"No.","Time","Source","Destination","Protocol","Length","Info"
"103","1.112166","100.86.243.187","64.233.180.190","TCP","1466","53804  >  443 [ACK] Seq=1 Ack=1 Win=32804 Len=1400 TSval=4060318398 TSecr=2767256742 [TCP PDU reassembled in 106]"
"104","1.112168","100.86.243.187","64.233.180.190","TCP","1466","53804  >  443 [ACK] Seq=1401 Ack=1 Win=32804 Len=1400 TSval=4060318398 TSecr=2767256742 [TCP PDU reassembled in 106]"
"105","1.112169","100.86.243.187","64.233.180.190","TCP","1466","53804  >  443 [ACK] Seq=2801 Ack=1 Win=32804 Len=1400 TSval=4060318398 TSecr=2767256742 [TCP PDU reassembled in 106]"
"106","1.112199","100.86.243.187","64.233.180.190","TLSv1.2","757","Application Data"
"107","1.112242","100.86.243.187","64.233.180.190","TCP","1466","53804  >  443 [ACK] Seq=4892 Ack=1 Win=32804 Len=1400 TSval=4060318398 TSecr=2767256742 [TCP PDU reassembled in 109]"
"108","1.112243","100.86.243.187","64.233.180.190","TCP","1466","53804  >  443 [ACK] Seq=6292 Ack=1 Win=32804 Len=1400 TSval=4060318398 TSecr=2767256742 [TCP PDU reassembled in 109]"
"109","1.112252","100.86.243.187","64.233.180.190","TLSv1.2","578","Application Data"
"110","1.123307","64.233.180.190","100.86.243.187","TCP","66","443  >  53804 [ACK] Seq=1 Ack=8204 Win=549 Len=0 TSval=2767257967 TSecr=4060318398"
"113","1.262924","64.233.180.190","100.86.243.187","TLSv1.2","142","Application Data"
"114","1.262924","64.233.180.190","100.86.243.187","TLSv1.2","97","Application Data"
"115","1.262925","64.233.180.190","100.86.243.187","TLSv1.2","105","Application Data"
"116","1.262925","64.233.180.190","100.86.243.187","TCP","105","[TCP Retransmission] 443  >  53804 [PSH, ACK] Seq=108 Ack=8204 Win=554 Len=39 TSval=2767258040 TSecr=4060318398"
"122","1.263124","100.86.243.187","64.233.180.190","TCP","66","53804  >  443 [ACK] Seq=8204 Ack=147 Win=32801 Len=0 TSval=4060318549 TSecr=2767258009"
"123","1.263134","100.86.243.187","64.233.180.190","TCP","78","[TCP Dup ACK 122#1] 53804  >  443 [ACK] Seq=8204 Ack=147 Win=32801 Len=0 TSval=4060318549 TSecr=2767258040 SLE=108 SRE=147"
"124","1.263561","100.86.243.187","64.233.180.190","TLSv1.2","105","Application Data"
"126","1.276348","64.233.180.190","100.86.243.187","TCP","66","443  >  53804 [ACK] Seq=147 Ack=8243 Win=554 Len=0 TSval=2767258119 TSecr=4060318549"
"135","1.788436","100.86.243.187","64.233.180.190","TCP","1466","53804  >  443 [ACK] Seq=8243 Ack=147 Win=32804 Len=1400 TSval=4060319074 TSecr=2767258119 [TCP PDU reassembled in 137]"
"136","1.788440","100.86.243.187","64.233.180.190","TCP","1466","53804  >  443 [ACK] Seq=9643 Ack=147 Win=32804 Len=1400 TSval=4060319074 TSecr=2767258119 [TCP PDU reassembled in 137]"
"137","1.788487","100.86.243.187","64.233.180.190","TLSv1.2","604","Application Data"
"138","1.799751","64.233.180.190","100.86.243.187","TCP","66","443  >  53804 [ACK] Seq=147 Ack=11581 Win=543 Len=0 TSval=2767258643 TSecr=4060319074"
"139","1.800691","64.233.180.190","100.86.243.187","TLSv1.2","144","Application Data"
"140","1.800776","100.86.243.187","64.233.180.190","TCP","66","53804  >  443 [ACK] Seq=11581 Ack=225 Win=32803 Len=0 TSval=4060319086 TSecr=2767258644"
"141","1.801066","100.86.243.187","64.233.180.190","TLSv1.2","105","Application Data"
"143","1.816996","64.233.180.190","100.86.243.187","TCP","66","443  >  53804 [ACK] Seq=225 Ack=11620 Win=554 Len=0 TSval=2767258661 TSecr=4060319087"
"145","2.073014","100.86.243.187","64.233.180.190","TCP","1466","53804  >  443 [ACK] Seq=11620 Ack=225 Win=32804 Len=1400 TSval=4060319359 TSecr=2767258661 [TCP PDU reassembled in 147]"
"146","2.073016","100.86.243.187","64.233.180.190","TCP","1466","53804  >  443 [ACK] Seq=13020 Ack=225 Win=32804 Len=1400 TSval=4060319359 TSecr=2767258661 [TCP PDU reassembled in 147]"
"147","2.073053","100.86.243.187","64.233.180.190","TLSv1.2","588","Application Data"
"148","2.073636","100.86.243.187","64.233.180.190","TCP","1466","53804  >  443 [ACK] Seq=14942 Ack=225 Win=32804 Len=1400 TSval=4060319359 TSecr=2767258661 [TCP PDU reassembled in 150]"
"149","2.073638","100.86.243.187","64.233.180.190","TCP","1466","53804  >  443 [ACK] Seq=16342 Ack=225 Win=32804 Len=1400 TSval=4060319359 TSecr=2767258661 [TCP PDU reassembled in 150]"
"150","2.073656","100.86.243.187","64.233.180.190","TLSv1.2","633","Application Data"
"151","2.074108","100.86.243.187","64.233.180.190","TCP","1466","53804  >  443 [ACK] Seq=18309 Ack=225 Win=32804 Len=1400 TSval=4060319360 TSecr=2767258661 [TCP PDU reassembled in 153]"
"152","2.074109","100.86.243.187","64.233.180.190","TCP","1466","53804  >  443 [ACK] Seq=19709 Ack=225 Win=32804 Len=1400 TSval=4060319360 TSecr=2767258661 [TCP PDU reassembled in 153]"
"153","2.074125","100.86.243.187","64.233.180.190","TLSv1.2","634","Application Data"
"154","2.074451","100.86.243.187","64.233.180.190","TCP","1466","53804  >  443 [ACK] Seq=21677 Ack=225 Win=32804 Len=1400 TSval=4060319360 TSecr=2767258661 [TCP PDU reassembled in 156]"
"155","2.074452","100.86.243.187","64.233.180.190","TCP","1466","53804  >  443 [ACK] Seq=23077 Ack=225 Win=32804 Len=1400 TSval=4060319360 TSecr=2767258661 [TCP PDU reassembled in 156]"
"156","2.074468","100.86.243.187","64.233.180.190","TLSv1.2","634","Application Data"
"157","2.074785","100.86.243.187","64.233.180.190","TCP","1466","53804  >  443 [ACK] Seq=25045 Ack=225 Win=32804 Len=1400 TSval=4060319360 TSecr=2767258661 [TCP PDU reassembled in 159]"
"158","2.074787","100.86.243.187","64.233.180.190","TCP","1466","53804  >  443 [ACK] Seq=26445 Ack=225 Win=32804 Len=1400 TSval=4060319360 TSecr=2767258661 [TCP PDU reassembled in 159]"
"159","2.074807","100.86.243.187","64.233.180.190","TLSv1.2","634","Application Data"
"160","2.075153","100.86.243.187","64.233.180.190","TCP","1466","53804  >  443 [ACK] Seq=28413 Ack=225 Win=32804 Len=1400 TSval=4060319361 TSecr=2767258661 [TCP PDU reassembled in 162]"
"161","2.075154","100.86.243.187","64.233.180.190","TCP","1466","53804  >  443 [ACK] Seq=29813 Ack=225 Win=32804 Len=1400 TSval=4060319361 TSecr=2767258661 [TCP PDU reassembled in 162]"
"162","2.075173","100.86.243.187","64.233.180.190","TLSv1.2","634","Application Data"
"163","2.075517","100.86.243.187","64.233.180.190","TCP","1466","53804  >  443 [ACK] Seq=31781 Ack=225 Win=32804 Len=1400 TSval=4060319361 TSecr=2767258661 [TCP PDU reassembled in 165]"
"164","2.075519","100.86.243.187","64.233.180.190","TCP","1466","53804  >  443 [ACK] Seq=33181 Ack=225 Win=32804 Len=1400 TSval=4060319361 TSecr=2767258661 [TCP PDU reassembled in 165]"
"165","2.075535","100.86.243.187","64.233.180.190","TLSv1.2","634","Application Data"
"166","2.075854","100.86.243.187","64.233.180.190","TCP","1466","53804  >  443 [ACK] Seq=35149 Ack=225 Win=32804 Len=1400 TSval=4060319361 TSecr=2767258661 [TCP PDU reassembled in 168]"
"167","2.075856","100.86.243.187","64.233.180.190","TCP","1466","53804  >  443 [ACK] Seq=36549 Ack=225 Win=32804 Len=1400 TSval=4060319361 TSecr=2767258661 [TCP PDU reassembled in 168]"
"168","2.075871","100.86.243.187","64.233.180.190","TLSv1.2","634","Application Data"
"169","2.076159","100.86.243.187","64.233.180.190","TCP","1466","53804  >  443 [ACK] Seq=38517 Ack=225 Win=32804 Len=1400 TSval=4060319362 TSecr=2767258661 [TCP PDU reassembled in 171]"
"170","2.076160","100.86.243.187","64.233.180.190","TCP","1466","53804  >  443 [ACK] Seq=39917 Ack=225 Win=32804 Len=1400 TSval=4060319362 TSecr=2767258661 [TCP PDU reassembled in 171]"
"171","2.076172","100.86.243.187","64.233.180.190","TLSv1.2","634","Application Data"
"172","2.076865","100.86.243.187","64.233.180.190","TCP","1466","53804  >  443 [ACK] Seq=41885 Ack=225 Win=32804 Len=1400 TSval=4060319362 TSecr=2767258661 [TCP PDU reassembled in 174]"
"173","2.076866","100.86.243.187","64.233.180.190","TCP","1466","53804  >  443 [ACK] Seq=43285 Ack=225 Win=32804 Len=1400 TSval=4060319362 TSecr=2767258661 [TCP PDU reassembled in 174]"
"174","2.076937","100.86.243.187","64.233.180.190","TLSv1.2","634","Application Data"
"175","2.077240","100.86.243.187","64.233.180.190","TCP","1466","53804  >  443 [ACK] Seq=45253 Ack=225 Win=32804 Len=1400 TSval=4060319363 TSecr=2767258661 [TCP PDU reassembled in 177]"
"176","2.077241","100.86.243.187","64.233.180.190","TCP","1466","53804  >  443 [ACK] Seq=46653 Ack=225 Win=32804 Len=1400 TSval=4060319363 TSecr=2767258661 [TCP PDU reassembled in 177]"
"177","2.077254","100.86.243.187","64.233.180.190","TLSv1.2","634","Application Data"
"178","2.077575","100.86.243.187","64.233.180.190","TCP","1466","53804  >  443 [ACK] Seq=48621 Ack=225 Win=32804 Len=1400 TSval=4060319363 TSecr=2767258661 [TCP PDU reassembled in 180]"
"179","2.077577","100.86.243.187","64.233.180.190","TCP","1466","53804  >  443 [ACK] Seq=50021 Ack=225 Win=32804 Len=1400 TSval=4060319363 TSecr=2767258661 [TCP PDU reassembled in 180]"
"180","2.077593","100.86.243.187","64.233.180.190","TLSv1.2","633","Application Data"
"181","2.077949","100.86.243.187","64.233.180.190","TCP","1466","53804  >  443 [ACK] Seq=51988 Ack=225 Win=32804 Len=1400 TSval=4060319363 TSecr=2767258661 [TCP PDU reassembled in 183]"
"182","2.077950","100.86.243.187","64.233.180.190","TCP","1466","53804  >  443 [ACK] Seq=53388 Ack=225 Win=32804 Len=1400 TSval=4060319363 TSecr=2767258661 [TCP PDU reassembled in 183]"
"183","2.077966","100.86.243.187","64.233.180.190","TLSv1.2","634","Application Data"
"184","2.078280","100.86.243.187","64.233.180.190","TCP","1466","53804  >  443 [ACK] Seq=55356 Ack=225 Win=32804 Len=1400 TSval=4060319364 TSecr=2767258661 [TCP PDU reassembled in 186]"
"185","2.078282","100.86.243.187","64.233.180.190","TCP","1466","53804  >  443 [ACK] Seq=56756 Ack=225 Win=32804 Len=1400 TSval=4060319364 TSecr=2767258661 [TCP PDU reassembled in 186]"
"186","2.078294","100.86.243.187","64.233.180.190","TLSv1.2","634","Application Data"
"187","2.078615","100.86.243.187","64.233.180.190","TCP","1466","53804  >  443 [ACK] Seq=58724 Ack=225 Win=32804 Len=1400 TSval=4060319364 TSecr=2767258661 [TCP PDU reassembled in 189]"
"188","2.078615","100.86.243.187","64.233.180.190","TCP","1466","53804  >  443 [ACK] Seq=60124 Ack=225 Win=32804 Len=1400 TSval=4060319364 TSecr=2767258661 [TCP PDU reassembled in 189]"
"189","2.078627","100.86.243.187","64.233.180.190","TLSv1.2","634","Application Data"
"190","2.078937","100.86.243.187","64.233.180.190","TCP","1466","53804  >  443 [ACK] Seq=62092 Ack=225 Win=32804 Len=1400 TSval=4060319364 TSecr=2767258661 [TCP PDU reassembled in 192]"
"191","2.078939","100.86.243.187","64.233.180.190","TCP","1466","53804  >  443 [ACK] Seq=63492 Ack=225 Win=32804 Len=1400 TSval=4060319364 TSecr=2767258661 [TCP PDU reassembled in 192]"
"192","2.078949","100.86.243.187","64.233.180.190","TLSv1.2","634","Application Data"
"193","2.079180","100.86.243.187","64.233.180.190","TCP","1466","53804  >  443 [ACK] Seq=65460 Ack=225 Win=32804 Len=1400 TSval=4060319364 TSecr=2767258661 [TCP PDU reassembled in 195]"
"194","2.079181","100.86.243.187","64.233.180.190","TCP","1466","53804  >  443 [ACK] Seq=66860 Ack=225 Win=32804 Len=1400 TSval=4060319364 TSecr=2767258661 [TCP PDU reassembled in 195]"
"195","2.079192","100.86.243.187","64.233.180.190","TLSv1.2","634","Application Data"
"196","2.079482","100.86.243.187","64.233.180.190","TCP","1466","53804  >  443 [ACK] Seq=68828 Ack=225 Win=32804 Len=1400 TSval=4060319365 TSecr=2767258661 [TCP PDU reassembled in 198]"
"197","2.079482","100.86.243.187","64.233.180.190","TCP","1466","53804  >  443 [ACK] Seq=70228 Ack=225 Win=32804 Len=1400 TSval=4060319365 TSecr=2767258661 [TCP PDU reassembled in 198]"
"198","2.079492","100.86.243.187","64.233.180.190","TLSv1.2","634","Application Data"
"199","2.079763","100.86.243.187","64.233.180.190","TCP","1466","53804  >  443 [ACK] Seq=72196 Ack=225 Win=32804 Len=1400 TSval=4060319365 TSecr=2767258661 [TCP PDU reassembled in 201]"
"200","2.079764","100.86.243.187","64.233.180.190","TCP","1466","53804  >  443 [ACK] Seq=73596 Ack=225 Win=32804 Len=1400 TSval=4060319365 TSecr=2767258661 [TCP PDU reassembled in 201]"
"201","2.079773","100.86.243.187","64.233.180.190","TLSv1.2","634","Application Data"
"202","2.080084","100.86.243.187","64.233.180.190","TCP","1466","53804  >  443 [ACK] Seq=75564 Ack=225 Win=32804 Len=1400 TSval=4060319365 TSecr=2767258661 [TCP PDU reassembled in 204]"
"203","2.080085","100.86.243.187","64.233.180.190","TCP","1466","53804  >  443 [ACK] Seq=76964 Ack=225 Win=32804 Len=1400 TSval=4060319365 TSecr=2767258661 [TCP PDU reassembled in 204]"
"204","2.080094","100.86.243.187","64.233.180.190","TLSv1.2","634","Application Data"
"205","2.081233","100.86.243.187","64.233.180.190","TLSv1.2","101","Application Data"
"206","2.081732","100.86.243.187","64.233.180.190","TLSv1.2","101","Application Data"
"207","2.082050","100.86.243.187","64.233.180.190","TLSv1.2","101","Application Data"
"208","2.082584","100.86.243.187","64.233.180.190","TLSv1.2","101","Application Data"
"209","2.082983","100.86.243.187","64.233.180.190","TLSv1.2","101","Application Data"
"210","2.083497","100.86.243.187","64.233.180.190","TLSv1.2","101","Application Data"
"211","2.083918","100.86.243.187","64.233.180.190","TLSv1.2","101","Application Data"
"212","2.084252","100.86.243.187","64.233.180.190","TLSv1.2","101","Application Data"
"213","2.084679","100.86.243.187","64.233.180.190","TLSv1.2","101","Application Data"
"214","2.084980","100.86.243.187","64.233.180.190","TLSv1.2","101","Application Data"
"215","2.085325","100.86.243.187","64.233.180.190","TLSv1.2","101","Application Data"
"216","2.085809","100.86.243.187","64.233.180.190","TLSv1.2","101","Application Data"
"217","2.086246","100.86.243.187","64.233.180.190","TLSv1.2","101","Application Data"
"218","2.086807","100.86.243.187","64.233.180.190","TLSv1.2","101","Application Data"
"219","2.087198","100.86.243.187","64.233.180.190","TLSv1.2","101","Application Data"
"220","2.087467","100.86.243.187","64.233.180.190","TLSv1.2","101","Application Data"
"221","2.087517","64.233.180.190","100.86.243.187","TCP","66","443  >  53804 [ACK] Seq=225 Ack=14420 Win=545 Len=0 TSval=2767258931 TSecr=4060319359"
"222","2.087517","64.233.180.190","100.86.243.187","TCP","66","443  >  53804 [ACK] Seq=225 Ack=14942 Win=543 Len=0 TSval=2767258931 TSecr=4060319359"
"223","2.087686","64.233.180.190","100.86.243.187","TCP","66","443  >  53804 [ACK] Seq=225 Ack=17742 Win=533 Len=0 TSval=2767258931 TSecr=4060319359"
"224","2.087686","64.233.180.190","100.86.243.187","TCP","66","443  >  53804 [ACK] Seq=225 Ack=24477 Win=509 Len=0 TSval=2767258931 TSecr=4060319360"
"225","2.087783","100.86.243.187","64.233.180.190","TLSv1.2","101","Application Data"
"226","2.088041","100.86.243.187","64.233.180.190","TLSv1.2","101","Application Data"
"227","2.088328","64.233.180.190","100.86.243.187","TCP","66","443  >  53804 [ACK] Seq=225 Ack=31781 Win=635 Len=0 TSval=2767258932 TSecr=4060319361"
"228","2.088329","64.233.180.190","100.86.243.187","TCP","66","443  >  53804 [ACK] Seq=225 Ack=36549 Win=618 Len=0 TSval=2767258932 TSecr=4060319361"
"229","2.088404","100.86.243.187","64.233.180.190","TLSv1.2","101","Application Data"
"230","2.089243","64.233.180.190","100.86.243.187","TCP","66","443  >  53804 [ACK] Seq=225 Ack=45253 Win=587 Len=0 TSval=2767258933 TSecr=4060319362"
"231","2.089244","64.233.180.190","100.86.243.187","TCP","66","443  >  53804 [ACK] Seq=225 Ack=48053 Win=577 Len=0 TSval=2767258933 TSecr=4060319363"
"232","2.089996","64.233.180.190","100.86.243.187","TCP","66","443  >  53804 [ACK] Seq=225 Ack=54788 Win=553 Len=0 TSval=2767258933 TSecr=4060319363"
"233","2.089996","64.233.180.190","100.86.243.187","TCP","66","443  >  53804 [ACK] Seq=225 Ack=58724 Win=539 Len=0 TSval=2767258934 TSecr=4060319364"
"234","2.092250","64.233.180.190","100.86.243.187","TLSv1.2","375","Application Data"
"235","2.092251","64.233.180.190","100.86.243.187","TLSv1.2","1466","Application Data"
"236","2.092251","64.233.180.190","100.86.243.187","TLSv1.2","1466","Application Data"
"237","2.092308","100.86.243.187","64.233.180.190","TCP","66","53804  >  443 [ACK] Seq=79597 Ack=3334 Win=32755 Len=0 TSval=4060319378 TSecr=2767258936"
"238","2.092479","100.86.243.187","64.233.180.190","TCP","66","[TCP Window Update] 53804  >  443 [ACK] Seq=79597 Ack=3334 Win=32804 Len=0 TSval=4060319378 TSecr=2767258936"
"239","2.092524","64.233.180.190","100.86.243.187","TLSv1.2","1466","Application Data"
"240","2.092524","64.233.180.190","100.86.243.187","TLSv1.2","1466","Application Data"
"241","2.092550","100.86.243.187","64.233.180.190","TCP","66","53804  >  443 [ACK] Seq=79597 Ack=6134 Win=32760 Len=0 TSval=4060319378 TSecr=2767258936"
"242","2.092595","100.86.243.187","64.233.180.190","TCP","66","[TCP Window Update] 53804  >  443 [ACK] Seq=79597 Ack=6134 Win=32804 Len=0 TSval=4060319378 TSecr=2767258936"
"243","2.093237","64.233.180.190","100.86.243.187","TLSv1.2","1466","Application Data"
"244","2.093238","64.233.180.190","100.86.243.187","TLSv1.2","1466","Application Data"
"245","2.093268","100.86.243.187","64.233.180.190","TCP","66","53804  >  443 [ACK] Seq=79597 Ack=8934 Win=32760 Len=0 TSval=4060319378 TSecr=2767258936"
"246","2.093317","100.86.243.187","64.233.180.190","TCP","66","[TCP Window Update] 53804  >  443 [ACK] Seq=79597 Ack=8934 Win=32804 Len=0 TSval=4060319379 TSecr=2767258936"
"247","2.094389","64.233.180.190","100.86.243.187","TLSv1.2","1466","Application Data"
"248","2.094390","64.233.180.190","100.86.243.187","TLSv1.2","1466","Application Data"
"249","2.094391","64.233.180.190","100.86.243.187","TLSv1.2","1466","Application Data"
"250","2.094391","64.233.180.190","100.86.243.187","TLSv1.2","1466","Application Data"
"251","2.094392","64.233.180.190","100.86.243.187","TLSv1.2","1466","Application Data"
"252","2.094392","64.233.180.190","100.86.243.187","TLSv1.2","1466","Application Data"
"253","2.094393","64.233.180.190","100.86.243.187","TLSv1.2","1466","Application Data"
"254","2.094393","64.233.180.190","100.86.243.187","TLSv1.2","1466","Application Data"
"255","2.094394","64.233.180.190","100.86.243.187","TLSv1.2","1466","Application Data"
"256","2.094395","64.233.180.190","100.86.243.187","TLSv1.2","1466","Application Data"
"257","2.094395","64.233.180.190","100.86.243.187","TLSv1.2","1466","Application Data"
"258","2.094395","64.233.180.190","100.86.243.187","TLSv1.2","1466","Application Data"
"259","2.094396","64.233.180.190","100.86.243.187","TLSv1.2","1466","Application Data"
"260","2.094397","64.233.180.190","100.86.243.187","TLSv1.2","1466","Application Data"
"261","2.094691","100.86.243.187","64.233.180.190","TCP","66","53804  >  443 [ACK] Seq=79597 Ack=28534 Win=32804 Len=0 TSval=4060319380 TSecr=2767258937"
"262","2.096632","64.233.180.190","100.86.243.187","TLSv1.2","1466","[TCP Previous segment not captured] , Application Data"
"263","2.096633","64.233.180.190","100.86.243.187","TLSv1.2","1466","Application Data"
"264","2.096633","64.233.180.190","100.86.243.187","TLSv1.2","1180","Application Data"
"265","2.096634","64.233.180.190","100.86.243.187","TCP","66","443  >  53804 [ACK] Seq=32734 Ack=78364 Win=469 Len=0 TSval=2767258937 TSecr=4060319365"
"266","2.096634","64.233.180.190","100.86.243.187","TLSv1.2","1466","Application Data"
"267","2.096634","64.233.180.190","100.86.243.187","TLSv1.2","1466","Application Data"
"268","2.096635","64.233.180.190","100.86.243.187","TLSv1.2","1466","Application Data"
"269","2.096636","64.233.180.190","100.86.243.187","TLSv1.2","1466","Application Data"
"270","2.096636","64.233.180.190","100.86.243.187","TLSv1.2","1466","Application Data"
"271","2.096637","64.233.180.190","100.86.243.187","TLSv1.2","1466","Application Data"
"272","2.096638","64.233.180.190","100.86.243.187","TLSv1.2","1466","Application Data"
"273","2.096638","64.233.180.190","100.86.243.187","TLSv1.2","1466","Application Data"
"274","2.096639","64.233.180.190","100.86.243.187","TLSv1.2","1466","Application Data"
"275","2.096639","64.233.180.190","100.86.243.187","TLSv1.2","1466","Application Data"
"276","2.096640","64.233.180.190","100.86.243.187","TLSv1.2","1466","Application Data"
"277","2.096640","64.233.180.190","100.86.243.187","TLSv1.2","1466","Application Data"
"278","2.096640","64.233.180.190","100.86.243.187","TLSv1.2","1466","Application Data"
"279","2.096641","64.233.180.190","100.86.243.187","TLSv1.2","1466","Application Data"
"280","2.096642","64.233.180.190","100.86.243.187","TLSv1.2","1466","Application Data"
"281","2.096643","64.233.180.190","100.86.243.187","TLSv1.2","1466","Application Data"
"282","2.096643","64.233.180.190","100.86.243.187","TLSv1.2","1466","Application Data"
"283","2.096644","64.233.180.190","100.86.243.187","TLSv1.2","938","Application Data, Application Data"
"284","2.096689","100.86.243.187","64.233.180.190","TCP","78","[TCP Dup ACK 261#1] 53804  >  443 [ACK] Seq=79597 Ack=28534 Win=32804 Len=0 TSval=4060319382 TSecr=2767258937 SLE=29934 SRE=32734"
"285","2.096712","100.86.243.187","64.233.180.190","TCP","78","[TCP Dup ACK 261#2] 53804  >  443 [ACK] Seq=79597 Ack=28534 Win=32804 Len=0 TSval=4060319382 TSecr=2767258937 SLE=29934 SRE=33848"
"286","2.096721","100.86.243.187","64.233.180.190","TCP","78","[TCP Dup ACK 261#3] 53804  >  443 [ACK] Seq=79597 Ack=28534 Win=32804 Len=0 TSval=4060319382 TSecr=2767258937 SLE=29934 SRE=46448"
"287","2.096730","100.86.243.187","64.233.180.190","TCP","78","[TCP Dup ACK 261#4] 53804  >  443 [ACK] Seq=79597 Ack=28534 Win=32804 Len=0 TSval=4060319382 TSecr=2767258937 SLE=29934 SRE=58520"
"288","2.097949","64.233.180.190","100.86.243.187","TLSv1.2","1466","Application Data"
"289","2.097950","64.233.180.190","100.86.243.187","TLSv1.2","1466","Application Data"
"290","2.097951","64.233.180.190","100.86.243.187","TLSv1.2","1466","Application Data"
"291","2.097951","64.233.180.190","100.86.243.187","TLSv1.2","1466","Application Data"
"292","2.097952","64.233.180.190","100.86.243.187","TLSv1.2","1466","Application Data"
"293","2.097952","64.233.180.190","100.86.243.187","TLSv1.2","1466","Application Data"
"294","2.097953","64.233.180.190","100.86.243.187","TLSv1.2","1466","Application Data"
"295","2.097953","64.233.180.190","100.86.243.187","TLSv1.2","1466","Application Data"
"296","2.097954","64.233.180.190","100.86.243.187","TLSv1.2","1466","Application Data"
"297","2.097954","64.233.180.190","100.86.243.187","TLSv1.2","1466","Application Data"
"298","2.097955","64.233.180.190","100.86.243.187","TLSv1.2","1466","Application Data"
"299","2.097957","64.233.180.190","100.86.243.187","TLSv1.2","197","Application Data"
"300","2.097957","64.233.180.190","100.86.243.187","TLSv1.2","1466","Application Data"
"301","2.097958","64.233.180.190","100.86.243.187","TLSv1.2","1466","Application Data"
"302","2.097958","64.233.180.190","100.86.243.187","TLSv1.2","1466","Application Data"
"303","2.097959","64.233.180.190","100.86.243.187","TLSv1.2","1466","Application Data"
"304","2.097959","64.233.180.190","100.86.243.187","TLSv1.2","1466","Application Data"
"305","2.097960","64.233.180.190","100.86.243.187","TLSv1.2","1466","Application Data"
"306","2.097960","64.233.180.190","100.86.243.187","TLSv1.2","1466","Application Data"
"307","2.097961","64.233.180.190","100.86.243.187","TLSv1.2","1466","Application Data"
"308","2.098010","100.86.243.187","64.233.180.190","TCP","78","[TCP Dup ACK 261#5] 53804  >  443 [ACK] Seq=79597 Ack=28534 Win=32804 Len=0 TSval=4060319384 TSecr=2767258937 SLE=29934 SRE=74051"
"309","2.098032","100.86.243.187","64.233.180.190","TCP","78","[TCP Dup ACK 261#6] 53804  >  443 [ACK] Seq=79597 Ack=28534 Win=32804 Len=0 TSval=4060319384 TSecr=2767258937 SLE=29934 SRE=85251"
"310","2.099096","64.233.180.190","100.86.243.187","TLSv1.2","1466","Application Data"
"311","2.099096","64.233.180.190","100.86.243.187","TLSv1.2","1466","Application Data"
"312","2.099097","64.233.180.190","100.86.243.187","TLSv1.2","1466","Application Data"
"313","2.099098","64.233.180.190","100.86.243.187","TLSv1.2","1466","Application Data"
"314","2.099098","64.233.180.190","100.86.243.187","TLSv1.2","1466","Application Data"
"315","2.099099","64.233.180.190","100.86.243.187","TLSv1.2","1466","Application Data"
"316","2.099099","64.233.180.190","100.86.243.187","TLSv1.2","1466","Application Data"
"317","2.099100","64.233.180.190","100.86.243.187","TLSv1.2","1466","Application Data"
"318","2.099100","64.233.180.190","100.86.243.187","TLSv1.2","1466","Application Data"
"319","2.099101","64.233.180.190","100.86.243.187","TLSv1.2","1466","Application Data"
"320","2.099101","64.233.180.190","100.86.243.187","TLSv1.2","1466","Application Data"
"321","2.099102","64.233.180.190","100.86.243.187","TLSv1.2","1466","Application Data"
"322","2.099102","64.233.180.190","100.86.243.187","TLSv1.2","1466","Application Data"
"323","2.099103","64.233.180.190","100.86.243.187","TLSv1.2","1466","Application Data"
"324","2.099104","64.233.180.190","100.86.243.187","TLSv1.2","1466","Application Data"
"325","2.099104","64.233.180.190","100.86.243.187","TLSv1.2","1466","Application Data"
"326","2.099150","100.86.243.187","64.233.180.190","TCP","78","[TCP Dup ACK 261#7] 53804  >  443 [ACK] Seq=79597 Ack=28534 Win=32804 Len=0 TSval=4060319385 TSecr=2767258937 SLE=29934 SRE=100651"
"327","2.099168","100.86.243.187","64.233.180.190","TCP","78","[TCP Dup ACK 261#8] 53804  >  443 [ACK] Seq=79597 Ack=28534 Win=32804 Len=0 TSval=4060319385 TSecr=2767258937 SLE=29934 SRE=107651"
"328","2.099213","64.233.180.190","100.86.243.187","TLSv1.2","1466","Application Data"
"329","2.099213","64.233.180.190","100.86.243.187","TCP","1466","[TCP Previous segment not captured] 443  >  53804 [ACK] Seq=111851 Ack=79212 Win=467 Len=1400 TSval=2767258941 TSecr=4060319370"
"330","2.099241","100.86.243.187","64.233.180.190","TCP","78","[TCP Dup ACK 261#9] 53804  >  443 [ACK] Seq=79597 Ack=28534 Win=32804 Len=0 TSval=4060319385 TSecr=2767258937 SLE=29934 SRE=109051"
"331","2.099258","100.86.243.187","64.233.180.190","TCP","86","[TCP Dup ACK 261#10] 53804  >  443 [ACK] Seq=79597 Ack=28534 Win=32804 Len=0 TSval=4060319385 TSecr=2767258937 SLE=111851 SRE=113251 SLE=29934 SRE=109051"
"332","2.099542","64.233.180.190","100.86.243.187","TLSv1.2","1466","Ignored Unknown Record"
"333","2.099542","64.233.180.190","100.86.243.187","TLSv1.2","1466","Ignored Unknown Record"
"334","2.099542","64.233.180.190","100.86.243.187","TLSv1.2","1466","Ignored Unknown Record"
"335","2.099543","64.233.180.190","100.86.243.187","TLSv1.2","1466","Ignored Unknown Record"
"336","2.099573","100.86.243.187","64.233.180.190","TCP","86","[TCP Dup ACK 261#11] 53804  >  443 [ACK] Seq=79597 Ack=28534 Win=32804 Len=0 TSval=4060319385 TSecr=2767258937 SLE=111851 SRE=118851 SLE=29934 SRE=109051"
"337","2.101049","64.233.180.190","100.86.243.187","TLSv1.2","1466","Ignored Unknown Record"
"338","2.101049","64.233.180.190","100.86.243.187","TLSv1.2","1466","Ignored Unknown Record"
"339","2.101050","64.233.180.190","100.86.243.187","TLSv1.2","1466","Ignored Unknown Record"
"340","2.101050","64.233.180.190","100.86.243.187","TLSv1.2","1466","Ignored Unknown Record"
"341","2.101051","64.233.180.190","100.86.243.187","TLSv1.2","1466","Ignored Unknown Record"
"342","2.101051","64.233.180.190","100.86.243.187","TLSv1.2","1466","Ignored Unknown Record"
"343","2.101052","64.233.180.190","100.86.243.187","TLSv1.2","1466","Ignored Unknown Record"
"344","2.101052","64.233.180.190","100.86.243.187","TLSv1.2","1466","Ignored Unknown Record"
"345","2.101053","64.233.180.190","100.86.243.187","TLSv1.2","1466","Ignored Unknown Record"
"346","2.101053","64.233.180.190","100.86.243.187","TLSv1.2","1466","Ignored Unknown Record"
"347","2.101054","64.233.180.190","100.86.243.187","TCP","1466","443  >  53804 [ACK] Seq=132851 Ack=79352 Win=467 Len=1400 TSval=2767258942 TSecr=4060319370"
"348","2.101054","64.233.180.190","100.86.243.187","TLSv1.2","1466","Ignored Unknown Record"
"349","2.101055","64.233.180.190","100.86.243.187","TLSv1.2","1466","Ignored Unknown Record"
"350","2.101056","64.233.180.190","100.86.243.187","TLSv1.2","1466","Ignored Unknown Record"
"351","2.101056","64.233.180.190","100.86.243.187","TLSv1.2","1466","Ignored Unknown Record"
"352","2.101056","64.233.180.190","100.86.243.187","TLSv1.2","1466","Ignored Unknown Record"
"353","2.101057","64.233.180.190","100.86.243.187","TLSv1.2","1466","Ignored Unknown Record"
"354","2.101057","64.233.180.190","100.86.243.187","TLSv1.2","1466","Ignored Unknown Record"
"355","2.101113","100.86.243.187","64.233.180.190","TCP","86","[TCP Dup ACK 261#12] 53804  >  443 [ACK] Seq=79597 Ack=28534 Win=32804 Len=0 TSval=4060319387 TSecr=2767258937 SLE=111851 SRE=128651 SLE=29934 SRE=109051"
"356","2.101137","100.86.243.187","64.233.180.190","TCP","86","[TCP Dup ACK 261#13] 53804  >  443 [ACK] Seq=79597 Ack=28534 Win=32804 Len=0 TSval=4060319387 TSecr=2767258937 SLE=111851 SRE=144051 SLE=29934 SRE=109051"
"357","2.101158","64.233.180.190","100.86.243.187","TLSv1.2","1466","Ignored Unknown Record"
"358","2.101158","64.233.180.190","100.86.243.187","TLSv1.2","1466","Ignored Unknown Record"
"359","2.101190","100.86.243.187","64.233.180.190","TCP","86","[TCP Dup ACK 261#14] 53804  >  443 [ACK] Seq=79597 Ack=28534 Win=32804 Len=0 TSval=4060319387 TSecr=2767258937 SLE=111851 SRE=146851 SLE=29934 SRE=109051"
"360","2.101489","64.233.180.190","100.86.243.187","TLSv1.2","1466","Ignored Unknown Record"
"361","2.101490","64.233.180.190","100.86.243.187","TLSv1.2","1466","Ignored Unknown Record"
"362","2.101490","64.233.180.190","100.86.243.187","TLSv1.2","1466","Ignored Unknown Record"
"363","2.101491","64.233.180.190","100.86.243.187","TLSv1.2","1466","Ignored Unknown Record"
"364","2.101521","100.86.243.187","64.233.180.190","TCP","86","[TCP Dup ACK 261#15] 53804  >  443 [ACK] Seq=79597 Ack=28534 Win=32804 Len=0 TSval=4060319387 TSecr=2767258937 SLE=111851 SRE=152451 SLE=29934 SRE=109051"
"365","2.103309","64.233.180.190","100.86.243.187","TLSv1.2","1466","Ignored Unknown Record"
"366","2.103309","64.233.180.190","100.86.243.187","TCP","1466","443  >  53804 [ACK] Seq=153851 Ack=79352 Win=467 Len=1400 TSval=2767258943 TSecr=4060319370"
"367","2.103310","64.233.180.190","100.86.243.187","TLSv1.2","1466","Ignored Unknown Record"
"368","2.103310","64.233.180.190","100.86.243.187","TLSv1.2","1466","Ignored Unknown Record"
"369","2.103311","64.233.180.190","100.86.243.187","TLSv1.2","1466","Ignored Unknown Record"
"370","2.103311","64.233.180.190","100.86.243.187","TLSv1.2","1466","Ignored Unknown Record"
"371","2.103312","64.233.180.190","100.86.243.187","TLSv1.2","1466","Ignored Unknown Record"
"372","2.103312","64.233.180.190","100.86.243.187","TLSv1.2","1466","Ignored Unknown Record"
"373","2.103313","64.233.180.190","100.86.243.187","TLSv1.2","1466","Ignored Unknown Record"
"374","2.103314","64.233.180.190","100.86.243.187","TLSv1.2","1466","Ignored Unknown Record"
"375","2.103314","64.233.180.190","100.86.243.187","TCP","1466","443  >  53804 [ACK] Seq=166451 Ack=79562 Win=467 Len=1400 TSval=2767258944 TSecr=4060319372 [TCP PDU reassembled in 377]"
"376","2.103315","64.233.180.190","100.86.243.187","TCP","1466","443  >  53804 [ACK] Seq=167851 Ack=79562 Win=467 Len=1400 TSval=2767258944 TSecr=4060319372 [TCP PDU reassembled in 377]"
"377","2.103315","64.233.180.190","100.86.243.187","TLSv1.2","1466","Ignored Unknown Record"
"378","2.103316","64.233.180.190","100.86.243.187","TLSv1.2","1466","Ignored Unknown Record"
"379","2.103316","64.233.180.190","100.86.243.187","TLSv1.2","1466","Ignored Unknown Record"
"380","2.103317","64.233.180.190","100.86.243.187","TLSv1.2","1466","Ignored Unknown Record"
"381","2.103318","64.233.180.190","100.86.243.187","TLSv1.2","1466","Ignored Unknown Record"
"382","2.103318","64.233.180.190","100.86.243.187","TLSv1.2","1466","Ignored Unknown Record"
"383","2.103354","100.86.243.187","64.233.180.190","TCP","86","[TCP Dup ACK 261#16] 53804  >  443 [ACK] Seq=79597 Ack=28534 Win=32804 Len=0 TSval=4060319389 TSecr=2767258937 SLE=111851 SRE=165051 SLE=29934 SRE=109051"
"384","2.103372","100.86.243.187","64.233.180.190","TCP","86","[TCP Dup ACK 261#17] 53804  >  443 [ACK] Seq=79597 Ack=28534 Win=32804 Len=0 TSval=4060319389 TSecr=2767258937 SLE=111851 SRE=177651 SLE=29934 SRE=109051"
"385","2.103574","64.233.180.190","100.86.243.187","TLSv1.2","1466","Ignored Unknown Record"
"386","2.103575","64.233.180.190","100.86.243.187","TCP","1466","443  >  53804 [ACK] Seq=179051 Ack=79562 Win=467 Len=1400 TSval=2767258944 TSecr=4060319372"
"387","2.103575","64.233.180.190","100.86.243.187","TLSv1.2","1466","Ignored Unknown Record"
"388","2.103576","64.233.180.190","100.86.243.187","TLSv1.2","1466","Ignored Unknown Record"
"389","2.103618","100.86.243.187","64.233.180.190","TCP","86","[TCP Dup ACK 261#18] 53804  >  443 [ACK] Seq=79597 Ack=28534 Win=32804 Len=0 TSval=4060319389 TSecr=2767258937 SLE=111851 SRE=183251 SLE=29934 SRE=109051"
"390","2.103897","64.233.180.190","100.86.243.187","TLSv1.2","1466","Ignored Unknown Record"
"391","2.103898","64.233.180.190","100.86.243.187","TLSv1.2","1466","Ignored Unknown Record"
"392","2.103910","64.233.180.190","100.86.243.187","TLSv1.2","1466","Ignored Unknown Record"
"393","2.103911","64.233.180.190","100.86.243.187","TLSv1.2","1466","Ignored Unknown Record"
"394","2.103939","100.86.243.187","64.233.180.190","TCP","86","[TCP Dup ACK 261#19] 53804  >  443 [ACK] Seq=79597 Ack=28534 Win=32804 Len=0 TSval=4060319389 TSecr=2767258937 SLE=111851 SRE=186051 SLE=29934 SRE=109051"
"395","2.103964","100.86.243.187","64.233.180.190","TCP","86","[TCP Dup ACK 261#20] 53804  >  443 [ACK] Seq=79597 Ack=28534 Win=32804 Len=0 TSval=4060319389 TSecr=2767258937 SLE=111851 SRE=188851 SLE=29934 SRE=109051"
"396","2.104040","64.233.180.190","100.86.243.187","TLSv1.2","1466","Ignored Unknown Record"
"397","2.104041","64.233.180.190","100.86.243.187","TLSv1.2","1466","Ignored Unknown Record"
"398","2.104067","100.86.243.187","64.233.180.190","TCP","86","[TCP Dup ACK 261#21] 53804  >  443 [ACK] Seq=79597 Ack=28534 Win=32804 Len=0 TSval=4060319389 TSecr=2767258937 SLE=111851 SRE=191651 SLE=29934 SRE=109051"
"399","2.105550","64.233.180.190","100.86.243.187","TLSv1.2","1466","Ignored Unknown Record"
"400","2.105551","64.233.180.190","100.86.243.187","TLSv1.2","1466","Ignored Unknown Record"
"401","2.105551","64.233.180.190","100.86.243.187","TLSv1.2","1466","Ignored Unknown Record"
"402","2.105552","64.233.180.190","100.86.243.187","TLSv1.2","1466","[TCP Previous segment not captured] , Ignored Unknown Record"
"403","2.105553","64.233.180.190","100.86.243.187","TLSv1.2","1466","Ignored Unknown Record"
"404","2.105553","64.233.180.190","100.86.243.187","TLSv1.2","1466","Ignored Unknown Record"
"405","2.105553","64.233.180.190","100.86.243.187","TLSv1.2","1466","Ignored Unknown Record"
"406","2.105554","64.233.180.190","100.86.243.187","TLSv1.2","1466","Ignored Unknown Record"
"407","2.105555","64.233.180.190","100.86.243.187","TLSv1.2","1466","Ignored Unknown Record"
"408","2.105555","64.233.180.190","100.86.243.187","TLSv1.2","1466","Ignored Unknown Record"
"409","2.105556","64.233.180.190","100.86.243.187","TLSv1.2","1466","Ignored Unknown Record"
"410","2.105556","64.233.180.190","100.86.243.187","TLSv1.2","1466","Ignored Unknown Record"
"411","2.105557","64.233.180.190","100.86.243.187","TLSv1.2","1466","Ignored Unknown Record"
"412","2.105557","64.233.180.190","100.86.243.187","TLSv1.2","1466","Ignored Unknown Record"
"413","2.105558","64.233.180.190","100.86.243.187","TLSv1.2","1466","Ignored Unknown Record"
"414","2.105558","64.233.180.190","100.86.243.187","TLSv1.2","1466","Ignored Unknown Record"
"415","2.105559","64.233.180.190","100.86.243.187","TLSv1.2","1466","Ignored Unknown Record"
"416","2.105559","64.233.180.190","100.86.243.187","TLSv1.2","1466","Ignored Unknown Record"
"417","2.105560","64.233.180.190","100.86.243.187","TLSv1.2","1466","Ignored Unknown Record"
"418","2.105560","64.233.180.190","100.86.243.187","TLSv1.2","1466","Ignored Unknown Record"
"419","2.105642","100.86.243.187","64.233.180.190","TCP","86","[TCP Dup ACK 261#22] 53804  >  443 [ACK] Seq=79597 Ack=28534 Win=32804 Len=0 TSval=4060319391 TSecr=2767258937 SLE=111851 SRE=195851 SLE=29934 SRE=109051"
"420","2.105662","100.86.243.187","64.233.180.190","TCP","94","[TCP Dup ACK 261#23] 53804  >  443 [ACK] Seq=79597 Ack=28534 Win=32804 Len=0 TSval=4060319391 TSecr=2767258937 SLE=197251 SRE=201451 SLE=111851 SRE=195851 SLE=29934 SRE=109051"
"421","2.105675","100.86.243.187","64.233.180.190","TCP","94","[TCP Dup ACK 261#24] 53804  >  443 [ACK] Seq=79597 Ack=28534 Win=32804 Len=0 TSval=4060319391 TSecr=2767258937 SLE=197251 SRE=216851 SLE=111851 SRE=195851 SLE=29934 SRE=109051"
"422","2.105684","100.86.243.187","64.233.180.190","TCP","94","[TCP Dup ACK 261#25] 53804  >  443 [ACK] Seq=79597 Ack=28534 Win=32804 Len=0 TSval=4060319391 TSecr=2767258937 SLE=197251 SRE=219651 SLE=111851 SRE=195851 SLE=29934 SRE=109051"
"423","2.105693","100.86.243.187","64.233.180.190","TCP","94","[TCP Dup ACK 261#26] 53804  >  443 [ACK] Seq=79597 Ack=28534 Win=32804 Len=0 TSval=4060319391 TSecr=2767258937 SLE=197251 SRE=221051 SLE=111851 SRE=195851 SLE=29934 SRE=109051"
"424","2.105714","64.233.180.190","100.86.243.187","TLSv1.2","1466","Ignored Unknown Record"
"425","2.105715","64.233.180.190","100.86.243.187","TLSv1.2","1466","Ignored Unknown Record"
"426","2.105736","100.86.243.187","64.233.180.190","TCP","94","[TCP Dup ACK 261#27] 53804  >  443 [ACK] Seq=79597 Ack=28534 Win=32804 Len=0 TSval=4060319391 TSecr=2767258937 SLE=197251 SRE=223851 SLE=111851 SRE=195851 SLE=29934 SRE=109051"
"427","2.106105","64.233.180.190","100.86.243.187","TLSv1.2","1466","Ignored Unknown Record"
"428","2.106106","64.233.180.190","100.86.243.187","TLSv1.2","1466","[TCP Previous segment not captured] , Ignored Unknown Record"
"429","2.106107","64.233.180.190","100.86.243.187","TLSv1.2","1466","Ignored Unknown Record"
"430","2.106108","64.233.180.190","100.86.243.187","TLSv1.2","1466","Ignored Unknown Record"
"431","2.106162","100.86.243.187","64.233.180.190","TCP","94","[TCP Dup ACK 261#28] 53804  >  443 [ACK] Seq=79597 Ack=28534 Win=32804 Len=0 TSval=4060319391 TSecr=2767258937 SLE=197251 SRE=225251 SLE=111851 SRE=195851 SLE=29934 SRE=109051"
"432","2.106189","100.86.243.187","64.233.180.190","TCP","94","[TCP Dup ACK 261#29] 53804  >  443 [ACK] Seq=79597 Ack=28534 Win=32804 Len=0 TSval=4060319391 TSecr=2767258937 SLE=226651 SRE=230851 SLE=197251 SRE=225251 SLE=111851 SRE=195851"
"433","2.107525","64.233.180.190","100.86.243.187","TCP","1466","443  >  53804 [ACK] Seq=230851 Ack=79597 Win=662 Len=1400 TSval=2767258947 TSecr=4060319373 [TCP PDU reassembled in 466]"
"434","2.107526","64.233.180.190","100.86.243.187","TCP","1466","443  >  53804 [ACK] Seq=232251 Ack=79597 Win=662 Len=1400 TSval=2767258947 TSecr=4060319373 [TCP PDU reassembled in 466]"
"435","2.107526","64.233.180.190","100.86.243.187","TCP","1466","443  >  53804 [ACK] Seq=233651 Ack=79597 Win=662 Len=1400 TSval=2767258947 TSecr=4060319373 [TCP PDU reassembled in 466]"
"436","2.107527","64.233.180.190","100.86.243.187","TCP","1466","443  >  53804 [ACK] Seq=235051 Ack=79597 Win=662 Len=1400 TSval=2767258947 TSecr=4060319373 [TCP PDU reassembled in 466]"
"437","2.107527","64.233.180.190","100.86.243.187","TCP","1466","443  >  53804 [PSH, ACK] Seq=236451 Ack=79597 Win=662 Len=1400 TSval=2767258947 TSecr=4060319373 [TCP PDU reassembled in 466]"
"438","2.107528","64.233.180.190","100.86.243.187","TCP","1466","443  >  53804 [ACK] Seq=237851 Ack=79597 Win=662 Len=1400 TSval=2767258948 TSecr=4060319373 [TCP PDU reassembled in 466]"
"439","2.107529","64.233.180.190","100.86.243.187","TCP","1466","443  >  53804 [ACK] Seq=239251 Ack=79597 Win=662 Len=1400 TSval=2767258948 TSecr=4060319373 [TCP PDU reassembled in 466]"
"440","2.107529","64.233.180.190","100.86.243.187","TCP","1466","443  >  53804 [ACK] Seq=240651 Ack=79597 Win=662 Len=1400 TSval=2767258948 TSecr=4060319373 [TCP PDU reassembled in 466]"
"441","2.107530","64.233.180.190","100.86.243.187","TCP","1466","443  >  53804 [ACK] Seq=242051 Ack=79597 Win=662 Len=1400 TSval=2767258948 TSecr=4060319373 [TCP PDU reassembled in 466]"
"442","2.107530","64.233.180.190","100.86.243.187","TCP","1466","443  >  53804 [ACK] Seq=243451 Ack=79597 Win=662 Len=1400 TSval=2767258948 TSecr=4060319373 [TCP PDU reassembled in 466]"
"443","2.107531","64.233.180.190","100.86.243.187","TCP","1466","443  >  53804 [ACK] Seq=244851 Ack=79597 Win=662 Len=1400 TSval=2767258948 TSecr=4060319373 [TCP PDU reassembled in 466]"
"444","2.107531","64.233.180.190","100.86.243.187","TCP","1466","443  >  53804 [ACK] Seq=246251 Ack=79597 Win=662 Len=1400 TSval=2767258948 TSecr=4060319373 [TCP PDU reassembled in 466]"
"445","2.107532","64.233.180.190","100.86.243.187","TCP","1466","443  >  53804 [ACK] Seq=247651 Ack=79597 Win=662 Len=1400 TSval=2767258948 TSecr=4060319373 [TCP PDU reassembled in 466]"
"446","2.107532","64.233.180.190","100.86.243.187","TCP","1466","443  >  53804 [ACK] Seq=249051 Ack=79597 Win=662 Len=1400 TSval=2767258948 TSecr=4060319373 [TCP PDU reassembled in 466]"
"447","2.107533","64.233.180.190","100.86.243.187","TCP","1466","443  >  53804 [ACK] Seq=250451 Ack=79597 Win=662 Len=1400 TSval=2767258948 TSecr=4060319373 [TCP PDU reassembled in 466]"
"448","2.107533","64.233.180.190","100.86.243.187","TCP","1466","443  >  53804 [ACK] Seq=251851 Ack=79597 Win=662 Len=1400 TSval=2767258948 TSecr=4060319373 [TCP PDU reassembled in 466]"
"449","2.107598","100.86.243.187","64.233.180.190","TCP","94","[TCP Dup ACK 261#30] 53804  >  443 [ACK] Seq=79597 Ack=28534 Win=32804 Len=0 TSval=4060319393 TSecr=2767258937 SLE=226651 SRE=246251 SLE=197251 SRE=225251 SLE=111851 SRE=195851"
"450","2.107620","100.86.243.187","64.233.180.190","TCP","94","[TCP Dup ACK 261#31] 53804  >  443 [ACK] Seq=79597 Ack=28534 Win=32804 Len=0 TSval=4060319393 TSecr=2767258937 SLE=226651 SRE=253251 SLE=197251 SRE=225251 SLE=111851 SRE=195851"
"451","2.108354","64.233.180.190","100.86.243.187","TCP","1466","443  >  53804 [ACK] Seq=253251 Ack=79597 Win=662 Len=1400 TSval=2767258948 TSecr=4060319373 [TCP PDU reassembled in 466]"
"452","2.108354","64.233.180.190","100.86.243.187","TCP","1466","443  >  53804 [PSH, ACK] Seq=254651 Ack=79597 Win=662 Len=1400 TSval=2767258948 TSecr=4060319373 [TCP PDU reassembled in 466]"
"453","2.108401","100.86.243.187","64.233.180.190","TCP","94","[TCP Dup ACK 261#32] 53804  >  443 [ACK] Seq=79597 Ack=28534 Win=32804 Len=0 TSval=4060319393 TSecr=2767258937 SLE=226651 SRE=256051 SLE=197251 SRE=225251 SLE=111851 SRE=195851"
"454","2.109599","64.233.180.190","100.86.243.187","TCP","1466","443  >  53804 [ACK] Seq=256051 Ack=79597 Win=662 Len=1400 TSval=2767258949 TSecr=4060319373 [TCP PDU reassembled in 466]"
"455","2.109600","64.233.180.190","100.86.243.187","TCP","1466","443  >  53804 [ACK] Seq=257451 Ack=79597 Win=662 Len=1400 TSval=2767258949 TSecr=4060319373 [TCP PDU reassembled in 466]"
"456","2.109600","64.233.180.190","100.86.243.187","TCP","1466","443  >  53804 [ACK] Seq=258851 Ack=79597 Win=662 Len=1400 TSval=2767258949 TSecr=4060319373 [TCP PDU reassembled in 466]"
"457","2.109601","64.233.180.190","100.86.243.187","TCP","1466","443  >  53804 [ACK] Seq=260251 Ack=79597 Win=662 Len=1400 TSval=2767258949 TSecr=4060319373 [TCP PDU reassembled in 466]"
"458","2.109602","64.233.180.190","100.86.243.187","TCP","1466","443  >  53804 [ACK] Seq=261651 Ack=79597 Win=662 Len=1400 TSval=2767258949 TSecr=4060319373 [TCP PDU reassembled in 466]"
"459","2.109602","64.233.180.190","100.86.243.187","TCP","1466","443  >  53804 [ACK] Seq=263051 Ack=79597 Win=662 Len=1400 TSval=2767258949 TSecr=4060319373 [TCP PDU reassembled in 466]"
"460","2.109603","64.233.180.190","100.86.243.187","TCP","1466","443  >  53804 [ACK] Seq=264451 Ack=79597 Win=662 Len=1400 TSval=2767258949 TSecr=4060319373 [TCP PDU reassembled in 466]"
"461","2.109603","64.233.180.190","100.86.243.187","TCP","1466","443  >  53804 [ACK] Seq=265851 Ack=79597 Win=662 Len=1400 TSval=2767258949 TSecr=4060319373 [TCP PDU reassembled in 466]"
"462","2.109604","64.233.180.190","100.86.243.187","TCP","1466","443  >  53804 [ACK] Seq=267251 Ack=79597 Win=662 Len=1400 TSval=2767258949 TSecr=4060319373 [TCP PDU reassembled in 466]"
"463","2.109604","64.233.180.190","100.86.243.187","TCP","1466","443  >  53804 [ACK] Seq=268651 Ack=79597 Win=662 Len=1400 TSval=2767258949 TSecr=4060319373 [TCP PDU reassembled in 466]"
"464","2.109605","64.233.180.190","100.86.243.187","TCP","1466","443  >  53804 [ACK] Seq=270051 Ack=79597 Win=662 Len=1400 TSval=2767258949 TSecr=4060319373 [TCP PDU reassembled in 466]"
"465","2.109605","64.233.180.190","100.86.243.187","TCP","1466","443  >  53804 [ACK] Seq=271451 Ack=79597 Win=662 Len=1400 TSval=2767258949 TSecr=4060319373 [TCP PDU reassembled in 466]"
"466","2.109606","64.233.180.190","100.86.243.187","TLSv1.2","1466","Encrypted Handshake Message, Ignored Unknown Record"
"467","2.109607","64.233.180.190","100.86.243.187","TLSv1.2","1466","Ignored Unknown Record"
"468","2.109607","64.233.180.190","100.86.243.187","TLSv1.2","1466","Ignored Unknown Record"
"469","2.109608","64.233.180.190","100.86.243.187","TLSv1.2","1466","Ignored Unknown Record"
"470","2.109608","64.233.180.190","100.86.243.187","TLSv1.2","1466","Ignored Unknown Record"
"471","2.109609","64.233.180.190","100.86.243.187","TLSv1.2","1466","Ignored Unknown Record"
"472","2.109609","64.233.180.190","100.86.243.187","TLSv1.2","1466","Ignored Unknown Record"
"473","2.109609","64.233.180.190","100.86.243.187","TLSv1.2","1466","Ignored Unknown Record"
"474","2.109610","64.233.180.190","100.86.243.187","TLSv1.2","1466","Ignored Unknown Record"
"475","2.109610","64.233.180.190","100.86.243.187","TLSv1.2","1466","Ignored Unknown Record"
"476","2.109659","100.86.243.187","64.233.180.190","TCP","94","[TCP Dup ACK 261#33] 53804  >  443 [ACK] Seq=79597 Ack=28534 Win=32804 Len=0 TSval=4060319395 TSecr=2767258937 SLE=226651 SRE=271451 SLE=197251 SRE=225251 SLE=111851 SRE=195851"
"477","2.109676","100.86.243.187","64.233.180.190","TCP","94","[TCP Dup ACK 261#34] 53804  >  443 [ACK] Seq=79597 Ack=28534 Win=32804 Len=0 TSval=4060319395 TSecr=2767258937 SLE=226651 SRE=286851 SLE=197251 SRE=225251 SLE=111851 SRE=195851"
"478","2.111052","64.233.180.190","100.86.243.187","TLSv1.2","1466","Ignored Unknown Record"
"479","2.111053","64.233.180.190","100.86.243.187","TLSv1.2","1466","Ignored Unknown Record"
"480","2.111053","64.233.180.190","100.86.243.187","TCP","1466","443  >  53804 [ACK] Seq=289651 Ack=79597 Win=662 Len=1400 TSval=2767258949 TSecr=4060319373 [TCP PDU reassembled in 520]"
"481","2.111054","64.233.180.190","100.86.243.187","TCP","1466","443  >  53804 [PSH, ACK] Seq=291051 Ack=79597 Win=662 Len=1400 TSval=2767258949 TSecr=4060319373 [TCP PDU reassembled in 520]"
"482","2.111054","64.233.180.190","100.86.243.187","TCP","1466","443  >  53804 [ACK] Seq=292451 Ack=79597 Win=662 Len=1400 TSval=2767258950 TSecr=4060319373 [TCP PDU reassembled in 520]"
"483","2.111054","64.233.180.190","100.86.243.187","TCP","1466","443  >  53804 [ACK] Seq=293851 Ack=79597 Win=662 Len=1400 TSval=2767258950 TSecr=4060319373 [TCP PDU reassembled in 520]"
"484","2.111055","64.233.180.190","100.86.243.187","TCP","1466","443  >  53804 [ACK] Seq=295251 Ack=79597 Win=662 Len=1400 TSval=2767258950 TSecr=4060319373 [TCP PDU reassembled in 520]"
"485","2.111056","64.233.180.190","100.86.243.187","TCP","1466","443  >  53804 [ACK] Seq=296651 Ack=79597 Win=662 Len=1400 TSval=2767258950 TSecr=4060319373 [TCP PDU reassembled in 520]"
"486","2.111056","64.233.180.190","100.86.243.187","TCP","1466","443  >  53804 [ACK] Seq=298051 Ack=79597 Win=662 Len=1400 TSval=2767258950 TSecr=4060319373 [TCP PDU reassembled in 520]"
"487","2.111057","64.233.180.190","100.86.243.187","TCP","1466","443  >  53804 [ACK] Seq=299451 Ack=79597 Win=662 Len=1400 TSval=2767258950 TSecr=4060319373 [TCP PDU reassembled in 520]"
"488","2.111057","64.233.180.190","100.86.243.187","TCP","1466","443  >  53804 [ACK] Seq=300851 Ack=79597 Win=662 Len=1400 TSval=2767258950 TSecr=4060319373 [TCP PDU reassembled in 520]"
"489","2.111057","64.233.180.190","100.86.243.187","TCP","1466","443  >  53804 [ACK] Seq=302251 Ack=79597 Win=662 Len=1400 TSval=2767258950 TSecr=4060319373 [TCP PDU reassembled in 520]"
"490","2.111058","64.233.180.190","100.86.243.187","TCP","1466","443  >  53804 [ACK] Seq=303651 Ack=79597 Win=662 Len=1400 TSval=2767258950 TSecr=4060319373 [TCP PDU reassembled in 520]"
"491","2.111059","64.233.180.190","100.86.243.187","TCP","1466","443  >  53804 [ACK] Seq=305051 Ack=79597 Win=662 Len=1400 TSval=2767258950 TSecr=4060319373 [TCP PDU reassembled in 520]"
"492","2.111059","64.233.180.190","100.86.243.187","TCP","1466","443  >  53804 [ACK] Seq=306451 Ack=79597 Win=662 Len=1400 TSval=2767258950 TSecr=4060319373 [TCP PDU reassembled in 520]"
"493","2.111060","64.233.180.190","100.86.243.187","TCP","1466","443  >  53804 [ACK] Seq=307851 Ack=79597 Win=662 Len=1400 TSval=2767258950 TSecr=4060319373 [TCP PDU reassembled in 520]"
"494","2.111117","100.86.243.187","64.233.180.190","TCP","94","[TCP Dup ACK 261#35] 53804  >  443 [ACK] Seq=79597 Ack=28534 Win=32804 Len=0 TSval=4060319397 TSecr=2767258937 SLE=226651 SRE=302251 SLE=197251 SRE=225251 SLE=111851 SRE=195851"
"495","2.111138","100.86.243.187","64.233.180.190","TCP","94","[TCP Dup ACK 261#36] 53804  >  443 [ACK] Seq=79597 Ack=28534 Win=32804 Len=0 TSval=4060319397 TSecr=2767258937 SLE=226651 SRE=309251 SLE=197251 SRE=225251 SLE=111851 SRE=195851"
"496","2.111765","64.233.180.190","100.86.243.187","TCP","1466","443  >  53804 [PSH, ACK] Seq=309251 Ack=79597 Win=662 Len=1400 TSval=2767258950 TSecr=4060319373 [TCP PDU reassembled in 520]"
"497","2.111766","64.233.180.190","100.86.243.187","TCP","1466","443  >  53804 [ACK] Seq=310651 Ack=79597 Win=662 Len=1400 TSval=2767258951 TSecr=4060319373 [TCP PDU reassembled in 520]"
"498","2.111800","100.86.243.187","64.233.180.190","TCP","94","[TCP Dup ACK 261#37] 53804  >  443 [ACK] Seq=79597 Ack=28534 Win=32804 Len=0 TSval=4060319397 TSecr=2767258937 SLE=226651 SRE=312051 SLE=197251 SRE=225251 SLE=111851 SRE=195851"
"499","2.113282","64.233.180.190","100.86.243.187","TCP","1466","443  >  53804 [ACK] Seq=312051 Ack=79597 Win=662 Len=1400 TSval=2767258951 TSecr=4060319373 [TCP PDU reassembled in 520]"
"500","2.113283","64.233.180.190","100.86.243.187","TCP","1466","443  >  53804 [ACK] Seq=313451 Ack=79597 Win=662 Len=1400 TSval=2767258951 TSecr=4060319373 [TCP PDU reassembled in 520]"
"501","2.113283","64.233.180.190","100.86.243.187","TCP","1466","443  >  53804 [ACK] Seq=314851 Ack=79597 Win=662 Len=1400 TSval=2767258951 TSecr=4060319373 [TCP PDU reassembled in 520]"
"502","2.113284","64.233.180.190","100.86.243.187","TCP","1466","443  >  53804 [ACK] Seq=316251 Ack=79597 Win=662 Len=1400 TSval=2767258951 TSecr=4060319373 [TCP PDU reassembled in 520]"
"503","2.113284","64.233.180.190","100.86.243.187","TCP","1466","443  >  53804 [ACK] Seq=317651 Ack=79597 Win=662 Len=1400 TSval=2767258951 TSecr=4060319373 [TCP PDU reassembled in 520]"
"504","2.113285","64.233.180.190","100.86.243.187","TCP","1466","443  >  53804 [ACK] Seq=319051 Ack=79597 Win=662 Len=1400 TSval=2767258951 TSecr=4060319373 [TCP PDU reassembled in 520]"
"505","2.113286","64.233.180.190","100.86.243.187","TCP","1466","443  >  53804 [ACK] Seq=320451 Ack=79597 Win=662 Len=1400 TSval=2767258951 TSecr=4060319373 [TCP PDU reassembled in 520]"
"506","2.113287","64.233.180.190","100.86.243.187","TCP","1466","443  >  53804 [ACK] Seq=321851 Ack=79597 Win=662 Len=1400 TSval=2767258951 TSecr=4060319373 [TCP PDU reassembled in 520]"
"507","2.113287","64.233.180.190","100.86.243.187","TCP","1466","443  >  53804 [ACK] Seq=323251 Ack=79597 Win=662 Len=1400 TSval=2767258951 TSecr=4060319373 [TCP PDU reassembled in 520]"
"508","2.113287","64.233.180.190","100.86.243.187","TCP","1466","443  >  53804 [ACK] Seq=324651 Ack=79597 Win=662 Len=1400 TSval=2767258951 TSecr=4060319373 [TCP PDU reassembled in 520]"
"509","2.113288","64.233.180.190","100.86.243.187","TCP","1466","443  >  53804 [ACK] Seq=326051 Ack=79597 Win=662 Len=1400 TSval=2767258951 TSecr=4060319373 [TCP PDU reassembled in 520]"
"510","2.113288","64.233.180.190","100.86.243.187","TCP","1466","443  >  53804 [PSH, ACK] Seq=327451 Ack=79597 Win=662 Len=1400 TSval=2767258951 TSecr=4060319373 [TCP PDU reassembled in 520]"
"511","2.113289","64.233.180.190","100.86.243.187","TCP","1466","443  >  53804 [ACK] Seq=328851 Ack=79597 Win=662 Len=1400 TSval=2767258952 TSecr=4060319373 [TCP PDU reassembled in 520]"
"512","2.113290","64.233.180.190","100.86.243.187","TCP","1466","443  >  53804 [ACK] Seq=330251 Ack=79597 Win=662 Len=1400 TSval=2767258952 TSecr=4060319373 [TCP PDU reassembled in 520]"
"513","2.113290","64.233.180.190","100.86.243.187","TCP","1466","443  >  53804 [ACK] Seq=331651 Ack=79597 Win=662 Len=1400 TSval=2767258952 TSecr=4060319373 [TCP PDU reassembled in 520]"
"514","2.113290","64.233.180.190","100.86.243.187","TCP","1466","443  >  53804 [ACK] Seq=333051 Ack=79597 Win=662 Len=1400 TSval=2767258952 TSecr=4060319373 [TCP PDU reassembled in 520]"
"515","2.113291","64.233.180.190","100.86.243.187","TCP","1466","443  >  53804 [ACK] Seq=334451 Ack=79597 Win=662 Len=1400 TSval=2767258952 TSecr=4060319373 [TCP PDU reassembled in 520]"
"516","2.113291","64.233.180.190","100.86.243.187","TCP","1466","443  >  53804 [ACK] Seq=335851 Ack=79597 Win=662 Len=1400 TSval=2767258952 TSecr=4060319373 [TCP PDU reassembled in 520]"
"517","2.113292","64.233.180.190","100.86.243.187","TCP","1466","443  >  53804 [ACK] Seq=337251 Ack=79597 Win=662 Len=1400 TSval=2767258952 TSecr=4060319373 [TCP PDU reassembled in 520]"
"518","2.113292","64.233.180.190","100.86.243.187","TCP","1466","443  >  53804 [ACK] Seq=338651 Ack=79597 Win=662 Len=1400 TSval=2767258952 TSecr=4060319373 [TCP PDU reassembled in 520]"
"519","2.113293","64.233.180.190","100.86.243.187","TCP","1466","443  >  53804 [ACK] Seq=340051 Ack=79597 Win=662 Len=1400 TSval=2767258952 TSecr=4060319373 [TCP PDU reassembled in 520]"
"520","2.113294","64.233.180.190","100.86.243.187","TLSv1.2","1466","Encrypted Alert, Ignored Unknown Record"
"521","2.113294","64.233.180.190","100.86.243.187","TLSv1.2","1466","Ignored Unknown Record"
"522","2.113294","64.233.180.190","100.86.243.187","TLSv1.2","1466","Ignored Unknown Record"
"523","2.113326","100.86.243.187","64.233.180.190","TCP","94","[TCP Dup ACK 261#38] 53804  >  443 [ACK] Seq=79597 Ack=28534 Win=32804 Len=0 TSval=4060319399 TSecr=2767258937 SLE=226651 SRE=327451 SLE=197251 SRE=225251 SLE=111851 SRE=195851"
"524","2.113339","100.86.243.187","64.233.180.190","TCP","94","[TCP Dup ACK 261#39] 53804  >  443 [ACK] Seq=79597 Ack=28534 Win=32804 Len=0 TSval=4060319399 TSecr=2767258937 SLE=226651 SRE=342851 SLE=197251 SRE=225251 SLE=111851 SRE=195851"
"525","2.113349","100.86.243.187","64.233.180.190","TCP","94","[TCP Dup ACK 261#40] 53804  >  443 [ACK] Seq=79597 Ack=28534 Win=32804 Len=0 TSval=4060319399 TSecr=2767258937 SLE=226651 SRE=345651 SLE=197251 SRE=225251 SLE=111851 SRE=195851"
"526","2.113428","64.233.180.190","100.86.243.187","TLSv1.2","1466","Ignored Unknown Record"
"527","2.113429","64.233.180.190","100.86.243.187","TLSv1.2","1466","Ignored Unknown Record"
"528","2.113465","100.86.243.187","64.233.180.190","TCP","94","[TCP Dup ACK 261#41] 53804  >  443 [ACK] Seq=79597 Ack=28534 Win=32804 Len=0 TSval=4060319399 TSecr=2767258937 SLE=226651 SRE=348451 SLE=197251 SRE=225251 SLE=111851 SRE=195851"
"529","2.113633","64.233.180.190","100.86.243.187","TLSv1.2","1466","Ignored Unknown Record"
"530","2.113633","64.233.180.190","100.86.243.187","TLSv1.2","1466","Ignored Unknown Record"
"531","2.113676","100.86.243.187","64.233.180.190","TCP","94","[TCP Dup ACK 261#42] 53804  >  443 [ACK] Seq=79597 Ack=28534 Win=32804 Len=0 TSval=4060319399 TSecr=2767258937 SLE=226651 SRE=351251 SLE=197251 SRE=225251 SLE=111851 SRE=195851"
"532","2.113984","64.233.180.190","100.86.243.187","TLSv1.2","1466","Ignored Unknown Record"
"533","2.113985","64.233.180.190","100.86.243.187","TLSv1.2","1466","Ignored Unknown Record"
"534","2.113985","64.233.180.190","100.86.243.187","TCP","1466","443  >  53804 [ACK] Seq=354051 Ack=79597 Win=662 Len=1400 TSval=2767258953 TSecr=4060319373"
"535","2.113986","64.233.180.190","100.86.243.187","TLSv1.2","1466","Ignored Unknown Record"
"536","2.114011","100.86.243.187","64.233.180.190","TCP","94","[TCP Dup ACK 261#43] 53804  >  443 [ACK] Seq=79597 Ack=28534 Win=32804 Len=0 TSval=4060319400 TSecr=2767258937 SLE=226651 SRE=356851 SLE=197251 SRE=225251 SLE=111851 SRE=195851"
"537","2.115525","64.233.180.190","100.86.243.187","TLSv1.2","1466","Ignored Unknown Record"
"538","2.115525","64.233.180.190","100.86.243.187","TLSv1.2","1466","Ignored Unknown Record"
"539","2.115525","64.233.180.190","100.86.243.187","TLSv1.2","1466","Ignored Unknown Record"
"540","2.115526","64.233.180.190","100.86.243.187","TLSv1.2","1466","Ignored Unknown Record"
"541","2.115527","64.233.180.190","100.86.243.187","TLSv1.2","1466","Ignored Unknown Record"
"542","2.115527","64.233.180.190","100.86.243.187","TLSv1.2","1466","Ignored Unknown Record"
"543","2.115528","64.233.180.190","100.86.243.187","TLSv1.2","1466","Ignored Unknown Record"
"544","2.115528","64.233.180.190","100.86.243.187","TLSv1.2","1466","Ignored Unknown Record"
"545","2.115529","64.233.180.190","100.86.243.187","TLSv1.2","1466","Ignored Unknown Record"
"546","2.115529","64.233.180.190","100.86.243.187","TLSv1.2","1466","Ignored Unknown Record"
"547","2.115530","64.233.180.190","100.86.243.187","TLSv1.2","1466","Ignored Unknown Record"
"548","2.115531","64.233.180.190","100.86.243.187","TCP","1466","443  >  53804 [ACK] Seq=372251 Ack=79597 Win=662 Len=1400 TSval=2767258954 TSecr=4060319373 [TCP PDU reassembled in 569]"
"549","2.115531","64.233.180.190","100.86.243.187","TCP","1466","443  >  53804 [ACK] Seq=373651 Ack=79597 Win=662 Len=1400 TSval=2767258954 TSecr=4060319373 [TCP PDU reassembled in 569]"
"550","2.115532","64.233.180.190","100.86.243.187","TCP","1466","443  >  53804 [ACK] Seq=375051 Ack=79597 Win=662 Len=1400 TSval=2767258954 TSecr=4060319373 [TCP PDU reassembled in 569]"
"551","2.115532","64.233.180.190","100.86.243.187","TCP","1466","443  >  53804 [ACK] Seq=376451 Ack=79597 Win=662 Len=1400 TSval=2767258954 TSecr=4060319373 [TCP PDU reassembled in 569]"
"552","2.115533","64.233.180.190","100.86.243.187","TCP","1466","443  >  53804 [ACK] Seq=377851 Ack=79597 Win=662 Len=1400 TSval=2767258954 TSecr=4060319373 [TCP PDU reassembled in 569]"
"553","2.115533","64.233.180.190","100.86.243.187","TCP","1466","443  >  53804 [ACK] Seq=379251 Ack=79597 Win=662 Len=1400 TSval=2767258954 TSecr=4060319373 [TCP PDU reassembled in 569]"
"554","2.115534","64.233.180.190","100.86.243.187","TCP","1466","443  >  53804 [ACK] Seq=380651 Ack=79597 Win=662 Len=1400 TSval=2767258954 TSecr=4060319373 [TCP PDU reassembled in 569]"
"555","2.115569","100.86.243.187","64.233.180.190","TCP","94","[TCP Dup ACK 261#44] 53804  >  443 [ACK] Seq=79597 Ack=28534 Win=32804 Len=0 TSval=4060319401 TSecr=2767258937 SLE=226651 SRE=372251 SLE=197251 SRE=225251 SLE=111851 SRE=195851"
"556","2.115584","100.86.243.187","64.233.180.190","TCP","94","[TCP Dup ACK 261#45] 53804  >  443 [ACK] Seq=79597 Ack=28534 Win=32804 Len=0 TSval=4060319401 TSecr=2767258937 SLE=226651 SRE=382051 SLE=197251 SRE=225251 SLE=111851 SRE=195851"
"557","2.116616","64.233.180.190","100.86.243.187","TCP","1466","443  >  53804 [PSH, ACK] Seq=382051 Ack=79597 Win=662 Len=1400 TSval=2767258954 TSecr=4060319373 [TCP PDU reassembled in 569]"
"558","2.116617","64.233.180.190","100.86.243.187","TCP","1466","443  >  53804 [ACK] Seq=383451 Ack=79597 Win=662 Len=1400 TSval=2767258955 TSecr=4060319373 [TCP PDU reassembled in 569]"
"559","2.116656","100.86.243.187","64.233.180.190","TCP","94","[TCP Dup ACK 261#46] 53804  >  443 [ACK] Seq=79597 Ack=28534 Win=32804 Len=0 TSval=4060319402 TSecr=2767258937 SLE=226651 SRE=384851 SLE=197251 SRE=225251 SLE=111851 SRE=195851"
"560","2.116736","64.233.180.190","100.86.243.187","TCP","1466","443  >  53804 [ACK] Seq=384851 Ack=79597 Win=662 Len=1400 TSval=2767258955 TSecr=4060319373 [TCP PDU reassembled in 569]"
"561","2.116736","64.233.180.190","100.86.243.187","TCP","1466","443  >  53804 [ACK] Seq=386251 Ack=79597 Win=662 Len=1400 TSval=2767258955 TSecr=4060319373 [TCP PDU reassembled in 569]"
"562","2.116762","100.86.243.187","64.233.180.190","TCP","94","[TCP Dup ACK 261#47] 53804  >  443 [ACK] Seq=79597 Ack=28534 Win=32804 Len=0 TSval=4060319402 TSecr=2767258937 SLE=226651 SRE=387651 SLE=197251 SRE=225251 SLE=111851 SRE=195851"
"563","2.116882","64.233.180.190","100.86.243.187","TCP","1466","443  >  53804 [ACK] Seq=387651 Ack=79597 Win=662 Len=1400 TSval=2767258955 TSecr=4060319373 [TCP PDU reassembled in 569]"
"564","2.116883","64.233.180.190","100.86.243.187","TCP","1466","443  >  53804 [ACK] Seq=389051 Ack=79597 Win=662 Len=1400 TSval=2767258955 TSecr=4060319373 [TCP PDU reassembled in 569]"
"565","2.116903","100.86.243.187","64.233.180.190","TCP","94","[TCP Dup ACK 261#48] 53804  >  443 [ACK] Seq=79597 Ack=28534 Win=32804 Len=0 TSval=4060319402 TSecr=2767258937 SLE=226651 SRE=390451 SLE=197251 SRE=225251 SLE=111851 SRE=195851"
"566","2.117082","64.233.180.190","100.86.243.187","TCP","1466","443  >  53804 [ACK] Seq=390451 Ack=79597 Win=662 Len=1400 TSval=2767258955 TSecr=4060319373 [TCP PDU reassembled in 569]"
"567","2.117083","64.233.180.190","100.86.243.187","TCP","1466","443  >  53804 [ACK] Seq=391851 Ack=79597 Win=662 Len=1400 TSval=2767258955 TSecr=4060319373 [TCP PDU reassembled in 569]"
"568","2.117123","100.86.243.187","64.233.180.190","TCP","94","[TCP Dup ACK 261#49] 53804  >  443 [ACK] Seq=79597 Ack=28534 Win=32804 Len=0 TSval=4060319402 TSecr=2767258937 SLE=226651 SRE=393251 SLE=197251 SRE=225251 SLE=111851 SRE=195851"
"569","2.118589","64.233.180.190","100.86.243.187","TLSv1.2","1466","Application Data, Ignored Unknown Record"
"570","2.118590","64.233.180.190","100.86.243.187","TLSv1.2","1466","Ignored Unknown Record"
"571","2.118590","64.233.180.190","100.86.243.187","TLSv1.2","1466","Ignored Unknown Record"
"572","2.118591","64.233.180.190","100.86.243.187","TLSv1.2","1466","Ignored Unknown Record"
"573","2.118591","64.233.180.190","100.86.243.187","TLSv1.2","1466","Ignored Unknown Record"
"574","2.118592","64.233.180.190","100.86.243.187","TLSv1.2","1466","Ignored Unknown Record"
"575","2.118592","64.233.180.190","100.86.243.187","TLSv1.2","1466","Ignored Unknown Record"
"576","2.118593","64.233.180.190","100.86.243.187","TLSv1.2","1466","Ignored Unknown Record"
"577","2.118593","64.233.180.190","100.86.243.187","TLSv1.2","1466","Ignored Unknown Record"
"578","2.118594","64.233.180.190","100.86.243.187","TLSv1.2","1466","Ignored Unknown Record"
"579","2.118595","64.233.180.190","100.86.243.187","TLSv1.2","1466","Ignored Unknown Record"
"580","2.118595","64.233.180.190","100.86.243.187","TLSv1.2","1466","Ignored Unknown Record"
"581","2.118596","64.233.180.190","100.86.243.187","TLSv1.2","1466","Ignored Unknown Record"
"582","2.118596","64.233.180.190","100.86.243.187","TLSv1.2","1466","Ignored Unknown Record"
"583","2.118597","64.233.180.190","100.86.243.187","TLSv1.2","1466","Ignored Unknown Record"
"584","2.118599","64.233.180.190","100.86.243.187","TLSv1.2","1466","Ignored Unknown Record"
"585","2.118600","64.233.180.190","100.86.243.187","TLSv1.2","1466","Ignored Unknown Record"
"586","2.118600","64.233.180.190","100.86.243.187","TLSv1.2","1466","Ignored Unknown Record"
"587","2.118601","64.233.180.190","100.86.243.187","TLSv1.2","1466","Ignored Unknown Record"
"588","2.118601","64.233.180.190","100.86.243.187","TLSv1.2","1466","Ignored Unknown Record"
"589","2.118602","64.233.180.190","100.86.243.187","TLSv1.2","1466","Ignored Unknown Record"
"590","2.118602","64.233.180.190","100.86.243.187","TLSv1.2","1466","Ignored Unknown Record"
"591","2.118603","64.233.180.190","100.86.243.187","TLSv1.2","1466","Ignored Unknown Record"
"592","2.118604","64.233.180.190","100.86.243.187","TLSv1.2","1466","Ignored Unknown Record"
"593","2.118663","100.86.243.187","64.233.180.190","TCP","94","[TCP Dup ACK 261#50] 53804  >  443 [ACK] Seq=79597 Ack=28534 Win=32804 Len=0 TSval=4060319404 TSecr=2767258937 SLE=226651 SRE=408651 SLE=197251 SRE=225251 SLE=111851 SRE=195851"
"594","2.118681","100.86.243.187","64.233.180.190","TCP","94","[TCP Dup ACK 261#51] 53804  >  443 [ACK] Seq=79597 Ack=28534 Win=32804 Len=0 TSval=4060319404 TSecr=2767258937 SLE=226651 SRE=424051 SLE=197251 SRE=225251 SLE=111851 SRE=195851"
"595","2.118691","100.86.243.187","64.233.180.190","TCP","94","[TCP Dup ACK 261#52] 53804  >  443 [ACK] Seq=79597 Ack=28534 Win=32804 Len=0 TSval=4060319404 TSecr=2767258937 SLE=226651 SRE=426851 SLE=197251 SRE=225251 SLE=111851 SRE=195851"
"596","2.118714","64.233.180.190","100.86.243.187","TLSv1.2","1466","Ignored Unknown Record"
"597","2.118714","64.233.180.190","100.86.243.187","TCP","1466","443  >  53804 [ACK] Seq=428251 Ack=79597 Win=662 Len=1400 TSval=2767258957 TSecr=4060319373 [TCP PDU reassembled in 615]"
"598","2.118736","100.86.243.187","64.233.180.190","TCP","94","[TCP Dup ACK 261#53] 53804  >  443 [ACK] Seq=79597 Ack=28534 Win=32804 Len=0 TSval=4060319404 TSecr=2767258937 SLE=226651 SRE=429651 SLE=197251 SRE=225251 SLE=111851 SRE=195851"
"599","2.118838","64.233.180.190","100.86.243.187","TCP","1466","443  >  53804 [ACK] Seq=429651 Ack=79597 Win=662 Len=1400 TSval=2767258957 TSecr=4060319373 [TCP PDU reassembled in 615]"
"600","2.118838","64.233.180.190","100.86.243.187","TCP","1466","443  >  53804 [ACK] Seq=431051 Ack=79597 Win=662 Len=1400 TSval=2767258957 TSecr=4060319373 [TCP PDU reassembled in 615]"
"601","2.118871","100.86.243.187","64.233.180.190","TCP","94","[TCP Dup ACK 261#54] 53804  >  443 [ACK] Seq=79597 Ack=28534 Win=32804 Len=0 TSval=4060319404 TSecr=2767258937 SLE=226651 SRE=432451 SLE=197251 SRE=225251 SLE=111851 SRE=195851"
"602","2.119182","64.233.180.190","100.86.243.187","TCP","1466","443  >  53804 [ACK] Seq=432451 Ack=79597 Win=662 Len=1400 TSval=2767258957 TSecr=4060319373 [TCP PDU reassembled in 615]"
"603","2.119183","64.233.180.190","100.86.243.187","TCP","1466","443  >  53804 [ACK] Seq=433851 Ack=79597 Win=662 Len=1400 TSval=2767258957 TSecr=4060319373 [TCP PDU reassembled in 615]"
"604","2.119183","64.233.180.190","100.86.243.187","TCP","1466","443  >  53804 [ACK] Seq=435251 Ack=79597 Win=662 Len=1400 TSval=2767258957 TSecr=4060319373 [TCP PDU reassembled in 615]"
"605","2.119184","64.233.180.190","100.86.243.187","TCP","1466","443  >  53804 [PSH, ACK] Seq=436651 Ack=79597 Win=662 Len=1400 TSval=2767258957 TSecr=4060319373 [TCP PDU reassembled in 615]"
"606","2.119212","100.86.243.187","64.233.180.190","TCP","94","[TCP Dup ACK 261#55] 53804  >  443 [ACK] Seq=79597 Ack=28534 Win=32804 Len=0 TSval=4060319404 TSecr=2767258937 SLE=226651 SRE=438051 SLE=197251 SRE=225251 SLE=111851 SRE=195851"
"607","2.119467","64.233.180.190","100.86.243.187","TCP","1466","443  >  53804 [ACK] Seq=438051 Ack=79597 Win=662 Len=1400 TSval=2767258958 TSecr=4060319373 [TCP PDU reassembled in 615]"
"608","2.119467","64.233.180.190","100.86.243.187","TCP","1466","443  >  53804 [ACK] Seq=439451 Ack=79597 Win=662 Len=1400 TSval=2767258958 TSecr=4060319373 [TCP PDU reassembled in 615]"
"609","2.119468","64.233.180.190","100.86.243.187","TCP","1466","443  >  53804 [ACK] Seq=440851 Ack=79597 Win=662 Len=1400 TSval=2767258958 TSecr=4060319373 [TCP PDU reassembled in 615]"
"610","2.119468","64.233.180.190","100.86.243.187","TCP","1466","443  >  53804 [ACK] Seq=442251 Ack=79597 Win=662 Len=1400 TSval=2767258958 TSecr=4060319373 [TCP PDU reassembled in 615]"
"611","2.119499","100.86.243.187","64.233.180.190","TCP","94","[TCP Dup ACK 261#56] 53804  >  443 [ACK] Seq=79597 Ack=28534 Win=32804 Len=0 TSval=4060319404 TSecr=2767258937 SLE=226651 SRE=443651 SLE=197251 SRE=225251 SLE=111851 SRE=195851"
"612","2.119611","64.233.180.190","100.86.243.187","TCP","1466","443  >  53804 [ACK] Seq=443651 Ack=79597 Win=662 Len=1400 TSval=2767258958 TSecr=4060319373 [TCP PDU reassembled in 615]"
"613","2.119612","64.233.180.190","100.86.243.187","TCP","1466","443  >  53804 [ACK] Seq=445051 Ack=79597 Win=662 Len=1400 TSval=2767258958 TSecr=4060319373 [TCP PDU reassembled in 615]"
"614","2.119628","100.86.243.187","64.233.180.190","TCP","94","[TCP Dup ACK 261#57] 53804  >  443 [ACK] Seq=79597 Ack=28534 Win=32804 Len=0 TSval=4060319404 TSecr=2767258937 SLE=226651 SRE=446451 SLE=197251 SRE=225251 SLE=111851 SRE=195851"
"615","2.119969","64.233.180.190","100.86.243.187","TLSv1.2","1466","Change Cipher Spec, Ignored Unknown Record"
"616","2.119970","64.233.180.190","100.86.243.187","TLSv1.2","1466","Ignored Unknown Record"
"617","2.119971","64.233.180.190","100.86.243.187","TLSv1.2","1466","Ignored Unknown Record"
"618","2.119971","64.233.180.190","100.86.243.187","TLSv1.2","1466","Ignored Unknown Record"
"619","2.120015","100.86.243.187","64.233.180.190","TCP","94","[TCP Dup ACK 261#58] 53804  >  443 [ACK] Seq=79597 Ack=28534 Win=32804 Len=0 TSval=4060319406 TSecr=2767258937 SLE=226651 SRE=452051 SLE=197251 SRE=225251 SLE=111851 SRE=195851"
"620","2.121458","64.233.180.190","100.86.243.187","TLSv1.2","1466","Ignored Unknown Record"
"621","2.121459","64.233.180.190","100.86.243.187","TLSv1.2","1466","Ignored Unknown Record"
"622","2.121460","64.233.180.190","100.86.243.187","TLSv1.2","1466","Ignored Unknown Record"
"623","2.121460","64.233.180.190","100.86.243.187","TLSv1.2","1466","Ignored Unknown Record"
"624","2.121461","64.233.180.190","100.86.243.187","TLSv1.2","1466","Ignored Unknown Record"
"625","2.121462","64.233.180.190","100.86.243.187","TLSv1.2","1466","Ignored Unknown Record"
"626","2.121462","64.233.180.190","100.86.243.187","TLSv1.2","1466","Ignored Unknown Record"
"627","2.121463","64.233.180.190","100.86.243.187","TLSv1.2","1466","Ignored Unknown Record"
"628","2.121464","64.233.180.190","100.86.243.187","TLSv1.2","1466","Ignored Unknown Record"
"629","2.121464","64.233.180.190","100.86.243.187","TLSv1.2","1319","Ignored Unknown Record"
"630","2.121551","100.86.243.187","64.233.180.190","TCP","94","[TCP Dup ACK 261#59] 53804  >  443 [ACK] Seq=79597 Ack=28534 Win=32804 Len=0 TSval=4060319407 TSecr=2767258937 SLE=226651 SRE=465904 SLE=197251 SRE=225251 SLE=111851 SRE=195851"
"631","2.125767","64.233.180.190","100.86.243.187","TLSv1.2","1466","[TCP Fast Retransmission] , Application Data"
"632","2.125769","64.233.180.190","100.86.243.187","TLSv1.2","1466","[TCP Fast Retransmission] , Application Data"
"633","2.125840","100.86.243.187","64.233.180.190","TCP","94","53804  >  443 [ACK] Seq=79597 Ack=109051 Win=31546 Len=0 TSval=4060319412 TSecr=2767258969 SLE=226651 SRE=465904 SLE=197251 SRE=225251 SLE=111851 SRE=195851"
"634","2.125909","100.86.243.187","64.233.180.190","TCP","94","53804  >  443 [ACK] Seq=79597 Ack=110451 Win=31524 Len=0 TSval=4060319412 TSecr=2767258969 SLE=226651 SRE=465904 SLE=197251 SRE=225251 SLE=111851 SRE=195851"
"635","2.126159","100.86.243.187","64.233.180.190","TLSv1.2","133","Application Data"
"636","2.126389","64.233.180.190","100.86.243.187","TCP","1466","[TCP Retransmission] 443  >  53804 [ACK] Seq=195851 Ack=79597 Win=662 Len=1400 TSval=2767258970 TSecr=4060319397"
"637","2.126390","64.233.180.190","100.86.243.187","TCP","1466","[TCP Retransmission] 443  >  53804 [ACK] Seq=225251 Ack=79597 Win=662 Len=1400 TSval=2767258970 TSecr=4060319399"
"638","2.126430","100.86.243.187","64.233.180.190","TCP","86","[TCP Dup ACK 634#1] 53804  >  443 [ACK] Seq=79636 Ack=110451 Win=32624 Len=0 TSval=4060319412 TSecr=2767258969 SLE=111851 SRE=225251 SLE=226651 SRE=465904"
"639","2.126449","100.86.243.187","64.233.180.190","TCP","78","[TCP Dup ACK 634#2] 53804  >  443 [ACK] Seq=79636 Ack=110451 Win=32690 Len=0 TSval=4060319412 TSecr=2767258969 SLE=111851 SRE=465904"
"640","2.126490","100.86.243.187","64.233.180.190","TCP","78","[TCP Dup ACK 634#3] 53804  >  443 [ACK] Seq=79636 Ack=110451 Win=32804 Len=0 TSval=4060319412 TSecr=2767258969 SLE=111851 SRE=465904"
"641","2.141855","64.233.180.190","100.86.243.187","TCP","66","443  >  53804 [ACK] Seq=465904 Ack=79636 Win=662 Len=0 TSval=2767258985 TSecr=4060319412"
"642","2.153786","64.233.180.190","100.86.243.187","TLSv1.2","701","Application Data"
"643","2.153787","64.233.180.190","100.86.243.187","TLSv1.2","1466","Application Data"
"644","2.153788","64.233.180.190","100.86.243.187","TLSv1.2","1466","Application Data"
"645","2.153789","64.233.180.190","100.86.243.187","TLSv1.2","630","Application Data"
"646","2.153790","64.233.180.190","100.86.243.187","TLSv1.2","98","Application Data"
"647","2.153894","100.86.243.187","64.233.180.190","TCP","78","[TCP Dup ACK 634#4] 53804  >  443 [ACK] Seq=79636 Ack=110451 Win=32804 Len=0 TSval=4060319440 TSecr=2767258969 SLE=111851 SRE=469935"
"648","2.154267","64.233.180.190","100.86.243.187","TLSv1.2","97","Application Data"
"649","2.154268","64.233.180.190","100.86.243.187","TLSv1.2","105","Application Data"
"650","2.154348","100.86.243.187","64.233.180.190","TCP","78","[TCP Dup ACK 634#5] 53804  >  443 [ACK] Seq=79636 Ack=110451 Win=32804 Len=0 TSval=4060319440 TSecr=2767258969 SLE=111851 SRE=470005"
"651","2.166144","64.233.180.190","100.86.243.187","TLSv1.2","1466","[TCP Fast Retransmission] , Application Data"
"652","2.166323","100.86.243.187","64.233.180.190","TCP","66","53804  >  443 [ACK] Seq=79636 Ack=470005 Win=27186 Len=0 TSval=4060319452 TSecr=2767259008"
"653","2.168824","100.86.243.187","64.233.180.190","TCP","66","[TCP Window Update] 53804  >  443 [ACK] Seq=79636 Ack=470005 Win=32804 Len=0 TSval=4060319454 TSecr=2767259008"
"654","2.168867","100.86.243.187","64.233.180.190","TLSv1.2","105","Application Data"
"657","2.184622","64.233.180.190","100.86.243.187","TCP","66","443  >  53804 [ACK] Seq=470005 Ack=79675 Win=662 Len=0 TSval=2767259028 TSecr=4060319454"
"5175","6.145500","100.86.243.187","64.233.180.190","TCP","1466","53804  >  443 [ACK] Seq=79675 Ack=470005 Win=32804 Len=1400 TSval=4060323431 TSecr=2767259028 [TCP PDU reassembled in 5177]"
"5176","6.145503","100.86.243.187","64.233.180.190","TCP","1466","53804  >  443 [ACK] Seq=81075 Ack=470005 Win=32804 Len=1400 TSval=4060323431 TSecr=2767259028 [TCP PDU reassembled in 5177]"
"5177","6.145567","100.86.243.187","64.233.180.190","TLSv1.2","352","Application Data"
"5178","6.156494","64.233.180.190","100.86.243.187","TCP","66","443  >  53804 [ACK] Seq=470005 Ack=82761 Win=1072 Len=0 TSval=2767263000 TSecr=4060323431"
"5184","6.182286","64.233.180.190","100.86.243.187","TLSv1.2","143","Application Data"
"5185","6.182363","100.86.243.187","64.233.180.190","TCP","66","53804  >  443 [ACK] Seq=82761 Ack=470082 Win=32803 Len=0 TSval=4060323468 TSecr=2767263026"
"5186","6.182405","64.233.180.190","100.86.243.187","TLSv1.2","97","Application Data"
"5187","6.182405","64.233.180.190","100.86.243.187","TLSv1.2","105","Application Data"
"5188","6.182445","100.86.243.187","64.233.180.190","TCP","66","53804  >  443 [ACK] Seq=82761 Ack=470152 Win=32802 Len=0 TSval=4060323468 TSecr=2767263026"
"5189","6.182841","100.86.243.187","64.233.180.190","TLSv1.2","105","Application Data"
"5191","6.198329","64.233.180.190","100.86.243.187","TCP","66","443  >  53804 [ACK] Seq=470152 Ack=82800 Win=1072 Len=0 TSval=2767263042 TSecr=4060323468"
"5594","6.997423","100.86.243.187","64.233.180.190","TLSv1.2","357","Application Data"
"5595","7.007592","64.233.180.190","100.86.243.187","TCP","66","443  >  53804 [ACK] Seq=470152 Ack=83091 Win=1082 Len=0 TSval=2767263852 TSecr=4060324283"
"5596","7.008056","64.233.180.190","100.86.243.187","TLSv1.2","145","Application Data"
"5597","7.008096","100.86.243.187","64.233.180.190","TCP","66","53804  >  443 [ACK] Seq=83091 Ack=470231 Win=32803 Len=0 TSval=4060324293 TSecr=2767263852"
"5598","7.008308","100.86.243.187","64.233.180.190","TLSv1.2","105","Application Data"
"5601","7.023747","64.233.180.190","100.86.243.187","TCP","66","443  >  53804 [ACK] Seq=470231 Ack=83130 Win=1082 Len=0 TSval=2767263868 TSecr=4060324293"
