"No.","Time","Source","Destination","Protocol","Length","Info"
"34","0.105529","100.86.243.187","64.233.180.190","TCP","1466","53804  >  443 [ACK] Seq=1 Ack=1 Win=32804 Len=1400 TSval=4060374980 TSecr=2767313856 [TCP PDU reassembled in 36]"
"35","0.105532","100.86.243.187","64.233.180.190","TCP","1466","53804  >  443 [ACK] Seq=1401 Ack=1 Win=32804 Len=1400 TSval=4060374980 TSecr=2767313856 [TCP PDU reassembled in 36]"
"36","0.105568","100.86.243.187","64.233.180.190","TLSv1.2","635","Application Data"
"37","0.105627","100.86.243.187","64.233.180.190","TCP","1466","53804  >  443 [ACK] Seq=3370 Ack=1 Win=32804 Len=1400 TSval=4060374980 TSecr=2767313856 [TCP PDU reassembled in 40]"
"38","0.105629","100.86.243.187","64.233.180.190","TCP","1466","53804  >  443 [ACK] Seq=4770 Ack=1 Win=32804 Len=1400 TSval=4060374980 TSecr=2767313856 [TCP PDU reassembled in 40]"
"39","0.105630","100.86.243.187","64.233.180.190","TCP","1466","53804  >  443 [ACK] Seq=6170 Ack=1 Win=32804 Len=1400 TSval=4060374980 TSecr=2767313856 [TCP PDU reassembled in 40]"
"40","0.105646","100.86.243.187","64.233.180.190","TLSv1.2","381","Application Data"
"41","0.116764","64.233.180.190","100.86.243.187","TCP","66","443  >  53804 [ACK] Seq=1 Ack=2801 Win=1312 Len=0 TSval=2767314551 TSecr=4060374980"
"42","0.116765","64.233.180.190","100.86.243.187","TCP","66","443  >  53804 [ACK] Seq=1 Ack=3370 Win=1323 Len=0 TSval=2767314551 TSecr=4060374980"
"43","0.117040","64.233.180.190","100.86.243.187","TCP","66","443  >  53804 [ACK] Seq=1 Ack=6170 Win=1345 Len=0 TSval=2767314551 TSecr=4060374980"
"44","0.117041","64.233.180.190","100.86.243.187","TCP","66","443  >  53804 [ACK] Seq=1 Ack=7885 Win=1367 Len=0 TSval=2767314551 TSecr=4060374980"
"52","0.241237","64.233.180.190","100.86.243.187","TLSv1.2","621","Application Data"
"53","0.241238","64.233.180.190","100.86.243.187","TLSv1.2","1466","Application Data"
"54","0.241239","64.233.180.190","100.86.243.187","TLSv1.2","1466","Application Data"
"55","0.241423","100.86.243.187","64.233.180.190","TCP","66","53804  >  443 [ACK] Seq=7885 Ack=3356 Win=32751 Len=0 TSval=4060375116 TSecr=2767314675"
"56","0.241649","64.233.180.190","100.86.243.187","TLSv1.2","1466","Application Data"
"57","0.241651","64.233.180.190","100.86.243.187","TLSv1.2","1466","Application Data"
"58","0.241726","100.86.243.187","64.233.180.190","TCP","66","53804  >  443 [ACK] Seq=7885 Ack=6156 Win=32716 Len=0 TSval=4060375116 TSecr=2767314675"
"59","0.241777","64.233.180.190","100.86.243.187","TLSv1.2","1466","Application Data"
"60","0.241779","64.233.180.190","100.86.243.187","TLSv1.2","1466","Application Data"
"61","0.241804","100.86.243.187","64.233.180.190","TCP","66","[TCP Window Update] 53804  >  443 [ACK] Seq=7885 Ack=6156 Win=32804 Len=0 TSval=4060375116 TSecr=2767314675"
"62","0.241821","100.86.243.187","64.233.180.190","TCP","66","53804  >  443 [ACK] Seq=7885 Ack=8956 Win=32760 Len=0 TSval=4060375116 TSecr=2767314675"
"63","0.241864","100.86.243.187","64.233.180.190","TCP","66","[TCP Window Update] 53804  >  443 [ACK] Seq=7885 Ack=8956 Win=32804 Len=0 TSval=4060375116 TSecr=2767314675"
"64","0.243144","64.233.180.190","100.86.243.187","TLSv1.2","1466","Application Data"
"65","0.243145","64.233.180.190","100.86.243.187","TLSv1.2","1466","Application Data"
"66","0.243150","64.233.180.190","100.86.243.187","TLSv1.2","1466","Application Data"
"67","0.243151","64.233.180.190","100.86.243.187","TLSv1.2","1466","Application Data"
"68","0.243151","64.233.180.190","100.86.243.187","TLSv1.2","1250","Application Data"
"69","0.243152","64.233.180.190","100.86.243.187","TLSv1.2","335","Application Data"
"70","0.243153","64.233.180.190","100.86.243.187","TLSv1.2","671","Application Data"
"71","0.243153","64.233.180.190","100.86.243.187","TLSv1.2","97","Application Data"
"72","0.243154","64.233.180.190","100.86.243.187","TLSv1.2","105","Application Data"
"73","0.243266","100.86.243.187","64.233.180.190","TCP","66","53804  >  443 [ACK] Seq=7885 Ack=16684 Win=32683 Len=0 TSval=4060375118 TSecr=2767314676"
"74","0.243717","100.86.243.187","64.233.180.190","TCP","66","[TCP Window Update] 53804  >  443 [ACK] Seq=7885 Ack=16684 Win=32804 Len=0 TSval=4060375118 TSecr=2767314676"
"75","0.243770","100.86.243.187","64.233.180.190","TLSv1.2","105","Application Data"
"76","0.255047","64.233.180.190","100.86.243.187","TCP","66","443  >  53804 [ACK] Seq=16684 Ack=7924 Win=1367 Len=0 TSval=2767314689 TSecr=4060375118"
"132","0.473987","100.86.243.187","64.233.180.190","TCP","1466","53804  >  443 [ACK] Seq=7924 Ack=16684 Win=32804 Len=1400 TSval=4060375348 TSecr=2767314689 [TCP PDU reassembled in 134]"
"133","0.473989","100.86.243.187","64.233.180.190","TCP","1466","53804  >  443 [ACK] Seq=9324 Ack=16684 Win=32804 Len=1400 TSval=4060375348 TSecr=2767314689 [TCP PDU reassembled in 134]"
"134","0.474040","100.86.243.187","64.233.180.190","TLSv1.2","651","Application Data"
"135","0.474080","100.86.243.187","64.233.180.190","TCP","1466","53804  >  443 [ACK] Seq=11309 Ack=16684 Win=32804 Len=1400 TSval=4060375348 TSecr=2767314689 [TCP PDU reassembled in 137]"
"136","0.474081","100.86.243.187","64.233.180.190","TCP","1466","53804  >  443 [ACK] Seq=12709 Ack=16684 Win=32804 Len=1400 TSval=4060375348 TSecr=2767314689 [TCP PDU reassembled in 137]"
"137","0.474093","100.86.243.187","64.233.180.190","TLSv1.2","1055","Application Data"
"138","0.485270","64.233.180.190","100.86.243.187","TCP","66","443  >  53804 [ACK] Seq=16684 Ack=9324 Win=1378 Len=0 TSval=2767314919 TSecr=4060375348"
"139","0.485273","64.233.180.190","100.86.243.187","TCP","66","443  >  53804 [ACK] Seq=16684 Ack=15098 Win=1432 Len=0 TSval=2767314919 TSecr=4060375348"
"140","0.485613","100.86.243.187","64.233.180.190","TCP","1466","53804  >  443 [ACK] Seq=15098 Ack=16684 Win=32804 Len=1400 TSval=4060375360 TSecr=2767314919 [TCP PDU reassembled in 142]"
"141","0.485614","100.86.243.187","64.233.180.190","TCP","1466","53804  >  443 [ACK] Seq=16498 Ack=16684 Win=32804 Len=1400 TSval=4060375360 TSecr=2767314919 [TCP PDU reassembled in 142]"
"142","0.485644","100.86.243.187","64.233.180.190","TLSv1.2","636","Application Data"
"143","0.485708","100.86.243.187","64.233.180.190","TCP","1466","53804  >  443 [ACK] Seq=18468 Ack=16684 Win=32804 Len=1400 TSval=4060375360 TSecr=2767314919 [TCP PDU reassembled in 145]"
"144","0.485709","100.86.243.187","64.233.180.190","TCP","1466","53804  >  443 [ACK] Seq=19868 Ack=16684 Win=32804 Len=1400 TSval=4060375360 TSecr=2767314919 [TCP PDU reassembled in 145]"
"145","0.485722","100.86.243.187","64.233.180.190","TLSv1.2","1446","Application Data"
"146","0.496500","64.233.180.190","100.86.243.187","TCP","66","443  >  53804 [ACK] Seq=16684 Ack=16498 Win=1443 Len=0 TSval=2767314930 TSecr=4060375360"
"147","0.496527","64.233.180.190","100.86.243.187","TCP","66","443  >  53804 [ACK] Seq=16684 Ack=22648 Win=1454 Len=0 TSval=2767314931 TSecr=4060375360"
"157","0.523922","64.233.180.190","100.86.243.187","TLSv1.2","152","Application Data"
"158","0.524004","100.86.243.187","64.233.180.190","TCP","66","53804  >  443 [ACK] Seq=22648 Ack=16770 Win=32802 Len=0 TSval=4060375398 TSecr=2767314958"
"159","0.524601","64.233.180.190","100.86.243.187","TLSv1.2","1287","Application Data"
"160","0.524605","64.233.180.190","100.86.243.187","TLSv1.2","97","Application Data"
"161","0.524605","64.233.180.190","100.86.243.187","TLSv1.2","105","Application Data"
"162","0.524674","100.86.243.187","64.233.180.190","TCP","66","53804  >  443 [ACK] Seq=22648 Ack=18061 Win=32784 Len=0 TSval=4060375398 TSecr=2767314958"
"163","0.524888","100.86.243.187","64.233.180.190","TLSv1.2","105","Application Data"
"176","0.540554","64.233.180.190","100.86.243.187","TCP","66","443  >  53804 [ACK] Seq=18061 Ack=22687 Win=1462 Len=0 TSval=2767314975 TSecr=4060375398"
"1632","0.970488","100.86.243.187","64.233.180.190","TCP","1466","53804  >  443 [ACK] Seq=22687 Ack=18061 Win=32804 Len=1400 TSval=4060375845 TSecr=2767314975 [TCP PDU reassembled in 1635]"
"1633","0.970490","100.86.243.187","64.233.180.190","TCP","1466","53804  >  443 [ACK] Seq=24087 Ack=18061 Win=32804 Len=1400 TSval=4060375845 TSecr=2767314975 [TCP PDU reassembled in 1635]"
"1634","0.970492","100.86.243.187","64.233.180.190","TCP","1466","53804  >  443 [ACK] Seq=25487 Ack=18061 Win=32804 Len=1400 TSval=4060375845 TSecr=2767314975 [TCP PDU reassembled in 1635]"
"1635","0.970532","100.86.243.187","64.233.180.190","TLSv1.2","440","Application Data"
"1636","0.982025","64.233.180.190","100.86.243.187","TCP","66","443  >  53804 [ACK] Seq=18061 Ack=26887 Win=1462 Len=0 TSval=2767315416 TSecr=4060375845"
"1637","0.982028","64.233.180.190","100.86.243.187","TCP","66","443  >  53804 [ACK] Seq=18061 Ack=27261 Win=1462 Len=0 TSval=2767315416 TSecr=4060375845"
"1638","1.015322","64.233.180.190","100.86.243.187","TLSv1.2","147","Application Data"
"1639","1.015323","64.233.180.190","100.86.243.187","TLSv1.2","97","Application Data"
"1640","1.015323","64.233.180.190","100.86.243.187","TLSv1.2","105","Application Data"
"1641","1.015423","100.86.243.187","64.233.180.190","TCP","66","53804  >  443 [ACK] Seq=27261 Ack=18212 Win=32801 Len=0 TSval=4060375890 TSecr=2767315449"
"1642","1.015746","100.86.243.187","64.233.180.190","TLSv1.2","105","Application Data"
"1643","1.031714","64.233.180.190","100.86.243.187","TCP","66","443  >  53804 [ACK] Seq=18212 Ack=27300 Win=1462 Len=0 TSval=2767315466 TSecr=4060375890"
"1652","1.301548","64.233.180.190","100.86.243.187","TLSv1.2","627","Application Data"
"1653","1.301548","64.233.180.190","100.86.243.187","TLSv1.2","1466","Application Data"
"1654","1.301549","64.233.180.190","100.86.243.187","TLSv1.2","1466","Application Data"
"1655","1.301646","100.86.243.187","64.233.180.190","TCP","66","53804  >  443 [ACK] Seq=27300 Ack=21573 Win=32751 Len=0 TSval=4060376176 TSecr=2767315685"
"1656","1.301928","100.86.243.187","64.233.180.190","TCP","66","[TCP Window Update] 53804  >  443 [ACK] Seq=27300 Ack=21573 Win=32804 Len=0 TSval=4060376176 TSecr=2767315685"
"1657","1.303814","64.233.180.190","100.86.243.187","TLSv1.2","1466","Application Data"
"1658","1.303815","64.233.180.190","100.86.243.187","TLSv1.2","1466","Application Data"
"1659","1.303816","64.233.180.190","100.86.243.187","TLSv1.2","1466","Application Data"
"1660","1.303816","64.233.180.190","100.86.243.187","TLSv1.2","1466","Application Data"
"1661","1.303817","64.233.180.190","100.86.243.187","TLSv1.2","1466","Application Data"
"1662","1.303817","64.233.180.190","100.86.243.187","TLSv1.2","1466","Application Data"
"1663","1.303818","64.233.180.190","100.86.243.187","TLSv1.2","1466","Application Data"
"1664","1.303818","64.233.180.190","100.86.243.187","TLSv1.2","1466","Application Data"
"1665","1.303822","64.233.180.190","100.86.243.187","TLSv1.2","1247","Application Data"
"1666","1.303822","64.233.180.190","100.86.243.187","TLSv1.2","335","Application Data"
"1667","1.303823","64.233.180.190","100.86.243.187","TLSv1.2","1466","Application Data"
"1668","1.303823","64.233.180.190","100.86.243.187","TLSv1.2","1466","Application Data"
"1669","1.303824","64.233.180.190","100.86.243.187","TLSv1.2","1466","Application Data"
"1670","1.303824","64.233.180.190","100.86.243.187","TLSv1.2","1466","Application Data"
"1671","1.303825","64.233.180.190","100.86.243.187","TLSv1.2","1466","Application Data"
"1672","1.303825","64.233.180.190","100.86.243.187","TLSv1.2","1466","Application Data"
"1673","1.303826","64.233.180.190","100.86.243.187","TLSv1.2","1466","Application Data"
"1674","1.303827","64.233.180.190","100.86.243.187","TLSv1.2","1466","Application Data"
"1675","1.303828","64.233.180.190","100.86.243.187","TLSv1.2","1466","Application Data"
"1676","1.303828","64.233.180.190","100.86.243.187","TLSv1.2","1466","Application Data"
"1677","1.303829","64.233.180.190","100.86.243.187","TLSv1.2","1466","Application Data"
"1678","1.303829","64.233.180.190","100.86.243.187","TLSv1.2","1323","Application Data"
"1679","1.303830","64.233.180.190","100.86.243.187","TLSv1.2","1466","Application Data"
"1680","1.303830","64.233.180.190","100.86.243.187","TLSv1.2","1466","Application Data"
"1681","1.303831","64.233.180.190","100.86.243.187","TLSv1.2","1466","Application Data"
"1682","1.303832","64.233.180.190","100.86.243.187","TLSv1.2","1466","Application Data"
"1683","1.303832","64.233.180.190","100.86.243.187","TLSv1.2","1466","Application Data"
"1684","1.303833","64.233.180.190","100.86.243.187","TLSv1.2","1466","Application Data"
"1685","1.303896","64.233.180.190","100.86.243.187","TLSv1.2","1466","Application Data"
"1686","1.303897","64.233.180.190","100.86.243.187","TLSv1.2","1466","Application Data"
"1687","1.303944","100.86.243.187","64.233.180.190","TCP","66","53804  >  443 [ACK] Seq=27300 Ack=37023 Win=32562 Len=0 TSval=4060376178 TSecr=2767315686"
"1688","1.304006","100.86.243.187","64.233.180.190","TCP","66","53804  >  443 [ACK] Seq=27300 Ack=59280 Win=32215 Len=0 TSval=4060376178 TSecr=2767315687"
"1689","1.304022","100.86.243.187","64.233.180.190","TCP","66","53804  >  443 [ACK] Seq=27300 Ack=62080 Win=32193 Len=0 TSval=4060376178 TSecr=2767315687"
"1690","1.304039","64.233.180.190","100.86.243.187","TLSv1.2","1466","Application Data"
"1691","1.304040","64.233.180.190","100.86.243.187","TLSv1.2","1466","Application Data"
"1692","1.304117","100.86.243.187","64.233.180.190","TCP","66","53804  >  443 [ACK] Seq=27300 Ack=64880 Win=32321 Len=0 TSval=4060376178 TSecr=2767315688"
"1693","1.304162","64.233.180.190","100.86.243.187","TLSv1.2","1466","Application Data"
"1694","1.304163","64.233.180.190","100.86.243.187","TLSv1.2","1466","Application Data"
"1695","1.304199","100.86.243.187","64.233.180.190","TCP","66","53804  >  443 [ACK] Seq=27300 Ack=67680 Win=32420 Len=0 TSval=4060376178 TSecr=2767315688"
"1696","1.304443","100.86.243.187","64.233.180.190","TCP","66","[TCP Window Update] 53804  >  443 [ACK] Seq=27300 Ack=67680 Win=32804 Len=0 TSval=4060376178 TSecr=2767315688"
"1697","1.304555","64.233.180.190","100.86.243.187","TLSv1.2","1466","Application Data"
"1698","1.304556","64.233.180.190","100.86.243.187","TLSv1.2","1466","Application Data"
"1699","1.304557","64.233.180.190","100.86.243.187","TLSv1.2","1466","Application Data"
"1700","1.304557","64.233.180.190","100.86.243.187","TLSv1.2","1323","Application Data"
"1701","1.304615","100.86.243.187","64.233.180.190","TCP","66","53804  >  443 [ACK] Seq=27300 Ack=73137 Win=32718 Len=0 TSval=4060376178 TSecr=2767315688"
"1702","1.304693","64.233.180.190","100.86.243.187","TLSv1.2","1466","Application Data"
"1703","1.304693","64.233.180.190","100.86.243.187","TLSv1.2","1466","Application Data"
"1704","1.304736","100.86.243.187","64.233.180.190","TCP","66","[TCP Window Update] 53804  >  443 [ACK] Seq=27300 Ack=73137 Win=32804 Len=0 TSval=4060376178 TSecr=2767315688"
"1705","1.304760","100.86.243.187","64.233.180.190","TCP","66","53804  >  443 [ACK] Seq=27300 Ack=75937 Win=32760 Len=0 TSval=4060376178 TSecr=2767315689"
"1706","1.304792","64.233.180.190","100.86.243.187","TLSv1.2","1466","Application Data"
"1707","1.304792","64.233.180.190","100.86.243.187","TLSv1.2","1466","Application Data"
"1708","1.304813","100.86.243.187","64.233.180.190","TCP","66","[TCP Window Update] 53804  >  443 [ACK] Seq=27300 Ack=75937 Win=32804 Len=0 TSval=4060376178 TSecr=2767315689"
"1709","1.304860","100.86.243.187","64.233.180.190","TCP","66","53804  >  443 [ACK] Seq=27300 Ack=78737 Win=32760 Len=0 TSval=4060376178 TSecr=2767315689"
"1710","1.304940","100.86.243.187","64.233.180.190","TCP","66","[TCP Window Update] 53804  >  443 [ACK] Seq=27300 Ack=78737 Win=32804 Len=0 TSval=4060376179 TSecr=2767315689"
"1711","1.306462","64.233.180.190","100.86.243.187","TLSv1.2","1466","Application Data"
"1712","1.306463","64.233.180.190","100.86.243.187","TLSv1.2","1466","Application Data"
"1713","1.306464","64.233.180.190","100.86.243.187","TLSv1.2","1466","Application Data"
"1714","1.306464","64.233.180.190","100.86.243.187","TLSv1.2","970","Application Data"
"1715","1.306465","64.233.180.190","100.86.243.187","TLSv1.2","422","Application Data"
"1716","1.306465","64.233.180.190","100.86.243.187","TLSv1.2","1466","Application Data"
"1717","1.306469","64.233.180.190","100.86.243.187","TLSv1.2","105","Application Data"
"1718","1.306469","64.233.180.190","100.86.243.187","TLSv1.2","97","Application Data"
"1719","1.306469","64.233.180.190","100.86.243.187","TLSv1.2","105","Application Data"
"1720","1.306469","64.233.180.190","100.86.243.187","TCP","105","[TCP Retransmission] 443  >  53804 [PSH, ACK] Seq=85667 Ack=27300 Win=1462 Len=39 TSval=2767315720 TSecr=4060375890"
"1721","1.306546","100.86.243.187","64.233.180.190","TCP","66","53804  >  443 [ACK] Seq=27300 Ack=85706 Win=32695 Len=0 TSval=4060376181 TSecr=2767315693"
"1722","1.306614","100.86.243.187","64.233.180.190","TCP","78","[TCP Dup ACK 1721#1] 53804  >  443 [ACK] Seq=27300 Ack=85706 Win=32695 Len=0 TSval=4060376181 TSecr=2767315720 SLE=85667 SRE=85706"
"1723","1.306820","100.86.243.187","64.233.180.190","TCP","66","[TCP Window Update] 53804  >  443 [ACK] Seq=27300 Ack=85706 Win=32804 Len=0 TSval=4060376181 TSecr=2767315720"
"1724","1.306867","100.86.243.187","64.233.180.190","TLSv1.2","105","Application Data"
"1725","1.317797","64.233.180.190","100.86.243.187","TCP","66","443  >  53804 [ACK] Seq=85706 Ack=27339 Win=1462 Len=0 TSval=2767315751 TSecr=4060376181"
"1733","1.516603","100.86.243.187","64.233.180.190","TCP","1466","53804  >  443 [ACK] Seq=27339 Ack=85706 Win=32804 Len=1400 TSval=4060376390 TSecr=2767315751 [TCP PDU reassembled in 1735]"
"1734","1.516604","100.86.243.187","64.233.180.190","TCP","1466","53804  >  443 [ACK] Seq=28739 Ack=85706 Win=32804 Len=1400 TSval=4060376390 TSecr=2767315751 [TCP PDU reassembled in 1735]"
"1735","1.516617","100.86.243.187","64.233.180.190","TLSv1.2","241","Application Data"
"1741","1.528018","64.233.180.190","100.86.243.187","TCP","66","443  >  53804 [ACK] Seq=85706 Ack=30314 Win=1462 Len=0 TSval=2767315962 TSecr=4060376390"
"1742","1.528019","64.233.180.190","100.86.243.187","TLSv1.2","146","Application Data"
"1743","1.528059","100.86.243.187","64.233.180.190","TCP","66","53804  >  443 [ACK] Seq=30314 Ack=85786 Win=32803 Len=0 TSval=4060376402 TSecr=2767315962"
"1744","1.528246","100.86.243.187","64.233.180.190","TLSv1.2","105","Application Data"
"1745","1.543612","64.233.180.190","100.86.243.187","TCP","66","443  >  53804 [ACK] Seq=85786 Ack=30353 Win=1462 Len=0 TSval=2767315978 TSecr=4060376402"
"1750","1.995772","100.86.243.187","64.233.180.190","TCP","1466","53804  >  443 [ACK] Seq=30353 Ack=85786 Win=32804 Len=1400 TSval=4060376870 TSecr=2767315978 [TCP PDU reassembled in 1753]"
"1751","1.995775","100.86.243.187","64.233.180.190","TCP","1466","53804  >  443 [ACK] Seq=31753 Ack=85786 Win=32804 Len=1400 TSval=4060376870 TSecr=2767315978 [TCP PDU reassembled in 1753]"
"1752","1.995776","100.86.243.187","64.233.180.190","TCP","1466","53804  >  443 [ACK] Seq=33153 Ack=85786 Win=32804 Len=1400 TSval=4060376870 TSecr=2767315978 [TCP PDU reassembled in 1753]"
"1753","1.995819","100.86.243.187","64.233.180.190","TLSv1.2","428","Application Data"
"1754","1.995954","100.86.243.187","64.233.180.190","TCP","1466","53804  >  443 [ACK] Seq=34915 Ack=85786 Win=32804 Len=1400 TSval=4060376870 TSecr=2767315978 [TCP PDU reassembled in 1756]"
"1755","1.995956","100.86.243.187","64.233.180.190","TCP","1466","53804  >  443 [ACK] Seq=36315 Ack=85786 Win=32804 Len=1400 TSval=4060376870 TSecr=2767315978 [TCP PDU reassembled in 1756]"
"1756","1.995970","100.86.243.187","64.233.180.190","TLSv1.2","1166","Application Data"
"1757","2.024080","100.86.243.187","64.233.180.190","TCP","1466","[TCP Retransmission] 53804  >  443 [PSH, ACK] Seq=37415 Ack=85786 Win=32804 Len=1400 TSval=4060376898 TSecr=2767315978 [TCP PDU reassembled in 1756]"
"1758","2.094761","64.233.180.190","100.86.243.187","TCP","66","443  >  53804 [ACK] Seq=85786 Ack=34915 Win=1462 Len=0 TSval=2767316528 TSecr=4060376870"
"1759","2.094762","64.233.180.190","100.86.243.187","TCP","66","443  >  53804 [ACK] Seq=85786 Ack=38815 Win=1454 Len=0 TSval=2767316528 TSecr=4060376870"
"1760","2.094763","64.233.180.190","100.86.243.187","TCP","78","[TCP Dup ACK 1759#1] 443  >  53804 [ACK] Seq=85786 Ack=38815 Win=1454 Len=0 TSval=2767316528 TSecr=4060376898 SLE=37415 SRE=38815"
"1770","2.139717","64.233.180.190","100.86.243.187","TLSv1.2","154","Application Data"
"1771","2.139718","64.233.180.190","100.86.243.187","TLSv1.2","97","Application Data"
"1772","2.139718","64.233.180.190","100.86.243.187","TLSv1.2","105","Application Data"
"1773","2.139833","100.86.243.187","64.233.180.190","TCP","66","53804  >  443 [ACK] Seq=38815 Ack=85944 Win=32801 Len=0 TSval=4060377014 TSecr=2767316572"
"1774","2.140341","100.86.243.187","64.233.180.190","TLSv1.2","105","Application Data"
"1775","2.153134","64.233.180.190","100.86.243.187","TCP","66","443  >  53804 [ACK] Seq=85944 Ack=38854 Win=1462 Len=0 TSval=2767316586 TSecr=4060377014"
"3788","9.105329","100.86.243.187","64.233.180.190","TCP","1466","53804  >  443 [ACK] Seq=38854 Ack=85944 Win=32804 Len=1400 TSval=4060383979 TSecr=2767316586 [TCP PDU reassembled in 3790]"
"3789","9.105331","100.86.243.187","64.233.180.190","TCP","1466","53804  >  443 [ACK] Seq=40254 Ack=85944 Win=32804 Len=1400 TSval=4060383979 TSecr=2767316586 [TCP PDU reassembled in 3790]"
"3790","9.105373","100.86.243.187","64.233.180.190","TLSv1.2","400","Application Data"
"3791","9.119691","64.233.180.190","100.86.243.187","TCP","66","443  >  53804 [ACK] Seq=85944 Ack=41988 Win=1457 Len=0 TSval=2767323552 TSecr=4060383979"
"3792","9.152416","64.233.180.190","100.86.243.187","TLSv1.2","148","Application Data"
"3793","9.152609","100.86.243.187","64.233.180.190","TCP","66","53804  >  443 [ACK] Seq=41988 Ack=86026 Win=32802 Len=0 TSval=4060384027 TSecr=2767323579"
"3794","9.152784","64.233.180.190","100.86.243.187","TLSv1.2","97","Application Data"
"3795","9.152786","64.233.180.190","100.86.243.187","TLSv1.2","105","Application Data"
"3796","9.152916","100.86.243.187","64.233.180.190","TCP","66","53804  >  443 [ACK] Seq=41988 Ack=86096 Win=32803 Len=0 TSval=4060384027 TSecr=2767323579"
"3797","9.153487","100.86.243.187","64.233.180.190","TLSv1.2","105","Application Data"
"3798","9.170379","64.233.180.190","100.86.243.187","TCP","66","443  >  53804 [ACK] Seq=86096 Ack=42027 Win=1462 Len=0 TSval=2767323603 TSecr=4060384027"
