"No.","Time","Source","Destination","Protocol","Length","Info"
"3","0.279200","172.253.122.93","100.86.243.187","TLSv1.2","144","Application Data"
"4","0.279295","100.86.243.187","172.253.122.93","TCP","66","56045  >  443 [ACK] Seq=1 Ack=79 Win=8281 Len=0 TSval=758534791 TSecr=960944173"
"5","0.280230","172.253.122.93","100.86.243.187","TLSv1.2","1466","Application Data"
"6","0.280231","172.253.122.93","100.86.243.187","TLSv1.2","1466","Application Data"
"7","0.280232","172.253.122.93","100.86.243.187","TLSv1.2","1466","Application Data"
"8","0.280233","172.253.122.93","100.86.243.187","TLSv1.2","1466","Application Data"
"9","0.280233","172.253.122.93","100.86.243.187","TLSv1.2","1466","Application Data"
"10","0.280234","172.253.122.93","100.86.243.187","TLSv1.2","1466","Application Data"
"11","0.280235","172.253.122.93","100.86.243.187","TLSv1.2","349","Application Data"
"12","0.280236","172.253.122.93","100.86.243.187","TLSv1.2","1466","Application Data"
"13","0.280236","172.253.122.93","100.86.243.187","TLSv1.2","1466","Application Data"
"14","0.280237","172.253.122.93","100.86.243.187","TLSv1.2","1466","Application Data"
"15","0.280238","172.253.122.93","100.86.243.187","TLSv1.2","1466","Application Data"
"16","0.280238","172.253.122.93","100.86.243.187","TLSv1.2","1466","Application Data"
"17","0.280239","172.253.122.93","100.86.243.187","TLSv1.2","1466","Application Data"
"18","0.280240","172.253.122.93","100.86.243.187","TLSv1.2","468","Application Data"
"19","0.280240","172.253.122.93","100.86.243.187","TLSv1.2","1466","Application Data"
"20","0.280241","172.253.122.93","100.86.243.187","TLSv1.2","1411","Application Data"
"21","0.280242","172.253.122.93","100.86.243.187","TLSv1.2","1466","Application Data"
"22","0.280243","172.253.122.93","100.86.243.187","TLSv1.2","1466","Application Data"
"23","0.280244","172.253.122.93","100.86.243.187","TLSv1.2","137","Application Data"
"24","0.280244","172.253.122.93","100.86.243.187","TLSv1.2","1466","Application Data"
"25","0.280245","172.253.122.93","100.86.243.187","TLSv1.2","1265","Application Data"
"26","0.280246","172.253.122.93","100.86.243.187","TLSv1.2","1466","Application Data"
"27","0.280247","172.253.122.93","100.86.243.187","TLSv1.2","1363","Application Data"
"28","0.280248","172.253.122.93","100.86.243.187","TLSv1.2","1466","Application Data"
"29","0.280248","172.253.122.93","100.86.243.187","TLSv1.2","1466","Application Data"
"30","0.280249","172.253.122.93","100.86.243.187","TLSv1.2","924","Application Data"
"31","0.280250","172.253.122.93","100.86.243.187","TLSv1.2","1466","Application Data"
"32","0.280250","172.253.122.93","100.86.243.187","TLSv1.2","1269","Application Data"
"33","0.280895","100.86.243.187","172.253.122.93","TCP","66","56045  >  443 [ACK] Seq=1 Ack=34737 Win=8282 Len=0 TSval=758534792 TSecr=960944202"
"34","0.280952","172.253.122.93","100.86.243.187","TLSv1.2","1466","Application Data"
"35","0.280952","172.253.122.93","100.86.243.187","TLSv1.2","1466","Application Data"
"36","0.280953","172.253.122.93","100.86.243.187","TLSv1.2","460","Application Data"
"37","0.280953","172.253.122.93","100.86.243.187","TLSv1.2","1466","Application Data"
"38","0.280954","172.253.122.93","100.86.243.187","TLSv1.2","1466","Application Data"
"39","0.280955","172.253.122.93","100.86.243.187","TLSv1.2","1466","Application Data"
"40","0.280956","172.253.122.93","100.86.243.187","TLSv1.2","1466","Application Data"
"41","0.280957","172.253.122.93","100.86.243.187","TLSv1.2","1466","Application Data"
"42","0.280957","172.253.122.93","100.86.243.187","TLSv1.2","1362","Application Data"
"43","0.280959","172.253.122.93","100.86.243.187","TLSv1.2","1466","Application Data"
"44","0.280959","172.253.122.93","100.86.243.187","TLSv1.2","938","Application Data"
"45","0.280960","172.253.122.93","100.86.243.187","TLSv1.2","1466","Application Data"
"46","0.281022","100.86.243.187","172.253.122.93","TCP","66","56045  >  443 [ACK] Seq=1 Ack=49899 Win=8045 Len=0 TSval=758534792 TSecr=960944204"
"47","0.281096","172.253.122.93","100.86.243.187","TLSv1.2","1466","Application Data"
"48","0.281097","172.253.122.93","100.86.243.187","TLSv1.2","1466","Application Data"
"49","0.281140","100.86.243.187","172.253.122.93","TCP","66","56045  >  443 [ACK] Seq=1 Ack=52699 Win=8051 Len=0 TSval=758534792 TSecr=960944204"
"50","0.281231","100.86.243.187","172.253.122.93","TCP","66","[TCP Window Update] 56045  >  443 [ACK] Seq=1 Ack=52699 Win=8282 Len=0 TSval=758534792 TSecr=960944204"
"51","0.282721","172.253.122.93","100.86.243.187","TLSv1.2","1350","Application Data"
"52","0.282723","172.253.122.93","100.86.243.187","TLSv1.2","1466","Application Data"
"53","0.282723","172.253.122.93","100.86.243.187","TLSv1.2","1466","Application Data"
"54","0.282724","172.253.122.93","100.86.243.187","TLSv1.2","1466","Application Data"
"55","0.282729","172.253.122.93","100.86.243.187","TLSv1.2","138","Application Data"
"56","0.282729","172.253.122.93","100.86.243.187","TLSv1.2","101","Application Data"
"57","0.282730","172.253.122.93","100.86.243.187","TLSv1.2","1466","Application Data"
"58","0.282730","172.253.122.93","100.86.243.187","TLSv1.2","1466","Application Data"
"59","0.282731","172.253.122.93","100.86.243.187","TLSv1.2","1466","Application Data"
"60","0.282732","172.253.122.93","100.86.243.187","TLSv1.2","1466","Application Data"
"61","0.282732","172.253.122.93","100.86.243.187","TLSv1.2","1466","Application Data"
"62","0.282733","172.253.122.93","100.86.243.187","TLSv1.2","1466","Application Data"
"63","0.282733","172.253.122.93","100.86.243.187","TLSv1.2","1466","Application Data"
"64","0.282734","172.253.122.93","100.86.243.187","TLSv1.2","1466","Application Data"
"65","0.282735","172.253.122.93","100.86.243.187","TLSv1.2","1466","Application Data"
"66","0.282735","172.253.122.93","100.86.243.187","TLSv1.2","1466","Application Data"
"67","0.282736","172.253.122.93","100.86.243.187","TLSv1.2","1466","Application Data"
"68","0.282737","172.253.122.93","100.86.243.187","TLSv1.2","354","Application Data"
"69","0.282855","100.86.243.187","172.253.122.93","TCP","66","56045  >  443 [ACK] Seq=1 Ack=68090 Win=8041 Len=0 TSval=758534795 TSecr=960944207"
"70","0.283176","100.86.243.187","172.253.122.93","TCP","66","56045  >  443 [ACK] Seq=1 Ack=73978 Win=8282 Len=0 TSval=758534795 TSecr=960944207"
"71","0.284051","172.253.122.93","100.86.243.187","TLSv1.2","1466","Application Data"
"72","0.284053","172.253.122.93","100.86.243.187","TLSv1.2","1466","Application Data"
"73","0.284054","172.253.122.93","100.86.243.187","TLSv1.2","396","Application Data"
"74","0.284055","172.253.122.93","100.86.243.187","TLSv1.2","1466","Application Data"
"75","0.284056","172.253.122.93","100.86.243.187","TLSv1.2","1466","Application Data"
"76","0.284057","172.253.122.93","100.86.243.187","TLSv1.2","1466","Application Data"
"77","0.284057","172.253.122.93","100.86.243.187","TLSv1.2","1466","Application Data"
"78","0.284058","172.253.122.93","100.86.243.187","TLSv1.2","1466","Application Data"
"79","0.284059","172.253.122.93","100.86.243.187","TLSv1.2","1466","Application Data"
"80","0.284060","172.253.122.93","100.86.243.187","TLSv1.2","648","Application Data"
"81","0.284060","172.253.122.93","100.86.243.187","TLSv1.2","1466","Application Data"
"82","0.284061","172.253.122.93","100.86.243.187","TLSv1.2","1466","Application Data"
"83","0.284062","172.253.122.93","100.86.243.187","TLSv1.2","676","Application Data"
"84","0.284062","172.253.122.93","100.86.243.187","TLSv1.2","1466","Application Data"
"85","0.284063","172.253.122.93","100.86.243.187","TLSv1.2","1466","Application Data"
"86","0.284064","172.253.122.93","100.86.243.187","TLSv1.2","1466","Application Data"
"87","0.284065","172.253.122.93","100.86.243.187","TLSv1.2","1466","Application Data"
"88","0.284065","172.253.122.93","100.86.243.187","TLSv1.2","300","Application Data"
"89","0.284066","172.253.122.93","100.86.243.187","TLSv1.2","1466","Application Data"
"90","0.284067","172.253.122.93","100.86.243.187","TLSv1.2","1326","Application Data"
"91","0.284067","172.253.122.93","100.86.243.187","TLSv1.2","1466","Application Data"
"92","0.284069","172.253.122.93","100.86.243.187","TLSv1.2","1466","Application Data"
"93","0.284069","172.253.122.93","100.86.243.187","TLSv1.2","1466","Application Data"
"94","0.284070","172.253.122.93","100.86.243.187","TLSv1.2","217","Application Data"
"95","0.284509","100.86.243.187","172.253.122.93","TCP","66","56045  >  443 [ACK] Seq=1 Ack=102345 Win=8282 Len=0 TSval=758534796 TSecr=960944208"
"96","0.285210","172.253.122.93","100.86.243.187","TLSv1.2","1466","Application Data"
"97","0.285212","172.253.122.93","100.86.243.187","TLSv1.2","1466","Application Data"
"98","0.285212","172.253.122.93","100.86.243.187","TLSv1.2","249","Application Data"
"99","0.285213","172.253.122.93","100.86.243.187","TLSv1.2","1466","Application Data"
"100","0.285214","172.253.122.93","100.86.243.187","TLSv1.2","1466","Application Data"
"101","0.285214","172.253.122.93","100.86.243.187","TLSv1.2","484","Application Data"
"102","0.285215","172.253.122.93","100.86.243.187","TLSv1.2","1466","Application Data"
"103","0.285216","172.253.122.93","100.86.243.187","TLSv1.2","1466","Application Data"
"104","0.285216","172.253.122.93","100.86.243.187","TLSv1.2","925","Application Data"
"105","0.285217","172.253.122.93","100.86.243.187","TLSv1.2","1466","Application Data"
"106","0.285218","172.253.122.93","100.86.243.187","TLSv1.2","1466","Application Data"
"107","0.285219","172.253.122.93","100.86.243.187","TLSv1.2","1466","Application Data"
"108","0.285219","172.253.122.93","100.86.243.187","TLSv1.2","758","Application Data"
"109","0.285220","172.253.122.93","100.86.243.187","TLSv1.2","1439","Application Data"
"110","0.285221","172.253.122.93","100.86.243.187","TLSv1.2","1466","Application Data"
"111","0.285221","172.253.122.93","100.86.243.187","TLSv1.2","1466","Application Data"
"112","0.285222","172.253.122.93","100.86.243.187","TLSv1.2","1466","Application Data"
"113","0.285223","172.253.122.93","100.86.243.187","TLSv1.2","755","Application Data"
"114","0.285224","172.253.122.93","100.86.243.187","TLSv1.2","1466","Application Data"
"115","0.285224","172.253.122.93","100.86.243.187","TLSv1.2","1466","Application Data"
"116","0.285225","172.253.122.93","100.86.243.187","TLSv1.2","249","Application Data"
"117","0.285225","172.253.122.93","100.86.243.187","TLSv1.2","1466","Application Data"
"118","0.285226","172.253.122.93","100.86.243.187","TLSv1.2","1466","Application Data"
"119","0.285226","172.253.122.93","100.86.243.187","TLSv1.2","178","Application Data"
"120","0.285227","172.253.122.93","100.86.243.187","TLSv1.2","1466","Application Data"
"121","0.285228","172.253.122.93","100.86.243.187","TLSv1.2","1466","Application Data"
"122","0.285284","172.253.122.93","100.86.243.187","TLSv1.2","1466","Application Data"
"123","0.285286","172.253.122.93","100.86.243.187","TLSv1.2","1466","Application Data"
"124","0.285564","172.253.122.93","100.86.243.187","TLSv1.2","284","Application Data"
"125","0.285565","172.253.122.93","100.86.243.187","TLSv1.2","1466","Application Data"
"126","0.285567","172.253.122.93","100.86.243.187","TLSv1.2","1466","Application Data"
"127","0.285569","172.253.122.93","100.86.243.187","TLSv1.2","1466","Application Data"
"128","0.285621","172.253.122.93","100.86.243.187","TLSv1.2","1466","Application Data"
"129","0.285622","172.253.122.93","100.86.243.187","TLSv1.2","1466","Application Data"
"130","0.285853","172.253.122.93","100.86.243.187","TLSv1.2","158","Application Data"
"131","0.285853","172.253.122.93","100.86.243.187","TLSv1.2","1466","Application Data"
"132","0.285855","172.253.122.93","100.86.243.187","TLSv1.2","1466","Application Data"
"133","0.285857","172.253.122.93","100.86.243.187","TLSv1.2","1466","Application Data"
"134","0.285883","100.86.243.187","172.253.122.93","TCP","66","56045  >  443 [ACK] Seq=1 Ack=142072 Win=8282 Len=0 TSval=758534797 TSecr=960944210"
"135","0.285928","100.86.243.187","172.253.122.93","TCP","66","56045  >  443 [ACK] Seq=1 Ack=146364 Win=8282 Len=0 TSval=758534797 TSecr=960944213"
"136","0.286094","172.253.122.93","100.86.243.187","TLSv1.2","1466","Application Data"
"137","0.286095","172.253.122.93","100.86.243.187","TLSv1.2","1466","Application Data"
"138","0.286117","172.253.122.93","100.86.243.187","TLSv1.2","1466","Application Data"
"139","0.286118","172.253.122.93","100.86.243.187","TLSv1.2","1466","Application Data"
"140","0.286216","100.86.243.187","172.253.122.93","TCP","66","56045  >  443 [ACK] Seq=1 Ack=151964 Win=8282 Len=0 TSval=758534797 TSecr=960944213"
"141","0.287683","172.253.122.93","100.86.243.187","TLSv1.2","1466","Application Data"
"142","0.287685","172.253.122.93","100.86.243.187","TLSv1.2","1466","Application Data"
"143","0.287686","172.253.122.93","100.86.243.187","TLSv1.2","1466","Application Data"
"144","0.287687","172.253.122.93","100.86.243.187","TLSv1.2","1466","Application Data"
"145","0.287895","100.86.243.187","172.253.122.93","TCP","66","56045  >  443 [ACK] Seq=1 Ack=157564 Win=8282 Len=0 TSval=758534800 TSecr=960944214"
"146","0.289477","172.253.122.93","100.86.243.187","TLSv1.2","1466","Application Data"
"147","0.289478","172.253.122.93","100.86.243.187","TLSv1.2","1202","Application Data"
"148","0.289479","172.253.122.93","100.86.243.187","TLSv1.2","1466","Application Data"
"149","0.289480","172.253.122.93","100.86.243.187","TLSv1.2","1466","Application Data"
"150","0.289481","172.253.122.93","100.86.243.187","TLSv1.2","1466","Application Data"
"151","0.289482","172.253.122.93","100.86.243.187","TLSv1.2","1466","Application Data"
"152","0.289483","172.253.122.93","100.86.243.187","TLSv1.2","1466","Application Data"
"153","0.289483","172.253.122.93","100.86.243.187","TLSv1.2","1466","Application Data"
"154","0.289484","172.253.122.93","100.86.243.187","TLSv1.2","1466","Application Data"
"155","0.289485","172.253.122.93","100.86.243.187","TLSv1.2","1466","Application Data"
"156","0.289486","172.253.122.93","100.86.243.187","TLSv1.2","1466","Application Data"
"157","0.289486","172.253.122.93","100.86.243.187","TLSv1.2","299","Application Data"
"158","0.289487","172.253.122.93","100.86.243.187","TLSv1.2","1466","Application Data"
"159","0.289487","172.253.122.93","100.86.243.187","TLSv1.2","1061","Application Data, Application Data, Application Data"
"160","0.289488","172.253.122.93","100.86.243.187","TLSv1.2","105","Application Data"
"161","0.289908","100.86.243.187","172.253.122.93","TCP","66","56045  >  443 [ACK] Seq=1 Ack=175367 Win=8282 Len=0 TSval=758534801 TSecr=960944214"
"162","0.289975","100.86.243.187","172.253.122.93","TLSv1.2","105","Application Data"
"163","0.300961","172.253.122.93","100.86.243.187","TCP","66","443  >  56045 [ACK] Seq=175367 Ack=40 Win=1458 Len=0 TSval=960944241 TSecr=758534801"
"164","0.303337","100.86.243.187","172.253.122.93","TCP","1466","56045  >  443 [ACK] Seq=40 Ack=175367 Win=8282 Len=1400 TSval=758534815 TSecr=960944241 [TCP PDU reassembled in 165]"
"165","0.303376","100.86.243.187","172.253.122.93","TLSv1.2","590","Application Data"
"166","0.314242","172.253.122.93","100.86.243.187","TCP","78","[TCP Dup ACK 163#1] 443  >  56045 [ACK] Seq=175367 Ack=40 Win=1458 Len=0 TSval=960944255 TSecr=758534801 SLE=1440 SRE=1964"
"167","0.314243","172.253.122.93","100.86.243.187","TCP","66","443  >  56045 [ACK] Seq=175367 Ack=1964 Win=1451 Len=0 TSval=960944255 TSecr=758534815"
"168","0.370711","172.253.122.93","100.86.243.187","TLSv1.2","623","Application Data"
"169","0.370901","100.86.243.187","172.253.122.93","TCP","66","56045  >  443 [ACK] Seq=1964 Ack=175924 Win=8273 Len=0 TSval=758534883 TSecr=960944311"
"170","0.372472","172.253.122.93","100.86.243.187","TLSv1.2","1466","Application Data"
"171","0.372473","172.253.122.93","100.86.243.187","TLSv1.2","1466","Application Data"
"172","0.372474","172.253.122.93","100.86.243.187","TLSv1.2","630","Application Data"
"173","0.372474","172.253.122.93","100.86.243.187","TLSv1.2","98","Application Data"
"174","0.372475","172.253.122.93","100.86.243.187","TLSv1.2","97","Application Data"
"175","0.372475","172.253.122.93","100.86.243.187","TLSv1.2","105","Application Data"
"176","0.372729","100.86.243.187","172.253.122.93","TCP","66","56045  >  443 [ACK] Seq=1964 Ack=179390 Win=8282 Len=0 TSval=758534884 TSecr=960944311"
"177","0.372783","100.86.243.187","172.253.122.93","TLSv1.2","105","Application Data"
"180","0.388102","172.253.122.93","100.86.243.187","TCP","66","443  >  56045 [ACK] Seq=179390 Ack=2003 Win=1458 Len=0 TSval=960944324 TSecr=758534884"
"181","0.973539","100.86.243.187","172.253.122.93","TLSv1.2","534","Application Data"
"182","0.973926","100.86.243.187","172.253.122.93","TCP","1466","56045  >  443 [ACK] Seq=2471 Ack=179390 Win=8282 Len=1400 TSval=758535485 TSecr=960944324 [TCP PDU reassembled in 183]"
"183","0.973947","100.86.243.187","172.253.122.93","TLSv1.2","211","Application Data"
"184","0.978064","100.86.243.187","172.253.122.93","TLSv1.2","101","Application Data"
"185","0.978537","100.86.243.187","172.253.122.93","TLSv1.2","101","Application Data"
"186","0.991276","172.253.122.93","100.86.243.187","TCP","66","443  >  56045 [ACK] Seq=179390 Ack=2471 Win=1457 Len=0 TSval=960944931 TSecr=758535485"
"187","0.991277","172.253.122.93","100.86.243.187","TCP","78","[TCP Dup ACK 186#1] 443  >  56045 [ACK] Seq=179390 Ack=2471 Win=1457 Len=0 TSval=960944931 TSecr=758535485 SLE=3871 SRE=4016"
"188","0.991277","172.253.122.93","100.86.243.187","TCP","66","443  >  56045 [ACK] Seq=179390 Ack=4016 Win=1451 Len=0 TSval=960944931 TSecr=758535485"
"189","0.991278","172.253.122.93","100.86.243.187","TLSv1.2","155","Application Data"
"190","0.991279","172.253.122.93","100.86.243.187","TLSv1.2","1466","Application Data"
"191","0.991647","100.86.243.187","172.253.122.93","TCP","66","56045  >  443 [ACK] Seq=4086 Ack=180879 Win=8259 Len=0 TSval=758535503 TSecr=960944932"
"192","0.991750","172.253.122.93","100.86.243.187","TLSv1.2","1466","Application Data"
"193","0.991752","172.253.122.93","100.86.243.187","TLSv1.2","1466","Application Data"
"194","0.991757","172.253.122.93","100.86.243.187","TLSv1.2","983","Application Data"
"195","0.991759","172.253.122.93","100.86.243.187","TLSv1.2","105","Application Data"
"196","0.991812","172.253.122.93","100.86.243.187","TLSv1.2","155","Application Data"
"197","0.991813","172.253.122.93","100.86.243.187","TLSv1.2","1466","Application Data"
"198","0.991891","100.86.243.187","172.253.122.93","TCP","66","56045  >  443 [ACK] Seq=4086 Ack=184635 Win=8201 Len=0 TSval=758535503 TSecr=960944932"
"199","0.991993","100.86.243.187","172.253.122.93","TCP","66","[TCP Window Update] 56045  >  443 [ACK] Seq=4086 Ack=184635 Win=8282 Len=0 TSval=758535503 TSecr=960944932"
"200","0.992027","100.86.243.187","172.253.122.93","TLSv1.2","105","Application Data"
"201","0.992092","100.86.243.187","172.253.122.93","TCP","66","56045  >  443 [ACK] Seq=4125 Ack=186124 Win=8259 Len=0 TSval=758535503 TSecr=960944932"
"202","0.993061","172.253.122.93","100.86.243.187","TLSv1.2","1466","Application Data"
"203","0.993064","172.253.122.93","100.86.243.187","TLSv1.2","555","Application Data"
"204","0.993264","100.86.243.187","172.253.122.93","TCP","66","56045  >  443 [ACK] Seq=4125 Ack=188013 Win=8252 Len=0 TSval=758535505 TSecr=960944933"
"205","0.993729","172.253.122.93","100.86.243.187","TCP","66","443  >  56045 [ACK] Seq=188013 Ack=4086 Win=1458 Len=0 TSval=960944933 TSecr=758535490"
"206","1.008909","172.253.122.93","100.86.243.187","TCP","66","443  >  56045 [ACK] Seq=188013 Ack=4125 Win=1458 Len=0 TSval=960944949 TSecr=758535503"
"211","1.199384","100.86.243.187","172.253.122.93","TLSv1.2","778","Application Data"
"212","1.199453","100.86.243.187","172.253.122.93","TCP","1466","56045  >  443 [ACK] Seq=4837 Ack=188013 Win=8282 Len=1400 TSval=758535711 TSecr=960944949 [TCP PDU reassembled in 213]"
"213","1.199464","100.86.243.187","172.253.122.93","TLSv1.2","1272","Application Data"
"214","1.210967","172.253.122.93","100.86.243.187","TCP","66","443  >  56045 [ACK] Seq=188013 Ack=4837 Win=1456 Len=0 TSval=960945151 TSecr=758535711"
"215","1.210968","172.253.122.93","100.86.243.187","TCP","66","443  >  56045 [ACK] Seq=188013 Ack=6237 Win=1452 Len=0 TSval=960945151 TSecr=758535711"
"216","1.210996","172.253.122.93","100.86.243.187","TCP","66","443  >  56045 [ACK] Seq=188013 Ack=7443 Win=1448 Len=0 TSval=960945151 TSecr=758535711"
"229","1.247228","172.253.122.93","100.86.243.187","TLSv1.2","149","Application Data"
"230","1.247317","100.86.243.187","172.253.122.93","TCP","66","56045  >  443 [ACK] Seq=7443 Ack=188096 Win=8281 Len=0 TSval=758535759 TSecr=960945188"
"231","1.247799","172.253.122.93","100.86.243.187","TLSv1.2","1466","Application Data"
"232","1.247800","172.253.122.93","100.86.243.187","TLSv1.2","1466","Application Data"
"233","1.247801","172.253.122.93","100.86.243.187","TLSv1.2","1466","Application Data"
"234","1.247856","100.86.243.187","172.253.122.93","TCP","66","56045  >  443 [ACK] Seq=7443 Ack=192296 Win=8216 Len=0 TSval=758535759 TSecr=960945188"
"235","1.247964","100.86.243.187","172.253.122.93","TCP","66","[TCP Window Update] 56045  >  443 [ACK] Seq=7443 Ack=192296 Win=8282 Len=0 TSval=758535759 TSecr=960945188"
"236","1.248523","172.253.122.93","100.86.243.187","TLSv1.2","1466","Application Data"
"237","1.248524","172.253.122.93","100.86.243.187","TLSv1.2","1466","Application Data"
"238","1.248577","100.86.243.187","172.253.122.93","TCP","66","56045  >  443 [ACK] Seq=7443 Ack=195096 Win=8238 Len=0 TSval=758535760 TSecr=960945188"
"239","1.248664","100.86.243.187","172.253.122.93","TCP","66","[TCP Window Update] 56045  >  443 [ACK] Seq=7443 Ack=195096 Win=8282 Len=0 TSval=758535760 TSecr=960945188"
"240","1.249912","172.253.122.93","100.86.243.187","TLSv1.2","1466","Application Data"
"241","1.249913","172.253.122.93","100.86.243.187","TLSv1.2","1466","Application Data"
"242","1.249914","172.253.122.93","100.86.243.187","TLSv1.2","1466","Application Data"
"243","1.249914","172.253.122.93","100.86.243.187","TLSv1.2","1466","Application Data"
"244","1.249915","172.253.122.93","100.86.243.187","TLSv1.2","1466","Application Data"
"245","1.249917","172.253.122.93","100.86.243.187","TLSv1.2","1333","Application Data"
"246","1.249918","172.253.122.93","100.86.243.187","TLSv1.2","1466","Application Data"
"247","1.249919","172.253.122.93","100.86.243.187","TLSv1.2","1466","Application Data"
"248","1.249919","172.253.122.93","100.86.243.187","TLSv1.2","1466","Application Data"
"249","1.249920","172.253.122.93","100.86.243.187","TLSv1.2","1466","Application Data"
"250","1.249920","172.253.122.93","100.86.243.187","TLSv1.2","1466","Application Data"
"251","1.249921","172.253.122.93","100.86.243.187","TLSv1.2","1466","Application Data"
"252","1.249922","172.253.122.93","100.86.243.187","TLSv1.2","1466","Application Data"
"253","1.249922","172.253.122.93","100.86.243.187","TLSv1.2","1466","Application Data"
"254","1.249923","172.253.122.93","100.86.243.187","TLSv1.2","1466","Application Data"
"255","1.249924","172.253.122.93","100.86.243.187","TLSv1.2","1466","Application Data"
"256","1.249924","172.253.122.93","100.86.243.187","TLSv1.2","1466","Application Data"
"257","1.249925","172.253.122.93","100.86.243.187","TLSv1.2","299","Application Data"
"258","1.250029","100.86.243.187","172.253.122.93","TCP","66","56045  >  443 [ACK] Seq=7443 Ack=210363 Win=8043 Len=0 TSval=758535762 TSecr=960945188"
"259","1.250132","100.86.243.187","172.253.122.93","TCP","66","56045  >  443 [ACK] Seq=7443 Ack=218996 Win=7908 Len=0 TSval=758535762 TSecr=960945189"
"260","1.250392","100.86.243.187","172.253.122.93","TCP","66","[TCP Window Update] 56045  >  443 [ACK] Seq=7443 Ack=218996 Win=8282 Len=0 TSval=758535762 TSecr=960945189"
"261","1.250801","172.253.122.93","100.86.243.187","TLSv1.2","97","Application Data"
"262","1.250802","172.253.122.93","100.86.243.187","TLSv1.2","105","Application Data"
"263","1.250862","100.86.243.187","172.253.122.93","TCP","66","56045  >  443 [ACK] Seq=7443 Ack=219066 Win=8281 Len=0 TSval=758535762 TSecr=960945189"
"264","1.251086","100.86.243.187","172.253.122.93","TLSv1.2","105","Application Data"
"265","1.266971","172.253.122.93","100.86.243.187","TCP","66","443  >  56045 [ACK] Seq=219066 Ack=7482 Win=1458 Len=0 TSval=960945207 TSecr=758535763"
"318","1.596173","100.86.243.187","172.253.122.93","TCP","1466","56045  >  443 [ACK] Seq=7482 Ack=219066 Win=8282 Len=1400 TSval=758536108 TSecr=960945207 [TCP PDU reassembled in 320]"
"319","1.596179","100.86.243.187","172.253.122.93","TCP","1466","56045  >  443 [ACK] Seq=8882 Ack=219066 Win=8282 Len=1400 TSval=758536108 TSecr=960945207 [TCP PDU reassembled in 320]"
"320","1.596213","100.86.243.187","172.253.122.93","TLSv1.2","76","Application Data"
"321","1.608239","172.253.122.93","100.86.243.187","TCP","78","[TCP Dup ACK 265#1] 443  >  56045 [ACK] Seq=219066 Ack=7482 Win=1458 Len=0 TSval=960945548 TSecr=758535763 SLE=10282 SRE=10292"
"322","1.608242","172.253.122.93","100.86.243.187","TCP","78","443  >  56045 [ACK] Seq=219066 Ack=8882 Win=1453 Len=0 TSval=960945548 TSecr=758536108 SLE=10282 SRE=10292"
"323","1.608307","172.253.122.93","100.86.243.187","TCP","66","443  >  56045 [ACK] Seq=219066 Ack=10292 Win=1448 Len=0 TSval=960945548 TSecr=758536108"
"326","1.636382","100.86.243.187","172.253.122.93","TLSv1.2","1232","Application Data"
"327","1.636910","172.253.122.93","100.86.243.187","TLSv1.2","143","Application Data"
"328","1.636997","100.86.243.187","172.253.122.93","TCP","66","56045  >  443 [ACK] Seq=11458 Ack=219143 Win=8281 Len=0 TSval=758536148 TSecr=960945577"
"329","1.637156","172.253.122.93","100.86.243.187","TLSv1.2","97","Application Data"
"330","1.637157","172.253.122.93","100.86.243.187","TLSv1.2","105","Application Data"
"331","1.637217","100.86.243.187","172.253.122.93","TCP","66","56045  >  443 [ACK] Seq=11458 Ack=219213 Win=8281 Len=0 TSval=758536148 TSecr=960945577"
"332","1.637369","100.86.243.187","172.253.122.93","TLSv1.2","105","Application Data"
"337","1.647787","172.253.122.93","100.86.243.187","TCP","66","443  >  56045 [ACK] Seq=219213 Ack=11497 Win=1458 Len=0 TSval=960945588 TSecr=758536148"
"366","1.745666","172.253.122.93","100.86.243.187","TLSv1.2","607","Application Data"
"367","1.745667","172.253.122.93","100.86.243.187","TLSv1.2","1466","Application Data"
"368","1.745668","172.253.122.93","100.86.243.187","TLSv1.2","106","Application Data"
"369","1.745669","172.253.122.93","100.86.243.187","TLSv1.2","98","Application Data"
"370","1.745669","172.253.122.93","100.86.243.187","TLSv1.2","97","Application Data"
"371","1.745772","100.86.243.187","172.253.122.93","TCP","66","56045  >  443 [ACK] Seq=11497 Ack=221257 Win=8250 Len=0 TSval=758536258 TSecr=960945686"
"372","1.746323","172.253.122.93","100.86.243.187","TLSv1.2","105","Application Data"
"373","1.746397","100.86.243.187","172.253.122.93","TCP","66","56045  >  443 [ACK] Seq=11497 Ack=221296 Win=8281 Len=0 TSval=758536258 TSecr=960945686"
"374","1.746842","100.86.243.187","172.253.122.93","TCP","1466","56045  >  443 [ACK] Seq=11497 Ack=221296 Win=8281 Len=1400 TSval=758536259 TSecr=960945686 [TCP PDU reassembled in 376]"
"375","1.746843","100.86.243.187","172.253.122.93","TCP","1466","56045  >  443 [ACK] Seq=12897 Ack=221296 Win=8281 Len=1400 TSval=758536259 TSecr=960945686 [TCP PDU reassembled in 376]"
"376","1.746908","100.86.243.187","172.253.122.93","TLSv1.2","579","Application Data"
"377","1.746976","100.86.243.187","172.253.122.93","TLSv1.2","105","Application Data"
"378","1.752956","100.86.243.187","172.253.122.93","TCP","1466","56045  >  443 [ACK] Seq=14849 Ack=221296 Win=8282 Len=1400 TSval=758536265 TSecr=960945686 [TCP PDU reassembled in 379]"
"379","1.753000","100.86.243.187","172.253.122.93","TLSv1.2","1100","Application Data"
"380","1.753086","100.86.243.187","172.253.122.93","TCP","1466","56045  >  443 [ACK] Seq=17283 Ack=221296 Win=8282 Len=1400 TSval=758536265 TSecr=960945686 [TCP PDU reassembled in 381]"
"381","1.753100","100.86.243.187","172.253.122.93","TLSv1.2","424","Application Data"
"382","1.757554","172.253.122.93","100.86.243.187","TCP","66","443  >  56045 [ACK] Seq=221296 Ack=14297 Win=1448 Len=0 TSval=960945698 TSecr=758536259"
"383","1.758674","172.253.122.93","100.86.243.187","TCP","66","443  >  56045 [ACK] Seq=221296 Ack=14849 Win=1458 Len=0 TSval=960945699 TSecr=758536259"
"384","1.773573","172.253.122.93","100.86.243.187","TCP","78","[TCP Dup ACK 383#1] 443  >  56045 [ACK] Seq=221296 Ack=14849 Win=1458 Len=0 TSval=960945704 TSecr=758536259 SLE=16249 SRE=17283"
"385","1.773575","172.253.122.93","100.86.243.187","TCP","66","443  >  56045 [ACK] Seq=221296 Ack=17283 Win=1449 Len=0 TSval=960945704 TSecr=758536265"
"386","1.773931","172.253.122.93","100.86.243.187","TCP","66","443  >  56045 [ACK] Seq=221296 Ack=19041 Win=1443 Len=0 TSval=960945704 TSecr=758536265"
"389","1.775071","172.253.122.93","100.86.243.187","TLSv1.2","145","Application Data"
"390","1.775071","172.253.122.93","100.86.243.187","TLSv1.2","216","Application Data"
"391","1.775071","172.253.122.93","100.86.243.187","TLSv1.2","97","Application Data"
"392","1.775072","172.253.122.93","100.86.243.187","TLSv1.2","105","Application Data"
"393","1.775142","100.86.243.187","172.253.122.93","TCP","66","56045  >  443 [ACK] Seq=19041 Ack=221595 Win=8277 Len=0 TSval=758536287 TSecr=960945711"
"397","1.775820","100.86.243.187","172.253.122.93","TLSv1.2","105","Application Data"
"402","1.784860","172.253.122.93","100.86.243.187","TLSv1.2","143","Application Data"
"403","1.784893","172.253.122.93","100.86.243.187","TLSv1.2","97","Application Data"
"404","1.784938","100.86.243.187","172.253.122.93","TCP","66","56045  >  443 [ACK] Seq=19080 Ack=221672 Win=8281 Len=0 TSval=758536297 TSecr=960945725"
"405","1.784984","100.86.243.187","172.253.122.93","TCP","66","56045  >  443 [ACK] Seq=19080 Ack=221703 Win=8280 Len=0 TSval=758536297 TSecr=960945725"
"406","1.792093","172.253.122.93","100.86.243.187","TCP","66","443  >  56045 [ACK] Seq=221703 Ack=19080 Win=1458 Len=0 TSval=960945732 TSecr=758536287"
"461","2.108443","100.86.243.187","172.253.122.93","TCP","1466","56045  >  443 [ACK] Seq=19080 Ack=221703 Win=8282 Len=1400 TSval=758536620 TSecr=960945732 [TCP PDU reassembled in 463]"
"462","2.108446","100.86.243.187","172.253.122.93","TCP","1466","56045  >  443 [ACK] Seq=20480 Ack=221703 Win=8282 Len=1400 TSval=758536620 TSecr=960945732 [TCP PDU reassembled in 463]"
"463","2.108478","100.86.243.187","172.253.122.93","TLSv1.2","383","Application Data"
"464","2.108528","100.86.243.187","172.253.122.93","TCP","1466","56045  >  443 [ACK] Seq=22197 Ack=221703 Win=8282 Len=1400 TSval=758536620 TSecr=960945732 [TCP PDU reassembled in 465]"
"465","2.108529","100.86.243.187","172.253.122.93","TLSv1.2","1251","Application Data"
"466","2.121098","172.253.122.93","100.86.243.187","TCP","66","443  >  56045 [ACK] Seq=221703 Ack=20480 Win=1453 Len=0 TSval=960946060 TSecr=758536620"
"467","2.121099","172.253.122.93","100.86.243.187","TCP","78","[TCP Dup ACK 466#1] 443  >  56045 [ACK] Seq=221703 Ack=20480 Win=1453 Len=0 TSval=960946060 TSecr=758536620 SLE=21880 SRE=22197"
"468","2.121099","172.253.122.93","100.86.243.187","TCP","66","443  >  56045 [ACK] Seq=221703 Ack=24782 Win=1440 Len=0 TSval=960946060 TSecr=758536620"
"471","2.208287","172.253.122.93","100.86.243.187","TLSv1.2","145","Application Data"
"472","2.208288","172.253.122.93","100.86.243.187","TLSv1.2","1466","Application Data"
"473","2.208288","172.253.122.93","100.86.243.187","TLSv1.2","1466","Application Data"
"474","2.208381","100.86.243.187","172.253.122.93","TCP","66","56045  >  443 [ACK] Seq=24782 Ack=224582 Win=8237 Len=0 TSval=758536720 TSecr=960946148"
"475","2.208613","100.86.243.187","172.253.122.93","TCP","66","[TCP Window Update] 56045  >  443 [ACK] Seq=24782 Ack=224582 Win=8282 Len=0 TSval=758536720 TSecr=960946148"
"476","2.209176","172.253.122.93","100.86.243.187","TLSv1.2","1466","Application Data"
"477","2.209177","172.253.122.93","100.86.243.187","TLSv1.2","1466","Application Data"
"478","2.209178","172.253.122.93","100.86.243.187","TLSv1.2","1466","Application Data"
"479","2.209178","172.253.122.93","100.86.243.187","TLSv1.2","1466","Application Data"
"480","2.209240","100.86.243.187","172.253.122.93","TCP","66","56045  >  443 [ACK] Seq=24782 Ack=230182 Win=8194 Len=0 TSval=758536720 TSecr=960946148"
"481","2.209336","100.86.243.187","172.253.122.93","TCP","66","[TCP Window Update] 56045  >  443 [ACK] Seq=24782 Ack=230182 Win=8282 Len=0 TSval=758536720 TSecr=960946148"
"482","2.209477","172.253.122.93","100.86.243.187","TLSv1.2","1466","Application Data"
"483","2.209478","172.253.122.93","100.86.243.187","TLSv1.2","1466","Application Data"
"484","2.209518","100.86.243.187","172.253.122.93","TCP","66","56045  >  443 [ACK] Seq=24782 Ack=232982 Win=8238 Len=0 TSval=758536721 TSecr=960946148"
"485","2.209607","100.86.243.187","172.253.122.93","TCP","66","[TCP Window Update] 56045  >  443 [ACK] Seq=24782 Ack=232982 Win=8282 Len=0 TSval=758536721 TSecr=960946148"
"486","2.210592","172.253.122.93","100.86.243.187","TLSv1.2","1466","Application Data"
"487","2.210593","172.253.122.93","100.86.243.187","TLSv1.2","1466","Application Data"
"488","2.210593","172.253.122.93","100.86.243.187","TLSv1.2","248","Application Data"
"489","2.210594","172.253.122.93","100.86.243.187","TLSv1.2","97","Application Data"
"490","2.210594","172.253.122.93","100.86.243.187","TLSv1.2","105","Application Data"
"491","2.210653","100.86.243.187","172.253.122.93","TCP","66","56045  >  443 [ACK] Seq=24782 Ack=236034 Win=8234 Len=0 TSval=758536722 TSecr=960946149"
"492","2.210850","100.86.243.187","172.253.122.93","TCP","66","[TCP Window Update] 56045  >  443 [ACK] Seq=24782 Ack=236034 Win=8282 Len=0 TSval=758536722 TSecr=960946149"
"493","2.210883","100.86.243.187","172.253.122.93","TLSv1.2","105","Application Data"
"494","2.221682","172.253.122.93","100.86.243.187","TCP","66","443  >  56045 [ACK] Seq=236034 Ack=24821 Win=1458 Len=0 TSval=960946162 TSecr=758536722"
"495","2.405839","100.86.243.187","172.253.122.93","TCP","1466","56045  >  443 [ACK] Seq=24821 Ack=236034 Win=8282 Len=1400 TSval=758536918 TSecr=960946162 [TCP PDU reassembled in 496]"
"496","2.405877","100.86.243.187","172.253.122.93","TLSv1.2","1373","Application Data"
"497","2.416696","172.253.122.93","100.86.243.187","TCP","78","[TCP Dup ACK 494#1] 443  >  56045 [ACK] Seq=236034 Ack=24821 Win=1458 Len=0 TSval=960946357 TSecr=758536722 SLE=26221 SRE=27528"
"498","2.416696","172.253.122.93","100.86.243.187","TCP","66","443  >  56045 [ACK] Seq=236034 Ack=27528 Win=1448 Len=0 TSval=960946357 TSecr=758536918"
"503","2.470513","172.253.122.93","100.86.243.187","TLSv1.2","623","Application Data"
"504","2.470514","172.253.122.93","100.86.243.187","TLSv1.2","1466","Application Data"
"505","2.470515","172.253.122.93","100.86.243.187","TLSv1.2","1466","Application Data"
"506","2.470515","172.253.122.93","100.86.243.187","TLSv1.2","630","Application Data"
"507","2.470516","172.253.122.93","100.86.243.187","TLSv1.2","98","Application Data"
"508","2.470586","100.86.243.187","172.253.122.93","TCP","66","56045  >  443 [ACK] Seq=27528 Ack=239987 Win=8220 Len=0 TSval=758536982 TSecr=960946411"
"509","2.470913","100.86.243.187","172.253.122.93","TCP","66","[TCP Window Update] 56045  >  443 [ACK] Seq=27528 Ack=239987 Win=8282 Len=0 TSval=758536982 TSecr=960946411"
"510","2.471137","172.253.122.93","100.86.243.187","TLSv1.2","97","Application Data"
"511","2.471138","172.253.122.93","100.86.243.187","TLSv1.2","105","Application Data"
"512","2.471182","100.86.243.187","172.253.122.93","TCP","66","56045  >  443 [ACK] Seq=27528 Ack=240057 Win=8281 Len=0 TSval=758536982 TSecr=960946411"
"513","2.471297","100.86.243.187","172.253.122.93","TLSv1.2","105","Application Data"
"516","2.482328","172.253.122.93","100.86.243.187","TCP","66","443  >  56045 [ACK] Seq=240057 Ack=27567 Win=1458 Len=0 TSval=960946423 TSecr=758536982"
"647","3.825420","100.86.243.187","172.253.122.93","TCP","1466","56045  >  443 [ACK] Seq=27567 Ack=240057 Win=8282 Len=1400 TSval=758538337 TSecr=960946423 [TCP PDU reassembled in 648]"
"648","3.825454","100.86.243.187","172.253.122.93","TLSv1.2","1332","Application Data"
"649","3.837295","172.253.122.93","100.86.243.187","TCP","66","443  >  56045 [ACK] Seq=240057 Ack=30233 Win=1449 Len=0 TSval=960947777 TSecr=758538337"
"650","3.837296","172.253.122.93","100.86.243.187","TLSv1.2","146","Application Data"
"651","3.837380","100.86.243.187","172.253.122.93","TCP","66","56045  >  443 [ACK] Seq=30233 Ack=240137 Win=8281 Len=0 TSval=758538349 TSecr=960947777"
"652","3.837615","100.86.243.187","172.253.122.93","TLSv1.2","105","Application Data"
"653","3.855016","172.253.122.93","100.86.243.187","TCP","66","443  >  56045 [ACK] Seq=240137 Ack=30272 Win=1458 Len=0 TSval=960947794 TSecr=758538349"
"656","4.139946","100.86.243.187","172.253.122.93","TCP","1466","56045  >  443 [ACK] Seq=30272 Ack=240137 Win=8282 Len=1400 TSval=758538652 TSecr=960947794 [TCP PDU reassembled in 657]"
"657","4.139979","100.86.243.187","172.253.122.93","TLSv1.2","1372","Application Data"
"658","4.151215","172.253.122.93","100.86.243.187","TCP","78","[TCP Dup ACK 653#1] 443  >  56045 [ACK] Seq=240137 Ack=30272 Win=1458 Len=0 TSval=960948091 TSecr=758538349 SLE=31672 SRE=32978"
"659","4.151215","172.253.122.93","100.86.243.187","TCP","66","443  >  56045 [ACK] Seq=240137 Ack=32978 Win=1448 Len=0 TSval=960948091 TSecr=758538652"
"660","4.151255","172.253.122.93","100.86.243.187","TLSv1.2","146","Application Data"
"661","4.151330","100.86.243.187","172.253.122.93","TCP","66","56045  >  443 [ACK] Seq=32978 Ack=240217 Win=8281 Len=0 TSval=758538663 TSecr=960948092"
"662","4.151599","100.86.243.187","172.253.122.93","TLSv1.2","105","Application Data"
"663","4.170553","172.253.122.93","100.86.243.187","TCP","66","443  >  56045 [ACK] Seq=240217 Ack=33017 Win=1458 Len=0 TSval=960948108 TSecr=758538663"
"664","4.258983","100.86.243.187","172.253.122.93","TCP","1466","56045  >  443 [ACK] Seq=33017 Ack=240217 Win=8282 Len=1400 TSval=758538771 TSecr=960948108 [TCP PDU reassembled in 667]"
"665","4.258985","100.86.243.187","172.253.122.93","TCP","1466","56045  >  443 [ACK] Seq=34417 Ack=240217 Win=8282 Len=1400 TSval=758538771 TSecr=960948108 [TCP PDU reassembled in 667]"
"666","4.258986","100.86.243.187","172.253.122.93","TCP","1466","56045  >  443 [ACK] Seq=35817 Ack=240217 Win=8282 Len=1400 TSval=758538771 TSecr=960948108 [TCP PDU reassembled in 667]"
"667","4.259024","100.86.243.187","172.253.122.93","TLSv1.2","141","Application Data"
"668","4.259072","100.86.243.187","172.253.122.93","TCP","1466","56045  >  443 [ACK] Seq=37292 Ack=240217 Win=8282 Len=1400 TSval=758538771 TSecr=960948108 [TCP PDU reassembled in 670]"
"669","4.259073","100.86.243.187","172.253.122.93","TCP","1466","56045  >  443 [ACK] Seq=38692 Ack=240217 Win=8282 Len=1400 TSval=758538771 TSecr=960948108 [TCP PDU reassembled in 670]"
"670","4.259084","100.86.243.187","172.253.122.93","TLSv1.2","1160","Application Data"
"671","4.275409","172.253.122.93","100.86.243.187","TCP","66","443  >  56045 [ACK] Seq=240217 Ack=35817 Win=1448 Len=0 TSval=960948210 TSecr=758538771"
"672","4.275409","172.253.122.93","100.86.243.187","TCP","78","[TCP Dup ACK 671#1] 443  >  56045 [ACK] Seq=240217 Ack=35817 Win=1456 Len=0 TSval=960948211 TSecr=758538771 SLE=37217 SRE=37292"
"673","4.275786","172.253.122.93","100.86.243.187","TCP","66","443  >  56045 [ACK] Seq=240217 Ack=41186 Win=1444 Len=0 TSval=960948211 TSecr=758538771"
"676","4.311206","172.253.122.93","100.86.243.187","TLSv1.2","147","Application Data"
"677","4.311270","100.86.243.187","172.253.122.93","TCP","66","56045  >  443 [ACK] Seq=41186 Ack=240298 Win=8281 Len=0 TSval=758538823 TSecr=960948251"
"678","4.311442","172.253.122.93","100.86.243.187","TLSv1.2","97","Application Data"
"679","4.311443","172.253.122.93","100.86.243.187","TLSv1.2","105","Application Data"
"680","4.311488","100.86.243.187","172.253.122.93","TCP","66","56045  >  443 [ACK] Seq=41186 Ack=240368 Win=8281 Len=0 TSval=758538823 TSecr=960948251"
"681","4.311635","100.86.243.187","172.253.122.93","TLSv1.2","105","Application Data"
"682","4.322380","172.253.122.93","100.86.243.187","TCP","66","443  >  56045 [ACK] Seq=240368 Ack=41225 Win=1458 Len=0 TSval=960948263 TSecr=758538823"
"683","4.577412","100.86.243.187","172.253.122.93","TCP","1466","56045  >  443 [ACK] Seq=41225 Ack=240368 Win=8282 Len=1400 TSval=758539089 TSecr=960948263 [TCP PDU reassembled in 685]"
"684","4.577413","100.86.243.187","172.253.122.93","TCP","1466","56045  >  443 [ACK] Seq=42625 Ack=240368 Win=8282 Len=1400 TSval=758539089 TSecr=960948263 [TCP PDU reassembled in 685]"
"685","4.577455","100.86.243.187","172.253.122.93","TLSv1.2","760","Application Data"
"686","4.577542","100.86.243.187","172.253.122.93","TCP","1466","56045  >  443 [ACK] Seq=44719 Ack=240368 Win=8282 Len=1400 TSval=758539089 TSecr=960948263 [TCP PDU reassembled in 687]"
"687","4.577554","100.86.243.187","172.253.122.93","TLSv1.2","1312","Application Data"
"690","4.592327","172.253.122.93","100.86.243.187","TCP","78","[TCP Dup ACK 682#1] 443  >  56045 [ACK] Seq=240368 Ack=41225 Win=1458 Len=0 TSval=960948533 TSecr=758538823 SLE=44025 SRE=44719"
"691","4.592328","172.253.122.93","100.86.243.187","TCP","78","443  >  56045 [ACK] Seq=240368 Ack=42625 Win=1453 Len=0 TSval=960948533 TSecr=758539089 SLE=44025 SRE=44719"
"692","4.592328","172.253.122.93","100.86.243.187","TCP","66","443  >  56045 [ACK] Seq=240368 Ack=47365 Win=1436 Len=0 TSval=960948533 TSecr=758539089"
"695","4.623710","172.253.122.93","100.86.243.187","TLSv1.2","148","Application Data"
"696","4.623711","172.253.122.93","100.86.243.187","TLSv1.2","1384","Application Data"
"697","4.623712","172.253.122.93","100.86.243.187","TLSv1.2","97","Application Data"
"698","4.623792","100.86.243.187","172.253.122.93","TCP","66","56045  >  443 [ACK] Seq=47365 Ack=241799 Win=8260 Len=0 TSval=758539135 TSecr=960948564"
"699","4.624078","172.253.122.93","100.86.243.187","TLSv1.2","105","Application Data"
"700","4.624122","100.86.243.187","172.253.122.93","TCP","66","56045  >  443 [ACK] Seq=47365 Ack=241838 Win=8281 Len=0 TSval=758539135 TSecr=960948564"
"701","4.624217","100.86.243.187","172.253.122.93","TLSv1.2","105","Application Data"
"702","4.638616","100.86.243.187","172.253.122.93","TCP","1466","56045  >  443 [ACK] Seq=47404 Ack=241838 Win=8282 Len=1400 TSval=758539150 TSecr=960948564 [TCP PDU reassembled in 704]"
"703","4.638618","100.86.243.187","172.253.122.93","TCP","1466","56045  >  443 [ACK] Seq=48804 Ack=241838 Win=8282 Len=1400 TSval=758539150 TSecr=960948564 [TCP PDU reassembled in 704]"
"704","4.638657","100.86.243.187","172.253.122.93","TLSv1.2","331","Application Data"
"705","4.639467","172.253.122.93","100.86.243.187","TCP","66","443  >  56045 [ACK] Seq=241838 Ack=47404 Win=1458 Len=0 TSval=960948580 TSecr=758539135"
"706","4.649627","172.253.122.93","100.86.243.187","TCP","66","443  >  56045 [ACK] Seq=241838 Ack=48804 Win=1453 Len=0 TSval=960948590 TSecr=758539150"
"707","4.649907","172.253.122.93","100.86.243.187","TLSv1.2","146","Application Data"
"708","4.649964","100.86.243.187","172.253.122.93","TCP","66","56045  >  443 [ACK] Seq=50469 Ack=241918 Win=8281 Len=0 TSval=758539161 TSecr=960948590"
"709","4.650301","100.86.243.187","172.253.122.93","TLSv1.2","105","Application Data"
"710","4.666674","172.253.122.93","100.86.243.187","TCP","66","443  >  56045 [ACK] Seq=241918 Ack=50508 Win=1458 Len=0 TSval=960948607 TSecr=758539161"
"725","5.295349","100.86.243.187","172.253.122.93","TCP","1466","56045  >  443 [ACK] Seq=50508 Ack=241918 Win=8282 Len=1400 TSval=758539807 TSecr=960948607 [TCP PDU reassembled in 727]"
"726","5.295352","100.86.243.187","172.253.122.93","TCP","1466","56045  >  443 [ACK] Seq=51908 Ack=241918 Win=8282 Len=1400 TSval=758539807 TSecr=960948607 [TCP PDU reassembled in 727]"
"727","5.295395","100.86.243.187","172.253.122.93","TLSv1.2","331","Application Data"
"732","5.307413","172.253.122.93","100.86.243.187","TCP","78","[TCP Dup ACK 710#1] 443  >  56045 [ACK] Seq=241918 Ack=50508 Win=1458 Len=0 TSval=960949247 TSecr=758539161 SLE=53308 SRE=53573"
"733","5.307413","172.253.122.93","100.86.243.187","TCP","78","443  >  56045 [ACK] Seq=241918 Ack=51908 Win=1453 Len=0 TSval=960949247 TSecr=758539807 SLE=53308 SRE=53573"
"734","5.308020","172.253.122.93","100.86.243.187","TLSv1.2","146","Application Data"
"735","5.308135","100.86.243.187","172.253.122.93","TCP","66","56045  >  443 [ACK] Seq=53573 Ack=241998 Win=8281 Len=0 TSval=758539819 TSecr=960949247"
"736","5.308473","100.86.243.187","172.253.122.93","TLSv1.2","105","Application Data"
"745","5.325052","172.253.122.93","100.86.243.187","TCP","66","443  >  56045 [ACK] Seq=241998 Ack=53612 Win=1458 Len=0 TSval=960949265 TSecr=758539819"
"779","9.084812","100.86.243.187","172.253.122.93","TCP","1466","56045  >  443 [ACK] Seq=53612 Ack=241998 Win=8282 Len=1400 TSval=758543596 TSecr=960949265 [TCP PDU reassembled in 780]"
"780","9.084849","100.86.243.187","172.253.122.93","TLSv1.2","625","Application Data"
"781","9.096476","172.253.122.93","100.86.243.187","TCP","78","[TCP Dup ACK 745#1] 443  >  56045 [ACK] Seq=241998 Ack=53612 Win=1458 Len=0 TSval=960953036 TSecr=758539819 SLE=55012 SRE=55571"
"782","9.096479","172.253.122.93","100.86.243.187","TCP","66","443  >  56045 [ACK] Seq=241998 Ack=55571 Win=1451 Len=0 TSval=960953036 TSecr=758543596"
"783","9.097160","172.253.122.93","100.86.243.187","TLSv1.2","146","Application Data"
"784","9.097266","100.86.243.187","172.253.122.93","TCP","66","56045  >  443 [ACK] Seq=55571 Ack=242078 Win=8281 Len=0 TSval=758543608 TSecr=960953038"
"785","9.097686","100.86.243.187","172.253.122.93","TLSv1.2","105","Application Data"
"786","9.113816","172.253.122.93","100.86.243.187","TCP","66","443  >  56045 [ACK] Seq=242078 Ack=55610 Win=1458 Len=0 TSval=960953054 TSecr=758543609"
"789","9.203402","100.86.243.187","172.253.122.93","TLSv1.2","177","Application Data"
"790","9.214907","172.253.122.93","100.86.243.187","TLSv1.2","146","Application Data"
"791","9.215088","100.86.243.187","172.253.122.93","TCP","66","56045  >  443 [ACK] Seq=55721 Ack=242158 Win=8281 Len=0 TSval=758543727 TSecr=960953155"
"792","9.215897","100.86.243.187","172.253.122.93","TLSv1.2","105","Application Data"
"793","9.231535","172.253.122.93","100.86.243.187","TCP","66","443  >  56045 [ACK] Seq=242158 Ack=55760 Win=1458 Len=0 TSval=960953172 TSecr=758543727"
