"No.","Time","Source","Destination","Protocol","Length","Info"
"13","0.221186","100.86.243.187","172.253.62.190","TCP","1466","54596  >  443 [ACK] Seq=1 Ack=1 Win=16310 Len=1400 TSval=282759062 TSecr=1973513337 [TCP PDU reassembled in 15]"
"14","0.221189","100.86.243.187","172.253.62.190","TCP","1466","54596  >  443 [ACK] Seq=1401 Ack=1 Win=16310 Len=1400 TSval=282759062 TSecr=1973513337 [TCP PDU reassembled in 15]"
"15","0.221230","100.86.243.187","172.253.62.190","TLSv1.2","243","Application Data"
"16","0.221280","100.86.243.187","172.253.62.190","TLSv1.2","1299","Application Data"
"17","0.223266","100.86.243.187","172.253.62.190","TCP","1466","54596  >  443 [ACK] Seq=4211 Ack=1 Win=16310 Len=1400 TSval=282759064 TSecr=1973513337 [TCP PDU reassembled in 19]"
"18","0.223267","100.86.243.187","172.253.62.190","TCP","1466","54596  >  443 [ACK] Seq=5611 Ack=1 Win=16310 Len=1400 TSval=282759064 TSecr=1973513337 [TCP PDU reassembled in 19]"
"19","0.223292","100.86.243.187","172.253.62.190","TLSv1.2","243","Application Data"
"20","0.223332","100.86.243.187","172.253.62.190","TLSv1.2","1299","Application Data"
"21","0.232442","172.253.62.190","100.86.243.187","TCP","66","443  >  54596 [ACK] Seq=1 Ack=1401 Win=4243 Len=0 TSval=1973513735 TSecr=282759062"
"22","0.232443","172.253.62.190","100.86.243.187","TCP","78","[TCP Dup ACK 21#1] 443  >  54596 [ACK] Seq=1 Ack=1401 Win=4243 Len=0 TSval=1973513735 TSecr=282759062 SLE=2801 SRE=2978"
"23","0.232465","172.253.62.190","100.86.243.187","TCP","66","443  >  54596 [ACK] Seq=1 Ack=4211 Win=4265 Len=0 TSval=1973513735 TSecr=282759062"
"24","0.234834","172.253.62.190","100.86.243.187","TCP","66","443  >  54596 [ACK] Seq=1 Ack=8421 Win=4298 Len=0 TSval=1973513738 TSecr=282759064"
"25","0.246438","100.86.243.187","172.253.62.190","TCP","1466","54596  >  443 [ACK] Seq=8421 Ack=1 Win=16310 Len=1400 TSval=282759087 TSecr=1973513738 [TCP PDU reassembled in 27]"
"26","0.246439","100.86.243.187","172.253.62.190","TCP","1466","54596  >  443 [ACK] Seq=9821 Ack=1 Win=16310 Len=1400 TSval=282759087 TSecr=1973513738 [TCP PDU reassembled in 27]"
"27","0.246472","100.86.243.187","172.253.62.190","TLSv1.2","248","Application Data"
"28","0.246517","100.86.243.187","172.253.62.190","TLSv1.2","1337","Application Data"
"29","0.248908","100.86.243.187","172.253.62.190","TCP","1466","54596  >  443 [ACK] Seq=12674 Ack=1 Win=16310 Len=1400 TSval=282759090 TSecr=1973513738 [TCP PDU reassembled in 31]"
"30","0.248910","100.86.243.187","172.253.62.190","TCP","1466","54596  >  443 [ACK] Seq=14074 Ack=1 Win=16310 Len=1400 TSval=282759090 TSecr=1973513738 [TCP PDU reassembled in 31]"
"31","0.248940","100.86.243.187","172.253.62.190","TLSv1.2","246","Application Data"
"32","0.248995","100.86.243.187","172.253.62.190","TLSv1.2","1325","Application Data"
"33","0.255341","100.86.243.187","172.253.62.190","TCP","1466","54596  >  443 [ACK] Seq=16913 Ack=1 Win=16310 Len=1400 TSval=282759096 TSecr=1973513738 [TCP PDU reassembled in 35]"
"34","0.255343","100.86.243.187","172.253.62.190","TCP","1466","54596  >  443 [ACK] Seq=18313 Ack=1 Win=16310 Len=1400 TSval=282759096 TSecr=1973513738 [TCP PDU reassembled in 35]"
"35","0.255374","100.86.243.187","172.253.62.190","TLSv1.2","253","Application Data"
"36","0.255421","100.86.243.187","172.253.62.190","TLSv1.2","1277","Application Data"
"37","0.257157","100.86.243.187","172.253.62.190","TCP","1466","54596  >  443 [ACK] Seq=21111 Ack=1 Win=16310 Len=1400 TSval=282759098 TSecr=1973513738 [TCP PDU reassembled in 39]"
"38","0.257159","100.86.243.187","172.253.62.190","TCP","1466","54596  >  443 [ACK] Seq=22511 Ack=1 Win=16310 Len=1400 TSval=282759098 TSecr=1973513738 [TCP PDU reassembled in 39]"
"39","0.257179","100.86.243.187","172.253.62.190","TLSv1.2","253","Application Data"
"40","0.257217","100.86.243.187","172.253.62.190","TLSv1.2","1278","Application Data"
"41","0.257555","172.253.62.190","100.86.243.187","TCP","66","443  >  54596 [ACK] Seq=1 Ack=9821 Win=4309 Len=0 TSval=1973513761 TSecr=282759087"
"42","0.257556","172.253.62.190","100.86.243.187","TCP","78","[TCP Dup ACK 41#1] 443  >  54596 [ACK] Seq=1 Ack=9821 Win=4309 Len=0 TSval=1973513761 TSecr=282759087 SLE=11221 SRE=11403"
"43","0.257556","172.253.62.190","100.86.243.187","TCP","66","443  >  54596 [ACK] Seq=1 Ack=12674 Win=4330 Len=0 TSval=1973513761 TSecr=282759087"
"44","0.260108","172.253.62.190","100.86.243.187","TCP","78","[TCP Dup ACK 43#1] 443  >  54596 [ACK] Seq=1 Ack=12674 Win=4330 Len=0 TSval=1973513763 TSecr=282759087 SLE=15474 SRE=15654"
"45","0.260109","172.253.62.190","100.86.243.187","TCP","78","443  >  54596 [ACK] Seq=1 Ack=14074 Win=4341 Len=0 TSval=1973513763 TSecr=282759090 SLE=15474 SRE=15654"
"46","0.260109","172.253.62.190","100.86.243.187","TCP","66","443  >  54596 [ACK] Seq=1 Ack=16913 Win=4363 Len=0 TSval=1973513763 TSecr=282759090"
"47","0.266168","172.253.62.190","100.86.243.187","TCP","66","443  >  54596 [ACK] Seq=1 Ack=18313 Win=4374 Len=0 TSval=1973513770 TSecr=282759096"
"48","0.266187","172.253.62.190","100.86.243.187","TCP","66","443  >  54596 [ACK] Seq=1 Ack=21111 Win=4396 Len=0 TSval=1973513770 TSecr=282759096"
"49","0.268271","172.253.62.190","100.86.243.187","TCP","66","443  >  54596 [ACK] Seq=1 Ack=22511 Win=4407 Len=0 TSval=1973513772 TSecr=282759098"
"50","0.268271","172.253.62.190","100.86.243.187","TCP","78","[TCP Dup ACK 49#1] 443  >  54596 [ACK] Seq=1 Ack=22511 Win=4407 Len=0 TSval=1973513772 TSecr=282759098 SLE=23911 SRE=24098"
"51","0.268272","172.253.62.190","100.86.243.187","TCP","66","443  >  54596 [ACK] Seq=1 Ack=25310 Win=4429 Len=0 TSval=1973513772 TSecr=282759098"
"52","0.292519","172.253.62.190","100.86.243.187","TLSv1.2","148","Application Data"
"53","0.292586","100.86.243.187","172.253.62.190","TCP","66","54596  >  443 [ACK] Seq=25310 Ack=83 Win=16309 Len=0 TSval=282759133 TSecr=1973513796"
"54","0.292935","172.253.62.190","100.86.243.187","TLSv1.2","1049","Application Data"
"55","0.292935","172.253.62.190","100.86.243.187","TLSv1.2","97","Application Data"
"56","0.292967","100.86.243.187","172.253.62.190","TCP","66","54596  >  443 [ACK] Seq=25310 Ack=1097 Win=16294 Len=0 TSval=282759133 TSecr=1973513796"
"57","0.293225","172.253.62.190","100.86.243.187","TLSv1.2","105","Application Data"
"58","0.293261","100.86.243.187","172.253.62.190","TCP","66","54596  >  443 [ACK] Seq=25310 Ack=1136 Win=16309 Len=0 TSval=282759133 TSecr=1973513796"
"59","0.293318","100.86.243.187","172.253.62.190","TLSv1.2","105","Application Data"
"60","0.295616","172.253.62.190","100.86.243.187","TLSv1.2","148","Application Data"
"61","0.295664","100.86.243.187","172.253.62.190","TCP","66","54596  >  443 [ACK] Seq=25349 Ack=1218 Win=16309 Len=0 TSval=282759136 TSecr=1973513799"
"62","0.295908","172.253.62.190","100.86.243.187","TLSv1.2","1050","Application Data"
"63","0.295908","172.253.62.190","100.86.243.187","TLSv1.2","97","Application Data"
"64","0.295935","100.86.243.187","172.253.62.190","TCP","66","54596  >  443 [ACK] Seq=25349 Ack=2233 Win=16294 Len=0 TSval=282759136 TSecr=1973513799"
"67","0.306599","172.253.62.190","100.86.243.187","TCP","66","443  >  54596 [ACK] Seq=2233 Ack=25349 Win=4429 Len=0 TSval=1973513810 TSecr=282759133"
"72","0.310752","172.253.62.190","100.86.243.187","TLSv1.2","148","Application Data"
"73","0.310753","172.253.62.190","100.86.243.187","TLSv1.2","1157","Application Data"
"74","0.310753","172.253.62.190","100.86.243.187","TLSv1.2","97","Application Data"
"75","0.310810","100.86.243.187","172.253.62.190","TCP","66","54596  >  443 [ACK] Seq=25349 Ack=3437 Win=16291 Len=0 TSval=282759151 TSecr=1973513814"
"76","0.311367","172.253.62.190","100.86.243.187","TLSv1.2","105","Application Data"
"77","0.311407","100.86.243.187","172.253.62.190","TCP","66","54596  >  443 [ACK] Seq=25349 Ack=3476 Win=16309 Len=0 TSval=282759151 TSecr=1973513814"
"78","0.311485","100.86.243.187","172.253.62.190","TLSv1.2","105","Application Data"
"79","0.316011","172.253.62.190","100.86.243.187","TLSv1.2","148","Application Data"
"80","0.316064","100.86.243.187","172.253.62.190","TCP","66","54596  >  443 [ACK] Seq=25388 Ack=3558 Win=16309 Len=0 TSval=282759157 TSecr=1973513819"
"81","0.316255","172.253.62.190","100.86.243.187","TLSv1.2","1159","Application Data"
"82","0.316256","172.253.62.190","100.86.243.187","TLSv1.2","97","Application Data"
"83","0.316297","100.86.243.187","172.253.62.190","TCP","66","54596  >  443 [ACK] Seq=25388 Ack=4682 Win=16292 Len=0 TSval=282759157 TSecr=1973513819"
"86","0.326124","172.253.62.190","100.86.243.187","TCP","66","443  >  54596 [ACK] Seq=4682 Ack=25388 Win=4429 Len=0 TSval=1973513829 TSecr=282759151"
"87","0.340892","172.253.62.190","100.86.243.187","TLSv1.2","148","Application Data"
"88","0.340893","172.253.62.190","100.86.243.187","TLSv1.2","1466","Application Data"
"89","0.340894","172.253.62.190","100.86.243.187","TLSv1.2","97","Application Data"
"90","0.340966","100.86.243.187","172.253.62.190","TCP","66","54596  >  443 [ACK] Seq=25388 Ack=6195 Win=16286 Len=0 TSval=282759182 TSecr=1973513844"
"91","0.341138","172.253.62.190","100.86.243.187","TLSv1.2","97","Application Data"
"92","0.341139","172.253.62.190","100.86.243.187","TLSv1.2","105","Application Data"
"93","0.341193","100.86.243.187","172.253.62.190","TCP","66","54596  >  443 [ACK] Seq=25388 Ack=6265 Win=16287 Len=0 TSval=282759182 TSecr=1973513844"
"94","0.341344","100.86.243.187","172.253.62.190","TLSv1.2","105","Application Data"
"95","0.357048","172.253.62.190","100.86.243.187","TCP","66","443  >  54596 [ACK] Seq=6265 Ack=25427 Win=4429 Len=0 TSval=1973513860 TSecr=282759182"
"169","0.534897","172.253.62.190","100.86.243.187","TLSv1.2","148","Application Data"
"170","0.534898","172.253.62.190","100.86.243.187","TLSv1.2","1297","Application Data"
"171","0.534898","172.253.62.190","100.86.243.187","TLSv1.2","97","Application Data"
"172","0.534899","172.253.62.190","100.86.243.187","TLSv1.2","105","Application Data"
"174","0.534982","100.86.243.187","172.253.62.190","TCP","66","54596  >  443 [ACK] Seq=25427 Ack=7648 Win=16288 Len=0 TSval=282759375 TSecr=1973514038"
"177","0.535344","100.86.243.187","172.253.62.190","TLSv1.2","105","Application Data"
"193","0.546242","172.253.62.190","100.86.243.187","TCP","66","443  >  54596 [ACK] Seq=7648 Ack=25466 Win=4429 Len=0 TSval=1973514049 TSecr=282759375"
"399","1.484143","100.86.243.187","172.253.62.190","TCP","1466","54596  >  443 [ACK] Seq=25466 Ack=7648 Win=16310 Len=1400 TSval=282760325 TSecr=1973514049 [TCP PDU reassembled in 401]"
"400","1.484145","100.86.243.187","172.253.62.190","TCP","1466","54596  >  443 [ACK] Seq=26866 Ack=7648 Win=16310 Len=1400 TSval=282760325 TSecr=1973514049 [TCP PDU reassembled in 401]"
"401","1.484183","100.86.243.187","172.253.62.190","TLSv1.2","246","Application Data"
"402","1.484236","100.86.243.187","172.253.62.190","TCP","1466","54596  >  443 [ACK] Seq=28446 Ack=7648 Win=16310 Len=1400 TSval=282760325 TSecr=1973514049 [TCP PDU reassembled in 403]"
"403","1.484247","100.86.243.187","172.253.62.190","TLSv1.2","81","Application Data"
"404","1.495483","172.253.62.190","100.86.243.187","TCP","66","443  >  54596 [ACK] Seq=7648 Ack=26866 Win=4440 Len=0 TSval=1973514998 TSecr=282760325"
"405","1.495485","172.253.62.190","100.86.243.187","TCP","78","[TCP Dup ACK 404#1] 443  >  54596 [ACK] Seq=7648 Ack=26866 Win=4440 Len=0 TSval=1973514998 TSecr=282760325 SLE=28266 SRE=28446"
"406","1.495486","172.253.62.190","100.86.243.187","TCP","66","443  >  54596 [ACK] Seq=7648 Ack=29861 Win=4462 Len=0 TSval=1973514998 TSecr=282760325"
"407","1.579479","100.86.243.187","172.253.62.190","TCP","1466","54596  >  443 [ACK] Seq=29861 Ack=7648 Win=16310 Len=1400 TSval=282760420 TSecr=1973514998 [TCP PDU reassembled in 409]"
"408","1.579481","100.86.243.187","172.253.62.190","TCP","1466","54596  >  443 [ACK] Seq=31261 Ack=7648 Win=16310 Len=1400 TSval=282760420 TSecr=1973514998 [TCP PDU reassembled in 409]"
"409","1.579521","100.86.243.187","172.253.62.190","TLSv1.2","242","Application Data"
"410","1.579577","100.86.243.187","172.253.62.190","TCP","1466","54596  >  443 [ACK] Seq=32837 Ack=7648 Win=16310 Len=1400 TSval=282760420 TSecr=1973514998 [TCP PDU reassembled in 411]"
"411","1.579588","100.86.243.187","172.253.62.190","TLSv1.2","461","Application Data"
"414","1.591824","172.253.62.190","100.86.243.187","TCP","78","[TCP Dup ACK 406#1] 443  >  54596 [ACK] Seq=7648 Ack=29861 Win=4462 Len=0 TSval=1973515094 TSecr=282760325 SLE=32661 SRE=32837"
"415","1.591825","172.253.62.190","100.86.243.187","TCP","78","443  >  54596 [ACK] Seq=7648 Ack=31261 Win=4473 Len=0 TSval=1973515094 TSecr=282760420 SLE=32661 SRE=32837"
"416","1.592176","172.253.62.190","100.86.243.187","TCP","66","443  >  54596 [ACK] Seq=7648 Ack=34632 Win=4495 Len=0 TSval=1973515094 TSecr=282760420"
"417","1.756672","172.253.62.190","100.86.243.187","TLSv1.2","148","Application Data"
"418","1.756674","172.253.62.190","100.86.243.187","TLSv1.2","1466","Application Data"
"419","1.756675","172.253.62.190","100.86.243.187","TLSv1.2","1466","Application Data"
"420","1.756676","172.253.62.190","100.86.243.187","TLSv1.2","1466","Application Data"
"421","1.756677","172.253.62.190","100.86.243.187","TLSv1.2","764","Application Data"
"422","1.756830","100.86.243.187","172.253.62.190","TCP","66","54596  >  443 [ACK] Seq=34632 Ack=12628 Win=16232 Len=0 TSval=282760597 TSecr=1973515260"
"423","1.757403","172.253.62.190","100.86.243.187","TLSv1.2","97","Application Data"
"424","1.757405","172.253.62.190","100.86.243.187","TLSv1.2","105","Application Data"
"425","1.757512","100.86.243.187","172.253.62.190","TCP","66","54596  >  443 [ACK] Seq=34632 Ack=12698 Win=16298 Len=0 TSval=282760597 TSecr=1973515260"
"426","1.757793","100.86.243.187","172.253.62.190","TLSv1.2","105","Application Data"
"427","1.780053","172.253.62.190","100.86.243.187","TCP","66","443  >  54596 [ACK] Seq=12698 Ack=34671 Win=4495 Len=0 TSval=1973515271 TSecr=282760597"
"428","1.794499","100.86.243.187","172.253.62.190","TCP","1466","54596  >  443 [ACK] Seq=34671 Ack=12698 Win=16310 Len=1400 TSval=282760635 TSecr=1973515271 [TCP PDU reassembled in 430]"
"429","1.794501","100.86.243.187","172.253.62.190","TCP","1466","54596  >  443 [ACK] Seq=36071 Ack=12698 Win=16310 Len=1400 TSval=282760635 TSecr=1973515271 [TCP PDU reassembled in 430]"
"430","1.794539","100.86.243.187","172.253.62.190","TLSv1.2","254","Application Data"
"431","1.794581","100.86.243.187","172.253.62.190","TLSv1.2","1277","Application Data"
"432","1.806213","172.253.62.190","100.86.243.187","TCP","66","443  >  54596 [ACK] Seq=12698 Ack=36071 Win=4505 Len=0 TSval=1973515309 TSecr=282760635"
"433","1.806214","172.253.62.190","100.86.243.187","TCP","78","[TCP Dup ACK 432#1] 443  >  54596 [ACK] Seq=12698 Ack=36071 Win=4505 Len=0 TSval=1973515309 TSecr=282760635 SLE=37471 SRE=37659"
"434","1.806215","172.253.62.190","100.86.243.187","TCP","66","443  >  54596 [ACK] Seq=12698 Ack=38870 Win=4527 Len=0 TSval=1973515309 TSecr=282760635"
"462","1.844593","172.253.62.190","100.86.243.187","TLSv1.2","148","Application Data"
"463","1.844720","100.86.243.187","172.253.62.190","TCP","66","54596  >  443 [ACK] Seq=38870 Ack=12780 Win=16309 Len=0 TSval=282760685 TSecr=1973515348"
"464","1.844784","172.253.62.190","100.86.243.187","TLSv1.2","1163","Application Data"
"465","1.844785","172.253.62.190","100.86.243.187","TLSv1.2","97","Application Data"
"466","1.844933","100.86.243.187","172.253.62.190","TCP","66","54596  >  443 [ACK] Seq=38870 Ack=13908 Win=16291 Len=0 TSval=282760685 TSecr=1973515348"
"467","1.845440","172.253.62.190","100.86.243.187","TLSv1.2","105","Application Data"
"468","1.845542","100.86.243.187","172.253.62.190","TCP","66","54596  >  443 [ACK] Seq=38870 Ack=13947 Win=16309 Len=0 TSval=282760685 TSecr=1973515348"
"469","1.845705","100.86.243.187","172.253.62.190","TLSv1.2","105","Application Data"
"485","1.861008","172.253.62.190","100.86.243.187","TCP","66","443  >  54596 [ACK] Seq=13947 Ack=38909 Win=4527 Len=0 TSval=1973515364 TSecr=282760686"
"854","2.422213","172.253.62.190","100.86.243.187","TLSv1.2","148","Application Data"
"855","2.422213","172.253.62.190","100.86.243.187","TLSv1.2","1343","Application Data"
"856","2.422214","172.253.62.190","100.86.243.187","TLSv1.2","97","Application Data"
"857","2.422214","172.253.62.190","100.86.243.187","TLSv1.2","105","Application Data"
"863","2.422218","172.253.62.190","100.86.243.187","TCP","105","[TCP Retransmission] 443  >  54596 [PSH, ACK] Seq=15337 Ack=38909 Win=4527 Len=39 TSval=1973515918 TSecr=282760686"
"865","2.422415","100.86.243.187","172.253.62.190","TCP","78","54596  >  443 [ACK] Seq=38909 Ack=15376 Win=16288 Len=0 TSval=282761263 TSecr=1973515918 SLE=15337 SRE=15376"
"866","2.422679","100.86.243.187","172.253.62.190","TLSv1.2","105","Application Data"
"867","2.433833","172.253.62.190","100.86.243.187","TCP","66","443  >  54596 [ACK] Seq=15376 Ack=38948 Win=4527 Len=0 TSval=1973515937 TSecr=282761263"
"1591","3.201952","100.86.243.187","172.253.62.190","TCP","1466","54596  >  443 [ACK] Seq=38948 Ack=15376 Win=16310 Len=1400 TSval=282762042 TSecr=1973515937 [TCP PDU reassembled in 1593]"
"1592","3.201954","100.86.243.187","172.253.62.190","TCP","1466","54596  >  443 [ACK] Seq=40348 Ack=15376 Win=16310 Len=1400 TSval=282762042 TSecr=1973515937 [TCP PDU reassembled in 1593]"
"1593","3.201999","100.86.243.187","172.253.62.190","TLSv1.2","640","Application Data"
"1594","3.202056","100.86.243.187","172.253.62.190","TLSv1.2","1297","Application Data"
"1597","3.218613","172.253.62.190","100.86.243.187","TCP","66","443  >  54596 [ACK] Seq=15376 Ack=40348 Win=4538 Len=0 TSval=1973516721 TSecr=282762042"
"1598","3.218617","172.253.62.190","100.86.243.187","TCP","78","[TCP Dup ACK 1597#1] 443  >  54596 [ACK] Seq=15376 Ack=40348 Win=4538 Len=0 TSval=1973516721 TSecr=282762042 SLE=41748 SRE=42322"
"1599","3.218618","172.253.62.190","100.86.243.187","TCP","78","[TCP Dup ACK 1597#2] 443  >  54596 [ACK] Seq=15376 Ack=40348 Win=4549 Len=0 TSval=1973516721 TSecr=282762042 SLE=41748 SRE=43553"
"1600","3.218719","172.253.62.190","100.86.243.187","TCP","66","443  >  54596 [ACK] Seq=15376 Ack=43553 Win=4560 Len=0 TSval=1973516721 TSecr=282762042"
"1601","3.359831","172.253.62.190","100.86.243.187","TLSv1.2","148","Application Data"
"1602","3.359832","172.253.62.190","100.86.243.187","TLSv1.2","1144","Application Data"
"1603","3.359832","172.253.62.190","100.86.243.187","TLSv1.2","97","Application Data"
"1604","3.359919","100.86.243.187","172.253.62.190","TCP","66","54596  >  443 [ACK] Seq=43553 Ack=16567 Win=16291 Len=0 TSval=282762200 TSecr=1973516863"
"1605","3.360159","172.253.62.190","100.86.243.187","TLSv1.2","105","Application Data"
"1606","3.360247","100.86.243.187","172.253.62.190","TCP","66","54596  >  443 [ACK] Seq=43553 Ack=16606 Win=16309 Len=0 TSval=282762200 TSecr=1973516863"
"1607","3.360364","100.86.243.187","172.253.62.190","TLSv1.2","105","Application Data"
"1608","3.372149","172.253.62.190","100.86.243.187","TCP","66","443  >  54596 [ACK] Seq=16606 Ack=43592 Win=4560 Len=0 TSval=1973516875 TSecr=282762200"
"1609","3.388436","100.86.243.187","172.253.62.190","TCP","1466","54596  >  443 [ACK] Seq=43592 Ack=16606 Win=16310 Len=1400 TSval=282762229 TSecr=1973516875 [TCP PDU reassembled in 1611]"
"1610","3.388444","100.86.243.187","172.253.62.190","TCP","1466","54596  >  443 [ACK] Seq=44992 Ack=16606 Win=16310 Len=1400 TSval=282762229 TSecr=1973516875 [TCP PDU reassembled in 1611]"
"1611","3.388552","100.86.243.187","172.253.62.190","TLSv1.2","624","Application Data"
"1612","3.388608","100.86.243.187","172.253.62.190","TLSv1.2","1456","Application Data"
"1613","3.391866","100.86.243.187","172.253.62.190","TCP","1466","54596  >  443 [ACK] Seq=48340 Ack=16606 Win=16310 Len=1400 TSval=282762232 TSecr=1973516875 [TCP PDU reassembled in 1615]"
"1614","3.391868","100.86.243.187","172.253.62.190","TCP","1466","54596  >  443 [ACK] Seq=49740 Ack=16606 Win=16310 Len=1400 TSval=282762232 TSecr=1973516875 [TCP PDU reassembled in 1615]"
"1615","3.391951","100.86.243.187","172.253.62.190","TLSv1.2","625","Application Data"
"1616","3.392005","100.86.243.187","172.253.62.190","TCP","1466","54596  >  443 [ACK] Seq=51699 Ack=16606 Win=16310 Len=1400 TSval=282762232 TSecr=1973516875 [TCP PDU reassembled in 1617]"
"1617","3.392029","100.86.243.187","172.253.62.190","TLSv1.2","115","Application Data"
"1618","3.395154","100.86.243.187","172.253.62.190","TCP","1466","54596  >  443 [ACK] Seq=53148 Ack=16606 Win=16310 Len=1400 TSval=282762236 TSecr=1973516875 [TCP PDU reassembled in 1620]"
"1619","3.395156","100.86.243.187","172.253.62.190","TCP","1466","54596  >  443 [ACK] Seq=54548 Ack=16606 Win=16310 Len=1400 TSval=282762236 TSecr=1973516875 [TCP PDU reassembled in 1620]"
"1620","3.395248","100.86.243.187","172.253.62.190","TLSv1.2","625","Application Data"
"1621","3.395274","100.86.243.187","172.253.62.190","TCP","1466","54596  >  443 [ACK] Seq=56507 Ack=16606 Win=16310 Len=1400 TSval=282762236 TSecr=1973516875 [TCP PDU reassembled in 1622]"
"1622","3.395276","100.86.243.187","172.253.62.190","TLSv1.2","114","Application Data"
"1623","3.399656","172.253.62.190","100.86.243.187","TCP","66","443  >  54596 [ACK] Seq=16606 Ack=46950 Win=4593 Len=0 TSval=1973516903 TSecr=282762229"
"1624","3.400283","172.253.62.190","100.86.243.187","TCP","66","443  >  54596 [ACK] Seq=16606 Ack=48340 Win=4604 Len=0 TSval=1973516903 TSecr=282762229"
"1625","3.402989","172.253.62.190","100.86.243.187","TCP","66","443  >  54596 [ACK] Seq=16606 Ack=49740 Win=4615 Len=0 TSval=1973516906 TSecr=282762232"
"1626","3.402990","172.253.62.190","100.86.243.187","TCP","78","[TCP Dup ACK 1625#1] 443  >  54596 [ACK] Seq=16606 Ack=49740 Win=4615 Len=0 TSval=1973516906 TSecr=282762232 SLE=51140 SRE=51699"
"1627","3.402993","172.253.62.190","100.86.243.187","TCP","66","443  >  54596 [ACK] Seq=16606 Ack=53148 Win=4637 Len=0 TSval=1973516906 TSecr=282762232"
"1628","3.406260","172.253.62.190","100.86.243.187","TCP","66","443  >  54596 [ACK] Seq=16606 Ack=56507 Win=4670 Len=0 TSval=1973516909 TSecr=282762236"
"1629","3.406262","172.253.62.190","100.86.243.187","TCP","78","[TCP Dup ACK 1628#1] 443  >  54596 [ACK] Seq=16606 Ack=56507 Win=4670 Len=0 TSval=1973516909 TSecr=282762236 SLE=57907 SRE=57955"
"1630","3.406262","172.253.62.190","100.86.243.187","TCP","66","443  >  54596 [ACK] Seq=16606 Ack=57955 Win=4680 Len=0 TSval=1973516909 TSecr=282762236"
"1631","3.456994","172.253.62.190","100.86.243.187","TLSv1.2","148","Application Data"
"1632","3.457080","100.86.243.187","172.253.62.190","TCP","66","54596  >  443 [ACK] Seq=57955 Ack=16688 Win=16309 Len=0 TSval=282762298 TSecr=1973516960"
"1633","3.457287","172.253.62.190","100.86.243.187","TLSv1.2","1214","Application Data"
"1634","3.457288","172.253.62.190","100.86.243.187","TLSv1.2","97","Application Data"
"1635","3.457354","100.86.243.187","172.253.62.190","TCP","66","54596  >  443 [ACK] Seq=57955 Ack=17867 Win=16292 Len=0 TSval=282762298 TSecr=1973516960"
"1636","3.457725","172.253.62.190","100.86.243.187","TLSv1.2","105","Application Data"
"1637","3.457794","100.86.243.187","172.253.62.190","TCP","66","54596  >  443 [ACK] Seq=57955 Ack=17906 Win=16309 Len=0 TSval=282762298 TSecr=1973516960"
"1638","3.457929","100.86.243.187","172.253.62.190","TLSv1.2","105","Application Data"
"1639","3.466459","172.253.62.190","100.86.243.187","TLSv1.2","144","Application Data"
"1640","3.466538","172.253.62.190","100.86.243.187","TLSv1.2","1214","Application Data"
"1641","3.466540","172.253.62.190","100.86.243.187","TLSv1.2","97","Application Data"
"1642","3.466679","100.86.243.187","172.253.62.190","TCP","66","54596  >  443 [ACK] Seq=57994 Ack=17984 Win=16309 Len=0 TSval=282762307 TSecr=1973516969"
"1643","3.466798","100.86.243.187","172.253.62.190","TCP","66","54596  >  443 [ACK] Seq=57994 Ack=19163 Win=16290 Len=0 TSval=282762307 TSecr=1973516969"
"1644","3.468713","172.253.62.190","100.86.243.187","TCP","66","443  >  54596 [ACK] Seq=19163 Ack=57994 Win=4680 Len=0 TSval=1973516972 TSecr=282762298"
"1645","3.551381","172.253.62.190","100.86.243.187","TLSv1.2","148","Application Data"
"1646","3.551385","172.253.62.190","100.86.243.187","TLSv1.2","1466","Application Data"
"1647","3.551386","172.253.62.190","100.86.243.187","TLSv1.2","1466","Application Data"
"1648","3.551386","172.253.62.190","100.86.243.187","TLSv1.2","440","Application Data"
"1649","3.551387","172.253.62.190","100.86.243.187","TLSv1.2","97","Application Data"
"1650","3.551493","100.86.243.187","172.253.62.190","TCP","66","54596  >  443 [ACK] Seq=57994 Ack=22450 Win=16259 Len=0 TSval=282762392 TSecr=1973517054"
"1651","3.551775","100.86.243.187","172.253.62.190","TCP","66","[TCP Window Update] 54596  >  443 [ACK] Seq=57994 Ack=22450 Win=16310 Len=0 TSval=282762392 TSecr=1973517054"
"1652","3.552108","172.253.62.190","100.86.243.187","TLSv1.2","105","Application Data"
"1653","3.552165","100.86.243.187","172.253.62.190","TCP","66","54596  >  443 [ACK] Seq=57994 Ack=22489 Win=16309 Len=0 TSval=282762392 TSecr=1973517054"
"1654","3.552250","100.86.243.187","172.253.62.190","TLSv1.2","105","Application Data"
"1655","3.563287","172.253.62.190","100.86.243.187","TCP","66","443  >  54596 [ACK] Seq=22489 Ack=58033 Win=4680 Len=0 TSval=1973517066 TSecr=282762392"
"1656","3.578628","100.86.243.187","172.253.62.190","TCP","1466","54596  >  443 [ACK] Seq=58033 Ack=22489 Win=16310 Len=1400 TSval=282762419 TSecr=1973517066 [TCP PDU reassembled in 1658]"
"1657","3.578631","100.86.243.187","172.253.62.190","TCP","1466","54596  >  443 [ACK] Seq=59433 Ack=22489 Win=16310 Len=1400 TSval=282762419 TSecr=1973517066 [TCP PDU reassembled in 1658]"
"1658","3.578674","100.86.243.187","172.253.62.190","TLSv1.2","624","Application Data"
"1659","3.578735","100.86.243.187","172.253.62.190","TCP","1466","54596  >  443 [ACK] Seq=61391 Ack=22489 Win=16310 Len=1400 TSval=282762419 TSecr=1973517066 [TCP PDU reassembled in 1660]"
"1660","3.578747","100.86.243.187","172.253.62.190","TLSv1.2","483","Application Data"
"1661","3.590093","172.253.62.190","100.86.243.187","TCP","66","443  >  54596 [ACK] Seq=22489 Ack=59433 Win=4691 Len=0 TSval=1973517093 TSecr=282762419"
"1662","3.590098","172.253.62.190","100.86.243.187","TCP","78","[TCP Dup ACK 1661#1] 443  >  54596 [ACK] Seq=22489 Ack=59433 Win=4691 Len=0 TSval=1973517093 TSecr=282762419 SLE=60833 SRE=61391"
"1663","3.590099","172.253.62.190","100.86.243.187","TCP","66","443  >  54596 [ACK] Seq=22489 Ack=63208 Win=4713 Len=0 TSval=1973517093 TSecr=282762419"
"1682","3.654783","100.86.243.187","172.253.62.190","TCP","1466","54596  >  443 [ACK] Seq=63208 Ack=22489 Win=16310 Len=1400 TSval=282762495 TSecr=1973517093 [TCP PDU reassembled in 1684]"
"1683","3.654785","100.86.243.187","172.253.62.190","TCP","1466","54596  >  443 [ACK] Seq=64608 Ack=22489 Win=16310 Len=1400 TSval=282762495 TSecr=1973517093 [TCP PDU reassembled in 1684]"
"1684","3.654827","100.86.243.187","172.253.62.190","TLSv1.2","259","Application Data"
"1685","3.654957","100.86.243.187","172.253.62.190","TCP","1466","54596  >  443 [ACK] Seq=66201 Ack=22489 Win=16310 Len=1400 TSval=282762495 TSecr=1973517093 [TCP PDU reassembled in 1696]"
"1686","3.654958","100.86.243.187","172.253.62.190","TCP","1466","54596  >  443 [ACK] Seq=67601 Ack=22489 Win=16310 Len=1400 TSval=282762495 TSecr=1973517093 [TCP PDU reassembled in 1696]"
"1687","3.654960","100.86.243.187","172.253.62.190","TCP","1466","54596  >  443 [ACK] Seq=69001 Ack=22489 Win=16310 Len=1400 TSval=282762495 TSecr=1973517093 [TCP PDU reassembled in 1696]"
"1688","3.654960","100.86.243.187","172.253.62.190","TCP","1466","54596  >  443 [ACK] Seq=70401 Ack=22489 Win=16310 Len=1400 TSval=282762495 TSecr=1973517093 [TCP PDU reassembled in 1696]"
"1689","3.654961","100.86.243.187","172.253.62.190","TCP","1466","54596  >  443 [ACK] Seq=71801 Ack=22489 Win=16310 Len=1400 TSval=282762495 TSecr=1973517093 [TCP PDU reassembled in 1696]"
"1690","3.654962","100.86.243.187","172.253.62.190","TCP","1466","54596  >  443 [ACK] Seq=73201 Ack=22489 Win=16310 Len=1400 TSval=282762495 TSecr=1973517093 [TCP PDU reassembled in 1696]"
"1691","3.654962","100.86.243.187","172.253.62.190","TCP","1466","54596  >  443 [ACK] Seq=74601 Ack=22489 Win=16310 Len=1400 TSval=282762495 TSecr=1973517093 [TCP PDU reassembled in 1696]"
"1692","3.654962","100.86.243.187","172.253.62.190","TCP","1466","54596  >  443 [ACK] Seq=76001 Ack=22489 Win=16310 Len=1400 TSval=282762495 TSecr=1973517093 [TCP PDU reassembled in 1696]"
"1693","3.654964","100.86.243.187","172.253.62.190","TCP","1466","54596  >  443 [ACK] Seq=77401 Ack=22489 Win=16310 Len=1400 TSval=282762495 TSecr=1973517093 [TCP PDU reassembled in 1696]"
"1694","3.654964","100.86.243.187","172.253.62.190","TCP","1466","54596  >  443 [ACK] Seq=78801 Ack=22489 Win=16310 Len=1400 TSval=282762495 TSecr=1973517093 [TCP PDU reassembled in 1696]"
"1695","3.654966","100.86.243.187","172.253.62.190","TCP","1466","54596  >  443 [ACK] Seq=80201 Ack=22489 Win=16310 Len=1400 TSval=282762495 TSecr=1973517093 [TCP PDU reassembled in 1696]"
"1696","3.654996","100.86.243.187","172.253.62.190","TLSv1.2","697","Application Data"
"1697","3.655069","100.86.243.187","172.253.62.190","TCP","1466","54596  >  443 [ACK] Seq=82232 Ack=22489 Win=16310 Len=1400 TSval=282762495 TSecr=1973517093 [TCP PDU reassembled in 1706]"
"1698","3.655070","100.86.243.187","172.253.62.190","TCP","1466","54596  >  443 [ACK] Seq=83632 Ack=22489 Win=16310 Len=1400 TSval=282762495 TSecr=1973517093 [TCP PDU reassembled in 1706]"
"1699","3.655072","100.86.243.187","172.253.62.190","TCP","1466","54596  >  443 [ACK] Seq=85032 Ack=22489 Win=16310 Len=1400 TSval=282762495 TSecr=1973517093 [TCP PDU reassembled in 1706]"
"1700","3.655074","100.86.243.187","172.253.62.190","TCP","1466","54596  >  443 [ACK] Seq=86432 Ack=22489 Win=16310 Len=1400 TSval=282762495 TSecr=1973517093 [TCP PDU reassembled in 1706]"
"1701","3.655076","100.86.243.187","172.253.62.190","TCP","1466","54596  >  443 [ACK] Seq=87832 Ack=22489 Win=16310 Len=1400 TSval=282762495 TSecr=1973517093 [TCP PDU reassembled in 1706]"
"1702","3.655076","100.86.243.187","172.253.62.190","TCP","1466","54596  >  443 [ACK] Seq=89232 Ack=22489 Win=16310 Len=1400 TSval=282762495 TSecr=1973517093 [TCP PDU reassembled in 1706]"
"1703","3.655077","100.86.243.187","172.253.62.190","TCP","1466","54596  >  443 [ACK] Seq=90632 Ack=22489 Win=16310 Len=1400 TSval=282762495 TSecr=1973517093 [TCP PDU reassembled in 1706]"
"1704","3.655078","100.86.243.187","172.253.62.190","TCP","1466","54596  >  443 [ACK] Seq=92032 Ack=22489 Win=16310 Len=1400 TSval=282762495 TSecr=1973517093 [TCP PDU reassembled in 1706]"
"1705","3.655079","100.86.243.187","172.253.62.190","TCP","1466","54596  >  443 [ACK] Seq=93432 Ack=22489 Win=16310 Len=1400 TSval=282762495 TSecr=1973517093 [TCP PDU reassembled in 1706]"
"1706","3.655100","100.86.243.187","172.253.62.190","TLSv1.2","404","Application Data"
"1707","3.655141","100.86.243.187","172.253.62.190","TLSv1.2","1393","Application Data"
"1708","3.655232","100.86.243.187","172.253.62.190","TCP","1466","54596  >  443 [ACK] Seq=96497 Ack=22489 Win=16310 Len=1400 TSval=282762495 TSecr=1973517093 [TCP PDU reassembled in 1719]"
"1709","3.655233","100.86.243.187","172.253.62.190","TCP","1466","54596  >  443 [ACK] Seq=97897 Ack=22489 Win=16310 Len=1400 TSval=282762495 TSecr=1973517093 [TCP PDU reassembled in 1719]"
"1710","3.655234","100.86.243.187","172.253.62.190","TCP","1466","54596  >  443 [ACK] Seq=99297 Ack=22489 Win=16310 Len=1400 TSval=282762495 TSecr=1973517093 [TCP PDU reassembled in 1719]"
"1711","3.655235","100.86.243.187","172.253.62.190","TCP","1466","54596  >  443 [ACK] Seq=100697 Ack=22489 Win=16310 Len=1400 TSval=282762495 TSecr=1973517093 [TCP PDU reassembled in 1719]"
"1712","3.655236","100.86.243.187","172.253.62.190","TCP","1466","54596  >  443 [ACK] Seq=102097 Ack=22489 Win=16310 Len=1400 TSval=282762495 TSecr=1973517093 [TCP PDU reassembled in 1719]"
"1713","3.655237","100.86.243.187","172.253.62.190","TCP","1466","54596  >  443 [ACK] Seq=103497 Ack=22489 Win=16310 Len=1400 TSval=282762495 TSecr=1973517093 [TCP PDU reassembled in 1719]"
"1714","3.655239","100.86.243.187","172.253.62.190","TCP","1466","54596  >  443 [ACK] Seq=104897 Ack=22489 Win=16310 Len=1400 TSval=282762495 TSecr=1973517093 [TCP PDU reassembled in 1719]"
"1715","3.655240","100.86.243.187","172.253.62.190","TCP","1466","54596  >  443 [ACK] Seq=106297 Ack=22489 Win=16310 Len=1400 TSval=282762495 TSecr=1973517093 [TCP PDU reassembled in 1719]"
"1716","3.655240","100.86.243.187","172.253.62.190","TCP","1466","54596  >  443 [ACK] Seq=107697 Ack=22489 Win=16310 Len=1400 TSval=282762495 TSecr=1973517093 [TCP PDU reassembled in 1719]"
"1717","3.655242","100.86.243.187","172.253.62.190","TCP","1466","54596  >  443 [ACK] Seq=109097 Ack=22489 Win=16310 Len=1400 TSval=282762495 TSecr=1973517093 [TCP PDU reassembled in 1719]"
"1718","3.655243","100.86.243.187","172.253.62.190","TCP","1466","54596  >  443 [ACK] Seq=110497 Ack=22489 Win=16310 Len=1400 TSval=282762495 TSecr=1973517093 [TCP PDU reassembled in 1719]"
"1719","3.655267","100.86.243.187","172.253.62.190","TLSv1.2","697","Application Data"
"1720","3.655341","100.86.243.187","172.253.62.190","TCP","1466","54596  >  443 [ACK] Seq=112528 Ack=22489 Win=16310 Len=1400 TSval=282762495 TSecr=1973517093 [TCP PDU reassembled in 1731]"
"1721","3.655343","100.86.243.187","172.253.62.190","TCP","1466","54596  >  443 [ACK] Seq=113928 Ack=22489 Win=16310 Len=1400 TSval=282762495 TSecr=1973517093 [TCP PDU reassembled in 1731]"
"1722","3.655344","100.86.243.187","172.253.62.190","TCP","1466","54596  >  443 [ACK] Seq=115328 Ack=22489 Win=16310 Len=1400 TSval=282762495 TSecr=1973517093 [TCP PDU reassembled in 1731]"
"1723","3.655345","100.86.243.187","172.253.62.190","TCP","1466","54596  >  443 [ACK] Seq=116728 Ack=22489 Win=16310 Len=1400 TSval=282762495 TSecr=1973517093 [TCP PDU reassembled in 1731]"
"1724","3.655345","100.86.243.187","172.253.62.190","TCP","1466","54596  >  443 [ACK] Seq=118128 Ack=22489 Win=16310 Len=1400 TSval=282762495 TSecr=1973517093 [TCP PDU reassembled in 1731]"
"1725","3.655346","100.86.243.187","172.253.62.190","TCP","1466","54596  >  443 [ACK] Seq=119528 Ack=22489 Win=16310 Len=1400 TSval=282762495 TSecr=1973517093 [TCP PDU reassembled in 1731]"
"1726","3.655347","100.86.243.187","172.253.62.190","TCP","1466","54596  >  443 [ACK] Seq=120928 Ack=22489 Win=16310 Len=1400 TSval=282762495 TSecr=1973517093 [TCP PDU reassembled in 1731]"
"1727","3.655348","100.86.243.187","172.253.62.190","TCP","1466","54596  >  443 [ACK] Seq=122328 Ack=22489 Win=16310 Len=1400 TSval=282762495 TSecr=1973517093 [TCP PDU reassembled in 1731]"
"1728","3.655349","100.86.243.187","172.253.62.190","TCP","1466","54596  >  443 [ACK] Seq=123728 Ack=22489 Win=16310 Len=1400 TSval=282762495 TSecr=1973517093 [TCP PDU reassembled in 1731]"
"1729","3.655350","100.86.243.187","172.253.62.190","TCP","1466","54596  >  443 [ACK] Seq=125128 Ack=22489 Win=16310 Len=1400 TSval=282762495 TSecr=1973517093 [TCP PDU reassembled in 1731]"
"1730","3.655351","100.86.243.187","172.253.62.190","TCP","1466","54596  >  443 [ACK] Seq=126528 Ack=22489 Win=16310 Len=1400 TSval=282762495 TSecr=1973517093 [TCP PDU reassembled in 1731]"
"1731","3.655373","100.86.243.187","172.253.62.190","TLSv1.2","169","Application Data"
"1732","3.655405","100.86.243.187","172.253.62.190","TLSv1.2","641","Application Data"
"1733","3.655456","100.86.243.187","172.253.62.190","TCP","1466","54596  >  443 [ACK] Seq=128606 Ack=22489 Win=16310 Len=1400 TSval=282762495 TSecr=1973517093 [TCP PDU reassembled in 1737]"
"1734","3.655457","100.86.243.187","172.253.62.190","TCP","1466","54596  >  443 [ACK] Seq=130006 Ack=22489 Win=16310 Len=1400 TSval=282762495 TSecr=1973517093 [TCP PDU reassembled in 1737]"
"1735","3.655458","100.86.243.187","172.253.62.190","TCP","1466","54596  >  443 [ACK] Seq=131406 Ack=22489 Win=16310 Len=1400 TSval=282762495 TSecr=1973517093 [TCP PDU reassembled in 1737]"
"1736","3.655459","100.86.243.187","172.253.62.190","TCP","1466","54596  >  443 [ACK] Seq=132806 Ack=22489 Win=16310 Len=1400 TSval=282762495 TSecr=1973517093 [TCP PDU reassembled in 1737]"
"1737","3.655471","100.86.243.187","172.253.62.190","TLSv1.2","1216","Application Data"
"1738","3.666051","172.253.62.190","100.86.243.187","TCP","66","443  >  54596 [ACK] Seq=22489 Ack=66201 Win=4735 Len=0 TSval=1973517169 TSecr=282762495"
"1739","3.667083","172.253.62.190","100.86.243.187","TCP","66","443  >  54596 [ACK] Seq=22489 Ack=69001 Win=4757 Len=0 TSval=1973517170 TSecr=282762495"
"1740","3.667083","172.253.62.190","100.86.243.187","TCP","66","443  >  54596 [ACK] Seq=22489 Ack=74601 Win=4801 Len=0 TSval=1973517170 TSecr=282762495"
"1741","3.667688","172.253.62.190","100.86.243.187","TCP","66","443  >  54596 [ACK] Seq=22489 Ack=80201 Win=4845 Len=0 TSval=1973517171 TSecr=282762495"
"1742","3.667688","172.253.62.190","100.86.243.187","TCP","78","[TCP Dup ACK 1741#1] 443  >  54596 [ACK] Seq=22489 Ack=80201 Win=4845 Len=0 TSval=1973517171 TSecr=282762495 SLE=81601 SRE=82232"
"1743","3.667689","172.253.62.190","100.86.243.187","TCP","66","443  >  54596 [ACK] Seq=22489 Ack=86432 Win=4888 Len=0 TSval=1973517171 TSecr=282762495"
"1744","3.667689","172.253.62.190","100.86.243.187","TCP","66","443  >  54596 [ACK] Seq=22489 Ack=90632 Win=4921 Len=0 TSval=1973517171 TSecr=282762495"
"1745","3.668548","172.253.62.190","100.86.243.187","TCP","66","443  >  54596 [ACK] Seq=22489 Ack=92032 Win=4932 Len=0 TSval=1973517172 TSecr=282762495"
"1746","3.668548","172.253.62.190","100.86.243.187","TCP","78","[TCP Dup ACK 1745#1] 443  >  54596 [ACK] Seq=22489 Ack=92032 Win=4932 Len=0 TSval=1973517172 TSecr=282762495 SLE=94832 SRE=95170"
"1747","3.668549","172.253.62.190","100.86.243.187","TCP","66","443  >  54596 [ACK] Seq=22489 Ack=97897 Win=4976 Len=0 TSval=1973517172 TSecr=282762495"
"1748","3.668549","172.253.62.190","100.86.243.187","TCP","66","443  >  54596 [ACK] Seq=22489 Ack=103497 Win=5020 Len=0 TSval=1973517172 TSecr=282762495"
"1749","3.669500","172.253.62.190","100.86.243.187","TCP","66","443  >  54596 [ACK] Seq=22489 Ack=111897 Win=5085 Len=0 TSval=1973517172 TSecr=282762495"
"1750","3.669527","172.253.62.190","100.86.243.187","TCP","66","443  >  54596 [ACK] Seq=22489 Ack=116728 Win=5129 Len=0 TSval=1973517173 TSecr=282762495"
"1751","3.670253","172.253.62.190","100.86.243.187","TCP","66","443  >  54596 [ACK] Seq=22489 Ack=122328 Win=5173 Len=0 TSval=1973517173 TSecr=282762495"
"1752","3.670253","172.253.62.190","100.86.243.187","TCP","66","443  >  54596 [ACK] Seq=22489 Ack=123728 Win=5184 Len=0 TSval=1973517174 TSecr=282762495"
"1753","3.670254","172.253.62.190","100.86.243.187","TCP","78","[TCP Dup ACK 1752#1] 443  >  54596 [ACK] Seq=22489 Ack=123728 Win=5184 Len=0 TSval=1973517174 TSecr=282762495 SLE=127928 SRE=128031"
"1754","3.670257","172.253.62.190","100.86.243.187","TCP","78","443  >  54596 [ACK] Seq=22489 Ack=126528 Win=5216 Len=0 TSval=1973517174 TSecr=282762495 SLE=127928 SRE=128606"
"1755","3.670257","172.253.62.190","100.86.243.187","TCP","66","443  >  54596 [ACK] Seq=22489 Ack=128606 Win=5227 Len=0 TSval=1973517174 TSecr=282762495"
"1756","3.671020","172.253.62.190","100.86.243.187","TCP","66","443  >  54596 [ACK] Seq=22489 Ack=131406 Win=5249 Len=0 TSval=1973517174 TSecr=282762495"
"1757","3.671021","172.253.62.190","100.86.243.187","TCP","78","[TCP Dup ACK 1756#1] 443  >  54596 [ACK] Seq=22489 Ack=131406 Win=5260 Len=0 TSval=1973517174 TSecr=282762495 SLE=134206 SRE=135356"
"1758","3.671021","172.253.62.190","100.86.243.187","TCP","66","443  >  54596 [ACK] Seq=22489 Ack=135356 Win=5282 Len=0 TSval=1973517174 TSecr=282762495"
"1759","3.748055","172.253.62.190","100.86.243.187","TLSv1.2","148","Application Data"
"1760","3.748139","172.253.62.190","100.86.243.187","TLSv1.2","1466","Application Data"
"1761","3.748140","172.253.62.190","100.86.243.187","TLSv1.2","1466","Application Data"
"1762","3.748248","100.86.243.187","172.253.62.190","TCP","66","54596  >  443 [ACK] Seq=135356 Ack=22571 Win=16309 Len=0 TSval=282762589 TSecr=1973517251"
"1763","3.748355","172.253.62.190","100.86.243.187","TLSv1.2","1466","Application Data"
"1764","3.748364","172.253.62.190","100.86.243.187","TLSv1.2","766","Application Data"
"1765","3.748415","100.86.243.187","172.253.62.190","TCP","66","54596  >  443 [ACK] Seq=135356 Ack=25371 Win=16265 Len=0 TSval=282762589 TSecr=1973517251"
"1766","3.748469","100.86.243.187","172.253.62.190","TCP","66","54596  >  443 [ACK] Seq=135356 Ack=27471 Win=16233 Len=0 TSval=282762589 TSecr=1973517251"
"1767","3.748867","172.253.62.190","100.86.243.187","TLSv1.2","97","Application Data"
"1768","3.748877","172.253.62.190","100.86.243.187","TLSv1.2","105","Application Data"
"1769","3.748906","100.86.243.187","172.253.62.190","TCP","66","[TCP Window Update] 54596  >  443 [ACK] Seq=135356 Ack=27471 Win=16310 Len=0 TSval=282762589 TSecr=1973517251"
"1770","3.748966","100.86.243.187","172.253.62.190","TCP","66","54596  >  443 [ACK] Seq=135356 Ack=27541 Win=16309 Len=0 TSval=282762589 TSecr=1973517251"
"1771","3.749207","100.86.243.187","172.253.62.190","TLSv1.2","105","Application Data"
"1772","3.759930","172.253.62.190","100.86.243.187","TCP","66","443  >  54596 [ACK] Seq=27541 Ack=135395 Win=5282 Len=0 TSval=1973517263 TSecr=282762590"
"1773","4.459720","172.253.62.190","100.86.243.187","TLSv1.2","149","Application Data"
"1774","4.459866","100.86.243.187","172.253.62.190","TCP","66","54596  >  443 [ACK] Seq=135395 Ack=27624 Win=16309 Len=0 TSval=282763300 TSecr=1973517793"
"1775","4.460908","172.253.62.190","100.86.243.187","TLSv1.2","1466","Application Data"
"1776","4.460910","172.253.62.190","100.86.243.187","TLSv1.2","1466","Application Data"
"1777","4.460911","172.253.62.190","100.86.243.187","TLSv1.2","1466","Application Data"
"1778","4.460912","172.253.62.190","100.86.243.187","TLSv1.2","1466","Application Data"
"1779","4.460913","172.253.62.190","100.86.243.187","TLSv1.2","1466","Application Data"
"1780","4.460914","172.253.62.190","100.86.243.187","TLSv1.2","1466","Application Data"
"1781","4.460915","172.253.62.190","100.86.243.187","TLSv1.2","1466","Application Data"
"1782","4.460916","172.253.62.190","100.86.243.187","TLSv1.2","1466","Application Data"
"1783","4.460916","172.253.62.190","100.86.243.187","TLSv1.2","1466","Application Data"
"1784","4.460918","172.253.62.190","100.86.243.187","TLSv1.2","1466","Application Data"
"1785","4.460919","172.253.62.190","100.86.243.187","TLSv1.2","1466","Application Data"
"1786","4.460920","172.253.62.190","100.86.243.187","TLSv1.2","1466","Application Data"
"1787","4.460921","172.253.62.190","100.86.243.187","TLSv1.2","1466","Application Data"
"1788","4.460922","172.253.62.190","100.86.243.187","TLSv1.2","656","Application Data"
"1789","4.460923","172.253.62.190","100.86.243.187","TLSv1.2","97","Application Data"
"1790","4.460923","172.253.62.190","100.86.243.187","TLSv1.2","105","Application Data"
"1791","4.460924","172.253.62.190","100.86.243.187","TCP","105","[TCP Retransmission] 443  >  54596 [PSH, ACK] Seq=46445 Ack=135395 Win=5282 Len=39 TSval=1973517821 TSecr=282762590"
"1794","4.461252","100.86.243.187","172.253.62.190","TCP","66","54596  >  443 [ACK] Seq=135395 Ack=43024 Win=16069 Len=0 TSval=282763302 TSecr=1973517794"
"1796","4.461322","100.86.243.187","172.253.62.190","TCP","66","54596  >  443 [ACK] Seq=135395 Ack=46484 Win=16015 Len=0 TSval=282763302 TSecr=1973517794"
"1797","4.461442","100.86.243.187","172.253.62.190","TCP","78","[TCP Dup ACK 1796#1] 54596  >  443 [ACK] Seq=135395 Ack=46484 Win=16015 Len=0 TSval=282763302 TSecr=1973517821 SLE=46445 SRE=46484"
"1799","4.462392","100.86.243.187","172.253.62.190","TCP","66","[TCP Window Update] 54596  >  443 [ACK] Seq=135395 Ack=46484 Win=16310 Len=0 TSval=282763303 TSecr=1973517821"
"1800","4.462483","100.86.243.187","172.253.62.190","TLSv1.2","105","Application Data"
"1804","4.473903","172.253.62.190","100.86.243.187","TCP","66","443  >  54596 [ACK] Seq=46484 Ack=135434 Win=5282 Len=0 TSval=1973517977 TSecr=282763303"
"1805","4.617668","100.86.243.187","172.253.62.190","TCP","1466","54596  >  443 [ACK] Seq=135434 Ack=46484 Win=16310 Len=1400 TSval=282763458 TSecr=1973517977 [TCP PDU reassembled in 1807]"
"1806","4.617670","100.86.243.187","172.253.62.190","TCP","1466","54596  >  443 [ACK] Seq=136834 Ack=46484 Win=16310 Len=1400 TSval=282763458 TSecr=1973517977 [TCP PDU reassembled in 1807]"
"1807","4.617709","100.86.243.187","172.253.62.190","TLSv1.2","259","Application Data"
"1808","4.617797","100.86.243.187","172.253.62.190","TCP","1466","54596  >  443 [ACK] Seq=138427 Ack=46484 Win=16310 Len=1400 TSval=282763458 TSecr=1973517977 [TCP PDU reassembled in 1819]"
"1809","4.617798","100.86.243.187","172.253.62.190","TCP","1466","54596  >  443 [ACK] Seq=139827 Ack=46484 Win=16310 Len=1400 TSval=282763458 TSecr=1973517977 [TCP PDU reassembled in 1819]"
"1810","4.617800","100.86.243.187","172.253.62.190","TCP","1466","54596  >  443 [ACK] Seq=141227 Ack=46484 Win=16310 Len=1400 TSval=282763458 TSecr=1973517977 [TCP PDU reassembled in 1819]"
"1811","4.617801","100.86.243.187","172.253.62.190","TCP","1466","54596  >  443 [ACK] Seq=142627 Ack=46484 Win=16310 Len=1400 TSval=282763458 TSecr=1973517977 [TCP PDU reassembled in 1819]"
"1812","4.617803","100.86.243.187","172.253.62.190","TCP","1466","54596  >  443 [ACK] Seq=144027 Ack=46484 Win=16310 Len=1400 TSval=282763458 TSecr=1973517977 [TCP PDU reassembled in 1819]"
"1813","4.617803","100.86.243.187","172.253.62.190","TCP","1466","54596  >  443 [ACK] Seq=145427 Ack=46484 Win=16310 Len=1400 TSval=282763458 TSecr=1973517977 [TCP PDU reassembled in 1819]"
"1814","4.617805","100.86.243.187","172.253.62.190","TCP","1466","54596  >  443 [ACK] Seq=146827 Ack=46484 Win=16310 Len=1400 TSval=282763458 TSecr=1973517977 [TCP PDU reassembled in 1819]"
"1815","4.617806","100.86.243.187","172.253.62.190","TCP","1466","54596  >  443 [ACK] Seq=148227 Ack=46484 Win=16310 Len=1400 TSval=282763458 TSecr=1973517977 [TCP PDU reassembled in 1819]"
"1816","4.617807","100.86.243.187","172.253.62.190","TCP","1466","54596  >  443 [ACK] Seq=149627 Ack=46484 Win=16310 Len=1400 TSval=282763458 TSecr=1973517977 [TCP PDU reassembled in 1819]"
"1817","4.617807","100.86.243.187","172.253.62.190","TCP","1466","54596  >  443 [ACK] Seq=151027 Ack=46484 Win=16310 Len=1400 TSval=282763458 TSecr=1973517977 [TCP PDU reassembled in 1819]"
"1818","4.617808","100.86.243.187","172.253.62.190","TCP","1466","54596  >  443 [ACK] Seq=152427 Ack=46484 Win=16310 Len=1400 TSval=282763458 TSecr=1973517977 [TCP PDU reassembled in 1819]"
"1819","4.617826","100.86.243.187","172.253.62.190","TLSv1.2","697","Application Data"
"1820","4.617885","100.86.243.187","172.253.62.190","TCP","1466","54596  >  443 [ACK] Seq=154458 Ack=46484 Win=16310 Len=1400 TSval=282763458 TSecr=1973517977 [TCP PDU reassembled in 1829]"
"1821","4.617886","100.86.243.187","172.253.62.190","TCP","1466","54596  >  443 [ACK] Seq=155858 Ack=46484 Win=16310 Len=1400 TSval=282763458 TSecr=1973517977 [TCP PDU reassembled in 1829]"
"1822","4.617887","100.86.243.187","172.253.62.190","TCP","1466","54596  >  443 [ACK] Seq=157258 Ack=46484 Win=16310 Len=1400 TSval=282763458 TSecr=1973517977 [TCP PDU reassembled in 1829]"
"1823","4.617888","100.86.243.187","172.253.62.190","TCP","1466","54596  >  443 [ACK] Seq=158658 Ack=46484 Win=16310 Len=1400 TSval=282763458 TSecr=1973517977 [TCP PDU reassembled in 1829]"
"1824","4.617889","100.86.243.187","172.253.62.190","TCP","1466","54596  >  443 [ACK] Seq=160058 Ack=46484 Win=16310 Len=1400 TSval=282763458 TSecr=1973517977 [TCP PDU reassembled in 1829]"
"1825","4.617890","100.86.243.187","172.253.62.190","TCP","1466","54596  >  443 [ACK] Seq=161458 Ack=46484 Win=16310 Len=1400 TSval=282763458 TSecr=1973517977 [TCP PDU reassembled in 1829]"
"1826","4.617891","100.86.243.187","172.253.62.190","TCP","1466","54596  >  443 [ACK] Seq=162858 Ack=46484 Win=16310 Len=1400 TSval=282763458 TSecr=1973517977 [TCP PDU reassembled in 1829]"
"1827","4.617892","100.86.243.187","172.253.62.190","TCP","1466","54596  >  443 [ACK] Seq=164258 Ack=46484 Win=16310 Len=1400 TSval=282763458 TSecr=1973517977 [TCP PDU reassembled in 1829]"
"1828","4.617892","100.86.243.187","172.253.62.190","TCP","1466","54596  >  443 [ACK] Seq=165658 Ack=46484 Win=16310 Len=1400 TSval=282763458 TSecr=1973517977 [TCP PDU reassembled in 1829]"
"1829","4.617907","100.86.243.187","172.253.62.190","TLSv1.2","405","Application Data"
"1830","4.617936","100.86.243.187","172.253.62.190","TLSv1.2","1393","Application Data"
"1831","4.618010","100.86.243.187","172.253.62.190","TCP","1466","54596  >  443 [ACK] Seq=168724 Ack=46484 Win=16310 Len=1400 TSval=282763458 TSecr=1973517977 [TCP PDU reassembled in 1842]"
"1832","4.618011","100.86.243.187","172.253.62.190","TCP","1466","54596  >  443 [ACK] Seq=170124 Ack=46484 Win=16310 Len=1400 TSval=282763458 TSecr=1973517977 [TCP PDU reassembled in 1842]"
"1833","4.618012","100.86.243.187","172.253.62.190","TCP","1466","54596  >  443 [ACK] Seq=171524 Ack=46484 Win=16310 Len=1400 TSval=282763458 TSecr=1973517977 [TCP PDU reassembled in 1842]"
"1834","4.618013","100.86.243.187","172.253.62.190","TCP","1466","54596  >  443 [ACK] Seq=172924 Ack=46484 Win=16310 Len=1400 TSval=282763458 TSecr=1973517977 [TCP PDU reassembled in 1842]"
"1835","4.618014","100.86.243.187","172.253.62.190","TCP","1466","54596  >  443 [ACK] Seq=174324 Ack=46484 Win=16310 Len=1400 TSval=282763458 TSecr=1973517977 [TCP PDU reassembled in 1842]"
"1836","4.618015","100.86.243.187","172.253.62.190","TCP","1466","54596  >  443 [ACK] Seq=175724 Ack=46484 Win=16310 Len=1400 TSval=282763458 TSecr=1973517977 [TCP PDU reassembled in 1842]"
"1837","4.618016","100.86.243.187","172.253.62.190","TCP","1466","54596  >  443 [ACK] Seq=177124 Ack=46484 Win=16310 Len=1400 TSval=282763458 TSecr=1973517977 [TCP PDU reassembled in 1842]"
"1838","4.618016","100.86.243.187","172.253.62.190","TCP","1466","54596  >  443 [ACK] Seq=178524 Ack=46484 Win=16310 Len=1400 TSval=282763458 TSecr=1973517977 [TCP PDU reassembled in 1842]"
"1839","4.618017","100.86.243.187","172.253.62.190","TCP","1466","54596  >  443 [ACK] Seq=179924 Ack=46484 Win=16310 Len=1400 TSval=282763458 TSecr=1973517977 [TCP PDU reassembled in 1842]"
"1840","4.618018","100.86.243.187","172.253.62.190","TCP","1466","54596  >  443 [ACK] Seq=181324 Ack=46484 Win=16310 Len=1400 TSval=282763458 TSecr=1973517977 [TCP PDU reassembled in 1842]"
"1841","4.618019","100.86.243.187","172.253.62.190","TCP","1466","54596  >  443 [ACK] Seq=182724 Ack=46484 Win=16310 Len=1400 TSval=282763458 TSecr=1973517977 [TCP PDU reassembled in 1842]"
"1842","4.618035","100.86.243.187","172.253.62.190","TLSv1.2","697","Application Data"
"1843","4.618099","100.86.243.187","172.253.62.190","TCP","1466","54596  >  443 [ACK] Seq=184755 Ack=46484 Win=16310 Len=1400 TSval=282763458 TSecr=1973517977 [TCP PDU reassembled in 1854]"
"1844","4.618100","100.86.243.187","172.253.62.190","TCP","1466","54596  >  443 [ACK] Seq=186155 Ack=46484 Win=16310 Len=1400 TSval=282763458 TSecr=1973517977 [TCP PDU reassembled in 1854]"
"1845","4.618101","100.86.243.187","172.253.62.190","TCP","1466","54596  >  443 [ACK] Seq=187555 Ack=46484 Win=16310 Len=1400 TSval=282763458 TSecr=1973517977 [TCP PDU reassembled in 1854]"
"1846","4.618102","100.86.243.187","172.253.62.190","TCP","1466","54596  >  443 [ACK] Seq=188955 Ack=46484 Win=16310 Len=1400 TSval=282763458 TSecr=1973517977 [TCP PDU reassembled in 1854]"
"1847","4.618103","100.86.243.187","172.253.62.190","TCP","1466","54596  >  443 [ACK] Seq=190355 Ack=46484 Win=16310 Len=1400 TSval=282763458 TSecr=1973517977 [TCP PDU reassembled in 1854]"
"1848","4.618104","100.86.243.187","172.253.62.190","TCP","1466","54596  >  443 [ACK] Seq=191755 Ack=46484 Win=16310 Len=1400 TSval=282763458 TSecr=1973517977 [TCP PDU reassembled in 1854]"
"1849","4.618104","100.86.243.187","172.253.62.190","TCP","1466","54596  >  443 [ACK] Seq=193155 Ack=46484 Win=16310 Len=1400 TSval=282763458 TSecr=1973517977 [TCP PDU reassembled in 1854]"
"1850","4.618105","100.86.243.187","172.253.62.190","TCP","1466","54596  >  443 [ACK] Seq=194555 Ack=46484 Win=16310 Len=1400 TSval=282763458 TSecr=1973517977 [TCP PDU reassembled in 1854]"
"1851","4.618105","100.86.243.187","172.253.62.190","TCP","1466","54596  >  443 [ACK] Seq=195955 Ack=46484 Win=16310 Len=1400 TSval=282763458 TSecr=1973517977 [TCP PDU reassembled in 1854]"
"1852","4.618107","100.86.243.187","172.253.62.190","TCP","1466","54596  >  443 [ACK] Seq=197355 Ack=46484 Win=16310 Len=1400 TSval=282763458 TSecr=1973517977 [TCP PDU reassembled in 1854]"
"1853","4.618108","100.86.243.187","172.253.62.190","TCP","1466","54596  >  443 [ACK] Seq=198755 Ack=46484 Win=16310 Len=1400 TSval=282763458 TSecr=1973517977 [TCP PDU reassembled in 1854]"
"1854","4.618123","100.86.243.187","172.253.62.190","TLSv1.2","169","Application Data"
"1855","4.618148","100.86.243.187","172.253.62.190","TLSv1.2","641","Application Data"
"1856","4.618214","100.86.243.187","172.253.62.190","TCP","1466","54596  >  443 [ACK] Seq=200833 Ack=46484 Win=16310 Len=1400 TSval=282763458 TSecr=1973517977 [TCP PDU reassembled in 1866]"
"1857","4.618215","100.86.243.187","172.253.62.190","TCP","1466","54596  >  443 [ACK] Seq=202233 Ack=46484 Win=16310 Len=1400 TSval=282763458 TSecr=1973517977 [TCP PDU reassembled in 1866]"
"1858","4.618216","100.86.243.187","172.253.62.190","TCP","1466","54596  >  443 [ACK] Seq=203633 Ack=46484 Win=16310 Len=1400 TSval=282763458 TSecr=1973517977 [TCP PDU reassembled in 1866]"
"1859","4.618217","100.86.243.187","172.253.62.190","TCP","1466","54596  >  443 [ACK] Seq=205033 Ack=46484 Win=16310 Len=1400 TSval=282763458 TSecr=1973517977 [TCP PDU reassembled in 1866]"
"1860","4.618218","100.86.243.187","172.253.62.190","TCP","1466","54596  >  443 [ACK] Seq=206433 Ack=46484 Win=16310 Len=1400 TSval=282763458 TSecr=1973517977 [TCP PDU reassembled in 1866]"
"1861","4.618219","100.86.243.187","172.253.62.190","TCP","1466","54596  >  443 [ACK] Seq=207833 Ack=46484 Win=16310 Len=1400 TSval=282763458 TSecr=1973517977 [TCP PDU reassembled in 1866]"
"1862","4.618220","100.86.243.187","172.253.62.190","TCP","1466","54596  >  443 [ACK] Seq=209233 Ack=46484 Win=16310 Len=1400 TSval=282763458 TSecr=1973517977 [TCP PDU reassembled in 1866]"
"1863","4.618221","100.86.243.187","172.253.62.190","TCP","1466","54596  >  443 [ACK] Seq=210633 Ack=46484 Win=16310 Len=1400 TSval=282763458 TSecr=1973517977 [TCP PDU reassembled in 1866]"
"1864","4.618221","100.86.243.187","172.253.62.190","TCP","1466","54596  >  443 [ACK] Seq=212033 Ack=46484 Win=16310 Len=1400 TSval=282763458 TSecr=1973517977 [TCP PDU reassembled in 1866]"
"1865","4.618222","100.86.243.187","172.253.62.190","TCP","1466","54596  >  443 [ACK] Seq=213433 Ack=46484 Win=16310 Len=1400 TSval=282763458 TSecr=1973517977 [TCP PDU reassembled in 1866]"
"1866","4.618237","100.86.243.187","172.253.62.190","TLSv1.2","230","Application Data"
"1867","4.629143","172.253.62.190","100.86.243.187","TCP","66","443  >  54596 [ACK] Seq=46484 Ack=136834 Win=5293 Len=0 TSval=1973518132 TSecr=282763458"
"1868","4.629144","172.253.62.190","100.86.243.187","TCP","78","[TCP Dup ACK 1867#1] 443  >  54596 [ACK] Seq=46484 Ack=136834 Win=5293 Len=0 TSval=1973518132 TSecr=282763458 SLE=138234 SRE=138427"
"1869","4.629144","172.253.62.190","100.86.243.187","TCP","66","443  >  54596 [ACK] Seq=46484 Ack=148227 Win=5380 Len=0 TSval=1973518132 TSecr=282763458"
"1870","4.630024","172.253.62.190","100.86.243.187","TCP","66","443  >  54596 [ACK] Seq=46484 Ack=153827 Win=5424 Len=0 TSval=1973518133 TSecr=282763458"
"1871","4.630024","172.253.62.190","100.86.243.187","TCP","66","443  >  54596 [ACK] Seq=46484 Ack=157258 Win=5457 Len=0 TSval=1973518133 TSecr=282763458"
"1872","4.630025","172.253.62.190","100.86.243.187","TCP","66","443  >  54596 [ACK] Seq=46484 Ack=158658 Win=5468 Len=0 TSval=1973518133 TSecr=282763458"
"1873","4.630689","172.253.62.190","100.86.243.187","TCP","66","443  >  54596 [ACK] Seq=46484 Ack=167058 Win=5534 Len=0 TSval=1973518134 TSecr=282763458"
"1874","4.630690","172.253.62.190","100.86.243.187","TCP","66","443  >  54596 [ACK] Seq=46484 Ack=171524 Win=5566 Len=0 TSval=1973518134 TSecr=282763458"
"1875","4.631263","172.253.62.190","100.86.243.187","TCP","66","443  >  54596 [ACK] Seq=46484 Ack=174324 Win=5588 Len=0 TSval=1973518134 TSecr=282763458"
"1876","4.631264","172.253.62.190","100.86.243.187","TCP","66","443  >  54596 [ACK] Seq=46484 Ack=182724 Win=5654 Len=0 TSval=1973518135 TSecr=282763458"
"1877","4.631264","172.253.62.190","100.86.243.187","TCP","66","443  >  54596 [ACK] Seq=46484 Ack=184755 Win=5676 Len=0 TSval=1973518135 TSecr=282763458"
"1878","4.631889","172.253.62.190","100.86.243.187","TCP","66","443  >  54596 [ACK] Seq=46484 Ack=198755 Win=5785 Len=0 TSval=1973518135 TSecr=282763458"
"1879","4.631890","172.253.62.190","100.86.243.187","TCP","78","[TCP Dup ACK 1878#1] 443  >  54596 [ACK] Seq=46484 Ack=198755 Win=5785 Len=0 TSval=1973518135 TSecr=282763458 SLE=200155 SRE=200258"
"1880","4.631890","172.253.62.190","100.86.243.187","TCP","66","443  >  54596 [ACK] Seq=46484 Ack=200258 Win=5796 Len=0 TSval=1973518135 TSecr=282763458"
"1881","4.632631","172.253.62.190","100.86.243.187","TCP","66","443  >  54596 [ACK] Seq=46484 Ack=205033 Win=5840 Len=0 TSval=1973518136 TSecr=282763458"
"1882","4.632783","172.253.62.190","100.86.243.187","TCP","66","443  >  54596 [ACK] Seq=46484 Ack=210633 Win=5884 Len=0 TSval=1973518136 TSecr=282763458"
"1883","4.634571","172.253.62.190","100.86.243.187","TCP","78","[TCP Dup ACK 1882#1] 443  >  54596 [ACK] Seq=46484 Ack=210633 Win=5884 Len=0 TSval=1973518136 TSecr=282763458 SLE=214833 SRE=214997"
"1884","4.634572","172.253.62.190","100.86.243.187","TCP","66","443  >  54596 [ACK] Seq=46484 Ack=214997 Win=5916 Len=0 TSval=1973518136 TSecr=282763458"
"2121","5.531688","172.253.62.190","100.86.243.187","TLSv1.2","149","Application Data"
"2122","5.531874","100.86.243.187","172.253.62.190","TCP","66","54596  >  443 [ACK] Seq=214997 Ack=46567 Win=16310 Len=0 TSval=282764372 TSecr=1973519035"
"2123","5.532313","172.253.62.190","100.86.243.187","TLSv1.2","1466","Application Data"
"2124","5.532314","172.253.62.190","100.86.243.187","TLSv1.2","1466","Application Data"
"2125","5.532314","172.253.62.190","100.86.243.187","TLSv1.2","1466","Application Data"
"2126","5.532315","172.253.62.190","100.86.243.187","TLSv1.2","1466","Application Data"
"2127","5.532505","100.86.243.187","172.253.62.190","TCP","66","54596  >  443 [ACK] Seq=214997 Ack=52167 Win=16310 Len=0 TSval=282764372 TSecr=1973519035"
"2128","5.532968","172.253.62.190","100.86.243.187","TLSv1.2","1466","Application Data"
"2129","5.532968","172.253.62.190","100.86.243.187","TLSv1.2","1466","Application Data"
"2130","5.533073","100.86.243.187","172.253.62.190","TCP","66","54596  >  443 [ACK] Seq=214997 Ack=54967 Win=16310 Len=0 TSval=282764373 TSecr=1973519035"
"2131","5.534186","172.253.62.190","100.86.243.187","TLSv1.2","1466","Application Data"
"2132","5.534187","172.253.62.190","100.86.243.187","TLSv1.2","1466","Application Data"
"2133","5.534188","172.253.62.190","100.86.243.187","TLSv1.2","1466","Application Data"
"2134","5.534189","172.253.62.190","100.86.243.187","TLSv1.2","1466","Application Data"
"2135","5.534189","172.253.62.190","100.86.243.187","TLSv1.2","1355","Application Data"
"2136","5.534190","172.253.62.190","100.86.243.187","TLSv1.2","1466","Application Data"
"2137","5.534191","172.253.62.190","100.86.243.187","TLSv1.2","1466","Application Data"
"2138","5.534191","172.253.62.190","100.86.243.187","TLSv1.2","1466","Application Data"
"2139","5.534192","172.253.62.190","100.86.243.187","TLSv1.2","1466","Application Data"
"2140","5.534192","172.253.62.190","100.86.243.187","TLSv1.2","1466","Application Data"
"2141","5.534193","172.253.62.190","100.86.243.187","TLSv1.2","1466","Application Data"
"2142","5.534193","172.253.62.190","100.86.243.187","TLSv1.2","1466","Application Data"
"2143","5.534194","172.253.62.190","100.86.243.187","TLSv1.2","1466","Application Data"
"2144","5.534194","172.253.62.190","100.86.243.187","TLSv1.2","1466","Application Data"
"2145","5.534195","172.253.62.190","100.86.243.187","TLSv1.2","1466","Application Data"
"2146","5.534195","172.253.62.190","100.86.243.187","TLSv1.2","1466","Application Data"
"2147","5.534524","100.86.243.187","172.253.62.190","TCP","66","54596  >  443 [ACK] Seq=214997 Ack=77256 Win=16310 Len=0 TSval=282764375 TSecr=1973519036"
"2148","5.534962","172.253.62.190","100.86.243.187","TLSv1.2","1466","Application Data"
"2149","5.534963","172.253.62.190","100.86.243.187","TLSv1.2","196","Application Data"
"2150","5.535080","100.86.243.187","172.253.62.190","TCP","66","54596  >  443 [ACK] Seq=214997 Ack=78786 Win=16310 Len=0 TSval=282764375 TSecr=1973519037"
"2151","5.535130","172.253.62.190","100.86.243.187","TLSv1.2","1466","Application Data"
"2152","5.535131","172.253.62.190","100.86.243.187","TLSv1.2","1466","Application Data"
"2153","5.535132","172.253.62.190","100.86.243.187","TLSv1.2","1466","Application Data"
"2154","5.535132","172.253.62.190","100.86.243.187","TLSv1.2","1466","Application Data"
"2155","5.535242","100.86.243.187","172.253.62.190","TCP","66","54596  >  443 [ACK] Seq=214997 Ack=84386 Win=16310 Len=0 TSval=282764375 TSecr=1973519037"
"2156","5.536602","172.253.62.190","100.86.243.187","TLSv1.2","1466","Application Data"
"2157","5.536602","172.253.62.190","100.86.243.187","TLSv1.2","1466","Application Data"
"2158","5.536603","172.253.62.190","100.86.243.187","TLSv1.2","1466","Application Data"
"2159","5.536604","172.253.62.190","100.86.243.187","TLSv1.2","252","Application Data"
"2160","5.536604","172.253.62.190","100.86.243.187","TLSv1.2","97","Application Data"
"2161","5.536605","172.253.62.190","100.86.243.187","TLSv1.2","105","Application Data"
"2162","5.536873","100.86.243.187","172.253.62.190","TCP","66","54596  >  443 [ACK] Seq=214997 Ack=88842 Win=16310 Len=0 TSval=282764377 TSecr=1973519037"
"2163","5.536924","100.86.243.187","172.253.62.190","TLSv1.2","105","Application Data"
"2164","5.547395","172.253.62.190","100.86.243.187","TCP","66","443  >  54596 [ACK] Seq=88842 Ack=215036 Win=5916 Len=0 TSval=1973519050 TSecr=282764377"
