"No.","Time","Source","Destination","Protocol","Length","Info"
"1","0.000000","100.86.243.187","172.253.122.93","TLSv1.2","860","Application Data"
"2","0.016911","172.253.122.93","100.86.243.187","TCP","66","443  >  56045 [ACK] Seq=1 Ack=795 Win=541 Len=0 TSval=960827892 TSecr=758418450"
"3","0.073529","172.253.122.93","100.86.243.187","TLSv1.2","623","Application Data"
"4","0.073530","172.253.122.93","100.86.243.187","TLSv1.2","1466","Application Data"
"5","0.073530","172.253.122.93","100.86.243.187","TLSv1.2","1466","Application Data"
"6","0.073534","172.253.122.93","100.86.243.187","TLSv1.2","630","Application Data"
"7","0.073535","172.253.122.93","100.86.243.187","TLSv1.2","98","Application Data"
"8","0.073604","100.86.243.187","172.253.122.93","TCP","66","56045  >  443 [ACK] Seq=795 Ack=3954 Win=8220 Len=0 TSval=758418524 TSecr=960827948"
"9","0.073882","100.86.243.187","172.253.122.93","TCP","66","[TCP Window Update] 56045  >  443 [ACK] Seq=795 Ack=3954 Win=8282 Len=0 TSval=758418524 TSecr=960827948"
"10","0.074004","172.253.122.93","100.86.243.187","TLSv1.2","97","Application Data"
"11","0.074004","172.253.122.93","100.86.243.187","TLSv1.2","105","Application Data"
"12","0.074062","100.86.243.187","172.253.122.93","TCP","66","56045  >  443 [ACK] Seq=795 Ack=4024 Win=8281 Len=0 TSval=758418524 TSecr=960827949"
"13","0.074188","100.86.243.187","172.253.122.93","TLSv1.2","105","Application Data"
"14","0.084691","172.253.122.93","100.86.243.187","TCP","66","443  >  56045 [ACK] Seq=4024 Ack=834 Win=544 Len=0 TSval=960827960 TSecr=758418524"
"17","0.200571","100.86.243.187","172.253.122.93","TCP","1466","56045  >  443 [ACK] Seq=834 Ack=4024 Win=8282 Len=1400 TSval=758418651 TSecr=960827960 [TCP PDU reassembled in 18]"
"18","0.200607","100.86.243.187","172.253.122.93","TLSv1.2","510","Application Data"
"19","0.200800","100.86.243.187","172.253.122.93","TLSv1.2","273","Application Data"
"20","0.202344","100.86.243.187","172.253.122.93","TLSv1.2","101","Application Data"
"21","0.202808","100.86.243.187","172.253.122.93","TLSv1.2","101","Application Data"
"22","0.212573","172.253.122.93","100.86.243.187","TCP","66","443  >  56045 [ACK] Seq=4024 Ack=2678 Win=538 Len=0 TSval=960828086 TSecr=758418651"
"23","0.212574","172.253.122.93","100.86.243.187","TCP","66","443  >  56045 [ACK] Seq=4024 Ack=2885 Win=539 Len=0 TSval=960828087 TSecr=758418651"
"24","0.212574","172.253.122.93","100.86.243.187","TCP","66","443  >  56045 [ACK] Seq=4024 Ack=2955 Win=543 Len=0 TSval=960828088 TSecr=758418653"
"28","0.765949","172.253.122.93","100.86.243.187","TLSv1.2","144","Application Data"
"29","0.766073","100.86.243.187","172.253.122.93","TCP","66","56045  >  443 [ACK] Seq=2955 Ack=4102 Win=8281 Len=0 TSval=758419216 TSecr=960828640"
"30","0.828635","172.253.122.93","100.86.243.187","TLSv1.2","1466","[TCP Previous segment not captured] , Application Data"
"31","0.828637","172.253.122.93","100.86.243.187","TLSv1.2","1466","Application Data"
"32","0.828637","172.253.122.93","100.86.243.187","TLSv1.2","1466","Application Data"
"33","0.828856","100.86.243.187","172.253.122.93","TCP","78","[TCP Dup ACK 29#1] 56045  >  443 [ACK] Seq=2955 Ack=4102 Win=8282 Len=0 TSval=758419279 TSecr=960828640 SLE=5502 SRE=9702"
"34","0.829265","172.253.122.93","100.86.243.187","TLSv1.2","1466","Application Data"
"35","0.829267","172.253.122.93","100.86.243.187","TLSv1.2","1466","Application Data"
"36","0.829344","100.86.243.187","172.253.122.93","TCP","78","[TCP Dup ACK 29#2] 56045  >  443 [ACK] Seq=2955 Ack=4102 Win=8282 Len=0 TSval=758419279 TSecr=960828640 SLE=5502 SRE=12502"
"37","0.829545","172.253.122.93","100.86.243.187","TLSv1.2","1466","Application Data"
"38","0.829549","172.253.122.93","100.86.243.187","TLSv1.2","743","Application Data"
"39","0.829633","100.86.243.187","172.253.122.93","TCP","78","[TCP Dup ACK 29#3] 56045  >  443 [ACK] Seq=2955 Ack=4102 Win=8282 Len=0 TSval=758419279 TSecr=960828640 SLE=5502 SRE=14579"
"40","0.831383","172.253.122.93","100.86.243.187","TLSv1.2","1466","Application Data"
"41","0.831384","172.253.122.93","100.86.243.187","TLSv1.2","937","Application Data"
"42","0.831465","100.86.243.187","172.253.122.93","TCP","78","[TCP Dup ACK 29#4] 56045  >  443 [ACK] Seq=2955 Ack=4102 Win=8282 Len=0 TSval=758419282 TSecr=960828640 SLE=5502 SRE=16850"
"43","0.834008","172.253.122.93","100.86.243.187","TLSv1.2","1466","Application Data"
"44","0.834010","172.253.122.93","100.86.243.187","TLSv1.2","1466","Application Data"
"45","0.834011","172.253.122.93","100.86.243.187","TLSv1.2","1466","Application Data"
"46","0.834129","100.86.243.187","172.253.122.93","TCP","78","[TCP Dup ACK 29#5] 56045  >  443 [ACK] Seq=2955 Ack=4102 Win=8282 Len=0 TSval=758419284 TSecr=960828640 SLE=5502 SRE=21050"
"47","0.835956","172.253.122.93","100.86.243.187","TLSv1.2","1466","Application Data"
"48","0.835958","172.253.122.93","100.86.243.187","TLSv1.2","1157","Application Data"
"49","0.835958","172.253.122.93","100.86.243.187","TLSv1.2","1466","Application Data"
"50","0.835960","172.253.122.93","100.86.243.187","TLSv1.2","1466","Application Data"
"51","0.835960","172.253.122.93","100.86.243.187","TLSv1.2","1466","Application Data"
"52","0.835961","172.253.122.93","100.86.243.187","TLSv1.2","1426","Application Data"
"53","0.836129","100.86.243.187","172.253.122.93","TCP","78","[TCP Dup ACK 29#6] 56045  >  443 [ACK] Seq=2955 Ack=4102 Win=8282 Len=0 TSval=758419286 TSecr=960828640 SLE=5502 SRE=29101"
"54","0.836756","172.253.122.93","100.86.243.187","TLSv1.2","1466","Application Data"
"55","0.836878","100.86.243.187","172.253.122.93","TCP","78","[TCP Dup ACK 29#7] 56045  >  443 [ACK] Seq=2955 Ack=4102 Win=8282 Len=0 TSval=758419286 TSecr=960828640 SLE=5502 SRE=30501"
"56","0.836994","172.253.122.93","100.86.243.187","TLSv1.2","1385","Application Data"
"57","0.837081","100.86.243.187","172.253.122.93","TCP","78","[TCP Dup ACK 29#8] 56045  >  443 [ACK] Seq=2955 Ack=4102 Win=8282 Len=0 TSval=758419287 TSecr=960828640 SLE=5502 SRE=31820"
"58","0.837634","172.253.122.93","100.86.243.187","TLSv1.2","1466","Application Data"
"59","0.837635","172.253.122.93","100.86.243.187","TLSv1.2","1234","Application Data"
"60","0.837696","100.86.243.187","172.253.122.93","TCP","78","[TCP Dup ACK 29#9] 56045  >  443 [ACK] Seq=2955 Ack=4102 Win=8282 Len=0 TSval=758419287 TSecr=960828640 SLE=5502 SRE=34388"
"61","0.839292","172.253.122.93","100.86.243.187","TLSv1.2","1466","[TCP Fast Retransmission] , Application Data"
"62","0.839427","100.86.243.187","172.253.122.93","TCP","66","56045  >  443 [ACK] Seq=2955 Ack=34388 Win=7809 Len=0 TSval=758419290 TSecr=960828714"
"63","0.840135","100.86.243.187","172.253.122.93","TCP","66","[TCP Window Update] 56045  >  443 [ACK] Seq=2955 Ack=34388 Win=8282 Len=0 TSval=758419290 TSecr=960828714"
"64","0.847906","172.253.122.93","100.86.243.187","TLSv1.2","1466","Application Data"
"65","0.848038","100.86.243.187","172.253.122.93","TCP","66","56045  >  443 [ACK] Seq=2955 Ack=35788 Win=8260 Len=0 TSval=758419298 TSecr=960828723"
"66","0.848631","172.253.122.93","100.86.243.187","TLSv1.2","244","[TCP Previous segment not captured] , Application Data"
"67","0.848727","100.86.243.187","172.253.122.93","TCP","78","[TCP Dup ACK 65#1] 56045  >  443 [ACK] Seq=2955 Ack=35788 Win=8282 Len=0 TSval=758419298 TSecr=960828723 SLE=37188 SRE=37366"
"68","0.849248","172.253.122.93","100.86.243.187","TLSv1.2","1466","Application Data"
"69","0.849249","172.253.122.93","100.86.243.187","TLSv1.2","1466","Application Data"
"70","0.849250","172.253.122.93","100.86.243.187","TLSv1.2","1466","Application Data"
"71","0.849250","172.253.122.93","100.86.243.187","TLSv1.2","1466","Application Data"
"72","0.849311","100.86.243.187","172.253.122.93","TCP","78","[TCP Dup ACK 65#2] 56045  >  443 [ACK] Seq=2955 Ack=35788 Win=8282 Len=0 TSval=758419300 TSecr=960828723 SLE=37188 SRE=42966"
"73","0.850301","172.253.122.93","100.86.243.187","TLSv1.2","1466","Application Data"
"74","0.850302","172.253.122.93","100.86.243.187","TLSv1.2","1167","Application Data"
"75","0.850372","100.86.243.187","172.253.122.93","TCP","78","[TCP Dup ACK 65#3] 56045  >  443 [ACK] Seq=2955 Ack=35788 Win=8282 Len=0 TSval=758419301 TSecr=960828723 SLE=37188 SRE=45467"
"76","0.851453","172.253.122.93","100.86.243.187","TLSv1.2","1466","Application Data"
"77","0.851506","100.86.243.187","172.253.122.93","TCP","78","[TCP Dup ACK 65#4] 56045  >  443 [ACK] Seq=2955 Ack=35788 Win=8282 Len=0 TSval=758419302 TSecr=960828723 SLE=37188 SRE=46867"
"78","0.851672","172.253.122.93","100.86.243.187","TLSv1.2","1466","Application Data"
"79","0.851673","172.253.122.93","100.86.243.187","TLSv1.2","1466","Application Data"
"80","0.851724","100.86.243.187","172.253.122.93","TCP","78","[TCP Dup ACK 65#5] 56045  >  443 [ACK] Seq=2955 Ack=35788 Win=8282 Len=0 TSval=758419302 TSecr=960828723 SLE=37188 SRE=49667"
"81","0.852177","172.253.122.93","100.86.243.187","TLSv1.2","1466","Application Data"
"82","0.852221","100.86.243.187","172.253.122.93","TCP","78","[TCP Dup ACK 65#6] 56045  >  443 [ACK] Seq=2955 Ack=35788 Win=8282 Len=0 TSval=758419302 TSecr=960828723 SLE=37188 SRE=51067"
"83","0.852405","172.253.122.93","100.86.243.187","TLSv1.2","1466","Application Data"
"84","0.852406","172.253.122.93","100.86.243.187","TLSv1.2","1466","Application Data"
"85","0.852465","100.86.243.187","172.253.122.93","TCP","78","[TCP Dup ACK 65#7] 56045  >  443 [ACK] Seq=2955 Ack=35788 Win=8282 Len=0 TSval=758419302 TSecr=960828723 SLE=37188 SRE=53867"
"86","0.852931","172.253.122.93","100.86.243.187","TLSv1.2","1466","Application Data"
"87","0.852934","172.253.122.93","100.86.243.187","TLSv1.2","1466","Application Data"
"88","0.852935","172.253.122.93","100.86.243.187","TLSv1.2","1466","Application Data"
"89","0.852940","172.253.122.93","100.86.243.187","TLSv1.2","1466","Application Data"
"90","0.853019","100.86.243.187","172.253.122.93","TCP","78","[TCP Dup ACK 65#8] 56045  >  443 [ACK] Seq=2955 Ack=35788 Win=8282 Len=0 TSval=758419303 TSecr=960828723 SLE=37188 SRE=59467"
"91","0.854326","172.253.122.93","100.86.243.187","TLSv1.2","1466","Application Data"
"92","0.854326","172.253.122.93","100.86.243.187","TLSv1.2","1466","Application Data"
"93","0.854327","172.253.122.93","100.86.243.187","TLSv1.2","1466","Application Data"
"94","0.854330","172.253.122.93","100.86.243.187","TLSv1.2","1466","Application Data"
"95","0.854331","172.253.122.93","100.86.243.187","TLSv1.2","411","Application Data"
"96","0.854332","172.253.122.93","100.86.243.187","TLSv1.2","1466","Application Data"
"97","0.854400","100.86.243.187","172.253.122.93","TCP","78","[TCP Dup ACK 65#9] 56045  >  443 [ACK] Seq=2955 Ack=35788 Win=8282 Len=0 TSval=758419305 TSecr=960828723 SLE=37188 SRE=66812"
"98","0.854538","172.253.122.93","100.86.243.187","TLSv1.2","1466","Application Data"
"99","0.854539","172.253.122.93","100.86.243.187","TLSv1.2","1466","Application Data"
"100","0.854599","100.86.243.187","172.253.122.93","TCP","78","[TCP Dup ACK 65#10] 56045  >  443 [ACK] Seq=2955 Ack=35788 Win=8282 Len=0 TSval=758419305 TSecr=960828723 SLE=37188 SRE=69612"
"101","0.854833","172.253.122.93","100.86.243.187","TLSv1.2","1466","Application Data"
"102","0.854833","172.253.122.93","100.86.243.187","TLSv1.2","1466","Application Data"
"103","0.854872","100.86.243.187","172.253.122.93","TCP","78","[TCP Dup ACK 65#11] 56045  >  443 [ACK] Seq=2955 Ack=35788 Win=8282 Len=0 TSval=758419305 TSecr=960828723 SLE=37188 SRE=72412"
"104","0.854951","172.253.122.93","100.86.243.187","TLSv1.2","1466","Application Data"
"105","0.854952","172.253.122.93","100.86.243.187","TLSv1.2","1466","Application Data"
"106","0.854997","100.86.243.187","172.253.122.93","TCP","78","[TCP Dup ACK 65#12] 56045  >  443 [ACK] Seq=2955 Ack=35788 Win=8282 Len=0 TSval=758419305 TSecr=960828723 SLE=37188 SRE=75212"
"107","0.856428","172.253.122.93","100.86.243.187","TLSv1.2","1466","Application Data"
"108","0.856429","172.253.122.93","100.86.243.187","TLSv1.2","1466","Application Data"
"109","0.856430","172.253.122.93","100.86.243.187","TLSv1.2","1466","Application Data"
"110","0.856431","172.253.122.93","100.86.243.187","TLSv1.2","1466","Application Data"
"111","0.856432","172.253.122.93","100.86.243.187","TLSv1.2","1466","Application Data"
"112","0.856434","172.253.122.93","100.86.243.187","TLSv1.2","1315","Application Data"
"113","0.856434","172.253.122.93","100.86.243.187","TLSv1.2","1466","Application Data"
"114","0.856438","172.253.122.93","100.86.243.187","TLSv1.2","1466","Application Data"
"115","0.856439","172.253.122.93","100.86.243.187","TLSv1.2","1466","Application Data"
"116","0.856440","172.253.122.93","100.86.243.187","TLSv1.2","1466","Application Data"
"117","0.856442","172.253.122.93","100.86.243.187","TLSv1.2","1466","Application Data"
"118","0.856443","172.253.122.93","100.86.243.187","TLSv1.2","1466","Application Data"
"119","0.856444","172.253.122.93","100.86.243.187","TLSv1.2","1466","Application Data"
"120","0.856445","172.253.122.93","100.86.243.187","TLSv1.2","1466","Application Data"
"121","0.856510","100.86.243.187","172.253.122.93","TCP","78","[TCP Dup ACK 65#13] 56045  >  443 [ACK] Seq=2955 Ack=35788 Win=8282 Len=0 TSval=758419307 TSecr=960828723 SLE=37188 SRE=90461"
"122","0.856538","100.86.243.187","172.253.122.93","TCP","78","[TCP Dup ACK 65#14] 56045  >  443 [ACK] Seq=2955 Ack=35788 Win=8282 Len=0 TSval=758419307 TSecr=960828723 SLE=37188 SRE=94661"
"123","0.856652","172.253.122.93","100.86.243.187","TLSv1.2","1466","Application Data"
"124","0.856653","172.253.122.93","100.86.243.187","TLSv1.2","738","Application Data"
"125","0.856690","100.86.243.187","172.253.122.93","TCP","78","[TCP Dup ACK 65#15] 56045  >  443 [ACK] Seq=2955 Ack=35788 Win=8282 Len=0 TSval=758419307 TSecr=960828723 SLE=37188 SRE=96733"
"126","0.856827","172.253.122.93","100.86.243.187","TLSv1.2","1466","Application Data"
"127","0.856829","172.253.122.93","100.86.243.187","TLSv1.2","1466","Application Data"
"128","0.856875","100.86.243.187","172.253.122.93","TCP","78","[TCP Dup ACK 65#16] 56045  >  443 [ACK] Seq=2955 Ack=35788 Win=8282 Len=0 TSval=758419307 TSecr=960828723 SLE=37188 SRE=99533"
"129","0.857182","172.253.122.93","100.86.243.187","TLSv1.2","1466","Application Data"
"130","0.857183","172.253.122.93","100.86.243.187","TLSv1.2","1466","Application Data"
"131","0.857206","100.86.243.187","172.253.122.93","TCP","78","[TCP Dup ACK 65#17] 56045  >  443 [ACK] Seq=2955 Ack=35788 Win=8282 Len=0 TSval=758419307 TSecr=960828723 SLE=37188 SRE=102333"
"132","0.857647","172.253.122.93","100.86.243.187","TLSv1.2","1466","Application Data"
"133","0.857649","172.253.122.93","100.86.243.187","TLSv1.2","1174","Application Data"
"134","0.857724","100.86.243.187","172.253.122.93","TCP","78","[TCP Dup ACK 65#18] 56045  >  443 [ACK] Seq=2955 Ack=35788 Win=8282 Len=0 TSval=758419308 TSecr=960828723 SLE=37188 SRE=104841"
"135","0.858588","172.253.122.93","100.86.243.187","TLSv1.2","1466","Application Data"
"136","0.858625","100.86.243.187","172.253.122.93","TCP","78","[TCP Dup ACK 65#19] 56045  >  443 [ACK] Seq=2955 Ack=35788 Win=8282 Len=0 TSval=758419308 TSecr=960828723 SLE=37188 SRE=106241"
"137","0.858784","172.253.122.93","100.86.243.187","TLSv1.2","1466","Application Data"
"138","0.858786","172.253.122.93","100.86.243.187","TLSv1.2","1382","Application Data"
"139","0.858819","100.86.243.187","172.253.122.93","TCP","78","[TCP Dup ACK 65#20] 56045  >  443 [ACK] Seq=2955 Ack=35788 Win=8282 Len=0 TSval=758419309 TSecr=960828723 SLE=37188 SRE=108957"
"140","0.860750","172.253.122.93","100.86.243.187","TLSv1.2","1466","Application Data"
"141","0.860753","172.253.122.93","100.86.243.187","TLSv1.2","1466","Application Data"
"142","0.860754","172.253.122.93","100.86.243.187","TLSv1.2","1466","Application Data"
"143","0.860755","172.253.122.93","100.86.243.187","TLSv1.2","1364","Application Data"
"144","0.860761","172.253.122.93","100.86.243.187","TLSv1.2","1466","Application Data"
"145","0.860763","172.253.122.93","100.86.243.187","TLSv1.2","1466","Application Data"
"146","0.860765","172.253.122.93","100.86.243.187","TLSv1.2","1466","Application Data"
"147","0.860766","172.253.122.93","100.86.243.187","TLSv1.2","1466","Application Data"
"148","0.860768","172.253.122.93","100.86.243.187","TLSv1.2","804","Application Data"
"149","0.860769","172.253.122.93","100.86.243.187","TLSv1.2","1466","[TCP Fast Retransmission] , Application Data"
"150","0.860835","100.86.243.187","172.253.122.93","TCP","78","[TCP Dup ACK 65#21] 56045  >  443 [ACK] Seq=2955 Ack=35788 Win=8282 Len=0 TSval=758419311 TSecr=960828723 SLE=37188 SRE=120793"
"151","0.860881","100.86.243.187","172.253.122.93","TCP","66","56045  >  443 [ACK] Seq=2955 Ack=120793 Win=6954 Len=0 TSval=758419311 TSecr=960828735"
"152","0.861666","172.253.122.93","100.86.243.187","TLSv1.2","1466","Application Data"
"153","0.861673","172.253.122.93","100.86.243.187","TLSv1.2","1466","Application Data"
"154","0.861674","172.253.122.93","100.86.243.187","TLSv1.2","1466","Application Data"
"155","0.861770","100.86.243.187","172.253.122.93","TCP","66","56045  >  443 [ACK] Seq=2955 Ack=124993 Win=7460 Len=0 TSval=758419311 TSecr=960828737"
"156","0.862622","172.253.122.93","100.86.243.187","TLSv1.2","1466","Application Data"
"157","0.862688","100.86.243.187","172.253.122.93","TCP","66","[TCP Window Update] 56045  >  443 [ACK] Seq=2955 Ack=124993 Win=8282 Len=0 TSval=758419312 TSecr=960828737"
"158","0.862732","100.86.243.187","172.253.122.93","TCP","66","56045  >  443 [ACK] Seq=2955 Ack=126393 Win=8260 Len=0 TSval=758419312 TSecr=960828737"
"159","0.862914","172.253.122.93","100.86.243.187","TLSv1.2","1000","Application Data"
"160","0.862950","100.86.243.187","172.253.122.93","TCP","66","56045  >  443 [ACK] Seq=2955 Ack=127327 Win=8267 Len=0 TSval=758419313 TSecr=960828737"
"161","0.864170","172.253.122.93","100.86.243.187","TLSv1.2","1466","Application Data"
"162","0.864171","172.253.122.93","100.86.243.187","TLSv1.2","1466","Application Data"
"163","0.864171","172.253.122.93","100.86.243.187","TLSv1.2","1466","Application Data"
"164","0.864244","100.86.243.187","172.253.122.93","TCP","66","56045  >  443 [ACK] Seq=2955 Ack=131527 Win=8216 Len=0 TSval=758419314 TSecr=960828738"
"165","0.864385","100.86.243.187","172.253.122.93","TCP","66","[TCP Window Update] 56045  >  443 [ACK] Seq=2955 Ack=131527 Win=8282 Len=0 TSval=758419314 TSecr=960828738"
"166","0.865102","172.253.122.93","100.86.243.187","TLSv1.2","1466","Application Data"
"167","0.865103","172.253.122.93","100.86.243.187","TLSv1.2","1466","Application Data"
"168","0.865165","100.86.243.187","172.253.122.93","TCP","66","56045  >  443 [ACK] Seq=2955 Ack=134327 Win=8238 Len=0 TSval=758419314 TSecr=960828738"
"169","0.865271","100.86.243.187","172.253.122.93","TCP","66","[TCP Window Update] 56045  >  443 [ACK] Seq=2955 Ack=134327 Win=8282 Len=0 TSval=758419315 TSecr=960828738"
"170","0.866382","172.253.122.93","100.86.243.187","TLSv1.2","1466","Application Data"
"171","0.866384","172.253.122.93","100.86.243.187","TLSv1.2","1466","Application Data"
"172","0.866384","172.253.122.93","100.86.243.187","TLSv1.2","1466","Application Data"
"173","0.866385","172.253.122.93","100.86.243.187","TLSv1.2","1466","Application Data"
"174","0.866386","172.253.122.93","100.86.243.187","TLSv1.2","1466","Application Data"
"175","0.866390","172.253.122.93","100.86.243.187","TLSv1.2","1466","Application Data"
"176","0.866390","172.253.122.93","100.86.243.187","TLSv1.2","1466","Application Data"
"177","0.866391","172.253.122.93","100.86.243.187","TLSv1.2","1280","Application Data, Application Data"
"178","0.866392","172.253.122.93","100.86.243.187","TLSv1.2","1466","Application Data"
"179","0.866393","172.253.122.93","100.86.243.187","TLSv1.2","1466","Application Data"
"180","0.866464","100.86.243.187","172.253.122.93","TCP","66","56045  >  443 [ACK] Seq=2955 Ack=148141 Win=8066 Len=0 TSval=758419317 TSecr=960828741"
"181","0.866741","100.86.243.187","172.253.122.93","TCP","66","[TCP Window Update] 56045  >  443 [ACK] Seq=2955 Ack=148141 Win=8282 Len=0 TSval=758419317 TSecr=960828741"
"182","0.866857","172.253.122.93","100.86.243.187","TLSv1.2","1466","Application Data"
"183","0.866858","172.253.122.93","100.86.243.187","TLSv1.2","1466","Application Data"
"184","0.866910","100.86.243.187","172.253.122.93","TCP","66","56045  >  443 [ACK] Seq=2955 Ack=150941 Win=8238 Len=0 TSval=758419317 TSecr=960828741"
"185","0.866993","100.86.243.187","172.253.122.93","TCP","66","[TCP Window Update] 56045  >  443 [ACK] Seq=2955 Ack=150941 Win=8282 Len=0 TSval=758419317 TSecr=960828741"
"186","0.868242","172.253.122.93","100.86.243.187","TLSv1.2","1466","Application Data"
"187","0.868243","172.253.122.93","100.86.243.187","TLSv1.2","1466","Application Data"
"188","0.868243","172.253.122.93","100.86.243.187","TLSv1.2","1466","Application Data"
"189","0.868246","172.253.122.93","100.86.243.187","TLSv1.2","1466","Application Data"
"190","0.868247","172.253.122.93","100.86.243.187","TLSv1.2","1466","Application Data"
"191","0.868248","172.253.122.93","100.86.243.187","TLSv1.2","1466","Application Data"
"192","0.868248","172.253.122.93","100.86.243.187","TLSv1.2","1041","Application Data"
"193","0.868301","100.86.243.187","172.253.122.93","TCP","66","56045  >  443 [ACK] Seq=2955 Ack=160316 Win=8135 Len=0 TSval=758419319 TSecr=960828741"
"194","0.868473","100.86.243.187","172.253.122.93","TCP","66","[TCP Window Update] 56045  >  443 [ACK] Seq=2955 Ack=160316 Win=8282 Len=0 TSval=758419319 TSecr=960828741"
"195","0.868712","172.253.122.93","100.86.243.187","TLSv1.2","98","Application Data"
"196","0.868766","100.86.243.187","172.253.122.93","TCP","66","56045  >  443 [ACK] Seq=2955 Ack=160348 Win=8281 Len=0 TSval=758419319 TSecr=960828743"
"197","0.869601","172.253.122.93","100.86.243.187","TLSv1.2","97","Application Data"
"198","0.869680","100.86.243.187","172.253.122.93","TCP","66","56045  >  443 [ACK] Seq=2955 Ack=160379 Win=8281 Len=0 TSval=758419320 TSecr=960828744"
"199","0.870443","172.253.122.93","100.86.243.187","TLSv1.2","105","Application Data"
"200","0.870519","100.86.243.187","172.253.122.93","TCP","66","56045  >  443 [ACK] Seq=2955 Ack=160418 Win=8281 Len=0 TSval=758419320 TSecr=960828744"
"201","0.870645","100.86.243.187","172.253.122.93","TLSv1.2","105","Application Data"
"202","0.881316","172.253.122.93","100.86.243.187","TCP","66","443  >  56045 [ACK] Seq=160418 Ack=2994 Win=544 Len=0 TSval=960828756 TSecr=758419320"
"242","1.681902","100.86.243.187","172.253.122.93","TLSv1.2","983","Application Data"
"243","1.681991","100.86.243.187","172.253.122.93","TCP","1466","56045  >  443 [ACK] Seq=3911 Ack=160418 Win=8282 Len=1400 TSval=758420132 TSecr=960828756 [TCP PDU reassembled in 244]"
"244","1.682004","100.86.243.187","172.253.122.93","TLSv1.2","1117","Application Data"
"250","1.693114","172.253.122.93","100.86.243.187","TCP","66","443  >  56045 [ACK] Seq=160418 Ack=3911 Win=541 Len=0 TSval=960829568 TSecr=758420132"
"251","1.693115","172.253.122.93","100.86.243.187","TCP","78","[TCP Dup ACK 250#1] 443  >  56045 [ACK] Seq=160418 Ack=3911 Win=541 Len=0 TSval=960829568 TSecr=758420132 SLE=5311 SRE=6362"
"252","1.693830","172.253.122.93","100.86.243.187","TCP","66","443  >  56045 [ACK] Seq=160418 Ack=6362 Win=532 Len=0 TSval=960829568 TSecr=758420132"
"253","1.731722","172.253.122.93","100.86.243.187","TLSv1.2","144","Application Data"
"254","1.731723","172.253.122.93","100.86.243.187","TLSv1.2","1466","Application Data"
"255","1.731724","172.253.122.93","100.86.243.187","TLSv1.2","1466","Application Data"
"256","1.731814","100.86.243.187","172.253.122.93","TCP","66","56045  >  443 [ACK] Seq=6362 Ack=163296 Win=8237 Len=0 TSval=758420182 TSecr=960829606"
"257","1.732053","100.86.243.187","172.253.122.93","TCP","66","[TCP Window Update] 56045  >  443 [ACK] Seq=6362 Ack=163296 Win=8282 Len=0 TSval=758420182 TSecr=960829606"
"258","1.732291","172.253.122.93","100.86.243.187","TLSv1.2","1466","Application Data"
"259","1.732292","172.253.122.93","100.86.243.187","TLSv1.2","1466","Application Data"
"260","1.732361","100.86.243.187","172.253.122.93","TCP","66","56045  >  443 [ACK] Seq=6362 Ack=166096 Win=8238 Len=0 TSval=758420182 TSecr=960829606"
"261","1.732473","100.86.243.187","172.253.122.93","TCP","66","[TCP Window Update] 56045  >  443 [ACK] Seq=6362 Ack=166096 Win=8282 Len=0 TSval=758420182 TSecr=960829606"
"262","1.733800","172.253.122.93","100.86.243.187","TLSv1.2","1466","Application Data"
"263","1.733801","172.253.122.93","100.86.243.187","TLSv1.2","1466","Application Data"
"264","1.733801","172.253.122.93","100.86.243.187","TLSv1.2","1466","Application Data"
"265","1.733806","172.253.122.93","100.86.243.187","TLSv1.2","1466","[TCP Previous segment not captured] , Application Data"
"266","1.733807","172.253.122.93","100.86.243.187","TLSv1.2","1466","Application Data"
"267","1.733807","172.253.122.93","100.86.243.187","TLSv1.2","1345","Application Data"
"268","1.733808","172.253.122.93","100.86.243.187","TLSv1.2","338","Application Data"
"269","1.733808","172.253.122.93","100.86.243.187","TLSv1.2","1466","Application Data"
"270","1.733809","172.253.122.93","100.86.243.187","TLSv1.2","1466","Application Data"
"271","1.733809","172.253.122.93","100.86.243.187","TLSv1.2","1466","Application Data"
"272","1.733810","172.253.122.93","100.86.243.187","TLSv1.2","1466","Application Data"
"273","1.733811","172.253.122.93","100.86.243.187","TLSv1.2","1466","Application Data"
"274","1.733811","172.253.122.93","100.86.243.187","TLSv1.2","1466","Application Data"
"275","1.733812","172.253.122.93","100.86.243.187","TLSv1.2","1466","Application Data"
"276","1.734578","100.86.243.187","172.253.122.93","TCP","78","56045  >  443 [ACK] Seq=6362 Ack=170296 Win=8282 Len=0 TSval=758420184 TSecr=960829607 SLE=171696 SRE=185847"
"277","1.735153","172.253.122.93","100.86.243.187","TLSv1.2","1466","Application Data"
"278","1.735156","172.253.122.93","100.86.243.187","TLSv1.2","1466","Application Data"
"279","1.735157","172.253.122.93","100.86.243.187","TLSv1.2","1466","Application Data"
"280","1.735158","172.253.122.93","100.86.243.187","TLSv1.2","1466","Application Data"
"281","1.735161","172.253.122.93","100.86.243.187","TLSv1.2","253","Application Data, Application Data"
"282","1.735161","172.253.122.93","100.86.243.187","TLSv1.2","105","Application Data"
"283","1.735234","100.86.243.187","172.253.122.93","TCP","78","[TCP Dup ACK 276#1] 56045  >  443 [ACK] Seq=6362 Ack=170296 Win=8282 Len=0 TSval=758420185 TSecr=960829607 SLE=171696 SRE=191673"
"284","1.746574","172.253.122.93","100.86.243.187","TCP","1466","[TCP Retransmission] 443  >  56045 [ACK] Seq=170296 Ack=6362 Win=544 Len=1400 TSval=960829621 TSecr=758420185"
"285","1.746661","100.86.243.187","172.253.122.93","TCP","66","56045  >  443 [ACK] Seq=6362 Ack=191673 Win=7948 Len=0 TSval=758420197 TSecr=960829621"
"286","1.747161","100.86.243.187","172.253.122.93","TCP","66","[TCP Window Update] 56045  >  443 [ACK] Seq=6362 Ack=191673 Win=8282 Len=0 TSval=758420197 TSecr=960829621"
"287","1.747220","100.86.243.187","172.253.122.93","TLSv1.2","105","Application Data"
"288","1.763943","172.253.122.93","100.86.243.187","TCP","66","443  >  56045 [ACK] Seq=191673 Ack=6401 Win=544 Len=0 TSval=960829638 TSecr=758420197"
"289","1.808798","100.86.243.187","172.253.122.93","TCP","1466","56045  >  443 [ACK] Seq=6401 Ack=191673 Win=8282 Len=1400 TSval=758420258 TSecr=960829638 [TCP PDU reassembled in 290]"
"290","1.808854","100.86.243.187","172.253.122.93","TLSv1.2","543","Application Data"
"291","1.809090","100.86.243.187","172.253.122.93","TLSv1.2","261","Application Data"
"292","1.809366","100.86.243.187","172.253.122.93","TLSv1.2","187","Application Data"
"293","1.810171","100.86.243.187","172.253.122.93","TLSv1.2","189","Application Data"
"294","1.820378","172.253.122.93","100.86.243.187","TCP","78","[TCP Dup ACK 288#1] 443  >  56045 [ACK] Seq=191673 Ack=6401 Win=544 Len=0 TSval=960829695 TSecr=758420197 SLE=7801 SRE=8278"
"295","1.820379","172.253.122.93","100.86.243.187","TCP","66","443  >  56045 [ACK] Seq=191673 Ack=8278 Win=537 Len=0 TSval=960829695 TSecr=758420258"
"296","1.820382","172.253.122.93","100.86.243.187","TCP","66","443  >  56045 [ACK] Seq=191673 Ack=8594 Win=539 Len=0 TSval=960829695 TSecr=758420259"
"297","1.821033","172.253.122.93","100.86.243.187","TCP","66","443  >  56045 [ACK] Seq=191673 Ack=8717 Win=539 Len=0 TSval=960829696 TSecr=758420260"
"298","1.825142","172.253.122.93","100.86.243.187","TLSv1.2","161","Application Data"
"299","1.825144","172.253.122.93","100.86.243.187","TLSv1.2","97","Application Data"
"300","1.825146","172.253.122.93","100.86.243.187","TLSv1.2","105","Application Data"
"301","1.825148","172.253.122.93","100.86.243.187","TLSv1.2","138","Application Data"
"302","1.825151","172.253.122.93","100.86.243.187","TLSv1.2","138","Application Data"
"303","1.825447","100.86.243.187","172.253.122.93","TCP","66","56045  >  443 [ACK] Seq=8717 Ack=191982 Win=8277 Len=0 TSval=758420276 TSecr=960829700"
"304","1.826240","172.253.122.93","100.86.243.187","TLSv1.2","97","Application Data"
"305","1.826318","100.86.243.187","172.253.122.93","TLSv1.2","105","Application Data"
"306","1.826352","100.86.243.187","172.253.122.93","TCP","66","56045  >  443 [ACK] Seq=8756 Ack=192013 Win=8279 Len=0 TSval=758420276 TSecr=960829700"
"307","1.827034","172.253.122.93","100.86.243.187","TLSv1.2","138","Application Data"
"308","1.827177","100.86.243.187","172.253.122.93","TCP","66","56045  >  443 [ACK] Seq=8756 Ack=192085 Win=8281 Len=0 TSval=758420277 TSecr=960829701"
"309","1.842483","172.253.122.93","100.86.243.187","TCP","66","443  >  56045 [ACK] Seq=192085 Ack=8756 Win=544 Len=0 TSval=960829717 TSecr=758420276"
"356","2.149812","100.86.243.187","172.253.122.93","TLSv1.2","597","Application Data"
"358","2.164943","172.253.122.93","100.86.243.187","TCP","66","443  >  56045 [ACK] Seq=192085 Ack=9287 Win=542 Len=0 TSval=960830039 TSecr=758420600"
"359","2.164943","172.253.122.93","100.86.243.187","TLSv1.2","145","Application Data"
"361","2.165028","100.86.243.187","172.253.122.93","TCP","66","56045  >  443 [ACK] Seq=9287 Ack=192164 Win=8281 Len=0 TSval=758420615 TSecr=960830039"
"364","2.165287","100.86.243.187","172.253.122.93","TLSv1.2","105","Application Data"
"369","2.180356","100.86.243.187","172.253.122.93","TCP","1466","56045  >  443 [ACK] Seq=9326 Ack=192164 Win=8282 Len=1400 TSval=758420631 TSecr=960830039 [TCP PDU reassembled in 370]"
"370","2.180408","100.86.243.187","172.253.122.93","TLSv1.2","1114","Application Data"
"371","2.183858","172.253.122.93","100.86.243.187","TCP","66","443  >  56045 [ACK] Seq=192164 Ack=9326 Win=544 Len=0 TSval=960830057 TSecr=758420615"
"372","2.192299","172.253.122.93","100.86.243.187","TCP","78","[TCP Dup ACK 371#1] 443  >  56045 [ACK] Seq=192164 Ack=9326 Win=544 Len=0 TSval=960830067 TSecr=758420615 SLE=10726 SRE=11774"
"373","2.192300","172.253.122.93","100.86.243.187","TCP","66","443  >  56045 [ACK] Seq=192164 Ack=11774 Win=535 Len=0 TSval=960830067 TSecr=758420631"
"408","2.286842","100.86.243.187","172.253.122.93","TLSv1.2","784","Application Data"
"409","2.286903","100.86.243.187","172.253.122.93","TCP","1466","56045  >  443 [ACK] Seq=12492 Ack=192164 Win=8282 Len=1400 TSval=758420737 TSecr=960830067 [TCP PDU reassembled in 410]"
"410","2.286912","100.86.243.187","172.253.122.93","TLSv1.2","419","Application Data"
"413","2.297822","172.253.122.93","100.86.243.187","TCP","66","443  >  56045 [ACK] Seq=192164 Ack=12492 Win=539 Len=0 TSval=960830173 TSecr=758420737"
"414","2.297822","172.253.122.93","100.86.243.187","TCP","78","[TCP Dup ACK 413#1] 443  >  56045 [ACK] Seq=192164 Ack=12492 Win=539 Len=0 TSval=960830173 TSecr=758420737 SLE=13892 SRE=14245"
"415","2.297822","172.253.122.93","100.86.243.187","TCP","66","443  >  56045 [ACK] Seq=192164 Ack=14245 Win=533 Len=0 TSval=960830173 TSecr=758420737"
"418","2.307383","172.253.122.93","100.86.243.187","TLSv1.2","139","Application Data"
"419","2.307384","172.253.122.93","100.86.243.187","TLSv1.2","219","Application Data"
"420","2.307436","100.86.243.187","172.253.122.93","TCP","66","56045  >  443 [ACK] Seq=14245 Ack=192390 Win=8278 Len=0 TSval=758420757 TSecr=960830182"
"421","2.307982","172.253.122.93","100.86.243.187","TLSv1.2","97","Application Data"
"422","2.307983","172.253.122.93","100.86.243.187","TLSv1.2","105","Application Data"
"423","2.308039","100.86.243.187","172.253.122.93","TCP","66","56045  >  443 [ACK] Seq=14245 Ack=192460 Win=8281 Len=0 TSval=758420758 TSecr=960830183"
"424","2.308213","100.86.243.187","172.253.122.93","TLSv1.2","105","Application Data"
"425","2.311663","172.253.122.93","100.86.243.187","TLSv1.2","604","Application Data"
"426","2.311663","172.253.122.93","100.86.243.187","TLSv1.2","1466","Application Data"
"427","2.311664","172.253.122.93","100.86.243.187","TLSv1.2","102","Application Data"
"428","2.311721","100.86.243.187","172.253.122.93","TCP","66","56045  >  443 [ACK] Seq=14284 Ack=194434 Win=8251 Len=0 TSval=758420762 TSecr=960830187"
"429","2.312316","172.253.122.93","100.86.243.187","TLSv1.2","98","Application Data"
"430","2.312316","172.253.122.93","100.86.243.187","TLSv1.2","97","Application Data"
"431","2.312369","100.86.243.187","172.253.122.93","TCP","66","56045  >  443 [ACK] Seq=14284 Ack=194497 Win=8281 Len=0 TSval=758420762 TSecr=960830187"
"432","2.322772","172.253.122.93","100.86.243.187","TCP","66","443  >  56045 [ACK] Seq=194497 Ack=14284 Win=544 Len=0 TSval=960830197 TSecr=758420758"
"441","2.352605","100.86.243.187","172.253.122.93","TCP","1466","56045  >  443 [ACK] Seq=14284 Ack=194497 Win=8282 Len=1400 TSval=758420803 TSecr=960830197 [TCP PDU reassembled in 442]"
"442","2.352626","100.86.243.187","172.253.122.93","TLSv1.2","748","Application Data"
"443","2.363378","172.253.122.93","100.86.243.187","TCP","78","[TCP Dup ACK 432#1] 443  >  56045 [ACK] Seq=194497 Ack=14284 Win=544 Len=0 TSval=960830238 TSecr=758420762 SLE=15684 SRE=16366"
"444","2.363379","172.253.122.93","100.86.243.187","TCP","66","443  >  56045 [ACK] Seq=194497 Ack=16366 Win=536 Len=0 TSval=960830238 TSecr=758420803"
"445","2.364019","172.253.122.93","100.86.243.187","TLSv1.2","145","Application Data"
"446","2.364071","100.86.243.187","172.253.122.93","TCP","66","56045  >  443 [ACK] Seq=16366 Ack=194576 Win=8281 Len=0 TSval=758420814 TSecr=960830239"
"447","2.364298","100.86.243.187","172.253.122.93","TLSv1.2","105","Application Data"
"448","2.380330","172.253.122.93","100.86.243.187","TCP","66","443  >  56045 [ACK] Seq=194576 Ack=16405 Win=544 Len=0 TSval=960830255 TSecr=758420814"
"488","2.617588","100.86.243.187","172.253.122.93","TCP","1466","56045  >  443 [ACK] Seq=16405 Ack=194576 Win=8282 Len=1400 TSval=758421068 TSecr=960830255 [TCP PDU reassembled in 490]"
"489","2.617591","100.86.243.187","172.253.122.93","TCP","1466","56045  >  443 [ACK] Seq=17805 Ack=194576 Win=8282 Len=1400 TSval=758421068 TSecr=960830255 [TCP PDU reassembled in 490]"
"490","2.617625","100.86.243.187","172.253.122.93","TLSv1.2","544","Application Data"
"491","2.617674","100.86.243.187","172.253.122.93","TCP","1466","56045  >  443 [ACK] Seq=19683 Ack=194576 Win=8282 Len=1400 TSval=758421068 TSecr=960830255 [TCP PDU reassembled in 492]"
"492","2.617682","100.86.243.187","172.253.122.93","TLSv1.2","1096","Application Data"
"493","2.629187","172.253.122.93","100.86.243.187","TCP","66","443  >  56045 [ACK] Seq=194576 Ack=19683 Win=539 Len=0 TSval=960830504 TSecr=758421068"
"494","2.629188","172.253.122.93","100.86.243.187","TCP","78","[TCP Dup ACK 493#1] 443  >  56045 [ACK] Seq=194576 Ack=19683 Win=539 Len=0 TSval=960830504 TSecr=758421068 SLE=21083 SRE=22113"
"495","2.639841","100.86.243.187","172.253.122.93","TCP","1466","[TCP Retransmission] 56045  >  443 [ACK] Seq=19683 Ack=194576 Win=8282 Len=1400 TSval=758421090 TSecr=960830504"
"496","2.650153","172.253.122.93","100.86.243.187","TCP","78","443  >  56045 [ACK] Seq=194576 Ack=22113 Win=544 Len=0 TSval=960830525 TSecr=758421068 SLE=19683 SRE=21083"
"499","2.728765","100.86.243.187","172.253.122.93","TCP","1466","56045  >  443 [ACK] Seq=22113 Ack=194576 Win=8282 Len=1400 TSval=758421179 TSecr=960830525 [TCP PDU reassembled in 501]"
"500","2.728767","100.86.243.187","172.253.122.93","TCP","1466","56045  >  443 [ACK] Seq=23513 Ack=194576 Win=8282 Len=1400 TSval=758421179 TSecr=960830525 [TCP PDU reassembled in 501]"
"501","2.728804","100.86.243.187","172.253.122.93","TLSv1.2","218","Application Data"
"502","2.739490","172.253.122.93","100.86.243.187","TCP","66","443  >  56045 [ACK] Seq=194576 Ack=25065 Win=539 Len=0 TSval=960830614 TSecr=758421179"
"503","2.748222","172.253.122.93","100.86.243.187","TLSv1.2","139","Application Data"
"504","2.748288","100.86.243.187","172.253.122.93","TCP","66","56045  >  443 [ACK] Seq=25065 Ack=194649 Win=8281 Len=0 TSval=758421199 TSecr=960830623"
"505","2.748463","172.253.122.93","100.86.243.187","TLSv1.2","1466","Application Data"
"506","2.748507","100.86.243.187","172.253.122.93","TCP","66","56045  >  443 [ACK] Seq=25065 Ack=196049 Win=8260 Len=0 TSval=758421199 TSecr=960830623"
"507","2.748728","172.253.122.93","100.86.243.187","TLSv1.2","1466","Application Data"
"508","2.748728","172.253.122.93","100.86.243.187","TLSv1.2","1466","Application Data"
"509","2.748778","100.86.243.187","172.253.122.93","TCP","66","56045  >  443 [ACK] Seq=25065 Ack=198849 Win=8238 Len=0 TSval=758421199 TSecr=960830623"
"510","2.748872","100.86.243.187","172.253.122.93","TCP","66","[TCP Window Update] 56045  >  443 [ACK] Seq=25065 Ack=198849 Win=8282 Len=0 TSval=758421199 TSecr=960830623"
"511","2.749012","172.253.122.93","100.86.243.187","TLSv1.2","1466","Application Data"
"512","2.749012","172.253.122.93","100.86.243.187","TLSv1.2","1466","Application Data"
"513","2.749052","100.86.243.187","172.253.122.93","TCP","66","56045  >  443 [ACK] Seq=25065 Ack=201649 Win=8238 Len=0 TSval=758421199 TSecr=960830623"
"514","2.749119","100.86.243.187","172.253.122.93","TCP","66","[TCP Window Update] 56045  >  443 [ACK] Seq=25065 Ack=201649 Win=8282 Len=0 TSval=758421199 TSecr=960830623"
"515","2.749303","172.253.122.93","100.86.243.187","TLSv1.2","1466","Application Data"
"516","2.749303","172.253.122.93","100.86.243.187","TLSv1.2","1466","Application Data"
"517","2.749344","100.86.243.187","172.253.122.93","TCP","66","56045  >  443 [ACK] Seq=25065 Ack=204449 Win=8238 Len=0 TSval=758421200 TSecr=960830624"
"518","2.749417","100.86.243.187","172.253.122.93","TCP","66","[TCP Window Update] 56045  >  443 [ACK] Seq=25065 Ack=204449 Win=8282 Len=0 TSval=758421200 TSecr=960830624"
"519","2.750525","172.253.122.93","100.86.243.187","TLSv1.2","1466","Application Data"
"520","2.750526","172.253.122.93","100.86.243.187","TLSv1.2","1466","Application Data"
"521","2.750527","172.253.122.93","100.86.243.187","TLSv1.2","1466","Application Data"
"522","2.750527","172.253.122.93","100.86.243.187","TLSv1.2","283","Application Data, Application Data"
"523","2.750527","172.253.122.93","100.86.243.187","TLSv1.2","105","Application Data"
"524","2.750603","100.86.243.187","172.253.122.93","TCP","66","56045  >  443 [ACK] Seq=25065 Ack=208905 Win=8212 Len=0 TSval=758421201 TSecr=960830624"
"525","2.750826","100.86.243.187","172.253.122.93","TCP","66","[TCP Window Update] 56045  >  443 [ACK] Seq=25065 Ack=208905 Win=8282 Len=0 TSval=758421201 TSecr=960830624"
"526","2.750870","100.86.243.187","172.253.122.93","TLSv1.2","105","Application Data"
"527","2.767564","172.253.122.93","100.86.243.187","TCP","66","443  >  56045 [ACK] Seq=208905 Ack=25104 Win=544 Len=0 TSval=960830642 TSecr=758421201"
"528","2.781995","172.253.122.93","100.86.243.187","TLSv1.2","624","Application Data"
"529","2.781996","172.253.122.93","100.86.243.187","TLSv1.2","1466","Application Data"
"530","2.781996","172.253.122.93","100.86.243.187","TLSv1.2","1466","Application Data"
"531","2.781997","172.253.122.93","100.86.243.187","TLSv1.2","630","Application Data"
"532","2.781998","172.253.122.93","100.86.243.187","TLSv1.2","98","Application Data"
"533","2.782071","100.86.243.187","172.253.122.93","TCP","66","56045  >  443 [ACK] Seq=25104 Ack=212859 Win=8220 Len=0 TSval=758421232 TSecr=960830657"
"534","2.782343","100.86.243.187","172.253.122.93","TCP","66","[TCP Window Update] 56045  >  443 [ACK] Seq=25104 Ack=212859 Win=8282 Len=0 TSval=758421232 TSecr=960830657"
"535","2.782767","172.253.122.93","100.86.243.187","TLSv1.2","97","Application Data"
"536","2.782767","172.253.122.93","100.86.243.187","TLSv1.2","105","Application Data"
"537","2.782825","100.86.243.187","172.253.122.93","TCP","66","56045  >  443 [ACK] Seq=25104 Ack=212929 Win=8281 Len=0 TSval=758421232 TSecr=960830657"
"538","2.782961","100.86.243.187","172.253.122.93","TLSv1.2","105","Application Data"
"539","2.798134","172.253.122.93","100.86.243.187","TCP","66","443  >  56045 [ACK] Seq=212929 Ack=25143 Win=544 Len=0 TSval=960830673 TSecr=758421232"
"729","4.576780","100.86.243.187","172.253.122.93","TCP","1466","56045  >  443 [ACK] Seq=25143 Ack=212929 Win=8282 Len=1400 TSval=758423027 TSecr=960830673 [TCP PDU reassembled in 731]"
"730","4.576782","100.86.243.187","172.253.122.93","TCP","1466","56045  >  443 [ACK] Seq=26543 Ack=212929 Win=8282 Len=1400 TSval=758423027 TSecr=960830673 [TCP PDU reassembled in 731]"
"731","4.576820","100.86.243.187","172.253.122.93","TLSv1.2","598","Application Data"
"732","4.576882","100.86.243.187","172.253.122.93","TCP","1466","56045  >  443 [ACK] Seq=28475 Ack=212929 Win=8282 Len=1400 TSval=758423027 TSecr=960830673 [TCP PDU reassembled in 733]"
"733","4.576892","100.86.243.187","172.253.122.93","TLSv1.2","1157","Application Data"
"734","4.592068","172.253.122.93","100.86.243.187","TCP","66","443  >  56045 [ACK] Seq=212929 Ack=30966 Win=539 Len=0 TSval=960832467 TSecr=758423027"
"737","4.628074","172.253.122.93","100.86.243.187","TLSv1.2","143","Application Data"
"738","4.628075","172.253.122.93","100.86.243.187","TLSv1.2","1394","Application Data"
"739","4.628076","172.253.122.93","100.86.243.187","TLSv1.2","97","Application Data"
"740","4.628145","100.86.243.187","172.253.122.93","TCP","66","56045  >  443 [ACK] Seq=30966 Ack=214365 Win=8259 Len=0 TSval=758423078 TSecr=960832502"
"741","4.628314","172.253.122.93","100.86.243.187","TLSv1.2","105","Application Data"
"742","4.628357","100.86.243.187","172.253.122.93","TCP","66","56045  >  443 [ACK] Seq=30966 Ack=214404 Win=8281 Len=0 TSval=758423078 TSecr=960832502"
"743","4.628455","100.86.243.187","172.253.122.93","TLSv1.2","105","Application Data"
"744","4.645219","172.253.122.93","100.86.243.187","TCP","66","443  >  56045 [ACK] Seq=214404 Ack=31005 Win=544 Len=0 TSval=960832520 TSecr=758423078"
"745","4.665656","100.86.243.187","172.253.122.93","TCP","1466","56045  >  443 [ACK] Seq=31005 Ack=214404 Win=8282 Len=1400 TSval=758423116 TSecr=960832520 [TCP PDU reassembled in 747]"
"746","4.665658","100.86.243.187","172.253.122.93","TCP","1466","56045  >  443 [ACK] Seq=32405 Ack=214404 Win=8282 Len=1400 TSval=758423116 TSecr=960832520 [TCP PDU reassembled in 747]"
"747","4.665693","100.86.243.187","172.253.122.93","TLSv1.2","219","Application Data"
"748","4.676335","172.253.122.93","100.86.243.187","TCP","78","[TCP Dup ACK 744#1] 443  >  56045 [ACK] Seq=214404 Ack=31005 Win=544 Len=0 TSval=960832551 TSecr=758423078 SLE=33805 SRE=33958"
"749","4.676336","172.253.122.93","100.86.243.187","TCP","78","443  >  56045 [ACK] Seq=214404 Ack=32405 Win=539 Len=0 TSval=960832551 TSecr=758423116 SLE=33805 SRE=33958"
"750","4.676337","172.253.122.93","100.86.243.187","TCP","66","443  >  56045 [ACK] Seq=214404 Ack=33958 Win=533 Len=0 TSval=960832551 TSecr=758423116"
"751","4.676704","172.253.122.93","100.86.243.187","TLSv1.2","145","Application Data"
"752","4.676751","100.86.243.187","172.253.122.93","TCP","66","56045  >  443 [ACK] Seq=33958 Ack=214483 Win=8281 Len=0 TSval=758423127 TSecr=960832552"
"753","4.676984","100.86.243.187","172.253.122.93","TLSv1.2","105","Application Data"
"754","4.693239","172.253.122.93","100.86.243.187","TCP","66","443  >  56045 [ACK] Seq=214483 Ack=33997 Win=544 Len=0 TSval=960832568 TSecr=758423127"
"824","7.366026","100.86.243.187","172.253.122.93","TCP","1466","56045  >  443 [ACK] Seq=33997 Ack=214483 Win=8282 Len=1400 TSval=758425816 TSecr=960832568 [TCP PDU reassembled in 825]"
"825","7.366074","100.86.243.187","172.253.122.93","TLSv1.2","515","Application Data"
"828","7.379191","172.253.122.93","100.86.243.187","TCP","78","[TCP Dup ACK 754#1] 443  >  56045 [ACK] Seq=214483 Ack=33997 Win=544 Len=0 TSval=960835254 TSecr=758423127 SLE=35397 SRE=35846"
"829","7.379768","172.253.122.93","100.86.243.187","TLSv1.2","145","Application Data"
"830","7.379857","100.86.243.187","172.253.122.93","TCP","66","56045  >  443 [ACK] Seq=35846 Ack=214562 Win=8281 Len=0 TSval=758425830 TSecr=960835254"
"831","7.380386","100.86.243.187","172.253.122.93","TLSv1.2","105","Application Data"
"832","7.396036","172.253.122.93","100.86.243.187","TCP","66","443  >  56045 [ACK] Seq=214562 Ack=35885 Win=544 Len=0 TSval=960835271 TSecr=758425830"
