"No.","Time","Source","Destination","Protocol","Length","Info"
"4","0.005788","64.233.180.190","100.86.243.187","TLSv1.2","126","Application Data"
"5","0.005939","100.86.243.187","64.233.180.190","TCP","66","53804  >  443 [ACK] Seq=1 Ack=61 Win=32804 Len=0 TSval=4060114273 TSecr=2767053823"
"8","0.023739","100.86.243.187","64.233.180.190","TLSv1.2","890","Application Data"
"9","0.023889","100.86.243.187","64.233.180.190","TCP","1466","53804  >  443 [ACK] Seq=825 Ack=61 Win=32804 Len=1400 TSval=4060114291 TSecr=2767053823 [TCP PDU reassembled in 10]"
"10","0.023916","100.86.243.187","64.233.180.190","TLSv1.2","1098","Application Data"
"11","0.034291","64.233.180.190","100.86.243.187","TLSv1.2","1466","Application Data"
"12","0.034293","64.233.180.190","100.86.243.187","TLSv1.2","1466","Application Data"
"13","0.034293","64.233.180.190","100.86.243.187","TLSv1.2","1466","Application Data"
"14","0.034325","64.233.180.190","100.86.243.187","TLSv1.2","1466","Application Data"
"15","0.034326","64.233.180.190","100.86.243.187","TLSv1.2","689","Application Data"
"16","0.034589","100.86.243.187","64.233.180.190","TCP","66","53804  >  443 [ACK] Seq=3257 Ack=6284 Win=32804 Len=0 TSval=4060114302 TSecr=2767053853"
"17","0.035122","64.233.180.190","100.86.243.187","TLSv1.2","1466","Application Data"
"18","0.035123","64.233.180.190","100.86.243.187","TLSv1.2","1424","Application Data"
"19","0.035322","100.86.243.187","64.233.180.190","TCP","66","53804  >  443 [ACK] Seq=3257 Ack=9042 Win=32804 Len=0 TSval=4060114302 TSecr=2767053853"
"20","0.035722","64.233.180.190","100.86.243.187","TCP","66","443  >  53804 [ACK] Seq=9042 Ack=3257 Win=545 Len=0 TSval=2767053854 TSecr=4060114291"
"21","0.036800","64.233.180.190","100.86.243.187","TLSv1.2","1466","Application Data"
"22","0.036801","64.233.180.190","100.86.243.187","TLSv1.2","1466","Application Data"
"23","0.036801","64.233.180.190","100.86.243.187","TLSv1.2","1466","Application Data"
"24","0.036869","64.233.180.190","100.86.243.187","TLSv1.2","137","Application Data"
"25","0.036870","64.233.180.190","100.86.243.187","TLSv1.2","1466","Application Data"
"26","0.036905","100.86.243.187","64.233.180.190","TCP","66","53804  >  443 [ACK] Seq=3257 Ack=13242 Win=32738 Len=0 TSval=4060114304 TSecr=2767053856"
"27","0.037158","100.86.243.187","64.233.180.190","TCP","66","53804  >  443 [ACK] Seq=3257 Ack=14713 Win=32804 Len=0 TSval=4060114304 TSecr=2767053856"
"28","0.037213","64.233.180.190","100.86.243.187","TLSv1.2","524","Application Data"
"29","0.037215","64.233.180.190","100.86.243.187","TLSv1.2","1466","Application Data"
"30","0.037313","100.86.243.187","64.233.180.190","TCP","66","53804  >  443 [ACK] Seq=3257 Ack=16571 Win=32804 Len=0 TSval=4060114304 TSecr=2767053856"
"31","0.037663","64.233.180.190","100.86.243.187","TLSv1.2","1346","Application Data"
"32","0.037785","100.86.243.187","64.233.180.190","TCP","66","53804  >  443 [ACK] Seq=3257 Ack=17851 Win=32804 Len=0 TSval=4060114304 TSecr=2767053856"
"33","0.037950","64.233.180.190","100.86.243.187","TLSv1.2","1079","Application Data"
"34","0.038061","100.86.243.187","64.233.180.190","TCP","66","53804  >  443 [ACK] Seq=3257 Ack=18864 Win=32804 Len=0 TSval=4060114305 TSecr=2767053857"
"35","0.041317","64.233.180.190","100.86.243.187","TLSv1.2","1466","Application Data"
"36","0.041489","100.86.243.187","64.233.180.190","TCP","66","53804  >  443 [ACK] Seq=3257 Ack=20264 Win=32804 Len=0 TSval=4060114309 TSecr=2767053860"
"37","0.041802","64.233.180.190","100.86.243.187","TLSv1.2","1436","Application Data"
"38","0.041922","100.86.243.187","64.233.180.190","TCP","66","53804  >  443 [ACK] Seq=3257 Ack=21634 Win=32804 Len=0 TSval=4060114309 TSecr=2767053860"
"39","0.043212","64.233.180.190","100.86.243.187","TLSv1.2","1466","Application Data"
"40","0.043435","100.86.243.187","64.233.180.190","TCP","66","53804  >  443 [ACK] Seq=3257 Ack=23034 Win=32804 Len=0 TSval=4060114310 TSecr=2767053862"
"41","0.043696","64.233.180.190","100.86.243.187","TLSv1.2","553","Application Data"
"42","0.043697","64.233.180.190","100.86.243.187","TLSv1.2","1466","Application Data"
"43","0.043847","100.86.243.187","64.233.180.190","TCP","66","53804  >  443 [ACK] Seq=3257 Ack=24921 Win=32804 Len=0 TSval=4060114310 TSecr=2767053862"
"44","0.043872","64.233.180.190","100.86.243.187","TLSv1.2","1360","Application Data"
"45","0.043874","64.233.180.190","100.86.243.187","TLSv1.2","980","Application Data"
"46","0.044023","100.86.243.187","64.233.180.190","TCP","66","53804  >  443 [ACK] Seq=3257 Ack=27129 Win=32804 Len=0 TSval=4060114310 TSecr=2767053863"
"47","0.044129","64.233.180.190","100.86.243.187","TLSv1.2","1466","Application Data"
"48","0.044131","64.233.180.190","100.86.243.187","TLSv1.2","1466","Application Data"
"49","0.044246","100.86.243.187","64.233.180.190","TCP","66","53804  >  443 [ACK] Seq=3257 Ack=29929 Win=32804 Len=0 TSval=4060114310 TSecr=2767053863"
"50","0.044509","64.233.180.190","100.86.243.187","TLSv1.2","183","Application Data"
"51","0.044614","100.86.243.187","64.233.180.190","TCP","66","53804  >  443 [ACK] Seq=3257 Ack=30046 Win=32804 Len=0 TSval=4060114312 TSecr=2767053863"
"52","0.044840","64.233.180.190","100.86.243.187","TLSv1.2","1466","Application Data"
"53","0.044842","64.233.180.190","100.86.243.187","TLSv1.2","656","Application Data"
"54","0.044972","100.86.243.187","64.233.180.190","TCP","66","53804  >  443 [ACK] Seq=3257 Ack=32036 Win=32804 Len=0 TSval=4060114312 TSecr=2767053864"
"55","0.045826","64.233.180.190","100.86.243.187","TLSv1.2","1466","Application Data"
"56","0.045985","100.86.243.187","64.233.180.190","TCP","66","53804  >  443 [ACK] Seq=3257 Ack=33436 Win=32804 Len=0 TSval=4060114313 TSecr=2767053865"
"57","0.047017","64.233.180.190","100.86.243.187","TLSv1.2","1375","Application Data"
"58","0.047022","64.233.180.190","100.86.243.187","TLSv1.2","1086","Application Data"
"59","0.047275","100.86.243.187","64.233.180.190","TCP","66","53804  >  443 [ACK] Seq=3257 Ack=35765 Win=32804 Len=0 TSval=4060114314 TSecr=2767053865"
"60","0.047936","64.233.180.190","100.86.243.187","TLSv1.2","1466","Application Data"
"61","0.048099","100.86.243.187","64.233.180.190","TCP","66","53804  >  443 [ACK] Seq=3257 Ack=37165 Win=32804 Len=0 TSval=4060114314 TSecr=2767053866"
"62","0.048233","64.233.180.190","100.86.243.187","TLSv1.2","1134","Application Data"
"63","0.048346","100.86.243.187","64.233.180.190","TCP","66","53804  >  443 [ACK] Seq=3257 Ack=38233 Win=32804 Len=0 TSval=4060114315 TSecr=2767053866"
"64","0.049435","64.233.180.190","100.86.243.187","TLSv1.2","1466","Application Data"
"65","0.049437","64.233.180.190","100.86.243.187","TLSv1.2","545","Application Data"
"66","0.049750","100.86.243.187","64.233.180.190","TCP","66","53804  >  443 [ACK] Seq=3257 Ack=40112 Win=32804 Len=0 TSval=4060114317 TSecr=2767053867"
"67","0.049943","64.233.180.190","100.86.243.187","TLSv1.2","1466","Application Data"
"68","0.049944","64.233.180.190","100.86.243.187","TLSv1.2","1368","Application Data"
"69","0.049945","64.233.180.190","100.86.243.187","TLSv1.2","1156","Application Data"
"70","0.049946","64.233.180.190","100.86.243.187","TLSv1.2","1466","Application Data"
"71","0.050164","100.86.243.187","64.233.180.190","TCP","66","53804  >  443 [ACK] Seq=3257 Ack=45304 Win=32804 Len=0 TSval=4060114317 TSecr=2767053869"
"72","0.050985","64.233.180.190","100.86.243.187","TLSv1.2","1416","Application Data"
"73","0.051149","100.86.243.187","64.233.180.190","TCP","66","53804  >  443 [ACK] Seq=3257 Ack=46654 Win=32804 Len=0 TSval=4060114318 TSecr=2767053869"
"74","0.051589","64.233.180.190","100.86.243.187","TLSv1.2","1466","Application Data"
"75","0.051590","64.233.180.190","100.86.243.187","TLSv1.2","1466","Application Data"
"76","0.051630","64.233.180.190","100.86.243.187","TLSv1.2","436","Application Data"
"77","0.051839","100.86.243.187","64.233.180.190","TCP","66","53804  >  443 [ACK] Seq=3257 Ack=49824 Win=32804 Len=0 TSval=4060114318 TSecr=2767053870"
"78","0.052640","64.233.180.190","100.86.243.187","TLSv1.2","1466","Application Data"
"79","0.052643","64.233.180.190","100.86.243.187","TLSv1.2","966","Application Data"
"80","0.052852","100.86.243.187","64.233.180.190","TCP","66","53804  >  443 [ACK] Seq=3257 Ack=52124 Win=32804 Len=0 TSval=4060114320 TSecr=2767053871"
"81","0.052991","64.233.180.190","100.86.243.187","TLSv1.2","1466","Application Data"
"82","0.052992","64.233.180.190","100.86.243.187","TLSv1.2","425","Application Data"
"83","0.053150","100.86.243.187","64.233.180.190","TCP","66","53804  >  443 [ACK] Seq=3257 Ack=53883 Win=32804 Len=0 TSval=4060114320 TSecr=2767053872"
"84","0.054740","64.233.180.190","100.86.243.187","TLSv1.2","1466","Application Data"
"85","0.054741","64.233.180.190","100.86.243.187","TLSv1.2","1466","Application Data"
"86","0.054742","64.233.180.190","100.86.243.187","TLSv1.2","1466","Application Data"
"87","0.055015","100.86.243.187","64.233.180.190","TCP","66","53804  >  443 [ACK] Seq=3257 Ack=58083 Win=32804 Len=0 TSval=4060114322 TSecr=2767053874"
"88","0.055366","64.233.180.190","100.86.243.187","TLSv1.2","1466","Application Data"
"89","0.055367","64.233.180.190","100.86.243.187","TLSv1.2","174","Application Data"
"90","0.055522","100.86.243.187","64.233.180.190","TCP","66","53804  >  443 [ACK] Seq=3257 Ack=59591 Win=32804 Len=0 TSval=4060114322 TSecr=2767053874"
"91","0.056005","64.233.180.190","100.86.243.187","TLSv1.2","1466","Application Data"
"92","0.056007","64.233.180.190","100.86.243.187","TLSv1.2","921","Application Data"
"93","0.056008","64.233.180.190","100.86.243.187","TLSv1.2","98","Application Data"
"94","0.056212","100.86.243.187","64.233.180.190","TCP","66","53804  >  443 [ACK] Seq=3257 Ack=61878 Win=32804 Len=0 TSval=4060114323 TSecr=2767053875"
"95","0.056854","64.233.180.190","100.86.243.187","TLSv1.2","97","Application Data"
"96","0.056855","64.233.180.190","100.86.243.187","TLSv1.2","105","Application Data"
"97","0.057099","100.86.243.187","64.233.180.190","TCP","66","53804  >  443 [ACK] Seq=3257 Ack=61948 Win=32804 Len=0 TSval=4060114324 TSecr=2767053875"
"98","0.057170","100.86.243.187","64.233.180.190","TLSv1.2","105","Application Data"
"99","0.072904","64.233.180.190","100.86.243.187","TCP","66","443  >  53804 [ACK] Seq=61948 Ack=3296 Win=554 Len=0 TSval=2767053892 TSecr=4060114324"
"100","0.076016","64.233.180.190","100.86.243.187","TLSv1.2","148","Application Data"
"101","0.076017","64.233.180.190","100.86.243.187","TLSv1.2","1285","Application Data"
"102","0.076019","64.233.180.190","100.86.243.187","TLSv1.2","97","Application Data"
"103","0.076458","100.86.243.187","64.233.180.190","TCP","66","53804  >  443 [ACK] Seq=3296 Ack=63280 Win=32804 Len=0 TSval=4060114343 TSecr=2767053894"
"104","0.076592","64.233.180.190","100.86.243.187","TLSv1.2","105","Application Data"
"105","0.076687","100.86.243.187","64.233.180.190","TCP","66","53804  >  443 [ACK] Seq=3296 Ack=63319 Win=32804 Len=0 TSval=4060114343 TSecr=2767053894"
"106","0.076743","100.86.243.187","64.233.180.190","TLSv1.2","105","Application Data"
"107","0.092108","64.233.180.190","100.86.243.187","TCP","66","443  >  53804 [ACK] Seq=63319 Ack=3335 Win=554 Len=0 TSval=2767053911 TSecr=4060114343"
"667","0.305591","100.86.243.187","64.233.180.190","TCP","1466","53804  >  443 [ACK] Seq=3335 Ack=63319 Win=32804 Len=1400 TSval=4060114573 TSecr=2767053911 [TCP PDU reassembled in 668]"
"668","0.305635","100.86.243.187","64.233.180.190","TLSv1.2","226","Application Data"
"669","0.305964","100.86.243.187","64.233.180.190","TLSv1.2","247","Application Data"
"670","0.306223","100.86.243.187","64.233.180.190","TLSv1.2","235","Application Data"
"671","0.306421","100.86.243.187","64.233.180.190","TLSv1.2","235","Application Data"
"672","0.306566","100.86.243.187","64.233.180.190","TLSv1.2","235","Application Data"
"673","0.306925","100.86.243.187","64.233.180.190","TLSv1.2","235","Application Data"
"674","0.307062","100.86.243.187","64.233.180.190","TLSv1.2","235","Application Data"
"675","0.307199","100.86.243.187","64.233.180.190","TLSv1.2","235","Application Data"
"676","0.307374","100.86.243.187","64.233.180.190","TLSv1.2","235","Application Data"
"677","0.307931","100.86.243.187","64.233.180.190","TLSv1.2","234","Application Data"
"678","0.308231","100.86.243.187","64.233.180.190","TLSv1.2","235","Application Data"
"679","0.308506","100.86.243.187","64.233.180.190","TLSv1.2","235","Application Data"
"680","0.308713","100.86.243.187","64.233.180.190","TLSv1.2","235","Application Data"
"681","0.308893","100.86.243.187","64.233.180.190","TLSv1.2","235","Application Data"
"682","0.309068","100.86.243.187","64.233.180.190","TLSv1.2","235","Application Data"
"683","0.309243","100.86.243.187","64.233.180.190","TLSv1.2","235","Application Data"
"684","0.309357","100.86.243.187","64.233.180.190","TLSv1.2","235","Application Data"
"685","0.309469","100.86.243.187","64.233.180.190","TLSv1.2","235","Application Data"
"686","0.309615","100.86.243.187","64.233.180.190","TLSv1.2","235","Application Data"
"687","0.309705","100.86.243.187","64.233.180.190","TLSv1.2","235","Application Data"
"688","0.315797","100.86.243.187","64.233.180.190","TLSv1.2","101","Application Data"
"689","0.316136","100.86.243.187","64.233.180.190","TLSv1.2","101","Application Data"
"690","0.316310","64.233.180.190","100.86.243.187","TCP","66","443  >  53804 [ACK] Seq=63319 Ack=4895 Win=549 Len=0 TSval=2767054135 TSecr=4060114573"
"691","0.316877","100.86.243.187","64.233.180.190","TLSv1.2","101","Application Data"
"692","0.317361","64.233.180.190","100.86.243.187","TCP","66","443  >  53804 [ACK] Seq=63319 Ack=5583 Win=549 Len=0 TSval=2767054136 TSecr=4060114574"
"693","0.317534","100.86.243.187","64.233.180.190","TLSv1.2","101","Application Data"
"694","0.318307","100.86.243.187","64.233.180.190","TLSv1.2","101","Application Data"
"695","0.318755","100.86.243.187","64.233.180.190","TLSv1.2","101","Application Data"
"696","0.318926","64.233.180.190","100.86.243.187","TCP","66","443  >  53804 [ACK] Seq=63319 Ack=6259 Win=549 Len=0 TSval=2767054137 TSecr=4060114574"
"697","0.318927","64.233.180.190","100.86.243.187","TCP","66","443  >  53804 [ACK] Seq=63319 Ack=6427 Win=549 Len=0 TSval=2767054137 TSecr=4060114575"
"698","0.319322","100.86.243.187","64.233.180.190","TLSv1.2","101","Application Data"
"699","0.319516","64.233.180.190","100.86.243.187","TCP","66","443  >  53804 [ACK] Seq=63319 Ack=6765 Win=549 Len=0 TSval=2767054138 TSecr=4060114575"
"700","0.319517","64.233.180.190","100.86.243.187","TCP","66","443  >  53804 [ACK] Seq=63319 Ack=7103 Win=549 Len=0 TSval=2767054139 TSecr=4060114575"
"701","0.320104","100.86.243.187","64.233.180.190","TLSv1.2","101","Application Data"
"702","0.320345","100.86.243.187","64.233.180.190","TLSv1.2","101","Application Data"
"703","0.320604","64.233.180.190","100.86.243.187","TLSv1.2","160","Application Data"
"704","0.320604","64.233.180.190","100.86.243.187","TLSv1.2","1466","Application Data"
"705","0.320605","64.233.180.190","100.86.243.187","TLSv1.2","1466","Application Data"
"706","0.320705","100.86.243.187","64.233.180.190","TCP","66","53804  >  443 [ACK] Seq=8432 Ack=63413 Win=32804 Len=0 TSval=4060114588 TSecr=2767054139"
"707","0.320794","100.86.243.187","64.233.180.190","TCP","66","53804  >  443 [ACK] Seq=8432 Ack=66213 Win=32760 Len=0 TSval=4060114588 TSecr=2767054139"
"708","0.320815","100.86.243.187","64.233.180.190","TCP","66","[TCP Window Update] 53804  >  443 [ACK] Seq=8432 Ack=66213 Win=32804 Len=0 TSval=4060114588 TSecr=2767054139"
"709","0.321061","100.86.243.187","64.233.180.190","TLSv1.2","101","Application Data"
"710","0.321317","64.233.180.190","100.86.243.187","TLSv1.2","1466","Application Data"
"711","0.321318","64.233.180.190","100.86.243.187","TLSv1.2","1466","Application Data"
"712","0.321319","64.233.180.190","100.86.243.187","TLSv1.2","1466","Application Data"
"713","0.321320","64.233.180.190","100.86.243.187","TLSv1.2","1466","Application Data"
"714","0.321439","100.86.243.187","64.233.180.190","TCP","66","53804  >  443 [ACK] Seq=8467 Ack=71813 Win=32804 Len=0 TSval=4060114589 TSecr=2767054139"
"715","0.321561","100.86.243.187","64.233.180.190","TLSv1.2","101","Application Data"
"716","0.321627","64.233.180.190","100.86.243.187","TLSv1.2","1466","Application Data"
"717","0.321629","64.233.180.190","100.86.243.187","TLSv1.2","1466","Application Data"
"718","0.321629","64.233.180.190","100.86.243.187","TLSv1.2","1466","Application Data"
"719","0.321630","64.233.180.190","100.86.243.187","TLSv1.2","1466","Application Data"
"720","0.321699","64.233.180.190","100.86.243.187","TLSv1.2","1466","Application Data"
"721","0.321700","64.233.180.190","100.86.243.187","TLSv1.2","1466","Application Data"
"722","0.321729","100.86.243.187","64.233.180.190","TCP","66","53804  >  443 [ACK] Seq=8502 Ack=77413 Win=32804 Len=0 TSval=4060114589 TSecr=2767054139"
"723","0.321766","100.86.243.187","64.233.180.190","TCP","66","53804  >  443 [ACK] Seq=8502 Ack=80213 Win=32804 Len=0 TSval=4060114589 TSecr=2767054140"
"724","0.322051","100.86.243.187","64.233.180.190","TLSv1.2","101","Application Data"
"725","0.322811","100.86.243.187","64.233.180.190","TLSv1.2","101","Application Data"
"726","0.323176","100.86.243.187","64.233.180.190","TLSv1.2","101","Application Data"
"727","0.323229","64.233.180.190","100.86.243.187","TLSv1.2","1466","Application Data"
"728","0.323230","64.233.180.190","100.86.243.187","TLSv1.2","1466","Application Data"
"729","0.323230","64.233.180.190","100.86.243.187","TLSv1.2","1466","Application Data"
"730","0.323231","64.233.180.190","100.86.243.187","TLSv1.2","1466","Application Data"
"731","0.323232","64.233.180.190","100.86.243.187","TLSv1.2","1466","Application Data"
"732","0.323233","64.233.180.190","100.86.243.187","TLSv1.2","1466","Application Data"
"733","0.323234","64.233.180.190","100.86.243.187","TLSv1.2","1466","Application Data"
"734","0.323235","64.233.180.190","100.86.243.187","TLSv1.2","1466","Application Data"
"735","0.323362","64.233.180.190","100.86.243.187","TLSv1.2","1466","Application Data"
"736","0.323362","64.233.180.190","100.86.243.187","TLSv1.2","1466","Application Data"
"737","0.323442","100.86.243.187","64.233.180.190","TCP","66","53804  >  443 [ACK] Seq=8607 Ack=94213 Win=32804 Len=0 TSval=4060114590 TSecr=2767054140"
"738","0.323628","64.233.180.190","100.86.243.187","TLSv1.2","1466","Application Data"
"739","0.323629","64.233.180.190","100.86.243.187","TLSv1.2","1180","Application Data"
"740","0.323630","64.233.180.190","100.86.243.187","TLSv1.2","1466","Application Data"
"741","0.323630","64.233.180.190","100.86.243.187","TLSv1.2","1466","Application Data"
"742","0.323740","100.86.243.187","64.233.180.190","TCP","66","53804  >  443 [ACK] Seq=8607 Ack=99527 Win=32804 Len=0 TSval=4060114590 TSecr=2767054141"
"743","0.323796","100.86.243.187","64.233.180.190","TLSv1.2","101","Application Data"
"744","0.324227","100.86.243.187","64.233.180.190","TLSv1.2","101","Application Data"
"745","0.324854","100.86.243.187","64.233.180.190","TLSv1.2","101","Application Data"
"746","0.325239","64.233.180.190","100.86.243.187","TLSv1.2","1466","Application Data"
"747","0.325240","64.233.180.190","100.86.243.187","TLSv1.2","1466","Application Data"
"748","0.325241","64.233.180.190","100.86.243.187","TLSv1.2","1466","Application Data"
"749","0.325242","64.233.180.190","100.86.243.187","TLSv1.2","1466","Application Data"
"750","0.325333","100.86.243.187","64.233.180.190","TLSv1.2","101","Application Data"
"751","0.325454","100.86.243.187","64.233.180.190","TCP","66","[TCP Window Update] 53804  >  443 [ACK] Seq=8747 Ack=105127 Win=32804 Len=0 TSval=4060114592 TSecr=2767054141"
"752","0.325818","100.86.243.187","64.233.180.190","TLSv1.2","101","Application Data"
"753","0.326351","64.233.180.190","100.86.243.187","TLSv1.2","1466","Application Data"
"754","0.326352","64.233.180.190","100.86.243.187","TLSv1.2","1466","Application Data"
"755","0.326352","64.233.180.190","100.86.243.187","TLSv1.2","1466","Application Data"
"756","0.326353","64.233.180.190","100.86.243.187","TLSv1.2","1466","Application Data"
"757","0.326355","64.233.180.190","100.86.243.187","TLSv1.2","1466","Application Data"
"758","0.326356","64.233.180.190","100.86.243.187","TLSv1.2","1466","Application Data"
"759","0.326356","64.233.180.190","100.86.243.187","TLSv1.2","1466","Application Data"
"760","0.326357","64.233.180.190","100.86.243.187","TLSv1.2","1466","Application Data"
"761","0.326358","64.233.180.190","100.86.243.187","TLSv1.2","1466","Application Data"
"762","0.326359","64.233.180.190","100.86.243.187","TLSv1.2","1466","Application Data"
"763","0.326359","64.233.180.190","100.86.243.187","TLSv1.2","1466","Application Data"
"764","0.326360","64.233.180.190","100.86.243.187","TLSv1.2","1466","Application Data, Application Data, Application Data"
"765","0.326361","64.233.180.190","100.86.243.187","TLSv1.2","1466","Application Data"
"766","0.326361","64.233.180.190","100.86.243.187","TLSv1.2","1466","Application Data"
"767","0.326362","64.233.180.190","100.86.243.187","TLSv1.2","1466","Application Data"
"768","0.326363","64.233.180.190","100.86.243.187","TLSv1.2","1466","Application Data"
"769","0.326363","64.233.180.190","100.86.243.187","TLSv1.2","1466","Application Data"
"770","0.326364","64.233.180.190","100.86.243.187","TLSv1.2","1466","Application Data"
"771","0.326614","100.86.243.187","64.233.180.190","TLSv1.2","105","Application Data"
"772","0.326726","100.86.243.187","64.233.180.190","TCP","66","[TCP Window Update] 53804  >  443 [ACK] Seq=8821 Ack=130327 Win=32804 Len=0 TSval=4060114594 TSecr=2767054141"
"773","0.328545","64.233.180.190","100.86.243.187","TLSv1.2","1466","Application Data"
"774","0.328546","64.233.180.190","100.86.243.187","TLSv1.2","1466","Application Data"
"775","0.328547","64.233.180.190","100.86.243.187","TLSv1.2","1466","Application Data"
"776","0.328547","64.233.180.190","100.86.243.187","TLSv1.2","1466","Application Data"
"777","0.328548","64.233.180.190","100.86.243.187","TLSv1.2","1466","Application Data"
"778","0.328549","64.233.180.190","100.86.243.187","TLSv1.2","1466","Application Data"
"779","0.328549","64.233.180.190","100.86.243.187","TLSv1.2","1466","Application Data"
"780","0.328550","64.233.180.190","100.86.243.187","TLSv1.2","1466","Application Data"
"781","0.328550","64.233.180.190","100.86.243.187","TLSv1.2","1466","Application Data"
"782","0.328551","64.233.180.190","100.86.243.187","TLSv1.2","1466","Application Data"
"783","0.328551","64.233.180.190","100.86.243.187","TLSv1.2","1466","Application Data"
"784","0.328552","64.233.180.190","100.86.243.187","TLSv1.2","1466","Application Data"
"785","0.328553","64.233.180.190","100.86.243.187","TLSv1.2","1466","Application Data"
"786","0.328554","64.233.180.190","100.86.243.187","TLSv1.2","1466","Application Data"
"787","0.328554","64.233.180.190","100.86.243.187","TLSv1.2","1466","Application Data"
"788","0.328555","64.233.180.190","100.86.243.187","TLSv1.2","1466","Application Data"
"789","0.328555","64.233.180.190","100.86.243.187","TLSv1.2","1466","Application Data"
"790","0.328556","64.233.180.190","100.86.243.187","TLSv1.2","1466","Application Data"
"791","0.328590","64.233.180.190","100.86.243.187","TLSv1.2","1466","Application Data"
"792","0.328590","64.233.180.190","100.86.243.187","TLSv1.2","1466","Application Data"
"793","0.328766","64.233.180.190","100.86.243.187","TLSv1.2","1466","Application Data"
"794","0.328767","64.233.180.190","100.86.243.187","TLSv1.2","1466","Application Data"
"795","0.328879","100.86.243.187","64.233.180.190","TCP","66","53804  >  443 [ACK] Seq=8821 Ack=161127 Win=32804 Len=0 TSval=4060114596 TSecr=2767054144"
"796","0.329034","64.233.180.190","100.86.243.187","TLSv1.2","1466","Application Data"
"797","0.329034","64.233.180.190","100.86.243.187","TLSv1.2","1466","Application Data"
"798","0.329035","64.233.180.190","100.86.243.187","TLSv1.2","1466","Application Data"
"799","0.329036","64.233.180.190","100.86.243.187","TLSv1.2","1466","Application Data"
"800","0.329165","100.86.243.187","64.233.180.190","TCP","66","53804  >  443 [ACK] Seq=8821 Ack=166727 Win=32804 Len=0 TSval=4060114596 TSecr=2767054145"
"801","0.329220","64.233.180.190","100.86.243.187","TLSv1.2","1466","Application Data"
"802","0.329221","64.233.180.190","100.86.243.187","TLSv1.2","1466","Application Data"
"803","0.329299","100.86.243.187","64.233.180.190","TCP","66","53804  >  443 [ACK] Seq=8821 Ack=169527 Win=32804 Len=0 TSval=4060114596 TSecr=2767054145"
"804","0.329528","64.233.180.190","100.86.243.187","TLSv1.2","1466","Application Data"
"805","0.329529","64.233.180.190","100.86.243.187","TLSv1.2","1466","Application Data"
"806","0.329529","64.233.180.190","100.86.243.187","TLSv1.2","1466","Application Data"
"807","0.329530","64.233.180.190","100.86.243.187","TLSv1.2","1466","Application Data"
"808","0.329580","100.86.243.187","64.233.180.190","TCP","66","53804  >  443 [ACK] Seq=8821 Ack=175127 Win=32716 Len=0 TSval=4060114596 TSecr=2767054146"
"809","0.329652","64.233.180.190","100.86.243.187","TLSv1.2","1466","Application Data"
"810","0.329666","64.233.180.190","100.86.243.187","TLSv1.2","1466","Application Data"
"811","0.329687","100.86.243.187","64.233.180.190","TCP","66","[TCP Window Update] 53804  >  443 [ACK] Seq=8821 Ack=175127 Win=32804 Len=0 TSval=4060114597 TSecr=2767054146"
"812","0.329724","100.86.243.187","64.233.180.190","TCP","66","53804  >  443 [ACK] Seq=8821 Ack=177927 Win=32804 Len=0 TSval=4060114597 TSecr=2767054146"
"813","0.329870","64.233.180.190","100.86.243.187","TLSv1.2","1466","Application Data"
"814","0.329872","64.233.180.190","100.86.243.187","TLSv1.2","1466","Application Data, Application Data"
"815","0.329872","64.233.180.190","100.86.243.187","TLSv1.2","1466","Application Data"
"816","0.329873","64.233.180.190","100.86.243.187","TLSv1.2","1466","Application Data"
"817","0.330028","100.86.243.187","64.233.180.190","TCP","66","53804  >  443 [ACK] Seq=8821 Ack=183527 Win=32804 Len=0 TSval=4060114597 TSecr=2767054147"
"818","0.330189","64.233.180.190","100.86.243.187","TLSv1.2","1466","Application Data"
"819","0.330190","64.233.180.190","100.86.243.187","TLSv1.2","1466","Application Data"
"820","0.330290","100.86.243.187","64.233.180.190","TCP","66","53804  >  443 [ACK] Seq=8821 Ack=186327 Win=32804 Len=0 TSval=4060114597 TSecr=2767054147"
"821","0.331581","64.233.180.190","100.86.243.187","TLSv1.2","1466","Application Data"
"822","0.331582","64.233.180.190","100.86.243.187","TLSv1.2","1466","Application Data"
"823","0.331583","64.233.180.190","100.86.243.187","TLSv1.2","1466","Application Data"
"824","0.331584","64.233.180.190","100.86.243.187","TLSv1.2","1466","Application Data"
"825","0.331584","64.233.180.190","100.86.243.187","TLSv1.2","1466","Application Data"
"826","0.331585","64.233.180.190","100.86.243.187","TLSv1.2","1466","Application Data"
"827","0.331585","64.233.180.190","100.86.243.187","TLSv1.2","1466","Application Data"
"828","0.331586","64.233.180.190","100.86.243.187","TLSv1.2","1466","Application Data"
"829","0.331587","64.233.180.190","100.86.243.187","TLSv1.2","1466","Application Data"
"830","0.331587","64.233.180.190","100.86.243.187","TLSv1.2","1466","Application Data"
"831","0.331588","64.233.180.190","100.86.243.187","TLSv1.2","1466","Application Data"
"832","0.331589","64.233.180.190","100.86.243.187","TLSv1.2","1466","Application Data"
"833","0.331589","64.233.180.190","100.86.243.187","TCP","1466","[TCP Previous segment not captured] 443  >  53804 [ACK] Seq=204527 Ack=8187 Win=554 Len=1400 TSval=2767054148 TSecr=4060114583"
"834","0.331590","64.233.180.190","100.86.243.187","TLSv1.2","1466","Ignored Unknown Record"
"835","0.331591","64.233.180.190","100.86.243.187","TLSv1.2","1466","Ignored Unknown Record"
"836","0.331591","64.233.180.190","100.86.243.187","TLSv1.2","1466","Ignored Unknown Record"
"837","0.331703","100.86.243.187","64.233.180.190","TCP","78","53804  >  443 [ACK] Seq=8821 Ack=203127 Win=32541 Len=0 TSval=4060114599 TSecr=2767054147 SLE=204527 SRE=207327"
"838","0.331751","100.86.243.187","64.233.180.190","TCP","78","[TCP Dup ACK 837#1] 53804  >  443 [ACK] Seq=8821 Ack=203127 Win=32591 Len=0 TSval=4060114599 TSecr=2767054147 SLE=204527 SRE=210127"
"839","0.331840","100.86.243.187","64.233.180.190","TCP","78","[TCP Dup ACK 837#2] 53804  >  443 [ACK] Seq=8821 Ack=203127 Win=32804 Len=0 TSval=4060114599 TSecr=2767054147 SLE=204527 SRE=210127"
"840","0.333272","64.233.180.190","100.86.243.187","TLSv1.2","1466","Ignored Unknown Record"
"841","0.333274","64.233.180.190","100.86.243.187","TLSv1.2","1466","Ignored Unknown Record"
"842","0.333274","64.233.180.190","100.86.243.187","TLSv1.2","1466","Ignored Unknown Record"
"843","0.333275","64.233.180.190","100.86.243.187","TLSv1.2","1466","Ignored Unknown Record"
"844","0.333276","64.233.180.190","100.86.243.187","TLSv1.2","1466","Ignored Unknown Record"
"845","0.333276","64.233.180.190","100.86.243.187","TLSv1.2","1466","Ignored Unknown Record"
"846","0.333277","64.233.180.190","100.86.243.187","TLSv1.2","1466","Ignored Unknown Record"
"847","0.333278","64.233.180.190","100.86.243.187","TLSv1.2","1466","Ignored Unknown Record"
"848","0.333278","64.233.180.190","100.86.243.187","TLSv1.2","1466","Ignored Unknown Record"
"849","0.333279","64.233.180.190","100.86.243.187","TLSv1.2","1466","Ignored Unknown Record"
"850","0.333280","64.233.180.190","100.86.243.187","TLSv1.2","1466","Ignored Unknown Record"
"851","0.333280","64.233.180.190","100.86.243.187","TLSv1.2","1466","Ignored Unknown Record"
"852","0.333281","64.233.180.190","100.86.243.187","TLSv1.2","1466","Ignored Unknown Record"
"853","0.333282","64.233.180.190","100.86.243.187","TLSv1.2","1466","Ignored Unknown Record"
"854","0.333366","100.86.243.187","64.233.180.190","TCP","78","[TCP Dup ACK 837#3] 53804  >  443 [ACK] Seq=8821 Ack=203127 Win=32804 Len=0 TSval=4060114601 TSecr=2767054147 SLE=204527 SRE=219927"
"855","0.333395","100.86.243.187","64.233.180.190","TCP","78","[TCP Dup ACK 837#4] 53804  >  443 [ACK] Seq=8821 Ack=203127 Win=32804 Len=0 TSval=4060114601 TSecr=2767054147 SLE=204527 SRE=229727"
"856","0.334469","64.233.180.190","100.86.243.187","TCP","1466","443  >  53804 [ACK] Seq=229727 Ack=8292 Win=554 Len=1400 TSval=2767054150 TSecr=4060114585 [TCP PDU reassembled in 884]"
"857","0.334470","64.233.180.190","100.86.243.187","TCP","1466","443  >  53804 [PSH, ACK] Seq=231127 Ack=8292 Win=554 Len=1400 TSval=2767054150 TSecr=4060114585 [TCP PDU reassembled in 884]"
"858","0.334471","64.233.180.190","100.86.243.187","TCP","1466","443  >  53804 [ACK] Seq=232527 Ack=8362 Win=554 Len=1400 TSval=2767054151 TSecr=4060114585 [TCP PDU reassembled in 884]"
"859","0.334472","64.233.180.190","100.86.243.187","TCP","1466","443  >  53804 [ACK] Seq=233927 Ack=8362 Win=554 Len=1400 TSval=2767054151 TSecr=4060114585 [TCP PDU reassembled in 884]"
"860","0.334473","64.233.180.190","100.86.243.187","TCP","1466","443  >  53804 [ACK] Seq=235327 Ack=8362 Win=554 Len=1400 TSval=2767054151 TSecr=4060114585 [TCP PDU reassembled in 884]"
"861","0.334473","64.233.180.190","100.86.243.187","TCP","1466","443  >  53804 [ACK] Seq=236727 Ack=8362 Win=554 Len=1400 TSval=2767054151 TSecr=4060114585 [TCP PDU reassembled in 884]"
"862","0.334475","64.233.180.190","100.86.243.187","TCP","1466","443  >  53804 [ACK] Seq=238127 Ack=8362 Win=554 Len=1400 TSval=2767054151 TSecr=4060114585 [TCP PDU reassembled in 884]"
"863","0.334475","64.233.180.190","100.86.243.187","TCP","1466","443  >  53804 [ACK] Seq=239527 Ack=8362 Win=554 Len=1400 TSval=2767054151 TSecr=4060114585 [TCP PDU reassembled in 884]"
"864","0.334476","64.233.180.190","100.86.243.187","TCP","1466","443  >  53804 [ACK] Seq=240927 Ack=8362 Win=554 Len=1400 TSval=2767054151 TSecr=4060114585 [TCP PDU reassembled in 884]"
"865","0.334477","64.233.180.190","100.86.243.187","TCP","1466","443  >  53804 [ACK] Seq=242327 Ack=8362 Win=554 Len=1400 TSval=2767054151 TSecr=4060114585 [TCP PDU reassembled in 884]"
"866","0.334478","64.233.180.190","100.86.243.187","TCP","1466","443  >  53804 [PSH, ACK] Seq=243727 Ack=8362 Win=554 Len=1400 TSval=2767054151 TSecr=4060114585 [TCP PDU reassembled in 884]"
"867","0.334479","64.233.180.190","100.86.243.187","TCP","1466","443  >  53804 [ACK] Seq=245127 Ack=8362 Win=554 Len=1400 TSval=2767054152 TSecr=4060114585 [TCP PDU reassembled in 884]"
"868","0.334592","100.86.243.187","64.233.180.190","TCP","78","[TCP Dup ACK 837#5] 53804  >  443 [ACK] Seq=8821 Ack=203127 Win=32804 Len=0 TSval=4060114602 TSecr=2767054147 SLE=204527 SRE=232527"
"869","0.334635","100.86.243.187","64.233.180.190","TCP","78","[TCP Dup ACK 837#6] 53804  >  443 [ACK] Seq=8821 Ack=203127 Win=32804 Len=0 TSval=4060114602 TSecr=2767054147 SLE=204527 SRE=246527"
"870","0.335846","64.233.180.190","100.86.243.187","TCP","1466","443  >  53804 [ACK] Seq=246527 Ack=8362 Win=554 Len=1400 TSval=2767054152 TSecr=4060114585 [TCP PDU reassembled in 884]"
"871","0.335847","64.233.180.190","100.86.243.187","TCP","1466","443  >  53804 [ACK] Seq=247927 Ack=8362 Win=554 Len=1400 TSval=2767054152 TSecr=4060114585 [TCP PDU reassembled in 884]"
"872","0.335848","64.233.180.190","100.86.243.187","TCP","1466","443  >  53804 [ACK] Seq=249327 Ack=8362 Win=554 Len=1400 TSval=2767054152 TSecr=4060114585 [TCP PDU reassembled in 884]"
"873","0.335849","64.233.180.190","100.86.243.187","TCP","1466","443  >  53804 [ACK] Seq=250727 Ack=8362 Win=554 Len=1400 TSval=2767054152 TSecr=4060114585 [TCP PDU reassembled in 884]"
"874","0.335849","64.233.180.190","100.86.243.187","TCP","1466","443  >  53804 [ACK] Seq=252127 Ack=8362 Win=554 Len=1400 TSval=2767054152 TSecr=4060114585 [TCP PDU reassembled in 884]"
"875","0.335850","64.233.180.190","100.86.243.187","TCP","1466","443  >  53804 [ACK] Seq=253527 Ack=8362 Win=554 Len=1400 TSval=2767054152 TSecr=4060114585 [TCP PDU reassembled in 884]"
"876","0.335851","64.233.180.190","100.86.243.187","TCP","1466","443  >  53804 [ACK] Seq=254927 Ack=8362 Win=554 Len=1400 TSval=2767054152 TSecr=4060114585 [TCP PDU reassembled in 884]"
"877","0.335851","64.233.180.190","100.86.243.187","TCP","1466","443  >  53804 [PSH, ACK] Seq=256327 Ack=8362 Win=554 Len=1400 TSval=2767054152 TSecr=4060114585 [TCP PDU reassembled in 884]"
"878","0.335852","64.233.180.190","100.86.243.187","TCP","1466","443  >  53804 [ACK] Seq=257727 Ack=8362 Win=554 Len=1400 TSval=2767054152 TSecr=4060114585 [TCP PDU reassembled in 884]"
"879","0.335853","64.233.180.190","100.86.243.187","TCP","1466","443  >  53804 [ACK] Seq=259127 Ack=8362 Win=554 Len=1400 TSval=2767054152 TSecr=4060114585 [TCP PDU reassembled in 884]"
"880","0.335854","64.233.180.190","100.86.243.187","TCP","1466","443  >  53804 [ACK] Seq=260527 Ack=8362 Win=554 Len=1400 TSval=2767054152 TSecr=4060114585 [TCP PDU reassembled in 884]"
"881","0.335855","64.233.180.190","100.86.243.187","TCP","1466","443  >  53804 [ACK] Seq=261927 Ack=8362 Win=554 Len=1400 TSval=2767054152 TSecr=4060114585 [TCP PDU reassembled in 884]"
"882","0.335856","64.233.180.190","100.86.243.187","TCP","1466","443  >  53804 [ACK] Seq=263327 Ack=8362 Win=554 Len=1400 TSval=2767054152 TSecr=4060114585 [TCP PDU reassembled in 884]"
"883","0.335857","64.233.180.190","100.86.243.187","TCP","1466","443  >  53804 [ACK] Seq=264727 Ack=8362 Win=554 Len=1400 TSval=2767054152 TSecr=4060114585 [TCP PDU reassembled in 884]"
"884","0.335858","64.233.180.190","100.86.243.187","TLSv1.2","1466","Application Data"
"885","0.335859","64.233.180.190","100.86.243.187","TCP","1466","443  >  53804 [ACK] Seq=267527 Ack=8362 Win=554 Len=1400 TSval=2767054152 TSecr=4060114585 [TCP PDU reassembled in 899]"
"886","0.335929","100.86.243.187","64.233.180.190","TCP","78","[TCP Dup ACK 837#7] 53804  >  443 [ACK] Seq=8821 Ack=203127 Win=32804 Len=0 TSval=4060114603 TSecr=2767054147 SLE=204527 SRE=261927"
"887","0.335952","100.86.243.187","64.233.180.190","TCP","78","[TCP Dup ACK 837#8] 53804  >  443 [ACK] Seq=8821 Ack=203127 Win=32804 Len=0 TSval=4060114603 TSecr=2767054147 SLE=204527 SRE=268927"
"888","0.336396","64.233.180.190","100.86.243.187","TCP","1466","443  >  53804 [PSH, ACK] Seq=268927 Ack=8362 Win=554 Len=1400 TSval=2767054152 TSecr=4060114585 [TCP PDU reassembled in 899]"
"889","0.336397","64.233.180.190","100.86.243.187","TCP","1466","443  >  53804 [ACK] Seq=270327 Ack=8502 Win=554 Len=1400 TSval=2767054153 TSecr=4060114586 [TCP PDU reassembled in 899]"
"890","0.336398","64.233.180.190","100.86.243.187","TCP","1466","443  >  53804 [ACK] Seq=271727 Ack=8502 Win=554 Len=1400 TSval=2767054153 TSecr=4060114586 [TCP PDU reassembled in 899]"
"891","0.336399","64.233.180.190","100.86.243.187","TCP","1466","443  >  53804 [ACK] Seq=273127 Ack=8502 Win=554 Len=1400 TSval=2767054153 TSecr=4060114586 [TCP PDU reassembled in 899]"
"892","0.336467","100.86.243.187","64.233.180.190","TCP","78","[TCP Dup ACK 837#9] 53804  >  443 [ACK] Seq=8821 Ack=203127 Win=32804 Len=0 TSval=4060114603 TSecr=2767054147 SLE=204527 SRE=270327"
"893","0.336501","100.86.243.187","64.233.180.190","TCP","78","[TCP Dup ACK 837#10] 53804  >  443 [ACK] Seq=8821 Ack=203127 Win=32804 Len=0 TSval=4060114603 TSecr=2767054147 SLE=204527 SRE=274527"
"894","0.336692","64.233.180.190","100.86.243.187","TCP","1466","443  >  53804 [ACK] Seq=274527 Ack=8502 Win=554 Len=1400 TSval=2767054153 TSecr=4060114586 [TCP PDU reassembled in 899]"
"895","0.336693","64.233.180.190","100.86.243.187","TCP","1466","443  >  53804 [ACK] Seq=275927 Ack=8502 Win=554 Len=1400 TSval=2767054153 TSecr=4060114586 [TCP PDU reassembled in 899]"
"896","0.336694","64.233.180.190","100.86.243.187","TCP","1466","443  >  53804 [ACK] Seq=277327 Ack=8502 Win=554 Len=1400 TSval=2767054153 TSecr=4060114586 [TCP PDU reassembled in 899]"
"897","0.336694","64.233.180.190","100.86.243.187","TCP","1466","443  >  53804 [ACK] Seq=278727 Ack=8502 Win=554 Len=1400 TSval=2767054153 TSecr=4060114586 [TCP PDU reassembled in 899]"
"898","0.336741","100.86.243.187","64.233.180.190","TCP","78","[TCP Dup ACK 837#11] 53804  >  443 [ACK] Seq=8821 Ack=203127 Win=32804 Len=0 TSval=4060114603 TSecr=2767054147 SLE=204527 SRE=280127"
"899","0.337037","64.233.180.190","100.86.243.187","TLSv1.2","1466","Application Data, Ignored Unknown Record"
"900","0.337038","64.233.180.190","100.86.243.187","TLSv1.2","1466","[TCP Previous segment not captured] , Ignored Unknown Record"
"901","0.337039","64.233.180.190","100.86.243.187","TLSv1.2","1466","Ignored Unknown Record"
"902","0.337040","64.233.180.190","100.86.243.187","TLSv1.2","1466","Ignored Unknown Record"
"903","0.337083","100.86.243.187","64.233.180.190","TCP","78","[TCP Dup ACK 837#12] 53804  >  443 [ACK] Seq=8821 Ack=203127 Win=32804 Len=0 TSval=4060114604 TSecr=2767054147 SLE=204527 SRE=281527"
"904","0.337103","100.86.243.187","64.233.180.190","TCP","86","[TCP Dup ACK 837#13] 53804  >  443 [ACK] Seq=8821 Ack=203127 Win=32804 Len=0 TSval=4060114604 TSecr=2767054147 SLE=282927 SRE=287127 SLE=204527 SRE=281527"
"905","0.338487","64.233.180.190","100.86.243.187","TLSv1.2","1466","Ignored Unknown Record"
"906","0.338489","64.233.180.190","100.86.243.187","TLSv1.2","1466","Ignored Unknown Record"
"907","0.338490","64.233.180.190","100.86.243.187","TLSv1.2","1466","Ignored Unknown Record"
"908","0.338491","64.233.180.190","100.86.243.187","TLSv1.2","1466","Ignored Unknown Record"
"909","0.338492","64.233.180.190","100.86.243.187","TLSv1.2","1466","Ignored Unknown Record"
"910","0.338492","64.233.180.190","100.86.243.187","TLSv1.2","1466","Ignored Unknown Record"
"911","0.338493","64.233.180.190","100.86.243.187","TLSv1.2","1466","Ignored Unknown Record"
"912","0.338493","64.233.180.190","100.86.243.187","TLSv1.2","1466","Ignored Unknown Record"
"913","0.338494","64.233.180.190","100.86.243.187","TLSv1.2","1466","Ignored Unknown Record"
"914","0.338494","64.233.180.190","100.86.243.187","TLSv1.2","1466","Ignored Unknown Record"
