"No.","Time","Source","Destination","Protocol","Length","Info"
"267","0.979351","100.86.243.187","64.233.180.190","TCP","1466","53804  >  443 [ACK] Seq=1 Ack=1 Win=32804 Len=1400 TSval=4060631008 TSecr=2767569475 [TCP PDU reassembled in 269]"
"268","0.979354","100.86.243.187","64.233.180.190","TCP","1466","53804  >  443 [ACK] Seq=1401 Ack=1 Win=32804 Len=1400 TSval=4060631008 TSecr=2767569475 [TCP PDU reassembled in 269]"
"269","0.979382","100.86.243.187","64.233.180.190","TLSv1.2","653","Application Data"
"270","0.979430","100.86.243.187","64.233.180.190","TCP","1466","53804  >  443 [ACK] Seq=3388 Ack=1 Win=32804 Len=1400 TSval=4060631008 TSecr=2767569475 [TCP PDU reassembled in 272]"
"271","0.979431","100.86.243.187","64.233.180.190","TCP","1466","53804  >  443 [ACK] Seq=4788 Ack=1 Win=32804 Len=1400 TSval=4060631008 TSecr=2767569475 [TCP PDU reassembled in 272]"
"272","0.979440","100.86.243.187","64.233.180.190","TLSv1.2","1241","Application Data"
"275","0.991023","64.233.180.190","100.86.243.187","TCP","66","443  >  53804 [ACK] Seq=1 Ack=7363 Win=2017 Len=0 TSval=2767570588 TSecr=4060631008"
"409","1.643410","64.233.180.190","100.86.243.187","TLSv1.2","618","Application Data"
"410","1.643411","64.233.180.190","100.86.243.187","TLSv1.2","1466","Application Data"
"411","1.643412","64.233.180.190","100.86.243.187","TLSv1.2","1466","Application Data"
"412","1.643412","64.233.180.190","100.86.243.187","TLSv1.2","1466","Application Data"
"413","1.643413","64.233.180.190","100.86.243.187","TLSv1.2","1466","Application Data"
"414","1.643525","100.86.243.187","64.233.180.190","TCP","66","53804  >  443 [ACK] Seq=7363 Ack=6153 Win=32708 Len=0 TSval=4060631673 TSecr=2767571241"
"415","1.643939","100.86.243.187","64.233.180.190","TCP","66","[TCP Window Update] 53804  >  443 [ACK] Seq=7363 Ack=6153 Win=32804 Len=0 TSval=4060631673 TSecr=2767571241"
"416","1.645291","64.233.180.190","100.86.243.187","TLSv1.2","1466","Application Data"
"417","1.645292","64.233.180.190","100.86.243.187","TLSv1.2","1466","Application Data"
"418","1.645292","64.233.180.190","100.86.243.187","TLSv1.2","1466","Application Data"
"419","1.645293","64.233.180.190","100.86.243.187","TLSv1.2","1466","Application Data"
"420","1.645293","64.233.180.190","100.86.243.187","TLSv1.2","1466","Application Data"
"421","1.645294","64.233.180.190","100.86.243.187","TLSv1.2","1466","Application Data"
"422","1.645296","64.233.180.190","100.86.243.187","TLSv1.2","1466","Application Data"
"423","1.645299","64.233.180.190","100.86.243.187","TLSv1.2","112","Application Data"
"424","1.645299","64.233.180.190","100.86.243.187","TLSv1.2","1466","Application Data"
"425","1.645300","64.233.180.190","100.86.243.187","TLSv1.2","1466","Application Data"
"426","1.645300","64.233.180.190","100.86.243.187","TLSv1.2","1466","Application Data"
"427","1.645301","64.233.180.190","100.86.243.187","TLSv1.2","1466","Application Data"
"428","1.645302","64.233.180.190","100.86.243.187","TLSv1.2","124","Application Data, Application Data"
"429","1.645302","64.233.180.190","100.86.243.187","TLSv1.2","105","Application Data"
"430","1.645383","100.86.243.187","64.233.180.190","TCP","66","53804  >  443 [ACK] Seq=7363 Ack=21696 Win=32561 Len=0 TSval=4060631675 TSecr=2767571241"
"431","1.645708","100.86.243.187","64.233.180.190","TCP","66","[TCP Window Update] 53804  >  443 [ACK] Seq=7363 Ack=21696 Win=32804 Len=0 TSval=4060631675 TSecr=2767571241"
"432","1.645751","100.86.243.187","64.233.180.190","TLSv1.2","105","Application Data"
"435","1.656342","64.233.180.190","100.86.243.187","TCP","66","443  >  53804 [ACK] Seq=21696 Ack=7402 Win=2037 Len=0 TSval=2767571253 TSecr=4060631675"
"457","1.763776","100.86.243.187","64.233.180.190","TCP","1466","53804  >  443 [ACK] Seq=7402 Ack=21696 Win=32804 Len=1400 TSval=4060631793 TSecr=2767571253 [TCP PDU reassembled in 460]"
"458","1.763778","100.86.243.187","64.233.180.190","TCP","1466","53804  >  443 [ACK] Seq=8802 Ack=21696 Win=32804 Len=1400 TSval=4060631793 TSecr=2767571253 [TCP PDU reassembled in 460]"
"459","1.763780","100.86.243.187","64.233.180.190","TCP","1466","53804  >  443 [ACK] Seq=10202 Ack=21696 Win=32804 Len=1400 TSval=4060631793 TSecr=2767571253 [TCP PDU reassembled in 460]"
"460","1.763817","100.86.243.187","64.233.180.190","TLSv1.2","776","Application Data"
"461","1.763887","100.86.243.187","64.233.180.190","TCP","1466","53804  >  443 [ACK] Seq=12312 Ack=21696 Win=32804 Len=1400 TSval=4060631793 TSecr=2767571253 [TCP PDU reassembled in 464]"
"462","1.763888","100.86.243.187","64.233.180.190","TCP","1466","53804  >  443 [ACK] Seq=13712 Ack=21696 Win=32804 Len=1400 TSval=4060631793 TSecr=2767571253 [TCP PDU reassembled in 464]"
"463","1.763889","100.86.243.187","64.233.180.190","TCP","1466","53804  >  443 [ACK] Seq=15112 Ack=21696 Win=32804 Len=1400 TSval=4060631793 TSecr=2767571253 [TCP PDU reassembled in 464]"
"464","1.763899","100.86.243.187","64.233.180.190","TLSv1.2","689","Application Data"
"465","1.764622","100.86.243.187","64.233.180.190","TCP","1466","53804  >  443 [ACK] Seq=17135 Ack=21696 Win=32804 Len=1400 TSval=4060631793 TSecr=2767571253 [TCP PDU reassembled in 468]"
"466","1.764625","100.86.243.187","64.233.180.190","TCP","1466","53804  >  443 [ACK] Seq=18535 Ack=21696 Win=32804 Len=1400 TSval=4060631793 TSecr=2767571253 [TCP PDU reassembled in 468]"
"467","1.764627","100.86.243.187","64.233.180.190","TCP","1466","53804  >  443 [ACK] Seq=19935 Ack=21696 Win=32804 Len=1400 TSval=4060631793 TSecr=2767571253 [TCP PDU reassembled in 468]"
"468","1.764653","100.86.243.187","64.233.180.190","TLSv1.2","789","Application Data"
"469","1.764701","100.86.243.187","64.233.180.190","TCP","1466","53804  >  443 [ACK] Seq=22058 Ack=21696 Win=32804 Len=1400 TSval=4060631793 TSecr=2767571253 [TCP PDU reassembled in 471]"
"470","1.764702","100.86.243.187","64.233.180.190","TCP","1466","53804  >  443 [ACK] Seq=23458 Ack=21696 Win=32804 Len=1400 TSval=4060631793 TSecr=2767571253 [TCP PDU reassembled in 471]"
"471","1.764713","100.86.243.187","64.233.180.190","TLSv1.2","1404","Application Data"
"472","1.765301","100.86.243.187","64.233.180.190","TCP","1466","53804  >  443 [ACK] Seq=26196 Ack=21696 Win=32804 Len=1400 TSval=4060631794 TSecr=2767571253 [TCP PDU reassembled in 475]"
"473","1.765304","100.86.243.187","64.233.180.190","TCP","1466","53804  >  443 [ACK] Seq=27596 Ack=21696 Win=32804 Len=1400 TSval=4060631794 TSecr=2767571253 [TCP PDU reassembled in 475]"
"474","1.765305","100.86.243.187","64.233.180.190","TCP","1466","53804  >  443 [ACK] Seq=28996 Ack=21696 Win=32804 Len=1400 TSval=4060631794 TSecr=2767571253 [TCP PDU reassembled in 475]"
"475","1.765336","100.86.243.187","64.233.180.190","TLSv1.2","786","Application Data"
"476","1.765390","100.86.243.187","64.233.180.190","TCP","1466","53804  >  443 [ACK] Seq=31116 Ack=21696 Win=32804 Len=1400 TSval=4060631794 TSecr=2767571253 [TCP PDU reassembled in 479]"
"477","1.765391","100.86.243.187","64.233.180.190","TCP","1466","53804  >  443 [ACK] Seq=32516 Ack=21696 Win=32804 Len=1400 TSval=4060631794 TSecr=2767571253 [TCP PDU reassembled in 479]"
"478","1.765393","100.86.243.187","64.233.180.190","TCP","1466","53804  >  443 [ACK] Seq=33916 Ack=21696 Win=32804 Len=1400 TSval=4060631794 TSecr=2767571253 [TCP PDU reassembled in 479]"
"479","1.765402","100.86.243.187","64.233.180.190","TLSv1.2","81","Application Data"
"487","1.775209","64.233.180.190","100.86.243.187","TCP","66","443  >  53804 [ACK] Seq=21696 Ack=10202 Win=2033 Len=0 TSval=2767571372 TSecr=4060631793"
"488","1.775241","64.233.180.190","100.86.243.187","TCP","66","443  >  53804 [ACK] Seq=21696 Ack=17135 Win=2010 Len=0 TSval=2767571372 TSecr=4060631793"
"489","1.776007","64.233.180.190","100.86.243.187","TCP","66","443  >  53804 [ACK] Seq=21696 Ack=18535 Win=2037 Len=0 TSval=2767571373 TSecr=4060631793"
"490","1.776009","64.233.180.190","100.86.243.187","TCP","66","443  >  53804 [ACK] Seq=21696 Ack=26196 Win=2012 Len=0 TSval=2767571373 TSecr=4060631793"
"491","1.776009","64.233.180.190","100.86.243.187","TCP","66","443  >  53804 [ACK] Seq=21696 Ack=28996 Win=2033 Len=0 TSval=2767571374 TSecr=4060631794"
"492","1.777110","64.233.180.190","100.86.243.187","TCP","66","443  >  53804 [ACK] Seq=21696 Ack=35331 Win=2011 Len=0 TSval=2767571374 TSecr=4060631794"
"513","1.846558","64.233.180.190","100.86.243.187","TLSv1.2","594","Application Data"
"514","1.846590","64.233.180.190","100.86.243.187","TLSv1.2","1466","Application Data"
"515","1.846676","100.86.243.187","64.233.180.190","TCP","66","53804  >  443 [ACK] Seq=35331 Ack=22224 Win=32796 Len=0 TSval=4060631876 TSecr=2767571444"
"516","1.846733","100.86.243.187","64.233.180.190","TCP","66","53804  >  443 [ACK] Seq=35331 Ack=23624 Win=32774 Len=0 TSval=4060631876 TSecr=2767571444"
"517","1.847026","64.233.180.190","100.86.243.187","TLSv1.2","1466","Application Data"
"518","1.847028","64.233.180.190","100.86.243.187","TLSv1.2","1466","Application Data"
"519","1.847091","100.86.243.187","64.233.180.190","TCP","66","53804  >  443 [ACK] Seq=35331 Ack=26424 Win=32760 Len=0 TSval=4060631876 TSecr=2767571444"
"520","1.847186","100.86.243.187","64.233.180.190","TCP","66","[TCP Window Update] 53804  >  443 [ACK] Seq=35331 Ack=26424 Win=32804 Len=0 TSval=4060631876 TSecr=2767571444"
"521","1.847427","64.233.180.190","100.86.243.187","TLSv1.2","1466","Application Data"
"522","1.847429","64.233.180.190","100.86.243.187","TLSv1.2","1466","Application Data"
"523","1.847473","100.86.243.187","64.233.180.190","TCP","66","53804  >  443 [ACK] Seq=35331 Ack=29224 Win=32760 Len=0 TSval=4060631876 TSecr=2767571444"
"524","1.847562","100.86.243.187","64.233.180.190","TCP","66","[TCP Window Update] 53804  >  443 [ACK] Seq=35331 Ack=29224 Win=32804 Len=0 TSval=4060631876 TSecr=2767571444"
"525","1.848642","64.233.180.190","100.86.243.187","TLSv1.2","1466","Application Data"
"526","1.848642","64.233.180.190","100.86.243.187","TLSv1.2","1466","Application Data"
"527","1.848643","64.233.180.190","100.86.243.187","TLSv1.2","1466","Application Data"
"528","1.848644","64.233.180.190","100.86.243.187","TLSv1.2","1466","Application Data"
"529","1.848644","64.233.180.190","100.86.243.187","TLSv1.2","1466","Application Data"
"530","1.848672","64.233.180.190","100.86.243.187","TLSv1.2","486","Application Data"
"531","1.848750","100.86.243.187","64.233.180.190","TCP","66","53804  >  443 [ACK] Seq=35331 Ack=36644 Win=32688 Len=0 TSval=4060631878 TSecr=2767571444"
"532","1.848905","100.86.243.187","64.233.180.190","TCP","66","[TCP Window Update] 53804  >  443 [ACK] Seq=35331 Ack=36644 Win=32804 Len=0 TSval=4060631878 TSecr=2767571444"
"533","1.849316","64.233.180.190","100.86.243.187","TLSv1.2","97","Application Data"
"534","1.849317","64.233.180.190","100.86.243.187","TLSv1.2","105","Application Data"
"535","1.849379","100.86.243.187","64.233.180.190","TCP","66","53804  >  443 [ACK] Seq=35331 Ack=36714 Win=32803 Len=0 TSval=4060631878 TSecr=2767571445"
"536","1.849672","100.86.243.187","64.233.180.190","TLSv1.2","105","Application Data"
"537","1.860375","64.233.180.190","100.86.243.187","TCP","66","443  >  53804 [ACK] Seq=36714 Ack=35370 Win=2037 Len=0 TSval=2767571458 TSecr=4060631878"
"543","1.901529","64.233.180.190","100.86.243.187","TLSv1.2","593","Application Data"
"545","1.901632","100.86.243.187","64.233.180.190","TCP","66","53804  >  443 [ACK] Seq=35370 Ack=37241 Win=32796 Len=0 TSval=4060631931 TSecr=2767571499"
"546","1.902003","64.233.180.190","100.86.243.187","TLSv1.2","1466","Application Data"
"547","1.902004","64.233.180.190","100.86.243.187","TLSv1.2","1466","Application Data"
"548","1.902005","64.233.180.190","100.86.243.187","TLSv1.2","1466","Application Data"
"549","1.902005","64.233.180.190","100.86.243.187","TLSv1.2","1466","Application Data"
"550","1.902081","100.86.243.187","64.233.180.190","TCP","66","53804  >  443 [ACK] Seq=35370 Ack=42841 Win=32716 Len=0 TSval=4060631931 TSecr=2767571499"
"551","1.902272","64.233.180.190","100.86.243.187","TLSv1.2","1466","Application Data"
"552","1.902272","64.233.180.190","100.86.243.187","TLSv1.2","1466","Application Data"
"553","1.902288","100.86.243.187","64.233.180.190","TCP","66","[TCP Window Update] 53804  >  443 [ACK] Seq=35370 Ack=42841 Win=32804 Len=0 TSval=4060631931 TSecr=2767571499"
"554","1.902317","100.86.243.187","64.233.180.190","TCP","66","53804  >  443 [ACK] Seq=35370 Ack=45641 Win=32760 Len=0 TSval=4060631931 TSecr=2767571499"
"555","1.902394","100.86.243.187","64.233.180.190","TCP","66","[TCP Window Update] 53804  >  443 [ACK] Seq=35370 Ack=45641 Win=32804 Len=0 TSval=4060631931 TSecr=2767571499"
"556","1.902569","64.233.180.190","100.86.243.187","TLSv1.2","1466","Application Data"
"557","1.902569","64.233.180.190","100.86.243.187","TLSv1.2","1466","Application Data"
"558","1.902570","64.233.180.190","100.86.243.187","TLSv1.2","1466","Application Data"
"559","1.902571","64.233.180.190","100.86.243.187","TLSv1.2","1466","Application Data"
"560","1.902615","100.86.243.187","64.233.180.190","TCP","66","53804  >  443 [ACK] Seq=35370 Ack=51241 Win=32716 Len=0 TSval=4060631932 TSecr=2767571499"
"561","1.902719","100.86.243.187","64.233.180.190","TCP","66","[TCP Window Update] 53804  >  443 [ACK] Seq=35370 Ack=51241 Win=32804 Len=0 TSval=4060631932 TSecr=2767571499"
"562","1.903916","64.233.180.190","100.86.243.187","TLSv1.2","1241","Application Data"
"563","1.903917","64.233.180.190","100.86.243.187","TLSv1.2","1466","Application Data"
"564","1.903917","64.233.180.190","100.86.243.187","TLSv1.2","1466","Application Data"
"565","1.903919","64.233.180.190","100.86.243.187","TLSv1.2","1466","Application Data"
"566","1.903919","64.233.180.190","100.86.243.187","TLSv1.2","1466","Application Data"
"567","1.903920","64.233.180.190","100.86.243.187","TLSv1.2","245","Application Data, Application Data"
"568","1.904001","100.86.243.187","64.233.180.190","TCP","66","53804  >  443 [ACK] Seq=35370 Ack=58195 Win=32695 Len=0 TSval=4060631933 TSecr=2767571500"
"569","1.904088","64.233.180.190","100.86.243.187","TLSv1.2","105","Application Data"
"570","1.904121","100.86.243.187","64.233.180.190","TCP","66","53804  >  443 [ACK] Seq=35370 Ack=58234 Win=32713 Len=0 TSval=4060631933 TSecr=2767571500"
"571","1.904249","100.86.243.187","64.233.180.190","TCP","66","[TCP Window Update] 53804  >  443 [ACK] Seq=35370 Ack=58234 Win=32804 Len=0 TSval=4060631933 TSecr=2767571500"
"572","1.904286","100.86.243.187","64.233.180.190","TLSv1.2","105","Application Data"
"576","1.915447","64.233.180.190","100.86.243.187","TCP","66","443  >  53804 [ACK] Seq=58234 Ack=35409 Win=2037 Len=0 TSval=2767571512 TSecr=4060631933"
"584","1.939713","100.86.243.187","64.233.180.190","TCP","1466","53804  >  443 [ACK] Seq=35409 Ack=58234 Win=32804 Len=1400 TSval=4060631969 TSecr=2767571512 [TCP PDU reassembled in 587]"
"585","1.939715","100.86.243.187","64.233.180.190","TCP","1466","53804  >  443 [ACK] Seq=36809 Ack=58234 Win=32804 Len=1400 TSval=4060631969 TSecr=2767571512 [TCP PDU reassembled in 587]"
"586","1.939717","100.86.243.187","64.233.180.190","TCP","1466","53804  >  443 [ACK] Seq=38209 Ack=58234 Win=32804 Len=1400 TSval=4060631969 TSecr=2767571512 [TCP PDU reassembled in 587]"
"587","1.939753","100.86.243.187","64.233.180.190","TLSv1.2","643","Application Data"
"589","1.951461","64.233.180.190","100.86.243.187","TCP","66","443  >  53804 [ACK] Seq=58234 Ack=40186 Win=2026 Len=0 TSval=2767571549 TSecr=4060631969"
"605","2.014338","64.233.180.190","100.86.243.187","TLSv1.2","711","Application Data"
"606","2.014436","100.86.243.187","64.233.180.190","TCP","66","53804  >  443 [ACK] Seq=40186 Ack=58879 Win=32794 Len=0 TSval=4060632044 TSecr=2767571612"
"607","2.014863","64.233.180.190","100.86.243.187","TLSv1.2","1466","Application Data"
"608","2.014864","64.233.180.190","100.86.243.187","TLSv1.2","1466","Application Data"
"609","2.014917","100.86.243.187","64.233.180.190","TCP","66","53804  >  443 [ACK] Seq=40186 Ack=61679 Win=32760 Len=0 TSval=4060632044 TSecr=2767571612"
"610","2.015011","64.233.180.190","100.86.243.187","TLSv1.2","1466","Application Data"
"611","2.015011","64.233.180.190","100.86.243.187","TLSv1.2","1466","Application Data"
"612","2.015082","100.86.243.187","64.233.180.190","TCP","66","53804  >  443 [ACK] Seq=40186 Ack=64479 Win=32804 Len=0 TSval=4060632044 TSecr=2767571612"
"613","2.015258","64.233.180.190","100.86.243.187","TLSv1.2","1466","Application Data"
"614","2.015259","64.233.180.190","100.86.243.187","TLSv1.2","1466","Application Data"
"615","2.015365","64.233.180.190","100.86.243.187","TLSv1.2","761","Application Data"
"616","2.015366","64.233.180.190","100.86.243.187","TLSv1.2","1466","Application Data"
"617","2.015381","100.86.243.187","64.233.180.190","TCP","66","53804  >  443 [ACK] Seq=40186 Ack=67279 Win=32804 Len=0 TSval=4060632044 TSecr=2767571612"
"618","2.015493","100.86.243.187","64.233.180.190","TCP","66","53804  >  443 [ACK] Seq=40186 Ack=69374 Win=32804 Len=0 TSval=4060632045 TSecr=2767571613"
"619","2.015752","64.233.180.190","100.86.243.187","TLSv1.2","1466","Application Data"
"620","2.015753","64.233.180.190","100.86.243.187","TLSv1.2","1466","Application Data"
"621","2.015873","100.86.243.187","64.233.180.190","TCP","66","53804  >  443 [ACK] Seq=40186 Ack=72174 Win=32804 Len=0 TSval=4060632045 TSecr=2767571613"
"622","2.015936","64.233.180.190","100.86.243.187","TLSv1.2","1466","Application Data"
"623","2.015937","64.233.180.190","100.86.243.187","TLSv1.2","1466","Application Data"
"624","2.016052","100.86.243.187","64.233.180.190","TCP","66","53804  >  443 [ACK] Seq=40186 Ack=74974 Win=32804 Len=0 TSval=4060632045 TSecr=2767571613"
"625","2.016121","64.233.180.190","100.86.243.187","TLSv1.2","1466","Application Data"
"626","2.016122","64.233.180.190","100.86.243.187","TLSv1.2","157","Application Data"
"627","2.016232","100.86.243.187","64.233.180.190","TCP","66","53804  >  443 [ACK] Seq=40186 Ack=76465 Win=32804 Len=0 TSval=4060632045 TSecr=2767571613"
"660","2.041326","100.86.243.187","64.233.180.190","TCP","1466","53804  >  443 [ACK] Seq=40186 Ack=76465 Win=32804 Len=1400 TSval=4060632070 TSecr=2767571613 [TCP PDU reassembled in 663]"
"661","2.041327","100.86.243.187","64.233.180.190","TCP","1466","53804  >  443 [ACK] Seq=41586 Ack=76465 Win=32804 Len=1400 TSval=4060632070 TSecr=2767571613 [TCP PDU reassembled in 663]"
"662","2.041328","100.86.243.187","64.233.180.190","TCP","1466","53804  >  443 [ACK] Seq=42986 Ack=76465 Win=32804 Len=1400 TSval=4060632070 TSecr=2767571613 [TCP PDU reassembled in 663]"
"663","2.041330","100.86.243.187","64.233.180.190","TLSv1.2","730","Application Data"
"664","2.041380","100.86.243.187","64.233.180.190","TCP","1466","53804  >  443 [ACK] Seq=45050 Ack=76465 Win=32804 Len=1400 TSval=4060632070 TSecr=2767571613 [TCP PDU reassembled in 666]"
"665","2.041382","100.86.243.187","64.233.180.190","TCP","1466","53804  >  443 [ACK] Seq=46450 Ack=76465 Win=32804 Len=1400 TSval=4060632070 TSecr=2767571613 [TCP PDU reassembled in 666]"
"666","2.041391","100.86.243.187","64.233.180.190","TLSv1.2","1020","Application Data"
"676","2.052680","64.233.180.190","100.86.243.187","TCP","66","443  >  53804 [ACK] Seq=76465 Ack=42986 Win=2037 Len=0 TSval=2767571650 TSecr=4060632070"
"677","2.052681","64.233.180.190","100.86.243.187","TCP","66","443  >  53804 [ACK] Seq=76465 Ack=48804 Win=2029 Len=0 TSval=2767571650 TSecr=4060632070"
"698","2.095501","64.233.180.190","100.86.243.187","TLSv1.2","143","Application Data"
"699","2.095502","64.233.180.190","100.86.243.187","TLSv1.2","1283","Application Data"
"700","2.095507","64.233.180.190","100.86.243.187","TLSv1.2","97","Application Data"
"701","2.095507","64.233.180.190","100.86.243.187","TLSv1.2","105","Application Data"
"702","2.095667","100.86.243.187","64.233.180.190","TCP","66","53804  >  443 [ACK] Seq=48804 Ack=77829 Win=32782 Len=0 TSval=4060632125 TSecr=2767571689"
"703","2.095866","100.86.243.187","64.233.180.190","TLSv1.2","105","Application Data"
"708","2.103362","100.86.243.187","64.233.180.190","TCP","1466","53804  >  443 [ACK] Seq=48843 Ack=77829 Win=32804 Len=1400 TSval=4060632132 TSecr=2767571689 [TCP PDU reassembled in 711]"
"709","2.103365","100.86.243.187","64.233.180.190","TCP","1466","53804  >  443 [ACK] Seq=50243 Ack=77829 Win=32804 Len=1400 TSval=4060632132 TSecr=2767571689 [TCP PDU reassembled in 711]"
"710","2.103368","100.86.243.187","64.233.180.190","TCP","1466","53804  >  443 [ACK] Seq=51643 Ack=77829 Win=32804 Len=1400 TSval=4060632132 TSecr=2767571689 [TCP PDU reassembled in 711]"
"711","2.103401","100.86.243.187","64.233.180.190","TLSv1.2","1274","Application Data"
"720","2.113452","64.233.180.190","100.86.243.187","TCP","66","443  >  53804 [ACK] Seq=77829 Ack=48843 Win=2037 Len=0 TSval=2767571711 TSecr=4060632125"
"721","2.114869","64.233.180.190","100.86.243.187","TCP","66","443  >  53804 [ACK] Seq=77829 Ack=54251 Win=2037 Len=0 TSval=2767571712 TSecr=4060632132"
"726","2.145581","64.233.180.190","100.86.243.187","TLSv1.2","184","Application Data"
"727","2.145717","100.86.243.187","64.233.180.190","TCP","66","53804  >  443 [ACK] Seq=54251 Ack=77947 Win=32804 Len=0 TSval=4060632175 TSecr=2767571742"
"728","2.147702","64.233.180.190","100.86.243.187","TLSv1.2","1466","Application Data"
"729","2.147703","64.233.180.190","100.86.243.187","TLSv1.2","1103","Application Data"
"730","2.147704","64.233.180.190","100.86.243.187","TLSv1.2","97","Application Data"
"731","2.147704","64.233.180.190","100.86.243.187","TLSv1.2","105","Application Data"
"736","2.148136","100.86.243.187","64.233.180.190","TCP","66","53804  >  443 [ACK] Seq=54251 Ack=80454 Win=32804 Len=0 TSval=4060632177 TSecr=2767571743"
"737","2.148169","100.86.243.187","64.233.180.190","TLSv1.2","105","Application Data"
"741","2.163263","64.233.180.190","100.86.243.187","TCP","66","443  >  53804 [ACK] Seq=80454 Ack=54290 Win=2037 Len=0 TSval=2767571761 TSecr=4060632177"
"746","2.175800","64.233.180.190","100.86.243.187","TLSv1.2","1466","Application Data"
"747","2.175801","64.233.180.190","100.86.243.187","TLSv1.2","1466","Application Data"
"748","2.176097","100.86.243.187","64.233.180.190","TCP","66","53804  >  443 [ACK] Seq=54290 Ack=83254 Win=32804 Len=0 TSval=4060632205 TSecr=2767571773"
"749","2.176227","64.233.180.190","100.86.243.187","TLSv1.2","1466","Application Data"
"750","2.176228","64.233.180.190","100.86.243.187","TLSv1.2","1466","Application Data"
"751","2.176351","100.86.243.187","64.233.180.190","TCP","66","53804  >  443 [ACK] Seq=54290 Ack=86054 Win=32804 Len=0 TSval=4060632205 TSecr=2767571773"
"752","2.176363","64.233.180.190","100.86.243.187","TLSv1.2","1466","Application Data"
"753","2.176365","64.233.180.190","100.86.243.187","TLSv1.2","620","Application Data"
"754","2.176487","100.86.243.187","64.233.180.190","TCP","66","53804  >  443 [ACK] Seq=54290 Ack=88008 Win=32804 Len=0 TSval=4060632205 TSecr=2767571773"
"755","2.177878","64.233.180.190","100.86.243.187","TLSv1.2","1466","Application Data"
"756","2.177879","64.233.180.190","100.86.243.187","TLSv1.2","1466","Application Data"
"757","2.177880","64.233.180.190","100.86.243.187","TLSv1.2","1466","Application Data"
"758","2.177880","64.233.180.190","100.86.243.187","TLSv1.2","1466","Application Data"
"759","2.177881","64.233.180.190","100.86.243.187","TLSv1.2","1466","Application Data"
"760","2.177882","64.233.180.190","100.86.243.187","TLSv1.2","1466","Application Data"
"761","2.177882","64.233.180.190","100.86.243.187","TLSv1.2","235","Application Data"
"762","2.177883","64.233.180.190","100.86.243.187","TLSv1.2","1466","Application Data"
"763","2.178420","100.86.243.187","64.233.180.190","TCP","66","53804  >  443 [ACK] Seq=54290 Ack=97977 Win=32804 Len=0 TSval=4060632207 TSecr=2767571774"
"764","2.179153","64.233.180.190","100.86.243.187","TLSv1.2","1466","Application Data"
"765","2.179154","64.233.180.190","100.86.243.187","TLSv1.2","1466","Application Data"
"766","2.179154","64.233.180.190","100.86.243.187","TLSv1.2","1466","Application Data"
"767","2.179155","64.233.180.190","100.86.243.187","TLSv1.2","1466","Application Data"
"768","2.179156","64.233.180.190","100.86.243.187","TLSv1.2","1466","Application Data"
"769","2.179157","64.233.180.190","100.86.243.187","TLSv1.2","464","Application Data"
"770","2.179157","64.233.180.190","100.86.243.187","TLSv1.2","1466","Application Data"
"771","2.179158","64.233.180.190","100.86.243.187","TLSv1.2","1347","Application Data"
"772","2.179159","64.233.180.190","100.86.243.187","TLSv1.2","1466","Application Data"
"773","2.179159","64.233.180.190","100.86.243.187","TLSv1.2","1466","Application Data"
"774","2.179160","64.233.180.190","100.86.243.187","TLSv1.2","1466","Application Data"
"775","2.179161","64.233.180.190","100.86.243.187","TLSv1.2","1466","Application Data"
"776","2.179161","64.233.180.190","100.86.243.187","TLSv1.2","243","Application Data"
"777","2.179161","64.233.180.190","100.86.243.187","TLSv1.2","1466","Application Data"
"778","2.179162","64.233.180.190","100.86.243.187","TLSv1.2","1466","Application Data"
"779","2.179163","64.233.180.190","100.86.243.187","TLSv1.2","1466","Application Data"
"780","2.179713","100.86.243.187","64.233.180.190","TCP","66","53804  >  443 [ACK] Seq=54290 Ack=118033 Win=32804 Len=0 TSval=4060632208 TSecr=2767571775"
"781","2.180487","64.233.180.190","100.86.243.187","TLSv1.2","1466","Application Data"
"782","2.180489","64.233.180.190","100.86.243.187","TLSv1.2","1466","Application Data"
"783","2.180489","64.233.180.190","100.86.243.187","TLSv1.2","1466","Application Data"
"784","2.180490","64.233.180.190","100.86.243.187","TLSv1.2","561","Application Data"
"785","2.180490","64.233.180.190","100.86.243.187","TLSv1.2","97","Application Data"
"786","2.180491","64.233.180.190","100.86.243.187","TLSv1.2","105","Application Data"
"787","2.180759","100.86.243.187","64.233.180.190","TCP","66","53804  >  443 [ACK] Seq=54290 Ack=122798 Win=32804 Len=0 TSval=4060632210 TSecr=2767571775"
"788","2.180822","100.86.243.187","64.233.180.190","TLSv1.2","105","Application Data"
"792","2.196427","64.233.180.190","100.86.243.187","TCP","66","443  >  53804 [ACK] Seq=122798 Ack=54329 Win=2037 Len=0 TSval=2767571794 TSecr=4060632210"
"998","2.275293","100.86.243.187","64.233.180.190","TCP","1466","53804  >  443 [ACK] Seq=54329 Ack=122798 Win=32804 Len=1400 TSval=4060632304 TSecr=2767571794 [TCP PDU reassembled in 1001]"
"999","2.275295","100.86.243.187","64.233.180.190","TCP","1466","53804  >  443 [ACK] Seq=55729 Ack=122798 Win=32804 Len=1400 TSval=4060632304 TSecr=2767571794 [TCP PDU reassembled in 1001]"
"1000","2.275297","100.86.243.187","64.233.180.190","TCP","1466","53804  >  443 [ACK] Seq=57129 Ack=122798 Win=32804 Len=1400 TSval=4060632304 TSecr=2767571794 [TCP PDU reassembled in 1001]"
"1001","2.275298","100.86.243.187","64.233.180.190","TLSv1.2","1274","Application Data"
"1043","2.286429","64.233.180.190","100.86.243.187","TCP","66","443  >  53804 [ACK] Seq=122798 Ack=59737 Win=2025 Len=0 TSval=2767571884 TSecr=4060632304"
"1387","2.317999","64.233.180.190","100.86.243.187","TLSv1.2","142","Application Data"
"1388","2.317999","64.233.180.190","100.86.243.187","TLSv1.2","1466","Application Data"
"1389","2.317999","64.233.180.190","100.86.243.187","TLSv1.2","943","Application Data"
"1390","2.318000","64.233.180.190","100.86.243.187","TLSv1.2","97","Application Data"
"1391","2.318000","64.233.180.190","100.86.243.187","TLSv1.2","105","Application Data"
"1407","2.318130","100.86.243.187","64.233.180.190","TCP","66","53804  >  443 [ACK] Seq=59737 Ack=125221 Win=32766 Len=0 TSval=4060632347 TSecr=2767571911"
"1408","2.318513","100.86.243.187","64.233.180.190","TLSv1.2","105","Application Data"
"1908","2.350248","64.233.180.190","100.86.243.187","TCP","66","443  >  53804 [ACK] Seq=125221 Ack=59776 Win=2037 Len=0 TSval=2767571938 TSecr=4060632347"
"4275","2.501204","100.86.243.187","64.233.180.190","TCP","1466","53804  >  443 [ACK] Seq=59776 Ack=125221 Win=32804 Len=1400 TSval=4060632530 TSecr=2767571938 [TCP PDU reassembled in 4279]"
"4276","2.501206","100.86.243.187","64.233.180.190","TCP","1466","53804  >  443 [ACK] Seq=61176 Ack=125221 Win=32804 Len=1400 TSval=4060632530 TSecr=2767571938 [TCP PDU reassembled in 4279]"
"4277","2.501207","100.86.243.187","64.233.180.190","TCP","1466","53804  >  443 [ACK] Seq=62576 Ack=125221 Win=32804 Len=1400 TSval=4060632530 TSecr=2767571938 [TCP PDU reassembled in 4279]"
"4278","2.501208","100.86.243.187","64.233.180.190","TCP","1466","53804  >  443 [ACK] Seq=63976 Ack=125221 Win=32804 Len=1400 TSval=4060632530 TSecr=2767571938 [TCP PDU reassembled in 4279]"
"4279","2.501230","100.86.243.187","64.233.180.190","TLSv1.2","241","Application Data"
"4610","2.523573","64.233.180.190","100.86.243.187","TCP","66","443  >  53804 [ACK] Seq=125221 Ack=65551 Win=2037 Len=0 TSval=2767572117 TSecr=4060632530"
"5123","2.556441","64.233.180.190","100.86.243.187","TLSv1.2","142","Application Data"
"5135","2.556673","100.86.243.187","64.233.180.190","TCP","66","53804  >  443 [ACK] Seq=65551 Ack=125297 Win=32804 Len=0 TSval=4060632586 TSecr=2767572146"
"5141","2.557502","64.233.180.190","100.86.243.187","TLSv1.2","97","Application Data"
"5142","2.557503","64.233.180.190","100.86.243.187","TLSv1.2","105","Application Data"
"5151","2.557791","100.86.243.187","64.233.180.190","TCP","66","53804  >  443 [ACK] Seq=65551 Ack=125367 Win=32804 Len=0 TSval=4060632587 TSecr=2767572146"
"5152","2.557830","100.86.243.187","64.233.180.190","TLSv1.2","105","Application Data"
"5553","2.584055","64.233.180.190","100.86.243.187","TCP","66","443  >  53804 [ACK] Seq=125367 Ack=65590 Win=2037 Len=0 TSval=2767572173 TSecr=4060632587"
"7504","3.095026","64.233.180.190","100.86.243.187","TLSv1.2","613","Application Data"
"7505","3.095027","64.233.180.190","100.86.243.187","TLSv1.2","1466","Application Data"
"7506","3.095028","64.233.180.190","100.86.243.187","TLSv1.2","1466","Application Data"
"7507","3.095332","100.86.243.187","64.233.180.190","TCP","66","53804  >  443 [ACK] Seq=65590 Ack=128714 Win=32804 Len=0 TSval=4060633124 TSecr=2767572692"
"7508","3.095415","64.233.180.190","100.86.243.187","TLSv1.2","1466","Application Data"
"7509","3.095415","64.233.180.190","100.86.243.187","TLSv1.2","1466","Application Data"
"7510","3.095416","64.233.180.190","100.86.243.187","TLSv1.2","902","Application Data"
"7511","3.095417","64.233.180.190","100.86.243.187","TLSv1.2","97","Application Data"
"7512","3.095522","100.86.243.187","64.233.180.190","TCP","66","53804  >  443 [ACK] Seq=65590 Ack=132381 Win=32804 Len=0 TSval=4060633124 TSecr=2767572693"
"7513","3.095984","64.233.180.190","100.86.243.187","TLSv1.2","105","Application Data"
"7514","3.096091","100.86.243.187","64.233.180.190","TCP","66","53804  >  443 [ACK] Seq=65590 Ack=132420 Win=32804 Len=0 TSval=4060633124 TSecr=2767572693"
"7515","3.096141","100.86.243.187","64.233.180.190","TLSv1.2","105","Application Data"
"7521","3.106191","64.233.180.190","100.86.243.187","TCP","66","443  >  53804 [ACK] Seq=132420 Ack=65629 Win=2037 Len=0 TSval=2767572704 TSecr=4060633125"
"7527","3.122569","100.86.243.187","64.233.180.190","TCP","1466","53804  >  443 [ACK] Seq=65629 Ack=132420 Win=32804 Len=1400 TSval=4060633152 TSecr=2767572704 [TCP PDU reassembled in 7529]"
"7528","3.122570","100.86.243.187","64.233.180.190","TCP","1466","53804  >  443 [ACK] Seq=67029 Ack=132420 Win=32804 Len=1400 TSval=4060633152 TSecr=2767572704 [TCP PDU reassembled in 7529]"
"7529","3.122599","100.86.243.187","64.233.180.190","TLSv1.2","1384","Application Data"
"7530","3.123007","100.86.243.187","64.233.180.190","TCP","1466","53804  >  443 [ACK] Seq=69747 Ack=132420 Win=32804 Len=1400 TSval=4060633152 TSecr=2767572704 [TCP PDU reassembled in 7532]"
"7531","3.123009","100.86.243.187","64.233.180.190","TCP","1466","53804  >  443 [ACK] Seq=71147 Ack=132420 Win=32804 Len=1400 TSval=4060633152 TSecr=2767572704 [TCP PDU reassembled in 7532]"
"7532","3.123028","100.86.243.187","64.233.180.190","TLSv1.2","1429","Application Data"
"7533","3.123562","100.86.243.187","64.233.180.190","TCP","1466","53804  >  443 [ACK] Seq=73910 Ack=132420 Win=32804 Len=1400 TSval=4060633153 TSecr=2767572704 [TCP PDU reassembled in 7535]"
"7534","3.123563","100.86.243.187","64.233.180.190","TCP","1466","53804  >  443 [ACK] Seq=75310 Ack=132420 Win=32804 Len=1400 TSval=4060633153 TSecr=2767572704 [TCP PDU reassembled in 7535]"
"7535","3.123581","100.86.243.187","64.233.180.190","TLSv1.2","1430","Application Data"
"7536","3.123983","100.86.243.187","64.233.180.190","TCP","1466","53804  >  443 [ACK] Seq=78074 Ack=132420 Win=32804 Len=1400 TSval=4060633153 TSecr=2767572704 [TCP PDU reassembled in 7538]"
"7537","3.123984","100.86.243.187","64.233.180.190","TCP","1466","53804  >  443 [ACK] Seq=79474 Ack=132420 Win=32804 Len=1400 TSval=4060633153 TSecr=2767572704 [TCP PDU reassembled in 7538]"
"7538","3.123986","100.86.243.187","64.233.180.190","TLSv1.2","1429","Application Data"
"7539","3.124188","100.86.243.187","64.233.180.190","TCP","1466","53804  >  443 [ACK] Seq=82237 Ack=132420 Win=32804 Len=1400 TSval=4060633153 TSecr=2767572704 [TCP PDU reassembled in 7541]"
"7540","3.124190","100.86.243.187","64.233.180.190","TCP","1466","53804  >  443 [ACK] Seq=83637 Ack=132420 Win=32804 Len=1400 TSval=4060633153 TSecr=2767572704 [TCP PDU reassembled in 7541]"
"7541","3.124203","100.86.243.187","64.233.180.190","TLSv1.2","1430","Application Data"
"7542","3.124450","100.86.243.187","64.233.180.190","TCP","1466","53804  >  443 [ACK] Seq=86401 Ack=132420 Win=32804 Len=1400 TSval=4060633153 TSecr=2767572704 [TCP PDU reassembled in 7544]"
"7543","3.124451","100.86.243.187","64.233.180.190","TCP","1466","53804  >  443 [ACK] Seq=87801 Ack=132420 Win=32804 Len=1400 TSval=4060633153 TSecr=2767572704 [TCP PDU reassembled in 7544]"
"7544","3.124462","100.86.243.187","64.233.180.190","TLSv1.2","1430","Application Data"
"7545","3.124694","100.86.243.187","64.233.180.190","TCP","1466","53804  >  443 [ACK] Seq=90565 Ack=132420 Win=32804 Len=1400 TSval=4060633154 TSecr=2767572704 [TCP PDU reassembled in 7547]"
"7546","3.124696","100.86.243.187","64.233.180.190","TCP","1466","53804  >  443 [ACK] Seq=91965 Ack=132420 Win=32804 Len=1400 TSval=4060633154 TSecr=2767572704 [TCP PDU reassembled in 7547]"
"7547","3.124707","100.86.243.187","64.233.180.190","TLSv1.2","1430","Application Data"
"7548","3.124934","100.86.243.187","64.233.180.190","TCP","1466","53804  >  443 [ACK] Seq=94729 Ack=132420 Win=32804 Len=1400 TSval=4060633154 TSecr=2767572704 [TCP PDU reassembled in 7550]"
"7549","3.124936","100.86.243.187","64.233.180.190","TCP","1466","53804  >  443 [ACK] Seq=96129 Ack=132420 Win=32804 Len=1400 TSval=4060633154 TSecr=2767572704 [TCP PDU reassembled in 7550]"
"7550","3.124951","100.86.243.187","64.233.180.190","TLSv1.2","1430","Application Data"
"7551","3.125190","100.86.243.187","64.233.180.190","TCP","1466","53804  >  443 [ACK] Seq=98893 Ack=132420 Win=32804 Len=1400 TSval=4060633154 TSecr=2767572704 [TCP PDU reassembled in 7553]"
"7552","3.125191","100.86.243.187","64.233.180.190","TCP","1466","53804  >  443 [ACK] Seq=100293 Ack=132420 Win=32804 Len=1400 TSval=4060633154 TSecr=2767572704 [TCP PDU reassembled in 7553]"
"7553","3.125202","100.86.243.187","64.233.180.190","TLSv1.2","1430","Application Data"
"7554","3.125438","100.86.243.187","64.233.180.190","TCP","1466","53804  >  443 [ACK] Seq=103057 Ack=132420 Win=32804 Len=1400 TSval=4060633154 TSecr=2767572704 [TCP PDU reassembled in 7556]"
"7555","3.125439","100.86.243.187","64.233.180.190","TCP","1466","53804  >  443 [ACK] Seq=104457 Ack=132420 Win=32804 Len=1400 TSval=4060633154 TSecr=2767572704 [TCP PDU reassembled in 7556]"
"7556","3.125449","100.86.243.187","64.233.180.190","TLSv1.2","1430","Application Data"
"7558","3.125818","100.86.243.187","64.233.180.190","TCP","1466","53804  >  443 [ACK] Seq=107221 Ack=132420 Win=32804 Len=1400 TSval=4060633155 TSecr=2767572704 [TCP PDU reassembled in 7560]"
"7559","3.125820","100.86.243.187","64.233.180.190","TCP","1466","53804  >  443 [ACK] Seq=108621 Ack=132420 Win=32804 Len=1400 TSval=4060633155 TSecr=2767572704 [TCP PDU reassembled in 7560]"
"7560","3.125834","100.86.243.187","64.233.180.190","TLSv1.2","1430","Application Data"
"7561","3.126118","100.86.243.187","64.233.180.190","TCP","1466","53804  >  443 [ACK] Seq=111385 Ack=132420 Win=32804 Len=1400 TSval=4060633155 TSecr=2767572704 [TCP PDU reassembled in 7563]"
"7562","3.126119","100.86.243.187","64.233.180.190","TCP","1466","53804  >  443 [ACK] Seq=112785 Ack=132420 Win=32804 Len=1400 TSval=4060633155 TSecr=2767572704 [TCP PDU reassembled in 7563]"
"7563","3.126135","100.86.243.187","64.233.180.190","TLSv1.2","1430","Application Data"
"7564","3.126362","100.86.243.187","64.233.180.190","TCP","1466","53804  >  443 [ACK] Seq=115549 Ack=132420 Win=32804 Len=1400 TSval=4060633155 TSecr=2767572704 [TCP PDU reassembled in 7566]"
"7565","3.126364","100.86.243.187","64.233.180.190","TCP","1466","53804  >  443 [ACK] Seq=116949 Ack=132420 Win=32804 Len=1400 TSval=4060633155 TSecr=2767572704 [TCP PDU reassembled in 7566]"
"7566","3.126376","100.86.243.187","64.233.180.190","TLSv1.2","1430","Application Data"
"7568","3.126844","100.86.243.187","64.233.180.190","TCP","1466","53804  >  443 [ACK] Seq=119713 Ack=132420 Win=32804 Len=1400 TSval=4060633156 TSecr=2767572704 [TCP PDU reassembled in 7570]"
"7569","3.126845","100.86.243.187","64.233.180.190","TCP","1466","53804  >  443 [ACK] Seq=121113 Ack=132420 Win=32804 Len=1400 TSval=4060633156 TSecr=2767572704 [TCP PDU reassembled in 7570]"
"7570","3.126861","100.86.243.187","64.233.180.190","TLSv1.2","1430","Application Data"
"7571","3.127100","100.86.243.187","64.233.180.190","TCP","1466","53804  >  443 [ACK] Seq=123877 Ack=132420 Win=32804 Len=1400 TSval=4060633156 TSecr=2767572704 [TCP PDU reassembled in 7573]"
"7572","3.127102","100.86.243.187","64.233.180.190","TCP","1466","53804  >  443 [ACK] Seq=125277 Ack=132420 Win=32804 Len=1400 TSval=4060633156 TSecr=2767572704 [TCP PDU reassembled in 7573]"
"7573","3.127114","100.86.243.187","64.233.180.190","TLSv1.2","1430","Application Data"
"7574","3.127329","100.86.243.187","64.233.180.190","TCP","1466","53804  >  443 [ACK] Seq=128041 Ack=132420 Win=32804 Len=1400 TSval=4060633156 TSecr=2767572704 [TCP PDU reassembled in 7576]"
"7575","3.127330","100.86.243.187","64.233.180.190","TCP","1466","53804  >  443 [ACK] Seq=129441 Ack=132420 Win=32804 Len=1400 TSval=4060633156 TSecr=2767572704 [TCP PDU reassembled in 7576]"
"7576","3.127341","100.86.243.187","64.233.180.190","TLSv1.2","1430","Application Data"
"7577","3.127577","100.86.243.187","64.233.180.190","TCP","1466","53804  >  443 [ACK] Seq=132205 Ack=132420 Win=32804 Len=1400 TSval=4060633156 TSecr=2767572704 [TCP PDU reassembled in 7579]"
"7578","3.127578","100.86.243.187","64.233.180.190","TCP","1466","53804  >  443 [ACK] Seq=133605 Ack=132420 Win=32804 Len=1400 TSval=4060633156 TSecr=2767572704 [TCP PDU reassembled in 7579]"
"7579","3.127589","100.86.243.187","64.233.180.190","TLSv1.2","1430","Application Data"
"7580","3.127811","100.86.243.187","64.233.180.190","TCP","1466","53804  >  443 [ACK] Seq=136369 Ack=132420 Win=32804 Len=1400 TSval=4060633156 TSecr=2767572704 [TCP PDU reassembled in 7582]"
"7581","3.127813","100.86.243.187","64.233.180.190","TCP","1466","53804  >  443 [ACK] Seq=137769 Ack=132420 Win=32804 Len=1400 TSval=4060633156 TSecr=2767572704 [TCP PDU reassembled in 7582]"
"7582","3.127824","100.86.243.187","64.233.180.190","TLSv1.2","1430","Application Data"
"7583","3.128040","100.86.243.187","64.233.180.190","TCP","1466","53804  >  443 [ACK] Seq=140533 Ack=132420 Win=32804 Len=1400 TSval=4060633157 TSecr=2767572704 [TCP PDU reassembled in 7585]"
"7584","3.128042","100.86.243.187","64.233.180.190","TCP","1466","53804  >  443 [ACK] Seq=141933 Ack=132420 Win=32804 Len=1400 TSval=4060633157 TSecr=2767572704 [TCP PDU reassembled in 7585]"
