"No.","Time","Source","Destination","Protocol","Length","Info"
"3","0.193101","151.101.1.140","100.86.243.187","TLSv1.2","111","Application Data"
"4","0.193188","100.86.243.187","151.101.1.140","TCP","78","56485  >  443 [ACK] Seq=1 Ack=4294966029 Win=3925 Len=0 TSval=2851220481 TSecr=1266165143 SLE=1 SRE=46"
"5","0.193670","151.101.1.140","100.86.243.187","TLSv1.2","124","Application Data"
"6","0.193731","100.86.243.187","151.101.1.140","TCP","78","[TCP Dup ACK 4#1] 56485  >  443 [ACK] Seq=1 Ack=4294966029 Win=3925 Len=0 TSval=2851220481 TSecr=1266165143 SLE=1 SRE=104"
"7","0.194127","151.101.1.140","100.86.243.187","TLSv1.2","305","Application Data"
"8","0.194178","100.86.243.187","151.101.1.140","TCP","78","[TCP Dup ACK 4#2] 56485  >  443 [ACK] Seq=1 Ack=4294966029 Win=3925 Len=0 TSval=2851220482 TSecr=1266165143 SLE=1 SRE=343"
"9","0.195991","151.101.1.140","100.86.243.187","TLSv1.2","880","Application Data"
"10","0.195992","151.101.1.140","100.86.243.187","TLSv1.2","283","Application Data"
"11","0.195992","151.101.1.140","100.86.243.187","TLSv1.2","448","Application Data"
"12","0.196047","100.86.243.187","151.101.1.140","TCP","78","[TCP Dup ACK 4#3] 56485  >  443 [ACK] Seq=1 Ack=4294966029 Win=3925 Len=0 TSval=2851220484 TSecr=1266165143 SLE=1 SRE=1756"
"13","0.196320","151.101.1.140","100.86.243.187","TLSv1.2","953","Application Data"
"14","0.196321","151.101.1.140","100.86.243.187","TLSv1.2","475","Application Data"
"15","0.196322","151.101.1.140","100.86.243.187","TLSv1.2","585","Application Data"
"16","0.196323","151.101.1.140","100.86.243.187","TLSv1.2","263","Application Data"
"17","0.196376","100.86.243.187","151.101.1.140","TCP","78","[TCP Dup ACK 4#4] 56485  >  443 [ACK] Seq=1 Ack=4294966029 Win=3925 Len=0 TSval=2851220484 TSecr=1266165143 SLE=1 SRE=3768"
"18","0.196602","151.101.1.140","100.86.243.187","TLSv1.2","594","Application Data"
"19","0.196603","151.101.1.140","100.86.243.187","TLSv1.2","519","Application Data"
"20","0.196653","100.86.243.187","151.101.1.140","TCP","78","[TCP Dup ACK 4#5] 56485  >  443 [ACK] Seq=1 Ack=4294966029 Win=3925 Len=0 TSval=2851220484 TSecr=1266165143 SLE=1 SRE=4749"
"21","0.197212","151.101.1.140","100.86.243.187","TLSv1.2","484","Application Data"
"22","0.197213","151.101.1.140","100.86.243.187","TLSv1.2","767","Application Data"
"23","0.197259","100.86.243.187","151.101.1.140","TCP","78","[TCP Dup ACK 4#6] 56485  >  443 [ACK] Seq=1 Ack=4294966029 Win=3925 Len=0 TSval=2851220485 TSecr=1266165143 SLE=1 SRE=5868"
"24","0.204480","151.101.1.140","100.86.243.187","TLSv1.2","1334","[TCP Fast Retransmission] , Application Data"
"25","0.204552","100.86.243.187","151.101.1.140","TCP","66","56485  >  443 [ACK] Seq=1 Ack=5868 Win=3814 Len=0 TSval=2851220492 TSecr=1266165974"
"26","0.204851","100.86.243.187","151.101.1.140","TCP","66","[TCP Window Update] 56485  >  443 [ACK] Seq=1 Ack=5868 Win=3925 Len=0 TSval=2851220492 TSecr=1266165974"
"27","0.205279","151.101.1.140","100.86.243.187","TCP","1510","443  >  56485 [ACK] Seq=5868 Ack=1 Win=639 Len=1444 TSval=1266165974 TSecr=2851220481 [TCP PDU reassembled in 29]"
"28","0.205334","100.86.243.187","151.101.1.140","TCP","66","56485  >  443 [ACK] Seq=1 Ack=7312 Win=3903 Len=0 TSval=2851220492 TSecr=1266165974"
"29","0.206695","151.101.1.140","100.86.243.187","TLSv1.2","1510","Application Data, Application Data"
"30","0.206764","100.86.243.187","151.101.1.140","TCP","66","56485  >  443 [ACK] Seq=1 Ack=8756 Win=3903 Len=0 TSval=2851220495 TSecr=1266165977"
"31","0.207784","151.101.1.140","100.86.243.187","TLSv1.2","1510","Application Data, Application Data"
"32","0.207851","100.86.243.187","151.101.1.140","TCP","66","56485  >  443 [ACK] Seq=1 Ack=10200 Win=3903 Len=0 TSval=2851220496 TSecr=1266165977"
"33","0.208137","151.101.1.140","100.86.243.187","TLSv1.2","1510","Application Data, Application Data, Application Data, Application Data"
"34","0.208138","151.101.1.140","100.86.243.187","TLSv1.2","394","Application Data, Application Data, Application Data"
"35","0.208186","100.86.243.187","151.101.1.140","TCP","66","56485  >  443 [ACK] Seq=1 Ack=11972 Win=3898 Len=0 TSval=2851220496 TSecr=1266165977"
"36","0.248500","151.101.1.140","100.86.243.187","TLSv1.2","626","Application Data"
"37","0.248586","100.86.243.187","151.101.1.140","TCP","66","56485  >  443 [ACK] Seq=1 Ack=12532 Win=3917 Len=0 TSval=2851220537 TSecr=1266166018"
"38","0.254728","151.101.1.140","100.86.243.187","TLSv1.2","564","Application Data"
"39","0.254804","100.86.243.187","151.101.1.140","TCP","66","56485  >  443 [ACK] Seq=1 Ack=13030 Win=3918 Len=0 TSval=2851220543 TSecr=1266166024"
"40","0.259569","151.101.1.140","100.86.243.187","TLSv1.2","297","Application Data"
"41","0.259638","100.86.243.187","151.101.1.140","TCP","66","56485  >  443 [ACK] Seq=1 Ack=13261 Win=3922 Len=0 TSval=2851220548 TSecr=1266166029"
"42","0.266103","151.101.1.140","100.86.243.187","TLSv1.2","182","Application Data"
"43","0.266184","100.86.243.187","151.101.1.140","TCP","66","56485  >  443 [ACK] Seq=1 Ack=13377 Win=3924 Len=0 TSval=2851220554 TSecr=1266166036"
"44","0.276002","151.101.1.140","100.86.243.187","TLSv1.2","300","Application Data"
"45","0.276075","100.86.243.187","151.101.1.140","TCP","66","56485  >  443 [ACK] Seq=1 Ack=13611 Win=3922 Len=0 TSval=2851220564 TSecr=1266166046"
"46","0.279038","151.101.1.140","100.86.243.187","TLSv1.2","157","Application Data"
"47","0.279133","100.86.243.187","151.101.1.140","TCP","66","56485  >  443 [ACK] Seq=1 Ack=13702 Win=3924 Len=0 TSval=2851220567 TSecr=1266166049"
"48","0.282423","151.101.1.140","100.86.243.187","TLSv1.2","270","Application Data"
"49","0.282493","100.86.243.187","151.101.1.140","TCP","66","56485  >  443 [ACK] Seq=1 Ack=13906 Win=3922 Len=0 TSval=2851220570 TSecr=1266166053"
"50","0.286357","151.101.1.140","100.86.243.187","TLSv1.2","377","Application Data"
"51","0.286423","100.86.243.187","151.101.1.140","TCP","66","56485  >  443 [ACK] Seq=1 Ack=14217 Win=3921 Len=0 TSval=2851220574 TSecr=1266166057"
"52","0.286943","151.101.1.140","100.86.243.187","TLSv1.2","395","Application Data"
"53","0.287001","100.86.243.187","151.101.1.140","TCP","66","56485  >  443 [ACK] Seq=1 Ack=14546 Win=3920 Len=0 TSval=2851220574 TSecr=1266166057"
"54","0.287306","151.101.1.140","100.86.243.187","TCP","1510","443  >  56485 [ACK] Seq=14546 Ack=1 Win=639 Len=1444 TSval=1266166057 TSecr=2851220564 [TCP PDU reassembled in 56]"
"55","0.287367","100.86.243.187","151.101.1.140","TCP","66","56485  >  443 [ACK] Seq=1 Ack=15990 Win=3903 Len=0 TSval=2851220574 TSecr=1266166057"
"56","0.289634","151.101.1.140","100.86.243.187","TLSv1.2","209","Application Data"
"57","0.289700","100.86.243.187","151.101.1.140","TCP","66","56485  >  443 [ACK] Seq=1 Ack=16133 Win=3923 Len=0 TSval=2851220578 TSecr=1266166057"
"58","0.291053","151.101.1.140","100.86.243.187","TCP","1510","443  >  56485 [ACK] Seq=16133 Ack=1 Win=639 Len=1444 TSval=1266166061 TSecr=2851220564 [TCP PDU reassembled in 73]"
"59","0.291539","151.101.1.140","100.86.243.187","TCP","1510","443  >  56485 [PSH, ACK] Seq=17577 Ack=1 Win=639 Len=1444 TSval=1266166061 TSecr=2851220564 [TCP PDU reassembled in 73]"
"60","0.291623","100.86.243.187","151.101.1.140","TCP","66","56485  >  443 [ACK] Seq=1 Ack=19021 Win=3925 Len=0 TSval=2851220579 TSecr=1266166061"
"61","0.292013","151.101.1.140","100.86.243.187","TCP","1510","443  >  56485 [ACK] Seq=19021 Ack=1 Win=639 Len=1444 TSval=1266166062 TSecr=2851220564 [TCP PDU reassembled in 73]"
"62","0.292014","151.101.1.140","100.86.243.187","TCP","1510","443  >  56485 [PSH, ACK] Seq=20465 Ack=1 Win=639 Len=1444 TSval=1266166062 TSecr=2851220564 [TCP PDU reassembled in 73]"
"63","0.292115","100.86.243.187","151.101.1.140","TCP","66","56485  >  443 [ACK] Seq=1 Ack=21909 Win=3925 Len=0 TSval=2851220579 TSecr=1266166062"
"64","0.294668","151.101.1.140","100.86.243.187","TCP","1510","443  >  56485 [ACK] Seq=21909 Ack=1 Win=639 Len=1444 TSval=1266166064 TSecr=2851220570 [TCP PDU reassembled in 73]"
"65","0.295156","151.101.1.140","100.86.243.187","TCP","1510","443  >  56485 [PSH, ACK] Seq=23353 Ack=1 Win=639 Len=1444 TSval=1266166064 TSecr=2851220570 [TCP PDU reassembled in 73]"
"66","0.295255","100.86.243.187","151.101.1.140","TCP","66","56485  >  443 [ACK] Seq=1 Ack=24797 Win=3925 Len=0 TSval=2851220583 TSecr=1266166064"
"67","0.296151","151.101.1.140","100.86.243.187","TCP","1510","443  >  56485 [ACK] Seq=24797 Ack=1 Win=639 Len=1444 TSval=1266166067 TSecr=2851220574 [TCP PDU reassembled in 73]"
"68","0.296436","151.101.1.140","100.86.243.187","TCP","1510","443  >  56485 [PSH, ACK] Seq=26241 Ack=1 Win=639 Len=1444 TSval=1266166067 TSecr=2851220574 [TCP PDU reassembled in 73]"
"69","0.296525","100.86.243.187","151.101.1.140","TCP","66","56485  >  443 [ACK] Seq=1 Ack=27685 Win=3925 Len=0 TSval=2851220584 TSecr=1266166067"
"70","0.298737","151.101.1.140","100.86.243.187","TCP","1510","443  >  56485 [ACK] Seq=27685 Ack=1 Win=639 Len=1444 TSval=1266166069 TSecr=2851220574 [TCP PDU reassembled in 73]"
"71","0.302032","151.101.1.140","100.86.243.187","TCP","1510","443  >  56485 [ACK] Seq=29129 Ack=1 Win=639 Len=1444 TSval=1266166072 TSecr=2851220574 [TCP PDU reassembled in 73]"
"72","0.302661","151.101.1.140","100.86.243.187","TCP","1510","443  >  56485 [ACK] Seq=30573 Ack=1 Win=639 Len=1444 TSval=1266166072 TSecr=2851220579 [TCP PDU reassembled in 73]"
"73","0.302662","151.101.1.140","100.86.243.187","TLSv1.2","1510","Application Data, Application Data"
"74","0.302879","100.86.243.187","151.101.1.140","TCP","66","56485  >  443 [ACK] Seq=1 Ack=33461 Win=3925 Len=0 TSval=2851220590 TSecr=1266166069"
"75","0.303736","151.101.1.140","100.86.243.187","TCP","1510","443  >  56485 [ACK] Seq=33461 Ack=1 Win=639 Len=1444 TSval=1266166074 TSecr=2851220579 [TCP PDU reassembled in 81]"
"76","0.304570","151.101.1.140","100.86.243.187","TCP","1510","443  >  56485 [PSH, ACK] Seq=34905 Ack=1 Win=639 Len=1444 TSval=1266166074 TSecr=2851220579 [TCP PDU reassembled in 81]"
"77","0.304675","100.86.243.187","151.101.1.140","TCP","66","56485  >  443 [ACK] Seq=1 Ack=36349 Win=3925 Len=0 TSval=2851220592 TSecr=1266166074"
"78","0.306322","151.101.1.140","100.86.243.187","TCP","1510","443  >  56485 [ACK] Seq=36349 Ack=1 Win=639 Len=1444 TSval=1266166076 TSecr=2851220584 [TCP PDU reassembled in 81]"
"79","0.307452","151.101.1.140","100.86.243.187","TCP","1510","443  >  56485 [PSH, ACK] Seq=37793 Ack=1 Win=639 Len=1444 TSval=1266166076 TSecr=2851220584 [TCP PDU reassembled in 81]"
"80","0.307560","100.86.243.187","151.101.1.140","TCP","66","56485  >  443 [ACK] Seq=1 Ack=39237 Win=3925 Len=0 TSval=2851220595 TSecr=1266166076"
"81","0.308541","151.101.1.140","100.86.243.187","TLSv1.2","1510","Application Data"
"82","0.308542","151.101.1.140","100.86.243.187","TLSv1.2","1510","Application Data, Application Data"
"83","0.308754","100.86.243.187","151.101.1.140","TCP","66","56485  >  443 [ACK] Seq=1 Ack=42125 Win=3925 Len=0 TSval=2851220597 TSecr=1266166078"
"84","0.311659","151.101.1.140","100.86.243.187","TLSv1.2","1510","Application Data, Application Data"
"85","0.319392","151.101.1.140","100.86.243.187","TLSv1.2","1510","Application Data, Application Data"
"86","0.320260","151.101.1.140","100.86.243.187","TLSv1.2","1510","Application Data, Application Data, Application Data"
"87","0.320290","151.101.1.140","100.86.243.187","TLSv1.2","1510","Application Data, Application Data, Application Data"
"88","0.320291","151.101.1.140","100.86.243.187","TLSv1.2","1510","Application Data, Application Data"
"89","0.320504","100.86.243.187","151.101.1.140","TCP","66","56485  >  443 [ACK] Seq=1 Ack=49345 Win=3925 Len=0 TSval=2851220608 TSecr=1266166081"
"90","0.323699","151.101.1.140","100.86.243.187","TLSv1.2","1510","Application Data, Application Data, Application Data"
"91","0.326274","151.101.1.140","100.86.243.187","TLSv1.2","1510","Application Data, Application Data, Application Data, Application Data"
"92","0.326275","151.101.1.140","100.86.243.187","TLSv1.2","1510","Application Data, Application Data, Application Data, Application Data, Application Data, Application Data"
"93","0.326517","100.86.243.187","151.101.1.140","TCP","66","56485  >  443 [ACK] Seq=1 Ack=53677 Win=3925 Len=0 TSval=2851220614 TSecr=1266166092"
"94","0.326552","151.101.1.140","100.86.243.187","TLSv1.2","1510","Application Data, Application Data"
"95","0.326553","151.101.1.140","100.86.243.187","TLSv1.2","1510","Application Data"
"96","0.326653","100.86.243.187","151.101.1.140","TCP","66","56485  >  443 [ACK] Seq=1 Ack=56565 Win=3925 Len=0 TSval=2851220614 TSecr=1266166096"
"97","0.328860","151.101.1.140","100.86.243.187","TLSv1.2","1510","Application Data, Application Data"
"98","0.329030","100.86.243.187","151.101.1.140","TCP","66","56485  >  443 [ACK] Seq=1 Ack=58009 Win=3925 Len=0 TSval=2851220617 TSecr=1266166096"
"99","0.331750","151.101.1.140","100.86.243.187","TLSv1.2","763","Application Data"
"100","0.331863","100.86.243.187","151.101.1.140","TCP","66","56485  >  443 [ACK] Seq=1 Ack=58706 Win=3925 Len=0 TSval=2851220620 TSecr=1266166101"
"115","1.155133","100.86.243.187","151.101.1.140","TCP","1514","56485  >  443 [ACK] Seq=1 Ack=58706 Win=3925 Len=1448 TSval=2851221443 TSecr=1266166101 [TCP PDU reassembled in 116]"
"116","1.155271","100.86.243.187","151.101.1.140","TLSv1.2","1412","Application Data"
"117","1.155319","100.86.243.187","151.101.1.140","TLSv1.2","813","Application Data"
"120","1.165765","151.101.1.140","100.86.243.187","TCP","66","443  >  56485 [ACK] Seq=58706 Ack=2795 Win=634 Len=0 TSval=1266166935 TSecr=2851221443"
"121","1.165767","151.101.1.140","100.86.243.187","TCP","66","443  >  56485 [ACK] Seq=58706 Ack=3542 Win=633 Len=0 TSval=1266166935 TSecr=2851221443"
"127","1.200514","151.101.1.140","100.86.243.187","TCP","1510","443  >  56485 [ACK] Seq=58706 Ack=3542 Win=639 Len=1444 TSval=1266166970 TSecr=2851221443 [TCP PDU reassembled in 128]"
"128","1.200548","151.101.1.140","100.86.243.187","TLSv1.2","923","Application Data"
"129","1.200625","100.86.243.187","151.101.1.140","TCP","66","56485  >  443 [ACK] Seq=3542 Ack=60150 Win=3903 Len=0 TSval=2851221489 TSecr=1266166970"
"130","1.200685","100.86.243.187","151.101.1.140","TCP","66","56485  >  443 [ACK] Seq=3542 Ack=61007 Win=3889 Len=0 TSval=2851221489 TSecr=1266166970"
"139","1.317378","100.86.243.187","151.101.1.140","TLSv1.2","170","Application Data"
"144","1.319768","100.86.243.187","151.101.1.140","TLSv1.2","101","Application Data"
"146","1.320246","100.86.243.187","151.101.1.140","TLSv1.2","170","Application Data"
"157","1.325421","100.86.243.187","151.101.1.140","TLSv1.2","101","Application Data"
"163","1.330950","151.101.1.140","100.86.243.187","TLSv1.2","226","Application Data"
"165","1.330951","151.101.1.140","100.86.243.187","TCP","1510","443  >  56520 [ACK] Seq=161 Ack=105 Win=296 Len=1444 TSval=2144782396 TSecr=2085254312 [TCP PDU reassembled in 167]"
"166","1.330952","151.101.1.140","100.86.243.187","TCP","1510","443  >  56520 [ACK] Seq=1605 Ack=105 Win=296 Len=1444 TSval=2144782396 TSecr=2085254312 [TCP PDU reassembled in 167]"
"167","1.330954","151.101.1.140","100.86.243.187","TLSv1.2","781","Application Data"
"174","1.331128","100.86.243.187","151.101.1.140","TCP","66","56520  >  443 [ACK] Seq=279 Ack=3764 Win=2826 Len=0 TSval=2085254326 TSecr=2144782396"
"177","1.331423","100.86.243.187","151.101.1.140","TCP","66","[TCP Window Update] 56520  >  443 [ACK] Seq=279 Ack=3764 Win=2885 Len=0 TSval=2085254326 TSecr=2144782396"
"178","1.332047","151.101.1.140","100.86.243.187","TCP","66","443  >  56520 [ACK] Seq=3764 Ack=140 Win=296 Len=0 TSval=2144782399 TSecr=2085254315"
"182","1.332050","151.101.1.140","100.86.243.187","TCP","66","443  >  56520 [ACK] Seq=3764 Ack=244 Win=296 Len=0 TSval=2144782399 TSecr=2085254315"
"186","1.332053","151.101.1.140","100.86.243.187","TCP","1510","443  >  56520 [ACK] Seq=3764 Ack=244 Win=296 Len=1444 TSval=2144782399 TSecr=2085254315 [TCP PDU reassembled in 187]"
"187","1.332054","151.101.1.140","100.86.243.187","TLSv1.2","508","Application Data"
"189","1.332165","100.86.243.187","151.101.1.140","TCP","66","56520  >  443 [ACK] Seq=279 Ack=5650 Win=2855 Len=0 TSval=2085254327 TSecr=2144782399"
"194","1.335624","151.101.1.140","100.86.243.187","TCP","66","443  >  56520 [ACK] Seq=5650 Ack=279 Win=296 Len=0 TSval=2144782403 TSecr=2085254320"
"195","1.346990","100.86.243.187","151.101.1.140","TCP","1514","56485  >  443 [ACK] Seq=3542 Ack=61007 Win=3925 Len=1448 TSval=2851221635 TSecr=1266166970 [TCP PDU reassembled in 196]"
"196","1.347035","100.86.243.187","151.101.1.140","TLSv1.2","1358","Application Data"
"197","1.356720","151.101.1.140","100.86.243.187","TCP","66","443  >  56485 [ACK] Seq=61007 Ack=4990 Win=637 Len=0 TSval=1266167127 TSecr=2851221635"
"198","1.357574","151.101.1.140","100.86.243.187","TCP","66","443  >  56485 [ACK] Seq=61007 Ack=6282 Win=635 Len=0 TSval=1266167127 TSecr=2851221635"
"205","1.381379","151.101.1.140","100.86.243.187","TCP","1510","443  >  56485 [ACK] Seq=61007 Ack=6282 Win=639 Len=1444 TSval=1266167151 TSecr=2851221635 [TCP PDU reassembled in 207]"
"206","1.381493","100.86.243.187","151.101.1.140","TCP","66","56485  >  443 [ACK] Seq=6282 Ack=62451 Win=3903 Len=0 TSval=2851221669 TSecr=1266167151"
"207","1.381842","151.101.1.140","100.86.243.187","TLSv1.2","241","Application Data"
"208","1.381905","100.86.243.187","151.101.1.140","TCP","66","56485  >  443 [ACK] Seq=6282 Ack=62626 Win=3923 Len=0 TSval=2851221669 TSecr=1266167151"
"209","1.387996","100.86.243.187","151.101.1.140","TLSv1.2","321","Application Data"
"210","1.395100","100.86.243.187","151.101.1.140","TCP","1514","56485  >  443 [ACK] Seq=6537 Ack=62626 Win=3925 Len=1448 TSval=2851221683 TSecr=1266167151 [TCP PDU reassembled in 211]"
"211","1.395149","100.86.243.187","151.101.1.140","TLSv1.2","1298","Application Data"
"212","1.395418","100.86.243.187","151.101.1.140","TLSv1.2","331","Application Data"
"213","1.395863","100.86.243.187","151.101.1.140","TCP","1514","56485  >  443 [ACK] Seq=9482 Ack=62626 Win=3925 Len=1448 TSval=2851221683 TSecr=1266167151 [TCP PDU reassembled in 214]"
"214","1.395882","100.86.243.187","151.101.1.140","TLSv1.2","1312","Application Data"
"215","1.396003","100.86.243.187","151.101.1.140","TLSv1.2","308","Application Data"
"216","1.397635","151.101.1.140","100.86.243.187","TCP","66","443  >  56485 [ACK] Seq=62626 Ack=6537 Win=639 Len=0 TSval=1266167168 TSecr=2851221676"
"217","1.414962","151.101.1.140","100.86.243.187","TCP","66","443  >  56485 [ACK] Seq=62626 Ack=9217 Win=634 Len=0 TSval=1266167175 TSecr=2851221683"
"218","1.414963","151.101.1.140","100.86.243.187","TCP","66","443  >  56485 [ACK] Seq=62626 Ack=12418 Win=631 Len=0 TSval=1266167176 TSecr=2851221683"
"221","1.431483","151.101.1.140","100.86.243.187","TCP","1510","443  >  56485 [ACK] Seq=62626 Ack=12418 Win=639 Len=1444 TSval=1266167200 TSecr=2851221683 [TCP PDU reassembled in 222]"
"222","1.431484","151.101.1.140","100.86.243.187","TLSv1.2","982","Application Data"
"223","1.431485","151.101.1.140","100.86.243.187","TLSv1.2","112","Application Data"
"224","1.431614","100.86.243.187","151.101.1.140","TCP","66","56485  >  443 [ACK] Seq=12418 Ack=65032 Win=3888 Len=0 TSval=2851221719 TSecr=1266167201"
"225","1.432145","151.101.1.140","100.86.243.187","TCP","1510","443  >  56485 [ACK] Seq=65032 Ack=12418 Win=639 Len=1444 TSval=1266167201 TSecr=2851221683 [TCP PDU reassembled in 226]"
"226","1.432151","151.101.1.140","100.86.243.187","TLSv1.2","269","Application Data"
"227","1.432376","100.86.243.187","151.101.1.140","TCP","66","56485  >  443 [ACK] Seq=12418 Ack=66679 Win=3900 Len=0 TSval=2851221719 TSecr=1266167201"
"228","1.434429","151.101.1.140","100.86.243.187","TCP","1510","443  >  56485 [ACK] Seq=66679 Ack=12418 Win=639 Len=1444 TSval=1266167202 TSecr=2851221683 [TCP PDU reassembled in 229]"
"229","1.434430","151.101.1.140","100.86.243.187","TLSv1.2","979","Application Data"
"230","1.434522","100.86.243.187","151.101.1.140","TCP","66","56485  >  443 [ACK] Seq=12418 Ack=69036 Win=3889 Len=0 TSval=2851221722 TSecr=1266167202"
"231","1.438046","151.101.1.140","100.86.243.187","TCP","1510","443  >  56485 [ACK] Seq=69036 Ack=12418 Win=639 Len=1444 TSval=1266167208 TSecr=2851221683 [TCP PDU reassembled in 233]"
"232","1.438143","100.86.243.187","151.101.1.140","TCP","66","56485  >  443 [ACK] Seq=12418 Ack=70480 Win=3903 Len=0 TSval=2851221726 TSecr=1266167208"
"233","1.439024","151.101.1.140","100.86.243.187","TLSv1.2","267","Application Data"
"234","1.439102","100.86.243.187","151.101.1.140","TCP","66","56485  >  443 [ACK] Seq=12418 Ack=70681 Win=3922 Len=0 TSval=2851221726 TSecr=1266167208"
"235","1.439304","100.86.243.187","151.101.1.140","TCP","1514","56485  >  443 [ACK] Seq=12418 Ack=70681 Win=3922 Len=1448 TSval=2851221727 TSecr=1266167208 [TCP PDU reassembled in 236]"
"236","1.439326","100.86.243.187","151.101.1.140","TLSv1.2","1309","Application Data"
"237","1.442174","151.101.1.140","100.86.243.187","TCP","1510","443  >  56485 [ACK] Seq=70681 Ack=12418 Win=639 Len=1444 TSval=1266167212 TSecr=2851221683 [TCP PDU reassembled in 239]"
"238","1.442258","100.86.243.187","151.101.1.140","TCP","66","56485  >  443 [ACK] Seq=15109 Ack=72125 Win=3903 Len=0 TSval=2851221730 TSecr=1266167212"
"239","1.442752","151.101.1.140","100.86.243.187","TLSv1.2","958","Application Data"
"240","1.442822","100.86.243.187","151.101.1.140","TCP","66","56485  >  443 [ACK] Seq=15109 Ack=73017 Win=3911 Len=0 TSval=2851221730 TSecr=1266167212"
"241","1.443029","151.101.1.140","100.86.243.187","TLSv1.2","112","Application Data"
"242","1.443091","100.86.243.187","151.101.1.140","TCP","66","56485  >  443 [ACK] Seq=15109 Ack=73063 Win=3925 Len=0 TSval=2851221730 TSecr=1266167213"
"243","1.449149","151.101.1.140","100.86.243.187","TCP","66","443  >  56485 [ACK] Seq=73063 Ack=13866 Win=637 Len=0 TSval=1266167219 TSecr=2851221727"
"244","1.450001","151.101.1.140","100.86.243.187","TCP","66","443  >  56485 [ACK] Seq=73063 Ack=15109 Win=635 Len=0 TSval=1266167220 TSecr=2851221727"
"245","1.450447","100.86.243.187","151.101.1.140","TLSv1.2","299","Application Data"
"246","1.450522","100.86.243.187","151.101.1.140","TLSv1.2","222","Application Data"
"247","1.461816","151.101.1.140","100.86.243.187","TCP","66","443  >  56485 [ACK] Seq=73063 Ack=15498 Win=635 Len=0 TSval=1266167231 TSecr=2851221738"
"248","1.474717","151.101.1.140","100.86.243.187","TCP","1510","443  >  56485 [ACK] Seq=73063 Ack=15498 Win=639 Len=1444 TSval=1266167245 TSecr=2851221738 [TCP PDU reassembled in 249]"
"249","1.474719","151.101.1.140","100.86.243.187","TLSv1.2","277","Application Data"
"250","1.474829","100.86.243.187","151.101.1.140","TCP","66","56485  >  443 [ACK] Seq=15498 Ack=74718 Win=3900 Len=0 TSval=2851221763 TSecr=1266167245"
"255","1.477637","151.101.1.140","100.86.243.187","TLSv1.2","428","Application Data"
"256","1.477783","100.86.243.187","151.101.1.140","TCP","66","56485  >  443 [ACK] Seq=15498 Ack=75080 Win=3920 Len=0 TSval=2851221766 TSecr=1266167246"
"257","1.478354","151.101.1.140","100.86.243.187","TLSv1.2","107","Application Data"
"258","1.478355","151.101.1.140","100.86.243.187","TLSv1.2","97","Application Data"
"259","1.478465","100.86.243.187","151.101.1.140","TCP","66","56485  >  443 [ACK] Seq=15498 Ack=75152 Win=3924 Len=0 TSval=2851221766 TSecr=1266167246"
"260","1.482059","151.101.1.140","100.86.243.187","TLSv1.2","1035","Application Data"
"261","1.482167","100.86.243.187","151.101.1.140","TCP","66","56485  >  443 [ACK] Seq=15498 Ack=76121 Win=3910 Len=0 TSval=2851221770 TSecr=1266167252"
"262","1.482839","151.101.1.140","100.86.243.187","TLSv1.2","113","Application Data"
"263","1.482840","151.101.1.140","100.86.243.187","TLSv1.2","97","Application Data"
"264","1.482929","100.86.243.187","151.101.1.140","TCP","66","56485  >  443 [ACK] Seq=15498 Ack=76199 Win=3924 Len=0 TSval=2851221770 TSecr=1266167252"
"266","1.486339","151.101.1.140","100.86.243.187","TLSv1.2","815","Application Data"
"268","1.486589","100.86.243.187","151.101.1.140","TCP","66","56485  >  443 [ACK] Seq=15498 Ack=76948 Win=3925 Len=0 TSval=2851221774 TSecr=1266167257"
"275","1.489722","151.101.1.140","100.86.243.187","TLSv1.2","107","Application Data"
"276","1.489722","151.101.1.140","100.86.243.187","TLSv1.2","97","Application Data"
"277","1.490011","100.86.243.187","151.101.1.140","TCP","66","56485  >  443 [ACK] Seq=15498 Ack=77020 Win=3925 Len=0 TSval=2851221777 TSecr=1266167260"
"278","1.495919","151.101.1.140","100.86.243.187","TLSv1.2","107","Application Data"
"279","1.496095","100.86.243.187","151.101.1.140","TCP","66","56485  >  443 [ACK] Seq=15498 Ack=77061 Win=3925 Len=0 TSval=2851221784 TSecr=1266167266"
"280","1.508588","151.101.1.140","100.86.243.187","TCP","1510","443  >  56485 [ACK] Seq=77061 Ack=15498 Win=639 Len=1444 TSval=1266167279 TSecr=2851221784 [TCP PDU reassembled in 281]"
"281","1.508591","151.101.1.140","100.86.243.187","TLSv1.2","1027","Application Data"
"282","1.508931","100.86.243.187","151.101.1.140","TCP","66","56485  >  443 [ACK] Seq=15498 Ack=79466 Win=3925 Len=0 TSval=2851221797 TSecr=1266167279"
"283","1.523838","151.101.1.140","100.86.243.187","TLSv1.2","1504","Application Data"
"284","1.523840","151.101.1.140","100.86.243.187","TLSv1.2","668","Application Data"
"285","1.523841","151.101.1.140","100.86.243.187","TLSv1.2","391","Application Data"
"286","1.523907","151.101.1.140","100.86.243.187","TLSv1.2","97","Application Data"
"287","1.524220","100.86.243.187","151.101.1.140","TCP","66","56485  >  443 [ACK] Seq=15498 Ack=81862 Win=3925 Len=0 TSval=2851221812 TSecr=1266167294"
"347","1.742290","100.86.243.187","151.101.1.140","TCP","1514","56485  >  443 [ACK] Seq=15498 Ack=81862 Win=3925 Len=1448 TSval=2851222030 TSecr=1266167294 [TCP PDU reassembled in 348]"
"348","1.742333","100.86.243.187","151.101.1.140","TLSv1.2","1295","Application Data"
"349","1.742386","100.86.243.187","151.101.1.140","TLSv1.2","273","Application Data"
"354","1.752215","151.101.1.140","100.86.243.187","TCP","66","443  >  56485 [ACK] Seq=81862 Ack=18382 Win=635 Len=0 TSval=1266167523 TSecr=2851222030"
"364","1.852720","151.101.1.140","100.86.243.187","TCP","1510","443  >  56485 [ACK] Seq=81862 Ack=18382 Win=639 Len=1444 TSval=1266167623 TSecr=2851222030 [TCP PDU reassembled in 366]"
"365","1.852837","100.86.243.187","151.101.1.140","TCP","66","56485  >  443 [ACK] Seq=18382 Ack=83306 Win=3903 Len=0 TSval=2851222141 TSecr=1266167623"
"366","1.853689","151.101.1.140","100.86.243.187","TLSv1.2","441","Application Data"
"367","1.853769","100.86.243.187","151.101.1.140","TCP","66","56485  >  443 [ACK] Seq=18382 Ack=83681 Win=3920 Len=0 TSval=2851222141 TSecr=1266167623"
"384","1.918753","100.86.243.187","151.101.1.140","TLSv1.2","297","Application Data"
"385","1.918817","100.86.243.187","151.101.1.140","TLSv1.2","146","Application Data"
"386","1.922999","100.86.243.187","151.101.1.140","TCP","1514","56485  >  443 [ACK] Seq=18693 Ack=83681 Win=3925 Len=1448 TSval=2851222211 TSecr=1266167623 [TCP PDU reassembled in 387]"
"387","1.923036","100.86.243.187","151.101.1.140","TLSv1.2","1469","Application Data"
"388","1.929373","151.101.1.140","100.86.243.187","TCP","66","443  >  56485 [ACK] Seq=83681 Ack=18693 Win=639 Len=0 TSval=1266167699 TSecr=2851222207"
"389","1.932567","151.101.1.140","100.86.243.187","TCP","66","443  >  56485 [ACK] Seq=83681 Ack=21544 Win=634 Len=0 TSval=1266167703 TSecr=2851222211"
"390","1.958135","151.101.1.140","100.86.243.187","TCP","1510","443  >  56485 [ACK] Seq=83681 Ack=21544 Win=639 Len=1444 TSval=1266167728 TSecr=2851222211 [TCP PDU reassembled in 391]"
"391","1.958162","151.101.1.140","100.86.243.187","TLSv1.2","860","Application Data"
"392","1.958163","151.101.1.140","100.86.243.187","TLSv1.2","1119","Application Data"
"393","1.958221","100.86.243.187","151.101.1.140","TCP","66","56485  >  443 [ACK] Seq=21544 Ack=85125 Win=3903 Len=0 TSval=2851222246 TSecr=1266167728"
"394","1.958533","100.86.243.187","151.101.1.140","TCP","66","56485  >  443 [ACK] Seq=21544 Ack=86972 Win=3925 Len=0 TSval=2851222246 TSecr=1266167729"
"395","1.997463","151.101.1.140","100.86.243.187","TCP","1510","443  >  56485 [ACK] Seq=86972 Ack=21544 Win=639 Len=1444 TSval=1266167765 TSecr=2851222246 [TCP PDU reassembled in 396]"
"396","1.998620","151.101.1.140","100.86.243.187","TLSv1.2","523","Application Data"
"397","1.998729","100.86.243.187","151.101.1.140","TCP","66","56485  >  443 [ACK] Seq=21544 Ack=88873 Win=3925 Len=0 TSval=2851222287 TSecr=1266167765"
"482","2.775154","151.101.1.140","100.86.243.187","TLSv1.2","313","Application Data"
"483","2.775291","100.86.243.187","151.101.1.140","TCP","66","56485  >  443 [ACK] Seq=21544 Ack=89120 Win=3925 Len=0 TSval=2851223063 TSecr=1266168545"
"484","2.785931","151.101.1.140","100.86.243.187","TLSv1.2","148","Application Data"
"485","2.786053","100.86.243.187","151.101.1.140","TCP","66","56485  >  443 [ACK] Seq=21544 Ack=89202 Win=3925 Len=0 TSval=2851223074 TSecr=1266168556"
"486","2.873413","151.101.1.140","100.86.243.187","TLSv1.2","1097","Application Data"
"487","2.873587","100.86.243.187","151.101.1.140","TCP","66","56485  >  443 [ACK] Seq=21544 Ack=90233 Win=3925 Len=0 TSval=2851223161 TSecr=1266168643"
"488","2.892095","151.101.1.140","100.86.243.187","TLSv1.2","759","Application Data"
"489","2.892292","100.86.243.187","151.101.1.140","TCP","66","56485  >  443 [ACK] Seq=21544 Ack=90926 Win=3925 Len=0 TSval=2851223180 TSecr=1266168655"
"490","2.911779","151.101.1.140","100.86.243.187","TLSv1.2","742","Application Data"
"491","2.911780","151.101.1.140","100.86.243.187","TLSv1.2","646","Application Data"
"492","2.911995","100.86.243.187","151.101.1.140","TCP","66","56485  >  443 [ACK] Seq=21544 Ack=92182 Win=3925 Len=0 TSval=2851223200 TSecr=1266168661"
"493","2.914244","151.101.1.140","100.86.243.187","TLSv1.2","556","Application Data"
"494","2.914246","151.101.1.140","100.86.243.187","TLSv1.2","492","Application Data"
"495","2.914527","100.86.243.187","151.101.1.140","TCP","66","56485  >  443 [ACK] Seq=21544 Ack=93098 Win=3925 Len=0 TSval=2851223202 TSecr=1266168662"
"496","2.940344","151.101.1.140","100.86.243.187","TLSv1.2","604","Application Data"
"497","2.940345","151.101.1.140","100.86.243.187","TLSv1.2","474","Application Data"
"498","2.940345","151.101.1.140","100.86.243.187","TLSv1.2","178","Application Data"
"499","2.940345","151.101.1.140","100.86.243.187","TLSv1.2","158","Application Data"
"500","2.940602","100.86.243.187","151.101.1.140","TCP","66","56485  >  443 [ACK] Seq=21544 Ack=94248 Win=3925 Len=0 TSval=2851223228 TSecr=1266168673"
"503","2.972547","151.101.1.140","100.86.243.187","TLSv1.2","342","Application Data"
"504","2.972548","151.101.1.140","100.86.243.187","TLSv1.2","314","Application Data"
"505","2.972781","100.86.243.187","151.101.1.140","TCP","66","56485  >  443 [ACK] Seq=21544 Ack=94772 Win=3925 Len=0 TSval=2851223260 TSecr=1266168682"
"507","2.980326","151.101.1.140","100.86.243.187","TLSv1.2","177","Application Data"
"508","2.980327","151.101.1.140","100.86.243.187","TLSv1.2","220","Application Data"
"509","2.980757","100.86.243.187","151.101.1.140","TCP","66","56485  >  443 [ACK] Seq=21544 Ack=95037 Win=3925 Len=0 TSval=2851223268 TSecr=1266168689"
"510","2.981871","151.101.1.140","100.86.243.187","TLSv1.2","1510","Application Data, Application Data, Application Data, Application Data"
"511","2.981874","151.101.1.140","100.86.243.187","TLSv1.2","834","Application Data"
"512","2.982211","100.86.243.187","151.101.1.140","TCP","66","56485  >  443 [ACK] Seq=21544 Ack=97249 Win=3925 Len=0 TSval=2851223270 TSecr=1266168720"
"513","2.985118","151.101.1.140","100.86.243.187","TLSv1.2","388","Application Data"
"515","2.985497","100.86.243.187","151.101.1.140","TCP","66","56485  >  443 [ACK] Seq=21544 Ack=97571 Win=3925 Len=0 TSval=2851223273 TSecr=1266168740"
"521","3.014555","151.101.1.140","100.86.243.187","TLSv1.2","445","Application Data"
"522","3.014720","100.86.243.187","151.101.1.140","TCP","66","56485  >  443 [ACK] Seq=21544 Ack=97950 Win=3925 Len=0 TSval=2851223302 TSecr=1266168783"
"523","3.037950","151.101.1.140","100.86.243.187","TLSv1.2","166","Application Data"
"524","3.038094","100.86.243.187","151.101.1.140","TCP","66","56485  >  443 [ACK] Seq=21544 Ack=98050 Win=3925 Len=0 TSval=2851223326 TSecr=1266168807"
"525","3.044041","151.101.1.140","100.86.243.187","TLSv1.2","156","Application Data"
"526","3.044191","100.86.243.187","151.101.1.140","TCP","66","56485  >  443 [ACK] Seq=21544 Ack=98140 Win=3925 Len=0 TSval=2851223332 TSecr=1266168812"
"527","3.048013","151.101.1.140","100.86.243.187","TLSv1.2","159","Application Data"
"528","3.048159","100.86.243.187","151.101.1.140","TCP","66","56485  >  443 [ACK] Seq=21544 Ack=98233 Win=3925 Len=0 TSval=2851223336 TSecr=1266168817"
"529","3.053907","151.101.1.140","100.86.243.187","TLSv1.2","163","Application Data"
"530","3.054049","100.86.243.187","151.101.1.140","TCP","66","56485  >  443 [ACK] Seq=21544 Ack=98330 Win=3925 Len=0 TSval=2851223342 TSecr=1266168822"
"531","3.056765","151.101.1.140","100.86.243.187","TLSv1.2","213","Application Data"
"532","3.056919","100.86.243.187","151.101.1.140","TCP","66","56485  >  443 [ACK] Seq=21544 Ack=98477 Win=3925 Len=0 TSval=2851223345 TSecr=1266168827"
"533","3.062043","151.101.1.140","100.86.243.187","TLSv1.2","291","Application Data"
"534","3.062197","100.86.243.187","151.101.1.140","TCP","66","56485  >  443 [ACK] Seq=21544 Ack=98702 Win=3925 Len=0 TSval=2851223350 TSecr=1266168832"
"535","3.066167","151.101.1.140","100.86.243.187","TLSv1.2","366","Application Data"
"536","3.066314","100.86.243.187","151.101.1.140","TCP","66","56485  >  443 [ACK] Seq=21544 Ack=99002 Win=3925 Len=0 TSval=2851223354 TSecr=1266168836"
"537","3.070228","151.101.1.140","100.86.243.187","TLSv1.2","169","Application Data"
"538","3.070399","100.86.243.187","151.101.1.140","TCP","66","56485  >  443 [ACK] Seq=21544 Ack=99105 Win=3925 Len=0 TSval=2851223358 TSecr=1266168841"
"539","3.075301","151.101.1.140","100.86.243.187","TLSv1.2","138","Application Data"
"540","3.075462","100.86.243.187","151.101.1.140","TCP","66","56485  >  443 [ACK] Seq=21544 Ack=99177 Win=3925 Len=0 TSval=2851223363 TSecr=1266168846"
"541","3.080792","151.101.1.140","100.86.243.187","TLSv1.2","182","Application Data"
"542","3.080941","100.86.243.187","151.101.1.140","TCP","66","56485  >  443 [ACK] Seq=21544 Ack=99293 Win=3925 Len=0 TSval=2851223369 TSecr=1266168851"
"543","3.081853","151.101.1.140","100.86.243.187","TLSv1.2","214","Application Data"
"544","3.081977","100.86.243.187","151.101.1.140","TCP","66","56485  >  443 [ACK] Seq=21544 Ack=99441 Win=3925 Len=0 TSval=2851223370 TSecr=1266168852"
"545","3.084831","151.101.1.140","100.86.243.187","TLSv1.2","529","Application Data"
"546","3.085040","100.86.243.187","151.101.1.140","TCP","66","56485  >  443 [ACK] Seq=21544 Ack=99904 Win=3925 Len=0 TSval=2851223373 TSecr=1266168855"
"547","3.085562","151.101.1.140","100.86.243.187","TLSv1.2","170","Application Data"
"548","3.085680","100.86.243.187","151.101.1.140","TCP","66","56485  >  443 [ACK] Seq=21544 Ack=100008 Win=3925 Len=0 TSval=2851223373 TSecr=1266168856"
"549","3.086855","151.101.1.140","100.86.243.187","TLSv1.2","234","Application Data"
"550","3.087077","100.86.243.187","151.101.1.140","TCP","66","56485  >  443 [ACK] Seq=21544 Ack=100176 Win=3925 Len=0 TSval=2851223375 TSecr=1266168856"
"551","3.090116","151.101.1.140","100.86.243.187","TLSv1.2","142","Application Data"
"552","3.090255","100.86.243.187","151.101.1.140","TCP","66","56485  >  443 [ACK] Seq=21544 Ack=100252 Win=3925 Len=0 TSval=2851223378 TSecr=1266168860"
"553","3.091042","151.101.1.140","100.86.243.187","TLSv1.2","193","Application Data"
"554","3.091160","100.86.243.187","151.101.1.140","TCP","66","56485  >  443 [ACK] Seq=21544 Ack=100379 Win=3925 Len=0 TSval=2851223378 TSecr=1266168861"
"555","3.091660","151.101.1.140","100.86.243.187","TCP","1510","443  >  56485 [ACK] Seq=100379 Ack=21544 Win=639 Len=1444 TSval=1266168862 TSecr=2851223369 [TCP PDU reassembled in 556]"
"556","3.093238","151.101.1.140","100.86.243.187","TLSv1.2","428","Application Data"
"557","3.093239","151.101.1.140","100.86.243.187","TLSv1.2","1187","Application Data"
"558","3.093521","100.86.243.187","151.101.1.140","TCP","66","56485  >  443 [ACK] Seq=21544 Ack=103306 Win=3925 Len=0 TSval=2851223381 TSecr=1266168862"
"559","3.093877","151.101.1.140","100.86.243.187","TLSv1.2","291","Application Data"
"560","3.094027","100.86.243.187","151.101.1.140","TCP","66","56485  >  443 [ACK] Seq=21544 Ack=103531 Win=3925 Len=0 TSval=2851223381 TSecr=1266168863"
"561","3.094163","151.101.1.140","100.86.243.187","TLSv1.2","173","Application Data"
"562","3.094286","100.86.243.187","151.101.1.140","TCP","66","56485  >  443 [ACK] Seq=21544 Ack=103638 Win=3925 Len=0 TSval=2851223381 TSecr=1266168864"
"563","3.119590","151.101.1.140","100.86.243.187","TLSv1.2","140","Application Data"
"564","3.119616","151.101.1.140","100.86.243.187","TLSv1.2","182","Application Data"
"565","3.119843","100.86.243.187","151.101.1.140","TCP","66","56485  >  443 [ACK] Seq=21544 Ack=103828 Win=3925 Len=0 TSval=2851223408 TSecr=1266168889"
"566","3.150786","151.101.1.140","100.86.243.187","TLSv1.2","211","Application Data"
"567","3.150921","100.86.243.187","151.101.1.140","TCP","66","56485  >  443 [ACK] Seq=21544 Ack=103973 Win=3925 Len=0 TSval=2851223439 TSecr=1266168920"
"568","3.162131","151.101.1.140","100.86.243.187","TLSv1.2","310","Application Data"
"569","3.162277","100.86.243.187","151.101.1.140","TCP","66","56485  >  443 [ACK] Seq=21544 Ack=104217 Win=3925 Len=0 TSval=2851223450 TSecr=1266168931"
"570","3.175049","151.101.1.140","100.86.243.187","TLSv1.2","258","Application Data"
"571","3.175190","100.86.243.187","151.101.1.140","TCP","66","56485  >  443 [ACK] Seq=21544 Ack=104409 Win=3925 Len=0 TSval=2851223463 TSecr=1266168944"
"572","3.179721","151.101.1.140","100.86.243.187","TLSv1.2","221","Application Data"
"573","3.179865","100.86.243.187","151.101.1.140","TCP","66","56485  >  443 [ACK] Seq=21544 Ack=104564 Win=3925 Len=0 TSval=2851223468 TSecr=1266168949"
"574","3.196470","151.101.1.140","100.86.243.187","TLSv1.2","138","Application Data"
"575","3.196606","100.86.243.187","151.101.1.140","TCP","66","56485  >  443 [ACK] Seq=21544 Ack=104636 Win=3925 Len=0 TSval=2851223484 TSecr=1266168967"
"586","3.206684","151.101.1.140","100.86.243.187","TLSv1.2","182","Application Data"
"587","3.206809","100.86.243.187","151.101.1.140","TCP","66","56485  >  443 [ACK] Seq=21544 Ack=104752 Win=3925 Len=0 TSval=2851223495 TSecr=1266168976"
"588","3.206958","151.101.1.140","100.86.243.187","TLSv1.2","209","Application Data"
"589","3.207038","100.86.243.187","151.101.1.140","TCP","66","56485  >  443 [ACK] Seq=21544 Ack=104895 Win=3925 Len=0 TSval=2851223495 TSecr=1266168977"
"590","3.208009","151.101.1.140","100.86.243.187","TLSv1.2","696","Application Data"
"591","3.208116","100.86.243.187","151.101.1.140","TCP","66","56485  >  443 [ACK] Seq=21544 Ack=105525 Win=3925 Len=0 TSval=2851223496 TSecr=1266168978"
"592","3.208804","151.101.1.140","100.86.243.187","TLSv1.2","148","Application Data"
"593","3.208909","100.86.243.187","151.101.1.140","TCP","66","56485  >  443 [ACK] Seq=21544 Ack=105607 Win=3925 Len=0 TSval=2851223496 TSecr=1266168978"
"594","3.209463","151.101.1.140","100.86.243.187","TLSv1.2","1411","Application Data"
"595","3.209563","100.86.243.187","151.101.1.140","TCP","66","56485  >  443 [ACK] Seq=21544 Ack=106952 Win=3925 Len=0 TSval=2851223497 TSecr=1266168979"
"596","3.211170","151.101.1.140","100.86.243.187","TLSv1.2","1326","Application Data"
"597","3.211273","100.86.243.187","151.101.1.140","TCP","66","56485  >  443 [ACK] Seq=21544 Ack=108212 Win=3925 Len=0 TSval=2851223499 TSecr=1266168981"
"598","3.213616","151.101.1.140","100.86.243.187","TLSv1.2","336","Application Data"
"601","3.213759","100.86.243.187","151.101.1.140","TCP","66","56485  >  443 [ACK] Seq=21544 Ack=108482 Win=3925 Len=0 TSval=2851223502 TSecr=1266168981"
"611","3.245479","151.101.1.140","100.86.243.187","TLSv1.2","132","Application Data"
"612","3.245620","100.86.243.187","151.101.1.140","TCP","66","56485  >  443 [ACK] Seq=21544 Ack=108548 Win=3925 Len=0 TSval=2851223533 TSecr=1266169016"
"621","3.271190","151.101.1.140","100.86.243.187","TLSv1.2","182","Application Data"
"622","3.271337","100.86.243.187","151.101.1.140","TCP","66","56485  >  443 [ACK] Seq=21544 Ack=108664 Win=3925 Len=0 TSval=2851223559 TSecr=1266169035"
"625","3.284994","151.101.1.140","100.86.243.187","TLSv1.2","462","Application Data"
"626","3.285145","100.86.243.187","151.101.1.140","TCP","66","56485  >  443 [ACK] Seq=21544 Ack=109060 Win=3925 Len=0 TSval=2851223573 TSecr=1266169047"
"627","3.300639","151.101.1.140","100.86.243.187","TLSv1.2","188","Application Data"
"628","3.300784","100.86.243.187","151.101.1.140","TCP","66","56485  >  443 [ACK] Seq=21544 Ack=109182 Win=3925 Len=0 TSval=2851223589 TSecr=1266169071"
"629","3.305538","151.101.1.140","100.86.243.187","TLSv1.2","208","Application Data"
"630","3.305674","100.86.243.187","151.101.1.140","TCP","66","56485  >  443 [ACK] Seq=21544 Ack=109324 Win=3925 Len=0 TSval=2851223593 TSecr=1266169076"
"631","3.310535","151.101.1.140","100.86.243.187","TLSv1.2","132","Application Data"
"632","3.310686","100.86.243.187","151.101.1.140","TCP","66","56485  >  443 [ACK] Seq=21544 Ack=109390 Win=3925 Len=0 TSval=2851223598 TSecr=1266169081"
"633","3.315694","151.101.1.140","100.86.243.187","TLSv1.2","186","Application Data"
"634","3.315830","100.86.243.187","151.101.1.140","TCP","66","56485  >  443 [ACK] Seq=21544 Ack=109510 Win=3925 Len=0 TSval=2851223604 TSecr=1266169086"
"635","3.320165","151.101.1.140","100.86.243.187","TLSv1.2","203","Application Data"
"636","3.320314","100.86.243.187","151.101.1.140","TCP","66","56485  >  443 [ACK] Seq=21544 Ack=109647 Win=3925 Len=0 TSval=2851223608 TSecr=1266169090"
"637","3.321479","151.101.1.140","100.86.243.187","TLSv1.2","1435","Application Data"
"638","3.321625","100.86.243.187","151.101.1.140","TCP","66","56485  >  443 [ACK] Seq=21544 Ack=111016 Win=3925 Len=0 TSval=2851223609 TSecr=1266169092"
"639","3.321717","151.101.1.140","100.86.243.187","TLSv1.2","377","Application Data"
"640","3.321875","100.86.243.187","151.101.1.140","TCP","66","56485  >  443 [ACK] Seq=21544 Ack=111327 Win=3925 Len=0 TSval=2851223609 TSecr=1266169092"
"641","3.322056","151.101.1.140","100.86.243.187","TLSv1.2","289","Application Data"
"642","3.322057","151.101.1.140","100.86.243.187","TLSv1.2","169","Application Data"
"646","3.322344","100.86.243.187","151.101.1.140","TCP","66","56485  >  443 [ACK] Seq=21544 Ack=111653 Win=3925 Len=0 TSval=2851223609 TSecr=1266169092"
"647","3.322860","100.86.243.187","151.101.1.140","TLSv1.2","144","Application Data"
"652","3.324960","100.86.243.187","151.101.1.140","TLSv1.2","101","Application Data"
"654","3.332349","151.101.1.140","100.86.243.187","TCP","66","443  >  56509 [ACK] Seq=1 Ack=79 Win=424 Len=0 TSval=3914429830 TSecr=514130360"
"657","3.334236","151.101.1.140","100.86.243.187","TLSv1.2","254","Application Data"
"658","3.334335","100.86.243.187","151.101.1.140","TCP","66","56509  >  443 [ACK] Seq=114 Ack=189 Win=7022 Len=0 TSval=514130371 TSecr=3914429832"
"659","3.334402","151.101.1.140","100.86.243.187","TLSv1.2","1347","Application Data"
"660","3.334626","100.86.243.187","151.101.1.140","TCP","66","56509  >  443 [ACK] Seq=114 Ack=1470 Win=7002 Len=0 TSval=514130371 TSecr=3914429833"
"670","3.338792","151.101.1.140","100.86.243.187","TLSv1.2","144","Application Data"
"671","3.338883","100.86.243.187","151.101.1.140","TCP","66","56485  >  443 [ACK] Seq=21544 Ack=111731 Win=3925 Len=0 TSval=2851223626 TSecr=1266169109"
"672","3.339678","151.101.1.140","100.86.243.187","TLSv1.2","171","Application Data"
"673","3.339794","100.86.243.187","151.101.1.140","TCP","66","56485  >  443 [ACK] Seq=21544 Ack=111836 Win=3925 Len=0 TSval=2851223628 TSecr=1266169110"
"674","3.340514","151.101.1.140","100.86.243.187","TLSv1.2","413","Application Data"
"675","3.340642","100.86.243.187","151.101.1.140","TCP","66","56485  >  443 [ACK] Seq=21544 Ack=112183 Win=3925 Len=0 TSval=2851223628 TSecr=1266169111"
"676","3.340683","151.101.1.140","100.86.243.187","TLSv1.2","600","Application Data"
"677","3.340731","100.86.243.187","151.101.1.140","TCP","66","56485  >  443 [ACK] Seq=21544 Ack=112717 Win=3925 Len=0 TSval=2851223629 TSecr=1266169111"
"678","3.345589","151.101.1.140","100.86.243.187","TLSv1.2","515","Application Data"
"679","3.345734","100.86.243.187","151.101.1.140","TCP","66","56485  >  443 [ACK] Seq=21544 Ack=113166 Win=3925 Len=0 TSval=2851223634 TSecr=1266169116"
"682","3.359191","151.101.1.140","100.86.243.187","TLSv1.2","176","Application Data"
"683","3.359354","100.86.243.187","151.101.1.140","TCP","66","56485  >  443 [ACK] Seq=21544 Ack=113276 Win=3925 Len=0 TSval=2851223647 TSecr=1266169129"
"684","3.368761","151.101.1.140","100.86.243.187","TLSv1.2","163","Application Data"
"685","3.368912","100.86.243.187","151.101.1.140","TCP","66","56485  >  443 [ACK] Seq=21544 Ack=113373 Win=3925 Len=0 TSval=2851223657 TSecr=1266169139"
"686","3.376752","151.101.1.140","100.86.243.187","TLSv1.2","517","Application Data"
"687","3.376907","100.86.243.187","151.101.1.140","TCP","66","56485  >  443 [ACK] Seq=21544 Ack=113824 Win=3925 Len=0 TSval=2851223665 TSecr=1266169145"
"688","3.382209","151.101.1.140","100.86.243.187","TLSv1.2","699","Application Data"
"689","3.382360","100.86.243.187","151.101.1.140","TCP","66","56485  >  443 [ACK] Seq=21544 Ack=114457 Win=3925 Len=0 TSval=2851223670 TSecr=1266169152"
"690","3.387287","151.101.1.140","100.86.243.187","TLSv1.2","660","Application Data"
"691","3.387428","100.86.243.187","151.101.1.140","TCP","66","56485  >  443 [ACK] Seq=21544 Ack=115051 Win=3925 Len=0 TSval=2851223675 TSecr=1266169158"
"692","3.388325","151.101.1.140","100.86.243.187","TLSv1.2","544","Application Data"
"693","3.388440","100.86.243.187","151.101.1.140","TCP","66","56485  >  443 [ACK] Seq=21544 Ack=115529 Win=3925 Len=0 TSval=2851223676 TSecr=1266169158"
"694","3.391154","151.101.1.140","100.86.243.187","TLSv1.2","166","Application Data"
"695","3.391277","100.86.243.187","151.101.1.140","TCP","66","56485  >  443 [ACK] Seq=21544 Ack=115629 Win=3925 Len=0 TSval=2851223679 TSecr=1266169159"
"696","3.395430","151.101.1.140","100.86.243.187","TLSv1.2","492","Application Data"
"697","3.395594","100.86.243.187","151.101.1.140","TCP","66","56485  >  443 [ACK] Seq=21544 Ack=116055 Win=3925 Len=0 TSval=2851223683 TSecr=1266169165"
"698","3.396164","151.101.1.140","100.86.243.187","TLSv1.2","1503","Application Data"
"699","3.396254","100.86.243.187","151.101.1.140","TCP","66","56485  >  443 [ACK] Seq=21544 Ack=117492 Win=3925 Len=0 TSval=2851223683 TSecr=1266169166"
"700","3.396412","151.101.1.140","100.86.243.187","TLSv1.2","163","Application Data"
"701","3.396491","100.86.243.187","151.101.1.140","TCP","66","56485  >  443 [ACK] Seq=21544 Ack=117589 Win=3925 Len=0 TSval=2851223683 TSecr=1266169166"
"702","3.397165","151.101.1.140","100.86.243.187","TLSv1.2","733","Application Data"
"703","3.397277","100.86.243.187","151.101.1.140","TCP","66","56485  >  443 [ACK] Seq=21544 Ack=118256 Win=3925 Len=0 TSval=2851223685 TSecr=1266169167"
"704","3.397556","151.101.1.140","100.86.243.187","TLSv1.2","210","Application Data"
"705","3.397626","100.86.243.187","151.101.1.140","TCP","66","56485  >  443 [ACK] Seq=21544 Ack=118400 Win=3925 Len=0 TSval=2851223685 TSecr=1266169168"
"706","3.407928","151.101.1.140","100.86.243.187","TLSv1.2","534","Application Data"
"707","3.408087","100.86.243.187","151.101.1.140","TCP","66","56485  >  443 [ACK] Seq=21544 Ack=118868 Win=3925 Len=0 TSval=2851223696 TSecr=1266169178"
"708","3.428630","151.101.1.140","100.86.243.187","TLSv1.2","153","Application Data"
"709","3.428786","100.86.243.187","151.101.1.140","TCP","66","56485  >  443 [ACK] Seq=21544 Ack=118955 Win=3925 Len=0 TSval=2851223717 TSecr=1266169199"
"712","3.455973","151.101.1.140","100.86.243.187","TLSv1.2","201","Application Data"
"713","3.456123","100.86.243.187","151.101.1.140","TCP","66","56485  >  443 [ACK] Seq=21544 Ack=119090 Win=3925 Len=0 TSval=2851223744 TSecr=1266169225"
"714","3.456862","151.101.1.140","100.86.243.187","TLSv1.2","385","Application Data"
"715","3.456993","100.86.243.187","151.101.1.140","TCP","66","56485  >  443 [ACK] Seq=21544 Ack=119409 Win=3925 Len=0 TSval=2851223744 TSecr=1266169228"
"718","3.463615","151.101.1.140","100.86.243.187","TLSv1.2","697","Application Data"
"719","3.463760","100.86.243.187","151.101.1.140","TCP","66","56485  >  443 [ACK] Seq=21544 Ack=120040 Win=3925 Len=0 TSval=2851223752 TSecr=1266169234"
"720","3.464434","151.101.1.140","100.86.243.187","TLSv1.2","146","Application Data"
"721","3.464561","100.86.243.187","151.101.1.140","TCP","66","56485  >  443 [ACK] Seq=21544 Ack=120120 Win=3925 Len=0 TSval=2851223752 TSecr=1266169235"
"761","3.986059","100.86.243.187","151.101.1.140","TLSv1.2","170","Application Data"
"763","3.986477","100.86.243.187","151.101.1.140","TLSv1.2","170","Application Data"
"764","3.986768","100.86.243.187","151.101.1.140","TLSv1.2","170","Application Data"
"765","3.987005","100.86.243.187","151.101.1.140","TLSv1.2","240","Application Data"
"767","3.987316","100.86.243.187","151.101.1.140","TLSv1.2","170","Application Data"
"771","3.987958","100.86.243.187","151.101.1.140","TLSv1.2","169","Application Data"
"776","3.996012","151.101.1.140","100.86.243.187","TCP","66","443  >  56520 [ACK] Seq=5650 Ack=383 Win=296 Len=0 TSval=2144785064 TSecr=2085256980"
"778","3.996034","151.101.1.140","100.86.243.187","TCP","66","443  >  56520 [ACK] Seq=5650 Ack=487 Win=296 Len=0 TSval=2144785064 TSecr=2085256981"
"779","3.996296","151.101.1.140","100.86.243.187","TCP","66","443  >  56509 [ACK] Seq=1470 Ack=288 Win=424 Len=0 TSval=3914430494 TSecr=514131023"
"780","3.998062","151.101.1.140","100.86.243.187","TCP","1510","443  >  56520 [ACK] Seq=5650 Ack=591 Win=296 Len=1444 TSval=2144785065 TSecr=2085256981 [TCP PDU reassembled in 782]"
"781","3.998063","151.101.1.140","100.86.243.187","TCP","1510","443  >  56520 [ACK] Seq=7094 Ack=591 Win=296 Len=1444 TSval=2144785065 TSecr=2085256981 [TCP PDU reassembled in 782]"
"782","3.998063","151.101.1.140","100.86.243.187","TLSv1.2","418","Application Data"
"785","3.998065","151.101.1.140","100.86.243.187","TCP","1510","443  >  56520 [ACK] Seq=8890 Ack=591 Win=296 Len=1444 TSval=2144785065 TSecr=2085256981 [TCP PDU reassembled in 787]"
"786","3.998065","151.101.1.140","100.86.243.187","TCP","1510","443  >  56520 [ACK] Seq=10334 Ack=591 Win=296 Len=1444 TSval=2144785065 TSecr=2085256981 [TCP PDU reassembled in 787]"
"787","3.998066","151.101.1.140","100.86.243.187","TLSv1.2","867","Application Data"
"796","3.998070","151.101.1.140","100.86.243.187","TLSv1.2","166","Application Data"
"797","3.998071","151.101.1.140","100.86.243.187","TCP","1510","443  >  56520 [ACK] Seq=12679 Ack=695 Win=296 Len=1444 TSval=2144785065 TSecr=2085256981 [TCP PDU reassembled in 806]"
"798","3.998191","100.86.243.187","151.101.1.140","TCP","66","56520  >  443 [ACK] Seq=798 Ack=12579 Win=2776 Len=0 TSval=2085256993 TSecr=2144785065"
"799","3.998273","100.86.243.187","151.101.1.140","TCP","66","56520  >  443 [ACK] Seq=798 Ack=14123 Win=2752 Len=0 TSval=2085256993 TSecr=2144785065"
"803","3.999002","100.86.243.187","151.101.1.140","TCP","66","[TCP Window Update] 56520  >  443 [ACK] Seq=798 Ack=14123 Win=2885 Len=0 TSval=2085256993 TSecr=2144785065"
"804","3.999659","151.101.1.140","100.86.243.187","TCP","1510","443  >  56520 [ACK] Seq=14123 Ack=695 Win=296 Len=1444 TSval=2144785065 TSecr=2085256981 [TCP PDU reassembled in 806]"
"805","3.999660","151.101.1.140","100.86.243.187","TCP","1510","443  >  56520 [ACK] Seq=15567 Ack=695 Win=296 Len=1444 TSval=2144785065 TSecr=2085256981 [TCP PDU reassembled in 806]"
"806","3.999661","151.101.1.140","100.86.243.187","TLSv1.2","960","Application Data"
"807","3.999662","151.101.1.140","100.86.243.187","TLSv1.2","166","Application Data"
"808","3.999662","151.101.1.140","100.86.243.187","TCP","1510","443  >  56520 [ACK] Seq=18005 Ack=695 Win=296 Len=1444 TSval=2144785066 TSecr=2085256981 [TCP PDU reassembled in 812]"
"809","3.999663","151.101.1.140","100.86.243.187","TCP","1510","443  >  56520 [ACK] Seq=19449 Ack=695 Win=296 Len=1444 TSval=2144785066 TSecr=2085256981 [TCP PDU reassembled in 812]"
"810","3.999664","151.101.1.140","100.86.243.187","TCP","1510","443  >  56520 [ACK] Seq=20893 Ack=695 Win=296 Len=1444 TSval=2144785066 TSecr=2085256981 [TCP PDU reassembled in 812]"
"811","3.999664","151.101.1.140","100.86.243.187","TCP","1510","443  >  56520 [ACK] Seq=22337 Ack=695 Win=296 Len=1444 TSval=2144785066 TSecr=2085256981 [TCP PDU reassembled in 812]"
"812","3.999665","151.101.1.140","100.86.243.187","TLSv1.2","1058","Application Data"
"814","3.999755","100.86.243.187","151.101.1.140","TCP","66","56520  >  443 [ACK] Seq=798 Ack=24773 Win=2718 Len=0 TSval=2085256995 TSecr=2144785066"
"817","3.999819","151.101.1.140","100.86.243.187","TCP","66","443  >  56520 [ACK] Seq=24773 Ack=798 Win=296 Len=0 TSval=2144785066 TSecr=2085256982"
"819","4.000181","100.86.243.187","151.101.1.140","TCP","66","[TCP Window Update] 56520  >  443 [ACK] Seq=798 Ack=24773 Win=2885 Len=0 TSval=2085256995 TSecr=2144785066"
"832","4.001837","151.101.1.140","100.86.243.187","TLSv1.2","166","Application Data"
"833","4.001928","100.86.243.187","151.101.1.140","TCP","66","56520  >  443 [ACK] Seq=798 Ack=24873 Win=2883 Len=0 TSval=2085256996 TSecr=2144785070"
"835","4.002016","151.101.1.140","100.86.243.187","TCP","1510","443  >  56520 [ACK] Seq=24873 Ack=798 Win=296 Len=1444 TSval=2144785070 TSecr=2085256982 [TCP PDU reassembled in 836]"
"836","4.002017","151.101.1.140","100.86.243.187","TLSv1.2","1428","Application Data"
"837","4.002090","100.86.243.187","151.101.1.140","TCP","66","56520  >  443 [ACK] Seq=798 Ack=27679 Win=2841 Len=0 TSval=2085256996 TSecr=2144785070"
"843","4.008273","151.101.1.140","100.86.243.187","TLSv1.2","376","Application Data"
"844","4.008274","151.101.1.140","100.86.243.187","TCP","1510","443  >  56509 [ACK] Seq=1780 Ack=288 Win=424 Len=1444 TSval=3914430502 TSecr=514131023 [TCP PDU reassembled in 865]"
"845","4.008275","151.101.1.140","100.86.243.187","TCP","1510","443  >  56509 [PSH, ACK] Seq=3224 Ack=288 Win=424 Len=1444 TSval=3914430502 TSecr=514131023 [TCP PDU reassembled in 865]"
"846","4.008276","151.101.1.140","100.86.243.187","TCP","1510","443  >  56509 [ACK] Seq=4668 Ack=288 Win=424 Len=1444 TSval=3914430505 TSecr=514131023 [TCP PDU reassembled in 865]"
"847","4.008276","151.101.1.140","100.86.243.187","TCP","1510","443  >  56509 [PSH, ACK] Seq=6112 Ack=288 Win=424 Len=1444 TSval=3914430505 TSecr=514131023 [TCP PDU reassembled in 865]"
"848","4.008391","100.86.243.187","151.101.1.140","TCP","66","56509  >  443 [ACK] Seq=288 Ack=7556 Win=6930 Len=0 TSval=514131045 TSecr=3914430505"
"849","4.008721","100.86.243.187","151.101.1.140","TCP","66","[TCP Window Update] 56509  >  443 [ACK] Seq=288 Ack=7556 Win=7025 Len=0 TSval=514131045 TSecr=3914430505"
"850","4.008767","151.101.1.140","100.86.243.187","TCP","1510","443  >  56509 [ACK] Seq=7556 Ack=288 Win=424 Len=1444 TSval=3914430507 TSecr=514131023 [TCP PDU reassembled in 865]"
"851","4.008818","100.86.243.187","151.101.1.140","TCP","66","56509  >  443 [ACK] Seq=288 Ack=9000 Win=7002 Len=0 TSval=514131045 TSecr=3914430507"
"852","4.009478","151.101.1.140","100.86.243.187","TCP","1510","443  >  56509 [PSH, ACK] Seq=9000 Ack=288 Win=424 Len=1444 TSval=3914430507 TSecr=514131023 [TCP PDU reassembled in 865]"
"853","4.009540","100.86.243.187","151.101.1.140","TCP","66","56509  >  443 [ACK] Seq=288 Ack=10444 Win=7002 Len=0 TSval=514131046 TSecr=3914430507"
"855","4.009978","100.86.243.187","151.101.1.140","TLSv1.2","163","Application Data"
"856","4.010933","151.101.1.140","100.86.243.187","TCP","1510","443  >  56509 [ACK] Seq=10444 Ack=288 Win=424 Len=1444 TSval=3914430509 TSecr=514131023 [TCP PDU reassembled in 865]"
"857","4.011009","100.86.243.187","151.101.1.140","TCP","66","56509  >  443 [ACK] Seq=385 Ack=11888 Win=7002 Len=0 TSval=514131048 TSecr=3914430509"
"860","4.020338","151.101.1.140","100.86.243.187","TCP","1510","443  >  56509 [ACK] Seq=11888 Ack=288 Win=424 Len=1444 TSval=3914430518 TSecr=514131046 [TCP PDU reassembled in 865]"
"861","4.020339","151.101.1.140","100.86.243.187","TCP","1510","443  >  56509 [PSH, ACK] Seq=13332 Ack=288 Win=424 Len=1444 TSval=3914430518 TSecr=514131046 [TCP PDU reassembled in 865]"
"863","4.020458","100.86.243.187","151.101.1.140","TCP","66","56509  >  443 [ACK] Seq=385 Ack=14776 Win=6980 Len=0 TSval=514131057 TSecr=3914430518"
"864","4.023062","151.101.1.140","100.86.243.187","TCP","1510","443  >  56509 [ACK] Seq=14776 Ack=288 Win=424 Len=1444 TSval=3914430519 TSecr=514131046 [TCP PDU reassembled in 865]"
"865","4.023064","151.101.1.140","100.86.243.187","TLSv1.2","1510","Application Data"
"867","4.023094","151.101.1.140","100.86.243.187","TCP","1510","443  >  56509 [ACK] Seq=17664 Ack=288 Win=424 Len=1444 TSval=3914430521 TSecr=514131046 [TCP PDU reassembled in 887]"
"868","4.023172","100.86.243.187","151.101.1.140","TCP","66","56509  >  443 [ACK] Seq=385 Ack=17664 Win=6980 Len=0 TSval=514131060 TSecr=3914430519"
"869","4.023286","100.86.243.187","151.101.1.140","TCP","66","56509  >  443 [ACK] Seq=385 Ack=19108 Win=6986 Len=0 TSval=514131060 TSecr=3914430521"
"871","4.024370","151.101.1.140","100.86.243.187","TCP","1510","443  >  56509 [PSH, ACK] Seq=19108 Ack=288 Win=424 Len=1444 TSval=3914430521 TSecr=514131046 [TCP PDU reassembled in 887]"
"872","4.024461","100.86.243.187","151.101.1.140","TCP","66","56509  >  443 [ACK] Seq=385 Ack=20552 Win=7002 Len=0 TSval=514131061 TSecr=3914430521"
"873","4.025769","151.101.1.140","100.86.243.187","TCP","1510","443  >  56509 [ACK] Seq=20552 Ack=385 Win=424 Len=1444 TSval=3914430523 TSecr=514131046 [TCP PDU reassembled in 887]"
"874","4.025877","100.86.243.187","151.101.1.140","TCP","66","56509  >  443 [ACK] Seq=385 Ack=21996 Win=7002 Len=0 TSval=514131063 TSecr=3914430523"
"875","4.026549","151.101.1.140","100.86.243.187","TCP","1510","443  >  56509 [PSH, ACK] Seq=21996 Ack=385 Win=424 Len=1444 TSval=3914430523 TSecr=514131046 [TCP PDU reassembled in 887]"
"876","4.026633","100.86.243.187","151.101.1.140","TCP","66","56509  >  443 [ACK] Seq=385 Ack=23440 Win=7002 Len=0 TSval=514131063 TSecr=3914430523"
"877","4.027262","151.101.1.140","100.86.243.187","TCP","1510","443  >  56509 [ACK] Seq=23440 Ack=385 Win=424 Len=1444 TSval=3914430525 TSecr=514131048 [TCP PDU reassembled in 887]"
"878","4.027356","100.86.243.187","151.101.1.140","TCP","66","56509  >  443 [ACK] Seq=385 Ack=24884 Win=7002 Len=0 TSval=514131064 TSecr=3914430525"
"879","4.030820","151.101.1.140","100.86.243.187","TCP","1510","443  >  56509 [ACK] Seq=24884 Ack=385 Win=424 Len=1444 TSval=3914430528 TSecr=514131057 [TCP PDU reassembled in 887]"
"880","4.030905","100.86.243.187","151.101.1.140","TCP","66","56509  >  443 [ACK] Seq=385 Ack=26328 Win=7002 Len=0 TSval=514131068 TSecr=3914430528"
"881","4.031722","151.101.1.140","100.86.243.187","TCP","1510","443  >  56509 [PSH, ACK] Seq=26328 Ack=385 Win=424 Len=1444 TSval=3914430528 TSecr=514131057 [TCP PDU reassembled in 887]"
"882","4.031830","100.86.243.187","151.101.1.140","TCP","66","56509  >  443 [ACK] Seq=385 Ack=27772 Win=7002 Len=0 TSval=514131068 TSecr=3914430528"
"883","4.034199","151.101.1.140","100.86.243.187","TCP","1510","443  >  56509 [ACK] Seq=27772 Ack=385 Win=424 Len=1444 TSval=3914430531 TSecr=514131060 [TCP PDU reassembled in 887]"
"884","4.034304","100.86.243.187","151.101.1.140","TCP","66","56509  >  443 [ACK] Seq=385 Ack=29216 Win=7002 Len=0 TSval=514131071 TSecr=3914430531"
"885","4.034727","151.101.1.140","100.86.243.187","TCP","1510","443  >  56509 [PSH, ACK] Seq=29216 Ack=385 Win=424 Len=1444 TSval=3914430531 TSecr=514131060 [TCP PDU reassembled in 887]"
"886","4.034728","151.101.1.140","100.86.243.187","TCP","1510","443  >  56509 [ACK] Seq=30660 Ack=385 Win=424 Len=1444 TSval=3914430532 TSecr=514131061 [TCP PDU reassembled in 887]"
"887","4.034729","151.101.1.140","100.86.243.187","TLSv1.2","1510","Application Data"
"888","4.034789","100.86.243.187","151.101.1.140","TCP","66","56509  >  443 [ACK] Seq=385 Ack=33548 Win=6957 Len=0 TSval=514131071 TSecr=3914430532"
"889","4.034978","100.86.243.187","151.101.1.140","TCP","66","[TCP Window Update] 56509  >  443 [ACK] Seq=385 Ack=33548 Win=7025 Len=0 TSval=514131071 TSecr=3914430532"
"890","4.037572","151.101.1.140","100.86.243.187","TCP","1510","443  >  56509 [ACK] Seq=33548 Ack=385 Win=424 Len=1444 TSval=3914430535 TSecr=514131064 [TCP PDU reassembled in 906]"
"891","4.037665","100.86.243.187","151.101.1.140","TCP","66","56509  >  443 [ACK] Seq=385 Ack=34992 Win=7002 Len=0 TSval=514131074 TSecr=3914430535"
"892","4.038036","151.101.1.140","100.86.243.187","TCP","1510","443  >  56509 [PSH, ACK] Seq=34992 Ack=385 Win=424 Len=1444 TSval=3914430535 TSecr=514131064 [TCP PDU reassembled in 906]"
"893","4.038132","100.86.243.187","151.101.1.140","TCP","66","56509  >  443 [ACK] Seq=385 Ack=36436 Win=7025 Len=0 TSval=514131074 TSecr=3914430535"
"894","4.040806","151.101.1.140","100.86.243.187","TCP","1510","443  >  56509 [ACK] Seq=36436 Ack=385 Win=424 Len=1444 TSval=3914430539 TSecr=514131068 [TCP PDU reassembled in 906]"
"895","4.041808","151.101.1.140","100.86.243.187","TCP","1510","443  >  56509 [PSH, ACK] Seq=37880 Ack=385 Win=424 Len=1444 TSval=3914430539 TSecr=514131068 [TCP PDU reassembled in 906]"
"896","4.041953","100.86.243.187","151.101.1.140","TCP","66","56509  >  443 [ACK] Seq=385 Ack=39324 Win=7025 Len=0 TSval=514131079 TSecr=3914430539"
"897","4.044533","151.101.1.140","100.86.243.187","TCP","1510","443  >  56509 [ACK] Seq=39324 Ack=385 Win=424 Len=1444 TSval=3914430542 TSecr=514131071 [TCP PDU reassembled in 906]"
"898","4.045401","151.101.1.140","100.86.243.187","TCP","1510","443  >  56509 [PSH, ACK] Seq=40768 Ack=385 Win=424 Len=1444 TSval=3914430542 TSecr=514131071 [TCP PDU reassembled in 906]"
"899","4.045580","100.86.243.187","151.101.1.140","TCP","66","56509  >  443 [ACK] Seq=385 Ack=42212 Win=7025 Len=0 TSval=514131081 TSecr=3914430542"
"900","4.045735","151.101.1.140","100.86.243.187","TCP","1510","443  >  56509 [ACK] Seq=42212 Ack=385 Win=424 Len=1444 TSval=3914430543 TSecr=514131071 [TCP PDU reassembled in 906]"
"901","4.045736","151.101.1.140","100.86.243.187","TCP","1510","443  >  56509 [PSH, ACK] Seq=43656 Ack=385 Win=424 Len=1444 TSval=3914430543 TSecr=514131071 [TCP PDU reassembled in 906]"
"902","4.045867","100.86.243.187","151.101.1.140","TCP","66","56509  >  443 [ACK] Seq=385 Ack=45100 Win=7025 Len=0 TSval=514131083 TSecr=3914430543"
"903","4.048220","151.101.1.140","100.86.243.187","TCP","1510","443  >  56509 [ACK] Seq=45100 Ack=385 Win=424 Len=1444 TSval=3914430546 TSecr=514131074 [TCP PDU reassembled in 906]"
"904","4.048247","151.101.1.140","100.86.243.187","TCP","1510","443  >  56509 [PSH, ACK] Seq=46544 Ack=385 Win=424 Len=1444 TSval=3914430546 TSecr=514131074 [TCP PDU reassembled in 906]"
"905","4.048356","100.86.243.187","151.101.1.140","TCP","66","56509  >  443 [ACK] Seq=385 Ack=47988 Win=7025 Len=0 TSval=514131085 TSecr=3914430546"
"906","4.052235","151.101.1.140","100.86.243.187","TLSv1.2","1510","Application Data"
"907","4.052720","151.101.1.140","100.86.243.187","TCP","1510","443  >  56509 [PSH, ACK] Seq=49432 Ack=385 Win=424 Len=1444 TSval=3914430550 TSecr=514131079 [TCP PDU reassembled in 924]"
"908","4.052848","100.86.243.187","151.101.1.140","TCP","66","56509  >  443 [ACK] Seq=385 Ack=50876 Win=7025 Len=0 TSval=514131089 TSecr=3914430550"
"909","4.055125","151.101.1.140","100.86.243.187","TCP","1510","443  >  56509 [ACK] Seq=50876 Ack=385 Win=424 Len=1444 TSval=3914430553 TSecr=514131081 [TCP PDU reassembled in 924]"
"910","4.055127","151.101.1.140","100.86.243.187","TCP","1510","443  >  56509 [PSH, ACK] Seq=52320 Ack=385 Win=424 Len=1444 TSval=3914430553 TSecr=514131081 [TCP PDU reassembled in 924]"
"911","4.055285","100.86.243.187","151.101.1.140","TCP","66","56509  >  443 [ACK] Seq=385 Ack=53764 Win=7025 Len=0 TSval=514131092 TSecr=3914430553"
"912","4.055804","151.101.1.140","100.86.243.187","TCP","1510","443  >  56509 [ACK] Seq=53764 Ack=385 Win=424 Len=1444 TSval=3914430554 TSecr=514131081 [TCP PDU reassembled in 924]"
"913","4.056032","151.101.1.140","100.86.243.187","TCP","1510","443  >  56509 [PSH, ACK] Seq=55208 Ack=385 Win=424 Len=1444 TSval=3914430554 TSecr=514131081 [TCP PDU reassembled in 924]"
"914","4.056112","100.86.243.187","151.101.1.140","TCP","66","56509  >  443 [ACK] Seq=385 Ack=56652 Win=7025 Len=0 TSval=514131092 TSecr=3914430554"
"915","4.057892","151.101.1.140","100.86.243.187","TCP","1510","443  >  56509 [ACK] Seq=56652 Ack=385 Win=424 Len=1444 TSval=3914430556 TSecr=514131083 [TCP PDU reassembled in 924]"
"916","4.058066","151.101.1.140","100.86.243.187","TCP","1510","443  >  56509 [PSH, ACK] Seq=58096 Ack=385 Win=424 Len=1444 TSval=3914430556 TSecr=514131083 [TCP PDU reassembled in 924]"
"917","4.058172","100.86.243.187","151.101.1.140","TCP","66","56509  >  443 [ACK] Seq=385 Ack=59540 Win=7025 Len=0 TSval=514131095 TSecr=3914430556"
"918","4.059308","151.101.1.140","100.86.243.187","TCP","1510","443  >  56509 [ACK] Seq=59540 Ack=385 Win=424 Len=1444 TSval=3914430558 TSecr=514131085 [TCP PDU reassembled in 924]"
"919","4.059803","151.101.1.140","100.86.243.187","TCP","1510","443  >  56509 [PSH, ACK] Seq=60984 Ack=385 Win=424 Len=1444 TSval=3914430558 TSecr=514131085 [TCP PDU reassembled in 924]"
"920","4.059932","100.86.243.187","151.101.1.140","TCP","66","56509  >  443 [ACK] Seq=385 Ack=62428 Win=7025 Len=0 TSval=514131096 TSecr=3914430558"
"921","4.062909","151.101.1.140","100.86.243.187","TCP","1510","443  >  56509 [ACK] Seq=62428 Ack=385 Win=424 Len=1444 TSval=3914430561 TSecr=514131089 [TCP PDU reassembled in 924]"
"922","4.063563","151.101.1.140","100.86.243.187","TCP","1510","443  >  56509 [PSH, ACK] Seq=63872 Ack=385 Win=424 Len=1444 TSval=3914430561 TSecr=514131089 [TCP PDU reassembled in 924]"
"923","4.063710","100.86.243.187","151.101.1.140","TCP","66","56509  >  443 [ACK] Seq=385 Ack=65316 Win=7025 Len=0 TSval=514131100 TSecr=3914430561"
"924","4.064411","151.101.1.140","100.86.243.187","TLSv1.2","1510","Application Data, Application Data"
"925","4.065455","151.101.1.140","100.86.243.187","TCP","1510","443  >  56509 [PSH, ACK] Seq=66760 Ack=385 Win=424 Len=1444 TSval=3914430563 TSecr=514131092 [TCP PDU reassembled in 940]"
"926","4.065595","100.86.243.187","151.101.1.140","TCP","66","56509  >  443 [ACK] Seq=385 Ack=68204 Win=7025 Len=0 TSval=514131102 TSecr=3914430563"
"927","4.066713","151.101.1.140","100.86.243.187","TCP","1510","443  >  56509 [ACK] Seq=68204 Ack=385 Win=424 Len=1444 TSval=3914430565 TSecr=514131092 [TCP PDU reassembled in 940]"
"928","4.070107","151.101.1.140","100.86.243.187","TCP","1510","443  >  56509 [PSH, ACK] Seq=69648 Ack=385 Win=424 Len=1444 TSval=3914430565 TSecr=514131092 [TCP PDU reassembled in 940]"
"929","4.070110","151.101.1.140","100.86.243.187","TCP","1510","443  >  56509 [ACK] Seq=71092 Ack=385 Win=424 Len=1444 TSval=3914430567 TSecr=514131095 [TCP PDU reassembled in 940]"
"930","4.070111","151.101.1.140","100.86.243.187","TCP","1510","443  >  56509 [PSH, ACK] Seq=72536 Ack=385 Win=424 Len=1444 TSval=3914430567 TSecr=514131095 [TCP PDU reassembled in 940]"
"931","4.070326","100.86.243.187","151.101.1.140","TCP","66","56509  >  443 [ACK] Seq=385 Ack=73980 Win=7025 Len=0 TSval=514131107 TSecr=3914430565"
"932","4.071540","151.101.1.140","100.86.243.187","TCP","1510","443  >  56509 [ACK] Seq=73980 Ack=385 Win=424 Len=1444 TSval=3914430568 TSecr=514131096 [TCP PDU reassembled in 940]"
"933","4.071541","151.101.1.140","100.86.243.187","TCP","1510","443  >  56509 [PSH, ACK] Seq=75424 Ack=385 Win=424 Len=1444 TSval=3914430568 TSecr=514131096 [TCP PDU reassembled in 940]"
"934","4.071694","100.86.243.187","151.101.1.140","TCP","66","56509  >  443 [ACK] Seq=385 Ack=76868 Win=7025 Len=0 TSval=514131108 TSecr=3914430568"
"935","4.072926","100.86.243.187","151.101.1.140","TLSv1.2","101","Application Data"
"936","4.073470","151.101.1.140","100.86.243.187","TCP","1510","443  >  56509 [ACK] Seq=76868 Ack=385 Win=424 Len=1444 TSval=3914430572 TSecr=514131100 [TCP PDU reassembled in 940]"
"937","4.073794","151.101.1.140","100.86.243.187","TCP","1510","443  >  56509 [PSH, ACK] Seq=78312 Ack=385 Win=424 Len=1444 TSval=3914430572 TSecr=514131100 [TCP PDU reassembled in 940]"
"938","4.074434","100.86.243.187","151.101.1.140","TCP","66","56509  >  443 [ACK] Seq=420 Ack=79756 Win=7025 Len=0 TSval=514131110 TSecr=3914430572"
"939","4.076068","151.101.1.140","100.86.243.187","TCP","1510","443  >  56509 [ACK] Seq=79756 Ack=385 Win=424 Len=1444 TSval=3914430574 TSecr=514131102 [TCP PDU reassembled in 940]"
"940","4.076104","151.101.1.140","100.86.243.187","TLSv1.2","1510","Application Data"
"941","4.076304","100.86.243.187","151.101.1.140","TCP","66","56509  >  443 [ACK] Seq=420 Ack=82644 Win=7025 Len=0 TSval=514131113 TSecr=3914430574"
"942","4.081406","151.101.1.140","100.86.243.187","TCP","1510","[TCP Previous segment not captured] 443  >  56509 [PSH, ACK] Seq=84088 Ack=385 Win=424 Len=1444 TSval=3914430579 TSecr=514131107 [TCP PDU reassembled in 964]"
"943","4.081441","151.101.1.140","100.86.243.187","TCP","1510","443  >  56509 [ACK] Seq=85532 Ack=385 Win=424 Len=1444 TSval=3914430579 TSecr=514131107 [TCP PDU reassembled in 964]"
"944","4.081501","100.86.243.187","151.101.1.140","TCP","78","[TCP Dup ACK 941#1] 56509  >  443 [ACK] Seq=420 Ack=82644 Win=7025 Len=0 TSval=514131118 TSecr=3914430574 SLE=84088 SRE=85532"
"945","4.081569","100.86.243.187","151.101.1.140","TCP","78","[TCP Dup ACK 941#2] 56509  >  443 [ACK] Seq=420 Ack=82644 Win=7025 Len=0 TSval=514131118 TSecr=3914430574 SLE=84088 SRE=86976"
"946","4.082920","151.101.1.140","100.86.243.187","TCP","1510","443  >  56509 [PSH, ACK] Seq=86976 Ack=385 Win=424 Len=1444 TSval=3914430579 TSecr=514131107 [TCP PDU reassembled in 964]"
"947","4.083019","100.86.243.187","151.101.1.140","TCP","78","[TCP Dup ACK 941#3] 56509  >  443 [ACK] Seq=420 Ack=82644 Win=7025 Len=0 TSval=514131120 TSecr=3914430574 SLE=84088 SRE=88420"
"948","4.083216","151.101.1.140","100.86.243.187","TCP","1510","443  >  56509 [ACK] Seq=88420 Ack=385 Win=424 Len=1444 TSval=3914430581 TSecr=514131108 [TCP PDU reassembled in 964]"
"949","4.083216","151.101.1.140","100.86.243.187","TCP","1510","443  >  56509 [PSH, ACK] Seq=89864 Ack=385 Win=424 Len=1444 TSval=3914430581 TSecr=514131108 [TCP PDU reassembled in 964]"
"950","4.083271","100.86.243.187","151.101.1.140","TCP","78","[TCP Dup ACK 941#4] 56509  >  443 [ACK] Seq=420 Ack=82644 Win=7025 Len=0 TSval=514131120 TSecr=3914430574 SLE=84088 SRE=91308"
"951","4.085069","151.101.1.140","100.86.243.187","TCP","1510","443  >  56509 [ACK] Seq=91308 Ack=420 Win=424 Len=1444 TSval=3914430583 TSecr=514131110 [TCP PDU reassembled in 964]"
"952","4.085190","100.86.243.187","151.101.1.140","TCP","78","[TCP Dup ACK 941#5] 56509  >  443 [ACK] Seq=420 Ack=82644 Win=7025 Len=0 TSval=514131122 TSecr=3914430574 SLE=84088 SRE=92752"
"953","4.085724","151.101.1.140","100.86.243.187","TCP","1510","443  >  56509 [PSH, ACK] Seq=92752 Ack=420 Win=424 Len=1444 TSval=3914430583 TSecr=514131110 [TCP PDU reassembled in 964]"
"954","4.085804","100.86.243.187","151.101.1.140","TCP","78","[TCP Dup ACK 941#6] 56509  >  443 [ACK] Seq=420 Ack=82644 Win=7025 Len=0 TSval=514131122 TSecr=3914430574 SLE=84088 SRE=94196"
"955","4.087284","151.101.1.140","100.86.243.187","TCP","1510","443  >  56509 [ACK] Seq=94196 Ack=420 Win=424 Len=1444 TSval=3914430585 TSecr=514131113 [TCP PDU reassembled in 964]"
"956","4.087372","100.86.243.187","151.101.1.140","TCP","78","[TCP Dup ACK 941#7] 56509  >  443 [ACK] Seq=420 Ack=82644 Win=7025 Len=0 TSval=514131124 TSecr=3914430574 SLE=84088 SRE=95640"
"957","4.088151","151.101.1.140","100.86.243.187","TCP","1510","443  >  56509 [PSH, ACK] Seq=95640 Ack=420 Win=424 Len=1444 TSval=3914430585 TSecr=514131113 [TCP PDU reassembled in 964]"
"958","4.088243","100.86.243.187","151.101.1.140","TCP","78","[TCP Dup ACK 941#8] 56509  >  443 [ACK] Seq=420 Ack=82644 Win=7025 Len=0 TSval=514131124 TSecr=3914430574 SLE=84088 SRE=97084"
"959","4.093139","151.101.1.140","100.86.243.187","TCP","1510","443  >  56509 [ACK] Seq=97084 Ack=420 Win=424 Len=1444 TSval=3914430590 TSecr=514131118 [TCP PDU reassembled in 964]"
"960","4.093241","100.86.243.187","151.101.1.140","TCP","78","[TCP Dup ACK 941#9] 56509  >  443 [ACK] Seq=420 Ack=82644 Win=7025 Len=0 TSval=514131130 TSecr=3914430574 SLE=84088 SRE=98528"
"961","4.095985","151.101.1.140","100.86.243.187","TCP","1510","[TCP Fast Retransmission] 443  >  56509 [ACK] Seq=82644 Ack=420 Win=424 Len=1444 TSval=3914430591 TSecr=514131120 [TCP PDU reassembled in 964]"
"962","4.096083","100.86.243.187","151.101.1.140","TCP","66","56509  >  443 [ACK] Seq=420 Ack=98528 Win=6777 Len=0 TSval=514131133 TSecr=3914430591"
"963","4.096180","100.86.243.187","151.101.1.140","TCP","66","[TCP Window Update] 56509  >  443 [ACK] Seq=420 Ack=98528 Win=7025 Len=0 TSval=514131133 TSecr=3914430591"
"964","4.096356","151.101.1.140","100.86.243.187","TLSv1.2","1510","Application Data"
"965","4.096357","151.101.1.140","100.86.243.187","TCP","1510","443  >  56509 [ACK] Seq=99972 Ack=420 Win=424 Len=1444 TSval=3914430594 TSecr=514131122 [TCP PDU reassembled in 983]"
"966","4.096413","100.86.243.187","151.101.1.140","TCP","66","56509  >  443 [ACK] Seq=420 Ack=101416 Win=6980 Len=0 TSval=514131133 TSecr=3914430594"
"967","4.096649","151.101.1.140","100.86.243.187","TCP","1510","443  >  56509 [ACK] Seq=101416 Ack=420 Win=424 Len=1444 TSval=3914430594 TSecr=514131122 [TCP PDU reassembled in 983]"
"968","4.096710","100.86.243.187","151.101.1.140","TCP","66","56509  >  443 [ACK] Seq=420 Ack=102860 Win=7002 Len=0 TSval=514131133 TSecr=3914430594"
"969","4.097608","151.101.1.140","100.86.243.187","TCP","1510","443  >  56509 [ACK] Seq=102860 Ack=420 Win=424 Len=1444 TSval=3914430596 TSecr=514131124 [TCP PDU reassembled in 983]"
"970","4.097707","100.86.243.187","151.101.1.140","TCP","66","56509  >  443 [ACK] Seq=420 Ack=104304 Win=7002 Len=0 TSval=514131135 TSecr=3914430596"
"971","4.097785","151.101.1.140","100.86.243.187","TCP","1510","443  >  56509 [ACK] Seq=104304 Ack=420 Win=424 Len=1444 TSval=3914430596 TSecr=514131124 [TCP PDU reassembled in 983]"
"972","4.097837","100.86.243.187","151.101.1.140","TCP","66","56509  >  443 [ACK] Seq=420 Ack=105748 Win=7002 Len=0 TSval=514131135 TSecr=3914430596"
"973","4.103032","151.101.1.140","100.86.243.187","TCP","1510","443  >  56509 [ACK] Seq=105748 Ack=420 Win=424 Len=1444 TSval=3914430601 TSecr=514131130 [TCP PDU reassembled in 983]"
"974","4.103135","100.86.243.187","151.101.1.140","TCP","66","56509  >  443 [ACK] Seq=420 Ack=107192 Win=7002 Len=0 TSval=514131140 TSecr=3914430601"
"975","4.105299","151.101.1.140","100.86.243.187","TCP","1510","443  >  56509 [ACK] Seq=107192 Ack=420 Win=424 Len=1444 TSval=3914430603 TSecr=514131133 [TCP PDU reassembled in 983]"
"976","4.105411","100.86.243.187","151.101.1.140","TCP","66","56509  >  443 [ACK] Seq=420 Ack=108636 Win=7002 Len=0 TSval=514131142 TSecr=3914430603"
"977","4.106450","151.101.1.140","100.86.243.187","TCP","1510","443  >  56509 [ACK] Seq=108636 Ack=420 Win=424 Len=1444 TSval=3914430604 TSecr=514131133 [TCP PDU reassembled in 983]"
"978","4.106555","100.86.243.187","151.101.1.140","TCP","66","56509  >  443 [ACK] Seq=420 Ack=110080 Win=7002 Len=0 TSval=514131143 TSecr=3914430604"
"979","4.107386","151.101.1.140","100.86.243.187","TCP","1510","443  >  56509 [PSH, ACK] Seq=110080 Ack=420 Win=424 Len=1444 TSval=3914430604 TSecr=514131133 [TCP PDU reassembled in 983]"
"980","4.107464","100.86.243.187","151.101.1.140","TCP","66","56509  >  443 [ACK] Seq=420 Ack=111524 Win=7002 Len=0 TSval=514131143 TSecr=3914430604"
"981","4.110744","151.101.1.140","100.86.243.187","TCP","1510","443  >  56509 [ACK] Seq=111524 Ack=420 Win=424 Len=1444 TSval=3914430607 TSecr=514131135 [TCP PDU reassembled in 983]"
"982","4.110848","100.86.243.187","151.101.1.140","TCP","66","56509  >  443 [ACK] Seq=420 Ack=112968 Win=7002 Len=0 TSval=514131148 TSecr=3914430607"
"983","4.111311","151.101.1.140","100.86.243.187","TLSv1.2","1510","Application Data"
"984","4.111312","151.101.1.140","100.86.243.187","TCP","1510","443  >  56509 [ACK] Seq=114412 Ack=420 Win=424 Len=1444 TSval=3914430609 TSecr=514131135 [TCP PDU reassembled in 1004]"
"985","4.111406","100.86.243.187","151.101.1.140","TCP","66","56509  >  443 [ACK] Seq=420 Ack=115856 Win=6980 Len=0 TSval=514131148 TSecr=3914430609"
"986","4.112260","151.101.1.140","100.86.243.187","TCP","1510","443  >  56509 [ACK] Seq=115856 Ack=420 Win=424 Len=1444 TSval=3914430611 TSecr=514131140 [TCP PDU reassembled in 1004]"
"987","4.112355","100.86.243.187","151.101.1.140","TCP","66","56509  >  443 [ACK] Seq=420 Ack=117300 Win=7002 Len=0 TSval=514131149 TSecr=3914430611"
"988","4.113076","151.101.1.140","100.86.243.187","TCP","1510","443  >  56509 [PSH, ACK] Seq=117300 Ack=420 Win=424 Len=1444 TSval=3914430611 TSecr=514131140 [TCP PDU reassembled in 1004]"
"989","4.113162","100.86.243.187","151.101.1.140","TCP","66","56509  >  443 [ACK] Seq=420 Ack=118744 Win=7002 Len=0 TSval=514131149 TSecr=3914430611"
"990","4.116317","151.101.1.140","100.86.243.187","TCP","1510","443  >  56509 [ACK] Seq=118744 Ack=420 Win=424 Len=1444 TSval=3914430614 TSecr=514131143 [TCP PDU reassembled in 1004]"
"991","4.116416","100.86.243.187","151.101.1.140","TCP","66","56509  >  443 [ACK] Seq=420 Ack=120188 Win=7002 Len=0 TSval=514131153 TSecr=3914430614"
"992","4.117051","151.101.1.140","100.86.243.187","TCP","1510","443  >  56509 [PSH, ACK] Seq=120188 Ack=420 Win=424 Len=1444 TSval=3914430614 TSecr=514131143 [TCP PDU reassembled in 1004]"
"993","4.117139","100.86.243.187","151.101.1.140","TCP","66","56509  >  443 [ACK] Seq=420 Ack=121632 Win=7002 Len=0 TSval=514131153 TSecr=3914430614"
"994","4.120646","151.101.1.140","100.86.243.187","TCP","1510","443  >  56509 [ACK] Seq=121632 Ack=420 Win=424 Len=1444 TSval=3914430619 TSecr=514131148 [TCP PDU reassembled in 1004]"
"995","4.120749","100.86.243.187","151.101.1.140","TCP","66","56509  >  443 [ACK] Seq=420 Ack=123076 Win=7002 Len=0 TSval=514131158 TSecr=3914430619"
"996","4.120868","151.101.1.140","100.86.243.187","TCP","1510","443  >  56509 [PSH, ACK] Seq=123076 Ack=420 Win=424 Len=1444 TSval=3914430619 TSecr=514131148 [TCP PDU reassembled in 1004]"
"997","4.120958","100.86.243.187","151.101.1.140","TCP","66","56509  >  443 [ACK] Seq=420 Ack=124520 Win=7025 Len=0 TSval=514131158 TSecr=3914430619"
"998","4.121440","151.101.1.140","100.86.243.187","TCP","1510","443  >  56509 [ACK] Seq=124520 Ack=420 Win=424 Len=1444 TSval=3914430620 TSecr=514131148 [TCP PDU reassembled in 1004]"
"999","4.121703","151.101.1.140","100.86.243.187","TCP","1510","443  >  56509 [PSH, ACK] Seq=125964 Ack=420 Win=424 Len=1444 TSval=3914430620 TSecr=514131148 [TCP PDU reassembled in 1004]"
"1000","4.121815","100.86.243.187","151.101.1.140","TCP","66","56509  >  443 [ACK] Seq=420 Ack=127408 Win=7025 Len=0 TSval=514131159 TSecr=3914430620"
"1001","4.124132","151.101.1.140","100.86.243.187","TCP","1510","443  >  56509 [ACK] Seq=127408 Ack=420 Win=424 Len=1444 TSval=3914430622 TSecr=514131149 [TCP PDU reassembled in 1004]"
"1002","4.125112","151.101.1.140","100.86.243.187","TCP","1510","443  >  56509 [PSH, ACK] Seq=128852 Ack=420 Win=424 Len=1444 TSval=3914430622 TSecr=514131149 [TCP PDU reassembled in 1004]"
"1003","4.125285","100.86.243.187","151.101.1.140","TCP","66","56509  >  443 [ACK] Seq=420 Ack=130296 Win=7025 Len=0 TSval=514131162 TSecr=3914430622"
"1004","4.127142","151.101.1.140","100.86.243.187","TLSv1.2","1510","Application Data"
"1005","4.127165","151.101.1.140","100.86.243.187","TCP","1510","443  >  56509 [PSH, ACK] Seq=131740 Ack=420 Win=424 Len=1444 TSval=3914430625 TSecr=514131153 [TCP PDU reassembled in 1016]"
"1006","4.127377","100.86.243.187","151.101.1.140","TCP","66","56509  >  443 [ACK] Seq=420 Ack=133184 Win=7025 Len=0 TSval=514131164 TSecr=3914430625"
"1007","4.132145","151.101.1.140","100.86.243.187","TCP","1510","443  >  56509 [ACK] Seq=133184 Ack=420 Win=424 Len=1444 TSval=3914430630 TSecr=514131159 [TCP PDU reassembled in 1016]"
"1008","4.132178","151.101.1.140","100.86.243.187","TCP","1510","443  >  56509 [PSH, ACK] Seq=134628 Ack=420 Win=424 Len=1444 TSval=3914430630 TSecr=514131159 [TCP PDU reassembled in 1016]"
"1009","4.132287","100.86.243.187","151.101.1.140","TCP","66","56509  >  443 [ACK] Seq=420 Ack=136072 Win=7025 Len=0 TSval=514131169 TSecr=3914430630"
"1010","4.133014","151.101.1.140","100.86.243.187","TCP","1510","443  >  56509 [ACK] Seq=136072 Ack=420 Win=424 Len=1444 TSval=3914430631 TSecr=514131159 [TCP PDU reassembled in 1016]"
"1011","4.134791","151.101.1.140","100.86.243.187","TCP","1510","443  >  56509 [PSH, ACK] Seq=137516 Ack=420 Win=424 Len=1444 TSval=3914430631 TSecr=514131159 [TCP PDU reassembled in 1016]"
"1012","4.134914","100.86.243.187","151.101.1.140","TCP","66","56509  >  443 [ACK] Seq=420 Ack=138960 Win=7025 Len=0 TSval=514131172 TSecr=3914430631"
"1013","4.135603","151.101.1.140","100.86.243.187","TCP","1510","443  >  56509 [ACK] Seq=138960 Ack=420 Win=424 Len=1444 TSval=3914430634 TSecr=514131162 [TCP PDU reassembled in 1016]"
"1014","4.135833","151.101.1.140","100.86.243.187","TCP","1510","443  >  56509 [PSH, ACK] Seq=140404 Ack=420 Win=424 Len=1444 TSval=3914430634 TSecr=514131162 [TCP PDU reassembled in 1016]"
"1015","4.135923","100.86.243.187","151.101.1.140","TCP","66","56509  >  443 [ACK] Seq=420 Ack=141848 Win=7025 Len=0 TSval=514131173 TSecr=3914430634"
"1016","4.137782","151.101.1.140","100.86.243.187","TLSv1.2","1510","Application Data"
"1017","4.138422","151.101.1.140","100.86.243.187","TCP","1510","443  >  56509 [PSH, ACK] Seq=143292 Ack=420 Win=424 Len=1444 TSval=3914430636 TSecr=514131164 [TCP PDU reassembled in 1019]"
"1018","4.138532","100.86.243.187","151.101.1.140","TCP","66","56509  >  443 [ACK] Seq=420 Ack=144736 Win=7025 Len=0 TSval=514131175 TSecr=3914430636"
"1019","4.144003","151.101.1.140","100.86.243.187","TLSv1.2","68","Application Data"
"1020","4.144160","100.86.243.187","151.101.1.140","TCP","66","56509  >  443 [ACK] Seq=420 Ack=144738 Win=7025 Len=0 TSval=514131181 TSecr=3914430640"
"1084","4.458636","100.86.243.187","151.101.1.140","TCP","1514","56485  >  443 [ACK] Seq=21544 Ack=120120 Win=3925 Len=1448 TSval=2851224746 TSecr=1266169235 [TCP PDU reassembled in 1086]"
"1085","4.458639","100.86.243.187","151.101.1.140","TCP","1514","56485  >  443 [ACK] Seq=22992 Ack=120120 Win=3925 Len=1448 TSval=2851224746 TSecr=1266169235 [TCP PDU reassembled in 1086]"
"1086","4.458685","100.86.243.187","151.101.1.140","TLSv1.2","82","Application Data"
"1087","4.458741","100.86.243.187","151.101.1.140","TCP","1514","56485  >  443 [ACK] Seq=24456 Ack=120120 Win=3925 Len=1448 TSval=2851224746 TSecr=1266169235 [TCP PDU reassembled in 1088]"
"1088","4.458754","100.86.243.187","151.101.1.140","TLSv1.2","1063","Application Data"
"1093","4.478634","151.101.1.140","100.86.243.187","TCP","66","443  >  56485 [ACK] Seq=120120 Ack=26901 Win=630 Len=0 TSval=1266170241 TSecr=2851224746"
"1102","4.522703","151.101.1.140","100.86.243.187","TCP","1510","443  >  56485 [ACK] Seq=120120 Ack=26901 Win=639 Len=1444 TSval=1266170293 TSecr=2851224746 [TCP PDU reassembled in 1104]"
"1103","4.522824","100.86.243.187","151.101.1.140","TCP","66","56485  >  443 [ACK] Seq=26901 Ack=121564 Win=3903 Len=0 TSval=2851224811 TSecr=1266170293"
"1104","4.524006","151.101.1.140","100.86.243.187","TLSv1.2","905","Application Data"
"1105","4.524075","100.86.243.187","151.101.1.140","TCP","66","56485  >  443 [ACK] Seq=26901 Ack=122403 Win=3912 Len=0 TSval=2851224812 TSecr=1266170293"
"1106","4.524420","151.101.1.140","100.86.243.187","TLSv1.2","209","Application Data"
"1107","4.524488","100.86.243.187","151.101.1.140","TCP","66","56485  >  443 [ACK] Seq=26901 Ack=122546 Win=3923 Len=0 TSval=2851224812 TSecr=1266170293"
"1116","4.679819","100.86.243.187","151.101.1.140","TCP","1514","56485  >  443 [ACK] Seq=26901 Ack=122546 Win=3925 Len=1448 TSval=2851224968 TSecr=1266170293 [TCP PDU reassembled in 1118]"
"1117","4.679821","100.86.243.187","151.101.1.140","TCP","1514","56485  >  443 [ACK] Seq=28349 Ack=122546 Win=3925 Len=1448 TSval=2851224968 TSecr=1266170293 [TCP PDU reassembled in 1118]"
"1118","4.679862","100.86.243.187","151.101.1.140","TLSv1.2","138","Application Data"
"1119","4.679919","100.86.243.187","151.101.1.140","TCP","1514","56485  >  443 [ACK] Seq=29869 Ack=122546 Win=3925 Len=1448 TSval=2851224968 TSecr=1266170293 [TCP PDU reassembled in 1121]"
"1120","4.679920","100.86.243.187","151.101.1.140","TCP","1514","56485  >  443 [ACK] Seq=31317 Ack=122546 Win=3925 Len=1448 TSval=2851224968 TSecr=1266170293 [TCP PDU reassembled in 1121]"
"1121","4.679933","100.86.243.187","151.101.1.140","TLSv1.2","221","Application Data"
"1122","4.691139","151.101.1.140","100.86.243.187","TCP","66","443  >  56485 [ACK] Seq=122546 Ack=32920 Win=629 Len=0 TSval=1266170460 TSecr=2851224968"
"1123","4.716855","151.101.1.140","100.86.243.187","TCP","1510","443  >  56485 [ACK] Seq=122546 Ack=32920 Win=639 Len=1444 TSval=1266170487 TSecr=2851224968 [TCP PDU reassembled in 1125]"
"1124","4.717133","100.86.243.187","151.101.1.140","TCP","66","56485  >  443 [ACK] Seq=32920 Ack=123990 Win=3903 Len=0 TSval=2851225005 TSecr=1266170487"
"1125","4.717495","151.101.1.140","100.86.243.187","TLSv1.2","278","Application Data"
"1126","4.717645","100.86.243.187","151.101.1.140","TCP","66","56485  >  443 [ACK] Seq=32920 Ack=124202 Win=3922 Len=0 TSval=2851225005 TSecr=1266170487"
