"No.","Time","Source","Destination","Protocol","Length","Info"
"31","0.620454","100.86.243.187","151.101.65.140","TCP","78","56492  >  443 [SYN] Seq=0 Win=65535 Len=0 MSS=1460 WS=64 TSval=874255927 TSecr=0 SACK_PERM"
"33","0.636395","151.101.65.140","100.86.243.187","TCP","74","443  >  56492 [SYN, ACK] Seq=0 Ack=1 Win=65535 Len=0 MSS=1460 SACK_PERM TSval=1577772902 TSecr=874255927 WS=512"
"34","0.636477","100.86.243.187","151.101.65.140","TCP","66","56492  >  443 [ACK] Seq=1 Ack=1 Win=131712 Len=0 TSval=874255943 TSecr=1577772902"
"35","0.637162","100.86.243.187","151.101.65.140","TCP","1514","56492  >  443 [ACK] Seq=1 Ack=1 Win=131712 Len=1448 TSval=874255943 TSecr=1577772902 [TCP PDU reassembled in 36]"
"36","0.637187","100.86.243.187","151.101.65.140","TLSv1.3","523","Client Hello (SNI=www.redditstatic.com)"
"52","0.649446","151.101.65.140","100.86.243.187","TCP","66","443  >  56492 [ACK] Seq=1 Ack=1906 Win=148992 Len=0 TSval=1577772917 TSecr=874255943"
"53","0.652036","151.101.65.140","100.86.243.187","TLSv1.3","1510","Server Hello, Change Cipher Spec, Application Data"
"54","0.652037","151.101.65.140","100.86.243.187","TCP","1510","443  >  56492 [ACK] Seq=1445 Ack=1906 Win=148992 Len=1444 TSval=1577772919 TSecr=874255943 [TCP PDU reassembled in 55]"
"55","0.652037","151.101.65.140","100.86.243.187","TLSv1.3","1427","Application Data, Application Data, Application Data, Application Data"
"56","0.652109","100.86.243.187","151.101.65.140","TCP","66","56492  >  443 [ACK] Seq=1906 Ack=4250 Win=127488 Len=0 TSval=874255959 TSecr=1577772919"
"58","0.654997","100.86.243.187","151.101.65.140","TLSv1.3","130","Change Cipher Spec, Application Data"
"59","0.655841","100.86.243.187","151.101.65.140","TLSv1.3","158","Application Data"
"60","0.655898","100.86.243.187","151.101.65.140","TLSv1.3","447","Application Data"
"61","0.656049","100.86.243.187","151.101.65.140","TLSv1.3","233","Application Data"
"62","0.656208","100.86.243.187","151.101.65.140","TLSv1.3","226","Application Data"
"63","0.656303","100.86.243.187","151.101.65.140","TLSv1.3","212","Application Data"
"64","0.658316","100.86.243.187","151.101.65.140","TLSv1.3","169","Application Data"
"65","0.664596","100.86.243.187","151.101.65.140","TLSv1.3","101","Application Data"
"66","0.666718","151.101.65.140","100.86.243.187","TCP","66","443  >  56492 [ACK] Seq=4250 Ack=1970 Win=148992 Len=0 TSval=1577772935 TSecr=874255962"
"67","0.666718","151.101.65.140","100.86.243.187","TCP","66","443  >  56492 [ACK] Seq=4250 Ack=2916 Win=157696 Len=0 TSval=1577772936 TSecr=874255963"
"68","0.667293","151.101.65.140","100.86.243.187","TLSv1.3","131","Application Data"
"69","0.667353","100.86.243.187","151.101.65.140","TCP","66","56492  >  443 [ACK] Seq=3054 Ack=4315 Win=130944 Len=0 TSval=874255973 TSecr=1577772936"
"70","0.667466","100.86.243.187","151.101.65.140","TLSv1.3","97","Application Data"
"71","0.668073","151.101.65.140","100.86.243.187","TLSv1.3","1376","Application Data"
"72","0.668121","100.86.243.187","151.101.65.140","TCP","66","56492  >  443 [ACK] Seq=3085 Ack=5625 Win=129728 Len=0 TSval=874255975 TSecr=1577772936"
"73","0.668536","151.101.65.140","100.86.243.187","TLSv1.3","1510","Application Data"
"74","0.668537","151.101.65.140","100.86.243.187","TLSv1.3","1510","Application Data"
"75","0.668538","151.101.65.140","100.86.243.187","TLSv1.3","1193","Application Data"
"76","0.668538","151.101.65.140","100.86.243.187","TCP","66","443  >  56492 [ACK] Seq=9640 Ack=3019 Win=157696 Len=0 TSval=1577772937 TSecr=874255965"
"77","0.668587","100.86.243.187","151.101.65.140","TCP","66","56492  >  443 [ACK] Seq=3085 Ack=9640 Win=127040 Len=0 TSval=874255975 TSecr=1577772937"
"78","0.669145","100.86.243.187","151.101.65.140","TCP","66","[TCP Window Update] 56492  >  443 [ACK] Seq=3085 Ack=9640 Win=131072 Len=0 TSval=874255976 TSecr=1577772937"
"79","0.669194","151.101.65.140","100.86.243.187","TLSv1.3","1510","Application Data"
"80","0.669195","151.101.65.140","100.86.243.187","TLSv1.3","1146","Application Data"
"81","0.669246","100.86.243.187","151.101.65.140","TCP","66","56492  >  443 [ACK] Seq=3085 Ack=12164 Win=128512 Len=0 TSval=874255976 TSecr=1577772937"
"84","0.676041","151.101.65.140","100.86.243.187","TCP","66","443  >  56492 [ACK] Seq=12164 Ack=3054 Win=157696 Len=0 TSval=1577772945 TSecr=874255971"
"90","0.678374","151.101.65.140","100.86.243.187","TCP","66","443  >  56492 [ACK] Seq=12164 Ack=3085 Win=157696 Len=0 TSval=1577772947 TSecr=874255975"
"98","0.984243","100.86.243.187","151.101.65.140","TLSv1.3","224","Application Data"
"100","0.996619","151.101.65.140","100.86.243.187","TCP","66","443  >  56492 [ACK] Seq=12164 Ack=3243 Win=160256 Len=0 TSval=1577773264 TSecr=874256291"
"101","0.996620","151.101.65.140","100.86.243.187","TLSv1.3","169","Application Data"
"102","0.996621","151.101.65.140","100.86.243.187","TLSv1.3","1024","Application Data"
"103","0.996752","100.86.243.187","151.101.65.140","TCP","66","56492  >  443 [ACK] Seq=3243 Ack=13225 Win=129984 Len=0 TSval=874256303 TSecr=1577773264"
"108","1.048424","100.86.243.187","151.101.65.140","TLSv1.3","232","Application Data"
"109","1.048679","100.86.243.187","151.101.65.140","TLSv1.3","160","Application Data"
"110","1.048830","100.86.243.187","151.101.65.140","TLSv1.3","162","Application Data"
"111","1.052275","100.86.243.187","151.101.65.140","TLSv1.3","101","Application Data"
"112","1.052989","100.86.243.187","151.101.65.140","TLSv1.3","101","Application Data"
"113","1.054199","100.86.243.187","151.101.65.140","TLSv1.3","101","Application Data"
"115","1.063048","151.101.65.140","100.86.243.187","TCP","66","443  >  56492 [ACK] Seq=13225 Ack=3669 Win=163328 Len=0 TSval=1577773332 TSecr=874256359"
"116","1.064221","151.101.65.140","100.86.243.187","TLSv1.3","147","Application Data"
"117","1.064301","100.86.243.187","151.101.65.140","TCP","66","56492  >  443 [ACK] Seq=3704 Ack=13306 Win=130944 Len=0 TSval=874256371 TSecr=1577773333"
"118","1.065043","151.101.65.140","100.86.243.187","TLSv1.3","1510","Application Data"
"119","1.065044","151.101.65.140","100.86.243.187","TLSv1.3","1304","Application Data"
"120","1.065045","151.101.65.140","100.86.243.187","TCP","66","443  >  56492 [ACK] Seq=15988 Ack=3704 Win=163328 Len=0 TSval=1577773333 TSecr=874256361"
"121","1.065121","100.86.243.187","151.101.65.140","TCP","66","56492  >  443 [ACK] Seq=3704 Ack=15988 Win=128384 Len=0 TSval=874256371 TSecr=1577773333"
"141","1.149880","100.86.243.187","151.101.65.140","TLSv1.3","222","Application Data"
"142","1.153851","100.86.243.187","151.101.65.140","TLSv1.3","168","Application Data"
"143","1.154222","100.86.243.187","151.101.65.140","TLSv1.3","101","Application Data"
"144","1.155641","100.86.243.187","151.101.65.140","TLSv1.3","171","Application Data"
"145","1.158464","100.86.243.187","151.101.65.140","TLSv1.3","175","Application Data"
"146","1.159644","100.86.243.187","151.101.65.140","TLSv1.3","170","Application Data"
"147","1.160405","100.86.243.187","151.101.65.140","TLSv1.3","101","Application Data"
"148","1.161645","100.86.243.187","151.101.65.140","TLSv1.3","171","Application Data"
"149","1.162270","100.86.243.187","151.101.65.140","TLSv1.3","101","Application Data"
"150","1.162555","100.86.243.187","151.101.65.140","TLSv1.3","164","Application Data"
"151","1.163625","100.86.243.187","151.101.65.140","TLSv1.3","101","Application Data"
"152","1.164888","100.86.243.187","151.101.65.140","TLSv1.3","101","Application Data"
"153","1.165960","100.86.243.187","151.101.65.140","TLSv1.3","101","Application Data"
"154","1.167121","100.86.243.187","151.101.65.140","TLSv1.3","101","Application Data"
"161","1.177052","151.101.65.140","100.86.243.187","TCP","66","443  >  56492 [ACK] Seq=15988 Ack=4658 Win=168960 Len=0 TSval=1577773444 TSecr=874256471"
"162","1.177053","151.101.65.140","100.86.243.187","TLSv1.3","147","[TCP Previous segment not captured] , Application Data"
"163","1.177053","151.101.65.140","100.86.243.187","TLSv1.3","607","Application Data"
"164","1.177053","151.101.65.140","100.86.243.187","TCP","66","443  >  56492 [ACK] Seq=17933 Ack=4693 Win=168960 Len=0 TSval=1577773446 TSecr=874256472"
"165","1.177159","100.86.243.187","151.101.65.140","TCP","78","[TCP Dup ACK 121#1] 56492  >  443 [ACK] Seq=4728 Ack=15988 Win=131072 Len=0 TSval=874256484 TSecr=1577773444 SLE=17311 SRE=17933"
"166","1.178656","151.101.65.140","100.86.243.187","TCP","66","443  >  56492 [ACK] Seq=17933 Ack=4728 Win=168960 Len=0 TSval=1577773447 TSecr=874256474"
"167","1.194896","151.101.65.140","100.86.243.187","TCP","1389","[TCP Retransmission] 443  >  56492 [PSH, ACK] Seq=15988 Ack=4728 Win=168960 Len=1323 TSval=1577773462 TSecr=874256484"
"170","1.195047","100.86.243.187","151.101.65.140","TCP","66","56492  >  443 [ACK] Seq=4728 Ack=17933 Win=129088 Len=0 TSval=874256502 TSecr=1577773462"
"478","2.850833","100.86.243.187","151.101.65.140","TLSv1.3","202","Application Data"
"479","2.856507","100.86.243.187","151.101.65.140","TLSv1.3","101","Application Data"
"482","2.876412","151.101.65.140","100.86.243.187","TCP","66","443  >  56492 [ACK] Seq=17933 Ack=4899 Win=172032 Len=0 TSval=1577775145 TSecr=874258163"
