"No.","Time","Source","Destination","Protocol","Length","Info"
"1","0.000000","151.101.1.140","100.86.243.187","TLSv1.2","257","Application Data"
"2","0.000152","100.86.243.187","151.101.1.140","TCP","66","56485  >  443 [ACK] Seq=1 Ack=192 Win=3922 Len=0 TSval=2851363645 TSecr=1266309115"
"3","0.004367","151.101.1.140","100.86.243.187","TLSv1.2","185","Application Data"
"4","0.004368","151.101.1.140","100.86.243.187","TLSv1.2","1107","Application Data"
"5","0.004369","151.101.1.140","100.86.243.187","TLSv1.2","730","Application Data"
"6","0.004369","151.101.1.140","100.86.243.187","TLSv1.2","611","Application Data"
"7","0.004370","151.101.1.140","100.86.243.187","TLSv1.2","524","Application Data"
"8","0.004371","151.101.1.140","100.86.243.187","TLSv1.2","1199","Application Data"
"9","0.004372","151.101.1.140","100.86.243.187","TCP","1510","443  >  56485 [ACK] Seq=4152 Ack=1 Win=639 Len=1444 TSval=1266309135 TSecr=2851363154 [TCP PDU reassembled in 12]"
"10","0.004688","100.86.243.187","151.101.1.140","TCP","66","56485  >  443 [ACK] Seq=1 Ack=5596 Win=3925 Len=0 TSval=2851363649 TSecr=1266309135"
"11","0.004778","151.101.1.140","100.86.243.187","TCP","1510","443  >  56485 [PSH, ACK] Seq=5596 Ack=1 Win=639 Len=1444 TSval=1266309135 TSecr=2851363154 [TCP PDU reassembled in 12]"
"12","0.004855","151.101.1.140","100.86.243.187","TLSv1.2","804","Application Data"
"13","0.004892","100.86.243.187","151.101.1.140","TCP","66","56485  >  443 [ACK] Seq=1 Ack=7040 Win=3925 Len=0 TSval=2851363649 TSecr=1266309135"
"14","0.004925","100.86.243.187","151.101.1.140","TCP","66","56485  >  443 [ACK] Seq=1 Ack=7778 Win=3925 Len=0 TSval=2851363649 TSecr=1266309136"
"15","0.006498","151.101.1.140","100.86.243.187","TLSv1.2","176","Application Data"
"16","0.006499","151.101.1.140","100.86.243.187","TLSv1.2","549","Application Data"
"17","0.006714","100.86.243.187","151.101.1.140","TCP","66","56485  >  443 [ACK] Seq=1 Ack=8371 Win=3925 Len=0 TSval=2851363651 TSecr=1266309138"
"18","0.025501","151.101.1.140","100.86.243.187","TLSv1.2","247","Application Data"
"19","0.025502","151.101.1.140","100.86.243.187","TLSv1.2","1307","Application Data"
"20","0.025503","151.101.1.140","100.86.243.187","TLSv1.2","248","Application Data"
"21","0.025690","100.86.243.187","151.101.1.140","TCP","66","56485  >  443 [ACK] Seq=1 Ack=9975 Win=3925 Len=0 TSval=2851363670 TSecr=1266309157"
"22","0.046242","151.101.1.140","100.86.243.187","TLSv1.2","182","Application Data"
"24","0.046379","100.86.243.187","151.101.1.140","TCP","66","56485  >  443 [ACK] Seq=1 Ack=10091 Win=3925 Len=0 TSval=2851363691 TSecr=1266309176"
"27","0.047562","151.101.1.140","100.86.243.187","TLSv1.2","384","Application Data"
"28","0.047563","151.101.1.140","100.86.243.187","TLSv1.2","1419","Application Data"
"29","0.047564","151.101.1.140","100.86.243.187","TLSv1.2","600","Application Data"
"30","0.047564","151.101.1.140","100.86.243.187","TLSv1.2","1020","Application Data, Application Data"
"31","0.047564","151.101.1.140","100.86.243.187","TLSv1.2","583","Application Data"
"32","0.047565","151.101.1.140","100.86.243.187","TLSv1.2","931","Application Data"
"33","0.047566","151.101.1.140","100.86.243.187","TLSv1.2","908","Application Data, Application Data"
"34","0.048284","100.86.243.187","151.101.1.140","TCP","66","56485  >  443 [ACK] Seq=1 Ack=15474 Win=3925 Len=0 TSval=2851363693 TSecr=1266309179"
"38","0.064461","151.101.1.140","100.86.243.187","TLSv1.2","192","Application Data"
"39","0.064462","151.101.1.140","100.86.243.187","TLSv1.2","348","Application Data"
"40","0.064684","100.86.243.187","151.101.1.140","TCP","66","56485  >  443 [ACK] Seq=1 Ack=15882 Win=3925 Len=0 TSval=2851363709 TSecr=1266309196"
"41","0.072060","151.101.1.140","100.86.243.187","TCP","1510","443  >  56485 [ACK] Seq=15882 Ack=1 Win=639 Len=1444 TSval=1266309202 TSecr=2851363693 [TCP PDU reassembled in 42]"
"42","0.072061","151.101.1.140","100.86.243.187","TLSv1.2","704","Application Data"
"43","0.072062","151.101.1.140","100.86.243.187","TLSv1.2","574","Application Data"
"44","0.072255","100.86.243.187","151.101.1.140","TCP","66","56485  >  443 [ACK] Seq=1 Ack=18472 Win=3925 Len=0 TSval=2851363717 TSecr=1266309203"
"47","0.088806","151.101.1.140","100.86.243.187","TLSv1.2","187","Application Data"
"48","0.088807","151.101.1.140","100.86.243.187","TLSv1.2","822","Application Data"
"49","0.088980","100.86.243.187","151.101.1.140","TCP","66","56485  >  443 [ACK] Seq=1 Ack=19349 Win=3925 Len=0 TSval=2851363734 TSecr=1266309220"
"52","0.096980","151.101.1.140","100.86.243.187","TCP","1510","443  >  56485 [ACK] Seq=19349 Ack=1 Win=639 Len=1444 TSval=1266309225 TSecr=2851363717 [TCP PDU reassembled in 53]"
"53","0.096980","151.101.1.140","100.86.243.187","TLSv1.2","495","Application Data"
"54","0.096981","151.101.1.140","100.86.243.187","TLSv1.2","382","Application Data"
"55","0.096981","151.101.1.140","100.86.243.187","TLSv1.2","683","Application Data"
"57","0.097150","100.86.243.187","151.101.1.140","TCP","66","56485  >  443 [ACK] Seq=1 Ack=22155 Win=3925 Len=0 TSval=2851363742 TSecr=1266309226"
"59","0.111255","151.101.1.140","100.86.243.187","TLSv1.2","292","Application Data"
"60","0.111368","100.86.243.187","151.101.1.140","TCP","66","56485  >  443 [ACK] Seq=1 Ack=22381 Win=3925 Len=0 TSval=2851363756 TSecr=1266309241"
"61","0.112739","151.101.1.140","100.86.243.187","TLSv1.2","554","Application Data"
"62","0.112845","100.86.243.187","151.101.1.140","TCP","66","56485  >  443 [ACK] Seq=1 Ack=22869 Win=3925 Len=0 TSval=2851363758 TSecr=1266309245"
"63","0.119117","151.101.1.140","100.86.243.187","TLSv1.2","361","Application Data"
"64","0.119244","100.86.243.187","151.101.1.140","TCP","66","56485  >  443 [ACK] Seq=1 Ack=23164 Win=3925 Len=0 TSval=2851363764 TSecr=1266309249"
"65","0.120634","151.101.1.140","100.86.243.187","TLSv1.2","250","Application Data"
"66","0.120635","151.101.1.140","100.86.243.187","TLSv1.2","1124","Application Data"
"67","0.120636","151.101.1.140","100.86.243.187","TLSv1.2","225","Application Data"
"68","0.120637","151.101.1.140","100.86.243.187","TLSv1.2","297","Application Data"
"69","0.120637","151.101.1.140","100.86.243.187","TLSv1.2","1191","Application Data"
"70","0.120847","100.86.243.187","151.101.1.140","TCP","66","56485  >  443 [ACK] Seq=1 Ack=25921 Win=3925 Len=0 TSval=2851363766 TSecr=1266309251"
"75","0.136163","151.101.1.140","100.86.243.187","TLSv1.2","241","Application Data"
"76","0.136273","100.86.243.187","151.101.1.140","TCP","66","56485  >  443 [ACK] Seq=1 Ack=26096 Win=3925 Len=0 TSval=2851363781 TSecr=1266309267"
"77","0.137846","151.101.1.140","100.86.243.187","TLSv1.2","209","Application Data"
"78","0.137847","151.101.1.140","100.86.243.187","TLSv1.2","346","Application Data"
"79","0.138008","100.86.243.187","151.101.1.140","TCP","66","56485  >  443 [ACK] Seq=1 Ack=26519 Win=3925 Len=0 TSval=2851363783 TSecr=1266309269"
"80","0.139355","151.101.1.140","100.86.243.187","TLSv1.2","204","Application Data"
"81","0.139471","100.86.243.187","151.101.1.140","TCP","66","56485  >  443 [ACK] Seq=1 Ack=26657 Win=3925 Len=0 TSval=2851363784 TSecr=1266309270"
"82","0.139479","151.101.1.140","100.86.243.187","TLSv1.2","914","Application Data"
"83","0.139594","100.86.243.187","151.101.1.140","TCP","66","56485  >  443 [ACK] Seq=1 Ack=27505 Win=3925 Len=0 TSval=2851363784 TSecr=1266309270"
"84","0.140759","151.101.1.140","100.86.243.187","TLSv1.2","860","Application Data"
"85","0.140902","100.86.243.187","151.101.1.140","TCP","66","56485  >  443 [ACK] Seq=1 Ack=28299 Win=3925 Len=0 TSval=2851363786 TSecr=1266309271"
"98","0.160321","151.101.1.140","100.86.243.187","TLSv1.2","406","Application Data"
"99","0.160322","151.101.1.140","100.86.243.187","TLSv1.2","143","Application Data"
"101","0.160517","100.86.243.187","151.101.1.140","TCP","66","56485  >  443 [ACK] Seq=1 Ack=28716 Win=3925 Len=0 TSval=2851363805 TSecr=1266309291"
"103","0.161726","151.101.1.140","100.86.243.187","TLSv1.2","1214","Application Data"
"104","0.161788","151.101.1.140","100.86.243.187","TLSv1.2","468","Application Data"
"105","0.161789","151.101.1.140","100.86.243.187","TLSv1.2","766","Application Data"
"106","0.161916","100.86.243.187","151.101.1.140","TCP","66","56485  >  443 [ACK] Seq=1 Ack=30966 Win=3925 Len=0 TSval=2851363807 TSecr=1266309292"
"107","0.163401","151.101.1.140","100.86.243.187","TLSv1.2","248","Application Data"
"108","0.163402","151.101.1.140","100.86.243.187","TLSv1.2","1033","Application Data"
"109","0.163578","100.86.243.187","151.101.1.140","TCP","66","56485  >  443 [ACK] Seq=1 Ack=32115 Win=3925 Len=0 TSval=2851363808 TSecr=1266309294"
"110","0.164642","151.101.1.140","100.86.243.187","TLSv1.2","584","Application Data"
"111","0.164643","151.101.1.140","100.86.243.187","TLSv1.2","940","Application Data"
"112","0.164829","100.86.243.187","151.101.1.140","TCP","66","56485  >  443 [ACK] Seq=1 Ack=33507 Win=3925 Len=0 TSval=2851363810 TSecr=1266309295"
"113","0.166353","151.101.1.140","100.86.243.187","TLSv1.2","516","Application Data"
"114","0.166354","151.101.1.140","100.86.243.187","TLSv1.2","322","Application Data"
"116","0.166545","100.86.243.187","151.101.1.140","TCP","66","56485  >  443 [ACK] Seq=1 Ack=34213 Win=3925 Len=0 TSval=2851363811 TSecr=1266309296"
"133","0.184490","151.101.1.140","100.86.243.187","TLSv1.2","190","Application Data"
"134","0.184495","151.101.1.140","100.86.243.187","TLSv1.2","255","Application Data"
"135","0.185133","100.86.243.187","151.101.1.140","TCP","66","56485  >  443 [ACK] Seq=1 Ack=34526 Win=3925 Len=0 TSval=2851363830 TSecr=1266309317"
"136","0.190590","151.101.1.140","100.86.243.187","TLSv1.2","154","Application Data"
"137","0.190591","151.101.1.140","100.86.243.187","TLSv1.2","326","Application Data"
"138","0.190592","151.101.1.140","100.86.243.187","TLSv1.2","164","Application Data"
"139","0.190593","151.101.1.140","100.86.243.187","TLSv1.2","478","Application Data"
"141","0.190794","100.86.243.187","151.101.1.140","TCP","66","56485  >  443 [ACK] Seq=1 Ack=35384 Win=3925 Len=0 TSval=2851363836 TSecr=1266309322"
"144","0.217372","151.101.1.140","100.86.243.187","TCP","1510","443  >  56485 [ACK] Seq=35384 Ack=1 Win=639 Len=1444 TSval=1266309346 TSecr=2851363836 [TCP PDU reassembled in 147]"
"145","0.217372","151.101.1.140","100.86.243.187","TCP","1510","443  >  56485 [PSH, ACK] Seq=36828 Ack=1 Win=639 Len=1444 TSval=1266309346 TSecr=2851363836 [TCP PDU reassembled in 147]"
"146","0.217374","151.101.1.140","100.86.243.187","TCP","1510","443  >  56485 [ACK] Seq=38272 Ack=1 Win=639 Len=1444 TSval=1266309347 TSecr=2851363836 [TCP PDU reassembled in 147]"
"147","0.217374","151.101.1.140","100.86.243.187","TLSv1.2","1214","Application Data"
"148","0.217375","151.101.1.140","100.86.243.187","TLSv1.2","297","Application Data"
"149","0.217575","100.86.243.187","151.101.1.140","TCP","66","56485  >  443 [ACK] Seq=1 Ack=41095 Win=3925 Len=0 TSval=2851363862 TSecr=1266309348"
"150","0.234519","151.101.1.140","100.86.243.187","TLSv1.2","163","Application Data"
"151","0.234580","151.101.1.140","100.86.243.187","TLSv1.2","543","Application Data"
"152","0.234654","100.86.243.187","151.101.1.140","TCP","66","56485  >  443 [ACK] Seq=1 Ack=41192 Win=3925 Len=0 TSval=2851363879 TSecr=1266309364"
"153","0.234731","100.86.243.187","151.101.1.140","TCP","66","56485  >  443 [ACK] Seq=1 Ack=41669 Win=3925 Len=0 TSval=2851363879 TSecr=1266309365"
"154","0.239996","151.101.1.140","100.86.243.187","TCP","1510","443  >  56485 [ACK] Seq=41669 Ack=1 Win=639 Len=1444 TSval=1266309371 TSecr=2851363862 [TCP PDU reassembled in 156]"
"155","0.239997","151.101.1.140","100.86.243.187","TCP","1510","443  >  56485 [PSH, ACK] Seq=43113 Ack=1 Win=639 Len=1444 TSval=1266309371 TSecr=2851363862 [TCP PDU reassembled in 156]"
"156","0.239998","151.101.1.140","100.86.243.187","TLSv1.2","115","Application Data"
"157","0.240116","100.86.243.187","151.101.1.140","TCP","66","56485  >  443 [ACK] Seq=1 Ack=44606 Win=3925 Len=0 TSval=2851363885 TSecr=1266309371"
"159","0.246739","151.101.1.140","100.86.243.187","TCP","1510","443  >  56485 [ACK] Seq=44606 Ack=1 Win=639 Len=1444 TSval=1266309377 TSecr=2851363862 [TCP PDU reassembled in 160]"
"160","0.246740","151.101.1.140","100.86.243.187","TLSv1.2","423","Application Data"
"161","0.246858","100.86.243.187","151.101.1.140","TCP","66","56485  >  443 [ACK] Seq=1 Ack=46407 Win=3925 Len=0 TSval=2851363892 TSecr=1266309377"
"199","1.382115","100.86.243.187","151.101.1.140","TLSv1.2","248","Application Data"
"207","1.383726","100.86.243.187","151.101.1.140","TLSv1.2","170","Application Data"
"210","1.384404","100.86.243.187","151.101.1.140","TLSv1.2","218","Application Data"
"214","1.385058","100.86.243.187","151.101.1.140","TLSv1.2","222","Application Data"
"217","1.385539","100.86.243.187","151.101.1.140","TLSv1.2","236","Application Data"
"219","1.385866","100.86.243.187","151.101.1.140","TLSv1.2","146","Application Data"
"222","1.386410","100.86.243.187","151.101.1.140","TLSv1.2","219","Application Data"
"226","1.391613","100.86.243.187","151.101.1.140","TLSv1.2","163","Application Data"
"227","1.391856","100.86.243.187","151.101.1.140","TLSv1.2","164","Application Data"
"229","1.392381","100.86.243.187","151.101.1.140","TLSv1.2","163","Application Data"
"233","1.476122","100.86.243.187","151.101.1.140","TLSv1.2","101","Application Data"
"237","1.479471","100.86.243.187","151.101.1.140","TLSv1.2","101","Application Data"
"242","1.482726","100.86.243.187","151.101.1.140","TLSv1.2","101","Application Data"
"246","1.486437","100.86.243.187","151.101.1.140","TLSv1.2","101","Application Data"
"247","1.486552","100.86.243.187","151.101.1.140","TLSv1.2","101","Application Data"
"251","1.489456","100.86.243.187","151.101.1.140","TLSv1.2","101","Application Data"
"252","1.501720","100.86.243.187","151.101.1.140","TLSv1.2","101","Application Data"
"253","1.502211","100.86.243.187","151.101.1.140","TLSv1.2","101","Application Data"
"254","1.502428","100.86.243.187","151.101.1.140","TLSv1.2","101","Application Data"
"257","1.589924","100.86.243.187","151.101.1.140","TCP","1514","[TCP Retransmission] 56509  >  443 [PSH, ACK] Seq=18 Ack=1 Win=7025 Len=1448 TSval=514271983 TSecr=3914568570"
"260","1.596809","151.101.1.140","100.86.243.187","TCP","66","443  >  56509 [ACK] Seq=1 Ack=1186 Win=424 Len=0 TSval=3914571435 TSecr=514271785"
"261","1.596810","151.101.1.140","100.86.243.187","TCP","66","443  >  56520 [ACK] Seq=1 Ack=105 Win=296 Len=0 TSval=2144926005 TSecr=2085397734"
"263","1.596811","151.101.1.140","100.86.243.187","TLSv1.2","164","Application Data"
"264","1.596811","151.101.1.140","100.86.243.187","TCP","1510","443  >  56520 [ACK] Seq=99 Ack=105 Win=296 Len=1444 TSval=2144926006 TSecr=2085397734 [TCP PDU reassembled in 267]"
"266","1.596812","151.101.1.140","100.86.243.187","TCP","1510","443  >  56520 [ACK] Seq=1543 Ack=105 Win=296 Len=1444 TSval=2144926006 TSecr=2085397734 [TCP PDU reassembled in 267]"
"267","1.596813","151.101.1.140","100.86.243.187","TLSv1.2","1254","Application Data"
"271","1.596815","151.101.1.140","100.86.243.187","TCP","66","443  >  56509 [ACK] Seq=1 Ack=1326 Win=424 Len=0 TSval=3914571436 TSecr=514271880"
"273","1.596815","151.101.1.140","100.86.243.187","TCP","66","443  >  56509 [ACK] Seq=1 Ack=1466 Win=424 Len=0 TSval=3914571436 TSecr=514271895"
"276","1.596816","151.101.1.140","100.86.243.187","TCP","66","443  >  56520 [ACK] Seq=4175 Ack=140 Win=296 Len=0 TSval=2144926006 TSecr=2085397828"
"284","1.596819","151.101.1.140","100.86.243.187","TCP","1510","443  >  56509 [ACK] Seq=1 Ack=1466 Win=424 Len=1444 TSval=3914571438 TSecr=514271895 [TCP PDU reassembled in 313]"
"285","1.596820","151.101.1.140","100.86.243.187","TCP","1510","443  >  56509 [PSH, ACK] Seq=1445 Ack=1466 Win=424 Len=1444 TSval=3914571438 TSecr=514271895 [TCP PDU reassembled in 313]"
"288","1.596824","151.101.1.140","100.86.243.187","TCP","1510","443  >  56509 [ACK] Seq=2889 Ack=1466 Win=424 Len=1444 TSval=3914571440 TSecr=514271895 [TCP PDU reassembled in 313]"
"289","1.596825","151.101.1.140","100.86.243.187","TCP","1510","443  >  56509 [PSH, ACK] Seq=4333 Ack=1466 Win=424 Len=1444 TSval=3914571440 TSecr=514271895 [TCP PDU reassembled in 313]"
"292","1.596826","151.101.1.140","100.86.243.187","TCP","1510","443  >  56509 [ACK] Seq=5777 Ack=1466 Win=424 Len=1444 TSval=3914571443 TSecr=514271895 [TCP PDU reassembled in 313]"
"293","1.596827","151.101.1.140","100.86.243.187","TCP","1510","443  >  56509 [PSH, ACK] Seq=7221 Ack=1466 Win=424 Len=1444 TSval=3914571443 TSecr=514271895 [TCP PDU reassembled in 313]"
"294","1.596827","151.101.1.140","100.86.243.187","TCP","1510","443  >  56509 [ACK] Seq=8665 Ack=1466 Win=424 Len=1444 TSval=3914571446 TSecr=514271895 [TCP PDU reassembled in 313]"
"295","1.596955","100.86.243.187","151.101.1.140","TCP","66","56509  >  443 [ACK] Seq=1466 Ack=5777 Win=6935 Len=0 TSval=514271990 TSecr=3914571440"
"296","1.597001","100.86.243.187","151.101.1.140","TCP","66","56520  >  443 [ACK] Seq=140 Ack=4175 Win=2819 Len=0 TSval=2085397948 TSecr=2144926006"
"298","1.597049","100.86.243.187","151.101.1.140","TCP","66","[TCP Window Update] 56509  >  443 [ACK] Seq=1466 Ack=5777 Win=7025 Len=0 TSval=514271990 TSecr=3914571440"
"300","1.597128","100.86.243.187","151.101.1.140","TCP","66","56509  >  443 [ACK] Seq=1466 Ack=10109 Win=6957 Len=0 TSval=514271990 TSecr=3914571446"
"302","1.597181","100.86.243.187","151.101.1.140","TCP","66","[TCP Window Update] 56520  >  443 [ACK] Seq=140 Ack=4175 Win=2885 Len=0 TSval=2085397948 TSecr=2144926006"
"303","1.597264","100.86.243.187","151.101.1.140","TCP","66","[TCP Window Update] 56509  >  443 [ACK] Seq=1466 Ack=10109 Win=7025 Len=0 TSval=514271990 TSecr=3914571446"
"305","1.607502","151.101.1.140","100.86.243.187","TCP","78","[TCP Dup ACK 273#1] 443  >  56509 [ACK] Seq=10109 Ack=1466 Win=424 Len=0 TSval=3914571465 TSecr=514271983 SLE=18 SRE=1466"
"307","1.607504","151.101.1.140","100.86.243.187","TCP","1510","443  >  56509 [ACK] Seq=10109 Ack=1466 Win=424 Len=1444 TSval=3914571465 TSecr=514271990 [TCP PDU reassembled in 313]"
"308","1.607505","151.101.1.140","100.86.243.187","TCP","1510","443  >  56509 [PSH, ACK] Seq=11553 Ack=1466 Win=424 Len=1444 TSval=3914571465 TSecr=514271990 [TCP PDU reassembled in 313]"
"309","1.607610","100.86.243.187","151.101.1.140","TCP","66","56509  >  443 [ACK] Seq=1466 Ack=12997 Win=6980 Len=0 TSval=514272001 TSecr=3914571465"
"311","1.609477","151.101.1.140","100.86.243.187","TCP","1510","443  >  56509 [ACK] Seq=12997 Ack=1466 Win=424 Len=1444 TSval=3914571468 TSecr=514271990 [TCP PDU reassembled in 313]"
"312","1.609553","100.86.243.187","151.101.1.140","TCP","66","56509  >  443 [ACK] Seq=1466 Ack=14441 Win=7002 Len=0 TSval=514272003 TSecr=3914571468"
"313","1.610696","151.101.1.140","100.86.243.187","TLSv1.2","1510","Application Data"
"314","1.610765","100.86.243.187","151.101.1.140","TCP","66","56509  >  443 [ACK] Seq=1466 Ack=15885 Win=7002 Len=0 TSval=514272004 TSecr=3914571468"
"315","1.612893","151.101.1.140","100.86.243.187","TCP","1510","443  >  56509 [ACK] Seq=15885 Ack=1466 Win=424 Len=1444 TSval=3914571471 TSecr=514271990 [TCP PDU reassembled in 336]"
"316","1.612894","151.101.1.140","100.86.243.187","TCP","1510","443  >  56509 [PSH, ACK] Seq=17329 Ack=1466 Win=424 Len=1444 TSval=3914571471 TSecr=514271990 [TCP PDU reassembled in 336]"
"317","1.612963","100.86.243.187","151.101.1.140","TCP","66","56509  >  443 [ACK] Seq=1466 Ack=18773 Win=6980 Len=0 TSval=514272006 TSecr=3914571471"
"318","1.615333","151.101.1.140","100.86.243.187","TCP","1510","443  >  56509 [ACK] Seq=18773 Ack=1466 Win=424 Len=1444 TSval=3914571474 TSecr=514271990 [TCP PDU reassembled in 336]"
"319","1.615407","100.86.243.187","151.101.1.140","TCP","66","56509  >  443 [ACK] Seq=1466 Ack=20217 Win=7002 Len=0 TSval=514272009 TSecr=3914571474"
"320","1.616700","151.101.1.140","100.86.243.187","TCP","1510","443  >  56509 [PSH, ACK] Seq=20217 Ack=1466 Win=424 Len=1444 TSval=3914571474 TSecr=514271990 [TCP PDU reassembled in 336]"
"321","1.616768","100.86.243.187","151.101.1.140","TCP","66","56509  >  443 [ACK] Seq=1466 Ack=21661 Win=7002 Len=0 TSval=514272010 TSecr=3914571474"
"322","1.618774","151.101.1.140","100.86.243.187","TCP","1510","443  >  56509 [ACK] Seq=21661 Ack=1466 Win=424 Len=1444 TSval=3914571478 TSecr=514272001 [TCP PDU reassembled in 336]"
"323","1.618841","100.86.243.187","151.101.1.140","TCP","66","56509  >  443 [ACK] Seq=1466 Ack=23105 Win=7002 Len=0 TSval=514272012 TSecr=3914571478"
"324","1.618898","151.101.1.140","100.86.243.187","TCP","1510","443  >  56509 [PSH, ACK] Seq=23105 Ack=1466 Win=424 Len=1444 TSval=3914571478 TSecr=514272001 [TCP PDU reassembled in 336]"
"325","1.618950","100.86.243.187","151.101.1.140","TCP","66","56509  >  443 [ACK] Seq=1466 Ack=24549 Win=7002 Len=0 TSval=514272012 TSecr=3914571478"
"326","1.621912","151.101.1.140","100.86.243.187","TCP","1510","443  >  56509 [ACK] Seq=24549 Ack=1466 Win=424 Len=1444 TSval=3914571481 TSecr=514272004 [TCP PDU reassembled in 336]"
"327","1.621978","100.86.243.187","151.101.1.140","TCP","66","56509  >  443 [ACK] Seq=1466 Ack=25993 Win=7002 Len=0 TSval=514272015 TSecr=3914571481"
"328","1.622639","151.101.1.140","100.86.243.187","TCP","1510","443  >  56509 [PSH, ACK] Seq=25993 Ack=1466 Win=424 Len=1444 TSval=3914571481 TSecr=514272004 [TCP PDU reassembled in 336]"
"329","1.622700","100.86.243.187","151.101.1.140","TCP","66","56509  >  443 [ACK] Seq=1466 Ack=27437 Win=7002 Len=0 TSval=514272016 TSecr=3914571481"
"330","1.624574","151.101.1.140","100.86.243.187","TCP","1510","443  >  56509 [ACK] Seq=27437 Ack=1466 Win=424 Len=1444 TSval=3914571484 TSecr=514272006 [TCP PDU reassembled in 336]"
"331","1.624653","100.86.243.187","151.101.1.140","TCP","66","56509  >  443 [ACK] Seq=1466 Ack=28881 Win=7002 Len=0 TSval=514272018 TSecr=3914571484"
"332","1.624975","151.101.1.140","100.86.243.187","TCP","1510","443  >  56509 [PSH, ACK] Seq=28881 Ack=1466 Win=424 Len=1444 TSval=3914571484 TSecr=514272006 [TCP PDU reassembled in 336]"
"333","1.625042","100.86.243.187","151.101.1.140","TCP","66","56509  >  443 [ACK] Seq=1466 Ack=30325 Win=7002 Len=0 TSval=514272018 TSecr=3914571484"
"334","1.627177","151.101.1.140","100.86.243.187","TCP","1510","443  >  56509 [ACK] Seq=30325 Ack=1466 Win=424 Len=1444 TSval=3914571487 TSecr=514272010 [TCP PDU reassembled in 336]"
"335","1.627255","100.86.243.187","151.101.1.140","TCP","66","56509  >  443 [ACK] Seq=1466 Ack=31769 Win=7002 Len=0 TSval=514272021 TSecr=3914571487"
"336","1.627962","151.101.1.140","100.86.243.187","TLSv1.2","1510","Application Data"
"337","1.628038","100.86.243.187","151.101.1.140","TCP","66","56509  >  443 [ACK] Seq=1466 Ack=33213 Win=7002 Len=0 TSval=514272021 TSecr=3914571487"
"338","1.629786","151.101.1.140","100.86.243.187","TCP","1510","443  >  56509 [ACK] Seq=33213 Ack=1466 Win=424 Len=1444 TSval=3914571489 TSecr=514272012 [TCP PDU reassembled in 345]"
"339","1.630765","151.101.1.140","100.86.243.187","TCP","1510","443  >  56509 [PSH, ACK] Seq=34657 Ack=1466 Win=424 Len=1444 TSval=3914571489 TSecr=514272012 [TCP PDU reassembled in 345]"
"340","1.630876","100.86.243.187","151.101.1.140","TCP","66","56509  >  443 [ACK] Seq=1466 Ack=36101 Win=7025 Len=0 TSval=514272024 TSecr=3914571489"
"341","1.632525","151.101.1.140","100.86.243.187","TCP","1510","443  >  56509 [ACK] Seq=36101 Ack=1466 Win=424 Len=1444 TSval=3914571492 TSecr=514272016 [TCP PDU reassembled in 345]"
"342","1.633220","151.101.1.140","100.86.243.187","TCP","1510","443  >  56509 [PSH, ACK] Seq=37545 Ack=1466 Win=424 Len=1444 TSval=3914571492 TSecr=514272016 [TCP PDU reassembled in 345]"
"343","1.633318","100.86.243.187","151.101.1.140","TCP","66","56509  >  443 [ACK] Seq=1466 Ack=38989 Win=7025 Len=0 TSval=514272026 TSecr=3914571492"
"344","1.636067","151.101.1.140","100.86.243.187","TCP","1510","443  >  56509 [ACK] Seq=38989 Ack=1466 Win=424 Len=1444 TSval=3914571494 TSecr=514272018 [TCP PDU reassembled in 345]"
"345","1.636471","151.101.1.140","100.86.243.187","TLSv1.2","1288","Application Data"
"346","1.636588","100.86.243.187","151.101.1.140","TCP","66","56509  >  443 [ACK] Seq=1466 Ack=41655 Win=7025 Len=0 TSval=514272030 TSecr=3914571494"
"360","1.817108","100.86.243.187","151.101.1.140","TLSv1.2","242","Application Data"
"361","1.817368","100.86.243.187","151.101.1.140","TLSv1.2","152","Application Data"
"362","1.817536","100.86.243.187","151.101.1.140","TLSv1.2","152","Application Data"
"365","1.817791","100.86.243.187","151.101.1.140","TLSv1.2","152","Application Data"
"368","1.819022","100.86.243.187","151.101.1.140","TLSv1.2","101","Application Data"
"369","1.819851","100.86.243.187","151.101.1.140","TLSv1.2","101","Application Data"
"370","1.821564","100.86.243.187","151.101.1.140","TLSv1.2","101","Application Data"
"376","1.849291","151.101.1.140","100.86.243.187","TCP","66","443  >  56509 [ACK] Seq=41655 Ack=1970 Win=424 Len=0 TSval=3914571704 TSecr=514272212"
"377","1.849292","151.101.1.140","100.86.243.187","TCP","66","443  >  56509 [ACK] Seq=41655 Ack=2005 Win=424 Len=0 TSval=3914571704 TSecr=514272215"
"379","1.858906","151.101.1.140","100.86.243.187","TCP","1510","443  >  56509 [ACK] Seq=41655 Ack=2005 Win=424 Len=1444 TSval=3914571705 TSecr=514272215 [TCP PDU reassembled in 402]"
"380","1.858907","151.101.1.140","100.86.243.187","TCP","1510","443  >  56509 [PSH, ACK] Seq=43099 Ack=2005 Win=424 Len=1444 TSval=3914571705 TSecr=514272215 [TCP PDU reassembled in 402]"
"381","1.858908","151.101.1.140","100.86.243.187","TCP","1510","443  >  56509 [ACK] Seq=44543 Ack=2005 Win=424 Len=1444 TSval=3914571706 TSecr=514272215 [TCP PDU reassembled in 402]"
"382","1.858908","151.101.1.140","100.86.243.187","TCP","1510","443  >  56509 [PSH, ACK] Seq=45987 Ack=2005 Win=424 Len=1444 TSval=3914571706 TSecr=514272215 [TCP PDU reassembled in 402]"
"388","1.859055","100.86.243.187","151.101.1.140","TCP","66","56509  >  443 [ACK] Seq=2005 Ack=47431 Win=7025 Len=0 TSval=514272252 TSecr=3914571706"
"389","1.860413","151.101.1.140","100.86.243.187","TCP","1510","443  >  56509 [ACK] Seq=47431 Ack=2005 Win=424 Len=1444 TSval=3914571708 TSecr=514272215 [TCP PDU reassembled in 402]"
"390","1.860414","151.101.1.140","100.86.243.187","TCP","1510","443  >  56509 [PSH, ACK] Seq=48875 Ack=2005 Win=424 Len=1444 TSval=3914571708 TSecr=514272215 [TCP PDU reassembled in 402]"
"393","1.860535","100.86.243.187","151.101.1.140","TCP","66","56509  >  443 [ACK] Seq=2005 Ack=50319 Win=7025 Len=0 TSval=514272254 TSecr=3914571708"
"394","1.861749","151.101.1.140","100.86.243.187","TCP","1510","443  >  56509 [ACK] Seq=50319 Ack=2005 Win=424 Len=1444 TSval=3914571710 TSecr=514272215 [TCP PDU reassembled in 402]"
"395","1.861750","151.101.1.140","100.86.243.187","TCP","1510","443  >  56509 [PSH, ACK] Seq=51763 Ack=2005 Win=424 Len=1444 TSval=3914571710 TSecr=514272215 [TCP PDU reassembled in 402]"
"396","1.861750","151.101.1.140","100.86.243.187","TCP","1510","443  >  56509 [ACK] Seq=53207 Ack=2005 Win=424 Len=1444 TSval=3914571712 TSecr=514272215 [TCP PDU reassembled in 402]"
"398","1.861861","100.86.243.187","151.101.1.140","TCP","66","56509  >  443 [ACK] Seq=2005 Ack=54651 Win=7025 Len=0 TSval=514272255 TSecr=3914571712"
"400","1.874727","151.101.1.140","100.86.243.187","TCP","1510","443  >  56509 [ACK] Seq=54651 Ack=2005 Win=424 Len=1444 TSval=3914571732 TSecr=514272255 [TCP PDU reassembled in 402]"
"401","1.877996","151.101.1.140","100.86.243.187","TCP","1510","443  >  56509 [PSH, ACK] Seq=56095 Ack=2005 Win=424 Len=1444 TSval=3914571732 TSecr=514272255 [TCP PDU reassembled in 402]"
"402","1.877997","151.101.1.140","100.86.243.187","TLSv1.2","1510","Application Data"
"403","1.877998","151.101.1.140","100.86.243.187","TCP","1510","443  >  56509 [PSH, ACK] Seq=58983 Ack=2005 Win=424 Len=1444 TSval=3914571733 TSecr=514272255 [TCP PDU reassembled in 426]"
"404","1.878384","100.86.243.187","151.101.1.140","TCP","66","56509  >  443 [ACK] Seq=2005 Ack=60427 Win=7025 Len=0 TSval=514272272 TSecr=3914571732"
"406","1.880552","151.101.1.140","100.86.243.187","TCP","1510","443  >  56509 [ACK] Seq=60427 Ack=2005 Win=424 Len=1444 TSval=3914571735 TSecr=514272255 [TCP PDU reassembled in 426]"
"407","1.880553","151.101.1.140","100.86.243.187","TCP","1510","443  >  56509 [PSH, ACK] Seq=61871 Ack=2005 Win=424 Len=1444 TSval=3914571735 TSecr=514272255 [TCP PDU reassembled in 426]"
"410","1.880693","100.86.243.187","151.101.1.140","TCP","66","56509  >  443 [ACK] Seq=2005 Ack=63315 Win=7025 Len=0 TSval=514272274 TSecr=3914571735"
"413","1.889108","151.101.1.140","100.86.243.187","TCP","1510","443  >  56509 [ACK] Seq=63315 Ack=2005 Win=424 Len=1444 TSval=3914571737 TSecr=514272255 [TCP PDU reassembled in 426]"
"414","1.889109","151.101.1.140","100.86.243.187","TCP","1510","443  >  56509 [PSH, ACK] Seq=64759 Ack=2005 Win=424 Len=1444 TSval=3914571737 TSecr=514272255 [TCP PDU reassembled in 426]"
"415","1.889110","151.101.1.140","100.86.243.187","TCP","1510","443  >  56509 [ACK] Seq=66203 Ack=2005 Win=424 Len=1444 TSval=3914571739 TSecr=514272255 [TCP PDU reassembled in 426]"
"416","1.889111","151.101.1.140","100.86.243.187","TCP","1510","443  >  56509 [PSH, ACK] Seq=67647 Ack=2005 Win=424 Len=1444 TSval=3914571739 TSecr=514272255 [TCP PDU reassembled in 426]"
"417","1.889242","100.86.243.187","151.101.1.140","TCP","66","56509  >  443 [ACK] Seq=2005 Ack=69091 Win=7025 Len=0 TSval=514272283 TSecr=3914571739"
"420","1.912255","151.101.1.140","100.86.243.187","TCP","1510","443  >  56509 [ACK] Seq=69091 Ack=2005 Win=424 Len=1444 TSval=3914571771 TSecr=514272255 [TCP PDU reassembled in 426]"
"421","1.913056","151.101.1.140","100.86.243.187","TCP","1510","443  >  56509 [ACK] Seq=70535 Ack=2005 Win=424 Len=1444 TSval=3914571771 TSecr=514272283 [TCP PDU reassembled in 426]"
"422","1.913057","151.101.1.140","100.86.243.187","TCP","1510","443  >  56509 [PSH, ACK] Seq=71979 Ack=2005 Win=424 Len=1444 TSval=3914571771 TSecr=514272283 [TCP PDU reassembled in 426]"
"423","1.913162","100.86.243.187","151.101.1.140","TCP","66","56509  >  443 [ACK] Seq=2005 Ack=73423 Win=7025 Len=0 TSval=514272306 TSecr=3914571771"
"426","2.092209","151.101.1.140","100.86.243.187","TLSv1.2","1510","Application Data"
"427","2.092210","151.101.1.140","100.86.243.187","TCP","1510","443  >  56509 [PSH, ACK] Seq=74867 Ack=2005 Win=424 Len=1444 TSval=3914571774 TSecr=514272283 [TCP PDU reassembled in 433]"
"429","2.092455","100.86.243.187","151.101.1.140","TCP","66","56509  >  443 [ACK] Seq=2005 Ack=76311 Win=7025 Len=0 TSval=514272486 TSecr=3914571774"
"430","2.094585","151.101.1.140","100.86.243.187","TCP","1510","443  >  56509 [ACK] Seq=76311 Ack=2005 Win=424 Len=1444 TSval=3914571777 TSecr=514272283 [TCP PDU reassembled in 433]"
"431","2.094586","151.101.1.140","100.86.243.187","TCP","1510","443  >  56509 [PSH, ACK] Seq=77755 Ack=2005 Win=424 Len=1444 TSval=3914571777 TSecr=514272283 [TCP PDU reassembled in 433]"
"432","2.094587","151.101.1.140","100.86.243.187","TCP","1510","443  >  56509 [ACK] Seq=79199 Ack=2005 Win=424 Len=1444 TSval=3914571779 TSecr=514272283 [TCP PDU reassembled in 433]"
"433","2.094588","151.101.1.140","100.86.243.187","TLSv1.2","1184","Application Data"
"435","2.094718","100.86.243.187","151.101.1.140","TCP","66","56509  >  443 [ACK] Seq=2005 Ack=81761 Win=7025 Len=0 TSval=514272488 TSecr=3914571779"
"747","6.123083","100.86.243.187","151.101.1.140","TCP","1514","56485  >  443 [ACK] Seq=1 Ack=46407 Win=3925 Len=1448 TSval=2851369767 TSecr=1266309377 [TCP PDU reassembled in 749]"
"748","6.123086","100.86.243.187","151.101.1.140","TCP","1514","56485  >  443 [ACK] Seq=1449 Ack=46407 Win=3925 Len=1448 TSval=2851369767 TSecr=1266309377 [TCP PDU reassembled in 749]"
"749","6.123137","100.86.243.187","151.101.1.140","TLSv1.2","182","Application Data"
"750","6.123244","100.86.243.187","151.101.1.140","TCP","1514","56485  >  443 [ACK] Seq=3013 Ack=46407 Win=3925 Len=1448 TSval=2851369767 TSecr=1266309377 [TCP PDU reassembled in 753]"
"751","6.123246","100.86.243.187","151.101.1.140","TCP","1514","56485  >  443 [ACK] Seq=4461 Ack=46407 Win=3925 Len=1448 TSval=2851369767 TSecr=1266309377 [TCP PDU reassembled in 753]"
"752","6.123248","100.86.243.187","151.101.1.140","TCP","1514","56485  >  443 [ACK] Seq=5909 Ack=46407 Win=3925 Len=1448 TSval=2851369767 TSecr=1266309377 [TCP PDU reassembled in 753]"
"753","6.123265","100.86.243.187","151.101.1.140","TLSv1.2","1058","Application Data"
"754","6.138484","151.101.1.140","100.86.243.187","TCP","66","443  >  56485 [ACK] Seq=46407 Ack=1449 Win=637 Len=0 TSval=1266315269 TSecr=2851369767"
"755","6.138486","151.101.1.140","100.86.243.187","TCP","66","443  >  56485 [ACK] Seq=46407 Ack=8349 Win=626 Len=0 TSval=1266315269 TSecr=2851369767"
"756","6.162761","151.101.1.140","100.86.243.187","TCP","1510","443  >  56485 [ACK] Seq=46407 Ack=8349 Win=639 Len=1444 TSval=1266315291 TSecr=2851369767 [TCP PDU reassembled in 757]"
"757","6.162763","151.101.1.140","100.86.243.187","TLSv1.2","256","Application Data"
"758","6.162879","100.86.243.187","151.101.1.140","TCP","66","56485  >  443 [ACK] Seq=8349 Ack=48041 Win=3900 Len=0 TSval=2851369806 TSecr=1266315291"
