"No.","Time","Source","Destination","Protocol","Length","Info"
"1","0.000000","100.86.235.39","151.101.1.140","TLSv1.2","245","Application Data"
"2","0.001897","151.101.65.140","100.86.235.39","TLSv1.2","1510","Ignored Unknown Record"
"3","0.001898","151.101.65.140","100.86.235.39","TLSv1.2","1510","Ignored Unknown Record"
"4","0.001960","100.86.235.39","151.101.65.140","TCP","66","56383  >  443 [ACK] Seq=1 Ack=2889 Win=2002 Len=0 TSval=1360024759 TSecr=557249728"
"5","0.006928","151.101.65.140","100.86.235.39","TLSv1.2","1510","Ignored Unknown Record"
"6","0.006928","151.101.65.140","100.86.235.39","TLSv1.2","1510","Ignored Unknown Record"
"7","0.006990","100.86.235.39","151.101.65.140","TCP","66","56383  >  443 [ACK] Seq=1 Ack=5777 Win=2002 Len=0 TSval=1360024764 TSecr=557249733"
"8","0.012660","100.86.235.39","151.101.1.140","TLSv1.2","212","Application Data"
"9","0.015849","100.86.235.39","151.101.1.140","TLSv1.2","101","Application Data"
"10","0.021765","100.86.235.39","151.101.1.140","TLSv1.2","227","Application Data"
"11","0.023872","151.101.1.140","100.86.235.39","TCP","66","443  >  56466 [ACK] Seq=1 Ack=180 Win=359 Len=0 TSval=211896931 TSecr=2554345210"
"12","0.023873","151.101.65.140","100.86.235.39","TLSv1.2","1510","Ignored Unknown Record"
"13","0.023873","151.101.65.140","100.86.235.39","SSLv2","1510",""
"14","0.023945","100.86.235.39","151.101.65.140","TCP","66","56383  >  443 [ACK] Seq=1 Ack=7221 Win=2025 Len=0 TSval=1360024781 TSecr=557249755"
"15","0.024046","100.86.235.39","151.101.65.140","TCP","66","56473  >  443 [ACK] Seq=1 Ack=1445 Win=4649 Len=0 TSval=1656597023 TSecr=2958664702"
"16","0.026123","100.86.235.39","151.101.1.140","TLSv1.2","165","Application Data"
"17","0.026364","100.86.235.39","151.101.1.140","TLSv1.2","171","Application Data"
"18","0.027386","100.86.235.39","151.101.1.140","TLSv1.2","101","Application Data"
"19","0.031396","151.101.65.140","100.86.235.39","SSLv2","1510",""
"20","0.031398","151.101.65.140","100.86.235.39","TLSv1.2","1510","Ignored Unknown Record"
"21","0.031464","100.86.235.39","151.101.65.140","TCP","66","56473  >  443 [ACK] Seq=1 Ack=2889 Win=4649 Len=0 TSval=1656597030 TSecr=2958664702"
"22","0.031515","100.86.235.39","151.101.65.140","TCP","66","56383  >  443 [ACK] Seq=1 Ack=8665 Win=2025 Len=0 TSval=1360024788 TSecr=557249756"
"23","0.032683","151.101.1.140","100.86.235.39","TLSv1.2","672","Application Data"
"24","0.032684","151.101.65.140","100.86.235.39","TLSv1.2","1510","Ignored Unknown Record"
"25","0.032686","151.101.65.140","100.86.235.39","TCP","1510","443  >  56383 [PSH, ACK] Seq=10109 Ack=1 Win=538 Len=1444 TSval=557249758 TSecr=1360024764"
"26","0.032687","151.101.1.140","100.86.235.39","TCP","66","443  >  56466 [ACK] Seq=607 Ack=326 Win=364 Len=0 TSval=211896937 TSecr=2554345223"
"27","0.032762","100.86.235.39","151.101.1.140","TCP","66","56466  >  443 [ACK] Seq=761 Ack=607 Win=4640 Len=0 TSval=2554345244 TSecr=211896932"
"28","0.032821","100.86.235.39","151.101.65.140","TCP","66","56383  >  443 [ACK] Seq=1 Ack=11553 Win=2002 Len=0 TSval=1360024790 TSecr=557249758"
"29","0.033673","100.86.235.39","151.101.1.140","TLSv1.2","167","Application Data"
"30","0.038794","151.101.1.140","100.86.235.39","TLSv1.2","512","Application Data"
"31","0.038795","151.101.65.140","100.86.235.39","TLSv1.2","1510","Ignored Unknown Record"
"32","0.038795","151.101.65.140","100.86.235.39","SSLv2","1510","[TCP Previous segment not captured] "
"33","0.038796","151.101.1.140","100.86.235.39","TCP","66","443  >  56466 [ACK] Seq=1053 Ack=522 Win=370 Len=0 TSval=211896945 TSecr=2554345233"
"34","0.038863","100.86.235.39","151.101.1.140","TCP","66","56466  >  443 [ACK] Seq=862 Ack=1053 Win=4642 Len=0 TSval=2554345250 TSecr=211896938"
"35","0.038914","100.86.235.39","151.101.65.140","TCP","66","56383  >  443 [ACK] Seq=1 Ack=12997 Win=2025 Len=0 TSval=1360024796 TSecr=557249766"
"36","0.038941","100.86.235.39","151.101.65.140","TCP","78","[TCP Dup ACK 21#1] 56473  >  443 [ACK] Seq=1 Ack=2889 Win=4672 Len=0 TSval=1656597038 TSecr=2958664702 SLE=4333 SRE=5777"
"37","0.041682","100.86.235.39","151.101.1.140","TLSv1.2","155","Application Data"
"38","0.043711","151.101.1.140","100.86.235.39","TCP","1510","443  >  56466 [ACK] Seq=1053 Ack=522 Win=370 Len=1444 TSval=211896947 TSecr=2554345233 [TCP PDU reassembled in 40]"
"39","0.043712","151.101.1.140","100.86.235.39","TCP","1510","443  >  56466 [ACK] Seq=2497 Ack=522 Win=370 Len=1444 TSval=211896947 TSecr=2554345233 [TCP PDU reassembled in 40]"
"40","0.043713","151.101.1.140","100.86.235.39","TLSv1.2","291","Application Data"
"41","0.043713","151.101.65.140","100.86.235.39","TLSv1.2","1510","[TCP Previous segment not captured] , Ignored Unknown Record"
"42","0.043781","100.86.235.39","151.101.1.140","TCP","66","56466  >  443 [ACK] Seq=951 Ack=4166 Win=4601 Len=0 TSval=2554345255 TSecr=211896947"
"43","0.043854","100.86.235.39","151.101.65.140","TCP","78","[TCP Dup ACK 35#1] 56383  >  443 [ACK] Seq=1 Ack=12997 Win=2048 Len=0 TSval=1360024801 TSecr=557249766 SLE=14441 SRE=15885"
"44","0.043876","100.86.235.39","151.101.1.140","TCP","66","[TCP Window Update] 56466  >  443 [ACK] Seq=951 Ack=4166 Win=4649 Len=0 TSval=2554345255 TSecr=211896947"
"45","0.046202","151.101.65.140","100.86.235.39","TLSv1.2","1510","Ignored Unknown Record"
"46","0.046204","151.101.1.140","100.86.235.39","TCP","66","443  >  56466 [ACK] Seq=4166 Ack=761 Win=370 Len=0 TSval=211896957 TSecr=2554345238"
"47","0.046285","100.86.235.39","151.101.65.140","TCP","78","[TCP Dup ACK 35#2] 56383  >  443 [ACK] Seq=1 Ack=12997 Win=2048 Len=0 TSval=1360024803 TSecr=557249766 SLE=14441 SRE=17329"
"48","0.048225","100.86.235.39","151.101.1.140","TLSv1.2","101","Application Data"
"49","0.052014","151.101.1.140","100.86.235.39","TLSv1.2","648","Application Data"
"50","0.052015","151.101.1.140","100.86.235.39","TLSv1.2","766","Application Data"
"51","0.052016","151.101.65.140","100.86.235.39","TLSv1.2","1510","Ignored Unknown Record"
"52","0.052017","151.101.65.140","100.86.235.39","TLSv1.2","1510","Ignored Unknown Record"
"53","0.052092","100.86.235.39","151.101.1.140","TCP","66","56466  >  443 [ACK] Seq=986 Ack=5448 Win=4629 Len=0 TSval=2554345263 TSecr=211896958"
"54","0.052135","151.101.1.140","100.86.235.39","TLSv1.2","344","Application Data"
"55","0.052135","151.101.1.140","100.86.235.39","TCP","1510","443  >  56466 [ACK] Seq=5726 Ack=761 Win=370 Len=1444 TSval=211896958 TSecr=2554345238 [TCP PDU reassembled in 66]"
"56","0.052163","100.86.235.39","151.101.65.140","TCP","78","[TCP Dup ACK 35#3] 56383  >  443 [ACK] Seq=1 Ack=12997 Win=2048 Len=0 TSval=1360024809 TSecr=557249766 SLE=14441 SRE=20217"
"57","0.052188","100.86.235.39","151.101.1.140","TCP","66","56466  >  443 [ACK] Seq=986 Ack=7170 Win=4612 Len=0 TSval=2554345263 TSecr=211896958"
"58","0.053488","151.101.1.140","100.86.235.39","TCP","1510","443  >  56466 [ACK] Seq=7170 Ack=761 Win=370 Len=1444 TSval=211896958 TSecr=2554345238 [TCP PDU reassembled in 66]"
"59","0.053489","151.101.1.140","100.86.235.39","TCP","1510","443  >  56466 [PSH, ACK] Seq=8614 Ack=761 Win=370 Len=1444 TSval=211896958 TSecr=2554345238 [TCP PDU reassembled in 66]"
"60","0.053490","151.101.65.140","100.86.235.39","SSLv2","1510",""
"61","0.053490","151.101.65.140","100.86.235.39","SSLv2","1510",""
"62","0.053548","100.86.235.39","151.101.1.140","TCP","66","56466  >  443 [ACK] Seq=986 Ack=10058 Win=4604 Len=0 TSval=2554345264 TSecr=211896958"
"63","0.053611","100.86.235.39","151.101.65.140","TCP","78","[TCP Dup ACK 21#2] 56473  >  443 [ACK] Seq=1 Ack=2889 Win=4672 Len=0 TSval=1656597052 TSecr=2958664702 SLE=4333 SRE=8665"
"64","0.055781","100.86.235.39","151.101.1.140","TLSv1.2","101","Application Data"
"65","0.057925","151.101.1.140","100.86.235.39","TCP","1510","443  >  56466 [ACK] Seq=10058 Ack=761 Win=370 Len=1444 TSval=211896959 TSecr=2554345238 [TCP PDU reassembled in 66]"
"66","0.057926","151.101.1.140","100.86.235.39","TLSv1.2","832","Application Data"
"67","0.057927","151.101.1.140","100.86.235.39","TCP","66","443  >  56466 [ACK] Seq=12268 Ack=862 Win=370 Len=0 TSval=211896963 TSecr=2554345244"
"68","0.057927","151.101.1.140","100.86.235.39","TLSv1.2","171","Application Data"
"69","0.057931","151.101.1.140","100.86.235.39","TCP","1510","443  >  56466 [ACK] Seq=12373 Ack=862 Win=370 Len=1444 TSval=211896963 TSecr=2554345244 [TCP PDU reassembled in 90]"
"70","0.058091","151.101.1.140","100.86.235.39","TCP","1510","443  >  56466 [PSH, ACK] Seq=13817 Ack=862 Win=370 Len=1444 TSval=211896963 TSecr=2554345244 [TCP PDU reassembled in 90]"
"71","0.058092","151.101.1.140","100.86.235.39","TCP","1510","443  >  56466 [ACK] Seq=15261 Ack=862 Win=370 Len=1444 TSval=211896964 TSecr=2554345244 [TCP PDU reassembled in 90]"
"72","0.058136","100.86.235.39","151.101.1.140","TCP","66","56466  >  443 [ACK] Seq=1021 Ack=13817 Win=4591 Len=0 TSval=2554345269 TSecr=211896963"
"73","0.058170","100.86.235.39","151.101.1.140","TCP","66","56466  >  443 [ACK] Seq=1021 Ack=16705 Win=4546 Len=0 TSval=2554345269 TSecr=211896964"
"74","0.058190","151.101.1.140","100.86.235.39","TCP","1510","443  >  56466 [PSH, ACK] Seq=16705 Ack=862 Win=370 Len=1444 TSval=211896964 TSecr=2554345244 [TCP PDU reassembled in 90]"
"75","0.058191","151.101.1.140","100.86.235.39","TCP","1510","443  >  56466 [ACK] Seq=18149 Ack=862 Win=370 Len=1444 TSval=211896965 TSecr=2554345244 [TCP PDU reassembled in 90]"
"76","0.058232","100.86.235.39","151.101.1.140","TCP","66","56466  >  443 [ACK] Seq=1021 Ack=19593 Win=4535 Len=0 TSval=2554345269 TSecr=211896965"
"77","0.058320","100.86.235.39","151.101.1.140","TCP","66","[TCP Window Update] 56466  >  443 [ACK] Seq=1021 Ack=19593 Win=4649 Len=0 TSval=2554345269 TSecr=211896965"
"78","0.058374","151.101.1.140","100.86.235.39","TCP","1510","443  >  56466 [PSH, ACK] Seq=19593 Ack=862 Win=370 Len=1444 TSval=211896965 TSecr=2554345244 [TCP PDU reassembled in 90]"
"79","0.058375","151.101.1.140","100.86.235.39","TCP","1510","443  >  56466 [ACK] Seq=21037 Ack=862 Win=370 Len=1444 TSval=211896965 TSecr=2554345244 [TCP PDU reassembled in 90]"
"80","0.058419","100.86.235.39","151.101.1.140","TCP","66","56466  >  443 [ACK] Seq=1021 Ack=22481 Win=4604 Len=0 TSval=2554345269 TSecr=211896965"
"81","0.059402","100.86.235.39","151.101.1.140","TLSv1.2","101","Application Data"
"82","0.059764","151.101.1.140","100.86.235.39","TCP","1510","443  >  56466 [PSH, ACK] Seq=22481 Ack=862 Win=370 Len=1444 TSval=211896965 TSecr=2554345244 [TCP PDU reassembled in 90]"
"83","0.059766","151.101.65.140","100.86.235.39","TLSv1.2","1510","Ignored Unknown Record"
"84","0.059766","151.101.1.140","100.86.235.39","TCP","1510","443  >  56466 [ACK] Seq=23925 Ack=862 Win=370 Len=1444 TSval=211896966 TSecr=2554345244 [TCP PDU reassembled in 90]"
"85","0.059767","151.101.1.140","100.86.235.39","TCP","1510","443  >  56466 [PSH, ACK] Seq=25369 Ack=862 Win=370 Len=1444 TSval=211896966 TSecr=2554345244 [TCP PDU reassembled in 90]"
"86","0.059828","100.86.235.39","151.101.1.140","TCP","66","56466  >  443 [ACK] Seq=1056 Ack=26813 Win=4582 Len=0 TSval=2554345270 TSecr=211896966"
"87","0.059876","100.86.235.39","151.101.65.140","TCP","78","[TCP Dup ACK 35#4] 56383  >  443 [ACK] Seq=1 Ack=12997 Win=2048 Len=0 TSval=1360024816 TSecr=557249766 SLE=14441 SRE=21661"
"88","0.059912","100.86.235.39","151.101.1.140","TCP","66","[TCP Window Update] 56466  >  443 [ACK] Seq=1056 Ack=26813 Win=4649 Len=0 TSval=2554345270 TSecr=211896966"
"89","0.066435","151.101.1.140","100.86.235.39","TCP","1510","443  >  56466 [ACK] Seq=26813 Ack=862 Win=370 Len=1444 TSval=211896967 TSecr=2554345244 [TCP PDU reassembled in 90]"
"90","0.066437","151.101.1.140","100.86.235.39","TLSv1.2","1510","Application Data"
"91","0.066438","151.101.1.140","100.86.235.39","TCP","1510","443  >  56466 [ACK] Seq=29701 Ack=862 Win=370 Len=1444 TSval=211896967 TSecr=2554345244 [TCP PDU reassembled in 108]"
"92","0.066438","151.101.1.140","100.86.235.39","TCP","1510","443  >  56466 [PSH, ACK] Seq=31145 Ack=862 Win=370 Len=1444 TSval=211896967 TSecr=2554345244 [TCP PDU reassembled in 108]"
"93","0.066526","100.86.235.39","151.101.1.140","TCP","66","56466  >  443 [ACK] Seq=1056 Ack=32589 Win=4559 Len=0 TSval=2554345277 TSecr=211896967"
"94","0.066653","151.101.1.140","100.86.235.39","TCP","1510","443  >  56466 [ACK] Seq=32589 Ack=862 Win=370 Len=1444 TSval=211896968 TSecr=2554345244 [TCP PDU reassembled in 108]"
"95","0.066655","151.101.1.140","100.86.235.39","TCP","1510","443  >  56466 [PSH, ACK] Seq=34033 Ack=862 Win=370 Len=1444 TSval=211896968 TSecr=2554345244 [TCP PDU reassembled in 108]"
"96","0.066656","151.101.1.140","100.86.235.39","TCP","1510","443  >  56466 [ACK] Seq=35477 Ack=862 Win=370 Len=1444 TSval=211896969 TSecr=2554345250 [TCP PDU reassembled in 108]"
"97","0.066657","151.101.1.140","100.86.235.39","TCP","1510","443  >  56466 [PSH, ACK] Seq=36921 Ack=862 Win=370 Len=1444 TSval=211896969 TSecr=2554345250 [TCP PDU reassembled in 108]"
"98","0.066713","100.86.235.39","151.101.1.140","TCP","66","56466  >  443 [ACK] Seq=1056 Ack=38365 Win=4500 Len=0 TSval=2554345277 TSecr=211896969"
"99","0.066767","100.86.235.39","151.101.1.140","TCP","66","[TCP Window Update] 56466  >  443 [ACK] Seq=1056 Ack=38365 Win=4649 Len=0 TSval=2554345277 TSecr=211896969"
"100","0.066873","151.101.1.140","100.86.235.39","TCP","1510","443  >  56466 [ACK] Seq=38365 Ack=951 Win=370 Len=1444 TSval=211896970 TSecr=2554345255 [TCP PDU reassembled in 108]"
"101","0.066874","151.101.1.140","100.86.235.39","TCP","1510","443  >  56466 [PSH, ACK] Seq=39809 Ack=951 Win=370 Len=1444 TSval=211896970 TSecr=2554345255 [TCP PDU reassembled in 108]"
"102","0.066875","151.101.65.140","100.86.235.39","TLSv1.2","1510","Ignored Unknown Record"
"103","0.066876","151.101.65.140","100.86.235.39","TLSv1.2","1510","Ignored Unknown Record"
"104","0.066921","100.86.235.39","151.101.1.140","TCP","66","56466  >  443 [ACK] Seq=1056 Ack=41253 Win=4604 Len=0 TSval=2554345277 TSecr=211896970"
"105","0.066957","100.86.235.39","151.101.65.140","TCP","78","[TCP Dup ACK 35#5] 56383  >  443 [ACK] Seq=1 Ack=12997 Win=2048 Len=0 TSval=1360024823 TSecr=557249766 SLE=14441 SRE=24549"
"106","0.067220","151.101.1.140","100.86.235.39","TCP","1510","443  >  56466 [ACK] Seq=41253 Ack=951 Win=370 Len=1444 TSval=211896970 TSecr=2554345255 [TCP PDU reassembled in 108]"
"107","0.067221","151.101.1.140","100.86.235.39","TCP","1510","443  >  56466 [PSH, ACK] Seq=42697 Ack=951 Win=370 Len=1444 TSval=211896970 TSecr=2554345255 [TCP PDU reassembled in 108]"
"108","0.067222","151.101.1.140","100.86.235.39","TLSv1.2","1510","Application Data"
"109","0.067223","151.101.1.140","100.86.235.39","TCP","1510","443  >  56466 [PSH, ACK] Seq=45585 Ack=951 Win=370 Len=1444 TSval=211896971 TSecr=2554345255 [TCP PDU reassembled in 125]"
"110","0.067375","100.86.235.39","151.101.1.140","TCP","66","56466  >  443 [ACK] Seq=1056 Ack=47029 Win=4649 Len=0 TSval=2554345277 TSecr=211896971"
"111","0.068660","151.101.1.140","100.86.235.39","TCP","1510","443  >  56466 [ACK] Seq=47029 Ack=951 Win=370 Len=1444 TSval=211896972 TSecr=2554345255 [TCP PDU reassembled in 125]"
"112","0.068661","151.101.1.140","100.86.235.39","TCP","1510","443  >  56466 [PSH, ACK] Seq=48473 Ack=951 Win=370 Len=1444 TSval=211896972 TSecr=2554345255 [TCP PDU reassembled in 125]"
"113","0.068662","151.101.1.140","100.86.235.39","TCP","1510","443  >  56466 [ACK] Seq=49917 Ack=951 Win=370 Len=1444 TSval=211896972 TSecr=2554345255 [TCP PDU reassembled in 125]"
"114","0.068662","151.101.1.140","100.86.235.39","TCP","1510","443  >  56466 [PSH, ACK] Seq=51361 Ack=951 Win=370 Len=1444 TSval=211896972 TSecr=2554345255 [TCP PDU reassembled in 125]"
"115","0.068746","100.86.235.39","151.101.1.140","TCP","66","56466  >  443 [ACK] Seq=1056 Ack=52805 Win=4649 Len=0 TSval=2554345280 TSecr=211896972"
"116","0.074126","151.101.1.140","100.86.235.39","TCP","1510","443  >  56466 [ACK] Seq=52805 Ack=951 Win=370 Len=1444 TSval=211896973 TSecr=2554345255 [TCP PDU reassembled in 125]"
"117","0.074128","151.101.1.140","100.86.235.39","TCP","1510","443  >  56466 [PSH, ACK] Seq=54249 Ack=951 Win=370 Len=1444 TSval=211896973 TSecr=2554345255 [TCP PDU reassembled in 125]"
"118","0.074128","151.101.1.140","100.86.235.39","TCP","1510","443  >  56466 [ACK] Seq=55693 Ack=951 Win=370 Len=1444 TSval=211896974 TSecr=2554345255 [TCP PDU reassembled in 125]"
"119","0.074129","151.101.1.140","100.86.235.39","TCP","1510","443  >  56466 [PSH, ACK] Seq=57137 Ack=951 Win=370 Len=1444 TSval=211896974 TSecr=2554345255 [TCP PDU reassembled in 125]"
"120","0.074188","151.101.1.140","100.86.235.39","TCP","1510","443  >  56466 [ACK] Seq=58581 Ack=951 Win=370 Len=1444 TSval=211896974 TSecr=2554345255 [TCP PDU reassembled in 125]"
"121","0.074189","151.101.1.140","100.86.235.39","TCP","1510","443  >  56466 [PSH, ACK] Seq=60025 Ack=951 Win=370 Len=1444 TSval=211896974 TSecr=2554345255 [TCP PDU reassembled in 125]"
"122","0.074227","100.86.235.39","151.101.1.140","TCP","66","56466  >  443 [ACK] Seq=1056 Ack=58581 Win=4649 Len=0 TSval=2554345285 TSecr=211896974"
"123","0.074274","100.86.235.39","151.101.1.140","TCP","66","56466  >  443 [ACK] Seq=1056 Ack=61469 Win=4649 Len=0 TSval=2554345285 TSecr=211896974"
"124","0.074302","151.101.65.140","100.86.235.39","SSLv2","1510",""
"125","0.074303","151.101.1.140","100.86.235.39","TLSv1.2","1510","Application Data"
"126","0.074405","100.86.235.39","151.101.65.140","TCP","78","[TCP Dup ACK 21#3] 56473  >  443 [ACK] Seq=1 Ack=2889 Win=4672 Len=0 TSval=1656597073 TSecr=2958664702 SLE=4333 SRE=10109"
"127","0.074777","151.101.1.140","100.86.235.39","TCP","1510","443  >  56466 [PSH, ACK] Seq=62913 Ack=951 Win=370 Len=1444 TSval=211896975 TSecr=2554345255 [TCP PDU reassembled in 187]"
"128","0.074778","151.101.1.140","100.86.235.39","TCP","1510","443  >  56466 [ACK] Seq=64357 Ack=951 Win=370 Len=1444 TSval=211896976 TSecr=2554345255 [TCP PDU reassembled in 187]"
"129","0.074779","151.101.1.140","100.86.235.39","TCP","1510","443  >  56466 [PSH, ACK] Seq=65801 Ack=951 Win=370 Len=1444 TSval=211896976 TSecr=2554345255 [TCP PDU reassembled in 187]"
"130","0.074780","151.101.65.140","100.86.235.39","TLSv1.2","1510","Ignored Unknown Record"
"131","0.074781","151.101.65.140","100.86.235.39","TLSv1.2","1510","Ignored Unknown Record"
"132","0.074781","151.101.1.140","100.86.235.39","TCP","1510","443  >  56466 [ACK] Seq=67245 Ack=951 Win=370 Len=1444 TSval=211896976 TSecr=2554345255 [TCP PDU reassembled in 187]"
"133","0.074848","100.86.235.39","151.101.65.140","TCP","78","[TCP Dup ACK 35#6] 56383  >  443 [ACK] Seq=1 Ack=12997 Win=2048 Len=0 TSval=1360024831 TSecr=557249766 SLE=14441 SRE=27437"
"134","0.074869","100.86.235.39","151.101.1.140","TCP","66","56466  >  443 [ACK] Seq=1056 Ack=68689 Win=4649 Len=0 TSval=2554345285 TSecr=211896975"
"135","0.075078","151.101.1.140","100.86.235.39","TCP","1510","443  >  56466 [PSH, ACK] Seq=68689 Ack=951 Win=370 Len=1444 TSval=211896976 TSecr=2554345255 [TCP PDU reassembled in 187]"
"136","0.075079","151.101.1.140","100.86.235.39","TCP","1510","443  >  56466 [ACK] Seq=70133 Ack=951 Win=370 Len=1444 TSval=211896977 TSecr=2554345255 [TCP PDU reassembled in 187]"
"137","0.075123","100.86.235.39","151.101.1.140","TCP","66","56466  >  443 [ACK] Seq=1056 Ack=71577 Win=4649 Len=0 TSval=2554345285 TSecr=211896977"
"138","0.076333","151.101.1.140","100.86.235.39","TCP","1510","443  >  56466 [PSH, ACK] Seq=71577 Ack=951 Win=370 Len=1444 TSval=211896977 TSecr=2554345255 [TCP PDU reassembled in 187]"
"139","0.076334","151.101.1.140","100.86.235.39","TCP","1510","443  >  56466 [ACK] Seq=73021 Ack=986 Win=370 Len=1444 TSval=211896982 TSecr=2554345264 [TCP PDU reassembled in 187]"
"140","0.076334","151.101.1.140","100.86.235.39","TCP","1510","443  >  56466 [ACK] Seq=74465 Ack=986 Win=370 Len=1444 TSval=211896982 TSecr=2554345264 [TCP PDU reassembled in 187]"
"141","0.076335","151.101.1.140","100.86.235.39","TCP","1510","[TCP Previous segment not captured] 443  >  56466 [ACK] Seq=77353 Ack=986 Win=370 Len=1444 TSval=211896982 TSecr=2554345264 [TCP PDU reassembled in 187], Application Data"
"142","0.076400","100.86.235.39","151.101.1.140","TCP","78","56466  >  443 [ACK] Seq=1056 Ack=75909 Win=4582 Len=0 TSval=2554345287 TSecr=211896977 SLE=77353 SRE=78797"
"143","0.076429","100.86.235.39","151.101.1.140","TCP","78","[TCP Dup ACK 142#1] 56466  >  443 [ACK] Seq=1056 Ack=75909 Win=4649 Len=0 TSval=2554345287 TSecr=211896977 SLE=77353 SRE=78797"
"144","0.085038","151.101.1.140","100.86.235.39","TCP","1510","443  >  56466 [ACK] Seq=78797 Ack=986 Win=370 Len=1444 TSval=211896982 TSecr=2554345264 [TCP PDU reassembled in 156]"
"145","0.085039","151.101.1.140","100.86.235.39","TCP","1510","443  >  56466 [PSH, ACK] Seq=80241 Ack=986 Win=370 Len=1444 TSval=211896982 TSecr=2554345264 [TCP PDU reassembled in 156]"
"146","0.085040","151.101.65.140","100.86.235.39","SSLv2","1510",""
"147","0.085041","151.101.65.140","100.86.235.39","TLSv1.2","1510","[TCP Fast Retransmission] , Ignored Unknown Record"
"148","0.085043","151.101.1.140","100.86.235.39","TCP","1510","443  >  56466 [ACK] Seq=81685 Ack=1021 Win=370 Len=1444 TSval=211896983 TSecr=2554345269 [TCP PDU reassembled in 156]"
"149","0.085044","151.101.1.140","100.86.235.39","TCP","1510","443  >  56466 [ACK] Seq=83129 Ack=1021 Win=370 Len=1444 TSval=211896983 TSecr=2554345269 [TCP PDU reassembled in 156]"
"150","0.085045","151.101.1.140","100.86.235.39","TCP","1510","443  >  56466 [PSH, ACK] Seq=84573 Ack=1021 Win=370 Len=1444 TSval=211896983 TSecr=2554345269 [TCP PDU reassembled in 156]"
"151","0.085046","151.101.1.140","100.86.235.39","TCP","1510","443  >  56466 [ACK] Seq=86017 Ack=1021 Win=370 Len=1444 TSval=211896984 TSecr=2554345269 [TCP PDU reassembled in 156]"
"152","0.085047","151.101.1.140","100.86.235.39","TCP","1510","443  >  56466 [PSH, ACK] Seq=87461 Ack=1021 Win=370 Len=1444 TSval=211896984 TSecr=2554345269 [TCP PDU reassembled in 156]"
"153","0.085048","151.101.1.140","100.86.235.39","TCP","1510","443  >  56466 [ACK] Seq=88905 Ack=1021 Win=370 Len=1444 TSval=211896984 TSecr=2554345269 [TCP PDU reassembled in 156]"
"154","0.085048","151.101.1.140","100.86.235.39","TCP","1510","443  >  56466 [ACK] Seq=90349 Ack=1021 Win=370 Len=1444 TSval=211896984 TSecr=2554345269 [TCP PDU reassembled in 156]"
"155","0.085049","151.101.1.140","100.86.235.39","TCP","1510","443  >  56466 [PSH, ACK] Seq=91793 Ack=1021 Win=370 Len=1444 TSval=211896984 TSecr=2554345269 [TCP PDU reassembled in 156]"
"156","0.085050","151.101.1.140","100.86.235.39","TLSv1.2","1510","Application Data"
"157","0.085051","151.101.1.140","100.86.235.39","TCP","1510","443  >  56466 [ACK] Seq=94681 Ack=1021 Win=370 Len=1444 TSval=211896985 TSecr=2554345269 [TCP PDU reassembled in 161]"
"158","0.085051","151.101.1.140","100.86.235.39","TCP","1510","443  >  56466 [PSH, ACK] Seq=96125 Ack=1021 Win=370 Len=1444 TSval=211896985 TSecr=2554345269 [TCP PDU reassembled in 161]"
"159","0.085052","151.101.65.140","100.86.235.39","TLSv1.2","1510","Ignored Unknown Record"
"160","0.085053","151.101.1.140","100.86.235.39","TCP","1510","443  >  56466 [ACK] Seq=97569 Ack=1021 Win=370 Len=1444 TSval=211896986 TSecr=2554345269 [TCP PDU reassembled in 161]"
"161","0.085054","151.101.1.140","100.86.235.39","TLSv1.2","1510","Application Data"
"162","0.085054","151.101.1.140","100.86.235.39","TLSv1.2","177","Application Data"
"163","0.085131","100.86.235.39","151.101.1.140","TCP","78","[TCP Dup ACK 142#2] 56466  >  443 [ACK] Seq=1056 Ack=75909 Win=4649 Len=0 TSval=2554345296 TSecr=211896977 SLE=77353 SRE=81685"
"164","0.085172","100.86.235.39","151.101.1.140","TCP","78","[TCP Dup ACK 142#3] 56466  >  443 [ACK] Seq=1056 Ack=75909 Win=4649 Len=0 TSval=2554345296 TSecr=211896977 SLE=77353 SRE=97569"
"165","0.085189","100.86.235.39","151.101.1.140","TCP","78","[TCP Dup ACK 142#4] 56466  >  443 [ACK] Seq=1056 Ack=75909 Win=4649 Len=0 TSval=2554345296 TSecr=211896977 SLE=77353 SRE=100568"
"166","0.085240","100.86.235.39","151.101.65.140","TCP","78","[TCP Dup ACK 21#4] 56473  >  443 [ACK] Seq=1 Ack=2889 Win=4672 Len=0 TSval=1656597084 TSecr=2958664702 SLE=4333 SRE=11553"
"167","0.085259","100.86.235.39","151.101.65.140","TCP","66","56383  >  443 [ACK] Seq=1 Ack=27437 Win=1822 Len=0 TSval=1360024842 TSecr=557249806"
"168","0.085279","100.86.235.39","151.101.65.140","TCP","66","56383  >  443 [ACK] Seq=1 Ack=28881 Win=1799 Len=0 TSval=1360024842 TSecr=557249810"
"169","0.085422","100.86.235.39","151.101.65.140","TCP","66","[TCP Window Update] 56383  >  443 [ACK] Seq=1 Ack=28881 Win=2048 Len=0 TSval=1360024842 TSecr=557249810"
"170","0.092924","151.101.65.140","100.86.235.39","TLSv1.2","1510","Ignored Unknown Record"
"171","0.092925","151.101.65.140","100.86.235.39","SSLv2","1510","[TCP Fast Retransmission] "
"172","0.092987","100.86.235.39","151.101.65.140","TCP","66","56383  >  443 [ACK] Seq=1 Ack=30325 Win=2025 Len=0 TSval=1360024850 TSecr=557249813"
"173","0.093038","100.86.235.39","151.101.65.140","TCP","66","56473  >  443 [ACK] Seq=1 Ack=11553 Win=4537 Len=0 TSval=1656597092 TSecr=2958664760"
"174","0.093058","151.101.1.140","100.86.235.39","TCP","66","443  >  56466 [ACK] Seq=100568 Ack=1056 Win=370 Len=0 TSval=211896991 TSecr=2554345277"
"175","0.093059","151.101.65.140","100.86.235.39","TLSv1.2","1510","Ignored Unknown Record"
"176","0.093059","151.101.65.140","100.86.235.39","TLSv1.2","1510","Ignored Unknown Record"
"177","0.093082","100.86.235.39","151.101.65.140","TCP","66","[TCP Window Update] 56473  >  443 [ACK] Seq=1 Ack=11553 Win=4672 Len=0 TSval=1656597092 TSecr=2958664760"
"178","0.093113","100.86.235.39","151.101.65.140","TCP","66","56383  >  443 [ACK] Seq=1 Ack=33213 Win=2002 Len=0 TSval=1360024850 TSecr=557249819"
"179","0.103612","151.101.65.140","100.86.235.39","TLSv1.2","1510","Ignored Unknown Record"
"180","0.103613","151.101.65.140","100.86.235.39","SSLv2","1510",""
"181","0.103614","151.101.65.140","100.86.235.39","TCP","1510","443  >  56383 [ACK] Seq=34657 Ack=1 Win=538 Len=1444 TSval=557249828 TSecr=1360024831"
"182","0.103615","151.101.65.140","100.86.235.39","TLSv1.2","1510","Ignored Unknown Record"
"183","0.103677","100.86.235.39","151.101.65.140","TCP","66","56383  >  443 [ACK] Seq=1 Ack=37545 Win=1980 Len=0 TSval=1360024860 TSecr=557249828"
"184","0.103726","100.86.235.39","151.101.65.140","TCP","66","56473  >  443 [ACK] Seq=1 Ack=12997 Win=4649 Len=0 TSval=1656597102 TSecr=2958664766"
"185","0.103769","100.86.235.39","151.101.65.140","TCP","66","[TCP Window Update] 56383  >  443 [ACK] Seq=1 Ack=37545 Win=2048 Len=0 TSval=1360024860 TSecr=557249828"
"186","0.111860","151.101.65.140","100.86.235.39","SSLv2","1510",""
"187","0.111861","151.101.1.140","100.86.235.39","TCP","1510","[TCP Retransmission] 443  >  56466 [ACK] Seq=75909 Ack=1056 Win=370 Len=1444 TSval=211897010 TSecr=2554345287"
"188","0.111862","151.101.65.140","100.86.235.39","SSLv2","1510",""
"189","0.111862","151.101.65.140","100.86.235.39","TLSv1.2","1510","Ignored Unknown Record"
"190","0.111933","100.86.235.39","151.101.1.140","TCP","66","56466  >  443 [ACK] Seq=1056 Ack=100568 Win=4264 Len=0 TSval=2554345323 TSecr=211897010"
"191","0.112009","100.86.235.39","151.101.65.140","TCP","66","56473  >  443 [ACK] Seq=1 Ack=15885 Win=4627 Len=0 TSval=1656597111 TSecr=2958664787"
"192","0.112032","100.86.235.39","151.101.65.140","TCP","66","56383  >  443 [ACK] Seq=1 Ack=38989 Win=2025 Len=0 TSval=1360024869 TSecr=557249840"
"193","0.112167","100.86.235.39","151.101.1.140","TCP","66","[TCP Window Update] 56466  >  443 [ACK] Seq=1056 Ack=100568 Win=4649 Len=0 TSval=2554345323 TSecr=211897010"
"194","0.118977","151.101.65.140","100.86.235.39","TLSv1.2","1510","Ignored Unknown Record"
"195","0.119085","100.86.235.39","151.101.65.140","TCP","66","56383  >  443 [ACK] Seq=1 Ack=40433 Win=2025 Len=0 TSval=1360024876 TSecr=557249840"
"196","0.128311","151.101.65.140","100.86.235.39","TLSv1.2","1510","Ignored Unknown Record"
"197","0.128312","151.101.65.140","100.86.235.39","TLSv1.2","1510","Ignored Unknown Record"
"198","0.128313","151.101.65.140","100.86.235.39","SSLv2","1510",""
"199","0.128314","151.101.65.140","100.86.235.39","TLSv1.2","1510","Ignored Unknown Record"
"200","0.128753","100.86.235.39","151.101.65.140","TCP","66","56383  >  443 [ACK] Seq=1 Ack=44765 Win=2048 Len=0 TSval=1360024885 TSecr=557249858"
"201","0.128754","100.86.235.39","151.101.65.140","TCP","66","56473  >  443 [ACK] Seq=1 Ack=17329 Win=4649 Len=0 TSval=1656597127 TSecr=2958664795"
"202","0.136543","151.101.65.140","100.86.235.39","TLSv1.2","1510","Ignored Unknown Record"
"203","0.136545","151.101.65.140","100.86.235.39","SSLv2","1510",""
"204","0.136545","151.101.65.140","100.86.235.39","TLSv1.2","1510","Ignored Unknown Record"
"205","0.136546","151.101.65.140","100.86.235.39","TLSv1.2","1510","Ignored Unknown Record"
"206","0.136610","100.86.235.39","151.101.65.140","TCP","66","56383  >  443 [ACK] Seq=1 Ack=49097 Win=1980 Len=0 TSval=1360024893 TSecr=557249861"
"207","0.136702","100.86.235.39","151.101.65.140","TCP","66","[TCP Window Update] 56383  >  443 [ACK] Seq=1 Ack=49097 Win=2048 Len=0 TSval=1360024893 TSecr=557249861"
"208","0.136771","100.86.235.39","151.101.65.140","TCP","66","56473  >  443 [ACK] Seq=1 Ack=18773 Win=4649 Len=0 TSval=1656597135 TSecr=2958664804"
"209","0.144317","151.101.65.140","100.86.235.39","TLSv1.2","1510","Ignored Unknown Record"
"210","0.144319","151.101.65.140","100.86.235.39","TLSv1.2","1510","Ignored Unknown Record"
"211","0.144320","151.101.65.140","100.86.235.39","SSLv2","1510",""
"212","0.144321","151.101.65.140","100.86.235.39","SSLv2","1510",""
"213","0.144399","100.86.235.39","151.101.65.140","TCP","66","56383  >  443 [ACK] Seq=1 Ack=51985 Win=2002 Len=0 TSval=1360024901 TSecr=557249867"
"214","0.144449","100.86.235.39","151.101.65.140","TCP","66","56473  >  443 [ACK] Seq=1 Ack=21661 Win=4627 Len=0 TSval=1656597143 TSecr=2958664812"
"215","0.151959","100.86.235.39","151.101.65.140","TLSv1.2","548","Application Data"
"216","0.153364","100.86.235.39","151.101.65.140","TLSv1.2","101","Application Data"
"217","0.153493","151.101.65.140","100.86.235.39","TLSv1.2","1510","Ignored Unknown Record"
"218","0.153494","151.101.65.140","100.86.235.39","SSLv2","1510","Encrypted Data"
"219","0.153544","100.86.235.39","151.101.65.140","TCP","66","56383  >  443 [ACK] Seq=518 Ack=53429 Win=2025 Len=0 TSval=1360024910 TSecr=557249874"
"220","0.153573","100.86.235.39","151.101.65.140","TCP","66","56473  >  443 [ACK] Seq=1 Ack=23105 Win=4649 Len=0 TSval=1656597152 TSecr=2958664822"
"221","0.168762","151.101.65.140","100.86.235.39","TLSv1.2","1510","Ignored Unknown Record"
"222","0.168763","151.101.65.140","100.86.235.39","TLSv1.2","1510","Ignored Unknown Record"
"223","0.168764","151.101.65.140","100.86.235.39","SSLv2","1510",""
"224","0.168841","100.86.235.39","151.101.65.140","TCP","66","56383  >  443 [ACK] Seq=518 Ack=56317 Win=2002 Len=0 TSval=1360024926 TSecr=557249897"
"225","0.168896","100.86.235.39","151.101.65.140","TCP","66","56473  >  443 [ACK] Seq=1 Ack=24549 Win=4649 Len=0 TSval=1656597168 TSecr=2958664844"
"226","0.177318","151.101.65.140","100.86.235.39","SSLv2","1510",""
"227","0.177319","151.101.65.140","100.86.235.39","TLSv1.2","1510","Ignored Unknown Record"
"228","0.177320","151.101.65.140","100.86.235.39","TCP","1510","[TCP Previous segment not captured] 443  >  56383 [PSH, ACK] Seq=59205 Ack=1 Win=538 Len=1444 TSval=557249904 TSecr=1360024901 [TCP PDU reassembled in 240]"
"229","0.177321","151.101.65.140","100.86.235.39","SSLv2","1510",""
"230","0.177383","100.86.235.39","151.101.65.140","TCP","66","56473  >  443 [ACK] Seq=1 Ack=27437 Win=4627 Len=0 TSval=1656597176 TSecr=2958664851"
"231","0.177483","100.86.235.39","151.101.65.140","TCP","66","56383  >  443 [ACK] Seq=518 Ack=57761 Win=2025 Len=0 TSval=1360024934 TSecr=557249901"
"232","0.177511","100.86.235.39","151.101.65.140","TCP","78","[TCP Dup ACK 231#1] 56383  >  443 [ACK] Seq=518 Ack=57761 Win=2025 Len=0 TSval=1360024934 TSecr=557249901 SLE=59205 SRE=60649"
"233","0.185185","151.101.65.140","100.86.235.39","SSLv2","1510",""
"234","0.185186","151.101.65.140","100.86.235.39","TCP","1510","443  >  56383 [ACK] Seq=60649 Ack=1 Win=538 Len=1444 TSval=557249910 TSecr=1360024901 [TCP PDU reassembled in 240]"
"235","0.185187","151.101.65.140","100.86.235.39","TCP","1510","443  >  56383 [PSH, ACK] Seq=62093 Ack=1 Win=538 Len=1444 TSval=557249910 TSecr=1360024901 [TCP PDU reassembled in 240]"
"236","0.185188","151.101.65.140","100.86.235.39","TCP","1510","443  >  56383 [ACK] Seq=63537 Ack=518 Win=538 Len=1444 TSval=557249917 TSecr=1360024910 [TCP PDU reassembled in 240]"
"237","0.185254","100.86.235.39","151.101.65.140","TCP","66","56473  >  443 [ACK] Seq=1 Ack=28881 Win=4649 Len=0 TSval=1656597184 TSecr=2958664851"
"238","0.185324","100.86.235.39","151.101.65.140","TCP","78","[TCP Dup ACK 231#2] 56383  >  443 [ACK] Seq=518 Ack=57761 Win=2048 Len=0 TSval=1360024942 TSecr=557249901 SLE=59205 SRE=63537"
"239","0.185363","100.86.235.39","151.101.65.140","TCP","78","[TCP Dup ACK 231#3] 56383  >  443 [ACK] Seq=518 Ack=57761 Win=2048 Len=0 TSval=1360024942 TSecr=557249901 SLE=59205 SRE=64981"
"240","0.191499","151.101.65.140","100.86.235.39","TLSv1.2","1510","Application Data, Ignored Unknown Record"
"241","0.191500","151.101.65.140","100.86.235.39","SSLv2","1510",""
"242","0.191557","100.86.235.39","151.101.65.140","TCP","78","[TCP Dup ACK 231#4] 56383  >  443 [ACK] Seq=518 Ack=57761 Win=2048 Len=0 TSval=1360024948 TSecr=557249901 SLE=59205 SRE=66425"
"243","0.191605","100.86.235.39","151.101.65.140","TCP","66","56473  >  443 [ACK] Seq=1 Ack=30325 Win=4649 Len=0 TSval=1656597190 TSecr=2958664865"
"244","0.222497","151.101.65.140","100.86.235.39","TLSv1.2","1510","Ignored Unknown Record"
"245","0.222498","151.101.65.140","100.86.235.39","TLSv1.2","1510","Ignored Unknown Record"
"246","0.222499","151.101.65.140","100.86.235.39","SSLv2","1510",""
"247","0.222557","100.86.235.39","151.101.65.140","TCP","78","[TCP Dup ACK 231#5] 56383  >  443 [ACK] Seq=518 Ack=57761 Win=2048 Len=0 TSval=1360024979 TSecr=557249901 SLE=59205 SRE=69313"
"248","0.222602","100.86.235.39","151.101.65.140","TCP","66","56473  >  443 [ACK] Seq=1 Ack=31769 Win=4649 Len=0 TSval=1656597221 TSecr=2958664896"
"249","0.231226","151.101.65.140","100.86.235.39","SSLv2","1510",""
"250","0.231228","151.101.65.140","100.86.235.39","TLSv1.2","1510","Ignored Unknown Record"
"251","0.231229","151.101.65.140","100.86.235.39","TLSv1.2","1510","Ignored Unknown Record"
"252","0.231230","151.101.65.140","100.86.235.39","SSLv2","1510",""
"253","0.231316","100.86.235.39","151.101.65.140","TCP","66","56473  >  443 [ACK] Seq=1 Ack=34657 Win=4627 Len=0 TSval=1656597230 TSecr=2958664903"
"254","0.231418","100.86.235.39","151.101.65.140","TCP","78","[TCP Dup ACK 231#6] 56383  >  443 [ACK] Seq=518 Ack=57761 Win=2048 Len=0 TSval=1360024988 TSecr=557249901 SLE=59205 SRE=72201"
"255","0.238058","151.101.65.140","100.86.235.39","SSLv2","1510",""
"256","0.238060","151.101.65.140","100.86.235.39","TLSv1.2","1510","[TCP Fast Retransmission] , Ignored Unknown Record"
"257","0.238172","100.86.235.39","151.101.65.140","TCP","66","56473  >  443 [ACK] Seq=1 Ack=36101 Win=4649 Len=0 TSval=1656597237 TSecr=2958664903"
"258","0.238294","100.86.235.39","151.101.65.140","TCP","66","56383  >  443 [ACK] Seq=518 Ack=72201 Win=1822 Len=0 TSval=1360024995 TSecr=557249960"
"259","0.238558","100.86.235.39","151.101.65.140","TCP","66","[TCP Window Update] 56383  >  443 [ACK] Seq=518 Ack=72201 Win=2048 Len=0 TSval=1360024995 TSecr=557249960"
"260","0.245902","151.101.65.140","100.86.235.39","TLSv1.2","1510","Ignored Unknown Record"
"261","0.245904","151.101.65.140","100.86.235.39","SSLv2","1510",""
"262","0.246023","100.86.235.39","151.101.65.140","TCP","66","56383  >  443 [ACK] Seq=518 Ack=73645 Win=2025 Len=0 TSval=1360025003 TSecr=557249963"
"263","0.246111","100.86.235.39","151.101.65.140","TCP","66","56473  >  443 [ACK] Seq=1 Ack=37545 Win=4649 Len=0 TSval=1656597245 TSecr=2958664917"
"264","0.255899","151.101.65.140","100.86.235.39","TLSv1.2","1510","Ignored Unknown Record"
"265","0.255901","151.101.65.140","100.86.235.39","TLSv1.2","1510","Ignored Unknown Record"
"266","0.255902","151.101.65.140","100.86.235.39","SSLv2","1510",""
"267","0.255995","100.86.235.39","151.101.65.140","TCP","66","56383  >  443 [ACK] Seq=518 Ack=76533 Win=2002 Len=0 TSval=1360025013 TSecr=557249984"
"268","0.256106","100.86.235.39","151.101.65.140","TCP","66","56473  >  443 [ACK] Seq=1 Ack=38989 Win=4649 Len=0 TSval=1656597255 TSecr=2958664931"
"269","0.264627","151.101.65.140","100.86.235.39","SSLv2","1510",""
"270","0.264628","151.101.65.140","100.86.235.39","TLSv1.2","1510","Ignored Unknown Record"
"271","0.264629","151.101.65.140","100.86.235.39","TLSv1.2","1510","Ignored Unknown Record"
"272","0.264630","151.101.65.140","100.86.235.39","SSLv2","1510",""
"273","0.264714","100.86.235.39","151.101.65.140","TCP","66","56383  >  443 [ACK] Seq=518 Ack=79421 Win=2002 Len=0 TSval=1360025022 TSecr=557249987"
"274","0.264757","100.86.235.39","151.101.65.140","TCP","66","56473  >  443 [ACK] Seq=1 Ack=41877 Win=4672 Len=0 TSval=1656597264 TSecr=2958664939"
"275","0.274746","151.101.65.140","100.86.235.39","SSLv2","1510",""
"276","0.274747","151.101.65.140","100.86.235.39","TLSv1.2","1510","Ignored Unknown Record"
"277","0.274810","100.86.235.39","151.101.65.140","TCP","66","56383  >  443 [ACK] Seq=518 Ack=80865 Win=2025 Len=0 TSval=1360025032 TSecr=557249993"
"278","0.274841","100.86.235.39","151.101.65.140","TCP","66","56473  >  443 [ACK] Seq=1 Ack=43321 Win=4672 Len=0 TSval=1656597274 TSecr=2958664939"
"279","0.281821","151.101.65.140","100.86.235.39","TLSv1.2","1510","Ignored Unknown Record"
"280","0.281822","151.101.65.140","100.86.235.39","TLSv1.2","1510","Ignored Unknown Record"
"281","0.281896","100.86.235.39","151.101.65.140","TCP","66","56383  >  443 [ACK] Seq=518 Ack=83753 Win=2002 Len=0 TSval=1360025039 TSecr=557250010"
"282","0.291716","151.101.65.140","100.86.235.39","SSLv2","1510",""
"283","0.291718","151.101.65.140","100.86.235.39","SSLv2","1510",""
"284","0.291719","151.101.65.140","100.86.235.39","TLSv1.2","1510","Ignored Unknown Record"
"285","0.291720","151.101.65.140","100.86.235.39","TLSv1.2","1510","Ignored Unknown Record"
"286","0.291788","100.86.235.39","151.101.65.140","TCP","66","56383  >  443 [ACK] Seq=518 Ack=86641 Win=2002 Len=0 TSval=1360025049 TSecr=557250019"
"287","0.291815","100.86.235.39","151.101.65.140","TCP","66","56473  >  443 [ACK] Seq=1 Ack=46209 Win=4672 Len=0 TSval=1656597291 TSecr=2958664957"
"288","0.299231","151.101.65.140","100.86.235.39","SSLv2","1510",""
"289","0.299233","151.101.65.140","100.86.235.39","SSLv2","1510","Encrypted Data"
"290","0.299233","151.101.65.140","100.86.235.39","TLSv1.2","1510","Ignored Unknown Record"
"291","0.299234","151.101.65.140","100.86.235.39","TLSv1.2","1510","Ignored Unknown Record"
"292","0.299303","100.86.235.39","151.101.65.140","TCP","66","56383  >  443 [ACK] Seq=518 Ack=89529 Win=2002 Len=0 TSval=1360025056 TSecr=557250024"
"293","0.299401","100.86.235.39","151.101.65.140","TCP","66","56473  >  443 [ACK] Seq=1 Ack=49097 Win=4672 Len=0 TSval=1656597298 TSecr=2958664966"
"294","0.305508","151.101.65.140","100.86.235.39","SSLv2","1510",""
"295","0.305509","151.101.65.140","100.86.235.39","SSLv2","1510",""
"296","0.305606","100.86.235.39","151.101.65.140","TCP","66","56473  >  443 [ACK] Seq=1 Ack=51985 Win=4672 Len=0 TSval=1656597304 TSecr=2958664975"
"297","0.313341","151.101.65.140","100.86.235.39","TLSv1.2","1510","Ignored Unknown Record"
"298","0.313402","100.86.235.39","151.101.65.140","TCP","66","56383  >  443 [ACK] Seq=518 Ack=90973 Win=2025 Len=0 TSval=1360025070 TSecr=557250033"
"299","0.351360","151.101.65.140","100.86.235.39","TLSv1.2","1510","Ignored Unknown Record"
"300","0.351363","151.101.65.140","100.86.235.39","TLSv1.2","1510","Ignored Unknown Record"
