"No.","Time","Source","Destination","Protocol","Length","Info"
"1","0.000000","151.101.65.140","100.86.235.39","TLSv1.2","208","Application Data"
"2","0.000132","100.86.235.39","151.101.65.140","TCP","66","56383  >  443 [ACK] Seq=1 Ack=143 Win=2045 Len=0 TSval=1359923280 TSecr=557148257"
"3","0.028787","151.101.65.140","100.86.235.39","TLSv1.2","947","Application Data"
"4","0.028997","100.86.235.39","151.101.65.140","TCP","66","56383  >  443 [ACK] Seq=1 Ack=1024 Win=2048 Len=0 TSval=1359923308 TSecr=557148286"
"5","0.032070","151.101.65.140","100.86.235.39","TLSv1.2","111","Application Data"
"6","0.032271","100.86.235.39","151.101.65.140","TCP","66","56383  >  443 [ACK] Seq=1 Ack=1069 Win=2048 Len=0 TSval=1359923312 TSecr=557148290"
"7","0.036568","151.101.65.140","100.86.235.39","TLSv1.2","124","Application Data"
"8","0.036717","100.86.235.39","151.101.65.140","TCP","66","56383  >  443 [ACK] Seq=1 Ack=1127 Win=2048 Len=0 TSval=1359923316 TSecr=557148294"
"9","0.038931","151.101.65.140","100.86.235.39","TLSv1.2","167","Application Data"
"10","0.039113","100.86.235.39","151.101.65.140","TCP","66","56383  >  443 [ACK] Seq=1 Ack=1228 Win=2048 Len=0 TSval=1359923319 TSecr=557148297"
"11","0.045271","151.101.65.140","100.86.235.39","TLSv1.2","125","Application Data"
"12","0.045457","100.86.235.39","151.101.65.140","TCP","66","56383  >  443 [ACK] Seq=1 Ack=1287 Win=2048 Len=0 TSval=1359923325 TSecr=557148303"
"13","0.054369","151.101.65.140","100.86.235.39","TLSv1.2","140","Application Data"
"14","0.054643","100.86.235.39","151.101.65.140","TCP","66","56383  >  443 [ACK] Seq=1 Ack=1361 Win=2048 Len=0 TSval=1359923334 TSecr=557148311"
"15","0.056272","151.101.65.140","100.86.235.39","TLSv1.2","146","Application Data"
"16","0.056514","100.86.235.39","151.101.65.140","TCP","66","56383  >  443 [ACK] Seq=1 Ack=1441 Win=2048 Len=0 TSval=1359923336 TSecr=557148314"
"17","0.057117","151.101.65.140","100.86.235.39","TLSv1.2","230","Application Data"
"18","0.057339","100.86.235.39","151.101.65.140","TCP","66","56383  >  443 [ACK] Seq=1 Ack=1605 Win=2048 Len=0 TSval=1359923336 TSecr=557148314"
"19","0.057678","151.101.65.140","100.86.235.39","TLSv1.2","621","Application Data"
"20","0.057684","151.101.65.140","100.86.235.39","TLSv1.2","245","Application Data"
"21","0.057790","151.101.65.140","100.86.235.39","TLSv1.2","157","Application Data"
"22","0.057923","100.86.235.39","151.101.65.140","TCP","66","56383  >  443 [ACK] Seq=1 Ack=2430 Win=2048 Len=0 TSval=1359923337 TSecr=557148315"
"23","0.061137","151.101.65.140","100.86.235.39","TLSv1.2","114","Application Data"
"24","0.061138","151.101.65.140","100.86.235.39","TLSv1.2","148","Application Data"
"25","0.061399","100.86.235.39","151.101.65.140","TCP","66","56383  >  443 [ACK] Seq=1 Ack=2560 Win=2048 Len=0 TSval=1359923341 TSecr=557148316"
"26","0.061875","151.101.65.140","100.86.235.39","TLSv1.2","166","Application Data"
"27","0.061877","151.101.65.140","100.86.235.39","TLSv1.2","612","Application Data"
"28","0.062116","100.86.235.39","151.101.65.140","TCP","66","56383  >  443 [ACK] Seq=1 Ack=3206 Win=2048 Len=0 TSval=1359923341 TSecr=557148318"
"29","0.065187","151.101.65.140","100.86.235.39","TLSv1.2","123","Application Data"
"30","0.065291","100.86.235.39","151.101.65.140","TCP","66","56383  >  443 [ACK] Seq=1 Ack=3263 Win=2048 Len=0 TSval=1359923345 TSecr=557148322"
"31","0.090256","151.101.65.140","100.86.235.39","TLSv1.2","751","Application Data"
"32","0.090258","151.101.65.140","100.86.235.39","TLSv1.2","511","Application Data"
"33","0.090640","100.86.235.39","151.101.65.140","TCP","66","56383  >  443 [ACK] Seq=1 Ack=4393 Win=2048 Len=0 TSval=1359923370 TSecr=557148348"
"34","0.094124","151.101.65.140","100.86.235.39","TLSv1.2","619","Application Data"
"35","0.094313","100.86.235.39","151.101.65.140","TCP","66","56383  >  443 [ACK] Seq=1 Ack=4946 Win=2048 Len=0 TSval=1359923374 TSecr=557148352"
"36","0.098617","151.101.65.140","100.86.235.39","TLSv1.2","105","Application Data"
"37","0.098855","100.86.235.39","151.101.65.140","TCP","66","56383  >  443 [ACK] Seq=1 Ack=4985 Win=2048 Len=0 TSval=1359923378 TSecr=557148356"
"38","0.109574","151.101.65.140","100.86.235.39","TLSv1.2","154","Application Data"
"39","0.109826","100.86.235.39","151.101.65.140","TCP","66","56383  >  443 [ACK] Seq=1 Ack=5073 Win=2048 Len=0 TSval=1359923389 TSecr=557148367"
"40","0.116709","151.101.65.140","100.86.235.39","TLSv1.2","201","Application Data"
"41","0.116960","100.86.235.39","151.101.65.140","TCP","66","56383  >  443 [ACK] Seq=1 Ack=5208 Win=2048 Len=0 TSval=1359923396 TSecr=557148374"
"42","0.132347","151.101.65.140","100.86.235.39","TCP","1510","443  >  56383 [ACK] Seq=5208 Ack=1 Win=538 Len=1444 TSval=557148390 TSecr=1359923396 [TCP PDU reassembled in 43]"
"43","0.132890","151.101.65.140","100.86.235.39","TLSv1.2","153","Application Data"
"44","0.133003","100.86.235.39","151.101.65.140","TCP","66","56383  >  443 [ACK] Seq=1 Ack=6739 Win=2046 Len=0 TSval=1359923412 TSecr=557148390"
"45","0.146347","151.101.65.140","100.86.235.39","TLSv1.2","1076","Application Data"
"46","0.146349","151.101.65.140","100.86.235.39","TLSv1.2","1064","Application Data"
"47","0.146351","151.101.65.140","100.86.235.39","TLSv1.2","544","Application Data"
"48","0.146489","100.86.235.39","151.101.65.140","TCP","66","56383  >  443 [ACK] Seq=1 Ack=9225 Win=2009 Len=0 TSval=1359923426 TSecr=557148403"
"49","0.147388","151.101.65.140","100.86.235.39","TLSv1.2","664","Application Data"
"50","0.147478","100.86.235.39","151.101.65.140","TCP","66","56383  >  443 [ACK] Seq=1 Ack=9823 Win=2038 Len=0 TSval=1359923426 TSecr=557148404"
"51","0.147643","151.101.65.140","100.86.235.39","TCP","1510","443  >  56383 [ACK] Seq=9823 Ack=1 Win=538 Len=1444 TSval=557148405 TSecr=1359923412 [TCP PDU reassembled in 52]"
"52","0.147647","151.101.65.140","100.86.235.39","TLSv1.2","120","Application Data"
"53","0.147747","100.86.235.39","151.101.65.140","TCP","66","56383  >  443 [ACK] Seq=1 Ack=11321 Win=2024 Len=0 TSval=1359923427 TSecr=557148405"
"54","0.148005","151.101.65.140","100.86.235.39","TLSv1.2","535","Application Data"
"55","0.148102","100.86.235.39","151.101.65.140","TCP","66","56383  >  443 [ACK] Seq=1 Ack=11790 Win=2040 Len=0 TSval=1359923427 TSecr=557148406"
"56","0.154806","151.101.65.140","100.86.235.39","TLSv1.2","294","Application Data"
"57","0.154905","100.86.235.39","151.101.65.140","TCP","66","56383  >  443 [ACK] Seq=1 Ack=12018 Win=2044 Len=0 TSval=1359923435 TSecr=557148412"
"58","0.155697","151.101.65.140","100.86.235.39","TLSv1.2","174","Application Data"
"59","0.155768","100.86.235.39","151.101.65.140","TCP","66","56383  >  443 [ACK] Seq=1 Ack=12126 Win=2046 Len=0 TSval=1359923435 TSecr=557148414"
"60","0.172498","151.101.65.140","100.86.235.39","TLSv1.2","342","Application Data"
"61","0.172991","100.86.235.39","151.101.65.140","TCP","66","56383  >  443 [ACK] Seq=1 Ack=12402 Win=2048 Len=0 TSval=1359923452 TSecr=557148430"
"62","0.193803","151.101.65.140","100.86.235.39","TLSv1.2","172","Application Data"
"63","0.193922","100.86.235.39","151.101.65.140","TCP","66","56383  >  443 [ACK] Seq=1 Ack=12508 Win=2048 Len=0 TSval=1359923473 TSecr=557148451"
"64","0.197632","151.101.65.140","100.86.235.39","TLSv1.2","138","Application Data"
"65","0.197752","100.86.235.39","151.101.65.140","TCP","66","56383  >  443 [ACK] Seq=1 Ack=12580 Win=2048 Len=0 TSval=1359923477 TSecr=557148455"
"66","0.200212","151.101.65.140","100.86.235.39","TLSv1.2","179","Application Data"
"67","0.200328","100.86.235.39","151.101.65.140","TCP","66","56383  >  443 [ACK] Seq=1 Ack=12693 Win=2048 Len=0 TSval=1359923480 TSecr=557148458"
"68","0.211266","151.101.65.140","100.86.235.39","TLSv1.2","542","Application Data"
"69","0.211393","100.86.235.39","151.101.65.140","TCP","66","56383  >  443 [ACK] Seq=1 Ack=13169 Win=2048 Len=0 TSval=1359923491 TSecr=557148468"
"70","0.211867","151.101.65.140","100.86.235.39","TLSv1.2","309","Application Data"
"71","0.211943","100.86.235.39","151.101.65.140","TCP","66","56383  >  443 [ACK] Seq=1 Ack=13412 Win=2048 Len=0 TSval=1359923491 TSecr=557148469"
"72","0.214296","151.101.65.140","100.86.235.39","TLSv1.2","260","Application Data"
"73","0.214384","100.86.235.39","151.101.65.140","TCP","66","56383  >  443 [ACK] Seq=1 Ack=13606 Win=2048 Len=0 TSval=1359923494 TSecr=557148472"
"74","0.215497","151.101.65.140","100.86.235.39","TLSv1.2","424","Application Data"
"75","0.215500","151.101.65.140","100.86.235.39","TLSv1.2","233","Application Data"
"76","0.215500","151.101.65.140","100.86.235.39","TLSv1.2","174","Application Data"
"77","0.215673","100.86.235.39","151.101.65.140","TCP","66","56383  >  443 [ACK] Seq=1 Ack=14239 Win=2048 Len=0 TSval=1359923495 TSecr=557148473"
"78","0.216355","151.101.65.140","100.86.235.39","TLSv1.2","176","Application Data"
"79","0.216356","151.101.65.140","100.86.235.39","TCP","1510","443  >  56383 [ACK] Seq=14349 Ack=1 Win=538 Len=1444 TSval=557148473 TSecr=1359923480 [TCP PDU reassembled in 80]"
"80","0.216359","151.101.65.140","100.86.235.39","TLSv1.2","200","Application Data"
"81","0.216360","151.101.65.140","100.86.235.39","TLSv1.2","894","Application Data"
"82","0.216424","100.86.235.39","151.101.65.140","TCP","66","56383  >  443 [ACK] Seq=1 Ack=16755 Win=2008 Len=0 TSval=1359923495 TSecr=557148474"
"83","0.217764","151.101.65.140","100.86.235.39","TLSv1.2","581","Application Data"
"84","0.217767","151.101.65.140","100.86.235.39","TLSv1.2","214","Application Data"
"85","0.217767","151.101.65.140","100.86.235.39","TLSv1.2","269","Application Data"
"86","0.217769","151.101.65.140","100.86.235.39","TLSv1.2","105","Application Data"
"87","0.217769","151.101.65.140","100.86.235.39","TLSv1.2","106","Application Data"
"88","0.217770","151.101.65.140","100.86.235.39","TLSv1.2","137","Application Data"
"89","0.217895","100.86.235.39","151.101.65.140","TCP","66","56383  >  443 [ACK] Seq=1 Ack=17771 Win=2032 Len=0 TSval=1359923497 TSecr=557148474"
"90","0.218439","151.101.65.140","100.86.235.39","TLSv1.2","349","Application Data"
"91","0.218440","151.101.65.140","100.86.235.39","TLSv1.2","148","Application Data"
"92","0.218514","100.86.235.39","151.101.65.140","TCP","66","56383  >  443 [ACK] Seq=1 Ack=18136 Win=2042 Len=0 TSval=1359923497 TSecr=557148475"
"93","0.218882","151.101.65.140","100.86.235.39","TLSv1.2","176","Application Data"
"94","0.218882","151.101.65.140","100.86.235.39","TLSv1.2","242","Application Data"
"95","0.218927","100.86.235.39","151.101.65.140","TCP","66","56383  >  443 [ACK] Seq=1 Ack=18422 Win=2043 Len=0 TSval=1359923499 TSecr=557148476"
"96","0.221867","151.101.65.140","100.86.235.39","TLSv1.2","1510","Application Data, Application Data, Application Data, Application Data, Application Data, Application Data, Application Data, Application Data, Application Data"
"97","0.223634","151.101.65.140","100.86.235.39","TLSv1.2","107","Application Data"
"98","0.223639","151.101.65.140","100.86.235.39","TLSv1.2","570","Application Data, Application Data"
"99","0.223711","100.86.235.39","151.101.65.140","TCP","66","56383  >  443 [ACK] Seq=1 Ack=20411 Win=2039 Len=0 TSval=1359923503 TSecr=557148479"
"100","0.224543","151.101.65.140","100.86.235.39","TLSv1.2","1510","Application Data"
"101","0.226417","151.101.65.140","100.86.235.39","TLSv1.2","1318","Application Data, Application Data"
"102","0.226479","100.86.235.39","151.101.65.140","TCP","66","56383  >  443 [ACK] Seq=1 Ack=23107 Win=2028 Len=0 TSval=1359923506 TSecr=557148482"
"103","0.231817","151.101.65.140","100.86.235.39","TLSv1.2","390","Application Data"
"104","0.231880","100.86.235.39","151.101.65.140","TCP","66","56383  >  443 [ACK] Seq=1 Ack=23431 Win=2042 Len=0 TSval=1359923511 TSecr=557148489"
"105","0.232465","151.101.65.140","100.86.235.39","TLSv1.2","393","Application Data"
"106","0.232564","100.86.235.39","151.101.65.140","TCP","66","56383  >  443 [ACK] Seq=1 Ack=23758 Win=2048 Len=0 TSval=1359923511 TSecr=557148490"
"107","0.239125","151.101.65.140","100.86.235.39","TLSv1.2","580","Application Data"
"108","0.239255","100.86.235.39","151.101.65.140","TCP","66","56383  >  443 [ACK] Seq=1 Ack=24272 Win=2048 Len=0 TSval=1359923519 TSecr=557148495"
"109","0.240971","151.101.65.140","100.86.235.39","TLSv1.2","325","Application Data"
"110","0.240979","151.101.65.140","100.86.235.39","TLSv1.2","270","Application Data"
"111","0.241133","100.86.235.39","151.101.65.140","TCP","66","56383  >  443 [ACK] Seq=1 Ack=24735 Win=2048 Len=0 TSval=1359923521 TSecr=557148496"
"112","0.241212","151.101.65.140","100.86.235.39","TLSv1.2","480","Application Data"
"113","0.241287","100.86.235.39","151.101.65.140","TCP","66","56383  >  443 [ACK] Seq=1 Ack=25149 Win=2048 Len=0 TSval=1359923521 TSecr=557148497"
"114","0.308424","100.86.235.39","151.101.65.140","TCP","1514","56383  >  443 [ACK] Seq=1 Ack=25149 Win=2048 Len=1448 TSval=1359923588 TSecr=557148497 [TCP PDU reassembled in 116]"
"115","0.308426","100.86.235.39","151.101.65.140","TCP","1514","56383  >  443 [ACK] Seq=1449 Ack=25149 Win=2048 Len=1448 TSval=1359923588 TSecr=557148497 [TCP PDU reassembled in 116]"
"116","0.308472","100.86.235.39","151.101.65.140","TLSv1.2","135","Application Data"
"117","0.308521","100.86.235.39","151.101.65.140","TLSv1.2","222","Application Data"
"118","0.318460","151.101.65.140","100.86.235.39","TCP","66","443  >  56383 [ACK] Seq=25149 Ack=3122 Win=533 Len=0 TSval=557148577 TSecr=1359923588"
"119","0.319336","100.86.235.39","151.101.65.140","TCP","1514","56383  >  443 [ACK] Seq=3122 Ack=25149 Win=2048 Len=1448 TSval=1359923598 TSecr=557148577 [TCP PDU reassembled in 121]"
"120","0.319339","100.86.235.39","151.101.65.140","TCP","1514","56383  >  443 [ACK] Seq=4570 Ack=25149 Win=2048 Len=1448 TSval=1359923598 TSecr=557148577 [TCP PDU reassembled in 121]"
"121","0.319393","100.86.235.39","151.101.65.140","TLSv1.2","187","Application Data"
"122","0.319427","100.86.235.39","151.101.65.140","TLSv1.2","273","Application Data"
"123","0.330120","151.101.65.140","100.86.235.39","TCP","66","443  >  56383 [ACK] Seq=25149 Ack=6346 Win=534 Len=0 TSval=557148588 TSecr=1359923598"
"124","0.349838","100.86.235.39","151.101.65.140","TLSv1.2","224","Application Data"
"125","0.357051","100.86.235.39","151.101.65.140","TLSv1.2","227","Application Data"
"126","0.357388","100.86.235.39","151.101.65.140","TLSv1.2","222","Application Data"
"127","0.357607","100.86.235.39","151.101.65.140","TLSv1.2","218","Application Data"
"128","0.361731","151.101.65.140","100.86.235.39","TCP","66","443  >  56438 [ACK] Seq=1 Ack=159 Win=424 Len=0 TSval=3000714020 TSecr=3707549463"
"129","0.363428","151.101.65.140","100.86.235.39","TLSv1.2","216","Application Data"
"130","0.363505","100.86.235.39","151.101.65.140","TCP","66","56438  >  443 [ACK] Seq=320 Ack=151 Win=7860 Len=0 TSval=3707549477 TSecr=3000714022"
"131","0.364218","151.101.65.140","100.86.235.39","TCP","1510","443  >  56438 [ACK] Seq=151 Ack=159 Win=424 Len=1444 TSval=3000714023 TSecr=3707549463 [TCP PDU reassembled in 162]"
"132","0.364287","100.86.235.39","151.101.65.140","TCP","66","56438  >  443 [ACK] Seq=320 Ack=1595 Win=7840 Len=0 TSval=3707549477 TSecr=3000714023"
"133","0.366315","151.101.65.140","100.86.235.39","TCP","1510","443  >  56438 [PSH, ACK] Seq=1595 Ack=159 Win=424 Len=1444 TSval=3000714023 TSecr=3707549463 [TCP PDU reassembled in 162]"
"134","0.366397","100.86.235.39","151.101.65.140","TCP","66","56438  >  443 [ACK] Seq=320 Ack=3039 Win=7840 Len=0 TSval=3707549480 TSecr=3000714023"
"135","0.366956","151.101.65.140","100.86.235.39","TCP","1510","443  >  56438 [ACK] Seq=3039 Ack=159 Win=424 Len=1444 TSval=3000714025 TSecr=3707549463 [TCP PDU reassembled in 162]"
"136","0.366957","151.101.65.140","100.86.235.39","TCP","1510","443  >  56438 [PSH, ACK] Seq=4483 Ack=159 Win=424 Len=1444 TSval=3000714025 TSecr=3707549463 [TCP PDU reassembled in 162]"
"137","0.367032","100.86.235.39","151.101.65.140","TCP","66","56438  >  443 [ACK] Seq=320 Ack=5927 Win=7817 Len=0 TSval=3707549480 TSecr=3000714025"
"138","0.367538","151.101.65.140","100.86.235.39","TCP","1510","443  >  56438 [ACK] Seq=5927 Ack=159 Win=424 Len=1444 TSval=3000714027 TSecr=3707549463 [TCP PDU reassembled in 162]"
"139","0.367596","100.86.235.39","151.101.65.140","TCP","66","56438  >  443 [ACK] Seq=320 Ack=7371 Win=7840 Len=0 TSval=3707549481 TSecr=3000714027"
"140","0.367824","151.101.65.140","100.86.235.39","TCP","1510","443  >  56438 [PSH, ACK] Seq=7371 Ack=159 Win=424 Len=1444 TSval=3000714027 TSecr=3707549463 [TCP PDU reassembled in 162]"
"141","0.367824","151.101.65.140","100.86.235.39","TCP","66","443  >  56449 [ACK] Seq=1 Ack=309 Win=424 Len=0 TSval=867505621 TSecr=921799269"
"142","0.367876","100.86.235.39","151.101.65.140","TCP","66","56438  >  443 [ACK] Seq=320 Ack=8815 Win=7840 Len=0 TSval=3707549481 TSecr=3000714027"
"143","0.370678","100.86.235.39","151.101.1.140","TLSv1.2","239","Application Data"
"144","0.370910","151.101.65.140","100.86.235.39","TLSv1.2","786","Application Data"
"145","0.370911","151.101.65.140","100.86.235.39","TCP","1510","443  >  56438 [ACK] Seq=8815 Ack=159 Win=424 Len=1444 TSval=3000714029 TSecr=3707549463 [TCP PDU reassembled in 162]"
"146","0.370914","151.101.65.140","100.86.235.39","TCP","1510","443  >  56449 [ACK] Seq=721 Ack=309 Win=424 Len=1444 TSval=867505624 TSecr=921799269 [TCP PDU reassembled in 219]"
"147","0.370995","151.101.65.140","100.86.235.39","TCP","1510","443  >  56449 [PSH, ACK] Seq=2165 Ack=309 Win=424 Len=1444 TSval=867505624 TSecr=921799269 [TCP PDU reassembled in 219]"
"148","0.370996","151.101.65.140","100.86.235.39","TCP","66","443  >  56438 [ACK] Seq=10259 Ack=320 Win=424 Len=0 TSval=3000714030 TSecr=3707549471"
"149","0.371020","100.86.235.39","151.101.65.140","TCP","66","56449  >  443 [ACK] Seq=309 Ack=3609 Win=5272 Len=0 TSval=921799282 TSecr=867505624"
"150","0.371021","100.86.235.39","151.101.65.140","TCP","66","56438  >  443 [ACK] Seq=320 Ack=10259 Win=7840 Len=0 TSval=3707549484 TSecr=3000714029"
"151","0.371316","100.86.235.39","151.101.65.140","TCP","66","[TCP Window Update] 56449  >  443 [ACK] Seq=309 Ack=3609 Win=5328 Len=0 TSval=921799282 TSecr=867505624"
"152","0.374113","151.101.65.140","100.86.235.39","TCP","1510","443  >  56438 [ACK] Seq=10259 Ack=320 Win=424 Len=1444 TSval=3000714033 TSecr=3707549477 [TCP PDU reassembled in 162]"
"153","0.374176","100.86.235.39","151.101.65.140","TCP","66","56438  >  443 [ACK] Seq=320 Ack=11703 Win=7840 Len=0 TSval=3707549488 TSecr=3000714033"
"154","0.376731","151.101.65.140","100.86.235.39","TCP","1510","443  >  56449 [ACK] Seq=3609 Ack=309 Win=424 Len=1444 TSval=867505630 TSecr=921799269 [TCP PDU reassembled in 219]"
"155","0.376809","100.86.235.39","151.101.65.140","TCP","66","56449  >  443 [ACK] Seq=309 Ack=5053 Win=5306 Len=0 TSval=921799288 TSecr=867505630"
"156","0.377326","151.101.65.140","100.86.235.39","TCP","1510","443  >  56449 [PSH, ACK] Seq=5053 Ack=309 Win=424 Len=1444 TSval=867505630 TSecr=921799269 [TCP PDU reassembled in 219]"
"157","0.377380","100.86.235.39","151.101.65.140","TCP","66","56449  >  443 [ACK] Seq=309 Ack=6497 Win=5306 Len=0 TSval=921799288 TSecr=867505630"
"158","0.377662","151.101.65.140","100.86.235.39","TCP","1510","443  >  56438 [ACK] Seq=11703 Ack=320 Win=424 Len=1444 TSval=3000714036 TSecr=3707549481 [TCP PDU reassembled in 162]"
"159","0.377663","151.101.65.140","100.86.235.39","TCP","1510","443  >  56438 [PSH, ACK] Seq=13147 Ack=320 Win=424 Len=1444 TSval=3000714036 TSecr=3707549481 [TCP PDU reassembled in 162]"
"160","0.377716","100.86.235.39","151.101.65.140","TCP","66","56438  >  443 [ACK] Seq=320 Ack=14591 Win=7817 Len=0 TSval=3707549490 TSecr=3000714036"
"161","0.378641","151.101.65.140","100.86.235.39","TCP","1510","443  >  56438 [ACK] Seq=14591 Ack=320 Win=424 Len=1444 TSval=3000714037 TSecr=3707549481 [TCP PDU reassembled in 162]"
"162","0.378641","151.101.65.140","100.86.235.39","TLSv1.2","1510","Application Data, Application Data"
"163","0.378676","100.86.235.39","151.101.65.140","TCP","66","56438  >  443 [ACK] Seq=320 Ack=17479 Win=7817 Len=0 TSval=3707549491 TSecr=3000714037"
"164","0.380086","151.101.65.140","100.86.235.39","TCP","1510","443  >  56383 [ACK] Seq=25149 Ack=6346 Win=538 Len=1444 TSval=557148638 TSecr=1359923598 [TCP PDU reassembled in 165]"
"165","0.380125","151.101.65.140","100.86.235.39","TLSv1.2","1022","Application Data"
"166","0.380125","151.101.65.140","100.86.235.39","TCP","1510","443  >  56438 [ACK] Seq=17479 Ack=320 Win=424 Len=1444 TSval=3000714039 TSecr=3707549481 [TCP PDU reassembled in 216]"
"167","0.380178","100.86.235.39","151.101.65.140","TCP","66","56383  >  443 [ACK] Seq=6346 Ack=26593 Win=2025 Len=0 TSval=1359923660 TSecr=557148638"
"168","0.380251","100.86.235.39","151.101.65.140","TCP","66","56438  >  443 [ACK] Seq=320 Ack=18923 Win=7840 Len=0 TSval=3707549494 TSecr=3000714039"
"169","0.380293","100.86.235.39","151.101.65.140","TCP","66","56383  >  443 [ACK] Seq=6346 Ack=27549 Win=2048 Len=0 TSval=1359923660 TSecr=557148638"
"170","0.380725","151.101.65.140","100.86.235.39","TCP","1510","443  >  56438 [PSH, ACK] Seq=18923 Ack=320 Win=424 Len=1444 TSval=3000714039 TSecr=3707549481 [TCP PDU reassembled in 216]"
"171","0.380778","100.86.235.39","151.101.65.140","TCP","66","56438  >  443 [ACK] Seq=320 Ack=20367 Win=7840 Len=0 TSval=3707549494 TSecr=3000714039"
"172","0.383466","151.101.65.140","100.86.235.39","TCP","1510","443  >  56449 [ACK] Seq=6497 Ack=309 Win=424 Len=1444 TSval=867505635 TSecr=921799282 [TCP PDU reassembled in 219]"
"173","0.383467","151.101.1.140","100.86.235.39","TCP","66","443  >  56444 [ACK] Seq=1 Ack=174 Win=366 Len=0 TSval=3958119317 TSecr=1368239185"
"174","0.383564","100.86.235.39","151.101.65.140","TCP","66","56449  >  443 [ACK] Seq=309 Ack=7941 Win=5306 Len=0 TSval=921799295 TSecr=867505635"
"175","0.384481","151.101.65.140","100.86.235.39","TCP","1510","443  >  56438 [ACK] Seq=20367 Ack=320 Win=424 Len=1444 TSval=3000714043 TSecr=3707549488 [TCP PDU reassembled in 216]"
"176","0.384489","151.101.65.140","100.86.235.39","TCP","1510","443  >  56438 [PSH, ACK] Seq=21811 Ack=320 Win=424 Len=1444 TSval=3000714043 TSecr=3707549488 [TCP PDU reassembled in 216]"
"177","0.384565","100.86.235.39","151.101.65.140","TCP","66","56438  >  443 [ACK] Seq=320 Ack=23255 Win=7817 Len=0 TSval=3707549498 TSecr=3000714043"
"178","0.385429","151.101.1.140","100.86.235.39","TLSv1.2","214","Application Data"
"179","0.385430","151.101.65.140","100.86.235.39","TCP","1510","[TCP Previous segment not captured] 443  >  56449 [ACK] Seq=9385 Ack=309 Win=424 Len=1444 TSval=867505639 TSecr=921799282 [TCP PDU reassembled in 219]"
"180","0.385486","100.86.235.39","151.101.1.140","TCP","66","56444  >  443 [ACK] Seq=174 Ack=149 Win=7113 Len=0 TSval=1368239199 TSecr=3958119320"
"181","0.385522","100.86.235.39","151.101.65.140","TCP","78","[TCP Dup ACK 174#1] 56449  >  443 [ACK] Seq=309 Ack=7941 Win=5328 Len=0 TSval=921799296 TSecr=867505635 SLE=9385 SRE=10829"
"182","0.387406","151.101.65.140","100.86.235.39","TCP","1510","443  >  56449 [PSH, ACK] Seq=10829 Ack=309 Win=424 Len=1444 TSval=867505639 TSecr=921799282 [TCP PDU reassembled in 219]"
"183","0.387407","151.101.1.140","100.86.235.39","TCP","1510","443  >  56444 [ACK] Seq=149 Ack=174 Win=366 Len=1444 TSval=3958119321 TSecr=1368239185 [TCP PDU reassembled in 205]"
"184","0.387408","151.101.1.140","100.86.235.39","TCP","1510","443  >  56444 [PSH, ACK] Seq=1593 Ack=174 Win=366 Len=1444 TSval=3958119321 TSecr=1368239185 [TCP PDU reassembled in 205]"
"185","0.387410","151.101.1.140","100.86.235.39","TCP","1510","443  >  56444 [ACK] Seq=3037 Ack=174 Win=366 Len=1444 TSval=3958119321 TSecr=1368239185 [TCP PDU reassembled in 205]"
"186","0.387411","151.101.1.140","100.86.235.39","TCP","1510","443  >  56444 [PSH, ACK] Seq=4481 Ack=174 Win=366 Len=1444 TSval=3958119321 TSecr=1368239185 [TCP PDU reassembled in 205]"
"187","0.387511","100.86.235.39","151.101.1.140","TCP","66","56444  >  443 [ACK] Seq=174 Ack=5925 Win=7025 Len=0 TSval=1368239201 TSecr=3958119321"
"188","0.387574","100.86.235.39","151.101.65.140","TCP","78","[TCP Dup ACK 174#2] 56449  >  443 [ACK] Seq=309 Ack=7941 Win=5328 Len=0 TSval=921799298 TSecr=867505635 SLE=9385 SRE=12273"
"189","0.387621","100.86.235.39","151.101.1.140","TCP","66","[TCP Window Update] 56444  >  443 [ACK] Seq=174 Ack=5925 Win=7116 Len=0 TSval=1368239201 TSecr=3958119321"
"190","0.387952","151.101.1.140","100.86.235.39","TCP","1510","443  >  56444 [ACK] Seq=5925 Ack=174 Win=366 Len=1444 TSval=3958119322 TSecr=1368239185 [TCP PDU reassembled in 205]"
"191","0.387955","151.101.1.140","100.86.235.39","TCP","1510","443  >  56444 [PSH, ACK] Seq=7369 Ack=174 Win=366 Len=1444 TSval=3958119322 TSecr=1368239185 [TCP PDU reassembled in 205]"
"192","0.387960","151.101.65.140","100.86.235.39","TCP","1510","443  >  56438 [ACK] Seq=23255 Ack=320 Win=424 Len=1444 TSval=3000714047 TSecr=3707549490 [TCP PDU reassembled in 216]"
"193","0.388028","100.86.235.39","151.101.1.140","TCP","66","56444  >  443 [ACK] Seq=174 Ack=8813 Win=7070 Len=0 TSval=1368239203 TSecr=3958119322"
"194","0.388069","100.86.235.39","151.101.65.140","TCP","66","56438  >  443 [ACK] Seq=320 Ack=24699 Win=7840 Len=0 TSval=3707549502 TSecr=3000714047"
"195","0.389255","151.101.65.140","100.86.235.39","TCP","1510","443  >  56438 [PSH, ACK] Seq=24699 Ack=320 Win=424 Len=1444 TSval=3000714047 TSecr=3707549490 [TCP PDU reassembled in 216]"
"196","0.389256","151.101.1.140","100.86.235.39","TCP","1510","443  >  56444 [ACK] Seq=8813 Ack=174 Win=366 Len=1444 TSval=3958119323 TSecr=1368239185 [TCP PDU reassembled in 205]"
"197","0.389343","100.86.235.39","151.101.1.140","TCP","66","56444  >  443 [ACK] Seq=174 Ack=10257 Win=7093 Len=0 TSval=1368239204 TSecr=3958119323"
"198","0.389412","100.86.235.39","151.101.65.140","TCP","66","56438  >  443 [ACK] Seq=320 Ack=26143 Win=7840 Len=0 TSval=3707549503 TSecr=3000714047"
"199","0.391044","151.101.1.140","100.86.235.39","TCP","1510","443  >  56444 [PSH, ACK] Seq=10257 Ack=174 Win=366 Len=1444 TSval=3958119323 TSecr=1368239185 [TCP PDU reassembled in 205]"
"200","0.391047","151.101.65.140","100.86.235.39","TCP","1510","443  >  56449 [ACK] Seq=12273 Ack=309 Win=424 Len=1444 TSval=867505642 TSecr=921799282 [TCP PDU reassembled in 219]"
"201","0.391048","151.101.65.140","100.86.235.39","TCP","1510","443  >  56449 [PSH, ACK] Seq=13717 Ack=309 Win=424 Len=1444 TSval=867505642 TSecr=921799282 [TCP PDU reassembled in 219]"
"202","0.391052","151.101.1.140","100.86.235.39","TCP","1510","443  >  56444 [ACK] Seq=11701 Ack=174 Win=366 Len=1444 TSval=3958119324 TSecr=1368239185 [TCP PDU reassembled in 205]"
"203","0.391129","100.86.235.39","151.101.1.140","TCP","66","56444  >  443 [ACK] Seq=174 Ack=13145 Win=7070 Len=0 TSval=1368239206 TSecr=3958119324"
"204","0.391213","100.86.235.39","151.101.65.140","TCP","78","[TCP Dup ACK 174#3] 56449  >  443 [ACK] Seq=309 Ack=7941 Win=5328 Len=0 TSval=921799303 TSecr=867505635 SLE=9385 SRE=15161"
"205","0.393049","151.101.1.140","100.86.235.39","TLSv1.2","967","Application Data"
"206","0.393050","151.101.65.140","100.86.235.39","TCP","1510","443  >  56438 [ACK] Seq=26143 Ack=320 Win=424 Len=1444 TSval=3000714049 TSecr=3707549491 [TCP PDU reassembled in 216]"
"207","0.393051","151.101.65.140","100.86.235.39","TCP","1510","443  >  56438 [PSH, ACK] Seq=27587 Ack=320 Win=424 Len=1444 TSval=3000714049 TSecr=3707549491 [TCP PDU reassembled in 216]"
"208","0.393052","151.101.65.140","100.86.235.39","TCP","1510","443  >  56438 [ACK] Seq=29031 Ack=320 Win=424 Len=1444 TSval=3000714050 TSecr=3707549494 [TCP PDU reassembled in 216]"
"209","0.393052","151.101.65.140","100.86.235.39","TCP","1510","443  >  56438 [PSH, ACK] Seq=30475 Ack=320 Win=424 Len=1444 TSval=3000714050 TSecr=3707549494 [TCP PDU reassembled in 216]"
"210","0.393053","151.101.65.140","100.86.235.39","TCP","1510","443  >  56449 [ACK] Seq=15161 Ack=309 Win=424 Len=1444 TSval=867505646 TSecr=921799288 [TCP PDU reassembled in 219]"
"211","0.393054","151.101.65.140","100.86.235.39","TCP","1510","443  >  56449 [PSH, ACK] Seq=16605 Ack=309 Win=424 Len=1444 TSval=867505646 TSecr=921799288 [TCP PDU reassembled in 219]"
"212","0.393155","100.86.235.39","151.101.1.140","TCP","66","56444  >  443 [ACK] Seq=174 Ack=14046 Win=7101 Len=0 TSval=1368239208 TSecr=3958119324"
"213","0.393244","100.86.235.39","151.101.65.140","TCP","66","56438  >  443 [ACK] Seq=320 Ack=31919 Win=7772 Len=0 TSval=3707549507 TSecr=3000714050"
"214","0.393290","100.86.235.39","151.101.65.140","TCP","78","[TCP Dup ACK 174#4] 56449  >  443 [ACK] Seq=309 Ack=7941 Win=5328 Len=0 TSval=921799305 TSecr=867505635 SLE=9385 SRE=18049"
"215","0.393446","100.86.235.39","151.101.65.140","TCP","66","[TCP Window Update] 56438  >  443 [ACK] Seq=320 Ack=31919 Win=7862 Len=0 TSval=3707549507 TSecr=3000714050"
"216","0.399237","151.101.65.140","100.86.235.39","TLSv1.2","1510","Application Data"
"217","0.402080","151.101.65.140","100.86.235.39","TCP","1510","443  >  56438 [PSH, ACK] Seq=33363 Ack=320 Win=424 Len=1444 TSval=3000714056 TSecr=3707549498 [TCP PDU reassembled in 247]"
"218","0.402082","151.101.65.140","100.86.235.39","TCP","1510","443  >  56449 [ACK] Seq=18049 Ack=309 Win=424 Len=1444 TSval=867505651 TSecr=921799295 [TCP PDU reassembled in 262]"
"219","0.402083","151.101.65.140","100.86.235.39","TLSv1.2","1510","[TCP Fast Retransmission] , Application Data"
"220","0.402085","151.101.65.140","100.86.235.39","TCP","1510","443  >  56438 [ACK] Seq=34807 Ack=320 Win=424 Len=1444 TSval=3000714058 TSecr=3707549503 [TCP PDU reassembled in 247]"
"221","0.402086","151.101.65.140","100.86.235.39","TCP","1510","443  >  56438 [PSH, ACK] Seq=36251 Ack=320 Win=424 Len=1444 TSval=3000714058 TSecr=3707549503 [TCP PDU reassembled in 247]"
"222","0.402087","151.101.65.140","100.86.235.39","TCP","1510","443  >  56449 [ACK] Seq=19493 Ack=309 Win=424 Len=1444 TSval=867505653 TSecr=921799298 [TCP PDU reassembled in 262]"
"223","0.402250","100.86.235.39","151.101.65.140","TCP","78","[TCP Dup ACK 174#5] 56449  >  443 [ACK] Seq=309 Ack=7941 Win=5328 Len=0 TSval=921799314 TSecr=867505635 SLE=9385 SRE=19493"
"224","0.402304","100.86.235.39","151.101.65.140","TCP","66","56438  >  443 [ACK] Seq=320 Ack=37695 Win=7862 Len=0 TSval=3707549516 TSecr=3000714056"
"225","0.402306","100.86.235.39","151.101.65.140","TCP","66","56449  >  443 [ACK] Seq=309 Ack=19493 Win=5148 Len=0 TSval=921799314 TSecr=867505652"
"226","0.402337","100.86.235.39","151.101.65.140","TCP","66","56449  >  443 [ACK] Seq=309 Ack=20937 Win=5193 Len=0 TSval=921799314 TSecr=867505653"
"227","0.402450","100.86.235.39","151.101.65.140","TCP","66","[TCP Window Update] 56449  >  443 [ACK] Seq=309 Ack=20937 Win=5328 Len=0 TSval=921799314 TSecr=867505653"
"228","0.407511","151.101.65.140","100.86.235.39","TCP","1510","443  >  56449 [ACK] Seq=20937 Ack=309 Win=424 Len=1444 TSval=867505661 TSecr=921799305 [TCP PDU reassembled in 262]"
"229","0.407514","151.101.65.140","100.86.235.39","TCP","1510","443  >  56449 [PSH, ACK] Seq=22381 Ack=309 Win=424 Len=1444 TSval=867505661 TSecr=921799305 [TCP PDU reassembled in 262]"
"230","0.407514","151.101.65.140","100.86.235.39","TCP","1510","443  >  56438 [ACK] Seq=37695 Ack=320 Win=424 Len=1444 TSval=3000714066 TSecr=3707549507 [TCP PDU reassembled in 247]"
"231","0.407582","100.86.235.39","151.101.65.140","TCP","66","56449  >  443 [ACK] Seq=309 Ack=23825 Win=5283 Len=0 TSval=921799319 TSecr=867505661"
"232","0.408102","151.101.65.140","100.86.235.39","TCP","1510","443  >  56438 [PSH, ACK] Seq=39139 Ack=320 Win=424 Len=1444 TSval=3000714066 TSecr=3707549507 [TCP PDU reassembled in 247]"
"233","0.408217","100.86.235.39","151.101.65.140","TCP","66","56438  >  443 [ACK] Seq=320 Ack=40583 Win=7862 Len=0 TSval=3707549521 TSecr=3000714066"
"234","0.408692","151.101.65.140","100.86.235.39","TCP","1510","443  >  56438 [ACK] Seq=40583 Ack=320 Win=424 Len=1444 TSval=3000714067 TSecr=3707549507 [TCP PDU reassembled in 247]"
"235","0.408892","151.101.65.140","100.86.235.39","TCP","1510","443  >  56438 [PSH, ACK] Seq=42027 Ack=320 Win=424 Len=1444 TSval=3000714067 TSecr=3707549507 [TCP PDU reassembled in 247]"
"236","0.408974","100.86.235.39","151.101.65.140","TCP","66","56438  >  443 [ACK] Seq=320 Ack=43471 Win=7862 Len=0 TSval=3707549522 TSecr=3000714067"
"237","0.412269","151.101.65.140","100.86.235.39","TCP","1510","443  >  56438 [ACK] Seq=43471 Ack=320 Win=424 Len=1444 TSval=3000714071 TSecr=3707549516 [TCP PDU reassembled in 247]"
"238","0.415258","151.101.65.140","100.86.235.39","TCP","1510","443  >  56438 [PSH, ACK] Seq=44915 Ack=320 Win=424 Len=1444 TSval=3000714071 TSecr=3707549516 [TCP PDU reassembled in 247]"
"239","0.415260","151.101.65.140","100.86.235.39","TCP","1510","443  >  56449 [ACK] Seq=23825 Ack=309 Win=424 Len=1444 TSval=867505666 TSecr=921799314 [TCP PDU reassembled in 262]"
"240","0.415261","151.101.65.140","100.86.235.39","TCP","1510","443  >  56449 [ACK] Seq=25269 Ack=309 Win=424 Len=1444 TSval=867505666 TSecr=921799314 [TCP PDU reassembled in 262]"
"241","0.415262","151.101.65.140","100.86.235.39","TCP","1510","443  >  56449 [PSH, ACK] Seq=26713 Ack=309 Win=424 Len=1444 TSval=867505666 TSecr=921799314 [TCP PDU reassembled in 262]"
"242","0.415262","151.101.65.140","100.86.235.39","TCP","1510","443  >  56438 [ACK] Seq=46359 Ack=320 Win=424 Len=1444 TSval=3000714072 TSecr=3707549516 [TCP PDU reassembled in 247]"
"243","0.415263","151.101.65.140","100.86.235.39","TCP","1510","443  >  56438 [PSH, ACK] Seq=47803 Ack=320 Win=424 Len=1444 TSval=3000714072 TSecr=3707549516 [TCP PDU reassembled in 247]"
"244","0.415354","100.86.235.39","151.101.65.140","TCP","66","56449  >  443 [ACK] Seq=309 Ack=28157 Win=5260 Len=0 TSval=921799327 TSecr=867505666"
"245","0.415409","100.86.235.39","151.101.65.140","TCP","66","[TCP Window Update] 56449  >  443 [ACK] Seq=309 Ack=28157 Win=5328 Len=0 TSval=921799327 TSecr=867505666"
"246","0.415410","100.86.235.39","151.101.65.140","TCP","66","56438  >  443 [ACK] Seq=320 Ack=49247 Win=7862 Len=0 TSval=3707549529 TSecr=3000714071"
"247","0.415844","151.101.65.140","100.86.235.39","TLSv1.2","1510","Application Data"
"248","0.418382","151.101.65.140","100.86.235.39","TCP","1510","443  >  56438 [ACK] Seq=50691 Ack=320 Win=424 Len=1444 TSval=3000714077 TSecr=3707549521 [TCP PDU reassembled in 288]"
"249","0.418938","151.101.65.140","100.86.235.39","TCP","1510","443  >  56438 [PSH, ACK] Seq=52135 Ack=320 Win=424 Len=1444 TSval=3000714077 TSecr=3707549521 [TCP PDU reassembled in 288]"
"250","0.418944","151.101.65.140","100.86.235.39","TCP","1510","443  >  56449 [ACK] Seq=28157 Ack=309 Win=424 Len=1444 TSval=867505672 TSecr=921799319 [TCP PDU reassembled in 262]"
"251","0.418944","151.101.65.140","100.86.235.39","TCP","1510","443  >  56449 [PSH, ACK] Seq=29601 Ack=309 Win=424 Len=1444 TSval=867505672 TSecr=921799319 [TCP PDU reassembled in 262]"
"252","0.419075","100.86.235.39","151.101.65.140","TCP","66","56438  >  443 [ACK] Seq=320 Ack=53579 Win=7862 Len=0 TSval=3707549532 TSecr=3000714074"
"253","0.419077","100.86.235.39","151.101.65.140","TCP","66","56449  >  443 [ACK] Seq=309 Ack=31045 Win=5283 Len=0 TSval=921799330 TSecr=867505672"
"254","0.419584","151.101.65.140","100.86.235.39","TCP","1510","[TCP Previous segment not captured] 443  >  56438 [PSH, ACK] Seq=55023 Ack=320 Win=424 Len=1444 TSval=3000714079 TSecr=3707549522 [TCP PDU reassembled in 288]"
"255","0.419658","100.86.235.39","151.101.65.140","TCP","78","[TCP Dup ACK 252#1] 56438  >  443 [ACK] Seq=320 Ack=53579 Win=7862 Len=0 TSval=3707549533 TSecr=3000714074 SLE=55023 SRE=56467"
"256","0.422713","151.101.65.140","100.86.235.39","TCP","1510","443  >  56383 [ACK] Seq=27549 Ack=6346 Win=538 Len=1444 TSval=557148680 TSecr=1359923660 [TCP PDU reassembled in 257]"
"257","0.423362","151.101.65.140","100.86.235.39","TLSv1.2","244","Application Data"
"258","0.423368","151.101.65.140","100.86.235.39","TLSv1.2","413","Application Data"
"259","0.423436","100.86.235.39","151.101.65.140","TCP","66","56383  >  443 [ACK] Seq=6346 Ack=29518 Win=2039 Len=0 TSval=1359923702 TSecr=557148680"
"260","0.425470","151.101.65.140","100.86.235.39","TCP","1510","443  >  56438 [ACK] Seq=56467 Ack=320 Win=424 Len=1444 TSval=3000714084 TSecr=3707549529 [TCP PDU reassembled in 288]"
"261","0.425533","151.101.65.140","100.86.235.39","TCP","1510","443  >  56438 [PSH, ACK] Seq=57911 Ack=320 Win=424 Len=1444 TSval=3000714084 TSecr=3707549529 [TCP PDU reassembled in 288]"
"262","0.425534","151.101.65.140","100.86.235.39","TLSv1.2","1510","Application Data"
"263","0.425559","100.86.235.39","151.101.65.140","TCP","78","[TCP Dup ACK 252#2] 56438  >  443 [ACK] Seq=320 Ack=53579 Win=7862 Len=0 TSval=3707549539 TSecr=3000714074 SLE=55023 SRE=57911"
"264","0.425601","100.86.235.39","151.101.65.140","TCP","78","[TCP Dup ACK 252#3] 56438  >  443 [ACK] Seq=320 Ack=53579 Win=7862 Len=0 TSval=3707549539 TSecr=3000714074 SLE=55023 SRE=59355"
"265","0.425629","100.86.235.39","151.101.65.140","TCP","66","56449  >  443 [ACK] Seq=309 Ack=32489 Win=5306 Len=0 TSval=921799337 TSecr=867505679"
"266","0.426355","151.101.65.140","100.86.235.39","TCP","1510","443  >  56449 [PSH, ACK] Seq=32489 Ack=309 Win=424 Len=1444 TSval=867505679 TSecr=921799327 [TCP PDU reassembled in 309]"
"267","0.426421","100.86.235.39","151.101.65.140","TCP","66","56449  >  443 [ACK] Seq=309 Ack=33933 Win=5306 Len=0 TSval=921799337 TSecr=867505679"
"268","0.427576","151.101.65.140","100.86.235.39","TCP","1510","443  >  56438 [ACK] Seq=59355 Ack=320 Win=424 Len=1444 TSval=3000714085 TSecr=3707549529 [TCP PDU reassembled in 288]"
"269","0.427580","151.101.65.140","100.86.235.39","TCP","1510","443  >  56438 [PSH, ACK] Seq=60799 Ack=320 Win=424 Len=1444 TSval=3000714085 TSecr=3707549529 [TCP PDU reassembled in 288]"
"270","0.427674","100.86.235.39","151.101.65.140","TCP","78","[TCP Dup ACK 252#4] 56438  >  443 [ACK] Seq=320 Ack=53579 Win=7862 Len=0 TSval=3707549541 TSecr=3000714074 SLE=55023 SRE=62243"
"271","0.428013","151.101.65.140","100.86.235.39","TCP","1510","443  >  56449 [ACK] Seq=33933 Ack=309 Win=424 Len=1444 TSval=867505681 TSecr=921799327 [TCP PDU reassembled in 309]"
"272","0.428018","151.101.65.140","100.86.235.39","TCP","1510","443  >  56449 [PSH, ACK] Seq=35377 Ack=309 Win=424 Len=1444 TSval=867505681 TSecr=921799327 [TCP PDU reassembled in 309]"
"273","0.428086","100.86.235.39","151.101.65.140","TCP","66","56449  >  443 [ACK] Seq=309 Ack=36821 Win=5283 Len=0 TSval=921799339 TSecr=867505681"
"274","0.428358","151.101.65.140","100.86.235.39","TCP","1510","443  >  56438 [ACK] Seq=62243 Ack=320 Win=424 Len=1444 TSval=3000714087 TSecr=3707549532 [TCP PDU reassembled in 288]"
"275","0.428362","151.101.65.140","100.86.235.39","TCP","1510","443  >  56438 [PSH, ACK] Seq=63687 Ack=320 Win=424 Len=1444 TSval=3000714087 TSecr=3707549532 [TCP PDU reassembled in 288]"
"276","0.428439","100.86.235.39","151.101.65.140","TCP","78","[TCP Dup ACK 252#5] 56438  >  443 [ACK] Seq=320 Ack=53579 Win=7862 Len=0 TSval=3707549541 TSecr=3000714074 SLE=55023 SRE=65131"
"277","0.431101","151.101.65.140","100.86.235.39","TCP","1510","443  >  56438 [ACK] Seq=65131 Ack=320 Win=424 Len=1444 TSval=3000714090 TSecr=3707549533 [TCP PDU reassembled in 288]"
"278","0.431139","151.101.65.140","100.86.235.39","TCP","1510","443  >  56438 [PSH, ACK] Seq=66575 Ack=320 Win=424 Len=1444 TSval=3000714090 TSecr=3707549533 [TCP PDU reassembled in 332]"
"279","0.431193","100.86.235.39","151.101.65.140","TCP","78","[TCP Dup ACK 252#6] 56438  >  443 [ACK] Seq=320 Ack=53579 Win=7862 Len=0 TSval=3707549545 TSecr=3000714074 SLE=55023 SRE=66575"
"280","0.431246","100.86.235.39","151.101.65.140","TCP","78","[TCP Dup ACK 252#7] 56438  >  443 [ACK] Seq=320 Ack=53579 Win=7862 Len=0 TSval=3707549545 TSecr=3000714074 SLE=55023 SRE=68019"
"281","0.431983","151.101.65.140","100.86.235.39","TCP","1510","443  >  56449 [ACK] Seq=36821 Ack=309 Win=424 Len=1444 TSval=867505685 TSecr=921799330 [TCP PDU reassembled in 309]"
