"No.","Time","Source","Destination","Protocol","Length","Info"
"1","0.000000","100.86.235.39","151.101.65.140","TCP","1514","56383  >  443 [ACK] Seq=1 Ack=1 Win=2048 Len=1448 TSval=1360403029 TSecr=557627265 [TCP PDU reassembled in 2]"
"2","0.000041","100.86.235.39","151.101.65.140","TLSv1.2","1451","Application Data"
"3","0.000088","100.86.235.39","151.101.65.140","TLSv1.2","730","Application Data"
"4","0.010400","151.101.65.140","100.86.235.39","TCP","66","443  >  56383 [ACK] Seq=1 Ack=3498 Win=537 Len=0 TSval=557628032 TSecr=1360403029"
"5","0.029550","100.86.235.39","151.101.1.140","TLSv1.2","222","Application Data"
"6","0.032456","100.86.235.39","151.101.1.140","TLSv1.2","156","Application Data"
"7","0.035303","151.101.65.140","100.86.235.39","TCP","1510","443  >  56383 [ACK] Seq=1 Ack=3498 Win=538 Len=1444 TSval=557628057 TSecr=1360403029 [TCP PDU reassembled in 9]"
"8","0.035372","100.86.235.39","151.101.65.140","TCP","66","56383  >  443 [ACK] Seq=3498 Ack=1445 Win=2025 Len=0 TSval=1360403064 TSecr=557628057"
"9","0.035900","151.101.65.140","100.86.235.39","TLSv1.2","785","Application Data"
"10","0.035956","100.86.235.39","151.101.65.140","TCP","66","56383  >  443 [ACK] Seq=3498 Ack=2164 Win=2036 Len=0 TSval=1360403064 TSecr=557628057"
"11","0.039121","151.101.1.140","100.86.235.39","TCP","66","443  >  56738 [ACK] Seq=1 Ack=157 Win=325 Len=0 TSval=683387857 TSecr=584190383"
"12","0.039149","100.86.235.39","151.101.1.140","TLSv1.2","101","Application Data"
"13","0.039768","151.101.1.140","100.86.235.39","TLSv1.2","486","Application Data"
"14","0.039818","100.86.235.39","151.101.1.140","TCP","66","56738  >  443 [ACK] Seq=282 Ack=421 Win=2041 Len=0 TSval=584190393 TSecr=683387858"
"15","0.041096","100.86.235.39","151.101.1.140","TLSv1.2","101","Application Data"
"16","0.041689","151.101.1.140","100.86.235.39","TCP","66","443  >  56738 [ACK] Seq=421 Ack=247 Win=325 Len=0 TSval=683387860 TSecr=584190386"
"17","0.042457","151.101.1.140","100.86.235.39","TLSv1.2","539","Application Data"
"18","0.042522","100.86.235.39","151.101.1.140","TCP","66","56738  >  443 [ACK] Seq=317 Ack=894 Win=2040 Len=0 TSval=584190396 TSecr=683387860"
"19","0.048605","151.101.1.140","100.86.235.39","TCP","66","443  >  56738 [ACK] Seq=894 Ack=282 Win=325 Len=0 TSval=683387866 TSecr=584190393"
"20","0.051420","151.101.1.140","100.86.235.39","TCP","66","443  >  56738 [ACK] Seq=894 Ack=317 Win=325 Len=0 TSval=683387869 TSecr=584190395"
"21","0.138306","100.86.235.39","151.101.1.140","TLSv1.2","230","Application Data"
"22","0.142922","100.86.235.39","151.101.1.140","TLSv1.2","212","Application Data"
"23","0.146064","100.86.235.39","151.101.1.140","TLSv1.2","101","Application Data"
"24","0.148814","151.101.1.140","100.86.235.39","TCP","66","443  >  56738 [ACK] Seq=894 Ack=481 Win=330 Len=0 TSval=683387966 TSecr=584190492"
"25","0.149137","100.86.235.39","151.101.1.140","TLSv1.2","245","Application Data"
"26","0.149323","151.101.1.140","100.86.235.39","TLSv1.2","636","Application Data"
"27","0.149383","100.86.235.39","151.101.1.140","TCP","66","56738  >  443 [ACK] Seq=841 Ack=1464 Win=2039 Len=0 TSval=584190503 TSecr=683387967"
"28","0.150763","100.86.235.39","151.101.65.140","TCP","1514","56383  >  443 [ACK] Seq=3498 Ack=2164 Win=2048 Len=1448 TSval=1360403180 TSecr=557628057 [TCP PDU reassembled in 29]"
"29","0.150788","100.86.235.39","151.101.65.140","TLSv1.2","1391","Application Data"
"30","0.152889","151.101.1.140","100.86.235.39","TCP","66","443  >  56738 [ACK] Seq=1464 Ack=627 Win=336 Len=0 TSval=683387971 TSecr=584190497"
"31","0.153508","100.86.235.39","151.101.1.140","TLSv1.2","101","Application Data"
"32","0.153945","151.101.1.140","100.86.235.39","TLSv1.2","426","Application Data"
"33","0.154005","100.86.235.39","151.101.1.140","TCP","66","56738  >  443 [ACK] Seq=876 Ack=1824 Win=2042 Len=0 TSval=584190508 TSecr=683387972"
"34","0.154905","100.86.235.39","151.101.1.140","TLSv1.2","233","Application Data"
"35","0.155900","151.101.1.140","100.86.235.39","TCP","66","443  >  56738 [ACK] Seq=1824 Ack=662 Win=336 Len=0 TSval=683387973 TSecr=584190500"
"36","0.156470","100.86.235.39","151.101.1.140","TLSv1.2","156","Application Data"
"37","0.158970","151.101.1.140","100.86.235.39","TCP","66","443  >  56738 [ACK] Seq=1824 Ack=841 Win=342 Len=0 TSval=683387976 TSecr=584190503"
"38","0.159224","151.101.1.140","100.86.235.39","TLSv1.2","651","Application Data"
"39","0.159282","100.86.235.39","151.101.1.140","TCP","66","56738  >  443 [ACK] Seq=1133 Ack=2409 Win=2038 Len=0 TSval=584190513 TSecr=683387977"
"40","0.161401","151.101.65.140","100.86.235.39","TCP","66","443  >  56383 [ACK] Seq=2164 Ack=6271 Win=534 Len=0 TSval=557628182 TSecr=1360403180"
"41","0.161975","151.101.65.140","100.86.235.39","TLSv1.2","350","Application Data"
"42","0.162042","100.86.235.39","151.101.65.140","TCP","66","56383  >  443 [ACK] Seq=6271 Ack=2448 Win=2043 Len=0 TSval=1360403190 TSecr=557628183"
"43","0.162084","151.101.65.140","100.86.235.39","TCP","1510","443  >  56383 [ACK] Seq=2448 Ack=6271 Win=538 Len=1444 TSval=557628183 TSecr=1360403180 [TCP PDU reassembled in 49]"
"44","0.162096","151.101.65.140","100.86.235.39","TCP","1510","443  >  56383 [PSH, ACK] Seq=3892 Ack=6271 Win=538 Len=1444 TSval=557628183 TSecr=1360403180 [TCP PDU reassembled in 49]"
"45","0.162140","100.86.235.39","151.101.65.140","TCP","66","56383  >  443 [ACK] Seq=6271 Ack=5336 Win=1998 Len=0 TSval=1360403190 TSecr=557628183"
"46","0.162332","100.86.235.39","151.101.65.140","TCP","66","[TCP Window Update] 56383  >  443 [ACK] Seq=6271 Ack=5336 Win=2048 Len=0 TSval=1360403190 TSecr=557628183"
"47","0.162798","151.101.1.140","100.86.235.39","TCP","66","443  >  56738 [ACK] Seq=2409 Ack=876 Win=342 Len=0 TSval=683387981 TSecr=584190507"
"48","0.164065","151.101.65.140","100.86.235.39","TCP","1510","443  >  56383 [ACK] Seq=5336 Ack=6271 Win=538 Len=1444 TSval=557628184 TSecr=1360403180 [TCP PDU reassembled in 49]"
"49","0.164066","151.101.65.140","100.86.235.39","TLSv1.2","782","Application Data"
"50","0.164139","100.86.235.39","151.101.65.140","TCP","66","56383  >  443 [ACK] Seq=6271 Ack=7496 Win=2014 Len=0 TSval=1360403193 TSecr=557628184"
"51","0.164940","151.101.1.140","100.86.235.39","TCP","66","443  >  56738 [ACK] Seq=2409 Ack=1043 Win=347 Len=0 TSval=683387983 TSecr=584190508"
"52","0.165157","151.101.1.140","100.86.235.39","TLSv1.2","146","Application Data"
"53","0.165157","151.101.1.140","100.86.235.39","TLSv1.2","400","Application Data"
"54","0.165213","100.86.235.39","151.101.1.140","TCP","66","56738  >  443 [ACK] Seq=1133 Ack=2823 Win=2041 Len=0 TSval=584190519 TSecr=683387983"
"55","0.165709","100.86.235.39","151.101.1.140","TLSv1.2","212","Application Data"
"56","0.166569","151.101.1.140","100.86.235.39","TCP","66","443  >  56738 [ACK] Seq=2823 Ack=1133 Win=347 Len=0 TSval=683387984 TSecr=584190510"
"57","0.166919","151.101.1.140","100.86.235.39","TLSv1.2","516","Application Data"
"58","0.166989","100.86.235.39","151.101.1.140","TCP","66","56738  >  443 [ACK] Seq=1279 Ack=3273 Win=2040 Len=0 TSval=584190520 TSecr=683387985"
"59","0.172643","100.86.235.39","151.101.1.140","TLSv1.2","226","Application Data"
"60","0.173103","100.86.235.39","151.101.1.140","TLSv1.2","155","Application Data"
"61","0.175525","151.101.1.140","100.86.235.39","TCP","66","443  >  56738 [ACK] Seq=3273 Ack=1279 Win=353 Len=0 TSval=683387994 TSecr=584190519"
"62","0.176121","151.101.1.140","100.86.235.39","TLSv1.2","529","Application Data"
"63","0.176181","100.86.235.39","151.101.1.140","TCP","66","56738  >  443 [ACK] Seq=1528 Ack=3736 Win=2040 Len=0 TSval=584190529 TSecr=683387994"
"64","0.177722","100.86.235.39","151.101.1.140","TLSv1.2","166","Application Data"
"65","0.182099","151.101.1.140","100.86.235.39","TCP","66","443  >  56738 [ACK] Seq=3736 Ack=1439 Win=359 Len=0 TSval=683388000 TSecr=584190526"
"66","0.182835","151.101.1.140","100.86.235.39","TCP","66","443  >  56738 [ACK] Seq=3736 Ack=1528 Win=359 Len=0 TSval=683388001 TSecr=584190526"
"67","0.183218","151.101.1.140","100.86.235.39","TLSv1.2","1389","Application Data"
"68","0.183267","100.86.235.39","151.101.1.140","TCP","66","56738  >  443 [ACK] Seq=1628 Ack=5059 Win=2027 Len=0 TSval=584190537 TSecr=683388001"
"69","0.183361","151.101.1.140","100.86.235.39","TLSv1.2","541","Application Data"
"70","0.183404","100.86.235.39","151.101.1.140","TCP","66","56738  >  443 [ACK] Seq=1628 Ack=5534 Win=2040 Len=0 TSval=584190537 TSecr=683388001"
"71","0.187465","151.101.1.140","100.86.235.39","TCP","66","443  >  56738 [ACK] Seq=5534 Ack=1628 Win=359 Len=0 TSval=683388005 TSecr=584190532"
"72","0.187919","151.101.1.140","100.86.235.39","TLSv1.2","367","Application Data"
"73","0.187988","100.86.235.39","151.101.1.140","TCP","66","56738  >  443 [ACK] Seq=1628 Ack=5835 Win=2043 Len=0 TSval=584190541 TSecr=683388006"
"74","0.193307","100.86.235.39","151.101.1.140","TLSv1.2","171","Application Data"
"75","0.203934","151.101.1.140","100.86.235.39","TCP","66","443  >  56738 [ACK] Seq=5835 Ack=1733 Win=359 Len=0 TSval=683388021 TSecr=584190547"
"76","0.205135","151.101.1.140","100.86.235.39","TLSv1.2","758","Application Data"
"77","0.205230","100.86.235.39","151.101.1.140","TCP","66","56738  >  443 [ACK] Seq=1733 Ack=6527 Win=2037 Len=0 TSval=584190559 TSecr=683388022"
"78","0.220263","100.86.235.39","151.101.65.140","TCP","1514","56383  >  443 [ACK] Seq=6271 Ack=7496 Win=2048 Len=1448 TSval=1360403249 TSecr=557628184 [TCP PDU reassembled in 79]"
"79","0.220306","100.86.235.39","151.101.65.140","TLSv1.2","1424","Application Data"
"80","0.230323","151.101.65.140","100.86.235.39","TCP","66","443  >  56383 [ACK] Seq=7496 Ack=9077 Win=538 Len=0 TSval=557628252 TSecr=1360403249"
"81","0.264323","151.101.65.140","100.86.235.39","TCP","1510","443  >  56383 [ACK] Seq=7496 Ack=9077 Win=538 Len=1444 TSval=557628286 TSecr=1360403249 [TCP PDU reassembled in 82]"
"82","0.264366","151.101.65.140","100.86.235.39","TLSv1.2","275","Application Data"
"83","0.264366","151.101.65.140","100.86.235.39","TLSv1.2","99","Application Data"
"84","0.264401","100.86.235.39","151.101.65.140","TCP","66","56383  >  443 [ACK] Seq=9077 Ack=8940 Win=2025 Len=0 TSval=1360403293 TSecr=557628286"
"85","0.264512","100.86.235.39","151.101.65.140","TCP","66","56383  >  443 [ACK] Seq=9077 Ack=9182 Win=2021 Len=0 TSval=1360403293 TSecr=557628286"
"86","0.265526","100.86.235.39","151.101.65.140","TCP","1514","56383  >  443 [ACK] Seq=9077 Ack=9182 Win=2048 Len=1448 TSval=1360403294 TSecr=557628286 [TCP PDU reassembled in 87]"
"87","0.265552","100.86.235.39","151.101.65.140","TLSv1.2","1473","Application Data"
"88","0.275466","151.101.65.140","100.86.235.39","TCP","66","443  >  56383 [ACK] Seq=9182 Ack=11932 Win=538 Len=0 TSval=557628297 TSecr=1360403294"
"89","0.305825","151.101.65.140","100.86.235.39","TCP","1510","443  >  56383 [ACK] Seq=9182 Ack=11932 Win=538 Len=1444 TSval=557628327 TSecr=1360403294 [TCP PDU reassembled in 90]"
"90","0.305828","151.101.65.140","100.86.235.39","TLSv1.2","961","Application Data"
"91","0.306064","100.86.235.39","151.101.65.140","TCP","66","56383  >  443 [ACK] Seq=11932 Ack=11521 Win=2011 Len=0 TSval=1360403335 TSecr=557628327"
"92","0.307303","100.86.235.39","151.101.65.140","TCP","1514","56383  >  443 [ACK] Seq=11932 Ack=11521 Win=2048 Len=1448 TSval=1360403336 TSecr=557628327 [TCP PDU reassembled in 93]"
"93","0.307307","100.86.235.39","151.101.65.140","TLSv1.2","1469","Application Data"
"94","0.307829","100.86.235.39","151.101.65.140","TCP","1514","56383  >  443 [ACK] Seq=14783 Ack=11521 Win=2048 Len=1448 TSval=1360403336 TSecr=557628327 [TCP PDU reassembled in 95]"
"95","0.307891","100.86.235.39","151.101.65.140","TLSv1.2","1484","Application Data"
"96","0.309846","100.86.235.39","151.101.65.140","TCP","1514","56383  >  443 [ACK] Seq=17649 Ack=11521 Win=2048 Len=1448 TSval=1360403339 TSecr=557628327 [TCP PDU reassembled in 97]"
"97","0.309883","100.86.235.39","151.101.65.140","TLSv1.2","1461","Application Data"
"98","0.317021","151.101.65.140","100.86.235.39","TCP","66","443  >  56383 [ACK] Seq=11521 Ack=14783 Win=538 Len=0 TSval=557628338 TSecr=1360403336"
"99","0.318479","151.101.65.140","100.86.235.39","TCP","66","443  >  56383 [ACK] Seq=11521 Ack=17649 Win=534 Len=0 TSval=557628340 TSecr=1360403336"
"100","0.319735","151.101.65.140","100.86.235.39","TCP","66","443  >  56383 [ACK] Seq=11521 Ack=20492 Win=534 Len=0 TSval=557628341 TSecr=1360403339"
"101","0.340877","100.86.235.39","151.101.65.140","TLSv1.2","213","Application Data"
"102","0.345855","151.101.65.140","100.86.235.39","TLSv1.2","428","Application Data"
"103","0.345940","100.86.235.39","151.101.65.140","TCP","66","56383  >  443 [ACK] Seq=20492 Ack=11883 Win=2042 Len=0 TSval=1360403375 TSecr=557628367"
"104","0.346819","151.101.65.140","100.86.235.39","TCP","1510","443  >  56383 [ACK] Seq=11883 Ack=20492 Win=538 Len=1444 TSval=557628368 TSecr=1360403339 [TCP PDU reassembled in 106]"
"105","0.346900","100.86.235.39","151.101.65.140","TCP","66","56383  >  443 [ACK] Seq=20492 Ack=13327 Win=2025 Len=0 TSval=1360403375 TSecr=557628368"
"106","0.346988","151.101.65.140","100.86.235.39","TLSv1.2","309","Application Data"
"107","0.347040","100.86.235.39","151.101.65.140","TCP","66","56383  >  443 [ACK] Seq=20492 Ack=13570 Win=2044 Len=0 TSval=1360403376 TSecr=557628368"
"108","0.348000","151.101.65.140","100.86.235.39","TLSv1.2","107","Application Data"
"109","0.348001","151.101.65.140","100.86.235.39","TLSv1.2","97","Application Data"
"110","0.348001","151.101.65.140","100.86.235.39","TCP","1510","443  >  56383 [ACK] Seq=13642 Ack=20492 Win=538 Len=1444 TSval=557628370 TSecr=1360403339 [TCP PDU reassembled in 112]"
"111","0.348078","100.86.235.39","151.101.65.140","TCP","66","56383  >  443 [ACK] Seq=20492 Ack=15086 Win=2024 Len=0 TSval=1360403377 TSecr=557628370"
"112","0.348642","151.101.65.140","100.86.235.39","TLSv1.2","931","Application Data"
"113","0.348697","100.86.235.39","151.101.65.140","TCP","66","56383  >  443 [ACK] Seq=20492 Ack=15951 Win=2034 Len=0 TSval=1360403377 TSecr=557628370"
"114","0.350451","151.101.65.140","100.86.235.39","TCP","66","443  >  56745 [ACK] Seq=1 Ack=148 Win=347 Len=0 TSval=557628372 TSecr=983112076"
"115","0.353666","151.101.65.140","100.86.235.39","TCP","1510","443  >  56745 [ACK] Seq=1 Ack=148 Win=347 Len=1444 TSval=557628375 TSecr=983112076 [TCP PDU reassembled in 181]"
"116","0.353667","151.101.65.140","100.86.235.39","TCP","1510","443  >  56745 [ACK] Seq=1445 Ack=148 Win=347 Len=1444 TSval=557628375 TSecr=983112076 [TCP PDU reassembled in 181]"
"117","0.353668","151.101.65.140","100.86.235.39","TCP","1510","[TCP Previous segment not captured] 443  >  56745 [ACK] Seq=4333 Ack=148 Win=347 Len=1444 TSval=557628375 TSecr=983112076 [TCP PDU reassembled in 181]"
"118","0.353764","100.86.235.39","151.101.65.140","TCP","66","56745  >  443 [ACK] Seq=148 Ack=2889 Win=9604 Len=0 TSval=983112089 TSecr=557628375"
"119","0.353853","100.86.235.39","151.101.65.140","TCP","78","[TCP Dup ACK 118#1] 56745  >  443 [ACK] Seq=148 Ack=2889 Win=9604 Len=0 TSval=983112089 TSecr=557628375 SLE=4333 SRE=5777"
"120","0.354244","151.101.65.140","100.86.235.39","TCP","1510","443  >  56745 [ACK] Seq=5777 Ack=148 Win=347 Len=1444 TSval=557628375 TSecr=983112076 [TCP PDU reassembled in 181]"
"121","0.354245","151.101.65.140","100.86.235.39","TCP","1510","443  >  56745 [PSH, ACK] Seq=7221 Ack=148 Win=347 Len=1444 TSval=557628375 TSecr=983112076 [TCP PDU reassembled in 181]"
"122","0.354313","100.86.235.39","151.101.65.140","TCP","78","[TCP Dup ACK 118#2] 56745  >  443 [ACK] Seq=148 Ack=2889 Win=9650 Len=0 TSval=983112089 TSecr=557628375 SLE=4333 SRE=8665"
"123","0.354369","151.101.65.140","100.86.235.39","TCP","1510","443  >  56745 [ACK] Seq=8665 Ack=148 Win=347 Len=1444 TSval=557628375 TSecr=983112076 [TCP PDU reassembled in 181]"
"124","0.354370","151.101.65.140","100.86.235.39","TCP","1510","443  >  56745 [ACK] Seq=10109 Ack=148 Win=347 Len=1444 TSval=557628375 TSecr=983112076 [TCP PDU reassembled in 181]"
"125","0.354408","100.86.235.39","151.101.65.140","TCP","78","[TCP Dup ACK 118#3] 56745  >  443 [ACK] Seq=148 Ack=2889 Win=9650 Len=0 TSval=983112089 TSecr=557628375 SLE=4333 SRE=11553"
"126","0.354671","151.101.65.140","100.86.235.39","TCP","1510","443  >  56745 [ACK] Seq=11553 Ack=148 Win=347 Len=1444 TSval=557628375 TSecr=983112076 [TCP PDU reassembled in 181]"
"127","0.354672","151.101.65.140","100.86.235.39","TCP","1510","443  >  56745 [ACK] Seq=12997 Ack=148 Win=347 Len=1444 TSval=557628375 TSecr=983112076 [TCP PDU reassembled in 181]"
"128","0.354734","100.86.235.39","151.101.65.140","TCP","78","[TCP Dup ACK 118#4] 56745  >  443 [ACK] Seq=148 Ack=2889 Win=9650 Len=0 TSval=983112089 TSecr=557628375 SLE=4333 SRE=14441"
"129","0.355013","151.101.65.140","100.86.235.39","TCP","1074","443  >  56745 [PSH, ACK] Seq=14441 Ack=148 Win=347 Len=1008 TSval=557628375 TSecr=983112076 [TCP PDU reassembled in 181]"
"130","0.355014","151.101.65.140","100.86.235.39","TCP","1510","443  >  56745 [ACK] Seq=15449 Ack=148 Win=347 Len=1444 TSval=557628376 TSecr=983112076 [TCP PDU reassembled in 183]"
"131","0.355065","100.86.235.39","151.101.65.140","TCP","78","[TCP Dup ACK 118#5] 56745  >  443 [ACK] Seq=148 Ack=2889 Win=9650 Len=0 TSval=983112090 TSecr=557628375 SLE=4333 SRE=16893"
"132","0.356553","151.101.65.140","100.86.235.39","TCP","1510","443  >  56745 [ACK] Seq=16893 Ack=148 Win=347 Len=1444 TSval=557628376 TSecr=983112076 [TCP PDU reassembled in 183]"
"133","0.356554","151.101.65.140","100.86.235.39","TCP","1510","443  >  56745 [ACK] Seq=18337 Ack=148 Win=347 Len=1444 TSval=557628376 TSecr=983112076 [TCP PDU reassembled in 183]"
"134","0.356555","151.101.65.140","100.86.235.39","TCP","1510","443  >  56745 [ACK] Seq=19781 Ack=148 Win=347 Len=1444 TSval=557628376 TSecr=983112076 [TCP PDU reassembled in 183]"
"135","0.356556","151.101.65.140","100.86.235.39","TCP","1510","443  >  56745 [ACK] Seq=21225 Ack=148 Win=347 Len=1444 TSval=557628376 TSecr=983112076 [TCP PDU reassembled in 183]"
"136","0.356557","151.101.65.140","100.86.235.39","TCP","1510","443  >  56745 [PSH, ACK] Seq=22669 Ack=148 Win=347 Len=1444 TSval=557628376 TSecr=983112076 [TCP PDU reassembled in 183]"
"137","0.356558","151.101.65.140","100.86.235.39","TCP","1510","443  >  56745 [ACK] Seq=24113 Ack=148 Win=347 Len=1444 TSval=557628377 TSecr=983112076 [TCP PDU reassembled in 183]"
"138","0.356559","151.101.65.140","100.86.235.39","TCP","1510","443  >  56745 [ACK] Seq=25557 Ack=148 Win=347 Len=1444 TSval=557628377 TSecr=983112076 [TCP PDU reassembled in 183]"
"139","0.356560","151.101.65.140","100.86.235.39","TCP","1510","443  >  56745 [ACK] Seq=27001 Ack=148 Win=347 Len=1444 TSval=557628377 TSecr=983112076 [TCP PDU reassembled in 183]"
"140","0.356560","151.101.65.140","100.86.235.39","TCP","1510","443  >  56745 [ACK] Seq=28445 Ack=148 Win=347 Len=1444 TSval=557628377 TSecr=983112076 [TCP PDU reassembled in 183]"
"141","0.356562","151.101.65.140","100.86.235.39","TCP","1510","[TCP Previous segment not captured] 443  >  56745 [PSH, ACK] Seq=31333 Ack=148 Win=347 Len=1444 TSval=557628377 TSecr=983112076 [TCP PDU reassembled in 183]"
"142","0.356562","151.101.65.140","100.86.235.39","TCP","1510","443  >  56745 [ACK] Seq=32777 Ack=148 Win=347 Len=1444 TSval=557628378 TSecr=983112076 [TCP PDU reassembled in 184]"
"143","0.356563","151.101.65.140","100.86.235.39","TCP","1510","443  >  56745 [ACK] Seq=34221 Ack=148 Win=347 Len=1444 TSval=557628378 TSecr=983112076 [TCP PDU reassembled in 184]"
"144","0.356564","151.101.65.140","100.86.235.39","TCP","1510","443  >  56745 [ACK] Seq=35665 Ack=148 Win=347 Len=1444 TSval=557628378 TSecr=983112076 [TCP PDU reassembled in 184]"
"145","0.356668","100.86.235.39","151.101.65.140","TCP","78","[TCP Dup ACK 118#6] 56745  >  443 [ACK] Seq=148 Ack=2889 Win=9650 Len=0 TSval=983112091 TSecr=557628375 SLE=4333 SRE=29889"
"146","0.356711","100.86.235.39","151.101.65.140","TCP","86","[TCP Dup ACK 118#7] 56745  >  443 [ACK] Seq=148 Ack=2889 Win=9650 Len=0 TSval=983112091 TSecr=557628375 SLE=31333 SRE=37109 SLE=4333 SRE=29889"
"147","0.356825","151.101.65.140","100.86.235.39","TCP","1510","443  >  56745 [ACK] Seq=37109 Ack=148 Win=347 Len=1444 TSval=557628378 TSecr=983112076 [TCP PDU reassembled in 184]"
"148","0.356826","151.101.65.140","100.86.235.39","TCP","1510","[TCP Previous segment not captured] 443  >  56745 [PSH, ACK] Seq=39997 Ack=148 Win=347 Len=1444 TSval=557628378 TSecr=983112076 [TCP PDU reassembled in 184]"
"149","0.356879","100.86.235.39","151.101.65.140","TCP","86","[TCP Dup ACK 118#8] 56745  >  443 [ACK] Seq=148 Ack=2889 Win=9650 Len=0 TSval=983112091 TSecr=557628375 SLE=31333 SRE=38553 SLE=4333 SRE=29889"
"150","0.356910","100.86.235.39","151.101.65.140","TCP","94","[TCP Dup ACK 118#9] 56745  >  443 [ACK] Seq=148 Ack=2889 Win=9650 Len=0 TSval=983112091 TSecr=557628375 SLE=39997 SRE=41441 SLE=31333 SRE=38553 SLE=4333 SRE=29889"
"151","0.357601","151.101.65.140","100.86.235.39","TCP","1510","443  >  56383 [ACK] Seq=15951 Ack=20492 Win=538 Len=1444 TSval=557628378 TSecr=1360403375 [TCP PDU reassembled in 152]"
"152","0.357603","151.101.65.140","100.86.235.39","TLSv1.2","308","Application Data"
"153","0.357642","151.101.65.140","100.86.235.39","TCP","1510","443  >  56745 [ACK] Seq=41441 Ack=148 Win=347 Len=1444 TSval=557628379 TSecr=983112076 [TCP PDU reassembled in 184]"
"154","0.357644","151.101.65.140","100.86.235.39","TCP","1510","443  >  56745 [ACK] Seq=42885 Ack=148 Win=347 Len=1444 TSval=557628379 TSecr=983112076 [TCP PDU reassembled in 184]"
"155","0.357680","100.86.235.39","151.101.65.140","TCP","66","56383  >  443 [ACK] Seq=20492 Ack=17637 Win=2021 Len=0 TSval=1360403386 TSecr=557628378"
"156","0.357735","100.86.235.39","151.101.65.140","TCP","94","[TCP Dup ACK 118#10] 56745  >  443 [ACK] Seq=148 Ack=2889 Win=9650 Len=0 TSval=983112092 TSecr=557628375 SLE=39997 SRE=44329 SLE=31333 SRE=38553 SLE=4333 SRE=29889"
"157","0.357941","151.101.65.140","100.86.235.39","TCP","1510","443  >  56745 [ACK] Seq=44329 Ack=148 Win=347 Len=1444 TSval=557628379 TSecr=983112076 [TCP PDU reassembled in 184]"
"158","0.357943","151.101.65.140","100.86.235.39","TCP","1510","443  >  56745 [ACK] Seq=45773 Ack=148 Win=347 Len=1444 TSval=557628379 TSecr=983112076 [TCP PDU reassembled in 184]"
"159","0.358178","100.86.235.39","151.101.65.140","TCP","94","[TCP Dup ACK 118#11] 56745  >  443 [ACK] Seq=148 Ack=2889 Win=9650 Len=0 TSval=983112092 TSecr=557628375 SLE=39997 SRE=47217 SLE=31333 SRE=38553 SLE=4333 SRE=29889"
"160","0.358221","151.101.65.140","100.86.235.39","TCP","1510","443  >  56745 [ACK] Seq=47217 Ack=148 Win=347 Len=1444 TSval=557628379 TSecr=983112076 [TCP PDU reassembled in 184]"
"161","0.358222","151.101.65.140","100.86.235.39","TCP","1510","443  >  56745 [PSH, ACK] Seq=48661 Ack=148 Win=347 Len=1444 TSval=557628379 TSecr=983112076 [TCP PDU reassembled in 175]"
"162","0.358268","100.86.235.39","151.101.65.140","TCP","94","[TCP Dup ACK 118#12] 56745  >  443 [ACK] Seq=148 Ack=2889 Win=9650 Len=0 TSval=983112092 TSecr=557628375 SLE=39997 SRE=50105 SLE=31333 SRE=38553 SLE=4333 SRE=29889"
"163","0.358472","151.101.65.140","100.86.235.39","TCP","1510","443  >  56745 [ACK] Seq=50105 Ack=148 Win=347 Len=1444 TSval=557628380 TSecr=983112076 [TCP PDU reassembled in 175]"
"164","0.358473","151.101.65.140","100.86.235.39","TCP","1510","443  >  56745 [ACK] Seq=51549 Ack=148 Win=347 Len=1444 TSval=557628380 TSecr=983112076 [TCP PDU reassembled in 175]"
"165","0.358524","100.86.235.39","151.101.65.140","TCP","94","[TCP Dup ACK 118#13] 56745  >  443 [ACK] Seq=148 Ack=2889 Win=9650 Len=0 TSval=983112092 TSecr=557628375 SLE=39997 SRE=52993 SLE=31333 SRE=38553 SLE=4333 SRE=29889"
"166","0.358687","151.101.65.140","100.86.235.39","TCP","1510","443  >  56745 [ACK] Seq=52993 Ack=148 Win=347 Len=1444 TSval=557628380 TSecr=983112076 [TCP PDU reassembled in 175]"
"167","0.358688","151.101.65.140","100.86.235.39","TCP","1510","443  >  56745 [ACK] Seq=54437 Ack=148 Win=347 Len=1444 TSval=557628380 TSecr=983112076 [TCP PDU reassembled in 175]"
"168","0.358735","100.86.235.39","151.101.65.140","TCP","94","[TCP Dup ACK 118#14] 56745  >  443 [ACK] Seq=148 Ack=2889 Win=9650 Len=0 TSval=983112094 TSecr=557628375 SLE=39997 SRE=55881 SLE=31333 SRE=38553 SLE=4333 SRE=29889"
"169","0.361404","151.101.65.140","100.86.235.39","TCP","1510","443  >  56745 [ACK] Seq=55881 Ack=148 Win=347 Len=1444 TSval=557628380 TSecr=983112076 [TCP PDU reassembled in 175]"
"170","0.361406","151.101.65.140","100.86.235.39","TCP","1510","443  >  56745 [PSH, ACK] Seq=57325 Ack=148 Win=347 Len=1444 TSval=557628380 TSecr=983112076 [TCP PDU reassembled in 175]"
"171","0.361406","151.101.65.140","100.86.235.39","TCP","1510","443  >  56745 [ACK] Seq=58769 Ack=148 Win=347 Len=1444 TSval=557628381 TSecr=983112076 [TCP PDU reassembled in 175]"
"172","0.361407","151.101.65.140","100.86.235.39","TCP","1510","443  >  56745 [ACK] Seq=60213 Ack=148 Win=347 Len=1444 TSval=557628381 TSecr=983112076 [TCP PDU reassembled in 175]"
"173","0.361408","151.101.65.140","100.86.235.39","TCP","1510","443  >  56745 [ACK] Seq=61657 Ack=148 Win=347 Len=1444 TSval=557628381 TSecr=983112076 [TCP PDU reassembled in 175]"
"174","0.361409","151.101.65.140","100.86.235.39","TCP","1510","443  >  56745 [ACK] Seq=63101 Ack=148 Win=347 Len=1444 TSval=557628381 TSecr=983112076 [TCP PDU reassembled in 175]"
"175","0.361409","151.101.65.140","100.86.235.39","TLSv1.2","1510","Application Data"
"176","0.361410","151.101.65.140","100.86.235.39","TCP","1510","443  >  56745 [PSH, ACK] Seq=65989 Ack=148 Win=347 Len=1444 TSval=557628381 TSecr=983112076 [TCP PDU reassembled in 179]"
"177","0.361485","100.86.235.39","151.101.65.140","TCP","94","[TCP Dup ACK 118#15] 56745  >  443 [ACK] Seq=148 Ack=2889 Win=9650 Len=0 TSval=983112095 TSecr=557628375 SLE=39997 SRE=67433 SLE=31333 SRE=38553 SLE=4333 SRE=29889"
"178","0.361555","151.101.65.140","100.86.235.39","TCP","1510","443  >  56745 [ACK] Seq=67433 Ack=148 Win=347 Len=1444 TSval=557628382 TSecr=983112076 [TCP PDU reassembled in 179]"
"179","0.361556","151.101.65.140","100.86.235.39","TLSv1.2","1037","Application Data"
"180","0.361598","100.86.235.39","151.101.65.140","TCP","94","[TCP Dup ACK 118#16] 56745  >  443 [ACK] Seq=148 Ack=2889 Win=9650 Len=0 TSval=983112095 TSecr=557628375 SLE=39997 SRE=69848 SLE=31333 SRE=38553 SLE=4333 SRE=29889"
"181","0.367757","151.101.65.140","100.86.235.39","TLSv1.2","1510","[TCP Fast Retransmission] , Application Data"
"182","0.367852","100.86.235.39","151.101.65.140","TCP","86","56745  >  443 [ACK] Seq=148 Ack=29889 Win=9228 Len=0 TSval=983112103 TSecr=557628389 SLE=39997 SRE=69848 SLE=31333 SRE=38553"
"183","0.368236","151.101.65.140","100.86.235.39","TCP","1510","[TCP Retransmission] 443  >  56745 [ACK] Seq=29889 Ack=148 Win=347 Len=1444 TSval=557628389 TSecr=983112091"
"184","0.368238","151.101.65.140","100.86.235.39","TCP","1510","[TCP Retransmission] 443  >  56745 [ACK] Seq=38553 Ack=148 Win=347 Len=1444 TSval=557628390 TSecr=983112091"
"185","0.368268","100.86.235.39","151.101.65.140","TCP","86","[TCP Dup ACK 182#1] 56745  >  443 [ACK] Seq=148 Ack=29889 Win=9650 Len=0 TSval=983112103 TSecr=557628389 SLE=39997 SRE=69848 SLE=31333 SRE=38553"
"186","0.368283","100.86.235.39","151.101.65.140","TCP","78","56745  >  443 [ACK] Seq=148 Ack=38553 Win=9514 Len=0 TSval=983112103 TSecr=557628389 SLE=39997 SRE=69848"
"187","0.368291","100.86.235.39","151.101.65.140","TCP","66","56745  >  443 [ACK] Seq=148 Ack=69848 Win=9025 Len=0 TSval=983112103 TSecr=557628390"
"188","0.368521","100.86.235.39","151.101.65.140","TCP","66","[TCP Window Update] 56745  >  443 [ACK] Seq=148 Ack=69848 Win=9650 Len=0 TSval=983112103 TSecr=557628390"
"189","0.372222","100.86.235.39","151.101.65.140","TLSv1.2","244","Application Data"
"190","0.372475","100.86.235.39","151.101.65.140","TLSv1.2","238","Application Data"
"191","0.373752","100.86.235.39","151.101.65.140","TLSv1.2","101","Application Data"
"192","0.373928","100.86.235.39","151.101.65.140","TLSv1.2","101","Application Data"
"193","0.375323","100.86.235.39","151.101.65.140","TCP","1514","56383  >  443 [ACK] Seq=20492 Ack=17637 Win=2048 Len=1448 TSval=1360403404 TSecr=557628378 [TCP PDU reassembled in 194]"
"194","0.375350","100.86.235.39","151.101.65.140","TLSv1.2","1419","Application Data"
"195","0.384322","151.101.65.140","100.86.235.39","TCP","66","443  >  56744 [ACK] Seq=1 Ack=179 Win=359 Len=0 TSval=550540446 TSecr=719745113"
"196","0.384323","151.101.65.140","100.86.235.39","TLSv1.2","185","Application Data"
"197","0.384324","151.101.65.140","100.86.235.39","TLSv1.2","985","Application Data"
"198","0.384403","100.86.235.39","151.101.65.140","TCP","66","56744  >  443 [ACK] Seq=421 Ack=1039 Win=8864 Len=0 TSval=719745126 TSecr=550540446"
"199","0.384459","151.101.65.140","100.86.235.39","TCP","66","443  >  56744 [ACK] Seq=1039 Ack=421 Win=364 Len=0 TSval=550540447 TSecr=719745116"
"200","0.385077","151.101.65.140","100.86.235.39","TCP","66","443  >  56383 [ACK] Seq=17637 Ack=23293 Win=534 Len=0 TSval=557628406 TSecr=1360403404"
"201","0.398071","151.101.65.140","100.86.235.39","TLSv1.2","1035","Application Data"
"202","0.398147","100.86.235.39","151.101.65.140","TCP","66","56383  >  443 [ACK] Seq=23293 Ack=18606 Win=2032 Len=0 TSval=1360403427 TSecr=557628419"
"203","0.398330","151.101.65.140","100.86.235.39","TLSv1.2","113","Application Data"
"204","0.398383","100.86.235.39","151.101.65.140","TCP","66","56383  >  443 [ACK] Seq=23293 Ack=18653 Win=2047 Len=0 TSval=1360403427 TSecr=557628420"
"205","0.398838","151.101.65.140","100.86.235.39","TLSv1.2","97","Application Data"
"206","0.398896","100.86.235.39","151.101.65.140","TCP","66","56383  >  443 [ACK] Seq=23293 Ack=18684 Win=2047 Len=0 TSval=1360403427 TSecr=557628420"
"207","0.406264","151.101.65.140","100.86.235.39","TLSv1.2","825","Application Data"
"208","0.406400","100.86.235.39","151.101.65.140","TCP","66","56383  >  443 [ACK] Seq=23293 Ack=19443 Win=2048 Len=0 TSval=1360403435 TSecr=557628428"
"209","0.413202","151.101.65.140","100.86.235.39","TCP","1510","443  >  56383 [ACK] Seq=19443 Ack=23293 Win=538 Len=1444 TSval=557628435 TSecr=1360403427 [TCP PDU reassembled in 210]"
"210","0.413450","151.101.65.140","100.86.235.39","TLSv1.2","898","Application Data"
"211","0.413502","100.86.235.39","151.101.65.140","TCP","66","56383  >  443 [ACK] Seq=23293 Ack=21719 Win=2035 Len=0 TSval=1360403441 TSecr=557628435"
"212","0.430793","151.101.65.140","100.86.235.39","TLSv1.2","1510","Application Data"
"213","0.431018","100.86.235.39","151.101.65.140","TCP","66","56383  >  443 [ACK] Seq=23293 Ack=23163 Win=2048 Len=0 TSval=1360403460 TSecr=557628452"
"214","0.434891","151.101.65.140","100.86.235.39","TLSv1.2","957","Application Data"
"215","0.435042","100.86.235.39","151.101.65.140","TCP","66","56383  >  443 [ACK] Seq=23293 Ack=24054 Win=2048 Len=0 TSval=1360403464 TSecr=557628456"
"216","0.578817","100.86.235.39","151.101.65.140","TCP","1514","56383  >  443 [ACK] Seq=23293 Ack=24054 Win=2048 Len=1448 TSval=1360403608 TSecr=557628456 [TCP PDU reassembled in 217]"
"217","0.578858","100.86.235.39","151.101.65.140","TLSv1.2","1452","Application Data"
"218","0.578906","100.86.235.39","151.101.65.140","TLSv1.2","222","Application Data"
"219","0.588512","151.101.65.140","100.86.235.39","TCP","66","443  >  56383 [ACK] Seq=24054 Ack=26283 Win=534 Len=0 TSval=557628610 TSecr=1360403608"
"220","0.643353","151.101.65.140","100.86.235.39","TCP","1510","443  >  56383 [ACK] Seq=24054 Ack=26283 Win=538 Len=1444 TSval=557628664 TSecr=1360403608 [TCP PDU reassembled in 222]"
"221","0.643431","100.86.235.39","151.101.65.140","TCP","66","56383  >  443 [ACK] Seq=26283 Ack=25498 Win=2025 Len=0 TSval=1360403672 TSecr=557628664"
"222","0.644008","151.101.65.140","100.86.235.39","TLSv1.2","413","Application Data"
"223","0.644064","100.86.235.39","151.101.65.140","TCP","66","56383  >  443 [ACK] Seq=26283 Ack=25845 Win=2042 Len=0 TSval=1360403672 TSecr=557628664"
"224","0.713190","100.86.235.39","151.101.65.140","TCP","1514","56383  >  443 [ACK] Seq=26283 Ack=25845 Win=2048 Len=1448 TSval=1360403742 TSecr=557628664 [TCP PDU reassembled in 226]"
"225","0.713192","100.86.235.39","151.101.65.140","TCP","1514","56383  >  443 [ACK] Seq=27731 Ack=25845 Win=2048 Len=1448 TSval=1360403742 TSecr=557628664 [TCP PDU reassembled in 226]"
"226","0.713230","100.86.235.39","151.101.65.140","TLSv1.2","116","Application Data"
"227","0.714907","100.86.235.39","151.101.65.140","TCP","1514","56383  >  443 [ACK] Seq=29229 Ack=25845 Win=2048 Len=1448 TSval=1360403744 TSecr=557628664 [TCP PDU reassembled in 228]"
"228","0.714938","100.86.235.39","151.101.65.140","TLSv1.2","1449","Application Data"
"229","0.715013","100.86.235.39","151.101.65.140","TLSv1.2","146","Application Data"
"230","0.723494","151.101.65.140","100.86.235.39","TCP","66","443  >  56383 [ACK] Seq=25845 Ack=29229 Win=533 Len=0 TSval=557628745 TSecr=1360403742"
"231","0.724566","151.101.65.140","100.86.235.39","TCP","66","443  >  56383 [ACK] Seq=25845 Ack=32140 Win=534 Len=0 TSval=557628746 TSecr=1360403744"
"232","0.754176","151.101.65.140","100.86.235.39","TCP","1510","443  >  56383 [ACK] Seq=25845 Ack=32140 Win=538 Len=1444 TSval=557628775 TSecr=1360403744 [TCP PDU reassembled in 233]"
"233","0.754217","151.101.65.140","100.86.235.39","TLSv1.2","851","Application Data"
"234","0.754272","100.86.235.39","151.101.65.140","TCP","66","56383  >  443 [ACK] Seq=32140 Ack=27289 Win=2025 Len=0 TSval=1360403783 TSecr=557628775"
"235","0.754408","100.86.235.39","151.101.65.140","TCP","66","56383  >  443 [ACK] Seq=32140 Ack=28074 Win=2048 Len=0 TSval=1360403783 TSecr=557628775"
"236","0.754911","151.101.65.140","100.86.235.39","TLSv1.2","1112","Application Data"
"237","0.755094","100.86.235.39","151.101.65.140","TCP","66","56383  >  443 [ACK] Seq=32140 Ack=29120 Win=2048 Len=0 TSval=1360403783 TSecr=557628776"
"238","0.756841","151.101.65.140","100.86.235.39","TLSv1.2","107","Application Data"
"239","0.756969","100.86.235.39","151.101.65.140","TCP","66","56383  >  443 [ACK] Seq=32140 Ack=29161 Win=2048 Len=0 TSval=1360403786 TSecr=557628778"
"240","0.757796","151.101.65.140","100.86.235.39","TCP","1510","443  >  56383 [ACK] Seq=29161 Ack=32140 Win=538 Len=1444 TSval=557628779 TSecr=1360403744 [TCP PDU reassembled in 241]"
"241","0.757797","151.101.65.140","100.86.235.39","TLSv1.2","367","Application Data"
"242","0.757900","100.86.235.39","151.101.65.140","TCP","66","56383  >  443 [ACK] Seq=32140 Ack=30906 Win=2020 Len=0 TSval=1360403786 TSecr=557628779"
"243","0.758369","151.101.65.140","100.86.235.39","TLSv1.2","112","Application Data"
"244","0.758420","100.86.235.39","151.101.65.140","TCP","66","56383  >  443 [ACK] Seq=32140 Ack=30952 Win=2047 Len=0 TSval=1360403787 TSecr=557628780"
"245","1.209640","100.86.235.39","151.101.1.140","TLSv1.2","1210","Application Data"
"246","1.219383","151.101.1.140","100.86.235.39","TCP","66","443  >  56258 [ACK] Seq=1 Ack=1145 Win=424 Len=0 TSval=3343561659 TSecr=3451152872"
"247","1.238046","151.101.1.140","100.86.235.39","TLSv1.2","145","Application Data"
"248","1.238079","151.101.1.140","100.86.235.39","TLSv1.2","214","Application Data"
"249","1.238119","100.86.235.39","151.101.1.140","TCP","66","56258  >  443 [ACK] Seq=1145 Ack=80 Win=2046 Len=0 TSval=3451152901 TSecr=3343561678"
"250","1.238219","100.86.235.39","151.101.1.140","TCP","66","56258  >  443 [ACK] Seq=1145 Ack=228 Win=2044 Len=0 TSval=3451152901 TSecr=3343561678"
"251","1.242305","100.86.235.39","151.101.1.140","TLSv1.2","1207","Application Data"
"252","1.254630","151.101.1.140","100.86.235.39","TCP","66","443  >  56258 [ACK] Seq=228 Ack=2286 Win=424 Len=0 TSval=3343561692 TSecr=3451152905"
"253","1.269457","151.101.1.140","100.86.235.39","TLSv1.2","1116","Application Data"
"254","1.269517","100.86.235.39","151.101.1.140","TCP","66","56258  >  443 [ACK] Seq=2286 Ack=1278 Win=2031 Len=0 TSval=3451152932 TSecr=3343561709"
"255","1.458684","100.86.235.39","151.101.1.140","TLSv1.2","1270","Application Data"
"256","1.459573","100.86.235.39","151.101.1.140","TLSv1.2","1275","Application Data"
"257","1.468591","151.101.1.140","100.86.235.39","TCP","66","443  >  56258 [ACK] Seq=1278 Ack=3490 Win=424 Len=0 TSval=3343561908 TSecr=3451153121"
"258","1.469206","151.101.1.140","100.86.235.39","TCP","66","443  >  56258 [ACK] Seq=1278 Ack=4699 Win=424 Len=0 TSval=3343561909 TSecr=3451153121"
"259","1.489510","151.101.1.140","100.86.235.39","TLSv1.2","250","Application Data"
"260","1.489582","100.86.235.39","151.101.1.140","TCP","66","56258  >  443 [ACK] Seq=4699 Ack=1462 Win=2045 Len=0 TSval=3451153152 TSecr=3343561929"
"261","1.490706","151.101.1.140","100.86.235.39","TLSv1.2","250","Application Data"
"262","1.490776","100.86.235.39","151.101.1.140","TCP","66","56258  >  443 [ACK] Seq=4699 Ack=1646 Win=2045 Len=0 TSval=3451153154 TSecr=3343561930"
"263","1.667089","100.86.235.39","151.101.129.140","TLSv1.2","1189","Application Data"
"264","1.667162","100.86.235.39","151.101.129.140","TLSv1.2","115","Application Data"
"265","1.667317","100.86.235.39","151.101.129.140","TLSv1.2","342","Application Data"
"266","1.677839","151.101.129.140","100.86.235.39","TCP","66","443  >  56742 [ACK] Seq=1 Ack=1173 Win=310 Len=0 TSval=3794493233 TSecr=1414252650"
"267","1.677871","151.101.129.140","100.86.235.39","TLSv1.2","101","Application Data"
"268","1.677933","100.86.235.39","151.101.129.140","TCP","66","56742  >  443 [ACK] Seq=1449 Ack=36 Win=2047 Len=0 TSval=1414252661 TSecr=3794493233"
"269","1.678549","151.101.129.140","100.86.235.39","TCP","66","443  >  56742 [ACK] Seq=36 Ack=1449 Win=316 Len=0 TSval=3794493234 TSecr=1414252650"
"270","1.759275","151.101.129.140","100.86.235.39","TLSv1.2","1164","Application Data"
"271","1.759356","100.86.235.39","151.101.129.140","TCP","66","56742  >  443 [ACK] Seq=1449 Ack=1134 Win=2030 Len=0 TSval=1414252742 TSecr=3794493314"
"272","1.770789","100.86.235.39","151.101.1.140","TCP","1514","56258  >  443 [ACK] Seq=4699 Ack=1646 Win=2048 Len=1448 TSval=3451153434 TSecr=3343561930 [TCP PDU reassembled in 273]"
"273","1.770875","100.86.235.39","151.101.1.140","TLSv1.2","136","Application Data"
"274","1.780660","151.101.1.140","100.86.235.39","TCP","66","443  >  56258 [ACK] Seq=1646 Ack=6217 Win=422 Len=0 TSval=3343562220 TSecr=3451153434"
"275","1.795737","151.101.65.140","100.86.235.39","TLSv1.2","258","Application Data"
"276","1.795900","100.86.235.39","151.101.65.140","TCP","66","56383  >  443 [ACK] Seq=32140 Ack=31144 Win=2048 Len=0 TSval=1360404825 TSecr=557629813"
"277","1.801725","151.101.65.140","100.86.235.39","TLSv1.2","185","Application Data"
"278","1.801873","100.86.235.39","151.101.65.140","TCP","66","56383  >  443 [ACK] Seq=32140 Ack=31263 Win=2048 Len=0 TSval=1360404831 TSecr=557629823"
"279","1.804979","151.101.65.140","100.86.235.39","TCP","1510","443  >  56383 [ACK] Seq=31263 Ack=32140 Win=538 Len=1444 TSval=557629826 TSecr=1360403787 [TCP PDU reassembled in 280]"
"280","1.805387","151.101.65.140","100.86.235.39","TLSv1.2","283","Application Data"
"281","1.805475","100.86.235.39","151.101.65.140","TCP","66","56383  >  443 [ACK] Seq=32140 Ack=32924 Win=2044 Len=0 TSval=1360404834 TSecr=557629826"
"282","1.807817","151.101.65.140","100.86.235.39","TLSv1.2","1405","Application Data"
"283","1.807818","151.101.65.140","100.86.235.39","TCP","1510","[TCP Previous segment not captured] 443  >  56383 [PSH, ACK] Seq=35707 Ack=32140 Win=538 Len=1444 TSval=557629828 TSecr=1360404825"
"284","1.807819","151.101.65.140","100.86.235.39","TCP","320","443  >  56383 [PSH, ACK] Seq=37151 Ack=32140 Win=538 Len=254 TSval=557629828 TSecr=1360404825"
"285","1.807918","100.86.235.39","151.101.65.140","TCP","78","56383  >  443 [ACK] Seq=32140 Ack=34263 Win=2027 Len=0 TSval=1360404837 TSecr=557629827 SLE=35707 SRE=37405"
"286","1.808225","151.101.65.140","100.86.235.39","TLSv1.2","1115","Application Data"
"287","1.808226","151.101.65.140","100.86.235.39","TLSv1.2","1428","Application Data, Application Data, Application Data"
"288","1.808279","100.86.235.39","151.101.65.140","TCP","78","[TCP Dup ACK 285#1] 56383  >  443 [ACK] Seq=32140 Ack=34263 Win=2048 Len=0 TSval=1360404837 TSecr=557629827 SLE=35707 SRE=39816"
"289","1.809143","151.101.65.140","100.86.235.39","TLSv1.2","673","Application Data"
"290","1.809145","151.101.65.140","100.86.235.39","TLSv1.2","1238","Application Data"
"291","1.809263","100.86.235.39","151.101.65.140","TCP","78","[TCP Dup ACK 285#2] 56383  >  443 [ACK] Seq=32140 Ack=34263 Win=2048 Len=0 TSval=1360404838 TSecr=557629827 SLE=35707 SRE=41595"
"292","1.811250","151.101.65.140","100.86.235.39","TLSv1.2","436","Application Data"
"293","1.811317","100.86.235.39","151.101.65.140","TCP","78","[TCP Dup ACK 285#3] 56383  >  443 [ACK] Seq=32140 Ack=34263 Win=2048 Len=0 TSval=1360404840 TSecr=557629827 SLE=35707 SRE=41965"
"294","1.818260","151.101.65.140","100.86.235.39","TCP","1510","[TCP Fast Retransmission] 443  >  56383 [ACK] Seq=34263 Ack=32140 Win=538 Len=1444 TSval=557629839 TSecr=1360404837"
"295","1.818352","100.86.235.39","151.101.65.140","TCP","66","56383  >  443 [ACK] Seq=32140 Ack=41965 Win=1927 Len=0 TSval=1360404847 TSecr=557629839"
"296","1.818613","100.86.235.39","151.101.65.140","TCP","66","[TCP Window Update] 56383  >  443 [ACK] Seq=32140 Ack=41965 Win=2048 Len=0 TSval=1360404847 TSecr=557629839"
"297","1.824805","151.101.65.140","100.86.235.39","TLSv1.2","466","Application Data"
"298","1.824832","151.101.65.140","100.86.235.39","TLSv1.2","412","Application Data"
"299","1.824915","100.86.235.39","151.101.65.140","TCP","66","56383  >  443 [ACK] Seq=32140 Ack=42365 Win=2041 Len=0 TSval=1360404854 TSecr=557629846"
"300","1.825051","100.86.235.39","151.101.65.140","TCP","66","56383  >  443 [ACK] Seq=32140 Ack=42711 Win=2036 Len=0 TSval=1360404854 TSecr=557629846"
"301","1.828464","151.101.65.140","100.86.235.39","TLSv1.2","307","Application Data"
"302","1.828501","151.101.65.140","100.86.235.39","TLSv1.2","210","Application Data"
"303","1.828534","100.86.235.39","151.101.65.140","TCP","66","56383  >  443 [ACK] Seq=32140 Ack=42952 Win=2044 Len=0 TSval=1360404857 TSecr=557629850"
"304","1.828625","100.86.235.39","151.101.65.140","TCP","66","56383  >  443 [ACK] Seq=32140 Ack=43096 Win=2041 Len=0 TSval=1360404857 TSecr=557629850"
"305","1.828755","151.101.1.140","100.86.235.39","TCP","1510","443  >  56258 [ACK] Seq=1646 Ack=6217 Win=424 Len=1444 TSval=3343562268 TSecr=3451153434 [TCP PDU reassembled in 312]"
"306","1.828756","151.101.1.140","100.86.235.39","TCP","1510","443  >  56258 [PSH, ACK] Seq=3090 Ack=6217 Win=424 Len=1444 TSval=3343562268 TSecr=3451153434 [TCP PDU reassembled in 312]"
"307","1.828807","100.86.235.39","151.101.1.140","TCP","66","56258  >  443 [ACK] Seq=6217 Ack=4534 Win=2002 Len=0 TSval=3451153491 TSecr=3343562268"
"308","1.831563","151.101.1.140","100.86.235.39","TCP","1510","443  >  56258 [ACK] Seq=4534 Ack=6217 Win=424 Len=1444 TSval=3343562269 TSecr=3451153434 [TCP PDU reassembled in 312]"
"309","1.831565","151.101.1.140","100.86.235.39","TCP","1510","443  >  56258 [PSH, ACK] Seq=5978 Ack=6217 Win=424 Len=1444 TSval=3343562269 TSecr=3451153434 [TCP PDU reassembled in 312]"
"310","1.831565","151.101.65.140","100.86.235.39","TCP","1510","443  >  56383 [ACK] Seq=43096 Ack=32140 Win=538 Len=1444 TSval=557629851 TSecr=1360404847 [TCP PDU reassembled in 311]"
"311","1.831566","151.101.65.140","100.86.235.39","TLSv1.2","1092","Application Data"
"312","1.831567","151.101.1.140","100.86.235.39","TLSv1.2","519","Application Data"
"313","1.831567","151.101.65.140","100.86.235.39","TLSv1.2","565","Application Data"
"314","1.831568","151.101.65.140","100.86.235.39","TLSv1.2","1165","Application Data, Application Data"
"315","1.831665","100.86.235.39","151.101.1.140","TCP","66","56258  >  443 [ACK] Seq=6217 Ack=7875 Win=1995 Len=0 TSval=3451153494 TSecr=3343562270"
"316","1.831715","100.86.235.39","151.101.65.140","TCP","66","56383  >  443 [ACK] Seq=32140 Ack=47164 Win=1984 Len=0 TSval=1360404860 TSecr=557629852"
"317","1.831776","100.86.235.39","151.101.1.140","TCP","66","[TCP Window Update] 56258  >  443 [ACK] Seq=6217 Ack=7875 Win=2048 Len=0 TSval=3451153494 TSecr=3343562270"
"318","1.831940","151.101.65.140","100.86.235.39","TLSv1.2","1275","Application Data, Application Data"
"319","1.831980","100.86.235.39","151.101.65.140","TCP","66","56383  >  443 [ACK] Seq=32140 Ack=48373 Win=1965 Len=0 TSval=1360404860 TSecr=557629853"
"320","1.832087","100.86.235.39","151.101.65.140","TCP","66","[TCP Window Update] 56383  >  443 [ACK] Seq=32140 Ack=48373 Win=2048 Len=0 TSval=1360404860 TSecr=557629853"
"321","1.834717","151.101.65.140","100.86.235.39","TLSv1.2","1040","Application Data, Application Data"
"322","1.834782","100.86.235.39","151.101.65.140","TCP","66","56383  >  443 [ACK] Seq=32140 Ack=49347 Win=2032 Len=0 TSval=1360404864 TSecr=557629856"
"323","1.847167","151.101.65.140","100.86.235.39","TLSv1.2","443","Application Data"
"324","1.847194","151.101.65.140","100.86.235.39","TLSv1.2","745","Application Data"
"325","1.847246","100.86.235.39","151.101.65.140","TCP","66","56383  >  443 [ACK] Seq=32140 Ack=49724 Win=2042 Len=0 TSval=1360404876 TSecr=557629868"
"326","1.847327","100.86.235.39","151.101.65.140","TCP","66","56383  >  443 [ACK] Seq=32140 Ack=50403 Win=2031 Len=0 TSval=1360404876 TSecr=557629869"
"327","1.847872","151.101.65.140","100.86.235.39","TLSv1.2","604","Application Data"
"328","1.847917","100.86.235.39","151.101.65.140","TCP","66","56383  >  443 [ACK] Seq=32140 Ack=50941 Win=2039 Len=0 TSval=1360404876 TSecr=557629869"
"329","1.848246","151.101.65.140","100.86.235.39","TLSv1.2","397","Application Data"
"330","1.848293","100.86.235.39","151.101.65.140","TCP","66","56383  >  443 [ACK] Seq=32140 Ack=51272 Win=2042 Len=0 TSval=1360404877 TSecr=557629870"
"331","1.849464","151.101.65.140","100.86.235.39","TLSv1.2","249","Application Data"
"332","1.849466","151.101.65.140","100.86.235.39","TLSv1.2","838","Application Data"
"333","1.849466","151.101.65.140","100.86.235.39","TLSv1.2","329","Application Data"
"334","1.849467","151.101.65.140","100.86.235.39","TLSv1.2","167","Application Data"
"335","1.849538","100.86.235.39","151.101.65.140","TCP","66","56383  >  443 [ACK] Seq=32140 Ack=52591 Win=2027 Len=0 TSval=1360404878 TSecr=557629871"
"336","1.851367","151.101.65.140","100.86.235.39","TLSv1.2","1152","Application Data"
"337","1.851368","151.101.65.140","100.86.235.39","TLSv1.2","1425","Application Data"
"338","1.851431","100.86.235.39","151.101.65.140","TCP","66","56383  >  443 [ACK] Seq=32140 Ack=55036 Win=2009 Len=0 TSval=1360404880 TSecr=557629871"
"339","1.858209","151.101.65.140","100.86.235.39","TLSv1.2","1007","Application Data, Application Data"
"340","1.858280","100.86.235.39","151.101.65.140","TCP","66","56383  >  443 [ACK] Seq=32140 Ack=55977 Win=2033 Len=0 TSval=1360404887 TSecr=557629880"
"341","1.863386","151.101.65.140","100.86.235.39","TLSv1.2","465","Application Data"
"342","1.863457","100.86.235.39","151.101.65.140","TCP","66","56383  >  443 [ACK] Seq=32140 Ack=56376 Win=2041 Len=0 TSval=1360404892 TSecr=557629885"
"343","1.864213","151.101.65.140","100.86.235.39","TLSv1.2","305","Application Data"
"344","1.864276","100.86.235.39","151.101.65.140","TCP","66","56383  >  443 [ACK] Seq=32140 Ack=56615 Win=2044 Len=0 TSval=1360404892 TSecr=557629886"
"345","1.864909","151.101.65.140","100.86.235.39","TLSv1.2","258","Application Data"
"346","1.864910","151.101.65.140","100.86.235.39","TLSv1.2","347","Application Data"
"347","1.865042","100.86.235.39","151.101.65.140","TCP","66","56383  >  443 [ACK] Seq=32140 Ack=57088 Win=2048 Len=0 TSval=1360404894 TSecr=557629886"
"348","1.865277","151.101.65.140","100.86.235.39","TLSv1.2","155","Application Data"
"349","1.865278","151.101.65.140","100.86.235.39","TLSv1.2","624","Application Data"
"350","1.865384","100.86.235.39","151.101.65.140","TCP","66","56383  >  443 [ACK] Seq=32140 Ack=57735 Win=2048 Len=0 TSval=1360404894 TSecr=557629887"
"351","1.865901","151.101.65.140","100.86.235.39","TLSv1.2","848","Application Data"
"352","1.865972","100.86.235.39","151.101.65.140","TCP","66","56383  >  443 [ACK] Seq=32140 Ack=58517 Win=2048 Len=0 TSval=1360404895 TSecr=557629887"
"353","1.866794","151.101.65.140","100.86.235.39","TLSv1.2","197","Application Data"
"354","1.866795","151.101.65.140","100.86.235.39","TLSv1.2","673","Application Data"
"355","1.866920","100.86.235.39","151.101.65.140","TCP","66","56383  >  443 [ACK] Seq=32140 Ack=59255 Win=2048 Len=0 TSval=1360404895 TSecr=557629888"
"356","1.867814","151.101.65.140","100.86.235.39","TLSv1.2","1510","Application Data, Application Data"
"357","1.874648","151.101.65.140","100.86.235.39","TLSv1.2","1510","Application Data, Application Data"
"358","1.874730","100.86.235.39","151.101.65.140","TCP","66","56383  >  443 [ACK] Seq=32140 Ack=62143 Win=2025 Len=0 TSval=1360404904 TSecr=557629889"
"359","1.875357","151.101.65.140","100.86.235.39","TLSv1.2","191","Application Data"
"360","1.875410","100.86.235.39","151.101.65.140","TCP","66","56383  >  443 [ACK] Seq=32140 Ack=62268 Win=2046 Len=0 TSval=1360404904 TSecr=557629896"
"361","1.885908","151.101.65.140","100.86.235.39","TLSv1.2","408","Application Data"
"362","1.886046","100.86.235.39","151.101.65.140","TCP","66","56383  >  443 [ACK] Seq=32140 Ack=62610 Win=2048 Len=0 TSval=1360404915 TSecr=557629907"
"363","1.893404","151.101.65.140","100.86.235.39","TLSv1.2","721","Application Data"
"364","1.893541","100.86.235.39","151.101.65.140","TCP","66","56383  >  443 [ACK] Seq=32140 Ack=63265 Win=2048 Len=0 TSval=1360404922 TSecr=557629915"
"365","1.894055","151.101.65.140","100.86.235.39","TLSv1.2","598","Application Data"
"366","1.894152","100.86.235.39","151.101.65.140","TCP","66","56383  >  443 [ACK] Seq=32140 Ack=63797 Win=2048 Len=0 TSval=1360404922 TSecr=557629915"
"367","1.894306","151.101.65.140","100.86.235.39","TLSv1.2","1214","Application Data"
"368","1.894384","100.86.235.39","151.101.65.140","TCP","66","56383  >  443 [ACK] Seq=32140 Ack=64945 Win=2048 Len=0 TSval=1360404922 TSecr=557629915"
"369","1.894939","151.101.65.140","100.86.235.39","TLSv1.2","299","Application Data"
"370","1.895028","100.86.235.39","151.101.65.140","TCP","66","56383  >  443 [ACK] Seq=32140 Ack=65178 Win=2048 Len=0 TSval=1360404923 TSecr=557629916"
"371","1.895104","151.101.65.140","100.86.235.39","TLSv1.2","834","Application Data"
"372","1.895198","100.86.235.39","151.101.65.140","TCP","66","56383  >  443 [ACK] Seq=32140 Ack=65946 Win=2048 Len=0 TSval=1360404923 TSecr=557629916"
"373","1.895737","151.101.65.140","100.86.235.39","TLSv1.2","728","Application Data"
"374","1.895851","100.86.235.39","151.101.65.140","TCP","66","56383  >  443 [ACK] Seq=32140 Ack=66608 Win=2048 Len=0 TSval=1360404925 TSecr=557629917"
"375","1.896809","151.101.65.140","100.86.235.39","TLSv1.2","355","Application Data"
"376","1.896810","151.101.65.140","100.86.235.39","TLSv1.2","366","Application Data"
"377","1.896999","100.86.235.39","151.101.65.140","TCP","66","56383  >  443 [ACK] Seq=32140 Ack=67197 Win=2048 Len=0 TSval=1360404926 TSecr=557629917"
"378","1.897542","151.101.65.140","100.86.235.39","TLSv1.2","436","Application Data"
"379","1.897543","151.101.65.140","100.86.235.39","TLSv1.2","655","Application Data"
"380","1.897702","100.86.235.39","151.101.65.140","TCP","66","56383  >  443 [ACK] Seq=32140 Ack=68156 Win=2048 Len=0 TSval=1360404926 TSecr=557629918"
"381","1.909797","151.101.65.140","100.86.235.39","TLSv1.2","1510","Application Data, Application Data, Application Data, Application Data, Application Data"
"382","1.909798","151.101.65.140","100.86.235.39","TLSv1.2","1510","Application Data, Application Data, Application Data, Application Data, Application Data"
"383","1.909798","151.101.65.140","100.86.235.39","TCP","1510","443  >  56383 [ACK] Seq=71044 Ack=32140 Win=538 Len=1444 TSval=557629927 TSecr=1360404923 [TCP PDU reassembled in 387]"
"384","1.909886","100.86.235.39","151.101.65.140","TCP","66","56383  >  443 [ACK] Seq=32140 Ack=72488 Win=1980 Len=0 TSval=1360404939 TSecr=557629927"
"385","1.910157","100.86.235.39","151.101.65.140","TCP","66","[TCP Window Update] 56383  >  443 [ACK] Seq=32140 Ack=72488 Win=2048 Len=0 TSval=1360404939 TSecr=557629927"
"386","1.910598","151.101.65.140","100.86.235.39","TCP","1510","443  >  56383 [PSH, ACK] Seq=72488 Ack=32140 Win=538 Len=1444 TSval=557629927 TSecr=1360404923 [TCP PDU reassembled in 387]"
"387","1.910599","151.101.65.140","100.86.235.39","TLSv1.2","1510","Application Data"
"388","1.910653","100.86.235.39","151.101.65.140","TCP","66","56383  >  443 [ACK] Seq=32140 Ack=75376 Win=2002 Len=0 TSval=1360404939 TSecr=557629929"
"389","1.910926","151.101.65.140","100.86.235.39","TCP","1510","443  >  56383 [PSH, ACK] Seq=75376 Ack=32140 Win=538 Len=1444 TSval=557629929 TSecr=1360404925 [TCP PDU reassembled in 390]"
"390","1.910927","151.101.65.140","100.86.235.39","TLSv1.2","223","Application Data"
"391","1.910973","100.86.235.39","151.101.65.140","TCP","66","56383  >  443 [ACK] Seq=32140 Ack=76977 Win=2022 Len=0 TSval=1360404940 TSecr=557629931"
"392","1.913225","100.86.235.39","151.101.1.140","TLSv1.2","533","Application Data"
"393","1.922781","151.101.1.140","100.86.235.39","TCP","66","443  >  56258 [ACK] Seq=7875 Ack=6684 Win=424 Len=0 TSval=3343562362 TSecr=3451153576"
"394","1.923688","151.101.1.140","100.86.235.39","TLSv1.2","114","Application Data"
"395","1.923762","100.86.235.39","151.101.1.140","TCP","66","56258  >  443 [ACK] Seq=6684 Ack=7923 Win=2047 Len=0 TSval=3451153586 TSecr=3343562363"
"396","1.927215","100.86.235.39","151.101.1.140","TCP","1514","56258  >  443 [ACK] Seq=6684 Ack=7923 Win=2048 Len=1448 TSval=3451153590 TSecr=3343562363 [TCP PDU reassembled in 397]"
"397","1.927256","100.86.235.39","151.101.1.140","TLSv1.2","138","Application Data"
"398","1.936896","151.101.1.140","100.86.235.39","TCP","66","443  >  56258 [ACK] Seq=7923 Ack=8204 Win=422 Len=0 TSval=3343562377 TSecr=3451153590"
