"No.","Time","Source","Destination","Protocol","Length","Info"
"1","0.000000","100.86.243.187","151.101.65.140","TLSv1.2","172","Application Data"
"2","0.003120","100.86.243.187","151.101.65.140","TLSv1.2","101","Application Data"
"3","0.004478","100.86.243.187","151.101.65.140","TLSv1.2","176","Application Data"
"4","0.006062","100.86.243.187","151.101.65.140","TLSv1.2","101","Application Data"
"5","0.008484","100.86.243.187","151.101.65.140","TLSv1.2","168","Application Data"
"6","0.030929","100.86.243.187","151.101.65.140","TLSv1.2","173","Application Data"
"7","0.034406","100.86.243.187","151.101.65.140","TLSv1.2","182","Application Data"
"8","0.036092","100.86.243.187","151.101.65.140","TLSv1.2","175","Application Data"
"9","0.037429","100.86.243.187","151.101.65.140","TLSv1.2","174","Application Data"
"10","0.037941","100.86.243.187","151.101.65.140","TLSv1.2","101","Application Data"
"11","0.039056","100.86.243.187","151.101.65.140","TLSv1.2","101","Application Data"
"12","0.039716","100.86.243.187","151.101.65.140","TLSv1.2","170","Application Data"
"13","0.040013","100.86.243.187","151.101.65.140","TLSv1.2","101","Application Data"
"14","0.049886","100.86.243.187","151.101.65.140","TLSv1.2","168","Application Data"
"15","0.059122","100.86.243.187","151.101.65.140","TCP","1514","56277  >  443 [ACK] Seq=1 Ack=1 Win=2545 Len=1448 TSval=4146193199 TSecr=1902568752 [TCP PDU reassembled in 17]"
"16","0.059124","100.86.243.187","151.101.65.140","TCP","1514","56277  >  443 [ACK] Seq=1449 Ack=1 Win=2545 Len=1448 TSval=4146193199 TSecr=1902568752 [TCP PDU reassembled in 17]"
"17","0.059161","100.86.243.187","151.101.65.140","TLSv1.2","139","Application Data"
"18","0.059215","100.86.243.187","151.101.65.140","TLSv1.2","222","Application Data"
"20","0.078343","100.86.243.187","151.101.65.140","TCP","1514","56277  >  443 [ACK] Seq=3126 Ack=1 Win=2545 Len=1448 TSval=4146193218 TSecr=1902568752 [TCP PDU reassembled in 22]"
"21","0.078346","100.86.243.187","151.101.65.140","TCP","1514","56277  >  443 [ACK] Seq=4574 Ack=1 Win=2545 Len=1448 TSval=4146193218 TSecr=1902568752 [TCP PDU reassembled in 22]"
"22","0.078384","100.86.243.187","151.101.65.140","TLSv1.2","140","Application Data"
"23","0.078431","100.86.243.187","151.101.65.140","TLSv1.2","273","Application Data"
"27","0.095847","100.86.243.187","151.101.65.140","TCP","1514","56277  >  443 [ACK] Seq=6303 Ack=1 Win=2545 Len=1448 TSval=4146193236 TSecr=1902568752 [TCP PDU reassembled in 29]"
"28","0.095849","100.86.243.187","151.101.65.140","TCP","1514","56277  >  443 [ACK] Seq=7751 Ack=1 Win=2545 Len=1448 TSval=4146193236 TSecr=1902568752 [TCP PDU reassembled in 29]"
"29","0.095882","100.86.243.187","151.101.65.140","TLSv1.2","130","Application Data"
"30","0.095934","100.86.243.187","151.101.65.140","TCP","1514","56277  >  443 [ACK] Seq=9263 Ack=1 Win=2545 Len=1448 TSval=4146193236 TSecr=1902568752 [TCP PDU reassembled in 32]"
"31","0.095935","100.86.243.187","151.101.65.140","TCP","1514","56277  >  443 [ACK] Seq=10711 Ack=1 Win=2545 Len=1448 TSval=4146193236 TSecr=1902568752 [TCP PDU reassembled in 32]"
"32","0.095946","100.86.243.187","151.101.65.140","TLSv1.2","460","Application Data"
"33","0.105222","100.86.243.187","151.101.65.140","TCP","1514","56277  >  443 [ACK] Seq=12553 Ack=1 Win=2545 Len=1448 TSval=4146193245 TSecr=1902568752 [TCP PDU reassembled in 35]"
"34","0.105224","100.86.243.187","151.101.65.140","TCP","1514","56277  >  443 [ACK] Seq=14001 Ack=1 Win=2545 Len=1448 TSval=4146193245 TSecr=1902568752 [TCP PDU reassembled in 35]"
"35","0.105257","100.86.243.187","151.101.65.140","TLSv1.2","106","Application Data"
"36","0.132265","100.86.243.187","151.101.65.140","TCP","1514","56277  >  443 [ACK] Seq=15489 Ack=1 Win=2545 Len=1448 TSval=4146193272 TSecr=1902568752 [TCP PDU reassembled in 38]"
"37","0.132267","100.86.243.187","151.101.65.140","TCP","1514","56277  >  443 [ACK] Seq=16937 Ack=1 Win=2545 Len=1448 TSval=4146193272 TSecr=1902568752 [TCP PDU reassembled in 38]"
"38","0.132295","100.86.243.187","151.101.65.140","TLSv1.2","107","Application Data"
"39","0.140036","100.86.243.187","151.101.65.140","TCP","1514","56277  >  443 [ACK] Seq=18426 Ack=1 Win=2545 Len=1448 TSval=4146193280 TSecr=1902568752 [TCP PDU reassembled in 40]"
"40","0.140070","100.86.243.187","151.101.65.140","TLSv1.2","1436","Application Data"
"41","0.150372","151.101.65.140","100.86.243.187","TCP","66","443  >  56277 [ACK] Seq=1 Ack=3126 Win=1565 Len=0 TSval=1902569194 TSecr=4146193199"
"42","0.150373","151.101.65.140","100.86.243.187","TCP","66","443  >  56277 [ACK] Seq=1 Ack=6303 Win=1576 Len=0 TSval=1902569194 TSecr=4146193218"
"44","0.151555","151.101.65.140","100.86.243.187","TCP","66","443  >  56277 [ACK] Seq=1 Ack=15449 Win=1616 Len=0 TSval=1902569195 TSecr=4146193245"
"46","0.151556","151.101.65.140","100.86.243.187","TCP","66","443  >  56303 [ACK] Seq=1 Ack=1140 Win=424 Len=0 TSval=1824821879 TSecr=2091648001"
"47","0.151556","151.101.65.140","100.86.243.187","TCP","66","443  >  56277 [ACK] Seq=1 Ack=18426 Win=1627 Len=0 TSval=1902569195 TSecr=4146193272"
"48","0.151557","151.101.65.140","100.86.243.187","TCP","66","443  >  56277 [ACK] Seq=1 Ack=21244 Win=1638 Len=0 TSval=1902569196 TSecr=4146193280"
"49","0.151557","151.101.65.140","100.86.243.187","TCP","1510","443  >  56303 [ACK] Seq=1 Ack=1140 Win=424 Len=1444 TSval=1824821880 TSecr=2091648001 [TCP PDU reassembled in 72]"
"50","0.151558","151.101.65.140","100.86.243.187","TCP","1510","443  >  56303 [PSH, ACK] Seq=1445 Ack=1140 Win=424 Len=1444 TSval=1824821880 TSecr=2091648001 [TCP PDU reassembled in 72]"
"59","0.151757","100.86.243.187","151.101.65.140","TCP","66","56303  >  443 [ACK] Seq=1140 Ack=2889 Win=2002 Len=0 TSval=2091648103 TSecr=1824821880"
"60","0.151998","151.101.65.140","100.86.243.187","TCP","1510","443  >  56303 [ACK] Seq=2889 Ack=1140 Win=424 Len=1444 TSval=1824821882 TSecr=2091648001 [TCP PDU reassembled in 72]"
"61","0.152000","151.101.65.140","100.86.243.187","TCP","1510","443  >  56303 [PSH, ACK] Seq=4333 Ack=1140 Win=424 Len=1444 TSval=1824821882 TSecr=2091648001 [TCP PDU reassembled in 72]"
"62","0.152042","100.86.243.187","151.101.65.140","TCP","66","56303  >  443 [ACK] Seq=1140 Ack=5777 Win=1957 Len=0 TSval=2091648103 TSecr=1824821882"
"64","0.152174","100.86.243.187","151.101.65.140","TCP","66","[TCP Window Update] 56303  >  443 [ACK] Seq=1140 Ack=5777 Win=2048 Len=0 TSval=2091648103 TSecr=1824821882"
"71","0.154068","151.101.65.140","100.86.243.187","TCP","1510","443  >  56303 [ACK] Seq=5777 Ack=1140 Win=424 Len=1444 TSval=1824821884 TSecr=2091648001 [TCP PDU reassembled in 72]"
"72","0.154069","151.101.65.140","100.86.243.187","TLSv1.2","1442","Application Data"
"73","0.154141","100.86.243.187","151.101.65.140","TCP","66","56303  >  443 [ACK] Seq=1140 Ack=8597 Win=2003 Len=0 TSval=2091648104 TSecr=1824821884"
"83","0.157395","151.101.65.140","100.86.243.187","TLSv1.2","1278","Application Data"
"85","0.157509","100.86.243.187","151.101.65.140","TCP","66","56303  >  443 [ACK] Seq=1140 Ack=9809 Win=2029 Len=0 TSval=2091648108 TSecr=1824821887"
"139","0.174620","151.101.65.140","100.86.243.187","TCP","1510","443  >  56277 [ACK] Seq=1 Ack=21244 Win=1638 Len=1444 TSval=1902569220 TSecr=4146193280 [TCP PDU reassembled in 140]"
"140","0.174622","151.101.65.140","100.86.243.187","TLSv1.2","234","Application Data"
"143","0.174703","100.86.243.187","151.101.65.140","TCP","66","56277  >  443 [ACK] Seq=21244 Ack=1613 Win=2520 Len=0 TSval=4146193314 TSecr=1902569220"
"146","0.175643","151.101.65.140","100.86.243.187","TCP","1510","443  >  56277 [ACK] Seq=1613 Ack=21244 Win=1638 Len=1444 TSval=1902569221 TSecr=4146193280 [TCP PDU reassembled in 147]"
"147","0.175644","151.101.65.140","100.86.243.187","TLSv1.2","976","Application Data"
"148","0.175702","100.86.243.187","151.101.65.140","TCP","66","56277  >  443 [ACK] Seq=21244 Ack=3967 Win=2508 Len=0 TSval=4146193315 TSecr=1902569221"
"150","0.179787","151.101.65.140","100.86.243.187","TLSv1.2","112","Application Data"
"151","0.179787","151.101.65.140","100.86.243.187","TCP","1510","443  >  56277 [ACK] Seq=4013 Ack=21244 Win=1638 Len=1444 TSval=1902569224 TSecr=4146193280 [TCP PDU reassembled in 152]"
"152","0.179788","151.101.65.140","100.86.243.187","TLSv1.2","289","Application Data"
"156","0.179932","100.86.243.187","151.101.65.140","TCP","66","56277  >  443 [ACK] Seq=21244 Ack=5680 Win=2518 Len=0 TSval=4146193320 TSecr=1902569224"
"187","0.197079","151.101.65.140","100.86.243.187","TCP","1510","443  >  56277 [ACK] Seq=5680 Ack=21244 Win=1638 Len=1444 TSval=1902569243 TSecr=4146193320 [TCP PDU reassembled in 188]"
"188","0.197080","151.101.65.140","100.86.243.187","TLSv1.2","899","Application Data"
"189","0.197156","100.86.243.187","151.101.65.140","TCP","66","56277  >  443 [ACK] Seq=21244 Ack=7957 Win=2510 Len=0 TSval=4146193336 TSecr=1902569243"
"190","0.198506","151.101.65.140","100.86.243.187","TLSv1.2","99","Application Data"
"191","0.198581","100.86.243.187","151.101.65.140","TCP","66","56277  >  443 [ACK] Seq=21244 Ack=7990 Win=2545 Len=0 TSval=4146193339 TSecr=1902569244"
"209","0.216816","151.101.65.140","100.86.243.187","TCP","1510","443  >  56277 [ACK] Seq=7990 Ack=21244 Win=1638 Len=1444 TSval=1902569259 TSecr=4146193339 [TCP PDU reassembled in 210]"
"210","0.216816","151.101.65.140","100.86.243.187","TLSv1.2","401","Application Data"
"211","0.216817","151.101.65.140","100.86.243.187","TLSv1.2","428","Application Data"
"212","0.216817","151.101.65.140","100.86.243.187","TLSv1.2","107","Application Data"
"215","0.217094","100.86.243.187","151.101.65.140","TCP","66","56277  >  443 [ACK] Seq=21244 Ack=10172 Win=2511 Len=0 TSval=4146193357 TSecr=1902569261"
"216","0.229357","151.101.65.140","100.86.243.187","TCP","1510","443  >  56277 [ACK] Seq=10172 Ack=21244 Win=1638 Len=1444 TSval=1902569273 TSecr=4146193357 [TCP PDU reassembled in 217]"
"217","0.229357","151.101.65.140","100.86.243.187","TLSv1.2","1048","Application Data"
"218","0.229421","100.86.243.187","151.101.65.140","TCP","66","56277  >  443 [ACK] Seq=21244 Ack=12598 Win=2507 Len=0 TSval=4146193369 TSecr=1902569273"
"219","0.277751","100.86.243.187","151.101.65.140","TLSv1.2","233","Application Data"
"220","0.278797","100.86.243.187","151.101.65.140","TLSv1.2","169","Application Data"
"221","0.306353","151.101.65.140","100.86.243.187","TCP","66","443  >  56303 [ACK] Seq=9809 Ack=1307 Win=424 Len=0 TSval=1824822035 TSecr=2091648229"
"222","0.306354","151.101.65.140","100.86.243.187","TCP","66","443  >  56303 [ACK] Seq=9809 Ack=1410 Win=424 Len=0 TSval=1824822035 TSecr=2091648230"
"223","0.306354","151.101.65.140","100.86.243.187","TCP","1510","443  >  56303 [ACK] Seq=9809 Ack=1410 Win=424 Len=1444 TSval=1824822036 TSecr=2091648230 [TCP PDU reassembled in 227]"
"224","0.306355","151.101.65.140","100.86.243.187","TCP","1510","443  >  56303 [PSH, ACK] Seq=11253 Ack=1410 Win=424 Len=1444 TSval=1824822036 TSecr=2091648230 [TCP PDU reassembled in 227]"
"225","0.306463","100.86.243.187","151.101.65.140","TCP","66","56303  >  443 [ACK] Seq=1410 Ack=12697 Win=2002 Len=0 TSval=2091648257 TSecr=1824822036"
"226","0.307804","151.101.65.140","100.86.243.187","TCP","1510","443  >  56303 [ACK] Seq=12697 Ack=1410 Win=424 Len=1444 TSval=1824822038 TSecr=2091648230 [TCP PDU reassembled in 227]"
"227","0.307804","151.101.65.140","100.86.243.187","TLSv1.2","973","Application Data"
"228","0.307870","100.86.243.187","151.101.65.140","TCP","66","56303  >  443 [ACK] Seq=1410 Ack=15048 Win=2011 Len=0 TSval=2091648259 TSecr=1824822038"
"268","0.405581","100.86.243.187","151.101.65.140","TCP","1514","56277  >  443 [ACK] Seq=21244 Ack=12598 Win=2545 Len=1448 TSval=4146193546 TSecr=1902569273 [TCP PDU reassembled in 269]"
"269","0.405606","100.86.243.187","151.101.65.140","TLSv1.2","1433","Application Data"
"273","0.415260","151.101.65.140","100.86.243.187","TCP","66","443  >  56277 [ACK] Seq=12598 Ack=24059 Win=1649 Len=0 TSval=1902569461 TSecr=4146193546"
"276","0.422931","100.86.243.187","151.101.65.140","TCP","1514","56277  >  443 [ACK] Seq=24059 Ack=12598 Win=2545 Len=1448 TSval=4146193563 TSecr=1902569461 [TCP PDU reassembled in 277]"
"277","0.422962","100.86.243.187","151.101.65.140","TLSv1.2","1448","Application Data"
"278","0.423341","100.86.243.187","151.101.65.140","TCP","1514","56277  >  443 [ACK] Seq=26889 Ack=12598 Win=2545 Len=1448 TSval=4146193563 TSecr=1902569461 [TCP PDU reassembled in 280]"
"279","0.423343","100.86.243.187","151.101.65.140","TCP","1514","56277  >  443 [ACK] Seq=28337 Ack=12598 Win=2545 Len=1448 TSval=4146193563 TSecr=1902569461 [TCP PDU reassembled in 280]"
"280","0.423361","100.86.243.187","151.101.65.140","TLSv1.2","74","Application Data"
"281","0.425936","100.86.243.187","151.101.65.140","TCP","1514","56277  >  443 [ACK] Seq=29793 Ack=12598 Win=2545 Len=1448 TSval=4146193566 TSecr=1902569461 [TCP PDU reassembled in 282]"
"282","0.425967","100.86.243.187","151.101.65.140","TLSv1.2","1449","Application Data"
"283","0.458818","100.86.243.187","151.101.65.140","TLSv1.2","246","Application Data"
"284","0.459056","100.86.243.187","151.101.65.140","TLSv1.2","101","Application Data"
"285","0.474693","100.86.243.187","151.101.65.140","TLSv1.2","217","Application Data"
"286","0.475958","100.86.243.187","151.101.65.140","TLSv1.2","170","Application Data"
"287","0.486641","100.86.243.187","151.101.65.140","TCP","1514","[TCP Retransmission] 56277  >  443 [PSH, ACK] Seq=31176 Ack=12598 Win=2545 Len=1448 TSval=4146193627 TSecr=1902569461 [TCP PDU reassembled in 282]"
"305","0.626828","100.86.243.187","151.101.65.140","TCP","536","[TCP Retransmission] 56303  >  443 [PSH, ACK] Seq=1410 Ack=15048 Win=2048 Len=470 TSval=2091648578 TSecr=1824822038"
"307","0.661034","151.101.65.140","100.86.243.187","TCP","66","443  >  56277 [ACK] Seq=12598 Ack=29793 Win=1672 Len=0 TSval=1902569480 TSecr=4146193563"
"308","0.661035","151.101.65.140","100.86.243.187","TCP","66","443  >  56277 [ACK] Seq=12598 Ack=32624 Win=1683 Len=0 TSval=1902569482 TSecr=4146193566"
"309","0.664483","151.101.65.140","100.86.243.187","TCP","1510","443  >  56277 [ACK] Seq=12598 Ack=32624 Win=1683 Len=1444 TSval=1902569494 TSecr=4146193566 [TCP PDU reassembled in 310]"
"310","0.664484","151.101.65.140","100.86.243.187","TLSv1.2","358","Application Data"
"311","0.664485","151.101.65.140","100.86.243.187","TCP","1510","443  >  56277 [ACK] Seq=14334 Ack=32624 Win=1683 Len=1444 TSval=1902569504 TSecr=4146193566 [TCP PDU reassembled in 312]"
"312","0.664486","151.101.65.140","100.86.243.187","TLSv1.2","894","Application Data"
"313","0.664487","151.101.65.140","100.86.243.187","TLSv1.2","112","Application Data"
"314","0.664488","151.101.65.140","100.86.243.187","TCP","1510","443  >  56277 [ACK] Seq=16652 Ack=32624 Win=1683 Len=1444 TSval=1902569517 TSecr=4146193566 [TCP PDU reassembled in 315]"
"315","0.664489","151.101.65.140","100.86.243.187","TLSv1.2","329","Application Data"
"316","0.664490","151.101.65.140","100.86.243.187","TCP","1510","443  >  56277 [ACK] Seq=18359 Ack=32624 Win=1683 Len=1444 TSval=1902569529 TSecr=4146193566 [TCP PDU reassembled in 317]"
"317","0.664491","151.101.65.140","100.86.243.187","TLSv1.2","1051","Application Data"
"319","0.664493","151.101.65.140","100.86.243.187","TLSv1.2","912","Application Data, Application Data, Application Data"
"320","0.664723","100.86.243.187","151.101.65.140","TCP","66","56277  >  443 [ACK] Seq=32624 Ack=21634 Win=2404 Len=0 TSval=4146193805 TSecr=1902569562"
"322","0.668504","100.86.243.187","151.101.65.140","TCP","66","[TCP Window Update] 56277  >  443 [ACK] Seq=32624 Ack=21634 Win=2545 Len=0 TSval=4146193808 TSecr=1902569562"
"323","0.670966","151.101.65.140","100.86.243.187","TCP","66","443  >  56303 [ACK] Seq=15048 Ack=1880 Win=424 Len=0 TSval=1824822401 TSecr=2091648427"
"325","0.670968","151.101.65.140","100.86.243.187","TCP","78","[TCP Dup ACK 323#1] 443  >  56303 [ACK] Seq=15048 Ack=1880 Win=424 Len=0 TSval=1824822402 TSecr=2091648578 SLE=1410 SRE=1880"
"326","0.670968","151.101.65.140","100.86.243.187","TCP","78","[TCP Dup ACK 308#1] 443  >  56277 [ACK] Seq=21634 Ack=32624 Win=1683 Len=0 TSval=1902569717 TSecr=4146193627 SLE=31176 SRE=32624"
"327","0.671051","151.101.65.140","100.86.243.187","TLSv1.2","170","Application Data"
"328","0.671052","151.101.65.140","100.86.243.187","TCP","1510","443  >  56303 [ACK] Seq=15152 Ack=1880 Win=424 Len=1444 TSval=1824822402 TSecr=2091648578 [TCP PDU reassembled in 330]"
"329","0.671110","100.86.243.187","151.101.65.140","TCP","66","56303  >  443 [ACK] Seq=1880 Ack=16596 Win=2023 Len=0 TSval=2091648622 TSecr=1824822402"
"330","0.671198","151.101.65.140","100.86.243.187","TLSv1.2","850","Application Data"
"332","0.671245","100.86.243.187","151.101.65.140","TCP","66","56303  >  443 [ACK] Seq=1880 Ack=17380 Win=2013 Len=0 TSval=2091648622 TSecr=1824822402"
"338","0.674305","151.101.65.140","100.86.243.187","TLSv1.2","431","Application Data"
"341","0.674385","100.86.243.187","151.101.65.140","TCP","66","56303  >  443 [ACK] Seq=1880 Ack=17745 Win=2042 Len=0 TSval=2091648625 TSecr=1824822404"
"348","0.677165","151.101.65.140","100.86.243.187","TLSv1.2","1051","Application Data"
"353","0.677338","100.86.243.187","151.101.65.140","TCP","66","56277  >  443 [ACK] Seq=32624 Ack=22619 Win=2530 Len=0 TSval=4146193817 TSecr=1902569722"
"406","0.788760","100.86.243.187","151.101.65.140","TCP","1514","56277  >  443 [ACK] Seq=32624 Ack=22619 Win=2545 Len=1448 TSval=4146193929 TSecr=1902569722 [TCP PDU reassembled in 408]"
"407","0.788763","100.86.243.187","151.101.65.140","TCP","1514","56277  >  443 [ACK] Seq=34072 Ack=22619 Win=2545 Len=1448 TSval=4146193929 TSecr=1902569722 [TCP PDU reassembled in 408]"
"408","0.788803","100.86.243.187","151.101.65.140","TLSv1.2","141","Application Data"
"409","0.788854","100.86.243.187","151.101.65.140","TCP","1514","56277  >  443 [ACK] Seq=35595 Ack=22619 Win=2545 Len=1448 TSval=4146193929 TSecr=1902569722 [TCP PDU reassembled in 410]"
"410","0.788866","100.86.243.187","151.101.65.140","TLSv1.2","1063","Application Data"
"420","0.800277","151.101.65.140","100.86.243.187","TCP","66","443  >  56277 [ACK] Seq=22619 Ack=38040 Win=1703 Len=0 TSval=1902569846 TSecr=4146193929"
"432","0.869677","151.101.65.140","100.86.243.187","TCP","1510","443  >  56277 [ACK] Seq=22619 Ack=38040 Win=1703 Len=1444 TSval=1902569914 TSecr=4146193929 [TCP PDU reassembled in 433]"
"433","0.869680","151.101.65.140","100.86.243.187","TLSv1.2","517","Application Data"
"434","0.869835","100.86.243.187","151.101.65.140","TCP","66","56277  >  443 [ACK] Seq=38040 Ack=24514 Win=2516 Len=0 TSval=4146194010 TSecr=1902569914"
"436","1.325477","151.101.65.140","100.86.243.187","TLSv1.2","150","Application Data"
"437","1.325653","100.86.243.187","151.101.65.140","TCP","66","56277  >  443 [ACK] Seq=38040 Ack=24598 Win=2544 Len=0 TSval=4146194466 TSecr=1902570369"
"438","1.326813","151.101.65.140","100.86.243.187","TLSv1.2","260","Application Data"
"439","1.326951","100.86.243.187","151.101.65.140","TCP","66","56277  >  443 [ACK] Seq=38040 Ack=24792 Win=2542 Len=0 TSval=4146194467 TSecr=1902570371"
"440","1.335472","151.101.65.140","100.86.243.187","TCP","1510","443  >  56277 [ACK] Seq=24792 Ack=38040 Win=1703 Len=1444 TSval=1902570380 TSecr=4146194010 [TCP PDU reassembled in 447]"
"441","1.335474","151.101.65.140","100.86.243.187","TCP","1510","443  >  56277 [PSH, ACK] Seq=26236 Ack=38040 Win=1703 Len=1444 TSval=1902570380 TSecr=4146194010 [TCP PDU reassembled in 447]"
"442","1.335607","100.86.243.187","151.101.65.140","TCP","66","56277  >  443 [ACK] Seq=38040 Ack=27680 Win=2500 Len=0 TSval=4146194476 TSecr=1902570380"
"443","1.337042","151.101.65.140","100.86.243.187","TCP","1510","443  >  56277 [ACK] Seq=27680 Ack=38040 Win=1703 Len=1444 TSval=1902570382 TSecr=4146194010 [TCP PDU reassembled in 447]"
"444","1.337043","151.101.65.140","100.86.243.187","TCP","1510","443  >  56277 [PSH, ACK] Seq=29124 Ack=38040 Win=1703 Len=1444 TSval=1902570382 TSecr=4146194010 [TCP PDU reassembled in 447]"
"445","1.337119","100.86.243.187","151.101.65.140","TCP","66","56277  >  443 [ACK] Seq=38040 Ack=30568 Win=2500 Len=0 TSval=4146194477 TSecr=1902570382"
"446","1.345005","151.101.65.140","100.86.243.187","TCP","1510","443  >  56277 [ACK] Seq=30568 Ack=38040 Win=1703 Len=1444 TSval=1902570388 TSecr=4146194010 [TCP PDU reassembled in 447]"
"447","1.345006","151.101.65.140","100.86.243.187","TLSv1.2","609","Application Data"
"448","1.345110","100.86.243.187","151.101.65.140","TCP","66","56277  >  443 [ACK] Seq=38040 Ack=32555 Win=2514 Len=0 TSval=4146194485 TSecr=1902570388"
"449","1.346801","151.101.65.140","100.86.243.187","TLSv1.2","542","Application Data, Application Data"
"450","1.346891","100.86.243.187","151.101.65.140","TCP","66","56277  >  443 [ACK] Seq=38040 Ack=33031 Win=2538 Len=0 TSval=4146194487 TSecr=1902570392"
"451","1.354367","151.101.65.140","100.86.243.187","TLSv1.2","246","Application Data"
"452","1.354368","151.101.65.140","100.86.243.187","TLSv1.2","399","Application Data"
"453","1.354368","151.101.65.140","100.86.243.187","TLSv1.2","243","Application Data"
"454","1.354629","100.86.243.187","151.101.65.140","TCP","66","56277  >  443 [ACK] Seq=38040 Ack=33721 Win=2545 Len=0 TSval=4146194494 TSecr=1902570399"
"455","1.358749","151.101.65.140","100.86.243.187","TLSv1.2","500","Application Data"
"456","1.358750","151.101.65.140","100.86.243.187","TLSv1.2","295","Application Data"
"457","1.358750","151.101.65.140","100.86.243.187","TLSv1.2","482","Application Data"
"458","1.358751","151.101.65.140","100.86.243.187","TLSv1.2","831","Application Data, Application Data, Application Data, Application Data"
"459","1.358752","151.101.65.140","100.86.243.187","TLSv1.2","1510","Application Data, Application Data, Application Data, Application Data, Application Data"
"460","1.358752","151.101.65.140","100.86.243.187","TLSv1.2","498","Application Data, Application Data, Application Data, Application Data, Application Data"
"461","1.358832","100.86.243.187","151.101.65.140","TCP","66","56277  >  443 [ACK] Seq=38040 Ack=37441 Win=2487 Len=0 TSval=4146194499 TSecr=1902570402"
"462","1.359125","100.86.243.187","151.101.65.140","TCP","66","[TCP Window Update] 56277  >  443 [ACK] Seq=38040 Ack=37441 Win=2545 Len=0 TSval=4146194499 TSecr=1902570402"
"463","1.370266","151.101.65.140","100.86.243.187","TLSv1.2","854","Application Data"
"464","1.370418","100.86.243.187","151.101.65.140","TCP","66","56277  >  443 [ACK] Seq=38040 Ack=38229 Win=2545 Len=0 TSval=4146194510 TSecr=1902570414"
"465","1.396330","151.101.65.140","100.86.243.187","TLSv1.2","1237","Application Data"
"466","1.396332","151.101.65.140","100.86.243.187","TLSv1.2","912","Application Data"
"467","1.396333","151.101.65.140","100.86.243.187","TCP","1510","443  >  56277 [ACK] Seq=40246 Ack=38040 Win=1703 Len=1444 TSval=1902570421 TSecr=4146194499 [TCP PDU reassembled in 471]"
"468","1.396487","100.86.243.187","151.101.65.140","TCP","66","56277  >  443 [ACK] Seq=38040 Ack=41690 Win=2491 Len=0 TSval=4146194536 TSecr=1902570421"
"469","1.396839","100.86.243.187","151.101.65.140","TCP","66","[TCP Window Update] 56277  >  443 [ACK] Seq=38040 Ack=41690 Win=2545 Len=0 TSval=4146194536 TSecr=1902570421"
"470","1.397333","151.101.65.140","100.86.243.187","TCP","1510","443  >  56277 [PSH, ACK] Seq=41690 Ack=38040 Win=1703 Len=1444 TSval=1902570421 TSecr=4146194499 [TCP PDU reassembled in 471]"
"471","1.397335","151.101.65.140","100.86.243.187","TLSv1.2","642","Application Data"
"472","1.397473","100.86.243.187","151.101.65.140","TCP","66","56277  >  443 [ACK] Seq=38040 Ack=43710 Win=2514 Len=0 TSval=4146194536 TSecr=1902570425"
"473","1.398019","151.101.65.140","100.86.243.187","TLSv1.2","154","Application Data"
"474","1.398020","151.101.65.140","100.86.243.187","TLSv1.2","160","Application Data"
"475","1.398130","100.86.243.187","151.101.65.140","TCP","66","56277  >  443 [ACK] Seq=38040 Ack=43892 Win=2542 Len=0 TSval=4146194538 TSecr=1902570440"
"476","1.400660","151.101.65.140","100.86.243.187","TLSv1.2","237","Application Data"
"477","1.400747","100.86.243.187","151.101.65.140","TCP","66","56277  >  443 [ACK] Seq=38040 Ack=44063 Win=2543 Len=0 TSval=4146194541 TSecr=1902570445"
"480","1.435325","151.101.65.140","100.86.243.187","TLSv1.2","498","Application Data"
"481","1.435530","100.86.243.187","151.101.65.140","TCP","66","56277  >  443 [ACK] Seq=38040 Ack=44495 Win=2545 Len=0 TSval=4146194575 TSecr=1902570479"
"482","1.441502","151.101.65.140","100.86.243.187","TLSv1.2","310","Application Data"
"483","1.441709","100.86.243.187","151.101.65.140","TCP","66","56277  >  443 [ACK] Seq=38040 Ack=44739 Win=2545 Len=0 TSval=4146194582 TSecr=1902570486"
"484","1.446274","151.101.65.140","100.86.243.187","TLSv1.2","307","Application Data"
"485","1.446550","100.86.243.187","151.101.65.140","TCP","66","56277  >  443 [ACK] Seq=38040 Ack=44980 Win=2545 Len=0 TSval=4146194586 TSecr=1902570491"
"486","1.452078","151.101.65.140","100.86.243.187","TLSv1.2","247","Application Data"
"487","1.452079","151.101.65.140","100.86.243.187","TLSv1.2","253","Application Data"
"488","1.452464","100.86.243.187","151.101.65.140","TCP","66","56277  >  443 [ACK] Seq=38040 Ack=45348 Win=2545 Len=0 TSval=4146194592 TSecr=1902570496"
"489","1.454069","151.101.65.140","100.86.243.187","TLSv1.2","403","Application Data"
"490","1.454285","100.86.243.187","151.101.65.140","TCP","66","56277  >  443 [ACK] Seq=38040 Ack=45685 Win=2545 Len=0 TSval=4146194594 TSecr=1902570500"
"491","1.456559","151.101.65.140","100.86.243.187","TLSv1.2","178","Application Data"
"492","1.456802","100.86.243.187","151.101.65.140","TCP","66","56277  >  443 [ACK] Seq=38040 Ack=45797 Win=2545 Len=0 TSval=4146194597 TSecr=1902570500"
"493","1.461832","151.101.65.140","100.86.243.187","TLSv1.2","184","Application Data"
"494","1.461833","151.101.65.140","100.86.243.187","TLSv1.2","172","Application Data"
"495","1.462069","100.86.243.187","151.101.65.140","TCP","66","56277  >  443 [ACK] Seq=38040 Ack=46021 Win=2545 Len=0 TSval=4146194602 TSecr=1902570506"
"496","1.463307","151.101.65.140","100.86.243.187","TCP","1510","443  >  56277 [ACK] Seq=46021 Ack=38040 Win=1703 Len=1444 TSval=1902570509 TSecr=4146194592 [TCP PDU reassembled in 500]"
"497","1.463308","151.101.65.140","100.86.243.187","TCP","1510","443  >  56277 [PSH, ACK] Seq=47465 Ack=38040 Win=1703 Len=1444 TSval=1902570509 TSecr=4146194592 [TCP PDU reassembled in 500]"
"498","1.463370","100.86.243.187","151.101.65.140","TCP","66","56277  >  443 [ACK] Seq=38040 Ack=48909 Win=2500 Len=0 TSval=4146194603 TSecr=1902570509"
"499","1.465707","151.101.65.140","100.86.243.187","TCP","1510","443  >  56277 [ACK] Seq=48909 Ack=38040 Win=1703 Len=1444 TSval=1902570510 TSecr=4146194592 [TCP PDU reassembled in 500]"
"500","1.465708","151.101.65.140","100.86.243.187","TLSv1.2","162","Application Data"
"501","1.465786","100.86.243.187","151.101.65.140","TCP","66","56277  >  443 [ACK] Seq=38040 Ack=50449 Win=2521 Len=0 TSval=4146194606 TSecr=1902570510"
"503","1.710074","151.101.65.140","100.86.243.187","TLSv1.2","312","Application Data"
"504","1.710076","151.101.65.140","100.86.243.187","TLSv1.2","274","Application Data"
"505","1.710077","151.101.65.140","100.86.243.187","TLSv1.2","400","Application Data"
"506","1.710077","151.101.65.140","100.86.243.187","TLSv1.2","173","Application Data"
"507","1.710078","151.101.65.140","100.86.243.187","TLSv1.2","156","Application Data"
"508","1.710079","151.101.65.140","100.86.243.187","TLSv1.2","157","Application Data"
"509","1.710079","151.101.65.140","100.86.243.187","TLSv1.2","370","Application Data"
"510","1.710080","151.101.65.140","100.86.243.187","TLSv1.2","445","Application Data"
"511","1.710080","151.101.65.140","100.86.243.187","TLSv1.2","343","Application Data"
"512","1.710081","151.101.65.140","100.86.243.187","TLSv1.2","999","Application Data"
"516","1.710083","151.101.65.140","100.86.243.187","TLSv1.2","1510","Application Data, Application Data, Application Data"
"520","1.710248","100.86.243.187","151.101.65.140","TCP","66","56277  >  443 [ACK] Seq=38040 Ack=54862 Win=2476 Len=0 TSval=4146194850 TSecr=1902570613"
"522","1.710786","100.86.243.187","151.101.65.140","TCP","66","[TCP Window Update] 56277  >  443 [ACK] Seq=38040 Ack=54862 Win=2545 Len=0 TSval=4146194850 TSecr=1902570613"
"524","1.736239","151.101.65.140","100.86.243.187","TLSv1.2","1510","Application Data, Application Data, Application Data, Application Data, Application Data, Application Data, Application Data"
"525","1.736240","151.101.65.140","100.86.243.187","TLSv1.2","1510","Application Data, Application Data, Application Data"
"526","1.736365","100.86.243.187","151.101.65.140","TCP","66","56277  >  443 [ACK] Seq=38040 Ack=57750 Win=2500 Len=0 TSval=4146194876 TSecr=1902570767"
"531","2.025729","151.101.65.140","100.86.243.187","TLSv1.2","1366","Application Data, Application Data, Application Data, Application Data"
"532","2.025879","100.86.243.187","151.101.65.140","TCP","66","56277  >  443 [ACK] Seq=38040 Ack=59050 Win=2525 Len=0 TSval=4146195166 TSecr=1902571072"
"828","2.606324","100.86.243.187","151.101.65.140","TCP","1514","56277  >  443 [ACK] Seq=38040 Ack=59050 Win=2545 Len=1448 TSval=4146195746 TSecr=1902571072 [TCP PDU reassembled in 830]"
"829","2.606326","100.86.243.187","151.101.65.140","TCP","1514","56277  >  443 [ACK] Seq=39488 Ack=59050 Win=2545 Len=1448 TSval=4146195746 TSecr=1902571072 [TCP PDU reassembled in 830]"
"830","2.606358","100.86.243.187","151.101.65.140","TLSv1.2","135","Application Data"
"831","2.606408","100.86.243.187","151.101.65.140","TLSv1.2","146","Application Data"
"833","2.746267","100.86.243.187","151.101.65.140","TCP","1514","[TCP Retransmission] 56277  >  443 [PSH, ACK] Seq=39637 Ack=59050 Win=2545 Len=1448 TSval=4146195886 TSecr=1902571072"
"849","2.769710","151.101.65.140","100.86.243.187","TCP","66","443  >  56277 [ACK] Seq=59050 Ack=41085 Win=1715 Len=0 TSval=1902571813 TSecr=4146195746"
"850","2.769713","151.101.65.140","100.86.243.187","TCP","78","[TCP Dup ACK 849#1] 443  >  56277 [ACK] Seq=59050 Ack=41085 Win=1715 Len=0 TSval=1902571813 TSecr=4146195886 SLE=39637 SRE=41085"
"879","2.790799","151.101.65.140","100.86.243.187","TCP","1510","443  >  56277 [ACK] Seq=59050 Ack=41085 Win=1715 Len=1444 TSval=1902571836 TSecr=4146195886 [TCP PDU reassembled in 880]"
"880","2.790800","151.101.65.140","100.86.243.187","TLSv1.2","748","Application Data"
"881","2.790921","100.86.243.187","151.101.65.140","TCP","66","56277  >  443 [ACK] Seq=41085 Ack=61176 Win=2512 Len=0 TSval=4146195931 TSecr=1902571836"
"882","2.793036","151.101.65.140","100.86.243.187","TLSv1.2","1119","Application Data"
"883","2.793260","100.86.243.187","151.101.65.140","TCP","66","56277  >  443 [ACK] Seq=41085 Ack=62229 Win=2529 Len=0 TSval=4146195933 TSecr=1902571838"
"1109","3.194948","100.86.243.187","151.101.65.140","TCP","1514","56277  >  443 [ACK] Seq=41085 Ack=62229 Win=2545 Len=1448 TSval=4146196335 TSecr=1902571838 [TCP PDU reassembled in 1111]"
"1110","3.194950","100.86.243.187","151.101.65.140","TCP","1514","56277  >  443 [ACK] Seq=42533 Ack=62229 Win=2545 Len=1448 TSval=4146196335 TSecr=1902571838 [TCP PDU reassembled in 1111]"
"1111","3.194985","100.86.243.187","151.101.65.140","TLSv1.2","131","Application Data"
"1112","3.195038","100.86.243.187","151.101.65.140","TCP","1514","56277  >  443 [ACK] Seq=44046 Ack=62229 Win=2545 Len=1448 TSval=4146196335 TSecr=1902571838 [TCP PDU reassembled in 1113]"
"1113","3.195049","100.86.243.187","151.101.65.140","TLSv1.2","1456","Application Data"
"1131","3.293494","151.101.65.140","100.86.243.187","TCP","66","443  >  56277 [ACK] Seq=62229 Ack=46884 Win=1737 Len=0 TSval=1902572337 TSecr=4146196335"
"1146","3.336961","151.101.65.140","100.86.243.187","TCP","1510","443  >  56277 [ACK] Seq=62229 Ack=46884 Win=1737 Len=1444 TSval=1902572381 TSecr=4146196335 [TCP PDU reassembled in 1147]"
"1147","3.336966","151.101.65.140","100.86.243.187","TLSv1.2","414","Application Data"
"1150","3.337064","100.86.243.187","151.101.65.140","TCP","66","56277  >  443 [ACK] Seq=46884 Ack=64021 Win=2517 Len=0 TSval=4146196477 TSecr=1902572381"
