"No.","Time","Source","Destination","Protocol","Length","Info"
"1","0.000000","100.86.235.39","151.101.65.140","TLSv1.2","584","Application Data"
"2","0.000076","100.86.235.39","151.101.65.140","TLSv1.2","832","Application Data"
"3","0.001377","100.86.235.39","151.101.65.140","TCP","1514","56257  >  443 [ACK] Seq=1285 Ack=1 Win=2545 Len=1448 TSval=1601722274 TSecr=653858914 [TCP PDU reassembled in 4]"
"4","0.001415","100.86.235.39","151.101.65.140","TLSv1.2","985","Application Data"
"5","0.003999","100.86.235.39","151.101.65.140","TLSv1.2","101","Application Data"
"6","0.016175","151.101.65.140","100.86.235.39","TCP","66","443  >  56257 [ACK] Seq=1 Ack=1285 Win=368 Len=0 TSval=653859850 TSecr=1601722273"
"7","0.016539","151.101.65.140","100.86.235.39","TCP","66","443  >  56257 [ACK] Seq=1 Ack=3687 Win=377 Len=0 TSval=653859851 TSecr=1601722277"
"8","0.037472","151.101.65.140","100.86.235.39","TCP","1510","443  >  56257 [ACK] Seq=1 Ack=3687 Win=377 Len=1444 TSval=653859871 TSecr=1601722277 [TCP PDU reassembled in 9]"
"9","0.037474","151.101.65.140","100.86.235.39","TLSv1.2","933","Application Data"
"10","0.037648","100.86.235.39","151.101.65.140","TCP","66","56257  >  443 [ACK] Seq=3687 Ack=2312 Win=2509 Len=0 TSval=1601722310 TSecr=653859871"
"11","0.168102","100.86.235.39","151.101.1.140","TCP","78","56261  >  443 [SYN, ECE, CWR] Seq=0 Win=65535 Len=0 MSS=1460 WS=64 TSval=922834813 TSecr=0 SACK_PERM"
"12","0.181157","151.101.1.140","100.86.235.39","TCP","74","443  >  56261 [SYN, ACK] Seq=0 Ack=1 Win=65535 Len=0 MSS=1460 SACK_PERM TSval=269490649 TSecr=922834813 WS=512"
"13","0.181311","100.86.235.39","151.101.1.140","TCP","66","56261  >  443 [ACK] Seq=1 Ack=1 Win=131712 Len=0 TSval=922834826 TSecr=269490649"
"14","0.181925","100.86.235.39","151.101.1.140","TCP","1514","56261  >  443 [ACK] Seq=1 Ack=1 Win=131712 Len=1448 TSval=922834826 TSecr=269490649 [TCP PDU reassembled in 15]"
"15","0.181956","100.86.235.39","151.101.1.140","TLSv1.3","523","Client Hello (SNI=www.redditstatic.com)"
"16","0.182883","100.86.235.39","151.101.1.140","TCP","66","56261  >  443 [FIN, ACK] Seq=1906 Ack=1 Win=131712 Len=0 TSval=922834828 TSecr=269490649"
"17","0.183631","100.86.235.39","151.101.1.140","TCP","78","56263  >  443 [SYN, ECE, CWR] Seq=0 Win=65535 Len=0 MSS=1460 WS=64 TSval=764789014 TSecr=0 SACK_PERM"
"18","0.190026","100.86.235.39","151.101.1.140","TCP","78","56264  >  443 [SYN, ECE, CWR] Seq=0 Win=65535 Len=0 MSS=1460 WS=64 TSval=277490933 TSecr=0 SACK_PERM"
"19","0.192805","151.101.1.140","100.86.235.39","TCP","66","443  >  56261 [ACK] Seq=1 Ack=1906 Win=148992 Len=0 TSval=269490662 TSecr=922834826"
"20","0.194419","151.101.1.140","100.86.235.39","TCP","66","443  >  56261 [ACK] Seq=1 Ack=1907 Win=148992 Len=0 TSval=269490663 TSecr=922834828"
"21","0.194420","151.101.1.140","100.86.235.39","TLSv1.3","1510","Server Hello, Change Cipher Spec, Application Data"
"22","0.194421","151.101.1.140","100.86.235.39","TCP","1510","443  >  56261 [ACK] Seq=1445 Ack=1907 Win=148992 Len=1444 TSval=269490664 TSecr=922834828 [TCP PDU reassembled in 24]"
"23","0.194516","100.86.235.39","151.101.1.140","TCP","54","56261  >  443 [RST] Seq=1907 Win=0 Len=0"
"24","0.195071","151.101.1.140","100.86.235.39","TLSv1.3","1427","Application Data, Application Data, Application Data, Application Data"
"25","0.195072","151.101.1.140","100.86.235.39","TLSv1.3","90","Application Data"
"26","0.195128","100.86.235.39","151.101.1.140","TCP","54","56261  >  443 [RST] Seq=1907 Win=0 Len=0"
"27","0.195153","100.86.235.39","151.101.1.140","TCP","54","56261  >  443 [RST] Seq=1907 Win=0 Len=0"
"28","0.196460","151.101.1.140","100.86.235.39","TCP","66","443  >  56261 [FIN, ACK] Seq=4274 Ack=1907 Win=148992 Len=0 TSval=269490664 TSecr=922834828"
"29","0.196461","151.101.1.140","100.86.235.39","TCP","74","443  >  56263 [SYN, ACK] Seq=0 Ack=1 Win=65535 Len=0 MSS=1460 SACK_PERM TSval=2372292043 TSecr=764789014 WS=512"
"30","0.196526","100.86.235.39","151.101.1.140","TCP","54","56261  >  443 [RST] Seq=1907 Win=0 Len=0"
"31","0.196553","100.86.235.39","151.101.1.140","TCP","54","56263  >  443 [RST] Seq=1 Win=0 Len=0"
"32","0.199757","100.86.235.39","151.101.1.140","TCP","78","56265  >  443 [SYN, ECE, CWR] Seq=0 Win=65535 Len=0 MSS=1460 WS=64 TSval=115107084 TSecr=0 SACK_PERM"
"33","0.203450","151.101.1.140","100.86.235.39","TCP","74","443  >  56264 [SYN, ACK] Seq=0 Ack=1 Win=65535 Len=0 MSS=1460 SACK_PERM TSval=359660157 TSecr=277490933 WS=512"
"34","0.203507","100.86.235.39","151.101.1.140","TCP","54","56264  >  443 [RST] Seq=1 Win=0 Len=0"
"35","0.203973","100.86.235.39","151.101.1.140","TCP","78","56266  >  443 [SYN, ECE, CWR] Seq=0 Win=65535 Len=0 MSS=1460 WS=64 TSval=3178706379 TSecr=0 SACK_PERM"
"36","0.210147","100.86.235.39","151.101.1.140","TCP","78","56267  >  443 [SYN, ECE, CWR] Seq=0 Win=65535 Len=0 MSS=1460 WS=64 TSval=827781490 TSecr=0 SACK_PERM"
"37","0.212489","151.101.1.140","100.86.235.39","TCP","74","443  >  56265 [SYN, ACK] Seq=0 Ack=1 Win=65535 Len=0 MSS=1460 SACK_PERM TSval=1864496344 TSecr=115107084 WS=512"
"38","0.212544","100.86.235.39","151.101.1.140","TCP","54","56265  >  443 [RST] Seq=1 Win=0 Len=0"
"39","0.217052","151.101.1.140","100.86.235.39","TCP","74","443  >  56266 [SYN, ACK] Seq=0 Ack=1 Win=65535 Len=0 MSS=1460 SACK_PERM TSval=1315031123 TSecr=3178706379 WS=512"
"40","0.217111","100.86.235.39","151.101.1.140","TCP","54","56266  >  443 [RST] Seq=1 Win=0 Len=0"
"41","0.227272","151.101.1.140","100.86.235.39","TCP","74","443  >  56267 [SYN, ACK] Seq=0 Ack=1 Win=65535 Len=0 MSS=1460 SACK_PERM TSval=3035348898 TSecr=827781490 WS=512"
"42","0.227408","100.86.235.39","151.101.1.140","TCP","66","56267  >  443 [ACK] Seq=1 Ack=1 Win=131712 Len=0 TSval=827781507 TSecr=3035348898"
"43","0.228548","100.86.235.39","151.101.1.140","TCP","1514","56267  >  443 [ACK] Seq=1 Ack=1 Win=131712 Len=1448 TSval=827781508 TSecr=3035348898 [TCP PDU reassembled in 44]"
"44","0.228593","100.86.235.39","151.101.1.140","TLSv1.3","966","Client Hello (SNI=www.redditstatic.com)"
"45","0.238166","100.86.235.39","151.101.65.140","TLSv1.2","546","Application Data"
"46","0.238238","151.101.1.140","100.86.235.39","TCP","66","443  >  56267 [ACK] Seq=1 Ack=2349 Win=149504 Len=0 TSval=3035348914 TSecr=827781508"
"47","0.238653","151.101.1.140","100.86.235.39","TLSv1.3","519","Server Hello, Change Cipher Spec, Application Data, Application Data, Application Data"
"48","0.238699","100.86.235.39","151.101.1.140","TCP","66","56267  >  443 [ACK] Seq=2349 Ack=454 Win=131264 Len=0 TSval=827781518 TSecr=3035348914"
"49","0.239271","100.86.235.39","151.101.1.140","TLSv1.3","130","Change Cipher Spec, Application Data"
"50","0.240159","100.86.235.39","151.101.1.140","TLSv1.3","158","Application Data"
"51","0.240211","100.86.235.39","151.101.1.140","TLSv1.3","434","Application Data"
"52","0.240411","100.86.235.39","151.101.1.140","TLSv1.3","167","Application Data"
"53","0.242552","100.86.235.39","151.101.1.140","TLSv1.3","260","Application Data"
"54","0.242785","100.86.235.39","151.101.1.140","TLSv1.3","101","Application Data"
"55","0.245869","100.86.235.39","151.101.65.140","TCP","78","56268  >  443 [SYN, ECE, CWR] Seq=0 Win=65535 Len=0 MSS=1460 WS=64 TSval=164806128 TSecr=0 SACK_PERM"
"56","0.247252","100.86.235.39","151.101.1.140","TLSv1.3","167","Application Data"
"57","0.248608","151.101.65.140","100.86.235.39","TCP","66","443  >  56257 [ACK] Seq=2312 Ack=4167 Win=382 Len=0 TSval=653860083 TSecr=1601722511"
"58","0.248609","151.101.1.140","100.86.235.39","TCP","66","443  >  56267 [ACK] Seq=454 Ack=2413 Win=149504 Len=0 TSval=3035348924 TSecr=827781519"
"59","0.250407","151.101.1.140","100.86.235.39","TCP","66","443  >  56267 [ACK] Seq=454 Ack=2974 Win=152576 Len=0 TSval=3035348926 TSecr=827781520"
"60","0.250434","151.101.1.140","100.86.235.39","TLSv1.3","131","Application Data"
"61","0.250489","100.86.235.39","151.101.1.140","TCP","66","56267  >  443 [ACK] Seq=3304 Ack=519 Win=131200 Len=0 TSval=827781530 TSecr=3035348926"
"62","0.250645","100.86.235.39","151.101.1.140","TLSv1.3","97","Application Data"
"63","0.250927","151.101.1.140","100.86.235.39","TLSv1.3","1510","Application Data"
"64","0.250980","100.86.235.39","151.101.1.140","TCP","66","56267  >  443 [ACK] Seq=3335 Ack=1963 Win=129792 Len=0 TSval=827781530 TSecr=3035348927"
"65","0.251116","151.101.1.140","100.86.235.39","TLSv1.3","1510","Application Data"
"66","0.251117","151.101.1.140","100.86.235.39","TLSv1.3","1510","Application Data"
"67","0.251174","100.86.235.39","151.101.1.140","TCP","66","56267  >  443 [ACK] Seq=3335 Ack=4851 Win=128128 Len=0 TSval=827781530 TSecr=3035348927"
"68","0.251235","100.86.235.39","151.101.1.140","TCP","66","[TCP Window Update] 56267  >  443 [ACK] Seq=3335 Ack=4851 Win=131072 Len=0 TSval=827781530 TSecr=3035348927"
"69","0.252856","151.101.1.140","100.86.235.39","TLSv1.3","1510","Application Data"
"70","0.252858","151.101.1.140","100.86.235.39","TLSv1.3","1510","Application Data"
"71","0.252858","151.101.1.140","100.86.235.39","TLSv1.3","1510","Application Data"
"72","0.252859","151.101.1.140","100.86.235.39","TLSv1.3","1510","Application Data"
"73","0.252861","151.101.1.140","100.86.235.39","TLSv1.3","1510","Application Data"
"74","0.252862","151.101.1.140","100.86.235.39","TLSv1.3","1510","Application Data"
"75","0.252863","151.101.1.140","100.86.235.39","TLSv1.3","1510","Application Data"
"76","0.252863","151.101.1.140","100.86.235.39","TLSv1.3","1510","Application Data"
"77","0.252937","100.86.235.39","151.101.1.140","TCP","66","56267  >  443 [ACK] Seq=3335 Ack=16403 Win=119488 Len=0 TSval=827781533 TSecr=3035348927"
"78","0.253079","100.86.235.39","151.101.1.140","TCP","66","[TCP Window Update] 56267  >  443 [ACK] Seq=3335 Ack=16403 Win=131072 Len=0 TSval=827781533 TSecr=3035348927"
"79","0.253343","151.101.1.140","100.86.235.39","TLSv1.3","1510","Application Data"
"80","0.253344","151.101.1.140","100.86.235.39","TLSv1.3","1510","Application Data"
"81","0.253404","100.86.235.39","151.101.1.140","TCP","66","56267  >  443 [ACK] Seq=3335 Ack=19291 Win=128128 Len=0 TSval=827781533 TSecr=3035348928"
"82","0.253795","151.101.1.140","100.86.235.39","TLSv1.3","1510","Application Data"
"83","0.253796","151.101.1.140","100.86.235.39","TLSv1.3","1510","Application Data"
"84","0.253857","100.86.235.39","151.101.1.140","TCP","66","56267  >  443 [ACK] Seq=3335 Ack=22179 Win=128128 Len=0 TSval=827781533 TSecr=3035348928"
"85","0.253974","151.101.1.140","100.86.235.39","TLSv1.3","1510","Application Data"
"86","0.253975","151.101.1.140","100.86.235.39","TLSv1.3","1510","Application Data"
"87","0.254015","100.86.235.39","151.101.1.140","TCP","66","56267  >  443 [ACK] Seq=3335 Ack=25067 Win=128128 Len=0 TSval=827781534 TSecr=3035348929"
"88","0.255242","151.101.1.140","100.86.235.39","TLSv1.3","1510","Application Data"
"89","0.255243","151.101.1.140","100.86.235.39","TLSv1.3","1510","Application Data"
"90","0.255244","151.101.1.140","100.86.235.39","TLSv1.3","1510","Application Data"
"91","0.255314","100.86.235.39","151.101.1.140","TCP","66","56267  >  443 [ACK] Seq=3335 Ack=29399 Win=126720 Len=0 TSval=827781535 TSecr=3035348930"
"92","0.255463","100.86.235.39","151.101.1.140","TCP","66","[TCP Window Update] 56267  >  443 [ACK] Seq=3335 Ack=29399 Win=131072 Len=0 TSval=827781535 TSecr=3035348930"
"93","0.255862","151.101.1.140","100.86.235.39","TLSv1.3","1510","Application Data, Application Data"
"94","0.255863","151.101.1.140","100.86.235.39","TLSv1.3","1510","Application Data"
"95","0.255920","100.86.235.39","151.101.1.140","TCP","66","56267  >  443 [ACK] Seq=3335 Ack=30843 Win=129600 Len=0 TSval=827781535 TSecr=3035348930"
"96","0.255960","100.86.235.39","151.101.1.140","TCP","66","56267  >  443 [ACK] Seq=3335 Ack=32287 Win=128128 Len=0 TSval=827781535 TSecr=3035348930"
"97","0.257302","151.101.1.140","100.86.235.39","TLSv1.3","1510","Application Data"
"98","0.257304","151.101.1.140","100.86.235.39","TLSv1.3","1510","Application Data"
"99","0.257305","151.101.1.140","100.86.235.39","TLSv1.3","1510","Application Data"
"100","0.257306","151.101.1.140","100.86.235.39","TLSv1.3","1510","Application Data"
"101","0.257307","151.101.1.140","100.86.235.39","TLSv1.3","1510","Application Data"
"102","0.257307","151.101.1.140","100.86.235.39","TLSv1.3","1510","Application Data"
"103","0.257308","151.101.1.140","100.86.235.39","TLSv1.3","1510","Application Data"
"104","0.257381","100.86.235.39","151.101.1.140","TCP","66","56267  >  443 [ACK] Seq=3335 Ack=42395 Win=120960 Len=0 TSval=827781537 TSecr=3035348932"
"105","0.257554","100.86.235.39","151.101.1.140","TCP","66","[TCP Window Update] 56267  >  443 [ACK] Seq=3335 Ack=42395 Win=131072 Len=0 TSval=827781537 TSecr=3035348932"
"106","0.258540","151.101.1.140","100.86.235.39","TCP","66","443  >  56267 [ACK] Seq=42395 Ack=3304 Win=155648 Len=0 TSval=3035348934 TSecr=827781527"
"107","0.258541","151.101.65.140","100.86.235.39","TCP","74","443  >  56268 [SYN, ACK] Seq=0 Ack=1 Win=65535 Len=0 MSS=1460 SACK_PERM TSval=966799824 TSecr=164806128 WS=512"
"108","0.258668","100.86.235.39","151.101.65.140","TCP","66","56268  >  443 [ACK] Seq=1 Ack=1 Win=131712 Len=0 TSval=164806141 TSecr=966799824"
"109","0.259410","100.86.235.39","151.101.65.140","TCP","1514","56268  >  443 [ACK] Seq=1 Ack=1 Win=131712 Len=1448 TSval=164806141 TSecr=966799824 [TCP PDU reassembled in 110]"
"110","0.259435","100.86.235.39","151.101.65.140","TLSv1.3","968","Client Hello (SNI=styles.redditmedia.com)"
"111","0.261169","100.86.235.39","151.101.65.140","TCP","66","56268  >  443 [FIN, ACK] Seq=2351 Ack=1 Win=131712 Len=0 TSval=164806144 TSecr=966799824"
"112","0.261428","151.101.1.140","100.86.235.39","TLSv1.3","1510","Application Data"
"113","0.261429","151.101.1.140","100.86.235.39","TLSv1.3","1510","Application Data"
"114","0.261484","100.86.235.39","151.101.1.140","TCP","66","56267  >  443 [ACK] Seq=3335 Ack=45283 Win=175936 Len=0 TSval=827781541 TSecr=3035348937"
"115","0.261704","151.101.1.140","100.86.235.39","TLSv1.3","1510","Application Data, Application Data"
"116","0.261705","151.101.1.140","100.86.235.39","TLSv1.3","1510","Application Data, Application Data"
"117","0.261753","100.86.235.39","151.101.1.140","TCP","66","56267  >  443 [ACK] Seq=3335 Ack=48171 Win=175936 Len=0 TSval=827781541 TSecr=3035348937"
"118","0.261990","151.101.1.140","100.86.235.39","TLSv1.3","133","Application Data"
"119","0.262036","100.86.235.39","151.101.1.140","TCP","66","56267  >  443 [ACK] Seq=3335 Ack=48238 Win=177856 Len=0 TSval=827781541 TSecr=3035348937"
"120","0.269361","151.101.65.140","100.86.235.39","TCP","66","443  >  56268 [ACK] Seq=1 Ack=2351 Win=149504 Len=0 TSval=966799836 TSecr=164806141"
"121","0.269915","151.101.65.140","100.86.235.39","TLSv1.3","1510","Server Hello, Change Cipher Spec, Application Data, Application Data"
"122","0.269994","100.86.235.39","151.101.65.140","TCP","54","56268  >  443 [RST] Seq=2351 Win=0 Len=0"
"123","0.270394","151.101.65.140","100.86.235.39","TLSv1.3","163","Application Data"
"124","0.270436","100.86.235.39","151.101.65.140","TCP","54","56268  >  443 [RST] Seq=2351 Win=0 Len=0"
"125","0.275097","151.101.65.140","100.86.235.39","TCP","1510","443  >  56257 [ACK] Seq=2312 Ack=4167 Win=382 Len=1444 TSval=653860109 TSecr=1601722511 [TCP PDU reassembled in 127]"
"126","0.275167","100.86.235.39","151.101.65.140","TCP","66","56257  >  443 [ACK] Seq=4167 Ack=3756 Win=2523 Len=0 TSval=1601722548 TSecr=653860109"
"127","0.275496","151.101.65.140","100.86.235.39","TLSv1.2","230","Application Data"
"128","0.275542","100.86.235.39","151.101.65.140","TCP","66","56257  >  443 [ACK] Seq=4167 Ack=3920 Win=2543 Len=0 TSval=1601722548 TSecr=653860109"
"129","0.288439","100.86.235.39","151.101.65.140","TCP","1514","56257  >  443 [ACK] Seq=4167 Ack=3920 Win=2545 Len=1448 TSval=1601722561 TSecr=653860109 [TCP PDU reassembled in 130]"
"130","0.288477","100.86.235.39","151.101.65.140","TLSv1.2","1077","Application Data"
"131","0.298641","151.101.65.140","100.86.235.39","TCP","66","443  >  56257 [ACK] Seq=3920 Ack=6626 Win=394 Len=0 TSval=653860133 TSecr=1601722561"
"132","0.310083","100.86.235.39","151.101.1.140","TLSv1.3","177","Application Data"
"133","0.310463","100.86.235.39","151.101.1.140","TLSv1.3","175","Application Data"
"134","0.311828","100.86.235.39","151.101.1.140","TLSv1.3","178","Application Data"
"135","0.319927","151.101.1.140","100.86.235.39","TCP","66","443  >  56267 [ACK] Seq=48238 Ack=3446 Win=155648 Len=0 TSval=3035348995 TSecr=827781590"
"136","0.320635","151.101.1.140","100.86.235.39","TLSv1.3","522","Application Data"
"137","0.320715","100.86.235.39","151.101.1.140","TCP","66","56267  >  443 [ACK] Seq=3667 Ack=48694 Win=178368 Len=0 TSval=827781600 TSecr=3035348996"
"138","0.320865","151.101.1.140","100.86.235.39","TLSv1.3","168","Application Data"
"139","0.320865","151.101.1.140","100.86.235.39","TLSv1.3","313","Application Data"
"140","0.320920","100.86.235.39","151.101.1.140","TCP","66","56267  >  443 [ACK] Seq=3667 Ack=49043 Win=178496 Len=0 TSval=827781600 TSecr=3035348997"
"141","0.321335","151.101.1.140","100.86.235.39","TCP","66","443  >  56267 [ACK] Seq=49043 Ack=3667 Win=155648 Len=0 TSval=3035348997 TSecr=827781592"
"142","0.322521","151.101.1.140","100.86.235.39","TLSv1.3","147","Application Data"
"143","0.322522","151.101.1.140","100.86.235.39","TLSv1.3","459","Application Data"
"144","0.322821","100.86.235.39","151.101.1.140","TCP","66","56267  >  443 [ACK] Seq=3667 Ack=49517 Win=178816 Len=0 TSval=827781602 TSecr=3035348998"
"145","0.324989","151.101.65.140","100.86.235.39","TCP","1510","443  >  56257 [ACK] Seq=3920 Ack=6626 Win=394 Len=1444 TSval=653860159 TSecr=1601722561 [TCP PDU reassembled in 146]"
"146","0.325022","151.101.65.140","100.86.235.39","TLSv1.2","998","Application Data"
"147","0.325023","151.101.65.140","100.86.235.39","TLSv1.2","112","Application Data"
"148","0.325066","100.86.235.39","151.101.65.140","TCP","66","56257  >  443 [ACK] Seq=6626 Ack=5364 Win=2523 Len=0 TSval=1601722598 TSecr=653860159"
"149","0.325199","100.86.235.39","151.101.65.140","TCP","66","56257  >  443 [ACK] Seq=6626 Ack=6342 Win=2530 Len=0 TSval=1601722598 TSecr=653860159"
"150","0.328196","100.86.235.39","151.101.65.140","TLSv1.2","486","Application Data"
"151","0.328587","100.86.235.39","151.101.65.140","TCP","1514","56257  >  443 [ACK] Seq=7046 Ack=6342 Win=2545 Len=1448 TSval=1601722601 TSecr=653860159 [TCP PDU reassembled in 152]"
"152","0.328608","100.86.235.39","151.101.65.140","TLSv1.2","1107","Application Data"
"153","0.328770","100.86.235.39","151.101.65.140","TLSv1.2","478","Application Data"
"154","0.329118","100.86.235.39","151.101.65.140","TCP","1514","56257  >  443 [ACK] Seq=9947 Ack=6342 Win=2545 Len=1448 TSval=1601722601 TSecr=653860159 [TCP PDU reassembled in 155]"
"155","0.329138","100.86.235.39","151.101.65.140","TLSv1.2","1113","Application Data"
"156","0.329295","100.86.235.39","151.101.65.140","TLSv1.2","486","Application Data"
"157","0.329578","100.86.235.39","151.101.65.140","TCP","1514","56257  >  443 [ACK] Seq=12862 Ack=6342 Win=2545 Len=1448 TSval=1601722602 TSecr=653860159 [TCP PDU reassembled in 158]"
"158","0.329595","100.86.235.39","151.101.65.140","TLSv1.2","1096","Application Data"
"159","0.330153","100.86.235.39","151.101.65.140","TLSv1.2","486","Application Data"
"160","0.330433","100.86.235.39","151.101.65.140","TCP","1514","56257  >  443 [ACK] Seq=15760 Ack=6342 Win=2545 Len=1448 TSval=1601722603 TSecr=653860159 [TCP PDU reassembled in 161]"
"161","0.330450","100.86.235.39","151.101.65.140","TLSv1.2","1095","Application Data"
"162","0.330580","100.86.235.39","151.101.65.140","TLSv1.2","489","Application Data"
"163","0.337751","151.101.65.140","100.86.235.39","TCP","66","443  >  56257 [ACK] Seq=6342 Ack=7046 Win=399 Len=0 TSval=653860172 TSecr=1601722601"
"164","0.339104","151.101.65.140","100.86.235.39","TCP","66","443  >  56257 [ACK] Seq=6342 Ack=9947 Win=416 Len=0 TSval=653860173 TSecr=1601722601"
"165","0.339105","151.101.65.140","100.86.235.39","TCP","66","443  >  56257 [ACK] Seq=6342 Ack=12442 Win=420 Len=0 TSval=653860173 TSecr=1601722601"
"166","0.339495","151.101.65.140","100.86.235.39","TCP","66","443  >  56257 [ACK] Seq=6342 Ack=12862 Win=420 Len=0 TSval=653860174 TSecr=1601722602"
"167","0.340532","151.101.65.140","100.86.235.39","TCP","66","443  >  56257 [ACK] Seq=6342 Ack=14310 Win=424 Len=0 TSval=653860174 TSecr=1601722602"
"168","0.340533","151.101.65.140","100.86.235.39","TCP","66","443  >  56257 [ACK] Seq=6342 Ack=18660 Win=424 Len=0 TSval=653860175 TSecr=1601722603"
"169","0.362807","151.101.65.140","100.86.235.39","TCP","1510","443  >  56257 [ACK] Seq=6342 Ack=18660 Win=424 Len=1444 TSval=653860196 TSecr=1601722603 [TCP PDU reassembled in 170]"
"170","0.362853","151.101.65.140","100.86.235.39","TLSv1.2","250","Application Data"
"171","0.362853","151.101.65.140","100.86.235.39","TLSv1.2","112","Application Data"
"172","0.362906","100.86.235.39","151.101.65.140","TCP","66","56257  >  443 [ACK] Seq=18660 Ack=7786 Win=2523 Len=0 TSval=1601722636 TSecr=653860196"
"173","0.362994","100.86.235.39","151.101.65.140","TCP","66","56257  >  443 [ACK] Seq=18660 Ack=8016 Win=2519 Len=0 TSval=1601722636 TSecr=653860196"
"174","0.363492","151.101.65.140","100.86.235.39","TCP","1510","443  >  56257 [ACK] Seq=8016 Ack=18660 Win=424 Len=1444 TSval=653860197 TSecr=1601722603 [TCP PDU reassembled in 176]"
"175","0.363550","100.86.235.39","151.101.65.140","TCP","66","56257  >  443 [ACK] Seq=18660 Ack=9460 Win=2523 Len=0 TSval=1601722636 TSecr=653860197"
"176","0.363797","151.101.65.140","100.86.235.39","TLSv1.2","971","Application Data"
"177","0.363845","100.86.235.39","151.101.65.140","TCP","66","56257  >  443 [ACK] Seq=18660 Ack=10365 Win=2531 Len=0 TSval=1601722636 TSecr=653860197"
"178","0.367002","151.101.65.140","100.86.235.39","TCP","1510","443  >  56257 [ACK] Seq=10365 Ack=18660 Win=424 Len=1444 TSval=653860201 TSecr=1601722603 [TCP PDU reassembled in 180]"
"179","0.367069","100.86.235.39","151.101.65.140","TCP","66","56257  >  443 [ACK] Seq=18660 Ack=11809 Win=2523 Len=0 TSval=1601722640 TSecr=653860201"
"180","0.367128","151.101.65.140","100.86.235.39","TLSv1.2","276","Application Data"
"181","0.367173","100.86.235.39","151.101.65.140","TCP","66","56257  >  443 [ACK] Seq=18660 Ack=12019 Win=2542 Len=0 TSval=1601722640 TSecr=653860201"
"182","0.368968","151.101.65.140","100.86.235.39","TCP","1510","443  >  56257 [ACK] Seq=12019 Ack=18660 Win=424 Len=1444 TSval=653860203 TSecr=1601722603 [TCP PDU reassembled in 184]"
"183","0.369036","100.86.235.39","151.101.65.140","TCP","66","56257  >  443 [ACK] Seq=18660 Ack=13463 Win=2523 Len=0 TSval=1601722642 TSecr=653860203"
"184","0.369288","151.101.65.140","100.86.235.39","TLSv1.2","968","Application Data"
"185","0.369289","151.101.65.140","100.86.235.39","TCP","1510","443  >  56257 [ACK] Seq=14365 Ack=18660 Win=424 Len=1444 TSval=653860203 TSecr=1601722603 [TCP PDU reassembled in 186]"
"186","0.369291","151.101.65.140","100.86.235.39","TLSv1.2","254","Application Data"
"187","0.369292","151.101.65.140","100.86.235.39","TCP","1510","443  >  56257 [ACK] Seq=15997 Ack=18660 Win=424 Len=1444 TSval=653860203 TSecr=1601722603 [TCP PDU reassembled in 189]"
"188","0.369347","100.86.235.39","151.101.65.140","TCP","66","56257  >  443 [ACK] Seq=18660 Ack=17441 Win=2483 Len=0 TSval=1601722642 TSecr=653860203"
"189","0.369594","151.101.65.140","100.86.235.39","TLSv1.2","992","Application Data"
"190","0.369640","100.86.235.39","151.101.65.140","TCP","66","56257  >  443 [ACK] Seq=18660 Ack=18367 Win=2483 Len=0 TSval=1601722642 TSecr=653860203"
"191","0.369801","100.86.235.39","151.101.65.140","TCP","66","[TCP Window Update] 56257  >  443 [ACK] Seq=18660 Ack=18367 Win=2545 Len=0 TSval=1601722642 TSecr=653860203"
"192","0.370266","151.101.65.140","100.86.235.39","TCP","1510","443  >  56257 [ACK] Seq=18367 Ack=18660 Win=424 Len=1444 TSval=653860204 TSecr=1601722603 [TCP PDU reassembled in 193]"
"193","0.370267","151.101.65.140","100.86.235.39","TLSv1.2","376","Application Data"
"194","0.370317","100.86.235.39","151.101.65.140","TCP","66","56257  >  443 [ACK] Seq=18660 Ack=20121 Win=2518 Len=0 TSval=1601722643 TSecr=653860204"
"195","0.371488","151.101.65.140","100.86.235.39","TLSv1.2","97","Application Data"
"196","0.371568","100.86.235.39","151.101.65.140","TCP","66","56257  >  443 [ACK] Seq=18660 Ack=20152 Win=2545 Len=0 TSval=1601722644 TSecr=653860204"
"197","0.375708","151.101.65.140","100.86.235.39","TCP","1510","443  >  56257 [ACK] Seq=20152 Ack=18660 Win=424 Len=1444 TSval=653860209 TSecr=1601722636 [TCP PDU reassembled in 198]"
"198","0.376443","151.101.65.140","100.86.235.39","TLSv1.2","955","Application Data"
"199","0.376511","100.86.235.39","151.101.65.140","TCP","66","56257  >  443 [ACK] Seq=18660 Ack=22485 Win=2531 Len=0 TSval=1601722648 TSecr=653860209"
"200","0.385913","151.101.65.140","100.86.235.39","TCP","1510","443  >  56257 [ACK] Seq=22485 Ack=18660 Win=424 Len=1444 TSval=653860219 TSecr=1601722644 [TCP PDU reassembled in 201]"
"201","0.386566","151.101.65.140","100.86.235.39","TLSv1.2","296","Application Data"
"202","0.386617","100.86.235.39","151.101.65.140","TCP","66","56257  >  443 [ACK] Seq=18660 Ack=24159 Win=2542 Len=0 TSval=1601722659 TSecr=653860219"
"203","0.399186","100.86.235.39","151.101.65.140","TLSv1.2","224","Application Data"
"204","0.410187","151.101.65.140","100.86.235.39","TCP","66","443  >  56257 [ACK] Seq=24159 Ack=18818 Win=424 Len=0 TSval=653860244 TSecr=1601722672"
"205","0.411237","151.101.65.140","100.86.235.39","TLSv1.2","107","Application Data"
"206","0.411335","100.86.235.39","151.101.65.140","TCP","66","56257  >  443 [ACK] Seq=18818 Ack=24200 Win=2545 Len=0 TSval=1601722684 TSecr=653860246"
"207","0.415985","151.101.65.140","100.86.235.39","TLSv1.2","316","Application Data"
"208","0.416007","151.101.65.140","100.86.235.39","TLSv1.2","959","Application Data"
"209","0.416123","100.86.235.39","151.101.65.140","TCP","66","56257  >  443 [ACK] Seq=18818 Ack=25343 Win=2545 Len=0 TSval=1601722689 TSecr=653860250"
"210","0.416678","151.101.65.140","100.86.235.39","TLSv1.2","437","Application Data"
"211","0.416679","151.101.65.140","100.86.235.39","TLSv1.2","97","Application Data"
"212","0.416802","100.86.235.39","151.101.65.140","TCP","66","56257  >  443 [ACK] Seq=18818 Ack=25745 Win=2545 Len=0 TSval=1601722689 TSecr=653860250"
"213","0.427971","151.101.65.140","100.86.235.39","TLSv1.2","107","Application Data"
"214","0.428081","100.86.235.39","151.101.65.140","TCP","66","56257  >  443 [ACK] Seq=18818 Ack=25786 Win=2545 Len=0 TSval=1601722701 TSecr=653860262"
"215","0.437305","151.101.65.140","100.86.235.39","TLSv1.2","1510","Application Data"
"216","0.437396","100.86.235.39","151.101.65.140","TCP","66","56257  >  443 [ACK] Seq=18818 Ack=27230 Win=2545 Len=0 TSval=1601722709 TSecr=653860272"
"217","0.437738","151.101.65.140","100.86.235.39","TLSv1.2","961","Application Data"
"218","0.437813","100.86.235.39","151.101.65.140","TCP","66","56257  >  443 [ACK] Seq=18818 Ack=28125 Win=2545 Len=0 TSval=1601722710 TSecr=653860272"
"219","0.440057","151.101.65.140","100.86.235.39","TLSv1.2","107","Application Data"
"220","0.440153","100.86.235.39","151.101.65.140","TCP","66","56257  >  443 [ACK] Seq=18818 Ack=28166 Win=2545 Len=0 TSval=1601722713 TSecr=653860274"
"221","0.443160","100.86.235.39","151.101.65.140","TCP","1514","56257  >  443 [ACK] Seq=18818 Ack=28166 Win=2545 Len=1448 TSval=1601722716 TSecr=653860274 [TCP PDU reassembled in 222]"
"222","0.443196","100.86.235.39","151.101.65.140","TLSv1.2","1239","Application Data"
"223","0.443248","100.86.235.39","151.101.65.140","TLSv1.2","222","Application Data"
"224","0.444187","151.101.65.140","100.86.235.39","TLSv1.2","945","Application Data"
"225","0.444277","100.86.235.39","151.101.65.140","TCP","66","56257  >  443 [ACK] Seq=21595 Ack=29045 Win=2545 Len=0 TSval=1601722717 TSecr=653860279"
"226","0.444731","151.101.65.140","100.86.235.39","TLSv1.2","1435","Application Data"
"227","0.444732","151.101.65.140","100.86.235.39","TLSv1.2","200","Application Data"
"228","0.444732","151.101.65.140","100.86.235.39","TLSv1.2","146","Application Data"
"229","0.444800","100.86.235.39","151.101.65.140","TCP","66","56257  >  443 [ACK] Seq=21595 Ack=30628 Win=2521 Len=0 TSval=1601722717 TSecr=653860279"
"230","0.444846","151.101.65.140","100.86.235.39","TLSv1.2","97","Application Data"
"231","0.444847","151.101.65.140","100.86.235.39","TCP","1510","443  >  56257 [ACK] Seq=30659 Ack=18818 Win=424 Len=1444 TSval=653860279 TSecr=1601722701 [TCP PDU reassembled in 233]"
"232","0.444895","100.86.235.39","151.101.65.140","TCP","66","56257  >  443 [ACK] Seq=21595 Ack=32103 Win=2519 Len=0 TSval=1601722717 TSecr=653860279"
"233","0.445993","151.101.65.140","100.86.235.39","TLSv1.2","928","Application Data"
"234","0.446572","100.86.235.39","151.101.65.140","TCP","66","56257  >  443 [ACK] Seq=21595 Ack=32965 Win=2532 Len=0 TSval=1601722719 TSecr=653860279"
"235","0.454523","151.101.65.140","100.86.235.39","TCP","66","443  >  56257 [ACK] Seq=32965 Ack=21595 Win=424 Len=0 TSval=653860289 TSecr=1601722717"
"236","0.467137","100.86.235.39","151.101.1.140","TLSv1.3","168","Application Data"
"237","0.468009","151.101.65.140","100.86.235.39","TLSv1.2","825","Application Data"
"238","0.468077","100.86.235.39","151.101.65.140","TCP","66","56257  >  443 [ACK] Seq=21595 Ack=33724 Win=2533 Len=0 TSval=1601722740 TSecr=653860302"
"239","0.473994","100.86.235.39","151.101.1.140","TLSv1.3","101","Application Data"
"240","0.477716","151.101.1.140","100.86.235.39","TLSv1.3","1510","Application Data"
"241","0.477785","100.86.235.39","151.101.1.140","TCP","66","56267  >  443 [ACK] Seq=3804 Ack=50961 Win=177408 Len=0 TSval=827781757 TSecr=3035349153"
"242","0.477951","151.101.1.140","100.86.235.39","TLSv1.3","537","Application Data"
"243","0.478005","100.86.235.39","151.101.1.140","TCP","66","56267  >  443 [ACK] Seq=3804 Ack=51432 Win=178368 Len=0 TSval=827781757 TSecr=3035349153"
"244","0.484363","151.101.1.140","100.86.235.39","TCP","66","443  >  56267 [ACK] Seq=51432 Ack=3804 Win=155648 Len=0 TSval=3035349160 TSecr=827781754"
"245","0.519367","151.101.65.140","100.86.235.39","TCP","1510","443  >  56257 [ACK] Seq=33724 Ack=21595 Win=424 Len=1444 TSval=653860353 TSecr=1601722740 [TCP PDU reassembled in 246]"
"246","0.519401","151.101.65.140","100.86.235.39","TLSv1.2","373","Application Data"
"247","0.519462","100.86.235.39","151.101.65.140","TCP","66","56257  >  443 [ACK] Seq=21595 Ack=35475 Win=2518 Len=0 TSval=1601722792 TSecr=653860353"
"248","0.543344","151.101.65.140","100.86.235.39","TLSv1.2","438","Application Data"
"249","0.543395","100.86.235.39","151.101.65.140","TCP","66","56257  >  443 [ACK] Seq=21595 Ack=35847 Win=2539 Len=0 TSval=1601722815 TSecr=653860378"
"250","0.767166","151.101.65.140","100.86.235.39","TLSv1.2","1051","Application Data"
"251","0.767197","151.101.65.140","100.86.235.39","TLSv1.2","97","Application Data"
"252","0.768880","100.86.235.39","151.101.65.140","TCP","66","56257  >  443 [ACK] Seq=21595 Ack=36863 Win=2545 Len=0 TSval=1601723042 TSecr=653860601"
"253","0.912395","100.86.235.39","151.101.65.140","TLSv1.2","515","Application Data"
"254","0.912481","100.86.235.39","151.101.65.140","TLSv1.2","274","Application Data"
"255","0.922651","151.101.65.140","100.86.235.39","TCP","66","443  >  56257 [ACK] Seq=36863 Ack=22252 Win=424 Len=0 TSval=653860756 TSecr=1601723185"
"256","0.938188","100.86.235.39","151.101.65.140","TCP","1514","56257  >  443 [ACK] Seq=22252 Ack=36863 Win=2545 Len=1448 TSval=1601723211 TSecr=653860756 [TCP PDU reassembled in 257]"
"257","0.938223","100.86.235.39","151.101.65.140","TLSv1.2","1155","Application Data"
"258","0.940541","100.86.235.39","151.101.65.140","TLSv1.2","560","Application Data"
"259","0.940635","100.86.235.39","151.101.65.140","TLSv1.2","146","Application Data"
"260","0.948085","151.101.65.140","100.86.235.39","TCP","66","443  >  56257 [ACK] Seq=36863 Ack=24789 Win=420 Len=0 TSval=653860782 TSecr=1601723211"
"261","0.950437","151.101.65.140","100.86.235.39","TCP","66","443  >  56257 [ACK] Seq=36863 Ack=25283 Win=430 Len=0 TSval=653860784 TSecr=1601723213"
"262","0.951076","151.101.65.140","100.86.235.39","TCP","66","443  >  56257 [ACK] Seq=36863 Ack=25363 Win=430 Len=0 TSval=653860785 TSecr=1601723213"
"263","0.970161","151.101.65.140","100.86.235.39","TCP","1510","443  >  56257 [ACK] Seq=36863 Ack=25363 Win=430 Len=1444 TSval=653860804 TSecr=1601723213 [TCP PDU reassembled in 264]"
"264","0.970882","151.101.65.140","100.86.235.39","TLSv1.2","892","Application Data"
"265","0.970883","151.101.65.140","100.86.235.39","TLSv1.2","1122","Application Data"
"266","0.970944","100.86.235.39","151.101.65.140","TCP","66","56257  >  443 [ACK] Seq=25363 Ack=40189 Win=2516 Len=0 TSval=1601723243 TSecr=653860804"
"267","0.979359","151.101.65.140","100.86.235.39","TCP","1510","443  >  56257 [ACK] Seq=40189 Ack=25363 Win=430 Len=1444 TSval=653860814 TSecr=1601723213 [TCP PDU reassembled in 268]"
"268","0.979395","151.101.65.140","100.86.235.39","TLSv1.2","516","Application Data"
"269","0.979428","100.86.235.39","151.101.65.140","TCP","66","56257  >  443 [ACK] Seq=25363 Ack=41633 Win=2523 Len=0 TSval=1601723252 TSecr=653860814"
"270","0.979511","100.86.235.39","151.101.65.140","TCP","66","56257  >  443 [ACK] Seq=25363 Ack=42083 Win=2545 Len=0 TSval=1601723252 TSecr=653860814"
"271","0.987598","151.101.65.140","100.86.235.39","TCP","1510","443  >  56257 [ACK] Seq=42083 Ack=25363 Win=430 Len=1444 TSval=653860822 TSecr=1601723243 [TCP PDU reassembled in 272]"
"272","0.987626","151.101.65.140","100.86.235.39","TLSv1.2","1075","Application Data"
"273","0.987684","100.86.235.39","151.101.65.140","TCP","66","56257  >  443 [ACK] Seq=25363 Ack=44536 Win=2507 Len=0 TSval=1601723260 TSecr=653860822"
"274","1.849790","151.101.65.140","100.86.235.39","TLSv1.2","150","Application Data"
"275","1.849860","100.86.235.39","151.101.65.140","TCP","66","56257  >  443 [ACK] Seq=25363 Ack=44620 Win=2544 Len=0 TSval=1601724123 TSecr=653861684"
"276","1.856138","151.101.65.140","100.86.235.39","TLSv1.2","258","Application Data"
"277","1.856231","100.86.235.39","151.101.65.140","TCP","66","56257  >  443 [ACK] Seq=25363 Ack=44812 Win=2545 Len=0 TSval=1601724129 TSecr=653861691"
"278","1.862931","151.101.65.140","100.86.235.39","TLSv1.2","148","Application Data"
"279","1.863032","100.86.235.39","151.101.65.140","TCP","66","56257  >  443 [ACK] Seq=25363 Ack=44894 Win=2545 Len=0 TSval=1601724136 TSecr=653861697"
"280","1.874601","151.101.65.140","100.86.235.39","TCP","1510","443  >  56257 [ACK] Seq=44894 Ack=25363 Win=430 Len=1444 TSval=653861709 TSecr=1601724136 [TCP PDU reassembled in 281]"
"281","1.874895","151.101.65.140","100.86.235.39","TLSv1.2","221","Application Data"
"282","1.874943","100.86.235.39","151.101.65.140","TCP","66","56257  >  443 [ACK] Seq=25363 Ack=46493 Win=2543 Len=0 TSval=1601724147 TSecr=653861709"
"283","1.877960","151.101.65.140","100.86.235.39","TCP","1510","443  >  56257 [ACK] Seq=46493 Ack=25363 Win=430 Len=1444 TSval=653861712 TSecr=1601724136 [TCP PDU reassembled in 285]"
"284","1.877961","151.101.65.140","100.86.235.39","TCP","1510","443  >  56257 [ACK] Seq=47937 Ack=25363 Win=430 Len=1444 TSval=653861712 TSecr=1601724136 [TCP PDU reassembled in 285]"
"285","1.877962","151.101.65.140","100.86.235.39","TLSv1.2","891","Application Data"
"286","1.878039","100.86.235.39","151.101.65.140","TCP","66","56257  >  443 [ACK] Seq=25363 Ack=50206 Win=2487 Len=0 TSval=1601724151 TSecr=653861712"
"287","1.878124","100.86.235.39","151.101.65.140","TCP","66","[TCP Window Update] 56257  >  443 [ACK] Seq=25363 Ack=50206 Win=2545 Len=0 TSval=1601724151 TSecr=653861712"
"288","1.878556","151.101.65.140","100.86.235.39","TLSv1.2","753","Application Data"
"289","1.878557","151.101.65.140","100.86.235.39","TLSv1.2","674","Application Data"
"290","1.878557","151.101.65.140","100.86.235.39","TLSv1.2","648","Application Data"
"291","1.878558","151.101.65.140","100.86.235.39","TLSv1.2","473","Application Data"
"292","1.878559","151.101.65.140","100.86.235.39","TLSv1.2","411","Application Data"
"293","1.878612","100.86.235.39","151.101.65.140","TCP","66","56257  >  443 [ACK] Seq=25363 Ack=52835 Win=2504 Len=0 TSval=1601724151 TSecr=653861713"
"294","1.879378","151.101.65.140","100.86.235.39","TLSv1.2","202","Application Data"
"295","1.879379","151.101.65.140","100.86.235.39","TLSv1.2","359","Application Data"
"296","1.879445","100.86.235.39","151.101.65.140","TCP","66","56257  >  443 [ACK] Seq=25363 Ack=53264 Win=2539 Len=0 TSval=1601724152 TSecr=653861713"
"297","1.879748","151.101.65.140","100.86.235.39","TLSv1.2","447","Application Data"
"298","1.879749","151.101.65.140","100.86.235.39","TLSv1.2","221","Application Data"
"299","1.879869","100.86.235.39","151.101.65.140","TCP","66","56257  >  443 [ACK] Seq=25363 Ack=53800 Win=2545 Len=0 TSval=1601724152 TSecr=653861714"
"300","1.892725","151.101.65.140","100.86.235.39","TLSv1.2","503","Application Data"
"301","1.892828","100.86.235.39","151.101.65.140","TCP","66","56257  >  443 [ACK] Seq=25363 Ack=54237 Win=2545 Len=0 TSval=1601724165 TSecr=653861727"
"302","1.897016","151.101.65.140","100.86.235.39","TLSv1.2","436","Application Data"
"303","1.897017","151.101.65.140","100.86.235.39","TLSv1.2","147","Application Data"
"304","1.897017","151.101.65.140","100.86.235.39","TLSv1.2","170","Application Data"
"305","1.897176","100.86.235.39","151.101.65.140","TCP","66","56257  >  443 [ACK] Seq=25363 Ack=54792 Win=2545 Len=0 TSval=1601724170 TSecr=653861731"
"306","1.898174","151.101.65.140","100.86.235.39","TLSv1.2","360","Application Data"
"307","1.898175","151.101.65.140","100.86.235.39","TLSv1.2","606","Application Data"
"308","1.898175","151.101.65.140","100.86.235.39","TLSv1.2","455","Application Data"
"309","1.898176","151.101.65.140","100.86.235.39","TLSv1.2","244","Application Data"
"310","1.898176","151.101.65.140","100.86.235.39","TLSv1.2","159","Application Data"
"311","1.898176","151.101.65.140","100.86.235.39","TLSv1.2","157","Application Data"
"312","1.898177","151.101.65.140","100.86.235.39","TLSv1.2","241","Application Data"
"313","1.898177","151.101.65.140","100.86.235.39","TLSv1.2","501","Application Data"
"314","1.898178","151.101.65.140","100.86.235.39","TLSv1.2","561","Application Data"
"315","1.898178","151.101.65.140","100.86.235.39","TLSv1.2","459","Application Data"
"316","1.898179","151.101.65.140","100.86.235.39","TLSv1.2","467","Application Data"
"317","1.898243","100.86.235.39","151.101.65.140","TCP","66","56257  >  443 [ACK] Seq=25363 Ack=58276 Win=2491 Len=0 TSval=1601724171 TSecr=653861732"
"318","1.898522","100.86.235.39","151.101.65.140","TCP","66","[TCP Window Update] 56257  >  443 [ACK] Seq=25363 Ack=58276 Win=2545 Len=0 TSval=1601724171 TSecr=653861732"
"319","1.904439","151.101.65.140","100.86.235.39","TLSv1.2","272","Application Data"
"320","1.904544","100.86.235.39","151.101.65.140","TCP","66","56257  >  443 [ACK] Seq=25363 Ack=58482 Win=2545 Len=0 TSval=1601724177 TSecr=653861738"
"321","1.904902","151.101.65.140","100.86.235.39","TLSv1.2","426","Application Data"
"322","1.904902","151.101.65.140","100.86.235.39","TLSv1.2","513","Application Data"
"323","1.905025","100.86.235.39","151.101.65.140","TCP","66","56257  >  443 [ACK] Seq=25363 Ack=59289 Win=2545 Len=0 TSval=1601724177 TSecr=653861739"
"324","1.908443","151.101.65.140","100.86.235.39","TLSv1.2","489","Application Data"
"325","1.908444","151.101.65.140","100.86.235.39","TLSv1.2","226","Application Data"
"326","1.908584","100.86.235.39","151.101.65.140","TCP","66","56257  >  443 [ACK] Seq=25363 Ack=59872 Win=2545 Len=0 TSval=1601724181 TSecr=653861743"
"327","1.909207","151.101.65.140","100.86.235.39","TLSv1.2","442","Application Data"
"328","1.909299","100.86.235.39","151.101.65.140","TCP","66","56257  >  443 [ACK] Seq=25363 Ack=60248 Win=2545 Len=0 TSval=1601724181 TSecr=653861743"
"329","1.919712","151.101.65.140","100.86.235.39","TLSv1.2","193","Application Data"
"330","1.919713","151.101.65.140","100.86.235.39","TLSv1.2","596","Application Data"
"331","1.919713","151.101.65.140","100.86.235.39","TLSv1.2","153","Application Data"
"332","1.919892","100.86.235.39","151.101.65.140","TCP","66","56257  >  443 [ACK] Seq=25363 Ack=60992 Win=2545 Len=0 TSval=1601724192 TSecr=653861754"
"333","1.920045","151.101.65.140","100.86.235.39","TLSv1.2","200","Application Data"
"334","1.920046","151.101.65.140","100.86.235.39","TLSv1.2","372","Application Data"
"335","1.920046","151.101.65.140","100.86.235.39","TLSv1.2","566","Application Data"
"336","1.920046","151.101.65.140","100.86.235.39","TLSv1.2","320","Application Data"
"337","1.920166","100.86.235.39","151.101.65.140","TCP","66","56257  >  443 [ACK] Seq=25363 Ack=62186 Win=2545 Len=0 TSval=1601724192 TSecr=653861754"
"338","1.920714","151.101.65.140","100.86.235.39","TLSv1.2","175","Application Data"
"339","1.920715","151.101.65.140","100.86.235.39","TLSv1.2","138","Application Data"
"340","1.920715","151.101.65.140","100.86.235.39","TLSv1.2","205","Application Data"
"341","1.920832","100.86.235.39","151.101.65.140","TCP","66","56257  >  443 [ACK] Seq=25363 Ack=62506 Win=2545 Len=0 TSval=1601724193 TSecr=653861755"
"342","1.920984","151.101.65.140","100.86.235.39","TLSv1.2","837","Application Data"
"343","1.920985","151.101.65.140","100.86.235.39","TLSv1.2","663","Application Data"
"344","1.921077","100.86.235.39","151.101.65.140","TCP","66","56257  >  443 [ACK] Seq=25363 Ack=63874 Win=2545 Len=0 TSval=1601724193 TSecr=653861755"
"345","1.921483","151.101.65.140","100.86.235.39","TLSv1.2","664","Application Data"
"346","1.921484","151.101.65.140","100.86.235.39","TLSv1.2","479","Application Data"
"347","1.921579","100.86.235.39","151.101.65.140","TCP","66","56257  >  443 [ACK] Seq=25363 Ack=64885 Win=2545 Len=0 TSval=1601724193 TSecr=653861755"
"348","1.921631","151.101.65.140","100.86.235.39","TLSv1.2","306","Application Data"
"349","1.921631","151.101.65.140","100.86.235.39","TLSv1.2","215","Application Data"
"350","1.921709","100.86.235.39","151.101.65.140","TCP","66","56257  >  443 [ACK] Seq=25363 Ack=65274 Win=2545 Len=0 TSval=1601724193 TSecr=653861756"
"351","1.921857","151.101.65.140","100.86.235.39","TLSv1.2","196","Application Data"
"352","1.921858","151.101.65.140","100.86.235.39","TLSv1.2","512","Application Data"
"353","1.921957","100.86.235.39","151.101.65.140","TCP","66","56257  >  443 [ACK] Seq=25363 Ack=65850 Win=2545 Len=0 TSval=1601724195 TSecr=653861756"
"354","1.922307","151.101.65.140","100.86.235.39","TLSv1.2","297","Application Data"
"355","1.922371","100.86.235.39","151.101.65.140","TCP","66","56257  >  443 [ACK] Seq=25363 Ack=66081 Win=2545 Len=0 TSval=1601724195 TSecr=653861756"
"356","1.929500","151.101.65.140","100.86.235.39","TLSv1.2","393","Application Data"
"357","1.929605","100.86.235.39","151.101.65.140","TCP","66","56257  >  443 [ACK] Seq=25363 Ack=66408 Win=2545 Len=0 TSval=1601724202 TSecr=653861764"
"358","1.931902","151.101.65.140","100.86.235.39","TLSv1.2","169","Application Data"
"359","1.932009","100.86.235.39","151.101.65.140","TCP","66","56257  >  443 [ACK] Seq=25363 Ack=66511 Win=2545 Len=0 TSval=1601724205 TSecr=653861766"
"360","1.934975","151.101.65.140","100.86.235.39","TLSv1.2","228","Application Data"
"361","1.935080","100.86.235.39","151.101.65.140","TCP","66","56257  >  443 [ACK] Seq=25363 Ack=66673 Win=2545 Len=0 TSval=1601724208 TSecr=653861769"
"362","1.935357","151.101.65.140","100.86.235.39","TLSv1.2","933","Application Data"
"363","1.935434","100.86.235.39","151.101.65.140","TCP","66","56257  >  443 [ACK] Seq=25363 Ack=67540 Win=2545 Len=0 TSval=1601724208 TSecr=653861770"
"364","1.946871","151.101.65.140","100.86.235.39","TLSv1.2","189","Application Data"
"365","1.946977","100.86.235.39","151.101.65.140","TCP","66","56257  >  443 [ACK] Seq=25363 Ack=67663 Win=2545 Len=0 TSval=1601724220 TSecr=653861780"
"366","1.947254","151.101.65.140","100.86.235.39","TLSv1.2","272","Application Data"
"367","1.947327","100.86.235.39","151.101.65.140","TCP","66","56257  >  443 [ACK] Seq=25363 Ack=67869 Win=2545 Len=0 TSval=1601724220 TSecr=653861781"
"368","1.951211","151.101.65.140","100.86.235.39","TLSv1.2","350","Application Data"
"369","1.951331","100.86.235.39","151.101.65.140","TCP","66","56257  >  443 [ACK] Seq=25363 Ack=68153 Win=2545 Len=0 TSval=1601724224 TSecr=653861785"
"370","1.951602","151.101.65.140","100.86.235.39","TLSv1.2","176","Application Data"
"371","1.951674","100.86.235.39","151.101.65.140","TCP","66","56257  >  443 [ACK] Seq=25363 Ack=68263 Win=2545 Len=0 TSval=1601724224 TSecr=653861785"
"372","1.952908","151.101.65.140","100.86.235.39","TLSv1.2","157","Application Data"
"373","1.952909","151.101.65.140","100.86.235.39","TLSv1.2","263","Application Data"
"374","1.952910","151.101.65.140","100.86.235.39","TLSv1.2","311","Application Data"
"375","1.952910","151.101.65.140","100.86.235.39","TLSv1.2","354","Application Data"
"376","1.952911","151.101.65.140","100.86.235.39","TLSv1.2","301","Application Data"
"377","1.952912","151.101.65.140","100.86.235.39","TLSv1.2","241","Application Data"
"378","1.952912","151.101.65.140","100.86.235.39","TLSv1.2","432","Application Data"
"379","1.952913","151.101.65.140","100.86.235.39","TLSv1.2","444","Application Data"
"380","1.952981","100.86.235.39","151.101.65.140","TCP","66","56257  >  443 [ACK] Seq=25363 Ack=70238 Win=2514 Len=0 TSval=1601724226 TSecr=653861786"
"381","1.953888","151.101.65.140","100.86.235.39","TLSv1.2","180","Application Data"
"382","1.953890","151.101.65.140","100.86.235.39","TLSv1.2","540","Application Data"
"383","1.953944","100.86.235.39","151.101.65.140","TCP","66","56257  >  443 [ACK] Seq=25363 Ack=70826 Win=2536 Len=0 TSval=1601724226 TSecr=653861787"
"384","1.953976","100.86.235.39","151.101.1.140","TLSv1.2","1210","Application Data"
"385","1.960260","151.101.65.140","100.86.235.39","TLSv1.2","395","Application Data"
"386","1.960319","100.86.235.39","151.101.65.140","TCP","66","56257  >  443 [ACK] Seq=25363 Ack=71155 Win=2540 Len=0 TSval=1601724233 TSecr=653861794"
"387","1.963411","151.101.65.140","100.86.235.39","TLSv1.2","141","Application Data"
"388","1.963412","151.101.1.140","100.86.235.39","TCP","66","443  >  56258 [ACK] Seq=1 Ack=1145 Win=323 Len=0 TSval=3342462265 TSecr=3450053510"
"389","1.963506","100.86.235.39","151.101.65.140","TCP","66","56257  >  443 [ACK] Seq=25363 Ack=71230 Win=2544 Len=0 TSval=1601724236 TSecr=653861797"
"390","1.964521","100.86.235.39","151.101.1.140","TLSv1.2","1207","Application Data"
"391","1.968985","151.101.65.140","100.86.235.39","TLSv1.2","175","Application Data"
"392","1.969081","100.86.235.39","151.101.65.140","TCP","66","56257  >  443 [ACK] Seq=25363 Ack=71339 Win=2545 Len=0 TSval=1601724242 TSecr=653861803"
"393","1.971873","151.101.65.140","100.86.235.39","TLSv1.2","522","Application Data"
"394","1.971963","100.86.235.39","151.101.65.140","TCP","66","56257  >  443 [ACK] Seq=25363 Ack=71795 Win=2545 Len=0 TSval=1601724245 TSecr=653861806"
"395","1.973594","151.101.1.140","100.86.235.39","TCP","66","443  >  56258 [ACK] Seq=1 Ack=2286 Win=329 Len=0 TSval=3342462276 TSecr=3450053520"
"396","1.974896","151.101.65.140","100.86.235.39","TLSv1.2","1448","Application Data"
"397","1.974897","151.101.65.140","100.86.235.39","TLSv1.2","312","Application Data"
"398","1.974949","100.86.235.39","151.101.65.140","TCP","66","56257  >  443 [ACK] Seq=25363 Ack=73423 Win=2520 Len=0 TSval=1601724248 TSecr=653861809"
"399","1.979949","151.101.65.140","100.86.235.39","TLSv1.2","165","Application Data"
"400","1.979950","151.101.65.140","100.86.235.39","TLSv1.2","147","Application Data"
"401","1.980022","100.86.235.39","151.101.65.140","TCP","66","56257  >  443 [ACK] Seq=25363 Ack=73603 Win=2542 Len=0 TSval=1601724253 TSecr=653861814"
"402","1.980876","151.101.1.140","100.86.235.39","TLSv1.2","145","Application Data"
"403","1.980931","100.86.235.39","151.101.1.140","TCP","66","56258  >  443 [ACK] Seq=2286 Ack=80 Win=2046 Len=0 TSval=3450053536 TSecr=3342462282"
"404","1.981023","151.101.1.140","100.86.235.39","TLSv1.2","214","Application Data"
"405","1.981063","100.86.235.39","151.101.1.140","TCP","66","56258  >  443 [ACK] Seq=2286 Ack=228 Win=2045 Len=0 TSval=3450053537 TSecr=3342462282"
"406","1.983044","151.101.65.140","100.86.235.39","TLSv1.2","437","Application Data"
"407","1.983075","151.101.65.140","100.86.235.39","TLSv1.2","568","Application Data"
"408","1.983155","100.86.235.39","151.101.65.140","TCP","66","56257  >  443 [ACK] Seq=25363 Ack=73974 Win=2545 Len=0 TSval=1601724256 TSecr=653861817"
"409","1.983236","100.86.235.39","151.101.65.140","TCP","66","56257  >  443 [ACK] Seq=25363 Ack=74476 Win=2545 Len=0 TSval=1601724256 TSecr=653861818"
"410","1.983701","151.101.65.140","100.86.235.39","TLSv1.2","352","Application Data"
"411","1.983783","100.86.235.39","151.101.65.140","TCP","66","56257  >  443 [ACK] Seq=25363 Ack=74762 Win=2545 Len=0 TSval=1601724256 TSecr=653861818"
"412","1.984272","151.101.65.140","100.86.235.39","TLSv1.2","853","Application Data"
"413","1.984273","151.101.65.140","100.86.235.39","TLSv1.2","178","Application Data"
"414","1.984273","151.101.65.140","100.86.235.39","TLSv1.2","336","Application Data"
"415","1.984274","151.101.65.140","100.86.235.39","TLSv1.2","828","Application Data"
"416","1.984274","151.101.65.140","100.86.235.39","TLSv1.2","653","Application Data"
"417","1.984327","100.86.235.39","151.101.65.140","TCP","66","56257  >  443 [ACK] Seq=25363 Ack=77280 Win=2506 Len=0 TSval=1601724257 TSecr=653861819"
"418","1.984688","151.101.65.140","100.86.235.39","TLSv1.2","650","Application Data"
"419","1.984727","100.86.235.39","151.101.65.140","TCP","66","56257  >  443 [ACK] Seq=25363 Ack=77864 Win=2536 Len=0 TSval=1601724257 TSecr=653861819"
"420","1.992453","151.101.65.140","100.86.235.39","TLSv1.2","619","Application Data"
"421","1.992516","100.86.235.39","151.101.65.140","TCP","66","56257  >  443 [ACK] Seq=25363 Ack=78417 Win=2537 Len=0 TSval=1601724265 TSecr=653861827"
"422","1.992723","151.101.65.140","100.86.235.39","TLSv1.2","168","Application Data"
"423","1.992768","100.86.235.39","151.101.65.140","TCP","66","56257  >  443 [ACK] Seq=25363 Ack=78519 Win=2544 Len=0 TSval=1601724265 TSecr=653861827"
"424","1.995790","151.101.1.140","100.86.235.39","TLSv1.2","1149","Application Data"
"425","1.995814","151.101.65.140","100.86.235.39","TLSv1.2","133","Application Data"
"426","1.995866","100.86.235.39","151.101.1.140","TCP","66","56258  >  443 [ACK] Seq=2286 Ack=1311 Win=2031 Len=0 TSval=3450053552 TSecr=3342462297"
"427","1.995947","100.86.235.39","151.101.65.140","TCP","66","56257  >  443 [ACK] Seq=25363 Ack=78586 Win=2544 Len=0 TSval=1601724269 TSecr=653861830"
"428","1.996625","151.101.65.140","100.86.235.39","TLSv1.2","185","Application Data"
"429","1.996716","100.86.235.39","151.101.65.140","TCP","66","56257  >  443 [ACK] Seq=25363 Ack=78705 Win=2545 Len=0 TSval=1601724269 TSecr=653861831"
"430","2.000062","151.101.65.140","100.86.235.39","TLSv1.2","401","Application Data"
"431","2.000090","151.101.65.140","100.86.235.39","TLSv1.2","567","Application Data"
"432","2.000193","100.86.235.39","151.101.65.140","TCP","66","56257  >  443 [ACK] Seq=25363 Ack=79541 Win=2545 Len=0 TSval=1601724273 TSecr=653861834"
"433","2.000545","151.101.65.140","100.86.235.39","TLSv1.2","308","Application Data"
"434","2.000610","100.86.235.39","151.101.65.140","TCP","66","56257  >  443 [ACK] Seq=25363 Ack=79783 Win=2545 Len=0 TSval=1601724273 TSecr=653861835"
"435","2.001193","151.101.65.140","100.86.235.39","TLSv1.2","562","Application Data"
"436","2.001263","100.86.235.39","151.101.65.140","TCP","66","56257  >  443 [ACK] Seq=25363 Ack=80279 Win=2545 Len=0 TSval=1601724274 TSecr=653861835"
"437","2.181515","100.86.235.39","151.101.1.140","TLSv1.2","1270","Application Data"
"438","2.182333","100.86.235.39","151.101.1.140","TLSv1.2","1275","Application Data"
"439","2.191631","151.101.1.140","100.86.235.39","TCP","66","443  >  56258 [ACK] Seq=1311 Ack=3490 Win=334 Len=0 TSval=3342462493 TSecr=3450053737"
"440","2.191633","151.101.1.140","100.86.235.39","TCP","66","443  >  56258 [ACK] Seq=1311 Ack=4699 Win=340 Len=0 TSval=3342462493 TSecr=3450053737"
"441","2.219125","151.101.1.140","100.86.235.39","TLSv1.2","250","Application Data"
"442","2.219206","100.86.235.39","151.101.1.140","TCP","66","56258  >  443 [ACK] Seq=4699 Ack=1495 Win=2045 Len=0 TSval=3450053775 TSecr=3342462521"
"443","2.219873","151.101.1.140","100.86.235.39","TLSv1.2","250","Application Data"
"444","2.219938","100.86.235.39","151.101.1.140","TCP","66","56258  >  443 [ACK] Seq=4699 Ack=1679 Win=2045 Len=0 TSval=3450053775 TSecr=3342462521"
"445","2.494724","100.86.235.39","151.101.129.140","TCP","78","56273  >  443 [SYN] Seq=0 Win=65535 Len=0 MSS=1460 WS=64 TSval=3642428753 TSecr=0 SACK_PERM"
"446","2.508745","151.101.129.140","100.86.235.39","TCP","74","443  >  56273 [SYN, ACK] Seq=0 Ack=1 Win=65535 Len=0 MSS=1460 SACK_PERM TSval=1609348843 TSecr=3642428753 WS=512"
"447","2.508838","100.86.235.39","151.101.129.140","TCP","66","56273  >  443 [ACK] Seq=1 Ack=1 Win=131712 Len=0 TSval=3642428768 TSecr=1609348843"
"448","2.509675","100.86.235.39","151.101.129.140","TCP","1514","56273  >  443 [ACK] Seq=1 Ack=1 Win=131712 Len=1448 TSval=3642428768 TSecr=1609348843 [TCP PDU reassembled in 449]"
"449","2.509710","100.86.235.39","151.101.129.140","TLSv1.3","964","Client Hello (SNI=gql-fed.reddit.com)"
"450","2.519765","151.101.129.140","100.86.235.39","TCP","66","443  >  56273 [ACK] Seq=1 Ack=2347 Win=151040 Len=0 TSval=1609348856 TSecr=3642428768"
"451","2.520603","151.101.129.140","100.86.235.39","TLSv1.3","519","Server Hello, Change Cipher Spec, Application Data, Application Data, Application Data"
"452","2.520674","100.86.235.39","151.101.129.140","TCP","66","56273  >  443 [ACK] Seq=2347 Ack=454 Win=131264 Len=0 TSval=3642428779 TSecr=1609348856"
"453","2.521253","100.86.235.39","151.101.129.140","TLSv1.3","130","Change Cipher Spec, Application Data"
"454","2.522190","100.86.235.39","151.101.129.140","TLSv1.3","158","Application Data"
"455","2.522248","100.86.235.39","151.101.129.140","TCP","1514","56273  >  443 [ACK] Seq=2503 Ack=454 Win=131264 Len=1448 TSval=3642428781 TSecr=1609348856 [TCP PDU reassembled in 456]"
"456","2.522261","100.86.235.39","151.101.129.140","TLSv1.3","179","Application Data"
"457","2.522324","100.86.235.39","151.101.129.140","TLSv1.3","303","Application Data"
"458","2.522480","100.86.235.39","151.101.129.140","TLSv1.3","1193","Application Data"
"459","2.522504","100.86.235.39","151.101.129.140","TLSv1.3","115","Application Data"
"460","2.523910","100.86.235.39","151.101.129.140","TLSv1.3","292","Application Data"
"461","2.531399","151.101.129.140","100.86.235.39","TCP","66","443  >  56273 [ACK] Seq=454 Ack=2411 Win=151040 Len=0 TSval=1609348867 TSecr=3642428780"
"462","2.531979","151.101.129.140","100.86.235.39","TLSv1.3","131","Application Data"
"463","2.532059","100.86.235.39","151.101.129.140","TCP","66","56273  >  443 [ACK] Seq=5703 Ack=519 Win=131200 Len=0 TSval=3642428790 TSecr=1609348868"
"464","2.532212","100.86.235.39","151.101.129.140","TLSv1.3","97","Application Data"
"465","2.532301","151.101.129.140","100.86.235.39","TCP","66","443  >  56273 [ACK] Seq=519 Ack=4301 Win=156672 Len=0 TSval=1609348868 TSecr=3642428781"
"466","2.532302","151.101.129.140","100.86.235.39","TCP","66","443  >  56273 [ACK] Seq=519 Ack=5477 Win=159744 Len=0 TSval=1609348868 TSecr=3642428781"
"467","2.532505","151.101.129.140","100.86.235.39","TLSv1.3","101","Application Data"
"468","2.532554","100.86.235.39","151.101.129.140","TCP","66","56273  >  443 [ACK] Seq=5734 Ack=554 Win=131200 Len=0 TSval=3642428791 TSecr=1609348868"
"469","2.534654","151.101.129.140","100.86.235.39","TCP","66","443  >  56273 [ACK] Seq=554 Ack=5703 Win=162816 Len=0 TSval=1609348869 TSecr=3642428783"
"470","2.542388","151.101.129.140","100.86.235.39","TCP","66","443  >  56273 [ACK] Seq=554 Ack=5734 Win=162816 Len=0 TSval=1609348878 TSecr=3642428791"
"471","2.578151","151.101.129.140","100.86.235.39","TLSv1.3","1096","Application Data"
"472","2.578181","151.101.129.140","100.86.235.39","TLSv1.3","1504","Application Data, Application Data"
"473","2.578248","100.86.235.39","151.101.129.140","TCP","66","56273  >  443 [ACK] Seq=5734 Ack=1584 Win=130176 Len=0 TSval=3642428837 TSecr=1609348914"
"474","2.578284","100.86.235.39","151.101.129.140","TCP","66","56273  >  443 [ACK] Seq=5734 Ack=3022 Win=128704 Len=0 TSval=3642428837 TSecr=1609348914"
"475","2.579802","151.101.129.140","100.86.235.39","TLSv1.3","341","Application Data"
"476","2.579938","100.86.235.39","151.101.129.140","TCP","66","56273  >  443 [ACK] Seq=5734 Ack=3297 Win=130752 Len=0 TSval=3642428839 TSecr=1609348916"
"477","2.580414","151.101.129.140","100.86.235.39","TLSv1.3","225","Application Data"
"478","2.580527","100.86.235.39","151.101.129.140","TCP","66","56273  >  443 [ACK] Seq=5734 Ack=3456 Win=130880 Len=0 TSval=3642428839 TSecr=1609348916"
