"No.","Time","Source","Destination","Protocol","Length","Info"
"1","0.000000","151.101.1.140","100.86.235.39","TCP","66","443  >  56466 [ACK] Seq=1 Ack=1 Win=308 Len=0 TSval=211680846 TSecr=2554129140"
"2","0.012326","100.86.235.39","151.101.129.140","TCP","78","56474  >  443 [SYN] Seq=0 Win=65535 Len=0 MSS=1460 WS=64 TSval=2958727883 TSecr=0 SACK_PERM"
"3","0.017849","100.86.235.39","151.101.65.140","TCP","1514","56383  >  443 [ACK] Seq=1 Ack=1 Win=2048 Len=1448 TSval=1359808713 TSecr=557033593 [TCP PDU reassembled in 4]"
"4","0.017895","100.86.235.39","151.101.65.140","TLSv1.2","1488","Application Data"
"5","0.018411","100.86.235.39","151.101.1.140","TLSv1.2","271","Application Data"
"6","0.018612","100.86.235.39","151.101.65.140","TLSv1.2","252","Application Data"
"7","0.018809","100.86.235.39","151.101.65.140","TLSv1.2","236","Application Data"
"8","0.023658","100.86.235.39","151.101.65.140","TLSv1.2","237","Application Data"
"9","0.031769","100.86.235.39","151.101.1.140","TLSv1.2","267","Application Data"
"10","0.032080","100.86.235.39","151.101.65.140","TLSv1.2","238","Application Data"
"11","0.032239","100.86.235.39","151.101.65.140","TLSv1.2","241","Application Data"
"12","0.032377","151.101.1.140","100.86.235.39","TLSv1.2","1510","Application Data"
"13","0.032378","151.101.1.140","100.86.235.39","TLSv1.2","1510","Application Data"
"14","0.032379","151.101.1.140","100.86.235.39","TLSv1.2","1510","Application Data"
"15","0.032440","100.86.235.39","151.101.1.140","TCP","66","56466  >  443 [ACK] Seq=1 Ack=4333 Win=1980 Len=0 TSval=2554129181 TSecr=211680874"
"16","0.032562","100.86.235.39","151.101.65.140","TLSv1.2","238","Application Data"
"17","0.033015","100.86.235.39","151.101.65.140","TCP","1514","56383  >  443 [ACK] Seq=2871 Ack=1 Win=2048 Len=1448 TSval=1359808728 TSecr=557033593 [TCP PDU reassembled in 18]"
"18","0.033033","100.86.235.39","151.101.65.140","TLSv1.2","1393","Application Data"
"19","0.033463","100.86.235.39","151.101.65.140","TCP","1514","56383  >  443 [ACK] Seq=5646 Ack=1 Win=2048 Len=1448 TSval=1359808728 TSecr=557033593 [TCP PDU reassembled in 20]"
"20","0.033479","100.86.235.39","151.101.65.140","TLSv1.2","1408","Application Data"
"21","0.033672","100.86.235.39","151.101.1.140","TCP","66","[TCP Window Update] 56466  >  443 [ACK] Seq=1 Ack=4333 Win=2048 Len=0 TSval=2554129182 TSecr=211680874"
"22","0.036869","151.101.1.140","100.86.235.39","TLSv1.2","1510","Application Data"
"23","0.036871","151.101.1.140","100.86.235.39","TLSv1.2","1510","Application Data"
"24","0.036872","151.101.1.140","100.86.235.39","TLSv1.2","1510","Application Data"
"25","0.036873","151.101.1.140","100.86.235.39","TLSv1.2","1510","Application Data"
"26","0.036874","151.101.1.140","100.86.235.39","TLSv1.2","1510","Application Data"
"27","0.036875","151.101.1.140","100.86.235.39","TLSv1.2","1510","Application Data"
"28","0.036876","151.101.1.140","100.86.235.39","TLSv1.2","1510","Application Data"
"29","0.036877","151.101.1.140","100.86.235.39","TLSv1.2","1278","Application Data, Application Data"
"30","0.036878","151.101.1.140","100.86.235.39","TCP","1510","443  >  56466 [ACK] Seq=15653 Ack=1 Win=308 Len=1444 TSval=211680876 TSecr=2554129140 [TCP PDU reassembled in 41]"
"31","0.036879","151.101.1.140","100.86.235.39","TCP","1510","443  >  56466 [ACK] Seq=17097 Ack=1 Win=308 Len=1444 TSval=211680876 TSecr=2554129140 [TCP PDU reassembled in 41]"
"32","0.036880","151.101.1.140","100.86.235.39","TCP","1510","443  >  56466 [ACK] Seq=18541 Ack=1 Win=308 Len=1444 TSval=211680876 TSecr=2554129140 [TCP PDU reassembled in 41]"
"33","0.036881","151.101.1.140","100.86.235.39","TCP","1510","443  >  56466 [PSH, ACK] Seq=19985 Ack=1 Win=308 Len=1444 TSval=211680876 TSecr=2554129140 [TCP PDU reassembled in 41]"
"34","0.036883","151.101.1.140","100.86.235.39","TCP","1510","443  >  56466 [ACK] Seq=21429 Ack=1 Win=308 Len=1444 TSval=211680877 TSecr=2554129140 [TCP PDU reassembled in 41]"
"35","0.036884","151.101.1.140","100.86.235.39","TCP","1510","443  >  56466 [ACK] Seq=22873 Ack=1 Win=308 Len=1444 TSval=211680877 TSecr=2554129140 [TCP PDU reassembled in 41]"
"36","0.036885","151.101.1.140","100.86.235.39","TCP","1510","443  >  56466 [ACK] Seq=24317 Ack=1 Win=308 Len=1444 TSval=211680877 TSecr=2554129140 [TCP PDU reassembled in 41]"
"37","0.036886","151.101.1.140","100.86.235.39","TCP","1510","443  >  56466 [PSH, ACK] Seq=25761 Ack=1 Win=308 Len=1444 TSval=211680877 TSecr=2554129140 [TCP PDU reassembled in 41]"
"38","0.036887","151.101.1.140","100.86.235.39","TCP","1510","443  >  56466 [ACK] Seq=27205 Ack=1 Win=308 Len=1444 TSval=211680877 TSecr=2554129140 [TCP PDU reassembled in 41]"
"39","0.036888","151.101.1.140","100.86.235.39","TCP","1510","443  >  56466 [ACK] Seq=28649 Ack=1 Win=308 Len=1444 TSval=211680877 TSecr=2554129140 [TCP PDU reassembled in 41]"
"40","0.036889","151.101.1.140","100.86.235.39","TCP","1510","443  >  56466 [ACK] Seq=30093 Ack=1 Win=308 Len=1444 TSval=211680877 TSecr=2554129140 [TCP PDU reassembled in 41]"
"41","0.036890","151.101.1.140","100.86.235.39","TLSv1.2","1510","Application Data"
"42","0.036891","151.101.1.140","100.86.235.39","TCP","1510","443  >  56466 [ACK] Seq=32981 Ack=1 Win=308 Len=1444 TSval=211680878 TSecr=2554129140 [TCP PDU reassembled in 95]"
"43","0.036891","151.101.1.140","100.86.235.39","TCP","1510","443  >  56466 [ACK] Seq=34425 Ack=1 Win=308 Len=1444 TSval=211680878 TSecr=2554129140 [TCP PDU reassembled in 95]"
"44","0.037000","100.86.235.39","151.101.1.140","TCP","66","56466  >  443 [ACK] Seq=1 Ack=19985 Win=1803 Len=0 TSval=2554129186 TSecr=211680876"
"45","0.037065","100.86.235.39","151.101.1.140","TCP","66","56466  >  443 [ACK] Seq=1 Ack=35869 Win=1555 Len=0 TSval=2554129186 TSecr=211680878"
"46","0.037471","100.86.235.39","151.101.1.140","TCP","66","[TCP Window Update] 56466  >  443 [ACK] Seq=1 Ack=35869 Win=2048 Len=0 TSval=2554129186 TSecr=211680878"
"47","0.038366","151.101.1.140","100.86.235.39","TCP","1510","443  >  56466 [ACK] Seq=35869 Ack=1 Win=308 Len=1444 TSval=211680878 TSecr=2554129140 [TCP PDU reassembled in 95]"
"48","0.038368","151.101.1.140","100.86.235.39","TCP","1510","443  >  56466 [PSH, ACK] Seq=37313 Ack=1 Win=308 Len=1444 TSval=211680878 TSecr=2554129140 [TCP PDU reassembled in 95]"
"49","0.038368","151.101.1.140","100.86.235.39","TCP","1510","443  >  56466 [ACK] Seq=38757 Ack=1 Win=308 Len=1444 TSval=211680879 TSecr=2554129140 [TCP PDU reassembled in 95]"
"50","0.038370","151.101.1.140","100.86.235.39","TCP","1510","443  >  56466 [ACK] Seq=40201 Ack=1 Win=308 Len=1444 TSval=211680879 TSecr=2554129140 [TCP PDU reassembled in 95]"
"51","0.038371","151.101.1.140","100.86.235.39","TCP","1510","443  >  56466 [PSH, ACK] Seq=41645 Ack=1 Win=308 Len=1444 TSval=211680879 TSecr=2554129140 [TCP PDU reassembled in 95]"
"52","0.038372","151.101.129.140","100.86.235.39","TCP","74","443  >  56474 [SYN, ACK] Seq=0 Ack=1 Win=65535 Len=0 MSS=1460 SACK_PERM TSval=628892572 TSecr=2958727883 WS=512"
"53","0.038468","100.86.235.39","151.101.1.140","TCP","66","56466  >  443 [ACK] Seq=1 Ack=43089 Win=1935 Len=0 TSval=2554129188 TSecr=211680879"
"54","0.038525","100.86.235.39","151.101.129.140","TCP","66","56474  >  443 [ACK] Seq=1 Ack=1 Win=131712 Len=0 TSval=2958727910 TSecr=628892572"
"55","0.038599","100.86.235.39","151.101.1.140","TCP","66","[TCP Window Update] 56466  >  443 [ACK] Seq=1 Ack=43089 Win=2048 Len=0 TSval=2554129188 TSecr=211680879"
"56","0.039823","100.86.235.39","151.101.129.140","TCP","1514","56474  >  443 [ACK] Seq=1 Ack=1 Win=131712 Len=1448 TSval=2958727911 TSecr=628892572 [TCP PDU reassembled in 57]"
"57","0.039847","100.86.235.39","151.101.129.140","TLSv1.3","955","Client Hello (SNI=v.redd.it)"
"58","0.040258","100.86.235.39","151.101.65.140","TCP","1514","56383  >  443 [ACK] Seq=8436 Ack=1 Win=2048 Len=1448 TSval=1359808735 TSecr=557033593 [TCP PDU reassembled in 60]"
"59","0.040259","100.86.235.39","151.101.65.140","TCP","1514","56383  >  443 [ACK] Seq=9884 Ack=1 Win=2048 Len=1448 TSval=1359808735 TSecr=557033593 [TCP PDU reassembled in 60]"
"60","0.040276","100.86.235.39","151.101.65.140","TLSv1.2","102","Application Data"
"61","0.040314","100.86.235.39","151.101.65.140","TLSv1.2","146","Application Data"
"62","0.042071","151.101.65.140","100.86.235.39","TCP","66","443  >  56383 [ACK] Seq=1 Ack=2871 Win=534 Len=0 TSval=557033712 TSecr=1359808713"
"63","0.043178","151.101.65.140","100.86.235.39","TCP","66","443  >  56438 [ACK] Seq=1 Ack=342 Win=424 Len=0 TSval=3000599114 TSecr=3707434553"
"64","0.043309","151.101.65.140","100.86.235.39","TCP","66","443  >  56449 [ACK] Seq=1 Ack=187 Win=377 Len=0 TSval=867390708 TSecr=921684345"
"65","0.043438","151.101.1.140","100.86.235.39","TCP","66","443  >  56444 [ACK] Seq=1 Ack=206 Win=309 Len=0 TSval=3958004390 TSecr=1368124248"
"66","0.045731","151.101.65.140","100.86.235.39","TLSv1.2","227","Application Data"
"67","0.045732","151.101.1.140","100.86.235.39","TLSv1.2","193","Application Data"
"68","0.045733","151.101.1.140","100.86.235.39","TCP","1510","443  >  56444 [ACK] Seq=128 Ack=206 Win=309 Len=1444 TSval=3958004390 TSecr=1368124248 [TCP PDU reassembled in 103]"
"69","0.045734","151.101.1.140","100.86.235.39","TCP","1510","443  >  56444 [ACK] Seq=1572 Ack=206 Win=309 Len=1444 TSval=3958004390 TSecr=1368124248 [TCP PDU reassembled in 103]"
"70","0.045735","151.101.1.140","100.86.235.39","TCP","1510","443  >  56444 [ACK] Seq=3016 Ack=206 Win=309 Len=1444 TSval=3958004390 TSecr=1368124248 [TCP PDU reassembled in 103]"
"71","0.045735","151.101.1.140","100.86.235.39","TCP","1510","443  >  56444 [ACK] Seq=4460 Ack=206 Win=309 Len=1444 TSval=3958004390 TSecr=1368124248 [TCP PDU reassembled in 103]"
"72","0.045736","151.101.1.140","100.86.235.39","TCP","1510","443  >  56444 [ACK] Seq=5904 Ack=206 Win=309 Len=1444 TSval=3958004390 TSecr=1368124248 [TCP PDU reassembled in 103]"
"73","0.045737","151.101.1.140","100.86.235.39","TCP","1510","443  >  56444 [ACK] Seq=7348 Ack=206 Win=309 Len=1444 TSval=3958004390 TSecr=1368124248 [TCP PDU reassembled in 103]"
"74","0.045737","151.101.1.140","100.86.235.39","TCP","1510","443  >  56444 [PSH, ACK] Seq=8792 Ack=206 Win=309 Len=1444 TSval=3958004390 TSecr=1368124248 [TCP PDU reassembled in 103]"
"75","0.045738","151.101.65.140","100.86.235.39","TCP","1510","443  >  56438 [ACK] Seq=162 Ack=342 Win=424 Len=1444 TSval=3000599114 TSecr=3707434553 [TCP PDU reassembled in 76]"
"76","0.045739","151.101.65.140","100.86.235.39","TLSv1.2","581","Application Data"
"77","0.045739","151.101.65.140","100.86.235.39","TLSv1.2","217","Application Data"
"78","0.045740","151.101.65.140","100.86.235.39","TLSv1.2","1510","Application Data"
"79","0.045741","151.101.65.140","100.86.235.39","TLSv1.2","1510","Application Data"
"80","0.045741","151.101.65.140","100.86.235.39","TLSv1.2","1510","Application Data"
"81","0.045742","151.101.65.140","100.86.235.39","TLSv1.2","1510","Application Data"
"82","0.045743","151.101.65.140","100.86.235.39","TLSv1.2","1510","Application Data"
"83","0.045743","151.101.65.140","100.86.235.39","TLSv1.2","1510","Application Data"
"84","0.045744","151.101.65.140","100.86.235.39","TLSv1.2","1510","Application Data"
"85","0.045745","151.101.65.140","100.86.235.39","TLSv1.2","333","Application Data"
"86","0.045745","151.101.1.140","100.86.235.39","TCP","1510","443  >  56466 [ACK] Seq=43089 Ack=1 Win=308 Len=1444 TSval=211680890 TSecr=2554129182 [TCP PDU reassembled in 95]"
"87","0.045746","151.101.1.140","100.86.235.39","TCP","1510","443  >  56466 [ACK] Seq=44533 Ack=1 Win=308 Len=1444 TSval=211680890 TSecr=2554129182 [TCP PDU reassembled in 95]"
"88","0.045832","100.86.235.39","151.101.65.140","TCP","66","56438  >  443 [ACK] Seq=686 Ack=2121 Win=2331 Len=0 TSval=3707434574 TSecr=3000599114"
"89","0.045920","100.86.235.39","151.101.1.140","TCP","66","56444  >  443 [ACK] Seq=407 Ack=10236 Win=2091 Len=0 TSval=1368124275 TSecr=3958004390"
"90","0.045954","100.86.235.39","151.101.1.140","TCP","66","56466  >  443 [ACK] Seq=1 Ack=45977 Win=2545 Len=0 TSval=2554129194 TSecr=211680890"
"91","0.045979","100.86.235.39","151.101.65.140","TCP","66","56449  >  443 [ACK] Seq=362 Ack=10527 Win=2064 Len=0 TSval=921684372 TSecr=867390709"
"92","0.046388","100.86.235.39","151.101.65.140","TCP","66","[TCP Window Update] 56449  >  443 [ACK] Seq=362 Ack=10527 Win=2229 Len=0 TSval=921684373 TSecr=867390709"
"93","0.046506","100.86.235.39","151.101.1.140","TCP","66","[TCP Window Update] 56444  >  443 [ACK] Seq=407 Ack=10236 Win=2251 Len=0 TSval=1368124276 TSecr=3958004390"
"94","0.046730","151.101.1.140","100.86.235.39","TCP","1510","443  >  56466 [ACK] Seq=45977 Ack=1 Win=308 Len=1444 TSval=211680890 TSecr=2554129182 [TCP PDU reassembled in 95]"
"95","0.046731","151.101.1.140","100.86.235.39","TLSv1.2","1510","Application Data"
"96","0.046796","100.86.235.39","151.101.1.140","TCP","66","56466  >  443 [ACK] Seq=1 Ack=48865 Win=2545 Len=0 TSval=2554129195 TSecr=211680890"
"97","0.046926","151.101.1.140","100.86.235.39","TCP","1510","443  >  56444 [ACK] Seq=10236 Ack=206 Win=309 Len=1444 TSval=3958004391 TSecr=1368124248 [TCP PDU reassembled in 103]"
"98","0.046928","151.101.1.140","100.86.235.39","TCP","1510","443  >  56444 [ACK] Seq=11680 Ack=206 Win=309 Len=1444 TSval=3958004391 TSecr=1368124248 [TCP PDU reassembled in 103]"
"99","0.046928","151.101.1.140","100.86.235.39","TCP","1510","443  >  56444 [ACK] Seq=13124 Ack=206 Win=309 Len=1444 TSval=3958004391 TSecr=1368124248 [TCP PDU reassembled in 103]"
"100","0.046929","151.101.1.140","100.86.235.39","TCP","1510","443  >  56444 [ACK] Seq=14568 Ack=206 Win=309 Len=1444 TSval=3958004391 TSecr=1368124248 [TCP PDU reassembled in 103]"
"101","0.046983","100.86.235.39","151.101.1.140","TCP","66","56444  >  443 [ACK] Seq=407 Ack=16012 Win=2161 Len=0 TSval=1368124276 TSecr=3958004391"
"102","0.047058","100.86.235.39","151.101.1.140","TCP","66","[TCP Window Update] 56444  >  443 [ACK] Seq=407 Ack=16012 Win=2251 Len=0 TSval=1368124276 TSecr=3958004391"
"103","0.048465","151.101.1.140","100.86.235.39","TLSv1.2","1510","Application Data"
"104","0.048467","151.101.1.140","100.86.235.39","TCP","1510","443  >  56444 [ACK] Seq=17456 Ack=206 Win=309 Len=1444 TSval=3958004391 TSecr=1368124248 [TCP PDU reassembled in 124]"
"105","0.048467","151.101.1.140","100.86.235.39","TCP","1510","443  >  56444 [PSH, ACK] Seq=18900 Ack=206 Win=309 Len=1444 TSval=3958004391 TSecr=1368124248 [TCP PDU reassembled in 124]"
"106","0.048468","151.101.65.140","100.86.235.39","TCP","66","443  >  56438 [ACK] Seq=2121 Ack=686 Win=424 Len=0 TSval=3000599115 TSecr=3707434561"
"107","0.048469","151.101.65.140","100.86.235.39","TCP","66","443  >  56383 [ACK] Seq=1 Ack=8436 Win=529 Len=0 TSval=557033714 TSecr=1359808728"
"108","0.048469","151.101.65.140","100.86.235.39","TCP","66","443  >  56449 [ACK] Seq=10527 Ack=362 Win=383 Len=0 TSval=867390710 TSecr=921684359"
"109","0.048470","151.101.1.140","100.86.235.39","TCP","1510","443  >  56444 [ACK] Seq=20344 Ack=206 Win=309 Len=1444 TSval=3958004392 TSecr=1368124248 [TCP PDU reassembled in 124]"
"110","0.048471","151.101.1.140","100.86.235.39","TCP","1510","443  >  56444 [ACK] Seq=21788 Ack=206 Win=309 Len=1444 TSval=3958004392 TSecr=1368124248 [TCP PDU reassembled in 124]"
"111","0.048472","151.101.65.140","100.86.235.39","TLSv1.2","164","Application Data"
"112","0.048472","151.101.65.140","100.86.235.39","TCP","1510","443  >  56438 [ACK] Seq=2219 Ack=686 Win=424 Len=1444 TSval=3000599116 TSecr=3707434561 [TCP PDU reassembled in 113]"
"113","0.048474","151.101.65.140","100.86.235.39","TLSv1.2","964","Application Data"
"114","0.048474","151.101.1.140","100.86.235.39","TCP","1510","443  >  56444 [ACK] Seq=23232 Ack=206 Win=309 Len=1444 TSval=3958004392 TSecr=1368124248 [TCP PDU reassembled in 124]"
"115","0.048475","151.101.1.140","100.86.235.39","TCP","1510","443  >  56444 [ACK] Seq=24676 Ack=206 Win=309 Len=1444 TSval=3958004392 TSecr=1368124248 [TCP PDU reassembled in 124]"
"116","0.048476","151.101.1.140","100.86.235.39","TCP","1510","443  >  56444 [ACK] Seq=26120 Ack=206 Win=309 Len=1444 TSval=3958004392 TSecr=1368124248 [TCP PDU reassembled in 124]"
"117","0.048477","151.101.1.140","100.86.235.39","TCP","1510","443  >  56444 [ACK] Seq=27564 Ack=206 Win=309 Len=1444 TSval=3958004392 TSecr=1368124248 [TCP PDU reassembled in 124]"
"118","0.048478","151.101.1.140","100.86.235.39","TCP","1510","443  >  56444 [PSH, ACK] Seq=29008 Ack=206 Win=309 Len=1444 TSval=3958004392 TSecr=1368124248 [TCP PDU reassembled in 124]"
"119","0.048650","100.86.235.39","151.101.1.140","TCP","66","56444  >  443 [ACK] Seq=407 Ack=30452 Win=2026 Len=0 TSval=1368124279 TSecr=3958004392"
"120","0.048653","100.86.235.39","151.101.65.140","TCP","66","56438  >  443 [ACK] Seq=686 Ack=4561 Win=2326 Len=0 TSval=3707434578 TSecr=3000599116"
"121","0.049045","100.86.235.39","151.101.1.140","TCP","66","[TCP Window Update] 56444  >  443 [ACK] Seq=407 Ack=30452 Win=2251 Len=0 TSval=1368124279 TSecr=3958004392"
"122","0.050679","151.101.65.140","100.86.235.39","TLSv1.2","198","Application Data"
"123","0.050680","151.101.1.140","100.86.235.39","TCP","1510","443  >  56444 [ACK] Seq=30452 Ack=407 Win=315 Len=1444 TSval=3958004393 TSecr=1368124262 [TCP PDU reassembled in 124]"
"124","0.050681","151.101.1.140","100.86.235.39","TLSv1.2","1510","Application Data, Application Data, Application Data"
"125","0.050682","151.101.1.140","100.86.235.39","TCP","1510","443  >  56444 [ACK] Seq=33340 Ack=407 Win=315 Len=1444 TSval=3958004393 TSecr=1368124262 [TCP PDU reassembled in 171]"
"126","0.050683","151.101.1.140","100.86.235.39","TCP","1510","443  >  56444 [ACK] Seq=34784 Ack=407 Win=315 Len=1444 TSval=3958004393 TSecr=1368124262 [TCP PDU reassembled in 171]"
"127","0.050684","151.101.65.140","100.86.235.39","TCP","1510","443  >  56449 [ACK] Seq=10659 Ack=362 Win=383 Len=1444 TSval=867390711 TSecr=921684359 [TCP PDU reassembled in 141]"
"128","0.050685","151.101.1.140","100.86.235.39","TCP","1510","443  >  56444 [ACK] Seq=36228 Ack=407 Win=315 Len=1444 TSval=3958004393 TSecr=1368124262 [TCP PDU reassembled in 171]"
"129","0.050686","151.101.65.140","100.86.235.39","TCP","1510","443  >  56449 [ACK] Seq=12103 Ack=362 Win=383 Len=1444 TSval=867390711 TSecr=921684359 [TCP PDU reassembled in 141]"
"130","0.050687","151.101.1.140","100.86.235.39","TCP","1510","443  >  56444 [ACK] Seq=37672 Ack=407 Win=315 Len=1444 TSval=3958004393 TSecr=1368124262 [TCP PDU reassembled in 171]"
"131","0.050688","151.101.65.140","100.86.235.39","TCP","1510","443  >  56449 [ACK] Seq=13547 Ack=362 Win=383 Len=1444 TSval=867390711 TSecr=921684359 [TCP PDU reassembled in 141]"
"132","0.050688","151.101.1.140","100.86.235.39","TCP","1510","443  >  56444 [PSH, ACK] Seq=39116 Ack=407 Win=315 Len=1444 TSval=3958004393 TSecr=1368124262 [TCP PDU reassembled in 171]"
"133","0.050690","151.101.65.140","100.86.235.39","TCP","1510","443  >  56449 [ACK] Seq=14991 Ack=362 Win=383 Len=1444 TSval=867390711 TSecr=921684359 [TCP PDU reassembled in 141]"
"134","0.050691","151.101.65.140","100.86.235.39","TCP","1510","443  >  56449 [ACK] Seq=16435 Ack=362 Win=383 Len=1444 TSval=867390711 TSecr=921684359 [TCP PDU reassembled in 141]"
"135","0.050692","151.101.65.140","100.86.235.39","TCP","1510","443  >  56449 [ACK] Seq=17879 Ack=362 Win=383 Len=1444 TSval=867390711 TSecr=921684359 [TCP PDU reassembled in 141]"
"136","0.050693","151.101.65.140","100.86.235.39","TCP","1510","443  >  56449 [ACK] Seq=19323 Ack=362 Win=383 Len=1444 TSval=867390711 TSecr=921684359 [TCP PDU reassembled in 141]"
"137","0.050694","151.101.65.140","100.86.235.39","TCP","1510","443  >  56449 [ACK] Seq=20767 Ack=362 Win=383 Len=1444 TSval=867390711 TSecr=921684359 [TCP PDU reassembled in 141]"
"138","0.050695","151.101.65.140","100.86.235.39","TCP","1510","443  >  56449 [ACK] Seq=22211 Ack=362 Win=383 Len=1444 TSval=867390711 TSecr=921684359 [TCP PDU reassembled in 141]"
"139","0.050696","151.101.65.140","100.86.235.39","TCP","1510","443  >  56449 [ACK] Seq=23655 Ack=362 Win=383 Len=1444 TSval=867390711 TSecr=921684359 [TCP PDU reassembled in 141]"
"140","0.050697","151.101.65.140","100.86.235.39","TCP","1510","443  >  56449 [ACK] Seq=25099 Ack=362 Win=383 Len=1444 TSval=867390711 TSecr=921684359 [TCP PDU reassembled in 141]"
"141","0.050698","151.101.65.140","100.86.235.39","TLSv1.2","1510","Application Data"
"142","0.050699","151.101.65.140","100.86.235.39","TCP","1510","443  >  56449 [ACK] Seq=27987 Ack=362 Win=383 Len=1444 TSval=867390712 TSecr=921684359 [TCP PDU reassembled in 292]"
"143","0.050700","151.101.65.140","100.86.235.39","TCP","1510","443  >  56449 [ACK] Seq=29431 Ack=362 Win=383 Len=1444 TSval=867390712 TSecr=921684359 [TCP PDU reassembled in 292]"
"144","0.050701","151.101.65.140","100.86.235.39","TCP","1510","443  >  56449 [ACK] Seq=30875 Ack=362 Win=383 Len=1444 TSval=867390712 TSecr=921684359 [TCP PDU reassembled in 292]"
"145","0.050702","151.101.65.140","100.86.235.39","TCP","1510","443  >  56449 [ACK] Seq=32319 Ack=362 Win=383 Len=1444 TSval=867390712 TSecr=921684359 [TCP PDU reassembled in 292]"
"146","0.050792","151.101.65.140","100.86.235.39","TCP","1510","443  >  56449 [ACK] Seq=33763 Ack=362 Win=383 Len=1444 TSval=867390712 TSecr=921684359 [TCP PDU reassembled in 292]"
"147","0.050796","151.101.65.140","100.86.235.39","TCP","1510","[TCP Previous segment not captured] 443  >  56449 [ACK] Seq=36651 Ack=362 Win=383 Len=1444 TSval=867390712 TSecr=921684359 [TCP PDU reassembled in 292]"
"148","0.050861","100.86.235.39","151.101.65.140","TCP","66","56449  >  443 [ACK] Seq=362 Ack=26543 Win=1978 Len=0 TSval=921684378 TSecr=867390711"
"149","0.050923","100.86.235.39","151.101.65.140","TCP","66","56449  >  443 [ACK] Seq=362 Ack=33763 Win=1865 Len=0 TSval=921684378 TSecr=867390712"
"150","0.050948","151.101.65.140","100.86.235.39","TCP","1510","443  >  56449 [ACK] Seq=38095 Ack=362 Win=383 Len=1444 TSval=867390712 TSecr=921684359 [TCP PDU reassembled in 292]"
"151","0.050949","151.101.65.140","100.86.235.39","TCP","1510","443  >  56449 [ACK] Seq=39539 Ack=362 Win=383 Len=1444 TSval=867390712 TSecr=921684359 [TCP PDU reassembled in 292]"
"152","0.051008","100.86.235.39","151.101.1.140","TCP","66","56444  >  443 [ACK] Seq=407 Ack=40560 Win=2093 Len=0 TSval=1368124281 TSecr=3958004393"
"153","0.051036","100.86.235.39","151.101.65.140","TCP","66","56449  >  443 [ACK] Seq=362 Ack=35207 Win=1845 Len=0 TSval=921684378 TSecr=867390712"
"154","0.051056","100.86.235.39","151.101.65.140","TCP","78","[TCP Dup ACK 153#1] 56449  >  443 [ACK] Seq=362 Ack=35207 Win=1845 Len=0 TSval=921684378 TSecr=867390712 SLE=36651 SRE=38095"
"155","0.051072","100.86.235.39","151.101.65.140","TCP","78","[TCP Dup ACK 153#2] 56449  >  443 [ACK] Seq=362 Ack=35207 Win=1845 Len=0 TSval=921684378 TSecr=867390712 SLE=36651 SRE=40983"
"156","0.051131","151.101.65.140","100.86.235.39","TCP","1510","443  >  56449 [ACK] Seq=40983 Ack=362 Win=383 Len=1444 TSval=867390712 TSecr=921684359 [TCP PDU reassembled in 292]"
"157","0.051132","151.101.65.140","100.86.235.39","TCP","1510","443  >  56449 [ACK] Seq=42427 Ack=362 Win=383 Len=1444 TSval=867390712 TSecr=921684359 [TCP PDU reassembled in 292]"
"158","0.051187","100.86.235.39","151.101.65.140","TCP","78","[TCP Dup ACK 153#3] 56449  >  443 [ACK] Seq=362 Ack=35207 Win=2101 Len=0 TSval=921684378 TSecr=867390712 SLE=36651 SRE=43871"
"159","0.051278","100.86.235.39","151.101.65.140","TCP","78","[TCP Dup ACK 153#4] 56449  >  443 [ACK] Seq=362 Ack=35207 Win=2229 Len=0 TSval=921684378 TSecr=867390712 SLE=36651 SRE=43871"
"160","0.051338","151.101.65.140","100.86.235.39","TCP","1510","443  >  56449 [PSH, ACK] Seq=43871 Ack=362 Win=383 Len=1444 TSval=867390712 TSecr=921684359 [TCP PDU reassembled in 187]"
"161","0.051339","151.101.1.140","100.86.235.39","TCP","1510","443  >  56444 [ACK] Seq=40560 Ack=407 Win=315 Len=1444 TSval=3958004394 TSecr=1368124262 [TCP PDU reassembled in 171]"
"162","0.051341","151.101.1.140","100.86.235.39","TCP","1510","443  >  56444 [ACK] Seq=42004 Ack=407 Win=315 Len=1444 TSval=3958004394 TSecr=1368124262 [TCP PDU reassembled in 171]"
"163","0.051342","151.101.1.140","100.86.235.39","TCP","1510","443  >  56444 [ACK] Seq=43448 Ack=407 Win=315 Len=1444 TSval=3958004394 TSecr=1368124262 [TCP PDU reassembled in 171]"
"164","0.051390","100.86.235.39","151.101.1.140","TCP","66","56444  >  443 [ACK] Seq=407 Ack=44892 Win=2026 Len=0 TSval=1368124281 TSecr=3958004394"
"165","0.051422","100.86.235.39","151.101.65.140","TCP","78","[TCP Dup ACK 153#5] 56449  >  443 [ACK] Seq=362 Ack=35207 Win=2229 Len=0 TSval=921684378 TSecr=867390712 SLE=36651 SRE=45315"
"166","0.051520","151.101.1.140","100.86.235.39","TCP","1510","443  >  56444 [ACK] Seq=44892 Ack=407 Win=315 Len=1444 TSval=3958004394 TSecr=1368124262 [TCP PDU reassembled in 171]"
"167","0.051521","151.101.1.140","100.86.235.39","TCP","1510","443  >  56444 [ACK] Seq=46336 Ack=407 Win=315 Len=1444 TSval=3958004394 TSecr=1368124262 [TCP PDU reassembled in 171]"
"168","0.051569","100.86.235.39","151.101.1.140","TCP","66","56444  >  443 [ACK] Seq=407 Ack=47780 Win=2021 Len=0 TSval=1368124281 TSecr=3958004394"
"169","0.051715","100.86.235.39","151.101.1.140","TCP","66","[TCP Window Update] 56444  >  443 [ACK] Seq=407 Ack=47780 Win=2251 Len=0 TSval=1368124281 TSecr=3958004394"
"170","0.051790","151.101.1.140","100.86.235.39","TCP","1510","443  >  56444 [ACK] Seq=47780 Ack=407 Win=315 Len=1444 TSval=3958004394 TSecr=1368124262 [TCP PDU reassembled in 171]"
"171","0.051792","151.101.1.140","100.86.235.39","TLSv1.2","1510","Application Data"
"172","0.051793","151.101.65.140","100.86.235.39","TCP","1510","443  >  56449 [ACK] Seq=45315 Ack=362 Win=383 Len=1444 TSval=867390713 TSecr=921684359 [TCP PDU reassembled in 187]"
"173","0.051794","151.101.65.140","100.86.235.39","TCP","1510","443  >  56449 [ACK] Seq=46759 Ack=362 Win=383 Len=1444 TSval=867390713 TSecr=921684359 [TCP PDU reassembled in 187]"
"174","0.051834","100.86.235.39","151.101.1.140","TCP","66","56444  >  443 [ACK] Seq=407 Ack=50668 Win=2206 Len=0 TSval=1368124282 TSecr=3958004394"
"175","0.051867","100.86.235.39","151.101.65.140","TCP","78","[TCP Dup ACK 153#6] 56449  >  443 [ACK] Seq=362 Ack=35207 Win=2229 Len=0 TSval=921684379 TSecr=867390712 SLE=36651 SRE=48203"
"176","0.051892","151.101.65.140","100.86.235.39","TCP","1510","443  >  56449 [ACK] Seq=48203 Ack=362 Win=383 Len=1444 TSval=867390713 TSecr=921684359 [TCP PDU reassembled in 187]"
"177","0.051893","151.101.65.140","100.86.235.39","TCP","1510","443  >  56449 [ACK] Seq=49647 Ack=362 Win=383 Len=1444 TSval=867390713 TSecr=921684359 [TCP PDU reassembled in 187]"
"178","0.051932","100.86.235.39","151.101.65.140","TCP","78","[TCP Dup ACK 153#7] 56449  >  443 [ACK] Seq=362 Ack=35207 Win=2229 Len=0 TSval=921684379 TSecr=867390712 SLE=36651 SRE=51091"
"179","0.052074","151.101.65.140","100.86.235.39","TCP","1510","443  >  56449 [ACK] Seq=51091 Ack=362 Win=383 Len=1444 TSval=867390713 TSecr=921684359 [TCP PDU reassembled in 187]"
"180","0.052075","151.101.65.140","100.86.235.39","TCP","1510","443  >  56449 [ACK] Seq=52535 Ack=362 Win=383 Len=1444 TSval=867390713 TSecr=921684359 [TCP PDU reassembled in 187]"
"181","0.052116","100.86.235.39","151.101.65.140","TCP","78","[TCP Dup ACK 153#8] 56449  >  443 [ACK] Seq=362 Ack=35207 Win=2229 Len=0 TSval=921684379 TSecr=867390712 SLE=36651 SRE=53979"
"182","0.052341","151.101.65.140","100.86.235.39","TCP","1510","443  >  56449 [ACK] Seq=53979 Ack=362 Win=383 Len=1444 TSval=867390713 TSecr=921684359 [TCP PDU reassembled in 187]"
"183","0.052342","151.101.65.140","100.86.235.39","TCP","1510","443  >  56449 [ACK] Seq=55423 Ack=362 Win=383 Len=1444 TSval=867390713 TSecr=921684359 [TCP PDU reassembled in 187]"
"184","0.052342","151.101.65.140","100.86.235.39","TCP","1510","443  >  56449 [ACK] Seq=56867 Ack=362 Win=383 Len=1444 TSval=867390713 TSecr=921684359 [TCP PDU reassembled in 187]"
"185","0.052343","151.101.65.140","100.86.235.39","TCP","1510","443  >  56449 [ACK] Seq=58311 Ack=362 Win=383 Len=1444 TSval=867390713 TSecr=921684359 [TCP PDU reassembled in 187]"
"186","0.052381","100.86.235.39","151.101.65.140","TCP","78","[TCP Dup ACK 153#9] 56449  >  443 [ACK] Seq=362 Ack=35207 Win=2229 Len=0 TSval=921684379 TSecr=867390712 SLE=36651 SRE=59755"
"187","0.052474","151.101.65.140","100.86.235.39","TLSv1.2","1510","Application Data"
"188","0.052475","151.101.65.140","100.86.235.39","TCP","1510","443  >  56449 [PSH, ACK] Seq=61199 Ack=362 Win=383 Len=1444 TSval=867390713 TSecr=921684359 [TCP PDU reassembled in 217]"
"189","0.052513","100.86.235.39","151.101.65.140","TCP","78","[TCP Dup ACK 153#10] 56449  >  443 [ACK] Seq=362 Ack=35207 Win=2229 Len=0 TSval=921684379 TSecr=867390712 SLE=36651 SRE=62643"
"190","0.052622","151.101.1.140","100.86.235.39","TCP","1510","443  >  56466 [ACK] Seq=48865 Ack=1 Win=308 Len=1444 TSval=211680894 TSecr=2554129186 [TCP PDU reassembled in 205]"
"191","0.052629","151.101.1.140","100.86.235.39","TCP","1510","443  >  56466 [ACK] Seq=50309 Ack=1 Win=308 Len=1444 TSval=211680894 TSecr=2554129186 [TCP PDU reassembled in 205]"
"192","0.052666","100.86.235.39","151.101.1.140","TCP","66","56466  >  443 [ACK] Seq=1 Ack=51753 Win=2545 Len=0 TSval=2554129201 TSecr=211680894"
"193","0.053190","151.101.1.140","100.86.235.39","TCP","1510","443  >  56466 [ACK] Seq=51753 Ack=1 Win=308 Len=1444 TSval=211680894 TSecr=2554129186 [TCP PDU reassembled in 205]"
"194","0.053191","151.101.1.140","100.86.235.39","TCP","1510","443  >  56466 [ACK] Seq=53197 Ack=1 Win=308 Len=1444 TSval=211680894 TSecr=2554129186 [TCP PDU reassembled in 205]"
"195","0.053265","100.86.235.39","151.101.1.140","TCP","66","56466  >  443 [ACK] Seq=1 Ack=54641 Win=2545 Len=0 TSval=2554129202 TSecr=211680894"
"196","0.056004","151.101.1.140","100.86.235.39","TCP","1510","443  >  56466 [ACK] Seq=54641 Ack=1 Win=308 Len=1444 TSval=211680894 TSecr=2554129186 [TCP PDU reassembled in 205]"
"197","0.056005","151.101.1.140","100.86.235.39","TCP","1510","443  >  56466 [ACK] Seq=56085 Ack=1 Win=308 Len=1444 TSval=211680894 TSecr=2554129186 [TCP PDU reassembled in 205]"
"198","0.056007","151.101.1.140","100.86.235.39","TCP","1510","443  >  56466 [PSH, ACK] Seq=57529 Ack=1 Win=308 Len=1444 TSval=211680894 TSecr=2554129186 [TCP PDU reassembled in 205]"
"199","0.056008","151.101.1.140","100.86.235.39","TCP","1510","443  >  56444 [ACK] Seq=50668 Ack=407 Win=315 Len=1444 TSval=3958004395 TSecr=1368124262 [TCP PDU reassembled in 200]"
"200","0.056009","151.101.1.140","100.86.235.39","TLSv1.2","624","Application Data"
"201","0.056010","151.101.1.140","100.86.235.39","TCP","1510","443  >  56466 [ACK] Seq=58973 Ack=1 Win=308 Len=1444 TSval=211680894 TSecr=2554129186 [TCP PDU reassembled in 205]"
"202","0.056011","151.101.1.140","100.86.235.39","TCP","1510","443  >  56466 [ACK] Seq=60417 Ack=1 Win=308 Len=1444 TSval=211680894 TSecr=2554129186 [TCP PDU reassembled in 205]"
"203","0.056011","151.101.1.140","100.86.235.39","TCP","1510","443  >  56466 [ACK] Seq=61861 Ack=1 Win=308 Len=1444 TSval=211680894 TSecr=2554129186 [TCP PDU reassembled in 205]"
"204","0.056012","151.101.1.140","100.86.235.39","TCP","1510","443  >  56466 [ACK] Seq=63305 Ack=1 Win=308 Len=1444 TSval=211680894 TSecr=2554129186 [TCP PDU reassembled in 205]"
"205","0.056013","151.101.1.140","100.86.235.39","TLSv1.2","1510","Application Data"
"206","0.056014","151.101.1.140","100.86.235.39","TCP","1510","443  >  56466 [ACK] Seq=66193 Ack=1 Win=308 Len=1444 TSval=211680894 TSecr=2554129186 [TCP PDU reassembled in 252]"
"207","0.056015","151.101.1.140","100.86.235.39","TCP","1510","443  >  56466 [PSH, ACK] Seq=67637 Ack=1 Win=308 Len=1444 TSval=211680894 TSecr=2554129186 [TCP PDU reassembled in 252]"
"208","0.056015","151.101.65.140","100.86.235.39","TCP","1510","443  >  56449 [ACK] Seq=62643 Ack=362 Win=383 Len=1444 TSval=867390714 TSecr=921684359 [TCP PDU reassembled in 217]"
"209","0.056017","151.101.65.140","100.86.235.39","TCP","1510","443  >  56449 [ACK] Seq=64087 Ack=362 Win=383 Len=1444 TSval=867390714 TSecr=921684359 [TCP PDU reassembled in 217]"
"210","0.056018","151.101.65.140","100.86.235.39","TCP","1510","443  >  56449 [ACK] Seq=65531 Ack=362 Win=383 Len=1444 TSval=867390714 TSecr=921684359 [TCP PDU reassembled in 217]"
"211","0.056018","151.101.65.140","100.86.235.39","TCP","1510","443  >  56449 [ACK] Seq=66975 Ack=362 Win=383 Len=1444 TSval=867390714 TSecr=921684359 [TCP PDU reassembled in 217]"
"212","0.056019","151.101.65.140","100.86.235.39","TCP","1510","443  >  56449 [ACK] Seq=68419 Ack=362 Win=383 Len=1444 TSval=867390714 TSecr=921684359 [TCP PDU reassembled in 217]"
"213","0.056020","151.101.65.140","100.86.235.39","TCP","1510","443  >  56449 [ACK] Seq=69863 Ack=362 Win=383 Len=1444 TSval=867390714 TSecr=921684359 [TCP PDU reassembled in 217]"
"214","0.056021","151.101.65.140","100.86.235.39","TCP","1510","443  >  56449 [ACK] Seq=71307 Ack=362 Win=383 Len=1444 TSval=867390714 TSecr=921684359 [TCP PDU reassembled in 217]"
"215","0.056022","151.101.65.140","100.86.235.39","TCP","1510","443  >  56449 [ACK] Seq=72751 Ack=362 Win=383 Len=1444 TSval=867390714 TSecr=921684359 [TCP PDU reassembled in 217]"
"216","0.056022","151.101.65.140","100.86.235.39","TCP","1510","443  >  56449 [ACK] Seq=74195 Ack=362 Win=383 Len=1444 TSval=867390714 TSecr=921684359 [TCP PDU reassembled in 217]"
"217","0.056023","151.101.65.140","100.86.235.39","TLSv1.2","1510","Application Data, Application Data"
"218","0.056179","100.86.235.39","151.101.1.140","TCP","66","56466  >  443 [ACK] Seq=1 Ack=69081 Win=2365 Len=0 TSval=2554129205 TSecr=211680894"
"219","0.056182","100.86.235.39","151.101.1.140","TCP","66","56444  >  443 [ACK] Seq=407 Ack=52670 Win=2220 Len=0 TSval=1368124286 TSecr=3958004395"
"220","0.056183","100.86.235.39","151.101.65.140","TCP","78","[TCP Dup ACK 153#11] 56449  >  443 [ACK] Seq=362 Ack=35207 Win=2229 Len=0 TSval=921684383 TSecr=867390712 SLE=36651 SRE=77083"
"221","0.056421","100.86.235.39","151.101.1.140","TCP","66","[TCP Window Update] 56466  >  443 [ACK] Seq=1 Ack=69081 Win=2591 Len=0 TSval=2554129205 TSecr=211680894"
"222","0.056947","151.101.65.140","100.86.235.39","TCP","1510","443  >  56449 [ACK] Seq=77083 Ack=362 Win=383 Len=1444 TSval=867390714 TSecr=921684359 [TCP PDU reassembled in 247]"
"223","0.056948","151.101.65.140","100.86.235.39","TCP","1510","443  >  56449 [PSH, ACK] Seq=78527 Ack=362 Win=383 Len=1444 TSval=867390714 TSecr=921684359 [TCP PDU reassembled in 247]"
"224","0.056949","151.101.1.140","100.86.235.39","TCP","1510","443  >  56466 [ACK] Seq=69081 Ack=1 Win=308 Len=1444 TSval=211680895 TSecr=2554129186 [TCP PDU reassembled in 252]"
"225","0.056950","151.101.1.140","100.86.235.39","TCP","1510","443  >  56466 [ACK] Seq=70525 Ack=1 Win=308 Len=1444 TSval=211680895 TSecr=2554129186 [TCP PDU reassembled in 252]"
"226","0.057025","100.86.235.39","151.101.1.140","TCP","66","56466  >  443 [ACK] Seq=1 Ack=71969 Win=2545 Len=0 TSval=2554129205 TSecr=211680895"
"227","0.057071","100.86.235.39","151.101.65.140","TCP","78","[TCP Dup ACK 153#12] 56449  >  443 [ACK] Seq=362 Ack=35207 Win=2229 Len=0 TSval=921684383 TSecr=867390712 SLE=36651 SRE=79971"
"228","0.057173","151.101.1.140","100.86.235.39","TCP","1510","443  >  56466 [ACK] Seq=71969 Ack=1 Win=308 Len=1444 TSval=211680895 TSecr=2554129186 [TCP PDU reassembled in 252]"
"229","0.057174","151.101.1.140","100.86.235.39","TCP","1510","443  >  56466 [ACK] Seq=73413 Ack=1 Win=308 Len=1444 TSval=211680895 TSecr=2554129186 [TCP PDU reassembled in 252]"
"230","0.057220","100.86.235.39","151.101.1.140","TCP","66","56466  >  443 [ACK] Seq=1 Ack=74857 Win=2545 Len=0 TSval=2554129206 TSecr=211680895"
"231","0.057300","151.101.1.140","100.86.235.39","TCP","1510","443  >  56466 [ACK] Seq=74857 Ack=1 Win=308 Len=1444 TSval=211680895 TSecr=2554129186 [TCP PDU reassembled in 252]"
"232","0.057301","151.101.1.140","100.86.235.39","TCP","1510","443  >  56466 [ACK] Seq=76301 Ack=1 Win=308 Len=1444 TSval=211680895 TSecr=2554129186 [TCP PDU reassembled in 252]"
"233","0.057302","151.101.1.140","100.86.235.39","TCP","1510","443  >  56466 [PSH, ACK] Seq=77745 Ack=1 Win=308 Len=1444 TSval=211680895 TSecr=2554129186 [TCP PDU reassembled in 252]"
"234","0.057302","151.101.65.140","100.86.235.39","TCP","1510","443  >  56449 [ACK] Seq=79971 Ack=362 Win=383 Len=1444 TSval=867390715 TSecr=921684359 [TCP PDU reassembled in 247]"
"235","0.057343","100.86.235.39","151.101.1.140","TCP","66","56466  >  443 [ACK] Seq=1 Ack=79189 Win=2523 Len=0 TSval=2554129206 TSecr=211680895"
"236","0.057402","151.101.65.140","100.86.235.39","TCP","1510","443  >  56449 [ACK] Seq=81415 Ack=362 Win=383 Len=1444 TSval=867390715 TSecr=921684359 [TCP PDU reassembled in 247]"
"237","0.057403","151.101.65.140","100.86.235.39","TCP","1510","443  >  56449 [ACK] Seq=82859 Ack=362 Win=383 Len=1444 TSval=867390715 TSecr=921684359 [TCP PDU reassembled in 247]"
"238","0.057421","100.86.235.39","151.101.1.140","TCP","66","[TCP Window Update] 56466  >  443 [ACK] Seq=1 Ack=79189 Win=2591 Len=0 TSval=2554129206 TSecr=211680895"
"239","0.057422","100.86.235.39","151.101.65.140","TCP","78","[TCP Dup ACK 153#13] 56449  >  443 [ACK] Seq=362 Ack=35207 Win=2229 Len=0 TSval=921684384 TSecr=867390712 SLE=36651 SRE=81415"
"240","0.057454","100.86.235.39","151.101.65.140","TCP","78","[TCP Dup ACK 153#14] 56449  >  443 [ACK] Seq=362 Ack=35207 Win=2229 Len=0 TSval=921684384 TSecr=867390712 SLE=36651 SRE=84303"
"241","0.057759","151.101.65.140","100.86.235.39","TCP","1510","443  >  56449 [ACK] Seq=84303 Ack=362 Win=383 Len=1444 TSval=867390715 TSecr=921684359 [TCP PDU reassembled in 247]"
"242","0.057761","151.101.65.140","100.86.235.39","TCP","1510","443  >  56449 [ACK] Seq=85747 Ack=362 Win=383 Len=1444 TSval=867390715 TSecr=921684359 [TCP PDU reassembled in 247]"
"243","0.057762","151.101.65.140","100.86.235.39","TCP","1510","443  >  56449 [ACK] Seq=87191 Ack=362 Win=383 Len=1444 TSval=867390715 TSecr=921684359 [TCP PDU reassembled in 247]"
"244","0.057763","151.101.65.140","100.86.235.39","TCP","1510","443  >  56449 [ACK] Seq=88635 Ack=362 Win=383 Len=1444 TSval=867390715 TSecr=921684359 [TCP PDU reassembled in 247]"
"245","0.057815","100.86.235.39","151.101.65.140","TCP","78","[TCP Dup ACK 153#15] 56449  >  443 [ACK] Seq=362 Ack=35207 Win=2229 Len=0 TSval=921684384 TSecr=867390712 SLE=36651 SRE=90079"
"246","0.059573","151.101.65.140","100.86.235.39","TCP","1510","443  >  56449 [ACK] Seq=90079 Ack=362 Win=383 Len=1444 TSval=867390715 TSecr=921684359 [TCP PDU reassembled in 247]"
"247","0.059574","151.101.65.140","100.86.235.39","TLSv1.2","1510","Application Data"
"248","0.059575","151.101.65.140","100.86.235.39","TCP","1510","443  >  56449 [ACK] Seq=92967 Ack=362 Win=383 Len=1444 TSval=867390715 TSecr=921684359 [TCP PDU reassembled in 250]"
"249","0.059576","151.101.65.140","100.86.235.39","TCP","1510","443  >  56449 [ACK] Seq=94411 Ack=362 Win=383 Len=1444 TSval=867390715 TSecr=921684359 [TCP PDU reassembled in 250]"
"250","0.059577","151.101.65.140","100.86.235.39","TLSv1.2","198","Application Data"
"251","0.059578","151.101.1.140","100.86.235.39","TCP","1510","443  >  56466 [ACK] Seq=79189 Ack=1 Win=308 Len=1444 TSval=211680896 TSecr=2554129186 [TCP PDU reassembled in 252]"
"252","0.059579","151.101.1.140","100.86.235.39","TLSv1.2","1510","Application Data, Application Data"
"253","0.059580","151.101.1.140","100.86.235.39","TCP","1510","443  >  56466 [ACK] Seq=82077 Ack=1 Win=308 Len=1444 TSval=211680896 TSecr=2554129186 [TCP PDU reassembled in 302]"
"254","0.059581","151.101.1.140","100.86.235.39","TCP","1510","443  >  56466 [ACK] Seq=83521 Ack=1 Win=308 Len=1444 TSval=211680896 TSecr=2554129186 [TCP PDU reassembled in 302]"
"255","0.059581","151.101.1.140","100.86.235.39","TCP","1510","443  >  56466 [ACK] Seq=84965 Ack=1 Win=308 Len=1444 TSval=211680896 TSecr=2554129186 [TCP PDU reassembled in 302]"
