"No.","Time","Source","Destination","Protocol","Length","Info"
"15","0.027293","100.86.243.187","151.101.1.140","TCP","1514","56485  >  443 [ACK] Seq=1 Ack=1 Win=3925 Len=1448 TSval=2851305642 TSecr=1266250686 [TCP PDU reassembled in 17]"
"16","0.027294","100.86.243.187","151.101.1.140","TCP","1514","56485  >  443 [ACK] Seq=1449 Ack=1 Win=3925 Len=1448 TSval=2851305642 TSecr=1266250686 [TCP PDU reassembled in 17]"
"17","0.027338","100.86.243.187","151.101.1.140","TLSv1.2","233","Application Data"
"18","0.027403","100.86.243.187","151.101.1.140","TLSv1.2","222","Application Data"
"19","0.037336","151.101.1.140","100.86.243.187","TCP","66","443  >  56485 [ACK] Seq=1 Ack=3220 Win=634 Len=0 TSval=1266251137 TSecr=2851305642"
"29","0.053191","100.86.243.187","151.101.1.140","TCP","1514","56485  >  443 [ACK] Seq=3220 Ack=1 Win=3925 Len=1448 TSval=2851305667 TSecr=1266251137 [TCP PDU reassembled in 31]"
"30","0.053193","100.86.243.187","151.101.1.140","TCP","1514","56485  >  443 [ACK] Seq=4668 Ack=1 Win=3925 Len=1448 TSval=2851305667 TSecr=1266251137 [TCP PDU reassembled in 31]"
"31","0.053228","100.86.243.187","151.101.1.140","TLSv1.2","234","Application Data"
"32","0.053286","100.86.243.187","151.101.1.140","TLSv1.2","274","Application Data"
"48","0.065200","151.101.1.140","100.86.243.187","TCP","66","443  >  56485 [ACK] Seq=1 Ack=6492 Win=631 Len=0 TSval=1266251163 TSecr=2851305667"
"56","0.080664","100.86.243.187","151.101.1.140","TLSv1.2","145","Application Data"
"57","0.080962","100.86.243.187","151.101.1.140","TLSv1.2","291","Application Data"
"66","0.092534","151.101.1.140","100.86.243.187","TCP","66","443  >  56509 [ACK] Seq=1 Ack=80 Win=424 Len=0 TSval=3914511917 TSecr=514212444"
"67","0.093695","151.101.1.140","100.86.243.187","TCP","1510","443  >  56509 [ACK] Seq=1 Ack=305 Win=424 Len=1444 TSval=3914511919 TSecr=514212444 [TCP PDU reassembled in 68]"
"68","0.093696","151.101.1.140","100.86.243.187","TLSv1.2","1186","Application Data"
"69","0.093776","100.86.243.187","151.101.1.140","TCP","66","56509  >  443 [ACK] Seq=305 Ack=2565 Win=6985 Len=0 TSval=514212457 TSecr=3914511919"
"70","0.094681","151.101.1.140","100.86.243.187","TCP","1510","443  >  56509 [ACK] Seq=2565 Ack=305 Win=424 Len=1444 TSval=3914511920 TSecr=514212444 [TCP PDU reassembled in 103]"
"71","0.094683","151.101.1.140","100.86.243.187","TCP","1510","443  >  56509 [PSH, ACK] Seq=4009 Ack=305 Win=424 Len=1444 TSval=3914511920 TSecr=514212444 [TCP PDU reassembled in 103]"
"72","0.094757","100.86.243.187","151.101.1.140","TCP","66","56509  >  443 [ACK] Seq=305 Ack=5453 Win=6980 Len=0 TSval=514212457 TSecr=3914511920"
"73","0.095160","151.101.1.140","100.86.243.187","TCP","1510","443  >  56509 [ACK] Seq=5453 Ack=305 Win=424 Len=1444 TSval=3914511922 TSecr=514212444 [TCP PDU reassembled in 103]"
"74","0.095161","151.101.1.140","100.86.243.187","TCP","1510","443  >  56509 [PSH, ACK] Seq=6897 Ack=305 Win=424 Len=1444 TSval=3914511922 TSecr=514212444 [TCP PDU reassembled in 103]"
"76","0.095239","100.86.243.187","151.101.1.140","TCP","66","56509  >  443 [ACK] Seq=305 Ack=8341 Win=6980 Len=0 TSval=514212458 TSecr=3914511922"
"78","0.098614","151.101.1.140","100.86.243.187","TCP","1510","443  >  56509 [ACK] Seq=8341 Ack=305 Win=424 Len=1444 TSval=3914511923 TSecr=514212444 [TCP PDU reassembled in 103]"
"79","0.098615","151.101.1.140","100.86.243.187","TCP","1510","443  >  56509 [PSH, ACK] Seq=9785 Ack=305 Win=424 Len=1444 TSval=3914511923 TSecr=514212444 [TCP PDU reassembled in 103]"
"80","0.098616","151.101.1.140","100.86.243.187","TCP","1510","443  >  56485 [ACK] Seq=1 Ack=6492 Win=639 Len=1444 TSval=1266251197 TSecr=2851305667 [TCP PDU reassembled in 81]"
"81","0.098643","151.101.1.140","100.86.243.187","TLSv1.2","1087","Application Data"
"82","0.098644","151.101.1.140","100.86.243.187","TCP","1510","443  >  56509 [ACK] Seq=11229 Ack=305 Win=424 Len=1444 TSval=3914511925 TSecr=514212444 [TCP PDU reassembled in 103]"
"83","0.098692","100.86.243.187","151.101.1.140","TCP","66","56509  >  443 [ACK] Seq=305 Ack=11229 Win=6980 Len=0 TSval=514212462 TSecr=3914511923"
"84","0.098737","100.86.243.187","151.101.1.140","TCP","66","56485  >  443 [ACK] Seq=6492 Ack=1445 Win=3903 Len=0 TSval=2851305713 TSecr=1266251197"
"85","0.098759","100.86.243.187","151.101.1.140","TCP","66","56509  >  443 [ACK] Seq=305 Ack=12673 Win=6957 Len=0 TSval=514212462 TSecr=3914511925"
"86","0.098784","100.86.243.187","151.101.1.140","TCP","66","56485  >  443 [ACK] Seq=6492 Ack=2466 Win=3925 Len=0 TSval=2851305713 TSecr=1266251197"
"87","0.099240","100.86.243.187","151.101.1.140","TCP","66","[TCP Window Update] 56509  >  443 [ACK] Seq=305 Ack=12673 Win=7025 Len=0 TSval=514212462 TSecr=3914511925"
"88","0.099517","151.101.1.140","100.86.243.187","TCP","1510","443  >  56509 [PSH, ACK] Seq=12673 Ack=305 Win=424 Len=1444 TSval=3914511925 TSecr=514212444 [TCP PDU reassembled in 103]"
"89","0.099518","151.101.1.140","100.86.243.187","TCP","1510","443  >  56509 [ACK] Seq=14117 Ack=305 Win=424 Len=1444 TSval=3914511927 TSecr=514212444 [TCP PDU reassembled in 103]"
"90","0.099520","151.101.1.140","100.86.243.187","TCP","1510","443  >  56509 [PSH, ACK] Seq=15561 Ack=305 Win=424 Len=1444 TSval=3914511927 TSecr=514212444 [TCP PDU reassembled in 103]"
"91","0.099614","100.86.243.187","151.101.1.140","TCP","66","56509  >  443 [ACK] Seq=305 Ack=17005 Win=6957 Len=0 TSval=514212462 TSecr=3914511927"
"92","0.099715","100.86.243.187","151.101.1.140","TCP","66","[TCP Window Update] 56509  >  443 [ACK] Seq=305 Ack=17005 Win=7025 Len=0 TSval=514212463 TSecr=3914511927"
"103","0.104990","151.101.1.140","100.86.243.187","TLSv1.2","1510","Application Data"
"104","0.104990","151.101.1.140","100.86.243.187","TCP","1510","443  >  56509 [PSH, ACK] Seq=18449 Ack=305 Win=424 Len=1444 TSval=3914511929 TSecr=514212444 [TCP PDU reassembled in 168]"
"107","0.104993","151.101.1.140","100.86.243.187","TCP","1510","443  >  56509 [ACK] Seq=19893 Ack=305 Win=424 Len=1444 TSval=3914511931 TSecr=514212444 [TCP PDU reassembled in 168]"
"108","0.104994","151.101.1.140","100.86.243.187","TCP","1510","443  >  56509 [PSH, ACK] Seq=21337 Ack=305 Win=424 Len=1444 TSval=3914511931 TSecr=514212444 [TCP PDU reassembled in 168]"
"111","0.105116","100.86.243.187","151.101.1.140","TCP","66","56509  >  443 [ACK] Seq=305 Ack=22781 Win=6935 Len=0 TSval=514212468 TSecr=3914511931"
"114","0.105391","100.86.243.187","151.101.1.140","TCP","66","[TCP Window Update] 56509  >  443 [ACK] Seq=305 Ack=22781 Win=7025 Len=0 TSval=514212468 TSecr=3914511931"
"116","0.106200","151.101.1.140","100.86.243.187","TCP","1510","443  >  56509 [ACK] Seq=22781 Ack=305 Win=424 Len=1444 TSval=3914511932 TSecr=514212457 [TCP PDU reassembled in 168]"
"117","0.106202","151.101.1.140","100.86.243.187","TCP","1510","443  >  56509 [PSH, ACK] Seq=24225 Ack=305 Win=424 Len=1444 TSval=3914511932 TSecr=514212457 [TCP PDU reassembled in 168]"
"118","0.106283","100.86.243.187","151.101.1.140","TCP","66","56509  >  443 [ACK] Seq=305 Ack=25669 Win=6980 Len=0 TSval=514212469 TSecr=3914511932"
"121","0.107420","151.101.1.140","100.86.243.187","TCP","1510","443  >  56509 [ACK] Seq=25669 Ack=305 Win=424 Len=1444 TSval=3914511934 TSecr=514212457 [TCP PDU reassembled in 168]"
"122","0.107494","100.86.243.187","151.101.1.140","TCP","66","56509  >  443 [ACK] Seq=305 Ack=27113 Win=7002 Len=0 TSval=514212471 TSecr=3914511934"
"124","0.107749","151.101.1.140","100.86.243.187","TCP","1510","443  >  56509 [PSH, ACK] Seq=27113 Ack=305 Win=424 Len=1444 TSval=3914511934 TSecr=514212457 [TCP PDU reassembled in 168]"
"125","0.107814","100.86.243.187","151.101.1.140","TCP","66","56509  >  443 [ACK] Seq=305 Ack=28557 Win=7002 Len=0 TSval=514212471 TSecr=3914511934"
"126","0.108752","151.101.1.140","100.86.243.187","TCP","1510","443  >  56509 [ACK] Seq=28557 Ack=305 Win=424 Len=1444 TSval=3914511936 TSecr=514212458 [TCP PDU reassembled in 168]"
"127","0.109223","151.101.1.140","100.86.243.187","TCP","1510","443  >  56509 [PSH, ACK] Seq=30001 Ack=305 Win=424 Len=1444 TSval=3914511936 TSecr=514212458 [TCP PDU reassembled in 168]"
"128","0.109328","100.86.243.187","151.101.1.140","TCP","66","56509  >  443 [ACK] Seq=305 Ack=31445 Win=7025 Len=0 TSval=514212472 TSecr=3914511936"
"131","0.110837","151.101.1.140","100.86.243.187","TCP","1510","443  >  56509 [ACK] Seq=31445 Ack=305 Win=424 Len=1444 TSval=3914511938 TSecr=514212463 [TCP PDU reassembled in 168]"
"132","0.112126","151.101.1.140","100.86.243.187","TCP","1510","443  >  56509 [PSH, ACK] Seq=32889 Ack=305 Win=424 Len=1444 TSval=3914511938 TSecr=514212463 [TCP PDU reassembled in 168]"
"133","0.112250","100.86.243.187","151.101.1.140","TCP","66","56509  >  443 [ACK] Seq=305 Ack=34333 Win=7025 Len=0 TSval=514212476 TSecr=3914511938"
"134","0.112974","151.101.1.140","100.86.243.187","TCP","1510","[TCP Previous segment not captured] 443  >  56509 [PSH, ACK] Seq=35777 Ack=305 Win=424 Len=1444 TSval=3914511939 TSecr=514212463"
"135","0.113042","100.86.243.187","151.101.1.140","TCP","78","[TCP Dup ACK 133#1] 56509  >  443 [ACK] Seq=305 Ack=34333 Win=7025 Len=0 TSval=514212476 TSecr=3914511938 SLE=35777 SRE=37221"
"139","0.114109","151.101.1.140","100.86.243.187","TCP","1510","443  >  56509 [ACK] Seq=37221 Ack=305 Win=424 Len=1444 TSval=3914511941 TSecr=514212463"
"140","0.114110","151.101.1.140","100.86.243.187","TCP","1510","443  >  56509 [PSH, ACK] Seq=38665 Ack=305 Win=424 Len=1444 TSval=3914511941 TSecr=514212463"
"141","0.114174","100.86.243.187","151.101.1.140","TCP","78","[TCP Dup ACK 133#2] 56509  >  443 [ACK] Seq=305 Ack=34333 Win=7025 Len=0 TSval=514212477 TSecr=3914511938 SLE=35777 SRE=40109"
"142","0.115358","151.101.1.140","100.86.243.187","TCP","1510","443  >  56509 [ACK] Seq=40109 Ack=305 Win=424 Len=1444 TSval=3914511942 TSecr=514212468"
"143","0.115436","100.86.243.187","151.101.1.140","TCP","78","[TCP Dup ACK 133#3] 56509  >  443 [ACK] Seq=305 Ack=34333 Win=7025 Len=0 TSval=514212479 TSecr=3914511938 SLE=35777 SRE=41553"
"144","0.115797","151.101.1.140","100.86.243.187","TCP","1510","443  >  56509 [PSH, ACK] Seq=41553 Ack=305 Win=424 Len=1444 TSval=3914511942 TSecr=514212468"
"145","0.115850","100.86.243.187","151.101.1.140","TCP","78","[TCP Dup ACK 133#4] 56509  >  443 [ACK] Seq=305 Ack=34333 Win=7025 Len=0 TSval=514212479 TSecr=3914511938 SLE=35777 SRE=42997"
"146","0.116923","151.101.1.140","100.86.243.187","TCP","1510","443  >  56509 [ACK] Seq=42997 Ack=305 Win=424 Len=1444 TSval=3914511944 TSecr=514212468"
"147","0.116992","100.86.243.187","151.101.1.140","TCP","78","[TCP Dup ACK 133#5] 56509  >  443 [ACK] Seq=305 Ack=34333 Win=7025 Len=0 TSval=514212480 TSecr=3914511938 SLE=35777 SRE=44441"
"148","0.117728","151.101.1.140","100.86.243.187","TCP","1510","443  >  56509 [PSH, ACK] Seq=44441 Ack=305 Win=424 Len=1444 TSval=3914511944 TSecr=514212468"
"149","0.117821","100.86.243.187","151.101.1.140","TCP","78","[TCP Dup ACK 133#6] 56509  >  443 [ACK] Seq=305 Ack=34333 Win=7025 Len=0 TSval=514212480 TSecr=3914511938 SLE=35777 SRE=45885"
"150","0.118553","151.101.1.140","100.86.243.187","TCP","1510","443  >  56509 [ACK] Seq=45885 Ack=305 Win=424 Len=1444 TSval=3914511946 TSecr=514212469"
"151","0.118613","100.86.243.187","151.101.1.140","TCP","78","[TCP Dup ACK 133#7] 56509  >  443 [ACK] Seq=305 Ack=34333 Win=7025 Len=0 TSval=514212482 TSecr=3914511938 SLE=35777 SRE=47329"
"152","0.119815","151.101.1.140","100.86.243.187","TCP","1510","443  >  56509 [PSH, ACK] Seq=47329 Ack=305 Win=424 Len=1444 TSval=3914511946 TSecr=514212469"
"153","0.119885","100.86.243.187","151.101.1.140","TCP","78","[TCP Dup ACK 133#8] 56509  >  443 [ACK] Seq=305 Ack=34333 Win=7025 Len=0 TSval=514212483 TSecr=3914511938 SLE=35777 SRE=48773"
"154","0.122313","151.101.1.140","100.86.243.187","TCP","1510","443  >  56509 [ACK] Seq=48773 Ack=305 Win=424 Len=1444 TSval=3914511947 TSecr=514212471"
"155","0.122314","151.101.1.140","100.86.243.187","TCP","1510","443  >  56509 [PSH, ACK] Seq=50217 Ack=305 Win=424 Len=1444 TSval=3914511947 TSecr=514212471"
"160","0.122318","151.101.1.140","100.86.243.187","TLSv1.2","1510","Ignored Unknown Record"
"161","0.122319","151.101.1.140","100.86.243.187","TCP","1510","443  >  56509 [PSH, ACK] Seq=53105 Ack=305 Win=424 Len=1444 TSval=3914511949 TSecr=514212472 [TCP PDU reassembled in 1271]"
"162","0.122411","100.86.243.187","151.101.1.140","TCP","78","[TCP Dup ACK 133#9] 56509  >  443 [ACK] Seq=305 Ack=34333 Win=7025 Len=0 TSval=514212486 TSecr=3914511938 SLE=35777 SRE=54549"
"165","0.122959","151.101.1.140","100.86.243.187","TCP","1510","443  >  56509 [ACK] Seq=54549 Ack=305 Win=424 Len=1444 TSval=3914511950 TSecr=514212476 [TCP PDU reassembled in 1271]"
"166","0.122960","151.101.1.140","100.86.243.187","TCP","1510","443  >  56509 [PSH, ACK] Seq=55993 Ack=305 Win=424 Len=1444 TSval=3914511950 TSecr=514212476 [TCP PDU reassembled in 1271]"
"167","0.123037","100.86.243.187","151.101.1.140","TCP","78","[TCP Dup ACK 133#10] 56509  >  443 [ACK] Seq=305 Ack=34333 Win=7025 Len=0 TSval=514212486 TSecr=3914511938 SLE=35777 SRE=57437"
"168","0.125102","151.101.1.140","100.86.243.187","TLSv1.2","1510","[TCP Fast Retransmission] , Application Data"
"169","0.125182","100.86.243.187","151.101.1.140","TCP","66","56509  >  443 [ACK] Seq=305 Ack=57437 Win=6664 Len=0 TSval=514212488 TSecr=3914511952"
"170","0.125329","151.101.1.140","100.86.243.187","TCP","1510","443  >  56509 [ACK] Seq=57437 Ack=305 Win=424 Len=1444 TSval=3914511952 TSecr=514212477 [TCP PDU reassembled in 1271]"
"171","0.125373","100.86.243.187","151.101.1.140","TCP","66","56509  >  443 [ACK] Seq=305 Ack=58881 Win=6901 Len=0 TSval=514212488 TSecr=3914511952"
"172","0.125490","100.86.243.187","151.101.1.140","TCP","66","[TCP Window Update] 56509  >  443 [ACK] Seq=305 Ack=58881 Win=7025 Len=0 TSval=514212488 TSecr=3914511952"
"173","0.127810","151.101.1.140","100.86.243.187","TCP","1510","[TCP Previous segment not captured] 443  >  56509 [ACK] Seq=60325 Ack=305 Win=424 Len=1444 TSval=3914511955 TSecr=514212480 [TCP PDU reassembled in 1271]"
"174","0.127890","100.86.243.187","151.101.1.140","TCP","78","[TCP Dup ACK 171#1] 56509  >  443 [ACK] Seq=305 Ack=58881 Win=7025 Len=0 TSval=514212491 TSecr=3914511952 SLE=60325 SRE=61769"
"175","0.128424","151.101.1.140","100.86.243.187","TCP","1510","443  >  56509 [ACK] Seq=61769 Ack=305 Win=424 Len=1444 TSval=3914511955 TSecr=514212480 [TCP PDU reassembled in 1271]"
"176","0.128491","100.86.243.187","151.101.1.140","TCP","78","[TCP Dup ACK 171#2] 56509  >  443 [ACK] Seq=305 Ack=58881 Win=7025 Len=0 TSval=514212491 TSecr=3914511952 SLE=60325 SRE=63213"
"177","0.132323","151.101.1.140","100.86.243.187","TCP","1510","443  >  56509 [ACK] Seq=63213 Ack=305 Win=424 Len=1444 TSval=3914511959 TSecr=514212486 [TCP PDU reassembled in 1271]"
"178","0.132410","100.86.243.187","151.101.1.140","TCP","78","[TCP Dup ACK 171#3] 56509  >  443 [ACK] Seq=305 Ack=58881 Win=7025 Len=0 TSval=514212496 TSecr=3914511952 SLE=60325 SRE=64657"
"179","0.132693","151.101.1.140","100.86.243.187","TCP","1510","443  >  56509 [PSH, ACK] Seq=64657 Ack=305 Win=424 Len=1444 TSval=3914511959 TSecr=514212486 [TCP PDU reassembled in 1271]"
"180","0.132694","151.101.1.140","100.86.243.187","TCP","1510","443  >  56509 [ACK] Seq=66101 Ack=305 Win=424 Len=1444 TSval=3914511960 TSecr=514212486 [TCP PDU reassembled in 1271]"
"181","0.132748","100.86.243.187","151.101.1.140","TCP","78","[TCP Dup ACK 171#4] 56509  >  443 [ACK] Seq=305 Ack=58881 Win=7025 Len=0 TSval=514212496 TSecr=3914511952 SLE=60325 SRE=67545"
"182","0.133036","151.101.1.140","100.86.243.187","TCP","1510","443  >  56509 [PSH, ACK] Seq=67545 Ack=305 Win=424 Len=1444 TSval=3914511960 TSecr=514212486 [TCP PDU reassembled in 1271]"
"183","0.133082","100.86.243.187","151.101.1.140","TCP","78","[TCP Dup ACK 171#5] 56509  >  443 [ACK] Seq=305 Ack=58881 Win=7025 Len=0 TSval=514212496 TSecr=3914511952 SLE=60325 SRE=68989"
"184","0.133465","151.101.1.140","100.86.243.187","TCP","1510","443  >  56509 [ACK] Seq=68989 Ack=305 Win=424 Len=1444 TSval=3914511960 TSecr=514212486 [TCP PDU reassembled in 1271]"
"185","0.133517","100.86.243.187","151.101.1.140","TCP","78","[TCP Dup ACK 171#6] 56509  >  443 [ACK] Seq=305 Ack=58881 Win=7025 Len=0 TSval=514212497 TSecr=3914511952 SLE=60325 SRE=70433"
"186","0.135050","151.101.1.140","100.86.243.187","TCP","1510","443  >  56509 [PSH, ACK] Seq=70433 Ack=305 Win=424 Len=1444 TSval=3914511960 TSecr=514212486 [TCP PDU reassembled in 1271]"
"187","0.135116","100.86.243.187","151.101.1.140","TCP","78","[TCP Dup ACK 171#7] 56509  >  443 [ACK] Seq=305 Ack=58881 Win=7025 Len=0 TSval=514212498 TSecr=3914511952 SLE=60325 SRE=71877"
"188","0.135926","151.101.1.140","100.86.243.187","TCP","1510","443  >  56509 [ACK] Seq=71877 Ack=305 Win=424 Len=1444 TSval=3914511962 TSecr=514212488 [TCP PDU reassembled in 1271]"
"189","0.135984","100.86.243.187","151.101.1.140","TCP","78","[TCP Dup ACK 171#8] 56509  >  443 [ACK] Seq=305 Ack=58881 Win=7025 Len=0 TSval=514212498 TSecr=3914511952 SLE=60325 SRE=73321"
"190","0.136136","151.101.1.140","100.86.243.187","TCP","1510","443  >  56509 [PSH, ACK] Seq=73321 Ack=305 Win=424 Len=1444 TSval=3914511962 TSecr=514212488 [TCP PDU reassembled in 1271]"
"191","0.136185","100.86.243.187","151.101.1.140","TCP","78","[TCP Dup ACK 171#9] 56509  >  443 [ACK] Seq=305 Ack=58881 Win=7025 Len=0 TSval=514212499 TSecr=3914511952 SLE=60325 SRE=74765"
"192","0.137530","151.101.1.140","100.86.243.187","TCP","1510","443  >  56509 [ACK] Seq=74765 Ack=305 Win=424 Len=1444 TSval=3914511964 TSecr=514212491 [TCP PDU reassembled in 1271]"
"193","0.137593","100.86.243.187","151.101.1.140","TCP","78","[TCP Dup ACK 171#10] 56509  >  443 [ACK] Seq=305 Ack=58881 Win=7025 Len=0 TSval=514212501 TSecr=3914511952 SLE=60325 SRE=76209"
"194","0.138028","151.101.1.140","100.86.243.187","TCP","1510","[TCP Fast Retransmission] 443  >  56509 [ACK] Seq=58881 Ack=305 Win=424 Len=1444 TSval=3914511965 TSecr=514212491 [TCP PDU reassembled in 1271]"
"195","0.138094","100.86.243.187","151.101.1.140","TCP","66","56509  >  443 [ACK] Seq=305 Ack=76209 Win=6754 Len=0 TSval=514212501 TSecr=3914511965"
"196","0.138276","100.86.243.187","151.101.1.140","TCP","66","[TCP Window Update] 56509  >  443 [ACK] Seq=305 Ack=76209 Win=7025 Len=0 TSval=514212501 TSecr=3914511965"
"197","0.142817","151.101.1.140","100.86.243.187","TCP","1510","443  >  56509 [ACK] Seq=76209 Ack=305 Win=424 Len=1444 TSval=3914511970 TSecr=514212496 [TCP PDU reassembled in 1271]"
"198","0.142882","100.86.243.187","151.101.1.140","TCP","66","56509  >  443 [ACK] Seq=305 Ack=77653 Win=7002 Len=0 TSval=514212506 TSecr=3914511970"
"199","0.143543","151.101.1.140","100.86.243.187","TCP","1510","443  >  56509 [ACK] Seq=77653 Ack=305 Win=424 Len=1444 TSval=3914511970 TSecr=514212496 [TCP PDU reassembled in 1271]"
"200","0.143597","100.86.243.187","151.101.1.140","TCP","66","56509  >  443 [ACK] Seq=305 Ack=79097 Win=7002 Len=0 TSval=514212506 TSecr=3914511970"
"201","0.144559","151.101.1.140","100.86.243.187","TCP","1510","443  >  56509 [ACK] Seq=79097 Ack=305 Win=424 Len=1444 TSval=3914511971 TSecr=514212496 [TCP PDU reassembled in 1271]"
"202","0.144608","100.86.243.187","151.101.1.140","TCP","66","56509  >  443 [ACK] Seq=305 Ack=80541 Win=7002 Len=0 TSval=514212508 TSecr=3914511971"
"203","0.145327","151.101.1.140","100.86.243.187","TCP","1510","443  >  56509 [ACK] Seq=80541 Ack=305 Win=424 Len=1444 TSval=3914511972 TSecr=514212498 [TCP PDU reassembled in 1271]"
"204","0.145384","100.86.243.187","151.101.1.140","TCP","66","56509  >  443 [ACK] Seq=305 Ack=81985 Win=7002 Len=0 TSval=514212508 TSecr=3914511972"
"205","0.146918","151.101.1.140","100.86.243.187","TCP","1510","443  >  56509 [ACK] Seq=81985 Ack=305 Win=424 Len=1444 TSval=3914511974 TSecr=514212499 [TCP PDU reassembled in 1271]"
"206","0.146980","100.86.243.187","151.101.1.140","TCP","66","56509  >  443 [ACK] Seq=305 Ack=83429 Win=7002 Len=0 TSval=514212510 TSecr=3914511974"
"207","0.147570","151.101.1.140","100.86.243.187","TCP","1510","443  >  56509 [ACK] Seq=83429 Ack=305 Win=424 Len=1444 TSval=3914511974 TSecr=514212501 [TCP PDU reassembled in 1271]"
"208","0.147617","100.86.243.187","151.101.1.140","TCP","66","56509  >  443 [ACK] Seq=305 Ack=84873 Win=7002 Len=0 TSval=514212510 TSecr=3914511974"
"209","0.147809","151.101.1.140","100.86.243.187","TCP","1510","443  >  56509 [ACK] Seq=84873 Ack=305 Win=424 Len=1444 TSval=3914511975 TSecr=514212501 [TCP PDU reassembled in 1271]"
"210","0.147854","100.86.243.187","151.101.1.140","TCP","66","56509  >  443 [ACK] Seq=305 Ack=86317 Win=7002 Len=0 TSval=514212510 TSecr=3914511975"
"211","0.153164","151.101.1.140","100.86.243.187","TCP","1510","443  >  56509 [ACK] Seq=86317 Ack=305 Win=424 Len=1444 TSval=3914511980 TSecr=514212506 [TCP PDU reassembled in 1271]"
"212","0.153881","100.86.243.187","151.101.1.140","TCP","66","56509  >  443 [ACK] Seq=305 Ack=87761 Win=7002 Len=0 TSval=514212517 TSecr=3914511980"
"213","0.153911","151.101.1.140","100.86.243.187","TCP","1510","443  >  56485 [ACK] Seq=2466 Ack=6492 Win=639 Len=1444 TSval=1266251252 TSecr=2851305713 [TCP PDU reassembled in 214]"
"214","0.153912","151.101.1.140","100.86.243.187","TLSv1.2","389","Application Data"
"215","0.153912","151.101.1.140","100.86.243.187","TCP","155","443  >  56509 [PSH, ACK] Seq=87761 Ack=305 Win=424 Len=89 TSval=3914511980 TSecr=514212506 [TCP PDU reassembled in 1271]"
"216","0.153973","100.86.243.187","151.101.1.140","TCP","66","56509  >  443 [ACK] Seq=305 Ack=87850 Win=7024 Len=0 TSval=514212517 TSecr=3914511980"
"217","0.154008","100.86.243.187","151.101.1.140","TCP","66","56485  >  443 [ACK] Seq=6492 Ack=4233 Win=3925 Len=0 TSval=2851305768 TSecr=1266251252"
"218","0.169938","100.86.243.187","151.101.1.140","TCP","1514","56485  >  443 [ACK] Seq=6492 Ack=4233 Win=3925 Len=1448 TSval=2851305784 TSecr=1266251252 [TCP PDU reassembled in 220]"
"219","0.169939","100.86.243.187","151.101.1.140","TCP","1514","56485  >  443 [ACK] Seq=7940 Ack=4233 Win=3925 Len=1448 TSval=2851305784 TSecr=1266251252 [TCP PDU reassembled in 220]"
"220","0.169977","100.86.243.187","151.101.1.140","TLSv1.2","181","Application Data"
"221","0.170044","100.86.243.187","151.101.1.140","TCP","1514","56485  >  443 [ACK] Seq=9503 Ack=4233 Win=3925 Len=1448 TSval=2851305784 TSecr=1266251252 [TCP PDU reassembled in 223]"
"222","0.170046","100.86.243.187","151.101.1.140","TCP","1514","56485  >  443 [ACK] Seq=10951 Ack=4233 Win=3925 Len=1448 TSval=2851305784 TSecr=1266251252 [TCP PDU reassembled in 223]"
"223","0.170058","100.86.243.187","151.101.1.140","TLSv1.2","328","Application Data"
"226","0.178342","100.86.243.187","151.101.1.140","TCP","1514","56485  >  443 [ACK] Seq=12661 Ack=4233 Win=3925 Len=1448 TSval=2851305792 TSecr=1266251252 [TCP PDU reassembled in 228]"
"227","0.178344","100.86.243.187","151.101.1.140","TCP","1514","56485  >  443 [ACK] Seq=14109 Ack=4233 Win=3925 Len=1448 TSval=2851305792 TSecr=1266251252 [TCP PDU reassembled in 228]"
"228","0.178371","100.86.243.187","151.101.1.140","TLSv1.2","203","Application Data"
"229","0.180453","151.101.1.140","100.86.243.187","TCP","66","443  >  56485 [ACK] Seq=4233 Ack=12661 Win=629 Len=0 TSval=1266251279 TSecr=2851305784"
"231","0.188207","151.101.1.140","100.86.243.187","TCP","66","443  >  56485 [ACK] Seq=4233 Ack=14109 Win=635 Len=0 TSval=1266251288 TSecr=2851305792"
"232","0.188207","151.101.1.140","100.86.243.187","TCP","66","443  >  56485 [ACK] Seq=4233 Ack=15694 Win=635 Len=0 TSval=1266251288 TSecr=2851305792"
"236","0.205401","100.86.243.187","151.101.1.140","TCP","1514","56485  >  443 [ACK] Seq=15694 Ack=4233 Win=3925 Len=1448 TSval=2851305820 TSecr=1266251288 [TCP PDU reassembled in 238]"
"237","0.205404","100.86.243.187","151.101.1.140","TCP","1514","56485  >  443 [ACK] Seq=17142 Ack=4233 Win=3925 Len=1448 TSval=2851305820 TSecr=1266251288 [TCP PDU reassembled in 238]"
"238","0.205439","100.86.243.187","151.101.1.140","TLSv1.2","201","Application Data"
"239","0.206323","151.101.1.140","100.86.243.187","TCP","1510","443  >  56485 [ACK] Seq=4233 Ack=15694 Win=639 Len=1444 TSval=1266251306 TSecr=2851305792 [TCP PDU reassembled in 241]"
"240","0.206407","100.86.243.187","151.101.1.140","TCP","66","56485  >  443 [ACK] Seq=18725 Ack=5677 Win=3903 Len=0 TSval=2851305821 TSecr=1266251306"
"241","0.206611","151.101.1.140","100.86.243.187","TLSv1.2","931","Application Data"
"242","0.206661","100.86.243.187","151.101.1.140","TCP","66","56485  >  443 [ACK] Seq=18725 Ack=6542 Win=3912 Len=0 TSval=2851305821 TSecr=1266251306"
"243","0.210089","151.101.1.140","100.86.243.187","TCP","1510","443  >  56485 [ACK] Seq=6542 Ack=15694 Win=639 Len=1444 TSval=1266251310 TSecr=2851305792 [TCP PDU reassembled in 244]"
"244","0.210091","151.101.1.140","100.86.243.187","TLSv1.2","229","Application Data"
"245","0.210209","100.86.243.187","151.101.1.140","TCP","66","56485  >  443 [ACK] Seq=18725 Ack=8149 Win=3925 Len=0 TSval=2851305824 TSecr=1266251310"
"246","0.215823","151.101.1.140","100.86.243.187","TCP","66","443  >  56485 [ACK] Seq=8149 Ack=18725 Win=634 Len=0 TSval=1266251315 TSecr=2851305821"
"249","0.241871","100.86.243.187","151.101.1.140","TCP","1514","56485  >  443 [ACK] Seq=18725 Ack=8149 Win=3925 Len=1448 TSval=2851305856 TSecr=1266251315 [TCP PDU reassembled in 250]"
"250","0.241912","100.86.243.187","151.101.1.140","TLSv1.2","1492","Application Data"
"251","0.243742","100.86.243.187","151.101.1.140","TCP","1514","56485  >  443 [ACK] Seq=21599 Ack=8149 Win=3925 Len=1448 TSval=2851305858 TSecr=1266251315 [TCP PDU reassembled in 253]"
"252","0.243744","100.86.243.187","151.101.1.140","TCP","1514","56485  >  443 [ACK] Seq=23047 Ack=8149 Win=3925 Len=1448 TSval=2851305858 TSecr=1266251315 [TCP PDU reassembled in 253]"
"253","0.243778","100.86.243.187","151.101.1.140","TLSv1.2","79","Application Data"
"254","0.251404","151.101.1.140","100.86.243.187","TCP","1510","443  >  56485 [ACK] Seq=8149 Ack=18725 Win=639 Len=1444 TSval=1266251351 TSecr=2851305824 [TCP PDU reassembled in 255]"
"255","0.251405","151.101.1.140","100.86.243.187","TLSv1.2","951","Application Data"
"256","0.251496","100.86.243.187","151.101.1.140","TCP","66","56485  >  443 [ACK] Seq=24508 Ack=10478 Win=3889 Len=0 TSval=2851305866 TSecr=1266251351"
"257","0.254403","151.101.1.140","100.86.243.187","TCP","66","443  >  56485 [ACK] Seq=10478 Ack=24508 Win=630 Len=0 TSval=1266251354 TSecr=2851305858"
"258","0.278034","151.101.1.140","100.86.243.187","TCP","1510","443  >  56485 [ACK] Seq=10478 Ack=24508 Win=639 Len=1444 TSval=1266251377 TSecr=2851305866 [TCP PDU reassembled in 259]"
"259","0.278036","151.101.1.140","100.86.243.187","TLSv1.2","335","Application Data"
"260","0.278131","100.86.243.187","151.101.1.140","TCP","66","56485  >  443 [ACK] Seq=24508 Ack=12191 Win=3899 Len=0 TSval=2851305892 TSecr=1266251377"
"261","0.285532","151.101.1.140","100.86.243.187","TCP","1510","443  >  56485 [ACK] Seq=12191 Ack=24508 Win=639 Len=1444 TSval=1266251385 TSecr=2851305866 [TCP PDU reassembled in 262]"
"262","0.285558","151.101.1.140","100.86.243.187","TLSv1.2","1006","Application Data"
"263","0.285616","100.86.243.187","151.101.1.140","TCP","66","56485  >  443 [ACK] Seq=24508 Ack=13635 Win=3903 Len=0 TSval=2851305900 TSecr=1266251385"
"264","0.285721","100.86.243.187","151.101.1.140","TCP","66","56485  >  443 [ACK] Seq=24508 Ack=14575 Win=3925 Len=0 TSval=2851305900 TSecr=1266251385"
"268","0.326384","151.101.1.140","100.86.243.187","TLSv1.2","438","Application Data"
"269","0.326537","100.86.243.187","151.101.1.140","TCP","66","56485  >  443 [ACK] Seq=24508 Ack=14947 Win=3925 Len=0 TSval=2851305941 TSecr=1266251426"
"270","0.362577","100.86.243.187","151.101.1.140","TCP","1514","56485  >  443 [ACK] Seq=24508 Ack=14947 Win=3925 Len=1448 TSval=2851305977 TSecr=1266251426 [TCP PDU reassembled in 272]"
"271","0.362580","100.86.243.187","151.101.1.140","TCP","1514","56485  >  443 [ACK] Seq=25956 Ack=14947 Win=3925 Len=1448 TSval=2851305977 TSecr=1266251426 [TCP PDU reassembled in 272]"
"272","0.362624","100.86.243.187","151.101.1.140","TLSv1.2","97","Application Data"
"273","0.365691","100.86.243.187","151.101.1.140","TCP","1514","56485  >  443 [ACK] Seq=27435 Ack=14947 Win=3925 Len=1448 TSval=2851305980 TSecr=1266251426 [TCP PDU reassembled in 275]"
"274","0.365693","100.86.243.187","151.101.1.140","TCP","1514","56485  >  443 [ACK] Seq=28883 Ack=14947 Win=3925 Len=1448 TSval=2851305980 TSecr=1266251426 [TCP PDU reassembled in 275]"
"275","0.365729","100.86.243.187","151.101.1.140","TLSv1.2","77","Application Data"
"276","0.366365","100.86.243.187","151.101.1.140","TCP","1514","56485  >  443 [ACK] Seq=30342 Ack=14947 Win=3925 Len=1448 TSval=2851305980 TSecr=1266251426 [TCP PDU reassembled in 278]"
"277","0.366368","100.86.243.187","151.101.1.140","TCP","1514","56485  >  443 [ACK] Seq=31790 Ack=14947 Win=3925 Len=1448 TSval=2851305980 TSecr=1266251426 [TCP PDU reassembled in 278]"
"278","0.366395","100.86.243.187","151.101.1.140","TLSv1.2","92","Application Data"
"279","0.373009","151.101.1.140","100.86.243.187","TCP","66","443  >  56485 [ACK] Seq=14947 Ack=27435 Win=634 Len=0 TSval=1266251472 TSecr=2851305977"
"280","0.374612","100.86.243.187","151.101.1.140","TCP","1514","56485  >  443 [ACK] Seq=33264 Ack=14947 Win=3925 Len=1448 TSval=2851305989 TSecr=1266251472 [TCP PDU reassembled in 282]"
"281","0.374615","100.86.243.187","151.101.1.140","TCP","1514","56485  >  443 [ACK] Seq=34712 Ack=14947 Win=3925 Len=1448 TSval=2851305989 TSecr=1266251472 [TCP PDU reassembled in 282]"
"282","0.374653","100.86.243.187","151.101.1.140","TLSv1.2","231","Application Data"
"283","0.374715","100.86.243.187","151.101.1.140","TLSv1.2","146","Application Data"
"284","0.376918","151.101.1.140","100.86.243.187","TCP","66","443  >  56485 [ACK] Seq=14947 Ack=30342 Win=629 Len=0 TSval=1266251475 TSecr=2851305980"
"285","0.376919","151.101.1.140","100.86.243.187","TCP","66","443  >  56485 [ACK] Seq=14947 Ack=33264 Win=631 Len=0 TSval=1266251476 TSecr=2851305980"
"292","0.384538","151.101.1.140","100.86.243.187","TCP","66","443  >  56485 [ACK] Seq=14947 Ack=36405 Win=631 Len=0 TSval=1266251484 TSecr=2851305989"
"293","0.395906","151.101.1.140","100.86.243.187","TCP","1510","443  >  56485 [ACK] Seq=14947 Ack=36405 Win=639 Len=1444 TSval=1266251495 TSecr=2851305989 [TCP PDU reassembled in 294]"
"294","0.395907","151.101.1.140","100.86.243.187","TLSv1.2","320","Application Data"
"295","0.396012","100.86.243.187","151.101.1.140","TCP","66","56485  >  443 [ACK] Seq=36405 Ack=16645 Win=3899 Len=0 TSval=2851306010 TSecr=1266251495"
"296","0.401552","151.101.1.140","100.86.243.187","TCP","1510","443  >  56485 [ACK] Seq=16645 Ack=36405 Win=639 Len=1444 TSval=1266251501 TSecr=2851305989 [TCP PDU reassembled in 297]"
"297","0.401574","151.101.1.140","100.86.243.187","TLSv1.2","903","Application Data"
"298","0.401629","100.86.243.187","151.101.1.140","TCP","66","56485  >  443 [ACK] Seq=36405 Ack=18089 Win=3903 Len=0 TSval=2851306016 TSecr=1266251501"
"299","0.401725","100.86.243.187","151.101.1.140","TCP","66","56485  >  443 [ACK] Seq=36405 Ack=18926 Win=3925 Len=0 TSval=2851306016 TSecr=1266251501"
"300","0.405343","151.101.1.140","100.86.243.187","TCP","1510","443  >  56485 [ACK] Seq=18926 Ack=36405 Win=639 Len=1444 TSval=1266251505 TSecr=2851305989 [TCP PDU reassembled in 301]"
"301","0.405365","151.101.1.140","100.86.243.187","TLSv1.2","343","Application Data"
"302","0.405499","100.86.243.187","151.101.1.140","TCP","66","56485  >  443 [ACK] Seq=36405 Ack=20647 Win=3925 Len=0 TSval=2851306020 TSecr=1266251505"
"303","0.410274","151.101.1.140","100.86.243.187","TLSv1.2","112","Application Data"
"304","0.410390","100.86.243.187","151.101.1.140","TCP","66","56485  >  443 [ACK] Seq=36405 Ack=20693 Win=3925 Len=0 TSval=2851306025 TSecr=1266251509"
"305","0.428426","151.101.1.140","100.86.243.187","TCP","1510","443  >  56485 [ACK] Seq=20693 Ack=36405 Win=639 Len=1444 TSval=1266251527 TSecr=2851306025 [TCP PDU reassembled in 308]"
"306","0.428450","151.101.1.140","100.86.243.187","TCP","1510","443  >  56485 [PSH, ACK] Seq=22137 Ack=36405 Win=639 Len=1444 TSval=1266251527 TSecr=2851306025 [TCP PDU reassembled in 308]"
"307","0.428553","100.86.243.187","151.101.1.140","TCP","66","56485  >  443 [ACK] Seq=36405 Ack=23581 Win=3925 Len=0 TSval=2851306043 TSecr=1266251527"
"308","0.430460","151.101.1.140","100.86.243.187","TLSv1.2","465","Application Data"
"309","0.430595","100.86.243.187","151.101.1.140","TCP","66","56485  >  443 [ACK] Seq=36405 Ack=23980 Win=3925 Len=0 TSval=2851306045 TSecr=1266251529"
"314","0.461088","151.101.1.140","100.86.243.187","TLSv1.2","107","Application Data"
"315","0.461233","100.86.243.187","151.101.1.140","TCP","66","56485  >  443 [ACK] Seq=36405 Ack=24021 Win=3925 Len=0 TSval=2851306075 TSecr=1266251560"
"316","0.461546","151.101.1.140","100.86.243.187","TLSv1.2","815","Application Data"
"317","0.461638","100.86.243.187","151.101.1.140","TCP","66","56485  >  443 [ACK] Seq=36405 Ack=24770 Win=3925 Len=0 TSval=2851306075 TSecr=1266251561"
"318","0.461728","151.101.1.140","100.86.243.187","TLSv1.2","107","Application Data"
"319","0.461798","100.86.243.187","151.101.1.140","TCP","66","56485  >  443 [ACK] Seq=36405 Ack=24811 Win=3925 Len=0 TSval=2851306075 TSecr=1266251561"
"385","0.772784","151.101.1.140","100.86.243.187","TLSv1.2","1051","Application Data"
"386","0.772787","151.101.1.140","100.86.243.187","TLSv1.2","97","Application Data"
"387","0.773075","100.86.243.187","151.101.1.140","TCP","66","56485  >  443 [ACK] Seq=36405 Ack=25827 Win=3925 Len=0 TSval=2851306387 TSecr=1266251856"
"388","0.774738","100.86.243.187","151.101.1.140","TCP","1514","56485  >  443 [ACK] Seq=36405 Ack=25827 Win=3925 Len=1448 TSval=2851306389 TSecr=1266251856 [TCP PDU reassembled in 390]"
"389","0.774742","100.86.243.187","151.101.1.140","TCP","1514","56485  >  443 [ACK] Seq=37853 Ack=25827 Win=3925 Len=1448 TSval=2851306389 TSecr=1266251856 [TCP PDU reassembled in 390]"
"390","0.774793","100.86.243.187","151.101.1.140","TLSv1.2","234","Application Data"
"391","0.774863","100.86.243.187","151.101.1.140","TCP","1514","56485  >  443 [ACK] Seq=39469 Ack=25827 Win=3925 Len=1448 TSval=2851306389 TSecr=1266251856 [TCP PDU reassembled in 392]"
"392","0.774875","100.86.243.187","151.101.1.140","TLSv1.2","1063","Application Data"
"402","0.798734","151.101.1.140","100.86.243.187","TCP","97","[TCP Spurious Retransmission] 443  >  56485 [PSH, ACK] Seq=25796 Ack=36405 Win=639 Len=31 TSval=1266251889 TSecr=2851306075"
"403","0.798735","151.101.1.140","100.86.243.187","TCP","66","443  >  56485 [ACK] Seq=25827 Ack=41914 Win=635 Len=0 TSval=1266251896 TSecr=2851306389"
"404","0.798835","100.86.243.187","151.101.1.140","TCP","78","[TCP Dup ACK 387#1] 56485  >  443 [ACK] Seq=41914 Ack=25827 Win=3925 Len=0 TSval=2851306413 TSecr=1266251889 SLE=25796 SRE=25827"
"416","0.831484","151.101.1.140","100.86.243.187","TCP","1510","443  >  56485 [ACK] Seq=25827 Ack=41914 Win=639 Len=1444 TSval=1266251929 TSecr=2851306413 [TCP PDU reassembled in 418]"
"417","0.831598","100.86.243.187","151.101.1.140","TCP","66","56485  >  443 [ACK] Seq=41914 Ack=27271 Win=3903 Len=0 TSval=2851306446 TSecr=1266251929"
"418","0.834647","151.101.1.140","100.86.243.187","TLSv1.2","368","Application Data"
"419","0.834726","100.86.243.187","151.101.1.140","TCP","66","56485  >  443 [ACK] Seq=41914 Ack=27573 Win=3921 Len=0 TSval=2851306449 TSecr=1266251929"
"423","1.045131","151.101.1.140","100.86.243.187","TLSv1.2","160","Application Data"
"424","1.045207","100.86.243.187","151.101.1.140","TCP","66","56485  >  443 [ACK] Seq=41914 Ack=27667 Win=3924 Len=0 TSval=2851306659 TSecr=1266252141"
"425","1.048824","151.101.1.140","100.86.243.187","TLSv1.2","232","Application Data"
"426","1.049041","100.86.243.187","151.101.1.140","TCP","66","56485  >  443 [ACK] Seq=41914 Ack=27833 Win=3925 Len=0 TSval=2851306663 TSecr=1266252147"
"427","1.051007","151.101.1.140","100.86.243.187","TCP","1510","443  >  56485 [ACK] Seq=27833 Ack=41914 Win=639 Len=1444 TSval=1266252149 TSecr=2851306449 [TCP PDU reassembled in 428]"
"428","1.053137","151.101.1.140","100.86.243.187","TLSv1.2","1432","Application Data"
"429","1.053247","100.86.243.187","151.101.1.140","TCP","66","56485  >  443 [ACK] Seq=41914 Ack=30643 Win=3925 Len=0 TSval=2851306667 TSecr=1266252149"
"430","1.053879","151.101.1.140","100.86.243.187","TLSv1.2","1139","Application Data"
"431","1.053880","151.101.1.140","100.86.243.187","TLSv1.2","1503","Application Data, Application Data, Application Data"
"432","1.054047","100.86.243.187","151.101.1.140","TCP","66","56485  >  443 [ACK] Seq=41914 Ack=33153 Win=3925 Len=0 TSval=2851306667 TSecr=1266252152"
"433","1.056557","151.101.1.140","100.86.243.187","TLSv1.2","1289","Application Data, Application Data, Application Data"
"434","1.056652","151.101.1.140","100.86.243.187","TLSv1.2","390","Application Data, Application Data"
"435","1.056951","100.86.243.187","151.101.1.140","TCP","66","56485  >  443 [ACK] Seq=41914 Ack=34700 Win=3925 Len=0 TSval=2851306671 TSecr=1266252154"
"436","1.067074","151.101.1.140","100.86.243.187","TLSv1.2","228","Application Data"
"437","1.067292","100.86.243.187","151.101.1.140","TCP","66","56485  >  443 [ACK] Seq=41914 Ack=34862 Win=3925 Len=0 TSval=2851306681 TSecr=1266252166"
"438","1.068032","151.101.1.140","100.86.243.187","TLSv1.2","229","Application Data"
"439","1.068144","100.86.243.187","151.101.1.140","TCP","66","56485  >  443 [ACK] Seq=41914 Ack=35025 Win=3925 Len=0 TSval=2851306681 TSecr=1266252167"
"440","1.075650","151.101.1.140","100.86.243.187","TLSv1.2","230","Application Data"
"441","1.075817","100.86.243.187","151.101.1.140","TCP","66","56485  >  443 [ACK] Seq=41914 Ack=35189 Win=3925 Len=0 TSval=2851306690 TSecr=1266252174"
"442","1.099544","151.101.1.140","100.86.243.187","TLSv1.2","352","Application Data"
"443","1.099843","100.86.243.187","151.101.1.140","TCP","66","56485  >  443 [ACK] Seq=41914 Ack=35475 Win=3925 Len=0 TSval=2851306714 TSecr=1266252198"
"444","1.102863","151.101.1.140","100.86.243.187","TLSv1.2","233","Application Data"
"445","1.103161","100.86.243.187","151.101.1.140","TCP","66","56485  >  443 [ACK] Seq=41914 Ack=35642 Win=3925 Len=0 TSval=2851306717 TSecr=1266252202"
"446","1.103408","151.101.1.140","100.86.243.187","TLSv1.2","390","Application Data"
"447","1.103604","100.86.243.187","151.101.1.140","TCP","66","56485  >  443 [ACK] Seq=41914 Ack=35966 Win=3925 Len=0 TSval=2851306717 TSecr=1266252203"
"448","1.107799","151.101.1.140","100.86.243.187","TLSv1.2","905","Application Data"
"449","1.108110","100.86.243.187","151.101.1.140","TCP","66","56485  >  443 [ACK] Seq=41914 Ack=36805 Win=3925 Len=0 TSval=2851306722 TSecr=1266252206"
"450","1.108274","151.101.1.140","100.86.243.187","TCP","1510","443  >  56485 [ACK] Seq=36805 Ack=41914 Win=639 Len=1444 TSval=1266252207 TSecr=2851306690 [TCP PDU reassembled in 454]"
"451","1.108276","151.101.1.140","100.86.243.187","TCP","1510","443  >  56485 [PSH, ACK] Seq=38249 Ack=41914 Win=639 Len=1444 TSval=1266252207 TSecr=2851306690 [TCP PDU reassembled in 454]"
"452","1.108476","100.86.243.187","151.101.1.140","TCP","66","56485  >  443 [ACK] Seq=41914 Ack=39693 Win=3925 Len=0 TSval=2851306722 TSecr=1266252207"
"453","1.110495","151.101.1.140","100.86.243.187","TCP","1510","443  >  56485 [ACK] Seq=39693 Ack=41914 Win=639 Len=1444 TSval=1266252210 TSecr=2851306690 [TCP PDU reassembled in 454]"
"454","1.111478","151.101.1.140","100.86.243.187","TLSv1.2","605","Application Data"
"455","1.111770","100.86.243.187","151.101.1.140","TCP","66","56485  >  443 [ACK] Seq=41914 Ack=41676 Win=3925 Len=0 TSval=2851306726 TSecr=1266252210"
"456","1.112259","151.101.1.140","100.86.243.187","TLSv1.2","1411","Application Data"
"457","1.112533","100.86.243.187","151.101.1.140","TCP","66","56485  >  443 [ACK] Seq=41914 Ack=43021 Win=3925 Len=0 TSval=2851306726 TSecr=1266252211"
