"No.","Time","Source","Destination","Protocol","Length","Info"
"1","0.000000","151.101.65.140","100.86.235.39","SSL","1510","Continuation Data"
"2","0.000001","151.101.65.140","100.86.235.39","SSL","1510","Continuation Data"
"3","0.000413","100.86.235.39","151.101.65.140","TCP","66","56438  >  443 [ACK] Seq=1 Ack=2889 Win=7862 Len=0 TSval=3707456268 TSecr=3000620811"
"4","0.002641","151.101.65.140","100.86.235.39","SSL","1510","Continuation Data"
"5","0.006845","151.101.65.140","100.86.235.39","TCP","1510","443  >  56438 [ACK] Seq=4333 Ack=1 Win=424 Len=1444 TSval=3000620817 TSecr=3707456264 [TCP PDU reassembled in 35]"
"6","0.007340","151.101.65.140","100.86.235.39","TCP","1510","443  >  56438 [PSH, ACK] Seq=5777 Ack=1 Win=424 Len=1444 TSval=3000620817 TSecr=3707456264 [TCP PDU reassembled in 35]"
"7","0.007467","100.86.235.39","151.101.65.140","TCP","66","56438  >  443 [ACK] Seq=1 Ack=7221 Win=7862 Len=0 TSval=3707456275 TSecr=3000620813"
"8","0.010861","151.101.65.140","100.86.235.39","TCP","1510","443  >  56438 [ACK] Seq=7221 Ack=1 Win=424 Len=1444 TSval=3000620821 TSecr=3707456268 [TCP PDU reassembled in 35]"
"9","0.011553","151.101.65.140","100.86.235.39","TCP","1510","443  >  56438 [PSH, ACK] Seq=8665 Ack=1 Win=424 Len=1444 TSval=3000620821 TSecr=3707456268 [TCP PDU reassembled in 35]"
"10","0.011663","100.86.235.39","151.101.65.140","TCP","66","56438  >  443 [ACK] Seq=1 Ack=10109 Win=7862 Len=0 TSval=3707456279 TSecr=3000620821"
"11","0.017931","151.101.65.140","100.86.235.39","TCP","1510","443  >  56438 [ACK] Seq=10109 Ack=1 Win=424 Len=1444 TSval=3000620829 TSecr=3707456275 [TCP PDU reassembled in 35]"
"12","0.018967","151.101.65.140","100.86.235.39","TCP","1510","443  >  56438 [PSH, ACK] Seq=11553 Ack=1 Win=424 Len=1444 TSval=3000620829 TSecr=3707456275 [TCP PDU reassembled in 35]"
"13","0.019092","100.86.235.39","151.101.65.140","TCP","66","56438  >  443 [ACK] Seq=1 Ack=12997 Win=7862 Len=0 TSval=3707456287 TSecr=3000620829"
"14","0.019639","151.101.65.140","100.86.235.39","TCP","1510","443  >  56438 [ACK] Seq=12997 Ack=1 Win=424 Len=1444 TSval=3000620830 TSecr=3707456275 [TCP PDU reassembled in 35]"
"15","0.019639","151.101.65.140","100.86.235.39","TCP","1510","443  >  56438 [PSH, ACK] Seq=14441 Ack=1 Win=424 Len=1444 TSval=3000620830 TSecr=3707456275 [TCP PDU reassembled in 35]"
"16","0.019734","100.86.235.39","151.101.65.140","TCP","66","56438  >  443 [ACK] Seq=1 Ack=15885 Win=7862 Len=0 TSval=3707456287 TSecr=3000620830"
"17","0.022752","151.101.65.140","100.86.235.39","TCP","1510","443  >  56438 [ACK] Seq=15885 Ack=1 Win=424 Len=1444 TSval=3000620833 TSecr=3707456279 [TCP PDU reassembled in 35]"
"18","0.022780","151.101.65.140","100.86.235.39","TCP","1510","443  >  56438 [PSH, ACK] Seq=17329 Ack=1 Win=424 Len=1444 TSval=3000620833 TSecr=3707456279 [TCP PDU reassembled in 35]"
"19","0.022873","100.86.235.39","151.101.65.140","TCP","66","56438  >  443 [ACK] Seq=1 Ack=18773 Win=7862 Len=0 TSval=3707456291 TSecr=3000620833"
"20","0.025169","151.101.65.140","100.86.235.39","TCP","1510","443  >  56438 [ACK] Seq=18773 Ack=1 Win=424 Len=1444 TSval=3000620835 TSecr=3707456279 [TCP PDU reassembled in 35]"
"21","0.028598","151.101.65.140","100.86.235.39","TCP","1510","443  >  56438 [ACK] Seq=20217 Ack=1 Win=424 Len=1444 TSval=3000620840 TSecr=3707456287 [TCP PDU reassembled in 35]"
"22","0.028982","151.101.65.140","100.86.235.39","TCP","1510","443  >  56438 [PSH, ACK] Seq=21661 Ack=1 Win=424 Len=1444 TSval=3000620840 TSecr=3707456287 [TCP PDU reassembled in 35]"
"23","0.029064","100.86.235.39","151.101.65.140","TCP","66","56438  >  443 [ACK] Seq=1 Ack=23105 Win=7862 Len=0 TSval=3707456297 TSecr=3000620835"
"24","0.029756","151.101.65.140","100.86.235.39","TCP","1510","443  >  56438 [ACK] Seq=23105 Ack=1 Win=424 Len=1444 TSval=3000620841 TSecr=3707456287 [TCP PDU reassembled in 35]"
"25","0.033380","151.101.65.140","100.86.235.39","TCP","1510","443  >  56438 [ACK] Seq=24549 Ack=1 Win=424 Len=1444 TSval=3000620844 TSecr=3707456291 [TCP PDU reassembled in 35]"
"26","0.034070","151.101.65.140","100.86.235.39","TCP","1510","443  >  56438 [PSH, ACK] Seq=25993 Ack=1 Win=424 Len=1444 TSval=3000620844 TSecr=3707456291 [TCP PDU reassembled in 35]"
"27","0.034171","100.86.235.39","151.101.65.140","TCP","66","56438  >  443 [ACK] Seq=1 Ack=27437 Win=7862 Len=0 TSval=3707456302 TSecr=3000620841"
"28","0.039025","151.101.65.140","100.86.235.39","TCP","1510","443  >  56438 [ACK] Seq=27437 Ack=1 Win=424 Len=1444 TSval=3000620850 TSecr=3707456297 [TCP PDU reassembled in 35]"
"29","0.039405","151.101.65.140","100.86.235.39","TCP","1510","443  >  56438 [PSH, ACK] Seq=28881 Ack=1 Win=424 Len=1444 TSval=3000620850 TSecr=3707456297 [TCP PDU reassembled in 35]"
"30","0.039505","100.86.235.39","151.101.65.140","TCP","66","56438  >  443 [ACK] Seq=1 Ack=30325 Win=7862 Len=0 TSval=3707456307 TSecr=3000620850"
"31","0.040242","151.101.65.140","100.86.235.39","TCP","1510","443  >  56438 [ACK] Seq=30325 Ack=1 Win=424 Len=1444 TSval=3000620851 TSecr=3707456297 [TCP PDU reassembled in 35]"
"32","0.041279","151.101.65.140","100.86.235.39","TCP","1510","443  >  56438 [PSH, ACK] Seq=31769 Ack=1 Win=424 Len=1444 TSval=3000620851 TSecr=3707456297 [TCP PDU reassembled in 35]"
"33","0.041414","100.86.235.39","151.101.65.140","TCP","66","56438  >  443 [ACK] Seq=1 Ack=33213 Win=7862 Len=0 TSval=3707456310 TSecr=3000620851"
"34","0.043793","151.101.65.140","100.86.235.39","TCP","1510","443  >  56438 [ACK] Seq=33213 Ack=1 Win=424 Len=1444 TSval=3000620855 TSecr=3707456302 [TCP PDU reassembled in 35]"
"35","0.044929","151.101.65.140","100.86.235.39","SSLv2","1510","Encrypted Data, Continuation Data"
"36","0.045061","100.86.235.39","151.101.65.140","TCP","66","56438  >  443 [ACK] Seq=1 Ack=36101 Win=7862 Len=0 TSval=3707456313 TSecr=3000620855"
"37","0.045891","151.101.65.140","100.86.235.39","SSL","1510","Continuation Data"
"38","0.049107","151.101.65.140","100.86.235.39","SSL","1510","Continuation Data"
"39","0.049141","151.101.65.140","100.86.235.39","SSL","1510","Continuation Data"
"40","0.049264","100.86.235.39","151.101.65.140","TCP","66","56438  >  443 [ACK] Seq=1 Ack=40433 Win=7862 Len=0 TSval=3707456317 TSecr=3000620857"
"41","0.051530","100.86.235.39","151.101.65.140","TCP","1514","56383  >  443 [ACK] Seq=1 Ack=1 Win=2048 Len=1448 TSval=1359830486 TSecr=557055395 [TCP PDU reassembled in 43]"
"42","0.051534","100.86.235.39","151.101.65.140","TCP","1514","56383  >  443 [ACK] Seq=1449 Ack=1 Win=2048 Len=1448 TSval=1359830486 TSecr=557055395 [TCP PDU reassembled in 43]"
"43","0.051576","100.86.235.39","151.101.65.140","TLSv1.2","188","Application Data"
"44","0.051633","100.86.235.39","151.101.65.140","TCP","1514","56383  >  443 [ACK] Seq=3019 Ack=1 Win=2048 Len=1448 TSval=1359830486 TSecr=557055395 [TCP PDU reassembled in 45]"
"45","0.051645","100.86.235.39","151.101.65.140","TLSv1.2","1063","Application Data"
"46","0.051866","151.101.65.140","100.86.235.39","SSL","1510","Continuation Data"
"47","0.052182","151.101.65.140","100.86.235.39","SSL","1510","Continuation Data"
"48","0.052273","100.86.235.39","151.101.65.140","TCP","66","56438  >  443 [ACK] Seq=1 Ack=43321 Win=7862 Len=0 TSval=3707456320 TSecr=3000620862"
"49","0.055307","151.101.65.140","100.86.235.39","SSL","1510","Continuation Data"
"50","0.055682","151.101.65.140","100.86.235.39","SSL","1510","Continuation Data"
"51","0.055790","100.86.235.39","151.101.65.140","TCP","66","56438  >  443 [ACK] Seq=1 Ack=46209 Win=7862 Len=0 TSval=3707456324 TSecr=3000620866"
"52","0.059057","151.101.65.140","100.86.235.39","SSL","1510","Continuation Data"
"53","0.059058","151.101.65.140","100.86.235.39","SSL","1510","Continuation Data"
"54","0.059161","100.86.235.39","151.101.65.140","TCP","66","56438  >  443 [ACK] Seq=1 Ack=49097 Win=7862 Len=0 TSval=3707456327 TSecr=3000620870"
"55","0.059724","151.101.65.140","100.86.235.39","SSL","1510","Continuation Data"
"56","0.060057","151.101.65.140","100.86.235.39","SSL","1510","Continuation Data"
"57","0.060123","100.86.235.39","151.101.65.140","TCP","66","56438  >  443 [ACK] Seq=1 Ack=51985 Win=7862 Len=0 TSval=3707456328 TSecr=3000620871"
"58","0.062966","151.101.65.140","100.86.235.39","SSL","1510","Continuation Data"
"59","0.062990","151.101.65.140","100.86.235.39","SSL","1510","Continuation Data"
"60","0.063103","100.86.235.39","151.101.65.140","TCP","66","56438  >  443 [ACK] Seq=1 Ack=54873 Win=7862 Len=0 TSval=3707456331 TSecr=3000620874"
"61","0.063817","151.101.65.140","100.86.235.39","TCP","66","443  >  56383 [ACK] Seq=1 Ack=5464 Win=538 Len=0 TSval=557055471 TSecr=1359830486"
"62","0.065525","151.101.65.140","100.86.235.39","SSL","1510","Continuation Data"
"63","0.065543","151.101.65.140","100.86.235.39","SSL","1510","Continuation Data"
"64","0.065634","100.86.235.39","151.101.65.140","TCP","66","56438  >  443 [ACK] Seq=1 Ack=57761 Win=7862 Len=0 TSval=3707456334 TSecr=3000620876"
"65","0.069132","151.101.65.140","100.86.235.39","SSL","1510","Continuation Data"
"66","0.069943","151.101.65.140","100.86.235.39","SSL","1510","[TCP Previous segment not captured] , Continuation Data"
"67","0.070002","100.86.235.39","151.101.65.140","TCP","78","56438  >  443 [ACK] Seq=1 Ack=59205 Win=7862 Len=0 TSval=3707456337 TSecr=3000620880 SLE=60649 SRE=62093"
"68","0.070544","151.101.65.140","100.86.235.39","SSL","1510","Continuation Data"
"69","0.070588","100.86.235.39","151.101.65.140","TCP","78","[TCP Dup ACK 67#1] 56438  >  443 [ACK] Seq=1 Ack=59205 Win=7862 Len=0 TSval=3707456339 TSecr=3000620880 SLE=60649 SRE=63537"
"70","0.072902","151.101.65.140","100.86.235.39","TCP","1510","443  >  56438 [ACK] Seq=63537 Ack=1 Win=424 Len=1444 TSval=3000620884 TSecr=3707456331"
"71","0.072935","151.101.65.140","100.86.235.39","SSL","1510","Continuation Data"
"72","0.072973","100.86.235.39","151.101.65.140","TCP","78","[TCP Dup ACK 67#2] 56438  >  443 [ACK] Seq=1 Ack=59205 Win=7862 Len=0 TSval=3707456341 TSecr=3000620880 SLE=60649 SRE=64981"
"73","0.073032","100.86.235.39","151.101.65.140","TCP","78","[TCP Dup ACK 67#3] 56438  >  443 [ACK] Seq=1 Ack=59205 Win=7862 Len=0 TSval=3707456341 TSecr=3000620880 SLE=60649 SRE=66425"
"74","0.075370","151.101.65.140","100.86.235.39","SSL","1510","Continuation Data"
"75","0.075408","151.101.65.140","100.86.235.39","SSL","1510","Continuation Data"
"76","0.075459","100.86.235.39","151.101.65.140","TCP","78","[TCP Dup ACK 67#4] 56438  >  443 [ACK] Seq=1 Ack=59205 Win=7862 Len=0 TSval=3707456344 TSecr=3000620880 SLE=60649 SRE=67869"
"77","0.075504","100.86.235.39","151.101.65.140","TCP","78","[TCP Dup ACK 67#5] 56438  >  443 [ACK] Seq=1 Ack=59205 Win=7862 Len=0 TSval=3707456344 TSecr=3000620880 SLE=60649 SRE=69313"
"78","0.079546","151.101.65.140","100.86.235.39","SSL","1510","Continuation Data"
"79","0.079574","151.101.65.140","100.86.235.39","SSL","1510","Continuation Data"
"80","0.079631","100.86.235.39","151.101.65.140","TCP","78","[TCP Dup ACK 67#6] 56438  >  443 [ACK] Seq=1 Ack=59205 Win=7862 Len=0 TSval=3707456348 TSecr=3000620880 SLE=60649 SRE=70757"
"81","0.079665","100.86.235.39","151.101.65.140","TCP","78","[TCP Dup ACK 67#7] 56438  >  443 [ACK] Seq=1 Ack=59205 Win=7862 Len=0 TSval=3707456348 TSecr=3000620880 SLE=60649 SRE=72201"
"82","0.080401","151.101.65.140","100.86.235.39","SSL","1510","Continuation Data"
"83","0.080444","100.86.235.39","151.101.65.140","TCP","78","[TCP Dup ACK 67#8] 56438  >  443 [ACK] Seq=1 Ack=59205 Win=7862 Len=0 TSval=3707456348 TSecr=3000620880 SLE=60649 SRE=73645"
"84","0.080722","151.101.65.140","100.86.235.39","SSL","1510","Continuation Data"
"85","0.080758","100.86.235.39","151.101.65.140","TCP","78","[TCP Dup ACK 67#9] 56438  >  443 [ACK] Seq=1 Ack=59205 Win=7862 Len=0 TSval=3707456349 TSecr=3000620880 SLE=60649 SRE=75089"
"86","0.082801","151.101.65.140","100.86.235.39","SSL","1510","[TCP Fast Retransmission] , Continuation Data"
"87","0.082865","100.86.235.39","151.101.65.140","TCP","66","56438  >  443 [ACK] Seq=1 Ack=75089 Win=7614 Len=0 TSval=3707456351 TSecr=3000620894"
"88","0.083034","151.101.65.140","100.86.235.39","TCP","1510","443  >  56438 [ACK] Seq=75089 Ack=1 Win=424 Len=1444 TSval=3000620894 TSecr=3707456341"
"89","0.083068","100.86.235.39","151.101.65.140","TCP","66","[TCP Window Update] 56438  >  443 [ACK] Seq=1 Ack=75089 Win=7862 Len=0 TSval=3707456351 TSecr=3000620894"
"90","0.083091","100.86.235.39","151.101.65.140","TCP","66","56438  >  443 [ACK] Seq=1 Ack=76533 Win=7840 Len=0 TSval=3707456351 TSecr=3000620894"
"91","0.089410","151.101.65.140","100.86.235.39","SSL","1510","Continuation Data"
"92","0.089485","100.86.235.39","151.101.65.140","TCP","66","56438  >  443 [ACK] Seq=1 Ack=77977 Win=7840 Len=0 TSval=3707456358 TSecr=3000620900"
"93","0.089992","151.101.65.140","100.86.235.39","SSL","1510","Continuation Data"
"94","0.090071","100.86.235.39","151.101.65.140","TCP","66","56438  >  443 [ACK] Seq=1 Ack=79421 Win=7840 Len=0 TSval=3707456358 TSecr=3000620901"
"95","0.090429","151.101.65.140","100.86.235.39","SSL","1510","Continuation Data"
"96","0.090503","100.86.235.39","151.101.65.140","TCP","66","56438  >  443 [ACK] Seq=1 Ack=80865 Win=7840 Len=0 TSval=3707456359 TSecr=3000620902"
"97","0.091334","151.101.65.140","100.86.235.39","SSL","1510","Continuation Data"
"98","0.091399","100.86.235.39","151.101.65.140","TCP","66","56438  >  443 [ACK] Seq=1 Ack=82309 Win=7840 Len=0 TSval=3707456359 TSecr=3000620902"
"99","0.093453","151.101.65.140","100.86.235.39","SSL","1510","Continuation Data"
"100","0.093479","151.101.65.140","100.86.235.39","SSL","1510","Continuation Data"
"101","0.093525","100.86.235.39","151.101.65.140","TCP","66","56438  >  443 [ACK] Seq=1 Ack=83753 Win=7840 Len=0 TSval=3707456362 TSecr=3000620904"
"102","0.093572","100.86.235.39","151.101.65.140","TCP","66","56438  >  443 [ACK] Seq=1 Ack=85197 Win=7817 Len=0 TSval=3707456362 TSecr=3000620904"
"103","0.099537","151.101.65.140","100.86.235.39","SSL","1510","Continuation Data"
"104","0.099563","151.101.65.140","100.86.235.39","SSL","1510","Continuation Data"
"105","0.099619","100.86.235.39","151.101.65.140","TCP","66","56438  >  443 [ACK] Seq=1 Ack=86641 Win=7840 Len=0 TSval=3707456368 TSecr=3000620910"
"106","0.099677","100.86.235.39","151.101.65.140","TCP","66","56438  >  443 [ACK] Seq=1 Ack=88085 Win=7817 Len=0 TSval=3707456368 TSecr=3000620910"
"107","0.100705","151.101.65.140","100.86.235.39","SSL","1510","Continuation Data"
"108","0.100747","100.86.235.39","151.101.65.140","TCP","66","56438  >  443 [ACK] Seq=1 Ack=89529 Win=7840 Len=0 TSval=3707456369 TSecr=3000620912"
"109","0.102463","151.101.65.140","100.86.235.39","SSL","1510","Continuation Data"
"110","0.102500","100.86.235.39","151.101.65.140","TCP","66","56438  >  443 [ACK] Seq=1 Ack=90973 Win=7840 Len=0 TSval=3707456371 TSecr=3000620913"
"111","0.102746","151.101.65.140","100.86.235.39","SSL","1510","Continuation Data"
"112","0.102783","100.86.235.39","151.101.65.140","TCP","66","56438  >  443 [ACK] Seq=1 Ack=92417 Win=7840 Len=0 TSval=3707456371 TSecr=3000620913"
"113","0.104747","151.101.65.140","100.86.235.39","SSL","1510","Continuation Data"
"114","0.104788","100.86.235.39","151.101.65.140","TCP","66","56438  >  443 [ACK] Seq=1 Ack=93861 Win=7840 Len=0 TSval=3707456373 TSecr=3000620916"
"115","0.104937","151.101.65.140","100.86.235.39","SSL","1510","Continuation Data"
"116","0.104976","100.86.235.39","151.101.65.140","TCP","66","56438  >  443 [ACK] Seq=1 Ack=95305 Win=7840 Len=0 TSval=3707456373 TSecr=3000620916"
"117","0.112648","151.101.65.140","100.86.235.39","SSL","1510","Continuation Data"
"118","0.112649","151.101.65.140","100.86.235.39","SSL","1510","Continuation Data"
"119","0.112764","100.86.235.39","151.101.65.140","TCP","66","56438  >  443 [ACK] Seq=1 Ack=98193 Win=7817 Len=0 TSval=3707456381 TSecr=3000620920"
"120","0.113436","151.101.65.140","100.86.235.39","SSL","1510","Continuation Data"
"121","0.113437","151.101.65.140","100.86.235.39","SSL","1510","Continuation Data"
"122","0.113574","100.86.235.39","151.101.65.140","TCP","66","56438  >  443 [ACK] Seq=1 Ack=101081 Win=7862 Len=0 TSval=3707456381 TSecr=3000620923"
"123","0.114355","151.101.65.140","100.86.235.39","TCP","1510","443  >  56438 [ACK] Seq=101081 Ack=1 Win=424 Len=1444 TSval=3000620925 TSecr=3707456373"
"124","0.115585","151.101.65.140","100.86.235.39","SSL","1510","Continuation Data"
"125","0.115673","100.86.235.39","151.101.65.140","TCP","66","56438  >  443 [ACK] Seq=1 Ack=103969 Win=7862 Len=0 TSval=3707456384 TSecr=3000620925"
"126","0.122680","151.101.65.140","100.86.235.39","TCP","1510","443  >  56438 [ACK] Seq=103969 Ack=1 Win=424 Len=1444 TSval=3000620934 TSecr=3707456381"
"127","0.122718","151.101.65.140","100.86.235.39","SSL","1510","Continuation Data"
"128","0.122812","100.86.235.39","151.101.65.140","TCP","66","56438  >  443 [ACK] Seq=1 Ack=106857 Win=7862 Len=0 TSval=3707456390 TSecr=3000620934"
"129","0.123751","151.101.65.140","100.86.235.39","SSL","1510","Continuation Data"
"130","0.124788","151.101.65.140","100.86.235.39","SSL","1510","Continuation Data"
"131","0.124871","100.86.235.39","151.101.65.140","TCP","66","56438  >  443 [ACK] Seq=1 Ack=109745 Win=7862 Len=0 TSval=3707456393 TSecr=3000620935"
"132","0.129466","151.101.65.140","100.86.235.39","SSL","1510","Continuation Data"
"133","0.129468","151.101.65.140","100.86.235.39","SSL","1510","Continuation Data"
"134","0.129631","100.86.235.39","151.101.65.140","TCP","66","56438  >  443 [ACK] Seq=1 Ack=112633 Win=7862 Len=0 TSval=3707456398 TSecr=3000620937"
"135","0.130115","151.101.65.140","100.86.235.39","SSL","1510","Continuation Data"
"136","0.136291","151.101.65.140","100.86.235.39","SSL","1510","Continuation Data"
"137","0.136688","151.101.65.140","100.86.235.39","SSL","1510","Continuation Data"
"138","0.137269","100.86.235.39","151.101.65.140","TCP","66","56438  >  443 [ACK] Seq=1 Ack=116965 Win=7862 Len=0 TSval=3707456405 TSecr=3000620940"
"139","0.137649","151.101.65.140","100.86.235.39","TCP","1510","443  >  56383 [ACK] Seq=1 Ack=5464 Win=538 Len=1444 TSval=557055547 TSecr=1359830486 [TCP PDU reassembled in 140]"
"140","0.137650","151.101.65.140","100.86.235.39","TLSv1.2","295","Application Data"
"141","0.137650","151.101.65.140","100.86.235.39","SSL","1510","Continuation Data"
"142","0.137708","100.86.235.39","151.101.65.140","TCP","66","56383  >  443 [ACK] Seq=5464 Ack=1674 Win=2021 Len=0 TSval=1359830572 TSecr=557055547"
"143","0.138237","151.101.65.140","100.86.235.39","SSL","1510","Continuation Data"
"144","0.138238","151.101.65.140","100.86.235.39","TLSv1.2","209","Application Data"
"145","0.138283","100.86.235.39","151.101.65.140","TCP","66","56383  >  443 [ACK] Seq=5464 Ack=1817 Win=2045 Len=0 TSval=1359830572 TSecr=557055548"
"146","0.138363","100.86.235.39","151.101.65.140","TCP","66","56438  >  443 [ACK] Seq=1 Ack=119853 Win=7862 Len=0 TSval=3707456406 TSecr=3000620949"
"147","0.140311","151.101.65.140","100.86.235.39","SSL","1510","Continuation Data"
"148","0.140707","151.101.65.140","100.86.235.39","TCP","1510","443  >  56438 [PSH, ACK] Seq=121297 Ack=1 Win=424 Len=1444 TSval=3000620951 TSecr=3707456398"
"149","0.140802","100.86.235.39","151.101.65.140","TCP","66","56438  >  443 [ACK] Seq=1 Ack=122741 Win=7862 Len=0 TSval=3707456409 TSecr=3000620951"
"150","0.146967","151.101.65.140","100.86.235.39","SSL","1510","Continuation Data"
"151","0.146968","151.101.65.140","100.86.235.39","SSL","1510","Continuation Data"
"152","0.147114","100.86.235.39","151.101.65.140","TCP","66","56438  >  443 [ACK] Seq=1 Ack=125629 Win=7862 Len=0 TSval=3707456415 TSecr=3000620958"
"153","0.148146","151.101.65.140","100.86.235.39","SSL","1510","Continuation Data"
"154","0.149101","151.101.65.140","100.86.235.39","SSL","1510","Continuation Data"
"155","0.149146","100.86.235.39","151.101.65.140","TCP","66","56438  >  443 [ACK] Seq=1 Ack=128517 Win=7862 Len=0 TSval=3707456416 TSecr=3000620960"
"156","0.151354","151.101.65.140","100.86.235.39","SSL","1510","Continuation Data"
"157","0.151788","151.101.65.140","100.86.235.39","SSL","1510","Continuation Data"
"158","0.151878","100.86.235.39","151.101.65.140","TCP","66","56438  >  443 [ACK] Seq=1 Ack=131405 Win=7862 Len=0 TSval=3707456420 TSecr=3000620962"
"159","0.154398","151.101.65.140","100.86.235.39","SSL","1510","Continuation Data"
"160","0.157430","151.101.65.140","100.86.235.39","SSL","1510","Continuation Data"
"161","0.158000","151.101.65.140","100.86.235.39","SSL","1510","Continuation Data"
"162","0.158119","100.86.235.39","151.101.65.140","TCP","66","56438  >  443 [ACK] Seq=1 Ack=135737 Win=7862 Len=0 TSval=3707456426 TSecr=3000620965"
"163","0.158801","151.101.65.140","100.86.235.39","SSL","1510","Continuation Data"
"164","0.159094","151.101.65.140","100.86.235.39","SSL","1510","Continuation Data"
"165","0.159202","100.86.235.39","151.101.65.140","TCP","66","56438  >  443 [ACK] Seq=1 Ack=138625 Win=7862 Len=0 TSval=3707456427 TSecr=3000620970"
"166","0.162102","151.101.65.140","100.86.235.39","SSL","1510","Continuation Data"
"167","0.162479","151.101.65.140","100.86.235.39","SSL","1510","Continuation Data"
"168","0.162610","100.86.235.39","151.101.65.140","TCP","66","56438  >  443 [ACK] Seq=1 Ack=141513 Win=7862 Len=0 TSval=3707456430 TSecr=3000620973"
"169","0.167876","151.101.65.140","100.86.235.39","SSL","1510","Continuation Data"
"170","0.167929","151.101.65.140","100.86.235.39","SSL","1510","Continuation Data"
"171","0.168139","100.86.235.39","151.101.65.140","TCP","66","56438  >  443 [ACK] Seq=1 Ack=144401 Win=7862 Len=0 TSval=3707456436 TSecr=3000620979"
"172","0.169067","151.101.65.140","100.86.235.39","SSL","1510","Continuation Data"
"173","0.169367","151.101.65.140","100.86.235.39","SSL","1510","Continuation Data"
"174","0.170154","100.86.235.39","151.101.65.140","TCP","66","56438  >  443 [ACK] Seq=1 Ack=147289 Win=7862 Len=0 TSval=3707456437 TSecr=3000620980"
"175","0.170705","151.101.65.140","100.86.235.39","SSL","1510","Continuation Data"
"176","0.170951","151.101.65.140","100.86.235.39","SSL","1510","Continuation Data"
"177","0.171093","100.86.235.39","151.101.65.140","TCP","66","56438  >  443 [ACK] Seq=1 Ack=150177 Win=7862 Len=0 TSval=3707456439 TSecr=3000620982"
"178","0.173438","151.101.65.140","100.86.235.39","SSL","1510","Continuation Data"
"179","0.174071","151.101.65.140","100.86.235.39","SSL","1510","Continuation Data"
"180","0.174195","100.86.235.39","151.101.65.140","TCP","66","56438  >  443 [ACK] Seq=1 Ack=153065 Win=7862 Len=0 TSval=3707456442 TSecr=3000620984"
"181","0.175153","151.101.65.140","100.86.235.39","SSL","1510","Continuation Data"
"182","0.177619","151.101.65.140","100.86.235.39","SSL","1510","Continuation Data"
"183","0.178034","151.101.65.140","100.86.235.39","SSL","1510","Continuation Data"
"184","0.178156","100.86.235.39","151.101.65.140","TCP","66","56438  >  443 [ACK] Seq=1 Ack=157397 Win=7862 Len=0 TSval=3707456446 TSecr=3000620986"
"185","0.179857","151.101.65.140","100.86.235.39","SSL","1510","Continuation Data"
"186","0.180464","151.101.65.140","100.86.235.39","SSL","1510","Continuation Data"
"187","0.180605","100.86.235.39","151.101.65.140","TCP","66","56438  >  443 [ACK] Seq=1 Ack=160285 Win=7862 Len=0 TSval=3707456448 TSecr=3000620991"
"188","0.181223","151.101.65.140","100.86.235.39","SSL","1510","Continuation Data"
"189","0.181487","151.101.65.140","100.86.235.39","SSL","1510","Continuation Data"
"190","0.181590","100.86.235.39","151.101.65.140","TCP","66","56438  >  443 [ACK] Seq=1 Ack=163173 Win=7862 Len=0 TSval=3707456450 TSecr=3000620992"
"191","0.183768","151.101.65.140","100.86.235.39","SSL","1510","Continuation Data"
"192","0.184228","151.101.65.140","100.86.235.39","SSL","1510","Continuation Data"
"193","0.184332","100.86.235.39","151.101.65.140","TCP","66","56438  >  443 [ACK] Seq=1 Ack=166061 Win=7862 Len=0 TSval=3707456452 TSecr=3000620995"
"194","0.187594","151.101.65.140","100.86.235.39","SSL","1510","Continuation Data"
"195","0.187628","151.101.65.140","100.86.235.39","SSL","1510","Continuation Data"
"196","0.187841","100.86.235.39","151.101.65.140","TCP","66","56438  >  443 [ACK] Seq=1 Ack=168949 Win=7862 Len=0 TSval=3707456456 TSecr=3000620999"
"197","0.190796","151.101.65.140","100.86.235.39","SSL","1510","Continuation Data"
"198","0.190833","151.101.65.140","100.86.235.39","SSL","1510","Continuation Data"
"199","0.190945","100.86.235.39","151.101.65.140","TCP","66","56438  >  443 [ACK] Seq=1 Ack=171837 Win=7862 Len=0 TSval=3707456459 TSecr=3000621001"
"200","0.191621","151.101.65.140","100.86.235.39","SSL","1510","Continuation Data"
"201","0.191813","151.101.65.140","100.86.235.39","SSL","1510","Continuation Data"
"202","0.192220","100.86.235.39","151.101.65.140","TCP","66","56438  >  443 [ACK] Seq=1 Ack=174725 Win=7862 Len=0 TSval=3707456460 TSecr=3000621002"
"203","0.194088","151.101.65.140","100.86.235.39","SSL","1510","Continuation Data"
"204","0.194116","151.101.65.140","100.86.235.39","SSL","1510","Continuation Data"
"205","0.194216","100.86.235.39","151.101.65.140","TCP","66","56438  >  443 [ACK] Seq=1 Ack=177613 Win=7862 Len=0 TSval=3707456462 TSecr=3000621005"
"206","0.197516","151.101.65.140","100.86.235.39","SSL","1510","Continuation Data"
"207","0.197550","151.101.65.140","100.86.235.39","TCP","1510","443  >  56438 [PSH, ACK] Seq=179057 Ack=1 Win=424 Len=1444 TSval=3000621009 TSecr=3707456456"
"208","0.197640","100.86.235.39","151.101.65.140","TCP","66","56438  >  443 [ACK] Seq=1 Ack=180501 Win=7862 Len=0 TSval=3707456466 TSecr=3000621009"
"209","0.201010","151.101.65.140","100.86.235.39","SSL","1510","Continuation Data"
"210","0.201461","151.101.65.140","100.86.235.39","SSL","1510","Continuation Data"
"211","0.201650","100.86.235.39","151.101.65.140","TCP","66","56438  >  443 [ACK] Seq=1 Ack=183389 Win=7862 Len=0 TSval=3707456469 TSecr=3000621012"
"212","0.202166","151.101.65.140","100.86.235.39","SSL","1510","Continuation Data"
"213","0.202168","151.101.65.140","100.86.235.39","SSL","1510","Continuation Data"
"214","0.202383","100.86.235.39","151.101.65.140","TCP","66","56438  >  443 [ACK] Seq=1 Ack=186277 Win=7862 Len=0 TSval=3707456471 TSecr=3000621012"
"215","0.203429","151.101.65.140","100.86.235.39","SSL","1510","Continuation Data"
"216","0.203762","151.101.65.140","100.86.235.39","SSL","1510","Continuation Data"
"217","0.203886","100.86.235.39","151.101.65.140","TCP","66","56438  >  443 [ACK] Seq=1 Ack=189165 Win=7862 Len=0 TSval=3707456472 TSecr=3000621014"
"218","0.205660","151.101.65.140","100.86.235.39","SSL","1510","Continuation Data"
"219","0.205855","151.101.65.140","100.86.235.39","SSL","1510","Continuation Data"
"220","0.205935","100.86.235.39","151.101.65.140","TCP","66","56438  >  443 [ACK] Seq=1 Ack=192053 Win=7862 Len=0 TSval=3707456474 TSecr=3000621016"
"221","0.206809","151.101.65.140","100.86.235.39","SSL","1510","Continuation Data"
"222","0.207717","151.101.65.140","100.86.235.39","SSL","1510","Continuation Data"
"223","0.207866","100.86.235.39","151.101.65.140","TCP","66","56438  >  443 [ACK] Seq=1 Ack=194941 Win=7862 Len=0 TSval=3707456475 TSecr=3000621018"
"224","0.210795","151.101.65.140","100.86.235.39","SSL","1510","Continuation Data"
"225","0.211056","151.101.65.140","100.86.235.39","SSL","1510","Continuation Data"
"226","0.211158","100.86.235.39","151.101.65.140","TCP","66","56438  >  443 [ACK] Seq=1 Ack=197829 Win=7862 Len=0 TSval=3707456479 TSecr=3000621022"
"227","0.212328","151.101.65.140","100.86.235.39","SSL","1510","Continuation Data"
"228","0.213175","151.101.65.140","100.86.235.39","SSL","1510","Continuation Data"
"229","0.213290","100.86.235.39","151.101.65.140","TCP","66","56438  >  443 [ACK] Seq=1 Ack=200717 Win=7862 Len=0 TSval=3707456481 TSecr=3000621024"
"230","0.213913","151.101.65.140","100.86.235.39","SSL","1510","Continuation Data"
"231","0.213914","151.101.65.140","100.86.235.39","SSL","1510","Continuation Data"
"232","0.214012","100.86.235.39","151.101.65.140","TCP","66","56438  >  443 [ACK] Seq=1 Ack=203605 Win=7862 Len=0 TSval=3707456482 TSecr=3000621025"
"233","0.215966","151.101.65.140","100.86.235.39","SSL","1510","Continuation Data"
"234","0.215989","151.101.65.140","100.86.235.39","SSL","1510","Continuation Data"
"235","0.216173","100.86.235.39","151.101.65.140","TCP","66","56438  >  443 [ACK] Seq=1 Ack=206493 Win=7862 Len=0 TSval=3707456484 TSecr=3000621026"
"236","0.217527","151.101.65.140","100.86.235.39","SSL","1510","Continuation Data"
"237","0.217776","151.101.65.140","100.86.235.39","SSL","1510","Continuation Data"
"238","0.217851","100.86.235.39","151.101.65.140","TCP","66","56438  >  443 [ACK] Seq=1 Ack=209381 Win=7862 Len=0 TSval=3707456486 TSecr=3000621029"
"239","0.220990","151.101.65.140","100.86.235.39","SSL","1510","Continuation Data"
"240","0.221380","151.101.65.140","100.86.235.39","SSL","1510","Continuation Data"
"241","0.221452","100.86.235.39","151.101.65.140","TCP","66","56438  >  443 [ACK] Seq=1 Ack=212269 Win=7862 Len=0 TSval=3707456489 TSecr=3000621032"
"242","0.223042","151.101.65.140","100.86.235.39","SSL","1510","Continuation Data"
"243","0.223476","151.101.65.140","100.86.235.39","SSL","1510","Continuation Data"
"244","0.223555","100.86.235.39","151.101.65.140","TCP","66","56438  >  443 [ACK] Seq=1 Ack=215157 Win=7862 Len=0 TSval=3707456491 TSecr=3000621034"
"245","0.224017","151.101.65.140","100.86.235.39","SSL","1510","Continuation Data"
"246","0.224017","151.101.65.140","100.86.235.39","SSL","1510","Continuation Data"
"247","0.224081","100.86.235.39","151.101.65.140","TCP","66","56438  >  443 [ACK] Seq=1 Ack=218045 Win=7862 Len=0 TSval=3707456491 TSecr=3000621035"
"248","0.226584","151.101.65.140","100.86.235.39","SSL","1510","Continuation Data"
"249","0.227309","151.101.65.140","100.86.235.39","SSL","1510","Continuation Data"
"250","0.227325","151.101.65.140","100.86.235.39","SSL","1510","Continuation Data"
"251","0.227390","100.86.235.39","151.101.65.140","TCP","66","56438  >  443 [ACK] Seq=1 Ack=222377 Win=7862 Len=0 TSval=3707456495 TSecr=3000621038"
"252","0.232949","151.101.65.140","100.86.235.39","SSL","1510","Continuation Data"
"253","0.233571","151.101.65.140","100.86.235.39","SSL","1510","Continuation Data"
"254","0.233643","100.86.235.39","151.101.65.140","TCP","66","56438  >  443 [ACK] Seq=1 Ack=225265 Win=7862 Len=0 TSval=3707456501 TSecr=3000621044"
"255","0.233980","151.101.65.140","100.86.235.39","SSL","1510","Continuation Data"
"256","0.233981","151.101.65.140","100.86.235.39","SSL","1510","Continuation Data"
"257","0.234063","100.86.235.39","151.101.65.140","TCP","66","56438  >  443 [ACK] Seq=1 Ack=228153 Win=7862 Len=0 TSval=3707456502 TSecr=3000621045"
"258","0.235153","151.101.65.140","100.86.235.39","SSL","1510","Continuation Data"
"259","0.236246","151.101.65.140","100.86.235.39","SSL","1510","Continuation Data"
"260","0.236326","100.86.235.39","151.101.65.140","TCP","66","56438  >  443 [ACK] Seq=1 Ack=231041 Win=7862 Len=0 TSval=3707456505 TSecr=3000621046"
"261","0.237048","151.101.65.140","100.86.235.39","SSL","1510","Continuation Data"
"262","0.237240","151.101.65.140","100.86.235.39","SSL","1510","Continuation Data"
"263","0.237315","100.86.235.39","151.101.65.140","TCP","66","56438  >  443 [ACK] Seq=1 Ack=233929 Win=7862 Len=0 TSval=3707456506 TSecr=3000621048"
"264","0.238619","151.101.65.140","100.86.235.39","SSL","1510","Continuation Data"
"265","0.239045","151.101.65.140","100.86.235.39","SSL","1510","Continuation Data"
"266","0.239110","100.86.235.39","151.101.65.140","TCP","66","56438  >  443 [ACK] Seq=1 Ack=236817 Win=7862 Len=0 TSval=3707456507 TSecr=3000621050"
"267","0.240077","151.101.65.140","100.86.235.39","SSL","1510","Continuation Data"
"268","0.242885","151.101.65.140","100.86.235.39","SSL","1026","Continuation Data"
"269","0.243068","100.86.235.39","151.101.65.140","TCP","66","56438  >  443 [ACK] Seq=1 Ack=239221 Win=7862 Len=0 TSval=3707456511 TSecr=3000621051"
"270","2.634413","100.86.235.39","151.101.65.140","TCP","1514","56383  >  443 [ACK] Seq=5464 Ack=1817 Win=2048 Len=1448 TSval=1359833069 TSecr=557055548 [TCP PDU reassembled in 272]"
"271","2.634416","100.86.235.39","151.101.65.140","TCP","1514","56383  >  443 [ACK] Seq=6912 Ack=1817 Win=2048 Len=1448 TSval=1359833069 TSecr=557055548 [TCP PDU reassembled in 272]"
"272","2.634486","100.86.235.39","151.101.65.140","TLSv1.2","108","Application Data"
"273","2.634561","100.86.235.39","151.101.65.140","TCP","1514","56383  >  443 [ACK] Seq=8402 Ack=1817 Win=2048 Len=1448 TSval=1359833069 TSecr=557055548 [TCP PDU reassembled in 284]"
"274","2.634564","100.86.235.39","151.101.65.140","TCP","1514","56383  >  443 [ACK] Seq=9850 Ack=1817 Win=2048 Len=1448 TSval=1359833069 TSecr=557055548 [TCP PDU reassembled in 284]"
"275","2.634566","100.86.235.39","151.101.65.140","TCP","1514","56383  >  443 [ACK] Seq=11298 Ack=1817 Win=2048 Len=1448 TSval=1359833069 TSecr=557055548 [TCP PDU reassembled in 284]"
"276","2.634567","100.86.235.39","151.101.65.140","TCP","1514","56383  >  443 [ACK] Seq=12746 Ack=1817 Win=2048 Len=1448 TSval=1359833069 TSecr=557055548 [TCP PDU reassembled in 284]"
"277","2.634569","100.86.235.39","151.101.65.140","TCP","1514","56383  >  443 [ACK] Seq=14194 Ack=1817 Win=2048 Len=1448 TSval=1359833069 TSecr=557055548 [TCP PDU reassembled in 284]"
"278","2.634571","100.86.235.39","151.101.65.140","TCP","1514","56383  >  443 [ACK] Seq=15642 Ack=1817 Win=2048 Len=1448 TSval=1359833069 TSecr=557055548 [TCP PDU reassembled in 284]"
"279","2.634573","100.86.235.39","151.101.65.140","TCP","1514","56383  >  443 [ACK] Seq=17090 Ack=1817 Win=2048 Len=1448 TSval=1359833069 TSecr=557055548 [TCP PDU reassembled in 284]"
"280","2.634574","100.86.235.39","151.101.65.140","TCP","1514","56383  >  443 [ACK] Seq=18538 Ack=1817 Win=2048 Len=1448 TSval=1359833069 TSecr=557055548 [TCP PDU reassembled in 284]"
"281","2.634575","100.86.235.39","151.101.65.140","TCP","1514","56383  >  443 [ACK] Seq=19986 Ack=1817 Win=2048 Len=1448 TSval=1359833069 TSecr=557055548 [TCP PDU reassembled in 284]"
"282","2.634577","100.86.235.39","151.101.65.140","TCP","1514","56383  >  443 [ACK] Seq=21434 Ack=1817 Win=2048 Len=1448 TSval=1359833069 TSecr=557055548 [TCP PDU reassembled in 284]"
"283","2.634579","100.86.235.39","151.101.65.140","TCP","1514","56383  >  443 [ACK] Seq=22882 Ack=1817 Win=2048 Len=1448 TSval=1359833069 TSecr=557055548 [TCP PDU reassembled in 284]"
"284","2.634612","100.86.235.39","151.101.65.140","TLSv1.2","169","Application Data"
"285","2.634686","100.86.235.39","151.101.65.140","TCP","1514","56383  >  443 [ACK] Seq=24433 Ack=1817 Win=2048 Len=1448 TSval=1359833069 TSecr=557055548 [TCP PDU reassembled in 293]"
"286","2.634688","100.86.235.39","151.101.65.140","TCP","1514","56383  >  443 [ACK] Seq=25881 Ack=1817 Win=2048 Len=1448 TSval=1359833069 TSecr=557055548 [TCP PDU reassembled in 293]"
"287","2.634690","100.86.235.39","151.101.65.140","TCP","1514","56383  >  443 [ACK] Seq=27329 Ack=1817 Win=2048 Len=1448 TSval=1359833069 TSecr=557055548 [TCP PDU reassembled in 293]"
"288","2.634692","100.86.235.39","151.101.65.140","TCP","1514","56383  >  443 [ACK] Seq=28777 Ack=1817 Win=2048 Len=1448 TSval=1359833069 TSecr=557055548 [TCP PDU reassembled in 293]"
"289","2.634693","100.86.235.39","151.101.65.140","TCP","1514","56383  >  443 [ACK] Seq=30225 Ack=1817 Win=2048 Len=1448 TSval=1359833069 TSecr=557055548 [TCP PDU reassembled in 293]"
"290","2.634694","100.86.235.39","151.101.65.140","TCP","1514","56383  >  443 [ACK] Seq=31673 Ack=1817 Win=2048 Len=1448 TSval=1359833069 TSecr=557055548 [TCP PDU reassembled in 293]"
"291","2.634695","100.86.235.39","151.101.65.140","TCP","1514","56383  >  443 [ACK] Seq=33121 Ack=1817 Win=2048 Len=1448 TSval=1359833069 TSecr=557055548 [TCP PDU reassembled in 293]"
"292","2.634696","100.86.235.39","151.101.65.140","TCP","1514","56383  >  443 [ACK] Seq=34569 Ack=1817 Win=2048 Len=1448 TSval=1359833069 TSecr=557055548 [TCP PDU reassembled in 293]"
"293","2.634722","100.86.235.39","151.101.65.140","TLSv1.2","1504","Application Data"
"294","2.634757","100.86.235.39","151.101.65.140","TLSv1.2","1393","Application Data"
"295","2.634808","100.86.235.39","151.101.65.140","TCP","1514","56383  >  443 [ACK] Seq=38782 Ack=1817 Win=2048 Len=1448 TSval=1359833069 TSecr=557055548 [TCP PDU reassembled in 298]"
"296","2.634810","100.86.235.39","151.101.65.140","TCP","1514","56383  >  443 [ACK] Seq=40230 Ack=1817 Win=2048 Len=1448 TSval=1359833069 TSecr=557055548 [TCP PDU reassembled in 298]"
"297","2.634811","100.86.235.39","151.101.65.140","TCP","1514","56383  >  443 [ACK] Seq=41678 Ack=1817 Win=2048 Len=1448 TSval=1359833069 TSecr=557055548 [TCP PDU reassembled in 298]"
"298","2.634826","100.86.235.39","151.101.65.140","TLSv1.2","515","Application Data"
"299","2.645031","151.101.65.140","100.86.235.39","TCP","66","443  >  56383 [ACK] Seq=1817 Ack=8402 Win=538 Len=0 TSval=557058054 TSecr=1359833069"
"300","2.646758","151.101.65.140","100.86.235.39","TCP","66","443  >  56383 [ACK] Seq=1817 Ack=14194 Win=538 Len=0 TSval=557058056 TSecr=1359833069"
"301","2.646759","151.101.65.140","100.86.235.39","TCP","66","443  >  56383 [ACK] Seq=1817 Ack=19986 Win=538 Len=0 TSval=557058057 TSecr=1359833069"
"302","2.646760","151.101.65.140","100.86.235.39","TCP","66","443  >  56383 [ACK] Seq=1817 Ack=27329 Win=534 Len=0 TSval=557058057 TSecr=1359833069"
"303","2.647938","151.101.65.140","100.86.235.39","TLSv1.2","101","Application Data"
"304","2.647941","151.101.65.140","100.86.235.39","TCP","66","443  >  56383 [ACK] Seq=1852 Ack=43575 Win=529 Len=0 TSval=557058058 TSecr=1359833069"
"305","2.648100","100.86.235.39","151.101.65.140","TCP","66","56383  >  443 [ACK] Seq=43575 Ack=1852 Win=2047 Len=0 TSval=1359833082 TSecr=557058057"
"306","2.670785","151.101.65.140","100.86.235.39","TCP","1510","443  >  56383 [ACK] Seq=1852 Ack=43575 Win=538 Len=1444 TSval=557058080 TSecr=1359833082 [TCP PDU reassembled in 307]"
"307","2.670788","151.101.65.140","100.86.235.39","TLSv1.2","874","Application Data"
"308","2.670789","151.101.65.140","100.86.235.39","TLSv1.2","99","Application Data"
"309","2.670943","100.86.235.39","151.101.65.140","TCP","66","56383  >  443 [ACK] Seq=43575 Ack=4137 Win=2012 Len=0 TSval=1359833105 TSecr=557058080"
