"No.","Time","Source","Destination","Protocol","Length","Info"
"1","0.000000","151.101.65.140","100.86.235.39","SSLv2","1510",""
"2","0.000196","100.86.235.39","151.101.65.140","TCP","66","56473  >  443 [ACK] Seq=1 Ack=1445 Win=4672 Len=0 TSval=1656561041 TSecr=2958628724"
"3","0.002003","151.101.65.140","100.86.235.39","SSLv2","1510",""
"4","0.002508","151.101.65.140","100.86.235.39","SSLv2","1510","Encrypted Data"
"5","0.002685","100.86.235.39","151.101.65.140","TCP","66","56473  >  443 [ACK] Seq=1 Ack=4333 Win=4672 Len=0 TSval=1656561043 TSecr=2958628727"
"6","0.002939","151.101.65.140","100.86.235.39","SSLv2","1510",""
"7","0.002940","151.101.65.140","100.86.235.39","SSLv2","1510","Encrypted Data"
"8","0.003035","100.86.235.39","151.101.65.140","TCP","66","56473  >  443 [ACK] Seq=1 Ack=7221 Win=4672 Len=0 TSval=1656561043 TSecr=2958628728"
"9","0.006839","151.101.65.140","100.86.235.39","SSLv2","1510",""
"10","0.007180","151.101.65.140","100.86.235.39","SSLv2","1510",""
"11","0.007277","100.86.235.39","151.101.65.140","TCP","66","56473  >  443 [ACK] Seq=1 Ack=10109 Win=4672 Len=0 TSval=1656561048 TSecr=2958628732"
"12","0.008155","151.101.65.140","100.86.235.39","SSLv2","1510",""
"13","0.008157","151.101.65.140","100.86.235.39","SSLv2","1510",""
"14","0.008288","100.86.235.39","151.101.65.140","TCP","66","56473  >  443 [ACK] Seq=1 Ack=12997 Win=4672 Len=0 TSval=1656561049 TSecr=2958628733"
"15","0.009974","151.101.65.140","100.86.235.39","SSLv2","1510",""
"16","0.010003","151.101.65.140","100.86.235.39","SSLv2","1510",""
"17","0.010109","100.86.235.39","151.101.65.140","TCP","66","56473  >  443 [ACK] Seq=1 Ack=15885 Win=4672 Len=0 TSval=1656561051 TSecr=2958628735"
"18","0.012870","151.101.65.140","100.86.235.39","SSLv2","1510",""
"19","0.012905","151.101.65.140","100.86.235.39","SSLv2","1510",""
"20","0.013084","100.86.235.39","151.101.65.140","TCP","66","56473  >  443 [ACK] Seq=1 Ack=18773 Win=4672 Len=0 TSval=1656561054 TSecr=2958628738"
"21","0.014042","151.101.65.140","100.86.235.39","SSLv2","1510",""
"22","0.014480","151.101.65.140","100.86.235.39","SSLv2","1510",""
"23","0.014582","100.86.235.39","151.101.65.140","TCP","66","56473  >  443 [ACK] Seq=1 Ack=21661 Win=4672 Len=0 TSval=1656561055 TSecr=2958628740"
"24","0.017059","151.101.65.140","100.86.235.39","SSLv2","1510",""
"25","0.017103","151.101.65.140","100.86.235.39","SSLv2","1510",""
"26","0.017192","100.86.235.39","151.101.65.140","TCP","66","56473  >  443 [ACK] Seq=1 Ack=24549 Win=4672 Len=0 TSval=1656561058 TSecr=2958628743"
"27","0.018241","151.101.65.140","100.86.235.39","SSLv2","1510",""
"28","0.018346","151.101.65.140","100.86.235.39","TCP","1510","443  >  56473 [PSH, ACK] Seq=25993 Ack=1 Win=298 Len=1444 TSval=2958628743 TSecr=1656561049 [TCP PDU reassembled in 47]"
"29","0.018423","100.86.235.39","151.101.65.140","TCP","66","56473  >  443 [ACK] Seq=1 Ack=27437 Win=4672 Len=0 TSval=1656561059 TSecr=2958628743"
"30","0.019795","151.101.65.140","100.86.235.39","TCP","1510","443  >  56473 [ACK] Seq=27437 Ack=1 Win=298 Len=1444 TSval=2958628745 TSecr=1656561051 [TCP PDU reassembled in 47]"
"31","0.020001","151.101.65.140","100.86.235.39","TCP","1510","443  >  56473 [PSH, ACK] Seq=28881 Ack=1 Win=298 Len=1444 TSval=2958628745 TSecr=1656561051 [TCP PDU reassembled in 47]"
"32","0.020104","100.86.235.39","151.101.65.140","TCP","66","56473  >  443 [ACK] Seq=1 Ack=30325 Win=4672 Len=0 TSval=1656561061 TSecr=2958628745"
"33","0.023488","151.101.65.140","100.86.235.39","TCP","1510","443  >  56473 [ACK] Seq=30325 Ack=1 Win=298 Len=1444 TSval=2958628749 TSecr=1656561054 [TCP PDU reassembled in 47]"
"34","0.023541","151.101.65.140","100.86.235.39","TCP","1510","443  >  56473 [PSH, ACK] Seq=31769 Ack=1 Win=298 Len=1444 TSval=2958628749 TSecr=1656561054 [TCP PDU reassembled in 47]"
"35","0.023728","100.86.235.39","151.101.65.140","TCP","66","56473  >  443 [ACK] Seq=1 Ack=33213 Win=4672 Len=0 TSval=1656561064 TSecr=2958628749"
"36","0.024427","151.101.65.140","100.86.235.39","TCP","1510","443  >  56473 [ACK] Seq=33213 Ack=1 Win=298 Len=1444 TSval=2958628750 TSecr=1656561055 [TCP PDU reassembled in 47]"
"37","0.024429","151.101.65.140","100.86.235.39","TCP","1510","443  >  56473 [PSH, ACK] Seq=34657 Ack=1 Win=298 Len=1444 TSval=2958628750 TSecr=1656561055 [TCP PDU reassembled in 47]"
"38","0.024559","100.86.235.39","151.101.65.140","TCP","66","56473  >  443 [ACK] Seq=1 Ack=36101 Win=4672 Len=0 TSval=1656561064 TSecr=2958628750"
"39","0.025733","151.101.65.140","100.86.235.39","TCP","1510","443  >  56473 [ACK] Seq=36101 Ack=1 Win=298 Len=1444 TSval=2958628751 TSecr=1656561055 [TCP PDU reassembled in 47]"
"40","0.026943","100.86.235.39","151.101.65.140","TCP","1514","56383  >  443 [ACK] Seq=1 Ack=1 Win=2048 Len=1448 TSval=1359988826 TSecr=557213703 [TCP PDU reassembled in 42]"
"41","0.026946","100.86.235.39","151.101.65.140","TCP","1514","56383  >  443 [ACK] Seq=1449 Ack=1 Win=2048 Len=1448 TSval=1359988826 TSecr=557213703 [TCP PDU reassembled in 42]"
"42","0.026986","100.86.235.39","151.101.65.140","TLSv1.2","238","Application Data"
"43","0.027083","100.86.235.39","151.101.65.140","TLSv1.2","222","Application Data"
"44","0.027724","151.101.65.140","100.86.235.39","TCP","1510","443  >  56473 [ACK] Seq=37545 Ack=1 Win=298 Len=1444 TSval=2958628753 TSecr=1656561058 [TCP PDU reassembled in 47]"
"45","0.027936","151.101.65.140","100.86.235.39","TCP","1510","443  >  56473 [PSH, ACK] Seq=38989 Ack=1 Win=298 Len=1444 TSval=2958628753 TSecr=1656561058 [TCP PDU reassembled in 47]"
"46","0.028026","100.86.235.39","151.101.65.140","TCP","66","56473  >  443 [ACK] Seq=1 Ack=40433 Win=4672 Len=0 TSval=1656561069 TSecr=2958628751"
"47","0.028898","151.101.65.140","100.86.235.39","SSLv2","1510","Encrypted Data"
"48","0.029714","151.101.65.140","100.86.235.39","SSLv2","1510",""
"49","0.029823","100.86.235.39","151.101.65.140","TCP","66","56473  >  443 [ACK] Seq=1 Ack=43321 Win=4672 Len=0 TSval=1656561070 TSecr=2958628755"
"50","0.030131","151.101.65.140","100.86.235.39","SSLv2","1510",""
"51","0.030132","151.101.65.140","100.86.235.39","SSLv2","1510",""
"52","0.030216","100.86.235.39","151.101.65.140","TCP","66","56473  >  443 [ACK] Seq=1 Ack=46209 Win=4672 Len=0 TSval=1656561071 TSecr=2958628756"
"53","0.033890","151.101.65.140","100.86.235.39","SSLv2","1510",""
"54","0.034260","151.101.65.140","100.86.235.39","SSLv2","1510",""
"55","0.034799","100.86.235.39","151.101.65.140","TCP","66","56473  >  443 [ACK] Seq=1 Ack=49097 Win=4672 Len=0 TSval=1656561075 TSecr=2958628759"
"56","0.034967","151.101.65.140","100.86.235.39","SSLv2","1510",""
"57","0.034969","151.101.65.140","100.86.235.39","SSLv2","1510",""
"58","0.035164","100.86.235.39","151.101.65.140","TCP","66","56473  >  443 [ACK] Seq=1 Ack=51985 Win=4672 Len=0 TSval=1656561076 TSecr=2958628760"
"59","0.037340","151.101.65.140","100.86.235.39","TCP","66","443  >  56383 [ACK] Seq=1 Ack=3225 Win=533 Len=0 TSval=557213816 TSecr=1359988826"
"60","0.039768","151.101.65.140","100.86.235.39","SSLv2","1510",""
"61","0.039805","151.101.65.140","100.86.235.39","SSLv2","1510",""
"62","0.039915","100.86.235.39","151.101.65.140","TCP","66","56473  >  443 [ACK] Seq=1 Ack=54873 Win=4672 Len=0 TSval=1656561081 TSecr=2958628765"
"63","0.040846","151.101.65.140","100.86.235.39","SSLv2","1510",""
"64","0.041879","151.101.65.140","100.86.235.39","SSLv2","1510","Encrypted Data"
"65","0.041982","100.86.235.39","151.101.65.140","TCP","66","56473  >  443 [ACK] Seq=1 Ack=57761 Win=4672 Len=0 TSval=1656561083 TSecr=2958628766"
"66","0.042834","151.101.65.140","100.86.235.39","SSLv2","1510",""
"67","0.042910","100.86.235.39","151.101.65.140","TCP","1514","56383  >  443 [ACK] Seq=3225 Ack=1 Win=2048 Len=1448 TSval=1359988841 TSecr=557213816 [TCP PDU reassembled in 69]"
"68","0.042912","100.86.235.39","151.101.65.140","TCP","1514","56383  >  443 [ACK] Seq=4673 Ack=1 Win=2048 Len=1448 TSval=1359988841 TSecr=557213816 [TCP PDU reassembled in 69]"
"69","0.042939","100.86.235.39","151.101.65.140","TLSv1.2","240","Application Data"
"70","0.042983","100.86.235.39","151.101.65.140","TLSv1.2","273","Application Data"
"71","0.043008","151.101.65.140","100.86.235.39","SSLv2","1510",""
"72","0.043058","100.86.235.39","151.101.65.140","TCP","66","56473  >  443 [ACK] Seq=1 Ack=60649 Win=4672 Len=0 TSval=1656561084 TSecr=2958628768"
"73","0.044797","151.101.65.140","100.86.235.39","SSLv2","1510",""
"74","0.045442","151.101.65.140","100.86.235.39","SSLv2","1510",""
"75","0.045554","100.86.235.39","151.101.65.140","TCP","66","56473  >  443 [ACK] Seq=1 Ack=63537 Win=4672 Len=0 TSval=1656561086 TSecr=2958628771"
"76","0.046079","151.101.65.140","100.86.235.39","SSLv2","1510",""
"77","0.046457","151.101.65.140","100.86.235.39","SSLv2","1510",""
"78","0.046642","100.86.235.39","151.101.65.140","TCP","66","56473  >  443 [ACK] Seq=1 Ack=66425 Win=4672 Len=0 TSval=1656561087 TSecr=2958628771"
"79","0.047836","151.101.65.140","100.86.235.39","SSLv2","1510",""
"80","0.049506","151.101.65.140","100.86.235.39","SSLv2","1510",""
"81","0.049799","151.101.65.140","100.86.235.39","SSLv2","1510",""
"82","0.049942","100.86.235.39","151.101.65.140","TCP","66","56473  >  443 [ACK] Seq=1 Ack=70757 Win=4672 Len=0 TSval=1656561090 TSecr=2958628773"
"83","0.052680","151.101.65.140","100.86.235.39","SSLv2","1510",""
"84","0.052681","151.101.65.140","100.86.235.39","SSLv2","1510",""
"85","0.052842","100.86.235.39","151.101.65.140","TCP","66","56473  >  443 [ACK] Seq=1 Ack=73645 Win=4672 Len=0 TSval=1656561094 TSecr=2958628778"
"86","0.053003","151.101.65.140","100.86.235.39","TCP","66","443  >  56383 [ACK] Seq=1 Ack=6502 Win=534 Len=0 TSval=557213832 TSecr=1359988842"
"87","0.055277","151.101.65.140","100.86.235.39","SSLv2","1510",""
"88","0.055279","151.101.65.140","100.86.235.39","SSLv2","1510",""
"89","0.055465","100.86.235.39","151.101.65.140","TCP","66","56473  >  443 [ACK] Seq=1 Ack=76533 Win=4672 Len=0 TSval=1656561096 TSecr=2958628779"
"90","0.057988","151.101.65.140","100.86.235.39","SSLv2","1510",""
"91","0.057989","151.101.65.140","100.86.235.39","SSLv2","1510",""
"92","0.057990","151.101.65.140","100.86.235.39","SSLv2","1510",""
"93","0.058128","100.86.235.39","151.101.65.140","TCP","66","56473  >  443 [ACK] Seq=1 Ack=80865 Win=4672 Len=0 TSval=1656561099 TSecr=2958628783"
"94","0.058384","151.101.65.140","100.86.235.39","SSLv2","1510",""
"95","0.058580","100.86.235.39","151.101.65.140","TCP","66","56473  >  443 [ACK] Seq=1 Ack=82309 Win=4672 Len=0 TSval=1656561099 TSecr=2958628783"
"96","0.062529","151.101.65.140","100.86.235.39","SSLv2","1510",""
"97","0.062531","151.101.65.140","100.86.235.39","SSLv2","1510",""
"98","0.062674","100.86.235.39","151.101.65.140","TCP","66","56473  >  443 [ACK] Seq=1 Ack=85197 Win=4672 Len=0 TSval=1656561103 TSecr=2958628787"
"99","0.063293","151.101.65.140","100.86.235.39","SSLv2","1510",""
"100","0.063294","151.101.65.140","100.86.235.39","SSLv2","1510",""
"101","0.063390","100.86.235.39","151.101.65.140","TCP","66","56473  >  443 [ACK] Seq=1 Ack=88085 Win=4672 Len=0 TSval=1656561103 TSecr=2958628788"
"102","0.066914","151.101.65.140","100.86.235.39","SSLv2","1510",""
"103","0.066915","151.101.65.140","100.86.235.39","SSLv2","1510",""
"104","0.066917","151.101.65.140","100.86.235.39","SSLv2","1510",""
"105","0.066918","151.101.65.140","100.86.235.39","SSLv2","1510",""
"106","0.067558","151.101.65.140","100.86.235.39","SSLv2","1510","[TCP Previous segment not captured] "
"107","0.067621","100.86.235.39","151.101.65.140","TCP","78","56473  >  443 [ACK] Seq=1 Ack=93861 Win=4582 Len=0 TSval=1656561108 TSecr=2958628791 SLE=95305 SRE=96749"
"108","0.068192","100.86.235.39","151.101.65.140","TCP","78","[TCP Dup ACK 107#1] 56473  >  443 [ACK] Seq=1 Ack=93861 Win=4672 Len=0 TSval=1656561109 TSecr=2958628791 SLE=95305 SRE=96749"
"109","0.080385","151.101.65.140","100.86.235.39","SSLv2","1510",""
"110","0.080412","151.101.65.140","100.86.235.39","SSLv2","1510",""
"111","0.080413","151.101.65.140","100.86.235.39","SSLv2","1510",""
"112","0.080469","100.86.235.39","151.101.65.140","TCP","78","[TCP Dup ACK 107#2] 56473  >  443 [ACK] Seq=1 Ack=93861 Win=4672 Len=0 TSval=1656561121 TSecr=2958628791 SLE=95305 SRE=98193"
"113","0.080500","100.86.235.39","151.101.65.140","TCP","78","[TCP Dup ACK 107#3] 56473  >  443 [ACK] Seq=1 Ack=93861 Win=4672 Len=0 TSval=1656561121 TSecr=2958628791 SLE=95305 SRE=101081"
"114","0.081441","151.101.65.140","100.86.235.39","SSLv2","1510",""
"115","0.081443","151.101.65.140","100.86.235.39","SSLv2","1510",""
"116","0.081496","100.86.235.39","151.101.65.140","TCP","78","[TCP Dup ACK 107#4] 56473  >  443 [ACK] Seq=1 Ack=93861 Win=4672 Len=0 TSval=1656561122 TSecr=2958628791 SLE=95305 SRE=103969"
"117","0.082310","151.101.65.140","100.86.235.39","SSLv2","1510",""
"118","0.082358","100.86.235.39","151.101.65.140","TCP","78","[TCP Dup ACK 107#5] 56473  >  443 [ACK] Seq=1 Ack=93861 Win=4672 Len=0 TSval=1656561122 TSecr=2958628791 SLE=95305 SRE=105413"
"119","0.088663","151.101.65.140","100.86.235.39","SSLv2","1510",""
"120","0.088862","100.86.235.39","151.101.65.140","TCP","78","[TCP Dup ACK 107#6] 56473  >  443 [ACK] Seq=1 Ack=93861 Win=4672 Len=0 TSval=1656561130 TSecr=2958628791 SLE=95305 SRE=106857"
"121","0.088991","151.101.65.140","100.86.235.39","SSLv2","1510",""
"122","0.089058","100.86.235.39","151.101.65.140","TCP","78","[TCP Dup ACK 107#7] 56473  >  443 [ACK] Seq=1 Ack=93861 Win=4672 Len=0 TSval=1656561130 TSecr=2958628791 SLE=95305 SRE=108301"
"123","0.089616","151.101.65.140","100.86.235.39","SSLv2","1510",""
"124","0.089704","100.86.235.39","151.101.65.140","TCP","78","[TCP Dup ACK 107#8] 56473  >  443 [ACK] Seq=1 Ack=93861 Win=4672 Len=0 TSval=1656561130 TSecr=2958628791 SLE=95305 SRE=109745"
"125","0.089906","151.101.65.140","100.86.235.39","SSLv2","1510",""
"126","0.090036","100.86.235.39","151.101.65.140","TCP","78","[TCP Dup ACK 107#9] 56473  >  443 [ACK] Seq=1 Ack=93861 Win=4672 Len=0 TSval=1656561131 TSecr=2958628791 SLE=95305 SRE=111189"
"127","0.091320","151.101.65.140","100.86.235.39","SSLv2","1510",""
"128","0.091380","100.86.235.39","151.101.65.140","TCP","78","[TCP Dup ACK 107#10] 56473  >  443 [ACK] Seq=1 Ack=93861 Win=4672 Len=0 TSval=1656561132 TSecr=2958628791 SLE=95305 SRE=112633"
"129","0.091788","151.101.65.140","100.86.235.39","SSLv2","1510",""
"130","0.091841","100.86.235.39","151.101.65.140","TCP","78","[TCP Dup ACK 107#11] 56473  >  443 [ACK] Seq=1 Ack=93861 Win=4672 Len=0 TSval=1656561132 TSecr=2958628791 SLE=95305 SRE=114077"
"131","0.092734","151.101.65.140","100.86.235.39","SSLv2","1510","[TCP Fast Retransmission] , Encrypted Data"
"132","0.092884","100.86.235.39","151.101.65.140","TCP","66","56473  >  443 [ACK] Seq=1 Ack=114077 Win=4356 Len=0 TSval=1656561134 TSecr=2958628818"
"133","0.093426","100.86.235.39","151.101.65.140","TCP","66","[TCP Window Update] 56473  >  443 [ACK] Seq=1 Ack=114077 Win=4672 Len=0 TSval=1656561134 TSecr=2958628818"
"134","0.093875","151.101.65.140","100.86.235.39","SSLv2","1510",""
"135","0.094006","100.86.235.39","151.101.65.140","TCP","66","56473  >  443 [ACK] Seq=1 Ack=115521 Win=4649 Len=0 TSval=1656561135 TSecr=2958628819"
"136","0.095092","151.101.65.140","100.86.235.39","SSLv2","1510",""
"137","0.095193","100.86.235.39","151.101.65.140","TCP","66","56473  >  443 [ACK] Seq=1 Ack=116965 Win=4649 Len=0 TSval=1656561136 TSecr=2958628820"
"138","0.099561","151.101.65.140","100.86.235.39","SSLv2","1510",""
"139","0.099597","151.101.65.140","100.86.235.39","SSLv2","1510",""
"140","0.099647","100.86.235.39","151.101.65.140","TCP","66","56473  >  443 [ACK] Seq=1 Ack=118409 Win=4649 Len=0 TSval=1656561141 TSecr=2958628824"
"141","0.099788","100.86.235.39","151.101.65.140","TCP","66","56473  >  443 [ACK] Seq=1 Ack=119853 Win=4649 Len=0 TSval=1656561141 TSecr=2958628825"
"142","0.100193","151.101.65.140","100.86.235.39","SSLv2","1510",""
"143","0.100240","100.86.235.39","151.101.65.140","TCP","66","56473  >  443 [ACK] Seq=1 Ack=121297 Win=4649 Len=0 TSval=1656561141 TSecr=2958628825"
"144","0.100523","151.101.65.140","100.86.235.39","SSLv2","1510",""
"145","0.100563","100.86.235.39","151.101.65.140","TCP","66","56473  >  443 [ACK] Seq=1 Ack=122741 Win=4649 Len=0 TSval=1656561141 TSecr=2958628826"
"146","0.102901","151.101.65.140","100.86.235.39","SSLv2","1510",""
"147","0.103040","100.86.235.39","151.101.65.140","TCP","66","56473  >  443 [ACK] Seq=1 Ack=124185 Win=4649 Len=0 TSval=1656561144 TSecr=2958628827"
"148","0.103459","151.101.65.140","100.86.235.39","SSLv2","1510",""
"149","0.103461","151.101.65.140","100.86.235.39","SSLv2","1510",""
"150","0.103550","100.86.235.39","151.101.65.140","TCP","66","56473  >  443 [ACK] Seq=1 Ack=127073 Win=4627 Len=0 TSval=1656561144 TSecr=2958628829"
"151","0.104907","151.101.65.140","100.86.235.39","SSLv2","1510",""
"152","0.104983","100.86.235.39","151.101.65.140","TCP","66","56473  >  443 [ACK] Seq=1 Ack=128517 Win=4649 Len=0 TSval=1656561146 TSecr=2958628831"
"153","0.105821","151.101.65.140","100.86.235.39","SSLv2","1510",""
"154","0.105903","100.86.235.39","151.101.65.140","TCP","66","56473  >  443 [ACK] Seq=1 Ack=129961 Win=4649 Len=0 TSval=1656561146 TSecr=2958628831"
"155","0.108886","151.101.65.140","100.86.235.39","SSLv2","1510","Encrypted Data"
"156","0.108957","100.86.235.39","151.101.65.140","TCP","66","56473  >  443 [ACK] Seq=1 Ack=131405 Win=4649 Len=0 TSval=1656561150 TSecr=2958628835"
"157","0.109459","151.101.65.140","100.86.235.39","TCP","1510","443  >  56473 [PSH, ACK] Seq=131405 Ack=1 Win=298 Len=1444 TSval=2958628835 TSecr=1656561141"
"158","0.109516","100.86.235.39","151.101.65.140","TCP","66","56473  >  443 [ACK] Seq=1 Ack=132849 Win=4649 Len=0 TSval=1656561150 TSecr=2958628835"
"159","0.112207","100.86.235.39","151.101.65.140","TCP","1514","56383  >  443 [ACK] Seq=6502 Ack=1 Win=2048 Len=1448 TSval=1359988911 TSecr=557213832 [TCP PDU reassembled in 161]"
"160","0.112210","100.86.235.39","151.101.65.140","TCP","1514","56383  >  443 [ACK] Seq=7950 Ack=1 Win=2048 Len=1448 TSval=1359988911 TSecr=557213832 [TCP PDU reassembled in 161]"
"161","0.112249","100.86.235.39","151.101.65.140","TLSv1.2","190","Application Data"
"162","0.112301","151.101.65.140","100.86.235.39","TCP","1058","[TCP Previous segment not captured] 443  >  56383 [PSH, ACK] Seq=1445 Ack=6502 Win=538 Len=992 TSval=557213890 TSecr=1359988842"
"163","0.112331","100.86.235.39","151.101.65.140","TCP","1514","56383  >  443 [ACK] Seq=9522 Ack=1 Win=2048 Len=1448 TSval=1359988911 TSecr=557213832 [TCP PDU reassembled in 165]"
"164","0.112333","100.86.235.39","151.101.65.140","TCP","1514","56383  >  443 [ACK] Seq=10970 Ack=1 Win=2048 Len=1448 TSval=1359988911 TSecr=557213832 [TCP PDU reassembled in 165]"
"165","0.112335","100.86.235.39","151.101.65.140","TLSv1.2","171","Application Data"
"166","0.112361","100.86.235.39","151.101.65.140","TCP","78","[TCP Dup ACK 40#1] 56383  >  443 [ACK] Seq=12523 Ack=1 Win=2048 Len=0 TSval=1359988911 TSecr=557213832 SLE=1445 SRE=2437"
"167","0.112963","151.101.65.140","100.86.235.39","SSLv2","1510",""
"168","0.113054","100.86.235.39","151.101.65.140","TCP","66","56473  >  443 [ACK] Seq=1 Ack=134293 Win=4649 Len=0 TSval=1656561153 TSecr=2958628838"
"169","0.113513","151.101.65.140","100.86.235.39","SSLv2","1510",""
"170","0.113573","100.86.235.39","151.101.65.140","TCP","66","56473  >  443 [ACK] Seq=1 Ack=135737 Win=4649 Len=0 TSval=1656561154 TSecr=2958628838"
"171","0.114942","151.101.65.140","100.86.235.39","SSLv2","1510",""
"172","0.115013","100.86.235.39","151.101.65.140","TCP","66","56473  >  443 [ACK] Seq=1 Ack=137181 Win=4649 Len=0 TSval=1656561156 TSecr=2958628839"
"173","0.115331","151.101.65.140","100.86.235.39","SSLv2","1510",""
"174","0.115407","100.86.235.39","151.101.65.140","TCP","66","56473  >  443 [ACK] Seq=1 Ack=138625 Win=4672 Len=0 TSval=1656561156 TSecr=2958628839"
"175","0.115761","151.101.65.140","100.86.235.39","SSLv2","1510",""
"176","0.115762","151.101.65.140","100.86.235.39","SSLv2","1510",""
"177","0.115855","100.86.235.39","151.101.65.140","TCP","66","56473  >  443 [ACK] Seq=1 Ack=141513 Win=4672 Len=0 TSval=1656561156 TSecr=2958628841"
"178","0.118803","151.101.65.140","100.86.235.39","SSLv2","1510",""
"179","0.119482","151.101.65.140","100.86.235.39","SSLv2","1510",""
"180","0.119583","100.86.235.39","151.101.65.140","TCP","66","56473  >  443 [ACK] Seq=1 Ack=144401 Win=4672 Len=0 TSval=1656561160 TSecr=2958628844"
"181","0.119912","151.101.65.140","100.86.235.39","SSLv2","1510","Encrypted Data"
"182","0.120178","151.101.65.140","100.86.235.39","SSLv2","1510",""
"183","0.120272","100.86.235.39","151.101.65.140","TCP","66","56473  >  443 [ACK] Seq=1 Ack=147289 Win=4672 Len=0 TSval=1656561161 TSecr=2958628845"
"184","0.122328","151.101.65.140","100.86.235.39","TCP","66","443  >  56383 [ACK] Seq=2437 Ack=9398 Win=538 Len=0 TSval=557213901 TSecr=1359988911"
"185","0.122329","151.101.65.140","100.86.235.39","TCP","66","443  >  56383 [ACK] Seq=2437 Ack=12523 Win=538 Len=0 TSval=557213902 TSecr=1359988911"
"186","0.123553","151.101.65.140","100.86.235.39","TCP","1510","443  >  56383 [ACK] Seq=2437 Ack=12523 Win=538 Len=1444 TSval=557213902 TSecr=1359988911 [TCP PDU reassembled in 187]"
"187","0.123605","151.101.65.140","100.86.235.39","TLSv1.2","207","Application Data"
"188","0.123605","151.101.65.140","100.86.235.39","TLSv1.2","273","Application Data"
"189","0.123621","100.86.235.39","151.101.65.140","TCP","78","[TCP Dup ACK 40#2] 56383  >  443 [ACK] Seq=12523 Ack=1 Win=2048 Len=0 TSval=1359988922 TSecr=557213832 SLE=1445 SRE=3881"
"190","0.124806","151.101.65.140","100.86.235.39","SSLv2","1510",""
"191","0.126085","151.101.65.140","100.86.235.39","SSLv2","1510",""
"192","0.126174","100.86.235.39","151.101.65.140","TCP","78","[TCP Dup ACK 40#3] 56383  >  443 [ACK] Seq=12523 Ack=1 Win=2048 Len=0 TSval=1359988922 TSecr=557213832 SLE=1445 SRE=4229"
"193","0.126176","100.86.235.39","151.101.65.140","TCP","66","56473  >  443 [ACK] Seq=1 Ack=150177 Win=4672 Len=0 TSval=1656561167 TSecr=2958628851"
"194","0.126374","151.101.65.140","100.86.235.39","SSLv2","1510",""
"195","0.126375","151.101.65.140","100.86.235.39","SSLv2","1510",""
"196","0.126425","100.86.235.39","151.101.65.140","TCP","66","56473  >  443 [ACK] Seq=1 Ack=153065 Win=4672 Len=0 TSval=1656561167 TSecr=2958628851"
"197","0.127774","151.101.65.140","100.86.235.39","SSLv2","1510",""
"198","0.128273","151.101.65.140","100.86.235.39","SSLv2","1510",""
"199","0.128331","100.86.235.39","151.101.65.140","TCP","66","56473  >  443 [ACK] Seq=1 Ack=155953 Win=4672 Len=0 TSval=1656561169 TSecr=2958628853"
"200","0.129467","151.101.65.140","100.86.235.39","SSLv2","1510",""
"201","0.129937","151.101.65.140","100.86.235.39","SSLv2","1510",""
"202","0.129938","151.101.65.140","100.86.235.39","TCP","1510","[TCP Fast Retransmission] 443  >  56383 [ACK] Seq=1 Ack=12523 Win=538 Len=1444 TSval=557213909 TSecr=1359988911"
"203","0.130002","100.86.235.39","151.101.65.140","TCP","66","56383  >  443 [ACK] Seq=12523 Ack=4229 Win=1981 Len=0 TSval=1359988928 TSecr=557213909"
"204","0.130026","100.86.235.39","151.101.65.140","TCP","66","56473  >  443 [ACK] Seq=1 Ack=158841 Win=4672 Len=0 TSval=1656561170 TSecr=2958628855"
"205","0.130706","100.86.235.39","151.101.65.140","TCP","66","[TCP Window Update] 56383  >  443 [ACK] Seq=12523 Ack=4229 Win=2048 Len=0 TSval=1359988929 TSecr=557213909"
"206","0.133160","151.101.65.140","100.86.235.39","SSLv2","1510",""
"207","0.133195","151.101.65.140","100.86.235.39","SSLv2","1510",""
"208","0.133304","100.86.235.39","151.101.65.140","TCP","66","56473  >  443 [ACK] Seq=1 Ack=161729 Win=4672 Len=0 TSval=1656561174 TSecr=2958628857"
"209","0.136563","151.101.65.140","100.86.235.39","SSLv2","1510",""
"210","0.136606","151.101.65.140","100.86.235.39","TCP","1510","443  >  56473 [PSH, ACK] Seq=163173 Ack=1 Win=298 Len=1444 TSval=2958628861 TSecr=1656561167"
"211","0.136788","100.86.235.39","151.101.65.140","TCP","66","56473  >  443 [ACK] Seq=1 Ack=164617 Win=4672 Len=0 TSval=1656561178 TSecr=2958628861"
"212","0.137454","151.101.65.140","100.86.235.39","SSLv2","1510",""
"213","0.137455","151.101.65.140","100.86.235.39","SSLv2","1510",""
"214","0.137630","100.86.235.39","151.101.65.140","TCP","66","56473  >  443 [ACK] Seq=1 Ack=167505 Win=4672 Len=0 TSval=1656561178 TSecr=2958628862"
"215","0.140436","151.101.65.140","100.86.235.39","SSLv2","1510",""
"216","0.141153","151.101.65.140","100.86.235.39","SSLv2","1510",""
"217","0.141262","100.86.235.39","151.101.65.140","TCP","66","56473  >  443 [ACK] Seq=1 Ack=170393 Win=4672 Len=0 TSval=1656561181 TSecr=2958628866"
"218","0.141418","151.101.65.140","100.86.235.39","SSLv2","1510",""
"219","0.141420","151.101.65.140","100.86.235.39","SSLv2","1510",""
"220","0.141492","100.86.235.39","151.101.65.140","TCP","66","56473  >  443 [ACK] Seq=1 Ack=173281 Win=4672 Len=0 TSval=1656561182 TSecr=2958628867"
"221","0.142872","151.101.65.140","100.86.235.39","SSLv2","1510",""
"222","0.143998","151.101.65.140","100.86.235.39","SSLv2","1510",""
"223","0.144128","100.86.235.39","151.101.65.140","TCP","66","56473  >  443 [ACK] Seq=1 Ack=176169 Win=4672 Len=0 TSval=1656561185 TSecr=2958628868"
"224","0.146650","151.101.65.140","100.86.235.39","SSLv2","1510",""
"225","0.147026","151.101.65.140","100.86.235.39","SSLv2","1510",""
"226","0.147126","100.86.235.39","151.101.65.140","TCP","66","56473  >  443 [ACK] Seq=1 Ack=179057 Win=4672 Len=0 TSval=1656561188 TSecr=2958628872"
"227","0.148323","151.101.65.140","100.86.235.39","SSLv2","1510",""
"228","0.148325","151.101.65.140","100.86.235.39","SSLv2","1510",""
"229","0.148326","151.101.65.140","100.86.235.39","TCP","1510","443  >  56383 [ACK] Seq=4229 Ack=12523 Win=538 Len=1444 TSval=557213927 TSecr=1359988929 [TCP PDU reassembled in 232]"
"230","0.148451","100.86.235.39","151.101.65.140","TCP","66","56383  >  443 [ACK] Seq=12523 Ack=5673 Win=2025 Len=0 TSval=1359988947 TSecr=557213927"
"231","0.148544","100.86.235.39","151.101.65.140","TCP","66","56473  >  443 [ACK] Seq=1 Ack=181945 Win=4672 Len=0 TSval=1656561189 TSecr=2958628873"
"232","0.149129","151.101.65.140","100.86.235.39","TLSv1.2","932","Application Data"
"233","0.149201","100.86.235.39","151.101.65.140","TCP","66","56383  >  443 [ACK] Seq=12523 Ack=6539 Win=2034 Len=0 TSval=1359988947 TSecr=557213927"
"234","0.150013","100.86.235.39","151.101.65.140","TCP","1514","56383  >  443 [ACK] Seq=12523 Ack=6539 Win=2048 Len=1448 TSval=1359988949 TSecr=557213927 [TCP PDU reassembled in 236]"
"235","0.150016","100.86.235.39","151.101.65.140","TCP","1514","56383  >  443 [ACK] Seq=13971 Ack=6539 Win=2048 Len=1448 TSval=1359988949 TSecr=557213927 [TCP PDU reassembled in 236]"
"236","0.150041","100.86.235.39","151.101.65.140","TLSv1.2","208","Application Data"
"237","0.151554","151.101.65.140","100.86.235.39","SSLv2","1510",""
"238","0.151971","151.101.65.140","100.86.235.39","SSLv2","1510",""
"239","0.152078","100.86.235.39","151.101.65.140","TCP","66","56473  >  443 [ACK] Seq=1 Ack=184833 Win=4672 Len=0 TSval=1656561192 TSecr=2958628876"
"240","0.152420","151.101.65.140","100.86.235.39","SSLv2","1510",""
"241","0.152421","151.101.65.140","100.86.235.39","SSLv2","1510",""
"242","0.152520","100.86.235.39","151.101.65.140","TCP","66","56473  >  443 [ACK] Seq=1 Ack=187721 Win=4672 Len=0 TSval=1656561192 TSecr=2958628877"
"243","0.154005","151.101.65.140","100.86.235.39","SSLv2","1510",""
"244","0.154380","151.101.65.140","100.86.235.39","SSLv2","1510",""
"245","0.154476","100.86.235.39","151.101.65.140","TCP","66","56473  >  443 [ACK] Seq=1 Ack=190609 Win=4672 Len=0 TSval=1656561195 TSecr=2958628879"
"246","0.158149","151.101.65.140","100.86.235.39","SSLv2","1510",""
"247","0.158765","151.101.65.140","100.86.235.39","SSLv2","1510",""
"248","0.158859","100.86.235.39","151.101.65.140","TCP","66","56473  >  443 [ACK] Seq=1 Ack=193497 Win=4672 Len=0 TSval=1656561199 TSecr=2958628884"
"249","0.159427","151.101.65.140","100.86.235.39","SSLv2","1510",""
"250","0.159429","151.101.65.140","100.86.235.39","SSLv2","1510",""
"251","0.159519","100.86.235.39","151.101.65.140","TCP","66","56473  >  443 [ACK] Seq=1 Ack=196385 Win=4672 Len=0 TSval=1656561200 TSecr=2958628884"
"252","0.161329","151.101.65.140","100.86.235.39","TCP","66","443  >  56383 [ACK] Seq=6539 Ack=15561 Win=533 Len=0 TSval=557213940 TSecr=1359988949"
"253","0.161942","151.101.65.140","100.86.235.39","SSLv2","1510",""
"254","0.161943","151.101.65.140","100.86.235.39","SSLv2","1510",""
"255","0.162154","100.86.235.39","151.101.65.140","TCP","66","56473  >  443 [ACK] Seq=1 Ack=199273 Win=4672 Len=0 TSval=1656561202 TSecr=2958628887"
"256","0.163575","151.101.65.140","100.86.235.39","SSLv2","1510",""
"257","0.164167","151.101.65.140","100.86.235.39","SSLv2","1510",""
"258","0.164169","151.101.65.140","100.86.235.39","SSLv2","1510",""
"259","0.164268","100.86.235.39","151.101.65.140","TCP","66","56473  >  443 [ACK] Seq=1 Ack=203605 Win=4672 Len=0 TSval=1656561205 TSecr=2958628889"
"260","0.164347","151.101.65.140","100.86.235.39","SSLv2","1510",""
"261","0.164419","100.86.235.39","151.101.65.140","TCP","66","56473  >  443 [ACK] Seq=1 Ack=205049 Win=4672 Len=0 TSval=1656561205 TSecr=2958628890"
"262","0.169723","151.101.65.140","100.86.235.39","SSLv2","1510",""
"263","0.169754","151.101.65.140","100.86.235.39","SSLv2","1510",""
"264","0.169988","100.86.235.39","151.101.65.140","TCP","1514","56383  >  443 [ACK] Seq=15561 Ack=6539 Win=2048 Len=1448 TSval=1359988969 TSecr=557213940 [TCP PDU reassembled in 266]"
"265","0.169990","100.86.235.39","151.101.65.140","TCP","1514","56383  >  443 [ACK] Seq=17009 Ack=6539 Win=2048 Len=1448 TSval=1359988969 TSecr=557213940 [TCP PDU reassembled in 266]"
"266","0.170027","100.86.235.39","151.101.65.140","TLSv1.2","208","Application Data"
"267","0.170186","100.86.235.39","151.101.65.140","TCP","66","56473  >  443 [ACK] Seq=1 Ack=207937 Win=4672 Len=0 TSval=1656561211 TSecr=2958628895"
"268","0.170626","151.101.65.140","100.86.235.39","SSLv2","1510",""
"269","0.170928","151.101.65.140","100.86.235.39","SSLv2","1510",""
"270","0.171012","100.86.235.39","151.101.65.140","TCP","66","56473  >  443 [ACK] Seq=1 Ack=210825 Win=4672 Len=0 TSval=1656561212 TSecr=2958628896"
"271","0.174120","151.101.65.140","100.86.235.39","SSLv2","1510",""
"272","0.174157","151.101.65.140","100.86.235.39","SSLv2","1510",""
"273","0.174370","100.86.235.39","151.101.65.140","TCP","66","56473  >  443 [ACK] Seq=1 Ack=213713 Win=4672 Len=0 TSval=1656561215 TSecr=2958628900"
"274","0.174917","151.101.65.140","100.86.235.39","SSLv2","1510",""
"275","0.175189","151.101.65.140","100.86.235.39","SSLv2","1510",""
"276","0.175279","100.86.235.39","151.101.65.140","TCP","1514","56383  >  443 [ACK] Seq=18599 Ack=6539 Win=2048 Len=1448 TSval=1359988974 TSecr=557213940 [TCP PDU reassembled in 277]"
"277","0.175308","100.86.235.39","151.101.65.140","TLSv1.2","1502","Application Data"
"278","0.175439","100.86.235.39","151.101.65.140","TCP","66","56473  >  443 [ACK] Seq=1 Ack=216601 Win=4672 Len=0 TSval=1656561216 TSecr=2958628900"
"279","0.179008","151.101.65.140","100.86.235.39","SSLv2","1510",""
"280","0.179045","151.101.65.140","100.86.235.39","SSLv2","1510",""
"281","0.179143","100.86.235.39","151.101.65.140","TCP","66","56473  >  443 [ACK] Seq=1 Ack=219489 Win=4672 Len=0 TSval=1656561220 TSecr=2958628902"
"282","0.180149","151.101.65.140","100.86.235.39","TCP","66","443  >  56383 [ACK] Seq=6539 Ack=18599 Win=534 Len=0 TSval=557213959 TSecr=1359988969"
"283","0.180794","151.101.65.140","100.86.235.39","SSLv2","1510",""
"284","0.180795","151.101.65.140","100.86.235.39","SSLv2","1510",""
"285","0.180908","100.86.235.39","151.101.65.140","TCP","66","56473  >  443 [ACK] Seq=1 Ack=222377 Win=4672 Len=0 TSval=1656561221 TSecr=2958628906"
"286","0.181612","151.101.65.140","100.86.235.39","SSLv2","1510",""
"287","0.181613","151.101.65.140","100.86.235.39","SSLv2","1510",""
"288","0.182204","100.86.235.39","151.101.65.140","TCP","66","56473  >  443 [ACK] Seq=1 Ack=225265 Win=4672 Len=0 TSval=1656561223 TSecr=2958628906"
"289","0.186211","151.101.65.140","100.86.235.39","TCP","66","443  >  56383 [ACK] Seq=6539 Ack=21483 Win=538 Len=0 TSval=557213965 TSecr=1359988974"
"290","0.186246","151.101.65.140","100.86.235.39","SSLv2","1510","Encrypted Data"
"291","0.186248","151.101.65.140","100.86.235.39","SSLv2","1510",""
"292","0.186362","100.86.235.39","151.101.65.140","TCP","66","56473  >  443 [ACK] Seq=1 Ack=228153 Win=4672 Len=0 TSval=1656561227 TSecr=2958628912"
"293","0.186752","151.101.65.140","100.86.235.39","TCP","1510","443  >  56473 [ACK] Seq=228153 Ack=1 Win=298 Len=1444 TSval=2958628912 TSecr=1656561216 [TCP PDU reassembled in 313]"
"294","0.186753","151.101.65.140","100.86.235.39","TCP","1510","443  >  56473 [PSH, ACK] Seq=229597 Ack=1 Win=298 Len=1444 TSval=2958628912 TSecr=1656561216 [TCP PDU reassembled in 313]"
"295","0.186929","100.86.235.39","151.101.65.140","TCP","66","56473  >  443 [ACK] Seq=1 Ack=231041 Win=4672 Len=0 TSval=1656561227 TSecr=2958628912"
"296","0.188346","151.101.65.140","100.86.235.39","TCP","1510","443  >  56473 [ACK] Seq=231041 Ack=1 Win=298 Len=1444 TSval=2958628914 TSecr=1656561216 [TCP PDU reassembled in 313]"
"297","0.189977","151.101.65.140","100.86.235.39","TCP","1510","443  >  56473 [ACK] Seq=232485 Ack=1 Win=298 Len=1444 TSval=2958628915 TSecr=1656561220 [TCP PDU reassembled in 313]"
"298","0.190876","151.101.65.140","100.86.235.39","TCP","1510","443  >  56473 [PSH, ACK] Seq=233929 Ack=1 Win=298 Len=1444 TSval=2958628915 TSecr=1656561220 [TCP PDU reassembled in 313]"
"299","0.190912","151.101.65.140","100.86.235.39","TCP","1510","443  >  56473 [ACK] Seq=235373 Ack=1 Win=298 Len=1444 TSval=2958628916 TSecr=1656561221 [TCP PDU reassembled in 313]"
"300","0.190913","151.101.65.140","100.86.235.39","TCP","1510","443  >  56473 [PSH, ACK] Seq=236817 Ack=1 Win=298 Len=1444 TSval=2958628916 TSecr=1656561221 [TCP PDU reassembled in 313]"
"301","0.190993","100.86.235.39","151.101.65.140","TCP","66","56473  >  443 [ACK] Seq=1 Ack=238261 Win=4672 Len=0 TSval=1656561231 TSecr=2958628914"
"302","0.193569","151.101.65.140","100.86.235.39","TCP","1510","443  >  56473 [ACK] Seq=238261 Ack=1 Win=298 Len=1444 TSval=2958628919 TSecr=1656561223 [TCP PDU reassembled in 313]"
"303","0.193607","151.101.65.140","100.86.235.39","TCP","1510","443  >  56473 [PSH, ACK] Seq=239705 Ack=1 Win=298 Len=1444 TSval=2958628919 TSecr=1656561223 [TCP PDU reassembled in 313]"
"304","0.193704","100.86.235.39","151.101.65.140","TCP","66","56473  >  443 [ACK] Seq=1 Ack=241149 Win=4672 Len=0 TSval=1656561235 TSecr=2958628919"
"305","0.194730","100.86.235.39","151.101.65.140","TCP","1514","56383  >  443 [ACK] Seq=21483 Ack=6539 Win=2048 Len=1448 TSval=1359988994 TSecr=557213965 [TCP PDU reassembled in 307]"
"306","0.194733","100.86.235.39","151.101.65.140","TCP","1514","56383  >  443 [ACK] Seq=22931 Ack=6539 Win=2048 Len=1448 TSval=1359988994 TSecr=557213965 [TCP PDU reassembled in 307]"
"307","0.194793","100.86.235.39","151.101.65.140","TLSv1.2","87","Application Data"
"308","0.195902","151.101.65.140","100.86.235.39","TCP","1510","443  >  56473 [ACK] Seq=241149 Ack=1 Win=298 Len=1444 TSval=2958628922 TSecr=1656561227 [TCP PDU reassembled in 313]"
"309","0.196825","151.101.65.140","100.86.235.39","TCP","1510","443  >  56473 [PSH, ACK] Seq=242593 Ack=1 Win=298 Len=1444 TSval=2958628922 TSecr=1656561227 [TCP PDU reassembled in 313]"
"310","0.196949","100.86.235.39","151.101.65.140","TCP","66","56473  >  443 [ACK] Seq=1 Ack=244037 Win=4672 Len=0 TSval=1656561237 TSecr=2958628922"
"311","0.200269","151.101.65.140","100.86.235.39","TCP","1510","443  >  56473 [ACK] Seq=244037 Ack=1 Win=298 Len=1444 TSval=2958628923 TSecr=1656561227 [TCP PDU reassembled in 313]"
"312","0.200923","151.101.65.140","100.86.235.39","TCP","1510","443  >  56473 [PSH, ACK] Seq=245481 Ack=1 Win=298 Len=1444 TSval=2958628923 TSecr=1656561227 [TCP PDU reassembled in 313]"
"313","0.200925","151.101.65.140","100.86.235.39","SSLv2","1510","Encrypted Data"
"314","0.200926","151.101.65.140","100.86.235.39","TCP","1510","443  >  56473 [PSH, ACK] Seq=248369 Ack=1 Win=298 Len=1444 TSval=2958628926 TSecr=1656561231 [TCP PDU reassembled in 325]"
"315","0.201237","100.86.235.39","151.101.65.140","TCP","66","56473  >  443 [ACK] Seq=1 Ack=249813 Win=4672 Len=0 TSval=1656561241 TSecr=2958628923"
"316","0.201357","151.101.65.140","100.86.235.39","TCP","1510","443  >  56473 [ACK] Seq=249813 Ack=1 Win=298 Len=1444 TSval=2958628927 TSecr=1656561231 [TCP PDU reassembled in 325]"
"317","0.201359","151.101.65.140","100.86.235.39","TCP","1510","443  >  56473 [PSH, ACK] Seq=251257 Ack=1 Win=298 Len=1444 TSval=2958628927 TSecr=1656561231 [TCP PDU reassembled in 325]"
"318","0.201470","100.86.235.39","151.101.65.140","TCP","66","56473  >  443 [ACK] Seq=1 Ack=252701 Win=4672 Len=0 TSval=1656561242 TSecr=2958628927"
"319","0.201930","151.101.65.140","100.86.235.39","TCP","1510","443  >  56383 [ACK] Seq=6539 Ack=21483 Win=538 Len=1444 TSval=557213980 TSecr=1359988974 [TCP PDU reassembled in 320]"
"320","0.201934","151.101.65.140","100.86.235.39","TLSv1.2","231","Application Data"
"321","0.202047","100.86.235.39","151.101.65.140","TCP","66","56383  >  443 [ACK] Seq=24400 Ack=8148 Win=2022 Len=0 TSval=1359989000 TSecr=557213980"
"322","0.203088","151.101.65.140","100.86.235.39","TCP","1510","443  >  56473 [ACK] Seq=252701 Ack=1 Win=298 Len=1444 TSval=2958628928 TSecr=1656561231 [TCP PDU reassembled in 325]"
"323","0.204148","151.101.65.140","100.86.235.39","TCP","1510","443  >  56473 [PSH, ACK] Seq=254145 Ack=1 Win=298 Len=1444 TSval=2958628928 TSecr=1656561231 [TCP PDU reassembled in 325]"
"324","0.204369","100.86.235.39","151.101.65.140","TCP","66","56473  >  443 [ACK] Seq=1 Ack=255589 Win=4672 Len=0 TSval=1656561245 TSecr=2958628928"
"325","0.204453","151.101.65.140","100.86.235.39","SSLv2","1510","Encrypted Data"
"326","0.204455","151.101.65.140","100.86.235.39","TCP","1510","443  >  56473 [PSH, ACK] Seq=257033 Ack=1 Win=298 Len=1444 TSval=2958628930 TSecr=1656561235 [TCP PDU reassembled in 342]"
"327","0.204547","100.86.235.39","151.101.65.140","TCP","66","56473  >  443 [ACK] Seq=1 Ack=258477 Win=4672 Len=0 TSval=1656561245 TSecr=2958628930"
"328","0.205063","151.101.65.140","100.86.235.39","TCP","1510","443  >  56383 [ACK] Seq=8148 Ack=21483 Win=538 Len=1444 TSval=557213984 TSecr=1359988974 [TCP PDU reassembled in 329]"
"329","0.205065","151.101.65.140","100.86.235.39","TLSv1.2","953","Application Data"
"330","0.205112","100.86.235.39","151.101.65.140","TCP","66","56383  >  443 [ACK] Seq=24400 Ack=10479 Win=2011 Len=0 TSval=1359989003 TSecr=557213984"
"331","0.206160","151.101.65.140","100.86.235.39","TCP","66","443  >  56383 [ACK] Seq=10479 Ack=24400 Win=533 Len=0 TSval=557213985 TSecr=1359988994"
"332","0.206436","151.101.65.140","100.86.235.39","TCP","1510","443  >  56473 [ACK] Seq=258477 Ack=1 Win=298 Len=1444 TSval=2958628932 TSecr=1656561237 [TCP PDU reassembled in 342]"
"333","0.207022","151.101.65.140","100.86.235.39","TCP","1510","443  >  56473 [PSH, ACK] Seq=259921 Ack=1 Win=298 Len=1444 TSval=2958628932 TSecr=1656561237 [TCP PDU reassembled in 342]"
"334","0.207208","100.86.235.39","151.101.65.140","TCP","66","56473  >  443 [ACK] Seq=1 Ack=261365 Win=4672 Len=0 TSval=1656561247 TSecr=2958628932"
"335","0.211507","151.101.65.140","100.86.235.39","TCP","1510","443  >  56473 [ACK] Seq=261365 Ack=1 Win=298 Len=1444 TSval=2958628937 TSecr=1656561242 [TCP PDU reassembled in 342]"
"336","0.211545","151.101.65.140","100.86.235.39","TCP","1510","443  >  56473 [PSH, ACK] Seq=262809 Ack=1 Win=298 Len=1444 TSval=2958628937 TSecr=1656561242 [TCP PDU reassembled in 342]"
"337","0.211707","100.86.235.39","151.101.65.140","TCP","66","56473  >  443 [ACK] Seq=1 Ack=264253 Win=4672 Len=0 TSval=1656561252 TSecr=2958628937"
