"No.","Time","Source","Destination","Protocol","Length","Info"
"1","0.000000","151.101.65.140","100.86.235.39","TLSv1.2","1510","Ignored Unknown Record"
"2","0.000001","151.101.65.140","100.86.235.39","TLSv1.2","1510","Ignored Unknown Record"
"3","0.000002","151.101.65.140","100.86.235.39","TLSv1.2","1510","Ignored Unknown Record"
"4","0.000081","100.86.235.39","151.101.65.140","TCP","78","56473  >  443 [ACK] Seq=1 Ack=4294957189 Win=4672 Len=0 TSval=1656514634 TSecr=2958582064 SLE=4294958633 SRE=4333"
"5","0.000110","151.101.65.140","100.86.235.39","TLSv1.2","1510","Ignored Unknown Record"
"6","0.000111","151.101.65.140","100.86.235.39","TCP","1510","[TCP Out-Of-Order] 443  >  56473 [ACK] Seq=4294957189 Ack=1 Win=298 Len=1444 TSval=2958582097 TSecr=1656514400"
"7","0.000149","100.86.235.39","151.101.65.140","TCP","78","[TCP Dup ACK 4#1] 56473  >  443 [ACK] Seq=1 Ack=4294957189 Win=4672 Len=0 TSval=1656514634 TSecr=2958582064 SLE=4294958633 SRE=5777"
"8","0.000172","100.86.235.39","151.101.65.140","TCP","66","56473  >  443 [ACK] Seq=1 Ack=5777 Win=4424 Len=0 TSval=1656514634 TSecr=2958582097"
"9","0.000369","100.86.235.39","151.101.65.140","TCP","66","[TCP Window Update] 56473  >  443 [ACK] Seq=1 Ack=5777 Win=4672 Len=0 TSval=1656514634 TSecr=2958582097"
"10","0.002443","151.101.65.140","100.86.235.39","TLSv1.2","1510","Ignored Unknown Record"
"11","0.002444","151.101.65.140","100.86.235.39","TLSv1.2","1510","Ignored Unknown Record"
"12","0.002445","151.101.65.140","100.86.235.39","TLSv1.2","1510","Ignored Unknown Record"
"13","0.002446","151.101.65.140","100.86.235.39","TLSv1.2","1510","Ignored Unknown Record"
"14","0.002447","151.101.65.140","100.86.235.39","TLSv1.2","1510","Ignored Unknown Record"
"15","0.002447","151.101.65.140","100.86.235.39","TLSv1.2","576","Application Data"
"16","0.002448","151.101.65.140","100.86.235.39","TLSv1.2","145","Application Data"
"17","0.002448","151.101.65.140","100.86.235.39","TLSv1.2","413","Application Data"
"18","0.002449","151.101.65.140","100.86.235.39","TLSv1.2","413","Application Data"
"19","0.002449","151.101.65.140","100.86.235.39","TLSv1.2","126","Application Data"
"20","0.002450","151.101.65.140","100.86.235.39","TLSv1.2","209","Application Data"
"21","0.002450","151.101.65.140","100.86.235.39","TLSv1.2","128","Application Data"
"22","0.002451","151.101.65.140","100.86.235.39","TLSv1.2","576","Application Data"
"23","0.002451","151.101.65.140","100.86.235.39","TLSv1.2","239","Application Data"
"24","0.002452","151.101.65.140","100.86.235.39","TLSv1.2","132","Application Data"
"25","0.002452","151.101.65.140","100.86.235.39","TLSv1.2","143","Application Data"
"26","0.002452","151.101.65.140","100.86.235.39","TLSv1.2","140","Application Data"
"27","0.002453","151.101.65.140","100.86.235.39","TLSv1.2","164","Application Data"
"28","0.002453","151.101.65.140","100.86.235.39","TLSv1.2","108","Application Data"
"29","0.002453","151.101.65.140","100.86.235.39","TLSv1.2","418","Application Data"
"30","0.002454","151.101.65.140","100.86.235.39","TLSv1.2","167","Application Data"
"31","0.002454","151.101.65.140","100.86.235.39","TCP","1510","443  >  56383 [ACK] Seq=3042 Ack=1 Win=538 Len=1444 TSval=557167206 TSecr=1359941871 [TCP PDU reassembled in 32]"
"32","0.002455","151.101.65.140","100.86.235.39","TLSv1.2","248","Application Data"
"33","0.002455","151.101.65.140","100.86.235.39","TLSv1.2","521","Application Data"
"34","0.002456","151.101.65.140","100.86.235.39","TLSv1.2","672","Application Data"
"35","0.002456","151.101.65.140","100.86.235.39","TLSv1.2","576","Application Data"
"36","0.002457","151.101.65.140","100.86.235.39","TLSv1.2","1510","Application Data, Application Data, Application Data"
"37","0.002546","100.86.235.39","151.101.65.140","TCP","66","56473  >  443 [ACK] Seq=1 Ack=12997 Win=4559 Len=0 TSval=1656514637 TSecr=2958582104"
"38","0.002619","100.86.235.39","151.101.65.140","TCP","66","56383  >  443 [ACK] Seq=1 Ack=7683 Win=1927 Len=0 TSval=1359942395 TSecr=557167290"
"39","0.002650","100.86.235.39","151.101.65.140","TCP","66","[TCP Window Update] 56473  >  443 [ACK] Seq=1 Ack=12997 Win=4672 Len=0 TSval=1656514637 TSecr=2958582104"
"40","0.003107","100.86.235.39","151.101.65.140","TCP","66","[TCP Window Update] 56383  >  443 [ACK] Seq=1 Ack=7683 Win=2048 Len=0 TSval=1359942395 TSecr=557167290"
"41","0.009880","151.101.65.140","100.86.235.39","TCP","1510","[TCP Spurious Retransmission] 443  >  56473 [ACK] Seq=4294957189 Ack=1 Win=298 Len=1444 TSval=2958582326 TSecr=1656514400"
"42","0.009983","100.86.235.39","151.101.65.140","TCP","78","[TCP Dup ACK 37#1] 56473  >  443 [ACK] Seq=1 Ack=12997 Win=4672 Len=0 TSval=1656514644 TSecr=2958582104 SLE=4294957189 SRE=4294958633"
"43","0.011299","151.101.65.140","100.86.235.39","TCP","1510","[TCP Spurious Retransmission] 443  >  56473 [ACK] Seq=5777 Ack=1 Win=298 Len=1444 TSval=2958582328 TSecr=1656514634"
"44","0.011304","151.101.65.140","100.86.235.39","TCP","1510","[TCP Spurious Retransmission] 443  >  56473 [PSH, ACK] Seq=7221 Ack=1 Win=298 Len=1444 TSval=2958582328 TSecr=1656514634"
"45","0.011394","100.86.235.39","151.101.65.140","TCP","78","[TCP Dup ACK 37#2] 56473  >  443 [ACK] Seq=1 Ack=12997 Win=4672 Len=0 TSval=1656514646 TSecr=2958582104 SLE=5777 SRE=8665"
"46","0.014291","151.101.65.140","100.86.235.39","TLSv1.2","1510","Application Data, Application Data, Application Data"
"47","0.014294","151.101.65.140","100.86.235.39","TLSv1.2","1510","Application Data, Application Data, Application Data, Application Data, Application Data"
"48","0.014395","100.86.235.39","151.101.65.140","TCP","66","56383  >  443 [ACK] Seq=1 Ack=10571 Win=2002 Len=0 TSval=1359942407 TSecr=557167385"
"49","0.015861","151.101.65.140","100.86.235.39","TLSv1.2","1510","Application Data, Application Data, Application Data, Application Data, Application Data, Application Data"
"50","0.015932","100.86.235.39","151.101.65.140","TCP","66","56383  >  443 [ACK] Seq=1 Ack=12015 Win=2025 Len=0 TSval=1359942408 TSecr=557167387"
"51","0.016449","151.101.65.140","100.86.235.39","TLSv1.2","1510","Application Data, Application Data, Application Data"
"52","0.016592","100.86.235.39","151.101.65.140","TCP","66","56383  >  443 [ACK] Seq=1 Ack=13459 Win=2048 Len=0 TSval=1359942408 TSecr=557167387"
"53","0.021840","151.101.65.140","100.86.235.39","TLSv1.2","1510","Application Data, Application Data, Application Data, Application Data, Application Data"
"54","0.021842","151.101.65.140","100.86.235.39","TLSv1.2","1510","Application Data, Application Data, Application Data, Application Data, Application Data, Application Data"
"55","0.021933","100.86.235.39","151.101.65.140","TCP","66","56383  >  443 [ACK] Seq=1 Ack=16347 Win=2002 Len=0 TSval=1359942414 TSecr=557167391"
"56","0.026936","151.101.65.140","100.86.235.39","TLSv1.2","1438","Application Data, Application Data, Application Data, Application Data"
"57","0.026938","151.101.65.140","100.86.235.39","TLSv1.2","1510",""
"58","0.026939","151.101.65.140","100.86.235.39","TLSv1.2","1510","Ignored Unknown Record"
"59","0.027021","100.86.235.39","151.101.65.140","TCP","66","56383  >  443 [ACK] Seq=1 Ack=17719 Win=2026 Len=0 TSval=1359942419 TSecr=557167396"
"60","0.027079","100.86.235.39","151.101.65.140","TCP","66","56473  >  443 [ACK] Seq=1 Ack=15885 Win=4627 Len=0 TSval=1656514661 TSecr=2958582344"
"61","0.027107","151.101.65.140","100.86.235.39","TLSv1.2","1510","Application Data, Application Data, Application Data, Application Data, Application Data"
"62","0.027109","151.101.65.140","100.86.235.39","TLSv1.2","1510","Application Data, Application Data, Application Data, Application Data, Application Data, Application Data, Application Data, Application Data, Application Data"
"63","0.027145","100.86.235.39","151.101.65.140","TCP","66","56383  >  443 [ACK] Seq=1 Ack=20607 Win=1994 Len=0 TSval=1359942419 TSecr=557167398"
"64","0.027421","100.86.235.39","151.101.65.140","TCP","66","[TCP Window Update] 56383  >  443 [ACK] Seq=1 Ack=20607 Win=2048 Len=0 TSval=1359942419 TSecr=557167398"
"65","0.032067","151.101.65.140","100.86.235.39","TLSv1.2","1510","Application Data, Application Data, Application Data, Application Data, Application Data, Application Data, Application Data, Application Data, Application Data, Application Data, Application Data, Application Data, Application Data, Application Data"
"66","0.032070","151.101.65.140","100.86.235.39","TLSv1.2","1510","Application Data, Application Data, Application Data, Application Data"
"67","0.032157","100.86.235.39","151.101.65.140","TCP","66","56383  >  443 [ACK] Seq=1 Ack=23495 Win=2002 Len=0 TSval=1359942424 TSecr=557167402"
"68","0.037211","151.101.65.140","100.86.235.39","TLSv1.2","1510","Application Data, Application Data, Application Data"
"69","0.037212","151.101.65.140","100.86.235.39","TLSv1.2","1510","Application Data, Application Data, Application Data"
"70","0.037305","100.86.235.39","151.101.65.140","TCP","66","56383  >  443 [ACK] Seq=1 Ack=26383 Win=2002 Len=0 TSval=1359942430 TSecr=557167407"
"71","0.039299","151.101.65.140","100.86.235.39","TLSv1.2","386","Application Data, Application Data, Application Data, Application Data, Application Data"
"72","0.039385","100.86.235.39","151.101.65.140","TCP","66","56383  >  443 [ACK] Seq=1 Ack=26703 Win=2043 Len=0 TSval=1359942432 TSecr=557167410"
"73","0.040080","151.101.65.140","100.86.235.39","TLSv1.2","431","Application Data, Application Data, Application Data, Application Data"
"74","0.040245","100.86.235.39","151.101.65.140","TCP","66","56383  >  443 [ACK] Seq=1 Ack=27068 Win=2048 Len=0 TSval=1359942432 TSecr=557167411"
"75","0.053268","151.101.65.140","100.86.235.39","TLSv1.2","1510","Ignored Unknown Record"
"76","0.053269","151.101.65.140","100.86.235.39","TLSv1.2","1510","Ignored Unknown Record"
"77","0.053342","100.86.235.39","151.101.65.140","TCP","66","56473  >  443 [ACK] Seq=1 Ack=18773 Win=4627 Len=0 TSval=1656514688 TSecr=2958582370"
"78","0.077442","151.101.65.140","100.86.235.39","TLSv1.2","1510","Ignored Unknown Record"
"79","0.077443","151.101.65.140","100.86.235.39","TLSv1.2","1510","Ignored Unknown Record"
"80","0.077528","100.86.235.39","151.101.65.140","TCP","66","56473  >  443 [ACK] Seq=1 Ack=21661 Win=4627 Len=0 TSval=1656514712 TSecr=2958582395"
"81","0.106302","151.101.65.140","100.86.235.39","TLSv1.2","1510","Ignored Unknown Record"
"82","0.106415","100.86.235.39","151.101.65.140","TCP","66","56473  >  443 [ACK] Seq=1 Ack=23105 Win=4649 Len=0 TSval=1656514741 TSecr=2958582420"
"83","0.112886","151.101.65.140","100.86.235.39","TLSv1.2","1510","Ignored Unknown Record"
"84","0.112887","151.101.65.140","100.86.235.39","TLSv1.2","1510","Ignored Unknown Record"
"85","0.112997","100.86.235.39","151.101.65.140","TCP","66","56473  >  443 [ACK] Seq=1 Ack=25993 Win=4627 Len=0 TSval=1656514747 TSecr=2958582429"
"86","0.129465","151.101.65.140","100.86.235.39","TLSv1.2","1510","Ignored Unknown Record"
"87","0.129466","151.101.65.140","100.86.235.39","TLSv1.2","1510","Ignored Unknown Record"
"88","0.129654","100.86.235.39","151.101.65.140","TCP","66","56473  >  443 [ACK] Seq=1 Ack=28881 Win=4627 Len=0 TSval=1656514764 TSecr=2958582447"
"89","0.143181","151.101.65.140","100.86.235.39","TLSv1.2","1510","Ignored Unknown Record"
"90","0.143183","151.101.65.140","100.86.235.39","TLSv1.2","1510","Ignored Unknown Record"
"91","0.143262","100.86.235.39","151.101.65.140","TCP","66","56473  >  443 [ACK] Seq=1 Ack=31769 Win=4627 Len=0 TSval=1656514778 TSecr=2958582459"
"92","0.152995","151.101.65.140","100.86.235.39","TLSv1.2","1510","Ignored Unknown Record"
"93","0.152997","151.101.65.140","100.86.235.39","TLSv1.2","1510",""
"94","0.153102","100.86.235.39","151.101.65.140","TCP","66","56473  >  443 [ACK] Seq=1 Ack=34657 Win=4627 Len=0 TSval=1656514787 TSecr=2958582469"
"95","0.160300","151.101.65.140","100.86.235.39","TLSv1.2","1510","Ignored Unknown Record"
"96","0.160301","151.101.65.140","100.86.235.39","TLSv1.2","1510",""
"97","0.160387","100.86.235.39","151.101.65.140","TCP","66","56473  >  443 [ACK] Seq=1 Ack=37545 Win=4627 Len=0 TSval=1656514795 TSecr=2958582476"
"98","0.165233","151.101.65.140","100.86.235.39","TLSv1.2","1510","Ignored Unknown Record"
"99","0.165315","100.86.235.39","151.101.65.140","TCP","66","56473  >  443 [ACK] Seq=1 Ack=38989 Win=4649 Len=0 TSval=1656514799 TSecr=2958582483"
"100","0.165451","151.101.65.140","100.86.235.39","TLSv1.2","1510","Ignored Unknown Record"
"101","0.165503","100.86.235.39","151.101.65.140","TCP","66","56473  >  443 [ACK] Seq=1 Ack=40433 Win=4649 Len=0 TSval=1656514799 TSecr=2958582483"
"102","0.173501","151.101.65.140","100.86.235.39","TLSv1.2","1510","Ignored Unknown Record"
"103","0.173502","151.101.65.140","100.86.235.39","TLSv1.2","1510","Ignored Unknown Record"
"104","0.173580","100.86.235.39","151.101.65.140","TCP","66","56473  >  443 [ACK] Seq=1 Ack=43321 Win=4627 Len=0 TSval=1656514808 TSecr=2958582489"
"105","0.178266","151.101.65.140","100.86.235.39","TLSv1.2","1510","Ignored Unknown Record"
"106","0.178365","100.86.235.39","151.101.65.140","TCP","66","56473  >  443 [ACK] Seq=1 Ack=44765 Win=4649 Len=0 TSval=1656514813 TSecr=2958582495"
"107","0.178579","151.101.65.140","100.86.235.39","TCP","1510","443  >  56473 [PSH, ACK] Seq=44765 Ack=1 Win=298 Len=1444 TSval=2958582495 TSecr=1656514787 [TCP PDU reassembled in 135]"
"108","0.178707","100.86.235.39","151.101.65.140","TCP","66","56473  >  443 [ACK] Seq=1 Ack=46209 Win=4672 Len=0 TSval=1656514813 TSecr=2958582495"
"109","0.184226","151.101.65.140","100.86.235.39","TCP","1510","443  >  56473 [ACK] Seq=46209 Ack=1 Win=298 Len=1444 TSval=2958582500 TSecr=1656514795 [TCP PDU reassembled in 135]"
"110","0.184228","151.101.65.140","100.86.235.39","TCP","1510","443  >  56473 [PSH, ACK] Seq=47653 Ack=1 Win=298 Len=1444 TSval=2958582500 TSecr=1656514795 [TCP PDU reassembled in 135]"
"111","0.184486","100.86.235.39","151.101.65.140","TCP","66","56473  >  443 [ACK] Seq=1 Ack=49097 Win=4672 Len=0 TSval=1656514819 TSecr=2958582500"
"112","0.187166","100.86.235.39","151.101.65.140","TCP","1514","56383  >  443 [ACK] Seq=1 Ack=27068 Win=2048 Len=1448 TSval=1359942579 TSecr=557167411 [TCP PDU reassembled in 114]"
"113","0.187168","100.86.235.39","151.101.65.140","TCP","1514","56383  >  443 [ACK] Seq=1449 Ack=27068 Win=2048 Len=1448 TSval=1359942579 TSecr=557167411 [TCP PDU reassembled in 114]"
"114","0.187195","100.86.235.39","151.101.65.140","TLSv1.2","179","Application Data"
"115","0.187242","100.86.235.39","151.101.65.140","TLSv1.2","222","Application Data"
"116","0.187681","151.101.65.140","100.86.235.39","TCP","1510","443  >  56473 [ACK] Seq=49097 Ack=1 Win=298 Len=1444 TSval=2958582505 TSecr=1656514799 [TCP PDU reassembled in 135]"
"117","0.189264","151.101.65.140","100.86.235.39","TCP","1510","443  >  56473 [PSH, ACK] Seq=50541 Ack=1 Win=298 Len=1444 TSval=2958582505 TSecr=1656514799 [TCP PDU reassembled in 135]"
"118","0.189391","100.86.235.39","151.101.65.140","TCP","66","56473  >  443 [ACK] Seq=1 Ack=51985 Win=4672 Len=0 TSval=1656514824 TSecr=2958582505"
"119","0.192828","151.101.65.140","100.86.235.39","TCP","1510","443  >  56473 [ACK] Seq=51985 Ack=1 Win=298 Len=1444 TSval=2958582509 TSecr=1656514799 [TCP PDU reassembled in 135]"
"120","0.192830","151.101.65.140","100.86.235.39","TCP","1510","443  >  56473 [PSH, ACK] Seq=53429 Ack=1 Win=298 Len=1444 TSval=2958582509 TSecr=1656514799 [TCP PDU reassembled in 135]"
"121","0.192967","100.86.235.39","151.101.65.140","TCP","66","56473  >  443 [ACK] Seq=1 Ack=54873 Win=4672 Len=0 TSval=1656514827 TSecr=2958582509"
"122","0.212995","100.86.235.39","151.101.65.140","TCP","1514","[TCP Retransmission] 56383  >  443 [PSH, ACK] Seq=1718 Ack=27068 Win=2048 Len=1448 TSval=1359942605 TSecr=557167411"
"123","0.216876","151.101.65.140","100.86.235.39","TCP","1510","443  >  56473 [ACK] Seq=54873 Ack=1 Win=298 Len=1444 TSval=2958582513 TSecr=1656514808 [TCP PDU reassembled in 135]"
"124","0.216877","151.101.65.140","100.86.235.39","TCP","1510","443  >  56473 [PSH, ACK] Seq=56317 Ack=1 Win=298 Len=1444 TSval=2958582513 TSecr=1656514808 [TCP PDU reassembled in 135]"
"125","0.217018","100.86.235.39","151.101.65.140","TCP","66","56473  >  443 [ACK] Seq=1 Ack=57761 Win=4672 Len=0 TSval=1656514851 TSecr=2958582513"
"126","0.218240","151.101.65.140","100.86.235.39","TCP","66","443  >  56383 [ACK] Seq=27068 Ack=3166 Win=533 Len=0 TSval=557167570 TSecr=1359942579"
"127","0.220107","151.101.65.140","100.86.235.39","TCP","1510","443  >  56473 [ACK] Seq=57761 Ack=1 Win=298 Len=1444 TSval=2958582517 TSecr=1656514813 [TCP PDU reassembled in 135]"
"128","0.220109","151.101.65.140","100.86.235.39","TCP","1510","443  >  56473 [PSH, ACK] Seq=59205 Ack=1 Win=298 Len=1444 TSval=2958582517 TSecr=1656514813 [TCP PDU reassembled in 135]"
"129","0.220110","151.101.65.140","100.86.235.39","TCP","1510","443  >  56473 [ACK] Seq=60649 Ack=1 Win=298 Len=1444 TSval=2958582520 TSecr=1656514819 [TCP PDU reassembled in 135]"
"130","0.220110","151.101.65.140","100.86.235.39","TCP","1510","443  >  56473 [PSH, ACK] Seq=62093 Ack=1 Win=298 Len=1444 TSval=2958582520 TSecr=1656514819 [TCP PDU reassembled in 135]"
"131","0.220111","151.101.65.140","100.86.235.39","TCP","1510","443  >  56473 [ACK] Seq=63537 Ack=1 Win=298 Len=1444 TSval=2958582523 TSecr=1656514819 [TCP PDU reassembled in 135]"
"132","0.220112","151.101.65.140","100.86.235.39","TCP","1510","443  >  56473 [PSH, ACK] Seq=64981 Ack=1 Win=298 Len=1444 TSval=2958582523 TSecr=1656514819 [TCP PDU reassembled in 135]"
"133","0.220113","151.101.65.140","100.86.235.39","TCP","1510","443  >  56473 [ACK] Seq=66425 Ack=1 Win=298 Len=1444 TSval=2958582526 TSecr=1656514824 [TCP PDU reassembled in 135]"
"134","0.220114","151.101.65.140","100.86.235.39","TCP","1510","443  >  56473 [PSH, ACK] Seq=67869 Ack=1 Win=298 Len=1444 TSval=2958582526 TSecr=1656514824 [TCP PDU reassembled in 135]"
"135","0.220114","151.101.65.140","100.86.235.39","TLSv1.2","1510","Ignored Unknown Record, Ignored Unknown Record"
"136","0.220115","151.101.65.140","100.86.235.39","TLSv1.2","1510","Ignored Unknown Record"
"137","0.220375","100.86.235.39","151.101.65.140","TCP","66","56473  >  443 [ACK] Seq=1 Ack=72201 Win=4672 Len=0 TSval=1656514854 TSecr=2958582529"
"138","0.227229","151.101.65.140","100.86.235.39","TCP","78","[TCP Dup ACK 126#1] 443  >  56383 [ACK] Seq=27068 Ack=3166 Win=538 Len=0 TSval=557167599 TSecr=1359942605 SLE=1718 SRE=3166"
"139","0.228825","151.101.65.140","100.86.235.39","TLSv1.2","1510","Ignored Unknown Record"
"140","0.228827","151.101.65.140","100.86.235.39","TLSv1.2","1510","Ignored Unknown Record"
"141","0.228827","151.101.65.140","100.86.235.39","TLSv1.2","1510","Ignored Unknown Record"
"142","0.228928","151.101.65.140","100.86.235.39","TCP","1510","443  >  56473 [PSH, ACK] Seq=76533 Ack=1 Win=298 Len=1444 TSval=2958582546 TSecr=1656514851"
"143","0.228967","100.86.235.39","151.101.65.140","TCP","66","56473  >  443 [ACK] Seq=1 Ack=76533 Win=4672 Len=0 TSval=1656514863 TSecr=2958582546"
"144","0.229053","100.86.235.39","151.101.65.140","TCP","66","56473  >  443 [ACK] Seq=1 Ack=77977 Win=4672 Len=0 TSval=1656514863 TSecr=2958582546"
"145","0.232154","151.101.65.140","100.86.235.39","TLSv1.2","1510","Ignored Unknown Record"
"146","0.232308","151.101.65.140","100.86.235.39","TLSv1.2","1510","Ignored Unknown Record"
"147","0.232382","100.86.235.39","151.101.65.140","TCP","66","56473  >  443 [ACK] Seq=1 Ack=80865 Win=4672 Len=0 TSval=1656514866 TSecr=2958582550"
"148","0.235320","151.101.65.140","100.86.235.39","TLSv1.2","1510","Ignored Unknown Record"
"149","0.236754","151.101.65.140","100.86.235.39","TLSv1.2","1510","Ignored Unknown Record"
"150","0.236860","100.86.235.39","151.101.65.140","TCP","66","56473  >  443 [ACK] Seq=1 Ack=83753 Win=4672 Len=0 TSval=1656514871 TSecr=2958582553"
"151","0.238242","151.101.65.140","100.86.235.39","TLSv1.2","1510","Ignored Unknown Record"
"152","0.238800","151.101.65.140","100.86.235.39","TLSv1.2","1510","Ignored Unknown Record"
"153","0.238889","100.86.235.39","151.101.65.140","TCP","66","56473  >  443 [ACK] Seq=1 Ack=86641 Win=4672 Len=0 TSval=1656514873 TSecr=2958582556"
"154","0.243644","151.101.65.140","100.86.235.39","TLSv1.2","1510","Ignored Unknown Record"
"155","0.243645","151.101.65.140","100.86.235.39","TLSv1.2","1510","Ignored Unknown Record"
"156","0.243811","100.86.235.39","151.101.65.140","TCP","66","56473  >  443 [ACK] Seq=1 Ack=89529 Win=4672 Len=0 TSval=1656514878 TSecr=2958582559"
"157","0.245244","151.101.65.140","100.86.235.39","TLSv1.2","1510","Ignored Unknown Record"
"158","0.245245","151.101.65.140","100.86.235.39","TLSv1.2","1510","Ignored Unknown Record"
"159","0.245339","100.86.235.39","151.101.65.140","TCP","66","56473  >  443 [ACK] Seq=1 Ack=92417 Win=4672 Len=0 TSval=1656514880 TSecr=2958582562"
"160","0.248066","151.101.65.140","100.86.235.39","TCP","1510","443  >  56473 [ACK] Seq=92417 Ack=1 Win=298 Len=1444 TSval=2958582565 TSecr=1656514863"
"161","0.248067","151.101.65.140","100.86.235.39","TLSv1.2","1510","Ignored Unknown Record"
"162","0.248182","100.86.235.39","151.101.65.140","TCP","66","56473  >  443 [ACK] Seq=1 Ack=95305 Win=4672 Len=0 TSval=1656514882 TSecr=2958582565"
"163","0.249698","151.101.65.140","100.86.235.39","TLSv1.2","1510","Ignored Unknown Record"
"164","0.252027","151.101.65.140","100.86.235.39","TLSv1.2","1510","Ignored Unknown Record"
"165","0.252219","100.86.235.39","151.101.65.140","TCP","66","56473  >  443 [ACK] Seq=1 Ack=98193 Win=4672 Len=0 TSval=1656514886 TSecr=2958582568"
"166","0.253460","151.101.65.140","100.86.235.39","TLSv1.2","1510","Ignored Unknown Record"
"167","0.253462","151.101.65.140","100.86.235.39","TLSv1.2","1510","Ignored Unknown Record"
"168","0.253569","100.86.235.39","151.101.65.140","TCP","66","56473  >  443 [ACK] Seq=1 Ack=101081 Win=4672 Len=0 TSval=1656514888 TSecr=2958582570"
"169","0.255800","151.101.65.140","100.86.235.39","TLSv1.2","1510","Ignored Unknown Record"
"170","0.255801","151.101.65.140","100.86.235.39","TLSv1.2","1510","Ignored Unknown Record"
"171","0.255960","100.86.235.39","151.101.65.140","TCP","66","56473  >  443 [ACK] Seq=1 Ack=103969 Win=4672 Len=0 TSval=1656514890 TSecr=2958582573"
"172","0.257166","151.101.65.140","100.86.235.39","TLSv1.2","1510","Ignored Unknown Record"
"173","0.258729","151.101.65.140","100.86.235.39","TLSv1.2","1510","Ignored Unknown Record"
"174","0.258829","100.86.235.39","151.101.65.140","TCP","66","56473  >  443 [ACK] Seq=1 Ack=106857 Win=4672 Len=0 TSval=1656514893 TSecr=2958582575"
"175","0.260019","151.101.65.140","100.86.235.39","TLSv1.2","1510","Ignored Unknown Record"
"176","0.260285","151.101.65.140","100.86.235.39","TLSv1.2","1510","Ignored Unknown Record"
"177","0.260362","100.86.235.39","151.101.65.140","TCP","66","56473  >  443 [ACK] Seq=1 Ack=109745 Win=4672 Len=0 TSval=1656514894 TSecr=2958582577"
"178","0.262418","151.101.65.140","100.86.235.39","TLSv1.2","1510","Ignored Unknown Record"
"179","0.262419","151.101.65.140","100.86.235.39","TLSv1.2","1510","Ignored Unknown Record"
"180","0.262525","100.86.235.39","151.101.65.140","TCP","66","56473  >  443 [ACK] Seq=1 Ack=112633 Win=4672 Len=0 TSval=1656514897 TSecr=2958582579"
"181","0.264001","151.101.65.140","100.86.235.39","TLSv1.2","1510","Ignored Unknown Record"
"182","0.264800","151.101.65.140","100.86.235.39","TLSv1.2","1510","Ignored Unknown Record"
"183","0.264987","100.86.235.39","151.101.65.140","TCP","66","56473  >  443 [ACK] Seq=1 Ack=115521 Win=4672 Len=0 TSval=1656514898 TSecr=2958582581"
"184","0.265280","151.101.65.140","100.86.235.39","TLSv1.2","1510","Ignored Unknown Record"
"185","0.266137","151.101.65.140","100.86.235.39","TLSv1.2","1510","Ignored Unknown Record"
"186","0.266290","100.86.235.39","151.101.65.140","TCP","66","56473  >  443 [ACK] Seq=1 Ack=118409 Win=4672 Len=0 TSval=1656514900 TSecr=2958582583"
"187","0.267494","151.101.65.140","100.86.235.39","TLSv1.2","1510","[TCP Previous segment not captured] , Ignored Unknown Record"
"188","0.267561","100.86.235.39","151.101.65.140","TCP","78","[TCP Dup ACK 186#1] 56473  >  443 [ACK] Seq=1 Ack=118409 Win=4672 Len=0 TSval=1656514902 TSecr=2958582583 SLE=119853 SRE=121297"
"189","0.268979","151.101.65.140","100.86.235.39","TCP","1510","443  >  56383 [ACK] Seq=27068 Ack=3166 Win=538 Len=1444 TSval=557167639 TSecr=1359942605 [TCP PDU reassembled in 190]"
"190","0.268981","151.101.65.140","100.86.235.39","TLSv1.2","913","Application Data"
"191","0.268982","151.101.65.140","100.86.235.39","TLSv1.2","1510","Ignored Unknown Record"
"192","0.269047","100.86.235.39","151.101.65.140","TCP","66","56383  >  443 [ACK] Seq=3166 Ack=29359 Win=2012 Len=0 TSval=1359942661 TSecr=557167639"
"193","0.269136","100.86.235.39","151.101.65.140","TCP","78","[TCP Dup ACK 186#2] 56473  >  443 [ACK] Seq=1 Ack=118409 Win=4672 Len=0 TSval=1656514903 TSecr=2958582583 SLE=119853 SRE=122741"
"194","0.269175","151.101.65.140","100.86.235.39","TLSv1.2","1510","Ignored Unknown Record"
"195","0.269177","151.101.65.140","100.86.235.39","TLSv1.2","233","Application Data"
"196","0.269211","100.86.235.39","151.101.65.140","TCP","78","[TCP Dup ACK 186#3] 56473  >  443 [ACK] Seq=1 Ack=118409 Win=4672 Len=0 TSval=1656514903 TSecr=2958582583 SLE=119853 SRE=124185"
"197","0.269228","100.86.235.39","151.101.65.140","TCP","66","56383  >  443 [ACK] Seq=3166 Ack=29526 Win=2045 Len=0 TSval=1359942661 TSecr=557167640"
"198","0.272429","151.101.65.140","100.86.235.39","TLSv1.2","1510","Ignored Unknown Record"
"199","0.272430","151.101.65.140","100.86.235.39","TLSv1.2","1510","Ignored Unknown Record"
"200","0.272502","100.86.235.39","151.101.65.140","TCP","78","[TCP Dup ACK 186#4] 56473  >  443 [ACK] Seq=1 Ack=118409 Win=4672 Len=0 TSval=1656514907 TSecr=2958582583 SLE=119853 SRE=127073"
"201","0.273412","151.101.65.140","100.86.235.39","TCP","1510","443  >  56473 [ACK] Seq=127073 Ack=1 Win=298 Len=1444 TSval=2958582590 TSecr=1656514894"
"202","0.273413","151.101.65.140","100.86.235.39","TLSv1.2","1510","Ignored Unknown Record"
"203","0.273476","100.86.235.39","151.101.65.140","TCP","78","[TCP Dup ACK 186#5] 56473  >  443 [ACK] Seq=1 Ack=118409 Win=4672 Len=0 TSval=1656514907 TSecr=2958582583 SLE=119853 SRE=129961"
"204","0.274052","151.101.65.140","100.86.235.39","TLSv1.2","1510","Ignored Unknown Record"
"205","0.274109","100.86.235.39","151.101.65.140","TCP","78","[TCP Dup ACK 186#6] 56473  >  443 [ACK] Seq=1 Ack=118409 Win=4672 Len=0 TSval=1656514908 TSecr=2958582583 SLE=119853 SRE=131405"
"206","0.274866","151.101.65.140","100.86.235.39","TLSv1.2","1510","Ignored Unknown Record"
"207","0.274920","100.86.235.39","151.101.65.140","TCP","78","[TCP Dup ACK 186#7] 56473  >  443 [ACK] Seq=1 Ack=118409 Win=4672 Len=0 TSval=1656514908 TSecr=2958582583 SLE=119853 SRE=132849"
"208","0.275005","100.86.235.39","151.101.65.140","TCP","1514","56383  >  443 [ACK] Seq=3166 Ack=29526 Win=2048 Len=1448 TSval=1359942666 TSecr=557167640 [TCP PDU reassembled in 210]"
"209","0.275007","100.86.235.39","151.101.65.140","TCP","1514","56383  >  443 [ACK] Seq=4614 Ack=29526 Win=2048 Len=1448 TSval=1359942666 TSecr=557167640 [TCP PDU reassembled in 210]"
"210","0.275026","100.86.235.39","151.101.65.140","TLSv1.2","192","Application Data"
"211","0.275065","100.86.235.39","151.101.65.140","TLSv1.2","838","Application Data"
"212","0.279781","151.101.65.140","100.86.235.39","TLSv1.2","1510","Ignored Unknown Record"
"213","0.279782","151.101.65.140","100.86.235.39","TLSv1.2","1510","Ignored Unknown Record"
"214","0.279783","151.101.65.140","100.86.235.39","TLSv1.2","1510","Ignored Unknown Record"
"215","0.279784","151.101.65.140","100.86.235.39","TLSv1.2","1510","Ignored Unknown Record"
"216","0.279785","151.101.65.140","100.86.235.39","TLSv1.2","1510","Ignored Unknown Record"
"217","0.279786","151.101.65.140","100.86.235.39","TLSv1.2","1510","Ignored Unknown Record"
"218","0.279855","100.86.235.39","151.101.65.140","TCP","78","[TCP Dup ACK 186#8] 56473  >  443 [ACK] Seq=1 Ack=118409 Win=4672 Len=0 TSval=1656514914 TSecr=2958582583 SLE=119853 SRE=141513"
"219","0.280358","151.101.65.140","100.86.235.39","TLSv1.2","1510","Ignored Unknown Record"
"220","0.280457","100.86.235.39","151.101.65.140","TCP","78","[TCP Dup ACK 186#9] 56473  >  443 [ACK] Seq=1 Ack=118409 Win=4672 Len=0 TSval=1656514914 TSecr=2958582583 SLE=119853 SRE=142957"
"221","0.281066","151.101.65.140","100.86.235.39","TLSv1.2","1510","Ignored Unknown Record"
"222","0.281121","100.86.235.39","151.101.65.140","TCP","78","[TCP Dup ACK 186#10] 56473  >  443 [ACK] Seq=1 Ack=118409 Win=4672 Len=0 TSval=1656514915 TSecr=2958582583 SLE=119853 SRE=144401"
"223","0.282874","100.86.235.39","151.101.65.140","TCP","1514","56383  >  443 [ACK] Seq=6960 Ack=29526 Win=2048 Len=1448 TSval=1359942675 TSecr=557167640 [TCP PDU reassembled in 225]"
"224","0.282877","100.86.235.39","151.101.65.140","TCP","1514","56383  >  443 [ACK] Seq=8408 Ack=29526 Win=2048 Len=1448 TSval=1359942675 TSecr=557167640 [TCP PDU reassembled in 225]"
"225","0.282909","100.86.235.39","151.101.65.140","TLSv1.2","142","Application Data"
"226","0.283878","151.101.65.140","100.86.235.39","TLSv1.2","1510","[TCP Fast Retransmission] , Ignored Unknown Record"
"227","0.283879","151.101.65.140","100.86.235.39","TLSv1.2","1510","Ignored Unknown Record"
"228","0.283880","151.101.65.140","100.86.235.39","TLSv1.2","1510","Ignored Unknown Record"
"229","0.283944","100.86.235.39","151.101.65.140","TCP","66","56473  >  443 [ACK] Seq=1 Ack=144401 Win=4266 Len=0 TSval=1656514918 TSecr=2958582599"
"230","0.283975","100.86.235.39","151.101.65.140","TCP","66","56473  >  443 [ACK] Seq=1 Ack=147289 Win=4221 Len=0 TSval=1656514918 TSecr=2958582600"
"231","0.284220","100.86.235.39","151.101.65.140","TCP","66","[TCP Window Update] 56473  >  443 [ACK] Seq=1 Ack=147289 Win=4672 Len=0 TSval=1656514918 TSecr=2958582600"
"232","0.285850","151.101.65.140","100.86.235.39","TLSv1.2","1510","Ignored Unknown Record"
"233","0.285903","100.86.235.39","151.101.65.140","TCP","66","56473  >  443 [ACK] Seq=1 Ack=148733 Win=4649 Len=0 TSval=1656514920 TSecr=2958582602"
"234","0.288350","151.101.65.140","100.86.235.39","TLSv1.2","1510","Ignored Unknown Record"
"235","0.288413","100.86.235.39","151.101.65.140","TCP","66","56473  >  443 [ACK] Seq=1 Ack=150177 Win=4649 Len=0 TSval=1656514923 TSecr=2958582602"
"236","0.288658","151.101.65.140","100.86.235.39","TCP","66","443  >  56383 [ACK] Seq=29526 Ack=6960 Win=538 Len=0 TSval=557167658 TSecr=1359942666"
"237","0.290819","151.101.65.140","100.86.235.39","TLSv1.2","1510","Ignored Unknown Record"
"238","0.290913","100.86.235.39","151.101.65.140","TCP","66","56473  >  443 [ACK] Seq=1 Ack=151621 Win=4649 Len=0 TSval=1656514925 TSecr=2958582607"
"239","0.291164","151.101.65.140","100.86.235.39","TLSv1.2","1510","Ignored Unknown Record"
"240","0.291166","151.101.65.140","100.86.235.39","TLSv1.2","1510","Ignored Unknown Record"
"241","0.291166","151.101.65.140","100.86.235.39","TLSv1.2","1510","Ignored Unknown Record"
"242","0.291167","151.101.65.140","100.86.235.39","TLSv1.2","1510","Ignored Unknown Record"
"243","0.291215","100.86.235.39","151.101.65.140","TCP","66","56473  >  443 [ACK] Seq=1 Ack=157397 Win=4582 Len=0 TSval=1656514925 TSecr=2958582609"
"244","0.291283","100.86.235.39","151.101.65.140","TCP","66","[TCP Window Update] 56473  >  443 [ACK] Seq=1 Ack=157397 Win=4672 Len=0 TSval=1656514925 TSecr=2958582609"
"245","0.298218","151.101.65.140","100.86.235.39","TCP","66","443  >  56383 [ACK] Seq=29526 Ack=9932 Win=534 Len=0 TSval=557167668 TSecr=1359942675"
"246","0.298219","151.101.65.140","100.86.235.39","TLSv1.2","1510","Ignored Unknown Record"
"247","0.298221","151.101.65.140","100.86.235.39","TLSv1.2","1510","Ignored Unknown Record"
"248","0.298223","151.101.65.140","100.86.235.39","TLSv1.2","1510","Ignored Unknown Record"
"249","0.298369","100.86.235.39","151.101.65.140","TCP","66","56473  >  443 [ACK] Seq=1 Ack=161729 Win=4604 Len=0 TSval=1656514933 TSecr=2958582614"
"250","0.298484","100.86.235.39","151.101.65.140","TCP","66","[TCP Window Update] 56473  >  443 [ACK] Seq=1 Ack=161729 Win=4672 Len=0 TSval=1656514933 TSecr=2958582614"
"251","0.298985","151.101.65.140","100.86.235.39","TLSv1.2","1510","Ignored Unknown Record"
"252","0.298986","151.101.65.140","100.86.235.39","TLSv1.2","1510","Ignored Unknown Record"
"253","0.299040","100.86.235.39","151.101.65.140","TCP","66","56473  >  443 [ACK] Seq=1 Ack=164617 Win=4627 Len=0 TSval=1656514933 TSecr=2958582616"
"254","0.300976","151.101.65.140","100.86.235.39","TLSv1.2","1510","[TCP Previous segment not captured] , Ignored Unknown Record"
"255","0.301034","100.86.235.39","151.101.65.140","TCP","78","[TCP Dup ACK 253#1] 56473  >  443 [ACK] Seq=1 Ack=164617 Win=4672 Len=0 TSval=1656514935 TSecr=2958582616 SLE=166061 SRE=167505"
"256","0.302967","151.101.65.140","100.86.235.39","TLSv1.2","1510","Ignored Unknown Record"
"257","0.303029","100.86.235.39","151.101.65.140","TCP","78","[TCP Dup ACK 253#2] 56473  >  443 [ACK] Seq=1 Ack=164617 Win=4672 Len=0 TSval=1656514937 TSecr=2958582616 SLE=166061 SRE=168949"
"258","0.303320","151.101.65.140","100.86.235.39","TLSv1.2","1510","Ignored Unknown Record"
"259","0.303368","100.86.235.39","151.101.65.140","TCP","78","[TCP Dup ACK 253#3] 56473  >  443 [ACK] Seq=1 Ack=164617 Win=4672 Len=0 TSval=1656514937 TSecr=2958582616 SLE=166061 SRE=170393"
"260","0.304732","100.86.235.39","151.101.65.140","TCP","1514","56383  >  443 [ACK] Seq=9932 Ack=29526 Win=2048 Len=1448 TSval=1359942697 TSecr=557167668 [TCP PDU reassembled in 262]"
"261","0.304734","100.86.235.39","151.101.65.140","TCP","1514","56383  >  443 [ACK] Seq=11380 Ack=29526 Win=2048 Len=1448 TSval=1359942697 TSecr=557167668 [TCP PDU reassembled in 262]"
"262","0.304765","100.86.235.39","151.101.65.140","TLSv1.2","145","Application Data"
"263","0.305525","151.101.65.140","100.86.235.39","TLSv1.2","1510","Ignored Unknown Record"
"264","0.305526","151.101.65.140","100.86.235.39","TLSv1.2","1510","Ignored Unknown Record"
"265","0.305595","100.86.235.39","151.101.65.140","TCP","78","[TCP Dup ACK 253#4] 56473  >  443 [ACK] Seq=1 Ack=164617 Win=4672 Len=0 TSval=1656514939 TSecr=2958582616 SLE=166061 SRE=173281"
"266","0.309546","151.101.65.140","100.86.235.39","TLSv1.2","1510","Ignored Unknown Record"
"267","0.309547","151.101.65.140","100.86.235.39","TLSv1.2","1510","Ignored Unknown Record"
"268","0.309548","151.101.65.140","100.86.235.39","TLSv1.2","1510","Ignored Unknown Record"
"269","0.309616","100.86.235.39","151.101.65.140","TCP","78","[TCP Dup ACK 253#5] 56473  >  443 [ACK] Seq=1 Ack=164617 Win=4672 Len=0 TSval=1656514944 TSecr=2958582616 SLE=166061 SRE=177613"
"270","0.309925","151.101.65.140","100.86.235.39","TLSv1.2","1510","Ignored Unknown Record"
"271","0.309974","100.86.235.39","151.101.65.140","TCP","78","[TCP Dup ACK 253#6] 56473  >  443 [ACK] Seq=1 Ack=164617 Win=4672 Len=0 TSval=1656514944 TSecr=2958582616 SLE=166061 SRE=179057"
"272","0.323604","100.86.235.39","151.101.65.140","TCP","1514","56383  >  443 [ACK] Seq=12907 Ack=29526 Win=2048 Len=1448 TSval=1359942716 TSecr=557167668 [TCP PDU reassembled in 273]"
"273","0.323644","100.86.235.39","151.101.65.140","TLSv1.2","1471","Application Data"
"274","0.333509","151.101.65.140","100.86.235.39","TLSv1.2","1510","Ignored Unknown Record"
"275","0.333509","151.101.65.140","100.86.235.39","TLSv1.2","1510","Ignored Unknown Record"
"276","0.333536","151.101.65.140","100.86.235.39","TLSv1.2","1510","Ignored Unknown Record"
"277","0.333581","100.86.235.39","151.101.65.140","TCP","78","[TCP Dup ACK 253#7] 56473  >  443 [ACK] Seq=1 Ack=164617 Win=4672 Len=0 TSval=1656514968 TSecr=2958582616 SLE=166061 SRE=181945"
"278","0.333611","100.86.235.39","151.101.65.140","TCP","78","[TCP Dup ACK 253#8] 56473  >  443 [ACK] Seq=1 Ack=164617 Win=4672 Len=0 TSval=1656514968 TSecr=2958582616 SLE=166061 SRE=183389"
"279","0.335150","151.101.65.140","100.86.235.39","TLSv1.2","1510","Ignored Unknown Record"
"280","0.335151","151.101.65.140","100.86.235.39","TCP","1510","443  >  56383 [ACK] Seq=29526 Ack=9932 Win=538 Len=1444 TSval=557167685 TSecr=1359942675 [TCP PDU reassembled in 281]"
"281","0.335152","151.101.65.140","100.86.235.39","TLSv1.2","247","Application Data"
"282","0.335153","151.101.65.140","100.86.235.39","TLSv1.2","1510","[TCP Fast Retransmission] , Ignored Unknown Record"
"283","0.335154","151.101.65.140","100.86.235.39","TCP","66","443  >  56383 [ACK] Seq=31151 Ack=12907 Win=534 Len=0 TSval=557167686 TSecr=1359942697"
"284","0.335154","151.101.65.140","100.86.235.39","TLSv1.2","1510","Ignored Unknown Record"
"285","0.335155","151.101.65.140","100.86.235.39","TLSv1.2","1510","Ignored Unknown Record"
"286","0.335156","151.101.65.140","100.86.235.39","TCP","1510","443  >  56383 [ACK] Seq=31151 Ack=12907 Win=538 Len=1444 TSval=557167695 TSecr=1359942697 [TCP PDU reassembled in 287]"
"287","0.335156","151.101.65.140","100.86.235.39","TLSv1.2","914","Application Data"
"288","0.336113","100.86.235.39","151.101.65.140","TCP","66","56473  >  443 [ACK] Seq=1 Ack=187721 Win=4672 Len=0 TSval=1656514970 TSecr=2958582637"
"289","0.336115","100.86.235.39","151.101.65.140","TCP","66","56383  >  443 [ACK] Seq=15760 Ack=33443 Win=2048 Len=0 TSval=1359942728 TSecr=557167695"
"290","0.336344","151.101.65.140","100.86.235.39","TCP","1510","443  >  56383 [ACK] Seq=33443 Ack=12907 Win=538 Len=1444 TSval=557167705 TSecr=1359942697 [TCP PDU reassembled in 291]"
"291","0.336345","151.101.65.140","100.86.235.39","TLSv1.2","271","Application Data"
"292","0.336397","100.86.235.39","151.101.65.140","TCP","66","56383  >  443 [ACK] Seq=15760 Ack=35092 Win=2022 Len=0 TSval=1359942729 TSecr=557167705"
"293","0.341725","151.101.65.140","100.86.235.39","TCP","1510","443  >  56473 [ACK] Seq=187721 Ack=1 Win=298 Len=1444 TSval=2958582659 TSecr=1656514944"
"294","0.341725","151.101.65.140","100.86.235.39","TCP","66","443  >  56383 [ACK] Seq=35092 Ack=15760 Win=534 Len=0 TSval=557167713 TSecr=1359942716"
"295","0.341804","100.86.235.39","151.101.65.140","TCP","66","56473  >  443 [ACK] Seq=1 Ack=189165 Win=4649 Len=0 TSval=1656514976 TSecr=2958582659"
"296","0.344240","151.101.65.140","100.86.235.39","TLSv1.2","1510","Ignored Unknown Record"
"297","0.344297","100.86.235.39","151.101.65.140","TCP","66","56473  >  443 [ACK] Seq=1 Ack=190609 Win=4649 Len=0 TSval=1656514979 TSecr=2958582661"
"298","0.344849","151.101.65.140","100.86.235.39","TLSv1.2","1510","Ignored Unknown Record"
"299","0.344850","151.101.65.140","100.86.235.39","TLSv1.2","1510","Ignored Unknown Record"
"300","0.344904","100.86.235.39","151.101.65.140","TCP","66","56473  >  443 [ACK] Seq=1 Ack=193497 Win=4627 Len=0 TSval=1656514979 TSecr=2958582662"
"301","0.345338","151.101.65.140","100.86.235.39","TLSv1.2","1510","Ignored Unknown Record"
"302","0.345393","100.86.235.39","151.101.65.140","TCP","66","56473  >  443 [ACK] Seq=1 Ack=194941 Win=4649 Len=0 TSval=1656514980 TSecr=2958582663"
"303","0.345636","151.101.65.140","100.86.235.39","TLSv1.2","1510","Ignored Unknown Record"
"304","0.345689","100.86.235.39","151.101.65.140","TCP","66","56473  >  443 [ACK] Seq=1 Ack=196385 Win=4649 Len=0 TSval=1656514980 TSecr=2958582663"
"305","0.349279","151.101.65.140","100.86.235.39","TCP","1510","443  >  56473 [ACK] Seq=196385 Ack=1 Win=298 Len=1444 TSval=2958582667 TSecr=1656514970"
"306","0.349345","100.86.235.39","151.101.65.140","TCP","66","56473  >  443 [ACK] Seq=1 Ack=197829 Win=4649 Len=0 TSval=1656514984 TSecr=2958582667"
"307","0.349885","151.101.65.140","100.86.235.39","TCP","1510","443  >  56473 [PSH, ACK] Seq=197829 Ack=1 Win=298 Len=1444 TSval=2958582667 TSecr=1656514970 [TCP PDU reassembled in 337]"
"308","0.349938","100.86.235.39","151.101.65.140","TCP","66","56473  >  443 [ACK] Seq=1 Ack=199273 Win=4649 Len=0 TSval=1656514984 TSecr=2958582667"
