"No.","Time","Source","Destination","Protocol","Length","Info"
"58","0.038816","100.86.243.187","151.101.65.140","TLSv1.2","169","Application Data"
"59","0.040056","100.86.243.187","151.101.65.140","TLSv1.2","166","Application Data"
"60","0.042930","100.86.243.187","151.101.65.140","TLSv1.2","101","Application Data"
"61","0.045839","100.86.243.187","151.101.65.140","TLSv1.2","181","Application Data"
"62","0.048849","100.86.243.187","151.101.65.140","TLSv1.2","101","Application Data"
"63","0.054287","100.86.243.187","151.101.65.140","TLSv1.2","101","Application Data"
"64","0.063118","100.86.243.187","151.101.65.140","TLSv1.2","168","Application Data"
"65","0.063388","100.86.243.187","151.101.65.140","TLSv1.2","172","Application Data"
"66","0.066566","100.86.243.187","151.101.65.140","TLSv1.2","101","Application Data"
"67","0.069257","100.86.243.187","151.101.65.140","TLSv1.2","101","Application Data"
"68","0.080674","100.86.243.187","151.101.65.140","TLSv1.2","175","Application Data"
"69","0.083532","100.86.243.187","151.101.65.140","TLSv1.2","101","Application Data"
"70","0.177361","151.101.65.140","100.86.243.187","TCP","66","443  >  56492 [ACK] Seq=1 Ack=104 Win=347 Len=0 TSval=1577837394 TSecr=874320420"
"71","0.177363","151.101.65.140","100.86.243.187","TCP","66","443  >  56492 [ACK] Seq=1 Ack=204 Win=347 Len=0 TSval=1577837395 TSecr=874320421"
"72","0.177363","151.101.65.140","100.86.243.187","TLSv1.2","359","Application Data"
"73","0.177364","151.101.65.140","100.86.243.187","TLSv1.2","300","Application Data"
"74","0.177364","151.101.65.140","100.86.243.187","TCP","66","443  >  56492 [ACK] Seq=528 Ack=239 Win=347 Len=0 TSval=1577837398 TSecr=874320424"
"75","0.177365","151.101.65.140","100.86.243.187","TCP","300","[TCP Retransmission] 443  >  56492 [PSH, ACK] Seq=294 Ack=239 Win=347 Len=234 TSval=1577837426 TSecr=874320424"
"76","0.177476","100.86.243.187","151.101.65.140","TCP","66","56492  >  443 [ACK] Seq=846 Ack=528 Win=2039 Len=0 TSval=874320558 TSecr=1577837395"
"77","0.177548","100.86.243.187","151.101.65.140","TCP","78","[TCP Dup ACK 76#1] 56492  >  443 [ACK] Seq=846 Ack=528 Win=2039 Len=0 TSval=874320558 TSecr=1577837426 SLE=294 SRE=528"
"78","0.186259","151.101.65.140","100.86.243.187","TCP","66","443  >  56492 [ACK] Seq=528 Ack=702 Win=347 Len=0 TSval=1577837531 TSecr=874320450"
"79","0.186260","151.101.65.140","100.86.243.187","TCP","66","443  >  56492 [ACK] Seq=528 Ack=846 Win=347 Len=0 TSval=1577837531 TSecr=874320464"
"88","1.015404","100.86.243.187","151.101.65.140","TLSv1.2","211","Application Data"
"89","1.025478","100.86.243.187","151.101.65.140","TLSv1.2","171","Application Data"
"90","1.027606","100.86.243.187","151.101.65.140","TLSv1.2","101","Application Data"
"91","1.034238","100.86.243.187","151.101.65.140","TLSv1.2","101","Application Data"
"92","1.037485","100.86.243.187","151.101.65.140","TLSv1.2","160","Application Data"
"93","1.038268","100.86.243.187","151.101.65.140","TLSv1.2","157","Application Data"
"94","1.044724","100.86.243.187","151.101.65.140","TLSv1.2","155","Application Data"
"95","1.045297","100.86.243.187","151.101.65.140","TLSv1.2","101","Application Data"
"96","1.045663","100.86.243.187","151.101.65.140","TLSv1.2","101","Application Data"
"97","1.049094","100.86.243.187","151.101.65.140","TLSv1.2","101","Application Data"
"98","1.050053","100.86.243.187","151.101.65.140","TLSv1.2","167","Application Data"
"99","1.052842","100.86.243.187","151.101.65.140","TLSv1.2","170","Application Data"
"101","1.060780","100.86.243.187","151.101.65.140","TLSv1.2","101","Application Data"
"102","1.065276","100.86.243.187","151.101.65.140","TLSv1.2","101","Application Data"
"105","1.071608","100.86.243.187","151.101.65.140","TLSv1.2","171","Application Data"
"109","1.085063","100.86.243.187","151.101.65.140","TLSv1.2","172","Application Data"
"110","1.093706","100.86.243.187","151.101.65.140","TLSv1.2","101","Application Data"
"111","1.095305","100.86.243.187","151.101.65.140","TLSv1.2","157","Application Data"
"113","1.097873","151.101.65.140","100.86.243.187","TCP","66","443  >  56492 [ACK] Seq=528 Ack=1510 Win=353 Len=0 TSval=1577838442 TSecr=874321425"
"114","1.098014","151.101.65.140","100.86.243.187","TCP","66","443  >  56492 [ACK] Seq=528 Ack=2031 Win=353 Len=0 TSval=1577838443 TSecr=874321466"
"115","1.099301","151.101.65.140","100.86.243.187","TLSv1.2","1510","Application Data"
"116","1.099302","151.101.65.140","100.86.243.187","TLSv1.2","456","Application Data"
"117","1.099458","100.86.243.187","151.101.65.140","TCP","66","56492  >  443 [ACK] Seq=2157 Ack=2362 Win=2019 Len=0 TSval=874321480 TSecr=1577838444"
"118","1.101271","100.86.243.187","151.101.65.140","TLSv1.2","229","Application Data"
"119","1.104239","151.101.65.140","100.86.243.187","TCP","66","443  >  56492 [ACK] Seq=2362 Ack=2066 Win=353 Len=0 TSval=1577838449 TSecr=874321474"
"120","1.105012","151.101.65.140","100.86.243.187","TCP","66","443  >  56492 [ACK] Seq=2362 Ack=2157 Win=353 Len=0 TSval=1577838450 TSecr=874321476"
"121","1.105690","100.86.243.187","151.101.65.140","TLSv1.2","155","Application Data"
"122","1.106399","151.101.65.140","100.86.243.187","TLSv1.2","184","Application Data"
"123","1.106425","100.86.243.187","151.101.65.140","TLSv1.2","168","Application Data"
"124","1.106456","100.86.243.187","151.101.65.140","TCP","66","56492  >  443 [ACK] Seq=2511 Ack=2480 Win=2046 Len=0 TSval=874321486 TSecr=1577838450"
"125","1.106504","151.101.65.140","100.86.243.187","TLSv1.2","433","Application Data"
"126","1.106539","100.86.243.187","151.101.65.140","TCP","66","56492  >  443 [ACK] Seq=2511 Ack=2847 Win=2042 Len=0 TSval=874321486 TSecr=1577838450"
"127","1.111040","151.101.65.140","100.86.243.187","TCP","66","443  >  56492 [ACK] Seq=2847 Ack=2320 Win=359 Len=0 TSval=1577838456 TSecr=874321482"
"128","1.111041","151.101.65.140","100.86.243.187","TLSv1.2","170","Application Data"
"129","1.111116","100.86.243.187","151.101.65.140","TCP","66","56492  >  443 [ACK] Seq=2511 Ack=2951 Win=2046 Len=0 TSval=874321492 TSecr=1577838456"
"130","1.111704","151.101.65.140","100.86.243.187","TLSv1.2","607","Application Data"
"131","1.111759","100.86.243.187","151.101.65.140","TCP","66","56492  >  443 [ACK] Seq=2511 Ack=3492 Win=2039 Len=0 TSval=874321492 TSecr=1577838456"
"132","1.116256","151.101.65.140","100.86.243.187","TCP","66","443  >  56492 [ACK] Seq=3492 Ack=2511 Win=359 Len=0 TSval=1577838461 TSecr=874321486"
"133","1.116256","151.101.65.140","100.86.243.187","TLSv1.2","146","Application Data"
"134","1.116328","100.86.243.187","151.101.65.140","TCP","66","56492  >  443 [ACK] Seq=2511 Ack=3572 Win=2046 Len=0 TSval=874321497 TSecr=1577838461"
"135","1.116869","151.101.65.140","100.86.243.187","TLSv1.2","483","Application Data"
"136","1.116922","100.86.243.187","151.101.65.140","TCP","66","56492  >  443 [ACK] Seq=2511 Ack=3989 Win=2041 Len=0 TSval=874321497 TSecr=1577838461"
"137","1.117130","151.101.65.140","100.86.243.187","TLSv1.2","1510","Application Data"
"138","1.117131","151.101.65.140","100.86.243.187","TLSv1.2","470","Application Data"
"139","1.117174","100.86.243.187","151.101.65.140","TCP","66","56492  >  443 [ACK] Seq=2511 Ack=5837 Win=2019 Len=0 TSval=874321497 TSecr=1577838462"
"156","1.141096","100.86.243.187","151.101.65.140","TLSv1.2","230","Application Data"
"157","1.152099","151.101.65.140","100.86.243.187","TCP","66","443  >  56492 [ACK] Seq=5837 Ack=2675 Win=364 Len=0 TSval=1577838496 TSecr=874321522"
"158","1.152949","151.101.65.140","100.86.243.187","TLSv1.2","1510","Application Data"
"159","1.152951","151.101.65.140","100.86.243.187","TLSv1.2","1380","Application Data"
"160","1.153019","100.86.243.187","151.101.65.140","TCP","66","56492  >  443 [ACK] Seq=2675 Ack=8595 Win=2004 Len=0 TSval=874321533 TSecr=1577838497"
"193","1.540308","100.86.243.187","151.101.65.140","TLSv1.2","214","Application Data"
"194","1.541345","100.86.243.187","151.101.65.140","TLSv1.2","168","Application Data"
"195","1.546308","100.86.243.187","151.101.65.140","TLSv1.2","158","Application Data"
"196","1.550351","151.101.65.140","100.86.243.187","TCP","66","443  >  56492 [ACK] Seq=8595 Ack=2823 Win=370 Len=0 TSval=1577838895 TSecr=874321921"
"197","1.550384","151.101.65.140","100.86.243.187","TLSv1.2","195","Application Data"
"198","1.550461","100.86.243.187","151.101.65.140","TCP","66","56492  >  443 [ACK] Seq=3017 Ack=8724 Win=2045 Len=0 TSval=874321931 TSecr=1577838896"
"199","1.551187","151.101.65.140","100.86.243.187","TCP","1510","443  >  56492 [ACK] Seq=8724 Ack=2925 Win=370 Len=1444 TSval=1577838896 TSecr=874321922 [TCP PDU reassembled in 216]"
"200","1.551262","100.86.243.187","151.101.65.140","TCP","66","56492  >  443 [ACK] Seq=3017 Ack=10168 Win=2025 Len=0 TSval=874321931 TSecr=1577838896"
"201","1.551540","151.101.65.140","100.86.243.187","TCP","1510","443  >  56492 [ACK] Seq=10168 Ack=2925 Win=370 Len=1444 TSval=1577838896 TSecr=874321922 [TCP PDU reassembled in 216]"
"202","1.551541","151.101.65.140","100.86.243.187","TCP","1510","443  >  56492 [PSH, ACK] Seq=11612 Ack=2925 Win=370 Len=1444 TSval=1577838896 TSecr=874321922 [TCP PDU reassembled in 216]"
"203","1.551604","100.86.243.187","151.101.65.140","TCP","66","56492  >  443 [ACK] Seq=3017 Ack=13056 Win=2002 Len=0 TSval=874321932 TSecr=1577838896"
"204","1.551688","151.101.65.140","100.86.243.187","TCP","1510","443  >  56492 [ACK] Seq=13056 Ack=2925 Win=370 Len=1444 TSval=1577838897 TSecr=874321922 [TCP PDU reassembled in 216]"
"205","1.551690","151.101.65.140","100.86.243.187","TCP","1510","443  >  56492 [ACK] Seq=14500 Ack=2925 Win=370 Len=1444 TSval=1577838897 TSecr=874321922 [TCP PDU reassembled in 216]"
"206","1.551743","100.86.243.187","151.101.65.140","TCP","66","56492  >  443 [ACK] Seq=3017 Ack=15944 Win=2002 Len=0 TSval=874321932 TSecr=1577838897"
"207","1.552745","151.101.65.140","100.86.243.187","TCP","1510","443  >  56492 [PSH, ACK] Seq=15944 Ack=2925 Win=370 Len=1444 TSval=1577838897 TSecr=874321922 [TCP PDU reassembled in 216]"
"208","1.552825","100.86.243.187","151.101.65.140","TCP","66","56492  >  443 [ACK] Seq=3017 Ack=17388 Win=2025 Len=0 TSval=874321934 TSecr=1577838897"
"209","1.552953","151.101.65.140","100.86.243.187","TCP","1510","443  >  56492 [ACK] Seq=17388 Ack=2925 Win=370 Len=1444 TSval=1577838897 TSecr=874321922 [TCP PDU reassembled in 216]"
"210","1.552954","151.101.65.140","100.86.243.187","TCP","1510","443  >  56492 [ACK] Seq=18832 Ack=2925 Win=370 Len=1444 TSval=1577838897 TSecr=874321922 [TCP PDU reassembled in 216]"
"211","1.553010","100.86.243.187","151.101.65.140","TCP","66","56492  >  443 [ACK] Seq=3017 Ack=20276 Win=2002 Len=0 TSval=874321934 TSecr=1577838897"
"212","1.554058","151.101.65.140","100.86.243.187","TCP","1510","443  >  56492 [PSH, ACK] Seq=20276 Ack=2925 Win=370 Len=1444 TSval=1577838897 TSecr=874321922 [TCP PDU reassembled in 216]"
"213","1.554059","151.101.65.140","100.86.243.187","TCP","1510","443  >  56492 [ACK] Seq=21720 Ack=2925 Win=370 Len=1444 TSval=1577838898 TSecr=874321922 [TCP PDU reassembled in 216]"
"214","1.554125","100.86.243.187","151.101.65.140","TCP","66","56492  >  443 [ACK] Seq=3017 Ack=23164 Win=2002 Len=0 TSval=874321935 TSecr=1577838898"
"215","1.554710","151.101.65.140","100.86.243.187","TCP","1510","443  >  56492 [ACK] Seq=23164 Ack=2925 Win=370 Len=1444 TSval=1577838898 TSecr=874321922 [TCP PDU reassembled in 216]"
"216","1.554711","151.101.65.140","100.86.243.187","TLSv1.2","1510","Application Data"
"217","1.554712","151.101.65.140","100.86.243.187","TCP","1510","443  >  56492 [ACK] Seq=26052 Ack=2925 Win=370 Len=1444 TSval=1577838899 TSecr=874321922 [TCP PDU reassembled in 233]"
"218","1.554713","151.101.65.140","100.86.243.187","TCP","1510","443  >  56492 [ACK] Seq=27496 Ack=2925 Win=370 Len=1444 TSval=1577838899 TSecr=874321922 [TCP PDU reassembled in 233]"
"219","1.554785","100.86.243.187","151.101.65.140","TCP","66","56492  >  443 [ACK] Seq=3017 Ack=28940 Win=1957 Len=0 TSval=874321935 TSecr=1577838899"
"220","1.554972","100.86.243.187","151.101.65.140","TCP","66","[TCP Window Update] 56492  >  443 [ACK] Seq=3017 Ack=28940 Win=2048 Len=0 TSval=874321935 TSecr=1577838899"
"221","1.556098","151.101.65.140","100.86.243.187","TCP","1510","443  >  56492 [PSH, ACK] Seq=28940 Ack=2925 Win=370 Len=1444 TSval=1577838899 TSecr=874321922 [TCP PDU reassembled in 233]"
"222","1.556099","151.101.65.140","100.86.243.187","TCP","1510","443  >  56492 [ACK] Seq=30384 Ack=2925 Win=370 Len=1444 TSval=1577838900 TSecr=874321922 [TCP PDU reassembled in 233]"
"223","1.556100","151.101.65.140","100.86.243.187","TCP","1510","443  >  56492 [ACK] Seq=31828 Ack=2925 Win=370 Len=1444 TSval=1577838900 TSecr=874321922 [TCP PDU reassembled in 233]"
"224","1.556242","100.86.243.187","151.101.65.140","TCP","66","56492  >  443 [ACK] Seq=3017 Ack=33272 Win=1980 Len=0 TSval=874321937 TSecr=1577838900"
"225","1.556283","100.86.243.187","151.101.65.140","TCP","66","[TCP Window Update] 56492  >  443 [ACK] Seq=3017 Ack=33272 Win=2048 Len=0 TSval=874321937 TSecr=1577838900"
"226","1.556754","151.101.65.140","100.86.243.187","TCP","1510","443  >  56492 [PSH, ACK] Seq=33272 Ack=2925 Win=370 Len=1444 TSval=1577838900 TSecr=874321922 [TCP PDU reassembled in 233]"
"227","1.556755","151.101.65.140","100.86.243.187","TCP","1510","443  >  56492 [ACK] Seq=34716 Ack=2925 Win=370 Len=1444 TSval=1577838901 TSecr=874321922 [TCP PDU reassembled in 233]"
"228","1.556820","100.86.243.187","151.101.65.140","TCP","66","56492  >  443 [ACK] Seq=3017 Ack=36160 Win=2002 Len=0 TSval=874321937 TSecr=1577838901"
"229","1.557059","151.101.65.140","100.86.243.187","TCP","1510","443  >  56492 [ACK] Seq=36160 Ack=2925 Win=370 Len=1444 TSval=1577838901 TSecr=874321922 [TCP PDU reassembled in 233]"
"230","1.557060","151.101.65.140","100.86.243.187","TCP","1510","443  >  56492 [PSH, ACK] Seq=37604 Ack=2925 Win=370 Len=1444 TSval=1577838901 TSecr=874321922 [TCP PDU reassembled in 233]"
"231","1.557112","100.86.243.187","151.101.65.140","TCP","66","56492  >  443 [ACK] Seq=3017 Ack=39048 Win=2002 Len=0 TSval=874321937 TSecr=1577838901"
"232","1.557303","151.101.65.140","100.86.243.187","TCP","1510","443  >  56492 [ACK] Seq=39048 Ack=2925 Win=370 Len=1444 TSval=1577838902 TSecr=874321922 [TCP PDU reassembled in 233]"
"233","1.557304","151.101.65.140","100.86.243.187","TLSv1.2","1510","Application Data"
"234","1.557355","100.86.243.187","151.101.65.140","TCP","66","56492  >  443 [ACK] Seq=3017 Ack=41936 Win=2002 Len=0 TSval=874321938 TSecr=1577838902"
"235","1.557761","151.101.65.140","100.86.243.187","TCP","1510","443  >  56492 [PSH, ACK] Seq=41936 Ack=2925 Win=370 Len=1444 TSval=1577838902 TSecr=874321922 [TCP PDU reassembled in 252]"
"236","1.557825","100.86.243.187","151.101.65.140","TCP","66","56492  >  443 [ACK] Seq=3017 Ack=43380 Win=2025 Len=0 TSval=874321938 TSecr=1577838902"
"237","1.557913","151.101.65.140","100.86.243.187","TCP","1510","443  >  56492 [ACK] Seq=43380 Ack=3017 Win=370 Len=1444 TSval=1577838903 TSecr=874321927 [TCP PDU reassembled in 252]"
"238","1.557914","151.101.65.140","100.86.243.187","TCP","1510","443  >  56492 [ACK] Seq=44824 Ack=3017 Win=370 Len=1444 TSval=1577838903 TSecr=874321927 [TCP PDU reassembled in 252]"
"239","1.557969","100.86.243.187","151.101.65.140","TCP","66","56492  >  443 [ACK] Seq=3017 Ack=46268 Win=2002 Len=0 TSval=874321938 TSecr=1577838903"
"240","1.558946","151.101.65.140","100.86.243.187","TCP","1510","443  >  56492 [PSH, ACK] Seq=46268 Ack=3017 Win=370 Len=1444 TSval=1577838903 TSecr=874321927 [TCP PDU reassembled in 252]"
"241","1.559014","100.86.243.187","151.101.65.140","TCP","66","56492  >  443 [ACK] Seq=3017 Ack=47712 Win=2025 Len=0 TSval=874321940 TSecr=1577838903"
"242","1.559734","151.101.65.140","100.86.243.187","TCP","1510","443  >  56492 [ACK] Seq=47712 Ack=3017 Win=370 Len=1444 TSval=1577838904 TSecr=874321927 [TCP PDU reassembled in 252]"
"243","1.559736","151.101.65.140","100.86.243.187","TCP","1510","443  >  56492 [PSH, ACK] Seq=49156 Ack=3017 Win=370 Len=1444 TSval=1577838904 TSecr=874321927 [TCP PDU reassembled in 252]"
"244","1.559813","100.86.243.187","151.101.65.140","TCP","66","56492  >  443 [ACK] Seq=3017 Ack=50600 Win=2002 Len=0 TSval=874321940 TSecr=1577838904"
"245","1.561565","151.101.65.140","100.86.243.187","TCP","1510","443  >  56492 [ACK] Seq=50600 Ack=3017 Win=370 Len=1444 TSval=1577838906 TSecr=874321932 [TCP PDU reassembled in 252]"
"246","1.561567","151.101.65.140","100.86.243.187","TCP","1510","443  >  56492 [ACK] Seq=52044 Ack=3017 Win=370 Len=1444 TSval=1577838906 TSecr=874321932 [TCP PDU reassembled in 252]"
"247","1.561568","151.101.65.140","100.86.243.187","TCP","1510","443  >  56492 [PSH, ACK] Seq=53488 Ack=3017 Win=370 Len=1444 TSval=1577838906 TSecr=874321932 [TCP PDU reassembled in 252]"
"248","1.561652","100.86.243.187","151.101.65.140","TCP","66","56492  >  443 [ACK] Seq=3017 Ack=54932 Win=2817 Len=0 TSval=874321942 TSecr=1577838906"
"249","1.561754","100.86.243.187","151.101.65.140","TCP","66","[TCP Window Update] 56492  >  443 [ACK] Seq=3017 Ack=54932 Win=2885 Len=0 TSval=874321942 TSecr=1577838906"
"250","1.562112","151.101.65.140","100.86.243.187","TCP","1510","443  >  56492 [ACK] Seq=54932 Ack=3017 Win=370 Len=1444 TSval=1577838906 TSecr=874321932 [TCP PDU reassembled in 252]"
"251","1.562112","151.101.65.140","100.86.243.187","TCP","1510","443  >  56492 [ACK] Seq=56376 Ack=3017 Win=370 Len=1444 TSval=1577838906 TSecr=874321932 [TCP PDU reassembled in 252]"
"252","1.562207","151.101.65.140","100.86.243.187","TLSv1.2","1510","Application Data"
"253","1.562208","151.101.65.140","100.86.243.187","TCP","1510","443  >  56492 [ACK] Seq=59264 Ack=3017 Win=370 Len=1444 TSval=1577838907 TSecr=874321932 [TCP PDU reassembled in 266]"
"254","1.562233","100.86.243.187","151.101.65.140","TCP","66","56492  >  443 [ACK] Seq=3017 Ack=57820 Win=2840 Len=0 TSval=874321942 TSecr=1577838906"
"255","1.562252","100.86.243.187","151.101.65.140","TCP","66","56492  >  443 [ACK] Seq=3017 Ack=60708 Win=2840 Len=0 TSval=874321942 TSecr=1577838907"
"256","1.562713","151.101.65.140","100.86.243.187","TCP","1510","443  >  56492 [ACK] Seq=60708 Ack=3017 Win=370 Len=1444 TSval=1577838907 TSecr=874321932 [TCP PDU reassembled in 266]"
"257","1.562714","151.101.65.140","100.86.243.187","TCP","1510","443  >  56492 [ACK] Seq=62152 Ack=3017 Win=370 Len=1444 TSval=1577838907 TSecr=874321932 [TCP PDU reassembled in 266]"
"258","1.562779","100.86.243.187","151.101.65.140","TCP","66","56492  >  443 [ACK] Seq=3017 Ack=63596 Win=2840 Len=0 TSval=874321944 TSecr=1577838907"
"259","1.563157","151.101.65.140","100.86.243.187","TCP","1510","443  >  56492 [PSH, ACK] Seq=63596 Ack=3017 Win=370 Len=1444 TSval=1577838907 TSecr=874321932 [TCP PDU reassembled in 266]"
"260","1.563223","100.86.243.187","151.101.65.140","TCP","66","56492  >  443 [ACK] Seq=3017 Ack=65040 Win=2862 Len=0 TSval=874321944 TSecr=1577838907"
"261","1.563229","151.101.65.140","100.86.243.187","TCP","1510","443  >  56492 [ACK] Seq=65040 Ack=3017 Win=370 Len=1444 TSval=1577838908 TSecr=874321934 [TCP PDU reassembled in 266]"
"262","1.563230","151.101.65.140","100.86.243.187","TCP","1510","443  >  56492 [ACK] Seq=66484 Ack=3017 Win=370 Len=1444 TSval=1577838908 TSecr=874321934 [TCP PDU reassembled in 266]"
"263","1.563300","100.86.243.187","151.101.65.140","TCP","66","56492  >  443 [ACK] Seq=3017 Ack=67928 Win=2817 Len=0 TSval=874321944 TSecr=1577838908"
"264","1.563319","100.86.243.187","151.101.65.140","TCP","66","[TCP Window Update] 56492  >  443 [ACK] Seq=3017 Ack=67928 Win=2885 Len=0 TSval=874321944 TSecr=1577838908"
"265","1.563857","151.101.65.140","100.86.243.187","TCP","1510","443  >  56492 [ACK] Seq=67928 Ack=3017 Win=370 Len=1444 TSval=1577838908 TSecr=874321934 [TCP PDU reassembled in 266]"
"266","1.563858","151.101.65.140","100.86.243.187","TLSv1.2","1510","Application Data, Application Data"
"267","1.563933","100.86.243.187","151.101.65.140","TCP","66","56492  >  443 [ACK] Seq=3017 Ack=70816 Win=2840 Len=0 TSval=874321945 TSecr=1577838908"
"268","1.564059","151.101.65.140","100.86.243.187","TCP","1510","443  >  56492 [ACK] Seq=70816 Ack=3017 Win=370 Len=1444 TSval=1577838909 TSecr=874321935 [TCP PDU reassembled in 285]"
"269","1.564061","151.101.65.140","100.86.243.187","TCP","1510","443  >  56492 [ACK] Seq=72260 Ack=3017 Win=370 Len=1444 TSval=1577838909 TSecr=874321935 [TCP PDU reassembled in 285]"
"270","1.564116","100.86.243.187","151.101.65.140","TCP","66","56492  >  443 [ACK] Seq=3017 Ack=73704 Win=2839 Len=0 TSval=874321945 TSecr=1577838909"
"271","1.564201","100.86.243.187","151.101.65.140","TCP","66","[TCP Window Update] 56492  >  443 [ACK] Seq=3017 Ack=73704 Win=2885 Len=0 TSval=874321945 TSecr=1577838909"
"272","1.564383","151.101.65.140","100.86.243.187","TCP","1510","443  >  56492 [ACK] Seq=73704 Ack=3017 Win=370 Len=1444 TSval=1577838909 TSecr=874321935 [TCP PDU reassembled in 285]"
"273","1.564384","151.101.65.140","100.86.243.187","TCP","1510","443  >  56492 [ACK] Seq=75148 Ack=3017 Win=370 Len=1444 TSval=1577838909 TSecr=874321935 [TCP PDU reassembled in 285]"
"274","1.564432","100.86.243.187","151.101.65.140","TCP","66","56492  >  443 [ACK] Seq=3017 Ack=76592 Win=2840 Len=0 TSval=874321945 TSecr=1577838909"
"275","1.565675","151.101.65.140","100.86.243.187","TCP","1510","443  >  56492 [PSH, ACK] Seq=76592 Ack=3017 Win=370 Len=1444 TSval=1577838909 TSecr=874321935 [TCP PDU reassembled in 285]"
"276","1.565753","100.86.243.187","151.101.65.140","TCP","66","56492  >  443 [ACK] Seq=3017 Ack=78036 Win=2862 Len=0 TSval=874321947 TSecr=1577838909"
"277","1.567634","151.101.65.140","100.86.243.187","TCP","1510","443  >  56492 [ACK] Seq=78036 Ack=3017 Win=370 Len=1444 TSval=1577838912 TSecr=874321937 [TCP PDU reassembled in 285]"
"278","1.567635","151.101.65.140","100.86.243.187","TCP","1510","443  >  56492 [ACK] Seq=79480 Ack=3017 Win=370 Len=1444 TSval=1577838912 TSecr=874321937 [TCP PDU reassembled in 285]"
"279","1.567636","151.101.65.140","100.86.243.187","TCP","1510","443  >  56492 [ACK] Seq=80924 Ack=3017 Win=370 Len=1444 TSval=1577838912 TSecr=874321937 [TCP PDU reassembled in 285]"
"280","1.567840","100.86.243.187","151.101.65.140","TCP","66","56492  >  443 [ACK] Seq=3017 Ack=82368 Win=2817 Len=0 TSval=874321948 TSecr=1577838912"
"281","1.567928","100.86.243.187","151.101.65.140","TCP","66","[TCP Window Update] 56492  >  443 [ACK] Seq=3017 Ack=82368 Win=2885 Len=0 TSval=874321948 TSecr=1577838912"
"282","1.569493","151.101.65.140","100.86.243.187","TCP","1510","443  >  56492 [ACK] Seq=82368 Ack=3017 Win=370 Len=1444 TSval=1577838912 TSecr=874321937 [TCP PDU reassembled in 285]"
"283","1.569495","151.101.65.140","100.86.243.187","TCP","1510","443  >  56492 [ACK] Seq=83812 Ack=3017 Win=370 Len=1444 TSval=1577838912 TSecr=874321937 [TCP PDU reassembled in 285]"
"284","1.569496","151.101.65.140","100.86.243.187","TCP","1510","443  >  56492 [ACK] Seq=85256 Ack=3017 Win=370 Len=1444 TSval=1577838912 TSecr=874321937 [TCP PDU reassembled in 285]"
"285","1.569497","151.101.65.140","100.86.243.187","TLSv1.2","1510","Application Data"
"286","1.569497","151.101.65.140","100.86.243.187","TCP","1510","443  >  56492 [ACK] Seq=88144 Ack=3017 Win=370 Len=1444 TSval=1577838912 TSecr=874321937 [TCP PDU reassembled in 299]"
"287","1.569498","151.101.65.140","100.86.243.187","TCP","1510","443  >  56492 [PSH, ACK] Seq=89588 Ack=3017 Win=370 Len=1444 TSval=1577838912 TSecr=874321937 [TCP PDU reassembled in 299]"
"288","1.569499","151.101.65.140","100.86.243.187","TCP","1510","443  >  56492 [ACK] Seq=91032 Ack=3017 Win=370 Len=1444 TSval=1577838913 TSecr=874321937 [TCP PDU reassembled in 299]"
"289","1.569500","151.101.65.140","100.86.243.187","TCP","1510","443  >  56492 [ACK] Seq=92476 Ack=3017 Win=370 Len=1444 TSval=1577838913 TSecr=874321937 [TCP PDU reassembled in 299]"
"290","1.569501","151.101.65.140","100.86.243.187","TCP","1510","443  >  56492 [ACK] Seq=93920 Ack=3017 Win=370 Len=1444 TSval=1577838913 TSecr=874321937 [TCP PDU reassembled in 299]"
"291","1.569502","151.101.65.140","100.86.243.187","TCP","1510","443  >  56492 [ACK] Seq=95364 Ack=3017 Win=370 Len=1444 TSval=1577838913 TSecr=874321937 [TCP PDU reassembled in 299]"
"292","1.569502","151.101.65.140","100.86.243.187","TCP","1510","443  >  56492 [ACK] Seq=96808 Ack=3017 Win=370 Len=1444 TSval=1577838913 TSecr=874321937 [TCP PDU reassembled in 299]"
"293","1.569503","151.101.65.140","100.86.243.187","TCP","1510","443  >  56492 [ACK] Seq=98252 Ack=3017 Win=370 Len=1444 TSval=1577838913 TSecr=874321937 [TCP PDU reassembled in 299]"
"294","1.569504","151.101.65.140","100.86.243.187","TCP","1510","443  >  56492 [PSH, ACK] Seq=99696 Ack=3017 Win=370 Len=1444 TSval=1577838913 TSecr=874321937 [TCP PDU reassembled in 299]"
"295","1.569505","151.101.65.140","100.86.243.187","TCP","1510","443  >  56492 [ACK] Seq=101140 Ack=3017 Win=370 Len=1444 TSval=1577838914 TSecr=874321937 [TCP PDU reassembled in 299]"
"296","1.569597","100.86.243.187","151.101.65.140","TCP","66","56492  >  443 [ACK] Seq=3017 Ack=98252 Win=2636 Len=0 TSval=874321950 TSecr=1577838913"
"297","1.569642","100.86.243.187","151.101.65.140","TCP","66","56492  >  443 [ACK] Seq=3017 Ack=102584 Win=2569 Len=0 TSval=874321950 TSecr=1577838914"
"298","1.569759","100.86.243.187","151.101.65.140","TCP","66","[TCP Window Update] 56492  >  443 [ACK] Seq=3017 Ack=102584 Win=2885 Len=0 TSval=874321950 TSecr=1577838914"
"299","1.570902","151.101.65.140","100.86.243.187","TLSv1.2","1510","Application Data"
"300","1.570903","151.101.65.140","100.86.243.187","TLSv1.2","1510","Application Data"
"301","1.570904","151.101.65.140","100.86.243.187","TCP","1510","443  >  56492 [ACK] Seq=105472 Ack=3017 Win=370 Len=1444 TSval=1577838914 TSecr=874321937 [TCP PDU reassembled in 314]"
"302","1.570905","151.101.65.140","100.86.243.187","TCP","1510","443  >  56492 [ACK] Seq=106916 Ack=3017 Win=370 Len=1444 TSval=1577838914 TSecr=874321937 [TCP PDU reassembled in 314]"
"303","1.570906","151.101.65.140","100.86.243.187","TCP","1510","443  >  56492 [ACK] Seq=108360 Ack=3017 Win=370 Len=1444 TSval=1577838914 TSecr=874321937 [TCP PDU reassembled in 314]"
"304","1.570907","151.101.65.140","100.86.243.187","TCP","1510","443  >  56492 [PSH, ACK] Seq=109804 Ack=3017 Win=370 Len=1444 TSval=1577838914 TSecr=874321937 [TCP PDU reassembled in 314]"
"305","1.570908","151.101.65.140","100.86.243.187","TCP","1510","443  >  56492 [ACK] Seq=111248 Ack=3017 Win=370 Len=1444 TSval=1577838915 TSecr=874321938 [TCP PDU reassembled in 314]"
"306","1.570908","151.101.65.140","100.86.243.187","TCP","1510","443  >  56492 [ACK] Seq=112692 Ack=3017 Win=370 Len=1444 TSval=1577838915 TSecr=874321938 [TCP PDU reassembled in 314]"
"307","1.570985","100.86.243.187","151.101.65.140","TCP","66","56492  >  443 [ACK] Seq=3017 Ack=114136 Win=2704 Len=0 TSval=874321952 TSecr=1577838915"
"308","1.571265","100.86.243.187","151.101.65.140","TCP","66","[TCP Window Update] 56492  >  443 [ACK] Seq=3017 Ack=114136 Win=2885 Len=0 TSval=874321952 TSecr=1577838915"
"309","1.572115","151.101.65.140","100.86.243.187","TCP","1510","443  >  56492 [ACK] Seq=114136 Ack=3017 Win=370 Len=1444 TSval=1577838915 TSecr=874321938 [TCP PDU reassembled in 314]"
"310","1.572116","151.101.65.140","100.86.243.187","TCP","1510","443  >  56492 [ACK] Seq=115580 Ack=3017 Win=370 Len=1444 TSval=1577838915 TSecr=874321938 [TCP PDU reassembled in 314]"
"311","1.572117","151.101.65.140","100.86.243.187","TCP","1510","443  >  56492 [ACK] Seq=117024 Ack=3017 Win=370 Len=1444 TSval=1577838915 TSecr=874321938 [TCP PDU reassembled in 314]"
"312","1.572118","151.101.65.140","100.86.243.187","TCP","1510","443  >  56492 [ACK] Seq=118468 Ack=3017 Win=370 Len=1444 TSval=1577838915 TSecr=874321938 [TCP PDU reassembled in 314]"
"313","1.572118","151.101.65.140","100.86.243.187","TCP","1510","443  >  56492 [PSH, ACK] Seq=119912 Ack=3017 Win=370 Len=1444 TSval=1577838915 TSecr=874321938 [TCP PDU reassembled in 314]"
"314","1.572119","151.101.65.140","100.86.243.187","TLSv1.2","1510","Application Data"
"315","1.572120","151.101.65.140","100.86.243.187","TCP","1510","443  >  56492 [ACK] Seq=122800 Ack=3017 Win=370 Len=1444 TSval=1577838916 TSecr=874321940 [TCP PDU reassembled in 328]"
"316","1.572120","151.101.65.140","100.86.243.187","TCP","1510","443  >  56492 [ACK] Seq=124244 Ack=3017 Win=370 Len=1444 TSval=1577838916 TSecr=874321940 [TCP PDU reassembled in 328]"
"317","1.572121","151.101.65.140","100.86.243.187","TCP","1510","443  >  56492 [ACK] Seq=125688 Ack=3017 Win=370 Len=1444 TSval=1577838916 TSecr=874321940 [TCP PDU reassembled in 328]"
"318","1.572122","151.101.65.140","100.86.243.187","TCP","1510","443  >  56492 [ACK] Seq=127132 Ack=3017 Win=370 Len=1444 TSval=1577838916 TSecr=874321940 [TCP PDU reassembled in 328]"
"319","1.572122","151.101.65.140","100.86.243.187","TCP","1510","443  >  56492 [ACK] Seq=128576 Ack=3017 Win=370 Len=1444 TSval=1577838916 TSecr=874321940 [TCP PDU reassembled in 328]"
"320","1.572123","151.101.65.140","100.86.243.187","TCP","1510","443  >  56492 [ACK] Seq=130020 Ack=3017 Win=370 Len=1444 TSval=1577838916 TSecr=874321940 [TCP PDU reassembled in 328]"
"321","1.572215","100.86.243.187","151.101.65.140","TCP","66","56492  >  443 [ACK] Seq=3017 Ack=130020 Win=2636 Len=0 TSval=874321953 TSecr=1577838916"
"322","1.572387","100.86.243.187","151.101.65.140","TCP","66","56492  >  443 [ACK] Seq=3017 Ack=131464 Win=2885 Len=0 TSval=874321953 TSecr=1577838916"
"323","1.572482","151.101.65.140","100.86.243.187","TCP","1510","443  >  56492 [ACK] Seq=131464 Ack=3017 Win=370 Len=1444 TSval=1577838916 TSecr=874321940 [TCP PDU reassembled in 328]"
"324","1.572483","151.101.65.140","100.86.243.187","TCP","1510","443  >  56492 [PSH, ACK] Seq=132908 Ack=3017 Win=370 Len=1444 TSval=1577838916 TSecr=874321940 [TCP PDU reassembled in 328]"
"325","1.572535","100.86.243.187","151.101.65.140","TCP","66","56492  >  443 [ACK] Seq=3017 Ack=134352 Win=2840 Len=0 TSval=874321953 TSecr=1577838916"
"326","1.573600","151.101.65.140","100.86.243.187","TCP","1510","443  >  56492 [ACK] Seq=134352 Ack=3017 Win=370 Len=1444 TSval=1577838918 TSecr=874321942 [TCP PDU reassembled in 328]"
"327","1.573601","151.101.65.140","100.86.243.187","TCP","1510","443  >  56492 [ACK] Seq=135796 Ack=3017 Win=370 Len=1444 TSval=1577838918 TSecr=874321942 [TCP PDU reassembled in 328]"
"328","1.573602","151.101.65.140","100.86.243.187","TLSv1.2","1510","Application Data"
"329","1.573679","100.86.243.187","151.101.65.140","TCP","66","56492  >  443 [ACK] Seq=3017 Ack=138684 Win=5147 Len=0 TSval=874321954 TSecr=1577838918"
"330","1.573833","100.86.243.187","151.101.65.140","TCP","66","[TCP Window Update] 56492  >  443 [ACK] Seq=3017 Ack=138684 Win=5215 Len=0 TSval=874321954 TSecr=1577838918"
"331","1.574514","151.101.65.140","100.86.243.187","TCP","1510","443  >  56492 [ACK] Seq=138684 Ack=3017 Win=370 Len=1444 TSval=1577838918 TSecr=874321942 [TCP PDU reassembled in 342]"
"332","1.574515","151.101.65.140","100.86.243.187","TCP","1510","443  >  56492 [ACK] Seq=140128 Ack=3017 Win=370 Len=1444 TSval=1577838918 TSecr=874321942 [TCP PDU reassembled in 342]"
"333","1.574735","151.101.65.140","100.86.243.187","TCP","1510","443  >  56492 [ACK] Seq=141572 Ack=3017 Win=370 Len=1444 TSval=1577838918 TSecr=874321942 [TCP PDU reassembled in 342]"
"334","1.574736","151.101.65.140","100.86.243.187","TCP","1510","443  >  56492 [ACK] Seq=143016 Ack=3017 Win=370 Len=1444 TSval=1577838918 TSecr=874321942 [TCP PDU reassembled in 342]"
"335","1.574738","151.101.65.140","100.86.243.187","TCP","1510","443  >  56492 [ACK] Seq=144460 Ack=3017 Win=370 Len=1444 TSval=1577838918 TSecr=874321942 [TCP PDU reassembled in 342]"
"336","1.574738","151.101.65.140","100.86.243.187","TCP","1510","443  >  56492 [PSH, ACK] Seq=145904 Ack=3017 Win=370 Len=1444 TSval=1577838918 TSecr=874321942 [TCP PDU reassembled in 342]"
"337","1.574848","100.86.243.187","151.101.65.140","TCP","66","56492  >  443 [ACK] Seq=3017 Ack=147348 Win=5215 Len=0 TSval=874321956 TSecr=1577838918"
"338","1.576118","151.101.65.140","100.86.243.187","TCP","1510","443  >  56492 [ACK] Seq=147348 Ack=3017 Win=370 Len=1444 TSval=1577838919 TSecr=874321945 [TCP PDU reassembled in 342]"
"339","1.576120","151.101.65.140","100.86.243.187","TCP","1510","443  >  56492 [ACK] Seq=148792 Ack=3017 Win=370 Len=1444 TSval=1577838919 TSecr=874321945 [TCP PDU reassembled in 342]"
"340","1.576121","151.101.65.140","100.86.243.187","TCP","1510","443  >  56492 [ACK] Seq=150236 Ack=3017 Win=370 Len=1444 TSval=1577838919 TSecr=874321945 [TCP PDU reassembled in 342]"
"341","1.576122","151.101.65.140","100.86.243.187","TCP","1510","443  >  56492 [ACK] Seq=151680 Ack=3017 Win=370 Len=1444 TSval=1577838919 TSecr=874321945 [TCP PDU reassembled in 342]"
"342","1.576123","151.101.65.140","100.86.243.187","TLSv1.2","1510","Application Data"
"343","1.576123","151.101.65.140","100.86.243.187","TCP","1510","443  >  56492 [PSH, ACK] Seq=154568 Ack=3017 Win=370 Len=1444 TSval=1577838919 TSecr=874321945 [TCP PDU reassembled in 355]"
"344","1.576124","151.101.65.140","100.86.243.187","TCP","1510","443  >  56492 [ACK] Seq=156012 Ack=3017 Win=370 Len=1444 TSval=1577838919 TSecr=874321945 [TCP PDU reassembled in 355]"
"345","1.576125","151.101.65.140","100.86.243.187","TCP","1510","443  >  56492 [ACK] Seq=157456 Ack=3017 Win=370 Len=1444 TSval=1577838919 TSecr=874321945 [TCP PDU reassembled in 355]"
"346","1.576126","151.101.65.140","100.86.243.187","TCP","1510","443  >  56492 [ACK] Seq=158900 Ack=3017 Win=370 Len=1444 TSval=1577838919 TSecr=874321945 [TCP PDU reassembled in 355]"
"347","1.576127","151.101.65.140","100.86.243.187","TCP","1510","443  >  56492 [ACK] Seq=160344 Ack=3017 Win=370 Len=1444 TSval=1577838919 TSecr=874321945 [TCP PDU reassembled in 355]"
"348","1.576127","151.101.65.140","100.86.243.187","TCP","1510","443  >  56492 [ACK] Seq=161788 Ack=3017 Win=370 Len=1444 TSval=1577838919 TSecr=874321945 [TCP PDU reassembled in 355]"
"349","1.576129","151.101.65.140","100.86.243.187","TCP","1510","443  >  56492 [ACK] Seq=163232 Ack=3017 Win=370 Len=1444 TSval=1577838919 TSecr=874321945 [TCP PDU reassembled in 355]"
"350","1.576129","151.101.65.140","100.86.243.187","TCP","1510","443  >  56492 [ACK] Seq=164676 Ack=3017 Win=370 Len=1444 TSval=1577838919 TSecr=874321945 [TCP PDU reassembled in 355]"
"351","1.576130","151.101.65.140","100.86.243.187","TCP","1510","443  >  56492 [ACK] Seq=166120 Ack=3017 Win=370 Len=1444 TSval=1577838919 TSecr=874321945 [TCP PDU reassembled in 355]"
"352","1.576269","151.101.65.140","100.86.243.187","TCP","1510","443  >  56492 [ACK] Seq=167564 Ack=3017 Win=370 Len=1444 TSval=1577838919 TSecr=874321945 [TCP PDU reassembled in 355]"
"353","1.576270","151.101.65.140","100.86.243.187","TCP","1510","443  >  56492 [ACK] Seq=169008 Ack=3017 Win=370 Len=1444 TSval=1577838919 TSecr=874321945 [TCP PDU reassembled in 355]"
"354","1.576377","100.86.243.187","151.101.65.140","TCP","66","56492  >  443 [ACK] Seq=3017 Ack=170452 Win=5215 Len=0 TSval=874321957 TSecr=1577838919"
"355","1.576441","151.101.65.140","100.86.243.187","TLSv1.2","1510","Application Data, Application Data"
"356","1.576442","151.101.65.140","100.86.243.187","TCP","1510","443  >  56492 [ACK] Seq=171896 Ack=3017 Win=370 Len=1444 TSval=1577838920 TSecr=874321945 [TCP PDU reassembled in 367]"
"357","1.576442","151.101.65.140","100.86.243.187","TCP","1510","443  >  56492 [ACK] Seq=173340 Ack=3017 Win=370 Len=1444 TSval=1577838920 TSecr=874321945 [TCP PDU reassembled in 367]"
"358","1.576443","151.101.65.140","100.86.243.187","TCP","1510","443  >  56492 [ACK] Seq=174784 Ack=3017 Win=370 Len=1444 TSval=1577838920 TSecr=874321945 [TCP PDU reassembled in 367]"
"359","1.576584","100.86.243.187","151.101.65.140","TCP","66","56492  >  443 [ACK] Seq=3017 Ack=176228 Win=5215 Len=0 TSval=874321957 TSecr=1577838920"
"360","1.577072","151.101.65.140","100.86.243.187","TCP","1510","443  >  56492 [ACK] Seq=176228 Ack=3017 Win=370 Len=1444 TSval=1577838920 TSecr=874321945 [TCP PDU reassembled in 367]"
"361","1.577073","151.101.65.140","100.86.243.187","TCP","1510","443  >  56492 [ACK] Seq=177672 Ack=3017 Win=370 Len=1444 TSval=1577838920 TSecr=874321945 [TCP PDU reassembled in 367]"
"362","1.578584","151.101.65.140","100.86.243.187","TCP","1510","443  >  56492 [ACK] Seq=179116 Ack=3017 Win=370 Len=1444 TSval=1577838920 TSecr=874321945 [TCP PDU reassembled in 367]"
"363","1.578585","151.101.65.140","100.86.243.187","TCP","1510","443  >  56492 [ACK] Seq=180560 Ack=3017 Win=370 Len=1444 TSval=1577838920 TSecr=874321945 [TCP PDU reassembled in 367]"
"364","1.578586","151.101.65.140","100.86.243.187","TCP","1510","443  >  56492 [ACK] Seq=182004 Ack=3017 Win=370 Len=1444 TSval=1577838920 TSecr=874321945 [TCP PDU reassembled in 367]"
"365","1.578587","151.101.65.140","100.86.243.187","TCP","1510","443  >  56492 [ACK] Seq=183448 Ack=3017 Win=370 Len=1444 TSval=1577838920 TSecr=874321945 [TCP PDU reassembled in 367]"
"366","1.578588","151.101.65.140","100.86.243.187","TCP","1510","443  >  56492 [ACK] Seq=184892 Ack=3017 Win=370 Len=1444 TSval=1577838920 TSecr=874321945 [TCP PDU reassembled in 367]"
"367","1.578589","151.101.65.140","100.86.243.187","TLSv1.2","1510","Application Data"
"368","1.578590","151.101.65.140","100.86.243.187","TCP","1510","443  >  56492 [PSH, ACK] Seq=187780 Ack=3017 Win=370 Len=1444 TSval=1577838920 TSecr=874321945 [TCP PDU reassembled in 381]"
"369","1.578959","100.86.243.187","151.101.65.140","TCP","66","56492  >  443 [ACK] Seq=3017 Ack=189224 Win=5215 Len=0 TSval=874321959 TSecr=1577838920"
"370","1.579023","151.101.65.140","100.86.243.187","TCP","1510","443  >  56492 [ACK] Seq=189224 Ack=3017 Win=370 Len=1444 TSval=1577838924 TSecr=874321948 [TCP PDU reassembled in 381]"
"371","1.579024","151.101.65.140","100.86.243.187","TCP","1510","443  >  56492 [ACK] Seq=190668 Ack=3017 Win=370 Len=1444 TSval=1577838924 TSecr=874321948 [TCP PDU reassembled in 381]"
"372","1.579025","151.101.65.140","100.86.243.187","TCP","1510","443  >  56492 [ACK] Seq=192112 Ack=3017 Win=370 Len=1444 TSval=1577838924 TSecr=874321948 [TCP PDU reassembled in 381]"
"373","1.579109","100.86.243.187","151.101.65.140","TCP","66","56492  >  443 [ACK] Seq=3017 Ack=193556 Win=5215 Len=0 TSval=874321959 TSecr=1577838924"
"374","1.581180","151.101.65.140","100.86.243.187","TCP","1510","443  >  56492 [ACK] Seq=193556 Ack=3017 Win=370 Len=1444 TSval=1577838924 TSecr=874321948 [TCP PDU reassembled in 381]"
"375","1.581182","151.101.65.140","100.86.243.187","TCP","1510","443  >  56492 [ACK] Seq=195000 Ack=3017 Win=370 Len=1444 TSval=1577838924 TSecr=874321948 [TCP PDU reassembled in 381]"
"376","1.581182","151.101.65.140","100.86.243.187","TCP","1510","443  >  56492 [ACK] Seq=196444 Ack=3017 Win=370 Len=1444 TSval=1577838924 TSecr=874321948 [TCP PDU reassembled in 381]"
"377","1.581183","151.101.65.140","100.86.243.187","TCP","1510","443  >  56492 [ACK] Seq=197888 Ack=3017 Win=370 Len=1444 TSval=1577838924 TSecr=874321948 [TCP PDU reassembled in 381]"
"378","1.581184","151.101.65.140","100.86.243.187","TCP","1510","443  >  56492 [PSH, ACK] Seq=199332 Ack=3017 Win=370 Len=1444 TSval=1577838924 TSecr=874321948 [TCP PDU reassembled in 381]"
"379","1.581306","100.86.243.187","151.101.65.140","TCP","66","56492  >  443 [ACK] Seq=3017 Ack=200776 Win=5215 Len=0 TSval=874321962 TSecr=1577838924"
"380","1.581678","151.101.65.140","100.86.243.187","TCP","1510","443  >  56492 [ACK] Seq=200776 Ack=3017 Win=370 Len=1444 TSval=1577838926 TSecr=874321952 [TCP PDU reassembled in 381]"
"381","1.581679","151.101.65.140","100.86.243.187","TLSv1.2","1510","Application Data"
"382","1.581680","151.101.65.140","100.86.243.187","TCP","1510","443  >  56492 [ACK] Seq=203664 Ack=3017 Win=370 Len=1444 TSval=1577838926 TSecr=874321952 [TCP PDU reassembled in 395]"
"383","1.581852","100.86.243.187","151.101.65.140","TCP","66","56492  >  443 [ACK] Seq=3017 Ack=205108 Win=5215 Len=0 TSval=874321962 TSecr=1577838926"
"384","1.582292","151.101.65.140","100.86.243.187","TCP","1510","443  >  56492 [ACK] Seq=205108 Ack=3017 Win=370 Len=1444 TSval=1577838926 TSecr=874321952 [TCP PDU reassembled in 395]"
"385","1.582293","151.101.65.140","100.86.243.187","TCP","1510","443  >  56492 [ACK] Seq=206552 Ack=3017 Win=370 Len=1444 TSval=1577838926 TSecr=874321952 [TCP PDU reassembled in 395]"
"386","1.582294","151.101.65.140","100.86.243.187","TCP","1510","443  >  56492 [ACK] Seq=207996 Ack=3017 Win=370 Len=1444 TSval=1577838926 TSecr=874321952 [TCP PDU reassembled in 395]"
"387","1.582295","151.101.65.140","100.86.243.187","TCP","1510","443  >  56492 [ACK] Seq=209440 Ack=3017 Win=370 Len=1444 TSval=1577838926 TSecr=874321952 [TCP PDU reassembled in 395]"
"388","1.582296","151.101.65.140","100.86.243.187","TCP","1510","443  >  56492 [ACK] Seq=210884 Ack=3017 Win=370 Len=1444 TSval=1577838926 TSecr=874321952 [TCP PDU reassembled in 395]"
"389","1.582297","151.101.65.140","100.86.243.187","TCP","1510","443  >  56492 [ACK] Seq=212328 Ack=3017 Win=370 Len=1444 TSval=1577838926 TSecr=874321952 [TCP PDU reassembled in 395]"
"390","1.582388","100.86.243.187","151.101.65.140","TCP","66","56492  >  443 [ACK] Seq=3017 Ack=213772 Win=5215 Len=0 TSval=874321963 TSecr=1577838926"
"391","1.584030","151.101.65.140","100.86.243.187","TCP","1510","443  >  56492 [ACK] Seq=213772 Ack=3017 Win=370 Len=1444 TSval=1577838926 TSecr=874321952 [TCP PDU reassembled in 395]"
"392","1.584031","151.101.65.140","100.86.243.187","TCP","1510","443  >  56492 [ACK] Seq=215216 Ack=3017 Win=370 Len=1444 TSval=1577838926 TSecr=874321952 [TCP PDU reassembled in 395]"
"393","1.584032","151.101.65.140","100.86.243.187","TCP","1510","443  >  56492 [ACK] Seq=216660 Ack=3017 Win=370 Len=1444 TSval=1577838926 TSecr=874321952 [TCP PDU reassembled in 395]"
"394","1.584033","151.101.65.140","100.86.243.187","TCP","1510","443  >  56492 [ACK] Seq=218104 Ack=3017 Win=370 Len=1444 TSval=1577838926 TSecr=874321952 [TCP PDU reassembled in 395]"
"395","1.584033","151.101.65.140","100.86.243.187","TLSv1.2","1510","Application Data"
"396","1.584034","151.101.65.140","100.86.243.187","TCP","1510","443  >  56492 [ACK] Seq=220992 Ack=3017 Win=370 Len=1444 TSval=1577838927 TSecr=874321952 [TCP PDU reassembled in 407]"
"397","1.584035","151.101.65.140","100.86.243.187","TCP","1510","443  >  56492 [ACK] Seq=222436 Ack=3017 Win=370 Len=1444 TSval=1577838927 TSecr=874321952 [TCP PDU reassembled in 407]"
"398","1.584036","151.101.65.140","100.86.243.187","TCP","1510","443  >  56492 [ACK] Seq=223880 Ack=3017 Win=370 Len=1444 TSval=1577838927 TSecr=874321952 [TCP PDU reassembled in 407]"
"399","1.584037","151.101.65.140","100.86.243.187","TCP","1510","443  >  56492 [ACK] Seq=225324 Ack=3017 Win=370 Len=1444 TSval=1577838927 TSecr=874321952 [TCP PDU reassembled in 407]"
"400","1.584037","151.101.65.140","100.86.243.187","TCP","1510","443  >  56492 [ACK] Seq=226768 Ack=3017 Win=370 Len=1444 TSval=1577838927 TSecr=874321952 [TCP PDU reassembled in 407]"
"401","1.584038","151.101.65.140","100.86.243.187","TCP","1510","443  >  56492 [ACK] Seq=228212 Ack=3017 Win=370 Len=1444 TSval=1577838927 TSecr=874321952 [TCP PDU reassembled in 407]"
"402","1.584039","151.101.65.140","100.86.243.187","TCP","1510","443  >  56492 [ACK] Seq=229656 Ack=3017 Win=370 Len=1444 TSval=1577838927 TSecr=874321952 [TCP PDU reassembled in 407]"
"403","1.584171","151.101.65.140","100.86.243.187","TCP","1510","443  >  56492 [ACK] Seq=231100 Ack=3017 Win=370 Len=1444 TSval=1577838927 TSecr=874321952 [TCP PDU reassembled in 407]"
"404","1.584172","151.101.65.140","100.86.243.187","TCP","1510","443  >  56492 [ACK] Seq=232544 Ack=3017 Win=370 Len=1444 TSval=1577838927 TSecr=874321952 [TCP PDU reassembled in 407]"
"405","1.584239","100.86.243.187","151.101.65.140","TCP","66","56492  >  443 [ACK] Seq=3017 Ack=233988 Win=5215 Len=0 TSval=874321965 TSecr=1577838927"
"406","1.584392","151.101.65.140","100.86.243.187","TCP","1510","443  >  56492 [ACK] Seq=233988 Ack=3017 Win=370 Len=1444 TSval=1577838927 TSecr=874321952 [TCP PDU reassembled in 407]"
"407","1.584393","151.101.65.140","100.86.243.187","TLSv1.2","1510","Application Data, Application Data"
"408","1.584582","151.101.65.140","100.86.243.187","TCP","1510","443  >  56492 [ACK] Seq=236876 Ack=3017 Win=370 Len=1444 TSval=1577838927 TSecr=874321952 [TCP PDU reassembled in 421]"
"409","1.584583","151.101.65.140","100.86.243.187","TCP","1510","443  >  56492 [ACK] Seq=238320 Ack=3017 Win=370 Len=1444 TSval=1577838927 TSecr=874321952 [TCP PDU reassembled in 421]"
"410","1.584583","151.101.65.140","100.86.243.187","TCP","1510","443  >  56492 [ACK] Seq=239764 Ack=3017 Win=370 Len=1444 TSval=1577838927 TSecr=874321952 [TCP PDU reassembled in 421]"
"411","1.584584","151.101.65.140","100.86.243.187","TCP","1510","443  >  56492 [ACK] Seq=241208 Ack=3017 Win=370 Len=1444 TSval=1577838927 TSecr=874321952 [TCP PDU reassembled in 421]"
"412","1.584678","100.86.243.187","151.101.65.140","TCP","66","56492  >  443 [ACK] Seq=3017 Ack=242652 Win=5215 Len=0 TSval=874321965 TSecr=1577838927"
"413","1.584876","151.101.65.140","100.86.243.187","TCP","1510","443  >  56492 [PSH, ACK] Seq=242652 Ack=3017 Win=370 Len=1444 TSval=1577838927 TSecr=874321952 [TCP PDU reassembled in 421]"
"414","1.584878","151.101.65.140","100.86.243.187","TCP","1510","443  >  56492 [ACK] Seq=244096 Ack=3017 Win=370 Len=1444 TSval=1577838928 TSecr=874321953 [TCP PDU reassembled in 421]"
"415","1.584879","151.101.65.140","100.86.243.187","TCP","1510","443  >  56492 [ACK] Seq=245540 Ack=3017 Win=370 Len=1444 TSval=1577838928 TSecr=874321953 [TCP PDU reassembled in 421]"
"416","1.584880","151.101.65.140","100.86.243.187","TCP","1510","443  >  56492 [ACK] Seq=246984 Ack=3017 Win=370 Len=1444 TSval=1577838928 TSecr=874321953 [TCP PDU reassembled in 421]"
"417","1.584955","100.86.243.187","151.101.65.140","TCP","66","56492  >  443 [ACK] Seq=3017 Ack=248428 Win=5215 Len=0 TSval=874321965 TSecr=1577838928"
"418","1.586211","151.101.65.140","100.86.243.187","TCP","1510","443  >  56492 [ACK] Seq=248428 Ack=3017 Win=370 Len=1444 TSval=1577838928 TSecr=874321953 [TCP PDU reassembled in 421]"
"419","1.586212","151.101.65.140","100.86.243.187","TCP","1510","443  >  56492 [ACK] Seq=249872 Ack=3017 Win=370 Len=1444 TSval=1577838928 TSecr=874321953 [TCP PDU reassembled in 421]"
"420","1.586213","151.101.65.140","100.86.243.187","TCP","1510","443  >  56492 [ACK] Seq=251316 Ack=3017 Win=370 Len=1444 TSval=1577838928 TSecr=874321953 [TCP PDU reassembled in 421]"
"421","1.586214","151.101.65.140","100.86.243.187","TLSv1.2","1510","Application Data"
"422","1.586215","151.101.65.140","100.86.243.187","TCP","1510","443  >  56492 [ACK] Seq=254204 Ack=3017 Win=370 Len=1444 TSval=1577838928 TSecr=874321953 [TCP PDU reassembled in 426]"
"423","1.586216","151.101.65.140","100.86.243.187","TCP","1510","443  >  56492 [ACK] Seq=255648 Ack=3017 Win=370 Len=1444 TSval=1577838928 TSecr=874321953 [TCP PDU reassembled in 426]"
"424","1.586398","100.86.243.187","151.101.65.140","TCP","66","56492  >  443 [ACK] Seq=3017 Ack=257092 Win=5215 Len=0 TSval=874321967 TSecr=1577838928"
"425","1.586846","151.101.65.140","100.86.243.187","TCP","1510","443  >  56492 [ACK] Seq=257092 Ack=3017 Win=370 Len=1444 TSval=1577838928 TSecr=874321953 [TCP PDU reassembled in 426]"
"426","1.586847","151.101.65.140","100.86.243.187","TLSv1.2","171","Application Data"
"427","1.586968","100.86.243.187","151.101.65.140","TCP","66","56492  >  443 [ACK] Seq=3017 Ack=258641 Win=5215 Len=0 TSval=874321967 TSecr=1577838928"
"454","2.209528","100.86.243.187","151.101.65.140","TLSv1.2","204","Application Data"
"455","2.210509","100.86.243.187","151.101.65.140","TLSv1.2","101","Application Data"
"456","2.219732","151.101.65.140","100.86.243.187","TCP","66","443  >  56492 [ACK] Seq=258641 Ack=3155 Win=376 Len=0 TSval=1577839565 TSecr=874322590"
"457","2.220426","151.101.65.140","100.86.243.187","TCP","66","443  >  56492 [ACK] Seq=258641 Ack=3190 Win=376 Len=0 TSval=1577839565 TSecr=874322590"
"619","3.491517","100.86.243.187","151.101.65.140","TLSv1.2","215","Application Data"
"622","3.493274","100.86.243.187","151.101.65.140","TLSv1.2","171","Application Data"
"631","3.501004","151.101.65.140","100.86.243.187","TCP","66","443  >  56492 [ACK] Seq=258641 Ack=3339 Win=381 Len=0 TSval=1577840846 TSecr=874323872"
"635","3.502087","151.101.65.140","100.86.243.187","TLSv1.2","1330","Application Data"
"637","3.502179","100.86.243.187","151.101.65.140","TCP","66","56492  >  443 [ACK] Seq=3444 Ack=259905 Win=5195 Len=0 TSval=874323883 TSecr=1577840847"
"638","3.503058","151.101.65.140","100.86.243.187","TCP","66","443  >  56492 [ACK] Seq=259905 Ack=3444 Win=381 Len=0 TSval=1577840848 TSecr=874323874"
"639","3.504408","151.101.65.140","100.86.243.187","TLSv1.2","167","Application Data"
"640","3.504409","151.101.65.140","100.86.243.187","TCP","1510","443  >  56492 [ACK] Seq=260006 Ack=3444 Win=381 Len=1444 TSval=1577840849 TSecr=874323874 [TCP PDU reassembled in 648]"
"641","3.504410","151.101.65.140","100.86.243.187","TCP","1510","443  >  56492 [ACK] Seq=261450 Ack=3444 Win=381 Len=1444 TSval=1577840849 TSecr=874323874 [TCP PDU reassembled in 648]"
"642","3.504490","100.86.243.187","151.101.65.140","TCP","66","56492  >  443 [ACK] Seq=3444 Ack=262894 Win=5168 Len=0 TSval=874323885 TSecr=1577840849"
"643","3.504757","100.86.243.187","151.101.65.140","TCP","66","[TCP Window Update] 56492  >  443 [ACK] Seq=3444 Ack=262894 Win=5215 Len=0 TSval=874323885 TSecr=1577840849"
"644","3.506362","151.101.65.140","100.86.243.187","TCP","1510","443  >  56492 [ACK] Seq=262894 Ack=3444 Win=381 Len=1444 TSval=1577840849 TSecr=874323874 [TCP PDU reassembled in 648]"
"645","3.506363","151.101.65.140","100.86.243.187","TCP","1510","443  >  56492 [ACK] Seq=264338 Ack=3444 Win=381 Len=1444 TSval=1577840849 TSecr=874323874 [TCP PDU reassembled in 648]"
"646","3.506364","151.101.65.140","100.86.243.187","TCP","1510","443  >  56492 [ACK] Seq=265782 Ack=3444 Win=381 Len=1444 TSval=1577840849 TSecr=874323874 [TCP PDU reassembled in 648]"
"647","3.506365","151.101.65.140","100.86.243.187","TCP","1510","443  >  56492 [ACK] Seq=267226 Ack=3444 Win=381 Len=1444 TSval=1577840849 TSecr=874323874 [TCP PDU reassembled in 648]"
"648","3.506365","151.101.65.140","100.86.243.187","TLSv1.2","452","Application Data"
"653","3.506473","100.86.243.187","151.101.65.140","TCP","66","56492  >  443 [ACK] Seq=3444 Ack=269056 Win=5119 Len=0 TSval=874323887 TSecr=1577840849"
"656","3.506572","100.86.243.187","151.101.65.140","TCP","66","[TCP Window Update] 56492  >  443 [ACK] Seq=3444 Ack=269056 Win=5215 Len=0 TSval=874323887 TSecr=1577840849"
