"No.","Time","Source","Destination","Protocol","Length","Info"
"1","0.000000","151.101.65.140","100.86.235.39","SSLv2","1510",""
"2","0.000390","151.101.65.140","100.86.235.39","SSLv2","1510",""
"3","0.000479","100.86.235.39","151.101.65.140","TCP","66","56473  >  443 [ACK] Seq=1 Ack=2889 Win=4672 Len=0 TSval=1656578051 TSecr=2958645735"
"4","0.002072","151.101.65.140","100.86.235.39","SSLv2","1510",""
"5","0.002802","151.101.65.140","100.86.235.39","SSLv2","1510","Encrypted Data"
"6","0.002924","100.86.235.39","151.101.65.140","TCP","66","56473  >  443 [ACK] Seq=1 Ack=5777 Win=4672 Len=0 TSval=1656578052 TSecr=2958645737"
"7","0.007178","151.101.65.140","100.86.235.39","SSLv2","1510",""
"8","0.007554","151.101.65.140","100.86.235.39","SSLv2","1510",""
"9","0.007653","100.86.235.39","151.101.65.140","TCP","66","56473  >  443 [ACK] Seq=1 Ack=8665 Win=4672 Len=0 TSval=1656578057 TSecr=2958645742"
"10","0.007825","151.101.65.140","100.86.235.39","SSLv2","1510",""
"11","0.007825","151.101.65.140","100.86.235.39","SSLv2","1510",""
"12","0.008012","100.86.235.39","151.101.65.140","TCP","66","56473  >  443 [ACK] Seq=1 Ack=11553 Win=4672 Len=0 TSval=1656578057 TSecr=2958645743"
"13","0.009080","151.101.65.140","100.86.235.39","SSLv2","1510",""
"14","0.010190","151.101.65.140","100.86.235.39","SSLv2","1510",""
"15","0.010335","100.86.235.39","151.101.65.140","TCP","66","56473  >  443 [ACK] Seq=1 Ack=14441 Win=4672 Len=0 TSval=1656578060 TSecr=2958645745"
"16","0.011064","151.101.65.140","100.86.235.39","SSLv2","1510",""
"17","0.011301","151.101.65.140","100.86.235.39","SSLv2","1510",""
"18","0.011388","100.86.235.39","151.101.65.140","TCP","66","56473  >  443 [ACK] Seq=1 Ack=17329 Win=4672 Len=0 TSval=1656578062 TSecr=2958645746"
"19","0.012569","151.101.65.140","100.86.235.39","SSLv2","1510",""
"20","0.013680","151.101.65.140","100.86.235.39","SSLv2","1510",""
"21","0.013802","100.86.235.39","151.101.65.140","TCP","66","56473  >  443 [ACK] Seq=1 Ack=20217 Win=4672 Len=0 TSval=1656578064 TSecr=2958645748"
"22","0.017117","151.101.65.140","100.86.235.39","SSLv2","1510",""
"23","0.017149","151.101.65.140","100.86.235.39","SSLv2","1510",""
"24","0.017257","100.86.235.39","151.101.65.140","TCP","66","56473  >  443 [ACK] Seq=1 Ack=23105 Win=4672 Len=0 TSval=1656578067 TSecr=2958645752"
"25","0.017958","151.101.65.140","100.86.235.39","SSLv2","1510",""
"26","0.018272","151.101.65.140","100.86.235.39","SSLv2","1510",""
"27","0.018360","100.86.235.39","151.101.65.140","TCP","66","56473  >  443 [ACK] Seq=1 Ack=25993 Win=4672 Len=0 TSval=1656578069 TSecr=2958645753"
"28","0.020716","151.101.65.140","100.86.235.39","SSLv2","1510",""
"29","0.020753","151.101.65.140","100.86.235.39","SSLv2","1510",""
"30","0.020948","100.86.235.39","151.101.65.140","TCP","66","56473  >  443 [ACK] Seq=1 Ack=28881 Win=4672 Len=0 TSval=1656578071 TSecr=2958645756"
"31","0.022094","151.101.65.140","100.86.235.39","SSLv2","1510",""
"32","0.022534","151.101.65.140","100.86.235.39","SSLv2","1510",""
"33","0.022629","100.86.235.39","151.101.65.140","TCP","66","56473  >  443 [ACK] Seq=1 Ack=31769 Win=4672 Len=0 TSval=1656578072 TSecr=2958645757"
"34","0.023380","151.101.65.140","100.86.235.39","SSLv2","1510",""
"35","0.024406","151.101.65.140","100.86.235.39","SSLv2","1510",""
"36","0.024527","100.86.235.39","151.101.65.140","TCP","66","56473  >  443 [ACK] Seq=1 Ack=34657 Win=4672 Len=0 TSval=1656578075 TSecr=2958645759"
"37","0.025450","100.86.235.39","151.101.65.140","TLSv1.2","166","Application Data"
"38","0.025714","100.86.235.39","151.101.65.140","TLSv1.2","206","Application Data"
"39","0.025870","100.86.235.39","151.101.65.140","TLSv1.2","166","Application Data"
"40","0.026016","100.86.235.39","151.101.65.140","TLSv1.2","208","Application Data"
"41","0.026929","151.101.65.140","100.86.235.39","SSLv2","1510",""
"42","0.027808","151.101.65.140","100.86.235.39","SSLv2","1510",""
"43","0.027931","100.86.235.39","151.101.65.140","TCP","66","56473  >  443 [ACK] Seq=1 Ack=37545 Win=4672 Len=0 TSval=1656578077 TSecr=2958645762"
"44","0.028274","151.101.65.140","100.86.235.39","SSLv2","1510",""
"45","0.028275","151.101.65.140","100.86.235.39","SSLv2","1510",""
"46","0.028360","100.86.235.39","151.101.65.140","TCP","66","56473  >  443 [ACK] Seq=1 Ack=40433 Win=4672 Len=0 TSval=1656578079 TSecr=2958645763"
"47","0.029042","100.86.235.39","151.101.65.140","TCP","1514","56383  >  443 [ACK] Seq=1 Ack=1 Win=2048 Len=1448 TSval=1360005837 TSecr=557230700 [TCP PDU reassembled in 48]"
"48","0.029086","100.86.235.39","151.101.65.140","TLSv1.2","1482","Application Data"
"49","0.031548","100.86.235.39","151.101.65.140","TCP","1514","56383  >  443 [ACK] Seq=2865 Ack=1 Win=2048 Len=1448 TSval=1360005840 TSecr=557230700 [TCP PDU reassembled in 50]"
"50","0.031591","100.86.235.39","151.101.65.140","TLSv1.2","1497","Application Data"
"51","0.031934","151.101.65.140","100.86.235.39","SSLv2","1510",""
"52","0.032422","151.101.65.140","100.86.235.39","SSLv2","1510",""
"53","0.032512","100.86.235.39","151.101.65.140","TCP","66","56473  >  443 [ACK] Seq=1 Ack=43321 Win=4672 Len=0 TSval=1656578082 TSecr=2958645767"
"54","0.032786","151.101.65.140","100.86.235.39","SSLv2","1510",""
"55","0.032787","151.101.65.140","100.86.235.39","SSLv2","1510",""
"56","0.032978","100.86.235.39","151.101.65.140","TCP","66","56473  >  443 [ACK] Seq=1 Ack=46209 Win=4672 Len=0 TSval=1656578083 TSecr=2958645768"
"57","0.034508","151.101.65.140","100.86.235.39","SSLv2","1510",""
"58","0.034545","100.86.235.39","151.101.65.140","TCP","1514","56383  >  443 [ACK] Seq=5744 Ack=1 Win=2048 Len=1448 TSval=1360005843 TSecr=557230700 [TCP PDU reassembled in 60]"
"59","0.034547","100.86.235.39","151.101.65.140","TCP","1514","56383  >  443 [ACK] Seq=7192 Ack=1 Win=2048 Len=1448 TSval=1360005843 TSecr=557230700 [TCP PDU reassembled in 60]"
"60","0.034549","100.86.235.39","151.101.65.140","TLSv1.2","91","Application Data"
"61","0.034582","151.101.65.140","100.86.235.39","SSLv2","1510",""
"62","0.034583","151.101.65.140","100.86.235.39","TCP","66","443  >  56438 [ACK] Seq=1 Ack=101 Win=424 Len=0 TSval=3000796225 TSecr=3707631667"
"63","0.034648","100.86.235.39","151.101.65.140","TCP","66","56473  >  443 [ACK] Seq=1 Ack=49097 Win=4672 Len=0 TSval=1656578085 TSecr=2958645770"
"64","0.035295","151.101.65.140","100.86.235.39","TCP","66","443  >  56438 [ACK] Seq=1 Ack=483 Win=424 Len=0 TSval=3000796226 TSecr=3707631668"
"65","0.036771","151.101.65.140","100.86.235.39","TCP","1510","443  >  56438 [ACK] Seq=1 Ack=483 Win=424 Len=1444 TSval=3000796226 TSecr=3707631668 [TCP PDU reassembled in 71]"
"66","0.036801","151.101.65.140","100.86.235.39","TCP","1510","443  >  56438 [PSH, ACK] Seq=1445 Ack=483 Win=424 Len=1444 TSval=3000796226 TSecr=3707631668 [TCP PDU reassembled in 71]"
"67","0.036853","100.86.235.39","151.101.65.140","TCP","66","56438  >  443 [ACK] Seq=483 Ack=1445 Win=7840 Len=0 TSval=3707631679 TSecr=3000796226"
"68","0.036944","100.86.235.39","151.101.65.140","TCP","66","56438  >  443 [ACK] Seq=483 Ack=2889 Win=7817 Len=0 TSval=3707631679 TSecr=3000796226"
"69","0.037534","151.101.65.140","100.86.235.39","SSLv2","1510",""
"70","0.037535","151.101.65.140","100.86.235.39","TCP","1510","443  >  56473 [PSH, ACK] Seq=50541 Ack=1 Win=298 Len=1444 TSval=2958645773 TSecr=1656578077 [TCP PDU reassembled in 122]"
"71","0.037536","151.101.65.140","100.86.235.39","TLSv1.2","932","Application Data"
"72","0.037537","151.101.65.140","100.86.235.39","TCP","1510","443  >  56438 [ACK] Seq=3755 Ack=483 Win=424 Len=1444 TSval=3000796228 TSecr=3707631668 [TCP PDU reassembled in 128]"
"73","0.037611","100.86.235.39","151.101.65.140","TCP","66","56438  >  443 [ACK] Seq=483 Ack=5199 Win=7826 Len=0 TSval=3707631679 TSecr=3000796228"
"74","0.037644","100.86.235.39","151.101.65.140","TCP","66","56473  >  443 [ACK] Seq=1 Ack=51985 Win=4672 Len=0 TSval=1656578087 TSecr=2958645773"
"75","0.038081","151.101.65.140","100.86.235.39","TCP","1510","443  >  56438 [PSH, ACK] Seq=5199 Ack=483 Win=424 Len=1444 TSval=3000796228 TSecr=3707631668 [TCP PDU reassembled in 128]"
"76","0.038150","100.86.235.39","151.101.65.140","TCP","66","56438  >  443 [ACK] Seq=483 Ack=6643 Win=7840 Len=0 TSval=3707631680 TSecr=3000796228"
"77","0.038278","151.101.65.140","100.86.235.39","TCP","1510","443  >  56473 [ACK] Seq=51985 Ack=1 Win=298 Len=1444 TSval=2958645773 TSecr=1656578079 [TCP PDU reassembled in 122]"
"78","0.038279","151.101.65.140","100.86.235.39","TCP","1510","443  >  56473 [PSH, ACK] Seq=53429 Ack=1 Win=298 Len=1444 TSval=2958645773 TSecr=1656578079 [TCP PDU reassembled in 122]"
"79","0.038349","100.86.235.39","151.101.65.140","TCP","66","56473  >  443 [ACK] Seq=1 Ack=54873 Win=4672 Len=0 TSval=1656578088 TSecr=2958645773"
"80","0.038403","151.101.65.140","100.86.235.39","TCP","66","443  >  56383 [ACK] Seq=1 Ack=2865 Win=538 Len=0 TSval=557230827 TSecr=1360005837"
"81","0.039306","151.101.65.140","100.86.235.39","TCP","1510","443  >  56438 [ACK] Seq=6643 Ack=483 Win=424 Len=1444 TSval=3000796229 TSecr=3707631668 [TCP PDU reassembled in 128]"
"82","0.039365","100.86.235.39","151.101.65.140","TCP","66","56438  >  443 [ACK] Seq=483 Ack=8087 Win=7840 Len=0 TSval=3707631682 TSecr=3000796229"
"83","0.039785","151.101.65.140","100.86.235.39","TCP","1510","443  >  56438 [PSH, ACK] Seq=8087 Ack=483 Win=424 Len=1444 TSval=3000796229 TSecr=3707631668 [TCP PDU reassembled in 128]"
"84","0.039833","100.86.235.39","151.101.65.140","TCP","66","56438  >  443 [ACK] Seq=483 Ack=9531 Win=7840 Len=0 TSval=3707631682 TSecr=3000796229"
"85","0.040501","151.101.65.140","100.86.235.39","TCP","1510","443  >  56438 [ACK] Seq=9531 Ack=483 Win=424 Len=1444 TSval=3000796231 TSecr=3707631668 [TCP PDU reassembled in 128]"
"86","0.040558","100.86.235.39","151.101.65.140","TCP","66","56438  >  443 [ACK] Seq=483 Ack=10975 Win=7840 Len=0 TSval=3707631683 TSecr=3000796231"
"87","0.040952","151.101.65.140","100.86.235.39","TCP","1510","443  >  56438 [PSH, ACK] Seq=10975 Ack=483 Win=424 Len=1444 TSval=3000796231 TSecr=3707631668 [TCP PDU reassembled in 128]"
"88","0.041010","100.86.235.39","151.101.65.140","TCP","66","56438  >  443 [ACK] Seq=483 Ack=12419 Win=7840 Len=0 TSval=3707631683 TSecr=3000796231"
"89","0.046831","151.101.65.140","100.86.235.39","TCP","1510","443  >  56473 [ACK] Seq=54873 Ack=1 Win=298 Len=1444 TSval=2958645777 TSecr=1656578082 [TCP PDU reassembled in 122]"
"90","0.046832","151.101.65.140","100.86.235.39","TCP","66","443  >  56383 [ACK] Seq=1 Ack=5744 Win=538 Len=0 TSval=557230831 TSecr=1360005840"
"91","0.050410","151.101.65.140","100.86.235.39","TCP","1510","443  >  56473 [PSH, ACK] Seq=56317 Ack=1 Win=298 Len=1444 TSval=2958645777 TSecr=1656578082 [TCP PDU reassembled in 122]"
"92","0.050412","151.101.65.140","100.86.235.39","TCP","1510","443  >  56473 [ACK] Seq=57761 Ack=1 Win=298 Len=1444 TSval=2958645778 TSecr=1656578082 [TCP PDU reassembled in 122]"
"93","0.050412","151.101.65.140","100.86.235.39","TCP","1510","443  >  56473 [PSH, ACK] Seq=59205 Ack=1 Win=298 Len=1444 TSval=2958645778 TSecr=1656578082 [TCP PDU reassembled in 122]"
"94","0.050413","151.101.65.140","100.86.235.39","TCP","1510","443  >  56438 [ACK] Seq=12419 Ack=483 Win=424 Len=1444 TSval=3000796232 TSecr=3707631668 [TCP PDU reassembled in 128]"
"95","0.050414","151.101.65.140","100.86.235.39","TCP","1510","443  >  56438 [PSH, ACK] Seq=13863 Ack=483 Win=424 Len=1444 TSval=3000796232 TSecr=3707631668 [TCP PDU reassembled in 128]"
"96","0.050415","151.101.65.140","100.86.235.39","TCP","1510","443  >  56473 [ACK] Seq=60649 Ack=1 Win=298 Len=1444 TSval=2958645779 TSecr=1656578083 [TCP PDU reassembled in 122]"
"97","0.050416","151.101.65.140","100.86.235.39","TCP","1510","443  >  56473 [PSH, ACK] Seq=62093 Ack=1 Win=298 Len=1444 TSval=2958645779 TSecr=1656578083 [TCP PDU reassembled in 122]"
"98","0.050416","151.101.65.140","100.86.235.39","TCP","66","443  >  56383 [ACK] Seq=1 Ack=8665 Win=533 Len=0 TSval=557230833 TSecr=1360005843"
"99","0.050550","100.86.235.39","151.101.65.140","TCP","66","56438  >  443 [ACK] Seq=483 Ack=15307 Win=7817 Len=0 TSval=3707631693 TSecr=3000796232"
"100","0.050659","100.86.235.39","151.101.65.140","TCP","66","56473  >  443 [ACK] Seq=1 Ack=63537 Win=4672 Len=0 TSval=1656578101 TSecr=2958645777"
"101","0.051599","151.101.65.140","100.86.235.39","TCP","1510","443  >  56473 [ACK] Seq=63537 Ack=1 Win=298 Len=1444 TSval=2958645781 TSecr=1656578085 [TCP PDU reassembled in 122]"
"102","0.051600","151.101.65.140","100.86.235.39","TCP","1510","443  >  56473 [PSH, ACK] Seq=64981 Ack=1 Win=298 Len=1444 TSval=2958645781 TSecr=1656578085 [TCP PDU reassembled in 122]"
"103","0.051602","151.101.65.140","100.86.235.39","TCP","1510","443  >  56473 [ACK] Seq=66425 Ack=1 Win=298 Len=1444 TSval=2958645783 TSecr=1656578087 [TCP PDU reassembled in 122]"
"104","0.051603","151.101.65.140","100.86.235.39","TCP","1510","443  >  56473 [PSH, ACK] Seq=67869 Ack=1 Win=298 Len=1444 TSval=2958645783 TSecr=1656578087 [TCP PDU reassembled in 122]"
"105","0.051604","151.101.65.140","100.86.235.39","TCP","1510","[TCP Previous segment not captured] 443  >  56438 [ACK] Seq=16751 Ack=483 Win=424 Len=1444 TSval=3000796237 TSecr=3707631679 [TCP PDU reassembled in 128]"
"106","0.051605","151.101.65.140","100.86.235.39","TCP","1510","443  >  56438 [PSH, ACK] Seq=18195 Ack=483 Win=424 Len=1444 TSval=3000796237 TSecr=3707631679 [TCP PDU reassembled in 128]"
"107","0.051605","151.101.65.140","100.86.235.39","TCP","1510","443  >  56438 [ACK] Seq=19639 Ack=483 Win=424 Len=1444 TSval=3000796238 TSecr=3707631679 [TCP PDU reassembled in 128]"
"108","0.051606","151.101.65.140","100.86.235.39","TCP","1510","443  >  56438 [PSH, ACK] Seq=21083 Ack=483 Win=424 Len=1444 TSval=3000796238 TSecr=3707631679 [TCP PDU reassembled in 115]"
"109","0.051607","151.101.65.140","100.86.235.39","TCP","1510","443  >  56473 [ACK] Seq=69313 Ack=1 Win=298 Len=1444 TSval=2958645784 TSecr=1656578088 [TCP PDU reassembled in 122]"
"110","0.051608","151.101.65.140","100.86.235.39","TCP","1510","443  >  56473 [PSH, ACK] Seq=70757 Ack=1 Win=298 Len=1444 TSval=2958645784 TSecr=1656578088 [TCP PDU reassembled in 122]"
"111","0.051609","151.101.65.140","100.86.235.39","TCP","1510","443  >  56438 [ACK] Seq=22527 Ack=483 Win=424 Len=1444 TSval=3000796239 TSecr=3707631680 [TCP PDU reassembled in 115]"
"112","0.051610","151.101.65.140","100.86.235.39","TCP","1510","443  >  56438 [PSH, ACK] Seq=23971 Ack=483 Win=424 Len=1444 TSval=3000796239 TSecr=3707631680 [TCP PDU reassembled in 115]"
"113","0.051732","100.86.235.39","151.101.65.140","TCP","78","[TCP Dup ACK 99#1] 56438  >  443 [ACK] Seq=483 Ack=15307 Win=7862 Len=0 TSval=3707631694 TSecr=3000796232 SLE=16751 SRE=25415"
"114","0.051763","100.86.235.39","151.101.65.140","TCP","66","56473  >  443 [ACK] Seq=1 Ack=72201 Win=4672 Len=0 TSval=1656578102 TSecr=2958645784"
"115","0.055289","151.101.65.140","100.86.235.39","TLSv1.2","1510","Application Data"
"116","0.055340","151.101.65.140","100.86.235.39","TCP","1510","443  >  56438 [PSH, ACK] Seq=26859 Ack=483 Win=424 Len=1444 TSval=3000796245 TSecr=3707631683 [TCP PDU reassembled in 158]"
"117","0.055381","100.86.235.39","151.101.65.140","TCP","78","[TCP Dup ACK 99#2] 56438  >  443 [ACK] Seq=483 Ack=15307 Win=7862 Len=0 TSval=3707631697 TSecr=3000796232 SLE=16751 SRE=26859"
"118","0.055422","100.86.235.39","151.101.65.140","TCP","78","[TCP Dup ACK 99#3] 56438  >  443 [ACK] Seq=483 Ack=15307 Win=7862 Len=0 TSval=3707631697 TSecr=3000796232 SLE=16751 SRE=28303"
"119","0.056247","151.101.65.140","100.86.235.39","TCP","1510","443  >  56438 [ACK] Seq=28303 Ack=483 Win=424 Len=1444 TSval=3000796246 TSecr=3707631683 [TCP PDU reassembled in 158]"
"120","0.056248","151.101.65.140","100.86.235.39","TCP","1510","443  >  56438 [PSH, ACK] Seq=29747 Ack=483 Win=424 Len=1444 TSval=3000796246 TSecr=3707631683 [TCP PDU reassembled in 158]"
"121","0.056318","100.86.235.39","151.101.65.140","TCP","78","[TCP Dup ACK 99#4] 56438  >  443 [ACK] Seq=483 Ack=15307 Win=7862 Len=0 TSval=3707631699 TSecr=3000796232 SLE=16751 SRE=31191"
"122","0.060401","151.101.65.140","100.86.235.39","SSLv2","1510","Encrypted Data"
"123","0.060446","151.101.65.140","100.86.235.39","TCP","1510","443  >  56473 [PSH, ACK] Seq=73645 Ack=1 Win=298 Len=1444 TSval=2958645796 TSecr=1656578101 [TCP PDU reassembled in 175]"
"124","0.060598","100.86.235.39","151.101.65.140","TCP","66","56473  >  443 [ACK] Seq=1 Ack=75089 Win=4672 Len=0 TSval=1656578111 TSecr=2958645796"
"125","0.060897","151.101.65.140","100.86.235.39","TCP","1510","443  >  56438 [ACK] Seq=31191 Ack=483 Win=424 Len=1444 TSval=3000796250 TSecr=3707631693 [TCP PDU reassembled in 158]"
"126","0.060899","151.101.65.140","100.86.235.39","TCP","1510","443  >  56438 [PSH, ACK] Seq=32635 Ack=483 Win=424 Len=1444 TSval=3000796250 TSecr=3707631693 [TCP PDU reassembled in 158]"
"127","0.060962","100.86.235.39","151.101.65.140","TCP","78","[TCP Dup ACK 99#5] 56438  >  443 [ACK] Seq=483 Ack=15307 Win=7862 Len=0 TSval=3707631703 TSecr=3000796232 SLE=16751 SRE=34079"
"128","0.061215","151.101.65.140","100.86.235.39","TLSv1.2","1510","[TCP Fast Retransmission] , Application Data"
"129","0.061216","151.101.65.140","100.86.235.39","TCP","1510","443  >  56473 [ACK] Seq=75089 Ack=1 Win=298 Len=1444 TSval=2958645796 TSecr=1656578101 [TCP PDU reassembled in 175]"
"130","0.061217","151.101.65.140","100.86.235.39","TCP","1510","443  >  56473 [PSH, ACK] Seq=76533 Ack=1 Win=298 Len=1444 TSval=2958645796 TSecr=1656578101 [TCP PDU reassembled in 175]"
"131","0.061218","151.101.65.140","100.86.235.39","TCP","1510","443  >  56383 [ACK] Seq=1 Ack=8665 Win=538 Len=1444 TSval=557230850 TSecr=1360005843 [TCP PDU reassembled in 135]"
"132","0.061269","100.86.235.39","151.101.65.140","TCP","66","56438  >  443 [ACK] Seq=483 Ack=34079 Win=7569 Len=0 TSval=3707631703 TSecr=3000796251"
"133","0.061311","100.86.235.39","151.101.65.140","TCP","66","56383  >  443 [ACK] Seq=8665 Ack=1445 Win=2025 Len=0 TSval=1360005869 TSecr=557230850"
"134","0.061487","100.86.235.39","151.101.65.140","TCP","66","56473  >  443 [ACK] Seq=1 Ack=77977 Win=4672 Len=0 TSval=1656578112 TSecr=2958645796"
"135","0.061732","151.101.65.140","100.86.235.39","TLSv1.2","252","Application Data"
"136","0.061781","100.86.235.39","151.101.65.140","TCP","66","56383  >  443 [ACK] Seq=8665 Ack=1631 Win=2045 Len=0 TSval=1360005870 TSecr=557230850"
"137","0.061876","151.101.65.140","100.86.235.39","TCP","1510","443  >  56438 [ACK] Seq=34079 Ack=483 Win=424 Len=1444 TSval=3000796252 TSecr=3707631694 [TCP PDU reassembled in 158]"
"138","0.061877","151.101.65.140","100.86.235.39","TCP","1510","443  >  56438 [PSH, ACK] Seq=35523 Ack=483 Win=424 Len=1444 TSval=3000796252 TSecr=3707631694 [TCP PDU reassembled in 158]"
"139","0.061924","100.86.235.39","151.101.65.140","TCP","66","56438  >  443 [ACK] Seq=483 Ack=36967 Win=7682 Len=0 TSval=3707631704 TSecr=3000796252"
"140","0.061944","100.86.235.39","151.101.65.140","TCP","66","[TCP Window Update] 56438  >  443 [ACK] Seq=483 Ack=36967 Win=7862 Len=0 TSval=3707631704 TSecr=3000796252"
"141","0.062363","151.101.65.140","100.86.235.39","TLSv1.2","112","Application Data"
"142","0.062429","100.86.235.39","151.101.65.140","TCP","66","56383  >  443 [ACK] Seq=8665 Ack=1677 Win=2047 Len=0 TSval=1360005870 TSecr=557230851"
"143","0.062722","151.101.65.140","100.86.235.39","TCP","1510","443  >  56473 [ACK] Seq=77977 Ack=1 Win=298 Len=1444 TSval=2958645798 TSecr=1656578101 [TCP PDU reassembled in 175]"
"144","0.063756","151.101.65.140","100.86.235.39","TCP","1510","443  >  56473 [ACK] Seq=79421 Ack=1 Win=298 Len=1444 TSval=2958645798 TSecr=1656578101 [TCP PDU reassembled in 175]"
"145","0.063758","151.101.65.140","100.86.235.39","TCP","1510","443  >  56473 [PSH, ACK] Seq=80865 Ack=1 Win=298 Len=1444 TSval=2958645798 TSecr=1656578101 [TCP PDU reassembled in 175]"
"146","0.063891","100.86.235.39","151.101.65.140","TCP","66","56473  >  443 [ACK] Seq=1 Ack=82309 Win=4672 Len=0 TSval=1656578114 TSecr=2958645798"
"147","0.064613","151.101.65.140","100.86.235.39","TCP","1510","443  >  56473 [ACK] Seq=82309 Ack=1 Win=298 Len=1444 TSval=2958645800 TSecr=1656578102 [TCP PDU reassembled in 175]"
"148","0.064962","151.101.65.140","100.86.235.39","TCP","1510","443  >  56473 [PSH, ACK] Seq=83753 Ack=1 Win=298 Len=1444 TSval=2958645800 TSecr=1656578102 [TCP PDU reassembled in 175]"
"149","0.065056","100.86.235.39","151.101.65.140","TCP","66","56473  >  443 [ACK] Seq=1 Ack=85197 Win=4672 Len=0 TSval=1656578115 TSecr=2958645800"
"150","0.065926","151.101.65.140","100.86.235.39","TCP","1510","443  >  56438 [ACK] Seq=36967 Ack=483 Win=424 Len=1444 TSval=3000796255 TSecr=3707631697 [TCP PDU reassembled in 158]"
"151","0.065928","151.101.65.140","100.86.235.39","TCP","1510","443  >  56438 [ACK] Seq=38411 Ack=483 Win=424 Len=1444 TSval=3000796255 TSecr=3707631697 [TCP PDU reassembled in 158]"
"152","0.065929","151.101.65.140","100.86.235.39","TCP","1510","443  >  56473 [ACK] Seq=85197 Ack=1 Win=298 Len=1444 TSval=2958645801 TSecr=1656578102 [TCP PDU reassembled in 175]"
"153","0.066014","100.86.235.39","151.101.65.140","TCP","66","56438  >  443 [ACK] Seq=483 Ack=39855 Win=7817 Len=0 TSval=3707631707 TSecr=3000796255"
"154","0.066281","151.101.65.140","100.86.235.39","TCP","1510","443  >  56473 [PSH, ACK] Seq=86641 Ack=1 Win=298 Len=1444 TSval=2958645801 TSecr=1656578102 [TCP PDU reassembled in 175]"
"155","0.066283","151.101.65.140","100.86.235.39","TCP","1510","443  >  56438 [ACK] Seq=39855 Ack=483 Win=424 Len=1444 TSval=3000796256 TSecr=3707631699 [TCP PDU reassembled in 158]"
"156","0.066340","100.86.235.39","151.101.65.140","TCP","66","56438  >  443 [ACK] Seq=483 Ack=41299 Win=7840 Len=0 TSval=3707631708 TSecr=3000796256"
"157","0.066364","100.86.235.39","151.101.65.140","TCP","66","56473  >  443 [ACK] Seq=1 Ack=88085 Win=4672 Len=0 TSval=1656578116 TSecr=2958645801"
"158","0.066658","151.101.65.140","100.86.235.39","TLSv1.2","1510","Application Data"
"159","0.066723","100.86.235.39","151.101.65.140","TCP","66","56438  >  443 [ACK] Seq=483 Ack=42743 Win=7840 Len=0 TSval=3707631708 TSecr=3000796256"
"160","0.067630","151.101.65.140","100.86.235.39","TCP","1510","443  >  56473 [ACK] Seq=88085 Ack=1 Win=298 Len=1444 TSval=2958645803 TSecr=1656578102 [TCP PDU reassembled in 175]"
"161","0.068752","151.101.65.140","100.86.235.39","TCP","1510","443  >  56473 [PSH, ACK] Seq=89529 Ack=1 Win=298 Len=1444 TSval=2958645803 TSecr=1656578102 [TCP PDU reassembled in 175]"
"162","0.068878","100.86.235.39","151.101.65.140","TCP","66","56473  >  443 [ACK] Seq=1 Ack=90973 Win=4672 Len=0 TSval=1656578119 TSecr=2958645803"
"163","0.070970","151.101.65.140","100.86.235.39","TCP","1510","443  >  56383 [ACK] Seq=1677 Ack=8665 Win=538 Len=1444 TSval=557230860 TSecr=1360005843 [TCP PDU reassembled in 164]"
"164","0.071000","151.101.65.140","100.86.235.39","TLSv1.2","964","Application Data"
"165","0.071060","100.86.235.39","151.101.65.140","TCP","66","56383  >  443 [ACK] Seq=8665 Ack=4019 Win=2011 Len=0 TSval=1360005879 TSecr=557230860"
"166","0.071576","151.101.65.140","100.86.235.39","TCP","1510","443  >  56438 [ACK] Seq=42743 Ack=483 Win=424 Len=1444 TSval=3000796261 TSecr=3707631703 [TCP PDU reassembled in 212]"
"167","0.071577","151.101.65.140","100.86.235.39","TCP","1510","443  >  56438 [PSH, ACK] Seq=44187 Ack=483 Win=424 Len=1444 TSval=3000796261 TSecr=3707631703 [TCP PDU reassembled in 212]"
"168","0.071637","100.86.235.39","151.101.65.140","TCP","66","56438  >  443 [ACK] Seq=483 Ack=45631 Win=7817 Len=0 TSval=3707631713 TSecr=3000796261"
"169","0.071858","151.101.65.140","100.86.235.39","TCP","1510","443  >  56473 [ACK] Seq=90973 Ack=1 Win=298 Len=1444 TSval=2958645807 TSecr=1656578112 [TCP PDU reassembled in 175]"
"170","0.071859","151.101.65.140","100.86.235.39","TCP","1510","443  >  56473 [PSH, ACK] Seq=92417 Ack=1 Win=298 Len=1444 TSval=2958645807 TSecr=1656578112 [TCP PDU reassembled in 175]"
"171","0.072023","100.86.235.39","151.101.65.140","TCP","66","56473  >  443 [ACK] Seq=1 Ack=93861 Win=4672 Len=0 TSval=1656578121 TSecr=2958645807"
"172","0.072104","151.101.65.140","100.86.235.39","TCP","1510","443  >  56438 [ACK] Seq=45631 Ack=483 Win=424 Len=1444 TSval=3000796262 TSecr=3707631704 [TCP PDU reassembled in 212]"
"173","0.072106","151.101.65.140","100.86.235.39","TCP","1510","443  >  56438 [PSH, ACK] Seq=47075 Ack=483 Win=424 Len=1444 TSval=3000796262 TSecr=3707631704 [TCP PDU reassembled in 212]"
"174","0.072146","100.86.235.39","151.101.65.140","TCP","66","56438  >  443 [ACK] Seq=483 Ack=48519 Win=7817 Len=0 TSval=3707631714 TSecr=3000796262"
"175","0.072978","151.101.65.140","100.86.235.39","SSLv2","1510","Encrypted Data, Encrypted Data"
"176","0.072979","151.101.65.140","100.86.235.39","TCP","1510","443  >  56473 [PSH, ACK] Seq=95305 Ack=1 Win=298 Len=1444 TSval=2958645808 TSecr=1656578112 [TCP PDU reassembled in 215]"
"177","0.073101","100.86.235.39","151.101.65.140","TCP","66","56473  >  443 [ACK] Seq=1 Ack=96749 Win=4672 Len=0 TSval=1656578122 TSecr=2958645808"
"178","0.074016","151.101.65.140","100.86.235.39","TCP","1510","443  >  56473 [ACK] Seq=96749 Ack=1 Win=298 Len=1444 TSval=2958645809 TSecr=1656578114 [TCP PDU reassembled in 215]"
"179","0.074547","151.101.65.140","100.86.235.39","TCP","1510","443  >  56473 [PSH, ACK] Seq=98193 Ack=1 Win=298 Len=1444 TSval=2958645809 TSecr=1656578114 [TCP PDU reassembled in 215]"
"180","0.074653","100.86.235.39","151.101.65.140","TCP","66","56473  >  443 [ACK] Seq=1 Ack=99637 Win=4672 Len=0 TSval=1656578124 TSecr=2958645809"
"181","0.074951","151.101.65.140","100.86.235.39","TCP","1510","443  >  56383 [ACK] Seq=4019 Ack=8665 Win=538 Len=1444 TSval=557230863 TSecr=1360005870 [TCP PDU reassembled in 182]"
"182","0.074952","151.101.65.140","100.86.235.39","TLSv1.2","253","Application Data"
"183","0.075006","100.86.235.39","151.101.65.140","TCP","66","56383  >  443 [ACK] Seq=8665 Ack=5650 Win=2022 Len=0 TSval=1360005882 TSecr=557230863"
"184","0.076166","151.101.65.140","100.86.235.39","TCP","1510","443  >  56473 [ACK] Seq=99637 Ack=1 Win=298 Len=1444 TSval=2958645811 TSecr=1656578115 [TCP PDU reassembled in 215]"
"185","0.076167","151.101.65.140","100.86.235.39","TCP","1510","443  >  56473 [PSH, ACK] Seq=101081 Ack=1 Win=298 Len=1444 TSval=2958645811 TSecr=1656578115 [TCP PDU reassembled in 215]"
"186","0.076168","151.101.65.140","100.86.235.39","TLSv1.2","328","Application Data"
"187","0.076246","100.86.235.39","151.101.65.140","TCP","66","56383  >  443 [ACK] Seq=8665 Ack=5912 Win=2043 Len=0 TSval=1360005884 TSecr=557230865"
"188","0.076274","100.86.235.39","151.101.65.140","TCP","66","56473  >  443 [ACK] Seq=1 Ack=102525 Win=4672 Len=0 TSval=1656578126 TSecr=2958645811"
"189","0.078661","151.101.65.140","100.86.235.39","TLSv1.2","156","Application Data"
"190","0.078664","151.101.65.140","100.86.235.39","TLSv1.2","144","Application Data"
"191","0.078665","151.101.65.140","100.86.235.39","TCP","1510","443  >  56438 [ACK] Seq=48519 Ack=483 Win=424 Len=1444 TSval=3000796266 TSecr=3707631708 [TCP PDU reassembled in 212]"
"192","0.078666","151.101.65.140","100.86.235.39","TCP","1510","443  >  56438 [PSH, ACK] Seq=49963 Ack=483 Win=424 Len=1444 TSval=3000796266 TSecr=3707631708 [TCP PDU reassembled in 212]"
"193","0.078667","151.101.65.140","100.86.235.39","TLSv1.2","116","Application Data"
"194","0.078668","151.101.65.140","100.86.235.39","TCP","1510","443  >  56473 [ACK] Seq=102525 Ack=1 Win=298 Len=1444 TSval=2958645812 TSecr=1656578116 [TCP PDU reassembled in 215]"
"195","0.078669","151.101.65.140","100.86.235.39","TCP","1510","443  >  56473 [PSH, ACK] Seq=103969 Ack=1 Win=298 Len=1444 TSval=2958645812 TSecr=1656578116 [TCP PDU reassembled in 215]"
"196","0.078671","151.101.65.140","100.86.235.39","TLSv1.2","149","Application Data"
"197","0.078774","151.101.65.140","100.86.235.39","TCP","1510","443  >  56438 [ACK] Seq=51407 Ack=483 Win=424 Len=1444 TSval=3000796267 TSecr=3707631708 [TCP PDU reassembled in 212]"
"198","0.078775","151.101.65.140","100.86.235.39","TCP","1510","443  >  56438 [PSH, ACK] Seq=52851 Ack=483 Win=424 Len=1444 TSval=3000796267 TSecr=3707631708 [TCP PDU reassembled in 212]"
"199","0.078822","100.86.235.39","151.101.65.140","TCP","66","56438  >  443 [ACK] Seq=483 Ack=51407 Win=7817 Len=0 TSval=3707631721 TSecr=3000796266"
"200","0.078878","100.86.235.39","151.101.65.140","TCP","66","56438  >  443 [ACK] Seq=483 Ack=54295 Win=7772 Len=0 TSval=3707631721 TSecr=3000796267"
"201","0.078901","100.86.235.39","151.101.65.140","TCP","66","56383  >  443 [ACK] Seq=8665 Ack=6213 Win=2048 Len=0 TSval=1360005887 TSecr=557230866"
"202","0.078965","100.86.235.39","151.101.65.140","TCP","66","[TCP Window Update] 56438  >  443 [ACK] Seq=483 Ack=54295 Win=7862 Len=0 TSval=3707631721 TSecr=3000796267"
"203","0.079082","100.86.235.39","151.101.65.140","TCP","66","56473  >  443 [ACK] Seq=1 Ack=105413 Win=4672 Len=0 TSval=1656578129 TSecr=2958645812"
"204","0.079450","151.101.65.140","100.86.235.39","TCP","1510","443  >  56473 [ACK] Seq=105413 Ack=1 Win=298 Len=1444 TSval=2958645814 TSecr=1656578119 [TCP PDU reassembled in 215]"
"205","0.079452","151.101.65.140","100.86.235.39","TCP","1510","443  >  56473 [PSH, ACK] Seq=106857 Ack=1 Win=298 Len=1444 TSval=2958645814 TSecr=1656578119 [TCP PDU reassembled in 215]"
"206","0.079568","100.86.235.39","151.101.65.140","TCP","66","56473  >  443 [ACK] Seq=1 Ack=108301 Win=4672 Len=0 TSval=1656578129 TSecr=2958645814"
"207","0.079688","151.101.65.140","100.86.235.39","TCP","1510","443  >  56438 [ACK] Seq=54295 Ack=483 Win=424 Len=1444 TSval=3000796269 TSecr=3707631708 [TCP PDU reassembled in 212]"
"208","0.079741","100.86.235.39","151.101.65.140","TCP","66","56438  >  443 [ACK] Seq=483 Ack=55739 Win=7840 Len=0 TSval=3707631721 TSecr=3000796269"
"209","0.080655","151.101.65.140","100.86.235.39","TLSv1.2","892","Application Data, Application Data, Application Data, Application Data, Application Data"
"210","0.080976","100.86.235.39","151.101.65.140","TCP","66","56383  >  443 [ACK] Seq=8665 Ack=7039 Win=2048 Len=0 TSval=1360005889 TSecr=557230870"
"211","0.081585","151.101.65.140","100.86.235.39","TCP","1510","443  >  56438 [ACK] Seq=55739 Ack=483 Win=424 Len=1444 TSval=3000796271 TSecr=3707631713 [TCP PDU reassembled in 212]"
"212","0.081587","151.101.65.140","100.86.235.39","TLSv1.2","1510","Application Data"
"213","0.081692","100.86.235.39","151.101.65.140","TCP","66","56438  >  443 [ACK] Seq=483 Ack=58627 Win=7817 Len=0 TSval=3707631723 TSecr=3000796271"
"214","0.082372","151.101.65.140","100.86.235.39","TCP","1510","443  >  56473 [ACK] Seq=108301 Ack=1 Win=298 Len=1444 TSval=2958645817 TSecr=1656578121 [TCP PDU reassembled in 215]"
"215","0.082374","151.101.65.140","100.86.235.39","SSLv2","1510","Encrypted Data"
"216","0.082540","100.86.235.39","151.101.65.140","TCP","66","56473  >  443 [ACK] Seq=1 Ack=111189 Win=4672 Len=0 TSval=1656578132 TSecr=2958645817"
"217","0.083255","151.101.65.140","100.86.235.39","TCP","1510","443  >  56438 [ACK] Seq=58627 Ack=483 Win=424 Len=1444 TSval=3000796272 TSecr=3707631714 [TCP PDU reassembled in 259]"
"218","0.083258","151.101.65.140","100.86.235.39","TCP","1510","443  >  56438 [PSH, ACK] Seq=60071 Ack=483 Win=424 Len=1444 TSval=3000796272 TSecr=3707631714 [TCP PDU reassembled in 259]"
"219","0.083377","100.86.235.39","151.101.65.140","TCP","66","56438  >  443 [ACK] Seq=483 Ack=61515 Win=7817 Len=0 TSval=3707631726 TSecr=3000796272"
"220","0.084031","151.101.65.140","100.86.235.39","TCP","1510","443  >  56473 [ACK] Seq=111189 Ack=1 Win=298 Len=1444 TSval=2958645820 TSecr=1656578124 [TCP PDU reassembled in 226]"
"221","0.084393","151.101.65.140","100.86.235.39","TCP","1510","443  >  56473 [PSH, ACK] Seq=112633 Ack=1 Win=298 Len=1444 TSval=2958645820 TSecr=1656578124 [TCP PDU reassembled in 226]"
"222","0.084471","100.86.235.39","151.101.65.140","TCP","66","56473  >  443 [ACK] Seq=1 Ack=114077 Win=4672 Len=0 TSval=1656578135 TSecr=2958645820"
"223","0.084920","151.101.65.140","100.86.235.39","TCP","1510","443  >  56473 [ACK] Seq=114077 Ack=1 Win=298 Len=1444 TSval=2958645820 TSecr=1656578124 [TCP PDU reassembled in 226]"
"224","0.085615","151.101.65.140","100.86.235.39","TCP","1510","443  >  56473 [PSH, ACK] Seq=115521 Ack=1 Win=298 Len=1444 TSval=2958645820 TSecr=1656578124 [TCP PDU reassembled in 226]"
"225","0.085697","100.86.235.39","151.101.65.140","TCP","66","56473  >  443 [ACK] Seq=1 Ack=116965 Win=4672 Len=0 TSval=1656578136 TSecr=2958645820"
"226","0.087223","151.101.65.140","100.86.235.39","SSLv2","1510","Encrypted Data"
"227","0.087870","151.101.65.140","100.86.235.39","TCP","1510","443  >  56473 [PSH, ACK] Seq=118409 Ack=1 Win=298 Len=1444 TSval=2958645822 TSecr=1656578126 [TCP PDU reassembled in 252]"
"228","0.087948","100.86.235.39","151.101.65.140","TCP","66","56473  >  443 [ACK] Seq=1 Ack=119853 Win=4672 Len=0 TSval=1656578138 TSecr=2958645822"
"229","0.088313","151.101.65.140","100.86.235.39","TCP","1510","443  >  56473 [ACK] Seq=119853 Ack=1 Win=298 Len=1444 TSval=2958645824 TSecr=1656578129 [TCP PDU reassembled in 252]"
"230","0.088314","151.101.65.140","100.86.235.39","TCP","1510","443  >  56473 [PSH, ACK] Seq=121297 Ack=1 Win=298 Len=1444 TSval=2958645824 TSecr=1656578129 [TCP PDU reassembled in 252]"
"231","0.088315","151.101.65.140","100.86.235.39","TCP","1510","443  >  56438 [ACK] Seq=61515 Ack=483 Win=424 Len=1444 TSval=3000796278 TSecr=3707631721 [TCP PDU reassembled in 259]"
"232","0.088360","100.86.235.39","151.101.65.140","TCP","66","56438  >  443 [ACK] Seq=483 Ack=62959 Win=7840 Len=0 TSval=3707631731 TSecr=3000796278"
"233","0.088384","100.86.235.39","151.101.65.140","TCP","66","56473  >  443 [ACK] Seq=1 Ack=122741 Win=4672 Len=0 TSval=1656578139 TSecr=2958645824"
"234","0.088791","151.101.65.140","100.86.235.39","TCP","1510","443  >  56438 [PSH, ACK] Seq=62959 Ack=483 Win=424 Len=1444 TSval=3000796278 TSecr=3707631721 [TCP PDU reassembled in 259]"
"235","0.088828","100.86.235.39","151.101.65.140","TCP","66","56438  >  443 [ACK] Seq=483 Ack=64403 Win=7840 Len=0 TSval=3707631731 TSecr=3000796278"
"236","0.089952","151.101.65.140","100.86.235.39","TCP","1510","443  >  56473 [ACK] Seq=122741 Ack=1 Win=298 Len=1444 TSval=2958645825 TSecr=1656578129 [TCP PDU reassembled in 252]"
"237","0.089953","151.101.65.140","100.86.235.39","TCP","1510","443  >  56473 [PSH, ACK] Seq=124185 Ack=1 Win=298 Len=1444 TSval=2958645825 TSecr=1656578129 [TCP PDU reassembled in 252]"
"238","0.089955","151.101.65.140","100.86.235.39","TCP","1510","443  >  56438 [ACK] Seq=64403 Ack=483 Win=424 Len=1444 TSval=3000796279 TSecr=3707631721 [TCP PDU reassembled in 259]"
"239","0.090087","100.86.235.39","151.101.65.140","TCP","66","56438  >  443 [ACK] Seq=483 Ack=65847 Win=7840 Len=0 TSval=3707631732 TSecr=3000796279"
"240","0.090176","100.86.235.39","151.101.65.140","TCP","66","56473  >  443 [ACK] Seq=1 Ack=125629 Win=4672 Len=0 TSval=1656578140 TSecr=2958645825"
"241","0.090271","151.101.65.140","100.86.235.39","TCP","1510","443  >  56438 [PSH, ACK] Seq=65847 Ack=483 Win=424 Len=1444 TSval=3000796279 TSecr=3707631721 [TCP PDU reassembled in 259]"
"242","0.090325","100.86.235.39","151.101.65.140","TCP","66","56438  >  443 [ACK] Seq=483 Ack=67291 Win=7840 Len=0 TSval=3707631732 TSecr=3000796279"
"243","0.091828","151.101.65.140","100.86.235.39","TCP","1510","443  >  56438 [ACK] Seq=67291 Ack=483 Win=424 Len=1444 TSval=3000796281 TSecr=3707631721 [TCP PDU reassembled in 259]"
"244","0.092105","151.101.65.140","100.86.235.39","TCP","1510","443  >  56438 [PSH, ACK] Seq=68735 Ack=483 Win=424 Len=1444 TSval=3000796281 TSecr=3707631721 [TCP PDU reassembled in 259]"
"245","0.092187","100.86.235.39","151.101.65.140","TCP","66","56438  >  443 [ACK] Seq=483 Ack=70179 Win=7862 Len=0 TSval=3707631734 TSecr=3000796281"
"246","0.092905","151.101.65.140","100.86.235.39","TCP","1510","443  >  56473 [ACK] Seq=125629 Ack=1 Win=298 Len=1444 TSval=2958645827 TSecr=1656578132 [TCP PDU reassembled in 252]"
"247","0.092907","151.101.65.140","100.86.235.39","TCP","1510","443  >  56473 [PSH, ACK] Seq=127073 Ack=1 Win=298 Len=1444 TSval=2958645827 TSecr=1656578132 [TCP PDU reassembled in 252]"
"248","0.092998","100.86.235.39","151.101.65.140","TCP","66","56473  >  443 [ACK] Seq=1 Ack=128517 Win=4672 Len=0 TSval=1656578143 TSecr=2958645827"
"249","0.093148","151.101.65.140","100.86.235.39","TCP","1510","443  >  56438 [ACK] Seq=70179 Ack=483 Win=424 Len=1444 TSval=3000796283 TSecr=3707631723 [TCP PDU reassembled in 259]"
"250","0.093149","151.101.65.140","100.86.235.39","TCP","1510","443  >  56438 [PSH, ACK] Seq=71623 Ack=483 Win=424 Len=1444 TSval=3000796283 TSecr=3707631723 [TCP PDU reassembled in 259]"
"251","0.093227","100.86.235.39","151.101.65.140","TCP","66","56438  >  443 [ACK] Seq=483 Ack=73067 Win=7862 Len=0 TSval=3707631735 TSecr=3000796283"
"252","0.093926","151.101.65.140","100.86.235.39","SSLv2","1510","Encrypted Data"
"253","0.094420","151.101.65.140","100.86.235.39","TCP","1510","443  >  56473 [PSH, ACK] Seq=129961 Ack=1 Win=298 Len=1444 TSval=2958645830 TSecr=1656578135 [TCP PDU reassembled in 266]"
"254","0.094527","100.86.235.39","151.101.65.140","TCP","66","56473  >  443 [ACK] Seq=1 Ack=131405 Win=4672 Len=0 TSval=1656578144 TSecr=2958645830"
"255","0.094680","151.101.65.140","100.86.235.39","TCP","1510","443  >  56473 [ACK] Seq=131405 Ack=1 Win=298 Len=1444 TSval=2958645830 TSecr=1656578135 [TCP PDU reassembled in 266]"
"256","0.094681","151.101.65.140","100.86.235.39","TCP","1510","443  >  56473 [PSH, ACK] Seq=132849 Ack=1 Win=298 Len=1444 TSval=2958645830 TSecr=1656578135 [TCP PDU reassembled in 266]"
"257","0.094755","100.86.235.39","151.101.65.140","TCP","66","56473  >  443 [ACK] Seq=1 Ack=134293 Win=4672 Len=0 TSval=1656578144 TSecr=2958645830"
"258","0.095306","151.101.65.140","100.86.235.39","TCP","1510","443  >  56438 [ACK] Seq=73067 Ack=483 Win=424 Len=1444 TSval=3000796285 TSecr=3707631726 [TCP PDU reassembled in 259]"
"259","0.095307","151.101.65.140","100.86.235.39","TLSv1.2","1510","Application Data"
"260","0.095517","100.86.235.39","151.101.65.140","TCP","66","56438  >  443 [ACK] Seq=483 Ack=75955 Win=7862 Len=0 TSval=3707631738 TSecr=3000796285"
"261","0.096867","151.101.65.140","100.86.235.39","TCP","1510","443  >  56473 [ACK] Seq=134293 Ack=1 Win=298 Len=1444 TSval=2958645832 TSecr=1656578136 [TCP PDU reassembled in 266]"
"262","0.096894","151.101.65.140","100.86.235.39","TCP","1510","443  >  56473 [PSH, ACK] Seq=135737 Ack=1 Win=298 Len=1444 TSval=2958645832 TSecr=1656578136 [TCP PDU reassembled in 266]"
"263","0.096988","100.86.235.39","151.101.65.140","TCP","66","56473  >  443 [ACK] Seq=1 Ack=137181 Win=4672 Len=0 TSval=1656578147 TSecr=2958645832"
"264","0.097748","151.101.65.140","100.86.235.39","TCP","1510","443  >  56438 [ACK] Seq=75955 Ack=483 Win=424 Len=1444 TSval=3000796288 TSecr=3707631731 [TCP PDU reassembled in 272]"
"265","0.098115","151.101.65.140","100.86.235.39","TCP","1510","443  >  56473 [ACK] Seq=137181 Ack=1 Win=298 Len=1444 TSval=2958645833 TSecr=1656578139 [TCP PDU reassembled in 266]"
"266","0.098116","151.101.65.140","100.86.235.39","SSLv2","1510","Encrypted Data"
"267","0.098211","100.86.235.39","151.101.65.140","TCP","66","56473  >  443 [ACK] Seq=1 Ack=140069 Win=4672 Len=0 TSval=1656578148 TSecr=2958645833"
"268","0.098861","151.101.65.140","100.86.235.39","TCP","1510","443  >  56473 [ACK] Seq=140069 Ack=1 Win=298 Len=1444 TSval=2958645834 TSecr=1656578139 [TCP PDU reassembled in 288]"
"269","0.099027","151.101.65.140","100.86.235.39","TCP","1510","443  >  56473 [PSH, ACK] Seq=141513 Ack=1 Win=298 Len=1444 TSval=2958645834 TSecr=1656578139 [TCP PDU reassembled in 288]"
"270","0.099029","151.101.65.140","100.86.235.39","TCP","1510","443  >  56438 [ACK] Seq=77399 Ack=483 Win=424 Len=1444 TSval=3000796289 TSecr=3707631732 [TCP PDU reassembled in 272]"
