"No.","Time","Source","Destination","Protocol","Length","Info"
"1","0.000000","151.101.1.140","100.86.243.187","TLSv1.2","148","Application Data"
"2","0.000148","100.86.243.187","151.101.1.140","TCP","66","56485  >  443 [ACK] Seq=1 Ack=83 Win=3925 Len=0 TSval=2851333416 TSecr=1266278902"
"3","0.000459","151.101.1.140","100.86.243.187","TLSv1.2","114","Application Data"
"4","0.000543","100.86.243.187","151.101.1.140","TCP","66","56485  >  443 [ACK] Seq=1 Ack=131 Win=3925 Len=0 TSval=2851333416 TSecr=1266278902"
"5","0.019006","151.101.1.140","100.86.243.187","TLSv1.2","155","Application Data"
"6","0.019154","100.86.243.187","151.101.1.140","TCP","66","56485  >  443 [ACK] Seq=1 Ack=220 Win=3925 Len=0 TSval=2851333435 TSecr=1266278921"
"7","0.019923","151.101.1.140","100.86.243.187","TLSv1.2","105","Application Data"
"8","0.020042","100.86.243.187","151.101.1.140","TCP","66","56485  >  443 [ACK] Seq=1 Ack=259 Win=3925 Len=0 TSval=2851333435 TSecr=1266278922"
"9","0.035385","151.101.1.140","100.86.243.187","TLSv1.2","565","Application Data"
"10","0.035529","100.86.243.187","151.101.1.140","TCP","66","56485  >  443 [ACK] Seq=1 Ack=758 Win=3925 Len=0 TSval=2851333452 TSecr=1266278937"
"11","0.060004","151.101.1.140","100.86.243.187","TLSv1.2","136","Application Data"
"12","0.060005","151.101.1.140","100.86.243.187","TLSv1.2","119","Application Data"
"13","0.060221","100.86.243.187","151.101.1.140","TCP","66","56485  >  443 [ACK] Seq=1 Ack=881 Win=3925 Len=0 TSval=2851333476 TSecr=1266278962"
"14","0.060772","151.101.1.140","100.86.243.187","TLSv1.2","433","Application Data"
"15","0.060888","100.86.243.187","151.101.1.140","TCP","66","56485  >  443 [ACK] Seq=1 Ack=1248 Win=3925 Len=0 TSval=2851333476 TSecr=1266278963"
"16","0.064210","151.101.1.140","100.86.243.187","TLSv1.2","112","Application Data"
"17","0.064232","151.101.1.140","100.86.243.187","TLSv1.2","119","Application Data"
"18","0.064389","100.86.243.187","151.101.1.140","TCP","66","56485  >  443 [ACK] Seq=1 Ack=1347 Win=3925 Len=0 TSval=2851333480 TSecr=1266278966"
"19","0.064716","151.101.1.140","100.86.243.187","TLSv1.2","213","Application Data"
"20","0.064809","100.86.243.187","151.101.1.140","TCP","66","56485  >  443 [ACK] Seq=1 Ack=1494 Win=3925 Len=0 TSval=2851333480 TSecr=1266278967"
"21","0.064998","151.101.1.140","100.86.243.187","TLSv1.2","139","Application Data"
"22","0.065077","100.86.243.187","151.101.1.140","TCP","66","56485  >  443 [ACK] Seq=1 Ack=1567 Win=3925 Len=0 TSval=2851333480 TSecr=1266278967"
"23","0.065815","151.101.1.140","100.86.243.187","TLSv1.2","116","Application Data"
"24","0.065816","151.101.1.140","100.86.243.187","TLSv1.2","176","Application Data"
"25","0.065946","100.86.243.187","151.101.1.140","TCP","66","56485  >  443 [ACK] Seq=1 Ack=1727 Win=3925 Len=0 TSval=2851333482 TSecr=1266278967"
"26","0.066936","151.101.1.140","100.86.243.187","TLSv1.2","645","Application Data"
"27","0.067032","100.86.243.187","151.101.1.140","TCP","66","56485  >  443 [ACK] Seq=1 Ack=2306 Win=3925 Len=0 TSval=2851333483 TSecr=1266278969"
"28","0.067206","151.101.1.140","100.86.243.187","TLSv1.2","1268","Application Data"
"29","0.067282","100.86.243.187","151.101.1.140","TCP","66","56485  >  443 [ACK] Seq=1 Ack=3508 Win=3925 Len=0 TSval=2851333483 TSecr=1266278969"
"30","0.068368","151.101.1.140","100.86.243.187","TCP","1510","443  >  56485 [ACK] Seq=3508 Ack=1 Win=639 Len=1444 TSval=1266278970 TSecr=2851333452 [TCP PDU reassembled in 31]"
"31","0.069740","151.101.1.140","100.86.243.187","TLSv1.2","330","Application Data"
"32","0.069816","100.86.243.187","151.101.1.140","TCP","66","56485  >  443 [ACK] Seq=1 Ack=5216 Win=3925 Len=0 TSval=2851333486 TSecr=1266278970"
"33","0.069982","151.101.1.140","100.86.243.187","TLSv1.2","944","Application Data"
"34","0.070050","100.86.243.187","151.101.1.140","TCP","66","56485  >  443 [ACK] Seq=1 Ack=6094 Win=3925 Len=0 TSval=2851333486 TSecr=1266278972"
"35","0.070863","151.101.1.140","100.86.243.187","TLSv1.2","109","Application Data"
"36","0.070930","100.86.243.187","151.101.1.140","TCP","66","56485  >  443 [ACK] Seq=1 Ack=6137 Win=3925 Len=0 TSval=2851333487 TSecr=1266278973"
"37","0.102847","151.101.1.140","100.86.243.187","TLSv1.2","105","Application Data"
"38","0.102886","151.101.1.140","100.86.243.187","TLSv1.2","126","Application Data"
"39","0.103112","100.86.243.187","151.101.1.140","TCP","66","56485  >  443 [ACK] Seq=1 Ack=6236 Win=3925 Len=0 TSval=2851333519 TSecr=1266279004"
"40","0.103611","151.101.1.140","100.86.243.187","TLSv1.2","395","Application Data"
"41","0.103725","100.86.243.187","151.101.1.140","TCP","66","56485  >  443 [ACK] Seq=1 Ack=6565 Win=3925 Len=0 TSval=2851333519 TSecr=1266279005"
"42","0.105093","151.101.1.140","100.86.243.187","TLSv1.2","164","Application Data"
"43","0.105243","100.86.243.187","151.101.1.140","TCP","66","56485  >  443 [ACK] Seq=1 Ack=6663 Win=3925 Len=0 TSval=2851333521 TSecr=1266279007"
"57","0.223561","100.86.243.187","151.101.1.140","TCP","1514","56485  >  443 [ACK] Seq=1 Ack=6663 Win=3925 Len=1448 TSval=2851333640 TSecr=1266279007 [TCP PDU reassembled in 59]"
"58","0.223564","100.86.243.187","151.101.1.140","TCP","1514","56485  >  443 [ACK] Seq=1449 Ack=6663 Win=3925 Len=1448 TSval=2851333640 TSecr=1266279007 [TCP PDU reassembled in 59]"
"59","0.223606","100.86.243.187","151.101.1.140","TLSv1.2","189","Application Data"
"60","0.223657","100.86.243.187","151.101.1.140","TLSv1.2","222","Application Data"
"69","0.243828","100.86.243.187","151.101.1.140","TCP","1514","56485  >  443 [ACK] Seq=3176 Ack=6663 Win=3925 Len=1448 TSval=2851333660 TSecr=1266279007 [TCP PDU reassembled in 71]"
"70","0.243831","100.86.243.187","151.101.1.140","TCP","1514","56485  >  443 [ACK] Seq=4624 Ack=6663 Win=3925 Len=1448 TSval=2851333660 TSecr=1266279007 [TCP PDU reassembled in 71]"
"71","0.243873","100.86.243.187","151.101.1.140","TLSv1.2","189","Application Data"
"72","0.243922","100.86.243.187","151.101.1.140","TLSv1.2","277","Application Data"
"73","0.254898","151.101.1.140","100.86.243.187","TCP","66","443  >  56485 [ACK] Seq=6663 Ack=3176 Win=635 Len=0 TSval=1266279146 TSecr=2851333640"
"86","0.265193","151.101.1.140","100.86.243.187","TCP","66","443  >  56485 [ACK] Seq=6663 Ack=6406 Win=631 Len=0 TSval=1266279165 TSecr=2851333660"
"113","0.311348","151.101.1.140","100.86.243.187","TCP","1510","443  >  56485 [ACK] Seq=6663 Ack=6406 Win=639 Len=1444 TSval=1266279213 TSecr=2851333660 [TCP PDU reassembled in 115]"
"114","0.311440","100.86.243.187","151.101.1.140","TCP","66","56485  >  443 [ACK] Seq=6406 Ack=8107 Win=3903 Len=0 TSval=2851333727 TSecr=1266279213"
"115","0.311498","151.101.1.140","100.86.243.187","TLSv1.2","1084","Application Data"
"116","0.311541","100.86.243.187","151.101.1.140","TCP","66","56485  >  443 [ACK] Seq=6406 Ack=9125 Win=3925 Len=0 TSval=2851333727 TSecr=1266279213"
"117","0.367067","100.86.243.187","151.101.1.140","TCP","1514","56485  >  443 [ACK] Seq=6406 Ack=9125 Win=3925 Len=1448 TSval=2851333783 TSecr=1266279213 [TCP PDU reassembled in 119]"
"118","0.367072","100.86.243.187","151.101.1.140","TCP","1514","56485  >  443 [ACK] Seq=7854 Ack=9125 Win=3925 Len=1448 TSval=2851333783 TSecr=1266279213 [TCP PDU reassembled in 119]"
"119","0.367156","100.86.243.187","151.101.1.140","TLSv1.2","180","Application Data"
"120","0.367204","100.86.243.187","151.101.1.140","TCP","1514","56485  >  443 [ACK] Seq=9416 Ack=9125 Win=3925 Len=1448 TSval=2851333783 TSecr=1266279213 [TCP PDU reassembled in 121]"
"121","0.367217","100.86.243.187","151.101.1.140","TLSv1.2","511","Application Data"
"122","0.376313","100.86.243.187","151.101.1.140","TCP","1514","56485  >  443 [ACK] Seq=11309 Ack=9125 Win=3925 Len=1448 TSval=2851333792 TSecr=1266279213 [TCP PDU reassembled in 124]"
"123","0.376315","100.86.243.187","151.101.1.140","TCP","1514","56485  >  443 [ACK] Seq=12757 Ack=9125 Win=3925 Len=1448 TSval=2851333792 TSecr=1266279213 [TCP PDU reassembled in 124]"
"124","0.376355","100.86.243.187","151.101.1.140","TLSv1.2","163","Application Data"
"125","0.376932","151.101.1.140","100.86.243.187","TCP","66","443  >  56485 [ACK] Seq=9125 Ack=11309 Win=631 Len=0 TSval=1266279279 TSecr=2851333783"
"126","0.386148","151.101.1.140","100.86.243.187","TCP","66","443  >  56485 [ACK] Seq=9125 Ack=12757 Win=635 Len=0 TSval=1266279288 TSecr=2851333792"
"127","0.386149","151.101.1.140","100.86.243.187","TCP","66","443  >  56485 [ACK] Seq=9125 Ack=14302 Win=635 Len=0 TSval=1266279288 TSecr=2851333792"
"128","0.387132","151.101.1.140","100.86.243.187","TCP","1510","443  >  56485 [ACK] Seq=9125 Ack=14302 Win=639 Len=1444 TSval=1266279289 TSecr=2851333792 [TCP PDU reassembled in 132]"
"129","0.387200","100.86.243.187","151.101.1.140","TCP","66","56485  >  443 [ACK] Seq=14302 Ack=10569 Win=3903 Len=0 TSval=2851333802 TSecr=1266279289"
"130","0.387521","151.101.1.140","100.86.243.187","TCP","1510","443  >  56485 [PSH, ACK] Seq=10569 Ack=14302 Win=639 Len=1444 TSval=1266279289 TSecr=2851333792 [TCP PDU reassembled in 132]"
"131","0.387599","100.86.243.187","151.101.1.140","TCP","66","56485  >  443 [ACK] Seq=14302 Ack=12013 Win=3925 Len=0 TSval=2851333803 TSecr=1266279289"
"132","0.387794","151.101.1.140","100.86.243.187","TLSv1.2","1400","Application Data"
"133","0.387873","100.86.243.187","151.101.1.140","TCP","66","56485  >  443 [ACK] Seq=14302 Ack=13347 Win=3925 Len=0 TSval=2851333803 TSecr=1266279290"
"134","0.412742","151.101.1.140","100.86.243.187","TCP","1510","443  >  56485 [ACK] Seq=13347 Ack=14302 Win=639 Len=1444 TSval=1266279315 TSecr=2851333803 [TCP PDU reassembled in 135]"
"135","0.412744","151.101.1.140","100.86.243.187","TLSv1.2","925","Application Data"
"136","0.412902","100.86.243.187","151.101.1.140","TCP","66","56485  >  443 [ACK] Seq=14302 Ack=15650 Win=3925 Len=0 TSval=2851333829 TSecr=1266279315"
"137","0.413581","151.101.1.140","100.86.243.187","TLSv1.2","99","Application Data"
"138","0.413690","100.86.243.187","151.101.1.140","TCP","66","56485  >  443 [ACK] Seq=14302 Ack=15683 Win=3925 Len=0 TSval=2851333829 TSecr=1266279315"
"139","0.425921","151.101.1.140","100.86.243.187","TCP","1510","443  >  56485 [ACK] Seq=15683 Ack=14302 Win=639 Len=1444 TSval=1266279325 TSecr=2851333829 [TCP PDU reassembled in 140]"
"140","0.426956","151.101.1.140","100.86.243.187","TLSv1.2","228","Application Data"
"141","0.427088","100.86.243.187","151.101.1.140","TCP","66","56485  >  443 [ACK] Seq=14302 Ack=17289 Win=3925 Len=0 TSval=2851333843 TSecr=1266279325"
"142","0.430055","100.86.243.187","151.101.1.140","TCP","1514","56485  >  443 [ACK] Seq=14302 Ack=17289 Win=3925 Len=1448 TSval=2851333846 TSecr=1266279325 [TCP PDU reassembled in 144]"
"143","0.430058","100.86.243.187","151.101.1.140","TCP","1514","56485  >  443 [ACK] Seq=15750 Ack=17289 Win=3925 Len=1448 TSval=2851333846 TSecr=1266279325 [TCP PDU reassembled in 144]"
"144","0.430123","100.86.243.187","151.101.1.140","TLSv1.2","157","Application Data"
"145","0.440303","151.101.1.140","100.86.243.187","TCP","66","443  >  56485 [ACK] Seq=17289 Ack=17289 Win=635 Len=0 TSval=1266279342 TSecr=2851333846"
"146","0.449660","100.86.243.187","151.101.1.140","TCP","1514","56485  >  443 [ACK] Seq=17289 Ack=17289 Win=3925 Len=1448 TSval=2851333866 TSecr=1266279342 [TCP PDU reassembled in 147]"
"147","0.449700","100.86.243.187","151.101.1.140","TLSv1.2","1485","Application Data"
"148","0.460089","151.101.1.140","100.86.243.187","TCP","66","443  >  56485 [ACK] Seq=17289 Ack=20156 Win=631 Len=0 TSval=1266279362 TSecr=2851333866"
"149","0.463285","151.101.1.140","100.86.243.187","TCP","1510","443  >  56485 [ACK] Seq=17289 Ack=20156 Win=639 Len=1444 TSval=1266279365 TSecr=2851333866 [TCP PDU reassembled in 151]"
"150","0.463495","100.86.243.187","151.101.1.140","TCP","66","56485  >  443 [ACK] Seq=20156 Ack=18733 Win=3903 Len=0 TSval=2851333879 TSecr=1266279365"
"151","0.463611","151.101.1.140","100.86.243.187","TLSv1.2","942","Application Data"
"152","0.463716","100.86.243.187","151.101.1.140","TCP","66","56485  >  443 [ACK] Seq=20156 Ack=19609 Win=3925 Len=0 TSval=2851333879 TSecr=1266279365"
"153","0.492832","151.101.1.140","100.86.243.187","TCP","1510","443  >  56485 [ACK] Seq=19609 Ack=20156 Win=639 Len=1444 TSval=1266279394 TSecr=2851333879 [TCP PDU reassembled in 154]"
"154","0.492917","151.101.1.140","100.86.243.187","TLSv1.2","357","Application Data"
"155","0.493082","100.86.243.187","151.101.1.140","TCP","66","56485  >  443 [ACK] Seq=20156 Ack=21344 Win=3925 Len=0 TSval=2851333909 TSecr=1266279394"
"159","0.548829","100.86.243.187","151.101.1.140","TCP","1514","56485  >  443 [ACK] Seq=20156 Ack=21344 Win=3925 Len=1448 TSval=2851333965 TSecr=1266279394 [TCP PDU reassembled in 160]"
"160","0.548956","100.86.243.187","151.101.1.140","TLSv1.2","1481","Application Data"
"161","0.549484","100.86.243.187","151.101.1.140","TCP","1514","56485  >  443 [ACK] Seq=23019 Ack=21344 Win=3925 Len=1448 TSval=2851333965 TSecr=1266279394 [TCP PDU reassembled in 162]"
"162","0.549512","100.86.243.187","151.101.1.140","TLSv1.2","1496","Application Data"
"164","0.549868","100.86.243.187","151.101.1.140","TCP","1514","56485  >  443 [ACK] Seq=25897 Ack=21344 Win=3925 Len=1448 TSval=2851333966 TSecr=1266279394 [TCP PDU reassembled in 166]"
"165","0.549870","100.86.243.187","151.101.1.140","TCP","1514","56485  >  443 [ACK] Seq=27345 Ack=21344 Win=3925 Len=1448 TSval=2851333966 TSecr=1266279394 [TCP PDU reassembled in 166]"
"166","0.549885","100.86.243.187","151.101.1.140","TLSv1.2","91","Application Data"
"180","0.560117","151.101.1.140","100.86.243.187","TLSv1.2","428","Application Data"
"182","0.560313","100.86.243.187","151.101.1.140","TCP","66","56485  >  443 [ACK] Seq=28818 Ack=21706 Win=3925 Len=0 TSval=2851333976 TSecr=1266279460"
"185","0.560352","151.101.1.140","100.86.243.187","TCP","66","443  >  56485 [ACK] Seq=21706 Ack=28818 Win=635 Len=0 TSval=1266279462 TSecr=2851333966"
"189","0.561861","151.101.1.140","100.86.243.187","TLSv1.2","107","Application Data"
"190","0.561967","100.86.243.187","151.101.1.140","TCP","66","56485  >  443 [ACK] Seq=28818 Ack=21747 Win=3925 Len=0 TSval=2851333978 TSecr=1266279463"
"202","0.569705","100.86.243.187","151.101.1.140","TCP","1514","56485  >  443 [ACK] Seq=28818 Ack=21747 Win=3925 Len=1448 TSval=2851333985 TSecr=1266279463 [TCP PDU reassembled in 204]"
"203","0.569709","100.86.243.187","151.101.1.140","TCP","1514","56485  >  443 [ACK] Seq=30266 Ack=21747 Win=3925 Len=1448 TSval=2851333985 TSecr=1266279463 [TCP PDU reassembled in 204]"
"204","0.569777","100.86.243.187","151.101.1.140","TLSv1.2","187","Application Data"
"205","0.569923","100.86.243.187","151.101.1.140","TLSv1.2","146","Application Data"
"211","0.580293","151.101.1.140","100.86.243.187","TCP","66","443  >  56485 [ACK] Seq=21747 Ack=31915 Win=634 Len=0 TSval=1266279482 TSecr=2851333986"
"212","0.583414","151.101.1.140","100.86.243.187","TCP","1510","443  >  56485 [ACK] Seq=21747 Ack=31915 Win=639 Len=1444 TSval=1266279484 TSecr=2851333986 [TCP PDU reassembled in 214]"
"213","0.583495","100.86.243.187","151.101.1.140","TCP","66","56485  >  443 [ACK] Seq=31915 Ack=23191 Win=3903 Len=0 TSval=2851334000 TSecr=1266279484"
"214","0.584170","151.101.1.140","100.86.243.187","TLSv1.2","896","Application Data"
"215","0.584170","151.101.1.140","100.86.243.187","TLSv1.2","112","Application Data"
"216","0.584225","100.86.243.187","151.101.1.140","TCP","66","56485  >  443 [ACK] Seq=31915 Ack=24067 Win=3912 Len=0 TSval=2851334000 TSecr=1266279485"
"217","0.593900","151.101.1.140","100.86.243.187","TCP","1510","443  >  56485 [ACK] Seq=24067 Ack=31915 Win=639 Len=1444 TSval=1266279496 TSecr=2851333986 [TCP PDU reassembled in 218]"
"218","0.593948","151.101.1.140","100.86.243.187","TLSv1.2","314","Application Data"
"219","0.594109","100.86.243.187","151.101.1.140","TCP","66","56485  >  443 [ACK] Seq=31915 Ack=25759 Win=3925 Len=0 TSval=2851334010 TSecr=1266279496"
"220","0.595876","151.101.1.140","100.86.243.187","TCP","1510","443  >  56485 [ACK] Seq=25759 Ack=31915 Win=639 Len=1444 TSval=1266279498 TSecr=2851334000 [TCP PDU reassembled in 221]"
"221","0.596477","151.101.1.140","100.86.243.187","TLSv1.2","911","Application Data"
"222","0.596685","100.86.243.187","151.101.1.140","TCP","66","56485  >  443 [ACK] Seq=31915 Ack=28048 Win=3925 Len=0 TSval=2851334013 TSecr=1266279498"
"223","0.599981","151.101.1.140","100.86.243.187","TCP","1510","443  >  56485 [ACK] Seq=28048 Ack=31915 Win=639 Len=1444 TSval=1266279502 TSecr=2851334000 [TCP PDU reassembled in 224]"
"224","0.599983","151.101.1.140","100.86.243.187","TLSv1.2","1283","Application Data"
"225","0.600320","100.86.243.187","151.101.1.140","TCP","66","56485  >  443 [ACK] Seq=31915 Ack=30709 Win=3925 Len=0 TSval=2851334016 TSecr=1266279502"
"226","0.603934","151.101.1.140","100.86.243.187","TLSv1.2","112","Application Data"
"227","0.603966","151.101.1.140","100.86.243.187","TLSv1.2","261","Application Data"
"228","0.604122","100.86.243.187","151.101.1.140","TCP","66","56485  >  443 [ACK] Seq=31915 Ack=30950 Win=3925 Len=0 TSval=2851334020 TSecr=1266279506"
"229","0.606058","151.101.1.140","100.86.243.187","TLSv1.2","254","Application Data"
"230","0.606059","151.101.1.140","100.86.243.187","TLSv1.2","168","Application Data"
"231","0.606238","100.86.243.187","151.101.1.140","TCP","66","56485  >  443 [ACK] Seq=31915 Ack=31240 Win=3925 Len=0 TSval=2851334022 TSecr=1266279508"
"232","0.606484","151.101.1.140","100.86.243.187","TLSv1.2","208","Application Data"
"233","0.606569","100.86.243.187","151.101.1.140","TCP","66","56485  >  443 [ACK] Seq=31915 Ack=31382 Win=3925 Len=0 TSval=2851334022 TSecr=1266279509"
"234","0.610664","151.101.1.140","100.86.243.187","TLSv1.2","661","Application Data"
"235","0.610801","100.86.243.187","151.101.1.140","TCP","66","56485  >  443 [ACK] Seq=31915 Ack=31977 Win=3925 Len=0 TSval=2851334027 TSecr=1266279513"
"240","0.638416","151.101.1.140","100.86.243.187","TLSv1.2","825","Application Data"
"241","0.638582","100.86.243.187","151.101.1.140","TCP","66","56485  >  443 [ACK] Seq=31915 Ack=32736 Win=3925 Len=0 TSval=2851334055 TSecr=1266279540"
"242","0.638649","151.101.1.140","100.86.243.187","TLSv1.2","97","Application Data"
"243","0.638863","100.86.243.187","151.101.1.140","TCP","66","56485  >  443 [ACK] Seq=31915 Ack=32767 Win=3925 Len=0 TSval=2851334055 TSecr=1266279540"
"247","0.650893","100.86.243.187","151.101.1.140","TLSv1.2","206","Application Data"
"248","0.651163","100.86.243.187","151.101.1.140","TLSv1.2","206","Application Data"
"249","0.661116","151.101.1.140","100.86.243.187","TCP","66","443  >  56509 [ACK] Seq=1 Ack=141 Win=424 Len=0 TSval=3914540290 TSecr=514240816"
"250","0.661153","151.101.1.140","100.86.243.187","TCP","66","443  >  56509 [ACK] Seq=1 Ack=281 Win=424 Len=0 TSval=3914540291 TSecr=514240816"
"252","0.664645","151.101.1.140","100.86.243.187","TLSv1.2","223","Application Data"
"253","0.664730","100.86.243.187","151.101.1.140","TCP","66","56509  >  443 [ACK] Seq=281 Ack=158 Win=7023 Len=0 TSval=514240830 TSecr=3914540294"
"254","0.665435","151.101.1.140","100.86.243.187","TCP","1510","443  >  56509 [ACK] Seq=158 Ack=281 Win=424 Len=1444 TSval=3914540294 TSecr=514240816 [TCP PDU reassembled in 257]"
"255","0.665436","151.101.1.140","100.86.243.187","TCP","1510","443  >  56509 [PSH, ACK] Seq=1602 Ack=281 Win=424 Len=1444 TSval=3914540294 TSecr=514240816 [TCP PDU reassembled in 257]"
"256","0.665499","100.86.243.187","151.101.1.140","TCP","66","56509  >  443 [ACK] Seq=281 Ack=3046 Win=6980 Len=0 TSval=514240830 TSecr=3914540294"
"257","0.667243","151.101.1.140","100.86.243.187","TLSv1.2","1321","Application Data"
"258","0.667304","100.86.243.187","151.101.1.140","TCP","66","56509  >  443 [ACK] Seq=281 Ack=4301 Win=7005 Len=0 TSval=514240832 TSecr=3914540296"
"259","0.668518","151.101.1.140","100.86.243.187","TCP","1510","443  >  56509 [ACK] Seq=4301 Ack=281 Win=424 Len=1444 TSval=3914540297 TSecr=514240816 [TCP PDU reassembled in 264]"
"260","0.668519","151.101.1.140","100.86.243.187","TCP","1510","443  >  56509 [PSH, ACK] Seq=5745 Ack=281 Win=424 Len=1444 TSval=3914540297 TSecr=514240816 [TCP PDU reassembled in 264]"
"261","0.668601","100.86.243.187","151.101.1.140","TCP","66","56509  >  443 [ACK] Seq=281 Ack=7189 Win=6980 Len=0 TSval=514240834 TSecr=3914540297"
"262","0.670137","151.101.1.140","100.86.243.187","TCP","1510","443  >  56509 [ACK] Seq=7189 Ack=281 Win=424 Len=1444 TSval=3914540299 TSecr=514240816 [TCP PDU reassembled in 264]"
"263","0.670211","100.86.243.187","151.101.1.140","TCP","66","56509  >  443 [ACK] Seq=281 Ack=8633 Win=7002 Len=0 TSval=514240835 TSecr=3914540299"
"264","0.674858","151.101.1.140","100.86.243.187","TLSv1.2","510","Application Data"
"265","0.674947","100.86.243.187","151.101.1.140","TCP","66","56509  >  443 [ACK] Seq=281 Ack=9077 Win=7018 Len=0 TSval=514240840 TSecr=3914540304"
"325","0.938167","100.86.243.187","151.101.1.140","TCP","1514","56485  >  443 [ACK] Seq=31915 Ack=32767 Win=3925 Len=1448 TSval=2851334354 TSecr=1266279540 [TCP PDU reassembled in 327]"
"326","0.938169","100.86.243.187","151.101.1.140","TCP","1514","56485  >  443 [ACK] Seq=33363 Ack=32767 Win=3925 Len=1448 TSval=2851334354 TSecr=1266279540 [TCP PDU reassembled in 327]"
"327","0.938171","100.86.243.187","151.101.1.140","TLSv1.2","188","Application Data"
"328","0.938173","100.86.243.187","151.101.1.140","TCP","1514","56485  >  443 [ACK] Seq=34933 Ack=32767 Win=3925 Len=1448 TSval=2851334354 TSecr=1266279540 [TCP PDU reassembled in 329]"
"329","0.938174","100.86.243.187","151.101.1.140","TLSv1.2","1063","Application Data"
"338","0.948358","151.101.1.140","100.86.243.187","TCP","66","443  >  56485 [ACK] Seq=32767 Ack=37378 Win=630 Len=0 TSval=1266279850 TSecr=2851334354"
"349","0.999974","151.101.1.140","100.86.243.187","TCP","1510","443  >  56485 [ACK] Seq=32767 Ack=37378 Win=639 Len=1444 TSval=1266279902 TSecr=2851334354 [TCP PDU reassembled in 351]"
"350","1.000112","100.86.243.187","151.101.1.140","TCP","66","56485  >  443 [ACK] Seq=37378 Ack=34211 Win=3903 Len=0 TSval=2851334416 TSecr=1266279902"
"351","1.000589","151.101.1.140","100.86.243.187","TLSv1.2","986","Application Data"
"352","1.000718","100.86.243.187","151.101.1.140","TCP","66","56485  >  443 [ACK] Seq=37378 Ack=35131 Win=3911 Len=0 TSval=2851334416 TSecr=1266279902"
"355","1.352967","151.101.1.140","100.86.243.187","TLSv1.2","148","Application Data"
"356","1.353070","100.86.243.187","151.101.1.140","TCP","66","56485  >  443 [ACK] Seq=37378 Ack=35213 Win=3924 Len=0 TSval=2851334769 TSecr=1266280254"
"357","1.353998","151.101.1.140","100.86.243.187","TLSv1.2","398","Application Data"
"358","1.354106","100.86.243.187","151.101.1.140","TCP","66","56485  >  443 [ACK] Seq=37378 Ack=35545 Win=3920 Len=0 TSval=2851334770 TSecr=1266280256"
"359","1.355320","151.101.1.140","100.86.243.187","TCP","1510","443  >  56485 [ACK] Seq=35545 Ack=37378 Win=639 Len=1444 TSval=1266280257 TSecr=2851334416 [TCP PDU reassembled in 360]"
"360","1.355322","151.101.1.140","100.86.243.187","TLSv1.2","135","Application Data"
"361","1.355323","151.101.1.140","100.86.243.187","TLSv1.2","769","Application Data"
"362","1.355474","100.86.243.187","151.101.1.140","TCP","66","56485  >  443 [ACK] Seq=37378 Ack=37761 Win=3891 Len=0 TSval=2851334771 TSecr=1266280257"
"363","1.356441","151.101.1.140","100.86.243.187","TLSv1.2","1510","Application Data"
"364","1.356443","151.101.1.140","100.86.243.187","TLSv1.2","134","Application Data"
"365","1.356566","100.86.243.187","151.101.1.140","TCP","66","56485  >  443 [ACK] Seq=37378 Ack=39273 Win=3902 Len=0 TSval=2851334773 TSecr=1266280257"
"366","1.358025","151.101.1.140","100.86.243.187","TLSv1.2","1089","Application Data"
"367","1.358172","100.86.243.187","151.101.1.140","TCP","66","56485  >  443 [ACK] Seq=37378 Ack=40296 Win=3909 Len=0 TSval=2851334774 TSecr=1266280259"
"368","1.358454","151.101.1.140","100.86.243.187","TLSv1.2","912","Application Data"
"369","1.358455","151.101.1.140","100.86.243.187","TLSv1.2","1097","Application Data"
"370","1.358585","100.86.243.187","151.101.1.140","TCP","66","56485  >  443 [ACK] Seq=37378 Ack=42173 Win=3896 Len=0 TSval=2851334774 TSecr=1266280259"
"371","1.366634","151.101.1.140","100.86.243.187","TLSv1.2","279","Application Data"
"372","1.366790","100.86.243.187","151.101.1.140","TCP","66","56485  >  443 [ACK] Seq=37378 Ack=42386 Win=3922 Len=0 TSval=2851334783 TSecr=1266280268"
"373","1.369471","151.101.1.140","100.86.243.187","TLSv1.2","151","Application Data"
"374","1.369473","151.101.1.140","100.86.243.187","TLSv1.2","261","Application Data"
"375","1.369642","100.86.243.187","151.101.1.140","TCP","66","56485  >  443 [ACK] Seq=37378 Ack=42666 Win=3921 Len=0 TSval=2851334786 TSecr=1266280271"
"376","1.373554","151.101.1.140","100.86.243.187","TLSv1.2","539","Application Data"
"377","1.373702","100.86.243.187","151.101.1.140","TCP","66","56485  >  443 [ACK] Seq=37378 Ack=43139 Win=3918 Len=0 TSval=2851334790 TSecr=1266280275"
"378","1.374335","151.101.1.140","100.86.243.187","TLSv1.2","980","Application Data"
"379","1.374337","151.101.1.140","100.86.243.187","TLSv1.2","392","Application Data"
"380","1.374338","151.101.1.140","100.86.243.187","TLSv1.2","142","Application Data"
"381","1.374478","100.86.243.187","151.101.1.140","TCP","66","56485  >  443 [ACK] Seq=37378 Ack=44455 Win=3905 Len=0 TSval=2851334790 TSecr=1266280276"
"382","1.374572","151.101.1.140","100.86.243.187","TLSv1.2","177","Application Data"
"383","1.374684","100.86.243.187","151.101.1.140","TCP","66","56485  >  443 [ACK] Seq=37378 Ack=44566 Win=3917 Len=0 TSval=2851334790 TSecr=1266280276"
"384","1.375673","151.101.1.140","100.86.243.187","TLSv1.2","836","Application Data"
"385","1.375674","151.101.1.140","100.86.243.187","TLSv1.2","199","Application Data"
"386","1.375793","100.86.243.187","151.101.1.140","TCP","66","56485  >  443 [ACK] Seq=37378 Ack=45469 Win=3911 Len=0 TSval=2851334791 TSecr=1266280277"
"387","1.378743","151.101.1.140","100.86.243.187","TLSv1.2","855","Application Data"
"388","1.378905","100.86.243.187","151.101.1.140","TCP","66","56485  >  443 [ACK] Seq=37378 Ack=46258 Win=3913 Len=0 TSval=2851334795 TSecr=1266280281"
"389","1.384366","151.101.1.140","100.86.243.187","TLSv1.2","1092","Application Data"
"390","1.384368","151.101.1.140","100.86.243.187","TLSv1.2","130","Application Data"
"391","1.384368","151.101.1.140","100.86.243.187","TLSv1.2","662","Application Data"
"392","1.384369","151.101.1.140","100.86.243.187","TLSv1.2","679","Application Data"
"393","1.384370","151.101.1.140","100.86.243.187","TLSv1.2","394","Application Data"
"394","1.384518","100.86.243.187","151.101.1.140","TCP","66","56485  >  443 [ACK] Seq=37378 Ack=48885 Win=3884 Len=0 TSval=2851334800 TSecr=1266280287"
"395","1.385229","151.101.1.140","100.86.243.187","TLSv1.2","181","Application Data"
"396","1.385285","151.101.1.140","100.86.243.187","TLSv1.2","295","Application Data"
"397","1.385286","151.101.1.140","100.86.243.187","TLSv1.2","377","Application Data, Application Data"
"398","1.385381","100.86.243.187","151.101.1.140","TCP","66","56485  >  443 [ACK] Seq=37378 Ack=49000 Win=3924 Len=0 TSval=2851334800 TSecr=1266280287"
"399","1.385720","100.86.243.187","151.101.1.140","TCP","66","56485  >  443 [ACK] Seq=37378 Ack=49540 Win=3925 Len=0 TSval=2851334802 TSecr=1266280287"
"400","1.385922","151.101.1.140","100.86.243.187","TLSv1.2","136","Application Data"
"401","1.385923","151.101.1.140","100.86.243.187","TLSv1.2","435","Application Data"
"402","1.386180","100.86.243.187","151.101.1.140","TCP","66","56485  >  443 [ACK] Seq=37378 Ack=49979 Win=3925 Len=0 TSval=2851334802 TSecr=1266280288"
"403","1.393842","151.101.1.140","100.86.243.187","TLSv1.2","906","Application Data"
"404","1.393843","151.101.1.140","100.86.243.187","TLSv1.2","359","Application Data"
"405","1.394282","100.86.243.187","151.101.1.140","TCP","66","56485  >  443 [ACK] Seq=37378 Ack=51112 Win=3925 Len=0 TSval=2851334810 TSecr=1266280296"
"406","1.394518","151.101.1.140","100.86.243.187","TLSv1.2","534","Application Data"
"407","1.394731","100.86.243.187","151.101.1.140","TCP","66","56485  >  443 [ACK] Seq=37378 Ack=51580 Win=3925 Len=0 TSval=2851334810 TSecr=1266280296"
"408","1.394901","151.101.1.140","100.86.243.187","TLSv1.2","1307","Application Data"
"409","1.395089","100.86.243.187","151.101.1.140","TCP","66","56485  >  443 [ACK] Seq=37378 Ack=52821 Win=3925 Len=0 TSval=2851334811 TSecr=1266280297"
"410","1.396536","151.101.1.140","100.86.243.187","TLSv1.2","724","Application Data"
"411","1.396839","100.86.243.187","151.101.1.140","TCP","66","56485  >  443 [ACK] Seq=37378 Ack=53479 Win=3925 Len=0 TSval=2851334813 TSecr=1266280298"
"412","1.397328","151.101.1.140","100.86.243.187","TLSv1.2","240","Application Data"
"413","1.397552","100.86.243.187","151.101.1.140","TCP","66","56485  >  443 [ACK] Seq=37378 Ack=53653 Win=3925 Len=0 TSval=2851334813 TSecr=1266280298"
"414","1.403907","151.101.1.140","100.86.243.187","TLSv1.2","293","Application Data"
"415","1.403908","151.101.1.140","100.86.243.187","TLSv1.2","356","Application Data"
"416","1.404336","100.86.243.187","151.101.1.140","TCP","66","56485  >  443 [ACK] Seq=37378 Ack=54170 Win=3925 Len=0 TSval=2851334820 TSecr=1266280306"
"417","1.408452","151.101.1.140","100.86.243.187","TLSv1.2","348","Application Data"
"418","1.408754","100.86.243.187","151.101.1.140","TCP","66","56485  >  443 [ACK] Seq=37378 Ack=54452 Win=3925 Len=0 TSval=2851334825 TSecr=1266280310"
"419","1.412357","151.101.1.140","100.86.243.187","TLSv1.2","323","Application Data"
"420","1.412358","151.101.1.140","100.86.243.187","TLSv1.2","217","Application Data"
"421","1.412359","151.101.1.140","100.86.243.187","TLSv1.2","196","Application Data"
"422","1.412360","151.101.1.140","100.86.243.187","TLSv1.2","290","Application Data"
"423","1.412360","151.101.1.140","100.86.243.187","TLSv1.2","194","Application Data"
"424","1.412428","151.101.1.140","100.86.243.187","TLSv1.2","180","Application Data"
"425","1.412429","151.101.1.140","100.86.243.187","TLSv1.2","182","Application Data"
"426","1.412895","100.86.243.187","151.101.1.140","TCP","66","56485  >  443 [ACK] Seq=37378 Ack=55572 Win=3925 Len=0 TSval=2851334828 TSecr=1266280314"
"427","1.413114","151.101.1.140","100.86.243.187","TLSv1.2","829","Application Data"
"428","1.413164","151.101.1.140","100.86.243.187","TLSv1.2","414","Application Data"
"429","1.413165","151.101.1.140","100.86.243.187","TLSv1.2","198","Application Data"
"430","1.413480","100.86.243.187","151.101.1.140","TCP","66","56485  >  443 [ACK] Seq=37378 Ack=56815 Win=3925 Len=0 TSval=2851334828 TSecr=1266280315"
"431","1.413575","151.101.1.140","100.86.243.187","TLSv1.2","146","Application Data"
"432","1.413576","151.101.1.140","100.86.243.187","TLSv1.2","131","Application Data"
"433","1.413780","100.86.243.187","151.101.1.140","TCP","66","56485  >  443 [ACK] Seq=37378 Ack=56960 Win=3925 Len=0 TSval=2851334830 TSecr=1266280315"
"434","1.414176","151.101.1.140","100.86.243.187","TLSv1.2","176","Application Data"
"435","1.414325","100.86.243.187","151.101.1.140","TCP","66","56485  >  443 [ACK] Seq=37378 Ack=57070 Win=3925 Len=0 TSval=2851334830 TSecr=1266280316"
"436","1.415417","151.101.1.140","100.86.243.187","TLSv1.2","1000","Application Data"
"437","1.415712","100.86.243.187","151.101.1.140","TCP","66","56485  >  443 [ACK] Seq=37378 Ack=58004 Win=3925 Len=0 TSval=2851334832 TSecr=1266280317"
"438","1.422485","151.101.1.140","100.86.243.187","TLSv1.2","159","Application Data"
"439","1.422764","100.86.243.187","151.101.1.140","TCP","66","56485  >  443 [ACK] Seq=37378 Ack=58097 Win=3925 Len=0 TSval=2851334839 TSecr=1266280324"
"440","1.423399","151.101.1.140","100.86.243.187","TLSv1.2","243","Application Data"
"441","1.423400","151.101.1.140","100.86.243.187","TLSv1.2","807","Application Data"
"442","1.423668","100.86.243.187","151.101.1.140","TCP","66","56485  >  443 [ACK] Seq=37378 Ack=59015 Win=3925 Len=0 TSval=2851334840 TSecr=1266280325"
"443","1.423845","151.101.1.140","100.86.243.187","TLSv1.2","786","Application Data"
"444","1.424060","100.86.243.187","151.101.1.140","TCP","66","56485  >  443 [ACK] Seq=37378 Ack=59735 Win=3925 Len=0 TSval=2851334840 TSecr=1266280326"
"445","1.424726","151.101.1.140","100.86.243.187","TLSv1.2","143","Application Data"
"446","1.424855","100.86.243.187","151.101.1.140","TCP","66","56485  >  443 [ACK] Seq=37378 Ack=59812 Win=3925 Len=0 TSval=2851334841 TSecr=1266280327"
"447","1.425541","151.101.1.140","100.86.243.187","TLSv1.2","1028","Application Data"
"448","1.425660","100.86.243.187","151.101.1.140","TCP","66","56485  >  443 [ACK] Seq=37378 Ack=60774 Win=3925 Len=0 TSval=2851334841 TSecr=1266280327"
"449","1.426292","151.101.1.140","100.86.243.187","TLSv1.2","498","Application Data"
"450","1.426412","100.86.243.187","151.101.1.140","TCP","66","56485  >  443 [ACK] Seq=37378 Ack=61206 Win=3925 Len=0 TSval=2851334842 TSecr=1266280328"
"451","1.426554","151.101.1.140","100.86.243.187","TLSv1.2","376","Application Data"
"452","1.426669","100.86.243.187","151.101.1.140","TCP","66","56485  >  443 [ACK] Seq=37378 Ack=61516 Win=3925 Len=0 TSval=2851334842 TSecr=1266280328"
"453","1.429025","151.101.1.140","100.86.243.187","TLSv1.2","465","Application Data"
"454","1.429026","151.101.1.140","100.86.243.187","TLSv1.2","448","Application Data"
"455","1.429027","151.101.1.140","100.86.243.187","TLSv1.2","345","Application Data"
"456","1.429389","100.86.243.187","151.101.1.140","TCP","66","56485  >  443 [ACK] Seq=37378 Ack=62576 Win=3925 Len=0 TSval=2851334845 TSecr=1266280330"
"457","1.430604","151.101.1.140","100.86.243.187","TLSv1.2","404","Application Data"
"458","1.430605","151.101.1.140","100.86.243.187","TLSv1.2","394","Application Data"
"459","1.430606","151.101.1.140","100.86.243.187","TLSv1.2","164","Application Data"
"460","1.430606","151.101.1.140","100.86.243.187","TLSv1.2","561","Application Data"
"461","1.430607","151.101.1.140","100.86.243.187","TLSv1.2","296","Application Data"
"462","1.431015","100.86.243.187","151.101.1.140","TCP","66","56485  >  443 [ACK] Seq=37378 Ack=64065 Win=3925 Len=0 TSval=2851334847 TSecr=1266280330"
"463","1.432981","151.101.1.140","100.86.243.187","TLSv1.2","1188","Application Data, Application Data"
"464","1.433342","100.86.243.187","151.101.1.140","TCP","66","56485  >  443 [ACK] Seq=37378 Ack=65187 Win=3925 Len=0 TSval=2851334849 TSecr=1266280335"
"498","1.733340","100.86.243.187","151.101.1.140","TLSv1.2","170","Application Data"
"519","1.744399","151.101.1.140","100.86.243.187","TCP","66","443  >  56520 [ACK] Seq=1 Ack=105 Win=296 Len=0 TSval=2144895943 TSecr=2085367856"
"520","1.744400","151.101.1.140","100.86.243.187","TLSv1.2","198","Application Data"
"521","1.744401","151.101.1.140","100.86.243.187","TCP","1510","443  >  56520 [ACK] Seq=133 Ack=105 Win=296 Len=1444 TSval=2144895944 TSecr=2085367856 [TCP PDU reassembled in 548]"
"522","1.744446","151.101.1.140","100.86.243.187","TCP","1510","443  >  56520 [ACK] Seq=1577 Ack=105 Win=296 Len=1444 TSval=2144895944 TSecr=2085367856 [TCP PDU reassembled in 548]"
"523","1.744447","151.101.1.140","100.86.243.187","TCP","1510","443  >  56520 [PSH, ACK] Seq=3021 Ack=105 Win=296 Len=1444 TSval=2144895944 TSecr=2085367856 [TCP PDU reassembled in 548]"
"525","1.744517","100.86.243.187","151.101.1.140","TCP","66","56520  >  443 [ACK] Seq=105 Ack=1577 Win=2860 Len=0 TSval=2085367867 TSecr=2144895944"
"526","1.744586","100.86.243.187","151.101.1.140","TCP","66","56520  >  443 [ACK] Seq=105 Ack=4465 Win=2815 Len=0 TSval=2085367867 TSecr=2144895944"
"527","1.744845","100.86.243.187","151.101.1.140","TCP","66","[TCP Window Update] 56520  >  443 [ACK] Seq=105 Ack=4465 Win=2885 Len=0 TSval=2085367868 TSecr=2144895944"
"528","1.745156","151.101.1.140","100.86.243.187","TCP","1510","443  >  56520 [ACK] Seq=4465 Ack=105 Win=296 Len=1444 TSval=2144895945 TSecr=2085367856 [TCP PDU reassembled in 548]"
"529","1.745159","151.101.1.140","100.86.243.187","TCP","1510","443  >  56520 [ACK] Seq=5909 Ack=105 Win=296 Len=1444 TSval=2144895945 TSecr=2085367856 [TCP PDU reassembled in 548]"
"530","1.745160","151.101.1.140","100.86.243.187","TCP","1510","443  >  56520 [PSH, ACK] Seq=7353 Ack=105 Win=296 Len=1444 TSval=2144895945 TSecr=2085367856 [TCP PDU reassembled in 548]"
"531","1.745239","100.86.243.187","151.101.1.140","TCP","66","56520  >  443 [ACK] Seq=105 Ack=8797 Win=2817 Len=0 TSval=2085367868 TSecr=2144895945"
"533","1.745411","100.86.243.187","151.101.1.140","TCP","66","[TCP Window Update] 56520  >  443 [ACK] Seq=105 Ack=8797 Win=2885 Len=0 TSval=2085367868 TSecr=2144895945"
"538","1.745970","151.101.1.140","100.86.243.187","TCP","1510","443  >  56520 [ACK] Seq=8797 Ack=105 Win=296 Len=1444 TSval=2144895946 TSecr=2085367856 [TCP PDU reassembled in 548]"
"539","1.745972","151.101.1.140","100.86.243.187","TCP","1510","443  >  56520 [ACK] Seq=10241 Ack=105 Win=296 Len=1444 TSval=2144895946 TSecr=2085367856 [TCP PDU reassembled in 548]"
"540","1.746045","100.86.243.187","151.101.1.140","TCP","66","56520  >  443 [ACK] Seq=105 Ack=11685 Win=2840 Len=0 TSval=2085367869 TSecr=2144895946"
"541","1.746543","151.101.1.140","100.86.243.187","TCP","1510","443  >  56520 [PSH, ACK] Seq=11685 Ack=105 Win=296 Len=1444 TSval=2144895946 TSecr=2085367856 [TCP PDU reassembled in 548]"
"542","1.746638","100.86.243.187","151.101.1.140","TCP","66","56520  >  443 [ACK] Seq=105 Ack=13129 Win=2862 Len=0 TSval=2085367869 TSecr=2144895946"
"545","1.747176","151.101.1.140","100.86.243.187","TCP","1510","443  >  56520 [ACK] Seq=13129 Ack=105 Win=296 Len=1444 TSval=2144895946 TSecr=2085367856 [TCP PDU reassembled in 548]"
"546","1.747177","151.101.1.140","100.86.243.187","TCP","1510","443  >  56520 [ACK] Seq=14573 Ack=105 Win=296 Len=1444 TSval=2144895946 TSecr=2085367856 [TCP PDU reassembled in 548]"
"547","1.747254","100.86.243.187","151.101.1.140","TCP","66","56520  >  443 [ACK] Seq=105 Ack=16017 Win=2840 Len=0 TSval=2085367870 TSecr=2144895946"
"548","1.748384","151.101.1.140","100.86.243.187","TLSv1.2","1510","Application Data"
"549","1.748389","151.101.1.140","100.86.243.187","TCP","1510","443  >  56520 [ACK] Seq=17461 Ack=105 Win=296 Len=1444 TSval=2144895947 TSecr=2085367856 [TCP PDU reassembled in 571]"
"550","1.748390","151.101.1.140","100.86.243.187","TCP","1510","443  >  56520 [ACK] Seq=18905 Ack=105 Win=296 Len=1444 TSval=2144895947 TSecr=2085367856 [TCP PDU reassembled in 571]"
"551","1.748491","100.86.243.187","151.101.1.140","TCP","66","56520  >  443 [ACK] Seq=105 Ack=20349 Win=2817 Len=0 TSval=2085367871 TSecr=2144895947"
"552","1.748551","151.101.1.140","100.86.243.187","TCP","1510","443  >  56520 [PSH, ACK] Seq=20349 Ack=105 Win=296 Len=1444 TSval=2144895947 TSecr=2085367856 [TCP PDU reassembled in 571]"
"553","1.748610","100.86.243.187","151.101.1.140","TCP","66","56520  >  443 [ACK] Seq=105 Ack=21793 Win=2794 Len=0 TSval=2085367871 TSecr=2144895947"
"554","1.748950","151.101.1.140","100.86.243.187","TCP","1510","443  >  56520 [ACK] Seq=21793 Ack=105 Win=296 Len=1444 TSval=2144895948 TSecr=2085367856 [TCP PDU reassembled in 571]"
"555","1.748951","151.101.1.140","100.86.243.187","TCP","1510","443  >  56520 [ACK] Seq=23237 Ack=105 Win=296 Len=1444 TSval=2144895948 TSecr=2085367856 [TCP PDU reassembled in 571]"
"556","1.749014","100.86.243.187","151.101.1.140","TCP","66","56520  >  443 [ACK] Seq=105 Ack=24681 Win=2757 Len=0 TSval=2085367871 TSecr=2144895948"
"557","1.749382","100.86.243.187","151.101.1.140","TCP","66","[TCP Window Update] 56520  >  443 [ACK] Seq=105 Ack=24681 Win=2885 Len=0 TSval=2085367871 TSecr=2144895948"
"558","1.749816","151.101.1.140","100.86.243.187","TCP","1510","443  >  56520 [PSH, ACK] Seq=24681 Ack=105 Win=296 Len=1444 TSval=2144895948 TSecr=2085367856 [TCP PDU reassembled in 571]"
"559","1.749817","151.101.1.140","100.86.243.187","TCP","1510","443  >  56520 [ACK] Seq=26125 Ack=105 Win=296 Len=1444 TSval=2144895949 TSecr=2085367856 [TCP PDU reassembled in 571]"
"560","1.749822","151.101.1.140","100.86.243.187","TCP","1510","443  >  56520 [ACK] Seq=27569 Ack=105 Win=296 Len=1444 TSval=2144895949 TSecr=2085367856 [TCP PDU reassembled in 571]"
"561","1.749904","100.86.243.187","151.101.1.140","TCP","66","56520  >  443 [ACK] Seq=105 Ack=29013 Win=2817 Len=0 TSval=2085367873 TSecr=2144895949"
"562","1.750002","100.86.243.187","151.101.1.140","TCP","66","[TCP Window Update] 56520  >  443 [ACK] Seq=105 Ack=29013 Win=2885 Len=0 TSval=2085367873 TSecr=2144895949"
"563","1.750446","151.101.1.140","100.86.243.187","TCP","1510","443  >  56520 [PSH, ACK] Seq=29013 Ack=105 Win=296 Len=1444 TSval=2144895949 TSecr=2085367856 [TCP PDU reassembled in 571]"
"565","1.750524","100.86.243.187","151.101.1.140","TCP","66","56520  >  443 [ACK] Seq=105 Ack=30457 Win=2862 Len=0 TSval=2085367873 TSecr=2144895949"
"568","1.750676","151.101.1.140","100.86.243.187","TCP","1510","443  >  56520 [ACK] Seq=30457 Ack=105 Win=296 Len=1444 TSval=2144895950 TSecr=2085367856 [TCP PDU reassembled in 571]"
"569","1.750736","100.86.243.187","151.101.1.140","TCP","66","56520  >  443 [ACK] Seq=105 Ack=31901 Win=2862 Len=0 TSval=2085367873 TSecr=2144895950"
"571","1.750967","151.101.1.140","100.86.243.187","TLSv1.2","1510","Application Data"
"572","1.750968","151.101.1.140","100.86.243.187","TCP","1510","443  >  56520 [PSH, ACK] Seq=33345 Ack=105 Win=296 Len=1444 TSval=2144895950 TSecr=2085367856 [TCP PDU reassembled in 593]"
"573","1.751027","100.86.243.187","151.101.1.140","TCP","66","56520  >  443 [ACK] Seq=105 Ack=34789 Win=2840 Len=0 TSval=2085367874 TSecr=2144895950"
"577","1.751205","151.101.1.140","100.86.243.187","TCP","1510","443  >  56520 [ACK] Seq=34789 Ack=105 Win=296 Len=1444 TSval=2144895951 TSecr=2085367856 [TCP PDU reassembled in 593]"
"578","1.751227","151.101.1.140","100.86.243.187","TCP","1510","443  >  56520 [ACK] Seq=36233 Ack=105 Win=296 Len=1444 TSval=2144895951 TSecr=2085367856 [TCP PDU reassembled in 593]"
"579","1.751311","100.86.243.187","151.101.1.140","TCP","66","56520  >  443 [ACK] Seq=105 Ack=37677 Win=2840 Len=0 TSval=2085367874 TSecr=2144895951"
"580","1.753627","151.101.1.140","100.86.243.187","TCP","1510","443  >  56520 [PSH, ACK] Seq=37677 Ack=105 Win=296 Len=1444 TSval=2144895951 TSecr=2085367856 [TCP PDU reassembled in 593]"
"585","1.753636","151.101.1.140","100.86.243.187","TCP","1510","443  >  56520 [ACK] Seq=39121 Ack=105 Win=296 Len=1444 TSval=2144895952 TSecr=2085367856 [TCP PDU reassembled in 593]"
"586","1.753746","100.86.243.187","151.101.1.140","TCP","66","56520  >  443 [ACK] Seq=105 Ack=40565 Win=2840 Len=0 TSval=2085367877 TSecr=2144895952"
"589","1.755853","151.101.1.140","100.86.243.187","TCP","1510","443  >  56520 [ACK] Seq=40565 Ack=105 Win=296 Len=1444 TSval=2144895952 TSecr=2085367856 [TCP PDU reassembled in 593]"
"590","1.755855","151.101.1.140","100.86.243.187","TCP","1510","443  >  56520 [PSH, ACK] Seq=42009 Ack=105 Win=296 Len=1444 TSval=2144895952 TSecr=2085367856 [TCP PDU reassembled in 593]"
"593","1.755857","151.101.1.140","100.86.243.187","TLSv1.2","317","Application Data"
"596","1.755986","100.86.243.187","151.101.1.140","TCP","66","56520  >  443 [ACK] Seq=105 Ack=43704 Win=2836 Len=0 TSval=2085367879 TSecr=2144895952"
"598","1.756114","100.86.243.187","151.101.1.140","TCP","66","[TCP Window Update] 56520  >  443 [ACK] Seq=105 Ack=43704 Win=2885 Len=0 TSval=2085367879 TSecr=2144895952"
"1318","2.300450","100.86.243.187","151.101.1.140","TCP","1514","56485  >  443 [ACK] Seq=37378 Ack=65187 Win=3925 Len=1448 TSval=2851335716 TSecr=1266280335 [TCP PDU reassembled in 1320]"
"1319","2.300456","100.86.243.187","151.101.1.140","TCP","1514","56485  >  443 [ACK] Seq=38826 Ack=65187 Win=3925 Len=1448 TSval=2851335716 TSecr=1266280335 [TCP PDU reassembled in 1320]"
"1320","2.300513","100.86.243.187","151.101.1.140","TLSv1.2","185","Application Data"
"1321","2.300538","100.86.243.187","151.101.1.140","TLSv1.2","146","Application Data"
"1331","2.308223","100.86.243.187","151.101.1.140","TCP","1514","56485  >  443 [ACK] Seq=40473 Ack=65187 Win=3925 Len=1448 TSval=2851335724 TSecr=1266280335 [TCP PDU reassembled in 1333]"
"1332","2.308224","100.86.243.187","151.101.1.140","TCP","1514","56485  >  443 [ACK] Seq=41921 Ack=65187 Win=3925 Len=1448 TSval=2851335724 TSecr=1266280335 [TCP PDU reassembled in 1333]"
"1333","2.308255","100.86.243.187","151.101.1.140","TLSv1.2","179","Application Data"
"1334","2.308307","100.86.243.187","151.101.1.140","TLSv1.2","901","Application Data"
"1335","2.323375","151.101.1.140","100.86.243.187","TCP","66","443  >  56485 [ACK] Seq=65187 Ack=40473 Win=634 Len=0 TSval=1266281214 TSecr=2851335716"
"1342","2.326875","151.101.1.140","100.86.243.187","TCP","66","443  >  56485 [ACK] Seq=65187 Ack=44317 Win=628 Len=0 TSval=1266281220 TSecr=2851335724"
"1346","2.332754","151.101.1.140","100.86.243.187","TCP","1510","443  >  56485 [ACK] Seq=65187 Ack=44317 Win=639 Len=1444 TSval=1266281235 TSecr=2851335724 [TCP PDU reassembled in 1348]"
"1347","2.332884","100.86.243.187","151.101.1.140","TCP","66","56485  >  443 [ACK] Seq=44317 Ack=66631 Win=3903 Len=0 TSval=2851335749 TSecr=1266281235"
"1348","2.333393","151.101.1.140","100.86.243.187","TLSv1.2","1286","Application Data"
"1349","2.333464","100.86.243.187","151.101.1.140","TCP","66","56485  >  443 [ACK] Seq=44317 Ack=67851 Win=3906 Len=0 TSval=2851335749 TSecr=1266281235"
"1357","2.341183","151.101.1.140","100.86.243.187","TCP","1510","443  >  56485 [ACK] Seq=67851 Ack=44317 Win=639 Len=1444 TSval=1266281243 TSecr=2851335724 [TCP PDU reassembled in 1358]"
"1358","2.341186","151.101.1.140","100.86.243.187","TLSv1.2","907","Application Data"
"1360","2.341296","100.86.243.187","151.101.1.140","TCP","66","56485  >  443 [ACK] Seq=44317 Ack=70136 Win=3890 Len=0 TSval=2851335757 TSecr=1266281243"
"1782","2.770452","151.101.1.140","100.86.243.187","TLSv1.2","1035","Application Data"
"1783","2.770529","100.86.243.187","151.101.1.140","TCP","66","56485  >  443 [ACK] Seq=44317 Ack=71105 Win=3910 Len=0 TSval=2851336186 TSecr=1266281672"
"1788","2.773759","151.101.1.140","100.86.243.187","TLSv1.2","113","Application Data"
"1789","2.773872","100.86.243.187","151.101.1.140","TCP","66","56485  >  443 [ACK] Seq=44317 Ack=71152 Win=3925 Len=0 TSval=2851336190 TSecr=1266281676"
