"No.","Time","Source","Destination","Protocol","Length","Info"
"1","0.000000","151.101.65.140","100.86.243.187","TLSv1.2","577","Application Data"
"2","0.000071","100.86.243.187","151.101.65.140","TCP","66","56277  >  443 [ACK] Seq=1 Ack=512 Win=2537 Len=0 TSval=4146159251 TSecr=1902535153"
"3","0.002205","151.101.65.140","100.86.243.187","TLSv1.2","145","Application Data"
"4","0.002271","100.86.243.187","151.101.65.140","TCP","66","56277  >  443 [ACK] Seq=1 Ack=591 Win=2544 Len=0 TSval=4146159253 TSecr=1902535158"
"5","0.010487","151.101.65.140","100.86.243.187","TLSv1.2","413","Application Data"
"6","0.010550","100.86.243.187","151.101.65.140","TCP","66","56277  >  443 [ACK] Seq=1 Ack=938 Win=2540 Len=0 TSval=4146159261 TSecr=1902535164"
"7","0.012004","151.101.65.140","100.86.243.187","TLSv1.2","249","Application Data"
"8","0.012070","100.86.243.187","151.101.65.140","TCP","66","56277  >  443 [ACK] Seq=1 Ack=1121 Win=2542 Len=0 TSval=4146159263 TSecr=1902535167"
"9","0.017674","151.101.65.140","100.86.243.187","TLSv1.2","261","Application Data"
"10","0.017748","100.86.243.187","151.101.65.140","TCP","66","56277  >  443 [ACK] Seq=1 Ack=1316 Win=2542 Len=0 TSval=4146159268 TSecr=1902535171"
"11","0.019113","151.101.65.140","100.86.243.187","TLSv1.2","272","Application Data"
"12","0.019113","151.101.65.140","100.86.243.187","TLSv1.2","920","Application Data"
"13","0.019114","151.101.65.140","100.86.243.187","TLSv1.2","418","Application Data"
"14","0.019114","151.101.65.140","100.86.243.187","TLSv1.2","219","Application Data"
"15","0.019115","151.101.65.140","100.86.243.187","TLSv1.2","981","Application Data"
"16","0.019116","151.101.65.140","100.86.243.187","TLSv1.2","731","Application Data"
"17","0.019116","151.101.65.140","100.86.243.187","TLSv1.2","487","Application Data"
"18","0.019117","151.101.65.140","100.86.243.187","TLSv1.2","706","Application Data"
"19","0.019118","151.101.65.140","100.86.243.187","TCP","1510","443  >  56277 [ACK] Seq=5522 Ack=1 Win=1278 Len=1444 TSval=1902535174 TSecr=4146159253 [TCP PDU reassembled in 20]"
"20","0.019119","151.101.65.140","100.86.243.187","TLSv1.2","101","Application Data"
"21","0.019119","151.101.65.140","100.86.243.187","TLSv1.2","822","Application Data, Application Data, Application Data"
"22","0.019182","100.86.243.187","151.101.65.140","TCP","66","56277  >  443 [ACK] Seq=1 Ack=7757 Win=2445 Len=0 TSval=4146159270 TSecr=1902535174"
"23","0.019432","100.86.243.187","151.101.65.140","TCP","66","[TCP Window Update] 56277  >  443 [ACK] Seq=1 Ack=7757 Win=2545 Len=0 TSval=4146159270 TSecr=1902535174"
"24","0.021522","151.101.65.140","100.86.243.187","TLSv1.2","1510","Application Data"
"25","0.021583","100.86.243.187","151.101.65.140","TCP","66","56277  >  443 [ACK] Seq=1 Ack=9201 Win=2523 Len=0 TSval=4146159272 TSecr=1902535177"
"26","0.023078","151.101.65.140","100.86.243.187","TLSv1.2","1510","Application Data, Application Data, Application Data"
"27","0.023153","100.86.243.187","151.101.65.140","TCP","66","56277  >  443 [ACK] Seq=1 Ack=10645 Win=2523 Len=0 TSval=4146159274 TSecr=1902535178"
"28","0.029781","151.101.65.140","100.86.243.187","TLSv1.2","1510","Application Data, Application Data, Application Data, Application Data"
"29","0.029782","151.101.65.140","100.86.243.187","TLSv1.2","1510","Application Data, Application Data, Application Data, Application Data"
"30","0.029782","151.101.65.140","100.86.243.187","TLSv1.2","1510","Application Data, Application Data, Application Data, Application Data, Application Data"
"31","0.029783","151.101.65.140","100.86.243.187","TLSv1.2","338","Application Data, Application Data"
"32","0.029864","151.101.65.140","100.86.243.187","TCP","1510","443  >  56277 [ACK] Seq=15249 Ack=1 Win=1278 Len=1444 TSval=1902535185 TSecr=4146159270 [TCP PDU reassembled in 33]"
"33","0.029865","151.101.65.140","100.86.243.187","TLSv1.2","238","Application Data"
"34","0.029885","100.86.243.187","151.101.65.140","TCP","66","56277  >  443 [ACK] Seq=1 Ack=15249 Win=2473 Len=0 TSval=4146159280 TSecr=1902535185"
"35","0.029920","100.86.243.187","151.101.65.140","TCP","66","56277  >  443 [ACK] Seq=1 Ack=16865 Win=2448 Len=0 TSval=4146159280 TSecr=1902535185"
"36","0.030068","100.86.243.187","151.101.65.140","TCP","66","[TCP Window Update] 56277  >  443 [ACK] Seq=1 Ack=16865 Win=2545 Len=0 TSval=4146159280 TSecr=1902535185"
"37","0.044766","151.101.65.140","100.86.243.187","TLSv1.2","425","Application Data"
"38","0.044826","100.86.243.187","151.101.65.140","TCP","66","56277  >  443 [ACK] Seq=1 Ack=17224 Win=2540 Len=0 TSval=4146159295 TSecr=1902535199"
"39","0.046788","151.101.65.140","100.86.243.187","TLSv1.2","246","Application Data"
"40","0.046854","100.86.243.187","151.101.65.140","TCP","66","56277  >  443 [ACK] Seq=1 Ack=17404 Win=2542 Len=0 TSval=4146159297 TSecr=1902535202"
"41","0.071620","151.101.65.140","100.86.243.187","TCP","1510","443  >  56277 [ACK] Seq=17404 Ack=1 Win=1278 Len=1444 TSval=1902535225 TSecr=4146159297 [TCP PDU reassembled in 48]"
"42","0.071621","151.101.65.140","100.86.243.187","TCP","1510","443  >  56277 [PSH, ACK] Seq=18848 Ack=1 Win=1278 Len=1444 TSval=1902535225 TSecr=4146159297 [TCP PDU reassembled in 48]"
"43","0.071623","151.101.65.140","100.86.243.187","TCP","1510","443  >  56277 [ACK] Seq=20292 Ack=1 Win=1278 Len=1444 TSval=1902535226 TSecr=4146159297 [TCP PDU reassembled in 48]"
"44","0.071624","151.101.65.140","100.86.243.187","TCP","1510","443  >  56277 [PSH, ACK] Seq=21736 Ack=1 Win=1278 Len=1444 TSval=1902535226 TSecr=4146159297 [TCP PDU reassembled in 48]"
"45","0.071625","151.101.65.140","100.86.243.187","TCP","1510","443  >  56277 [ACK] Seq=23180 Ack=1 Win=1278 Len=1444 TSval=1902535227 TSecr=4146159297 [TCP PDU reassembled in 48]"
"46","0.071699","100.86.243.187","151.101.65.140","TCP","66","56277  >  443 [ACK] Seq=1 Ack=24624 Win=2432 Len=0 TSval=4146159322 TSecr=1902535227"
"47","0.071775","100.86.243.187","151.101.65.140","TCP","66","[TCP Window Update] 56277  >  443 [ACK] Seq=1 Ack=24624 Win=2545 Len=0 TSval=4146159322 TSecr=1902535227"
"48","0.072069","151.101.65.140","100.86.243.187","TLSv1.2","157","Application Data"
"49","0.072125","100.86.243.187","151.101.65.140","TCP","66","56277  >  443 [ACK] Seq=1 Ack=24715 Win=2544 Len=0 TSval=4146159322 TSecr=1902535227"
"56","0.456867","100.86.243.187","151.101.65.140","TLSv1.2","231","Application Data"
"57","0.457546","100.86.243.187","151.101.65.140","TLSv1.2","156","Application Data"
"58","0.461305","100.86.243.187","151.101.65.140","TLSv1.2","166","Application Data"
"59","0.463464","100.86.243.187","151.101.65.140","TLSv1.2","156","Application Data"
"60","0.467525","100.86.243.187","151.101.65.140","TLSv1.2","101","Application Data"
"61","0.471834","100.86.243.187","151.101.65.140","TLSv1.2","101","Application Data"
"62","0.474142","100.86.243.187","151.101.65.140","TLSv1.2","101","Application Data"
"63","0.476043","100.86.243.187","151.101.65.140","TLSv1.2","101","Application Data"
"64","0.479466","100.86.243.187","151.101.65.140","TLSv1.2","156","Application Data"
"65","0.481293","100.86.243.187","151.101.65.140","TLSv1.2","171","Application Data"
"66","0.482206","151.101.65.140","100.86.243.187","TCP","66","443  >  56303 [ACK] Seq=1 Ack=516 Win=424 Len=0 TSval=1824788322 TSecr=2091614533"
"67","0.484134","151.101.65.140","100.86.243.187","TLSv1.2","1188","Application Data"
"68","0.484135","151.101.65.140","100.86.243.187","TLSv1.2","554","Application Data"
"69","0.484135","151.101.65.140","100.86.243.187","TCP","66","443  >  56303 [ACK] Seq=1611 Ack=551 Win=424 Len=0 TSval=1824788323 TSecr=2091614536"
"70","0.484191","100.86.243.187","151.101.65.140","TCP","66","56303  >  443 [ACK] Seq=781 Ack=1611 Win=2022 Len=0 TSval=2091614546 TSecr=1824788323"
"71","0.485346","100.86.243.187","151.101.65.140","TLSv1.2","160","Application Data"
"72","0.486451","100.86.243.187","151.101.65.140","TLSv1.2","157","Application Data"
"73","0.487628","151.101.65.140","100.86.243.187","TCP","66","443  >  56303 [ACK] Seq=1611 Ack=586 Win=424 Len=0 TSval=1824788327 TSecr=2091614537"
"74","0.489322","100.86.243.187","151.101.65.140","TLSv1.2","101","Application Data"
"75","0.490764","151.101.65.140","100.86.243.187","TCP","66","443  >  56303 [ACK] Seq=1611 Ack=676 Win=424 Len=0 TSval=1824788330 TSecr=2091614541"
"76","0.490764","151.101.65.140","100.86.243.187","TCP","66","443  >  56303 [ACK] Seq=1611 Ack=781 Win=424 Len=0 TSval=1824788331 TSecr=2091614543"
"77","0.491177","100.86.243.187","151.101.65.140","TLSv1.2","155","Application Data"
"78","0.493724","100.86.243.187","151.101.65.140","TLSv1.2","101","Application Data"
"79","0.495696","151.101.65.140","100.86.243.187","TLSv1.2","953","Application Data"
"80","0.495764","100.86.243.187","151.101.65.140","TCP","66","56303  >  443 [ACK] Seq=1125 Ack=2498 Win=2034 Len=0 TSval=2091614557 TSecr=1824788334"
"81","0.496058","151.101.65.140","100.86.243.187","TCP","66","443  >  56303 [ACK] Seq=2498 Ack=875 Win=424 Len=0 TSval=1824788335 TSecr=2091614547"
"82","0.496059","151.101.65.140","100.86.243.187","TLSv1.2","170","Application Data"
"83","0.496059","151.101.65.140","100.86.243.187","TLSv1.2","619","Application Data"
"84","0.496112","100.86.243.187","151.101.65.140","TCP","66","56303  >  443 [ACK] Seq=1125 Ack=3155 Win=2037 Len=0 TSval=2091614557 TSecr=1824788335"
"85","0.496325","151.101.65.140","100.86.243.187","TCP","66","443  >  56303 [ACK] Seq=3155 Ack=966 Win=424 Len=0 TSval=1824788336 TSecr=2091614548"
"86","0.497001","151.101.65.140","100.86.243.187","TLSv1.2","607","Application Data"
"87","0.497059","100.86.243.187","151.101.65.140","TCP","66","56303  >  443 [ACK] Seq=1125 Ack=3696 Win=2039 Len=0 TSval=2091614558 TSecr=1824788337"
"88","0.499546","151.101.65.140","100.86.243.187","TCP","66","443  >  56303 [ACK] Seq=3696 Ack=1001 Win=424 Len=0 TSval=1824788340 TSecr=2091614551"
"89","0.500963","151.101.65.140","100.86.243.187","TCP","66","443  >  56303 [ACK] Seq=3696 Ack=1090 Win=424 Len=0 TSval=1824788340 TSecr=2091614552"
"90","0.500964","151.101.65.140","100.86.243.187","TLSv1.2","167","Application Data"
"91","0.501023","100.86.243.187","151.101.65.140","TCP","66","56303  >  443 [ACK] Seq=1125 Ack=3797 Win=2046 Len=0 TSval=2091614562 TSecr=1824788341"
"92","0.502297","151.101.65.140","100.86.243.187","TLSv1.2","463","Application Data"
"93","0.502350","100.86.243.187","151.101.65.140","TCP","66","56303  >  443 [ACK] Seq=1125 Ack=4194 Win=2041 Len=0 TSval=2091614564 TSecr=1824788341"
"94","0.504099","100.86.243.187","151.101.65.140","TLSv1.2","167","Application Data"
"95","0.506199","151.101.65.140","100.86.243.187","TCP","66","443  >  56303 [ACK] Seq=4194 Ack=1125 Win=424 Len=0 TSval=1824788346 TSecr=2091614557"
"96","0.506531","100.86.243.187","151.101.65.140","TLSv1.2","170","Application Data"
"97","0.515651","100.86.243.187","151.101.65.140","TLSv1.2","244","Application Data"
"98","0.516476","151.101.65.140","100.86.243.187","TCP","66","443  >  56303 [ACK] Seq=4194 Ack=1226 Win=424 Len=0 TSval=1824788355 TSecr=2091614566"
"99","0.516476","151.101.65.140","100.86.243.187","TCP","66","443  >  56303 [ACK] Seq=4194 Ack=1330 Win=424 Len=0 TSval=1824788356 TSecr=2091614568"
"100","0.516477","151.101.65.140","100.86.243.187","TLSv1.2","614","Application Data"
"101","0.516477","151.101.65.140","100.86.243.187","TLSv1.2","168","Application Data"
"102","0.516538","100.86.243.187","151.101.65.140","TCP","66","56303  >  443 [ACK] Seq=1508 Ack=4844 Win=2037 Len=0 TSval=2091614577 TSecr=1824788357"
"103","0.517088","151.101.65.140","100.86.243.187","TLSv1.2","410","Application Data"
"104","0.517135","100.86.243.187","151.101.65.140","TCP","66","56303  >  443 [ACK] Seq=1508 Ack=5188 Win=2042 Len=0 TSval=2091614578 TSecr=1824788357"
"105","0.523802","100.86.243.187","151.101.65.140","TLSv1.2","157","Application Data"
"106","0.525926","151.101.65.140","100.86.243.187","TCP","66","443  >  56303 [ACK] Seq=5188 Ack=1508 Win=424 Len=0 TSval=1824788366 TSecr=2091614577"
"107","0.527419","151.101.65.140","100.86.243.187","TLSv1.2","169","Application Data"
"108","0.527420","151.101.65.140","100.86.243.187","TLSv1.2","571","Application Data"
"109","0.527474","100.86.243.187","151.101.65.140","TCP","66","56303  >  443 [ACK] Seq=1599 Ack=5796 Win=2038 Len=0 TSval=2091614588 TSecr=1824788366"
"110","0.534149","100.86.243.187","151.101.65.140","TLSv1.2","230","Application Data"
"111","0.536135","151.101.65.140","100.86.243.187","TCP","66","443  >  56303 [ACK] Seq=5796 Ack=1599 Win=424 Len=0 TSval=1824788375 TSecr=2091614585"
"112","0.536208","151.101.65.140","100.86.243.187","TLSv1.2","512","Application Data"
"113","0.536258","100.86.243.187","151.101.65.140","TCP","66","56303  >  443 [ACK] Seq=1763 Ack=6242 Win=2041 Len=0 TSval=2091614598 TSecr=1824788376"
"114","0.545300","100.86.243.187","151.101.65.140","TCP","1514","56277  >  443 [ACK] Seq=1 Ack=24715 Win=2545 Len=1448 TSval=4146159796 TSecr=1902535227 [TCP PDU reassembled in 115]"
"115","0.545332","100.86.243.187","151.101.65.140","TLSv1.2","1405","Application Data"
"116","0.545369","100.86.243.187","151.101.65.140","TLSv1.2","730","Application Data"
"117","0.546619","151.101.65.140","100.86.243.187","TCP","66","443  >  56303 [ACK] Seq=6242 Ack=1763 Win=424 Len=0 TSval=1824788385 TSecr=2091614598"
"118","0.546717","151.101.65.140","100.86.243.187","TLSv1.2","1336","Application Data"
"119","0.546767","100.86.243.187","151.101.65.140","TCP","66","56303  >  443 [ACK] Seq=1763 Ack=7512 Win=2028 Len=0 TSval=2091614608 TSecr=1824788386"
"120","0.547850","100.86.243.187","151.101.65.140","TLSv1.2","212","Application Data"
"121","0.558323","151.101.65.140","100.86.243.187","TCP","66","443  >  56277 [ACK] Seq=24715 Ack=3452 Win=1295 Len=0 TSval=1902535711 TSecr=4146159796"
"122","0.558324","151.101.65.140","100.86.243.187","TCP","66","443  >  56303 [ACK] Seq=7512 Ack=1909 Win=424 Len=0 TSval=1824788397 TSecr=2091614609"
"123","0.558324","151.101.65.140","100.86.243.187","TLSv1.2","170","Application Data"
"124","0.558324","151.101.65.140","100.86.243.187","TLSv1.2","370","Application Data"
"125","0.558394","100.86.243.187","151.101.65.140","TCP","66","56303  >  443 [ACK] Seq=1909 Ack=7920 Win=2041 Len=0 TSval=2091614620 TSecr=1824788398"
"126","0.579252","151.101.65.140","100.86.243.187","TCP","1510","443  >  56277 [ACK] Seq=24715 Ack=3452 Win=1295 Len=1444 TSval=1902535733 TSecr=4146159796 [TCP PDU reassembled in 127]"
"127","0.579253","151.101.65.140","100.86.243.187","TLSv1.2","235","Application Data"
"128","0.579318","100.86.243.187","151.101.65.140","TCP","66","56277  >  443 [ACK] Seq=3452 Ack=26328 Win=2520 Len=0 TSval=4146159830 TSecr=1902535733"
"163","0.669669","100.86.243.187","151.101.65.140","TCP","1514","56277  >  443 [ACK] Seq=3452 Ack=26328 Win=2545 Len=1448 TSval=4146159920 TSecr=1902535733 [TCP PDU reassembled in 164]"
"164","0.669698","100.86.243.187","151.101.65.140","TLSv1.2","1346","Application Data"
"165","0.681172","100.86.243.187","151.101.65.140","TLSv1.2","260","Application Data"
"166","0.683808","100.86.243.187","151.101.65.140","TLSv1.2","222","Application Data"
"167","0.685432","151.101.65.140","100.86.243.187","TCP","66","443  >  56277 [ACK] Seq=26328 Ack=6180 Win=1306 Len=0 TSval=1902535839 TSecr=4146159920"
"168","0.689310","100.86.243.187","151.101.65.140","TLSv1.2","101","Application Data"
"169","0.691497","151.101.65.140","100.86.243.187","TCP","66","443  >  56277 [ACK] Seq=26328 Ack=6374 Win=1306 Len=0 TSval=1902535846 TSecr=4146159932"
"170","0.691498","151.101.65.140","100.86.243.187","TCP","1510","443  >  56277 [ACK] Seq=26328 Ack=6374 Win=1306 Len=1444 TSval=1902535847 TSecr=4146159932 [TCP PDU reassembled in 175]"
"171","0.691574","100.86.243.187","151.101.65.140","TCP","66","56277  >  443 [ACK] Seq=6409 Ack=27772 Win=2523 Len=0 TSval=4146159942 TSecr=1902535847"
"172","0.692033","151.101.65.140","100.86.243.187","TCP","1510","443  >  56277 [PSH, ACK] Seq=27772 Ack=6374 Win=1306 Len=1444 TSval=1902535847 TSecr=4146159932 [TCP PDU reassembled in 175]"
"173","0.692101","100.86.243.187","151.101.65.140","TCP","66","56277  >  443 [ACK] Seq=6409 Ack=29216 Win=2523 Len=0 TSval=4146159942 TSecr=1902535847"
"174","0.692829","151.101.65.140","100.86.243.187","TCP","1510","443  >  56277 [ACK] Seq=29216 Ack=6374 Win=1306 Len=1444 TSval=1902535847 TSecr=4146159932 [TCP PDU reassembled in 175]"
"175","0.692830","151.101.65.140","100.86.243.187","TLSv1.2","935","Application Data"
"176","0.692890","100.86.243.187","151.101.65.140","TCP","66","56277  >  443 [ACK] Seq=6409 Ack=31529 Win=2509 Len=0 TSval=4146159943 TSecr=1902535847"
"177","0.693268","100.86.243.187","151.101.65.140","TLSv1.2","101","Application Data"
"178","0.694398","100.86.243.187","151.101.65.140","TCP","1514","56277  >  443 [ACK] Seq=6409 Ack=31529 Win=2545 Len=1448 TSval=4146159945 TSecr=1902535847 [TCP PDU reassembled in 179]"
"179","0.694422","100.86.243.187","151.101.65.140","TLSv1.2","1387","Application Data"
"180","0.694500","151.101.65.140","100.86.243.187","TCP","66","443  >  56303 [ACK] Seq=7920 Ack=2065 Win=424 Len=0 TSval=1824788534 TSecr=2091614745"
"181","0.695173","151.101.65.140","100.86.243.187","TLSv1.2","169","Application Data"
"182","0.695227","100.86.243.187","151.101.65.140","TCP","66","56303  >  443 [ACK] Seq=2100 Ack=8023 Win=2046 Len=0 TSval=2091614756 TSecr=1824788535"
"183","0.695662","151.101.65.140","100.86.243.187","TLSv1.2","509","Application Data"
"184","0.695717","100.86.243.187","151.101.65.140","TCP","66","56303  >  443 [ACK] Seq=2100 Ack=8466 Win=2041 Len=0 TSval=2091614757 TSecr=1824788535"
"185","0.701942","151.101.65.140","100.86.243.187","TCP","66","443  >  56277 [ACK] Seq=31529 Ack=6409 Win=1306 Len=0 TSval=1902535856 TSecr=4146159940"
"186","0.704518","151.101.65.140","100.86.243.187","TCP","66","443  >  56303 [ACK] Seq=8466 Ack=2100 Win=424 Len=0 TSval=1824788543 TSecr=2091614754"
"187","0.704518","151.101.65.140","100.86.243.187","TCP","66","443  >  56277 [ACK] Seq=31529 Ack=9178 Win=1317 Len=0 TSval=1902535860 TSecr=4146159945"
"188","0.706257","151.101.65.140","100.86.243.187","TLSv1.2","912","[TCP Previous segment not captured] , Ignored Unknown Record"
"189","0.706335","100.86.243.187","151.101.65.140","TCP","78","[TCP Dup ACK 176#1] 56277  >  443 [ACK] Seq=9178 Ack=31529 Win=2545 Len=0 TSval=4146159957 TSecr=1902535860 SLE=32973 SRE=33819"
"190","0.708566","100.86.243.187","151.101.65.140","TCP","1514","56277  >  443 [ACK] Seq=9178 Ack=31529 Win=2545 Len=1436 TSval=4146159959 TSecr=1902535860 SLE=32973 SRE=33819 [TCP PDU reassembled in 191]"
"191","0.708591","100.86.243.187","151.101.65.140","TLSv1.2","1447","Application Data"
"192","0.708912","100.86.243.187","151.101.65.140","TCP","1514","56277  >  443 [ACK] Seq=11983 Ack=31529 Win=2545 Len=1436 TSval=4146159959 TSecr=1902535860 SLE=32973 SRE=33819 [TCP PDU reassembled in 193]"
"193","0.708927","100.86.243.187","151.101.65.140","TLSv1.2","1462","Application Data"
"194","0.709166","100.86.243.187","151.101.65.140","TCP","1514","56277  >  443 [ACK] Seq=14803 Ack=31529 Win=2545 Len=1436 TSval=4146159959 TSecr=1902535860 SLE=32973 SRE=33819 [TCP PDU reassembled in 195]"
"195","0.709179","100.86.243.187","151.101.65.140","TLSv1.2","1439","Application Data"
"196","0.720634","151.101.65.140","100.86.243.187","TCP","66","443  >  56277 [ACK] Seq=33819 Ack=11983 Win=1328 Len=0 TSval=1902535874 TSecr=4146159959"
"197","0.720635","151.101.65.140","100.86.243.187","TCP","66","443  >  56277 [ACK] Seq=33819 Ack=17600 Win=1350 Len=0 TSval=1902535875 TSecr=4146159959"
"198","0.724204","151.101.65.140","100.86.243.187","TCP","1510","[TCP Retransmission] 443  >  56277 [ACK] Seq=31529 Ack=17600 Win=1350 Len=1444 TSval=1902535878 TSecr=4146159959"
"199","0.724273","100.86.243.187","151.101.65.140","TCP","66","56277  >  443 [ACK] Seq=17600 Ack=33819 Win=2509 Len=0 TSval=4146159975 TSecr=1902535878"
"201","0.735804","100.86.243.187","151.101.65.140","TCP","1514","56277  >  443 [ACK] Seq=17600 Ack=33819 Win=2545 Len=1448 TSval=4146159986 TSecr=1902535878 [TCP PDU reassembled in 202]"
"202","0.735837","100.86.243.187","151.101.65.140","TLSv1.2","1373","Application Data"
"203","0.740508","151.101.65.140","100.86.243.187","TCP","1510","443  >  56277 [ACK] Seq=33819 Ack=17600 Win=1350 Len=1444 TSval=1902535894 TSecr=4146159975 [TCP PDU reassembled in 204]"
"204","0.740509","151.101.65.140","100.86.243.187","TLSv1.2","357","Application Data"
"205","0.740589","100.86.243.187","151.101.65.140","TCP","66","56277  >  443 [ACK] Seq=20355 Ack=35554 Win=2518 Len=0 TSval=4146159991 TSecr=1902535894"
"206","0.747680","151.101.65.140","100.86.243.187","TCP","1510","443  >  56277 [ACK] Seq=35554 Ack=20355 Win=1362 Len=1444 TSval=1902535901 TSecr=4146159986 [TCP PDU reassembled in 207]"
"207","0.747681","151.101.65.140","100.86.243.187","TLSv1.2","918","Application Data"
"208","0.747862","100.86.243.187","151.101.65.140","TCP","66","56277  >  443 [ACK] Seq=20355 Ack=37850 Win=2509 Len=0 TSval=4146159998 TSecr=1902535901"
"209","0.749126","151.101.65.140","100.86.243.187","TCP","1510","443  >  56277 [ACK] Seq=37850 Ack=20355 Win=1362 Len=1444 TSval=1902535903 TSecr=4146159986 [TCP PDU reassembled in 210]"
"210","0.749128","151.101.65.140","100.86.243.187","TLSv1.2","328","Application Data"
"211","0.749208","100.86.243.187","151.101.65.140","TCP","66","56277  >  443 [ACK] Seq=20355 Ack=39556 Win=2519 Len=0 TSval=4146160000 TSecr=1902535903"
"212","0.760332","151.101.65.140","100.86.243.187","TCP","1510","443  >  56277 [ACK] Seq=39556 Ack=20355 Win=1362 Len=1444 TSval=1902535914 TSecr=4146159998 [TCP PDU reassembled in 213]"
"213","0.760333","151.101.65.140","100.86.243.187","TLSv1.2","892","Application Data"
"214","0.760333","151.101.65.140","100.86.243.187","TLSv1.2","112","Application Data"
"215","0.760423","100.86.243.187","151.101.65.140","TCP","66","56277  >  443 [ACK] Seq=20355 Ack=41872 Win=2509 Len=0 TSval=4146160011 TSecr=1902535915"
"216","0.769242","151.101.65.140","100.86.243.187","TCP","1510","443  >  56277 [ACK] Seq=41872 Ack=20355 Win=1362 Len=1444 TSval=1902535923 TSecr=4146160000 [TCP PDU reassembled in 217]"
"217","0.769243","151.101.65.140","100.86.243.187","TLSv1.2","283","Application Data"
"218","0.769328","100.86.243.187","151.101.65.140","TCP","66","56277  >  443 [ACK] Seq=20355 Ack=43533 Win=2519 Len=0 TSval=4146160020 TSecr=1902535923"
"219","0.782067","151.101.65.140","100.86.243.187","TLSv1.2","428","Application Data"
"220","0.782068","151.101.65.140","100.86.243.187","TLSv1.2","107","Application Data"
"221","0.782148","100.86.243.187","151.101.65.140","TCP","66","56277  >  443 [ACK] Seq=20355 Ack=43936 Win=2539 Len=0 TSval=4146160033 TSecr=1902535937"
"222","0.803266","151.101.65.140","100.86.243.187","TLSv1.2","1051","Application Data"
"223","0.803338","100.86.243.187","151.101.65.140","TCP","66","56277  >  443 [ACK] Seq=20355 Ack=44921 Win=2530 Len=0 TSval=4146160054 TSecr=1902535958"
"224","0.874451","151.101.65.140","100.86.243.187","TLSv1.2","1504","Application Data"
"225","0.874454","151.101.65.140","100.86.243.187","TLSv1.2","668","Application Data"
"226","0.874454","151.101.65.140","100.86.243.187","TLSv1.2","391","Application Data"
"227","0.874455","151.101.65.140","100.86.243.187","TLSv1.2","97","Application Data"
"228","0.874553","100.86.243.187","151.101.65.140","TCP","66","56277  >  443 [ACK] Seq=20355 Ack=47317 Win=2508 Len=0 TSval=4146160125 TSecr=1902536029"
"229","0.910027","100.86.243.187","151.101.65.140","TCP","1514","56277  >  443 [ACK] Seq=20355 Ack=47317 Win=2545 Len=1448 TSval=4146160160 TSecr=1902536029 [TCP PDU reassembled in 230]"
"230","0.910062","100.86.243.187","151.101.65.140","TLSv1.2","1401","Application Data"
"231","0.910106","100.86.243.187","151.101.65.140","TLSv1.2","222","Application Data"
"232","0.938994","100.86.243.187","151.101.65.140","TCP","1514","[TCP Retransmission] 56277  >  443 [PSH, ACK] Seq=21846 Ack=47317 Win=2545 Len=1448 TSval=4146160189 TSecr=1902536029"
"234","1.009687","151.101.65.140","100.86.243.187","TCP","66","443  >  56277 [ACK] Seq=47317 Ack=23294 Win=1373 Len=0 TSval=1902536163 TSecr=4146160160"
"235","1.009688","151.101.65.140","100.86.243.187","TCP","78","[TCP Dup ACK 234#1] 443  >  56277 [ACK] Seq=47317 Ack=23294 Win=1373 Len=0 TSval=1902536163 TSecr=4146160189 SLE=21846 SRE=23294"
"255","1.074308","151.101.65.140","100.86.243.187","TCP","1510","443  >  56277 [ACK] Seq=47317 Ack=23294 Win=1373 Len=1444 TSval=1902536228 TSecr=4146160189 [TCP PDU reassembled in 256]"
"256","1.074309","151.101.65.140","100.86.243.187","TLSv1.2","868","Application Data"
"257","1.074309","151.101.65.140","100.86.243.187","TLSv1.2","233","Application Data"
"258","1.074381","100.86.243.187","151.101.65.140","TCP","66","56277  >  443 [ACK] Seq=23294 Ack=49730 Win=2508 Len=0 TSval=4146160325 TSecr=1902536228"
"261","1.106188","151.101.65.140","100.86.243.187","TLSv1.2","825","Application Data"
"262","1.106253","100.86.243.187","151.101.65.140","TCP","66","56277  >  443 [ACK] Seq=23294 Ack=50489 Win=2533 Len=0 TSval=4146160356 TSecr=1902536262"
"264","1.205384","100.86.243.187","151.101.65.140","TCP","1514","56277  >  443 [ACK] Seq=23294 Ack=50489 Win=2545 Len=1448 TSval=4146160456 TSecr=1902536262 [TCP PDU reassembled in 265]"
"265","1.205421","100.86.243.187","151.101.65.140","TLSv1.2","1512","Application Data"
"268","1.218145","151.101.65.140","100.86.243.187","TCP","66","443  >  56277 [ACK] Seq=50489 Ack=24742 Win=1379 Len=0 TSval=1902536371 TSecr=4146160456"
"269","1.218146","151.101.65.140","100.86.243.187","TCP","66","443  >  56277 [ACK] Seq=50489 Ack=26188 Win=1384 Len=0 TSval=1902536372 TSecr=4146160456"
"270","1.218322","100.86.243.187","151.101.65.140","TCP","1514","56277  >  443 [ACK] Seq=26188 Ack=50489 Win=2545 Len=1448 TSval=4146160469 TSecr=1902536372 [TCP PDU reassembled in 271]"
"271","1.218349","100.86.243.187","151.101.65.140","TLSv1.2","1401","Application Data"
"272","1.218386","100.86.243.187","151.101.65.140","TLSv1.2","146","Application Data"
"273","1.231380","151.101.65.140","100.86.243.187","TCP","66","443  >  56277 [ACK] Seq=50489 Ack=28971 Win=1396 Len=0 TSval=1902536384 TSecr=4146160469"
"274","1.231381","151.101.65.140","100.86.243.187","TCP","66","443  >  56277 [ACK] Seq=50489 Ack=29051 Win=1396 Len=0 TSval=1902536384 TSecr=4146160469"
"275","1.249348","151.101.65.140","100.86.243.187","TCP","1510","443  >  56277 [ACK] Seq=50489 Ack=29051 Win=1396 Len=1444 TSval=1902536404 TSecr=4146160469 [TCP PDU reassembled in 277]"
"276","1.249434","100.86.243.187","151.101.65.140","TCP","66","56277  >  443 [ACK] Seq=29051 Ack=51933 Win=2523 Len=0 TSval=4146160500 TSecr=1902536404"
"277","1.249725","151.101.65.140","100.86.243.187","TLSv1.2","1280","Application Data"
"278","1.249769","100.86.243.187","151.101.65.140","TCP","66","56277  >  443 [ACK] Seq=29051 Ack=53147 Win=2526 Len=0 TSval=4146160500 TSecr=1902536404"
"279","1.265016","151.101.65.140","100.86.243.187","TCP","1510","443  >  56277 [ACK] Seq=53147 Ack=29051 Win=1396 Len=1444 TSval=1902536418 TSecr=4146160500 [TCP PDU reassembled in 281]"
"280","1.265093","100.86.243.187","151.101.65.140","TCP","66","56277  >  443 [ACK] Seq=29051 Ack=54591 Win=2523 Len=0 TSval=4146160515 TSecr=1902536418"
"281","1.265147","151.101.65.140","100.86.243.187","TLSv1.2","977","Application Data"
"282","1.265147","151.101.65.140","100.86.243.187","TLSv1.2","112","Application Data"
"283","1.265195","100.86.243.187","151.101.65.140","TCP","66","56277  >  443 [ACK] Seq=29051 Ack=55548 Win=2530 Len=0 TSval=4146160515 TSecr=1902536419"
"397","1.840557","100.86.243.187","151.101.65.140","TLSv1.2","176","Application Data"
"398","1.844761","100.86.243.187","151.101.65.140","TLSv1.2","101","Application Data"
"399","1.850322","151.101.65.140","100.86.243.187","TCP","66","443  >  56303 [ACK] Seq=8466 Ack=2210 Win=424 Len=0 TSval=1824789690 TSecr=2091615902"
"400","1.851174","151.101.65.140","100.86.243.187","TLSv1.2","207","Application Data"
"401","1.851229","100.86.243.187","151.101.65.140","TCP","66","56303  >  443 [ACK] Seq=2245 Ack=8607 Win=2045 Len=0 TSval=2091615912 TSecr=1824789691"
"402","1.851481","151.101.65.140","100.86.243.187","TCP","1510","443  >  56303 [ACK] Seq=8607 Ack=2210 Win=424 Len=1444 TSval=1824789691 TSecr=2091615902 [TCP PDU reassembled in 415]"
"403","1.851481","151.101.65.140","100.86.243.187","TCP","1510","443  >  56303 [PSH, ACK] Seq=10051 Ack=2210 Win=424 Len=1444 TSval=1824789691 TSecr=2091615902 [TCP PDU reassembled in 415]"
"404","1.851523","100.86.243.187","151.101.65.140","TCP","66","56303  >  443 [ACK] Seq=2245 Ack=11495 Win=2002 Len=0 TSval=2091615913 TSecr=1824789691"
"405","1.852997","151.101.65.140","100.86.243.187","TCP","1510","443  >  56303 [ACK] Seq=11495 Ack=2210 Win=424 Len=1444 TSval=1824789693 TSecr=2091615902 [TCP PDU reassembled in 415]"
"406","1.853064","100.86.243.187","151.101.65.140","TCP","66","56303  >  443 [ACK] Seq=2245 Ack=12939 Win=2025 Len=0 TSval=2091615914 TSecr=1824789693"
"407","1.855224","151.101.65.140","100.86.243.187","TCP","1510","443  >  56303 [PSH, ACK] Seq=12939 Ack=2210 Win=424 Len=1444 TSval=1824789693 TSecr=2091615902 [TCP PDU reassembled in 415]"
"408","1.855283","100.86.243.187","151.101.65.140","TCP","66","56303  >  443 [ACK] Seq=2245 Ack=14383 Win=2025 Len=0 TSval=2091615916 TSecr=1824789693"
"409","1.855482","151.101.65.140","100.86.243.187","TCP","1510","443  >  56303 [ACK] Seq=14383 Ack=2210 Win=424 Len=1444 TSval=1824789695 TSecr=2091615902 [TCP PDU reassembled in 415]"
"410","1.855528","100.86.243.187","151.101.65.140","TCP","66","56303  >  443 [ACK] Seq=2245 Ack=15827 Win=2025 Len=0 TSval=2091615916 TSecr=1824789695"
"411","1.856914","151.101.65.140","100.86.243.187","TCP","452","[TCP Previous segment not captured] 443  >  56303 [PSH, ACK] Seq=17271 Ack=2245 Win=424 Len=386 TSval=1824789697 TSecr=2091615906 [TCP PDU reassembled in 415]"
"412","1.856983","100.86.243.187","151.101.65.140","TCP","78","[TCP Dup ACK 410#1] 56303  >  443 [ACK] Seq=2245 Ack=15827 Win=2048 Len=0 TSval=2091615918 TSecr=1824789695 SLE=17271 SRE=17657"
"415","1.869508","151.101.65.140","100.86.243.187","TCP","1510","[TCP Retransmission] 443  >  56303 [ACK] Seq=15827 Ack=2245 Win=424 Len=1444 TSval=1824789710 TSecr=2091615918"
"416","1.869567","100.86.243.187","151.101.65.140","TCP","66","56303  >  443 [ACK] Seq=2245 Ack=17657 Win=2019 Len=0 TSval=2091615930 TSecr=1824789710"
"481","2.405488","151.101.65.140","100.86.243.187","TLSv1.2","257","Application Data"
"482","2.405557","100.86.243.187","151.101.65.140","TCP","66","56277  >  443 [ACK] Seq=29051 Ack=55739 Win=2542 Len=0 TSval=4146161656 TSecr=1902537561"
"484","2.405997","151.101.65.140","100.86.243.187","TLSv1.2","185","Application Data"
"485","2.406039","100.86.243.187","151.101.65.140","TCP","66","56277  >  443 [ACK] Seq=29051 Ack=55858 Win=2543 Len=0 TSval=4146161656 TSecr=1902537561"
"486","2.406808","151.101.65.140","100.86.243.187","TCP","1510","443  >  56277 [ACK] Seq=55858 Ack=29051 Win=1396 Len=1444 TSval=1902537561 TSecr=4146160515 [TCP PDU reassembled in 487]"
"487","2.407056","151.101.65.140","100.86.243.187","TLSv1.2","338","Application Data"
"488","2.407102","100.86.243.187","151.101.65.140","TCP","66","56277  >  443 [ACK] Seq=29051 Ack=57574 Win=2541 Len=0 TSval=4146161657 TSecr=1902537561"
"489","2.407753","151.101.65.140","100.86.243.187","TLSv1.2","1003","Application Data"
"490","2.407825","100.86.243.187","151.101.65.140","TCP","66","56277  >  443 [ACK] Seq=29051 Ack=58511 Win=2545 Len=0 TSval=4146161657 TSecr=1902537562"
"491","2.408072","151.101.65.140","100.86.243.187","TLSv1.2","1244","Application Data, Application Data"
"492","2.408158","100.86.243.187","151.101.65.140","TCP","66","56277  >  443 [ACK] Seq=29051 Ack=59689 Win=2545 Len=0 TSval=4146161658 TSecr=1902537563"
"493","2.409157","151.101.65.140","100.86.243.187","TLSv1.2","1085","Application Data"
"494","2.409242","100.86.243.187","151.101.65.140","TCP","66","56277  >  443 [ACK] Seq=29051 Ack=60708 Win=2545 Len=0 TSval=4146161659 TSecr=1902537563"
"495","2.410161","151.101.65.140","100.86.243.187","TLSv1.2","993","Application Data, Application Data, Application Data, Application Data"
"496","2.410304","151.101.65.140","100.86.243.187","TLSv1.2","1510","Application Data, Application Data, Application Data, Application Data"
"497","2.410305","151.101.65.140","100.86.243.187","TLSv1.2","210","Application Data"
"498","2.410325","100.86.243.187","151.101.65.140","TCP","66","56277  >  443 [ACK] Seq=29051 Ack=61635 Win=2545 Len=0 TSval=4146161660 TSecr=1902537564"
"499","2.410346","100.86.243.187","151.101.65.140","TCP","66","56277  >  443 [ACK] Seq=29051 Ack=63223 Win=2520 Len=0 TSval=4146161660 TSecr=1902537565"
"502","2.428267","151.101.65.140","100.86.243.187","TLSv1.2","1119","Application Data"
"503","2.428267","151.101.65.140","100.86.243.187","TLSv1.2","331","Application Data"
"504","2.428268","151.101.65.140","100.86.243.187","TLSv1.2","352","Application Data"
"505","2.428268","151.101.65.140","100.86.243.187","TLSv1.2","486","Application Data"
"506","2.428350","100.86.243.187","151.101.65.140","TCP","66","56277  >  443 [ACK] Seq=29051 Ack=65247 Win=2514 Len=0 TSval=4146161678 TSecr=1902537580"
"508","2.445629","151.101.65.140","100.86.243.187","TLSv1.2","269","Application Data"
"509","2.445707","100.86.243.187","151.101.65.140","TCP","66","56277  >  443 [ACK] Seq=29051 Ack=65450 Win=2542 Len=0 TSval=4146161696 TSecr=1902537599"
"510","2.447235","151.101.65.140","100.86.243.187","TLSv1.2","351","Application Data"
"511","2.447236","151.101.65.140","100.86.243.187","TLSv1.2","259","Application Data"
"512","2.447389","100.86.243.187","151.101.65.140","TCP","66","56277  >  443 [ACK] Seq=29051 Ack=65928 Win=2545 Len=0 TSval=4146161697 TSecr=1902537602"
"513","2.447927","151.101.65.140","100.86.243.187","TLSv1.2","547","Application Data"
"514","2.448023","100.86.243.187","151.101.65.140","TCP","66","56277  >  443 [ACK] Seq=29051 Ack=66409 Win=2545 Len=0 TSval=4146161697 TSecr=1902537602"
"515","2.448668","151.101.65.140","100.86.243.187","TLSv1.2","1332","Application Data"
"516","2.448669","151.101.65.140","100.86.243.187","TLSv1.2","533","Application Data"
"517","2.448726","100.86.243.187","151.101.65.140","TCP","66","56277  >  443 [ACK] Seq=29051 Ack=68142 Win=2518 Len=0 TSval=4146161699 TSecr=1902537603"
"518","2.448904","151.101.65.140","100.86.243.187","TLSv1.2","278","Application Data"
"519","2.448905","151.101.65.140","100.86.243.187","TLSv1.2","579","Application Data, Application Data"
"520","2.448948","100.86.243.187","151.101.65.140","TCP","66","56277  >  443 [ACK] Seq=29051 Ack=68867 Win=2534 Len=0 TSval=4146161699 TSecr=1902537604"
"521","2.449499","151.101.65.140","100.86.243.187","TLSv1.2","478","Application Data"
"522","2.449500","151.101.65.140","100.86.243.187","TLSv1.2","565","Application Data"
"523","2.449611","100.86.243.187","151.101.65.140","TCP","66","56277  >  443 [ACK] Seq=29051 Ack=69778 Win=2545 Len=0 TSval=4146161699 TSecr=1902537604"
"524","2.450010","151.101.65.140","100.86.243.187","TLSv1.2","415","Application Data"
"525","2.450103","100.86.243.187","151.101.65.140","TCP","66","56277  >  443 [ACK] Seq=29051 Ack=70127 Win=2545 Len=0 TSval=4146161700 TSecr=1902537605"
"528","2.467299","151.101.65.140","100.86.243.187","TLSv1.2","402","Application Data"
"530","2.467829","100.86.243.187","151.101.65.140","TCP","66","56277  >  443 [ACK] Seq=29051 Ack=70463 Win=2545 Len=0 TSval=4146161717 TSecr=1902537622"
"531","2.474421","151.101.65.140","100.86.243.187","TLSv1.2","179","Application Data"
"532","2.474562","100.86.243.187","151.101.65.140","TCP","66","56277  >  443 [ACK] Seq=29051 Ack=70576 Win=2545 Len=0 TSval=4146161725 TSecr=1902537629"
"543","2.571526","151.101.65.140","100.86.243.187","TLSv1.2","379","Application Data"
"548","2.571708","100.86.243.187","151.101.65.140","TCP","66","56277  >  443 [ACK] Seq=29051 Ack=70889 Win=2545 Len=0 TSval=4146161822 TSecr=1902537634"
"554","2.573975","151.101.65.140","100.86.243.187","TLSv1.2","725","Application Data"
"555","2.573975","151.101.65.140","100.86.243.187","TLSv1.2","611","Application Data"
"556","2.573976","151.101.65.140","100.86.243.187","TLSv1.2","395","Application Data"
"557","2.573976","151.101.65.140","100.86.243.187","TLSv1.2","444","Application Data"
"558","2.573977","151.101.65.140","100.86.243.187","TLSv1.2","519","Application Data, Application Data"
"559","2.573977","151.101.65.140","100.86.243.187","TLSv1.2","234","Application Data"
"560","2.573977","151.101.65.140","100.86.243.187","TLSv1.2","243","Application Data"
"561","2.573978","151.101.65.140","100.86.243.187","TLSv1.2","304","Application Data"
"562","2.573978","151.101.65.140","100.86.243.187","TLSv1.2","170","Application Data"
"564","2.573979","151.101.65.140","100.86.243.187","TLSv1.2","1510","Application Data"
"567","2.574171","100.86.243.187","151.101.65.140","TCP","66","56277  >  443 [ACK] Seq=29051 Ack=75384 Win=2475 Len=0 TSval=4146161824 TSecr=1902537690"
"568","2.574397","100.86.243.187","151.101.65.140","TCP","66","[TCP Window Update] 56277  >  443 [ACK] Seq=29051 Ack=75384 Win=2545 Len=0 TSval=4146161824 TSecr=1902537690"
"569","2.584067","151.101.65.140","100.86.243.187","TLSv1.2","1510","Application Data, Application Data, Application Data"
"574","2.586856","151.101.65.140","100.86.243.187","TLSv1.2","1510","Application Data, Application Data, Application Data"
"575","2.586856","151.101.65.140","100.86.243.187","TLSv1.2","1510","Application Data, Application Data"
"576","2.586936","100.86.243.187","151.101.65.140","TCP","66","56277  >  443 [ACK] Seq=29051 Ack=79716 Win=2500 Len=0 TSval=4146161837 TSecr=1902537737"
"577","2.591573","151.101.65.140","100.86.243.187","TLSv1.2","1510","Application Data, Application Data, Application Data, Application Data"
"578","2.591630","100.86.243.187","151.101.65.140","TCP","66","56277  >  443 [ACK] Seq=29051 Ack=81160 Win=2523 Len=0 TSval=4146161842 TSecr=1902537745"
"579","2.597550","151.101.65.140","100.86.243.187","TCP","1510","[TCP Previous segment not captured] 443  >  56277 [ACK] Seq=82604 Ack=29051 Win=1396 Len=1444 TSval=1902537751 TSecr=4146161824, Application Data, Application Data"
"580","2.597551","151.101.65.140","100.86.243.187","TLSv1.2","1510","Ignored Unknown Record"
"581","2.597617","100.86.243.187","151.101.65.140","TCP","78","[TCP Dup ACK 578#1] 56277  >  443 [ACK] Seq=29051 Ack=81160 Win=2545 Len=0 TSval=4146161848 TSecr=1902537745 SLE=82604 SRE=85492"
"582","2.603863","151.101.65.140","100.86.243.187","TLSv1.2","1510","Ignored Unknown Record"
"583","2.603863","151.101.65.140","100.86.243.187","TLSv1.2","1510","Ignored Unknown Record"
"584","2.603922","100.86.243.187","151.101.65.140","TCP","78","[TCP Dup ACK 578#2] 56277  >  443 [ACK] Seq=29051 Ack=81160 Win=2545 Len=0 TSval=4146161854 TSecr=1902537745 SLE=82604 SRE=88380"
"586","2.610024","151.101.65.140","100.86.243.187","TLSv1.2","1510","Ignored Unknown Record"
"587","2.610025","151.101.65.140","100.86.243.187","TLSv1.2","1510","Ignored Unknown Record"
"588","2.610084","100.86.243.187","151.101.65.140","TCP","78","[TCP Dup ACK 578#3] 56277  >  443 [ACK] Seq=29051 Ack=81160 Win=2545 Len=0 TSval=4146161860 TSecr=1902537745 SLE=82604 SRE=91268"
"589","2.616645","151.101.65.140","100.86.243.187","TLSv1.2","1510","Ignored Unknown Record"
"590","2.616646","151.101.65.140","100.86.243.187","TLSv1.2","1510","Ignored Unknown Record"
"592","2.616714","100.86.243.187","151.101.65.140","TCP","78","[TCP Dup ACK 578#4] 56277  >  443 [ACK] Seq=29051 Ack=81160 Win=2545 Len=0 TSval=4146161867 TSecr=1902537745 SLE=82604 SRE=94156"
"597","2.620353","151.101.65.140","100.86.243.187","TLSv1.2","1510","[TCP Fast Retransmission] , Application Data, Application Data"
"598","2.620411","100.86.243.187","151.101.65.140","TCP","66","56277  >  443 [ACK] Seq=29051 Ack=94156 Win=2342 Len=0 TSval=4146161871 TSecr=1902537775"
"599","2.620737","100.86.243.187","151.101.65.140","TCP","66","[TCP Window Update] 56277  >  443 [ACK] Seq=29051 Ack=94156 Win=2545 Len=0 TSval=4146161871 TSecr=1902537775"
"600","2.624093","151.101.65.140","100.86.243.187","TLSv1.2","1510","Ignored Unknown Record"
"601","2.624094","151.101.65.140","100.86.243.187","TLSv1.2","885","Ignored Unknown Record"
"602","2.624144","100.86.243.187","151.101.65.140","TCP","66","56277  >  443 [ACK] Seq=29051 Ack=96419 Win=2510 Len=0 TSval=4146161874 TSecr=1902537778"
"603","2.628990","151.101.65.140","100.86.243.187","TLSv1.2","287","Application Data"
"604","2.628991","151.101.65.140","100.86.243.187","TLSv1.2","205","Application Data"
"605","2.628991","151.101.65.140","100.86.243.187","TLSv1.2","289","Application Data"
"607","2.629073","100.86.243.187","151.101.65.140","TCP","66","56277  >  443 [ACK] Seq=29051 Ack=97002 Win=2536 Len=0 TSval=4146161879 TSecr=1902537783"
"608","2.633621","151.101.65.140","100.86.243.187","TLSv1.2","242","Application Data"
"609","2.633677","100.86.243.187","151.101.65.140","TCP","66","56277  >  443 [ACK] Seq=29051 Ack=97178 Win=2543 Len=0 TSval=4146161884 TSecr=1902537787"
"610","2.635329","151.101.65.140","100.86.243.187","TLSv1.2","304","Application Data"
"611","2.635365","100.86.243.187","151.101.65.140","TCP","66","56277  >  443 [ACK] Seq=29051 Ack=97416 Win=2542 Len=0 TSval=4146161885 TSecr=1902537790"
"612","2.635893","151.101.65.140","100.86.243.187","TLSv1.2","149","Application Data"
"613","2.635925","100.86.243.187","151.101.65.140","TCP","66","56277  >  443 [ACK] Seq=29051 Ack=97499 Win=2544 Len=0 TSval=4146161885 TSecr=1902537791"
"614","2.639968","151.101.65.140","100.86.243.187","TLSv1.2","520","Application Data"
"615","2.640006","100.86.243.187","151.101.65.140","TCP","66","56277  >  443 [ACK] Seq=29051 Ack=97953 Win=2538 Len=0 TSval=4146161890 TSecr=1902537793"
"616","2.641561","151.101.65.140","100.86.243.187","TLSv1.2","740","Application Data, Application Data, Application Data, Application Data"
"624","2.641568","151.101.65.140","100.86.243.187","TLSv1.2","458","Application Data"
"625","2.641568","151.101.65.140","100.86.243.187","TLSv1.2","979","Application Data, Application Data"
"629","2.641794","100.86.243.187","151.101.65.140","TCP","66","56277  >  443 [ACK] Seq=29051 Ack=99932 Win=2514 Len=0 TSval=4146161892 TSecr=1902537795"
"644","2.644356","151.101.65.140","100.86.243.187","TCP","1510","443  >  56277 [ACK] Seq=99932 Ack=29051 Win=1396 Len=1444 TSval=1902537799 TSecr=4146161884 [TCP PDU reassembled in 652]"
"645","2.644441","100.86.243.187","151.101.65.140","TCP","66","56277  >  443 [ACK] Seq=29051 Ack=101376 Win=2523 Len=0 TSval=4146161895 TSecr=1902537799"
"646","2.646789","151.101.65.140","100.86.243.187","TLSv1.2","111","[TCP Previous segment not captured] , Ignored Unknown Record"
"647","2.646852","100.86.243.187","151.101.65.140","TCP","78","[TCP Dup ACK 645#1] 56277  >  443 [ACK] Seq=29051 Ack=101376 Win=2545 Len=0 TSval=4146161897 TSecr=1902537799 SLE=102820 SRE=102865"
"652","2.659986","151.101.65.140","100.86.243.187","TCP","1510","[TCP Retransmission] 443  >  56277 [ACK] Seq=101376 Ack=29051 Win=1396 Len=1444 TSval=1902537815 TSecr=4146161897"
"653","2.660051","100.86.243.187","151.101.65.140","TCP","66","56277  >  443 [ACK] Seq=29051 Ack=102865 Win=2522 Len=0 TSval=4146161910 TSecr=1902537815"
"655","2.684455","100.86.243.187","151.101.65.140","TCP","1514","56277  >  443 [ACK] Seq=29051 Ack=102865 Win=2545 Len=1448 TSval=4146161935 TSecr=1902537815 [TCP PDU reassembled in 657]"
"656","2.684457","100.86.243.187","151.101.65.140","TCP","1514","56277  >  443 [ACK] Seq=30499 Ack=102865 Win=2545 Len=1448 TSval=4146161935 TSecr=1902537815 [TCP PDU reassembled in 657]"
"657","2.684488","100.86.243.187","151.101.65.140","TLSv1.2","134","Application Data"
"658","2.684539","100.86.243.187","151.101.65.140","TCP","1514","56277  >  443 [ACK] Seq=32015 Ack=102865 Win=2545 Len=1448 TSval=4146161935 TSecr=1902537815 [TCP PDU reassembled in 659]"
"659","2.684548","100.86.243.187","151.101.65.140","TLSv1.2","1042","Application Data"
"665","2.697767","151.101.65.140","100.86.243.187","TCP","66","443  >  56277 [ACK] Seq=102865 Ack=34439 Win=1418 Len=0 TSval=1902537851 TSecr=4146161935"
"667","2.745718","151.101.65.140","100.86.243.187","TCP","1510","443  >  56277 [ACK] Seq=102865 Ack=34439 Win=1418 Len=1444 TSval=1902537899 TSecr=4146161935 [TCP PDU reassembled in 668]"
"668","2.745719","151.101.65.140","100.86.243.187","TLSv1.2","368","Application Data"
"669","2.745788","100.86.243.187","151.101.65.140","TCP","66","56277  >  443 [ACK] Seq=34439 Ack=104611 Win=2518 Len=0 TSval=4146161996 TSecr=1902537899"
"670","2.751917","100.86.243.187","151.101.65.140","TLSv1.2","163","Application Data"
"671","2.764637","151.101.65.140","100.86.243.187","TCP","66","443  >  56303 [ACK] Seq=17657 Ack=2342 Win=424 Len=0 TSval=1824790602 TSecr=2091616813"
"672","2.764637","151.101.65.140","100.86.243.187","TCP","1510","443  >  56303 [ACK] Seq=17657 Ack=2342 Win=424 Len=1444 TSval=1824790603 TSecr=2091616813 [TCP PDU reassembled in 673]"
"673","2.764638","151.101.65.140","100.86.243.187","TLSv1.2","901","Application Data"
"674","2.764700","100.86.243.187","151.101.65.140","TCP","66","56303  >  443 [ACK] Seq=2342 Ack=19936 Win=2012 Len=0 TSval=2091616826 TSecr=1824790603"
"697","3.075425","100.86.243.187","151.101.65.140","TLSv1.2","169","Application Data"
"718","3.078994","100.86.243.187","151.101.65.140","TLSv1.2","166","Application Data"
"719","3.084483","100.86.243.187","151.101.65.140","TLSv1.2","169","Application Data"
"726","3.110679","151.101.65.140","100.86.243.187","TCP","66","443  >  56303 [ACK] Seq=19936 Ack=2545 Win=424 Len=0 TSval=1824790947 TSecr=2091617146"
"727","3.110680","151.101.65.140","100.86.243.187","TCP","66","443  >  56307 [ACK] Seq=1 Ack=104 Win=296 Len=0 TSval=4059472035 TSecr=2762193028"
"732","3.110682","151.101.65.140","100.86.243.187","TCP","1510","443  >  56307 [ACK] Seq=1 Ack=104 Win=296 Len=1444 TSval=4059472036 TSecr=2762193028 [TCP PDU reassembled in 749]"
"733","3.110682","151.101.65.140","100.86.243.187","TCP","1510","443  >  56307 [ACK] Seq=1445 Ack=104 Win=296 Len=1444 TSval=4059472036 TSecr=2762193028 [TCP PDU reassembled in 749]"
"734","3.110683","151.101.65.140","100.86.243.187","TCP","1510","443  >  56307 [ACK] Seq=2889 Ack=104 Win=296 Len=1444 TSval=4059472036 TSecr=2762193028 [TCP PDU reassembled in 749]"
"735","3.110683","151.101.65.140","100.86.243.187","TCP","1510","443  >  56307 [PSH, ACK] Seq=4333 Ack=104 Win=296 Len=1444 TSval=4059472036 TSecr=2762193028 [TCP PDU reassembled in 749]"
"738","3.110685","151.101.65.140","100.86.243.187","TCP","1510","443  >  56303 [ACK] Seq=19936 Ack=2545 Win=424 Len=1444 TSval=1824790948 TSecr=2091617146 [TCP PDU reassembled in 752]"
"739","3.110685","151.101.65.140","100.86.243.187","TCP","1510","443  >  56303 [PSH, ACK] Seq=21380 Ack=2545 Win=424 Len=1444 TSval=1824790948 TSecr=2091617146 [TCP PDU reassembled in 752]"
"740","3.110685","151.101.65.140","100.86.243.187","TCP","1510","443  >  56307 [ACK] Seq=5777 Ack=104 Win=296 Len=1444 TSval=4059472037 TSecr=2762193028 [TCP PDU reassembled in 749]"
"741","3.110686","151.101.65.140","100.86.243.187","TCP","1510","443  >  56307 [ACK] Seq=7221 Ack=104 Win=296 Len=1444 TSval=4059472037 TSecr=2762193028 [TCP PDU reassembled in 749]"
"742","3.110686","151.101.65.140","100.86.243.187","TCP","1510","443  >  56307 [ACK] Seq=8665 Ack=104 Win=296 Len=1444 TSval=4059472037 TSecr=2762193028 [TCP PDU reassembled in 749]"
"743","3.110687","151.101.65.140","100.86.243.187","TCP","1510","443  >  56307 [PSH, ACK] Seq=10109 Ack=104 Win=296 Len=1444 TSval=4059472037 TSecr=2762193028 [TCP PDU reassembled in 749]"
"747","3.110689","151.101.65.140","100.86.243.187","TCP","1510","443  >  56307 [ACK] Seq=11553 Ack=104 Win=296 Len=1444 TSval=4059472038 TSecr=2762193028 [TCP PDU reassembled in 749]"
"748","3.110689","151.101.65.140","100.86.243.187","TCP","1510","443  >  56307 [ACK] Seq=12997 Ack=104 Win=296 Len=1444 TSval=4059472038 TSecr=2762193028 [TCP PDU reassembled in 749]"
"749","3.110690","151.101.65.140","100.86.243.187","TLSv1.2","1172","Application Data"
"752","3.110691","151.101.65.140","100.86.243.187","TLSv1.2","573","Application Data"
"756","3.110774","100.86.243.187","151.101.65.140","TCP","66","56303  >  443 [ACK] Seq=2545 Ack=23331 Win=1994 Len=0 TSval=2091617172 TSecr=1824790950"
"758","3.110857","100.86.243.187","151.101.65.140","TCP","66","[TCP Window Update] 56303  >  443 [ACK] Seq=2545 Ack=23331 Win=2048 Len=0 TSval=2091617172 TSecr=1824790950"
"759","3.110858","100.86.243.187","151.101.65.140","TCP","66","56307  >  443 [ACK] Seq=104 Ack=15547 Win=4972 Len=0 TSval=2762193064 TSecr=4059472038"
"765","3.111643","100.86.243.187","151.101.65.140","TCP","66","[TCP Window Update] 56307  >  443 [ACK] Seq=104 Ack=15547 Win=5215 Len=0 TSval=2762193064 TSecr=4059472038"
"767","3.112563","151.101.65.140","100.86.243.187","TCP","1510","443  >  56307 [ACK] Seq=15547 Ack=104 Win=296 Len=1444 TSval=4059472038 TSecr=2762193028 [TCP PDU reassembled in 866]"
"768","3.112564","151.101.65.140","100.86.243.187","TCP","1510","443  >  56307 [ACK] Seq=16991 Ack=104 Win=296 Len=1444 TSval=4059472038 TSecr=2762193028 [TCP PDU reassembled in 866]"
"769","3.112564","151.101.65.140","100.86.243.187","TCP","1510","443  >  56307 [ACK] Seq=18435 Ack=104 Win=296 Len=1444 TSval=4059472038 TSecr=2762193028 [TCP PDU reassembled in 866]"
"770","3.112565","151.101.65.140","100.86.243.187","TCP","1510","443  >  56307 [PSH, ACK] Seq=19879 Ack=104 Win=296 Len=1444 TSval=4059472038 TSecr=2762193028 [TCP PDU reassembled in 866]"
"775","3.112566","151.101.65.140","100.86.243.187","TCP","1510","443  >  56307 [ACK] Seq=21323 Ack=104 Win=296 Len=1444 TSval=4059472039 TSecr=2762193028 [TCP PDU reassembled in 866]"
"776","3.112567","151.101.65.140","100.86.243.187","TCP","1510","443  >  56307 [ACK] Seq=22767 Ack=104 Win=296 Len=1444 TSval=4059472039 TSecr=2762193028 [TCP PDU reassembled in 866]"
"777","3.112567","151.101.65.140","100.86.243.187","TCP","1510","[TCP Previous segment not captured] 443  >  56307 [PSH, ACK] Seq=25655 Ack=104 Win=296 Len=1444 TSval=4059472039 TSecr=2762193028 [TCP PDU reassembled in 866]"
"778","3.112636","100.86.243.187","151.101.65.140","TCP","66","56307  >  443 [ACK] Seq=104 Ack=24211 Win=5080 Len=0 TSval=2762193065 TSecr=4059472039"
"781","3.112688","100.86.243.187","151.101.65.140","TCP","78","[TCP Dup ACK 778#1] 56307  >  443 [ACK] Seq=104 Ack=24211 Win=5080 Len=0 TSval=2762193065 TSecr=4059472039 SLE=25655 SRE=27099"
"783","3.112704","100.86.243.187","151.101.65.140","TCP","78","[TCP Dup ACK 778#2] 56307  >  443 [ACK] Seq=104 Ack=24211 Win=5215 Len=0 TSval=2762193065 TSecr=4059472039 SLE=25655 SRE=27099"
"786","3.115343","151.101.65.140","100.86.243.187","TCP","1510","443  >  56307 [ACK] Seq=27099 Ack=104 Win=296 Len=1444 TSval=4059472040 TSecr=2762193028 [TCP PDU reassembled in 866]"
"787","3.115343","151.101.65.140","100.86.243.187","TCP","1510","443  >  56307 [ACK] Seq=28543 Ack=104 Win=296 Len=1444 TSval=4059472040 TSecr=2762193028 [TCP PDU reassembled in 866]"
"788","3.115344","151.101.65.140","100.86.243.187","TCP","1510","443  >  56307 [ACK] Seq=29987 Ack=104 Win=296 Len=1444 TSval=4059472040 TSecr=2762193028 [TCP PDU reassembled in 866]"
"789","3.115344","151.101.65.140","100.86.243.187","TCP","1510","443  >  56307 [PSH, ACK] Seq=31431 Ack=104 Win=296 Len=1444 TSval=4059472040 TSecr=2762193028 [TCP PDU reassembled in 866]"
"792","3.115346","151.101.65.140","100.86.243.187","TCP","1510","443  >  56307 [ACK] Seq=32875 Ack=104 Win=296 Len=1444 TSval=4059472041 TSecr=2762193028 [TCP PDU reassembled in 811]"
"793","3.115347","151.101.65.140","100.86.243.187","TCP","1510","443  >  56307 [ACK] Seq=34319 Ack=104 Win=296 Len=1444 TSval=4059472041 TSecr=2762193028 [TCP PDU reassembled in 811]"
"794","3.115415","100.86.243.187","151.101.65.140","TCP","78","[TCP Dup ACK 778#3] 56307  >  443 [ACK] Seq=104 Ack=24211 Win=5215 Len=0 TSval=2762193068 TSecr=4059472039 SLE=25655 SRE=35763"
"796","3.116667","151.101.65.140","100.86.243.187","TCP","1510","443  >  56307 [ACK] Seq=35763 Ack=104 Win=296 Len=1444 TSval=4059472041 TSecr=2762193028 [TCP PDU reassembled in 811]"
"797","3.116668","151.101.65.140","100.86.243.187","TCP","1510","443  >  56307 [PSH, ACK] Seq=37207 Ack=104 Win=296 Len=1444 TSval=4059472041 TSecr=2762193028 [TCP PDU reassembled in 811]"
"800","3.116670","151.101.65.140","100.86.243.187","TCP","1510","443  >  56307 [ACK] Seq=38651 Ack=104 Win=296 Len=1444 TSval=4059472042 TSecr=2762193028 [TCP PDU reassembled in 811]"
"801","3.116670","151.101.65.140","100.86.243.187","TCP","1510","443  >  56307 [ACK] Seq=40095 Ack=104 Win=296 Len=1444 TSval=4059472042 TSecr=2762193028 [TCP PDU reassembled in 811]"
"802","3.116671","151.101.65.140","100.86.243.187","TCP","1510","443  >  56307 [ACK] Seq=41539 Ack=104 Win=296 Len=1444 TSval=4059472042 TSecr=2762193028 [TCP PDU reassembled in 811]"
"803","3.116671","151.101.65.140","100.86.243.187","TCP","1510","443  >  56307 [PSH, ACK] Seq=42983 Ack=104 Win=296 Len=1444 TSval=4059472042 TSecr=2762193028 [TCP PDU reassembled in 811]"
"806","3.116673","151.101.65.140","100.86.243.187","TCP","1510","443  >  56307 [ACK] Seq=44427 Ack=104 Win=296 Len=1444 TSval=4059472043 TSecr=2762193028 [TCP PDU reassembled in 811]"
"807","3.116673","151.101.65.140","100.86.243.187","TCP","1510","443  >  56307 [ACK] Seq=45871 Ack=104 Win=296 Len=1444 TSval=4059472043 TSecr=2762193028 [TCP PDU reassembled in 811]"
"808","3.116741","100.86.243.187","151.101.65.140","TCP","78","[TCP Dup ACK 778#4] 56307  >  443 [ACK] Seq=104 Ack=24211 Win=5215 Len=0 TSval=2762193070 TSecr=4059472039 SLE=25655 SRE=47315"
"811","3.117336","151.101.65.140","100.86.243.187","TLSv1.2","1510","Application Data"
"812","3.117336","151.101.65.140","100.86.243.187","TCP","1510","443  >  56307 [PSH, ACK] Seq=48759 Ack=104 Win=296 Len=1444 TSval=4059472043 TSecr=2762193028 [TCP PDU reassembled in 834]"
"813","3.117396","100.86.243.187","151.101.65.140","TCP","78","[TCP Dup ACK 778#5] 56307  >  443 [ACK] Seq=104 Ack=24211 Win=5215 Len=0 TSval=2762193070 TSecr=4059472039 SLE=25655 SRE=50203"
"814","3.118500","151.101.65.140","100.86.243.187","TCP","1510","443  >  56307 [ACK] Seq=50203 Ack=104 Win=296 Len=1444 TSval=4059472044 TSecr=2762193028 [TCP PDU reassembled in 834]"
"815","3.118501","151.101.65.140","100.86.243.187","TCP","1510","443  >  56307 [ACK] Seq=51647 Ack=104 Win=296 Len=1444 TSval=4059472044 TSecr=2762193028 [TCP PDU reassembled in 834]"
"816","3.118501","151.101.65.140","100.86.243.187","TCP","1510","443  >  56307 [ACK] Seq=53091 Ack=104 Win=296 Len=1444 TSval=4059472044 TSecr=2762193028 [TCP PDU reassembled in 834]"
"817","3.118502","151.101.65.140","100.86.243.187","TCP","1510","443  >  56307 [PSH, ACK] Seq=54535 Ack=104 Win=296 Len=1444 TSval=4059472044 TSecr=2762193028 [TCP PDU reassembled in 834]"
"819","3.118504","151.101.65.140","100.86.243.187","TCP","1510","443  >  56307 [ACK] Seq=55979 Ack=104 Win=296 Len=1444 TSval=4059472045 TSecr=2762193028 [TCP PDU reassembled in 834]"
"820","3.118504","151.101.65.140","100.86.243.187","TCP","1510","443  >  56307 [ACK] Seq=57423 Ack=104 Win=296 Len=1444 TSval=4059472045 TSecr=2762193028 [TCP PDU reassembled in 834]"
"821","3.118505","151.101.65.140","100.86.243.187","TCP","1510","443  >  56307 [ACK] Seq=58867 Ack=104 Win=296 Len=1444 TSval=4059472045 TSecr=2762193028 [TCP PDU reassembled in 834]"
"822","3.118506","151.101.65.140","100.86.243.187","TCP","1510","443  >  56307 [PSH, ACK] Seq=60311 Ack=104 Win=296 Len=1444 TSval=4059472045 TSecr=2762193028 [TCP PDU reassembled in 834]"
"824","3.118587","100.86.243.187","151.101.65.140","TCP","78","[TCP Dup ACK 778#6] 56307  >  443 [ACK] Seq=104 Ack=24211 Win=5215 Len=0 TSval=2762193072 TSecr=4059472039 SLE=25655 SRE=61755"
"832","3.124264","151.101.65.140","100.86.243.187","TCP","1510","443  >  56307 [ACK] Seq=61755 Ack=104 Win=296 Len=1444 TSval=4059472050 TSecr=2762193064 [TCP PDU reassembled in 834]"
"833","3.124265","151.101.65.140","100.86.243.187","TCP","1510","443  >  56307 [ACK] Seq=63199 Ack=104 Win=296 Len=1444 TSval=4059472050 TSecr=2762193064 [TCP PDU reassembled in 834]"
"834","3.124265","151.101.65.140","100.86.243.187","TLSv1.2","1510","Application Data"
"835","3.124266","151.101.65.140","100.86.243.187","TCP","1510","443  >  56307 [PSH, ACK] Seq=66087 Ack=104 Win=296 Len=1444 TSval=4059472050 TSecr=2762193064 [TCP PDU reassembled in 853]"
"838","3.124268","151.101.65.140","100.86.243.187","TCP","1510","443  >  56307 [ACK] Seq=67531 Ack=104 Win=296 Len=1444 TSval=4059472051 TSecr=2762193064 [TCP PDU reassembled in 853]"
"839","3.124268","151.101.65.140","100.86.243.187","TCP","1510","443  >  56307 [ACK] Seq=68975 Ack=104 Win=296 Len=1444 TSval=4059472051 TSecr=2762193064 [TCP PDU reassembled in 853]"
"840","3.124269","151.101.65.140","100.86.243.187","TCP","1510","443  >  56307 [ACK] Seq=70419 Ack=104 Win=296 Len=1444 TSval=4059472051 TSecr=2762193064 [TCP PDU reassembled in 853]"
"841","3.124339","100.86.243.187","151.101.65.140","TCP","78","[TCP Dup ACK 778#7] 56307  >  443 [ACK] Seq=104 Ack=24211 Win=5215 Len=0 TSval=2762193077 TSecr=4059472039 SLE=25655 SRE=71863"
"843","3.125367","151.101.65.140","100.86.243.187","TCP","1510","443  >  56307 [PSH, ACK] Seq=71863 Ack=104 Win=296 Len=1444 TSval=4059472051 TSecr=2762193064 [TCP PDU reassembled in 853]"
"848","3.125371","151.101.65.140","100.86.243.187","TCP","1510","443  >  56307 [ACK] Seq=73307 Ack=104 Win=296 Len=1444 TSval=4059472052 TSecr=2762193065 [TCP PDU reassembled in 853]"
"849","3.125371","151.101.65.140","100.86.243.187","TCP","1510","443  >  56307 [ACK] Seq=74751 Ack=104 Win=296 Len=1444 TSval=4059472052 TSecr=2762193065 [TCP PDU reassembled in 853]"
"850","3.125372","151.101.65.140","100.86.243.187","TCP","1510","443  >  56307 [ACK] Seq=76195 Ack=104 Win=296 Len=1444 TSval=4059472052 TSecr=2762193065 [TCP PDU reassembled in 853]"
"851","3.125372","151.101.65.140","100.86.243.187","TCP","1510","443  >  56307 [PSH, ACK] Seq=77639 Ack=104 Win=296 Len=1444 TSval=4059472052 TSecr=2762193065 [TCP PDU reassembled in 853]"
"852","3.125373","151.101.65.140","100.86.243.187","TCP","1510","443  >  56307 [ACK] Seq=79083 Ack=104 Win=296 Len=1444 TSval=4059472053 TSecr=2762193065 [TCP PDU reassembled in 853]"
"853","3.125374","151.101.65.140","100.86.243.187","TLSv1.2","1510","Application Data, Application Data"
"855","3.125521","100.86.243.187","151.101.65.140","TCP","78","[TCP Dup ACK 778#8] 56307  >  443 [ACK] Seq=104 Ack=24211 Win=5215 Len=0 TSval=2762193078 TSecr=4059472039 SLE=25655 SRE=81971"
"857","3.126277","151.101.65.140","100.86.243.187","TCP","1510","443  >  56307 [ACK] Seq=81971 Ack=104 Win=296 Len=1444 TSval=4059472053 TSecr=2762193065 [TCP PDU reassembled in 882]"
"858","3.126278","151.101.65.140","100.86.243.187","TCP","1510","443  >  56307 [PSH, ACK] Seq=83415 Ack=104 Win=296 Len=1444 TSval=4059472053 TSecr=2762193065 [TCP PDU reassembled in 882]"
"859","3.126327","100.86.243.187","151.101.65.140","TCP","78","[TCP Dup ACK 778#9] 56307  >  443 [ACK] Seq=104 Ack=24211 Win=5215 Len=0 TSval=2762193078 TSecr=4059472039 SLE=25655 SRE=84859"
"866","3.127070","151.101.65.140","100.86.243.187","TLSv1.2","1510","[TCP Fast Retransmission] , Application Data"
"867","3.127071","151.101.65.140","100.86.243.187","TCP","1510","443  >  56307 [ACK] Seq=84859 Ack=104 Win=296 Len=1444 TSval=4059472055 TSecr=2762193068 [TCP PDU reassembled in 882]"
"868","3.127106","100.86.243.187","151.101.65.140","TCP","66","56307  >  443 [ACK] Seq=104 Ack=84859 Win=4267 Len=0 TSval=2762193080 TSecr=4059472054"
"869","3.127154","100.86.243.187","151.101.65.140","TCP","66","56307  >  443 [ACK] Seq=104 Ack=86303 Win=4245 Len=0 TSval=2762193080 TSecr=4059472055"
"870","3.127361","100.86.243.187","151.101.65.140","TCP","66","[TCP Window Update] 56307  >  443 [ACK] Seq=104 Ack=86303 Win=5215 Len=0 TSval=2762193080 TSecr=4059472055"
"873","3.130384","151.101.65.140","100.86.243.187","TCP","1510","443  >  56307 [ACK] Seq=86303 Ack=104 Win=296 Len=1444 TSval=4059472055 TSecr=2762193068 [TCP PDU reassembled in 882]"
"874","3.130385","151.101.65.140","100.86.243.187","TCP","1510","443  >  56307 [PSH, ACK] Seq=87747 Ack=104 Win=296 Len=1444 TSval=4059472055 TSecr=2762193068 [TCP PDU reassembled in 882]"
"875","3.130386","151.101.65.140","100.86.243.187","TCP","1510","443  >  56307 [ACK] Seq=89191 Ack=104 Win=296 Len=1444 TSval=4059472055 TSecr=2762193070 [TCP PDU reassembled in 882]"
"876","3.130386","151.101.65.140","100.86.243.187","TCP","1510","443  >  56307 [ACK] Seq=90635 Ack=104 Win=296 Len=1444 TSval=4059472056 TSecr=2762193070 [TCP PDU reassembled in 882]"
"879","3.130388","151.101.65.140","100.86.243.187","TCP","1510","443  >  56307 [ACK] Seq=92079 Ack=104 Win=296 Len=1444 TSval=4059472056 TSecr=2762193072 [TCP PDU reassembled in 882]"
"880","3.130389","151.101.65.140","100.86.243.187","TCP","1510","443  >  56307 [ACK] Seq=93523 Ack=104 Win=296 Len=1444 TSval=4059472056 TSecr=2762193072 [TCP PDU reassembled in 882]"
"881","3.130389","151.101.65.140","100.86.243.187","TCP","1510","443  >  56307 [ACK] Seq=94967 Ack=104 Win=296 Len=1444 TSval=4059472056 TSecr=2762193072 [TCP PDU reassembled in 882]"
"882","3.130389","151.101.65.140","100.86.243.187","TLSv1.2","1510","Application Data"
"883","3.130390","151.101.65.140","100.86.243.187","TCP","1510","443  >  56307 [ACK] Seq=97855 Ack=104 Win=296 Len=1444 TSval=4059472057 TSecr=2762193072 [TCP PDU reassembled in 920]"
"884","3.130391","151.101.65.140","100.86.243.187","TCP","1510","443  >  56307 [ACK] Seq=99299 Ack=104 Win=296 Len=1444 TSval=4059472057 TSecr=2762193072 [TCP PDU reassembled in 920]"
"885","3.130392","151.101.65.140","100.86.243.187","TCP","1510","443  >  56307 [ACK] Seq=100743 Ack=104 Win=296 Len=1444 TSval=4059472057 TSecr=2762193072 [TCP PDU reassembled in 920]"
"886","3.130392","151.101.65.140","100.86.243.187","TCP","1510","443  >  56307 [PSH, ACK] Seq=102187 Ack=104 Win=296 Len=1444 TSval=4059472057 TSecr=2762193072 [TCP PDU reassembled in 920]"
"887","3.130454","100.86.243.187","151.101.65.140","TCP","66","56307  >  443 [ACK] Seq=104 Ack=102187 Win=4967 Len=0 TSval=2762193083 TSecr=4059472057"
"888","3.130481","100.86.243.187","151.101.65.140","TCP","66","56307  >  443 [ACK] Seq=104 Ack=103631 Win=4944 Len=0 TSval=2762193083 TSecr=4059472057"
"890","3.130572","100.86.243.187","151.101.65.140","TCP","66","[TCP Window Update] 56307  >  443 [ACK] Seq=104 Ack=103631 Win=5215 Len=0 TSval=2762193083 TSecr=4059472057"
"914","3.136556","151.101.65.140","100.86.243.187","TCP","1510","443  >  56307 [ACK] Seq=103631 Ack=104 Win=296 Len=1444 TSval=4059472062 TSecr=2762193077 [TCP PDU reassembled in 920]"
"915","3.136558","151.101.65.140","100.86.243.187","TCP","1510","443  >  56307 [ACK] Seq=105075 Ack=104 Win=296 Len=1444 TSval=4059472062 TSecr=2762193077 [TCP PDU reassembled in 920]"
"916","3.136559","151.101.65.140","100.86.243.187","TCP","1510","443  >  56307 [ACK] Seq=106519 Ack=104 Win=296 Len=1444 TSval=4059472062 TSecr=2762193077 [TCP PDU reassembled in 920]"
"917","3.136559","151.101.65.140","100.86.243.187","TCP","1510","443  >  56307 [ACK] Seq=107963 Ack=104 Win=296 Len=1444 TSval=4059472062 TSecr=2762193077 [TCP PDU reassembled in 920]"
"920","3.136562","151.101.65.140","100.86.243.187","TLSv1.2","1190","Application Data"
"923","3.136659","100.86.243.187","151.101.65.140","TCP","66","56307  >  443 [ACK] Seq=104 Ack=110531 Win=5107 Len=0 TSval=2762193089 TSecr=4059472062"
"925","3.136689","100.86.243.187","151.101.65.140","TCP","66","[TCP Window Update] 56307  >  443 [ACK] Seq=104 Ack=110531 Win=5215 Len=0 TSval=2762193089 TSecr=4059472062"
"3619","3.970546","100.86.243.187","151.101.65.140","TCP","1514","56277  >  443 [ACK] Seq=34439 Ack=104611 Win=2545 Len=1448 TSval=4146163220 TSecr=1902537899 [TCP PDU reassembled in 3621]"
"3620","3.970547","100.86.243.187","151.101.65.140","TCP","1514","56277  >  443 [ACK] Seq=35887 Ack=104611 Win=2545 Len=1448 TSval=4146163220 TSecr=1902537899 [TCP PDU reassembled in 3621]"
"3621","3.970567","100.86.243.187","151.101.65.140","TLSv1.2","129","Application Data"
"3622","3.970625","100.86.243.187","151.101.65.140","TCP","1514","56277  >  443 [ACK] Seq=37398 Ack=104611 Win=2545 Len=1448 TSval=4146163220 TSecr=1902537899 [TCP PDU reassembled in 3625]"
"3623","3.970627","100.86.243.187","151.101.65.140","TCP","1514","56277  >  443 [ACK] Seq=38846 Ack=104611 Win=2545 Len=1448 TSval=4146163220 TSecr=1902537899 [TCP PDU reassembled in 3625]"
"3624","3.970628","100.86.243.187","151.101.65.140","TCP","1514","56277  >  443 [ACK] Seq=40294 Ack=104611 Win=2545 Len=1448 TSval=4146163220 TSecr=1902537899 [TCP PDU reassembled in 3625]"
"3625","3.970640","100.86.243.187","151.101.65.140","TLSv1.2","367","Application Data"
"3658","3.981610","151.101.65.140","100.86.243.187","TCP","66","443  >  56277 [ACK] Seq=104611 Ack=37335 Win=1429 Len=0 TSval=1902539136 TSecr=4146163220"
"3659","3.981610","151.101.65.140","100.86.243.187","TCP","66","443  >  56277 [ACK] Seq=104611 Ack=37398 Win=1429 Len=0 TSval=1902539136 TSecr=4146163220"
"3660","3.981611","151.101.65.140","100.86.243.187","TCP","66","443  >  56277 [ACK] Seq=104611 Ack=42043 Win=1452 Len=0 TSval=1902539137 TSecr=4146163220"
"3733","4.009619","151.101.65.140","100.86.243.187","TCP","1510","443  >  56277 [ACK] Seq=104611 Ack=42043 Win=1452 Len=1444 TSval=1902539164 TSecr=4146163220 [TCP PDU reassembled in 3734]"
"3734","4.009620","151.101.65.140","100.86.243.187","TLSv1.2","933","Application Data"
"3735","4.009693","100.86.243.187","151.101.65.140","TCP","66","56277  >  443 [ACK] Seq=42043 Ack=106922 Win=2509 Len=0 TSval=4146163259 TSecr=1902539164"
"3884","4.082525","100.86.243.187","151.101.65.140","TLSv1.2","161","Application Data"
"3885","4.082770","100.86.243.187","151.101.65.140","TLSv1.2","155","Application Data"
"3888","4.083924","100.86.243.187","151.101.65.140","TLSv1.2","101","Application Data"
"3890","4.084472","100.86.243.187","151.101.65.140","TLSv1.2","101","Application Data"
"3910","4.092141","151.101.65.140","100.86.243.187","TCP","66","443  >  56303 [ACK] Seq=23331 Ack=2640 Win=424 Len=0 TSval=1824791932 TSecr=2091618143"
"3911","4.092952","151.101.65.140","100.86.243.187","TCP","1510","443  >  56303 [ACK] Seq=23331 Ack=2729 Win=424 Len=1444 TSval=1824791932 TSecr=2091618143 [TCP PDU reassembled in 3963]"
"3912","4.093031","100.86.243.187","151.101.65.140","TCP","66","56303  >  443 [ACK] Seq=2799 Ack=24775 Win=2025 Len=0 TSval=2091618153 TSecr=1824791932"
"3913","4.093483","151.101.65.140","100.86.243.187","TCP","1510","443  >  56303 [PSH, ACK] Seq=24775 Ack=2729 Win=424 Len=1444 TSval=1824791932 TSecr=2091618143 [TCP PDU reassembled in 3963]"
"3914","4.093533","100.86.243.187","151.101.65.140","TCP","66","56303  >  443 [ACK] Seq=2799 Ack=26219 Win=2025 Len=0 TSval=2091618154 TSecr=1824791932"
"3920","4.095104","151.101.65.140","100.86.243.187","TCP","1510","443  >  56303 [ACK] Seq=26219 Ack=2729 Win=424 Len=1444 TSval=1824791935 TSecr=2091618143 [TCP PDU reassembled in 3963]"
"3922","4.095156","100.86.243.187","151.101.65.140","TCP","66","56303  >  443 [ACK] Seq=2799 Ack=27663 Win=2025 Len=0 TSval=2091618156 TSecr=1824791935"
"3923","4.096380","151.101.65.140","100.86.243.187","TCP","1510","443  >  56303 [PSH, ACK] Seq=27663 Ack=2729 Win=424 Len=1444 TSval=1824791935 TSecr=2091618143 [TCP PDU reassembled in 3963]"
"3924","4.096444","100.86.243.187","151.101.65.140","TCP","66","56303  >  443 [ACK] Seq=2799 Ack=29107 Win=2025 Len=0 TSval=2091618157 TSecr=1824791935"
"3929","4.098889","151.101.65.140","100.86.243.187","TCP","1510","443  >  56303 [ACK] Seq=29107 Ack=2729 Win=424 Len=1444 TSval=1824791938 TSecr=2091618143 [TCP PDU reassembled in 3963]"
"3930","4.098968","100.86.243.187","151.101.65.140","TCP","66","56303  >  443 [ACK] Seq=2799 Ack=30551 Win=2025 Len=0 TSval=2091618160 TSecr=1824791938"
"3931","4.099064","151.101.65.140","100.86.243.187","TCP","1510","443  >  56303 [PSH, ACK] Seq=30551 Ack=2729 Win=424 Len=1444 TSval=1824791938 TSecr=2091618143 [TCP PDU reassembled in 3963]"
"3933","4.099109","100.86.243.187","151.101.65.140","TCP","66","56303  >  443 [ACK] Seq=2799 Ack=31995 Win=2025 Len=0 TSval=2091618160 TSecr=1824791938"
"3942","4.101590","151.101.65.140","100.86.243.187","TCP","66","443  >  56303 [ACK] Seq=31995 Ack=2799 Win=424 Len=0 TSval=1824791941 TSecr=2091618145"
"3950","4.105467","151.101.65.140","100.86.243.187","TCP","1510","443  >  56303 [ACK] Seq=31995 Ack=2799 Win=424 Len=1444 TSval=1824791944 TSecr=2091618154 [TCP PDU reassembled in 3963]"
"3951","4.105468","151.101.65.140","100.86.243.187","TCP","1510","443  >  56303 [PSH, ACK] Seq=33439 Ack=2799 Win=424 Len=1444 TSval=1824791944 TSecr=2091618154 [TCP PDU reassembled in 3963]"
"3952","4.105510","100.86.243.187","151.101.65.140","TCP","66","56303  >  443 [ACK] Seq=2799 Ack=34883 Win=2002 Len=0 TSval=2091618166 TSecr=1824791944"
"3953","4.106422","151.101.65.140","100.86.243.187","TCP","1510","443  >  56303 [ACK] Seq=34883 Ack=2799 Win=424 Len=1444 TSval=1824791946 TSecr=2091618157 [TCP PDU reassembled in 3963]"
"3954","4.106460","100.86.243.187","151.101.65.140","TCP","66","56303  >  443 [ACK] Seq=2799 Ack=36327 Win=2025 Len=0 TSval=2091618167 TSecr=1824791946"
"3955","4.107771","151.101.65.140","100.86.243.187","TCP","1510","443  >  56303 [PSH, ACK] Seq=36327 Ack=2799 Win=424 Len=1444 TSval=1824791946 TSecr=2091618157 [TCP PDU reassembled in 3963]"
"3956","4.107808","100.86.243.187","151.101.65.140","TCP","66","56303  >  443 [ACK] Seq=2799 Ack=37771 Win=2025 Len=0 TSval=2091618169 TSecr=1824791946"
"3963","4.109605","151.101.65.140","100.86.243.187","TLSv1.2","1510","Application Data"
"3964","4.109605","151.101.65.140","100.86.243.187","TLSv1.2","1510","Application Data"
"3965","4.109636","100.86.243.187","151.101.65.140","TCP","66","56303  >  443 [ACK] Seq=2799 Ack=40659 Win=2002 Len=0 TSval=2091618170 TSecr=1824791949"
"3974","4.112742","151.101.65.140","100.86.243.187","TCP","1510","443  >  56303 [ACK] Seq=40659 Ack=2799 Win=424 Len=1444 TSval=1824791951 TSecr=2091618160 [TCP PDU reassembled in 3989]"
"3975","4.112768","100.86.243.187","151.101.65.140","TCP","66","56303  >  443 [ACK] Seq=2799 Ack=42103 Win=2025 Len=0 TSval=2091618173 TSecr=1824791951"
"3987","4.120141","151.101.65.140","100.86.243.187","TCP","1510","443  >  56303 [ACK] Seq=42103 Ack=2799 Win=424 Len=1444 TSval=1824791957 TSecr=2091618167 [TCP PDU reassembled in 3989]"
"3988","4.120187","100.86.243.187","151.101.65.140","TCP","66","56303  >  443 [ACK] Seq=2799 Ack=43547 Win=2025 Len=0 TSval=2091618181 TSecr=1824791957"
"3989","4.120824","151.101.65.140","100.86.243.187","TLSv1.2","802","Application Data"
"3990","4.120858","100.86.243.187","151.101.65.140","TCP","66","56303  >  443 [ACK] Seq=2799 Ack=44283 Win=2036 Len=0 TSval=2091618181 TSecr=1824791957"
"5203","8.964925","100.86.243.187","151.101.65.140","TCP","1514","56277  >  443 [ACK] Seq=42043 Ack=106922 Win=2545 Len=1448 TSval=4146168214 TSecr=1902539164 [TCP PDU reassembled in 5205]"
"5204","8.964928","100.86.243.187","151.101.65.140","TCP","1514","56277  >  443 [ACK] Seq=43491 Ack=106922 Win=2545 Len=1448 TSval=4146168214 TSecr=1902539164 [TCP PDU reassembled in 5205]"
"5205","8.964973","100.86.243.187","151.101.65.140","TLSv1.2","130","Application Data"
"5206","8.965050","100.86.243.187","151.101.65.140","TCP","1514","56277  >  443 [ACK] Seq=45003 Ack=106922 Win=2545 Len=1448 TSval=4146168214 TSecr=1902539164 [TCP PDU reassembled in 5208]"
"5207","8.965052","100.86.243.187","151.101.65.140","TCP","1514","56277  >  443 [ACK] Seq=46451 Ack=106922 Win=2545 Len=1448 TSval=4146168214 TSecr=1902539164 [TCP PDU reassembled in 5208]"
"5208","8.965069","100.86.243.187","151.101.65.140","TLSv1.2","945","Application Data"
"5209","8.975402","151.101.65.140","100.86.243.187","TCP","66","443  >  56277 [ACK] Seq=106922 Ack=48778 Win=1480 Len=0 TSval=1902544129 TSecr=4146168214"
"5217","9.029227","151.101.65.140","100.86.243.187","TCP","1510","443  >  56277 [ACK] Seq=106922 Ack=48778 Win=1480 Len=1444 TSval=1902544183 TSecr=4146168214 [TCP PDU reassembled in 5219]"
"5218","9.029349","100.86.243.187","151.101.65.140","TCP","66","56277  >  443 [ACK] Seq=48778 Ack=108366 Win=2523 Len=0 TSval=4146168279 TSecr=1902544183"
"5219","9.029486","151.101.65.140","100.86.243.187","TLSv1.2","239","Application Data"
"5220","9.029558","100.86.243.187","151.101.65.140","TCP","66","56277  >  443 [ACK] Seq=48778 Ack=108539 Win=2543 Len=0 TSval=4146168279 TSecr=1902544183"
