"No.","Time","Source","Destination","Protocol","Length","Info"
"1","0.000000","151.101.65.140","100.86.235.39","TLSv1.2","1510","Ignored Unknown Record"
"2","0.000071","100.86.235.39","151.101.65.140","TCP","66","56449  >  443 [ACK] Seq=1 Ack=1445 Win=5306 Len=0 TSval=921847116 TSecr=867553459"
"3","0.000446","151.101.65.140","100.86.235.39","TLSv1.2","1510","Ignored Unknown Record"
"4","0.000495","100.86.235.39","151.101.65.140","TCP","66","56449  >  443 [ACK] Seq=1 Ack=2889 Win=5306 Len=0 TSval=921847116 TSecr=867553459"
"5","0.002072","151.101.65.140","100.86.235.39","TLSv1.2","1510","Ignored Unknown Record"
"6","0.002140","100.86.235.39","151.101.65.140","TCP","66","56449  >  443 [ACK] Seq=1 Ack=4333 Win=5306 Len=0 TSval=921847118 TSecr=867553460"
"7","0.002360","151.101.65.140","100.86.235.39","TLSv1.2","1510","Ignored Unknown Record"
"8","0.002361","151.101.65.140","100.86.235.39","TLSv1.2","1510","Ignored Unknown Record"
"9","0.002394","100.86.235.39","151.101.65.140","TCP","66","56449  >  443 [ACK] Seq=1 Ack=7221 Win=5283 Len=0 TSval=921847118 TSecr=867553461"
"10","0.003320","151.101.65.140","100.86.235.39","TLSv1.2","1510","Ignored Unknown Record"
"11","0.003321","151.101.65.140","100.86.235.39","TLSv1.2","1510","Ignored Unknown Record"
"12","0.003378","100.86.235.39","151.101.65.140","TCP","66","56449  >  443 [ACK] Seq=1 Ack=10109 Win=5283 Len=0 TSval=921847119 TSecr=867553462"
"13","0.005131","151.101.65.140","100.86.235.39","TLSv1.2","1510","Ignored Unknown Record"
"14","0.005217","100.86.235.39","151.101.65.140","TCP","66","56449  >  443 [ACK] Seq=1 Ack=11553 Win=5306 Len=0 TSval=921847121 TSecr=867553464"
"15","0.005368","151.101.65.140","100.86.235.39","TLSv1.2","1510",""
"16","0.005411","100.86.235.39","151.101.65.140","TCP","66","56449  >  443 [ACK] Seq=1 Ack=12997 Win=5306 Len=0 TSval=921847121 TSecr=867553465"
"17","0.007909","151.101.65.140","100.86.235.39","TLSv1.2","1510","Ignored Unknown Record"
"18","0.007982","100.86.235.39","151.101.65.140","TCP","66","56449  >  443 [ACK] Seq=1 Ack=14441 Win=5306 Len=0 TSval=921847124 TSecr=867553467"
"19","0.010172","151.101.65.140","100.86.235.39","TLSv1.2","1510","Ignored Unknown Record"
"20","0.010202","151.101.65.140","100.86.235.39","TLSv1.2","1510","Ignored Unknown Record"
"21","0.010241","100.86.235.39","151.101.65.140","TCP","66","56449  >  443 [ACK] Seq=1 Ack=15885 Win=5306 Len=0 TSval=921847126 TSecr=867553469"
"22","0.010298","100.86.235.39","151.101.65.140","TCP","66","56449  >  443 [ACK] Seq=1 Ack=17329 Win=5283 Len=0 TSval=921847126 TSecr=867553469"
"23","0.012870","151.101.65.140","100.86.235.39","TLSv1.2","1510","Ignored Unknown Record"
"24","0.012974","100.86.235.39","151.101.65.140","TCP","66","56449  >  443 [ACK] Seq=1 Ack=18773 Win=5306 Len=0 TSval=921847129 TSecr=867553471"
"25","0.014873","151.101.65.140","100.86.235.39","TLSv1.2","1510","Ignored Unknown Record"
"26","0.014923","151.101.65.140","100.86.235.39","TLSv1.2","1510","Ignored Unknown Record"
"27","0.014923","151.101.65.140","100.86.235.39","TLSv1.2","1510","Ignored Unknown Record"
"28","0.014965","100.86.235.39","151.101.65.140","TCP","66","56449  >  443 [ACK] Seq=1 Ack=20217 Win=5306 Len=0 TSval=921847131 TSecr=867553471"
"29","0.015013","100.86.235.39","151.101.65.140","TCP","66","56449  >  443 [ACK] Seq=1 Ack=23105 Win=5260 Len=0 TSval=921847131 TSecr=867553472"
"30","0.015151","100.86.235.39","151.101.65.140","TCP","66","[TCP Window Update] 56449  >  443 [ACK] Seq=1 Ack=23105 Win=5328 Len=0 TSval=921847131 TSecr=867553472"
"31","0.015713","151.101.65.140","100.86.235.39","TLSv1.2","1510","Ignored Unknown Record"
"32","0.015775","100.86.235.39","151.101.65.140","TCP","66","56449  >  443 [ACK] Seq=1 Ack=24549 Win=5306 Len=0 TSval=921847131 TSecr=867553474"
"33","0.016210","151.101.65.140","100.86.235.39","TLSv1.2","1510","Ignored Unknown Record"
"34","0.016212","151.101.65.140","100.86.235.39","TLSv1.2","1510","Ignored Unknown Record"
"35","0.016272","100.86.235.39","151.101.65.140","TCP","66","56449  >  443 [ACK] Seq=1 Ack=27437 Win=5283 Len=0 TSval=921847132 TSecr=867553475"
"36","0.017696","151.101.65.140","100.86.235.39","TLSv1.2","1510","Ignored Unknown Record"
"37","0.017809","100.86.235.39","151.101.65.140","TCP","66","56449  >  443 [ACK] Seq=1 Ack=28881 Win=5306 Len=0 TSval=921847134 TSecr=867553477"
"38","0.017960","151.101.65.140","100.86.235.39","TLSv1.2","1510","Ignored Unknown Record"
"39","0.018035","100.86.235.39","151.101.65.140","TCP","66","56449  >  443 [ACK] Seq=1 Ack=30325 Win=5328 Len=0 TSval=921847134 TSecr=867553477"
"40","0.020405","151.101.65.140","100.86.235.39","TLSv1.2","1510","[TCP Previous segment not captured] , Ignored Unknown Record"
"41","0.020503","100.86.235.39","151.101.65.140","TCP","78","[TCP Dup ACK 39#1] 56449  >  443 [ACK] Seq=1 Ack=30325 Win=5328 Len=0 TSval=921847136 TSecr=867553477 SLE=31769 SRE=33213"
"42","0.023569","151.101.65.140","100.86.235.39","TCP","1510","443  >  56449 [ACK] Seq=33213 Ack=1 Win=424 Len=1444 TSval=867553482 TSecr=921847129"
"43","0.023708","100.86.235.39","151.101.65.140","TCP","78","[TCP Dup ACK 39#2] 56449  >  443 [ACK] Seq=1 Ack=30325 Win=5328 Len=0 TSval=921847140 TSecr=867553477 SLE=31769 SRE=34657"
"44","0.025617","151.101.65.140","100.86.235.39","TLSv1.2","1510",""
"45","0.025708","100.86.235.39","151.101.65.140","TCP","78","[TCP Dup ACK 39#3] 56449  >  443 [ACK] Seq=1 Ack=30325 Win=5328 Len=0 TSval=921847142 TSecr=867553477 SLE=31769 SRE=36101"
"46","0.026231","151.101.65.140","100.86.235.39","TLSv1.2","1510","Ignored Unknown Record"
"47","0.026304","100.86.235.39","151.101.65.140","TCP","78","[TCP Dup ACK 39#4] 56449  >  443 [ACK] Seq=1 Ack=30325 Win=5328 Len=0 TSval=921847142 TSecr=867553477 SLE=31769 SRE=37545"
"48","0.026560","151.101.65.140","100.86.235.39","TLSv1.2","1510","Ignored Unknown Record"
"49","0.026561","151.101.65.140","100.86.235.39","TLSv1.2","1510","Ignored Unknown Record"
"50","0.026616","100.86.235.39","151.101.65.140","TCP","78","[TCP Dup ACK 39#5] 56449  >  443 [ACK] Seq=1 Ack=30325 Win=5328 Len=0 TSval=921847142 TSecr=867553477 SLE=31769 SRE=40433"
"51","0.028743","151.101.65.140","100.86.235.39","TLSv1.2","1510","Ignored Unknown Record"
"52","0.028819","100.86.235.39","151.101.65.140","TCP","78","[TCP Dup ACK 39#6] 56449  >  443 [ACK] Seq=1 Ack=30325 Win=5328 Len=0 TSval=921847145 TSecr=867553477 SLE=31769 SRE=41877"
"53","0.029137","151.101.65.140","100.86.235.39","TLSv1.2","1510","Ignored Unknown Record"
"54","0.029191","100.86.235.39","151.101.65.140","TCP","78","[TCP Dup ACK 39#7] 56449  >  443 [ACK] Seq=1 Ack=30325 Win=5328 Len=0 TSval=921847145 TSecr=867553477 SLE=31769 SRE=43321"
"55","0.030222","151.101.65.140","100.86.235.39","TLSv1.2","1510","Ignored Unknown Record"
"56","0.030301","100.86.235.39","151.101.65.140","TCP","78","[TCP Dup ACK 39#8] 56449  >  443 [ACK] Seq=1 Ack=30325 Win=5328 Len=0 TSval=921847146 TSecr=867553477 SLE=31769 SRE=44765"
"57","0.030478","151.101.65.140","100.86.235.39","TLSv1.2","1510","Ignored Unknown Record"
"58","0.030524","100.86.235.39","151.101.65.140","TCP","78","[TCP Dup ACK 39#9] 56449  >  443 [ACK] Seq=1 Ack=30325 Win=5328 Len=0 TSval=921847146 TSecr=867553477 SLE=31769 SRE=46209"
"59","0.032940","151.101.65.140","100.86.235.39","TLSv1.2","428","Application Data"
"60","0.033035","100.86.235.39","151.101.65.140","TCP","66","56383  >  443 [ACK] Seq=1 Ack=363 Win=2042 Len=0 TSval=1359971517 TSecr=557196496"
"61","0.033193","151.101.65.140","100.86.235.39","TLSv1.2","107","Application Data"
"62","0.033245","100.86.235.39","151.101.65.140","TCP","66","56383  >  443 [ACK] Seq=1 Ack=404 Win=2047 Len=0 TSval=1359971517 TSecr=557196496"
"63","0.033644","151.101.65.140","100.86.235.39","TLSv1.2","1510","[TCP Fast Retransmission] , Ignored Unknown Record"
"64","0.033706","100.86.235.39","151.101.65.140","TCP","66","56449  >  443 [ACK] Seq=1 Ack=46209 Win=5080 Len=0 TSval=921847149 TSecr=867553493"
"65","0.033871","100.86.235.39","151.101.65.140","TCP","66","[TCP Window Update] 56449  >  443 [ACK] Seq=1 Ack=46209 Win=5328 Len=0 TSval=921847149 TSecr=867553493"
"66","0.036387","151.101.65.140","100.86.235.39","TLSv1.2","1510","Ignored Unknown Record"
"67","0.036464","100.86.235.39","151.101.65.140","TCP","66","56449  >  443 [ACK] Seq=1 Ack=47653 Win=5306 Len=0 TSval=921847152 TSecr=867553495"
"68","0.036610","151.101.65.140","100.86.235.39","TLSv1.2","1510","Ignored Unknown Record"
"69","0.036654","100.86.235.39","151.101.65.140","TCP","66","56449  >  443 [ACK] Seq=1 Ack=49097 Win=5306 Len=0 TSval=921847152 TSecr=867553495"
"70","0.038701","151.101.65.140","100.86.235.39","TLSv1.2","1510","Ignored Unknown Record"
"71","0.038776","100.86.235.39","151.101.65.140","TCP","66","56449  >  443 [ACK] Seq=1 Ack=50541 Win=5306 Len=0 TSval=921847155 TSecr=867553498"
"72","0.039522","151.101.65.140","100.86.235.39","TLSv1.2","1510","Ignored Unknown Record"
"73","0.039594","100.86.235.39","151.101.65.140","TCP","66","56449  >  443 [ACK] Seq=1 Ack=51985 Win=5306 Len=0 TSval=921847155 TSecr=867553499"
"74","0.039845","151.101.65.140","100.86.235.39","TLSv1.2","1510","Ignored Unknown Record"
"75","0.039898","100.86.235.39","151.101.65.140","TCP","66","56449  >  443 [ACK] Seq=1 Ack=53429 Win=5306 Len=0 TSval=921847156 TSecr=867553499"
"76","0.040973","151.101.65.140","100.86.235.39","TLSv1.2","1510","Ignored Unknown Record"
"77","0.041040","100.86.235.39","151.101.65.140","TCP","66","56449  >  443 [ACK] Seq=1 Ack=54873 Win=5306 Len=0 TSval=921847157 TSecr=867553499"
"78","0.043888","151.101.65.140","100.86.235.39","TLSv1.2","1510","Ignored Unknown Record"
"79","0.043979","100.86.235.39","151.101.65.140","TCP","66","56449  >  443 [ACK] Seq=1 Ack=56317 Win=5306 Len=0 TSval=921847160 TSecr=867553503"
"80","0.046671","151.101.65.140","100.86.235.39","TLSv1.2","1510","Ignored Unknown Record"
"81","0.046744","100.86.235.39","151.101.65.140","TCP","66","56449  >  443 [ACK] Seq=1 Ack=57761 Win=5306 Len=0 TSval=921847163 TSecr=867553505"
"82","0.048672","151.101.65.140","100.86.235.39","TLSv1.2","1510","Ignored Unknown Record"
"83","0.048858","100.86.235.39","151.101.65.140","TCP","66","56449  >  443 [ACK] Seq=1 Ack=59205 Win=5306 Len=0 TSval=921847165 TSecr=867553507"
"84","0.048996","151.101.65.140","100.86.235.39","TLSv1.2","1510","Ignored Unknown Record"
"85","0.049040","100.86.235.39","151.101.65.140","TCP","66","56449  >  443 [ACK] Seq=1 Ack=60649 Win=5306 Len=0 TSval=921847165 TSecr=867553508"
"86","0.049405","151.101.65.140","100.86.235.39","TLSv1.2","1510","Ignored Unknown Record"
"87","0.049471","100.86.235.39","151.101.65.140","TCP","66","56449  >  443 [ACK] Seq=1 Ack=62093 Win=5306 Len=0 TSval=921847165 TSecr=867553508"
"88","0.050764","151.101.65.140","100.86.235.39","TLSv1.2","1510","Ignored Unknown Record"
"89","0.050838","100.86.235.39","151.101.65.140","TCP","66","56449  >  443 [ACK] Seq=1 Ack=63537 Win=5306 Len=0 TSval=921847167 TSecr=867553510"
"90","0.051403","151.101.65.140","100.86.235.39","TLSv1.2","1510","Ignored Unknown Record"
"91","0.051473","100.86.235.39","151.101.65.140","TCP","66","56449  >  443 [ACK] Seq=1 Ack=64981 Win=5306 Len=0 TSval=921847167 TSecr=867553510"
"92","0.054449","151.101.65.140","100.86.235.39","TLSv1.2","1510","Ignored Unknown Record"
"93","0.054537","100.86.235.39","151.101.65.140","TCP","66","56449  >  443 [ACK] Seq=1 Ack=66425 Win=5306 Len=0 TSval=921847170 TSecr=867553513"
"94","0.054734","151.101.65.140","100.86.235.39","TLSv1.2","1510","Ignored Unknown Record"
"95","0.054757","100.86.235.39","151.101.65.140","TLSv1.2","329","Application Data"
"96","0.054779","100.86.235.39","151.101.65.140","TCP","66","56449  >  443 [ACK] Seq=1 Ack=67869 Win=5306 Len=0 TSval=921847170 TSecr=867553513"
"97","0.054941","100.86.235.39","151.101.65.140","TLSv1.2","229","Application Data"
"98","0.057153","151.101.65.140","100.86.235.39","TLSv1.2","1510","Ignored Unknown Record"
"99","0.059293","151.101.65.140","100.86.235.39","TLSv1.2","1510","Ignored Unknown Record"
"100","0.059476","100.86.235.39","151.101.65.140","TCP","66","56449  >  443 [ACK] Seq=1 Ack=70757 Win=5328 Len=0 TSval=921847175 TSecr=867553516"
"101","0.059536","151.101.65.140","100.86.235.39","TLSv1.2","1510","Ignored Unknown Record"
"102","0.059730","100.86.235.39","151.101.65.140","TCP","66","56449  >  443 [ACK] Seq=1 Ack=72201 Win=5328 Len=0 TSval=921847175 TSecr=867553518"
"103","0.060892","151.101.65.140","100.86.235.39","TLSv1.2","1510","Ignored Unknown Record"
"104","0.061243","151.101.65.140","100.86.235.39","TLSv1.2","1510","Ignored Unknown Record"
"105","0.061347","100.86.235.39","151.101.65.140","TCP","66","56449  >  443 [ACK] Seq=1 Ack=75089 Win=5328 Len=0 TSval=921847177 TSecr=867553520"
"106","0.064610","151.101.65.140","100.86.235.39","TLSv1.2","1510","Ignored Unknown Record"
"107","0.064867","100.86.235.39","151.101.65.140","TLSv1.2","237","Application Data"
"108","0.065062","151.101.65.140","100.86.235.39","TLSv1.2","1510","Ignored Unknown Record"
"109","0.065063","151.101.65.140","100.86.235.39","TCP","66","443  >  56438 [ACK] Seq=1 Ack=427 Win=424 Len=0 TSval=3000761929 TSecr=3707597372"
"110","0.065421","100.86.235.39","151.101.65.140","TCP","1514","56383  >  443 [ACK] Seq=1 Ack=404 Win=2048 Len=1448 TSval=1359971549 TSecr=557196496 [TCP PDU reassembled in 111]"
"111","0.065445","100.86.235.39","151.101.65.140","TLSv1.2","1504","Application Data"
"112","0.065536","100.86.235.39","151.101.65.140","TCP","66","56449  >  443 [ACK] Seq=172 Ack=77977 Win=5328 Len=0 TSval=921847181 TSecr=867553523"
"113","0.065834","100.86.235.39","151.101.65.140","TCP","1514","56383  >  443 [ACK] Seq=2887 Ack=404 Win=2048 Len=1448 TSval=1359971550 TSecr=557196496 [TCP PDU reassembled in 115]"
"114","0.065836","100.86.235.39","151.101.65.140","TCP","1514","56383  >  443 [ACK] Seq=4335 Ack=404 Win=2048 Len=1448 TSval=1359971550 TSecr=557196496 [TCP PDU reassembled in 115]"
"115","0.065853","100.86.235.39","151.101.65.140","TLSv1.2","190","Application Data"
"116","0.065892","100.86.235.39","151.101.65.140","TLSv1.2","146","Application Data"
"117","0.066126","151.101.65.140","100.86.235.39","TLSv1.2","198","Application Data"
"118","0.066179","100.86.235.39","151.101.65.140","TCP","66","56438  >  443 [ACK] Seq=427 Ack=133 Win=7860 Len=0 TSval=3707597384 TSecr=3000761931"
"119","0.066432","151.101.65.140","100.86.235.39","TCP","1510","443  >  56438 [ACK] Seq=133 Ack=427 Win=424 Len=1444 TSval=3000761931 TSecr=3707597372 [TCP PDU reassembled in 120]"
"120","0.066432","151.101.65.140","100.86.235.39","TLSv1.2","569","Application Data"
"121","0.066478","100.86.235.39","151.101.65.140","TCP","1514","56383  >  443 [ACK] Seq=5987 Ack=404 Win=2048 Len=1448 TSval=1359971550 TSecr=557196496 [TCP PDU reassembled in 123]"
"122","0.066480","100.86.235.39","151.101.65.140","TCP","66","56438  >  443 [ACK] Seq=427 Ack=2080 Win=7830 Len=0 TSval=3707597384 TSecr=3000761931"
"123","0.066496","100.86.235.39","151.101.65.140","TLSv1.2","1482","Application Data"
"124","0.067018","100.86.235.39","151.101.65.140","TCP","1514","56383  >  443 [ACK] Seq=8851 Ack=404 Win=2048 Len=1448 TSval=1359971551 TSecr=557196496 [TCP PDU reassembled in 125]"
"125","0.067036","100.86.235.39","151.101.65.140","TLSv1.2","1497","Application Data"
"126","0.070003","151.101.65.140","100.86.235.39","TCP","1510","443  >  56438 [ACK] Seq=2080 Ack=427 Win=424 Len=1444 TSval=3000761934 TSecr=3707597372 [TCP PDU reassembled in 140]"
"127","0.070075","100.86.235.39","151.101.65.140","TCP","66","56438  >  443 [ACK] Seq=427 Ack=3524 Win=7840 Len=0 TSval=3707597388 TSecr=3000761934"
"128","0.070699","151.101.65.140","100.86.235.39","TCP","1510","443  >  56438 [PSH, ACK] Seq=3524 Ack=427 Win=424 Len=1444 TSval=3000761934 TSecr=3707597372 [TCP PDU reassembled in 140]"
"129","0.070767","100.86.235.39","151.101.65.140","TCP","66","56438  >  443 [ACK] Seq=427 Ack=4968 Win=7840 Len=0 TSval=3707597388 TSecr=3000761934"
"130","0.070981","151.101.65.140","100.86.235.39","TLSv1.2","1510","Ignored Unknown Record"
"131","0.070982","151.101.65.140","100.86.235.39","TLSv1.2","1510","Ignored Unknown Record"
"132","0.071067","100.86.235.39","151.101.65.140","TCP","66","56449  >  443 [ACK] Seq=172 Ack=80865 Win=5328 Len=0 TSval=921847187 TSecr=867553529"
"133","0.071865","151.101.65.140","100.86.235.39","TLSv1.2","1510","Ignored Unknown Record"
"134","0.073311","151.101.65.140","100.86.235.39","TLSv1.2","1510","Ignored Unknown Record"
"135","0.073449","100.86.235.39","151.101.65.140","TCP","66","56449  >  443 [ACK] Seq=172 Ack=83753 Win=5328 Len=0 TSval=921847189 TSecr=867553531"
"136","0.074128","151.101.65.140","100.86.235.39","TLSv1.2","1510","Ignored Unknown Record"
"137","0.074473","151.101.65.140","100.86.235.39","TLSv1.2","1510","Ignored Unknown Record"
"138","0.074553","100.86.235.39","151.101.65.140","TCP","66","56449  >  443 [ACK] Seq=172 Ack=86641 Win=5328 Len=0 TSval=921847190 TSecr=867553533"
"139","0.075256","151.101.65.140","100.86.235.39","TCP","66","443  >  56383 [ACK] Seq=404 Ack=2887 Win=538 Len=0 TSval=557196539 TSecr=1359971549"
"140","0.076429","151.101.65.140","100.86.235.39","TLSv1.2","250","Application Data"
"141","0.076431","151.101.65.140","100.86.235.39","TCP","66","443  >  56383 [ACK] Seq=404 Ack=5987 Win=533 Len=0 TSval=557196539 TSecr=1359971550"
"142","0.076467","151.101.65.140","100.86.235.39","TCP","66","443  >  56449 [ACK] Seq=86641 Ack=172 Win=424 Len=0 TSval=867553535 TSecr=921847181"
"143","0.076526","100.86.235.39","151.101.65.140","TCP","66","56438  >  443 [ACK] Seq=427 Ack=5152 Win=7859 Len=0 TSval=3707597394 TSecr=3000761940"
"144","0.077107","151.101.65.140","100.86.235.39","TLSv1.2","1510","Ignored Unknown Record"
"145","0.077109","151.101.65.140","100.86.235.39","TLSv1.2","1510","Ignored Unknown Record"
"146","0.077196","151.101.65.140","100.86.235.39","TCP","66","443  >  56383 [ACK] Seq=404 Ack=11730 Win=538 Len=0 TSval=557196540 TSecr=1359971551"
"147","0.081388","151.101.65.140","100.86.235.39","TLSv1.2","1510","Ignored Unknown Record"
"148","0.081391","151.101.65.140","100.86.235.39","TLSv1.2","1510","Ignored Unknown Record"
"149","0.081654","100.86.235.39","151.101.65.140","TCP","66","56449  >  443 [ACK] Seq=172 Ack=92417 Win=5328 Len=0 TSval=921847197 TSecr=867553536"
"150","0.084324","151.101.65.140","100.86.235.39","TLSv1.2","1510","Ignored Unknown Record"
"151","0.084416","151.101.65.140","100.86.235.39","TLSv1.2","1510","Ignored Unknown Record"
"152","0.084588","100.86.235.39","151.101.65.140","TCP","66","56449  >  443 [ACK] Seq=172 Ack=95305 Win=5328 Len=0 TSval=921847200 TSecr=867553543"
"153","0.085186","151.101.65.140","100.86.235.39","TLSv1.2","1510","Ignored Unknown Record"
"154","0.085809","151.101.65.140","100.86.235.39","TLSv1.2","1510","Ignored Unknown Record"
"155","0.085909","100.86.235.39","151.101.65.140","TCP","66","56449  >  443 [ACK] Seq=172 Ack=98193 Win=5328 Len=0 TSval=921847202 TSecr=867553544"
"156","0.092604","151.101.65.140","100.86.235.39","TLSv1.2","1510","Ignored Unknown Record"
"157","0.092998","151.101.65.140","100.86.235.39","TLSv1.2","1510","Ignored Unknown Record"
"158","0.093102","100.86.235.39","151.101.65.140","TCP","66","56449  >  443 [ACK] Seq=172 Ack=101081 Win=5328 Len=0 TSval=921847209 TSecr=867553551"
"159","0.093602","151.101.65.140","100.86.235.39","TCP","1510","443  >  56449 [ACK] Seq=101081 Ack=172 Win=424 Len=1444 TSval=867553552 TSecr=921847197"
"160","0.093896","151.101.65.140","100.86.235.39","TLSv1.2","1510","Ignored Unknown Record"
"161","0.093998","100.86.235.39","151.101.65.140","TCP","66","56449  >  443 [ACK] Seq=172 Ack=103969 Win=5328 Len=0 TSval=921847210 TSecr=867553552"
"162","0.095906","151.101.65.140","100.86.235.39","TLSv1.2","1510","Ignored Unknown Record"
"163","0.096165","151.101.65.140","100.86.235.39","TLSv1.2","1510","Ignored Unknown Record"
"164","0.096255","100.86.235.39","151.101.65.140","TCP","66","56449  >  443 [ACK] Seq=172 Ack=106857 Win=5328 Len=0 TSval=921847212 TSecr=867553555"
"165","0.096871","151.101.65.140","100.86.235.39","TCP","1510","443  >  56383 [ACK] Seq=404 Ack=11730 Win=538 Len=1444 TSval=557196560 TSecr=1359971551 [TCP PDU reassembled in 166]"
"166","0.096875","151.101.65.140","100.86.235.39","TLSv1.2","938","Application Data"
"167","0.096999","100.86.235.39","151.101.65.140","TCP","66","56383  >  443 [ACK] Seq=11730 Ack=2720 Win=2011 Len=0 TSval=1359971580 TSecr=557196560"
"168","0.097513","151.101.65.140","100.86.235.39","TLSv1.2","1510","Ignored Unknown Record"
"169","0.097827","151.101.65.140","100.86.235.39","TLSv1.2","1510","Ignored Unknown Record"
"170","0.097900","100.86.235.39","151.101.65.140","TCP","66","56449  >  443 [ACK] Seq=172 Ack=109745 Win=5328 Len=0 TSval=921847213 TSecr=867553557"
"171","0.099055","151.101.65.140","100.86.235.39","TCP","1510","443  >  56383 [ACK] Seq=2720 Ack=11730 Win=538 Len=1444 TSval=557196563 TSecr=1359971551 [TCP PDU reassembled in 173]"
"172","0.099111","100.86.235.39","151.101.65.140","TCP","66","56383  >  443 [ACK] Seq=11730 Ack=4164 Win=2025 Len=0 TSval=1359971583 TSecr=557196563"
"173","0.099563","151.101.65.140","100.86.235.39","TLSv1.2","1265","Application Data"
"174","0.099603","100.86.235.39","151.101.65.140","TCP","66","56383  >  443 [ACK] Seq=11730 Ack=5363 Win=2029 Len=0 TSval=1359971583 TSecr=557196563"
"175","0.099749","151.101.65.140","100.86.235.39","TLSv1.2","1510","Ignored Unknown Record"
"176","0.099751","151.101.65.140","100.86.235.39","TCP","1510","443  >  56383 [ACK] Seq=5363 Ack=11730 Win=538 Len=1444 TSval=557196563 TSecr=1359971551 [TCP PDU reassembled in 178]"
"177","0.099803","100.86.235.39","151.101.65.140","TCP","66","56383  >  443 [ACK] Seq=11730 Ack=6807 Win=2025 Len=0 TSval=1359971583 TSecr=557196563"
"178","0.100244","151.101.65.140","100.86.235.39","TLSv1.2","1013","Application Data"
"179","0.100313","100.86.235.39","151.101.65.140","TCP","66","56383  >  443 [ACK] Seq=11730 Ack=7754 Win=2033 Len=0 TSval=1359971584 TSecr=557196563"
"180","0.102904","151.101.65.140","100.86.235.39","TLSv1.2","1510","Ignored Unknown Record"
"181","0.103778","151.101.65.140","100.86.235.39","TLSv1.2","1510","Ignored Unknown Record"
"182","0.103887","100.86.235.39","151.101.65.140","TCP","66","56449  >  443 [ACK] Seq=172 Ack=114077 Win=5328 Len=0 TSval=921847219 TSecr=867553559"
"183","0.104133","151.101.65.140","100.86.235.39","TLSv1.2","1510","Ignored Unknown Record"
"184","0.104459","151.101.65.140","100.86.235.39","TLSv1.2","1510","Ignored Unknown Record"
"185","0.104544","100.86.235.39","151.101.65.140","TCP","66","56449  >  443 [ACK] Seq=172 Ack=116965 Win=5328 Len=0 TSval=921847220 TSecr=867553563"
"186","0.105452","151.101.65.140","100.86.235.39","TCP","1510","443  >  56383 [ACK] Seq=7754 Ack=11730 Win=538 Len=1444 TSval=557196569 TSecr=1359971551 [TCP PDU reassembled in 188]"
"187","0.105536","100.86.235.39","151.101.65.140","TCP","66","56383  >  443 [ACK] Seq=11730 Ack=9198 Win=2025 Len=0 TSval=1359971589 TSecr=557196569"
"188","0.105597","151.101.65.140","100.86.235.39","TLSv1.2","258","Application Data"
"189","0.105640","100.86.235.39","151.101.65.140","TCP","66","56383  >  443 [ACK] Seq=11730 Ack=9390 Win=2045 Len=0 TSval=1359971589 TSecr=557196569"
"190","0.107530","151.101.65.140","100.86.235.39","TLSv1.2","1510","Ignored Unknown Record"
"191","0.107531","151.101.65.140","100.86.235.39","TLSv1.2","1510","Ignored Unknown Record"
"192","0.107664","100.86.235.39","151.101.65.140","TCP","66","56449  >  443 [ACK] Seq=172 Ack=119853 Win=5328 Len=0 TSval=921847223 TSecr=867553566"
"193","0.109781","151.101.65.140","100.86.235.39","TLSv1.2","1510","Ignored Unknown Record"
"194","0.109811","151.101.65.140","100.86.235.39","TLSv1.2","1510","Ignored Unknown Record"
"195","0.109987","100.86.235.39","151.101.65.140","TCP","66","56449  >  443 [ACK] Seq=172 Ack=122741 Win=5328 Len=0 TSval=921847226 TSecr=867553569"
"196","0.114089","151.101.65.140","100.86.235.39","TLSv1.2","1510","Ignored Unknown Record"
"197","0.114115","151.101.65.140","100.86.235.39","TCP","1510","443  >  56449 [PSH, ACK] Seq=124185 Ack=172 Win=424 Len=1444 TSval=867553573 TSecr=921847219 [TCP PDU reassembled in 273]"
"198","0.114223","100.86.235.39","151.101.65.140","TCP","66","56449  >  443 [ACK] Seq=172 Ack=125629 Win=5328 Len=0 TSval=921847230 TSecr=867553573"
"199","0.114986","151.101.65.140","100.86.235.39","TCP","1510","443  >  56449 [ACK] Seq=125629 Ack=172 Win=424 Len=1444 TSval=867553574 TSecr=921847220 [TCP PDU reassembled in 273]"
"200","0.115603","151.101.65.140","100.86.235.39","TCP","1510","443  >  56449 [PSH, ACK] Seq=127073 Ack=172 Win=424 Len=1444 TSval=867553574 TSecr=921847220 [TCP PDU reassembled in 273]"
"201","0.115689","100.86.235.39","151.101.65.140","TCP","66","56449  >  443 [ACK] Seq=172 Ack=128517 Win=5328 Len=0 TSval=921847232 TSecr=867553574"
"202","0.117900","151.101.65.140","100.86.235.39","TCP","1510","443  >  56449 [ACK] Seq=128517 Ack=172 Win=424 Len=1444 TSval=867553577 TSecr=921847223 [TCP PDU reassembled in 273]"
"203","0.117901","151.101.65.140","100.86.235.39","TCP","1510","443  >  56449 [PSH, ACK] Seq=129961 Ack=172 Win=424 Len=1444 TSval=867553577 TSecr=921847223 [TCP PDU reassembled in 273]"
"204","0.118029","100.86.235.39","151.101.65.140","TCP","66","56449  >  443 [ACK] Seq=172 Ack=131405 Win=5328 Len=0 TSval=921847234 TSecr=867553577"
"205","0.120372","151.101.65.140","100.86.235.39","TCP","1510","443  >  56449 [ACK] Seq=131405 Ack=172 Win=424 Len=1444 TSval=867553579 TSecr=921847226 [TCP PDU reassembled in 273]"
"206","0.120851","151.101.65.140","100.86.235.39","TCP","1510","443  >  56449 [PSH, ACK] Seq=132849 Ack=172 Win=424 Len=1444 TSval=867553579 TSecr=921847226 [TCP PDU reassembled in 273]"
"207","0.120953","100.86.235.39","151.101.65.140","TCP","66","56449  >  443 [ACK] Seq=172 Ack=134293 Win=5328 Len=0 TSval=921847237 TSecr=867553579"
"208","0.124934","151.101.65.140","100.86.235.39","TCP","1510","443  >  56449 [ACK] Seq=134293 Ack=172 Win=424 Len=1444 TSval=867553583 TSecr=921847230 [TCP PDU reassembled in 273]"
"209","0.125609","151.101.65.140","100.86.235.39","TCP","1510","443  >  56449 [PSH, ACK] Seq=135737 Ack=172 Win=424 Len=1444 TSval=867553583 TSecr=921847230 [TCP PDU reassembled in 273]"
"210","0.125707","100.86.235.39","151.101.65.140","TCP","66","56449  >  443 [ACK] Seq=172 Ack=137181 Win=5328 Len=0 TSval=921847241 TSecr=867553583"
"211","0.126027","151.101.65.140","100.86.235.39","TCP","1510","443  >  56449 [ACK] Seq=137181 Ack=172 Win=424 Len=1444 TSval=867553585 TSecr=921847232 [TCP PDU reassembled in 273]"
"212","0.126028","151.101.65.140","100.86.235.39","TCP","1510","443  >  56449 [PSH, ACK] Seq=138625 Ack=172 Win=424 Len=1444 TSval=867553585 TSecr=921847232 [TCP PDU reassembled in 273]"
"213","0.126203","100.86.235.39","151.101.65.140","TCP","66","56449  >  443 [ACK] Seq=172 Ack=140069 Win=5328 Len=0 TSval=921847242 TSecr=867553585"
"214","0.128546","151.101.65.140","100.86.235.39","TCP","1510","443  >  56449 [ACK] Seq=140069 Ack=172 Win=424 Len=1444 TSval=867553587 TSecr=921847234 [TCP PDU reassembled in 273]"
"215","0.129190","151.101.65.140","100.86.235.39","TCP","1510","443  >  56449 [PSH, ACK] Seq=141513 Ack=172 Win=424 Len=1444 TSval=867553587 TSecr=921847234 [TCP PDU reassembled in 273]"
"216","0.129267","100.86.235.39","151.101.65.140","TCP","66","56449  >  443 [ACK] Seq=172 Ack=142957 Win=5328 Len=0 TSval=921847244 TSecr=867553587"
"217","0.129404","151.101.65.140","100.86.235.39","TCP","1510","443  >  56449 [ACK] Seq=142957 Ack=172 Win=424 Len=1444 TSval=867553588 TSecr=921847234 [TCP PDU reassembled in 273]"
"218","0.129405","151.101.65.140","100.86.235.39","TCP","1510","443  >  56449 [PSH, ACK] Seq=144401 Ack=172 Win=424 Len=1444 TSval=867553588 TSecr=921847234 [TCP PDU reassembled in 273]"
"219","0.129470","100.86.235.39","151.101.65.140","TCP","66","56449  >  443 [ACK] Seq=172 Ack=145845 Win=5328 Len=0 TSval=921847244 TSecr=867553588"
"220","0.131206","151.101.65.140","100.86.235.39","TCP","1510","443  >  56449 [ACK] Seq=145845 Ack=172 Win=424 Len=1444 TSval=867553590 TSecr=921847237 [TCP PDU reassembled in 273]"
"221","0.131959","151.101.65.140","100.86.235.39","TCP","1510","443  >  56449 [PSH, ACK] Seq=147289 Ack=172 Win=424 Len=1444 TSval=867553590 TSecr=921847237 [TCP PDU reassembled in 273]"
"222","0.132023","100.86.235.39","151.101.65.140","TCP","66","56449  >  443 [ACK] Seq=172 Ack=148733 Win=5328 Len=0 TSval=921847247 TSecr=867553590"
"223","0.135399","151.101.65.140","100.86.235.39","TCP","1510","443  >  56449 [ACK] Seq=148733 Ack=172 Win=424 Len=1444 TSval=867553594 TSecr=921847241 [TCP PDU reassembled in 273]"
"224","0.135421","151.101.65.140","100.86.235.39","TCP","1510","443  >  56449 [PSH, ACK] Seq=150177 Ack=172 Win=424 Len=1444 TSval=867553594 TSecr=921847241 [TCP PDU reassembled in 273]"
"225","0.135493","100.86.235.39","151.101.65.140","TCP","66","56449  >  443 [ACK] Seq=172 Ack=151621 Win=5328 Len=0 TSval=921847251 TSecr=867553594"
"226","0.136225","151.101.65.140","100.86.235.39","TCP","1510","443  >  56449 [ACK] Seq=151621 Ack=172 Win=424 Len=1444 TSval=867553595 TSecr=921847242 [TCP PDU reassembled in 273]"
"227","0.139396","151.101.65.140","100.86.235.39","TCP","1510","443  >  56449 [ACK] Seq=153065 Ack=172 Win=424 Len=1444 TSval=867553598 TSecr=921847244 [TCP PDU reassembled in 273]"
"228","0.139419","151.101.65.140","100.86.235.39","TCP","1510","443  >  56449 [PSH, ACK] Seq=154509 Ack=172 Win=424 Len=1444 TSval=867553598 TSecr=921847244 [TCP PDU reassembled in 273]"
"229","0.139593","100.86.235.39","151.101.65.140","TCP","66","56449  >  443 [ACK] Seq=172 Ack=155953 Win=5328 Len=0 TSval=921847255 TSecr=867553595"
"230","0.140882","151.101.65.140","100.86.235.39","TCP","1510","443  >  56449 [ACK] Seq=155953 Ack=172 Win=424 Len=1444 TSval=867553600 TSecr=921847244 [TCP PDU reassembled in 273]"
"231","0.142031","151.101.65.140","100.86.235.39","TCP","1510","443  >  56449 [PSH, ACK] Seq=157397 Ack=172 Win=424 Len=1444 TSval=867553600 TSecr=921847244 [TCP PDU reassembled in 273]"
"232","0.142118","100.86.235.39","151.101.65.140","TCP","66","56449  >  443 [ACK] Seq=172 Ack=158841 Win=5328 Len=0 TSval=921847258 TSecr=867553600"
"233","0.142289","151.101.65.140","100.86.235.39","TCP","1510","443  >  56449 [ACK] Seq=158841 Ack=172 Win=424 Len=1444 TSval=867553601 TSecr=921847247 [TCP PDU reassembled in 273]"
"234","0.142290","151.101.65.140","100.86.235.39","TCP","1510","443  >  56449 [PSH, ACK] Seq=160285 Ack=172 Win=424 Len=1444 TSval=867553601 TSecr=921847247 [TCP PDU reassembled in 273]"
"235","0.142351","100.86.235.39","151.101.65.140","TCP","66","56449  >  443 [ACK] Seq=172 Ack=161729 Win=5328 Len=0 TSval=921847258 TSecr=867553601"
"236","0.146079","151.101.65.140","100.86.235.39","TCP","1510","443  >  56449 [ACK] Seq=161729 Ack=172 Win=424 Len=1444 TSval=867553605 TSecr=921847251 [TCP PDU reassembled in 273]"
"237","0.146310","151.101.65.140","100.86.235.39","TCP","1510","443  >  56449 [PSH, ACK] Seq=163173 Ack=172 Win=424 Len=1444 TSval=867553605 TSecr=921847251 [TCP PDU reassembled in 273]"
"238","0.146384","100.86.235.39","151.101.65.140","TCP","66","56449  >  443 [ACK] Seq=172 Ack=164617 Win=5328 Len=0 TSval=921847262 TSecr=867553605"
"239","0.148253","151.101.65.140","100.86.235.39","TLSv1.2","107","Application Data"
"240","0.148303","100.86.235.39","151.101.65.140","TCP","66","56383  >  443 [ACK] Seq=11730 Ack=9431 Win=2047 Len=0 TSval=1359971632 TSecr=557196612"
"241","0.150279","151.101.65.140","100.86.235.39","TCP","1510","443  >  56449 [ACK] Seq=164617 Ack=172 Win=424 Len=1444 TSval=867553609 TSecr=921847255 [TCP PDU reassembled in 273]"
"242","0.150670","151.101.65.140","100.86.235.39","TCP","1510","443  >  56449 [PSH, ACK] Seq=166061 Ack=172 Win=424 Len=1444 TSval=867553609 TSecr=921847255 [TCP PDU reassembled in 273]"
"243","0.150745","100.86.235.39","151.101.65.140","TCP","66","56449  >  443 [ACK] Seq=172 Ack=167505 Win=5328 Len=0 TSval=921847266 TSecr=867553609"
"244","0.151453","151.101.65.140","100.86.235.39","TCP","1510","443  >  56449 [ACK] Seq=167505 Ack=172 Win=424 Len=1444 TSval=867553610 TSecr=921847255 [TCP PDU reassembled in 273]"
"245","0.151454","151.101.65.140","100.86.235.39","TCP","1510","443  >  56449 [PSH, ACK] Seq=168949 Ack=172 Win=424 Len=1444 TSval=867553610 TSecr=921847255 [TCP PDU reassembled in 273]"
"246","0.151529","100.86.235.39","151.101.65.140","TCP","66","56449  >  443 [ACK] Seq=172 Ack=170393 Win=5328 Len=0 TSval=921847267 TSecr=867553610"
"247","0.152923","151.101.65.140","100.86.235.39","TCP","1510","443  >  56449 [ACK] Seq=170393 Ack=172 Win=424 Len=1444 TSval=867553612 TSecr=921847258 [TCP PDU reassembled in 273]"
"248","0.153727","151.101.65.140","100.86.235.39","TCP","1510","443  >  56449 [PSH, ACK] Seq=171837 Ack=172 Win=424 Len=1444 TSval=867553612 TSecr=921847258 [TCP PDU reassembled in 273]"
"249","0.153820","100.86.235.39","151.101.65.140","TCP","66","56449  >  443 [ACK] Seq=172 Ack=173281 Win=5328 Len=0 TSval=921847269 TSecr=867553612"
"250","0.154583","151.101.65.140","100.86.235.39","TCP","1510","443  >  56449 [ACK] Seq=173281 Ack=172 Win=424 Len=1444 TSval=867553614 TSecr=921847258 [TCP PDU reassembled in 273]"
"251","0.155065","151.101.65.140","100.86.235.39","TCP","1510","443  >  56449 [PSH, ACK] Seq=174725 Ack=172 Win=424 Len=1444 TSval=867553614 TSecr=921847258 [TCP PDU reassembled in 273]"
"252","0.155147","100.86.235.39","151.101.65.140","TCP","66","56449  >  443 [ACK] Seq=172 Ack=176169 Win=5328 Len=0 TSval=921847270 TSecr=867553614"
"253","0.156929","151.101.65.140","100.86.235.39","TCP","1510","443  >  56449 [ACK] Seq=176169 Ack=172 Win=424 Len=1444 TSval=867553616 TSecr=921847262 [TCP PDU reassembled in 273]"
"254","0.160497","151.101.65.140","100.86.235.39","TCP","1510","[TCP Previous segment not captured] 443  >  56449 [ACK] Seq=179057 Ack=172 Win=424 Len=1444 TSval=867553620 TSecr=921847266 [TCP PDU reassembled in 273]"
"255","0.160568","100.86.235.39","151.101.65.140","TCP","78","56449  >  443 [ACK] Seq=172 Ack=177613 Win=5328 Len=0 TSval=921847276 TSecr=867553616 SLE=179057 SRE=180501"
"256","0.161086","151.101.65.140","100.86.235.39","TCP","1510","443  >  56449 [PSH, ACK] Seq=180501 Ack=172 Win=424 Len=1444 TSval=867553620 TSecr=921847266 [TCP PDU reassembled in 273]"
"257","0.161131","100.86.235.39","151.101.65.140","TCP","78","[TCP Dup ACK 255#1] 56449  >  443 [ACK] Seq=172 Ack=177613 Win=5328 Len=0 TSval=921847276 TSecr=867553616 SLE=179057 SRE=181945"
"258","0.164609","151.101.65.140","100.86.235.39","TCP","1510","443  >  56449 [ACK] Seq=181945 Ack=172 Win=424 Len=1444 TSval=867553623 TSecr=921847269 [TCP PDU reassembled in 273]"
"259","0.164633","151.101.65.140","100.86.235.39","TCP","1510","443  >  56449 [PSH, ACK] Seq=183389 Ack=172 Win=424 Len=1444 TSval=867553623 TSecr=921847269 [TCP PDU reassembled in 273]"
"260","0.164679","100.86.235.39","151.101.65.140","TCP","78","[TCP Dup ACK 255#2] 56449  >  443 [ACK] Seq=172 Ack=177613 Win=5328 Len=0 TSval=921847281 TSecr=867553616 SLE=179057 SRE=183389"
"261","0.164707","100.86.235.39","151.101.65.140","TCP","78","[TCP Dup ACK 255#3] 56449  >  443 [ACK] Seq=172 Ack=177613 Win=5328 Len=0 TSval=921847281 TSecr=867553616 SLE=179057 SRE=184833"
"262","0.165434","151.101.65.140","100.86.235.39","TCP","1510","443  >  56449 [ACK] Seq=184833 Ack=172 Win=424 Len=1444 TSval=867553624 TSecr=921847269 [TCP PDU reassembled in 273]"
"263","0.165435","151.101.65.140","100.86.235.39","TCP","1510","443  >  56449 [PSH, ACK] Seq=186277 Ack=172 Win=424 Len=1444 TSval=867553624 TSecr=921847269 [TCP PDU reassembled in 273]"
"264","0.165473","100.86.235.39","151.101.65.140","TCP","78","[TCP Dup ACK 255#4] 56449  >  443 [ACK] Seq=172 Ack=177613 Win=5328 Len=0 TSval=921847281 TSecr=867553616 SLE=179057 SRE=187721"
"265","0.167351","151.101.65.140","100.86.235.39","TCP","1510","443  >  56449 [ACK] Seq=187721 Ack=172 Win=424 Len=1444 TSval=867553626 TSecr=921847270 [TCP PDU reassembled in 273]"
"266","0.167408","100.86.235.39","151.101.65.140","TCP","78","[TCP Dup ACK 255#5] 56449  >  443 [ACK] Seq=172 Ack=177613 Win=5328 Len=0 TSval=921847283 TSecr=867553616 SLE=179057 SRE=189165"
"267","0.167582","151.101.65.140","100.86.235.39","TCP","1510","443  >  56449 [PSH, ACK] Seq=189165 Ack=172 Win=424 Len=1444 TSval=867553626 TSecr=921847270 [TCP PDU reassembled in 273], Ignored Unknown Record"
"268","0.167607","100.86.235.39","151.101.65.140","TCP","78","[TCP Dup ACK 255#6] 56449  >  443 [ACK] Seq=172 Ack=177613 Win=5328 Len=0 TSval=921847283 TSecr=867553616 SLE=179057 SRE=190609"
"269","0.170564","151.101.65.140","100.86.235.39","TLSv1.2","1510","Ignored Unknown Record"
"270","0.170601","100.86.235.39","151.101.65.140","TCP","78","[TCP Dup ACK 255#7] 56449  >  443 [ACK] Seq=172 Ack=177613 Win=5328 Len=0 TSval=921847286 TSecr=867553616 SLE=179057 SRE=192053"
"271","0.170850","151.101.65.140","100.86.235.39","TLSv1.2","1510","Ignored Unknown Record"
"272","0.170894","100.86.235.39","151.101.65.140","TCP","78","[TCP Dup ACK 255#8] 56449  >  443 [ACK] Seq=172 Ack=177613 Win=5328 Len=0 TSval=921847286 TSecr=867553616 SLE=179057 SRE=193497"
"273","0.172316","151.101.65.140","100.86.235.39","TLSv1.2","1510","[TCP Fast Retransmission] "
"274","0.172361","100.86.235.39","151.101.65.140","TCP","66","56449  >  443 [ACK] Seq=172 Ack=193497 Win=5080 Len=0 TSval=921847288 TSecr=867553630"
"275","0.172560","100.86.235.39","151.101.65.140","TCP","66","[TCP Window Update] 56449  >  443 [ACK] Seq=172 Ack=193497 Win=5328 Len=0 TSval=921847288 TSecr=867553630"
"276","0.186048","151.101.65.140","100.86.235.39","TLSv1.2","1510","Ignored Unknown Record"
"277","0.186050","151.101.65.140","100.86.235.39","TLSv1.2","1510","Ignored Unknown Record"
"278","0.186051","151.101.65.140","100.86.235.39","TLSv1.2","1510","Ignored Unknown Record"
"279","0.186121","100.86.235.39","151.101.65.140","TCP","66","56449  >  443 [ACK] Seq=172 Ack=197829 Win=5260 Len=0 TSval=921847302 TSecr=867553636"
"280","0.186217","100.86.235.39","151.101.65.140","TCP","66","[TCP Window Update] 56449  >  443 [ACK] Seq=172 Ack=197829 Win=5328 Len=0 TSval=921847302 TSecr=867553636"
"281","0.188475","151.101.65.140","100.86.235.39","TLSv1.2","1510","Ignored Unknown Record"
"282","0.188476","151.101.65.140","100.86.235.39","TLSv1.2","1510","Ignored Unknown Record"
"283","0.188477","151.101.65.140","100.86.235.39","TLSv1.2","1510","Ignored Unknown Record"
"284","0.188564","100.86.235.39","151.101.65.140","TCP","66","56449  >  443 [ACK] Seq=172 Ack=202161 Win=5260 Len=0 TSval=921847304 TSecr=867553641"
"285","0.188652","100.86.235.39","151.101.65.140","TCP","66","[TCP Window Update] 56449  >  443 [ACK] Seq=172 Ack=202161 Win=5328 Len=0 TSval=921847304 TSecr=867553641"
"286","0.194256","151.101.65.140","100.86.235.39","TLSv1.2","1510","Ignored Unknown Record"
"287","0.194315","100.86.235.39","151.101.65.140","TCP","66","56449  >  443 [ACK] Seq=172 Ack=203605 Win=5306 Len=0 TSval=921847310 TSecr=867553653"
"288","0.196712","151.101.65.140","100.86.235.39","TLSv1.2","1510","Ignored Unknown Record"
"289","0.196743","151.101.65.140","100.86.235.39","TLSv1.2","1510","Ignored Unknown Record"
"290","0.196773","100.86.235.39","151.101.65.140","TCP","66","56449  >  443 [ACK] Seq=172 Ack=205049 Win=5306 Len=0 TSval=921847313 TSecr=867553655"
"291","0.196811","100.86.235.39","151.101.65.140","TCP","66","56449  >  443 [ACK] Seq=172 Ack=206493 Win=5283 Len=0 TSval=921847313 TSecr=867553655"
"292","0.198715","151.101.65.140","100.86.235.39","TLSv1.2","1510","Ignored Unknown Record"
"293","0.198731","151.101.65.140","100.86.235.39","TLSv1.2","1510","Ignored Unknown Record"
"294","0.198748","100.86.235.39","151.101.65.140","TCP","66","56449  >  443 [ACK] Seq=172 Ack=207937 Win=5306 Len=0 TSval=921847315 TSecr=867553657"
"295","0.198786","100.86.235.39","151.101.65.140","TCP","66","56449  >  443 [ACK] Seq=172 Ack=209381 Win=5283 Len=0 TSval=921847315 TSecr=867553657"
"296","0.201940","151.101.65.140","100.86.235.39","TLSv1.2","1510","Ignored Unknown Record"
