"No.","Time","Source","Destination","Protocol","Length","Info"
"1","0.000000","100.86.243.187","151.101.1.140","TCP","1514","56485  >  443 [ACK] Seq=1 Ack=1 Win=3925 Len=1448 TSval=2851274577 TSecr=1266220017 [TCP PDU reassembled in 3]"
"2","0.000001","100.86.243.187","151.101.1.140","TCP","1514","56485  >  443 [ACK] Seq=1449 Ack=1 Win=3925 Len=1448 TSval=2851274577 TSecr=1266220017 [TCP PDU reassembled in 3]"
"3","0.000039","100.86.243.187","151.101.1.140","TLSv1.2","181","Application Data"
"4","0.000102","100.86.243.187","151.101.1.140","TLSv1.2","850","Application Data"
"5","0.006213","100.86.243.187","151.101.1.140","TCP","1514","56485  >  443 [ACK] Seq=3796 Ack=1 Win=3925 Len=1448 TSval=2851274583 TSecr=1266220017 [TCP PDU reassembled in 7]"
"6","0.006214","100.86.243.187","151.101.1.140","TCP","1514","56485  >  443 [ACK] Seq=5244 Ack=1 Win=3925 Len=1448 TSval=2851274583 TSecr=1266220017 [TCP PDU reassembled in 7]"
"7","0.006250","100.86.243.187","151.101.1.140","TLSv1.2","146","Application Data"
"12","0.012470","151.101.1.140","100.86.243.187","TCP","66","443  >  56485 [ACK] Seq=1 Ack=3796 Win=635 Len=0 TSval=1266220072 TSecr=2851274577"
"14","0.019069","151.101.1.140","100.86.243.187","TCP","66","443  >  56485 [ACK] Seq=1 Ack=6772 Win=635 Len=0 TSval=1266220078 TSecr=2851274583"
"15","0.031882","151.101.1.140","100.86.243.187","TCP","1510","443  >  56485 [ACK] Seq=1 Ack=6772 Win=639 Len=1444 TSval=1266220090 TSecr=2851274583 [TCP PDU reassembled in 16]"
"16","0.031883","151.101.1.140","100.86.243.187","TLSv1.2","377","Application Data"
"17","0.031953","100.86.243.187","151.101.1.140","TCP","66","56485  >  443 [ACK] Seq=6772 Ack=1756 Win=3898 Len=0 TSval=2851274608 TSecr=1266220090"
"18","0.088477","100.86.243.187","151.101.1.140","TCP","1514","56485  >  443 [ACK] Seq=6772 Ack=1756 Win=3925 Len=1448 TSval=2851274665 TSecr=1266220090 [TCP PDU reassembled in 20]"
"19","0.088479","100.86.243.187","151.101.1.140","TCP","1514","56485  >  443 [ACK] Seq=8220 Ack=1756 Win=3925 Len=1448 TSval=2851274665 TSecr=1266220090 [TCP PDU reassembled in 20]"
"20","0.088520","100.86.243.187","151.101.1.140","TLSv1.2","150","Application Data"
"21","0.089233","100.86.243.187","151.101.1.140","TCP","1514","56485  >  443 [ACK] Seq=9752 Ack=1756 Win=3925 Len=1448 TSval=2851274665 TSecr=1266220090 [TCP PDU reassembled in 22]"
"22","0.089260","100.86.243.187","151.101.1.140","TLSv1.2","1478","Application Data"
"29","0.142944","151.101.1.140","100.86.243.187","TCP","1510","443  >  56485 [ACK] Seq=1756 Ack=6772 Win=639 Len=1444 TSval=1266220104 TSecr=2851274608 [TCP PDU reassembled in 30]"
"30","0.148682","151.101.1.140","100.86.243.187","TLSv1.2","932","Application Data"
"31","0.148683","151.101.1.140","100.86.243.187","TCP","1510","443  >  56485 [ACK] Seq=4066 Ack=6772 Win=639 Len=1444 TSval=1266220108 TSecr=2851274608 [TCP PDU reassembled in 32]"
"32","0.148684","151.101.1.140","100.86.243.187","TLSv1.2","219","Application Data"
"33","0.148684","151.101.1.140","100.86.243.187","TLSv1.2","99","Application Data"
"34","0.148685","151.101.1.140","100.86.243.187","TCP","99","[TCP Retransmission] 443  >  56485 [PSH, ACK] Seq=5663 Ack=6772 Win=639 Len=33 TSval=1266220206 TSecr=2851274608"
"35","0.148787","100.86.243.187","151.101.1.140","TCP","78","56485  >  443 [ACK] Seq=12612 Ack=5696 Win=3886 Len=0 TSval=2851274725 TSecr=1266220104 SLE=5663 SRE=5696"
"36","0.153648","151.101.1.140","100.86.243.187","TCP","66","443  >  56485 [ACK] Seq=5696 Ack=11200 Win=632 Len=0 TSval=1266220213 TSecr=2851274665"
"37","0.153649","151.101.1.140","100.86.243.187","TCP","66","443  >  56485 [ACK] Seq=5696 Ack=12612 Win=635 Len=0 TSval=1266220213 TSecr=2851274665"
"51","0.184586","151.101.1.140","100.86.243.187","TCP","1510","443  >  56485 [ACK] Seq=5696 Ack=12612 Win=639 Len=1444 TSval=1266220244 TSecr=2851274725 [TCP PDU reassembled in 52]"
"52","0.184587","151.101.1.140","100.86.243.187","TLSv1.2","1017","Application Data"
"54","0.184671","100.86.243.187","151.101.1.140","TCP","66","56485  >  443 [ACK] Seq=12612 Ack=8091 Win=3888 Len=0 TSval=2851274761 TSecr=1266220244"
"66","0.211449","151.101.1.140","100.86.243.187","TCP","1510","443  >  56485 [ACK] Seq=8091 Ack=12612 Win=639 Len=1444 TSval=1266220270 TSecr=2851274761 [TCP PDU reassembled in 67]"
"67","0.211451","151.101.1.140","100.86.243.187","TLSv1.2","266","Application Data"
"68","0.211530","100.86.243.187","151.101.1.140","TCP","66","56485  >  443 [ACK] Seq=12612 Ack=9735 Win=3900 Len=0 TSval=2851274788 TSecr=1266220270"
"69","0.224512","151.101.1.140","100.86.243.187","TLSv1.2","438","Application Data"
"70","0.224512","151.101.1.140","100.86.243.187","TLSv1.2","97","Application Data"
"71","0.224582","100.86.243.187","151.101.1.140","TCP","66","56485  >  443 [ACK] Seq=12612 Ack=10138 Win=3919 Len=0 TSval=2851274801 TSecr=1266220284"
"72","0.227432","100.86.243.187","151.101.1.140","TCP","1514","56485  >  443 [ACK] Seq=12612 Ack=10138 Win=3925 Len=1448 TSval=2851274804 TSecr=1266220284 [TCP PDU reassembled in 73]"
"73","0.227461","100.86.243.187","151.101.1.140","TLSv1.2","1474","Application Data"
"74","0.228125","100.86.243.187","151.101.1.140","TCP","1514","56485  >  443 [ACK] Seq=15468 Ack=10138 Win=3925 Len=1448 TSval=2851274804 TSecr=1266220284 [TCP PDU reassembled in 75]"
"75","0.228145","100.86.243.187","151.101.1.140","TLSv1.2","1489","Application Data"
"76","0.228690","100.86.243.187","151.101.1.140","TCP","1514","56485  >  443 [ACK] Seq=18339 Ack=10138 Win=3925 Len=1448 TSval=2851274805 TSecr=1266220284 [TCP PDU reassembled in 78]"
"77","0.228692","100.86.243.187","151.101.1.140","TCP","1514","56485  >  443 [ACK] Seq=19787 Ack=10138 Win=3925 Len=1448 TSval=2851274805 TSecr=1266220284 [TCP PDU reassembled in 78]"
"78","0.228715","100.86.243.187","151.101.1.140","TLSv1.2","179","Application Data"
"79","0.228751","100.86.243.187","151.101.1.140","TLSv1.2","146","Application Data"
"80","0.229042","100.86.243.187","151.101.1.140","TCP","1514","56485  >  443 [ACK] Seq=21428 Ack=10138 Win=3925 Len=1448 TSval=2851274805 TSecr=1266220284 [TCP PDU reassembled in 82]"
"81","0.229045","100.86.243.187","151.101.1.140","TCP","1514","56485  >  443 [ACK] Seq=22876 Ack=10138 Win=3925 Len=1448 TSval=2851274805 TSecr=1266220284 [TCP PDU reassembled in 82]"
"82","0.229061","100.86.243.187","151.101.1.140","TLSv1.2","119","Application Data"
"85","0.240306","151.101.1.140","100.86.243.187","TCP","66","443  >  56485 [ACK] Seq=10138 Ack=15468 Win=635 Len=0 TSval=1266220299 TSecr=2851274804"
"86","0.240308","151.101.1.140","100.86.243.187","TCP","66","443  >  56485 [ACK] Seq=10138 Ack=18339 Win=631 Len=0 TSval=1266220300 TSecr=2851274804"
"87","0.240310","151.101.1.140","100.86.243.187","TCP","66","443  >  56485 [ACK] Seq=10138 Ack=24377 Win=630 Len=0 TSval=1266220300 TSecr=2851274805"
"92","0.264216","151.101.1.140","100.86.243.187","TCP","1510","443  >  56485 [ACK] Seq=10138 Ack=24377 Win=639 Len=1444 TSval=1266220323 TSecr=2851274805 [TCP PDU reassembled in 93]"
"93","0.264218","151.101.1.140","100.86.243.187","TLSv1.2","994","Application Data"
"94","0.264332","100.86.243.187","151.101.1.140","TCP","66","56485  >  443 [ACK] Seq=24377 Ack=12510 Win=3888 Len=0 TSval=2851274841 TSecr=1266220323"
"95","0.266233","151.101.1.140","100.86.243.187","TLSv1.2","112","Application Data"
"96","0.266316","100.86.243.187","151.101.1.140","TCP","66","56485  >  443 [ACK] Seq=24377 Ack=12556 Win=3925 Len=0 TSval=2851274843 TSecr=1266220325"
"97","0.273341","151.101.1.140","100.86.243.187","TCP","1510","443  >  56485 [ACK] Seq=12556 Ack=24377 Win=639 Len=1444 TSval=1266220333 TSecr=2851274805 [TCP PDU reassembled in 98]"
"98","0.273410","151.101.1.140","100.86.243.187","TLSv1.2","251","Application Data"
"99","0.273523","100.86.243.187","151.101.1.140","TCP","66","56485  >  443 [ACK] Seq=24377 Ack=14185 Win=3925 Len=0 TSval=2851274850 TSecr=1266220333"
"100","0.277295","151.101.1.140","100.86.243.187","TCP","1510","443  >  56485 [ACK] Seq=14185 Ack=24377 Win=639 Len=1444 TSval=1266220337 TSecr=2851274841 [TCP PDU reassembled in 101]"
"101","0.277296","151.101.1.140","100.86.243.187","TLSv1.2","919","Application Data"
"102","0.277433","100.86.243.187","151.101.1.140","TCP","66","56485  >  443 [ACK] Seq=24377 Ack=16482 Win=3925 Len=0 TSval=2851274853 TSecr=1266220337"
"103","0.279740","151.101.1.140","100.86.243.187","TLSv1.2","1119","Application Data"
"104","0.279865","100.86.243.187","151.101.1.140","TCP","66","56485  >  443 [ACK] Seq=24377 Ack=17535 Win=3925 Len=0 TSval=2851274856 TSecr=1266220340"
"105","0.286429","151.101.1.140","100.86.243.187","TCP","1510","443  >  56485 [ACK] Seq=17535 Ack=24377 Win=639 Len=1444 TSval=1266220346 TSecr=2851274850 [TCP PDU reassembled in 106]"
"106","0.286430","151.101.1.140","100.86.243.187","TLSv1.2","307","Application Data"
"107","0.286558","100.86.243.187","151.101.1.140","TCP","66","56485  >  443 [ACK] Seq=24377 Ack=19220 Win=3925 Len=0 TSval=2851274863 TSecr=1266220346"
"108","0.286859","151.101.1.140","100.86.243.187","TLSv1.2","112","Application Data"
"109","0.286950","100.86.243.187","151.101.1.140","TCP","66","56485  >  443 [ACK] Seq=24377 Ack=19266 Win=3925 Len=0 TSval=2851274863 TSecr=1266220347"
"120","0.352682","151.101.1.140","100.86.243.187","TLSv1.2","1035","Application Data"
"121","0.352722","151.101.1.140","100.86.243.187","TLSv1.2","113","Application Data"
"122","0.352899","100.86.243.187","151.101.1.140","TCP","66","56485  >  443 [ACK] Seq=24377 Ack=20282 Win=3925 Len=0 TSval=2851274929 TSecr=1266220411"
"123","0.359678","151.101.1.140","100.86.243.187","TLSv1.2","97","Application Data"
"124","0.359828","100.86.243.187","151.101.1.140","TCP","66","56485  >  443 [ACK] Seq=24377 Ack=20313 Win=3925 Len=0 TSval=2851274936 TSecr=1266220419"
"138","0.489872","151.101.1.140","100.86.243.187","TLSv1.2","815","Application Data"
"139","0.489873","151.101.1.140","100.86.243.187","TLSv1.2","107","Application Data"
"140","0.490278","100.86.243.187","151.101.1.140","TCP","66","56485  >  443 [ACK] Seq=24377 Ack=21103 Win=3925 Len=0 TSval=2851275067 TSecr=1266220443"
"141","0.508571","151.101.1.140","100.86.243.187","TLSv1.2","97","Application Data"
"142","0.508572","151.101.1.140","100.86.243.187","TCP","97","[TCP Retransmission] 443  >  56485 [PSH, ACK] Seq=21103 Ack=24377 Win=639 Len=31 TSval=1266220489 TSecr=2851274936"
"145","0.508768","100.86.243.187","151.101.1.140","TCP","78","56485  >  443 [ACK] Seq=24377 Ack=21134 Win=3925 Len=0 TSval=2851275085 TSecr=1266220443 SLE=21103 SRE=21134"
"182","0.621073","100.86.243.187","151.101.1.140","TCP","1514","56485  >  443 [ACK] Seq=24377 Ack=21134 Win=3925 Len=1448 TSval=2851275198 TSecr=1266220443 [TCP PDU reassembled in 184]"
"183","0.621075","100.86.243.187","151.101.1.140","TCP","1514","56485  >  443 [ACK] Seq=25825 Ack=21134 Win=3925 Len=1448 TSval=2851275198 TSecr=1266220443 [TCP PDU reassembled in 184]"
"184","0.621118","100.86.243.187","151.101.1.140","TLSv1.2","183","Application Data"
"185","0.621182","100.86.243.187","151.101.1.140","TCP","1514","56485  >  443 [ACK] Seq=27390 Ack=21134 Win=3925 Len=1448 TSval=2851275198 TSecr=1266220443 [TCP PDU reassembled in 186]"
"186","0.621194","100.86.243.187","151.101.1.140","TLSv1.2","1042","Application Data"
"192","0.685679","100.86.243.187","151.101.1.140","TCP","1514","[TCP Retransmission] 56485  >  443 [PSH, ACK] Seq=28366 Ack=21134 Win=3925 Len=1448 TSval=2851275262 TSecr=1266220443 [TCP PDU reassembled in 186]"
"197","0.694954","151.101.1.140","100.86.243.187","TCP","66","443  >  56485 [ACK] Seq=21134 Ack=29814 Win=631 Len=0 TSval=1266220753 TSecr=2851275198"
"202","0.720755","151.101.1.140","100.86.243.187","TCP","78","[TCP Dup ACK 197#1] 443  >  56485 [ACK] Seq=21134 Ack=29814 Win=639 Len=0 TSval=1266220770 TSecr=2851275262 SLE=28366 SRE=29814"
"217","0.862772","151.101.1.140","100.86.243.187","TCP","1510","443  >  56485 [ACK] Seq=21134 Ack=29814 Win=639 Len=1444 TSval=1266220803 TSecr=2851275262 [TCP PDU reassembled in 218]"
"218","0.862772","151.101.1.140","100.86.243.187","TLSv1.2","1040","Application Data"
"219","0.862863","100.86.243.187","151.101.1.140","TCP","66","56485  >  443 [ACK] Seq=29814 Ack=23552 Win=3888 Len=0 TSval=2851275439 TSecr=1266220803"
"232","1.420020","151.101.1.140","100.86.243.187","TCP","1040","[TCP Spurious Retransmission] 443  >  56485 [PSH, ACK] Seq=22578 Ack=29814 Win=639 Len=974 TSval=1266220918 TSecr=2851275262 [TCP PDU reassembled in 218]"
"233","1.420021","151.101.1.140","100.86.243.187","TLSv1.2","257","Application Data"
"234","1.420021","151.101.1.140","100.86.243.187","TCP","1510","443  >  56485 [ACK] Seq=23743 Ack=29814 Win=639 Len=1444 TSval=1266220936 TSecr=2851275262 [TCP PDU reassembled in 235]"
"235","1.420022","151.101.1.140","100.86.243.187","TLSv1.2","492","Application Data"
"236","1.420022","151.101.1.140","100.86.243.187","TCP","1510","443  >  56485 [ACK] Seq=25613 Ack=29814 Win=639 Len=1444 TSval=1266220939 TSecr=2851275262 [TCP PDU reassembled in 237]"
"237","1.420023","151.101.1.140","100.86.243.187","TLSv1.2","1486","Application Data"
"238","1.420141","100.86.243.187","151.101.1.140","TCP","78","56485  >  443 [ACK] Seq=29814 Ack=28477 Win=3848 Len=0 TSval=2851275997 TSecr=1266220939 SLE=22578 SRE=23552"
"239","1.420347","100.86.243.187","151.101.1.140","TCP","66","[TCP Window Update] 56485  >  443 [ACK] Seq=29814 Ack=28477 Win=3925 Len=0 TSval=2851275997 TSecr=1266220939"
"241","1.523439","151.101.1.140","100.86.243.187","TLSv1.2","1510","[TCP Previous segment not captured] , Ignored Unknown Record"
"243","1.523440","151.101.1.140","100.86.243.187","TLSv1.2","1510","Ignored Unknown Record"
"244","1.523441","151.101.1.140","100.86.243.187","TLSv1.2","1510","Ignored Unknown Record"
"252","1.523574","100.86.243.187","151.101.1.140","TCP","78","[TCP Dup ACK 238#1] 56485  >  443 [ACK] Seq=29814 Ack=28477 Win=3925 Len=0 TSval=2851276100 TSecr=1266220939 SLE=31365 SRE=35697"
"266","1.524914","151.101.1.140","100.86.243.187","TCP","257","[TCP Spurious Retransmission] 443  >  56485 [PSH, ACK] Seq=23552 Ack=29814 Win=639 Len=191 TSval=1266221294 TSecr=2851275439"
"273","1.525249","100.86.243.187","151.101.1.140","TCP","86","[TCP Dup ACK 238#2] 56485  >  443 [ACK] Seq=29814 Ack=28477 Win=3925 Len=0 TSval=2851276102 TSecr=1266220939 SLE=23552 SRE=23743 SLE=31365 SRE=35697"
"276","1.561728","151.101.1.140","100.86.243.187","TLSv1.2","1510","Ignored Unknown Record"
"277","1.561730","151.101.1.140","100.86.243.187","TLSv1.2","1510","Ignored Unknown Record"
"279","1.561732","151.101.1.140","100.86.243.187","TLSv1.2","1510","Ignored Unknown Record"
"280","1.561734","151.101.1.140","100.86.243.187","TLSv1.2","1510","Ignored Unknown Record"
"282","1.561927","100.86.243.187","151.101.1.140","TCP","78","[TCP Dup ACK 238#3] 56485  >  443 [ACK] Seq=29814 Ack=28477 Win=3925 Len=0 TSval=2851276138 TSecr=1266220939 SLE=31365 SRE=41473"
"283","1.708805","151.101.1.140","100.86.243.187","TCP","1510","[TCP Retransmission] 443  >  56485 [ACK] Seq=28477 Ack=29814 Win=639 Len=1444 TSval=1266221599 TSecr=2851276100"
"284","1.708806","151.101.1.140","100.86.243.187","TCP","1510","[TCP Retransmission] 443  >  56485 [PSH, ACK] Seq=29921 Ack=29814 Win=639 Len=1444 TSval=1266221599 TSecr=2851276100"
"289","1.708917","100.86.243.187","151.101.1.140","TCP","66","56485  >  443 [ACK] Seq=29814 Ack=41473 Win=3722 Len=0 TSval=2851276285 TSecr=1266221599"
"293","1.709374","100.86.243.187","151.101.1.140","TCP","66","[TCP Window Update] 56485  >  443 [ACK] Seq=29814 Ack=41473 Win=3925 Len=0 TSval=2851276285 TSecr=1266221599"
"295","1.720555","151.101.1.140","100.86.243.187","TLSv1.2","1510","Ignored Unknown Record"
"296","1.720558","151.101.1.140","100.86.243.187","TLSv1.2","1510","Ignored Unknown Record"
"297","1.720558","151.101.1.140","100.86.243.187","TLSv1.2","1510","Ignored Unknown Record"
"298","1.720559","151.101.1.140","100.86.243.187","TLSv1.2","1510","Ignored Unknown Record"
"299","1.720652","100.86.243.187","151.101.1.140","TCP","66","56485  >  443 [ACK] Seq=29814 Ack=47249 Win=3835 Len=0 TSval=2851276297 TSecr=1266221666"
"300","1.720894","100.86.243.187","151.101.1.140","TCP","66","[TCP Window Update] 56485  >  443 [ACK] Seq=29814 Ack=47249 Win=3925 Len=0 TSval=2851276297 TSecr=1266221666"
"301","1.739389","151.101.1.140","100.86.243.187","TLSv1.2","1510","Ignored Unknown Record"
"303","1.739481","100.86.243.187","151.101.1.140","TCP","66","56485  >  443 [ACK] Seq=29814 Ack=48693 Win=3903 Len=0 TSval=2851276316 TSecr=1266221666"
"305","1.740994","151.101.1.140","100.86.243.187","TLSv1.2","1510","Ignored Unknown Record"
"306","1.740995","151.101.1.140","100.86.243.187","TLSv1.2","1510","Ignored Unknown Record"
"307","1.741107","100.86.243.187","151.101.1.140","TCP","66","56485  >  443 [ACK] Seq=29814 Ack=51581 Win=3880 Len=0 TSval=2851276318 TSecr=1266221793"
"309","1.872279","151.101.1.140","100.86.243.187","TLSv1.2","1510","[TCP Previous segment not captured] , Ignored Unknown Record"
"310","1.872281","151.101.1.140","100.86.243.187","TLSv1.2","1510","Ignored Unknown Record"
"311","1.872406","100.86.243.187","151.101.1.140","TCP","78","[TCP Dup ACK 307#1] 56485  >  443 [ACK] Seq=29814 Ack=51581 Win=3925 Len=0 TSval=2851276449 TSecr=1266221793 SLE=54469 SRE=57357"
"312","1.885728","151.101.1.140","100.86.243.187","TLSv1.2","1510","Ignored Unknown Record"
"313","1.885730","151.101.1.140","100.86.243.187","TLSv1.2","1510","Ignored Unknown Record"
"314","1.885860","100.86.243.187","151.101.1.140","TCP","78","[TCP Dup ACK 307#2] 56485  >  443 [ACK] Seq=29814 Ack=51581 Win=3925 Len=0 TSval=2851276462 TSecr=1266221793 SLE=54469 SRE=60245"
"315","1.902639","151.101.1.140","100.86.243.187","TLSv1.2","1510","Ignored Unknown Record"
"316","1.902640","151.101.1.140","100.86.243.187","TLSv1.2","434","Ignored Unknown Record"
"317","1.902737","100.86.243.187","151.101.1.140","TCP","78","[TCP Dup ACK 307#3] 56485  >  443 [ACK] Seq=29814 Ack=51581 Win=3925 Len=0 TSval=2851276479 TSecr=1266221793 SLE=54469 SRE=62057"
"318","1.925202","151.101.1.140","100.86.243.187","TCP","1510","[TCP Retransmission] 443  >  56485 [ACK] Seq=51581 Ack=29814 Win=639 Len=1444 TSval=1266221984 TSecr=2851276449"
"319","1.925203","151.101.1.140","100.86.243.187","TCP","1510","[TCP Retransmission] 443  >  56485 [PSH, ACK] Seq=53025 Ack=29814 Win=639 Len=1444 TSval=1266221984 TSecr=2851276449"
"320","1.925310","100.86.243.187","151.101.1.140","TCP","66","56485  >  443 [ACK] Seq=29814 Ack=62057 Win=3762 Len=0 TSval=2851276502 TSecr=1266221984"
"321","1.925543","100.86.243.187","151.101.1.140","TCP","66","[TCP Window Update] 56485  >  443 [ACK] Seq=29814 Ack=62057 Win=3925 Len=0 TSval=2851276502 TSecr=1266221984"
"326","1.964239","151.101.1.140","100.86.243.187","TCP","1510","443  >  56485 [ACK] Seq=62057 Ack=29814 Win=639 Len=1444 TSval=1266222021 TSecr=2851276462 [TCP PDU reassembled in 327]"
"327","1.964240","151.101.1.140","100.86.243.187","TLSv1.2","1510","Application Data"
"328","1.964325","100.86.243.187","151.101.1.140","TCP","66","56485  >  443 [ACK] Seq=29814 Ack=64945 Win=3880 Len=0 TSval=2851276541 TSecr=1266222021"
"329","1.993246","151.101.1.140","100.86.243.187","TLSv1.2","911","Application Data, Application Data"
"330","1.993336","100.86.243.187","151.101.1.140","TCP","66","56485  >  443 [ACK] Seq=29814 Ack=65790 Win=3912 Len=0 TSval=2851276570 TSecr=1266222054"
"424","2.808587","100.86.243.187","151.101.1.140","TLSv1.2","170","Application Data"
"427","2.811347","100.86.243.187","151.101.1.140","TLSv1.2","236","Application Data"
"428","2.811630","100.86.243.187","151.101.1.140","TLSv1.2","146","Application Data"
"429","2.811816","100.86.243.187","151.101.1.140","TLSv1.2","215","Application Data"
"431","2.812178","100.86.243.187","151.101.1.140","TLSv1.2","145","Application Data"
"432","2.812466","100.86.243.187","151.101.1.140","TLSv1.2","235","Application Data"
"435","2.813918","100.86.243.187","151.101.1.140","TLSv1.2","146","Application Data"
"440","2.915215","151.101.1.140","100.86.243.187","TCP","66","443  >  56520 [ACK] Seq=1 Ack=105 Win=296 Len=0 TSval=2144838178 TSecr=2085310092"
"441","2.915215","151.101.1.140","100.86.243.187","TCP","66","443  >  56509 [ACK] Seq=1 Ack=171 Win=424 Len=0 TSval=3914483609 TSecr=514184136"
"443","2.916320","151.101.1.140","100.86.243.187","TCP","1510","443  >  56520 [ACK] Seq=1 Ack=105 Win=296 Len=1444 TSval=2144838179 TSecr=2085310092 [TCP PDU reassembled in 445]"
"444","2.916321","151.101.1.140","100.86.243.187","TCP","1510","443  >  56520 [ACK] Seq=1445 Ack=105 Win=296 Len=1444 TSval=2144838179 TSecr=2085310092 [TCP PDU reassembled in 445]"
"445","2.916321","151.101.1.140","100.86.243.187","TLSv1.2","1355","Application Data"
"446","2.916322","151.101.1.140","100.86.243.187","TCP","66","443  >  56509 [ACK] Seq=1 Ack=479 Win=424 Len=0 TSval=3914483610 TSecr=514184137"
"450","2.916325","151.101.1.140","100.86.243.187","TCP","1510","443  >  56509 [ACK] Seq=1 Ack=479 Win=424 Len=1444 TSval=3914483610 TSecr=514184137 [TCP PDU reassembled in 491]"
"451","2.916326","151.101.1.140","100.86.243.187","TCP","1510","443  >  56509 [PSH, ACK] Seq=1445 Ack=479 Win=424 Len=1444 TSval=3914483610 TSecr=514184137 [TCP PDU reassembled in 491]"
"452","2.916326","151.101.1.140","100.86.243.187","TCP","1510","443  >  56509 [ACK] Seq=2889 Ack=479 Win=424 Len=1444 TSval=3914483612 TSecr=514184137 [TCP PDU reassembled in 491]"
"453","2.916327","151.101.1.140","100.86.243.187","TCP","1510","443  >  56509 [PSH, ACK] Seq=4333 Ack=479 Win=424 Len=1444 TSval=3914483612 TSecr=514184137 [TCP PDU reassembled in 491]"
"459","2.916331","151.101.1.140","100.86.243.187","TCP","1510","443  >  56509 [ACK] Seq=5777 Ack=479 Win=424 Len=1444 TSval=3914483614 TSecr=514184137 [TCP PDU reassembled in 491]"
"460","2.916332","151.101.1.140","100.86.243.187","TCP","1510","443  >  56509 [PSH, ACK] Seq=7221 Ack=479 Win=424 Len=1444 TSval=3914483614 TSecr=514184137 [TCP PDU reassembled in 491]"
"465","2.916335","151.101.1.140","100.86.243.187","TCP","1510","443  >  56509 [ACK] Seq=8665 Ack=648 Win=424 Len=1444 TSval=3914483616 TSecr=514184137 [TCP PDU reassembled in 491]"
"466","2.916336","151.101.1.140","100.86.243.187","TCP","1510","443  >  56509 [PSH, ACK] Seq=10109 Ack=648 Win=424 Len=1444 TSval=3914483616 TSecr=514184137 [TCP PDU reassembled in 491]"
"467","2.916458","100.86.243.187","151.101.1.140","TCP","66","56520  >  443 [ACK] Seq=105 Ack=4178 Win=2819 Len=0 TSval=2085310200 TSecr=2144838179"
"469","2.916565","100.86.243.187","151.101.1.140","TCP","66","56509  >  443 [ACK] Seq=728 Ack=8665 Win=6890 Len=0 TSval=514184242 TSecr=3914483614"
"470","2.916587","100.86.243.187","151.101.1.140","TCP","66","56509  >  443 [ACK] Seq=728 Ack=11553 Win=6845 Len=0 TSval=514184242 TSecr=3914483616"
"473","2.916928","100.86.243.187","151.101.1.140","TCP","66","[TCP Window Update] 56520  >  443 [ACK] Seq=105 Ack=4178 Win=2885 Len=0 TSval=2085310200 TSecr=2144838179"
"474","2.917247","100.86.243.187","151.101.1.140","TCP","66","[TCP Window Update] 56509  >  443 [ACK] Seq=728 Ack=11553 Win=7025 Len=0 TSval=514184242 TSecr=3914483616"
"479","2.919072","151.101.1.140","100.86.243.187","TCP","1355","[TCP Spurious Retransmission] 443  >  56520 [PSH, ACK] Seq=2889 Ack=105 Win=296 Len=1289 TSval=2144838208 TSecr=2085310092 [TCP PDU reassembled in 445]"
"480","2.919073","151.101.1.140","100.86.243.187","TCP","1510","443  >  56509 [ACK] Seq=11553 Ack=648 Win=424 Len=1444 TSval=3914483641 TSecr=514184137 [TCP PDU reassembled in 491]"
"483","2.919192","100.86.243.187","151.101.1.140","TCP","78","[TCP Dup ACK 467#1] 56520  >  443 [ACK] Seq=105 Ack=4178 Win=2885 Len=0 TSval=2085310203 TSecr=2144838208 SLE=2889 SRE=4178"
"484","2.919239","100.86.243.187","151.101.1.140","TCP","66","56509  >  443 [ACK] Seq=728 Ack=12997 Win=7002 Len=0 TSval=514184245 TSecr=3914483641"
"487","2.928058","151.101.1.140","100.86.243.187","TCP","66","443  >  56509 [ACK] Seq=12997 Ack=728 Win=424 Len=0 TSval=3914483715 TSecr=514184139"
"490","2.930782","151.101.1.140","100.86.243.187","TCP","1510","443  >  56509 [ACK] Seq=12997 Ack=728 Win=424 Len=1444 TSval=3914483716 TSecr=514184242 [TCP PDU reassembled in 491]"
"491","2.930783","151.101.1.140","100.86.243.187","TLSv1.2","1510","Application Data"
"497","2.930910","100.86.243.187","151.101.1.140","TCP","66","56509  >  443 [ACK] Seq=728 Ack=15885 Win=6980 Len=0 TSval=514184256 TSecr=3914483716"
"501","2.931663","151.101.1.140","100.86.243.187","TCP","1510","443  >  56509 [ACK] Seq=15885 Ack=728 Win=424 Len=1444 TSval=3914483719 TSecr=514184242 [TCP PDU reassembled in 537]"
"502","2.931664","151.101.1.140","100.86.243.187","TCP","1510","443  >  56509 [PSH, ACK] Seq=17329 Ack=728 Win=424 Len=1444 TSval=3914483719 TSecr=514184242 [TCP PDU reassembled in 537]"
"504","2.931740","100.86.243.187","151.101.1.140","TCP","66","56509  >  443 [ACK] Seq=728 Ack=18773 Win=6980 Len=0 TSval=514184256 TSecr=3914483719"
"510","2.935692","151.101.1.140","100.86.243.187","TCP","1510","443  >  56509 [ACK] Seq=18773 Ack=728 Win=424 Len=1444 TSval=3914483724 TSecr=514184242 [TCP PDU reassembled in 537]"
"511","2.935694","151.101.1.140","100.86.243.187","TCP","1510","443  >  56509 [PSH, ACK] Seq=20217 Ack=728 Win=424 Len=1444 TSval=3914483724 TSecr=514184242 [TCP PDU reassembled in 537]"
"513","2.935813","100.86.243.187","151.101.1.140","TCP","66","56509  >  443 [ACK] Seq=728 Ack=21661 Win=6980 Len=0 TSval=514184261 TSecr=3914483724"
"517","2.941427","151.101.1.140","100.86.243.187","TCP","1510","443  >  56509 [ACK] Seq=21661 Ack=728 Win=424 Len=1444 TSval=3914483728 TSecr=514184245 [TCP PDU reassembled in 537]"
"518","2.941428","151.101.1.140","100.86.243.187","TCP","1510","443  >  56509 [PSH, ACK] Seq=23105 Ack=728 Win=424 Len=1444 TSval=3914483728 TSecr=514184245 [TCP PDU reassembled in 537]"
"519","2.941544","100.86.243.187","151.101.1.140","TCP","66","56509  >  443 [ACK] Seq=728 Ack=24549 Win=6980 Len=0 TSval=514184267 TSecr=3914483728"
"524","2.947460","151.101.1.140","100.86.243.187","TCP","1510","443  >  56509 [ACK] Seq=24549 Ack=728 Win=424 Len=1444 TSval=3914483734 TSecr=514184256 [TCP PDU reassembled in 537]"
"525","2.947462","151.101.1.140","100.86.243.187","TCP","1510","443  >  56509 [PSH, ACK] Seq=25993 Ack=728 Win=424 Len=1444 TSval=3914483734 TSecr=514184256 [TCP PDU reassembled in 537]"
"528","2.947577","100.86.243.187","151.101.1.140","TCP","66","56509  >  443 [ACK] Seq=728 Ack=27437 Win=6980 Len=0 TSval=514184273 TSecr=3914483734"
"530","2.953303","151.101.1.140","100.86.243.187","TCP","1510","443  >  56509 [ACK] Seq=27437 Ack=728 Win=424 Len=1444 TSval=3914483740 TSecr=514184256 [TCP PDU reassembled in 537]"
"531","2.953305","151.101.1.140","100.86.243.187","TCP","1510","443  >  56509 [PSH, ACK] Seq=28881 Ack=728 Win=424 Len=1444 TSval=3914483740 TSecr=514184256 [TCP PDU reassembled in 537]"
"534","2.953403","100.86.243.187","151.101.1.140","TCP","66","56509  >  443 [ACK] Seq=728 Ack=30325 Win=6980 Len=0 TSval=514184279 TSecr=3914483740"
"536","2.958402","151.101.1.140","100.86.243.187","TCP","1510","443  >  56509 [ACK] Seq=30325 Ack=728 Win=424 Len=1444 TSval=3914483745 TSecr=514184261 [TCP PDU reassembled in 537]"
"537","2.958403","151.101.1.140","100.86.243.187","TLSv1.2","1510","Application Data"
"540","2.958523","100.86.243.187","151.101.1.140","TCP","66","56509  >  443 [ACK] Seq=728 Ack=33213 Win=6980 Len=0 TSval=514184284 TSecr=3914483745"
"542","2.963256","151.101.1.140","100.86.243.187","TCP","1510","443  >  56509 [ACK] Seq=33213 Ack=728 Win=424 Len=1444 TSval=3914483750 TSecr=514184267 [TCP PDU reassembled in 561]"
"543","2.963258","151.101.1.140","100.86.243.187","TCP","1510","443  >  56509 [PSH, ACK] Seq=34657 Ack=728 Win=424 Len=1444 TSval=3914483750 TSecr=514184267 [TCP PDU reassembled in 561]"
"546","2.963384","100.86.243.187","151.101.1.140","TCP","66","56509  >  443 [ACK] Seq=728 Ack=36101 Win=6980 Len=0 TSval=514184289 TSecr=3914483750"
"548","2.966692","151.101.1.140","100.86.243.187","TCP","1510","443  >  56509 [ACK] Seq=36101 Ack=728 Win=424 Len=1444 TSval=3914483754 TSecr=514184273 [TCP PDU reassembled in 561]"
"549","2.966694","151.101.1.140","100.86.243.187","TCP","1510","443  >  56509 [PSH, ACK] Seq=37545 Ack=728 Win=424 Len=1444 TSval=3914483754 TSecr=514184273 [TCP PDU reassembled in 561]"
"550","2.966807","100.86.243.187","151.101.1.140","TCP","66","56509  >  443 [ACK] Seq=728 Ack=38989 Win=6980 Len=0 TSval=514184292 TSecr=3914483754"
"551","2.972114","151.101.1.140","100.86.243.187","TCP","1510","443  >  56509 [ACK] Seq=38989 Ack=728 Win=424 Len=1444 TSval=3914483759 TSecr=514184279 [TCP PDU reassembled in 561]"
"552","2.972116","151.101.1.140","100.86.243.187","TCP","1510","443  >  56509 [PSH, ACK] Seq=40433 Ack=728 Win=424 Len=1444 TSval=3914483759 TSecr=514184279 [TCP PDU reassembled in 561]"
"553","2.972228","100.86.243.187","151.101.1.140","TCP","66","56509  >  443 [ACK] Seq=728 Ack=41877 Win=6980 Len=0 TSval=514184298 TSecr=3914483759"
"554","2.973737","151.101.1.140","100.86.243.187","TCP","1510","443  >  56509 [ACK] Seq=41877 Ack=728 Win=424 Len=1444 TSval=3914483762 TSecr=514184279 [TCP PDU reassembled in 561]"
"555","2.973838","100.86.243.187","151.101.1.140","TCP","66","56509  >  443 [ACK] Seq=728 Ack=43321 Win=7002 Len=0 TSval=514184299 TSecr=3914483762"
"556","2.976068","151.101.1.140","100.86.243.187","TCP","1510","443  >  56509 [ACK] Seq=43321 Ack=728 Win=424 Len=1444 TSval=3914483764 TSecr=514184284 [TCP PDU reassembled in 561]"
"557","2.976168","100.86.243.187","151.101.1.140","TCP","66","56509  >  443 [ACK] Seq=728 Ack=44765 Win=7002 Len=0 TSval=514184302 TSecr=3914483764"
"558","2.976492","151.101.1.140","100.86.243.187","TCP","1510","443  >  56509 [PSH, ACK] Seq=44765 Ack=728 Win=424 Len=1444 TSval=3914483764 TSecr=514184284 [TCP PDU reassembled in 561]"
"559","2.976561","100.86.243.187","151.101.1.140","TCP","66","56509  >  443 [ACK] Seq=728 Ack=46209 Win=7002 Len=0 TSval=514184302 TSecr=3914483764"
"560","2.980883","151.101.1.140","100.86.243.187","TCP","1510","443  >  56509 [ACK] Seq=46209 Ack=728 Win=424 Len=1444 TSval=3914483767 TSecr=514184289 [TCP PDU reassembled in 561]"
"561","2.981057","151.101.1.140","100.86.243.187","TLSv1.2","1510","Application Data"
"562","2.981240","100.86.243.187","151.101.1.140","TCP","66","56509  >  443 [ACK] Seq=728 Ack=49097 Win=7025 Len=0 TSval=514184306 TSecr=3914483767"
"563","2.982645","151.101.1.140","100.86.243.187","TCP","1510","443  >  56509 [ACK] Seq=49097 Ack=728 Win=424 Len=1444 TSval=3914483771 TSecr=514184292 [TCP PDU reassembled in 578]"
"564","2.982646","151.101.1.140","100.86.243.187","TCP","1510","443  >  56509 [PSH, ACK] Seq=50541 Ack=728 Win=424 Len=1444 TSval=3914483771 TSecr=514184292 [TCP PDU reassembled in 578]"
"565","2.982802","100.86.243.187","151.101.1.140","TCP","66","56509  >  443 [ACK] Seq=728 Ack=51985 Win=7025 Len=0 TSval=514184308 TSecr=3914483771"
"566","2.986104","151.101.1.140","100.86.243.187","TCP","1510","443  >  56509 [ACK] Seq=51985 Ack=728 Win=424 Len=1444 TSval=3914483774 TSecr=514184298 [TCP PDU reassembled in 578]"
"567","2.986105","151.101.1.140","100.86.243.187","TCP","1510","443  >  56509 [PSH, ACK] Seq=53429 Ack=728 Win=424 Len=1444 TSval=3914483774 TSecr=514184298 [TCP PDU reassembled in 578]"
"568","2.986251","100.86.243.187","151.101.1.140","TCP","66","56509  >  443 [ACK] Seq=728 Ack=54873 Win=7025 Len=0 TSval=514184312 TSecr=3914483774"
"569","2.988363","151.101.1.140","100.86.243.187","TCP","1510","443  >  56509 [ACK] Seq=54873 Ack=728 Win=424 Len=1444 TSval=3914483777 TSecr=514184302 [TCP PDU reassembled in 578]"
"570","2.989219","151.101.1.140","100.86.243.187","TCP","1510","443  >  56509 [PSH, ACK] Seq=56317 Ack=728 Win=424 Len=1444 TSval=3914483777 TSecr=514184302 [TCP PDU reassembled in 578]"
"571","2.989832","100.86.243.187","151.101.1.140","TCP","66","56509  >  443 [ACK] Seq=728 Ack=57761 Win=7025 Len=0 TSval=514184314 TSecr=3914483777"
"572","2.992037","151.101.1.140","100.86.243.187","TCP","1510","443  >  56509 [ACK] Seq=57761 Ack=728 Win=424 Len=1444 TSval=3914483780 TSecr=514184306 [TCP PDU reassembled in 578]"
"573","2.992039","151.101.1.140","100.86.243.187","TCP","1510","443  >  56509 [PSH, ACK] Seq=59205 Ack=728 Win=424 Len=1444 TSval=3914483780 TSecr=514184306 [TCP PDU reassembled in 578]"
"574","2.992202","100.86.243.187","151.101.1.140","TCP","66","56509  >  443 [ACK] Seq=728 Ack=60649 Win=7025 Len=0 TSval=514184318 TSecr=3914483780"
"575","2.993980","151.101.1.140","100.86.243.187","TCP","1510","443  >  56509 [ACK] Seq=60649 Ack=728 Win=424 Len=1444 TSval=3914483782 TSecr=514184308 [TCP PDU reassembled in 578]"
"576","2.994404","151.101.1.140","100.86.243.187","TCP","1510","443  >  56509 [PSH, ACK] Seq=62093 Ack=728 Win=424 Len=1444 TSval=3914483782 TSecr=514184308 [TCP PDU reassembled in 578]"
"577","2.994528","100.86.243.187","151.101.1.140","TCP","66","56509  >  443 [ACK] Seq=728 Ack=63537 Win=7025 Len=0 TSval=514184320 TSecr=3914483782"
"578","2.997378","151.101.1.140","100.86.243.187","TLSv1.2","1510","Application Data"
"579","2.997409","151.101.1.140","100.86.243.187","TCP","1510","443  >  56509 [PSH, ACK] Seq=64981 Ack=728 Win=424 Len=1444 TSval=3914483785 TSecr=514184312 [TCP PDU reassembled in 594]"
"580","2.997611","100.86.243.187","151.101.1.140","TCP","66","56509  >  443 [ACK] Seq=728 Ack=66425 Win=7025 Len=0 TSval=514184323 TSecr=3914483785"
"581","3.002340","151.101.1.140","100.86.243.187","TCP","1510","443  >  56509 [ACK] Seq=66425 Ack=728 Win=424 Len=1444 TSval=3914483789 TSecr=514184314 [TCP PDU reassembled in 594]"
"582","3.002342","151.101.1.140","100.86.243.187","TCP","1510","443  >  56509 [PSH, ACK] Seq=67869 Ack=728 Win=424 Len=1444 TSval=3914483789 TSecr=514184314 [TCP PDU reassembled in 594]"
"583","3.002343","151.101.1.140","100.86.243.187","TCP","1510","443  >  56509 [ACK] Seq=69313 Ack=728 Win=424 Len=1444 TSval=3914483790 TSecr=514184314 [TCP PDU reassembled in 594]"
"584","3.002344","151.101.1.140","100.86.243.187","TCP","1510","443  >  56509 [PSH, ACK] Seq=70757 Ack=728 Win=424 Len=1444 TSval=3914483790 TSecr=514184314 [TCP PDU reassembled in 594]"
"585","3.002509","100.86.243.187","151.101.1.140","TCP","66","56509  >  443 [ACK] Seq=728 Ack=72201 Win=7025 Len=0 TSval=514184328 TSecr=3914483790"
"586","3.004387","151.101.1.140","100.86.243.187","TCP","1510","443  >  56509 [ACK] Seq=72201 Ack=728 Win=424 Len=1444 TSval=3914483792 TSecr=514184318 [TCP PDU reassembled in 594]"
"587","3.005907","151.101.1.140","100.86.243.187","TCP","1510","443  >  56509 [PSH, ACK] Seq=73645 Ack=728 Win=424 Len=1444 TSval=3914483792 TSecr=514184318 [TCP PDU reassembled in 594]"
"588","3.005908","151.101.1.140","100.86.243.187","TCP","1510","443  >  56509 [ACK] Seq=75089 Ack=728 Win=424 Len=1444 TSval=3914483795 TSecr=514184320 [TCP PDU reassembled in 594]"
"589","3.006057","100.86.243.187","151.101.1.140","TCP","66","56509  >  443 [ACK] Seq=728 Ack=76533 Win=7025 Len=0 TSval=514184331 TSecr=3914483792"
"590","3.007558","151.101.1.140","100.86.243.187","TCP","1510","443  >  56509 [ACK] Seq=76533 Ack=728 Win=424 Len=1444 TSval=3914483796 TSecr=514184323 [TCP PDU reassembled in 594]"
"591","3.008294","151.101.1.140","100.86.243.187","TCP","1510","443  >  56509 [PSH, ACK] Seq=77977 Ack=728 Win=424 Len=1444 TSval=3914483796 TSecr=514184323 [TCP PDU reassembled in 594]"
"592","3.008422","100.86.243.187","151.101.1.140","TCP","66","56509  >  443 [ACK] Seq=728 Ack=79421 Win=7025 Len=0 TSval=514184333 TSecr=3914483796"
"593","3.009875","151.101.1.140","100.86.243.187","TCP","1510","443  >  56509 [ACK] Seq=79421 Ack=728 Win=424 Len=1444 TSval=3914483798 TSecr=514184323 [TCP PDU reassembled in 594]"
"594","3.015374","151.101.1.140","100.86.243.187","TLSv1.2","1510","Application Data, Application Data"
"595","3.015376","151.101.1.140","100.86.243.187","TCP","1510","443  >  56509 [PSH, ACK] Seq=82309 Ack=728 Win=424 Len=1444 TSval=3914483801 TSecr=514184328 [TCP PDU reassembled in 606]"
"596","3.015377","151.101.1.140","100.86.243.187","TCP","1510","443  >  56509 [ACK] Seq=83753 Ack=728 Win=424 Len=1444 TSval=3914483802 TSecr=514184328 [TCP PDU reassembled in 606]"
"597","3.015378","151.101.1.140","100.86.243.187","TCP","1510","443  >  56509 [PSH, ACK] Seq=85197 Ack=728 Win=424 Len=1444 TSval=3914483802 TSecr=514184328 [TCP PDU reassembled in 606]"
"598","3.015770","100.86.243.187","151.101.1.140","TCP","66","56509  >  443 [ACK] Seq=728 Ack=86641 Win=7025 Len=0 TSval=514184341 TSecr=3914483798"
"599","3.018180","151.101.1.140","100.86.243.187","TCP","1510","443  >  56509 [ACK] Seq=86641 Ack=728 Win=424 Len=1444 TSval=3914483805 TSecr=514184331 [TCP PDU reassembled in 606]"
"600","3.018181","151.101.1.140","100.86.243.187","TCP","1510","443  >  56509 [PSH, ACK] Seq=88085 Ack=728 Win=424 Len=1444 TSval=3914483805 TSecr=514184331 [TCP PDU reassembled in 606]"
"601","3.018344","100.86.243.187","151.101.1.140","TCP","66","56509  >  443 [ACK] Seq=728 Ack=89529 Win=7025 Len=0 TSval=514184344 TSecr=3914483805"
"602","3.018675","151.101.1.140","100.86.243.187","TCP","1510","443  >  56509 [ACK] Seq=89529 Ack=728 Win=424 Len=1444 TSval=3914483807 TSecr=514184333 [TCP PDU reassembled in 606]"
"603","3.019423","151.101.1.140","100.86.243.187","TCP","1510","443  >  56509 [PSH, ACK] Seq=90973 Ack=728 Win=424 Len=1444 TSval=3914483807 TSecr=514184333 [TCP PDU reassembled in 606]"
"604","3.019538","100.86.243.187","151.101.1.140","TCP","66","56509  >  443 [ACK] Seq=728 Ack=92417 Win=7025 Len=0 TSval=514184345 TSecr=3914483807"
"605","3.030109","151.101.1.140","100.86.243.187","TCP","1510","443  >  56509 [ACK] Seq=92417 Ack=728 Win=424 Len=1444 TSval=3914483816 TSecr=514184341 [TCP PDU reassembled in 606]"
"606","3.030110","151.101.1.140","100.86.243.187","TLSv1.2","1510","Application Data, Application Data"
"607","3.030111","151.101.1.140","100.86.243.187","TCP","1510","443  >  56509 [ACK] Seq=95305 Ack=728 Win=424 Len=1444 TSval=3914483817 TSecr=514184341 [TCP PDU reassembled in 622]"
"608","3.030112","151.101.1.140","100.86.243.187","TCP","1510","443  >  56509 [PSH, ACK] Seq=96749 Ack=728 Win=424 Len=1444 TSval=3914483817 TSecr=514184341 [TCP PDU reassembled in 622]"
"609","3.030222","151.101.1.140","100.86.243.187","TCP","1510","443  >  56509 [ACK] Seq=98193 Ack=728 Win=424 Len=1444 TSval=3914483819 TSecr=514184341 [TCP PDU reassembled in 622]"
"610","3.030609","100.86.243.187","151.101.1.140","TCP","66","56509  >  443 [ACK] Seq=728 Ack=99637 Win=7025 Len=0 TSval=514184356 TSecr=3914483817"
"611","3.030778","151.101.1.140","100.86.243.187","TCP","1510","443  >  56509 [PSH, ACK] Seq=99637 Ack=728 Win=424 Len=1444 TSval=3914483819 TSecr=514184341 [TCP PDU reassembled in 622]"
"612","3.030873","100.86.243.187","151.101.1.140","TCP","66","56509  >  443 [ACK] Seq=728 Ack=101081 Win=7025 Len=0 TSval=514184356 TSecr=3914483819"
"613","3.032682","151.101.1.140","100.86.243.187","TCP","1510","443  >  56509 [ACK] Seq=101081 Ack=728 Win=424 Len=1444 TSval=3914483821 TSecr=514184344 [TCP PDU reassembled in 622]"
"614","3.033117","151.101.1.140","100.86.243.187","TCP","1510","443  >  56509 [PSH, ACK] Seq=102525 Ack=728 Win=424 Len=1444 TSval=3914483821 TSecr=514184344 [TCP PDU reassembled in 622]"
"615","3.033243","100.86.243.187","151.101.1.140","TCP","66","56509  >  443 [ACK] Seq=728 Ack=103969 Win=7025 Len=0 TSval=514184358 TSecr=3914483821"
"616","3.034685","151.101.1.140","100.86.243.187","TCP","1510","443  >  56509 [ACK] Seq=103969 Ack=728 Win=424 Len=1444 TSval=3914483823 TSecr=514184345 [TCP PDU reassembled in 622]"
"617","3.035275","151.101.1.140","100.86.243.187","TCP","1510","443  >  56509 [PSH, ACK] Seq=105413 Ack=728 Win=424 Len=1444 TSval=3914483823 TSecr=514184345 [TCP PDU reassembled in 622]"
"618","3.035390","100.86.243.187","151.101.1.140","TCP","66","56509  >  443 [ACK] Seq=728 Ack=106857 Win=7025 Len=0 TSval=514184360 TSecr=3914483823"
"619","3.039996","151.101.1.140","100.86.243.187","TCP","1510","443  >  56509 [ACK] Seq=106857 Ack=728 Win=424 Len=1444 TSval=3914483828 TSecr=514184356 [TCP PDU reassembled in 622]"
"620","3.040229","151.101.1.140","100.86.243.187","TCP","1510","443  >  56509 [PSH, ACK] Seq=108301 Ack=728 Win=424 Len=1444 TSval=3914483828 TSecr=514184356 [TCP PDU reassembled in 622]"
"621","3.040338","100.86.243.187","151.101.1.140","TCP","66","56509  >  443 [ACK] Seq=728 Ack=109745 Win=7025 Len=0 TSval=514184366 TSecr=3914483828"
"622","3.040846","151.101.1.140","100.86.243.187","TLSv1.2","1510","Application Data"
"623","3.041621","151.101.1.140","100.86.243.187","TCP","1510","443  >  56509 [PSH, ACK] Seq=111189 Ack=728 Win=424 Len=1444 TSval=3914483829 TSecr=514184356 [TCP PDU reassembled in 640]"
"624","3.041738","100.86.243.187","151.101.1.140","TCP","66","56509  >  443 [ACK] Seq=728 Ack=112633 Win=7025 Len=0 TSval=514184367 TSecr=3914483829"
"625","3.042541","151.101.1.140","100.86.243.187","TCP","1510","443  >  56509 [ACK] Seq=112633 Ack=728 Win=424 Len=1444 TSval=3914483831 TSecr=514184356 [TCP PDU reassembled in 640]"
"626","3.043328","151.101.1.140","100.86.243.187","TCP","1510","443  >  56509 [PSH, ACK] Seq=114077 Ack=728 Win=424 Len=1444 TSval=3914483831 TSecr=514184356 [TCP PDU reassembled in 640]"
"627","3.043467","100.86.243.187","151.101.1.140","TCP","66","56509  >  443 [ACK] Seq=728 Ack=115521 Win=7025 Len=0 TSval=514184368 TSecr=3914483831"
"628","3.044193","151.101.1.140","100.86.243.187","TCP","1510","443  >  56509 [ACK] Seq=115521 Ack=728 Win=424 Len=1444 TSval=3914483832 TSecr=514184356 [TCP PDU reassembled in 640]"
"629","3.044674","151.101.1.140","100.86.243.187","TCP","1510","443  >  56509 [PSH, ACK] Seq=116965 Ack=728 Win=424 Len=1444 TSval=3914483832 TSecr=514184356 [TCP PDU reassembled in 640]"
"630","3.044792","100.86.243.187","151.101.1.140","TCP","66","56509  >  443 [ACK] Seq=728 Ack=118409 Win=7025 Len=0 TSval=514184370 TSecr=3914483832"
"631","3.046219","151.101.1.140","100.86.243.187","TCP","1510","443  >  56509 [ACK] Seq=118409 Ack=728 Win=424 Len=1444 TSval=3914483834 TSecr=514184358 [TCP PDU reassembled in 640]"
"632","3.046861","151.101.1.140","100.86.243.187","TCP","1510","443  >  56509 [PSH, ACK] Seq=119853 Ack=728 Win=424 Len=1444 TSval=3914483834 TSecr=514184358 [TCP PDU reassembled in 640]"
"633","3.046994","100.86.243.187","151.101.1.140","TCP","66","56509  >  443 [ACK] Seq=728 Ack=121297 Win=7025 Len=0 TSval=514184372 TSecr=3914483834"
"634","3.047705","151.101.1.140","100.86.243.187","TCP","1510","443  >  56509 [ACK] Seq=121297 Ack=728 Win=424 Len=1444 TSval=3914483836 TSecr=514184360 [TCP PDU reassembled in 640]"
"635","3.047757","151.101.1.140","100.86.243.187","TCP","1510","443  >  56509 [PSH, ACK] Seq=122741 Ack=728 Win=424 Len=1444 TSval=3914483836 TSecr=514184360 [TCP PDU reassembled in 640]"
"636","3.047925","100.86.243.187","151.101.1.140","TCP","66","56509  >  443 [ACK] Seq=728 Ack=124185 Win=7025 Len=0 TSval=514184373 TSecr=3914483836"
"637","3.050240","151.101.1.140","100.86.243.187","TCP","1510","443  >  56509 [ACK] Seq=124185 Ack=728 Win=424 Len=1444 TSval=3914483839 TSecr=514184366 [TCP PDU reassembled in 640]"
"638","3.050635","151.101.1.140","100.86.243.187","TCP","1510","443  >  56509 [PSH, ACK] Seq=125629 Ack=728 Win=424 Len=1444 TSval=3914483839 TSecr=514184366 [TCP PDU reassembled in 640]"
"639","3.050795","100.86.243.187","151.101.1.140","TCP","66","56509  >  443 [ACK] Seq=728 Ack=127073 Win=7025 Len=0 TSval=514184376 TSecr=3914483839"
"640","3.051846","151.101.1.140","100.86.243.187","TLSv1.2","1510","Application Data"
"641","3.052486","151.101.1.140","100.86.243.187","TCP","1510","443  >  56509 [PSH, ACK] Seq=128517 Ack=728 Win=424 Len=1444 TSval=3914483840 TSecr=514184367 [TCP PDU reassembled in 655]"
"642","3.052623","100.86.243.187","151.101.1.140","TCP","66","56509  >  443 [ACK] Seq=728 Ack=129961 Win=7025 Len=0 TSval=514184377 TSecr=3914483840"
"643","3.053589","151.101.1.140","100.86.243.187","TCP","1510","443  >  56509 [ACK] Seq=129961 Ack=728 Win=424 Len=1444 TSval=3914483842 TSecr=514184370 [TCP PDU reassembled in 655]"
"644","3.053872","151.101.1.140","100.86.243.187","TCP","1510","443  >  56509 [PSH, ACK] Seq=131405 Ack=728 Win=424 Len=1444 TSval=3914483842 TSecr=514184370 [TCP PDU reassembled in 655]"
"645","3.053979","100.86.243.187","151.101.1.140","TCP","66","56509  >  443 [ACK] Seq=728 Ack=132849 Win=7025 Len=0 TSval=514184379 TSecr=3914483842"
"646","3.054824","151.101.1.140","100.86.243.187","TCP","1510","443  >  56509 [ACK] Seq=132849 Ack=728 Win=424 Len=1444 TSval=3914483843 TSecr=514184370 [TCP PDU reassembled in 655]"
"647","3.055163","151.101.1.140","100.86.243.187","TCP","1510","443  >  56509 [PSH, ACK] Seq=134293 Ack=728 Win=424 Len=1444 TSval=3914483843 TSecr=514184370 [TCP PDU reassembled in 655]"
"648","3.055273","100.86.243.187","151.101.1.140","TCP","66","56509  >  443 [ACK] Seq=728 Ack=135737 Win=7025 Len=0 TSval=514184380 TSecr=3914483843"
"649","3.056691","151.101.1.140","100.86.243.187","TCP","1510","443  >  56509 [ACK] Seq=135737 Ack=728 Win=424 Len=1444 TSval=3914483845 TSecr=514184372 [TCP PDU reassembled in 655]"
"650","3.057093","151.101.1.140","100.86.243.187","TCP","1510","443  >  56509 [PSH, ACK] Seq=137181 Ack=728 Win=424 Len=1444 TSval=3914483845 TSecr=514184372 [TCP PDU reassembled in 655]"
"651","3.057217","100.86.243.187","151.101.1.140","TCP","66","56509  >  443 [ACK] Seq=728 Ack=138625 Win=7025 Len=0 TSval=514184382 TSecr=3914483845"
"652","3.057883","151.101.1.140","100.86.243.187","TCP","1510","443  >  56509 [ACK] Seq=138625 Ack=728 Win=424 Len=1444 TSval=3914483846 TSecr=514184373 [TCP PDU reassembled in 655]"
"653","3.067251","151.101.1.140","100.86.243.187","TCP","1510","443  >  56509 [PSH, ACK] Seq=140069 Ack=728 Win=424 Len=1444 TSval=3914483846 TSecr=514184373 [TCP PDU reassembled in 655]"
"654","3.067253","151.101.1.140","100.86.243.187","TCP","1510","443  >  56509 [ACK] Seq=141513 Ack=728 Win=424 Len=1444 TSval=3914483850 TSecr=514184376 [TCP PDU reassembled in 655]"
"655","3.067253","151.101.1.140","100.86.243.187","TLSv1.2","1510","Application Data"
"656","3.067511","100.86.243.187","151.101.1.140","TCP","66","56509  >  443 [ACK] Seq=728 Ack=144401 Win=7025 Len=0 TSval=514184393 TSecr=3914483846"
"657","3.069369","151.101.1.140","100.86.243.187","TCP","1510","443  >  56509 [ACK] Seq=144401 Ack=728 Win=424 Len=1444 TSval=3914483851 TSecr=514184377 [TCP PDU reassembled in 670]"
"658","3.069370","151.101.1.140","100.86.243.187","TCP","1510","443  >  56509 [PSH, ACK] Seq=145845 Ack=728 Win=424 Len=1444 TSval=3914483851 TSecr=514184377 [TCP PDU reassembled in 670]"
"659","3.069371","151.101.1.140","100.86.243.187","TCP","1510","443  >  56509 [ACK] Seq=147289 Ack=728 Win=424 Len=1444 TSval=3914483852 TSecr=514184379 [TCP PDU reassembled in 670]"
"660","3.069372","151.101.1.140","100.86.243.187","TCP","1510","443  >  56509 [PSH, ACK] Seq=148733 Ack=728 Win=424 Len=1444 TSval=3914483852 TSecr=514184379 [TCP PDU reassembled in 670]"
"661","3.069373","151.101.1.140","100.86.243.187","TCP","1510","443  >  56509 [ACK] Seq=150177 Ack=728 Win=424 Len=1444 TSval=3914483854 TSecr=514184380 [TCP PDU reassembled in 670]"
"662","3.069373","151.101.1.140","100.86.243.187","TCP","1510","443  >  56509 [PSH, ACK] Seq=151621 Ack=728 Win=424 Len=1444 TSval=3914483854 TSecr=514184380 [TCP PDU reassembled in 670]"
"663","3.069576","100.86.243.187","151.101.1.140","TCP","66","56509  >  443 [ACK] Seq=728 Ack=153065 Win=7025 Len=0 TSval=514184395 TSecr=3914483854"
"664","3.075663","151.101.1.140","100.86.243.187","TCP","1510","443  >  56509 [ACK] Seq=153065 Ack=728 Win=424 Len=1444 TSval=3914483864 TSecr=514184382 [TCP PDU reassembled in 670]"
"665","3.075918","151.101.1.140","100.86.243.187","TCP","1510","443  >  56509 [PSH, ACK] Seq=154509 Ack=728 Win=424 Len=1444 TSval=3914483864 TSecr=514184382 [TCP PDU reassembled in 670]"
"666","3.076025","100.86.243.187","151.101.1.140","TCP","66","56509  >  443 [ACK] Seq=728 Ack=155953 Win=7025 Len=0 TSval=514184401 TSecr=3914483864"
"667","3.077737","151.101.1.140","100.86.243.187","TCP","1510","443  >  56509 [ACK] Seq=155953 Ack=728 Win=424 Len=1444 TSval=3914483866 TSecr=514184393 [TCP PDU reassembled in 670]"
"668","3.078933","151.101.1.140","100.86.243.187","TCP","1510","443  >  56509 [PSH, ACK] Seq=157397 Ack=728 Win=424 Len=1444 TSval=3914483866 TSecr=514184393 [TCP PDU reassembled in 670]"
"669","3.079106","100.86.243.187","151.101.1.140","TCP","66","56509  >  443 [ACK] Seq=728 Ack=158841 Win=7025 Len=0 TSval=514184405 TSecr=3914483866"
"670","3.079177","151.101.1.140","100.86.243.187","TLSv1.2","1510","Application Data"
"671","3.079178","151.101.1.140","100.86.243.187","TCP","1510","443  >  56509 [PSH, ACK] Seq=160285 Ack=728 Win=424 Len=1444 TSval=3914483867 TSecr=514184393 [TCP PDU reassembled in 708]"
"672","3.079341","100.86.243.187","151.101.1.140","TCP","66","56509  >  443 [ACK] Seq=728 Ack=161729 Win=7025 Len=0 TSval=514184405 TSecr=3914483867"
"673","3.079786","151.101.1.140","100.86.243.187","TCP","1510","443  >  56509 [ACK] Seq=161729 Ack=728 Win=424 Len=1444 TSval=3914483868 TSecr=514184395 [TCP PDU reassembled in 708]"
"674","3.081006","151.101.1.140","100.86.243.187","TCP","1510","443  >  56509 [PSH, ACK] Seq=163173 Ack=728 Win=424 Len=1444 TSval=3914483868 TSecr=514184395 [TCP PDU reassembled in 708]"
"675","3.081159","100.86.243.187","151.101.1.140","TCP","66","56509  >  443 [ACK] Seq=728 Ack=164617 Win=7025 Len=0 TSval=514184407 TSecr=3914483868"
"676","3.082189","151.101.1.140","100.86.243.187","TCP","1510","443  >  56509 [ACK] Seq=164617 Ack=728 Win=424 Len=1444 TSval=3914483870 TSecr=514184395 [TCP PDU reassembled in 708]"
"677","3.082685","151.101.1.140","100.86.243.187","TCP","1510","443  >  56509 [PSH, ACK] Seq=166061 Ack=728 Win=424 Len=1444 TSval=3914483870 TSecr=514184395 [TCP PDU reassembled in 708]"
"678","3.082808","100.86.243.187","151.101.1.140","TCP","66","56509  >  443 [ACK] Seq=728 Ack=167505 Win=7025 Len=0 TSval=514184408 TSecr=3914483870"
"679","3.085872","151.101.1.140","100.86.243.187","TCP","1510","443  >  56509 [ACK] Seq=167505 Ack=728 Win=424 Len=1444 TSval=3914483872 TSecr=514184395 [TCP PDU reassembled in 708]"
"680","3.085874","151.101.1.140","100.86.243.187","TCP","1510","443  >  56509 [PSH, ACK] Seq=168949 Ack=728 Win=424 Len=1444 TSval=3914483872 TSecr=514184395 [TCP PDU reassembled in 708]"
"681","3.086041","100.86.243.187","151.101.1.140","TCP","66","56509  >  443 [ACK] Seq=728 Ack=170393 Win=7025 Len=0 TSval=514184411 TSecr=3914483872"
"682","3.086706","151.101.1.140","100.86.243.187","TCP","1510","443  >  56509 [ACK] Seq=170393 Ack=728 Win=424 Len=1444 TSval=3914483873 TSecr=514184395 [TCP PDU reassembled in 708]"
"683","3.087246","151.101.1.140","100.86.243.187","TCP","1510","443  >  56509 [ACK] Seq=171837 Ack=728 Win=424 Len=1444 TSval=3914483874 TSecr=514184401 [TCP PDU reassembled in 708]"
"684","3.088703","151.101.1.140","100.86.243.187","TCP","1510","[TCP Previous segment not captured] 443  >  56509 [ACK] Seq=174725 Ack=728 Win=424 Len=1444 TSval=3914483877 TSecr=514184405 [TCP PDU reassembled in 708]"
"685","3.088704","151.101.1.140","100.86.243.187","TCP","1510","443  >  56509 [PSH, ACK] Seq=176169 Ack=728 Win=424 Len=1444 TSval=3914483877 TSecr=514184405 [TCP PDU reassembled in 702]"
"686","3.088813","100.86.243.187","151.101.1.140","TCP","78","56509  >  443 [ACK] Seq=728 Ack=173281 Win=7025 Len=0 TSval=514184414 TSecr=3914483873 SLE=174725 SRE=177613"
"687","3.089362","151.101.1.140","100.86.243.187","TCP","1510","443  >  56509 [ACK] Seq=177613 Ack=728 Win=424 Len=1444 TSval=3914483878 TSecr=514184405 [TCP PDU reassembled in 702]"
"688","3.089363","151.101.1.140","100.86.243.187","TCP","1510","443  >  56509 [PSH, ACK] Seq=179057 Ack=728 Win=424 Len=1444 TSval=3914483878 TSecr=514184405 [TCP PDU reassembled in 702]"
"689","3.089470","100.86.243.187","151.101.1.140","TCP","78","[TCP Dup ACK 686#1] 56509  >  443 [ACK] Seq=728 Ack=173281 Win=7025 Len=0 TSval=514184414 TSecr=3914483873 SLE=174725 SRE=180501"
"690","3.093940","151.101.1.140","100.86.243.187","TCP","1510","443  >  56509 [ACK] Seq=180501 Ack=728 Win=424 Len=1444 TSval=3914483882 TSecr=514184407 [TCP PDU reassembled in 702]"
"691","3.094064","100.86.243.187","151.101.1.140","TCP","78","[TCP Dup ACK 686#2] 56509  >  443 [ACK] Seq=728 Ack=173281 Win=7025 Len=0 TSval=514184420 TSecr=3914483873 SLE=174725 SRE=181945"
"692","3.094187","151.101.1.140","100.86.243.187","TCP","1510","443  >  56509 [PSH, ACK] Seq=181945 Ack=728 Win=424 Len=1444 TSval=3914483882 TSecr=514184407 [TCP PDU reassembled in 702]"
"693","3.094239","100.86.243.187","151.101.1.140","TCP","78","[TCP Dup ACK 686#3] 56509  >  443 [ACK] Seq=728 Ack=173281 Win=7025 Len=0 TSval=514184420 TSecr=3914483873 SLE=174725 SRE=183389"
"694","3.094842","151.101.1.140","100.86.243.187","TCP","1510","443  >  56509 [ACK] Seq=183389 Ack=728 Win=424 Len=1444 TSval=3914483883 TSecr=514184408 [TCP PDU reassembled in 702]"
"695","3.094844","151.101.1.140","100.86.243.187","TCP","1510","443  >  56509 [PSH, ACK] Seq=184833 Ack=728 Win=424 Len=1444 TSval=3914483883 TSecr=514184408 [TCP PDU reassembled in 702]"
"696","3.095089","100.86.243.187","151.101.1.140","TCP","78","[TCP Dup ACK 686#4] 56509  >  443 [ACK] Seq=728 Ack=173281 Win=7025 Len=0 TSval=514184421 TSecr=3914483873 SLE=174725 SRE=186277"
"697","3.095852","151.101.1.140","100.86.243.187","TCP","1510","443  >  56509 [ACK] Seq=186277 Ack=728 Win=424 Len=1444 TSval=3914483884 TSecr=514184411 [TCP PDU reassembled in 702]"
"698","3.095946","100.86.243.187","151.101.1.140","TCP","78","[TCP Dup ACK 686#5] 56509  >  443 [ACK] Seq=728 Ack=173281 Win=7025 Len=0 TSval=514184421 TSecr=3914483873 SLE=174725 SRE=187721"
"699","3.096599","151.101.1.140","100.86.243.187","TCP","1510","443  >  56509 [PSH, ACK] Seq=187721 Ack=728 Win=424 Len=1444 TSval=3914483884 TSecr=514184411 [TCP PDU reassembled in 702]"
"700","3.096673","100.86.243.187","151.101.1.140","TCP","78","[TCP Dup ACK 686#6] 56509  >  443 [ACK] Seq=728 Ack=173281 Win=7025 Len=0 TSval=514184422 TSecr=3914483873 SLE=174725 SRE=189165"
"701","3.098514","151.101.1.140","100.86.243.187","TCP","1510","443  >  56509 [ACK] Seq=189165 Ack=728 Win=424 Len=1444 TSval=3914483887 TSecr=514184414 [TCP PDU reassembled in 702]"
"702","3.098515","151.101.1.140","100.86.243.187","TLSv1.2","1510","Application Data"
"703","3.098602","100.86.243.187","151.101.1.140","TCP","78","[TCP Dup ACK 686#7] 56509  >  443 [ACK] Seq=728 Ack=173281 Win=7025 Len=0 TSval=514184424 TSecr=3914483873 SLE=174725 SRE=192053"
"704","3.099121","151.101.1.140","100.86.243.187","TCP","1510","443  >  56509 [ACK] Seq=192053 Ack=728 Win=424 Len=1444 TSval=3914483888 TSecr=514184414 [TCP PDU reassembled in 728]"
"705","3.099194","100.86.243.187","151.101.1.140","TCP","78","[TCP Dup ACK 686#8] 56509  >  443 [ACK] Seq=728 Ack=173281 Win=7025 Len=0 TSval=514184424 TSecr=3914483873 SLE=174725 SRE=193497"
"706","3.099406","151.101.1.140","100.86.243.187","TCP","1510","443  >  56509 [PSH, ACK] Seq=193497 Ack=728 Win=424 Len=1444 TSval=3914483888 TSecr=514184414 [TCP PDU reassembled in 728]"
"707","3.099460","100.86.243.187","151.101.1.140","TCP","78","[TCP Dup ACK 686#9] 56509  >  443 [ACK] Seq=728 Ack=173281 Win=7025 Len=0 TSval=514184424 TSecr=3914483873 SLE=174725 SRE=194941"
"708","3.101308","151.101.1.140","100.86.243.187","TLSv1.2","1510","[TCP Fast Retransmission] , Application Data"
"709","3.101439","100.86.243.187","151.101.1.140","TCP","66","56509  >  443 [ACK] Seq=728 Ack=194941 Win=6687 Len=0 TSval=514184427 TSecr=3914483889"
"710","3.101804","151.101.1.140","100.86.243.187","TCP","1510","443  >  56509 [ACK] Seq=194941 Ack=728 Win=424 Len=1444 TSval=3914483890 TSecr=514184414 [TCP PDU reassembled in 728]"
"711","3.101895","100.86.243.187","151.101.1.140","TCP","66","56509  >  443 [ACK] Seq=728 Ack=196385 Win=6955 Len=0 TSval=514184427 TSecr=3914483890"
"712","3.102015","100.86.243.187","151.101.1.140","TCP","66","[TCP Window Update] 56509  >  443 [ACK] Seq=728 Ack=196385 Win=7025 Len=0 TSval=514184427 TSecr=3914483890"
"713","3.103813","151.101.1.140","100.86.243.187","TCP","1510","443  >  56509 [ACK] Seq=196385 Ack=728 Win=424 Len=1444 TSval=3914483892 TSecr=514184420 [TCP PDU reassembled in 728]"
"714","3.103962","100.86.243.187","151.101.1.140","TCP","66","56509  >  443 [ACK] Seq=728 Ack=197829 Win=7002 Len=0 TSval=514184429 TSecr=3914483892"
"715","3.105031","151.101.1.140","100.86.243.187","TCP","1510","443  >  56509 [ACK] Seq=197829 Ack=728 Win=424 Len=1444 TSval=3914483894 TSecr=514184421 [TCP PDU reassembled in 728]"
"716","3.105141","100.86.243.187","151.101.1.140","TCP","66","56509  >  443 [ACK] Seq=728 Ack=199273 Win=7002 Len=0 TSval=514184431 TSecr=3914483894"
"717","3.106879","151.101.1.140","100.86.243.187","TCP","1510","443  >  56509 [ACK] Seq=199273 Ack=728 Win=424 Len=1444 TSval=3914483894 TSecr=514184422 [TCP PDU reassembled in 728]"
"718","3.106991","100.86.243.187","151.101.1.140","TCP","66","56509  >  443 [ACK] Seq=728 Ack=200717 Win=7002 Len=0 TSval=514184432 TSecr=3914483894"
"719","3.108588","151.101.1.140","100.86.243.187","TCP","1510","443  >  56509 [ACK] Seq=200717 Ack=728 Win=424 Len=1444 TSval=3914483897 TSecr=514184424 [TCP PDU reassembled in 728]"
"720","3.108687","100.86.243.187","151.101.1.140","TCP","66","56509  >  443 [ACK] Seq=728 Ack=202161 Win=7002 Len=0 TSval=514184434 TSecr=3914483897"
"721","3.109087","151.101.1.140","100.86.243.187","TCP","1510","443  >  56509 [PSH, ACK] Seq=202161 Ack=728 Win=424 Len=1444 TSval=3914483897 TSecr=514184424 [TCP PDU reassembled in 728]"
"722","3.109171","100.86.243.187","151.101.1.140","TCP","66","56509  >  443 [ACK] Seq=728 Ack=203605 Win=7002 Len=0 TSval=514184434 TSecr=3914483897"
"723","3.109840","151.101.1.140","100.86.243.187","TCP","1510","443  >  56509 [ACK] Seq=203605 Ack=728 Win=424 Len=1444 TSval=3914483897 TSecr=514184424 [TCP PDU reassembled in 728]"
"724","3.109842","151.101.1.140","100.86.243.187","TCP","1510","443  >  56509 [ACK] Seq=205049 Ack=728 Win=424 Len=1444 TSval=3914483898 TSecr=514184424 [TCP PDU reassembled in 728]"
"725","3.109936","100.86.243.187","151.101.1.140","TCP","66","56509  >  443 [ACK] Seq=728 Ack=206493 Win=6980 Len=0 TSval=514184435 TSecr=3914483898"
"726","3.110817","151.101.1.140","100.86.243.187","TCP","1510","443  >  56509 [ACK] Seq=206493 Ack=728 Win=424 Len=1444 TSval=3914483899 TSecr=514184427 [TCP PDU reassembled in 728]"
"727","3.110942","100.86.243.187","151.101.1.140","TCP","66","56509  >  443 [ACK] Seq=728 Ack=207937 Win=7002 Len=0 TSval=514184435 TSecr=3914483899"
"728","3.113764","151.101.1.140","100.86.243.187","TLSv1.2","1510","Application Data"
"729","3.113882","100.86.243.187","151.101.1.140","TCP","66","56509  >  443 [ACK] Seq=728 Ack=209381 Win=7002 Len=0 TSval=514184439 TSecr=3914483902"
"730","3.115156","151.101.1.140","100.86.243.187","TCP","1510","443  >  56509 [PSH, ACK] Seq=209381 Ack=728 Win=424 Len=1444 TSval=3914483902 TSecr=514184429 [TCP PDU reassembled in 747]"
"731","3.115261","100.86.243.187","151.101.1.140","TCP","66","56509  >  443 [ACK] Seq=728 Ack=210825 Win=7002 Len=0 TSval=514184441 TSecr=3914483902"
"732","3.115908","151.101.1.140","100.86.243.187","TCP","1510","443  >  56509 [ACK] Seq=210825 Ack=728 Win=424 Len=1444 TSval=3914483904 TSecr=514184431 [TCP PDU reassembled in 747]"
"733","3.115998","100.86.243.187","151.101.1.140","TCP","66","56509  >  443 [ACK] Seq=728 Ack=212269 Win=7002 Len=0 TSval=514184441 TSecr=3914483904"
"734","3.119037","151.101.1.140","100.86.243.187","TCP","1510","443  >  56509 [ACK] Seq=212269 Ack=728 Win=424 Len=1444 TSval=3914483907 TSecr=514184434 [TCP PDU reassembled in 747]"
"735","3.119039","151.101.1.140","100.86.243.187","TCP","1510","443  >  56509 [PSH, ACK] Seq=213713 Ack=728 Win=424 Len=1444 TSval=3914483907 TSecr=514184434 [TCP PDU reassembled in 747]"
"736","3.119149","100.86.243.187","151.101.1.140","TCP","66","56509  >  443 [ACK] Seq=728 Ack=215157 Win=6980 Len=0 TSval=514184445 TSecr=3914483907"
"737","3.120616","151.101.1.140","100.86.243.187","TCP","1510","443  >  56509 [ACK] Seq=215157 Ack=728 Win=424 Len=1444 TSval=3914483908 TSecr=514184435 [TCP PDU reassembled in 747]"
"738","3.120617","151.101.1.140","100.86.243.187","TCP","1510","443  >  56509 [PSH, ACK] Seq=216601 Ack=728 Win=424 Len=1444 TSval=3914483908 TSecr=514184435 [TCP PDU reassembled in 747]"
"739","3.120726","100.86.243.187","151.101.1.140","TCP","66","56509  >  443 [ACK] Seq=728 Ack=218045 Win=6980 Len=0 TSval=514184446 TSecr=3914483908"
"740","3.122150","151.101.1.140","100.86.243.187","TCP","1510","443  >  56509 [ACK] Seq=218045 Ack=728 Win=424 Len=1444 TSval=3914483909 TSecr=514184435 [TCP PDU reassembled in 747]"
"741","3.122160","151.101.1.140","100.86.243.187","TCP","1510","443  >  56509 [PSH, ACK] Seq=219489 Ack=728 Win=424 Len=1444 TSval=3914483909 TSecr=514184435 [TCP PDU reassembled in 747]"
"742","3.122529","100.86.243.187","151.101.1.140","TCP","66","56509  >  443 [ACK] Seq=728 Ack=220933 Win=6980 Len=0 TSval=514184448 TSecr=3914483909"
"743","3.124874","151.101.1.140","100.86.243.187","TCP","1510","443  >  56509 [ACK] Seq=220933 Ack=728 Win=424 Len=1444 TSval=3914483913 TSecr=514184439 [TCP PDU reassembled in 747]"
"744","3.125041","100.86.243.187","151.101.1.140","TCP","66","56509  >  443 [ACK] Seq=728 Ack=222377 Win=7002 Len=0 TSval=514184450 TSecr=3914483913"
"745","3.125534","151.101.1.140","100.86.243.187","TCP","1510","443  >  56509 [PSH, ACK] Seq=222377 Ack=728 Win=424 Len=1444 TSval=3914483913 TSecr=514184439 [TCP PDU reassembled in 747]"
"746","3.125682","100.86.243.187","151.101.1.140","TCP","66","56509  >  443 [ACK] Seq=728 Ack=223821 Win=7025 Len=0 TSval=514184450 TSecr=3914483913"
"747","3.125858","151.101.1.140","100.86.243.187","TLSv1.2","1510","Application Data"
"748","3.126976","151.101.1.140","100.86.243.187","TCP","1510","443  >  56509 [PSH, ACK] Seq=225265 Ack=728 Win=424 Len=1444 TSval=3914483915 TSecr=514184441 [TCP PDU reassembled in 760]"
"749","3.127110","100.86.243.187","151.101.1.140","TCP","66","56509  >  443 [ACK] Seq=728 Ack=226709 Win=7025 Len=0 TSval=514184453 TSecr=3914483915"
"750","3.130341","151.101.1.140","100.86.243.187","TCP","1510","443  >  56509 [ACK] Seq=226709 Ack=728 Win=424 Len=1444 TSval=3914483918 TSecr=514184445 [TCP PDU reassembled in 760]"
"751","3.130342","151.101.1.140","100.86.243.187","TCP","1510","443  >  56509 [PSH, ACK] Seq=228153 Ack=728 Win=424 Len=1444 TSval=3914483918 TSecr=514184445 [TCP PDU reassembled in 760]"
"752","3.130496","100.86.243.187","151.101.1.140","TCP","66","56509  >  443 [ACK] Seq=728 Ack=229597 Win=7025 Len=0 TSval=514184456 TSecr=3914483918"
"753","3.131299","151.101.1.140","100.86.243.187","TCP","1510","443  >  56509 [ACK] Seq=229597 Ack=728 Win=424 Len=1444 TSval=3914483920 TSecr=514184446 [TCP PDU reassembled in 760]"
"754","3.131814","151.101.1.140","100.86.243.187","TCP","1510","443  >  56509 [PSH, ACK] Seq=231041 Ack=728 Win=424 Len=1444 TSval=3914483920 TSecr=514184446 [TCP PDU reassembled in 760]"
"755","3.131945","100.86.243.187","151.101.1.140","TCP","66","56509  >  443 [ACK] Seq=728 Ack=232485 Win=7025 Len=0 TSval=514184457 TSecr=3914483920"
"756","3.133584","151.101.1.140","100.86.243.187","TCP","1510","443  >  56509 [ACK] Seq=232485 Ack=728 Win=424 Len=1444 TSval=3914483921 TSecr=514184448 [TCP PDU reassembled in 760]"
"757","3.133586","151.101.1.140","100.86.243.187","TCP","1510","443  >  56509 [PSH, ACK] Seq=233929 Ack=728 Win=424 Len=1444 TSval=3914483921 TSecr=514184448 [TCP PDU reassembled in 760]"
"758","3.133746","100.86.243.187","151.101.1.140","TCP","66","56509  >  443 [ACK] Seq=728 Ack=235373 Win=7025 Len=0 TSval=514184459 TSecr=3914483921"
"759","3.134983","151.101.1.140","100.86.243.187","TCP","1510","443  >  56509 [ACK] Seq=235373 Ack=728 Win=424 Len=1444 TSval=3914483923 TSecr=514184450 [TCP PDU reassembled in 760]"
"760","3.135063","151.101.1.140","100.86.243.187","TLSv1.2","1510","Application Data"
"761","3.135326","100.86.243.187","151.101.1.140","TCP","66","56509  >  443 [ACK] Seq=728 Ack=238261 Win=7025 Len=0 TSval=514184461 TSecr=3914483923"
"762","3.138933","151.101.1.140","100.86.243.187","TCP","1510","443  >  56509 [ACK] Seq=238261 Ack=728 Win=424 Len=1444 TSval=3914483927 TSecr=514184453 [TCP PDU reassembled in 784]"
"763","3.138935","151.101.1.140","100.86.243.187","TCP","1510","443  >  56509 [PSH, ACK] Seq=239705 Ack=728 Win=424 Len=1444 TSval=3914483927 TSecr=514184453 [TCP PDU reassembled in 784]"
"764","3.139095","100.86.243.187","151.101.1.140","TCP","66","56509  >  443 [ACK] Seq=728 Ack=241149 Win=7025 Len=0 TSval=514184465 TSecr=3914483927"
"765","3.140557","151.101.1.140","100.86.243.187","TCP","1510","443  >  56509 [ACK] Seq=241149 Ack=728 Win=424 Len=1444 TSval=3914483929 TSecr=514184456 [TCP PDU reassembled in 784]"
"766","3.140558","151.101.1.140","100.86.243.187","TCP","1510","443  >  56509 [PSH, ACK] Seq=242593 Ack=728 Win=424 Len=1444 TSval=3914483929 TSecr=514184456 [TCP PDU reassembled in 784]"
"767","3.140715","100.86.243.187","151.101.1.140","TCP","66","56509  >  443 [ACK] Seq=728 Ack=244037 Win=7025 Len=0 TSval=514184466 TSecr=3914483929"
"768","3.145439","100.86.243.187","151.101.1.140","TCP","1514","56485  >  443 [ACK] Seq=29814 Ack=65790 Win=3925 Len=1448 TSval=2851277722 TSecr=1266222054 [TCP PDU reassembled in 770]"
"769","3.145442","100.86.243.187","151.101.1.140","TCP","1514","56485  >  443 [ACK] Seq=31262 Ack=65790 Win=3925 Len=1448 TSval=2851277722 TSecr=1266222054 [TCP PDU reassembled in 770]"
"770","3.145490","100.86.243.187","151.101.1.140","TLSv1.2","180","Application Data"
"771","3.146506","100.86.243.187","151.101.1.140","TCP","1514","56485  >  443 [ACK] Seq=32824 Ack=65790 Win=3925 Len=1448 TSval=2851277723 TSecr=1266222054 [TCP PDU reassembled in 775]"
"772","3.146509","100.86.243.187","151.101.1.140","TCP","1514","56485  >  443 [ACK] Seq=34272 Ack=65790 Win=3925 Len=1448 TSval=2851277723 TSecr=1266222054 [TCP PDU reassembled in 775]"
"773","3.146512","100.86.243.187","151.101.1.140","TCP","1514","56485  >  443 [ACK] Seq=35720 Ack=65790 Win=3925 Len=1448 TSval=2851277723 TSecr=1266222054 [TCP PDU reassembled in 775]"
"774","3.146514","100.86.243.187","151.101.1.140","TCP","1514","56485  >  443 [ACK] Seq=37168 Ack=65790 Win=3925 Len=1448 TSval=2851277723 TSecr=1266222054 [TCP PDU reassembled in 775]"
"775","3.146552","100.86.243.187","151.101.1.140","TLSv1.2","223","Application Data"
"776","3.220745","100.86.243.187","151.101.1.140","TCP","1514","[TCP Retransmission] 56485  >  443 [PSH, ACK] Seq=37325 Ack=65790 Win=3925 Len=1448 TSval=2851277797 TSecr=1266222054 [TCP PDU reassembled in 775]"
"777","3.242905","151.101.1.140","100.86.243.187","TCP","1510","443  >  56509 [ACK] Seq=244037 Ack=728 Win=424 Len=1444 TSval=3914483932 TSecr=514184457 [TCP PDU reassembled in 784]"
"778","3.242907","151.101.1.140","100.86.243.187","TCP","1510","443  >  56509 [PSH, ACK] Seq=245481 Ack=728 Win=424 Len=1444 TSval=3914483932 TSecr=514184457 [TCP PDU reassembled in 784]"
"779","3.242908","151.101.1.140","100.86.243.187","TCP","1510","443  >  56509 [ACK] Seq=246925 Ack=728 Win=424 Len=1444 TSval=3914483932 TSecr=514184459 [TCP PDU reassembled in 784]"
"780","3.243086","100.86.243.187","151.101.1.140","TCP","66","56509  >  443 [ACK] Seq=728 Ack=248369 Win=7025 Len=0 TSval=514184568 TSecr=3914483932"
"781","3.247256","151.101.1.140","100.86.243.187","TCP","1510","443  >  56509 [PSH, ACK] Seq=248369 Ack=728 Win=424 Len=1444 TSval=3914483932 TSecr=514184459 [TCP PDU reassembled in 784]"
"782","3.247258","151.101.1.140","100.86.243.187","TCP","1510","443  >  56509 [ACK] Seq=249813 Ack=728 Win=424 Len=1444 TSval=3914483934 TSecr=514184461 [TCP PDU reassembled in 784]"
"783","3.247259","151.101.1.140","100.86.243.187","TCP","1510","443  >  56509 [PSH, ACK] Seq=251257 Ack=728 Win=424 Len=1444 TSval=3914483934 TSecr=514184461 [TCP PDU reassembled in 784]"
"784","3.247260","151.101.1.140","100.86.243.187","TLSv1.2","1510","Application Data"
"785","3.247261","151.101.1.140","100.86.243.187","TCP","1510","443  >  56509 [PSH, ACK] Seq=254145 Ack=728 Win=424 Len=1444 TSval=3914483938 TSecr=514184465 [TCP PDU reassembled in 803]"
"786","3.247262","151.101.1.140","100.86.243.187","TCP","1510","443  >  56509 [ACK] Seq=255589 Ack=728 Win=424 Len=1444 TSval=3914483939 TSecr=514184466 [TCP PDU reassembled in 803]"
"787","3.247263","151.101.1.140","100.86.243.187","TCP","1510","443  >  56509 [PSH, ACK] Seq=257033 Ack=728 Win=424 Len=1444 TSval=3914483939 TSecr=514184466 [TCP PDU reassembled in 803]"
"788","3.247264","151.101.1.140","100.86.243.187","TCP","1510","443  >  56509 [ACK] Seq=258477 Ack=728 Win=424 Len=1444 TSval=3914483966 TSecr=514184466 [TCP PDU reassembled in 803]"
"791","3.247672","100.86.243.187","151.101.1.140","TCP","66","56509  >  443 [ACK] Seq=728 Ack=259921 Win=7025 Len=0 TSval=514184573 TSecr=3914483966"
"792","3.257884","151.101.1.140","100.86.243.187","TCP","1510","443  >  56509 [ACK] Seq=259921 Ack=728 Win=424 Len=1444 TSval=3914484045 TSecr=514184568 [TCP PDU reassembled in 803]"
"793","3.257885","151.101.1.140","100.86.243.187","TCP","1510","443  >  56509 [PSH, ACK] Seq=261365 Ack=728 Win=424 Len=1444 TSval=3914484045 TSecr=514184568 [TCP PDU reassembled in 803]"
"794","3.258039","100.86.243.187","151.101.1.140","TCP","66","56509  >  443 [ACK] Seq=728 Ack=262809 Win=7025 Len=0 TSval=514184583 TSecr=3914484045"
"795","3.259233","151.101.1.140","100.86.243.187","TCP","66","443  >  56485 [ACK] Seq=65790 Ack=38773 Win=623 Len=0 TSval=1266223319 TSecr=2851277723"
"796","3.259234","151.101.1.140","100.86.243.187","TCP","78","[TCP Dup ACK 795#1] 443  >  56485 [ACK] Seq=65790 Ack=38773 Win=623 Len=0 TSval=1266223319 TSecr=2851277797 SLE=37325 SRE=38773"
"797","3.259328","151.101.1.140","100.86.243.187","TCP","1510","443  >  56509 [ACK] Seq=262809 Ack=728 Win=424 Len=1444 TSval=3914484047 TSecr=514184573 [TCP PDU reassembled in 803]"
"798","3.259329","151.101.1.140","100.86.243.187","TCP","1510","443  >  56509 [PSH, ACK] Seq=264253 Ack=728 Win=424 Len=1444 TSval=3914484047 TSecr=514184573 [TCP PDU reassembled in 803]"
"799","3.259451","100.86.243.187","151.101.1.140","TCP","66","56509  >  443 [ACK] Seq=728 Ack=265697 Win=7025 Len=0 TSval=514184585 TSecr=3914484047"
"800","3.265461","151.101.1.140","100.86.243.187","TCP","1510","443  >  56509 [ACK] Seq=265697 Ack=728 Win=424 Len=1444 TSval=3914484052 TSecr=514184573 [TCP PDU reassembled in 803]"
"801","3.265463","151.101.1.140","100.86.243.187","TCP","1510","443  >  56509 [PSH, ACK] Seq=267141 Ack=728 Win=424 Len=1444 TSval=3914484052 TSecr=514184573 [TCP PDU reassembled in 803]"
"802","3.265619","100.86.243.187","151.101.1.140","TCP","66","56509  >  443 [ACK] Seq=728 Ack=268585 Win=7025 Len=0 TSval=514184591 TSecr=3914484052"
"803","3.269188","151.101.1.140","100.86.243.187","TLSv1.2","1510","Application Data"
"804","3.269830","151.101.1.140","100.86.243.187","TCP","1510","443  >  56509 [PSH, ACK] Seq=270029 Ack=728 Win=424 Len=1444 TSval=3914484058 TSecr=514184573 [TCP PDU reassembled in 820]"
"805","3.269951","100.86.243.187","151.101.1.140","TCP","66","56509  >  443 [ACK] Seq=728 Ack=271473 Win=7025 Len=0 TSval=514184595 TSecr=3914484058"
"806","3.274693","151.101.1.140","100.86.243.187","TCP","1510","443  >  56509 [ACK] Seq=271473 Ack=728 Win=424 Len=1444 TSval=3914484063 TSecr=514184573 [TCP PDU reassembled in 820]"
"807","3.274733","151.101.1.140","100.86.243.187","TCP","1510","443  >  56509 [PSH, ACK] Seq=272917 Ack=728 Win=424 Len=1444 TSval=3914484063 TSecr=514184573 [TCP PDU reassembled in 820]"
"808","3.274866","100.86.243.187","151.101.1.140","TCP","66","56509  >  443 [ACK] Seq=728 Ack=274361 Win=7025 Len=0 TSval=514184600 TSecr=3914484063"
"809","3.281792","151.101.1.140","100.86.243.187","TCP","1510","443  >  56509 [ACK] Seq=274361 Ack=728 Win=424 Len=1444 TSval=3914484068 TSecr=514184585 [TCP PDU reassembled in 820]"
"810","3.283205","151.101.1.140","100.86.243.187","TCP","1510","443  >  56509 [ACK] Seq=275805 Ack=728 Win=424 Len=1444 TSval=3914484071 TSecr=514184585 [TCP PDU reassembled in 820]"
"811","3.283206","151.101.1.140","100.86.243.187","TCP","1510","443  >  56509 [PSH, ACK] Seq=277249 Ack=728 Win=424 Len=1444 TSval=3914484071 TSecr=514184585 [TCP PDU reassembled in 820]"
"812","3.283419","100.86.243.187","151.101.1.140","TCP","66","56509  >  443 [ACK] Seq=728 Ack=278693 Win=7025 Len=0 TSval=514184609 TSecr=3914484068"
"813","3.288669","151.101.1.140","100.86.243.187","TCP","1510","443  >  56509 [ACK] Seq=278693 Ack=728 Win=424 Len=1444 TSval=3914484075 TSecr=514184585 [TCP PDU reassembled in 820]"
"814","3.288671","151.101.1.140","100.86.243.187","TCP","1510","443  >  56509 [PSH, ACK] Seq=280137 Ack=728 Win=424 Len=1444 TSval=3914484075 TSecr=514184585 [TCP PDU reassembled in 820]"
"815","3.288899","100.86.243.187","151.101.1.140","TCP","66","56509  >  443 [ACK] Seq=728 Ack=281581 Win=7025 Len=0 TSval=514184614 TSecr=3914484075"
"816","3.292328","151.101.1.140","100.86.243.187","TCP","1510","443  >  56509 [ACK] Seq=281581 Ack=728 Win=424 Len=1444 TSval=3914484080 TSecr=514184595 [TCP PDU reassembled in 820]"
"817","3.292330","151.101.1.140","100.86.243.187","TCP","1510","443  >  56509 [PSH, ACK] Seq=283025 Ack=728 Win=424 Len=1444 TSval=3914484080 TSecr=514184595 [TCP PDU reassembled in 820]"
"818","3.292527","100.86.243.187","151.101.1.140","TCP","66","56509  >  443 [ACK] Seq=728 Ack=284469 Win=7025 Len=0 TSval=514184618 TSecr=3914484080"
"819","3.298352","151.101.1.140","100.86.243.187","TCP","1510","443  >  56509 [ACK] Seq=284469 Ack=728 Win=424 Len=1444 TSval=3914484083 TSecr=514184600 [TCP PDU reassembled in 820]"
"820","3.298353","151.101.1.140","100.86.243.187","TLSv1.2","1510","Application Data"
"821","3.298354","151.101.1.140","100.86.243.187","TCP","1510","443  >  56485 [ACK] Seq=65790 Ack=38773 Win=639 Len=1444 TSval=1266223356 TSecr=2851277797 [TCP PDU reassembled in 822]"
"822","3.298355","151.101.1.140","100.86.243.187","TLSv1.2","269","Application Data"
"823","3.298470","100.86.243.187","151.101.1.140","TCP","66","56485  >  443 [ACK] Seq=38773 Ack=67437 Win=3900 Len=0 TSval=2851277875 TSecr=1266223356"
"824","3.299300","100.86.243.187","151.101.1.140","TCP","66","56509  >  443 [ACK] Seq=728 Ack=287357 Win=7025 Len=0 TSval=514184624 TSecr=3914484083"
"825","3.299627","151.101.1.140","100.86.243.187","TCP","1510","443  >  56509 [ACK] Seq=287357 Ack=728 Win=424 Len=1444 TSval=3914484087 TSecr=514184600 [TCP PDU reassembled in 838]"
"826","3.299732","151.101.1.140","100.86.243.187","TCP","1510","443  >  56509 [PSH, ACK] Seq=288801 Ack=728 Win=424 Len=1444 TSval=3914484087 TSecr=514184600 [TCP PDU reassembled in 838]"
"827","3.299815","100.86.243.187","151.101.1.140","TCP","66","56509  >  443 [ACK] Seq=728 Ack=290245 Win=7025 Len=0 TSval=514184625 TSecr=3914484087"
"828","3.302335","151.101.1.140","100.86.243.187","TCP","1510","443  >  56509 [ACK] Seq=290245 Ack=728 Win=424 Len=1444 TSval=3914484090 TSecr=514184609 [TCP PDU reassembled in 838]"
"829","3.302336","151.101.1.140","100.86.243.187","TCP","1510","443  >  56509 [PSH, ACK] Seq=291689 Ack=728 Win=424 Len=1444 TSval=3914484090 TSecr=514184609 [TCP PDU reassembled in 838]"
"830","3.302470","100.86.243.187","151.101.1.140","TCP","66","56509  >  443 [ACK] Seq=728 Ack=293133 Win=7025 Len=0 TSval=514184628 TSecr=3914484090"
"831","3.306627","151.101.1.140","100.86.243.187","TCP","1510","443  >  56509 [ACK] Seq=293133 Ack=728 Win=424 Len=1444 TSval=3914484093 TSecr=514184609 [TCP PDU reassembled in 838]"
"832","3.306628","151.101.1.140","100.86.243.187","TCP","1510","443  >  56509 [PSH, ACK] Seq=294577 Ack=728 Win=424 Len=1444 TSval=3914484093 TSecr=514184609 [TCP PDU reassembled in 838]"
"833","3.306777","100.86.243.187","151.101.1.140","TCP","66","56509  >  443 [ACK] Seq=728 Ack=296021 Win=7025 Len=0 TSval=514184632 TSecr=3914484093"
"834","3.308203","151.101.1.140","100.86.243.187","TCP","1510","443  >  56509 [ACK] Seq=296021 Ack=728 Win=424 Len=1444 TSval=3914484096 TSecr=514184614 [TCP PDU reassembled in 838]"
"835","3.308867","151.101.1.140","100.86.243.187","TCP","1510","443  >  56509 [PSH, ACK] Seq=297465 Ack=728 Win=424 Len=1444 TSval=3914484096 TSecr=514184614 [TCP PDU reassembled in 838]"
"836","3.308962","100.86.243.187","151.101.1.140","TCP","66","56509  >  443 [ACK] Seq=728 Ack=298909 Win=7025 Len=0 TSval=514184634 TSecr=3914484096"
"837","3.310905","151.101.1.140","100.86.243.187","TCP","1510","443  >  56509 [ACK] Seq=298909 Ack=728 Win=424 Len=1444 TSval=3914484099 TSecr=514184618 [TCP PDU reassembled in 838]"
"838","3.310931","151.101.1.140","100.86.243.187","TLSv1.2","1510","Application Data, Application Data"
"839","3.311487","100.86.243.187","151.101.1.140","TCP","66","56509  >  443 [ACK] Seq=728 Ack=301797 Win=7025 Len=0 TSval=514184636 TSecr=3914484099"
"840","3.313894","151.101.1.140","100.86.243.187","TCP","1510","443  >  56509 [ACK] Seq=301797 Ack=728 Win=424 Len=1444 TSval=3914484102 TSecr=514184624 [TCP PDU reassembled in 855]"
"841","3.314384","151.101.1.140","100.86.243.187","TCP","1510","443  >  56509 [PSH, ACK] Seq=303241 Ack=728 Win=424 Len=1444 TSval=3914484102 TSecr=514184624 [TCP PDU reassembled in 855]"
"842","3.314541","100.86.243.187","151.101.1.140","TCP","66","56509  >  443 [ACK] Seq=728 Ack=304685 Win=7025 Len=0 TSval=514184639 TSecr=3914484102"
"843","3.316606","151.101.1.140","100.86.243.187","TCP","1510","443  >  56509 [ACK] Seq=304685 Ack=728 Win=424 Len=1444 TSval=3914484105 TSecr=514184625 [TCP PDU reassembled in 855]"
"844","3.316690","151.101.1.140","100.86.243.187","TCP","1510","443  >  56509 [PSH, ACK] Seq=306129 Ack=728 Win=424 Len=1444 TSval=3914484105 TSecr=514184625 [TCP PDU reassembled in 855]"
"845","3.316770","100.86.243.187","151.101.1.140","TCP","66","56509  >  443 [ACK] Seq=728 Ack=307573 Win=7025 Len=0 TSval=514184642 TSecr=3914484105"
"846","3.319393","151.101.1.140","100.86.243.187","TCP","1510","443  >  56509 [ACK] Seq=307573 Ack=728 Win=424 Len=1444 TSval=3914484107 TSecr=514184628 [TCP PDU reassembled in 855]"
"847","3.319394","151.101.1.140","100.86.243.187","TCP","1510","443  >  56509 [PSH, ACK] Seq=309017 Ack=728 Win=424 Len=1444 TSval=3914484107 TSecr=514184628 [TCP PDU reassembled in 855]"
"848","3.319543","100.86.243.187","151.101.1.140","TCP","66","56509  >  443 [ACK] Seq=728 Ack=310461 Win=7025 Len=0 TSval=514184645 TSecr=3914484107"
"849","3.321020","151.101.1.140","100.86.243.187","TCP","1510","443  >  56509 [ACK] Seq=310461 Ack=728 Win=424 Len=1444 TSval=3914484110 TSecr=514184632 [TCP PDU reassembled in 855]"
"850","3.321726","151.101.1.140","100.86.243.187","TCP","1510","443  >  56509 [PSH, ACK] Seq=311905 Ack=728 Win=424 Len=1444 TSval=3914484110 TSecr=514184632 [TCP PDU reassembled in 855]"
"851","3.321828","100.86.243.187","151.101.1.140","TCP","66","56509  >  443 [ACK] Seq=728 Ack=313349 Win=7025 Len=0 TSval=514184647 TSecr=3914484110"
"852","3.323383","151.101.1.140","100.86.243.187","TCP","1510","443  >  56509 [ACK] Seq=313349 Ack=728 Win=424 Len=1444 TSval=3914484112 TSecr=514184634 [TCP PDU reassembled in 855]"
"853","3.324390","151.101.1.140","100.86.243.187","TCP","1510","443  >  56509 [PSH, ACK] Seq=314793 Ack=728 Win=424 Len=1444 TSval=3914484112 TSecr=514184634 [TCP PDU reassembled in 855]"
"854","3.324543","100.86.243.187","151.101.1.140","TCP","66","56509  >  443 [ACK] Seq=728 Ack=316237 Win=7025 Len=0 TSval=514184650 TSecr=3914484112"
"855","3.326152","151.101.1.140","100.86.243.187","TLSv1.2","1510","Application Data"
"856","3.326709","151.101.1.140","100.86.243.187","TCP","1510","443  >  56509 [PSH, ACK] Seq=317681 Ack=728 Win=424 Len=1444 TSval=3914484114 TSecr=514184636 [TCP PDU reassembled in 873]"
"857","3.326847","100.86.243.187","151.101.1.140","TCP","66","56509  >  443 [ACK] Seq=728 Ack=319125 Win=7025 Len=0 TSval=514184652 TSecr=3914484114"
"858","3.328353","151.101.1.140","100.86.243.187","TCP","1510","443  >  56509 [ACK] Seq=319125 Ack=728 Win=424 Len=1444 TSval=3914484116 TSecr=514184639 [TCP PDU reassembled in 873]"
"859","3.328355","151.101.1.140","100.86.243.187","TCP","1510","443  >  56509 [PSH, ACK] Seq=320569 Ack=728 Win=424 Len=1444 TSval=3914484116 TSecr=514184639 [TCP PDU reassembled in 873]"
"860","3.328487","100.86.243.187","151.101.1.140","TCP","66","56509  >  443 [ACK] Seq=728 Ack=322013 Win=7025 Len=0 TSval=514184654 TSecr=3914484116"
"861","3.330125","151.101.1.140","100.86.243.187","TCP","1510","443  >  56509 [ACK] Seq=322013 Ack=728 Win=424 Len=1444 TSval=3914484118 TSecr=514184642 [TCP PDU reassembled in 873]"
"862","3.330824","151.101.1.140","100.86.243.187","TCP","1510","443  >  56509 [PSH, ACK] Seq=323457 Ack=728 Win=424 Len=1444 TSval=3914484118 TSecr=514184642 [TCP PDU reassembled in 873]"
"863","3.330965","100.86.243.187","151.101.1.140","TCP","66","56509  >  443 [ACK] Seq=728 Ack=324901 Win=7025 Len=0 TSval=514184656 TSecr=3914484118"
"864","3.331821","151.101.1.140","100.86.243.187","TCP","1510","443  >  56509 [ACK] Seq=324901 Ack=728 Win=424 Len=1444 TSval=3914484120 TSecr=514184645 [TCP PDU reassembled in 873]"
"865","3.332221","151.101.1.140","100.86.243.187","TCP","1510","443  >  56509 [PSH, ACK] Seq=326345 Ack=728 Win=424 Len=1444 TSval=3914484120 TSecr=514184645 [TCP PDU reassembled in 873]"
"866","3.332342","100.86.243.187","151.101.1.140","TCP","66","56509  >  443 [ACK] Seq=728 Ack=327789 Win=7025 Len=0 TSval=514184657 TSecr=3914484120"
"867","3.334049","151.101.1.140","100.86.243.187","TCP","1510","443  >  56509 [ACK] Seq=327789 Ack=728 Win=424 Len=1444 TSval=3914484122 TSecr=514184647 [TCP PDU reassembled in 873]"
"868","3.335510","151.101.1.140","100.86.243.187","TCP","1510","443  >  56509 [PSH, ACK] Seq=329233 Ack=728 Win=424 Len=1444 TSval=3914484122 TSecr=514184647 [TCP PDU reassembled in 873]"
"869","3.335511","151.101.1.140","100.86.243.187","TCP","1510","443  >  56509 [ACK] Seq=330677 Ack=728 Win=424 Len=1444 TSval=3914484124 TSecr=514184650 [TCP PDU reassembled in 873]"
"870","3.335665","100.86.243.187","151.101.1.140","TCP","66","56509  >  443 [ACK] Seq=728 Ack=332121 Win=7025 Len=0 TSval=514184661 TSecr=3914484122"
"871","3.335929","151.101.1.140","100.86.243.187","TCP","1510","443  >  56509 [PSH, ACK] Seq=332121 Ack=728 Win=424 Len=1444 TSval=3914484124 TSecr=514184650 [TCP PDU reassembled in 873]"
"872","3.336030","100.86.243.187","151.101.1.140","TCP","66","56509  >  443 [ACK] Seq=728 Ack=333565 Win=7025 Len=0 TSval=514184661 TSecr=3914484124"
"873","3.337786","151.101.1.140","100.86.243.187","TLSv1.2","1510","Application Data"
"874","3.337892","151.101.1.140","100.86.243.187","TCP","1510","443  >  56509 [PSH, ACK] Seq=335009 Ack=728 Win=424 Len=1444 TSval=3914484126 TSecr=514184652 [TCP PDU reassembled in 887]"
"875","3.338055","100.86.243.187","151.101.1.140","TCP","66","56509  >  443 [ACK] Seq=728 Ack=336453 Win=7025 Len=0 TSval=514184663 TSecr=3914484126"
"876","3.340306","151.101.1.140","100.86.243.187","TCP","1510","443  >  56509 [ACK] Seq=336453 Ack=728 Win=424 Len=1444 TSval=3914484127 TSecr=514184654 [TCP PDU reassembled in 887]"
"877","3.340307","151.101.1.140","100.86.243.187","TCP","1510","443  >  56509 [PSH, ACK] Seq=337897 Ack=728 Win=424 Len=1444 TSval=3914484127 TSecr=514184654 [TCP PDU reassembled in 887]"
"878","3.340447","100.86.243.187","151.101.1.140","TCP","66","56509  >  443 [ACK] Seq=728 Ack=339341 Win=7025 Len=0 TSval=514184666 TSecr=3914484127"
"879","3.437450","151.101.1.140","100.86.243.187","TCP","1510","443  >  56509 [ACK] Seq=339341 Ack=728 Win=424 Len=1444 TSval=3914484129 TSecr=514184656 [TCP PDU reassembled in 887]"
"880","3.437451","151.101.1.140","100.86.243.187","TCP","1510","443  >  56509 [PSH, ACK] Seq=340785 Ack=728 Win=424 Len=1444 TSval=3914484129 TSecr=514184656 [TCP PDU reassembled in 887]"
"881","3.437452","151.101.1.140","100.86.243.187","TCP","1510","443  >  56509 [ACK] Seq=342229 Ack=728 Win=424 Len=1444 TSval=3914484130 TSecr=514184657 [TCP PDU reassembled in 887]"
"882","3.437619","100.86.243.187","151.101.1.140","TCP","66","56509  >  443 [ACK] Seq=728 Ack=343673 Win=7025 Len=0 TSval=514184763 TSecr=3914484130"
"883","3.439170","151.101.1.140","100.86.243.187","TCP","1510","443  >  56509 [PSH, ACK] Seq=343673 Ack=728 Win=424 Len=1444 TSval=3914484130 TSecr=514184657 [TCP PDU reassembled in 887]"
"884","3.439171","151.101.1.140","100.86.243.187","TCP","1510","443  >  56509 [ACK] Seq=345117 Ack=728 Win=424 Len=1444 TSval=3914484134 TSecr=514184661 [TCP PDU reassembled in 887]"
"885","3.439172","151.101.1.140","100.86.243.187","TCP","1510","443  >  56509 [PSH, ACK] Seq=346561 Ack=728 Win=424 Len=1444 TSval=3914484134 TSecr=514184661 [TCP PDU reassembled in 887]"
"886","3.439173","151.101.1.140","100.86.243.187","TCP","1510","443  >  56509 [ACK] Seq=348005 Ack=728 Win=424 Len=1444 TSval=3914484135 TSecr=514184661 [TCP PDU reassembled in 887]"
"887","3.439173","151.101.1.140","100.86.243.187","TLSv1.2","1510","Application Data"
"888","3.439174","151.101.1.140","100.86.243.187","TCP","1510","443  >  56509 [ACK] Seq=350893 Ack=728 Win=424 Len=1444 TSval=3914484137 TSecr=514184663 [TCP PDU reassembled in 904]"
"889","3.439174","151.101.1.140","100.86.243.187","TCP","1510","443  >  56509 [PSH, ACK] Seq=352337 Ack=728 Win=424 Len=1444 TSval=3914484137 TSecr=514184663 [TCP PDU reassembled in 904]"
"890","3.439175","151.101.1.140","100.86.243.187","TCP","1510","443  >  56509 [ACK] Seq=353781 Ack=728 Win=424 Len=1444 TSval=3914484164 TSecr=514184663 [TCP PDU reassembled in 904]"
"891","3.439466","100.86.243.187","151.101.1.140","TCP","66","56509  >  443 [ACK] Seq=728 Ack=355225 Win=7025 Len=0 TSval=514184765 TSecr=3914484164"
"892","3.449050","151.101.1.140","100.86.243.187","TCP","1510","443  >  56509 [ACK] Seq=355225 Ack=728 Win=424 Len=1444 TSval=3914484236 TSecr=514184763 [TCP PDU reassembled in 904]"
"893","3.449052","151.101.1.140","100.86.243.187","TCP","1510","443  >  56509 [PSH, ACK] Seq=356669 Ack=728 Win=424 Len=1444 TSval=3914484236 TSecr=514184763 [TCP PDU reassembled in 904]"
"894","3.449052","151.101.1.140","100.86.243.187","TCP","1510","443  >  56509 [ACK] Seq=358113 Ack=728 Win=424 Len=1444 TSval=3914484237 TSecr=514184763 [TCP PDU reassembled in 904]"
"895","3.449213","100.86.243.187","151.101.1.140","TCP","66","56509  >  443 [ACK] Seq=728 Ack=359557 Win=7025 Len=0 TSval=514184775 TSecr=3914484237"
"896","3.449627","151.101.1.140","100.86.243.187","TCP","1510","443  >  56509 [PSH, ACK] Seq=359557 Ack=728 Win=424 Len=1444 TSval=3914484237 TSecr=514184763 [TCP PDU reassembled in 904]"
"897","3.449716","100.86.243.187","151.101.1.140","TCP","66","56509  >  443 [ACK] Seq=728 Ack=361001 Win=7025 Len=0 TSval=514184775 TSecr=3914484237"
"898","3.452182","151.101.1.140","100.86.243.187","TCP","1510","443  >  56509 [ACK] Seq=361001 Ack=728 Win=424 Len=1444 TSval=3914484240 TSecr=514184763 [TCP PDU reassembled in 904]"
"899","3.452183","151.101.1.140","100.86.243.187","TCP","1510","443  >  56509 [PSH, ACK] Seq=362445 Ack=728 Win=424 Len=1444 TSval=3914484240 TSecr=514184763 [TCP PDU reassembled in 904]"
"900","3.452281","100.86.243.187","151.101.1.140","TCP","66","56509  >  443 [ACK] Seq=728 Ack=363889 Win=7025 Len=0 TSval=514184778 TSecr=3914484240"
"901","3.454499","151.101.1.140","100.86.243.187","TCP","1510","443  >  56509 [ACK] Seq=363889 Ack=728 Win=424 Len=1444 TSval=3914484243 TSecr=514184765 [TCP PDU reassembled in 904]"
"902","3.455480","151.101.1.140","100.86.243.187","TCP","1510","443  >  56509 [PSH, ACK] Seq=365333 Ack=728 Win=424 Len=1444 TSval=3914484243 TSecr=514184765 [TCP PDU reassembled in 904]"
"903","3.455614","100.86.243.187","151.101.1.140","TCP","66","56509  >  443 [ACK] Seq=728 Ack=366777 Win=7025 Len=0 TSval=514184781 TSecr=3914484243"
"904","3.459150","151.101.1.140","100.86.243.187","TLSv1.2","1510","Application Data, Application Data"
"905","3.459152","151.101.1.140","100.86.243.187","TCP","1510","443  >  56509 [PSH, ACK] Seq=368221 Ack=728 Win=424 Len=1444 TSval=3914484247 TSecr=514184765 [TCP PDU reassembled in 920]"
"906","3.459397","100.86.243.187","151.101.1.140","TCP","66","56509  >  443 [ACK] Seq=728 Ack=369665 Win=7025 Len=0 TSval=514184785 TSecr=3914484247"
"907","3.463727","151.101.1.140","100.86.243.187","TCP","1510","443  >  56509 [ACK] Seq=369665 Ack=728 Win=424 Len=1444 TSval=3914484251 TSecr=514184765 [TCP PDU reassembled in 920]"
"908","3.463728","151.101.1.140","100.86.243.187","TCP","1510","443  >  56509 [PSH, ACK] Seq=371109 Ack=728 Win=424 Len=1444 TSval=3914484251 TSecr=514184765 [TCP PDU reassembled in 920]"
"909","3.463905","100.86.243.187","151.101.1.140","TCP","66","56509  >  443 [ACK] Seq=728 Ack=372553 Win=7025 Len=0 TSval=514184789 TSecr=3914484251"
"910","3.467416","151.101.1.140","100.86.243.187","TCP","1510","443  >  56509 [ACK] Seq=372553 Ack=728 Win=424 Len=1444 TSval=3914484255 TSecr=514184765 [TCP PDU reassembled in 920]"
"911","3.467483","151.101.1.140","100.86.243.187","TCP","1510","443  >  56509 [PSH, ACK] Seq=373997 Ack=728 Win=424 Len=1444 TSval=3914484255 TSecr=514184765 [TCP PDU reassembled in 920]"
"912","3.467573","100.86.243.187","151.101.1.140","TCP","66","56509  >  443 [ACK] Seq=728 Ack=375441 Win=7025 Len=0 TSval=514184793 TSecr=3914484255"
"913","3.473652","151.101.1.140","100.86.243.187","TCP","1510","443  >  56509 [ACK] Seq=375441 Ack=728 Win=424 Len=1444 TSval=3914484259 TSecr=514184778 [TCP PDU reassembled in 920]"
"914","3.473654","151.101.1.140","100.86.243.187","TCP","1510","443  >  56509 [PSH, ACK] Seq=376885 Ack=728 Win=424 Len=1444 TSval=3914484259 TSecr=514184778 [TCP PDU reassembled in 920]"
"915","3.473654","151.101.1.140","100.86.243.187","TCP","1510","443  >  56509 [ACK] Seq=378329 Ack=728 Win=424 Len=1444 TSval=3914484262 TSecr=514184781 [TCP PDU reassembled in 920]"
"916","3.473822","100.86.243.187","151.101.1.140","TCP","66","56509  >  443 [ACK] Seq=728 Ack=379773 Win=7025 Len=0 TSval=514184799 TSecr=3914484262"
"917","3.474050","151.101.1.140","100.86.243.187","TCP","1510","443  >  56509 [PSH, ACK] Seq=379773 Ack=728 Win=424 Len=1444 TSval=3914484262 TSecr=514184781 [TCP PDU reassembled in 920]"
"918","3.474140","100.86.243.187","151.101.1.140","TCP","66","56509  >  443 [ACK] Seq=728 Ack=381217 Win=7025 Len=0 TSval=514184799 TSecr=3914484262"
"919","3.476891","151.101.1.140","100.86.243.187","TCP","1510","443  >  56509 [ACK] Seq=381217 Ack=728 Win=424 Len=1444 TSval=3914484265 TSecr=514184785 [TCP PDU reassembled in 920]"
"920","3.476892","151.101.1.140","100.86.243.187","TLSv1.2","1510","Application Data"
"921","3.477144","100.86.243.187","151.101.1.140","TCP","66","56509  >  443 [ACK] Seq=728 Ack=384105 Win=7025 Len=0 TSval=514184802 TSecr=3914484265"
"922","3.480042","151.101.1.140","100.86.243.187","TCP","1510","443  >  56509 [ACK] Seq=384105 Ack=728 Win=424 Len=1444 TSval=3914484268 TSecr=514184785 [TCP PDU reassembled in 936]"
"923","3.482944","151.101.1.140","100.86.243.187","TCP","1510","443  >  56509 [PSH, ACK] Seq=385549 Ack=728 Win=424 Len=1444 TSval=3914484268 TSecr=514184785 [TCP PDU reassembled in 936]"
"924","3.482973","151.101.1.140","100.86.243.187","TCP","1510","443  >  56509 [ACK] Seq=386993 Ack=728 Win=424 Len=1444 TSval=3914484271 TSecr=514184789 [TCP PDU reassembled in 936]"
"925","3.483113","100.86.243.187","151.101.1.140","TCP","66","56509  >  443 [ACK] Seq=728 Ack=388437 Win=7025 Len=0 TSval=514184809 TSecr=3914484268"
"926","3.483888","151.101.1.140","100.86.243.187","TCP","1510","443  >  56509 [PSH, ACK] Seq=388437 Ack=728 Win=424 Len=1444 TSval=3914484271 TSecr=514184789 [TCP PDU reassembled in 936]"
"927","3.483991","100.86.243.187","151.101.1.140","TCP","66","56509  >  443 [ACK] Seq=728 Ack=389881 Win=7025 Len=0 TSval=514184809 TSecr=3914484271"
"928","3.485426","151.101.1.140","100.86.243.187","TCP","1510","443  >  56509 [ACK] Seq=389881 Ack=728 Win=424 Len=1444 TSval=3914484273 TSecr=514184793 [TCP PDU reassembled in 936]"
"929","3.485495","151.101.1.140","100.86.243.187","TCP","1510","443  >  56509 [PSH, ACK] Seq=391325 Ack=728 Win=424 Len=1444 TSval=3914484273 TSecr=514184793 [TCP PDU reassembled in 936]"
"930","3.485560","100.86.243.187","151.101.1.140","TCP","66","56509  >  443 [ACK] Seq=728 Ack=392769 Win=7025 Len=0 TSval=514184811 TSecr=3914484273"
"931","3.488469","151.101.1.140","100.86.243.187","TCP","1510","443  >  56509 [ACK] Seq=392769 Ack=728 Win=424 Len=1444 TSval=3914484276 TSecr=514184793 [TCP PDU reassembled in 936]"
"932","3.488470","151.101.1.140","100.86.243.187","TCP","1510","443  >  56509 [PSH, ACK] Seq=394213 Ack=728 Win=424 Len=1444 TSval=3914484276 TSecr=514184793 [TCP PDU reassembled in 936]"
"933","3.488616","100.86.243.187","151.101.1.140","TCP","66","56509  >  443 [ACK] Seq=728 Ack=395657 Win=7025 Len=0 TSval=514184814 TSecr=3914484276"
"934","3.490802","151.101.1.140","100.86.243.187","TCP","1510","443  >  56509 [ACK] Seq=395657 Ack=728 Win=424 Len=1444 TSval=3914484278 TSecr=514184799 [TCP PDU reassembled in 936]"
"935","3.492202","151.101.1.140","100.86.243.187","TCP","1510","443  >  56509 [PSH, ACK] Seq=397101 Ack=728 Win=424 Len=1444 TSval=3914484278 TSecr=514184799 [TCP PDU reassembled in 936]"
"936","3.492224","151.101.1.140","100.86.243.187","TLSv1.2","1510","Application Data"
"937","3.492404","100.86.243.187","151.101.1.140","TCP","66","56509  >  443 [ACK] Seq=728 Ack=399989 Win=7025 Len=0 TSval=514184818 TSecr=3914484278"
"938","3.493684","151.101.1.140","100.86.243.187","TCP","1510","443  >  56509 [PSH, ACK] Seq=399989 Ack=728 Win=424 Len=1444 TSval=3914484280 TSecr=514184802 [TCP PDU reassembled in 955]"
"939","3.493818","100.86.243.187","151.101.1.140","TCP","66","56509  >  443 [ACK] Seq=728 Ack=401433 Win=7025 Len=0 TSval=514184819 TSecr=3914484280"
"940","3.495138","151.101.1.140","100.86.243.187","TCP","1510","443  >  56509 [ACK] Seq=401433 Ack=728 Win=424 Len=1444 TSval=3914484282 TSecr=514184802 [TCP PDU reassembled in 955]"
"941","3.495401","151.101.1.140","100.86.243.187","TCP","1510","443  >  56509 [PSH, ACK] Seq=402877 Ack=728 Win=424 Len=1444 TSval=3914484282 TSecr=514184802 [TCP PDU reassembled in 955]"
"942","3.495493","100.86.243.187","151.101.1.140","TCP","66","56509  >  443 [ACK] Seq=728 Ack=404321 Win=7025 Len=0 TSval=514184821 TSecr=3914484282"
"943","3.496836","151.101.1.140","100.86.243.187","TCP","1510","443  >  56509 [ACK] Seq=404321 Ack=728 Win=424 Len=1444 TSval=3914484284 TSecr=514184809 [TCP PDU reassembled in 955]"
"944","3.496871","151.101.1.140","100.86.243.187","TCP","1510","443  >  56509 [PSH, ACK] Seq=405765 Ack=728 Win=424 Len=1444 TSval=3914484284 TSecr=514184809 [TCP PDU reassembled in 955]"
"945","3.496974","100.86.243.187","151.101.1.140","TCP","66","56509  >  443 [ACK] Seq=728 Ack=407209 Win=7025 Len=0 TSval=514184822 TSecr=3914484284"
"946","3.498164","151.101.1.140","100.86.243.187","TCP","1510","443  >  56509 [ACK] Seq=407209 Ack=728 Win=424 Len=1444 TSval=3914484286 TSecr=514184809 [TCP PDU reassembled in 955]"
"947","3.499090","151.101.1.140","100.86.243.187","TCP","1510","443  >  56509 [PSH, ACK] Seq=408653 Ack=728 Win=424 Len=1444 TSval=3914484286 TSecr=514184809 [TCP PDU reassembled in 955]"
"948","3.499206","100.86.243.187","151.101.1.140","TCP","66","56509  >  443 [ACK] Seq=728 Ack=410097 Win=7025 Len=0 TSval=514184824 TSecr=3914484286"
"949","3.500705","151.101.1.140","100.86.243.187","TCP","1510","443  >  56509 [ACK] Seq=410097 Ack=728 Win=424 Len=1444 TSval=3914484288 TSecr=514184811 [TCP PDU reassembled in 955]"
"950","3.500706","151.101.1.140","100.86.243.187","TCP","1510","443  >  56509 [PSH, ACK] Seq=411541 Ack=728 Win=424 Len=1444 TSval=3914484288 TSecr=514184811 [TCP PDU reassembled in 955]"
"951","3.500833","100.86.243.187","151.101.1.140","TCP","66","56509  >  443 [ACK] Seq=728 Ack=412985 Win=7025 Len=0 TSval=514184826 TSecr=3914484288"
"952","3.503177","151.101.1.140","100.86.243.187","TCP","1510","443  >  56509 [ACK] Seq=412985 Ack=728 Win=424 Len=1444 TSval=3914484290 TSecr=514184814 [TCP PDU reassembled in 955]"
"953","3.503178","151.101.1.140","100.86.243.187","TCP","1510","443  >  56509 [PSH, ACK] Seq=414429 Ack=728 Win=424 Len=1444 TSval=3914484290 TSecr=514184814 [TCP PDU reassembled in 955]"
"954","3.503292","100.86.243.187","151.101.1.140","TCP","66","56509  >  443 [ACK] Seq=728 Ack=415873 Win=7025 Len=0 TSval=514184829 TSecr=3914484290"
"955","3.510083","151.101.1.140","100.86.243.187","TLSv1.2","1510","Application Data"
"956","3.510084","151.101.1.140","100.86.243.187","TCP","1510","443  >  56509 [PSH, ACK] Seq=417317 Ack=728 Win=424 Len=1444 TSval=3914484297 TSecr=514184822 [TCP PDU reassembled in 958]"
"957","3.510085","151.101.1.140","100.86.243.187","TCP","1510","443  >  56509 [ACK] Seq=418761 Ack=728 Win=424 Len=1444 TSval=3914484298 TSecr=514184822 [TCP PDU reassembled in 958]"
"958","3.510086","151.101.1.140","100.86.243.187","TLSv1.2","1481","Application Data"
"959","3.510363","100.86.243.187","151.101.1.140","TCP","66","56509  >  443 [ACK] Seq=728 Ack=421620 Win=7025 Len=0 TSval=514184836 TSecr=3914484298"
