"No.","Time","Source","Destination","Protocol","Length","Info"
"1","0.000000","100.86.243.187","151.101.1.140","TCP","1514","56485  >  443 [ACK] Seq=1 Ack=1 Win=3925 Len=1448 TSval=2851393748 TSecr=1266338379 [TCP PDU reassembled in 2]"
"2","0.000046","100.86.243.187","151.101.1.140","TLSv1.2","1294","Application Data"
"3","0.000163","100.86.243.187","151.101.1.140","TLSv1.2","733","Application Data"
"7","0.010589","151.101.1.140","100.86.243.187","TCP","66","443  >  56485 [ACK] Seq=1 Ack=1449 Win=637 Len=0 TSval=1266339246 TSecr=2851393748"
"8","0.010590","151.101.1.140","100.86.243.187","TCP","66","443  >  56485 [ACK] Seq=1 Ack=3344 Win=634 Len=0 TSval=1266339246 TSecr=2851393748"
"10","0.032293","151.101.1.140","100.86.243.187","TCP","1510","443  >  56485 [ACK] Seq=1 Ack=3344 Win=639 Len=1444 TSval=1266339267 TSecr=2851393748 [TCP PDU reassembled in 12]"
"11","0.032402","100.86.243.187","151.101.1.140","TCP","66","56485  >  443 [ACK] Seq=3344 Ack=1445 Win=3903 Len=0 TSval=2851393780 TSecr=1266339267"
"12","0.033072","151.101.1.140","100.86.243.187","TLSv1.2","302","Application Data"
"13","0.033073","151.101.1.140","100.86.243.187","TLSv1.2","99","Application Data"
"14","0.033137","100.86.243.187","151.101.1.140","TCP","66","56485  >  443 [ACK] Seq=3344 Ack=1714 Win=3921 Len=0 TSval=2851393780 TSecr=1266339268"
"19","0.370261","100.86.243.187","151.101.1.140","TCP","1514","56485  >  443 [ACK] Seq=3344 Ack=1714 Win=3925 Len=1448 TSval=2851394118 TSecr=1266339268 [TCP PDU reassembled in 20]"
"20","0.370304","100.86.243.187","151.101.1.140","TLSv1.2","1440","Application Data"
"21","0.380935","151.101.1.140","100.86.243.187","TCP","66","443  >  56485 [ACK] Seq=1714 Ack=6166 Win=634 Len=0 TSval=1266339616 TSecr=2851394118"
"22","0.385249","100.86.243.187","151.101.1.140","TCP","1514","56485  >  443 [ACK] Seq=6166 Ack=1714 Win=3925 Len=1448 TSval=2851394133 TSecr=1266339616 [TCP PDU reassembled in 23]"
"23","0.385291","100.86.243.187","151.101.1.140","TLSv1.2","1477","Application Data"
"24","0.396003","151.101.1.140","100.86.243.187","TCP","66","443  >  56485 [ACK] Seq=1714 Ack=9025 Win=635 Len=0 TSval=1266339631 TSecr=2851394133"
"25","0.403621","151.101.1.140","100.86.243.187","TCP","1510","443  >  56485 [ACK] Seq=1714 Ack=9025 Win=639 Len=1444 TSval=1266339639 TSecr=2851394133 [TCP PDU reassembled in 27]"
"26","0.403723","100.86.243.187","151.101.1.140","TCP","66","56485  >  443 [ACK] Seq=9025 Ack=3158 Win=3903 Len=0 TSval=2851394151 TSecr=1266339639"
"27","0.403863","151.101.1.140","100.86.243.187","TLSv1.2","868","Application Data"
"28","0.403922","100.86.243.187","151.101.1.140","TCP","66","56485  >  443 [ACK] Seq=9025 Ack=3960 Win=3913 Len=0 TSval=2851394151 TSecr=1266339639"
"29","0.421843","151.101.1.140","100.86.243.187","TCP","1510","443  >  56485 [ACK] Seq=3960 Ack=9025 Win=639 Len=1444 TSval=1266339657 TSecr=2851394151 [TCP PDU reassembled in 31]"
"30","0.421972","100.86.243.187","151.101.1.140","TCP","66","56485  >  443 [ACK] Seq=9025 Ack=5404 Win=3903 Len=0 TSval=2851394170 TSecr=1266339657"
"31","0.422628","151.101.1.140","100.86.243.187","TLSv1.2","381","Application Data"
"32","0.422815","100.86.243.187","151.101.1.140","TCP","66","56485  >  443 [ACK] Seq=9025 Ack=5719 Win=3920 Len=0 TSval=2851394170 TSecr=1266339657"
"33","0.451160","100.86.243.187","151.101.1.140","TCP","1514","56485  >  443 [ACK] Seq=9025 Ack=5719 Win=3925 Len=1448 TSval=2851394199 TSecr=1266339657 [TCP PDU reassembled in 34]"
"34","0.451205","100.86.243.187","151.101.1.140","TLSv1.2","1473","Application Data"
"35","0.451733","100.86.243.187","151.101.1.140","TCP","1514","56485  >  443 [ACK] Seq=11880 Ack=5719 Win=3925 Len=1448 TSval=2851394199 TSecr=1266339657 [TCP PDU reassembled in 36]"
"36","0.451762","100.86.243.187","151.101.1.140","TLSv1.2","1488","Application Data"
"37","0.452237","100.86.243.187","151.101.1.140","TCP","1514","56485  >  443 [ACK] Seq=14750 Ack=5719 Win=3925 Len=1448 TSval=2851394200 TSecr=1266339657 [TCP PDU reassembled in 38]"
"38","0.452261","100.86.243.187","151.101.1.140","TLSv1.2","1465","Application Data"
"39","0.461469","151.101.1.140","100.86.243.187","TCP","66","443  >  56485 [ACK] Seq=5719 Ack=11880 Win=635 Len=0 TSval=1266339697 TSecr=2851394199"
"40","0.462160","151.101.1.140","100.86.243.187","TCP","66","443  >  56485 [ACK] Seq=5719 Ack=17597 Win=626 Len=0 TSval=1266339698 TSecr=2851394200"
"41","0.480406","151.101.1.140","100.86.243.187","TLSv1.2","438","Application Data"
"42","0.480497","100.86.243.187","151.101.1.140","TCP","66","56485  >  443 [ACK] Seq=17597 Ack=6091 Win=3920 Len=0 TSval=2851394228 TSecr=1266339715"
"43","0.484924","151.101.1.140","100.86.243.187","TCP","1510","443  >  56485 [ACK] Seq=6091 Ack=17597 Win=639 Len=1444 TSval=1266339720 TSecr=2851394200 [TCP PDU reassembled in 45]"
"44","0.485017","100.86.243.187","151.101.1.140","TCP","66","56485  >  443 [ACK] Seq=17597 Ack=7535 Win=3903 Len=0 TSval=2851394233 TSecr=1266339720"
"45","0.485150","151.101.1.140","100.86.243.187","TLSv1.2","893","Application Data"
"46","0.485211","100.86.243.187","151.101.1.140","TCP","66","56485  >  443 [ACK] Seq=17597 Ack=8362 Win=3912 Len=0 TSval=2851394233 TSecr=1266339720"
"47","0.485898","151.101.1.140","100.86.243.187","TCP","1510","443  >  56485 [ACK] Seq=8362 Ack=17597 Win=639 Len=1444 TSval=1266339722 TSecr=2851394200 [TCP PDU reassembled in 49]"
"48","0.485975","100.86.243.187","151.101.1.140","TCP","66","56485  >  443 [ACK] Seq=17597 Ack=9806 Win=3903 Len=0 TSval=2851394233 TSecr=1266339722"
"49","0.486238","151.101.1.140","100.86.243.187","TLSv1.2","352","Application Data"
"50","0.486300","100.86.243.187","151.101.1.140","TCP","66","56485  >  443 [ACK] Seq=17597 Ack=10092 Win=3921 Len=0 TSval=2851394234 TSecr=1266339722"
"51","0.496276","151.101.1.140","100.86.243.187","TCP","1510","443  >  56485 [ACK] Seq=10092 Ack=17597 Win=639 Len=1444 TSval=1266339732 TSecr=2851394233 [TCP PDU reassembled in 53]"
"52","0.496373","100.86.243.187","151.101.1.140","TCP","66","56485  >  443 [ACK] Seq=17597 Ack=11536 Win=3903 Len=0 TSval=2851394244 TSecr=1266339732"
"53","0.496888","151.101.1.140","100.86.243.187","TLSv1.2","893","Application Data"
"54","0.496955","100.86.243.187","151.101.1.140","TCP","66","56485  >  443 [ACK] Seq=17597 Ack=12363 Win=3912 Len=0 TSval=2851394244 TSecr=1266339732"
"55","0.539284","151.101.1.140","100.86.243.187","TLSv1.2","1504","Application Data"
"56","0.539487","100.86.243.187","151.101.1.140","TCP","66","56485  >  443 [ACK] Seq=17597 Ack=13801 Win=3903 Len=0 TSval=2851394287 TSecr=1266339774"
"57","0.540285","151.101.1.140","100.86.243.187","TLSv1.2","668","Application Data"
"58","0.540287","151.101.1.140","100.86.243.187","TLSv1.2","391","Application Data"
"59","0.540444","100.86.243.187","151.101.1.140","TCP","66","56485  >  443 [ACK] Seq=17597 Ack=14728 Win=3911 Len=0 TSval=2851394287 TSecr=1266339775"
"60","0.540976","151.101.1.140","100.86.243.187","TLSv1.2","97","Application Data"
"61","0.541092","100.86.243.187","151.101.1.140","TCP","66","56485  >  443 [ACK] Seq=17597 Ack=14759 Win=3925 Len=0 TSval=2851394288 TSecr=1266339775"
"62","0.546675","151.101.1.140","100.86.243.187","TLSv1.2","1051","Application Data"
"63","0.546783","100.86.243.187","151.101.1.140","TCP","66","56485  >  443 [ACK] Seq=17597 Ack=15744 Win=3910 Len=0 TSval=2851394294 TSecr=1266339782"
"64","0.549316","151.101.1.140","100.86.243.187","TLSv1.2","97","Application Data"
"65","0.549407","100.86.243.187","151.101.1.140","TCP","66","56485  >  443 [ACK] Seq=17597 Ack=15775 Win=3925 Len=0 TSval=2851394297 TSecr=1266339785"
"66","0.551942","151.101.1.140","100.86.243.187","TLSv1.2","815","Application Data"
"67","0.552074","100.86.243.187","151.101.1.140","TCP","66","56485  >  443 [ACK] Seq=17597 Ack=16524 Win=3925 Len=0 TSval=2851394300 TSecr=1266339787"
"68","0.555153","151.101.1.140","100.86.243.187","TLSv1.2","107","Application Data"
"69","0.555323","100.86.243.187","151.101.1.140","TCP","66","56485  >  443 [ACK] Seq=17597 Ack=16565 Win=3925 Len=0 TSval=2851394303 TSecr=1266339791"
"70","0.591674","100.86.243.187","151.101.1.140","TCP","1514","56485  >  443 [ACK] Seq=17597 Ack=16565 Win=3925 Len=1448 TSval=2851394339 TSecr=1266339791 [TCP PDU reassembled in 71]"
"71","0.591758","100.86.243.187","151.101.1.140","TLSv1.2","1423","Application Data"
"72","0.614570","151.101.1.140","100.86.243.187","TCP","66","443  >  56485 [ACK] Seq=16565 Ack=20402 Win=634 Len=0 TSval=1266339850 TSecr=2851394339"
"76","0.639255","151.101.1.140","100.86.243.187","TCP","1510","443  >  56485 [ACK] Seq=16565 Ack=20402 Win=639 Len=1444 TSval=1266339874 TSecr=2851394339 [TCP PDU reassembled in 78]"
"77","0.639334","100.86.243.187","151.101.1.140","TCP","66","56485  >  443 [ACK] Seq=20402 Ack=18009 Win=3903 Len=0 TSval=2851394387 TSecr=1266339874"
"78","0.639429","151.101.1.140","100.86.243.187","TLSv1.2","313","Application Data"
"79","0.640525","100.86.243.187","151.101.1.140","TCP","66","56485  >  443 [ACK] Seq=20402 Ack=18256 Win=3925 Len=0 TSval=2851394388 TSecr=1266339874"
"109","0.957234","100.86.243.187","151.101.1.140","TCP","1514","56485  >  443 [ACK] Seq=20402 Ack=18256 Win=3925 Len=1448 TSval=2851394705 TSecr=1266339874 [TCP PDU reassembled in 110]"
"110","0.957277","100.86.243.187","151.101.1.140","TLSv1.2","1454","Application Data"
"111","0.957321","100.86.243.187","151.101.1.140","TLSv1.2","222","Application Data"
"112","0.971167","151.101.1.140","100.86.243.187","TCP","66","443  >  56485 [ACK] Seq=18256 Ack=23394 Win=635 Len=0 TSval=1266340207 TSecr=2851394705"
"113","0.986020","100.86.243.187","151.101.1.140","TCP","1514","56485  >  443 [ACK] Seq=23394 Ack=18256 Win=3925 Len=1448 TSval=2851394734 TSecr=1266340207 [TCP PDU reassembled in 114]"
"114","0.986063","100.86.243.187","151.101.1.140","TLSv1.2","1452","Application Data"
"115","0.986151","100.86.243.187","151.101.1.140","TLSv1.2","146","Application Data"
"116","0.991262","100.86.243.187","151.101.1.140","TCP","1514","56485  >  443 [ACK] Seq=26308 Ack=18256 Win=3925 Len=1448 TSval=2851394739 TSecr=1266340207 [TCP PDU reassembled in 118]"
"117","0.991264","100.86.243.187","151.101.1.140","TCP","1514","56485  >  443 [ACK] Seq=27756 Ack=18256 Win=3925 Len=1448 TSval=2851394739 TSecr=1266340207 [TCP PDU reassembled in 118]"
"118","0.991301","100.86.243.187","151.101.1.140","TLSv1.2","119","Application Data"
"119","0.996297","151.101.1.140","100.86.243.187","TCP","66","443  >  56485 [ACK] Seq=18256 Ack=26308 Win=635 Len=0 TSval=1266340231 TSecr=2851394734"
"120","1.001584","151.101.1.140","100.86.243.187","TCP","66","443  >  56485 [ACK] Seq=18256 Ack=29257 Win=631 Len=0 TSval=1266340237 TSecr=2851394739"
"123","1.016216","151.101.1.140","100.86.243.187","TCP","1510","443  >  56485 [ACK] Seq=18256 Ack=29257 Win=639 Len=1444 TSval=1266340252 TSecr=2851394739 [TCP PDU reassembled in 127]"
"124","1.016248","151.101.1.140","100.86.243.187","TCP","1510","443  >  56485 [PSH, ACK] Seq=19700 Ack=29257 Win=639 Len=1444 TSval=1266340252 TSecr=2851394739 [TCP PDU reassembled in 127]"
"125","1.016308","100.86.243.187","151.101.1.140","TCP","66","56485  >  443 [ACK] Seq=29257 Ack=19700 Win=3903 Len=0 TSval=2851394764 TSecr=1266340252"
"126","1.016456","100.86.243.187","151.101.1.140","TCP","66","56485  >  443 [ACK] Seq=29257 Ack=21144 Win=3903 Len=0 TSval=2851394764 TSecr=1266340252"
"127","1.016845","151.101.1.140","100.86.243.187","TLSv1.2","435","Application Data"
"128","1.016910","100.86.243.187","151.101.1.140","TCP","66","56485  >  443 [ACK] Seq=29257 Ack=21513 Win=3920 Len=0 TSval=2851394764 TSecr=1266340252"
"129","1.027115","151.101.1.140","100.86.243.187","TCP","1510","443  >  56485 [ACK] Seq=21513 Ack=29257 Win=639 Len=1444 TSval=1266340263 TSecr=2851394764 [TCP PDU reassembled in 130]"
"130","1.027151","151.101.1.140","100.86.243.187","TLSv1.2","419","Application Data"
"131","1.027214","100.86.243.187","151.101.1.140","TCP","66","56485  >  443 [ACK] Seq=29257 Ack=22957 Win=3903 Len=0 TSval=2851394775 TSecr=1266340263"
"132","1.027280","100.86.243.187","151.101.1.140","TCP","66","56485  >  443 [ACK] Seq=29257 Ack=23310 Win=3897 Len=0 TSval=2851394775 TSecr=1266340263"
"133","1.028898","151.101.1.140","100.86.243.187","TCP","1510","443  >  56485 [ACK] Seq=23310 Ack=29257 Win=639 Len=1444 TSval=1266340265 TSecr=2851394764 [TCP PDU reassembled in 135]"
"134","1.028967","100.86.243.187","151.101.1.140","TCP","66","56485  >  443 [ACK] Seq=29257 Ack=24754 Win=3903 Len=0 TSval=2851394777 TSecr=1266340265"
"135","1.029411","151.101.1.140","100.86.243.187","TLSv1.2","948","Application Data"
"136","1.029411","151.101.1.140","100.86.243.187","TLSv1.2","112","Application Data"
"137","1.029472","100.86.243.187","151.101.1.140","TCP","66","56485  >  443 [ACK] Seq=29257 Ack=25682 Win=3911 Len=0 TSval=2851394777 TSecr=1266340265"
"214","1.814992","151.101.1.140","100.86.243.187","TLSv1.2","257","Application Data"
"215","1.815106","100.86.243.187","151.101.1.140","TCP","66","56485  >  443 [ACK] Seq=29257 Ack=25873 Win=3922 Len=0 TSval=2851395563 TSecr=1266341050"
"216","1.819796","151.101.1.140","100.86.243.187","TLSv1.2","185","Application Data"
"217","1.819883","100.86.243.187","151.101.1.140","TCP","66","56485  >  443 [ACK] Seq=29257 Ack=25992 Win=3924 Len=0 TSval=2851395567 TSecr=1266341055"
"218","1.820252","151.101.1.140","100.86.243.187","TCP","1510","443  >  56485 [ACK] Seq=25992 Ack=29257 Win=639 Len=1444 TSval=1266341055 TSecr=2851394777 [TCP PDU reassembled in 219]"
"219","1.820253","151.101.1.140","100.86.243.187","TLSv1.2","810","Application Data"
"220","1.820304","100.86.243.187","151.101.1.140","TCP","66","56485  >  443 [ACK] Seq=29257 Ack=28180 Win=3891 Len=0 TSval=2851395567 TSecr=1266341055"
"221","1.820530","151.101.1.140","100.86.243.187","TLSv1.2","524","Application Data"
"222","1.820579","100.86.243.187","151.101.1.140","TCP","66","56485  >  443 [ACK] Seq=29257 Ack=28638 Win=3918 Len=0 TSval=2851395567 TSecr=1266341056"
"223","1.821218","151.101.1.140","100.86.243.187","TLSv1.2","675","Application Data"
"224","1.821294","100.86.243.187","151.101.1.140","TCP","66","56485  >  443 [ACK] Seq=29257 Ack=29247 Win=3916 Len=0 TSval=2851395569 TSecr=1266341056"
"225","1.821862","151.101.1.140","100.86.243.187","TLSv1.2","1065","Application Data"
"226","1.821863","151.101.1.140","100.86.243.187","TLSv1.2","1167","Application Data"
"227","1.821931","100.86.243.187","151.101.1.140","TCP","66","56485  >  443 [ACK] Seq=29257 Ack=31347 Win=3893 Len=0 TSval=2851395569 TSecr=1266341057"
"228","1.822892","151.101.1.140","100.86.243.187","TLSv1.2","972","Application Data"
"229","1.822957","100.86.243.187","151.101.1.140","TCP","66","56485  >  443 [ACK] Seq=29257 Ack=32253 Win=3911 Len=0 TSval=2851395571 TSecr=1266341058"
"230","1.823664","151.101.1.140","100.86.243.187","TLSv1.2","978","Application Data"
"231","1.823664","151.101.1.140","100.86.243.187","TLSv1.2","529","Application Data, Application Data"
"232","1.823729","100.86.243.187","151.101.1.140","TCP","66","56485  >  443 [ACK] Seq=29257 Ack=33628 Win=3904 Len=0 TSval=2851395571 TSecr=1266341059"
"233","1.824656","151.101.1.140","100.86.243.187","TLSv1.2","1510","Application Data, Application Data, Application Data, Application Data"
"234","1.824731","100.86.243.187","151.101.1.140","TCP","66","56485  >  443 [ACK] Seq=29257 Ack=35072 Win=3903 Len=0 TSval=2851395572 TSecr=1266341060"
"235","1.825481","151.101.1.140","100.86.243.187","TLSv1.2","803","Application Data, Application Data, Application Data"
"236","1.825541","100.86.243.187","151.101.1.140","TCP","66","56485  >  443 [ACK] Seq=29257 Ack=35809 Win=3914 Len=0 TSval=2851395572 TSecr=1266341060"
"237","1.838299","151.101.1.140","100.86.243.187","TLSv1.2","185","Application Data"
"238","1.838404","100.86.243.187","151.101.1.140","TCP","66","56485  >  443 [ACK] Seq=29257 Ack=35928 Win=3924 Len=0 TSval=2851395586 TSecr=1266341074"
"239","1.840808","151.101.1.140","100.86.243.187","TLSv1.2","384","Application Data"
"240","1.840982","100.86.243.187","151.101.1.140","TCP","66","56485  >  443 [ACK] Seq=29257 Ack=36246 Win=3925 Len=0 TSval=2851395588 TSecr=1266341074"
"241","1.846137","151.101.1.140","100.86.243.187","TLSv1.2","597","Application Data"
"242","1.846138","151.101.1.140","100.86.243.187","TCP","1510","443  >  56485 [ACK] Seq=36777 Ack=29257 Win=639 Len=1444 TSval=1266341080 TSecr=2851395572 [TCP PDU reassembled in 244]"
"243","1.846314","100.86.243.187","151.101.1.140","TCP","66","56485  >  443 [ACK] Seq=29257 Ack=38221 Win=3925 Len=0 TSval=2851395594 TSecr=1266341080"
"244","1.848406","151.101.1.140","100.86.243.187","TLSv1.2","117","Application Data"
"245","1.848407","151.101.1.140","100.86.243.187","TCP","1510","443  >  56485 [ACK] Seq=38272 Ack=29257 Win=639 Len=1444 TSval=1266341080 TSecr=2851395572 [TCP PDU reassembled in 247]"
"246","1.848412","151.101.1.140","100.86.243.187","TCP","1510","443  >  56485 [PSH, ACK] Seq=39716 Ack=29257 Win=639 Len=1444 TSval=1266341080 TSecr=2851395572 [TCP PDU reassembled in 247]"
"247","1.848413","151.101.1.140","100.86.243.187","TLSv1.2","405","Application Data"
"248","1.848414","151.101.1.140","100.86.243.187","TLSv1.2","1039","Application Data"
"249","1.848415","151.101.1.140","100.86.243.187","TLSv1.2","240","Application Data"
"250","1.848608","100.86.243.187","151.101.1.140","TCP","66","56485  >  443 [ACK] Seq=29257 Ack=42646 Win=3925 Len=0 TSval=2851395596 TSecr=1266341084"
"251","1.848814","151.101.1.140","100.86.243.187","TLSv1.2","185","Application Data"
"252","1.848901","100.86.243.187","151.101.1.140","TCP","66","56485  >  443 [ACK] Seq=29257 Ack=42765 Win=3925 Len=0 TSval=2851395596 TSecr=1266341084"
"253","1.852255","151.101.1.140","100.86.243.187","TLSv1.2","189","Application Data"
"254","1.852399","100.86.243.187","151.101.1.140","TCP","66","56485  >  443 [ACK] Seq=29257 Ack=42888 Win=3925 Len=0 TSval=2851395600 TSecr=1266341088"
"255","1.855117","151.101.1.140","100.86.243.187","TLSv1.2","166","Application Data"
"256","1.855266","100.86.243.187","151.101.1.140","TCP","66","56485  >  443 [ACK] Seq=29257 Ack=42988 Win=3925 Len=0 TSval=2851395603 TSecr=1266341091"
"257","1.859828","151.101.1.140","100.86.243.187","TLSv1.2","236","Application Data"
"258","1.860140","100.86.243.187","151.101.1.140","TCP","66","56485  >  443 [ACK] Seq=29257 Ack=43158 Win=3925 Len=0 TSval=2851395607 TSecr=1266341095"
"259","1.866050","151.101.1.140","100.86.243.187","TLSv1.2","318","Application Data"
"260","1.866221","100.86.243.187","151.101.1.140","TCP","66","56485  >  443 [ACK] Seq=29257 Ack=43410 Win=3925 Len=0 TSval=2851395614 TSecr=1266341102"
"261","1.866311","151.101.1.140","100.86.243.187","TLSv1.2","450","Application Data"
"262","1.866380","100.86.243.187","151.101.1.140","TCP","66","56485  >  443 [ACK] Seq=29257 Ack=43794 Win=3925 Len=0 TSval=2851395614 TSecr=1266341102"
"263","1.867177","151.101.1.140","100.86.243.187","TLSv1.2","572","Application Data"
"264","1.867295","100.86.243.187","151.101.1.140","TCP","66","56485  >  443 [ACK] Seq=29257 Ack=44300 Win=3925 Len=0 TSval=2851395615 TSecr=1266341102"
"265","1.886996","151.101.1.140","100.86.243.187","TLSv1.2","187","Application Data"
"266","1.887126","100.86.243.187","151.101.1.140","TCP","66","56485  >  443 [ACK] Seq=29257 Ack=44421 Win=3925 Len=0 TSval=2851395635 TSecr=1266341122"
"267","1.888649","151.101.1.140","100.86.243.187","TLSv1.2","822","Application Data"
"268","1.888757","100.86.243.187","151.101.1.140","TCP","66","56485  >  443 [ACK] Seq=29257 Ack=45177 Win=3925 Len=0 TSval=2851395636 TSecr=1266341124"
"269","1.893888","151.101.1.140","100.86.243.187","TLSv1.2","404","Application Data"
"270","1.894006","100.86.243.187","151.101.1.140","TCP","66","56485  >  443 [ACK] Seq=29257 Ack=45515 Win=3925 Len=0 TSval=2851395642 TSecr=1266341129"
"271","1.894867","151.101.1.140","100.86.243.187","TLSv1.2","620","Application Data"
"272","1.894966","100.86.243.187","151.101.1.140","TCP","66","56485  >  443 [ACK] Seq=29257 Ack=46069 Win=3925 Len=0 TSval=2851395643 TSecr=1266341130"
"273","1.894998","151.101.1.140","100.86.243.187","TLSv1.2","231","Application Data"
"274","1.895153","100.86.243.187","151.101.1.140","TCP","66","56485  >  443 [ACK] Seq=29257 Ack=46234 Win=3925 Len=0 TSval=2851395643 TSecr=1266341131"
"275","1.895996","151.101.1.140","100.86.243.187","TCP","1510","443  >  56485 [ACK] Seq=46234 Ack=29257 Win=639 Len=1444 TSval=1266341131 TSecr=2851395615 [TCP PDU reassembled in 276]"
"276","1.896827","151.101.1.140","100.86.243.187","TLSv1.2","182","Application Data"
"277","1.896827","151.101.1.140","100.86.243.187","TLSv1.2","519","Application Data"
"278","1.896828","151.101.1.140","100.86.243.187","TLSv1.2","1074","Application Data"
"279","1.896980","100.86.243.187","151.101.1.140","TCP","66","56485  >  443 [ACK] Seq=29257 Ack=49255 Win=3925 Len=0 TSval=2851395644 TSecr=1266341131"
"280","1.897524","151.101.1.140","100.86.243.187","TLSv1.2","652","Application Data"
"281","1.897612","100.86.243.187","151.101.1.140","TCP","66","56485  >  443 [ACK] Seq=29257 Ack=49841 Win=3925 Len=0 TSval=2851395645 TSecr=1266341133"
"282","1.898076","151.101.1.140","100.86.243.187","TLSv1.2","459","Application Data"
"283","1.898164","100.86.243.187","151.101.1.140","TCP","66","56485  >  443 [ACK] Seq=29257 Ack=50234 Win=3925 Len=0 TSval=2851395645 TSecr=1266341133"
"284","1.898669","151.101.1.140","100.86.243.187","TCP","1510","443  >  56485 [ACK] Seq=50234 Ack=29257 Win=639 Len=1444 TSval=1266341134 TSecr=2851395636 [TCP PDU reassembled in 285]"
"285","1.898670","151.101.1.140","100.86.243.187","TLSv1.2","75","Application Data"
"286","1.898760","100.86.243.187","151.101.1.140","TCP","66","56485  >  443 [ACK] Seq=29257 Ack=51687 Win=3925 Len=0 TSval=2851395646 TSecr=1266341134"
"287","1.909695","151.101.1.140","100.86.243.187","TLSv1.2","241","Application Data"
"288","1.909718","151.101.1.140","100.86.243.187","TLSv1.2","1382","Application Data"
"289","1.909907","100.86.243.187","151.101.1.140","TCP","66","56485  >  443 [ACK] Seq=29257 Ack=53178 Win=3925 Len=0 TSval=2851395657 TSecr=1266341145"
"290","1.910787","151.101.1.140","100.86.243.187","TLSv1.2","496","Application Data"
"291","1.910788","151.101.1.140","100.86.243.187","TLSv1.2","232","Application Data"
"292","1.910789","151.101.1.140","100.86.243.187","TLSv1.2","786","Application Data"
"293","1.910969","100.86.243.187","151.101.1.140","TCP","66","56485  >  443 [ACK] Seq=29257 Ack=54494 Win=3925 Len=0 TSval=2851395658 TSecr=1266341146"
"294","1.911039","151.101.1.140","100.86.243.187","TLSv1.2","618","Application Data"
"295","1.911040","151.101.1.140","100.86.243.187","TLSv1.2","296","Application Data"
"296","1.911132","100.86.243.187","151.101.1.140","TCP","66","56485  >  443 [ACK] Seq=29257 Ack=55276 Win=3925 Len=0 TSval=2851395658 TSecr=1266341147"
"297","1.911962","151.101.1.140","100.86.243.187","TLSv1.2","292","Application Data"
"298","1.912069","100.86.243.187","151.101.1.140","TCP","66","56485  >  443 [ACK] Seq=29257 Ack=55502 Win=3925 Len=0 TSval=2851395660 TSecr=1266341147"
"299","1.912873","151.101.1.140","100.86.243.187","TLSv1.2","1379","Application Data"
"300","1.912874","151.101.1.140","100.86.243.187","TLSv1.2","1036","Application Data"
"301","1.912875","151.101.1.140","100.86.243.187","TLSv1.2","584","Application Data"
"302","1.912875","151.101.1.140","100.86.243.187","TCP","1510","443  >  56485 [ACK] Seq=58303 Ack=29257 Win=639 Len=1444 TSval=1266341148 TSecr=2851395646 [TCP PDU reassembled in 304]"
"303","1.913049","100.86.243.187","151.101.1.140","TCP","66","56485  >  443 [ACK] Seq=29257 Ack=59747 Win=3925 Len=0 TSval=2851395661 TSecr=1266341148"
"304","1.913232","151.101.1.140","100.86.243.187","TLSv1.2","139","Application Data"
"305","1.913316","100.86.243.187","151.101.1.140","TCP","66","56485  >  443 [ACK] Seq=29257 Ack=59820 Win=3925 Len=0 TSval=2851395661 TSecr=1266341148"
"306","1.925558","151.101.1.140","100.86.243.187","TLSv1.2","191","Application Data"
"307","1.925691","100.86.243.187","151.101.1.140","TCP","66","56485  >  443 [ACK] Seq=29257 Ack=59945 Win=3925 Len=0 TSval=2851395673 TSecr=1266341161"
"308","1.926292","151.101.1.140","100.86.243.187","TLSv1.2","255","Application Data"
"309","1.926390","100.86.243.187","151.101.1.140","TCP","66","56485  >  443 [ACK] Seq=29257 Ack=60134 Win=3925 Len=0 TSval=2851395673 TSecr=1266341161"
"310","1.932433","151.101.1.140","100.86.243.187","TLSv1.2","165","Application Data"
"311","1.932564","100.86.243.187","151.101.1.140","TCP","66","56485  >  443 [ACK] Seq=29257 Ack=60233 Win=3925 Len=0 TSval=2851395680 TSecr=1266341166"
"312","1.932583","151.101.1.140","100.86.243.187","TLSv1.2","900","Application Data"
"313","1.932584","151.101.1.140","100.86.243.187","TLSv1.2","516","Application Data"
"314","1.932585","151.101.1.140","100.86.243.187","TLSv1.2","356","Application Data"
"315","1.932585","151.101.1.140","100.86.243.187","TLSv1.2","550","Application Data"
"316","1.932768","100.86.243.187","151.101.1.140","TCP","66","56485  >  443 [ACK] Seq=29257 Ack=62291 Win=3925 Len=0 TSval=2851395680 TSecr=1266341168"
"317","1.933434","151.101.1.140","100.86.243.187","TLSv1.2","381","Application Data"
"318","1.933434","151.101.1.140","100.86.243.187","TLSv1.2","340","Application Data"
"319","1.933582","100.86.243.187","151.101.1.140","TCP","66","56485  >  443 [ACK] Seq=29257 Ack=62880 Win=3925 Len=0 TSval=2851395681 TSecr=1266341169"
"320","1.933701","151.101.1.140","100.86.243.187","TLSv1.2","241","Application Data"
"321","1.933702","151.101.1.140","100.86.243.187","TLSv1.2","731","Application Data"
"322","1.933702","151.101.1.140","100.86.243.187","TLSv1.2","303","Application Data"
"323","1.933703","151.101.1.140","100.86.243.187","TLSv1.2","334","Application Data"
"324","1.933831","100.86.243.187","151.101.1.140","TCP","66","56485  >  443 [ACK] Seq=29257 Ack=64225 Win=3925 Len=0 TSval=2851395681 TSecr=1266341169"
"325","1.934628","151.101.1.140","100.86.243.187","TLSv1.2","280","Application Data"
"326","1.934727","100.86.243.187","151.101.1.140","TCP","66","56485  >  443 [ACK] Seq=29257 Ack=64439 Win=3925 Len=0 TSval=2851395682 TSecr=1266341169"
"327","1.934975","151.101.1.140","100.86.243.187","TLSv1.2","1510","Application Data, Application Data"
"328","1.936229","151.101.1.140","100.86.243.187","TLSv1.2","1027","Application Data, Application Data, Application Data"
"329","1.936426","100.86.243.187","151.101.1.140","TCP","66","56485  >  443 [ACK] Seq=29257 Ack=66844 Win=3925 Len=0 TSval=2851395684 TSecr=1266341171"
"330","1.942684","151.101.1.140","100.86.243.187","TLSv1.2","1510","Application Data, Application Data, Application Data, Application Data"
"331","1.943067","151.101.1.140","100.86.243.187","TLSv1.2","1510","Application Data"
"332","1.943200","100.86.243.187","151.101.1.140","TCP","66","56485  >  443 [ACK] Seq=29257 Ack=69732 Win=3925 Len=0 TSval=2851395690 TSecr=1266341178"
"333","1.943339","151.101.1.140","100.86.243.187","TLSv1.2","1161","Application Data, Application Data, Application Data"
"334","1.943443","100.86.243.187","151.101.1.140","TCP","66","56485  >  443 [ACK] Seq=29257 Ack=70827 Win=3925 Len=0 TSval=2851395690 TSecr=1266341179"
"335","1.943753","151.101.1.140","100.86.243.187","TLSv1.2","1058","Application Data, Application Data, Application Data, Application Data, Application Data"
"336","1.943878","100.86.243.187","151.101.1.140","TCP","66","56485  >  443 [ACK] Seq=29257 Ack=71819 Win=3925 Len=0 TSval=2851395691 TSecr=1266341179"
"337","1.945227","151.101.1.140","100.86.243.187","TLSv1.2","198","Application Data"
"338","1.945227","151.101.1.140","100.86.243.187","TLSv1.2","817","Application Data"
"339","1.945375","100.86.243.187","151.101.1.140","TCP","66","56485  >  443 [ACK] Seq=29257 Ack=72702 Win=3925 Len=0 TSval=2851395693 TSecr=1266341179"
"351","3.008514","100.86.243.187","151.101.1.140","TCP","1514","56485  >  443 [ACK] Seq=29257 Ack=72702 Win=3925 Len=1448 TSval=2851396756 TSecr=1266341179 [TCP PDU reassembled in 353]"
"352","3.008516","100.86.243.187","151.101.1.140","TCP","1514","56485  >  443 [ACK] Seq=30705 Ack=72702 Win=3925 Len=1448 TSval=2851396756 TSecr=1266341179 [TCP PDU reassembled in 353]"
"353","3.008557","100.86.243.187","151.101.1.140","TLSv1.2","180","Application Data"
"354","3.008676","100.86.243.187","151.101.1.140","TCP","1514","56485  >  443 [ACK] Seq=32267 Ack=72702 Win=3925 Len=1448 TSval=2851396756 TSecr=1266341179 [TCP PDU reassembled in 357]"
"355","3.008678","100.86.243.187","151.101.1.140","TCP","1514","56485  >  443 [ACK] Seq=33715 Ack=72702 Win=3925 Len=1448 TSval=2851396756 TSecr=1266341179 [TCP PDU reassembled in 357]"
"356","3.008679","100.86.243.187","151.101.1.140","TCP","1514","56485  >  443 [ACK] Seq=35163 Ack=72702 Win=3925 Len=1448 TSval=2851396756 TSecr=1266341179 [TCP PDU reassembled in 357]"
"357","3.008702","100.86.243.187","151.101.1.140","TLSv1.2","1182","Application Data"
"358","3.022448","151.101.1.140","100.86.243.187","TCP","66","443  >  56485 [ACK] Seq=72702 Ack=37727 Win=625 Len=0 TSval=1266342258 TSecr=2851396756"
"361","3.037446","100.86.243.187","151.101.1.140","TLSv1.2","170","Application Data"
"364","3.040834","100.86.243.187","151.101.1.140","TLSv1.2","236","Application Data"
"365","3.041066","100.86.243.187","151.101.1.140","TLSv1.2","146","Application Data"
"368","3.046989","151.101.1.140","100.86.243.187","TCP","66","443  >  56520 [ACK] Seq=1 Ack=105 Win=296 Len=0 TSval=2144957580 TSecr=2085429491"
"370","3.048868","151.101.1.140","100.86.243.187","TLSv1.2","646","Application Data"
"371","3.048869","151.101.1.140","100.86.243.187","TCP","1510","443  >  56520 [ACK] Seq=581 Ack=105 Win=296 Len=1444 TSval=2144957581 TSecr=2085429491 [TCP PDU reassembled in 373]"
"372","3.048920","151.101.1.140","100.86.243.187","TCP","1510","443  >  56520 [ACK] Seq=2025 Ack=105 Win=296 Len=1444 TSval=2144957581 TSecr=2085429491 [TCP PDU reassembled in 373]"
"373","3.048927","151.101.1.140","100.86.243.187","TLSv1.2","1254","Application Data"
"374","3.048971","100.86.243.187","151.101.1.140","TCP","66","56520  >  443 [ACK] Seq=105 Ack=2025 Win=2853 Len=0 TSval=2085429503 TSecr=2144957581"
"375","3.049018","100.86.243.187","151.101.1.140","TCP","66","56520  >  443 [ACK] Seq=105 Ack=4657 Win=2812 Len=0 TSval=2085429503 TSecr=2144957581"
"376","3.049319","100.86.243.187","151.101.1.140","TCP","66","[TCP Window Update] 56520  >  443 [ACK] Seq=105 Ack=4657 Win=2885 Len=0 TSval=2085429504 TSecr=2144957581"
"378","3.051803","151.101.1.140","100.86.243.187","TCP","66","443  >  56509 [ACK] Seq=1 Ack=251 Win=424 Len=0 TSval=3914603015 TSecr=514303537"
"379","3.054008","151.101.1.140","100.86.243.187","TCP","1510","443  >  56509 [ACK] Seq=1 Ack=251 Win=424 Len=1444 TSval=3914603017 TSecr=514303537 [TCP PDU reassembled in 425]"
"380","3.054090","100.86.243.187","151.101.1.140","TCP","66","56509  >  443 [ACK] Seq=251 Ack=1445 Win=7002 Len=0 TSval=514303551 TSecr=3914603017"
"381","3.054555","151.101.1.140","100.86.243.187","TCP","1510","443  >  56509 [PSH, ACK] Seq=1445 Ack=251 Win=424 Len=1444 TSval=3914603017 TSecr=514303537 [TCP PDU reassembled in 425]"
"382","3.054616","100.86.243.187","151.101.1.140","TCP","66","56509  >  443 [ACK] Seq=251 Ack=2889 Win=7002 Len=0 TSval=514303551 TSecr=3914603017"
"389","3.055448","151.101.1.140","100.86.243.187","TCP","1510","443  >  56509 [ACK] Seq=2889 Ack=251 Win=424 Len=1444 TSval=3914603018 TSecr=514303537 [TCP PDU reassembled in 425]"
"390","3.055449","151.101.1.140","100.86.243.187","TCP","1510","443  >  56509 [PSH, ACK] Seq=4333 Ack=251 Win=424 Len=1444 TSval=3914603018 TSecr=514303537 [TCP PDU reassembled in 425]"
"391","3.055510","100.86.243.187","151.101.1.140","TCP","66","56509  >  443 [ACK] Seq=251 Ack=5777 Win=6980 Len=0 TSval=514303552 TSecr=3914603018"
"394","3.057961","151.101.1.140","100.86.243.187","TCP","1510","443  >  56509 [ACK] Seq=5777 Ack=251 Win=424 Len=1444 TSval=3914603020 TSecr=514303537 [TCP PDU reassembled in 425]"
"395","3.057975","151.101.1.140","100.86.243.187","TCP","1510","443  >  56509 [PSH, ACK] Seq=7221 Ack=251 Win=424 Len=1444 TSval=3914603020 TSecr=514303537 [TCP PDU reassembled in 425]"
"396","3.058062","100.86.243.187","151.101.1.140","TCP","66","56509  >  443 [ACK] Seq=251 Ack=8665 Win=6980 Len=0 TSval=514303554 TSecr=3914603020"
"401","3.061254","151.101.1.140","100.86.243.187","TCP","1510","443  >  56509 [ACK] Seq=8665 Ack=251 Win=424 Len=1444 TSval=3914603022 TSecr=514303537 [TCP PDU reassembled in 425]"
"402","3.061255","151.101.1.140","100.86.243.187","TCP","1510","443  >  56509 [PSH, ACK] Seq=10109 Ack=251 Win=424 Len=1444 TSval=3914603022 TSecr=514303537 [TCP PDU reassembled in 425]"
"406","3.061349","100.86.243.187","151.101.1.140","TCP","66","56509  >  443 [ACK] Seq=251 Ack=11553 Win=6980 Len=0 TSval=514303558 TSecr=3914603022"
"416","3.064446","100.86.243.187","151.101.1.140","TLSv1.2","163","Application Data"
"417","3.064706","100.86.243.187","151.101.1.140","TLSv1.2","164","Application Data"
"419","3.065155","100.86.243.187","151.101.1.140","TLSv1.2","163","Application Data"
"420","3.065798","151.101.1.140","100.86.243.187","TCP","1510","443  >  56509 [ACK] Seq=11553 Ack=251 Win=424 Len=1444 TSval=3914603028 TSecr=514303551 [TCP PDU reassembled in 425]"
"421","3.065867","100.86.243.187","151.101.1.140","TCP","66","56509  >  443 [ACK] Seq=543 Ack=12997 Win=7002 Len=0 TSval=514303562 TSecr=3914603028"
"424","3.068344","151.101.1.140","100.86.243.187","TCP","1510","443  >  56509 [ACK] Seq=12997 Ack=251 Win=424 Len=1444 TSval=3914603029 TSecr=514303552 [TCP PDU reassembled in 425]"
"425","3.068344","151.101.1.140","100.86.243.187","TLSv1.2","1510","Application Data"
"430","3.068454","100.86.243.187","151.101.1.140","TCP","66","56509  >  443 [ACK] Seq=543 Ack=15885 Win=6980 Len=0 TSval=514303565 TSecr=3914603029"
"432","3.068724","151.101.1.140","100.86.243.187","TCP","1510","443  >  56509 [ACK] Seq=15885 Ack=251 Win=424 Len=1444 TSval=3914603031 TSecr=514303554 [TCP PDU reassembled in 491]"
"433","3.068725","151.101.1.140","100.86.243.187","TCP","1510","443  >  56509 [PSH, ACK] Seq=17329 Ack=251 Win=424 Len=1444 TSval=3914603031 TSecr=514303554 [TCP PDU reassembled in 491]"
"434","3.068780","100.86.243.187","151.101.1.140","TCP","66","56509  >  443 [ACK] Seq=543 Ack=18773 Win=6976 Len=0 TSval=514303565 TSecr=3914603031"
"435","3.068803","100.86.243.187","151.101.1.140","TCP","66","[TCP Window Update] 56509  >  443 [ACK] Seq=543 Ack=18773 Win=7025 Len=0 TSval=514303565 TSecr=3914603031"
"437","3.071800","151.101.1.140","100.86.243.187","TCP","1510","443  >  56509 [ACK] Seq=18773 Ack=251 Win=424 Len=1444 TSval=3914603034 TSecr=514303558 [TCP PDU reassembled in 491]"
"438","3.071801","151.101.1.140","100.86.243.187","TCP","1510","443  >  56509 [PSH, ACK] Seq=20217 Ack=251 Win=424 Len=1444 TSval=3914603034 TSecr=514303558 [TCP PDU reassembled in 491]"
"439","3.071913","100.86.243.187","151.101.1.140","TCP","66","56509  >  443 [ACK] Seq=543 Ack=21661 Win=6980 Len=0 TSval=514303568 TSecr=3914603034"
"449","3.074373","151.101.1.140","100.86.243.187","TCP","1510","443  >  56509 [ACK] Seq=21661 Ack=348 Win=424 Len=1444 TSval=3914603038 TSecr=514303560 [TCP PDU reassembled in 491]"
"450","3.074477","100.86.243.187","151.101.1.140","TCP","66","56509  >  443 [ACK] Seq=543 Ack=23105 Win=7002 Len=0 TSval=514303571 TSecr=3914603038"
"455","3.075058","151.101.1.140","100.86.243.187","TCP","66","443  >  56509 [ACK] Seq=23105 Ack=543 Win=424 Len=0 TSval=3914603038 TSecr=514303562"
"459","3.076979","151.101.1.140","100.86.243.187","TCP","1510","443  >  56485 [ACK] Seq=72702 Ack=37727 Win=639 Len=1444 TSval=1266342312 TSecr=2851396756 [TCP PDU reassembled in 460]"
"460","3.076979","151.101.1.140","100.86.243.187","TLSv1.2","313","Application Data"
"461","3.077050","100.86.243.187","151.101.1.140","TCP","66","56485  >  443 [ACK] Seq=37727 Ack=74393 Win=3899 Len=0 TSval=2851396824 TSecr=1266342312"
"462","3.078216","151.101.1.140","100.86.243.187","TCP","1510","443  >  56509 [ACK] Seq=23105 Ack=543 Win=424 Len=1444 TSval=3914603041 TSecr=514303565 [TCP PDU reassembled in 491]"
"463","3.078316","100.86.243.187","151.101.1.140","TCP","66","56509  >  443 [ACK] Seq=543 Ack=24549 Win=7002 Len=0 TSval=514303575 TSecr=3914603041"
"464","3.078393","151.101.1.140","100.86.243.187","TCP","1510","443  >  56509 [PSH, ACK] Seq=24549 Ack=543 Win=424 Len=1444 TSval=3914603041 TSecr=514303565 [TCP PDU reassembled in 491]"
"466","3.078455","100.86.243.187","151.101.1.140","TCP","66","56509  >  443 [ACK] Seq=543 Ack=25993 Win=7002 Len=0 TSval=514303575 TSecr=3914603041"
"473","3.080912","151.101.1.140","100.86.243.187","TCP","1510","443  >  56509 [ACK] Seq=25993 Ack=543 Win=424 Len=1444 TSval=3914603042 TSecr=514303565 [TCP PDU reassembled in 491]"
"474","3.080913","151.101.1.140","100.86.243.187","TCP","1510","443  >  56509 [PSH, ACK] Seq=27437 Ack=543 Win=424 Len=1444 TSval=3914603042 TSecr=514303565 [TCP PDU reassembled in 491]"
"477","3.081016","100.86.243.187","151.101.1.140","TCP","66","56509  >  443 [ACK] Seq=543 Ack=28881 Win=6980 Len=0 TSval=514303577 TSecr=3914603042"
"480","3.082680","151.101.1.140","100.86.243.187","TCP","1510","443  >  56509 [ACK] Seq=28881 Ack=543 Win=424 Len=1444 TSval=3914603045 TSecr=514303568 [TCP PDU reassembled in 491]"
"481","3.082681","151.101.1.140","100.86.243.187","TCP","1510","443  >  56509 [PSH, ACK] Seq=30325 Ack=543 Win=424 Len=1444 TSval=3914603045 TSecr=514303568 [TCP PDU reassembled in 491]"
"483","3.082770","100.86.243.187","151.101.1.140","TCP","66","56509  >  443 [ACK] Seq=543 Ack=31769 Win=6980 Len=0 TSval=514303579 TSecr=3914603045"
"491","3.084274","151.101.1.140","100.86.243.187","TLSv1.2","1510","Application Data"
"492","3.084275","151.101.1.140","100.86.243.187","TCP","1510","443  >  56509 [PSH, ACK] Seq=33213 Ack=543 Win=424 Len=1444 TSval=3914603047 TSecr=514303571 [TCP PDU reassembled in 520]"
"493","3.084344","100.86.243.187","151.101.1.140","TCP","66","56509  >  443 [ACK] Seq=543 Ack=34657 Win=6980 Len=0 TSval=514303580 TSecr=3914603047"
"496","3.088206","151.101.1.140","100.86.243.187","TCP","1510","443  >  56509 [ACK] Seq=34657 Ack=543 Win=424 Len=1444 TSval=3914603051 TSecr=514303575 [TCP PDU reassembled in 520]"
"497","3.088309","100.86.243.187","151.101.1.140","TCP","66","56509  >  443 [ACK] Seq=543 Ack=36101 Win=7002 Len=0 TSval=514303585 TSecr=3914603051"
"498","3.088869","151.101.1.140","100.86.243.187","TCP","1510","443  >  56509 [PSH, ACK] Seq=36101 Ack=543 Win=424 Len=1444 TSval=3914603051 TSecr=514303575 [TCP PDU reassembled in 520]"
"501","3.088999","100.86.243.187","151.101.1.140","TCP","66","56509  >  443 [ACK] Seq=543 Ack=37545 Win=7025 Len=0 TSval=514303585 TSecr=3914603051"
"502","3.091085","151.101.1.140","100.86.243.187","TCP","1510","443  >  56509 [ACK] Seq=37545 Ack=543 Win=424 Len=1444 TSval=3914603054 TSecr=514303577 [TCP PDU reassembled in 520]"
"505","3.092948","151.101.1.140","100.86.243.187","TCP","1510","[TCP Previous segment not captured] 443  >  56509 [ACK] Seq=40433 Ack=543 Win=424 Len=1444 TSval=3914603056 TSecr=514303579 [TCP PDU reassembled in 520]"
"506","3.093031","100.86.243.187","151.101.1.140","TCP","78","56509  >  443 [ACK] Seq=543 Ack=38989 Win=7025 Len=0 TSval=514303590 TSecr=3914603054 SLE=40433 SRE=41877"
"507","3.093304","151.101.1.140","100.86.243.187","TCP","1510","443  >  56509 [PSH, ACK] Seq=41877 Ack=543 Win=424 Len=1444 TSval=3914603056 TSecr=514303579 [TCP PDU reassembled in 520]"
"508","3.093372","100.86.243.187","151.101.1.140","TCP","78","[TCP Dup ACK 506#1] 56509  >  443 [ACK] Seq=543 Ack=38989 Win=7025 Len=0 TSval=514303590 TSecr=3914603054 SLE=40433 SRE=43321"
"509","3.094321","151.101.1.140","100.86.243.187","TCP","1510","443  >  56509 [ACK] Seq=43321 Ack=543 Win=424 Len=1444 TSval=3914603058 TSecr=514303580 [TCP PDU reassembled in 520]"
"510","3.094398","100.86.243.187","151.101.1.140","TCP","78","[TCP Dup ACK 506#2] 56509  >  443 [ACK] Seq=543 Ack=38989 Win=7025 Len=0 TSval=514303591 TSecr=3914603054 SLE=40433 SRE=44765"
"511","3.095249","151.101.1.140","100.86.243.187","TCP","1510","443  >  56509 [PSH, ACK] Seq=44765 Ack=543 Win=424 Len=1444 TSval=3914603058 TSecr=514303580 [TCP PDU reassembled in 520]"
"512","3.095342","100.86.243.187","151.101.1.140","TCP","78","[TCP Dup ACK 506#3] 56509  >  443 [ACK] Seq=543 Ack=38989 Win=7025 Len=0 TSval=514303591 TSecr=3914603054 SLE=40433 SRE=46209"
"513","3.099194","151.101.1.140","100.86.243.187","TCP","1510","443  >  56509 [ACK] Seq=46209 Ack=543 Win=424 Len=1444 TSval=3914603061 TSecr=514303585 [TCP PDU reassembled in 520]"
"514","3.099195","151.101.1.140","100.86.243.187","TCP","1510","443  >  56509 [PSH, ACK] Seq=47653 Ack=543 Win=424 Len=1444 TSval=3914603061 TSecr=514303585 [TCP PDU reassembled in 520]"
"515","3.099280","100.86.243.187","151.101.1.140","TCP","78","[TCP Dup ACK 506#4] 56509  >  443 [ACK] Seq=543 Ack=38989 Win=7025 Len=0 TSval=514303596 TSecr=3914603054 SLE=40433 SRE=49097"
"516","3.102803","151.101.1.140","100.86.243.187","TCP","1510","443  >  56509 [ACK] Seq=49097 Ack=543 Win=424 Len=1444 TSval=3914603066 TSecr=514303590 [TCP PDU reassembled in 542]"
"517","3.102837","151.101.1.140","100.86.243.187","TCP","1510","443  >  56509 [PSH, ACK] Seq=50541 Ack=543 Win=424 Len=1444 TSval=3914603066 TSecr=514303590 [TCP PDU reassembled in 542]"
"518","3.102907","100.86.243.187","151.101.1.140","TCP","78","[TCP Dup ACK 506#5] 56509  >  443 [ACK] Seq=543 Ack=38989 Win=7025 Len=0 TSval=514303599 TSecr=3914603054 SLE=40433 SRE=50541"
"519","3.102970","100.86.243.187","151.101.1.140","TCP","78","[TCP Dup ACK 506#6] 56509  >  443 [ACK] Seq=543 Ack=38989 Win=7025 Len=0 TSval=514303599 TSecr=3914603054 SLE=40433 SRE=51985"
"520","3.103332","151.101.1.140","100.86.243.187","TLSv1.2","1510","[TCP Fast Retransmission] , Application Data"
"521","3.103412","100.86.243.187","151.101.1.140","TCP","66","56509  >  443 [ACK] Seq=543 Ack=51985 Win=6822 Len=0 TSval=514303599 TSecr=3914603067"
"522","3.103600","100.86.243.187","151.101.1.140","TCP","66","[TCP Window Update] 56509  >  443 [ACK] Seq=543 Ack=51985 Win=7025 Len=0 TSval=514303599 TSecr=3914603067"
"523","3.104321","151.101.1.140","100.86.243.187","TCP","1510","443  >  56509 [ACK] Seq=51985 Ack=543 Win=424 Len=1444 TSval=3914603068 TSecr=514303591 [TCP PDU reassembled in 542]"
"524","3.104392","100.86.243.187","151.101.1.140","TCP","66","56509  >  443 [ACK] Seq=543 Ack=53429 Win=7002 Len=0 TSval=514303601 TSecr=3914603068"
"525","3.108953","151.101.1.140","100.86.243.187","TCP","1510","443  >  56509 [ACK] Seq=53429 Ack=543 Win=424 Len=1444 TSval=3914603072 TSecr=514303596 [TCP PDU reassembled in 542]"
"526","3.108980","151.101.1.140","100.86.243.187","TCP","1510","443  >  56509 [PSH, ACK] Seq=54873 Ack=543 Win=424 Len=1444 TSval=3914603072 TSecr=514303596 [TCP PDU reassembled in 542]"
"527","3.109040","100.86.243.187","151.101.1.140","TCP","66","56509  >  443 [ACK] Seq=543 Ack=54873 Win=7002 Len=0 TSval=514303606 TSecr=3914603072"
"528","3.109125","100.86.243.187","151.101.1.140","TCP","66","56509  >  443 [ACK] Seq=543 Ack=56317 Win=6980 Len=0 TSval=514303606 TSecr=3914603072"
"529","3.110081","100.86.243.187","151.101.1.140","TLSv1.2","101","Application Data"
"530","3.110269","100.86.243.187","151.101.1.140","TLSv1.2","101","Application Data"
"531","3.110288","100.86.243.187","151.101.1.140","TLSv1.2","101","Application Data"
"532","3.110334","100.86.243.187","151.101.1.140","TLSv1.2","101","Application Data"
"533","3.112019","151.101.1.140","100.86.243.187","TCP","1510","443  >  56509 [ACK] Seq=56317 Ack=543 Win=424 Len=1444 TSval=3914603075 TSecr=514303599 [TCP PDU reassembled in 542]"
"534","3.112104","100.86.243.187","151.101.1.140","TCP","66","56509  >  443 [ACK] Seq=683 Ack=57761 Win=7002 Len=0 TSval=514303609 TSecr=3914603075"
"535","3.112901","151.101.1.140","100.86.243.187","TCP","1510","443  >  56509 [ACK] Seq=57761 Ack=543 Win=424 Len=1444 TSval=3914603076 TSecr=514303599 [TCP PDU reassembled in 542]"
"536","3.112962","100.86.243.187","151.101.1.140","TCP","66","56509  >  443 [ACK] Seq=683 Ack=59205 Win=7002 Len=0 TSval=514303609 TSecr=3914603076"
"537","3.113676","151.101.1.140","100.86.243.187","TCP","1510","443  >  56509 [ACK] Seq=59205 Ack=543 Win=424 Len=1444 TSval=3914603077 TSecr=514303601 [TCP PDU reassembled in 542]"
"538","3.113724","100.86.243.187","151.101.1.140","TCP","66","56509  >  443 [ACK] Seq=683 Ack=60649 Win=7002 Len=0 TSval=514303610 TSecr=3914603077"
"539","3.113935","151.101.1.140","100.86.243.187","TCP","1510","443  >  56509 [PSH, ACK] Seq=60649 Ack=543 Win=424 Len=1444 TSval=3914603077 TSecr=514303601 [TCP PDU reassembled in 542]"
"540","3.113986","100.86.243.187","151.101.1.140","TCP","66","56509  >  443 [ACK] Seq=683 Ack=62093 Win=7002 Len=0 TSval=514303610 TSecr=3914603077"
"541","3.119097","151.101.1.140","100.86.243.187","TCP","1510","443  >  56509 [ACK] Seq=62093 Ack=543 Win=424 Len=1444 TSval=3914603082 TSecr=514303606 [TCP PDU reassembled in 542]"
"542","3.119098","151.101.1.140","100.86.243.187","TLSv1.2","1510","Application Data"
"543","3.119190","100.86.243.187","151.101.1.140","TCP","66","56509  >  443 [ACK] Seq=683 Ack=64981 Win=6980 Len=0 TSval=514303616 TSecr=3914603082"
"544","3.120002","151.101.1.140","100.86.243.187","TCP","66","443  >  56509 [ACK] Seq=64981 Ack=578 Win=424 Len=0 TSval=3914603083 TSecr=514303607"
"545","3.120945","151.101.1.140","100.86.243.187","TCP","66","443  >  56509 [ACK] Seq=64981 Ack=683 Win=424 Len=0 TSval=3914603084 TSecr=514303607"
"546","3.123022","151.101.1.140","100.86.243.187","TCP","1510","443  >  56509 [ACK] Seq=64981 Ack=683 Win=424 Len=1444 TSval=3914603086 TSecr=514303609 [TCP PDU reassembled in 566]"
"547","3.123057","151.101.1.140","100.86.243.187","TCP","1510","443  >  56509 [PSH, ACK] Seq=66425 Ack=683 Win=424 Len=1444 TSval=3914603086 TSecr=514303609 [TCP PDU reassembled in 566]"
"548","3.123122","100.86.243.187","151.101.1.140","TCP","66","56509  >  443 [ACK] Seq=683 Ack=66425 Win=7002 Len=0 TSval=514303620 TSecr=3914603086"
"549","3.123185","100.86.243.187","151.101.1.140","TCP","66","56509  >  443 [ACK] Seq=683 Ack=67869 Win=6980 Len=0 TSval=514303620 TSecr=3914603086"
"550","3.124050","151.101.1.140","100.86.243.187","TCP","1510","443  >  56509 [ACK] Seq=67869 Ack=683 Win=424 Len=1444 TSval=3914603087 TSecr=514303610 [TCP PDU reassembled in 566]"
"551","3.124133","100.86.243.187","151.101.1.140","TCP","66","56509  >  443 [ACK] Seq=683 Ack=69313 Win=7002 Len=0 TSval=514303621 TSecr=3914603087"
"552","3.124497","151.101.1.140","100.86.243.187","TCP","1510","443  >  56509 [PSH, ACK] Seq=69313 Ack=683 Win=424 Len=1444 TSval=3914603087 TSecr=514303610 [TCP PDU reassembled in 566]"
"553","3.124572","100.86.243.187","151.101.1.140","TCP","66","56509  >  443 [ACK] Seq=683 Ack=70757 Win=7002 Len=0 TSval=514303621 TSecr=3914603087"
"554","3.126236","151.101.1.140","100.86.243.187","TCP","1510","443  >  56509 [ACK] Seq=70757 Ack=683 Win=424 Len=1444 TSval=3914603090 TSecr=514303610 [TCP PDU reassembled in 566]"
"555","3.126323","100.86.243.187","151.101.1.140","TCP","66","56509  >  443 [ACK] Seq=683 Ack=72201 Win=7002 Len=0 TSval=514303623 TSecr=3914603090"
"556","3.128684","151.101.1.140","100.86.243.187","TCP","1510","443  >  56509 [ACK] Seq=72201 Ack=683 Win=424 Len=1444 TSval=3914603092 TSecr=514303616 [TCP PDU reassembled in 566]"
"557","3.128769","100.86.243.187","151.101.1.140","TCP","66","56509  >  443 [ACK] Seq=683 Ack=73645 Win=7002 Len=0 TSval=514303625 TSecr=3914603092"
"558","3.129096","151.101.1.140","100.86.243.187","TCP","1510","443  >  56509 [PSH, ACK] Seq=73645 Ack=683 Win=424 Len=1444 TSval=3914603092 TSecr=514303616 [TCP PDU reassembled in 566]"
"559","3.129167","100.86.243.187","151.101.1.140","TCP","66","56509  >  443 [ACK] Seq=683 Ack=75089 Win=7002 Len=0 TSval=514303625 TSecr=3914603092"
"560","3.133426","151.101.1.140","100.86.243.187","TCP","1510","443  >  56509 [ACK] Seq=75089 Ack=683 Win=424 Len=1444 TSval=3914603097 TSecr=514303621 [TCP PDU reassembled in 566]"
"561","3.134391","151.101.1.140","100.86.243.187","TCP","1510","443  >  56509 [ACK] Seq=76533 Ack=683 Win=424 Len=1444 TSval=3914603097 TSecr=514303621 [TCP PDU reassembled in 566]"
"562","3.134537","100.86.243.187","151.101.1.140","TCP","66","56509  >  443 [ACK] Seq=683 Ack=77977 Win=7025 Len=0 TSval=514303631 TSecr=3914603097"
"563","3.134789","151.101.1.140","100.86.243.187","TCP","1510","443  >  56509 [PSH, ACK] Seq=77977 Ack=683 Win=424 Len=1444 TSval=3914603097 TSecr=514303621 [TCP PDU reassembled in 566]"
"564","3.134897","100.86.243.187","151.101.1.140","TCP","66","56509  >  443 [ACK] Seq=683 Ack=79421 Win=7025 Len=0 TSval=514303631 TSecr=3914603097"
"565","3.137258","151.101.1.140","100.86.243.187","TCP","1510","443  >  56509 [ACK] Seq=79421 Ack=683 Win=424 Len=1444 TSval=3914603100 TSecr=514303623 [TCP PDU reassembled in 566]"
"566","3.137259","151.101.1.140","100.86.243.187","TLSv1.2","1510","Application Data, Application Data"
"567","3.137543","100.86.243.187","151.101.1.140","TCP","66","56509  >  443 [ACK] Seq=683 Ack=82309 Win=7025 Len=0 TSval=514303634 TSecr=3914603100"
"568","3.138658","151.101.1.140","100.86.243.187","TCP","1510","443  >  56509 [ACK] Seq=82309 Ack=683 Win=424 Len=1444 TSval=3914603102 TSecr=514303625 [TCP PDU reassembled in 580]"
"569","3.139131","151.101.1.140","100.86.243.187","TCP","1510","443  >  56509 [PSH, ACK] Seq=83753 Ack=683 Win=424 Len=1444 TSval=3914603102 TSecr=514303625 [TCP PDU reassembled in 580]"
"570","3.139253","100.86.243.187","151.101.1.140","TCP","66","56509  >  443 [ACK] Seq=683 Ack=85197 Win=7025 Len=0 TSval=514303635 TSecr=3914603102"
"571","3.144373","151.101.1.140","100.86.243.187","TCP","1510","443  >  56509 [ACK] Seq=85197 Ack=683 Win=424 Len=1444 TSval=3914603107 TSecr=514303631 [TCP PDU reassembled in 580]"
"572","3.144374","151.101.1.140","100.86.243.187","TCP","1510","443  >  56509 [PSH, ACK] Seq=86641 Ack=683 Win=424 Len=1444 TSval=3914603107 TSecr=514303631 [TCP PDU reassembled in 580]"
"573","3.144533","100.86.243.187","151.101.1.140","TCP","66","56509  >  443 [ACK] Seq=683 Ack=88085 Win=7025 Len=0 TSval=514303641 TSecr=3914603107"
"574","3.148167","151.101.1.140","100.86.243.187","TCP","1510","443  >  56509 [ACK] Seq=88085 Ack=683 Win=424 Len=1444 TSval=3914603111 TSecr=514303634 [TCP PDU reassembled in 580]"
"575","3.148662","151.101.1.140","100.86.243.187","TCP","1510","443  >  56509 [PSH, ACK] Seq=89529 Ack=683 Win=424 Len=1444 TSval=3914603111 TSecr=514303634 [TCP PDU reassembled in 580]"
"576","3.148781","100.86.243.187","151.101.1.140","TCP","66","56509  >  443 [ACK] Seq=683 Ack=90973 Win=7025 Len=0 TSval=514303645 TSecr=3914603111"
"577","3.149415","151.101.1.140","100.86.243.187","TCP","1510","443  >  56509 [ACK] Seq=90973 Ack=683 Win=424 Len=1444 TSval=3914603112 TSecr=514303635 [TCP PDU reassembled in 580]"
"578","3.149662","151.101.1.140","100.86.243.187","TCP","1510","443  >  56509 [PSH, ACK] Seq=92417 Ack=683 Win=424 Len=1444 TSval=3914603112 TSecr=514303635 [TCP PDU reassembled in 580]"
"579","3.149752","100.86.243.187","151.101.1.140","TCP","66","56509  >  443 [ACK] Seq=683 Ack=93861 Win=7025 Len=0 TSval=514303646 TSecr=3914603112"
"580","3.151616","151.101.1.140","100.86.243.187","TLSv1.2","1510","Application Data"
"581","3.154250","151.101.1.140","100.86.243.187","TCP","1510","443  >  56509 [ACK] Seq=95305 Ack=683 Win=424 Len=1444 TSval=3914603117 TSecr=514303641 [TCP PDU reassembled in 596]"
"582","3.154875","151.101.1.140","100.86.243.187","TCP","1510","443  >  56509 [PSH, ACK] Seq=96749 Ack=683 Win=424 Len=1444 TSval=3914603117 TSecr=514303641 [TCP PDU reassembled in 596]"
"583","3.154999","100.86.243.187","151.101.1.140","TCP","66","56509  >  443 [ACK] Seq=683 Ack=98193 Win=7025 Len=0 TSval=514303651 TSecr=3914603115"
"584","3.158244","151.101.1.140","100.86.243.187","TCP","1510","443  >  56509 [ACK] Seq=98193 Ack=683 Win=424 Len=1444 TSval=3914603122 TSecr=514303645 [TCP PDU reassembled in 596]"
"585","3.158849","151.101.1.140","100.86.243.187","TCP","1510","443  >  56509 [PSH, ACK] Seq=99637 Ack=683 Win=424 Len=1444 TSval=3914603122 TSecr=514303645 [TCP PDU reassembled in 596]"
"586","3.158973","100.86.243.187","151.101.1.140","TCP","66","56509  >  443 [ACK] Seq=683 Ack=101081 Win=7025 Len=0 TSval=514303655 TSecr=3914603122"
"587","3.159585","151.101.1.140","100.86.243.187","TCP","1510","443  >  56509 [ACK] Seq=101081 Ack=683 Win=424 Len=1444 TSval=3914603123 TSecr=514303646 [TCP PDU reassembled in 596]"
"588","3.160730","151.101.1.140","100.86.243.187","TCP","1510","443  >  56509 [PSH, ACK] Seq=102525 Ack=683 Win=424 Len=1444 TSval=3914603123 TSecr=514303646 [TCP PDU reassembled in 596]"
"589","3.160865","100.86.243.187","151.101.1.140","TCP","66","56509  >  443 [ACK] Seq=683 Ack=103969 Win=7025 Len=0 TSval=514303657 TSecr=3914603123"
"590","3.164408","151.101.1.140","100.86.243.187","TCP","1510","443  >  56509 [ACK] Seq=103969 Ack=683 Win=424 Len=1444 TSval=3914603127 TSecr=514303651 [TCP PDU reassembled in 596]"
"591","3.164446","151.101.1.140","100.86.243.187","TCP","1510","443  >  56509 [PSH, ACK] Seq=105413 Ack=683 Win=424 Len=1444 TSval=3914603127 TSecr=514303651 [TCP PDU reassembled in 596]"
"592","3.164563","100.86.243.187","151.101.1.140","TCP","66","56509  >  443 [ACK] Seq=683 Ack=106857 Win=7025 Len=0 TSval=514303661 TSecr=3914603127"
"593","3.165472","151.101.1.140","100.86.243.187","TCP","1510","443  >  56509 [ACK] Seq=106857 Ack=683 Win=424 Len=1444 TSval=3914603129 TSecr=514303651 [TCP PDU reassembled in 596]"
"594","3.165708","151.101.1.140","100.86.243.187","TCP","1510","443  >  56509 [PSH, ACK] Seq=108301 Ack=683 Win=424 Len=1444 TSval=3914603129 TSecr=514303651 [TCP PDU reassembled in 596]"
"595","3.165804","100.86.243.187","151.101.1.140","TCP","66","56509  >  443 [ACK] Seq=683 Ack=109745 Win=7025 Len=0 TSval=514303662 TSecr=3914603129"
"596","3.169165","151.101.1.140","100.86.243.187","TLSv1.2","1510","Application Data"
"597","3.169166","151.101.1.140","100.86.243.187","TCP","1510","443  >  56509 [PSH, ACK] Seq=111189 Ack=683 Win=424 Len=1444 TSval=3914603132 TSecr=514303655 [TCP PDU reassembled in 612]"
"598","3.169432","100.86.243.187","151.101.1.140","TCP","66","56509  >  443 [ACK] Seq=683 Ack=112633 Win=7025 Len=0 TSval=514303666 TSecr=3914603132"
"599","3.170757","151.101.1.140","100.86.243.187","TCP","1510","443  >  56509 [ACK] Seq=112633 Ack=683 Win=424 Len=1444 TSval=3914603133 TSecr=514303657 [TCP PDU reassembled in 612]"
"600","3.170989","151.101.1.140","100.86.243.187","TCP","1510","443  >  56509 [PSH, ACK] Seq=114077 Ack=683 Win=424 Len=1444 TSval=3914603133 TSecr=514303657 [TCP PDU reassembled in 612]"
"601","3.171092","100.86.243.187","151.101.1.140","TCP","66","56509  >  443 [ACK] Seq=683 Ack=115521 Win=7025 Len=0 TSval=514303667 TSecr=3914603133"
"602","3.174881","151.101.1.140","100.86.243.187","TCP","1510","443  >  56509 [ACK] Seq=115521 Ack=683 Win=424 Len=1444 TSval=3914603138 TSecr=514303661 [TCP PDU reassembled in 612]"
"603","3.174918","151.101.1.140","100.86.243.187","TCP","1510","443  >  56509 [PSH, ACK] Seq=116965 Ack=683 Win=424 Len=1444 TSval=3914603138 TSecr=514303661 [TCP PDU reassembled in 612]"
"604","3.175038","100.86.243.187","151.101.1.140","TCP","66","56509  >  443 [ACK] Seq=683 Ack=118409 Win=7025 Len=0 TSval=514303671 TSecr=3914603138"
"605","3.175930","151.101.1.140","100.86.243.187","TCP","1510","443  >  56509 [ACK] Seq=118409 Ack=683 Win=424 Len=1444 TSval=3914603139 TSecr=514303662 [TCP PDU reassembled in 612]"
"606","3.176317","151.101.1.140","100.86.243.187","TCP","1510","443  >  56509 [PSH, ACK] Seq=119853 Ack=683 Win=424 Len=1444 TSval=3914603139 TSecr=514303662 [TCP PDU reassembled in 612]"
"607","3.176419","100.86.243.187","151.101.1.140","TCP","66","56509  >  443 [ACK] Seq=683 Ack=121297 Win=7025 Len=0 TSval=514303672 TSecr=3914603139"
"608","3.179771","151.101.1.140","100.86.243.187","TCP","1510","443  >  56509 [ACK] Seq=121297 Ack=683 Win=424 Len=1444 TSval=3914603143 TSecr=514303666 [TCP PDU reassembled in 612]"
"609","3.180163","151.101.1.140","100.86.243.187","TCP","1510","443  >  56509 [PSH, ACK] Seq=122741 Ack=683 Win=424 Len=1444 TSval=3914603143 TSecr=514303666 [TCP PDU reassembled in 612]"
"610","3.180281","100.86.243.187","151.101.1.140","TCP","66","56509  >  443 [ACK] Seq=683 Ack=124185 Win=7025 Len=0 TSval=514303676 TSecr=3914603143"
"611","3.180860","151.101.1.140","100.86.243.187","TCP","1510","443  >  56509 [ACK] Seq=124185 Ack=683 Win=424 Len=1444 TSval=3914603144 TSecr=514303667 [TCP PDU reassembled in 612]"
"612","3.181134","151.101.1.140","100.86.243.187","TLSv1.2","1510","Application Data"
"613","3.181298","100.86.243.187","151.101.1.140","TCP","66","56509  >  443 [ACK] Seq=683 Ack=127073 Win=7025 Len=0 TSval=514303677 TSecr=3914603144"
"614","3.185635","151.101.1.140","100.86.243.187","TCP","1510","443  >  56509 [ACK] Seq=127073 Ack=683 Win=424 Len=1444 TSval=3914603148 TSecr=514303671 [TCP PDU reassembled in 631]"
"615","3.185664","151.101.1.140","100.86.243.187","TCP","1510","443  >  56509 [PSH, ACK] Seq=128517 Ack=683 Win=424 Len=1444 TSval=3914603148 TSecr=514303671 [TCP PDU reassembled in 631]"
"616","3.185767","100.86.243.187","151.101.1.140","TCP","66","56509  >  443 [ACK] Seq=683 Ack=129961 Win=7025 Len=0 TSval=514303682 TSecr=3914603148"
"617","3.186623","151.101.1.140","100.86.243.187","TCP","1510","443  >  56509 [ACK] Seq=129961 Ack=683 Win=424 Len=1444 TSval=3914603150 TSecr=514303672 [TCP PDU reassembled in 631]"
"618","3.187019","151.101.1.140","100.86.243.187","TCP","1510","443  >  56509 [PSH, ACK] Seq=131405 Ack=683 Win=424 Len=1444 TSval=3914603150 TSecr=514303672 [TCP PDU reassembled in 631]"
"619","3.187130","100.86.243.187","151.101.1.140","TCP","66","56509  >  443 [ACK] Seq=683 Ack=132849 Win=7025 Len=0 TSval=514303683 TSecr=3914603150"
"620","3.192398","151.101.1.140","100.86.243.187","TCP","1510","443  >  56509 [ACK] Seq=132849 Ack=683 Win=424 Len=1444 TSval=3914603155 TSecr=514303677 [TCP PDU reassembled in 631]"
"621","3.192673","151.101.1.140","100.86.243.187","TCP","1510","443  >  56509 [PSH, ACK] Seq=134293 Ack=683 Win=424 Len=1444 TSval=3914603155 TSecr=514303677 [TCP PDU reassembled in 631]"
"622","3.192781","100.86.243.187","151.101.1.140","TCP","66","56509  >  443 [ACK] Seq=683 Ack=135737 Win=7025 Len=0 TSval=514303689 TSecr=3914603155"
"625","3.193817","151.101.1.140","100.86.243.187","TCP","1510","443  >  56509 [ACK] Seq=135737 Ack=683 Win=424 Len=1444 TSval=3914603157 TSecr=514303677 [TCP PDU reassembled in 631]"
"626","3.193818","151.101.1.140","100.86.243.187","TCP","1510","443  >  56509 [PSH, ACK] Seq=137181 Ack=683 Win=424 Len=1444 TSval=3914603157 TSecr=514303677 [TCP PDU reassembled in 631]"
"627","3.193929","100.86.243.187","151.101.1.140","TCP","66","56509  >  443 [ACK] Seq=683 Ack=138625 Win=7025 Len=0 TSval=514303690 TSecr=3914603157"
"628","3.195941","151.101.1.140","100.86.243.187","TCP","1510","443  >  56509 [ACK] Seq=138625 Ack=683 Win=424 Len=1444 TSval=3914603159 TSecr=514303682 [TCP PDU reassembled in 631]"
"629","3.196076","151.101.1.140","100.86.243.187","TCP","1510","443  >  56509 [PSH, ACK] Seq=140069 Ack=683 Win=424 Len=1444 TSval=3914603159 TSecr=514303682 [TCP PDU reassembled in 631]"
"630","3.196175","100.86.243.187","151.101.1.140","TCP","66","56509  >  443 [ACK] Seq=683 Ack=141513 Win=7025 Len=0 TSval=514303692 TSecr=3914603159"
"631","3.197906","151.101.1.140","100.86.243.187","TLSv1.2","1510","Application Data"
"632","3.198297","151.101.1.140","100.86.243.187","TCP","1510","443  >  56509 [PSH, ACK] Seq=142957 Ack=683 Win=424 Len=1444 TSval=3914603161 TSecr=514303683 [TCP PDU reassembled in 648]"
"633","3.198398","100.86.243.187","151.101.1.140","TCP","66","56509  >  443 [ACK] Seq=683 Ack=144401 Win=7025 Len=0 TSval=514303694 TSecr=3914603161"
"634","3.200185","151.101.1.140","100.86.243.187","TCP","1510","443  >  56509 [ACK] Seq=144401 Ack=683 Win=424 Len=1444 TSval=3914603163 TSecr=514303683 [TCP PDU reassembled in 648]"
"635","3.202865","151.101.1.140","100.86.243.187","TCP","1510","443  >  56509 [ACK] Seq=145845 Ack=683 Win=424 Len=1444 TSval=3914603165 TSecr=514303689 [TCP PDU reassembled in 648]"
"636","3.202867","151.101.1.140","100.86.243.187","TCP","1510","443  >  56509 [PSH, ACK] Seq=147289 Ack=683 Win=424 Len=1444 TSval=3914603165 TSecr=514303689 [TCP PDU reassembled in 648]"
"637","3.203013","100.86.243.187","151.101.1.140","TCP","66","56509  >  443 [ACK] Seq=683 Ack=148733 Win=7025 Len=0 TSval=514303699 TSecr=3914603163"
"638","3.203679","151.101.1.140","100.86.243.187","TCP","1510","443  >  56509 [ACK] Seq=148733 Ack=683 Win=424 Len=1444 TSval=3914603166 TSecr=514303690 [TCP PDU reassembled in 648]"
"639","3.205801","151.101.1.140","100.86.243.187","TCP","1510","443  >  56509 [PSH, ACK] Seq=150177 Ack=683 Win=424 Len=1444 TSval=3914603166 TSecr=514303690 [TCP PDU reassembled in 648]"
"640","3.205931","100.86.243.187","151.101.1.140","TCP","66","56509  >  443 [ACK] Seq=683 Ack=151621 Win=7025 Len=0 TSval=514303702 TSecr=3914603166"
"641","3.206067","151.101.1.140","100.86.243.187","TCP","1510","443  >  56509 [ACK] Seq=151621 Ack=683 Win=424 Len=1444 TSval=3914603169 TSecr=514303692 [TCP PDU reassembled in 648]"
"642","3.206068","151.101.1.140","100.86.243.187","TCP","1510","443  >  56509 [PSH, ACK] Seq=153065 Ack=683 Win=424 Len=1444 TSval=3914603169 TSecr=514303692 [TCP PDU reassembled in 648]"
"643","3.206137","100.86.243.187","151.101.1.140","TCP","66","56509  >  443 [ACK] Seq=683 Ack=154509 Win=7025 Len=0 TSval=514303702 TSecr=3914603169"
"644","3.208669","151.101.1.140","100.86.243.187","TCP","1510","443  >  56509 [ACK] Seq=154509 Ack=683 Win=424 Len=1444 TSval=3914603171 TSecr=514303694 [TCP PDU reassembled in 648]"
"645","3.208706","151.101.1.140","100.86.243.187","TCP","1510","443  >  56509 [PSH, ACK] Seq=155953 Ack=683 Win=424 Len=1444 TSval=3914603171 TSecr=514303694 [TCP PDU reassembled in 648]"
"646","3.208818","100.86.243.187","151.101.1.140","TCP","66","56509  >  443 [ACK] Seq=683 Ack=157397 Win=7025 Len=0 TSval=514303705 TSecr=3914603171"
"647","3.214018","151.101.1.140","100.86.243.187","TCP","1510","443  >  56509 [ACK] Seq=157397 Ack=683 Win=424 Len=1444 TSval=3914603177 TSecr=514303699 [TCP PDU reassembled in 648]"
"648","3.214243","151.101.1.140","100.86.243.187","TLSv1.2","1510","Application Data"
"649","3.214434","100.86.243.187","151.101.1.140","TCP","66","56509  >  443 [ACK] Seq=683 Ack=160285 Win=7025 Len=0 TSval=514303711 TSecr=3914603177"
"650","3.215616","151.101.1.140","100.86.243.187","TCP","1510","443  >  56509 [ACK] Seq=160285 Ack=683 Win=424 Len=1444 TSval=3914603178 TSecr=514303699 [TCP PDU reassembled in 665]"
"651","3.215617","151.101.1.140","100.86.243.187","TCP","1510","443  >  56509 [PSH, ACK] Seq=161729 Ack=683 Win=424 Len=1444 TSval=3914603178 TSecr=514303699 [TCP PDU reassembled in 665]"
"652","3.215720","100.86.243.187","151.101.1.140","TCP","66","56509  >  443 [ACK] Seq=683 Ack=163173 Win=7025 Len=0 TSval=514303712 TSecr=3914603178"
"653","3.216566","151.101.1.140","100.86.243.187","TCP","1510","443  >  56509 [ACK] Seq=163173 Ack=683 Win=424 Len=1444 TSval=3914603180 TSecr=514303702 [TCP PDU reassembled in 665]"
"654","3.218258","151.101.1.140","100.86.243.187","TCP","1510","443  >  56509 [PSH, ACK] Seq=164617 Ack=683 Win=424 Len=1444 TSval=3914603180 TSecr=514303702 [TCP PDU reassembled in 665]"
"655","3.218400","100.86.243.187","151.101.1.140","TCP","66","56509  >  443 [ACK] Seq=683 Ack=166061 Win=7025 Len=0 TSval=514303715 TSecr=3914603180"
"656","3.218515","151.101.1.140","100.86.243.187","TCP","1510","443  >  56509 [ACK] Seq=166061 Ack=683 Win=424 Len=1444 TSval=3914603181 TSecr=514303702 [TCP PDU reassembled in 665]"
"657","3.218516","151.101.1.140","100.86.243.187","TCP","1510","443  >  56509 [PSH, ACK] Seq=167505 Ack=683 Win=424 Len=1444 TSval=3914603181 TSecr=514303702 [TCP PDU reassembled in 665]"
"658","3.218613","100.86.243.187","151.101.1.140","TCP","66","56509  >  443 [ACK] Seq=683 Ack=168949 Win=7025 Len=0 TSval=514303715 TSecr=3914603181"
"659","3.219863","151.101.1.140","100.86.243.187","TCP","1510","443  >  56509 [ACK] Seq=168949 Ack=683 Win=424 Len=1444 TSval=3914603183 TSecr=514303705 [TCP PDU reassembled in 665]"
"660","3.220238","151.101.1.140","100.86.243.187","TCP","1510","443  >  56509 [PSH, ACK] Seq=170393 Ack=683 Win=424 Len=1444 TSval=3914603183 TSecr=514303705 [TCP PDU reassembled in 665]"
"661","3.220333","100.86.243.187","151.101.1.140","TCP","66","56509  >  443 [ACK] Seq=683 Ack=171837 Win=7025 Len=0 TSval=514303716 TSecr=3914603183"
"662","3.225772","151.101.1.140","100.86.243.187","TCP","1510","443  >  56509 [ACK] Seq=171837 Ack=683 Win=424 Len=1444 TSval=3914603189 TSecr=514303712 [TCP PDU reassembled in 665]"
"663","3.226199","151.101.1.140","100.86.243.187","TCP","1510","443  >  56509 [PSH, ACK] Seq=173281 Ack=683 Win=424 Len=1444 TSval=3914603189 TSecr=514303712 [TCP PDU reassembled in 665]"
"664","3.226339","100.86.243.187","151.101.1.140","TCP","66","56509  >  443 [ACK] Seq=683 Ack=174725 Win=7025 Len=0 TSval=514303722 TSecr=3914603189"
"665","3.226925","151.101.1.140","100.86.243.187","TLSv1.2","1510","Application Data, Application Data"
"666","3.226926","151.101.1.140","100.86.243.187","TCP","1510","443  >  56509 [PSH, ACK] Seq=176169 Ack=683 Win=424 Len=1444 TSval=3914603190 TSecr=514303712 [TCP PDU reassembled in 683]"
"667","3.227123","100.86.243.187","151.101.1.140","TCP","66","56509  >  443 [ACK] Seq=683 Ack=177613 Win=7025 Len=0 TSval=514303723 TSecr=3914603190"
"668","3.228246","151.101.1.140","100.86.243.187","TCP","1510","443  >  56509 [ACK] Seq=177613 Ack=683 Win=424 Len=1444 TSval=3914603191 TSecr=514303715 [TCP PDU reassembled in 683]"
"669","3.229314","151.101.1.140","100.86.243.187","TCP","1510","443  >  56509 [PSH, ACK] Seq=179057 Ack=683 Win=424 Len=1444 TSval=3914603191 TSecr=514303715 [TCP PDU reassembled in 683]"
"670","3.229433","100.86.243.187","151.101.1.140","TCP","66","56509  >  443 [ACK] Seq=683 Ack=180501 Win=7025 Len=0 TSval=514303726 TSecr=3914603191"
"671","3.230155","151.101.1.140","100.86.243.187","TCP","1510","443  >  56509 [ACK] Seq=180501 Ack=683 Win=424 Len=1444 TSval=3914603193 TSecr=514303715 [TCP PDU reassembled in 683]"
"672","3.230852","151.101.1.140","100.86.243.187","TCP","1510","443  >  56509 [PSH, ACK] Seq=181945 Ack=683 Win=424 Len=1444 TSval=3914603193 TSecr=514303715 [TCP PDU reassembled in 683]"
"673","3.230970","100.86.243.187","151.101.1.140","TCP","66","56509  >  443 [ACK] Seq=683 Ack=183389 Win=7025 Len=0 TSval=514303727 TSecr=3914603193"
"674","3.232859","151.101.1.140","100.86.243.187","TCP","1510","443  >  56509 [ACK] Seq=183389 Ack=683 Win=424 Len=1444 TSval=3914603195 TSecr=514303716 [TCP PDU reassembled in 683]"
"675","3.232995","151.101.1.140","100.86.243.187","TCP","1510","443  >  56509 [PSH, ACK] Seq=184833 Ack=683 Win=424 Len=1444 TSval=3914603195 TSecr=514303716 [TCP PDU reassembled in 683]"
"676","3.233092","100.86.243.187","151.101.1.140","TCP","66","56509  >  443 [ACK] Seq=683 Ack=186277 Win=7025 Len=0 TSval=514303729 TSecr=3914603195"
"677","3.236405","151.101.1.140","100.86.243.187","TCP","1510","443  >  56509 [ACK] Seq=186277 Ack=683 Win=424 Len=1444 TSval=3914603199 TSecr=514303722 [TCP PDU reassembled in 683]"
"678","3.237471","151.101.1.140","100.86.243.187","TCP","1510","443  >  56509 [PSH, ACK] Seq=187721 Ack=683 Win=424 Len=1444 TSval=3914603199 TSecr=514303722 [TCP PDU reassembled in 683]"
"679","3.237699","100.86.243.187","151.101.1.140","TCP","66","56509  >  443 [ACK] Seq=683 Ack=189165 Win=7025 Len=0 TSval=514303734 TSecr=3914603199"
"680","3.238311","151.101.1.140","100.86.243.187","TCP","1510","443  >  56509 [ACK] Seq=189165 Ack=683 Win=424 Len=1444 TSval=3914603200 TSecr=514303723 [TCP PDU reassembled in 683]"
"681","3.238313","151.101.1.140","100.86.243.187","TCP","1510","443  >  56509 [PSH, ACK] Seq=190609 Ack=683 Win=424 Len=1444 TSval=3914603200 TSecr=514303723 [TCP PDU reassembled in 683]"
"682","3.238444","100.86.243.187","151.101.1.140","TCP","66","56509  >  443 [ACK] Seq=683 Ack=192053 Win=7025 Len=0 TSval=514303734 TSecr=3914603200"
"683","3.239220","151.101.1.140","100.86.243.187","TLSv1.2","1510","Application Data"
"684","3.239828","151.101.1.140","100.86.243.187","TCP","1510","443  >  56509 [PSH, ACK] Seq=193497 Ack=683 Win=424 Len=1444 TSval=3914603203 TSecr=514303726 [TCP PDU reassembled in 699]"
"685","3.239946","100.86.243.187","151.101.1.140","TCP","66","56509  >  443 [ACK] Seq=683 Ack=194941 Win=7025 Len=0 TSval=514303736 TSecr=3914603203"
"686","3.242063","151.101.1.140","100.86.243.187","TCP","1510","443  >  56509 [ACK] Seq=194941 Ack=683 Win=424 Len=1444 TSval=3914603205 TSecr=514303727 [TCP PDU reassembled in 699]"
"687","3.242098","151.101.1.140","100.86.243.187","TCP","1510","443  >  56509 [PSH, ACK] Seq=196385 Ack=683 Win=424 Len=1444 TSval=3914603205 TSecr=514303727 [TCP PDU reassembled in 699]"
"688","3.242209","100.86.243.187","151.101.1.140","TCP","66","56509  >  443 [ACK] Seq=683 Ack=197829 Win=7025 Len=0 TSval=514303739 TSecr=3914603205"
"689","3.242930","151.101.1.140","100.86.243.187","TCP","1510","443  >  56509 [ACK] Seq=197829 Ack=683 Win=424 Len=1444 TSval=3914603206 TSecr=514303729 [TCP PDU reassembled in 699]"
"690","3.244049","151.101.1.140","100.86.243.187","TCP","1510","443  >  56509 [PSH, ACK] Seq=199273 Ack=683 Win=424 Len=1444 TSval=3914603206 TSecr=514303729 [TCP PDU reassembled in 699]"
"691","3.244162","100.86.243.187","151.101.1.140","TCP","66","56509  >  443 [ACK] Seq=683 Ack=200717 Win=7025 Len=0 TSval=514303741 TSecr=3914603206"
"692","3.247734","151.101.1.140","100.86.243.187","TCP","1510","443  >  56509 [ACK] Seq=200717 Ack=683 Win=424 Len=1444 TSval=3914603210 TSecr=514303734 [TCP PDU reassembled in 699]"
"693","3.248219","151.101.1.140","100.86.243.187","TCP","1510","443  >  56509 [PSH, ACK] Seq=202161 Ack=683 Win=424 Len=1444 TSval=3914603210 TSecr=514303734 [TCP PDU reassembled in 699]"
"694","3.248325","100.86.243.187","151.101.1.140","TCP","66","56509  >  443 [ACK] Seq=683 Ack=203605 Win=7025 Len=0 TSval=514303744 TSecr=3914603210"
"695","3.248986","151.101.1.140","100.86.243.187","TCP","1510","443  >  56509 [ACK] Seq=203605 Ack=683 Win=424 Len=1444 TSval=3914603212 TSecr=514303734 [TCP PDU reassembled in 699]"
"696","3.249460","151.101.1.140","100.86.243.187","TCP","1510","443  >  56509 [PSH, ACK] Seq=205049 Ack=683 Win=424 Len=1444 TSval=3914603212 TSecr=514303734 [TCP PDU reassembled in 699]"
"697","3.249600","100.86.243.187","151.101.1.140","TCP","66","56509  >  443 [ACK] Seq=683 Ack=206493 Win=7025 Len=0 TSval=514303746 TSecr=3914603212"
"698","3.250622","151.101.1.140","100.86.243.187","TCP","1510","443  >  56509 [ACK] Seq=206493 Ack=683 Win=424 Len=1444 TSval=3914603213 TSecr=514303736 [TCP PDU reassembled in 699]"
"699","3.250623","151.101.1.140","100.86.243.187","TLSv1.2","1510","Application Data"
"700","3.250837","100.86.243.187","151.101.1.140","TCP","66","56509  >  443 [ACK] Seq=683 Ack=209381 Win=7025 Len=0 TSval=514303747 TSecr=3914603213"
"701","3.253464","151.101.1.140","100.86.243.187","TCP","1510","443  >  56509 [ACK] Seq=209381 Ack=683 Win=424 Len=1444 TSval=3914603216 TSecr=514303739 [TCP PDU reassembled in 702]"
"702","3.253647","151.101.1.140","100.86.243.187","TLSv1.2","1510","Application Data"
"703","3.253781","100.86.243.187","151.101.1.140","TCP","66","56509  >  443 [ACK] Seq=683 Ack=212269 Win=7025 Len=0 TSval=514303750 TSecr=3914603216"
"704","3.254194","151.101.1.140","100.86.243.187","TCP","1510","[TCP Previous segment not captured] 443  >  56509 [PSH, ACK] Seq=213713 Ack=683 Win=424 Len=1444 TSval=3914603217 TSecr=514303741"
"705","3.254250","100.86.243.187","151.101.1.140","TCP","78","[TCP Dup ACK 703#1] 56509  >  443 [ACK] Seq=683 Ack=212269 Win=7025 Len=0 TSval=514303750 TSecr=3914603216 SLE=213713 SRE=215157"
"706","3.258794","151.101.1.140","100.86.243.187","TCP","1510","443  >  56509 [ACK] Seq=215157 Ack=683 Win=424 Len=1444 TSval=3914603222 TSecr=514303744"
"707","3.258818","151.101.1.140","100.86.243.187","TCP","932","443  >  56509 [PSH, ACK] Seq=216601 Ack=683 Win=424 Len=866 TSval=3914603222 TSecr=514303744"
"708","3.258877","100.86.243.187","151.101.1.140","TCP","78","[TCP Dup ACK 703#2] 56509  >  443 [ACK] Seq=683 Ack=212269 Win=7025 Len=0 TSval=514303755 TSecr=3914603216 SLE=213713 SRE=216601"
"709","3.258925","100.86.243.187","151.101.1.140","TCP","78","[TCP Dup ACK 703#3] 56509  >  443 [ACK] Seq=683 Ack=212269 Win=7025 Len=0 TSval=514303755 TSecr=3914603216 SLE=213713 SRE=217467"
"710","3.268619","151.101.1.140","100.86.243.187","TLSv1.2","1510","[TCP Fast Retransmission] , Application Data"
"711","3.268734","100.86.243.187","151.101.1.140","TCP","66","56509  >  443 [ACK] Seq=683 Ack=217467 Win=6944 Len=0 TSval=514303765 TSecr=3914603232"
"712","3.268936","100.86.243.187","151.101.1.140","TCP","66","[TCP Window Update] 56509  >  443 [ACK] Seq=683 Ack=217467 Win=7025 Len=0 TSval=514303765 TSecr=3914603232"
"773","3.728107","100.86.243.187","151.101.1.140","TCP","1514","56485  >  443 [ACK] Seq=37727 Ack=74393 Win=3925 Len=1448 TSval=2851397476 TSecr=1266342312 [TCP PDU reassembled in 775]"
"774","3.728109","100.86.243.187","151.101.1.140","TCP","1514","56485  >  443 [ACK] Seq=39175 Ack=74393 Win=3925 Len=1448 TSval=2851397476 TSecr=1266342312 [TCP PDU reassembled in 775]"
"775","3.728153","100.86.243.187","151.101.1.140","TLSv1.2","131","Application Data"
"776","3.728214","100.86.243.187","151.101.1.140","TCP","1514","56485  >  443 [ACK] Seq=40688 Ack=74393 Win=3925 Len=1448 TSval=2851397476 TSecr=1266342312 [TCP PDU reassembled in 777]"
"777","3.728225","100.86.243.187","151.101.1.140","TLSv1.2","1063","Application Data"
"784","3.738658","151.101.1.140","100.86.243.187","TCP","66","443  >  56485 [ACK] Seq=74393 Ack=43133 Win=630 Len=0 TSval=1266342974 TSecr=2851397476"
"798","3.770267","151.101.1.140","100.86.243.187","TCP","1510","443  >  56485 [ACK] Seq=74393 Ack=43133 Win=639 Len=1444 TSval=1266343006 TSecr=2851397476 [TCP PDU reassembled in 799]"
"799","3.770268","151.101.1.140","100.86.243.187","TLSv1.2","990","Application Data"
"800","3.770325","100.86.243.187","151.101.1.140","TCP","66","56485  >  443 [ACK] Seq=43133 Ack=76761 Win=3888 Len=0 TSval=2851397518 TSecr=1266343006"
"932","8.992590","100.86.243.187","151.101.1.140","TCP","1514","56485  >  443 [ACK] Seq=43133 Ack=76761 Win=3925 Len=1448 TSval=2851402740 TSecr=1266343006 [TCP PDU reassembled in 934]"
"933","8.992592","100.86.243.187","151.101.1.140","TCP","1514","56485  >  443 [ACK] Seq=44581 Ack=76761 Win=3925 Len=1448 TSval=2851402740 TSecr=1266343006 [TCP PDU reassembled in 934]"
"934","8.992634","100.86.243.187","151.101.1.140","TLSv1.2","181","Application Data"
"935","8.992695","100.86.243.187","151.101.1.140","TCP","1514","56485  >  443 [ACK] Seq=46144 Ack=76761 Win=3925 Len=1448 TSval=2851402740 TSecr=1266343006 [TCP PDU reassembled in 937]"
"936","8.992696","100.86.243.187","151.101.1.140","TCP","1514","56485  >  443 [ACK] Seq=47592 Ack=76761 Win=3925 Len=1448 TSval=2851402740 TSecr=1266343006 [TCP PDU reassembled in 937]"
"937","8.992709","100.86.243.187","151.101.1.140","TLSv1.2","835","Application Data"
"938","9.002351","151.101.1.140","100.86.243.187","TCP","66","443  >  56485 [ACK] Seq=76761 Ack=46144 Win=635 Len=0 TSval=1266348238 TSecr=2851402740"
"939","9.002923","151.101.1.140","100.86.243.187","TCP","66","443  >  56485 [ACK] Seq=76761 Ack=49809 Win=630 Len=0 TSval=1266348238 TSecr=2851402740"
"940","9.054337","151.101.1.140","100.86.243.187","TCP","1510","443  >  56485 [ACK] Seq=76761 Ack=49809 Win=639 Len=1444 TSval=1266348289 TSecr=2851402740 [TCP PDU reassembled in 941]"
"941","9.054339","151.101.1.140","100.86.243.187","TLSv1.2","313","Application Data"
"942","9.054473","100.86.243.187","151.101.1.140","TCP","66","56485  >  443 [ACK] Seq=49809 Ack=78452 Win=3899 Len=0 TSval=2851402802 TSecr=1266348289"
