"No.","Time","Source","Destination","Protocol","Length","Info"
"1","0.000000","151.101.65.140","100.86.235.39","TCP","66","443  >  56383 [ACK] Seq=1 Ack=1 Win=534 Len=0 TSval=557106948 TSecr=1359881962"
"2","0.003610","151.101.65.140","100.86.235.39","TCP","66","443  >  56383 [ACK] Seq=1 Ack=3169 Win=534 Len=0 TSval=557106952 TSecr=1359881965"
"3","0.018547","100.86.235.39","151.101.65.140","TCP","1514","56383  >  443 [ACK] Seq=3169 Ack=1 Win=2048 Len=1448 TSval=1359881990 TSecr=557106952 [TCP PDU reassembled in 5]"
"4","0.018549","100.86.235.39","151.101.65.140","TCP","1514","56383  >  443 [ACK] Seq=4617 Ack=1 Win=2048 Len=1448 TSval=1359881990 TSecr=557106952 [TCP PDU reassembled in 5]"
"5","0.018592","100.86.235.39","151.101.65.140","TLSv1.2","109","Application Data"
"6","0.018645","100.86.235.39","151.101.65.140","TLSv1.2","278","Application Data"
"7","0.029470","151.101.65.140","100.86.235.39","TCP","66","443  >  56383 [ACK] Seq=1 Ack=6320 Win=534 Len=0 TSval=557106977 TSecr=1359881990"
"8","0.041816","151.101.65.140","100.86.235.39","TCP","1510","443  >  56383 [ACK] Seq=1 Ack=6320 Win=538 Len=1444 TSval=557106990 TSecr=1359881990 [TCP PDU reassembled in 10]"
"9","0.041927","100.86.235.39","151.101.65.140","TCP","66","56383  >  443 [ACK] Seq=6320 Ack=1445 Win=2025 Len=0 TSval=1359882013 TSecr=557106990"
"10","0.042436","151.101.65.140","100.86.235.39","TLSv1.2","869","Application Data"
"11","0.042494","100.86.235.39","151.101.65.140","TCP","66","56383  >  443 [ACK] Seq=6320 Ack=2248 Win=2035 Len=0 TSval=1359882013 TSecr=557106990"
"12","0.042686","151.101.65.140","100.86.235.39","TLSv1.2","276","Application Data"
"13","0.042733","100.86.235.39","151.101.65.140","TCP","66","56383  >  443 [ACK] Seq=6320 Ack=2458 Win=2044 Len=0 TSval=1359882013 TSecr=557106990"
"14","0.059249","151.101.65.140","100.86.235.39","TCP","1510","443  >  56383 [ACK] Seq=2458 Ack=6320 Win=538 Len=1444 TSval=557107008 TSecr=1359882013 [TCP PDU reassembled in 15]"
"15","0.059506","151.101.65.140","100.86.235.39","TLSv1.2","372","Application Data"
"16","0.059565","100.86.235.39","151.101.65.140","TCP","66","56383  >  443 [ACK] Seq=6320 Ack=4208 Win=2043 Len=0 TSval=1359882031 TSecr=557107008"
"17","0.063972","100.86.235.39","151.101.1.140","TLSv1.2","151","Application Data"
"18","0.064273","100.86.235.39","151.101.1.140","TLSv1.2","153","Application Data"
"19","0.064499","100.86.235.39","151.101.1.140","TLSv1.2","150","Application Data"
"20","0.064617","100.86.235.39","151.101.1.140","TLSv1.2","150","Application Data"
"21","0.064882","100.86.235.39","151.101.1.140","TLSv1.2","150","Application Data"
"22","0.065101","100.86.235.39","151.101.1.140","TLSv1.2","153","Application Data"
"23","0.073285","151.101.65.140","100.86.235.39","TCP","1510","443  >  56383 [ACK] Seq=4208 Ack=6320 Win=538 Len=1444 TSval=557107020 TSecr=1359882031 [TCP PDU reassembled in 24]"
"24","0.073328","151.101.65.140","100.86.235.39","TLSv1.2","865","Application Data"
"25","0.073328","151.101.65.140","100.86.235.39","TLSv1.2","233","Application Data"
"26","0.073381","100.86.235.39","151.101.65.140","TCP","66","56383  >  443 [ACK] Seq=6320 Ack=6618 Win=2010 Len=0 TSval=1359882045 TSecr=557107020"
"27","0.074274","151.101.1.140","100.86.235.39","TCP","66","443  >  56466 [ACK] Seq=1 Ack=86 Win=325 Len=0 TSval=211754198 TSecr=2554202489"
"28","0.074668","151.101.1.140","100.86.235.39","TCP","1510","443  >  56466 [ACK] Seq=1 Ack=86 Win=325 Len=1444 TSval=211754199 TSecr=2554202489 [TCP PDU reassembled in 29]"
"29","0.074669","151.101.1.140","100.86.235.39","TLSv1.2","460","Application Data"
"30","0.074729","100.86.235.39","151.101.1.140","TCP","66","56466  >  443 [ACK] Seq=512 Ack=1839 Win=4621 Len=0 TSval=2554202500 TSecr=211754199"
"31","0.074878","151.101.1.140","100.86.235.39","TCP","66","443  >  56466 [ACK] Seq=1839 Ack=512 Win=325 Len=0 TSval=211754199 TSecr=2554202490"
"32","0.076536","151.101.1.140","100.86.235.39","TCP","1510","443  >  56466 [ACK] Seq=1839 Ack=512 Win=325 Len=1444 TSval=211754200 TSecr=2554202490 [TCP PDU reassembled in 38]"
"33","0.076537","151.101.1.140","100.86.235.39","TCP","1510","443  >  56466 [ACK] Seq=3283 Ack=512 Win=325 Len=1444 TSval=211754200 TSecr=2554202490 [TCP PDU reassembled in 38]"
"34","0.076538","151.101.1.140","100.86.235.39","TCP","1510","443  >  56466 [ACK] Seq=4727 Ack=512 Win=325 Len=1444 TSval=211754200 TSecr=2554202490 [TCP PDU reassembled in 38]"
"35","0.076613","100.86.235.39","151.101.1.140","TCP","66","56466  >  443 [ACK] Seq=512 Ack=6171 Win=4582 Len=0 TSval=2554202502 TSecr=211754200"
"36","0.076719","100.86.235.39","151.101.1.140","TCP","66","[TCP Window Update] 56466  >  443 [ACK] Seq=512 Ack=6171 Win=4649 Len=0 TSval=2554202502 TSecr=211754200"
"37","0.078604","151.101.1.140","100.86.235.39","TCP","1510","443  >  56466 [ACK] Seq=6171 Ack=512 Win=325 Len=1444 TSval=211754200 TSecr=2554202490 [TCP PDU reassembled in 38]"
"38","0.078605","151.101.1.140","100.86.235.39","TLSv1.2","1496","Application Data"
"39","0.078606","151.101.1.140","100.86.235.39","TCP","1510","443  >  56466 [ACK] Seq=9045 Ack=512 Win=325 Len=1444 TSval=211754200 TSecr=2554202490 [TCP PDU reassembled in 40]"
"40","0.078606","151.101.1.140","100.86.235.39","TLSv1.2","1387","Application Data"
"41","0.078607","151.101.1.140","100.86.235.39","TLSv1.2","1087","Application Data"
"42","0.078688","100.86.235.39","151.101.1.140","TCP","66","56466  >  443 [ACK] Seq=512 Ack=12831 Win=4545 Len=0 TSval=2554202504 TSecr=211754201"
"43","0.079250","100.86.235.39","151.101.1.140","TCP","66","[TCP Window Update] 56466  >  443 [ACK] Seq=512 Ack=12831 Win=4649 Len=0 TSval=2554202504 TSecr=211754201"
"44","0.112270","100.86.235.39","151.101.65.140","TCP","1514","56383  >  443 [ACK] Seq=6320 Ack=6618 Win=2048 Len=1448 TSval=1359882083 TSecr=557107020 [TCP PDU reassembled in 46]"
"45","0.112272","100.86.235.39","151.101.65.140","TCP","1514","56383  >  443 [ACK] Seq=7768 Ack=6618 Win=2048 Len=1448 TSval=1359882083 TSecr=557107020 [TCP PDU reassembled in 46]"
"46","0.112317","100.86.235.39","151.101.65.140","TLSv1.2","108","Application Data"
"47","0.112374","100.86.235.39","151.101.65.140","TLSv1.2","292","Application Data"
"48","0.122222","151.101.65.140","100.86.235.39","TCP","66","443  >  56383 [ACK] Seq=6618 Ack=9484 Win=538 Len=0 TSval=557107070 TSecr=1359882083"
"49","0.124797","100.86.235.39","151.101.65.140","TCP","1514","56383  >  443 [ACK] Seq=9484 Ack=6618 Win=2048 Len=1448 TSval=1359882096 TSecr=557107070 [TCP PDU reassembled in 51]"
"50","0.124798","100.86.235.39","151.101.65.140","TCP","1514","56383  >  443 [ACK] Seq=10932 Ack=6618 Win=2048 Len=1448 TSval=1359882096 TSecr=557107070 [TCP PDU reassembled in 51]"
"51","0.124843","100.86.235.39","151.101.65.140","TLSv1.2","108","Application Data"
"52","0.124893","100.86.235.39","151.101.65.140","TLSv1.2","294","Application Data"
"53","0.126919","100.86.235.39","151.101.65.140","TCP","1514","56383  >  443 [ACK] Seq=12650 Ack=6618 Win=2048 Len=1448 TSval=1359882098 TSecr=557107070 [TCP PDU reassembled in 55]"
"54","0.126921","100.86.235.39","151.101.65.140","TCP","1514","56383  >  443 [ACK] Seq=14098 Ack=6618 Win=2048 Len=1448 TSval=1359882098 TSecr=557107070 [TCP PDU reassembled in 55]"
"55","0.126955","100.86.235.39","151.101.65.140","TLSv1.2","108","Application Data"
"56","0.126998","100.86.235.39","151.101.65.140","TLSv1.2","294","Application Data"
"57","0.134745","151.101.65.140","100.86.235.39","TCP","66","443  >  56383 [ACK] Seq=6618 Ack=12650 Win=533 Len=0 TSval=557107083 TSecr=1359882096"
"58","0.136882","151.101.65.140","100.86.235.39","TCP","66","443  >  56383 [ACK] Seq=6618 Ack=15588 Win=534 Len=0 TSval=557107085 TSecr=1359882098"
"59","0.136883","151.101.65.140","100.86.235.39","TCP","66","443  >  56383 [ACK] Seq=6618 Ack=15816 Win=534 Len=0 TSval=557107085 TSecr=1359882098"
"60","0.155598","100.86.235.39","151.101.65.140","TCP","1514","56383  >  443 [ACK] Seq=15816 Ack=6618 Win=2048 Len=1448 TSval=1359882127 TSecr=557107085 [TCP PDU reassembled in 62]"
"61","0.155600","100.86.235.39","151.101.65.140","TCP","1514","56383  >  443 [ACK] Seq=17264 Ack=6618 Win=2048 Len=1448 TSval=1359882127 TSecr=557107085 [TCP PDU reassembled in 62]"
"62","0.155646","100.86.235.39","151.101.65.140","TLSv1.2","105","Application Data"
"63","0.155754","100.86.235.39","151.101.65.140","TCP","1514","56383  >  443 [ACK] Seq=18751 Ack=6618 Win=2048 Len=1448 TSval=1359882127 TSecr=557107085 [TCP PDU reassembled in 67]"
"64","0.155756","100.86.235.39","151.101.65.140","TCP","1514","56383  >  443 [ACK] Seq=20199 Ack=6618 Win=2048 Len=1448 TSval=1359882127 TSecr=557107085 [TCP PDU reassembled in 67]"
"65","0.155757","100.86.235.39","151.101.65.140","TCP","1514","56383  >  443 [ACK] Seq=21647 Ack=6618 Win=2048 Len=1448 TSval=1359882127 TSecr=557107085 [TCP PDU reassembled in 67]"
"66","0.155759","100.86.235.39","151.101.65.140","TCP","1514","56383  >  443 [ACK] Seq=23095 Ack=6618 Win=2048 Len=1448 TSval=1359882127 TSecr=557107085 [TCP PDU reassembled in 67]"
"67","0.155775","100.86.235.39","151.101.65.140","TLSv1.2","486","Application Data"
"68","0.165548","151.101.65.140","100.86.235.39","TCP","66","443  >  56383 [ACK] Seq=6618 Ack=18751 Win=538 Len=0 TSval=557107114 TSecr=1359882127"
"69","0.166817","151.101.65.140","100.86.235.39","TCP","66","443  >  56383 [ACK] Seq=6618 Ack=24963 Win=526 Len=0 TSval=557107115 TSecr=1359882127"
"70","0.167051","100.86.235.39","151.101.65.140","TCP","1514","56383  >  443 [ACK] Seq=24963 Ack=6618 Win=2048 Len=1448 TSval=1359882138 TSecr=557107115 [TCP PDU reassembled in 72]"
"71","0.167053","100.86.235.39","151.101.65.140","TCP","1514","56383  >  443 [ACK] Seq=26411 Ack=6618 Win=2048 Len=1448 TSval=1359882138 TSecr=557107115 [TCP PDU reassembled in 72]"
"72","0.167104","100.86.235.39","151.101.65.140","TLSv1.2","82","Application Data"
"73","0.169654","151.101.65.140","100.86.235.39","TCP","1510","443  >  56383 [ACK] Seq=6618 Ack=24963 Win=538 Len=1444 TSval=557107118 TSecr=1359882127 [TCP PDU reassembled in 80]"
"74","0.169834","100.86.235.39","151.101.65.140","TCP","66","56383  >  443 [ACK] Seq=27875 Ack=8062 Win=2025 Len=0 TSval=1359882141 TSecr=557107118"
"75","0.171493","151.101.65.140","100.86.235.39","TCP","1510","443  >  56383 [PSH, ACK] Seq=8062 Ack=24963 Win=538 Len=1444 TSval=557107118 TSecr=1359882127 [TCP PDU reassembled in 80]"
"76","0.171496","151.101.65.140","100.86.235.39","TCP","1510","443  >  56383 [ACK] Seq=9506 Ack=24963 Win=538 Len=1444 TSval=557107118 TSecr=1359882127 [TCP PDU reassembled in 80]"
"77","0.171498","151.101.65.140","100.86.235.39","TCP","1510","443  >  56383 [PSH, ACK] Seq=10950 Ack=24963 Win=538 Len=1444 TSval=557107118 TSecr=1359882127 [TCP PDU reassembled in 80]"
"78","0.171670","100.86.235.39","151.101.65.140","TCP","66","56383  >  443 [ACK] Seq=27875 Ack=12394 Win=1980 Len=0 TSval=1359882143 TSecr=557107118"
"79","0.171864","100.86.235.39","151.101.65.140","TCP","66","[TCP Window Update] 56383  >  443 [ACK] Seq=27875 Ack=12394 Win=2048 Len=0 TSval=1359882143 TSecr=557107118"
"80","0.172116","151.101.65.140","100.86.235.39","TLSv1.2","559","Application Data"
"81","0.172215","100.86.235.39","151.101.65.140","TCP","66","56383  >  443 [ACK] Seq=27875 Ack=12887 Win=2048 Len=0 TSval=1359882143 TSecr=557107119"
"82","0.177269","151.101.65.140","100.86.235.39","TCP","66","443  >  56383 [ACK] Seq=12887 Ack=27875 Win=533 Len=0 TSval=557107126 TSecr=1359882138"
"83","0.186293","151.101.65.140","100.86.235.39","TCP","1510","443  >  56383 [ACK] Seq=12887 Ack=27875 Win=538 Len=1444 TSval=557107133 TSecr=1359882143 [TCP PDU reassembled in 85]"
"84","0.186375","100.86.235.39","151.101.65.140","TCP","66","56383  >  443 [ACK] Seq=27875 Ack=14331 Win=2025 Len=0 TSval=1359882158 TSecr=557107133"
"85","0.186823","151.101.65.140","100.86.235.39","TLSv1.2","1054","Application Data"
"86","0.186882","100.86.235.39","151.101.65.140","TCP","66","56383  >  443 [ACK] Seq=27875 Ack=15319 Win=2032 Len=0 TSval=1359882158 TSecr=557107133"
"87","0.191065","151.101.65.140","100.86.235.39","TCP","1510","443  >  56383 [ACK] Seq=15319 Ack=27875 Win=538 Len=1444 TSval=557107137 TSecr=1359882143 [TCP PDU reassembled in 88]"
"88","0.191553","151.101.65.140","100.86.235.39","TLSv1.2","375","Application Data"
"89","0.191554","151.101.65.140","100.86.235.39","TCP","1510","443  >  56383 [ACK] Seq=17072 Ack=27875 Win=538 Len=1444 TSval=557107139 TSecr=1359882143 [TCP PDU reassembled in 90]"
"90","0.191554","151.101.65.140","100.86.235.39","TLSv1.2","983","Application Data"
"91","0.191633","100.86.235.39","151.101.65.140","TCP","66","56383  >  443 [ACK] Seq=27875 Ack=19433 Win=2006 Len=0 TSval=1359882162 TSecr=557107137"
"92","0.201996","151.101.65.140","100.86.235.39","TCP","1510","443  >  56383 [ACK] Seq=19433 Ack=27875 Win=538 Len=1444 TSval=557107150 TSecr=1359882162 [TCP PDU reassembled in 93]"
"93","0.201998","151.101.65.140","100.86.235.39","TLSv1.2","291","Application Data"
"94","0.202075","100.86.235.39","151.101.65.140","TCP","66","56383  >  443 [ACK] Seq=27875 Ack=21102 Win=2021 Len=0 TSval=1359882173 TSecr=557107150"
"95","0.214419","151.101.65.140","100.86.235.39","TCP","1510","443  >  56383 [ACK] Seq=21102 Ack=27875 Win=538 Len=1444 TSval=557107162 TSecr=1359882173 [TCP PDU reassembled in 97]"
"96","0.214495","100.86.235.39","151.101.65.140","TCP","66","56383  >  443 [ACK] Seq=27875 Ack=22546 Win=2025 Len=0 TSval=1359882186 TSecr=557107162"
"97","0.214709","151.101.65.140","100.86.235.39","TLSv1.2","871","Application Data"
"98","0.214756","100.86.235.39","151.101.65.140","TCP","66","56383  >  443 [ACK] Seq=27875 Ack=23351 Win=2035 Len=0 TSval=1359882186 TSecr=557107162"
"99","0.242595","100.86.235.39","151.101.65.140","TCP","1514","56383  >  443 [ACK] Seq=27875 Ack=23351 Win=2048 Len=1448 TSval=1359882214 TSecr=557107162 [TCP PDU reassembled in 101]"
"100","0.242597","100.86.235.39","151.101.65.140","TCP","1514","56383  >  443 [ACK] Seq=29323 Ack=23351 Win=2048 Len=1448 TSval=1359882214 TSecr=557107162 [TCP PDU reassembled in 101]"
"101","0.242640","100.86.235.39","151.101.65.140","TLSv1.2","79","Application Data"
"102","0.252389","151.101.65.140","100.86.235.39","TCP","66","443  >  56383 [ACK] Seq=23351 Ack=30784 Win=533 Len=0 TSval=557107201 TSecr=1359882214"
"103","0.265703","100.86.235.39","151.101.65.140","TCP","1514","56383  >  443 [ACK] Seq=30784 Ack=23351 Win=2048 Len=1448 TSval=1359882237 TSecr=557107201 [TCP PDU reassembled in 104]"
"104","0.265783","100.86.235.39","151.101.65.140","TLSv1.2","1405","Application Data"
"105","0.272728","151.101.65.140","100.86.235.39","TCP","1510","443  >  56383 [ACK] Seq=23351 Ack=30784 Win=538 Len=1444 TSval=557107221 TSecr=1359882214 [TCP PDU reassembled in 106]"
"106","0.272729","151.101.65.140","100.86.235.39","TLSv1.2","301","Application Data"
"107","0.272730","151.101.65.140","100.86.235.39","TLSv1.2","99","Application Data"
"108","0.272805","100.86.235.39","151.101.65.140","TCP","66","56383  >  443 [ACK] Seq=33571 Ack=25063 Win=2021 Len=0 TSval=1359882244 TSecr=557107221"
"109","0.276369","151.101.65.140","100.86.235.39","TCP","66","443  >  56383 [ACK] Seq=25063 Ack=33571 Win=538 Len=0 TSval=557107224 TSecr=1359882237"
"110","0.330578","151.101.65.140","100.86.235.39","TCP","1510","443  >  56383 [ACK] Seq=25063 Ack=33571 Win=538 Len=1444 TSval=557107278 TSecr=1359882244 [TCP PDU reassembled in 112]"
"111","0.330648","100.86.235.39","151.101.65.140","TCP","66","56383  >  443 [ACK] Seq=33571 Ack=26507 Win=2025 Len=0 TSval=1359882302 TSecr=557107278"
"112","0.330726","151.101.65.140","100.86.235.39","TLSv1.2","973","Application Data"
"113","0.330773","100.86.235.39","151.101.65.140","TCP","66","56383  >  443 [ACK] Seq=33571 Ack=27414 Win=2048 Len=0 TSval=1359882302 TSecr=557107278"
"114","0.569746","100.86.235.39","151.101.65.140","TLSv1.2","167","Application Data"
"115","0.570400","100.86.235.39","151.101.65.140","TLSv1.2","167","Application Data"
"116","0.570643","100.86.235.39","151.101.65.140","TLSv1.2","242","Application Data"
"117","0.571225","100.86.235.39","151.101.1.140","TLSv1.2","176","Application Data"
"118","0.575445","100.86.235.39","151.101.1.140","TLSv1.2","172","Application Data"
"119","0.576891","100.86.235.39","151.101.1.140","TLSv1.2","169","Application Data"
"120","0.578085","100.86.235.39","151.101.1.140","TLSv1.2","165","Application Data"
"121","0.583876","100.86.235.39","151.101.65.140","TCP","1514","56383  >  443 [ACK] Seq=33571 Ack=27414 Win=2048 Len=1448 TSval=1359882555 TSecr=557107278 [TCP PDU reassembled in 122]"
"122","0.583976","100.86.235.39","151.101.65.140","TLSv1.2","1399","Application Data"
"123","0.584328","100.86.235.39","151.101.1.140","TLSv1.2","252","Application Data"
"124","0.584706","100.86.235.39","151.101.65.140","TCP","1514","56383  >  443 [ACK] Seq=36352 Ack=27414 Win=2048 Len=1448 TSval=1359882555 TSecr=557107278 [TCP PDU reassembled in 125]"
"125","0.584728","100.86.235.39","151.101.65.140","TLSv1.2","1414","Application Data"
"126","0.587065","151.101.65.140","100.86.235.39","TCP","66","443  >  56438 [ACK] Seq=1 Ack=203 Win=424 Len=0 TSval=3000672936 TSecr=3707508375"
"127","0.587068","151.101.65.140","100.86.235.39","TCP","66","443  >  56449 [ACK] Seq=1 Ack=177 Win=424 Len=0 TSval=867464531 TSecr=921758173"
"128","0.587069","151.101.1.140","100.86.235.39","TCP","66","443  >  56466 [ACK] Seq=12831 Ack=831 Win=325 Len=0 TSval=211754711 TSecr=2554203002"
"129","0.587557","100.86.235.39","151.101.1.140","TLSv1.2","185","Application Data"
"130","0.588262","151.101.1.140","100.86.235.39","TLSv1.2","1374","Application Data"
"131","0.588264","151.101.1.140","100.86.235.39","TLSv1.2","1037","Application Data"
"132","0.588326","151.101.65.140","100.86.235.39","TCP","1510","443  >  56438 [ACK] Seq=1 Ack=203 Win=424 Len=1444 TSval=3000672937 TSecr=3707508375 [TCP PDU reassembled in 151]"
"133","0.588327","151.101.65.140","100.86.235.39","TCP","1510","443  >  56438 [PSH, ACK] Seq=1445 Ack=203 Win=424 Len=1444 TSval=3000672937 TSecr=3707508375 [TCP PDU reassembled in 151]"
"134","0.588415","100.86.235.39","151.101.1.140","TCP","66","56466  >  443 [ACK] Seq=1235 Ack=15110 Win=4614 Len=0 TSval=2554203014 TSecr=211754712"
"135","0.588554","100.86.235.39","151.101.65.140","TCP","66","56438  >  443 [ACK] Seq=203 Ack=2889 Win=7817 Len=0 TSval=3707508394 TSecr=3000672937"
"136","0.588984","151.101.65.140","100.86.235.39","TCP","1510","443  >  56438 [ACK] Seq=2889 Ack=203 Win=424 Len=1444 TSval=3000672938 TSecr=3707508375 [TCP PDU reassembled in 151]"
"137","0.588985","151.101.65.140","100.86.235.39","TCP","1510","443  >  56438 [PSH, ACK] Seq=4333 Ack=203 Win=424 Len=1444 TSval=3000672938 TSecr=3707508375 [TCP PDU reassembled in 151]"
"138","0.589050","100.86.235.39","151.101.65.140","TCP","66","56438  >  443 [ACK] Seq=203 Ack=5777 Win=7817 Len=0 TSval=3707508394 TSecr=3000672938"
"139","0.590022","151.101.1.140","100.86.235.39","TCP","66","443  >  56466 [ACK] Seq=15110 Ack=930 Win=325 Len=0 TSval=211754713 TSecr=2554203003"
"140","0.592634","151.101.1.140","100.86.235.39","TLSv1.2","315","Application Data"
"141","0.592635","151.101.65.140","100.86.235.39","TCP","1510","443  >  56438 [ACK] Seq=5777 Ack=203 Win=424 Len=1444 TSval=3000672939 TSecr=3707508375 [TCP PDU reassembled in 151]"
"142","0.592635","151.101.65.140","100.86.235.39","TCP","1510","443  >  56438 [PSH, ACK] Seq=7221 Ack=203 Win=424 Len=1444 TSval=3000672939 TSecr=3707508375 [TCP PDU reassembled in 151]"
"143","0.592637","151.101.65.140","100.86.235.39","TCP","1510","443  >  56438 [ACK] Seq=8665 Ack=203 Win=424 Len=1444 TSval=3000672940 TSecr=3707508375 [TCP PDU reassembled in 151]"
"144","0.592637","151.101.65.140","100.86.235.39","TCP","1510","443  >  56438 [PSH, ACK] Seq=10109 Ack=203 Win=424 Len=1444 TSval=3000672940 TSecr=3707508375 [TCP PDU reassembled in 151]"
"145","0.592640","151.101.65.140","100.86.235.39","TCP","1510","443  >  56438 [ACK] Seq=11553 Ack=203 Win=424 Len=1444 TSval=3000672942 TSecr=3707508375 [TCP PDU reassembled in 151]"
"146","0.592730","100.86.235.39","151.101.1.140","TCP","66","56466  >  443 [ACK] Seq=1235 Ack=15359 Win=4645 Len=0 TSval=2554203018 TSecr=211754714"
"147","0.592792","100.86.235.39","151.101.1.140","TLSv1.2","169","Application Data"
"148","0.592811","100.86.235.39","151.101.65.140","TCP","66","56438  >  443 [ACK] Seq=203 Ack=12997 Win=7749 Len=0 TSval=3707508398 TSecr=3000672942"
"149","0.593107","100.86.235.39","151.101.65.140","TCP","66","[TCP Window Update] 56438  >  443 [ACK] Seq=203 Ack=12997 Win=7862 Len=0 TSval=3707508398 TSecr=3000672942"
"150","0.593579","151.101.65.140","100.86.235.39","TCP","1510","443  >  56438 [PSH, ACK] Seq=12997 Ack=203 Win=424 Len=1444 TSval=3000672942 TSecr=3707508375 [TCP PDU reassembled in 151]"
"151","0.593580","151.101.65.140","100.86.235.39","TLSv1.2","1510","Application Data"
"152","0.594157","100.86.235.39","151.101.65.140","TCP","66","56438  >  443 [ACK] Seq=203 Ack=15885 Win=7817 Len=0 TSval=3707508398 TSecr=3000672943"
"153","0.594184","151.101.65.140","100.86.235.39","TCP","1510","443  >  56438 [PSH, ACK] Seq=15885 Ack=203 Win=424 Len=1444 TSval=3000672943 TSecr=3707508375 [TCP PDU reassembled in 187]"
"154","0.594185","151.101.65.140","100.86.235.39","TCP","66","443  >  56383 [ACK] Seq=27414 Ack=36352 Win=534 Len=0 TSval=557107542 TSecr=1359882555"
"155","0.594237","100.86.235.39","151.101.65.140","TCP","66","56438  >  443 [ACK] Seq=203 Ack=17329 Win=7840 Len=0 TSval=3707508399 TSecr=3000672943"
"156","0.594425","151.101.65.140","100.86.235.39","TCP","66","443  >  56383 [ACK] Seq=27414 Ack=39148 Win=538 Len=0 TSval=557107543 TSecr=1359882555"
"157","0.595305","151.101.65.140","100.86.235.39","TCP","1510","443  >  56438 [ACK] Seq=17329 Ack=203 Win=424 Len=1444 TSval=3000672944 TSecr=3707508375 [TCP PDU reassembled in 187]"
"158","0.595306","151.101.65.140","100.86.235.39","TCP","1510","443  >  56438 [PSH, ACK] Seq=18773 Ack=203 Win=424 Len=1444 TSval=3000672944 TSecr=3707508375 [TCP PDU reassembled in 187]"
"159","0.595307","151.101.1.140","100.86.235.39","TCP","66","443  >  56466 [ACK] Seq=15359 Ack=1116 Win=330 Len=0 TSval=211754719 TSecr=2554203009"
"160","0.595403","100.86.235.39","151.101.65.140","TCP","66","56438  >  443 [ACK] Seq=203 Ack=20217 Win=7817 Len=0 TSval=3707508401 TSecr=3000672944"
"161","0.596558","151.101.1.140","100.86.235.39","TLSv1.2","172","Application Data"
"162","0.596559","151.101.1.140","100.86.235.39","TCP","1510","443  >  56466 [ACK] Seq=15465 Ack=1116 Win=330 Len=1444 TSval=211754720 TSecr=2554203009 [TCP PDU reassembled in 165]"
"163","0.596644","100.86.235.39","151.101.1.140","TCP","66","56466  >  443 [ACK] Seq=1338 Ack=16909 Win=4625 Len=0 TSval=2554203022 TSecr=211754720"
"164","0.597981","100.86.235.39","151.101.1.140","TLSv1.2","160","Application Data"
"165","0.599389","151.101.1.140","100.86.235.39","TLSv1.2","433","Application Data"
"166","0.599431","151.101.1.140","100.86.235.39","TCP","66","443  >  56466 [ACK] Seq=17276 Ack=1235 Win=330 Len=0 TSval=211754723 TSecr=2554203012"
"167","0.599489","100.86.235.39","151.101.1.140","TCP","66","56466  >  443 [ACK] Seq=1432 Ack=17276 Win=4644 Len=0 TSval=2554203025 TSecr=211754720"
"168","0.600321","151.101.65.140","100.86.235.39","TCP","1510","443  >  56438 [ACK] Seq=20217 Ack=203 Win=424 Len=1444 TSval=3000672948 TSecr=3707508394 [TCP PDU reassembled in 187]"
"169","0.600322","151.101.65.140","100.86.235.39","TCP","1510","443  >  56438 [PSH, ACK] Seq=21661 Ack=203 Win=424 Len=1444 TSval=3000672948 TSecr=3707508394 [TCP PDU reassembled in 187]"
"170","0.600392","100.86.235.39","151.101.65.140","TCP","66","56438  >  443 [ACK] Seq=203 Ack=23105 Win=7817 Len=0 TSval=3707508405 TSecr=3000672948"
"171","0.600425","151.101.1.140","100.86.235.39","TCP","1510","443  >  56466 [ACK] Seq=17276 Ack=1235 Win=330 Len=1444 TSval=211754723 TSecr=2554203014 [TCP PDU reassembled in 176]"
"172","0.600426","151.101.1.140","100.86.235.39","TCP","1510","443  >  56466 [ACK] Seq=18720 Ack=1235 Win=330 Len=1444 TSval=211754723 TSecr=2554203014 [TCP PDU reassembled in 176]"
"173","0.600468","100.86.235.39","151.101.1.140","TCP","66","56466  >  443 [ACK] Seq=1432 Ack=20164 Win=4604 Len=0 TSval=2554203026 TSecr=211754723"
"174","0.601871","151.101.1.140","100.86.235.39","TCP","1510","443  >  56466 [ACK] Seq=20164 Ack=1235 Win=330 Len=1444 TSval=211754723 TSecr=2554203014 [TCP PDU reassembled in 176]"
"175","0.601872","151.101.1.140","100.86.235.39","TCP","1510","443  >  56466 [ACK] Seq=21608 Ack=1235 Win=330 Len=1444 TSval=211754723 TSecr=2554203014 [TCP PDU reassembled in 176]"
"176","0.601873","151.101.1.140","100.86.235.39","TLSv1.2","101","Application Data"
"177","0.601874","151.101.65.140","100.86.235.39","TCP","1510","443  >  56438 [ACK] Seq=23105 Ack=203 Win=424 Len=1444 TSval=3000672948 TSecr=3707508394 [TCP PDU reassembled in 187]"
"178","0.601874","151.101.65.140","100.86.235.39","TCP","1510","443  >  56438 [PSH, ACK] Seq=24549 Ack=203 Win=424 Len=1444 TSval=3000672948 TSecr=3707508394 [TCP PDU reassembled in 187]"
"179","0.601961","100.86.235.39","151.101.1.140","TCP","66","56466  >  443 [ACK] Seq=1432 Ack=23087 Win=4604 Len=0 TSval=2554203027 TSecr=211754723"
"180","0.602018","100.86.235.39","151.101.1.140","TCP","66","[TCP Window Update] 56466  >  443 [ACK] Seq=1432 Ack=23087 Win=4649 Len=0 TSval=2554203027 TSecr=211754723"
"181","0.602036","100.86.235.39","151.101.65.140","TCP","66","56438  >  443 [ACK] Seq=203 Ack=25993 Win=7817 Len=0 TSval=3707508407 TSecr=3000672948"
"182","0.604426","151.101.1.140","100.86.235.39","TCP","66","443  >  56466 [ACK] Seq=23087 Ack=1338 Win=330 Len=0 TSval=211754729 TSecr=2554203018"
"183","0.604818","151.101.65.140","100.86.235.39","TCP","1510","443  >  56438 [ACK] Seq=25993 Ack=203 Win=424 Len=1444 TSval=3000672954 TSecr=3707508398 [TCP PDU reassembled in 187]"
"184","0.604818","151.101.65.140","100.86.235.39","TCP","1510","443  >  56438 [PSH, ACK] Seq=27437 Ack=203 Win=424 Len=1444 TSval=3000672954 TSecr=3707508398 [TCP PDU reassembled in 187]"
"185","0.604892","100.86.235.39","151.101.65.140","TCP","66","56438  >  443 [ACK] Seq=203 Ack=28881 Win=7817 Len=0 TSval=3707508410 TSecr=3000672954"
"186","0.605282","100.86.235.39","151.101.1.140","TLSv1.2","164","Application Data"
"187","0.605530","151.101.65.140","100.86.235.39","TLSv1.2","1510","Application Data, Application Data"
"188","0.605531","151.101.65.140","100.86.235.39","TCP","1510","443  >  56438 [PSH, ACK] Seq=30325 Ack=203 Win=424 Len=1444 TSval=3000672954 TSecr=3707508398 [TCP PDU reassembled in 216]"
"189","0.605532","151.101.1.140","100.86.235.39","TLSv1.2","170","Application Data"
"190","0.605532","151.101.1.140","100.86.235.39","TLSv1.2","1060","Application Data"
"191","0.605609","100.86.235.39","151.101.1.140","TCP","66","56466  >  443 [ACK] Seq=1530 Ack=24185 Win=4632 Len=0 TSval=2554203031 TSecr=211754729"
"192","0.605650","100.86.235.39","151.101.65.140","TCP","66","56438  >  443 [ACK] Seq=203 Ack=31769 Win=7817 Len=0 TSval=3707508411 TSecr=3000672954"
"193","0.606306","151.101.65.140","100.86.235.39","TCP","1510","443  >  56438 [ACK] Seq=31769 Ack=203 Win=424 Len=1444 TSval=3000672956 TSecr=3707508399 [TCP PDU reassembled in 216]"
"194","0.606372","100.86.235.39","151.101.65.140","TCP","66","56438  >  443 [ACK] Seq=203 Ack=33213 Win=7840 Len=0 TSval=3707508411 TSecr=3000672956"
"195","0.606687","151.101.65.140","100.86.235.39","TCP","1510","443  >  56438 [PSH, ACK] Seq=33213 Ack=203 Win=424 Len=1444 TSval=3000672956 TSecr=3707508399 [TCP PDU reassembled in 216]"
"196","0.606736","100.86.235.39","151.101.65.140","TCP","66","56438  >  443 [ACK] Seq=203 Ack=34657 Win=7840 Len=0 TSval=3707508412 TSecr=3000672956"
"197","0.607821","151.101.65.140","100.86.235.39","TCP","1510","443  >  56438 [ACK] Seq=34657 Ack=203 Win=424 Len=1444 TSval=3000672957 TSecr=3707508399 [TCP PDU reassembled in 216]"
"198","0.607889","100.86.235.39","151.101.65.140","TCP","66","56438  >  443 [ACK] Seq=203 Ack=36101 Win=7840 Len=0 TSval=3707508413 TSecr=3000672957"
"199","0.608783","151.101.65.140","100.86.235.39","TCP","1510","443  >  56438 [PSH, ACK] Seq=36101 Ack=203 Win=424 Len=1444 TSval=3000672957 TSecr=3707508399 [TCP PDU reassembled in 216]"
"200","0.608843","100.86.235.39","151.101.65.140","TCP","66","56438  >  443 [ACK] Seq=203 Ack=37545 Win=7840 Len=0 TSval=3707508413 TSecr=3000672957"
"201","0.609173","100.86.235.39","151.101.1.140","TLSv1.2","160","Application Data"
"202","0.609368","151.101.65.140","100.86.235.39","TCP","1510","443  >  56438 [ACK] Seq=37545 Ack=203 Win=424 Len=1444 TSval=3000672958 TSecr=3707508401 [TCP PDU reassembled in 216]"
"203","0.609368","151.101.65.140","100.86.235.39","TCP","1510","443  >  56438 [PSH, ACK] Seq=38989 Ack=203 Win=424 Len=1444 TSval=3000672958 TSecr=3707508401 [TCP PDU reassembled in 216]"
"204","0.609416","100.86.235.39","151.101.65.140","TCP","66","56438  >  443 [ACK] Seq=203 Ack=40433 Win=7817 Len=0 TSval=3707508414 TSecr=3000672958"
"205","0.610171","100.86.235.39","151.101.1.140","TLSv1.2","160","Application Data"
"206","0.610943","151.101.1.140","100.86.235.39","TCP","66","443  >  56466 [ACK] Seq=24185 Ack=1432 Win=330 Len=0 TSval=211754735 TSecr=2554203025"
"207","0.610944","151.101.65.140","100.86.235.39","TCP","1510","443  >  56438 [ACK] Seq=40433 Ack=203 Win=424 Len=1444 TSval=3000672960 TSecr=3707508405 [TCP PDU reassembled in 216]"
"208","0.610945","151.101.65.140","100.86.235.39","TCP","1510","443  >  56438 [PSH, ACK] Seq=41877 Ack=203 Win=424 Len=1444 TSval=3000672960 TSecr=3707508405 [TCP PDU reassembled in 216]"
"209","0.611023","100.86.235.39","151.101.65.140","TCP","66","56438  >  443 [ACK] Seq=203 Ack=43321 Win=7817 Len=0 TSval=3707508415 TSecr=3000672960"
"210","0.611516","151.101.1.140","100.86.235.39","TLSv1.2","838","Application Data"
"211","0.611517","151.101.65.140","100.86.235.39","TCP","1510","443  >  56438 [ACK] Seq=43321 Ack=203 Win=424 Len=1444 TSval=3000672961 TSecr=3707508407 [TCP PDU reassembled in 216]"
"212","0.611581","100.86.235.39","151.101.1.140","TCP","66","56466  >  443 [ACK] Seq=1718 Ack=24957 Win=4637 Len=0 TSval=2554203037 TSecr=211754735"
"213","0.611648","100.86.235.39","151.101.65.140","TCP","66","56438  >  443 [ACK] Seq=203 Ack=44765 Win=7840 Len=0 TSval=3707508417 TSecr=3000672961"
"214","0.611728","151.101.65.140","100.86.235.39","TCP","1510","443  >  56438 [PSH, ACK] Seq=44765 Ack=203 Win=424 Len=1444 TSval=3000672961 TSecr=3707508407 [TCP PDU reassembled in 216]"
"215","0.611925","100.86.235.39","151.101.65.140","TCP","66","56438  >  443 [ACK] Seq=203 Ack=46209 Win=7862 Len=0 TSval=3707508417 TSecr=3000672961"
"216","0.615701","151.101.65.140","100.86.235.39","TLSv1.2","1510","Application Data"
"217","0.615702","151.101.65.140","100.86.235.39","TCP","1510","443  >  56438 [PSH, ACK] Seq=47653 Ack=203 Win=424 Len=1444 TSval=3000672965 TSecr=3707508411 [TCP PDU reassembled in 225]"
"218","0.615703","151.101.1.140","100.86.235.39","TCP","66","443  >  56466 [ACK] Seq=24957 Ack=1530 Win=330 Len=0 TSval=211754740 TSecr=2554203031"
"219","0.615887","151.101.1.140","100.86.235.39","TLSv1.2","147","Application Data"
"220","0.615888","151.101.1.140","100.86.235.39","TCP","1510","443  >  56466 [ACK] Seq=25038 Ack=1530 Win=330 Len=1444 TSval=211754741 TSecr=2554203031 [TCP PDU reassembled in 224]"
"221","0.615942","100.86.235.39","151.101.65.140","TCP","66","56438  >  443 [ACK] Seq=203 Ack=49097 Win=7862 Len=0 TSval=3707508421 TSecr=3000672965"
"222","0.615943","100.86.235.39","151.101.1.140","TCP","66","56466  >  443 [ACK] Seq=1718 Ack=26482 Win=4626 Len=0 TSval=2554203041 TSecr=211754741"
"223","0.616251","100.86.235.39","151.101.1.140","TLSv1.2","156","Application Data"
"224","0.616467","151.101.1.140","100.86.235.39","TLSv1.2","1173","Application Data"
"225","0.616467","151.101.65.140","100.86.235.39","TLSv1.2","394","Application Data"
"226","0.616518","100.86.235.39","151.101.1.140","TCP","66","56466  >  443 [ACK] Seq=1808 Ack=27589 Win=4632 Len=0 TSval=2554203041 TSecr=211754741"
"227","0.616573","100.86.235.39","151.101.65.140","TCP","66","56438  >  443 [ACK] Seq=203 Ack=49425 Win=7862 Len=0 TSval=3707508421 TSecr=3000672966"
"228","0.618564","100.86.235.39","151.101.1.140","TLSv1.2","161","Application Data"
"229","0.618709","151.101.1.140","100.86.235.39","TCP","66","443  >  56466 [ACK] Seq=27589 Ack=1624 Win=330 Len=0 TSval=211754743 TSecr=2554203034"
"230","0.618845","151.101.1.140","100.86.235.39","TLSv1.2","648","Application Data"
"231","0.618846","151.101.1.140","100.86.235.39","TLSv1.2","785","Application Data"
"232","0.618889","100.86.235.39","151.101.1.140","TCP","66","56466  >  443 [ACK] Seq=1903 Ack=28890 Win=4629 Len=0 TSval=2554203044 TSecr=211754743"
"233","0.620074","151.101.65.140","100.86.235.39","TCP","1510","443  >  56383 [ACK] Seq=27414 Ack=39148 Win=538 Len=1444 TSval=557107568 TSecr=1359882555 [TCP PDU reassembled in 235]"
"234","0.620149","100.86.235.39","151.101.65.140","TCP","66","56383  >  443 [ACK] Seq=39148 Ack=28858 Win=2025 Len=0 TSval=1359882591 TSecr=557107568"
"235","0.620266","151.101.65.140","100.86.235.39","TLSv1.2","276","Application Data"
"236","0.620267","151.101.65.140","100.86.235.39","TLSv1.2","112","Application Data"
"237","0.620306","100.86.235.39","151.101.65.140","TCP","66","56383  >  443 [ACK] Seq=39148 Ack=29114 Win=2044 Len=0 TSval=1359882591 TSecr=557107568"
"238","0.620538","151.101.1.140","100.86.235.39","TCP","66","443  >  56466 [ACK] Seq=28890 Ack=1718 Win=330 Len=0 TSval=211754745 TSecr=2554203037"
"239","0.621377","100.86.235.39","151.101.1.140","TLSv1.2","157","Application Data"
"240","0.621917","151.101.1.140","100.86.235.39","TLSv1.2","1112","Application Data"
"241","0.621989","100.86.235.39","151.101.1.140","TCP","66","56466  >  443 [ACK] Seq=1994 Ack=29936 Win=4633 Len=0 TSval=2554203047 TSecr=211754746"
"242","0.622130","151.101.65.140","100.86.235.39","TCP","1510","443  >  56383 [ACK] Seq=29114 Ack=39148 Win=538 Len=1444 TSval=557107570 TSecr=1359882555 [TCP PDU reassembled in 243]"
"243","0.622131","151.101.65.140","100.86.235.39","TLSv1.2","908","Application Data"
"244","0.622188","100.86.235.39","151.101.65.140","TCP","66","56383  >  443 [ACK] Seq=39148 Ack=31400 Win=2012 Len=0 TSval=1359882593 TSecr=557107570"
"245","0.623535","100.86.235.39","151.101.1.140","TLSv1.2","166","Application Data"
"246","0.625914","151.101.1.140","100.86.235.39","TCP","66","443  >  56466 [ACK] Seq=29936 Ack=1808 Win=330 Len=0 TSval=211754750 TSecr=2554203041"
"247","0.626133","100.86.235.39","151.101.1.140","TLSv1.2","182","Application Data"
"248","0.626662","151.101.1.140","100.86.235.39","TLSv1.2","556","Application Data"
"249","0.626749","100.86.235.39","151.101.1.140","TCP","66","56466  >  443 [ACK] Seq=2210 Ack=30426 Win=4642 Len=0 TSval=2554203051 TSecr=211754751"
"250","0.626786","100.86.235.39","151.101.1.140","TLSv1.2","156","Application Data"
"251","0.626910","151.101.65.140","100.86.235.39","TLSv1.2","112","Application Data"
"252","0.626959","100.86.235.39","151.101.65.140","TCP","66","56383  >  443 [ACK] Seq=39148 Ack=31446 Win=2047 Len=0 TSval=1359882597 TSecr=557107575"
"253","0.627326","100.86.235.39","151.101.1.140","TLSv1.2","157","Application Data"
"254","0.629185","100.86.235.39","151.101.1.140","TLSv1.2","162","Application Data"
"255","0.629734","151.101.1.140","100.86.235.39","TCP","66","443  >  56466 [ACK] Seq=30426 Ack=1903 Win=330 Len=0 TSval=211754754 TSecr=2554203044"
"256","0.629923","151.101.1.140","100.86.235.39","TCP","1510","443  >  56466 [ACK] Seq=30426 Ack=1903 Win=330 Len=1444 TSval=211754755 TSecr=2554203044 [TCP PDU reassembled in 257]"
"257","0.629924","151.101.1.140","100.86.235.39","TLSv1.2","357","Application Data"
"258","0.629989","100.86.235.39","151.101.1.140","TCP","66","56466  >  443 [ACK] Seq=2487 Ack=32161 Win=4622 Len=0 TSval=2554203054 TSecr=211754755"
"259","0.631260","100.86.235.39","151.101.1.140","TLSv1.2","173","Application Data"
"260","0.632051","151.101.1.140","100.86.235.39","TCP","66","443  >  56466 [ACK] Seq=32161 Ack=1994 Win=330 Len=0 TSval=211754757 TSecr=2554203047"
"261","0.632249","151.101.1.140","100.86.235.39","TCP","1510","443  >  56466 [ACK] Seq=32161 Ack=1994 Win=330 Len=1444 TSval=211754757 TSecr=2554203047 [TCP PDU reassembled in 262]"
"262","0.632250","151.101.1.140","100.86.235.39","TLSv1.2","290","Application Data"
"263","0.632318","100.86.235.39","151.101.1.140","TCP","66","56466  >  443 [ACK] Seq=2594 Ack=33829 Win=4623 Len=0 TSval=2554203058 TSecr=211754757"
"264","0.632396","151.101.1.140","100.86.235.39","TCP","66","443  >  56466 [ACK] Seq=33829 Ack=2094 Win=330 Len=0 TSval=211754758 TSecr=2554203049"
"265","0.633307","151.101.1.140","100.86.235.39","TLSv1.2","1151","Application Data"
"266","0.633381","100.86.235.39","151.101.1.140","TCP","66","56466  >  443 [ACK] Seq=2594 Ack=34914 Win=4632 Len=0 TSval=2554203059 TSecr=211754758"
"267","0.634009","100.86.235.39","151.101.1.140","TLSv1.2","155","Application Data"
"268","0.636335","151.101.1.140","100.86.235.39","TCP","66","443  >  56466 [ACK] Seq=34914 Ack=2300 Win=330 Len=0 TSval=211754760 TSecr=2554203051"
"269","0.636969","100.86.235.39","151.101.1.140","TLSv1.2","165","Application Data"
"270","0.636996","151.101.1.140","100.86.235.39","TLSv1.2","171","Application Data"
"271","0.636997","151.101.1.140","100.86.235.39","TCP","1510","443  >  56466 [ACK] Seq=35019 Ack=2300 Win=330 Len=1444 TSval=211754761 TSecr=2554203051 [TCP PDU reassembled in 278]"
"272","0.636998","151.101.1.140","100.86.235.39","TCP","1510","443  >  56466 [ACK] Seq=36463 Ack=2300 Win=330 Len=1444 TSval=211754761 TSecr=2554203051 [TCP PDU reassembled in 278]"
"273","0.637135","151.101.1.140","100.86.235.39","TCP","1510","443  >  56466 [ACK] Seq=37907 Ack=2300 Win=330 Len=1444 TSval=211754761 TSecr=2554203051 [TCP PDU reassembled in 278]"
"274","0.637136","151.101.1.140","100.86.235.39","TCP","1510","443  >  56466 [ACK] Seq=39351 Ack=2300 Win=330 Len=1444 TSval=211754761 TSecr=2554203051 [TCP PDU reassembled in 278]"
"275","0.637307","100.86.235.39","151.101.1.140","TCP","66","56466  >  443 [ACK] Seq=2782 Ack=40795 Win=4649 Len=0 TSval=2554203062 TSecr=211754761"
"276","0.637461","100.86.235.39","151.101.1.140","TLSv1.2","158","Application Data"
"277","0.637602","151.101.1.140","100.86.235.39","TCP","1510","443  >  56466 [ACK] Seq=40795 Ack=2300 Win=330 Len=1444 TSval=211754761 TSecr=2554203051 [TCP PDU reassembled in 278]"
"278","0.637603","151.101.1.140","100.86.235.39","TLSv1.2","1211","Application Data"
"279","0.637603","151.101.1.140","100.86.235.39","TCP","66","443  >  56466 [ACK] Seq=43384 Ack=2391 Win=330 Len=0 TSval=211754762 TSecr=2554203052"
"280","0.637674","100.86.235.39","151.101.1.140","TCP","66","56466  >  443 [ACK] Seq=2874 Ack=43384 Win=4649 Len=0 TSval=2554203063 TSecr=211754761"
"281","0.638463","151.101.1.140","100.86.235.39","TLSv1.2","718","Application Data"
"282","0.638465","151.101.1.140","100.86.235.39","TCP","66","443  >  56466 [ACK] Seq=44036 Ack=2487 Win=330 Len=0 TSval=211754763 TSecr=2554203054"
"283","0.638510","100.86.235.39","151.101.1.140","TLSv1.2","173","Application Data"
"284","0.638596","100.86.235.39","151.101.1.140","TCP","66","56466  >  443 [ACK] Seq=2981 Ack=44036 Win=4649 Len=0 TSval=2554203064 TSecr=211754762"
"285","0.639288","151.101.1.140","100.86.235.39","TLSv1.2","1205","Application Data"
"286","0.639387","100.86.235.39","151.101.1.140","TCP","66","56466  >  443 [ACK] Seq=2981 Ack=45175 Win=4649 Len=0 TSval=2554203064 TSecr=211754764"
"287","0.640702","100.86.235.39","151.101.1.140","TLSv1.2","167","Application Data"
"288","0.640887","151.101.1.140","100.86.235.39","TCP","66","443  >  56466 [ACK] Seq=45175 Ack=2594 Win=330 Len=0 TSval=211754766 TSecr=2554203056"
"289","0.641862","151.101.1.140","100.86.235.39","TCP","1510","443  >  56466 [ACK] Seq=45175 Ack=2594 Win=330 Len=1444 TSval=211754766 TSecr=2554203056 [TCP PDU reassembled in 293]"
"290","0.641863","151.101.1.140","100.86.235.39","TCP","1510","443  >  56466 [ACK] Seq=46619 Ack=2594 Win=330 Len=1444 TSval=211754766 TSecr=2554203056 [TCP PDU reassembled in 293]"
"291","0.641884","151.101.1.140","100.86.235.39","TCP","1510","443  >  56466 [ACK] Seq=48063 Ack=2594 Win=330 Len=1444 TSval=211754766 TSecr=2554203056 [TCP PDU reassembled in 293]"
"292","0.641957","100.86.235.39","151.101.1.140","TCP","66","56466  >  443 [ACK] Seq=3082 Ack=49507 Win=4649 Len=0 TSval=2554203067 TSecr=211754766"
"293","0.642478","151.101.1.140","100.86.235.39","TLSv1.2","1364","Application Data"
"294","0.642565","100.86.235.39","151.101.1.140","TCP","66","56466  >  443 [ACK] Seq=3082 Ack=50805 Win=4649 Len=0 TSval=2554203067 TSecr=211754766"
"295","0.643454","151.101.1.140","100.86.235.39","TCP","66","443  >  56466 [ACK] Seq=50805 Ack=2683 Win=330 Len=0 TSval=211754768 TSecr=2554203059"
"296","0.644373","151.101.1.140","100.86.235.39","TLSv1.2","147","Application Data"
"297","0.644489","100.86.235.39","151.101.1.140","TCP","66","56466  >  443 [ACK] Seq=3082 Ack=50886 Win=4649 Len=0 TSval=2554203069 TSecr=211754769"
"298","0.645149","151.101.1.140","100.86.235.39","TCP","1510","443  >  56466 [ACK] Seq=50886 Ack=2683 Win=330 Len=1444 TSval=211754769 TSecr=2554203059 [TCP PDU reassembled in 299]"
"299","0.645150","151.101.1.140","100.86.235.39","TLSv1.2","100","Application Data"
"300","0.645250","100.86.235.39","151.101.1.140","TCP","66","56466  >  443 [ACK] Seq=3082 Ack=52364 Win=4649 Len=0 TSval=2554203070 TSecr=211754769"
"301","0.646179","151.101.1.140","100.86.235.39","TCP","66","443  >  56466 [ACK] Seq=52364 Ack=2782 Win=330 Len=0 TSval=211754771 TSecr=2554203062"
"302","0.646977","100.86.235.39","151.101.1.140","TLSv1.2","218","Application Data"
"303","0.647107","151.101.1.140","100.86.235.39","TLSv1.2","651","Application Data"
"304","0.647108","151.101.1.140","100.86.235.39","TCP","1510","443  >  56466 [ACK] Seq=52949 Ack=2782 Win=330 Len=1444 TSval=211754771 TSecr=2554203062 [TCP PDU reassembled in 308]"
"305","0.647109","151.101.1.140","100.86.235.39","TCP","1510","443  >  56466 [ACK] Seq=54393 Ack=2782 Win=330 Len=1444 TSval=211754771 TSecr=2554203062 [TCP PDU reassembled in 308]"
"306","0.647414","100.86.235.39","151.101.1.140","TCP","66","56466  >  443 [ACK] Seq=3234 Ack=55837 Win=4649 Len=0 TSval=2554203073 TSecr=211754771"
"307","0.648135","151.101.1.140","100.86.235.39","TCP","1510","443  >  56466 [ACK] Seq=55837 Ack=2782 Win=330 Len=1444 TSval=211754771 TSecr=2554203062 [TCP PDU reassembled in 308]"
"308","0.648136","151.101.1.140","100.86.235.39","TLSv1.2","1091","Application Data"
"309","0.648235","100.86.235.39","151.101.1.140","TCP","66","56466  >  443 [ACK] Seq=3234 Ack=58306 Win=4649 Len=0 TSval=2554203073 TSecr=211754771"
"310","0.650142","151.101.1.140","100.86.235.39","TLSv1.2","1127","Application Data"
"311","0.650143","151.101.1.140","100.86.235.39","TLSv1.2","148","Application Data"
"312","0.650143","151.101.1.140","100.86.235.39","TCP","1510","443  >  56466 [ACK] Seq=59449 Ack=2981 Win=330 Len=1444 TSval=211754773 TSecr=2554203064 [TCP PDU reassembled in 326]"
"313","0.650144","151.101.1.140","100.86.235.39","TCP","1510","443  >  56466 [ACK] Seq=60893 Ack=2981 Win=330 Len=1444 TSval=211754773 TSecr=2554203064 [TCP PDU reassembled in 326]"
"314","0.650145","151.101.1.140","100.86.235.39","TCP","1510","443  >  56466 [ACK] Seq=62337 Ack=2981 Win=330 Len=1444 TSval=211754773 TSecr=2554203064 [TCP PDU reassembled in 326]"
"315","0.650145","151.101.1.140","100.86.235.39","TCP","1510","443  >  56466 [ACK] Seq=63781 Ack=2981 Win=330 Len=1444 TSval=211754773 TSecr=2554203064 [TCP PDU reassembled in 326]"
"316","0.650147","151.101.1.140","100.86.235.39","TCP","1510","443  >  56466 [ACK] Seq=65225 Ack=2981 Win=330 Len=1444 TSval=211754773 TSecr=2554203064 [TCP PDU reassembled in 326]"
"317","0.650148","151.101.1.140","100.86.235.39","TCP","1510","443  >  56466 [ACK] Seq=66669 Ack=2981 Win=330 Len=1444 TSval=211754773 TSecr=2554203064 [TCP PDU reassembled in 326]"
"318","0.650148","151.101.1.140","100.86.235.39","TCP","1510","443  >  56466 [PSH, ACK] Seq=68113 Ack=2981 Win=330 Len=1444 TSval=211754773 TSecr=2554203064 [TCP PDU reassembled in 326]"
"319","0.650149","151.101.1.140","100.86.235.39","TCP","1510","443  >  56466 [ACK] Seq=69557 Ack=2981 Win=330 Len=1444 TSval=211754774 TSecr=2554203064 [TCP PDU reassembled in 326]"
"320","0.650241","100.86.235.39","151.101.1.140","TCP","66","56466  >  443 [ACK] Seq=3234 Ack=59367 Win=4633 Len=0 TSval=2554203075 TSecr=211754772"
"321","0.650677","100.86.235.39","151.101.1.140","TCP","66","56466  >  443 [ACK] Seq=3234 Ack=71001 Win=4649 Len=0 TSval=2554203075 TSecr=211754774"
"322","0.650987","100.86.235.39","151.101.1.140","TLSv1.2","169","Application Data"
"323","0.651201","151.101.1.140","100.86.235.39","TCP","1510","443  >  56466 [ACK] Seq=71001 Ack=2981 Win=330 Len=1444 TSval=211754774 TSecr=2554203064 [TCP PDU reassembled in 326]"
"324","0.651202","151.101.1.140","100.86.235.39","TCP","1510","443  >  56466 [ACK] Seq=72445 Ack=2981 Win=330 Len=1444 TSval=211754774 TSecr=2554203064 [TCP PDU reassembled in 326]"
"325","0.651203","151.101.1.140","100.86.235.39","TCP","1510","443  >  56466 [ACK] Seq=73889 Ack=2981 Win=330 Len=1444 TSval=211754774 TSecr=2554203064 [TCP PDU reassembled in 326]"
"326","0.651203","151.101.1.140","100.86.235.39","TLSv1.2","1510","Application Data"
"327","0.651353","151.101.1.140","100.86.235.39","TCP","1510","443  >  56466 [ACK] Seq=76777 Ack=2981 Win=330 Len=1444 TSval=211754774 TSecr=2554203064 [TCP PDU reassembled in 382]"
"328","0.651354","151.101.1.140","100.86.235.39","TCP","1510","443  >  56466 [PSH, ACK] Seq=78221 Ack=2981 Win=330 Len=1444 TSval=211754774 TSecr=2554203064 [TCP PDU reassembled in 382]"
"329","0.651374","100.86.235.39","151.101.1.140","TCP","66","56466  >  443 [ACK] Seq=3337 Ack=76777 Win=4649 Len=0 TSval=2554203077 TSecr=211754774"
"330","0.651421","100.86.235.39","151.101.1.140","TCP","66","56466  >  443 [ACK] Seq=3337 Ack=79665 Win=4649 Len=0 TSval=2554203077 TSecr=211754774"
"331","0.653105","151.101.1.140","100.86.235.39","TCP","1510","443  >  56466 [ACK] Seq=79665 Ack=2981 Win=330 Len=1444 TSval=211754775 TSecr=2554203064 [TCP PDU reassembled in 382]"
"332","0.653107","151.101.1.140","100.86.235.39","TCP","1510","443  >  56466 [ACK] Seq=81109 Ack=2981 Win=330 Len=1444 TSval=211754775 TSecr=2554203064 [TCP PDU reassembled in 382]"
"333","0.653108","151.101.1.140","100.86.235.39","TCP","1510","443  >  56466 [ACK] Seq=82553 Ack=2981 Win=330 Len=1444 TSval=211754775 TSecr=2554203064 [TCP PDU reassembled in 382]"
"334","0.653109","151.101.1.140","100.86.235.39","TCP","1510","443  >  56466 [ACK] Seq=83997 Ack=2981 Win=330 Len=1444 TSval=211754775 TSecr=2554203064 [TCP PDU reassembled in 382]"
"335","0.653110","151.101.1.140","100.86.235.39","TCP","1510","[TCP Previous segment not captured] 443  >  56466 [ACK] Seq=86885 Ack=2981 Win=330 Len=1444 TSval=211754775 TSecr=2554203064 [TCP PDU reassembled in 382]"
"336","0.653111","151.101.1.140","100.86.235.39","TCP","1510","443  >  56466 [PSH, ACK] Seq=88329 Ack=2981 Win=330 Len=1444 TSval=211754775 TSecr=2554203064 [TCP PDU reassembled in 382]"
"337","0.653112","151.101.1.140","100.86.235.39","TCP","1510","443  >  56466 [ACK] Seq=89773 Ack=2981 Win=330 Len=1444 TSval=211754776 TSecr=2554203064 [TCP PDU reassembled in 382]"
"338","0.653112","151.101.1.140","100.86.235.39","TCP","1510","443  >  56466 [ACK] Seq=91217 Ack=2981 Win=330 Len=1444 TSval=211754776 TSecr=2554203064 [TCP PDU reassembled in 382]"
"339","0.653113","151.101.1.140","100.86.235.39","TCP","1510","443  >  56466 [ACK] Seq=92661 Ack=2981 Win=330 Len=1444 TSval=211754776 TSecr=2554203064 [TCP PDU reassembled in 353]"
"340","0.653114","151.101.1.140","100.86.235.39","TCP","1510","443  >  56466 [ACK] Seq=94105 Ack=2981 Win=330 Len=1444 TSval=211754776 TSecr=2554203064 [TCP PDU reassembled in 353]"
"341","0.653115","151.101.1.140","100.86.235.39","TCP","1510","443  >  56466 [ACK] Seq=95549 Ack=2981 Win=330 Len=1444 TSval=211754776 TSecr=2554203064 [TCP PDU reassembled in 353]"
"342","0.653116","151.101.1.140","100.86.235.39","TCP","1510","443  >  56466 [ACK] Seq=96993 Ack=2981 Win=330 Len=1444 TSval=211754776 TSecr=2554203064 [TCP PDU reassembled in 353]"
"343","0.653117","151.101.1.140","100.86.235.39","TCP","1510","443  >  56466 [PSH, ACK] Seq=98437 Ack=2981 Win=330 Len=1444 TSval=211754776 TSecr=2554203064 [TCP PDU reassembled in 353]"
"344","0.653118","151.101.1.140","100.86.235.39","TCP","1510","443  >  56466 [ACK] Seq=99881 Ack=2981 Win=330 Len=1444 TSval=211754777 TSecr=2554203064 [TCP PDU reassembled in 353]"
"345","0.653219","100.86.235.39","151.101.1.140","TCP","78","56466  >  443 [ACK] Seq=3337 Ack=85441 Win=4559 Len=0 TSval=2554203078 TSecr=211754775 SLE=86885 SRE=101325"
"346","0.653249","100.86.235.39","151.101.1.140","TCP","78","[TCP Dup ACK 345#1] 56466  >  443 [ACK] Seq=3337 Ack=85441 Win=4649 Len=0 TSval=2554203078 TSecr=211754775 SLE=86885 SRE=101325"
"347","0.653674","151.101.1.140","100.86.235.39","TCP","1510","443  >  56466 [ACK] Seq=101325 Ack=2981 Win=330 Len=1444 TSval=211754777 TSecr=2554203064 [TCP PDU reassembled in 353]"
"348","0.653675","151.101.1.140","100.86.235.39","TCP","1510","443  >  56466 [ACK] Seq=102769 Ack=2981 Win=330 Len=1444 TSval=211754777 TSecr=2554203064 [TCP PDU reassembled in 353]"
"349","0.653676","151.101.1.140","100.86.235.39","TCP","1510","443  >  56466 [ACK] Seq=104213 Ack=2981 Win=330 Len=1444 TSval=211754777 TSecr=2554203064 [TCP PDU reassembled in 353]"
"350","0.653677","151.101.1.140","100.86.235.39","TCP","1510","443  >  56466 [ACK] Seq=105657 Ack=2981 Win=330 Len=1444 TSval=211754777 TSecr=2554203064 [TCP PDU reassembled in 353]"
"351","0.653737","100.86.235.39","151.101.1.140","TCP","78","[TCP Dup ACK 345#2] 56466  >  443 [ACK] Seq=3337 Ack=85441 Win=4649 Len=0 TSval=2554203078 TSecr=211754775 SLE=86885 SRE=107101"
"352","0.653796","151.101.1.140","100.86.235.39","TCP","1510","443  >  56466 [ACK] Seq=107101 Ack=2981 Win=330 Len=1444 TSval=211754777 TSecr=2554203064 [TCP PDU reassembled in 353]"
"353","0.653798","151.101.1.140","100.86.235.39","TLSv1.2","1510","Application Data"
"354","0.653845","100.86.235.39","151.101.1.140","TCP","78","[TCP Dup ACK 345#3] 56466  >  443 [ACK] Seq=3337 Ack=85441 Win=4649 Len=0 TSval=2554203078 TSecr=211754775 SLE=86885 SRE=109989"
"355","0.654006","151.101.1.140","100.86.235.39","TCP","1510","443  >  56466 [ACK] Seq=109989 Ack=2981 Win=330 Len=1444 TSval=211754778 TSecr=2554203064 [TCP PDU reassembled in 370]"
"356","0.654007","151.101.1.140","100.86.235.39","TCP","1510","443  >  56466 [ACK] Seq=111433 Ack=2981 Win=330 Len=1444 TSval=211754778 TSecr=2554203064 [TCP PDU reassembled in 370]"
"357","0.654053","100.86.235.39","151.101.1.140","TCP","78","[TCP Dup ACK 345#4] 56466  >  443 [ACK] Seq=3337 Ack=85441 Win=4649 Len=0 TSval=2554203078 TSecr=211754775 SLE=86885 SRE=112877"
"358","0.655653","151.101.1.140","100.86.235.39","TCP","1510","443  >  56466 [ACK] Seq=112877 Ack=2981 Win=330 Len=1444 TSval=211754778 TSecr=2554203064 [TCP PDU reassembled in 370]"
"359","0.655654","151.101.1.140","100.86.235.39","TCP","1510","443  >  56466 [ACK] Seq=114321 Ack=2981 Win=330 Len=1444 TSval=211754778 TSecr=2554203064 [TCP PDU reassembled in 370]"
"360","0.655655","151.101.1.140","100.86.235.39","TCP","1510","443  >  56466 [ACK] Seq=115765 Ack=2981 Win=330 Len=1444 TSval=211754778 TSecr=2554203064 [TCP PDU reassembled in 370]"
"361","0.655656","151.101.1.140","100.86.235.39","TCP","1510","443  >  56466 [ACK] Seq=117209 Ack=2981 Win=330 Len=1444 TSval=211754778 TSecr=2554203064 [TCP PDU reassembled in 370]"
"362","0.655657","151.101.1.140","100.86.235.39","TCP","1510","443  >  56466 [PSH, ACK] Seq=118653 Ack=2981 Win=330 Len=1444 TSval=211754778 TSecr=2554203064 [TCP PDU reassembled in 370]"
"363","0.655658","151.101.1.140","100.86.235.39","TCP","1510","443  >  56466 [ACK] Seq=120097 Ack=3082 Win=330 Len=1444 TSval=211754778 TSecr=2554203067 [TCP PDU reassembled in 370]"
"364","0.655659","151.101.1.140","100.86.235.39","TCP","1510","443  >  56466 [ACK] Seq=121541 Ack=3082 Win=330 Len=1444 TSval=211754778 TSecr=2554203067 [TCP PDU reassembled in 370]"
"365","0.655660","151.101.1.140","100.86.235.39","TCP","1510","443  >  56466 [ACK] Seq=122985 Ack=3082 Win=330 Len=1444 TSval=211754778 TSecr=2554203067 [TCP PDU reassembled in 370]"
"366","0.655709","100.86.235.39","151.101.1.140","TLSv1.2","181","Application Data"
"367","0.655745","100.86.235.39","151.101.1.140","TCP","78","[TCP Dup ACK 345#5] 56466  >  443 [ACK] Seq=3440 Ack=85441 Win=4649 Len=0 TSval=2554203081 TSecr=211754775 SLE=86885 SRE=120097"
"368","0.655772","100.86.235.39","151.101.1.140","TCP","78","[TCP Dup ACK 345#6] 56466  >  443 [ACK] Seq=3440 Ack=85441 Win=4649 Len=0 TSval=2554203081 TSecr=211754775 SLE=86885 SRE=124429"
"369","0.656758","100.86.235.39","151.101.1.140","TLSv1.2","181","Application Data"
"370","0.656792","151.101.1.140","100.86.235.39","TLSv1.2","1510","Application Data, Application Data"
"371","0.656793","151.101.1.140","100.86.235.39","TCP","1510","443  >  56466 [ACK] Seq=125873 Ack=3082 Win=330 Len=1444 TSval=211754778 TSecr=2554203067 [TCP PDU reassembled in 373]"
"372","0.656794","151.101.1.140","100.86.235.39","TCP","1510","443  >  56466 [ACK] Seq=127317 Ack=3082 Win=330 Len=1444 TSval=211754778 TSecr=2554203067 [TCP PDU reassembled in 373]"
"373","0.656795","151.101.1.140","100.86.235.39","TLSv1.2","1510","Application Data, Application Data"
"374","0.656796","151.101.1.140","100.86.235.39","TLSv1.2","256","Application Data"
"375","0.656875","100.86.235.39","151.101.1.140","TCP","78","[TCP Dup ACK 345#7] 56466  >  443 [ACK] Seq=3543 Ack=85441 Win=4649 Len=0 TSval=2554203082 TSecr=211754775 SLE=86885 SRE=130395"
"376","0.660048","100.86.235.39","151.101.65.140","TCP","1514","56383  >  443 [ACK] Seq=39148 Ack=31446 Win=2048 Len=1448 TSval=1359882631 TSecr=557107575 [TCP PDU reassembled in 378]"
"377","0.660050","100.86.235.39","151.101.65.140","TCP","1514","56383  >  443 [ACK] Seq=40596 Ack=31446 Win=2048 Len=1448 TSval=1359882631 TSecr=557107575 [TCP PDU reassembled in 378]"
"378","0.660114","100.86.235.39","151.101.65.140","TLSv1.2","108","Application Data"
"379","0.660141","100.86.235.39","151.101.65.140","TLSv1.2","146","Application Data"
"380","0.665237","151.101.1.140","100.86.235.39","TCP","66","443  >  56466 [ACK] Seq=130395 Ack=3234 Win=336 Len=0 TSval=211754790 TSecr=2554203071"
"381","0.665999","151.101.1.140","100.86.235.39","TCP","66","443  >  56466 [ACK] Seq=130395 Ack=3337 Win=336 Len=0 TSval=211754790 TSecr=2554203077"
"382","0.666000","151.101.1.140","100.86.235.39","TLSv1.2","1510","[TCP Fast Retransmission] , Application Data"
"383","0.666086","100.86.235.39","151.101.1.140","TCP","66","56466  >  443 [ACK] Seq=3543 Ack=130395 Win=3947 Len=0 TSval=2554203091 TSecr=211754790"
"384","0.666634","100.86.235.39","151.101.1.140","TCP","66","[TCP Window Update] 56466  >  443 [ACK] Seq=3543 Ack=130395 Win=4649 Len=0 TSval=2554203092 TSecr=211754790"
"385","0.667183","151.101.1.140","100.86.235.39","TCP","66","443  >  56466 [ACK] Seq=130395 Ack=3440 Win=336 Len=0 TSval=211754790 TSecr=2554203081"
"386","0.667184","151.101.1.140","100.86.235.39","TLSv1.2","147","Application Data"
"387","0.667184","151.101.1.140","100.86.235.39","TLSv1.2","493","Application Data"
"388","0.667185","151.101.1.140","100.86.235.39","TCP","66","443  >  56466 [ACK] Seq=130903 Ack=3543 Win=336 Len=0 TSval=211754791 TSecr=2554203082"
"389","0.667186","151.101.1.140","100.86.235.39","TLSv1.2","147","Application Data"
"390","0.667186","151.101.1.140","100.86.235.39","TCP","1510","443  >  56466 [ACK] Seq=130984 Ack=3543 Win=336 Len=1444 TSval=211754791 TSecr=2554203082 [TCP PDU reassembled in 394]"
"391","0.667187","151.101.1.140","100.86.235.39","TCP","1510","443  >  56466 [ACK] Seq=132428 Ack=3543 Win=336 Len=1444 TSval=211754791 TSecr=2554203082 [TCP PDU reassembled in 394]"
"392","0.667272","100.86.235.39","151.101.1.140","TCP","66","56466  >  443 [ACK] Seq=3543 Ack=130903 Win=4641 Len=0 TSval=2554203092 TSecr=211754790"
"393","0.667315","100.86.235.39","151.101.1.140","TCP","66","56466  >  443 [ACK] Seq=3543 Ack=133872 Win=4595 Len=0 TSval=2554203092 TSecr=211754791"
"394","0.667450","151.101.1.140","100.86.235.39","TLSv1.2","1113","Application Data"
"395","0.667502","100.86.235.39","151.101.1.140","TCP","66","56466  >  443 [ACK] Seq=3543 Ack=134919 Win=4580 Len=0 TSval=2554203093 TSecr=211754791"
"396","0.667749","100.86.235.39","151.101.1.140","TCP","66","[TCP Window Update] 56466  >  443 [ACK] Seq=3543 Ack=134919 Win=4649 Len=0 TSval=2554203093 TSecr=211754791"
"397","0.668730","151.101.1.140","100.86.235.39","TLSv1.2","170","Application Data"
"398","0.668730","151.101.1.140","100.86.235.39","TLSv1.2","460","Application Data"
"399","0.668796","100.86.235.39","151.101.1.140","TCP","66","56466  >  443 [ACK] Seq=3543 Ack=135417 Win=4642 Len=0 TSval=2554203094 TSecr=211754792"
"400","0.670467","151.101.65.140","100.86.235.39","TCP","66","443  >  56383 [ACK] Seq=31446 Ack=42166 Win=533 Len=0 TSval=557107618 TSecr=1359882631"
"401","0.677673","151.101.65.140","100.86.235.39","TLSv1.2","1051","Application Data"
"402","0.677762","100.86.235.39","151.101.65.140","TCP","66","56383  >  443 [ACK] Seq=42166 Ack=32431 Win=2032 Len=0 TSval=1359882649 TSecr=557107626"
"403","0.681614","151.101.65.140","100.86.235.39","TLSv1.2","97","Application Data"
"404","0.681688","100.86.235.39","151.101.65.140","TCP","66","56383  >  443 [ACK] Seq=42166 Ack=32462 Win=2047 Len=0 TSval=1359882653 TSecr=557107630"
"405","0.688259","151.101.65.140","100.86.235.39","TLSv1.2","825","Application Data"
"406","0.688295","151.101.65.140","100.86.235.39","TLSv1.2","97","Application Data"
"407","0.688339","100.86.235.39","151.101.65.140","TCP","66","56383  >  443 [ACK] Seq=42166 Ack=33221 Win=2036 Len=0 TSval=1359882660 TSecr=557107637"
"408","0.688426","100.86.235.39","151.101.65.140","TCP","66","56383  >  443 [ACK] Seq=42166 Ack=33252 Win=2035 Len=0 TSval=1359882660 TSecr=557107637"
"409","0.690845","151.101.65.140","100.86.235.39","TCP","1510","443  >  56383 [ACK] Seq=33252 Ack=42166 Win=538 Len=1444 TSval=557107639 TSecr=1359882649 [TCP PDU reassembled in 411]"
"410","0.690925","100.86.235.39","151.101.65.140","TCP","66","56383  >  443 [ACK] Seq=42166 Ack=34696 Win=2025 Len=0 TSval=1359882662 TSecr=557107639"
"411","0.691571","151.101.65.140","100.86.235.39","TLSv1.2","1310","Application Data"
"412","0.691704","100.86.235.39","151.101.65.140","TCP","66","56383  >  443 [ACK] Seq=42166 Ack=35940 Win=2028 Len=0 TSval=1359882662 TSecr=557107639"
"413","0.699294","100.86.235.39","151.101.65.140","TLSv1.2","206","Application Data"
"414","0.699577","100.86.235.39","151.101.65.140","TLSv1.2","205","Application Data"
"415","0.699746","100.86.235.39","151.101.65.140","TLSv1.2","206","Application Data"
"416","0.710669","151.101.65.140","100.86.235.39","TCP","66","443  >  56449 [ACK] Seq=1 Ack=596 Win=424 Len=0 TSval=867464655 TSecr=921758303"
"417","0.712395","151.101.65.140","100.86.235.39","TCP","1510","443  >  56449 [ACK] Seq=1 Ack=596 Win=424 Len=1444 TSval=867464656 TSecr=921758303 [TCP PDU reassembled in 421]"
"418","0.712428","151.101.65.140","100.86.235.39","TCP","1510","443  >  56449 [PSH, ACK] Seq=1445 Ack=596 Win=424 Len=1444 TSval=867464656 TSecr=921758303 [TCP PDU reassembled in 421]"
"419","0.712479","100.86.235.39","151.101.65.140","TCP","66","56449  >  443 [ACK] Seq=596 Ack=1445 Win=5306 Len=0 TSval=921758316 TSecr=867464656"
"420","0.712563","100.86.235.39","151.101.65.140","TCP","66","56449  >  443 [ACK] Seq=596 Ack=2889 Win=5283 Len=0 TSval=921758316 TSecr=867464656"
"421","0.712876","151.101.65.140","100.86.235.39","TLSv1.2","1146","Application Data"
"422","0.712940","100.86.235.39","151.101.65.140","TCP","66","56449  >  443 [ACK] Seq=596 Ack=3969 Win=5311 Len=0 TSval=921758316 TSecr=867464657"
"423","0.715525","151.101.65.140","100.86.235.39","TCP","1510","443  >  56449 [ACK] Seq=3969 Ack=596 Win=424 Len=1444 TSval=867464659 TSecr=921758303 [TCP PDU reassembled in 426]"
"424","0.715526","151.101.65.140","100.86.235.39","TCP","1510","443  >  56449 [PSH, ACK] Seq=5413 Ack=596 Win=424 Len=1444 TSval=867464659 TSecr=921758303 [TCP PDU reassembled in 426]"
"425","0.715526","151.101.65.140","100.86.235.39","TCP","1510","443  >  56449 [ACK] Seq=6857 Ack=596 Win=424 Len=1444 TSval=867464659 TSecr=921758303 [TCP PDU reassembled in 426]"
"426","0.715561","151.101.65.140","100.86.235.39","TLSv1.2","133","Application Data"
"427","0.715561","151.101.65.140","100.86.235.39","TLSv1.2","168","Application Data"
"428","0.715610","100.86.235.39","151.101.65.140","TCP","66","56449  >  443 [ACK] Seq=596 Ack=8301 Win=5260 Len=0 TSval=921758319 TSecr=867464659"
"429","0.715725","100.86.235.39","151.101.65.140","TCP","66","56449  >  443 [ACK] Seq=596 Ack=8470 Win=5258 Len=0 TSval=921758319 TSecr=867464660"
"430","0.715944","100.86.235.39","151.101.65.140","TCP","66","[TCP Window Update] 56449  >  443 [ACK] Seq=596 Ack=8470 Win=5328 Len=0 TSval=921758319 TSecr=867464660"
"431","0.716480","151.101.65.140","100.86.235.39","TCP","1510","443  >  56449 [ACK] Seq=8470 Ack=596 Win=424 Len=1444 TSval=867464660 TSecr=921758303 [TCP PDU reassembled in 435]"
"432","0.716481","151.101.65.140","100.86.235.39","TCP","1510","443  >  56449 [PSH, ACK] Seq=9914 Ack=596 Win=424 Len=1444 TSval=867464660 TSecr=921758303 [TCP PDU reassembled in 435]"
"433","0.716553","100.86.235.39","151.101.65.140","TCP","66","56449  >  443 [ACK] Seq=596 Ack=11358 Win=5283 Len=0 TSval=921758319 TSecr=867464660"
"434","0.716905","151.101.65.140","100.86.235.39","TCP","1510","443  >  56449 [ACK] Seq=11358 Ack=596 Win=424 Len=1444 TSval=867464661 TSecr=921758303 [TCP PDU reassembled in 435]"
"435","0.716907","151.101.65.140","100.86.235.39","TLSv1.2","81","Application Data"
"436","0.716983","100.86.235.39","151.101.65.140","TCP","66","56449  >  443 [ACK] Seq=596 Ack=12817 Win=5305 Len=0 TSval=921758320 TSecr=867464661"
"437","0.727056","100.86.235.39","151.101.1.140","TLSv1.2","235","Application Data"
"438","0.729583","100.86.235.39","151.101.1.140","TLSv1.2","160","Application Data"
"439","0.730259","100.86.235.39","151.101.1.140","TLSv1.2","167","Application Data"
"440","0.736688","151.101.1.140","100.86.235.39","TCP","66","443  >  56466 [ACK] Seq=135417 Ack=3712 Win=342 Len=0 TSval=211754861 TSecr=2554203152"
"441","0.737593","151.101.1.140","100.86.235.39","TCP","1510","443  >  56466 [ACK] Seq=135417 Ack=3712 Win=342 Len=1444 TSval=211754862 TSecr=2554203152 [TCP PDU reassembled in 442]"
"442","0.737594","151.101.1.140","100.86.235.39","TLSv1.2","214","Application Data"
"443","0.737668","100.86.235.39","151.101.1.140","TCP","66","56466  >  443 [ACK] Seq=3907 Ack=137009 Win=4625 Len=0 TSval=2554203162 TSecr=211754862"
"444","0.738720","151.101.1.140","100.86.235.39","TCP","66","443  >  56466 [ACK] Seq=137009 Ack=3806 Win=342 Len=0 TSval=211754864 TSecr=2554203155"
"445","0.741079","151.101.1.140","100.86.235.39","TCP","1510","443  >  56466 [ACK] Seq=137009 Ack=3806 Win=342 Len=1444 TSval=211754864 TSecr=2554203155 [TCP PDU reassembled in 446]"
"446","0.741080","151.101.1.140","100.86.235.39","TLSv1.2","1385","Application Data"
"447","0.741118","151.101.1.140","100.86.235.39","TCP","66","443  >  56466 [ACK] Seq=139772 Ack=3907 Win=342 Len=0 TSval=211754865 TSecr=2554203155"
"448","0.741166","100.86.235.39","151.101.1.140","TCP","66","56466  >  443 [ACK] Seq=3907 Ack=139772 Win=4606 Len=0 TSval=2554203166 TSecr=211754864"
"449","0.741674","151.101.1.140","100.86.235.39","TLSv1.2","1183","Application Data"
"450","0.741731","100.86.235.39","151.101.1.140","TCP","66","56466  >  443 [ACK] Seq=3907 Ack=140889 Win=4632 Len=0 TSval=2554203167 TSecr=211754865"
"451","0.881806","100.86.235.39","151.101.65.140","TCP","1514","56383  >  443 [ACK] Seq=42166 Ack=35940 Win=2048 Len=1448 TSval=1359882853 TSecr=557107639 [TCP PDU reassembled in 453]"
"452","0.881809","100.86.235.39","151.101.65.140","TCP","1514","56383  >  443 [ACK] Seq=43614 Ack=35940 Win=2048 Len=1448 TSval=1359882853 TSecr=557107639 [TCP PDU reassembled in 453]"
"453","0.881846","100.86.235.39","151.101.65.140","TLSv1.2","110","Application Data"
"454","0.881892","100.86.235.39","151.101.65.140","TCP","1514","56383  >  443 [ACK] Seq=45106 Ack=35940 Win=2048 Len=1448 TSval=1359882853 TSecr=557107639 [TCP PDU reassembled in 455]"
"455","0.881903","100.86.235.39","151.101.65.140","TLSv1.2","1063","Application Data"
"456","0.891405","151.101.65.140","100.86.235.39","TCP","66","443  >  56383 [ACK] Seq=35940 Ack=47551 Win=534 Len=0 TSval=557107840 TSecr=1359882853"
"457","0.937478","151.101.65.140","100.86.235.39","TCP","1510","443  >  56383 [ACK] Seq=35940 Ack=47551 Win=538 Len=1444 TSval=557107886 TSecr=1359882853 [TCP PDU reassembled in 458]"
"458","0.937480","151.101.65.140","100.86.235.39","TLSv1.2","964","Application Data"
"459","0.937546","100.86.235.39","151.101.65.140","TCP","66","56383  >  443 [ACK] Seq=47551 Ack=38282 Win=2011 Len=0 TSval=1359882909 TSecr=557107886"
"460","1.141236","151.101.65.140","100.86.235.39","TLSv1.2","171","Application Data"
"461","1.141314","100.86.235.39","151.101.65.140","TCP","66","56449  >  443 [ACK] Seq=596 Ack=12922 Win=5326 Len=0 TSval=921758745 TSecr=867465085"
"462","1.141878","151.101.65.140","100.86.235.39","TCP","1510","443  >  56449 [ACK] Seq=12922 Ack=596 Win=424 Len=1444 TSval=867465085 TSecr=921758320 [TCP PDU reassembled in 481]"
"463","1.141879","151.101.65.140","100.86.235.39","TCP","1510","443  >  56449 [PSH, ACK] Seq=14366 Ack=596 Win=424 Len=1444 TSval=867465085 TSecr=921758320 [TCP PDU reassembled in 481]"
"464","1.141879","151.101.65.140","100.86.235.39","TCP","1510","443  >  56449 [ACK] Seq=15810 Ack=596 Win=424 Len=1444 TSval=867465086 TSecr=921758320 [TCP PDU reassembled in 481]"
"465","1.141930","100.86.235.39","151.101.65.140","TCP","66","56449  >  443 [ACK] Seq=596 Ack=17254 Win=5260 Len=0 TSval=921758745 TSecr=867465086"
"466","1.141987","100.86.235.39","151.101.65.140","TCP","66","[TCP Window Update] 56449  >  443 [ACK] Seq=596 Ack=17254 Win=5328 Len=0 TSval=921758745 TSecr=867465086"
"467","1.142378","151.101.65.140","100.86.235.39","TCP","1510","443  >  56449 [PSH, ACK] Seq=17254 Ack=596 Win=424 Len=1444 TSval=867465086 TSecr=921758320 [TCP PDU reassembled in 481]"
"468","1.142404","100.86.235.39","151.101.65.140","TCP","66","56449  >  443 [ACK] Seq=596 Ack=18698 Win=5306 Len=0 TSval=921758746 TSecr=867465086"
"469","1.142886","151.101.65.140","100.86.235.39","TCP","1510","443  >  56449 [ACK] Seq=18698 Ack=596 Win=424 Len=1444 TSval=867465087 TSecr=921758320 [TCP PDU reassembled in 481]"
"470","1.142915","100.86.235.39","151.101.65.140","TCP","66","56449  >  443 [ACK] Seq=596 Ack=20142 Win=5306 Len=0 TSval=921758746 TSecr=867465087"
"471","1.143743","151.101.65.140","100.86.235.39","TCP","1510","443  >  56449 [PSH, ACK] Seq=20142 Ack=596 Win=424 Len=1444 TSval=867465087 TSecr=921758320 [TCP PDU reassembled in 481]"
"472","1.143767","100.86.235.39","151.101.65.140","TCP","66","56449  >  443 [ACK] Seq=596 Ack=21586 Win=5306 Len=0 TSval=921758747 TSecr=867465087"
"473","1.143906","151.101.65.140","100.86.235.39","TCP","1510","443  >  56449 [ACK] Seq=21586 Ack=596 Win=424 Len=1444 TSval=867465087 TSecr=921758320 [TCP PDU reassembled in 481]"
"474","1.143907","151.101.65.140","100.86.235.39","TCP","1510","443  >  56449 [PSH, ACK] Seq=23030 Ack=596 Win=424 Len=1444 TSval=867465087 TSecr=921758320 [TCP PDU reassembled in 481]"
"475","1.143930","100.86.235.39","151.101.65.140","TCP","66","56449  >  443 [ACK] Seq=596 Ack=24474 Win=5283 Len=0 TSval=921758747 TSecr=867465087"
"476","1.144529","151.101.65.140","100.86.235.39","TCP","1510","443  >  56449 [ACK] Seq=24474 Ack=596 Win=424 Len=1444 TSval=867465088 TSecr=921758320 [TCP PDU reassembled in 481]"
"477","1.144529","151.101.65.140","100.86.235.39","TCP","1510","443  >  56449 [PSH, ACK] Seq=25918 Ack=596 Win=424 Len=1444 TSval=867465088 TSecr=921758320 [TCP PDU reassembled in 481]"
"478","1.144555","100.86.235.39","151.101.65.140","TCP","66","56449  >  443 [ACK] Seq=596 Ack=27362 Win=5283 Len=0 TSval=921758747 TSecr=867465088"
"479","1.145683","151.101.65.140","100.86.235.39","TCP","1510","443  >  56449 [ACK] Seq=27362 Ack=596 Win=424 Len=1444 TSval=867465089 TSecr=921758320 [TCP PDU reassembled in 481]"
"480","1.145703","100.86.235.39","151.101.65.140","TCP","66","56449  >  443 [ACK] Seq=596 Ack=28806 Win=5306 Len=0 TSval=921758749 TSecr=867465089"
"481","1.148254","151.101.65.140","100.86.235.39","TLSv1.2","1510","Application Data"
"482","1.148255","151.101.65.140","100.86.235.39","TCP","1510","443  >  56449 [ACK] Seq=30250 Ack=596 Win=424 Len=1444 TSval=867465090 TSecr=921758320 [TCP PDU reassembled in 518]"
"483","1.148282","100.86.235.39","151.101.65.140","TCP","66","56449  >  443 [ACK] Seq=596 Ack=31694 Win=5283 Len=0 TSval=921758752 TSecr=867465090"
"484","1.150181","151.101.65.140","100.86.235.39","TCP","1510","443  >  56449 [PSH, ACK] Seq=31694 Ack=596 Win=424 Len=1444 TSval=867465090 TSecr=921758320 [TCP PDU reassembled in 518]"
"485","1.150181","151.101.65.140","100.86.235.39","TCP","1510","[TCP Previous segment not captured] 443  >  56449 [PSH, ACK] Seq=34582 Ack=596 Win=424 Len=1444 TSval=867465091 TSecr=921758320 [TCP PDU reassembled in 518]"
"486","1.150182","151.101.65.140","100.86.235.39","TCP","1510","443  >  56449 [ACK] Seq=36026 Ack=596 Win=424 Len=1444 TSval=867465091 TSecr=921758320 [TCP PDU reassembled in 518]"
"487","1.150184","151.101.65.140","100.86.235.39","TCP","1510","443  >  56449 [PSH, ACK] Seq=37470 Ack=596 Win=424 Len=1444 TSval=867465091 TSecr=921758320 [TCP PDU reassembled in 518]"
"488","1.150185","151.101.65.140","100.86.235.39","TCP","1510","443  >  56449 [ACK] Seq=38914 Ack=596 Win=424 Len=1444 TSval=867465092 TSecr=921758320 [TCP PDU reassembled in 518]"
"489","1.150186","151.101.65.140","100.86.235.39","TCP","1510","443  >  56449 [PSH, ACK] Seq=40358 Ack=596 Win=424 Len=1444 TSval=867465092 TSecr=921758320 [TCP PDU reassembled in 518]"
"490","1.150186","151.101.65.140","100.86.235.39","TCP","1510","443  >  56449 [ACK] Seq=41802 Ack=596 Win=424 Len=1444 TSval=867465093 TSecr=921758320 [TCP PDU reassembled in 518]"
"491","1.150187","151.101.65.140","100.86.235.39","TCP","1510","443  >  56449 [PSH, ACK] Seq=43246 Ack=596 Win=424 Len=1444 TSval=867465093 TSecr=921758320 [TCP PDU reassembled in 518]"
"492","1.150187","151.101.65.140","100.86.235.39","TCP","1510","443  >  56449 [ACK] Seq=44690 Ack=596 Win=424 Len=1444 TSval=867465094 TSecr=921758320 [TCP PDU reassembled in 518]"
"493","1.150188","151.101.65.140","100.86.235.39","TCP","1510","443  >  56449 [PSH, ACK] Seq=46134 Ack=596 Win=424 Len=1444 TSval=867465094 TSecr=921758320 [TCP PDU reassembled in 511]"
"494","1.150248","100.86.235.39","151.101.65.140","TCP","66","56449  >  443 [ACK] Seq=596 Ack=33138 Win=5306 Len=0 TSval=921758753 TSecr=867465090"
"495","1.150300","100.86.235.39","151.101.65.140","TCP","78","[TCP Dup ACK 494#1] 56449  >  443 [ACK] Seq=596 Ack=33138 Win=5306 Len=0 TSval=921758753 TSecr=867465090 SLE=34582 SRE=47578"
"496","1.154871","151.101.65.140","100.86.235.39","TCP","1510","443  >  56449 [ACK] Seq=47578 Ack=596 Win=424 Len=1444 TSval=867465098 TSecr=921758747 [TCP PDU reassembled in 511]"
"497","1.154872","151.101.65.140","100.86.235.39","TCP","1510","443  >  56449 [PSH, ACK] Seq=49022 Ack=596 Win=424 Len=1444 TSval=867465098 TSecr=921758747 [TCP PDU reassembled in 511]"
"498","1.154872","151.101.65.140","100.86.235.39","TCP","1510","443  >  56449 [ACK] Seq=50466 Ack=596 Win=424 Len=1444 TSval=867465098 TSecr=921758747 [TCP PDU reassembled in 511]"
"499","1.154954","100.86.235.39","151.101.65.140","TCP","78","[TCP Dup ACK 494#2] 56449  >  443 [ACK] Seq=596 Ack=33138 Win=5328 Len=0 TSval=921758758 TSecr=867465090 SLE=34582 SRE=51910"
"500","1.155462","151.101.65.140","100.86.235.39","TCP","1510","443  >  56449 [PSH, ACK] Seq=51910 Ack=596 Win=424 Len=1444 TSval=867465098 TSecr=921758747 [TCP PDU reassembled in 511]"
"501","1.155463","151.101.65.140","100.86.235.39","TCP","1510","443  >  56449 [ACK] Seq=53354 Ack=596 Win=424 Len=1444 TSval=867465099 TSecr=921758747 [TCP PDU reassembled in 511]"
"502","1.155521","100.86.235.39","151.101.65.140","TCP","78","[TCP Dup ACK 494#3] 56449  >  443 [ACK] Seq=596 Ack=33138 Win=5328 Len=0 TSval=921758758 TSecr=867465090 SLE=34582 SRE=54798"
"503","1.155752","151.101.65.140","100.86.235.39","TCP","1510","443  >  56449 [PSH, ACK] Seq=54798 Ack=596 Win=424 Len=1444 TSval=867465099 TSecr=921758747 [TCP PDU reassembled in 511]"
"504","1.155753","151.101.65.140","100.86.235.39","TCP","1510","443  >  56449 [ACK] Seq=56242 Ack=596 Win=424 Len=1444 TSval=867465100 TSecr=921758747 [TCP PDU reassembled in 511]"
"505","1.155805","100.86.235.39","151.101.65.140","TCP","78","[TCP Dup ACK 494#4] 56449  >  443 [ACK] Seq=596 Ack=33138 Win=5328 Len=0 TSval=921758758 TSecr=867465090 SLE=34582 SRE=57686"
"506","1.158083","151.101.65.140","100.86.235.39","TCP","1510","443  >  56449 [PSH, ACK] Seq=57686 Ack=596 Win=424 Len=1444 TSval=867465100 TSecr=921758747 [TCP PDU reassembled in 511]"
"507","1.158183","100.86.235.39","151.101.65.140","TCP","78","[TCP Dup ACK 494#5] 56449  >  443 [ACK] Seq=596 Ack=33138 Win=5328 Len=0 TSval=921758761 TSecr=867465090 SLE=34582 SRE=59130"
"508","1.158463","151.101.65.140","100.86.235.39","TCP","1510","443  >  56449 [ACK] Seq=59130 Ack=596 Win=424 Len=1444 TSval=867465100 TSecr=921758749 [TCP PDU reassembled in 511]"
"509","1.158493","100.86.235.39","151.101.65.140","TCP","78","[TCP Dup ACK 494#6] 56449  >  443 [ACK] Seq=596 Ack=33138 Win=5328 Len=0 TSval=921758761 TSecr=867465090 SLE=34582 SRE=60574"
"510","1.158723","151.101.65.140","100.86.235.39","TCP","1510","443  >  56449 [PSH, ACK] Seq=60574 Ack=596 Win=424 Len=1444 TSval=867465100 TSecr=921758749 [TCP PDU reassembled in 511]"
"511","1.158723","151.101.65.140","100.86.235.39","TLSv1.2","1510","Application Data"
"512","1.158746","100.86.235.39","151.101.65.140","TCP","78","[TCP Dup ACK 494#7] 56449  >  443 [ACK] Seq=596 Ack=33138 Win=5328 Len=0 TSval=921758761 TSecr=867465090 SLE=34582 SRE=63462"
"513","1.158963","151.101.65.140","100.86.235.39","TCP","1510","443  >  56449 [PSH, ACK] Seq=63462 Ack=596 Win=424 Len=1444 TSval=867465101 TSecr=921758749 [TCP PDU reassembled in 532]"
"514","1.158982","100.86.235.39","151.101.65.140","TCP","78","[TCP Dup ACK 494#8] 56449  >  443 [ACK] Seq=596 Ack=33138 Win=5328 Len=0 TSval=921758761 TSecr=867465090 SLE=34582 SRE=64906"
"515","1.159556","151.101.65.140","100.86.235.39","TCP","1510","443  >  56449 [ACK] Seq=64906 Ack=596 Win=424 Len=1444 TSval=867465103 TSecr=921758752 [TCP PDU reassembled in 532]"
"516","1.159557","151.101.65.140","100.86.235.39","TCP","1510","443  >  56449 [PSH, ACK] Seq=66350 Ack=596 Win=424 Len=1444 TSval=867465103 TSecr=921758752 [TCP PDU reassembled in 532]"
"517","1.159579","100.86.235.39","151.101.65.140","TCP","78","[TCP Dup ACK 494#9] 56449  >  443 [ACK] Seq=596 Ack=33138 Win=5328 Len=0 TSval=921758763 TSecr=867465090 SLE=34582 SRE=67794"
"518","1.159833","151.101.65.140","100.86.235.39","TLSv1.2","1510","[TCP Fast Retransmission] , Application Data"
"519","1.159889","100.86.235.39","151.101.65.140","TCP","66","56449  >  443 [ACK] Seq=596 Ack=67794 Win=4787 Len=0 TSval=921758763 TSecr=867465104"
"520","1.160156","100.86.235.39","151.101.65.140","TCP","66","[TCP Window Update] 56449  >  443 [ACK] Seq=596 Ack=67794 Win=5328 Len=0 TSval=921758763 TSecr=867465104"
"521","1.160841","151.101.65.140","100.86.235.39","TCP","1510","443  >  56449 [ACK] Seq=67794 Ack=596 Win=424 Len=1444 TSval=867465104 TSecr=921758753 [TCP PDU reassembled in 532]"
"522","1.160841","151.101.65.140","100.86.235.39","TCP","1510","443  >  56449 [PSH, ACK] Seq=69238 Ack=596 Win=424 Len=1444 TSval=867465104 TSecr=921758753 [TCP PDU reassembled in 532]"
"523","1.160873","100.86.235.39","151.101.65.140","TCP","66","56449  >  443 [ACK] Seq=596 Ack=70682 Win=5283 Len=0 TSval=921758764 TSecr=867465104"
"524","1.166379","151.101.65.140","100.86.235.39","TCP","1510","443  >  56449 [ACK] Seq=70682 Ack=596 Win=424 Len=1444 TSval=867465110 TSecr=921758758 [TCP PDU reassembled in 532]"
"525","1.166425","100.86.235.39","151.101.65.140","TCP","66","56449  >  443 [ACK] Seq=596 Ack=72126 Win=5306 Len=0 TSval=921758770 TSecr=867465110"
"526","1.166668","151.101.65.140","100.86.235.39","TCP","1510","443  >  56449 [PSH, ACK] Seq=72126 Ack=596 Win=424 Len=1444 TSval=867465110 TSecr=921758758 [TCP PDU reassembled in 532]"
"527","1.166669","151.101.65.140","100.86.235.39","TCP","1510","443  >  56449 [ACK] Seq=73570 Ack=596 Win=424 Len=1444 TSval=867465110 TSecr=921758758 [TCP PDU reassembled in 532]"
"528","1.166691","100.86.235.39","151.101.65.140","TCP","66","56449  >  443 [ACK] Seq=596 Ack=75014 Win=5283 Len=0 TSval=921758770 TSecr=867465110"
"529","1.167963","151.101.65.140","100.86.235.39","TCP","1510","443  >  56449 [ACK] Seq=75014 Ack=596 Win=424 Len=1444 TSval=867465111 TSecr=921758758 [TCP PDU reassembled in 532]"
"530","1.167963","151.101.65.140","100.86.235.39","TCP","1510","443  >  56449 [PSH, ACK] Seq=76458 Ack=596 Win=424 Len=1444 TSval=867465111 TSecr=921758758 [TCP PDU reassembled in 532]"
"531","1.168007","100.86.235.39","151.101.65.140","TCP","66","56449  >  443 [ACK] Seq=596 Ack=77902 Win=5283 Len=0 TSval=921758771 TSecr=867465111"
"532","1.168718","151.101.65.140","100.86.235.39","TLSv1.2","1510","Application Data, Application Data"
"533","1.168719","151.101.65.140","100.86.235.39","TCP","1510","443  >  56449 [PSH, ACK] Seq=79346 Ack=596 Win=424 Len=1444 TSval=867465112 TSecr=921758758 [TCP PDU reassembled in 545]"
"534","1.168768","100.86.235.39","151.101.65.140","TCP","66","56449  >  443 [ACK] Seq=596 Ack=80790 Win=5283 Len=0 TSval=921758771 TSecr=867465112"
"535","1.168956","151.101.65.140","100.86.235.39","TCP","1510","443  >  56449 [ACK] Seq=80790 Ack=596 Win=424 Len=1444 TSval=867465113 TSecr=921758761 [TCP PDU reassembled in 545]"
"536","1.168956","151.101.65.140","100.86.235.39","TCP","1510","443  >  56449 [ACK] Seq=82234 Ack=596 Win=424 Len=1444 TSval=867465113 TSecr=921758761 [TCP PDU reassembled in 545]"
"537","1.168994","100.86.235.39","151.101.65.140","TCP","66","56449  >  443 [ACK] Seq=596 Ack=83678 Win=5283 Len=0 TSval=921758771 TSecr=867465113"
"538","1.172731","151.101.65.140","100.86.235.39","TCP","1510","443  >  56449 [ACK] Seq=83678 Ack=596 Win=424 Len=1444 TSval=867465113 TSecr=921758761 [TCP PDU reassembled in 545]"
"539","1.172732","151.101.65.140","100.86.235.39","TCP","1510","443  >  56449 [PSH, ACK] Seq=85122 Ack=596 Win=424 Len=1444 TSval=867465113 TSecr=921758761 [TCP PDU reassembled in 545]"
"540","1.172733","151.101.65.140","100.86.235.39","TCP","1510","443  >  56449 [ACK] Seq=86566 Ack=596 Win=424 Len=1444 TSval=867465114 TSecr=921758761 [TCP PDU reassembled in 545]"
"541","1.172733","151.101.65.140","100.86.235.39","TCP","1510","443  >  56449 [ACK] Seq=88010 Ack=596 Win=424 Len=1444 TSval=867465114 TSecr=921758763 [TCP PDU reassembled in 545]"
"542","1.172734","151.101.65.140","100.86.235.39","TCP","1510","443  >  56449 [ACK] Seq=89454 Ack=596 Win=424 Len=1444 TSval=867465114 TSecr=921758763 [TCP PDU reassembled in 545]"
"543","1.172734","151.101.65.140","100.86.235.39","TCP","1510","443  >  56449 [ACK] Seq=90898 Ack=596 Win=424 Len=1444 TSval=867465115 TSecr=921758764 [TCP PDU reassembled in 545]"
"544","1.172735","151.101.65.140","100.86.235.39","TCP","1510","443  >  56449 [PSH, ACK] Seq=92342 Ack=596 Win=424 Len=1444 TSval=867465115 TSecr=921758764 [TCP PDU reassembled in 545]"
"545","1.172736","151.101.65.140","100.86.235.39","TLSv1.2","1510","Application Data"
"546","1.172806","100.86.235.39","151.101.65.140","TCP","66","56449  >  443 [ACK] Seq=596 Ack=95230 Win=5148 Len=0 TSval=921758776 TSecr=867465116"
"547","1.172973","100.86.235.39","151.101.65.140","TCP","66","[TCP Window Update] 56449  >  443 [ACK] Seq=596 Ack=95230 Win=5328 Len=0 TSval=921758776 TSecr=867465116"
"548","1.176085","151.101.65.140","100.86.235.39","TCP","1510","443  >  56449 [ACK] Seq=95230 Ack=596 Win=424 Len=1444 TSval=867465120 TSecr=921758770 [TCP PDU reassembled in 566]"
"549","1.176127","100.86.235.39","151.101.65.140","TCP","66","56449  >  443 [ACK] Seq=596 Ack=96674 Win=5306 Len=0 TSval=921758779 TSecr=867465120"
"550","1.178270","151.101.65.140","100.86.235.39","TCP","1510","443  >  56449 [ACK] Seq=96674 Ack=596 Win=424 Len=1444 TSval=867465122 TSecr=921758771 [TCP PDU reassembled in 566]"
"551","1.178270","151.101.65.140","100.86.235.39","TCP","1510","443  >  56449 [PSH, ACK] Seq=98118 Ack=596 Win=424 Len=1444 TSval=867465122 TSecr=921758771 [TCP PDU reassembled in 566]"
"552","1.178271","151.101.65.140","100.86.235.39","TCP","1510","443  >  56449 [ACK] Seq=99562 Ack=596 Win=424 Len=1444 TSval=867465123 TSecr=921758771 [TCP PDU reassembled in 566]"
"553","1.178301","100.86.235.39","151.101.65.140","TCP","66","56449  >  443 [ACK] Seq=596 Ack=101006 Win=5260 Len=0 TSval=921758782 TSecr=867465123"
"554","1.178357","100.86.235.39","151.101.65.140","TCP","66","[TCP Window Update] 56449  >  443 [ACK] Seq=596 Ack=101006 Win=5328 Len=0 TSval=921758782 TSecr=867465123"
"555","1.178972","151.101.65.140","100.86.235.39","TCP","1510","443  >  56449 [PSH, ACK] Seq=101006 Ack=596 Win=424 Len=1444 TSval=867465123 TSecr=921758771 [TCP PDU reassembled in 566]"
"556","1.179045","100.86.235.39","151.101.65.140","TCP","66","56449  >  443 [ACK] Seq=596 Ack=102450 Win=5306 Len=0 TSval=921758782 TSecr=867465123"
"557","1.179827","151.101.65.140","100.86.235.39","TCP","1510","443  >  56449 [ACK] Seq=102450 Ack=596 Win=424 Len=1444 TSval=867465124 TSecr=921758771 [TCP PDU reassembled in 566]"
"558","1.179907","100.86.235.39","151.101.65.140","TCP","66","56449  >  443 [ACK] Seq=596 Ack=103894 Win=5306 Len=0 TSval=921758783 TSecr=867465124"
"559","1.180573","151.101.65.140","100.86.235.39","TCP","1510","443  >  56449 [PSH, ACK] Seq=103894 Ack=596 Win=424 Len=1444 TSval=867465124 TSecr=921758771 [TCP PDU reassembled in 566]"
"560","1.180642","100.86.235.39","151.101.65.140","TCP","66","56449  >  443 [ACK] Seq=596 Ack=105338 Win=5306 Len=0 TSval=921758783 TSecr=867465124"
"561","1.181954","151.101.65.140","100.86.235.39","TCP","1510","443  >  56449 [ACK] Seq=105338 Ack=596 Win=424 Len=1444 TSval=867465125 TSecr=921758771 [TCP PDU reassembled in 566]"
"562","1.181955","151.101.65.140","100.86.235.39","TCP","1510","443  >  56449 [PSH, ACK] Seq=106782 Ack=596 Win=424 Len=1444 TSval=867465125 TSecr=921758771 [TCP PDU reassembled in 566]"
"563","1.182029","100.86.235.39","151.101.65.140","TCP","66","56449  >  443 [ACK] Seq=596 Ack=108226 Win=5283 Len=0 TSval=921758785 TSecr=867465125"
"564","1.182887","151.101.65.140","100.86.235.39","TCP","1510","443  >  56449 [ACK] Seq=108226 Ack=596 Win=424 Len=1444 TSval=867465126 TSecr=921758776 [TCP PDU reassembled in 566]"
"565","1.182960","100.86.235.39","151.101.65.140","TCP","66","56449  >  443 [ACK] Seq=596 Ack=109670 Win=5306 Len=0 TSval=921758785 TSecr=867465126"
"566","1.182999","151.101.65.140","100.86.235.39","TLSv1.2","674","Application Data"
"567","1.183021","100.86.235.39","151.101.65.140","TCP","66","56449  >  443 [ACK] Seq=596 Ack=110278 Win=5296 Len=0 TSval=921758786 TSecr=867465126"
"568","1.228318","151.101.65.140","100.86.235.39","TLSv1.2","438","Application Data"
"569","1.228415","100.86.235.39","151.101.65.140","TCP","66","56383  >  443 [ACK] Seq=47551 Ack=38654 Win=2042 Len=0 TSval=1359883200 TSecr=557108176"
