"No.","Time","Source","Destination","Protocol","Length","Info"
"9","0.031666","151.101.1.140","100.86.243.187","TLSv1.2","132","Application Data"
"10","0.031807","100.86.243.187","151.101.1.140","TCP","66","56485  >  443 [ACK] Seq=1 Ack=67 Win=3925 Len=0 TSval=2851243872 TSecr=1266189355"
"11","0.051700","151.101.1.140","100.86.243.187","TLSv1.2","175","Application Data"
"12","0.051944","100.86.243.187","151.101.1.140","TCP","66","56485  >  443 [ACK] Seq=1 Ack=176 Win=3925 Len=0 TSval=2851243892 TSecr=1266189374"
"17","0.074308","151.101.1.140","100.86.243.187","TLSv1.2","262","Application Data"
"19","0.076011","100.86.243.187","151.101.1.140","TCP","66","56485  >  443 [ACK] Seq=1 Ack=372 Win=3925 Len=0 TSval=2851243916 TSecr=1266189395"
"20","0.077448","151.101.1.140","100.86.243.187","TLSv1.2","166","Application Data"
"21","0.077684","100.86.243.187","151.101.1.140","TCP","66","56485  >  443 [ACK] Seq=1 Ack=472 Win=3925 Len=0 TSval=2851243918 TSecr=1266189401"
"22","0.096212","151.101.1.140","100.86.243.187","TLSv1.2","141","Application Data"
"23","0.096474","100.86.243.187","151.101.1.140","TCP","66","56485  >  443 [ACK] Seq=1 Ack=547 Win=3925 Len=0 TSval=2851243936 TSecr=1266189418"
"31","0.107496","151.101.1.140","100.86.243.187","TLSv1.2","138","Application Data"
"33","0.107868","100.86.243.187","151.101.1.140","TCP","66","56485  >  443 [ACK] Seq=1 Ack=619 Win=3925 Len=0 TSval=2851243947 TSecr=1266189431"
"34","0.120889","151.101.1.140","100.86.243.187","TLSv1.2","138","Application Data"
"35","0.121110","100.86.243.187","151.101.1.140","TCP","66","56485  >  443 [ACK] Seq=1 Ack=691 Win=3925 Len=0 TSval=2851243961 TSecr=1266189443"
"50","0.130896","151.101.1.140","100.86.243.187","TLSv1.2","138","Application Data"
"51","0.131014","100.86.243.187","151.101.1.140","TCP","66","56485  >  443 [ACK] Seq=1 Ack=763 Win=3925 Len=0 TSval=2851243971 TSecr=1266189450"
"52","0.133948","151.101.1.140","100.86.243.187","TLSv1.2","132","Application Data"
"53","0.134082","100.86.243.187","151.101.1.140","TCP","66","56485  >  443 [ACK] Seq=1 Ack=829 Win=3925 Len=0 TSval=2851243974 TSecr=1266189455"
"56","0.147094","151.101.1.140","100.86.243.187","TLSv1.2","170","Application Data"
"57","0.147095","151.101.1.140","100.86.243.187","TLSv1.2","185","Application Data"
"58","0.147095","151.101.1.140","100.86.243.187","TLSv1.2","211","Application Data"
"59","0.147294","100.86.243.187","151.101.1.140","TCP","66","56485  >  443 [ACK] Seq=1 Ack=1197 Win=3925 Len=0 TSval=2851243987 TSecr=1266189469"
"60","0.148757","151.101.1.140","100.86.243.187","TLSv1.2","141","Application Data"
"61","0.148758","151.101.1.140","100.86.243.187","TLSv1.2","138","Application Data"
"62","0.148942","100.86.243.187","151.101.1.140","TCP","66","56485  >  443 [ACK] Seq=1 Ack=1344 Win=3925 Len=0 TSval=2851243989 TSecr=1266189470"
"63","0.165154","151.101.1.140","100.86.243.187","TLSv1.2","875","Application Data, Application Data, Application Data, Application Data, Application Data, Application Data"
"64","0.165413","100.86.243.187","151.101.1.140","TCP","66","56485  >  443 [ACK] Seq=1 Ack=2153 Win=3925 Len=0 TSval=2851244005 TSecr=1266189488"
"70","0.170987","151.101.1.140","100.86.243.187","TLSv1.2","132","Application Data"
"71","0.171139","100.86.243.187","151.101.1.140","TCP","66","56485  >  443 [ACK] Seq=1 Ack=2219 Win=3925 Len=0 TSval=2851244011 TSecr=1266189494"
"72","0.172476","151.101.1.140","100.86.243.187","TLSv1.2","168","Application Data"
"73","0.172615","100.86.243.187","151.101.1.140","TCP","66","56485  >  443 [ACK] Seq=1 Ack=2321 Win=3925 Len=0 TSval=2851244013 TSecr=1266189495"
"84","0.215121","151.101.1.140","100.86.243.187","TLSv1.2","262","Application Data"
"85","0.215279","100.86.243.187","151.101.1.140","TCP","66","56485  >  443 [ACK] Seq=1 Ack=2517 Win=3925 Len=0 TSval=2851244055 TSecr=1266189533"
"86","0.217986","151.101.1.140","100.86.243.187","TLSv1.2","166","Application Data"
"87","0.218124","100.86.243.187","151.101.1.140","TCP","66","56485  >  443 [ACK] Seq=1 Ack=2617 Win=3925 Len=0 TSval=2851244058 TSecr=1266189537"
"88","0.223652","151.101.1.140","100.86.243.187","TLSv1.2","141","Application Data"
"90","0.223797","100.86.243.187","151.101.1.140","TCP","66","56485  >  443 [ACK] Seq=1 Ack=2692 Win=3925 Len=0 TSval=2851244064 TSecr=1266189543"
"91","0.227556","151.101.1.140","100.86.243.187","TLSv1.2","138","Application Data"
"92","0.227696","100.86.243.187","151.101.1.140","TCP","66","56485  >  443 [ACK] Seq=1 Ack=2764 Win=3925 Len=0 TSval=2851244068 TSecr=1266189549"
"93","0.234501","151.101.1.140","100.86.243.187","TLSv1.2","138","Application Data"
"94","0.234502","151.101.1.140","100.86.243.187","TLSv1.2","255","Application Data"
"95","0.234502","151.101.1.140","100.86.243.187","TLSv1.2","608","Application Data"
"96","0.234710","100.86.243.187","151.101.1.140","TCP","66","56485  >  443 [ACK] Seq=1 Ack=3567 Win=3925 Len=0 TSval=2851244075 TSecr=1266189555"
"97","0.237904","151.101.1.140","100.86.243.187","TLSv1.2","276","Application Data"
"98","0.238041","100.86.243.187","151.101.1.140","TCP","66","56485  >  443 [ACK] Seq=1 Ack=3777 Win=3925 Len=0 TSval=2851244078 TSecr=1266189556"
"99","0.250799","151.101.1.140","100.86.243.187","TLSv1.2","1510","Application Data, Application Data"
"100","0.252038","151.101.1.140","100.86.243.187","TLSv1.2","1510","Application Data, Application Data"
"101","0.252209","100.86.243.187","151.101.1.140","TCP","66","56485  >  443 [ACK] Seq=1 Ack=6665 Win=3925 Len=0 TSval=2851244092 TSecr=1266189573"
"105","0.253212","151.101.1.140","100.86.243.187","TLSv1.2","1498","Application Data, Application Data, Application Data, Application Data, Application Data, Application Data"
"106","0.253461","100.86.243.187","151.101.1.140","TCP","66","56485  >  443 [ACK] Seq=1 Ack=8097 Win=3925 Len=0 TSval=2851244093 TSecr=1266189575"
"113","0.259272","151.101.1.140","100.86.243.187","TLSv1.2","408","Application Data"
"114","0.259272","151.101.1.140","100.86.243.187","TLSv1.2","237","Application Data"
"115","0.259273","151.101.1.140","100.86.243.187","TLSv1.2","1168","Application Data"
"116","0.259273","151.101.1.140","100.86.243.187","TLSv1.2","739","Application Data"
"117","0.259474","100.86.243.187","151.101.1.140","TCP","66","56485  >  443 [ACK] Seq=1 Ack=10385 Win=3925 Len=0 TSval=2851244099 TSecr=1266189579"
"118","0.260524","151.101.1.140","100.86.243.187","TLSv1.2","1073","Application Data"
"119","0.260601","100.86.243.187","151.101.1.140","TCP","66","56485  >  443 [ACK] Seq=1 Ack=11392 Win=3925 Len=0 TSval=2851244101 TSecr=1266189580"
"120","0.272338","151.101.1.140","100.86.243.187","TLSv1.2","787","Application Data"
"121","0.272485","100.86.243.187","151.101.1.140","TCP","66","56485  >  443 [ACK] Seq=1 Ack=12113 Win=3925 Len=0 TSval=2851244112 TSecr=1266189594"
"122","0.279463","151.101.1.140","100.86.243.187","TLSv1.2","393","Application Data"
"123","0.279464","151.101.1.140","100.86.243.187","TLSv1.2","580","Application Data"
"124","0.279464","151.101.1.140","100.86.243.187","TLSv1.2","161","Application Data"
"125","0.279712","100.86.243.187","151.101.1.140","TCP","66","56485  >  443 [ACK] Seq=1 Ack=13049 Win=3925 Len=0 TSval=2851244120 TSecr=1266189597"
"126","0.284007","151.101.1.140","100.86.243.187","TLSv1.2","642","Application Data, Application Data, Application Data, Application Data, Application Data, Application Data, Application Data"
"130","0.284265","100.86.243.187","151.101.1.140","TCP","66","56485  >  443 [ACK] Seq=1 Ack=13625 Win=3925 Len=0 TSval=2851244123 TSecr=1266189599"
"136","0.288589","151.101.1.140","100.86.243.187","TLSv1.2","164","Application Data"
"137","0.289372","100.86.243.187","151.101.1.140","TCP","66","56485  >  443 [ACK] Seq=1 Ack=13723 Win=3925 Len=0 TSval=2851244129 TSecr=1266189611"
"170","0.468925","100.86.243.187","151.101.1.140","TCP","1514","56485  >  443 [ACK] Seq=1 Ack=13723 Win=3925 Len=1448 TSval=2851244309 TSecr=1266189611 [TCP PDU reassembled in 172]"
"171","0.468928","100.86.243.187","151.101.1.140","TCP","1514","56485  >  443 [ACK] Seq=1449 Ack=13723 Win=3925 Len=1448 TSval=2851244309 TSecr=1266189611 [TCP PDU reassembled in 172]"
"172","0.468974","100.86.243.187","151.101.1.140","TLSv1.2","149","Application Data"
"173","0.469030","100.86.243.187","151.101.1.140","TLSv1.2","222","Application Data"
"184","0.478287","151.101.1.140","100.86.243.187","TCP","66","443  >  56485 [ACK] Seq=13723 Ack=3136 Win=635 Len=0 TSval=1266189802 TSecr=2851244309"
"185","0.480166","100.86.243.187","151.101.1.140","TCP","1514","56485  >  443 [ACK] Seq=3136 Ack=13723 Win=3925 Len=1448 TSval=2851244320 TSecr=1266189802 [TCP PDU reassembled in 187]"
"186","0.480168","100.86.243.187","151.101.1.140","TCP","1514","56485  >  443 [ACK] Seq=4584 Ack=13723 Win=3925 Len=1448 TSval=2851244320 TSecr=1266189802 [TCP PDU reassembled in 187]"
"187","0.480211","100.86.243.187","151.101.1.140","TLSv1.2","150","Application Data"
"188","0.480265","100.86.243.187","151.101.1.140","TLSv1.2","284","Application Data"
"198","0.489642","151.101.1.140","100.86.243.187","TCP","66","443  >  56485 [ACK] Seq=13723 Ack=6334 Win=631 Len=0 TSval=1266189813 TSecr=2851244320"
"205","0.513863","100.86.243.187","151.101.1.140","TCP","1514","56485  >  443 [ACK] Seq=6334 Ack=13723 Win=3925 Len=1448 TSval=2851244354 TSecr=1266189813 [TCP PDU reassembled in 207]"
"206","0.513865","100.86.243.187","151.101.1.140","TCP","1514","56485  >  443 [ACK] Seq=7782 Ack=13723 Win=3925 Len=1448 TSval=2851244354 TSecr=1266189813 [TCP PDU reassembled in 207]"
"207","0.513910","100.86.243.187","151.101.1.140","TLSv1.2","137","Application Data"
"208","0.513984","100.86.243.187","151.101.1.140","TLSv1.2","924","Application Data"
"209","0.521950","100.86.243.187","151.101.1.140","TCP","1514","56485  >  443 [ACK] Seq=10159 Ack=13723 Win=3925 Len=1448 TSval=2851244362 TSecr=1266189813 [TCP PDU reassembled in 211]"
"210","0.521952","100.86.243.187","151.101.1.140","TCP","1514","56485  >  443 [ACK] Seq=11607 Ack=13723 Win=3925 Len=1448 TSval=2851244362 TSecr=1266189813 [TCP PDU reassembled in 211]"
"211","0.521993","100.86.243.187","151.101.1.140","TLSv1.2","123","Application Data"
"212","0.523793","151.101.1.140","100.86.243.187","TCP","66","443  >  56485 [ACK] Seq=13723 Ack=10159 Win=630 Len=0 TSval=1266189847 TSecr=2851244354"
"213","0.532139","151.101.1.140","100.86.243.187","TCP","66","443  >  56485 [ACK] Seq=13723 Ack=13112 Win=635 Len=0 TSval=1266189855 TSecr=2851244362"
"215","0.546291","151.101.1.140","100.86.243.187","TCP","1510","443  >  56485 [ACK] Seq=13723 Ack=13112 Win=639 Len=1444 TSval=1266189870 TSecr=2851244362 [TCP PDU reassembled in 217]"
"216","0.546385","100.86.243.187","151.101.1.140","TCP","66","56485  >  443 [ACK] Seq=13112 Ack=15167 Win=3903 Len=0 TSval=2851244386 TSecr=1266189870"
"217","0.546754","151.101.1.140","100.86.243.187","TLSv1.2","956","Application Data"
"218","0.546814","100.86.243.187","151.101.1.140","TCP","66","56485  >  443 [ACK] Seq=13112 Ack=16057 Win=3911 Len=0 TSval=2851244386 TSecr=1266189870"
"219","0.549934","151.101.1.140","100.86.243.187","TCP","1510","443  >  56485 [ACK] Seq=16057 Ack=13112 Win=639 Len=1444 TSval=1266189873 TSecr=2851244362 [TCP PDU reassembled in 220]"
"220","0.549975","151.101.1.140","100.86.243.187","TLSv1.2","231","Application Data"
"221","0.550102","100.86.243.187","151.101.1.140","TCP","66","56485  >  443 [ACK] Seq=13112 Ack=17666 Win=3925 Len=0 TSval=2851244390 TSecr=1266189873"
"222","0.550813","151.101.1.140","100.86.243.187","TLSv1.2","234","Application Data"
"223","0.550941","100.86.243.187","151.101.1.140","TCP","66","56485  >  443 [ACK] Seq=13112 Ack=17834 Win=3925 Len=0 TSval=2851244390 TSecr=1266189874"
"224","0.571916","151.101.1.140","100.86.243.187","TCP","1510","443  >  56485 [ACK] Seq=17834 Ack=13112 Win=639 Len=1444 TSval=1266189895 TSecr=2851244390 [TCP PDU reassembled in 225]"
"225","0.571918","151.101.1.140","100.86.243.187","TLSv1.2","935","Application Data"
"226","0.572155","100.86.243.187","151.101.1.140","TCP","66","56485  >  443 [ACK] Seq=13112 Ack=20147 Win=3925 Len=0 TSval=2851244412 TSecr=1266189895"
"227","0.574731","100.86.243.187","151.101.1.140","TCP","1514","56485  >  443 [ACK] Seq=13112 Ack=20147 Win=3925 Len=1448 TSval=2851244415 TSecr=1266189895 [TCP PDU reassembled in 229]"
"228","0.574732","100.86.243.187","151.101.1.140","TCP","1514","56485  >  443 [ACK] Seq=14560 Ack=20147 Win=3925 Len=1448 TSval=2851244415 TSecr=1266189895 [TCP PDU reassembled in 229]"
"229","0.574777","100.86.243.187","151.101.1.140","TLSv1.2","119","Application Data"
"230","0.584955","151.101.1.140","100.86.243.187","TCP","66","443  >  56485 [ACK] Seq=20147 Ack=16061 Win=635 Len=0 TSval=1266189908 TSecr=2851244415"
"232","0.595242","100.86.243.187","151.101.1.140","TCP","1514","56485  >  443 [ACK] Seq=16061 Ack=20147 Win=3925 Len=1448 TSval=2851244435 TSecr=1266189908 [TCP PDU reassembled in 233]"
"233","0.595336","100.86.243.187","151.101.1.140","TLSv1.2","1447","Application Data"
"234","0.605430","151.101.1.140","100.86.243.187","TCP","66","443  >  56485 [ACK] Seq=20147 Ack=18890 Win=635 Len=0 TSval=1266189929 TSecr=2851244435"
"235","0.623443","151.101.1.140","100.86.243.187","TCP","1510","443  >  56485 [ACK] Seq=20147 Ack=18890 Win=639 Len=1444 TSval=1266189946 TSecr=2851244435 [TCP PDU reassembled in 236]"
"236","0.623444","151.101.1.140","100.86.243.187","TLSv1.2","268","Application Data"
"237","0.623568","100.86.243.187","151.101.1.140","TCP","66","56485  >  443 [ACK] Seq=18890 Ack=21793 Win=3900 Len=0 TSval=2851244464 TSecr=1266189946"
"238","0.628961","151.101.1.140","100.86.243.187","TCP","1510","443  >  56485 [ACK] Seq=21793 Ack=18890 Win=639 Len=1444 TSval=1266189952 TSecr=2851244435 [TCP PDU reassembled in 243]"
"239","0.629080","100.86.243.187","151.101.1.140","TCP","66","56485  >  443 [ACK] Seq=18890 Ack=23237 Win=3903 Len=0 TSval=2851244469 TSecr=1266189952"
"240","0.629821","151.101.1.140","100.86.243.187","TCP","1510","443  >  56485 [PSH, ACK] Seq=23237 Ack=18890 Win=639 Len=1444 TSval=1266189952 TSecr=2851244435 [TCP PDU reassembled in 243]"
"241","0.629998","100.86.243.187","151.101.1.140","TCP","66","56485  >  443 [ACK] Seq=18890 Ack=24681 Win=3925 Len=0 TSval=2851244469 TSecr=1266189952"
"242","0.630589","151.101.1.140","100.86.243.187","TCP","1510","443  >  56485 [ACK] Seq=24681 Ack=18890 Win=639 Len=1444 TSval=1266189954 TSecr=2851244435 [TCP PDU reassembled in 243]"
"243","0.630854","151.101.1.140","100.86.243.187","TLSv1.2","1445","Application Data"
"244","0.631361","100.86.243.187","151.101.1.140","TCP","66","56485  >  443 [ACK] Seq=18890 Ack=27504 Win=3925 Len=0 TSval=2851244471 TSecr=1266189954"
"245","0.633341","151.101.1.140","100.86.243.187","TCP","1510","443  >  56485 [ACK] Seq=27504 Ack=18890 Win=639 Len=1444 TSval=1266189956 TSecr=2851244435 [TCP PDU reassembled in 246]"
"246","0.633342","151.101.1.140","100.86.243.187","TLSv1.2","327","Application Data"
"247","0.633481","100.86.243.187","151.101.1.140","TCP","66","56485  >  443 [ACK] Seq=18890 Ack=29209 Win=3925 Len=0 TSval=2851244473 TSecr=1266189956"
"248","0.672934","151.101.1.140","100.86.243.187","TLSv1.2","428","Application Data"
"249","0.673100","100.86.243.187","151.101.1.140","TCP","66","56485  >  443 [ACK] Seq=18890 Ack=29571 Win=3925 Len=0 TSval=2851244513 TSecr=1266189996"
"250","0.678445","151.101.1.140","100.86.243.187","TLSv1.2","107","Application Data"
"251","0.678603","100.86.243.187","151.101.1.140","TCP","66","56485  >  443 [ACK] Seq=18890 Ack=29612 Win=3925 Len=0 TSval=2851244519 TSecr=1266190002"
"252","0.689703","100.86.243.187","151.101.1.140","TCP","1514","56485  >  443 [ACK] Seq=18890 Ack=29612 Win=3925 Len=1448 TSval=2851244530 TSecr=1266190002 [TCP PDU reassembled in 253]"
"253","0.689747","100.86.243.187","151.101.1.140","TLSv1.2","1440","Application Data"
"254","0.690162","100.86.243.187","151.101.1.140","TCP","1514","56485  >  443 [ACK] Seq=21712 Ack=29612 Win=3925 Len=1448 TSval=2851244530 TSecr=1266190002 [TCP PDU reassembled in 255]"
"255","0.690187","100.86.243.187","151.101.1.140","TLSv1.2","1455","Application Data"
"256","0.700277","151.101.1.140","100.86.243.187","TCP","66","443  >  56485 [ACK] Seq=29612 Ack=21712 Win=634 Len=0 TSval=1266190023 TSecr=2851244530"
"257","0.700278","151.101.1.140","100.86.243.187","TCP","66","443  >  56485 [ACK] Seq=29612 Ack=24549 Win=631 Len=0 TSval=1266190023 TSecr=2851244530"
"258","0.721284","151.101.1.140","100.86.243.187","TCP","1510","443  >  56485 [ACK] Seq=29612 Ack=24549 Win=639 Len=1444 TSval=1266190044 TSecr=2851244530 [TCP PDU reassembled in 259]"
"259","0.721313","151.101.1.140","100.86.243.187","TLSv1.2","942","Application Data"
"260","0.721399","100.86.243.187","151.101.1.140","TCP","66","56485  >  443 [ACK] Seq=24549 Ack=31056 Win=3903 Len=0 TSval=2851244561 TSecr=1266190044"
"261","0.721519","100.86.243.187","151.101.1.140","TCP","66","56485  >  443 [ACK] Seq=24549 Ack=31932 Win=3925 Len=0 TSval=2851244561 TSecr=1266190044"
"262","0.728298","151.101.1.140","100.86.243.187","TCP","1510","443  >  56485 [ACK] Seq=31932 Ack=24549 Win=639 Len=1444 TSval=1266190051 TSecr=2851244530 [TCP PDU reassembled in 263]"
"263","0.728330","151.101.1.140","100.86.243.187","TLSv1.2","279","Application Data"
"264","0.728449","100.86.243.187","151.101.1.140","TCP","66","56485  >  443 [ACK] Seq=24549 Ack=33589 Win=3925 Len=0 TSval=2851244568 TSecr=1266190051"
"265","0.728614","151.101.1.140","100.86.243.187","TLSv1.2","112","Application Data"
"266","0.728821","100.86.243.187","151.101.1.140","TCP","66","56485  >  443 [ACK] Seq=24549 Ack=33635 Win=3925 Len=0 TSval=2851244568 TSecr=1266190052"
"267","0.775853","151.101.1.140","100.86.243.187","TLSv1.2","825","Application Data"
"268","0.775992","100.86.243.187","151.101.1.140","TCP","66","56485  >  443 [ACK] Seq=24549 Ack=34394 Win=3925 Len=0 TSval=2851244616 TSecr=1266190097"
"444","0.989890","151.101.1.140","100.86.243.187","TLSv1.2","1051","Application Data"
"445","0.990019","100.86.243.187","151.101.1.140","TCP","66","56485  >  443 [ACK] Seq=24549 Ack=35379 Win=3925 Len=0 TSval=2851244829 TSecr=1266190313"
"466","1.003488","100.86.243.187","151.101.1.140","TLSv1.2","205","Application Data"
"468","1.009638","100.86.243.187","151.101.1.140","TLSv1.2","205","Application Data"
"469","1.009909","100.86.243.187","151.101.1.140","TLSv1.2","206","Application Data"
"470","1.013138","151.101.1.140","100.86.243.187","TCP","66","443  >  56509 [ACK] Seq=1 Ack=140 Win=424 Len=0 TSval=3914451064 TSecr=514151592"
"471","1.015024","151.101.1.140","100.86.243.187","TCP","1510","443  >  56509 [ACK] Seq=1 Ack=140 Win=424 Len=1444 TSval=3914451066 TSecr=514151592 [TCP PDU reassembled in 477]"
"472","1.015051","151.101.1.140","100.86.243.187","TCP","1510","443  >  56509 [PSH, ACK] Seq=1445 Ack=140 Win=424 Len=1444 TSval=3914451066 TSecr=514151592 [TCP PDU reassembled in 477]"
"473","1.015094","100.86.243.187","151.101.1.140","TCP","66","56509  >  443 [ACK] Seq=419 Ack=1445 Win=7002 Len=0 TSval=514151604 TSecr=3914451066"
"474","1.015177","100.86.243.187","151.101.1.140","TCP","66","56509  >  443 [ACK] Seq=419 Ack=2889 Win=6980 Len=0 TSval=514151604 TSecr=3914451066"
"475","1.015754","151.101.1.140","100.86.243.187","TCP","1510","443  >  56509 [ACK] Seq=2889 Ack=140 Win=424 Len=1444 TSval=3914451067 TSecr=514151592 [TCP PDU reassembled in 477]"
"476","1.015817","100.86.243.187","151.101.1.140","TCP","66","56509  >  443 [ACK] Seq=419 Ack=4333 Win=7002 Len=0 TSval=514151604 TSecr=3914451067"
"477","1.016186","151.101.1.140","100.86.243.187","TLSv1.2","435","Application Data"
"478","1.016238","100.86.243.187","151.101.1.140","TCP","66","56509  >  443 [ACK] Seq=419 Ack=4702 Win=7019 Len=0 TSval=514151605 TSecr=3914451067"
"479","1.019106","151.101.1.140","100.86.243.187","TCP","66","443  >  56509 [ACK] Seq=4702 Ack=279 Win=424 Len=0 TSval=3914451070 TSecr=514151599"
"480","1.019776","151.101.1.140","100.86.243.187","TCP","66","443  >  56509 [ACK] Seq=4702 Ack=419 Win=424 Len=0 TSval=3914451071 TSecr=514151599"
"481","1.021004","151.101.1.140","100.86.243.187","TLSv1.2","169","Application Data"
"482","1.021086","100.86.243.187","151.101.1.140","TCP","66","56509  >  443 [ACK] Seq=419 Ack=4805 Win=7023 Len=0 TSval=514151610 TSecr=3914451072"
"483","1.021620","151.101.1.140","100.86.243.187","TCP","1510","443  >  56509 [ACK] Seq=4805 Ack=419 Win=424 Len=1444 TSval=3914451072 TSecr=514151599 [TCP PDU reassembled in 489]"
"484","1.021621","151.101.1.140","100.86.243.187","TCP","1510","443  >  56509 [PSH, ACK] Seq=6249 Ack=419 Win=424 Len=1444 TSval=3914451072 TSecr=514151599 [TCP PDU reassembled in 489]"
"485","1.021680","100.86.243.187","151.101.1.140","TCP","66","56509  >  443 [ACK] Seq=419 Ack=7693 Win=6980 Len=0 TSval=514151610 TSecr=3914451072"
"488","1.023729","151.101.1.140","100.86.243.187","TCP","1510","443  >  56509 [ACK] Seq=7693 Ack=419 Win=424 Len=1444 TSval=3914451074 TSecr=514151599 [TCP PDU reassembled in 489]"
"489","1.023730","151.101.1.140","100.86.243.187","TLSv1.2","111","Application Data"
"490","1.023785","100.86.243.187","151.101.1.140","TCP","66","56509  >  443 [ACK] Seq=419 Ack=9182 Win=7002 Len=0 TSval=514151613 TSecr=3914451074"
"491","1.033063","151.101.1.140","100.86.243.187","TCP","1510","443  >  56509 [ACK] Seq=9182 Ack=419 Win=424 Len=1444 TSval=3914451084 TSecr=514151605 [TCP PDU reassembled in 495]"
"492","1.033139","100.86.243.187","151.101.1.140","TCP","66","56509  >  443 [ACK] Seq=419 Ack=10626 Win=7002 Len=0 TSval=514151622 TSecr=3914451084"
"493","1.033704","151.101.1.140","100.86.243.187","TCP","1510","443  >  56509 [PSH, ACK] Seq=10626 Ack=419 Win=424 Len=1444 TSval=3914451084 TSecr=514151605 [TCP PDU reassembled in 495]"
"494","1.033774","100.86.243.187","151.101.1.140","TCP","66","56509  >  443 [ACK] Seq=419 Ack=12070 Win=7002 Len=0 TSval=514151622 TSecr=3914451084"
"495","1.034094","151.101.1.140","100.86.243.187","TLSv1.2","1281","Application Data"
"496","1.034163","100.86.243.187","151.101.1.140","TCP","66","56509  >  443 [ACK] Seq=419 Ack=13285 Win=7006 Len=0 TSval=514151623 TSecr=3914451085"
"567","1.218856","100.86.243.187","151.101.1.140","TCP","1514","56485  >  443 [ACK] Seq=24549 Ack=35379 Win=3925 Len=1448 TSval=2851245059 TSecr=1266190313 [TCP PDU reassembled in 569]"
"568","1.218859","100.86.243.187","151.101.1.140","TCP","1514","56485  >  443 [ACK] Seq=25997 Ack=35379 Win=3925 Len=1448 TSval=2851245059 TSecr=1266190313 [TCP PDU reassembled in 569]"
"569","1.218894","100.86.243.187","151.101.1.140","TLSv1.2","152","Application Data"
"570","1.218951","100.86.243.187","151.101.1.140","TCP","1514","56485  >  443 [ACK] Seq=27531 Ack=35379 Win=3925 Len=1448 TSval=2851245059 TSecr=1266190313 [TCP PDU reassembled in 571]"
"571","1.218961","100.86.243.187","151.101.1.140","TLSv1.2","1063","Application Data"
"576","1.228797","151.101.1.140","100.86.243.187","TCP","66","443  >  56485 [ACK] Seq=35379 Ack=27445 Win=634 Len=0 TSval=1266190552 TSecr=2851245059"
"577","1.228798","151.101.1.140","100.86.243.187","TCP","66","443  >  56485 [ACK] Seq=35379 Ack=29976 Win=635 Len=0 TSval=1266190552 TSecr=2851245059"
"594","1.267995","151.101.1.140","100.86.243.187","TCP","1510","443  >  56485 [ACK] Seq=35379 Ack=29976 Win=639 Len=1444 TSval=1266190590 TSecr=2851245059 [TCP PDU reassembled in 596]"
"595","1.268070","100.86.243.187","151.101.1.140","TCP","66","56485  >  443 [ACK] Seq=29976 Ack=36823 Win=3903 Len=0 TSval=2851245108 TSecr=1266190590"
"596","1.268251","151.101.1.140","100.86.243.187","TLSv1.2","920","Application Data"
"597","1.268299","100.86.243.187","151.101.1.140","TCP","66","56485  >  443 [ACK] Seq=29976 Ack=37677 Win=3912 Len=0 TSval=2851245108 TSecr=1266190590"
"598","1.268821","151.101.1.140","100.86.243.187","TLSv1.2","206","Application Data"
"599","1.268868","100.86.243.187","151.101.1.140","TCP","66","56485  >  443 [ACK] Seq=29976 Ack=37817 Win=3923 Len=0 TSval=2851245108 TSecr=1266190591"
