"No.","Time","Source","Destination","Protocol","Length","Info"
"1","0.000000","2600:4040:13e3:bf00:44e8:32de:8bf3:cac2","2620:0:861:ed1a::1","TLSv1.2","155","Application Data"
"2","0.000020","2600:4040:13e3:bf00:44e8:32de:8bf3:cac2","2620:0:861:ed1a::1","TLSv1.2","113","Application Data"
"3","0.015928","2620:0:861:ed1a::1","2600:4040:13e3:bf00:44e8:32de:8bf3:cac2","TCP","74","443  >  49913 [ACK] Seq=1 Ack=121 Win=83 Len=0"
"4","0.015928","2620:0:861:ed1a::1","2600:4040:13e3:bf00:44e8:32de:8bf3:cac2","TLSv1.2","113","Application Data"
"5","0.015928","2620:0:861:ed1a::1","2600:4040:13e3:bf00:44e8:32de:8bf3:cac2","TCP","1514","443  >  49913 [ACK] Seq=40 Ack=121 Win=83 Len=1440 [TCP PDU reassembled in 6]"
"6","0.015928","2620:0:861:ed1a::1","2600:4040:13e3:bf00:44e8:32de:8bf3:cac2","TLSv1.2","1385","Application Data"
"7","0.015998","2600:4040:13e3:bf00:44e8:32de:8bf3:cac2","2620:0:861:ed1a::1","TCP","74","49913  >  443 [ACK] Seq=121 Ack=2791 Win=511 Len=0"
"8","0.016835","2600:4040:13e3:bf00:44e8:32de:8bf3:cac2","2620:0:861:ed1a::1","TLSv1.2","109","Application Data"
"9","0.075499","2620:0:861:ed1a::1","2600:4040:13e3:bf00:44e8:32de:8bf3:cac2","TCP","74","443  >  49913 [ACK] Seq=2791 Ack=156 Win=83 Len=0"
"10","0.793484","2600:4040:13e3:bf00:44e8:32de:8bf3:cac2","2620:0:861:ed1a::1","TLSv1.2","147","Application Data"
"11","0.808175","2620:0:861:ed1a::1","2600:4040:13e3:bf00:44e8:32de:8bf3:cac2","TCP","74","443  >  49913 [ACK] Seq=2791 Ack=229 Win=83 Len=0"
"12","0.809669","2620:0:861:ed1a::1","2600:4040:13e3:bf00:44e8:32de:8bf3:cac2","TCP","1514","443  >  49913 [ACK] Seq=2791 Ack=229 Win=83 Len=1440 [TCP PDU reassembled in 16]"
"13","0.809669","2620:0:861:ed1a::1","2600:4040:13e3:bf00:44e8:32de:8bf3:cac2","TCP","1514","443  >  49913 [ACK] Seq=4231 Ack=229 Win=83 Len=1440 [TCP PDU reassembled in 16]"
"14","0.809669","2620:0:861:ed1a::1","2600:4040:13e3:bf00:44e8:32de:8bf3:cac2","TCP","1514","443  >  49913 [ACK] Seq=5671 Ack=229 Win=83 Len=1440 [TCP PDU reassembled in 16]"
"15","0.809669","2620:0:861:ed1a::1","2600:4040:13e3:bf00:44e8:32de:8bf3:cac2","TCP","1514","443  >  49913 [ACK] Seq=7111 Ack=229 Win=83 Len=1440 [TCP PDU reassembled in 16]"
"16","0.809669","2620:0:861:ed1a::1","2600:4040:13e3:bf00:44e8:32de:8bf3:cac2","TLSv1.2","24554","Application Data"
"17","0.809669","2620:0:861:ed1a::1","2600:4040:13e3:bf00:44e8:32de:8bf3:cac2","TLSv1.2","737","Application Data"
"18","0.809669","2620:0:861:ed1a::1","2600:4040:13e3:bf00:44e8:32de:8bf3:cac2","TCP","15914","443  >  49913 [ACK] Seq=33694 Ack=229 Win=83 Len=15840 [TCP PDU reassembled in 20]"
"19","0.809725","2600:4040:13e3:bf00:44e8:32de:8bf3:cac2","2620:0:861:ed1a::1","TCP","74","49913  >  443 [ACK] Seq=229 Ack=49534 Win=511 Len=0"
"20","0.809778","2620:0:861:ed1a::1","2600:4040:13e3:bf00:44e8:32de:8bf3:cac2","TLSv1.2","585","Application Data"
"21","0.809784","2600:4040:13e3:bf00:44e8:32de:8bf3:cac2","2620:0:861:ed1a::1","TCP","74","49913  >  443 [ACK] Seq=229 Ack=50045 Win=509 Len=0"
"22","0.810913","2620:0:861:ed1a::1","2600:4040:13e3:bf00:44e8:32de:8bf3:cac2","TLSv1.2","23114","Application Data"
"23","0.810934","2600:4040:13e3:bf00:44e8:32de:8bf3:cac2","2620:0:861:ed1a::1","TCP","74","49913  >  443 [ACK] Seq=229 Ack=73085 Win=511 Len=0"
"24","0.811164","2620:0:861:ed1a::1","2600:4040:13e3:bf00:44e8:32de:8bf3:cac2","TLSv1.2","14474","Application Data"
"25","0.811164","2620:0:861:ed1a::1","2600:4040:13e3:bf00:44e8:32de:8bf3:cac2","TLSv1.2","1273","Application Data"
"26","0.811185","2600:4040:13e3:bf00:44e8:32de:8bf3:cac2","2620:0:861:ed1a::1","TCP","74","49913  >  443 [ACK] Seq=229 Ack=88684 Win=511 Len=0"
"27","0.824609","2600:4040:13e3:bf00:44e8:32de:8bf3:cac2","2620:0:861:ed1a::1","TLSv1.2","344","Application Data"
"28","0.824647","2600:4040:13e3:bf00:44e8:32de:8bf3:cac2","2620:0:861:ed1a::1","TLSv1.2","182","Application Data"
"29","0.824680","2600:4040:13e3:bf00:44e8:32de:8bf3:cac2","2620:0:861:ed1a::1","TLSv1.2","180","Application Data"
"30","0.824710","2600:4040:13e3:bf00:44e8:32de:8bf3:cac2","2620:0:861:ed1a::1","TLSv1.2","219","Application Data"
"31","0.835019","2600:4040:13e3:bf00:44e8:32de:8bf3:cac2","2620:0:861:ed1a::1","TLSv1.2","156","Application Data"
"32","0.835053","2600:4040:13e3:bf00:44e8:32de:8bf3:cac2","2620:0:861:ed1a::1","TLSv1.2","171","Application Data"
"33","0.838054","2620:0:861:ed1a::1","2600:4040:13e3:bf00:44e8:32de:8bf3:cac2","TCP","74","443  >  49913 [ACK] Seq=88684 Ack=858 Win=83 Len=0"
"34","0.838660","2620:0:861:ed1a::1","2600:4040:13e3:bf00:44e8:32de:8bf3:cac2","TCP","14474","443  >  49913 [PSH, ACK] Seq=88684 Ack=858 Win=83 Len=14400 [TCP PDU reassembled in 36]"
"35","0.838689","2600:4040:13e3:bf00:44e8:32de:8bf3:cac2","2620:0:861:ed1a::1","TCP","74","49913  >  443 [ACK] Seq=1037 Ack=103084 Win=511 Len=0"
"36","0.839101","2620:0:861:ed1a::1","2600:4040:13e3:bf00:44e8:32de:8bf3:cac2","TLSv1.2","7274","Application Data"
"37","0.839101","2620:0:861:ed1a::1","2600:4040:13e3:bf00:44e8:32de:8bf3:cac2","TLSv1.2","1151","Application Data"
"38","0.839101","2620:0:861:ed1a::1","2600:4040:13e3:bf00:44e8:32de:8bf3:cac2","TCP","7274","443  >  49913 [PSH, ACK] Seq=111361 Ack=858 Win=83 Len=7200 [TCP PDU reassembled in 40]"
"39","0.839160","2600:4040:13e3:bf00:44e8:32de:8bf3:cac2","2620:0:861:ed1a::1","TCP","74","49913  >  443 [ACK] Seq=1037 Ack=118561 Win=511 Len=0"
"40","0.840110","2620:0:861:ed1a::1","2600:4040:13e3:bf00:44e8:32de:8bf3:cac2","TLSv1.2","13034","Application Data"
"41","0.840132","2600:4040:13e3:bf00:44e8:32de:8bf3:cac2","2620:0:861:ed1a::1","TCP","74","49913  >  443 [ACK] Seq=1037 Ack=131521 Win=511 Len=0"
"42","0.840303","2620:0:861:ed1a::1","2600:4040:13e3:bf00:44e8:32de:8bf3:cac2","TLSv1.2","7274","Application Data"
"43","0.840303","2620:0:861:ed1a::1","2600:4040:13e3:bf00:44e8:32de:8bf3:cac2","TLSv1.2","510","Application Data"
"44","0.840330","2600:4040:13e3:bf00:44e8:32de:8bf3:cac2","2620:0:861:ed1a::1","TCP","74","49913  >  443 [ACK] Seq=1037 Ack=139157 Win=511 Len=0"
"45","0.848382","2620:0:861:ed1a::1","2600:4040:13e3:bf00:44e8:32de:8bf3:cac2","TCP","74","443  >  49913 [ACK] Seq=139157 Ack=1037 Win=83 Len=0"
"46","0.849662","2600:4040:13e3:bf00:44e8:32de:8bf3:cac2","2620:0:861:ed1a::1","TLSv1.2","438","Application Data"
"47","0.850126","2600:4040:13e3:bf00:44e8:32de:8bf3:cac2","2620:0:861:ed1a::1","TLSv1.2","602","Application Data"
"48","0.851393","2620:0:861:ed1a::1","2600:4040:13e3:bf00:44e8:32de:8bf3:cac2","TCP","13034","443  >  49913 [ACK] Seq=139157 Ack=1037 Win=83 Len=12960 [TCP PDU reassembled in 49]"
"49","0.851393","2620:0:861:ed1a::1","2600:4040:13e3:bf00:44e8:32de:8bf3:cac2","TLSv1.2","1317","Application Data"
"50","0.851393","2620:0:861:ed1a::1","2600:4040:13e3:bf00:44e8:32de:8bf3:cac2","TCP","2954","443  >  49913 [ACK] Seq=153360 Ack=1037 Win=83 Len=2880 [TCP PDU reassembled in 51]"
"51","0.851393","2620:0:861:ed1a::1","2600:4040:13e3:bf00:44e8:32de:8bf3:cac2","TLSv1.2","1245","Application Data"
"52","0.851502","2600:4040:13e3:bf00:44e8:32de:8bf3:cac2","2620:0:861:ed1a::1","TCP","74","49913  >  443 [ACK] Seq=1929 Ack=157411 Win=511 Len=0"
"53","0.854069","2600:4040:13e3:bf00:44e8:32de:8bf3:cac2","2620:0:861:ed1a::1","TLSv1.2","246","Application Data"
"54","0.854102","2600:4040:13e3:bf00:44e8:32de:8bf3:cac2","2620:0:861:ed1a::1","TLSv1.2","194","Application Data"
"55","0.863058","2620:0:861:ed1a::1","2600:4040:13e3:bf00:44e8:32de:8bf3:cac2","TLSv1.2","1125","Application Data"
"56","0.863749","2600:4040:13e3:bf00:44e8:32de:8bf3:cac2","2620:0:861:ed1a::1","TLSv1.2","182","Application Data"
"57","0.866698","2620:0:861:ed1a::1","2600:4040:13e3:bf00:44e8:32de:8bf3:cac2","TLSv1.2","1125","Application Data"
"58","0.866721","2600:4040:13e3:bf00:44e8:32de:8bf3:cac2","2620:0:861:ed1a::1","TCP","74","49913  >  443 [ACK] Seq=2329 Ack=159513 Win=511 Len=0"
"59","0.867466","2600:4040:13e3:bf00:44e8:32de:8bf3:cac2","2620:0:861:ed1a::1","TLSv1.2","202","Application Data"
"60","0.869592","2620:0:861:ed1a::1","2600:4040:13e3:bf00:44e8:32de:8bf3:cac2","TCP","74","443  >  49913 [ACK] Seq=159513 Ack=2221 Win=83 Len=0"
"61","0.869592","2620:0:861:ed1a::1","2600:4040:13e3:bf00:44e8:32de:8bf3:cac2","TLSv1.2","1068","Application Data"
"62","0.869592","2620:0:861:ed1a::1","2600:4040:13e3:bf00:44e8:32de:8bf3:cac2","TLSv1.2","1379","Application Data"
"63","0.869646","2600:4040:13e3:bf00:44e8:32de:8bf3:cac2","2620:0:861:ed1a::1","TCP","74","49913  >  443 [ACK] Seq=2457 Ack=161812 Win=511 Len=0"
"64","0.878010","2620:0:861:ed1a::1","2600:4040:13e3:bf00:44e8:32de:8bf3:cac2","TLSv1.2","1122","Application Data"
"65","0.880120","2620:0:861:ed1a::1","2600:4040:13e3:bf00:44e8:32de:8bf3:cac2","TLSv1.2","1116","Application Data"
"66","0.880146","2600:4040:13e3:bf00:44e8:32de:8bf3:cac2","2620:0:861:ed1a::1","TCP","74","49913  >  443 [ACK] Seq=2457 Ack=163902 Win=511 Len=0"
"67","0.944387","2600:4040:13e3:bf00:44e8:32de:8bf3:cac2","2620:0:861:ed1a::1","TLSv1.2","202","Application Data"
"68","0.944452","2600:4040:13e3:bf00:44e8:32de:8bf3:cac2","2620:0:861:ed1a::1","TLSv1.2","309","Application Data"
"69","0.944560","2600:4040:13e3:bf00:44e8:32de:8bf3:cac2","2620:0:861:ed1a::1","TLSv1.2","1031","Application Data"
"70","0.957970","2600:4040:13e3:bf00:44e8:32de:8bf3:cac2","2620:0:861:ed1a::1","TLSv1.2","217","Application Data"
"71","0.958043","2620:0:861:ed1a::1","2600:4040:13e3:bf00:44e8:32de:8bf3:cac2","TCP","74","443  >  49913 [ACK] Seq=163902 Ack=2820 Win=83 Len=0"
"72","0.958043","2620:0:861:ed1a::1","2600:4040:13e3:bf00:44e8:32de:8bf3:cac2","TCP","7274","443  >  49913 [ACK] Seq=163902 Ack=3777 Win=83 Len=7200 [TCP PDU reassembled in 73]"
"73","0.958043","2620:0:861:ed1a::1","2600:4040:13e3:bf00:44e8:32de:8bf3:cac2","TLSv1.2","796","Application Data"
"74","0.958043","2620:0:861:ed1a::1","2600:4040:13e3:bf00:44e8:32de:8bf3:cac2","TCP","14474","443  >  49913 [PSH, ACK] Seq=171824 Ack=3777 Win=83 Len=14400 [TCP PDU reassembled in 76]"
"75","0.958089","2600:4040:13e3:bf00:44e8:32de:8bf3:cac2","2620:0:861:ed1a::1","TCP","74","49913  >  443 [ACK] Seq=3920 Ack=186224 Win=511 Len=0"
"76","0.959585","2620:0:861:ed1a::1","2600:4040:13e3:bf00:44e8:32de:8bf3:cac2","TLSv1.2","2954","Application Data"
"77","0.959585","2620:0:861:ed1a::1","2600:4040:13e3:bf00:44e8:32de:8bf3:cac2","TLSv1.2","485","Application Data"
"78","0.959585","2620:0:861:ed1a::1","2600:4040:13e3:bf00:44e8:32de:8bf3:cac2","TLSv1.2","37514","Application Data, Application Data"
"79","0.959623","2600:4040:13e3:bf00:44e8:32de:8bf3:cac2","2620:0:861:ed1a::1","TCP","74","49913  >  443 [ACK] Seq=3920 Ack=226955 Win=511 Len=0"
"80","0.960836","2620:0:861:ed1a::1","2600:4040:13e3:bf00:44e8:32de:8bf3:cac2","TLSv1.2","23114","Application Data"
"81","0.960861","2600:4040:13e3:bf00:44e8:32de:8bf3:cac2","2620:0:861:ed1a::1","TCP","74","49913  >  443 [ACK] Seq=3920 Ack=249995 Win=511 Len=0"
"82","0.963036","2620:0:861:ed1a::1","2600:4040:13e3:bf00:44e8:32de:8bf3:cac2","TCP","1514","443  >  49913 [ACK] Seq=249995 Ack=3777 Win=83 Len=1440 [TCP PDU reassembled in 84]"
"83","0.963036","2620:0:861:ed1a::1","2600:4040:13e3:bf00:44e8:32de:8bf3:cac2","TCP","1514","443  >  49913 [ACK] Seq=251435 Ack=3777 Win=83 Len=1440 [TCP PDU reassembled in 84]"
"84","0.963036","2620:0:861:ed1a::1","2600:4040:13e3:bf00:44e8:32de:8bf3:cac2","TLSv1.2","1514","Application Data"
"85","0.963036","2620:0:861:ed1a::1","2600:4040:13e3:bf00:44e8:32de:8bf3:cac2","TCP","1514","443  >  49913 [ACK] Seq=254315 Ack=3777 Win=83 Len=1440 [TCP PDU reassembled in 95]"
"86","0.963036","2620:0:861:ed1a::1","2600:4040:13e3:bf00:44e8:32de:8bf3:cac2","TCP","1514","443  >  49913 [ACK] Seq=255755 Ack=3777 Win=83 Len=1440 [TCP PDU reassembled in 95]"
"87","0.963036","2620:0:861:ed1a::1","2600:4040:13e3:bf00:44e8:32de:8bf3:cac2","TCP","1514","443  >  49913 [ACK] Seq=257195 Ack=3777 Win=83 Len=1440 [TCP PDU reassembled in 95]"
"88","0.963036","2620:0:861:ed1a::1","2600:4040:13e3:bf00:44e8:32de:8bf3:cac2","TCP","1514","443  >  49913 [ACK] Seq=258635 Ack=3777 Win=83 Len=1440 [TCP PDU reassembled in 95]"
"89","0.963036","2620:0:861:ed1a::1","2600:4040:13e3:bf00:44e8:32de:8bf3:cac2","TCP","1514","443  >  49913 [ACK] Seq=260075 Ack=3777 Win=83 Len=1440 [TCP PDU reassembled in 95]"
"90","0.963036","2620:0:861:ed1a::1","2600:4040:13e3:bf00:44e8:32de:8bf3:cac2","TCP","1514","443  >  49913 [ACK] Seq=261515 Ack=3777 Win=83 Len=1440 [TCP PDU reassembled in 95]"
"91","0.963036","2620:0:861:ed1a::1","2600:4040:13e3:bf00:44e8:32de:8bf3:cac2","TCP","1514","443  >  49913 [ACK] Seq=262955 Ack=3777 Win=83 Len=1440 [TCP PDU reassembled in 95]"
"92","0.963036","2620:0:861:ed1a::1","2600:4040:13e3:bf00:44e8:32de:8bf3:cac2","TCP","1514","443  >  49913 [ACK] Seq=264395 Ack=3777 Win=83 Len=1440 [TCP PDU reassembled in 95]"
"93","0.963036","2620:0:861:ed1a::1","2600:4040:13e3:bf00:44e8:32de:8bf3:cac2","TCP","1514","443  >  49913 [ACK] Seq=265835 Ack=3777 Win=83 Len=1440 [TCP PDU reassembled in 95]"
"94","0.963036","2620:0:861:ed1a::1","2600:4040:13e3:bf00:44e8:32de:8bf3:cac2","TCP","1514","443  >  49913 [ACK] Seq=267275 Ack=3777 Win=83 Len=1440 [TCP PDU reassembled in 95]"
"95","0.963036","2620:0:861:ed1a::1","2600:4040:13e3:bf00:44e8:32de:8bf3:cac2","TLSv1.2","1514","Application Data"
"96","0.963036","2620:0:861:ed1a::1","2600:4040:13e3:bf00:44e8:32de:8bf3:cac2","TLSv1.2","24554","Application Data"
"97","0.963036","2620:0:861:ed1a::1","2600:4040:13e3:bf00:44e8:32de:8bf3:cac2","TCP","157","443  >  49913 [ACK] Seq=294635 Ack=3777 Win=83 Len=83 [TCP PDU reassembled in 99]"
"98","0.963119","2600:4040:13e3:bf00:44e8:32de:8bf3:cac2","2620:0:861:ed1a::1","TCP","74","49913  >  443 [ACK] Seq=3920 Ack=294718 Win=1023 Len=0"
"99","0.971579","2620:0:861:ed1a::1","2600:4040:13e3:bf00:44e8:32de:8bf3:cac2","TLSv1.2","21674","Application Data"
"100","0.971579","2620:0:861:ed1a::1","2600:4040:13e3:bf00:44e8:32de:8bf3:cac2","TCP","796","443  >  49913 [PSH, ACK] Seq=316318 Ack=3920 Win=83 Len=722 [TCP PDU reassembled in 102]"
"101","0.971629","2600:4040:13e3:bf00:44e8:32de:8bf3:cac2","2620:0:861:ed1a::1","TCP","74","49913  >  443 [ACK] Seq=3920 Ack=317040 Win=1023 Len=0"
"102","0.972646","2620:0:861:ed1a::1","2600:4040:13e3:bf00:44e8:32de:8bf3:cac2","TLSv1.2","23114","Application Data, Application Data"
"103","0.972673","2600:4040:13e3:bf00:44e8:32de:8bf3:cac2","2620:0:861:ed1a::1","TCP","74","49913  >  443 [ACK] Seq=3920 Ack=340080 Win=1023 Len=0"
"104","0.974718","2620:0:861:ed1a::1","2600:4040:13e3:bf00:44e8:32de:8bf3:cac2","TLSv1.2","18794","Application Data"
"105","0.974718","2620:0:861:ed1a::1","2600:4040:13e3:bf00:44e8:32de:8bf3:cac2","TCP","792","443  >  49913 [PSH, ACK] Seq=358800 Ack=3920 Win=83 Len=718 [TCP PDU reassembled in 107]"
"106","0.974745","2600:4040:13e3:bf00:44e8:32de:8bf3:cac2","2620:0:861:ed1a::1","TCP","74","49913  >  443 [ACK] Seq=3920 Ack=359518 Win=1023 Len=0"
"107","0.976983","2620:0:861:ed1a::1","2600:4040:13e3:bf00:44e8:32de:8bf3:cac2","TLSv1.2","23114","Application Data"
"108","0.977007","2600:4040:13e3:bf00:44e8:32de:8bf3:cac2","2620:0:861:ed1a::1","TCP","74","49913  >  443 [ACK] Seq=3920 Ack=382558 Win=1023 Len=0"
"109","0.977948","2620:0:861:ed1a::1","2600:4040:13e3:bf00:44e8:32de:8bf3:cac2","TLSv1.2","23114","Application Data, Application Data, Application Data"
"110","0.977972","2600:4040:13e3:bf00:44e8:32de:8bf3:cac2","2620:0:861:ed1a::1","TCP","74","49913  >  443 [ACK] Seq=3920 Ack=405598 Win=1023 Len=0"
"111","0.978221","2620:0:861:ed1a::1","2600:4040:13e3:bf00:44e8:32de:8bf3:cac2","TLSv1.2","18794","Application Data"
"112","0.978242","2600:4040:13e3:bf00:44e8:32de:8bf3:cac2","2620:0:861:ed1a::1","TCP","74","49913  >  443 [ACK] Seq=3920 Ack=424318 Win=1023 Len=0"
"113","0.979022","2620:0:861:ed1a::1","2600:4040:13e3:bf00:44e8:32de:8bf3:cac2","TLSv1.2","23114","Application Data"
"114","0.979052","2600:4040:13e3:bf00:44e8:32de:8bf3:cac2","2620:0:861:ed1a::1","TCP","74","49913  >  443 [ACK] Seq=3920 Ack=447358 Win=2047 Len=0"
"115","0.979767","2620:0:861:ed1a::1","2600:4040:13e3:bf00:44e8:32de:8bf3:cac2","TLSv1.2","8714","Application Data"
"116","0.979767","2620:0:861:ed1a::1","2600:4040:13e3:bf00:44e8:32de:8bf3:cac2","TLSv1.2","1048","Application Data"
"117","0.979797","2600:4040:13e3:bf00:44e8:32de:8bf3:cac2","2620:0:861:ed1a::1","TCP","74","49913  >  443 [ACK] Seq=3920 Ack=456972 Win=2047 Len=0"
"118","1.015739","2600:4040:13e3:bf00:44e8:32de:8bf3:cac2","2620:0:861:ed1a::1","TLSv1.2","206","Application Data"
"119","1.025721","2600:4040:13e3:bf00:44e8:32de:8bf3:cac2","2620:0:861:ed1a::1","TLSv1.2","218","Application Data"
"120","1.027333","2600:4040:13e3:bf00:44e8:32de:8bf3:cac2","2620:0:861:ed1a::1","TLSv1.2","233","Application Data"
"121","1.027377","2600:4040:13e3:bf00:44e8:32de:8bf3:cac2","2620:0:861:ed1a::1","TLSv1.2","313","Application Data"
"122","1.027401","2600:4040:13e3:bf00:44e8:32de:8bf3:cac2","2620:0:861:ed1a::1","TLSv1.2","1035","Application Data"
"123","1.030594","2620:0:861:ed1a::1","2600:4040:13e3:bf00:44e8:32de:8bf3:cac2","TCP","14474","443  >  49913 [ACK] Seq=456972 Ack=4052 Win=83 Len=14400 [TCP PDU reassembled in 124]"
"124","1.030594","2620:0:861:ed1a::1","2600:4040:13e3:bf00:44e8:32de:8bf3:cac2","TLSv1.2","271","Application Data"
"125","1.030645","2600:4040:13e3:bf00:44e8:32de:8bf3:cac2","2620:0:861:ed1a::1","TCP","74","49913  >  443 [ACK] Seq=5555 Ack=471569 Win=2047 Len=0"
"126","1.037091","2600:4040:13e3:bf00:44e8:32de:8bf3:cac2","2620:0:861:ed1a::1","TLSv1.2","206","Application Data"
"127","1.039655","2620:0:861:ed1a::1","2600:4040:13e3:bf00:44e8:32de:8bf3:cac2","TCP","74","443  >  49913 [ACK] Seq=471569 Ack=4594 Win=83 Len=0"
"128","1.039655","2620:0:861:ed1a::1","2600:4040:13e3:bf00:44e8:32de:8bf3:cac2","TCP","11594","443  >  49913 [ACK] Seq=471569 Ack=4594 Win=83 Len=11520 [TCP PDU reassembled in 133]"
"129","1.039695","2600:4040:13e3:bf00:44e8:32de:8bf3:cac2","2620:0:861:ed1a::1","TCP","74","49913  >  443 [ACK] Seq=5687 Ack=483089 Win=2047 Len=0"
"130","1.039754","2620:0:861:ed1a::1","2600:4040:13e3:bf00:44e8:32de:8bf3:cac2","TCP","2954","443  >  49913 [PSH, ACK] Seq=483089 Ack=4594 Win=83 Len=2880 [TCP PDU reassembled in 133]"
"131","1.039776","2600:4040:13e3:bf00:44e8:32de:8bf3:cac2","2620:0:861:ed1a::1","TCP","74","49913  >  443 [ACK] Seq=5687 Ack=485969 Win=2047 Len=0"
"132","1.040365","2600:4040:13e3:bf00:44e8:32de:8bf3:cac2","2620:0:861:ed1a::1","TLSv1.2","216","Application Data"
"133","1.041586","2620:0:861:ed1a::1","2600:4040:13e3:bf00:44e8:32de:8bf3:cac2","TLSv1.2","1514","Application Data"
"134","1.041586","2620:0:861:ed1a::1","2600:4040:13e3:bf00:44e8:32de:8bf3:cac2","TCP","1514","443  >  49913 [ACK] Seq=487409 Ack=4594 Win=83 Len=1440 [TCP PDU reassembled in 140]"
"135","1.041586","2620:0:861:ed1a::1","2600:4040:13e3:bf00:44e8:32de:8bf3:cac2","TCP","1514","443  >  49913 [ACK] Seq=488849 Ack=4594 Win=83 Len=1440 [TCP PDU reassembled in 140]"
"136","1.041586","2620:0:861:ed1a::1","2600:4040:13e3:bf00:44e8:32de:8bf3:cac2","TCP","1514","443  >  49913 [ACK] Seq=490289 Ack=4594 Win=83 Len=1440 [TCP PDU reassembled in 140]"
"137","1.041586","2620:0:861:ed1a::1","2600:4040:13e3:bf00:44e8:32de:8bf3:cac2","TCP","1514","443  >  49913 [ACK] Seq=491729 Ack=4594 Win=83 Len=1440 [TCP PDU reassembled in 140]"
"138","1.041586","2620:0:861:ed1a::1","2600:4040:13e3:bf00:44e8:32de:8bf3:cac2","TCP","1514","443  >  49913 [ACK] Seq=493169 Ack=4594 Win=83 Len=1440 [TCP PDU reassembled in 140]"
"139","1.041586","2620:0:861:ed1a::1","2600:4040:13e3:bf00:44e8:32de:8bf3:cac2","TCP","1514","443  >  49913 [ACK] Seq=494609 Ack=4594 Win=83 Len=1440 [TCP PDU reassembled in 140]"
"140","1.041586","2620:0:861:ed1a::1","2600:4040:13e3:bf00:44e8:32de:8bf3:cac2","TLSv1.2","949","Application Data"
"141","1.041586","2620:0:861:ed1a::1","2600:4040:13e3:bf00:44e8:32de:8bf3:cac2","TLSv1.2","33194","Application Data, Application Data"
"142","1.041586","2620:0:861:ed1a::1","2600:4040:13e3:bf00:44e8:32de:8bf3:cac2","TLSv1.2","750","Application Data"
"143","1.041643","2600:4040:13e3:bf00:44e8:32de:8bf3:cac2","2620:0:861:ed1a::1","TCP","74","49913  >  443 [ACK] Seq=5829 Ack=530720 Win=2047 Len=0"
"144","1.042821","2620:0:861:ed1a::1","2600:4040:13e3:bf00:44e8:32de:8bf3:cac2","TLSv1.2","18794","Application Data"
"145","1.042821","2620:0:861:ed1a::1","2600:4040:13e3:bf00:44e8:32de:8bf3:cac2","TLSv1.2","1426","Application Data"
"146","1.042821","2620:0:861:ed1a::1","2600:4040:13e3:bf00:44e8:32de:8bf3:cac2","TCP","14474","443  >  49913 [PSH, ACK] Seq=550792 Ack=5555 Win=83 Len=14400 [TCP PDU reassembled in 148]"
"147","1.042857","2600:4040:13e3:bf00:44e8:32de:8bf3:cac2","2620:0:861:ed1a::1","TCP","74","49913  >  443 [ACK] Seq=5829 Ack=565192 Win=2047 Len=0"
"148","1.042956","2620:0:861:ed1a::1","2600:4040:13e3:bf00:44e8:32de:8bf3:cac2","TLSv1.2","1514","Application Data"
"149","1.042956","2620:0:861:ed1a::1","2600:4040:13e3:bf00:44e8:32de:8bf3:cac2","TLSv1.2","1469","Application Data"
"150","1.042971","2600:4040:13e3:bf00:44e8:32de:8bf3:cac2","2620:0:861:ed1a::1","TCP","74","49913  >  443 [ACK] Seq=5829 Ack=568027 Win=2047 Len=0"
"151","1.043493","2620:0:861:ed1a::1","2600:4040:13e3:bf00:44e8:32de:8bf3:cac2","TCP","15914","443  >  49913 [ACK] Seq=568027 Ack=5555 Win=83 Len=15840 [TCP PDU reassembled in 152]"
"152","1.043493","2620:0:861:ed1a::1","2600:4040:13e3:bf00:44e8:32de:8bf3:cac2","TLSv1.2","585","Application Data"
"153","1.043493","2620:0:861:ed1a::1","2600:4040:13e3:bf00:44e8:32de:8bf3:cac2","TCP","2954","443  >  49913 [ACK] Seq=584378 Ack=5555 Win=83 Len=2880 [TCP PDU reassembled in 157]"
"154","1.043521","2600:4040:13e3:bf00:44e8:32de:8bf3:cac2","2620:0:861:ed1a::1","TCP","74","49913  >  443 [ACK] Seq=5829 Ack=587258 Win=2047 Len=0"
"155","1.043590","2620:0:861:ed1a::1","2600:4040:13e3:bf00:44e8:32de:8bf3:cac2","TCP","2954","443  >  49913 [ACK] Seq=587258 Ack=5555 Win=83 Len=2880 [TCP PDU reassembled in 157]"
"156","1.043604","2600:4040:13e3:bf00:44e8:32de:8bf3:cac2","2620:0:861:ed1a::1","TCP","74","49913  >  443 [ACK] Seq=5829 Ack=590138 Win=2047 Len=0"
"157","1.044396","2620:0:861:ed1a::1","2600:4040:13e3:bf00:44e8:32de:8bf3:cac2","TLSv1.2","20234","Application Data"
"158","1.044418","2600:4040:13e3:bf00:44e8:32de:8bf3:cac2","2620:0:861:ed1a::1","TCP","74","49913  >  443 [ACK] Seq=5829 Ack=610298 Win=2047 Len=0"
"159","1.044789","2620:0:861:ed1a::1","2600:4040:13e3:bf00:44e8:32de:8bf3:cac2","TLSv1.2","25994","Application Data, Application Data"
"160","1.044812","2600:4040:13e3:bf00:44e8:32de:8bf3:cac2","2620:0:861:ed1a::1","TCP","74","49913  >  443 [ACK] Seq=5829 Ack=636218 Win=2047 Len=0"
"161","1.045790","2620:0:861:ed1a::1","2600:4040:13e3:bf00:44e8:32de:8bf3:cac2","TLSv1.2","25994","Application Data"
"162","1.045830","2600:4040:13e3:bf00:44e8:32de:8bf3:cac2","2620:0:861:ed1a::1","TCP","74","49913  >  443 [ACK] Seq=5829 Ack=662138 Win=2047 Len=0"
"163","1.046896","2620:0:861:ed1a::1","2600:4040:13e3:bf00:44e8:32de:8bf3:cac2","TLSv1.2","25994","Application Data, Application Data"
"164","1.046915","2600:4040:13e3:bf00:44e8:32de:8bf3:cac2","2620:0:861:ed1a::1","TCP","74","49913  >  443 [ACK] Seq=5829 Ack=688058 Win=2047 Len=0"
"165","1.048403","2620:0:861:ed1a::1","2600:4040:13e3:bf00:44e8:32de:8bf3:cac2","TLSv1.2","38954","Application Data, Application Data"
"166","1.048426","2600:4040:13e3:bf00:44e8:32de:8bf3:cac2","2620:0:861:ed1a::1","TCP","74","49913  >  443 [ACK] Seq=5829 Ack=726938 Win=2047 Len=0"
"167","1.050140","2620:0:861:ed1a::1","2600:4040:13e3:bf00:44e8:32de:8bf3:cac2","TLSv1.2","51914","Application Data, Application Data, Application Data"
"168","1.050180","2600:4040:13e3:bf00:44e8:32de:8bf3:cac2","2620:0:861:ed1a::1","TCP","74","49913  >  443 [ACK] Seq=5829 Ack=778778 Win=2047 Len=0"
"169","1.051683","2620:0:861:ed1a::1","2600:4040:13e3:bf00:44e8:32de:8bf3:cac2","TLSv1.2","38954","Application Data, Application Data, Application Data"
"170","1.051709","2600:4040:13e3:bf00:44e8:32de:8bf3:cac2","2620:0:861:ed1a::1","TCP","74","49913  >  443 [ACK] Seq=5829 Ack=817658 Win=2047 Len=0"
"171","1.054238","2620:0:861:ed1a::1","2600:4040:13e3:bf00:44e8:32de:8bf3:cac2","TCP","1514","443  >  49913 [ACK] Seq=817658 Ack=5687 Win=83 Len=1440 [TCP PDU reassembled in 179]"
"172","1.054238","2620:0:861:ed1a::1","2600:4040:13e3:bf00:44e8:32de:8bf3:cac2","TCP","1514","443  >  49913 [ACK] Seq=819098 Ack=5687 Win=83 Len=1440 [TCP PDU reassembled in 179]"
"173","1.054238","2620:0:861:ed1a::1","2600:4040:13e3:bf00:44e8:32de:8bf3:cac2","TCP","1514","443  >  49913 [ACK] Seq=820538 Ack=5687 Win=83 Len=1440 [TCP PDU reassembled in 179]"
"174","1.054238","2620:0:861:ed1a::1","2600:4040:13e3:bf00:44e8:32de:8bf3:cac2","TCP","1514","443  >  49913 [ACK] Seq=821978 Ack=5687 Win=83 Len=1440 [TCP PDU reassembled in 179]"
"175","1.054238","2620:0:861:ed1a::1","2600:4040:13e3:bf00:44e8:32de:8bf3:cac2","TCP","1514","443  >  49913 [ACK] Seq=823418 Ack=5687 Win=83 Len=1440 [TCP PDU reassembled in 179]"
"176","1.054238","2620:0:861:ed1a::1","2600:4040:13e3:bf00:44e8:32de:8bf3:cac2","TCP","1514","443  >  49913 [ACK] Seq=824858 Ack=5687 Win=83 Len=1440 [TCP PDU reassembled in 179]"
"177","1.054238","2620:0:861:ed1a::1","2600:4040:13e3:bf00:44e8:32de:8bf3:cac2","TCP","1514","443  >  49913 [ACK] Seq=826298 Ack=5687 Win=83 Len=1440 [TCP PDU reassembled in 179]"
"178","1.054238","2620:0:861:ed1a::1","2600:4040:13e3:bf00:44e8:32de:8bf3:cac2","TCP","1514","443  >  49913 [ACK] Seq=827738 Ack=5687 Win=83 Len=1440 [TCP PDU reassembled in 179]"
"179","1.054238","2620:0:861:ed1a::1","2600:4040:13e3:bf00:44e8:32de:8bf3:cac2","TLSv1.2","1514","Application Data"
"180","1.054238","2620:0:861:ed1a::1","2600:4040:13e3:bf00:44e8:32de:8bf3:cac2","TCP","1514","443  >  49913 [ACK] Seq=830618 Ack=5687 Win=83 Len=1440 [TCP PDU reassembled in 189]"
"181","1.054238","2620:0:861:ed1a::1","2600:4040:13e3:bf00:44e8:32de:8bf3:cac2","TCP","1514","443  >  49913 [ACK] Seq=832058 Ack=5687 Win=83 Len=1440 [TCP PDU reassembled in 189]"
"182","1.054238","2620:0:861:ed1a::1","2600:4040:13e3:bf00:44e8:32de:8bf3:cac2","TCP","1514","443  >  49913 [ACK] Seq=833498 Ack=5687 Win=83 Len=1440 [TCP PDU reassembled in 189]"
"183","1.054238","2620:0:861:ed1a::1","2600:4040:13e3:bf00:44e8:32de:8bf3:cac2","TCP","1514","443  >  49913 [ACK] Seq=834938 Ack=5687 Win=83 Len=1440 [TCP PDU reassembled in 189]"
"184","1.054238","2620:0:861:ed1a::1","2600:4040:13e3:bf00:44e8:32de:8bf3:cac2","TCP","1514","443  >  49913 [ACK] Seq=836378 Ack=5687 Win=83 Len=1440 [TCP PDU reassembled in 189]"
"185","1.054238","2620:0:861:ed1a::1","2600:4040:13e3:bf00:44e8:32de:8bf3:cac2","TCP","1514","443  >  49913 [ACK] Seq=837818 Ack=5687 Win=83 Len=1440 [TCP PDU reassembled in 189]"
"186","1.054238","2620:0:861:ed1a::1","2600:4040:13e3:bf00:44e8:32de:8bf3:cac2","TCP","1514","443  >  49913 [ACK] Seq=839258 Ack=5687 Win=83 Len=1440 [TCP PDU reassembled in 189]"
"187","1.054238","2620:0:861:ed1a::1","2600:4040:13e3:bf00:44e8:32de:8bf3:cac2","TCP","1514","443  >  49913 [ACK] Seq=840698 Ack=5687 Win=83 Len=1440 [TCP PDU reassembled in 189]"
"188","1.054238","2620:0:861:ed1a::1","2600:4040:13e3:bf00:44e8:32de:8bf3:cac2","TCP","1514","443  >  49913 [PSH, ACK] Seq=842138 Ack=5687 Win=83 Len=1440 [TCP PDU reassembled in 189]"
"189","1.054238","2620:0:861:ed1a::1","2600:4040:13e3:bf00:44e8:32de:8bf3:cac2","TLSv1.2","37514","Application Data, Application Data, Application Data"
"190","1.054318","2600:4040:13e3:bf00:44e8:32de:8bf3:cac2","2620:0:861:ed1a::1","TCP","74","49913  >  443 [ACK] Seq=5829 Ack=881018 Win=2047 Len=0"
"191","1.054355","2620:0:861:ed1a::1","2600:4040:13e3:bf00:44e8:32de:8bf3:cac2","TCP","2954","443  >  49913 [ACK] Seq=881018 Ack=5687 Win=83 Len=2880 [TCP PDU reassembled in 193]"
"192","1.054363","2600:4040:13e3:bf00:44e8:32de:8bf3:cac2","2620:0:861:ed1a::1","TCP","74","49913  >  443 [ACK] Seq=5829 Ack=883898 Win=2047 Len=0"
"193","1.055738","2620:0:861:ed1a::1","2600:4040:13e3:bf00:44e8:32de:8bf3:cac2","TLSv1.2","37514","Application Data, Application Data, Application Data"
"194","1.055765","2600:4040:13e3:bf00:44e8:32de:8bf3:cac2","2620:0:861:ed1a::1","TCP","74","49913  >  443 [ACK] Seq=5829 Ack=921338 Win=2047 Len=0"
"195","1.055999","2620:0:861:ed1a::1","2600:4040:13e3:bf00:44e8:32de:8bf3:cac2","TLSv1.2","13034","Application Data, Application Data"
"196","1.056012","2600:4040:13e3:bf00:44e8:32de:8bf3:cac2","2620:0:861:ed1a::1","TCP","74","49913  >  443 [ACK] Seq=5829 Ack=934298 Win=2047 Len=0"
"197","1.057582","2600:4040:13e3:bf00:44e8:32de:8bf3:cac2","2620:0:861:ed1a::1","TLSv1.2","211","Application Data"
"198","1.057626","2600:4040:13e3:bf00:44e8:32de:8bf3:cac2","2620:0:861:ed1a::1","TLSv1.2","218","Application Data"
"199","1.057646","2600:4040:13e3:bf00:44e8:32de:8bf3:cac2","2620:0:861:ed1a::1","TLSv1.2","214","Application Data"
"200","1.057668","2600:4040:13e3:bf00:44e8:32de:8bf3:cac2","2620:0:861:ed1a::1","TLSv1.2","214","Application Data"
"201","1.058217","2600:4040:13e3:bf00:44e8:32de:8bf3:cac2","2620:0:861:ed1a::1","TLSv1.2","110","Application Data"
"202","1.058239","2600:4040:13e3:bf00:44e8:32de:8bf3:cac2","2620:0:861:ed1a::1","TLSv1.2","110","Application Data"
"203","1.058285","2600:4040:13e3:bf00:44e8:32de:8bf3:cac2","2620:0:861:ed1a::1","TLSv1.2","110","Application Data"
"204","1.058303","2600:4040:13e3:bf00:44e8:32de:8bf3:cac2","2620:0:861:ed1a::1","TLSv1.2","110","Application Data"
"205","1.058313","2600:4040:13e3:bf00:44e8:32de:8bf3:cac2","2620:0:861:ed1a::1","TLSv1.2","110","Application Data"
"206","1.058322","2600:4040:13e3:bf00:44e8:32de:8bf3:cac2","2620:0:861:ed1a::1","TLSv1.2","110","Application Data"
"207","1.058351","2600:4040:13e3:bf00:44e8:32de:8bf3:cac2","2620:0:861:ed1a::1","TLSv1.2","110","Application Data"
"208","1.058362","2600:4040:13e3:bf00:44e8:32de:8bf3:cac2","2620:0:861:ed1a::1","TLSv1.2","110","Application Data"
"209","1.058952","2600:4040:13e3:bf00:44e8:32de:8bf3:cac2","2620:0:861:ed1a::1","TLSv1.2","222","Application Data"
"210","1.058978","2600:4040:13e3:bf00:44e8:32de:8bf3:cac2","2620:0:861:ed1a::1","TLSv1.2","234","Application Data"
"211","1.059001","2600:4040:13e3:bf00:44e8:32de:8bf3:cac2","2620:0:861:ed1a::1","TLSv1.2","209","Application Data"
"212","1.059016","2600:4040:13e3:bf00:44e8:32de:8bf3:cac2","2620:0:861:ed1a::1","TLSv1.2","212","Application Data"
"213","1.059045","2600:4040:13e3:bf00:44e8:32de:8bf3:cac2","2620:0:861:ed1a::1","TLSv1.2","212","Application Data"
"214","1.059071","2600:4040:13e3:bf00:44e8:32de:8bf3:cac2","2620:0:861:ed1a::1","TLSv1.2","215","Application Data"
"215","1.059612","2620:0:861:ed1a::1","2600:4040:13e3:bf00:44e8:32de:8bf3:cac2","TCP","1514","443  >  49913 [ACK] Seq=934298 Ack=5829 Win=83 Len=1440 [TCP PDU reassembled in 226]"
"216","1.059612","2620:0:861:ed1a::1","2600:4040:13e3:bf00:44e8:32de:8bf3:cac2","TCP","1514","443  >  49913 [ACK] Seq=935738 Ack=5829 Win=83 Len=1440 [TCP PDU reassembled in 226]"
"217","1.059612","2620:0:861:ed1a::1","2600:4040:13e3:bf00:44e8:32de:8bf3:cac2","TCP","1514","443  >  49913 [ACK] Seq=937178 Ack=5829 Win=83 Len=1440 [TCP PDU reassembled in 226]"
"218","1.059612","2620:0:861:ed1a::1","2600:4040:13e3:bf00:44e8:32de:8bf3:cac2","TCP","1514","443  >  49913 [ACK] Seq=938618 Ack=5829 Win=83 Len=1440 [TCP PDU reassembled in 226]"
"219","1.059612","2620:0:861:ed1a::1","2600:4040:13e3:bf00:44e8:32de:8bf3:cac2","TCP","1514","443  >  49913 [ACK] Seq=940058 Ack=5829 Win=83 Len=1440 [TCP PDU reassembled in 226]"
"220","1.059612","2620:0:861:ed1a::1","2600:4040:13e3:bf00:44e8:32de:8bf3:cac2","TCP","1514","443  >  49913 [ACK] Seq=941498 Ack=5829 Win=83 Len=1440 [TCP PDU reassembled in 226]"
"221","1.059612","2620:0:861:ed1a::1","2600:4040:13e3:bf00:44e8:32de:8bf3:cac2","TCP","1514","443  >  49913 [ACK] Seq=942938 Ack=5829 Win=83 Len=1440 [TCP PDU reassembled in 226]"
"222","1.059612","2620:0:861:ed1a::1","2600:4040:13e3:bf00:44e8:32de:8bf3:cac2","TCP","1514","443  >  49913 [ACK] Seq=944378 Ack=5829 Win=83 Len=1440 [TCP PDU reassembled in 226]"
"223","1.059612","2620:0:861:ed1a::1","2600:4040:13e3:bf00:44e8:32de:8bf3:cac2","TCP","1514","443  >  49913 [ACK] Seq=945818 Ack=5829 Win=83 Len=1440 [TCP PDU reassembled in 226]"
"224","1.059612","2620:0:861:ed1a::1","2600:4040:13e3:bf00:44e8:32de:8bf3:cac2","TCP","1514","443  >  49913 [ACK] Seq=947258 Ack=5829 Win=83 Len=1440 [TCP PDU reassembled in 226]"
"225","1.059612","2620:0:861:ed1a::1","2600:4040:13e3:bf00:44e8:32de:8bf3:cac2","TCP","1514","443  >  49913 [ACK] Seq=948698 Ack=5829 Win=83 Len=1440 [TCP PDU reassembled in 226]"
"226","1.059612","2620:0:861:ed1a::1","2600:4040:13e3:bf00:44e8:32de:8bf3:cac2","TLSv1.2","1514","Application Data"
"227","1.059612","2620:0:861:ed1a::1","2600:4040:13e3:bf00:44e8:32de:8bf3:cac2","TCP","1514","443  >  49913 [ACK] Seq=951578 Ack=5829 Win=83 Len=1440 [TCP PDU reassembled in 237]"
"228","1.059612","2620:0:861:ed1a::1","2600:4040:13e3:bf00:44e8:32de:8bf3:cac2","TCP","1514","443  >  49913 [ACK] Seq=953018 Ack=5829 Win=83 Len=1440 [TCP PDU reassembled in 237]"
"229","1.059612","2620:0:861:ed1a::1","2600:4040:13e3:bf00:44e8:32de:8bf3:cac2","TCP","1514","443  >  49913 [ACK] Seq=954458 Ack=5829 Win=83 Len=1440 [TCP PDU reassembled in 237]"
"230","1.059612","2620:0:861:ed1a::1","2600:4040:13e3:bf00:44e8:32de:8bf3:cac2","TCP","1514","443  >  49913 [ACK] Seq=955898 Ack=5829 Win=83 Len=1440 [TCP PDU reassembled in 237]"
"231","1.059612","2620:0:861:ed1a::1","2600:4040:13e3:bf00:44e8:32de:8bf3:cac2","TCP","1514","443  >  49913 [ACK] Seq=957338 Ack=5829 Win=83 Len=1440 [TCP PDU reassembled in 237]"
"232","1.059612","2620:0:861:ed1a::1","2600:4040:13e3:bf00:44e8:32de:8bf3:cac2","TCP","1514","443  >  49913 [PSH, ACK] Seq=958778 Ack=5829 Win=83 Len=1440 [TCP PDU reassembled in 237]"
"233","1.059612","2620:0:861:ed1a::1","2600:4040:13e3:bf00:44e8:32de:8bf3:cac2","TCP","1514","443  >  49913 [ACK] Seq=960218 Ack=5829 Win=83 Len=1440 [TCP PDU reassembled in 237]"
"234","1.059612","2620:0:861:ed1a::1","2600:4040:13e3:bf00:44e8:32de:8bf3:cac2","TCP","1514","443  >  49913 [ACK] Seq=961658 Ack=5829 Win=83 Len=1440 [TCP PDU reassembled in 237]"
"235","1.059612","2620:0:861:ed1a::1","2600:4040:13e3:bf00:44e8:32de:8bf3:cac2","TCP","1514","443  >  49913 [ACK] Seq=963098 Ack=5829 Win=83 Len=1440 [TCP PDU reassembled in 237]"
"236","1.059612","2620:0:861:ed1a::1","2600:4040:13e3:bf00:44e8:32de:8bf3:cac2","TCP","1514","443  >  49913 [ACK] Seq=964538 Ack=5829 Win=83 Len=1440 [TCP PDU reassembled in 237]"
"237","1.059612","2620:0:861:ed1a::1","2600:4040:13e3:bf00:44e8:32de:8bf3:cac2","TLSv1.2","1514","Application Data"
"238","1.059612","2620:0:861:ed1a::1","2600:4040:13e3:bf00:44e8:32de:8bf3:cac2","TCP","1514","443  >  49913 [ACK] Seq=967418 Ack=5829 Win=83 Len=1440 [TCP PDU reassembled in 240]"
"239","1.059612","2620:0:861:ed1a::1","2600:4040:13e3:bf00:44e8:32de:8bf3:cac2","TCP","1514","443  >  49913 [ACK] Seq=968858 Ack=5829 Win=83 Len=1440 [TCP PDU reassembled in 240]"
"240","1.059612","2620:0:861:ed1a::1","2600:4040:13e3:bf00:44e8:32de:8bf3:cac2","TLSv1.2","1514","Application Data"
"241","1.059612","2620:0:861:ed1a::1","2600:4040:13e3:bf00:44e8:32de:8bf3:cac2","TCP","1514","443  >  49913 [ACK] Seq=971738 Ack=5829 Win=83 Len=1440 [TCP PDU reassembled in 252]"
"242","1.059612","2620:0:861:ed1a::1","2600:4040:13e3:bf00:44e8:32de:8bf3:cac2","TCP","1514","443  >  49913 [ACK] Seq=973178 Ack=5829 Win=83 Len=1440 [TCP PDU reassembled in 252]"
"243","1.059612","2620:0:861:ed1a::1","2600:4040:13e3:bf00:44e8:32de:8bf3:cac2","TCP","1514","443  >  49913 [ACK] Seq=974618 Ack=5829 Win=83 Len=1440 [TCP PDU reassembled in 252]"
"244","1.059612","2620:0:861:ed1a::1","2600:4040:13e3:bf00:44e8:32de:8bf3:cac2","TCP","1514","443  >  49913 [ACK] Seq=976058 Ack=5829 Win=83 Len=1440 [TCP PDU reassembled in 252]"
"245","1.059612","2620:0:861:ed1a::1","2600:4040:13e3:bf00:44e8:32de:8bf3:cac2","TCP","1514","443  >  49913 [ACK] Seq=977498 Ack=5829 Win=83 Len=1440 [TCP PDU reassembled in 252]"
"246","1.059612","2620:0:861:ed1a::1","2600:4040:13e3:bf00:44e8:32de:8bf3:cac2","TCP","1514","443  >  49913 [ACK] Seq=978938 Ack=5829 Win=83 Len=1440 [TCP PDU reassembled in 252]"
"247","1.059721","2600:4040:13e3:bf00:44e8:32de:8bf3:cac2","2620:0:861:ed1a::1","TCP","74","49913  >  443 [ACK] Seq=7538 Ack=980378 Win=2047 Len=0"
"248","1.059761","2620:0:861:ed1a::1","2600:4040:13e3:bf00:44e8:32de:8bf3:cac2","TCP","1514","443  >  49913 [ACK] Seq=980378 Ack=5829 Win=83 Len=1440 [TCP PDU reassembled in 252]"
"249","1.059761","2620:0:861:ed1a::1","2600:4040:13e3:bf00:44e8:32de:8bf3:cac2","TCP","1514","443  >  49913 [ACK] Seq=981818 Ack=5829 Win=83 Len=1440 [TCP PDU reassembled in 252]"
"250","1.059761","2620:0:861:ed1a::1","2600:4040:13e3:bf00:44e8:32de:8bf3:cac2","TCP","1514","443  >  49913 [ACK] Seq=983258 Ack=5829 Win=83 Len=1440 [TCP PDU reassembled in 252]"
"251","1.059761","2620:0:861:ed1a::1","2600:4040:13e3:bf00:44e8:32de:8bf3:cac2","TCP","1514","443  >  49913 [PSH, ACK] Seq=984698 Ack=5829 Win=83 Len=1440 [TCP PDU reassembled in 252]"
"252","1.059761","2620:0:861:ed1a::1","2600:4040:13e3:bf00:44e8:32de:8bf3:cac2","TLSv1.2","38954","Application Data, Application Data, Application Data, Application Data"
"253","1.059792","2600:4040:13e3:bf00:44e8:32de:8bf3:cac2","2620:0:861:ed1a::1","TCP","74","49913  >  443 [ACK] Seq=7538 Ack=1025018 Win=4095 Len=0"
"254","1.062357","2620:0:861:ed1a::1","2600:4040:13e3:bf00:44e8:32de:8bf3:cac2","TLSv1.2","64874","Application Data, Application Data, Application Data, Application Data, Application Data"
"255","1.062357","2620:0:861:ed1a::1","2600:4040:13e3:bf00:44e8:32de:8bf3:cac2","TLSv1.2","10154","Application Data"
"256","1.062413","2600:4040:13e3:bf00:44e8:32de:8bf3:cac2","2620:0:861:ed1a::1","TCP","74","49913  >  443 [ACK] Seq=7538 Ack=1099898 Win=4095 Len=0"
"257","1.064784","2620:0:861:ed1a::1","2600:4040:13e3:bf00:44e8:32de:8bf3:cac2","TLSv1.2","64874","Application Data, Application Data, Application Data, Application Data, Application Data"
"258","1.064784","2620:0:861:ed1a::1","2600:4040:13e3:bf00:44e8:32de:8bf3:cac2","TLSv1.2","11594","Application Data"
"259","1.064828","2600:4040:13e3:bf00:44e8:32de:8bf3:cac2","2620:0:861:ed1a::1","TCP","74","49913  >  443 [ACK] Seq=7538 Ack=1176218 Win=4095 Len=0"
"260","1.065015","2620:0:861:ed1a::1","2600:4040:13e3:bf00:44e8:32de:8bf3:cac2","TLSv1.2","14474","Application Data, Application Data"
"261","1.065015","2620:0:861:ed1a::1","2600:4040:13e3:bf00:44e8:32de:8bf3:cac2","TLSv1.2","310","Application Data"
"262","1.065033","2600:4040:13e3:bf00:44e8:32de:8bf3:cac2","2620:0:861:ed1a::1","TCP","74","49913  >  443 [ACK] Seq=7538 Ack=1190854 Win=4095 Len=0"
"263","1.072981","2620:0:861:ed1a::1","2600:4040:13e3:bf00:44e8:32de:8bf3:cac2","TCP","74","443  >  49913 [ACK] Seq=1190854 Ack=7259 Win=81 Len=0"
"264","1.072981","2620:0:861:ed1a::1","2600:4040:13e3:bf00:44e8:32de:8bf3:cac2","TCP","74","443  >  49913 [ACK] Seq=1190854 Ack=7538 Win=83 Len=0"
"265","1.072981","2620:0:861:ed1a::1","2600:4040:13e3:bf00:44e8:32de:8bf3:cac2","TLSv1.2","1149","Application Data"
"266","1.073036","2600:4040:13e3:bf00:44e8:32de:8bf3:cac2","2620:0:861:ed1a::1","TCP","74","49913  >  443 [ACK] Seq=7538 Ack=1191929 Win=4091 Len=0"
"267","1.073103","2620:0:861:ed1a::1","2600:4040:13e3:bf00:44e8:32de:8bf3:cac2","TCP","1514","443  >  49913 [ACK] Seq=1191929 Ack=7538 Win=83 Len=1440 [TCP PDU reassembled in 268]"
"268","1.073103","2620:0:861:ed1a::1","2600:4040:13e3:bf00:44e8:32de:8bf3:cac2","TLSv1.2","817","Application Data"
"269","1.073123","2600:4040:13e3:bf00:44e8:32de:8bf3:cac2","2620:0:861:ed1a::1","TCP","74","49913  >  443 [ACK] Seq=7538 Ack=1194112 Win=4095 Len=0"
"270","1.073972","2620:0:861:ed1a::1","2600:4040:13e3:bf00:44e8:32de:8bf3:cac2","TCP","1514","443  >  49913 [ACK] Seq=1194112 Ack=7538 Win=83 Len=1440 [TCP PDU reassembled in 271]"
"271","1.073972","2620:0:861:ed1a::1","2600:4040:13e3:bf00:44e8:32de:8bf3:cac2","TLSv1.2","813","Application Data"
"272","1.073972","2620:0:861:ed1a::1","2600:4040:13e3:bf00:44e8:32de:8bf3:cac2","TCP","4394","443  >  49913 [ACK] Seq=1196291 Ack=7538 Win=83 Len=4320 [TCP PDU reassembled in 273]"
"273","1.073972","2620:0:861:ed1a::1","2600:4040:13e3:bf00:44e8:32de:8bf3:cac2","TLSv1.2","1434","Application Data"
"274","1.074003","2600:4040:13e3:bf00:44e8:32de:8bf3:cac2","2620:0:861:ed1a::1","TCP","74","49913  >  443 [ACK] Seq=7538 Ack=1201971 Win=4095 Len=0"
"275","1.105994","2600:4040:13e3:bf00:44e8:32de:8bf3:cac2","2620:0:861:ed1a::1","TLSv1.2","239","Application Data"
"276","1.106045","2600:4040:13e3:bf00:44e8:32de:8bf3:cac2","2620:0:861:ed1a::1","TLSv1.2","224","Application Data"
"277","1.111239","2600:4040:13e3:bf00:44e8:32de:8bf3:cac2","2620:0:861:ed1a::1","TLSv1.2","255","Application Data"
"278","1.119760","2620:0:861:ed1a::1","2600:4040:13e3:bf00:44e8:32de:8bf3:cac2","TCP","74","443  >  49913 [ACK] Seq=1201971 Ack=7853 Win=83 Len=0"
"279","1.119760","2620:0:861:ed1a::1","2600:4040:13e3:bf00:44e8:32de:8bf3:cac2","TLSv1.2","1456","Application Data"
"280","1.119760","2620:0:861:ed1a::1","2600:4040:13e3:bf00:44e8:32de:8bf3:cac2","TCP","8714","443  >  49913 [ACK] Seq=1203353 Ack=7853 Win=83 Len=8640 [TCP PDU reassembled in 284]"
"281","1.119820","2600:4040:13e3:bf00:44e8:32de:8bf3:cac2","2620:0:861:ed1a::1","TCP","74","49913  >  443 [ACK] Seq=8034 Ack=1211993 Win=4095 Len=0"
"282","1.119869","2620:0:861:ed1a::1","2600:4040:13e3:bf00:44e8:32de:8bf3:cac2","TCP","5834","443  >  49913 [PSH, ACK] Seq=1211993 Ack=7853 Win=83 Len=5760 [TCP PDU reassembled in 284]"
"283","1.119880","2600:4040:13e3:bf00:44e8:32de:8bf3:cac2","2620:0:861:ed1a::1","TCP","74","49913  >  443 [ACK] Seq=8034 Ack=1217753 Win=4095 Len=0"
"284","1.120170","2620:0:861:ed1a::1","2600:4040:13e3:bf00:44e8:32de:8bf3:cac2","TLSv1.2","8714","Application Data"
"285","1.120191","2600:4040:13e3:bf00:44e8:32de:8bf3:cac2","2620:0:861:ed1a::1","TCP","74","49913  >  443 [ACK] Seq=8034 Ack=1226393 Win=4095 Len=0"
"286","1.120298","2620:0:861:ed1a::1","2600:4040:13e3:bf00:44e8:32de:8bf3:cac2","TCP","2954","443  >  49913 [ACK] Seq=1226393 Ack=7853 Win=83 Len=2880 [TCP PDU reassembled in 289]"
"287","1.120311","2600:4040:13e3:bf00:44e8:32de:8bf3:cac2","2620:0:861:ed1a::1","TCP","74","49913  >  443 [ACK] Seq=8034 Ack=1229273 Win=4095 Len=0"
"288","1.121696","2620:0:861:ed1a::1","2600:4040:13e3:bf00:44e8:32de:8bf3:cac2","TCP","1514","443  >  49913 [ACK] Seq=1229273 Ack=7853 Win=83 Len=1440 [TCP PDU reassembled in 289]"
"289","1.121696","2620:0:861:ed1a::1","2600:4040:13e3:bf00:44e8:32de:8bf3:cac2","TLSv1.2","1184","Application Data"
"290","1.121720","2600:4040:13e3:bf00:44e8:32de:8bf3:cac2","2620:0:861:ed1a::1","TCP","74","49913  >  443 [ACK] Seq=8034 Ack=1231823 Win=4095 Len=0"
"291","1.123527","2620:0:861:ed1a::1","2600:4040:13e3:bf00:44e8:32de:8bf3:cac2","TLSv1.2","1305","Application Data"
"292","1.123558","2600:4040:13e3:bf00:44e8:32de:8bf3:cac2","2620:0:861:ed1a::1","TCP","74","49913  >  443 [ACK] Seq=8034 Ack=1233054 Win=4091 Len=0"
"293","1.168499","2600:4040:13e3:bf00:44e8:32de:8bf3:cac2","2620:0:861:ed1a::1","TLSv1.2","235","Application Data"
"294","1.182239","2620:0:861:ed1a::1","2600:4040:13e3:bf00:44e8:32de:8bf3:cac2","TLSv1.2","1346","Application Data"
"295","1.209317","2600:4040:13e3:bf00:44e8:32de:8bf3:cac2","2620:0:861:ed1a::1","TLSv1.2","209","Application Data"
"296","1.223925","2620:0:861:ed1a::1","2600:4040:13e3:bf00:44e8:32de:8bf3:cac2","TCP","1514","443  >  49913 [ACK] Seq=1234326 Ack=8330 Win=83 Len=1440 [TCP PDU reassembled in 297]"
"297","1.223925","2620:0:861:ed1a::1","2600:4040:13e3:bf00:44e8:32de:8bf3:cac2","TLSv1.2","467","Application Data"
"298","1.223970","2600:4040:13e3:bf00:44e8:32de:8bf3:cac2","2620:0:861:ed1a::1","TCP","74","49913  >  443 [ACK] Seq=8330 Ack=1236159 Win=4095 Len=0"
