"No.","Time","Source","Destination","Protocol","Length","Info"
"1","0.000000","2600:4040:13e3:bf00:149c:2c75:cfa0:ed7d","2620:0:861:ed1a::1","TLSv1.2","171","Application Data"
"2","0.016679","2620:0:861:ed1a::1","2600:4040:13e3:bf00:149c:2c75:cfa0:ed7d","TLSv1.2","1429","Application Data"
"3","0.017467","2600:4040:13e3:bf00:149c:2c75:cfa0:ed7d","2620:0:861:ed1a::1","TLSv1.2","172","Application Data"
"4","0.033108","2620:0:861:ed1a::1","2600:4040:13e3:bf00:149c:2c75:cfa0:ed7d","TCP","1514","443  >  52255 [ACK] Seq=1356 Ack=196 Win=83 Len=1440 [TCP PDU reassembled in 5]"
"5","0.033108","2620:0:861:ed1a::1","2600:4040:13e3:bf00:149c:2c75:cfa0:ed7d","TLSv1.2","1337","Application Data"
"6","0.033128","2600:4040:13e3:bf00:149c:2c75:cfa0:ed7d","2620:0:861:ed1a::1","TCP","74","52255  >  443 [ACK] Seq=196 Ack=4059 Win=8191 Len=0"
"7","0.033404","2600:4040:13e3:bf00:149c:2c75:cfa0:ed7d","2620:0:861:ed1a::1","TLSv1.2","109","Application Data"
"8","0.092497","2620:0:861:ed1a::1","2600:4040:13e3:bf00:149c:2c75:cfa0:ed7d","TCP","74","443  >  52255 [ACK] Seq=4059 Ack=231 Win=83 Len=0"
"9","0.646031","2600:4040:13e3:bf00:149c:2c75:cfa0:ed7d","2620:0:861:ed1a::1","TLSv1.2","181","Application Data"
"10","0.660419","2620:0:861:ed1a::1","2600:4040:13e3:bf00:149c:2c75:cfa0:ed7d","TCP","74","443  >  52255 [ACK] Seq=4059 Ack=338 Win=83 Len=0"
"11","0.660658","2620:0:861:ed1a::1","2600:4040:13e3:bf00:149c:2c75:cfa0:ed7d","TCP","1514","443  >  52255 [ACK] Seq=4059 Ack=338 Win=83 Len=1440 [TCP PDU reassembled in 12]"
"12","0.660658","2620:0:861:ed1a::1","2600:4040:13e3:bf00:149c:2c75:cfa0:ed7d","TLSv1.2","169","Application Data"
"13","0.660674","2600:4040:13e3:bf00:149c:2c75:cfa0:ed7d","2620:0:861:ed1a::1","TCP","74","52255  >  443 [ACK] Seq=338 Ack=5594 Win=8191 Len=0"
"14","0.714939","2600:4040:13e3:bf00:149c:2c75:cfa0:ed7d","2620:0:861:ed1a::1","TLSv1.2","424","Application Data"
"15","0.730212","2620:0:861:ed1a::1","2600:4040:13e3:bf00:149c:2c75:cfa0:ed7d","TCP","1514","443  >  52255 [ACK] Seq=5594 Ack=688 Win=83 Len=1440 [TCP PDU reassembled in 25]"
"16","0.730212","2620:0:861:ed1a::1","2600:4040:13e3:bf00:149c:2c75:cfa0:ed7d","TCP","1514","443  >  52255 [ACK] Seq=7034 Ack=688 Win=83 Len=1440 [TCP PDU reassembled in 25]"
"17","0.730212","2620:0:861:ed1a::1","2600:4040:13e3:bf00:149c:2c75:cfa0:ed7d","TCP","1514","443  >  52255 [ACK] Seq=8474 Ack=688 Win=83 Len=1440 [TCP PDU reassembled in 25]"
"18","0.730212","2620:0:861:ed1a::1","2600:4040:13e3:bf00:149c:2c75:cfa0:ed7d","TCP","1514","443  >  52255 [ACK] Seq=9914 Ack=688 Win=83 Len=1440 [TCP PDU reassembled in 25]"
"19","0.730212","2620:0:861:ed1a::1","2600:4040:13e3:bf00:149c:2c75:cfa0:ed7d","TCP","1514","443  >  52255 [ACK] Seq=11354 Ack=688 Win=83 Len=1440 [TCP PDU reassembled in 25]"
"20","0.730212","2620:0:861:ed1a::1","2600:4040:13e3:bf00:149c:2c75:cfa0:ed7d","TCP","1514","443  >  52255 [ACK] Seq=12794 Ack=688 Win=83 Len=1440 [TCP PDU reassembled in 25]"
"21","0.730212","2620:0:861:ed1a::1","2600:4040:13e3:bf00:149c:2c75:cfa0:ed7d","TCP","1514","443  >  52255 [ACK] Seq=14234 Ack=688 Win=83 Len=1440 [TCP PDU reassembled in 25]"
"22","0.730212","2620:0:861:ed1a::1","2600:4040:13e3:bf00:149c:2c75:cfa0:ed7d","TCP","1514","443  >  52255 [ACK] Seq=15674 Ack=688 Win=83 Len=1440 [TCP PDU reassembled in 25]"
"23","0.730212","2620:0:861:ed1a::1","2600:4040:13e3:bf00:149c:2c75:cfa0:ed7d","TCP","1514","443  >  52255 [ACK] Seq=17114 Ack=688 Win=83 Len=1440 [TCP PDU reassembled in 25]"
"24","0.730212","2620:0:861:ed1a::1","2600:4040:13e3:bf00:149c:2c75:cfa0:ed7d","TCP","1514","443  >  52255 [PSH, ACK] Seq=18554 Ack=688 Win=83 Len=1440 [TCP PDU reassembled in 25]"
"25","0.730212","2620:0:861:ed1a::1","2600:4040:13e3:bf00:149c:2c75:cfa0:ed7d","TLSv1.2","1514","Application Data"
"26","0.730212","2620:0:861:ed1a::1","2600:4040:13e3:bf00:149c:2c75:cfa0:ed7d","TCP","1514","443  >  52255 [ACK] Seq=21434 Ack=688 Win=83 Len=1440 [TCP PDU reassembled in 33]"
"27","0.730212","2620:0:861:ed1a::1","2600:4040:13e3:bf00:149c:2c75:cfa0:ed7d","TCP","1514","443  >  52255 [ACK] Seq=22874 Ack=688 Win=83 Len=1440 [TCP PDU reassembled in 33]"
"28","0.730212","2620:0:861:ed1a::1","2600:4040:13e3:bf00:149c:2c75:cfa0:ed7d","TCP","1514","443  >  52255 [ACK] Seq=24314 Ack=688 Win=83 Len=1440 [TCP PDU reassembled in 33]"
"29","0.730212","2620:0:861:ed1a::1","2600:4040:13e3:bf00:149c:2c75:cfa0:ed7d","TCP","1514","443  >  52255 [ACK] Seq=25754 Ack=688 Win=83 Len=1440 [TCP PDU reassembled in 33]"
"30","0.730212","2620:0:861:ed1a::1","2600:4040:13e3:bf00:149c:2c75:cfa0:ed7d","TCP","1514","443  >  52255 [ACK] Seq=27194 Ack=688 Win=83 Len=1440 [TCP PDU reassembled in 33]"
"31","0.730212","2620:0:861:ed1a::1","2600:4040:13e3:bf00:149c:2c75:cfa0:ed7d","TCP","1514","443  >  52255 [ACK] Seq=28634 Ack=688 Win=83 Len=1440 [TCP PDU reassembled in 33]"
"32","0.730212","2620:0:861:ed1a::1","2600:4040:13e3:bf00:149c:2c75:cfa0:ed7d","TCP","1514","443  >  52255 [ACK] Seq=30074 Ack=688 Win=83 Len=1440 [TCP PDU reassembled in 33]"
"33","0.730212","2620:0:861:ed1a::1","2600:4040:13e3:bf00:149c:2c75:cfa0:ed7d","TLSv1.2","1432","Application Data"
"34","0.730298","2600:4040:13e3:bf00:149c:2c75:cfa0:ed7d","2620:0:861:ed1a::1","TCP","74","52255  >  443 [ACK] Seq=688 Ack=32872 Win=8191 Len=0"
"35","0.739177","2600:4040:13e3:bf00:149c:2c75:cfa0:ed7d","2620:0:861:ed1a::1","TLSv1.2","386","Application Data"
"36","0.742647","2600:4040:13e3:bf00:149c:2c75:cfa0:ed7d","2620:0:861:ed1a::1","TLSv1.2","226","Application Data"
"37","0.752435","2620:0:861:ed1a::1","2600:4040:13e3:bf00:149c:2c75:cfa0:ed7d","TLSv1.2","21674","Application Data"
"38","0.752435","2620:0:861:ed1a::1","2600:4040:13e3:bf00:149c:2c75:cfa0:ed7d","TLSv1.2","747","Application Data"
"39","0.752506","2600:4040:13e3:bf00:149c:2c75:cfa0:ed7d","2620:0:861:ed1a::1","TCP","74","52255  >  443 [ACK] Seq=1152 Ack=55145 Win=8191 Len=0"
"40","0.756791","2620:0:861:ed1a::1","2600:4040:13e3:bf00:149c:2c75:cfa0:ed7d","TLSv1.2","881","Application Data"
"41","0.800256","2600:4040:13e3:bf00:149c:2c75:cfa0:ed7d","2620:0:861:ed1a::1","TCP","74","52255  >  443 [ACK] Seq=1152 Ack=55952 Win=8188 Len=0"
"42","2.345591","2600:4040:13e3:bf00:149c:2c75:cfa0:ed7d","2620:0:861:ed1a::1","TLSv1.2","185","Application Data"
"43","2.380870","2620:0:861:ed1a::1","2600:4040:13e3:bf00:149c:2c75:cfa0:ed7d","TCP","1514","443  >  52255 [ACK] Seq=55952 Ack=1263 Win=83 Len=1440 [TCP PDU reassembled in 44]"
"44","2.380870","2620:0:861:ed1a::1","2600:4040:13e3:bf00:149c:2c75:cfa0:ed7d","TLSv1.2","903","Application Data"
"45","2.380908","2600:4040:13e3:bf00:149c:2c75:cfa0:ed7d","2620:0:861:ed1a::1","TCP","74","52255  >  443 [ACK] Seq=1263 Ack=58221 Win=8191 Len=0"
"46","4.251664","2600:4040:13e3:bf00:149c:2c75:cfa0:ed7d","2620:0:861:ed1a::1","TLSv1.2","174","Application Data"
