"No.","Time","Source","Destination","Protocol","Length","Info"
"1","0.000000","2600:4040:13e3:bf00:149c:2c75:cfa0:ed7d","2620:0:861:ed1a::1","TLSv1.2","209","Application Data"
"2","0.013738","2620:0:861:ed1a::1","2600:4040:13e3:bf00:149c:2c75:cfa0:ed7d","TCP","1514","443  >  52255 [ACK] Seq=1 Ack=136 Win=231 Len=1440 [TCP PDU reassembled in 3]"
"3","0.013738","2620:0:861:ed1a::1","2600:4040:13e3:bf00:149c:2c75:cfa0:ed7d","TLSv1.2","1240","Application Data"
"4","0.013766","2600:4040:13e3:bf00:149c:2c75:cfa0:ed7d","2620:0:861:ed1a::1","TCP","74","52255  >  443 [ACK] Seq=136 Ack=2607 Win=8191 Len=0"
"5","0.014079","2600:4040:13e3:bf00:149c:2c75:cfa0:ed7d","2620:0:861:ed1a::1","TLSv1.2","109","Application Data"
"6","0.073917","2620:0:861:ed1a::1","2600:4040:13e3:bf00:149c:2c75:cfa0:ed7d","TCP","74","443  >  52255 [ACK] Seq=2607 Ack=171 Win=231 Len=0"
"7","3.135370","2600:4040:13e3:bf00:149c:2c75:cfa0:ed7d","2620:0:861:ed1a::1","TLSv1.2","161","Application Data"
"8","3.149937","2620:0:861:ed1a::1","2600:4040:13e3:bf00:149c:2c75:cfa0:ed7d","TCP","74","443  >  52255 [ACK] Seq=2607 Ack=258 Win=231 Len=0"
"9","3.366713","2620:0:861:ed1a::1","2600:4040:13e3:bf00:149c:2c75:cfa0:ed7d","TLSv1.2","1145","Application Data"
"10","3.367106","2620:0:861:ed1a::1","2600:4040:13e3:bf00:149c:2c75:cfa0:ed7d","TLSv1.2","115","Application Data"
"11","3.367127","2600:4040:13e3:bf00:149c:2c75:cfa0:ed7d","2620:0:861:ed1a::1","TCP","74","52255  >  443 [ACK] Seq=258 Ack=3719 Win=8187 Len=0"
"12","3.369466","2600:4040:13e3:bf00:149c:2c75:cfa0:ed7d","2620:0:861:ed1a::1","TLSv1.2","154","Application Data"
"13","3.369492","2600:4040:13e3:bf00:149c:2c75:cfa0:ed7d","2620:0:861:ed1a::1","TLSv1.2","613","Application Data"
"14","3.369554","2600:4040:13e3:bf00:149c:2c75:cfa0:ed7d","2620:0:861:ed1a::1","TLSv1.2","151","Application Data"
"15","3.369573","2600:4040:13e3:bf00:149c:2c75:cfa0:ed7d","2620:0:861:ed1a::1","TLSv1.2","695","Application Data"
"16","3.370937","2620:0:861:ed1a::1","2600:4040:13e3:bf00:149c:2c75:cfa0:ed7d","TCP","4394","443  >  52255 [ACK] Seq=3719 Ack=258 Win=231 Len=4320 [TCP PDU reassembled in 22]"
"17","3.370966","2600:4040:13e3:bf00:149c:2c75:cfa0:ed7d","2620:0:861:ed1a::1","TCP","74","52255  >  443 [ACK] Seq=1575 Ack=8039 Win=8191 Len=0"
"18","3.372095","2620:0:861:ed1a::1","2600:4040:13e3:bf00:149c:2c75:cfa0:ed7d","TCP","1514","443  >  52255 [ACK] Seq=8039 Ack=258 Win=231 Len=1440 [TCP PDU reassembled in 22]"
"19","3.372095","2620:0:861:ed1a::1","2600:4040:13e3:bf00:149c:2c75:cfa0:ed7d","TCP","1514","443  >  52255 [ACK] Seq=9479 Ack=258 Win=231 Len=1440 [TCP PDU reassembled in 22]"
"20","3.372095","2620:0:861:ed1a::1","2600:4040:13e3:bf00:149c:2c75:cfa0:ed7d","TCP","1514","443  >  52255 [ACK] Seq=10919 Ack=258 Win=231 Len=1440 [TCP PDU reassembled in 22]"
"21","3.372095","2620:0:861:ed1a::1","2600:4040:13e3:bf00:149c:2c75:cfa0:ed7d","TCP","7274","443  >  52255 [ACK] Seq=12359 Ack=258 Win=231 Len=7200 [TCP PDU reassembled in 22]"
"22","3.372095","2620:0:861:ed1a::1","2600:4040:13e3:bf00:149c:2c75:cfa0:ed7d","TLSv1.2","577","Application Data"
"23","3.372095","2620:0:861:ed1a::1","2600:4040:13e3:bf00:149c:2c75:cfa0:ed7d","TCP","4394","443  >  52255 [ACK] Seq=20062 Ack=258 Win=231 Len=4320 [TCP PDU reassembled in 24]"
"24","3.372095","2620:0:861:ed1a::1","2600:4040:13e3:bf00:149c:2c75:cfa0:ed7d","TLSv1.2","926","Application Data"
"25","3.372131","2600:4040:13e3:bf00:149c:2c75:cfa0:ed7d","2620:0:861:ed1a::1","TCP","74","52255  >  443 [ACK] Seq=1575 Ack=25234 Win=8191 Len=0"
"26","3.376837","2600:4040:13e3:bf00:149c:2c75:cfa0:ed7d","2620:0:861:ed1a::1","TLSv1.2","424","Application Data"
"27","3.380219","2600:4040:13e3:bf00:149c:2c75:cfa0:ed7d","2620:0:861:ed1a::1","TLSv1.2","290","Application Data"
"28","3.380260","2600:4040:13e3:bf00:149c:2c75:cfa0:ed7d","2620:0:861:ed1a::1","TLSv1.2","182","Application Data"
"29","3.380695","2600:4040:13e3:bf00:149c:2c75:cfa0:ed7d","2620:0:861:ed1a::1","TLSv1.2","181","Application Data"
"30","3.380729","2600:4040:13e3:bf00:149c:2c75:cfa0:ed7d","2620:0:861:ed1a::1","TLSv1.2","235","Application Data"
"31","3.380880","2600:4040:13e3:bf00:149c:2c75:cfa0:ed7d","2620:0:861:ed1a::1","TLSv1.2","157","Application Data"
"32","3.386052","2620:0:861:ed1a::1","2600:4040:13e3:bf00:149c:2c75:cfa0:ed7d","TCP","74","443  >  52255 [ACK] Seq=25234 Ack=338 Win=231 Len=0"
"33","3.386052","2620:0:861:ed1a::1","2600:4040:13e3:bf00:149c:2c75:cfa0:ed7d","TCP","74","443  >  52255 [ACK] Seq=25234 Ack=877 Win=236 Len=0"
"34","3.386052","2620:0:861:ed1a::1","2600:4040:13e3:bf00:149c:2c75:cfa0:ed7d","TLSv1.2","122","Application Data"
"35","3.386052","2620:0:861:ed1a::1","2600:4040:13e3:bf00:149c:2c75:cfa0:ed7d","TCP","74","443  >  52255 [ACK] Seq=25282 Ack=1575 Win=242 Len=0"
"36","3.386052","2620:0:861:ed1a::1","2600:4040:13e3:bf00:149c:2c75:cfa0:ed7d","TLSv1.2","122","Application Data"
"37","3.386092","2600:4040:13e3:bf00:149c:2c75:cfa0:ed7d","2620:0:861:ed1a::1","TCP","74","52255  >  443 [ACK] Seq=2600 Ack=25330 Win=8191 Len=0"
"38","3.386309","2620:0:861:ed1a::1","2600:4040:13e3:bf00:149c:2c75:cfa0:ed7d","TLSv1.2","936","Application Data"
"39","3.386309","2620:0:861:ed1a::1","2600:4040:13e3:bf00:149c:2c75:cfa0:ed7d","TLSv1.2","932","Application Data"
"40","3.386320","2600:4040:13e3:bf00:149c:2c75:cfa0:ed7d","2620:0:861:ed1a::1","TCP","74","52255  >  443 [ACK] Seq=2600 Ack=27050 Win=8191 Len=0"
"41","3.389825","2620:0:861:ed1a::1","2600:4040:13e3:bf00:149c:2c75:cfa0:ed7d","TCP","4394","443  >  52255 [ACK] Seq=27050 Ack=1925 Win=247 Len=4320 [TCP PDU reassembled in 46]"
"42","3.389846","2600:4040:13e3:bf00:149c:2c75:cfa0:ed7d","2620:0:861:ed1a::1","TCP","74","52255  >  443 [ACK] Seq=2600 Ack=31370 Win=8191 Len=0"
"43","3.389964","2620:0:861:ed1a::1","2600:4040:13e3:bf00:149c:2c75:cfa0:ed7d","TCP","1514","443  >  52255 [ACK] Seq=31370 Ack=1925 Win=247 Len=1440 [TCP PDU reassembled in 46]"
"44","3.389964","2620:0:861:ed1a::1","2600:4040:13e3:bf00:149c:2c75:cfa0:ed7d","TCP","1514","443  >  52255 [ACK] Seq=32810 Ack=1925 Win=247 Len=1440 [TCP PDU reassembled in 46]"
"45","3.389964","2620:0:861:ed1a::1","2600:4040:13e3:bf00:149c:2c75:cfa0:ed7d","TCP","1514","443  >  52255 [ACK] Seq=34250 Ack=1925 Win=247 Len=1440 [TCP PDU reassembled in 46]"
"46","3.389964","2620:0:861:ed1a::1","2600:4040:13e3:bf00:149c:2c75:cfa0:ed7d","TLSv1.2","15914","Application Data"
"47","3.389964","2620:0:861:ed1a::1","2600:4040:13e3:bf00:149c:2c75:cfa0:ed7d","TLSv1.2","907","Application Data"
"48","3.389993","2600:4040:13e3:bf00:149c:2c75:cfa0:ed7d","2620:0:861:ed1a::1","TCP","74","52255  >  443 [ACK] Seq=2600 Ack=52363 Win=8191 Len=0"
"49","3.391277","2600:4040:13e3:bf00:149c:2c75:cfa0:ed7d","2620:0:861:ed1a::1","TLSv1.2","170","Application Data"
"50","3.394993","2620:0:861:ed1a::1","2600:4040:13e3:bf00:149c:2c75:cfa0:ed7d","TCP","74","443  >  52255 [ACK] Seq=52363 Ack=2600 Win=258 Len=0"
"51","3.394993","2620:0:861:ed1a::1","2600:4040:13e3:bf00:149c:2c75:cfa0:ed7d","TLSv1.2","20234","Application Data"
"52","3.394993","2620:0:861:ed1a::1","2600:4040:13e3:bf00:149c:2c75:cfa0:ed7d","TLSv1.2","256","Application Data"
"53","3.394993","2620:0:861:ed1a::1","2600:4040:13e3:bf00:149c:2c75:cfa0:ed7d","TCP","7274","443  >  52255 [PSH, ACK] Seq=72705 Ack=2600 Win=258 Len=7200 [TCP PDU reassembled in 55]"
"54","3.395030","2600:4040:13e3:bf00:149c:2c75:cfa0:ed7d","2620:0:861:ed1a::1","TCP","74","52255  >  443 [ACK] Seq=2696 Ack=79905 Win=8191 Len=0"
"55","3.395089","2620:0:861:ed1a::1","2600:4040:13e3:bf00:149c:2c75:cfa0:ed7d","TLSv1.2","2954","Application Data"
"56","3.395097","2600:4040:13e3:bf00:149c:2c75:cfa0:ed7d","2620:0:861:ed1a::1","TCP","74","52255  >  443 [ACK] Seq=2696 Ack=82785 Win=8191 Len=0"
"57","3.398173","2620:0:861:ed1a::1","2600:4040:13e3:bf00:149c:2c75:cfa0:ed7d","TCP","1514","443  >  52255 [ACK] Seq=82785 Ack=2600 Win=258 Len=1440 [TCP PDU reassembled in 61]"
"58","3.398173","2620:0:861:ed1a::1","2600:4040:13e3:bf00:149c:2c75:cfa0:ed7d","TCP","1514","443  >  52255 [ACK] Seq=84225 Ack=2600 Win=258 Len=1440 [TCP PDU reassembled in 61]"
"59","3.398173","2620:0:861:ed1a::1","2600:4040:13e3:bf00:149c:2c75:cfa0:ed7d","TCP","1514","443  >  52255 [ACK] Seq=85665 Ack=2600 Win=258 Len=1440 [TCP PDU reassembled in 61]"
"60","3.398173","2620:0:861:ed1a::1","2600:4040:13e3:bf00:149c:2c75:cfa0:ed7d","TCP","7274","443  >  52255 [ACK] Seq=87105 Ack=2600 Win=258 Len=7200 [TCP PDU reassembled in 61]"
"61","3.398173","2620:0:861:ed1a::1","2600:4040:13e3:bf00:149c:2c75:cfa0:ed7d","TLSv1.2","413","Application Data"
"62","3.398207","2600:4040:13e3:bf00:149c:2c75:cfa0:ed7d","2620:0:861:ed1a::1","TCP","74","52255  >  443 [ACK] Seq=2696 Ack=94644 Win=8191 Len=0"
"63","3.398920","2600:4040:13e3:bf00:149c:2c75:cfa0:ed7d","2620:0:861:ed1a::1","TLSv1.2","502","Application Data"
"64","3.399288","2600:4040:13e3:bf00:149c:2c75:cfa0:ed7d","2620:0:861:ed1a::1","TLSv1.2","210","Application Data"
"65","3.400141","2600:4040:13e3:bf00:149c:2c75:cfa0:ed7d","2620:0:861:ed1a::1","TLSv1.2","110","Application Data"
"66","3.400164","2600:4040:13e3:bf00:149c:2c75:cfa0:ed7d","2620:0:861:ed1a::1","TLSv1.2","110","Application Data"
"67","3.400200","2600:4040:13e3:bf00:149c:2c75:cfa0:ed7d","2620:0:861:ed1a::1","TLSv1.2","110","Application Data"
"68","3.404032","2600:4040:13e3:bf00:149c:2c75:cfa0:ed7d","2620:0:861:ed1a::1","TLSv1.2","247","Application Data"
"69","3.404074","2600:4040:13e3:bf00:149c:2c75:cfa0:ed7d","2620:0:861:ed1a::1","TLSv1.2","308","Application Data"
"70","3.404116","2600:4040:13e3:bf00:149c:2c75:cfa0:ed7d","2620:0:861:ed1a::1","TLSv1.2","997","Application Data"
"71","3.404896","2620:0:861:ed1a::1","2600:4040:13e3:bf00:149c:2c75:cfa0:ed7d","TCP","4394","443  >  52255 [ACK] Seq=94644 Ack=2696 Win=258 Len=4320 [TCP PDU reassembled in 72]"
"72","3.404896","2620:0:861:ed1a::1","2600:4040:13e3:bf00:149c:2c75:cfa0:ed7d","TLSv1.2","817","Application Data"
"73","3.404941","2600:4040:13e3:bf00:149c:2c75:cfa0:ed7d","2620:0:861:ed1a::1","TCP","74","52255  >  443 [ACK] Seq=4698 Ack=99707 Win=8191 Len=0"
"74","3.406081","2600:4040:13e3:bf00:149c:2c75:cfa0:ed7d","2620:0:861:ed1a::1","TLSv1.2","224","Application Data"
"75","3.411652","2620:0:861:ed1a::1","2600:4040:13e3:bf00:149c:2c75:cfa0:ed7d","TLSv1.2","1123","Application Data"
"76","3.412256","2600:4040:13e3:bf00:149c:2c75:cfa0:ed7d","2620:0:861:ed1a::1","TLSv1.2","193","Application Data"
"77","3.413718","2620:0:861:ed1a::1","2600:4040:13e3:bf00:149c:2c75:cfa0:ed7d","TCP","74","443  >  52255 [ACK] Seq=100756 Ack=3368 Win=269 Len=0"
"78","3.413718","2620:0:861:ed1a::1","2600:4040:13e3:bf00:149c:2c75:cfa0:ed7d","TLSv1.2","1124","Application Data"
"79","3.413736","2600:4040:13e3:bf00:149c:2c75:cfa0:ed7d","2620:0:861:ed1a::1","TCP","74","52255  >  443 [ACK] Seq=4967 Ack=101806 Win=8191 Len=0"
"80","3.414385","2600:4040:13e3:bf00:149c:2c75:cfa0:ed7d","2620:0:861:ed1a::1","TLSv1.2","181","Application Data"
"81","3.414515","2600:4040:13e3:bf00:149c:2c75:cfa0:ed7d","2620:0:861:ed1a::1","TLSv1.2","110","Application Data"
"82","3.414542","2600:4040:13e3:bf00:149c:2c75:cfa0:ed7d","2620:0:861:ed1a::1","TLSv1.2","110","Application Data"
"83","3.414562","2600:4040:13e3:bf00:149c:2c75:cfa0:ed7d","2620:0:861:ed1a::1","TLSv1.2","110","Application Data"
"84","3.414578","2600:4040:13e3:bf00:149c:2c75:cfa0:ed7d","2620:0:861:ed1a::1","TLSv1.2","110","Application Data"
"85","3.419660","2620:0:861:ed1a::1","2600:4040:13e3:bf00:149c:2c75:cfa0:ed7d","TCP","74","443  >  52255 [ACK] Seq=101806 Ack=4698 Win=285 Len=0"
"86","3.419660","2620:0:861:ed1a::1","2600:4040:13e3:bf00:149c:2c75:cfa0:ed7d","TLSv1.2","17354","Application Data"
"87","3.419660","2620:0:861:ed1a::1","2600:4040:13e3:bf00:149c:2c75:cfa0:ed7d","TLSv1.2","535","Application Data"
"88","3.419660","2620:0:861:ed1a::1","2600:4040:13e3:bf00:149c:2c75:cfa0:ed7d","TLSv1.2","15914","Application Data"
"89","3.419721","2600:4040:13e3:bf00:149c:2c75:cfa0:ed7d","2620:0:861:ed1a::1","TCP","74","52255  >  443 [ACK] Seq=5218 Ack=135387 Win=8191 Len=0"
"90","3.419942","2620:0:861:ed1a::1","2600:4040:13e3:bf00:149c:2c75:cfa0:ed7d","TLSv1.2","15914","Application Data"
"91","3.419942","2620:0:861:ed1a::1","2600:4040:13e3:bf00:149c:2c75:cfa0:ed7d","TLSv1.2","1506","Application Data"
"92","3.419963","2600:4040:13e3:bf00:149c:2c75:cfa0:ed7d","2620:0:861:ed1a::1","TCP","74","52255  >  443 [ACK] Seq=5218 Ack=152659 Win=8191 Len=0"
"93","3.420991","2620:0:861:ed1a::1","2600:4040:13e3:bf00:149c:2c75:cfa0:ed7d","TCP","15914","443  >  52255 [ACK] Seq=152659 Ack=4698 Win=285 Len=15840 [TCP PDU reassembled in 94]"
"94","3.420991","2620:0:861:ed1a::1","2600:4040:13e3:bf00:149c:2c75:cfa0:ed7d","TLSv1.2","585","Application Data"
"95","3.420991","2620:0:861:ed1a::1","2600:4040:13e3:bf00:149c:2c75:cfa0:ed7d","TCP","15914","443  >  52255 [ACK] Seq=169010 Ack=4698 Win=285 Len=15840 [TCP PDU reassembled in 96]"
"96","3.420991","2620:0:861:ed1a::1","2600:4040:13e3:bf00:149c:2c75:cfa0:ed7d","TLSv1.2","585","Application Data"
"97","3.421027","2600:4040:13e3:bf00:149c:2c75:cfa0:ed7d","2620:0:861:ed1a::1","TCP","74","52255  >  443 [ACK] Seq=5218 Ack=185361 Win=8191 Len=0"
"98","3.421416","2620:0:861:ed1a::1","2600:4040:13e3:bf00:149c:2c75:cfa0:ed7d","TCP","15914","443  >  52255 [ACK] Seq=185361 Ack=4698 Win=285 Len=15840 [TCP PDU reassembled in 99]"
"99","3.421416","2620:0:861:ed1a::1","2600:4040:13e3:bf00:149c:2c75:cfa0:ed7d","TLSv1.2","585","Application Data"
"100","3.421442","2600:4040:13e3:bf00:149c:2c75:cfa0:ed7d","2620:0:861:ed1a::1","TCP","74","52255  >  443 [ACK] Seq=5218 Ack=201712 Win=8191 Len=0"
"101","3.422146","2600:4040:13e3:bf00:149c:2c75:cfa0:ed7d","2620:0:861:ed1a::1","TLSv1.2","201","Application Data"
"102","3.422157","2620:0:861:ed1a::1","2600:4040:13e3:bf00:149c:2c75:cfa0:ed7d","TLSv1.2","17354","Application Data"
"103","3.422205","2600:4040:13e3:bf00:149c:2c75:cfa0:ed7d","2620:0:861:ed1a::1","TCP","74","52255  >  443 [ACK] Seq=5345 Ack=218992 Win=8191 Len=0"
"104","3.422736","2620:0:861:ed1a::1","2600:4040:13e3:bf00:149c:2c75:cfa0:ed7d","TLSv1.2","31754","Application Data"
"105","3.422736","2620:0:861:ed1a::1","2600:4040:13e3:bf00:149c:2c75:cfa0:ed7d","TLSv1.2","167","Application Data"
"106","3.422767","2600:4040:13e3:bf00:149c:2c75:cfa0:ed7d","2620:0:861:ed1a::1","TCP","74","52255  >  443 [ACK] Seq=5345 Ack=250765 Win=8191 Len=0"
"107","3.424919","2620:0:861:ed1a::1","2600:4040:13e3:bf00:149c:2c75:cfa0:ed7d","TLSv1.2","64874","Application Data, Application Data, Application Data"
"108","3.424959","2600:4040:13e3:bf00:149c:2c75:cfa0:ed7d","2620:0:861:ed1a::1","TCP","74","52255  >  443 [ACK] Seq=5345 Ack=315565 Win=8191 Len=0"
"109","3.427936","2620:0:861:ed1a::1","2600:4040:13e3:bf00:149c:2c75:cfa0:ed7d","TLSv1.2","10154","Application Data, Application Data"
"110","3.427936","2620:0:861:ed1a::1","2600:4040:13e3:bf00:149c:2c75:cfa0:ed7d","TLSv1.2","201","Application Data"
"111","3.427936","2620:0:861:ed1a::1","2600:4040:13e3:bf00:149c:2c75:cfa0:ed7d","TLSv1.2","1068","Application Data"
"112","3.427967","2600:4040:13e3:bf00:149c:2c75:cfa0:ed7d","2620:0:861:ed1a::1","TCP","74","52255  >  443 [ACK] Seq=5345 Ack=326766 Win=8191 Len=0"
"113","3.429206","2620:0:861:ed1a::1","2600:4040:13e3:bf00:149c:2c75:cfa0:ed7d","TCP","74","443  >  52255 [ACK] Seq=326766 Ack=5110 Win=291 Len=0"
"114","3.429206","2620:0:861:ed1a::1","2600:4040:13e3:bf00:149c:2c75:cfa0:ed7d","TCP","74","443  >  52255 [ACK] Seq=326766 Ack=5218 Win=291 Len=0"
"115","3.429206","2620:0:861:ed1a::1","2600:4040:13e3:bf00:149c:2c75:cfa0:ed7d","TLSv1.2","1122","Application Data"
"116","3.429230","2600:4040:13e3:bf00:149c:2c75:cfa0:ed7d","2620:0:861:ed1a::1","TCP","74","52255  >  443 [ACK] Seq=5345 Ack=327814 Win=8187 Len=0"
"117","3.436315","2620:0:861:ed1a::1","2600:4040:13e3:bf00:149c:2c75:cfa0:ed7d","TLSv1.2","1116","Application Data"
"118","3.449209","2600:4040:13e3:bf00:149c:2c75:cfa0:ed7d","2620:0:861:ed1a::1","TLSv1.2","217","Application Data"
"119","3.450075","2600:4040:13e3:bf00:149c:2c75:cfa0:ed7d","2620:0:861:ed1a::1","TLSv1.2","232","Application Data"
"120","3.450352","2600:4040:13e3:bf00:149c:2c75:cfa0:ed7d","2620:0:861:ed1a::1","TLSv1.2","213","Application Data"
"121","3.460238","2600:4040:13e3:bf00:149c:2c75:cfa0:ed7d","2620:0:861:ed1a::1","TLSv1.2","205","Application Data"
"122","3.463067","2620:0:861:ed1a::1","2600:4040:13e3:bf00:149c:2c75:cfa0:ed7d","TCP","74","443  >  52255 [ACK] Seq=328856 Ack=5646 Win=302 Len=0"
"123","3.464291","2620:0:861:ed1a::1","2600:4040:13e3:bf00:149c:2c75:cfa0:ed7d","TLSv1.2","27434","Application Data, Application Data"
"124","3.464291","2620:0:861:ed1a::1","2600:4040:13e3:bf00:149c:2c75:cfa0:ed7d","TLSv1.2","1068","Application Data"
"125","3.464329","2600:4040:13e3:bf00:149c:2c75:cfa0:ed7d","2620:0:861:ed1a::1","TCP","74","52255  >  443 [ACK] Seq=5916 Ack=357210 Win=8191 Len=0"
"126","3.465464","2620:0:861:ed1a::1","2600:4040:13e3:bf00:149c:2c75:cfa0:ed7d","TCP","2954","443  >  52255 [ACK] Seq=357210 Ack=5785 Win=307 Len=2880 [TCP PDU reassembled in 127]"
"127","3.465464","2620:0:861:ed1a::1","2600:4040:13e3:bf00:149c:2c75:cfa0:ed7d","TLSv1.2","929","Application Data"
"128","3.465491","2600:4040:13e3:bf00:149c:2c75:cfa0:ed7d","2620:0:861:ed1a::1","TCP","74","52255  >  443 [ACK] Seq=5916 Ack=360945 Win=8191 Len=0"
"129","3.472389","2600:4040:13e3:bf00:149c:2c75:cfa0:ed7d","2620:0:861:ed1a::1","TLSv1.2","248","Application Data"
"130","3.473141","2620:0:861:ed1a::1","2600:4040:13e3:bf00:149c:2c75:cfa0:ed7d","TLSv1.2","1036","Application Data"
"131","3.475087","2600:4040:13e3:bf00:149c:2c75:cfa0:ed7d","2620:0:861:ed1a::1","TLSv1.2","210","Application Data"
"132","3.475124","2600:4040:13e3:bf00:149c:2c75:cfa0:ed7d","2620:0:861:ed1a::1","TLSv1.2","217","Application Data"
"133","3.475148","2600:4040:13e3:bf00:149c:2c75:cfa0:ed7d","2620:0:861:ed1a::1","TLSv1.2","213","Application Data"
"134","3.475226","2600:4040:13e3:bf00:149c:2c75:cfa0:ed7d","2620:0:861:ed1a::1","TLSv1.2","213","Application Data"
"135","3.475255","2600:4040:13e3:bf00:149c:2c75:cfa0:ed7d","2620:0:861:ed1a::1","TLSv1.2","208","Application Data"
"136","3.477798","2600:4040:13e3:bf00:149c:2c75:cfa0:ed7d","2620:0:861:ed1a::1","TLSv1.2","110","Application Data"
"137","3.477824","2600:4040:13e3:bf00:149c:2c75:cfa0:ed7d","2620:0:861:ed1a::1","TLSv1.2","110","Application Data"
"138","3.477836","2600:4040:13e3:bf00:149c:2c75:cfa0:ed7d","2620:0:861:ed1a::1","TLSv1.2","110","Application Data"
"139","3.477907","2600:4040:13e3:bf00:149c:2c75:cfa0:ed7d","2620:0:861:ed1a::1","TLSv1.2","110","Application Data"
"140","3.477924","2600:4040:13e3:bf00:149c:2c75:cfa0:ed7d","2620:0:861:ed1a::1","TLSv1.2","110","Application Data"
"141","3.477940","2600:4040:13e3:bf00:149c:2c75:cfa0:ed7d","2620:0:861:ed1a::1","TLSv1.2","110","Application Data"
"142","3.477958","2600:4040:13e3:bf00:149c:2c75:cfa0:ed7d","2620:0:861:ed1a::1","TLSv1.2","110","Application Data"
"143","3.477972","2600:4040:13e3:bf00:149c:2c75:cfa0:ed7d","2620:0:861:ed1a::1","TLSv1.2","110","Application Data"
"144","3.478192","2600:4040:13e3:bf00:149c:2c75:cfa0:ed7d","2620:0:861:ed1a::1","TLSv1.2","214","Application Data"
"145","3.478394","2600:4040:13e3:bf00:149c:2c75:cfa0:ed7d","2620:0:861:ed1a::1","TLSv1.2","233","Application Data"
"146","3.478421","2600:4040:13e3:bf00:149c:2c75:cfa0:ed7d","2620:0:861:ed1a::1","TLSv1.2","211","Application Data"
"147","3.478442","2600:4040:13e3:bf00:149c:2c75:cfa0:ed7d","2620:0:861:ed1a::1","TLSv1.2","211","Application Data"
"148","3.478463","2600:4040:13e3:bf00:149c:2c75:cfa0:ed7d","2620:0:861:ed1a::1","TLSv1.2","214","Application Data"
"149","3.479102","2600:4040:13e3:bf00:149c:2c75:cfa0:ed7d","2620:0:861:ed1a::1","TLSv1.2","199","Application Data"
"150","3.485839","2620:0:861:ed1a::1","2600:4040:13e3:bf00:149c:2c75:cfa0:ed7d","TCP","11594","443  >  52255 [ACK] Seq=361907 Ack=6090 Win=318 Len=11520 [TCP PDU reassembled in 151]"
"151","3.485839","2620:0:861:ed1a::1","2600:4040:13e3:bf00:149c:2c75:cfa0:ed7d","TLSv1.2","475","Application Data"
"152","3.485888","2600:4040:13e3:bf00:149c:2c75:cfa0:ed7d","2620:0:861:ed1a::1","TCP","74","52255  >  443 [ACK] Seq=7907 Ack=373828 Win=8191 Len=0"
"153","3.488268","2620:0:861:ed1a::1","2600:4040:13e3:bf00:149c:2c75:cfa0:ed7d","TCP","74","443  >  52255 [ACK] Seq=373828 Ack=6781 Win=346 Len=0"
"154","3.488268","2620:0:861:ed1a::1","2600:4040:13e3:bf00:149c:2c75:cfa0:ed7d","TCP","1514","443  >  52255 [ACK] Seq=373828 Ack=6781 Win=346 Len=1440 [TCP PDU reassembled in 155]"
"155","3.488268","2620:0:861:ed1a::1","2600:4040:13e3:bf00:149c:2c75:cfa0:ed7d","TLSv1.2","790","Application Data"
"156","3.488268","2620:0:861:ed1a::1","2600:4040:13e3:bf00:149c:2c75:cfa0:ed7d","TLSv1.2","1171","Application Data"
"157","3.488268","2620:0:861:ed1a::1","2600:4040:13e3:bf00:149c:2c75:cfa0:ed7d","TCP","1514","443  >  52255 [ACK] Seq=377081 Ack=6781 Win=346 Len=1440 [TCP PDU reassembled in 158]"
"158","3.488268","2620:0:861:ed1a::1","2600:4040:13e3:bf00:149c:2c75:cfa0:ed7d","TLSv1.2","839","Application Data"
"159","3.488311","2600:4040:13e3:bf00:149c:2c75:cfa0:ed7d","2620:0:861:ed1a::1","TCP","74","52255  >  443 [ACK] Seq=7907 Ack=377081 Win=8191 Len=0"
"160","3.488361","2600:4040:13e3:bf00:149c:2c75:cfa0:ed7d","2620:0:861:ed1a::1","TCP","74","52255  >  443 [ACK] Seq=7907 Ack=379286 Win=8191 Len=0"
"161","3.490444","2620:0:861:ed1a::1","2600:4040:13e3:bf00:149c:2c75:cfa0:ed7d","TCP","74","443  >  52255 [ACK] Seq=379286 Ack=6853 Win=346 Len=0"
"162","3.490444","2620:0:861:ed1a::1","2600:4040:13e3:bf00:149c:2c75:cfa0:ed7d","TCP","74","443  >  52255 [ACK] Seq=379286 Ack=6961 Win=346 Len=0"
"163","3.490444","2620:0:861:ed1a::1","2600:4040:13e3:bf00:149c:2c75:cfa0:ed7d","TCP","74","443  >  52255 [ACK] Seq=379286 Ack=7209 Win=351 Len=0"
"164","3.490444","2620:0:861:ed1a::1","2600:4040:13e3:bf00:149c:2c75:cfa0:ed7d","TLSv1.2","1223","Application Data"
"165","3.490444","2620:0:861:ed1a::1","2600:4040:13e3:bf00:149c:2c75:cfa0:ed7d","TCP","74","443  >  52255 [ACK] Seq=380435 Ack=7505 Win=362 Len=0"
"166","3.490970","2620:0:861:ed1a::1","2600:4040:13e3:bf00:149c:2c75:cfa0:ed7d","TLSv1.2","1376","Application Data"
"167","3.490970","2620:0:861:ed1a::1","2600:4040:13e3:bf00:149c:2c75:cfa0:ed7d","TLSv1.2","1178","Application Data"
"168","3.490987","2600:4040:13e3:bf00:149c:2c75:cfa0:ed7d","2620:0:861:ed1a::1","TCP","74","52255  >  443 [ACK] Seq=7907 Ack=382841 Win=8191 Len=0"
"169","3.492492","2620:0:861:ed1a::1","2600:4040:13e3:bf00:149c:2c75:cfa0:ed7d","TCP","74","443  >  52255 [ACK] Seq=382841 Ack=7907 Win=373 Len=0"
"170","3.493103","2620:0:861:ed1a::1","2600:4040:13e3:bf00:149c:2c75:cfa0:ed7d","TLSv1.2","1158","Application Data"
"171","3.493103","2620:0:861:ed1a::1","2600:4040:13e3:bf00:149c:2c75:cfa0:ed7d","TCP","1514","443  >  52255 [ACK] Seq=383925 Ack=7907 Win=373 Len=1440 [TCP PDU reassembled in 172]"
"172","3.493103","2620:0:861:ed1a::1","2600:4040:13e3:bf00:149c:2c75:cfa0:ed7d","TLSv1.2","928","Application Data"
"173","3.493130","2600:4040:13e3:bf00:149c:2c75:cfa0:ed7d","2620:0:861:ed1a::1","TCP","74","52255  >  443 [ACK] Seq=7907 Ack=386219 Win=8191 Len=0"
"174","3.497137","2600:4040:13e3:bf00:149c:2c75:cfa0:ed7d","2620:0:861:ed1a::1","TLSv1.2","221","Application Data"
"175","3.510522","2620:0:861:ed1a::1","2600:4040:13e3:bf00:149c:2c75:cfa0:ed7d","TLSv1.2","1343","Application Data"
"176","3.513844","2600:4040:13e3:bf00:149c:2c75:cfa0:ed7d","2620:0:861:ed1a::1","TLSv1.2","152","Application Data"
"177","3.527648","2620:0:861:ed1a::1","2600:4040:13e3:bf00:149c:2c75:cfa0:ed7d","TCP","1514","443  >  52255 [ACK] Seq=387488 Ack=8132 Win=378 Len=1440"
