"No.","Time","Source","Destination","Protocol","Length","Info"
"3366","1.142669","100.86.243.187","23.13.164.38","TLSv1.2","414","Application Data"
"3789","1.184703","23.13.164.38","100.86.243.187","TLSv1.2","406","Application Data"
"3790","1.184704","23.13.164.38","100.86.243.187","TCP","1514","443  >  54993 [ACK] Seq=341 Ack=349 Win=9783 Len=1448 TSval=1115600886 TSecr=931567195 [TCP PDU reassembled in 3805]"
"3791","1.184704","23.13.164.38","100.86.243.187","TCP","1514","443  >  54993 [ACK] Seq=1789 Ack=349 Win=9783 Len=1448 TSval=1115600886 TSecr=931567195 [TCP PDU reassembled in 3805]"
"3792","1.184762","100.86.243.187","23.13.164.38","TCP","66","54993  >  443 [ACK] Seq=349 Ack=3237 Win=37405 Len=0 TSval=931567237 TSecr=1115600886"
"3793","1.184948","100.86.243.187","23.13.164.38","TCP","66","[TCP Window Update] 54993  >  443 [ACK] Seq=349 Ack=3237 Win=37456 Len=0 TSval=931567237 TSecr=1115600886"
"3794","1.185348","23.13.164.38","100.86.243.187","TCP","1514","443  >  54993 [ACK] Seq=3237 Ack=349 Win=9783 Len=1448 TSval=1115600886 TSecr=931567195 [TCP PDU reassembled in 3805]"
"3795","1.185348","23.13.164.38","100.86.243.187","TCP","1514","443  >  54993 [ACK] Seq=4685 Ack=349 Win=9783 Len=1448 TSval=1115600886 TSecr=931567195 [TCP PDU reassembled in 3805]"
"3796","1.185392","100.86.243.187","23.13.164.38","TCP","66","54993  >  443 [ACK] Seq=349 Ack=6133 Win=37410 Len=0 TSval=931567238 TSecr=1115600886"
"3797","1.185436","100.86.243.187","23.13.164.38","TCP","66","[TCP Window Update] 54993  >  443 [ACK] Seq=349 Ack=6133 Win=37456 Len=0 TSval=931567238 TSecr=1115600886"
"3798","1.186651","23.13.164.38","100.86.243.187","TCP","1514","443  >  54993 [ACK] Seq=6133 Ack=349 Win=9783 Len=1448 TSval=1115600886 TSecr=931567195 [TCP PDU reassembled in 3805]"
"3799","1.186651","23.13.164.38","100.86.243.187","TCP","1514","443  >  54993 [ACK] Seq=7581 Ack=349 Win=9783 Len=1448 TSval=1115600886 TSecr=931567195 [TCP PDU reassembled in 3805]"
"3800","1.186652","23.13.164.38","100.86.243.187","TCP","1514","443  >  54993 [ACK] Seq=9029 Ack=349 Win=9783 Len=1448 TSval=1115600886 TSecr=931567195 [TCP PDU reassembled in 3805]"
"3801","1.186653","23.13.164.38","100.86.243.187","TCP","1514","443  >  54993 [ACK] Seq=10477 Ack=349 Win=9783 Len=1448 TSval=1115600886 TSecr=931567195 [TCP PDU reassembled in 3805]"
"3802","1.186653","23.13.164.38","100.86.243.187","TCP","1514","443  >  54993 [ACK] Seq=11925 Ack=349 Win=9783 Len=1448 TSval=1115600886 TSecr=931567195 [TCP PDU reassembled in 3805]"
"3803","1.186654","23.13.164.38","100.86.243.187","TCP","1514","443  >  54993 [PSH, ACK] Seq=13373 Ack=349 Win=9783 Len=1448 TSval=1115600886 TSecr=931567195 [TCP PDU reassembled in 3805]"
"3804","1.186655","23.13.164.38","100.86.243.187","TCP","1514","443  >  54993 [ACK] Seq=14821 Ack=349 Win=9783 Len=1448 TSval=1115600887 TSecr=931567195 [TCP PDU reassembled in 3805]"
"3805","1.186655","23.13.164.38","100.86.243.187","TLSv1.2","544","Application Data"
"3806","1.186656","23.13.164.38","100.86.243.187","TLSv1.2","97","Application Data"
"3807","1.186656","23.13.164.38","100.86.243.187","TCP","1514","443  >  54993 [ACK] Seq=16778 Ack=349 Win=9783 Len=1448 TSval=1115600887 TSecr=931567195 [TCP PDU reassembled in 3831]"
"3808","1.186657","23.13.164.38","100.86.243.187","TCP","1514","443  >  54993 [ACK] Seq=18226 Ack=349 Win=9783 Len=1448 TSval=1115600887 TSecr=931567195 [TCP PDU reassembled in 3831]"
"3809","1.186657","23.13.164.38","100.86.243.187","TCP","1514","443  >  54993 [ACK] Seq=19674 Ack=349 Win=9783 Len=1448 TSval=1115600887 TSecr=931567195 [TCP PDU reassembled in 3831]"
"3810","1.186658","23.13.164.38","100.86.243.187","TCP","1514","443  >  54993 [ACK] Seq=21122 Ack=349 Win=9783 Len=1448 TSval=1115600887 TSecr=931567195 [TCP PDU reassembled in 3831]"
"3811","1.186659","23.13.164.38","100.86.243.187","TCP","1514","443  >  54993 [ACK] Seq=22570 Ack=349 Win=9783 Len=1448 TSval=1115600887 TSecr=931567195 [TCP PDU reassembled in 3831]"
"3812","1.186659","23.13.164.38","100.86.243.187","TCP","1514","[TCP Previous segment not captured] 443  >  54993 [ACK] Seq=25466 Ack=349 Win=9783 Len=1448 TSval=1115600887 TSecr=931567195 [TCP PDU reassembled in 3831]"
"3813","1.186660","23.13.164.38","100.86.243.187","TCP","1514","443  >  54993 [ACK] Seq=26914 Ack=349 Win=9783 Len=1448 TSval=1115600887 TSecr=931567195 [TCP PDU reassembled in 3831]"
"3814","1.186733","100.86.243.187","23.13.164.38","TCP","66","54993  >  443 [ACK] Seq=349 Ack=21122 Win=37221 Len=0 TSval=931567240 TSecr=1115600887"
"3815","1.186760","100.86.243.187","23.13.164.38","TCP","66","54993  >  443 [ACK] Seq=349 Ack=24018 Win=37176 Len=0 TSval=931567240 TSecr=1115600887"
"3816","1.186773","100.86.243.187","23.13.164.38","TCP","78","[TCP Dup ACK 3815#1] 54993  >  443 [ACK] Seq=349 Ack=24018 Win=37176 Len=0 TSval=931567240 TSecr=1115600887 SLE=25466 SRE=28362"
"3817","1.186892","100.86.243.187","23.13.164.38","TCP","78","[TCP Dup ACK 3815#2] 54993  >  443 [ACK] Seq=349 Ack=24018 Win=37456 Len=0 TSval=931567240 TSecr=1115600887 SLE=25466 SRE=28362"
"3818","1.187205","23.13.164.38","100.86.243.187","TCP","1514","443  >  54993 [ACK] Seq=28362 Ack=349 Win=9783 Len=1448 TSval=1115600887 TSecr=931567195 [TCP PDU reassembled in 3831]"
"3819","1.187206","23.13.164.38","100.86.243.187","TCP","1514","443  >  54993 [PSH, ACK] Seq=29810 Ack=349 Win=9783 Len=1448 TSval=1115600887 TSecr=931567195 [TCP PDU reassembled in 3831]"
"3820","1.187266","100.86.243.187","23.13.164.38","TCP","78","[TCP Dup ACK 3815#3] 54993  >  443 [ACK] Seq=349 Ack=24018 Win=37456 Len=0 TSval=931567240 TSecr=1115600887 SLE=25466 SRE=31258"
"3821","1.188435","23.13.164.38","100.86.243.187","TCP","1514","443  >  54993 [ACK] Seq=31258 Ack=349 Win=9783 Len=1448 TSval=1115600888 TSecr=931567195 [TCP PDU reassembled in 3831]"
"3822","1.188436","23.13.164.38","100.86.243.187","TCP","1514","443  >  54993 [ACK] Seq=32706 Ack=349 Win=9783 Len=1448 TSval=1115600888 TSecr=931567195 [TCP PDU reassembled in 3831], Application Data"
"3823","1.188437","23.13.164.38","100.86.243.187","TCP","1514","443  >  54993 [ACK] Seq=34154 Ack=349 Win=9783 Len=1448 TSval=1115600888 TSecr=931567195 [TCP PDU reassembled in 3825]"
"3824","1.188437","23.13.164.38","100.86.243.187","TCP","1514","443  >  54993 [ACK] Seq=35602 Ack=349 Win=9783 Len=1448 TSval=1115600888 TSecr=931567195 [TCP PDU reassembled in 3825]"
"3825","1.188438","23.13.164.38","100.86.243.187","TLSv1.2","494","Application Data"
"3829","1.188516","100.86.243.187","23.13.164.38","TCP","78","[TCP Dup ACK 3815#4] 54993  >  443 [ACK] Seq=349 Ack=24018 Win=37456 Len=0 TSval=931567242 TSecr=1115600887 SLE=25466 SRE=37478"
"3831","1.211547","23.13.164.38","100.86.243.187","TCP","1514","[TCP Retransmission] 443  >  54993 [ACK] Seq=24018 Ack=349 Win=9783 Len=1448 TSval=1115600913 TSecr=931567242"
"3832","1.211611","100.86.243.187","23.13.164.38","TCP","66","54993  >  443 [ACK] Seq=349 Ack=37478 Win=37245 Len=0 TSval=931567265 TSecr=1115600913"
"3833","1.211758","100.86.243.187","23.13.164.38","TCP","66","[TCP Window Update] 54993  >  443 [ACK] Seq=349 Ack=37478 Win=37456 Len=0 TSval=931567265 TSecr=1115600913"
"3851","1.798282","100.86.243.187","23.13.164.38","TLSv1.2","684","Application Data"
"3852","1.835874","23.13.164.38","100.86.243.187","TLSv1.2","474","Application Data"
"3853","1.835875","23.13.164.38","100.86.243.187","TCP","1514","443  >  54993 [ACK] Seq=37886 Ack=967 Win=9783 Len=1448 TSval=1115601537 TSecr=931567851 [TCP PDU reassembled in 3866]"
"3854","1.835876","23.13.164.38","100.86.243.187","TCP","1514","443  >  54993 [ACK] Seq=39334 Ack=967 Win=9783 Len=1448 TSval=1115601537 TSecr=931567851 [TCP PDU reassembled in 3866]"
"3855","1.835966","100.86.243.187","23.13.164.38","TCP","66","54993  >  443 [ACK] Seq=967 Ack=40782 Win=37404 Len=0 TSval=931567889 TSecr=1115601537"
"3856","1.836181","100.86.243.187","23.13.164.38","TCP","66","[TCP Window Update] 54993  >  443 [ACK] Seq=967 Ack=40782 Win=37456 Len=0 TSval=931567889 TSecr=1115601537"
"3857","1.837580","23.13.164.38","100.86.243.187","TCP","1514","443  >  54993 [ACK] Seq=40782 Ack=967 Win=9783 Len=1448 TSval=1115601537 TSecr=931567851 [TCP PDU reassembled in 3866]"
"3858","1.837581","23.13.164.38","100.86.243.187","TCP","1514","443  >  54993 [ACK] Seq=42230 Ack=967 Win=9783 Len=1448 TSval=1115601537 TSecr=931567851 [TCP PDU reassembled in 3866]"
"3859","1.837582","23.13.164.38","100.86.243.187","TCP","1514","443  >  54993 [ACK] Seq=43678 Ack=967 Win=9783 Len=1448 TSval=1115601537 TSecr=931567851 [TCP PDU reassembled in 3866]"
"3860","1.837583","23.13.164.38","100.86.243.187","TCP","1514","443  >  54993 [ACK] Seq=45126 Ack=967 Win=9783 Len=1448 TSval=1115601537 TSecr=931567851 [TCP PDU reassembled in 3866]"
"3861","1.837583","23.13.164.38","100.86.243.187","TCP","1514","443  >  54993 [ACK] Seq=46574 Ack=967 Win=9783 Len=1448 TSval=1115601537 TSecr=931567851 [TCP PDU reassembled in 3866]"
"3862","1.837584","23.13.164.38","100.86.243.187","TCP","1514","443  >  54993 [ACK] Seq=48022 Ack=967 Win=9783 Len=1448 TSval=1115601537 TSecr=931567851 [TCP PDU reassembled in 3866]"
"3863","1.837585","23.13.164.38","100.86.243.187","TCP","1514","443  >  54993 [ACK] Seq=49470 Ack=967 Win=9783 Len=1448 TSval=1115601537 TSecr=931567851 [TCP PDU reassembled in 3866]"
"3864","1.837585","23.13.164.38","100.86.243.187","TCP","1514","443  >  54993 [PSH, ACK] Seq=50918 Ack=967 Win=9783 Len=1448 TSval=1115601537 TSecr=931567851 [TCP PDU reassembled in 3866]"
"3865","1.837586","23.13.164.38","100.86.243.187","TCP","1514","443  >  54993 [ACK] Seq=52366 Ack=967 Win=9783 Len=1448 TSval=1115601538 TSecr=931567851 [TCP PDU reassembled in 3866]"
"3866","1.837587","23.13.164.38","100.86.243.187","TLSv1.2","544","Application Data"
"3867","1.837588","23.13.164.38","100.86.243.187","TLSv1.2","1514","Application Data"
"3868","1.837588","23.13.164.38","100.86.243.187","TCP","1514","443  >  54993 [ACK] Seq=55740 Ack=967 Win=9783 Len=1448 TSval=1115601538 TSecr=931567851 [TCP PDU reassembled in 3872]"
"3869","1.837671","100.86.243.187","23.13.164.38","TCP","66","54993  >  443 [ACK] Seq=967 Ack=55740 Win=37222 Len=0 TSval=931567891 TSecr=1115601538"
"3870","1.837844","100.86.243.187","23.13.164.38","TCP","66","[TCP Window Update] 54993  >  443 [ACK] Seq=967 Ack=55740 Win=37456 Len=0 TSval=931567891 TSecr=1115601538"
"3871","1.837909","100.86.243.187","23.13.164.38","TCP","66","54993  >  443 [ACK] Seq=967 Ack=57188 Win=37433 Len=0 TSval=931567891 TSecr=1115601538"
"3872","1.837999","23.13.164.38","100.86.243.187","TLSv1.2","685","Application Data"
"3873","1.838042","100.86.243.187","23.13.164.38","TCP","66","54993  >  443 [ACK] Seq=967 Ack=57807 Win=37446 Len=0 TSval=931567891 TSecr=1115601538"
"3876","2.065843","100.86.243.187","23.13.164.38","TLSv1.2","569","Application Data"
"3877","2.066120","100.86.243.187","23.13.164.38","TLSv1.2","385","Application Data"
"3878","2.066358","100.86.243.187","23.13.164.38","TLSv1.2","385","Application Data"
"3879","2.076750","23.13.164.38","100.86.243.187","TCP","66","443  >  54993 [ACK] Seq=57807 Ack=2108 Win=9783 Len=0 TSval=1115601778 TSecr=931568119"
"3880","2.098852","23.13.164.38","100.86.243.187","TLSv1.2","420","Application Data"
"3881","2.098853","23.13.164.38","100.86.243.187","TCP","1514","443  >  54993 [ACK] Seq=58161 Ack=2108 Win=9783 Len=1448 TSval=1115601800 TSecr=931568119 [TCP PDU reassembled in 3894]"
"3882","2.098854","23.13.164.38","100.86.243.187","TCP","1514","443  >  54993 [ACK] Seq=59609 Ack=2108 Win=9783 Len=1448 TSval=1115601800 TSecr=931568119 [TCP PDU reassembled in 3894]"
"3883","2.098933","100.86.243.187","23.13.164.38","TCP","66","54993  >  443 [ACK] Seq=2108 Ack=61057 Win=37405 Len=0 TSval=931568152 TSecr=1115601800"
"3884","2.099140","100.86.243.187","23.13.164.38","TCP","66","[TCP Window Update] 54993  >  443 [ACK] Seq=2108 Ack=61057 Win=37456 Len=0 TSval=931568152 TSecr=1115601800"
"3885","2.100872","23.13.164.38","100.86.243.187","TCP","1514","443  >  54993 [ACK] Seq=61057 Ack=2108 Win=9783 Len=1448 TSval=1115601800 TSecr=931568119 [TCP PDU reassembled in 3894]"
"3886","2.100873","23.13.164.38","100.86.243.187","TCP","1514","443  >  54993 [ACK] Seq=62505 Ack=2108 Win=9783 Len=1448 TSval=1115601800 TSecr=931568119 [TCP PDU reassembled in 3894]"
"3887","2.100873","23.13.164.38","100.86.243.187","TCP","1514","443  >  54993 [ACK] Seq=63953 Ack=2108 Win=9783 Len=1448 TSval=1115601800 TSecr=931568119 [TCP PDU reassembled in 3894]"
"3888","2.100874","23.13.164.38","100.86.243.187","TCP","1514","443  >  54993 [ACK] Seq=65401 Ack=2108 Win=9783 Len=1448 TSval=1115601800 TSecr=931568119 [TCP PDU reassembled in 3894]"
"3889","2.100874","23.13.164.38","100.86.243.187","TCP","1514","443  >  54993 [ACK] Seq=66849 Ack=2108 Win=9783 Len=1448 TSval=1115601800 TSecr=931568119 [TCP PDU reassembled in 3894]"
"3890","2.100875","23.13.164.38","100.86.243.187","TCP","1514","443  >  54993 [ACK] Seq=68297 Ack=2108 Win=9783 Len=1448 TSval=1115601800 TSecr=931568119 [TCP PDU reassembled in 3894]"
"3891","2.100875","23.13.164.38","100.86.243.187","TCP","1514","443  >  54993 [ACK] Seq=69745 Ack=2108 Win=9783 Len=1448 TSval=1115601800 TSecr=931568119 [TCP PDU reassembled in 3894]"
"3892","2.100876","23.13.164.38","100.86.243.187","TCP","1514","443  >  54993 [PSH, ACK] Seq=71193 Ack=2108 Win=9783 Len=1448 TSval=1115601800 TSecr=931568119 [TCP PDU reassembled in 3894]"
"3893","2.100876","23.13.164.38","100.86.243.187","TCP","1514","443  >  54993 [ACK] Seq=72641 Ack=2108 Win=9783 Len=1448 TSval=1115601801 TSecr=931568119 [TCP PDU reassembled in 3894]"
"3894","2.100877","23.13.164.38","100.86.243.187","TLSv1.2","544","Application Data"
"3895","2.100877","23.13.164.38","100.86.243.187","TLSv1.2","1514","Application Data"
"3896","2.100877","23.13.164.38","100.86.243.187","TCP","1514","443  >  54993 [ACK] Seq=76015 Ack=2108 Win=9783 Len=1448 TSval=1115601801 TSecr=931568119 [TCP PDU reassembled in 3909]"
"3897","2.100878","23.13.164.38","100.86.243.187","TCP","1514","443  >  54993 [ACK] Seq=77463 Ack=2108 Win=9783 Len=1448 TSval=1115601801 TSecr=931568119 [TCP PDU reassembled in 3909]"
"3898","2.100878","23.13.164.38","100.86.243.187","TCP","1514","443  >  54993 [ACK] Seq=78911 Ack=2108 Win=9783 Len=1448 TSval=1115601801 TSecr=931568119 [TCP PDU reassembled in 3909]"
"3899","2.100879","23.13.164.38","100.86.243.187","TCP","1514","443  >  54993 [ACK] Seq=80359 Ack=2108 Win=9783 Len=1448 TSval=1115601801 TSecr=931568119 [TCP PDU reassembled in 3909]"
"3900","2.100879","23.13.164.38","100.86.243.187","TCP","1514","443  >  54993 [ACK] Seq=81807 Ack=2108 Win=9783 Len=1448 TSval=1115601801 TSecr=931568119 [TCP PDU reassembled in 3909]"
"3901","2.100947","100.86.243.187","23.13.164.38","TCP","66","54993  >  443 [ACK] Seq=2108 Ack=76015 Win=37222 Len=0 TSval=931568154 TSecr=1115601801"
"3902","2.100973","100.86.243.187","23.13.164.38","TCP","66","54993  >  443 [ACK] Seq=2108 Ack=83255 Win=37109 Len=0 TSval=931568154 TSecr=1115601801"
"3903","2.101094","100.86.243.187","23.13.164.38","TCP","66","[TCP Window Update] 54993  >  443 [ACK] Seq=2108 Ack=83255 Win=37456 Len=0 TSval=931568154 TSecr=1115601801"
"3904","2.102200","23.13.164.38","100.86.243.187","TCP","1514","443  >  54993 [ACK] Seq=83255 Ack=2108 Win=9783 Len=1448 TSval=1115601801 TSecr=931568119 [TCP PDU reassembled in 3909]"
"3905","2.102201","23.13.164.38","100.86.243.187","TCP","1514","443  >  54993 [ACK] Seq=84703 Ack=2108 Win=9783 Len=1448 TSval=1115601801 TSecr=931568119 [TCP PDU reassembled in 3909]"
"3906","2.102201","23.13.164.38","100.86.243.187","TCP","1514","443  >  54993 [ACK] Seq=86151 Ack=2108 Win=9783 Len=1448 TSval=1115601801 TSecr=931568119 [TCP PDU reassembled in 3909]"
"3907","2.102202","23.13.164.38","100.86.243.187","TCP","1514","443  >  54993 [PSH, ACK] Seq=87599 Ack=2108 Win=9783 Len=1448 TSval=1115601801 TSecr=931568119 [TCP PDU reassembled in 3909]"
"3908","2.102202","23.13.164.38","100.86.243.187","TCP","1514","443  >  54993 [ACK] Seq=89047 Ack=2108 Win=9783 Len=1448 TSval=1115601802 TSecr=931568119 [TCP PDU reassembled in 3909]"
"3909","2.102203","23.13.164.38","100.86.243.187","TLSv1.2","1514","Application Data, Application Data"
"3910","2.102203","23.13.164.38","100.86.243.187","TCP","1514","443  >  54993 [ACK] Seq=91943 Ack=2108 Win=9783 Len=1448 TSval=1115601802 TSecr=931568119 [TCP PDU reassembled in 3922]"
"3911","2.102204","23.13.164.38","100.86.243.187","TCP","1514","443  >  54993 [ACK] Seq=93391 Ack=2108 Win=9783 Len=1448 TSval=1115601802 TSecr=931568119 [TCP PDU reassembled in 3922]"
"3912","2.102263","100.86.243.187","23.13.164.38","TCP","66","54993  >  443 [ACK] Seq=2108 Ack=94839 Win=37275 Len=0 TSval=931568155 TSecr=1115601802"
"3913","2.102405","100.86.243.187","23.13.164.38","TCP","66","[TCP Window Update] 54993  >  443 [ACK] Seq=2108 Ack=94839 Win=37456 Len=0 TSval=931568155 TSecr=1115601802"
"3914","2.103749","23.13.164.38","100.86.243.187","TCP","1514","443  >  54993 [ACK] Seq=94839 Ack=2108 Win=9783 Len=1448 TSval=1115601802 TSecr=931568119 [TCP PDU reassembled in 3922]"
"3915","2.103750","23.13.164.38","100.86.243.187","TCP","1514","443  >  54993 [ACK] Seq=96287 Ack=2108 Win=9783 Len=1448 TSval=1115601802 TSecr=931568119 [TCP PDU reassembled in 3922]"
"3916","2.103750","23.13.164.38","100.86.243.187","TCP","1514","443  >  54993 [ACK] Seq=97735 Ack=2108 Win=9783 Len=1448 TSval=1115601802 TSecr=931568119 [TCP PDU reassembled in 3922]"
"3917","2.103751","23.13.164.38","100.86.243.187","TCP","1514","443  >  54993 [ACK] Seq=99183 Ack=2108 Win=9783 Len=1448 TSval=1115601802 TSecr=931568119 [TCP PDU reassembled in 3922]"
"3918","2.103751","23.13.164.38","100.86.243.187","TCP","1514","443  >  54993 [ACK] Seq=100631 Ack=2108 Win=9783 Len=1448 TSval=1115601802 TSecr=931568119 [TCP PDU reassembled in 3922]"
"3919","2.103752","23.13.164.38","100.86.243.187","TCP","1514","443  >  54993 [PSH, ACK] Seq=102079 Ack=2108 Win=9783 Len=1448 TSval=1115601802 TSecr=931568119 [TCP PDU reassembled in 3922]"
"3920","2.103752","23.13.164.38","100.86.243.187","TCP","1514","443  >  54993 [ACK] Seq=103527 Ack=2108 Win=9783 Len=1448 TSval=1115601803 TSecr=931568119 [TCP PDU reassembled in 3922]"
"3921","2.103753","23.13.164.38","100.86.243.187","TCP","1514","443  >  54993 [ACK] Seq=104975 Ack=2108 Win=9783 Len=1448 TSval=1115601803 TSecr=931568119 [TCP PDU reassembled in 3922]"
"3922","2.103753","23.13.164.38","100.86.243.187","TLSv1.2","1514","Application Data, Application Data"
"3923","2.103754","23.13.164.38","100.86.243.187","TCP","1514","443  >  54993 [ACK] Seq=107871 Ack=2108 Win=9783 Len=1448 TSval=1115601803 TSecr=931568119 [TCP PDU reassembled in 3940]"
"3924","2.103754","23.13.164.38","100.86.243.187","TCP","1514","443  >  54993 [ACK] Seq=109319 Ack=2108 Win=9783 Len=1448 TSval=1115601803 TSecr=931568119 [TCP PDU reassembled in 3940]"
"3925","2.103754","23.13.164.38","100.86.243.187","TCP","1514","443  >  54993 [ACK] Seq=110767 Ack=2108 Win=9783 Len=1448 TSval=1115601803 TSecr=931568119 [TCP PDU reassembled in 3940]"
"3926","2.103755","23.13.164.38","100.86.243.187","TCP","1514","443  >  54993 [ACK] Seq=112215 Ack=2108 Win=9783 Len=1448 TSval=1115601803 TSecr=931568119 [TCP PDU reassembled in 3940]"
"3927","2.103755","23.13.164.38","100.86.243.187","TCP","1514","443  >  54993 [ACK] Seq=113663 Ack=2108 Win=9783 Len=1448 TSval=1115601803 TSecr=931568119 [TCP PDU reassembled in 3940]"
"3928","2.103756","23.13.164.38","100.86.243.187","TCP","1514","443  >  54993 [ACK] Seq=115111 Ack=2108 Win=9783 Len=1448 TSval=1115601803 TSecr=931568119 [TCP PDU reassembled in 3940]"
"3929","2.103756","23.13.164.38","100.86.243.187","TCP","1514","443  >  54993 [PSH, ACK] Seq=116559 Ack=2108 Win=9783 Len=1448 TSval=1115601803 TSecr=931568119 [TCP PDU reassembled in 3940]"
"3930","2.103826","100.86.243.187","23.13.164.38","TCP","66","54993  >  443 [ACK] Seq=2108 Ack=110767 Win=37207 Len=0 TSval=931568157 TSecr=1115601803"
"3931","2.103866","100.86.243.187","23.13.164.38","TCP","66","54993  >  443 [ACK] Seq=2108 Ack=118007 Win=37094 Len=0 TSval=931568157 TSecr=1115601803"
"3932","2.103901","23.13.164.38","100.86.243.187","TCP","1514","443  >  54993 [ACK] Seq=118007 Ack=2108 Win=9783 Len=1448 TSval=1115601804 TSecr=931568119 [TCP PDU reassembled in 3940]"
"3933","2.103901","23.13.164.38","100.86.243.187","TCP","1514","443  >  54993 [ACK] Seq=119455 Ack=2108 Win=9783 Len=1448 TSval=1115601804 TSecr=931568119 [TCP PDU reassembled in 3940]"
"3934","2.103943","100.86.243.187","23.13.164.38","TCP","66","54993  >  443 [ACK] Seq=2108 Ack=120903 Win=37245 Len=0 TSval=931568157 TSecr=1115601804"
"3935","2.104004","100.86.243.187","23.13.164.38","TCP","66","[TCP Window Update] 54993  >  443 [ACK] Seq=2108 Ack=120903 Win=37456 Len=0 TSval=931568157 TSecr=1115601804"
"3936","2.104130","23.13.164.38","100.86.243.187","TCP","1514","443  >  54993 [ACK] Seq=120903 Ack=2108 Win=9783 Len=1448 TSval=1115601804 TSecr=931568119 [TCP PDU reassembled in 3940]"
"3937","2.104130","23.13.164.38","100.86.243.187","TCP","1514","443  >  54993 [ACK] Seq=122351 Ack=2108 Win=9783 Len=1448 TSval=1115601804 TSecr=931568119 [TCP PDU reassembled in 3940]"
"3938","2.104169","100.86.243.187","23.13.164.38","TCP","66","54993  >  443 [ACK] Seq=2108 Ack=123799 Win=37410 Len=0 TSval=931568157 TSecr=1115601804"
"3939","2.104217","100.86.243.187","23.13.164.38","TCP","66","[TCP Window Update] 54993  >  443 [ACK] Seq=2108 Ack=123799 Win=37456 Len=0 TSval=931568157 TSecr=1115601804"
"3940","2.105419","23.13.164.38","100.86.243.187","TLSv1.2","1514","Application Data, Application Data"
"3941","2.105419","23.13.164.38","100.86.243.187","TCP","1514","443  >  54993 [ACK] Seq=125247 Ack=2108 Win=9783 Len=1448 TSval=1115601804 TSecr=931568119 [TCP PDU reassembled in 3953]"
"3942","2.105420","23.13.164.38","100.86.243.187","TCP","1514","443  >  54993 [ACK] Seq=126695 Ack=2108 Win=9783 Len=1448 TSval=1115601804 TSecr=931568119 [TCP PDU reassembled in 3953]"
"3943","2.105421","23.13.164.38","100.86.243.187","TCP","1514","443  >  54993 [ACK] Seq=128143 Ack=2108 Win=9783 Len=1448 TSval=1115601804 TSecr=931568119 [TCP PDU reassembled in 3953]"
"3944","2.105421","23.13.164.38","100.86.243.187","TCP","1514","443  >  54993 [ACK] Seq=129591 Ack=2108 Win=9783 Len=1448 TSval=1115601804 TSecr=931568119 [TCP PDU reassembled in 3953]"
"3945","2.105421","23.13.164.38","100.86.243.187","TCP","1514","443  >  54993 [PSH, ACK] Seq=131039 Ack=2108 Win=9783 Len=1448 TSval=1115601804 TSecr=931568119 [TCP PDU reassembled in 3953]"
"3946","2.105480","100.86.243.187","23.13.164.38","TCP","66","54993  >  443 [ACK] Seq=2108 Ack=132487 Win=37320 Len=0 TSval=931568158 TSecr=1115601804"
"3947","2.105633","100.86.243.187","23.13.164.38","TCP","66","[TCP Window Update] 54993  >  443 [ACK] Seq=2108 Ack=132487 Win=37456 Len=0 TSval=931568158 TSecr=1115601804"
"3948","2.106879","23.13.164.38","100.86.243.187","TCP","1514","443  >  54993 [ACK] Seq=132487 Ack=2108 Win=9783 Len=1448 TSval=1115601805 TSecr=931568119 [TCP PDU reassembled in 3953]"
"3949","2.106880","23.13.164.38","100.86.243.187","TCP","1514","443  >  54993 [ACK] Seq=133935 Ack=2108 Win=9783 Len=1448 TSval=1115601805 TSecr=931568119 [TCP PDU reassembled in 3953]"
"3950","2.106880","23.13.164.38","100.86.243.187","TCP","1514","443  >  54993 [ACK] Seq=135383 Ack=2108 Win=9783 Len=1448 TSval=1115601805 TSecr=931568119 [TCP PDU reassembled in 3953]"
"3951","2.106881","23.13.164.38","100.86.243.187","TCP","1514","443  >  54993 [ACK] Seq=136831 Ack=2108 Win=9783 Len=1448 TSval=1115601805 TSecr=931568119 [TCP PDU reassembled in 3953]"
"3952","2.106881","23.13.164.38","100.86.243.187","TCP","1514","443  >  54993 [ACK] Seq=138279 Ack=2108 Win=9783 Len=1448 TSval=1115601805 TSecr=931568119 [TCP PDU reassembled in 3953]"
"3953","2.106881","23.13.164.38","100.86.243.187","TLSv1.2","1514","Application Data, Application Data"
"3954","2.106882","23.13.164.38","100.86.243.187","TCP","1514","443  >  54993 [ACK] Seq=141175 Ack=2108 Win=9783 Len=1448 TSval=1115601805 TSecr=931568119 [TCP PDU reassembled in 3964]"
"3955","2.106882","23.13.164.38","100.86.243.187","TCP","1514","443  >  54993 [ACK] Seq=142623 Ack=2108 Win=9783 Len=1448 TSval=1115601805 TSecr=931568119 [TCP PDU reassembled in 3964]"
"3956","2.106883","23.13.164.38","100.86.243.187","TCP","1514","443  >  54993 [ACK] Seq=144071 Ack=2108 Win=9783 Len=1448 TSval=1115601805 TSecr=931568119 [TCP PDU reassembled in 3964]"
"3957","2.106883","23.13.164.38","100.86.243.187","TCP","1514","443  >  54993 [PSH, ACK] Seq=145519 Ack=2108 Win=9783 Len=1448 TSval=1115601805 TSecr=931568119 [TCP PDU reassembled in 3964]"
"3958","2.106884","23.13.164.38","100.86.243.187","TCP","1514","443  >  54993 [ACK] Seq=146967 Ack=2108 Win=9783 Len=1448 TSval=1115601806 TSecr=931568119 [TCP PDU reassembled in 3964]"
"3959","2.106884","23.13.164.38","100.86.243.187","TCP","1514","443  >  54993 [ACK] Seq=148415 Ack=2108 Win=9783 Len=1448 TSval=1115601806 TSecr=931568119 [TCP PDU reassembled in 3964]"
"3960","2.106885","23.13.164.38","100.86.243.187","TCP","1514","443  >  54993 [ACK] Seq=149863 Ack=2108 Win=9783 Len=1448 TSval=1115601806 TSecr=931568119 [TCP PDU reassembled in 3964]"
"3961","2.106885","23.13.164.38","100.86.243.187","TCP","1514","443  >  54993 [ACK] Seq=151311 Ack=2108 Win=9783 Len=1448 TSval=1115601806 TSecr=931568119 [TCP PDU reassembled in 3964]"
"3962","2.106886","23.13.164.38","100.86.243.187","TCP","1514","443  >  54993 [ACK] Seq=152759 Ack=2108 Win=9783 Len=1448 TSval=1115601806 TSecr=931568119 [TCP PDU reassembled in 3964]"
"3963","2.106886","23.13.164.38","100.86.243.187","TCP","1514","443  >  54993 [ACK] Seq=154207 Ack=2108 Win=9783 Len=1448 TSval=1115601806 TSecr=931568119 [TCP PDU reassembled in 3964]"
"3964","2.106887","23.13.164.38","100.86.243.187","TLSv1.2","1514","Application Data, Application Data"
"3965","2.106887","23.13.164.38","100.86.243.187","TCP","1514","443  >  54993 [ACK] Seq=157103 Ack=2108 Win=9783 Len=1448 TSval=1115601806 TSecr=931568119 [TCP PDU reassembled in 3981]"
"3966","2.106952","100.86.243.187","23.13.164.38","TCP","66","54993  >  443 [ACK] Seq=2108 Ack=148415 Win=37207 Len=0 TSval=931568160 TSecr=1115601806"
"3967","2.106976","100.86.243.187","23.13.164.38","TCP","66","54993  >  443 [ACK] Seq=2108 Ack=158551 Win=37048 Len=0 TSval=931568160 TSecr=1115601806"
"3968","2.107162","100.86.243.187","23.13.164.38","TCP","66","[TCP Window Update] 54993  >  443 [ACK] Seq=2108 Ack=158551 Win=37456 Len=0 TSval=931568160 TSecr=1115601806"
"3969","2.107360","23.13.164.38","100.86.243.187","TCP","1514","443  >  54993 [ACK] Seq=158551 Ack=2108 Win=9783 Len=1448 TSval=1115601806 TSecr=931568119 [TCP PDU reassembled in 3981]"
"3970","2.107361","23.13.164.38","100.86.243.187","TCP","1514","443  >  54993 [PSH, ACK] Seq=159999 Ack=2108 Win=9783 Len=1448 TSval=1115601806 TSecr=931568119 [TCP PDU reassembled in 3981]"
"3971","2.107400","100.86.243.187","23.13.164.38","TCP","66","54993  >  443 [ACK] Seq=2108 Ack=161447 Win=37410 Len=0 TSval=931568160 TSecr=1115601806"
"3972","2.107441","100.86.243.187","23.13.164.38","TCP","66","[TCP Window Update] 54993  >  443 [ACK] Seq=2108 Ack=161447 Win=37456 Len=0 TSval=931568160 TSecr=1115601806"
"3973","2.108919","23.13.164.38","100.86.243.187","TCP","1514","443  >  54993 [ACK] Seq=161447 Ack=2108 Win=9783 Len=1448 TSval=1115601807 TSecr=931568119 [TCP PDU reassembled in 3981]"
"3974","2.108920","23.13.164.38","100.86.243.187","TCP","1514","443  >  54993 [ACK] Seq=162895 Ack=2108 Win=9783 Len=1448 TSval=1115601807 TSecr=931568119 [TCP PDU reassembled in 3981]"
"3975","2.108921","23.13.164.38","100.86.243.187","TCP","1514","443  >  54993 [ACK] Seq=164343 Ack=2108 Win=9783 Len=1448 TSval=1115601807 TSecr=931568119 [TCP PDU reassembled in 3981]"
"3976","2.108921","23.13.164.38","100.86.243.187","TCP","1514","443  >  54993 [ACK] Seq=165791 Ack=2108 Win=9783 Len=1448 TSval=1115601807 TSecr=931568119 [TCP PDU reassembled in 3981]"
"3977","2.108922","23.13.164.38","100.86.243.187","TCP","1514","443  >  54993 [ACK] Seq=167239 Ack=2108 Win=9783 Len=1448 TSval=1115601807 TSecr=931568119 [TCP PDU reassembled in 3981]"
"3978","2.108922","23.13.164.38","100.86.243.187","TCP","1514","443  >  54993 [ACK] Seq=168687 Ack=2108 Win=9783 Len=1448 TSval=1115601807 TSecr=931568119 [TCP PDU reassembled in 3981]"
"3979","2.108923","23.13.164.38","100.86.243.187","TCP","1514","443  >  54993 [ACK] Seq=170135 Ack=2108 Win=9783 Len=1448 TSval=1115601807 TSecr=931568119 [TCP PDU reassembled in 3981]"
"3980","2.108924","23.13.164.38","100.86.243.187","TCP","1514","443  >  54993 [ACK] Seq=171583 Ack=2108 Win=9783 Len=1448 TSval=1115601807 TSecr=931568119 [TCP PDU reassembled in 3981]"
"3981","2.108924","23.13.164.38","100.86.243.187","TLSv1.2","1514","Application Data, Application Data"
"3982","2.108925","23.13.164.38","100.86.243.187","TCP","1514","443  >  54993 [PSH, ACK] Seq=174479 Ack=2108 Win=9783 Len=1448 TSval=1115601807 TSecr=931568119 [TCP PDU reassembled in 3992]"
"3983","2.108926","23.13.164.38","100.86.243.187","TCP","1514","443  >  54993 [ACK] Seq=175927 Ack=2108 Win=9783 Len=1448 TSval=1115601807 TSecr=931568119 [TCP PDU reassembled in 3992]"
"3984","2.108926","23.13.164.38","100.86.243.187","TCP","1514","443  >  54993 [ACK] Seq=177375 Ack=2108 Win=9783 Len=1448 TSval=1115601807 TSecr=931568119 [TCP PDU reassembled in 3992]"
"3985","2.108927","23.13.164.38","100.86.243.187","TCP","1514","443  >  54993 [ACK] Seq=178823 Ack=2108 Win=9783 Len=1448 TSval=1115601807 TSecr=931568119 [TCP PDU reassembled in 3992]"
"3986","2.108928","23.13.164.38","100.86.243.187","TCP","1514","443  >  54993 [ACK] Seq=180271 Ack=2108 Win=9783 Len=1448 TSval=1115601807 TSecr=931568119 [TCP PDU reassembled in 3992]"
"3987","2.108928","23.13.164.38","100.86.243.187","TCP","1514","443  >  54993 [PSH, ACK] Seq=181719 Ack=2108 Win=9783 Len=1448 TSval=1115601807 TSecr=931568119 [TCP PDU reassembled in 3992]"
"3988","2.108929","23.13.164.38","100.86.243.187","TCP","1514","443  >  54993 [ACK] Seq=183167 Ack=2108 Win=9783 Len=1448 TSval=1115601808 TSecr=931568119 [TCP PDU reassembled in 3992]"
"3989","2.108929","23.13.164.38","100.86.243.187","TCP","1514","443  >  54993 [ACK] Seq=184615 Ack=2108 Win=9783 Len=1448 TSval=1115601808 TSecr=931568119 [TCP PDU reassembled in 3992]"
"3990","2.108930","23.13.164.38","100.86.243.187","TCP","1514","443  >  54993 [ACK] Seq=186063 Ack=2108 Win=9783 Len=1448 TSval=1115601808 TSecr=931568119 [TCP PDU reassembled in 3992]"
"3991","2.108931","23.13.164.38","100.86.243.187","TCP","1514","443  >  54993 [ACK] Seq=187511 Ack=2108 Win=9783 Len=1448 TSval=1115601808 TSecr=931568119 [TCP PDU reassembled in 3992]"
"3992","2.108931","23.13.164.38","100.86.243.187","TLSv1.2","1514","Application Data, Application Data"
"3993","2.109201","100.86.243.187","23.13.164.38","TCP","66","54993  >  443 [ACK] Seq=2108 Ack=190407 Win=37456 Len=0 TSval=931568162 TSecr=1115601807"
"3994","2.110271","23.13.164.38","100.86.243.187","TCP","1514","443  >  54993 [ACK] Seq=190407 Ack=2108 Win=9783 Len=1448 TSval=1115601808 TSecr=931568119 [TCP PDU reassembled in 4005]"
"3995","2.110272","23.13.164.38","100.86.243.187","TCP","1514","443  >  54993 [ACK] Seq=191855 Ack=2108 Win=9783 Len=1448 TSval=1115601808 TSecr=931568119 [TCP PDU reassembled in 4005]"
"3996","2.110273","23.13.164.38","100.86.243.187","TCP","1514","443  >  54993 [ACK] Seq=193303 Ack=2108 Win=9783 Len=1448 TSval=1115601808 TSecr=931568119 [TCP PDU reassembled in 4005]"
"3997","2.110273","23.13.164.38","100.86.243.187","TCP","1514","443  >  54993 [ACK] Seq=194751 Ack=2108 Win=9783 Len=1448 TSval=1115601808 TSecr=931568119 [TCP PDU reassembled in 4005]"
"3998","2.110274","23.13.164.38","100.86.243.187","TCP","1514","443  >  54993 [PSH, ACK] Seq=196199 Ack=2108 Win=9783 Len=1448 TSval=1115601808 TSecr=931568119 [TCP PDU reassembled in 4005]"
"3999","2.110274","23.13.164.38","100.86.243.187","TCP","1514","443  >  54993 [ACK] Seq=197647 Ack=2108 Win=9783 Len=1448 TSval=1115601809 TSecr=931568119 [TCP PDU reassembled in 4005]"
"4000","2.110274","23.13.164.38","100.86.243.187","TCP","1514","443  >  54993 [ACK] Seq=199095 Ack=2108 Win=9783 Len=1448 TSval=1115601809 TSecr=931568119 [TCP PDU reassembled in 4005]"
"4001","2.110275","23.13.164.38","100.86.243.187","TCP","1514","443  >  54993 [ACK] Seq=200543 Ack=2108 Win=9783 Len=1448 TSval=1115601809 TSecr=931568119 [TCP PDU reassembled in 4005]"
"4002","2.110275","23.13.164.38","100.86.243.187","TCP","1514","443  >  54993 [ACK] Seq=201991 Ack=2108 Win=9783 Len=1448 TSval=1115601809 TSecr=931568119 [TCP PDU reassembled in 4005]"
"4003","2.110276","23.13.164.38","100.86.243.187","TCP","1514","443  >  54993 [ACK] Seq=203439 Ack=2108 Win=9783 Len=1448 TSval=1115601809 TSecr=931568119 [TCP PDU reassembled in 4005]"
"4004","2.110367","100.86.243.187","23.13.164.38","TCP","66","54993  >  443 [ACK] Seq=2108 Ack=204887 Win=37456 Len=0 TSval=931568163 TSecr=1115601809"
"4005","2.111627","23.13.164.38","100.86.243.187","TLSv1.2","1514","Application Data, Application Data"
"4006","2.111627","23.13.164.38","100.86.243.187","TCP","1514","443  >  54993 [ACK] Seq=206335 Ack=2108 Win=9783 Len=1448 TSval=1115601809 TSecr=931568119 [TCP PDU reassembled in 4189]"
"4007","2.111628","23.13.164.38","100.86.243.187","TCP","1514","443  >  54993 [ACK] Seq=207783 Ack=2108 Win=9783 Len=1448 TSval=1115601809 TSecr=931568119 [TCP PDU reassembled in 4189]"
"4008","2.111628","23.13.164.38","100.86.243.187","TCP","1514","[TCP Previous segment not captured] 443  >  54993 [PSH, ACK] Seq=210679 Ack=2108 Win=9783 Len=1448 TSval=1115601809 TSecr=931568119"
"4009","2.111629","23.13.164.38","100.86.243.187","TCP","1514","443  >  54993 [ACK] Seq=212127 Ack=2108 Win=9783 Len=1448 TSval=1115601810 TSecr=931568119"
"4010","2.111629","23.13.164.38","100.86.243.187","TCP","1514","443  >  54993 [ACK] Seq=213575 Ack=2108 Win=9783 Len=1448 TSval=1115601810 TSecr=931568119"
"4011","2.111630","23.13.164.38","100.86.243.187","TCP","1514","443  >  54993 [ACK] Seq=215023 Ack=2108 Win=9783 Len=1448 TSval=1115601810 TSecr=931568119"
"4012","2.111630","23.13.164.38","100.86.243.187","TCP","1514","443  >  54993 [ACK] Seq=216471 Ack=2108 Win=9783 Len=1448 TSval=1115601810 TSecr=931568119"
"4013","2.111631","23.13.164.38","100.86.243.187","TCP","1514","443  >  54993 [ACK] Seq=217919 Ack=2108 Win=9783 Len=1448 TSval=1115601810 TSecr=931568119"
"4014","2.111631","23.13.164.38","100.86.243.187","TCP","1514","443  >  54993 [ACK] Seq=219367 Ack=2108 Win=9783 Len=1448 TSval=1115601810 TSecr=931568119"
"4015","2.111631","23.13.164.38","100.86.243.187","TCP","1514","443  >  54993 [ACK] Seq=220815 Ack=2108 Win=9783 Len=1448 TSval=1115601810 TSecr=931568119"
"4016","2.111632","23.13.164.38","100.86.243.187","TCP","1514","443  >  54993 [ACK] Seq=222263 Ack=2108 Win=9783 Len=1448 TSval=1115601810 TSecr=931568119"
"4017","2.111632","23.13.164.38","100.86.243.187","TCP","1514","443  >  54993 [ACK] Seq=223711 Ack=2108 Win=9783 Len=1448 TSval=1115601810 TSecr=931568119"
"4018","2.111633","23.13.164.38","100.86.243.187","TCP","1514","443  >  54993 [PSH, ACK] Seq=225159 Ack=2108 Win=9783 Len=1448 TSval=1115601810 TSecr=931568119, Application Data"
"4019","2.111633","23.13.164.38","100.86.243.187","TLSv1.2","1514","Ignored Unknown Record"
"4020","2.111634","23.13.164.38","100.86.243.187","TLSv1.2","1514","Ignored Unknown Record"
"4021","2.111634","23.13.164.38","100.86.243.187","TLSv1.2","1514","Ignored Unknown Record"
"4022","2.111635","23.13.164.38","100.86.243.187","TLSv1.2","1514","Ignored Unknown Record"
"4023","2.111686","23.13.164.38","100.86.243.187","TLSv1.2","1514","Ignored Unknown Record"
"4024","2.111686","23.13.164.38","100.86.243.187","TLSv1.2","1514","Ignored Unknown Record"
"4025","2.111722","100.86.243.187","23.13.164.38","TCP","78","54993  >  443 [ACK] Seq=2108 Ack=209231 Win=37406 Len=0 TSval=931568165 TSecr=1115601809 SLE=210679 SRE=226607"
"4026","2.111741","100.86.243.187","23.13.164.38","TCP","78","[TCP Dup ACK 4025#1] 54993  >  443 [ACK] Seq=2108 Ack=209231 Win=37406 Len=0 TSval=931568165 TSecr=1115601809 SLE=210679 SRE=232399"
"4027","2.111756","100.86.243.187","23.13.164.38","TCP","78","[TCP Dup ACK 4025#2] 54993  >  443 [ACK] Seq=2108 Ack=209231 Win=37406 Len=0 TSval=931568165 TSecr=1115601809 SLE=210679 SRE=235295"
"4028","2.111788","100.86.243.187","23.13.164.38","TCP","78","[TCP Dup ACK 4025#3] 54993  >  443 [ACK] Seq=2108 Ack=209231 Win=37456 Len=0 TSval=931568165 TSecr=1115601809 SLE=210679 SRE=235295"
"4029","2.111928","23.13.164.38","100.86.243.187","TLSv1.2","1514","Ignored Unknown Record"
"4030","2.111929","23.13.164.38","100.86.243.187","TLSv1.2","1514","Ignored Unknown Record"
"4031","2.111929","23.13.164.38","100.86.243.187","TLSv1.2","1514","Ignored Unknown Record"
"4032","2.111930","23.13.164.38","100.86.243.187","TLSv1.2","1514","Ignored Unknown Record"
"4033","2.111958","100.86.243.187","23.13.164.38","TCP","78","[TCP Dup ACK 4025#4] 54993  >  443 [ACK] Seq=2108 Ack=209231 Win=37456 Len=0 TSval=931568165 TSecr=1115601809 SLE=210679 SRE=241087"
"4034","2.112275","23.13.164.38","100.86.243.187","TCP","1514","443  >  54993 [ACK] Seq=241087 Ack=2108 Win=9783 Len=1448 TSval=1115601811 TSecr=931568119 [TCP PDU reassembled in 4191]"
"4035","2.112276","23.13.164.38","100.86.243.187","TCP","1514","443  >  54993 [ACK] Seq=242535 Ack=2108 Win=9783 Len=1448 TSval=1115601811 TSecr=931568119 [TCP PDU reassembled in 4191]"
"4036","2.112276","23.13.164.38","100.86.243.187","TCP","1514","443  >  54993 [ACK] Seq=243983 Ack=2108 Win=9783 Len=1448 TSval=1115601811 TSecr=931568119 [TCP PDU reassembled in 4191]"
"4037","2.112277","23.13.164.38","100.86.243.187","TCP","1514","443  >  54993 [ACK] Seq=245431 Ack=2108 Win=9783 Len=1448 TSval=1115601811 TSecr=931568119 [TCP PDU reassembled in 4191]"
"4038","2.112319","100.86.243.187","23.13.164.38","TCP","78","[TCP Dup ACK 4025#5] 54993  >  443 [ACK] Seq=2108 Ack=209231 Win=37456 Len=0 TSval=931568165 TSecr=1115601809 SLE=210679 SRE=246879"
"4039","2.112425","23.13.164.38","100.86.243.187","TCP","1514","443  >  54993 [PSH, ACK] Seq=246879 Ack=2108 Win=9783 Len=1448 TSval=1115601811 TSecr=931568119 [TCP PDU reassembled in 4191]"
"4040","2.112426","23.13.164.38","100.86.243.187","TCP","1514","443  >  54993 [ACK] Seq=248327 Ack=2108 Win=9783 Len=1448 TSval=1115601812 TSecr=931568119 [TCP PDU reassembled in 4191]"
"4041","2.112460","100.86.243.187","23.13.164.38","TCP","78","[TCP Dup ACK 4025#6] 54993  >  443 [ACK] Seq=2108 Ack=209231 Win=37456 Len=0 TSval=931568165 TSecr=1115601809 SLE=210679 SRE=249775"
"4042","2.112572","23.13.164.38","100.86.243.187","TCP","1514","[TCP Previous segment not captured] 443  >  54993 [ACK] Seq=251223 Ack=2108 Win=9783 Len=1448 TSval=1115601812 TSecr=931568119 [TCP PDU reassembled in 4191]"
"4043","2.112573","23.13.164.38","100.86.243.187","TCP","1514","443  >  54993 [ACK] Seq=252671 Ack=2108 Win=9783 Len=1448 TSval=1115601812 TSecr=931568119 [TCP PDU reassembled in 4191]"
"4044","2.112612","100.86.243.187","23.13.164.38","TCP","86","[TCP Dup ACK 4025#7] 54993  >  443 [ACK] Seq=2108 Ack=209231 Win=37456 Len=0 TSval=931568165 TSecr=1115601809 SLE=251223 SRE=254119 SLE=210679 SRE=249775"
"4045","2.112834","23.13.164.38","100.86.243.187","TCP","1514","443  >  54993 [ACK] Seq=254119 Ack=2108 Win=9783 Len=1448 TSval=1115601812 TSecr=931568119 [TCP PDU reassembled in 4191]"
"4046","2.112835","23.13.164.38","100.86.243.187","TCP","1514","443  >  54993 [ACK] Seq=255567 Ack=2108 Win=9783 Len=1448 TSval=1115601812 TSecr=931568119 [TCP PDU reassembled in 4191]"
"4047","2.112835","23.13.164.38","100.86.243.187","TCP","1514","443  >  54993 [ACK] Seq=257015 Ack=2108 Win=9783 Len=1448 TSval=1115601812 TSecr=931568119 [TCP PDU reassembled in 4191]"
"4048","2.112836","23.13.164.38","100.86.243.187","TCP","1514","443  >  54993 [ACK] Seq=258463 Ack=2108 Win=9783 Len=1448 TSval=1115601812 TSecr=931568119 [TCP PDU reassembled in 4191]"
