"No.","Time","Source","Destination","Protocol","Length","Info"
"5","0.089379","100.86.243.187","23.13.164.38","TLSv1.2","433","Application Data"
"10","0.223240","23.13.164.38","100.86.243.187","TCP","66","443  >  54993 [ACK] Seq=1 Ack=368 Win=9783 Len=0 TSval=1115625953 TSecr=931592249"
"11","0.223244","23.13.164.38","100.86.243.187","TCP","1514","443  >  54993 [ACK] Seq=1 Ack=368 Win=9783 Len=1448 TSval=1115625971 TSecr=931592249 [TCP PDU reassembled in 12]"
"12","0.223246","23.13.164.38","100.86.243.187","TLSv1.2","330","Application Data"
"13","0.223247","23.13.164.38","100.86.243.187","TCP","1514","443  >  54993 [ACK] Seq=1713 Ack=368 Win=9783 Len=1448 TSval=1115625971 TSecr=931592249 [TCP PDU reassembled in 24]"
"14","0.223248","23.13.164.38","100.86.243.187","TCP","1514","443  >  54993 [ACK] Seq=3161 Ack=368 Win=9783 Len=1448 TSval=1115625971 TSecr=931592249 [TCP PDU reassembled in 24]"
"15","0.223249","23.13.164.38","100.86.243.187","TCP","1514","443  >  54993 [ACK] Seq=4609 Ack=368 Win=9783 Len=1448 TSval=1115625971 TSecr=931592249 [TCP PDU reassembled in 24]"
"16","0.223250","23.13.164.38","100.86.243.187","TCP","1514","443  >  54993 [ACK] Seq=6057 Ack=368 Win=9783 Len=1448 TSval=1115625971 TSecr=931592249 [TCP PDU reassembled in 24]"
"17","0.223252","23.13.164.38","100.86.243.187","TCP","1514","443  >  54993 [ACK] Seq=7505 Ack=368 Win=9783 Len=1448 TSval=1115625971 TSecr=931592249 [TCP PDU reassembled in 24]"
"18","0.223253","23.13.164.38","100.86.243.187","TCP","1514","443  >  54993 [ACK] Seq=8953 Ack=368 Win=9783 Len=1448 TSval=1115625971 TSecr=931592249 [TCP PDU reassembled in 24]"
"19","0.223255","23.13.164.38","100.86.243.187","TCP","1514","443  >  54993 [ACK] Seq=10401 Ack=368 Win=9783 Len=1448 TSval=1115625971 TSecr=931592249 [TCP PDU reassembled in 24]"
"20","0.223256","23.13.164.38","100.86.243.187","TCP","1514","443  >  54993 [ACK] Seq=11849 Ack=368 Win=9783 Len=1448 TSval=1115625971 TSecr=931592249 [TCP PDU reassembled in 24]"
"21","0.223258","23.13.164.38","100.86.243.187","TCP","1514","443  >  54993 [ACK] Seq=13297 Ack=368 Win=9783 Len=1448 TSval=1115625971 TSecr=931592249 [TCP PDU reassembled in 24]"
"22","0.223259","23.13.164.38","100.86.243.187","TCP","1514","443  >  54993 [ACK] Seq=14745 Ack=368 Win=9783 Len=1448 TSval=1115625971 TSecr=931592249 [TCP PDU reassembled in 24]"
"23","0.223260","23.13.164.38","100.86.243.187","TCP","1514","443  >  54993 [PSH, ACK] Seq=16193 Ack=368 Win=9783 Len=1448 TSval=1115625971 TSecr=931592249 [TCP PDU reassembled in 24]"
"24","0.223261","23.13.164.38","100.86.243.187","TLSv1.2","1514","Application Data, Application Data"
"25","0.223263","23.13.164.38","100.86.243.187","TCP","1514","443  >  54993 [ACK] Seq=19089 Ack=368 Win=9783 Len=1448 TSval=1115625972 TSecr=931592249 [TCP PDU reassembled in 35]"
"26","0.223264","23.13.164.38","100.86.243.187","TCP","1514","443  >  54993 [ACK] Seq=20537 Ack=368 Win=9783 Len=1448 TSval=1115625972 TSecr=931592249 [TCP PDU reassembled in 35]"
"27","0.223265","23.13.164.38","100.86.243.187","TCP","1514","443  >  54993 [ACK] Seq=21985 Ack=368 Win=9783 Len=1448 TSval=1115625972 TSecr=931592249 [TCP PDU reassembled in 35]"
"28","0.223267","23.13.164.38","100.86.243.187","TCP","1514","443  >  54993 [ACK] Seq=23433 Ack=368 Win=9783 Len=1448 TSval=1115625972 TSecr=931592249 [TCP PDU reassembled in 35]"
"29","0.223268","23.13.164.38","100.86.243.187","TCP","1514","443  >  54993 [ACK] Seq=24881 Ack=368 Win=9783 Len=1448 TSval=1115625972 TSecr=931592249 [TCP PDU reassembled in 35]"
"30","0.223268","23.13.164.38","100.86.243.187","TCP","1514","443  >  54993 [ACK] Seq=26329 Ack=368 Win=9783 Len=1448 TSval=1115625972 TSecr=931592249 [TCP PDU reassembled in 35]"
"31","0.223270","23.13.164.38","100.86.243.187","TCP","1514","443  >  54993 [ACK] Seq=27777 Ack=368 Win=9783 Len=1448 TSval=1115625972 TSecr=931592249 [TCP PDU reassembled in 35]"
"32","0.223271","23.13.164.38","100.86.243.187","TCP","1514","443  >  54993 [ACK] Seq=29225 Ack=368 Win=9783 Len=1448 TSval=1115625972 TSecr=931592249 [TCP PDU reassembled in 35]"
"33","0.223272","23.13.164.38","100.86.243.187","TCP","1514","443  >  54993 [ACK] Seq=30673 Ack=368 Win=9783 Len=1448 TSval=1115625972 TSecr=931592249 [TCP PDU reassembled in 35]"
"34","0.223273","23.13.164.38","100.86.243.187","TCP","1514","443  >  54993 [PSH, ACK] Seq=32121 Ack=368 Win=9783 Len=1448 TSval=1115625972 TSecr=931592249 [TCP PDU reassembled in 35]"
"35","0.223274","23.13.164.38","100.86.243.187","TLSv1.2","1514","Application Data, Application Data"
"36","0.223276","23.13.164.38","100.86.243.187","TCP","1514","443  >  54993 [ACK] Seq=35017 Ack=368 Win=9783 Len=1448 TSval=1115625973 TSecr=931592249 [TCP PDU reassembled in 41]"
"37","0.223277","23.13.164.38","100.86.243.187","TCP","1514","443  >  54993 [ACK] Seq=36465 Ack=368 Win=9783 Len=1448 TSval=1115625973 TSecr=931592249 [TCP PDU reassembled in 41]"
"38","0.223279","23.13.164.38","100.86.243.187","TCP","1514","443  >  54993 [ACK] Seq=37913 Ack=368 Win=9783 Len=1448 TSval=1115625973 TSecr=931592249 [TCP PDU reassembled in 41]"
"39","0.223405","23.13.164.38","100.86.243.187","TCP","1514","443  >  54993 [ACK] Seq=39361 Ack=368 Win=9783 Len=1448 TSval=1115625973 TSecr=931592249 [TCP PDU reassembled in 41]"
"40","0.223406","23.13.164.38","100.86.243.187","TCP","1514","443  >  54993 [ACK] Seq=40809 Ack=368 Win=9783 Len=1448 TSval=1115625973 TSecr=931592249 [TCP PDU reassembled in 41]"
"41","0.223408","23.13.164.38","100.86.243.187","TLSv1.2","1514","Application Data"
"42","0.223409","23.13.164.38","100.86.243.187","TCP","1514","443  >  54993 [ACK] Seq=43705 Ack=368 Win=9783 Len=1448 TSval=1115625973 TSecr=931592249 [TCP PDU reassembled in 51]"
"43","0.223465","100.86.243.187","23.13.164.38","TCP","66","54993  >  443 [ACK] Seq=368 Ack=16193 Win=37203 Len=0 TSval=931592383 TSecr=1115625971"
"44","0.223525","100.86.243.187","23.13.164.38","TCP","66","54993  >  443 [ACK] Seq=368 Ack=32121 Win=36954 Len=0 TSval=931592383 TSecr=1115625972"
"45","0.223629","100.86.243.187","23.13.164.38","TCP","66","54993  >  443 [ACK] Seq=368 Ack=39361 Win=36841 Len=0 TSval=931592383 TSecr=1115625973"
"46","0.223691","100.86.243.187","23.13.164.38","TCP","66","54993  >  443 [ACK] Seq=368 Ack=45153 Win=36777 Len=0 TSval=931592383 TSecr=1115625973"
"47","0.224569","100.86.243.187","23.13.164.38","TCP","66","[TCP Window Update] 54993  >  443 [ACK] Seq=368 Ack=45153 Win=37456 Len=0 TSval=931592384 TSecr=1115625973"
"48","0.224685","23.13.164.38","100.86.243.187","TCP","1514","443  >  54993 [ACK] Seq=45153 Ack=368 Win=9783 Len=1448 TSval=1115625973 TSecr=931592249 [TCP PDU reassembled in 51]"
"49","0.224687","23.13.164.38","100.86.243.187","TCP","1514","443  >  54993 [ACK] Seq=46601 Ack=368 Win=9783 Len=1448 TSval=1115625973 TSecr=931592249 [TCP PDU reassembled in 51]"
"50","0.224687","23.13.164.38","100.86.243.187","TCP","1514","443  >  54993 [PSH, ACK] Seq=48049 Ack=368 Win=9783 Len=1448 TSval=1115625973 TSecr=931592249 [TCP PDU reassembled in 51]"
"51","0.224688","23.13.164.38","100.86.243.187","TLSv1.2","795","Application Data, Application Data"
"52","0.224808","100.86.243.187","23.13.164.38","TCP","66","54993  >  443 [ACK] Seq=368 Ack=50226 Win=37376 Len=0 TSval=931592384 TSecr=1115625974"
"53","0.224873","23.13.164.38","100.86.243.187","TCP","795","[TCP Spurious Retransmission] 443  >  54993 [PSH, ACK] Seq=49497 Ack=368 Win=9783 Len=729 TSval=1115626003 TSecr=931592249"
"54","0.224945","100.86.243.187","23.13.164.38","TCP","78","[TCP Dup ACK 52#1] 54993  >  443 [ACK] Seq=368 Ack=50226 Win=37455 Len=0 TSval=931592384 TSecr=1115626003 SLE=49497 SRE=50226"
"73","0.307987","100.86.243.187","23.13.164.38","TLSv1.2","681","Application Data"
"74","0.308275","100.86.243.187","23.13.164.38","TLSv1.2","339","Application Data"
"75","0.308611","100.86.243.187","23.13.164.38","TLSv1.2","339","Application Data"
"85","0.308938","100.86.243.187","23.13.164.38","TLSv1.2","327","Application Data"
"87","0.309296","100.86.243.187","23.13.164.38","TLSv1.2","347","Application Data"
"89","0.310770","100.86.243.187","23.13.164.38","TLSv1.2","314","Application Data"
"90","0.311121","100.86.243.187","23.13.164.38","TLSv1.2","306","Application Data"
"91","0.311358","100.86.243.187","23.13.164.38","TLSv1.2","326","Application Data"
"92","0.311655","100.86.243.187","23.13.164.38","TLSv1.2","324","Application Data"
"93","0.311975","100.86.243.187","23.13.164.38","TLSv1.2","315","Application Data"
"94","0.312274","100.86.243.187","23.13.164.38","TLSv1.2","326","Application Data"
"95","0.312543","100.86.243.187","23.13.164.38","TLSv1.2","323","Application Data"
"96","0.312804","100.86.243.187","23.13.164.38","TLSv1.2","325","Application Data"
"97","0.321428","23.13.164.38","100.86.243.187","TCP","66","443  >  54993 [ACK] Seq=50226 Ack=1529 Win=9778 Len=0 TSval=1115626127 TSecr=931592468"
"98","0.321429","23.13.164.38","100.86.243.187","TCP","66","443  >  54993 [ACK] Seq=50226 Ack=2071 Win=9774 Len=0 TSval=1115626128 TSecr=931592469"
"99","0.321430","23.13.164.38","100.86.243.187","TCP","66","443  >  54993 [ACK] Seq=50226 Ack=2319 Win=9773 Len=0 TSval=1115626129 TSecr=931592470"
"100","0.324353","23.13.164.38","100.86.243.187","TCP","66","443  >  54993 [ACK] Seq=50226 Ack=3843 Win=9774 Len=0 TSval=1115626131 TSecr=931592471"
"101","0.324354","23.13.164.38","100.86.243.187","TCP","66","443  >  54993 [ACK] Seq=50226 Ack=4102 Win=9772 Len=0 TSval=1115626132 TSecr=931592471"
"112","0.360101","23.13.164.38","100.86.243.187","TLSv1.2","465","Application Data"
"113","0.360102","23.13.164.38","100.86.243.187","TCP","1514","443  >  54993 [ACK] Seq=50625 Ack=4102 Win=9783 Len=1448 TSval=1115626167 TSecr=931592471 [TCP PDU reassembled in 126]"
"114","0.360103","23.13.164.38","100.86.243.187","TCP","1514","443  >  54993 [ACK] Seq=52073 Ack=4102 Win=9783 Len=1448 TSval=1115626167 TSecr=931592471 [TCP PDU reassembled in 126]"
"115","0.360103","23.13.164.38","100.86.243.187","TCP","1514","443  >  54993 [ACK] Seq=53521 Ack=4102 Win=9783 Len=1448 TSval=1115626167 TSecr=931592471 [TCP PDU reassembled in 126]"
"116","0.360104","23.13.164.38","100.86.243.187","TCP","1514","443  >  54993 [ACK] Seq=54969 Ack=4102 Win=9783 Len=1448 TSval=1115626167 TSecr=931592471 [TCP PDU reassembled in 126]"
"117","0.360105","23.13.164.38","100.86.243.187","TCP","1514","443  >  54993 [ACK] Seq=56417 Ack=4102 Win=9783 Len=1448 TSval=1115626167 TSecr=931592471 [TCP PDU reassembled in 126]"
"118","0.360105","23.13.164.38","100.86.243.187","TCP","1514","443  >  54993 [ACK] Seq=57865 Ack=4102 Win=9783 Len=1448 TSval=1115626167 TSecr=931592471 [TCP PDU reassembled in 126]"
"119","0.360181","100.86.243.187","23.13.164.38","TCP","66","54993  >  443 [ACK] Seq=4102 Ack=59313 Win=37314 Len=0 TSval=931592520 TSecr=1115626167"
"120","0.360431","100.86.243.187","23.13.164.38","TCP","66","[TCP Window Update] 54993  >  443 [ACK] Seq=4102 Ack=59313 Win=37456 Len=0 TSval=931592520 TSecr=1115626167"
"121","0.361559","23.13.164.38","100.86.243.187","TCP","1514","443  >  54993 [ACK] Seq=59313 Ack=4102 Win=9783 Len=1448 TSval=1115626167 TSecr=931592471 [TCP PDU reassembled in 126]"
"122","0.361560","23.13.164.38","100.86.243.187","TCP","1514","443  >  54993 [ACK] Seq=60761 Ack=4102 Win=9783 Len=1448 TSval=1115626167 TSecr=931592471 [TCP PDU reassembled in 126]"
"123","0.361561","23.13.164.38","100.86.243.187","TCP","1514","443  >  54993 [ACK] Seq=62209 Ack=4102 Win=9783 Len=1448 TSval=1115626167 TSecr=931592471 [TCP PDU reassembled in 126]"
"124","0.361562","23.13.164.38","100.86.243.187","TCP","1514","443  >  54993 [ACK] Seq=63657 Ack=4102 Win=9783 Len=1448 TSval=1115626167 TSecr=931592471 [TCP PDU reassembled in 126]"
"125","0.361562","23.13.164.38","100.86.243.187","TCP","1514","443  >  54993 [PSH, ACK] Seq=65105 Ack=4102 Win=9783 Len=1448 TSval=1115626167 TSecr=931592471 [TCP PDU reassembled in 126]"
"126","0.361563","23.13.164.38","100.86.243.187","TLSv1.2","575","Application Data, Application Data"
"127","0.361563","23.13.164.38","100.86.243.187","TCP","1514","443  >  54993 [ACK] Seq=67062 Ack=4102 Win=9783 Len=1448 TSval=1115626168 TSecr=931592471 [TCP PDU reassembled in 261]"
"128","0.361564","23.13.164.38","100.86.243.187","TCP","1514","[TCP Previous segment not captured] 443  >  54993 [ACK] Seq=69958 Ack=4102 Win=9783 Len=1448 TSval=1115626168 TSecr=931592471 [TCP PDU reassembled in 261]"
"129","0.361565","23.13.164.38","100.86.243.187","TCP","1514","[TCP Previous segment not captured] 443  >  54993 [ACK] Seq=72854 Ack=4102 Win=9783 Len=1448 TSval=1115626168 TSecr=931592471 [TCP PDU reassembled in 261]"
"130","0.361565","23.13.164.38","100.86.243.187","TCP","1514","443  >  54993 [ACK] Seq=74302 Ack=4102 Win=9783 Len=1448 TSval=1115626168 TSecr=931592471 [TCP PDU reassembled in 261]"
"131","0.361566","23.13.164.38","100.86.243.187","TCP","1514","443  >  54993 [ACK] Seq=75750 Ack=4102 Win=9783 Len=1448 TSval=1115626168 TSecr=931592471 [TCP PDU reassembled in 261]"
"132","0.361566","23.13.164.38","100.86.243.187","TCP","1514","443  >  54993 [ACK] Seq=77198 Ack=4102 Win=9783 Len=1448 TSval=1115626168 TSecr=931592471 [TCP PDU reassembled in 261]"
"133","0.361567","23.13.164.38","100.86.243.187","TCP","1514","443  >  54993 [ACK] Seq=78646 Ack=4102 Win=9783 Len=1448 TSval=1115626168 TSecr=931592471 [TCP PDU reassembled in 261]"
"134","0.361567","23.13.164.38","100.86.243.187","TCP","1514","443  >  54993 [ACK] Seq=80094 Ack=4102 Win=9783 Len=1448 TSval=1115626168 TSecr=931592471 [TCP PDU reassembled in 261]"
"135","0.361568","23.13.164.38","100.86.243.187","TCP","1514","443  >  54993 [PSH, ACK] Seq=81542 Ack=4102 Win=9783 Len=1448 TSval=1115626168 TSecr=931592471 [TCP PDU reassembled in 261]"
"136","0.361569","23.13.164.38","100.86.243.187","TCP","1514","443  >  54993 [ACK] Seq=82990 Ack=4102 Win=9783 Len=1448 TSval=1115626169 TSecr=931592471 [TCP PDU reassembled in 261], Application Data"
"137","0.361569","23.13.164.38","100.86.243.187","TCP","1514","443  >  54993 [ACK] Seq=84438 Ack=4102 Win=9783 Len=1448 TSval=1115626169 TSecr=931592471 [TCP PDU reassembled in 153]"
"138","0.361570","23.13.164.38","100.86.243.187","TCP","1514","443  >  54993 [ACK] Seq=85886 Ack=4102 Win=9783 Len=1448 TSval=1115626169 TSecr=931592471 [TCP PDU reassembled in 153]"
"139","0.361570","23.13.164.38","100.86.243.187","TCP","1514","443  >  54993 [ACK] Seq=87334 Ack=4102 Win=9783 Len=1448 TSval=1115626169 TSecr=931592471 [TCP PDU reassembled in 153]"
"140","0.361571","23.13.164.38","100.86.243.187","TCP","1514","443  >  54993 [ACK] Seq=88782 Ack=4102 Win=9783 Len=1448 TSval=1115626169 TSecr=931592471 [TCP PDU reassembled in 153]"
"141","0.361637","100.86.243.187","23.13.164.38","TCP","66","54993  >  443 [ACK] Seq=4102 Ack=68510 Win=37312 Len=0 TSval=931592521 TSecr=1115626168"
"142","0.361660","100.86.243.187","23.13.164.38","TCP","78","[TCP Dup ACK 141#1] 54993  >  443 [ACK] Seq=4102 Ack=68510 Win=37312 Len=0 TSval=931592521 TSecr=1115626168 SLE=69958 SRE=71406"
"143","0.361671","100.86.243.187","23.13.164.38","TCP","86","[TCP Dup ACK 141#2] 54993  >  443 [ACK] Seq=4102 Ack=68510 Win=37312 Len=0 TSval=931592521 TSecr=1115626168 SLE=72854 SRE=88782 SLE=69958 SRE=71406"
"144","0.361681","100.86.243.187","23.13.164.38","TCP","86","[TCP Dup ACK 141#3] 54993  >  443 [ACK] Seq=4102 Ack=68510 Win=37312 Len=0 TSval=931592521 TSecr=1115626168 SLE=72854 SRE=90230 SLE=69958 SRE=71406"
"145","0.361782","100.86.243.187","23.13.164.38","TCP","86","[TCP Dup ACK 141#4] 54993  >  443 [ACK] Seq=4102 Ack=68510 Win=37456 Len=0 TSval=931592521 TSecr=1115626168 SLE=72854 SRE=90230 SLE=69958 SRE=71406"
"146","0.363340","23.13.164.38","100.86.243.187","TCP","1514","443  >  54993 [ACK] Seq=90230 Ack=4102 Win=9783 Len=1448 TSval=1115626169 TSecr=931592471 [TCP PDU reassembled in 153]"
"147","0.363341","23.13.164.38","100.86.243.187","TCP","1514","443  >  54993 [ACK] Seq=91678 Ack=4102 Win=9783 Len=1448 TSval=1115626169 TSecr=931592471 [TCP PDU reassembled in 153]"
"148","0.363341","23.13.164.38","100.86.243.187","TCP","1514","443  >  54993 [ACK] Seq=93126 Ack=4102 Win=9783 Len=1448 TSval=1115626169 TSecr=931592471 [TCP PDU reassembled in 153]"
"149","0.363341","23.13.164.38","100.86.243.187","TCP","1514","443  >  54993 [ACK] Seq=94574 Ack=4102 Win=9783 Len=1448 TSval=1115626169 TSecr=931592471 [TCP PDU reassembled in 153]"
"150","0.363424","100.86.243.187","23.13.164.38","TCP","86","[TCP Dup ACK 141#5] 54993  >  443 [ACK] Seq=4102 Ack=68510 Win=37456 Len=0 TSval=931592523 TSecr=1115626168 SLE=72854 SRE=96022 SLE=69958 SRE=71406"
"151","0.365693","23.13.164.38","100.86.243.187","TCP","1514","443  >  54993 [ACK] Seq=96022 Ack=4102 Win=9783 Len=1448 TSval=1115626169 TSecr=931592471 [TCP PDU reassembled in 153]"
"152","0.365693","23.13.164.38","100.86.243.187","TCP","1514","443  >  54993 [PSH, ACK] Seq=97470 Ack=4102 Win=9783 Len=1448 TSval=1115626169 TSecr=931592471 [TCP PDU reassembled in 153]"
"153","0.365694","23.13.164.38","100.86.243.187","TLSv1.2","1514","Application Data, Application Data, Application Data"
"154","0.365695","23.13.164.38","100.86.243.187","TCP","1514","443  >  54993 [ACK] Seq=100366 Ack=4102 Win=9783 Len=1448 TSval=1115626170 TSecr=931592471 [TCP PDU reassembled in 164]"
"155","0.365695","23.13.164.38","100.86.243.187","TCP","1514","443  >  54993 [ACK] Seq=101814 Ack=4102 Win=9783 Len=1448 TSval=1115626170 TSecr=931592471 [TCP PDU reassembled in 164]"
"156","0.365696","23.13.164.38","100.86.243.187","TCP","1514","443  >  54993 [ACK] Seq=103262 Ack=4102 Win=9783 Len=1448 TSval=1115626170 TSecr=931592471 [TCP PDU reassembled in 164]"
"157","0.365696","23.13.164.38","100.86.243.187","TCP","1514","443  >  54993 [ACK] Seq=104710 Ack=4102 Win=9783 Len=1448 TSval=1115626170 TSecr=931592471 [TCP PDU reassembled in 164]"
"158","0.365697","23.13.164.38","100.86.243.187","TCP","1514","443  >  54993 [ACK] Seq=106158 Ack=4102 Win=9783 Len=1448 TSval=1115626170 TSecr=931592471 [TCP PDU reassembled in 164]"
"159","0.365698","23.13.164.38","100.86.243.187","TCP","1514","443  >  54993 [ACK] Seq=107606 Ack=4102 Win=9783 Len=1448 TSval=1115626170 TSecr=931592471 [TCP PDU reassembled in 164]"
"160","0.365698","23.13.164.38","100.86.243.187","TCP","1514","443  >  54993 [ACK] Seq=109054 Ack=4102 Win=9783 Len=1448 TSval=1115626170 TSecr=931592471 [TCP PDU reassembled in 164]"
"161","0.365699","23.13.164.38","100.86.243.187","TCP","1514","443  >  54993 [ACK] Seq=110502 Ack=4102 Win=9783 Len=1448 TSval=1115626170 TSecr=931592471 [TCP PDU reassembled in 164]"
"162","0.365699","23.13.164.38","100.86.243.187","TCP","1514","443  >  54993 [ACK] Seq=111950 Ack=4102 Win=9783 Len=1448 TSval=1115626170 TSecr=931592471 [TCP PDU reassembled in 164]"
"163","0.365700","23.13.164.38","100.86.243.187","TCP","1514","443  >  54993 [PSH, ACK] Seq=113398 Ack=4102 Win=9783 Len=1448 TSval=1115626170 TSecr=931592471 [TCP PDU reassembled in 164]"
"164","0.365701","23.13.164.38","100.86.243.187","TLSv1.2","1514","Application Data, Application Data"
"165","0.365701","23.13.164.38","100.86.243.187","TLSv1.2","1514","Application Data"
"166","0.365701","23.13.164.38","100.86.243.187","TCP","1514","443  >  54993 [ACK] Seq=117742 Ack=4102 Win=9783 Len=1448 TSval=1115626171 TSecr=931592471 [TCP PDU reassembled in 172]"
"167","0.365702","23.13.164.38","100.86.243.187","TCP","1514","443  >  54993 [ACK] Seq=119190 Ack=4102 Win=9783 Len=1448 TSval=1115626171 TSecr=931592471 [TCP PDU reassembled in 172]"
"168","0.365703","23.13.164.38","100.86.243.187","TCP","1514","443  >  54993 [ACK] Seq=120638 Ack=4102 Win=9783 Len=1448 TSval=1115626171 TSecr=931592471 [TCP PDU reassembled in 172]"
"169","0.365703","23.13.164.38","100.86.243.187","TCP","1514","443  >  54993 [ACK] Seq=122086 Ack=4102 Win=9783 Len=1448 TSval=1115626171 TSecr=931592471 [TCP PDU reassembled in 172]"
"170","0.365704","23.13.164.38","100.86.243.187","TCP","1514","443  >  54993 [ACK] Seq=123534 Ack=4102 Win=9783 Len=1448 TSval=1115626171 TSecr=931592471 [TCP PDU reassembled in 172]"
"171","0.365704","23.13.164.38","100.86.243.187","TCP","1514","443  >  54993 [ACK] Seq=124982 Ack=4102 Win=9783 Len=1448 TSval=1115626171 TSecr=931592471 [TCP PDU reassembled in 172]"
"172","0.365705","23.13.164.38","100.86.243.187","TLSv1.2","1514","Application Data, Application Data"
"173","0.365781","100.86.243.187","23.13.164.38","TCP","86","[TCP Dup ACK 141#6] 54993  >  443 [ACK] Seq=4102 Ack=68510 Win=37456 Len=0 TSval=931592525 TSecr=1115626168 SLE=72854 SRE=111950 SLE=69958 SRE=71406"
"174","0.365813","100.86.243.187","23.13.164.38","TCP","86","[TCP Dup ACK 141#7] 54993  >  443 [ACK] Seq=4102 Ack=68510 Win=37456 Len=0 TSval=931592525 TSecr=1115626168 SLE=72854 SRE=127878 SLE=69958 SRE=71406"
"175","0.366667","23.13.164.38","100.86.243.187","TLSv1.2","1054","Application Data"
"176","0.366668","23.13.164.38","100.86.243.187","TLSv1.2","1514","Application Data"
"177","0.366669","23.13.164.38","100.86.243.187","TCP","1514","443  >  54993 [ACK] Seq=130314 Ack=4102 Win=9783 Len=1448 TSval=1115626172 TSecr=931592471 [TCP PDU reassembled in 180]"
"178","0.366670","23.13.164.38","100.86.243.187","TCP","1514","443  >  54993 [ACK] Seq=131762 Ack=4102 Win=9783 Len=1448 TSval=1115626172 TSecr=931592471 [TCP PDU reassembled in 180]"
"179","0.366671","23.13.164.38","100.86.243.187","TCP","1514","443  >  54993 [ACK] Seq=133210 Ack=4102 Win=9783 Len=1448 TSval=1115626172 TSecr=931592471 [TCP PDU reassembled in 180]"
"180","0.366671","23.13.164.38","100.86.243.187","TLSv1.2","999","Application Data"
"181","0.366748","100.86.243.187","23.13.164.38","TCP","86","[TCP Dup ACK 141#8] 54993  >  443 [ACK] Seq=4102 Ack=68510 Win=37456 Len=0 TSval=931592525 TSecr=1115626168 SLE=72854 SRE=135591 SLE=69958 SRE=71406"
"182","0.395536","23.13.164.38","100.86.243.187","TLSv1.2","457","Application Data"
"183","0.395537","23.13.164.38","100.86.243.187","TCP","1514","443  >  54993 [ACK] Seq=135982 Ack=4102 Win=9783 Len=1448 TSval=1115626179 TSecr=931592471 [TCP PDU reassembled in 194]"
"184","0.395538","23.13.164.38","100.86.243.187","TCP","1514","443  >  54993 [ACK] Seq=137430 Ack=4102 Win=9783 Len=1448 TSval=1115626179 TSecr=931592471 [TCP PDU reassembled in 194]"
"185","0.395538","23.13.164.38","100.86.243.187","TCP","1514","443  >  54993 [ACK] Seq=138878 Ack=4102 Win=9783 Len=1448 TSval=1115626179 TSecr=931592471 [TCP PDU reassembled in 194]"
"186","0.395539","23.13.164.38","100.86.243.187","TCP","1514","443  >  54993 [ACK] Seq=140326 Ack=4102 Win=9783 Len=1448 TSval=1115626179 TSecr=931592471 [TCP PDU reassembled in 194]"
"187","0.395539","23.13.164.38","100.86.243.187","TCP","1514","443  >  54993 [ACK] Seq=141774 Ack=4102 Win=9783 Len=1448 TSval=1115626179 TSecr=931592471 [TCP PDU reassembled in 194]"
"188","0.395540","23.13.164.38","100.86.243.187","TCP","1514","443  >  54993 [ACK] Seq=143222 Ack=4102 Win=9783 Len=1448 TSval=1115626179 TSecr=931592471 [TCP PDU reassembled in 194]"
"189","0.395540","23.13.164.38","100.86.243.187","TCP","1514","443  >  54993 [ACK] Seq=144670 Ack=4102 Win=9783 Len=1448 TSval=1115626179 TSecr=931592471 [TCP PDU reassembled in 194]"
"190","0.395541","23.13.164.38","100.86.243.187","TCP","1514","443  >  54993 [ACK] Seq=146118 Ack=4102 Win=9783 Len=1448 TSval=1115626179 TSecr=931592471 [TCP PDU reassembled in 194]"
"191","0.395542","23.13.164.38","100.86.243.187","TCP","1514","443  >  54993 [ACK] Seq=147566 Ack=4102 Win=9783 Len=1448 TSval=1115626179 TSecr=931592471 [TCP PDU reassembled in 194]"
"192","0.395542","23.13.164.38","100.86.243.187","TCP","1514","443  >  54993 [ACK] Seq=149014 Ack=4102 Win=9783 Len=1448 TSval=1115626179 TSecr=931592471 [TCP PDU reassembled in 194]"
"193","0.395543","23.13.164.38","100.86.243.187","TCP","1514","443  >  54993 [PSH, ACK] Seq=150462 Ack=4102 Win=9783 Len=1448 TSval=1115626179 TSecr=931592471 [TCP PDU reassembled in 194]"
"194","0.395543","23.13.164.38","100.86.243.187","TLSv1.2","1514","Application Data, Application Data"
"195","0.395544","23.13.164.38","100.86.243.187","TCP","1514","443  >  54993 [ACK] Seq=153358 Ack=4102 Win=9783 Len=1448 TSval=1115626180 TSecr=931592471 [TCP PDU reassembled in 205]"
"196","0.395544","23.13.164.38","100.86.243.187","TCP","1514","443  >  54993 [ACK] Seq=154806 Ack=4102 Win=9783 Len=1448 TSval=1115626180 TSecr=931592471 [TCP PDU reassembled in 205]"
"197","0.395545","23.13.164.38","100.86.243.187","TCP","1514","443  >  54993 [ACK] Seq=156254 Ack=4102 Win=9783 Len=1448 TSval=1115626180 TSecr=931592471 [TCP PDU reassembled in 205]"
"198","0.395545","23.13.164.38","100.86.243.187","TCP","1514","443  >  54993 [ACK] Seq=157702 Ack=4102 Win=9783 Len=1448 TSval=1115626180 TSecr=931592471 [TCP PDU reassembled in 205]"
"199","0.395546","23.13.164.38","100.86.243.187","TCP","1514","443  >  54993 [ACK] Seq=159150 Ack=4102 Win=9783 Len=1448 TSval=1115626180 TSecr=931592471 [TCP PDU reassembled in 205]"
"200","0.395547","23.13.164.38","100.86.243.187","TCP","1514","443  >  54993 [ACK] Seq=160598 Ack=4102 Win=9783 Len=1448 TSval=1115626180 TSecr=931592471 [TCP PDU reassembled in 205]"
"201","0.395547","23.13.164.38","100.86.243.187","TCP","1514","443  >  54993 [ACK] Seq=162046 Ack=4102 Win=9783 Len=1448 TSval=1115626180 TSecr=931592471 [TCP PDU reassembled in 205]"
"202","0.395547","23.13.164.38","100.86.243.187","TCP","1514","443  >  54993 [ACK] Seq=163494 Ack=4102 Win=9783 Len=1448 TSval=1115626180 TSecr=931592471 [TCP PDU reassembled in 205]"
"203","0.395548","23.13.164.38","100.86.243.187","TCP","1514","443  >  54993 [ACK] Seq=164942 Ack=4102 Win=9783 Len=1448 TSval=1115626180 TSecr=931592471 [TCP PDU reassembled in 205]"
"204","0.395549","23.13.164.38","100.86.243.187","TCP","1514","443  >  54993 [PSH, ACK] Seq=166390 Ack=4102 Win=9783 Len=1448 TSval=1115626180 TSecr=931592471 [TCP PDU reassembled in 205]"
"205","0.395549","23.13.164.38","100.86.243.187","TLSv1.2","1514","Application Data, Application Data"
"206","0.395550","23.13.164.38","100.86.243.187","TCP","1514","443  >  54993 [ACK] Seq=169286 Ack=4102 Win=9783 Len=1448 TSval=1115626181 TSecr=931592471 [TCP PDU reassembled in 220]"
"207","0.395550","23.13.164.38","100.86.243.187","TCP","1514","443  >  54993 [ACK] Seq=170734 Ack=4102 Win=9783 Len=1448 TSval=1115626181 TSecr=931592471 [TCP PDU reassembled in 220]"
"208","0.395551","23.13.164.38","100.86.243.187","TCP","1514","443  >  54993 [ACK] Seq=172182 Ack=4102 Win=9783 Len=1448 TSval=1115626181 TSecr=931592471 [TCP PDU reassembled in 220]"
"209","0.395641","100.86.243.187","23.13.164.38","TCP","86","[TCP Dup ACK 141#9] 54993  >  443 [ACK] Seq=4102 Ack=68510 Win=37456 Len=0 TSval=931592555 TSecr=1115626168 SLE=72854 SRE=151910 SLE=69958 SRE=71406"
"210","0.395674","100.86.243.187","23.13.164.38","TCP","86","[TCP Dup ACK 141#10] 54993  >  443 [ACK] Seq=4102 Ack=68510 Win=37456 Len=0 TSval=931592555 TSecr=1115626168 SLE=72854 SRE=167838 SLE=69958 SRE=71406"
"211","0.395689","100.86.243.187","23.13.164.38","TCP","86","[TCP Dup ACK 141#11] 54993  >  443 [ACK] Seq=4102 Ack=68510 Win=37456 Len=0 TSval=931592555 TSecr=1115626168 SLE=72854 SRE=173630 SLE=69958 SRE=71406"
"212","0.396456","23.13.164.38","100.86.243.187","TCP","1514","443  >  54993 [ACK] Seq=173630 Ack=4102 Win=9783 Len=1448 TSval=1115626181 TSecr=931592471 [TCP PDU reassembled in 220]"
"213","0.396456","23.13.164.38","100.86.243.187","TCP","1514","443  >  54993 [ACK] Seq=175078 Ack=4102 Win=9783 Len=1448 TSval=1115626181 TSecr=931592471 [TCP PDU reassembled in 220]"
"214","0.396457","23.13.164.38","100.86.243.187","TCP","1514","443  >  54993 [ACK] Seq=176526 Ack=4102 Win=9783 Len=1448 TSval=1115626181 TSecr=931592471 [TCP PDU reassembled in 220]"
"215","0.396457","23.13.164.38","100.86.243.187","TCP","1514","443  >  54993 [ACK] Seq=177974 Ack=4102 Win=9783 Len=1448 TSval=1115626181 TSecr=931592471 [TCP PDU reassembled in 220]"
"216","0.396458","23.13.164.38","100.86.243.187","TCP","1514","443  >  54993 [ACK] Seq=179422 Ack=4102 Win=9783 Len=1448 TSval=1115626181 TSecr=931592471 [TCP PDU reassembled in 220]"
"217","0.396458","23.13.164.38","100.86.243.187","TCP","1514","443  >  54993 [ACK] Seq=180870 Ack=4102 Win=9783 Len=1448 TSval=1115626181 TSecr=931592471 [TCP PDU reassembled in 220]"
"218","0.396459","23.13.164.38","100.86.243.187","TCP","1514","443  >  54993 [PSH, ACK] Seq=182318 Ack=4102 Win=9783 Len=1448 TSval=1115626181 TSecr=931592471 [TCP PDU reassembled in 220]"
"219","0.396460","23.13.164.38","100.86.243.187","TCP","1514","443  >  54993 [ACK] Seq=183766 Ack=4102 Win=9783 Len=1448 TSval=1115626182 TSecr=931592471 [TCP PDU reassembled in 220]"
"220","0.396460","23.13.164.38","100.86.243.187","TLSv1.2","1514","Application Data, Application Data"
"221","0.396460","23.13.164.38","100.86.243.187","TCP","1514","443  >  54993 [ACK] Seq=186662 Ack=4102 Win=9783 Len=1448 TSval=1115626182 TSecr=931592471 [TCP PDU reassembled in 228]"
"222","0.396461","23.13.164.38","100.86.243.187","TCP","1514","443  >  54993 [ACK] Seq=188110 Ack=4102 Win=9783 Len=1448 TSval=1115626182 TSecr=931592471 [TCP PDU reassembled in 228]"
"223","0.396461","23.13.164.38","100.86.243.187","TCP","1514","443  >  54993 [ACK] Seq=189558 Ack=4102 Win=9783 Len=1448 TSval=1115626182 TSecr=931592471 [TCP PDU reassembled in 228]"
"224","0.396462","23.13.164.38","100.86.243.187","TCP","1514","443  >  54993 [ACK] Seq=191006 Ack=4102 Win=9783 Len=1448 TSval=1115626182 TSecr=931592471 [TCP PDU reassembled in 228]"
"225","0.396463","23.13.164.38","100.86.243.187","TCP","1514","443  >  54993 [ACK] Seq=192454 Ack=4102 Win=9783 Len=1448 TSval=1115626182 TSecr=931592471 [TCP PDU reassembled in 228]"
"226","0.396463","23.13.164.38","100.86.243.187","TCP","1514","443  >  54993 [ACK] Seq=193902 Ack=4102 Win=9783 Len=1448 TSval=1115626182 TSecr=931592471 [TCP PDU reassembled in 228]"
"227","0.396464","23.13.164.38","100.86.243.187","TCP","1514","443  >  54993 [ACK] Seq=195350 Ack=4102 Win=9783 Len=1448 TSval=1115626182 TSecr=931592471 [TCP PDU reassembled in 228]"
"228","0.396464","23.13.164.38","100.86.243.187","TLSv1.2","1228","Application Data"
"229","0.396465","23.13.164.38","100.86.243.187","TLSv1.2","476","Application Data"
"230","0.396465","23.13.164.38","100.86.243.187","TCP","1514","443  >  54993 [ACK] Seq=198370 Ack=4102 Win=9783 Len=1448 TSval=1115626184 TSecr=931592523 [TCP PDU reassembled in 245]"
"231","0.396466","23.13.164.38","100.86.243.187","TCP","1514","443  >  54993 [ACK] Seq=199818 Ack=4102 Win=9783 Len=1448 TSval=1115626184 TSecr=931592523 [TCP PDU reassembled in 245]"
"232","0.396466","23.13.164.38","100.86.243.187","TCP","1514","443  >  54993 [ACK] Seq=201266 Ack=4102 Win=9783 Len=1448 TSval=1115626184 TSecr=931592523 [TCP PDU reassembled in 245]"
"233","0.396467","23.13.164.38","100.86.243.187","TCP","1514","443  >  54993 [ACK] Seq=202714 Ack=4102 Win=9783 Len=1448 TSval=1115626184 TSecr=931592523 [TCP PDU reassembled in 245]"
"234","0.396467","23.13.164.38","100.86.243.187","TCP","1514","443  >  54993 [ACK] Seq=204162 Ack=4102 Win=9783 Len=1448 TSval=1115626184 TSecr=931592523 [TCP PDU reassembled in 245]"
"235","0.396468","23.13.164.38","100.86.243.187","TCP","1514","443  >  54993 [ACK] Seq=205610 Ack=4102 Win=9783 Len=1448 TSval=1115626184 TSecr=931592523 [TCP PDU reassembled in 245]"
"236","0.396514","100.86.243.187","23.13.164.38","TCP","86","[TCP Dup ACK 141#12] 54993  >  443 [ACK] Seq=4102 Ack=68510 Win=37456 Len=0 TSval=931592555 TSecr=1115626168 SLE=72854 SRE=189558 SLE=69958 SRE=71406"
"237","0.396529","100.86.243.187","23.13.164.38","TCP","86","[TCP Dup ACK 141#13] 54993  >  443 [ACK] Seq=4102 Ack=68510 Win=37456 Len=0 TSval=931592555 TSecr=1115626168 SLE=72854 SRE=205610 SLE=69958 SRE=71406"
"238","0.396538","100.86.243.187","23.13.164.38","TCP","86","[TCP Dup ACK 141#14] 54993  >  443 [ACK] Seq=4102 Ack=68510 Win=37456 Len=0 TSval=931592555 TSecr=1115626168 SLE=72854 SRE=207058 SLE=69958 SRE=71406"
"239","0.398061","23.13.164.38","100.86.243.187","TCP","1514","443  >  54993 [ACK] Seq=207058 Ack=4102 Win=9783 Len=1448 TSval=1115626184 TSecr=931592523 [TCP PDU reassembled in 245]"
"240","0.398062","23.13.164.38","100.86.243.187","TCP","1514","443  >  54993 [ACK] Seq=208506 Ack=4102 Win=9783 Len=1448 TSval=1115626184 TSecr=931592523 [TCP PDU reassembled in 245]"
"241","0.398062","23.13.164.38","100.86.243.187","TCP","1514","443  >  54993 [ACK] Seq=209954 Ack=4102 Win=9783 Len=1448 TSval=1115626184 TSecr=931592523 [TCP PDU reassembled in 245]"
"242","0.398063","23.13.164.38","100.86.243.187","TCP","1514","443  >  54993 [ACK] Seq=211402 Ack=4102 Win=9783 Len=1448 TSval=1115626184 TSecr=931592523 [TCP PDU reassembled in 245]"
"243","0.398064","23.13.164.38","100.86.243.187","TCP","1514","443  >  54993 [PSH, ACK] Seq=212850 Ack=4102 Win=9783 Len=1448 TSval=1115626184 TSecr=931592523 [TCP PDU reassembled in 245]"
"245","0.398065","23.13.164.38","100.86.243.187","TLSv1.2","782","Application Data, Application Data, Application Data"
"246","0.398065","23.13.164.38","100.86.243.187","TLSv1.2","1514","Application Data"
"247","0.398066","23.13.164.38","100.86.243.187","TCP","1514","443  >  54993 [ACK] Seq=216462 Ack=4102 Win=9783 Len=1448 TSval=1115626185 TSecr=931592523 [TCP PDU reassembled in 257]"
"248","0.398066","23.13.164.38","100.86.243.187","TCP","1514","443  >  54993 [ACK] Seq=217910 Ack=4102 Win=9783 Len=1448 TSval=1115626185 TSecr=931592523 [TCP PDU reassembled in 257]"
"249","0.398067","23.13.164.38","100.86.243.187","TCP","1514","443  >  54993 [ACK] Seq=219358 Ack=4102 Win=9783 Len=1448 TSval=1115626185 TSecr=931592523 [TCP PDU reassembled in 257]"
"250","0.398067","23.13.164.38","100.86.243.187","TCP","1514","443  >  54993 [ACK] Seq=220806 Ack=4102 Win=9783 Len=1448 TSval=1115626185 TSecr=931592523 [TCP PDU reassembled in 257]"
"251","0.398068","23.13.164.38","100.86.243.187","TCP","1514","443  >  54993 [ACK] Seq=222254 Ack=4102 Win=9783 Len=1448 TSval=1115626185 TSecr=931592523 [TCP PDU reassembled in 257]"
"252","0.398068","23.13.164.38","100.86.243.187","TCP","1514","443  >  54993 [ACK] Seq=223702 Ack=4102 Win=9783 Len=1448 TSval=1115626185 TSecr=931592523 [TCP PDU reassembled in 257]"
"253","0.398069","23.13.164.38","100.86.243.187","TCP","1514","443  >  54993 [ACK] Seq=225150 Ack=4102 Win=9783 Len=1448 TSval=1115626185 TSecr=931592523 [TCP PDU reassembled in 257]"
"254","0.398069","23.13.164.38","100.86.243.187","TCP","1514","443  >  54993 [ACK] Seq=226598 Ack=4102 Win=9783 Len=1448 TSval=1115626185 TSecr=931592523 [TCP PDU reassembled in 257]"
"255","0.398070","23.13.164.38","100.86.243.187","TCP","1514","443  >  54993 [ACK] Seq=228046 Ack=4102 Win=9783 Len=1448 TSval=1115626185 TSecr=931592523 [TCP PDU reassembled in 257]"
"256","0.398071","23.13.164.38","100.86.243.187","TCP","1514","443  >  54993 [PSH, ACK] Seq=229494 Ack=4102 Win=9783 Len=1448 TSval=1115626185 TSecr=931592523 [TCP PDU reassembled in 257]"
"257","0.398071","23.13.164.38","100.86.243.187","TLSv1.2","1514","Application Data, Application Data"
"258","0.398072","23.13.164.38","100.86.243.187","TCP","1514","443  >  54993 [ACK] Seq=232390 Ack=4102 Win=9783 Len=1448 TSval=1115626186 TSecr=931592523 [TCP PDU reassembled in 259]"
"259","0.398072","23.13.164.38","100.86.243.187","TLSv1.2","299","Application Data"
"260","0.398073","23.13.164.38","100.86.243.187","TCP","1514","[TCP Fast Retransmission] 443  >  54993 [ACK] Seq=68510 Ack=4102 Win=9783 Len=1448 TSval=1115626187 TSecr=931592523 [TCP PDU reassembled in 261]"
"261","0.398073","23.13.164.38","100.86.243.187","TLSv1.2","1514","[TCP Fast Retransmission] , Application Data"
"262","0.398074","23.13.164.38","100.86.243.187","TLSv1.2","457","Application Data"
"263","0.398138","100.86.243.187","23.13.164.38","TCP","86","[TCP Dup ACK 141#15] 54993  >  443 [ACK] Seq=4102 Ack=68510 Win=37456 Len=0 TSval=931592558 TSecr=1115626168 SLE=72854 SRE=222254 SLE=69958 SRE=71406"
"264","0.398157","100.86.243.187","23.13.164.38","TCP","86","[TCP Dup ACK 141#16] 54993  >  443 [ACK] Seq=4102 Ack=68510 Win=37456 Len=0 TSval=931592558 TSecr=1115626168 SLE=72854 SRE=234071 SLE=69958 SRE=71406"
"266","0.398200","100.86.243.187","23.13.164.38","TCP","66","54993  >  443 [ACK] Seq=4102 Ack=234462 Win=34863 Len=0 TSval=931592558 TSecr=1115626189"
"267","0.399510","23.13.164.38","100.86.243.187","TCP","1514","443  >  54993 [ACK] Seq=234462 Ack=4102 Win=9783 Len=1448 TSval=1115626189 TSecr=931592523 [TCP PDU reassembled in 278]"
"268","0.399511","23.13.164.38","100.86.243.187","TCP","1514","443  >  54993 [ACK] Seq=235910 Ack=4102 Win=9783 Len=1448 TSval=1115626189 TSecr=931592523 [TCP PDU reassembled in 278]"
"269","0.399512","23.13.164.38","100.86.243.187","TCP","1514","443  >  54993 [ACK] Seq=237358 Ack=4102 Win=9783 Len=1448 TSval=1115626189 TSecr=931592523 [TCP PDU reassembled in 278]"
"270","0.399513","23.13.164.38","100.86.243.187","TCP","1514","443  >  54993 [ACK] Seq=238806 Ack=4102 Win=9783 Len=1448 TSval=1115626189 TSecr=931592523 [TCP PDU reassembled in 278]"
"271","0.399513","23.13.164.38","100.86.243.187","TCP","1514","443  >  54993 [ACK] Seq=240254 Ack=4102 Win=9783 Len=1448 TSval=1115626189 TSecr=931592523 [TCP PDU reassembled in 278]"
"272","0.399514","23.13.164.38","100.86.243.187","TCP","1514","443  >  54993 [ACK] Seq=241702 Ack=4102 Win=9783 Len=1448 TSval=1115626189 TSecr=931592523 [TCP PDU reassembled in 278]"
"273","0.399515","23.13.164.38","100.86.243.187","TCP","1514","443  >  54993 [ACK] Seq=243150 Ack=4102 Win=9783 Len=1448 TSval=1115626189 TSecr=931592523 [TCP PDU reassembled in 278]"
"274","0.399516","23.13.164.38","100.86.243.187","TCP","1514","443  >  54993 [ACK] Seq=244598 Ack=4102 Win=9783 Len=1448 TSval=1115626189 TSecr=931592523 [TCP PDU reassembled in 278]"
"275","0.399517","23.13.164.38","100.86.243.187","TCP","1514","443  >  54993 [ACK] Seq=246046 Ack=4102 Win=9783 Len=1448 TSval=1115626189 TSecr=931592523 [TCP PDU reassembled in 278]"
"276","0.399517","23.13.164.38","100.86.243.187","TCP","1514","443  >  54993 [ACK] Seq=247494 Ack=4102 Win=9783 Len=1448 TSval=1115626189 TSecr=931592523 [TCP PDU reassembled in 278]"
"277","0.399518","23.13.164.38","100.86.243.187","TCP","1514","443  >  54993 [PSH, ACK] Seq=248942 Ack=4102 Win=9783 Len=1448 TSval=1115626189 TSecr=931592523 [TCP PDU reassembled in 278]"
"278","0.399519","23.13.164.38","100.86.243.187","TLSv1.2","575","Application Data, Application Data"
"279","0.399519","23.13.164.38","100.86.243.187","TCP","1514","443  >  54993 [ACK] Seq=250899 Ack=4102 Win=9783 Len=1448 TSval=1115626190 TSecr=931592523 [TCP PDU reassembled in 294]"
"280","0.399520","23.13.164.38","100.86.243.187","TCP","1514","443  >  54993 [ACK] Seq=252347 Ack=4102 Win=9783 Len=1448 TSval=1115626190 TSecr=931592523 [TCP PDU reassembled in 294]"
"281","0.399522","23.13.164.38","100.86.243.187","TCP","1514","443  >  54993 [ACK] Seq=253795 Ack=4102 Win=9783 Len=1448 TSval=1115626190 TSecr=931592523 [TCP PDU reassembled in 294]"
"282","0.399523","23.13.164.38","100.86.243.187","TCP","1514","443  >  54993 [ACK] Seq=255243 Ack=4102 Win=9783 Len=1448 TSval=1115626190 TSecr=931592523 [TCP PDU reassembled in 294]"
"283","0.399524","23.13.164.38","100.86.243.187","TCP","1514","443  >  54993 [ACK] Seq=256691 Ack=4102 Win=9783 Len=1448 TSval=1115626190 TSecr=931592523 [TCP PDU reassembled in 294]"
"284","0.399525","23.13.164.38","100.86.243.187","TCP","1514","443  >  54993 [ACK] Seq=258139 Ack=4102 Win=9783 Len=1448 TSval=1115626190 TSecr=931592523 [TCP PDU reassembled in 294]"
"285","0.399525","23.13.164.38","100.86.243.187","TCP","1514","443  >  54993 [ACK] Seq=259587 Ack=4102 Win=9783 Len=1448 TSval=1115626190 TSecr=931592523 [TCP PDU reassembled in 294]"
"286","0.399526","23.13.164.38","100.86.243.187","TCP","1514","443  >  54993 [ACK] Seq=261035 Ack=4102 Win=9783 Len=1448 TSval=1115626190 TSecr=931592523 [TCP PDU reassembled in 294]"
"287","0.399527","23.13.164.38","100.86.243.187","TCP","1514","443  >  54993 [ACK] Seq=262483 Ack=4102 Win=9783 Len=1448 TSval=1115626190 TSecr=931592523 [TCP PDU reassembled in 294]"
