"No.","Time","Source","Destination","Protocol","Length","Info"
"1","0.000000","23.9.158.105","10.1.30.131","TCP","1514","443  >  54829 [ACK] Seq=1 Ack=1 Win=614 Len=1448 TSval=1263396331 TSecr=1832919582 [TCP PDU reassembled in 2]"
"2","0.000001","23.9.158.105","10.1.30.131","TLSv1.2","408","Application Data"
"3","0.000002","23.9.158.105","10.1.30.131","TLSv1.2","441","Application Data"
"4","0.000003","23.9.158.105","10.1.30.131","TLSv1.2","195","Application Data"
"5","0.000003","23.9.158.105","10.1.30.131","TLSv1.2","440","Application Data"
"6","0.000003","23.9.158.105","10.1.30.131","TLSv1.2","311","Application Data"
"7","0.000434","10.1.30.131","23.9.158.105","TCP","66","54829  >  443 [ACK] Seq=1 Ack=2914 Win=65535 Len=0 TSval=1832919651 TSecr=1263396331"
"8","0.036036","23.9.158.105","10.1.30.131","TLSv1.2","491","Application Data"
"9","0.036037","23.9.158.105","10.1.30.131","TLSv1.2","1067","Application Data"
"10","0.036037","23.9.158.105","10.1.30.131","TLSv1.2","430","Application Data"
"11","0.036038","23.9.158.105","10.1.30.131","TLSv1.2","195","Application Data"
"12","0.036384","10.1.30.131","23.9.158.105","TCP","66","54829  >  443 [ACK] Seq=1 Ack=4833 Win=65535 Len=0 TSval=1832919687 TSecr=1263396367"
"13","0.040454","23.9.158.105","10.1.30.131","TCP","1514","443  >  54829 [ACK] Seq=4833 Ack=1 Win=614 Len=1448 TSval=1263396371 TSecr=1832919651 [TCP PDU reassembled in 24]"
"14","0.040455","23.9.158.105","10.1.30.131","TCP","1514","443  >  54829 [ACK] Seq=6281 Ack=1 Win=614 Len=1448 TSval=1263396371 TSecr=1832919651 [TCP PDU reassembled in 24]"
"15","0.040455","23.9.158.105","10.1.30.131","TCP","1514","443  >  54829 [ACK] Seq=7729 Ack=1 Win=614 Len=1448 TSval=1263396371 TSecr=1832919651 [TCP PDU reassembled in 24]"
"16","0.040456","23.9.158.105","10.1.30.131","TCP","1514","443  >  54829 [ACK] Seq=9177 Ack=1 Win=614 Len=1448 TSval=1263396371 TSecr=1832919651 [TCP PDU reassembled in 24]"
"17","0.040457","23.9.158.105","10.1.30.131","TCP","1514","443  >  54829 [ACK] Seq=10625 Ack=1 Win=614 Len=1448 TSval=1263396371 TSecr=1832919651 [TCP PDU reassembled in 24]"
"18","0.040458","23.9.158.105","10.1.30.131","TCP","1514","443  >  54829 [ACK] Seq=12073 Ack=1 Win=614 Len=1448 TSval=1263396371 TSecr=1832919651 [TCP PDU reassembled in 24]"
"19","0.040458","23.9.158.105","10.1.30.131","TCP","1514","443  >  54829 [ACK] Seq=13521 Ack=1 Win=614 Len=1448 TSval=1263396371 TSecr=1832919651 [TCP PDU reassembled in 24]"
"20","0.040459","23.9.158.105","10.1.30.131","TCP","1514","443  >  54829 [ACK] Seq=14969 Ack=1 Win=614 Len=1448 TSval=1263396371 TSecr=1832919651 [TCP PDU reassembled in 24]"
"21","0.040459","23.9.158.105","10.1.30.131","TCP","1514","443  >  54829 [ACK] Seq=16417 Ack=1 Win=614 Len=1448 TSval=1263396371 TSecr=1832919651 [TCP PDU reassembled in 24]"
"22","0.040460","23.9.158.105","10.1.30.131","TCP","1514","443  >  54829 [ACK] Seq=17865 Ack=1 Win=614 Len=1448 TSval=1263396371 TSecr=1832919651 [TCP PDU reassembled in 24]"
"23","0.040461","23.9.158.105","10.1.30.131","TCP","1514","443  >  54829 [ACK] Seq=19313 Ack=1 Win=614 Len=1448 TSval=1263396371 TSecr=1832919651 [TCP PDU reassembled in 24]"
"24","0.040461","23.9.158.105","10.1.30.131","TLSv1.2","544","Application Data"
"25","0.040462","23.9.158.105","10.1.30.131","TLSv1.2","97","Application Data"
"26","0.040462","23.9.158.105","10.1.30.131","TCP","1514","443  >  54829 [ACK] Seq=21270 Ack=1 Win=614 Len=1448 TSval=1263396371 TSecr=1832919651 [TCP PDU reassembled in 37]"
"27","0.040463","23.9.158.105","10.1.30.131","TCP","1514","443  >  54829 [ACK] Seq=22718 Ack=1 Win=614 Len=1448 TSval=1263396371 TSecr=1832919651 [TCP PDU reassembled in 37]"
"28","0.040464","23.9.158.105","10.1.30.131","TCP","1514","443  >  54829 [ACK] Seq=24166 Ack=1 Win=614 Len=1448 TSval=1263396371 TSecr=1832919651 [TCP PDU reassembled in 37]"
"29","0.040464","23.9.158.105","10.1.30.131","TCP","1514","443  >  54829 [ACK] Seq=25614 Ack=1 Win=614 Len=1448 TSval=1263396371 TSecr=1832919651 [TCP PDU reassembled in 37]"
"30","0.040465","23.9.158.105","10.1.30.131","TCP","1514","443  >  54829 [ACK] Seq=27062 Ack=1 Win=614 Len=1448 TSval=1263396371 TSecr=1832919651 [TCP PDU reassembled in 37]"
"31","0.040465","23.9.158.105","10.1.30.131","TCP","1514","443  >  54829 [ACK] Seq=28510 Ack=1 Win=614 Len=1448 TSval=1263396371 TSecr=1832919651 [TCP PDU reassembled in 37]"
"32","0.040466","23.9.158.105","10.1.30.131","TCP","1514","443  >  54829 [ACK] Seq=29958 Ack=1 Win=614 Len=1448 TSval=1263396371 TSecr=1832919651 [TCP PDU reassembled in 37]"
"33","0.040466","23.9.158.105","10.1.30.131","TCP","1514","443  >  54829 [ACK] Seq=31406 Ack=1 Win=614 Len=1448 TSval=1263396371 TSecr=1832919651 [TCP PDU reassembled in 37]"
"34","0.040467","23.9.158.105","10.1.30.131","TCP","1514","443  >  54829 [ACK] Seq=32854 Ack=1 Win=614 Len=1448 TSval=1263396371 TSecr=1832919651 [TCP PDU reassembled in 37]"
"35","0.040468","23.9.158.105","10.1.30.131","TCP","1514","443  >  54829 [ACK] Seq=34302 Ack=1 Win=614 Len=1448 TSval=1263396371 TSecr=1832919651 [TCP PDU reassembled in 37]"
"36","0.040468","23.9.158.105","10.1.30.131","TCP","1514","443  >  54829 [ACK] Seq=35750 Ack=1 Win=614 Len=1448 TSval=1263396371 TSecr=1832919651 [TCP PDU reassembled in 37]"
"37","0.040468","23.9.158.105","10.1.30.131","TLSv1.2","544","Application Data"
"38","0.040469","23.9.158.105","10.1.30.131","TLSv1.2","1514","Application Data"
"39","0.040470","23.9.158.105","10.1.30.131","TCP","1514","443  >  54829 [ACK] Seq=39124 Ack=1 Win=614 Len=1448 TSval=1263396372 TSecr=1832919651 [TCP PDU reassembled in 50]"
"40","0.040470","23.9.158.105","10.1.30.131","TCP","1514","443  >  54829 [ACK] Seq=40572 Ack=1 Win=614 Len=1448 TSval=1263396372 TSecr=1832919651 [TCP PDU reassembled in 50]"
"41","0.040471","23.9.158.105","10.1.30.131","TCP","1514","443  >  54829 [ACK] Seq=42020 Ack=1 Win=614 Len=1448 TSval=1263396372 TSecr=1832919651 [TCP PDU reassembled in 50]"
"42","0.040472","23.9.158.105","10.1.30.131","TCP","1514","443  >  54829 [ACK] Seq=43468 Ack=1 Win=614 Len=1448 TSval=1263396372 TSecr=1832919651 [TCP PDU reassembled in 50]"
"43","0.040472","23.9.158.105","10.1.30.131","TCP","1514","443  >  54829 [ACK] Seq=44916 Ack=1 Win=614 Len=1448 TSval=1263396372 TSecr=1832919651 [TCP PDU reassembled in 50]"
"44","0.040473","23.9.158.105","10.1.30.131","TCP","1514","443  >  54829 [ACK] Seq=46364 Ack=1 Win=614 Len=1448 TSval=1263396372 TSecr=1832919651 [TCP PDU reassembled in 50]"
"45","0.040717","10.1.30.131","23.9.158.105","TCP","66","54829  >  443 [ACK] Seq=1 Ack=47812 Win=65535 Len=0 TSval=1832919692 TSecr=1263396371"
"46","0.040893","23.9.158.105","10.1.30.131","TCP","1514","443  >  54829 [ACK] Seq=47812 Ack=1 Win=614 Len=1448 TSval=1263396372 TSecr=1832919651 [TCP PDU reassembled in 50]"
"47","0.040894","23.9.158.105","10.1.30.131","TCP","1514","443  >  54829 [ACK] Seq=49260 Ack=1 Win=614 Len=1448 TSval=1263396372 TSecr=1832919651 [TCP PDU reassembled in 50]"
"48","0.040895","23.9.158.105","10.1.30.131","TCP","1514","443  >  54829 [ACK] Seq=50708 Ack=1 Win=614 Len=1448 TSval=1263396372 TSecr=1832919651 [TCP PDU reassembled in 50]"
"49","0.040896","23.9.158.105","10.1.30.131","TCP","1514","443  >  54829 [ACK] Seq=52156 Ack=1 Win=614 Len=1448 TSval=1263396372 TSecr=1832919651 [TCP PDU reassembled in 50]"
"50","0.040896","23.9.158.105","10.1.30.131","TLSv1.2","1514","Application Data, Application Data"
"51","0.040897","23.9.158.105","10.1.30.131","TCP","1514","443  >  54829 [ACK] Seq=55052 Ack=1 Win=614 Len=1448 TSval=1263396372 TSecr=1832919651 [TCP PDU reassembled in 61]"
"52","0.040898","23.9.158.105","10.1.30.131","TCP","1514","443  >  54829 [ACK] Seq=56500 Ack=1 Win=614 Len=1448 TSval=1263396372 TSecr=1832919651 [TCP PDU reassembled in 61]"
"53","0.040899","23.9.158.105","10.1.30.131","TCP","1514","443  >  54829 [ACK] Seq=57948 Ack=1 Win=614 Len=1448 TSval=1263396372 TSecr=1832919651 [TCP PDU reassembled in 61]"
"54","0.040899","23.9.158.105","10.1.30.131","TCP","1514","443  >  54829 [ACK] Seq=59396 Ack=1 Win=614 Len=1448 TSval=1263396372 TSecr=1832919651 [TCP PDU reassembled in 61]"
"55","0.040900","23.9.158.105","10.1.30.131","TCP","1514","443  >  54829 [ACK] Seq=60844 Ack=1 Win=614 Len=1448 TSval=1263396372 TSecr=1832919651 [TCP PDU reassembled in 61]"
"56","0.040901","23.9.158.105","10.1.30.131","TCP","1514","443  >  54829 [ACK] Seq=62292 Ack=1 Win=614 Len=1448 TSval=1263396372 TSecr=1832919651 [TCP PDU reassembled in 61]"
"57","0.040901","23.9.158.105","10.1.30.131","TCP","1514","443  >  54829 [ACK] Seq=63740 Ack=1 Win=614 Len=1448 TSval=1263396372 TSecr=1832919651 [TCP PDU reassembled in 61]"
"58","0.040902","23.9.158.105","10.1.30.131","TCP","1514","443  >  54829 [ACK] Seq=65188 Ack=1 Win=614 Len=1448 TSval=1263396372 TSecr=1832919651 [TCP PDU reassembled in 61]"
"59","0.040903","23.9.158.105","10.1.30.131","TCP","1514","443  >  54829 [ACK] Seq=66636 Ack=1 Win=614 Len=1448 TSval=1263396372 TSecr=1832919651 [TCP PDU reassembled in 61]"
"60","0.040903","23.9.158.105","10.1.30.131","TCP","1514","443  >  54829 [ACK] Seq=68084 Ack=1 Win=614 Len=1448 TSval=1263396372 TSecr=1832919651 [TCP PDU reassembled in 61]"
"61","0.040904","23.9.158.105","10.1.30.131","TLSv1.2","1084","Application Data"
"62","0.040905","23.9.158.105","10.1.30.131","TLSv1.2","1514","Application Data"
"63","0.040905","23.9.158.105","10.1.30.131","TCP","1514","443  >  54829 [ACK] Seq=71998 Ack=1 Win=614 Len=1448 TSval=1263396372 TSecr=1832919651 [TCP PDU reassembled in 73]"
"64","0.040906","23.9.158.105","10.1.30.131","TCP","1514","443  >  54829 [ACK] Seq=73446 Ack=1 Win=614 Len=1448 TSval=1263396372 TSecr=1832919651 [TCP PDU reassembled in 73]"
"65","0.040907","23.9.158.105","10.1.30.131","TCP","1514","443  >  54829 [ACK] Seq=74894 Ack=1 Win=614 Len=1448 TSval=1263396372 TSecr=1832919651 [TCP PDU reassembled in 73]"
"66","0.040907","23.9.158.105","10.1.30.131","TCP","1514","443  >  54829 [ACK] Seq=76342 Ack=1 Win=614 Len=1448 TSval=1263396372 TSecr=1832919651 [TCP PDU reassembled in 73]"
"67","0.040908","23.9.158.105","10.1.30.131","TCP","1514","443  >  54829 [ACK] Seq=77790 Ack=1 Win=614 Len=1448 TSval=1263396372 TSecr=1832919651 [TCP PDU reassembled in 73]"
"68","0.040909","23.9.158.105","10.1.30.131","TCP","1514","443  >  54829 [ACK] Seq=79238 Ack=1 Win=614 Len=1448 TSval=1263396372 TSecr=1832919651 [TCP PDU reassembled in 73]"
"69","0.040910","23.9.158.105","10.1.30.131","TCP","1514","443  >  54829 [ACK] Seq=80686 Ack=1 Win=614 Len=1448 TSval=1263396372 TSecr=1832919651 [TCP PDU reassembled in 73]"
"70","0.040910","23.9.158.105","10.1.30.131","TCP","1514","443  >  54829 [ACK] Seq=82134 Ack=1 Win=614 Len=1448 TSval=1263396372 TSecr=1832919651 [TCP PDU reassembled in 73]"
"71","0.040911","23.9.158.105","10.1.30.131","TCP","1514","443  >  54829 [ACK] Seq=83582 Ack=1 Win=614 Len=1448 TSval=1263396372 TSecr=1832919651 [TCP PDU reassembled in 73]"
"72","0.040912","23.9.158.105","10.1.30.131","TCP","1514","443  >  54829 [ACK] Seq=85030 Ack=1 Win=614 Len=1448 TSval=1263396372 TSecr=1832919651 [TCP PDU reassembled in 73]"
"73","0.040913","23.9.158.105","10.1.30.131","TLSv1.2","575","Application Data"
"74","0.040913","23.9.158.105","10.1.30.131","TLSv1.2","1514","Application Data"
"75","0.040914","23.9.158.105","10.1.30.131","TCP","1514","443  >  54829 [ACK] Seq=88435 Ack=1 Win=614 Len=1448 TSval=1263396372 TSecr=1832919651 [TCP PDU reassembled in 86]"
"76","0.040914","23.9.158.105","10.1.30.131","TCP","1514","443  >  54829 [ACK] Seq=89883 Ack=1 Win=614 Len=1448 TSval=1263396372 TSecr=1832919651 [TCP PDU reassembled in 86]"
"77","0.040915","23.9.158.105","10.1.30.131","TCP","1514","443  >  54829 [ACK] Seq=91331 Ack=1 Win=614 Len=1448 TSval=1263396372 TSecr=1832919651 [TCP PDU reassembled in 86]"
"78","0.040916","23.9.158.105","10.1.30.131","TCP","1514","443  >  54829 [ACK] Seq=92779 Ack=1 Win=614 Len=1448 TSval=1263396372 TSecr=1832919651 [TCP PDU reassembled in 86]"
"79","0.040917","23.9.158.105","10.1.30.131","TCP","1514","443  >  54829 [ACK] Seq=94227 Ack=1 Win=614 Len=1448 TSval=1263396372 TSecr=1832919651 [TCP PDU reassembled in 86]"
"80","0.041174","10.1.30.131","23.9.158.105","TCP","66","54829  >  443 [ACK] Seq=1 Ack=95675 Win=65535 Len=0 TSval=1832919692 TSecr=1263396372"
"81","0.041749","23.9.158.105","10.1.30.131","TCP","1514","443  >  54829 [ACK] Seq=95675 Ack=1 Win=614 Len=1448 TSval=1263396372 TSecr=1832919651 [TCP PDU reassembled in 86]"
"82","0.041750","23.9.158.105","10.1.30.131","TCP","1514","443  >  54829 [ACK] Seq=97123 Ack=1 Win=614 Len=1448 TSval=1263396372 TSecr=1832919651 [TCP PDU reassembled in 86]"
"83","0.041751","23.9.158.105","10.1.30.131","TCP","1514","443  >  54829 [ACK] Seq=98571 Ack=1 Win=614 Len=1448 TSval=1263396372 TSecr=1832919651 [TCP PDU reassembled in 86]"
"84","0.041752","23.9.158.105","10.1.30.131","TCP","1514","443  >  54829 [ACK] Seq=100019 Ack=1 Win=614 Len=1448 TSval=1263396372 TSecr=1832919651 [TCP PDU reassembled in 86]"
"85","0.041753","23.9.158.105","10.1.30.131","TCP","1514","443  >  54829 [ACK] Seq=101467 Ack=1 Win=614 Len=1448 TSval=1263396372 TSecr=1832919651 [TCP PDU reassembled in 86]"
"86","0.041753","23.9.158.105","10.1.30.131","TLSv1.2","1514","Application Data, Application Data"
"87","0.041754","23.9.158.105","10.1.30.131","TCP","1514","443  >  54829 [ACK] Seq=104363 Ack=1 Win=614 Len=1448 TSval=1263396372 TSecr=1832919651 [TCP PDU reassembled in 97]"
"88","0.041755","23.9.158.105","10.1.30.131","TCP","1514","443  >  54829 [ACK] Seq=105811 Ack=1 Win=614 Len=1448 TSval=1263396372 TSecr=1832919651 [TCP PDU reassembled in 97]"
"89","0.041755","23.9.158.105","10.1.30.131","TCP","1514","443  >  54829 [ACK] Seq=107259 Ack=1 Win=614 Len=1448 TSval=1263396372 TSecr=1832919651 [TCP PDU reassembled in 97]"
"90","0.041756","23.9.158.105","10.1.30.131","TCP","1514","443  >  54829 [ACK] Seq=108707 Ack=1 Win=614 Len=1448 TSval=1263396372 TSecr=1832919651 [TCP PDU reassembled in 97]"
"91","0.041757","23.9.158.105","10.1.30.131","TCP","1514","443  >  54829 [ACK] Seq=110155 Ack=1 Win=614 Len=1448 TSval=1263396372 TSecr=1832919651 [TCP PDU reassembled in 97]"
"92","0.041758","23.9.158.105","10.1.30.131","TCP","1514","443  >  54829 [ACK] Seq=111603 Ack=1 Win=614 Len=1448 TSval=1263396372 TSecr=1832919651 [TCP PDU reassembled in 97]"
"93","0.041758","23.9.158.105","10.1.30.131","TCP","1514","443  >  54829 [ACK] Seq=113051 Ack=1 Win=614 Len=1448 TSval=1263396372 TSecr=1832919651 [TCP PDU reassembled in 97]"
"94","0.041759","23.9.158.105","10.1.30.131","TCP","1514","443  >  54829 [ACK] Seq=114499 Ack=1 Win=614 Len=1448 TSval=1263396372 TSecr=1832919651 [TCP PDU reassembled in 97]"
"95","0.041760","23.9.158.105","10.1.30.131","TCP","1514","443  >  54829 [ACK] Seq=115947 Ack=1 Win=614 Len=1448 TSval=1263396372 TSecr=1832919651 [TCP PDU reassembled in 97]"
"96","0.041761","23.9.158.105","10.1.30.131","TCP","1514","443  >  54829 [ACK] Seq=117395 Ack=1 Win=614 Len=1448 TSval=1263396372 TSecr=1832919651 [TCP PDU reassembled in 97]"
"97","0.041761","23.9.158.105","10.1.30.131","TLSv1.2","1514","Application Data, Application Data"
"98","0.041762","23.9.158.105","10.1.30.131","TCP","1514","443  >  54829 [ACK] Seq=120291 Ack=1 Win=614 Len=1448 TSval=1263396372 TSecr=1832919651 [TCP PDU reassembled in 109]"
"99","0.041763","23.9.158.105","10.1.30.131","TCP","1514","443  >  54829 [ACK] Seq=121739 Ack=1 Win=614 Len=1448 TSval=1263396372 TSecr=1832919651 [TCP PDU reassembled in 109]"
"100","0.041764","23.9.158.105","10.1.30.131","TCP","1514","443  >  54829 [ACK] Seq=123187 Ack=1 Win=614 Len=1448 TSval=1263396372 TSecr=1832919651 [TCP PDU reassembled in 109]"
"101","0.041764","23.9.158.105","10.1.30.131","TCP","1514","443  >  54829 [ACK] Seq=124635 Ack=1 Win=614 Len=1448 TSval=1263396372 TSecr=1832919651 [TCP PDU reassembled in 109]"
"102","0.041765","23.9.158.105","10.1.30.131","TCP","1514","443  >  54829 [ACK] Seq=126083 Ack=1 Win=614 Len=1448 TSval=1263396372 TSecr=1832919651 [TCP PDU reassembled in 109]"
"103","0.041766","23.9.158.105","10.1.30.131","TCP","1514","443  >  54829 [ACK] Seq=127531 Ack=1 Win=614 Len=1448 TSval=1263396372 TSecr=1832919651 [TCP PDU reassembled in 109]"
"104","0.041766","23.9.158.105","10.1.30.131","TCP","1514","443  >  54829 [ACK] Seq=128979 Ack=1 Win=614 Len=1448 TSval=1263396372 TSecr=1832919651 [TCP PDU reassembled in 109]"
"105","0.041767","23.9.158.105","10.1.30.131","TCP","1514","443  >  54829 [ACK] Seq=130427 Ack=1 Win=614 Len=1448 TSval=1263396372 TSecr=1832919651 [TCP PDU reassembled in 109]"
"106","0.041768","23.9.158.105","10.1.30.131","TCP","1514","443  >  54829 [ACK] Seq=131875 Ack=1 Win=614 Len=1448 TSval=1263396372 TSecr=1832919651 [TCP PDU reassembled in 109]"
"107","0.041769","23.9.158.105","10.1.30.131","TCP","1514","443  >  54829 [ACK] Seq=133323 Ack=1 Win=614 Len=1448 TSval=1263396372 TSecr=1832919651 [TCP PDU reassembled in 109]"
"108","0.041769","23.9.158.105","10.1.30.131","TCP","1514","443  >  54829 [ACK] Seq=134771 Ack=1 Win=614 Len=1448 TSval=1263396372 TSecr=1832919651 [TCP PDU reassembled in 109]"
"109","0.041770","23.9.158.105","10.1.30.131","TLSv1.2","1514","Application Data, Application Data"
"110","0.041771","23.9.158.105","10.1.30.131","TCP","1514","443  >  54829 [ACK] Seq=137667 Ack=1 Win=614 Len=1448 TSval=1263396372 TSecr=1832919651 [TCP PDU reassembled in 121]"
"111","0.042025","10.1.30.131","23.9.158.105","TCP","66","54829  >  443 [ACK] Seq=1 Ack=139115 Win=65535 Len=0 TSval=1832919693 TSecr=1263396372"
"112","0.042450","23.9.158.105","10.1.30.131","TCP","1514","443  >  54829 [ACK] Seq=139115 Ack=1 Win=614 Len=1448 TSval=1263396372 TSecr=1832919651 [TCP PDU reassembled in 121]"
"113","0.042451","23.9.158.105","10.1.30.131","TCP","1514","443  >  54829 [ACK] Seq=140563 Ack=1 Win=614 Len=1448 TSval=1263396372 TSecr=1832919651 [TCP PDU reassembled in 121]"
"114","0.042451","23.9.158.105","10.1.30.131","TCP","1514","443  >  54829 [ACK] Seq=142011 Ack=1 Win=614 Len=1448 TSval=1263396372 TSecr=1832919651 [TCP PDU reassembled in 121]"
"115","0.042453","23.9.158.105","10.1.30.131","TCP","1514","443  >  54829 [ACK] Seq=143459 Ack=1 Win=614 Len=1448 TSval=1263396372 TSecr=1832919651 [TCP PDU reassembled in 121]"
"116","0.042453","23.9.158.105","10.1.30.131","TCP","1514","443  >  54829 [ACK] Seq=144907 Ack=1 Win=614 Len=1448 TSval=1263396372 TSecr=1832919651 [TCP PDU reassembled in 121]"
"117","0.042454","23.9.158.105","10.1.30.131","TCP","1514","443  >  54829 [ACK] Seq=146355 Ack=1 Win=614 Len=1448 TSval=1263396372 TSecr=1832919651 [TCP PDU reassembled in 121]"
"118","0.042455","23.9.158.105","10.1.30.131","TCP","1514","443  >  54829 [ACK] Seq=147803 Ack=1 Win=614 Len=1448 TSval=1263396372 TSecr=1832919651 [TCP PDU reassembled in 121]"
"119","0.042456","23.9.158.105","10.1.30.131","TCP","1514","443  >  54829 [PSH, ACK] Seq=149251 Ack=1 Win=614 Len=1448 TSval=1263396372 TSecr=1832919651 [TCP PDU reassembled in 121]"
"120","0.042457","23.9.158.105","10.1.30.131","TCP","1514","443  >  54829 [ACK] Seq=150699 Ack=1 Win=614 Len=1448 TSval=1263396373 TSecr=1832919651 [TCP PDU reassembled in 121]"
"121","0.042457","23.9.158.105","10.1.30.131","TLSv1.2","1514","Application Data, Application Data"
"122","0.042458","23.9.158.105","10.1.30.131","TCP","1514","443  >  54829 [ACK] Seq=153595 Ack=1 Win=614 Len=1448 TSval=1263396373 TSecr=1832919651 [TCP PDU reassembled in 132]"
"123","0.042459","23.9.158.105","10.1.30.131","TCP","1514","443  >  54829 [ACK] Seq=155043 Ack=1 Win=614 Len=1448 TSval=1263396373 TSecr=1832919651 [TCP PDU reassembled in 132]"
"124","0.042460","23.9.158.105","10.1.30.131","TCP","1514","443  >  54829 [ACK] Seq=156491 Ack=1 Win=614 Len=1448 TSval=1263396373 TSecr=1832919651 [TCP PDU reassembled in 132]"
"125","0.042461","23.9.158.105","10.1.30.131","TCP","1514","443  >  54829 [ACK] Seq=157939 Ack=1 Win=614 Len=1448 TSval=1263396373 TSecr=1832919651 [TCP PDU reassembled in 132]"
"126","0.042462","23.9.158.105","10.1.30.131","TCP","1514","443  >  54829 [ACK] Seq=159387 Ack=1 Win=614 Len=1448 TSval=1263396373 TSecr=1832919651 [TCP PDU reassembled in 132]"
"127","0.042462","23.9.158.105","10.1.30.131","TCP","1514","443  >  54829 [ACK] Seq=160835 Ack=1 Win=614 Len=1448 TSval=1263396373 TSecr=1832919651 [TCP PDU reassembled in 132]"
"128","0.042463","23.9.158.105","10.1.30.131","TCP","1514","443  >  54829 [ACK] Seq=162283 Ack=1 Win=614 Len=1448 TSval=1263396373 TSecr=1832919651 [TCP PDU reassembled in 132]"
"129","0.042464","23.9.158.105","10.1.30.131","TCP","1514","443  >  54829 [ACK] Seq=163731 Ack=1 Win=614 Len=1448 TSval=1263396373 TSecr=1832919651 [TCP PDU reassembled in 132]"
"130","0.042464","23.9.158.105","10.1.30.131","TCP","1514","443  >  54829 [ACK] Seq=165179 Ack=1 Win=614 Len=1448 TSval=1263396373 TSecr=1832919651 [TCP PDU reassembled in 132]"
"131","0.042465","23.9.158.105","10.1.30.131","TCP","1514","443  >  54829 [ACK] Seq=166627 Ack=1 Win=614 Len=1448 TSval=1263396373 TSecr=1832919651 [TCP PDU reassembled in 132]"
"132","0.042466","23.9.158.105","10.1.30.131","TLSv1.2","1514","Application Data, Application Data"
"133","0.042467","23.9.158.105","10.1.30.131","TCP","1514","443  >  54829 [ACK] Seq=169523 Ack=1 Win=614 Len=1448 TSval=1263396373 TSecr=1832919651 [TCP PDU reassembled in 145]"
"134","0.042468","23.9.158.105","10.1.30.131","TCP","1514","443  >  54829 [ACK] Seq=170971 Ack=1 Win=614 Len=1448 TSval=1263396373 TSecr=1832919651 [TCP PDU reassembled in 145]"
"135","0.042468","23.9.158.105","10.1.30.131","TCP","1514","443  >  54829 [ACK] Seq=172419 Ack=1 Win=614 Len=1448 TSval=1263396373 TSecr=1832919651 [TCP PDU reassembled in 145]"
"136","0.042469","23.9.158.105","10.1.30.131","TCP","1514","443  >  54829 [ACK] Seq=173867 Ack=1 Win=614 Len=1448 TSval=1263396373 TSecr=1832919651 [TCP PDU reassembled in 145]"
"137","0.042470","23.9.158.105","10.1.30.131","TCP","1514","443  >  54829 [ACK] Seq=175315 Ack=1 Win=614 Len=1448 TSval=1263396373 TSecr=1832919651 [TCP PDU reassembled in 145]"
"138","0.042471","23.9.158.105","10.1.30.131","TCP","1514","443  >  54829 [ACK] Seq=176763 Ack=1 Win=614 Len=1448 TSval=1263396373 TSecr=1832919651 [TCP PDU reassembled in 145]"
"139","0.042472","23.9.158.105","10.1.30.131","TCP","1514","443  >  54829 [ACK] Seq=178211 Ack=1 Win=614 Len=1448 TSval=1263396373 TSecr=1832919651 [TCP PDU reassembled in 145]"
"140","0.042472","23.9.158.105","10.1.30.131","TCP","1514","443  >  54829 [ACK] Seq=179659 Ack=1 Win=614 Len=1448 TSval=1263396373 TSecr=1832919651 [TCP PDU reassembled in 145]"
"141","0.042473","23.9.158.105","10.1.30.131","TCP","1514","443  >  54829 [ACK] Seq=181107 Ack=1 Win=614 Len=1448 TSval=1263396373 TSecr=1832919651 [TCP PDU reassembled in 145]"
"142","0.042474","23.9.158.105","10.1.30.131","TCP","1514","443  >  54829 [ACK] Seq=182555 Ack=1 Win=614 Len=1448 TSval=1263396373 TSecr=1832919651 [TCP PDU reassembled in 145]"
"143","0.042474","23.9.158.105","10.1.30.131","TCP","1514","443  >  54829 [ACK] Seq=184003 Ack=1 Win=614 Len=1448 TSval=1263396373 TSecr=1832919651 [TCP PDU reassembled in 145]"
"144","0.042702","10.1.30.131","23.9.158.105","TCP","66","54829  >  443 [ACK] Seq=1 Ack=185451 Win=65535 Len=0 TSval=1832919693 TSecr=1263396373"
"145","0.043309","23.9.158.105","10.1.30.131","TLSv1.2","1514","Application Data, Application Data"
"146","0.043309","23.9.158.105","10.1.30.131","TCP","1514","443  >  54829 [ACK] Seq=186899 Ack=1 Win=614 Len=1448 TSval=1263396373 TSecr=1832919651 [TCP PDU reassembled in 156]"
"147","0.043310","23.9.158.105","10.1.30.131","TCP","1514","443  >  54829 [ACK] Seq=188347 Ack=1 Win=614 Len=1448 TSval=1263396373 TSecr=1832919651 [TCP PDU reassembled in 156]"
"148","0.043311","23.9.158.105","10.1.30.131","TCP","1514","443  >  54829 [ACK] Seq=189795 Ack=1 Win=614 Len=1448 TSval=1263396373 TSecr=1832919651 [TCP PDU reassembled in 156]"
"149","0.043311","23.9.158.105","10.1.30.131","TCP","1514","443  >  54829 [ACK] Seq=191243 Ack=1 Win=614 Len=1448 TSval=1263396373 TSecr=1832919651 [TCP PDU reassembled in 156]"
"150","0.043312","23.9.158.105","10.1.30.131","TCP","1514","443  >  54829 [ACK] Seq=192691 Ack=1 Win=614 Len=1448 TSval=1263396373 TSecr=1832919651 [TCP PDU reassembled in 156]"
"151","0.043312","23.9.158.105","10.1.30.131","TCP","1514","443  >  54829 [ACK] Seq=194139 Ack=1 Win=614 Len=1448 TSval=1263396373 TSecr=1832919651 [TCP PDU reassembled in 156]"
"152","0.043313","23.9.158.105","10.1.30.131","TCP","1514","443  >  54829 [ACK] Seq=195587 Ack=1 Win=614 Len=1448 TSval=1263396373 TSecr=1832919651 [TCP PDU reassembled in 156]"
"153","0.043313","23.9.158.105","10.1.30.131","TCP","1514","443  >  54829 [ACK] Seq=197035 Ack=1 Win=614 Len=1448 TSval=1263396373 TSecr=1832919651 [TCP PDU reassembled in 156]"
"154","0.043314","23.9.158.105","10.1.30.131","TCP","1514","443  >  54829 [ACK] Seq=198483 Ack=1 Win=614 Len=1448 TSval=1263396373 TSecr=1832919651 [TCP PDU reassembled in 156]"
"155","0.043314","23.9.158.105","10.1.30.131","TCP","1514","443  >  54829 [ACK] Seq=199931 Ack=1 Win=614 Len=1448 TSval=1263396373 TSecr=1832919651 [TCP PDU reassembled in 156]"
"156","0.043315","23.9.158.105","10.1.30.131","TLSv1.2","1514","Application Data, Application Data"
"157","0.043316","23.9.158.105","10.1.30.131","TCP","1514","443  >  54829 [ACK] Seq=202827 Ack=1 Win=614 Len=1448 TSval=1263396373 TSecr=1832919651 [TCP PDU reassembled in 167]"
"158","0.043316","23.9.158.105","10.1.30.131","TCP","1514","443  >  54829 [ACK] Seq=204275 Ack=1 Win=614 Len=1448 TSval=1263396373 TSecr=1832919651 [TCP PDU reassembled in 167]"
"159","0.043317","23.9.158.105","10.1.30.131","TCP","1514","443  >  54829 [ACK] Seq=205723 Ack=1 Win=614 Len=1448 TSval=1263396373 TSecr=1832919651 [TCP PDU reassembled in 167]"
"160","0.043317","23.9.158.105","10.1.30.131","TCP","1514","443  >  54829 [ACK] Seq=207171 Ack=1 Win=614 Len=1448 TSval=1263396373 TSecr=1832919651 [TCP PDU reassembled in 167]"
"161","0.043318","23.9.158.105","10.1.30.131","TCP","1514","443  >  54829 [ACK] Seq=208619 Ack=1 Win=614 Len=1448 TSval=1263396373 TSecr=1832919651 [TCP PDU reassembled in 167]"
"162","0.043318","23.9.158.105","10.1.30.131","TCP","1514","443  >  54829 [ACK] Seq=210067 Ack=1 Win=614 Len=1448 TSval=1263396373 TSecr=1832919651 [TCP PDU reassembled in 167]"
"163","0.043319","23.9.158.105","10.1.30.131","TCP","1514","443  >  54829 [ACK] Seq=211515 Ack=1 Win=614 Len=1448 TSval=1263396373 TSecr=1832919651 [TCP PDU reassembled in 167]"
"164","0.043320","23.9.158.105","10.1.30.131","TCP","1514","443  >  54829 [PSH, ACK] Seq=212963 Ack=1 Win=614 Len=1448 TSval=1263396373 TSecr=1832919651 [TCP PDU reassembled in 167]"
"165","0.043320","23.9.158.105","10.1.30.131","TCP","1514","443  >  54829 [ACK] Seq=214411 Ack=1 Win=614 Len=1448 TSval=1263396374 TSecr=1832919651 [TCP PDU reassembled in 167]"
"166","0.043321","23.9.158.105","10.1.30.131","TCP","1514","443  >  54829 [ACK] Seq=215859 Ack=1 Win=614 Len=1448 TSval=1263396374 TSecr=1832919651 [TCP PDU reassembled in 167]"
"167","0.043322","23.9.158.105","10.1.30.131","TLSv1.2","1514","Application Data, Application Data"
"168","0.043322","23.9.158.105","10.1.30.131","TCP","1514","443  >  54829 [ACK] Seq=218755 Ack=1 Win=614 Len=1448 TSval=1263396374 TSecr=1832919651 [TCP PDU reassembled in 179]"
"169","0.043323","23.9.158.105","10.1.30.131","TCP","1514","443  >  54829 [ACK] Seq=220203 Ack=1 Win=614 Len=1448 TSval=1263396374 TSecr=1832919651 [TCP PDU reassembled in 179]"
"170","0.043323","23.9.158.105","10.1.30.131","TCP","1514","443  >  54829 [ACK] Seq=221651 Ack=1 Win=614 Len=1448 TSval=1263396374 TSecr=1832919651 [TCP PDU reassembled in 179]"
"171","0.043324","23.9.158.105","10.1.30.131","TCP","1514","443  >  54829 [ACK] Seq=223099 Ack=1 Win=614 Len=1448 TSval=1263396374 TSecr=1832919651 [TCP PDU reassembled in 179]"
"172","0.043324","23.9.158.105","10.1.30.131","TCP","1514","443  >  54829 [ACK] Seq=224547 Ack=1 Win=614 Len=1448 TSval=1263396374 TSecr=1832919651 [TCP PDU reassembled in 179]"
"173","0.043325","23.9.158.105","10.1.30.131","TCP","1514","443  >  54829 [ACK] Seq=225995 Ack=1 Win=614 Len=1448 TSval=1263396374 TSecr=1832919651 [TCP PDU reassembled in 179]"
"174","0.043326","23.9.158.105","10.1.30.131","TCP","1514","443  >  54829 [ACK] Seq=227443 Ack=1 Win=614 Len=1448 TSval=1263396374 TSecr=1832919651 [TCP PDU reassembled in 179]"
"175","0.043326","23.9.158.105","10.1.30.131","TCP","1514","443  >  54829 [ACK] Seq=228891 Ack=1 Win=614 Len=1448 TSval=1263396374 TSecr=1832919651 [TCP PDU reassembled in 179]"
"176","0.043327","23.9.158.105","10.1.30.131","TCP","1514","443  >  54829 [ACK] Seq=230339 Ack=1 Win=614 Len=1448 TSval=1263396374 TSecr=1832919651 [TCP PDU reassembled in 179]"
"177","0.043327","23.9.158.105","10.1.30.131","TCP","1514","443  >  54829 [ACK] Seq=231787 Ack=1 Win=614 Len=1448 TSval=1263396374 TSecr=1832919651 [TCP PDU reassembled in 179]"
"178","0.043328","23.9.158.105","10.1.30.131","TCP","1514","443  >  54829 [ACK] Seq=233235 Ack=1 Win=614 Len=1448 TSval=1263396374 TSecr=1832919651 [TCP PDU reassembled in 179]"
"179","0.043328","23.9.158.105","10.1.30.131","TLSv1.2","1514","Application Data, Application Data"
"180","0.043329","23.9.158.105","10.1.30.131","TCP","1514","443  >  54829 [ACK] Seq=236131 Ack=1 Win=614 Len=1448 TSval=1263396374 TSecr=1832919651 [TCP PDU reassembled in 190]"
"181","0.043329","23.9.158.105","10.1.30.131","TCP","1514","443  >  54829 [ACK] Seq=237579 Ack=1 Win=614 Len=1448 TSval=1263396374 TSecr=1832919651 [TCP PDU reassembled in 190]"
"182","0.043330","23.9.158.105","10.1.30.131","TCP","1514","443  >  54829 [ACK] Seq=239027 Ack=1 Win=614 Len=1448 TSval=1263396374 TSecr=1832919651 [TCP PDU reassembled in 190]"
"183","0.043330","23.9.158.105","10.1.30.131","TCP","1514","443  >  54829 [ACK] Seq=240475 Ack=1 Win=614 Len=1448 TSval=1263396374 TSecr=1832919651 [TCP PDU reassembled in 190]"
"184","0.043331","23.9.158.105","10.1.30.131","TCP","1514","443  >  54829 [ACK] Seq=241923 Ack=1 Win=614 Len=1448 TSval=1263396374 TSecr=1832919651 [TCP PDU reassembled in 190]"
"185","0.043331","23.9.158.105","10.1.30.131","TCP","1514","443  >  54829 [ACK] Seq=243371 Ack=1 Win=614 Len=1448 TSval=1263396374 TSecr=1832919651 [TCP PDU reassembled in 190]"
"186","0.043332","23.9.158.105","10.1.30.131","TCP","1514","443  >  54829 [ACK] Seq=244819 Ack=1 Win=614 Len=1448 TSval=1263396374 TSecr=1832919651 [TCP PDU reassembled in 190]"
"187","0.043332","23.9.158.105","10.1.30.131","TCP","1514","443  >  54829 [ACK] Seq=246267 Ack=1 Win=614 Len=1448 TSval=1263396374 TSecr=1832919651 [TCP PDU reassembled in 190]"
"188","0.043333","23.9.158.105","10.1.30.131","TCP","1514","443  >  54829 [ACK] Seq=247715 Ack=1 Win=614 Len=1448 TSval=1263396374 TSecr=1832919651 [TCP PDU reassembled in 190]"
"189","0.043334","23.9.158.105","10.1.30.131","TCP","1514","443  >  54829 [ACK] Seq=249163 Ack=1 Win=614 Len=1448 TSval=1263396374 TSecr=1832919651 [TCP PDU reassembled in 190]"
"190","0.043334","23.9.158.105","10.1.30.131","TLSv1.2","1514","Application Data, Application Data"
"191","0.043722","10.1.30.131","23.9.158.105","TCP","66","54829  >  443 [ACK] Seq=1 Ack=252059 Win=65535 Len=0 TSval=1832919695 TSecr=1263396373"
"192","0.044746","23.9.158.105","10.1.30.131","TCP","1514","443  >  54829 [ACK] Seq=252059 Ack=1 Win=614 Len=1448 TSval=1263396374 TSecr=1832919651 [TCP PDU reassembled in 202]"
"193","0.044746","23.9.158.105","10.1.30.131","TCP","1514","443  >  54829 [ACK] Seq=253507 Ack=1 Win=614 Len=1448 TSval=1263396374 TSecr=1832919651 [TCP PDU reassembled in 202]"
"194","0.044747","23.9.158.105","10.1.30.131","TCP","1514","443  >  54829 [ACK] Seq=254955 Ack=1 Win=614 Len=1448 TSval=1263396374 TSecr=1832919651 [TCP PDU reassembled in 202]"
"195","0.044748","23.9.158.105","10.1.30.131","TCP","1514","443  >  54829 [ACK] Seq=256403 Ack=1 Win=614 Len=1448 TSval=1263396374 TSecr=1832919651 [TCP PDU reassembled in 202]"
"196","0.044748","23.9.158.105","10.1.30.131","TCP","1514","443  >  54829 [ACK] Seq=257851 Ack=1 Win=614 Len=1448 TSval=1263396374 TSecr=1832919651 [TCP PDU reassembled in 202]"
"197","0.044749","23.9.158.105","10.1.30.131","TCP","1514","443  >  54829 [ACK] Seq=259299 Ack=1 Win=614 Len=1448 TSval=1263396374 TSecr=1832919651 [TCP PDU reassembled in 202]"
"198","0.044749","23.9.158.105","10.1.30.131","TCP","1514","443  >  54829 [ACK] Seq=260747 Ack=1 Win=614 Len=1448 TSval=1263396374 TSecr=1832919651 [TCP PDU reassembled in 202]"
"199","0.044750","23.9.158.105","10.1.30.131","TCP","1514","443  >  54829 [ACK] Seq=262195 Ack=1 Win=614 Len=1448 TSval=1263396374 TSecr=1832919651 [TCP PDU reassembled in 202]"
"200","0.044750","23.9.158.105","10.1.30.131","TCP","1514","443  >  54829 [ACK] Seq=263643 Ack=1 Win=614 Len=1448 TSval=1263396374 TSecr=1832919651 [TCP PDU reassembled in 202]"
"201","0.044750","23.9.158.105","10.1.30.131","TCP","1514","443  >  54829 [ACK] Seq=265091 Ack=1 Win=614 Len=1448 TSval=1263396374 TSecr=1832919651 [TCP PDU reassembled in 202]"
"202","0.044751","23.9.158.105","10.1.30.131","TLSv1.2","1352","Application Data, Application Data"
"203","0.044751","23.9.158.105","10.1.30.131","TCP","1514","443  >  54829 [ACK] Seq=267825 Ack=1 Win=614 Len=1448 TSval=1263396375 TSecr=1832919651 [TCP PDU reassembled in 206]"
"204","0.044752","23.9.158.105","10.1.30.131","TCP","1514","443  >  54829 [ACK] Seq=269273 Ack=1 Win=614 Len=1448 TSval=1263396375 TSecr=1832919651 [TCP PDU reassembled in 206]"
"205","0.044752","23.9.158.105","10.1.30.131","TCP","1514","443  >  54829 [ACK] Seq=270721 Ack=1 Win=614 Len=1448 TSval=1263396375 TSecr=1832919651 [TCP PDU reassembled in 206]"
"206","0.044753","23.9.158.105","10.1.30.131","TLSv1.2","526","Application Data"
"207","0.044899","10.1.30.131","23.9.158.105","TCP","66","54829  >  443 [ACK] Seq=1 Ack=272629 Win=65535 Len=0 TSval=1832919696 TSecr=1263396374"
"210","0.090597","23.9.158.105","10.1.30.131","TLSv1.2","478","Application Data"
"211","0.090600","23.9.158.105","10.1.30.131","TLSv1.2","1086","Application Data"
"212","0.090601","23.9.158.105","10.1.30.131","TLSv1.2","977","Application Data"
"213","0.090854","10.1.30.131","23.9.158.105","TCP","66","54829  >  443 [ACK] Seq=1 Ack=274972 Win=65535 Len=0 TSval=1832919742 TSecr=1263396423"
"214","0.131181","23.9.158.105","10.1.30.131","TLSv1.2","479","Application Data"
"215","0.131182","23.9.158.105","10.1.30.131","TLSv1.2","1084","Application Data"
"216","0.131420","10.1.30.131","23.9.158.105","TCP","66","54829  >  443 [ACK] Seq=1 Ack=276403 Win=65535 Len=0 TSval=1832919783 TSecr=1263396464"
"217","0.132192","23.9.158.105","10.1.30.131","TCP","1514","443  >  54829 [ACK] Seq=276403 Ack=1 Win=614 Len=1448 TSval=1263396464 TSecr=1832919742 [TCP PDU reassembled in 222]"
"218","0.132193","23.9.158.105","10.1.30.131","TCP","1514","443  >  54829 [ACK] Seq=277851 Ack=1 Win=614 Len=1448 TSval=1263396464 TSecr=1832919742 [TCP PDU reassembled in 222]"
"219","0.132193","23.9.158.105","10.1.30.131","TCP","1514","443  >  54829 [ACK] Seq=279299 Ack=1 Win=614 Len=1448 TSval=1263396464 TSecr=1832919742 [TCP PDU reassembled in 222]"
"220","0.132194","23.9.158.105","10.1.30.131","TCP","1514","443  >  54829 [ACK] Seq=280747 Ack=1 Win=614 Len=1448 TSval=1263396464 TSecr=1832919742 [TCP PDU reassembled in 222]"
"221","0.132195","23.9.158.105","10.1.30.131","TCP","1514","443  >  54829 [ACK] Seq=282195 Ack=1 Win=614 Len=1448 TSval=1263396464 TSecr=1832919742 [TCP PDU reassembled in 222]"
"222","0.132195","23.9.158.105","10.1.30.131","TLSv1.2","442","Application Data"
"223","0.132289","10.1.30.131","23.9.158.105","TCP","66","54829  >  443 [ACK] Seq=1 Ack=284019 Win=65535 Len=0 TSval=1832919784 TSecr=1263396464"
"233","0.263670","10.1.30.131","23.9.158.105","TLSv1.2","423","Application Data"
"234","0.263966","10.1.30.131","23.9.158.105","TLSv1.2","283","Application Data"
"235","0.264126","10.1.30.131","23.9.158.105","TLSv1.2","284","Application Data"
"236","0.265240","10.1.30.131","23.9.158.105","TLSv1.2","301","Application Data"
"237","0.274550","23.9.158.105","10.1.30.131","TCP","66","443  >  54829 [ACK] Seq=284019 Ack=575 Win=659 Len=0 TSval=1263396607 TSecr=1832919915"
"238","0.275017","23.9.158.105","10.1.30.131","TCP","66","443  >  54829 [ACK] Seq=284019 Ack=1028 Win=705 Len=0 TSval=1263396608 TSecr=1832919915"
"239","0.307224","23.9.158.105","10.1.30.131","TLSv1.2","442","Application Data"
"240","0.307225","23.9.158.105","10.1.30.131","TLSv1.2","1342","Application Data"
"241","0.307481","10.1.30.131","23.9.158.105","TCP","66","54829  >  443 [ACK] Seq=1028 Ack=285671 Win=65535 Len=0 TSval=1832919959 TSecr=1263396640"
"242","0.311483","23.9.158.105","10.1.30.131","TLSv1.2","955","Application Data"
"243","0.311484","23.9.158.105","10.1.30.131","TLSv1.2","876","Application Data"
"244","0.311718","10.1.30.131","23.9.158.105","TCP","66","54829  >  443 [ACK] Seq=1028 Ack=287370 Win=65535 Len=0 TSval=1832919963 TSecr=1263396643"
"245","0.314755","23.9.158.105","10.1.30.131","TLSv1.2","443","Application Data"
"246","0.314755","23.9.158.105","10.1.30.131","TLSv1.2","1342","Application Data"
"247","0.314960","10.1.30.131","23.9.158.105","TCP","66","54829  >  443 [ACK] Seq=1028 Ack=289023 Win=65535 Len=0 TSval=1832919966 TSecr=1263396647"
"248","0.333595","10.1.30.131","23.9.158.105","TLSv1.2","616","Application Data"
"249","0.333868","10.1.30.131","23.9.158.105","TLSv1.2","792","Application Data"
"250","0.334091","10.1.30.131","23.9.158.105","TLSv1.2","364","Application Data"
"251","0.344496","23.9.158.105","10.1.30.131","TCP","66","443  >  54829 [ACK] Seq=289023 Ack=2602 Win=741 Len=0 TSval=1263396677 TSecr=1832919985"
"252","0.364610","23.9.158.105","10.1.30.131","TLSv1.2","443","Application Data"
"253","0.364610","23.9.158.105","10.1.30.131","TLSv1.2","1342","Application Data"
"254","0.364672","10.1.30.131","23.9.158.105","TCP","66","54829  >  443 [ACK] Seq=2602 Ack=290676 Win=65509 Len=0 TSval=1832920016 TSecr=1263396697"
"255","0.364860","10.1.30.131","23.9.158.105","TLSv1.2","101","Application Data"
"256","0.411654","23.9.158.105","10.1.30.131","TLSv1.2","430","Application Data"
"257","0.411655","23.9.158.105","10.1.30.131","TLSv1.2","901","Application Data"
"258","0.411656","23.9.158.105","10.1.30.131","TLSv1.2","443","Application Data"
"259","0.411656","23.9.158.105","10.1.30.131","TLSv1.2","942","Application Data"
"260","0.411656","23.9.158.105","10.1.30.131","TCP","1514","443  >  54829 [ACK] Seq=293128 Ack=2637 Win=744 Len=1448 TSval=1263396743 TSecr=1832920016 [TCP PDU reassembled in 271]"
"261","0.411657","23.9.158.105","10.1.30.131","TCP","1514","443  >  54829 [ACK] Seq=294576 Ack=2637 Win=744 Len=1448 TSval=1263396743 TSecr=1832920016 [TCP PDU reassembled in 271]"
"262","0.411658","23.9.158.105","10.1.30.131","TCP","1514","443  >  54829 [ACK] Seq=296024 Ack=2637 Win=744 Len=1448 TSval=1263396743 TSecr=1832920016 [TCP PDU reassembled in 271]"
"263","0.411658","23.9.158.105","10.1.30.131","TCP","1514","443  >  54829 [ACK] Seq=297472 Ack=2637 Win=744 Len=1448 TSval=1263396743 TSecr=1832920016 [TCP PDU reassembled in 271]"
"264","0.411658","23.9.158.105","10.1.30.131","TCP","1514","443  >  54829 [ACK] Seq=298920 Ack=2637 Win=744 Len=1448 TSval=1263396743 TSecr=1832920016 [TCP PDU reassembled in 271]"
"265","0.411659","23.9.158.105","10.1.30.131","TCP","1514","443  >  54829 [ACK] Seq=300368 Ack=2637 Win=744 Len=1448 TSval=1263396743 TSecr=1832920016 [TCP PDU reassembled in 271]"
"266","0.411660","23.9.158.105","10.1.30.131","TCP","1514","443  >  54829 [ACK] Seq=301816 Ack=2637 Win=744 Len=1448 TSval=1263396743 TSecr=1832920016 [TCP PDU reassembled in 271]"
"267","0.411660","23.9.158.105","10.1.30.131","TCP","1514","443  >  54829 [ACK] Seq=303264 Ack=2637 Win=744 Len=1448 TSval=1263396743 TSecr=1832920016 [TCP PDU reassembled in 271]"
"268","0.411661","23.9.158.105","10.1.30.131","TCP","1514","443  >  54829 [ACK] Seq=304712 Ack=2637 Win=744 Len=1448 TSval=1263396743 TSecr=1832920016 [TCP PDU reassembled in 271]"
