"No.","Time","Source","Destination","Protocol","Length","Info"
"11","1.902466","100.86.243.187","23.13.164.38","TLSv1.2","737","Application Data"
"12","1.953637","23.13.164.38","100.86.243.187","TCP","66","443  >  54993 [ACK] Seq=1 Ack=672 Win=5280 Len=0 TSval=1115424137 TSecr=931390443"
"13","1.972271","23.13.164.38","100.86.243.187","TLSv1.2","432","Application Data"
"14","1.972272","23.13.164.38","100.86.243.187","TLSv1.2","1055","Application Data"
"15","1.972272","23.13.164.38","100.86.243.187","TCP","1514","443  >  54993 [ACK] Seq=1356 Ack=672 Win=5280 Len=1448 TSval=1115424156 TSecr=931390443 [TCP PDU reassembled in 27]"
"16","1.972389","100.86.243.187","23.13.164.38","TCP","66","54993  >  443 [ACK] Seq=672 Ack=2804 Win=37412 Len=0 TSval=931390513 TSecr=1115424156"
"17","1.974191","23.13.164.38","100.86.243.187","TCP","1514","443  >  54993 [ACK] Seq=2804 Ack=672 Win=5280 Len=1448 TSval=1115424156 TSecr=931390443 [TCP PDU reassembled in 27]"
"18","1.974193","23.13.164.38","100.86.243.187","TCP","1514","443  >  54993 [ACK] Seq=4252 Ack=672 Win=5280 Len=1448 TSval=1115424156 TSecr=931390443 [TCP PDU reassembled in 27]"
"19","1.974194","23.13.164.38","100.86.243.187","TCP","1514","443  >  54993 [ACK] Seq=5700 Ack=672 Win=5280 Len=1448 TSval=1115424156 TSecr=931390443 [TCP PDU reassembled in 27]"
"20","1.974194","23.13.164.38","100.86.243.187","TCP","1514","443  >  54993 [ACK] Seq=7148 Ack=672 Win=5280 Len=1448 TSval=1115424156 TSecr=931390443 [TCP PDU reassembled in 27]"
"21","1.974195","23.13.164.38","100.86.243.187","TCP","1514","443  >  54993 [ACK] Seq=8596 Ack=672 Win=5280 Len=1448 TSval=1115424156 TSecr=931390443 [TCP PDU reassembled in 27]"
"22","1.974196","23.13.164.38","100.86.243.187","TCP","1514","443  >  54993 [ACK] Seq=10044 Ack=672 Win=5280 Len=1448 TSval=1115424156 TSecr=931390443 [TCP PDU reassembled in 27]"
"23","1.974197","23.13.164.38","100.86.243.187","TCP","1514","443  >  54993 [PSH, ACK] Seq=11492 Ack=672 Win=5280 Len=1448 TSval=1115424156 TSecr=931390443 [TCP PDU reassembled in 27]"
"24","1.974197","23.13.164.38","100.86.243.187","TCP","1514","443  >  54993 [ACK] Seq=12940 Ack=672 Win=5280 Len=1448 TSval=1115424156 TSecr=931390443 [TCP PDU reassembled in 27]"
"25","1.974198","23.13.164.38","100.86.243.187","TCP","1514","443  >  54993 [ACK] Seq=14388 Ack=672 Win=5280 Len=1448 TSval=1115424156 TSecr=931390443 [TCP PDU reassembled in 27]"
"26","1.974198","23.13.164.38","100.86.243.187","TCP","1514","443  >  54993 [ACK] Seq=15836 Ack=672 Win=5280 Len=1448 TSval=1115424156 TSecr=931390443 [TCP PDU reassembled in 27]"
"27","1.974199","23.13.164.38","100.86.243.187","TLSv1.2","544","Application Data"
"28","1.974200","23.13.164.38","100.86.243.187","TLSv1.2","1514","Application Data"
"29","1.974200","23.13.164.38","100.86.243.187","TCP","1514","443  >  54993 [ACK] Seq=19210 Ack=672 Win=5280 Len=1448 TSval=1115424157 TSecr=931390443 [TCP PDU reassembled in 42]"
"30","1.974201","23.13.164.38","100.86.243.187","TCP","1514","443  >  54993 [ACK] Seq=20658 Ack=672 Win=5280 Len=1448 TSval=1115424157 TSecr=931390443 [TCP PDU reassembled in 42]"
"31","1.974310","100.86.243.187","23.13.164.38","TCP","66","54993  >  443 [ACK] Seq=672 Ack=17762 Win=37222 Len=0 TSval=931390515 TSecr=1115424156"
"32","1.974388","100.86.243.187","23.13.164.38","TCP","66","54993  >  443 [ACK] Seq=672 Ack=22106 Win=37154 Len=0 TSval=931390515 TSecr=1115424157"
"33","1.974511","100.86.243.187","23.13.164.38","TCP","66","[TCP Window Update] 54993  >  443 [ACK] Seq=672 Ack=22106 Win=37456 Len=0 TSval=931390515 TSecr=1115424157"
"34","1.975383","23.13.164.38","100.86.243.187","TCP","1514","443  >  54993 [ACK] Seq=22106 Ack=672 Win=5280 Len=1448 TSval=1115424157 TSecr=931390443 [TCP PDU reassembled in 42]"
"35","1.975385","23.13.164.38","100.86.243.187","TCP","1514","443  >  54993 [ACK] Seq=23554 Ack=672 Win=5280 Len=1448 TSval=1115424157 TSecr=931390443 [TCP PDU reassembled in 42]"
"36","1.975385","23.13.164.38","100.86.243.187","TCP","1514","443  >  54993 [ACK] Seq=25002 Ack=672 Win=5280 Len=1448 TSval=1115424157 TSecr=931390443 [TCP PDU reassembled in 42]"
"37","1.975386","23.13.164.38","100.86.243.187","TCP","1514","443  >  54993 [ACK] Seq=26450 Ack=672 Win=5280 Len=1448 TSval=1115424157 TSecr=931390443 [TCP PDU reassembled in 42]"
"38","1.975387","23.13.164.38","100.86.243.187","TCP","1514","443  >  54993 [PSH, ACK] Seq=27898 Ack=672 Win=5280 Len=1448 TSval=1115424157 TSecr=931390443 [TCP PDU reassembled in 42]"
"39","1.975387","23.13.164.38","100.86.243.187","TCP","1514","443  >  54993 [ACK] Seq=29346 Ack=672 Win=5280 Len=1448 TSval=1115424158 TSecr=931390443 [TCP PDU reassembled in 42]"
"40","1.975388","23.13.164.38","100.86.243.187","TCP","1514","443  >  54993 [ACK] Seq=30794 Ack=672 Win=5280 Len=1448 TSval=1115424158 TSecr=931390443 [TCP PDU reassembled in 42]"
"41","1.975389","23.13.164.38","100.86.243.187","TCP","1514","443  >  54993 [ACK] Seq=32242 Ack=672 Win=5280 Len=1448 TSval=1115424158 TSecr=931390443 [TCP PDU reassembled in 42]"
"42","1.975389","23.13.164.38","100.86.243.187","TLSv1.2","1514","Application Data, Application Data"
"43","1.975390","23.13.164.38","100.86.243.187","TCP","1514","443  >  54993 [ACK] Seq=35138 Ack=672 Win=5280 Len=1448 TSval=1115424158 TSecr=931390443 [TCP PDU reassembled in 58]"
"44","1.975391","23.13.164.38","100.86.243.187","TCP","1514","443  >  54993 [ACK] Seq=36586 Ack=672 Win=5280 Len=1448 TSval=1115424158 TSecr=931390443 [TCP PDU reassembled in 58]"
"45","1.975391","23.13.164.38","100.86.243.187","TCP","1514","443  >  54993 [ACK] Seq=38034 Ack=672 Win=5280 Len=1448 TSval=1115424158 TSecr=931390443 [TCP PDU reassembled in 58]"
"46","1.975478","100.86.243.187","23.13.164.38","TCP","66","54993  >  443 [ACK] Seq=672 Ack=38034 Win=37207 Len=0 TSval=931390516 TSecr=1115424158"
"47","1.975548","23.13.164.38","100.86.243.187","TCP","1514","443  >  54993 [PSH, ACK] Seq=39482 Ack=672 Win=5280 Len=1448 TSval=1115424158 TSecr=931390443 [TCP PDU reassembled in 58]"
"48","1.975549","23.13.164.38","100.86.243.187","TCP","1514","443  >  54993 [ACK] Seq=40930 Ack=672 Win=5280 Len=1448 TSval=1115424158 TSecr=931390443 [TCP PDU reassembled in 58]"
"49","1.975570","100.86.243.187","23.13.164.38","TCP","66","54993  >  443 [ACK] Seq=672 Ack=39482 Win=37184 Len=0 TSval=931390516 TSecr=1115424158"
"50","1.975613","100.86.243.187","23.13.164.38","TCP","66","54993  >  443 [ACK] Seq=672 Ack=42378 Win=37328 Len=0 TSval=931390516 TSecr=1115424158"
"51","1.975661","23.13.164.38","100.86.243.187","TCP","1514","443  >  54993 [ACK] Seq=42378 Ack=672 Win=5280 Len=1448 TSval=1115424158 TSecr=931390443 [TCP PDU reassembled in 58]"
"52","1.975662","23.13.164.38","100.86.243.187","TCP","1514","443  >  54993 [ACK] Seq=43826 Ack=672 Win=5280 Len=1448 TSval=1115424158 TSecr=931390443 [TCP PDU reassembled in 58]"
"53","1.975716","100.86.243.187","23.13.164.38","TCP","66","54993  >  443 [ACK] Seq=672 Ack=45274 Win=37283 Len=0 TSval=931390516 TSecr=1115424158"
"54","1.975740","100.86.243.187","23.13.164.38","TCP","66","[TCP Window Update] 54993  >  443 [ACK] Seq=672 Ack=45274 Win=37456 Len=0 TSval=931390516 TSecr=1115424158"
"55","1.977018","23.13.164.38","100.86.243.187","TCP","1514","443  >  54993 [ACK] Seq=45274 Ack=672 Win=5280 Len=1448 TSval=1115424158 TSecr=931390443 [TCP PDU reassembled in 58]"
"56","1.977020","23.13.164.38","100.86.243.187","TCP","1514","443  >  54993 [ACK] Seq=46722 Ack=672 Win=5280 Len=1448 TSval=1115424158 TSecr=931390443 [TCP PDU reassembled in 58]"
"57","1.977021","23.13.164.38","100.86.243.187","TCP","1514","443  >  54993 [ACK] Seq=48170 Ack=672 Win=5280 Len=1448 TSval=1115424158 TSecr=931390443 [TCP PDU reassembled in 58]"
"58","1.977022","23.13.164.38","100.86.243.187","TLSv1.2","1514","Application Data, Application Data"
"59","1.977023","23.13.164.38","100.86.243.187","TCP","1514","443  >  54993 [PSH, ACK] Seq=51066 Ack=672 Win=5280 Len=1448 TSval=1115424158 TSecr=931390443 [TCP PDU reassembled in 74]"
"60","1.977023","23.13.164.38","100.86.243.187","TCP","1514","443  >  54993 [ACK] Seq=52514 Ack=672 Win=5280 Len=1448 TSval=1115424159 TSecr=931390443 [TCP PDU reassembled in 74]"
"61","1.977024","23.13.164.38","100.86.243.187","TCP","1514","443  >  54993 [ACK] Seq=53962 Ack=672 Win=5280 Len=1448 TSval=1115424159 TSecr=931390443 [TCP PDU reassembled in 74]"
"62","1.977025","23.13.164.38","100.86.243.187","TCP","1514","443  >  54993 [ACK] Seq=55410 Ack=672 Win=5280 Len=1448 TSval=1115424159 TSecr=931390443 [TCP PDU reassembled in 74]"
"63","1.977026","23.13.164.38","100.86.243.187","TCP","1514","443  >  54993 [ACK] Seq=56858 Ack=672 Win=5280 Len=1448 TSval=1115424159 TSecr=931390443 [TCP PDU reassembled in 74]"
"64","1.977027","23.13.164.38","100.86.243.187","TCP","1514","443  >  54993 [ACK] Seq=58306 Ack=672 Win=5280 Len=1448 TSval=1115424159 TSecr=931390443 [TCP PDU reassembled in 74]"
"65","1.977027","23.13.164.38","100.86.243.187","TCP","1514","443  >  54993 [ACK] Seq=59754 Ack=672 Win=5280 Len=1448 TSval=1115424159 TSecr=931390443 [TCP PDU reassembled in 74]"
"66","1.977028","23.13.164.38","100.86.243.187","TCP","1514","443  >  54993 [ACK] Seq=61202 Ack=672 Win=5280 Len=1448 TSval=1115424159 TSecr=931390443 [TCP PDU reassembled in 74]"
"67","1.977137","100.86.243.187","23.13.164.38","TCP","66","54993  >  443 [ACK] Seq=672 Ack=61202 Win=37207 Len=0 TSval=931390518 TSecr=1115424159"
"68","1.977179","100.86.243.187","23.13.164.38","TCP","66","54993  >  443 [ACK] Seq=672 Ack=62650 Win=37184 Len=0 TSval=931390518 TSecr=1115424159"
"69","1.977346","100.86.243.187","23.13.164.38","TCP","66","[TCP Window Update] 54993  >  443 [ACK] Seq=672 Ack=62650 Win=37456 Len=0 TSval=931390518 TSecr=1115424159"
"70","1.977540","23.13.164.38","100.86.243.187","TCP","1514","443  >  54993 [PSH, ACK] Seq=62650 Ack=672 Win=5280 Len=1448 TSval=1115424159 TSecr=931390443 [TCP PDU reassembled in 74]"
"71","1.977541","23.13.164.38","100.86.243.187","TCP","1514","443  >  54993 [ACK] Seq=64098 Ack=672 Win=5280 Len=1448 TSval=1115424160 TSecr=931390443 [TCP PDU reassembled in 74]"
"72","1.977594","100.86.243.187","23.13.164.38","TCP","66","54993  >  443 [ACK] Seq=672 Ack=65546 Win=37410 Len=0 TSval=931390518 TSecr=1115424160"
"73","1.977625","23.13.164.38","100.86.243.187","TCP","1514","443  >  54993 [ACK] Seq=65546 Ack=672 Win=5280 Len=1448 TSval=1115424160 TSecr=931390443 [TCP PDU reassembled in 74]"
"74","1.977626","23.13.164.38","100.86.243.187","TLSv1.2","1514","Application Data, Application Data"
"75","1.977651","100.86.243.187","23.13.164.38","TCP","66","[TCP Window Update] 54993  >  443 [ACK] Seq=672 Ack=65546 Win=37456 Len=0 TSval=931390518 TSecr=1115424160"
"76","1.977664","100.86.243.187","23.13.164.38","TCP","66","54993  >  443 [ACK] Seq=672 Ack=68442 Win=37410 Len=0 TSval=931390518 TSecr=1115424160"
"77","1.977788","100.86.243.187","23.13.164.38","TCP","66","[TCP Window Update] 54993  >  443 [ACK] Seq=672 Ack=68442 Win=37456 Len=0 TSval=931390518 TSecr=1115424160"
"78","1.979076","23.13.164.38","100.86.243.187","TCP","1514","443  >  54993 [ACK] Seq=68442 Ack=672 Win=5280 Len=1448 TSval=1115424160 TSecr=931390443 [TCP PDU reassembled in 88]"
"79","1.979078","23.13.164.38","100.86.243.187","TCP","1514","443  >  54993 [ACK] Seq=69890 Ack=672 Win=5280 Len=1448 TSval=1115424160 TSecr=931390443 [TCP PDU reassembled in 88]"
"80","1.979079","23.13.164.38","100.86.243.187","TCP","1514","443  >  54993 [ACK] Seq=71338 Ack=672 Win=5280 Len=1448 TSval=1115424160 TSecr=931390443 [TCP PDU reassembled in 88]"
"81","1.979080","23.13.164.38","100.86.243.187","TCP","1514","443  >  54993 [ACK] Seq=72786 Ack=672 Win=5280 Len=1448 TSval=1115424160 TSecr=931390443 [TCP PDU reassembled in 88]"
"82","1.979080","23.13.164.38","100.86.243.187","TCP","1514","443  >  54993 [PSH, ACK] Seq=74234 Ack=672 Win=5280 Len=1448 TSval=1115424160 TSecr=931390443 [TCP PDU reassembled in 88]"
"83","1.979081","23.13.164.38","100.86.243.187","TCP","1514","443  >  54993 [ACK] Seq=75682 Ack=672 Win=5280 Len=1448 TSval=1115424161 TSecr=931390443 [TCP PDU reassembled in 88]"
"84","1.979082","23.13.164.38","100.86.243.187","TCP","1514","443  >  54993 [ACK] Seq=77130 Ack=672 Win=5280 Len=1448 TSval=1115424161 TSecr=931390443 [TCP PDU reassembled in 88]"
"85","1.979083","23.13.164.38","100.86.243.187","TCP","1514","443  >  54993 [ACK] Seq=78578 Ack=672 Win=5280 Len=1448 TSval=1115424161 TSecr=931390443 [TCP PDU reassembled in 88]"
"86","1.979084","23.13.164.38","100.86.243.187","TCP","1514","443  >  54993 [ACK] Seq=80026 Ack=672 Win=5280 Len=1448 TSval=1115424161 TSecr=931390443 [TCP PDU reassembled in 88]"
"87","1.979085","23.13.164.38","100.86.243.187","TCP","1514","443  >  54993 [ACK] Seq=81474 Ack=672 Win=5280 Len=1448 TSval=1115424161 TSecr=931390443 [TCP PDU reassembled in 88]"
"88","1.979086","23.13.164.38","100.86.243.187","TLSv1.2","1514","Application Data, Application Data"
"89","1.979087","23.13.164.38","100.86.243.187","TCP","1514","443  >  54993 [ACK] Seq=84370 Ack=672 Win=5280 Len=1448 TSval=1115424161 TSecr=931390443 [TCP PDU reassembled in 103]"
"90","1.979194","100.86.243.187","23.13.164.38","TCP","66","54993  >  443 [ACK] Seq=672 Ack=84370 Win=37207 Len=0 TSval=931390520 TSecr=1115424161"
"91","1.979264","100.86.243.187","23.13.164.38","TCP","66","54993  >  443 [ACK] Seq=672 Ack=85818 Win=37184 Len=0 TSval=931390520 TSecr=1115424161"
"92","1.979326","23.13.164.38","100.86.243.187","TCP","1514","443  >  54993 [PSH, ACK] Seq=85818 Ack=672 Win=5280 Len=1448 TSval=1115424161 TSecr=931390443 [TCP PDU reassembled in 103]"
"93","1.979327","23.13.164.38","100.86.243.187","TCP","1514","443  >  54993 [ACK] Seq=87266 Ack=672 Win=5280 Len=1448 TSval=1115424162 TSecr=931390443 [TCP PDU reassembled in 103]"
"94","1.979328","23.13.164.38","100.86.243.187","TCP","1514","443  >  54993 [ACK] Seq=88714 Ack=672 Win=5280 Len=1448 TSval=1115424162 TSecr=931390443 [TCP PDU reassembled in 103]"
"95","1.979329","23.13.164.38","100.86.243.187","TCP","1514","443  >  54993 [ACK] Seq=90162 Ack=672 Win=5280 Len=1448 TSval=1115424162 TSecr=931390443 [TCP PDU reassembled in 103]"
"96","1.979374","100.86.243.187","23.13.164.38","TCP","66","54993  >  443 [ACK] Seq=672 Ack=91610 Win=37330 Len=0 TSval=931390520 TSecr=1115424162"
"97","1.979389","100.86.243.187","23.13.164.38","TCP","66","[TCP Window Update] 54993  >  443 [ACK] Seq=672 Ack=91610 Win=37456 Len=0 TSval=931390520 TSecr=1115424162"
"98","1.980837","23.13.164.38","100.86.243.187","TCP","1514","443  >  54993 [ACK] Seq=91610 Ack=672 Win=5280 Len=1448 TSval=1115424162 TSecr=931390443 [TCP PDU reassembled in 103]"
"99","1.980839","23.13.164.38","100.86.243.187","TCP","1514","443  >  54993 [ACK] Seq=93058 Ack=672 Win=5280 Len=1448 TSval=1115424162 TSecr=931390443 [TCP PDU reassembled in 103]"
"100","1.980841","23.13.164.38","100.86.243.187","TCP","1514","443  >  54993 [ACK] Seq=94506 Ack=672 Win=5280 Len=1448 TSval=1115424162 TSecr=931390443 [TCP PDU reassembled in 103]"
"101","1.980843","23.13.164.38","100.86.243.187","TCP","1514","443  >  54993 [ACK] Seq=95954 Ack=672 Win=5280 Len=1448 TSval=1115424162 TSecr=931390443 [TCP PDU reassembled in 103]"
"102","1.980845","23.13.164.38","100.86.243.187","TCP","1514","443  >  54993 [PSH, ACK] Seq=97402 Ack=672 Win=5280 Len=1448 TSval=1115424162 TSecr=931390443 [TCP PDU reassembled in 103]"
"103","1.980847","23.13.164.38","100.86.243.187","TLSv1.2","1514","Application Data, Application Data"
"104","1.980850","23.13.164.38","100.86.243.187","TCP","1514","443  >  54993 [ACK] Seq=100298 Ack=672 Win=5280 Len=1448 TSval=1115424163 TSecr=931390443 [TCP PDU reassembled in 119]"
"105","1.980853","23.13.164.38","100.86.243.187","TCP","1514","443  >  54993 [ACK] Seq=101746 Ack=672 Win=5280 Len=1448 TSval=1115424163 TSecr=931390443 [TCP PDU reassembled in 119]"
"106","1.980855","23.13.164.38","100.86.243.187","TCP","1514","443  >  54993 [ACK] Seq=103194 Ack=672 Win=5280 Len=1448 TSval=1115424163 TSecr=931390443 [TCP PDU reassembled in 119]"
"107","1.980856","23.13.164.38","100.86.243.187","TCP","1514","443  >  54993 [ACK] Seq=104642 Ack=672 Win=5280 Len=1448 TSval=1115424163 TSecr=931390443 [TCP PDU reassembled in 119]"
"108","1.980859","23.13.164.38","100.86.243.187","TCP","1514","443  >  54993 [ACK] Seq=106090 Ack=672 Win=5280 Len=1448 TSval=1115424163 TSecr=931390443 [TCP PDU reassembled in 119]"
"109","1.980861","23.13.164.38","100.86.243.187","TCP","1514","443  >  54993 [ACK] Seq=107538 Ack=672 Win=5280 Len=1448 TSval=1115424163 TSecr=931390443 [TCP PDU reassembled in 119]"
"110","1.981139","100.86.243.187","23.13.164.38","TCP","66","54993  >  443 [ACK] Seq=672 Ack=107538 Win=37207 Len=0 TSval=931390522 TSecr=1115424163"
"111","1.981265","100.86.243.187","23.13.164.38","TCP","66","54993  >  443 [ACK] Seq=672 Ack=108986 Win=37184 Len=0 TSval=931390522 TSecr=1115424163"
"112","1.981487","23.13.164.38","100.86.243.187","TCP","1514","443  >  54993 [PSH, ACK] Seq=108986 Ack=672 Win=5280 Len=1448 TSval=1115424163 TSecr=931390443 [TCP PDU reassembled in 119]"
"113","1.981489","23.13.164.38","100.86.243.187","TCP","1514","443  >  54993 [ACK] Seq=110434 Ack=672 Win=5280 Len=1448 TSval=1115424164 TSecr=931390443 [TCP PDU reassembled in 119]"
"114","1.981545","100.86.243.187","23.13.164.38","TCP","66","[TCP Window Update] 54993  >  443 [ACK] Seq=672 Ack=108986 Win=37456 Len=0 TSval=931390522 TSecr=1115424163"
"115","1.981613","100.86.243.187","23.13.164.38","TCP","66","54993  >  443 [ACK] Seq=672 Ack=111882 Win=37456 Len=0 TSval=931390522 TSecr=1115424164"
"116","1.982952","23.13.164.38","100.86.243.187","TCP","1514","443  >  54993 [ACK] Seq=111882 Ack=672 Win=5280 Len=1448 TSval=1115424164 TSecr=931390443 [TCP PDU reassembled in 119]"
"117","1.982954","23.13.164.38","100.86.243.187","TCP","1514","443  >  54993 [ACK] Seq=113330 Ack=672 Win=5280 Len=1448 TSval=1115424164 TSecr=931390443 [TCP PDU reassembled in 119]"
"118","1.982956","23.13.164.38","100.86.243.187","TCP","1514","443  >  54993 [ACK] Seq=114778 Ack=672 Win=5280 Len=1448 TSval=1115424164 TSecr=931390443 [TCP PDU reassembled in 119]"
"119","1.982957","23.13.164.38","100.86.243.187","TLSv1.2","1514","Application Data, Application Data"
"120","1.982957","23.13.164.38","100.86.243.187","TCP","1514","443  >  54993 [ACK] Seq=117674 Ack=672 Win=5280 Len=1448 TSval=1115424164 TSecr=931390443 [TCP PDU reassembled in 131]"
"121","1.982958","23.13.164.38","100.86.243.187","TCP","1514","443  >  54993 [ACK] Seq=119122 Ack=672 Win=5280 Len=1448 TSval=1115424164 TSecr=931390443 [TCP PDU reassembled in 131]"
"122","1.982959","23.13.164.38","100.86.243.187","TCP","1514","443  >  54993 [ACK] Seq=120570 Ack=672 Win=5280 Len=1448 TSval=1115424164 TSecr=931390443 [TCP PDU reassembled in 131]"
"123","1.982960","23.13.164.38","100.86.243.187","TCP","1514","443  >  54993 [ACK] Seq=122018 Ack=672 Win=5280 Len=1448 TSval=1115424164 TSecr=931390443 [TCP PDU reassembled in 131]"
"124","1.982961","23.13.164.38","100.86.243.187","TCP","1514","443  >  54993 [ACK] Seq=123466 Ack=672 Win=5280 Len=1448 TSval=1115424164 TSecr=931390443 [TCP PDU reassembled in 131]"
"125","1.982962","23.13.164.38","100.86.243.187","TCP","1514","443  >  54993 [ACK] Seq=124914 Ack=672 Win=5280 Len=1448 TSval=1115424164 TSecr=931390443 [TCP PDU reassembled in 131]"
"126","1.982963","23.13.164.38","100.86.243.187","TCP","1514","443  >  54993 [ACK] Seq=126362 Ack=672 Win=5280 Len=1448 TSval=1115424164 TSecr=931390443 [TCP PDU reassembled in 131]"
"127","1.982964","23.13.164.38","100.86.243.187","TCP","1514","443  >  54993 [PSH, ACK] Seq=127810 Ack=672 Win=5280 Len=1448 TSval=1115424164 TSecr=931390443 [TCP PDU reassembled in 131]"
"128","1.983042","23.13.164.38","100.86.243.187","TCP","1514","443  >  54993 [ACK] Seq=129258 Ack=672 Win=5280 Len=1448 TSval=1115424165 TSecr=931390443 [TCP PDU reassembled in 131]"
"129","1.983044","23.13.164.38","100.86.243.187","TCP","1514","443  >  54993 [ACK] Seq=130706 Ack=672 Win=5280 Len=1448 TSval=1115424165 TSecr=931390443 [TCP PDU reassembled in 131]"
"130","1.983292","100.86.243.187","23.13.164.38","TCP","66","54993  >  443 [ACK] Seq=672 Ack=132154 Win=37456 Len=0 TSval=931390524 TSecr=1115424164"
"131","1.984484","23.13.164.38","100.86.243.187","TLSv1.2","1514","Application Data"
"132","1.984486","23.13.164.38","100.86.243.187","TCP","1514","443  >  54993 [ACK] Seq=133602 Ack=672 Win=5280 Len=1448 TSval=1115424165 TSecr=931390443 [TCP PDU reassembled in 142]"
"133","1.984487","23.13.164.38","100.86.243.187","TCP","1514","443  >  54993 [ACK] Seq=135050 Ack=672 Win=5280 Len=1448 TSval=1115424165 TSecr=931390443 [TCP PDU reassembled in 142]"
"134","1.984487","23.13.164.38","100.86.243.187","TCP","1514","443  >  54993 [ACK] Seq=136498 Ack=672 Win=5280 Len=1448 TSval=1115424165 TSecr=931390443 [TCP PDU reassembled in 142]"
"135","1.984488","23.13.164.38","100.86.243.187","TCP","1514","443  >  54993 [ACK] Seq=137946 Ack=672 Win=5280 Len=1448 TSval=1115424165 TSecr=931390443 [TCP PDU reassembled in 142]"
"136","1.984489","23.13.164.38","100.86.243.187","TCP","1514","443  >  54993 [PSH, ACK] Seq=139394 Ack=672 Win=5280 Len=1448 TSval=1115424165 TSecr=931390443 [TCP PDU reassembled in 142]"
"137","1.984489","23.13.164.38","100.86.243.187","TCP","1514","443  >  54993 [ACK] Seq=140842 Ack=672 Win=5280 Len=1448 TSval=1115424166 TSecr=931390443 [TCP PDU reassembled in 142]"
"138","1.984490","23.13.164.38","100.86.243.187","TCP","1514","443  >  54993 [ACK] Seq=142290 Ack=672 Win=5280 Len=1448 TSval=1115424166 TSecr=931390443 [TCP PDU reassembled in 142]"
"139","1.984491","23.13.164.38","100.86.243.187","TCP","1514","443  >  54993 [ACK] Seq=143738 Ack=672 Win=5280 Len=1448 TSval=1115424166 TSecr=931390443 [TCP PDU reassembled in 142]"
"140","1.984491","23.13.164.38","100.86.243.187","TCP","1514","443  >  54993 [ACK] Seq=145186 Ack=672 Win=5280 Len=1448 TSval=1115424166 TSecr=931390443 [TCP PDU reassembled in 142]"
"141","1.984730","23.13.164.38","100.86.243.187","TCP","1514","443  >  54993 [ACK] Seq=146634 Ack=672 Win=5280 Len=1448 TSval=1115424166 TSecr=931390443 [TCP PDU reassembled in 142]"
"142","1.984731","23.13.164.38","100.86.243.187","TLSv1.2","1514","Application Data, Application Data"
"143","1.984732","23.13.164.38","100.86.243.187","TCP","1514","443  >  54993 [ACK] Seq=149530 Ack=672 Win=5280 Len=1448 TSval=1115424166 TSecr=931390443 [TCP PDU reassembled in 155]"
"144","1.984733","23.13.164.38","100.86.243.187","TCP","1514","443  >  54993 [PSH, ACK] Seq=150978 Ack=672 Win=5280 Len=1448 TSval=1115424166 TSecr=931390443 [TCP PDU reassembled in 155]"
"145","1.984765","100.86.243.187","23.13.164.38","TCP","66","54993  >  443 [ACK] Seq=672 Ack=146634 Win=37456 Len=0 TSval=931390525 TSecr=1115424166"
"146","1.984892","100.86.243.187","23.13.164.38","TCP","66","54993  >  443 [ACK] Seq=672 Ack=152426 Win=37456 Len=0 TSval=931390525 TSecr=1115424166"
"147","1.986459","23.13.164.38","100.86.243.187","TCP","1514","443  >  54993 [ACK] Seq=152426 Ack=672 Win=5280 Len=1448 TSval=1115424167 TSecr=931390443 [TCP PDU reassembled in 155]"
"148","1.986461","23.13.164.38","100.86.243.187","TCP","1514","443  >  54993 [ACK] Seq=153874 Ack=672 Win=5280 Len=1448 TSval=1115424167 TSecr=931390443 [TCP PDU reassembled in 155]"
"149","1.986461","23.13.164.38","100.86.243.187","TCP","1514","443  >  54993 [ACK] Seq=155322 Ack=672 Win=5280 Len=1448 TSval=1115424167 TSecr=931390443 [TCP PDU reassembled in 155]"
"150","1.986462","23.13.164.38","100.86.243.187","TCP","1514","443  >  54993 [ACK] Seq=156770 Ack=672 Win=5280 Len=1448 TSval=1115424167 TSecr=931390443 [TCP PDU reassembled in 155]"
"151","1.986463","23.13.164.38","100.86.243.187","TCP","1514","443  >  54993 [ACK] Seq=158218 Ack=672 Win=5280 Len=1448 TSval=1115424167 TSecr=931390443 [TCP PDU reassembled in 155]"
"152","1.986463","23.13.164.38","100.86.243.187","TCP","1514","443  >  54993 [ACK] Seq=159666 Ack=672 Win=5280 Len=1448 TSval=1115424167 TSecr=931390443 [TCP PDU reassembled in 155]"
"153","1.986464","23.13.164.38","100.86.243.187","TCP","1514","443  >  54993 [ACK] Seq=161114 Ack=672 Win=5280 Len=1448 TSval=1115424167 TSecr=931390443 [TCP PDU reassembled in 155]"
"154","1.986465","23.13.164.38","100.86.243.187","TCP","1514","443  >  54993 [PSH, ACK] Seq=162562 Ack=672 Win=5280 Len=1448 TSval=1115424167 TSecr=931390443 [TCP PDU reassembled in 155]"
"155","1.986465","23.13.164.38","100.86.243.187","TLSv1.2","1514","Application Data, Application Data"
"156","1.986466","23.13.164.38","100.86.243.187","TCP","1514","443  >  54993 [ACK] Seq=165458 Ack=672 Win=5280 Len=1448 TSval=1115424168 TSecr=931390443 [TCP PDU reassembled in 169]"
"157","1.986467","23.13.164.38","100.86.243.187","TCP","1514","443  >  54993 [ACK] Seq=166906 Ack=672 Win=5280 Len=1448 TSval=1115424168 TSecr=931390443 [TCP PDU reassembled in 169]"
"158","1.986468","23.13.164.38","100.86.243.187","TCP","1514","443  >  54993 [ACK] Seq=168354 Ack=672 Win=5280 Len=1448 TSval=1115424168 TSecr=931390443 [TCP PDU reassembled in 169]"
"159","1.986508","23.13.164.38","100.86.243.187","TCP","1514","443  >  54993 [ACK] Seq=169802 Ack=672 Win=5280 Len=1448 TSval=1115424168 TSecr=931390443 [TCP PDU reassembled in 169]"
"160","1.986508","23.13.164.38","100.86.243.187","TCP","1514","443  >  54993 [ACK] Seq=171250 Ack=672 Win=5280 Len=1448 TSval=1115424168 TSecr=931390443 [TCP PDU reassembled in 169]"
"161","1.986760","100.86.243.187","23.13.164.38","TCP","66","54993  >  443 [ACK] Seq=672 Ack=172698 Win=37456 Len=0 TSval=931390527 TSecr=1115424168"
"162","1.986810","23.13.164.38","100.86.243.187","TCP","1514","443  >  54993 [ACK] Seq=172698 Ack=672 Win=5280 Len=1448 TSval=1115424168 TSecr=931390443 [TCP PDU reassembled in 169]"
"163","1.986812","23.13.164.38","100.86.243.187","TCP","1514","443  >  54993 [PSH, ACK] Seq=174146 Ack=672 Win=5280 Len=1448 TSval=1115424168 TSecr=931390443 [TCP PDU reassembled in 169]"
"164","1.986883","100.86.243.187","23.13.164.38","TCP","66","54993  >  443 [ACK] Seq=672 Ack=175594 Win=37456 Len=0 TSval=931390527 TSecr=1115424168"
"165","1.988163","23.13.164.38","100.86.243.187","TCP","1514","443  >  54993 [ACK] Seq=175594 Ack=672 Win=5280 Len=1448 TSval=1115424169 TSecr=931390443 [TCP PDU reassembled in 169]"
"166","1.988164","23.13.164.38","100.86.243.187","TCP","1514","443  >  54993 [ACK] Seq=177042 Ack=672 Win=5280 Len=1448 TSval=1115424169 TSecr=931390443 [TCP PDU reassembled in 169]"
"167","1.988164","23.13.164.38","100.86.243.187","TCP","1514","443  >  54993 [ACK] Seq=178490 Ack=672 Win=5280 Len=1448 TSval=1115424169 TSecr=931390443 [TCP PDU reassembled in 169]"
"168","1.988165","23.13.164.38","100.86.243.187","TCP","1514","443  >  54993 [ACK] Seq=179938 Ack=672 Win=5280 Len=1448 TSval=1115424169 TSecr=931390443 [TCP PDU reassembled in 169]"
"169","1.988166","23.13.164.38","100.86.243.187","TLSv1.2","1514","Application Data, Application Data"
"170","1.988166","23.13.164.38","100.86.243.187","TCP","1514","443  >  54993 [ACK] Seq=182834 Ack=672 Win=5280 Len=1448 TSval=1115424169 TSecr=931390443 [TCP PDU reassembled in 181]"
"171","1.988167","23.13.164.38","100.86.243.187","TCP","1514","443  >  54993 [ACK] Seq=184282 Ack=672 Win=5280 Len=1448 TSval=1115424169 TSecr=931390443 [TCP PDU reassembled in 181]"
"172","1.988168","23.13.164.38","100.86.243.187","TCP","1514","443  >  54993 [ACK] Seq=185730 Ack=672 Win=5280 Len=1448 TSval=1115424169 TSecr=931390443 [TCP PDU reassembled in 181]"
"173","1.988168","23.13.164.38","100.86.243.187","TCP","1514","443  >  54993 [ACK] Seq=187178 Ack=672 Win=5280 Len=1448 TSval=1115424169 TSecr=931390443 [TCP PDU reassembled in 181]"
"174","1.988169","23.13.164.38","100.86.243.187","TCP","1514","443  >  54993 [ACK] Seq=188626 Ack=672 Win=5280 Len=1448 TSval=1115424169 TSecr=931390443 [TCP PDU reassembled in 181]"
"175","1.988169","23.13.164.38","100.86.243.187","TCP","1514","443  >  54993 [ACK] Seq=190074 Ack=672 Win=5280 Len=1448 TSval=1115424169 TSecr=931390443 [TCP PDU reassembled in 181]"
"176","1.988170","23.13.164.38","100.86.243.187","TCP","1514","443  >  54993 [ACK] Seq=191522 Ack=672 Win=5280 Len=1448 TSval=1115424169 TSecr=931390443 [TCP PDU reassembled in 181]"
"177","1.988171","23.13.164.38","100.86.243.187","TCP","1514","443  >  54993 [PSH, ACK] Seq=192970 Ack=672 Win=5280 Len=1448 TSval=1115424169 TSecr=931390443 [TCP PDU reassembled in 181]"
"178","1.988171","23.13.164.38","100.86.243.187","TCP","1514","443  >  54993 [ACK] Seq=194418 Ack=672 Win=5280 Len=1448 TSval=1115424170 TSecr=931390443 [TCP PDU reassembled in 181]"
"179","1.988402","100.86.243.187","23.13.164.38","TCP","66","54993  >  443 [ACK] Seq=672 Ack=195866 Win=37456 Len=0 TSval=931390529 TSecr=1115424169"
"180","1.988440","23.13.164.38","100.86.243.187","TCP","1514","443  >  54993 [ACK] Seq=195866 Ack=672 Win=5280 Len=1448 TSval=1115424170 TSecr=931390443 [TCP PDU reassembled in 181]"
"181","1.988440","23.13.164.38","100.86.243.187","TLSv1.2","1514","Application Data, Application Data"
"182","1.988610","100.86.243.187","23.13.164.38","TCP","66","54993  >  443 [ACK] Seq=672 Ack=198762 Win=37456 Len=0 TSval=931390529 TSecr=1115424170"
"183","1.989620","23.13.164.38","100.86.243.187","TCP","1514","443  >  54993 [ACK] Seq=198762 Ack=672 Win=5280 Len=1448 TSval=1115424170 TSecr=931390443 [TCP PDU reassembled in 195]"
"184","1.989622","23.13.164.38","100.86.243.187","TCP","1514","443  >  54993 [ACK] Seq=200210 Ack=672 Win=5280 Len=1448 TSval=1115424170 TSecr=931390443 [TCP PDU reassembled in 195]"
"185","1.989623","23.13.164.38","100.86.243.187","TCP","1514","443  >  54993 [ACK] Seq=201658 Ack=672 Win=5280 Len=1448 TSval=1115424170 TSecr=931390443 [TCP PDU reassembled in 195]"
"186","1.989625","23.13.164.38","100.86.243.187","TCP","1514","443  >  54993 [ACK] Seq=203106 Ack=672 Win=5280 Len=1448 TSval=1115424170 TSecr=931390443 [TCP PDU reassembled in 195]"
"187","1.989626","23.13.164.38","100.86.243.187","TCP","1514","443  >  54993 [PSH, ACK] Seq=204554 Ack=672 Win=5280 Len=1448 TSval=1115424170 TSecr=931390443 [TCP PDU reassembled in 195]"
"188","1.989627","23.13.164.38","100.86.243.187","TCP","1514","443  >  54993 [ACK] Seq=206002 Ack=672 Win=5280 Len=1448 TSval=1115424171 TSecr=931390443 [TCP PDU reassembled in 195]"
"189","1.989628","23.13.164.38","100.86.243.187","TCP","1514","443  >  54993 [ACK] Seq=207450 Ack=672 Win=5280 Len=1448 TSval=1115424171 TSecr=931390443 [TCP PDU reassembled in 195]"
"190","1.989629","23.13.164.38","100.86.243.187","TCP","1514","443  >  54993 [ACK] Seq=208898 Ack=672 Win=5280 Len=1448 TSval=1115424171 TSecr=931390443 [TCP PDU reassembled in 195]"
"191","1.989631","23.13.164.38","100.86.243.187","TCP","1514","443  >  54993 [ACK] Seq=210346 Ack=672 Win=5280 Len=1448 TSval=1115424171 TSecr=931390443 [TCP PDU reassembled in 195]"
"192","1.989632","23.13.164.38","100.86.243.187","TCP","1514","443  >  54993 [ACK] Seq=211794 Ack=672 Win=5280 Len=1448 TSval=1115424171 TSecr=931390443 [TCP PDU reassembled in 195]"
"193","1.989902","100.86.243.187","23.13.164.38","TCP","66","54993  >  443 [ACK] Seq=672 Ack=213242 Win=37456 Len=0 TSval=931390530 TSecr=1115424171"
"194","1.989923","23.13.164.38","100.86.243.187","TCP","1514","443  >  54993 [ACK] Seq=213242 Ack=672 Win=5280 Len=1448 TSval=1115424171 TSecr=931390443 [TCP PDU reassembled in 195]"
"195","1.989926","23.13.164.38","100.86.243.187","TLSv1.2","1514","Application Data, Application Data"
"196","1.989927","23.13.164.38","100.86.243.187","TCP","1514","443  >  54993 [PSH, ACK] Seq=216138 Ack=672 Win=5280 Len=1448 TSval=1115424171 TSecr=931390443 [TCP PDU reassembled in 208]"
"197","1.989929","23.13.164.38","100.86.243.187","TCP","1514","443  >  54993 [ACK] Seq=217586 Ack=672 Win=5280 Len=1448 TSval=1115424172 TSecr=931390443 [TCP PDU reassembled in 208]"
"198","1.990155","100.86.243.187","23.13.164.38","TCP","66","54993  >  443 [ACK] Seq=672 Ack=219034 Win=37456 Len=0 TSval=931390530 TSecr=1115424172"
"199","1.990234","23.13.164.38","100.86.243.187","TCP","1514","443  >  54993 [ACK] Seq=219034 Ack=672 Win=5280 Len=1448 TSval=1115424172 TSecr=931390443 [TCP PDU reassembled in 208]"
"200","1.990235","23.13.164.38","100.86.243.187","TCP","1514","443  >  54993 [ACK] Seq=220482 Ack=672 Win=5280 Len=1448 TSval=1115424172 TSecr=931390443 [TCP PDU reassembled in 208]"
"201","1.990328","100.86.243.187","23.13.164.38","TCP","66","54993  >  443 [ACK] Seq=672 Ack=221930 Win=37456 Len=0 TSval=931390530 TSecr=1115424172"
"202","1.991639","23.13.164.38","100.86.243.187","TCP","1514","443  >  54993 [ACK] Seq=221930 Ack=672 Win=5280 Len=1448 TSval=1115424172 TSecr=931390443 [TCP PDU reassembled in 208]"
"203","1.991640","23.13.164.38","100.86.243.187","TCP","1514","443  >  54993 [ACK] Seq=223378 Ack=672 Win=5280 Len=1448 TSval=1115424172 TSecr=931390443 [TCP PDU reassembled in 208]"
"204","1.991640","23.13.164.38","100.86.243.187","TCP","1514","443  >  54993 [ACK] Seq=224826 Ack=672 Win=5280 Len=1448 TSval=1115424172 TSecr=931390443 [TCP PDU reassembled in 208]"
"205","1.991643","23.13.164.38","100.86.243.187","TCP","1514","443  >  54993 [ACK] Seq=226274 Ack=672 Win=5280 Len=1448 TSval=1115424172 TSecr=931390443 [TCP PDU reassembled in 208]"
"206","1.991643","23.13.164.38","100.86.243.187","TCP","1514","443  >  54993 [PSH, ACK] Seq=227722 Ack=672 Win=5280 Len=1448 TSval=1115424172 TSecr=931390443 [TCP PDU reassembled in 208]"
"207","1.991644","23.13.164.38","100.86.243.187","TCP","1514","443  >  54993 [ACK] Seq=229170 Ack=672 Win=5280 Len=1448 TSval=1115424173 TSecr=931390443 [TCP PDU reassembled in 208]"
"208","1.991645","23.13.164.38","100.86.243.187","TLSv1.2","1514","Application Data, Application Data"
"209","1.991645","23.13.164.38","100.86.243.187","TCP","1514","443  >  54993 [ACK] Seq=232066 Ack=672 Win=5280 Len=1448 TSval=1115424173 TSecr=931390443 [TCP PDU reassembled in 220]"
"210","1.991646","23.13.164.38","100.86.243.187","TCP","1514","443  >  54993 [ACK] Seq=233514 Ack=672 Win=5280 Len=1448 TSval=1115424173 TSecr=931390443 [TCP PDU reassembled in 220]"
"211","1.991647","23.13.164.38","100.86.243.187","TCP","1514","443  >  54993 [ACK] Seq=234962 Ack=672 Win=5280 Len=1448 TSval=1115424173 TSecr=931390443 [TCP PDU reassembled in 220]"
"212","1.991647","23.13.164.38","100.86.243.187","TCP","1514","443  >  54993 [ACK] Seq=236410 Ack=672 Win=5280 Len=1448 TSval=1115424173 TSecr=931390443 [TCP PDU reassembled in 220]"
"213","1.991648","23.13.164.38","100.86.243.187","TCP","1514","443  >  54993 [ACK] Seq=237858 Ack=672 Win=5280 Len=1448 TSval=1115424173 TSecr=931390443 [TCP PDU reassembled in 220]"
"214","1.991649","23.13.164.38","100.86.243.187","TCP","1514","443  >  54993 [PSH, ACK] Seq=239306 Ack=672 Win=5280 Len=1448 TSval=1115424173 TSecr=931390443 [TCP PDU reassembled in 220]"
"215","1.991650","23.13.164.38","100.86.243.187","TCP","1514","443  >  54993 [ACK] Seq=240754 Ack=672 Win=5280 Len=1448 TSval=1115424173 TSecr=931390443 [TCP PDU reassembled in 220]"
"216","1.991651","23.13.164.38","100.86.243.187","TCP","1514","443  >  54993 [ACK] Seq=242202 Ack=672 Win=5280 Len=1448 TSval=1115424173 TSecr=931390443 [TCP PDU reassembled in 220]"
"217","1.991652","23.13.164.38","100.86.243.187","TCP","1514","443  >  54993 [ACK] Seq=243650 Ack=672 Win=5280 Len=1448 TSval=1115424173 TSecr=931390443 [TCP PDU reassembled in 220]"
"218","1.991853","100.86.243.187","23.13.164.38","TCP","66","54993  >  443 [ACK] Seq=672 Ack=245098 Win=37456 Len=0 TSval=931390532 TSecr=1115424173"
"219","1.992106","23.13.164.38","100.86.243.187","TCP","1514","443  >  54993 [ACK] Seq=245098 Ack=672 Win=5280 Len=1448 TSval=1115424173 TSecr=931390443 [TCP PDU reassembled in 220]"
"220","1.992107","23.13.164.38","100.86.243.187","TLSv1.2","1514","Application Data, Application Data"
"221","1.992107","23.13.164.38","100.86.243.187","TCP","1514","443  >  54993 [ACK] Seq=247994 Ack=672 Win=5280 Len=1448 TSval=1115424174 TSecr=931390443 [TCP PDU reassembled in 236]"
"222","1.992108","23.13.164.38","100.86.243.187","TCP","1514","443  >  54993 [ACK] Seq=249442 Ack=672 Win=5280 Len=1448 TSval=1115424174 TSecr=931390443 [TCP PDU reassembled in 236]"
"223","1.992251","23.13.164.38","100.86.243.187","TCP","1514","443  >  54993 [ACK] Seq=250890 Ack=672 Win=5280 Len=1448 TSval=1115424174 TSecr=931390443 [TCP PDU reassembled in 236]"
"224","1.992251","23.13.164.38","100.86.243.187","TCP","1514","443  >  54993 [ACK] Seq=252338 Ack=672 Win=5280 Len=1448 TSval=1115424174 TSecr=931390443 [TCP PDU reassembled in 236]"
"225","1.992271","100.86.243.187","23.13.164.38","TCP","66","54993  >  443 [ACK] Seq=672 Ack=250890 Win=37456 Len=0 TSval=931390532 TSecr=1115424174"
"226","1.992305","100.86.243.187","23.13.164.38","TCP","66","54993  >  443 [ACK] Seq=672 Ack=253786 Win=37456 Len=0 TSval=931390532 TSecr=1115424174"
"227","1.992422","23.13.164.38","100.86.243.187","TCP","1514","443  >  54993 [ACK] Seq=253786 Ack=672 Win=5280 Len=1448 TSval=1115424174 TSecr=931390443 [TCP PDU reassembled in 236]"
"228","1.992423","23.13.164.38","100.86.243.187","TCP","1514","443  >  54993 [ACK] Seq=255234 Ack=672 Win=5280 Len=1448 TSval=1115424174 TSecr=931390443 [TCP PDU reassembled in 236]"
"229","1.992505","100.86.243.187","23.13.164.38","TCP","66","54993  >  443 [ACK] Seq=672 Ack=256682 Win=37456 Len=0 TSval=931390532 TSecr=1115424174"
"230","1.992630","23.13.164.38","100.86.243.187","TCP","1514","443  >  54993 [ACK] Seq=256682 Ack=672 Win=5280 Len=1448 TSval=1115424174 TSecr=931390443 [TCP PDU reassembled in 236]"
"231","1.992631","23.13.164.38","100.86.243.187","TCP","1514","443  >  54993 [PSH, ACK] Seq=258130 Ack=672 Win=5280 Len=1448 TSval=1115424174 TSecr=931390443 [TCP PDU reassembled in 236]"
"232","1.992631","23.13.164.38","100.86.243.187","TCP","1514","443  >  54993 [ACK] Seq=259578 Ack=672 Win=5280 Len=1448 TSval=1115424175 TSecr=931390443 [TCP PDU reassembled in 236]"
"233","1.992633","23.13.164.38","100.86.243.187","TCP","1514","443  >  54993 [ACK] Seq=261026 Ack=672 Win=5280 Len=1448 TSval=1115424175 TSecr=931390443 [TCP PDU reassembled in 236]"
"234","1.992713","100.86.243.187","23.13.164.38","TCP","66","54993  >  443 [ACK] Seq=672 Ack=262474 Win=37456 Len=0 TSval=931390532 TSecr=1115424175"
"235","1.994246","23.13.164.38","100.86.243.187","TCP","1514","443  >  54993 [ACK] Seq=262474 Ack=672 Win=5280 Len=1448 TSval=1115424175 TSecr=931390443 [TCP PDU reassembled in 236]"
"236","1.994247","23.13.164.38","100.86.243.187","TLSv1.2","1514","Application Data, Application Data"
"237","1.994248","23.13.164.38","100.86.243.187","TCP","1514","443  >  54993 [ACK] Seq=265370 Ack=672 Win=5280 Len=1448 TSval=1115424175 TSecr=931390443 [TCP PDU reassembled in 238]"
"238","1.994249","23.13.164.38","100.86.243.187","TLSv1.2","1514","Application Data"
"239","1.994249","23.13.164.38","100.86.243.187","TCP","1514","443  >  54993 [ACK] Seq=268266 Ack=672 Win=5280 Len=1448 TSval=1115424175 TSecr=931390443 [TCP PDU reassembled in 249]"
"240","1.994250","23.13.164.38","100.86.243.187","TCP","1514","443  >  54993 [PSH, ACK] Seq=269714 Ack=672 Win=5280 Len=1448 TSval=1115424175 TSecr=931390443 [TCP PDU reassembled in 249]"
"241","1.994251","23.13.164.38","100.86.243.187","TCP","1514","443  >  54993 [ACK] Seq=271162 Ack=672 Win=5280 Len=1448 TSval=1115424176 TSecr=931390443 [TCP PDU reassembled in 249]"
"242","1.994252","23.13.164.38","100.86.243.187","TCP","1514","443  >  54993 [ACK] Seq=272610 Ack=672 Win=5280 Len=1448 TSval=1115424176 TSecr=931390443 [TCP PDU reassembled in 249]"
"243","1.994252","23.13.164.38","100.86.243.187","TCP","1514","443  >  54993 [ACK] Seq=274058 Ack=672 Win=5280 Len=1448 TSval=1115424176 TSecr=931390443 [TCP PDU reassembled in 249]"
"244","1.994253","23.13.164.38","100.86.243.187","TCP","1514","443  >  54993 [ACK] Seq=275506 Ack=672 Win=5280 Len=1448 TSval=1115424176 TSecr=931390443 [TCP PDU reassembled in 249]"
"245","1.994254","23.13.164.38","100.86.243.187","TCP","1514","443  >  54993 [ACK] Seq=276954 Ack=672 Win=5280 Len=1448 TSval=1115424176 TSecr=931390443 [TCP PDU reassembled in 249]"
"246","1.994254","23.13.164.38","100.86.243.187","TCP","1514","443  >  54993 [ACK] Seq=278402 Ack=672 Win=5280 Len=1448 TSval=1115424176 TSecr=931390443 [TCP PDU reassembled in 249]"
"247","1.994290","23.13.164.38","100.86.243.187","TCP","1514","443  >  54993 [ACK] Seq=279850 Ack=672 Win=5280 Len=1448 TSval=1115424176 TSecr=931390443 [TCP PDU reassembled in 249]"
"248","1.994291","23.13.164.38","100.86.243.187","TCP","1514","443  >  54993 [PSH, ACK] Seq=281298 Ack=672 Win=5280 Len=1448 TSval=1115424176 TSecr=931390443 [TCP PDU reassembled in 249]"
"249","1.994291","23.13.164.38","100.86.243.187","TLSv1.2","1514","Application Data, Application Data"
"250","1.994292","23.13.164.38","100.86.243.187","TCP","1514","443  >  54993 [ACK] Seq=284194 Ack=672 Win=5280 Len=1448 TSval=1115424177 TSecr=931390443 [TCP PDU reassembled in 262]"
"251","1.994643","100.86.243.187","23.13.164.38","TCP","66","54993  >  443 [ACK] Seq=672 Ack=285642 Win=37456 Len=0 TSval=931390535 TSecr=1115424176"
"252","1.995955","23.13.164.38","100.86.243.187","TCP","1514","443  >  54993 [ACK] Seq=285642 Ack=672 Win=5280 Len=1448 TSval=1115424177 TSecr=931390443 [TCP PDU reassembled in 262]"
"253","1.995960","23.13.164.38","100.86.243.187","TCP","1514","443  >  54993 [ACK] Seq=287090 Ack=672 Win=5280 Len=1448 TSval=1115424177 TSecr=931390443 [TCP PDU reassembled in 262]"
"254","1.995963","23.13.164.38","100.86.243.187","TCP","1514","443  >  54993 [ACK] Seq=288538 Ack=672 Win=5280 Len=1448 TSval=1115424177 TSecr=931390443 [TCP PDU reassembled in 262]"
"255","1.995967","23.13.164.38","100.86.243.187","TCP","1514","443  >  54993 [ACK] Seq=289986 Ack=672 Win=5280 Len=1448 TSval=1115424177 TSecr=931390443 [TCP PDU reassembled in 262]"
"256","1.995970","23.13.164.38","100.86.243.187","TCP","1514","443  >  54993 [ACK] Seq=291434 Ack=672 Win=5280 Len=1448 TSval=1115424177 TSecr=931390443 [TCP PDU reassembled in 262]"
"257","1.995973","23.13.164.38","100.86.243.187","TCP","1514","443  >  54993 [PSH, ACK] Seq=292882 Ack=672 Win=5280 Len=1448 TSval=1115424177 TSecr=931390443 [TCP PDU reassembled in 262]"
"258","1.995975","23.13.164.38","100.86.243.187","TCP","1514","443  >  54993 [ACK] Seq=294330 Ack=672 Win=5280 Len=1448 TSval=1115424178 TSecr=931390515 [TCP PDU reassembled in 262]"
"259","1.995978","23.13.164.38","100.86.243.187","TCP","1514","443  >  54993 [ACK] Seq=295778 Ack=672 Win=5280 Len=1448 TSval=1115424178 TSecr=931390515 [TCP PDU reassembled in 262]"
"260","1.995981","23.13.164.38","100.86.243.187","TCP","1514","443  >  54993 [ACK] Seq=297226 Ack=672 Win=5280 Len=1448 TSval=1115424178 TSecr=931390515 [TCP PDU reassembled in 262]"
"261","1.995985","23.13.164.38","100.86.243.187","TCP","1514","443  >  54993 [ACK] Seq=298674 Ack=672 Win=5280 Len=1448 TSval=1115424178 TSecr=931390515 [TCP PDU reassembled in 262]"
"262","1.995987","23.13.164.38","100.86.243.187","TLSv1.2","1514","Application Data, Application Data"
"263","1.995990","23.13.164.38","100.86.243.187","TCP","1514","443  >  54993 [ACK] Seq=301570 Ack=672 Win=5280 Len=1448 TSval=1115424178 TSecr=931390515 [TCP PDU reassembled in 273]"
"264","1.995992","23.13.164.38","100.86.243.187","TCP","1514","443  >  54993 [ACK] Seq=303018 Ack=672 Win=5280 Len=1448 TSval=1115424178 TSecr=931390515 [TCP PDU reassembled in 273]"
"265","1.995995","23.13.164.38","100.86.243.187","TCP","1514","443  >  54993 [PSH, ACK] Seq=304466 Ack=672 Win=5280 Len=1448 TSval=1115424178 TSecr=931390515 [TCP PDU reassembled in 273]"
"266","1.995999","23.13.164.38","100.86.243.187","TCP","1514","443  >  54993 [ACK] Seq=305914 Ack=672 Win=5280 Len=1448 TSval=1115424178 TSecr=931390522 [TCP PDU reassembled in 273]"
"267","1.996003","23.13.164.38","100.86.243.187","TCP","1514","443  >  54993 [ACK] Seq=307362 Ack=672 Win=5280 Len=1448 TSval=1115424178 TSecr=931390522 [TCP PDU reassembled in 273]"
"268","1.996005","23.13.164.38","100.86.243.187","TCP","1514","443  >  54993 [ACK] Seq=308810 Ack=672 Win=5280 Len=1448 TSval=1115424178 TSecr=931390522 [TCP PDU reassembled in 273]"
"269","1.996008","23.13.164.38","100.86.243.187","TCP","1514","443  >  54993 [ACK] Seq=310258 Ack=672 Win=5280 Len=1448 TSval=1115424178 TSecr=931390522 [TCP PDU reassembled in 273]"
"270","1.996634","23.13.164.38","100.86.243.187","TCP","1514","443  >  54993 [PSH, ACK] Seq=311706 Ack=672 Win=5280 Len=1448 TSval=1115424178 TSecr=931390522 [TCP PDU reassembled in 273]"
"271","1.996638","23.13.164.38","100.86.243.187","TCP","1514","443  >  54993 [ACK] Seq=313154 Ack=672 Win=5280 Len=1448 TSval=1115424179 TSecr=931390522 [TCP PDU reassembled in 273]"
"272","1.996641","23.13.164.38","100.86.243.187","TCP","1514","443  >  54993 [ACK] Seq=314602 Ack=672 Win=5280 Len=1448 TSval=1115424179 TSecr=931390522 [TCP PDU reassembled in 273]"
"273","1.996642","23.13.164.38","100.86.243.187","TLSv1.2","1514","Application Data, Application Data"
"274","1.996736","100.86.243.187","23.13.164.38","TCP","66","54993  >  443 [ACK] Seq=672 Ack=311706 Win=37456 Len=0 TSval=931390537 TSecr=1115424178"
"275","1.996999","100.86.243.187","23.13.164.38","TCP","66","54993  >  443 [ACK] Seq=672 Ack=317498 Win=37456 Len=0 TSval=931390537 TSecr=1115424179"
"276","1.997985","23.13.164.38","100.86.243.187","TCP","1514","443  >  54993 [ACK] Seq=317498 Ack=672 Win=5280 Len=1448 TSval=1115424179 TSecr=931390522 [TCP PDU reassembled in 286]"
"277","1.997989","23.13.164.38","100.86.243.187","TCP","1514","443  >  54993 [ACK] Seq=318946 Ack=672 Win=5280 Len=1448 TSval=1115424179 TSecr=931390522 [TCP PDU reassembled in 286]"
"278","1.997990","23.13.164.38","100.86.243.187","TCP","1514","443  >  54993 [ACK] Seq=320394 Ack=672 Win=5280 Len=1448 TSval=1115424179 TSecr=931390522 [TCP PDU reassembled in 286]"
"279","1.997993","23.13.164.38","100.86.243.187","TCP","1514","443  >  54993 [ACK] Seq=321842 Ack=672 Win=5280 Len=1448 TSval=1115424179 TSecr=931390522 [TCP PDU reassembled in 286]"
"280","1.997994","23.13.164.38","100.86.243.187","TCP","1514","443  >  54993 [PSH, ACK] Seq=323290 Ack=672 Win=5280 Len=1448 TSval=1115424179 TSecr=931390522 [TCP PDU reassembled in 286]"
"281","1.997996","23.13.164.38","100.86.243.187","TCP","1514","443  >  54993 [ACK] Seq=324738 Ack=672 Win=5280 Len=1448 TSval=1115424180 TSecr=931390524 [TCP PDU reassembled in 286]"
"282","1.997997","23.13.164.38","100.86.243.187","TCP","1514","443  >  54993 [ACK] Seq=326186 Ack=672 Win=5280 Len=1448 TSval=1115424180 TSecr=931390524 [TCP PDU reassembled in 286]"
"283","1.997999","23.13.164.38","100.86.243.187","TCP","1514","443  >  54993 [ACK] Seq=327634 Ack=672 Win=5280 Len=1448 TSval=1115424180 TSecr=931390524 [TCP PDU reassembled in 286]"
"284","1.998001","23.13.164.38","100.86.243.187","TCP","1514","443  >  54993 [ACK] Seq=329082 Ack=672 Win=5280 Len=1448 TSval=1115424180 TSecr=931390524 [TCP PDU reassembled in 286]"
"285","1.998003","23.13.164.38","100.86.243.187","TCP","1514","443  >  54993 [ACK] Seq=330530 Ack=672 Win=5280 Len=1448 TSval=1115424180 TSecr=931390524 [TCP PDU reassembled in 286]"
"286","1.998005","23.13.164.38","100.86.243.187","TLSv1.2","1514","Application Data, Application Data"
"287","1.998006","23.13.164.38","100.86.243.187","TCP","1514","443  >  54993 [ACK] Seq=333426 Ack=672 Win=5280 Len=1448 TSval=1115424180 TSecr=931390524 [TCP PDU reassembled in 302]"
"288","1.998544","100.86.243.187","23.13.164.38","TCP","66","54993  >  443 [ACK] Seq=672 Ack=334874 Win=37456 Len=0 TSval=931390539 TSecr=1115424180"
"289","1.998916","23.13.164.38","100.86.243.187","TCP","1514","443  >  54993 [PSH, ACK] Seq=334874 Ack=672 Win=5280 Len=1448 TSval=1115424180 TSecr=931390524 [TCP PDU reassembled in 302]"
"290","1.998917","23.13.164.38","100.86.243.187","TCP","1514","443  >  54993 [ACK] Seq=336322 Ack=672 Win=5280 Len=1448 TSval=1115424181 TSecr=931390525 [TCP PDU reassembled in 302]"
"291","1.998998","23.13.164.38","100.86.243.187","TCP","1514","443  >  54993 [ACK] Seq=337770 Ack=672 Win=5280 Len=1448 TSval=1115424181 TSecr=931390525 [TCP PDU reassembled in 302]"
"292","1.998999","23.13.164.38","100.86.243.187","TCP","1514","443  >  54993 [ACK] Seq=339218 Ack=672 Win=5280 Len=1448 TSval=1115424181 TSecr=931390525 [TCP PDU reassembled in 302]"
"293","1.999024","100.86.243.187","23.13.164.38","TCP","66","54993  >  443 [ACK] Seq=672 Ack=337770 Win=37456 Len=0 TSval=931390539 TSecr=1115424181"
"294","1.999058","100.86.243.187","23.13.164.38","TCP","66","54993  >  443 [ACK] Seq=672 Ack=340666 Win=37456 Len=0 TSval=931390539 TSecr=1115424181"
"295","2.000895","23.13.164.38","100.86.243.187","TCP","1514","443  >  54993 [ACK] Seq=340666 Ack=672 Win=5280 Len=1448 TSval=1115424181 TSecr=931390525 [TCP PDU reassembled in 302]"
"296","2.000896","23.13.164.38","100.86.243.187","TCP","1514","443  >  54993 [ACK] Seq=342114 Ack=672 Win=5280 Len=1448 TSval=1115424181 TSecr=931390525 [TCP PDU reassembled in 302]"
"297","2.000897","23.13.164.38","100.86.243.187","TCP","1514","443  >  54993 [ACK] Seq=343562 Ack=672 Win=5280 Len=1448 TSval=1115424181 TSecr=931390525 [TCP PDU reassembled in 302]"
"298","2.000899","23.13.164.38","100.86.243.187","TCP","1514","443  >  54993 [ACK] Seq=345010 Ack=672 Win=5280 Len=1448 TSval=1115424181 TSecr=931390525 [TCP PDU reassembled in 302]"
"299","2.001013","100.86.243.187","23.13.164.38","TCP","66","54993  >  443 [ACK] Seq=672 Ack=346458 Win=37456 Len=0 TSval=931390542 TSecr=1115424181"
"300","2.001932","23.13.164.38","100.86.243.187","TCP","1514","443  >  54993 [PSH, ACK] Seq=346458 Ack=672 Win=5280 Len=1448 TSval=1115424181 TSecr=931390525 [TCP PDU reassembled in 302]"
"301","2.001933","23.13.164.38","100.86.243.187","TCP","1514","443  >  54993 [ACK] Seq=347906 Ack=672 Win=5280 Len=1448 TSval=1115424182 TSecr=931390525 [TCP PDU reassembled in 302]"
"302","2.001933","23.13.164.38","100.86.243.187","TLSv1.2","1514","Application Data, Application Data"
"303","2.001934","23.13.164.38","100.86.243.187","TCP","1514","443  >  54993 [ACK] Seq=350802 Ack=672 Win=5280 Len=1448 TSval=1115424182 TSecr=931390525 [TCP PDU reassembled in 313]"
"304","2.001934","23.13.164.38","100.86.243.187","TCP","1514","443  >  54993 [ACK] Seq=352250 Ack=672 Win=5280 Len=1448 TSval=1115424182 TSecr=931390525 [TCP PDU reassembled in 313]"
"305","2.001935","23.13.164.38","100.86.243.187","TCP","1514","443  >  54993 [ACK] Seq=353698 Ack=672 Win=5280 Len=1448 TSval=1115424182 TSecr=931390525 [TCP PDU reassembled in 313]"
"306","2.001936","23.13.164.38","100.86.243.187","TCP","1514","443  >  54993 [ACK] Seq=355146 Ack=672 Win=5280 Len=1448 TSval=1115424182 TSecr=931390525 [TCP PDU reassembled in 313]"
"307","2.001937","23.13.164.38","100.86.243.187","TCP","1514","443  >  54993 [ACK] Seq=356594 Ack=672 Win=5280 Len=1448 TSval=1115424182 TSecr=931390525 [TCP PDU reassembled in 313]"
"308","2.001937","23.13.164.38","100.86.243.187","TCP","1514","443  >  54993 [PSH, ACK] Seq=358042 Ack=672 Win=5280 Len=1448 TSval=1115424182 TSecr=931390525 [TCP PDU reassembled in 313]"
"309","2.001938","23.13.164.38","100.86.243.187","TCP","1514","443  >  54993 [ACK] Seq=359490 Ack=672 Win=5280 Len=1448 TSval=1115424182 TSecr=931390525 [TCP PDU reassembled in 313]"
"310","2.001939","23.13.164.38","100.86.243.187","TCP","1514","443  >  54993 [ACK] Seq=360938 Ack=672 Win=5280 Len=1448 TSval=1115424182 TSecr=931390525 [TCP PDU reassembled in 313]"
"311","2.001939","23.13.164.38","100.86.243.187","TCP","1514","443  >  54993 [ACK] Seq=362386 Ack=672 Win=5280 Len=1448 TSval=1115424182 TSecr=931390525 [TCP PDU reassembled in 313]"
"312","2.001940","23.13.164.38","100.86.243.187","TCP","1514","443  >  54993 [ACK] Seq=363834 Ack=672 Win=5280 Len=1448 TSval=1115424182 TSecr=931390525 [TCP PDU reassembled in 313]"
"313","2.001940","23.13.164.38","100.86.243.187","TLSv1.2","1514","Application Data, Application Data"
"314","2.001941","23.13.164.38","100.86.243.187","TCP","1514","443  >  54993 [ACK] Seq=366730 Ack=672 Win=5280 Len=1448 TSval=1115424182 TSecr=931390525 [TCP PDU reassembled in 326]"
"315","2.001942","23.13.164.38","100.86.243.187","TCP","1514","443  >  54993 [ACK] Seq=368178 Ack=672 Win=5280 Len=1448 TSval=1115424182 TSecr=931390525 [TCP PDU reassembled in 326]"
"316","2.001970","23.13.164.38","100.86.243.187","TCP","1514","443  >  54993 [PSH, ACK] Seq=369626 Ack=672 Win=5280 Len=1448 TSval=1115424182 TSecr=931390525 [TCP PDU reassembled in 326]"
"317","2.001971","23.13.164.38","100.86.243.187","TCP","1514","443  >  54993 [ACK] Seq=371074 Ack=672 Win=5280 Len=1448 TSval=1115424183 TSecr=931390527 [TCP PDU reassembled in 326]"
"318","2.002156","23.13.164.38","100.86.243.187","TCP","1514","443  >  54993 [ACK] Seq=372522 Ack=672 Win=5280 Len=1448 TSval=1115424183 TSecr=931390527 [TCP PDU reassembled in 326]"
"319","2.002157","23.13.164.38","100.86.243.187","TCP","1514","443  >  54993 [ACK] Seq=373970 Ack=672 Win=5280 Len=1448 TSval=1115424183 TSecr=931390527 [TCP PDU reassembled in 326]"
"320","2.002291","100.86.243.187","23.13.164.38","TCP","66","54993  >  443 [ACK] Seq=672 Ack=375418 Win=37456 Len=0 TSval=931390543 TSecr=1115424182"
"321","2.002431","23.13.164.38","100.86.243.187","TCP","1514","443  >  54993 [ACK] Seq=375418 Ack=672 Win=5280 Len=1448 TSval=1115424183 TSecr=931390527 [TCP PDU reassembled in 326]"
"322","2.002432","23.13.164.38","100.86.243.187","TCP","1514","443  >  54993 [PSH, ACK] Seq=376866 Ack=672 Win=5280 Len=1448 TSval=1115424183 TSecr=931390527 [TCP PDU reassembled in 326]"
"323","2.002433","23.13.164.38","100.86.243.187","TCP","1514","443  >  54993 [ACK] Seq=378314 Ack=672 Win=5280 Len=1448 TSval=1115424184 TSecr=931390527 [TCP PDU reassembled in 326]"
"324","2.002433","23.13.164.38","100.86.243.187","TCP","1514","443  >  54993 [ACK] Seq=379762 Ack=672 Win=5280 Len=1448 TSval=1115424184 TSecr=931390527 [TCP PDU reassembled in 326]"
"325","2.002506","100.86.243.187","23.13.164.38","TCP","66","54993  >  443 [ACK] Seq=672 Ack=381210 Win=37456 Len=0 TSval=931390543 TSecr=1115424184"
"326","2.002752","23.13.164.38","100.86.243.187","TLSv1.2","1514","Application Data, Application Data"
"327","2.002752","23.13.164.38","100.86.243.187","TCP","1514","443  >  54993 [ACK] Seq=382658 Ack=672 Win=5280 Len=1448 TSval=1115424184 TSecr=931390527 [TCP PDU reassembled in 341]"
"328","2.002754","23.13.164.38","100.86.243.187","TCP","1514","443  >  54993 [ACK] Seq=384106 Ack=672 Win=5280 Len=1448 TSval=1115424184 TSecr=931390527 [TCP PDU reassembled in 341]"
"329","2.002754","23.13.164.38","100.86.243.187","TCP","1514","443  >  54993 [ACK] Seq=385554 Ack=672 Win=5280 Len=1448 TSval=1115424184 TSecr=931390527 [TCP PDU reassembled in 341]"
"330","2.002883","23.13.164.38","100.86.243.187","TCP","1514","443  >  54993 [ACK] Seq=387002 Ack=672 Win=5280 Len=1448 TSval=1115424184 TSecr=931390527 [TCP PDU reassembled in 341]"
"331","2.002885","23.13.164.38","100.86.243.187","TCP","1514","443  >  54993 [PSH, ACK] Seq=388450 Ack=672 Win=5280 Len=1448 TSval=1115424184 TSecr=931390527 [TCP PDU reassembled in 341]"
"332","2.002916","100.86.243.187","23.13.164.38","TCP","66","54993  >  443 [ACK] Seq=672 Ack=387002 Win=37456 Len=0 TSval=931390543 TSecr=1115424184"
"333","2.002946","100.86.243.187","23.13.164.38","TCP","66","54993  >  443 [ACK] Seq=672 Ack=389898 Win=37456 Len=0 TSval=931390543 TSecr=1115424184"
"334","2.003027","23.13.164.38","100.86.243.187","TCP","1514","443  >  54993 [ACK] Seq=389898 Ack=672 Win=5280 Len=1448 TSval=1115424185 TSecr=931390527 [TCP PDU reassembled in 341]"
"335","2.003030","23.13.164.38","100.86.243.187","TCP","1514","443  >  54993 [ACK] Seq=391346 Ack=672 Win=5280 Len=1448 TSval=1115424185 TSecr=931390527 [TCP PDU reassembled in 341]"
"336","2.003087","100.86.243.187","23.13.164.38","TCP","66","54993  >  443 [ACK] Seq=672 Ack=392794 Win=37456 Len=0 TSval=931390544 TSecr=1115424185"
"337","2.004521","23.13.164.38","100.86.243.187","TCP","1514","443  >  54993 [ACK] Seq=392794 Ack=672 Win=5280 Len=1448 TSval=1115424185 TSecr=931390527 [TCP PDU reassembled in 341]"
"338","2.004522","23.13.164.38","100.86.243.187","TCP","1514","443  >  54993 [ACK] Seq=394242 Ack=672 Win=5280 Len=1448 TSval=1115424185 TSecr=931390527 [TCP PDU reassembled in 341]"
"339","2.004523","23.13.164.38","100.86.243.187","TCP","1514","443  >  54993 [ACK] Seq=395690 Ack=672 Win=5280 Len=1448 TSval=1115424185 TSecr=931390527 [TCP PDU reassembled in 341]"
"340","2.004523","23.13.164.38","100.86.243.187","TCP","1514","443  >  54993 [ACK] Seq=397138 Ack=672 Win=5280 Len=1448 TSval=1115424185 TSecr=931390527 [TCP PDU reassembled in 341]"
"341","2.004524","23.13.164.38","100.86.243.187","TLSv1.2","1514","Application Data, Application Data"
"342","2.004524","23.13.164.38","100.86.243.187","TCP","1514","443  >  54993 [PSH, ACK] Seq=400034 Ack=672 Win=5280 Len=1448 TSval=1115424185 TSecr=931390527 [TCP PDU reassembled in 344]"
"343","2.004676","100.86.243.187","23.13.164.38","TCP","66","54993  >  443 [ACK] Seq=672 Ack=401482 Win=37456 Len=0 TSval=931390545 TSecr=1115424185"
"344","2.004789","23.13.164.38","100.86.243.187","TLSv1.2","1514","Application Data"
"345","2.004790","23.13.164.38","100.86.243.187","TCP","1514","443  >  54993 [ACK] Seq=402930 Ack=672 Win=5280 Len=1448 TSval=1115424186 TSecr=931390527 [TCP PDU reassembled in 358]"
"346","2.004790","23.13.164.38","100.86.243.187","TCP","1514","443  >  54993 [ACK] Seq=404378 Ack=672 Win=5280 Len=1448 TSval=1115424186 TSecr=931390527 [TCP PDU reassembled in 358]"
"347","2.004791","23.13.164.38","100.86.243.187","TCP","1514","443  >  54993 [ACK] Seq=405826 Ack=672 Win=5280 Len=1448 TSval=1115424186 TSecr=931390527 [TCP PDU reassembled in 358]"
"348","2.004908","23.13.164.38","100.86.243.187","TCP","1514","443  >  54993 [ACK] Seq=407274 Ack=672 Win=5280 Len=1448 TSval=1115424186 TSecr=931390527 [TCP PDU reassembled in 358]"
"349","2.004909","23.13.164.38","100.86.243.187","TCP","1514","443  >  54993 [ACK] Seq=408722 Ack=672 Win=5280 Len=1448 TSval=1115424186 TSecr=931390527 [TCP PDU reassembled in 358]"
"350","2.004937","100.86.243.187","23.13.164.38","TCP","66","54993  >  443 [ACK] Seq=672 Ack=407274 Win=37456 Len=0 TSval=931390545 TSecr=1115424186"
"351","2.004962","100.86.243.187","23.13.164.38","TCP","66","54993  >  443 [ACK] Seq=672 Ack=410170 Win=37456 Len=0 TSval=931390545 TSecr=1115424186"
"352","2.005253","23.13.164.38","100.86.243.187","TCP","1514","443  >  54993 [ACK] Seq=410170 Ack=672 Win=5280 Len=1448 TSval=1115424186 TSecr=931390527 [TCP PDU reassembled in 358]"
"353","2.005254","23.13.164.38","100.86.243.187","TCP","1514","443  >  54993 [PSH, ACK] Seq=411618 Ack=672 Win=5280 Len=1448 TSval=1115424186 TSecr=931390527 [TCP PDU reassembled in 358]"
"354","2.005254","23.13.164.38","100.86.243.187","TCP","1514","443  >  54993 [ACK] Seq=413066 Ack=672 Win=5280 Len=1448 TSval=1115424186 TSecr=931390527 [TCP PDU reassembled in 358]"
"355","2.005256","23.13.164.38","100.86.243.187","TCP","1514","443  >  54993 [ACK] Seq=414514 Ack=672 Win=5280 Len=1448 TSval=1115424186 TSecr=931390527 [TCP PDU reassembled in 358]"
"356","2.005335","100.86.243.187","23.13.164.38","TCP","66","54993  >  443 [ACK] Seq=672 Ack=415962 Win=37456 Len=0 TSval=931390545 TSecr=1115424186"
"357","2.006854","23.13.164.38","100.86.243.187","TCP","1514","443  >  54993 [ACK] Seq=415962 Ack=672 Win=5280 Len=1448 TSval=1115424186 TSecr=931390527 [TCP PDU reassembled in 358]"
"358","2.006858","23.13.164.38","100.86.243.187","TLSv1.2","1514","Application Data, Application Data"
"359","2.006860","23.13.164.38","100.86.243.187","TCP","1514","443  >  54993 [ACK] Seq=418858 Ack=672 Win=5280 Len=1448 TSval=1115424186 TSecr=931390527 [TCP PDU reassembled in 367]"
"360","2.006862","23.13.164.38","100.86.243.187","TCP","1514","443  >  54993 [ACK] Seq=420306 Ack=672 Win=5280 Len=1448 TSval=1115424186 TSecr=931390527 [TCP PDU reassembled in 367]"
"361","2.006864","23.13.164.38","100.86.243.187","TCP","1514","443  >  54993 [ACK] Seq=421754 Ack=672 Win=5280 Len=1448 TSval=1115424186 TSecr=931390527 [TCP PDU reassembled in 367]"
"362","2.006865","23.13.164.38","100.86.243.187","TCP","1514","443  >  54993 [PSH, ACK] Seq=423202 Ack=672 Win=5280 Len=1448 TSval=1115424186 TSecr=931390527 [TCP PDU reassembled in 367]"
"363","2.006867","23.13.164.38","100.86.243.187","TCP","1514","443  >  54993 [ACK] Seq=424650 Ack=672 Win=5280 Len=1448 TSval=1115424187 TSecr=931390527 [TCP PDU reassembled in 367]"
"364","2.006870","23.13.164.38","100.86.243.187","TCP","1514","443  >  54993 [ACK] Seq=426098 Ack=672 Win=5280 Len=1448 TSval=1115424187 TSecr=931390527 [TCP PDU reassembled in 367]"
"365","2.006871","23.13.164.38","100.86.243.187","TCP","1514","443  >  54993 [ACK] Seq=427546 Ack=672 Win=5280 Len=1448 TSval=1115424187 TSecr=931390527 [TCP PDU reassembled in 367]"
"366","2.006873","23.13.164.38","100.86.243.187","TCP","1514","443  >  54993 [ACK] Seq=428994 Ack=672 Win=5280 Len=1448 TSval=1115424187 TSecr=931390527 [TCP PDU reassembled in 367]"
"367","2.006874","23.13.164.38","100.86.243.187","TLSv1.2","458","Application Data"
"368","2.007359","100.86.243.187","23.13.164.38","TCP","66","54993  >  443 [ACK] Seq=672 Ack=430834 Win=37456 Len=0 TSval=931390548 TSecr=1115424187"
