"No.","Time","Source","Destination","Protocol","Length","Info"
"1","0.000000","100.86.243.187","23.13.164.38","TLSv1.2","674","Application Data"
"2","0.000836","100.86.243.187","23.13.164.38","TLSv1.2","366","Application Data"
"3","0.011912","23.13.164.38","100.86.243.187","TCP","66","443  >  54993 [ACK] Seq=1 Ack=909 Win=8221 Len=0 TSval=1115497758 TSecr=931464101"
"4","0.038007","23.13.164.38","100.86.243.187","TLSv1.2","897","Application Data"
"5","0.038042","23.13.164.38","100.86.243.187","TLSv1.2","698","Application Data"
"6","0.038113","100.86.243.187","23.13.164.38","TCP","66","54993  >  443 [ACK] Seq=909 Ack=832 Win=37443 Len=0 TSval=931464139 TSecr=1115497784"
"7","0.038184","100.86.243.187","23.13.164.38","TCP","66","54993  >  443 [ACK] Seq=909 Ack=1464 Win=37433 Len=0 TSval=931464139 TSecr=1115497784"
"19","0.065231","23.13.164.38","100.86.243.187","TLSv1.2","899","Application Data"
"20","0.065299","100.86.243.187","23.13.164.38","TCP","66","54993  >  443 [ACK] Seq=909 Ack=2297 Win=37443 Len=0 TSval=931464165 TSecr=1115497811"
"21","0.065940","23.13.164.38","100.86.243.187","TLSv1.2","796","Application Data"
"22","0.065997","100.86.243.187","23.13.164.38","TCP","66","54993  >  443 [ACK] Seq=909 Ack=3027 Win=37444 Len=0 TSval=931464167 TSecr=1115497811"
"23","0.076211","100.86.243.187","23.13.164.38","TLSv1.2","859","Application Data"
"24","0.108466","23.13.164.38","100.86.243.187","TLSv1.2","771","Application Data"
"25","0.108491","23.13.164.38","100.86.243.187","TCP","1514","443  >  54993 [ACK] Seq=3732 Ack=1702 Win=8244 Len=1448 TSval=1115497854 TSecr=931464177 [TCP PDU reassembled in 38]"
"26","0.108491","23.13.164.38","100.86.243.187","TCP","1514","443  >  54993 [ACK] Seq=5180 Ack=1702 Win=8244 Len=1448 TSval=1115497854 TSecr=931464177 [TCP PDU reassembled in 38]"
"27","0.108547","100.86.243.187","23.13.164.38","TCP","66","54993  >  443 [ACK] Seq=1702 Ack=3732 Win=37445 Len=0 TSval=931464209 TSecr=1115497854"
"28","0.108711","100.86.243.187","23.13.164.38","TCP","66","54993  >  443 [ACK] Seq=1702 Ack=6628 Win=37456 Len=0 TSval=931464209 TSecr=1115497854"
"29","0.110201","23.13.164.38","100.86.243.187","TCP","1514","443  >  54993 [ACK] Seq=6628 Ack=1702 Win=8244 Len=1448 TSval=1115497854 TSecr=931464177 [TCP PDU reassembled in 38]"
"30","0.110202","23.13.164.38","100.86.243.187","TCP","1514","443  >  54993 [ACK] Seq=8076 Ack=1702 Win=8244 Len=1448 TSval=1115497854 TSecr=931464177 [TCP PDU reassembled in 38]"
"31","0.110202","23.13.164.38","100.86.243.187","TCP","1514","443  >  54993 [ACK] Seq=9524 Ack=1702 Win=8244 Len=1448 TSval=1115497854 TSecr=931464177 [TCP PDU reassembled in 38]"
"32","0.110203","23.13.164.38","100.86.243.187","TCP","1514","443  >  54993 [ACK] Seq=10972 Ack=1702 Win=8244 Len=1448 TSval=1115497854 TSecr=931464177 [TCP PDU reassembled in 38]"
"33","0.110293","100.86.243.187","23.13.164.38","TCP","66","54993  >  443 [ACK] Seq=1702 Ack=12420 Win=37456 Len=0 TSval=931464211 TSecr=1115497854"
"34","0.111493","23.13.164.38","100.86.243.187","TCP","1514","443  >  54993 [ACK] Seq=12420 Ack=1702 Win=8244 Len=1448 TSval=1115497854 TSecr=931464177 [TCP PDU reassembled in 38]"
"35","0.111493","23.13.164.38","100.86.243.187","TCP","1514","443  >  54993 [ACK] Seq=13868 Ack=1702 Win=8244 Len=1448 TSval=1115497854 TSecr=931464177 [TCP PDU reassembled in 38]"
"36","0.111494","23.13.164.38","100.86.243.187","TCP","1514","443  >  54993 [ACK] Seq=15316 Ack=1702 Win=8244 Len=1448 TSval=1115497854 TSecr=931464177 [TCP PDU reassembled in 38]"
"37","0.111494","23.13.164.38","100.86.243.187","TCP","1514","443  >  54993 [ACK] Seq=16764 Ack=1702 Win=8244 Len=1448 TSval=1115497854 TSecr=931464177 [TCP PDU reassembled in 38]"
"38","0.111495","23.13.164.38","100.86.243.187","TLSv1.2","239","Application Data"
"39","0.111574","100.86.243.187","23.13.164.38","TCP","66","54993  >  443 [ACK] Seq=1702 Ack=18385 Win=37456 Len=0 TSval=931464212 TSecr=1115497854"
"40","0.115049","100.86.243.187","23.13.164.38","TLSv1.2","330","Application Data"
"41","0.149301","100.86.243.187","23.13.164.38","TLSv1.2","920","Application Data"
"42","0.149591","100.86.243.187","23.13.164.38","TLSv1.2","949","Application Data"
"43","0.153563","23.13.164.38","100.86.243.187","TLSv1.2","770","Application Data"
"44","0.153566","23.13.164.38","100.86.243.187","TCP","1514","443  >  54993 [ACK] Seq=19089 Ack=1966 Win=8266 Len=1448 TSval=1115497890 TSecr=931464216 [TCP PDU reassembled in 58]"
"45","0.153567","23.13.164.38","100.86.243.187","TCP","1514","443  >  54993 [ACK] Seq=20537 Ack=1966 Win=8266 Len=1448 TSval=1115497890 TSecr=931464216 [TCP PDU reassembled in 58]"
"46","0.153658","100.86.243.187","23.13.164.38","TCP","66","54993  >  443 [ACK] Seq=3703 Ack=21985 Win=37399 Len=0 TSval=931464254 TSecr=1115497890"
"47","0.153815","100.86.243.187","23.13.164.38","TCP","66","[TCP Window Update] 54993  >  443 [ACK] Seq=3703 Ack=21985 Win=37456 Len=0 TSval=931464254 TSecr=1115497890"
"49","0.154087","23.13.164.38","100.86.243.187","TCP","1514","443  >  54993 [ACK] Seq=21985 Ack=1966 Win=8266 Len=1448 TSval=1115497890 TSecr=931464216 [TCP PDU reassembled in 58]"
"50","0.154088","23.13.164.38","100.86.243.187","TCP","1514","443  >  54993 [ACK] Seq=23433 Ack=1966 Win=8266 Len=1448 TSval=1115497890 TSecr=931464216 [TCP PDU reassembled in 58]"
"51","0.154089","23.13.164.38","100.86.243.187","TCP","1514","443  >  54993 [ACK] Seq=24881 Ack=1966 Win=8266 Len=1448 TSval=1115497890 TSecr=931464216 [TCP PDU reassembled in 58]"
"52","0.154089","23.13.164.38","100.86.243.187","TCP","1514","443  >  54993 [ACK] Seq=26329 Ack=1966 Win=8266 Len=1448 TSval=1115497890 TSecr=931464216 [TCP PDU reassembled in 58]"
"53","0.154149","100.86.243.187","23.13.164.38","TCP","66","54993  >  443 [ACK] Seq=3703 Ack=27777 Win=37456 Len=0 TSval=931464254 TSecr=1115497890"
"54","0.155478","23.13.164.38","100.86.243.187","TCP","1514","443  >  54993 [ACK] Seq=27777 Ack=1966 Win=8266 Len=1448 TSval=1115497890 TSecr=931464216 [TCP PDU reassembled in 58]"
"55","0.155479","23.13.164.38","100.86.243.187","TCP","1514","443  >  54993 [ACK] Seq=29225 Ack=1966 Win=8266 Len=1448 TSval=1115497890 TSecr=931464216 [TCP PDU reassembled in 58]"
"56","0.155480","23.13.164.38","100.86.243.187","TCP","1514","443  >  54993 [ACK] Seq=30673 Ack=1966 Win=8266 Len=1448 TSval=1115497890 TSecr=931464216 [TCP PDU reassembled in 58]"
"57","0.155481","23.13.164.38","100.86.243.187","TCP","1514","443  >  54993 [ACK] Seq=32121 Ack=1966 Win=8266 Len=1448 TSval=1115497890 TSecr=931464216 [TCP PDU reassembled in 58]"
"58","0.155481","23.13.164.38","100.86.243.187","TLSv1.2","239","Application Data"
"59","0.155582","100.86.243.187","23.13.164.38","TCP","66","54993  >  443 [ACK] Seq=3703 Ack=33742 Win=37456 Len=0 TSval=931464256 TSecr=1115497890"
"60","0.162689","23.13.164.38","100.86.243.187","TCP","66","443  >  54993 [ACK] Seq=33742 Ack=3703 Win=8312 Len=0 TSval=1115497908 TSecr=931464250"
"72","0.726653","23.13.164.38","100.86.243.187","TLSv1.2","713","Application Data"
"73","0.726654","23.13.164.38","100.86.243.187","TLSv1.2","1062","Application Data"
"74","0.726655","23.13.164.38","100.86.243.187","TCP","1514","443  >  54993 [ACK] Seq=35385 Ack=3703 Win=8312 Len=1448 TSval=1115498377 TSecr=931464256 [TCP PDU reassembled in 87]"
"75","0.726656","23.13.164.38","100.86.243.187","TCP","1514","443  >  54993 [ACK] Seq=36833 Ack=3703 Win=8312 Len=1448 TSval=1115498377 TSecr=931464256 [TCP PDU reassembled in 87]"
"76","0.726657","23.13.164.38","100.86.243.187","TCP","1514","443  >  54993 [ACK] Seq=38281 Ack=3703 Win=8312 Len=1448 TSval=1115498377 TSecr=931464256 [TCP PDU reassembled in 87]"
"77","0.726993","23.13.164.38","100.86.243.187","TCP","1514","443  >  54993 [ACK] Seq=39729 Ack=3703 Win=8312 Len=1448 TSval=1115498377 TSecr=931464256 [TCP PDU reassembled in 87]"
"78","0.726994","23.13.164.38","100.86.243.187","TCP","1514","443  >  54993 [ACK] Seq=41177 Ack=3703 Win=8312 Len=1448 TSval=1115498377 TSecr=931464256 [TCP PDU reassembled in 87]"
"79","0.727147","100.86.243.187","23.13.164.38","TCP","66","54993  >  443 [ACK] Seq=3703 Ack=42625 Win=37456 Len=0 TSval=931464827 TSecr=1115498377"
"80","0.727445","23.13.164.38","100.86.243.187","TCP","1514","443  >  54993 [ACK] Seq=42625 Ack=3703 Win=8312 Len=1448 TSval=1115498377 TSecr=931464256 [TCP PDU reassembled in 87]"
"81","0.727446","23.13.164.38","100.86.243.187","TCP","1514","443  >  54993 [ACK] Seq=44073 Ack=3703 Win=8312 Len=1448 TSval=1115498377 TSecr=931464256 [TCP PDU reassembled in 87]"
"82","0.727561","100.86.243.187","23.13.164.38","TCP","66","54993  >  443 [ACK] Seq=3703 Ack=45521 Win=37456 Len=0 TSval=931464827 TSecr=1115498377"
"83","0.728932","23.13.164.38","100.86.243.187","TCP","1514","443  >  54993 [ACK] Seq=45521 Ack=3703 Win=8312 Len=1448 TSval=1115498377 TSecr=931464256 [TCP PDU reassembled in 87]"
"84","0.728934","23.13.164.38","100.86.243.187","TCP","1514","443  >  54993 [ACK] Seq=46969 Ack=3703 Win=8312 Len=1448 TSval=1115498377 TSecr=931464256 [TCP PDU reassembled in 87]"
"85","0.728934","23.13.164.38","100.86.243.187","TCP","1514","443  >  54993 [ACK] Seq=48417 Ack=3703 Win=8312 Len=1448 TSval=1115498377 TSecr=931464256 [TCP PDU reassembled in 87]"
"86","0.728935","23.13.164.38","100.86.243.187","TCP","1514","443  >  54993 [PSH, ACK] Seq=49865 Ack=3703 Win=8312 Len=1448 TSval=1115498377 TSecr=931464256 [TCP PDU reassembled in 87]"
"87","0.728936","23.13.164.38","100.86.243.187","TLSv1.2","544","Application Data"
"88","0.728936","23.13.164.38","100.86.243.187","TLSv1.2","1514","Application Data"
"89","0.728937","23.13.164.38","100.86.243.187","TCP","1514","443  >  54993 [ACK] Seq=53239 Ack=3703 Win=8312 Len=1448 TSval=1115498377 TSecr=931464256 [TCP PDU reassembled in 101]"
"90","0.728938","23.13.164.38","100.86.243.187","TCP","1514","443  >  54993 [ACK] Seq=54687 Ack=3703 Win=8312 Len=1448 TSval=1115498377 TSecr=931464256 [TCP PDU reassembled in 101]"
"91","0.728939","23.13.164.38","100.86.243.187","TCP","1514","443  >  54993 [ACK] Seq=56135 Ack=3703 Win=8312 Len=1448 TSval=1115498377 TSecr=931464256 [TCP PDU reassembled in 101]"
"92","0.728940","23.13.164.38","100.86.243.187","TCP","1514","443  >  54993 [ACK] Seq=57583 Ack=3703 Win=8312 Len=1448 TSval=1115498377 TSecr=931464256 [TCP PDU reassembled in 101]"
"93","0.728940","23.13.164.38","100.86.243.187","TCP","1514","443  >  54993 [ACK] Seq=59031 Ack=3703 Win=8312 Len=1448 TSval=1115498377 TSecr=931464256 [TCP PDU reassembled in 101]"
"94","0.728941","23.13.164.38","100.86.243.187","TCP","1514","443  >  54993 [ACK] Seq=60479 Ack=3703 Win=8312 Len=1448 TSval=1115498377 TSecr=931464256 [TCP PDU reassembled in 101]"
"95","0.728942","23.13.164.38","100.86.243.187","TCP","1514","443  >  54993 [ACK] Seq=61927 Ack=3703 Win=8312 Len=1448 TSval=1115498377 TSecr=931464256 [TCP PDU reassembled in 101]"
"96","0.728943","23.13.164.38","100.86.243.187","TCP","1514","443  >  54993 [ACK] Seq=63375 Ack=3703 Win=8312 Len=1448 TSval=1115498377 TSecr=931464256 [TCP PDU reassembled in 101]"
"97","0.728943","23.13.164.38","100.86.243.187","TCP","1514","443  >  54993 [ACK] Seq=64823 Ack=3703 Win=8312 Len=1448 TSval=1115498377 TSecr=931464256 [TCP PDU reassembled in 101]"
"98","0.728944","23.13.164.38","100.86.243.187","TCP","1514","443  >  54993 [PSH, ACK] Seq=66271 Ack=3703 Win=8312 Len=1448 TSval=1115498377 TSecr=931464256 [TCP PDU reassembled in 101]"
"101","0.728953","23.13.164.38","100.86.243.187","TLSv1.2","1514","Application Data, Application Data"
"102","0.728954","23.13.164.38","100.86.243.187","TCP","1514","443  >  54993 [ACK] Seq=69167 Ack=3703 Win=8312 Len=1448 TSval=1115498378 TSecr=931464256 [TCP PDU reassembled in 115]"
"103","0.728955","23.13.164.38","100.86.243.187","TCP","1514","443  >  54993 [ACK] Seq=70615 Ack=3703 Win=8312 Len=1448 TSval=1115498378 TSecr=931464256 [TCP PDU reassembled in 115]"
"104","0.729007","23.13.164.38","100.86.243.187","TCP","1514","443  >  54993 [ACK] Seq=72063 Ack=3703 Win=8312 Len=1448 TSval=1115498378 TSecr=931464256 [TCP PDU reassembled in 115]"
"105","0.729008","23.13.164.38","100.86.243.187","TCP","1514","443  >  54993 [ACK] Seq=73511 Ack=3703 Win=8312 Len=1448 TSval=1115498378 TSecr=931464256 [TCP PDU reassembled in 115]"
"106","0.729009","23.13.164.38","100.86.243.187","TCP","1514","443  >  54993 [ACK] Seq=74959 Ack=3703 Win=8312 Len=1448 TSval=1115498378 TSecr=931464256 [TCP PDU reassembled in 115]"
"108","0.729606","100.86.243.187","23.13.164.38","TCP","66","54993  >  443 [ACK] Seq=3703 Ack=76407 Win=37456 Len=0 TSval=931464830 TSecr=1115498377"
"109","0.730422","23.13.164.38","100.86.243.187","TCP","1514","443  >  54993 [ACK] Seq=76407 Ack=3703 Win=8312 Len=1448 TSval=1115498378 TSecr=931464256 [TCP PDU reassembled in 115]"
"110","0.730423","23.13.164.38","100.86.243.187","TCP","1514","443  >  54993 [ACK] Seq=77855 Ack=3703 Win=8312 Len=1448 TSval=1115498378 TSecr=931464256 [TCP PDU reassembled in 115]"
"111","0.730425","23.13.164.38","100.86.243.187","TCP","1514","443  >  54993 [ACK] Seq=79303 Ack=3703 Win=8312 Len=1448 TSval=1115498378 TSecr=931464256 [TCP PDU reassembled in 115]"
"112","0.730426","23.13.164.38","100.86.243.187","TCP","1514","443  >  54993 [ACK] Seq=80751 Ack=3703 Win=8312 Len=1448 TSval=1115498378 TSecr=931464256 [TCP PDU reassembled in 115]"
"113","0.730427","23.13.164.38","100.86.243.187","TCP","1514","443  >  54993 [PSH, ACK] Seq=82199 Ack=3703 Win=8312 Len=1448 TSval=1115498378 TSecr=931464256 [TCP PDU reassembled in 115]"
"115","0.730429","23.13.164.38","100.86.243.187","TLSv1.2","1514","Application Data, Application Data"
"116","0.730429","23.13.164.38","100.86.243.187","TCP","1514","443  >  54993 [ACK] Seq=85095 Ack=3703 Win=8312 Len=1448 TSval=1115498379 TSecr=931464256 [TCP PDU reassembled in 128]"
"117","0.730433","23.13.164.38","100.86.243.187","TCP","1514","443  >  54993 [ACK] Seq=86543 Ack=3703 Win=8312 Len=1448 TSval=1115498379 TSecr=931464256 [TCP PDU reassembled in 128]"
"118","0.730435","23.13.164.38","100.86.243.187","TCP","1514","443  >  54993 [ACK] Seq=87991 Ack=3703 Win=8312 Len=1448 TSval=1115498379 TSecr=931464256 [TCP PDU reassembled in 128]"
"119","0.730436","23.13.164.38","100.86.243.187","TCP","1514","443  >  54993 [ACK] Seq=89439 Ack=3703 Win=8312 Len=1448 TSval=1115498379 TSecr=931464256 [TCP PDU reassembled in 128]"
"120","0.730436","23.13.164.38","100.86.243.187","TCP","1514","443  >  54993 [ACK] Seq=90887 Ack=3703 Win=8312 Len=1448 TSval=1115498379 TSecr=931464256 [TCP PDU reassembled in 128]"
"121","0.730438","23.13.164.38","100.86.243.187","TCP","1514","443  >  54993 [ACK] Seq=92335 Ack=3703 Win=8312 Len=1448 TSval=1115498379 TSecr=931464256 [TCP PDU reassembled in 128]"
"122","0.730438","23.13.164.38","100.86.243.187","TCP","1514","443  >  54993 [ACK] Seq=93783 Ack=3703 Win=8312 Len=1448 TSval=1115498379 TSecr=931464256 [TCP PDU reassembled in 128]"
"123","0.730440","23.13.164.38","100.86.243.187","TCP","1514","443  >  54993 [ACK] Seq=95231 Ack=3703 Win=8312 Len=1448 TSval=1115498379 TSecr=931464256 [TCP PDU reassembled in 128]"
"124","0.730441","23.13.164.38","100.86.243.187","TCP","1514","443  >  54993 [ACK] Seq=96679 Ack=3703 Win=8312 Len=1448 TSval=1115498379 TSecr=931464256 [TCP PDU reassembled in 128]"
"125","0.730441","23.13.164.38","100.86.243.187","TCP","1514","443  >  54993 [PSH, ACK] Seq=98127 Ack=3703 Win=8312 Len=1448 TSval=1115498379 TSecr=931464256 [TCP PDU reassembled in 128]"
"127","0.730443","23.13.164.38","100.86.243.187","TCP","1514","443  >  54993 [ACK] Seq=99575 Ack=3703 Win=8312 Len=1448 TSval=1115498380 TSecr=931464256 [TCP PDU reassembled in 128]"
"128","0.730444","23.13.164.38","100.86.243.187","TLSv1.2","1514","Application Data, Application Data"
"130","0.730924","100.86.243.187","23.13.164.38","TCP","66","54993  >  443 [ACK] Seq=3703 Ack=102471 Win=37456 Len=0 TSval=931464831 TSecr=1115498379"
"131","0.731821","23.13.164.38","100.86.243.187","TCP","1514","443  >  54993 [ACK] Seq=102471 Ack=3703 Win=8312 Len=1448 TSval=1115498380 TSecr=931464256 [TCP PDU reassembled in 141]"
"132","0.731822","23.13.164.38","100.86.243.187","TCP","1514","443  >  54993 [ACK] Seq=103919 Ack=3703 Win=8312 Len=1448 TSval=1115498380 TSecr=931464256 [TCP PDU reassembled in 141]"
"133","0.731823","23.13.164.38","100.86.243.187","TCP","1514","443  >  54993 [ACK] Seq=105367 Ack=3703 Win=8312 Len=1448 TSval=1115498380 TSecr=931464256 [TCP PDU reassembled in 141]"
"134","0.731824","23.13.164.38","100.86.243.187","TCP","1514","443  >  54993 [ACK] Seq=106815 Ack=3703 Win=8312 Len=1448 TSval=1115498380 TSecr=931464256 [TCP PDU reassembled in 141]"
"135","0.731825","23.13.164.38","100.86.243.187","TCP","1514","443  >  54993 [ACK] Seq=108263 Ack=3703 Win=8312 Len=1448 TSval=1115498380 TSecr=931464256 [TCP PDU reassembled in 141]"
"136","0.731825","23.13.164.38","100.86.243.187","TCP","1514","443  >  54993 [ACK] Seq=109711 Ack=3703 Win=8312 Len=1448 TSval=1115498380 TSecr=931464256 [TCP PDU reassembled in 141]"
"137","0.731826","23.13.164.38","100.86.243.187","TCP","1514","443  >  54993 [ACK] Seq=111159 Ack=3703 Win=8312 Len=1448 TSval=1115498380 TSecr=931464256 [TCP PDU reassembled in 141]"
"138","0.731827","23.13.164.38","100.86.243.187","TCP","1514","443  >  54993 [ACK] Seq=112607 Ack=3703 Win=8312 Len=1448 TSval=1115498380 TSecr=931464256 [TCP PDU reassembled in 141]"
"139","0.731828","23.13.164.38","100.86.243.187","TCP","1514","443  >  54993 [PSH, ACK] Seq=114055 Ack=3703 Win=8312 Len=1448 TSval=1115498380 TSecr=931464256 [TCP PDU reassembled in 141]"
"140","0.731829","23.13.164.38","100.86.243.187","TCP","1514","443  >  54993 [ACK] Seq=115503 Ack=3703 Win=8312 Len=1448 TSval=1115498381 TSecr=931464256 [TCP PDU reassembled in 141]"
"141","0.731830","23.13.164.38","100.86.243.187","TLSv1.2","1514","Application Data, Application Data"
"142","0.731831","23.13.164.38","100.86.243.187","TCP","1514","443  >  54993 [ACK] Seq=118399 Ack=3703 Win=8312 Len=1448 TSval=1115498381 TSecr=931464256 [TCP PDU reassembled in 201]"
"143","0.731832","23.13.164.38","100.86.243.187","TCP","1514","443  >  54993 [ACK] Seq=119847 Ack=3703 Win=8312 Len=1448 TSval=1115498381 TSecr=931464256 [TCP PDU reassembled in 201]"
"144","0.731833","23.13.164.38","100.86.243.187","TCP","1514","443  >  54993 [ACK] Seq=121295 Ack=3703 Win=8312 Len=1448 TSval=1115498381 TSecr=931464256 [TCP PDU reassembled in 201]"
"145","0.731834","23.13.164.38","100.86.243.187","TCP","1514","[TCP Previous segment not captured] 443  >  54993 [ACK] Seq=124191 Ack=3703 Win=8312 Len=1448 TSval=1115498381 TSecr=931464256 [TCP PDU reassembled in 201]"
"146","0.731834","23.13.164.38","100.86.243.187","TCP","1514","443  >  54993 [ACK] Seq=125639 Ack=3703 Win=8312 Len=1448 TSval=1115498381 TSecr=931464256 [TCP PDU reassembled in 201]"
"147","0.731915","100.86.243.187","23.13.164.38","TCP","78","54993  >  443 [ACK] Seq=3703 Ack=122743 Win=37139 Len=0 TSval=931464833 TSecr=1115498381 SLE=124191 SRE=127087"
"148","0.732118","100.86.243.187","23.13.164.38","TCP","78","[TCP Dup ACK 147#1] 54993  >  443 [ACK] Seq=3703 Ack=122743 Win=37456 Len=0 TSval=931464833 TSecr=1115498381 SLE=124191 SRE=127087"
"149","0.732904","23.13.164.38","100.86.243.187","TCP","1514","443  >  54993 [ACK] Seq=127087 Ack=3703 Win=8312 Len=1448 TSval=1115498381 TSecr=931464256 [TCP PDU reassembled in 201]"
"150","0.732905","23.13.164.38","100.86.243.187","TCP","1514","443  >  54993 [ACK] Seq=128535 Ack=3703 Win=8312 Len=1448 TSval=1115498381 TSecr=931464256 [TCP PDU reassembled in 201]"
"151","0.732906","23.13.164.38","100.86.243.187","TCP","1514","443  >  54993 [PSH, ACK] Seq=129983 Ack=3703 Win=8312 Len=1448 TSval=1115498381 TSecr=931464256 [TCP PDU reassembled in 201]"
"152","0.732907","23.13.164.38","100.86.243.187","TCP","1514","443  >  54993 [ACK] Seq=131431 Ack=3703 Win=8312 Len=1448 TSval=1115498382 TSecr=931464256 [TCP PDU reassembled in 201]"
"153","0.732908","23.13.164.38","100.86.243.187","TCP","1514","443  >  54993 [ACK] Seq=132879 Ack=3703 Win=8312 Len=1448 TSval=1115498382 TSecr=931464256 [TCP PDU reassembled in 201], Application Data"
"154","0.732908","23.13.164.38","100.86.243.187","TCP","1514","443  >  54993 [ACK] Seq=134327 Ack=3703 Win=8312 Len=1448 TSval=1115498382 TSecr=931464256 [TCP PDU reassembled in 161]"
"155","0.732909","23.13.164.38","100.86.243.187","TCP","1514","443  >  54993 [ACK] Seq=135775 Ack=3703 Win=8312 Len=1448 TSval=1115498382 TSecr=931464256 [TCP PDU reassembled in 161]"
"156","0.732910","23.13.164.38","100.86.243.187","TCP","1514","443  >  54993 [ACK] Seq=137223 Ack=3703 Win=8312 Len=1448 TSval=1115498382 TSecr=931464256 [TCP PDU reassembled in 161]"
"157","0.732911","23.13.164.38","100.86.243.187","TCP","1514","443  >  54993 [ACK] Seq=138671 Ack=3703 Win=8312 Len=1448 TSval=1115498382 TSecr=931464256 [TCP PDU reassembled in 161]"
"158","0.732911","23.13.164.38","100.86.243.187","TCP","1514","443  >  54993 [ACK] Seq=140119 Ack=3703 Win=8312 Len=1448 TSval=1115498382 TSecr=931464256 [TCP PDU reassembled in 161]"
"159","0.732912","23.13.164.38","100.86.243.187","TCP","1514","443  >  54993 [ACK] Seq=141567 Ack=3703 Win=8312 Len=1448 TSval=1115498382 TSecr=931464256 [TCP PDU reassembled in 161]"
"160","0.732913","23.13.164.38","100.86.243.187","TCP","1514","443  >  54993 [ACK] Seq=143015 Ack=3703 Win=8312 Len=1448 TSval=1115498382 TSecr=931464256 [TCP PDU reassembled in 161]"
"161","0.732914","23.13.164.38","100.86.243.187","TLSv1.2","1514","Application Data"
"162","0.732914","23.13.164.38","100.86.243.187","TCP","1514","443  >  54993 [PSH, ACK] Seq=145911 Ack=3703 Win=8312 Len=1448 TSval=1115498382 TSecr=931464256 [TCP PDU reassembled in 173]"
"164","0.732916","23.13.164.38","100.86.243.187","TCP","1514","443  >  54993 [ACK] Seq=147359 Ack=3703 Win=8312 Len=1448 TSval=1115498383 TSecr=931464256 [TCP PDU reassembled in 173]"
"165","0.733320","100.86.243.187","23.13.164.38","TCP","78","[TCP Dup ACK 147#2] 54993  >  443 [ACK] Seq=3703 Ack=122743 Win=37456 Len=0 TSval=931464834 TSecr=1115498381 SLE=124191 SRE=148807"
"167","0.733349","23.13.164.38","100.86.243.187","TCP","1514","443  >  54993 [ACK] Seq=148807 Ack=3703 Win=8312 Len=1448 TSval=1115498383 TSecr=931464256 [TCP PDU reassembled in 173]"
"168","0.733350","23.13.164.38","100.86.243.187","TCP","1514","443  >  54993 [ACK] Seq=150255 Ack=3703 Win=8312 Len=1448 TSval=1115498383 TSecr=931464256 [TCP PDU reassembled in 173]"
"169","0.733350","23.13.164.38","100.86.243.187","TCP","1514","443  >  54993 [ACK] Seq=151703 Ack=3703 Win=8312 Len=1448 TSval=1115498383 TSecr=931464256 [TCP PDU reassembled in 173]"
"170","0.733351","23.13.164.38","100.86.243.187","TCP","1514","443  >  54993 [ACK] Seq=153151 Ack=3703 Win=8312 Len=1448 TSval=1115498383 TSecr=931464256 [TCP PDU reassembled in 173]"
"171","0.733352","23.13.164.38","100.86.243.187","TCP","1514","443  >  54993 [ACK] Seq=154599 Ack=3703 Win=8312 Len=1448 TSval=1115498383 TSecr=931464256 [TCP PDU reassembled in 173]"
"172","0.733353","23.13.164.38","100.86.243.187","TCP","1514","443  >  54993 [ACK] Seq=156047 Ack=3703 Win=8312 Len=1448 TSval=1115498383 TSecr=931464256 [TCP PDU reassembled in 173]"
"173","0.733354","23.13.164.38","100.86.243.187","TLSv1.2","1514","Application Data"
"174","0.733355","23.13.164.38","100.86.243.187","TCP","1514","443  >  54993 [ACK] Seq=158943 Ack=3703 Win=8312 Len=1448 TSval=1115498383 TSecr=931464256 [TCP PDU reassembled in 176]"
"175","0.733412","100.86.243.187","23.13.164.38","TCP","78","[TCP Dup ACK 147#3] 54993  >  443 [ACK] Seq=3703 Ack=122743 Win=37456 Len=0 TSval=931464834 TSecr=1115498381 SLE=124191 SRE=160391"
"176","0.733749","23.13.164.38","100.86.243.187","TLSv1.2","1514","Application Data"
"177","0.733750","23.13.164.38","100.86.243.187","TCP","1514","443  >  54993 [PSH, ACK] Seq=161839 Ack=3703 Win=8312 Len=1448 TSval=1115498383 TSecr=931464256 [TCP PDU reassembled in 179]"
"178","0.733751","23.13.164.38","100.86.243.187","TCP","1514","443  >  54993 [ACK] Seq=163287 Ack=3703 Win=8312 Len=1448 TSval=1115498384 TSecr=931464256 [TCP PDU reassembled in 179]"
"179","0.733751","23.13.164.38","100.86.243.187","TLSv1.2","1514","Application Data"
"180","0.733811","100.86.243.187","23.13.164.38","TCP","78","[TCP Dup ACK 147#4] 54993  >  443 [ACK] Seq=3703 Ack=122743 Win=37456 Len=0 TSval=931464834 TSecr=1115498381 SLE=124191 SRE=166183"
"181","0.733992","23.13.164.38","100.86.243.187","TCP","1514","443  >  54993 [ACK] Seq=166183 Ack=3703 Win=8312 Len=1448 TSval=1115498384 TSecr=931464256 [TCP PDU reassembled in 183]"
"182","0.733993","23.13.164.38","100.86.243.187","TCP","1514","443  >  54993 [ACK] Seq=167631 Ack=3703 Win=8312 Len=1448 TSval=1115498384 TSecr=931464256 [TCP PDU reassembled in 183]"
"183","0.733994","23.13.164.38","100.86.243.187","TLSv1.2","1514","Application Data"
"184","0.733995","23.13.164.38","100.86.243.187","TCP","1514","443  >  54993 [ACK] Seq=170527 Ack=3703 Win=8312 Len=1448 TSval=1115498384 TSecr=931464256 [TCP PDU reassembled in 187]"
"185","0.734053","100.86.243.187","23.13.164.38","TCP","78","[TCP Dup ACK 147#5] 54993  >  443 [ACK] Seq=3703 Ack=122743 Win=37456 Len=0 TSval=931464835 TSecr=1115498381 SLE=124191 SRE=171975"
"186","0.734325","23.13.164.38","100.86.243.187","TCP","1514","443  >  54993 [ACK] Seq=171975 Ack=3703 Win=8312 Len=1448 TSval=1115498384 TSecr=931464256 [TCP PDU reassembled in 187]"
"187","0.734327","23.13.164.38","100.86.243.187","TLSv1.2","1514","Application Data"
"188","0.734327","23.13.164.38","100.86.243.187","TCP","1514","443  >  54993 [ACK] Seq=174871 Ack=3703 Win=8312 Len=1448 TSval=1115498384 TSecr=931464256 [TCP PDU reassembled in 191]"
"189","0.734328","23.13.164.38","100.86.243.187","TCP","1514","443  >  54993 [ACK] Seq=176319 Ack=3703 Win=8312 Len=1448 TSval=1115498384 TSecr=931464256 [TCP PDU reassembled in 191]"
"190","0.734370","100.86.243.187","23.13.164.38","TCP","78","[TCP Dup ACK 147#6] 54993  >  443 [ACK] Seq=3703 Ack=122743 Win=37456 Len=0 TSval=931464835 TSecr=1115498381 SLE=124191 SRE=177767"
"191","0.735837","23.13.164.38","100.86.243.187","TLSv1.2","1514","Application Data"
"192","0.735838","23.13.164.38","100.86.243.187","TLSv1.2","1068","Application Data"
"194","0.735839","23.13.164.38","100.86.243.187","TCP","1068","[TCP Fast Retransmission] 443  >  54993 [PSH, ACK] Seq=179215 Ack=3703 Win=8312 Len=1002 TSval=1115498417 TSecr=931464256 [TCP PDU reassembled in 192]"
"198","0.735988","100.86.243.187","23.13.164.38","TCP","78","[TCP Dup ACK 147#7] 54993  >  443 [ACK] Seq=3703 Ack=122743 Win=37456 Len=0 TSval=931464837 TSecr=1115498381 SLE=124191 SRE=180217"
"199","0.736013","100.86.243.187","23.13.164.38","TCP","86","[TCP Dup ACK 147#8] 54993  >  443 [ACK] Seq=3703 Ack=122743 Win=37456 Len=0 TSval=931464837 TSecr=1115498381 SLE=179215 SRE=180217 SLE=124191 SRE=180217"
"201","0.746129","23.13.164.38","100.86.243.187","TLSv1.2","1514","[TCP Fast Retransmission] , Application Data"
"202","0.746211","100.86.243.187","23.13.164.38","TCP","66","54993  >  443 [ACK] Seq=3703 Ack=180217 Win=36558 Len=0 TSval=931464847 TSecr=1115498492"
"203","0.746707","100.86.243.187","23.13.164.38","TCP","66","[TCP Window Update] 54993  >  443 [ACK] Seq=3703 Ack=180217 Win=37456 Len=0 TSval=931464847 TSecr=1115498492"
"204","0.880249","23.13.164.38","100.86.243.187","TLSv1.2","712","Application Data"
"205","0.880327","100.86.243.187","23.13.164.38","TCP","66","54993  >  443 [ACK] Seq=3703 Ack=180863 Win=37446 Len=0 TSval=931464981 TSecr=1115498626"
"206","0.880648","23.13.164.38","100.86.243.187","TLSv1.2","1062","Application Data"
"207","0.880691","100.86.243.187","23.13.164.38","TCP","66","54993  >  443 [ACK] Seq=3703 Ack=181859 Win=37440 Len=0 TSval=931464981 TSecr=1115498626"
"208","0.881793","23.13.164.38","100.86.243.187","TCP","1514","443  >  54993 [ACK] Seq=181859 Ack=3703 Win=8312 Len=1448 TSval=1115498627 TSecr=931464847 [TCP PDU reassembled in 223]"
"209","0.881795","23.13.164.38","100.86.243.187","TCP","1514","443  >  54993 [ACK] Seq=183307 Ack=3703 Win=8312 Len=1448 TSval=1115498627 TSecr=931464847 [TCP PDU reassembled in 223]"
"210","0.881795","23.13.164.38","100.86.243.187","TCP","1514","443  >  54993 [ACK] Seq=184755 Ack=3703 Win=8312 Len=1448 TSval=1115498627 TSecr=931464847 [TCP PDU reassembled in 223]"
"211","0.881855","100.86.243.187","23.13.164.38","TCP","66","54993  >  443 [ACK] Seq=3703 Ack=186203 Win=37388 Len=0 TSval=931464983 TSecr=1115498627"
"212","0.881919","100.86.243.187","23.13.164.38","TCP","66","[TCP Window Update] 54993  >  443 [ACK] Seq=3703 Ack=186203 Win=37456 Len=0 TSval=931464983 TSecr=1115498627"
"213","0.882332","23.13.164.38","100.86.243.187","TCP","1514","443  >  54993 [ACK] Seq=186203 Ack=3703 Win=8312 Len=1448 TSval=1115498627 TSecr=931464847 [TCP PDU reassembled in 223]"
"214","0.882333","23.13.164.38","100.86.243.187","TCP","1514","443  >  54993 [ACK] Seq=187651 Ack=3703 Win=8312 Len=1448 TSval=1115498627 TSecr=931464847 [TCP PDU reassembled in 223]"
"215","0.882382","100.86.243.187","23.13.164.38","TCP","66","54993  >  443 [ACK] Seq=3703 Ack=189099 Win=37410 Len=0 TSval=931464983 TSecr=1115498627"
"216","0.882433","100.86.243.187","23.13.164.38","TCP","66","[TCP Window Update] 54993  >  443 [ACK] Seq=3703 Ack=189099 Win=37456 Len=0 TSval=931464983 TSecr=1115498627"
"217","0.883953","23.13.164.38","100.86.243.187","TCP","1514","443  >  54993 [ACK] Seq=189099 Ack=3703 Win=8312 Len=1448 TSval=1115498627 TSecr=931464847 [TCP PDU reassembled in 223]"
"218","0.883954","23.13.164.38","100.86.243.187","TCP","1514","443  >  54993 [ACK] Seq=190547 Ack=3703 Win=8312 Len=1448 TSval=1115498627 TSecr=931464847 [TCP PDU reassembled in 223]"
"219","0.883954","23.13.164.38","100.86.243.187","TCP","1514","443  >  54993 [ACK] Seq=191995 Ack=3703 Win=8312 Len=1448 TSval=1115498627 TSecr=931464847 [TCP PDU reassembled in 223]"
"220","0.883955","23.13.164.38","100.86.243.187","TCP","1514","443  >  54993 [ACK] Seq=193443 Ack=3703 Win=8312 Len=1448 TSval=1115498627 TSecr=931464847 [TCP PDU reassembled in 223]"
"221","0.883956","23.13.164.38","100.86.243.187","TCP","1514","443  >  54993 [ACK] Seq=194891 Ack=3703 Win=8312 Len=1448 TSval=1115498627 TSecr=931464847 [TCP PDU reassembled in 223]"
"222","0.883956","23.13.164.38","100.86.243.187","TCP","1514","443  >  54993 [PSH, ACK] Seq=196339 Ack=3703 Win=8312 Len=1448 TSval=1115498627 TSecr=931464847 [TCP PDU reassembled in 223]"
"223","0.883957","23.13.164.38","100.86.243.187","TLSv1.2","544","Application Data"
"224","0.883958","23.13.164.38","100.86.243.187","TLSv1.2","1514","Application Data"
"225","0.883958","23.13.164.38","100.86.243.187","TCP","1514","443  >  54993 [ACK] Seq=199713 Ack=3703 Win=8312 Len=1448 TSval=1115498628 TSecr=931464847 [TCP PDU reassembled in 239]"
"226","0.883959","23.13.164.38","100.86.243.187","TCP","1514","443  >  54993 [ACK] Seq=201161 Ack=3703 Win=8312 Len=1448 TSval=1115498628 TSecr=931464847 [TCP PDU reassembled in 239]"
"227","0.884010","100.86.243.187","23.13.164.38","TCP","66","54993  >  443 [ACK] Seq=3703 Ack=202609 Win=37245 Len=0 TSval=931464985 TSecr=1115498628"
"228","0.884172","100.86.243.187","23.13.164.38","TCP","66","[TCP Window Update] 54993  >  443 [ACK] Seq=3703 Ack=202609 Win=37456 Len=0 TSval=931464985 TSecr=1115498628"
"229","0.884252","23.13.164.38","100.86.243.187","TCP","1514","443  >  54993 [ACK] Seq=202609 Ack=3703 Win=8312 Len=1448 TSval=1115498628 TSecr=931464847 [TCP PDU reassembled in 239]"
"230","0.884252","23.13.164.38","100.86.243.187","TCP","1514","443  >  54993 [ACK] Seq=204057 Ack=3703 Win=8312 Len=1448 TSval=1115498628 TSecr=931464847 [TCP PDU reassembled in 239]"
"231","0.884296","100.86.243.187","23.13.164.38","TCP","66","54993  >  443 [ACK] Seq=3703 Ack=205505 Win=37410 Len=0 TSval=931464985 TSecr=1115498628"
"232","0.884343","100.86.243.187","23.13.164.38","TCP","66","[TCP Window Update] 54993  >  443 [ACK] Seq=3703 Ack=205505 Win=37456 Len=0 TSval=931464985 TSecr=1115498628"
"233","0.885626","23.13.164.38","100.86.243.187","TCP","1514","443  >  54993 [ACK] Seq=205505 Ack=3703 Win=8312 Len=1448 TSval=1115498628 TSecr=931464847 [TCP PDU reassembled in 239]"
"234","0.885626","23.13.164.38","100.86.243.187","TCP","1514","443  >  54993 [ACK] Seq=206953 Ack=3703 Win=8312 Len=1448 TSval=1115498628 TSecr=931464847 [TCP PDU reassembled in 239]"
"235","0.885627","23.13.164.38","100.86.243.187","TCP","1514","443  >  54993 [ACK] Seq=208401 Ack=3703 Win=8312 Len=1448 TSval=1115498628 TSecr=931464847 [TCP PDU reassembled in 239]"
"236","0.885628","23.13.164.38","100.86.243.187","TCP","1514","443  >  54993 [ACK] Seq=209849 Ack=3703 Win=8312 Len=1448 TSval=1115498628 TSecr=931464847 [TCP PDU reassembled in 239]"
"237","0.885628","23.13.164.38","100.86.243.187","TCP","1514","443  >  54993 [ACK] Seq=211297 Ack=3703 Win=8312 Len=1448 TSval=1115498628 TSecr=931464847 [TCP PDU reassembled in 239]"
"238","0.885629","23.13.164.38","100.86.243.187","TCP","1514","443  >  54993 [PSH, ACK] Seq=212745 Ack=3703 Win=8312 Len=1448 TSval=1115498628 TSecr=931464847 [TCP PDU reassembled in 239]"
"239","0.885630","23.13.164.38","100.86.243.187","TLSv1.2","1514","Application Data, Application Data"
"240","0.885630","23.13.164.38","100.86.243.187","TCP","1514","443  >  54993 [ACK] Seq=215641 Ack=3703 Win=8312 Len=1448 TSval=1115498629 TSecr=931464847 [TCP PDU reassembled in 252]"
"241","0.885631","23.13.164.38","100.86.243.187","TCP","1514","443  >  54993 [ACK] Seq=217089 Ack=3703 Win=8312 Len=1448 TSval=1115498629 TSecr=931464847 [TCP PDU reassembled in 252]"
"242","0.885632","23.13.164.38","100.86.243.187","TCP","1514","443  >  54993 [ACK] Seq=218537 Ack=3703 Win=8312 Len=1448 TSval=1115498629 TSecr=931464847 [TCP PDU reassembled in 252]"
"243","0.885632","23.13.164.38","100.86.243.187","TCP","1514","443  >  54993 [ACK] Seq=219985 Ack=3703 Win=8312 Len=1448 TSval=1115498629 TSecr=931464847 [TCP PDU reassembled in 252]"
"244","0.885633","23.13.164.38","100.86.243.187","TCP","1514","443  >  54993 [ACK] Seq=221433 Ack=3703 Win=8312 Len=1448 TSval=1115498629 TSecr=931464847 [TCP PDU reassembled in 252]"
"245","0.885633","23.13.164.38","100.86.243.187","TCP","1514","443  >  54993 [ACK] Seq=222881 Ack=3703 Win=8312 Len=1448 TSval=1115498629 TSecr=931464847 [TCP PDU reassembled in 252]"
"246","0.885634","23.13.164.38","100.86.243.187","TCP","1514","443  >  54993 [ACK] Seq=224329 Ack=3703 Win=8312 Len=1448 TSval=1115498629 TSecr=931464847 [TCP PDU reassembled in 252]"
"247","0.885635","23.13.164.38","100.86.243.187","TCP","1514","443  >  54993 [ACK] Seq=225777 Ack=3703 Win=8312 Len=1448 TSval=1115498629 TSecr=931464847 [TCP PDU reassembled in 252]"
"248","0.885636","23.13.164.38","100.86.243.187","TCP","1514","443  >  54993 [ACK] Seq=227225 Ack=3703 Win=8312 Len=1448 TSval=1115498629 TSecr=931464847 [TCP PDU reassembled in 252]"
"249","0.885713","100.86.243.187","23.13.164.38","TCP","66","54993  >  443 [ACK] Seq=3703 Ack=221433 Win=37207 Len=0 TSval=931464986 TSecr=1115498629"
"250","0.885737","100.86.243.187","23.13.164.38","TCP","66","54993  >  443 [ACK] Seq=3703 Ack=228673 Win=37094 Len=0 TSval=931464986 TSecr=1115498629"
"251","0.885863","23.13.164.38","100.86.243.187","TCP","1514","443  >  54993 [PSH, ACK] Seq=228673 Ack=3703 Win=8312 Len=1448 TSval=1115498629 TSecr=931464847 [TCP PDU reassembled in 252]"
"252","0.885864","23.13.164.38","100.86.243.187","TLSv1.2","1514","Application Data, Application Data"
"253","0.885865","23.13.164.38","100.86.243.187","TCP","1514","443  >  54993 [ACK] Seq=231569 Ack=3703 Win=8312 Len=1448 TSval=1115498630 TSecr=931464847 [TCP PDU reassembled in 268]"
"254","0.885866","23.13.164.38","100.86.243.187","TCP","1514","443  >  54993 [ACK] Seq=233017 Ack=3703 Win=8312 Len=1448 TSval=1115498630 TSecr=931464847 [TCP PDU reassembled in 268]"
"255","0.885913","100.86.243.187","23.13.164.38","TCP","66","[TCP Window Update] 54993  >  443 [ACK] Seq=3703 Ack=228673 Win=37456 Len=0 TSval=931464986 TSecr=1115498629"
"256","0.885934","100.86.243.187","23.13.164.38","TCP","66","54993  >  443 [ACK] Seq=3703 Ack=234465 Win=37365 Len=0 TSval=931464986 TSecr=1115498630"
"257","0.886014","23.13.164.38","100.86.243.187","TCP","1514","443  >  54993 [ACK] Seq=234465 Ack=3703 Win=8312 Len=1448 TSval=1115498630 TSecr=931464847 [TCP PDU reassembled in 268]"
"258","0.886016","23.13.164.38","100.86.243.187","TCP","1514","443  >  54993 [ACK] Seq=235913 Ack=3703 Win=8312 Len=1448 TSval=1115498630 TSecr=931464847 [TCP PDU reassembled in 268]"
"259","0.886061","100.86.243.187","23.13.164.38","TCP","66","54993  >  443 [ACK] Seq=3703 Ack=237361 Win=37359 Len=0 TSval=931464986 TSecr=1115498630"
"260","0.886085","100.86.243.187","23.13.164.38","TCP","66","[TCP Window Update] 54993  >  443 [ACK] Seq=3703 Ack=237361 Win=37456 Len=0 TSval=931464986 TSecr=1115498630"
"261","0.887549","23.13.164.38","100.86.243.187","TCP","1514","443  >  54993 [ACK] Seq=237361 Ack=3703 Win=8312 Len=1448 TSval=1115498630 TSecr=931464847 [TCP PDU reassembled in 268]"
"262","0.887550","23.13.164.38","100.86.243.187","TCP","1514","443  >  54993 [ACK] Seq=238809 Ack=3703 Win=8312 Len=1448 TSval=1115498630 TSecr=931464847 [TCP PDU reassembled in 268]"
"263","0.887551","23.13.164.38","100.86.243.187","TCP","1514","443  >  54993 [ACK] Seq=240257 Ack=3703 Win=8312 Len=1448 TSval=1115498630 TSecr=931464847 [TCP PDU reassembled in 268]"
"264","0.887552","23.13.164.38","100.86.243.187","TCP","1514","443  >  54993 [ACK] Seq=241705 Ack=3703 Win=8312 Len=1448 TSval=1115498630 TSecr=931464847 [TCP PDU reassembled in 268]"
"265","0.887553","23.13.164.38","100.86.243.187","TCP","1514","443  >  54993 [ACK] Seq=243153 Ack=3703 Win=8312 Len=1448 TSval=1115498630 TSecr=931464847 [TCP PDU reassembled in 268]"
"266","0.887553","23.13.164.38","100.86.243.187","TCP","1514","443  >  54993 [PSH, ACK] Seq=244601 Ack=3703 Win=8312 Len=1448 TSval=1115498630 TSecr=931464847 [TCP PDU reassembled in 268]"
"267","0.887554","23.13.164.38","100.86.243.187","TCP","1514","443  >  54993 [ACK] Seq=246049 Ack=3703 Win=8312 Len=1448 TSval=1115498631 TSecr=931464847 [TCP PDU reassembled in 268]"
"268","0.887555","23.13.164.38","100.86.243.187","TLSv1.2","1514","Application Data, Application Data"
"269","0.887555","23.13.164.38","100.86.243.187","TCP","1514","443  >  54993 [ACK] Seq=248945 Ack=3703 Win=8312 Len=1448 TSval=1115498631 TSecr=931464847 [TCP PDU reassembled in 285]"
"270","0.887556","23.13.164.38","100.86.243.187","TCP","1514","443  >  54993 [ACK] Seq=250393 Ack=3703 Win=8312 Len=1448 TSval=1115498631 TSecr=931464847 [TCP PDU reassembled in 285]"
"271","0.887595","23.13.164.38","100.86.243.187","TCP","1514","443  >  54993 [ACK] Seq=251841 Ack=3703 Win=8312 Len=1448 TSval=1115498631 TSecr=931464847 [TCP PDU reassembled in 285]"
"272","0.887596","23.13.164.38","100.86.243.187","TCP","1514","443  >  54993 [ACK] Seq=253289 Ack=3703 Win=8312 Len=1448 TSval=1115498631 TSecr=931464847 [TCP PDU reassembled in 285]"
"273","0.887678","100.86.243.187","23.13.164.38","TCP","66","54993  >  443 [ACK] Seq=3703 Ack=251841 Win=37229 Len=0 TSval=931464988 TSecr=1115498631"
"274","0.887802","100.86.243.187","23.13.164.38","TCP","66","54993  >  443 [ACK] Seq=3703 Ack=254737 Win=37184 Len=0 TSval=931464988 TSecr=1115498631"
"275","0.887849","23.13.164.38","100.86.243.187","TCP","1514","443  >  54993 [ACK] Seq=254737 Ack=3703 Win=8312 Len=1448 TSval=1115498631 TSecr=931464847 [TCP PDU reassembled in 285]"
"276","0.887853","23.13.164.38","100.86.243.187","TCP","1514","443  >  54993 [ACK] Seq=256185 Ack=3703 Win=8312 Len=1448 TSval=1115498631 TSecr=931464847 [TCP PDU reassembled in 285]"
"277","0.887897","23.13.164.38","100.86.243.187","TCP","1514","443  >  54993 [ACK] Seq=257633 Ack=3703 Win=8312 Len=1448 TSval=1115498631 TSecr=931464847 [TCP PDU reassembled in 285]"
"278","0.887898","23.13.164.38","100.86.243.187","TCP","1514","443  >  54993 [ACK] Seq=259081 Ack=3703 Win=8312 Len=1448 TSval=1115498631 TSecr=931464847 [TCP PDU reassembled in 285]"
