"No.","Time","Source","Destination","Protocol","Length","Info"
"82","2.354670","100.86.243.187","23.13.164.38","TLSv1.2","426","Application Data"
"83","2.354899","100.86.243.187","23.13.164.38","TLSv1.2","387","Application Data"
"84","2.364818","23.13.164.38","100.86.243.187","TCP","66","443  >  54993 [ACK] Seq=1 Ack=361 Win=5099 Len=0 TSval=1115397684 TSecr=931364033"
"85","2.365701","23.13.164.38","100.86.243.187","TCP","66","443  >  54993 [ACK] Seq=1 Ack=682 Win=5121 Len=0 TSval=1115397685 TSecr=931364033"
"86","2.429579","23.13.164.38","100.86.243.187","TLSv1.2","431","Application Data"
"87","2.429651","100.86.243.187","23.13.164.38","TCP","66","54993  >  443 [ACK] Seq=682 Ack=366 Win=37450 Len=0 TSval=931364108 TSecr=1115397749"
"88","2.430303","23.13.164.38","100.86.243.187","TLSv1.2","999","Application Data"
"89","2.430352","100.86.243.187","23.13.164.38","TCP","66","54993  >  443 [ACK] Seq=682 Ack=1299 Win=37441 Len=0 TSval=931364108 TSecr=1115397749"
"90","2.462137","23.13.164.38","100.86.243.187","TCP","1514","443  >  54993 [ACK] Seq=1299 Ack=682 Win=5121 Len=1448 TSval=1115397781 TSecr=931364108 [TCP PDU reassembled in 103]"
"91","2.462138","23.13.164.38","100.86.243.187","TCP","1514","443  >  54993 [ACK] Seq=2747 Ack=682 Win=5121 Len=1448 TSval=1115397781 TSecr=931364108 [TCP PDU reassembled in 103]"
"92","2.462139","23.13.164.38","100.86.243.187","TCP","1514","443  >  54993 [ACK] Seq=4195 Ack=682 Win=5121 Len=1448 TSval=1115397781 TSecr=931364108 [TCP PDU reassembled in 103]"
"93","2.462316","100.86.243.187","23.13.164.38","TCP","66","54993  >  443 [ACK] Seq=682 Ack=5643 Win=37388 Len=0 TSval=931364140 TSecr=1115397781"
"94","2.462411","100.86.243.187","23.13.164.38","TCP","66","[TCP Window Update] 54993  >  443 [ACK] Seq=682 Ack=5643 Win=37456 Len=0 TSval=931364140 TSecr=1115397781"
"95","2.464410","23.13.164.38","100.86.243.187","TCP","1514","443  >  54993 [ACK] Seq=5643 Ack=682 Win=5121 Len=1448 TSval=1115397781 TSecr=931364108 [TCP PDU reassembled in 103]"
"96","2.464410","23.13.164.38","100.86.243.187","TCP","1514","443  >  54993 [ACK] Seq=7091 Ack=682 Win=5121 Len=1448 TSval=1115397781 TSecr=931364108 [TCP PDU reassembled in 103]"
"97","2.464411","23.13.164.38","100.86.243.187","TCP","1514","443  >  54993 [ACK] Seq=8539 Ack=682 Win=5121 Len=1448 TSval=1115397781 TSecr=931364108 [TCP PDU reassembled in 103]"
"98","2.464412","23.13.164.38","100.86.243.187","TCP","1514","443  >  54993 [ACK] Seq=9987 Ack=682 Win=5121 Len=1448 TSval=1115397781 TSecr=931364108 [TCP PDU reassembled in 103]"
"99","2.464413","23.13.164.38","100.86.243.187","TCP","1514","443  >  54993 [ACK] Seq=11435 Ack=682 Win=5121 Len=1448 TSval=1115397781 TSecr=931364108 [TCP PDU reassembled in 103]"
"100","2.464413","23.13.164.38","100.86.243.187","TCP","1514","443  >  54993 [ACK] Seq=12883 Ack=682 Win=5121 Len=1448 TSval=1115397781 TSecr=931364108 [TCP PDU reassembled in 103]"
"101","2.464414","23.13.164.38","100.86.243.187","TCP","1514","443  >  54993 [PSH, ACK] Seq=14331 Ack=682 Win=5121 Len=1448 TSval=1115397781 TSecr=931364108 [TCP PDU reassembled in 103]"
"102","2.464414","23.13.164.38","100.86.243.187","TCP","1514","443  >  54993 [ACK] Seq=15779 Ack=682 Win=5121 Len=1448 TSval=1115397781 TSecr=931364108 [TCP PDU reassembled in 103]"
"103","2.464415","23.13.164.38","100.86.243.187","TLSv1.2","544","Application Data"
"104","2.464417","23.13.164.38","100.86.243.187","TLSv1.2","1514","Application Data"
"105","2.464418","23.13.164.38","100.86.243.187","TCP","1514","443  >  54993 [ACK] Seq=19153 Ack=682 Win=5121 Len=1448 TSval=1115397782 TSecr=931364108 [TCP PDU reassembled in 118]"
"106","2.464419","23.13.164.38","100.86.243.187","TCP","1514","443  >  54993 [ACK] Seq=20601 Ack=682 Win=5121 Len=1448 TSval=1115397782 TSecr=931364108 [TCP PDU reassembled in 118]"
"107","2.464419","23.13.164.38","100.86.243.187","TCP","1514","443  >  54993 [ACK] Seq=22049 Ack=682 Win=5121 Len=1448 TSval=1115397782 TSecr=931364108 [TCP PDU reassembled in 118]"
"108","2.464420","23.13.164.38","100.86.243.187","TCP","1514","443  >  54993 [ACK] Seq=23497 Ack=682 Win=5121 Len=1448 TSval=1115397782 TSecr=931364108 [TCP PDU reassembled in 118]"
"109","2.464420","23.13.164.38","100.86.243.187","TCP","1514","443  >  54993 [ACK] Seq=24945 Ack=682 Win=5121 Len=1448 TSval=1115397782 TSecr=931364108 [TCP PDU reassembled in 118]"
"110","2.464421","23.13.164.38","100.86.243.187","TCP","1514","443  >  54993 [ACK] Seq=26393 Ack=682 Win=5121 Len=1448 TSval=1115397782 TSecr=931364108 [TCP PDU reassembled in 118]"
"111","2.464421","23.13.164.38","100.86.243.187","TCP","1514","443  >  54993 [PSH, ACK] Seq=27841 Ack=682 Win=5121 Len=1448 TSval=1115397782 TSecr=931364108 [TCP PDU reassembled in 118]"
"112","2.464422","23.13.164.38","100.86.243.187","TCP","1514","443  >  54993 [ACK] Seq=29289 Ack=682 Win=5121 Len=1448 TSval=1115397782 TSecr=931364108 [TCP PDU reassembled in 118]"
"113","2.464422","23.13.164.38","100.86.243.187","TCP","1514","443  >  54993 [ACK] Seq=30737 Ack=682 Win=5121 Len=1448 TSval=1115397782 TSecr=931364108 [TCP PDU reassembled in 118]"
"114","2.464423","23.13.164.38","100.86.243.187","TCP","1514","443  >  54993 [ACK] Seq=32185 Ack=682 Win=5121 Len=1448 TSval=1115397782 TSecr=931364108 [TCP PDU reassembled in 118]"
"115","2.464491","100.86.243.187","23.13.164.38","TCP","66","54993  >  443 [ACK] Seq=682 Ack=20601 Win=37222 Len=0 TSval=931364142 TSecr=1115397782"
"116","2.464521","100.86.243.187","23.13.164.38","TCP","66","54993  >  443 [ACK] Seq=682 Ack=33633 Win=37018 Len=0 TSval=931364142 TSecr=1115397782"
"117","2.464700","100.86.243.187","23.13.164.38","TCP","66","[TCP Window Update] 54993  >  443 [ACK] Seq=682 Ack=33633 Win=37456 Len=0 TSval=931364142 TSecr=1115397782"
"118","2.465468","23.13.164.38","100.86.243.187","TLSv1.2","1514","Application Data, Application Data"
"119","2.465468","23.13.164.38","100.86.243.187","TCP","1514","443  >  54993 [ACK] Seq=35081 Ack=682 Win=5121 Len=1448 TSval=1115397782 TSecr=931364108 [TCP PDU reassembled in 133]"
"120","2.465469","23.13.164.38","100.86.243.187","TCP","1514","443  >  54993 [ACK] Seq=36529 Ack=682 Win=5121 Len=1448 TSval=1115397782 TSecr=931364108 [TCP PDU reassembled in 133]"
"121","2.465470","23.13.164.38","100.86.243.187","TCP","1514","443  >  54993 [ACK] Seq=37977 Ack=682 Win=5121 Len=1448 TSval=1115397782 TSecr=931364108 [TCP PDU reassembled in 133]"
"122","2.465470","23.13.164.38","100.86.243.187","TCP","1514","443  >  54993 [PSH, ACK] Seq=39425 Ack=682 Win=5121 Len=1448 TSval=1115397782 TSecr=931364108 [TCP PDU reassembled in 133]"
"123","2.465528","100.86.243.187","23.13.164.38","TCP","66","54993  >  443 [ACK] Seq=682 Ack=40873 Win=37343 Len=0 TSval=931364143 TSecr=1115397782"
"124","2.465658","100.86.243.187","23.13.164.38","TCP","66","[TCP Window Update] 54993  >  443 [ACK] Seq=682 Ack=40873 Win=37456 Len=0 TSval=931364143 TSecr=1115397782"
"125","2.466009","23.13.164.38","100.86.243.187","TCP","1514","443  >  54993 [ACK] Seq=40873 Ack=682 Win=5121 Len=1448 TSval=1115397783 TSecr=931364108 [TCP PDU reassembled in 133]"
"126","2.466010","23.13.164.38","100.86.243.187","TCP","1514","443  >  54993 [ACK] Seq=42321 Ack=682 Win=5121 Len=1448 TSval=1115397783 TSecr=931364108 [TCP PDU reassembled in 133]"
"127","2.466010","23.13.164.38","100.86.243.187","TCP","1514","443  >  54993 [ACK] Seq=43769 Ack=682 Win=5121 Len=1448 TSval=1115397783 TSecr=931364108 [TCP PDU reassembled in 133]"
"128","2.466049","100.86.243.187","23.13.164.38","TCP","66","54993  >  443 [ACK] Seq=682 Ack=45217 Win=37388 Len=0 TSval=931364143 TSecr=1115397783"
"129","2.466087","100.86.243.187","23.13.164.38","TCP","66","[TCP Window Update] 54993  >  443 [ACK] Seq=682 Ack=45217 Win=37456 Len=0 TSval=931364143 TSecr=1115397783"
"130","2.466678","23.13.164.38","100.86.243.187","TCP","1514","443  >  54993 [ACK] Seq=45217 Ack=682 Win=5121 Len=1448 TSval=1115397783 TSecr=931364108 [TCP PDU reassembled in 133]"
"131","2.466678","23.13.164.38","100.86.243.187","TCP","1514","443  >  54993 [ACK] Seq=46665 Ack=682 Win=5121 Len=1448 TSval=1115397783 TSecr=931364108 [TCP PDU reassembled in 133]"
"132","2.466679","23.13.164.38","100.86.243.187","TCP","1514","443  >  54993 [ACK] Seq=48113 Ack=682 Win=5121 Len=1448 TSval=1115397783 TSecr=931364108 [TCP PDU reassembled in 133]"
"133","2.466680","23.13.164.38","100.86.243.187","TLSv1.2","1514","Application Data, Application Data"
"134","2.466718","100.86.243.187","23.13.164.38","TCP","66","54993  >  443 [ACK] Seq=682 Ack=51009 Win=37365 Len=0 TSval=931364145 TSecr=1115397783"
"135","2.466830","23.13.164.38","100.86.243.187","TCP","1514","443  >  54993 [PSH, ACK] Seq=51009 Ack=682 Win=5121 Len=1448 TSval=1115397783 TSecr=931364108 [TCP PDU reassembled in 155]"
"136","2.466831","23.13.164.38","100.86.243.187","TCP","1514","443  >  54993 [ACK] Seq=52457 Ack=682 Win=5121 Len=1448 TSval=1115397784 TSecr=931364108 [TCP PDU reassembled in 155]"
"137","2.466853","100.86.243.187","23.13.164.38","TCP","66","[TCP Window Update] 54993  >  443 [ACK] Seq=682 Ack=51009 Win=37456 Len=0 TSval=931364145 TSecr=1115397783"
"138","2.466874","100.86.243.187","23.13.164.38","TCP","66","54993  >  443 [ACK] Seq=682 Ack=53905 Win=37410 Len=0 TSval=931364145 TSecr=1115397784"
"139","2.466898","100.86.243.187","23.13.164.38","TCP","66","[TCP Window Update] 54993  >  443 [ACK] Seq=682 Ack=53905 Win=37456 Len=0 TSval=931364145 TSecr=1115397784"
"140","2.466934","23.13.164.38","100.86.243.187","TCP","1514","443  >  54993 [ACK] Seq=53905 Ack=682 Win=5121 Len=1448 TSval=1115397784 TSecr=931364108 [TCP PDU reassembled in 155]"
"141","2.466935","23.13.164.38","100.86.243.187","TCP","1514","443  >  54993 [ACK] Seq=55353 Ack=682 Win=5121 Len=1448 TSval=1115397784 TSecr=931364108 [TCP PDU reassembled in 155]"
"142","2.466964","100.86.243.187","23.13.164.38","TCP","66","54993  >  443 [ACK] Seq=682 Ack=56801 Win=37410 Len=0 TSval=931364145 TSecr=1115397784"
"143","2.467011","100.86.243.187","23.13.164.38","TCP","66","[TCP Window Update] 54993  >  443 [ACK] Seq=682 Ack=56801 Win=37456 Len=0 TSval=931364145 TSecr=1115397784"
"144","2.467173","23.13.164.38","100.86.243.187","TCP","1514","443  >  54993 [ACK] Seq=56801 Ack=682 Win=5121 Len=1448 TSval=1115397784 TSecr=931364108 [TCP PDU reassembled in 155]"
"145","2.467174","23.13.164.38","100.86.243.187","TCP","1514","443  >  54993 [ACK] Seq=58249 Ack=682 Win=5121 Len=1448 TSval=1115397784 TSecr=931364108 [TCP PDU reassembled in 155]"
"146","2.467175","23.13.164.38","100.86.243.187","TCP","1514","443  >  54993 [ACK] Seq=59697 Ack=682 Win=5121 Len=1448 TSval=1115397784 TSecr=931364108 [TCP PDU reassembled in 155]"
"147","2.467175","23.13.164.38","100.86.243.187","TCP","1514","443  >  54993 [ACK] Seq=61145 Ack=682 Win=5121 Len=1448 TSval=1115397784 TSecr=931364108 [TCP PDU reassembled in 155]"
"148","2.467218","100.86.243.187","23.13.164.38","TCP","66","54993  >  443 [ACK] Seq=682 Ack=62593 Win=37365 Len=0 TSval=931364145 TSecr=1115397784"
"149","2.467258","100.86.243.187","23.13.164.38","TCP","66","[TCP Window Update] 54993  >  443 [ACK] Seq=682 Ack=62593 Win=37456 Len=0 TSval=931364145 TSecr=1115397784"
"150","2.467449","23.13.164.38","100.86.243.187","TCP","1514","443  >  54993 [PSH, ACK] Seq=62593 Ack=682 Win=5121 Len=1448 TSval=1115397784 TSecr=931364108 [TCP PDU reassembled in 155]"
"151","2.467457","23.13.164.38","100.86.243.187","TCP","1514","443  >  54993 [ACK] Seq=64041 Ack=682 Win=5121 Len=1448 TSval=1115397785 TSecr=931364108 [TCP PDU reassembled in 155]"
"152","2.467489","100.86.243.187","23.13.164.38","TCP","66","54993  >  443 [ACK] Seq=682 Ack=65489 Win=37410 Len=0 TSval=931364145 TSecr=1115397785"
"153","2.467531","100.86.243.187","23.13.164.38","TCP","66","[TCP Window Update] 54993  >  443 [ACK] Seq=682 Ack=65489 Win=37456 Len=0 TSval=931364145 TSecr=1115397785"
"154","2.467765","23.13.164.38","100.86.243.187","TCP","1514","443  >  54993 [ACK] Seq=65489 Ack=682 Win=5121 Len=1448 TSval=1115397785 TSecr=931364108 [TCP PDU reassembled in 155]"
"155","2.467766","23.13.164.38","100.86.243.187","TLSv1.2","1514","Application Data, Application Data"
"156","2.467807","100.86.243.187","23.13.164.38","TCP","66","54993  >  443 [ACK] Seq=682 Ack=68385 Win=37410 Len=0 TSval=931364146 TSecr=1115397785"
"157","2.467925","100.86.243.187","23.13.164.38","TCP","66","[TCP Window Update] 54993  >  443 [ACK] Seq=682 Ack=68385 Win=37456 Len=0 TSval=931364146 TSecr=1115397785"
"158","2.469258","23.13.164.38","100.86.243.187","TCP","1514","443  >  54993 [ACK] Seq=68385 Ack=682 Win=5121 Len=1448 TSval=1115397785 TSecr=931364108 [TCP PDU reassembled in 168]"
"159","2.469259","23.13.164.38","100.86.243.187","TCP","1514","443  >  54993 [ACK] Seq=69833 Ack=682 Win=5121 Len=1448 TSval=1115397785 TSecr=931364108 [TCP PDU reassembled in 168]"
"160","2.469260","23.13.164.38","100.86.243.187","TCP","1514","443  >  54993 [ACK] Seq=71281 Ack=682 Win=5121 Len=1448 TSval=1115397785 TSecr=931364108 [TCP PDU reassembled in 168]"
"161","2.469260","23.13.164.38","100.86.243.187","TCP","1514","443  >  54993 [ACK] Seq=72729 Ack=682 Win=5121 Len=1448 TSval=1115397785 TSecr=931364108 [TCP PDU reassembled in 168]"
"162","2.469261","23.13.164.38","100.86.243.187","TCP","1514","443  >  54993 [PSH, ACK] Seq=74177 Ack=682 Win=5121 Len=1448 TSval=1115397785 TSecr=931364108 [TCP PDU reassembled in 168]"
"163","2.469261","23.13.164.38","100.86.243.187","TCP","1514","443  >  54993 [ACK] Seq=75625 Ack=682 Win=5121 Len=1448 TSval=1115397786 TSecr=931364108 [TCP PDU reassembled in 168]"
"164","2.469264","23.13.164.38","100.86.243.187","TCP","1514","443  >  54993 [ACK] Seq=77073 Ack=682 Win=5121 Len=1448 TSval=1115397786 TSecr=931364108 [TCP PDU reassembled in 168]"
"165","2.469265","23.13.164.38","100.86.243.187","TCP","1514","443  >  54993 [ACK] Seq=78521 Ack=682 Win=5121 Len=1448 TSval=1115397786 TSecr=931364108 [TCP PDU reassembled in 168]"
"166","2.469266","23.13.164.38","100.86.243.187","TCP","1514","443  >  54993 [ACK] Seq=79969 Ack=682 Win=5121 Len=1448 TSval=1115397786 TSecr=931364108 [TCP PDU reassembled in 168]"
"167","2.469266","23.13.164.38","100.86.243.187","TCP","1514","443  >  54993 [ACK] Seq=81417 Ack=682 Win=5121 Len=1448 TSval=1115397786 TSecr=931364108 [TCP PDU reassembled in 168]"
"168","2.469267","23.13.164.38","100.86.243.187","TLSv1.2","1514","Application Data, Application Data"
"169","2.469267","23.13.164.38","100.86.243.187","TCP","1514","443  >  54993 [ACK] Seq=84313 Ack=682 Win=5121 Len=1448 TSval=1115397786 TSecr=931364108 [TCP PDU reassembled in 182]"
"170","2.469268","23.13.164.38","100.86.243.187","TCP","1514","443  >  54993 [PSH, ACK] Seq=85761 Ack=682 Win=5121 Len=1448 TSval=1115397786 TSecr=931364108 [TCP PDU reassembled in 182]"
"171","2.469269","23.13.164.38","100.86.243.187","TCP","1514","443  >  54993 [ACK] Seq=87209 Ack=682 Win=5121 Len=1448 TSval=1115397787 TSecr=931364108 [TCP PDU reassembled in 182]"
"172","2.469269","23.13.164.38","100.86.243.187","TCP","1514","443  >  54993 [ACK] Seq=88657 Ack=682 Win=5121 Len=1448 TSval=1115397787 TSecr=931364108 [TCP PDU reassembled in 182]"
"173","2.469270","23.13.164.38","100.86.243.187","TCP","1514","443  >  54993 [ACK] Seq=90105 Ack=682 Win=5121 Len=1448 TSval=1115397787 TSecr=931364108 [TCP PDU reassembled in 182]"
"174","2.469335","100.86.243.187","23.13.164.38","TCP","66","54993  >  443 [ACK] Seq=682 Ack=84313 Win=37207 Len=0 TSval=931364147 TSecr=1115397786"
"175","2.469363","100.86.243.187","23.13.164.38","TCP","66","54993  >  443 [ACK] Seq=682 Ack=91553 Win=37094 Len=0 TSval=931364147 TSecr=1115397787"
"176","2.469471","100.86.243.187","23.13.164.38","TCP","66","[TCP Window Update] 54993  >  443 [ACK] Seq=682 Ack=91553 Win=37456 Len=0 TSval=931364147 TSecr=1115397787"
"177","2.470405","23.13.164.38","100.86.243.187","TCP","1514","443  >  54993 [ACK] Seq=91553 Ack=682 Win=5121 Len=1448 TSval=1115397787 TSecr=931364108 [TCP PDU reassembled in 182]"
"178","2.470406","23.13.164.38","100.86.243.187","TCP","1514","443  >  54993 [ACK] Seq=93001 Ack=682 Win=5121 Len=1448 TSval=1115397787 TSecr=931364108 [TCP PDU reassembled in 182]"
"179","2.470406","23.13.164.38","100.86.243.187","TCP","1514","443  >  54993 [ACK] Seq=94449 Ack=682 Win=5121 Len=1448 TSval=1115397787 TSecr=931364108 [TCP PDU reassembled in 182]"
"180","2.470407","23.13.164.38","100.86.243.187","TCP","1514","443  >  54993 [ACK] Seq=95897 Ack=682 Win=5121 Len=1448 TSval=1115397787 TSecr=931364108 [TCP PDU reassembled in 182]"
"181","2.470408","23.13.164.38","100.86.243.187","TCP","1514","443  >  54993 [PSH, ACK] Seq=97345 Ack=682 Win=5121 Len=1448 TSval=1115397787 TSecr=931364108 [TCP PDU reassembled in 182]"
"182","2.470408","23.13.164.38","100.86.243.187","TLSv1.2","1514","Application Data, Application Data"
"183","2.470409","23.13.164.38","100.86.243.187","TCP","1514","443  >  54993 [ACK] Seq=100241 Ack=682 Win=5121 Len=1448 TSval=1115397788 TSecr=931364108 [TCP PDU reassembled in 196]"
"184","2.470409","23.13.164.38","100.86.243.187","TCP","1514","443  >  54993 [ACK] Seq=101689 Ack=682 Win=5121 Len=1448 TSval=1115397788 TSecr=931364108 [TCP PDU reassembled in 196]"
"185","2.470410","23.13.164.38","100.86.243.187","TCP","1514","443  >  54993 [ACK] Seq=103137 Ack=682 Win=5121 Len=1448 TSval=1115397788 TSecr=931364108 [TCP PDU reassembled in 196]"
"186","2.470412","23.13.164.38","100.86.243.187","TCP","1514","443  >  54993 [ACK] Seq=104585 Ack=682 Win=5121 Len=1448 TSval=1115397788 TSecr=931364108 [TCP PDU reassembled in 196]"
"187","2.470413","23.13.164.38","100.86.243.187","TCP","1514","443  >  54993 [ACK] Seq=106033 Ack=682 Win=5121 Len=1448 TSval=1115397788 TSecr=931364108 [TCP PDU reassembled in 196]"
"188","2.470413","23.13.164.38","100.86.243.187","TCP","1514","443  >  54993 [ACK] Seq=107481 Ack=682 Win=5121 Len=1448 TSval=1115397788 TSecr=931364108 [TCP PDU reassembled in 196]"
"189","2.470414","23.13.164.38","100.86.243.187","TCP","1514","443  >  54993 [PSH, ACK] Seq=108929 Ack=682 Win=5121 Len=1448 TSval=1115397788 TSecr=931364108 [TCP PDU reassembled in 196]"
"190","2.470414","23.13.164.38","100.86.243.187","TCP","1514","443  >  54993 [ACK] Seq=110377 Ack=682 Win=5121 Len=1448 TSval=1115397789 TSecr=931364108 [TCP PDU reassembled in 196]"
"191","2.470478","100.86.243.187","23.13.164.38","TCP","66","54993  >  443 [ACK] Seq=682 Ack=107481 Win=37207 Len=0 TSval=931364148 TSecr=1115397788"
"192","2.470609","100.86.243.187","23.13.164.38","TCP","66","54993  >  443 [ACK] Seq=682 Ack=111825 Win=37456 Len=0 TSval=931364148 TSecr=1115397789"
"193","2.471834","23.13.164.38","100.86.243.187","TCP","1514","443  >  54993 [ACK] Seq=111825 Ack=682 Win=5121 Len=1448 TSval=1115397789 TSecr=931364108 [TCP PDU reassembled in 196]"
"194","2.471835","23.13.164.38","100.86.243.187","TCP","1514","443  >  54993 [ACK] Seq=113273 Ack=682 Win=5121 Len=1448 TSval=1115397789 TSecr=931364108 [TCP PDU reassembled in 196]"
"195","2.471835","23.13.164.38","100.86.243.187","TCP","1514","443  >  54993 [ACK] Seq=114721 Ack=682 Win=5121 Len=1448 TSval=1115397789 TSecr=931364108 [TCP PDU reassembled in 196]"
"196","2.471836","23.13.164.38","100.86.243.187","TLSv1.2","1514","Application Data, Application Data, Application Data, Application Data"
"197","2.471836","23.13.164.38","100.86.243.187","TLSv1.2","175","Application Data"
"198","2.472151","100.86.243.187","23.13.164.38","TCP","66","54993  >  443 [ACK] Seq=682 Ack=117726 Win=37456 Len=0 TSval=931364150 TSecr=1115397789"
"199","2.477269","23.13.164.38","100.86.243.187","TCP","1514","443  >  54993 [ACK] Seq=117726 Ack=682 Win=5121 Len=1448 TSval=1115397797 TSecr=931364140 [TCP PDU reassembled in 211]"
"200","2.477270","23.13.164.38","100.86.243.187","TCP","1514","443  >  54993 [ACK] Seq=119174 Ack=682 Win=5121 Len=1448 TSval=1115397797 TSecr=931364140 [TCP PDU reassembled in 211]"
"201","2.477273","23.13.164.38","100.86.243.187","TCP","1514","443  >  54993 [ACK] Seq=120622 Ack=682 Win=5121 Len=1448 TSval=1115397797 TSecr=931364140 [TCP PDU reassembled in 211]"
"202","2.477371","100.86.243.187","23.13.164.38","TCP","66","54993  >  443 [ACK] Seq=682 Ack=122070 Win=37456 Len=0 TSval=931364155 TSecr=1115397797"
"203","2.479208","23.13.164.38","100.86.243.187","TCP","1514","443  >  54993 [ACK] Seq=122070 Ack=682 Win=5121 Len=1448 TSval=1115397797 TSecr=931364140 [TCP PDU reassembled in 211]"
"204","2.479211","23.13.164.38","100.86.243.187","TCP","1514","443  >  54993 [ACK] Seq=123518 Ack=682 Win=5121 Len=1448 TSval=1115397797 TSecr=931364140 [TCP PDU reassembled in 211]"
"205","2.479211","23.13.164.38","100.86.243.187","TCP","1514","443  >  54993 [ACK] Seq=124966 Ack=682 Win=5121 Len=1448 TSval=1115397797 TSecr=931364140 [TCP PDU reassembled in 211]"
"206","2.479212","23.13.164.38","100.86.243.187","TCP","1514","443  >  54993 [ACK] Seq=126414 Ack=682 Win=5121 Len=1448 TSval=1115397797 TSecr=931364140 [TCP PDU reassembled in 211]"
"207","2.479213","23.13.164.38","100.86.243.187","TCP","1514","443  >  54993 [ACK] Seq=127862 Ack=682 Win=5121 Len=1448 TSval=1115397797 TSecr=931364140 [TCP PDU reassembled in 211]"
"208","2.479213","23.13.164.38","100.86.243.187","TCP","1514","443  >  54993 [ACK] Seq=129310 Ack=682 Win=5121 Len=1448 TSval=1115397797 TSecr=931364140 [TCP PDU reassembled in 211]"
"209","2.479214","23.13.164.38","100.86.243.187","TCP","1514","443  >  54993 [PSH, ACK] Seq=130758 Ack=682 Win=5121 Len=1448 TSval=1115397797 TSecr=931364140 [TCP PDU reassembled in 211]"
"210","2.479215","23.13.164.38","100.86.243.187","TCP","1514","443  >  54993 [ACK] Seq=132206 Ack=682 Win=5121 Len=1448 TSval=1115397798 TSecr=931364140 [TCP PDU reassembled in 211]"
"211","2.479218","23.13.164.38","100.86.243.187","TLSv1.2","544","Application Data"
"212","2.479218","23.13.164.38","100.86.243.187","TLSv1.2","1514","Application Data"
"213","2.479398","100.86.243.187","23.13.164.38","TCP","66","54993  >  443 [ACK] Seq=682 Ack=135580 Win=37456 Len=0 TSval=931364157 TSecr=1115397798"
"214","2.479671","23.13.164.38","100.86.243.187","TCP","1514","443  >  54993 [ACK] Seq=135580 Ack=682 Win=5121 Len=1448 TSval=1115397798 TSecr=931364140 [TCP PDU reassembled in 215]"
"215","2.479672","23.13.164.38","100.86.243.187","TLSv1.2","683","Application Data"
"216","2.479745","100.86.243.187","23.13.164.38","TCP","66","54993  >  443 [ACK] Seq=682 Ack=137645 Win=37456 Len=0 TSval=931364157 TSecr=1115397798"
"278","7.871221","100.86.243.187","23.13.164.38","TLSv1.2","762","Application Data"
"279","7.881240","23.13.164.38","100.86.243.187","TCP","66","443  >  54993 [ACK] Seq=137645 Ack=1378 Win=5144 Len=0 TSval=1115403201 TSecr=931369549"
"280","8.027123","23.13.164.38","100.86.243.187","TLSv1.2","1036","Application Data"
"281","8.027206","100.86.243.187","23.13.164.38","TCP","66","54993  >  443 [ACK] Seq=1378 Ack=138615 Win=37440 Len=0 TSval=931369705 TSecr=1115403347"
"282","8.027654","23.13.164.38","100.86.243.187","TLSv1.2","1043","Application Data"
"283","8.027655","23.13.164.38","100.86.243.187","TCP","1514","443  >  54993 [ACK] Seq=139592 Ack=1378 Win=5144 Len=1448 TSval=1115403347 TSecr=931369549 [TCP PDU reassembled in 292]"
"284","8.027656","23.13.164.38","100.86.243.187","TCP","1514","443  >  54993 [ACK] Seq=141040 Ack=1378 Win=5144 Len=1448 TSval=1115403347 TSecr=931369549 [TCP PDU reassembled in 292]"
"285","8.027717","100.86.243.187","23.13.164.38","TCP","66","54993  >  443 [ACK] Seq=1378 Ack=142488 Win=37395 Len=0 TSval=931369705 TSecr=1115403347"
"286","8.027819","100.86.243.187","23.13.164.38","TCP","66","[TCP Window Update] 54993  >  443 [ACK] Seq=1378 Ack=142488 Win=37456 Len=0 TSval=931369705 TSecr=1115403347"
"287","8.029601","23.13.164.38","100.86.243.187","TCP","1514","443  >  54993 [ACK] Seq=142488 Ack=1378 Win=5144 Len=1448 TSval=1115403347 TSecr=931369549 [TCP PDU reassembled in 292]"
"288","8.029603","23.13.164.38","100.86.243.187","TCP","1514","443  >  54993 [ACK] Seq=143936 Ack=1378 Win=5144 Len=1448 TSval=1115403347 TSecr=931369549 [TCP PDU reassembled in 292]"
"289","8.029604","23.13.164.38","100.86.243.187","TCP","1514","443  >  54993 [ACK] Seq=145384 Ack=1378 Win=5144 Len=1448 TSval=1115403347 TSecr=931369549 [TCP PDU reassembled in 292]"
"290","8.029605","23.13.164.38","100.86.243.187","TCP","1514","443  >  54993 [ACK] Seq=146832 Ack=1378 Win=5144 Len=1448 TSval=1115403347 TSecr=931369549 [TCP PDU reassembled in 292]"
"291","8.029607","23.13.164.38","100.86.243.187","TCP","1514","443  >  54993 [ACK] Seq=148280 Ack=1378 Win=5144 Len=1448 TSval=1115403347 TSecr=931369549 [TCP PDU reassembled in 292]"
"292","8.029608","23.13.164.38","100.86.243.187","TLSv1.2","873","Application Data"
"293","8.029754","100.86.243.187","23.13.164.38","TCP","66","54993  >  443 [ACK] Seq=1378 Ack=150535 Win=37330 Len=0 TSval=931369708 TSecr=1115403347"
"294","8.029867","100.86.243.187","23.13.164.38","TCP","66","[TCP Window Update] 54993  >  443 [ACK] Seq=1378 Ack=150535 Win=37456 Len=0 TSval=931369708 TSecr=1115403347"
"295","8.055940","100.86.243.187","23.13.164.38","TLSv1.2","848","Application Data"
"296","8.066692","23.13.164.38","100.86.243.187","TCP","66","443  >  54993 [ACK] Seq=150535 Ack=2160 Win=5167 Len=0 TSval=1115403386 TSecr=931369734"
"299","8.173140","23.13.164.38","100.86.243.187","TLSv1.2","1035","Application Data"
"300","8.173140","23.13.164.38","100.86.243.187","TLSv1.2","1042","Application Data"
"301","8.173141","23.13.164.38","100.86.243.187","TCP","1514","443  >  54993 [ACK] Seq=152480 Ack=2160 Win=5167 Len=1448 TSval=1115403493 TSecr=931369734 [TCP PDU reassembled in 314]"
"302","8.173210","100.86.243.187","23.13.164.38","TCP","66","54993  >  443 [ACK] Seq=2160 Ack=153928 Win=37403 Len=0 TSval=931369851 TSecr=1115403493"
"303","8.173504","100.86.243.187","23.13.164.38","TCP","66","[TCP Window Update] 54993  >  443 [ACK] Seq=2160 Ack=153928 Win=37456 Len=0 TSval=931369851 TSecr=1115403493"
"304","8.175061","23.13.164.38","100.86.243.187","TCP","1514","443  >  54993 [ACK] Seq=153928 Ack=2160 Win=5167 Len=1448 TSval=1115403493 TSecr=931369734 [TCP PDU reassembled in 314]"
"305","8.175062","23.13.164.38","100.86.243.187","TCP","1514","443  >  54993 [ACK] Seq=155376 Ack=2160 Win=5167 Len=1448 TSval=1115403493 TSecr=931369734 [TCP PDU reassembled in 314]"
"306","8.175063","23.13.164.38","100.86.243.187","TCP","1514","443  >  54993 [ACK] Seq=156824 Ack=2160 Win=5167 Len=1448 TSval=1115403493 TSecr=931369734 [TCP PDU reassembled in 314]"
"307","8.175063","23.13.164.38","100.86.243.187","TCP","1514","443  >  54993 [ACK] Seq=158272 Ack=2160 Win=5167 Len=1448 TSval=1115403493 TSecr=931369734 [TCP PDU reassembled in 314]"
"308","8.175064","23.13.164.38","100.86.243.187","TCP","1514","443  >  54993 [ACK] Seq=159720 Ack=2160 Win=5167 Len=1448 TSval=1115403493 TSecr=931369734 [TCP PDU reassembled in 314]"
"309","8.175065","23.13.164.38","100.86.243.187","TCP","1514","443  >  54993 [ACK] Seq=161168 Ack=2160 Win=5167 Len=1448 TSval=1115403493 TSecr=931369734 [TCP PDU reassembled in 314]"
"310","8.175065","23.13.164.38","100.86.243.187","TCP","1514","443  >  54993 [PSH, ACK] Seq=162616 Ack=2160 Win=5167 Len=1448 TSval=1115403493 TSecr=931369734 [TCP PDU reassembled in 314]"
"311","8.175066","23.13.164.38","100.86.243.187","TCP","1514","443  >  54993 [ACK] Seq=164064 Ack=2160 Win=5167 Len=1448 TSval=1115403494 TSecr=931369734 [TCP PDU reassembled in 314]"
"312","8.175067","23.13.164.38","100.86.243.187","TCP","1514","443  >  54993 [ACK] Seq=165512 Ack=2160 Win=5167 Len=1448 TSval=1115403494 TSecr=931369734 [TCP PDU reassembled in 314]"
"313","8.175067","23.13.164.38","100.86.243.187","TCP","1514","443  >  54993 [ACK] Seq=166960 Ack=2160 Win=5167 Len=1448 TSval=1115403494 TSecr=931369734 [TCP PDU reassembled in 314]"
"314","8.175068","23.13.164.38","100.86.243.187","TLSv1.2","544","Application Data"
"315","8.175068","23.13.164.38","100.86.243.187","TLSv1.2","1514","Application Data"
"316","8.175069","23.13.164.38","100.86.243.187","TCP","1514","443  >  54993 [ACK] Seq=170334 Ack=2160 Win=5167 Len=1448 TSval=1115403494 TSecr=931369734 [TCP PDU reassembled in 329]"
"317","8.175069","23.13.164.38","100.86.243.187","TCP","1514","443  >  54993 [ACK] Seq=171782 Ack=2160 Win=5167 Len=1448 TSval=1115403494 TSecr=931369734 [TCP PDU reassembled in 329]"
"318","8.175170","100.86.243.187","23.13.164.38","TCP","66","54993  >  443 [ACK] Seq=2160 Ack=168886 Win=37222 Len=0 TSval=931369853 TSecr=1115403494"
"319","8.175233","100.86.243.187","23.13.164.38","TCP","66","54993  >  443 [ACK] Seq=2160 Ack=173230 Win=37154 Len=0 TSval=931369853 TSecr=1115403494"
"320","8.175388","100.86.243.187","23.13.164.38","TCP","66","[TCP Window Update] 54993  >  443 [ACK] Seq=2160 Ack=173230 Win=37456 Len=0 TSval=931369853 TSecr=1115403494"
"321","8.176171","23.13.164.38","100.86.243.187","TCP","1514","443  >  54993 [ACK] Seq=173230 Ack=2160 Win=5167 Len=1448 TSval=1115403494 TSecr=931369734 [TCP PDU reassembled in 329]"
"322","8.176172","23.13.164.38","100.86.243.187","TCP","1514","443  >  54993 [ACK] Seq=174678 Ack=2160 Win=5167 Len=1448 TSval=1115403494 TSecr=931369734 [TCP PDU reassembled in 329]"
"323","8.176173","23.13.164.38","100.86.243.187","TCP","1514","443  >  54993 [ACK] Seq=176126 Ack=2160 Win=5167 Len=1448 TSval=1115403494 TSecr=931369734 [TCP PDU reassembled in 329]"
"324","8.176174","23.13.164.38","100.86.243.187","TCP","1514","443  >  54993 [ACK] Seq=177574 Ack=2160 Win=5167 Len=1448 TSval=1115403494 TSecr=931369734 [TCP PDU reassembled in 329]"
"325","8.176174","23.13.164.38","100.86.243.187","TCP","1514","443  >  54993 [PSH, ACK] Seq=179022 Ack=2160 Win=5167 Len=1448 TSval=1115403494 TSecr=931369734 [TCP PDU reassembled in 329]"
"326","8.176175","23.13.164.38","100.86.243.187","TCP","1514","443  >  54993 [ACK] Seq=180470 Ack=2160 Win=5167 Len=1448 TSval=1115403495 TSecr=931369734 [TCP PDU reassembled in 329]"
"327","8.176175","23.13.164.38","100.86.243.187","TCP","1514","443  >  54993 [ACK] Seq=181918 Ack=2160 Win=5167 Len=1448 TSval=1115403495 TSecr=931369734 [TCP PDU reassembled in 329]"
"328","8.176176","23.13.164.38","100.86.243.187","TCP","1514","443  >  54993 [ACK] Seq=183366 Ack=2160 Win=5167 Len=1448 TSval=1115403495 TSecr=931369734 [TCP PDU reassembled in 329]"
"329","8.176177","23.13.164.38","100.86.243.187","TLSv1.2","1514","Application Data, Application Data"
"330","8.176177","23.13.164.38","100.86.243.187","TCP","1514","443  >  54993 [ACK] Seq=186262 Ack=2160 Win=5167 Len=1448 TSval=1115403495 TSecr=931369734 [TCP PDU reassembled in 345]"
"331","8.176178","23.13.164.38","100.86.243.187","TCP","1514","443  >  54993 [ACK] Seq=187710 Ack=2160 Win=5167 Len=1448 TSval=1115403495 TSecr=931369734 [TCP PDU reassembled in 345]"
"332","8.176178","23.13.164.38","100.86.243.187","TCP","1514","443  >  54993 [ACK] Seq=189158 Ack=2160 Win=5167 Len=1448 TSval=1115403495 TSecr=931369734 [TCP PDU reassembled in 345]"
"333","8.176255","100.86.243.187","23.13.164.38","TCP","66","54993  >  443 [ACK] Seq=2160 Ack=189158 Win=37207 Len=0 TSval=931369854 TSecr=1115403495"
"334","8.176281","100.86.243.187","23.13.164.38","TCP","66","54993  >  443 [ACK] Seq=2160 Ack=190606 Win=37184 Len=0 TSval=931369854 TSecr=1115403495"
"335","8.176423","100.86.243.187","23.13.164.38","TCP","66","[TCP Window Update] 54993  >  443 [ACK] Seq=2160 Ack=190606 Win=37456 Len=0 TSval=931369854 TSecr=1115403495"
"336","8.177269","23.13.164.38","100.86.243.187","TCP","1514","443  >  54993 [PSH, ACK] Seq=190606 Ack=2160 Win=5167 Len=1448 TSval=1115403495 TSecr=931369734 [TCP PDU reassembled in 345]"
"337","8.177270","23.13.164.38","100.86.243.187","TCP","1514","443  >  54993 [ACK] Seq=192054 Ack=2160 Win=5167 Len=1448 TSval=1115403496 TSecr=931369734 [TCP PDU reassembled in 345]"
"338","8.177270","23.13.164.38","100.86.243.187","TCP","1514","443  >  54993 [ACK] Seq=193502 Ack=2160 Win=5167 Len=1448 TSval=1115403496 TSecr=931369734 [TCP PDU reassembled in 345]"
"339","8.177271","23.13.164.38","100.86.243.187","TCP","1514","443  >  54993 [ACK] Seq=194950 Ack=2160 Win=5167 Len=1448 TSval=1115403496 TSecr=931369734 [TCP PDU reassembled in 345]"
"340","8.177342","100.86.243.187","23.13.164.38","TCP","66","54993  >  443 [ACK] Seq=2160 Ack=196398 Win=37365 Len=0 TSval=931369855 TSecr=1115403496"
"341","8.177420","100.86.243.187","23.13.164.38","TCP","66","[TCP Window Update] 54993  >  443 [ACK] Seq=2160 Ack=196398 Win=37456 Len=0 TSval=931369855 TSecr=1115403496"
"342","8.178659","23.13.164.38","100.86.243.187","TCP","1514","443  >  54993 [ACK] Seq=196398 Ack=2160 Win=5167 Len=1448 TSval=1115403496 TSecr=931369734 [TCP PDU reassembled in 345]"
"343","8.178660","23.13.164.38","100.86.243.187","TCP","1514","443  >  54993 [ACK] Seq=197846 Ack=2160 Win=5167 Len=1448 TSval=1115403496 TSecr=931369734 [TCP PDU reassembled in 345]"
"344","8.178660","23.13.164.38","100.86.243.187","TCP","1514","443  >  54993 [ACK] Seq=199294 Ack=2160 Win=5167 Len=1448 TSval=1115403496 TSecr=931369734 [TCP PDU reassembled in 345]"
"345","8.178661","23.13.164.38","100.86.243.187","TLSv1.2","1514","Application Data, Application Data"
"346","8.178661","23.13.164.38","100.86.243.187","TCP","1514","443  >  54993 [PSH, ACK] Seq=202190 Ack=2160 Win=5167 Len=1448 TSval=1115403496 TSecr=931369734 [TCP PDU reassembled in 360]"
"347","8.178662","23.13.164.38","100.86.243.187","TCP","1514","443  >  54993 [ACK] Seq=203638 Ack=2160 Win=5167 Len=1448 TSval=1115403497 TSecr=931369734 [TCP PDU reassembled in 360]"
"348","8.178662","23.13.164.38","100.86.243.187","TCP","1514","443  >  54993 [ACK] Seq=205086 Ack=2160 Win=5167 Len=1448 TSval=1115403497 TSecr=931369734 [TCP PDU reassembled in 360]"
"349","8.178663","23.13.164.38","100.86.243.187","TCP","1514","443  >  54993 [ACK] Seq=206534 Ack=2160 Win=5167 Len=1448 TSval=1115403497 TSecr=931369734 [TCP PDU reassembled in 360]"
"350","8.178663","23.13.164.38","100.86.243.187","TCP","1514","443  >  54993 [ACK] Seq=207982 Ack=2160 Win=5167 Len=1448 TSval=1115403497 TSecr=931369734 [TCP PDU reassembled in 360]"
"351","8.178664","23.13.164.38","100.86.243.187","TCP","1514","443  >  54993 [ACK] Seq=209430 Ack=2160 Win=5167 Len=1448 TSval=1115403497 TSecr=931369734 [TCP PDU reassembled in 360]"
"352","8.178664","23.13.164.38","100.86.243.187","TCP","1514","443  >  54993 [ACK] Seq=210878 Ack=2160 Win=5167 Len=1448 TSval=1115403497 TSecr=931369734 [TCP PDU reassembled in 360]"
"353","8.178664","23.13.164.38","100.86.243.187","TCP","1514","443  >  54993 [ACK] Seq=212326 Ack=2160 Win=5167 Len=1448 TSval=1115403497 TSecr=931369734 [TCP PDU reassembled in 360]"
"354","8.178726","100.86.243.187","23.13.164.38","TCP","66","54993  >  443 [ACK] Seq=2160 Ack=212326 Win=37207 Len=0 TSval=931369857 TSecr=1115403497"
"355","8.178807","100.86.243.187","23.13.164.38","TCP","66","54993  >  443 [ACK] Seq=2160 Ack=213774 Win=37184 Len=0 TSval=931369857 TSecr=1115403497"
"356","8.178903","100.86.243.187","23.13.164.38","TCP","66","[TCP Window Update] 54993  >  443 [ACK] Seq=2160 Ack=213774 Win=37456 Len=0 TSval=931369857 TSecr=1115403497"
"357","8.179169","23.13.164.38","100.86.243.187","TCP","1514","443  >  54993 [PSH, ACK] Seq=213774 Ack=2160 Win=5167 Len=1448 TSval=1115403497 TSecr=931369734 [TCP PDU reassembled in 360]"
"358","8.179170","23.13.164.38","100.86.243.187","TCP","1514","443  >  54993 [ACK] Seq=215222 Ack=2160 Win=5167 Len=1448 TSval=1115403498 TSecr=931369734 [TCP PDU reassembled in 360]"
"359","8.179171","23.13.164.38","100.86.243.187","TCP","1514","443  >  54993 [ACK] Seq=216670 Ack=2160 Win=5167 Len=1448 TSval=1115403498 TSecr=931369734 [TCP PDU reassembled in 360]"
"360","8.179171","23.13.164.38","100.86.243.187","TLSv1.2","1514","Application Data, Application Data"
"361","8.179207","100.86.243.187","23.13.164.38","TCP","66","54993  >  443 [ACK] Seq=2160 Ack=219566 Win=37365 Len=0 TSval=931369857 TSecr=1115403498"
"362","8.179328","100.86.243.187","23.13.164.38","TCP","66","[TCP Window Update] 54993  >  443 [ACK] Seq=2160 Ack=219566 Win=37456 Len=0 TSval=931369857 TSecr=1115403498"
"363","8.180585","23.13.164.38","100.86.243.187","TCP","1514","443  >  54993 [ACK] Seq=219566 Ack=2160 Win=5167 Len=1448 TSval=1115403498 TSecr=931369734 [TCP PDU reassembled in 375]"
"364","8.180585","23.13.164.38","100.86.243.187","TCP","1514","443  >  54993 [ACK] Seq=221014 Ack=2160 Win=5167 Len=1448 TSval=1115403498 TSecr=931369734 [TCP PDU reassembled in 375]"
"365","8.180586","23.13.164.38","100.86.243.187","TCP","1514","443  >  54993 [ACK] Seq=222462 Ack=2160 Win=5167 Len=1448 TSval=1115403498 TSecr=931369734 [TCP PDU reassembled in 375]"
"366","8.180586","23.13.164.38","100.86.243.187","TCP","1514","443  >  54993 [ACK] Seq=223910 Ack=2160 Win=5167 Len=1448 TSval=1115403498 TSecr=931369734 [TCP PDU reassembled in 375]"
"367","8.180587","23.13.164.38","100.86.243.187","TCP","1514","443  >  54993 [PSH, ACK] Seq=225358 Ack=2160 Win=5167 Len=1448 TSval=1115403498 TSecr=931369734 [TCP PDU reassembled in 375]"
"368","8.180587","23.13.164.38","100.86.243.187","TCP","1514","443  >  54993 [ACK] Seq=226806 Ack=2160 Win=5167 Len=1448 TSval=1115403499 TSecr=931369734 [TCP PDU reassembled in 375]"
"369","8.180588","23.13.164.38","100.86.243.187","TCP","1514","443  >  54993 [ACK] Seq=228254 Ack=2160 Win=5167 Len=1448 TSval=1115403499 TSecr=931369734 [TCP PDU reassembled in 375]"
"370","8.180588","23.13.164.38","100.86.243.187","TCP","1514","443  >  54993 [ACK] Seq=229702 Ack=2160 Win=5167 Len=1448 TSval=1115403499 TSecr=931369734 [TCP PDU reassembled in 375]"
"371","8.180646","100.86.243.187","23.13.164.38","TCP","66","54993  >  443 [ACK] Seq=2160 Ack=231150 Win=37275 Len=0 TSval=931369859 TSecr=1115403499"
"372","8.180703","100.86.243.187","23.13.164.38","TCP","66","[TCP Window Update] 54993  >  443 [ACK] Seq=2160 Ack=231150 Win=37456 Len=0 TSval=931369859 TSecr=1115403499"
"373","8.182061","23.13.164.38","100.86.243.187","TCP","1514","443  >  54993 [ACK] Seq=231150 Ack=2160 Win=5167 Len=1448 TSval=1115403499 TSecr=931369734 [TCP PDU reassembled in 375]"
"374","8.182062","23.13.164.38","100.86.243.187","TCP","1514","443  >  54993 [ACK] Seq=232598 Ack=2160 Win=5167 Len=1448 TSval=1115403499 TSecr=931369734 [TCP PDU reassembled in 375]"
"375","8.182062","23.13.164.38","100.86.243.187","TLSv1.2","1514","Application Data, Application Data"
"376","8.182063","23.13.164.38","100.86.243.187","TCP","1514","443  >  54993 [ACK] Seq=235494 Ack=2160 Win=5167 Len=1448 TSval=1115403499 TSecr=931369734 [TCP PDU reassembled in 387]"
"377","8.182063","23.13.164.38","100.86.243.187","TCP","1514","443  >  54993 [PSH, ACK] Seq=236942 Ack=2160 Win=5167 Len=1448 TSval=1115403499 TSecr=931369734 [TCP PDU reassembled in 387]"
"378","8.182064","23.13.164.38","100.86.243.187","TCP","1514","443  >  54993 [ACK] Seq=238390 Ack=2160 Win=5167 Len=1448 TSval=1115403500 TSecr=931369734 [TCP PDU reassembled in 387]"
"379","8.182064","23.13.164.38","100.86.243.187","TCP","1514","443  >  54993 [ACK] Seq=239838 Ack=2160 Win=5167 Len=1448 TSval=1115403500 TSecr=931369734 [TCP PDU reassembled in 387]"
"380","8.182064","23.13.164.38","100.86.243.187","TCP","1514","443  >  54993 [ACK] Seq=241286 Ack=2160 Win=5167 Len=1448 TSval=1115403500 TSecr=931369734 [TCP PDU reassembled in 387]"
"381","8.182065","23.13.164.38","100.86.243.187","TCP","1514","443  >  54993 [ACK] Seq=242734 Ack=2160 Win=5167 Len=1448 TSval=1115403500 TSecr=931369734 [TCP PDU reassembled in 387]"
"382","8.182065","23.13.164.38","100.86.243.187","TCP","1514","443  >  54993 [ACK] Seq=244182 Ack=2160 Win=5167 Len=1448 TSval=1115403500 TSecr=931369734 [TCP PDU reassembled in 387]"
"383","8.182066","23.13.164.38","100.86.243.187","TCP","1514","443  >  54993 [ACK] Seq=245630 Ack=2160 Win=5167 Len=1448 TSval=1115403500 TSecr=931369734 [TCP PDU reassembled in 387]"
"384","8.182066","23.13.164.38","100.86.243.187","TCP","1514","443  >  54993 [ACK] Seq=247078 Ack=2160 Win=5167 Len=1448 TSval=1115403500 TSecr=931369734 [TCP PDU reassembled in 387]"
