"No.","Time","Source","Destination","Protocol","Length","Info"
"1","0.000000","23.13.164.38","100.86.243.187","TCP","78","443  >  54993 [ACK] Seq=1 Ack=1 Win=3763 Len=0 TSval=1115363769 TSecr=931330118 SLE=4294965849 SRE=1"
"2","0.045029","23.13.164.38","100.86.243.187","TLSv1.2","406","Application Data"
"3","0.045030","23.13.164.38","100.86.243.187","TCP","1514","443  >  54993 [ACK] Seq=341 Ack=1 Win=3763 Len=1448 TSval=1115363814 TSecr=931330118 [TCP PDU reassembled in 4]"
"4","0.045030","23.13.164.38","100.86.243.187","TLSv1.2","141","Application Data"
"5","0.045128","100.86.243.187","23.13.164.38","TCP","66","54993  >  443 [ACK] Seq=1 Ack=1864 Win=37427 Len=0 TSval=931330175 TSecr=1115363814"
"6","0.046741","23.13.164.38","100.86.243.187","TLSv1.2","406","Application Data"
"7","0.046742","23.13.164.38","100.86.243.187","TLSv1.2","1473","Application Data"
"8","0.046743","23.13.164.38","100.86.243.187","TLSv1.2","1514","Application Data"
"9","0.046744","23.13.164.38","100.86.243.187","TLSv1.2","1514","Application Data, Application Data"
"10","0.046745","23.13.164.38","100.86.243.187","TLSv1.2","724","Application Data"
"11","0.046745","23.13.164.38","100.86.243.187","TLSv1.2","1514","Application Data"
"12","0.046746","23.13.164.38","100.86.243.187","TLSv1.2","268","Application Data"
"13","0.046818","100.86.243.187","23.13.164.38","TCP","66","54993  >  443 [ACK] Seq=1 Ack=8815 Win=37347 Len=0 TSval=931330177 TSecr=1115363815"
"14","0.047234","100.86.243.187","23.13.164.38","TCP","66","[TCP Window Update] 54993  >  443 [ACK] Seq=1 Ack=8815 Win=37456 Len=0 TSval=931330177 TSecr=1115363815"
"15","0.067906","23.13.164.38","100.86.243.187","TLSv1.2","406","Application Data"
"16","0.067907","23.13.164.38","100.86.243.187","TCP","1514","443  >  54993 [ACK] Seq=9155 Ack=1 Win=3763 Len=1448 TSval=1115363836 TSecr=931330177 [TCP PDU reassembled in 17]"
"17","0.067907","23.13.164.38","100.86.243.187","TLSv1.2","105","Application Data"
"18","0.067990","100.86.243.187","23.13.164.38","TCP","66","54993  >  443 [ACK] Seq=1 Ack=10642 Win=37427 Len=0 TSval=931330198 TSecr=1115363836"
"19","0.076676","23.13.164.38","100.86.243.187","TLSv1.2","406","Application Data"
"20","0.076678","23.13.164.38","100.86.243.187","TCP","1514","443  >  54993 [ACK] Seq=10982 Ack=1 Win=3763 Len=1448 TSval=1115363846 TSecr=931330177 [TCP PDU reassembled in 21]"
"21","0.076680","23.13.164.38","100.86.243.187","TLSv1.2","81","Application Data"
"22","0.076794","100.86.243.187","23.13.164.38","TCP","66","54993  >  443 [ACK] Seq=1 Ack=12445 Win=37427 Len=0 TSval=931330207 TSecr=1115363846"
"2561","2.979374","100.86.243.187","23.13.164.38","TLSv1.2","384","Application Data"
"2563","2.989013","23.13.164.38","100.86.243.187","TCP","66","443  >  54993 [ACK] Seq=12445 Ack=319 Win=3785 Len=0 TSval=1115366760 TSecr=931333109"
"2577","3.127769","23.13.164.38","100.86.243.187","TLSv1.2","407","Application Data"
"2578","3.127770","23.13.164.38","100.86.243.187","TCP","1514","443  >  54993 [ACK] Seq=12786 Ack=319 Win=3785 Len=1448 TSval=1115366807 TSecr=931333109 [TCP PDU reassembled in 2633]"
"2579","3.127771","23.13.164.38","100.86.243.187","TCP","1514","[TCP Previous segment not captured] 443  >  54993 [ACK] Seq=15682 Ack=319 Win=3785 Len=1448 TSval=1115366807 TSecr=931333109 [TCP PDU reassembled in 2633]"
"2580","3.127889","100.86.243.187","23.13.164.38","TCP","66","54993  >  443 [ACK] Seq=319 Ack=14234 Win=37428 Len=0 TSval=931333258 TSecr=1115366807"
"2581","3.127937","100.86.243.187","23.13.164.38","TCP","78","[TCP Dup ACK 2580#1] 54993  >  443 [ACK] Seq=319 Ack=14234 Win=37428 Len=0 TSval=931333258 TSecr=1115366807 SLE=15682 SRE=17130"
"2582","3.130523","23.13.164.38","100.86.243.187","TCP","1514","443  >  54993 [ACK] Seq=17130 Ack=319 Win=3785 Len=1448 TSval=1115366807 TSecr=931333109 [TCP PDU reassembled in 2633]"
"2583","3.130524","23.13.164.38","100.86.243.187","TCP","1514","443  >  54993 [ACK] Seq=18578 Ack=319 Win=3785 Len=1448 TSval=1115366807 TSecr=931333109 [TCP PDU reassembled in 2633]"
"2584","3.130526","23.13.164.38","100.86.243.187","TCP","1514","443  >  54993 [ACK] Seq=20026 Ack=319 Win=3785 Len=1448 TSval=1115366807 TSecr=931333109 [TCP PDU reassembled in 2633]"
"2585","3.130527","23.13.164.38","100.86.243.187","TCP","1514","443  >  54993 [ACK] Seq=21474 Ack=319 Win=3785 Len=1448 TSval=1115366807 TSecr=931333109 [TCP PDU reassembled in 2633]"
"2586","3.130530","23.13.164.38","100.86.243.187","TCP","1514","443  >  54993 [ACK] Seq=22922 Ack=319 Win=3785 Len=1448 TSval=1115366807 TSecr=931333109 [TCP PDU reassembled in 2633]"
"2587","3.130531","23.13.164.38","100.86.243.187","TCP","1514","443  >  54993 [PSH, ACK] Seq=24370 Ack=319 Win=3785 Len=1448 TSval=1115366807 TSecr=931333109 [TCP PDU reassembled in 2633]"
"2588","3.130531","23.13.164.38","100.86.243.187","TCP","1514","443  >  54993 [ACK] Seq=25818 Ack=319 Win=3785 Len=1448 TSval=1115366808 TSecr=931333109 [TCP PDU reassembled in 2633]"
"2589","3.130532","23.13.164.38","100.86.243.187","TCP","1514","443  >  54993 [ACK] Seq=27266 Ack=319 Win=3785 Len=1448 TSval=1115366808 TSecr=931333109 [TCP PDU reassembled in 2633]"
"2590","3.130532","23.13.164.38","100.86.243.187","TCP","1514","443  >  54993 [ACK] Seq=28714 Ack=319 Win=3785 Len=1448 TSval=1115366808 TSecr=931333109 [TCP PDU reassembled in 2633], Application Data"
"2591","3.130533","23.13.164.38","100.86.243.187","TCP","1514","443  >  54993 [ACK] Seq=30162 Ack=319 Win=3785 Len=1448 TSval=1115366808 TSecr=931333109 [TCP PDU reassembled in 2601]"
"2592","3.130533","23.13.164.38","100.86.243.187","TCP","1514","443  >  54993 [ACK] Seq=31610 Ack=319 Win=3785 Len=1448 TSval=1115366808 TSecr=931333109 [TCP PDU reassembled in 2601]"
"2593","3.130534","23.13.164.38","100.86.243.187","TCP","1514","443  >  54993 [ACK] Seq=33058 Ack=319 Win=3785 Len=1448 TSval=1115366808 TSecr=931333109 [TCP PDU reassembled in 2601]"
"2594","3.130534","23.13.164.38","100.86.243.187","TCP","1514","443  >  54993 [ACK] Seq=34506 Ack=319 Win=3785 Len=1448 TSval=1115366808 TSecr=931333109 [TCP PDU reassembled in 2601]"
"2595","3.130535","23.13.164.38","100.86.243.187","TCP","1514","443  >  54993 [ACK] Seq=35954 Ack=319 Win=3785 Len=1448 TSval=1115366808 TSecr=931333109 [TCP PDU reassembled in 2601]"
"2596","3.130536","23.13.164.38","100.86.243.187","TCP","1514","443  >  54993 [PSH, ACK] Seq=37402 Ack=319 Win=3785 Len=1448 TSval=1115366808 TSecr=931333109 [TCP PDU reassembled in 2601]"
"2597","3.130536","23.13.164.38","100.86.243.187","TCP","1514","443  >  54993 [ACK] Seq=38850 Ack=319 Win=3785 Len=1448 TSval=1115366809 TSecr=931333109 [TCP PDU reassembled in 2601]"
"2598","3.130537","23.13.164.38","100.86.243.187","TCP","1514","443  >  54993 [ACK] Seq=40298 Ack=319 Win=3785 Len=1448 TSval=1115366809 TSecr=931333109 [TCP PDU reassembled in 2601]"
"2599","3.130537","23.13.164.38","100.86.243.187","TCP","1514","443  >  54993 [ACK] Seq=41746 Ack=319 Win=3785 Len=1448 TSval=1115366809 TSecr=931333109 [TCP PDU reassembled in 2601]"
"2600","3.130538","23.13.164.38","100.86.243.187","TCP","1514","443  >  54993 [ACK] Seq=43194 Ack=319 Win=3785 Len=1448 TSval=1115366809 TSecr=931333109 [TCP PDU reassembled in 2601]"
"2601","3.130538","23.13.164.38","100.86.243.187","TLSv1.2","1514","Application Data, Application Data"
"2602","3.130539","23.13.164.38","100.86.243.187","TCP","1514","443  >  54993 [ACK] Seq=46090 Ack=319 Win=3785 Len=1448 TSval=1115366809 TSecr=931333109 [TCP PDU reassembled in 2636]"
"2603","3.130539","23.13.164.38","100.86.243.187","TCP","1514","443  >  54993 [ACK] Seq=47538 Ack=319 Win=3785 Len=1448 TSval=1115366809 TSecr=931333109 [TCP PDU reassembled in 2636]"
"2604","3.130540","23.13.164.38","100.86.243.187","TCP","1514","443  >  54993 [ACK] Seq=48986 Ack=319 Win=3785 Len=1448 TSval=1115366809 TSecr=931333109 [TCP PDU reassembled in 2636]"
"2605","3.130541","23.13.164.38","100.86.243.187","TCP","1514","443  >  54993 [PSH, ACK] Seq=50434 Ack=319 Win=3785 Len=1448 TSval=1115366809 TSecr=931333109 [TCP PDU reassembled in 2636]"
"2606","3.130542","23.13.164.38","100.86.243.187","TCP","1514","443  >  54993 [ACK] Seq=51882 Ack=319 Win=3785 Len=1448 TSval=1115366810 TSecr=931333109 [TCP PDU reassembled in 2636]"
"2607","3.130542","23.13.164.38","100.86.243.187","TCP","1514","443  >  54993 [ACK] Seq=53330 Ack=319 Win=3785 Len=1448 TSval=1115366810 TSecr=931333109 [TCP PDU reassembled in 2636]"
"2608","3.130639","100.86.243.187","23.13.164.38","TCP","78","[TCP Dup ACK 2580#2] 54993  >  443 [ACK] Seq=319 Ack=14234 Win=37456 Len=0 TSval=931333261 TSecr=1115366807 SLE=15682 SRE=33058"
"2609","3.130676","100.86.243.187","23.13.164.38","TCP","78","[TCP Dup ACK 2580#3] 54993  >  443 [ACK] Seq=319 Ack=14234 Win=37456 Len=0 TSval=931333261 TSecr=1115366807 SLE=15682 SRE=48986"
"2610","3.130699","100.86.243.187","23.13.164.38","TCP","78","[TCP Dup ACK 2580#4] 54993  >  443 [ACK] Seq=319 Ack=14234 Win=37456 Len=0 TSval=931333261 TSecr=1115366807 SLE=15682 SRE=54778"
"2611","3.131927","23.13.164.38","100.86.243.187","TCP","1514","443  >  54993 [ACK] Seq=54778 Ack=319 Win=3785 Len=1448 TSval=1115366810 TSecr=931333109 [TCP PDU reassembled in 2636]"
"2612","3.131928","23.13.164.38","100.86.243.187","TCP","1514","[TCP Previous segment not captured] 443  >  54993 [ACK] Seq=57674 Ack=319 Win=3785 Len=1448 TSval=1115366810 TSecr=931333109 [TCP PDU reassembled in 2636]"
"2613","3.131929","23.13.164.38","100.86.243.187","TCP","1514","443  >  54993 [ACK] Seq=59122 Ack=319 Win=3785 Len=1448 TSval=1115366810 TSecr=931333109 [TCP PDU reassembled in 2636]"
"2614","3.131930","23.13.164.38","100.86.243.187","TCP","1514","443  >  54993 [ACK] Seq=60570 Ack=319 Win=3785 Len=1448 TSval=1115366810 TSecr=931333109 [TCP PDU reassembled in 2636]"
"2615","3.131931","23.13.164.38","100.86.243.187","TCP","1514","443  >  54993 [ACK] Seq=62018 Ack=319 Win=3785 Len=1448 TSval=1115366810 TSecr=931333109 [TCP PDU reassembled in 2636], Application Data"
"2616","3.131934","23.13.164.38","100.86.243.187","TCP","1514","443  >  54993 [PSH, ACK] Seq=63466 Ack=319 Win=3785 Len=1448 TSval=1115366810 TSecr=931333109 [TCP PDU reassembled in 2625]"
"2617","3.131935","23.13.164.38","100.86.243.187","TCP","1514","443  >  54993 [ACK] Seq=64914 Ack=319 Win=3785 Len=1448 TSval=1115366811 TSecr=931333109 [TCP PDU reassembled in 2625]"
"2618","3.131936","23.13.164.38","100.86.243.187","TCP","1514","443  >  54993 [ACK] Seq=66362 Ack=319 Win=3785 Len=1448 TSval=1115366811 TSecr=931333109 [TCP PDU reassembled in 2625]"
"2619","3.131936","23.13.164.38","100.86.243.187","TCP","1514","443  >  54993 [ACK] Seq=67810 Ack=319 Win=3785 Len=1448 TSval=1115366811 TSecr=931333109 [TCP PDU reassembled in 2625]"
"2620","3.131937","23.13.164.38","100.86.243.187","TCP","1514","443  >  54993 [ACK] Seq=69258 Ack=319 Win=3785 Len=1448 TSval=1115366811 TSecr=931333109 [TCP PDU reassembled in 2625]"
"2621","3.131937","23.13.164.38","100.86.243.187","TCP","1514","443  >  54993 [ACK] Seq=70706 Ack=319 Win=3785 Len=1448 TSval=1115366811 TSecr=931333109 [TCP PDU reassembled in 2625]"
"2622","3.131938","23.13.164.38","100.86.243.187","TCP","1514","443  >  54993 [ACK] Seq=72154 Ack=319 Win=3785 Len=1448 TSval=1115366811 TSecr=931333109 [TCP PDU reassembled in 2625]"
"2623","3.131938","23.13.164.38","100.86.243.187","TCP","1514","443  >  54993 [ACK] Seq=73602 Ack=319 Win=3785 Len=1448 TSval=1115366811 TSecr=931333109 [TCP PDU reassembled in 2625]"
"2624","3.131939","23.13.164.38","100.86.243.187","TCP","1514","443  >  54993 [ACK] Seq=75050 Ack=319 Win=3785 Len=1448 TSval=1115366811 TSecr=931333109 [TCP PDU reassembled in 2625]"
"2625","3.131939","23.13.164.38","100.86.243.187","TLSv1.2","149","Application Data"
"2626","3.131940","23.13.164.38","100.86.243.187","TCP","149","[TCP Fast Retransmission] 443  >  54993 [PSH, ACK] Seq=76498 Ack=319 Win=3785 Len=83 TSval=1115366843 TSecr=931333109 [TCP PDU reassembled in 2625]"
"2628","3.132045","100.86.243.187","23.13.164.38","TCP","78","[TCP Dup ACK 2580#5] 54993  >  443 [ACK] Seq=319 Ack=14234 Win=37456 Len=0 TSval=931333262 TSecr=1115366807 SLE=15682 SRE=56226"
"2629","3.132079","100.86.243.187","23.13.164.38","TCP","86","[TCP Dup ACK 2580#6] 54993  >  443 [ACK] Seq=319 Ack=14234 Win=37456 Len=0 TSval=931333262 TSecr=1115366807 SLE=57674 SRE=73602 SLE=15682 SRE=56226"
"2631","3.132125","100.86.243.187","23.13.164.38","TCP","86","[TCP Dup ACK 2580#7] 54993  >  443 [ACK] Seq=319 Ack=14234 Win=37456 Len=0 TSval=931333262 TSecr=1115366807 SLE=57674 SRE=76581 SLE=15682 SRE=56226"
"2632","3.132146","100.86.243.187","23.13.164.38","TCP","94","[TCP Dup ACK 2580#8] 54993  >  443 [ACK] Seq=319 Ack=14234 Win=37456 Len=0 TSval=931333262 TSecr=1115366807 SLE=76498 SRE=76581 SLE=57674 SRE=76581 SLE=15682 SRE=56226"
"2633","3.142680","23.13.164.38","100.86.243.187","TLSv1.2","1514","[TCP Fast Retransmission] , Application Data"
"2634","3.142776","100.86.243.187","23.13.164.38","TCP","78","54993  >  443 [ACK] Seq=319 Ack=56226 Win=36800 Len=0 TSval=931333273 TSecr=1115366912 SLE=57674 SRE=76581"
"2635","3.143037","100.86.243.187","23.13.164.38","TCP","78","[TCP Dup ACK 2634#1] 54993  >  443 [ACK] Seq=319 Ack=56226 Win=37456 Len=0 TSval=931333273 TSecr=1115366912 SLE=57674 SRE=76581"
"2636","3.144140","23.13.164.38","100.86.243.187","TCP","1514","[TCP Retransmission] 443  >  54993 [ACK] Seq=56226 Ack=319 Win=3785 Len=1448 TSval=1115366915 TSecr=931333262"
"2637","3.144211","100.86.243.187","23.13.164.38","TCP","66","54993  >  443 [ACK] Seq=319 Ack=76581 Win=37138 Len=0 TSval=931333274 TSecr=1115366915"
"2638","3.144362","100.86.243.187","23.13.164.38","TCP","66","[TCP Window Update] 54993  >  443 [ACK] Seq=319 Ack=76581 Win=37456 Len=0 TSval=931333274 TSecr=1115366915"
"2641","3.468970","100.86.243.187","23.13.164.38","TLSv1.2","391","Application Data"
"2642","3.479882","23.13.164.38","100.86.243.187","TCP","66","443  >  54993 [ACK] Seq=76581 Ack=644 Win=3808 Len=0 TSval=1115367250 TSecr=931333599"
"2648","3.549408","23.13.164.38","100.86.243.187","TLSv1.2","419","Application Data"
"2649","3.549410","23.13.164.38","100.86.243.187","TCP","1514","443  >  54993 [ACK] Seq=76934 Ack=644 Win=3808 Len=1448 TSval=1115367318 TSecr=931333599 [TCP PDU reassembled in 2662]"
"2650","3.549410","23.13.164.38","100.86.243.187","TCP","1514","443  >  54993 [ACK] Seq=78382 Ack=644 Win=3808 Len=1448 TSval=1115367318 TSecr=931333599 [TCP PDU reassembled in 2662]"
"2651","3.549524","100.86.243.187","23.13.164.38","TCP","66","54993  >  443 [ACK] Seq=644 Ack=79830 Win=37405 Len=0 TSval=931333679 TSecr=1115367318"
"2652","3.549754","100.86.243.187","23.13.164.38","TCP","66","[TCP Window Update] 54993  >  443 [ACK] Seq=644 Ack=79830 Win=37456 Len=0 TSval=931333680 TSecr=1115367318"
"2653","3.551218","23.13.164.38","100.86.243.187","TCP","1514","443  >  54993 [ACK] Seq=79830 Ack=644 Win=3808 Len=1448 TSval=1115367318 TSecr=931333599 [TCP PDU reassembled in 2662]"
"2654","3.551219","23.13.164.38","100.86.243.187","TCP","1514","443  >  54993 [ACK] Seq=81278 Ack=644 Win=3808 Len=1448 TSval=1115367318 TSecr=931333599 [TCP PDU reassembled in 2662]"
"2655","3.551219","23.13.164.38","100.86.243.187","TCP","1514","443  >  54993 [ACK] Seq=82726 Ack=644 Win=3808 Len=1448 TSval=1115367318 TSecr=931333599 [TCP PDU reassembled in 2662]"
"2656","3.551220","23.13.164.38","100.86.243.187","TCP","1514","443  >  54993 [ACK] Seq=84174 Ack=644 Win=3808 Len=1448 TSval=1115367318 TSecr=931333599 [TCP PDU reassembled in 2662]"
"2657","3.551220","23.13.164.38","100.86.243.187","TCP","1514","443  >  54993 [ACK] Seq=85622 Ack=644 Win=3808 Len=1448 TSval=1115367318 TSecr=931333599 [TCP PDU reassembled in 2662]"
"2658","3.551221","23.13.164.38","100.86.243.187","TCP","1514","443  >  54993 [ACK] Seq=87070 Ack=644 Win=3808 Len=1448 TSval=1115367318 TSecr=931333599 [TCP PDU reassembled in 2662]"
"2659","3.551221","23.13.164.38","100.86.243.187","TCP","1514","443  >  54993 [PSH, ACK] Seq=88518 Ack=644 Win=3808 Len=1448 TSval=1115367318 TSecr=931333599 [TCP PDU reassembled in 2662]"
"2660","3.551222","23.13.164.38","100.86.243.187","TCP","1514","443  >  54993 [ACK] Seq=89966 Ack=644 Win=3808 Len=1448 TSval=1115367319 TSecr=931333599 [TCP PDU reassembled in 2662]"
"2661","3.551222","23.13.164.38","100.86.243.187","TCP","1514","443  >  54993 [ACK] Seq=91414 Ack=644 Win=3808 Len=1448 TSval=1115367319 TSecr=931333599 [TCP PDU reassembled in 2662]"
"2662","3.551223","23.13.164.38","100.86.243.187","TLSv1.2","1514","Application Data, Application Data"
"2663","3.551232","23.13.164.38","100.86.243.187","TCP","1514","443  >  54993 [ACK] Seq=94310 Ack=644 Win=3808 Len=1448 TSval=1115367319 TSecr=931333599 [TCP PDU reassembled in 2673]"
"2664","3.551233","23.13.164.38","100.86.243.187","TCP","1514","443  >  54993 [ACK] Seq=95758 Ack=644 Win=3808 Len=1448 TSval=1115367319 TSecr=931333599 [TCP PDU reassembled in 2673]"
"2665","3.551233","23.13.164.38","100.86.243.187","TCP","1514","443  >  54993 [ACK] Seq=97206 Ack=644 Win=3808 Len=1448 TSval=1115367319 TSecr=931333599 [TCP PDU reassembled in 2673]"
"2666","3.551234","23.13.164.38","100.86.243.187","TCP","1514","443  >  54993 [ACK] Seq=98654 Ack=644 Win=3808 Len=1448 TSval=1115367319 TSecr=931333599 [TCP PDU reassembled in 2673]"
"2667","3.551234","23.13.164.38","100.86.243.187","TCP","1514","443  >  54993 [ACK] Seq=100102 Ack=644 Win=3808 Len=1448 TSval=1115367319 TSecr=931333599 [TCP PDU reassembled in 2673]"
"2668","3.551235","23.13.164.38","100.86.243.187","TCP","1514","443  >  54993 [PSH, ACK] Seq=101550 Ack=644 Win=3808 Len=1448 TSval=1115367319 TSecr=931333599 [TCP PDU reassembled in 2673]"
"2669","3.551236","23.13.164.38","100.86.243.187","TCP","1514","443  >  54993 [ACK] Seq=102998 Ack=644 Win=3808 Len=1448 TSval=1115367320 TSecr=931333599 [TCP PDU reassembled in 2673]"
"2670","3.551236","23.13.164.38","100.86.243.187","TCP","1514","443  >  54993 [ACK] Seq=104446 Ack=644 Win=3808 Len=1448 TSval=1115367320 TSecr=931333599 [TCP PDU reassembled in 2673]"
"2671","3.551237","23.13.164.38","100.86.243.187","TCP","1514","443  >  54993 [ACK] Seq=105894 Ack=644 Win=3808 Len=1448 TSval=1115367320 TSecr=931333599 [TCP PDU reassembled in 2673]"
"2672","3.551238","23.13.164.38","100.86.243.187","TCP","1514","443  >  54993 [ACK] Seq=107342 Ack=644 Win=3808 Len=1448 TSval=1115367320 TSecr=931333599 [TCP PDU reassembled in 2673]"
"2673","3.551239","23.13.164.38","100.86.243.187","TLSv1.2","1514","Application Data, Application Data"
"2674","3.551239","23.13.164.38","100.86.243.187","TCP","1514","443  >  54993 [ACK] Seq=110238 Ack=644 Win=3808 Len=1448 TSval=1115367320 TSecr=931333599 [TCP PDU reassembled in 2678]"
"2675","3.551240","23.13.164.38","100.86.243.187","TCP","1514","443  >  54993 [ACK] Seq=111686 Ack=644 Win=3808 Len=1448 TSval=1115367320 TSecr=931333599 [TCP PDU reassembled in 2678]"
"2676","3.551240","23.13.164.38","100.86.243.187","TCP","1514","443  >  54993 [ACK] Seq=113134 Ack=644 Win=3808 Len=1448 TSval=1115367320 TSecr=931333599 [TCP PDU reassembled in 2678]"
"2677","3.551241","23.13.164.38","100.86.243.187","TCP","1514","443  >  54993 [PSH, ACK] Seq=114582 Ack=644 Win=3808 Len=1448 TSval=1115367320 TSecr=931333599 [TCP PDU reassembled in 2678]"
"2678","3.551241","23.13.164.38","100.86.243.187","TLSv1.2","922","Application Data"
"2679","3.551326","100.86.243.187","23.13.164.38","TCP","66","54993  >  443 [ACK] Seq=644 Ack=95758 Win=37207 Len=0 TSval=931333681 TSecr=1115367319"
"2680","3.551369","100.86.243.187","23.13.164.38","TCP","66","54993  >  443 [ACK] Seq=644 Ack=111686 Win=36958 Len=0 TSval=931333681 TSecr=1115367320"
"2681","3.551409","100.86.243.187","23.13.164.38","TCP","66","54993  >  443 [ACK] Seq=644 Ack=116886 Win=36877 Len=0 TSval=931333681 TSecr=1115367321"
"2682","3.551576","100.86.243.187","23.13.164.38","TCP","66","[TCP Window Update] 54993  >  443 [ACK] Seq=644 Ack=116886 Win=37456 Len=0 TSval=931333681 TSecr=1115367321"
"2683","3.700169","100.86.243.187","23.13.164.38","TLSv1.2","366","Application Data"
"2684","3.701308","100.86.243.187","23.13.164.38","TLSv1.2","366","Application Data"
"2685","3.713066","23.13.164.38","100.86.243.187","TCP","66","443  >  54993 [ACK] Seq=116886 Ack=944 Win=3831 Len=0 TSval=1115367483 TSecr=931333830"
"2686","3.713070","23.13.164.38","100.86.243.187","TCP","66","443  >  54993 [ACK] Seq=116886 Ack=1244 Win=3853 Len=0 TSval=1115367483 TSecr=931333831"
"2688","3.796059","23.13.164.38","100.86.243.187","TLSv1.2","407","Application Data"
"2689","3.796161","100.86.243.187","23.13.164.38","TCP","66","54993  >  443 [ACK] Seq=1244 Ack=117227 Win=37450 Len=0 TSval=931333926 TSecr=1115367565"
"2690","3.798145","23.13.164.38","100.86.243.187","TCP","1514","443  >  54993 [ACK] Seq=117227 Ack=1244 Win=3853 Len=1448 TSval=1115367565 TSecr=931333831 [TCP PDU reassembled in 2701]"
"2691","3.798146","23.13.164.38","100.86.243.187","TCP","1514","443  >  54993 [ACK] Seq=118675 Ack=1244 Win=3853 Len=1448 TSval=1115367565 TSecr=931333831 [TCP PDU reassembled in 2701]"
"2692","3.798146","23.13.164.38","100.86.243.187","TCP","1514","443  >  54993 [ACK] Seq=120123 Ack=1244 Win=3853 Len=1448 TSval=1115367565 TSecr=931333831 [TCP PDU reassembled in 2701]"
"2693","3.798146","23.13.164.38","100.86.243.187","TCP","1514","443  >  54993 [ACK] Seq=121571 Ack=1244 Win=3853 Len=1448 TSval=1115367565 TSecr=931333831 [TCP PDU reassembled in 2701]"
"2694","3.798147","23.13.164.38","100.86.243.187","TCP","1514","443  >  54993 [ACK] Seq=123019 Ack=1244 Win=3853 Len=1448 TSval=1115367565 TSecr=931333831 [TCP PDU reassembled in 2701]"
"2695","3.798148","23.13.164.38","100.86.243.187","TCP","1514","443  >  54993 [ACK] Seq=124467 Ack=1244 Win=3853 Len=1448 TSval=1115367565 TSecr=931333831 [TCP PDU reassembled in 2701]"
"2696","3.798148","23.13.164.38","100.86.243.187","TCP","1514","443  >  54993 [ACK] Seq=125915 Ack=1244 Win=3853 Len=1448 TSval=1115367565 TSecr=931333831 [TCP PDU reassembled in 2701]"
"2697","3.798151","23.13.164.38","100.86.243.187","TCP","1514","443  >  54993 [ACK] Seq=127363 Ack=1244 Win=3853 Len=1448 TSval=1115367565 TSecr=931333831 [TCP PDU reassembled in 2701]"
"2698","3.798151","23.13.164.38","100.86.243.187","TCP","1514","443  >  54993 [PSH, ACK] Seq=128811 Ack=1244 Win=3853 Len=1448 TSval=1115367565 TSecr=931333831 [TCP PDU reassembled in 2701]"
"2699","3.798152","23.13.164.38","100.86.243.187","TCP","1514","443  >  54993 [ACK] Seq=130259 Ack=1244 Win=3853 Len=1448 TSval=1115367566 TSecr=931333831 [TCP PDU reassembled in 2701]"
"2700","3.798152","23.13.164.38","100.86.243.187","TCP","1514","443  >  54993 [ACK] Seq=131707 Ack=1244 Win=3853 Len=1448 TSval=1115367566 TSecr=931333831 [TCP PDU reassembled in 2701]"
"2701","3.798153","23.13.164.38","100.86.243.187","TLSv1.2","1514","Application Data, Application Data"
"2702","3.798153","23.13.164.38","100.86.243.187","TCP","1514","443  >  54993 [ACK] Seq=134603 Ack=1244 Win=3853 Len=1448 TSval=1115367566 TSecr=931333831 [TCP PDU reassembled in 2705]"
"2703","3.798154","23.13.164.38","100.86.243.187","TCP","1514","443  >  54993 [ACK] Seq=136051 Ack=1244 Win=3853 Len=1448 TSval=1115367566 TSecr=931333831 [TCP PDU reassembled in 2705]"
"2704","3.798154","23.13.164.38","100.86.243.187","TCP","1514","443  >  54993 [ACK] Seq=137499 Ack=1244 Win=3853 Len=1448 TSval=1115367566 TSecr=931333831 [TCP PDU reassembled in 2705]"
"2705","3.798155","23.13.164.38","100.86.243.187","TLSv1.2","578","Application Data"
"2709","3.798333","100.86.243.187","23.13.164.38","TCP","66","54993  >  443 [ACK] Seq=1244 Ack=133155 Win=37207 Len=0 TSval=931333928 TSecr=1115367566"
"2710","3.798363","100.86.243.187","23.13.164.38","TCP","66","54993  >  443 [ACK] Seq=1244 Ack=139459 Win=37108 Len=0 TSval=931333928 TSecr=1115367566"
"2711","3.798907","100.86.243.187","23.13.164.38","TCP","66","[TCP Window Update] 54993  >  443 [ACK] Seq=1244 Ack=139459 Win=37456 Len=0 TSval=931333928 TSecr=1115367566"
"2712","3.818795","23.13.164.38","100.86.243.187","TLSv1.2","408","Application Data"
"2713","3.818898","100.86.243.187","23.13.164.38","TCP","66","54993  >  443 [ACK] Seq=1244 Ack=139801 Win=37450 Len=0 TSval=931333949 TSecr=1115367588"
"2714","3.820739","23.13.164.38","100.86.243.187","TCP","1514","443  >  54993 [ACK] Seq=139801 Ack=1244 Win=3853 Len=1448 TSval=1115367588 TSecr=931333928 [TCP PDU reassembled in 2795]"
"2715","3.820740","23.13.164.38","100.86.243.187","TCP","1514","443  >  54993 [ACK] Seq=141249 Ack=1244 Win=3853 Len=1448 TSval=1115367588 TSecr=931333928 [TCP PDU reassembled in 2795]"
"2716","3.820740","23.13.164.38","100.86.243.187","TCP","1514","443  >  54993 [ACK] Seq=142697 Ack=1244 Win=3853 Len=1448 TSval=1115367588 TSecr=931333928 [TCP PDU reassembled in 2795]"
"2717","3.820742","23.13.164.38","100.86.243.187","TCP","1514","443  >  54993 [ACK] Seq=144145 Ack=1244 Win=3853 Len=1448 TSval=1115367588 TSecr=931333928 [TCP PDU reassembled in 2795]"
"2718","3.820756","23.13.164.38","100.86.243.187","TCP","1514","443  >  54993 [ACK] Seq=145593 Ack=1244 Win=3853 Len=1448 TSval=1115367588 TSecr=931333928 [TCP PDU reassembled in 2795]"
"2719","3.820757","23.13.164.38","100.86.243.187","TCP","1514","443  >  54993 [ACK] Seq=147041 Ack=1244 Win=3853 Len=1448 TSval=1115367588 TSecr=931333928 [TCP PDU reassembled in 2795]"
"2720","3.820758","23.13.164.38","100.86.243.187","TCP","1514","443  >  54993 [ACK] Seq=148489 Ack=1244 Win=3853 Len=1448 TSval=1115367588 TSecr=931333928 [TCP PDU reassembled in 2795]"
"2721","3.820759","23.13.164.38","100.86.243.187","TCP","1514","[TCP Previous segment not captured] 443  >  54993 [PSH, ACK] Seq=151385 Ack=1244 Win=3853 Len=1448 TSval=1115367588 TSecr=931333928 [TCP PDU reassembled in 2795]"
"2722","3.820759","23.13.164.38","100.86.243.187","TCP","1514","443  >  54993 [ACK] Seq=152833 Ack=1244 Win=3853 Len=1448 TSval=1115367589 TSecr=931333928 [TCP PDU reassembled in 2795]"
"2723","3.820759","23.13.164.38","100.86.243.187","TCP","1514","443  >  54993 [ACK] Seq=154281 Ack=1244 Win=3853 Len=1448 TSval=1115367589 TSecr=931333928 [TCP PDU reassembled in 2795]"
"2724","3.820760","23.13.164.38","100.86.243.187","TCP","1514","443  >  54993 [ACK] Seq=155729 Ack=1244 Win=3853 Len=1448 TSval=1115367589 TSecr=931333928 [TCP PDU reassembled in 2795], Application Data"
"2725","3.820761","23.13.164.38","100.86.243.187","TCP","1514","443  >  54993 [ACK] Seq=157177 Ack=1244 Win=3853 Len=1448 TSval=1115367589 TSecr=931333928 [TCP PDU reassembled in 2735]"
"2726","3.820761","23.13.164.38","100.86.243.187","TCP","1514","443  >  54993 [ACK] Seq=158625 Ack=1244 Win=3853 Len=1448 TSval=1115367589 TSecr=931333928 [TCP PDU reassembled in 2735]"
"2727","3.820762","23.13.164.38","100.86.243.187","TCP","1514","443  >  54993 [ACK] Seq=160073 Ack=1244 Win=3853 Len=1448 TSval=1115367589 TSecr=931333928 [TCP PDU reassembled in 2735]"
"2728","3.820762","23.13.164.38","100.86.243.187","TCP","1514","443  >  54993 [ACK] Seq=161521 Ack=1244 Win=3853 Len=1448 TSval=1115367589 TSecr=931333928 [TCP PDU reassembled in 2735]"
"2729","3.820763","23.13.164.38","100.86.243.187","TCP","1514","443  >  54993 [ACK] Seq=162969 Ack=1244 Win=3853 Len=1448 TSval=1115367589 TSecr=931333928 [TCP PDU reassembled in 2735]"
"2730","3.820763","23.13.164.38","100.86.243.187","TCP","1514","443  >  54993 [PSH, ACK] Seq=164417 Ack=1244 Win=3853 Len=1448 TSval=1115367589 TSecr=931333928 [TCP PDU reassembled in 2735]"
"2731","3.820764","23.13.164.38","100.86.243.187","TCP","1514","443  >  54993 [ACK] Seq=165865 Ack=1244 Win=3853 Len=1448 TSval=1115367590 TSecr=931333928 [TCP PDU reassembled in 2735]"
"2732","3.820765","23.13.164.38","100.86.243.187","TCP","1514","443  >  54993 [ACK] Seq=167313 Ack=1244 Win=3853 Len=1448 TSval=1115367590 TSecr=931333928 [TCP PDU reassembled in 2735]"
"2733","3.820765","23.13.164.38","100.86.243.187","TCP","1514","443  >  54993 [ACK] Seq=168761 Ack=1244 Win=3853 Len=1448 TSval=1115367590 TSecr=931333928 [TCP PDU reassembled in 2735]"
"2734","3.820766","23.13.164.38","100.86.243.187","TCP","1514","443  >  54993 [ACK] Seq=170209 Ack=1244 Win=3853 Len=1448 TSval=1115367590 TSecr=931333928 [TCP PDU reassembled in 2735]"
"2735","3.820766","23.13.164.38","100.86.243.187","TLSv1.2","1514","Application Data, Application Data"
"2736","3.820767","23.13.164.38","100.86.243.187","TCP","1514","443  >  54993 [ACK] Seq=173105 Ack=1244 Win=3853 Len=1448 TSval=1115367590 TSecr=931333928 [TCP PDU reassembled in 2751]"
"2737","3.820767","23.13.164.38","100.86.243.187","TCP","1514","443  >  54993 [ACK] Seq=174553 Ack=1244 Win=3853 Len=1448 TSval=1115367590 TSecr=931333928 [TCP PDU reassembled in 2751]"
"2738","3.820767","23.13.164.38","100.86.243.187","TCP","1514","443  >  54993 [ACK] Seq=176001 Ack=1244 Win=3853 Len=1448 TSval=1115367590 TSecr=931333928 [TCP PDU reassembled in 2751]"
"2739","3.820768","23.13.164.38","100.86.243.187","TCP","1514","443  >  54993 [PSH, ACK] Seq=177449 Ack=1244 Win=3853 Len=1448 TSval=1115367590 TSecr=931333928 [TCP PDU reassembled in 2751]"
"2740","3.820769","23.13.164.38","100.86.243.187","TCP","1514","443  >  54993 [ACK] Seq=178897 Ack=1244 Win=3853 Len=1448 TSval=1115367591 TSecr=931333928 [TCP PDU reassembled in 2751]"
"2741","3.820769","23.13.164.38","100.86.243.187","TCP","1514","443  >  54993 [ACK] Seq=180345 Ack=1244 Win=3853 Len=1448 TSval=1115367591 TSecr=931333928 [TCP PDU reassembled in 2751]"
"2742","3.820855","100.86.243.187","23.13.164.38","TCP","66","54993  >  443 [ACK] Seq=1244 Ack=149937 Win=37297 Len=0 TSval=931333951 TSecr=1115367588"
"2743","3.820925","100.86.243.187","23.13.164.38","TCP","78","[TCP Dup ACK 2742#1] 54993  >  443 [ACK] Seq=1244 Ack=149937 Win=37297 Len=0 TSval=931333951 TSecr=1115367588 SLE=151385 SRE=167313"
"2744","3.820951","100.86.243.187","23.13.164.38","TCP","78","[TCP Dup ACK 2742#2] 54993  >  443 [ACK] Seq=1244 Ack=149937 Win=37456 Len=0 TSval=931333951 TSecr=1115367588 SLE=151385 SRE=167313"
"2745","3.820971","100.86.243.187","23.13.164.38","TCP","78","[TCP Dup ACK 2742#3] 54993  >  443 [ACK] Seq=1244 Ack=149937 Win=37456 Len=0 TSval=931333951 TSecr=1115367588 SLE=151385 SRE=181793"
"2746","3.821953","23.13.164.38","100.86.243.187","TCP","1514","443  >  54993 [ACK] Seq=181793 Ack=1244 Win=3853 Len=1448 TSval=1115367591 TSecr=931333928 [TCP PDU reassembled in 2751]"
"2747","3.821954","23.13.164.38","100.86.243.187","TCP","1514","443  >  54993 [ACK] Seq=183241 Ack=1244 Win=3853 Len=1448 TSval=1115367591 TSecr=931333928 [TCP PDU reassembled in 2751]"
"2748","3.821955","23.13.164.38","100.86.243.187","TCP","1514","443  >  54993 [ACK] Seq=184689 Ack=1244 Win=3853 Len=1448 TSval=1115367591 TSecr=931333928 [TCP PDU reassembled in 2751]"
"2749","3.821955","23.13.164.38","100.86.243.187","TCP","1514","443  >  54993 [ACK] Seq=186137 Ack=1244 Win=3853 Len=1448 TSval=1115367591 TSecr=931333928 [TCP PDU reassembled in 2751]"
"2750","3.821956","23.13.164.38","100.86.243.187","TCP","1514","443  >  54993 [ACK] Seq=187585 Ack=1244 Win=3853 Len=1448 TSval=1115367591 TSecr=931333928 [TCP PDU reassembled in 2751]"
"2751","3.821959","23.13.164.38","100.86.243.187","TLSv1.2","1514","Application Data, Application Data"
"2752","3.821963","23.13.164.38","100.86.243.187","TCP","1514","443  >  54993 [PSH, ACK] Seq=190481 Ack=1244 Win=3853 Len=1448 TSval=1115367591 TSecr=931333928 [TCP PDU reassembled in 2764]"
"2753","3.821963","23.13.164.38","100.86.243.187","TCP","1514","443  >  54993 [ACK] Seq=191929 Ack=1244 Win=3853 Len=1448 TSval=1115367592 TSecr=931333928 [TCP PDU reassembled in 2764]"
"2754","3.821964","23.13.164.38","100.86.243.187","TCP","1514","443  >  54993 [ACK] Seq=193377 Ack=1244 Win=3853 Len=1448 TSval=1115367592 TSecr=931333928 [TCP PDU reassembled in 2764]"
"2755","3.821964","23.13.164.38","100.86.243.187","TCP","1514","443  >  54993 [ACK] Seq=194825 Ack=1244 Win=3853 Len=1448 TSval=1115367592 TSecr=931333928 [TCP PDU reassembled in 2764]"
"2756","3.821965","23.13.164.38","100.86.243.187","TCP","1514","443  >  54993 [ACK] Seq=196273 Ack=1244 Win=3853 Len=1448 TSval=1115367592 TSecr=931333928 [TCP PDU reassembled in 2764]"
"2757","3.821966","23.13.164.38","100.86.243.187","TCP","1514","443  >  54993 [ACK] Seq=197721 Ack=1244 Win=3853 Len=1448 TSval=1115367592 TSecr=931333928 [TCP PDU reassembled in 2764]"
"2758","3.821966","23.13.164.38","100.86.243.187","TCP","1514","443  >  54993 [ACK] Seq=199169 Ack=1244 Win=3853 Len=1448 TSval=1115367592 TSecr=931333928 [TCP PDU reassembled in 2764]"
"2759","3.821967","23.13.164.38","100.86.243.187","TCP","1514","443  >  54993 [ACK] Seq=200617 Ack=1244 Win=3853 Len=1448 TSval=1115367592 TSecr=931333928 [TCP PDU reassembled in 2764]"
"2760","3.822040","100.86.243.187","23.13.164.38","TCP","78","[TCP Dup ACK 2742#4] 54993  >  443 [ACK] Seq=1244 Ack=149937 Win=37456 Len=0 TSval=931333952 TSecr=1115367588 SLE=151385 SRE=197721"
"2761","3.822065","100.86.243.187","23.13.164.38","TCP","78","[TCP Dup ACK 2742#5] 54993  >  443 [ACK] Seq=1244 Ack=149937 Win=37456 Len=0 TSval=931333952 TSecr=1115367588 SLE=151385 SRE=202065"
"2762","3.822784","23.13.164.38","100.86.243.187","TCP","1514","443  >  54993 [ACK] Seq=202065 Ack=1244 Win=3853 Len=1448 TSval=1115367592 TSecr=931333928 [TCP PDU reassembled in 2764]"
"2763","3.822785","23.13.164.38","100.86.243.187","TCP","1514","443  >  54993 [PSH, ACK] Seq=203513 Ack=1244 Win=3853 Len=1448 TSval=1115367592 TSecr=931333928 [TCP PDU reassembled in 2764]"
"2764","3.822785","23.13.164.38","100.86.243.187","TLSv1.2","1514","Application Data, Application Data"
"2765","3.822787","23.13.164.38","100.86.243.187","TCP","1514","443  >  54993 [ACK] Seq=206409 Ack=1244 Win=3853 Len=1448 TSval=1115367592 TSecr=931333928 [TCP PDU reassembled in 2777]"
"2766","3.822856","23.13.164.38","100.86.243.187","TCP","1514","443  >  54993 [ACK] Seq=207857 Ack=1244 Win=3853 Len=1448 TSval=1115367592 TSecr=931333928 [TCP PDU reassembled in 2777]"
"2767","3.822857","23.13.164.38","100.86.243.187","TCP","1514","443  >  54993 [ACK] Seq=209305 Ack=1244 Win=3853 Len=1448 TSval=1115367592 TSecr=931333928 [TCP PDU reassembled in 2777]"
"2768","3.822893","100.86.243.187","23.13.164.38","TCP","78","[TCP Dup ACK 2742#6] 54993  >  443 [ACK] Seq=1244 Ack=149937 Win=37456 Len=0 TSval=931333952 TSecr=1115367588 SLE=151385 SRE=207857"
"2769","3.822928","100.86.243.187","23.13.164.38","TCP","78","[TCP Dup ACK 2742#7] 54993  >  443 [ACK] Seq=1244 Ack=149937 Win=37456 Len=0 TSval=931333952 TSecr=1115367588 SLE=151385 SRE=210753"
"2770","3.824324","23.13.164.38","100.86.243.187","TCP","1514","443  >  54993 [ACK] Seq=210753 Ack=1244 Win=3853 Len=1448 TSval=1115367592 TSecr=931333928 [TCP PDU reassembled in 2777]"
"2771","3.824325","23.13.164.38","100.86.243.187","TCP","1514","443  >  54993 [ACK] Seq=212201 Ack=1244 Win=3853 Len=1448 TSval=1115367592 TSecr=931333928 [TCP PDU reassembled in 2777]"
"2772","3.824326","23.13.164.38","100.86.243.187","TCP","1514","443  >  54993 [ACK] Seq=213649 Ack=1244 Win=3853 Len=1448 TSval=1115367592 TSecr=931333928 [TCP PDU reassembled in 2777]"
"2773","3.824328","23.13.164.38","100.86.243.187","TCP","1514","443  >  54993 [ACK] Seq=215097 Ack=1244 Win=3853 Len=1448 TSval=1115367592 TSecr=931333928 [TCP PDU reassembled in 2777]"
"2774","3.824328","23.13.164.38","100.86.243.187","TCP","1514","443  >  54993 [PSH, ACK] Seq=216545 Ack=1244 Win=3853 Len=1448 TSval=1115367592 TSecr=931333928 [TCP PDU reassembled in 2777]"
"2775","3.824332","23.13.164.38","100.86.243.187","TCP","1514","443  >  54993 [ACK] Seq=217993 Ack=1244 Win=3853 Len=1448 TSval=1115367593 TSecr=931333928 [TCP PDU reassembled in 2777]"
"2776","3.824333","23.13.164.38","100.86.243.187","TCP","1514","443  >  54993 [ACK] Seq=219441 Ack=1244 Win=3853 Len=1448 TSval=1115367593 TSecr=931333928 [TCP PDU reassembled in 2777]"
"2777","3.824336","23.13.164.38","100.86.243.187","TLSv1.2","1514","Application Data, Application Data"
"2778","3.824336","23.13.164.38","100.86.243.187","TCP","1514","[TCP Previous segment not captured] 443  >  54993 [ACK] Seq=223785 Ack=1244 Win=3853 Len=1448 TSval=1115367593 TSecr=931333928 [TCP PDU reassembled in 2798]"
"2779","3.824337","23.13.164.38","100.86.243.187","TCP","1514","443  >  54993 [ACK] Seq=225233 Ack=1244 Win=3853 Len=1448 TSval=1115367593 TSecr=931333928 [TCP PDU reassembled in 2798]"
"2780","3.824338","23.13.164.38","100.86.243.187","TCP","1514","443  >  54993 [ACK] Seq=226681 Ack=1244 Win=3853 Len=1448 TSval=1115367593 TSecr=931333928 [TCP PDU reassembled in 2798]"
"2781","3.824338","23.13.164.38","100.86.243.187","TCP","1514","443  >  54993 [ACK] Seq=228129 Ack=1244 Win=3853 Len=1448 TSval=1115367593 TSecr=931333928 [TCP PDU reassembled in 2798]"
"2782","3.824417","100.86.243.187","23.13.164.38","TCP","78","[TCP Dup ACK 2742#8] 54993  >  443 [ACK] Seq=1244 Ack=149937 Win=37456 Len=0 TSval=931333954 TSecr=1115367588 SLE=151385 SRE=222337"
"2783","3.824454","100.86.243.187","23.13.164.38","TCP","86","[TCP Dup ACK 2742#9] 54993  >  443 [ACK] Seq=1244 Ack=149937 Win=37456 Len=0 TSval=931333954 TSecr=1115367588 SLE=223785 SRE=229577 SLE=151385 SRE=222337"
"2784","3.826290","23.13.164.38","100.86.243.187","TCP","1514","443  >  54993 [PSH, ACK] Seq=229577 Ack=1244 Win=3853 Len=1448 TSval=1115367593 TSecr=931333928 [TCP PDU reassembled in 2798]"
"2785","3.826291","23.13.164.38","100.86.243.187","TCP","1514","443  >  54993 [ACK] Seq=231025 Ack=1244 Win=3853 Len=1448 TSval=1115367594 TSecr=931333928 [TCP PDU reassembled in 2798]"
"2786","3.826292","23.13.164.38","100.86.243.187","TCP","1514","443  >  54993 [ACK] Seq=232473 Ack=1244 Win=3853 Len=1448 TSval=1115367594 TSecr=931333928 [TCP PDU reassembled in 2798]"
"2787","3.826292","23.13.164.38","100.86.243.187","TCP","1514","443  >  54993 [ACK] Seq=233921 Ack=1244 Win=3853 Len=1448 TSval=1115367594 TSecr=931333928 [TCP PDU reassembled in 2798]"
"2788","3.826293","23.13.164.38","100.86.243.187","TCP","1514","443  >  54993 [ACK] Seq=235369 Ack=1244 Win=3853 Len=1448 TSval=1115367594 TSecr=931333928 [TCP PDU reassembled in 2798]"
"2789","3.826293","23.13.164.38","100.86.243.187","TCP","1514","443  >  54993 [ACK] Seq=236817 Ack=1244 Win=3853 Len=1448 TSval=1115367594 TSecr=931333928 [TCP PDU reassembled in 2798]"
"2790","3.826297","23.13.164.38","100.86.243.187","TCP","1514","443  >  54993 [ACK] Seq=238265 Ack=1244 Win=3853 Len=1448 TSval=1115367594 TSecr=931333928 [TCP PDU reassembled in 2798], Application Data"
"2791","3.826298","23.13.164.38","100.86.243.187","TCP","1514","443  >  54993 [ACK] Seq=239713 Ack=1244 Win=3853 Len=1448 TSval=1115367594 TSecr=931333928 [TCP PDU reassembled in 2793]"
"2792","3.826298","23.13.164.38","100.86.243.187","TCP","1514","443  >  54993 [ACK] Seq=241161 Ack=1244 Win=3853 Len=1448 TSval=1115367594 TSecr=931333928 [TCP PDU reassembled in 2793]"
"2793","3.826299","23.13.164.38","100.86.243.187","TLSv1.2","858","Application Data"
"2794","3.826378","100.86.243.187","23.13.164.38","TCP","86","[TCP Dup ACK 2742#10] 54993  >  443 [ACK] Seq=1244 Ack=149937 Win=37456 Len=0 TSval=931333956 TSecr=1115367588 SLE=223785 SRE=243401 SLE=151385 SRE=222337"
"2795","3.836124","23.13.164.38","100.86.243.187","TLSv1.2","1514","[TCP Fast Retransmission] , Application Data"
"2796","3.836198","100.86.243.187","23.13.164.38","TCP","78","54993  >  443 [ACK] Seq=1244 Ack=222337 Win=36324 Len=0 TSval=931333966 TSecr=1115367605 SLE=223785 SRE=243401"
"2797","3.836631","100.86.243.187","23.13.164.38","TCP","78","[TCP Dup ACK 2796#1] 54993  >  443 [ACK] Seq=1244 Ack=222337 Win=37456 Len=0 TSval=931333966 TSecr=1115367605 SLE=223785 SRE=243401"
"2798","3.847413","23.13.164.38","100.86.243.187","TCP","1514","[TCP Retransmission] 443  >  54993 [ACK] Seq=222337 Ack=1244 Win=3853 Len=1448 TSval=1115367615 TSecr=931333956"
"2799","3.847478","100.86.243.187","23.13.164.38","TCP","66","54993  >  443 [ACK] Seq=1244 Ack=243401 Win=37127 Len=0 TSval=931333978 TSecr=1115367615"
"2800","3.847636","100.86.243.187","23.13.164.38","TCP","66","[TCP Window Update] 54993  >  443 [ACK] Seq=1244 Ack=243401 Win=37456 Len=0 TSval=931333978 TSecr=1115367615"
