"No.","Time","Source","Destination","Protocol","Length","Info"
"1","0.000000","23.13.164.38","100.86.243.187","TLSv1.2","711","Application Data"
"2","0.000001","23.13.164.38","100.86.243.187","TLSv1.2","1062","Application Data"
"3","0.000077","100.86.243.187","23.13.164.38","TCP","66","54993  >  443 [ACK] Seq=1 Ack=1642 Win=37430 Len=0 TSval=931540654 TSecr=1115574301"
"4","0.007697","23.13.164.38","100.86.243.187","TCP","1514","443  >  54993 [ACK] Seq=1642 Ack=1 Win=9488 Len=1448 TSval=1115574310 TSecr=931540514 [TCP PDU reassembled in 17]"
"5","0.007698","23.13.164.38","100.86.243.187","TCP","1514","443  >  54993 [ACK] Seq=3090 Ack=1 Win=9488 Len=1448 TSval=1115574310 TSecr=931540514 [TCP PDU reassembled in 17]"
"6","0.007699","23.13.164.38","100.86.243.187","TCP","1514","443  >  54993 [ACK] Seq=4538 Ack=1 Win=9488 Len=1448 TSval=1115574310 TSecr=931540514 [TCP PDU reassembled in 17]"
"7","0.007770","100.86.243.187","23.13.164.38","TCP","66","54993  >  443 [ACK] Seq=1 Ack=5986 Win=37388 Len=0 TSval=931540662 TSecr=1115574310"
"8","0.007847","100.86.243.187","23.13.164.38","TCP","66","[TCP Window Update] 54993  >  443 [ACK] Seq=1 Ack=5986 Win=37456 Len=0 TSval=931540662 TSecr=1115574310"
"9","0.009388","23.13.164.38","100.86.243.187","TCP","1514","443  >  54993 [ACK] Seq=5986 Ack=1 Win=9488 Len=1448 TSval=1115574310 TSecr=931540514 [TCP PDU reassembled in 17]"
"10","0.009389","23.13.164.38","100.86.243.187","TCP","1514","443  >  54993 [ACK] Seq=7434 Ack=1 Win=9488 Len=1448 TSval=1115574310 TSecr=931540514 [TCP PDU reassembled in 17]"
"11","0.009390","23.13.164.38","100.86.243.187","TCP","1514","443  >  54993 [ACK] Seq=8882 Ack=1 Win=9488 Len=1448 TSval=1115574310 TSecr=931540514 [TCP PDU reassembled in 17]"
"12","0.009391","23.13.164.38","100.86.243.187","TCP","1514","443  >  54993 [ACK] Seq=10330 Ack=1 Win=9488 Len=1448 TSval=1115574310 TSecr=931540514 [TCP PDU reassembled in 17]"
"13","0.009392","23.13.164.38","100.86.243.187","TCP","1514","443  >  54993 [ACK] Seq=11778 Ack=1 Win=9488 Len=1448 TSval=1115574310 TSecr=931540514 [TCP PDU reassembled in 17]"
"14","0.009392","23.13.164.38","100.86.243.187","TCP","1514","443  >  54993 [ACK] Seq=13226 Ack=1 Win=9488 Len=1448 TSval=1115574310 TSecr=931540514 [TCP PDU reassembled in 17]"
"15","0.009393","23.13.164.38","100.86.243.187","TCP","1514","443  >  54993 [PSH, ACK] Seq=14674 Ack=1 Win=9488 Len=1448 TSval=1115574310 TSecr=931540514 [TCP PDU reassembled in 17]"
"16","0.009394","23.13.164.38","100.86.243.187","TCP","1514","443  >  54993 [ACK] Seq=16122 Ack=1 Win=9488 Len=1448 TSval=1115574310 TSecr=931540514 [TCP PDU reassembled in 17]"
"17","0.009395","23.13.164.38","100.86.243.187","TLSv1.2","544","Application Data"
"18","0.009395","23.13.164.38","100.86.243.187","TLSv1.2","1514","Application Data"
"19","0.009396","23.13.164.38","100.86.243.187","TCP","1514","443  >  54993 [ACK] Seq=19496 Ack=1 Win=9488 Len=1448 TSval=1115574310 TSecr=931540514 [TCP PDU reassembled in 314]"
"20","0.009396","23.13.164.38","100.86.243.187","TCP","1514","443  >  54993 [ACK] Seq=20944 Ack=1 Win=9488 Len=1448 TSval=1115574310 TSecr=931540514 [TCP PDU reassembled in 314]"
"21","0.009397","23.13.164.38","100.86.243.187","TCP","1514","443  >  54993 [ACK] Seq=22392 Ack=1 Win=9488 Len=1448 TSval=1115574310 TSecr=931540514 [TCP PDU reassembled in 314]"
"22","0.009398","23.13.164.38","100.86.243.187","TCP","1514","443  >  54993 [ACK] Seq=23840 Ack=1 Win=9488 Len=1448 TSval=1115574310 TSecr=931540514 [TCP PDU reassembled in 314]"
"23","0.009398","23.13.164.38","100.86.243.187","TCP","1514","443  >  54993 [ACK] Seq=25288 Ack=1 Win=9488 Len=1448 TSval=1115574310 TSecr=931540514 [TCP PDU reassembled in 314]"
"24","0.009399","23.13.164.38","100.86.243.187","TCP","1514","443  >  54993 [ACK] Seq=26736 Ack=1 Win=9488 Len=1448 TSval=1115574310 TSecr=931540514 [TCP PDU reassembled in 314]"
"25","0.009464","100.86.243.187","23.13.164.38","TCP","66","54993  >  443 [ACK] Seq=1 Ack=20944 Win=37222 Len=0 TSval=931540664 TSecr=1115574310"
"26","0.009500","100.86.243.187","23.13.164.38","TCP","66","54993  >  443 [ACK] Seq=1 Ack=28184 Win=37109 Len=0 TSval=931540664 TSecr=1115574310"
"27","0.009673","100.86.243.187","23.13.164.38","TCP","66","[TCP Window Update] 54993  >  443 [ACK] Seq=1 Ack=28184 Win=37456 Len=0 TSval=931540664 TSecr=1115574310"
"28","0.011626","23.13.164.38","100.86.243.187","TCP","1514","443  >  54993 [ACK] Seq=28184 Ack=1 Win=9488 Len=1448 TSval=1115574310 TSecr=931540514 [TCP PDU reassembled in 314]"
"29","0.011627","23.13.164.38","100.86.243.187","TCP","1514","[TCP Previous segment not captured] 443  >  54993 [PSH, ACK] Seq=31080 Ack=1 Win=9488 Len=1448 TSval=1115574310 TSecr=931540514 [TCP PDU reassembled in 314]"
"30","0.011628","23.13.164.38","100.86.243.187","TCP","1514","443  >  54993 [ACK] Seq=32528 Ack=1 Win=9488 Len=1448 TSval=1115574311 TSecr=931540514 [TCP PDU reassembled in 314]"
"31","0.011629","23.13.164.38","100.86.243.187","TCP","1514","443  >  54993 [ACK] Seq=33976 Ack=1 Win=9488 Len=1448 TSval=1115574311 TSecr=931540514 [TCP PDU reassembled in 314], Application Data"
"32","0.011630","23.13.164.38","100.86.243.187","TCP","1514","443  >  54993 [ACK] Seq=35424 Ack=1 Win=9488 Len=1448 TSval=1115574311 TSecr=931540514 [TCP PDU reassembled in 42]"
"33","0.011631","23.13.164.38","100.86.243.187","TCP","1514","443  >  54993 [ACK] Seq=36872 Ack=1 Win=9488 Len=1448 TSval=1115574311 TSecr=931540514 [TCP PDU reassembled in 42]"
"34","0.011631","23.13.164.38","100.86.243.187","TCP","1514","443  >  54993 [ACK] Seq=38320 Ack=1 Win=9488 Len=1448 TSval=1115574311 TSecr=931540514 [TCP PDU reassembled in 42]"
"35","0.011632","23.13.164.38","100.86.243.187","TCP","1514","443  >  54993 [ACK] Seq=39768 Ack=1 Win=9488 Len=1448 TSval=1115574311 TSecr=931540514 [TCP PDU reassembled in 42]"
"36","0.011633","23.13.164.38","100.86.243.187","TCP","1514","443  >  54993 [ACK] Seq=41216 Ack=1 Win=9488 Len=1448 TSval=1115574311 TSecr=931540514 [TCP PDU reassembled in 42]"
"37","0.011634","23.13.164.38","100.86.243.187","TCP","1514","443  >  54993 [ACK] Seq=42664 Ack=1 Win=9488 Len=1448 TSval=1115574311 TSecr=931540514 [TCP PDU reassembled in 42]"
"38","0.011634","23.13.164.38","100.86.243.187","TCP","1514","443  >  54993 [ACK] Seq=44112 Ack=1 Win=9488 Len=1448 TSval=1115574311 TSecr=931540514 [TCP PDU reassembled in 42]"
"39","0.011635","23.13.164.38","100.86.243.187","TCP","1514","443  >  54993 [PSH, ACK] Seq=45560 Ack=1 Win=9488 Len=1448 TSval=1115574311 TSecr=931540514 [TCP PDU reassembled in 42]"
"40","0.011636","23.13.164.38","100.86.243.187","TCP","1514","443  >  54993 [ACK] Seq=47008 Ack=1 Win=9488 Len=1448 TSval=1115574312 TSecr=931540514 [TCP PDU reassembled in 42]"
"41","0.011637","23.13.164.38","100.86.243.187","TCP","1514","443  >  54993 [ACK] Seq=48456 Ack=1 Win=9488 Len=1448 TSval=1115574312 TSecr=931540514 [TCP PDU reassembled in 42]"
"42","0.011637","23.13.164.38","100.86.243.187","TLSv1.2","1514","Application Data, Application Data"
"43","0.011639","23.13.164.38","100.86.243.187","TCP","1514","443  >  54993 [ACK] Seq=51352 Ack=1 Win=9488 Len=1448 TSval=1115574312 TSecr=931540514 [TCP PDU reassembled in 59]"
"44","0.011640","23.13.164.38","100.86.243.187","TCP","1514","443  >  54993 [ACK] Seq=52800 Ack=1 Win=9488 Len=1448 TSval=1115574312 TSecr=931540514 [TCP PDU reassembled in 59]"
"45","0.011641","23.13.164.38","100.86.243.187","TCP","1514","443  >  54993 [ACK] Seq=54248 Ack=1 Win=9488 Len=1448 TSval=1115574312 TSecr=931540514 [TCP PDU reassembled in 59]"
"46","0.011729","100.86.243.187","23.13.164.38","TCP","66","54993  >  443 [ACK] Seq=1 Ack=29632 Win=37433 Len=0 TSval=931540666 TSecr=1115574310"
"47","0.011833","100.86.243.187","23.13.164.38","TCP","78","[TCP Dup ACK 46#1] 54993  >  443 [ACK] Seq=1 Ack=29632 Win=37433 Len=0 TSval=931540666 TSecr=1115574310 SLE=31080 SRE=47008"
"48","0.011848","23.13.164.38","100.86.243.187","TCP","1514","443  >  54993 [ACK] Seq=55696 Ack=1 Win=9488 Len=1448 TSval=1115574312 TSecr=931540514 [TCP PDU reassembled in 59]"
"49","0.011849","23.13.164.38","100.86.243.187","TCP","1514","443  >  54993 [ACK] Seq=57144 Ack=1 Win=9488 Len=1448 TSval=1115574312 TSecr=931540514 [TCP PDU reassembled in 59]"
"50","0.011850","23.13.164.38","100.86.243.187","TCP","1514","443  >  54993 [ACK] Seq=58592 Ack=1 Win=9488 Len=1448 TSval=1115574312 TSecr=931540514 [TCP PDU reassembled in 59]"
"51","0.011851","23.13.164.38","100.86.243.187","TCP","1514","443  >  54993 [PSH, ACK] Seq=60040 Ack=1 Win=9488 Len=1448 TSval=1115574312 TSecr=931540514 [TCP PDU reassembled in 59]"
"52","0.011926","100.86.243.187","23.13.164.38","TCP","78","[TCP Dup ACK 46#2] 54993  >  443 [ACK] Seq=1 Ack=29632 Win=37456 Len=0 TSval=931540666 TSecr=1115574310 SLE=31080 SRE=55696"
"53","0.011962","100.86.243.187","23.13.164.38","TCP","78","[TCP Dup ACK 46#3] 54993  >  443 [ACK] Seq=1 Ack=29632 Win=37456 Len=0 TSval=931540666 TSecr=1115574310 SLE=31080 SRE=61488"
"54","0.012165","23.13.164.38","100.86.243.187","TCP","1514","443  >  54993 [ACK] Seq=61488 Ack=1 Win=9488 Len=1448 TSval=1115574313 TSecr=931540514 [TCP PDU reassembled in 59]"
"55","0.012166","23.13.164.38","100.86.243.187","TCP","1514","443  >  54993 [ACK] Seq=62936 Ack=1 Win=9488 Len=1448 TSval=1115574313 TSecr=931540514 [TCP PDU reassembled in 59]"
"56","0.012166","23.13.164.38","100.86.243.187","TCP","1514","443  >  54993 [ACK] Seq=64384 Ack=1 Win=9488 Len=1448 TSval=1115574313 TSecr=931540514 [TCP PDU reassembled in 59]"
"57","0.012167","23.13.164.38","100.86.243.187","TCP","1514","443  >  54993 [ACK] Seq=65832 Ack=1 Win=9488 Len=1448 TSval=1115574313 TSecr=931540514 [TCP PDU reassembled in 59]"
"58","0.012215","100.86.243.187","23.13.164.38","TCP","78","[TCP Dup ACK 46#4] 54993  >  443 [ACK] Seq=1 Ack=29632 Win=37456 Len=0 TSval=931540666 TSecr=1115574310 SLE=31080 SRE=67280"
"59","0.013613","23.13.164.38","100.86.243.187","TLSv1.2","1514","Application Data, Application Data"
"60","0.013614","23.13.164.38","100.86.243.187","TCP","1514","443  >  54993 [ACK] Seq=68728 Ack=1 Win=9488 Len=1448 TSval=1115574313 TSecr=931540514 [TCP PDU reassembled in 70]"
"61","0.013615","23.13.164.38","100.86.243.187","TCP","1514","443  >  54993 [ACK] Seq=70176 Ack=1 Win=9488 Len=1448 TSval=1115574313 TSecr=931540514 [TCP PDU reassembled in 70]"
"62","0.013616","23.13.164.38","100.86.243.187","TCP","1514","443  >  54993 [ACK] Seq=71624 Ack=1 Win=9488 Len=1448 TSval=1115574313 TSecr=931540514 [TCP PDU reassembled in 70]"
"63","0.013617","23.13.164.38","100.86.243.187","TCP","1514","443  >  54993 [ACK] Seq=73072 Ack=1 Win=9488 Len=1448 TSval=1115574313 TSecr=931540514 [TCP PDU reassembled in 70]"
"64","0.013617","23.13.164.38","100.86.243.187","TCP","1514","443  >  54993 [PSH, ACK] Seq=74520 Ack=1 Win=9488 Len=1448 TSval=1115574313 TSecr=931540514 [TCP PDU reassembled in 70]"
"65","0.013618","23.13.164.38","100.86.243.187","TCP","1514","443  >  54993 [ACK] Seq=75968 Ack=1 Win=9488 Len=1448 TSval=1115574314 TSecr=931540654 [TCP PDU reassembled in 70]"
"66","0.013618","23.13.164.38","100.86.243.187","TCP","1514","443  >  54993 [ACK] Seq=77416 Ack=1 Win=9488 Len=1448 TSval=1115574314 TSecr=931540654 [TCP PDU reassembled in 70]"
"67","0.013620","23.13.164.38","100.86.243.187","TCP","1514","443  >  54993 [ACK] Seq=78864 Ack=1 Win=9488 Len=1448 TSval=1115574314 TSecr=931540654 [TCP PDU reassembled in 70]"
"68","0.013621","23.13.164.38","100.86.243.187","TCP","1514","443  >  54993 [ACK] Seq=80312 Ack=1 Win=9488 Len=1448 TSval=1115574314 TSecr=931540654 [TCP PDU reassembled in 70]"
"69","0.013622","23.13.164.38","100.86.243.187","TCP","1514","443  >  54993 [ACK] Seq=81760 Ack=1 Win=9488 Len=1448 TSval=1115574314 TSecr=931540654 [TCP PDU reassembled in 70]"
"70","0.013623","23.13.164.38","100.86.243.187","TLSv1.2","1514","Application Data, Application Data"
"71","0.013623","23.13.164.38","100.86.243.187","TCP","1514","443  >  54993 [ACK] Seq=84656 Ack=1 Win=9488 Len=1448 TSval=1115574314 TSecr=931540654 [TCP PDU reassembled in 85]"
"72","0.013624","23.13.164.38","100.86.243.187","TCP","1514","443  >  54993 [ACK] Seq=86104 Ack=1 Win=9488 Len=1448 TSval=1115574314 TSecr=931540654 [TCP PDU reassembled in 85]"
"73","0.013658","23.13.164.38","100.86.243.187","TCP","1514","443  >  54993 [ACK] Seq=87552 Ack=1 Win=9488 Len=1448 TSval=1115574314 TSecr=931540654 [TCP PDU reassembled in 85]"
"74","0.013659","23.13.164.38","100.86.243.187","TCP","1514","443  >  54993 [PSH, ACK] Seq=89000 Ack=1 Win=9488 Len=1448 TSval=1115574314 TSecr=931540654 [TCP PDU reassembled in 85]"
"75","0.013707","100.86.243.187","23.13.164.38","TCP","78","[TCP Dup ACK 46#5] 54993  >  443 [ACK] Seq=1 Ack=29632 Win=37456 Len=0 TSval=931540668 TSecr=1115574310 SLE=31080 SRE=83208"
"76","0.013726","100.86.243.187","23.13.164.38","TCP","78","[TCP Dup ACK 46#6] 54993  >  443 [ACK] Seq=1 Ack=29632 Win=37456 Len=0 TSval=931540668 TSecr=1115574310 SLE=31080 SRE=87552"
"77","0.013737","100.86.243.187","23.13.164.38","TCP","78","[TCP Dup ACK 46#7] 54993  >  443 [ACK] Seq=1 Ack=29632 Win=37456 Len=0 TSval=931540668 TSecr=1115574310 SLE=31080 SRE=90448"
"78","0.013975","23.13.164.38","100.86.243.187","TCP","1514","443  >  54993 [ACK] Seq=90448 Ack=1 Win=9488 Len=1448 TSval=1115574315 TSecr=931540654 [TCP PDU reassembled in 85]"
"79","0.013976","23.13.164.38","100.86.243.187","TCP","1514","443  >  54993 [ACK] Seq=91896 Ack=1 Win=9488 Len=1448 TSval=1115574315 TSecr=931540654 [TCP PDU reassembled in 85]"
"80","0.013977","23.13.164.38","100.86.243.187","TCP","1514","443  >  54993 [ACK] Seq=93344 Ack=1 Win=9488 Len=1448 TSval=1115574315 TSecr=931540654 [TCP PDU reassembled in 85]"
"81","0.013978","23.13.164.38","100.86.243.187","TCP","1514","443  >  54993 [ACK] Seq=94792 Ack=1 Win=9488 Len=1448 TSval=1115574315 TSecr=931540654 [TCP PDU reassembled in 85]"
"82","0.014023","100.86.243.187","23.13.164.38","TCP","78","[TCP Dup ACK 46#8] 54993  >  443 [ACK] Seq=1 Ack=29632 Win=37456 Len=0 TSval=931540668 TSecr=1115574310 SLE=31080 SRE=96240"
"83","0.014321","23.13.164.38","100.86.243.187","TCP","1514","443  >  54993 [ACK] Seq=96240 Ack=1 Win=9488 Len=1448 TSval=1115574315 TSecr=931540654 [TCP PDU reassembled in 85]"
"84","0.014322","23.13.164.38","100.86.243.187","TCP","1514","443  >  54993 [ACK] Seq=97688 Ack=1 Win=9488 Len=1448 TSval=1115574315 TSecr=931540654 [TCP PDU reassembled in 85]"
"85","0.014323","23.13.164.38","100.86.243.187","TLSv1.2","1514","Application Data, Application Data"
"86","0.014323","23.13.164.38","100.86.243.187","TCP","1514","443  >  54993 [ACK] Seq=100584 Ack=1 Win=9488 Len=1448 TSval=1115574315 TSecr=931540654 [TCP PDU reassembled in 98]"
"87","0.014363","100.86.243.187","23.13.164.38","TCP","78","[TCP Dup ACK 46#9] 54993  >  443 [ACK] Seq=1 Ack=29632 Win=37456 Len=0 TSval=931540668 TSecr=1115574310 SLE=31080 SRE=102032"
"88","0.016052","23.13.164.38","100.86.243.187","TCP","1514","443  >  54993 [ACK] Seq=102032 Ack=1 Win=9488 Len=1448 TSval=1115574315 TSecr=931540654 [TCP PDU reassembled in 98]"
"89","0.016053","23.13.164.38","100.86.243.187","TCP","1514","443  >  54993 [ACK] Seq=103480 Ack=1 Win=9488 Len=1448 TSval=1115574315 TSecr=931540654 [TCP PDU reassembled in 98]"
"90","0.016054","23.13.164.38","100.86.243.187","TCP","1514","443  >  54993 [ACK] Seq=104928 Ack=1 Win=9488 Len=1448 TSval=1115574315 TSecr=931540654 [TCP PDU reassembled in 98]"
"91","0.016054","23.13.164.38","100.86.243.187","TCP","1514","443  >  54993 [ACK] Seq=106376 Ack=1 Win=9488 Len=1448 TSval=1115574315 TSecr=931540654 [TCP PDU reassembled in 98]"
"92","0.016055","23.13.164.38","100.86.243.187","TCP","1514","443  >  54993 [PSH, ACK] Seq=107824 Ack=1 Win=9488 Len=1448 TSval=1115574315 TSecr=931540654 [TCP PDU reassembled in 98]"
"93","0.016056","23.13.164.38","100.86.243.187","TCP","1514","443  >  54993 [ACK] Seq=109272 Ack=1 Win=9488 Len=1448 TSval=1115574316 TSecr=931540654 [TCP PDU reassembled in 98]"
"94","0.016056","23.13.164.38","100.86.243.187","TCP","1514","443  >  54993 [ACK] Seq=110720 Ack=1 Win=9488 Len=1448 TSval=1115574316 TSecr=931540654 [TCP PDU reassembled in 98]"
"95","0.016057","23.13.164.38","100.86.243.187","TCP","1514","443  >  54993 [ACK] Seq=112168 Ack=1 Win=9488 Len=1448 TSval=1115574316 TSecr=931540654 [TCP PDU reassembled in 98]"
"96","0.016058","23.13.164.38","100.86.243.187","TCP","1514","443  >  54993 [ACK] Seq=113616 Ack=1 Win=9488 Len=1448 TSval=1115574316 TSecr=931540654 [TCP PDU reassembled in 98]"
"97","0.016058","23.13.164.38","100.86.243.187","TCP","1514","443  >  54993 [ACK] Seq=115064 Ack=1 Win=9488 Len=1448 TSval=1115574316 TSecr=931540654 [TCP PDU reassembled in 98]"
"98","0.016093","23.13.164.38","100.86.243.187","TLSv1.2","1514","Application Data, Application Data"
"99","0.016094","23.13.164.38","100.86.243.187","TCP","1514","443  >  54993 [ACK] Seq=117960 Ack=1 Win=9488 Len=1448 TSval=1115574316 TSecr=931540654 [TCP PDU reassembled in 114]"
"100","0.016094","23.13.164.38","100.86.243.187","TCP","1514","443  >  54993 [ACK] Seq=119408 Ack=1 Win=9488 Len=1448 TSval=1115574316 TSecr=931540654 [TCP PDU reassembled in 114]"
"101","0.016095","23.13.164.38","100.86.243.187","TCP","1514","443  >  54993 [ACK] Seq=120856 Ack=1 Win=9488 Len=1448 TSval=1115574316 TSecr=931540654 [TCP PDU reassembled in 114]"
"102","0.016150","100.86.243.187","23.13.164.38","TCP","78","[TCP Dup ACK 46#10] 54993  >  443 [ACK] Seq=1 Ack=29632 Win=37456 Len=0 TSval=931540671 TSecr=1115574310 SLE=31080 SRE=116512"
"103","0.016180","100.86.243.187","23.13.164.38","TCP","78","[TCP Dup ACK 46#11] 54993  >  443 [ACK] Seq=1 Ack=29632 Win=37456 Len=0 TSval=931540671 TSecr=1115574310 SLE=31080 SRE=122304"
"104","0.016311","23.13.164.38","100.86.243.187","TCP","1514","443  >  54993 [ACK] Seq=122304 Ack=1 Win=9488 Len=1448 TSval=1115574316 TSecr=931540654 [TCP PDU reassembled in 114]"
"105","0.016312","23.13.164.38","100.86.243.187","TCP","1514","443  >  54993 [ACK] Seq=123752 Ack=1 Win=9488 Len=1448 TSval=1115574316 TSecr=931540654 [TCP PDU reassembled in 114]"
"106","0.016373","100.86.243.187","23.13.164.38","TCP","78","[TCP Dup ACK 46#12] 54993  >  443 [ACK] Seq=1 Ack=29632 Win=37456 Len=0 TSval=931540671 TSecr=1115574310 SLE=31080 SRE=125200"
"107","0.016415","23.13.164.38","100.86.243.187","TCP","1514","443  >  54993 [PSH, ACK] Seq=125200 Ack=1 Win=9488 Len=1448 TSval=1115574316 TSecr=931540654 [TCP PDU reassembled in 114]"
"108","0.016416","23.13.164.38","100.86.243.187","TCP","1514","443  >  54993 [ACK] Seq=126648 Ack=1 Win=9488 Len=1448 TSval=1115574317 TSecr=931540654 [TCP PDU reassembled in 114]"
"109","0.016453","100.86.243.187","23.13.164.38","TCP","78","[TCP Dup ACK 46#13] 54993  >  443 [ACK] Seq=1 Ack=29632 Win=37456 Len=0 TSval=931540671 TSecr=1115574310 SLE=31080 SRE=128096"
"110","0.016677","23.13.164.38","100.86.243.187","TCP","1514","443  >  54993 [ACK] Seq=128096 Ack=1 Win=9488 Len=1448 TSval=1115574317 TSecr=931540654 [TCP PDU reassembled in 114]"
"111","0.016678","23.13.164.38","100.86.243.187","TCP","1514","443  >  54993 [ACK] Seq=129544 Ack=1 Win=9488 Len=1448 TSval=1115574317 TSecr=931540654 [TCP PDU reassembled in 114]"
"112","0.016740","100.86.243.187","23.13.164.38","TCP","78","[TCP Dup ACK 46#14] 54993  >  443 [ACK] Seq=1 Ack=29632 Win=37456 Len=0 TSval=931540671 TSecr=1115574310 SLE=31080 SRE=130992"
"113","0.017167","23.13.164.38","100.86.243.187","TCP","1514","443  >  54993 [ACK] Seq=130992 Ack=1 Win=9488 Len=1448 TSval=1115574317 TSecr=931540654 [TCP PDU reassembled in 114]"
"114","0.017168","23.13.164.38","100.86.243.187","TLSv1.2","1514","Application Data, Application Data"
"115","0.017169","23.13.164.38","100.86.243.187","TCP","1514","443  >  54993 [ACK] Seq=133888 Ack=1 Win=9488 Len=1448 TSval=1115574317 TSecr=931540654 [TCP PDU reassembled in 126]"
"116","0.017170","23.13.164.38","100.86.243.187","TCP","1514","443  >  54993 [ACK] Seq=135336 Ack=1 Win=9488 Len=1448 TSval=1115574317 TSecr=931540654 [TCP PDU reassembled in 126]"
"117","0.017239","100.86.243.187","23.13.164.38","TCP","78","[TCP Dup ACK 46#15] 54993  >  443 [ACK] Seq=1 Ack=29632 Win=37456 Len=0 TSval=931540672 TSecr=1115574310 SLE=31080 SRE=136784"
"118","0.018521","23.13.164.38","100.86.243.187","TCP","1514","443  >  54993 [ACK] Seq=136784 Ack=1 Win=9488 Len=1448 TSval=1115574317 TSecr=931540654 [TCP PDU reassembled in 126]"
"119","0.018522","23.13.164.38","100.86.243.187","TCP","1514","443  >  54993 [ACK] Seq=138232 Ack=1 Win=9488 Len=1448 TSval=1115574317 TSecr=931540654 [TCP PDU reassembled in 126]"
"120","0.018523","23.13.164.38","100.86.243.187","TCP","1514","443  >  54993 [ACK] Seq=139680 Ack=1 Win=9488 Len=1448 TSval=1115574317 TSecr=931540654 [TCP PDU reassembled in 126]"
"121","0.018524","23.13.164.38","100.86.243.187","TCP","1514","443  >  54993 [ACK] Seq=141128 Ack=1 Win=9488 Len=1448 TSval=1115574317 TSecr=931540654 [TCP PDU reassembled in 126]"
"122","0.018524","23.13.164.38","100.86.243.187","TCP","1514","443  >  54993 [ACK] Seq=142576 Ack=1 Win=9488 Len=1448 TSval=1115574317 TSecr=931540654 [TCP PDU reassembled in 126]"
"123","0.018525","23.13.164.38","100.86.243.187","TCP","1514","443  >  54993 [PSH, ACK] Seq=144024 Ack=1 Win=9488 Len=1448 TSval=1115574317 TSecr=931540654 [TCP PDU reassembled in 126]"
"124","0.018525","23.13.164.38","100.86.243.187","TCP","1514","443  >  54993 [ACK] Seq=145472 Ack=1 Win=9488 Len=1448 TSval=1115574318 TSecr=931540654 [TCP PDU reassembled in 126]"
"125","0.018526","23.13.164.38","100.86.243.187","TCP","1514","443  >  54993 [ACK] Seq=146920 Ack=1 Win=9488 Len=1448 TSval=1115574318 TSecr=931540654 [TCP PDU reassembled in 126]"
"126","0.018527","23.13.164.38","100.86.243.187","TLSv1.2","1514","Application Data, Application Data"
"127","0.018528","23.13.164.38","100.86.243.187","TCP","1514","443  >  54993 [ACK] Seq=149816 Ack=1 Win=9488 Len=1448 TSval=1115574318 TSecr=931540654 [TCP PDU reassembled in 318]"
"128","0.018601","100.86.243.187","23.13.164.38","TCP","78","[TCP Dup ACK 46#16] 54993  >  443 [ACK] Seq=1 Ack=29632 Win=37456 Len=0 TSval=931540673 TSecr=1115574310 SLE=31080 SRE=151264"
"129","0.019510","23.13.164.38","100.86.243.187","TCP","1514","[TCP Previous segment not captured] 443  >  54993 [ACK] Seq=152712 Ack=1 Win=9488 Len=1448 TSval=1115574318 TSecr=931540654 [TCP PDU reassembled in 318]"
"130","0.019511","23.13.164.38","100.86.243.187","TCP","1514","443  >  54993 [ACK] Seq=154160 Ack=1 Win=9488 Len=1448 TSval=1115574318 TSecr=931540654 [TCP PDU reassembled in 318]"
"131","0.019512","23.13.164.38","100.86.243.187","TCP","1514","443  >  54993 [ACK] Seq=155608 Ack=1 Win=9488 Len=1448 TSval=1115574318 TSecr=931540654 [TCP PDU reassembled in 318]"
"132","0.019513","23.13.164.38","100.86.243.187","TCP","1514","443  >  54993 [ACK] Seq=157056 Ack=1 Win=9488 Len=1448 TSval=1115574318 TSecr=931540654 [TCP PDU reassembled in 318]"
"133","0.019513","23.13.164.38","100.86.243.187","TCP","1514","443  >  54993 [ACK] Seq=158504 Ack=1 Win=9488 Len=1448 TSval=1115574318 TSecr=931540654 [TCP PDU reassembled in 318]"
"134","0.019514","23.13.164.38","100.86.243.187","TCP","1514","443  >  54993 [ACK] Seq=159952 Ack=1 Win=9488 Len=1448 TSval=1115574318 TSecr=931540654 [TCP PDU reassembled in 318]"
"135","0.019514","23.13.164.38","100.86.243.187","TCP","1514","443  >  54993 [ACK] Seq=161400 Ack=1 Win=9488 Len=1448 TSval=1115574318 TSecr=931540654 [TCP PDU reassembled in 318]"
"136","0.019515","23.13.164.38","100.86.243.187","TCP","1514","443  >  54993 [PSH, ACK] Seq=162848 Ack=1 Win=9488 Len=1448 TSval=1115574318 TSecr=931540654 [TCP PDU reassembled in 318]"
"137","0.019516","23.13.164.38","100.86.243.187","TCP","1514","443  >  54993 [ACK] Seq=164296 Ack=1 Win=9488 Len=1448 TSval=1115574318 TSecr=931540654 [TCP PDU reassembled in 318]"
"138","0.019516","23.13.164.38","100.86.243.187","TCP","1514","443  >  54993 [ACK] Seq=165744 Ack=1 Win=9488 Len=1448 TSval=1115574318 TSecr=931540654 [TCP PDU reassembled in 318], Application Data"
"139","0.019517","23.13.164.38","100.86.243.187","TCP","1514","443  >  54993 [ACK] Seq=167192 Ack=1 Win=9488 Len=1448 TSval=1115574318 TSecr=931540654 [TCP PDU reassembled in 149]"
"140","0.019518","23.13.164.38","100.86.243.187","TCP","1514","443  >  54993 [ACK] Seq=168640 Ack=1 Win=9488 Len=1448 TSval=1115574318 TSecr=931540654 [TCP PDU reassembled in 149]"
"141","0.019518","23.13.164.38","100.86.243.187","TCP","1514","443  >  54993 [ACK] Seq=170088 Ack=1 Win=9488 Len=1448 TSval=1115574318 TSecr=931540654 [TCP PDU reassembled in 149]"
"142","0.019519","23.13.164.38","100.86.243.187","TCP","1514","443  >  54993 [ACK] Seq=171536 Ack=1 Win=9488 Len=1448 TSval=1115574318 TSecr=931540654 [TCP PDU reassembled in 149]"
"143","0.019520","23.13.164.38","100.86.243.187","TCP","1514","443  >  54993 [ACK] Seq=172984 Ack=1 Win=9488 Len=1448 TSval=1115574318 TSecr=931540654 [TCP PDU reassembled in 149]"
"144","0.019520","23.13.164.38","100.86.243.187","TCP","1514","443  >  54993 [ACK] Seq=174432 Ack=1 Win=9488 Len=1448 TSval=1115574318 TSecr=931540654 [TCP PDU reassembled in 149]"
"145","0.019521","23.13.164.38","100.86.243.187","TCP","1514","443  >  54993 [ACK] Seq=175880 Ack=1 Win=9488 Len=1448 TSval=1115574318 TSecr=931540654 [TCP PDU reassembled in 149]"
"146","0.019521","23.13.164.38","100.86.243.187","TCP","1514","443  >  54993 [ACK] Seq=177328 Ack=1 Win=9488 Len=1448 TSval=1115574318 TSecr=931540654 [TCP PDU reassembled in 149]"
"147","0.019522","23.13.164.38","100.86.243.187","TCP","1514","443  >  54993 [ACK] Seq=178776 Ack=1 Win=9488 Len=1448 TSval=1115574318 TSecr=931540654 [TCP PDU reassembled in 149]"
"148","0.019523","23.13.164.38","100.86.243.187","TCP","1514","443  >  54993 [ACK] Seq=180224 Ack=1 Win=9488 Len=1448 TSval=1115574318 TSecr=931540654 [TCP PDU reassembled in 149]"
"149","0.019523","23.13.164.38","100.86.243.187","TLSv1.2","1514","Application Data, Application Data"
"150","0.019524","23.13.164.38","100.86.243.187","TCP","1514","443  >  54993 [ACK] Seq=183120 Ack=1 Win=9488 Len=1448 TSval=1115574319 TSecr=931540654 [TCP PDU reassembled in 164]"
"151","0.019609","100.86.243.187","23.13.164.38","TCP","86","[TCP Dup ACK 46#17] 54993  >  443 [ACK] Seq=1 Ack=29632 Win=37456 Len=0 TSval=931540674 TSecr=1115574310 SLE=152712 SRE=168640 SLE=31080 SRE=151264"
"152","0.019637","100.86.243.187","23.13.164.38","TCP","86","[TCP Dup ACK 46#18] 54993  >  443 [ACK] Seq=1 Ack=29632 Win=37456 Len=0 TSval=931540674 TSecr=1115574310 SLE=152712 SRE=184568 SLE=31080 SRE=151264"
"153","0.021104","23.13.164.38","100.86.243.187","TCP","1514","443  >  54993 [ACK] Seq=184568 Ack=1 Win=9488 Len=1448 TSval=1115574319 TSecr=931540654 [TCP PDU reassembled in 164]"
"154","0.021105","23.13.164.38","100.86.243.187","TCP","1514","443  >  54993 [ACK] Seq=186016 Ack=1 Win=9488 Len=1448 TSval=1115574319 TSecr=931540654 [TCP PDU reassembled in 164]"
"155","0.021106","23.13.164.38","100.86.243.187","TCP","1514","443  >  54993 [ACK] Seq=187464 Ack=1 Win=9488 Len=1448 TSval=1115574319 TSecr=931540654 [TCP PDU reassembled in 164]"
"156","0.021107","23.13.164.38","100.86.243.187","TCP","1514","443  >  54993 [ACK] Seq=188912 Ack=1 Win=9488 Len=1448 TSval=1115574319 TSecr=931540654 [TCP PDU reassembled in 164]"
"157","0.021108","23.13.164.38","100.86.243.187","TCP","1514","443  >  54993 [PSH, ACK] Seq=190360 Ack=1 Win=9488 Len=1448 TSval=1115574319 TSecr=931540654 [TCP PDU reassembled in 164]"
"158","0.021108","23.13.164.38","100.86.243.187","TCP","1514","443  >  54993 [ACK] Seq=191808 Ack=1 Win=9488 Len=1448 TSval=1115574320 TSecr=931540654 [TCP PDU reassembled in 164]"
"159","0.021184","100.86.243.187","23.13.164.38","TCP","86","[TCP Dup ACK 46#19] 54993  >  443 [ACK] Seq=1 Ack=29632 Win=37456 Len=0 TSval=931540676 TSecr=1115574310 SLE=152712 SRE=193256 SLE=31080 SRE=151264"
"160","0.021291","23.13.164.38","100.86.243.187","TCP","1514","443  >  54993 [ACK] Seq=193256 Ack=1 Win=9488 Len=1448 TSval=1115574320 TSecr=931540654 [TCP PDU reassembled in 164]"
"161","0.021292","23.13.164.38","100.86.243.187","TCP","1514","443  >  54993 [ACK] Seq=194704 Ack=1 Win=9488 Len=1448 TSval=1115574320 TSecr=931540654 [TCP PDU reassembled in 164]"
"162","0.021321","100.86.243.187","23.13.164.38","TCP","86","[TCP Dup ACK 46#20] 54993  >  443 [ACK] Seq=1 Ack=29632 Win=37456 Len=0 TSval=931540676 TSecr=1115574310 SLE=152712 SRE=196152 SLE=31080 SRE=151264"
"163","0.021663","23.13.164.38","100.86.243.187","TCP","1514","443  >  54993 [ACK] Seq=196152 Ack=1 Win=9488 Len=1448 TSval=1115574320 TSecr=931540654 [TCP PDU reassembled in 164]"
"164","0.021664","23.13.164.38","100.86.243.187","TLSv1.2","1514","Application Data, Application Data"
"165","0.021665","23.13.164.38","100.86.243.187","TCP","1514","443  >  54993 [ACK] Seq=199048 Ack=1 Win=9488 Len=1448 TSval=1115574320 TSecr=931540654 [TCP PDU reassembled in 178]"
"166","0.021666","23.13.164.38","100.86.243.187","TCP","1514","443  >  54993 [ACK] Seq=200496 Ack=1 Win=9488 Len=1448 TSval=1115574320 TSecr=931540654 [TCP PDU reassembled in 178]"
"167","0.021667","23.13.164.38","100.86.243.187","TCP","1514","443  >  54993 [ACK] Seq=201944 Ack=1 Win=9488 Len=1448 TSval=1115574320 TSecr=931540654 [TCP PDU reassembled in 178]"
"168","0.021667","23.13.164.38","100.86.243.187","TCP","1514","443  >  54993 [ACK] Seq=203392 Ack=1 Win=9488 Len=1448 TSval=1115574320 TSecr=931540654 [TCP PDU reassembled in 178]"
"169","0.021742","100.86.243.187","23.13.164.38","TCP","86","[TCP Dup ACK 46#21] 54993  >  443 [ACK] Seq=1 Ack=29632 Win=37456 Len=0 TSval=931540676 TSecr=1115574310 SLE=152712 SRE=204840 SLE=31080 SRE=151264"
"170","0.021777","23.13.164.38","100.86.243.187","TCP","1514","443  >  54993 [ACK] Seq=204840 Ack=1 Win=9488 Len=1448 TSval=1115574320 TSecr=931540654 [TCP PDU reassembled in 178]"
"171","0.021778","23.13.164.38","100.86.243.187","TCP","1514","443  >  54993 [ACK] Seq=206288 Ack=1 Win=9488 Len=1448 TSval=1115574320 TSecr=931540654 [TCP PDU reassembled in 178]"
"172","0.021809","100.86.243.187","23.13.164.38","TCP","86","[TCP Dup ACK 46#22] 54993  >  443 [ACK] Seq=1 Ack=29632 Win=37456 Len=0 TSval=931540676 TSecr=1115574310 SLE=152712 SRE=207736 SLE=31080 SRE=151264"
"173","0.022184","23.13.164.38","100.86.243.187","TCP","1514","443  >  54993 [ACK] Seq=207736 Ack=1 Win=9488 Len=1448 TSval=1115574320 TSecr=931540654 [TCP PDU reassembled in 178]"
"174","0.022185","23.13.164.38","100.86.243.187","TCP","1514","443  >  54993 [PSH, ACK] Seq=209184 Ack=1 Win=9488 Len=1448 TSval=1115574320 TSecr=931540654 [TCP PDU reassembled in 178]"
"175","0.022185","23.13.164.38","100.86.243.187","TCP","1514","443  >  54993 [ACK] Seq=210632 Ack=1 Win=9488 Len=1448 TSval=1115574321 TSecr=931540654 [TCP PDU reassembled in 178]"
"176","0.022186","23.13.164.38","100.86.243.187","TCP","1514","443  >  54993 [ACK] Seq=212080 Ack=1 Win=9488 Len=1448 TSval=1115574321 TSecr=931540654 [TCP PDU reassembled in 178]"
"177","0.022214","23.13.164.38","100.86.243.187","TCP","1514","443  >  54993 [ACK] Seq=213528 Ack=1 Win=9488 Len=1448 TSval=1115574321 TSecr=931540654 [TCP PDU reassembled in 178]"
"178","0.022215","23.13.164.38","100.86.243.187","TLSv1.2","1514","Application Data, Application Data"
"179","0.022269","100.86.243.187","23.13.164.38","TCP","86","[TCP Dup ACK 46#23] 54993  >  443 [ACK] Seq=1 Ack=29632 Win=37456 Len=0 TSval=931540677 TSecr=1115574310 SLE=152712 SRE=213528 SLE=31080 SRE=151264"
"180","0.022294","100.86.243.187","23.13.164.38","TCP","86","[TCP Dup ACK 46#24] 54993  >  443 [ACK] Seq=1 Ack=29632 Win=37456 Len=0 TSval=931540677 TSecr=1115574310 SLE=152712 SRE=216424 SLE=31080 SRE=151264"
"181","0.022329","23.13.164.38","100.86.243.187","TCP","1514","443  >  54993 [ACK] Seq=216424 Ack=1 Win=9488 Len=1448 TSval=1115574321 TSecr=931540654 [TCP PDU reassembled in 194]"
"182","0.022330","23.13.164.38","100.86.243.187","TCP","1514","443  >  54993 [ACK] Seq=217872 Ack=1 Win=9488 Len=1448 TSval=1115574321 TSecr=931540654 [TCP PDU reassembled in 194]"
"183","0.022356","100.86.243.187","23.13.164.38","TCP","86","[TCP Dup ACK 46#25] 54993  >  443 [ACK] Seq=1 Ack=29632 Win=37456 Len=0 TSval=931540677 TSecr=1115574310 SLE=152712 SRE=219320 SLE=31080 SRE=151264"
"184","0.022492","23.13.164.38","100.86.243.187","TCP","1514","443  >  54993 [ACK] Seq=219320 Ack=1 Win=9488 Len=1448 TSval=1115574321 TSecr=931540654 [TCP PDU reassembled in 194]"
"185","0.022493","23.13.164.38","100.86.243.187","TCP","1514","443  >  54993 [ACK] Seq=220768 Ack=1 Win=9488 Len=1448 TSval=1115574321 TSecr=931540654 [TCP PDU reassembled in 194]"
"186","0.022541","100.86.243.187","23.13.164.38","TCP","86","[TCP Dup ACK 46#26] 54993  >  443 [ACK] Seq=1 Ack=29632 Win=37456 Len=0 TSval=931540677 TSecr=1115574310 SLE=152712 SRE=222216 SLE=31080 SRE=151264"
"187","0.022970","23.13.164.38","100.86.243.187","TCP","1514","443  >  54993 [ACK] Seq=222216 Ack=1 Win=9488 Len=1448 TSval=1115574321 TSecr=931540654 [TCP PDU reassembled in 194]"
"188","0.022971","23.13.164.38","100.86.243.187","TCP","1514","443  >  54993 [ACK] Seq=223664 Ack=1 Win=9488 Len=1448 TSval=1115574321 TSecr=931540654 [TCP PDU reassembled in 194]"
"189","0.022972","23.13.164.38","100.86.243.187","TCP","1514","443  >  54993 [ACK] Seq=225112 Ack=1 Win=9488 Len=1448 TSval=1115574321 TSecr=931540654 [TCP PDU reassembled in 194]"
"190","0.022973","23.13.164.38","100.86.243.187","TCP","1514","443  >  54993 [ACK] Seq=226560 Ack=1 Win=9488 Len=1448 TSval=1115574321 TSecr=931540654 [TCP PDU reassembled in 194]"
"191","0.022973","23.13.164.38","100.86.243.187","TCP","1514","443  >  54993 [PSH, ACK] Seq=228008 Ack=1 Win=9488 Len=1448 TSval=1115574321 TSecr=931540654 [TCP PDU reassembled in 194]"
"192","0.022974","23.13.164.38","100.86.243.187","TCP","1514","443  >  54993 [ACK] Seq=229456 Ack=1 Win=9488 Len=1448 TSval=1115574322 TSecr=931540654 [TCP PDU reassembled in 194]"
"193","0.023473","100.86.243.187","23.13.164.38","TCP","86","[TCP Dup ACK 46#27] 54993  >  443 [ACK] Seq=1 Ack=29632 Win=37456 Len=0 TSval=931540677 TSecr=1115574310 SLE=152712 SRE=230904 SLE=31080 SRE=151264"
"194","0.023497","23.13.164.38","100.86.243.187","TLSv1.2","1514","Application Data, Application Data"
"195","0.023498","23.13.164.38","100.86.243.187","TCP","1514","443  >  54993 [ACK] Seq=232352 Ack=1 Win=9488 Len=1448 TSval=1115574322 TSecr=931540654 [TCP PDU reassembled in 206]"
"196","0.023498","23.13.164.38","100.86.243.187","TCP","1514","443  >  54993 [ACK] Seq=233800 Ack=1 Win=9488 Len=1448 TSval=1115574322 TSecr=931540654 [TCP PDU reassembled in 206]"
"197","0.023499","23.13.164.38","100.86.243.187","TCP","1514","443  >  54993 [ACK] Seq=235248 Ack=1 Win=9488 Len=1448 TSval=1115574322 TSecr=931540654 [TCP PDU reassembled in 206]"
"198","0.023499","23.13.164.38","100.86.243.187","TCP","1514","443  >  54993 [ACK] Seq=236696 Ack=1 Win=9488 Len=1448 TSval=1115574322 TSecr=931540654 [TCP PDU reassembled in 206]"
"199","0.023500","23.13.164.38","100.86.243.187","TCP","1514","443  >  54993 [ACK] Seq=238144 Ack=1 Win=9488 Len=1448 TSval=1115574322 TSecr=931540654 [TCP PDU reassembled in 206]"
"200","0.023552","100.86.243.187","23.13.164.38","TCP","86","[TCP Dup ACK 46#28] 54993  >  443 [ACK] Seq=1 Ack=29632 Win=37456 Len=0 TSval=931540678 TSecr=1115574310 SLE=152712 SRE=239592 SLE=31080 SRE=151264"
"201","0.024837","23.13.164.38","100.86.243.187","TCP","1514","443  >  54993 [ACK] Seq=239592 Ack=1 Win=9488 Len=1448 TSval=1115574322 TSecr=931540654 [TCP PDU reassembled in 206]"
"202","0.024838","23.13.164.38","100.86.243.187","TCP","1514","443  >  54993 [ACK] Seq=241040 Ack=1 Win=9488 Len=1448 TSval=1115574322 TSecr=931540654 [TCP PDU reassembled in 206]"
"203","0.024839","23.13.164.38","100.86.243.187","TCP","1514","443  >  54993 [ACK] Seq=242488 Ack=1 Win=9488 Len=1448 TSval=1115574322 TSecr=931540654 [TCP PDU reassembled in 206]"
"204","0.024840","23.13.164.38","100.86.243.187","TCP","1514","443  >  54993 [ACK] Seq=243936 Ack=1 Win=9488 Len=1448 TSval=1115574322 TSecr=931540654 [TCP PDU reassembled in 206]"
"205","0.024840","23.13.164.38","100.86.243.187","TCP","1514","443  >  54993 [ACK] Seq=245384 Ack=1 Win=9488 Len=1448 TSval=1115574322 TSecr=931540654 [TCP PDU reassembled in 206]"
"206","0.024841","23.13.164.38","100.86.243.187","TLSv1.2","1514","Application Data, Application Data"
"207","0.024842","23.13.164.38","100.86.243.187","TCP","1514","443  >  54993 [ACK] Seq=248280 Ack=1 Win=9488 Len=1448 TSval=1115574323 TSecr=931540662 [TCP PDU reassembled in 321]"
"208","0.024842","23.13.164.38","100.86.243.187","TCP","1514","443  >  54993 [ACK] Seq=249728 Ack=1 Win=9488 Len=1448 TSval=1115574323 TSecr=931540662 [TCP PDU reassembled in 321]"
"209","0.024843","23.13.164.38","100.86.243.187","TCP","1514","[TCP Previous segment not captured] 443  >  54993 [ACK] Seq=252624 Ack=1 Win=9488 Len=1448 TSval=1115574323 TSecr=931540662 [TCP PDU reassembled in 321]"
"210","0.024844","23.13.164.38","100.86.243.187","TCP","1514","443  >  54993 [ACK] Seq=254072 Ack=1 Win=9488 Len=1448 TSval=1115574323 TSecr=931540662 [TCP PDU reassembled in 321]"
"211","0.024844","23.13.164.38","100.86.243.187","TCP","1514","443  >  54993 [PSH, ACK] Seq=255520 Ack=1 Win=9488 Len=1448 TSval=1115574323 TSecr=931540662 [TCP PDU reassembled in 321]"
"212","0.024845","23.13.164.38","100.86.243.187","TCP","1514","443  >  54993 [ACK] Seq=256968 Ack=1 Win=9488 Len=1448 TSval=1115574323 TSecr=931540662 [TCP PDU reassembled in 321]"
"213","0.024921","100.86.243.187","23.13.164.38","TCP","86","[TCP Dup ACK 46#29] 54993  >  443 [ACK] Seq=1 Ack=29632 Win=37456 Len=0 TSval=931540679 TSecr=1115574310 SLE=152712 SRE=251176 SLE=31080 SRE=151264"
"214","0.024945","100.86.243.187","23.13.164.38","TCP","94","[TCP Dup ACK 46#30] 54993  >  443 [ACK] Seq=1 Ack=29632 Win=37456 Len=0 TSval=931540679 TSecr=1115574310 SLE=252624 SRE=258416 SLE=152712 SRE=251176 SLE=31080 SRE=151264"
"215","0.025118","23.13.164.38","100.86.243.187","TCP","1514","443  >  54993 [ACK] Seq=258416 Ack=1 Win=9488 Len=1448 TSval=1115574323 TSecr=931540662 [TCP PDU reassembled in 321]"
"216","0.025119","23.13.164.38","100.86.243.187","TCP","1514","443  >  54993 [ACK] Seq=259864 Ack=1 Win=9488 Len=1448 TSval=1115574323 TSecr=931540662 [TCP PDU reassembled in 321]"
"217","0.025120","23.13.164.38","100.86.243.187","TCP","1514","443  >  54993 [ACK] Seq=261312 Ack=1 Win=9488 Len=1448 TSval=1115574323 TSecr=931540662 [TCP PDU reassembled in 321]"
"218","0.025120","23.13.164.38","100.86.243.187","TCP","1514","443  >  54993 [ACK] Seq=262760 Ack=1 Win=9488 Len=1448 TSval=1115574323 TSecr=931540662 [TCP PDU reassembled in 321]"
"219","0.025167","100.86.243.187","23.13.164.38","TCP","94","[TCP Dup ACK 46#31] 54993  >  443 [ACK] Seq=1 Ack=29632 Win=37456 Len=0 TSval=931540679 TSecr=1115574310 SLE=252624 SRE=264208 SLE=152712 SRE=251176 SLE=31080 SRE=151264"
"220","0.025398","23.13.164.38","100.86.243.187","TCP","1514","443  >  54993 [ACK] Seq=264208 Ack=1 Win=9488 Len=1448 TSval=1115574323 TSecr=931540662 [TCP PDU reassembled in 321], Application Data"
"221","0.025399","23.13.164.38","100.86.243.187","TCP","1514","443  >  54993 [ACK] Seq=265656 Ack=1 Win=9488 Len=1448 TSval=1115574323 TSecr=931540662 [TCP PDU reassembled in 234]"
"222","0.025399","23.13.164.38","100.86.243.187","TCP","1514","443  >  54993 [ACK] Seq=267104 Ack=1 Win=9488 Len=1448 TSval=1115574323 TSecr=931540662 [TCP PDU reassembled in 234]"
"223","0.025400","23.13.164.38","100.86.243.187","TCP","1514","443  >  54993 [ACK] Seq=268552 Ack=1 Win=9488 Len=1448 TSval=1115574323 TSecr=931540662 [TCP PDU reassembled in 234]"
"224","0.025447","100.86.243.187","23.13.164.38","TCP","94","[TCP Dup ACK 46#32] 54993  >  443 [ACK] Seq=1 Ack=29632 Win=37456 Len=0 TSval=931540679 TSecr=1115574310 SLE=252624 SRE=270000 SLE=152712 SRE=251176 SLE=31080 SRE=151264"
"225","0.025560","23.13.164.38","100.86.243.187","TCP","1514","443  >  54993 [ACK] Seq=270000 Ack=1 Win=9488 Len=1448 TSval=1115574323 TSecr=931540662 [TCP PDU reassembled in 234]"
"226","0.025561","23.13.164.38","100.86.243.187","TCP","1514","443  >  54993 [ACK] Seq=271448 Ack=1 Win=9488 Len=1448 TSval=1115574323 TSecr=931540662 [TCP PDU reassembled in 234]"
"227","0.025607","100.86.243.187","23.13.164.38","TCP","94","[TCP Dup ACK 46#33] 54993  >  443 [ACK] Seq=1 Ack=29632 Win=37456 Len=0 TSval=931540679 TSecr=1115574310 SLE=252624 SRE=272896 SLE=152712 SRE=251176 SLE=31080 SRE=151264"
"228","0.025878","23.13.164.38","100.86.243.187","TCP","1514","443  >  54993 [ACK] Seq=272896 Ack=1 Win=9488 Len=1448 TSval=1115574323 TSecr=931540662 [TCP PDU reassembled in 234]"
"229","0.025879","23.13.164.38","100.86.243.187","TCP","1514","443  >  54993 [PSH, ACK] Seq=274344 Ack=1 Win=9488 Len=1448 TSval=1115574323 TSecr=931540662 [TCP PDU reassembled in 234]"
"230","0.025880","23.13.164.38","100.86.243.187","TCP","1514","443  >  54993 [ACK] Seq=275792 Ack=1 Win=9488 Len=1448 TSval=1115574324 TSecr=931540662 [TCP PDU reassembled in 234]"
"231","0.025881","23.13.164.38","100.86.243.187","TCP","1514","443  >  54993 [ACK] Seq=277240 Ack=1 Win=9488 Len=1448 TSval=1115574324 TSecr=931540662 [TCP PDU reassembled in 234]"
"232","0.025926","100.86.243.187","23.13.164.38","TCP","94","[TCP Dup ACK 46#34] 54993  >  443 [ACK] Seq=1 Ack=29632 Win=37456 Len=0 TSval=931540680 TSecr=1115574310 SLE=252624 SRE=278688 SLE=152712 SRE=251176 SLE=31080 SRE=151264"
"233","0.026038","23.13.164.38","100.86.243.187","TCP","1514","443  >  54993 [ACK] Seq=278688 Ack=1 Win=9488 Len=1448 TSval=1115574324 TSecr=931540662 [TCP PDU reassembled in 234]"
"234","0.026039","23.13.164.38","100.86.243.187","TLSv1.2","1514","Application Data, Application Data"
"235","0.026080","100.86.243.187","23.13.164.38","TCP","94","[TCP Dup ACK 46#35] 54993  >  443 [ACK] Seq=1 Ack=29632 Win=37456 Len=0 TSval=931540680 TSecr=1115574310 SLE=252624 SRE=281584 SLE=152712 SRE=251176 SLE=31080 SRE=151264"
"236","0.026278","23.13.164.38","100.86.243.187","TCP","1514","443  >  54993 [ACK] Seq=281584 Ack=1 Win=9488 Len=1448 TSval=1115574324 TSecr=931540662 [TCP PDU reassembled in 248]"
"237","0.026279","23.13.164.38","100.86.243.187","TCP","1514","443  >  54993 [ACK] Seq=283032 Ack=1 Win=9488 Len=1448 TSval=1115574324 TSecr=931540662 [TCP PDU reassembled in 248]"
"238","0.026280","23.13.164.38","100.86.243.187","TCP","1514","443  >  54993 [ACK] Seq=284480 Ack=1 Win=9488 Len=1448 TSval=1115574324 TSecr=931540662 [TCP PDU reassembled in 248]"
"239","0.026280","23.13.164.38","100.86.243.187","TCP","1514","443  >  54993 [ACK] Seq=285928 Ack=1 Win=9488 Len=1448 TSval=1115574324 TSecr=931540662 [TCP PDU reassembled in 248]"
"240","0.026326","100.86.243.187","23.13.164.38","TCP","94","[TCP Dup ACK 46#36] 54993  >  443 [ACK] Seq=1 Ack=29632 Win=37456 Len=0 TSval=931540680 TSecr=1115574310 SLE=252624 SRE=287376 SLE=152712 SRE=251176 SLE=31080 SRE=151264"
"241","0.026494","23.13.164.38","100.86.243.187","TCP","1514","443  >  54993 [ACK] Seq=287376 Ack=1 Win=9488 Len=1448 TSval=1115574324 TSecr=931540662 [TCP PDU reassembled in 248]"
"242","0.026494","23.13.164.38","100.86.243.187","TCP","1514","443  >  54993 [ACK] Seq=288824 Ack=1 Win=9488 Len=1448 TSval=1115574324 TSecr=931540662 [TCP PDU reassembled in 248]"
"243","0.026510","23.13.164.38","100.86.243.187","TCP","1514","443  >  54993 [ACK] Seq=290272 Ack=1 Win=9488 Len=1448 TSval=1115574324 TSecr=931540662 [TCP PDU reassembled in 248]"
"244","0.026511","23.13.164.38","100.86.243.187","TCP","1514","443  >  54993 [ACK] Seq=291720 Ack=1 Win=9488 Len=1448 TSval=1115574324 TSecr=931540662 [TCP PDU reassembled in 248]"
"245","0.026555","100.86.243.187","23.13.164.38","TCP","94","[TCP Dup ACK 46#37] 54993  >  443 [ACK] Seq=1 Ack=29632 Win=37456 Len=0 TSval=931540680 TSecr=1115574310 SLE=252624 SRE=290272 SLE=152712 SRE=251176 SLE=31080 SRE=151264"
"246","0.026834","23.13.164.38","100.86.243.187","TCP","1514","443  >  54993 [PSH, ACK] Seq=293168 Ack=1 Win=9488 Len=1448 TSval=1115574324 TSecr=931540662 [TCP PDU reassembled in 248]"
"247","0.026847","23.13.164.38","100.86.243.187","TCP","1514","443  >  54993 [ACK] Seq=294616 Ack=1 Win=9488 Len=1448 TSval=1115574325 TSecr=931540662 [TCP PDU reassembled in 248]"
"248","0.026848","23.13.164.38","100.86.243.187","TLSv1.2","1514","Application Data, Application Data"
"249","0.026848","23.13.164.38","100.86.243.187","TCP","1514","443  >  54993 [ACK] Seq=297512 Ack=1 Win=9488 Len=1448 TSval=1115574325 TSecr=931540662 [TCP PDU reassembled in 265]"
"250","0.026875","100.86.243.187","23.13.164.38","TCP","94","[TCP Dup ACK 46#38] 54993  >  443 [ACK] Seq=1 Ack=29632 Win=37456 Len=0 TSval=931540680 TSecr=1115574310 SLE=252624 SRE=294616 SLE=152712 SRE=251176 SLE=31080 SRE=151264"
"251","0.026900","100.86.243.187","23.13.164.38","TCP","94","[TCP Dup ACK 46#39] 54993  >  443 [ACK] Seq=1 Ack=29632 Win=37456 Len=0 TSval=931540680 TSecr=1115574310 SLE=252624 SRE=298960 SLE=152712 SRE=251176 SLE=31080 SRE=151264"
"252","0.027108","23.13.164.38","100.86.243.187","TCP","1514","443  >  54993 [ACK] Seq=298960 Ack=1 Win=9488 Len=1448 TSval=1115574325 TSecr=931540662 [TCP PDU reassembled in 265]"
"253","0.027109","23.13.164.38","100.86.243.187","TCP","1514","443  >  54993 [ACK] Seq=300408 Ack=1 Win=9488 Len=1448 TSval=1115574325 TSecr=931540662 [TCP PDU reassembled in 265]"
"254","0.027110","23.13.164.38","100.86.243.187","TCP","1514","443  >  54993 [ACK] Seq=301856 Ack=1 Win=9488 Len=1448 TSval=1115574325 TSecr=931540662 [TCP PDU reassembled in 265]"
"255","0.027110","23.13.164.38","100.86.243.187","TCP","1514","443  >  54993 [ACK] Seq=303304 Ack=1 Win=9488 Len=1448 TSval=1115574325 TSecr=931540662 [TCP PDU reassembled in 265]"
"256","0.027144","100.86.243.187","23.13.164.38","TCP","94","[TCP Dup ACK 46#40] 54993  >  443 [ACK] Seq=1 Ack=29632 Win=37456 Len=0 TSval=931540682 TSecr=1115574310 SLE=252624 SRE=304752 SLE=152712 SRE=251176 SLE=31080 SRE=151264"
"257","0.027416","23.13.164.38","100.86.243.187","TCP","1514","443  >  54993 [ACK] Seq=304752 Ack=1 Win=9488 Len=1448 TSval=1115574325 TSecr=931540662 [TCP PDU reassembled in 265]"
"258","0.027417","23.13.164.38","100.86.243.187","TCP","1514","443  >  54993 [ACK] Seq=306200 Ack=1 Win=9488 Len=1448 TSval=1115574325 TSecr=931540662 [TCP PDU reassembled in 265]"
"259","0.027417","23.13.164.38","100.86.243.187","TCP","1514","443  >  54993 [ACK] Seq=307648 Ack=1 Win=9488 Len=1448 TSval=1115574325 TSecr=931540662 [TCP PDU reassembled in 265]"
"260","0.027418","23.13.164.38","100.86.243.187","TCP","1514","443  >  54993 [ACK] Seq=309096 Ack=1 Win=9488 Len=1448 TSval=1115574325 TSecr=931540662 [TCP PDU reassembled in 265]"
"261","0.027443","100.86.243.187","23.13.164.38","TCP","94","[TCP Dup ACK 46#41] 54993  >  443 [ACK] Seq=1 Ack=29632 Win=37456 Len=0 TSval=931540682 TSecr=1115574310 SLE=252624 SRE=310544 SLE=152712 SRE=251176 SLE=31080 SRE=151264"
"262","0.027578","23.13.164.38","100.86.243.187","TCP","1514","443  >  54993 [ACK] Seq=310544 Ack=1 Win=9488 Len=1448 TSval=1115574325 TSecr=931540662 [TCP PDU reassembled in 265]"
"263","0.027578","23.13.164.38","100.86.243.187","TCP","1514","443  >  54993 [PSH, ACK] Seq=311992 Ack=1 Win=9488 Len=1448 TSval=1115574325 TSecr=931540662 [TCP PDU reassembled in 265]"
"264","0.027605","100.86.243.187","23.13.164.38","TCP","94","[TCP Dup ACK 46#42] 54993  >  443 [ACK] Seq=1 Ack=29632 Win=37456 Len=0 TSval=931540682 TSecr=1115574310 SLE=252624 SRE=313440 SLE=152712 SRE=251176 SLE=31080 SRE=151264"
"265","0.029232","23.13.164.38","100.86.243.187","TLSv1.2","1514","Application Data, Application Data"
"266","0.029233","23.13.164.38","100.86.243.187","TCP","1514","443  >  54993 [ACK] Seq=314888 Ack=1 Win=9488 Len=1448 TSval=1115574326 TSecr=931540662 [TCP PDU reassembled in 276]"
"267","0.029234","23.13.164.38","100.86.243.187","TCP","1514","443  >  54993 [ACK] Seq=316336 Ack=1 Win=9488 Len=1448 TSval=1115574326 TSecr=931540662 [TCP PDU reassembled in 276]"
"268","0.029234","23.13.164.38","100.86.243.187","TCP","1514","443  >  54993 [ACK] Seq=317784 Ack=1 Win=9488 Len=1448 TSval=1115574326 TSecr=931540662 [TCP PDU reassembled in 276]"
"269","0.029235","23.13.164.38","100.86.243.187","TCP","1514","443  >  54993 [ACK] Seq=319232 Ack=1 Win=9488 Len=1448 TSval=1115574326 TSecr=931540662 [TCP PDU reassembled in 276]"
"270","0.029236","23.13.164.38","100.86.243.187","TCP","1514","443  >  54993 [PSH, ACK] Seq=320680 Ack=1 Win=9488 Len=1448 TSval=1115574326 TSecr=931540662 [TCP PDU reassembled in 276]"
"271","0.029236","23.13.164.38","100.86.243.187","TCP","1514","443  >  54993 [ACK] Seq=322128 Ack=1 Win=9488 Len=1448 TSval=1115574327 TSecr=931540662 [TCP PDU reassembled in 276]"
"272","0.029237","23.13.164.38","100.86.243.187","TCP","1514","443  >  54993 [ACK] Seq=323576 Ack=1 Win=9488 Len=1448 TSval=1115574327 TSecr=931540662 [TCP PDU reassembled in 276]"
"273","0.029238","23.13.164.38","100.86.243.187","TCP","1514","443  >  54993 [ACK] Seq=325024 Ack=1 Win=9488 Len=1448 TSval=1115574327 TSecr=931540662 [TCP PDU reassembled in 276]"
"274","0.029238","23.13.164.38","100.86.243.187","TCP","1514","443  >  54993 [ACK] Seq=326472 Ack=1 Win=9488 Len=1448 TSval=1115574327 TSecr=931540662 [TCP PDU reassembled in 276]"
"275","0.029239","23.13.164.38","100.86.243.187","TCP","1514","443  >  54993 [ACK] Seq=327920 Ack=1 Win=9488 Len=1448 TSval=1115574327 TSecr=931540662 [TCP PDU reassembled in 276]"
"276","0.029240","23.13.164.38","100.86.243.187","TLSv1.2","1514","Application Data, Application Data"
"277","0.029240","23.13.164.38","100.86.243.187","TCP","1514","443  >  54993 [ACK] Seq=330816 Ack=1 Win=9488 Len=1448 TSval=1115574327 TSecr=931540662 [TCP PDU reassembled in 291]"
"278","0.029241","23.13.164.38","100.86.243.187","TCP","1514","443  >  54993 [ACK] Seq=332264 Ack=1 Win=9488 Len=1448 TSval=1115574327 TSecr=931540662 [TCP PDU reassembled in 291]"
"279","0.029241","23.13.164.38","100.86.243.187","TCP","1514","443  >  54993 [ACK] Seq=333712 Ack=1 Win=9488 Len=1448 TSval=1115574327 TSecr=931540662 [TCP PDU reassembled in 291]"
"280","0.029242","23.13.164.38","100.86.243.187","TCP","1514","443  >  54993 [ACK] Seq=335160 Ack=1 Win=9488 Len=1448 TSval=1115574327 TSecr=931540662 [TCP PDU reassembled in 291]"
"281","0.029243","23.13.164.38","100.86.243.187","TCP","1514","443  >  54993 [ACK] Seq=336608 Ack=1 Win=9488 Len=1448 TSval=1115574327 TSecr=931540662 [TCP PDU reassembled in 291]"
"282","0.029244","23.13.164.38","100.86.243.187","TCP","1514","443  >  54993 [ACK] Seq=338056 Ack=1 Win=9488 Len=1448 TSval=1115574327 TSecr=931540662 [TCP PDU reassembled in 291]"
"283","0.029302","100.86.243.187","23.13.164.38","TCP","94","[TCP Dup ACK 46#43] 54993  >  443 [ACK] Seq=1 Ack=29632 Win=37456 Len=0 TSval=931540684 TSecr=1115574310 SLE=252624 SRE=329368 SLE=152712 SRE=251176 SLE=31080 SRE=151264"
"284","0.029328","100.86.243.187","23.13.164.38","TCP","94","[TCP Dup ACK 46#44] 54993  >  443 [ACK] Seq=1 Ack=29632 Win=37456 Len=0 TSval=931540684 TSecr=1115574310 SLE=252624 SRE=339504 SLE=152712 SRE=251176 SLE=31080 SRE=151264"
"285","0.029610","23.13.164.38","100.86.243.187","TCP","1514","443  >  54993 [PSH, ACK] Seq=339504 Ack=1 Win=9488 Len=1448 TSval=1115574327 TSecr=931540662 [TCP PDU reassembled in 291]"
"286","0.029611","23.13.164.38","100.86.243.187","TCP","1514","443  >  54993 [ACK] Seq=340952 Ack=1 Win=9488 Len=1448 TSval=1115574328 TSecr=931540662 [TCP PDU reassembled in 291]"
"287","0.029612","23.13.164.38","100.86.243.187","TCP","1514","443  >  54993 [ACK] Seq=342400 Ack=1 Win=9488 Len=1448 TSval=1115574328 TSecr=931540662 [TCP PDU reassembled in 291]"
"288","0.029612","23.13.164.38","100.86.243.187","TCP","1514","443  >  54993 [ACK] Seq=343848 Ack=1 Win=9488 Len=1448 TSval=1115574328 TSecr=931540662 [TCP PDU reassembled in 291]"
"289","0.029633","100.86.243.187","23.13.164.38","TCP","94","[TCP Dup ACK 46#45] 54993  >  443 [ACK] Seq=1 Ack=29632 Win=37456 Len=0 TSval=931540684 TSecr=1115574310 SLE=252624 SRE=345296 SLE=152712 SRE=251176 SLE=31080 SRE=151264"
"290","0.029924","23.13.164.38","100.86.243.187","TCP","1514","443  >  54993 [ACK] Seq=345296 Ack=1 Win=9488 Len=1448 TSval=1115574328 TSecr=931540662 [TCP PDU reassembled in 291]"
"291","0.029925","23.13.164.38","100.86.243.187","TLSv1.2","1514","Application Data, Application Data"
"292","0.029926","23.13.164.38","100.86.243.187","TCP","1514","443  >  54993 [ACK] Seq=348192 Ack=1 Win=9488 Len=1448 TSval=1115574328 TSecr=931540662 [TCP PDU reassembled in 307]"
"293","0.029926","23.13.164.38","100.86.243.187","TCP","1514","443  >  54993 [ACK] Seq=349640 Ack=1 Win=9488 Len=1448 TSval=1115574328 TSecr=931540662 [TCP PDU reassembled in 307]"
"294","0.029945","100.86.243.187","23.13.164.38","TCP","94","[TCP Dup ACK 46#46] 54993  >  443 [ACK] Seq=1 Ack=29632 Win=37456 Len=0 TSval=931540684 TSecr=1115574310 SLE=252624 SRE=351088 SLE=152712 SRE=251176 SLE=31080 SRE=151264"
"295","0.030045","23.13.164.38","100.86.243.187","TCP","1514","443  >  54993 [ACK] Seq=351088 Ack=1 Win=9488 Len=1448 TSval=1115574328 TSecr=931540662 [TCP PDU reassembled in 307]"
"296","0.030046","23.13.164.38","100.86.243.187","TCP","1514","443  >  54993 [ACK] Seq=352536 Ack=1 Win=9488 Len=1448 TSval=1115574328 TSecr=931540662 [TCP PDU reassembled in 307]"
"297","0.030062","100.86.243.187","23.13.164.38","TCP","94","[TCP Dup ACK 46#47] 54993  >  443 [ACK] Seq=1 Ack=29632 Win=37456 Len=0 TSval=931540684 TSecr=1115574310 SLE=252624 SRE=353984 SLE=152712 SRE=251176 SLE=31080 SRE=151264"
"298","0.030251","23.13.164.38","100.86.243.187","TCP","1514","443  >  54993 [ACK] Seq=353984 Ack=1 Win=9488 Len=1448 TSval=1115574328 TSecr=931540662 [TCP PDU reassembled in 307]"
"299","0.030252","23.13.164.38","100.86.243.187","TCP","1514","443  >  54993 [ACK] Seq=355432 Ack=1 Win=9488 Len=1448 TSval=1115574328 TSecr=931540662 [TCP PDU reassembled in 307]"
"300","0.030269","100.86.243.187","23.13.164.38","TCP","94","[TCP Dup ACK 46#48] 54993  >  443 [ACK] Seq=1 Ack=29632 Win=37456 Len=0 TSval=931540684 TSecr=1115574310 SLE=252624 SRE=356880 SLE=152712 SRE=251176 SLE=31080 SRE=151264"
"301","0.030439","23.13.164.38","100.86.243.187","TCP","1514","443  >  54993 [ACK] Seq=356880 Ack=1 Win=9488 Len=1448 TSval=1115574328 TSecr=931540662 [TCP PDU reassembled in 307]"
"302","0.030440","23.13.164.38","100.86.243.187","TCP","1514","443  >  54993 [PSH, ACK] Seq=358328 Ack=1 Win=9488 Len=1448 TSval=1115574328 TSecr=931540662 [TCP PDU reassembled in 307]"
"303","0.030479","100.86.243.187","23.13.164.38","TCP","94","[TCP Dup ACK 46#49] 54993  >  443 [ACK] Seq=1 Ack=29632 Win=37456 Len=0 TSval=931540685 TSecr=1115574310 SLE=252624 SRE=359776 SLE=152712 SRE=251176 SLE=31080 SRE=151264"
"304","0.030549","23.13.164.38","100.86.243.187","TCP","1514","443  >  54993 [ACK] Seq=359776 Ack=1 Win=9488 Len=1448 TSval=1115574328 TSecr=931540668 [TCP PDU reassembled in 307]"
"305","0.030549","23.13.164.38","100.86.243.187","TCP","1514","443  >  54993 [ACK] Seq=361224 Ack=1 Win=9488 Len=1448 TSval=1115574328 TSecr=931540668 [TCP PDU reassembled in 307]"
"306","0.030583","100.86.243.187","23.13.164.38","TCP","94","[TCP Dup ACK 46#50] 54993  >  443 [ACK] Seq=1 Ack=29632 Win=37456 Len=0 TSval=931540685 TSecr=1115574310 SLE=252624 SRE=362672 SLE=152712 SRE=251176 SLE=31080 SRE=151264"
"307","0.031855","23.13.164.38","100.86.243.187","TLSv1.2","1514","Application Data, Application Data"
"308","0.031855","23.13.164.38","100.86.243.187","TCP","1514","443  >  54993 [ACK] Seq=364120 Ack=1 Win=9488 Len=1448 TSval=1115574328 TSecr=931540668 [TCP PDU reassembled in 312]"
"309","0.031856","23.13.164.38","100.86.243.187","TCP","1514","443  >  54993 [ACK] Seq=365568 Ack=1 Win=9488 Len=1448 TSval=1115574328 TSecr=931540668 [TCP PDU reassembled in 312]"
"310","0.031857","23.13.164.38","100.86.243.187","TCP","1514","443  >  54993 [ACK] Seq=367016 Ack=1 Win=9488 Len=1448 TSval=1115574328 TSecr=931540668 [TCP PDU reassembled in 312]"
"311","0.031857","23.13.164.38","100.86.243.187","TCP","1514","443  >  54993 [PSH, ACK] Seq=368464 Ack=1 Win=9488 Len=1448 TSval=1115574328 TSecr=931540668 [TCP PDU reassembled in 312]"
"312","0.031858","23.13.164.38","100.86.243.187","TLSv1.2","1303","Application Data"
"313","0.031890","100.86.243.187","23.13.164.38","TCP","94","[TCP Dup ACK 46#51] 54993  >  443 [ACK] Seq=1 Ack=29632 Win=37456 Len=0 TSval=931540686 TSecr=1115574310 SLE=252624 SRE=371149 SLE=152712 SRE=251176 SLE=31080 SRE=151264"
"314","0.032886","23.13.164.38","100.86.243.187","TLSv1.2","1514","[TCP Fast Retransmission] , Application Data"
"315","0.032916","100.86.243.187","23.13.164.38","TCP","86","54993  >  443 [ACK] Seq=1 Ack=151264 Win=35555 Len=0 TSval=931540687 TSecr=1115574335 SLE=252624 SRE=371149 SLE=152712 SRE=251176"
"316","0.033422","100.86.243.187","23.13.164.38","TLSv1.2","121","Application Data"
"317","0.033606","100.86.243.187","23.13.164.38","TCP","86","[TCP Dup ACK 315#1] 54993  >  443 [ACK] Seq=36 Ack=151264 Win=37456 Len=0 TSval=931540687 TSecr=1115574335 SLE=252624 SRE=371149 SLE=152712 SRE=251176"
"318","0.040641","23.13.164.38","100.86.243.187","TCP","1514","[TCP Retransmission] 443  >  54993 [ACK] Seq=151264 Ack=1 Win=9488 Len=1448 TSval=1115574343 TSecr=931540684"
"319","0.040742","100.86.243.187","23.13.164.38","TCP","78","54993  >  443 [ACK] Seq=36 Ack=251176 Win=35895 Len=0 TSval=931540695 TSecr=1115574343 SLE=252624 SRE=371149"
"320","0.041400","100.86.243.187","23.13.164.38","TCP","78","[TCP Dup ACK 319#1] 54993  >  443 [ACK] Seq=36 Ack=251176 Win=37456 Len=0 TSval=931540695 TSecr=1115574343 SLE=252624 SRE=371149"
"321","0.042604","23.13.164.38","100.86.243.187","TCP","1514","[TCP Retransmission] 443  >  54993 [ACK] Seq=251176 Ack=1 Win=9488 Len=1448 TSval=1115574345 TSecr=931540687"
"322","0.042663","100.86.243.187","23.13.164.38","TCP","66","54993  >  443 [ACK] Seq=36 Ack=371149 Win=35581 Len=0 TSval=931540697 TSecr=1115574345"
"323","0.043306","100.86.243.187","23.13.164.38","TCP","66","[TCP Window Update] 54993  >  443 [ACK] Seq=36 Ack=371149 Win=37456 Len=0 TSval=931540697 TSecr=1115574345"
"324","0.083290","23.13.164.38","100.86.243.187","TCP","66","443  >  54993 [ACK] Seq=371149 Ack=36 Win=9488 Len=0 TSval=1115574386 TSecr=931540687"
