"No.","Time","Source","Destination","Protocol","Length","Info"
"3","0.000001","23.13.164.38","100.86.243.187","TLSv1.2","470","Application Data"
"5","0.000257","100.86.243.187","23.13.164.38","TCP","66","54993  >  443 [ACK] Seq=1 Ack=405 Win=37449 Len=0 TSval=931488293 TSecr=1115521935"
"6","0.000476","23.13.164.38","100.86.243.187","TCP","1514","443  >  54993 [ACK] Seq=405 Ack=1 Win=8628 Len=1448 TSval=1115521935 TSecr=931488260 [TCP PDU reassembled in 7]"
"7","0.000477","23.13.164.38","100.86.243.187","TLSv1.2","774","Application Data"
"8","0.000542","100.86.243.187","23.13.164.38","TCP","66","54993  >  443 [ACK] Seq=1 Ack=2561 Win=37422 Len=0 TSval=931488293 TSecr=1115521935"
"9","0.000735","100.86.243.187","23.13.164.38","TLSv1.2","954","Application Data"
"34","0.052207","23.13.164.38","100.86.243.187","TCP","66","443  >  54993 [ACK] Seq=2561 Ack=889 Win=8651 Len=0 TSval=1115521990 TSecr=931488293"
"43","0.321884","23.13.164.38","100.86.243.187","TLSv1.2","1037","Application Data"
"44","0.321885","23.13.164.38","100.86.243.187","TLSv1.2","1040","Application Data"
"45","0.321886","23.13.164.38","100.86.243.187","TCP","1514","443  >  54993 [ACK] Seq=4506 Ack=889 Win=8651 Len=1448 TSval=1115522168 TSecr=931488293 [TCP PDU reassembled in 66]"
"46","0.321992","100.86.243.187","23.13.164.38","TCP","66","54993  >  443 [ACK] Seq=889 Ack=5954 Win=37403 Len=0 TSval=931488615 TSecr=1115522168"
"47","0.322393","100.86.243.187","23.13.164.38","TCP","66","[TCP Window Update] 54993  >  443 [ACK] Seq=889 Ack=5954 Win=37456 Len=0 TSval=931488615 TSecr=1115522168"
"48","0.322854","23.13.164.38","100.86.243.187","TCP","1514","443  >  54993 [ACK] Seq=5954 Ack=889 Win=8651 Len=1448 TSval=1115522168 TSecr=931488293 [TCP PDU reassembled in 66]"
"49","0.322855","23.13.164.38","100.86.243.187","TCP","1514","443  >  54993 [ACK] Seq=7402 Ack=889 Win=8651 Len=1448 TSval=1115522168 TSecr=931488293 [TCP PDU reassembled in 66]"
"50","0.322922","100.86.243.187","23.13.164.38","TCP","66","54993  >  443 [ACK] Seq=889 Ack=8850 Win=37410 Len=0 TSval=931488615 TSecr=1115522168"
"51","0.322968","23.13.164.38","100.86.243.187","TCP","1514","443  >  54993 [ACK] Seq=8850 Ack=889 Win=8651 Len=1448 TSval=1115522168 TSecr=931488293 [TCP PDU reassembled in 66]"
"52","0.322970","23.13.164.38","100.86.243.187","TCP","1514","443  >  54993 [ACK] Seq=10298 Ack=889 Win=8651 Len=1448 TSval=1115522168 TSecr=931488293 [TCP PDU reassembled in 66]"
"53","0.323012","100.86.243.187","23.13.164.38","TCP","66","[TCP Window Update] 54993  >  443 [ACK] Seq=889 Ack=8850 Win=37456 Len=0 TSval=931488616 TSecr=1115522168"
"54","0.323038","100.86.243.187","23.13.164.38","TCP","66","54993  >  443 [ACK] Seq=889 Ack=11746 Win=37410 Len=0 TSval=931488616 TSecr=1115522168"
"55","0.323061","100.86.243.187","23.13.164.38","TCP","66","[TCP Window Update] 54993  >  443 [ACK] Seq=889 Ack=11746 Win=37456 Len=0 TSval=931488616 TSecr=1115522168"
"56","0.323131","23.13.164.38","100.86.243.187","TCP","1514","443  >  54993 [ACK] Seq=11746 Ack=889 Win=8651 Len=1448 TSval=1115522168 TSecr=931488293 [TCP PDU reassembled in 66]"
"57","0.323133","23.13.164.38","100.86.243.187","TCP","1514","443  >  54993 [ACK] Seq=13194 Ack=889 Win=8651 Len=1448 TSval=1115522168 TSecr=931488293 [TCP PDU reassembled in 66]"
"58","0.323188","100.86.243.187","23.13.164.38","TCP","66","54993  >  443 [ACK] Seq=889 Ack=14642 Win=37410 Len=0 TSval=931488616 TSecr=1115522168"
"59","0.323249","100.86.243.187","23.13.164.38","TCP","66","[TCP Window Update] 54993  >  443 [ACK] Seq=889 Ack=14642 Win=37456 Len=0 TSval=931488616 TSecr=1115522168"
"60","0.323339","23.13.164.38","100.86.243.187","TCP","1514","443  >  54993 [ACK] Seq=14642 Ack=889 Win=8651 Len=1448 TSval=1115522168 TSecr=931488293 [TCP PDU reassembled in 66]"
"61","0.323340","23.13.164.38","100.86.243.187","TCP","1514","443  >  54993 [ACK] Seq=16090 Ack=889 Win=8651 Len=1448 TSval=1115522168 TSecr=931488293 [TCP PDU reassembled in 66]"
"62","0.323408","100.86.243.187","23.13.164.38","TCP","66","54993  >  443 [ACK] Seq=889 Ack=17538 Win=37410 Len=0 TSval=931488616 TSecr=1115522168"
"63","0.323481","100.86.243.187","23.13.164.38","TCP","66","[TCP Window Update] 54993  >  443 [ACK] Seq=889 Ack=17538 Win=37456 Len=0 TSval=931488616 TSecr=1115522168"
"64","0.324986","23.13.164.38","100.86.243.187","TCP","1514","443  >  54993 [PSH, ACK] Seq=17538 Ack=889 Win=8651 Len=1448 TSval=1115522168 TSecr=931488293 [TCP PDU reassembled in 66]"
"65","0.324987","23.13.164.38","100.86.243.187","TCP","1514","443  >  54993 [ACK] Seq=18986 Ack=889 Win=8651 Len=1448 TSval=1115522169 TSecr=931488293 [TCP PDU reassembled in 66]"
"66","0.324988","23.13.164.38","100.86.243.187","TLSv1.2","575","Application Data, Application Data"
"67","0.324989","23.13.164.38","100.86.243.187","TCP","1514","443  >  54993 [ACK] Seq=20943 Ack=889 Win=8651 Len=1448 TSval=1115522169 TSecr=931488293 [TCP PDU reassembled in 78]"
"68","0.324990","23.13.164.38","100.86.243.187","TCP","1514","443  >  54993 [ACK] Seq=22391 Ack=889 Win=8651 Len=1448 TSval=1115522169 TSecr=931488293 [TCP PDU reassembled in 78]"
"69","0.324990","23.13.164.38","100.86.243.187","TCP","1514","443  >  54993 [ACK] Seq=23839 Ack=889 Win=8651 Len=1448 TSval=1115522169 TSecr=931488293 [TCP PDU reassembled in 78]"
"70","0.324991","23.13.164.38","100.86.243.187","TCP","1514","443  >  54993 [ACK] Seq=25287 Ack=889 Win=8651 Len=1448 TSval=1115522169 TSecr=931488293 [TCP PDU reassembled in 78]"
"71","0.324992","23.13.164.38","100.86.243.187","TCP","1514","443  >  54993 [ACK] Seq=26735 Ack=889 Win=8651 Len=1448 TSval=1115522169 TSecr=931488293 [TCP PDU reassembled in 78]"
"72","0.324993","23.13.164.38","100.86.243.187","TCP","1514","443  >  54993 [ACK] Seq=28183 Ack=889 Win=8651 Len=1448 TSval=1115522169 TSecr=931488293 [TCP PDU reassembled in 78]"
"73","0.324994","23.13.164.38","100.86.243.187","TCP","1514","443  >  54993 [ACK] Seq=29631 Ack=889 Win=8651 Len=1448 TSval=1115522169 TSecr=931488293 [TCP PDU reassembled in 78]"
"74","0.324994","23.13.164.38","100.86.243.187","TCP","1514","443  >  54993 [ACK] Seq=31079 Ack=889 Win=8651 Len=1448 TSval=1115522169 TSecr=931488293 [TCP PDU reassembled in 78]"
"75","0.324995","23.13.164.38","100.86.243.187","TCP","1514","443  >  54993 [ACK] Seq=32527 Ack=889 Win=8651 Len=1448 TSval=1115522169 TSecr=931488293 [TCP PDU reassembled in 78]"
"76","0.324996","23.13.164.38","100.86.243.187","TCP","1514","443  >  54993 [PSH, ACK] Seq=33975 Ack=889 Win=8651 Len=1448 TSval=1115522169 TSecr=931488293 [TCP PDU reassembled in 78]"
"77","0.324997","23.13.164.38","100.86.243.187","TCP","1514","443  >  54993 [ACK] Seq=35423 Ack=889 Win=8651 Len=1448 TSval=1115522170 TSecr=931488293 [TCP PDU reassembled in 78]"
"78","0.324998","23.13.164.38","100.86.243.187","TLSv1.2","1514","Application Data, Application Data"
"79","0.324998","23.13.164.38","100.86.243.187","TCP","1514","[TCP Previous segment not captured] 443  >  54993 [ACK] Seq=39767 Ack=889 Win=8651 Len=1448 TSval=1115522170 TSecr=931488293 [TCP PDU reassembled in 164]"
"80","0.324999","23.13.164.38","100.86.243.187","TCP","1514","443  >  54993 [ACK] Seq=41215 Ack=889 Win=8651 Len=1448 TSval=1115522170 TSecr=931488293 [TCP PDU reassembled in 164]"
"81","0.325000","23.13.164.38","100.86.243.187","TCP","1514","443  >  54993 [ACK] Seq=42663 Ack=889 Win=8651 Len=1448 TSval=1115522170 TSecr=931488293 [TCP PDU reassembled in 164]"
"82","0.325001","23.13.164.38","100.86.243.187","TCP","1514","443  >  54993 [ACK] Seq=44111 Ack=889 Win=8651 Len=1448 TSval=1115522170 TSecr=931488293 [TCP PDU reassembled in 164]"
"83","0.325002","23.13.164.38","100.86.243.187","TCP","1514","443  >  54993 [ACK] Seq=45559 Ack=889 Win=8651 Len=1448 TSval=1115522170 TSecr=931488293 [TCP PDU reassembled in 164]"
"84","0.325002","23.13.164.38","100.86.243.187","TCP","1514","443  >  54993 [ACK] Seq=47007 Ack=889 Win=8651 Len=1448 TSval=1115522170 TSecr=931488293 [TCP PDU reassembled in 164]"
"85","0.325003","23.13.164.38","100.86.243.187","TCP","1514","443  >  54993 [PSH, ACK] Seq=48455 Ack=889 Win=8651 Len=1448 TSval=1115522170 TSecr=931488293 [TCP PDU reassembled in 164]"
"86","0.325098","100.86.243.187","23.13.164.38","TCP","66","54993  >  443 [ACK] Seq=889 Ack=32527 Win=37221 Len=0 TSval=931488618 TSecr=1115522169"
"87","0.325134","100.86.243.187","23.13.164.38","TCP","66","54993  >  443 [ACK] Seq=889 Ack=38319 Win=37131 Len=0 TSval=931488618 TSecr=1115522170"
"88","0.325155","100.86.243.187","23.13.164.38","TCP","78","[TCP Dup ACK 87#1] 54993  >  443 [ACK] Seq=889 Ack=38319 Win=37131 Len=0 TSval=931488618 TSecr=1115522170 SLE=39767 SRE=49903"
"89","0.325345","23.13.164.38","100.86.243.187","TCP","1514","443  >  54993 [ACK] Seq=49903 Ack=889 Win=8651 Len=1448 TSval=1115522171 TSecr=931488293 [TCP PDU reassembled in 164]"
"90","0.325346","23.13.164.38","100.86.243.187","TCP","1514","443  >  54993 [ACK] Seq=51351 Ack=889 Win=8651 Len=1448 TSval=1115522171 TSecr=931488293 [TCP PDU reassembled in 164]"
"91","0.325410","100.86.243.187","23.13.164.38","TCP","78","[TCP Dup ACK 87#2] 54993  >  443 [ACK] Seq=889 Ack=38319 Win=37456 Len=0 TSval=931488618 TSecr=1115522170 SLE=39767 SRE=49903"
"92","0.325441","100.86.243.187","23.13.164.38","TCP","78","[TCP Dup ACK 87#3] 54993  >  443 [ACK] Seq=889 Ack=38319 Win=37456 Len=0 TSval=931488618 TSecr=1115522170 SLE=39767 SRE=52799"
"93","0.325482","23.13.164.38","100.86.243.187","TCP","1514","443  >  54993 [ACK] Seq=52799 Ack=889 Win=8651 Len=1448 TSval=1115522171 TSecr=931488293 [TCP PDU reassembled in 164], Application Data"
"94","0.325483","23.13.164.38","100.86.243.187","TCP","1514","443  >  54993 [ACK] Seq=54247 Ack=889 Win=8651 Len=1448 TSval=1115522171 TSecr=931488293 [TCP PDU reassembled in 106]"
"95","0.325540","100.86.243.187","23.13.164.38","TCP","78","[TCP Dup ACK 87#4] 54993  >  443 [ACK] Seq=889 Ack=38319 Win=37456 Len=0 TSval=931488618 TSecr=1115522170 SLE=39767 SRE=55695"
"96","0.327288","23.13.164.38","100.86.243.187","TCP","1514","443  >  54993 [ACK] Seq=55695 Ack=889 Win=8651 Len=1448 TSval=1115522171 TSecr=931488293 [TCP PDU reassembled in 106]"
"97","0.327291","23.13.164.38","100.86.243.187","TCP","1514","443  >  54993 [ACK] Seq=57143 Ack=889 Win=8651 Len=1448 TSval=1115522171 TSecr=931488293 [TCP PDU reassembled in 106]"
"98","0.327292","23.13.164.38","100.86.243.187","TCP","1514","443  >  54993 [ACK] Seq=58591 Ack=889 Win=8651 Len=1448 TSval=1115522171 TSecr=931488293 [TCP PDU reassembled in 106]"
"99","0.327294","23.13.164.38","100.86.243.187","TCP","1514","443  >  54993 [ACK] Seq=60039 Ack=889 Win=8651 Len=1448 TSval=1115522171 TSecr=931488293 [TCP PDU reassembled in 106]"
"100","0.327295","23.13.164.38","100.86.243.187","TCP","1514","443  >  54993 [ACK] Seq=61487 Ack=889 Win=8651 Len=1448 TSval=1115522171 TSecr=931488293 [TCP PDU reassembled in 106]"
"101","0.327296","23.13.164.38","100.86.243.187","TCP","1514","443  >  54993 [PSH, ACK] Seq=62935 Ack=889 Win=8651 Len=1448 TSval=1115522171 TSecr=931488293 [TCP PDU reassembled in 106]"
"102","0.327298","23.13.164.38","100.86.243.187","TCP","1514","443  >  54993 [ACK] Seq=64383 Ack=889 Win=8651 Len=1448 TSval=1115522172 TSecr=931488293 [TCP PDU reassembled in 106]"
"103","0.327299","23.13.164.38","100.86.243.187","TCP","1514","443  >  54993 [ACK] Seq=65831 Ack=889 Win=8651 Len=1448 TSval=1115522172 TSecr=931488293 [TCP PDU reassembled in 106]"
"104","0.327300","23.13.164.38","100.86.243.187","TCP","1514","443  >  54993 [ACK] Seq=67279 Ack=889 Win=8651 Len=1448 TSval=1115522172 TSecr=931488293 [TCP PDU reassembled in 106]"
"105","0.327302","23.13.164.38","100.86.243.187","TCP","1514","443  >  54993 [ACK] Seq=68727 Ack=889 Win=8651 Len=1448 TSval=1115522172 TSecr=931488293 [TCP PDU reassembled in 106]"
"106","0.327303","23.13.164.38","100.86.243.187","TLSv1.2","1514","Application Data, Application Data"
"107","0.327304","23.13.164.38","100.86.243.187","TCP","1514","443  >  54993 [ACK] Seq=71623 Ack=889 Win=8651 Len=1448 TSval=1115522172 TSecr=931488293 [TCP PDU reassembled in 117]"
"108","0.327305","23.13.164.38","100.86.243.187","TCP","1514","443  >  54993 [ACK] Seq=73071 Ack=889 Win=8651 Len=1448 TSval=1115522172 TSecr=931488293 [TCP PDU reassembled in 117]"
"109","0.327306","23.13.164.38","100.86.243.187","TCP","1514","443  >  54993 [ACK] Seq=74519 Ack=889 Win=8651 Len=1448 TSval=1115522172 TSecr=931488293 [TCP PDU reassembled in 117]"
"110","0.327308","23.13.164.38","100.86.243.187","TCP","1514","443  >  54993 [ACK] Seq=75967 Ack=889 Win=8651 Len=1448 TSval=1115522172 TSecr=931488293 [TCP PDU reassembled in 117]"
"111","0.327309","23.13.164.38","100.86.243.187","TCP","1514","443  >  54993 [PSH, ACK] Seq=77415 Ack=889 Win=8651 Len=1448 TSval=1115522172 TSecr=931488293 [TCP PDU reassembled in 117]"
"112","0.327310","23.13.164.38","100.86.243.187","TCP","1514","443  >  54993 [ACK] Seq=78863 Ack=889 Win=8651 Len=1448 TSval=1115522173 TSecr=931488293 [TCP PDU reassembled in 117]"
"113","0.327311","23.13.164.38","100.86.243.187","TCP","1514","443  >  54993 [ACK] Seq=80311 Ack=889 Win=8651 Len=1448 TSval=1115522173 TSecr=931488293 [TCP PDU reassembled in 117]"
"114","0.327312","23.13.164.38","100.86.243.187","TCP","1514","443  >  54993 [ACK] Seq=81759 Ack=889 Win=8651 Len=1448 TSval=1115522173 TSecr=931488293 [TCP PDU reassembled in 117]"
"115","0.327314","23.13.164.38","100.86.243.187","TCP","1514","443  >  54993 [ACK] Seq=83207 Ack=889 Win=8651 Len=1448 TSval=1115522173 TSecr=931488293 [TCP PDU reassembled in 117]"
"116","0.327315","23.13.164.38","100.86.243.187","TCP","1514","443  >  54993 [ACK] Seq=84655 Ack=889 Win=8651 Len=1448 TSval=1115522173 TSecr=931488293 [TCP PDU reassembled in 117]"
"117","0.327316","23.13.164.38","100.86.243.187","TLSv1.2","1514","Application Data, Application Data"
"118","0.327317","23.13.164.38","100.86.243.187","TCP","1514","443  >  54993 [ACK] Seq=87551 Ack=889 Win=8651 Len=1448 TSval=1115522173 TSecr=931488293 [TCP PDU reassembled in 132]"
"119","0.327318","23.13.164.38","100.86.243.187","TCP","1514","443  >  54993 [ACK] Seq=88999 Ack=889 Win=8651 Len=1448 TSval=1115522173 TSecr=931488293 [TCP PDU reassembled in 132]"
"120","0.327319","23.13.164.38","100.86.243.187","TCP","1514","443  >  54993 [ACK] Seq=90447 Ack=889 Win=8651 Len=1448 TSval=1115522173 TSecr=931488293 [TCP PDU reassembled in 132]"
"121","0.327321","23.13.164.38","100.86.243.187","TCP","1514","443  >  54993 [PSH, ACK] Seq=91895 Ack=889 Win=8651 Len=1448 TSval=1115522173 TSecr=931488293 [TCP PDU reassembled in 132]"
"122","0.327322","23.13.164.38","100.86.243.187","TCP","1514","443  >  54993 [ACK] Seq=93343 Ack=889 Win=8651 Len=1448 TSval=1115522174 TSecr=931488293 [TCP PDU reassembled in 132]"
"123","0.327323","23.13.164.38","100.86.243.187","TCP","1514","443  >  54993 [ACK] Seq=94791 Ack=889 Win=8651 Len=1448 TSval=1115522174 TSecr=931488293 [TCP PDU reassembled in 132]"
"124","0.327416","23.13.164.38","100.86.243.187","TCP","1514","443  >  54993 [ACK] Seq=96239 Ack=889 Win=8651 Len=1448 TSval=1115522174 TSecr=931488293 [TCP PDU reassembled in 132]"
"125","0.327418","23.13.164.38","100.86.243.187","TCP","1514","443  >  54993 [ACK] Seq=97687 Ack=889 Win=8651 Len=1448 TSval=1115522174 TSecr=931488293 [TCP PDU reassembled in 132]"
"126","0.327507","100.86.243.187","23.13.164.38","TCP","78","[TCP Dup ACK 87#5] 54993  >  443 [ACK] Seq=889 Ack=38319 Win=37456 Len=0 TSval=931488620 TSecr=1115522170 SLE=39767 SRE=71623"
"127","0.327562","100.86.243.187","23.13.164.38","TCP","78","[TCP Dup ACK 87#6] 54993  >  443 [ACK] Seq=889 Ack=38319 Win=37456 Len=0 TSval=931488620 TSecr=1115522170 SLE=39767 SRE=87551"
"128","0.327588","100.86.243.187","23.13.164.38","TCP","78","[TCP Dup ACK 87#7] 54993  >  443 [ACK] Seq=889 Ack=38319 Win=37456 Len=0 TSval=931488620 TSecr=1115522170 SLE=39767 SRE=96239"
"129","0.327619","100.86.243.187","23.13.164.38","TCP","78","[TCP Dup ACK 87#8] 54993  >  443 [ACK] Seq=889 Ack=38319 Win=37456 Len=0 TSval=931488620 TSecr=1115522170 SLE=39767 SRE=99135"
"130","0.327791","23.13.164.38","100.86.243.187","TCP","1514","443  >  54993 [ACK] Seq=99135 Ack=889 Win=8651 Len=1448 TSval=1115522174 TSecr=931488293 [TCP PDU reassembled in 132]"
"131","0.327793","23.13.164.38","100.86.243.187","TCP","1514","443  >  54993 [ACK] Seq=100583 Ack=889 Win=8651 Len=1448 TSval=1115522174 TSecr=931488293 [TCP PDU reassembled in 132]"
"132","0.327794","23.13.164.38","100.86.243.187","TLSv1.2","1514","Application Data, Application Data"
"133","0.327796","23.13.164.38","100.86.243.187","TCP","1514","443  >  54993 [ACK] Seq=103479 Ack=889 Win=8651 Len=1448 TSval=1115522174 TSecr=931488293 [TCP PDU reassembled in 142]"
"134","0.327902","100.86.243.187","23.13.164.38","TCP","78","[TCP Dup ACK 87#9] 54993  >  443 [ACK] Seq=889 Ack=38319 Win=37456 Len=0 TSval=931488620 TSecr=1115522170 SLE=39767 SRE=104927"
"135","0.330243","23.13.164.38","100.86.243.187","TCP","1514","443  >  54993 [ACK] Seq=104927 Ack=889 Win=8651 Len=1448 TSval=1115522174 TSecr=931488293 [TCP PDU reassembled in 142]"
"136","0.330244","23.13.164.38","100.86.243.187","TCP","1514","443  >  54993 [PSH, ACK] Seq=106375 Ack=889 Win=8651 Len=1448 TSval=1115522174 TSecr=931488293 [TCP PDU reassembled in 142]"
"137","0.330245","23.13.164.38","100.86.243.187","TCP","1514","443  >  54993 [ACK] Seq=107823 Ack=889 Win=8651 Len=1448 TSval=1115522175 TSecr=931488293 [TCP PDU reassembled in 142]"
"138","0.330245","23.13.164.38","100.86.243.187","TCP","1514","443  >  54993 [ACK] Seq=109271 Ack=889 Win=8651 Len=1448 TSval=1115522175 TSecr=931488293 [TCP PDU reassembled in 142]"
"139","0.330246","23.13.164.38","100.86.243.187","TCP","1514","443  >  54993 [ACK] Seq=110719 Ack=889 Win=8651 Len=1448 TSval=1115522175 TSecr=931488293 [TCP PDU reassembled in 142]"
"140","0.330247","23.13.164.38","100.86.243.187","TCP","1514","443  >  54993 [ACK] Seq=112167 Ack=889 Win=8651 Len=1448 TSval=1115522175 TSecr=931488293 [TCP PDU reassembled in 142]"
"141","0.330399","100.86.243.187","23.13.164.38","TCP","78","[TCP Dup ACK 87#10] 54993  >  443 [ACK] Seq=889 Ack=38319 Win=37456 Len=0 TSval=931488623 TSecr=1115522170 SLE=39767 SRE=113615"
"142","0.347761","23.13.164.38","100.86.243.187","TLSv1.2","752","Application Data"
"143","0.347763","23.13.164.38","100.86.243.187","TCP","752","[TCP Fast Retransmission] 443  >  54993 [PSH, ACK] Seq=113615 Ack=889 Win=8651 Len=686 TSval=1115522207 TSecr=931488293 [TCP PDU reassembled in 142]"
"144","0.347877","100.86.243.187","23.13.164.38","TCP","78","[TCP Dup ACK 87#11] 54993  >  443 [ACK] Seq=889 Ack=38319 Win=37456 Len=0 TSval=931488641 TSecr=1115522170 SLE=39767 SRE=114301"
"145","0.347935","100.86.243.187","23.13.164.38","TCP","86","[TCP Dup ACK 87#12] 54993  >  443 [ACK] Seq=889 Ack=38319 Win=37456 Len=0 TSval=931488641 TSecr=1115522170 SLE=113615 SRE=114301 SLE=39767 SRE=114301"
"164","0.359025","23.13.164.38","100.86.243.187","TLSv1.2","1514","[TCP Fast Retransmission] , Application Data"
"165","0.359175","100.86.243.187","23.13.164.38","TCP","66","54993  >  443 [ACK] Seq=889 Ack=114301 Win=36268 Len=0 TSval=931488652 TSecr=1115522296"
"166","0.359810","100.86.243.187","23.13.164.38","TCP","66","[TCP Window Update] 54993  >  443 [ACK] Seq=889 Ack=114301 Win=37456 Len=0 TSval=931488652 TSecr=1115522296"
"237","0.578110","100.86.243.187","23.13.164.38","TLSv1.2","987","Application Data"
"239","0.578360","100.86.243.187","23.13.164.38","TLSv1.2","381","Application Data"
"240","0.578742","100.86.243.187","23.13.164.38","TLSv1.2","347","Application Data"
"241","0.579071","100.86.243.187","23.13.164.38","TLSv1.2","341","Application Data"
"242","0.579405","100.86.243.187","23.13.164.38","TLSv1.2","344","Application Data"
"243","0.579512","100.86.243.187","23.13.164.38","TLSv1.2","347","Application Data"
"244","0.579812","100.86.243.187","23.13.164.38","TLSv1.2","342","Application Data"
"245","0.580173","100.86.243.187","23.13.164.38","TLSv1.2","342","Application Data"
"246","0.580435","100.86.243.187","23.13.164.38","TLSv1.2","342","Application Data"
"249","0.589195","23.13.164.38","100.86.243.187","TCP","66","443  >  54993 [ACK] Seq=114301 Ack=2681 Win=8741 Len=0 TSval=1115522528 TSecr=931488872"
"250","0.591040","23.13.164.38","100.86.243.187","TCP","66","443  >  54993 [ACK] Seq=114301 Ack=3792 Win=8832 Len=0 TSval=1115522529 TSecr=931488873"
"251","0.591041","23.13.164.38","100.86.243.187","TCP","66","443  >  54993 [ACK] Seq=114301 Ack=4068 Win=8855 Len=0 TSval=1115522529 TSecr=931488873"
"252","0.608189","23.13.164.38","100.86.243.187","TLSv1.2","614","Application Data"
"253","0.608191","23.13.164.38","100.86.243.187","TLSv1.2","1357","Application Data"
"254","0.608191","23.13.164.38","100.86.243.187","TLSv1.2","613","Application Data"
"255","0.608193","23.13.164.38","100.86.243.187","TCP","1514","443  >  54993 [ACK] Seq=116687 Ack=4068 Win=8855 Len=1448 TSval=1115522544 TSecr=931488873 [TCP PDU reassembled in 260]"
"256","0.608194","23.13.164.38","100.86.243.187","TCP","1514","443  >  54993 [ACK] Seq=118135 Ack=4068 Win=8855 Len=1448 TSval=1115522544 TSecr=931488873 [TCP PDU reassembled in 260]"
"257","0.608195","23.13.164.38","100.86.243.187","TCP","1514","443  >  54993 [ACK] Seq=119583 Ack=4068 Win=8855 Len=1448 TSval=1115522544 TSecr=931488873 [TCP PDU reassembled in 260]"
"258","0.608196","23.13.164.38","100.86.243.187","TCP","1514","443  >  54993 [ACK] Seq=121031 Ack=4068 Win=8855 Len=1448 TSval=1115522544 TSecr=931488873 [TCP PDU reassembled in 260]"
"259","0.608197","23.13.164.38","100.86.243.187","TCP","1514","443  >  54993 [ACK] Seq=122479 Ack=4068 Win=8855 Len=1448 TSval=1115522544 TSecr=931488873 [TCP PDU reassembled in 260]"
"260","0.608198","23.13.164.38","100.86.243.187","TLSv1.2","280","Application Data"
"261","0.608198","23.13.164.38","100.86.243.187","TLSv1.2","1514","Application Data"
"262","0.608200","23.13.164.38","100.86.243.187","TCP","1514","443  >  54993 [ACK] Seq=125589 Ack=4068 Win=8855 Len=1448 TSval=1115522544 TSecr=931488873 [TCP PDU reassembled in 263]"
"263","0.608200","23.13.164.38","100.86.243.187","TLSv1.2","542","Application Data"
"264","0.608201","23.13.164.38","100.86.243.187","TLSv1.2","1514","Application Data"
"265","0.608202","23.13.164.38","100.86.243.187","TCP","1514","443  >  54993 [ACK] Seq=128961 Ack=4068 Win=8855 Len=1448 TSval=1115522545 TSecr=931488873 [TCP PDU reassembled in 266]"
"266","0.608203","23.13.164.38","100.86.243.187","TLSv1.2","676","Application Data"
"267","0.608204","23.13.164.38","100.86.243.187","TLSv1.2","1514","Application Data"
"268","0.608205","23.13.164.38","100.86.243.187","TCP","1514","443  >  54993 [ACK] Seq=132467 Ack=4068 Win=8855 Len=1448 TSval=1115522545 TSecr=931488873 [TCP PDU reassembled in 276]"
"269","0.608206","23.13.164.38","100.86.243.187","TCP","1514","443  >  54993 [ACK] Seq=133915 Ack=4068 Win=8855 Len=1448 TSval=1115522545 TSecr=931488873 [TCP PDU reassembled in 276]"
"270","0.608207","23.13.164.38","100.86.243.187","TCP","1514","443  >  54993 [ACK] Seq=135363 Ack=4068 Win=8855 Len=1448 TSval=1115522545 TSecr=931488873 [TCP PDU reassembled in 276]"
"271","0.608208","23.13.164.38","100.86.243.187","TCP","1514","443  >  54993 [ACK] Seq=136811 Ack=4068 Win=8855 Len=1448 TSval=1115522545 TSecr=931488873 [TCP PDU reassembled in 276]"
"272","0.608209","23.13.164.38","100.86.243.187","TCP","1514","443  >  54993 [ACK] Seq=138259 Ack=4068 Win=8855 Len=1448 TSval=1115522545 TSecr=931488873 [TCP PDU reassembled in 276]"
"273","0.608210","23.13.164.38","100.86.243.187","TCP","1514","443  >  54993 [ACK] Seq=139707 Ack=4068 Win=8855 Len=1448 TSval=1115522545 TSecr=931488873 [TCP PDU reassembled in 276]"
"274","0.608211","23.13.164.38","100.86.243.187","TCP","1514","443  >  54993 [ACK] Seq=141155 Ack=4068 Win=8855 Len=1448 TSval=1115522545 TSecr=931488873 [TCP PDU reassembled in 276]"
"275","0.608211","23.13.164.38","100.86.243.187","TCP","1514","443  >  54993 [ACK] Seq=142603 Ack=4068 Win=8855 Len=1448 TSval=1115522545 TSecr=931488873 [TCP PDU reassembled in 276]"
"276","0.608213","23.13.164.38","100.86.243.187","TLSv1.2","1257","Application Data"
"277","0.608312","23.13.164.38","100.86.243.187","TLSv1.2","1514","Application Data"
"278","0.608313","23.13.164.38","100.86.243.187","TCP","1514","443  >  54993 [ACK] Seq=146690 Ack=4068 Win=8855 Len=1448 TSval=1115522546 TSecr=931488873 [TCP PDU reassembled in 287]"
"279","0.608314","23.13.164.38","100.86.243.187","TCP","1514","443  >  54993 [ACK] Seq=148138 Ack=4068 Win=8855 Len=1448 TSval=1115522546 TSecr=931488873 [TCP PDU reassembled in 287]"
"280","0.608315","23.13.164.38","100.86.243.187","TCP","1514","443  >  54993 [ACK] Seq=149586 Ack=4068 Win=8855 Len=1448 TSval=1115522546 TSecr=931488873 [TCP PDU reassembled in 287]"
"281","0.608371","23.13.164.38","100.86.243.187","TCP","1514","443  >  54993 [ACK] Seq=151034 Ack=4068 Win=8855 Len=1448 TSval=1115522546 TSecr=931488873 [TCP PDU reassembled in 287]"
"282","0.608372","23.13.164.38","100.86.243.187","TCP","1514","443  >  54993 [ACK] Seq=152482 Ack=4068 Win=8855 Len=1448 TSval=1115522546 TSecr=931488873 [TCP PDU reassembled in 287]"
"283","0.608404","100.86.243.187","23.13.164.38","TCP","66","54993  >  443 [ACK] Seq=4068 Ack=145242 Win=36972 Len=0 TSval=931488901 TSecr=1115522545"
"284","0.608429","100.86.243.187","23.13.164.38","TCP","66","54993  >  443 [ACK] Seq=4068 Ack=153930 Win=36836 Len=0 TSval=931488901 TSecr=1115522546"
"285","0.608668","23.13.164.38","100.86.243.187","TCP","1514","443  >  54993 [ACK] Seq=153930 Ack=4068 Win=8855 Len=1448 TSval=1115522546 TSecr=931488873 [TCP PDU reassembled in 287]"
"286","0.608669","23.13.164.38","100.86.243.187","TCP","1514","443  >  54993 [ACK] Seq=155378 Ack=4068 Win=8855 Len=1448 TSval=1115522546 TSecr=931488873 [TCP PDU reassembled in 287]"
"287","0.608670","23.13.164.38","100.86.243.187","TLSv1.2","1514","Application Data, Application Data"
"288","0.608670","23.13.164.38","100.86.243.187","TCP","1514","443  >  54993 [PSH, ACK] Seq=158274 Ack=4068 Win=8855 Len=1448 TSval=1115522546 TSecr=931488873 [TCP PDU reassembled in 301]"
"289","0.608721","100.86.243.187","23.13.164.38","TCP","66","54993  >  443 [ACK] Seq=4068 Ack=159722 Win=36775 Len=0 TSval=931488901 TSecr=1115522546"
"290","0.610040","100.86.243.187","23.13.164.38","TCP","66","[TCP Window Update] 54993  >  443 [ACK] Seq=4068 Ack=159722 Win=37456 Len=0 TSval=931488902 TSecr=1115522546"
"291","0.610720","23.13.164.38","100.86.243.187","TCP","1514","443  >  54993 [ACK] Seq=159722 Ack=4068 Win=8855 Len=1448 TSval=1115522547 TSecr=931488873 [TCP PDU reassembled in 301]"
"292","0.610722","23.13.164.38","100.86.243.187","TCP","1514","443  >  54993 [ACK] Seq=161170 Ack=4068 Win=8855 Len=1448 TSval=1115522547 TSecr=931488873 [TCP PDU reassembled in 301]"
"293","0.610723","23.13.164.38","100.86.243.187","TCP","1514","443  >  54993 [ACK] Seq=162618 Ack=4068 Win=8855 Len=1448 TSval=1115522547 TSecr=931488873 [TCP PDU reassembled in 301]"
"294","0.610724","23.13.164.38","100.86.243.187","TCP","1514","443  >  54993 [ACK] Seq=164066 Ack=4068 Win=8855 Len=1448 TSval=1115522547 TSecr=931488873 [TCP PDU reassembled in 301]"
"295","0.610725","23.13.164.38","100.86.243.187","TCP","1514","443  >  54993 [ACK] Seq=165514 Ack=4068 Win=8855 Len=1448 TSval=1115522547 TSecr=931488873 [TCP PDU reassembled in 301]"
"296","0.610726","23.13.164.38","100.86.243.187","TCP","1514","443  >  54993 [ACK] Seq=166962 Ack=4068 Win=8855 Len=1448 TSval=1115522547 TSecr=931488873 [TCP PDU reassembled in 301]"
"297","0.610727","23.13.164.38","100.86.243.187","TCP","1514","443  >  54993 [ACK] Seq=168410 Ack=4068 Win=8855 Len=1448 TSval=1115522547 TSecr=931488873 [TCP PDU reassembled in 301]"
"298","0.610728","23.13.164.38","100.86.243.187","TCP","1514","443  >  54993 [ACK] Seq=169858 Ack=4068 Win=8855 Len=1448 TSval=1115522547 TSecr=931488873 [TCP PDU reassembled in 301]"
"299","0.610729","23.13.164.38","100.86.243.187","TCP","1514","443  >  54993 [ACK] Seq=171306 Ack=4068 Win=8855 Len=1448 TSval=1115522547 TSecr=931488873 [TCP PDU reassembled in 301]"
"300","0.610730","23.13.164.38","100.86.243.187","TCP","1514","443  >  54993 [PSH, ACK] Seq=172754 Ack=4068 Win=8855 Len=1448 TSval=1115522547 TSecr=931488873 [TCP PDU reassembled in 301]"
"301","0.610730","23.13.164.38","100.86.243.187","TLSv1.2","246","Application Data"
"302","0.610731","23.13.164.38","100.86.243.187","TLSv1.2","614","Application Data"
"303","0.610732","23.13.164.38","100.86.243.187","TCP","1514","443  >  54993 [ACK] Seq=174930 Ack=4068 Win=8855 Len=1448 TSval=1115522548 TSecr=931488873 [TCP PDU reassembled in 304]"
"304","0.610733","23.13.164.38","100.86.243.187","TLSv1.2","1114","Application Data"
"305","0.610845","100.86.243.187","23.13.164.38","TCP","66","54993  >  443 [ACK] Seq=4068 Ack=174930 Win=37218 Len=0 TSval=931488904 TSecr=1115522548"
"306","0.610929","100.86.243.187","23.13.164.38","TCP","66","54993  >  443 [ACK] Seq=4068 Ack=177426 Win=37179 Len=0 TSval=931488904 TSecr=1115522548"
"307","0.611228","100.86.243.187","23.13.164.38","TCP","66","[TCP Window Update] 54993  >  443 [ACK] Seq=4068 Ack=177426 Win=37456 Len=0 TSval=931488904 TSecr=1115522548"
"308","0.620605","100.86.243.187","23.13.164.38","TLSv1.2","363","Application Data"
"309","0.620955","100.86.243.187","23.13.164.38","TLSv1.2","352","Application Data"
"310","0.621286","100.86.243.187","23.13.164.38","TLSv1.2","380","Application Data"
"311","0.621472","100.86.243.187","23.13.164.38","TLSv1.2","373","Application Data"
"312","0.621958","100.86.243.187","23.13.164.38","TLSv1.2","375","Application Data"
"313","0.622104","100.86.243.187","23.13.164.38","TLSv1.2","380","Application Data"
"314","0.622210","100.86.243.187","23.13.164.38","TLSv1.2","376","Application Data"
"315","0.622577","100.86.243.187","23.13.164.38","TLSv1.2","376","Application Data"
"316","0.622750","100.86.243.187","23.13.164.38","TLSv1.2","364","Application Data"
"317","0.623251","100.86.243.187","23.13.164.38","TLSv1.2","382","Application Data"
"318","0.623410","100.86.243.187","23.13.164.38","TLSv1.2","394","Application Data"
"319","0.623535","100.86.243.187","23.13.164.38","TLSv1.2","389","Application Data"
"320","0.624054","100.86.243.187","23.13.164.38","TLSv1.2","375","Application Data"
"321","0.624189","100.86.243.187","23.13.164.38","TLSv1.2","374","Application Data"
"322","0.624318","100.86.243.187","23.13.164.38","TLSv1.2","380","Application Data"
"323","0.624421","100.86.243.187","23.13.164.38","TLSv1.2","360","Application Data"
"324","0.624935","100.86.243.187","23.13.164.38","TLSv1.2","382","Application Data"
"325","0.625092","100.86.243.187","23.13.164.38","TLSv1.2","360","Application Data"
"326","0.625222","100.86.243.187","23.13.164.38","TLSv1.2","358","Application Data"
"327","0.625690","100.86.243.187","23.13.164.38","TLSv1.2","373","Application Data"
"328","0.674073","100.86.243.187","23.13.164.38","TCP","1514","[TCP Retransmission] 54993  >  443 [PSH, ACK] Seq=8766 Ack=177426 Win=37456 Len=1448 TSval=931488967 TSecr=1115522548"
"329","0.846122","23.13.164.38","100.86.243.187","TLSv1.2","617","Application Data"
"330","0.846122","23.13.164.38","100.86.243.187","TCP","1514","443  >  54993 [ACK] Seq=177977 Ack=4068 Win=8855 Len=1448 TSval=1115522569 TSecr=931488904 [TCP PDU reassembled in 331]"
"331","0.846123","23.13.164.38","100.86.243.187","TLSv1.2","1482","Application Data"
"332","0.846164","23.13.164.38","100.86.243.187","TCP","1482","[TCP Retransmission] 443  >  54993 [PSH, ACK] Seq=179425 Ack=4068 Win=8855 Len=1416 TSval=1115522700 TSecr=931488904 [TCP PDU reassembled in 331]"
"333","0.846249","100.86.243.187","23.13.164.38","TCP","66","54993  >  443 [ACK] Seq=10214 Ack=180841 Win=37402 Len=0 TSval=931489139 TSecr=1115522569"
"334","0.846348","100.86.243.187","23.13.164.38","TCP","78","[TCP Dup ACK 333#1] 54993  >  443 [ACK] Seq=10214 Ack=180841 Win=37402 Len=0 TSval=931489139 TSecr=1115522700 SLE=179425 SRE=180841"
"335","0.846767","100.86.243.187","23.13.164.38","TCP","66","[TCP Window Update] 54993  >  443 [ACK] Seq=10214 Ack=180841 Win=37456 Len=0 TSval=931489139 TSecr=1115522700"
"336","0.857041","23.13.164.38","100.86.243.187","TCP","66","443  >  54993 [ACK] Seq=180841 Ack=4651 Win=8900 Len=0 TSval=1115522794 TSecr=931488913"
"337","0.857042","23.13.164.38","100.86.243.187","TCP","66","443  >  54993 [ACK] Seq=180841 Ack=9907 Win=9239 Len=0 TSval=1115522795 TSecr=931488917"
"338","0.857043","23.13.164.38","100.86.243.187","TCP","78","443  >  54993 [ACK] Seq=180841 Ack=10214 Win=9262 Len=0 TSval=1115522795 TSecr=931488967 SLE=8766 SRE=10214"
"339","0.900427","23.13.164.38","100.86.243.187","TLSv1.2","406","Application Data"
"340","0.900428","23.13.164.38","100.86.243.187","TCP","1514","443  >  54993 [ACK] Seq=181181 Ack=10214 Win=9262 Len=1448 TSval=1115522820 TSecr=931489139 [TCP PDU reassembled in 350]"
"341","0.900428","23.13.164.38","100.86.243.187","TCP","1514","443  >  54993 [ACK] Seq=182629 Ack=10214 Win=9262 Len=1448 TSval=1115522820 TSecr=931489139 [TCP PDU reassembled in 350]"
"342","0.900510","100.86.243.187","23.13.164.38","TCP","66","54993  >  443 [ACK] Seq=10214 Ack=184077 Win=37405 Len=0 TSval=931489193 TSecr=1115522820"
"343","0.900703","100.86.243.187","23.13.164.38","TCP","66","[TCP Window Update] 54993  >  443 [ACK] Seq=10214 Ack=184077 Win=37456 Len=0 TSval=931489193 TSecr=1115522820"
"344","0.903525","23.13.164.38","100.86.243.187","TCP","1514","443  >  54993 [ACK] Seq=184077 Ack=10214 Win=9262 Len=1448 TSval=1115522820 TSecr=931489139 [TCP PDU reassembled in 350]"
"345","0.903526","23.13.164.38","100.86.243.187","TCP","1514","443  >  54993 [ACK] Seq=185525 Ack=10214 Win=9262 Len=1448 TSval=1115522820 TSecr=931489139 [TCP PDU reassembled in 350]"
"346","0.903526","23.13.164.38","100.86.243.187","TCP","1514","443  >  54993 [ACK] Seq=186973 Ack=10214 Win=9262 Len=1448 TSval=1115522820 TSecr=931489139 [TCP PDU reassembled in 350]"
"347","0.903527","23.13.164.38","100.86.243.187","TCP","1514","443  >  54993 [ACK] Seq=188421 Ack=10214 Win=9262 Len=1448 TSval=1115522820 TSecr=931489139 [TCP PDU reassembled in 350]"
"348","0.903527","23.13.164.38","100.86.243.187","TCP","1514","443  >  54993 [ACK] Seq=189869 Ack=10214 Win=9262 Len=1448 TSval=1115522820 TSecr=931489139 [TCP PDU reassembled in 350]"
"349","0.903528","23.13.164.38","100.86.243.187","TCP","1514","443  >  54993 [ACK] Seq=191317 Ack=10214 Win=9262 Len=1448 TSval=1115522820 TSecr=931489139 [TCP PDU reassembled in 350]"
"350","0.903529","23.13.164.38","100.86.243.187","TLSv1.2","1510","Application Data"
"351","0.903529","23.13.164.38","100.86.243.187","TLSv1.2","1514","Application Data"
"352","0.903530","23.13.164.38","100.86.243.187","TCP","1514","443  >  54993 [ACK] Seq=195657 Ack=10214 Win=9262 Len=1448 TSval=1115522821 TSecr=931489139 [TCP PDU reassembled in 361]"
"353","0.903531","23.13.164.38","100.86.243.187","TCP","1514","443  >  54993 [ACK] Seq=197105 Ack=10214 Win=9262 Len=1448 TSval=1115522821 TSecr=931489139 [TCP PDU reassembled in 361]"
"354","0.903531","23.13.164.38","100.86.243.187","TCP","1514","443  >  54993 [ACK] Seq=198553 Ack=10214 Win=9262 Len=1448 TSval=1115522821 TSecr=931489139 [TCP PDU reassembled in 361]"
"355","0.903532","23.13.164.38","100.86.243.187","TCP","1514","443  >  54993 [ACK] Seq=200001 Ack=10214 Win=9262 Len=1448 TSval=1115522821 TSecr=931489139 [TCP PDU reassembled in 361]"
"356","0.903532","23.13.164.38","100.86.243.187","TCP","1514","443  >  54993 [ACK] Seq=201449 Ack=10214 Win=9262 Len=1448 TSval=1115522821 TSecr=931489139 [TCP PDU reassembled in 361]"
"357","0.903533","23.13.164.38","100.86.243.187","TCP","1514","443  >  54993 [ACK] Seq=202897 Ack=10214 Win=9262 Len=1448 TSval=1115522821 TSecr=931489139 [TCP PDU reassembled in 361]"
"358","0.903534","23.13.164.38","100.86.243.187","TCP","1514","443  >  54993 [ACK] Seq=204345 Ack=10214 Win=9262 Len=1448 TSval=1115522821 TSecr=931489139 [TCP PDU reassembled in 361]"
"359","0.903534","23.13.164.38","100.86.243.187","TCP","1514","443  >  54993 [ACK] Seq=205793 Ack=10214 Win=9262 Len=1448 TSval=1115522821 TSecr=931489139 [TCP PDU reassembled in 361]"
"360","0.903535","23.13.164.38","100.86.243.187","TCP","1514","443  >  54993 [PSH, ACK] Seq=207241 Ack=10214 Win=9262 Len=1448 TSval=1115522821 TSecr=931489139 [TCP PDU reassembled in 361]"
"361","0.903535","23.13.164.38","100.86.243.187","TLSv1.2","1514","Application Data"
"362","0.903536","23.13.164.38","100.86.243.187","TLSv1.2","1514","Application Data"
"363","0.903537","23.13.164.38","100.86.243.187","TCP","1514","443  >  54993 [ACK] Seq=211585 Ack=10214 Win=9262 Len=1448 TSval=1115522822 TSecr=931489139 [TCP PDU reassembled in 372]"
"364","0.903537","23.13.164.38","100.86.243.187","TCP","1514","443  >  54993 [ACK] Seq=213033 Ack=10214 Win=9262 Len=1448 TSval=1115522822 TSecr=931489139 [TCP PDU reassembled in 372]"
"365","0.903538","23.13.164.38","100.86.243.187","TCP","1514","443  >  54993 [ACK] Seq=214481 Ack=10214 Win=9262 Len=1448 TSval=1115522822 TSecr=931489139 [TCP PDU reassembled in 372]"
"366","0.903538","23.13.164.38","100.86.243.187","TCP","1514","443  >  54993 [ACK] Seq=215929 Ack=10214 Win=9262 Len=1448 TSval=1115522822 TSecr=931489139 [TCP PDU reassembled in 372]"
"367","0.903539","23.13.164.38","100.86.243.187","TCP","1514","443  >  54993 [ACK] Seq=217377 Ack=10214 Win=9262 Len=1448 TSval=1115522822 TSecr=931489139 [TCP PDU reassembled in 372]"
"368","0.903539","23.13.164.38","100.86.243.187","TCP","1514","443  >  54993 [ACK] Seq=218825 Ack=10214 Win=9262 Len=1448 TSval=1115522822 TSecr=931489139 [TCP PDU reassembled in 372]"
"369","0.903540","23.13.164.38","100.86.243.187","TCP","1514","443  >  54993 [ACK] Seq=220273 Ack=10214 Win=9262 Len=1448 TSval=1115522822 TSecr=931489139 [TCP PDU reassembled in 372]"
"370","0.903544","23.13.164.38","100.86.243.187","TCP","1514","443  >  54993 [PSH, ACK] Seq=221721 Ack=10214 Win=9262 Len=1448 TSval=1115522822 TSecr=931489139 [TCP PDU reassembled in 372]"
"371","0.903545","23.13.164.38","100.86.243.187","TCP","1514","443  >  54993 [ACK] Seq=223169 Ack=10214 Win=9262 Len=1448 TSval=1115522823 TSecr=931489139 [TCP PDU reassembled in 372]"
"372","0.903545","23.13.164.38","100.86.243.187","TLSv1.2","1514","Application Data"
"373","0.903546","23.13.164.38","100.86.243.187","TLSv1.2","1514","Application Data"
"374","0.903546","23.13.164.38","100.86.243.187","TCP","1514","443  >  54993 [ACK] Seq=227513 Ack=10214 Win=9262 Len=1448 TSval=1115522823 TSecr=931489139 [TCP PDU reassembled in 584]"
"375","0.903547","23.13.164.38","100.86.243.187","TCP","1514","443  >  54993 [ACK] Seq=228961 Ack=10214 Win=9262 Len=1448 TSval=1115522823 TSecr=931489139 [TCP PDU reassembled in 584]"
"376","0.903606","23.13.164.38","100.86.243.187","TCP","1514","443  >  54993 [ACK] Seq=230409 Ack=10214 Win=9262 Len=1448 TSval=1115522823 TSecr=931489139 [TCP PDU reassembled in 584]"
"377","0.903606","23.13.164.38","100.86.243.187","TCP","1514","[TCP Previous segment not captured] 443  >  54993 [ACK] Seq=233305 Ack=10214 Win=9262 Len=1448 TSval=1115522823 TSecr=931489139 [TCP PDU reassembled in 584]"
"378","0.903626","100.86.243.187","23.13.164.38","TCP","66","54993  >  443 [ACK] Seq=10214 Ack=200001 Win=37207 Len=0 TSval=931489196 TSecr=1115522821"
"379","0.903656","100.86.243.187","23.13.164.38","TCP","66","54993  >  443 [ACK] Seq=10214 Ack=215929 Win=36958 Len=0 TSval=931489196 TSecr=1115522822"
"380","0.903669","100.86.243.187","23.13.164.38","TCP","66","54993  >  443 [ACK] Seq=10214 Ack=230409 Win=36732 Len=0 TSval=931489196 TSecr=1115522823"
"381","0.903684","100.86.243.187","23.13.164.38","TCP","66","54993  >  443 [ACK] Seq=10214 Ack=231857 Win=36709 Len=0 TSval=931489196 TSecr=1115522823"
"382","0.903700","100.86.243.187","23.13.164.38","TCP","78","[TCP Dup ACK 381#1] 54993  >  443 [ACK] Seq=10214 Ack=231857 Win=36709 Len=0 TSval=931489196 TSecr=1115522823 SLE=233305 SRE=234753"
"383","0.903762","23.13.164.38","100.86.243.187","TCP","1514","443  >  54993 [ACK] Seq=234753 Ack=10214 Win=9262 Len=1448 TSval=1115522823 TSecr=931489139 [TCP PDU reassembled in 584]"
"384","0.903763","23.13.164.38","100.86.243.187","TCP","1514","443  >  54993 [PSH, ACK] Seq=236201 Ack=10214 Win=9262 Len=1448 TSval=1115522823 TSecr=931489139 [TCP PDU reassembled in 584]"
"385","0.903812","100.86.243.187","23.13.164.38","TCP","78","[TCP Dup ACK 381#2] 54993  >  443 [ACK] Seq=10214 Ack=231857 Win=36867 Len=0 TSval=931489196 TSecr=1115522823 SLE=233305 SRE=237649"
"386","0.903918","23.13.164.38","100.86.243.187","TCP","1514","443  >  54993 [ACK] Seq=237649 Ack=10214 Win=9262 Len=1448 TSval=1115522823 TSecr=931489139 [TCP PDU reassembled in 584], Application Data"
"387","0.903919","23.13.164.38","100.86.243.187","TCP","1514","443  >  54993 [ACK] Seq=239097 Ack=10214 Win=9262 Len=1448 TSval=1115522823 TSecr=931489139 [TCP PDU reassembled in 393]"
"388","0.903965","100.86.243.187","23.13.164.38","TCP","78","[TCP Dup ACK 381#3] 54993  >  443 [ACK] Seq=10214 Ack=231857 Win=37113 Len=0 TSval=931489196 TSecr=1115522823 SLE=233305 SRE=240545"
"389","0.904301","100.86.243.187","23.13.164.38","TCP","78","[TCP Dup ACK 381#4] 54993  >  443 [ACK] Seq=10214 Ack=231857 Win=37456 Len=0 TSval=931489196 TSecr=1115522823 SLE=233305 SRE=240545"
"390","0.905537","23.13.164.38","100.86.243.187","TCP","1514","443  >  54993 [ACK] Seq=240545 Ack=10214 Win=9262 Len=1448 TSval=1115522823 TSecr=931489139 [TCP PDU reassembled in 393]"
"391","0.905538","23.13.164.38","100.86.243.187","TCP","1514","443  >  54993 [ACK] Seq=241993 Ack=10214 Win=9262 Len=1448 TSval=1115522823 TSecr=931489139 [TCP PDU reassembled in 393]"
"392","0.905539","23.13.164.38","100.86.243.187","TCP","1514","443  >  54993 [ACK] Seq=243441 Ack=10214 Win=9262 Len=1448 TSval=1115522823 TSecr=931489139 [TCP PDU reassembled in 393]"
"393","0.905540","23.13.164.38","100.86.243.187","TLSv1.2","805","Application Data"
"394","0.905541","23.13.164.38","100.86.243.187","TLSv1.2","418","Application Data"
"395","0.905541","23.13.164.38","100.86.243.187","TCP","1514","443  >  54993 [ACK] Seq=245980 Ack=10214 Win=9262 Len=1448 TSval=1115522825 TSecr=931489139 [TCP PDU reassembled in 406]"
"396","0.905542","23.13.164.38","100.86.243.187","TCP","1514","443  >  54993 [ACK] Seq=247428 Ack=10214 Win=9262 Len=1448 TSval=1115522825 TSecr=931489139 [TCP PDU reassembled in 406]"
"397","0.905542","23.13.164.38","100.86.243.187","TCP","1514","443  >  54993 [ACK] Seq=248876 Ack=10214 Win=9262 Len=1448 TSval=1115522825 TSecr=931489139 [TCP PDU reassembled in 406]"
"398","0.905543","23.13.164.38","100.86.243.187","TCP","1514","443  >  54993 [ACK] Seq=250324 Ack=10214 Win=9262 Len=1448 TSval=1115522825 TSecr=931489139 [TCP PDU reassembled in 406]"
"399","0.905543","23.13.164.38","100.86.243.187","TCP","1514","443  >  54993 [ACK] Seq=251772 Ack=10214 Win=9262 Len=1448 TSval=1115522825 TSecr=931489139 [TCP PDU reassembled in 406]"
"400","0.905544","23.13.164.38","100.86.243.187","TCP","1514","443  >  54993 [ACK] Seq=253220 Ack=10214 Win=9262 Len=1448 TSval=1115522825 TSecr=931489139 [TCP PDU reassembled in 406]"
"401","0.905544","23.13.164.38","100.86.243.187","TCP","1514","443  >  54993 [ACK] Seq=254668 Ack=10214 Win=9262 Len=1448 TSval=1115522825 TSecr=931489139 [TCP PDU reassembled in 406]"
"402","0.905545","23.13.164.38","100.86.243.187","TCP","1514","443  >  54993 [ACK] Seq=256116 Ack=10214 Win=9262 Len=1448 TSval=1115522825 TSecr=931489139 [TCP PDU reassembled in 406]"
"403","0.905545","23.13.164.38","100.86.243.187","TCP","1514","443  >  54993 [ACK] Seq=257564 Ack=10214 Win=9262 Len=1448 TSval=1115522825 TSecr=931489139 [TCP PDU reassembled in 406]"
"404","0.905546","23.13.164.38","100.86.243.187","TCP","1514","443  >  54993 [PSH, ACK] Seq=259012 Ack=10214 Win=9262 Len=1448 TSval=1115522825 TSecr=931489139 [TCP PDU reassembled in 406]"
"405","0.905546","23.13.164.38","100.86.243.187","TCP","1514","443  >  54993 [ACK] Seq=260460 Ack=10214 Win=9262 Len=1448 TSval=1115522826 TSecr=931489139 [TCP PDU reassembled in 406]"
"406","0.905547","23.13.164.38","100.86.243.187","TLSv1.2","1514","Application Data, Application Data"
"407","0.905547","23.13.164.38","100.86.243.187","TCP","1514","443  >  54993 [ACK] Seq=263356 Ack=10214 Win=9262 Len=1448 TSval=1115522826 TSecr=931489139 [TCP PDU reassembled in 420]"
"408","0.905548","23.13.164.38","100.86.243.187","TCP","1514","443  >  54993 [ACK] Seq=264804 Ack=10214 Win=9262 Len=1448 TSval=1115522826 TSecr=931489139 [TCP PDU reassembled in 420]"
"409","0.905548","23.13.164.38","100.86.243.187","TCP","1514","443  >  54993 [ACK] Seq=266252 Ack=10214 Win=9262 Len=1448 TSval=1115522826 TSecr=931489139 [TCP PDU reassembled in 420]"
"410","0.905549","23.13.164.38","100.86.243.187","TCP","1514","443  >  54993 [ACK] Seq=267700 Ack=10214 Win=9262 Len=1448 TSval=1115522826 TSecr=931489139 [TCP PDU reassembled in 420]"
"411","0.905550","23.13.164.38","100.86.243.187","TCP","1514","443  >  54993 [ACK] Seq=269148 Ack=10214 Win=9262 Len=1448 TSval=1115522826 TSecr=931489139 [TCP PDU reassembled in 420]"
"412","0.905550","23.13.164.38","100.86.243.187","TCP","1514","443  >  54993 [ACK] Seq=270596 Ack=10214 Win=9262 Len=1448 TSval=1115522826 TSecr=931489139 [TCP PDU reassembled in 420]"
"413","0.905551","23.13.164.38","100.86.243.187","TCP","1514","443  >  54993 [ACK] Seq=272044 Ack=10214 Win=9262 Len=1448 TSval=1115522826 TSecr=931489139 [TCP PDU reassembled in 420]"
"414","0.905628","100.86.243.187","23.13.164.38","TCP","78","[TCP Dup ACK 381#5] 54993  >  443 [ACK] Seq=10214 Ack=231857 Win=37456 Len=0 TSval=931489198 TSecr=1115522823 SLE=233305 SRE=256116"
"415","0.905654","100.86.243.187","23.13.164.38","TCP","78","[TCP Dup ACK 381#6] 54993  >  443 [ACK] Seq=10214 Ack=231857 Win=37456 Len=0 TSval=931489198 TSecr=1115522823 SLE=233305 SRE=272044"
"416","0.905666","100.86.243.187","23.13.164.38","TCP","78","[TCP Dup ACK 381#7] 54993  >  443 [ACK] Seq=10214 Ack=231857 Win=37456 Len=0 TSval=931489198 TSecr=1115522823 SLE=233305 SRE=273492"
"417","0.905829","23.13.164.38","100.86.243.187","TCP","1514","443  >  54993 [PSH, ACK] Seq=273492 Ack=10214 Win=9262 Len=1448 TSval=1115522826 TSecr=931489139 [TCP PDU reassembled in 420]"
"418","0.905830","23.13.164.38","100.86.243.187","TCP","1514","443  >  54993 [ACK] Seq=274940 Ack=10214 Win=9262 Len=1448 TSval=1115522826 TSecr=931489139 [TCP PDU reassembled in 420]"
"419","0.905830","23.13.164.38","100.86.243.187","TCP","1514","443  >  54993 [ACK] Seq=276388 Ack=10214 Win=9262 Len=1448 TSval=1115522826 TSecr=931489139 [TCP PDU reassembled in 420]"
"420","0.905831","23.13.164.38","100.86.243.187","TLSv1.2","1514","Application Data, Application Data"
"421","0.905831","23.13.164.38","100.86.243.187","TCP","1514","443  >  54993 [ACK] Seq=279284 Ack=10214 Win=9262 Len=1448 TSval=1115522826 TSecr=931489139 [TCP PDU reassembled in 585]"
"422","0.905832","23.13.164.38","100.86.243.187","TCP","1514","443  >  54993 [ACK] Seq=280732 Ack=10214 Win=9262 Len=1448 TSval=1115522826 TSecr=931489139 [TCP PDU reassembled in 585]"
"423","0.905876","100.86.243.187","23.13.164.38","TCP","78","[TCP Dup ACK 381#8] 54993  >  443 [ACK] Seq=10214 Ack=231857 Win=37456 Len=0 TSval=931489198 TSecr=1115522823 SLE=233305 SRE=282180"
"424","0.906235","23.13.164.38","100.86.243.187","TCP","1514","443  >  54993 [ACK] Seq=282180 Ack=10214 Win=9262 Len=1448 TSval=1115522826 TSecr=931489139 [TCP PDU reassembled in 585]"
"425","0.906235","23.13.164.38","100.86.243.187","TCP","1514","443  >  54993 [ACK] Seq=283628 Ack=10214 Win=9262 Len=1448 TSval=1115522826 TSecr=931489139 [TCP PDU reassembled in 585]"
"426","0.906236","23.13.164.38","100.86.243.187","TCP","1514","443  >  54993 [ACK] Seq=285076 Ack=10214 Win=9262 Len=1448 TSval=1115522826 TSecr=931489139 [TCP PDU reassembled in 585]"
"427","0.906236","23.13.164.38","100.86.243.187","TCP","1514","443  >  54993 [ACK] Seq=286524 Ack=10214 Win=9262 Len=1448 TSval=1115522826 TSecr=931489139 [TCP PDU reassembled in 585]"
"428","0.906279","100.86.243.187","23.13.164.38","TCP","78","[TCP Dup ACK 381#9] 54993  >  443 [ACK] Seq=10214 Ack=231857 Win=37456 Len=0 TSval=931489198 TSecr=1115522823 SLE=233305 SRE=287972"
"429","0.907629","23.13.164.38","100.86.243.187","TCP","1514","443  >  54993 [PSH, ACK] Seq=287972 Ack=10214 Win=9262 Len=1448 TSval=1115522826 TSecr=931489139 [TCP PDU reassembled in 585]"
"430","0.907630","23.13.164.38","100.86.243.187","TCP","1514","443  >  54993 [ACK] Seq=289420 Ack=10214 Win=9262 Len=1448 TSval=1115522827 TSecr=931489139 [TCP PDU reassembled in 585]"
"431","0.907630","23.13.164.38","100.86.243.187","TCP","1514","443  >  54993 [ACK] Seq=290868 Ack=10214 Win=9262 Len=1448 TSval=1115522827 TSecr=931489139 [TCP PDU reassembled in 585]"
"432","0.907631","23.13.164.38","100.86.243.187","TCP","1514","443  >  54993 [ACK] Seq=292316 Ack=10214 Win=9262 Len=1448 TSval=1115522827 TSecr=931489139 [TCP PDU reassembled in 585]"
"433","0.907684","100.86.243.187","23.13.164.38","TCP","78","[TCP Dup ACK 381#10] 54993  >  443 [ACK] Seq=10214 Ack=231857 Win=37456 Len=0 TSval=931489200 TSecr=1115522823 SLE=233305 SRE=293764"
"434","0.908288","23.13.164.38","100.86.243.187","TCP","1514","443  >  54993 [ACK] Seq=293764 Ack=10214 Win=9262 Len=1448 TSval=1115522827 TSecr=931489139 [TCP PDU reassembled in 585]"
"435","0.908289","23.13.164.38","100.86.243.187","TCP","1514","[TCP Previous segment not captured] 443  >  54993 [ACK] Seq=296660 Ack=10214 Win=9262 Len=1448 TSval=1115522827 TSecr=931489139"
"436","0.908359","100.86.243.187","23.13.164.38","TCP","78","[TCP Dup ACK 381#11] 54993  >  443 [ACK] Seq=10214 Ack=231857 Win=37456 Len=0 TSval=931489200 TSecr=1115522823 SLE=233305 SRE=295212"
"437","0.908396","100.86.243.187","23.13.164.38","TCP","86","[TCP Dup ACK 381#12] 54993  >  443 [ACK] Seq=10214 Ack=231857 Win=37456 Len=0 TSval=931489200 TSecr=1115522823 SLE=296660 SRE=298108 SLE=233305 SRE=295212"
"438","0.909476","23.13.164.38","100.86.243.187","TCP","1514","443  >  54993 [ACK] Seq=298108 Ack=10214 Win=9262 Len=1448 TSval=1115522827 TSecr=931489139"
"439","0.909477","23.13.164.38","100.86.243.187","TCP","1514","443  >  54993 [ACK] Seq=299556 Ack=10214 Win=9262 Len=1448 TSval=1115522827 TSecr=931489139"
"440","0.909478","23.13.164.38","100.86.243.187","TCP","1514","443  >  54993 [ACK] Seq=301004 Ack=10214 Win=9262 Len=1448 TSval=1115522827 TSecr=931489139"
"441","0.909479","23.13.164.38","100.86.243.187","TCP","1514","443  >  54993 [PSH, ACK] Seq=302452 Ack=10214 Win=9262 Len=1448 TSval=1115522827 TSecr=931489139"
"442","0.909479","23.13.164.38","100.86.243.187","TCP","1514","443  >  54993 [ACK] Seq=303900 Ack=10214 Win=9262 Len=1448 TSval=1115522828 TSecr=931489139"
"443","0.909480","23.13.164.38","100.86.243.187","TCP","1514","443  >  54993 [ACK] Seq=305348 Ack=10214 Win=9262 Len=1448 TSval=1115522828 TSecr=931489139"
"444","0.909480","23.13.164.38","100.86.243.187","TCP","1514","443  >  54993 [ACK] Seq=306796 Ack=10214 Win=9262 Len=1448 TSval=1115522828 TSecr=931489139"
"445","0.909481","23.13.164.38","100.86.243.187","TCP","1514","443  >  54993 [ACK] Seq=308244 Ack=10214 Win=9262 Len=1448 TSval=1115522828 TSecr=931489139 [TCP PDU reassembled in 483]"
"446","0.909482","23.13.164.38","100.86.243.187","TCP","1514","443  >  54993 [ACK] Seq=309692 Ack=10214 Win=9262 Len=1448 TSval=1115522828 TSecr=931489139 [TCP PDU reassembled in 483]"
"447","0.909483","23.13.164.38","100.86.243.187","TCP","1514","443  >  54993 [ACK] Seq=311140 Ack=10214 Win=9262 Len=1448 TSval=1115522828 TSecr=931489139 [TCP PDU reassembled in 483]"
"448","0.909484","23.13.164.38","100.86.243.187","TCP","1514","443  >  54993 [ACK] Seq=312588 Ack=10214 Win=9262 Len=1448 TSval=1115522828 TSecr=931489139 [TCP PDU reassembled in 483]"
"449","0.909484","23.13.164.38","100.86.243.187","TCP","1514","443  >  54993 [ACK] Seq=314036 Ack=10214 Win=9262 Len=1448 TSval=1115522828 TSecr=931489139 [TCP PDU reassembled in 483]"
"450","0.909485","23.13.164.38","100.86.243.187","TCP","1514","443  >  54993 [ACK] Seq=315484 Ack=10214 Win=9262 Len=1448 TSval=1115522828 TSecr=931489139 [TCP PDU reassembled in 483]"
"451","0.909486","23.13.164.38","100.86.243.187","TCP","1514","443  >  54993 [PSH, ACK] Seq=316932 Ack=10214 Win=9262 Len=1448 TSval=1115522828 TSecr=931489139 [TCP PDU reassembled in 483]"
"452","0.909486","23.13.164.38","100.86.243.187","TCP","1514","443  >  54993 [ACK] Seq=318380 Ack=10214 Win=9262 Len=1448 TSval=1115522829 TSecr=931489139 [TCP PDU reassembled in 483]"
"453","0.909487","23.13.164.38","100.86.243.187","TCP","1514","443  >  54993 [ACK] Seq=319828 Ack=10214 Win=9262 Len=1448 TSval=1115522829 TSecr=931489139 [TCP PDU reassembled in 483]"
"454","0.909488","23.13.164.38","100.86.243.187","TCP","1514","443  >  54993 [ACK] Seq=321276 Ack=10214 Win=9262 Len=1448 TSval=1115522829 TSecr=931489139 [TCP PDU reassembled in 483]"
"455","0.909489","23.13.164.38","100.86.243.187","TCP","1514","443  >  54993 [ACK] Seq=322724 Ack=10214 Win=9262 Len=1448 TSval=1115522829 TSecr=931489139 [TCP PDU reassembled in 483]"
"456","0.909490","23.13.164.38","100.86.243.187","TCP","1514","443  >  54993 [ACK] Seq=324172 Ack=10214 Win=9262 Len=1448 TSval=1115522829 TSecr=931489139 [TCP PDU reassembled in 483]"
"457","0.909490","23.13.164.38","100.86.243.187","TCP","1514","443  >  54993 [ACK] Seq=325620 Ack=10214 Win=9262 Len=1448 TSval=1115522829 TSecr=931489139 [TCP PDU reassembled in 483]"
"458","0.909491","23.13.164.38","100.86.243.187","TCP","1514","443  >  54993 [ACK] Seq=327068 Ack=10214 Win=9262 Len=1448 TSval=1115522829 TSecr=931489139 [TCP PDU reassembled in 483]"
"459","0.909491","23.13.164.38","100.86.243.187","TCP","1514","443  >  54993 [ACK] Seq=328516 Ack=10214 Win=9262 Len=1448 TSval=1115522829 TSecr=931489139 [TCP PDU reassembled in 483]"
"460","0.909578","100.86.243.187","23.13.164.38","TCP","86","[TCP Dup ACK 381#13] 54993  >  443 [ACK] Seq=10214 Ack=231857 Win=37456 Len=0 TSval=931489202 TSecr=1115522823 SLE=296660 SRE=314036 SLE=233305 SRE=295212"
"461","0.909614","23.13.164.38","100.86.243.187","TCP","1514","443  >  54993 [ACK] Seq=329964 Ack=10214 Win=9262 Len=1448 TSval=1115522829 TSecr=931489139 [TCP PDU reassembled in 483]"
"462","0.909615","23.13.164.38","100.86.243.187","TCP","1514","443  >  54993 [PSH, ACK] Seq=331412 Ack=10214 Win=9262 Len=1448 TSval=1115522829 TSecr=931489139 [TCP PDU reassembled in 483]"
"463","0.909653","100.86.243.187","23.13.164.38","TCP","86","[TCP Dup ACK 381#14] 54993  >  443 [ACK] Seq=10214 Ack=231857 Win=37456 Len=0 TSval=931489202 TSecr=1115522823 SLE=296660 SRE=329964 SLE=233305 SRE=295212"
"464","0.909676","100.86.243.187","23.13.164.38","TCP","86","[TCP Dup ACK 381#15] 54993  >  443 [ACK] Seq=10214 Ack=231857 Win=37456 Len=0 TSval=931489202 TSecr=1115522823 SLE=296660 SRE=332860 SLE=233305 SRE=295212"
"465","0.911769","23.13.164.38","100.86.243.187","TCP","1514","443  >  54993 [ACK] Seq=332860 Ack=10214 Win=9262 Len=1448 TSval=1115522830 TSecr=931489139 [TCP PDU reassembled in 483]"
"466","0.911773","23.13.164.38","100.86.243.187","TCP","1514","443  >  54993 [ACK] Seq=334308 Ack=10214 Win=9262 Len=1448 TSval=1115522830 TSecr=931489139 [TCP PDU reassembled in 483]"
"467","0.911775","23.13.164.38","100.86.243.187","TCP","1514","443  >  54993 [ACK] Seq=335756 Ack=10214 Win=9262 Len=1448 TSval=1115522830 TSecr=931489139 [TCP PDU reassembled in 483]"
"468","0.911776","23.13.164.38","100.86.243.187","TCP","1514","443  >  54993 [ACK] Seq=337204 Ack=10214 Win=9262 Len=1448 TSval=1115522830 TSecr=931489139 [TCP PDU reassembled in 483]"
"469","0.911777","23.13.164.38","100.86.243.187","TCP","1227","443  >  54993 [PSH, ACK] Seq=338652 Ack=10214 Win=9262 Len=1161 TSval=1115522830 TSecr=931489139 [TCP PDU reassembled in 483]"
"470","0.911778","23.13.164.38","100.86.243.187","TCP","407","443  >  54993 [PSH, ACK] Seq=339813 Ack=10214 Win=9262 Len=341 TSval=1115522849 TSecr=931489139 [TCP PDU reassembled in 483]"
"471","0.911778","23.13.164.38","100.86.243.187","TCP","1514","443  >  54993 [ACK] Seq=340154 Ack=10214 Win=9262 Len=1448 TSval=1115522849 TSecr=931489139 [TCP PDU reassembled in 483]"
"472","0.911779","23.13.164.38","100.86.243.187","TCP","1514","443  >  54993 [ACK] Seq=341602 Ack=10214 Win=9262 Len=1448 TSval=1115522849 TSecr=931489139 [TCP PDU reassembled in 483]"
"473","0.911781","23.13.164.38","100.86.243.187","TCP","1514","443  >  54993 [ACK] Seq=343050 Ack=10214 Win=9262 Len=1448 TSval=1115522849 TSecr=931489139 [TCP PDU reassembled in 483]"
"474","0.911782","23.13.164.38","100.86.243.187","TCP","1514","443  >  54993 [ACK] Seq=344498 Ack=10214 Win=9262 Len=1448 TSval=1115522849 TSecr=931489139 [TCP PDU reassembled in 483]"
"475","0.911924","100.86.243.187","23.13.164.38","TCP","86","[TCP Dup ACK 381#16] 54993  >  443 [ACK] Seq=10214 Ack=231857 Win=37456 Len=0 TSval=931489205 TSecr=1115522823 SLE=296660 SRE=345946 SLE=233305 SRE=295212"
"476","0.912883","23.13.164.38","100.86.243.187","TCP","1514","443  >  54993 [ACK] Seq=345946 Ack=10214 Win=9262 Len=1448 TSval=1115522849 TSecr=931489139 [TCP PDU reassembled in 483]"
"477","0.912884","23.13.164.38","100.86.243.187","TCP","1514","443  >  54993 [ACK] Seq=347394 Ack=10214 Win=9262 Len=1448 TSval=1115522849 TSecr=931489139 [TCP PDU reassembled in 483]"
"478","0.912885","23.13.164.38","100.86.243.187","TCP","1514","443  >  54993 [ACK] Seq=348842 Ack=10214 Win=9262 Len=1448 TSval=1115522849 TSecr=931489139 [TCP PDU reassembled in 483]"
"479","0.912885","23.13.164.38","100.86.243.187","TCP","1049","443  >  54993 [PSH, ACK] Seq=350290 Ack=10214 Win=9262 Len=983 TSval=1115522849 TSecr=931489139 [TCP PDU reassembled in 483]"
"480","0.912886","23.13.164.38","100.86.243.187","TCP","407","443  >  54993 [PSH, ACK] Seq=351273 Ack=10214 Win=9262 Len=341 TSval=1115522849 TSecr=931489139 [TCP PDU reassembled in 483]"
"481","0.912887","23.13.164.38","100.86.243.187","TCP","1514","443  >  54993 [ACK] Seq=351614 Ack=10214 Win=9262 Len=1448 TSval=1115522849 TSecr=931489139 [TCP PDU reassembled in 483]"
"482","0.912887","23.13.164.38","100.86.243.187","TCP","1514","443  >  54993 [ACK] Seq=353062 Ack=10214 Win=9262 Len=1448 TSval=1115522849 TSecr=931489139 [TCP PDU reassembled in 483]"
"483","0.912889","23.13.164.38","100.86.243.187","TLSv1.2","1514","Encrypted Alert, Ignored Unknown Record"
"484","0.912889","23.13.164.38","100.86.243.187","TLSv1.2","1514","Ignored Unknown Record"
"485","0.912890","23.13.164.38","100.86.243.187","TLSv1.2","1514","Ignored Unknown Record"
"486","0.912891","23.13.164.38","100.86.243.187","TLSv1.2","1514","Ignored Unknown Record"
"487","0.912892","23.13.164.38","100.86.243.187","TLSv1.2","1514","Ignored Unknown Record"
"488","0.912963","100.86.243.187","23.13.164.38","TCP","86","[TCP Dup ACK 381#17] 54993  >  443 [ACK] Seq=10214 Ack=231857 Win=37456 Len=0 TSval=931489206 TSecr=1115522823 SLE=296660 SRE=361750 SLE=233305 SRE=295212"
"489","0.912983","23.13.164.38","100.86.243.187","TLSv1.2","439","Ignored Unknown Record"
"490","0.912983","23.13.164.38","100.86.243.187","TLSv1.2","1514","Application Data"
"491","0.913019","100.86.243.187","23.13.164.38","TCP","86","[TCP Dup ACK 381#18] 54993  >  443 [ACK] Seq=10214 Ack=231857 Win=37456 Len=0 TSval=931489206 TSecr=1115522823 SLE=296660 SRE=363571 SLE=233305 SRE=295212"
"492","0.913335","23.13.164.38","100.86.243.187","TCP","1514","443  >  54993 [ACK] Seq=363571 Ack=10214 Win=9262 Len=1448 TSval=1115522850 TSecr=931489139 [TCP PDU reassembled in 496]"
"493","0.913335","23.13.164.38","100.86.243.187","TCP","1514","443  >  54993 [ACK] Seq=365019 Ack=10214 Win=9262 Len=1448 TSval=1115522850 TSecr=931489139 [TCP PDU reassembled in 496]"
"494","0.913336","23.13.164.38","100.86.243.187","TCP","1514","443  >  54993 [ACK] Seq=366467 Ack=10214 Win=9262 Len=1448 TSval=1115522850 TSecr=931489139 [TCP PDU reassembled in 496]"
"495","0.913337","23.13.164.38","100.86.243.187","TCP","1514","443  >  54993 [ACK] Seq=367915 Ack=10214 Win=9262 Len=1448 TSval=1115522850 TSecr=931489139 [TCP PDU reassembled in 496]"
"496","0.913338","23.13.164.38","100.86.243.187","TLSv1.2","1514","Application Data, Application Data"
"497","0.913339","23.13.164.38","100.86.243.187","TCP","1514","443  >  54993 [ACK] Seq=370811 Ack=10214 Win=9262 Len=1448 TSval=1115522850 TSecr=931489139 [TCP PDU reassembled in 507]"
"498","0.913391","100.86.243.187","23.13.164.38","TCP","86","[TCP Dup ACK 381#19] 54993  >  443 [ACK] Seq=10214 Ack=231857 Win=37456 Len=0 TSval=931489206 TSecr=1115522823 SLE=296660 SRE=372259 SLE=233305 SRE=295212"
"499","0.913676","23.13.164.38","100.86.243.187","TCP","1514","443  >  54993 [ACK] Seq=372259 Ack=10214 Win=9262 Len=1448 TSval=1115522850 TSecr=931489139 [TCP PDU reassembled in 507]"
"500","0.913677","23.13.164.38","100.86.243.187","TCP","1514","443  >  54993 [ACK] Seq=373707 Ack=10214 Win=9262 Len=1448 TSval=1115522850 TSecr=931489139 [TCP PDU reassembled in 507]"
"501","0.913677","23.13.164.38","100.86.243.187","TCP","1514","443  >  54993 [PSH, ACK] Seq=375155 Ack=10214 Win=9262 Len=1448 TSval=1115522850 TSecr=931489139 [TCP PDU reassembled in 507]"
"502","0.913678","23.13.164.38","100.86.243.187","TCP","1514","443  >  54993 [ACK] Seq=376603 Ack=10214 Win=9262 Len=1448 TSval=1115522851 TSecr=931489139 [TCP PDU reassembled in 507]"
"503","0.913721","100.86.243.187","23.13.164.38","TCP","86","[TCP Dup ACK 381#20] 54993  >  443 [ACK] Seq=10214 Ack=231857 Win=37456 Len=0 TSval=931489206 TSecr=1115522823 SLE=296660 SRE=378051 SLE=233305 SRE=295212"
"504","0.913854","23.13.164.38","100.86.243.187","TCP","1514","443  >  54993 [ACK] Seq=378051 Ack=10214 Win=9262 Len=1448 TSval=1115522851 TSecr=931489139 [TCP PDU reassembled in 507]"
"505","0.913854","23.13.164.38","100.86.243.187","TCP","1514","443  >  54993 [ACK] Seq=379499 Ack=10214 Win=9262 Len=1448 TSval=1115522851 TSecr=931489139 [TCP PDU reassembled in 507]"
"506","0.913897","100.86.243.187","23.13.164.38","TCP","86","[TCP Dup ACK 381#21] 54993  >  443 [ACK] Seq=10214 Ack=231857 Win=37456 Len=0 TSval=931489206 TSecr=1115522823 SLE=296660 SRE=380947 SLE=233305 SRE=295212"
"507","0.913984","23.13.164.38","100.86.243.187","TLSv1.2","1514","Application Data, Application Data"
"508","0.913984","23.13.164.38","100.86.243.187","TCP","1514","443  >  54993 [ACK] Seq=382395 Ack=10214 Win=9262 Len=1448 TSval=1115522851 TSecr=931489139 [TCP PDU reassembled in 516]"
"509","0.914026","100.86.243.187","23.13.164.38","TCP","86","[TCP Dup ACK 381#22] 54993  >  443 [ACK] Seq=10214 Ack=231857 Win=37456 Len=0 TSval=931489207 TSecr=1115522823 SLE=296660 SRE=383843 SLE=233305 SRE=295212"
"510","0.916788","23.13.164.38","100.86.243.187","TCP","1514","443  >  54993 [ACK] Seq=383843 Ack=10214 Win=9262 Len=1448 TSval=1115522851 TSecr=931489139 [TCP PDU reassembled in 516]"
"511","0.916789","23.13.164.38","100.86.243.187","TCP","1514","443  >  54993 [ACK] Seq=385291 Ack=10214 Win=9262 Len=1448 TSval=1115522851 TSecr=931489139 [TCP PDU reassembled in 516]"
"512","0.916790","23.13.164.38","100.86.243.187","TCP","1514","443  >  54993 [ACK] Seq=386739 Ack=10214 Win=9262 Len=1448 TSval=1115522851 TSecr=931489139 [TCP PDU reassembled in 516]"
"513","0.916791","23.13.164.38","100.86.243.187","TCP","1514","443  >  54993 [ACK] Seq=388187 Ack=10214 Win=9262 Len=1448 TSval=1115522851 TSecr=931489139 [TCP PDU reassembled in 516]"
"514","0.916860","100.86.243.187","23.13.164.38","TCP","86","[TCP Dup ACK 381#23] 54993  >  443 [ACK] Seq=10214 Ack=231857 Win=37456 Len=0 TSval=931489210 TSecr=1115522823 SLE=296660 SRE=389635 SLE=233305 SRE=295212"
"515","0.918676","23.13.164.38","100.86.243.187","TCP","1514","443  >  54993 [PSH, ACK] Seq=389635 Ack=10214 Win=9262 Len=1448 TSval=1115522851 TSecr=931489139 [TCP PDU reassembled in 516]"
"516","0.918677","23.13.164.38","100.86.243.187","TLSv1.2","1514","Application Data, Application Data"
"517","0.918678","23.13.164.38","100.86.243.187","TCP","1514","443  >  54993 [ACK] Seq=392531 Ack=10214 Win=9262 Len=1448 TSval=1115522852 TSecr=931489139 [TCP PDU reassembled in 522]"
"518","0.918679","23.13.164.38","100.86.243.187","TCP","1514","443  >  54993 [ACK] Seq=393979 Ack=10214 Win=9262 Len=1448 TSval=1115522852 TSecr=931489139 [TCP PDU reassembled in 522]"
"519","0.918679","23.13.164.38","100.86.243.187","TCP","1514","443  >  54993 [ACK] Seq=395427 Ack=10214 Win=9262 Len=1448 TSval=1115522852 TSecr=931489139 [TCP PDU reassembled in 522]"
"520","0.918680","23.13.164.38","100.86.243.187","TCP","1514","443  >  54993 [ACK] Seq=396875 Ack=10214 Win=9262 Len=1448 TSval=1115522852 TSecr=931489139 [TCP PDU reassembled in 522]"
"521","0.918680","23.13.164.38","100.86.243.187","TCP","1514","443  >  54993 [ACK] Seq=398323 Ack=10214 Win=9262 Len=1448 TSval=1115522852 TSecr=931489139 [TCP PDU reassembled in 522]"
"522","0.918681","23.13.164.38","100.86.243.187","TLSv1.2","1514","Application Data, Application Data"
"523","0.918682","23.13.164.38","100.86.243.187","TCP","1514","443  >  54993 [ACK] Seq=401219 Ack=10214 Win=9262 Len=1448 TSval=1115522852 TSecr=931489139 [TCP PDU reassembled in 534]"
"524","0.918683","23.13.164.38","100.86.243.187","TCP","1514","443  >  54993 [ACK] Seq=402667 Ack=10214 Win=9262 Len=1448 TSval=1115522852 TSecr=931489139 [TCP PDU reassembled in 534]"
"525","0.918684","23.13.164.38","100.86.243.187","TCP","1514","443  >  54993 [PSH, ACK] Seq=404115 Ack=10214 Win=9262 Len=1448 TSval=1115522852 TSecr=931489139 [TCP PDU reassembled in 534]"
"526","0.918684","23.13.164.38","100.86.243.187","TCP","1514","443  >  54993 [ACK] Seq=405563 Ack=10214 Win=9262 Len=1448 TSval=1115522853 TSecr=931489139 [TCP PDU reassembled in 534]"
"527","0.918685","23.13.164.38","100.86.243.187","TCP","1514","443  >  54993 [ACK] Seq=407011 Ack=10214 Win=9262 Len=1448 TSval=1115522853 TSecr=931489139 [TCP PDU reassembled in 534]"
"528","0.918686","23.13.164.38","100.86.243.187","TCP","1514","443  >  54993 [ACK] Seq=408459 Ack=10214 Win=9262 Len=1448 TSval=1115522853 TSecr=931489139 [TCP PDU reassembled in 534]"
"529","0.918686","23.13.164.38","100.86.243.187","TCP","1514","443  >  54993 [ACK] Seq=409907 Ack=10214 Win=9262 Len=1448 TSval=1115522853 TSecr=931489139 [TCP PDU reassembled in 534]"
"530","0.918687","23.13.164.38","100.86.243.187","TCP","1514","443  >  54993 [ACK] Seq=411355 Ack=10214 Win=9262 Len=1448 TSval=1115522853 TSecr=931489139 [TCP PDU reassembled in 534]"
"531","0.918688","23.13.164.38","100.86.243.187","TCP","1514","443  >  54993 [ACK] Seq=412803 Ack=10214 Win=9262 Len=1448 TSval=1115522853 TSecr=931489139 [TCP PDU reassembled in 534]"
"532","0.918688","23.13.164.38","100.86.243.187","TCP","1514","443  >  54993 [ACK] Seq=414251 Ack=10214 Win=9262 Len=1448 TSval=1115522853 TSecr=931489139 [TCP PDU reassembled in 534]"
"533","0.918689","23.13.164.38","100.86.243.187","TCP","1514","443  >  54993 [ACK] Seq=415699 Ack=10214 Win=9262 Len=1448 TSval=1115522853 TSecr=931489139 [TCP PDU reassembled in 534]"
"534","0.918689","23.13.164.38","100.86.243.187","TLSv1.2","1514","Application Data, Application Data"
"535","0.918690","23.13.164.38","100.86.243.187","TCP","1514","443  >  54993 [PSH, ACK] Seq=418595 Ack=10214 Win=9262 Len=1448 TSval=1115522853 TSecr=931489139 [TCP PDU reassembled in 545]"
"536","0.918691","23.13.164.38","100.86.243.187","TCP","1514","443  >  54993 [ACK] Seq=420043 Ack=10214 Win=9262 Len=1448 TSval=1115522854 TSecr=931489139 [TCP PDU reassembled in 545]"
"537","0.918691","23.13.164.38","100.86.243.187","TCP","1514","443  >  54993 [ACK] Seq=421491 Ack=10214 Win=9262 Len=1448 TSval=1115522854 TSecr=931489139 [TCP PDU reassembled in 545]"
"538","0.918692","23.13.164.38","100.86.243.187","TCP","1514","443  >  54993 [ACK] Seq=422939 Ack=10214 Win=9262 Len=1448 TSval=1115522854 TSecr=931489139 [TCP PDU reassembled in 545]"
"539","0.918694","23.13.164.38","100.86.243.187","TCP","1514","443  >  54993 [ACK] Seq=424387 Ack=10214 Win=9262 Len=1448 TSval=1115522854 TSecr=931489139 [TCP PDU reassembled in 545]"
"540","0.918695","23.13.164.38","100.86.243.187","TCP","1514","443  >  54993 [ACK] Seq=425835 Ack=10214 Win=9262 Len=1448 TSval=1115522854 TSecr=931489139 [TCP PDU reassembled in 545]"
"541","0.918696","23.13.164.38","100.86.243.187","TCP","1514","443  >  54993 [ACK] Seq=427283 Ack=10214 Win=9262 Len=1448 TSval=1115522854 TSecr=931489139 [TCP PDU reassembled in 545]"
"542","0.918696","23.13.164.38","100.86.243.187","TCP","1514","443  >  54993 [ACK] Seq=428731 Ack=10214 Win=9262 Len=1448 TSval=1115522854 TSecr=931489139 [TCP PDU reassembled in 545]"
"543","0.918697","23.13.164.38","100.86.243.187","TCP","1514","443  >  54993 [ACK] Seq=430179 Ack=10214 Win=9262 Len=1448 TSval=1115522854 TSecr=931489139 [TCP PDU reassembled in 545]"
"544","0.918698","23.13.164.38","100.86.243.187","TCP","1514","443  >  54993 [ACK] Seq=431627 Ack=10214 Win=9262 Len=1448 TSval=1115522854 TSecr=931489139 [TCP PDU reassembled in 545]"
"545","0.918698","23.13.164.38","100.86.243.187","TLSv1.2","1514","Application Data, Application Data"
"546","0.918699","23.13.164.38","100.86.243.187","TCP","1514","443  >  54993 [ACK] Seq=434523 Ack=10214 Win=9262 Len=1448 TSval=1115522855 TSecr=931489139 [TCP PDU reassembled in 552]"
"547","0.918699","23.13.164.38","100.86.243.187","TCP","1514","443  >  54993 [ACK] Seq=435971 Ack=10214 Win=9262 Len=1448 TSval=1115522855 TSecr=931489139 [TCP PDU reassembled in 552]"
"548","0.918700","23.13.164.38","100.86.243.187","TCP","1514","443  >  54993 [ACK] Seq=437419 Ack=10214 Win=9262 Len=1448 TSval=1115522855 TSecr=931489139 [TCP PDU reassembled in 552]"
"549","0.918701","23.13.164.38","100.86.243.187","TCP","1514","443  >  54993 [ACK] Seq=438867 Ack=10214 Win=9262 Len=1448 TSval=1115522855 TSecr=931489139 [TCP PDU reassembled in 552]"
"550","0.918701","23.13.164.38","100.86.243.187","TCP","1514","443  >  54993 [ACK] Seq=440315 Ack=10214 Win=9262 Len=1448 TSval=1115522855 TSecr=931489139 [TCP PDU reassembled in 552]"
"551","0.918702","23.13.164.38","100.86.243.187","TCP","1514","443  >  54993 [ACK] Seq=441763 Ack=10214 Win=9262 Len=1448 TSval=1115522855 TSecr=931489139 [TCP PDU reassembled in 552]"
"552","0.918703","23.13.164.38","100.86.243.187","TLSv1.2","1514","Application Data, Application Data"
"553","0.918703","23.13.164.38","100.86.243.187","TCP","1514","443  >  54993 [ACK] Seq=444659 Ack=10214 Win=9262 Len=1448 TSval=1115522855 TSecr=931489139 [TCP PDU reassembled in 565]"
"554","0.918704","23.13.164.38","100.86.243.187","TCP","1514","443  >  54993 [ACK] Seq=446107 Ack=10214 Win=9262 Len=1448 TSval=1115522855 TSecr=931489139 [TCP PDU reassembled in 565]"
"555","0.918813","100.86.243.187","23.13.164.38","TCP","86","[TCP Dup ACK 381#24] 54993  >  443 [ACK] Seq=10214 Ack=231857 Win=37456 Len=0 TSval=931489212 TSecr=1115522823 SLE=296660 SRE=405563 SLE=233305 SRE=295212"
"556","0.918837","100.86.243.187","23.13.164.38","TCP","86","[TCP Dup ACK 381#25] 54993  >  443 [ACK] Seq=10214 Ack=231857 Win=37456 Len=0 TSval=931489212 TSecr=1115522823 SLE=296660 SRE=421491 SLE=233305 SRE=295212"
"557","0.918850","100.86.243.187","23.13.164.38","TCP","86","[TCP Dup ACK 381#26] 54993  >  443 [ACK] Seq=10214 Ack=231857 Win=37456 Len=0 TSval=931489212 TSecr=1115522823 SLE=296660 SRE=435971 SLE=233305 SRE=295212"
"558","0.918861","100.86.243.187","23.13.164.38","TCP","86","[TCP Dup ACK 381#27] 54993  >  443 [ACK] Seq=10214 Ack=231857 Win=37456 Len=0 TSval=931489212 TSecr=1115522823 SLE=296660 SRE=447555 SLE=233305 SRE=295212"
"559","0.919297","23.13.164.38","100.86.243.187","TCP","1514","443  >  54993 [PSH, ACK] Seq=447555 Ack=10214 Win=9262 Len=1448 TSval=1115522855 TSecr=931489139 [TCP PDU reassembled in 565]"
"560","0.919297","23.13.164.38","100.86.243.187","TCP","1514","443  >  54993 [ACK] Seq=449003 Ack=10214 Win=9262 Len=1448 TSval=1115522856 TSecr=931489139 [TCP PDU reassembled in 565]"
"561","0.919363","100.86.243.187","23.13.164.38","TCP","86","[TCP Dup ACK 381#28] 54993  >  443 [ACK] Seq=10214 Ack=231857 Win=37456 Len=0 TSval=931489212 TSecr=1115522823 SLE=296660 SRE=450451 SLE=233305 SRE=295212"
"562","0.921319","23.13.164.38","100.86.243.187","TCP","1514","443  >  54993 [ACK] Seq=450451 Ack=10214 Win=9262 Len=1448 TSval=1115522856 TSecr=931489139 [TCP PDU reassembled in 565]"
"563","0.921320","23.13.164.38","100.86.243.187","TCP","1514","443  >  54993 [ACK] Seq=451899 Ack=10214 Win=9262 Len=1448 TSval=1115522856 TSecr=931489139 [TCP PDU reassembled in 565]"
"564","0.921320","23.13.164.38","100.86.243.187","TCP","1514","443  >  54993 [ACK] Seq=453347 Ack=10214 Win=9262 Len=1448 TSval=1115522856 TSecr=931489139 [TCP PDU reassembled in 565]"
"565","0.921321","23.13.164.38","100.86.243.187","TLSv1.2","1514","Application Data, Application Data"
"566","0.921322","23.13.164.38","100.86.243.187","TCP","1514","443  >  54993 [ACK] Seq=456243 Ack=10214 Win=9262 Len=1448 TSval=1115522856 TSecr=931489139 [TCP PDU reassembled in 573]"
"567","0.921323","23.13.164.38","100.86.243.187","TCP","1514","443  >  54993 [ACK] Seq=457691 Ack=10214 Win=9262 Len=1448 TSval=1115522856 TSecr=931489139 [TCP PDU reassembled in 573]"
"568","0.921323","23.13.164.38","100.86.243.187","TCP","1514","443  >  54993 [ACK] Seq=459139 Ack=10214 Win=9262 Len=1448 TSval=1115522856 TSecr=931489139 [TCP PDU reassembled in 573]"
"569","0.921324","23.13.164.38","100.86.243.187","TCP","1514","443  >  54993 [ACK] Seq=460587 Ack=10214 Win=9262 Len=1448 TSval=1115522856 TSecr=931489139 [TCP PDU reassembled in 573]"
"570","0.921325","23.13.164.38","100.86.243.187","TCP","1514","443  >  54993 [PSH, ACK] Seq=462035 Ack=10214 Win=9262 Len=1448 TSval=1115522856 TSecr=931489139 [TCP PDU reassembled in 573]"
"571","0.921325","23.13.164.38","100.86.243.187","TCP","1514","443  >  54993 [ACK] Seq=463483 Ack=10214 Win=9262 Len=1448 TSval=1115522857 TSecr=931489139 [TCP PDU reassembled in 573]"
"572","0.921325","23.13.164.38","100.86.243.187","TCP","1514","443  >  54993 [ACK] Seq=464931 Ack=10214 Win=9262 Len=1448 TSval=1115522857 TSecr=931489139 [TCP PDU reassembled in 573]"
"573","0.921326","23.13.164.38","100.86.243.187","TLSv1.2","549","Application Data"
"574","0.921327","23.13.164.38","100.86.243.187","TLSv1.2","417","Application Data"
"575","0.921327","23.13.164.38","100.86.243.187","TCP","1514","443  >  54993 [ACK] Seq=467213 Ack=10214 Win=9262 Len=1448 TSval=1115522859 TSecr=931489200 [TCP PDU reassembled in 581]"
"576","0.921328","23.13.164.38","100.86.243.187","TCP","1514","443  >  54993 [ACK] Seq=468661 Ack=10214 Win=9262 Len=1448 TSval=1115522859 TSecr=931489200 [TCP PDU reassembled in 581]"
"577","0.921328","23.13.164.38","100.86.243.187","TCP","1514","443  >  54993 [ACK] Seq=470109 Ack=10214 Win=9262 Len=1448 TSval=1115522859 TSecr=931489200 [TCP PDU reassembled in 581]"
"578","0.921329","23.13.164.38","100.86.243.187","TCP","1514","443  >  54993 [ACK] Seq=471557 Ack=10214 Win=9262 Len=1448 TSval=1115522859 TSecr=931489200 [TCP PDU reassembled in 581]"
"579","0.921330","23.13.164.38","100.86.243.187","TCP","1514","443  >  54993 [ACK] Seq=473005 Ack=10214 Win=9262 Len=1448 TSval=1115522859 TSecr=931489200 [TCP PDU reassembled in 581]"
"580","0.921330","23.13.164.38","100.86.243.187","TCP","1514","443  >  54993 [ACK] Seq=474453 Ack=10214 Win=9262 Len=1448 TSval=1115522859 TSecr=931489200 [TCP PDU reassembled in 581]"
"581","0.921331","23.13.164.38","100.86.243.187","TLSv1.2","785","Application Data"
"582","0.921394","100.86.243.187","23.13.164.38","TCP","86","[TCP Dup ACK 381#29] 54993  >  443 [ACK] Seq=10214 Ack=231857 Win=37456 Len=0 TSval=931489214 TSecr=1115522823 SLE=296660 SRE=466379 SLE=233305 SRE=295212"
"583","0.921420","100.86.243.187","23.13.164.38","TCP","86","[TCP Dup ACK 381#30] 54993  >  443 [ACK] Seq=10214 Ack=231857 Win=37456 Len=0 TSval=931489214 TSecr=1115522823 SLE=296660 SRE=476620 SLE=233305 SRE=295212"
"584","0.923711","23.13.164.38","100.86.243.187","TLSv1.2","1514","[TCP Fast Retransmission] , Application Data"
"585","0.923713","23.13.164.38","100.86.243.187","TLSv1.2","1514","[TCP Fast Retransmission] , Application Data, Application Data"
"586","0.923800","100.86.243.187","23.13.164.38","TCP","78","54993  >  443 [ACK] Seq=10214 Ack=295212 Win=36466 Len=0 TSval=931489217 TSecr=1115522862 SLE=296660 SRE=476620"
"587","0.923852","100.86.243.187","23.13.164.38","TCP","66","54993  >  443 [ACK] Seq=10214 Ack=476620 Win=33631 Len=0 TSval=931489217 TSecr=1115522862"
"588","0.926358","100.86.243.187","23.13.164.38","TCP","66","[TCP Window Update] 54993  >  443 [ACK] Seq=10214 Ack=476620 Win=37456 Len=0 TSval=931489219 TSecr=1115522862"
"589","0.931892","23.13.164.38","100.86.243.187","TLSv1.2","407","Application Data"
"590","0.931954","100.86.243.187","23.13.164.38","TCP","66","54993  >  443 [ACK] Seq=10214 Ack=476961 Win=37450 Len=0 TSval=931489225 TSecr=1115522869"
"591","0.934071","23.13.164.38","100.86.243.187","TCP","1514","443  >  54993 [ACK] Seq=476961 Ack=10214 Win=9262 Len=1448 TSval=1115522869 TSecr=931489212 [TCP PDU reassembled in 598]"
"592","0.934072","23.13.164.38","100.86.243.187","TCP","1514","443  >  54993 [ACK] Seq=478409 Ack=10214 Win=9262 Len=1448 TSval=1115522869 TSecr=931489212 [TCP PDU reassembled in 598]"
"593","0.934073","23.13.164.38","100.86.243.187","TCP","1514","443  >  54993 [ACK] Seq=479857 Ack=10214 Win=9262 Len=1448 TSval=1115522869 TSecr=931489212 [TCP PDU reassembled in 598]"
"594","0.934074","23.13.164.38","100.86.243.187","TCP","1514","443  >  54993 [ACK] Seq=481305 Ack=10214 Win=9262 Len=1448 TSval=1115522869 TSecr=931489212 [TCP PDU reassembled in 598]"
"595","0.934075","23.13.164.38","100.86.243.187","TCP","1514","443  >  54993 [ACK] Seq=482753 Ack=10214 Win=9262 Len=1448 TSval=1115522869 TSecr=931489212 [TCP PDU reassembled in 598]"
"596","0.934076","23.13.164.38","100.86.243.187","TCP","1514","443  >  54993 [ACK] Seq=484201 Ack=10214 Win=9262 Len=1448 TSval=1115522869 TSecr=931489212 [TCP PDU reassembled in 598]"
"597","0.934077","23.13.164.38","100.86.243.187","TCP","1514","443  >  54993 [ACK] Seq=485649 Ack=10214 Win=9262 Len=1448 TSval=1115522869 TSecr=931489212 [TCP PDU reassembled in 598]"
"598","0.934078","23.13.164.38","100.86.243.187","TLSv1.2","1049","Application Data"
"599","0.934078","23.13.164.38","100.86.243.187","TLSv1.2","419","Application Data"
"600","0.934079","23.13.164.38","100.86.243.187","TCP","1514","443  >  54993 [ACK] Seq=488433 Ack=10214 Win=9262 Len=1448 TSval=1115522870 TSecr=931489214 [TCP PDU reassembled in 611]"
"601","0.934080","23.13.164.38","100.86.243.187","TCP","1514","443  >  54993 [ACK] Seq=489881 Ack=10214 Win=9262 Len=1448 TSval=1115522870 TSecr=931489214 [TCP PDU reassembled in 611]"
"602","0.934081","23.13.164.38","100.86.243.187","TCP","1514","443  >  54993 [ACK] Seq=491329 Ack=10214 Win=9262 Len=1448 TSval=1115522870 TSecr=931489214 [TCP PDU reassembled in 611]"
"603","0.934082","23.13.164.38","100.86.243.187","TCP","1514","443  >  54993 [ACK] Seq=492777 Ack=10214 Win=9262 Len=1448 TSval=1115522870 TSecr=931489214 [TCP PDU reassembled in 611]"
"604","0.934083","23.13.164.38","100.86.243.187","TCP","1514","443  >  54993 [ACK] Seq=494225 Ack=10214 Win=9262 Len=1448 TSval=1115522870 TSecr=931489214 [TCP PDU reassembled in 611]"
"605","0.934083","23.13.164.38","100.86.243.187","TCP","1514","443  >  54993 [ACK] Seq=495673 Ack=10214 Win=9262 Len=1448 TSval=1115522870 TSecr=931489214 [TCP PDU reassembled in 611]"
"606","0.934085","23.13.164.38","100.86.243.187","TCP","1514","443  >  54993 [ACK] Seq=497121 Ack=10214 Win=9262 Len=1448 TSval=1115522870 TSecr=931489214 [TCP PDU reassembled in 611]"
"607","0.934085","23.13.164.38","100.86.243.187","TCP","1514","443  >  54993 [ACK] Seq=498569 Ack=10214 Win=9262 Len=1448 TSval=1115522870 TSecr=931489214 [TCP PDU reassembled in 611]"
"608","0.934086","23.13.164.38","100.86.243.187","TCP","1514","443  >  54993 [ACK] Seq=500017 Ack=10214 Win=9262 Len=1448 TSval=1115522870 TSecr=931489214 [TCP PDU reassembled in 611]"
"609","0.934087","23.13.164.38","100.86.243.187","TCP","1514","443  >  54993 [PSH, ACK] Seq=501465 Ack=10214 Win=9262 Len=1448 TSval=1115522870 TSecr=931489214 [TCP PDU reassembled in 611]"
"610","0.934088","23.13.164.38","100.86.243.187","TCP","1514","443  >  54993 [ACK] Seq=502913 Ack=10214 Win=9262 Len=1448 TSval=1115522871 TSecr=931489214 [TCP PDU reassembled in 611]"
"611","0.934089","23.13.164.38","100.86.243.187","TLSv1.2","986","Application Data, Application Data, Application Data"
"612","0.934190","100.86.243.187","23.13.164.38","TCP","66","54993  >  443 [ACK] Seq=10214 Ack=492777 Win=37209 Len=0 TSval=931489227 TSecr=1115522870"
"613","0.934244","100.86.243.187","23.13.164.38","TCP","66","54993  >  443 [ACK] Seq=10214 Ack=505281 Win=37013 Len=0 TSval=931489227 TSecr=1115522871"
"614","0.934599","100.86.243.187","23.13.164.38","TCP","66","[TCP Window Update] 54993  >  443 [ACK] Seq=10214 Ack=505281 Win=37456 Len=0 TSval=931489227 TSecr=1115522871"
"615","0.966350","23.13.164.38","100.86.243.187","TLSv1.2","407","Application Data"
"616","0.966452","100.86.243.187","23.13.164.38","TCP","66","54993  >  443 [ACK] Seq=10214 Ack=505622 Win=37450 Len=0 TSval=931489259 TSecr=1115522903"
"617","0.967825","23.13.164.38","100.86.243.187","TCP","1514","443  >  54993 [ACK] Seq=505622 Ack=10214 Win=9262 Len=1448 TSval=1115522903 TSecr=931489227 [TCP PDU reassembled in 624]"
"618","0.967826","23.13.164.38","100.86.243.187","TCP","1514","443  >  54993 [ACK] Seq=507070 Ack=10214 Win=9262 Len=1448 TSval=1115522903 TSecr=931489227 [TCP PDU reassembled in 624]"
"619","0.967827","23.13.164.38","100.86.243.187","TCP","1514","443  >  54993 [ACK] Seq=508518 Ack=10214 Win=9262 Len=1448 TSval=1115522903 TSecr=931489227 [TCP PDU reassembled in 624]"
"620","0.967828","23.13.164.38","100.86.243.187","TCP","1514","443  >  54993 [ACK] Seq=509966 Ack=10214 Win=9262 Len=1448 TSval=1115522903 TSecr=931489227 [TCP PDU reassembled in 624]"
"621","0.967829","23.13.164.38","100.86.243.187","TCP","1514","443  >  54993 [ACK] Seq=511414 Ack=10214 Win=9262 Len=1448 TSval=1115522903 TSecr=931489227 [TCP PDU reassembled in 624]"
"622","0.967830","23.13.164.38","100.86.243.187","TCP","1514","443  >  54993 [ACK] Seq=512862 Ack=10214 Win=9262 Len=1448 TSval=1115522903 TSecr=931489227 [TCP PDU reassembled in 624]"
"623","0.967830","23.13.164.38","100.86.243.187","TCP","1514","443  >  54993 [ACK] Seq=514310 Ack=10214 Win=9262 Len=1448 TSval=1115522903 TSecr=931489227 [TCP PDU reassembled in 624]"
"624","0.967831","23.13.164.38","100.86.243.187","TLSv1.2","581","Application Data"
"625","0.967911","100.86.243.187","23.13.164.38","TCP","66","54993  >  443 [ACK] Seq=10214 Ack=516273 Win=37289 Len=0 TSval=931489261 TSecr=1115522903"
"626","0.967990","100.86.243.187","23.13.164.38","TCP","66","[TCP Window Update] 54993  >  443 [ACK] Seq=10214 Ack=516273 Win=37456 Len=0 TSval=931489261 TSecr=1115522903"
