"No.","Time","Source","Destination","Protocol","Length","Info"
"1","0.000000","10.1.30.131","23.9.158.105","TCP","66","54829  >  443 [ACK] Seq=1 Ack=1 Win=65535 Len=0 TSval=1832799906 TSecr=1263276578"
"2","0.000193","23.9.158.105","10.1.30.131","SSLv2","1514",""
"3","0.000194","23.9.158.105","10.1.30.131","SSLv2","1514",""
"4","0.000194","23.9.158.105","10.1.30.131","SSLv2","1514",""
"5","0.000195","23.9.158.105","10.1.30.131","SSLv2","1514","Encrypted Data, Encrypted Data"
"6","0.000195","23.9.158.105","10.1.30.131","SSLv2","1514",""
"7","0.000196","23.9.158.105","10.1.30.131","SSLv2","1514",""
"8","0.000196","23.9.158.105","10.1.30.131","SSLv2","1514",""
"9","0.000197","23.9.158.105","10.1.30.131","SSLv2","1514",""
"10","0.000197","23.9.158.105","10.1.30.131","SSLv2","1514",""
"11","0.000198","23.9.158.105","10.1.30.131","SSLv2","1514",""
"12","0.000199","23.9.158.105","10.1.30.131","SSLv2","1514",""
"13","0.000199","23.9.158.105","10.1.30.131","SSLv2","1514",""
"14","0.000200","23.9.158.105","10.1.30.131","SSLv2","1514",""
"15","0.000201","23.9.158.105","10.1.30.131","SSLv2","1514",""
"16","0.000201","23.9.158.105","10.1.30.131","SSLv2","1514",""
"17","0.000201","23.9.158.105","10.1.30.131","SSLv2","1514",""
"18","0.000202","23.9.158.105","10.1.30.131","SSLv2","1514",""
"19","0.000202","23.9.158.105","10.1.30.131","SSLv2","1514",""
"20","0.000203","23.9.158.105","10.1.30.131","SSLv2","1514",""
"21","0.000204","23.9.158.105","10.1.30.131","SSLv2","1514",""
"22","0.000204","23.9.158.105","10.1.30.131","SSLv2","1514","Encrypted Data"
"23","0.000205","23.9.158.105","10.1.30.131","SSLv2","1514",""
"24","0.000205","23.9.158.105","10.1.30.131","SSLv2","1514",""
"25","0.000206","23.9.158.105","10.1.30.131","SSLv2","1514",""
"26","0.000207","23.9.158.105","10.1.30.131","SSLv2","1514",""
"27","0.000207","23.9.158.105","10.1.30.131","SSLv2","1514",""
"28","0.000207","23.9.158.105","10.1.30.131","SSLv2","1514",""
"29","0.000208","23.9.158.105","10.1.30.131","SSLv2","1514",""
"30","0.000209","23.9.158.105","10.1.30.131","SSLv2","1514",""
"31","0.000209","23.9.158.105","10.1.30.131","SSLv2","1514",""
"32","0.000210","23.9.158.105","10.1.30.131","SSLv2","1514",""
"33","0.000210","23.9.158.105","10.1.30.131","SSLv2","1514",""
"34","0.000482","10.1.30.131","23.9.158.105","TCP","66","54829  >  443 [ACK] Seq=1 Ack=46337 Win=65535 Len=0 TSval=1832799906 TSecr=1263276579"
"35","0.000997","23.9.158.105","10.1.30.131","SSLv2","1514",""
"36","0.000998","23.9.158.105","10.1.30.131","SSLv2","1514",""
"37","0.000999","23.9.158.105","10.1.30.131","SSLv2","1514",""
"38","0.001000","23.9.158.105","10.1.30.131","SSLv2","1514",""
"39","0.001000","23.9.158.105","10.1.30.131","SSLv2","1514",""
"40","0.001001","23.9.158.105","10.1.30.131","SSLv2","1514",""
"41","0.001002","23.9.158.105","10.1.30.131","SSLv2","1514",""
"42","0.001002","23.9.158.105","10.1.30.131","TCP","1514","443  >  54829 [ACK] Seq=56473 Ack=1 Win=501 Len=1448 TSval=1263276580 TSecr=1832799890"
"43","0.001003","23.9.158.105","10.1.30.131","SSLv2","1514",""
"44","0.001003","23.9.158.105","10.1.30.131","SSLv2","1514",""
"45","0.001004","23.9.158.105","10.1.30.131","SSLv2","1514",""
"46","0.001006","23.9.158.105","10.1.30.131","SSLv2","1514",""
"47","0.001007","23.9.158.105","10.1.30.131","TCP","1514","443  >  54829 [ACK] Seq=63713 Ack=1 Win=501 Len=1448 TSval=1263276580 TSecr=1832799890 [TCP PDU reassembled in 58]"
"48","0.001007","23.9.158.105","10.1.30.131","TCP","1514","443  >  54829 [ACK] Seq=65161 Ack=1 Win=501 Len=1448 TSval=1263276580 TSecr=1832799890 [TCP PDU reassembled in 58]"
"49","0.001008","23.9.158.105","10.1.30.131","TCP","1514","443  >  54829 [ACK] Seq=66609 Ack=1 Win=501 Len=1448 TSval=1263276580 TSecr=1832799890 [TCP PDU reassembled in 58]"
"50","0.001008","23.9.158.105","10.1.30.131","TCP","1514","443  >  54829 [ACK] Seq=68057 Ack=1 Win=501 Len=1448 TSval=1263276580 TSecr=1832799890 [TCP PDU reassembled in 58]"
"51","0.001009","23.9.158.105","10.1.30.131","TCP","1514","443  >  54829 [ACK] Seq=69505 Ack=1 Win=501 Len=1448 TSval=1263276580 TSecr=1832799890 [TCP PDU reassembled in 58]"
"52","0.001010","23.9.158.105","10.1.30.131","TCP","1514","443  >  54829 [ACK] Seq=70953 Ack=1 Win=501 Len=1448 TSval=1263276580 TSecr=1832799890 [TCP PDU reassembled in 58]"
"53","0.001010","23.9.158.105","10.1.30.131","TCP","1514","443  >  54829 [ACK] Seq=72401 Ack=1 Win=501 Len=1448 TSval=1263276580 TSecr=1832799890 [TCP PDU reassembled in 58]"
"54","0.001011","23.9.158.105","10.1.30.131","TCP","1514","443  >  54829 [ACK] Seq=73849 Ack=1 Win=501 Len=1448 TSval=1263276580 TSecr=1832799890 [TCP PDU reassembled in 58]"
"55","0.001011","23.9.158.105","10.1.30.131","TCP","1514","443  >  54829 [ACK] Seq=75297 Ack=1 Win=501 Len=1448 TSval=1263276580 TSecr=1832799890 [TCP PDU reassembled in 58]"
"56","0.001012","23.9.158.105","10.1.30.131","TCP","1514","443  >  54829 [ACK] Seq=76745 Ack=1 Win=501 Len=1448 TSval=1263276580 TSecr=1832799890 [TCP PDU reassembled in 58]"
"57","0.001013","23.9.158.105","10.1.30.131","TCP","1514","443  >  54829 [ACK] Seq=78193 Ack=1 Win=501 Len=1448 TSval=1263276580 TSecr=1832799890 [TCP PDU reassembled in 58]"
"58","0.001013","23.9.158.105","10.1.30.131","SSLv2","1514","Encrypted Data"
"59","0.001014","23.9.158.105","10.1.30.131","SSLv2","1514","Encrypted Data"
"60","0.001015","23.9.158.105","10.1.30.131","TCP","1514","443  >  54829 [ACK] Seq=82537 Ack=1 Win=501 Len=1448 TSval=1263276580 TSecr=1832799890 [TCP PDU reassembled in 66]"
"61","0.001016","23.9.158.105","10.1.30.131","TCP","1514","443  >  54829 [ACK] Seq=83985 Ack=1 Win=501 Len=1448 TSval=1263276580 TSecr=1832799890 [TCP PDU reassembled in 66]"
"62","0.001016","23.9.158.105","10.1.30.131","TCP","1514","443  >  54829 [PSH, ACK] Seq=85433 Ack=1 Win=501 Len=1448 TSval=1263276580 TSecr=1832799890 [TCP PDU reassembled in 66]"
"63","0.001017","23.9.158.105","10.1.30.131","TCP","1514","443  >  54829 [ACK] Seq=86881 Ack=1 Win=501 Len=1448 TSval=1263276580 TSecr=1832799890 [TCP PDU reassembled in 66]"
"64","0.001018","23.9.158.105","10.1.30.131","TCP","1514","443  >  54829 [ACK] Seq=88329 Ack=1 Win=501 Len=1448 TSval=1263276580 TSecr=1832799890 [TCP PDU reassembled in 66]"
"65","0.001019","23.9.158.105","10.1.30.131","TCP","1514","443  >  54829 [ACK] Seq=89777 Ack=1 Win=501 Len=1448 TSval=1263276580 TSecr=1832799890 [TCP PDU reassembled in 66]"
"66","0.001019","23.9.158.105","10.1.30.131","SSLv2","1514","Encrypted Data"
"67","0.001289","23.9.158.105","10.1.30.131","TCP","1514","443  >  54829 [ACK] Seq=92673 Ack=1 Win=501 Len=1448 TSval=1263276580 TSecr=1832799890 [TCP PDU reassembled in 80]"
"68","0.001290","23.9.158.105","10.1.30.131","TCP","1514","443  >  54829 [ACK] Seq=94121 Ack=1 Win=501 Len=1448 TSval=1263276580 TSecr=1832799890 [TCP PDU reassembled in 80]"
"69","0.001291","23.9.158.105","10.1.30.131","TCP","1514","443  >  54829 [ACK] Seq=95569 Ack=1 Win=501 Len=1448 TSval=1263276580 TSecr=1832799890 [TCP PDU reassembled in 80]"
"70","0.001292","23.9.158.105","10.1.30.131","TCP","1514","443  >  54829 [ACK] Seq=97017 Ack=1 Win=501 Len=1448 TSval=1263276580 TSecr=1832799890 [TCP PDU reassembled in 80]"
"71","0.001292","23.9.158.105","10.1.30.131","TCP","1514","443  >  54829 [ACK] Seq=98465 Ack=1 Win=501 Len=1448 TSval=1263276580 TSecr=1832799890 [TCP PDU reassembled in 80]"
"72","0.001292","23.9.158.105","10.1.30.131","TCP","1514","443  >  54829 [ACK] Seq=99913 Ack=1 Win=501 Len=1448 TSval=1263276580 TSecr=1832799890 [TCP PDU reassembled in 80]"
"73","0.001293","23.9.158.105","10.1.30.131","TCP","1514","443  >  54829 [ACK] Seq=101361 Ack=1 Win=501 Len=1448 TSval=1263276580 TSecr=1832799890 [TCP PDU reassembled in 80]"
"74","0.001294","23.9.158.105","10.1.30.131","TCP","1514","443  >  54829 [ACK] Seq=102809 Ack=1 Win=501 Len=1448 TSval=1263276580 TSecr=1832799890 [TCP PDU reassembled in 80]"
"75","0.001294","23.9.158.105","10.1.30.131","TCP","1514","443  >  54829 [ACK] Seq=104257 Ack=1 Win=501 Len=1448 TSval=1263276580 TSecr=1832799890 [TCP PDU reassembled in 80]"
"76","0.001295","23.9.158.105","10.1.30.131","TCP","1514","443  >  54829 [ACK] Seq=105705 Ack=1 Win=501 Len=1448 TSval=1263276580 TSecr=1832799890 [TCP PDU reassembled in 80]"
"77","0.001295","23.9.158.105","10.1.30.131","TCP","1514","443  >  54829 [ACK] Seq=107153 Ack=1 Win=501 Len=1448 TSval=1263276580 TSecr=1832799890 [TCP PDU reassembled in 80]"
"78","0.001296","23.9.158.105","10.1.30.131","TCP","1514","443  >  54829 [ACK] Seq=108601 Ack=1 Win=501 Len=1448 TSval=1263276580 TSecr=1832799890 [TCP PDU reassembled in 80]"
"79","0.001296","23.9.158.105","10.1.30.131","TCP","1514","443  >  54829 [ACK] Seq=110049 Ack=1 Win=501 Len=1448 TSval=1263276580 TSecr=1832799890 [TCP PDU reassembled in 80]"
"80","0.001297","23.9.158.105","10.1.30.131","SSLv2","1514","Encrypted Data"
"81","0.001298","23.9.158.105","10.1.30.131","TCP","1514","443  >  54829 [ACK] Seq=112945 Ack=1 Win=501 Len=1448 TSval=1263276580 TSecr=1832799890 [TCP PDU reassembled in 99]"
"82","0.001298","23.9.158.105","10.1.30.131","TCP","1514","443  >  54829 [ACK] Seq=114393 Ack=1 Win=501 Len=1448 TSval=1263276580 TSecr=1832799890 [TCP PDU reassembled in 99]"
"83","0.001299","23.9.158.105","10.1.30.131","TCP","1514","443  >  54829 [ACK] Seq=115841 Ack=1 Win=501 Len=1448 TSval=1263276580 TSecr=1832799890 [TCP PDU reassembled in 99]"
"84","0.001299","23.9.158.105","10.1.30.131","TCP","1514","443  >  54829 [ACK] Seq=117289 Ack=1 Win=501 Len=1448 TSval=1263276580 TSecr=1832799890 [TCP PDU reassembled in 99]"
"85","0.001300","23.9.158.105","10.1.30.131","TCP","1514","443  >  54829 [ACK] Seq=118737 Ack=1 Win=501 Len=1448 TSval=1263276580 TSecr=1832799890 [TCP PDU reassembled in 99]"
"86","0.001301","23.9.158.105","10.1.30.131","TCP","1514","443  >  54829 [ACK] Seq=120185 Ack=1 Win=501 Len=1448 TSval=1263276580 TSecr=1832799890 [TCP PDU reassembled in 99]"
"87","0.001301","23.9.158.105","10.1.30.131","TCP","1514","443  >  54829 [ACK] Seq=121633 Ack=1 Win=501 Len=1448 TSval=1263276580 TSecr=1832799890 [TCP PDU reassembled in 99]"
"88","0.001301","23.9.158.105","10.1.30.131","TCP","1514","443  >  54829 [ACK] Seq=123081 Ack=1 Win=501 Len=1448 TSval=1263276580 TSecr=1832799890 [TCP PDU reassembled in 99]"
"89","0.001302","23.9.158.105","10.1.30.131","TCP","1514","443  >  54829 [ACK] Seq=124529 Ack=1 Win=501 Len=1448 TSval=1263276580 TSecr=1832799890 [TCP PDU reassembled in 99]"
"90","0.001303","23.9.158.105","10.1.30.131","TCP","1514","443  >  54829 [ACK] Seq=125977 Ack=1 Win=501 Len=1448 TSval=1263276580 TSecr=1832799890 [TCP PDU reassembled in 99]"
"91","0.001303","23.9.158.105","10.1.30.131","TCP","1514","443  >  54829 [ACK] Seq=127425 Ack=1 Win=501 Len=1448 TSval=1263276580 TSecr=1832799890 [TCP PDU reassembled in 99]"
"92","0.001304","23.9.158.105","10.1.30.131","TCP","1514","443  >  54829 [ACK] Seq=128873 Ack=1 Win=501 Len=1448 TSval=1263276580 TSecr=1832799890 [TCP PDU reassembled in 99]"
"93","0.001304","23.9.158.105","10.1.30.131","TCP","1514","443  >  54829 [ACK] Seq=130321 Ack=1 Win=501 Len=1448 TSval=1263276580 TSecr=1832799890 [TCP PDU reassembled in 99]"
"94","0.001305","23.9.158.105","10.1.30.131","TCP","1514","443  >  54829 [ACK] Seq=131769 Ack=1 Win=501 Len=1448 TSval=1263276580 TSecr=1832799890 [TCP PDU reassembled in 99]"
"95","0.001305","23.9.158.105","10.1.30.131","TCP","1514","443  >  54829 [ACK] Seq=133217 Ack=1 Win=501 Len=1448 TSval=1263276580 TSecr=1832799890 [TCP PDU reassembled in 99]"
"96","0.001306","23.9.158.105","10.1.30.131","TCP","1514","443  >  54829 [ACK] Seq=134665 Ack=1 Win=501 Len=1448 TSval=1263276580 TSecr=1832799890 [TCP PDU reassembled in 99]"
"97","0.001306","23.9.158.105","10.1.30.131","TCP","1514","443  >  54829 [ACK] Seq=136113 Ack=1 Win=501 Len=1448 TSval=1263276580 TSecr=1832799890 [TCP PDU reassembled in 99]"
"98","0.001307","23.9.158.105","10.1.30.131","TCP","1514","443  >  54829 [ACK] Seq=137561 Ack=1 Win=501 Len=1448 TSval=1263276580 TSecr=1832799890 [TCP PDU reassembled in 99]"
"99","0.001307","23.9.158.105","10.1.30.131","SSLv2","1514","Encrypted Data"
"100","0.001308","23.9.158.105","10.1.30.131","TCP","1514","443  >  54829 [ACK] Seq=140457 Ack=1 Win=501 Len=1448 TSval=1263276580 TSecr=1832799890 [TCP PDU reassembled in 122]"
"101","0.001338","10.1.30.131","23.9.158.105","TCP","66","54829  >  443 [ACK] Seq=1 Ack=92673 Win=65535 Len=0 TSval=1832799908 TSecr=1263276580"
"102","0.001572","10.1.30.131","23.9.158.105","TCP","66","54829  >  443 [ACK] Seq=1 Ack=141905 Win=65535 Len=0 TSval=1832799908 TSecr=1263276580"
"103","0.002153","23.9.158.105","10.1.30.131","TCP","1514","443  >  54829 [ACK] Seq=141905 Ack=1 Win=501 Len=1448 TSval=1263276580 TSecr=1832799890 [TCP PDU reassembled in 122]"
"104","0.002154","23.9.158.105","10.1.30.131","TCP","1514","443  >  54829 [ACK] Seq=143353 Ack=1 Win=501 Len=1448 TSval=1263276580 TSecr=1832799890 [TCP PDU reassembled in 122]"
"105","0.002155","23.9.158.105","10.1.30.131","TCP","1514","443  >  54829 [ACK] Seq=144801 Ack=1 Win=501 Len=1448 TSval=1263276580 TSecr=1832799890 [TCP PDU reassembled in 122]"
"106","0.002155","23.9.158.105","10.1.30.131","TCP","1514","443  >  54829 [ACK] Seq=146249 Ack=1 Win=501 Len=1448 TSval=1263276580 TSecr=1832799890 [TCP PDU reassembled in 122]"
"107","0.002156","23.9.158.105","10.1.30.131","TCP","1514","443  >  54829 [ACK] Seq=147697 Ack=1 Win=501 Len=1448 TSval=1263276580 TSecr=1832799890 [TCP PDU reassembled in 122]"
"108","0.002157","23.9.158.105","10.1.30.131","TCP","1514","443  >  54829 [ACK] Seq=149145 Ack=1 Win=501 Len=1448 TSval=1263276580 TSecr=1832799890 [TCP PDU reassembled in 122]"
"109","0.002157","23.9.158.105","10.1.30.131","TCP","1514","443  >  54829 [PSH, ACK] Seq=150593 Ack=1 Win=501 Len=1448 TSval=1263276580 TSecr=1832799890 [TCP PDU reassembled in 122]"
"110","0.002158","23.9.158.105","10.1.30.131","TCP","1514","443  >  54829 [ACK] Seq=152041 Ack=1 Win=501 Len=1448 TSval=1263276581 TSecr=1832799890 [TCP PDU reassembled in 122]"
"111","0.002159","23.9.158.105","10.1.30.131","TCP","1514","443  >  54829 [ACK] Seq=153489 Ack=1 Win=501 Len=1448 TSval=1263276581 TSecr=1832799890 [TCP PDU reassembled in 122]"
"112","0.002160","23.9.158.105","10.1.30.131","TCP","1514","443  >  54829 [ACK] Seq=154937 Ack=1 Win=501 Len=1448 TSval=1263276581 TSecr=1832799890 [TCP PDU reassembled in 122]"
"113","0.002160","23.9.158.105","10.1.30.131","TCP","1514","443  >  54829 [ACK] Seq=156385 Ack=1 Win=501 Len=1448 TSval=1263276581 TSecr=1832799890 [TCP PDU reassembled in 122]"
"114","0.002161","23.9.158.105","10.1.30.131","TCP","1514","443  >  54829 [ACK] Seq=157833 Ack=1 Win=501 Len=1448 TSval=1263276581 TSecr=1832799890 [TCP PDU reassembled in 122]"
"115","0.002162","23.9.158.105","10.1.30.131","TCP","1514","443  >  54829 [ACK] Seq=159281 Ack=1 Win=501 Len=1448 TSval=1263276581 TSecr=1832799890 [TCP PDU reassembled in 122]"
"116","0.002162","23.9.158.105","10.1.30.131","TCP","1514","443  >  54829 [ACK] Seq=160729 Ack=1 Win=501 Len=1448 TSval=1263276581 TSecr=1832799890 [TCP PDU reassembled in 122]"
"117","0.002163","23.9.158.105","10.1.30.131","TCP","1514","443  >  54829 [ACK] Seq=162177 Ack=1 Win=501 Len=1448 TSval=1263276581 TSecr=1832799890 [TCP PDU reassembled in 122]"
"118","0.002164","23.9.158.105","10.1.30.131","TCP","1514","443  >  54829 [ACK] Seq=163625 Ack=1 Win=501 Len=1448 TSval=1263276581 TSecr=1832799890 [TCP PDU reassembled in 122]"
"119","0.002164","23.9.158.105","10.1.30.131","TCP","1514","443  >  54829 [ACK] Seq=165073 Ack=1 Win=501 Len=1448 TSval=1263276581 TSecr=1832799890 [TCP PDU reassembled in 122]"
"120","0.002165","23.9.158.105","10.1.30.131","TCP","1514","443  >  54829 [ACK] Seq=166521 Ack=1 Win=501 Len=1448 TSval=1263276581 TSecr=1832799890 [TCP PDU reassembled in 122]"
"121","0.002166","23.9.158.105","10.1.30.131","TCP","1514","443  >  54829 [ACK] Seq=167969 Ack=1 Win=501 Len=1448 TSval=1263276581 TSecr=1832799890 [TCP PDU reassembled in 122]"
"122","0.002166","23.9.158.105","10.1.30.131","SSLv2","1514","Encrypted Data"
"123","0.002167","23.9.158.105","10.1.30.131","TCP","1514","443  >  54829 [ACK] Seq=170865 Ack=1 Win=501 Len=1448 TSval=1263276581 TSecr=1832799890 [TCP PDU reassembled in 131]"
"124","0.002168","23.9.158.105","10.1.30.131","TCP","1514","443  >  54829 [ACK] Seq=172313 Ack=1 Win=501 Len=1448 TSval=1263276581 TSecr=1832799890 [TCP PDU reassembled in 131]"
"125","0.002168","23.9.158.105","10.1.30.131","TCP","1514","443  >  54829 [ACK] Seq=173761 Ack=1 Win=501 Len=1448 TSval=1263276581 TSecr=1832799890 [TCP PDU reassembled in 131]"
"126","0.002169","23.9.158.105","10.1.30.131","TCP","1514","443  >  54829 [ACK] Seq=175209 Ack=1 Win=501 Len=1448 TSval=1263276581 TSecr=1832799890 [TCP PDU reassembled in 131]"
"127","0.002170","23.9.158.105","10.1.30.131","TCP","1514","443  >  54829 [ACK] Seq=176657 Ack=1 Win=501 Len=1448 TSval=1263276581 TSecr=1832799890 [TCP PDU reassembled in 131]"
"128","0.002170","23.9.158.105","10.1.30.131","TCP","1514","443  >  54829 [ACK] Seq=178105 Ack=1 Win=501 Len=1448 TSval=1263276581 TSecr=1832799890 [TCP PDU reassembled in 131]"
"129","0.002171","23.9.158.105","10.1.30.131","TCP","1514","443  >  54829 [ACK] Seq=179553 Ack=1 Win=501 Len=1448 TSval=1263276581 TSecr=1832799890 [TCP PDU reassembled in 131]"
"130","0.002171","23.9.158.105","10.1.30.131","TCP","1514","443  >  54829 [ACK] Seq=181001 Ack=1 Win=501 Len=1448 TSval=1263276581 TSecr=1832799890 [TCP PDU reassembled in 131]"
"131","0.002172","23.9.158.105","10.1.30.131","SSLv2","1514","Encrypted Data, Encrypted Data"
"132","0.002173","23.9.158.105","10.1.30.131","TCP","1514","443  >  54829 [ACK] Seq=183897 Ack=1 Win=501 Len=1448 TSval=1263276581 TSecr=1832799890 [TCP PDU reassembled in 136]"
"133","0.002174","23.9.158.105","10.1.30.131","TCP","1514","443  >  54829 [ACK] Seq=185345 Ack=1 Win=501 Len=1448 TSval=1263276581 TSecr=1832799890 [TCP PDU reassembled in 136]"
"134","0.002174","23.9.158.105","10.1.30.131","TCP","1514","443  >  54829 [ACK] Seq=186793 Ack=1 Win=501 Len=1448 TSval=1263276581 TSecr=1832799890 [TCP PDU reassembled in 136]"
"135","0.002474","10.1.30.131","23.9.158.105","TCP","66","54829  >  443 [ACK] Seq=1 Ack=188241 Win=65535 Len=0 TSval=1832799909 TSecr=1263276581"
"136","0.002833","23.9.158.105","10.1.30.131","SSLv2","1514","Encrypted Data"
"137","0.002834","23.9.158.105","10.1.30.131","TCP","1514","443  >  54829 [ACK] Seq=189689 Ack=1 Win=501 Len=1448 TSval=1263276581 TSecr=1832799890 [TCP PDU reassembled in 139]"
"138","0.002834","23.9.158.105","10.1.30.131","TCP","1514","443  >  54829 [ACK] Seq=191137 Ack=1 Win=501 Len=1448 TSval=1263276581 TSecr=1832799890 [TCP PDU reassembled in 139]"
"139","0.002835","23.9.158.105","10.1.30.131","SSLv2","1514","Encrypted Data"
"140","0.002835","23.9.158.105","10.1.30.131","TCP","1514","443  >  54829 [ACK] Seq=194033 Ack=1 Win=501 Len=1448 TSval=1263276581 TSecr=1832799890 [TCP PDU reassembled in 156]"
"141","0.002836","23.9.158.105","10.1.30.131","TCP","1514","443  >  54829 [ACK] Seq=195481 Ack=1 Win=501 Len=1448 TSval=1263276581 TSecr=1832799890 [TCP PDU reassembled in 156]"
"142","0.002837","23.9.158.105","10.1.30.131","TCP","1514","443  >  54829 [ACK] Seq=196929 Ack=1 Win=501 Len=1448 TSval=1263276581 TSecr=1832799890 [TCP PDU reassembled in 156]"
"143","0.002837","23.9.158.105","10.1.30.131","TCP","1514","443  >  54829 [ACK] Seq=198377 Ack=1 Win=501 Len=1448 TSval=1263276581 TSecr=1832799890 [TCP PDU reassembled in 156]"
"144","0.002838","23.9.158.105","10.1.30.131","TCP","1514","443  >  54829 [ACK] Seq=199825 Ack=1 Win=501 Len=1448 TSval=1263276581 TSecr=1832799890 [TCP PDU reassembled in 156]"
"145","0.002838","23.9.158.105","10.1.30.131","TCP","1514","443  >  54829 [ACK] Seq=201273 Ack=1 Win=501 Len=1448 TSval=1263276581 TSecr=1832799890 [TCP PDU reassembled in 156]"
"146","0.002839","23.9.158.105","10.1.30.131","TCP","1514","443  >  54829 [ACK] Seq=202721 Ack=1 Win=501 Len=1448 TSval=1263276581 TSecr=1832799890 [TCP PDU reassembled in 156]"
"147","0.002839","23.9.158.105","10.1.30.131","TCP","1514","443  >  54829 [ACK] Seq=204169 Ack=1 Win=501 Len=1448 TSval=1263276581 TSecr=1832799890 [TCP PDU reassembled in 156]"
"148","0.002840","23.9.158.105","10.1.30.131","TCP","1514","443  >  54829 [ACK] Seq=205617 Ack=1 Win=501 Len=1448 TSval=1263276581 TSecr=1832799890 [TCP PDU reassembled in 156]"
"149","0.002840","23.9.158.105","10.1.30.131","TCP","1514","443  >  54829 [ACK] Seq=207065 Ack=1 Win=501 Len=1448 TSval=1263276581 TSecr=1832799890 [TCP PDU reassembled in 156]"
"150","0.002841","23.9.158.105","10.1.30.131","TCP","1514","443  >  54829 [ACK] Seq=208513 Ack=1 Win=501 Len=1448 TSval=1263276581 TSecr=1832799890 [TCP PDU reassembled in 156]"
"151","0.002841","23.9.158.105","10.1.30.131","TCP","1514","443  >  54829 [ACK] Seq=209961 Ack=1 Win=501 Len=1448 TSval=1263276581 TSecr=1832799890 [TCP PDU reassembled in 156]"
"152","0.002842","23.9.158.105","10.1.30.131","TCP","1514","443  >  54829 [ACK] Seq=211409 Ack=1 Win=501 Len=1448 TSval=1263276581 TSecr=1832799890 [TCP PDU reassembled in 156]"
"153","0.002843","23.9.158.105","10.1.30.131","TCP","1514","443  >  54829 [ACK] Seq=212857 Ack=1 Win=501 Len=1448 TSval=1263276581 TSecr=1832799890 [TCP PDU reassembled in 156]"
"154","0.002843","23.9.158.105","10.1.30.131","TCP","1514","443  >  54829 [ACK] Seq=214305 Ack=1 Win=501 Len=1448 TSval=1263276581 TSecr=1832799890 [TCP PDU reassembled in 156]"
"155","0.002844","23.9.158.105","10.1.30.131","TCP","1514","443  >  54829 [PSH, ACK] Seq=215753 Ack=1 Win=501 Len=1448 TSval=1263276581 TSecr=1832799890 [TCP PDU reassembled in 156]"
"156","0.002844","23.9.158.105","10.1.30.131","SSLv2","1514","Encrypted Data"
"157","0.002845","23.9.158.105","10.1.30.131","TCP","1514","443  >  54829 [ACK] Seq=218649 Ack=1 Win=501 Len=1448 TSval=1263276582 TSecr=1832799890 [TCP PDU reassembled in 160]"
"158","0.002845","23.9.158.105","10.1.30.131","TCP","1514","443  >  54829 [ACK] Seq=220097 Ack=1 Win=501 Len=1448 TSval=1263276582 TSecr=1832799890 [TCP PDU reassembled in 160]"
"159","0.002846","23.9.158.105","10.1.30.131","TCP","1514","443  >  54829 [ACK] Seq=221545 Ack=1 Win=501 Len=1448 TSval=1263276582 TSecr=1832799890 [TCP PDU reassembled in 160]"
"160","0.002846","23.9.158.105","10.1.30.131","SSLv2","1514","Encrypted Data"
"161","0.002847","23.9.158.105","10.1.30.131","TCP","1514","443  >  54829 [ACK] Seq=224441 Ack=1 Win=501 Len=1448 TSval=1263276582 TSecr=1832799890 [TCP PDU reassembled in 170]"
"162","0.002847","23.9.158.105","10.1.30.131","TCP","1514","443  >  54829 [ACK] Seq=225889 Ack=1 Win=501 Len=1448 TSval=1263276582 TSecr=1832799890 [TCP PDU reassembled in 170]"
"163","0.002848","23.9.158.105","10.1.30.131","TCP","1514","443  >  54829 [ACK] Seq=227337 Ack=1 Win=501 Len=1448 TSval=1263276582 TSecr=1832799890 [TCP PDU reassembled in 170]"
"164","0.002849","23.9.158.105","10.1.30.131","TCP","1514","443  >  54829 [ACK] Seq=228785 Ack=1 Win=501 Len=1448 TSval=1263276582 TSecr=1832799890 [TCP PDU reassembled in 170]"
"165","0.002849","23.9.158.105","10.1.30.131","TCP","1514","443  >  54829 [ACK] Seq=230233 Ack=1 Win=501 Len=1448 TSval=1263276582 TSecr=1832799890 [TCP PDU reassembled in 170]"
"166","0.002850","23.9.158.105","10.1.30.131","TCP","1514","443  >  54829 [ACK] Seq=231681 Ack=1 Win=501 Len=1448 TSval=1263276582 TSecr=1832799890 [TCP PDU reassembled in 170]"
"167","0.002850","23.9.158.105","10.1.30.131","TCP","1514","443  >  54829 [ACK] Seq=233129 Ack=1 Win=501 Len=1448 TSval=1263276582 TSecr=1832799890 [TCP PDU reassembled in 170]"
"168","0.002851","23.9.158.105","10.1.30.131","TCP","1514","443  >  54829 [ACK] Seq=234577 Ack=1 Win=501 Len=1448 TSval=1263276582 TSecr=1832799890 [TCP PDU reassembled in 170]"
"169","0.002851","23.9.158.105","10.1.30.131","TCP","1514","443  >  54829 [ACK] Seq=236025 Ack=1 Win=501 Len=1448 TSval=1263276582 TSecr=1832799890 [TCP PDU reassembled in 170]"
"170","0.002852","23.9.158.105","10.1.30.131","SSLv2","1514","Encrypted Data"
"171","0.002852","23.9.158.105","10.1.30.131","TCP","1514","443  >  54829 [ACK] Seq=238921 Ack=1 Win=501 Len=1448 TSval=1263276582 TSecr=1832799890 [TCP PDU reassembled in 181]"
"172","0.002853","23.9.158.105","10.1.30.131","TCP","1514","443  >  54829 [ACK] Seq=240369 Ack=1 Win=501 Len=1448 TSval=1263276582 TSecr=1832799890 [TCP PDU reassembled in 181]"
"173","0.002853","23.9.158.105","10.1.30.131","TCP","1514","443  >  54829 [ACK] Seq=241817 Ack=1 Win=501 Len=1448 TSval=1263276582 TSecr=1832799890 [TCP PDU reassembled in 181]"
"174","0.002854","23.9.158.105","10.1.30.131","TCP","1514","443  >  54829 [ACK] Seq=243265 Ack=1 Win=501 Len=1448 TSval=1263276582 TSecr=1832799890 [TCP PDU reassembled in 181]"
"175","0.002854","23.9.158.105","10.1.30.131","TCP","1514","443  >  54829 [ACK] Seq=244713 Ack=1 Win=501 Len=1448 TSval=1263276582 TSecr=1832799890 [TCP PDU reassembled in 181]"
"176","0.002855","23.9.158.105","10.1.30.131","TCP","1514","443  >  54829 [ACK] Seq=246161 Ack=1 Win=501 Len=1448 TSval=1263276582 TSecr=1832799890 [TCP PDU reassembled in 181]"
"177","0.002855","23.9.158.105","10.1.30.131","TCP","1514","443  >  54829 [ACK] Seq=247609 Ack=1 Win=501 Len=1448 TSval=1263276582 TSecr=1832799890 [TCP PDU reassembled in 181]"
"178","0.002856","23.9.158.105","10.1.30.131","TCP","1514","443  >  54829 [ACK] Seq=249057 Ack=1 Win=501 Len=1448 TSval=1263276582 TSecr=1832799890 [TCP PDU reassembled in 181]"
"179","0.002856","23.9.158.105","10.1.30.131","TCP","1514","443  >  54829 [ACK] Seq=250505 Ack=1 Win=501 Len=1448 TSval=1263276582 TSecr=1832799890 [TCP PDU reassembled in 181]"
"180","0.002857","23.9.158.105","10.1.30.131","TCP","1514","443  >  54829 [ACK] Seq=251953 Ack=1 Win=501 Len=1448 TSval=1263276582 TSecr=1832799890 [TCP PDU reassembled in 181]"
"181","0.002857","23.9.158.105","10.1.30.131","SSLv2","1514","Encrypted Data"
"182","0.002858","23.9.158.105","10.1.30.131","TCP","1514","443  >  54829 [ACK] Seq=254849 Ack=1 Win=501 Len=1448 TSval=1263276582 TSecr=1832799890 [TCP PDU reassembled in 189]"
"183","0.002858","23.9.158.105","10.1.30.131","TCP","1514","443  >  54829 [ACK] Seq=256297 Ack=1 Win=501 Len=1448 TSval=1263276582 TSecr=1832799890 [TCP PDU reassembled in 189]"
"184","0.002859","23.9.158.105","10.1.30.131","TCP","1514","443  >  54829 [ACK] Seq=257745 Ack=1 Win=501 Len=1448 TSval=1263276582 TSecr=1832799890 [TCP PDU reassembled in 189]"
"185","0.002859","23.9.158.105","10.1.30.131","TCP","1514","443  >  54829 [ACK] Seq=259193 Ack=1 Win=501 Len=1448 TSval=1263276582 TSecr=1832799890 [TCP PDU reassembled in 189]"
"186","0.002860","23.9.158.105","10.1.30.131","TCP","1514","443  >  54829 [ACK] Seq=260641 Ack=1 Win=501 Len=1448 TSval=1263276582 TSecr=1832799890 [TCP PDU reassembled in 189]"
"187","0.002860","23.9.158.105","10.1.30.131","TCP","1514","443  >  54829 [ACK] Seq=262089 Ack=1 Win=501 Len=1448 TSval=1263276582 TSecr=1832799890 [TCP PDU reassembled in 189]"
"188","0.002907","23.9.158.105","10.1.30.131","TCP","1514","443  >  54829 [ACK] Seq=263537 Ack=1 Win=501 Len=1448 TSval=1263276582 TSecr=1832799890 [TCP PDU reassembled in 189]"
"189","0.002908","23.9.158.105","10.1.30.131","SSLv2","1514","Encrypted Data"
"190","0.002908","23.9.158.105","10.1.30.131","TCP","1514","443  >  54829 [ACK] Seq=266433 Ack=1 Win=501 Len=1448 TSval=1263276582 TSecr=1832799890 [TCP PDU reassembled in 199]"
"191","0.003349","10.1.30.131","23.9.158.105","TCP","66","54829  >  443 [ACK] Seq=1 Ack=267881 Win=65535 Len=0 TSval=1832799910 TSecr=1263276581"
"192","0.004838","23.9.158.105","10.1.30.131","TCP","1514","443  >  54829 [ACK] Seq=267881 Ack=1 Win=501 Len=1448 TSval=1263276582 TSecr=1832799890 [TCP PDU reassembled in 199]"
"193","0.004839","23.9.158.105","10.1.30.131","TCP","1514","443  >  54829 [ACK] Seq=269329 Ack=1 Win=501 Len=1448 TSval=1263276582 TSecr=1832799890 [TCP PDU reassembled in 199]"
"194","0.004840","23.9.158.105","10.1.30.131","TCP","1514","443  >  54829 [ACK] Seq=270777 Ack=1 Win=501 Len=1448 TSval=1263276582 TSecr=1832799890 [TCP PDU reassembled in 199]"
"195","0.004841","23.9.158.105","10.1.30.131","TCP","1514","443  >  54829 [ACK] Seq=272225 Ack=1 Win=501 Len=1448 TSval=1263276582 TSecr=1832799890 [TCP PDU reassembled in 199]"
"196","0.004841","23.9.158.105","10.1.30.131","TCP","1514","443  >  54829 [ACK] Seq=273673 Ack=1 Win=501 Len=1448 TSval=1263276582 TSecr=1832799890 [TCP PDU reassembled in 199]"
"197","0.004842","23.9.158.105","10.1.30.131","TCP","1514","443  >  54829 [ACK] Seq=275121 Ack=1 Win=501 Len=1448 TSval=1263276582 TSecr=1832799890 [TCP PDU reassembled in 199]"
"198","0.004843","23.9.158.105","10.1.30.131","TCP","1514","443  >  54829 [ACK] Seq=276569 Ack=1 Win=501 Len=1448 TSval=1263276582 TSecr=1832799890 [TCP PDU reassembled in 199]"
"199","0.004843","23.9.158.105","10.1.30.131","SSLv2","1514","Encrypted Data"
"200","0.004844","23.9.158.105","10.1.30.131","TCP","1514","443  >  54829 [ACK] Seq=279465 Ack=1 Win=501 Len=1448 TSval=1263276582 TSecr=1832799890 [TCP PDU reassembled in 219]"
"201","0.004845","23.9.158.105","10.1.30.131","TCP","1514","443  >  54829 [PSH, ACK] Seq=280913 Ack=1 Win=501 Len=1448 TSval=1263276582 TSecr=1832799890 [TCP PDU reassembled in 219]"
"202","0.004846","23.9.158.105","10.1.30.131","TCP","1514","443  >  54829 [ACK] Seq=282361 Ack=1 Win=501 Len=1448 TSval=1263276583 TSecr=1832799890 [TCP PDU reassembled in 219]"
"203","0.004846","23.9.158.105","10.1.30.131","TCP","1514","443  >  54829 [ACK] Seq=283809 Ack=1 Win=501 Len=1448 TSval=1263276583 TSecr=1832799890 [TCP PDU reassembled in 219]"
"204","0.004847","23.9.158.105","10.1.30.131","TCP","1514","443  >  54829 [ACK] Seq=285257 Ack=1 Win=501 Len=1448 TSval=1263276583 TSecr=1832799890 [TCP PDU reassembled in 219]"
"205","0.004848","23.9.158.105","10.1.30.131","TCP","1514","443  >  54829 [ACK] Seq=286705 Ack=1 Win=501 Len=1448 TSval=1263276583 TSecr=1832799890 [TCP PDU reassembled in 219]"
"206","0.004848","23.9.158.105","10.1.30.131","TCP","1514","443  >  54829 [ACK] Seq=288153 Ack=1 Win=501 Len=1448 TSval=1263276583 TSecr=1832799890 [TCP PDU reassembled in 219]"
"207","0.004849","23.9.158.105","10.1.30.131","TCP","1514","443  >  54829 [ACK] Seq=289601 Ack=1 Win=501 Len=1448 TSval=1263276583 TSecr=1832799890 [TCP PDU reassembled in 219]"
"208","0.004850","23.9.158.105","10.1.30.131","TCP","1514","443  >  54829 [ACK] Seq=291049 Ack=1 Win=501 Len=1448 TSval=1263276583 TSecr=1832799890 [TCP PDU reassembled in 219]"
"209","0.004850","23.9.158.105","10.1.30.131","TCP","1514","443  >  54829 [ACK] Seq=292497 Ack=1 Win=501 Len=1448 TSval=1263276583 TSecr=1832799890 [TCP PDU reassembled in 219]"
"210","0.004851","23.9.158.105","10.1.30.131","TCP","1514","443  >  54829 [ACK] Seq=293945 Ack=1 Win=501 Len=1448 TSval=1263276583 TSecr=1832799890 [TCP PDU reassembled in 219]"
"211","0.004852","23.9.158.105","10.1.30.131","TCP","1514","443  >  54829 [ACK] Seq=295393 Ack=1 Win=501 Len=1448 TSval=1263276583 TSecr=1832799890 [TCP PDU reassembled in 219]"
"212","0.004852","23.9.158.105","10.1.30.131","TCP","1514","443  >  54829 [ACK] Seq=296841 Ack=1 Win=501 Len=1448 TSval=1263276583 TSecr=1832799890 [TCP PDU reassembled in 219]"
"213","0.004853","23.9.158.105","10.1.30.131","TCP","1514","443  >  54829 [ACK] Seq=298289 Ack=1 Win=501 Len=1448 TSval=1263276583 TSecr=1832799890 [TCP PDU reassembled in 219]"
"214","0.004854","23.9.158.105","10.1.30.131","TCP","1514","443  >  54829 [ACK] Seq=299737 Ack=1 Win=501 Len=1448 TSval=1263276583 TSecr=1832799890 [TCP PDU reassembled in 219]"
"215","0.004854","23.9.158.105","10.1.30.131","TCP","1514","443  >  54829 [ACK] Seq=301185 Ack=1 Win=501 Len=1448 TSval=1263276583 TSecr=1832799890 [TCP PDU reassembled in 219]"
"216","0.004855","23.9.158.105","10.1.30.131","TCP","1514","443  >  54829 [ACK] Seq=302633 Ack=1 Win=501 Len=1448 TSval=1263276583 TSecr=1832799890 [TCP PDU reassembled in 219]"
"217","0.005131","10.1.30.131","23.9.158.105","TCP","66","54829  >  443 [ACK] Seq=1 Ack=304081 Win=65535 Len=0 TSval=1832799911 TSecr=1263276583"
"218","0.005293","23.9.158.105","10.1.30.131","TCP","1514","443  >  54829 [ACK] Seq=304081 Ack=1 Win=501 Len=1448 TSval=1263276583 TSecr=1832799890 [TCP PDU reassembled in 219]"
"219","0.005294","23.9.158.105","10.1.30.131","SSLv2","1514","Encrypted Data"
"220","0.005295","23.9.158.105","10.1.30.131","TCP","1514","443  >  54829 [ACK] Seq=306977 Ack=1 Win=501 Len=1448 TSval=1263276583 TSecr=1832799890 [TCP PDU reassembled in 230]"
"221","0.005295","23.9.158.105","10.1.30.131","TCP","1514","443  >  54829 [ACK] Seq=308425 Ack=1 Win=501 Len=1448 TSval=1263276583 TSecr=1832799890 [TCP PDU reassembled in 230]"
"222","0.005296","23.9.158.105","10.1.30.131","TCP","1514","443  >  54829 [ACK] Seq=309873 Ack=1 Win=501 Len=1448 TSval=1263276583 TSecr=1832799890 [TCP PDU reassembled in 230]"
"223","0.005296","23.9.158.105","10.1.30.131","TCP","1514","443  >  54829 [ACK] Seq=311321 Ack=1 Win=501 Len=1448 TSval=1263276583 TSecr=1832799890 [TCP PDU reassembled in 230]"
"224","0.005297","23.9.158.105","10.1.30.131","TCP","1514","443  >  54829 [ACK] Seq=312769 Ack=1 Win=501 Len=1448 TSval=1263276583 TSecr=1832799890 [TCP PDU reassembled in 230]"
"225","0.005298","23.9.158.105","10.1.30.131","TCP","1514","443  >  54829 [ACK] Seq=314217 Ack=1 Win=501 Len=1448 TSval=1263276583 TSecr=1832799890 [TCP PDU reassembled in 230]"
"226","0.005298","23.9.158.105","10.1.30.131","TCP","1514","443  >  54829 [ACK] Seq=315665 Ack=1 Win=501 Len=1448 TSval=1263276583 TSecr=1832799890 [TCP PDU reassembled in 230]"
"227","0.005299","23.9.158.105","10.1.30.131","TCP","1514","443  >  54829 [ACK] Seq=317113 Ack=1 Win=501 Len=1448 TSval=1263276583 TSecr=1832799890 [TCP PDU reassembled in 230]"
"228","0.005300","23.9.158.105","10.1.30.131","TCP","1514","443  >  54829 [ACK] Seq=318561 Ack=1 Win=501 Len=1448 TSval=1263276583 TSecr=1832799890 [TCP PDU reassembled in 230]"
"229","0.005300","23.9.158.105","10.1.30.131","TCP","1514","443  >  54829 [ACK] Seq=320009 Ack=1 Win=501 Len=1448 TSval=1263276583 TSecr=1832799890 [TCP PDU reassembled in 230]"
"230","0.005301","23.9.158.105","10.1.30.131","SSLv2","1514","Encrypted Data"
"231","0.005302","23.9.158.105","10.1.30.131","TCP","1514","443  >  54829 [ACK] Seq=322905 Ack=1 Win=501 Len=1448 TSval=1263276583 TSecr=1832799890 [TCP PDU reassembled in 236]"
"232","0.005303","23.9.158.105","10.1.30.131","TCP","1514","443  >  54829 [ACK] Seq=324353 Ack=1 Win=501 Len=1448 TSval=1263276583 TSecr=1832799890 [TCP PDU reassembled in 236]"
"233","0.005303","23.9.158.105","10.1.30.131","TCP","1514","443  >  54829 [ACK] Seq=325801 Ack=1 Win=501 Len=1448 TSval=1263276583 TSecr=1832799890 [TCP PDU reassembled in 236]"
"234","0.005304","23.9.158.105","10.1.30.131","TCP","1514","443  >  54829 [ACK] Seq=327249 Ack=1 Win=501 Len=1448 TSval=1263276583 TSecr=1832799890 [TCP PDU reassembled in 236]"
"235","0.005305","23.9.158.105","10.1.30.131","TCP","1514","443  >  54829 [ACK] Seq=328697 Ack=1 Win=501 Len=1448 TSval=1263276583 TSecr=1832799890 [TCP PDU reassembled in 236]"
"236","0.005306","23.9.158.105","10.1.30.131","SSLv2","1514","Encrypted Data"
"237","0.005306","23.9.158.105","10.1.30.131","TCP","1514","443  >  54829 [ACK] Seq=331593 Ack=1 Win=501 Len=1448 TSval=1263276583 TSecr=1832799890 [TCP PDU reassembled in 246]"
"238","0.005307","23.9.158.105","10.1.30.131","TCP","1514","443  >  54829 [ACK] Seq=333041 Ack=1 Win=501 Len=1448 TSval=1263276583 TSecr=1832799890 [TCP PDU reassembled in 246]"
"239","0.005308","23.9.158.105","10.1.30.131","TCP","1514","443  >  54829 [ACK] Seq=334489 Ack=1 Win=501 Len=1448 TSval=1263276583 TSecr=1832799890 [TCP PDU reassembled in 246]"
"240","0.005308","23.9.158.105","10.1.30.131","TCP","1514","443  >  54829 [ACK] Seq=335937 Ack=1 Win=501 Len=1448 TSval=1263276583 TSecr=1832799890 [TCP PDU reassembled in 246]"
"241","0.005309","23.9.158.105","10.1.30.131","TCP","1514","443  >  54829 [ACK] Seq=337385 Ack=1 Win=501 Len=1448 TSval=1263276583 TSecr=1832799890 [TCP PDU reassembled in 246]"
"242","0.005310","23.9.158.105","10.1.30.131","TCP","1514","443  >  54829 [ACK] Seq=338833 Ack=1 Win=501 Len=1448 TSval=1263276583 TSecr=1832799890 [TCP PDU reassembled in 246]"
"243","0.005310","23.9.158.105","10.1.30.131","TCP","1514","443  >  54829 [ACK] Seq=340281 Ack=1 Win=501 Len=1448 TSval=1263276583 TSecr=1832799890 [TCP PDU reassembled in 246]"
"244","0.005311","23.9.158.105","10.1.30.131","TCP","1514","443  >  54829 [ACK] Seq=341729 Ack=1 Win=501 Len=1448 TSval=1263276583 TSecr=1832799890 [TCP PDU reassembled in 246]"
"245","0.005312","23.9.158.105","10.1.30.131","TCP","1514","443  >  54829 [ACK] Seq=343177 Ack=1 Win=501 Len=1448 TSval=1263276583 TSecr=1832799890 [TCP PDU reassembled in 246]"
"246","0.005313","23.9.158.105","10.1.30.131","SSLv2","1514","Encrypted Data"
"247","0.005313","23.9.158.105","10.1.30.131","SSLv2","1514","Encrypted Data"
"248","0.005314","23.9.158.105","10.1.30.131","TCP","1514","443  >  54829 [ACK] Seq=347521 Ack=1 Win=501 Len=1448 TSval=1263276584 TSecr=1832799890 [TCP PDU reassembled in 256]"
"249","0.005315","23.9.158.105","10.1.30.131","TCP","1514","443  >  54829 [ACK] Seq=348969 Ack=1 Win=501 Len=1448 TSval=1263276584 TSecr=1832799890 [TCP PDU reassembled in 256]"
"250","0.005315","23.9.158.105","10.1.30.131","TCP","1514","443  >  54829 [ACK] Seq=350417 Ack=1 Win=501 Len=1448 TSval=1263276584 TSecr=1832799890 [TCP PDU reassembled in 256]"
"251","0.005316","23.9.158.105","10.1.30.131","TCP","1514","443  >  54829 [ACK] Seq=351865 Ack=1 Win=501 Len=1448 TSval=1263276584 TSecr=1832799890 [TCP PDU reassembled in 256]"
"252","0.005317","23.9.158.105","10.1.30.131","TCP","1514","443  >  54829 [ACK] Seq=353313 Ack=1 Win=501 Len=1448 TSval=1263276584 TSecr=1832799890 [TCP PDU reassembled in 256]"
"253","0.005317","23.9.158.105","10.1.30.131","TCP","1514","443  >  54829 [ACK] Seq=354761 Ack=1 Win=501 Len=1448 TSval=1263276584 TSecr=1832799890 [TCP PDU reassembled in 256]"
"254","0.005318","23.9.158.105","10.1.30.131","TCP","1514","443  >  54829 [ACK] Seq=356209 Ack=1 Win=501 Len=1448 TSval=1263276584 TSecr=1832799890 [TCP PDU reassembled in 256]"
"255","0.005318","23.9.158.105","10.1.30.131","TCP","1514","443  >  54829 [ACK] Seq=357657 Ack=1 Win=501 Len=1448 TSval=1263276584 TSecr=1832799890 [TCP PDU reassembled in 256]"
"256","0.005319","23.9.158.105","10.1.30.131","SSLv2","1514","Encrypted Data"
"257","0.005320","23.9.158.105","10.1.30.131","TCP","1514","443  >  54829 [ACK] Seq=360553 Ack=1 Win=501 Len=1448 TSval=1263276584 TSecr=1832799890 [TCP PDU reassembled in 259]"
"258","0.005321","23.9.158.105","10.1.30.131","TCP","1514","443  >  54829 [ACK] Seq=362001 Ack=1 Win=501 Len=1448 TSval=1263276584 TSecr=1832799890 [TCP PDU reassembled in 259]"
"259","0.005322","23.9.158.105","10.1.30.131","SSLv2","1514","Encrypted Data"
"260","0.005322","23.9.158.105","10.1.30.131","TCP","1514","443  >  54829 [ACK] Seq=364897 Ack=1 Win=501 Len=1448 TSval=1263276584 TSecr=1832799890 [TCP PDU reassembled in 264]"
"261","0.005323","23.9.158.105","10.1.30.131","TCP","1514","443  >  54829 [ACK] Seq=366345 Ack=1 Win=501 Len=1448 TSval=1263276584 TSecr=1832799890 [TCP PDU reassembled in 264]"
"262","0.005324","23.9.158.105","10.1.30.131","TCP","1514","443  >  54829 [ACK] Seq=367793 Ack=1 Win=501 Len=1448 TSval=1263276584 TSecr=1832799890 [TCP PDU reassembled in 264]"
"263","0.005324","23.9.158.105","10.1.30.131","TCP","1514","443  >  54829 [ACK] Seq=369241 Ack=1 Win=501 Len=1448 TSval=1263276584 TSecr=1832799890 [TCP PDU reassembled in 264]"
"264","0.005325","23.9.158.105","10.1.30.131","SSLv2","1514","Encrypted Data"
"265","0.005326","23.9.158.105","10.1.30.131","TCP","1514","443  >  54829 [ACK] Seq=372137 Ack=1 Win=501 Len=1448 TSval=1263276584 TSecr=1832799890 [TCP PDU reassembled in 278]"
"266","0.005326","23.9.158.105","10.1.30.131","TCP","1514","443  >  54829 [ACK] Seq=373585 Ack=1 Win=501 Len=1448 TSval=1263276584 TSecr=1832799890 [TCP PDU reassembled in 278]"
