"No.","Time","Source","Destination","Protocol","Length","Info"
"1","0.000000","100.86.243.187","23.13.164.38","TLSv1.2","1160","Application Data"
"2","0.000256","100.86.243.187","23.13.164.38","TLSv1.2","413","Application Data"
"3","0.000522","100.86.243.187","23.13.164.38","TLSv1.2","408","Application Data"
"4","0.000767","100.86.243.187","23.13.164.38","TLSv1.2","310","Application Data"
"5","0.001366","100.86.243.187","23.13.164.38","TLSv1.2","387","Application Data"
"6","0.002473","100.86.243.187","23.13.164.38","TLSv1.2","606","Application Data"
"11","0.002900","100.86.243.187","23.13.164.38","TLSv1.2","325","Application Data"
"14","0.003357","100.86.243.187","23.13.164.38","TLSv1.2","292","Application Data"
"15","0.003689","100.86.243.187","23.13.164.38","TLSv1.2","298","Application Data"
"16","0.003863","100.86.243.187","23.13.164.38","TLSv1.2","308","Application Data"
"17","0.009890","23.13.164.38","100.86.243.187","TCP","66","443  >  54993 [ACK] Seq=1 Ack=1095 Win=1361 Len=0 TSval=1115337301 TSecr=931303651"
"18","0.011219","23.13.164.38","100.86.243.187","TCP","66","443  >  54993 [ACK] Seq=1 Ack=2028 Win=1429 Len=0 TSval=1115337301 TSecr=931303651"
"22","0.012377","23.13.164.38","100.86.243.187","TCP","66","443  >  54993 [ACK] Seq=1 Ack=2889 Win=1474 Len=0 TSval=1115337303 TSecr=931303653"
"24","0.013371","23.13.164.38","100.86.243.187","TCP","66","443  >  54993 [ACK] Seq=1 Ack=3374 Win=1519 Len=0 TSval=1115337304 TSecr=931303653"
"25","0.013734","23.13.164.38","100.86.243.187","TCP","66","443  >  54993 [ACK] Seq=1 Ack=3848 Win=1564 Len=0 TSval=1115337304 TSecr=931303654"
"36","0.068393","23.13.164.38","100.86.243.187","TLSv1.2","453","Application Data"
"37","0.068394","23.13.164.38","100.86.243.187","TCP","1514","443  >  54993 [ACK] Seq=388 Ack=3848 Win=1564 Len=1448 TSval=1115337359 TSecr=931303654 [TCP PDU reassembled in 45]"
"38","0.068395","23.13.164.38","100.86.243.187","TCP","1514","443  >  54993 [ACK] Seq=1836 Ack=3848 Win=1564 Len=1448 TSval=1115337359 TSecr=931303654 [TCP PDU reassembled in 45]"
"39","0.068432","23.13.164.38","100.86.243.187","TCP","1514","443  >  54993 [ACK] Seq=3284 Ack=3848 Win=1564 Len=1448 TSval=1115337359 TSecr=931303654 [TCP PDU reassembled in 45]"
"40","0.068433","23.13.164.38","100.86.243.187","TCP","1514","443  >  54993 [ACK] Seq=4732 Ack=3848 Win=1564 Len=1448 TSval=1115337359 TSecr=931303654 [TCP PDU reassembled in 45]"
"41","0.068496","100.86.243.187","23.13.164.38","TCP","66","54993  >  443 [ACK] Seq=3848 Ack=3284 Win=37404 Len=0 TSval=931303719 TSecr=1115337359"
"42","0.068550","100.86.243.187","23.13.164.38","TCP","66","54993  >  443 [ACK] Seq=3848 Ack=6180 Win=37359 Len=0 TSval=931303719 TSecr=1115337359"
"43","0.068713","100.86.243.187","23.13.164.38","TCP","66","[TCP Window Update] 54993  >  443 [ACK] Seq=3848 Ack=6180 Win=37456 Len=0 TSval=931303719 TSecr=1115337359"
"44","0.068933","23.13.164.38","100.86.243.187","TCP","1514","443  >  54993 [ACK] Seq=6180 Ack=3848 Win=1564 Len=1448 TSval=1115337359 TSecr=931303654 [TCP PDU reassembled in 45]"
"45","0.068934","23.13.164.38","100.86.243.187","TLSv1.2","1255","Application Data"
"46","0.068979","100.86.243.187","23.13.164.38","TCP","66","54993  >  443 [ACK] Seq=3848 Ack=8817 Win=37414 Len=0 TSval=931303719 TSecr=1115337359"
"47","0.069233","23.13.164.38","100.86.243.187","TLSv1.2","461","Application Data"
"48","0.069234","23.13.164.38","100.86.243.187","TCP","1514","443  >  54993 [ACK] Seq=9212 Ack=3848 Win=1564 Len=1448 TSval=1115337359 TSecr=931303654 [TCP PDU reassembled in 62]"
"49","0.069291","100.86.243.187","23.13.164.38","TCP","66","54993  >  443 [ACK] Seq=3848 Ack=10660 Win=37427 Len=0 TSval=931303719 TSecr=1115337359"
"50","0.069446","23.13.164.38","100.86.243.187","TCP","1514","443  >  54993 [ACK] Seq=10660 Ack=3848 Win=1564 Len=1448 TSval=1115337359 TSecr=931303654 [TCP PDU reassembled in 62]"
"51","0.069447","23.13.164.38","100.86.243.187","TCP","1514","443  >  54993 [ACK] Seq=12108 Ack=3848 Win=1564 Len=1448 TSval=1115337359 TSecr=931303654 [TCP PDU reassembled in 62]"
"52","0.069448","23.13.164.38","100.86.243.187","TCP","1514","443  >  54993 [ACK] Seq=13556 Ack=3848 Win=1564 Len=1448 TSval=1115337359 TSecr=931303654 [TCP PDU reassembled in 62]"
"53","0.069449","23.13.164.38","100.86.243.187","TCP","1514","443  >  54993 [ACK] Seq=15004 Ack=3848 Win=1564 Len=1448 TSval=1115337359 TSecr=931303654 [TCP PDU reassembled in 62]"
"54","0.069490","100.86.243.187","23.13.164.38","TCP","66","54993  >  443 [ACK] Seq=3848 Ack=16452 Win=37365 Len=0 TSval=931303720 TSecr=1115337359"
"55","0.069536","100.86.243.187","23.13.164.38","TCP","66","[TCP Window Update] 54993  >  443 [ACK] Seq=3848 Ack=16452 Win=37456 Len=0 TSval=931303720 TSecr=1115337359"
"56","0.071241","23.13.164.38","100.86.243.187","TCP","1514","443  >  54993 [ACK] Seq=16452 Ack=3848 Win=1564 Len=1448 TSval=1115337359 TSecr=931303654 [TCP PDU reassembled in 62]"
"57","0.071242","23.13.164.38","100.86.243.187","TCP","1514","443  >  54993 [ACK] Seq=17900 Ack=3848 Win=1564 Len=1448 TSval=1115337359 TSecr=931303654 [TCP PDU reassembled in 62]"
"58","0.071246","23.13.164.38","100.86.243.187","TCP","1514","443  >  54993 [ACK] Seq=19348 Ack=3848 Win=1564 Len=1448 TSval=1115337359 TSecr=931303654 [TCP PDU reassembled in 62]"
"59","0.071247","23.13.164.38","100.86.243.187","TCP","1514","443  >  54993 [ACK] Seq=20796 Ack=3848 Win=1564 Len=1448 TSval=1115337359 TSecr=931303654 [TCP PDU reassembled in 62]"
"60","0.071247","23.13.164.38","100.86.243.187","TCP","1514","443  >  54993 [PSH, ACK] Seq=22244 Ack=3848 Win=1564 Len=1448 TSval=1115337359 TSecr=931303654 [TCP PDU reassembled in 62]"
"61","0.071248","23.13.164.38","100.86.243.187","TCP","1514","443  >  54993 [ACK] Seq=23692 Ack=3848 Win=1564 Len=1448 TSval=1115337360 TSecr=931303654 [TCP PDU reassembled in 62]"
"62","0.071249","23.13.164.38","100.86.243.187","TLSv1.2","1514","Application Data, Application Data"
"63","0.071250","23.13.164.38","100.86.243.187","TCP","1514","443  >  54993 [ACK] Seq=26588 Ack=3848 Win=1564 Len=1448 TSval=1115337360 TSecr=931303654 [TCP PDU reassembled in 67]"
"64","0.071250","23.13.164.38","100.86.243.187","TCP","1514","443  >  54993 [ACK] Seq=28036 Ack=3848 Win=1564 Len=1448 TSval=1115337360 TSecr=931303654 [TCP PDU reassembled in 67]"
"65","0.071251","23.13.164.38","100.86.243.187","TCP","1514","443  >  54993 [ACK] Seq=29484 Ack=3848 Win=1564 Len=1448 TSval=1115337360 TSecr=931303654 [TCP PDU reassembled in 67]"
"66","0.071252","23.13.164.38","100.86.243.187","TCP","1514","443  >  54993 [ACK] Seq=30932 Ack=3848 Win=1564 Len=1448 TSval=1115337360 TSecr=931303654 [TCP PDU reassembled in 67]"
"67","0.071253","23.13.164.38","100.86.243.187","TLSv1.2","1514","Application Data, Application Data"
"68","0.071255","23.13.164.38","100.86.243.187","TCP","1514","443  >  54993 [ACK] Seq=33828 Ack=3848 Win=1564 Len=1448 TSval=1115337360 TSecr=931303654 [TCP PDU reassembled in 80]"
"69","0.071255","23.13.164.38","100.86.243.187","TCP","1514","443  >  54993 [ACK] Seq=35276 Ack=3848 Win=1564 Len=1448 TSval=1115337360 TSecr=931303654 [TCP PDU reassembled in 80]"
"70","0.071364","100.86.243.187","23.13.164.38","TCP","66","54993  >  443 [ACK] Seq=3848 Ack=32380 Win=37207 Len=0 TSval=931303722 TSecr=1115337360"
"71","0.071718","100.86.243.187","23.13.164.38","TCP","66","54993  >  443 [ACK] Seq=3848 Ack=36724 Win=37456 Len=0 TSval=931303722 TSecr=1115337360"
"72","0.073258","23.13.164.38","100.86.243.187","TCP","1514","443  >  54993 [PSH, ACK] Seq=36724 Ack=3848 Win=1564 Len=1448 TSval=1115337360 TSecr=931303654 [TCP PDU reassembled in 80]"
"73","0.073258","23.13.164.38","100.86.243.187","TCP","1514","443  >  54993 [ACK] Seq=38172 Ack=3848 Win=1564 Len=1448 TSval=1115337361 TSecr=931303654 [TCP PDU reassembled in 80]"
"74","0.073260","23.13.164.38","100.86.243.187","TCP","1514","443  >  54993 [ACK] Seq=39620 Ack=3848 Win=1564 Len=1448 TSval=1115337361 TSecr=931303654 [TCP PDU reassembled in 80]"
"75","0.073261","23.13.164.38","100.86.243.187","TCP","1514","443  >  54993 [ACK] Seq=41068 Ack=3848 Win=1564 Len=1448 TSval=1115337361 TSecr=931303654 [TCP PDU reassembled in 80]"
"76","0.073261","23.13.164.38","100.86.243.187","TCP","1514","443  >  54993 [ACK] Seq=42516 Ack=3848 Win=1564 Len=1448 TSval=1115337361 TSecr=931303654 [TCP PDU reassembled in 80]"
"77","0.073265","23.13.164.38","100.86.243.187","TCP","1514","443  >  54993 [ACK] Seq=43964 Ack=3848 Win=1564 Len=1448 TSval=1115337361 TSecr=931303654 [TCP PDU reassembled in 80]"
"78","0.073265","23.13.164.38","100.86.243.187","TCP","1514","443  >  54993 [ACK] Seq=45412 Ack=3848 Win=1564 Len=1448 TSval=1115337361 TSecr=931303654 [TCP PDU reassembled in 80]"
"79","0.073266","23.13.164.38","100.86.243.187","TCP","1514","443  >  54993 [ACK] Seq=46860 Ack=3848 Win=1564 Len=1448 TSval=1115337361 TSecr=931303654 [TCP PDU reassembled in 80]"
"80","0.073267","23.13.164.38","100.86.243.187","TLSv1.2","1514","Application Data, Application Data"
"81","0.073267","23.13.164.38","100.86.243.187","TCP","1514","443  >  54993 [ACK] Seq=49756 Ack=3848 Win=1564 Len=1448 TSval=1115337361 TSecr=931303654 [TCP PDU reassembled in 92]"
"82","0.073268","23.13.164.38","100.86.243.187","TCP","1514","443  >  54993 [PSH, ACK] Seq=51204 Ack=3848 Win=1564 Len=1448 TSval=1115337361 TSecr=931303654 [TCP PDU reassembled in 92]"
"83","0.073269","23.13.164.38","100.86.243.187","TCP","1514","443  >  54993 [ACK] Seq=52652 Ack=3848 Win=1564 Len=1448 TSval=1115337362 TSecr=931303654 [TCP PDU reassembled in 92]"
"84","0.073269","23.13.164.38","100.86.243.187","TCP","1514","443  >  54993 [ACK] Seq=54100 Ack=3848 Win=1564 Len=1448 TSval=1115337362 TSecr=931303654 [TCP PDU reassembled in 92]"
"85","0.073270","23.13.164.38","100.86.243.187","TCP","1514","443  >  54993 [ACK] Seq=55548 Ack=3848 Win=1564 Len=1448 TSval=1115337362 TSecr=931303654 [TCP PDU reassembled in 92]"
"86","0.073271","23.13.164.38","100.86.243.187","TCP","1514","443  >  54993 [ACK] Seq=56996 Ack=3848 Win=1564 Len=1448 TSval=1115337362 TSecr=931303654 [TCP PDU reassembled in 92]"
"87","0.073271","23.13.164.38","100.86.243.187","TCP","1514","443  >  54993 [ACK] Seq=58444 Ack=3848 Win=1564 Len=1448 TSval=1115337362 TSecr=931303654 [TCP PDU reassembled in 92]"
"88","0.073272","23.13.164.38","100.86.243.187","TCP","1514","443  >  54993 [ACK] Seq=59892 Ack=3848 Win=1564 Len=1448 TSval=1115337362 TSecr=931303654 [TCP PDU reassembled in 92]"
"89","0.073273","23.13.164.38","100.86.243.187","TCP","1514","443  >  54993 [ACK] Seq=61340 Ack=3848 Win=1564 Len=1448 TSval=1115337362 TSecr=931303654 [TCP PDU reassembled in 92]"
"90","0.073502","23.13.164.38","100.86.243.187","TCP","1514","443  >  54993 [ACK] Seq=62788 Ack=3848 Win=1564 Len=1448 TSval=1115337362 TSecr=931303654 [TCP PDU reassembled in 92]"
"91","0.073503","23.13.164.38","100.86.243.187","TCP","1514","443  >  54993 [ACK] Seq=64236 Ack=3848 Win=1564 Len=1448 TSval=1115337362 TSecr=931303654 [TCP PDU reassembled in 92]"
"92","0.073503","23.13.164.38","100.86.243.187","TLSv1.2","1514","Application Data, Application Data"
"93","0.073507","23.13.164.38","100.86.243.187","TCP","1514","443  >  54993 [ACK] Seq=67132 Ack=3848 Win=1564 Len=1448 TSval=1115337363 TSecr=931303654 [TCP PDU reassembled in 264]"
"94","0.073536","100.86.243.187","23.13.164.38","TCP","66","54993  >  443 [ACK] Seq=3848 Ack=62788 Win=37456 Len=0 TSval=931303724 TSecr=1115337361"
"95","0.073640","100.86.243.187","23.13.164.38","TCP","66","54993  >  443 [ACK] Seq=3848 Ack=68580 Win=37456 Len=0 TSval=931303724 TSecr=1115337363"
"96","0.073847","23.13.164.38","100.86.243.187","TCP","1514","443  >  54993 [ACK] Seq=68580 Ack=3848 Win=1564 Len=1448 TSval=1115337363 TSecr=931303654 [TCP PDU reassembled in 264]"
"97","0.073848","23.13.164.38","100.86.243.187","TCP","1514","443  >  54993 [ACK] Seq=70028 Ack=3848 Win=1564 Len=1448 TSval=1115337363 TSecr=931303654 [TCP PDU reassembled in 264]"
"98","0.073924","100.86.243.187","23.13.164.38","TCP","66","54993  >  443 [ACK] Seq=3848 Ack=71476 Win=37456 Len=0 TSval=931303724 TSecr=1115337363"
"99","0.075224","23.13.164.38","100.86.243.187","TCP","1514","443  >  54993 [ACK] Seq=71476 Ack=3848 Win=1564 Len=1448 TSval=1115337363 TSecr=931303654 [TCP PDU reassembled in 264]"
"100","0.075225","23.13.164.38","100.86.243.187","TCP","1514","443  >  54993 [ACK] Seq=72924 Ack=3848 Win=1564 Len=1448 TSval=1115337363 TSecr=931303654 [TCP PDU reassembled in 264]"
"101","0.075227","23.13.164.38","100.86.243.187","TCP","1514","443  >  54993 [ACK] Seq=74372 Ack=3848 Win=1564 Len=1448 TSval=1115337363 TSecr=931303654 [TCP PDU reassembled in 264]"
"102","0.075227","23.13.164.38","100.86.243.187","TCP","1514","443  >  54993 [ACK] Seq=75820 Ack=3848 Win=1564 Len=1448 TSval=1115337363 TSecr=931303654 [TCP PDU reassembled in 264]"
"103","0.075228","23.13.164.38","100.86.243.187","TCP","1514","[TCP Previous segment not captured] 443  >  54993 [ACK] Seq=78716 Ack=3848 Win=1564 Len=1448 TSval=1115337363 TSecr=931303654 [TCP PDU reassembled in 264]"
"104","0.075229","23.13.164.38","100.86.243.187","TCP","1514","443  >  54993 [PSH, ACK] Seq=80164 Ack=3848 Win=1564 Len=1448 TSval=1115337363 TSecr=931303654 [TCP PDU reassembled in 264]"
"105","0.075238","23.13.164.38","100.86.243.187","TCP","1514","443  >  54993 [ACK] Seq=81612 Ack=3848 Win=1564 Len=1448 TSval=1115337364 TSecr=931303654 [TCP PDU reassembled in 264], Application Data"
"106","0.075238","23.13.164.38","100.86.243.187","TCP","1514","443  >  54993 [ACK] Seq=83060 Ack=3848 Win=1564 Len=1448 TSval=1115337364 TSecr=931303654 [TCP PDU reassembled in 112]"
"107","0.075239","23.13.164.38","100.86.243.187","TCP","1514","443  >  54993 [ACK] Seq=84508 Ack=3848 Win=1564 Len=1448 TSval=1115337364 TSecr=931303654 [TCP PDU reassembled in 112]"
"108","0.075239","23.13.164.38","100.86.243.187","TCP","1514","443  >  54993 [ACK] Seq=85956 Ack=3848 Win=1564 Len=1448 TSval=1115337364 TSecr=931303654 [TCP PDU reassembled in 112]"
"109","0.075240","23.13.164.38","100.86.243.187","TCP","1514","443  >  54993 [ACK] Seq=87404 Ack=3848 Win=1564 Len=1448 TSval=1115337364 TSecr=931303654 [TCP PDU reassembled in 112]"
"110","0.075241","23.13.164.38","100.86.243.187","TCP","1514","443  >  54993 [ACK] Seq=88852 Ack=3848 Win=1564 Len=1448 TSval=1115337364 TSecr=931303654 [TCP PDU reassembled in 112]"
"111","0.075241","23.13.164.38","100.86.243.187","TCP","1514","443  >  54993 [ACK] Seq=90300 Ack=3848 Win=1564 Len=1448 TSval=1115337364 TSecr=931303654 [TCP PDU reassembled in 112]"
"112","0.075242","23.13.164.38","100.86.243.187","TLSv1.2","1514","Application Data, Application Data, Application Data"
"113","0.075243","23.13.164.38","100.86.243.187","TLSv1.2","1514","Application Data"
"114","0.075244","23.13.164.38","100.86.243.187","TCP","1514","443  >  54993 [PSH, ACK] Seq=94644 Ack=3848 Win=1564 Len=1448 TSval=1115337364 TSecr=931303654 [TCP PDU reassembled in 128]"
"115","0.075279","23.13.164.38","100.86.243.187","TCP","1514","443  >  54993 [ACK] Seq=96092 Ack=3848 Win=1564 Len=1448 TSval=1115337365 TSecr=931303654 [TCP PDU reassembled in 128]"
"116","0.075280","23.13.164.38","100.86.243.187","TCP","1514","443  >  54993 [ACK] Seq=97540 Ack=3848 Win=1564 Len=1448 TSval=1115337365 TSecr=931303654 [TCP PDU reassembled in 128]"
"117","0.075332","100.86.243.187","23.13.164.38","TCP","78","54993  >  443 [ACK] Seq=3848 Ack=77268 Win=37365 Len=0 TSval=931303726 TSecr=1115337363 SLE=78716 SRE=94644"
"118","0.075369","100.86.243.187","23.13.164.38","TCP","78","[TCP Dup ACK 117#1] 54993  >  443 [ACK] Seq=3848 Ack=77268 Win=37456 Len=0 TSval=931303726 TSecr=1115337363 SLE=78716 SRE=94644"
"119","0.075388","100.86.243.187","23.13.164.38","TCP","78","[TCP Dup ACK 117#2] 54993  >  443 [ACK] Seq=3848 Ack=77268 Win=37456 Len=0 TSval=931303726 TSecr=1115337363 SLE=78716 SRE=96092"
"120","0.075459","23.13.164.38","100.86.243.187","TCP","1514","443  >  54993 [ACK] Seq=98988 Ack=3848 Win=1564 Len=1448 TSval=1115337365 TSecr=931303654 [TCP PDU reassembled in 128]"
"121","0.075460","23.13.164.38","100.86.243.187","TCP","1514","443  >  54993 [ACK] Seq=100436 Ack=3848 Win=1564 Len=1448 TSval=1115337365 TSecr=931303654 [TCP PDU reassembled in 128]"
"122","0.075517","100.86.243.187","23.13.164.38","TCP","78","[TCP Dup ACK 117#3] 54993  >  443 [ACK] Seq=3848 Ack=77268 Win=37456 Len=0 TSval=931303726 TSecr=1115337363 SLE=78716 SRE=101884"
"123","0.076908","23.13.164.38","100.86.243.187","TCP","1514","443  >  54993 [ACK] Seq=101884 Ack=3848 Win=1564 Len=1448 TSval=1115337365 TSecr=931303654 [TCP PDU reassembled in 128]"
"124","0.076909","23.13.164.38","100.86.243.187","TCP","1514","443  >  54993 [ACK] Seq=103332 Ack=3848 Win=1564 Len=1448 TSval=1115337365 TSecr=931303654 [TCP PDU reassembled in 128]"
"125","0.076910","23.13.164.38","100.86.243.187","TCP","1514","443  >  54993 [ACK] Seq=104780 Ack=3848 Win=1564 Len=1448 TSval=1115337365 TSecr=931303654 [TCP PDU reassembled in 128]"
"126","0.076911","23.13.164.38","100.86.243.187","TCP","1514","443  >  54993 [ACK] Seq=106228 Ack=3848 Win=1564 Len=1448 TSval=1115337365 TSecr=931303654 [TCP PDU reassembled in 128]"
"127","0.076915","23.13.164.38","100.86.243.187","TCP","1514","443  >  54993 [ACK] Seq=107676 Ack=3848 Win=1564 Len=1448 TSval=1115337365 TSecr=931303654 [TCP PDU reassembled in 128]"
"128","0.076916","23.13.164.38","100.86.243.187","TLSv1.2","1514","Application Data, Application Data"
"129","0.076917","23.13.164.38","100.86.243.187","TCP","1514","443  >  54993 [ACK] Seq=110572 Ack=3848 Win=1564 Len=1448 TSval=1115337366 TSecr=931303654 [TCP PDU reassembled in 144]"
"130","0.076918","23.13.164.38","100.86.243.187","TCP","1514","443  >  54993 [ACK] Seq=112020 Ack=3848 Win=1564 Len=1448 TSval=1115337366 TSecr=931303654 [TCP PDU reassembled in 144]"
"131","0.076918","23.13.164.38","100.86.243.187","TCP","1514","443  >  54993 [ACK] Seq=113468 Ack=3848 Win=1564 Len=1448 TSval=1115337366 TSecr=931303654 [TCP PDU reassembled in 144]"
"132","0.076919","23.13.164.38","100.86.243.187","TCP","1514","443  >  54993 [ACK] Seq=114916 Ack=3848 Win=1564 Len=1448 TSval=1115337366 TSecr=931303654 [TCP PDU reassembled in 144]"
"133","0.076920","23.13.164.38","100.86.243.187","TCP","1514","443  >  54993 [PSH, ACK] Seq=116364 Ack=3848 Win=1564 Len=1448 TSval=1115337366 TSecr=931303654 [TCP PDU reassembled in 144]"
"135","0.076921","23.13.164.38","100.86.243.187","TCP","1514","443  >  54993 [ACK] Seq=117812 Ack=3848 Win=1564 Len=1448 TSval=1115337366 TSecr=931303654 [TCP PDU reassembled in 144]"
"136","0.076922","23.13.164.38","100.86.243.187","TCP","1514","443  >  54993 [ACK] Seq=119260 Ack=3848 Win=1564 Len=1448 TSval=1115337366 TSecr=931303654 [TCP PDU reassembled in 144]"
"137","0.076966","23.13.164.38","100.86.243.187","TCP","1514","443  >  54993 [ACK] Seq=120708 Ack=3848 Win=1564 Len=1448 TSval=1115337366 TSecr=931303654 [TCP PDU reassembled in 144]"
"138","0.076967","23.13.164.38","100.86.243.187","TCP","1514","443  >  54993 [ACK] Seq=122156 Ack=3848 Win=1564 Len=1448 TSval=1115337366 TSecr=931303654 [TCP PDU reassembled in 144]"
"139","0.077056","100.86.243.187","23.13.164.38","TCP","78","[TCP Dup ACK 117#4] 54993  >  443 [ACK] Seq=3848 Ack=77268 Win=37456 Len=0 TSval=931303728 TSecr=1115337363 SLE=78716 SRE=117812"
"140","0.077096","100.86.243.187","23.13.164.38","TCP","78","[TCP Dup ACK 117#5] 54993  >  443 [ACK] Seq=3848 Ack=77268 Win=37456 Len=0 TSval=931303728 TSecr=1115337363 SLE=78716 SRE=120708"
"142","0.077113","100.86.243.187","23.13.164.38","TCP","78","[TCP Dup ACK 117#6] 54993  >  443 [ACK] Seq=3848 Ack=77268 Win=37456 Len=0 TSval=931303728 TSecr=1115337363 SLE=78716 SRE=123604"
"143","0.078683","23.13.164.38","100.86.243.187","TCP","1514","443  >  54993 [ACK] Seq=123604 Ack=3848 Win=1564 Len=1448 TSval=1115337366 TSecr=931303654 [TCP PDU reassembled in 144]"
"144","0.078686","23.13.164.38","100.86.243.187","TLSv1.2","1514","Application Data, Application Data"
"145","0.078688","23.13.164.38","100.86.243.187","TCP","1514","443  >  54993 [ACK] Seq=126500 Ack=3848 Win=1564 Len=1448 TSval=1115337366 TSecr=931303654 [TCP PDU reassembled in 159]"
"146","0.078690","23.13.164.38","100.86.243.187","TCP","1514","443  >  54993 [ACK] Seq=127948 Ack=3848 Win=1564 Len=1448 TSval=1115337366 TSecr=931303654 [TCP PDU reassembled in 159]"
"147","0.078692","23.13.164.38","100.86.243.187","TCP","1514","443  >  54993 [ACK] Seq=129396 Ack=3848 Win=1564 Len=1448 TSval=1115337366 TSecr=931303654 [TCP PDU reassembled in 159]"
"148","0.078693","23.13.164.38","100.86.243.187","TCP","1514","443  >  54993 [PSH, ACK] Seq=130844 Ack=3848 Win=1564 Len=1448 TSval=1115337366 TSecr=931303654 [TCP PDU reassembled in 159]"
"150","0.078695","23.13.164.38","100.86.243.187","TCP","1514","443  >  54993 [ACK] Seq=132292 Ack=3848 Win=1564 Len=1448 TSval=1115337367 TSecr=931303654 [TCP PDU reassembled in 159]"
"151","0.078697","23.13.164.38","100.86.243.187","TCP","1514","443  >  54993 [ACK] Seq=133740 Ack=3848 Win=1564 Len=1448 TSval=1115337367 TSecr=931303654 [TCP PDU reassembled in 159]"
"152","0.078699","23.13.164.38","100.86.243.187","TCP","1514","443  >  54993 [ACK] Seq=135188 Ack=3848 Win=1564 Len=1448 TSval=1115337367 TSecr=931303654 [TCP PDU reassembled in 159]"
"153","0.078704","23.13.164.38","100.86.243.187","TCP","1514","443  >  54993 [ACK] Seq=136636 Ack=3848 Win=1564 Len=1448 TSval=1115337367 TSecr=931303654 [TCP PDU reassembled in 159]"
"154","0.078707","23.13.164.38","100.86.243.187","TCP","1514","443  >  54993 [ACK] Seq=138084 Ack=3848 Win=1564 Len=1448 TSval=1115337367 TSecr=931303654 [TCP PDU reassembled in 159]"
"155","0.078837","100.86.243.187","23.13.164.38","TCP","78","[TCP Dup ACK 117#7] 54993  >  443 [ACK] Seq=3848 Ack=77268 Win=37456 Len=0 TSval=931303729 TSecr=1115337363 SLE=78716 SRE=139532"
"157","0.079836","23.13.164.38","100.86.243.187","TCP","1514","443  >  54993 [ACK] Seq=139532 Ack=3848 Win=1564 Len=1448 TSval=1115337367 TSecr=931303654 [TCP PDU reassembled in 159]"
"158","0.079838","23.13.164.38","100.86.243.187","TCP","1514","443  >  54993 [ACK] Seq=140980 Ack=3848 Win=1564 Len=1448 TSval=1115337367 TSecr=931303654 [TCP PDU reassembled in 159]"
"159","0.079838","23.13.164.38","100.86.243.187","TLSv1.2","1514","Application Data, Application Data"
"160","0.079839","23.13.164.38","100.86.243.187","TCP","1514","443  >  54993 [ACK] Seq=143876 Ack=3848 Win=1564 Len=1448 TSval=1115337367 TSecr=931303654 [TCP PDU reassembled in 265]"
"161","0.079844","23.13.164.38","100.86.243.187","TCP","1514","443  >  54993 [PSH, ACK] Seq=145324 Ack=3848 Win=1564 Len=1448 TSval=1115337367 TSecr=931303654 [TCP PDU reassembled in 265]"
"163","0.079844","23.13.164.38","100.86.243.187","TCP","1514","443  >  54993 [ACK] Seq=146772 Ack=3848 Win=1564 Len=1448 TSval=1115337368 TSecr=931303654 [TCP PDU reassembled in 265]"
"164","0.079845","23.13.164.38","100.86.243.187","TCP","1514","443  >  54993 [ACK] Seq=148220 Ack=3848 Win=1564 Len=1448 TSval=1115337368 TSecr=931303654 [TCP PDU reassembled in 265]"
"165","0.079846","23.13.164.38","100.86.243.187","TCP","1514","443  >  54993 [ACK] Seq=149668 Ack=3848 Win=1564 Len=1448 TSval=1115337368 TSecr=931303654 [TCP PDU reassembled in 265]"
"166","0.079847","23.13.164.38","100.86.243.187","TCP","1514","443  >  54993 [ACK] Seq=151116 Ack=3848 Win=1564 Len=1448 TSval=1115337368 TSecr=931303654 [TCP PDU reassembled in 265]"
"167","0.079848","23.13.164.38","100.86.243.187","TCP","1514","443  >  54993 [ACK] Seq=152564 Ack=3848 Win=1564 Len=1448 TSval=1115337368 TSecr=931303654 [TCP PDU reassembled in 265]"
"168","0.079848","23.13.164.38","100.86.243.187","TCP","1514","443  >  54993 [ACK] Seq=154012 Ack=3848 Win=1564 Len=1448 TSval=1115337368 TSecr=931303654 [TCP PDU reassembled in 265]"
"169","0.079849","23.13.164.38","100.86.243.187","TCP","1514","443  >  54993 [ACK] Seq=155460 Ack=3848 Win=1564 Len=1448 TSval=1115337368 TSecr=931303654 [TCP PDU reassembled in 265]"
"170","0.079850","23.13.164.38","100.86.243.187","TCP","1514","[TCP Previous segment not captured] 443  >  54993 [ACK] Seq=158356 Ack=3848 Win=1564 Len=1448 TSval=1115337368 TSecr=931303654 [TCP PDU reassembled in 265], Application Data"
"171","0.079851","23.13.164.38","100.86.243.187","TCP","1514","443  >  54993 [PSH, ACK] Seq=159804 Ack=3848 Win=1564 Len=1448 TSval=1115337368 TSecr=931303654 [TCP PDU reassembled in 181]"
"172","0.079852","23.13.164.38","100.86.243.187","TCP","1514","443  >  54993 [ACK] Seq=161252 Ack=3848 Win=1564 Len=1448 TSval=1115337369 TSecr=931303654 [TCP PDU reassembled in 181]"
"173","0.079895","23.13.164.38","100.86.243.187","TCP","1514","443  >  54993 [ACK] Seq=162700 Ack=3848 Win=1564 Len=1448 TSval=1115337369 TSecr=931303654 [TCP PDU reassembled in 181]"
"174","0.079896","23.13.164.38","100.86.243.187","TCP","1514","443  >  54993 [ACK] Seq=164148 Ack=3848 Win=1564 Len=1448 TSval=1115337369 TSecr=931303654 [TCP PDU reassembled in 181]"
"175","0.079944","100.86.243.187","23.13.164.38","TCP","78","[TCP Dup ACK 117#8] 54993  >  443 [ACK] Seq=3848 Ack=77268 Win=37456 Len=0 TSval=931303730 TSecr=1115337363 SLE=78716 SRE=155460"
"177","0.080016","100.86.243.187","23.13.164.38","TCP","78","[TCP Dup ACK 117#9] 54993  >  443 [ACK] Seq=3848 Ack=77268 Win=37456 Len=0 TSval=931303730 TSecr=1115337363 SLE=78716 SRE=156908"
"178","0.080026","100.86.243.187","23.13.164.38","TCP","86","[TCP Dup ACK 117#10] 54993  >  443 [ACK] Seq=3848 Ack=77268 Win=37456 Len=0 TSval=931303730 TSecr=1115337363 SLE=158356 SRE=162700 SLE=78716 SRE=156908"
"179","0.080036","100.86.243.187","23.13.164.38","TCP","86","[TCP Dup ACK 117#11] 54993  >  443 [ACK] Seq=3848 Ack=77268 Win=37456 Len=0 TSval=931303730 TSecr=1115337363 SLE=158356 SRE=165596 SLE=78716 SRE=156908"
"180","0.080110","23.13.164.38","100.86.243.187","TCP","1514","443  >  54993 [ACK] Seq=165596 Ack=3848 Win=1564 Len=1448 TSval=1115337369 TSecr=931303654 [TCP PDU reassembled in 181]"
"181","0.080111","23.13.164.38","100.86.243.187","TLSv1.2","1514","Application Data, Application Data"
"182","0.080153","100.86.243.187","23.13.164.38","TCP","86","[TCP Dup ACK 117#12] 54993  >  443 [ACK] Seq=3848 Ack=77268 Win=37456 Len=0 TSval=931303730 TSecr=1115337363 SLE=158356 SRE=168492 SLE=78716 SRE=156908"
"183","0.081836","23.13.164.38","100.86.243.187","TCP","1514","443  >  54993 [ACK] Seq=168492 Ack=3848 Win=1564 Len=1448 TSval=1115337369 TSecr=931303654 [TCP PDU reassembled in 185]"
"184","0.081839","23.13.164.38","100.86.243.187","TCP","1514","443  >  54993 [ACK] Seq=169940 Ack=3848 Win=1564 Len=1448 TSval=1115337369 TSecr=931303654 [TCP PDU reassembled in 185]"
"185","0.081840","23.13.164.38","100.86.243.187","TLSv1.2","1514","Application Data, Application Data"
"186","0.081841","23.13.164.38","100.86.243.187","TCP","1514","443  >  54993 [ACK] Seq=172836 Ack=3848 Win=1564 Len=1448 TSval=1115337369 TSecr=931303654 [TCP PDU reassembled in 194]"
"187","0.081842","23.13.164.38","100.86.243.187","TCP","1514","443  >  54993 [PSH, ACK] Seq=174284 Ack=3848 Win=1564 Len=1448 TSval=1115337369 TSecr=931303654 [TCP PDU reassembled in 194]"
"190","0.081844","23.13.164.38","100.86.243.187","TCP","1514","443  >  54993 [ACK] Seq=175732 Ack=3848 Win=1564 Len=1448 TSval=1115337370 TSecr=931303654 [TCP PDU reassembled in 194]"
"191","0.081845","23.13.164.38","100.86.243.187","TCP","1514","443  >  54993 [ACK] Seq=177180 Ack=3848 Win=1564 Len=1448 TSval=1115337370 TSecr=931303654 [TCP PDU reassembled in 194]"
"192","0.081847","23.13.164.38","100.86.243.187","TCP","71","443  >  54993 [PSH, ACK] Seq=178628 Ack=3848 Win=1564 Len=5 TSval=1115337370 TSecr=931303654 [TCP PDU reassembled in 194]"
"193","0.081847","23.13.164.38","100.86.243.187","TCP","1514","443  >  54993 [ACK] Seq=178633 Ack=3848 Win=1564 Len=1448 TSval=1115337370 TSecr=931303654 [TCP PDU reassembled in 194]"
"194","0.081849","23.13.164.38","100.86.243.187","TLSv1.2","1514","Application Data, Application Data"
"195","0.081850","23.13.164.38","100.86.243.187","TCP","1514","443  >  54993 [ACK] Seq=181529 Ack=3848 Win=1564 Len=1448 TSval=1115337370 TSecr=931303654 [TCP PDU reassembled in 206]"
"196","0.081851","23.13.164.38","100.86.243.187","TCP","1514","443  >  54993 [ACK] Seq=182977 Ack=3848 Win=1564 Len=1448 TSval=1115337370 TSecr=931303654 [TCP PDU reassembled in 206]"
"197","0.081853","23.13.164.38","100.86.243.187","TCP","1514","443  >  54993 [ACK] Seq=184425 Ack=3848 Win=1564 Len=1448 TSval=1115337370 TSecr=931303654 [TCP PDU reassembled in 206]"
"198","0.081854","23.13.164.38","100.86.243.187","TCP","1514","443  >  54993 [ACK] Seq=185873 Ack=3848 Win=1564 Len=1448 TSval=1115337370 TSecr=931303654 [TCP PDU reassembled in 206]"
"199","0.082555","100.86.243.187","23.13.164.38","TCP","86","[TCP Dup ACK 117#13] 54993  >  443 [ACK] Seq=3848 Ack=77268 Win=37456 Len=0 TSval=931303733 TSecr=1115337363 SLE=158356 SRE=187321 SLE=78716 SRE=156908"
"201","0.082850","23.13.164.38","100.86.243.187","TCP","1514","443  >  54993 [ACK] Seq=187321 Ack=3848 Win=1564 Len=1448 TSval=1115337370 TSecr=931303654 [TCP PDU reassembled in 206]"
"202","0.082853","23.13.164.38","100.86.243.187","TCP","1514","443  >  54993 [ACK] Seq=188769 Ack=3848 Win=1564 Len=1448 TSval=1115337370 TSecr=931303654 [TCP PDU reassembled in 206]"
"203","0.082853","23.13.164.38","100.86.243.187","TCP","1514","443  >  54993 [ACK] Seq=190217 Ack=3848 Win=1564 Len=1448 TSval=1115337370 TSecr=931303654 [TCP PDU reassembled in 206]"
"204","0.082854","23.13.164.38","100.86.243.187","TCP","1514","443  >  54993 [PSH, ACK] Seq=191665 Ack=3848 Win=1564 Len=1448 TSval=1115337370 TSecr=931303654 [TCP PDU reassembled in 206]"
"206","0.082855","23.13.164.38","100.86.243.187","TLSv1.2","1514","Application Data"
"207","0.082856","23.13.164.38","100.86.243.187","TLSv1.2","1514","Application Data"
"208","0.082857","23.13.164.38","100.86.243.187","TCP","1514","443  >  54993 [ACK] Seq=196009 Ack=3848 Win=1564 Len=1448 TSval=1115337371 TSecr=931303654 [TCP PDU reassembled in 220]"
"209","0.082857","23.13.164.38","100.86.243.187","TCP","1514","443  >  54993 [ACK] Seq=197457 Ack=3848 Win=1564 Len=1448 TSval=1115337371 TSecr=931303654 [TCP PDU reassembled in 220]"
"210","0.082861","23.13.164.38","100.86.243.187","TCP","1514","443  >  54993 [ACK] Seq=198905 Ack=3848 Win=1564 Len=1448 TSval=1115337371 TSecr=931303654 [TCP PDU reassembled in 220]"
"211","0.082862","23.13.164.38","100.86.243.187","TCP","1514","443  >  54993 [ACK] Seq=200353 Ack=3848 Win=1564 Len=1448 TSval=1115337371 TSecr=931303654 [TCP PDU reassembled in 220]"
"212","0.082863","23.13.164.38","100.86.243.187","TCP","1514","443  >  54993 [ACK] Seq=201801 Ack=3848 Win=1564 Len=1448 TSval=1115337371 TSecr=931303654 [TCP PDU reassembled in 220]"
"213","0.082864","23.13.164.38","100.86.243.187","TCP","1514","443  >  54993 [ACK] Seq=203249 Ack=3848 Win=1564 Len=1448 TSval=1115337371 TSecr=931303654 [TCP PDU reassembled in 220]"
"214","0.082864","23.13.164.38","100.86.243.187","TCP","1514","443  >  54993 [ACK] Seq=204697 Ack=3848 Win=1564 Len=1448 TSval=1115337371 TSecr=931303654 [TCP PDU reassembled in 220]"
"215","0.082865","23.13.164.38","100.86.243.187","TCP","1514","443  >  54993 [PSH, ACK] Seq=206145 Ack=3848 Win=1564 Len=1448 TSval=1115337371 TSecr=931303654 [TCP PDU reassembled in 220]"
"216","0.082866","23.13.164.38","100.86.243.187","TCP","1514","443  >  54993 [ACK] Seq=207593 Ack=3848 Win=1564 Len=1448 TSval=1115337372 TSecr=931303719 [TCP PDU reassembled in 220]"
"217","0.082951","100.86.243.187","23.13.164.38","TCP","86","[TCP Dup ACK 117#14] 54993  >  443 [ACK] Seq=3848 Ack=77268 Win=37456 Len=0 TSval=931303733 TSecr=1115337363 SLE=158356 SRE=203249 SLE=78716 SRE=156908"
"219","0.083007","23.13.164.38","100.86.243.187","TCP","1514","443  >  54993 [ACK] Seq=209041 Ack=3848 Win=1564 Len=1448 TSval=1115337372 TSecr=931303719 [TCP PDU reassembled in 220]"
"220","0.083008","23.13.164.38","100.86.243.187","TLSv1.2","1514","Application Data, Application Data"
"221","0.083058","100.86.243.187","23.13.164.38","TCP","86","[TCP Dup ACK 117#15] 54993  >  443 [ACK] Seq=3848 Ack=77268 Win=37456 Len=0 TSval=931303734 TSecr=1115337363 SLE=158356 SRE=211937 SLE=78716 SRE=156908"
"222","0.083076","23.13.164.38","100.86.243.187","TCP","1514","443  >  54993 [ACK] Seq=211937 Ack=3848 Win=1564 Len=1448 TSval=1115337372 TSecr=931303719 [TCP PDU reassembled in 236]"
"223","0.083077","23.13.164.38","100.86.243.187","TCP","1514","443  >  54993 [ACK] Seq=213385 Ack=3848 Win=1564 Len=1448 TSval=1115337372 TSecr=931303719 [TCP PDU reassembled in 236]"
"224","0.083114","100.86.243.187","23.13.164.38","TCP","86","[TCP Dup ACK 117#16] 54993  >  443 [ACK] Seq=3848 Ack=77268 Win=37456 Len=0 TSval=931303734 TSecr=1115337363 SLE=158356 SRE=214833 SLE=78716 SRE=156908"
"226","0.084397","23.13.164.38","100.86.243.187","TCP","1514","443  >  54993 [ACK] Seq=214833 Ack=3848 Win=1564 Len=1448 TSval=1115337372 TSecr=931303719 [TCP PDU reassembled in 236]"
"227","0.084398","23.13.164.38","100.86.243.187","TCP","1514","443  >  54993 [ACK] Seq=216281 Ack=3848 Win=1564 Len=1448 TSval=1115337372 TSecr=931303719 [TCP PDU reassembled in 236]"
"228","0.084399","23.13.164.38","100.86.243.187","TCP","1514","443  >  54993 [ACK] Seq=217729 Ack=3848 Win=1564 Len=1448 TSval=1115337372 TSecr=931303719 [TCP PDU reassembled in 236]"
"229","0.084402","23.13.164.38","100.86.243.187","TCP","1514","443  >  54993 [ACK] Seq=219177 Ack=3848 Win=1564 Len=1448 TSval=1115337372 TSecr=931303719 [TCP PDU reassembled in 236]"
"230","0.084466","100.86.243.187","23.13.164.38","TCP","86","[TCP Dup ACK 117#17] 54993  >  443 [ACK] Seq=3848 Ack=77268 Win=37456 Len=0 TSval=931303735 TSecr=1115337363 SLE=158356 SRE=220625 SLE=78716 SRE=156908"
"231","0.084905","23.13.164.38","100.86.243.187","TCP","1514","443  >  54993 [PSH, ACK] Seq=220625 Ack=3848 Win=1564 Len=1448 TSval=1115337372 TSecr=931303719 [TCP PDU reassembled in 236]"
"232","0.084906","23.13.164.38","100.86.243.187","TCP","1514","443  >  54993 [ACK] Seq=222073 Ack=3848 Win=1564 Len=1448 TSval=1115337373 TSecr=931303720 [TCP PDU reassembled in 236]"
"233","0.084961","100.86.243.187","23.13.164.38","TCP","86","[TCP Dup ACK 117#18] 54993  >  443 [ACK] Seq=3848 Ack=77268 Win=37456 Len=0 TSval=931303735 TSecr=1115337363 SLE=158356 SRE=223521 SLE=78716 SRE=156908"
"234","0.085110","23.13.164.38","100.86.243.187","TCP","1514","443  >  54993 [ACK] Seq=223521 Ack=3848 Win=1564 Len=1448 TSval=1115337373 TSecr=931303720 [TCP PDU reassembled in 236]"
"235","0.085111","23.13.164.38","100.86.243.187","TCP","1514","443  >  54993 [ACK] Seq=224969 Ack=3848 Win=1564 Len=1448 TSval=1115337373 TSecr=931303720 [TCP PDU reassembled in 236]"
"236","0.085112","23.13.164.38","100.86.243.187","TLSv1.2","1514","Application Data, Application Data"
"237","0.085112","23.13.164.38","100.86.243.187","TCP","1514","443  >  54993 [ACK] Seq=227865 Ack=3848 Win=1564 Len=1448 TSval=1115337373 TSecr=931303720 [TCP PDU reassembled in 253]"
"238","0.085160","100.86.243.187","23.13.164.38","TCP","86","[TCP Dup ACK 117#19] 54993  >  443 [ACK] Seq=3848 Ack=77268 Win=37456 Len=0 TSval=931303735 TSecr=1115337363 SLE=158356 SRE=229313 SLE=78716 SRE=156908"
"239","0.085370","23.13.164.38","100.86.243.187","TCP","1514","443  >  54993 [ACK] Seq=229313 Ack=3848 Win=1564 Len=1448 TSval=1115337373 TSecr=931303720 [TCP PDU reassembled in 253]"
"240","0.085371","23.13.164.38","100.86.243.187","TCP","1514","443  >  54993 [ACK] Seq=230761 Ack=3848 Win=1564 Len=1448 TSval=1115337373 TSecr=931303720 [TCP PDU reassembled in 253]"
"241","0.085371","23.13.164.38","100.86.243.187","TCP","1514","443  >  54993 [ACK] Seq=232209 Ack=3848 Win=1564 Len=1448 TSval=1115337373 TSecr=931303720 [TCP PDU reassembled in 253]"
"242","0.085372","23.13.164.38","100.86.243.187","TCP","1514","443  >  54993 [ACK] Seq=233657 Ack=3848 Win=1564 Len=1448 TSval=1115337373 TSecr=931303720 [TCP PDU reassembled in 253]"
"243","0.085425","100.86.243.187","23.13.164.38","TCP","86","[TCP Dup ACK 117#20] 54993  >  443 [ACK] Seq=3848 Ack=77268 Win=37456 Len=0 TSval=931303735 TSecr=1115337363 SLE=158356 SRE=235105 SLE=78716 SRE=156908"
"244","0.085459","23.13.164.38","100.86.243.187","TCP","1514","443  >  54993 [PSH, ACK] Seq=235105 Ack=3848 Win=1564 Len=1448 TSval=1115337373 TSecr=931303720 [TCP PDU reassembled in 253]"
"246","0.085513","100.86.243.187","23.13.164.38","TCP","86","[TCP Dup ACK 117#21] 54993  >  443 [ACK] Seq=3848 Ack=77268 Win=37456 Len=0 TSval=931303736 TSecr=1115337363 SLE=158356 SRE=236553 SLE=78716 SRE=156908"
"248","0.087277","23.13.164.38","100.86.243.187","TCP","1514","443  >  54993 [ACK] Seq=236553 Ack=3848 Win=1564 Len=1448 TSval=1115337374 TSecr=931303720 [TCP PDU reassembled in 253]"
"249","0.087279","23.13.164.38","100.86.243.187","TCP","1514","443  >  54993 [ACK] Seq=238001 Ack=3848 Win=1564 Len=1448 TSval=1115337374 TSecr=931303720 [TCP PDU reassembled in 253]"
"250","0.087279","23.13.164.38","100.86.243.187","TCP","1514","443  >  54993 [ACK] Seq=239449 Ack=3848 Win=1564 Len=1448 TSval=1115337374 TSecr=931303720 [TCP PDU reassembled in 253]"
"251","0.087280","23.13.164.38","100.86.243.187","TCP","1514","443  >  54993 [ACK] Seq=240897 Ack=3848 Win=1564 Len=1448 TSval=1115337374 TSecr=931303720 [TCP PDU reassembled in 253]"
"252","0.087281","23.13.164.38","100.86.243.187","TCP","1514","443  >  54993 [PSH, ACK] Seq=242345 Ack=3848 Win=1564 Len=1448 TSval=1115337374 TSecr=931303720 [TCP PDU reassembled in 253]"
"253","0.087281","23.13.164.38","100.86.243.187","TLSv1.2","1514","Application Data, Application Data"
"254","0.087282","23.13.164.38","100.86.243.187","TCP","1514","443  >  54993 [ACK] Seq=245241 Ack=3848 Win=1564 Len=1448 TSval=1115337374 TSecr=931303720 [TCP PDU reassembled in 262]"
"255","0.087289","23.13.164.38","100.86.243.187","TCP","1514","443  >  54993 [ACK] Seq=246689 Ack=3848 Win=1564 Len=1448 TSval=1115337374 TSecr=931303720 [TCP PDU reassembled in 262]"
"256","0.087360","100.86.243.187","23.13.164.38","TCP","86","[TCP Dup ACK 117#22] 54993  >  443 [ACK] Seq=3848 Ack=77268 Win=37456 Len=0 TSval=931303738 TSecr=1115337363 SLE=158356 SRE=248137 SLE=78716 SRE=156908"
"257","0.088367","23.13.164.38","100.86.243.187","TCP","1514","443  >  54993 [ACK] Seq=248137 Ack=3848 Win=1564 Len=1448 TSval=1115337374 TSecr=931303720 [TCP PDU reassembled in 262]"
"258","0.088367","23.13.164.38","100.86.243.187","TCP","1514","443  >  54993 [ACK] Seq=249585 Ack=3848 Win=1564 Len=1448 TSval=1115337374 TSecr=931303720 [TCP PDU reassembled in 262]"
"259","0.088368","23.13.164.38","100.86.243.187","TCP","1514","443  >  54993 [ACK] Seq=251033 Ack=3848 Win=1564 Len=1448 TSval=1115337374 TSecr=931303720 [TCP PDU reassembled in 262]"
"260","0.088369","23.13.164.38","100.86.243.187","TCP","1514","443  >  54993 [ACK] Seq=252481 Ack=3848 Win=1564 Len=1448 TSval=1115337374 TSecr=931303720 [TCP PDU reassembled in 262]"
"261","0.088369","23.13.164.38","100.86.243.187","TCP","1514","443  >  54993 [ACK] Seq=253929 Ack=3848 Win=1564 Len=1448 TSval=1115337374 TSecr=931303720 [TCP PDU reassembled in 262]"
"262","0.088379","23.13.164.38","100.86.243.187","TLSv1.2","1482","Application Data"
"263","0.088449","100.86.243.187","23.13.164.38","TCP","86","[TCP Dup ACK 117#23] 54993  >  443 [ACK] Seq=3848 Ack=77268 Win=37456 Len=0 TSval=931303739 TSecr=1115337363 SLE=158356 SRE=256793 SLE=78716 SRE=156908"
"264","0.092932","23.13.164.38","100.86.243.187","TLSv1.2","1514","[TCP Fast Retransmission] , Application Data"
"265","0.092970","23.13.164.38","100.86.243.187","TLSv1.2","1514","[TCP Fast Retransmission] , Application Data"
"266","0.093017","100.86.243.187","23.13.164.38","TCP","78","54993  >  443 [ACK] Seq=3848 Ack=156908 Win=36211 Len=0 TSval=931303744 TSecr=1115337383 SLE=158356 SRE=256793"
"267","0.093069","100.86.243.187","23.13.164.38","TCP","66","54993  >  443 [ACK] Seq=3848 Ack=256793 Win=34651 Len=0 TSval=931303744 TSecr=1115337383"
"268","0.094326","100.86.243.187","23.13.164.38","TCP","66","[TCP Window Update] 54993  >  443 [ACK] Seq=3848 Ack=256793 Win=37456 Len=0 TSval=931303745 TSecr=1115337383"
"277","0.225538","23.13.164.38","100.86.243.187","TLSv1.2","470","Application Data"
"278","0.225541","23.13.164.38","100.86.243.187","TCP","1514","443  >  54993 [ACK] Seq=257197 Ack=3848 Win=1564 Len=1448 TSval=1115337514 TSecr=931303745 [TCP PDU reassembled in 280]"
"279","0.225541","23.13.164.38","100.86.243.187","TCP","1514","443  >  54993 [ACK] Seq=258645 Ack=3848 Win=1564 Len=1448 TSval=1115337514 TSecr=931303745 [TCP PDU reassembled in 280]"
"280","0.225542","23.13.164.38","100.86.243.187","TLSv1.2","742","Application Data"
"281","0.225632","100.86.243.187","23.13.164.38","TCP","66","54993  >  443 [ACK] Seq=3848 Ack=260769 Win=37394 Len=0 TSval=931303876 TSecr=1115337514"
"282","0.225850","100.86.243.187","23.13.164.38","TCP","66","[TCP Window Update] 54993  >  443 [ACK] Seq=3848 Ack=260769 Win=37456 Len=0 TSval=931303876 TSecr=1115337514"
"291","0.389201","100.86.243.187","23.13.164.38","TLSv1.2","308","Application Data"
"292","0.397111","100.86.243.187","23.13.164.38","TLSv1.2","732","Application Data"
"294","0.399144","23.13.164.38","100.86.243.187","TCP","66","443  >  54993 [ACK] Seq=260769 Ack=4090 Win=1587 Len=0 TSval=1115337690 TSecr=931304039"
"304","0.407140","23.13.164.38","100.86.243.187","TCP","66","443  >  54993 [ACK] Seq=260769 Ack=4756 Win=1610 Len=0 TSval=1115337697 TSecr=931304048"
"313","0.419162","23.13.164.38","100.86.243.187","TLSv1.2","455","Application Data"
"314","0.419200","23.13.164.38","100.86.243.187","TCP","1514","[TCP Previous segment not captured] 443  >  54993 [ACK] Seq=262606 Ack=4756 Win=1610 Len=1448 TSval=1115337710 TSecr=931304048"
"315","0.419200","23.13.164.38","100.86.243.187","TCP","1514","443  >  54993 [ACK] Seq=264054 Ack=4756 Win=1610 Len=1448 TSval=1115337710 TSecr=931304048"
"316","0.419227","100.86.243.187","23.13.164.38","TCP","66","54993  >  443 [ACK] Seq=4756 Ack=261158 Win=37450 Len=0 TSval=931304070 TSecr=1115337710"
"317","0.419269","100.86.243.187","23.13.164.38","TCP","78","[TCP Dup ACK 316#1] 54993  >  443 [ACK] Seq=4756 Ack=261158 Win=37450 Len=0 TSval=931304070 TSecr=1115337710 SLE=262606 SRE=265502"
"318","0.419688","23.13.164.38","100.86.243.187","TCP","1514","443  >  54993 [ACK] Seq=265502 Ack=4756 Win=1610 Len=1448 TSval=1115337710 TSecr=931304048"
"319","0.419689","23.13.164.38","100.86.243.187","TCP","1514","443  >  54993 [ACK] Seq=266950 Ack=4756 Win=1610 Len=1448 TSval=1115337710 TSecr=931304048"
"320","0.419757","100.86.243.187","23.13.164.38","TCP","78","[TCP Dup ACK 316#2] 54993  >  443 [ACK] Seq=4756 Ack=261158 Win=37456 Len=0 TSval=931304070 TSecr=1115337710 SLE=262606 SRE=268398"
"321","0.420958","23.13.164.38","100.86.243.187","TCP","712","443  >  54993 [PSH, ACK] Seq=268398 Ack=4756 Win=1610 Len=646 TSval=1115337710 TSecr=931304048"
"324","0.421085","100.86.243.187","23.13.164.38","TCP","78","[TCP Dup ACK 316#3] 54993  >  443 [ACK] Seq=4756 Ack=261158 Win=37456 Len=0 TSval=931304072 TSecr=1115337710 SLE=262606 SRE=269044"
"325","0.425119","100.86.243.187","23.13.164.38","TLSv1.2","384","Application Data"
"326","0.427009","100.86.243.187","23.13.164.38","TLSv1.2","404","Application Data"
"335","0.435191","23.13.164.38","100.86.243.187","TCP","66","443  >  54993 [ACK] Seq=269044 Ack=5062 Win=1632 Len=0 TSval=1115337726 TSecr=931304076"
"336","0.436344","23.13.164.38","100.86.243.187","TCP","1514","[TCP Fast Retransmission] 443  >  54993 [ACK] Seq=261158 Ack=5062 Win=1632 Len=1448 TSval=1115337727 TSecr=931304076"
"337","0.436404","100.86.243.187","23.13.164.38","TCP","66","54993  >  443 [ACK] Seq=5388 Ack=269044 Win=37332 Len=0 TSval=931304087 TSecr=1115337727"
"338","0.436477","100.86.243.187","23.13.164.38","TCP","66","[TCP Window Update] 54993  >  443 [ACK] Seq=5388 Ack=269044 Win=37456 Len=0 TSval=931304087 TSecr=1115337727"
"339","0.438884","23.13.164.38","100.86.243.187","TLSv1.2","473","Application Data"
"340","0.438909","23.13.164.38","100.86.243.187","TCP","1514","443  >  54993 [ACK] Seq=269451 Ack=5388 Win=1655 Len=1448 TSval=1115337730 TSecr=931304078 [TCP PDU reassembled in 341]"
"341","0.438910","23.13.164.38","100.86.243.187","TLSv1.2","256","Application Data"
"342","0.438947","100.86.243.187","23.13.164.38","TCP","66","54993  >  443 [ACK] Seq=5388 Ack=269451 Win=37449 Len=0 TSval=931304089 TSecr=1115337730"
"343","0.438992","100.86.243.187","23.13.164.38","TCP","66","54993  >  443 [ACK] Seq=5388 Ack=271089 Win=37424 Len=0 TSval=931304089 TSecr=1115337730"
"344","0.480438","23.13.164.38","100.86.243.187","TLSv1.2","436","Application Data"
"345","0.480514","100.86.243.187","23.13.164.38","TCP","66","54993  >  443 [ACK] Seq=5388 Ack=271459 Win=37450 Len=0 TSval=931304131 TSecr=1115337771"
"346","0.482481","23.13.164.38","100.86.243.187","TCP","1514","443  >  54993 [ACK] Seq=271459 Ack=5388 Win=1655 Len=1448 TSval=1115337771 TSecr=931304089 [TCP PDU reassembled in 357]"
"347","0.482481","23.13.164.38","100.86.243.187","TCP","1514","443  >  54993 [ACK] Seq=272907 Ack=5388 Win=1655 Len=1448 TSval=1115337771 TSecr=931304089 [TCP PDU reassembled in 357]"
"348","0.482482","23.13.164.38","100.86.243.187","TCP","1514","443  >  54993 [ACK] Seq=274355 Ack=5388 Win=1655 Len=1448 TSval=1115337771 TSecr=931304089 [TCP PDU reassembled in 357]"
"349","0.482483","23.13.164.38","100.86.243.187","TCP","1514","443  >  54993 [ACK] Seq=275803 Ack=5388 Win=1655 Len=1448 TSval=1115337771 TSecr=931304089 [TCP PDU reassembled in 357]"
"350","0.482483","23.13.164.38","100.86.243.187","TCP","1514","443  >  54993 [ACK] Seq=277251 Ack=5388 Win=1655 Len=1448 TSval=1115337771 TSecr=931304089 [TCP PDU reassembled in 357]"
"351","0.482484","23.13.164.38","100.86.243.187","TCP","1514","443  >  54993 [ACK] Seq=278699 Ack=5388 Win=1655 Len=1448 TSval=1115337771 TSecr=931304089 [TCP PDU reassembled in 357]"
"352","0.482490","23.13.164.38","100.86.243.187","TCP","1514","443  >  54993 [ACK] Seq=280147 Ack=5388 Win=1655 Len=1448 TSval=1115337771 TSecr=931304089 [TCP PDU reassembled in 357]"
"353","0.482491","23.13.164.38","100.86.243.187","TCP","1514","443  >  54993 [ACK] Seq=281595 Ack=5388 Win=1655 Len=1448 TSval=1115337771 TSecr=931304089 [TCP PDU reassembled in 357]"
"354","0.482492","23.13.164.38","100.86.243.187","TCP","1514","443  >  54993 [ACK] Seq=283043 Ack=5388 Win=1655 Len=1448 TSval=1115337771 TSecr=931304089 [TCP PDU reassembled in 357]"
"355","0.482492","23.13.164.38","100.86.243.187","TCP","1514","443  >  54993 [PSH, ACK] Seq=284491 Ack=5388 Win=1655 Len=1448 TSval=1115337771 TSecr=931304089 [TCP PDU reassembled in 357]"
"356","0.482493","23.13.164.38","100.86.243.187","TCP","1514","443  >  54993 [ACK] Seq=285939 Ack=5388 Win=1655 Len=1448 TSval=1115337772 TSecr=931304089 [TCP PDU reassembled in 357]"
"357","0.482494","23.13.164.38","100.86.243.187","TLSv1.2","544","Application Data"
"358","0.482494","23.13.164.38","100.86.243.187","TLSv1.2","1514","Application Data"
"359","0.482495","23.13.164.38","100.86.243.187","TCP","1514","443  >  54993 [ACK] Seq=289313 Ack=5388 Win=1655 Len=1448 TSval=1115337772 TSecr=931304089 [TCP PDU reassembled in 367]"
"360","0.482568","100.86.243.187","23.13.164.38","TCP","66","54993  >  443 [ACK] Seq=5388 Ack=287387 Win=37207 Len=0 TSval=931304133 TSecr=1115337772"
"361","0.482602","100.86.243.187","23.13.164.38","TCP","66","54993  >  443 [ACK] Seq=5388 Ack=290761 Win=37154 Len=0 TSval=931304133 TSecr=1115337772"
"362","0.482748","100.86.243.187","23.13.164.38","TCP","66","[TCP Window Update] 54993  >  443 [ACK] Seq=5388 Ack=290761 Win=37456 Len=0 TSval=931304133 TSecr=1115337772"
"363","0.483530","23.13.164.38","100.86.243.187","TCP","1514","443  >  54993 [ACK] Seq=290761 Ack=5388 Win=1655 Len=1448 TSval=1115337772 TSecr=931304089 [TCP PDU reassembled in 367]"
"364","0.483530","23.13.164.38","100.86.243.187","TCP","1514","443  >  54993 [ACK] Seq=292209 Ack=5388 Win=1655 Len=1448 TSval=1115337772 TSecr=931304089 [TCP PDU reassembled in 367]"
"365","0.483531","23.13.164.38","100.86.243.187","TCP","1514","443  >  54993 [ACK] Seq=293657 Ack=5388 Win=1655 Len=1448 TSval=1115337772 TSecr=931304089 [TCP PDU reassembled in 367]"
"366","0.483533","23.13.164.38","100.86.243.187","TCP","1514","443  >  54993 [ACK] Seq=295105 Ack=5388 Win=1655 Len=1448 TSval=1115337772 TSecr=931304089 [TCP PDU reassembled in 367]"
"367","0.483534","23.13.164.38","100.86.243.187","TLSv1.2","751","Application Data"
"368","0.483593","100.86.243.187","23.13.164.38","TCP","66","54993  >  443 [ACK] Seq=5388 Ack=297238 Win=37354 Len=0 TSval=931304134 TSecr=1115337772"
"369","0.483651","100.86.243.187","23.13.164.38","TCP","66","[TCP Window Update] 54993  >  443 [ACK] Seq=5388 Ack=297238 Win=37456 Len=0 TSval=931304134 TSecr=1115337772"
"411","0.689891","23.13.164.38","100.86.243.187","TLSv1.2","1034","Application Data"
"412","0.689980","100.86.243.187","23.13.164.38","TCP","66","54993  >  443 [ACK] Seq=5388 Ack=298206 Win=37441 Len=0 TSval=931304340 TSecr=1115337980"
"413","0.691142","23.13.164.38","100.86.243.187","TLSv1.2","1040","Application Data"
"414","0.691228","100.86.243.187","23.13.164.38","TCP","66","54993  >  443 [ACK] Seq=5388 Ack=299180 Win=37440 Len=0 TSval=931304341 TSecr=1115337980"
"422","0.709128","23.13.164.38","100.86.243.187","TCP","1514","443  >  54993 [ACK] Seq=299180 Ack=5388 Win=1655 Len=1448 TSval=1115337999 TSecr=931304341 [TCP PDU reassembled in 437]"
"423","0.709130","23.13.164.38","100.86.243.187","TCP","1514","443  >  54993 [ACK] Seq=300628 Ack=5388 Win=1655 Len=1448 TSval=1115337999 TSecr=931304341 [TCP PDU reassembled in 437]"
"424","0.709130","23.13.164.38","100.86.243.187","TCP","1514","443  >  54993 [ACK] Seq=302076 Ack=5388 Win=1655 Len=1448 TSval=1115337999 TSecr=931304341 [TCP PDU reassembled in 437]"
"425","0.709240","100.86.243.187","23.13.164.38","TCP","66","54993  >  443 [ACK] Seq=5388 Ack=303524 Win=37388 Len=0 TSval=931304360 TSecr=1115337999"
"426","0.709378","100.86.243.187","23.13.164.38","TCP","66","[TCP Window Update] 54993  >  443 [ACK] Seq=5388 Ack=303524 Win=37456 Len=0 TSval=931304360 TSecr=1115337999"
"427","0.710082","23.13.164.38","100.86.243.187","TCP","1514","443  >  54993 [ACK] Seq=303524 Ack=5388 Win=1655 Len=1448 TSval=1115337999 TSecr=931304341 [TCP PDU reassembled in 437]"
"428","0.710083","23.13.164.38","100.86.243.187","TCP","1514","443  >  54993 [ACK] Seq=304972 Ack=5388 Win=1655 Len=1448 TSval=1115337999 TSecr=931304341 [TCP PDU reassembled in 437]"
"429","0.710175","100.86.243.187","23.13.164.38","TCP","66","54993  >  443 [ACK] Seq=5388 Ack=306420 Win=37410 Len=0 TSval=931304360 TSecr=1115337999"
"430","0.710288","100.86.243.187","23.13.164.38","TCP","66","[TCP Window Update] 54993  >  443 [ACK] Seq=5388 Ack=306420 Win=37456 Len=0 TSval=931304361 TSecr=1115337999"
"431","0.711435","23.13.164.38","100.86.243.187","TCP","1514","443  >  54993 [ACK] Seq=306420 Ack=5388 Win=1655 Len=1448 TSval=1115337999 TSecr=931304341 [TCP PDU reassembled in 437]"
"432","0.711443","23.13.164.38","100.86.243.187","TCP","1514","443  >  54993 [ACK] Seq=307868 Ack=5388 Win=1655 Len=1448 TSval=1115337999 TSecr=931304341 [TCP PDU reassembled in 437]"
"433","0.711444","23.13.164.38","100.86.243.187","TCP","1514","443  >  54993 [ACK] Seq=309316 Ack=5388 Win=1655 Len=1448 TSval=1115337999 TSecr=931304341 [TCP PDU reassembled in 437]"
"434","0.711445","23.13.164.38","100.86.243.187","TCP","1514","443  >  54993 [ACK] Seq=310764 Ack=5388 Win=1655 Len=1448 TSval=1115337999 TSecr=931304341 [TCP PDU reassembled in 437]"
"435","0.711446","23.13.164.38","100.86.243.187","TCP","1514","443  >  54993 [ACK] Seq=312212 Ack=5388 Win=1655 Len=1448 TSval=1115337999 TSecr=931304341 [TCP PDU reassembled in 437]"
"436","0.711446","23.13.164.38","100.86.243.187","TCP","1514","443  >  54993 [ACK] Seq=313660 Ack=5388 Win=1655 Len=1448 TSval=1115337999 TSecr=931304341 [TCP PDU reassembled in 437]"
"437","0.711447","23.13.164.38","100.86.243.187","TLSv1.2","544","Application Data"
"438","0.711448","23.13.164.38","100.86.243.187","TLSv1.2","97","Application Data"
"439","0.711448","23.13.164.38","100.86.243.187","TCP","1514","443  >  54993 [ACK] Seq=315617 Ack=5388 Win=1655 Len=1448 TSval=1115338000 TSecr=931304341 [TCP PDU reassembled in 459]"
"440","0.711449","23.13.164.38","100.86.243.187","TCP","1514","[TCP Previous segment not captured] 443  >  54993 [ACK] Seq=319961 Ack=5388 Win=1655 Len=1448 TSval=1115338000 TSecr=931304341 [TCP PDU reassembled in 459]"
"441","0.711450","23.13.164.38","100.86.243.187","TCP","1514","443  >  54993 [ACK] Seq=321409 Ack=5388 Win=1655 Len=1448 TSval=1115338000 TSecr=931304341 [TCP PDU reassembled in 459]"
"442","0.711450","23.13.164.38","100.86.243.187","TCP","1514","443  >  54993 [ACK] Seq=322857 Ack=5388 Win=1655 Len=1448 TSval=1115338000 TSecr=931304341 [TCP PDU reassembled in 459]"
"443","0.711451","23.13.164.38","100.86.243.187","TCP","1514","443  >  54993 [ACK] Seq=324305 Ack=5388 Win=1655 Len=1448 TSval=1115338000 TSecr=931304341 [TCP PDU reassembled in 459]"
"444","0.711452","23.13.164.38","100.86.243.187","TCP","1514","443  >  54993 [ACK] Seq=325753 Ack=5388 Win=1655 Len=1448 TSval=1115338000 TSecr=931304341 [TCP PDU reassembled in 459]"
"445","0.711453","23.13.164.38","100.86.243.187","TCP","1514","443  >  54993 [ACK] Seq=327201 Ack=5388 Win=1655 Len=1448 TSval=1115338000 TSecr=931304341 [TCP PDU reassembled in 459]"
"446","0.711453","23.13.164.38","100.86.243.187","TCP","1514","443  >  54993 [PSH, ACK] Seq=328649 Ack=5388 Win=1655 Len=1448 TSval=1115338000 TSecr=931304341 [TCP PDU reassembled in 459]"
"447","0.711573","100.86.243.187","23.13.164.38","TCP","66","54993  >  443 [ACK] Seq=5388 Ack=317065 Win=37289 Len=0 TSval=931304362 TSecr=1115338000"
"448","0.711626","100.86.243.187","23.13.164.38","TCP","78","[TCP Dup ACK 447#1] 54993  >  443 [ACK] Seq=5388 Ack=317065 Win=37289 Len=0 TSval=931304362 TSecr=1115338000 SLE=319961 SRE=330097"
"449","0.712343","100.86.243.187","23.13.164.38","TCP","78","[TCP Dup ACK 447#2] 54993  >  443 [ACK] Seq=5388 Ack=317065 Win=37456 Len=0 TSval=931304362 TSecr=1115338000 SLE=319961 SRE=330097"
"450","0.712942","23.13.164.38","100.86.243.187","TCP","1514","443  >  54993 [ACK] Seq=330097 Ack=5388 Win=1655 Len=1448 TSval=1115338001 TSecr=931304341 [TCP PDU reassembled in 459]"
"451","0.712943","23.13.164.38","100.86.243.187","TCP","1514","443  >  54993 [ACK] Seq=331545 Ack=5388 Win=1655 Len=1448 TSval=1115338001 TSecr=931304341 [TCP PDU reassembled in 459], Application Data"
"452","0.712948","23.13.164.38","100.86.243.187","TCP","1514","443  >  54993 [ACK] Seq=332993 Ack=5388 Win=1655 Len=1448 TSval=1115338001 TSecr=931304341 [TCP PDU reassembled in 455]"
"453","0.712949","23.13.164.38","100.86.243.187","TCP","1514","443  >  54993 [ACK] Seq=334441 Ack=5388 Win=1655 Len=1448 TSval=1115338001 TSecr=931304341 [TCP PDU reassembled in 455]"
"454","0.712950","23.13.164.38","100.86.243.187","TCP","1514","443  >  54993 [ACK] Seq=335889 Ack=5388 Win=1655 Len=1448 TSval=1115338001 TSecr=931304341 [TCP PDU reassembled in 455]"
"455","0.712951","23.13.164.38","100.86.243.187","TLSv1.2","1464","Application Data"
"456","0.713040","100.86.243.187","23.13.164.38","TCP","78","[TCP Dup ACK 447#3] 54993  >  443 [ACK] Seq=5388 Ack=317065 Win=37456 Len=0 TSval=931304364 TSecr=1115338000 SLE=319961 SRE=338735"
"457","0.727935","23.13.164.38","100.86.243.187","TCP","1514","[TCP Fast Retransmission] 443  >  54993 [ACK] Seq=317065 Ack=5388 Win=1655 Len=1448 TSval=1115338018 TSecr=931304364 [TCP PDU reassembled in 459]"
"458","0.728023","100.86.243.187","23.13.164.38","TCP","78","54993  >  443 [ACK] Seq=5388 Ack=318513 Win=37433 Len=0 TSval=931304379 TSecr=1115338018 SLE=319961 SRE=338735"
"459","0.728438","23.13.164.38","100.86.243.187","TCP","1514","[TCP Retransmission] 443  >  54993 [PSH, ACK] Seq=318513 Ack=5388 Win=1655 Len=1448 TSval=1115338018 TSecr=931304364"
"460","0.728491","100.86.243.187","23.13.164.38","TCP","66","54993  >  443 [ACK] Seq=5388 Ack=338735 Win=37140 Len=0 TSval=931304379 TSecr=1115338018"
"461","0.728691","100.86.243.187","23.13.164.38","TCP","66","[TCP Window Update] 54993  >  443 [ACK] Seq=5388 Ack=338735 Win=37456 Len=0 TSval=931304379 TSecr=1115338018"
"1686","1.553985","100.86.243.187","23.13.164.38","TLSv1.2","707","Application Data"
"1691","1.604332","23.13.164.38","100.86.243.187","TCP","66","443  >  54993 [ACK] Seq=338735 Ack=6029 Win=1678 Len=0 TSval=1115338895 TSecr=931305205"
"1710","1.900371","100.86.243.187","23.13.164.38","TLSv1.2","730","Application Data"
"1716","1.910768","23.13.164.38","100.86.243.187","TCP","66","443  >  54993 [ACK] Seq=338735 Ack=6693 Win=1700 Len=0 TSval=1115339201 TSecr=931305551"
"1746","1.931621","100.86.243.187","23.13.164.38","TLSv1.2","360","Application Data"
"1751","1.932660","100.86.243.187","23.13.164.38","TLSv1.2","308","Application Data"
"1802","1.943666","23.13.164.38","100.86.243.187","TCP","66","443  >  54993 [ACK] Seq=338735 Ack=6987 Win=1723 Len=0 TSval=1115339234 TSecr=931305582"
"1804","1.944177","23.13.164.38","100.86.243.187","TCP","66","443  >  54993 [ACK] Seq=338735 Ack=7229 Win=1745 Len=0 TSval=1115339234 TSecr=931305583"
"1811","1.947904","23.13.164.38","100.86.243.187","TLSv1.2","423","Application Data"
"1812","1.947904","23.13.164.38","100.86.243.187","TLSv1.2","1230","Application Data"
"1826","1.948050","100.86.243.187","23.13.164.38","TCP","66","54993  >  443 [ACK] Seq=7229 Ack=340256 Win=37432 Len=0 TSval=931305599 TSecr=1115339235"
"1968","1.989953","23.13.164.38","100.86.243.187","TLSv1.2","1039","Application Data"
"1969","1.990045","100.86.243.187","23.13.164.38","TCP","66","54993  >  443 [ACK] Seq=7229 Ack=341229 Win=37440 Len=0 TSval=931305641 TSecr=1115339276"
"1970","1.990924","23.13.164.38","100.86.243.187","TLSv1.2","1040","Application Data"
"1971","1.990928","23.13.164.38","100.86.243.187","TCP","1514","443  >  54993 [ACK] Seq=342203 Ack=7229 Win=1745 Len=1448 TSval=1115339282 TSecr=931305599 [TCP PDU reassembled in 1986]"
"1972","1.990928","23.13.164.38","100.86.243.187","TCP","1514","443  >  54993 [ACK] Seq=343651 Ack=7229 Win=1745 Len=1448 TSval=1115339282 TSecr=931305599 [TCP PDU reassembled in 1986]"
"1973","1.991014","100.86.243.187","23.13.164.38","TCP","66","54993  >  443 [ACK] Seq=7229 Ack=345099 Win=37395 Len=0 TSval=931305641 TSecr=1115339282"
"1974","1.991133","100.86.243.187","23.13.164.38","TCP","66","[TCP Window Update] 54993  >  443 [ACK] Seq=7229 Ack=345099 Win=37456 Len=0 TSval=931305642 TSecr=1115339282"
"1975","1.991641","23.13.164.38","100.86.243.187","TCP","1514","443  >  54993 [ACK] Seq=345099 Ack=7229 Win=1745 Len=1448 TSval=1115339282 TSecr=931305599 [TCP PDU reassembled in 1986]"
"1976","1.991642","23.13.164.38","100.86.243.187","TCP","1514","443  >  54993 [ACK] Seq=346547 Ack=7229 Win=1745 Len=1448 TSval=1115339282 TSecr=931305599 [TCP PDU reassembled in 1986]"
"1977","1.991723","100.86.243.187","23.13.164.38","TCP","66","54993  >  443 [ACK] Seq=7229 Ack=347995 Win=37410 Len=0 TSval=931305642 TSecr=1115339282"
"1978","1.991798","100.86.243.187","23.13.164.38","TCP","66","[TCP Window Update] 54993  >  443 [ACK] Seq=7229 Ack=347995 Win=37456 Len=0 TSval=931305642 TSecr=1115339282"
"1979","1.992834","23.13.164.38","100.86.243.187","TCP","1514","443  >  54993 [ACK] Seq=347995 Ack=7229 Win=1745 Len=1448 TSval=1115339282 TSecr=931305599 [TCP PDU reassembled in 1986]"
"1980","1.992834","23.13.164.38","100.86.243.187","TCP","1514","443  >  54993 [ACK] Seq=349443 Ack=7229 Win=1745 Len=1448 TSval=1115339282 TSecr=931305599 [TCP PDU reassembled in 1986]"
"1981","1.992835","23.13.164.38","100.86.243.187","TCP","1514","443  >  54993 [ACK] Seq=350891 Ack=7229 Win=1745 Len=1448 TSval=1115339282 TSecr=931305599 [TCP PDU reassembled in 1986]"
"1982","1.992835","23.13.164.38","100.86.243.187","TCP","1514","443  >  54993 [ACK] Seq=352339 Ack=7229 Win=1745 Len=1448 TSval=1115339282 TSecr=931305599 [TCP PDU reassembled in 1986]"
"1983","1.992836","23.13.164.38","100.86.243.187","TCP","1514","443  >  54993 [ACK] Seq=353787 Ack=7229 Win=1745 Len=1448 TSval=1115339282 TSecr=931305599 [TCP PDU reassembled in 1986]"
"1984","1.992836","23.13.164.38","100.86.243.187","TCP","1514","443  >  54993 [PSH, ACK] Seq=355235 Ack=7229 Win=1745 Len=1448 TSval=1115339282 TSecr=931305599 [TCP PDU reassembled in 1986]"
"1985","1.992840","23.13.164.38","100.86.243.187","TCP","1514","443  >  54993 [ACK] Seq=356683 Ack=7229 Win=1745 Len=1448 TSval=1115339282 TSecr=931305599 [TCP PDU reassembled in 1986]"
"1986","1.992841","23.13.164.38","100.86.243.187","TLSv1.2","1514","Application Data, Application Data"
"1987","1.992842","23.13.164.38","100.86.243.187","TCP","1514","443  >  54993 [ACK] Seq=359579 Ack=7229 Win=1745 Len=1448 TSval=1115339282 TSecr=931305599 [TCP PDU reassembled in 2002]"
"1988","1.992842","23.13.164.38","100.86.243.187","TCP","1514","443  >  54993 [ACK] Seq=361027 Ack=7229 Win=1745 Len=1448 TSval=1115339282 TSecr=931305599 [TCP PDU reassembled in 2002]"
"1989","1.992843","23.13.164.38","100.86.243.187","TCP","1514","443  >  54993 [ACK] Seq=362475 Ack=7229 Win=1745 Len=1448 TSval=1115339282 TSecr=931305599 [TCP PDU reassembled in 2002]"
"1990","1.992843","23.13.164.38","100.86.243.187","TCP","1514","443  >  54993 [ACK] Seq=363923 Ack=7229 Win=1745 Len=1448 TSval=1115339282 TSecr=931305599 [TCP PDU reassembled in 2002]"
"1991","1.992843","23.13.164.38","100.86.243.187","TCP","1514","443  >  54993 [ACK] Seq=365371 Ack=7229 Win=1745 Len=1448 TSval=1115339282 TSecr=931305599 [TCP PDU reassembled in 2002]"
"1992","1.992844","23.13.164.38","100.86.243.187","TCP","1514","443  >  54993 [ACK] Seq=366819 Ack=7229 Win=1745 Len=1448 TSval=1115339282 TSecr=931305599 [TCP PDU reassembled in 2002]"
"1993","1.992917","100.86.243.187","23.13.164.38","TCP","66","54993  >  443 [ACK] Seq=7229 Ack=363923 Win=37207 Len=0 TSval=931305643 TSecr=1115339282"
"1994","1.992958","100.86.243.187","23.13.164.38","TCP","66","54993  >  443 [ACK] Seq=7229 Ack=368267 Win=37139 Len=0 TSval=931305643 TSecr=1115339282"
"1995","1.993071","100.86.243.187","23.13.164.38","TCP","66","[TCP Window Update] 54993  >  443 [ACK] Seq=7229 Ack=368267 Win=37456 Len=0 TSval=931305643 TSecr=1115339282"
"1996","1.994033","23.13.164.38","100.86.243.187","TCP","1514","443  >  54993 [ACK] Seq=368267 Ack=7229 Win=1745 Len=1448 TSval=1115339282 TSecr=931305599 [TCP PDU reassembled in 2002]"
"1997","1.994034","23.13.164.38","100.86.243.187","TCP","1514","443  >  54993 [PSH, ACK] Seq=369715 Ack=7229 Win=1745 Len=1448 TSval=1115339282 TSecr=931305599 [TCP PDU reassembled in 2002]"
"1998","1.994034","23.13.164.38","100.86.243.187","TCP","1514","443  >  54993 [ACK] Seq=371163 Ack=7229 Win=1745 Len=1448 TSval=1115339283 TSecr=931305599 [TCP PDU reassembled in 2002]"
"1999","1.994035","23.13.164.38","100.86.243.187","TCP","1514","443  >  54993 [ACK] Seq=372611 Ack=7229 Win=1745 Len=1448 TSval=1115339283 TSecr=931305599 [TCP PDU reassembled in 2002]"
"2000","1.994097","100.86.243.187","23.13.164.38","TCP","66","54993  >  443 [ACK] Seq=7229 Ack=374059 Win=37365 Len=0 TSval=931305645 TSecr=1115339283"
"2001","1.994153","100.86.243.187","23.13.164.38","TCP","66","[TCP Window Update] 54993  >  443 [ACK] Seq=7229 Ack=374059 Win=37456 Len=0 TSval=931305645 TSecr=1115339283"
"2002","1.995457","23.13.164.38","100.86.243.187","TLSv1.2","1514","Application Data, Application Data"
"2003","1.995458","23.13.164.38","100.86.243.187","TCP","1514","443  >  54993 [ACK] Seq=375507 Ack=7229 Win=1745 Len=1448 TSval=1115339283 TSecr=931305599 [TCP PDU reassembled in 2007]"
"2004","1.995458","23.13.164.38","100.86.243.187","TCP","1514","443  >  54993 [ACK] Seq=376955 Ack=7229 Win=1745 Len=1448 TSval=1115339283 TSecr=931305599 [TCP PDU reassembled in 2007]"
"2005","1.995459","23.13.164.38","100.86.243.187","TCP","1514","443  >  54993 [ACK] Seq=378403 Ack=7229 Win=1745 Len=1448 TSval=1115339283 TSecr=931305599 [TCP PDU reassembled in 2007]"
"2006","1.995459","23.13.164.38","100.86.243.187","TCP","1514","443  >  54993 [ACK] Seq=379851 Ack=7229 Win=1745 Len=1448 TSval=1115339283 TSecr=931305599 [TCP PDU reassembled in 2007]"
"2007","1.995459","23.13.164.38","100.86.243.187","TLSv1.2","525","Application Data"
"2008","1.995505","100.86.243.187","23.13.164.38","TCP","66","54993  >  443 [ACK] Seq=7229 Ack=381758 Win=37335 Len=0 TSval=931305646 TSecr=1115339283"
"2009","1.995646","100.86.243.187","23.13.164.38","TCP","66","[TCP Window Update] 54993  >  443 [ACK] Seq=7229 Ack=381758 Win=37456 Len=0 TSval=931305646 TSecr=1115339283"
"2010","1.996231","23.13.164.38","100.86.243.187","TLSv1.2","1514","Application Data"
"2011","1.996232","23.13.164.38","100.86.243.187","TLSv1.2","738","Application Data"
"2012","1.996232","23.13.164.38","100.86.243.187","TLSv1.2","493","Application Data"
"2013","1.996233","23.13.164.38","100.86.243.187","TCP","1514","443  >  54993 [ACK] Seq=384305 Ack=7229 Win=1745 Len=1448 TSval=1115339287 TSecr=931305599 [TCP PDU reassembled in 2015]"
"2014","1.996290","100.86.243.187","23.13.164.38","TCP","66","54993  >  443 [ACK] Seq=7229 Ack=385753 Win=37393 Len=0 TSval=931305646 TSecr=1115339287"
"2015","1.996664","23.13.164.38","100.86.243.187","TLSv1.2","293","Application Data"
"2016","1.996718","100.86.243.187","23.13.164.38","TCP","66","[TCP Window Update] 54993  >  443 [ACK] Seq=7229 Ack=385753 Win=37456 Len=0 TSval=931305647 TSecr=1115339287"
"2017","1.996742","100.86.243.187","23.13.164.38","TCP","66","54993  >  443 [ACK] Seq=7229 Ack=385980 Win=37452 Len=0 TSval=931305647 TSecr=1115339287"
