"No.","Time","Source","Destination","Protocol","Length","Info"
"1","0.000000","192.168.1.166","23.39.213.4","TLSv1.2","5279","Application Data"
"2","0.000069","192.168.1.166","23.39.213.4","TLSv1.2","93","Application Data"
"3","0.000083","192.168.1.166","23.39.213.4","TLSv1.2","538","Application Data"
"4","0.060639","23.39.213.4","192.168.1.166","TCP","54","443  >  50692 [ACK] Seq=1 Ack=5749 Win=9919 Len=0"
"5","0.061044","23.39.213.4","192.168.1.166","TLSv1.2","93","Application Data"
"6","0.102072","192.168.1.166","23.39.213.4","TCP","54","50692  >  443 [ACK] Seq=5749 Ack=40 Win=8191 Len=0"
"7","0.165729","23.39.213.4","192.168.1.166","TLSv1.2","935","Application Data"
"8","0.165729","23.39.213.4","192.168.1.166","TLSv1.2","116","Application Data"
"9","0.165752","192.168.1.166","23.39.213.4","TCP","54","50692  >  443 [ACK] Seq=5749 Ack=983 Win=8188 Len=0"
"10","0.166299","192.168.1.166","23.39.213.4","TLSv1.2","89","Application Data"
"11","0.239528","23.39.213.4","192.168.1.166","TCP","54","443  >  50692 [ACK] Seq=983 Ack=5784 Win=9949 Len=0"
"12","0.420074","192.168.1.166","23.39.213.4","TLSv1.2","5328","Application Data"
"13","0.455292","23.39.213.4","192.168.1.166","TCP","54","443  >  50692 [ACK] Seq=983 Ack=7244 Win=9945 Len=0"
"14","0.455292","23.39.213.4","192.168.1.166","TCP","54","443  >  50692 [ACK] Seq=983 Ack=8704 Win=9937 Len=0"
"15","0.455292","23.39.213.4","192.168.1.166","TCP","54","443  >  50692 [ACK] Seq=983 Ack=11058 Win=9940 Len=0"
"16","0.760619","23.39.213.4","192.168.1.166","TCP","1514","443  >  50692 [ACK] Seq=983 Ack=11058 Win=9949 Len=1460 [TCP PDU reassembled in 17]"
"17","0.760619","23.39.213.4","192.168.1.166","TLSv1.2","505","Application Data"
"18","0.760619","23.39.213.4","192.168.1.166","TCP","16114","443  >  50692 [ACK] Seq=2894 Ack=11058 Win=9949 Len=16060 [TCP PDU reassembled in 19]"
"19","0.760619","23.39.213.4","192.168.1.166","TLSv1.2","400","Application Data"
"20","0.760619","23.39.213.4","192.168.1.166","TLSv1.2","16114","Application Data"
"21","0.760619","23.39.213.4","192.168.1.166","TLSv1.2","431","Application Data"
"22","0.760619","23.39.213.4","192.168.1.166","TLSv1.2","7354","Application Data"
"23","0.760619","23.39.213.4","192.168.1.166","TLSv1.2","1180","Application Data"
"24","0.760619","23.39.213.4","192.168.1.166","TCP","5894","443  >  50692 [ACK] Seq=44163 Ack=11058 Win=9949 Len=5840 [TCP PDU reassembled in 27]"
"25","0.760689","192.168.1.166","23.39.213.4","TCP","54","50692  >  443 [ACK] Seq=11058 Ack=50003 Win=8191 Len=0"
"26","0.760798","23.39.213.4","192.168.1.166","TCP","1514","443  >  50692 [ACK] Seq=50003 Ack=11058 Win=9949 Len=1460 [TCP PDU reassembled in 27]"
"27","0.760798","23.39.213.4","192.168.1.166","TLSv1.2","1033","Application Data"
"28","0.760805","192.168.1.166","23.39.213.4","TCP","54","50692  >  443 [ACK] Seq=11058 Ack=52442 Win=8191 Len=0"
"29","0.762844","23.39.213.4","192.168.1.166","TCP","1514","443  >  50692 [ACK] Seq=52442 Ack=11058 Win=9949 Len=1460 [TCP PDU reassembled in 35]"
"30","0.762844","23.39.213.4","192.168.1.166","TCP","1514","443  >  50692 [ACK] Seq=53902 Ack=11058 Win=9949 Len=1460 [TCP PDU reassembled in 35]"
"31","0.762844","23.39.213.4","192.168.1.166","TCP","1514","443  >  50692 [ACK] Seq=55362 Ack=11058 Win=9949 Len=1460 [TCP PDU reassembled in 35]"
"32","0.762844","23.39.213.4","192.168.1.166","TCP","1514","443  >  50692 [ACK] Seq=56822 Ack=11058 Win=9949 Len=1460 [TCP PDU reassembled in 35]"
"33","0.762844","23.39.213.4","192.168.1.166","TCP","1514","443  >  50692 [ACK] Seq=58282 Ack=11058 Win=9949 Len=1460 [TCP PDU reassembled in 35]"
"34","0.762844","23.39.213.4","192.168.1.166","TCP","1514","443  >  50692 [ACK] Seq=59742 Ack=11058 Win=9949 Len=1460 [TCP PDU reassembled in 35]"
"35","0.762844","23.39.213.4","192.168.1.166","TLSv1.2","1155","Application Data"
"36","0.762844","23.39.213.4","192.168.1.166","TLSv1.2","93","Application Data"
"37","0.762844","23.39.213.4","192.168.1.166","TLSv1.2","85","Application Data"
"38","0.762883","192.168.1.166","23.39.213.4","TCP","54","50692  >  443 [ACK] Seq=11058 Ack=62373 Win=8191 Len=0"
"39","0.766994","192.168.1.166","23.39.213.4","TLSv1.2","5549","Application Data"
"40","0.767047","192.168.1.166","23.39.213.4","TLSv1.2","1663","Application Data"
"41","0.799376","23.39.213.4","192.168.1.166","TCP","54","443  >  50692 [ACK] Seq=62373 Ack=12518 Win=9945 Len=0"
"42","0.799376","23.39.213.4","192.168.1.166","TCP","54","443  >  50692 [ACK] Seq=62373 Ack=13978 Win=9945 Len=0"
"43","0.799376","23.39.213.4","192.168.1.166","TCP","54","443  >  50692 [ACK] Seq=62373 Ack=16553 Win=9939 Len=0"
"44","0.799376","23.39.213.4","192.168.1.166","TCP","54","443  >  50692 [ACK] Seq=62373 Ack=18013 Win=9945 Len=0"
"45","0.799376","23.39.213.4","192.168.1.166","TCP","54","443  >  50692 [ACK] Seq=62373 Ack=18162 Win=9949 Len=0"
"46","0.802321","192.168.1.166","23.39.213.4","TLSv1.2","5259","Application Data"
"47","0.802401","192.168.1.166","23.39.213.4","TLSv1.2","5260","Application Data"
"48","0.804116","192.168.1.166","23.39.213.4","TLSv1.2","584","Application Data"
"49","0.804141","192.168.1.166","23.39.213.4","TLSv1.2","201","Application Data"
"50","0.837457","23.39.213.4","192.168.1.166","TCP","54","443  >  50692 [ACK] Seq=62373 Ack=19622 Win=9945 Len=0"
"51","0.837457","23.39.213.4","192.168.1.166","TCP","54","443  >  50692 [ACK] Seq=62373 Ack=21082 Win=9937 Len=0"
"52","0.837457","23.39.213.4","192.168.1.166","TCP","54","443  >  50692 [ACK] Seq=62373 Ack=22542 Win=9945 Len=0"
"53","0.837457","23.39.213.4","192.168.1.166","TCP","54","443  >  50692 [ACK] Seq=62373 Ack=23367 Win=9941 Len=0"
"54","0.837457","23.39.213.4","192.168.1.166","TCP","54","443  >  50692 [ACK] Seq=62373 Ack=24827 Win=9940 Len=0"
"55","0.837457","23.39.213.4","192.168.1.166","TCP","54","443  >  50692 [ACK] Seq=62373 Ack=26287 Win=9932 Len=0"
"56","0.837457","23.39.213.4","192.168.1.166","TCP","54","443  >  50692 [ACK] Seq=62373 Ack=28573 Win=9915 Len=0"
"57","0.837457","23.39.213.4","192.168.1.166","TCP","54","443  >  50692 [ACK] Seq=62373 Ack=29250 Win=9910 Len=0"
"58","0.850148","23.39.213.4","192.168.1.166","TLSv1.2","346","Application Data"
"59","0.850148","23.39.213.4","192.168.1.166","TCP","1514","443  >  50692 [ACK] Seq=62665 Ack=29250 Win=9949 Len=1460 [TCP PDU reassembled in 60]"
"60","0.850148","23.39.213.4","192.168.1.166","TLSv1.2","1006","Application Data"
"61","0.850148","23.39.213.4","192.168.1.166","TLSv1.2","1514","Application Data"
"62","0.850148","23.39.213.4","192.168.1.166","TLSv1.2","624","Application Data"
"63","0.850192","192.168.1.166","23.39.213.4","TCP","54","50692  >  443 [ACK] Seq=29250 Ack=67107 Win=8191 Len=0"
"64","0.851507","192.168.1.166","23.39.213.4","TLSv1.2","201","Application Data"
"65","0.851537","192.168.1.166","23.39.213.4","TLSv1.2","180","Application Data"
"66","0.852132","23.39.213.4","192.168.1.166","TLSv1.2","361","Application Data"
"67","0.852132","23.39.213.4","192.168.1.166","TLSv1.2","289","Application Data"
"68","0.852142","192.168.1.166","23.39.213.4","TCP","54","50692  >  443 [ACK] Seq=29523 Ack=67649 Win=8189 Len=0"
"69","0.854182","23.39.213.4","192.168.1.166","TLSv1.2","383","Application Data"
"70","0.854182","23.39.213.4","192.168.1.166","TCP","16114","443  >  50692 [ACK] Seq=67978 Ack=29250 Win=9949 Len=16060 [TCP PDU reassembled in 71]"
"71","0.854182","23.39.213.4","192.168.1.166","TLSv1.2","400","Application Data"
"72","0.854182","23.39.213.4","192.168.1.166","TLSv1.2","16114","Application Data"
"73","0.854182","23.39.213.4","192.168.1.166","TLSv1.2","431","Application Data"
"74","0.854214","192.168.1.166","23.39.213.4","TCP","54","50692  >  443 [ACK] Seq=29523 Ack=100821 Win=8191 Len=0"
"75","0.855221","23.39.213.4","192.168.1.166","TLSv1.2","1514","Application Data"
"76","0.855221","23.39.213.4","192.168.1.166","TCP","1514","443  >  50692 [ACK] Seq=102281 Ack=29250 Win=9949 Len=1460 [TCP PDU reassembled in 81]"
"77","0.855221","23.39.213.4","192.168.1.166","TCP","1514","443  >  50692 [ACK] Seq=103741 Ack=29250 Win=9949 Len=1460 [TCP PDU reassembled in 81]"
"78","0.855221","23.39.213.4","192.168.1.166","TCP","1514","443  >  50692 [ACK] Seq=105201 Ack=29250 Win=9949 Len=1460 [TCP PDU reassembled in 81]"
"79","0.855221","23.39.213.4","192.168.1.166","TCP","1514","443  >  50692 [ACK] Seq=106661 Ack=29250 Win=9949 Len=1460 [TCP PDU reassembled in 81]"
"80","0.855221","23.39.213.4","192.168.1.166","TCP","1514","443  >  50692 [ACK] Seq=108121 Ack=29250 Win=9949 Len=1460 [TCP PDU reassembled in 81]"
"81","0.855221","23.39.213.4","192.168.1.166","TLSv1.2","966","Application Data"
"82","0.855247","192.168.1.166","23.39.213.4","TCP","54","50692  >  443 [ACK] Seq=29523 Ack=110493 Win=8191 Len=0"
"83","0.871883","23.39.213.4","192.168.1.166","TLSv1.2","382","Application Data"
"84","0.871883","23.39.213.4","192.168.1.166","TCP","5894","443  >  50692 [ACK] Seq=110821 Ack=29250 Win=9949 Len=5840 [TCP PDU reassembled in 85]"
"85","0.871883","23.39.213.4","192.168.1.166","TLSv1.2","731","Application Data"
"86","0.871909","192.168.1.166","23.39.213.4","TCP","54","50692  >  443 [ACK] Seq=29523 Ack=117338 Win=8191 Len=0"
"87","0.884127","192.168.1.166","23.39.213.4","TLSv1.2","178","Application Data"
"88","0.884354","23.39.213.4","192.168.1.166","TCP","54","443  >  50692 [ACK] Seq=117338 Ack=29523 Win=9949 Len=0"
"89","0.884861","192.168.1.166","23.39.213.4","TLSv1.2","177","Application Data"
"90","0.885331","192.168.1.166","23.39.213.4","TLSv1.2","5095","Application Data"
"91","0.885394","192.168.1.166","23.39.213.4","TLSv1.2","5286","Application Data"
"92","0.886978","192.168.1.166","23.39.213.4","TLSv1.2","5349","Application Data"
"93","0.893599","192.168.1.166","23.39.213.4","TLSv1.2","90","Application Data"
"94","0.893646","192.168.1.166","23.39.213.4","TLSv1.2","90","Application Data"
"95","0.894569","23.39.213.4","192.168.1.166","TLSv1.2","345","Application Data"
"96","0.894569","23.39.213.4","192.168.1.166","TCP","1514","443  >  50692 [ACK] Seq=117629 Ack=29523 Win=9949 Len=1460 [TCP PDU reassembled in 97]"
"97","0.894569","23.39.213.4","192.168.1.166","TLSv1.2","1475","Application Data"
"98","0.894602","192.168.1.166","23.39.213.4","TCP","54","50692  >  443 [ACK] Seq=45410 Ack=120510 Win=8191 Len=0"
"99","0.895283","192.168.1.166","23.39.213.4","TLSv1.2","558","Application Data"
"100","0.896736","192.168.1.166","23.39.213.4","TLSv1.2","207","Application Data"
"101","0.896767","192.168.1.166","23.39.213.4","TLSv1.2","205","Application Data"
"102","0.898669","23.39.213.4","192.168.1.166","TLSv1.2","326","Application Data"
"103","0.898669","23.39.213.4","192.168.1.166","TCP","1514","443  >  50692 [ACK] Seq=120782 Ack=29523 Win=9949 Len=1460 [TCP PDU reassembled in 104]"
"104","0.898669","23.39.213.4","192.168.1.166","TLSv1.2","586","Application Data"
"105","0.898693","192.168.1.166","23.39.213.4","TCP","54","50692  >  443 [ACK] Seq=46218 Ack=122774 Win=8191 Len=0"
"106","0.899228","192.168.1.166","23.39.213.4","TLSv1.2","200","Application Data"
"107","0.915356","192.168.1.166","23.39.213.4","TLSv1.2","90","Application Data"
"108","0.915398","192.168.1.166","23.39.213.4","TLSv1.2","90","Application Data"
"109","0.916837","23.39.213.4","192.168.1.166","TCP","54","443  >  50692 [ACK] Seq=122774 Ack=29770 Win=9949 Len=0"
"110","0.931361","23.39.213.4","192.168.1.166","TLSv1.2","333","Application Data"
"111","0.931361","23.39.213.4","192.168.1.166","TCP","1514","443  >  50692 [ACK] Seq=123053 Ack=46218 Win=9857 Len=1460 [TCP PDU reassembled in 112]"
"112","0.931361","23.39.213.4","192.168.1.166","TLSv1.2","452","Application Data"
"113","0.931407","192.168.1.166","23.39.213.4","TCP","54","50692  >  443 [ACK] Seq=46436 Ack=124911 Win=8191 Len=0"
"114","0.932062","192.168.1.166","23.39.213.4","TLSv1.2","185","Application Data"
"115","0.948803","23.39.213.4","192.168.1.166","TLSv1.2","346","Application Data"
"116","0.948803","23.39.213.4","192.168.1.166","TCP","13194","443  >  50692 [ACK] Seq=125203 Ack=46364 Win=9949 Len=13140 [TCP PDU reassembled in 117]"
"117","0.948803","23.39.213.4","192.168.1.166","TLSv1.2","1331","Application Data"
"118","0.948803","23.39.213.4","192.168.1.166","TCP","54","443  >  50692 [ACK] Seq=139620 Ack=46436 Win=9949 Len=0"
"119","0.948863","192.168.1.166","23.39.213.4","TCP","54","50692  >  443 [ACK] Seq=46567 Ack=139620 Win=8191 Len=0"
"120","0.949535","192.168.1.166","23.39.213.4","TLSv1.2","202","Application Data"
"121","0.951228","192.168.1.166","23.39.213.4","TLSv1.2","5071","Application Data"
"122","0.961197","23.39.213.4","192.168.1.166","TLSv1.2","951","Application Data"
"123","0.963451","23.39.213.4","192.168.1.166","TLSv1.2","85","Application Data"
"124","0.963474","192.168.1.166","23.39.213.4","TCP","54","50692  >  443 [ACK] Seq=51732 Ack=140548 Win=8188 Len=0"
"125","0.965392","23.39.213.4","192.168.1.166","TLSv1.2","316","Application Data"
"126","0.965392","23.39.213.4","192.168.1.166","TCP","2974","443  >  50692 [ACK] Seq=140810 Ack=46436 Win=9949 Len=2920 [TCP PDU reassembled in 127]"
"127","0.965392","23.39.213.4","192.168.1.166","TLSv1.2","1221","Application Data"
"128","0.965423","192.168.1.166","23.39.213.4","TCP","54","50692  >  443 [ACK] Seq=51732 Ack=144897 Win=8191 Len=0"
"129","0.966096","192.168.1.166","23.39.213.4","TLSv1.2","588","Application Data"
"130","0.975715","23.39.213.4","192.168.1.166","TLSv1.2","371","Application Data"
"131","0.975715","23.39.213.4","192.168.1.166","TLSv1.2","1338","Application Data"
"132","0.975715","23.39.213.4","192.168.1.166","TLSv1.2","16114","Application Data"
"133","0.975715","23.39.213.4","192.168.1.166","TLSv1.2","680","Application Data"
"134","0.975715","23.39.213.4","192.168.1.166","TLSv1.2","85","Application Data"
"135","0.975715","23.39.213.4","192.168.1.166","TCP","16114","443  >  50692 [ACK] Seq=163215 Ack=46567 Win=9949 Len=16060 [TCP PDU reassembled in 136]"
"136","0.975715","23.39.213.4","192.168.1.166","TLSv1.2","400","Application Data"
"137","0.975789","192.168.1.166","23.39.213.4","TCP","54","50692  >  443 [ACK] Seq=52266 Ack=179621 Win=8191 Len=0"
"138","0.976695","23.39.213.4","192.168.1.166","TLSv1.2","32174","Application Data, Application Data, Application Data"
"139","0.976695","23.39.213.4","192.168.1.166","TLSv1.2","808","Application Data"
"140","0.976695","23.39.213.4","192.168.1.166","TLSv1.2","16114","Application Data, Application Data, Application Data, Application Data, Application Data, Application Data"
"141","0.976695","23.39.213.4","192.168.1.166","TLSv1.2","1206","Application Data"
"142","0.976742","192.168.1.166","23.39.213.4","TCP","54","50692  >  443 [ACK] Seq=52266 Ack=229707 Win=8191 Len=0"
"143","0.978233","23.39.213.4","192.168.1.166","TLSv1.2","317","Application Data"
"144","0.978233","23.39.213.4","192.168.1.166","TCP","1514","443  >  50692 [ACK] Seq=229970 Ack=46567 Win=9949 Len=1460 [TCP PDU reassembled in 145]"
"145","0.978233","23.39.213.4","192.168.1.166","TLSv1.2","112","Application Data"
"146","0.978233","23.39.213.4","192.168.1.166","TCP","4434","443  >  50692 [ACK] Seq=231488 Ack=46567 Win=9949 Len=4380 [TCP PDU reassembled in 147]"
"147","0.978233","23.39.213.4","192.168.1.166","TLSv1.2","420","Application Data"
"148","0.978272","192.168.1.166","23.39.213.4","TCP","54","50692  >  443 [ACK] Seq=52266 Ack=236234 Win=8191 Len=0"
"149","0.978441","192.168.1.166","23.39.213.4","TLSv1.2","197","Application Data"
"150","0.979680","192.168.1.166","23.39.213.4","TLSv1.2","201","Application Data"
"151","0.980247","192.168.1.166","23.39.213.4","TLSv1.2","200","Application Data"
"152","0.992628","23.39.213.4","192.168.1.166","TCP","54","443  >  50692 [ACK] Seq=236234 Ack=51732 Win=9926 Len=0"
"153","1.014712","23.39.213.4","192.168.1.166","TLSv1.2","318","Application Data"
"154","1.014712","23.39.213.4","192.168.1.166","TCP","1514","443  >  50692 [ACK] Seq=236498 Ack=52702 Win=9941 Len=1460 [TCP PDU reassembled in 155]"
"155","1.014712","23.39.213.4","192.168.1.166","TLSv1.2","66","Application Data"
"156","1.014712","23.39.213.4","192.168.1.166","TLSv1.2","4434","Application Data"
"157","1.014712","23.39.213.4","192.168.1.166","TLSv1.2","622","Application Data"
"158","1.014712","23.39.213.4","192.168.1.166","TLSv1.2","7354","Application Data"
"159","1.014712","23.39.213.4","192.168.1.166","TLSv1.2","980","Application Data"
"160","1.014791","192.168.1.166","23.39.213.4","TCP","54","50692  >  443 [ACK] Seq=52702 Ack=251144 Win=8191 Len=0"
"161","1.016617","192.168.1.166","23.39.213.4","TLSv1.2","190","Application Data"
"162","1.027592","23.39.213.4","192.168.1.166","TCP","2974","443  >  50692 [ACK] Seq=251144 Ack=52702 Win=9949 Len=2920 [TCP PDU reassembled in 163]"
"163","1.027592","23.39.213.4","192.168.1.166","TLSv1.2","976","Application Data"
"164","1.027635","192.168.1.166","23.39.213.4","TCP","54","50692  >  443 [ACK] Seq=52838 Ack=254986 Win=8191 Len=0"
"165","1.029527","23.39.213.4","192.168.1.166","TLSv1.2","318","Application Data"
"166","1.029527","23.39.213.4","192.168.1.166","TCP","16114","443  >  50692 [ACK] Seq=255250 Ack=52702 Win=9949 Len=16060 [TCP PDU reassembled in 167]"
"167","1.029527","23.39.213.4","192.168.1.166","TLSv1.2","400","Application Data"
"168","1.029527","23.39.213.4","192.168.1.166","TLSv1.2","11734","Application Data, Application Data, Application Data"
"169","1.029527","23.39.213.4","192.168.1.166","TLSv1.2","1240","Application Data"
"170","1.029573","192.168.1.166","23.39.213.4","TCP","54","50692  >  443 [ACK] Seq=52838 Ack=284522 Win=8191 Len=0"
"171","1.066260","192.168.1.166","23.39.213.4","TLSv1.2","5044","Application Data"
"172","1.073857","192.168.1.166","23.39.213.4","TLSv1.2","5258","Application Data"
"173","1.073991","192.168.1.166","23.39.213.4","TLSv1.2","5258","Application Data"
"174","1.074141","192.168.1.166","23.39.213.4","TLSv1.2","5258","Application Data"
"175","1.089313","23.39.213.4","192.168.1.166","TLSv1.2","317","Application Data"
"176","1.089313","23.39.213.4","192.168.1.166","TCP","1514","443  >  50692 [ACK] Seq=284785 Ack=52838 Win=9949 Len=1460 [TCP PDU reassembled in 177]"
"177","1.089313","23.39.213.4","192.168.1.166","TLSv1.2","145","Application Data"
"178","1.089313","23.39.213.4","192.168.1.166","TCP","7354","443  >  50692 [ACK] Seq=286336 Ack=52838 Win=9949 Len=7300 [TCP PDU reassembled in 179]"
"179","1.089313","23.39.213.4","192.168.1.166","TLSv1.2","1199","Application Data"
"180","1.089371","192.168.1.166","23.39.213.4","TCP","54","50692  >  443 [ACK] Seq=73440 Ack=294781 Win=8191 Len=0"
"181","1.098597","23.39.213.4","192.168.1.166","TCP","54","443  >  50692 [ACK] Seq=294781 Ack=55758 Win=9937 Len=0"
"182","1.098597","23.39.213.4","192.168.1.166","TCP","54","443  >  50692 [ACK] Seq=294781 Ack=57828 Win=9949 Len=0"
"183","1.126026","23.39.213.4","192.168.1.166","TCP","54","443  >  50692 [ACK] Seq=294781 Ack=73440 Win=9870 Len=0"
"184","1.141180","192.168.1.166","23.39.213.4","TLSv1.2","5318","Application Data"
"185","1.141238","192.168.1.166","23.39.213.4","TLSv1.2","253","Application Data"
"186","1.151602","23.39.213.4","192.168.1.166","TLSv1.2","317","Application Data"
"187","1.151602","23.39.213.4","192.168.1.166","TCP","1514","443  >  50692 [ACK] Seq=295044 Ack=73440 Win=9949 Len=1460 [TCP PDU reassembled in 188]"
"188","1.151602","23.39.213.4","192.168.1.166","TLSv1.2","146","Application Data"
"189","1.151602","23.39.213.4","192.168.1.166","TLSv1.2","318","Application Data"
"190","1.151602","23.39.213.4","192.168.1.166","TLSv1.2","1389","Application Data"
"191","1.151602","23.39.213.4","192.168.1.166","TLSv1.2","377","Application Data"
"192","1.151602","23.39.213.4","192.168.1.166","TCP","16114","443  >  50692 [ACK] Seq=298518 Ack=73440 Win=9949 Len=16060 [TCP PDU reassembled in 193]"
"193","1.151602","23.39.213.4","192.168.1.166","TLSv1.2","400","Application Data"
"194","1.151602","23.39.213.4","192.168.1.166","TLSv1.2","16114","Application Data"
"195","1.151602","23.39.213.4","192.168.1.166","TLSv1.2","462","Application Data, Application Data"
"196","1.151602","23.39.213.4","192.168.1.166","TLSv1.2","8814","Application Data"
"197","1.151602","23.39.213.4","192.168.1.166","TLSv1.2","679","Application Data, Application Data"
"198","1.151692","192.168.1.166","23.39.213.4","TCP","54","50692  >  443 [ACK] Seq=78903 Ack=340777 Win=8191 Len=0"
"199","1.153021","23.39.213.4","192.168.1.166","TCP","2974","443  >  50692 [ACK] Seq=340777 Ack=73440 Win=9949 Len=2920 [TCP PDU reassembled in 200]"
"200","1.153021","23.39.213.4","192.168.1.166","TLSv1.2","596","Application Data"
"201","1.153021","23.39.213.4","192.168.1.166","TCP","10274","443  >  50692 [ACK] Seq=344239 Ack=73440 Win=9949 Len=10220 [TCP PDU reassembled in 202]"
"202","1.153021","23.39.213.4","192.168.1.166","TLSv1.2","1283","Application Data"
"203","1.153057","192.168.1.166","23.39.213.4","TCP","54","50692  >  443 [ACK] Seq=78903 Ack=355688 Win=8191 Len=0"
"204","1.162259","23.39.213.4","192.168.1.166","TLSv1.2","377","Application Data"
"205","1.162259","23.39.213.4","192.168.1.166","TCP","1514","443  >  50692 [ACK] Seq=356011 Ack=73440 Win=9949 Len=1460 [TCP PDU reassembled in 206]"
"206","1.162259","23.39.213.4","192.168.1.166","TLSv1.2","1192","Application Data"
"207","1.162306","192.168.1.166","23.39.213.4","TCP","54","50692  >  443 [ACK] Seq=78903 Ack=358609 Win=8191 Len=0"
"208","1.163713","192.168.1.166","23.39.213.4","TLSv1.2","5303","Application Data"
"209","1.177441","23.39.213.4","192.168.1.166","TCP","54","443  >  50692 [ACK] Seq=358609 Ack=78903 Win=9922 Len=0"
"210","1.180999","23.39.213.4","192.168.1.166","TLSv1.2","483","Application Data"
"211","1.180999","23.39.213.4","192.168.1.166","TLSv1.2","604","Application Data"
"212","1.181025","192.168.1.166","23.39.213.4","TCP","54","50692  >  443 [ACK] Seq=84152 Ack=359588 Win=8188 Len=0"
"213","1.207971","23.39.213.4","192.168.1.166","TCP","54","443  >  50692 [ACK] Seq=359588 Ack=84152 Win=9925 Len=0"
"214","1.221082","23.39.213.4","192.168.1.166","TLSv1.2","958","Application Data"
"215","1.221487","23.39.213.4","192.168.1.166","TLSv1.2","85","Application Data"
"216","1.221509","192.168.1.166","23.39.213.4","TCP","54","50692  >  443 [ACK] Seq=84152 Ack=360523 Win=8191 Len=0"
"217","1.253552","192.168.1.166","23.39.213.4","TLSv1.2","5313","Application Data"
"218","1.253661","192.168.1.166","23.39.213.4","TLSv1.2","5314","Application Data"
"219","1.253689","192.168.1.166","23.39.213.4","TLSv1.2","780","Application Data"
"220","1.253704","192.168.1.166","23.39.213.4","TLSv1.2","863","Application Data"
"221","1.288897","23.39.213.4","192.168.1.166","TCP","54","443  >  50692 [ACK] Seq=360523 Ack=89411 Win=9949 Len=0"
"222","1.288897","23.39.213.4","192.168.1.166","TCP","54","443  >  50692 [ACK] Seq=360523 Ack=94671 Win=9925 Len=0"
"223","1.288897","23.39.213.4","192.168.1.166","TCP","54","443  >  50692 [ACK] Seq=360523 Ack=96206 Win=9943 Len=0"
"224","1.354024","23.39.213.4","192.168.1.166","TLSv1.2","458","Application Data"
"225","1.354024","23.39.213.4","192.168.1.166","TLSv1.2","728","Application Data"
"226","1.354047","192.168.1.166","23.39.213.4","TCP","54","50692  >  443 [ACK] Seq=96206 Ack=361601 Win=8187 Len=0"
"227","1.357189","23.39.213.4","192.168.1.166","TLSv1.2","458","Application Data"
"228","1.357189","23.39.213.4","192.168.1.166","TLSv1.2","713","Application Data"
"229","1.357214","192.168.1.166","23.39.213.4","TCP","54","50692  >  443 [ACK] Seq=96206 Ack=362664 Win=8191 Len=0"
"230","1.364022","23.39.213.4","192.168.1.166","TLSv1.2","957","Application Data"
"231","1.364145","23.39.213.4","192.168.1.166","TLSv1.2","174","Application Data"
"232","1.364157","192.168.1.166","23.39.213.4","TCP","54","50692  >  443 [ACK] Seq=96206 Ack=363687 Win=8187 Len=0"
"233","1.367611","192.168.1.166","23.39.213.4","TLSv1.2","5304","Application Data"
"234","1.367651","192.168.1.166","23.39.213.4","TLSv1.2","339","Application Data"
"235","1.400879","23.39.213.4","192.168.1.166","TCP","54","443  >  50692 [ACK] Seq=363687 Ack=101456 Win=9949 Len=0"
"236","1.442656","23.39.213.4","192.168.1.166","TCP","54","443  >  50692 [ACK] Seq=363687 Ack=101741 Win=9949 Len=0"
"237","1.498128","23.39.213.4","192.168.1.166","TLSv1.2","961","Application Data"
"238","1.498128","23.39.213.4","192.168.1.166","TLSv1.2","1511","Application Data"
"239","1.498139","192.168.1.166","23.39.213.4","TCP","54","50692  >  443 [ACK] Seq=101741 Ack=366051 Win=8191 Len=0"
"240","1.499961","23.39.213.4","192.168.1.166","TCP","8814","443  >  50692 [ACK] Seq=366051 Ack=101741 Win=9949 Len=8760 [TCP PDU reassembled in 241]"
"241","1.499961","23.39.213.4","192.168.1.166","TLSv1.2","563","Application Data"
"242","1.499985","192.168.1.166","23.39.213.4","TCP","54","50692  >  443 [ACK] Seq=101741 Ack=375320 Win=8191 Len=0"
"243","1.534797","192.168.1.166","23.39.213.4","TLSv1.2","5390","Application Data"
"244","1.567252","23.39.213.4","192.168.1.166","TCP","54","443  >  50692 [ACK] Seq=375320 Ack=107077 Win=9924 Len=0"
"245","1.592921","23.39.213.4","192.168.1.166","TLSv1.2","348","Application Data"
"246","1.592921","23.39.213.4","192.168.1.166","TLSv1.2","312","Application Data"
"247","1.592971","192.168.1.166","23.39.213.4","TCP","54","50692  >  443 [ACK] Seq=107077 Ack=375872 Win=8189 Len=0"
"248","1.628780","192.168.1.166","23.39.213.4","TLSv1.2","5414","Application Data"
"249","1.661786","23.39.213.4","192.168.1.166","TCP","54","443  >  50692 [ACK] Seq=375872 Ack=109997 Win=9937 Len=0"
"250","1.661786","23.39.213.4","192.168.1.166","TCP","54","443  >  50692 [ACK] Seq=375872 Ack=112437 Win=9949 Len=0"
"251","1.688303","23.39.213.4","192.168.1.166","TLSv1.2","349","Application Data"
"252","1.688303","23.39.213.4","192.168.1.166","TLSv1.2","394","Application Data"
"253","1.688342","192.168.1.166","23.39.213.4","TCP","54","50692  >  443 [ACK] Seq=112437 Ack=376507 Win=8187 Len=0"
"254","1.701766","192.168.1.166","23.39.213.4","TLSv1.2","5565","Application Data"
"255","1.701808","192.168.1.166","23.39.213.4","TLSv1.2","3680","Application Data"
"256","1.705295","192.168.1.166","23.39.213.4","TLSv1.2","5565","Application Data"
"257","1.705331","192.168.1.166","23.39.213.4","TLSv1.2","3672","Application Data"
"258","1.720037","192.168.1.166","23.39.213.4","TLSv1.2","5566","Application Data"
"259","1.720080","192.168.1.166","23.39.213.4","TLSv1.2","1863","Application Data"
"260","1.723000","192.168.1.166","23.39.213.4","TLSv1.2","5566","Application Data"
"261","1.723034","192.168.1.166","23.39.213.4","TLSv1.2","1863","Application Data"
"262","1.734187","23.39.213.4","192.168.1.166","TCP","54","443  >  50692 [ACK] Seq=376507 Ack=115357 Win=9937 Len=0"
"263","1.734187","23.39.213.4","192.168.1.166","TCP","54","443  >  50692 [ACK] Seq=376507 Ack=117948 Win=9939 Len=0"
"264","1.734187","23.39.213.4","192.168.1.166","TCP","54","443  >  50692 [ACK] Seq=376507 Ack=121574 Win=9919 Len=0"
"265","1.738658","23.39.213.4","192.168.1.166","TCP","54","443  >  50692 [ACK] Seq=376507 Ack=124494 Win=9937 Len=0"
"266","1.738658","23.39.213.4","192.168.1.166","TCP","54","443  >  50692 [ACK] Seq=376507 Ack=127085 Win=9939 Len=0"
"267","1.738658","23.39.213.4","192.168.1.166","TCP","54","443  >  50692 [ACK] Seq=376507 Ack=130005 Win=9924 Len=0"
"268","1.743421","23.39.213.4","192.168.1.166","TLSv1.2","89","Application Data"
"269","1.755191","23.39.213.4","192.168.1.166","TCP","54","443  >  50692 [ACK] Seq=376542 Ack=136215 Win=9949 Len=0"
"270","1.755191","23.39.213.4","192.168.1.166","TCP","54","443  >  50692 [ACK] Seq=376542 Ack=138024 Win=9949 Len=0"
"271","1.755191","23.39.213.4","192.168.1.166","TCP","54","443  >  50692 [ACK] Seq=376542 Ack=140944 Win=9937 Len=0"
"272","1.755191","23.39.213.4","192.168.1.166","TCP","54","443  >  50692 [ACK] Seq=376542 Ack=143536 Win=9946 Len=0"
"273","1.759066","23.39.213.4","192.168.1.166","TCP","54","443  >  50692 [ACK] Seq=376542 Ack=145345 Win=9935 Len=0"
"274","1.763093","23.39.213.4","192.168.1.166","TLSv1.2","361","Application Data"
"275","1.763093","23.39.213.4","192.168.1.166","TLSv1.2","289","Application Data"
"276","1.763117","192.168.1.166","23.39.213.4","TCP","54","50692  >  443 [ACK] Seq=145345 Ack=377084 Win=8191 Len=0"
"277","1.767673","23.39.213.4","192.168.1.166","TLSv1.2","361","Application Data"
"278","1.767673","23.39.213.4","192.168.1.166","TLSv1.2","289","Application Data"
"279","1.767687","192.168.1.166","23.39.213.4","TCP","54","50692  >  443 [ACK] Seq=145345 Ack=377626 Win=8189 Len=0"
"280","1.781290","23.39.213.4","192.168.1.166","TLSv1.2","361","Application Data"
"281","1.781290","23.39.213.4","192.168.1.166","TLSv1.2","289","Application Data"
"282","1.781304","192.168.1.166","23.39.213.4","TCP","54","50692  >  443 [ACK] Seq=145345 Ack=378168 Win=8187 Len=0"
"283","1.787732","23.39.213.4","192.168.1.166","TLSv1.2","361","Application Data"
"284","1.787732","23.39.213.4","192.168.1.166","TLSv1.2","289","Application Data"
"285","1.787753","192.168.1.166","23.39.213.4","TCP","54","50692  >  443 [ACK] Seq=145345 Ack=378710 Win=8191 Len=0"
"286","2.154954","192.168.1.166","23.39.213.4","TLSv1.2","5292","Application Data"
"287","2.187493","23.39.213.4","192.168.1.166","TCP","54","443  >  50692 [ACK] Seq=378710 Ack=150583 Win=9949 Len=0"
"288","2.211587","23.39.213.4","192.168.1.166","TLSv1.2","368","Application Data"
"289","2.211587","23.39.213.4","192.168.1.166","TLSv1.2","614","Application Data"
"290","2.211604","192.168.1.166","23.39.213.4","TCP","54","50692  >  443 [ACK] Seq=150583 Ack=379584 Win=8188 Len=0"
"291","2.318777","192.168.1.166","23.39.213.4","TLSv1.2","5309","Application Data"
"292","2.318822","192.168.1.166","23.39.213.4","TLSv1.2","5479","Application Data"
"293","2.351321","23.39.213.4","192.168.1.166","TCP","54","443  >  50692 [ACK] Seq=379584 Ack=153503 Win=9949 Len=0"
"294","2.351321","23.39.213.4","192.168.1.166","TCP","54","443  >  50692 [ACK] Seq=379584 Ack=155838 Win=9949 Len=0"
"295","2.359964","23.39.213.4","192.168.1.166","TCP","54","443  >  50692 [ACK] Seq=379584 Ack=161263 Win=9924 Len=0"
"296","2.479076","23.39.213.4","192.168.1.166","TLSv1.2","374","Application Data"
"297","2.479076","23.39.213.4","192.168.1.166","TLSv1.2","85","Application Data"
"298","2.479111","192.168.1.166","23.39.213.4","TCP","54","50692  >  443 [ACK] Seq=161263 Ack=379935 Win=8187 Len=0"
"299","2.495355","192.168.1.166","23.39.213.4","TLSv1.2","5713","Application Data"
"300","2.495409","192.168.1.166","23.39.213.4","TLSv1.2","5978","Application Data"
"301","2.498716","192.168.1.166","23.39.213.4","TLSv1.2","5579","Application Data"
"302","2.527723","23.39.213.4","192.168.1.166","TCP","54","443  >  50692 [ACK] Seq=379935 Ack=165643 Win=9930 Len=0"
"303","2.527723","23.39.213.4","192.168.1.166","TCP","54","443  >  50692 [ACK] Seq=379935 Ack=168382 Win=9945 Len=0"
"304","2.527723","23.39.213.4","192.168.1.166","TCP","54","443  >  50692 [ACK] Seq=379935 Ack=172846 Win=9920 Len=0"
"305","2.531611","23.39.213.4","192.168.1.166","TCP","54","443  >  50692 [ACK] Seq=379935 Ack=178371 Win=9924 Len=0"
"306","2.574864","23.39.213.4","192.168.1.166","TLSv1.2","361","Application Data"
"307","2.574864","23.39.213.4","192.168.1.166","TLSv1.2","289","Application Data"
"308","2.574897","192.168.1.166","23.39.213.4","TCP","54","50692  >  443 [ACK] Seq=178371 Ack=380477 Win=8191 Len=0"
"309","3.068673","192.168.1.166","23.39.213.4","TLSv1.2","5460","Application Data"
"310","3.068717","192.168.1.166","23.39.213.4","TLSv1.2","1975","Application Data"
"311","3.100350","23.39.213.4","192.168.1.166","TCP","54","443  >  50692 [ACK] Seq=380477 Ack=185698 Win=9920 Len=0"
"312","3.136807","23.39.213.4","192.168.1.166","TLSv1.2","374","Application Data"
"313","3.136807","23.39.213.4","192.168.1.166","TLSv1.2","85","Application Data"
"314","3.136829","192.168.1.166","23.39.213.4","TCP","54","50692  >  443 [ACK] Seq=185698 Ack=380828 Win=8190 Len=0"
"315","3.966548","192.168.1.166","23.39.213.4","TLSv1.2","5411","Application Data"
"316","4.000269","23.39.213.4","192.168.1.166","TCP","54","443  >  50692 [ACK] Seq=380828 Ack=191055 Win=9949 Len=0"
"317","4.030065","23.39.213.4","192.168.1.166","TLSv1.2","368","Application Data"
"318","4.030065","23.39.213.4","192.168.1.166","TLSv1.2","591","Application Data"
"319","4.030089","192.168.1.166","23.39.213.4","TCP","54","50692  >  443 [ACK] Seq=191055 Ack=381679 Win=8187 Len=0"
"320","4.032461","192.168.1.166","23.39.213.4","TLSv1.2","5436","Application Data"
"321","4.032499","192.168.1.166","23.39.213.4","TLSv1.2","285","Application Data"
"322","4.064119","23.39.213.4","192.168.1.166","TCP","54","443  >  50692 [ACK] Seq=381679 Ack=196437 Win=9949 Len=0"
"323","4.105971","23.39.213.4","192.168.1.166","TCP","54","443  >  50692 [ACK] Seq=381679 Ack=196668 Win=9949 Len=0"
"324","4.168372","23.39.213.4","192.168.1.166","TLSv1.2","355","Application Data"
"325","4.168372","23.39.213.4","192.168.1.166","TLSv1.2","121","Application Data"
"326","4.168399","192.168.1.166","23.39.213.4","TCP","54","50692  >  443 [ACK] Seq=196668 Ack=382047 Win=8191 Len=0"
"327","4.504910","192.168.1.166","23.39.213.4","TLSv1.2","5713","Application Data"
"328","4.504961","192.168.1.166","23.39.213.4","TLSv1.2","1225","Application Data"
"329","4.521091","23.39.213.4","192.168.1.166","TLSv1.2","1471","Application Data"
"330","4.521091","23.39.213.4","192.168.1.166","TCP","16114","443  >  50692 [ACK] Seq=383464 Ack=196668 Win=9949 Len=16060 [TCP PDU reassembled in 331]"
"331","4.521091","23.39.213.4","192.168.1.166","TLSv1.2","400","Application Data"
"332","4.521091","23.39.213.4","192.168.1.166","TLSv1.2","85","Application Data"
"333","4.521091","23.39.213.4","192.168.1.166","TCP","16114","443  >  50692 [ACK] Seq=399901 Ack=196668 Win=9949 Len=16060 [TCP PDU reassembled in 334]"
"334","4.521091","23.39.213.4","192.168.1.166","TLSv1.2","400","Application Data"
"335","4.521143","192.168.1.166","23.39.213.4","TCP","54","50692  >  443 [ACK] Seq=203498 Ack=416307 Win=8191 Len=0"
"336","4.521542","23.39.213.4","192.168.1.166","TLSv1.2","13194","Application Data, Application Data"
"337","4.521542","23.39.213.4","192.168.1.166","TLSv1.2","92","Application Data"
"338","4.521558","192.168.1.166","23.39.213.4","TCP","54","50692  >  443 [ACK] Seq=203498 Ack=429485 Win=8191 Len=0"
"339","4.523809","23.39.213.4","192.168.1.166","TCP","16114","443  >  50692 [ACK] Seq=429485 Ack=196668 Win=9949 Len=16060 [TCP PDU reassembled in 340]"
"340","4.523809","23.39.213.4","192.168.1.166","TLSv1.2","400","Application Data"
"341","4.523809","23.39.213.4","192.168.1.166","TLSv1.2","85","Application Data"
"342","4.523839","192.168.1.166","23.39.213.4","TCP","54","50692  >  443 [ACK] Seq=203498 Ack=445922 Win=8191 Len=0"
"343","4.526771","192.168.1.166","23.39.213.4","TLSv1.2","5714","Application Data"
"344","4.526812","192.168.1.166","23.39.213.4","TLSv1.2","1532","Application Data"
"345","4.526898","23.39.213.4","192.168.1.166","TCP","7354","443  >  50692 [ACK] Seq=445922 Ack=196668 Win=9949 Len=7300 [TCP PDU reassembled in 346]"
"346","4.526898","23.39.213.4","192.168.1.166","TLSv1.2","838","Application Data"
"347","4.526924","192.168.1.166","23.39.213.4","TCP","54","50692  >  443 [ACK] Seq=210636 Ack=454006 Win=8191 Len=0"
"348","4.538145","23.39.213.4","192.168.1.166","TCP","54","443  >  50692 [ACK] Seq=454006 Ack=198128 Win=9945 Len=0"
"349","4.538145","23.39.213.4","192.168.1.166","TCP","54","443  >  50692 [ACK] Seq=454006 Ack=199588 Win=9937 Len=0"
"350","4.538145","23.39.213.4","192.168.1.166","TCP","54","443  >  50692 [ACK] Seq=454006 Ack=202327 Win=9923 Len=0"
"351","4.538145","23.39.213.4","192.168.1.166","TCP","54","443  >  50692 [ACK] Seq=454006 Ack=203498 Win=9917 Len=0"
"352","4.542302","192.168.1.166","23.39.213.4","TLSv1.2","5435","Application Data"
"353","4.543875","192.168.1.166","23.39.213.4","TLSv1.2","5436","Application Data"
"354","4.544335","192.168.1.166","23.39.213.4","TLSv1.2","5436","Application Data"
"355","4.544393","192.168.1.166","23.39.213.4","TLSv1.2","5436","Application Data"
"356","4.544439","192.168.1.166","23.39.213.4","TLSv1.2","5436","Application Data"
"357","4.544479","192.168.1.166","23.39.213.4","TLSv1.2","5436","Application Data"
"358","4.544518","192.168.1.166","23.39.213.4","TLSv1.2","5436","Application Data"
"359","4.544563","192.168.1.166","23.39.213.4","TLSv1.2","5408","Application Data"
"360","4.561837","23.39.213.4","192.168.1.166","TCP","16114","443  >  50692 [ACK] Seq=454006 Ack=203498 Win=9917 Len=16060 [TCP PDU reassembled in 361]"
"361","4.561837","23.39.213.4","192.168.1.166","TLSv1.2","400","Application Data"
"362","4.561837","23.39.213.4","192.168.1.166","TLSv1.2","85","Application Data"
"363","4.561881","192.168.1.166","23.39.213.4","TCP","54","50692  >  443 [ACK] Seq=253663 Ack=470443 Win=8191 Len=0"
"364","4.562397","23.39.213.4","192.168.1.166","TCP","54","443  >  50692 [ACK] Seq=470443 Ack=204958 Win=9945 Len=0"
"365","4.562893","23.39.213.4","192.168.1.166","TCP","54","443  >  50692 [ACK] Seq=470443 Ack=206418 Win=9937 Len=0"
"366","4.562893","23.39.213.4","192.168.1.166","TCP","54","443  >  50692 [ACK] Seq=470443 Ack=209158 Win=9923 Len=0"
"367","4.562893","23.39.213.4","192.168.1.166","TCP","54","443  >  50692 [ACK] Seq=470443 Ack=210618 Win=9916 Len=0"
"368","4.562893","23.39.213.4","192.168.1.166","TCP","54","443  >  50692 [ACK] Seq=470443 Ack=210636 Win=9916 Len=0"
"369","4.574389","23.39.213.4","192.168.1.166","TCP","54","443  >  50692 [ACK] Seq=470443 Ack=212096 Win=9906 Len=0"
"370","4.574389","23.39.213.4","192.168.1.166","TCP","54","443  >  50692 [ACK] Seq=470443 Ack=213556 Win=9899 Len=0"
"371","4.574389","23.39.213.4","192.168.1.166","TCP","54","443  >  50692 [ACK] Seq=470443 Ack=216017 Win=9885 Len=0"
"372","4.576617","23.39.213.4","192.168.1.166","TCP","54","443  >  50692 [ACK] Seq=470443 Ack=217477 Win=9878 Len=0"
"373","4.576617","23.39.213.4","192.168.1.166","TCP","54","443  >  50692 [ACK] Seq=470443 Ack=221399 Win=9857 Len=0"
"374","4.576617","23.39.213.4","192.168.1.166","TCP","54","443  >  50692 [ACK] Seq=470443 Ack=222859 Win=9850 Len=0"
"375","4.576617","23.39.213.4","192.168.1.166","TCP","54","443  >  50692 [ACK] Seq=470443 Ack=226781 Win=9829 Len=0"
"376","4.602973","23.39.213.4","192.168.1.166","TCP","7354","443  >  50692 [ACK] Seq=470443 Ack=253663 Win=9686 Len=7300 [TCP PDU reassembled in 377]"
"377","4.602973","23.39.213.4","192.168.1.166","TLSv1.2","59","Application Data"
"378","4.603021","192.168.1.166","23.39.213.4","TCP","54","50692  >  443 [ACK] Seq=253663 Ack=477748 Win=8191 Len=0"
"379","4.626797","23.39.213.4","192.168.1.166","TLSv1.2","361","Application Data"
"380","4.626797","23.39.213.4","192.168.1.166","TLSv1.2","289","Application Data"
"381","4.626817","192.168.1.166","23.39.213.4","TCP","54","50692  >  443 [ACK] Seq=253663 Ack=478290 Win=8189 Len=0"
"382","4.654916","23.39.213.4","192.168.1.166","TCP","16114","443  >  50692 [ACK] Seq=478290 Ack=253663 Win=9949 Len=16060 [TCP PDU reassembled in 383]"
"383","4.654916","23.39.213.4","192.168.1.166","TLSv1.2","400","Application Data"
"384","4.654916","23.39.213.4","192.168.1.166","TLSv1.2","85","Application Data"
"385","4.654916","23.39.213.4","192.168.1.166","TLSv1.2","372","Application Data"
"386","4.654916","23.39.213.4","192.168.1.166","TCP","1514","443  >  50692 [ACK] Seq=495045 Ack=253663 Win=9949 Len=1460 [TCP PDU reassembled in 387]"
"387","4.654916","23.39.213.4","192.168.1.166","TLSv1.2","971","Application Data"
"388","4.654916","23.39.213.4","192.168.1.166","TLSv1.2","11734","Application Data"
"389","4.654916","23.39.213.4","192.168.1.166","TLSv1.2","612","Application Data"
"390","4.654916","23.39.213.4","192.168.1.166","TLSv1.2","30714","Application Data, Application Data, Application Data, Application Data, Application Data, Application Data, Application Data"
"391","4.654916","23.39.213.4","192.168.1.166","TLSv1.2","713","Application Data"
"392","4.654998","192.168.1.166","23.39.213.4","TCP","54","50692  >  443 [ACK] Seq=253663 Ack=540979 Win=8191 Len=0"
