"No.","Time","Source","Destination","Protocol","Length","Info"
"1","0.000000","192.168.1.166","23.198.241.2","TLSv1.2","5224","Application Data"
"2","0.000032","192.168.1.166","23.198.241.2","TLSv1.2","93","Application Data"
"3","0.000086","192.168.1.166","23.198.241.2","TLSv1.2","5069","Application Data"
"4","0.000149","192.168.1.166","23.198.241.2","TLSv1.2","5073","Application Data"
"5","0.000170","192.168.1.166","23.198.241.2","TLSv1.2","770","Application Data"
"6","0.000188","192.168.1.166","23.198.241.2","TLSv1.2","508","Application Data"
"7","0.029469","23.198.241.2","192.168.1.166","TCP","54","443  >  58685 [ACK] Seq=1 Ack=4381 Win=9747 Len=0"
"8","0.029469","23.198.241.2","192.168.1.166","TCP","54","443  >  58685 [ACK] Seq=1 Ack=5210 Win=9770 Len=0"
"9","0.030112","23.198.241.2","192.168.1.166","TCP","54","443  >  58685 [ACK] Seq=1 Ack=15244 Win=9716 Len=0"
"10","0.030112","23.198.241.2","192.168.1.166","TLSv1.2","93","Application Data"
"11","0.037283","23.198.241.2","192.168.1.166","TCP","54","443  >  58685 [ACK] Seq=40 Ack=16414 Win=9770 Len=0"
"12","0.079870","192.168.1.166","23.198.241.2","TCP","54","58685  >  443 [ACK] Seq=16414 Ack=40 Win=8191 Len=0"
"13","0.080014","23.198.241.2","192.168.1.166","TLSv1.2","355","Application Data"
"14","0.080014","23.198.241.2","192.168.1.166","TLSv1.2","121","Application Data"
"15","0.080028","192.168.1.166","23.198.241.2","TCP","54","58685  >  443 [ACK] Seq=16414 Ack=408 Win=8190 Len=0"
"16","0.080388","192.168.1.166","23.198.241.2","TLSv1.2","89","Application Data"
"17","0.086859","23.198.241.2","192.168.1.166","TLSv1.2","491","Application Data"
"18","0.086859","23.198.241.2","192.168.1.166","TLSv1.2","759","Application Data"
"19","0.086882","192.168.1.166","23.198.241.2","TCP","54","58685  >  443 [ACK] Seq=16449 Ack=1550 Win=8191 Len=0"
"20","0.159838","23.198.241.2","192.168.1.166","TCP","54","443  >  58685 [ACK] Seq=1550 Ack=16449 Win=9770 Len=0"
"21","1.668818","23.198.241.2","192.168.1.166","TCP","1514","443  >  58685 [ACK] Seq=1550 Ack=16449 Win=9770 Len=1460 [TCP PDU reassembled in 22]"
"22","1.668818","23.198.241.2","192.168.1.166","TLSv1.2","474","Application Data"
"23","1.668818","23.198.241.2","192.168.1.166","TCP","16114","443  >  58685 [ACK] Seq=3430 Ack=16449 Win=9770 Len=16060 [TCP PDU reassembled in 24]"
"24","1.668818","23.198.241.2","192.168.1.166","TLSv1.2","400","Application Data"
"25","1.668818","23.198.241.2","192.168.1.166","TLSv1.2","16114","Application Data"
"26","1.668818","23.198.241.2","192.168.1.166","TLSv1.2","431","Application Data"
"27","1.668818","23.198.241.2","192.168.1.166","TLSv1.2","4434","Application Data"
"28","1.668818","23.198.241.2","192.168.1.166","TLSv1.2","975","Application Data"
"29","1.668818","23.198.241.2","192.168.1.166","TCP","5894","443  >  58685 [ACK] Seq=41574 Ack=16449 Win=9770 Len=5840 [TCP PDU reassembled in 32]"
"30","1.668876","192.168.1.166","23.198.241.2","TCP","54","58685  >  443 [ACK] Seq=16449 Ack=47414 Win=8191 Len=0"
"31","1.669124","23.198.241.2","192.168.1.166","TCP","2974","443  >  58685 [ACK] Seq=47414 Ack=16449 Win=9770 Len=2920 [TCP PDU reassembled in 32]"
"32","1.669124","23.198.241.2","192.168.1.166","TLSv1.2","279","Application Data"
"33","1.669137","192.168.1.166","23.198.241.2","TCP","54","58685  >  443 [ACK] Seq=16449 Ack=50559 Win=8191 Len=0"
"34","1.671558","23.198.241.2","192.168.1.166","TCP","1514","443  >  58685 [ACK] Seq=50559 Ack=16449 Win=9770 Len=1460 [TCP PDU reassembled in 45]"
"35","1.671558","23.198.241.2","192.168.1.166","TCP","1514","443  >  58685 [ACK] Seq=52019 Ack=16449 Win=9770 Len=1460 [TCP PDU reassembled in 45]"
"36","1.671558","23.198.241.2","192.168.1.166","TCP","1514","443  >  58685 [ACK] Seq=53479 Ack=16449 Win=9770 Len=1460 [TCP PDU reassembled in 45]"
"37","1.671558","23.198.241.2","192.168.1.166","TCP","1514","443  >  58685 [ACK] Seq=54939 Ack=16449 Win=9770 Len=1460 [TCP PDU reassembled in 45]"
"38","1.671558","23.198.241.2","192.168.1.166","TCP","1514","443  >  58685 [ACK] Seq=56399 Ack=16449 Win=9770 Len=1460 [TCP PDU reassembled in 45]"
"39","1.671558","23.198.241.2","192.168.1.166","TCP","1514","443  >  58685 [ACK] Seq=57859 Ack=16449 Win=9770 Len=1460 [TCP PDU reassembled in 45]"
"40","1.671558","23.198.241.2","192.168.1.166","TCP","1514","443  >  58685 [ACK] Seq=59319 Ack=16449 Win=9770 Len=1460 [TCP PDU reassembled in 45]"
"41","1.671558","23.198.241.2","192.168.1.166","TCP","1514","443  >  58685 [ACK] Seq=60779 Ack=16449 Win=9770 Len=1460 [TCP PDU reassembled in 45]"
"42","1.671558","23.198.241.2","192.168.1.166","TCP","1514","443  >  58685 [ACK] Seq=62239 Ack=16449 Win=9770 Len=1460 [TCP PDU reassembled in 45]"
"43","1.671558","23.198.241.2","192.168.1.166","TCP","1514","443  >  58685 [ACK] Seq=63699 Ack=16449 Win=9770 Len=1460 [TCP PDU reassembled in 45]"
"44","1.671558","23.198.241.2","192.168.1.166","TCP","1514","443  >  58685 [ACK] Seq=65159 Ack=16449 Win=9770 Len=1460 [TCP PDU reassembled in 45]"
"45","1.671558","23.198.241.2","192.168.1.166","TLSv1.2","400","Application Data"
"46","1.671558","23.198.241.2","192.168.1.166","TLSv1.2","85","Application Data"
"47","1.671558","23.198.241.2","192.168.1.166","TCP","4434","443  >  58685 [ACK] Seq=66996 Ack=16449 Win=9770 Len=4380 [TCP PDU reassembled in 48]"
"48","1.671558","23.198.241.2","192.168.1.166","TLSv1.2","1013","Application Data"
"49","1.671613","192.168.1.166","23.198.241.2","TCP","54","58685  >  443 [ACK] Seq=16449 Ack=72335 Win=8191 Len=0"
"50","1.676005","192.168.1.166","23.198.241.2","TLSv1.2","5363","Application Data"
"51","1.676042","192.168.1.166","23.198.241.2","TLSv1.2","1710","Application Data"
"52","1.678826","23.198.241.2","192.168.1.166","TCP","16114","443  >  58685 [ACK] Seq=72335 Ack=16449 Win=9770 Len=16060 [TCP PDU reassembled in 53]"
"53","1.678826","23.198.241.2","192.168.1.166","TLSv1.2","400","Application Data"
"54","1.678826","23.198.241.2","192.168.1.166","TLSv1.2","85","Application Data"
"55","1.678826","23.198.241.2","192.168.1.166","TCP","5894","443  >  58685 [ACK] Seq=88772 Ack=16449 Win=9770 Len=5840 [TCP PDU reassembled in 56]"
"56","1.678826","23.198.241.2","192.168.1.166","TLSv1.2","1350","Application Data"
"57","1.678826","23.198.241.2","192.168.1.166","TCP","16114","443  >  58685 [ACK] Seq=95908 Ack=16449 Win=9770 Len=16060 [TCP PDU reassembled in 58]"
"58","1.678826","23.198.241.2","192.168.1.166","TLSv1.2","400","Application Data"
"59","1.678826","23.198.241.2","192.168.1.166","TLSv1.2","85","Application Data"
"60","1.678826","23.198.241.2","192.168.1.166","TCP","7354","443  >  58685 [ACK] Seq=112345 Ack=16449 Win=9770 Len=7300 [TCP PDU reassembled in 61]"
"61","1.678826","23.198.241.2","192.168.1.166","TLSv1.2","568","Application Data"
"62","1.678892","192.168.1.166","23.198.241.2","TCP","54","58685  >  443 [ACK] Seq=23414 Ack=120159 Win=8191 Len=0"
"63","1.679957","23.198.241.2","192.168.1.166","TCP","16114","443  >  58685 [ACK] Seq=120159 Ack=16449 Win=9770 Len=16060 [TCP PDU reassembled in 64]"
"64","1.679957","23.198.241.2","192.168.1.166","TLSv1.2","400","Application Data"
"65","1.679957","23.198.241.2","192.168.1.166","TLSv1.2","85","Application Data"
"66","1.679957","23.198.241.2","192.168.1.166","TCP","2974","443  >  58685 [ACK] Seq=136596 Ack=16449 Win=9770 Len=2920 [TCP PDU reassembled in 67]"
"67","1.679957","23.198.241.2","192.168.1.166","TLSv1.2","1173","Application Data"
"68","1.679957","23.198.241.2","192.168.1.166","TLSv1.2","85","Application Data"
"69","1.679992","192.168.1.166","23.198.241.2","TCP","54","58685  >  443 [ACK] Seq=23414 Ack=140666 Win=8191 Len=0"
"70","1.708432","192.168.1.166","23.198.241.2","TLSv1.2","548","Application Data"
"71","1.714630","23.198.241.2","192.168.1.166","TCP","54","443  >  58685 [ACK] Seq=140666 Ack=20829 Win=9747 Len=0"
"72","1.714630","23.198.241.2","192.168.1.166","TCP","54","443  >  58685 [ACK] Seq=140666 Ack=21758 Win=9764 Len=0"
"73","1.714630","23.198.241.2","192.168.1.166","TCP","54","443  >  58685 [ACK] Seq=140666 Ack=23414 Win=9759 Len=0"
"74","1.739579","23.198.241.2","192.168.1.166","TLSv1.2","361","Application Data"
"75","1.739579","23.198.241.2","192.168.1.166","TLSv1.2","289","Application Data"
"76","1.739598","192.168.1.166","23.198.241.2","TCP","54","58685  >  443 [ACK] Seq=23908 Ack=141208 Win=8189 Len=0"
"77","1.750277","23.198.241.2","192.168.1.166","TCP","54","443  >  58685 [ACK] Seq=141208 Ack=23908 Win=9767 Len=0"
"78","1.751990","192.168.1.166","23.198.241.2","TLSv1.2","4818","Application Data"
"79","1.754111","23.198.241.2","192.168.1.166","TLSv1.2","338","Application Data"
"80","1.754111","23.198.241.2","192.168.1.166","TCP","1514","443  >  58685 [ACK] Seq=141492 Ack=23908 Win=9770 Len=1460 [TCP PDU reassembled in 81]"
"81","1.754111","23.198.241.2","192.168.1.166","TLSv1.2","1067","Application Data"
"82","1.754126","192.168.1.166","23.198.241.2","TCP","54","58685  >  443 [ACK] Seq=28672 Ack=143965 Win=8191 Len=0"
"83","1.777927","23.198.241.2","192.168.1.166","TCP","54","443  >  58685 [ACK] Seq=143965 Ack=26828 Win=9754 Len=0"
"84","1.777927","23.198.241.2","192.168.1.166","TCP","54","443  >  58685 [ACK] Seq=143965 Ack=28672 Win=9758 Len=0"
"85","1.782835","192.168.1.166","23.198.241.2","TLSv1.2","5161","Application Data"
"86","1.785206","23.198.241.2","192.168.1.166","TLSv1.2","1095","Application Data"
"87","1.785206","23.198.241.2","192.168.1.166","TCP","5894","443  >  58685 [ACK] Seq=145006 Ack=28672 Win=9770 Len=5840 [TCP PDU reassembled in 90]"
"88","1.785233","192.168.1.166","23.198.241.2","TCP","54","58685  >  443 [ACK] Seq=33779 Ack=150846 Win=8191 Len=0"
"89","1.786788","23.198.241.2","192.168.1.166","TCP","10274","443  >  58685 [ACK] Seq=150846 Ack=28672 Win=9770 Len=10220 [TCP PDU reassembled in 90]"
"90","1.786788","23.198.241.2","192.168.1.166","TLSv1.2","400","Application Data"
"91","1.786788","23.198.241.2","192.168.1.166","TLSv1.2","16114","Application Data"
"92","1.786788","23.198.241.2","192.168.1.166","TLSv1.2","431","Application Data"
"93","1.786788","23.198.241.2","192.168.1.166","TLSv1.2","48234","Application Data, Application Data, Application Data, Application Data, Application Data"
"94","1.786788","23.198.241.2","192.168.1.166","TLSv1.2","1185","Application Data"
"95","1.786843","192.168.1.166","23.198.241.2","TCP","54","58685  >  443 [ACK] Seq=33779 Ack=227160 Win=8191 Len=0"
"96","1.787207","23.198.241.2","192.168.1.166","TLSv1.2","27794","Application Data, Application Data, Application Data"
"97","1.787207","23.198.241.2","192.168.1.166","TLSv1.2","898","Application Data"
"98","1.787229","192.168.1.166","23.198.241.2","TCP","54","58685  >  443 [ACK] Seq=33779 Ack=255744 Win=8191 Len=0"
"99","1.809089","23.198.241.2","192.168.1.166","TCP","54","443  >  58685 [ACK] Seq=255744 Ack=31592 Win=9770 Len=0"
"100","1.809089","23.198.241.2","192.168.1.166","TCP","54","443  >  58685 [ACK] Seq=255744 Ack=33779 Win=9770 Len=0"
"101","1.822202","23.198.241.2","192.168.1.166","TLSv1.2","372","Application Data"
"102","1.822202","23.198.241.2","192.168.1.166","TLSv1.2","85","Application Data"
"103","1.822236","192.168.1.166","23.198.241.2","TCP","54","58685  >  443 [ACK] Seq=33779 Ack=256093 Win=8190 Len=0"
"104","1.829436","192.168.1.166","23.198.241.2","TLSv1.2","577","Application Data"
"105","1.829474","192.168.1.166","23.198.241.2","TLSv1.2","183","Application Data"
"106","1.829502","192.168.1.166","23.198.241.2","TLSv1.2","192","Application Data"
"107","1.863971","23.198.241.2","192.168.1.166","TCP","54","443  >  58685 [ACK] Seq=256093 Ack=34569 Win=9770 Len=0"
"108","1.872132","23.198.241.2","192.168.1.166","TLSv1.2","338","Application Data"
"109","1.872132","23.198.241.2","192.168.1.166","TLSv1.2","515","Application Data"
"110","1.872154","192.168.1.166","23.198.241.2","TCP","54","58685  >  443 [ACK] Seq=34569 Ack=256838 Win=8187 Len=0"
"111","1.876119","23.198.241.2","192.168.1.166","TLSv1.2","316","Application Data"
"112","1.876119","23.198.241.2","192.168.1.166","TLSv1.2","241","Application Data"
"113","1.876135","192.168.1.166","23.198.241.2","TCP","54","58685  >  443 [ACK] Seq=34569 Ack=257287 Win=8191 Len=0"
"114","1.878520","23.198.241.2","192.168.1.166","TLSv1.2","317","Application Data"
"115","1.878520","23.198.241.2","192.168.1.166","TCP","1514","443  >  58685 [ACK] Seq=257550 Ack=34569 Win=9770 Len=1460 [TCP PDU reassembled in 116]"
"116","1.878520","23.198.241.2","192.168.1.166","TLSv1.2","106","Application Data"
"117","1.878540","192.168.1.166","23.198.241.2","TCP","54","58685  >  443 [ACK] Seq=34569 Ack=259062 Win=8191 Len=0"
"118","1.878669","23.198.241.2","192.168.1.166","TCP","1514","443  >  58685 [ACK] Seq=259062 Ack=34569 Win=9770 Len=1460 [TCP PDU reassembled in 119]"
"119","1.878669","23.198.241.2","192.168.1.166","TLSv1.2","118","Application Data"
"120","1.878684","192.168.1.166","23.198.241.2","TCP","54","58685  >  443 [ACK] Seq=34569 Ack=260586 Win=8191 Len=0"
"121","2.058504","192.168.1.166","23.198.241.2","TLSv1.2","192","Application Data"
"122","2.058566","192.168.1.166","23.198.241.2","TLSv1.2","192","Application Data"
"123","2.058583","192.168.1.166","23.198.241.2","TLSv1.2","192","Application Data"
"124","2.058598","192.168.1.166","23.198.241.2","TLSv1.2","192","Application Data"
"125","2.058654","192.168.1.166","23.198.241.2","TLSv1.2","192","Application Data"
"126","2.058678","192.168.1.166","23.198.241.2","TLSv1.2","192","Application Data"
"127","2.094223","23.198.241.2","192.168.1.166","TCP","54","443  >  58685 [ACK] Seq=260586 Ack=35397 Win=9770 Len=0"
"128","2.108945","23.198.241.2","192.168.1.166","TLSv1.2","317","Application Data"
"129","2.108945","23.198.241.2","192.168.1.166","TLSv1.2","1496","Application Data"
"130","2.108945","23.198.241.2","192.168.1.166","TCP","1514","443  >  58685 [ACK] Seq=262291 Ack=35397 Win=9770 Len=1460 [TCP PDU reassembled in 135]"
"131","2.108945","23.198.241.2","192.168.1.166","TCP","1514","443  >  58685 [ACK] Seq=263751 Ack=35397 Win=9770 Len=1460 [TCP PDU reassembled in 135]"
"132","2.108945","23.198.241.2","192.168.1.166","TCP","1514","443  >  58685 [ACK] Seq=265211 Ack=35397 Win=9770 Len=1460 [TCP PDU reassembled in 135]"
"133","2.108945","23.198.241.2","192.168.1.166","TCP","1514","443  >  58685 [ACK] Seq=266671 Ack=35397 Win=9770 Len=1460 [TCP PDU reassembled in 135]"
"134","2.108945","23.198.241.2","192.168.1.166","TCP","1514","443  >  58685 [ACK] Seq=268131 Ack=35397 Win=9770 Len=1460 [TCP PDU reassembled in 135]"
"135","2.108945","23.198.241.2","192.168.1.166","TLSv1.2","1197","Application Data"
"136","2.108997","192.168.1.166","23.198.241.2","TCP","54","58685  >  443 [ACK] Seq=35397 Ack=270734 Win=8191 Len=0"
"137","2.109671","192.168.1.166","23.198.241.2","TLSv1.2","192","Application Data"
"138","2.146464","23.198.241.2","192.168.1.166","TLSv1.2","317","Application Data"
"139","2.147078","23.198.241.2","192.168.1.166","TLSv1.2","1468","Application Data"
"140","2.147078","23.198.241.2","192.168.1.166","TCP","4434","443  >  58685 [ACK] Seq=272411 Ack=35535 Win=9770 Len=4380 [TCP PDU reassembled in 141]"
"141","2.147078","23.198.241.2","192.168.1.166","TLSv1.2","422","Application Data"
"142","2.147103","192.168.1.166","23.198.241.2","TCP","54","58685  >  443 [ACK] Seq=35535 Ack=277159 Win=8191 Len=0"
"143","2.147605","192.168.1.166","23.198.241.2","TLSv1.2","193","Application Data"
"144","2.165975","23.198.241.2","192.168.1.166","TLSv1.2","318","Application Data"
"145","2.165975","23.198.241.2","192.168.1.166","TLSv1.2","1448","Application Data"
"146","2.165975","23.198.241.2","192.168.1.166","TCP","1514","443  >  58685 [ACK] Seq=278817 Ack=35535 Win=9770 Len=1460 [TCP PDU reassembled in 153]"
"147","2.165975","23.198.241.2","192.168.1.166","TCP","1514","443  >  58685 [ACK] Seq=280277 Ack=35535 Win=9770 Len=1460 [TCP PDU reassembled in 153]"
"148","2.165975","23.198.241.2","192.168.1.166","TCP","1514","443  >  58685 [ACK] Seq=281737 Ack=35535 Win=9770 Len=1460 [TCP PDU reassembled in 153]"
"149","2.166017","192.168.1.166","23.198.241.2","TCP","54","58685  >  443 [ACK] Seq=35674 Ack=283197 Win=8191 Len=0"
"150","2.166746","23.198.241.2","192.168.1.166","TCP","1514","443  >  58685 [ACK] Seq=283197 Ack=35535 Win=9770 Len=1460 [TCP PDU reassembled in 153]"
"151","2.166746","23.198.241.2","192.168.1.166","TCP","1514","443  >  58685 [ACK] Seq=284657 Ack=35535 Win=9770 Len=1460 [TCP PDU reassembled in 153]"
"152","2.166746","23.198.241.2","192.168.1.166","TCP","1514","443  >  58685 [ACK] Seq=286117 Ack=35535 Win=9770 Len=1460 [TCP PDU reassembled in 153]"
"153","2.166746","23.198.241.2","192.168.1.166","TLSv1.2","270","Application Data"
"154","2.166772","192.168.1.166","23.198.241.2","TCP","54","58685  >  443 [ACK] Seq=35674 Ack=287793 Win=8191 Len=0"
"155","2.170204","192.168.1.166","23.198.241.2","TLSv1.2","4967","Application Data"
"156","2.170248","192.168.1.166","23.198.241.2","TLSv1.2","588","Application Data"
"157","2.184552","23.198.241.2","192.168.1.166","TLSv1.2","319","Application Data"
"158","2.184552","23.198.241.2","192.168.1.166","TLSv1.2","1441","Application Data"
"159","2.184552","23.198.241.2","192.168.1.166","TCP","1514","443  >  58685 [ACK] Seq=289445 Ack=35535 Win=9770 Len=1460 [TCP PDU reassembled in 167]"
"160","2.184552","23.198.241.2","192.168.1.166","TCP","1514","443  >  58685 [ACK] Seq=290905 Ack=35535 Win=9770 Len=1460 [TCP PDU reassembled in 167]"
"161","2.184552","23.198.241.2","192.168.1.166","TCP","1514","443  >  58685 [ACK] Seq=292365 Ack=35535 Win=9770 Len=1460 [TCP PDU reassembled in 167]"
"162","2.184590","192.168.1.166","23.198.241.2","TCP","54","58685  >  443 [ACK] Seq=41121 Ack=293825 Win=8191 Len=0"
"163","2.194793","23.198.241.2","192.168.1.166","TCP","1514","443  >  58685 [ACK] Seq=293825 Ack=35535 Win=9770 Len=1460 [TCP PDU reassembled in 167]"
"164","2.194793","23.198.241.2","192.168.1.166","TCP","1514","443  >  58685 [ACK] Seq=295285 Ack=35535 Win=9770 Len=1460 [TCP PDU reassembled in 167]"
"165","2.194793","23.198.241.2","192.168.1.166","TCP","1514","443  >  58685 [ACK] Seq=296745 Ack=35535 Win=9770 Len=1460 [TCP PDU reassembled in 167]"
"166","2.194793","23.198.241.2","192.168.1.166","TCP","1514","443  >  58685 [ACK] Seq=298205 Ack=35535 Win=9770 Len=1460 [TCP PDU reassembled in 167]"
"167","2.194793","23.198.241.2","192.168.1.166","TLSv1.2","1179","Application Data"
"168","2.194793","23.198.241.2","192.168.1.166","TLSv1.2","317","Application Data"
"169","2.194793","23.198.241.2","192.168.1.166","TLSv1.2","1442","Application Data"
"170","2.194793","23.198.241.2","192.168.1.166","TCP","8814","443  >  58685 [ACK] Seq=302441 Ack=35674 Win=9770 Len=8760 [TCP PDU reassembled in 171]"
"171","2.194793","23.198.241.2","192.168.1.166","TLSv1.2","1154","Application Data"
"172","2.194793","23.198.241.2","192.168.1.166","TLSv1.2","317","Application Data"
"173","2.194793","23.198.241.2","192.168.1.166","TLSv1.2","1361","Application Data"
"174","2.194793","23.198.241.2","192.168.1.166","TCP","1514","443  >  58685 [ACK] Seq=313871 Ack=35674 Win=9770 Len=1460 [TCP PDU reassembled in 178]"
"175","2.194793","23.198.241.2","192.168.1.166","TCP","1514","443  >  58685 [ACK] Seq=315331 Ack=35674 Win=9770 Len=1460 [TCP PDU reassembled in 178]"
"176","2.194793","23.198.241.2","192.168.1.166","TCP","1514","443  >  58685 [ACK] Seq=316791 Ack=35674 Win=9770 Len=1460 [TCP PDU reassembled in 178]"
"177","2.194793","23.198.241.2","192.168.1.166","TCP","1514","443  >  58685 [ACK] Seq=318251 Ack=35674 Win=9770 Len=1460 [TCP PDU reassembled in 178]"
"178","2.194793","23.198.241.2","192.168.1.166","TLSv1.2","387","Application Data"
"179","2.194793","23.198.241.2","192.168.1.166","TLSv1.2","317","Application Data"
"180","2.194793","23.198.241.2","192.168.1.166","TLSv1.2","1449","Application Data"
"181","2.194793","23.198.241.2","192.168.1.166","TCP","1514","443  >  58685 [ACK] Seq=321702 Ack=35674 Win=9770 Len=1460 [TCP PDU reassembled in 184]"
"182","2.194793","23.198.241.2","192.168.1.166","TCP","1514","443  >  58685 [ACK] Seq=323162 Ack=35674 Win=9770 Len=1460 [TCP PDU reassembled in 184]"
"183","2.194793","23.198.241.2","192.168.1.166","TCP","2974","443  >  58685 [ACK] Seq=324622 Ack=35674 Win=9770 Len=2920 [TCP PDU reassembled in 184]"
"184","2.194793","23.198.241.2","192.168.1.166","TLSv1.2","972","Application Data"
"185","2.194793","23.198.241.2","192.168.1.166","TLSv1.2","317","Application Data"
"186","2.194793","23.198.241.2","192.168.1.166","TLSv1.2","1450","Application Data"
"187","2.194793","23.198.241.2","192.168.1.166","TCP","7354","443  >  58685 [ACK] Seq=330119 Ack=35674 Win=9770 Len=7300 [TCP PDU reassembled in 188]"
"188","2.194793","23.198.241.2","192.168.1.166","TLSv1.2","92","Application Data"
"189","2.194896","192.168.1.166","23.198.241.2","TCP","54","58685  >  443 [ACK] Seq=41121 Ack=337457 Win=8191 Len=0"
"190","2.223021","23.198.241.2","192.168.1.166","TCP","54","443  >  58685 [ACK] Seq=337457 Ack=40587 Win=9770 Len=0"
"191","2.251905","192.168.1.166","23.198.241.2","TLSv1.2","5216","Application Data"
"192","2.251966","192.168.1.166","23.198.241.2","TLSv1.2","3609","Application Data"
"193","2.265583","23.198.241.2","192.168.1.166","TCP","54","443  >  58685 [ACK] Seq=337457 Ack=41121 Win=9770 Len=0"
"194","2.278391","23.198.241.2","192.168.1.166","TCP","54","443  >  58685 [ACK] Seq=337457 Ack=42581 Win=9762 Len=0"
"195","2.278391","23.198.241.2","192.168.1.166","TCP","54","443  >  58685 [ACK] Seq=337457 Ack=46283 Win=9749 Len=0"
"196","2.278391","23.198.241.2","192.168.1.166","TCP","54","443  >  58685 [ACK] Seq=337457 Ack=49203 Win=9754 Len=0"
"197","2.286215","192.168.1.166","23.198.241.2","TLSv1.2","5215","Application Data"
"198","2.286282","192.168.1.166","23.198.241.2","TLSv1.2","685","Application Data"
"199","2.287974","23.198.241.2","192.168.1.166","TCP","54","443  >  58685 [ACK] Seq=337457 Ack=49838 Win=9770 Len=0"
"200","2.300274","23.198.241.2","192.168.1.166","TLSv1.2","479","Application Data"
"201","2.300274","23.198.241.2","192.168.1.166","TLSv1.2","828","Application Data"
"202","2.300310","192.168.1.166","23.198.241.2","TCP","54","58685  >  443 [ACK] Seq=55630 Ack=338656 Win=8187 Len=0"
"203","2.314544","23.198.241.2","192.168.1.166","TCP","54","443  >  58685 [ACK] Seq=338656 Ack=54999 Win=9770 Len=0"
"204","2.324410","23.198.241.2","192.168.1.166","TCP","54","443  >  58685 [ACK] Seq=338656 Ack=55630 Win=9770 Len=0"
"205","2.384835","23.198.241.2","192.168.1.166","TLSv1.2","492","Application Data"
"206","2.384835","23.198.241.2","192.168.1.166","TLSv1.2","173","Application Data"
"207","2.384868","192.168.1.166","23.198.241.2","TCP","54","58685  >  443 [ACK] Seq=55630 Ack=339213 Win=8191 Len=0"
"208","2.396139","192.168.1.166","23.198.241.2","TLSv1.2","570","Application Data"
"209","2.396209","192.168.1.166","23.198.241.2","TLSv1.2","191","Application Data"
"210","2.396233","192.168.1.166","23.198.241.2","TLSv1.2","191","Application Data"
"211","2.396417","192.168.1.166","23.198.241.2","TLSv1.2","191","Application Data"
"212","2.396450","192.168.1.166","23.198.241.2","TLSv1.2","191","Application Data"
"213","2.396484","192.168.1.166","23.198.241.2","TLSv1.2","192","Application Data"
"214","2.410981","192.168.1.166","23.198.241.2","TLSv1.2","90","Application Data"
"215","2.411041","192.168.1.166","23.198.241.2","TLSv1.2","90","Application Data"
"216","2.411091","192.168.1.166","23.198.241.2","TLSv1.2","90","Application Data"
"217","2.411109","192.168.1.166","23.198.241.2","TLSv1.2","90","Application Data"
"218","2.411125","192.168.1.166","23.198.241.2","TLSv1.2","90","Application Data"
"219","2.411142","192.168.1.166","23.198.241.2","TLSv1.2","90","Application Data"
"220","2.417229","192.168.1.166","23.198.241.2","TLSv1.2","4849","Application Data"
"221","2.417283","192.168.1.166","23.198.241.2","TLSv1.2","391","Application Data"
"222","2.419776","192.168.1.166","23.198.241.2","TLSv1.2","5216","Application Data"
"223","2.419823","192.168.1.166","23.198.241.2","TLSv1.2","3223","Application Data"
"224","2.422303","23.198.241.2","192.168.1.166","TCP","54","443  >  58685 [ACK] Seq=339213 Ack=56283 Win=9770 Len=0"
"225","2.422303","23.198.241.2","192.168.1.166","TCP","54","443  >  58685 [ACK] Seq=339213 Ack=56832 Win=9770 Len=0"
"226","2.436797","23.198.241.2","192.168.1.166","TLSv1.2","317","Application Data"
"227","2.436797","23.198.241.2","192.168.1.166","TLSv1.2","1465","Application Data"
"228","2.436797","23.198.241.2","192.168.1.166","TCP","4434","443  >  58685 [ACK] Seq=340887 Ack=56832 Win=9770 Len=4380 [TCP PDU reassembled in 229]"
"229","2.436797","23.198.241.2","192.168.1.166","TLSv1.2","393","Application Data"
"230","2.436836","192.168.1.166","23.198.241.2","TCP","54","58685  >  443 [ACK] Seq=70511 Ack=345606 Win=8191 Len=0"
"231","2.437370","23.198.241.2","192.168.1.166","TCP","54","443  >  58685 [ACK] Seq=345606 Ack=57048 Win=9770 Len=0"
"232","2.438649","23.198.241.2","192.168.1.166","TLSv1.2","317","Application Data"
"233","2.438649","23.198.241.2","192.168.1.166","TLSv1.2","1466","Application Data"
"234","2.438649","23.198.241.2","192.168.1.166","TLSv1.2","1026","Application Data"
"235","2.438663","192.168.1.166","23.198.241.2","TCP","54","58685  >  443 [ACK] Seq=70511 Ack=348253 Win=8191 Len=0"
"236","2.444993","23.198.241.2","192.168.1.166","TCP","54","443  >  58685 [ACK] Seq=348253 Ack=61428 Win=9770 Len=0"
"237","2.444993","23.198.241.2","192.168.1.166","TCP","54","443  >  58685 [ACK] Seq=348253 Ack=62180 Win=9770 Len=0"
"238","2.446751","23.198.241.2","192.168.1.166","TCP","54","443  >  58685 [ACK] Seq=348253 Ack=66560 Win=9770 Len=0"
"239","2.446751","23.198.241.2","192.168.1.166","TCP","54","443  >  58685 [ACK] Seq=348253 Ack=70511 Win=9746 Len=0"
"240","2.463191","192.168.1.166","23.198.241.2","TLSv1.2","5105","Application Data"
"241","2.463719","192.168.1.166","23.198.241.2","TLSv1.2","5098","Application Data"
"242","2.465995","192.168.1.166","23.198.241.2","TLSv1.2","5122","Application Data"
"243","2.467836","23.198.241.2","192.168.1.166","TLSv1.2","494","Application Data"
"244","2.467836","23.198.241.2","192.168.1.166","TLSv1.2","1505","Application Data"
"245","2.467836","23.198.241.2","192.168.1.166","TCP","1514","443  >  58685 [ACK] Seq=350144 Ack=70511 Win=9770 Len=1460 [TCP PDU reassembled in 246]"
"246","2.467836","23.198.241.2","192.168.1.166","TLSv1.2","1490","Application Data"
"247","2.467862","192.168.1.166","23.198.241.2","TCP","54","58685  >  443 [ACK] Seq=85674 Ack=353040 Win=8191 Len=0"
"248","2.489541","23.198.241.2","192.168.1.166","TCP","54","443  >  58685 [ACK] Seq=353040 Ack=75562 Win=9770 Len=0"
"249","2.489541","23.198.241.2","192.168.1.166","TCP","54","443  >  58685 [ACK] Seq=353040 Ack=80606 Win=9742 Len=0"
"250","2.498134","23.198.241.2","192.168.1.166","TCP","54","443  >  58685 [ACK] Seq=353040 Ack=83526 Win=9754 Len=0"
"251","2.507102","23.198.241.2","192.168.1.166","TCP","54","443  >  58685 [ACK] Seq=353040 Ack=85674 Win=9742 Len=0"
"252","2.520845","23.198.241.2","192.168.1.166","TLSv1.2","317","Application Data"
"253","2.520845","23.198.241.2","192.168.1.166","TLSv1.2","223","Application Data"
"254","2.520845","23.198.241.2","192.168.1.166","TLSv1.2","315","Application Data"
"255","2.520845","23.198.241.2","192.168.1.166","TLSv1.2","217","Application Data"
"256","2.520869","192.168.1.166","23.198.241.2","TCP","54","58685  >  443 [ACK] Seq=85674 Ack=353896 Win=8188 Len=0"
"257","2.526175","23.198.241.2","192.168.1.166","TLSv1.2","316","Application Data"
"258","2.526175","23.198.241.2","192.168.1.166","TLSv1.2","421","Application Data"
"259","2.526190","192.168.1.166","23.198.241.2","TCP","54","58685  >  443 [ACK] Seq=85674 Ack=354525 Win=8191 Len=0"
"260","2.529389","23.198.241.2","192.168.1.166","TLSv1.2","317","Application Data"
"261","2.529389","23.198.241.2","192.168.1.166","TLSv1.2","389","Application Data"
"262","2.529401","192.168.1.166","23.198.241.2","TCP","54","58685  >  443 [ACK] Seq=85674 Ack=355123 Win=8189 Len=0"
"263","2.543516","23.198.241.2","192.168.1.166","TLSv1.2","491","Application Data"
"264","2.543516","23.198.241.2","192.168.1.166","TCP","1514","443  >  58685 [ACK] Seq=355560 Ack=85674 Win=9770 Len=1460 [TCP PDU reassembled in 265]"
"265","2.543516","23.198.241.2","192.168.1.166","TLSv1.2","73","Application Data"
"266","2.543537","192.168.1.166","23.198.241.2","TCP","54","58685  >  443 [ACK] Seq=85674 Ack=357039 Win=8191 Len=0"
"267","2.549890","23.198.241.2","192.168.1.166","TLSv1.2","490","Application Data"
"268","2.549890","23.198.241.2","192.168.1.166","TLSv1.2","448","Application Data"
"269","2.549890","23.198.241.2","192.168.1.166","TLSv1.2","491","Application Data"
"270","2.549890","23.198.241.2","192.168.1.166","TLSv1.2","639","Application Data"
"271","2.549929","192.168.1.166","23.198.241.2","TCP","54","58685  >  443 [ACK] Seq=85674 Ack=358891 Win=8191 Len=0"
"272","2.572180","23.198.241.2","192.168.1.166","TLSv1.2","494","Application Data"
"273","2.572180","23.198.241.2","192.168.1.166","TLSv1.2","1505","Application Data"
"274","2.572180","23.198.241.2","192.168.1.166","TCP","1514","443  >  58685 [ACK] Seq=360782 Ack=85674 Win=9770 Len=1460 [TCP PDU reassembled in 280]"
"275","2.572180","23.198.241.2","192.168.1.166","TCP","1514","443  >  58685 [ACK] Seq=362242 Ack=85674 Win=9770 Len=1460 [TCP PDU reassembled in 280]"
"276","2.572180","23.198.241.2","192.168.1.166","TCP","1514","443  >  58685 [ACK] Seq=363702 Ack=85674 Win=9770 Len=1460 [TCP PDU reassembled in 280]"
"277","2.572180","23.198.241.2","192.168.1.166","TCP","1514","443  >  58685 [ACK] Seq=365162 Ack=85674 Win=9770 Len=1460 [TCP PDU reassembled in 280]"
"278","2.572180","23.198.241.2","192.168.1.166","TCP","1514","443  >  58685 [ACK] Seq=366622 Ack=85674 Win=9770 Len=1460 [TCP PDU reassembled in 280]"
"279","2.572180","23.198.241.2","192.168.1.166","TCP","1514","443  >  58685 [ACK] Seq=368082 Ack=85674 Win=9770 Len=1460 [TCP PDU reassembled in 280]"
"280","2.572180","23.198.241.2","192.168.1.166","TLSv1.2","414","Application Data"
"281","2.572236","192.168.1.166","23.198.241.2","TCP","54","58685  >  443 [ACK] Seq=85674 Ack=369902 Win=8191 Len=0"
"282","2.588518","192.168.1.166","23.198.241.2","TLSv1.2","5097","Application Data"
"283","2.588586","192.168.1.166","23.198.241.2","TLSv1.2","317","Application Data"
"284","2.615832","23.198.241.2","192.168.1.166","TCP","54","443  >  58685 [ACK] Seq=369902 Ack=90980 Win=9747 Len=0"
"285","2.623472","23.198.241.2","192.168.1.166","TLSv1.2","494","Application Data"
"286","2.623472","23.198.241.2","192.168.1.166","TLSv1.2","1162","Application Data"
"287","2.623502","192.168.1.166","23.198.241.2","TCP","54","58685  >  443 [ACK] Seq=90980 Ack=371450 Win=8191 Len=0"
"288","2.639943","192.168.1.166","23.198.241.2","TLSv1.2","5216","Application Data"
"289","2.639978","192.168.1.166","23.198.241.2","TLSv1.2","411","Application Data"
"290","2.640689","192.168.1.166","23.198.241.2","TLSv1.2","5216","Application Data"
"291","2.640729","192.168.1.166","23.198.241.2","TLSv1.2","2030","Application Data"
"292","2.665073","23.198.241.2","192.168.1.166","TCP","54","443  >  58685 [ACK] Seq=371450 Ack=93900 Win=9754 Len=0"
"293","2.665073","23.198.241.2","192.168.1.166","TCP","54","443  >  58685 [ACK] Seq=371450 Ack=96142 Win=9757 Len=0"
"294","2.667300","23.198.241.2","192.168.1.166","TCP","54","443  >  58685 [ACK] Seq=371450 Ack=97959 Win=9758 Len=0"
"295","2.674346","23.198.241.2","192.168.1.166","TCP","54","443  >  58685 [ACK] Seq=371450 Ack=103637 Win=9727 Len=0"
"296","2.684896","23.198.241.2","192.168.1.166","TLSv1.2","494","Application Data"
"297","2.684896","23.198.241.2","192.168.1.166","TLSv1.2","244","Application Data"
"298","2.684926","192.168.1.166","23.198.241.2","TCP","54","58685  >  443 [ACK] Seq=103637 Ack=372080 Win=8189 Len=0"
"299","2.738358","23.198.241.2","192.168.1.166","TLSv1.2","494","Application Data"
"300","2.738358","23.198.241.2","192.168.1.166","TLSv1.2","331","Application Data"
"301","2.738390","192.168.1.166","23.198.241.2","TCP","54","58685  >  443 [ACK] Seq=103637 Ack=372797 Win=8186 Len=0"
"302","2.756449","23.198.241.2","192.168.1.166","TLSv1.2","493","Application Data"
"303","2.756449","23.198.241.2","192.168.1.166","TLSv1.2","1507","Application Data"
"304","2.756449","23.198.241.2","192.168.1.166","TLSv1.2","1037","Application Data"
"305","2.756472","192.168.1.166","23.198.241.2","TCP","54","58685  >  443 [ACK] Seq=103637 Ack=375672 Win=8191 Len=0"
"306","2.766202","192.168.1.166","23.198.241.2","TLSv1.2","5112","Application Data"
"307","2.777378","192.168.1.166","23.198.241.2","TLSv1.2","572","Application Data"
"308","2.777437","192.168.1.166","23.198.241.2","TLSv1.2","177","Application Data"
"309","2.777460","192.168.1.166","23.198.241.2","TLSv1.2","177","Application Data"
"310","2.777476","192.168.1.166","23.198.241.2","TLSv1.2","176","Application Data"
"311","2.790238","192.168.1.166","23.198.241.2","TLSv1.2","4966","Application Data"
"312","2.790330","192.168.1.166","23.198.241.2","TLSv1.2","5216","Application Data"
"313","2.790351","192.168.1.166","23.198.241.2","TLSv1.2","487","Application Data"
"314","2.790363","192.168.1.166","23.198.241.2","TLSv1.2","382","Application Data"
"315","2.791672","23.198.241.2","192.168.1.166","TCP","54","443  >  58685 [ACK] Seq=375672 Ack=106557 Win=9754 Len=0"
"316","2.791672","23.198.241.2","192.168.1.166","TCP","54","443  >  58685 [ACK] Seq=375672 Ack=108695 Win=9757 Len=0"
"317","2.809528","23.198.241.2","192.168.1.166","TCP","54","443  >  58685 [ACK] Seq=375672 Ack=109336 Win=9770 Len=0"
"318","2.823288","23.198.241.2","192.168.1.166","TCP","54","443  >  58685 [ACK] Seq=375672 Ack=120416 Win=9704 Len=0"
"319","2.837311","23.198.241.2","192.168.1.166","TLSv1.2","316","Application Data"
"320","2.837311","23.198.241.2","192.168.1.166","TLSv1.2","387","Application Data"
"321","2.837311","23.198.241.2","192.168.1.166","TLSv1.2","866","Application Data, Application Data"
"322","2.837363","192.168.1.166","23.198.241.2","TCP","54","58685  >  443 [ACK] Seq=120416 Ack=377079 Win=8186 Len=0"
"323","2.850770","23.198.241.2","192.168.1.166","TLSv1.2","491","Application Data"
"324","2.850770","23.198.241.2","192.168.1.166","TCP","1514","443  >  58685 [ACK] Seq=377516 Ack=120416 Win=9770 Len=1460 [TCP PDU reassembled in 325]"
"325","2.850770","23.198.241.2","192.168.1.166","TLSv1.2","526","Application Data"
"326","2.850786","192.168.1.166","23.198.241.2","TCP","54","58685  >  443 [ACK] Seq=120416 Ack=379448 Win=8191 Len=0"
"327","2.852681","192.168.1.166","23.198.241.2","TLSv1.2","5173","Application Data"
"328","2.852713","192.168.1.166","23.198.241.2","TLSv1.2","165","Application Data"
"329","2.858413","192.168.1.166","23.198.241.2","TLSv1.2","5216","Application Data"
"330","2.858459","192.168.1.166","23.198.241.2","TLSv1.2","898","Application Data"
"331","2.879855","23.198.241.2","192.168.1.166","TLSv1.2","493","Application Data"
"332","2.879855","23.198.241.2","192.168.1.166","TLSv1.2","1507","Application Data"
"333","2.879855","23.198.241.2","192.168.1.166","TLSv1.2","893","Application Data"
"334","2.879901","192.168.1.166","23.198.241.2","TCP","54","58685  >  443 [ACK] Seq=131652 Ack=382179 Win=8191 Len=0"
"335","2.887241","23.198.241.2","192.168.1.166","TLSv1.2","317","Application Data"
"336","2.887241","23.198.241.2","192.168.1.166","TLSv1.2","557","Application Data"
"337","2.887271","192.168.1.166","23.198.241.2","TCP","54","58685  >  443 [ACK] Seq=131652 Ack=382945 Win=8188 Len=0"
"338","2.887569","192.168.1.166","23.198.241.2","TLSv1.2","5216","Application Data"
"339","2.887607","192.168.1.166","23.198.241.2","TLSv1.2","710","Application Data"
"340","2.890952","23.198.241.2","192.168.1.166","TLSv1.2","317","Application Data"
"341","2.890952","23.198.241.2","192.168.1.166","TLSv1.2","703","Application Data"
"342","2.890976","192.168.1.166","23.198.241.2","TCP","54","58685  >  443 [ACK] Seq=137470 Ack=383857 Win=8191 Len=0"
"343","2.899068","23.198.241.2","192.168.1.166","TCP","54","443  >  58685 [ACK] Seq=383857 Ack=130808 Win=9713 Len=0"
"344","2.918458","23.198.241.2","192.168.1.166","TCP","54","443  >  58685 [ACK] Seq=383857 Ack=133112 Win=9762 Len=0"
"345","2.918458","23.198.241.2","192.168.1.166","TCP","54","443  >  58685 [ACK] Seq=383857 Ack=136814 Win=9770 Len=0"
"346","2.918783","192.168.1.166","23.198.241.2","TLSv1.2","5214","Application Data"
"347","2.918841","192.168.1.166","23.198.241.2","TLSv1.2","1069","Application Data"
"348","2.922527","23.198.241.2","192.168.1.166","TLSv1.2","494","Application Data"
"349","2.922527","23.198.241.2","192.168.1.166","TCP","1514","443  >  58685 [ACK] Seq=384297 Ack=137470 Win=9770 Len=1460 [TCP PDU reassembled in 360]"
"350","2.922527","23.198.241.2","192.168.1.166","TCP","1514","443  >  58685 [ACK] Seq=385757 Ack=137470 Win=9770 Len=1460 [TCP PDU reassembled in 360]"
"351","2.922527","23.198.241.2","192.168.1.166","TCP","1514","443  >  58685 [ACK] Seq=387217 Ack=137470 Win=9770 Len=1460 [TCP PDU reassembled in 360]"
"352","2.922527","23.198.241.2","192.168.1.166","TCP","1514","443  >  58685 [ACK] Seq=388677 Ack=137470 Win=9770 Len=1460 [TCP PDU reassembled in 360]"
"353","2.922527","23.198.241.2","192.168.1.166","TCP","1514","443  >  58685 [ACK] Seq=390137 Ack=137470 Win=9770 Len=1460 [TCP PDU reassembled in 360]"
"354","2.922527","23.198.241.2","192.168.1.166","TCP","1514","443  >  58685 [ACK] Seq=391597 Ack=137470 Win=9770 Len=1460 [TCP PDU reassembled in 360]"
"355","2.922527","23.198.241.2","192.168.1.166","TCP","1514","443  >  58685 [ACK] Seq=393057 Ack=137470 Win=9770 Len=1460 [TCP PDU reassembled in 360]"
"356","2.922527","23.198.241.2","192.168.1.166","TCP","1514","443  >  58685 [ACK] Seq=394517 Ack=137470 Win=9770 Len=1460 [TCP PDU reassembled in 360]"
"357","2.922527","23.198.241.2","192.168.1.166","TCP","1514","443  >  58685 [ACK] Seq=395977 Ack=137470 Win=9770 Len=1460 [TCP PDU reassembled in 360]"
"358","2.922527","23.198.241.2","192.168.1.166","TCP","1514","443  >  58685 [ACK] Seq=397437 Ack=137470 Win=9770 Len=1460 [TCP PDU reassembled in 360]"
"359","2.922527","23.198.241.2","192.168.1.166","TCP","1514","443  >  58685 [ACK] Seq=398897 Ack=137470 Win=9770 Len=1460 [TCP PDU reassembled in 360]"
"360","2.922527","23.198.241.2","192.168.1.166","TLSv1.2","400","Application Data"
"361","2.922527","23.198.241.2","192.168.1.166","TLSv1.2","1514","Application Data"
"362","2.922527","23.198.241.2","192.168.1.166","TCP","1514","443  >  58685 [ACK] Seq=402163 Ack=137470 Win=9770 Len=1460 [TCP PDU reassembled in 370]"
"363","2.922527","23.198.241.2","192.168.1.166","TCP","1514","443  >  58685 [ACK] Seq=403623 Ack=137470 Win=9770 Len=1460 [TCP PDU reassembled in 370]"
"364","2.922527","23.198.241.2","192.168.1.166","TCP","1514","443  >  58685 [ACK] Seq=405083 Ack=137470 Win=9770 Len=1460 [TCP PDU reassembled in 370]"
"365","2.922527","23.198.241.2","192.168.1.166","TCP","1514","443  >  58685 [ACK] Seq=406543 Ack=137470 Win=9770 Len=1460 [TCP PDU reassembled in 370]"
"366","2.922527","23.198.241.2","192.168.1.166","TCP","1514","443  >  58685 [ACK] Seq=408003 Ack=137470 Win=9770 Len=1460 [TCP PDU reassembled in 370]"
"367","2.922527","23.198.241.2","192.168.1.166","TCP","1514","443  >  58685 [ACK] Seq=409463 Ack=137470 Win=9770 Len=1460 [TCP PDU reassembled in 370]"
"368","2.922527","23.198.241.2","192.168.1.166","TCP","1514","443  >  58685 [ACK] Seq=410923 Ack=137470 Win=9770 Len=1460 [TCP PDU reassembled in 370]"
"369","2.922527","23.198.241.2","192.168.1.166","TCP","4434","443  >  58685 [ACK] Seq=412383 Ack=137470 Win=9770 Len=4380 [TCP PDU reassembled in 370]"
"370","2.922527","23.198.241.2","192.168.1.166","TLSv1.2","431","Application Data"
"371","2.922527","23.198.241.2","192.168.1.166","TLSv1.2","439","Application Data, Application Data"
"372","2.922527","23.198.241.2","192.168.1.166","TLSv1.2","246","Application Data"
"373","2.922608","192.168.1.166","23.198.241.2","TCP","54","58685  >  443 [ACK] Seq=143645 Ack=417717 Win=8191 Len=0"
"374","2.944390","23.198.241.2","192.168.1.166","TCP","54","443  >  58685 [ACK] Seq=417717 Ack=140390 Win=9754 Len=0"
