"No.","Time","Source","Destination","Protocol","Length","Info"
"1","0.000000","192.168.1.166","23.39.213.4","TLSv1.2","5374","Application Data"
"2","0.036051","23.39.213.4","192.168.1.166","TCP","54","443  >  50692 [ACK] Seq=1 Ack=2921 Win=9937 Len=0"
"3","0.036051","23.39.213.4","192.168.1.166","TCP","54","443  >  50692 [ACK] Seq=1 Ack=5321 Win=9947 Len=0"
"4","0.137124","23.39.213.4","192.168.1.166","TLSv1.2","477","Application Data"
"5","0.137124","23.39.213.4","192.168.1.166","TLSv1.2","713","Application Data"
"6","0.137154","192.168.1.166","23.39.213.4","TCP","54","50692  >  443 [ACK] Seq=5321 Ack=1083 Win=8187 Len=0"
"7","0.137565","192.168.1.166","23.39.213.4","TLSv1.2","89","Application Data"
"8","0.212907","23.39.213.4","192.168.1.166","TCP","54","443  >  50692 [ACK] Seq=1083 Ack=5356 Win=9949 Len=0"
"9","1.741790","192.168.1.166","23.39.213.4","TLSv1.2","5206","Application Data"
"10","1.741874","192.168.1.166","23.39.213.4","TLSv1.2","538","Application Data"
"11","1.744574","192.168.1.166","23.39.213.4","TLSv1.2","5206","Application Data"
"12","1.744641","192.168.1.166","23.39.213.4","TLSv1.2","1173","Application Data"
"13","1.774698","23.39.213.4","192.168.1.166","TCP","54","443  >  50692 [ACK] Seq=1083 Ack=6816 Win=9945 Len=0"
"14","1.774698","23.39.213.4","192.168.1.166","TCP","54","443  >  50692 [ACK] Seq=1083 Ack=8276 Win=9937 Len=0"
"15","1.774698","23.39.213.4","192.168.1.166","TCP","54","443  >  50692 [ACK] Seq=1083 Ack=10508 Win=9925 Len=0"
"16","1.774698","23.39.213.4","192.168.1.166","TCP","54","443  >  50692 [ACK] Seq=1083 Ack=10992 Win=9922 Len=0"
"17","1.776756","23.39.213.4","192.168.1.166","TCP","54","443  >  50692 [ACK] Seq=1083 Ack=12452 Win=9945 Len=0"
"18","1.776756","23.39.213.4","192.168.1.166","TCP","54","443  >  50692 [ACK] Seq=1083 Ack=15372 Win=9930 Len=0"
"19","1.776756","23.39.213.4","192.168.1.166","TCP","54","443  >  50692 [ACK] Seq=1083 Ack=16144 Win=9948 Len=0"
"20","1.776756","23.39.213.4","192.168.1.166","TCP","54","443  >  50692 [ACK] Seq=1083 Ack=17263 Win=9946 Len=0"
"21","1.830357","192.168.1.166","23.39.213.4","TLSv1.2","5325","Application Data"
"22","1.859009","23.39.213.4","192.168.1.166","TLSv1.2","946","Application Data"
"23","1.859009","23.39.213.4","192.168.1.166","TLSv1.2","141","Application Data"
"24","1.859033","192.168.1.166","23.39.213.4","TCP","54","50692  >  443 [ACK] Seq=22534 Ack=2062 Win=8191 Len=0"
"25","1.862480","23.39.213.4","192.168.1.166","TCP","54","443  >  50692 [ACK] Seq=2062 Ack=18723 Win=9945 Len=0"
"26","1.862480","23.39.213.4","192.168.1.166","TCP","54","443  >  50692 [ACK] Seq=2062 Ack=20183 Win=9937 Len=0"
"27","1.862480","23.39.213.4","192.168.1.166","TCP","54","443  >  50692 [ACK] Seq=2062 Ack=22534 Win=9940 Len=0"
"28","1.891753","23.39.213.4","192.168.1.166","TLSv1.2","938","Application Data"
"29","1.891753","23.39.213.4","192.168.1.166","TLSv1.2","116","Application Data"
"30","1.891780","192.168.1.166","23.39.213.4","TCP","54","50692  >  443 [ACK] Seq=22534 Ack=3008 Win=8188 Len=0"
"31","3.837819","192.168.1.166","23.39.213.4","TLSv1.2","5411","Application Data"
"32","3.837846","192.168.1.166","23.39.213.4","TLSv1.2","1127","Application Data"
"33","3.870201","23.39.213.4","192.168.1.166","TCP","54","443  >  50692 [ACK] Seq=3008 Ack=23994 Win=9945 Len=0"
"34","3.870201","23.39.213.4","192.168.1.166","TCP","54","443  >  50692 [ACK] Seq=3008 Ack=25454 Win=9937 Len=0"
"35","3.870201","23.39.213.4","192.168.1.166","TCP","54","443  >  50692 [ACK] Seq=3008 Ack=27891 Win=9924 Len=0"
"36","3.870201","23.39.213.4","192.168.1.166","TCP","54","443  >  50692 [ACK] Seq=3008 Ack=28964 Win=9918 Len=0"
"37","3.899893","23.39.213.4","192.168.1.166","TLSv1.2","1445","Application Data"
"38","3.899893","23.39.213.4","192.168.1.166","TCP","16114","443  >  50692 [ACK] Seq=4399 Ack=28964 Win=9949 Len=16060 [TCP PDU reassembled in 39]"
"39","3.899893","23.39.213.4","192.168.1.166","TLSv1.2","400","Application Data"
"40","3.899893","23.39.213.4","192.168.1.166","TLSv1.2","85","Application Data"
"41","3.899893","23.39.213.4","192.168.1.166","TCP","16114","443  >  50692 [ACK] Seq=20836 Ack=28964 Win=9949 Len=16060 [TCP PDU reassembled in 42]"
"42","3.899893","23.39.213.4","192.168.1.166","TLSv1.2","400","Application Data"
"43","3.899950","192.168.1.166","23.39.213.4","TCP","54","50692  >  443 [ACK] Seq=28964 Ack=37242 Win=8191 Len=0"
"44","3.900768","23.39.213.4","192.168.1.166","TLSv1.2","13194","Application Data, Application Data"
"45","3.900768","23.39.213.4","192.168.1.166","TLSv1.2","765","Application Data"
"46","3.900794","192.168.1.166","23.39.213.4","TCP","54","50692  >  443 [ACK] Seq=28964 Ack=51093 Win=8191 Len=0"
"47","3.904260","23.39.213.4","192.168.1.166","TCP","1514","443  >  50692 [ACK] Seq=51093 Ack=28964 Win=9949 Len=1460 [TCP PDU reassembled in 58]"
"48","3.904260","23.39.213.4","192.168.1.166","TCP","1514","443  >  50692 [ACK] Seq=52553 Ack=28964 Win=9949 Len=1460 [TCP PDU reassembled in 58]"
"49","3.904260","23.39.213.4","192.168.1.166","TCP","1514","443  >  50692 [ACK] Seq=54013 Ack=28964 Win=9949 Len=1460 [TCP PDU reassembled in 58]"
"50","3.904260","23.39.213.4","192.168.1.166","TCP","1514","443  >  50692 [ACK] Seq=55473 Ack=28964 Win=9949 Len=1460 [TCP PDU reassembled in 58]"
"51","3.904260","23.39.213.4","192.168.1.166","TCP","1514","443  >  50692 [ACK] Seq=56933 Ack=28964 Win=9949 Len=1460 [TCP PDU reassembled in 58]"
"52","3.904260","23.39.213.4","192.168.1.166","TCP","1514","443  >  50692 [ACK] Seq=58393 Ack=28964 Win=9949 Len=1460 [TCP PDU reassembled in 58]"
"53","3.904260","23.39.213.4","192.168.1.166","TCP","1514","443  >  50692 [ACK] Seq=59853 Ack=28964 Win=9949 Len=1460 [TCP PDU reassembled in 58]"
"54","3.904260","23.39.213.4","192.168.1.166","TCP","1514","443  >  50692 [ACK] Seq=61313 Ack=28964 Win=9949 Len=1460 [TCP PDU reassembled in 58]"
"55","3.904260","23.39.213.4","192.168.1.166","TCP","1514","443  >  50692 [ACK] Seq=62773 Ack=28964 Win=9949 Len=1460 [TCP PDU reassembled in 58]"
"56","3.904260","23.39.213.4","192.168.1.166","TCP","1514","443  >  50692 [ACK] Seq=64233 Ack=28964 Win=9949 Len=1460 [TCP PDU reassembled in 58]"
"57","3.904260","23.39.213.4","192.168.1.166","TCP","1514","443  >  50692 [ACK] Seq=65693 Ack=28964 Win=9949 Len=1460 [TCP PDU reassembled in 58]"
"58","3.904260","23.39.213.4","192.168.1.166","TLSv1.2","400","Application Data"
"59","3.904260","23.39.213.4","192.168.1.166","TLSv1.2","85","Application Data"
"60","3.904260","23.39.213.4","192.168.1.166","TCP","4434","443  >  50692 [ACK] Seq=67530 Ack=28964 Win=9949 Len=4380 [TCP PDU reassembled in 61]"
"61","3.904260","23.39.213.4","192.168.1.166","TLSv1.2","1461","Application Data"
"62","3.904331","192.168.1.166","23.39.213.4","TCP","54","50692  >  443 [ACK] Seq=28964 Ack=73317 Win=8191 Len=0"
"63","3.906152","192.168.1.166","23.39.213.4","TLSv1.2","5413","Application Data"
"64","3.906195","192.168.1.166","23.39.213.4","TLSv1.2","1250","Application Data"
"65","3.907064","23.39.213.4","192.168.1.166","TCP","16114","443  >  50692 [ACK] Seq=73317 Ack=28964 Win=9949 Len=16060 [TCP PDU reassembled in 66]"
"66","3.907064","23.39.213.4","192.168.1.166","TLSv1.2","400","Application Data"
"67","3.907064","23.39.213.4","192.168.1.166","TLSv1.2","85","Application Data"
"68","3.907064","23.39.213.4","192.168.1.166","TCP","5894","443  >  50692 [ACK] Seq=89754 Ack=28964 Win=9949 Len=5840 [TCP PDU reassembled in 69]"
"69","3.907064","23.39.213.4","192.168.1.166","TLSv1.2","1222","Application Data"
"70","3.907097","192.168.1.166","23.39.213.4","TCP","54","50692  >  443 [ACK] Seq=35519 Ack=96762 Win=8191 Len=0"
"71","3.911225","23.39.213.4","192.168.1.166","TCP","16114","443  >  50692 [ACK] Seq=96762 Ack=28964 Win=9949 Len=16060 [TCP PDU reassembled in 72]"
"72","3.911225","23.39.213.4","192.168.1.166","TLSv1.2","400","Application Data"
"73","3.911225","23.39.213.4","192.168.1.166","TLSv1.2","85","Application Data"
"74","3.911225","23.39.213.4","192.168.1.166","TCP","7354","443  >  50692 [ACK] Seq=113199 Ack=28964 Win=9949 Len=7300 [TCP PDU reassembled in 75]"
"75","3.911225","23.39.213.4","192.168.1.166","TLSv1.2","1229","Application Data"
"76","3.911272","192.168.1.166","23.39.213.4","TCP","54","50692  >  443 [ACK] Seq=35519 Ack=121674 Win=8191 Len=0"
"77","3.912117","23.39.213.4","192.168.1.166","TCP","5894","443  >  50692 [ACK] Seq=121674 Ack=28964 Win=9949 Len=5840 [TCP PDU reassembled in 78]"
"78","3.912117","23.39.213.4","192.168.1.166","TLSv1.2","658","Application Data"
"79","3.912117","23.39.213.4","192.168.1.166","TLSv1.2","93","Application Data"
"80","3.912117","23.39.213.4","192.168.1.166","TLSv1.2","85","Application Data"
"81","3.912142","192.168.1.166","23.39.213.4","TCP","54","50692  >  443 [ACK] Seq=35519 Ack=128188 Win=8191 Len=0"
"82","3.935534","192.168.1.166","23.39.213.4","TLSv1.2","576","Application Data"
"83","3.935571","192.168.1.166","23.39.213.4","TLSv1.2","171","Application Data"
"84","3.940348","23.39.213.4","192.168.1.166","TCP","54","443  >  50692 [ACK] Seq=128188 Ack=35519 Win=9925 Len=0"
"85","3.954382","23.39.213.4","192.168.1.166","TLSv1.2","361","Application Data"
"86","3.954382","23.39.213.4","192.168.1.166","TLSv1.2","289","Application Data"
"87","3.954399","192.168.1.166","23.39.213.4","TCP","54","50692  >  443 [ACK] Seq=36158 Ack=128730 Win=8189 Len=0"
"88","3.965855","192.168.1.166","23.39.213.4","TLSv1.2","164","Application Data"
"89","3.967199","23.39.213.4","192.168.1.166","TCP","54","443  >  50692 [ACK] Seq=128730 Ack=36158 Win=9949 Len=0"
"90","3.968522","192.168.1.166","23.39.213.4","TLSv1.2","5006","Application Data"
"91","3.984800","192.168.1.166","23.39.213.4","TLSv1.2","563","Application Data"
"92","3.984853","192.168.1.166","23.39.213.4","TLSv1.2","191","Application Data"
"93","3.984873","192.168.1.166","23.39.213.4","TLSv1.2","191","Application Data"
"94","3.988461","23.39.213.4","192.168.1.166","TLSv1.2","361","Application Data"
"95","3.988461","23.39.213.4","192.168.1.166","TLSv1.2","289","Application Data"
"96","3.988504","192.168.1.166","23.39.213.4","TCP","54","50692  >  443 [ACK] Seq=42003 Ack=129272 Win=8187 Len=0"
"97","4.004779","192.168.1.166","23.39.213.4","TLSv1.2","5069","Application Data"
"98","4.016366","23.39.213.4","192.168.1.166","TCP","54","443  >  50692 [ACK] Seq=129272 Ack=41220 Win=9926 Len=0"
"99","4.030812","23.39.213.4","192.168.1.166","TLSv1.2","958","Application Data"
"100","4.030840","192.168.1.166","23.39.213.4","TCP","54","50692  >  443 [ACK] Seq=47018 Ack=130176 Win=8191 Len=0"
"101","4.042166","23.39.213.4","192.168.1.166","TLSv1.2","85","Application Data"
"102","4.042189","192.168.1.166","23.39.213.4","TCP","54","50692  >  443 [ACK] Seq=47018 Ack=130207 Win=8191 Len=0"
"103","4.055495","23.39.213.4","192.168.1.166","TLSv1.2","373","Application Data"
"104","4.059058","23.39.213.4","192.168.1.166","TLSv1.2","338","Application Data"
"105","4.059058","23.39.213.4","192.168.1.166","TLSv1.2","1331","Application Data"
"106","4.059058","23.39.213.4","192.168.1.166","TLSv1.2","85","Application Data"
"107","4.059058","23.39.213.4","192.168.1.166","TCP","1514","443  >  50692 [ACK] Seq=132118 Ack=47018 Win=9949 Len=1460 [TCP PDU reassembled in 109]"
"108","4.059058","23.39.213.4","192.168.1.166","TCP","1514","443  >  50692 [ACK] Seq=133578 Ack=47018 Win=9949 Len=1460 [TCP PDU reassembled in 109]"
"109","4.059058","23.39.213.4","192.168.1.166","TLSv1.2","723","Application Data"
"110","4.059093","192.168.1.166","23.39.213.4","TCP","54","50692  >  443 [ACK] Seq=47018 Ack=135707 Win=8191 Len=0"
"111","4.060002","192.168.1.166","23.39.213.4","TLSv1.2","578","Application Data"
"112","4.061726","23.39.213.4","192.168.1.166","TLSv1.2","338","Application Data"
"113","4.061726","23.39.213.4","192.168.1.166","TLSv1.2","515","Application Data"
"114","4.061746","192.168.1.166","23.39.213.4","TCP","54","50692  >  443 [ACK] Seq=47542 Ack=136452 Win=8188 Len=0"
"115","4.062474","192.168.1.166","23.39.213.4","TLSv1.2","191","Application Data"
"116","4.113039","23.39.213.4","192.168.1.166","TCP","54","443  >  50692 [ACK] Seq=136452 Ack=47679 Win=9949 Len=0"
"117","4.156170","23.39.213.4","192.168.1.166","TLSv1.2","339","Application Data"
"118","4.156170","23.39.213.4","192.168.1.166","TLSv1.2","1508","Application Data"
"119","4.156170","23.39.213.4","192.168.1.166","TCP","8814","443  >  50692 [ACK] Seq=138191 Ack=47679 Win=9949 Len=8760 [TCP PDU reassembled in 120]"
"120","4.156170","23.39.213.4","192.168.1.166","TLSv1.2","856","Application Data"
"121","4.156170","23.39.213.4","192.168.1.166","TLSv1.2","338","Application Data"
"122","4.156170","23.39.213.4","192.168.1.166","TLSv1.2","1019","Application Data"
"123","4.156224","192.168.1.166","23.39.213.4","TCP","54","50692  >  443 [ACK] Seq=47679 Ack=149002 Win=8191 Len=0"
"124","4.157817","192.168.1.166","23.39.213.4","TLSv1.2","192","Application Data"
"125","4.157846","192.168.1.166","23.39.213.4","TLSv1.2","192","Application Data"
"126","4.170054","23.39.213.4","192.168.1.166","TLSv1.2","318","Application Data"
"127","4.170054","23.39.213.4","192.168.1.166","TCP","1514","443  >  50692 [ACK] Seq=149266 Ack=47679 Win=9949 Len=1460 [TCP PDU reassembled in 128]"
"128","4.170054","23.39.213.4","192.168.1.166","TLSv1.2","88","Application Data"
"129","4.170054","23.39.213.4","192.168.1.166","TCP","16114","443  >  50692 [ACK] Seq=150760 Ack=47679 Win=9949 Len=16060 [TCP PDU reassembled in 130]"
"130","4.170054","23.39.213.4","192.168.1.166","TLSv1.2","400","Application Data"
"131","4.170054","23.39.213.4","192.168.1.166","TLSv1.2","85","Application Data"
"132","4.170054","23.39.213.4","192.168.1.166","TCP","7354","443  >  50692 [ACK] Seq=167197 Ack=47679 Win=9949 Len=7300 [TCP PDU reassembled in 133]"
"133","4.170054","23.39.213.4","192.168.1.166","TLSv1.2","1173","Application Data"
"134","4.170054","23.39.213.4","192.168.1.166","TCP","14654","443  >  50692 [ACK] Seq=175616 Ack=47679 Win=9949 Len=14600 [TCP PDU reassembled in 137]"
"135","4.170123","192.168.1.166","23.39.213.4","TCP","54","50692  >  443 [ACK] Seq=47955 Ack=190216 Win=8191 Len=0"
"136","4.170165","23.39.213.4","192.168.1.166","TCP","1514","443  >  50692 [ACK] Seq=190216 Ack=47679 Win=9949 Len=1460 [TCP PDU reassembled in 137]"
"137","4.170165","23.39.213.4","192.168.1.166","TLSv1.2","400","Application Data"
"138","4.170171","192.168.1.166","23.39.213.4","TCP","54","50692  >  443 [ACK] Seq=47955 Ack=192022 Win=8191 Len=0"
"139","4.170721","23.39.213.4","192.168.1.166","TLSv1.2","85","Application Data"
"140","4.170721","23.39.213.4","192.168.1.166","TCP","7354","443  >  50692 [ACK] Seq=192053 Ack=47679 Win=9949 Len=7300 [TCP PDU reassembled in 141]"
"141","4.170721","23.39.213.4","192.168.1.166","TLSv1.2","977","Application Data"
"142","4.170721","23.39.213.4","192.168.1.166","TCP","16114","443  >  50692 [ACK] Seq=200276 Ack=47679 Win=9949 Len=16060 [TCP PDU reassembled in 143]"
"143","4.170721","23.39.213.4","192.168.1.166","TLSv1.2","400","Application Data"
"144","4.170721","23.39.213.4","192.168.1.166","TLSv1.2","85","Application Data"
"145","4.170761","192.168.1.166","23.39.213.4","TCP","54","50692  >  443 [ACK] Seq=47955 Ack=216713 Win=8191 Len=0"
"146","4.172190","23.39.213.4","192.168.1.166","TCP","1514","443  >  50692 [ACK] Seq=216713 Ack=47679 Win=9949 Len=1460 [TCP PDU reassembled in 151]"
"147","4.172190","23.39.213.4","192.168.1.166","TCP","1514","443  >  50692 [ACK] Seq=218173 Ack=47679 Win=9949 Len=1460 [TCP PDU reassembled in 151]"
"148","4.172190","23.39.213.4","192.168.1.166","TCP","1514","443  >  50692 [ACK] Seq=219633 Ack=47679 Win=9949 Len=1460 [TCP PDU reassembled in 151]"
"149","4.172190","23.39.213.4","192.168.1.166","TCP","1514","443  >  50692 [ACK] Seq=221093 Ack=47679 Win=9949 Len=1460 [TCP PDU reassembled in 151]"
"150","4.172190","23.39.213.4","192.168.1.166","TCP","1514","443  >  50692 [ACK] Seq=222553 Ack=47679 Win=9949 Len=1460 [TCP PDU reassembled in 151]"
"151","4.172190","23.39.213.4","192.168.1.166","TLSv1.2","977","Application Data"
"152","4.172190","23.39.213.4","192.168.1.166","TCP","1514","443  >  50692 [ACK] Seq=224936 Ack=47679 Win=9949 Len=1460 [TCP PDU reassembled in 161]"
"153","4.172190","23.39.213.4","192.168.1.166","TCP","1514","443  >  50692 [ACK] Seq=226396 Ack=47679 Win=9949 Len=1460 [TCP PDU reassembled in 161]"
"154","4.172190","23.39.213.4","192.168.1.166","TCP","1514","443  >  50692 [ACK] Seq=227856 Ack=47679 Win=9949 Len=1460 [TCP PDU reassembled in 161]"
"155","4.172190","23.39.213.4","192.168.1.166","TCP","1514","443  >  50692 [ACK] Seq=229316 Ack=47679 Win=9949 Len=1460 [TCP PDU reassembled in 161]"
"156","4.172190","23.39.213.4","192.168.1.166","TCP","1514","443  >  50692 [ACK] Seq=230776 Ack=47679 Win=9949 Len=1460 [TCP PDU reassembled in 161]"
"157","4.172190","23.39.213.4","192.168.1.166","TCP","1514","443  >  50692 [ACK] Seq=232236 Ack=47679 Win=9949 Len=1460 [TCP PDU reassembled in 161]"
"158","4.172190","23.39.213.4","192.168.1.166","TCP","1514","443  >  50692 [ACK] Seq=233696 Ack=47679 Win=9949 Len=1460 [TCP PDU reassembled in 161]"
"159","4.172190","23.39.213.4","192.168.1.166","TCP","1514","443  >  50692 [ACK] Seq=235156 Ack=47679 Win=9949 Len=1460 [TCP PDU reassembled in 161]"
"160","4.172190","23.39.213.4","192.168.1.166","TCP","4434","443  >  50692 [ACK] Seq=236616 Ack=47679 Win=9949 Len=4380 [TCP PDU reassembled in 161]"
"161","4.172190","23.39.213.4","192.168.1.166","TLSv1.2","400","Application Data"
"162","4.172190","23.39.213.4","192.168.1.166","TLSv1.2","7354","Application Data"
"163","4.172190","23.39.213.4","192.168.1.166","TLSv1.2","1008","Application Data"
"164","4.172190","23.39.213.4","192.168.1.166","TLSv1.2","316","Application Data"
"165","4.172190","23.39.213.4","192.168.1.166","TCP","1514","443  >  50692 [ACK] Seq=249858 Ack=47679 Win=9949 Len=1460 [TCP PDU reassembled in 166]"
"166","4.172190","23.39.213.4","192.168.1.166","TLSv1.2","92","Application Data"
"167","4.172190","23.39.213.4","192.168.1.166","TLSv1.2","686","Application Data"
"168","4.172242","192.168.1.166","23.39.213.4","TCP","54","50692  >  443 [ACK] Seq=47955 Ack=251988 Win=8191 Len=0"
"169","4.172437","23.39.213.4","192.168.1.166","TCP","11734","443  >  50692 [ACK] Seq=251988 Ack=47679 Win=9949 Len=11680 [TCP PDU reassembled in 170]"
"170","4.172437","23.39.213.4","192.168.1.166","TLSv1.2","94","Application Data"
"171","4.172461","192.168.1.166","23.39.213.4","TCP","54","50692  >  443 [ACK] Seq=47955 Ack=263708 Win=8191 Len=0"
"172","4.173469","192.168.1.166","23.39.213.4","TLSv1.2","192","Application Data"
"173","4.174290","192.168.1.166","23.39.213.4","TLSv1.2","193","Application Data"
"174","4.196917","23.39.213.4","192.168.1.166","TCP","54","443  >  50692 [ACK] Seq=263708 Ack=47955 Win=9949 Len=0"
"175","4.212852","23.39.213.4","192.168.1.166","TCP","54","443  >  50692 [ACK] Seq=263708 Ack=48232 Win=9949 Len=0"
"176","4.307266","23.39.213.4","192.168.1.166","TLSv1.2","317","Application Data"
"177","4.307266","23.39.213.4","192.168.1.166","TLSv1.2","1456","Application Data"
"178","4.307266","23.39.213.4","192.168.1.166","TLSv1.2","317","Application Data"
"179","4.307266","23.39.213.4","192.168.1.166","TLSv1.2","1458","Application Data"
"180","4.307266","23.39.213.4","192.168.1.166","TCP","1514","443  >  50692 [ACK] Seq=267040 Ack=48232 Win=9949 Len=1460 [TCP PDU reassembled in 182]"
"181","4.307266","23.39.213.4","192.168.1.166","TCP","1514","443  >  50692 [ACK] Seq=268500 Ack=48232 Win=9949 Len=1460 [TCP PDU reassembled in 182]"
"182","4.307266","23.39.213.4","192.168.1.166","TLSv1.2","980","Application Data"
"183","4.307266","23.39.213.4","192.168.1.166","TCP","1514","443  >  50692 [ACK] Seq=270886 Ack=48232 Win=9949 Len=1460 [TCP PDU reassembled in 185]"
"184","4.307266","23.39.213.4","192.168.1.166","TCP","1514","443  >  50692 [ACK] Seq=272346 Ack=48232 Win=9949 Len=1460 [TCP PDU reassembled in 185]"
"185","4.307266","23.39.213.4","192.168.1.166","TLSv1.2","142","Application Data"
"186","4.307266","23.39.213.4","192.168.1.166","TLSv1.2","317","Application Data"
"187","4.307266","23.39.213.4","192.168.1.166","TLSv1.2","1454","Application Data"
"188","4.307330","192.168.1.166","23.39.213.4","TCP","54","50692  >  443 [ACK] Seq=48232 Ack=275557 Win=8191 Len=0"
"189","4.308751","192.168.1.166","23.39.213.4","TLSv1.2","192","Application Data"
"190","4.308788","192.168.1.166","23.39.213.4","TLSv1.2","192","Application Data"
"191","4.309860","23.39.213.4","192.168.1.166","TCP","1514","443  >  50692 [ACK] Seq=275557 Ack=48232 Win=9949 Len=1460 [TCP PDU reassembled in 194]"
"192","4.309860","23.39.213.4","192.168.1.166","TCP","1514","443  >  50692 [ACK] Seq=277017 Ack=48232 Win=9949 Len=1460 [TCP PDU reassembled in 194]"
"193","4.309860","23.39.213.4","192.168.1.166","TCP","1514","443  >  50692 [ACK] Seq=278477 Ack=48232 Win=9949 Len=1460 [TCP PDU reassembled in 194]"
"194","4.309860","23.39.213.4","192.168.1.166","TLSv1.2","356","Application Data"
"195","4.309881","192.168.1.166","23.39.213.4","TCP","54","50692  >  443 [ACK] Seq=48508 Ack=280239 Win=8191 Len=0"
"196","4.314129","23.39.213.4","192.168.1.166","TLSv1.2","317","Application Data"
"197","4.314129","23.39.213.4","192.168.1.166","TLSv1.2","1457","Application Data"
"198","4.314129","23.39.213.4","192.168.1.166","TCP","7354","443  >  50692 [ACK] Seq=281905 Ack=48232 Win=9949 Len=7300 [TCP PDU reassembled in 199]"
"199","4.314129","23.39.213.4","192.168.1.166","TLSv1.2","1071","Application Data"
"200","4.314158","192.168.1.166","23.39.213.4","TCP","54","50692  >  443 [ACK] Seq=48508 Ack=290222 Win=8191 Len=0"
"201","4.342919","23.39.213.4","192.168.1.166","TCP","54","443  >  50692 [ACK] Seq=290222 Ack=48508 Win=9949 Len=0"
"202","4.358654","23.39.213.4","192.168.1.166","TLSv1.2","317","Application Data"
"203","4.358654","23.39.213.4","192.168.1.166","TLSv1.2","1456","Application Data"
"204","4.358654","23.39.213.4","192.168.1.166","TCP","4434","443  >  50692 [ACK] Seq=291887 Ack=48508 Win=9949 Len=4380 [TCP PDU reassembled in 205]"
"205","4.358654","23.39.213.4","192.168.1.166","TLSv1.2","422","Application Data"
"206","4.358703","192.168.1.166","23.39.213.4","TCP","54","50692  >  443 [ACK] Seq=48508 Ack=296635 Win=8191 Len=0"
"207","4.379159","192.168.1.166","23.39.213.4","TLSv1.2","5138","Application Data"
"208","4.379227","192.168.1.166","23.39.213.4","TLSv1.2","588","Application Data"
"209","4.419138","23.39.213.4","192.168.1.166","TLSv1.2","317","Application Data"
"210","4.419138","23.39.213.4","192.168.1.166","TCP","1514","443  >  50692 [ACK] Seq=296898 Ack=54126 Win=9921 Len=1460 [TCP PDU reassembled in 211]"
"211","4.419138","23.39.213.4","192.168.1.166","TLSv1.2","93","Application Data"
"212","4.419163","192.168.1.166","23.39.213.4","TCP","54","50692  >  443 [ACK] Seq=54126 Ack=298397 Win=8191 Len=0"
"213","4.436230","23.39.213.4","192.168.1.166","TCP","2974","443  >  50692 [ACK] Seq=298397 Ack=54126 Win=9949 Len=2920 [TCP PDU reassembled in 214]"
"214","4.436230","23.39.213.4","192.168.1.166","TLSv1.2","61","Application Data"
"215","4.436270","192.168.1.166","23.39.213.4","TCP","54","50692  >  443 [ACK] Seq=54126 Ack=301324 Win=8191 Len=0"
"216","4.442253","23.39.213.4","192.168.1.166","TLSv1.2","316","Application Data"
"217","4.442253","23.39.213.4","192.168.1.166","TLSv1.2","1459","Application Data"
"218","4.442253","23.39.213.4","192.168.1.166","TCP","5894","443  >  50692 [ACK] Seq=302991 Ack=54126 Win=9949 Len=5840 [TCP PDU reassembled in 219]"
"219","4.442253","23.39.213.4","192.168.1.166","TLSv1.2","291","Application Data"
"220","4.442289","192.168.1.166","23.39.213.4","TCP","54","50692  >  443 [ACK] Seq=54126 Ack=309068 Win=8191 Len=0"
"221","4.460769","192.168.1.166","23.39.213.4","TLSv1.2","5387","Application Data"
"222","4.460830","192.168.1.166","23.39.213.4","TLSv1.2","1469","Application Data"
"223","4.462848","23.39.213.4","192.168.1.166","TLSv1.2","317","Application Data"
"224","4.462848","23.39.213.4","192.168.1.166","TLSv1.2","1457","Application Data"
"225","4.462848","23.39.213.4","192.168.1.166","TCP","2974","443  >  50692 [ACK] Seq=310734 Ack=54126 Win=9949 Len=2920 [TCP PDU reassembled in 226]"
"226","4.462848","23.39.213.4","192.168.1.166","TLSv1.2","1131","Application Data"
"227","4.462883","192.168.1.166","23.39.213.4","TCP","54","50692  >  443 [ACK] Seq=60874 Ack=314731 Win=8191 Len=0"
"228","4.493295","23.39.213.4","192.168.1.166","TCP","54","443  >  50692 [ACK] Seq=314731 Ack=59459 Win=9924 Len=0"
"229","4.504740","23.39.213.4","192.168.1.166","TLSv1.2","955","Application Data"
"230","4.504740","23.39.213.4","192.168.1.166","TLSv1.2","872","Application Data"
"231","4.504782","192.168.1.166","23.39.213.4","TCP","54","50692  >  443 [ACK] Seq=60874 Ack=316450 Win=8191 Len=0"
"232","4.524454","192.168.1.166","23.39.213.4","TLSv1.2","5387","Application Data"
"233","4.524517","192.168.1.166","23.39.213.4","TLSv1.2","653","Application Data"
"234","4.556870","23.39.213.4","192.168.1.166","TCP","54","443  >  50692 [ACK] Seq=316450 Ack=66806 Win=9928 Len=0"
"235","4.586491","192.168.1.166","23.39.213.4","TLSv1.2","571","Application Data"
"236","4.586554","192.168.1.166","23.39.213.4","TLSv1.2","190","Application Data"
"237","4.586575","192.168.1.166","23.39.213.4","TLSv1.2","191","Application Data"
"238","4.586593","192.168.1.166","23.39.213.4","TLSv1.2","190","Application Data"
"239","4.586679","192.168.1.166","23.39.213.4","TLSv1.2","90","Application Data"
"240","4.586701","192.168.1.166","23.39.213.4","TLSv1.2","90","Application Data"
"241","4.586723","192.168.1.166","23.39.213.4","TLSv1.2","192","Application Data"
"242","4.592463","23.39.213.4","192.168.1.166","TLSv1.2","952","Application Data"
"243","4.592463","23.39.213.4","192.168.1.166","TLSv1.2","197","Application Data"
"244","4.592496","192.168.1.166","23.39.213.4","TCP","54","50692  >  443 [ACK] Seq=67942 Ack=317491 Win=8187 Len=0"
"245","4.619016","23.39.213.4","192.168.1.166","TCP","54","443  >  50692 [ACK] Seq=317491 Ack=67459 Win=9949 Len=0"
"246","4.619016","23.39.213.4","192.168.1.166","TCP","54","443  >  50692 [ACK] Seq=317491 Ack=67942 Win=9949 Len=0"
"247","4.643326","23.39.213.4","192.168.1.166","TLSv1.2","317","Application Data"
"248","4.643326","23.39.213.4","192.168.1.166","TLSv1.2","745","Application Data"
"249","4.643326","23.39.213.4","192.168.1.166","TLSv1.2","317","Application Data"
"250","4.643326","23.39.213.4","192.168.1.166","TLSv1.2","1023","Application Data"
"251","4.643369","192.168.1.166","23.39.213.4","TCP","54","50692  >  443 [ACK] Seq=67942 Ack=319677 Win=8191 Len=0"
"252","4.644624","23.39.213.4","192.168.1.166","TLSv1.2","317","Application Data"
"253","4.644624","23.39.213.4","192.168.1.166","TLSv1.2","1031","Application Data"
"254","4.644638","192.168.1.166","23.39.213.4","TCP","54","50692  >  443 [ACK] Seq=67942 Ack=320917 Win=8187 Len=0"
"255","4.645501","23.39.213.4","192.168.1.166","TLSv1.2","317","Application Data"
"256","4.645501","23.39.213.4","192.168.1.166","TLSv1.2","1195","Application Data"
"257","4.645519","192.168.1.166","23.39.213.4","TCP","54","50692  >  443 [ACK] Seq=67942 Ack=322321 Win=8191 Len=0"
"258","4.707914","23.39.213.4","192.168.1.166","TLSv1.2","318","Application Data"
"259","4.707914","23.39.213.4","192.168.1.166","TLSv1.2","1456","Application Data"
"260","4.707914","23.39.213.4","192.168.1.166","TCP","1514","443  >  50692 [ACK] Seq=323987 Ack=67942 Win=9949 Len=1460 [TCP PDU reassembled in 271]"
"261","4.707914","23.39.213.4","192.168.1.166","TCP","1514","443  >  50692 [ACK] Seq=325447 Ack=67942 Win=9949 Len=1460 [TCP PDU reassembled in 271]"
"262","4.707914","23.39.213.4","192.168.1.166","TCP","1514","443  >  50692 [ACK] Seq=326907 Ack=67942 Win=9949 Len=1460 [TCP PDU reassembled in 271]"
"263","4.707914","23.39.213.4","192.168.1.166","TCP","1514","443  >  50692 [ACK] Seq=328367 Ack=67942 Win=9949 Len=1460 [TCP PDU reassembled in 271]"
"264","4.707914","23.39.213.4","192.168.1.166","TCP","1514","443  >  50692 [ACK] Seq=329827 Ack=67942 Win=9949 Len=1460 [TCP PDU reassembled in 271]"
"265","4.707914","23.39.213.4","192.168.1.166","TCP","1514","443  >  50692 [ACK] Seq=331287 Ack=67942 Win=9949 Len=1460 [TCP PDU reassembled in 271]"
"266","4.707914","23.39.213.4","192.168.1.166","TCP","1514","443  >  50692 [ACK] Seq=332747 Ack=67942 Win=9949 Len=1460 [TCP PDU reassembled in 271]"
"267","4.707914","23.39.213.4","192.168.1.166","TCP","1514","443  >  50692 [ACK] Seq=334207 Ack=67942 Win=9949 Len=1460 [TCP PDU reassembled in 271]"
"268","4.707914","23.39.213.4","192.168.1.166","TCP","1514","443  >  50692 [ACK] Seq=335667 Ack=67942 Win=9949 Len=1460 [TCP PDU reassembled in 271]"
"269","4.707914","23.39.213.4","192.168.1.166","TCP","1514","443  >  50692 [ACK] Seq=337127 Ack=67942 Win=9949 Len=1460 [TCP PDU reassembled in 271]"
"270","4.707914","23.39.213.4","192.168.1.166","TCP","1514","443  >  50692 [ACK] Seq=338587 Ack=67942 Win=9949 Len=1460 [TCP PDU reassembled in 271]"
"271","4.707914","23.39.213.4","192.168.1.166","TLSv1.2","400","Application Data"
"272","4.707914","23.39.213.4","192.168.1.166","TLSv1.2","85","Application Data"
"273","4.707914","23.39.213.4","192.168.1.166","TCP","1514","443  >  50692 [ACK] Seq=340424 Ack=67942 Win=9949 Len=1460 [TCP PDU reassembled in 281]"
"274","4.707914","23.39.213.4","192.168.1.166","TCP","1514","443  >  50692 [ACK] Seq=341884 Ack=67942 Win=9949 Len=1460 [TCP PDU reassembled in 281]"
"275","4.707914","23.39.213.4","192.168.1.166","TCP","1514","443  >  50692 [ACK] Seq=343344 Ack=67942 Win=9949 Len=1460 [TCP PDU reassembled in 281]"
"276","4.707914","23.39.213.4","192.168.1.166","TCP","1514","443  >  50692 [ACK] Seq=344804 Ack=67942 Win=9949 Len=1460 [TCP PDU reassembled in 281]"
"277","4.707914","23.39.213.4","192.168.1.166","TCP","1514","443  >  50692 [ACK] Seq=346264 Ack=67942 Win=9949 Len=1460 [TCP PDU reassembled in 281]"
"278","4.707914","23.39.213.4","192.168.1.166","TCP","1514","443  >  50692 [ACK] Seq=347724 Ack=67942 Win=9949 Len=1460 [TCP PDU reassembled in 281]"
"279","4.707914","23.39.213.4","192.168.1.166","TCP","1514","443  >  50692 [ACK] Seq=349184 Ack=67942 Win=9949 Len=1460 [TCP PDU reassembled in 281]"
"280","4.707914","23.39.213.4","192.168.1.166","TCP","5894","443  >  50692 [ACK] Seq=350644 Ack=67942 Win=9949 Len=5840 [TCP PDU reassembled in 281]"
"281","4.707914","23.39.213.4","192.168.1.166","TLSv1.2","400","Application Data"
"282","4.707914","23.39.213.4","192.168.1.166","TLSv1.2","32174","Application Data, Application Data, Application Data"
"283","4.707914","23.39.213.4","192.168.1.166","TLSv1.2","808","Application Data"
"284","4.707914","23.39.213.4","192.168.1.166","TLSv1.2","1514","Application Data"
"285","4.707914","23.39.213.4","192.168.1.166","TLSv1.2","121","Application Data"
"286","4.708029","192.168.1.166","23.39.213.4","TCP","54","50692  >  443 [ACK] Seq=67942 Ack=391231 Win=8191 Len=0"
"287","4.755050","23.39.213.4","192.168.1.166","TLSv1.2","953","Application Data"
"288","4.755050","23.39.213.4","192.168.1.166","TLSv1.2","195","Application Data"
"289","4.755089","192.168.1.166","23.39.213.4","TCP","54","50692  >  443 [ACK] Seq=67942 Ack=392271 Win=8187 Len=0"
"290","4.760617","192.168.1.166","23.39.213.4","TLSv1.2","5136","Application Data"
"291","4.760672","192.168.1.166","23.39.213.4","TLSv1.2","4300","Application Data"
"292","4.793353","23.39.213.4","192.168.1.166","TCP","54","443  >  50692 [ACK] Seq=392271 Ack=74484 Win=9918 Len=0"
"293","4.793353","23.39.213.4","192.168.1.166","TCP","54","443  >  50692 [ACK] Seq=392271 Ack=77270 Win=9938 Len=0"
"294","5.046985","23.39.213.4","192.168.1.166","TLSv1.2","955","Application Data"
"295","5.046985","23.39.213.4","192.168.1.166","TLSv1.2","1512","Application Data"
"296","5.046985","23.39.213.4","192.168.1.166","TLSv1.2","439","Application Data"
"297","5.047028","192.168.1.166","23.39.213.4","TCP","54","50692  >  443 [ACK] Seq=77270 Ack=395015 Win=8191 Len=0"
"298","5.056493","192.168.1.166","23.39.213.4","TLSv1.2","5386","Application Data"
"299","5.056557","192.168.1.166","23.39.213.4","TLSv1.2","1704","Application Data"
"300","5.056584","192.168.1.166","23.39.213.4","TLSv1.2","527","Application Data"
"301","5.064002","192.168.1.166","23.39.213.4","TLSv1.2","162","Application Data"
"302","5.066160","192.168.1.166","23.39.213.4","TLSv1.2","148","Application Data"
"303","5.070053","192.168.1.166","23.39.213.4","TLSv1.2","90","Application Data"
"304","5.089754","23.39.213.4","192.168.1.166","TCP","54","443  >  50692 [ACK] Seq=395015 Ack=81650 Win=9949 Len=0"
"305","5.089754","23.39.213.4","192.168.1.166","TCP","54","443  >  50692 [ACK] Seq=395015 Ack=84725 Win=9933 Len=0"
"306","5.101982","192.168.1.166","23.39.213.4","TLSv1.2","5137","Application Data"
"307","5.102047","192.168.1.166","23.39.213.4","TLSv1.2","474","Application Data"
"308","5.112024","23.39.213.4","192.168.1.166","TCP","54","443  >  50692 [ACK] Seq=395015 Ack=84963 Win=9949 Len=0"
"309","5.112422","23.39.213.4","192.168.1.166","TLSv1.2","333","Application Data"
"310","5.113060","23.39.213.4","192.168.1.166","TCP","8814","443  >  50692 [ACK] Seq=395294 Ack=84963 Win=9949 Len=8760 [TCP PDU reassembled in 311]"
"311","5.113060","23.39.213.4","192.168.1.166","TLSv1.2","865","Application Data"
"312","5.113086","192.168.1.166","23.39.213.4","TCP","54","50692  >  443 [ACK] Seq=90466 Ack=404865 Win=8191 Len=0"
"313","5.126421","23.39.213.4","192.168.1.166","TLSv1.2","336","Application Data"
"314","5.126421","23.39.213.4","192.168.1.166","TCP","16114","443  >  50692 [ACK] Seq=405147 Ack=84963 Win=9949 Len=16060 [TCP PDU reassembled in 315]"
"315","5.126421","23.39.213.4","192.168.1.166","TLSv1.2","400","Application Data"
"316","5.126421","23.39.213.4","192.168.1.166","TLSv1.2","85","Application Data"
"317","5.126421","23.39.213.4","192.168.1.166","TCP","16114","443  >  50692 [ACK] Seq=421584 Ack=84963 Win=9949 Len=16060 [TCP PDU reassembled in 318]"
"318","5.126421","23.39.213.4","192.168.1.166","TLSv1.2","400","Application Data"
"319","5.126481","192.168.1.166","23.39.213.4","TCP","54","50692  >  443 [ACK] Seq=90466 Ack=437990 Win=8191 Len=0"
"320","5.128127","23.39.213.4","192.168.1.166","TLSv1.2","32174","Application Data, Application Data, Application Data"
"321","5.128127","23.39.213.4","192.168.1.166","TLSv1.2","808","Application Data"
"322","5.128127","23.39.213.4","192.168.1.166","TLSv1.2","56994","Application Data, Application Data, Application Data, Application Data, Application Data, Application Data, Application Data"
"323","5.128175","192.168.1.166","23.39.213.4","TCP","54","50692  >  443 [ACK] Seq=90466 Ack=527804 Win=8191 Len=0"
"324","5.129218","23.39.213.4","192.168.1.166","TLSv1.2","56994","Application Data, Application Data, Application Data, Application Data, Application Data, Application Data"
"325","5.129241","192.168.1.166","23.39.213.4","TCP","54","50692  >  443 [ACK] Seq=90466 Ack=584744 Win=8191 Len=0"
"326","5.129637","23.39.213.4","192.168.1.166","TLSv1.2","26334","Application Data, Application Data, Application Data, Application Data"
"327","5.129659","192.168.1.166","23.39.213.4","TCP","54","50692  >  443 [ACK] Seq=90466 Ack=611024 Win=8191 Len=0"
"328","5.135149","23.39.213.4","192.168.1.166","TCP","1514","443  >  50692 [ACK] Seq=611024 Ack=84963 Win=9949 Len=1460 [TCP PDU reassembled in 333]"
"329","5.135149","23.39.213.4","192.168.1.166","TCP","1514","443  >  50692 [ACK] Seq=612484 Ack=84963 Win=9949 Len=1460 [TCP PDU reassembled in 333]"
"330","5.135149","23.39.213.4","192.168.1.166","TCP","1514","443  >  50692 [ACK] Seq=613944 Ack=84963 Win=9949 Len=1460 [TCP PDU reassembled in 333]"
"331","5.135149","23.39.213.4","192.168.1.166","TCP","1514","443  >  50692 [ACK] Seq=615404 Ack=84963 Win=9949 Len=1460 [TCP PDU reassembled in 333]"
"332","5.135149","23.39.213.4","192.168.1.166","TCP","1514","443  >  50692 [ACK] Seq=616864 Ack=84963 Win=9949 Len=1460 [TCP PDU reassembled in 333]"
"333","5.135149","23.39.213.4","192.168.1.166","TLSv1.2","1514","Application Data, Application Data"
"334","5.135149","23.39.213.4","192.168.1.166","TCP","1514","443  >  50692 [ACK] Seq=619784 Ack=84963 Win=9949 Len=1460 [TCP PDU reassembled in 344]"
"335","5.135149","23.39.213.4","192.168.1.166","TCP","1514","443  >  50692 [ACK] Seq=621244 Ack=84963 Win=9949 Len=1460 [TCP PDU reassembled in 344]"
"336","5.135149","23.39.213.4","192.168.1.166","TCP","1514","443  >  50692 [ACK] Seq=622704 Ack=84963 Win=9949 Len=1460 [TCP PDU reassembled in 344]"
"337","5.135149","23.39.213.4","192.168.1.166","TCP","1514","443  >  50692 [ACK] Seq=624164 Ack=84963 Win=9949 Len=1460 [TCP PDU reassembled in 344]"
"338","5.135149","23.39.213.4","192.168.1.166","TCP","1514","443  >  50692 [ACK] Seq=625624 Ack=84963 Win=9949 Len=1460 [TCP PDU reassembled in 344]"
"339","5.135149","23.39.213.4","192.168.1.166","TCP","1514","443  >  50692 [ACK] Seq=627084 Ack=84963 Win=9949 Len=1460 [TCP PDU reassembled in 344]"
"340","5.135149","23.39.213.4","192.168.1.166","TCP","1514","443  >  50692 [ACK] Seq=628544 Ack=84963 Win=9949 Len=1460 [TCP PDU reassembled in 344]"
"341","5.135149","23.39.213.4","192.168.1.166","TCP","1514","443  >  50692 [ACK] Seq=630004 Ack=84963 Win=9949 Len=1460 [TCP PDU reassembled in 344]"
"342","5.135149","23.39.213.4","192.168.1.166","TCP","1514","443  >  50692 [ACK] Seq=631464 Ack=84963 Win=9949 Len=1460 [TCP PDU reassembled in 344]"
"343","5.135149","23.39.213.4","192.168.1.166","TCP","1514","443  >  50692 [ACK] Seq=632924 Ack=84963 Win=9949 Len=1460 [TCP PDU reassembled in 344]"
"344","5.135149","23.39.213.4","192.168.1.166","TLSv1.2","1514","Application Data, Application Data"
"345","5.135149","23.39.213.4","192.168.1.166","TCP","1514","443  >  50692 [ACK] Seq=635844 Ack=84963 Win=9949 Len=1460 [TCP PDU reassembled in 355]"
"346","5.135149","23.39.213.4","192.168.1.166","TCP","1514","443  >  50692 [ACK] Seq=637304 Ack=84963 Win=9949 Len=1460 [TCP PDU reassembled in 355]"
"347","5.135149","23.39.213.4","192.168.1.166","TCP","1514","443  >  50692 [ACK] Seq=638764 Ack=84963 Win=9949 Len=1460 [TCP PDU reassembled in 355]"
"348","5.135149","23.39.213.4","192.168.1.166","TCP","1514","443  >  50692 [PSH, ACK] Seq=640224 Ack=84963 Win=9949 Len=1460 [TCP PDU reassembled in 355]"
"349","5.135149","23.39.213.4","192.168.1.166","TCP","1514","443  >  50692 [ACK] Seq=641684 Ack=84963 Win=9949 Len=1460 [TCP PDU reassembled in 355]"
"350","5.135149","23.39.213.4","192.168.1.166","TCP","1514","443  >  50692 [ACK] Seq=643144 Ack=84963 Win=9949 Len=1460 [TCP PDU reassembled in 355]"
"351","5.135149","23.39.213.4","192.168.1.166","TCP","1514","443  >  50692 [ACK] Seq=644604 Ack=84963 Win=9949 Len=1460 [TCP PDU reassembled in 355]"
"352","5.135149","23.39.213.4","192.168.1.166","TCP","1514","443  >  50692 [ACK] Seq=646064 Ack=84963 Win=9949 Len=1460 [TCP PDU reassembled in 355]"
"353","5.135149","23.39.213.4","192.168.1.166","TCP","1514","443  >  50692 [ACK] Seq=647524 Ack=84963 Win=9949 Len=1460 [TCP PDU reassembled in 355]"
"354","5.135149","23.39.213.4","192.168.1.166","TCP","1514","443  >  50692 [ACK] Seq=648984 Ack=84963 Win=9949 Len=1460 [TCP PDU reassembled in 355]"
"355","5.135149","23.39.213.4","192.168.1.166","TLSv1.2","1514","Application Data, Application Data"
"356","5.135149","23.39.213.4","192.168.1.166","TCP","1514","443  >  50692 [ACK] Seq=651904 Ack=84963 Win=9949 Len=1460 [TCP PDU reassembled in 358]"
"357","5.135149","23.39.213.4","192.168.1.166","TCP","1514","443  >  50692 [ACK] Seq=653364 Ack=84963 Win=9949 Len=1460 [TCP PDU reassembled in 358]"
"358","5.135149","23.39.213.4","192.168.1.166","TLSv1.2","36554","Application Data, Application Data, Application Data"
"359","5.135149","23.39.213.4","192.168.1.166","TLSv1.2","781","Application Data"
"360","5.135258","192.168.1.166","23.39.213.4","TCP","54","50692  >  443 [ACK] Seq=90466 Ack=692051 Win=8191 Len=0"
"361","5.152358","23.39.213.4","192.168.1.166","TCP","54","443  >  50692 [ACK] Seq=692051 Ack=90466 Win=9922 Len=0"
"362","5.175301","23.39.213.4","192.168.1.166","TLSv1.2","334","Application Data"
"363","5.175301","23.39.213.4","192.168.1.166","TLSv1.2","1432","Application Data"
"364","5.175301","23.39.213.4","192.168.1.166","TCP","13194","443  >  50692 [ACK] Seq=693709 Ack=90466 Win=9949 Len=13140 [TCP PDU reassembled in 365]"
"365","5.175301","23.39.213.4","192.168.1.166","TLSv1.2","1398","Application Data"
"366","5.175353","192.168.1.166","23.39.213.4","TCP","54","50692  >  443 [ACK] Seq=90466 Ack=708193 Win=8191 Len=0"
"367","5.175709","192.168.1.166","23.39.213.4","TLSv1.2","89","Application Data"
"368","5.217043","23.39.213.4","192.168.1.166","TLSv1.2","954","Application Data"
"369","5.217043","23.39.213.4","192.168.1.166","TLSv1.2","1512","Application Data"
"370","5.217043","23.39.213.4","192.168.1.166","TLSv1.2","1265","Application Data"
"371","5.217092","192.168.1.166","23.39.213.4","TCP","54","50692  >  443 [ACK] Seq=90501 Ack=711762 Win=8191 Len=0"
"372","5.237990","23.39.213.4","192.168.1.166","TLSv1.2","944","Application Data"
"373","5.237990","23.39.213.4","192.168.1.166","TLSv1.2","767","Application Data"
"374","5.238037","192.168.1.166","23.39.213.4","TCP","54","50692  >  443 [ACK] Seq=90501 Ack=713365 Win=8191 Len=0"
"375","5.297723","192.168.1.166","23.39.213.4","TLSv1.2","5280","Application Data"
"376","5.297816","192.168.1.166","23.39.213.4","TLSv1.2","5468","Application Data"
"377","5.330706","23.39.213.4","192.168.1.166","TCP","54","443  >  50692 [ACK] Seq=713365 Ack=93421 Win=9937 Len=0"
"378","5.330706","23.39.213.4","192.168.1.166","TCP","54","443  >  50692 [ACK] Seq=713365 Ack=95727 Win=9940 Len=0"
"379","5.338504","23.39.213.4","192.168.1.166","TCP","54","443  >  50692 [ACK] Seq=713365 Ack=101141 Win=9924 Len=0"
"380","5.378672","23.39.213.4","192.168.1.166","TLSv1.2","374","Application Data"
"381","5.378672","23.39.213.4","192.168.1.166","TLSv1.2","85","Application Data"
"382","5.378713","192.168.1.166","23.39.213.4","TCP","54","50692  >  443 [ACK] Seq=101141 Ack=713716 Win=8190 Len=0"
"383","5.401811","192.168.1.166","23.39.213.4","TLSv1.2","5390","Application Data"
"384","5.401848","192.168.1.166","23.39.213.4","TLSv1.2","382","Application Data"
"385","5.420224","192.168.1.166","23.39.213.4","TLSv1.2","5520","Application Data"
"386","5.420269","192.168.1.166","23.39.213.4","TLSv1.2","3728","Application Data"
"387","5.420852","192.168.1.166","23.39.213.4","TLSv1.2","5390","Application Data"
"388","5.420891","192.168.1.166","23.39.213.4","TLSv1.2","3641","Application Data"
"389","5.434921","23.39.213.4","192.168.1.166","TCP","54","443  >  50692 [ACK] Seq=713716 Ack=104061 Win=9937 Len=0"
"390","5.434921","23.39.213.4","192.168.1.166","TCP","54","443  >  50692 [ACK] Seq=713716 Ack=106477 Win=9939 Len=0"
"391","5.441903","192.168.1.166","23.39.213.4","TLSv1.2","5256","Application Data"
"392","5.441974","192.168.1.166","23.39.213.4","TLSv1.2","265","Application Data"
"393","5.442229","192.168.1.166","23.39.213.4","TLSv1.2","5256","Application Data"
"394","5.442261","192.168.1.166","23.39.213.4","TLSv1.2","312","Application Data"
"395","5.452157","23.39.213.4","192.168.1.166","TCP","54","443  >  50692 [ACK] Seq=713716 Ack=108265 Win=9945 Len=0"
"396","5.475064","23.39.213.4","192.168.1.166","TCP","54","443  >  50692 [ACK] Seq=713716 Ack=135741 Win=9795 Len=0"
"397","5.510802","192.168.1.166","23.39.213.4","TLSv1.2","5389","Application Data"
"398","5.510877","192.168.1.166","23.39.213.4","TLSv1.2","685","Application Data"
"399","5.542788","23.39.213.4","192.168.1.166","TCP","54","443  >  50692 [ACK] Seq=713716 Ack=141076 Win=9924 Len=0"
"400","5.582082","23.39.213.4","192.168.1.166","TCP","54","443  >  50692 [ACK] Seq=713716 Ack=141707 Win=9920 Len=0"
"401","5.658956","23.39.213.4","192.168.1.166","TLSv1.2","951","Application Data"
"402","5.658956","23.39.213.4","192.168.1.166","TLSv1.2","1514","Application Data"
"403","5.658956","23.39.213.4","192.168.1.166","TLSv1.2","361","Application Data"
"404","5.658956","23.39.213.4","192.168.1.166","TLSv1.2","289","Application Data"
"405","5.658956","23.39.213.4","192.168.1.166","TLSv1.2","355","Application Data"
"406","5.658956","23.39.213.4","192.168.1.166","TLSv1.2","886","Application Data"
"407","5.658956","23.39.213.4","192.168.1.166","TLSv1.2","121","Application Data"
"408","5.658956","23.39.213.4","192.168.1.166","TLSv1.2","355","Application Data"
"409","5.658956","23.39.213.4","192.168.1.166","TLSv1.2","121","Application Data"
"410","5.659008","192.168.1.166","23.39.213.4","TCP","54","50692  >  443 [ACK] Seq=141707 Ack=718183 Win=8191 Len=0"
"411","5.671008","192.168.1.166","23.39.213.4","TLSv1.2","5382","Application Data"
"412","5.671074","192.168.1.166","23.39.213.4","TLSv1.2","1069","Application Data"
"413","5.703126","23.39.213.4","192.168.1.166","TCP","54","443  >  50692 [ACK] Seq=718183 Ack=143167 Win=9945 Len=0"
"414","5.703126","23.39.213.4","192.168.1.166","TCP","54","443  >  50692 [ACK] Seq=718183 Ack=144627 Win=9937 Len=0"
"415","5.703229","23.39.213.4","192.168.1.166","TCP","54","443  >  50692 [ACK] Seq=718183 Ack=148050 Win=9919 Len=0"
"416","5.792631","23.39.213.4","192.168.1.166","TLSv1.2","956","Application Data"
"417","5.792631","23.39.213.4","192.168.1.166","TLSv1.2","196","Application Data"
"418","5.792666","192.168.1.166","23.39.213.4","TCP","54","50692  >  443 [ACK] Seq=148050 Ack=719227 Win=8187 Len=0"
"419","5.810433","192.168.1.166","23.39.213.4","TLSv1.2","5272","Application Data"
"420","5.810504","192.168.1.166","23.39.213.4","TLSv1.2","391","Application Data"
"421","5.831752","192.168.1.166","23.39.213.4","TLSv1.2","5388","Application Data"
"422","5.831821","192.168.1.166","23.39.213.4","TLSv1.2","3223","Application Data"
"423","5.842112","23.39.213.4","192.168.1.166","TCP","54","443  >  50692 [ACK] Seq=719227 Ack=150970 Win=9949 Len=0"
"424","5.842112","23.39.213.4","192.168.1.166","TCP","54","443  >  50692 [ACK] Seq=719227 Ack=153605 Win=9937 Len=0"
"425","5.842197","23.39.213.4","192.168.1.166","TLSv1.2","958","Application Data"
"426","5.842197","23.39.213.4","192.168.1.166","TLSv1.2","583","Application Data"
"427","5.842233","192.168.1.166","23.39.213.4","TCP","54","50692  >  443 [ACK] Seq=162108 Ack=720660 Win=8191 Len=0"
"428","5.854998","192.168.1.166","23.39.213.4","TLSv1.2","5239","Application Data"
"429","5.855065","192.168.1.166","23.39.213.4","TLSv1.2","768","Application Data"
"430","5.857763","192.168.1.166","23.39.213.4","TLSv1.2","5253","Application Data"
"431","5.857806","192.168.1.166","23.39.213.4","TLSv1.2","855","Application Data"
"432","5.858955","192.168.1.166","23.39.213.4","TLSv1.2","5389","Application Data"
"433","5.858995","192.168.1.166","23.39.213.4","TLSv1.2","2296","Application Data"
"434","5.862279","23.39.213.4","192.168.1.166","TLSv1.2","89","Application Data"
"435","5.865249","23.39.213.4","192.168.1.166","TCP","54","443  >  50692 [ACK] Seq=720695 Ack=162108 Win=9914 Len=0"
"436","5.888428","23.39.213.4","192.168.1.166","TCP","54","443  >  50692 [ACK] Seq=720695 Ack=165028 Win=9937 Len=0"
"437","5.888428","23.39.213.4","192.168.1.166","TCP","54","443  >  50692 [ACK] Seq=720695 Ack=167293 Win=9940 Len=0"
"438","5.891340","23.39.213.4","192.168.1.166","TCP","54","443  >  50692 [ACK] Seq=720695 Ack=169467 Win=9945 Len=0"
"439","5.891340","23.39.213.4","192.168.1.166","TCP","54","443  >  50692 [ACK] Seq=720695 Ack=175467 Win=9927 Len=0"
"440","5.891340","23.39.213.4","192.168.1.166","TCP","54","443  >  50692 [ACK] Seq=720695 Ack=179342 Win=9932 Len=0"
"441","5.891340","23.39.213.4","192.168.1.166","TCP","54","443  >  50692 [ACK] Seq=720695 Ack=181584 Win=9919 Len=0"
"442","5.909620","192.168.1.166","23.39.213.4","TCP","54","50692  >  443 [ACK] Seq=181584 Ack=720695 Win=8191 Len=0"
"443","5.940888","23.39.213.4","192.168.1.166","TLSv1.2","361","Application Data"
"444","5.949659","23.39.213.4","192.168.1.166","TLSv1.2","85","Application Data"
"445","5.949675","192.168.1.166","23.39.213.4","TCP","54","50692  >  443 [ACK] Seq=181584 Ack=721033 Win=8190 Len=0"
"446","5.978825","23.39.213.4","192.168.1.166","TLSv1.2","955","Application Data"
"447","5.978825","23.39.213.4","192.168.1.166","TLSv1.2","1512","Application Data"
"448","5.978860","192.168.1.166","23.39.213.4","TCP","54","50692  >  443 [ACK] Seq=181584 Ack=723392 Win=8191 Len=0"
"449","5.979079","23.39.213.4","192.168.1.166","TLSv1.2","1040","Application Data"
"450","6.006858","23.39.213.4","192.168.1.166","TLSv1.2","955","Application Data"
"451","6.006858","23.39.213.4","192.168.1.166","TLSv1.2","1512","Application Data"
"452","6.006858","23.39.213.4","192.168.1.166","TCP","1514","443  >  50692 [ACK] Seq=726737 Ack=181584 Win=9949 Len=1460 [TCP PDU reassembled in 458]"
"453","6.006858","23.39.213.4","192.168.1.166","TCP","1514","443  >  50692 [ACK] Seq=728197 Ack=181584 Win=9949 Len=1460 [TCP PDU reassembled in 458]"
"454","6.006858","23.39.213.4","192.168.1.166","TCP","1514","443  >  50692 [ACK] Seq=729657 Ack=181584 Win=9949 Len=1460 [TCP PDU reassembled in 458]"
"455","6.006858","23.39.213.4","192.168.1.166","TCP","1514","443  >  50692 [ACK] Seq=731117 Ack=181584 Win=9949 Len=1460 [TCP PDU reassembled in 458]"
"456","6.006858","23.39.213.4","192.168.1.166","TCP","1514","443  >  50692 [ACK] Seq=732577 Ack=181584 Win=9949 Len=1460 [TCP PDU reassembled in 458]"
"457","6.006858","23.39.213.4","192.168.1.166","TCP","1514","443  >  50692 [ACK] Seq=734037 Ack=181584 Win=9949 Len=1460 [TCP PDU reassembled in 458]"
"458","6.006858","23.39.213.4","192.168.1.166","TLSv1.2","726","Application Data"
"459","6.006858","23.39.213.4","192.168.1.166","TLSv1.2","438","Application Data"
"460","6.006858","23.39.213.4","192.168.1.166","TLSv1.2","719","Application Data"
"461","6.006898","192.168.1.166","23.39.213.4","TCP","54","50692  >  443 [ACK] Seq=181584 Ack=737218 Win=8191 Len=0"
"462","6.011029","192.168.1.166","23.39.213.4","TLSv1.2","5269","Application Data"
"463","6.011073","192.168.1.166","23.39.213.4","TLSv1.2","317","Application Data"
"464","6.037815","23.39.213.4","192.168.1.166","TLSv1.2","954","Application Data"
"465","6.037815","23.39.213.4","192.168.1.166","TLSv1.2","1514","Application Data"
"466","6.037815","23.39.213.4","192.168.1.166","TLSv1.2","225","Application Data"
"467","6.037850","192.168.1.166","23.39.213.4","TCP","54","50692  >  443 [ACK] Seq=187062 Ack=739749 Win=8191 Len=0"
"468","6.042072","23.39.213.4","192.168.1.166","TCP","54","443  >  50692 [ACK] Seq=739749 Ack=184504 Win=9937 Len=0"
"469","6.042072","23.39.213.4","192.168.1.166","TCP","54","443  >  50692 [ACK] Seq=739749 Ack=186799 Win=9940 Len=0"
"470","6.053686","192.168.1.166","23.39.213.4","TLSv1.2","5385","Application Data"
"471","6.053717","192.168.1.166","23.39.213.4","TLSv1.2","411","Application Data"
"472","6.054819","192.168.1.166","23.39.213.4","TLSv1.2","5385","Application Data"
"473","6.054859","192.168.1.166","23.39.213.4","TLSv1.2","2030","Application Data"
"474","6.055824","192.168.1.166","23.39.213.4","TLSv1.2","5385","Application Data"
"475","6.055859","192.168.1.166","23.39.213.4","TLSv1.2","561","Application Data"
"476","6.062613","192.168.1.166","23.39.213.4","TLSv1.2","5251","Application Data"
"477","6.062670","192.168.1.166","23.39.213.4","TLSv1.2","312","Application Data"
"478","6.083037","23.39.213.4","192.168.1.166","TCP","54","443  >  50692 [ACK] Seq=739749 Ack=187062 Win=9949 Len=0"
"479","6.085953","23.39.213.4","192.168.1.166","TCP","54","443  >  50692 [ACK] Seq=739749 Ack=191442 Win=9949 Len=0"
"480","6.085953","23.39.213.4","192.168.1.166","TCP","54","443  >  50692 [ACK] Seq=739749 Ack=192750 Win=9949 Len=0"
"481","6.085953","23.39.213.4","192.168.1.166","TCP","54","443  >  50692 [ACK] Seq=739749 Ack=200057 Win=9913 Len=0"
"482","6.088368","23.39.213.4","192.168.1.166","TCP","54","443  >  50692 [ACK] Seq=739749 Ack=202977 Win=9937 Len=0"
"483","6.088368","23.39.213.4","192.168.1.166","TCP","54","443  >  50692 [ACK] Seq=739749 Ack=205388 Win=9939 Len=0"
"484","6.088368","23.39.213.4","192.168.1.166","TCP","54","443  >  50692 [ACK] Seq=739749 Ack=205895 Win=9949 Len=0"
"485","6.088368","23.39.213.4","192.168.1.166","TLSv1.2","952","Application Data"
"486","6.088612","23.39.213.4","192.168.1.166","TLSv1.2","1513","Application Data"
"487","6.088629","192.168.1.166","23.39.213.4","TCP","54","50692  >  443 [ACK] Seq=211350 Ack=742106 Win=8191 Len=0"
"488","6.095854","23.39.213.4","192.168.1.166","TCP","54","443  >  50692 [ACK] Seq=742106 Ack=208815 Win=9949 Len=0"
"489","6.095854","23.39.213.4","192.168.1.166","TCP","54","443  >  50692 [ACK] Seq=742106 Ack=211350 Win=9937 Len=0"
"490","6.101499","23.39.213.4","192.168.1.166","TCP","2974","443  >  50692 [ACK] Seq=742106 Ack=211350 Win=9949 Len=2920 [TCP PDU reassembled in 491]"
"491","6.101499","23.39.213.4","192.168.1.166","TLSv1.2","848","Application Data"
"492","6.101522","192.168.1.166","23.39.213.4","TCP","54","50692  >  443 [ACK] Seq=211350 Ack=745820 Win=8191 Len=0"
"493","6.103157","192.168.1.166","23.39.213.4","TLSv1.2","5247","Application Data"
"494","6.103193","192.168.1.166","23.39.213.4","TLSv1.2","813","Application Data"
"495","6.134949","23.39.213.4","192.168.1.166","TCP","54","443  >  50692 [ACK] Seq=745820 Ack=217302 Win=9920 Len=0"
"496","6.143725","192.168.1.166","23.39.213.4","TCP","55","50978  >  443 [ACK] Seq=1 Ack=1 Win=255 Len=1"
"497","6.168477","23.39.213.4","192.168.1.166","TLSv1.2","955","Application Data"
"498","6.168477","23.39.213.4","192.168.1.166","TLSv1.2","299","Application Data"
"499","6.168501","192.168.1.166","23.39.213.4","TCP","54","50692  >  443 [ACK] Seq=217302 Ack=746966 Win=8187 Len=0"
"500","6.174851","23.39.213.4","192.168.1.166","TCP","66","443  >  50978 [ACK] Seq=1 Ack=2 Win=501 Len=0 SLE=1 SRE=2"
"501","6.183719","23.39.213.4","192.168.1.166","TLSv1.2","355","Application Data"
"502","6.183719","23.39.213.4","192.168.1.166","TLSv1.2","121","Application Data"
"503","6.183744","192.168.1.166","23.39.213.4","TCP","54","50692  >  443 [ACK] Seq=217302 Ack=747334 Win=8191 Len=0"
"504","6.193708","23.39.213.4","192.168.1.166","TLSv1.2","438","Application Data"
"505","6.193708","23.39.213.4","192.168.1.166","TLSv1.2","710","Application Data"
"506","6.193726","192.168.1.166","23.39.213.4","TCP","54","50692  >  443 [ACK] Seq=217302 Ack=748374 Win=8187 Len=0"
"507","6.215908","23.39.213.4","192.168.1.166","TLSv1.2","956","Application Data"
"508","6.215908","23.39.213.4","192.168.1.166","TLSv1.2","291","Application Data"
"509","6.215908","23.39.213.4","192.168.1.166","TLSv1.2","954","Application Data"
"510","6.215908","23.39.213.4","192.168.1.166","TLSv1.2","244","Application Data"
"511","6.215939","192.168.1.166","23.39.213.4","TCP","54","50692  >  443 [ACK] Seq=217302 Ack=750603 Win=8191 Len=0"
"512","6.240967","192.168.1.166","23.39.213.4","TLSv1.2","5275","Application Data"
"513","6.241019","192.168.1.166","23.39.213.4","TLSv1.2","1501","Application Data"
"514","6.267314","23.39.213.4","192.168.1.166","TLSv1.2","953","Application Data"
"515","6.267314","23.39.213.4","192.168.1.166","TLSv1.2","1512","Application Data"
"516","6.267314","23.39.213.4","192.168.1.166","TLSv1.2","603","Application Data"
"517","6.267344","192.168.1.166","23.39.213.4","TCP","54","50692  >  443 [ACK] Seq=223970 Ack=753509 Win=8191 Len=0"
"518","6.273942","23.39.213.4","192.168.1.166","TCP","54","443  >  50692 [ACK] Seq=753509 Ack=223970 Win=9925 Len=0"
"519","6.341993","23.39.213.4","192.168.1.166","TLSv1.2","374","Application Data"
"520","6.341993","23.39.213.4","192.168.1.166","TLSv1.2","85","Application Data"
"521","6.342008","192.168.1.166","23.39.213.4","TCP","54","50692  >  443 [ACK] Seq=223970 Ack=753860 Win=8190 Len=0"
"522","6.478497","192.168.1.166","23.39.213.4","TLSv1.2","5283","Application Data"
"523","6.478587","192.168.1.166","23.39.213.4","TLSv1.2","5276","Application Data"
"524","6.478647","192.168.1.166","23.39.213.4","TLSv1.2","5269","Application Data"
"525","6.478764","192.168.1.166","23.39.213.4","TLSv1.2","5293","Application Data"
"526","6.488569","192.168.1.166","23.39.213.4","TLSv1.2","572","Application Data"
"527","6.488624","192.168.1.166","23.39.213.4","TLSv1.2","176","Application Data"
"528","6.488642","192.168.1.166","23.39.213.4","TLSv1.2","191","Application Data"
"529","6.488678","192.168.1.166","23.39.213.4","TLSv1.2","177","Application Data"
"530","6.526811","192.168.1.166","23.39.213.4","TLSv1.2","5135","Application Data"
"531","6.526925","192.168.1.166","23.39.213.4","TLSv1.2","5385","Application Data"
"532","6.526945","192.168.1.166","23.39.213.4","TLSv1.2","487","Application Data"
"533","6.526959","192.168.1.166","23.39.213.4","TLSv1.2","898","Application Data"
"534","6.549357","192.168.1.166","23.39.213.4","TCP","1514","[TCP Retransmission] 50692  >  443 [PSH, ACK] Seq=256004 Ack=753860 Win=8190 Len=1460"
"535","6.552974","23.39.213.4","192.168.1.166","TCP","54","443  >  50692 [ACK] Seq=753860 Ack=245775 Win=9830 Len=0"
"536","6.559939","23.39.213.4","192.168.1.166","TCP","54","443  >  50692 [ACK] Seq=753860 Ack=250155 Win=9930 Len=0"
"537","6.560704","192.168.1.166","23.39.213.4","TLSv1.2","5344","Application Data"
"538","6.560750","192.168.1.166","23.39.213.4","TLSv1.2","186","Application Data"
"539","6.581752","23.39.213.4","192.168.1.166","TCP","66","443  >  50692 [ACK] Seq=753860 Ack=257464 Win=9889 Len=0 SLE=256004 SRE=257464"
"540","6.586973","192.168.1.166","23.39.213.4","TLSv1.2","5347","Application Data"
"541","6.587420","192.168.1.166","23.39.213.4","TLSv1.2","5395","Application Data"
"542","6.588047","192.168.1.166","23.39.213.4","TLSv1.2","5256","Application Data"
"543","6.588174","192.168.1.166","23.39.213.4","TLSv1.2","5283","Application Data"
"544","6.588576","192.168.1.166","23.39.213.4","TLSv1.2","5248","Application Data"
"545","6.589083","192.168.1.166","23.39.213.4","TLSv1.2","5284","Application Data"
"546","6.589784","192.168.1.166","23.39.213.4","TLSv1.2","5371","Application Data"
"547","6.589909","192.168.1.166","23.39.213.4","TLSv1.2","5255","Application Data"
"548","6.592510","23.39.213.4","192.168.1.166","TCP","54","443  >  50692 [ACK] Seq=753860 Ack=258924 Win=9881 Len=0"
"549","6.592510","23.39.213.4","192.168.1.166","TCP","54","443  >  50692 [ACK] Seq=753860 Ack=262754 Win=9861 Len=0"
"550","6.592510","23.39.213.4","192.168.1.166","TCP","54","443  >  50692 [ACK] Seq=753860 Ack=262886 Win=9860 Len=0"
"551","6.608734","192.168.1.166","23.39.213.4","TLSv1.2","5385","Application Data"
"552","6.608783","192.168.1.166","23.39.213.4","TLSv1.2","2296","Application Data"
"553","6.619299","23.39.213.4","192.168.1.166","TCP","54","443  >  50692 [ACK] Seq=753860 Ack=264346 Win=9851 Len=0"
"554","6.619299","23.39.213.4","192.168.1.166","TCP","54","443  >  50692 [ACK] Seq=753860 Ack=268179 Win=9829 Len=0"
"555","6.619299","23.39.213.4","192.168.1.166","TCP","54","443  >  50692 [ACK] Seq=753860 Ack=269639 Win=9822 Len=0"
"556","6.619299","23.39.213.4","192.168.1.166","TCP","54","443  >  50692 [ACK] Seq=753860 Ack=273520 Win=9801 Len=0"
"557","6.619299","23.39.213.4","192.168.1.166","TCP","54","443  >  50692 [ACK] Seq=753860 Ack=274980 Win=9794 Len=0"
"558","6.619299","23.39.213.4","192.168.1.166","TCP","54","443  >  50692 [ACK] Seq=753860 Ack=277900 Win=9779 Len=0"
"559","6.621489","23.39.213.4","192.168.1.166","TCP","54","443  >  50692 [ACK] Seq=753860 Ack=278722 Win=9774 Len=0"
"560","6.621489","23.39.213.4","192.168.1.166","TCP","54","443  >  50692 [ACK] Seq=753860 Ack=280182 Win=9766 Len=0"
"561","6.621489","23.39.213.4","192.168.1.166","TCP","54","443  >  50692 [ACK] Seq=753860 Ack=283951 Win=9746 Len=0"
"562","6.621489","23.39.213.4","192.168.1.166","TCP","54","443  >  50692 [ACK] Seq=753860 Ack=285411 Win=9739 Len=0"
"563","6.621489","23.39.213.4","192.168.1.166","TCP","54","443  >  50692 [ACK] Seq=753860 Ack=289145 Win=9718 Len=0"
"564","6.621489","23.39.213.4","192.168.1.166","TCP","54","443  >  50692 [ACK] Seq=753860 Ack=290605 Win=9710 Len=0"
"565","6.663055","23.39.213.4","192.168.1.166","TCP","54","443  >  50692 [ACK] Seq=753860 Ack=312466 Win=9593 Len=0"
"566","6.683637","23.39.213.4","192.168.1.166","TLSv1.2","484","Application Data"
"567","6.683637","23.39.213.4","192.168.1.166","TCP","1514","443  >  50692 [ACK] Seq=754290 Ack=312466 Win=9949 Len=1460 [TCP PDU reassembled in 568]"
"568","6.683637","23.39.213.4","192.168.1.166","TLSv1.2","526","Application Data"
"569","6.683637","23.39.213.4","192.168.1.166","TLSv1.2","483","Application Data"
"570","6.683637","23.39.213.4","192.168.1.166","TCP","1514","443  >  50692 [ACK] Seq=756651 Ack=312466 Win=9949 Len=1460 [TCP PDU reassembled in 571]"
"571","6.683637","23.39.213.4","192.168.1.166","TLSv1.2","74","Application Data"
"572","6.683637","23.39.213.4","192.168.1.166","TLSv1.2","483","Application Data"
"573","6.683637","23.39.213.4","192.168.1.166","TLSv1.2","878","Application Data, Application Data"
"574","6.683637","23.39.213.4","192.168.1.166","TLSv1.2","639","Application Data"
"575","6.683676","192.168.1.166","23.39.213.4","TCP","54","50692  >  443 [ACK] Seq=312466 Ack=759969 Win=8191 Len=0"
"576","6.740843","23.39.213.4","192.168.1.166","TLSv1.2","484","Application Data"
"577","6.740843","23.39.213.4","192.168.1.166","TLSv1.2","949","Application Data"
"578","6.740873","192.168.1.166","23.39.213.4","TCP","54","50692  >  443 [ACK] Seq=312466 Ack=761294 Win=8186 Len=0"
"579","6.743254","23.39.213.4","192.168.1.166","TLSv1.2","483","Application Data"
"580","6.743254","23.39.213.4","192.168.1.166","TLSv1.2","1084","Application Data"
"581","6.743273","192.168.1.166","23.39.213.4","TCP","54","50692  >  443 [ACK] Seq=312466 Ack=762753 Win=8191 Len=0"
"582","6.747550","23.39.213.4","192.168.1.166","TLSv1.2","483","Application Data"
"583","6.747550","23.39.213.4","192.168.1.166","TLSv1.2","651","Application Data"
"584","6.747576","192.168.1.166","23.39.213.4","TCP","54","50692  >  443 [ACK] Seq=312466 Ack=763779 Win=8187 Len=0"
"585","6.759601","23.39.213.4","192.168.1.166","TLSv1.2","418","Application Data"
"586","6.759601","23.39.213.4","192.168.1.166","TLSv1.2","254","Application Data"
"587","6.759624","192.168.1.166","23.39.213.4","TCP","54","50692  >  443 [ACK] Seq=312466 Ack=764343 Win=8191 Len=0"
"588","6.765259","23.39.213.4","192.168.1.166","TLSv1.2","483","Application Data"
"589","6.765259","23.39.213.4","192.168.1.166","TLSv1.2","772","Application Data"
"590","6.765278","192.168.1.166","23.39.213.4","TCP","54","50692  >  443 [ACK] Seq=312466 Ack=765490 Win=8187 Len=0"
"591","6.770565","23.39.213.4","192.168.1.166","TLSv1.2","318","Application Data"
"592","6.770565","23.39.213.4","192.168.1.166","TLSv1.2","1455","Application Data"
"593","6.770565","23.39.213.4","192.168.1.166","TCP","16114","443  >  50692 [ACK] Seq=767155 Ack=312466 Win=9949 Len=16060 [TCP PDU reassembled in 594]"
"594","6.770565","23.39.213.4","192.168.1.166","TLSv1.2","400","Application Data"
"595","6.770565","23.39.213.4","192.168.1.166","TLSv1.2","85","Application Data"
"596","6.770565","23.39.213.4","192.168.1.166","TLSv1.2","1253","Application Data"
"597","6.770612","192.168.1.166","23.39.213.4","TCP","54","50692  >  443 [ACK] Seq=312466 Ack=784791 Win=8191 Len=0"
"598","6.771623","23.39.213.4","192.168.1.166","TLSv1.2","484","Application Data"
"599","6.772674","23.39.213.4","192.168.1.166","TCP","1514","443  >  50692 [ACK] Seq=785221 Ack=312466 Win=9949 Len=1460 [TCP PDU reassembled in 600]"
"600","6.772674","23.39.213.4","192.168.1.166","TLSv1.2","528","Application Data"
"601","6.772690","192.168.1.166","23.39.213.4","TCP","54","50692  >  443 [ACK] Seq=312466 Ack=787155 Win=8191 Len=0"
"602","6.776776","23.39.213.4","192.168.1.166","TLSv1.2","318","Application Data"
"603","6.776776","23.39.213.4","192.168.1.166","TLSv1.2","1454","Application Data"
"604","6.776794","192.168.1.166","23.39.213.4","TCP","54","50692  >  443 [ACK] Seq=312466 Ack=788819 Win=8191 Len=0"
"605","6.795099","23.39.213.4","192.168.1.166","TLSv1.2","951","Application Data"
"606","6.795099","23.39.213.4","192.168.1.166","TLSv1.2","715","Application Data"
"607","6.795099","23.39.213.4","192.168.1.166","TCP","16114","443  >  50692 [ACK] Seq=790377 Ack=312466 Win=9949 Len=16060 [TCP PDU reassembled in 608]"
"608","6.795099","23.39.213.4","192.168.1.166","TLSv1.2","400","Application Data"
"609","6.795099","23.39.213.4","192.168.1.166","TLSv1.2","1514","Application Data"
"610","6.795099","23.39.213.4","192.168.1.166","TLSv1.2","396","Application Data, Application Data"
"611","6.795099","23.39.213.4","192.168.1.166","TLSv1.2","2974","Application Data, Application Data"
"612","6.795099","23.39.213.4","192.168.1.166","TLSv1.2","199","Application Data"
"613","6.795099","23.39.213.4","192.168.1.166","TCP","16114","443  >  50692 [ACK] Seq=811650 Ack=312466 Win=9949 Len=16060 [TCP PDU reassembled in 614]"
"614","6.795099","23.39.213.4","192.168.1.166","TLSv1.2","400","Application Data"
"615","6.795099","23.39.213.4","192.168.1.166","TLSv1.2","2974","Application Data"
"616","6.795159","192.168.1.166","23.39.213.4","TCP","54","50692  >  443 [ACK] Seq=312466 Ack=830976 Win=8191 Len=0"
"617","6.795522","23.39.213.4","192.168.1.166","TCP","4434","443  >  50692 [ACK] Seq=830976 Ack=312466 Win=9949 Len=4380 [TCP PDU reassembled in 618]"
"618","6.795522","23.39.213.4","192.168.1.166","TLSv1.2","310","Application Data"
"619","6.795522","23.39.213.4","192.168.1.166","TCP","16114","443  >  50692 [ACK] Seq=835612 Ack=312466 Win=9949 Len=16060 [TCP PDU reassembled in 620]"
"620","6.795522","23.39.213.4","192.168.1.166","TLSv1.2","1257","Application Data, Application Data, Application Data"
"621","6.795556","192.168.1.166","23.39.213.4","TCP","54","50692  >  443 [ACK] Seq=312466 Ack=852875 Win=8191 Len=0"
"622","6.798142","23.39.213.4","192.168.1.166","TLSv1.2","482","Application Data"
"623","6.798142","23.39.213.4","192.168.1.166","TLSv1.2","196","Application Data"
"624","6.798176","192.168.1.166","23.39.213.4","TCP","54","50692  >  443 [ACK] Seq=312466 Ack=853445 Win=8189 Len=0"
"625","6.803184","23.39.213.4","192.168.1.166","TLSv1.2","482","Application Data"
"626","6.803184","23.39.213.4","192.168.1.166","TLSv1.2","193","Application Data"
"627","6.803220","192.168.1.166","23.39.213.4","TCP","54","50692  >  443 [ACK] Seq=312466 Ack=854012 Win=8187 Len=0"
"628","6.820233","23.39.213.4","192.168.1.166","TLSv1.2","957","Application Data"
"629","6.820233","23.39.213.4","192.168.1.166","TCP","16114","443  >  50692 [ACK] Seq=854915 Ack=312466 Win=9949 Len=16060 [TCP PDU reassembled in 630]"
"630","6.820233","23.39.213.4","192.168.1.166","TLSv1.2","400","Application Data"
"631","6.820233","23.39.213.4","192.168.1.166","TLSv1.2","16114","Application Data"
"632","6.820233","23.39.213.4","192.168.1.166","TLSv1.2","431","Application Data"
"633","6.820233","23.39.213.4","192.168.1.166","TLSv1.2","439","Application Data, Application Data"
"634","6.820233","23.39.213.4","192.168.1.166","TLSv1.2","246","Application Data"
"635","6.820289","192.168.1.166","23.39.213.4","TCP","54","50692  >  443 [ACK] Seq=312466 Ack=888335 Win=8191 Len=0"
"636","6.858739","23.39.213.4","192.168.1.166","TLSv1.2","483","Application Data"
"637","6.858739","23.39.213.4","192.168.1.166","TLSv1.2","448","Application Data"
"638","6.858778","192.168.1.166","23.39.213.4","TCP","54","50692  >  443 [ACK] Seq=312466 Ack=889158 Win=8188 Len=0"
"639","6.878845","192.168.1.166","23.39.213.4","TLSv1.2","5518","Application Data"
"640","6.878945","192.168.1.166","23.39.213.4","TLSv1.2","5301","Application Data"
"641","6.878964","192.168.1.166","23.39.213.4","TLSv1.2","3754","Application Data"
"642","6.878980","192.168.1.166","23.39.213.4","TLSv1.2","253","Application Data"
"643","6.890226","23.39.213.4","192.168.1.166","TLSv1.2","954","Application Data"
"644","6.890226","23.39.213.4","192.168.1.166","TCP","1514","443  >  50692 [ACK] Seq=890058 Ack=312466 Win=9949 Len=1460 [TCP PDU reassembled in 645]"
"645","6.890226","23.39.213.4","192.168.1.166","TLSv1.2","56","Application Data"
"646","6.890226","23.39.213.4","192.168.1.166","TCP","2974","443  >  50692 [ACK] Seq=891520 Ack=312466 Win=9949 Len=2920 [TCP PDU reassembled in 647]"
"647","6.890226","23.39.213.4","192.168.1.166","TLSv1.2","846","Application Data"
"648","6.890273","192.168.1.166","23.39.213.4","TCP","54","50692  >  443 [ACK] Seq=327076 Ack=895232 Win=8191 Len=0"
"649","6.896775","192.168.1.166","23.39.213.4","TLSv1.2","5387","Application Data"
"650","6.896835","192.168.1.166","23.39.213.4","TLSv1.2","2020","Application Data"
"651","6.912573","23.39.213.4","192.168.1.166","TCP","54","443  >  50692 [ACK] Seq=895232 Ack=322310 Win=9909 Len=0"
"652","6.912573","23.39.213.4","192.168.1.166","TCP","54","443  >  50692 [ACK] Seq=895232 Ack=324637 Win=9926 Len=0"
"653","6.912573","23.39.213.4","192.168.1.166","TCP","54","443  >  50692 [ACK] Seq=895232 Ack=326877 Win=9927 Len=0"
"654","6.929914","23.39.213.4","192.168.1.166","TCP","54","443  >  50692 [ACK] Seq=895232 Ack=328536 Win=9945 Len=0"
"655","6.929914","23.39.213.4","192.168.1.166","TCP","54","443  >  50692 [ACK] Seq=895232 Ack=334375 Win=9921 Len=0"
"656","6.947728","23.39.213.4","192.168.1.166","TLSv1.2","361","Application Data"
"657","6.947728","23.39.213.4","192.168.1.166","TLSv1.2","289","Application Data"
"658","6.947755","192.168.1.166","23.39.213.4","TCP","54","50692  >  443 [ACK] Seq=334375 Ack=895774 Win=8189 Len=0"
"659","7.047950","23.39.213.4","192.168.1.166","TLSv1.2","953","Application Data"
"660","7.047950","23.39.213.4","192.168.1.166","TLSv1.2","1512","Application Data"
"661","7.047950","23.39.213.4","192.168.1.166","TLSv1.2","985","Application Data"
"662","7.047981","192.168.1.166","23.39.213.4","TCP","54","50692  >  443 [ACK] Seq=334375 Ack=899062 Win=8191 Len=0"
"663","7.052708","192.168.1.166","23.39.213.4","TLSv1.2","5248","Application Data"
"664","7.052755","192.168.1.166","23.39.213.4","TLSv1.2","747","Application Data"
"665","7.055986","192.168.1.166","23.39.213.4","TLSv1.2","5385","Application Data"
"666","7.056026","192.168.1.166","23.39.213.4","TLSv1.2","732","Application Data"
"667","7.088980","23.39.213.4","192.168.1.166","TCP","54","443  >  50692 [ACK] Seq=899062 Ack=341722 Win=9913 Len=0"
"668","7.091748","23.39.213.4","192.168.1.166","TCP","54","443  >  50692 [ACK] Seq=899062 Ack=345593 Win=9939 Len=0"
"669","7.131358","23.39.213.4","192.168.1.166","TCP","54","443  >  50692 [ACK] Seq=899062 Ack=346271 Win=9949 Len=0"
"670","7.131673","23.39.213.4","192.168.1.166","TLSv1.2","955","Application Data"
"671","7.131673","23.39.213.4","192.168.1.166","TLSv1.2","174","Application Data"
"672","7.131696","192.168.1.166","23.39.213.4","TCP","54","50692  >  443 [ACK] Seq=346271 Ack=900083 Win=8187 Len=0"
"673","7.147770","23.39.213.4","192.168.1.166","TLSv1.2","438","Application Data"
"674","7.147770","23.39.213.4","192.168.1.166","TLSv1.2","683","Application Data"
"675","7.147797","192.168.1.166","23.39.213.4","TCP","54","50692  >  443 [ACK] Seq=346271 Ack=901096 Win=8191 Len=0"
"676","7.292156","23.39.213.4","192.168.1.166","TLSv1.2","955","Application Data"
"677","7.292156","23.39.213.4","192.168.1.166","TLSv1.2","280","Application Data"
"678","7.292211","192.168.1.166","23.39.213.4","TCP","54","50692  >  443 [ACK] Seq=346271 Ack=902223 Win=8187 Len=0"
"679","7.300002","192.168.1.166","23.39.213.4","TLSv1.2","571","Application Data"
"680","7.300057","192.168.1.166","23.39.213.4","TLSv1.2","191","Application Data"
"681","7.300075","192.168.1.166","23.39.213.4","TLSv1.2","191","Application Data"
"682","7.333559","23.39.213.4","192.168.1.166","TCP","54","443  >  50692 [ACK] Seq=902223 Ack=346788 Win=9949 Len=0"
"683","7.333559","23.39.213.4","192.168.1.166","TCP","54","443  >  50692 [ACK] Seq=902223 Ack=346925 Win=9948 Len=0"
"684","7.333559","23.39.213.4","192.168.1.166","TCP","54","443  >  50692 [ACK] Seq=902223 Ack=347062 Win=9947 Len=0"
"685","7.346198","23.39.213.4","192.168.1.166","TLSv1.2","317","Application Data"
"686","7.346198","23.39.213.4","192.168.1.166","TCP","2974","443  >  50692 [ACK] Seq=902486 Ack=347062 Win=9949 Len=2920 [TCP PDU reassembled in 687]"
"687","7.346198","23.39.213.4","192.168.1.166","TLSv1.2","743","Application Data"
"688","7.346198","23.39.213.4","192.168.1.166","TLSv1.2","2974","Application Data"
"689","7.346198","23.39.213.4","192.168.1.166","TLSv1.2","714","Application Data"
"690","7.346229","192.168.1.166","23.39.213.4","TCP","54","50692  >  443 [ACK] Seq=347062 Ack=909675 Win=8191 Len=0"
"691","7.358416","23.39.213.4","192.168.1.166","TLSv1.2","317","Application Data"
"692","7.358416","23.39.213.4","192.168.1.166","TCP","4434","443  >  50692 [ACK] Seq=909938 Ack=347062 Win=9949 Len=4380 [TCP PDU reassembled in 693]"
"693","7.358416","23.39.213.4","192.168.1.166","TLSv1.2","335","Application Data"
"694","7.358437","192.168.1.166","23.39.213.4","TCP","54","50692  >  443 [ACK] Seq=347062 Ack=914599 Win=8191 Len=0"
"695","7.952752","192.168.1.166","23.39.213.4","TLSv1.2","5437","Application Data"
"696","7.952851","192.168.1.166","23.39.213.4","TLSv1.2","5682","Application Data"
"697","7.952900","192.168.1.166","23.39.213.4","TLSv1.2","5687","Application Data"
"698","7.982153","192.168.1.166","23.39.213.4","TLSv1.2","5690","Application Data"
"699","7.982239","192.168.1.166","23.39.213.4","TLSv1.2","5690","Application Data"
"700","7.989787","23.39.213.4","192.168.1.166","TCP","54","443  >  50692 [ACK] Seq=914599 Ack=363706 Win=9866 Len=0"
"701","8.015047","23.39.213.4","192.168.1.166","TCP","54","443  >  50692 [ACK] Seq=914599 Ack=368086 Win=9930 Len=0"
"702","8.055602","23.39.213.4","192.168.1.166","TCP","54","443  >  50692 [ACK] Seq=914599 Ack=374978 Win=9894 Len=0"
"703","8.485307","192.168.1.166","23.39.213.4","TLSv1.2","5387","Application Data"
"704","8.485372","192.168.1.166","23.39.213.4","TLSv1.2","671","Application Data"
"705","8.518793","23.39.213.4","192.168.1.166","TCP","54","443  >  50692 [ACK] Seq=914599 Ack=377898 Win=9937 Len=0"
"706","8.522725","23.39.213.4","192.168.1.166","TLSv1.2","479","Application Data"
"707","8.522725","23.39.213.4","192.168.1.166","TCP","16114","443  >  50692 [ACK] Seq=915024 Ack=380928 Win=9920 Len=16060 [TCP PDU reassembled in 708]"
"708","8.522725","23.39.213.4","192.168.1.166","TLSv1.2","400","Application Data"
"709","8.522725","23.39.213.4","192.168.1.166","TLSv1.2","16114","Application Data"
"710","8.522725","23.39.213.4","192.168.1.166","TLSv1.2","431","Application Data"
"711","8.522725","23.39.213.4","192.168.1.166","TLSv1.2","7354","Application Data"
"712","8.522725","23.39.213.4","192.168.1.166","TLSv1.2","823","Application Data"
"713","8.522783","192.168.1.166","23.39.213.4","TCP","54","50692  >  443 [ACK] Seq=380928 Ack=955936 Win=8191 Len=0"
"714","8.524669","192.168.1.166","23.39.213.4","TLSv1.2","5688","Application Data"
"715","8.581079","23.39.213.4","192.168.1.166","TCP","54","443  >  50692 [ACK] Seq=955936 Ack=386562 Win=9891 Len=0"
"716","8.615931","23.39.213.4","192.168.1.166","TCP","16114","443  >  50692 [ACK] Seq=955936 Ack=386562 Win=9949 Len=16060 [TCP PDU reassembled in 717]"
"717","8.615931","23.39.213.4","192.168.1.166","TLSv1.2","400","Application Data"
"718","8.615931","23.39.213.4","192.168.1.166","TLSv1.2","85","Application Data"
"719","8.615931","23.39.213.4","192.168.1.166","TCP","2974","443  >  50692 [ACK] Seq=972373 Ack=386562 Win=9949 Len=2920 [TCP PDU reassembled in 720]"
"720","8.615931","23.39.213.4","192.168.1.166","TLSv1.2","413","Application Data"
"721","8.615977","192.168.1.166","23.39.213.4","TCP","54","50692  >  443 [ACK] Seq=386562 Ack=975652 Win=8191 Len=0"
"722","8.648407","23.39.213.4","192.168.1.166","TLSv1.2","85","Application Data"
"723","8.696592","192.168.1.166","23.39.213.4","TCP","54","50692  >  443 [ACK] Seq=386562 Ack=975683 Win=8191 Len=0"
"724","8.701614","23.39.213.4","192.168.1.166","TLSv1.2","479","Application Data"
"725","8.701614","23.39.213.4","192.168.1.166","TCP","16114","443  >  50692 [ACK] Seq=976108 Ack=386562 Win=9949 Len=16060 [TCP PDU reassembled in 726]"
"726","8.701614","23.39.213.4","192.168.1.166","TLSv1.2","400","Application Data"
"727","8.701614","23.39.213.4","192.168.1.166","TLSv1.2","16114","Application Data"
"728","8.701614","23.39.213.4","192.168.1.166","TLSv1.2","431","Application Data"
"729","8.701614","23.39.213.4","192.168.1.166","TLSv1.2","7354","Application Data"
"730","8.701614","23.39.213.4","192.168.1.166","TLSv1.2","847","Application Data"
"731","8.701660","192.168.1.166","23.39.213.4","TCP","54","50692  >  443 [ACK] Seq=386562 Ack=1017044 Win=8191 Len=0"
"732","8.703234","192.168.1.166","23.39.213.4","TLSv1.2","5694","Application Data"
"733","8.765867","23.39.213.4","192.168.1.166","TCP","16114","443  >  50692 [ACK] Seq=1017044 Ack=392202 Win=9923 Len=16060 [TCP PDU reassembled in 734]"
"734","8.765867","23.39.213.4","192.168.1.166","TLSv1.2","400","Application Data"
"735","8.765867","23.39.213.4","192.168.1.166","TLSv1.2","85","Application Data"
"736","8.765867","23.39.213.4","192.168.1.166","TCP","1514","443  >  50692 [ACK] Seq=1033481 Ack=392202 Win=9923 Len=1460 [TCP PDU reassembled in 737]"
"737","8.765867","23.39.213.4","192.168.1.166","TLSv1.2","82","Application Data"
"738","8.765867","23.39.213.4","192.168.1.166","TLSv1.2","1073","Application Data, Application Data"
"739","8.765895","192.168.1.166","23.39.213.4","TCP","54","50692  >  443 [ACK] Seq=392202 Ack=1035988 Win=8191 Len=0"
"740","8.770641","192.168.1.166","23.39.213.4","TLSv1.2","5386","Application Data"
"741","8.770687","192.168.1.166","23.39.213.4","TLSv1.2","4081","Application Data"
"742","8.813068","23.39.213.4","192.168.1.166","TCP","54","443  >  50692 [ACK] Seq=1035988 Ack=401561 Win=9874 Len=0"
"743","8.815963","23.39.213.4","192.168.1.166","TLSv1.2","85","Application Data"
"744","8.868145","192.168.1.166","23.39.213.4","TCP","54","50692  >  443 [ACK] Seq=401561 Ack=1036019 Win=8191 Len=0"
"745","9.073560","23.39.213.4","192.168.1.166","TLSv1.2","479","Application Data"
"746","9.073560","23.39.213.4","192.168.1.166","TCP","16114","443  >  50692 [ACK] Seq=1036444 Ack=401561 Win=9949 Len=16060 [TCP PDU reassembled in 747]"
"747","9.073560","23.39.213.4","192.168.1.166","TLSv1.2","400","Application Data"
"748","9.073560","23.39.213.4","192.168.1.166","TLSv1.2","16114","Application Data"
"749","9.073560","23.39.213.4","192.168.1.166","TLSv1.2","431","Application Data"
"750","9.073612","192.168.1.166","23.39.213.4","TCP","54","50692  >  443 [ACK] Seq=401561 Ack=1069287 Win=8191 Len=0"
"751","9.073898","23.39.213.4","192.168.1.166","TLSv1.2","7354","Application Data"
"752","9.073898","23.39.213.4","192.168.1.166","TLSv1.2","831","Application Data"
"753","9.073920","192.168.1.166","23.39.213.4","TCP","54","50692  >  443 [ACK] Seq=401561 Ack=1077364 Win=8191 Len=0"
"754","9.097946","23.39.213.4","192.168.1.166","TCP","7354","443  >  50692 [ACK] Seq=1077364 Ack=401561 Win=9949 Len=7300 [TCP PDU reassembled in 755]"
"755","9.097946","23.39.213.4","192.168.1.166","TLSv1.2","415","Application Data"
"756","9.098036","192.168.1.166","23.39.213.4","TCP","54","50692  >  443 [ACK] Seq=401561 Ack=1085025 Win=8191 Len=0"
"757","9.115312","192.168.1.166","23.39.213.4","TLSv1.2","5683","Application Data"
"758","9.163457","23.39.213.4","192.168.1.166","TLSv1.2","479","Application Data"
"759","9.163457","23.39.213.4","192.168.1.166","TCP","16114","443  >  50692 [ACK] Seq=1085450 Ack=407190 Win=9923 Len=16060 [TCP PDU reassembled in 760]"
"760","9.163457","23.39.213.4","192.168.1.166","TLSv1.2","400","Application Data"
"761","9.163457","23.39.213.4","192.168.1.166","TLSv1.2","5894","Application Data"
"762","9.163512","192.168.1.166","23.39.213.4","TCP","54","50692  >  443 [ACK] Seq=407190 Ack=1107696 Win=8191 Len=0"
"763","9.164235","23.39.213.4","192.168.1.166","TCP","10274","443  >  50692 [ACK] Seq=1107696 Ack=407190 Win=9923 Len=10220 [TCP PDU reassembled in 764]"
"764","9.164235","23.39.213.4","192.168.1.166","TLSv1.2","431","Application Data"
"765","9.164235","23.39.213.4","192.168.1.166","TLSv1.2","5894","Application Data"
"766","9.164235","23.39.213.4","192.168.1.166","TCP","1514","443  >  50692 [ACK] Seq=1124133 Ack=407190 Win=9923 Len=1460 [TCP PDU reassembled in 767]"
"767","9.164235","23.39.213.4","192.168.1.166","TLSv1.2","832","Application Data"
"768","9.164235","23.39.213.4","192.168.1.166","TLSv1.2","1514","Application Data"
"769","9.164235","23.39.213.4","192.168.1.166","TLSv1.2","950","Application Data"
"770","9.164323","192.168.1.166","23.39.213.4","TCP","54","50692  >  443 [ACK] Seq=407190 Ack=1128727 Win=8191 Len=0"
"771","9.164452","23.39.213.4","192.168.1.166","TCP","2974","443  >  50692 [ACK] Seq=1128727 Ack=407190 Win=9923 Len=2920 [TCP PDU reassembled in 776]"
"772","9.164468","192.168.1.166","23.39.213.4","TCP","54","50692  >  443 [ACK] Seq=407190 Ack=1131647 Win=8191 Len=0"
"773","9.164613","23.39.213.4","192.168.1.166","TCP","2974","443  >  50692 [ACK] Seq=1131647 Ack=407190 Win=9923 Len=2920 [TCP PDU reassembled in 776]"
"774","9.164623","192.168.1.166","23.39.213.4","TCP","54","50692  >  443 [ACK] Seq=407190 Ack=1134567 Win=8191 Len=0"
"775","9.165292","23.39.213.4","192.168.1.166","TCP","1514","443  >  50692 [ACK] Seq=1134567 Ack=407190 Win=9923 Len=1460 [TCP PDU reassembled in 776]"
"776","9.165292","23.39.213.4","192.168.1.166","TLSv1.2","303","Application Data"
"777","9.165292","23.39.213.4","192.168.1.166","TCP","4434","443  >  50692 [ACK] Seq=1136276 Ack=407190 Win=9923 Len=4380 [TCP PDU reassembled in 778]"
"778","9.165292","23.39.213.4","192.168.1.166","TLSv1.2","863","Application Data"
"779","9.165313","192.168.1.166","23.39.213.4","TCP","54","50692  >  443 [ACK] Seq=407190 Ack=1141465 Win=8191 Len=0"
"780","9.169928","23.39.213.4","192.168.1.166","TCP","10274","443  >  50692 [ACK] Seq=1141465 Ack=407190 Win=9949 Len=10220 [TCP PDU reassembled in 781]"
"781","9.169928","23.39.213.4","192.168.1.166","TLSv1.2","900","Application Data"
"782","9.169991","192.168.1.166","23.39.213.4","TCP","54","50692  >  443 [ACK] Seq=407190 Ack=1152531 Win=8191 Len=0"
"783","9.176313","192.168.1.166","23.39.213.4","TLSv1.2","5685","Application Data"
"784","9.224009","23.39.213.4","192.168.1.166","TLSv1.2","93","Application Data"
"785","9.224009","23.39.213.4","192.168.1.166","TCP","10274","443  >  50692 [ACK] Seq=1152570 Ack=412821 Win=9923 Len=10220 [TCP PDU reassembled in 786]"
"786","9.224009","23.39.213.4","192.168.1.166","TLSv1.2","160","Application Data"
"787","9.224009","23.39.213.4","192.168.1.166","TLSv1.2","16114","Application Data"
"788","9.224009","23.39.213.4","192.168.1.166","TLSv1.2","825","Application Data"
"789","9.224009","23.39.213.4","192.168.1.166","TLSv1.2","17574","Application Data, Application Data, Application Data"
"790","9.224070","192.168.1.166","23.39.213.4","TCP","54","50692  >  443 [ACK] Seq=412821 Ack=1197247 Win=8191 Len=0"
"791","9.224746","23.39.213.4","192.168.1.166","TCP","5894","443  >  50692 [ACK] Seq=1197247 Ack=412821 Win=9923 Len=5840 [TCP PDU reassembled in 792]"
"792","9.224746","23.39.213.4","192.168.1.166","TLSv1.2","1205","Application Data"
"793","9.224764","192.168.1.166","23.39.213.4","TCP","54","50692  >  443 [ACK] Seq=412821 Ack=1204238 Win=8191 Len=0"
"794","9.226174","192.168.1.166","23.39.213.4","TLSv1.2","5386","Application Data"
"795","9.226206","192.168.1.166","23.39.213.4","TLSv1.2","844","Application Data"
"796","9.273722","23.39.213.4","192.168.1.166","TCP","54","443  >  50692 [ACK] Seq=1204238 Ack=418943 Win=9890 Len=0"
"797","9.278667","23.39.213.4","192.168.1.166","TLSv1.2","85","Application Data"
"798","9.278667","23.39.213.4","192.168.1.166","TLSv1.2","93","Application Data"
"799","9.278667","23.39.213.4","192.168.1.166","TCP","1514","443  >  50692 [ACK] Seq=1204308 Ack=418943 Win=9949 Len=1460 [TCP PDU reassembled in 810]"
"800","9.278667","23.39.213.4","192.168.1.166","TCP","1514","443  >  50692 [ACK] Seq=1205768 Ack=418943 Win=9949 Len=1460 [TCP PDU reassembled in 810]"
"801","9.278667","23.39.213.4","192.168.1.166","TCP","1514","443  >  50692 [ACK] Seq=1207228 Ack=418943 Win=9949 Len=1460 [TCP PDU reassembled in 810]"
"802","9.278667","23.39.213.4","192.168.1.166","TCP","1514","443  >  50692 [ACK] Seq=1208688 Ack=418943 Win=9949 Len=1460 [TCP PDU reassembled in 810]"
"803","9.278667","23.39.213.4","192.168.1.166","TCP","1514","443  >  50692 [ACK] Seq=1210148 Ack=418943 Win=9949 Len=1460 [TCP PDU reassembled in 810]"
"804","9.278667","23.39.213.4","192.168.1.166","TCP","1514","443  >  50692 [ACK] Seq=1211608 Ack=418943 Win=9949 Len=1460 [TCP PDU reassembled in 810]"
"805","9.278667","23.39.213.4","192.168.1.166","TCP","1514","443  >  50692 [ACK] Seq=1213068 Ack=418943 Win=9949 Len=1460 [TCP PDU reassembled in 810]"
"806","9.278667","23.39.213.4","192.168.1.166","TCP","1514","443  >  50692 [ACK] Seq=1214528 Ack=418943 Win=9949 Len=1460 [TCP PDU reassembled in 810]"
"807","9.278667","23.39.213.4","192.168.1.166","TCP","1514","443  >  50692 [ACK] Seq=1215988 Ack=418943 Win=9949 Len=1460 [TCP PDU reassembled in 810]"
"808","9.278667","23.39.213.4","192.168.1.166","TCP","1514","443  >  50692 [ACK] Seq=1217448 Ack=418943 Win=9949 Len=1460 [TCP PDU reassembled in 810]"
"809","9.278667","23.39.213.4","192.168.1.166","TCP","1514","443  >  50692 [ACK] Seq=1218908 Ack=418943 Win=9949 Len=1460 [TCP PDU reassembled in 810]"
"810","9.278667","23.39.213.4","192.168.1.166","TLSv1.2","400","Application Data"
"811","9.278667","23.39.213.4","192.168.1.166","TLSv1.2","85","Application Data"
"812","9.278667","23.39.213.4","192.168.1.166","TLSv1.2","961","Application Data"
"813","9.278782","192.168.1.166","23.39.213.4","TCP","54","50692  >  443 [ACK] Seq=418943 Ack=1221652 Win=8191 Len=0"
