"No.","Time","Source","Destination","Protocol","Length","Info"
"1","0.000000","192.168.1.166","23.39.213.4","TLSv1.2","5802","Application Data"
"2","0.000074","192.168.1.166","23.39.213.4","TLSv1.2","13592","Application Data"
"3","0.002003","192.168.1.166","23.39.213.4","TLSv1.2","5705","Application Data"
"4","0.033243","23.39.213.4","192.168.1.166","TCP","54","443  >  52183 [ACK] Seq=1 Ack=8669 Win=11747 Len=0"
"5","0.033243","23.39.213.4","192.168.1.166","TCP","54","443  >  52183 [ACK] Seq=1 Ack=13049 Win=11740 Len=0"
"6","0.035417","23.39.213.4","192.168.1.166","TCP","54","443  >  52183 [ACK] Seq=1 Ack=15969 Win=11800 Len=0"
"7","0.039366","23.39.213.4","192.168.1.166","TCP","54","443  >  52183 [ACK] Seq=1 Ack=24938 Win=11752 Len=0"
"8","0.094443","23.39.213.4","192.168.1.166","TLSv1.2","361","Application Data"
"9","0.094443","23.39.213.4","192.168.1.166","TLSv1.2","289","Application Data"
"10","0.094475","192.168.1.166","23.39.213.4","TCP","54","52183  >  443 [ACK] Seq=24938 Ack=543 Win=8191 Len=0"
"11","0.094936","192.168.1.166","23.39.213.4","TLSv1.2","89","Application Data"
"12","0.168506","23.39.213.4","192.168.1.166","TCP","54","443  >  52183 [ACK] Seq=543 Ack=24973 Win=11805 Len=0"
"13","1.030630","23.39.213.4","192.168.1.166","TCP","1514","443  >  52183 [ACK] Seq=543 Ack=24973 Win=11805 Len=1460 [TCP PDU reassembled in 14]"
"14","1.030630","23.39.213.4","192.168.1.166","TLSv1.2","555","Application Data"
"15","1.030630","23.39.213.4","192.168.1.166","TCP","16114","443  >  52183 [ACK] Seq=2504 Ack=24973 Win=11805 Len=16060 [TCP PDU reassembled in 16]"
"16","1.030630","23.39.213.4","192.168.1.166","TLSv1.2","400","Application Data"
"17","1.030630","23.39.213.4","192.168.1.166","TLSv1.2","85","Application Data"
"18","1.030630","23.39.213.4","192.168.1.166","TCP","16114","443  >  52183 [ACK] Seq=18941 Ack=24973 Win=11805 Len=16060 [TCP PDU reassembled in 19]"
"19","1.030630","23.39.213.4","192.168.1.166","TLSv1.2","400","Application Data"
"20","1.030630","23.39.213.4","192.168.1.166","TLSv1.2","13194","Application Data, Application Data"
"21","1.030630","23.39.213.4","192.168.1.166","TLSv1.2","856","Application Data"
"22","1.030729","192.168.1.166","23.39.213.4","TCP","54","52183  >  443 [ACK] Seq=24973 Ack=49289 Win=8191 Len=0"
"23","1.031184","23.39.213.4","192.168.1.166","TCP","1514","443  >  52183 [ACK] Seq=49289 Ack=24973 Win=11805 Len=1460 [TCP PDU reassembled in 28]"
"24","1.031184","23.39.213.4","192.168.1.166","TCP","1514","443  >  52183 [ACK] Seq=50749 Ack=24973 Win=11805 Len=1460 [TCP PDU reassembled in 28]"
"25","1.031184","23.39.213.4","192.168.1.166","TCP","1514","443  >  52183 [ACK] Seq=52209 Ack=24973 Win=11805 Len=1460 [TCP PDU reassembled in 28]"
"26","1.031184","23.39.213.4","192.168.1.166","TCP","1514","443  >  52183 [ACK] Seq=53669 Ack=24973 Win=11805 Len=1460 [TCP PDU reassembled in 28]"
"27","1.031184","23.39.213.4","192.168.1.166","TCP","10274","443  >  52183 [ACK] Seq=55129 Ack=24973 Win=11805 Len=10220 [TCP PDU reassembled in 28]"
"28","1.031184","23.39.213.4","192.168.1.166","TLSv1.2","400","Application Data"
"29","1.031184","23.39.213.4","192.168.1.166","TLSv1.2","85","Application Data"
"30","1.031215","192.168.1.166","23.39.213.4","TCP","54","52183  >  443 [ACK] Seq=24973 Ack=65726 Win=8191 Len=0"
"31","1.031316","23.39.213.4","192.168.1.166","TCP","1514","443  >  52183 [ACK] Seq=65726 Ack=24973 Win=11805 Len=1460 [TCP PDU reassembled in 34]"
"32","1.031316","23.39.213.4","192.168.1.166","TCP","1514","443  >  52183 [ACK] Seq=67186 Ack=24973 Win=11805 Len=1460 [TCP PDU reassembled in 34]"
"33","1.031316","23.39.213.4","192.168.1.166","TCP","1514","443  >  52183 [ACK] Seq=68646 Ack=24973 Win=11805 Len=1460 [TCP PDU reassembled in 34]"
"34","1.031316","23.39.213.4","192.168.1.166","TLSv1.2","828","Application Data"
"35","1.031330","192.168.1.166","23.39.213.4","TCP","54","52183  >  443 [ACK] Seq=24973 Ack=70880 Win=8191 Len=0"
"36","1.033567","23.39.213.4","192.168.1.166","TCP","16114","443  >  52183 [ACK] Seq=70880 Ack=24973 Win=11805 Len=16060 [TCP PDU reassembled in 37]"
"37","1.033567","23.39.213.4","192.168.1.166","TLSv1.2","400","Application Data"
"38","1.033567","23.39.213.4","192.168.1.166","TLSv1.2","85","Application Data"
"39","1.033567","23.39.213.4","192.168.1.166","TCP","5894","443  >  52183 [ACK] Seq=87317 Ack=24973 Win=11805 Len=5840 [TCP PDU reassembled in 40]"
"40","1.033567","23.39.213.4","192.168.1.166","TLSv1.2","506","Application Data"
"41","1.033613","192.168.1.166","23.39.213.4","TCP","54","52183  >  443 [ACK] Seq=24973 Ack=93609 Win=8191 Len=0"
"42","1.038263","192.168.1.166","23.39.213.4","TLSv1.2","5803","Application Data"
"43","1.038307","192.168.1.166","23.39.213.4","TLSv1.2","1795","Application Data"
"44","1.038613","23.39.213.4","192.168.1.166","TCP","16114","443  >  52183 [ACK] Seq=93609 Ack=24973 Win=11805 Len=16060 [TCP PDU reassembled in 45]"
"45","1.038613","23.39.213.4","192.168.1.166","TLSv1.2","400","Application Data"
"46","1.038613","23.39.213.4","192.168.1.166","TLSv1.2","85","Application Data"
"47","1.038613","23.39.213.4","192.168.1.166","TCP","7354","443  >  52183 [ACK] Seq=110046 Ack=24973 Win=11805 Len=7300 [TCP PDU reassembled in 48]"
"48","1.038613","23.39.213.4","192.168.1.166","TLSv1.2","1290","Application Data"
"49","1.038646","192.168.1.166","23.39.213.4","TCP","54","52183  >  443 [ACK] Seq=32463 Ack=118582 Win=8191 Len=0"
"50","1.041140","23.39.213.4","192.168.1.166","TCP","1514","443  >  52183 [ACK] Seq=118582 Ack=24973 Win=11805 Len=1460 [TCP PDU reassembled in 55]"
"51","1.041140","23.39.213.4","192.168.1.166","TCP","1514","443  >  52183 [ACK] Seq=120042 Ack=24973 Win=11805 Len=1460 [TCP PDU reassembled in 55]"
"52","1.041160","192.168.1.166","23.39.213.4","TCP","54","52183  >  443 [ACK] Seq=32463 Ack=121502 Win=8191 Len=0"
"53","1.042258","23.39.213.4","192.168.1.166","TCP","1514","443  >  52183 [ACK] Seq=121502 Ack=24973 Win=11805 Len=1460 [TCP PDU reassembled in 55]"
"54","1.042258","23.39.213.4","192.168.1.166","TCP","1514","443  >  52183 [ACK] Seq=122962 Ack=24973 Win=11805 Len=1460 [TCP PDU reassembled in 55]"
"55","1.042258","23.39.213.4","192.168.1.166","TLSv1.2","59","Application Data"
"56","1.042258","23.39.213.4","192.168.1.166","TLSv1.2","93","Application Data"
"57","1.042258","23.39.213.4","192.168.1.166","TLSv1.2","85","Application Data"
"58","1.042287","192.168.1.166","23.39.213.4","TCP","54","52183  >  443 [ACK] Seq=32463 Ack=124497 Win=8191 Len=0"
"59","1.075309","23.39.213.4","192.168.1.166","TCP","54","443  >  52183 [ACK] Seq=124497 Ack=26433 Win=11800 Len=0"
"60","1.077708","23.39.213.4","192.168.1.166","TCP","54","443  >  52183 [ACK] Seq=124497 Ack=29353 Win=11793 Len=0"
"61","1.077708","23.39.213.4","192.168.1.166","TCP","54","443  >  52183 [ACK] Seq=124497 Ack=30722 Win=11800 Len=0"
"62","1.077708","23.39.213.4","192.168.1.166","TCP","54","443  >  52183 [ACK] Seq=124497 Ack=32182 Win=11793 Len=0"
"63","1.077708","23.39.213.4","192.168.1.166","TCP","54","443  >  52183 [ACK] Seq=124497 Ack=32463 Win=11791 Len=0"
"64","1.080915","192.168.1.166","23.39.213.4","TLSv1.2","5532","Application Data"
"65","1.082427","23.39.213.4","192.168.1.166","TLSv1.2","89","Application Data"
"66","1.112733","23.39.213.4","192.168.1.166","TCP","54","443  >  52183 [ACK] Seq=124532 Ack=33923 Win=11800 Len=0"
"67","1.112733","23.39.213.4","192.168.1.166","TCP","54","443  >  52183 [ACK] Seq=124532 Ack=37941 Win=11787 Len=0"
"68","1.117633","192.168.1.166","23.39.213.4","TLSv1.2","5595","Application Data"
"69","1.126330","23.39.213.4","192.168.1.166","TLSv1.2","1001","Application Data"
"70","1.126564","23.39.213.4","192.168.1.166","TLSv1.2","85","Application Data"
"71","1.126586","192.168.1.166","23.39.213.4","TCP","54","52183  >  443 [ACK] Seq=43482 Ack=125510 Win=8187 Len=0"
"72","1.148967","23.39.213.4","192.168.1.166","TCP","54","443  >  52183 [ACK] Seq=125510 Ack=40861 Win=11793 Len=0"
"73","1.148967","23.39.213.4","192.168.1.166","TCP","54","443  >  52183 [ACK] Seq=125510 Ack=43482 Win=11801 Len=0"
"74","1.159963","23.39.213.4","192.168.1.166","TLSv1.2","373","Application Data"
"75","1.159963","23.39.213.4","192.168.1.166","TLSv1.2","361","Application Data"
"76","1.159963","23.39.213.4","192.168.1.166","TLSv1.2","289","Application Data"
"77","1.159963","23.39.213.4","192.168.1.166","TLSv1.2","85","Application Data"
"78","1.160002","192.168.1.166","23.39.213.4","TCP","54","52183  >  443 [ACK] Seq=43482 Ack=126402 Win=8191 Len=0"
"79","1.337349","192.168.1.166","23.39.213.4","TLSv1.2","5499","Application Data"
"80","1.337410","192.168.1.166","23.39.213.4","TLSv1.2","588","Application Data"
"81","1.370549","23.39.213.4","192.168.1.166","TCP","54","443  >  52183 [ACK] Seq=126402 Ack=48927 Win=11774 Len=0"
"82","1.408979","192.168.1.166","23.39.213.4","TLSv1.2","5500","Application Data"
"83","1.409035","192.168.1.166","23.39.213.4","TLSv1.2","3641","Application Data"
"84","1.411245","23.39.213.4","192.168.1.166","TCP","54","443  >  52183 [ACK] Seq=126402 Ack=49461 Win=11805 Len=0"
"85","1.433410","192.168.1.166","23.39.213.4","TLSv1.2","5499","Application Data"
"86","1.433454","192.168.1.166","23.39.213.4","TLSv1.2","685","Application Data"
"87","1.443507","23.39.213.4","192.168.1.166","TCP","54","443  >  52183 [ACK] Seq=126402 Ack=50921 Win=11800 Len=0"
"88","1.443507","23.39.213.4","192.168.1.166","TCP","54","443  >  52183 [ACK] Seq=126402 Ack=54907 Win=11779 Len=0"
"89","1.443507","23.39.213.4","192.168.1.166","TCP","54","443  >  52183 [ACK] Seq=126402 Ack=56367 Win=11772 Len=0"
"90","1.443507","23.39.213.4","192.168.1.166","TCP","54","443  >  52183 [ACK] Seq=126402 Ack=58494 Win=11760 Len=0"
"91","1.466712","23.39.213.4","192.168.1.166","TCP","54","443  >  52183 [ACK] Seq=126402 Ack=59954 Win=11800 Len=0"
"92","1.467883","23.39.213.4","192.168.1.166","TCP","54","443  >  52183 [ACK] Seq=126402 Ack=64570 Win=11775 Len=0"
"93","1.479310","23.39.213.4","192.168.1.166","TLSv1.2","956","Application Data"
"94","1.479310","23.39.213.4","192.168.1.166","TLSv1.2","561","Application Data"
"95","1.479353","192.168.1.166","23.39.213.4","TCP","54","52183  >  443 [ACK] Seq=64570 Ack=127811 Win=8186 Len=0"
"96","1.572446","23.39.213.4","192.168.1.166","TLSv1.2","953","Application Data"
"97","1.572446","23.39.213.4","192.168.1.166","TLSv1.2","173","Application Data"
"98","1.572478","192.168.1.166","23.39.213.4","TCP","54","52183  >  443 [ACK] Seq=64570 Ack=128829 Win=8191 Len=0"
"99","1.591058","192.168.1.166","23.39.213.4","TLSv1.2","5387","Application Data"
"100","1.591125","192.168.1.166","23.39.213.4","TLSv1.2","391","Application Data"
"101","1.592875","192.168.1.166","23.39.213.4","TLSv1.2","5503","Application Data"
"102","1.592978","192.168.1.166","23.39.213.4","TLSv1.2","5503","Application Data"
"103","1.593016","192.168.1.166","23.39.213.4","TLSv1.2","3223","Application Data"
"104","1.593032","192.168.1.166","23.39.213.4","TLSv1.2","1469","Application Data"
"105","1.610550","192.168.1.166","23.39.213.4","TLSv1.2","5394","Application Data"
"106","1.611025","192.168.1.166","23.39.213.4","TLSv1.2","5387","Application Data"
"107","1.611656","192.168.1.166","23.39.213.4","TLSv1.2","5411","Application Data"
"108","1.626806","23.39.213.4","192.168.1.166","TCP","54","443  >  52183 [ACK] Seq=128829 Ack=67490 Win=11793 Len=0"
"109","1.626806","23.39.213.4","192.168.1.166","TCP","54","443  >  52183 [ACK] Seq=128829 Ack=70240 Win=11776 Len=0"
"110","1.626806","23.39.213.4","192.168.1.166","TCP","54","443  >  52183 [ACK] Seq=128829 Ack=73160 Win=11800 Len=0"
"111","1.626806","23.39.213.4","192.168.1.166","TCP","54","443  >  52183 [ACK] Seq=128829 Ack=81138 Win=11766 Len=0"
"112","1.626806","23.39.213.4","192.168.1.166","TCP","54","443  >  52183 [ACK] Seq=128829 Ack=84307 Win=11790 Len=0"
"113","1.626806","23.39.213.4","192.168.1.166","TCP","54","443  >  52183 [ACK] Seq=128829 Ack=85722 Win=11805 Len=0"
"114","1.626806","23.39.213.4","192.168.1.166","TLSv1.2","955","Application Data"
"115","1.626806","23.39.213.4","192.168.1.166","TLSv1.2","1512","Application Data"
"116","1.626806","23.39.213.4","192.168.1.166","TLSv1.2","1192","Application Data"
"117","1.626863","192.168.1.166","23.39.213.4","TCP","54","52183  >  443 [ACK] Seq=101752 Ack=132326 Win=8191 Len=0"
"118","1.644705","23.39.213.4","192.168.1.166","TCP","54","443  >  52183 [ACK] Seq=132326 Ack=96395 Win=11759 Len=0"
"119","1.644705","23.39.213.4","192.168.1.166","TCP","54","443  >  52183 [ACK] Seq=132326 Ack=99315 Win=11744 Len=0"
"120","1.644996","23.39.213.4","192.168.1.166","TCP","54","443  >  52183 [ACK] Seq=132326 Ack=101752 Win=11802 Len=0"
"121","1.688220","23.39.213.4","192.168.1.166","TLSv1.2","484","Application Data"
"122","1.688220","23.39.213.4","192.168.1.166","TCP","1514","443  >  52183 [ACK] Seq=132756 Ack=101752 Win=11805 Len=1460 [TCP PDU reassembled in 123]"
"123","1.688220","23.39.213.4","192.168.1.166","TLSv1.2","74","Application Data"
"124","1.688257","192.168.1.166","23.39.213.4","TCP","54","52183  >  443 [ACK] Seq=101752 Ack=134236 Win=8191 Len=0"
"125","1.716905","23.39.213.4","192.168.1.166","TLSv1.2","953","Application Data"
"126","1.716905","23.39.213.4","192.168.1.166","TLSv1.2","197","Application Data"
"127","1.716945","192.168.1.166","23.39.213.4","TCP","54","52183  >  443 [ACK] Seq=101752 Ack=135278 Win=8187 Len=0"
"128","1.729976","23.39.213.4","192.168.1.166","TLSv1.2","484","Application Data"
"129","1.729976","23.39.213.4","192.168.1.166","TLSv1.2","448","Application Data"
"130","1.730012","192.168.1.166","23.39.213.4","TCP","54","52183  >  443 [ACK] Seq=101752 Ack=136102 Win=8191 Len=0"
"131","1.731943","23.39.213.4","192.168.1.166","TLSv1.2","484","Application Data"
"132","1.731943","23.39.213.4","192.168.1.166","TLSv1.2","639","Application Data"
"133","1.731964","192.168.1.166","23.39.213.4","TCP","54","52183  >  443 [ACK] Seq=101752 Ack=137117 Win=8187 Len=0"
"134","1.757497","23.39.213.4","192.168.1.166","TLSv1.2","953","Application Data"
"135","1.757497","23.39.213.4","192.168.1.166","TLSv1.2","1511","Application Data"
"136","1.757497","23.39.213.4","192.168.1.166","TCP","8814","443  >  52183 [ACK] Seq=139473 Ack=101752 Win=11805 Len=8760 [TCP PDU reassembled in 137]"
"137","1.757497","23.39.213.4","192.168.1.166","TLSv1.2","713","Application Data"
"138","1.757542","192.168.1.166","23.39.213.4","TCP","54","52183  >  443 [ACK] Seq=101752 Ack=148892 Win=8191 Len=0"
"139","1.759843","192.168.1.166","23.39.213.4","TLSv1.2","5385","Application Data"
"140","1.759882","192.168.1.166","23.39.213.4","TLSv1.2","317","Application Data"
"141","1.765931","23.39.213.4","192.168.1.166","TLSv1.2","953","Application Data"
"142","1.765931","23.39.213.4","192.168.1.166","TLSv1.2","1097","Application Data"
"143","1.765961","192.168.1.166","23.39.213.4","TCP","54","52183  >  443 [ACK] Seq=107346 Ack=150834 Win=8191 Len=0"
"144","1.777705","192.168.1.166","23.39.213.4","TLSv1.2","5502","Application Data"
"145","1.777748","192.168.1.166","23.39.213.4","TLSv1.2","411","Application Data"
"146","1.778339","192.168.1.166","23.39.213.4","TLSv1.2","5502","Application Data"
"147","1.778381","192.168.1.166","23.39.213.4","TLSv1.2","2030","Application Data"
"148","1.793546","23.39.213.4","192.168.1.166","TCP","54","443  >  52183 [ACK] Seq=150834 Ack=106132 Win=11805 Len=0"
"149","1.793546","23.39.213.4","192.168.1.166","TCP","54","443  >  52183 [ACK] Seq=150834 Ack=107346 Win=11805 Len=0"
"150","1.809758","23.39.213.4","192.168.1.166","TCP","54","443  >  52183 [ACK] Seq=150834 Ack=113151 Win=11783 Len=0"
"151","1.814079","23.39.213.4","192.168.1.166","TCP","54","443  >  52183 [ACK] Seq=150834 Ack=118599 Win=11787 Len=0"
"152","1.814079","23.39.213.4","192.168.1.166","TCP","54","443  >  52183 [ACK] Seq=150834 Ack=120575 Win=11796 Len=0"
"153","1.889349","23.39.213.4","192.168.1.166","TLSv1.2","961","Application Data"
"154","1.889349","23.39.213.4","192.168.1.166","TLSv1.2","244","Application Data"
"155","1.889376","192.168.1.166","23.39.213.4","TCP","54","52183  >  443 [ACK] Seq=120575 Ack=151931 Win=8187 Len=0"
"156","1.898925","23.39.213.4","192.168.1.166","TLSv1.2","957","Application Data"
"157","1.898925","23.39.213.4","192.168.1.166","TLSv1.2","284","Application Data"
"158","1.898945","192.168.1.166","23.39.213.4","TCP","54","52183  >  443 [ACK] Seq=120575 Ack=153064 Win=8191 Len=0"
"159","1.915854","192.168.1.166","23.39.213.4","TLSv1.2","5403","Application Data"
"160","1.915917","23.39.213.4","192.168.1.166","TLSv1.2","954","Application Data"
"161","1.915917","23.39.213.4","192.168.1.166","TLSv1.2","1513","Application Data"
"162","1.915917","23.39.213.4","192.168.1.166","TLSv1.2","316","Application Data"
"163","1.915950","192.168.1.166","23.39.213.4","TCP","54","52183  >  443 [ACK] Seq=125924 Ack=155685 Win=8191 Len=0"
"164","1.945935","192.168.1.166","23.39.213.4","TLSv1.2","5503","Application Data"
"165","1.946053","192.168.1.166","23.39.213.4","TLSv1.2","5504","Application Data"
"166","1.946077","192.168.1.166","23.39.213.4","TLSv1.2","487","Application Data"
"167","1.946092","192.168.1.166","23.39.213.4","TLSv1.2","382","Application Data"
"168","1.952888","23.39.213.4","192.168.1.166","TCP","54","443  >  52183 [ACK] Seq=155685 Ack=123495 Win=11793 Len=0"
"169","1.952888","23.39.213.4","192.168.1.166","TCP","54","443  >  52183 [ACK] Seq=155685 Ack=125924 Win=11795 Len=0"
"170","1.961184","192.168.1.166","23.39.213.4","TLSv1.2","5463","Application Data"
"171","1.961250","192.168.1.166","23.39.213.4","TLSv1.2","186","Application Data"
"172","1.966193","192.168.1.166","23.39.213.4","TLSv1.2","5504","Application Data"
"173","1.966251","192.168.1.166","23.39.213.4","TLSv1.2","898","Application Data"
"174","1.979911","23.39.213.4","192.168.1.166","TCP","54","443  >  52183 [ACK] Seq=155685 Ack=137256 Win=11747 Len=0"
"175","1.994672","23.39.213.4","192.168.1.166","TCP","54","443  >  52183 [ACK] Seq=155685 Ack=139044 Win=11800 Len=0"
"176","1.997783","23.39.213.4","192.168.1.166","TCP","54","443  >  52183 [ACK] Seq=155685 Ack=143125 Win=11777 Len=0"
"177","1.998015","23.39.213.4","192.168.1.166","TCP","54","443  >  52183 [ACK] Seq=155685 Ack=146045 Win=11793 Len=0"
"178","1.998015","23.39.213.4","192.168.1.166","TCP","54","443  >  52183 [ACK] Seq=155685 Ack=148575 Win=11794 Len=0"
"179","2.001149","23.39.213.4","192.168.1.166","TLSv1.2","485","Application Data"
"180","2.001149","23.39.213.4","192.168.1.166","TCP","1514","443  >  52183 [ACK] Seq=156116 Ack=149419 Win=11805 Len=1460 [TCP PDU reassembled in 181]"
"181","2.001149","23.39.213.4","192.168.1.166","TLSv1.2","526","Application Data"
"182","2.001190","192.168.1.166","23.39.213.4","TCP","54","52183  >  443 [ACK] Seq=149419 Ack=158048 Win=8191 Len=0"
"183","2.016386","192.168.1.166","23.39.213.4","TLSv1.2","5510","Application Data"
"184","2.016455","192.168.1.166","23.39.213.4","TLSv1.2","710","Application Data"
"185","2.047577","23.39.213.4","192.168.1.166","TCP","54","443  >  52183 [ACK] Seq=158048 Ack=152339 Win=11793 Len=0"
"186","2.047577","23.39.213.4","192.168.1.166","TCP","54","443  >  52183 [ACK] Seq=158048 Ack=154875 Win=11794 Len=0"
"187","2.061435","23.39.213.4","192.168.1.166","TLSv1.2","418","Application Data"
"188","2.061435","23.39.213.4","192.168.1.166","TLSv1.2","254","Application Data"
"189","2.061435","23.39.213.4","192.168.1.166","TLSv1.2","957","Application Data"
"190","2.061435","23.39.213.4","192.168.1.166","TLSv1.2","1514","Application Data"
"191","2.061435","23.39.213.4","192.168.1.166","TLSv1.2","886","Application Data"
"192","2.061485","192.168.1.166","23.39.213.4","TCP","54","52183  >  443 [ACK] Seq=155531 Ack=161807 Win=8191 Len=0"
"193","2.062916","192.168.1.166","23.39.213.4","TLSv1.2","5472","Application Data"
"194","2.063100","192.168.1.166","23.39.213.4","TLSv1.2","5522","Application Data"
"195","2.067671","192.168.1.166","23.39.213.4","TLSv1.2","5512","Application Data"
"196","2.067728","192.168.1.166","23.39.213.4","TLSv1.2","1069","Application Data"
"197","2.070645","192.168.1.166","23.39.213.4","TLSv1.2","5383","Application Data"
"198","2.072053","192.168.1.166","23.39.213.4","TLSv1.2","5375","Application Data"
"199","2.072781","192.168.1.166","23.39.213.4","TLSv1.2","5411","Application Data"
"200","2.073821","192.168.1.166","23.39.213.4","TLSv1.2","5498","Application Data"
"201","2.095996","23.39.213.4","192.168.1.166","TCP","54","443  >  52183 [ACK] Seq=161807 Ack=166417 Win=11758 Len=0"
"202","2.100997","23.39.213.4","192.168.1.166","TCP","54","443  >  52183 [ACK] Seq=161807 Ack=169337 Win=11793 Len=0"
"203","2.120655","23.39.213.4","192.168.1.166","TLSv1.2","957","Application Data"
"204","2.120655","23.39.213.4","192.168.1.166","TCP","16114","443  >  52183 [ACK] Seq=162710 Ack=194341 Win=11660 Len=16060 [TCP PDU reassembled in 205]"
"205","2.120655","23.39.213.4","192.168.1.166","TLSv1.2","400","Application Data"
"206","2.120655","23.39.213.4","192.168.1.166","TLSv1.2","85","Application Data"
"207","2.120655","23.39.213.4","192.168.1.166","TCP","4434","443  >  52183 [ACK] Seq=179147 Ack=194341 Win=11660 Len=4380 [TCP PDU reassembled in 213]"
"208","2.120709","192.168.1.166","23.39.213.4","TCP","54","52183  >  443 [ACK] Seq=194341 Ack=183527 Win=8191 Len=0"
"209","2.123566","23.39.213.4","192.168.1.166","TCP","1514","443  >  52183 [ACK] Seq=183527 Ack=194341 Win=11660 Len=1460 [TCP PDU reassembled in 213]"
"210","2.123566","23.39.213.4","192.168.1.166","TCP","1514","443  >  52183 [ACK] Seq=184987 Ack=194341 Win=11660 Len=1460 [TCP PDU reassembled in 213]"
"211","2.123566","23.39.213.4","192.168.1.166","TCP","1514","443  >  52183 [ACK] Seq=186447 Ack=194341 Win=11660 Len=1460 [TCP PDU reassembled in 213]"
"212","2.123566","23.39.213.4","192.168.1.166","TCP","7354","443  >  52183 [ACK] Seq=187907 Ack=194341 Win=11660 Len=7300 [TCP PDU reassembled in 213]"
"213","2.123566","23.39.213.4","192.168.1.166","TLSv1.2","400","Application Data"
"214","2.123566","23.39.213.4","192.168.1.166","TLSv1.2","439","Application Data, Application Data"
"215","2.123566","23.39.213.4","192.168.1.166","TLSv1.2","246","Application Data"
"216","2.123600","192.168.1.166","23.39.213.4","TCP","54","52183  >  443 [ACK] Seq=194341 Ack=196130 Win=8191 Len=0"
"217","2.137651","192.168.1.166","23.39.213.4","TLSv1.2","5409","Application Data"
"218","2.138247","192.168.1.166","23.39.213.4","TLSv1.2","5381","Application Data"
"219","2.149982","23.39.213.4","192.168.1.166","TLSv1.2","955","Application Data"
"220","2.149982","23.39.213.4","192.168.1.166","TLSv1.2","715","Application Data"
"221","2.149982","23.39.213.4","192.168.1.166","TLSv1.2","955","Application Data"
"222","2.149982","23.39.213.4","192.168.1.166","TLSv1.2","274","Application Data"
"223","2.149982","23.39.213.4","192.168.1.166","TLSv1.2","483","Application Data"
"224","2.149982","23.39.213.4","192.168.1.166","TLSv1.2","196","Application Data"
"225","2.150029","192.168.1.166","23.39.213.4","TCP","54","52183  >  443 [ACK] Seq=205023 Ack=199384 Win=8191 Len=0"
"226","2.163284","23.39.213.4","192.168.1.166","TLSv1.2","485","Application Data"
"227","2.163284","23.39.213.4","192.168.1.166","TLSv1.2","948","Application Data"
"228","2.163325","192.168.1.166","23.39.213.4","TCP","54","52183  >  443 [ACK] Seq=205023 Ack=200709 Win=8186 Len=0"
"229","2.173988","23.39.213.4","192.168.1.166","TCP","54","443  >  52183 [ACK] Seq=200709 Ack=205023 Win=11751 Len=0"
"230","2.194759","23.39.213.4","192.168.1.166","TLSv1.2","484","Application Data"
"231","2.194759","23.39.213.4","192.168.1.166","TLSv1.2","775","Application Data"
"232","2.194791","192.168.1.166","23.39.213.4","TCP","54","52183  >  443 [ACK] Seq=205023 Ack=201860 Win=8191 Len=0"
"233","2.210251","23.39.213.4","192.168.1.166","TLSv1.2","484","Application Data"
"234","2.210251","23.39.213.4","192.168.1.166","TLSv1.2","651","Application Data"
"235","2.210291","192.168.1.166","23.39.213.4","TCP","54","52183  >  443 [ACK] Seq=205023 Ack=202887 Win=8187 Len=0"
"236","2.213759","23.39.213.4","192.168.1.166","TLSv1.2","485","Application Data"
"237","2.213759","23.39.213.4","192.168.1.166","TCP","1514","443  >  52183 [ACK] Seq=203318 Ack=205023 Win=11805 Len=1460 [TCP PDU reassembled in 238]"
"238","2.213759","23.39.213.4","192.168.1.166","TLSv1.2","529","Application Data"
"239","2.213800","192.168.1.166","23.39.213.4","TCP","54","52183  >  443 [ACK] Seq=205023 Ack=205253 Win=8191 Len=0"
"240","2.219416","23.39.213.4","192.168.1.166","TLSv1.2","483","Application Data"
"241","2.219416","23.39.213.4","192.168.1.166","TLSv1.2","193","Application Data"
"242","2.219446","192.168.1.166","23.39.213.4","TCP","54","52183  >  443 [ACK] Seq=205023 Ack=205821 Win=8189 Len=0"
"243","2.222957","23.39.213.4","192.168.1.166","TLSv1.2","484","Application Data"
"244","2.222957","23.39.213.4","192.168.1.166","TLSv1.2","1084","Application Data"
"245","2.222990","192.168.1.166","23.39.213.4","TCP","54","52183  >  443 [ACK] Seq=205023 Ack=207281 Win=8191 Len=0"
"246","2.225586","23.39.213.4","192.168.1.166","TLSv1.2","484","Application Data"
"247","2.225586","23.39.213.4","192.168.1.166","TLSv1.2","449","Application Data"
"248","2.225613","192.168.1.166","23.39.213.4","TCP","54","52183  >  443 [ACK] Seq=205023 Ack=208106 Win=8188 Len=0"
"249","2.253332","192.168.1.166","23.39.213.4","TLSv1.2","5655","Application Data"
"250","2.253425","192.168.1.166","23.39.213.4","TLSv1.2","5423","Application Data"
"251","2.253450","192.168.1.166","23.39.213.4","TLSv1.2","3962","Application Data"
"252","2.253467","192.168.1.166","23.39.213.4","TLSv1.2","253","Application Data"
"253","2.272991","192.168.1.166","23.39.213.4","TLSv1.2","5655","Application Data"
"254","2.273044","192.168.1.166","23.39.213.4","TLSv1.2","3958","Application Data"
"255","2.273474","192.168.1.166","23.39.213.4","TLSv1.2","5511","Application Data"
"256","2.273517","192.168.1.166","23.39.213.4","TLSv1.2","579","Application Data"
"257","2.282194","192.168.1.166","23.39.213.4","TLSv1.2","5511","Application Data"
"258","2.282262","192.168.1.166","23.39.213.4","TLSv1.2","653","Application Data"
"259","2.286393","23.39.213.4","192.168.1.166","TCP","54","443  >  52183 [ACK] Seq=208106 Ack=215993 Win=11758 Len=0"
"260","2.286393","23.39.213.4","192.168.1.166","TCP","54","443  >  52183 [ACK] Seq=208106 Ack=219901 Win=11787 Len=0"
"261","2.305887","23.39.213.4","192.168.1.166","TCP","54","443  >  52183 [ACK] Seq=208106 Ack=221560 Win=11800 Len=0"
"262","2.312881","23.39.213.4","192.168.1.166","TCP","54","443  >  52183 [ACK] Seq=208106 Ack=235587 Win=11725 Len=0"
"263","2.315755","23.39.213.4","192.168.1.166","TCP","54","443  >  52183 [ACK] Seq=208106 Ack=241044 Win=11779 Len=0"
"264","2.340874","23.39.213.4","192.168.1.166","TLSv1.2","361","Application Data"
"265","2.340874","23.39.213.4","192.168.1.166","TLSv1.2","289","Application Data"
"266","2.340906","192.168.1.166","23.39.213.4","TCP","54","52183  >  443 [ACK] Seq=241643 Ack=208648 Win=8186 Len=0"
"267","2.348295","23.39.213.4","192.168.1.166","TLSv1.2","361","Application Data"
"268","2.348295","23.39.213.4","192.168.1.166","TLSv1.2","289","Application Data"
"269","2.348313","192.168.1.166","23.39.213.4","TCP","54","52183  >  443 [ACK] Seq=241643 Ack=209190 Win=8191 Len=0"
"270","2.353427","192.168.1.166","23.39.213.4","TLSv1.2","5401","Application Data"
"271","2.353472","192.168.1.166","23.39.213.4","TLSv1.2","5489","Application Data"
"272","2.388604","23.39.213.4","192.168.1.166","TCP","54","443  >  52183 [ACK] Seq=209190 Ack=252425 Win=11751 Len=0"
"273","2.405919","23.39.213.4","192.168.1.166","TLSv1.2","953","Application Data"
"274","2.405919","23.39.213.4","192.168.1.166","TLSv1.2","402","Application Data"
"275","2.405953","192.168.1.166","23.39.213.4","TCP","54","52183  >  443 [ACK] Seq=252425 Ack=210437 Win=8187 Len=0"
"276","2.408821","23.39.213.4","192.168.1.166","TLSv1.2","957","Application Data"
"277","2.408821","23.39.213.4","192.168.1.166","TLSv1.2","565","Application Data"
"278","2.408849","192.168.1.166","23.39.213.4","TCP","54","52183  >  443 [ACK] Seq=252425 Ack=211851 Win=8191 Len=0"
"279","2.422667","192.168.1.166","23.39.213.4","TLSv1.2","5362","Application Data"
"280","2.422731","192.168.1.166","23.39.213.4","TLSv1.2","817","Application Data"
"281","2.424109","192.168.1.166","23.39.213.4","TLSv1.2","5376","Application Data"
"282","2.424149","192.168.1.166","23.39.213.4","TLSv1.2","904","Application Data"
"283","2.424981","192.168.1.166","23.39.213.4","TLSv1.2","5512","Application Data"
"284","2.425026","192.168.1.166","23.39.213.4","TLSv1.2","2296","Application Data"
"285","2.430071","23.39.213.4","192.168.1.166","TLSv1.2","374","Application Data"
"286","2.430071","23.39.213.4","192.168.1.166","TLSv1.2","85","Application Data"
"287","2.430087","192.168.1.166","23.39.213.4","TCP","54","52183  >  443 [ACK] Seq=272368 Ack=212202 Win=8190 Len=0"
"288","2.432679","23.39.213.4","192.168.1.166","TLSv1.2","956","Application Data"
"289","2.432679","23.39.213.4","192.168.1.166","TLSv1.2","174","Application Data"
"290","2.432699","192.168.1.166","23.39.213.4","TCP","54","52183  >  443 [ACK] Seq=272368 Ack=213224 Win=8186 Len=0"
"291","2.433596","23.39.213.4","192.168.1.166","TLSv1.2","959","Application Data"
"292","2.433596","23.39.213.4","192.168.1.166","TLSv1.2","174","Application Data"
"293","2.433611","192.168.1.166","23.39.213.4","TCP","54","52183  >  443 [ACK] Seq=272368 Ack=214249 Win=8191 Len=0"
"294","2.437315","192.168.1.166","23.39.213.4","TLSv1.2","5514","Application Data"
"295","2.437366","192.168.1.166","23.39.213.4","TLSv1.2","4300","Application Data"
"296","2.455328","23.39.213.4","192.168.1.166","TCP","54","443  >  52183 [ACK] Seq=214249 Ack=258496 Win=11782 Len=0"
"297","2.456902","23.39.213.4","192.168.1.166","TCP","54","443  >  52183 [ACK] Seq=214249 Ack=263818 Win=11787 Len=0"
"298","2.456902","23.39.213.4","192.168.1.166","TCP","54","443  >  52183 [ACK] Seq=214249 Ack=269048 Win=11759 Len=0"
"299","2.459827","23.39.213.4","192.168.1.166","TCP","54","443  >  52183 [ACK] Seq=214249 Ack=271586 Win=11800 Len=0"
"300","2.476897","23.39.213.4","192.168.1.166","TCP","54","443  >  52183 [ACK] Seq=214249 Ack=282074 Win=11745 Len=0"
"301","2.486966","23.39.213.4","192.168.1.166","TLSv1.2","89","Application Data"
"302","2.508313","23.39.213.4","192.168.1.166","TLSv1.2","361","Application Data"
"303","2.508313","23.39.213.4","192.168.1.166","TLSv1.2","85","Application Data"
"304","2.508339","192.168.1.166","23.39.213.4","TCP","54","52183  >  443 [ACK] Seq=282074 Ack=214622 Win=8190 Len=0"
"305","2.512254","192.168.1.166","23.39.213.4","TLSv1.2","5658","Application Data"
"306","2.512287","192.168.1.166","23.39.213.4","TLSv1.2","2236","Application Data"
"307","2.519180","23.39.213.4","192.168.1.166","TLSv1.2","438","Application Data"
"308","2.519180","23.39.213.4","192.168.1.166","TLSv1.2","743","Application Data"
"309","2.519203","192.168.1.166","23.39.213.4","TCP","54","52183  >  443 [ACK] Seq=289860 Ack=215695 Win=8186 Len=0"
"310","2.545543","23.39.213.4","192.168.1.166","TCP","54","443  >  52183 [ACK] Seq=215695 Ack=289860 Win=11774 Len=0"
"311","2.618261","23.39.213.4","192.168.1.166","TLSv1.2","361","Application Data"
"312","2.618261","23.39.213.4","192.168.1.166","TLSv1.2","289","Application Data"
"313","2.618296","192.168.1.166","23.39.213.4","TCP","54","52183  >  443 [ACK] Seq=289860 Ack=216237 Win=8191 Len=0"
"314","2.653645","23.39.213.4","192.168.1.166","TLSv1.2","955","Application Data"
"315","2.653645","23.39.213.4","192.168.1.166","TLSv1.2","1511","Application Data"
"316","2.653710","192.168.1.166","23.39.213.4","TCP","54","52183  >  443 [ACK] Seq=289860 Ack=218595 Win=8191 Len=0"
"317","2.654226","23.39.213.4","192.168.1.166","TLSv1.2","720","Application Data"
"318","2.672819","192.168.1.166","23.39.213.4","TLSv1.2","5510","Application Data"
"319","2.672875","192.168.1.166","23.39.213.4","TLSv1.2","474","Application Data"
"320","2.677272","192.168.1.166","23.39.213.4","TLSv1.2","5510","Application Data"
"321","2.677335","192.168.1.166","23.39.213.4","TLSv1.2","1704","Application Data"
"322","2.714579","23.39.213.4","192.168.1.166","TCP","54","443  >  52183 [ACK] Seq=219261 Ack=302842 Win=11737 Len=0"
"323","2.803138","23.39.213.4","192.168.1.166","TLSv1.2","960","Application Data"
"324","2.803138","23.39.213.4","192.168.1.166","TLSv1.2","1507","Application Data"
"325","2.803163","192.168.1.166","23.39.213.4","TCP","54","52183  >  443 [ACK] Seq=302842 Ack=221620 Win=8191 Len=0"
"326","2.804211","23.39.213.4","192.168.1.166","TCP","1514","443  >  52183 [ACK] Seq=221620 Ack=302842 Win=11805 Len=1460 [TCP PDU reassembled in 329]"
"327","2.804211","23.39.213.4","192.168.1.166","TCP","1514","443  >  52183 [ACK] Seq=223080 Ack=302842 Win=11805 Len=1460 [TCP PDU reassembled in 329]"
"328","2.804211","23.39.213.4","192.168.1.166","TCP","8814","443  >  52183 [ACK] Seq=224540 Ack=302842 Win=11805 Len=8760 [TCP PDU reassembled in 329]"
"329","2.804211","23.39.213.4","192.168.1.166","TLSv1.2","123","Application Data"
"330","2.804240","192.168.1.166","23.39.213.4","TCP","54","52183  >  443 [ACK] Seq=302842 Ack=233369 Win=8191 Len=0"
"331","2.805737","192.168.1.166","23.39.213.4","TLSv1.2","5376","Application Data"
"332","2.805772","192.168.1.166","23.39.213.4","TLSv1.2","862","Application Data"
"333","2.811649","23.39.213.4","192.168.1.166","TLSv1.2","943","Application Data"
"334","2.811649","23.39.213.4","192.168.1.166","TLSv1.2","767","Application Data"
"335","2.811670","192.168.1.166","23.39.213.4","TCP","54","52183  >  443 [ACK] Seq=308972 Ack=234971 Win=8191 Len=0"
"336","2.825330","23.39.213.4","192.168.1.166","TLSv1.2","959","Application Data"
"337","2.825330","23.39.213.4","192.168.1.166","TCP","1514","443  >  52183 [ACK] Seq=235876 Ack=302842 Win=11805 Len=1460 [TCP PDU reassembled in 338]"
"338","2.825330","23.39.213.4","192.168.1.166","TLSv1.2","56","Application Data"
"339","2.825330","23.39.213.4","192.168.1.166","TLSv1.2","1261","Application Data"
"340","2.825361","192.168.1.166","23.39.213.4","TCP","54","52183  >  443 [ACK] Seq=308972 Ack=238545 Win=8191 Len=0"
"341","2.839658","23.39.213.4","192.168.1.166","TCP","54","443  >  52183 [ACK] Seq=238545 Ack=305762 Win=11793 Len=0"
"342","2.839658","23.39.213.4","192.168.1.166","TCP","54","443  >  52183 [ACK] Seq=238545 Ack=308164 Win=11795 Len=0"
"343","2.871104","192.168.1.166","23.39.213.4","TLSv1.2","5514","Application Data"
"344","2.871169","192.168.1.166","23.39.213.4","TLSv1.2","2296","Application Data"
"345","2.881564","23.39.213.4","192.168.1.166","TCP","54","443  >  52183 [ACK] Seq=238545 Ack=308972 Win=11805 Len=0"
"346","2.894956","23.39.213.4","192.168.1.166","TLSv1.2","438","Application Data"
"347","2.894956","23.39.213.4","192.168.1.166","TLSv1.2","731","Application Data"
"348","2.894979","192.168.1.166","23.39.213.4","TCP","54","52183  >  443 [ACK] Seq=316674 Ack=239606 Win=8187 Len=0"
"349","2.905539","23.39.213.4","192.168.1.166","TCP","54","443  >  52183 [ACK] Seq=239606 Ack=311892 Win=11793 Len=0"
"350","2.905539","23.39.213.4","192.168.1.166","TCP","54","443  >  52183 [ACK] Seq=239606 Ack=314432 Win=11794 Len=0"
"351","2.905539","23.39.213.4","192.168.1.166","TCP","54","443  >  52183 [ACK] Seq=239606 Ack=316674 Win=11782 Len=0"
"352","3.090920","23.39.213.4","192.168.1.166","TLSv1.2","954","Application Data"
"353","3.090920","23.39.213.4","192.168.1.166","TLSv1.2","1511","Application Data"
"354","3.090920","23.39.213.4","192.168.1.166","TCP","11734","443  >  52183 [ACK] Seq=241963 Ack=316674 Win=11805 Len=11680 [TCP PDU reassembled in 355]"
"355","3.090920","23.39.213.4","192.168.1.166","TLSv1.2","288","Application Data"
"356","3.090969","192.168.1.166","23.39.213.4","TCP","54","52183  >  443 [ACK] Seq=316674 Ack=253877 Win=8191 Len=0"
"357","3.095162","192.168.1.166","23.39.213.4","TLSv1.2","5508","Application Data"
"358","3.095211","192.168.1.166","23.39.213.4","TLSv1.2","2070","Application Data"
"359","3.128685","23.39.213.4","192.168.1.166","TCP","54","443  >  52183 [ACK] Seq=253877 Ack=322128 Win=11805 Len=0"
"360","3.128685","23.39.213.4","192.168.1.166","TCP","54","443  >  52183 [ACK] Seq=253877 Ack=324144 Win=11796 Len=0"
"361","3.267499","23.39.213.4","192.168.1.166","TLSv1.2","954","Application Data"
"362","3.267499","23.39.213.4","192.168.1.166","TLSv1.2","1513","Application Data"
"363","3.267499","23.39.213.4","192.168.1.166","TCP","7354","443  >  52183 [ACK] Seq=256236 Ack=324144 Win=11805 Len=7300 [TCP PDU reassembled in 364]"
"364","3.267499","23.39.213.4","192.168.1.166","TLSv1.2","639","Application Data"
"365","3.267540","192.168.1.166","23.39.213.4","TCP","54","52183  >  443 [ACK] Seq=324144 Ack=256236 Win=8191 Len=0"
"366","3.267568","192.168.1.166","23.39.213.4","TCP","54","52183  >  443 [ACK] Seq=324144 Ack=264121 Win=8191 Len=0"
"367","3.301568","192.168.1.166","23.39.213.4","TLSv1.2","5371","Application Data"
"368","3.301638","192.168.1.166","23.39.213.4","TLSv1.2","5374","Application Data"
"369","3.301656","192.168.1.166","23.39.213.4","TLSv1.2","796","Application Data"
"370","3.301669","192.168.1.166","23.39.213.4","TLSv1.2","1641","Application Data"
"371","3.313842","192.168.1.166","23.39.213.4","TLSv1.2","5509","Application Data"
"372","3.313884","192.168.1.166","23.39.213.4","TLSv1.2","772","Application Data"
"373","3.322188","192.168.1.166","23.39.213.4","TLSv1.2","5399","Application Data"
"374","3.322231","192.168.1.166","23.39.213.4","TLSv1.2","723","Application Data"
"375","3.333029","23.39.213.4","192.168.1.166","TCP","54","443  >  52183 [ACK] Seq=264121 Ack=329461 Win=11780 Len=0"
"376","3.336005","23.39.213.4","192.168.1.166","TCP","54","443  >  52183 [ACK] Seq=264121 Ack=334781 Win=11780 Len=0"
"377","3.343419","23.39.213.4","192.168.1.166","TCP","54","443  >  52183 [ACK] Seq=264121 Ack=337110 Win=11765 Len=0"
"378","3.346470","23.39.213.4","192.168.1.166","TCP","54","443  >  52183 [ACK] Seq=264121 Ack=340030 Win=11793 Len=0"
"379","3.358411","23.39.213.4","192.168.1.166","TCP","54","443  >  52183 [ACK] Seq=264121 Ack=349297 Win=11742 Len=0"
"380","3.395801","23.39.213.4","192.168.1.166","TLSv1.2","374","Application Data"
"381","3.397333","23.39.213.4","192.168.1.166","TLSv1.2","85","Application Data"
"382","3.397345","192.168.1.166","23.39.213.4","TCP","54","52183  >  443 [ACK] Seq=349297 Ack=264472 Win=8190 Len=0"
"383","3.414096","23.39.213.4","192.168.1.166","TLSv1.2","437","Application Data"
"384","3.414096","23.39.213.4","192.168.1.166","TLSv1.2","885","Application Data"
"385","3.414127","192.168.1.166","23.39.213.4","TCP","54","52183  >  443 [ACK] Seq=349297 Ack=265686 Win=8191 Len=0"
"386","3.425302","23.39.213.4","192.168.1.166","TLSv1.2","438","Application Data"
"387","3.425302","23.39.213.4","192.168.1.166","TLSv1.2","704","Application Data"
"388","3.425350","192.168.1.166","23.39.213.4","TCP","54","52183  >  443 [ACK] Seq=349297 Ack=266720 Win=8187 Len=0"
"389","3.497670","23.39.213.4","192.168.1.166","TLSv1.2","959","Application Data"
"390","3.497670","23.39.213.4","192.168.1.166","TLSv1.2","320","Application Data"
"391","3.497701","192.168.1.166","23.39.213.4","TCP","54","52183  >  443 [ACK] Seq=349297 Ack=267891 Win=8191 Len=0"
"392","3.506790","192.168.1.166","23.39.213.4","TLSv1.2","572","Application Data"
"393","3.541474","23.39.213.4","192.168.1.166","TCP","54","443  >  52183 [ACK] Seq=267891 Ack=349815 Win=11805 Len=0"
"394","3.551491","23.39.213.4","192.168.1.166","TLSv1.2","317","Application Data"
"395","3.551491","23.39.213.4","192.168.1.166","TCP","2974","443  >  52183 [ACK] Seq=268154 Ack=349815 Win=11805 Len=2920 [TCP PDU reassembled in 396]"
"396","3.551491","23.39.213.4","192.168.1.166","TLSv1.2","59","Application Data"
"397","3.551519","192.168.1.166","23.39.213.4","TCP","54","52183  >  443 [ACK] Seq=349815 Ack=271079 Win=8191 Len=0"
