"No.","Time","Source","Destination","Protocol","Length","Info"
"1","0.000000","192.168.1.166","23.198.241.2","TLSv1.2","5695","Application Data"
"2","0.000103","192.168.1.166","23.198.241.2","TLSv1.2","5695","Application Data"
"3","0.000122","192.168.1.166","23.198.241.2","TLSv1.2","1173","Application Data"
"4","0.000136","192.168.1.166","23.198.241.2","TLSv1.2","538","Application Data"
"5","0.030118","23.198.241.2","192.168.1.166","TCP","54","443  >  58685 [ACK] Seq=1 Ack=2921 Win=14815 Len=0"
"6","0.030118","23.198.241.2","192.168.1.166","TCP","54","443  >  58685 [ACK] Seq=1 Ack=5642 Win=14815 Len=0"
"7","0.030118","23.198.241.2","192.168.1.166","TCP","54","443  >  58685 [ACK] Seq=1 Ack=8562 Win=14805 Len=0"
"8","0.030118","23.198.241.2","192.168.1.166","TCP","54","443  >  58685 [ACK] Seq=1 Ack=11283 Win=14806 Len=0"
"9","0.030118","23.198.241.2","192.168.1.166","TCP","54","443  >  58685 [ACK] Seq=1 Ack=12886 Win=14796 Len=0"
"10","0.058580","192.168.1.166","23.198.241.2","TLSv1.2","5780","Application Data"
"11","0.086017","23.198.241.2","192.168.1.166","TCP","54","443  >  58685 [ACK] Seq=1 Ack=15806 Win=14812 Len=0"
"12","0.086017","23.198.241.2","192.168.1.166","TCP","54","443  >  58685 [ACK] Seq=1 Ack=18612 Win=14815 Len=0"
"13","0.105298","23.198.241.2","192.168.1.166","TLSv1.2","473","Application Data"
"14","0.105298","23.198.241.2","192.168.1.166","TLSv1.2","116","Application Data"
"15","0.105328","192.168.1.166","23.198.241.2","TCP","54","58685  >  443 [ACK] Seq=18612 Ack=482 Win=8191 Len=0"
"16","0.105896","192.168.1.166","23.198.241.2","TLSv1.2","89","Application Data"
"17","0.112340","23.198.241.2","192.168.1.166","TLSv1.2","492","Application Data"
"18","0.112340","23.198.241.2","192.168.1.166","TLSv1.2","120","Application Data"
"19","0.112362","192.168.1.166","23.198.241.2","TCP","54","58685  >  443 [ACK] Seq=18647 Ack=986 Win=8189 Len=0"
"20","0.174205","23.198.241.2","192.168.1.166","TCP","54","443  >  58685 [ACK] Seq=986 Ack=18647 Win=14815 Len=0"
"21","1.066964","23.198.241.2","192.168.1.166","TLSv1.2","1049","Application Data"
"22","1.066964","23.198.241.2","192.168.1.166","TCP","1514","443  >  58685 [ACK] Seq=1981 Ack=18647 Win=14815 Len=1460 [TCP PDU reassembled in 29]"
"23","1.066964","23.198.241.2","192.168.1.166","TCP","1514","443  >  58685 [ACK] Seq=3441 Ack=18647 Win=14815 Len=1460 [TCP PDU reassembled in 29]"
"24","1.066964","23.198.241.2","192.168.1.166","TCP","1514","443  >  58685 [ACK] Seq=4901 Ack=18647 Win=14815 Len=1460 [TCP PDU reassembled in 29]"
"25","1.066964","23.198.241.2","192.168.1.166","TCP","1514","443  >  58685 [ACK] Seq=6361 Ack=18647 Win=14815 Len=1460 [TCP PDU reassembled in 29]"
"26","1.066964","23.198.241.2","192.168.1.166","TCP","1514","443  >  58685 [ACK] Seq=7821 Ack=18647 Win=14815 Len=1460 [TCP PDU reassembled in 29]"
"27","1.066964","23.198.241.2","192.168.1.166","TCP","1514","443  >  58685 [ACK] Seq=9281 Ack=18647 Win=14815 Len=1460 [TCP PDU reassembled in 29]"
"28","1.066964","23.198.241.2","192.168.1.166","TCP","7354","443  >  58685 [ACK] Seq=10741 Ack=18647 Win=14815 Len=7300 [TCP PDU reassembled in 29]"
"29","1.066964","23.198.241.2","192.168.1.166","TLSv1.2","400","Application Data"
"30","1.066964","23.198.241.2","192.168.1.166","TLSv1.2","85","Application Data"
"31","1.066964","23.198.241.2","192.168.1.166","TCP","16114","443  >  58685 [ACK] Seq=18418 Ack=18647 Win=14815 Len=16060 [TCP PDU reassembled in 32]"
"32","1.066964","23.198.241.2","192.168.1.166","TLSv1.2","400","Application Data"
"33","1.066964","23.198.241.2","192.168.1.166","TLSv1.2","20494","Application Data, Application Data"
"34","1.066964","23.198.241.2","192.168.1.166","TLSv1.2","899","Application Data"
"35","1.067046","192.168.1.166","23.198.241.2","TCP","54","58685  >  443 [ACK] Seq=18647 Ack=56109 Win=8191 Len=0"
"36","1.070117","23.198.241.2","192.168.1.166","TCP","16114","443  >  58685 [ACK] Seq=56109 Ack=18647 Win=14815 Len=16060 [TCP PDU reassembled in 37]"
"37","1.070117","23.198.241.2","192.168.1.166","TLSv1.2","400","Application Data"
"38","1.070117","23.198.241.2","192.168.1.166","TLSv1.2","85","Application Data"
"39","1.070117","23.198.241.2","192.168.1.166","TCP","10274","443  >  58685 [ACK] Seq=72546 Ack=18647 Win=14815 Len=10220 [TCP PDU reassembled in 40]"
"40","1.070117","23.198.241.2","192.168.1.166","TLSv1.2","1439","Application Data"
"41","1.070117","23.198.241.2","192.168.1.166","TLSv1.2","1077","Application Data"
"42","1.070117","23.198.241.2","192.168.1.166","TLSv1.2","93","Application Data"
"43","1.070117","23.198.241.2","192.168.1.166","TLSv1.2","85","Application Data"
"44","1.070158","192.168.1.166","23.198.241.2","TCP","54","58685  >  443 [ACK] Seq=18647 Ack=85244 Win=8191 Len=0"
"45","1.073618","192.168.1.166","23.198.241.2","TLSv1.2","5893","Application Data"
"46","1.073656","192.168.1.166","23.198.241.2","TLSv1.2","1546","Application Data"
"47","1.099512","192.168.1.166","23.198.241.2","TLSv1.2","5712","Application Data"
"48","1.100535","23.198.241.2","192.168.1.166","TCP","54","443  >  58685 [ACK] Seq=85244 Ack=20107 Win=14812 Len=0"
"49","1.100535","23.198.241.2","192.168.1.166","TCP","54","443  >  58685 [ACK] Seq=85244 Ack=21567 Win=14812 Len=0"
"50","1.102940","23.198.241.2","192.168.1.166","TCP","54","443  >  58685 [ACK] Seq=85244 Ack=24486 Win=14805 Len=0"
"51","1.103473","23.198.241.2","192.168.1.166","TCP","54","443  >  58685 [ACK] Seq=85244 Ack=25946 Win=14812 Len=0"
"52","1.103473","23.198.241.2","192.168.1.166","TCP","54","443  >  58685 [ACK] Seq=85244 Ack=25978 Win=14812 Len=0"
"53","1.124474","23.198.241.2","192.168.1.166","TCP","54","443  >  58685 [ACK] Seq=85244 Ack=27438 Win=14812 Len=0"
"54","1.124474","23.198.241.2","192.168.1.166","TCP","54","443  >  58685 [ACK] Seq=85244 Ack=28898 Win=14812 Len=0"
"55","1.124474","23.198.241.2","192.168.1.166","TCP","54","443  >  58685 [ACK] Seq=85244 Ack=30358 Win=14812 Len=0"
"56","1.124474","23.198.241.2","192.168.1.166","TCP","54","443  >  58685 [ACK] Seq=85244 Ack=31636 Win=14813 Len=0"
"57","1.139814","23.198.241.2","192.168.1.166","TLSv1.2","957","Application Data"
"58","1.139814","23.198.241.2","192.168.1.166","TLSv1.2","85","Application Data"
"59","1.139830","192.168.1.166","23.198.241.2","TCP","54","58685  >  443 [ACK] Seq=31636 Ack=86178 Win=8188 Len=0"
"60","1.145314","192.168.1.166","23.198.241.2","TLSv1.2","553","Application Data"
"61","1.145382","192.168.1.166","23.198.241.2","TLSv1.2","191","Application Data"
"62","1.145449","192.168.1.166","23.198.241.2","TLSv1.2","176","Application Data"
"63","1.145571","192.168.1.166","23.198.241.2","TLSv1.2","191","Application Data"
"64","1.145622","192.168.1.166","23.198.241.2","TLSv1.2","176","Application Data"
"65","1.171938","192.168.1.166","23.198.241.2","TLSv1.2","177","Application Data"
"66","1.173288","23.198.241.2","192.168.1.166","TLSv1.2","361","Application Data"
"67","1.173288","23.198.241.2","192.168.1.166","TLSv1.2","290","Application Data"
"68","1.173320","192.168.1.166","23.198.241.2","TCP","54","58685  >  443 [ACK] Seq=32776 Ack=86721 Win=8191 Len=0"
"69","1.180507","23.198.241.2","192.168.1.166","TCP","54","443  >  58685 [ACK] Seq=86721 Ack=32135 Win=14815 Len=0"
"70","1.180507","23.198.241.2","192.168.1.166","TCP","54","443  >  58685 [ACK] Seq=86721 Ack=32272 Win=14814 Len=0"
"71","1.180507","23.198.241.2","192.168.1.166","TCP","54","443  >  58685 [ACK] Seq=86721 Ack=32394 Win=14814 Len=0"
"72","1.180507","23.198.241.2","192.168.1.166","TCP","54","443  >  58685 [ACK] Seq=86721 Ack=32531 Win=14813 Len=0"
"73","1.180507","23.198.241.2","192.168.1.166","TCP","54","443  >  58685 [ACK] Seq=86721 Ack=32653 Win=14813 Len=0"
"74","1.189688","23.198.241.2","192.168.1.166","TLSv1.2","334","Application Data"
"75","1.189688","23.198.241.2","192.168.1.166","TCP","1514","443  >  58685 [ACK] Seq=87001 Ack=32653 Win=14815 Len=1460 [TCP PDU reassembled in 86]"
"76","1.189688","23.198.241.2","192.168.1.166","TCP","1514","443  >  58685 [ACK] Seq=88461 Ack=32653 Win=14815 Len=1460 [TCP PDU reassembled in 86]"
"77","1.189688","23.198.241.2","192.168.1.166","TCP","1514","443  >  58685 [ACK] Seq=89921 Ack=32653 Win=14815 Len=1460 [TCP PDU reassembled in 86]"
"78","1.189688","23.198.241.2","192.168.1.166","TCP","1514","443  >  58685 [ACK] Seq=91381 Ack=32653 Win=14815 Len=1460 [TCP PDU reassembled in 86]"
"79","1.189688","23.198.241.2","192.168.1.166","TCP","1514","443  >  58685 [ACK] Seq=92841 Ack=32653 Win=14815 Len=1460 [TCP PDU reassembled in 86]"
"80","1.189688","23.198.241.2","192.168.1.166","TCP","1514","443  >  58685 [ACK] Seq=94301 Ack=32653 Win=14815 Len=1460 [TCP PDU reassembled in 86]"
"81","1.189688","23.198.241.2","192.168.1.166","TCP","1514","443  >  58685 [ACK] Seq=95761 Ack=32653 Win=14815 Len=1460 [TCP PDU reassembled in 86]"
"82","1.189688","23.198.241.2","192.168.1.166","TCP","1514","443  >  58685 [ACK] Seq=97221 Ack=32653 Win=14815 Len=1460 [TCP PDU reassembled in 86]"
"83","1.189688","23.198.241.2","192.168.1.166","TCP","1514","443  >  58685 [ACK] Seq=98681 Ack=32653 Win=14815 Len=1460 [TCP PDU reassembled in 86]"
"84","1.189688","23.198.241.2","192.168.1.166","TCP","1514","443  >  58685 [ACK] Seq=100141 Ack=32653 Win=14815 Len=1460 [TCP PDU reassembled in 86]"
"85","1.189688","23.198.241.2","192.168.1.166","TCP","1514","443  >  58685 [ACK] Seq=101601 Ack=32653 Win=14815 Len=1460 [TCP PDU reassembled in 86]"
"86","1.189688","23.198.241.2","192.168.1.166","TLSv1.2","400","Application Data"
"87","1.189688","23.198.241.2","192.168.1.166","TLSv1.2","85","Application Data"
"88","1.189688","23.198.241.2","192.168.1.166","TCP","1514","443  >  58685 [ACK] Seq=103438 Ack=32653 Win=14815 Len=1460 [TCP PDU reassembled in 99]"
"89","1.189688","23.198.241.2","192.168.1.166","TCP","1514","443  >  58685 [ACK] Seq=104898 Ack=32653 Win=14815 Len=1460 [TCP PDU reassembled in 99]"
"90","1.189688","23.198.241.2","192.168.1.166","TCP","1514","443  >  58685 [ACK] Seq=106358 Ack=32653 Win=14815 Len=1460 [TCP PDU reassembled in 99]"
"91","1.189688","23.198.241.2","192.168.1.166","TCP","1514","443  >  58685 [ACK] Seq=107818 Ack=32653 Win=14815 Len=1460 [TCP PDU reassembled in 99]"
"92","1.189688","23.198.241.2","192.168.1.166","TCP","1514","443  >  58685 [ACK] Seq=109278 Ack=32653 Win=14815 Len=1460 [TCP PDU reassembled in 99]"
"93","1.189688","23.198.241.2","192.168.1.166","TCP","1514","443  >  58685 [ACK] Seq=110738 Ack=32653 Win=14815 Len=1460 [TCP PDU reassembled in 99]"
"94","1.189688","23.198.241.2","192.168.1.166","TCP","1514","443  >  58685 [ACK] Seq=112198 Ack=32653 Win=14815 Len=1460 [TCP PDU reassembled in 99]"
"95","1.189688","23.198.241.2","192.168.1.166","TCP","1514","443  >  58685 [ACK] Seq=113658 Ack=32653 Win=14815 Len=1460 [TCP PDU reassembled in 99]"
"96","1.189688","23.198.241.2","192.168.1.166","TCP","1514","443  >  58685 [ACK] Seq=115118 Ack=32653 Win=14815 Len=1460 [TCP PDU reassembled in 99]"
"97","1.189688","23.198.241.2","192.168.1.166","TCP","1514","443  >  58685 [ACK] Seq=116578 Ack=32653 Win=14815 Len=1460 [TCP PDU reassembled in 99]"
"98","1.189688","23.198.241.2","192.168.1.166","TCP","1514","443  >  58685 [ACK] Seq=118038 Ack=32653 Win=14815 Len=1460 [TCP PDU reassembled in 99]"
"99","1.189688","23.198.241.2","192.168.1.166","TLSv1.2","400","Application Data"
"100","1.189688","23.198.241.2","192.168.1.166","TLSv1.2","1514","Application Data"
"101","1.189688","23.198.241.2","192.168.1.166","TLSv1.2","1106","Application Data"
"102","1.189768","192.168.1.166","23.198.241.2","TCP","54","58685  >  443 [ACK] Seq=32776 Ack=122356 Win=8191 Len=0"
"103","1.191048","192.168.1.166","23.198.241.2","TLSv1.2","191","Application Data"
"104","1.197251","23.198.241.2","192.168.1.166","TLSv1.2","316","Application Data"
"105","1.197251","23.198.241.2","192.168.1.166","TCP","1514","443  >  58685 [ACK] Seq=122618 Ack=32653 Win=14815 Len=1460 [TCP PDU reassembled in 106]"
"106","1.197251","23.198.241.2","192.168.1.166","TLSv1.2","142","Application Data"
"107","1.197251","23.198.241.2","192.168.1.166","TLSv1.2","1514","Application Data"
"108","1.197251","23.198.241.2","192.168.1.166","TLSv1.2","369","Application Data"
"109","1.197251","23.198.241.2","192.168.1.166","TCP","2974","443  >  58685 [ACK] Seq=125941 Ack=32653 Win=14815 Len=2920 [TCP PDU reassembled in 110]"
"110","1.197251","23.198.241.2","192.168.1.166","TLSv1.2","1428","Application Data"
"111","1.197251","23.198.241.2","192.168.1.166","TCP","4434","443  >  58685 [ACK] Seq=130235 Ack=32653 Win=14815 Len=4380 [TCP PDU reassembled in 112]"
"112","1.197251","23.198.241.2","192.168.1.166","TLSv1.2","94","Application Data"
"113","1.197251","23.198.241.2","192.168.1.166","TLSv1.2","318","Application Data"
"114","1.197251","23.198.241.2","192.168.1.166","TCP","1514","443  >  58685 [ACK] Seq=134919 Ack=32653 Win=14815 Len=1460 [TCP PDU reassembled in 115]"
"115","1.197251","23.198.241.2","192.168.1.166","TLSv1.2","95","Application Data"
"116","1.197251","23.198.241.2","192.168.1.166","TCP","8814","443  >  58685 [ACK] Seq=136420 Ack=32653 Win=14815 Len=8760 [TCP PDU reassembled in 117]"
"117","1.197251","23.198.241.2","192.168.1.166","TLSv1.2","657","Application Data"
"118","1.197251","23.198.241.2","192.168.1.166","TLSv1.2","318","Application Data"
"119","1.197251","23.198.241.2","192.168.1.166","TCP","1514","443  >  58685 [ACK] Seq=146047 Ack=32653 Win=14815 Len=1460 [TCP PDU reassembled in 120]"
"120","1.197251","23.198.241.2","192.168.1.166","TLSv1.2","140","Application Data"
"121","1.197251","23.198.241.2","192.168.1.166","TCP","16114","443  >  58685 [ACK] Seq=147593 Ack=32653 Win=14815 Len=16060 [TCP PDU reassembled in 122]"
"122","1.197251","23.198.241.2","192.168.1.166","TLSv1.2","400","Application Data"
"123","1.197251","23.198.241.2","192.168.1.166","TLSv1.2","573","Application Data, Application Data"
"124","1.197342","192.168.1.166","23.198.241.2","TCP","54","58685  >  443 [ACK] Seq=32913 Ack=164518 Win=8191 Len=0"
"125","1.198535","192.168.1.166","23.198.241.2","TLSv1.2","191","Application Data"
"126","1.213930","23.198.241.2","192.168.1.166","TLSv1.2","317","Application Data"
"127","1.213930","23.198.241.2","192.168.1.166","TCP","1514","443  >  58685 [ACK] Seq=164781 Ack=32776 Win=14815 Len=1460 [TCP PDU reassembled in 128]"
"128","1.213930","23.198.241.2","192.168.1.166","TLSv1.2","142","Application Data"
"129","1.213930","23.198.241.2","192.168.1.166","TCP","1514","443  >  58685 [ACK] Seq=166329 Ack=32776 Win=14815 Len=1460 [TCP PDU reassembled in 130]"
"130","1.213930","23.198.241.2","192.168.1.166","TLSv1.2","878","Application Data"
"131","1.213973","192.168.1.166","23.198.241.2","TCP","54","58685  >  443 [ACK] Seq=33050 Ack=168613 Win=8191 Len=0"
"132","1.222560","192.168.1.166","23.198.241.2","TLSv1.2","5379","Application Data"
"133","1.234410","23.198.241.2","192.168.1.166","TLSv1.2","317","Application Data"
"134","1.234410","23.198.241.2","192.168.1.166","TCP","2974","443  >  58685 [ACK] Seq=168876 Ack=33050 Win=14815 Len=2920 [TCP PDU reassembled in 135]"
"135","1.234410","23.198.241.2","192.168.1.166","TLSv1.2","1059","Application Data"
"136","1.234445","192.168.1.166","23.198.241.2","TCP","54","58685  >  443 [ACK] Seq=38375 Ack=172801 Win=8191 Len=0"
"137","1.246063","23.198.241.2","192.168.1.166","TLSv1.2","318","Application Data"
"138","1.246063","23.198.241.2","192.168.1.166","TCP","1514","443  >  58685 [ACK] Seq=173065 Ack=33050 Win=14815 Len=1460 [TCP PDU reassembled in 139]"
"139","1.246063","23.198.241.2","192.168.1.166","TLSv1.2","141","Application Data"
"140","1.246063","23.198.241.2","192.168.1.166","TCP","10274","443  >  58685 [ACK] Seq=174612 Ack=33050 Win=14815 Len=10220 [TCP PDU reassembled in 141]"
"141","1.246063","23.198.241.2","192.168.1.166","TLSv1.2","807","Application Data"
"142","1.246106","192.168.1.166","23.198.241.2","TCP","54","58685  >  443 [ACK] Seq=38375 Ack=185585 Win=8191 Len=0"
"143","1.252723","23.198.241.2","192.168.1.166","TCP","54","443  >  58685 [ACK] Seq=185585 Ack=37430 Win=14815 Len=0"
"144","1.262518","192.168.1.166","23.198.241.2","TLSv1.2","5714","Application Data"
"145","1.262574","192.168.1.166","23.198.241.2","TLSv1.2","339","Application Data"
"146","1.273609","192.168.1.166","23.198.241.2","TLSv1.2","5731","Application Data"
"147","1.273744","192.168.1.166","23.198.241.2","TLSv1.2","5732","Application Data"
"148","1.273778","192.168.1.166","23.198.241.2","TLSv1.2","789","Application Data"
"149","1.273796","192.168.1.166","23.198.241.2","TLSv1.2","872","Application Data"
"150","1.290368","23.198.241.2","192.168.1.166","TCP","54","443  >  58685 [ACK] Seq=185585 Ack=41295 Win=14805 Len=0"
"151","1.290368","23.198.241.2","192.168.1.166","TCP","54","443  >  58685 [ACK] Seq=185585 Ack=44035 Win=14806 Len=0"
"152","1.299459","23.198.241.2","192.168.1.166","TCP","54","443  >  58685 [ACK] Seq=185585 Ack=47240 Win=14805 Len=0"
"153","1.299459","23.198.241.2","192.168.1.166","TCP","54","443  >  58685 [ACK] Seq=185585 Ack=49997 Win=14805 Len=0"
"154","1.299459","23.198.241.2","192.168.1.166","TCP","54","443  >  58685 [ACK] Seq=185585 Ack=55675 Win=14776 Len=0"
"155","1.299459","23.198.241.2","192.168.1.166","TCP","54","443  >  58685 [ACK] Seq=185585 Ack=57228 Win=14810 Len=0"
"156","1.324073","23.198.241.2","192.168.1.166","TLSv1.2","556","Application Data"
"157","1.324073","23.198.241.2","192.168.1.166","TLSv1.2","239","Application Data"
"158","1.324098","192.168.1.166","23.198.241.2","TCP","54","58685  >  443 [ACK] Seq=57228 Ack=186272 Win=8189 Len=0"
"159","1.370495","23.198.241.2","192.168.1.166","TLSv1.2","494","Application Data"
"160","1.370495","23.198.241.2","192.168.1.166","TLSv1.2","1509","Application Data"
"161","1.370495","23.198.241.2","192.168.1.166","TCP","8814","443  >  58685 [ACK] Seq=188167 Ack=57228 Win=14815 Len=8760 [TCP PDU reassembled in 162]"
"162","1.370495","23.198.241.2","192.168.1.166","TLSv1.2","254","Application Data"
"163","1.370533","192.168.1.166","23.198.241.2","TCP","54","58685  >  443 [ACK] Seq=57228 Ack=197127 Win=8191 Len=0"
"164","1.370713","23.198.241.2","192.168.1.166","TLSv1.2","531","Application Data"
"165","1.370713","23.198.241.2","192.168.1.166","TLSv1.2","734","Application Data"
"166","1.370721","192.168.1.166","23.198.241.2","TCP","54","58685  >  443 [ACK] Seq=57228 Ack=198284 Win=8187 Len=0"
"167","1.402788","23.198.241.2","192.168.1.166","TLSv1.2","531","Application Data"
"168","1.402788","23.198.241.2","192.168.1.166","TLSv1.2","724","Application Data"
"169","1.402832","192.168.1.166","23.198.241.2","TCP","54","58685  >  443 [ACK] Seq=57228 Ack=199431 Win=8191 Len=0"
"170","1.470527","192.168.1.166","23.198.241.2","TLSv1.2","5838","Application Data"
"171","1.497633","23.198.241.2","192.168.1.166","TCP","54","443  >  58685 [ACK] Seq=199431 Ack=61608 Win=14815 Len=0"
"172","1.506981","23.198.241.2","192.168.1.166","TLSv1.2","961","Application Data"
"173","1.506981","23.198.241.2","192.168.1.166","TLSv1.2","85","Application Data"
"174","1.507006","192.168.1.166","23.198.241.2","TCP","54","58685  >  443 [ACK] Seq=63012 Ack=200369 Win=8188 Len=0"
"175","1.544151","192.168.1.166","23.198.241.2","TLSv1.2","5904","Application Data"
"176","1.544254","192.168.1.166","23.198.241.2","TLSv1.2","5969","Application Data"
"177","1.546054","192.168.1.166","23.198.241.2","TLSv1.2","5904","Application Data"
"178","1.546349","192.168.1.166","23.198.241.2","TLSv1.2","5969","Application Data"
"179","1.569309","192.168.1.166","23.198.241.2","TLSv1.2","556","Application Data"
"180","1.571794","23.198.241.2","192.168.1.166","TCP","54","443  >  58685 [ACK] Seq=200369 Ack=65932 Win=14815 Len=0"
"181","1.571794","23.198.241.2","192.168.1.166","TCP","54","443  >  58685 [ACK] Seq=200369 Ack=76237 Win=14771 Len=0"
"182","1.575403","23.198.241.2","192.168.1.166","TCP","54","443  >  58685 [ACK] Seq=200369 Ack=79157 Win=14805 Len=0"
"183","1.581375","192.168.1.166","23.198.241.2","TLSv1.2","5561","Application Data"
"184","1.581432","192.168.1.166","23.198.241.2","TLSv1.2","253","Application Data"
"185","1.590234","192.168.1.166","23.198.241.2","TLSv1.2","5744","Application Data"
"186","1.591895","23.198.241.2","192.168.1.166","TCP","54","443  >  58685 [ACK] Seq=200369 Ack=86542 Win=14763 Len=0"
"187","1.593545","192.168.1.166","23.198.241.2","TLSv1.2","562","Application Data"
"188","1.594996","192.168.1.166","23.198.241.2","TLSv1.2","148","Application Data"
"189","1.595163","192.168.1.166","23.198.241.2","TLSv1.2","90","Application Data"
"190","1.595189","192.168.1.166","23.198.241.2","TLSv1.2","90","Application Data"
"191","1.599268","192.168.1.166","23.198.241.2","TLSv1.2","191","Application Data"
"192","1.604726","192.168.1.166","23.198.241.2","TLSv1.2","5630","Application Data"
"193","1.605218","192.168.1.166","23.198.241.2","TLSv1.2","5969","Application Data"
"194","1.618122","23.198.241.2","192.168.1.166","TLSv1.2","491","Application Data"
"195","1.618122","23.198.241.2","192.168.1.166","TLSv1.2","1370","Application Data"
"196","1.618161","192.168.1.166","23.198.241.2","TCP","54","58685  >  443 [ACK] Seq=110742 Ack=202122 Win=8191 Len=0"
"197","1.620148","23.198.241.2","192.168.1.166","TCP","54","443  >  58685 [ACK] Seq=202122 Ack=89964 Win=14815 Len=0"
"198","1.620148","23.198.241.2","192.168.1.166","TCP","54","443  >  58685 [ACK] Seq=202122 Ack=98948 Win=14770 Len=0"
"199","1.629202","23.198.241.2","192.168.1.166","TLSv1.2","345","Application Data"
"200","1.629202","23.198.241.2","192.168.1.166","TLSv1.2","753","Application Data"
"201","1.629256","192.168.1.166","23.198.241.2","TCP","54","58685  >  443 [ACK] Seq=110742 Ack=203112 Win=8188 Len=0"
"202","1.630962","23.198.241.2","192.168.1.166","TCP","54","443  >  58685 [ACK] Seq=203112 Ack=102171 Win=14798 Len=0"
"203","1.630962","23.198.241.2","192.168.1.166","TCP","54","443  >  58685 [ACK] Seq=203112 Ack=104827 Win=14778 Len=0"
"204","1.630962","23.198.241.2","192.168.1.166","TCP","54","443  >  58685 [ACK] Seq=203112 Ack=110742 Win=14752 Len=0"
"205","1.637197","192.168.1.166","23.198.241.2","TLSv1.2","5831","Application Data"
"206","1.638495","192.168.1.166","23.198.241.2","TLSv1.2","5832","Application Data"
"207","1.639094","192.168.1.166","23.198.241.2","TLSv1.2","5832","Application Data"
"208","1.642421","192.168.1.166","23.198.241.2","TLSv1.2","5831","Application Data"
"209","1.651577","23.198.241.2","192.168.1.166","TLSv1.2","345","Application Data"
"210","1.651577","23.198.241.2","192.168.1.166","TLSv1.2","703","Application Data"
"211","1.651577","23.198.241.2","192.168.1.166","TLSv1.2","1514","Application Data"
"212","1.651577","23.198.241.2","192.168.1.166","TLSv1.2","369","Application Data"
"213","1.651577","23.198.241.2","192.168.1.166","TLSv1.2","1514","Application Data"
"214","1.651577","23.198.241.2","192.168.1.166","TLSv1.2","405","Application Data"
"215","1.651577","23.198.241.2","192.168.1.166","TCP","16114","443  >  58685 [ACK] Seq=207638 Ack=110742 Win=14815 Len=16060 [TCP PDU reassembled in 216]"
"216","1.651577","23.198.241.2","192.168.1.166","TLSv1.2","400","Application Data"
"217","1.651577","23.198.241.2","192.168.1.166","TLSv1.2","2974","Application Data, Application Data"
"218","1.651577","23.198.241.2","192.168.1.166","TLSv1.2","720","Application Data"
"219","1.651641","192.168.1.166","23.198.241.2","TCP","54","58685  >  443 [ACK] Seq=133852 Ack=227630 Win=8191 Len=0"
"220","1.654544","23.198.241.2","192.168.1.166","TLSv1.2","491","Application Data"
"221","1.654544","23.198.241.2","192.168.1.166","TLSv1.2","781","Application Data"
"222","1.654562","192.168.1.166","23.198.241.2","TCP","54","58685  >  443 [ACK] Seq=133852 Ack=228794 Win=8187 Len=0"
"223","1.656431","192.168.1.166","23.198.241.2","TLSv1.2","5744","Application Data"
"224","1.665818","23.198.241.2","192.168.1.166","TCP","54","443  >  58685 [ACK] Seq=228794 Ack=115122 Win=14815 Len=0"
"225","1.665818","23.198.241.2","192.168.1.166","TCP","54","443  >  58685 [ACK] Seq=228794 Ack=125217 Win=14768 Len=0"
"226","1.673875","23.198.241.2","192.168.1.166","TCP","54","443  >  58685 [ACK] Seq=228794 Ack=128075 Win=14805 Len=0"
"227","1.692211","23.198.241.2","192.168.1.166","TLSv1.2","491","Application Data"
"228","1.692211","23.198.241.2","192.168.1.166","TLSv1.2","1456","Application Data"
"229","1.692211","23.198.241.2","192.168.1.166","TCP","54","443  >  58685 [ACK] Seq=230633 Ack=136772 Win=14805 Len=0"
"230","1.692257","192.168.1.166","23.198.241.2","TCP","54","58685  >  443 [ACK] Seq=139542 Ack=230633 Win=8191 Len=0"
"231","1.712047","23.198.241.2","192.168.1.166","TLSv1.2","493","Application Data"
"232","1.712047","23.198.241.2","192.168.1.166","TLSv1.2","174","Application Data"
"233","1.712047","23.198.241.2","192.168.1.166","TLSv1.2","491","Application Data"
"234","1.712047","23.198.241.2","192.168.1.166","TLSv1.2","1328","Application Data"
"235","1.712097","192.168.1.166","23.198.241.2","TCP","54","58685  >  443 [ACK] Seq=139542 Ack=232903 Win=8191 Len=0"
"236","1.732581","192.168.1.166","23.198.241.2","TLSv1.2","6114","Application Data"
"237","1.733223","192.168.1.166","23.198.241.2","TLSv1.2","6102","Application Data"
"238","1.733296","192.168.1.166","23.198.241.2","TLSv1.2","6114","Application Data"
"239","1.733364","192.168.1.166","23.198.241.2","TLSv1.2","6102","Application Data"
"240","1.733413","192.168.1.166","23.198.241.2","TLSv1.2","6114","Application Data"
"241","1.733481","192.168.1.166","23.198.241.2","TLSv1.2","6101","Application Data"
"242","1.733711","192.168.1.166","23.198.241.2","TLSv1.2","6113","Application Data"
"243","1.733795","192.168.1.166","23.198.241.2","TLSv1.2","6101","Application Data"
"244","1.752948","192.168.1.166","23.198.241.2","TLSv1.2","5769","Application Data"
"245","1.753005","192.168.1.166","23.198.241.2","TLSv1.2","538","Application Data"
"246","1.758605","23.198.241.2","192.168.1.166","TLSv1.2","573","Application Data"
"247","1.758605","23.198.241.2","192.168.1.166","TLSv1.2","1101","Application Data"
"248","1.758605","23.198.241.2","192.168.1.166","TLSv1.2","574","Application Data"
"249","1.758605","23.198.241.2","192.168.1.166","TCP","1514","443  >  58685 [ACK] Seq=234989 Ack=139542 Win=14815 Len=1460 [TCP PDU reassembled in 250]"
"250","1.758605","23.198.241.2","192.168.1.166","TLSv1.2","105","Application Data"
"251","1.758645","192.168.1.166","23.198.241.2","TCP","54","58685  >  443 [ACK] Seq=194170 Ack=236500 Win=8191 Len=0"
"252","1.761722","23.198.241.2","192.168.1.166","TLSv1.2","489","Application Data"
"253","1.761722","23.198.241.2","192.168.1.166","TLSv1.2","192","Application Data"
"254","1.761722","23.198.241.2","192.168.1.166","TLSv1.2","489","Application Data"
"255","1.761740","192.168.1.166","23.198.241.2","TCP","54","58685  >  443 [ACK] Seq=194170 Ack=237508 Win=8187 Len=0"
"256","1.762008","23.198.241.2","192.168.1.166","TLSv1.2","192","Application Data"
"257","1.780157","23.198.241.2","192.168.1.166","TCP","54","443  >  58685 [ACK] Seq=237646 Ack=183384 Win=14581 Len=0"
"258","1.780157","23.198.241.2","192.168.1.166","TCP","54","443  >  58685 [ACK] Seq=237646 Ack=187764 Win=14805 Len=0"
"259","1.801946","23.198.241.2","192.168.1.166","TLSv1.2","575","Application Data"
"260","1.801946","23.198.241.2","192.168.1.166","TLSv1.2","774","Application Data"
"261","1.801981","192.168.1.166","23.198.241.2","TCP","54","58685  >  443 [ACK] Seq=194170 Ack=238887 Win=8191 Len=0"
"262","1.802540","192.168.1.166","23.198.241.2","TLSv1.2","5966","Application Data"
"263","1.804494","192.168.1.166","23.198.241.2","TLSv1.2","5796","Application Data"
"264","1.804526","192.168.1.166","23.198.241.2","TLSv1.2","879","Application Data"
"265","1.805442","23.198.241.2","192.168.1.166","TLSv1.2","491","Application Data"
"266","1.805442","23.198.241.2","192.168.1.166","TLSv1.2","781","Application Data"
"267","1.805460","192.168.1.166","23.198.241.2","TCP","54","58685  >  443 [ACK] Seq=206649 Ack=240051 Win=8187 Len=0"
"268","1.806713","192.168.1.166","23.198.241.2","TLSv1.2","5744","Application Data"
"269","1.807490","192.168.1.166","23.198.241.2","TLSv1.2","6114","Application Data"
"270","1.807564","192.168.1.166","23.198.241.2","TLSv1.2","5832","Application Data"
"271","1.807628","192.168.1.166","23.198.241.2","TLSv1.2","6102","Application Data"
"272","1.807883","192.168.1.166","23.198.241.2","TLSv1.2","6114","Application Data"
"273","1.807941","192.168.1.166","23.198.241.2","TLSv1.2","5832","Application Data"
"274","1.807987","192.168.1.166","23.198.241.2","TLSv1.2","6102","Application Data"
"275","1.813107","192.168.1.166","23.198.241.2","TLSv1.2","5955","Application Data"
"276","1.814033","23.198.241.2","192.168.1.166","TLSv1.2","489","Application Data"
"277","1.814033","23.198.241.2","192.168.1.166","TLSv1.2","192","Application Data"
"278","1.814051","192.168.1.166","23.198.241.2","TCP","54","58685  >  443 [ACK] Seq=254012 Ack=240624 Win=8191 Len=0"
"279","1.814738","23.198.241.2","192.168.1.166","TLSv1.2","489","Application Data"
"280","1.814738","23.198.241.2","192.168.1.166","TLSv1.2","192","Application Data"
"281","1.814752","192.168.1.166","23.198.241.2","TCP","54","58685  >  443 [ACK] Seq=254012 Ack=241197 Win=8189 Len=0"
"282","1.820663","23.198.241.2","192.168.1.166","TCP","54","443  >  58685 [ACK] Seq=241197 Ack=190891 Win=14815 Len=0"
"283","1.825856","23.198.241.2","192.168.1.166","TCP","54","443  >  58685 [ACK] Seq=241197 Ack=194170 Win=14802 Len=0"
"284","1.827982","23.198.241.2","192.168.1.166","TCP","54","443  >  58685 [ACK] Seq=241197 Ack=197090 Win=14805 Len=0"
"285","1.827982","23.198.241.2","192.168.1.166","TCP","54","443  >  58685 [ACK] Seq=241197 Ack=200082 Win=14815 Len=0"
"286","1.848792","23.198.241.2","192.168.1.166","TCP","54","443  >  58685 [ACK] Seq=241197 Ack=254012 Win=14531 Len=0"
"287","1.850242","192.168.1.166","23.198.241.2","TLSv1.2","5838","Application Data"
"288","1.850308","192.168.1.166","23.198.241.2","TLSv1.2","5838","Application Data"
"289","1.850361","192.168.1.166","23.198.241.2","TLSv1.2","5838","Application Data"
"290","1.853514","192.168.1.166","23.198.241.2","TLSv1.2","5966","Application Data"
"291","1.876798","23.198.241.2","192.168.1.166","TCP","54","443  >  58685 [ACK] Seq=241197 Ack=259796 Win=14798 Len=0"
"292","1.876798","23.198.241.2","192.168.1.166","TCP","54","443  >  58685 [ACK] Seq=241197 Ack=265580 Win=14759 Len=0"
"293","1.876798","23.198.241.2","192.168.1.166","TCP","54","443  >  58685 [ACK] Seq=241197 Ack=268500 Win=14753 Len=0"
"294","1.878773","23.198.241.2","192.168.1.166","TCP","54","443  >  58685 [ACK] Seq=241197 Ack=271364 Win=14805 Len=0"
"295","1.887527","192.168.1.166","23.198.241.2","TLSv1.2","560","Application Data"
"296","1.893531","23.198.241.2","192.168.1.166","TCP","54","443  >  58685 [ACK] Seq=241197 Ack=277276 Win=14773 Len=0"
"297","1.911243","23.198.241.2","192.168.1.166","TLSv1.2","473","Application Data"
"298","1.911243","23.198.241.2","192.168.1.166","TLSv1.2","116","Application Data"
"299","1.911243","23.198.241.2","192.168.1.166","TLSv1.2","531","Application Data"
"300","1.911243","23.198.241.2","192.168.1.166","TLSv1.2","748","Application Data"
"301","1.911243","23.198.241.2","192.168.1.166","TLSv1.2","1218","Application Data, Application Data"
"302","1.911274","192.168.1.166","23.198.241.2","TCP","54","58685  >  443 [ACK] Seq=277782 Ack=244013 Win=8191 Len=0"
"303","1.912511","192.168.1.166","23.198.241.2","TLSv1.2","5495","Application Data"
"304","1.914824","192.168.1.166","23.198.241.2","TLSv1.2","5966","Application Data"
"305","1.928561","23.198.241.2","192.168.1.166","TLSv1.2","282","Application Data"
"306","1.928561","23.198.241.2","192.168.1.166","TCP","1514","443  >  58685 [ACK] Seq=244241 Ack=277782 Win=14815 Len=1460 [TCP PDU reassembled in 316]"
"307","1.928561","23.198.241.2","192.168.1.166","TCP","1514","443  >  58685 [ACK] Seq=245701 Ack=277782 Win=14815 Len=1460 [TCP PDU reassembled in 316]"
"308","1.928561","23.198.241.2","192.168.1.166","TCP","1514","443  >  58685 [ACK] Seq=247161 Ack=277782 Win=14815 Len=1460 [TCP PDU reassembled in 316]"
"309","1.928561","23.198.241.2","192.168.1.166","TCP","1514","443  >  58685 [ACK] Seq=248621 Ack=277782 Win=14815 Len=1460 [TCP PDU reassembled in 316]"
"310","1.928561","23.198.241.2","192.168.1.166","TCP","1514","443  >  58685 [ACK] Seq=250081 Ack=277782 Win=14815 Len=1460 [TCP PDU reassembled in 316]"
"311","1.928561","23.198.241.2","192.168.1.166","TCP","1514","443  >  58685 [ACK] Seq=251541 Ack=277782 Win=14815 Len=1460 [TCP PDU reassembled in 316]"
"312","1.928561","23.198.241.2","192.168.1.166","TCP","1514","443  >  58685 [ACK] Seq=253001 Ack=277782 Win=14815 Len=1460 [TCP PDU reassembled in 316]"
"313","1.928561","23.198.241.2","192.168.1.166","TCP","1514","443  >  58685 [ACK] Seq=254461 Ack=277782 Win=14815 Len=1460 [TCP PDU reassembled in 316]"
"314","1.928561","23.198.241.2","192.168.1.166","TCP","2974","443  >  58685 [ACK] Seq=255921 Ack=277782 Win=14815 Len=2920 [TCP PDU reassembled in 316]"
"315","1.928561","23.198.241.2","192.168.1.166","TCP","1514","443  >  58685 [ACK] Seq=258841 Ack=277782 Win=14815 Len=1460 [TCP PDU reassembled in 316]"
"316","1.928561","23.198.241.2","192.168.1.166","TLSv1.2","400","Application Data"
"317","1.928561","23.198.241.2","192.168.1.166","TLSv1.2","85","Application Data"
"318","1.928561","23.198.241.2","192.168.1.166","TCP","16114","443  >  58685 [ACK] Seq=260678 Ack=277782 Win=14815 Len=16060 [TCP PDU reassembled in 319]"
"319","1.928561","23.198.241.2","192.168.1.166","TLSv1.2","400","Application Data"
"320","1.928561","23.198.241.2","192.168.1.166","TLSv1.2","7354","Application Data"
"321","1.928561","23.198.241.2","192.168.1.166","TLSv1.2","927","Application Data"
"322","1.928630","192.168.1.166","23.198.241.2","TCP","54","58685  >  443 [ACK] Seq=289135 Ack=285257 Win=8191 Len=0"
"323","1.938320","23.198.241.2","192.168.1.166","TCP","2974","443  >  58685 [ACK] Seq=285257 Ack=277782 Win=14815 Len=2920 [TCP PDU reassembled in 324]"
"324","1.938320","23.198.241.2","192.168.1.166","TLSv1.2","1029","Application Data"
"325","1.938320","23.198.241.2","192.168.1.166","TLSv1.2","282","Application Data"
"326","1.938320","23.198.241.2","192.168.1.166","TLSv1.2","85","Application Data"
"327","1.938320","23.198.241.2","192.168.1.166","TCP","16114","443  >  58685 [ACK] Seq=289411 Ack=277782 Win=14815 Len=16060 [TCP PDU reassembled in 328]"
"328","1.938320","23.198.241.2","192.168.1.166","TLSv1.2","400","Application Data"
"329","1.938320","23.198.241.2","192.168.1.166","TLSv1.2","85","Application Data"
"330","1.938320","23.198.241.2","192.168.1.166","TCP","16114","443  >  58685 [ACK] Seq=305848 Ack=277782 Win=14815 Len=16060 [TCP PDU reassembled in 331]"
"331","1.938320","23.198.241.2","192.168.1.166","TLSv1.2","400","Application Data"
"332","1.938320","23.198.241.2","192.168.1.166","TLSv1.2","24874","Application Data, Application Data, Application Data"
"333","1.938320","23.198.241.2","192.168.1.166","TLSv1.2","77","Application Data"
"334","1.938320","23.198.241.2","192.168.1.166","TLSv1.2","14654","Application Data, Application Data"
"335","1.938320","23.198.241.2","192.168.1.166","TLSv1.2","852","Application Data, Application Data"
"336","1.938320","23.198.241.2","192.168.1.166","TLSv1.2","348","Application Data"
"337","1.938320","23.198.241.2","192.168.1.166","TLSv1.2","659","Application Data"
"338","1.938320","23.198.241.2","192.168.1.166","TLSv1.2","574","Application Data"
"339","1.938320","23.198.241.2","192.168.1.166","TLSv1.2","756","Application Data"
"340","1.938419","192.168.1.166","23.198.241.2","TCP","54","58685  >  443 [ACK] Seq=289135 Ack=364616 Win=8191 Len=0"
"341","1.939608","23.198.241.2","192.168.1.166","TCP","54","443  >  58685 [ACK] Seq=364616 Ack=283223 Win=14791 Len=0"
"342","1.949443","23.198.241.2","192.168.1.166","TCP","54","443  >  58685 [ACK] Seq=364616 Ack=286143 Win=14805 Len=0"
"343","1.955966","23.198.241.2","192.168.1.166","TLSv1.2","489","Application Data"
"344","1.955966","23.198.241.2","192.168.1.166","TLSv1.2","192","Application Data"
"345","1.955966","23.198.241.2","192.168.1.166","TLSv1.2","489","Application Data"
"346","1.955966","23.198.241.2","192.168.1.166","TLSv1.2","192","Application Data"
"347","1.956002","192.168.1.166","23.198.241.2","TCP","54","58685  >  443 [ACK] Seq=289135 Ack=365762 Win=8187 Len=0"
"348","1.976655","23.198.241.2","192.168.1.166","TLSv1.2","492","Application Data"
"349","1.976655","23.198.241.2","192.168.1.166","TCP","4434","443  >  58685 [ACK] Seq=366200 Ack=289135 Win=14815 Len=4380 [TCP PDU reassembled in 350]"
"350","1.976655","23.198.241.2","192.168.1.166","TLSv1.2","406","Application Data"
"351","1.976655","23.198.241.2","192.168.1.166","TLSv1.2","492","Application Data"
"352","1.976655","23.198.241.2","192.168.1.166","TCP","4434","443  >  58685 [ACK] Seq=371370 Ack=289135 Win=14815 Len=4380 [TCP PDU reassembled in 353]"
"353","1.976655","23.198.241.2","192.168.1.166","TLSv1.2","383","Application Data"
"354","1.976655","23.198.241.2","192.168.1.166","TLSv1.2","282","Application Data"
"355","1.976655","23.198.241.2","192.168.1.166","TCP","16114","443  >  58685 [ACK] Seq=376307 Ack=289135 Win=14815 Len=16060 [TCP PDU reassembled in 356]"
"356","1.976655","23.198.241.2","192.168.1.166","TLSv1.2","400","Application Data"
"357","1.976655","23.198.241.2","192.168.1.166","TLSv1.2","85","Application Data"
"358","1.976655","23.198.241.2","192.168.1.166","TCP","16114","443  >  58685 [ACK] Seq=392744 Ack=289135 Win=14815 Len=16060 [TCP PDU reassembled in 359]"
"359","1.976655","23.198.241.2","192.168.1.166","TLSv1.2","400","Application Data"
"360","1.976655","23.198.241.2","192.168.1.166","TLSv1.2","7354","Application Data"
"361","1.976655","23.198.241.2","192.168.1.166","TLSv1.2","927","Application Data"
"362","1.976707","192.168.1.166","23.198.241.2","TCP","54","58685  >  443 [ACK] Seq=289135 Ack=417323 Win=8191 Len=0"
"363","1.978330","23.198.241.2","192.168.1.166","TCP","1514","443  >  58685 [ACK] Seq=417323 Ack=289135 Win=14815 Len=1460 [TCP PDU reassembled in 365]"
"364","1.978330","23.198.241.2","192.168.1.166","TCP","1514","443  >  58685 [ACK] Seq=418783 Ack=289135 Win=14815 Len=1460 [TCP PDU reassembled in 365]"
"365","1.978330","23.198.241.2","192.168.1.166","TLSv1.2","1029","Application Data"
"366","1.978346","192.168.1.166","23.198.241.2","TCP","54","58685  >  443 [ACK] Seq=289135 Ack=421218 Win=8191 Len=0"
"367","1.980249","23.198.241.2","192.168.1.166","TLSv1.2","85","Application Data"
"368","1.986628","23.198.241.2","192.168.1.166","TLSv1.2","575","Application Data"
"369","1.986628","23.198.241.2","192.168.1.166","TLSv1.2","769","Application Data"
"370","1.986658","192.168.1.166","23.198.241.2","TCP","54","58685  >  443 [ACK] Seq=289135 Ack=422485 Win=8186 Len=0"
"371","1.990230","23.198.241.2","192.168.1.166","TLSv1.2","491","Application Data"
"372","1.990230","23.198.241.2","192.168.1.166","TLSv1.2","781","Application Data"
"373","1.990267","192.168.1.166","23.198.241.2","TCP","54","58685  >  443 [ACK] Seq=289135 Ack=423649 Win=8191 Len=0"
"374","1.991110","192.168.1.166","23.198.241.2","TLSv1.2","5741","Application Data"
"375","1.998634","23.198.241.2","192.168.1.166","TLSv1.2","492","Application Data"
"376","1.998634","23.198.241.2","192.168.1.166","TCP","4434","443  >  58685 [ACK] Seq=424087 Ack=289135 Win=14815 Len=4380 [TCP PDU reassembled in 377]"
"377","1.998634","23.198.241.2","192.168.1.166","TLSv1.2","448","Application Data"
"378","1.998661","192.168.1.166","23.198.241.2","TCP","54","58685  >  443 [ACK] Seq=294822 Ack=428861 Win=8191 Len=0"
"379","2.023352","23.198.241.2","192.168.1.166","TLSv1.2","492","Application Data"
"380","2.023352","23.198.241.2","192.168.1.166","TCP","4434","443  >  58685 [ACK] Seq=429299 Ack=289135 Win=14815 Len=4380 [TCP PDU reassembled in 381]"
"381","2.023352","23.198.241.2","192.168.1.166","TLSv1.2","427","Application Data"
"382","2.023388","192.168.1.166","23.198.241.2","TCP","54","58685  >  443 [ACK] Seq=294822 Ack=434052 Win=8191 Len=0"
"383","2.038868","23.198.241.2","192.168.1.166","TLSv1.2","574","Application Data"
