"No.","Time","Source","Destination","Protocol","Length","Info"
"1","0.000000","192.168.1.166","23.39.213.4","TLSv1.2","5924","Application Data"
"2","0.002630","192.168.1.166","23.39.213.4","TLSv1.2","5343","Application Data"
"3","0.002655","192.168.1.166","23.39.213.4","TLSv1.2","629","Application Data"
"4","0.067796","23.39.213.4","192.168.1.166","TCP","54","443  >  50692 [ACK] Seq=1 Ack=1461 Win=9945 Len=0"
"5","0.067796","23.39.213.4","192.168.1.166","TCP","54","443  >  50692 [ACK] Seq=1 Ack=2921 Win=9937 Len=0"
"6","0.067796","23.39.213.4","192.168.1.166","TCP","54","443  >  50692 [ACK] Seq=1 Ack=4381 Win=9930 Len=0"
"7","0.067796","23.39.213.4","192.168.1.166","TCP","54","443  >  50692 [ACK] Seq=1 Ack=5841 Win=9945 Len=0"
"8","0.067796","23.39.213.4","192.168.1.166","TCP","54","443  >  50692 [ACK] Seq=1 Ack=5871 Win=9945 Len=0"
"9","0.067796","23.39.213.4","192.168.1.166","TCP","54","443  >  50692 [ACK] Seq=1 Ack=7331 Win=9945 Len=0"
"10","0.070045","23.39.213.4","192.168.1.166","TCP","54","443  >  50692 [ACK] Seq=1 Ack=8791 Win=9945 Len=0"
"11","0.070045","23.39.213.4","192.168.1.166","TCP","54","443  >  50692 [ACK] Seq=1 Ack=11160 Win=9932 Len=0"
"12","0.070045","23.39.213.4","192.168.1.166","TCP","54","443  >  50692 [ACK] Seq=1 Ack=11735 Win=9928 Len=0"
"13","0.182038","23.39.213.4","192.168.1.166","TLSv1.2","355","Application Data"
"14","0.182038","23.39.213.4","192.168.1.166","TLSv1.2","121","Application Data"
"15","0.182085","192.168.1.166","23.39.213.4","TCP","54","50692  >  443 [ACK] Seq=11735 Ack=369 Win=16379 Len=0"
"16","0.182984","192.168.1.166","23.39.213.4","TLSv1.2","89","Application Data"
"17","0.214442","23.39.213.4","192.168.1.166","TCP","54","443  >  50692 [ACK] Seq=369 Ack=11770 Win=9949 Len=0"
"18","0.344483","23.39.213.4","192.168.1.166","TLSv1.2","1459","Application Data"
"19","0.344483","23.39.213.4","192.168.1.166","TCP","1514","443  >  50692 [ACK] Seq=1774 Ack=11770 Win=9949 Len=1460 [TCP PDU reassembled in 31]"
"20","0.344483","23.39.213.4","192.168.1.166","TCP","1514","443  >  50692 [ACK] Seq=3234 Ack=11770 Win=9949 Len=1460 [TCP PDU reassembled in 31]"
"21","0.344483","23.39.213.4","192.168.1.166","TCP","1514","443  >  50692 [ACK] Seq=4694 Ack=11770 Win=9949 Len=1460 [TCP PDU reassembled in 31]"
"22","0.344525","192.168.1.166","23.39.213.4","TCP","54","50692  >  443 [ACK] Seq=11770 Ack=6154 Win=16383 Len=0"
"23","0.345236","23.39.213.4","192.168.1.166","TCP","1514","443  >  50692 [ACK] Seq=6154 Ack=11770 Win=9949 Len=1460 [TCP PDU reassembled in 31]"
"24","0.345236","23.39.213.4","192.168.1.166","TCP","1514","443  >  50692 [ACK] Seq=7614 Ack=11770 Win=9949 Len=1460 [TCP PDU reassembled in 31]"
"25","0.345236","23.39.213.4","192.168.1.166","TCP","1514","443  >  50692 [ACK] Seq=9074 Ack=11770 Win=9949 Len=1460 [TCP PDU reassembled in 31]"
"26","0.345236","23.39.213.4","192.168.1.166","TCP","1514","443  >  50692 [ACK] Seq=10534 Ack=11770 Win=9949 Len=1460 [TCP PDU reassembled in 31]"
"27","0.345236","23.39.213.4","192.168.1.166","TCP","1514","443  >  50692 [ACK] Seq=11994 Ack=11770 Win=9949 Len=1460 [TCP PDU reassembled in 31]"
"28","0.345236","23.39.213.4","192.168.1.166","TCP","1514","443  >  50692 [ACK] Seq=13454 Ack=11770 Win=9949 Len=1460 [TCP PDU reassembled in 31]"
"29","0.345236","23.39.213.4","192.168.1.166","TCP","1514","443  >  50692 [ACK] Seq=14914 Ack=11770 Win=9949 Len=1460 [TCP PDU reassembled in 31]"
"30","0.345236","23.39.213.4","192.168.1.166","TCP","1514","443  >  50692 [ACK] Seq=16374 Ack=11770 Win=9949 Len=1460 [TCP PDU reassembled in 31]"
"31","0.345236","23.39.213.4","192.168.1.166","TLSv1.2","400","Application Data"
"32","0.345236","23.39.213.4","192.168.1.166","TLSv1.2","4434","Application Data"
"33","0.345236","23.39.213.4","192.168.1.166","TLSv1.2","966","Application Data"
"34","0.345278","192.168.1.166","23.39.213.4","TCP","54","50692  >  443 [ACK] Seq=11770 Ack=23472 Win=16383 Len=0"
"35","0.349820","192.168.1.166","23.39.213.4","TLSv1.2","5628","Application Data"
"36","0.349864","192.168.1.166","23.39.213.4","TLSv1.2","1334","Application Data"
"37","0.355444","192.168.1.166","23.39.213.4","TLSv1.2","5498","Application Data"
"38","0.381938","23.39.213.4","192.168.1.166","TCP","54","443  >  50692 [ACK] Seq=23472 Ack=13230 Win=9945 Len=0"
"39","0.381938","23.39.213.4","192.168.1.166","TCP","54","443  >  50692 [ACK] Seq=23472 Ack=16150 Win=9930 Len=0"
"40","0.381938","23.39.213.4","192.168.1.166","TCP","54","443  >  50692 [ACK] Seq=23472 Ack=17344 Win=9946 Len=0"
"41","0.381938","23.39.213.4","192.168.1.166","TCP","54","443  >  50692 [ACK] Seq=23472 Ack=18624 Win=9946 Len=0"
"42","0.389156","23.39.213.4","192.168.1.166","TCP","54","443  >  50692 [ACK] Seq=23472 Ack=20084 Win=9945 Len=0"
"43","0.389156","23.39.213.4","192.168.1.166","TCP","54","443  >  50692 [ACK] Seq=23472 Ack=23004 Win=9930 Len=0"
"44","0.389156","23.39.213.4","192.168.1.166","TCP","54","443  >  50692 [ACK] Seq=23472 Ack=24068 Win=9949 Len=0"
"45","0.417041","23.39.213.4","192.168.1.166","TLSv1.2","361","Application Data"
"46","0.417041","23.39.213.4","192.168.1.166","TLSv1.2","289","Application Data"
"47","0.417062","192.168.1.166","23.39.213.4","TCP","54","50692  >  443 [ACK] Seq=24068 Ack=24014 Win=16381 Len=0"
"48","2.024288","23.39.213.4","192.168.1.166","TLSv1.2","1495","Application Data"
"49","2.024288","23.39.213.4","192.168.1.166","TCP","16114","443  >  50692 [ACK] Seq=25455 Ack=24068 Win=9949 Len=16060 [TCP PDU reassembled in 50]"
"50","2.024288","23.39.213.4","192.168.1.166","TLSv1.2","400","Application Data"
"51","2.024288","23.39.213.4","192.168.1.166","TLSv1.2","16114","Application Data"
"52","2.024288","23.39.213.4","192.168.1.166","TLSv1.2","431","Application Data"
"53","2.024288","23.39.213.4","192.168.1.166","TLSv1.2","7354","Application Data"
"54","2.024288","23.39.213.4","192.168.1.166","TLSv1.2","886","Application Data"
"55","2.024288","23.39.213.4","192.168.1.166","TCP","5894","443  >  50692 [ACK] Seq=66430 Ack=24068 Win=9949 Len=5840 [TCP PDU reassembled in 56]"
"56","2.024288","23.39.213.4","192.168.1.166","TLSv1.2","796","Application Data"
"57","2.024288","23.39.213.4","192.168.1.166","TCP","16114","443  >  50692 [ACK] Seq=73012 Ack=24068 Win=9949 Len=16060 [TCP PDU reassembled in 58]"
"58","2.024288","23.39.213.4","192.168.1.166","TLSv1.2","400","Application Data"
"59","2.024288","23.39.213.4","192.168.1.166","TLSv1.2","85","Application Data"
"60","2.024288","23.39.213.4","192.168.1.166","TCP","7354","443  >  50692 [ACK] Seq=89449 Ack=24068 Win=9949 Len=7300 [TCP PDU reassembled in 61]"
"61","2.024288","23.39.213.4","192.168.1.166","TLSv1.2","746","Application Data"
"62","2.024288","23.39.213.4","192.168.1.166","TCP","16114","443  >  50692 [ACK] Seq=97441 Ack=24068 Win=9949 Len=16060 [TCP PDU reassembled in 63]"
"63","2.024288","23.39.213.4","192.168.1.166","TLSv1.2","400","Application Data"
"64","2.024288","23.39.213.4","192.168.1.166","TLSv1.2","85","Application Data"
"65","2.024288","23.39.213.4","192.168.1.166","TCP","4434","443  >  50692 [ACK] Seq=113878 Ack=24068 Win=9949 Len=4380 [TCP PDU reassembled in 66]"
"66","2.024288","23.39.213.4","192.168.1.166","TLSv1.2","1400","Application Data"
"67","2.024288","23.39.213.4","192.168.1.166","TCP","16114","443  >  50692 [ACK] Seq=119604 Ack=24068 Win=9949 Len=16060 [TCP PDU reassembled in 68]"
"68","2.024288","23.39.213.4","192.168.1.166","TLSv1.2","400","Application Data"
"69","2.024288","23.39.213.4","192.168.1.166","TLSv1.2","85","Application Data"
"70","2.024288","23.39.213.4","192.168.1.166","TCP","5894","443  >  50692 [ACK] Seq=136041 Ack=24068 Win=9949 Len=5840 [TCP PDU reassembled in 71]"
"71","2.024288","23.39.213.4","192.168.1.166","TLSv1.2","1216","Application Data"
"72","2.024288","23.39.213.4","192.168.1.166","TCP","16114","443  >  50692 [ACK] Seq=143043 Ack=24068 Win=9949 Len=16060 [TCP PDU reassembled in 73]"
"73","2.024288","23.39.213.4","192.168.1.166","TLSv1.2","400","Application Data"
"74","2.024288","23.39.213.4","192.168.1.166","TLSv1.2","85","Application Data"
"75","2.024288","23.39.213.4","192.168.1.166","TCP","7354","443  >  50692 [ACK] Seq=159480 Ack=24068 Win=9949 Len=7300 [TCP PDU reassembled in 76]"
"76","2.024288","23.39.213.4","192.168.1.166","TLSv1.2","292","Application Data"
"77","2.024288","23.39.213.4","192.168.1.166","TCP","16114","443  >  50692 [ACK] Seq=167018 Ack=24068 Win=9949 Len=16060 [TCP PDU reassembled in 78]"
"78","2.024288","23.39.213.4","192.168.1.166","TLSv1.2","400","Application Data"
"79","2.024288","23.39.213.4","192.168.1.166","TLSv1.2","85","Application Data"
"80","2.024454","192.168.1.166","23.39.213.4","TCP","54","50692  >  443 [ACK] Seq=24068 Ack=183455 Win=16383 Len=0"
"81","2.024524","23.39.213.4","192.168.1.166","TCP","5894","443  >  50692 [ACK] Seq=183455 Ack=24068 Win=9949 Len=5840 [TCP PDU reassembled in 82]"
"82","2.024524","23.39.213.4","192.168.1.166","TLSv1.2","785","Application Data"
"83","2.024524","23.39.213.4","192.168.1.166","TLSv1.2","85","Application Data"
"84","2.024536","192.168.1.166","23.39.213.4","TCP","54","50692  >  443 [ACK] Seq=24068 Ack=190057 Win=16357 Len=0"
"85","2.025432","192.168.1.166","23.39.213.4","TCP","54","[TCP Window Update] 50692  >  443 [ACK] Seq=24068 Ack=190057 Win=16383 Len=0"
"86","2.032240","192.168.1.166","23.39.213.4","TLSv1.2","5640","Application Data"
"87","2.032292","192.168.1.166","23.39.213.4","TLSv1.2","1644","Application Data"
"88","2.065106","23.39.213.4","192.168.1.166","TCP","54","443  >  50692 [ACK] Seq=190057 Ack=25528 Win=9945 Len=0"
"89","2.065106","23.39.213.4","192.168.1.166","TCP","54","443  >  50692 [ACK] Seq=190057 Ack=26988 Win=9937 Len=0"
"90","2.065106","23.39.213.4","192.168.1.166","TCP","54","443  >  50692 [ACK] Seq=190057 Ack=29654 Win=9938 Len=0"
"91","2.065106","23.39.213.4","192.168.1.166","TCP","54","443  >  50692 [ACK] Seq=190057 Ack=31114 Win=9931 Len=0"
"92","2.065106","23.39.213.4","192.168.1.166","TCP","54","443  >  50692 [ACK] Seq=190057 Ack=31244 Win=9930 Len=0"
"93","2.072183","192.168.1.166","23.39.213.4","TLSv1.2","576","Application Data"
"94","2.090781","23.39.213.4","192.168.1.166","TLSv1.2","361","Application Data"
"95","2.090781","23.39.213.4","192.168.1.166","TLSv1.2","289","Application Data"
"96","2.090803","192.168.1.166","23.39.213.4","TCP","54","50692  >  443 [ACK] Seq=31766 Ack=190599 Win=16381 Len=0"
"97","2.102707","192.168.1.166","23.39.213.4","TLSv1.2","5120","Application Data"
"98","2.133319","192.168.1.166","23.39.213.4","TLSv1.2","5439","Application Data"
"99","2.171815","192.168.1.166","23.39.213.4","TLSv1.2","577","Application Data"
"100","2.171857","192.168.1.166","23.39.213.4","TLSv1.2","192","Application Data"
"101","2.171879","192.168.1.166","23.39.213.4","TLSv1.2","192","Application Data"
"102","2.172158","192.168.1.166","23.39.213.4","TLSv1.2","192","Application Data"
"103","2.172845","192.168.1.166","23.39.213.4","TLSv1.2","191","Application Data"
"104","2.184857","23.39.213.4","192.168.1.166","TCP","54","443  >  50692 [ACK] Seq=190599 Ack=33226 Win=9945 Len=0"
"105","2.184857","23.39.213.4","192.168.1.166","TCP","54","443  >  50692 [ACK] Seq=190599 Ack=36832 Win=9925 Len=0"
"106","2.184857","23.39.213.4","192.168.1.166","TLSv1.2","981","Application Data"
"107","2.184857","23.39.213.4","192.168.1.166","TLSv1.2","85","Application Data"
"108","2.184905","192.168.1.166","23.39.213.4","TCP","54","50692  >  443 [ACK] Seq=43291 Ack=191557 Win=16383 Len=0"
"109","2.187924","23.39.213.4","192.168.1.166","TLSv1.2","318","Application Data"
"110","2.187924","23.39.213.4","192.168.1.166","TCP","1514","443  >  50692 [ACK] Seq=191821 Ack=36832 Win=9949 Len=1460 [TCP PDU reassembled in 111]"
"111","2.187924","23.39.213.4","192.168.1.166","TLSv1.2","63","Application Data"
"112","2.187924","23.39.213.4","192.168.1.166","TCP","16114","443  >  50692 [ACK] Seq=193290 Ack=36832 Win=9949 Len=16060 [TCP PDU reassembled in 113]"
"113","2.187924","23.39.213.4","192.168.1.166","TLSv1.2","400","Application Data"
"114","2.187924","23.39.213.4","192.168.1.166","TLSv1.2","10274","Application Data, Application Data"
"115","2.187924","23.39.213.4","192.168.1.166","TLSv1.2","1277","Application Data"
"116","2.187967","192.168.1.166","23.39.213.4","TCP","54","50692  >  443 [ACK] Seq=43291 Ack=221139 Win=16383 Len=0"
"117","2.188979","192.168.1.166","23.39.213.4","TLSv1.2","192","Application Data"
"118","2.215589","23.39.213.4","192.168.1.166","TCP","54","443  >  50692 [ACK] Seq=221139 Ack=39752 Win=9937 Len=0"
"119","2.215589","23.39.213.4","192.168.1.166","TCP","54","443  >  50692 [ACK] Seq=221139 Ack=42217 Win=9939 Len=0"
"120","2.215589","23.39.213.4","192.168.1.166","TCP","54","443  >  50692 [ACK] Seq=221139 Ack=43291 Win=9949 Len=0"
"121","2.220422","192.168.1.166","23.39.213.4","TLSv1.2","90","Application Data"
"122","2.220453","192.168.1.166","23.39.213.4","TLSv1.2","90","Application Data"
"123","2.236842","23.39.213.4","192.168.1.166","TLSv1.2","373","Application Data"
"124","2.241643","23.39.213.4","192.168.1.166","TLSv1.2","85","Application Data"
"125","2.241654","192.168.1.166","23.39.213.4","TCP","54","50692  >  443 [ACK] Seq=43501 Ack=221489 Win=16382 Len=0"
"126","2.243288","23.39.213.4","192.168.1.166","TLSv1.2","317","Application Data"
"127","2.243288","23.39.213.4","192.168.1.166","TLSv1.2","879","Application Data"
"128","2.243311","192.168.1.166","23.39.213.4","TCP","54","50692  >  443 [ACK] Seq=43501 Ack=222577 Win=16378 Len=0"
"129","2.245364","192.168.1.166","23.39.213.4","TLSv1.2","193","Application Data"
"130","2.253494","23.39.213.4","192.168.1.166","TCP","54","443  >  50692 [ACK] Seq=222577 Ack=43501 Win=9949 Len=0"
"131","2.328340","23.39.213.4","192.168.1.166","TLSv1.2","318","Application Data"
"132","2.328340","23.39.213.4","192.168.1.166","TCP","1514","443  >  50692 [ACK] Seq=222841 Ack=43640 Win=9949 Len=1460 [TCP PDU reassembled in 133]"
"133","2.328340","23.39.213.4","192.168.1.166","TLSv1.2","145","Application Data"
"134","2.328340","23.39.213.4","192.168.1.166","TCP","1514","443  >  50692 [ACK] Seq=224392 Ack=43640 Win=9949 Len=1460 [TCP PDU reassembled in 135]"
"135","2.328340","23.39.213.4","192.168.1.166","TLSv1.2","735","Application Data"
"136","2.328340","23.39.213.4","192.168.1.166","TLSv1.2","317","Application Data"
"137","2.328340","23.39.213.4","192.168.1.166","TCP","1514","443  >  50692 [ACK] Seq=226796 Ack=43640 Win=9949 Len=1460 [TCP PDU reassembled in 138]"
"138","2.328340","23.39.213.4","192.168.1.166","TLSv1.2","92","Application Data"
"139","2.328340","23.39.213.4","192.168.1.166","TCP","4434","443  >  50692 [ACK] Seq=228294 Ack=43640 Win=9949 Len=4380 [TCP PDU reassembled in 140]"
"140","2.328340","23.39.213.4","192.168.1.166","TLSv1.2","886","Application Data"
"141","2.328411","192.168.1.166","23.39.213.4","TCP","54","50692  >  443 [ACK] Seq=43640 Ack=233506 Win=16383 Len=0"
"142","2.329792","192.168.1.166","23.39.213.4","TLSv1.2","191","Application Data"
"143","2.329830","192.168.1.166","23.39.213.4","TLSv1.2","192","Application Data"
"144","2.336284","23.39.213.4","192.168.1.166","TLSv1.2","317","Application Data"
"145","2.336284","23.39.213.4","192.168.1.166","TCP","1514","443  >  50692 [ACK] Seq=233769 Ack=43640 Win=9949 Len=1460 [TCP PDU reassembled in 146]"
"146","2.336284","23.39.213.4","192.168.1.166","TLSv1.2","94","Application Data"
"147","2.336284","23.39.213.4","192.168.1.166","TCP","2974","443  >  50692 [ACK] Seq=235269 Ack=43640 Win=9949 Len=2920 [TCP PDU reassembled in 148]"
"148","2.336284","23.39.213.4","192.168.1.166","TLSv1.2","808","Application Data"
"149","2.336320","192.168.1.166","23.39.213.4","TCP","54","50692  >  443 [ACK] Seq=43915 Ack=238943 Win=16383 Len=0"
"150","2.337015","192.168.1.166","23.39.213.4","TLSv1.2","193","Application Data"
"151","2.338109","23.39.213.4","192.168.1.166","TLSv1.2","317","Application Data"
"152","2.338109","23.39.213.4","192.168.1.166","TCP","1514","443  >  50692 [ACK] Seq=239206 Ack=43640 Win=9949 Len=1460 [TCP PDU reassembled in 153]"
"153","2.338109","23.39.213.4","192.168.1.166","TLSv1.2","92","Application Data"
"154","2.338109","23.39.213.4","192.168.1.166","TCP","2974","443  >  50692 [ACK] Seq=240704 Ack=43640 Win=9949 Len=2920 [TCP PDU reassembled in 155]"
"155","2.338109","23.39.213.4","192.168.1.166","TLSv1.2","62","Application Data"
"156","2.338154","192.168.1.166","23.39.213.4","TCP","54","50692  >  443 [ACK] Seq=44054 Ack=243632 Win=16383 Len=0"
"157","2.362298","23.39.213.4","192.168.1.166","TCP","54","443  >  50692 [ACK] Seq=243632 Ack=43915 Win=9949 Len=0"
"158","2.381548","23.39.213.4","192.168.1.166","TLSv1.2","318","Application Data"
"159","2.381548","23.39.213.4","192.168.1.166","TCP","1514","443  >  50692 [ACK] Seq=243896 Ack=44054 Win=9949 Len=1460 [TCP PDU reassembled in 160]"
"160","2.381548","23.39.213.4","192.168.1.166","TLSv1.2","92","Application Data"
"161","2.381548","23.39.213.4","192.168.1.166","TLSv1.2","1514","Application Data"
"162","2.381548","23.39.213.4","192.168.1.166","TLSv1.2","355","Application Data"
"163","2.381582","192.168.1.166","23.39.213.4","TCP","54","50692  >  443 [ACK] Seq=44054 Ack=247155 Win=16383 Len=0"
"164","2.382819","23.39.213.4","192.168.1.166","TCP","1514","443  >  50692 [ACK] Seq=247155 Ack=44054 Win=9949 Len=1460 [TCP PDU reassembled in 170]"
"165","2.382819","23.39.213.4","192.168.1.166","TCP","1514","443  >  50692 [ACK] Seq=248615 Ack=44054 Win=9949 Len=1460 [TCP PDU reassembled in 170]"
"166","2.382819","23.39.213.4","192.168.1.166","TCP","1514","443  >  50692 [ACK] Seq=250075 Ack=44054 Win=9949 Len=1460 [TCP PDU reassembled in 170]"
"167","2.382819","23.39.213.4","192.168.1.166","TCP","1514","443  >  50692 [ACK] Seq=251535 Ack=44054 Win=9949 Len=1460 [TCP PDU reassembled in 170]"
"168","2.382819","23.39.213.4","192.168.1.166","TCP","1514","443  >  50692 [ACK] Seq=252995 Ack=44054 Win=9949 Len=1460 [TCP PDU reassembled in 170]"
"169","2.382819","23.39.213.4","192.168.1.166","TCP","1514","443  >  50692 [ACK] Seq=254455 Ack=44054 Win=9949 Len=1460 [TCP PDU reassembled in 170]"
"170","2.382819","23.39.213.4","192.168.1.166","TLSv1.2","349","Application Data"
"171","2.382819","23.39.213.4","192.168.1.166","TLSv1.2","822","Application Data"
"172","2.382863","192.168.1.166","23.39.213.4","TCP","54","50692  >  443 [ACK] Seq=44054 Ack=256978 Win=16383 Len=0"
"173","2.408628","23.39.213.4","192.168.1.166","TLSv1.2","317","Application Data"
"174","2.408628","23.39.213.4","192.168.1.166","TLSv1.2","1383","Application Data"
"175","2.408662","192.168.1.166","23.39.213.4","TCP","54","50692  >  443 [ACK] Seq=44054 Ack=258570 Win=16383 Len=0"
"176","2.414264","23.39.213.4","192.168.1.166","TLSv1.2","316","Application Data"
"177","2.414264","23.39.213.4","192.168.1.166","TLSv1.2","1473","Application Data"
"178","2.414264","23.39.213.4","192.168.1.166","TCP","1514","443  >  50692 [ACK] Seq=260251 Ack=44054 Win=9949 Len=1460 [TCP PDU reassembled in 179]"
"179","2.414264","23.39.213.4","192.168.1.166","TLSv1.2","937","Application Data"
"180","2.414294","192.168.1.166","23.39.213.4","TCP","54","50692  >  443 [ACK] Seq=44054 Ack=262594 Win=16383 Len=0"
"181","2.470349","23.39.213.4","192.168.1.166","TLSv1.2","316","Application Data"
"182","2.470349","23.39.213.4","192.168.1.166","TCP","1514","443  >  50692 [ACK] Seq=262856 Ack=44054 Win=9949 Len=1460 [TCP PDU reassembled in 183]"
"183","2.470349","23.39.213.4","192.168.1.166","TLSv1.2","93","Application Data"
"184","2.470349","23.39.213.4","192.168.1.166","TCP","4434","443  >  50692 [ACK] Seq=264355 Ack=44054 Win=9949 Len=4380 [TCP PDU reassembled in 185]"
"185","2.470349","23.39.213.4","192.168.1.166","TLSv1.2","1313","Application Data"
"186","2.470399","192.168.1.166","23.39.213.4","TCP","54","50692  >  443 [ACK] Seq=44054 Ack=269994 Win=16383 Len=0"
"187","2.491365","192.168.1.166","23.39.213.4","TLSv1.2","5252","Application Data"
"188","2.491428","192.168.1.166","23.39.213.4","TLSv1.2","588","Application Data"
"189","2.524158","23.39.213.4","192.168.1.166","TCP","54","443  >  50692 [ACK] Seq=269994 Ack=49786 Win=9928 Len=0"
"190","2.579490","192.168.1.166","23.39.213.4","TLSv1.2","5501","Application Data"
"191","2.579543","192.168.1.166","23.39.213.4","TLSv1.2","3641","Application Data"
"192","2.636362","192.168.1.166","23.39.213.4","TLSv1.2","5500","Application Data"
"193","2.636442","192.168.1.166","23.39.213.4","TLSv1.2","685","Application Data"
"194","2.661705","23.39.213.4","192.168.1.166","TCP","54","443  >  50692 [ACK] Seq=269994 Ack=52706 Win=9945 Len=0"
"195","2.661705","23.39.213.4","192.168.1.166","TCP","54","443  >  50692 [ACK] Seq=269994 Ack=55233 Win=9949 Len=0"
"196","2.661705","23.39.213.4","192.168.1.166","TCP","54","443  >  50692 [ACK] Seq=269994 Ack=58820 Win=9933 Len=0"
"197","2.661705","23.39.213.4","192.168.1.166","TLSv1.2","952","Application Data"
"198","2.661705","23.39.213.4","192.168.1.166","TLSv1.2","974","Application Data"
"199","2.661745","192.168.1.166","23.39.213.4","TCP","54","50692  >  443 [ACK] Seq=64897 Ack=271812 Win=16383 Len=0"
"200","2.691942","23.39.213.4","192.168.1.166","TCP","54","443  >  50692 [ACK] Seq=271812 Ack=61740 Win=9949 Len=0"
"201","2.691942","23.39.213.4","192.168.1.166","TCP","54","443  >  50692 [ACK] Seq=271812 Ack=64897 Win=9935 Len=0"
"202","2.737822","192.168.1.166","23.39.213.4","TLSv1.2","556","Application Data"
"203","2.737886","192.168.1.166","23.39.213.4","TLSv1.2","176","Application Data"
"204","2.737907","192.168.1.166","23.39.213.4","TLSv1.2","177","Application Data"
"205","2.737926","192.168.1.166","23.39.213.4","TLSv1.2","177","Application Data"
"206","2.737976","192.168.1.166","23.39.213.4","TLSv1.2","177","Application Data"
"207","2.744931","192.168.1.166","23.39.213.4","TLSv1.2","90","Application Data"
"208","2.744966","192.168.1.166","23.39.213.4","TLSv1.2","90","Application Data"
"209","2.745006","192.168.1.166","23.39.213.4","TLSv1.2","90","Application Data"
"210","2.745024","192.168.1.166","23.39.213.4","TLSv1.2","90","Application Data"
"211","2.745036","192.168.1.166","23.39.213.4","TLSv1.2","90","Application Data"
"212","2.745048","192.168.1.166","23.39.213.4","TLSv1.2","90","Application Data"
"213","2.801760","23.39.213.4","192.168.1.166","TCP","54","443  >  50692 [ACK] Seq=271812 Ack=65890 Win=9949 Len=0"
"214","2.801760","23.39.213.4","192.168.1.166","TCP","54","443  >  50692 [ACK] Seq=271812 Ack=66106 Win=9949 Len=0"
"215","2.801760","23.39.213.4","192.168.1.166","TLSv1.2","956","Application Data"
"216","2.801760","23.39.213.4","192.168.1.166","TLSv1.2","1509","Application Data"
"217","2.801760","23.39.213.4","192.168.1.166","TLSv1.2","956","Application Data"
"218","2.801760","23.39.213.4","192.168.1.166","TLSv1.2","5894","Application Data"
"219","2.801760","23.39.213.4","192.168.1.166","TLSv1.2","616","Application Data"
"220","2.801760","23.39.213.4","192.168.1.166","TLSv1.2","1039","Application Data, Application Data"
"221","2.801823","192.168.1.166","23.39.213.4","TCP","54","50692  >  443 [ACK] Seq=66106 Ack=282458 Win=16383 Len=0"
"222","2.815544","23.39.213.4","192.168.1.166","TLSv1.2","318","Application Data"
"223","2.815544","23.39.213.4","192.168.1.166","TLSv1.2","1426","Application Data"
"224","2.815544","23.39.213.4","192.168.1.166","TCP","16114","443  >  50692 [ACK] Seq=284094 Ack=66106 Win=9949 Len=16060 [TCP PDU reassembled in 225]"
"225","2.815544","23.39.213.4","192.168.1.166","TLSv1.2","400","Application Data"
"226","2.815544","23.39.213.4","192.168.1.166","TLSv1.2","11734","Application Data"
"227","2.815544","23.39.213.4","192.168.1.166","TLSv1.2","879","Application Data"
"228","2.815544","23.39.213.4","192.168.1.166","TLSv1.2","316","Application Data"
"229","2.815544","23.39.213.4","192.168.1.166","TLSv1.2","355","Application Data"
"230","2.815612","192.168.1.166","23.39.213.4","TCP","54","50692  >  443 [ACK] Seq=66106 Ack=313568 Win=16383 Len=0"
"231","2.827103","192.168.1.166","23.39.213.4","TLSv1.2","5137","Application Data"
"232","2.827194","192.168.1.166","23.39.213.4","TLSv1.2","391","Application Data"
"233","2.829495","192.168.1.166","23.39.213.4","TLSv1.2","5502","Application Data"
"234","2.829603","192.168.1.166","23.39.213.4","TLSv1.2","5502","Application Data"
"235","2.829632","192.168.1.166","23.39.213.4","TLSv1.2","3223","Application Data"
"236","2.829647","192.168.1.166","23.39.213.4","TLSv1.2","1469","Application Data"
"237","2.831101","23.39.213.4","192.168.1.166","TLSv1.2","316","Application Data"
"238","2.831101","23.39.213.4","192.168.1.166","TLSv1.2","795","Application Data"
"239","2.831132","192.168.1.166","23.39.213.4","TCP","54","50692  >  443 [ACK] Seq=87006 Ack=314571 Win=16379 Len=0"
"240","2.856722","23.39.213.4","192.168.1.166","TLSv1.2","317","Application Data"
"241","2.856722","23.39.213.4","192.168.1.166","TLSv1.2","339","Application Data"
"242","2.856765","192.168.1.166","23.39.213.4","TCP","54","50692  >  443 [ACK] Seq=87006 Ack=315119 Win=16383 Len=0"
"243","2.860711","23.39.213.4","192.168.1.166","TCP","54","443  >  50692 [ACK] Seq=315119 Ack=71526 Win=9930 Len=0"
"244","2.862643","23.39.213.4","192.168.1.166","TCP","54","443  >  50692 [ACK] Seq=315119 Ack=76974 Win=9931 Len=0"
"245","2.862643","23.39.213.4","192.168.1.166","TCP","54","443  >  50692 [ACK] Seq=315119 Ack=83882 Win=9895 Len=0"
"246","2.862643","23.39.213.4","192.168.1.166","TCP","54","443  >  50692 [ACK] Seq=315119 Ack=85591 Win=9885 Len=0"
"247","2.888548","192.168.1.166","23.39.213.4","TLSv1.2","5393","Application Data"
"248","2.896684","192.168.1.166","23.39.213.4","TLSv1.2","5386","Application Data"
"249","2.909607","192.168.1.166","23.39.213.4","TLSv1.2","5410","Application Data"
"250","2.944318","23.39.213.4","192.168.1.166","TCP","54","443  >  50692 [ACK] Seq=315119 Ack=87006 Win=9949 Len=0"
"251","2.944318","23.39.213.4","192.168.1.166","TCP","54","443  >  50692 [ACK] Seq=315119 Ack=91386 Win=9930 Len=0"
"252","2.944318","23.39.213.4","192.168.1.166","TCP","54","443  >  50692 [ACK] Seq=315119 Ack=92345 Win=9949 Len=0"
"253","2.986614","23.39.213.4","192.168.1.166","TLSv1.2","955","Application Data"
"254","2.986614","23.39.213.4","192.168.1.166","TLSv1.2","1514","Application Data"
"255","2.986658","192.168.1.166","23.39.213.4","TCP","54","50692  >  443 [ACK] Seq=103033 Ack=317480 Win=16383 Len=0"
"256","3.017103","23.39.213.4","192.168.1.166","TCP","1514","443  >  50692 [ACK] Seq=317480 Ack=103033 Win=9949 Len=1460 [TCP PDU reassembled in 262]"
"257","3.017103","23.39.213.4","192.168.1.166","TCP","1514","443  >  50692 [ACK] Seq=318940 Ack=103033 Win=9949 Len=1460 [TCP PDU reassembled in 262]"
"258","3.017103","23.39.213.4","192.168.1.166","TCP","1514","443  >  50692 [ACK] Seq=320400 Ack=103033 Win=9949 Len=1460 [TCP PDU reassembled in 262]"
"259","3.017103","23.39.213.4","192.168.1.166","TCP","1514","443  >  50692 [ACK] Seq=321860 Ack=103033 Win=9949 Len=1460 [TCP PDU reassembled in 262]"
"260","3.017103","23.39.213.4","192.168.1.166","TCP","1514","443  >  50692 [ACK] Seq=323320 Ack=103033 Win=9949 Len=1460 [TCP PDU reassembled in 262]"
"261","3.017103","23.39.213.4","192.168.1.166","TCP","1514","443  >  50692 [ACK] Seq=324780 Ack=103033 Win=9949 Len=1460 [TCP PDU reassembled in 262]"
"262","3.017103","23.39.213.4","192.168.1.166","TLSv1.2","726","Application Data"
"263","3.017103","23.39.213.4","192.168.1.166","TLSv1.2","955","Application Data"
"264","3.017103","23.39.213.4","192.168.1.166","TLSv1.2","226","Application Data"
"265","3.017159","192.168.1.166","23.39.213.4","TCP","54","50692  >  443 [ACK] Seq=103033 Ack=327985 Win=16383 Len=0"
"266","3.019709","192.168.1.166","23.39.213.4","TLSv1.2","5384","Application Data"
"267","3.019769","192.168.1.166","23.39.213.4","TLSv1.2","317","Application Data"
"268","3.027333","23.39.213.4","192.168.1.166","TLSv1.2","484","Application Data"
"269","3.027333","23.39.213.4","192.168.1.166","TCP","1514","443  >  50692 [ACK] Seq=328415 Ack=103033 Win=9949 Len=1460 [TCP PDU reassembled in 270]"
"270","3.027333","23.39.213.4","192.168.1.166","TLSv1.2","72","Application Data"
"271","3.027373","192.168.1.166","23.39.213.4","TCP","54","50692  >  443 [ACK] Seq=108626 Ack=329893 Win=16383 Len=0"
"272","3.072351","23.39.213.4","192.168.1.166","TLSv1.2","483","Application Data"
"273","3.072351","23.39.213.4","192.168.1.166","TLSv1.2","639","Application Data"
"274","3.072351","23.39.213.4","192.168.1.166","TCP","54","443  >  50692 [ACK] Seq=330907 Ack=108626 Win=9922 Len=0"
"275","3.072351","23.39.213.4","192.168.1.166","TLSv1.2","483","Application Data"
"276","3.072351","23.39.213.4","192.168.1.166","TLSv1.2","449","Application Data"
"277","3.072437","192.168.1.166","23.39.213.4","TCP","54","50692  >  443 [ACK] Seq=108626 Ack=331731 Win=16383 Len=0"
"278","3.161672","23.39.213.4","192.168.1.166","TLSv1.2","954","Application Data"
"279","3.161672","23.39.213.4","192.168.1.166","TLSv1.2","216","Application Data"
"280","3.161701","192.168.1.166","23.39.213.4","TCP","54","50692  >  443 [ACK] Seq=108626 Ack=332793 Win=16379 Len=0"
"281","3.175881","192.168.1.166","23.39.213.4","TLSv1.2","5399","Application Data"
"282","3.182182","192.168.1.166","23.39.213.4","TLSv1.2","572","Application Data"
"283","3.182229","192.168.1.166","23.39.213.4","TLSv1.2","191","Application Data"
"284","3.182251","192.168.1.166","23.39.213.4","TLSv1.2","191","Application Data"
"285","3.182269","192.168.1.166","23.39.213.4","TLSv1.2","191","Application Data"
"286","3.218474","192.168.1.166","23.39.213.4","TLSv1.2","5251","Application Data"
"287","3.218576","192.168.1.166","23.39.213.4","TLSv1.2","5501","Application Data"
"288","3.218605","192.168.1.166","23.39.213.4","TLSv1.2","487","Application Data"
"289","3.218626","192.168.1.166","23.39.213.4","TLSv1.2","382","Application Data"
"290","3.218757","192.168.1.166","23.39.213.4","TLSv1.2","5501","Application Data"
"291","3.218792","192.168.1.166","23.39.213.4","TLSv1.2","898","Application Data"
"292","3.222337","23.39.213.4","192.168.1.166","TCP","54","443  >  50692 [ACK] Seq=332793 Ack=113971 Win=9949 Len=0"
"293","3.253739","23.39.213.4","192.168.1.166","TCP","54","443  >  50692 [ACK] Seq=332793 Ack=114626 Win=9949 Len=0"
"294","3.254875","23.39.213.4","192.168.1.166","TCP","54","443  >  50692 [ACK] Seq=332793 Ack=121557 Win=9911 Len=0"
"295","3.255085","23.39.213.4","192.168.1.166","TCP","54","443  >  50692 [ACK] Seq=332793 Ack=124477 Win=9937 Len=0"
"296","3.265668","23.39.213.4","192.168.1.166","TCP","54","443  >  50692 [ACK] Seq=332793 Ack=132596 Win=9891 Len=0"
"297","3.288243","192.168.1.166","23.39.213.4","TLSv1.2","5463","Application Data"
"298","3.288330","192.168.1.166","23.39.213.4","TLSv1.2","186","Application Data"
"299","3.289212","23.39.213.4","192.168.1.166","TLSv1.2","956","Application Data"
"300","3.289212","23.39.213.4","192.168.1.166","TLSv1.2","1342","Application Data"
"301","3.289212","23.39.213.4","192.168.1.166","TLSv1.2","1514","Application Data"
"302","3.289212","23.39.213.4","192.168.1.166","TLSv1.2","374","Application Data"
"303","3.289212","23.39.213.4","192.168.1.166","TLSv1.2","1514","Application Data"
"304","3.289212","23.39.213.4","192.168.1.166","TLSv1.2","329","Application Data"
"305","3.289212","23.39.213.4","192.168.1.166","TCP","1514","443  >  50692 [ACK] Seq=338498 Ack=132596 Win=9949 Len=1460 [TCP PDU reassembled in 306]"
"306","3.289212","23.39.213.4","192.168.1.166","TLSv1.2","1153","Application Data"
"307","3.289212","23.39.213.4","192.168.1.166","TCP","2974","443  >  50692 [ACK] Seq=341057 Ack=132596 Win=9949 Len=2920 [TCP PDU reassembled in 308]"
"308","3.289212","23.39.213.4","192.168.1.166","TLSv1.2","960","Application Data"
"309","3.289280","192.168.1.166","23.39.213.4","TCP","54","50692  >  443 [ACK] Seq=138137 Ack=344883 Win=16383 Len=0"
"310","3.289889","23.39.213.4","192.168.1.166","TLSv1.2","317","Application Data"
"311","3.289889","23.39.213.4","192.168.1.166","TLSv1.2","1436","Application Data"
"312","3.289889","23.39.213.4","192.168.1.166","TCP","2974","443  >  50692 [ACK] Seq=346528 Ack=132596 Win=9949 Len=2920 [TCP PDU reassembled in 313]"
"313","3.289889","23.39.213.4","192.168.1.166","TLSv1.2","1276","Application Data"
"314","3.289915","192.168.1.166","23.39.213.4","TCP","54","50692  >  443 [ACK] Seq=138137 Ack=350670 Win=16383 Len=0"
"315","3.298613","23.39.213.4","192.168.1.166","TLSv1.2","484","Application Data"
"316","3.298613","23.39.213.4","192.168.1.166","TCP","1514","443  >  50692 [ACK] Seq=351100 Ack=132596 Win=9949 Len=1460 [TCP PDU reassembled in 317]"
"317","3.298613","23.39.213.4","192.168.1.166","TLSv1.2","528","Application Data"
"318","3.298648","192.168.1.166","23.39.213.4","TCP","54","50692  >  443 [ACK] Seq=138137 Ack=353034 Win=16383 Len=0"
"319","3.303697","23.39.213.4","192.168.1.166","TLSv1.2","317","Application Data"
"320","3.303697","23.39.213.4","192.168.1.166","TLSv1.2","1473","Application Data"
"321","3.303697","23.39.213.4","192.168.1.166","TCP","2974","443  >  50692 [ACK] Seq=354716 Ack=132596 Win=9949 Len=2920 [TCP PDU reassembled in 322]"
"322","3.303697","23.39.213.4","192.168.1.166","TLSv1.2","1179","Application Data"
"323","3.303744","192.168.1.166","23.39.213.4","TCP","54","50692  >  443 [ACK] Seq=138137 Ack=358761 Win=16383 Len=0"
"324","3.310796","192.168.1.166","23.39.213.4","TLSv1.2","5504","Application Data"
"325","3.310844","192.168.1.166","23.39.213.4","TLSv1.2","653","Application Data"
"326","3.330004","192.168.1.166","23.39.213.4","TLSv1.2","5504","Application Data"
"327","3.330051","192.168.1.166","23.39.213.4","TLSv1.2","411","Application Data"
"328","3.330945","192.168.1.166","23.39.213.4","TLSv1.2","5504","Application Data"
"329","3.330980","192.168.1.166","23.39.213.4","TLSv1.2","2030","Application Data"
"330","3.332473","192.168.1.166","23.39.213.4","TLSv1.2","5504","Application Data"
"331","3.332507","192.168.1.166","23.39.213.4","TLSv1.2","561","Application Data"
"332","3.349121","23.39.213.4","192.168.1.166","TCP","54","443  >  50692 [ACK] Seq=358761 Ack=135516 Win=9949 Len=0"
"333","3.349121","23.39.213.4","192.168.1.166","TCP","54","443  >  50692 [ACK] Seq=358761 Ack=138137 Win=9937 Len=0"
"334","3.349121","23.39.213.4","192.168.1.166","TCP","54","443  >  50692 [ACK] Seq=358761 Ack=141057 Win=9945 Len=0"
"335","3.349121","23.39.213.4","192.168.1.166","TCP","54","443  >  50692 [ACK] Seq=358761 Ack=144186 Win=9935 Len=0"
"336","3.356178","23.39.213.4","192.168.1.166","TLSv1.2","956","Application Data"
"337","3.356178","23.39.213.4","192.168.1.166","TCP","1514","443  >  50692 [ACK] Seq=359663 Ack=144186 Win=9949 Len=1460 [TCP PDU reassembled in 338]"
"338","3.356178","23.39.213.4","192.168.1.166","TLSv1.2","55","Application Data"
"339","3.356178","23.39.213.4","192.168.1.166","TLSv1.2","885","Application Data"
"340","3.356214","192.168.1.166","23.39.213.4","TCP","54","50692  >  443 [ACK] Seq=163376 Ack=361955 Win=16383 Len=0"
"341","3.361429","192.168.1.166","23.39.213.4","TLSv1.2","5504","Application Data"
"342","3.361465","192.168.1.166","23.39.213.4","TLSv1.2","1069","Application Data"
"343","3.388777","23.39.213.4","192.168.1.166","TLSv1.2","417","Application Data"
"344","3.388777","23.39.213.4","192.168.1.166","TLSv1.2","254","Application Data"
"345","3.388777","23.39.213.4","192.168.1.166","TCP","54","443  >  50692 [ACK] Seq=362518 Ack=151453 Win=9921 Len=0"
"346","3.388777","23.39.213.4","192.168.1.166","TCP","54","443  >  50692 [ACK] Seq=362518 Ack=155443 Win=9939 Len=0"
"347","3.388777","23.39.213.4","192.168.1.166","TCP","54","443  >  50692 [ACK] Seq=362518 Ack=157419 Win=9941 Len=0"
"348","3.388777","23.39.213.4","192.168.1.166","TCP","54","443  >  50692 [ACK] Seq=362518 Ack=163376 Win=9909 Len=0"
"349","3.388827","192.168.1.166","23.39.213.4","TCP","54","50692  >  443 [ACK] Seq=169841 Ack=362518 Win=16381 Len=0"
"350","3.393722","23.39.213.4","192.168.1.166","TCP","54","443  >  50692 [ACK] Seq=362518 Ack=166296 Win=9937 Len=0"
"351","3.393722","23.39.213.4","192.168.1.166","TCP","54","443  >  50692 [ACK] Seq=362518 Ack=169841 Win=9918 Len=0"
"352","3.412219","23.39.213.4","192.168.1.166","TLSv1.2","959","Application Data"
"353","3.412219","23.39.213.4","192.168.1.166","TCP","16114","443  >  50692 [ACK] Seq=363423 Ack=169841 Win=9949 Len=16060 [TCP PDU reassembled in 354]"
"354","3.412219","23.39.213.4","192.168.1.166","TLSv1.2","400","Application Data"
"355","3.412219","23.39.213.4","192.168.1.166","TLSv1.2","85","Application Data"
"356","3.412219","23.39.213.4","192.168.1.166","TCP","16114","443  >  50692 [ACK] Seq=379860 Ack=169841 Win=9949 Len=16060 [TCP PDU reassembled in 357]"
"357","3.412219","23.39.213.4","192.168.1.166","TLSv1.2","400","Application Data"
"358","3.412219","23.39.213.4","192.168.1.166","TLSv1.2","439","Application Data, Application Data"
"359","3.412219","23.39.213.4","192.168.1.166","TLSv1.2","246","Application Data"
"360","3.412283","192.168.1.166","23.39.213.4","TCP","54","50692  >  443 [ACK] Seq=169841 Ack=396843 Win=16383 Len=0"
"361","3.422992","23.39.213.4","192.168.1.166","TLSv1.2","939","Application Data"
"362","3.422992","23.39.213.4","192.168.1.166","TLSv1.2","715","Application Data"
"363","3.423032","192.168.1.166","23.39.213.4","TCP","54","50692  >  443 [ACK] Seq=169841 Ack=398389 Win=16383 Len=0"
"364","3.441080","23.39.213.4","192.168.1.166","TLSv1.2","951","Application Data"
"365","3.441080","23.39.213.4","192.168.1.166","TLSv1.2","174","Application Data"
"366","3.441120","192.168.1.166","23.39.213.4","TCP","54","50692  >  443 [ACK] Seq=169841 Ack=399406 Win=16379 Len=0"
"367","3.447240","192.168.1.166","23.39.213.4","TLSv1.2","5500","Application Data"
"368","3.447307","192.168.1.166","23.39.213.4","TLSv1.2","4300","Application Data"
"369","3.475800","23.39.213.4","192.168.1.166","TLSv1.2","953","Application Data"
"370","3.475800","23.39.213.4","192.168.1.166","TLSv1.2","502","Application Data"
"371","3.475850","192.168.1.166","23.39.213.4","TCP","54","50692  >  443 [ACK] Seq=179533 Ack=400753 Win=16383 Len=0"
"372","3.479803","23.39.213.4","192.168.1.166","TCP","54","443  >  50692 [ACK] Seq=400753 Ack=172761 Win=9949 Len=0"
"373","3.479803","23.39.213.4","192.168.1.166","TCP","54","443  >  50692 [ACK] Seq=400753 Ack=175287 Win=9949 Len=0"
"374","3.479803","23.39.213.4","192.168.1.166","TCP","54","443  >  50692 [ACK] Seq=400753 Ack=179533 Win=9930 Len=0"
"375","3.514528","23.39.213.4","192.168.1.166","TLSv1.2","956","Application Data"
"376","3.514528","23.39.213.4","192.168.1.166","TLSv1.2","504","Application Data"
"377","3.514572","192.168.1.166","23.39.213.4","TCP","54","50692  >  443 [ACK] Seq=179533 Ack=402105 Win=16378 Len=0"
"378","3.521274","23.39.213.4","192.168.1.166","TLSv1.2","960","Application Data"
"379","3.521274","23.39.213.4","192.168.1.166","TLSv1.2","589","Application Data"
"380","3.521325","192.168.1.166","23.39.213.4","TCP","54","50692  >  443 [ACK] Seq=179533 Ack=403546 Win=16383 Len=0"
"381","3.531036","192.168.1.166","23.39.213.4","TLSv1.2","5357","Application Data"
"382","3.531111","192.168.1.166","23.39.213.4","TLSv1.2","796","Application Data"
"383","3.533373","192.168.1.166","23.39.213.4","TLSv1.2","5372","Application Data"
"384","3.533416","192.168.1.166","23.39.213.4","TLSv1.2","883","Application Data"
"385","3.535386","192.168.1.166","23.39.213.4","TLSv1.2","5508","Application Data"
"386","3.535431","192.168.1.166","23.39.213.4","TLSv1.2","2296","Application Data"
"387","3.569178","23.39.213.4","192.168.1.166","TLSv1.2","957","Application Data"
"388","3.569178","23.39.213.4","192.168.1.166","TLSv1.2","1513","Application Data"
"389","3.569178","23.39.213.4","192.168.1.166","TCP","1514","443  >  50692 [ACK] Seq=405908 Ack=179533 Win=9949 Len=1460 [TCP PDU reassembled in 390]"
"390","3.569178","23.39.213.4","192.168.1.166","TLSv1.2","1103","Application Data"
"391","3.569229","192.168.1.166","23.39.213.4","TCP","54","50692  >  443 [ACK] Seq=199421 Ack=408417 Win=16383 Len=0"
"392","3.578099","23.39.213.4","192.168.1.166","TCP","54","443  >  50692 [ACK] Seq=408417 Ack=190896 Win=9899 Len=0"
