"No.","Time","Source","Destination","Protocol","Length","Info"
"1","0.000000","192.168.1.166","23.198.241.2","TLSv1.2","5741","Application Data"
"2","0.000067","192.168.1.166","23.198.241.2","TLSv1.2","93","Application Data"
"3","0.000081","192.168.1.166","23.198.241.2","TLSv1.2","538","Application Data"
"4","0.027192","23.198.241.2","192.168.1.166","TCP","54","443  >  58685 [ACK] Seq=1 Ack=2921 Win=14805 Len=0"
"5","0.027192","23.198.241.2","192.168.1.166","TCP","54","443  >  58685 [ACK] Seq=1 Ack=6211 Win=14785 Len=0"
"6","0.027192","23.198.241.2","192.168.1.166","TLSv1.2","93","Application Data"
"7","0.064368","192.168.1.166","23.198.241.2","TLSv1.2","5860","Application Data"
"8","0.064451","192.168.1.166","23.198.241.2","TLSv1.2","5734","Application Data"
"9","0.064474","192.168.1.166","23.198.241.2","TLSv1.2","853","Application Data"
"10","0.103875","23.198.241.2","192.168.1.166","TCP","54","443  >  58685 [ACK] Seq=40 Ack=10591 Win=14813 Len=0"
"11","0.103875","23.198.241.2","192.168.1.166","TCP","54","443  >  58685 [ACK] Seq=40 Ack=13477 Win=14805 Len=0"
"12","0.103875","23.198.241.2","192.168.1.166","TCP","54","443  >  58685 [ACK] Seq=40 Ack=18496 Win=14793 Len=0"
"13","0.111655","23.198.241.2","192.168.1.166","TLSv1.2","492","Application Data"
"14","0.111655","23.198.241.2","192.168.1.166","TLSv1.2","120","Application Data"
"15","0.111688","192.168.1.166","23.198.241.2","TCP","54","58685  >  443 [ACK] Seq=18496 Ack=544 Win=8188 Len=0"
"16","0.112431","192.168.1.166","23.198.241.2","TLSv1.2","89","Application Data"
"17","0.143264","23.198.241.2","192.168.1.166","TLSv1.2","355","Application Data"
"18","0.143264","23.198.241.2","192.168.1.166","TLSv1.2","121","Application Data"
"19","0.143331","192.168.1.166","23.198.241.2","TCP","54","58685  >  443 [ACK] Seq=18531 Ack=912 Win=8186 Len=0"
"20","1.510243","23.198.241.2","192.168.1.166","TCP","1514","443  >  58685 [ACK] Seq=912 Ack=18531 Win=14813 Len=1460 [TCP PDU reassembled in 21]"
"21","1.510243","23.198.241.2","192.168.1.166","TLSv1.2","1033","Application Data"
"22","1.510243","23.198.241.2","192.168.1.166","TCP","1514","443  >  58685 [ACK] Seq=3351 Ack=18531 Win=14813 Len=1460 [TCP PDU reassembled in 25]"
"23","1.510243","23.198.241.2","192.168.1.166","TCP","1514","443  >  58685 [ACK] Seq=4811 Ack=18531 Win=14813 Len=1460 [TCP PDU reassembled in 25]"
"24","1.510243","23.198.241.2","192.168.1.166","TCP","13194","443  >  58685 [ACK] Seq=6271 Ack=18531 Win=14813 Len=13140 [TCP PDU reassembled in 25]"
"25","1.510243","23.198.241.2","192.168.1.166","TLSv1.2","400","Application Data"
"26","1.510243","23.198.241.2","192.168.1.166","TLSv1.2","85","Application Data"
"27","1.510243","23.198.241.2","192.168.1.166","TCP","16114","443  >  58685 [ACK] Seq=19788 Ack=18531 Win=14813 Len=16060 [TCP PDU reassembled in 28]"
"28","1.510243","23.198.241.2","192.168.1.166","TLSv1.2","400","Application Data"
"29","1.510243","23.198.241.2","192.168.1.166","TLSv1.2","13194","Application Data, Application Data, Application Data"
"30","1.510243","23.198.241.2","192.168.1.166","TCP","1514","443  >  58685 [ACK] Seq=49334 Ack=18531 Win=14813 Len=1460 [TCP PDU reassembled in 39]"
"31","1.510243","23.198.241.2","192.168.1.166","TCP","1514","443  >  58685 [ACK] Seq=50794 Ack=18531 Win=14813 Len=1460 [TCP PDU reassembled in 39]"
"32","1.510243","23.198.241.2","192.168.1.166","TCP","1514","443  >  58685 [ACK] Seq=52254 Ack=18531 Win=14813 Len=1460 [TCP PDU reassembled in 39]"
"33","1.510243","23.198.241.2","192.168.1.166","TCP","1514","443  >  58685 [ACK] Seq=53714 Ack=18531 Win=14813 Len=1460 [TCP PDU reassembled in 39]"
"34","1.510243","23.198.241.2","192.168.1.166","TCP","1514","443  >  58685 [ACK] Seq=55174 Ack=18531 Win=14813 Len=1460 [TCP PDU reassembled in 39]"
"35","1.510243","23.198.241.2","192.168.1.166","TCP","1514","443  >  58685 [ACK] Seq=56634 Ack=18531 Win=14813 Len=1460 [TCP PDU reassembled in 39]"
"36","1.510243","23.198.241.2","192.168.1.166","TCP","1514","443  >  58685 [ACK] Seq=58094 Ack=18531 Win=14813 Len=1460 [TCP PDU reassembled in 39]"
"37","1.510243","23.198.241.2","192.168.1.166","TCP","1514","443  >  58685 [ACK] Seq=59554 Ack=18531 Win=14813 Len=1460 [TCP PDU reassembled in 39]"
"38","1.510243","23.198.241.2","192.168.1.166","TCP","4434","443  >  58685 [ACK] Seq=61014 Ack=18531 Win=14813 Len=4380 [TCP PDU reassembled in 39]"
"39","1.510243","23.198.241.2","192.168.1.166","TLSv1.2","400","Application Data"
"40","1.510243","23.198.241.2","192.168.1.166","TLSv1.2","85","Application Data"
"41","1.510243","23.198.241.2","192.168.1.166","TCP","1514","443  >  58685 [ACK] Seq=65771 Ack=18531 Win=14813 Len=1460 [TCP PDU reassembled in 44]"
"42","1.510243","23.198.241.2","192.168.1.166","TCP","1514","443  >  58685 [ACK] Seq=67231 Ack=18531 Win=14813 Len=1460 [TCP PDU reassembled in 44]"
"43","1.510243","23.198.241.2","192.168.1.166","TCP","1514","443  >  58685 [ACK] Seq=68691 Ack=18531 Win=14813 Len=1460 [TCP PDU reassembled in 44]"
"44","1.510243","23.198.241.2","192.168.1.166","TLSv1.2","1252","Application Data"
"45","1.510375","192.168.1.166","23.198.241.2","TCP","54","58685  >  443 [ACK] Seq=18531 Ack=71349 Win=8191 Len=0"
"46","1.518059","23.198.241.2","192.168.1.166","TCP","16114","443  >  58685 [ACK] Seq=71349 Ack=18531 Win=14813 Len=16060 [TCP PDU reassembled in 47]"
"47","1.518059","23.198.241.2","192.168.1.166","TLSv1.2","400","Application Data"
"48","1.518059","23.198.241.2","192.168.1.166","TLSv1.2","85","Application Data"
"49","1.518059","23.198.241.2","192.168.1.166","TCP","5894","443  >  58685 [ACK] Seq=87786 Ack=18531 Win=14813 Len=5840 [TCP PDU reassembled in 50]"
"50","1.518059","23.198.241.2","192.168.1.166","TLSv1.2","1305","Application Data"
"51","1.518059","23.198.241.2","192.168.1.166","TCP","16114","443  >  58685 [ACK] Seq=94877 Ack=18531 Win=14813 Len=16060 [TCP PDU reassembled in 52]"
"52","1.518059","23.198.241.2","192.168.1.166","TLSv1.2","400","Application Data"
"53","1.518059","23.198.241.2","192.168.1.166","TLSv1.2","85","Application Data"
"54","1.518059","23.198.241.2","192.168.1.166","TCP","7354","443  >  58685 [ACK] Seq=111314 Ack=18531 Win=14813 Len=7300 [TCP PDU reassembled in 55]"
"55","1.518059","23.198.241.2","192.168.1.166","TLSv1.2","975","Application Data"
"56","1.518059","23.198.241.2","192.168.1.166","TCP","7354","443  >  58685 [ACK] Seq=119535 Ack=18531 Win=14813 Len=7300 [TCP PDU reassembled in 57]"
"57","1.518059","23.198.241.2","192.168.1.166","TLSv1.2","1161","Application Data"
"58","1.518059","23.198.241.2","192.168.1.166","TLSv1.2","93","Application Data"
"59","1.518059","23.198.241.2","192.168.1.166","TLSv1.2","85","Application Data"
"60","1.518132","192.168.1.166","23.198.241.2","TCP","54","58685  >  443 [ACK] Seq=18531 Ack=128012 Win=8191 Len=0"
"61","1.520078","192.168.1.166","23.198.241.2","TLSv1.2","6127","Application Data"
"62","1.520122","192.168.1.166","23.198.241.2","TLSv1.2","1644","Application Data"
"63","1.566341","192.168.1.166","23.198.241.2","TLSv1.2","576","Application Data"
"64","1.566360","192.168.1.166","23.198.241.2","TLSv1.2","171","Application Data"
"65","1.572581","23.198.241.2","192.168.1.166","TCP","54","443  >  58685 [ACK] Seq=128012 Ack=24604 Win=14787 Len=0"
"66","1.572581","23.198.241.2","192.168.1.166","TCP","54","443  >  58685 [ACK] Seq=128012 Ack=26194 Win=14810 Len=0"
"67","1.610507","192.168.1.166","23.198.241.2","TLSv1.2","164","Application Data"
"68","1.612417","23.198.241.2","192.168.1.166","TCP","54","443  >  58685 [ACK] Seq=128012 Ack=26833 Win=14813 Len=0"
"69","1.612417","23.198.241.2","192.168.1.166","TLSv1.2","365","Application Data"
"70","1.612417","23.198.241.2","192.168.1.166","TLSv1.2","159","Application Data"
"71","1.612417","23.198.241.2","192.168.1.166","TLSv1.2","339","Application Data"
"72","1.612417","23.198.241.2","192.168.1.166","TCP","1514","443  >  58685 [ACK] Seq=128713 Ack=26833 Win=14813 Len=1460 [TCP PDU reassembled in 73]"
"73","1.612417","23.198.241.2","192.168.1.166","TLSv1.2","61","Application Data"
"74","1.612417","23.198.241.2","192.168.1.166","TCP","8814","443  >  58685 [ACK] Seq=130180 Ack=26833 Win=14813 Len=8760 [TCP PDU reassembled in 75]"
"75","1.612417","23.198.241.2","192.168.1.166","TLSv1.2","843","Application Data"
"76","1.612463","192.168.1.166","23.198.241.2","TCP","54","58685  >  443 [ACK] Seq=26943 Ack=139729 Win=8191 Len=0"
"77","1.612876","192.168.1.166","23.198.241.2","TLSv1.2","5425","Application Data"
"78","1.639678","192.168.1.166","23.198.241.2","TLSv1.2","5744","Application Data"
"79","1.663042","23.198.241.2","192.168.1.166","TCP","54","443  >  58685 [ACK] Seq=139729 Ack=28403 Win=14810 Len=0"
"80","1.663042","23.198.241.2","192.168.1.166","TCP","54","443  >  58685 [ACK] Seq=139729 Ack=31323 Win=14795 Len=0"
"81","1.666046","23.198.241.2","192.168.1.166","TCP","54","443  >  58685 [ACK] Seq=139729 Ack=35234 Win=14805 Len=0"
"82","1.676592","23.198.241.2","192.168.1.166","TLSv1.2","956","Application Data"
"83","1.684496","23.198.241.2","192.168.1.166","TLSv1.2","85","Application Data"
"84","1.684496","23.198.241.2","192.168.1.166","TLSv1.2","372","Application Data"
"85","1.684496","23.198.241.2","192.168.1.166","TLSv1.2","85","Application Data"
"86","1.684513","192.168.1.166","23.198.241.2","TCP","54","58685  >  443 [ACK] Seq=38004 Ack=141011 Win=8186 Len=0"
"87","1.749026","192.168.1.166","23.198.241.2","TLSv1.2","577","Application Data"
"88","1.749069","192.168.1.166","23.198.241.2","TLSv1.2","191","Application Data"
"89","1.749087","192.168.1.166","23.198.241.2","TLSv1.2","183","Application Data"
"90","1.749103","192.168.1.166","23.198.241.2","TLSv1.2","192","Application Data"
"91","1.752276","23.198.241.2","192.168.1.166","TLSv1.2","318","Application Data"
"92","1.752276","23.198.241.2","192.168.1.166","TLSv1.2","1443","Application Data"
"93","1.752276","23.198.241.2","192.168.1.166","TCP","1514","443  >  58685 [ACK] Seq=142664 Ack=38004 Win=14814 Len=1460 [TCP PDU reassembled in 104]"
"94","1.752276","23.198.241.2","192.168.1.166","TCP","1514","443  >  58685 [ACK] Seq=144124 Ack=38004 Win=14814 Len=1460 [TCP PDU reassembled in 104]"
"95","1.752276","23.198.241.2","192.168.1.166","TCP","1514","443  >  58685 [ACK] Seq=145584 Ack=38004 Win=14814 Len=1460 [TCP PDU reassembled in 104]"
"96","1.752276","23.198.241.2","192.168.1.166","TCP","1514","443  >  58685 [ACK] Seq=147044 Ack=38004 Win=14814 Len=1460 [TCP PDU reassembled in 104]"
"97","1.752276","23.198.241.2","192.168.1.166","TCP","1514","443  >  58685 [ACK] Seq=148504 Ack=38004 Win=14814 Len=1460 [TCP PDU reassembled in 104]"
"98","1.752276","23.198.241.2","192.168.1.166","TCP","1514","443  >  58685 [ACK] Seq=149964 Ack=38004 Win=14814 Len=1460 [TCP PDU reassembled in 104]"
"99","1.752276","23.198.241.2","192.168.1.166","TCP","1514","443  >  58685 [ACK] Seq=151424 Ack=38004 Win=14814 Len=1460 [TCP PDU reassembled in 104]"
"100","1.752276","23.198.241.2","192.168.1.166","TCP","1514","443  >  58685 [ACK] Seq=152884 Ack=38004 Win=14814 Len=1460 [TCP PDU reassembled in 104]"
"101","1.752276","23.198.241.2","192.168.1.166","TCP","1514","443  >  58685 [ACK] Seq=154344 Ack=38004 Win=14814 Len=1460 [TCP PDU reassembled in 104]"
"102","1.752276","23.198.241.2","192.168.1.166","TCP","1514","443  >  58685 [ACK] Seq=155804 Ack=38004 Win=14814 Len=1460 [TCP PDU reassembled in 104]"
"103","1.752276","23.198.241.2","192.168.1.166","TCP","1514","443  >  58685 [ACK] Seq=157264 Ack=38004 Win=14814 Len=1460 [TCP PDU reassembled in 104]"
"104","1.752276","23.198.241.2","192.168.1.166","TLSv1.2","400","Application Data"
"105","1.752276","23.198.241.2","192.168.1.166","TLSv1.2","85","Application Data"
"106","1.752276","23.198.241.2","192.168.1.166","TCP","1514","443  >  58685 [ACK] Seq=159101 Ack=38004 Win=14814 Len=1460 [TCP PDU reassembled in 117]"
"107","1.752276","23.198.241.2","192.168.1.166","TCP","1514","443  >  58685 [ACK] Seq=160561 Ack=38004 Win=14814 Len=1460 [TCP PDU reassembled in 117]"
"108","1.752276","23.198.241.2","192.168.1.166","TCP","1514","443  >  58685 [ACK] Seq=162021 Ack=38004 Win=14814 Len=1460 [TCP PDU reassembled in 117]"
"109","1.752276","23.198.241.2","192.168.1.166","TCP","1514","443  >  58685 [ACK] Seq=163481 Ack=38004 Win=14814 Len=1460 [TCP PDU reassembled in 117]"
"110","1.752276","23.198.241.2","192.168.1.166","TCP","1514","443  >  58685 [ACK] Seq=164941 Ack=38004 Win=14814 Len=1460 [TCP PDU reassembled in 117]"
"111","1.752276","23.198.241.2","192.168.1.166","TCP","1514","443  >  58685 [ACK] Seq=166401 Ack=38004 Win=14814 Len=1460 [TCP PDU reassembled in 117]"
"112","1.752276","23.198.241.2","192.168.1.166","TCP","1514","443  >  58685 [ACK] Seq=167861 Ack=38004 Win=14814 Len=1460 [TCP PDU reassembled in 117]"
"113","1.752276","23.198.241.2","192.168.1.166","TCP","1514","443  >  58685 [ACK] Seq=169321 Ack=38004 Win=14814 Len=1460 [TCP PDU reassembled in 117]"
"114","1.752276","23.198.241.2","192.168.1.166","TCP","1514","443  >  58685 [ACK] Seq=170781 Ack=38004 Win=14814 Len=1460 [TCP PDU reassembled in 117]"
"115","1.752276","23.198.241.2","192.168.1.166","TCP","1514","443  >  58685 [ACK] Seq=172241 Ack=38004 Win=14814 Len=1460 [TCP PDU reassembled in 117]"
"116","1.752276","23.198.241.2","192.168.1.166","TCP","1514","443  >  58685 [ACK] Seq=173701 Ack=38004 Win=14814 Len=1460 [TCP PDU reassembled in 117]"
"117","1.752276","23.198.241.2","192.168.1.166","TLSv1.2","400","Application Data"
"118","1.752276","23.198.241.2","192.168.1.166","TLSv1.2","1514","Application Data"
"119","1.752276","23.198.241.2","192.168.1.166","TLSv1.2","30714","Application Data, Application Data"
"120","1.752276","23.198.241.2","192.168.1.166","TLSv1.2","808","Application Data"
"121","1.752276","23.198.241.2","192.168.1.166","TLSv1.2","16114","Application Data"
"122","1.752276","23.198.241.2","192.168.1.166","TLSv1.2","462","Application Data, Application Data"
"123","1.752443","192.168.1.166","23.198.241.2","TCP","54","58685  >  443 [ACK] Seq=38931 Ack=224849 Win=8191 Len=0"
"124","1.752502","23.198.241.2","192.168.1.166","TLSv1.2","27794","Application Data, Application Data"
"125","1.752502","23.198.241.2","192.168.1.166","TLSv1.2","772","Application Data"
"126","1.752517","192.168.1.166","23.198.241.2","TCP","54","58685  >  443 [ACK] Seq=38931 Ack=253307 Win=8191 Len=0"
"127","1.754130","192.168.1.166","23.198.241.2","TLSv1.2","191","Application Data"
"128","1.774360","23.198.241.2","192.168.1.166","TCP","54","443  >  58685 [ACK] Seq=253307 Ack=38931 Win=14814 Len=0"
"129","1.793788","23.198.241.2","192.168.1.166","TLSv1.2","338","Application Data"
"130","1.793788","23.198.241.2","192.168.1.166","TLSv1.2","1505","Application Data"
"131","1.793788","23.198.241.2","192.168.1.166","TLSv1.2","338","Application Data"
"132","1.793788","23.198.241.2","192.168.1.166","TLSv1.2","1019","Application Data"
"133","1.793788","23.198.241.2","192.168.1.166","TCP","2974","443  >  58685 [ACK] Seq=256291 Ack=39068 Win=14814 Len=2920 [TCP PDU reassembled in 134]"
"134","1.793788","23.198.241.2","192.168.1.166","TLSv1.2","549","Application Data"
"135","1.793829","192.168.1.166","23.198.241.2","TCP","54","58685  >  443 [ACK] Seq=39068 Ack=259706 Win=8191 Len=0"
"136","1.794886","192.168.1.166","23.198.241.2","TLSv1.2","192","Application Data"
"137","1.794918","192.168.1.166","23.198.241.2","TLSv1.2","192","Application Data"
"138","1.804355","192.168.1.166","23.198.241.2","TLSv1.2","90","Application Data"
"139","1.804384","192.168.1.166","23.198.241.2","TLSv1.2","90","Application Data"
"140","1.822688","23.198.241.2","192.168.1.166","TCP","54","443  >  58685 [ACK] Seq=259706 Ack=39344 Win=14814 Len=0"
"141","1.852013","23.198.241.2","192.168.1.166","TLSv1.2","317","Application Data"
"142","1.852013","23.198.241.2","192.168.1.166","TCP","1514","443  >  58685 [ACK] Seq=259969 Ack=39344 Win=14814 Len=1460 [TCP PDU reassembled in 143]"
"143","1.852013","23.198.241.2","192.168.1.166","TLSv1.2","89","Application Data"
"144","1.852013","23.198.241.2","192.168.1.166","TCP","4434","443  >  58685 [ACK] Seq=261464 Ack=39344 Win=14814 Len=4380 [TCP PDU reassembled in 145]"
"145","1.852013","23.198.241.2","192.168.1.166","TLSv1.2","261","Application Data"
"146","1.852013","23.198.241.2","192.168.1.166","TLSv1.2","338","Application Data"
"147","1.852013","23.198.241.2","192.168.1.166","TLSv1.2","515","Application Data"
"148","1.852013","23.198.241.2","192.168.1.166","TCP","54","443  >  58685 [ACK] Seq=266796 Ack=39416 Win=14814 Len=0"
"149","1.852063","192.168.1.166","23.198.241.2","TCP","54","58685  >  443 [ACK] Seq=39416 Ack=266796 Win=8191 Len=0"
"150","1.853098","192.168.1.166","23.198.241.2","TLSv1.2","192","Application Data"
"151","1.853136","192.168.1.166","23.198.241.2","TLSv1.2","193","Application Data"
"152","1.875340","23.198.241.2","192.168.1.166","TLSv1.2","317","Application Data"
"153","1.875340","23.198.241.2","192.168.1.166","TLSv1.2","1448","Application Data"
"154","1.875340","23.198.241.2","192.168.1.166","TCP","1514","443  >  58685 [ACK] Seq=268453 Ack=39416 Win=14814 Len=1460 [TCP PDU reassembled in 156]"
"155","1.875340","23.198.241.2","192.168.1.166","TCP","1514","443  >  58685 [ACK] Seq=269913 Ack=39416 Win=14814 Len=1460 [TCP PDU reassembled in 156]"
"156","1.875340","23.198.241.2","192.168.1.166","TLSv1.2","988","Application Data"
"157","1.875340","23.198.241.2","192.168.1.166","TLSv1.2","316","Application Data"
"158","1.875340","23.198.241.2","192.168.1.166","TLSv1.2","1449","Application Data"
"159","1.875340","23.198.241.2","192.168.1.166","TLSv1.2","789","Application Data"
"160","1.875383","192.168.1.166","23.198.241.2","TCP","54","58685  >  443 [ACK] Seq=39693 Ack=274699 Win=8191 Len=0"
"161","1.876443","192.168.1.166","23.198.241.2","TLSv1.2","192","Application Data"
"162","1.876473","192.168.1.166","23.198.241.2","TLSv1.2","192","Application Data"
"163","1.886412","23.198.241.2","192.168.1.166","TCP","54","443  >  58685 [ACK] Seq=274699 Ack=39693 Win=14814 Len=0"
"164","1.908605","23.198.241.2","192.168.1.166","TCP","54","443  >  58685 [ACK] Seq=274699 Ack=39969 Win=14814 Len=0"
"165","1.921133","23.198.241.2","192.168.1.166","TLSv1.2","317","Application Data"
"166","1.921133","23.198.241.2","192.168.1.166","TLSv1.2","1449","Application Data"
"167","1.921133","23.198.241.2","192.168.1.166","TCP","2974","443  >  58685 [ACK] Seq=276357 Ack=39969 Win=14814 Len=2920 [TCP PDU reassembled in 168]"
"168","1.921133","23.198.241.2","192.168.1.166","TLSv1.2","165","Application Data"
"169","1.921177","192.168.1.166","23.198.241.2","TCP","54","58685  >  443 [ACK] Seq=39969 Ack=279388 Win=8191 Len=0"
"170","1.928271","23.198.241.2","192.168.1.166","TLSv1.2","317","Application Data"
"171","1.928271","23.198.241.2","192.168.1.166","TCP","1514","443  >  58685 [ACK] Seq=279651 Ack=39969 Win=14814 Len=1460 [TCP PDU reassembled in 172]"
"172","1.928271","23.198.241.2","192.168.1.166","TLSv1.2","88","Application Data"
"173","1.928271","23.198.241.2","192.168.1.166","TCP","1514","443  >  58685 [ACK] Seq=281145 Ack=39969 Win=14814 Len=1460 [TCP PDU reassembled in 174]"
"174","1.928271","23.198.241.2","192.168.1.166","TLSv1.2","1512","Application Data"
"175","1.928313","192.168.1.166","23.198.241.2","TCP","54","58685  >  443 [ACK] Seq=39969 Ack=284063 Win=8191 Len=0"
"176","1.983083","23.198.241.2","192.168.1.166","TLSv1.2","317","Application Data"
"177","1.983083","23.198.241.2","192.168.1.166","TCP","1514","443  >  58685 [ACK] Seq=284326 Ack=39969 Win=14814 Len=1460 [TCP PDU reassembled in 178]"
"178","1.983083","23.198.241.2","192.168.1.166","TLSv1.2","88","Application Data"
"179","1.983083","23.198.241.2","192.168.1.166","TCP","7354","443  >  58685 [ACK] Seq=285820 Ack=39969 Win=14814 Len=7300 [TCP PDU reassembled in 180]"
"180","1.983083","23.198.241.2","192.168.1.166","TLSv1.2","980","Application Data"
"181","1.983127","192.168.1.166","23.198.241.2","TCP","54","58685  >  443 [ACK] Seq=39969 Ack=294046 Win=8191 Len=0"
"182","1.987497","23.198.241.2","192.168.1.166","TLSv1.2","316","Application Data"
"183","1.987497","23.198.241.2","192.168.1.166","TCP","1514","443  >  58685 [ACK] Seq=294308 Ack=39969 Win=14814 Len=1460 [TCP PDU reassembled in 184]"
"184","1.987497","23.198.241.2","192.168.1.166","TLSv1.2","89","Application Data"
"185","1.987497","23.198.241.2","192.168.1.166","TCP","5894","443  >  58685 [ACK] Seq=295803 Ack=39969 Win=14814 Len=5840 [TCP PDU reassembled in 186]"
"186","1.987497","23.198.241.2","192.168.1.166","TLSv1.2","201","Application Data"
"187","1.987528","192.168.1.166","23.198.241.2","TCP","54","58685  >  443 [ACK] Seq=39969 Ack=301790 Win=8191 Len=0"
"188","2.031546","23.198.241.2","192.168.1.166","TLSv1.2","317","Application Data"
"189","2.031546","23.198.241.2","192.168.1.166","TLSv1.2","1447","Application Data"
"190","2.031546","23.198.241.2","192.168.1.166","TCP","1514","443  >  58685 [ACK] Seq=303446 Ack=39969 Win=14814 Len=1460 [TCP PDU reassembled in 193]"
"191","2.031546","23.198.241.2","192.168.1.166","TCP","1514","443  >  58685 [ACK] Seq=304906 Ack=39969 Win=14814 Len=1460 [TCP PDU reassembled in 193]"
"192","2.031546","23.198.241.2","192.168.1.166","TCP","1514","443  >  58685 [ACK] Seq=306366 Ack=39969 Win=14814 Len=1460 [TCP PDU reassembled in 193]"
"193","2.031546","23.198.241.2","192.168.1.166","TLSv1.2","431","Application Data"
"194","2.031590","192.168.1.166","23.198.241.2","TCP","54","58685  >  443 [ACK] Seq=39969 Ack=308203 Win=8191 Len=0"
"195","2.085722","23.198.241.2","192.168.1.166","TLSv1.2","317","Application Data"
"196","2.085722","23.198.241.2","192.168.1.166","TCP","1514","443  >  58685 [ACK] Seq=308466 Ack=39969 Win=14814 Len=1460 [TCP PDU reassembled in 197]"
"197","2.085722","23.198.241.2","192.168.1.166","TLSv1.2","88","Application Data"
"198","2.085722","23.198.241.2","192.168.1.166","TCP","2974","443  >  58685 [ACK] Seq=309960 Ack=39969 Win=14814 Len=2920 [TCP PDU reassembled in 199]"
"199","2.085722","23.198.241.2","192.168.1.166","TLSv1.2","1040","Application Data"
"200","2.085757","192.168.1.166","23.198.241.2","TCP","54","58685  >  443 [ACK] Seq=39969 Ack=313866 Win=8191 Len=0"
"201","2.136621","192.168.1.166","23.198.241.2","TLSv1.2","5554","Application Data"
"202","2.136690","192.168.1.166","23.198.241.2","TLSv1.2","588","Application Data"
"203","2.155615","192.168.1.166","23.198.241.2","TLSv1.2","5803","Application Data"
"204","2.155677","192.168.1.166","23.198.241.2","TLSv1.2","3609","Application Data"
"205","2.163369","23.198.241.2","192.168.1.166","TCP","54","443  >  58685 [ACK] Seq=313866 Ack=42889 Win=14805 Len=0"
"206","2.163369","23.198.241.2","192.168.1.166","TCP","54","443  >  58685 [ACK] Seq=313866 Ack=45469 Win=14814 Len=0"
"207","2.185014","192.168.1.166","23.198.241.2","TLSv1.2","5802","Application Data"
"208","2.185068","192.168.1.166","23.198.241.2","TLSv1.2","685","Application Data"
"209","2.188138","23.198.241.2","192.168.1.166","TCP","54","443  >  58685 [ACK] Seq=313866 Ack=51752 Win=14790 Len=0"
"210","2.188138","23.198.241.2","192.168.1.166","TCP","54","443  >  58685 [ACK] Seq=313866 Ack=55307 Win=14808 Len=0"
"211","2.212640","23.198.241.2","192.168.1.166","TCP","54","443  >  58685 [ACK] Seq=313866 Ack=61686 Win=14786 Len=0"
"212","2.224963","23.198.241.2","192.168.1.166","TLSv1.2","493","Application Data"
"213","2.224963","23.198.241.2","192.168.1.166","TLSv1.2","872","Application Data"
"214","2.224993","192.168.1.166","23.198.241.2","TCP","54","58685  >  443 [ACK] Seq=61686 Ack=315123 Win=8186 Len=0"
"215","2.287759","192.168.1.166","23.198.241.2","TLSv1.2","571","Application Data"
"216","2.287813","192.168.1.166","23.198.241.2","TLSv1.2","190","Application Data"
"217","2.287830","192.168.1.166","23.198.241.2","TLSv1.2","191","Application Data"
"218","2.287845","192.168.1.166","23.198.241.2","TLSv1.2","190","Application Data"
"219","2.287896","192.168.1.166","23.198.241.2","TLSv1.2","192","Application Data"
"220","2.287918","192.168.1.166","23.198.241.2","TLSv1.2","191","Application Data"
"221","2.296694","23.198.241.2","192.168.1.166","TLSv1.2","492","Application Data"
"222","2.296694","23.198.241.2","192.168.1.166","TLSv1.2","173","Application Data"
"223","2.296719","192.168.1.166","23.198.241.2","TCP","54","58685  >  443 [ACK] Seq=62887 Ack=315680 Win=8191 Len=0"
"224","2.308557","192.168.1.166","23.198.241.2","TLSv1.2","90","Application Data"
"225","2.308607","192.168.1.166","23.198.241.2","TLSv1.2","90","Application Data"
"226","2.308649","192.168.1.166","23.198.241.2","TLSv1.2","90","Application Data"
"227","2.308666","192.168.1.166","23.198.241.2","TLSv1.2","90","Application Data"
"228","2.308677","192.168.1.166","23.198.241.2","TLSv1.2","90","Application Data"
"229","2.308687","192.168.1.166","23.198.241.2","TLSv1.2","90","Application Data"
"230","2.308697","192.168.1.166","23.198.241.2","TLSv1.2","90","Application Data"
"231","2.314419","23.198.241.2","192.168.1.166","TCP","54","443  >  58685 [ACK] Seq=315680 Ack=62887 Win=14814 Len=0"
"232","2.318755","192.168.1.166","23.198.241.2","TLSv1.2","5436","Application Data"
"233","2.318813","192.168.1.166","23.198.241.2","TLSv1.2","391","Application Data"
"234","2.319134","192.168.1.166","23.198.241.2","TLSv1.2","5803","Application Data"
"235","2.319164","192.168.1.166","23.198.241.2","TLSv1.2","3223","Application Data"
"236","2.333671","23.198.241.2","192.168.1.166","TCP","54","443  >  58685 [ACK] Seq=315680 Ack=62959 Win=14814 Len=0"
"237","2.337662","23.198.241.2","192.168.1.166","TCP","54","443  >  58685 [ACK] Seq=315680 Ack=63139 Win=14814 Len=0"
"238","2.345780","23.198.241.2","192.168.1.166","TCP","54","443  >  58685 [ACK] Seq=315680 Ack=66059 Win=14814 Len=0"
"239","2.345780","23.198.241.2","192.168.1.166","TCP","54","443  >  58685 [ACK] Seq=315680 Ack=68858 Win=14803 Len=0"
"240","2.345780","23.198.241.2","192.168.1.166","TCP","54","443  >  58685 [ACK] Seq=315680 Ack=71778 Win=14812 Len=0"
"241","2.345780","23.198.241.2","192.168.1.166","TCP","54","443  >  58685 [ACK] Seq=315680 Ack=77776 Win=14780 Len=0"
"242","2.361859","192.168.1.166","23.198.241.2","TLSv1.2","5685","Application Data"
"243","2.362455","192.168.1.166","23.198.241.2","TLSv1.2","5709","Application Data"
"244","2.376384","23.198.241.2","192.168.1.166","TLSv1.2","494","Application Data"
"245","2.376384","23.198.241.2","192.168.1.166","TLSv1.2","1506","Application Data"
"246","2.376384","23.198.241.2","192.168.1.166","TLSv1.2","1046","Application Data"
"247","2.376408","192.168.1.166","23.198.241.2","TCP","54","58685  >  443 [ACK] Seq=89062 Ack=318564 Win=8191 Len=0"
"248","2.383449","23.198.241.2","192.168.1.166","TLSv1.2","317","Application Data"
"249","2.383449","23.198.241.2","192.168.1.166","TLSv1.2","1031","Application Data"
"250","2.383478","192.168.1.166","23.198.241.2","TCP","54","58685  >  443 [ACK] Seq=89062 Ack=319804 Win=8187 Len=0"
"251","2.397065","23.198.241.2","192.168.1.166","TCP","54","443  >  58685 [ACK] Seq=319804 Ack=82156 Win=14797 Len=0"
"252","2.397065","23.198.241.2","192.168.1.166","TCP","54","443  >  58685 [ACK] Seq=319804 Ack=84867 Win=14806 Len=0"
"253","2.397065","23.198.241.2","192.168.1.166","TCP","54","443  >  58685 [ACK] Seq=319804 Ack=87787 Win=14814 Len=0"
"254","2.407723","23.198.241.2","192.168.1.166","TLSv1.2","317","Application Data"
"255","2.407723","23.198.241.2","192.168.1.166","TLSv1.2","1195","Application Data"
"256","2.407723","23.198.241.2","192.168.1.166","TLSv1.2","317","Application Data"
"257","2.407723","23.198.241.2","192.168.1.166","TLSv1.2","1023","Application Data"
"258","2.407750","192.168.1.166","23.198.241.2","TCP","54","58685  >  443 [ACK] Seq=89062 Ack=322440 Win=8191 Len=0"
"259","2.426691","23.198.241.2","192.168.1.166","TLSv1.2","317","Application Data"
"260","2.426691","23.198.241.2","192.168.1.166","TLSv1.2","745","Application Data"
"261","2.426719","192.168.1.166","23.198.241.2","TCP","54","58685  >  443 [ACK] Seq=89062 Ack=323394 Win=8188 Len=0"
"262","2.441452","23.198.241.2","192.168.1.166","TLSv1.2","318","Application Data"
"263","2.441452","23.198.241.2","192.168.1.166","TCP","1514","443  >  58685 [ACK] Seq=323658 Ack=89062 Win=14814 Len=1460 [TCP PDU reassembled in 264]"
"264","2.441452","23.198.241.2","192.168.1.166","TLSv1.2","86","Application Data"
"265","2.441480","192.168.1.166","23.198.241.2","TCP","54","58685  >  443 [ACK] Seq=89062 Ack=325150 Win=8191 Len=0"
"266","2.450174","23.198.241.2","192.168.1.166","TCP","16114","443  >  58685 [ACK] Seq=325150 Ack=89062 Win=14814 Len=16060 [TCP PDU reassembled in 267]"
"267","2.450174","23.198.241.2","192.168.1.166","TLSv1.2","400","Application Data"
"268","2.450174","23.198.241.2","192.168.1.166","TLSv1.2","85","Application Data"
"269","2.450174","23.198.241.2","192.168.1.166","TCP","16114","443  >  58685 [ACK] Seq=341587 Ack=89062 Win=14814 Len=16060 [TCP PDU reassembled in 270]"
"270","2.450174","23.198.241.2","192.168.1.166","TLSv1.2","400","Application Data"
"271","2.450174","23.198.241.2","192.168.1.166","TLSv1.2","32174","Application Data, Application Data, Application Data"
"272","2.450174","23.198.241.2","192.168.1.166","TLSv1.2","808","Application Data"
"273","2.450174","23.198.241.2","192.168.1.166","TLSv1.2","85","Application Data"
"274","2.450174","23.198.241.2","192.168.1.166","TLSv1.2","1460","Application Data"
"275","2.450174","23.198.241.2","192.168.1.166","TLSv1.2","490","Application Data"
"276","2.450174","23.198.241.2","192.168.1.166","TLSv1.2","448","Application Data"
"277","2.450238","192.168.1.166","23.198.241.2","TCP","54","58685  >  443 [ACK] Seq=89062 Ack=393134 Win=8191 Len=0"
"278","2.452306","23.198.241.2","192.168.1.166","TLSv1.2","491","Application Data"
"279","2.452306","23.198.241.2","192.168.1.166","TLSv1.2","639","Application Data"
"280","2.452331","192.168.1.166","23.198.241.2","TCP","54","58685  >  443 [ACK] Seq=89062 Ack=394156 Win=8187 Len=0"
"281","2.454256","23.198.241.2","192.168.1.166","TLSv1.2","494","Application Data"
"282","2.454256","23.198.241.2","192.168.1.166","TLSv1.2","1507","Application Data"
"283","2.454256","23.198.241.2","192.168.1.166","TCP","1514","443  >  58685 [ACK] Seq=396049 Ack=89062 Win=14814 Len=1460 [TCP PDU reassembled in 289]"
"284","2.454256","23.198.241.2","192.168.1.166","TCP","1514","443  >  58685 [ACK] Seq=397509 Ack=89062 Win=14814 Len=1460 [TCP PDU reassembled in 289]"
"285","2.454256","23.198.241.2","192.168.1.166","TCP","1514","443  >  58685 [ACK] Seq=398969 Ack=89062 Win=14814 Len=1460 [TCP PDU reassembled in 289]"
"286","2.454256","23.198.241.2","192.168.1.166","TCP","1514","443  >  58685 [ACK] Seq=400429 Ack=89062 Win=14814 Len=1460 [TCP PDU reassembled in 289]"
"287","2.454256","23.198.241.2","192.168.1.166","TCP","1514","443  >  58685 [ACK] Seq=401889 Ack=89062 Win=14814 Len=1460 [TCP PDU reassembled in 289]"
"288","2.454256","23.198.241.2","192.168.1.166","TCP","1514","443  >  58685 [ACK] Seq=403349 Ack=89062 Win=14814 Len=1460 [TCP PDU reassembled in 289]"
"289","2.454256","23.198.241.2","192.168.1.166","TLSv1.2","418","Application Data"
"290","2.454293","192.168.1.166","23.198.241.2","TCP","54","58685  >  443 [ACK] Seq=89062 Ack=405173 Win=8191 Len=0"
"291","2.471589","192.168.1.166","23.198.241.2","TLSv1.2","5684","Application Data"
"292","2.471662","192.168.1.166","23.198.241.2","TLSv1.2","317","Application Data"
"293","2.497044","23.198.241.2","192.168.1.166","TCP","54","443  >  58685 [ACK] Seq=405173 Ack=91982 Win=14805 Len=0"
"294","2.497044","23.198.241.2","192.168.1.166","TCP","54","443  >  58685 [ACK] Seq=405173 Ack=94955 Win=14803 Len=0"
"295","2.516291","23.198.241.2","192.168.1.166","TLSv1.2","318","Application Data"
"296","2.516291","23.198.241.2","192.168.1.166","TCP","1514","443  >  58685 [ACK] Seq=405437 Ack=94955 Win=14814 Len=1460 [TCP PDU reassembled in 297]"
"297","2.516291","23.198.241.2","192.168.1.166","TLSv1.2","86","Application Data"
"298","2.516291","23.198.241.2","192.168.1.166","TCP","1514","443  >  58685 [ACK] Seq=406929 Ack=94955 Win=14814 Len=1460 [TCP PDU reassembled in 309]"
"299","2.516291","23.198.241.2","192.168.1.166","TCP","1514","443  >  58685 [ACK] Seq=408389 Ack=94955 Win=14814 Len=1460 [TCP PDU reassembled in 309]"
"300","2.516291","23.198.241.2","192.168.1.166","TCP","1514","443  >  58685 [ACK] Seq=409849 Ack=94955 Win=14814 Len=1460 [TCP PDU reassembled in 309]"
"301","2.516291","23.198.241.2","192.168.1.166","TCP","1514","443  >  58685 [ACK] Seq=411309 Ack=94955 Win=14814 Len=1460 [TCP PDU reassembled in 309]"
"302","2.516291","23.198.241.2","192.168.1.166","TCP","1514","443  >  58685 [ACK] Seq=412769 Ack=94955 Win=14814 Len=1460 [TCP PDU reassembled in 309]"
"303","2.516291","23.198.241.2","192.168.1.166","TCP","1514","443  >  58685 [ACK] Seq=414229 Ack=94955 Win=14814 Len=1460 [TCP PDU reassembled in 309]"
"304","2.516291","23.198.241.2","192.168.1.166","TCP","1514","443  >  58685 [ACK] Seq=415689 Ack=94955 Win=14814 Len=1460 [TCP PDU reassembled in 309]"
"305","2.516291","23.198.241.2","192.168.1.166","TCP","1514","443  >  58685 [ACK] Seq=417149 Ack=94955 Win=14814 Len=1460 [TCP PDU reassembled in 309]"
"306","2.516291","23.198.241.2","192.168.1.166","TCP","1514","443  >  58685 [ACK] Seq=418609 Ack=94955 Win=14814 Len=1460 [TCP PDU reassembled in 309]"
"307","2.516291","23.198.241.2","192.168.1.166","TCP","1514","443  >  58685 [ACK] Seq=420069 Ack=94955 Win=14814 Len=1460 [TCP PDU reassembled in 309]"
"308","2.516291","23.198.241.2","192.168.1.166","TCP","1514","443  >  58685 [ACK] Seq=421529 Ack=94955 Win=14814 Len=1460 [TCP PDU reassembled in 309]"
"309","2.516291","23.198.241.2","192.168.1.166","TLSv1.2","400","Application Data"
"310","2.516291","23.198.241.2","192.168.1.166","TLSv1.2","85","Application Data"
"311","2.516291","23.198.241.2","192.168.1.166","TCP","16114","443  >  58685 [ACK] Seq=423366 Ack=94955 Win=14814 Len=16060 [TCP PDU reassembled in 312]"
"312","2.516291","23.198.241.2","192.168.1.166","TLSv1.2","400","Application Data"
"313","2.516291","23.198.241.2","192.168.1.166","TLSv1.2","1514","Application Data"
"314","2.516291","23.198.241.2","192.168.1.166","TCP","1514","443  >  58685 [ACK] Seq=441232 Ack=94955 Win=14814 Len=1460 [TCP PDU reassembled in 321]"
"315","2.516291","23.198.241.2","192.168.1.166","TCP","1514","443  >  58685 [ACK] Seq=442692 Ack=94955 Win=14814 Len=1460 [TCP PDU reassembled in 321]"
"316","2.516291","23.198.241.2","192.168.1.166","TCP","1514","443  >  58685 [ACK] Seq=444152 Ack=94955 Win=14814 Len=1460 [TCP PDU reassembled in 321]"
"317","2.516291","23.198.241.2","192.168.1.166","TCP","5894","443  >  58685 [ACK] Seq=445612 Ack=94955 Win=14814 Len=5840 [TCP PDU reassembled in 321]"
"318","2.516291","23.198.241.2","192.168.1.166","TCP","1514","443  >  58685 [ACK] Seq=451452 Ack=94955 Win=14814 Len=1460 [TCP PDU reassembled in 321]"
"319","2.516291","23.198.241.2","192.168.1.166","TCP","1514","443  >  58685 [ACK] Seq=452912 Ack=94955 Win=14814 Len=1460 [TCP PDU reassembled in 321]"
"320","2.516291","23.198.241.2","192.168.1.166","TCP","1514","443  >  58685 [ACK] Seq=454372 Ack=94955 Win=14814 Len=1460 [TCP PDU reassembled in 321]"
"321","2.516291","23.198.241.2","192.168.1.166","TLSv1.2","1514","Application Data, Application Data"
"322","2.516291","23.198.241.2","192.168.1.166","TCP","1514","443  >  58685 [ACK] Seq=457292 Ack=94955 Win=14814 Len=1460 [TCP PDU reassembled in 328]"
"323","2.516291","23.198.241.2","192.168.1.166","TCP","1514","443  >  58685 [ACK] Seq=458752 Ack=94955 Win=14814 Len=1460 [TCP PDU reassembled in 328]"
"324","2.516291","23.198.241.2","192.168.1.166","TCP","8814","443  >  58685 [ACK] Seq=460212 Ack=94955 Win=14814 Len=8760 [TCP PDU reassembled in 328]"
"325","2.516291","23.198.241.2","192.168.1.166","TCP","1514","443  >  58685 [ACK] Seq=468972 Ack=94955 Win=14814 Len=1460 [TCP PDU reassembled in 328]"
"326","2.516291","23.198.241.2","192.168.1.166","TCP","1514","443  >  58685 [ACK] Seq=470432 Ack=94955 Win=14814 Len=1460 [TCP PDU reassembled in 328]"
"327","2.516439","192.168.1.166","23.198.241.2","TCP","54","58685  >  443 [ACK] Seq=94955 Ack=471892 Win=8191 Len=0"
"328","2.516501","23.198.241.2","192.168.1.166","TLSv1.2","808","Application Data"
"329","2.516501","23.198.241.2","192.168.1.166","TLSv1.2","85","Application Data"
"330","2.516501","23.198.241.2","192.168.1.166","TCP","1514","443  >  58685 [ACK] Seq=472677 Ack=94955 Win=14814 Len=1460 [TCP PDU reassembled in 332]"
"331","2.516501","23.198.241.2","192.168.1.166","TCP","5894","443  >  58685 [ACK] Seq=474137 Ack=94955 Win=14814 Len=5840 [TCP PDU reassembled in 332]"
"332","2.516501","23.198.241.2","192.168.1.166","TLSv1.2","160","Application Data"
"333","2.516513","192.168.1.166","23.198.241.2","TCP","54","58685  >  443 [ACK] Seq=94955 Ack=480083 Win=8191 Len=0"
"334","2.518207","23.198.241.2","192.168.1.166","TLSv1.2","493","Application Data"
"335","2.518207","23.198.241.2","192.168.1.166","TLSv1.2","1508","Application Data"
"336","2.518207","23.198.241.2","192.168.1.166","TLSv1.2","159","Application Data"
"337","2.518223","192.168.1.166","23.198.241.2","TCP","54","58685  >  443 [ACK] Seq=94955 Ack=482081 Win=8191 Len=0"
"338","2.532454","192.168.1.166","23.198.241.2","TLSv1.2","5803","Application Data"
"339","2.532491","192.168.1.166","23.198.241.2","TLSv1.2","411","Application Data"
"340","2.533368","192.168.1.166","23.198.241.2","TLSv1.2","5803","Application Data"
"341","2.533402","192.168.1.166","23.198.241.2","TLSv1.2","2030","Application Data"
"342","2.559093","23.198.241.2","192.168.1.166","TCP","54","443  >  58685 [ACK] Seq=482081 Ack=99335 Win=14797 Len=0"
"343","2.559093","23.198.241.2","192.168.1.166","TCP","54","443  >  58685 [ACK] Seq=482081 Ack=101061 Win=14809 Len=0"
"344","2.559093","23.198.241.2","192.168.1.166","TCP","54","443  >  58685 [ACK] Seq=482081 Ack=108786 Win=14779 Len=0"
"345","2.568282","23.198.241.2","192.168.1.166","TLSv1.2","492","Application Data"
"346","2.568282","23.198.241.2","192.168.1.166","TLSv1.2","216","Application Data"
"347","2.568309","192.168.1.166","23.198.241.2","TCP","54","58685  >  443 [ACK] Seq=108786 Ack=482681 Win=8189 Len=0"
"348","2.619730","23.198.241.2","192.168.1.166","TLSv1.2","493","Application Data"
"349","2.619730","23.198.241.2","192.168.1.166","TLSv1.2","299","Application Data"
"350","2.619752","192.168.1.166","23.198.241.2","TCP","54","58685  >  443 [ACK] Seq=108786 Ack=483365 Win=8186 Len=0"
"351","2.642647","23.198.241.2","192.168.1.166","TLSv1.2","493","Application Data"
"352","2.642647","23.198.241.2","192.168.1.166","TLSv1.2","1510","Application Data"
"353","2.642647","23.198.241.2","192.168.1.166","TLSv1.2","551","Application Data"
"354","2.642669","192.168.1.166","23.198.241.2","TCP","54","58685  >  443 [ACK] Seq=108786 Ack=485757 Win=8191 Len=0"
"355","2.667999","192.168.1.166","23.198.241.2","TLSv1.2","5699","Application Data"
"356","2.668077","192.168.1.166","23.198.241.2","TLSv1.2","5692","Application Data"
"357","2.703629","23.198.241.2","192.168.1.166","TCP","54","443  >  58685 [ACK] Seq=485757 Ack=113166 Win=14797 Len=0"
"358","2.703629","23.198.241.2","192.168.1.166","TCP","54","443  >  58685 [ACK] Seq=485757 Ack=115891 Win=14812 Len=0"
"359","2.703629","23.198.241.2","192.168.1.166","TCP","54","443  >  58685 [ACK] Seq=485757 Ack=118811 Win=14797 Len=0"
"360","2.706359","192.168.1.166","23.198.241.2","TLSv1.2","5802","Application Data"
"361","2.706460","192.168.1.166","23.198.241.2","TLSv1.2","5803","Application Data"
"362","2.706480","192.168.1.166","23.198.241.2","TLSv1.2","487","Application Data"
"363","2.706494","192.168.1.166","23.198.241.2","TLSv1.2","382","Application Data"
"364","2.706610","192.168.1.166","23.198.241.2","TLSv1.2","5803","Application Data"
"365","2.706636","192.168.1.166","23.198.241.2","TLSv1.2","898","Application Data"
"366","2.731344","23.198.241.2","192.168.1.166","TCP","54","443  >  58685 [ACK] Seq=485757 Ack=121529 Win=14812 Len=0"
"367","2.740492","23.198.241.2","192.168.1.166","TCP","54","443  >  58685 [ACK] Seq=485757 Ack=138920 Win=14719 Len=0"
