"No.","Time","Source","Destination","Protocol","Length","Info"
"1","0.000000","192.168.1.166","23.39.213.4","TLSv1.2","4970","Application Data"
"2","0.000091","192.168.1.166","23.39.213.4","TLSv1.2","538","Application Data"
"3","0.033576","23.39.213.4","192.168.1.166","TCP","54","443  >  50692 [ACK] Seq=1 Ack=5401 Win=9922 Len=0"
"4","0.111058","192.168.1.166","23.39.213.4","TLSv1.2","5119","Application Data"
"5","0.111136","192.168.1.166","23.39.213.4","TLSv1.2","4963","Application Data"
"6","0.111157","192.168.1.166","23.39.213.4","TLSv1.2","799","Application Data"
"7","0.144225","23.39.213.4","192.168.1.166","TCP","54","443  >  50692 [ACK] Seq=1 Ack=9781 Win=9930 Len=0"
"8","0.147059","23.39.213.4","192.168.1.166","TCP","54","443  >  50692 [ACK] Seq=1 Ack=16120 Win=9894 Len=0"
"9","0.217393","23.39.213.4","192.168.1.166","TLSv1.2","955","Application Data"
"10","0.217393","23.39.213.4","192.168.1.166","TLSv1.2","120","Application Data"
"11","0.217414","192.168.1.166","23.39.213.4","TCP","54","50692  >  443 [ACK] Seq=16120 Ack=968 Win=8188 Len=0"
"12","0.217886","192.168.1.166","23.39.213.4","TLSv1.2","89","Application Data"
"13","0.228368","23.39.213.4","192.168.1.166","TLSv1.2","355","Application Data"
"14","0.228368","23.39.213.4","192.168.1.166","TLSv1.2","121","Application Data"
"15","0.228383","192.168.1.166","23.39.213.4","TCP","54","50692  >  443 [ACK] Seq=16155 Ack=1336 Win=8186 Len=0"
"16","0.290720","23.39.213.4","192.168.1.166","TCP","54","443  >  50692 [ACK] Seq=1336 Ack=16155 Win=9949 Len=0"
"17","1.962129","23.39.213.4","192.168.1.166","TCP","1514","443  >  50692 [ACK] Seq=1336 Ack=16155 Win=9949 Len=1460 [TCP PDU reassembled in 18]"
"18","1.962129","23.39.213.4","192.168.1.166","TLSv1.2","457","Application Data"
"19","1.962129","23.39.213.4","192.168.1.166","TCP","16114","443  >  50692 [ACK] Seq=3199 Ack=16155 Win=9949 Len=16060 [TCP PDU reassembled in 20]"
"20","1.962129","23.39.213.4","192.168.1.166","TLSv1.2","400","Application Data"
"21","1.962129","23.39.213.4","192.168.1.166","TLSv1.2","85","Application Data"
"22","1.962129","23.39.213.4","192.168.1.166","TCP","16114","443  >  50692 [ACK] Seq=19636 Ack=16155 Win=9949 Len=16060 [TCP PDU reassembled in 23]"
"23","1.962129","23.39.213.4","192.168.1.166","TLSv1.2","400","Application Data"
"24","1.962182","192.168.1.166","23.39.213.4","TCP","54","50692  >  443 [ACK] Seq=16155 Ack=36042 Win=8191 Len=0"
"25","1.962688","23.39.213.4","192.168.1.166","TLSv1.2","4434","Application Data"
"26","1.962688","23.39.213.4","192.168.1.166","TLSv1.2","1218","Application Data"
"27","1.962688","23.39.213.4","192.168.1.166","TCP","16114","443  >  50692 [ACK] Seq=41586 Ack=16155 Win=9949 Len=16060 [TCP PDU reassembled in 28]"
"28","1.962688","23.39.213.4","192.168.1.166","TLSv1.2","400","Application Data"
"29","1.962688","23.39.213.4","192.168.1.166","TLSv1.2","85","Application Data"
"30","1.962688","23.39.213.4","192.168.1.166","TCP","8814","443  >  50692 [ACK] Seq=58023 Ack=16155 Win=9949 Len=8760 [TCP PDU reassembled in 38]"
"31","1.962730","192.168.1.166","23.39.213.4","TCP","54","50692  >  443 [ACK] Seq=16155 Ack=66783 Win=8191 Len=0"
"32","1.965146","23.39.213.4","192.168.1.166","TCP","1514","443  >  50692 [ACK] Seq=66783 Ack=16155 Win=9949 Len=1460 [TCP PDU reassembled in 38]"
"33","1.965146","23.39.213.4","192.168.1.166","TCP","1514","443  >  50692 [ACK] Seq=68243 Ack=16155 Win=9949 Len=1460 [TCP PDU reassembled in 38]"
"34","1.965166","192.168.1.166","23.39.213.4","TCP","54","50692  >  443 [ACK] Seq=16155 Ack=69703 Win=8191 Len=0"
"35","1.967156","23.39.213.4","192.168.1.166","TCP","1514","443  >  50692 [ACK] Seq=69703 Ack=16155 Win=9949 Len=1460 [TCP PDU reassembled in 38]"
"36","1.967156","23.39.213.4","192.168.1.166","TCP","1514","443  >  50692 [ACK] Seq=71163 Ack=16155 Win=9949 Len=1460 [TCP PDU reassembled in 38]"
"37","1.967156","23.39.213.4","192.168.1.166","TCP","1514","443  >  50692 [ACK] Seq=72623 Ack=16155 Win=9949 Len=1460 [TCP PDU reassembled in 38]"
"38","1.967156","23.39.213.4","192.168.1.166","TLSv1.2","400","Application Data"
"39","1.967156","23.39.213.4","192.168.1.166","TLSv1.2","1514","Application Data"
"40","1.967156","23.39.213.4","192.168.1.166","TCP","1514","443  >  50692 [ACK] Seq=75889 Ack=16155 Win=9949 Len=1460 [TCP PDU reassembled in 49]"
"41","1.967156","23.39.213.4","192.168.1.166","TCP","1514","443  >  50692 [ACK] Seq=77349 Ack=16155 Win=9949 Len=1460 [TCP PDU reassembled in 49]"
"42","1.967156","23.39.213.4","192.168.1.166","TCP","1514","443  >  50692 [ACK] Seq=78809 Ack=16155 Win=9949 Len=1460 [TCP PDU reassembled in 49]"
"43","1.967156","23.39.213.4","192.168.1.166","TCP","1514","443  >  50692 [ACK] Seq=80269 Ack=16155 Win=9949 Len=1460 [TCP PDU reassembled in 49]"
"44","1.967156","23.39.213.4","192.168.1.166","TCP","1514","443  >  50692 [ACK] Seq=81729 Ack=16155 Win=9949 Len=1460 [TCP PDU reassembled in 49]"
"45","1.967156","23.39.213.4","192.168.1.166","TCP","1514","443  >  50692 [ACK] Seq=83189 Ack=16155 Win=9949 Len=1460 [TCP PDU reassembled in 49]"
"46","1.967156","23.39.213.4","192.168.1.166","TCP","1514","443  >  50692 [ACK] Seq=84649 Ack=16155 Win=9949 Len=1460 [TCP PDU reassembled in 49]"
"47","1.967156","23.39.213.4","192.168.1.166","TCP","1514","443  >  50692 [ACK] Seq=86109 Ack=16155 Win=9949 Len=1460 [TCP PDU reassembled in 49]"
"48","1.967156","23.39.213.4","192.168.1.166","TCP","1514","443  >  50692 [ACK] Seq=87569 Ack=16155 Win=9949 Len=1460 [TCP PDU reassembled in 49]"
"49","1.967156","23.39.213.4","192.168.1.166","TLSv1.2","5894","Application Data, Application Data"
"50","1.967156","23.39.213.4","192.168.1.166","TLSv1.2","1391","Application Data"
"51","1.967156","23.39.213.4","192.168.1.166","TCP","16114","443  >  50692 [ACK] Seq=96206 Ack=16155 Win=9949 Len=16060 [TCP PDU reassembled in 52]"
"52","1.967156","23.39.213.4","192.168.1.166","TLSv1.2","400","Application Data"
"53","1.967156","23.39.213.4","192.168.1.166","TLSv1.2","85","Application Data"
"54","1.967156","23.39.213.4","192.168.1.166","TCP","1514","443  >  50692 [ACK] Seq=112643 Ack=16155 Win=9949 Len=1460 [TCP PDU reassembled in 59]"
"55","1.967156","23.39.213.4","192.168.1.166","TCP","1514","443  >  50692 [ACK] Seq=114103 Ack=16155 Win=9949 Len=1460 [TCP PDU reassembled in 59]"
"56","1.967156","23.39.213.4","192.168.1.166","TCP","1514","443  >  50692 [ACK] Seq=115563 Ack=16155 Win=9949 Len=1460 [TCP PDU reassembled in 59]"
"57","1.967156","23.39.213.4","192.168.1.166","TCP","1514","443  >  50692 [ACK] Seq=117023 Ack=16155 Win=9949 Len=1460 [TCP PDU reassembled in 59]"
"58","1.967156","23.39.213.4","192.168.1.166","TCP","1514","443  >  50692 [ACK] Seq=118483 Ack=16155 Win=9949 Len=1460 [TCP PDU reassembled in 59]"
"59","1.967156","23.39.213.4","192.168.1.166","TLSv1.2","983","Application Data"
"60","1.967156","23.39.213.4","192.168.1.166","TCP","11734","443  >  50692 [ACK] Seq=120872 Ack=16155 Win=9949 Len=11680 [TCP PDU reassembled in 61]"
"61","1.967156","23.39.213.4","192.168.1.166","TLSv1.2","1251","Application Data"
"62","1.967245","192.168.1.166","23.39.213.4","TCP","54","50692  >  443 [ACK] Seq=16155 Ack=133749 Win=8191 Len=0"
"63","1.968866","23.39.213.4","192.168.1.166","TLSv1.2","93","Application Data"
"64","1.968866","23.39.213.4","192.168.1.166","TLSv1.2","85","Application Data"
"65","1.968881","192.168.1.166","23.39.213.4","TCP","54","50692  >  443 [ACK] Seq=16155 Ack=133819 Win=8191 Len=0"
"66","1.969988","192.168.1.166","23.39.213.4","TLSv1.2","5201","Application Data"
"67","1.970024","192.168.1.166","23.39.213.4","TLSv1.2","1322","Application Data"
"68","2.003774","23.39.213.4","192.168.1.166","TCP","54","443  >  50692 [ACK] Seq=133819 Ack=17615 Win=9945 Len=0"
"69","2.003774","23.39.213.4","192.168.1.166","TCP","54","443  >  50692 [ACK] Seq=133819 Ack=21302 Win=9925 Len=0"
"70","2.003774","23.39.213.4","192.168.1.166","TCP","54","443  >  50692 [ACK] Seq=133819 Ack=22570 Win=9918 Len=0"
"71","2.006651","192.168.1.166","23.39.213.4","TLSv1.2","576","Application Data"
"72","2.006682","192.168.1.166","23.39.213.4","TLSv1.2","164","Application Data"
"73","2.008023","192.168.1.166","23.39.213.4","TLSv1.2","4809","Application Data"
"74","2.038953","23.39.213.4","192.168.1.166","TCP","54","443  >  50692 [ACK] Seq=133819 Ack=23092 Win=9949 Len=0"
"75","2.038953","23.39.213.4","192.168.1.166","TCP","54","443  >  50692 [ACK] Seq=133819 Ack=23202 Win=9949 Len=0"
"76","2.038953","23.39.213.4","192.168.1.166","TCP","54","443  >  50692 [ACK] Seq=133819 Ack=24662 Win=9939 Len=0"
"77","2.038953","23.39.213.4","192.168.1.166","TCP","54","443  >  50692 [ACK] Seq=133819 Ack=27957 Win=9921 Len=0"
"78","2.043173","192.168.1.166","23.39.213.4","TLSv1.2","5030","Application Data"
"79","2.043255","192.168.1.166","23.39.213.4","TLSv1.2","5015","Application Data"
"80","2.044271","192.168.1.166","23.39.213.4","TLSv1.2","5046","Application Data"
"81","2.048587","192.168.1.166","23.39.213.4","TLSv1.2","5016","Application Data"
"82","2.052363","192.168.1.166","23.39.213.4","TLSv1.2","5012","Application Data"
"83","2.067887","23.39.213.4","192.168.1.166","TLSv1.2","89","Application Data"
"84","2.067887","23.39.213.4","192.168.1.166","TLSv1.2","370","Application Data"
"85","2.067887","23.39.213.4","192.168.1.166","TCP","10274","443  >  50692 [ACK] Seq=134170 Ack=27957 Win=9949 Len=10220 [TCP PDU reassembled in 86]"
"86","2.067887","23.39.213.4","192.168.1.166","TLSv1.2","211","Application Data"
"87","2.067924","192.168.1.166","23.39.213.4","TCP","54","50692  >  443 [ACK] Seq=52806 Ack=144547 Win=8191 Len=0"
"88","2.072298","23.39.213.4","192.168.1.166","TLSv1.2","361","Application Data"
"89","2.072298","23.39.213.4","192.168.1.166","TLSv1.2","289","Application Data"
"90","2.072326","192.168.1.166","23.39.213.4","TCP","54","50692  >  443 [ACK] Seq=52806 Ack=145089 Win=8189 Len=0"
"91","2.079912","192.168.1.166","23.39.213.4","TLSv1.2","5013","Application Data"
"92","2.081965","23.39.213.4","192.168.1.166","TLSv1.2","318","Application Data"
"93","2.081965","23.39.213.4","192.168.1.166","TCP","1514","443  >  50692 [ACK] Seq=145353 Ack=47848 Win=9846 Len=1460 [TCP PDU reassembled in 94]"
"94","2.081965","23.39.213.4","192.168.1.166","TLSv1.2","64","Application Data"
"95","2.081989","192.168.1.166","23.39.213.4","TCP","54","50692  >  443 [ACK] Seq=57765 Ack=146823 Win=8191 Len=0"
"96","2.091928","192.168.1.166","23.39.213.4","TLSv1.2","90","Application Data"
"97","2.091987","192.168.1.166","23.39.213.4","TLSv1.2","90","Application Data"
"98","2.093678","192.168.1.166","23.39.213.4","TLSv1.2","90","Application Data"
"99","2.093706","192.168.1.166","23.39.213.4","TLSv1.2","90","Application Data"
"100","2.093740","192.168.1.166","23.39.213.4","TLSv1.2","576","Application Data"
"101","2.093758","192.168.1.166","23.39.213.4","TLSv1.2","183","Application Data"
"102","2.093949","192.168.1.166","23.39.213.4","TLSv1.2","4824","Application Data"
"103","2.096728","23.39.213.4","192.168.1.166","TCP","54","443  >  50692 [ACK] Seq=146823 Ack=52806 Win=9818 Len=0"
"104","2.101465","23.39.213.4","192.168.1.166","TCP","13194","443  >  50692 [ACK] Seq=146823 Ack=52806 Win=9949 Len=13140 [TCP PDU reassembled in 105]"
"105","2.101465","23.39.213.4","192.168.1.166","TLSv1.2","982","Application Data"
"106","2.101465","23.39.213.4","192.168.1.166","TLSv1.2","338","Application Data"
"107","2.101465","23.39.213.4","192.168.1.166","TLSv1.2","909","Application Data"
"108","2.101509","192.168.1.166","23.39.213.4","TCP","54","50692  >  443 [ACK] Seq=63330 Ack=162030 Win=8191 Len=0"
"109","2.112104","192.168.1.166","23.39.213.4","TLSv1.2","90","Application Data"
"110","2.112124","192.168.1.166","23.39.213.4","TLSv1.2","90","Application Data"
"111","2.112133","192.168.1.166","23.39.213.4","TLSv1.2","90","Application Data"
"112","2.114955","192.168.1.166","23.39.213.4","TLSv1.2","572","Application Data"
"113","2.114991","192.168.1.166","23.39.213.4","TLSv1.2","193","Application Data"
"114","2.115010","192.168.1.166","23.39.213.4","TLSv1.2","192","Application Data"
"115","2.115026","192.168.1.166","23.39.213.4","TLSv1.2","192","Application Data"
"116","2.116582","23.39.213.4","192.168.1.166","TCP","54","443  >  50692 [ACK] Seq=162030 Ack=57765 Win=9926 Len=0"
"117","2.125269","23.39.213.4","192.168.1.166","TCP","54","443  >  50692 [ACK] Seq=162030 Ack=60020 Win=9933 Len=0"
"118","2.161343","23.39.213.4","192.168.1.166","TLSv1.2","371","Application Data"
"119","2.161343","23.39.213.4","192.168.1.166","TCP","5894","443  >  50692 [ACK] Seq=162347 Ack=64371 Win=9900 Len=5840 [TCP PDU reassembled in 120]"
"120","2.161343","23.39.213.4","192.168.1.166","TLSv1.2","410","Application Data"
"121","2.161343","23.39.213.4","192.168.1.166","TLSv1.2","957","Application Data"
"122","2.161343","23.39.213.4","192.168.1.166","TLSv1.2","5894","Application Data"
"123","2.161343","23.39.213.4","192.168.1.166","TLSv1.2","271","Application Data"
"124","2.161343","23.39.213.4","192.168.1.166","TLSv1.2","384","Application Data"
"125","2.161343","23.39.213.4","192.168.1.166","TCP","16114","443  >  50692 [ACK] Seq=175833 Ack=64371 Win=9900 Len=16060 [TCP PDU reassembled in 126]"
"126","2.161343","23.39.213.4","192.168.1.166","TLSv1.2","400","Application Data"
"127","2.161406","192.168.1.166","23.39.213.4","TCP","54","50692  >  443 [ACK] Seq=64371 Ack=192239 Win=8191 Len=0"
"128","2.161773","23.39.213.4","192.168.1.166","TLSv1.2","17574","Application Data, Application Data, Application Data"
"129","2.161773","23.39.213.4","192.168.1.166","TLSv1.2","564","Application Data"
"130","2.161799","192.168.1.166","23.39.213.4","TCP","54","50692  >  443 [ACK] Seq=64371 Ack=210269 Win=8191 Len=0"
"131","2.166654","192.168.1.166","23.39.213.4","TLSv1.2","4762","Application Data"
"132","2.169580","192.168.1.166","23.39.213.4","TLSv1.2","5019","Application Data"
"133","2.170626","192.168.1.166","23.39.213.4","TLSv1.2","5019","Application Data"
"134","2.182886","23.39.213.4","192.168.1.166","TLSv1.2","85","Application Data"
"135","2.183946","192.168.1.166","23.39.213.4","TLSv1.2","5018","Application Data"
"136","2.216847","23.39.213.4","192.168.1.166","TCP","54","443  >  50692 [ACK] Seq=210300 Ack=83973 Win=9847 Len=0"
"137","2.223002","23.39.213.4","192.168.1.166","TLSv1.2","434","Application Data"
"138","2.223002","23.39.213.4","192.168.1.166","TCP","16114","443  >  50692 [ACK] Seq=210680 Ack=83973 Win=9949 Len=16060 [TCP PDU reassembled in 139]"
"139","2.223002","23.39.213.4","192.168.1.166","TLSv1.2","400","Application Data"
"140","2.223002","23.39.213.4","192.168.1.166","TLSv1.2","85","Application Data"
"141","2.223002","23.39.213.4","192.168.1.166","TCP","4434","443  >  50692 [ACK] Seq=227117 Ack=83973 Win=9949 Len=4380 [TCP PDU reassembled in 142]"
"142","2.223002","23.39.213.4","192.168.1.166","TLSv1.2","157","Application Data"
"143","2.223002","23.39.213.4","192.168.1.166","TLSv1.2","5894","Application Data, Application Data, Application Data, Application Data, Application Data, Application Data, Application Data, Application Data, Application Data"
"144","2.223002","23.39.213.4","192.168.1.166","TLSv1.2","519","Application Data"
"145","2.223061","192.168.1.166","23.39.213.4","TCP","54","50692  >  443 [ACK] Seq=83973 Ack=237905 Win=8191 Len=0"
"146","2.225174","192.168.1.166","23.39.213.4","TLSv1.2","5019","Application Data"
"147","2.254826","23.39.213.4","192.168.1.166","TCP","1514","443  >  50692 [ACK] Seq=237905 Ack=83973 Win=9949 Len=1460 [TCP PDU reassembled in 148]"
"148","2.254826","23.39.213.4","192.168.1.166","TLSv1.2","64","Application Data"
"149","2.254826","23.39.213.4","192.168.1.166","TLSv1.2","1098","Application Data"
"150","2.254826","23.39.213.4","192.168.1.166","TCP","1514","443  >  50692 [ACK] Seq=240419 Ack=83973 Win=9949 Len=1460 [TCP PDU reassembled in 151]"
"151","2.254826","23.39.213.4","192.168.1.166","TLSv1.2","542","Application Data"
"152","2.254826","23.39.213.4","192.168.1.166","TLSv1.2","384","Application Data"
"153","2.254826","23.39.213.4","192.168.1.166","TCP","16114","443  >  50692 [ACK] Seq=242697 Ack=83973 Win=9949 Len=16060 [TCP PDU reassembled in 154]"
"154","2.254826","23.39.213.4","192.168.1.166","TLSv1.2","400","Application Data"
"155","2.254826","23.39.213.4","192.168.1.166","TLSv1.2","85","Application Data"
"156","2.254826","23.39.213.4","192.168.1.166","TCP","16114","443  >  50692 [ACK] Seq=259134 Ack=83973 Win=9949 Len=16060 [TCP PDU reassembled in 157]"
"157","2.254826","23.39.213.4","192.168.1.166","TLSv1.2","400","Application Data"
"158","2.254908","192.168.1.166","23.39.213.4","TCP","54","50692  >  443 [ACK] Seq=88938 Ack=275540 Win=8191 Len=0"
"159","2.256428","192.168.1.166","23.39.213.4","TLSv1.2","578","Application Data"
"160","2.256466","192.168.1.166","23.39.213.4","TLSv1.2","192","Application Data"
"161","2.256480","192.168.1.166","23.39.213.4","TLSv1.2","192","Application Data"
"162","2.260358","23.39.213.4","192.168.1.166","TLSv1.2","1514","Application Data"
"163","2.260358","23.39.213.4","192.168.1.166","TCP","1514","443  >  50692 [ACK] Seq=277000 Ack=83973 Win=9949 Len=1460 [TCP PDU reassembled in 173]"
"164","2.260358","23.39.213.4","192.168.1.166","TCP","1514","443  >  50692 [ACK] Seq=278460 Ack=83973 Win=9949 Len=1460 [TCP PDU reassembled in 173]"
"165","2.260358","23.39.213.4","192.168.1.166","TCP","1514","443  >  50692 [ACK] Seq=279920 Ack=83973 Win=9949 Len=1460 [TCP PDU reassembled in 173]"
"166","2.260358","23.39.213.4","192.168.1.166","TCP","1514","443  >  50692 [ACK] Seq=281380 Ack=83973 Win=9949 Len=1460 [TCP PDU reassembled in 173]"
"167","2.260358","23.39.213.4","192.168.1.166","TCP","1514","443  >  50692 [ACK] Seq=282840 Ack=83973 Win=9949 Len=1460 [TCP PDU reassembled in 173]"
"168","2.260358","23.39.213.4","192.168.1.166","TCP","1514","443  >  50692 [ACK] Seq=284300 Ack=83973 Win=9949 Len=1460 [TCP PDU reassembled in 173]"
"169","2.260358","23.39.213.4","192.168.1.166","TCP","1514","443  >  50692 [ACK] Seq=285760 Ack=83973 Win=9949 Len=1460 [TCP PDU reassembled in 173]"
"170","2.260358","23.39.213.4","192.168.1.166","TCP","1514","443  >  50692 [ACK] Seq=287220 Ack=83973 Win=9949 Len=1460 [TCP PDU reassembled in 173]"
"171","2.260358","23.39.213.4","192.168.1.166","TCP","1514","443  >  50692 [ACK] Seq=288680 Ack=83973 Win=9949 Len=1460 [TCP PDU reassembled in 173]"
"172","2.260358","23.39.213.4","192.168.1.166","TCP","1514","443  >  50692 [ACK] Seq=290140 Ack=83973 Win=9949 Len=1460 [TCP PDU reassembled in 173]"
"173","2.260358","23.39.213.4","192.168.1.166","TLSv1.2","1514","Application Data, Application Data"
"174","2.260358","23.39.213.4","192.168.1.166","TCP","1514","443  >  50692 [ACK] Seq=293060 Ack=83973 Win=9949 Len=1460 [TCP PDU reassembled in 184]"
"175","2.260358","23.39.213.4","192.168.1.166","TCP","1514","443  >  50692 [ACK] Seq=294520 Ack=83973 Win=9949 Len=1460 [TCP PDU reassembled in 184]"
"176","2.260358","23.39.213.4","192.168.1.166","TCP","1514","443  >  50692 [ACK] Seq=295980 Ack=83973 Win=9949 Len=1460 [TCP PDU reassembled in 184]"
"177","2.260358","23.39.213.4","192.168.1.166","TCP","1514","443  >  50692 [ACK] Seq=297440 Ack=83973 Win=9949 Len=1460 [TCP PDU reassembled in 184]"
"178","2.260358","23.39.213.4","192.168.1.166","TCP","1514","443  >  50692 [ACK] Seq=298900 Ack=83973 Win=9949 Len=1460 [TCP PDU reassembled in 184]"
"179","2.260358","23.39.213.4","192.168.1.166","TCP","1514","443  >  50692 [ACK] Seq=300360 Ack=83973 Win=9949 Len=1460 [TCP PDU reassembled in 184]"
"180","2.260358","23.39.213.4","192.168.1.166","TCP","1514","443  >  50692 [ACK] Seq=301820 Ack=83973 Win=9949 Len=1460 [TCP PDU reassembled in 184]"
"181","2.260358","23.39.213.4","192.168.1.166","TCP","1514","443  >  50692 [ACK] Seq=303280 Ack=83973 Win=9949 Len=1460 [TCP PDU reassembled in 184]"
"182","2.260358","23.39.213.4","192.168.1.166","TCP","1514","443  >  50692 [ACK] Seq=304740 Ack=83973 Win=9949 Len=1460 [TCP PDU reassembled in 184]"
"183","2.260358","23.39.213.4","192.168.1.166","TCP","1514","443  >  50692 [ACK] Seq=306200 Ack=83973 Win=9949 Len=1460 [TCP PDU reassembled in 184]"
"184","2.260358","23.39.213.4","192.168.1.166","TLSv1.2","808","Application Data"
"185","2.260358","23.39.213.4","192.168.1.166","TLSv1.2","1514","Application Data"
"186","2.260358","23.39.213.4","192.168.1.166","TCP","1514","443  >  50692 [ACK] Seq=309874 Ack=83973 Win=9949 Len=1460 [TCP PDU reassembled in 193]"
"187","2.260358","23.39.213.4","192.168.1.166","TCP","1514","443  >  50692 [ACK] Seq=311334 Ack=83973 Win=9949 Len=1460 [TCP PDU reassembled in 193]"
"188","2.260358","23.39.213.4","192.168.1.166","TCP","1514","443  >  50692 [ACK] Seq=312794 Ack=83973 Win=9949 Len=1460 [TCP PDU reassembled in 193]"
"189","2.260358","23.39.213.4","192.168.1.166","TCP","1514","443  >  50692 [ACK] Seq=314254 Ack=83973 Win=9949 Len=1460 [TCP PDU reassembled in 193]"
"190","2.260358","23.39.213.4","192.168.1.166","TCP","1514","443  >  50692 [ACK] Seq=315714 Ack=83973 Win=9949 Len=1460 [TCP PDU reassembled in 193]"
"191","2.260358","23.39.213.4","192.168.1.166","TCP","1514","443  >  50692 [ACK] Seq=317174 Ack=83973 Win=9949 Len=1460 [TCP PDU reassembled in 193]"
"192","2.260358","23.39.213.4","192.168.1.166","TCP","1514","443  >  50692 [ACK] Seq=318634 Ack=83973 Win=9949 Len=1460 [TCP PDU reassembled in 193]"
"193","2.260358","23.39.213.4","192.168.1.166","TLSv1.2","40934","Application Data, Application Data, Application Data, Application Data, Application Data, Application Data"
"194","2.260505","192.168.1.166","23.39.213.4","TCP","54","50692  >  443 [ACK] Seq=89738 Ack=360974 Win=8191 Len=0"
"195","2.260556","23.39.213.4","192.168.1.166","TLSv1.2","967","Application Data"
"196","2.260556","23.39.213.4","192.168.1.166","TLSv1.2","48234","Application Data, Application Data, Application Data, Application Data, Application Data, Application Data, Application Data"
"197","2.260590","192.168.1.166","23.39.213.4","TCP","54","50692  >  443 [ACK] Seq=89738 Ack=410067 Win=8000 Len=0"
"198","2.260598","192.168.1.166","23.39.213.4","TCP","54","[TCP Window Update] 50692  >  443 [ACK] Seq=89738 Ack=410067 Win=8191 Len=0"
"199","2.260615","23.39.213.4","192.168.1.166","TLSv1.2","20494","Application Data, Application Data, Application Data, Application Data"
"200","2.260615","23.39.213.4","192.168.1.166","TLSv1.2","546","Application Data"
"201","2.260635","192.168.1.166","23.39.213.4","TCP","54","50692  >  443 [ACK] Seq=89738 Ack=430999 Win=8110 Len=0"
"202","2.260686","192.168.1.166","23.39.213.4","TCP","54","[TCP Window Update] 50692  >  443 [ACK] Seq=89738 Ack=430999 Win=8191 Len=0"
"203","2.264382","192.168.1.166","23.39.213.4","TLSv1.2","4762","Application Data"
"204","2.264506","192.168.1.166","23.39.213.4","TLSv1.2","5019","Application Data"
"205","2.264884","192.168.1.166","23.39.213.4","TLSv1.2","5044","Application Data"
"206","2.267925","192.168.1.166","23.39.213.4","TLSv1.2","5018","Application Data"
"207","2.297491","23.39.213.4","192.168.1.166","TCP","54","443  >  50692 [ACK] Seq=430999 Ack=91198 Win=9936 Len=0"
"208","2.303459","23.39.213.4","192.168.1.166","TLSv1.2","386","Application Data"
"209","2.303459","23.39.213.4","192.168.1.166","TCP","16114","443  >  50692 [ACK] Seq=431331 Ack=109365 Win=9838 Len=16060 [TCP PDU reassembled in 210]"
"210","2.303459","23.39.213.4","192.168.1.166","TLSv1.2","400","Application Data"
"211","2.303459","23.39.213.4","192.168.1.166","TLSv1.2","85","Application Data"
"212","2.303459","23.39.213.4","192.168.1.166","TCP","16114","443  >  50692 [ACK] Seq=447768 Ack=109365 Win=9838 Len=16060 [TCP PDU reassembled in 213]"
"213","2.303459","23.39.213.4","192.168.1.166","TLSv1.2","400","Application Data"
"214","2.303513","192.168.1.166","23.39.213.4","TCP","54","50692  >  443 [ACK] Seq=109365 Ack=464174 Win=8191 Len=0"
"215","2.303995","23.39.213.4","192.168.1.166","TLSv1.2","32174","Application Data, Application Data, Application Data"
"216","2.303995","23.39.213.4","192.168.1.166","TLSv1.2","808","Application Data"
"217","2.304016","192.168.1.166","23.39.213.4","TCP","54","50692  >  443 [ACK] Seq=109365 Ack=497048 Win=8191 Len=0"
"218","2.305366","23.39.213.4","192.168.1.166","TLSv1.2","43854","Application Data, Application Data, Application Data, Application Data, Application Data"
"219","2.305395","192.168.1.166","23.39.213.4","TCP","54","50692  >  443 [ACK] Seq=109365 Ack=540848 Win=8191 Len=0"
"220","2.305741","23.39.213.4","192.168.1.166","TCP","1514","443  >  50692 [ACK] Seq=540848 Ack=109365 Win=9838 Len=1460 [TCP PDU reassembled in 223]"
"221","2.305741","23.39.213.4","192.168.1.166","TCP","1514","443  >  50692 [ACK] Seq=542308 Ack=109365 Win=9838 Len=1460 [TCP PDU reassembled in 223]"
"222","2.305741","23.39.213.4","192.168.1.166","TCP","1514","443  >  50692 [ACK] Seq=543768 Ack=109365 Win=9838 Len=1460 [TCP PDU reassembled in 223]"
"223","2.305741","23.39.213.4","192.168.1.166","TLSv1.2","1514","Application Data, Application Data"
"224","2.305741","23.39.213.4","192.168.1.166","TCP","1514","443  >  50692 [ACK] Seq=546688 Ack=109365 Win=9838 Len=1460 [TCP PDU reassembled in 225]"
"225","2.305741","23.39.213.4","192.168.1.166","TLSv1.2","17574","Application Data, Application Data"
"226","2.305782","192.168.1.166","23.39.213.4","TCP","54","50692  >  443 [ACK] Seq=109365 Ack=565668 Win=8191 Len=0"
"227","2.306914","23.39.213.4","192.168.1.166","TLSv1.2","64294","Application Data, Application Data, Application Data, Application Data, Application Data, Application Data, Application Data, Application Data"
"228","2.306914","23.39.213.4","192.168.1.166","TLSv1.2","7354","Application Data, Application Data"
"229","2.306914","23.39.213.4","192.168.1.166","TLSv1.2","989","Application Data"
"230","2.306958","192.168.1.166","23.39.213.4","TCP","54","50692  >  443 [ACK] Seq=109365 Ack=638143 Win=8191 Len=0"
"231","2.309631","192.168.1.166","23.39.213.4","TLSv1.2","5045","Application Data"
"232","2.310292","192.168.1.166","23.39.213.4","TLSv1.2","5084","Application Data"
"233","2.314826","23.39.213.4","192.168.1.166","TLSv1.2","317","Application Data"
"234","2.314826","23.39.213.4","192.168.1.166","TLSv1.2","1427","Application Data"
"235","2.314858","192.168.1.166","23.39.213.4","TCP","54","50692  >  443 [ACK] Seq=119386 Ack=639779 Win=8191 Len=0"
"236","2.345865","23.39.213.4","192.168.1.166","TLSv1.2","1375","Application Data"
"237","2.345865","23.39.213.4","192.168.1.166","TLSv1.2","317","Application Data"
"238","2.345865","23.39.213.4","192.168.1.166","TLSv1.2","1472","Application Data"
"239","2.345865","23.39.213.4","192.168.1.166","TLSv1.2","385","Application Data"
"240","2.345865","23.39.213.4","192.168.1.166","TCP","16114","443  >  50692 [ACK] Seq=643112 Ack=119386 Win=9899 Len=16060 [TCP PDU reassembled in 241]"
"241","2.345865","23.39.213.4","192.168.1.166","TLSv1.2","400","Application Data"
"242","2.345865","23.39.213.4","192.168.1.166","TLSv1.2","85","Application Data"
"243","2.345865","23.39.213.4","192.168.1.166","TLSv1.2","466","Application Data"
"244","2.345865","23.39.213.4","192.168.1.166","TCP","4434","443  >  50692 [ACK] Seq=659961 Ack=119386 Win=9899 Len=4380 [TCP PDU reassembled in 245]"
"245","2.345865","23.39.213.4","192.168.1.166","TLSv1.2","1262","Application Data"
"246","2.345865","23.39.213.4","192.168.1.166","TLSv1.2","16114","Application Data"
"247","2.345865","23.39.213.4","192.168.1.166","TLSv1.2","729","Application Data"
"248","2.345865","23.39.213.4","192.168.1.166","TLSv1.2","5894","Application Data"
"249","2.345944","192.168.1.166","23.39.213.4","TCP","54","50692  >  443 [ACK] Seq=119386 Ack=688124 Win=8191 Len=0"
"250","2.346220","23.39.213.4","192.168.1.166","TLSv1.2","26334","Application Data, Application Data"
"251","2.346220","23.39.213.4","192.168.1.166","TLSv1.2","808","Application Data"
"252","2.346243","192.168.1.166","23.39.213.4","TCP","54","50692  >  443 [ACK] Seq=119386 Ack=715158 Win=8191 Len=0"
"253","2.347531","23.39.213.4","192.168.1.166","TLSv1.2","1514","Application Data"
"254","2.347531","23.39.213.4","192.168.1.166","TCP","1514","443  >  50692 [ACK] Seq=716618 Ack=119386 Win=9899 Len=1460 [TCP PDU reassembled in 255]"
"255","2.347531","23.39.213.4","192.168.1.166","TLSv1.2","1514","Application Data, Application Data"
"256","2.347531","23.39.213.4","192.168.1.166","TCP","1514","443  >  50692 [ACK] Seq=719538 Ack=119386 Win=9899 Len=1460 [TCP PDU reassembled in 267]"
"257","2.347531","23.39.213.4","192.168.1.166","TCP","1514","443  >  50692 [ACK] Seq=720998 Ack=119386 Win=9899 Len=1460 [TCP PDU reassembled in 267]"
"258","2.347531","23.39.213.4","192.168.1.166","TCP","1514","443  >  50692 [ACK] Seq=722458 Ack=119386 Win=9899 Len=1460 [TCP PDU reassembled in 267]"
"259","2.347531","23.39.213.4","192.168.1.166","TCP","1514","443  >  50692 [ACK] Seq=723918 Ack=119386 Win=9899 Len=1460 [TCP PDU reassembled in 267]"
"260","2.347531","23.39.213.4","192.168.1.166","TCP","1514","443  >  50692 [ACK] Seq=725378 Ack=119386 Win=9899 Len=1460 [TCP PDU reassembled in 267]"
"261","2.347531","23.39.213.4","192.168.1.166","TCP","1514","443  >  50692 [ACK] Seq=726838 Ack=119386 Win=9899 Len=1460 [TCP PDU reassembled in 267]"
"262","2.347531","23.39.213.4","192.168.1.166","TCP","1514","443  >  50692 [ACK] Seq=728298 Ack=119386 Win=9899 Len=1460 [TCP PDU reassembled in 267]"
"263","2.347531","23.39.213.4","192.168.1.166","TCP","1514","443  >  50692 [ACK] Seq=729758 Ack=119386 Win=9899 Len=1460 [TCP PDU reassembled in 267]"
"264","2.347531","23.39.213.4","192.168.1.166","TCP","1514","443  >  50692 [ACK] Seq=731218 Ack=119386 Win=9899 Len=1460 [TCP PDU reassembled in 267]"
"265","2.347575","192.168.1.166","23.39.213.4","TCP","54","50692  >  443 [ACK] Seq=119386 Ack=732678 Win=8191 Len=0"
"266","2.348484","23.39.213.4","192.168.1.166","TCP","1514","443  >  50692 [ACK] Seq=732678 Ack=119386 Win=9899 Len=1460 [TCP PDU reassembled in 267]"
"267","2.348484","23.39.213.4","192.168.1.166","TLSv1.2","1514","Application Data, Application Data"
"268","2.348484","23.39.213.4","192.168.1.166","TCP","1514","443  >  50692 [ACK] Seq=735598 Ack=119386 Win=9899 Len=1460 [TCP PDU reassembled in 275]"
"269","2.348484","23.39.213.4","192.168.1.166","TCP","1514","443  >  50692 [ACK] Seq=737058 Ack=119386 Win=9899 Len=1460 [TCP PDU reassembled in 275]"
"270","2.348484","23.39.213.4","192.168.1.166","TCP","1514","443  >  50692 [ACK] Seq=738518 Ack=119386 Win=9899 Len=1460 [TCP PDU reassembled in 275]"
"271","2.348484","23.39.213.4","192.168.1.166","TCP","1514","443  >  50692 [ACK] Seq=739978 Ack=119386 Win=9899 Len=1460 [TCP PDU reassembled in 275]"
"272","2.348484","23.39.213.4","192.168.1.166","TCP","1514","443  >  50692 [ACK] Seq=741438 Ack=119386 Win=9899 Len=1460 [TCP PDU reassembled in 275]"
"273","2.348484","23.39.213.4","192.168.1.166","TCP","1514","443  >  50692 [ACK] Seq=742898 Ack=119386 Win=9899 Len=1460 [TCP PDU reassembled in 275]"
"274","2.348484","23.39.213.4","192.168.1.166","TCP","1514","443  >  50692 [ACK] Seq=744358 Ack=119386 Win=9899 Len=1460 [TCP PDU reassembled in 275]"
"275","2.348484","23.39.213.4","192.168.1.166","TLSv1.2","1131","Application Data"
"276","2.348516","192.168.1.166","23.39.213.4","TCP","54","50692  >  443 [ACK] Seq=119386 Ack=746895 Win=8191 Len=0"
"277","2.352238","192.168.1.166","23.39.213.4","TLSv1.2","5115","Application Data"
"278","2.361378","192.168.1.166","23.39.213.4","TLSv1.2","5087","Application Data"
"279","2.384362","23.39.213.4","192.168.1.166","TCP","54","443  >  50692 [ACK] Seq=746895 Ack=122306 Win=9937 Len=0"
"280","2.387849","23.39.213.4","192.168.1.166","TLSv1.2","384","Application Data"
"281","2.387849","23.39.213.4","192.168.1.166","TLSv1.2","972","Application Data"
"282","2.387849","23.39.213.4","192.168.1.166","TLSv1.2","384","Application Data"
"283","2.387849","23.39.213.4","192.168.1.166","TCP","1514","443  >  50692 [ACK] Seq=748473 Ack=124447 Win=9925 Len=1460 [TCP PDU reassembled in 284]"
"284","2.387849","23.39.213.4","192.168.1.166","TLSv1.2","386","Application Data"
"285","2.387849","23.39.213.4","192.168.1.166","TLSv1.2","351","Application Data"
"286","2.387895","192.168.1.166","23.39.213.4","TCP","54","50692  >  443 [ACK] Seq=129480 Ack=750562 Win=8191 Len=0"
"287","2.388134","192.168.1.166","23.39.213.4","TLSv1.2","89","Application Data"
"288","2.392449","23.39.213.4","192.168.1.166","TCP","54","443  >  50692 [ACK] Seq=750562 Ack=127367 Win=9937 Len=0"
"289","2.401555","23.39.213.4","192.168.1.166","TLSv1.2","317","Application Data"
"290","2.401555","23.39.213.4","192.168.1.166","TCP","1514","443  >  50692 [ACK] Seq=750825 Ack=129480 Win=9925 Len=1460 [TCP PDU reassembled in 291]"
"291","2.401555","23.39.213.4","192.168.1.166","TLSv1.2","110","Application Data"
"292","2.401555","23.39.213.4","192.168.1.166","TLSv1.2","85","Application Data"
"293","2.401555","23.39.213.4","192.168.1.166","TLSv1.2","373","Application Data"
"294","2.401555","23.39.213.4","192.168.1.166","TLSv1.2","380","Application Data"
"295","2.401596","192.168.1.166","23.39.213.4","TCP","54","50692  >  443 [ACK] Seq=129515 Ack=753017 Win=8191 Len=0"
"296","2.401949","192.168.1.166","23.39.213.4","TLSv1.2","89","Application Data"
"297","2.461111","23.39.213.4","192.168.1.166","TCP","54","443  >  50692 [ACK] Seq=753017 Ack=129550 Win=9949 Len=0"
"298","2.464493","23.39.213.4","192.168.1.166","TLSv1.2","85","Application Data"
"299","2.464493","23.39.213.4","192.168.1.166","TLSv1.2","352","Application Data"
"300","2.464520","192.168.1.166","23.39.213.4","TCP","54","50692  >  443 [ACK] Seq=129550 Ack=753346 Win=8190 Len=0"
"301","2.464773","192.168.1.166","23.39.213.4","TLSv1.2","89","Application Data"
"302","2.476605","23.39.213.4","192.168.1.166","TLSv1.2","318","Application Data"
"303","2.476605","23.39.213.4","192.168.1.166","TLSv1.2","1429","Application Data"
"304","2.476605","23.39.213.4","192.168.1.166","TLSv1.2","85","Application Data"
"305","2.476644","192.168.1.166","23.39.213.4","TCP","54","50692  >  443 [ACK] Seq=129585 Ack=755016 Win=8191 Len=0"
"306","2.503939","23.39.213.4","192.168.1.166","TLSv1.2","813","Application Data"
"307","2.503975","192.168.1.166","23.39.213.4","TCP","54","50692  >  443 [ACK] Seq=129585 Ack=755775 Win=8188 Len=0"
"308","2.655261","192.168.1.166","23.39.213.4","TLSv1.2","5177","Application Data"
"309","2.655316","192.168.1.166","23.39.213.4","TLSv1.2","588","Application Data"
"310","2.664073","192.168.1.166","23.39.213.4","TLSv1.2","5036","Application Data"
"311","2.664497","192.168.1.166","23.39.213.4","TLSv1.2","5019","Application Data"
"312","2.664565","192.168.1.166","23.39.213.4","TLSv1.2","5018","Application Data"
"313","2.664819","192.168.1.166","23.39.213.4","TLSv1.2","5018","Application Data"
"314","2.666305","192.168.1.166","23.39.213.4","TLSv1.2","5019","Application Data"
"315","2.686794","23.39.213.4","192.168.1.166","TCP","54","443  >  50692 [ACK] Seq=755775 Ack=134708 Win=9925 Len=0"
"316","2.695823","23.39.213.4","192.168.1.166","TCP","54","443  >  50692 [ACK] Seq=755775 Ack=136702 Win=9945 Len=0"
"317","2.713594","23.39.213.4","192.168.1.166","TCP","54","443  >  50692 [ACK] Seq=755775 Ack=160082 Win=9819 Len=0"
"318","2.726771","192.168.1.166","23.39.213.4","TLSv1.2","5337","Application Data"
"319","2.726839","192.168.1.166","23.39.213.4","TLSv1.2","3904","Application Data"
"320","2.729869","192.168.1.166","23.39.213.4","TLSv1.2","5337","Application Data"
"321","2.729907","192.168.1.166","23.39.213.4","TLSv1.2","3904","Application Data"
"322","2.730585","192.168.1.166","23.39.213.4","TLSv1.2","5177","Application Data"
"323","2.730622","192.168.1.166","23.39.213.4","TLSv1.2","3641","Application Data"
"324","2.737889","192.168.1.166","23.39.213.4","TLSv1.2","5101","Application Data"
"325","2.740900","192.168.1.166","23.39.213.4","TLSv1.2","5100","Application Data"
"326","2.741083","23.39.213.4","192.168.1.166","TLSv1.2","371","Application Data"
"327","2.741083","23.39.213.4","192.168.1.166","TCP","1514","443  >  50692 [ACK] Seq=756092 Ack=160082 Win=9949 Len=1460 [TCP PDU reassembled in 329]"
"328","2.741083","23.39.213.4","192.168.1.166","TCP","1514","443  >  50692 [ACK] Seq=757552 Ack=160082 Win=9949 Len=1460 [TCP PDU reassembled in 329]"
"329","2.741083","23.39.213.4","192.168.1.166","TLSv1.2","1137","Application Data"
"330","2.741083","23.39.213.4","192.168.1.166","TLSv1.2","383","Application Data"
"331","2.741083","23.39.213.4","192.168.1.166","TCP","1514","443  >  50692 [ACK] Seq=760424 Ack=160082 Win=9949 Len=1460 [TCP PDU reassembled in 342]"
"332","2.741083","23.39.213.4","192.168.1.166","TCP","1514","443  >  50692 [ACK] Seq=761884 Ack=160082 Win=9949 Len=1460 [TCP PDU reassembled in 342]"
"333","2.741083","23.39.213.4","192.168.1.166","TCP","1514","443  >  50692 [ACK] Seq=763344 Ack=160082 Win=9949 Len=1460 [TCP PDU reassembled in 342]"
"334","2.741083","23.39.213.4","192.168.1.166","TCP","1514","443  >  50692 [ACK] Seq=764804 Ack=160082 Win=9949 Len=1460 [TCP PDU reassembled in 342]"
"335","2.741083","23.39.213.4","192.168.1.166","TCP","1514","443  >  50692 [ACK] Seq=766264 Ack=160082 Win=9949 Len=1460 [TCP PDU reassembled in 342]"
"336","2.741083","23.39.213.4","192.168.1.166","TCP","1514","443  >  50692 [ACK] Seq=767724 Ack=160082 Win=9949 Len=1460 [TCP PDU reassembled in 342]"
"337","2.741083","23.39.213.4","192.168.1.166","TCP","1514","443  >  50692 [ACK] Seq=769184 Ack=160082 Win=9949 Len=1460 [TCP PDU reassembled in 342]"
"338","2.741083","23.39.213.4","192.168.1.166","TCP","1514","443  >  50692 [ACK] Seq=770644 Ack=160082 Win=9949 Len=1460 [TCP PDU reassembled in 342]"
"339","2.741083","23.39.213.4","192.168.1.166","TCP","1514","443  >  50692 [ACK] Seq=772104 Ack=160082 Win=9949 Len=1460 [TCP PDU reassembled in 342]"
"340","2.741083","23.39.213.4","192.168.1.166","TCP","1514","443  >  50692 [ACK] Seq=773564 Ack=160082 Win=9949 Len=1460 [TCP PDU reassembled in 342]"
"341","2.741083","23.39.213.4","192.168.1.166","TCP","1514","443  >  50692 [ACK] Seq=775024 Ack=160082 Win=9949 Len=1460 [TCP PDU reassembled in 342]"
"342","2.741083","23.39.213.4","192.168.1.166","TLSv1.2","400","Application Data"
"343","2.741083","23.39.213.4","192.168.1.166","TLSv1.2","85","Application Data"
"344","2.741162","192.168.1.166","23.39.213.4","TCP","54","50692  >  443 [ACK] Seq=197151 Ack=776861 Win=8191 Len=0"
"345","2.742256","23.39.213.4","192.168.1.166","TCP","1514","443  >  50692 [ACK] Seq=776861 Ack=160082 Win=9949 Len=1460 [TCP PDU reassembled in 350]"
"346","2.742256","23.39.213.4","192.168.1.166","TCP","1514","443  >  50692 [ACK] Seq=778321 Ack=160082 Win=9949 Len=1460 [TCP PDU reassembled in 350]"
"347","2.742256","23.39.213.4","192.168.1.166","TCP","1514","443  >  50692 [ACK] Seq=779781 Ack=160082 Win=9949 Len=1460 [TCP PDU reassembled in 350]"
"348","2.742256","23.39.213.4","192.168.1.166","TCP","1514","443  >  50692 [ACK] Seq=781241 Ack=160082 Win=9949 Len=1460 [TCP PDU reassembled in 350]"
"349","2.742256","23.39.213.4","192.168.1.166","TCP","2974","443  >  50692 [ACK] Seq=782701 Ack=160082 Win=9949 Len=2920 [TCP PDU reassembled in 350]"
"350","2.742256","23.39.213.4","192.168.1.166","TLSv1.2","197","Application Data"
"351","2.742256","23.39.213.4","192.168.1.166","TLSv1.2","16114","Application Data"
"352","2.742256","23.39.213.4","192.168.1.166","TLSv1.2","729","Application Data"
"353","2.742256","23.39.213.4","192.168.1.166","TLSv1.2","26334","Application Data, Application Data, Application Data"
"354","2.742256","23.39.213.4","192.168.1.166","TCP","1514","443  >  50692 [ACK] Seq=828779 Ack=160082 Win=9949 Len=1460 [TCP PDU reassembled in 355]"
"355","2.742256","23.39.213.4","192.168.1.166","TLSv1.2","1202","Application Data"
"356","2.742256","23.39.213.4","192.168.1.166","TLSv1.2","1514","Application Data, Application Data"
"357","2.742256","23.39.213.4","192.168.1.166","TLSv1.2","1227","Application Data, Application Data"
"358","2.742314","192.168.1.166","23.39.213.4","TCP","54","50692  >  443 [ACK] Seq=197151 Ack=834020 Win=8191 Len=0"
"359","2.744849","192.168.1.166","23.39.213.4","TLSv1.2","5036","Application Data"
