"No.","Time","Source","Destination","Protocol","Length","Info"
"1","0.000000","192.168.1.166","23.198.241.2","TLSv1.2","5645","Application Data"
"2","0.000067","192.168.1.166","23.198.241.2","TLSv1.2","538","Application Data"
"3","0.025383","23.198.241.2","192.168.1.166","TCP","54","443  >  58685 [ACK] Seq=1 Ack=6076 Win=9736 Len=0"
"4","0.085085","23.198.241.2","192.168.1.166","TLSv1.2","473","Application Data"
"5","0.085085","23.198.241.2","192.168.1.166","TLSv1.2","116","Application Data"
"6","0.085114","192.168.1.166","23.198.241.2","TCP","54","58685  >  443 [ACK] Seq=6076 Ack=482 Win=8186 Len=0"
"7","0.272799","192.168.1.166","23.198.241.2","TLSv1.2","5664","Application Data"
"8","0.272862","192.168.1.166","23.198.241.2","TLSv1.2","2637","Application Data"
"9","0.315861","23.198.241.2","192.168.1.166","TCP","54","443  >  58685 [ACK] Seq=482 Ack=8996 Win=9754 Len=0"
"10","0.315861","23.198.241.2","192.168.1.166","TCP","54","443  >  58685 [ACK] Seq=482 Ack=11686 Win=9755 Len=0"
"11","0.315861","23.198.241.2","192.168.1.166","TCP","54","443  >  58685 [ACK] Seq=482 Ack=14269 Win=9763 Len=0"
"12","0.331420","23.198.241.2","192.168.1.166","TLSv1.2","374","Application Data"
"13","0.331420","23.198.241.2","192.168.1.166","TLSv1.2","85","Application Data"
"14","0.331441","192.168.1.166","23.198.241.2","TCP","54","58685  >  443 [ACK] Seq=14269 Ack=833 Win=8191 Len=0"
"15","0.727964","192.168.1.166","23.198.241.2","TLSv1.2","5789","Application Data"
"16","0.763723","23.198.241.2","192.168.1.166","TCP","54","443  >  58685 [ACK] Seq=833 Ack=17189 Win=9754 Len=0"
"17","0.763723","23.198.241.2","192.168.1.166","TCP","54","443  >  58685 [ACK] Seq=833 Ack=20004 Win=9770 Len=0"
"18","2.465437","23.198.241.2","192.168.1.166","TLSv1.2","1455","Application Data"
"19","2.465437","23.198.241.2","192.168.1.166","TCP","16114","443  >  58685 [ACK] Seq=2234 Ack=20004 Win=9770 Len=16060 [TCP PDU reassembled in 20]"
"20","2.465437","23.198.241.2","192.168.1.166","TLSv1.2","400","Application Data"
"21","2.465437","23.198.241.2","192.168.1.166","TLSv1.2","85","Application Data"
"22","2.465437","23.198.241.2","192.168.1.166","TCP","16114","443  >  58685 [ACK] Seq=18671 Ack=20004 Win=9770 Len=16060 [TCP PDU reassembled in 23]"
"23","2.465437","23.198.241.2","192.168.1.166","TLSv1.2","400","Application Data"
"24","2.465437","23.198.241.2","192.168.1.166","TLSv1.2","11734","Application Data, Application Data"
"25","2.465437","23.198.241.2","192.168.1.166","TLSv1.2","1160","Application Data"
"26","2.465510","192.168.1.166","23.198.241.2","TCP","54","58685  >  443 [ACK] Seq=20004 Ack=47863 Win=8191 Len=0"
"27","2.466439","192.168.1.166","23.198.241.2","TLSv1.2","89","Application Data"
"28","2.467246","23.198.241.2","192.168.1.166","TCP","16114","443  >  58685 [ACK] Seq=47863 Ack=20004 Win=9770 Len=16060 [TCP PDU reassembled in 29]"
"29","2.467246","23.198.241.2","192.168.1.166","TLSv1.2","400","Application Data"
"30","2.467246","23.198.241.2","192.168.1.166","TLSv1.2","85","Application Data"
"31","2.467246","23.198.241.2","192.168.1.166","TCP","2974","443  >  58685 [ACK] Seq=64300 Ack=20004 Win=9770 Len=2920 [TCP PDU reassembled in 34]"
"32","2.467281","192.168.1.166","23.198.241.2","TCP","54","58685  >  443 [ACK] Seq=20039 Ack=67220 Win=8191 Len=0"
"33","2.468065","23.198.241.2","192.168.1.166","TCP","2974","443  >  58685 [ACK] Seq=67220 Ack=20004 Win=9770 Len=2920 [TCP PDU reassembled in 34]"
"34","2.468065","23.198.241.2","192.168.1.166","TLSv1.2","452","Application Data"
"35","2.468085","192.168.1.166","23.198.241.2","TCP","54","58685  >  443 [ACK] Seq=20039 Ack=70538 Win=8191 Len=0"
"36","2.471557","192.168.1.166","23.198.241.2","TLSv1.2","5851","Application Data"
"37","2.471593","192.168.1.166","23.198.241.2","TLSv1.2","1450","Application Data"
"38","2.487277","23.198.241.2","192.168.1.166","TCP","1514","443  >  58685 [ACK] Seq=70538 Ack=20004 Win=9770 Len=1460 [TCP PDU reassembled in 49]"
"39","2.487277","23.198.241.2","192.168.1.166","TCP","1514","443  >  58685 [ACK] Seq=71998 Ack=20004 Win=9770 Len=1460 [TCP PDU reassembled in 49]"
"40","2.487277","23.198.241.2","192.168.1.166","TCP","1514","443  >  58685 [ACK] Seq=73458 Ack=20004 Win=9770 Len=1460 [TCP PDU reassembled in 49]"
"41","2.487277","23.198.241.2","192.168.1.166","TCP","1514","443  >  58685 [ACK] Seq=74918 Ack=20004 Win=9770 Len=1460 [TCP PDU reassembled in 49]"
"42","2.487277","23.198.241.2","192.168.1.166","TCP","1514","443  >  58685 [ACK] Seq=76378 Ack=20004 Win=9770 Len=1460 [TCP PDU reassembled in 49]"
"43","2.487277","23.198.241.2","192.168.1.166","TCP","1514","443  >  58685 [ACK] Seq=77838 Ack=20004 Win=9770 Len=1460 [TCP PDU reassembled in 49]"
"44","2.487277","23.198.241.2","192.168.1.166","TCP","1514","443  >  58685 [ACK] Seq=79298 Ack=20004 Win=9770 Len=1460 [TCP PDU reassembled in 49]"
"45","2.487277","23.198.241.2","192.168.1.166","TCP","1514","443  >  58685 [ACK] Seq=80758 Ack=20004 Win=9770 Len=1460 [TCP PDU reassembled in 49]"
"46","2.487277","23.198.241.2","192.168.1.166","TCP","1514","443  >  58685 [ACK] Seq=82218 Ack=20004 Win=9770 Len=1460 [TCP PDU reassembled in 49]"
"47","2.487277","23.198.241.2","192.168.1.166","TCP","1514","443  >  58685 [ACK] Seq=83678 Ack=20004 Win=9770 Len=1460 [TCP PDU reassembled in 49]"
"48","2.487277","23.198.241.2","192.168.1.166","TCP","1514","443  >  58685 [ACK] Seq=85138 Ack=20004 Win=9770 Len=1460 [TCP PDU reassembled in 49]"
"49","2.487277","23.198.241.2","192.168.1.166","TLSv1.2","400","Application Data"
"50","2.487277","23.198.241.2","192.168.1.166","TLSv1.2","85","Application Data"
"51","2.487277","23.198.241.2","192.168.1.166","TCP","1514","443  >  58685 [ACK] Seq=86975 Ack=20004 Win=9770 Len=1460 [TCP PDU reassembled in 59]"
"52","2.487277","23.198.241.2","192.168.1.166","TCP","1514","443  >  58685 [ACK] Seq=88435 Ack=20004 Win=9770 Len=1460 [TCP PDU reassembled in 59]"
"53","2.487277","23.198.241.2","192.168.1.166","TCP","1514","443  >  58685 [ACK] Seq=89895 Ack=20004 Win=9770 Len=1460 [TCP PDU reassembled in 59]"
"54","2.487277","23.198.241.2","192.168.1.166","TCP","1514","443  >  58685 [ACK] Seq=91355 Ack=20004 Win=9770 Len=1460 [TCP PDU reassembled in 59]"
"55","2.487277","23.198.241.2","192.168.1.166","TCP","1514","443  >  58685 [ACK] Seq=92815 Ack=20004 Win=9770 Len=1460 [TCP PDU reassembled in 59]"
"56","2.487277","23.198.241.2","192.168.1.166","TCP","1514","443  >  58685 [ACK] Seq=94275 Ack=20004 Win=9770 Len=1460 [TCP PDU reassembled in 59]"
"57","2.487277","23.198.241.2","192.168.1.166","TCP","1514","443  >  58685 [ACK] Seq=95735 Ack=20004 Win=9770 Len=1460 [TCP PDU reassembled in 59]"
"58","2.487277","23.198.241.2","192.168.1.166","TCP","1514","443  >  58685 [ACK] Seq=97195 Ack=20004 Win=9770 Len=1460 [TCP PDU reassembled in 59]"
"59","2.487277","23.198.241.2","192.168.1.166","TLSv1.2","1028","Application Data"
"60","2.487277","23.198.241.2","192.168.1.166","TCP","7354","443  >  58685 [ACK] Seq=99629 Ack=20004 Win=9770 Len=7300 [TCP PDU reassembled in 61]"
"61","2.487277","23.198.241.2","192.168.1.166","TLSv1.2","172","Application Data"
"62","2.487277","23.198.241.2","192.168.1.166","TLSv1.2","93","Application Data"
"63","2.487277","23.198.241.2","192.168.1.166","TLSv1.2","85","Application Data"
"64","2.487362","192.168.1.166","23.198.241.2","TCP","54","58685  >  443 [ACK] Seq=27232 Ack=107117 Win=8191 Len=0"
"65","2.496989","192.168.1.166","23.198.241.2","TLSv1.2","5674","Application Data"
"66","2.497049","192.168.1.166","23.198.241.2","TLSv1.2","5706","Application Data"
"67","2.497095","192.168.1.166","23.198.241.2","TLSv1.2","5694","Application Data"
"68","2.497120","192.168.1.166","23.198.241.2","TLSv1.2","566","Application Data"
"69","2.497134","192.168.1.166","23.198.241.2","TLSv1.2","182","Application Data"
"70","2.508199","23.198.241.2","192.168.1.166","TCP","54","443  >  58685 [ACK] Seq=107117 Ack=21499 Win=9762 Len=0"
"71","2.508199","23.198.241.2","192.168.1.166","TCP","54","443  >  58685 [ACK] Seq=107117 Ack=24419 Win=9770 Len=0"
"72","2.508199","23.198.241.2","192.168.1.166","TCP","54","443  >  58685 [ACK] Seq=107117 Ack=27232 Win=9755 Len=0"
"73","2.508765","192.168.1.166","23.198.241.2","TLSv1.2","5438","Application Data"
"74","2.529830","23.198.241.2","192.168.1.166","TLSv1.2","361","Application Data"
"75","2.529830","23.198.241.2","192.168.1.166","TLSv1.2","290","Application Data"
"76","2.529865","192.168.1.166","23.198.241.2","TCP","54","58685  >  443 [ACK] Seq=50168 Ack=107660 Win=8189 Len=0"
"77","2.531720","192.168.1.166","23.198.241.2","TLSv1.2","566","Application Data"
"78","2.532701","192.168.1.166","23.198.241.2","TLSv1.2","182","Application Data"
"79","2.532731","192.168.1.166","23.198.241.2","TLSv1.2","181","Application Data"
"80","2.532784","192.168.1.166","23.198.241.2","TLSv1.2","5413","Application Data"
"81","2.532836","192.168.1.166","23.198.241.2","TLSv1.2","5676","Application Data"
"82","2.555833","23.198.241.2","192.168.1.166","TCP","54","443  >  58685 [ACK] Seq=107660 Ack=35772 Win=9732 Len=0"
"83","2.555833","23.198.241.2","192.168.1.166","TCP","54","443  >  58685 [ACK] Seq=107660 Ack=38504 Win=9762 Len=0"
"84","2.575139","23.198.241.2","192.168.1.166","TLSv1.2","372","Application Data"
"85","2.575139","23.198.241.2","192.168.1.166","TCP","1514","443  >  58685 [ACK] Seq=107978 Ack=50168 Win=9699 Len=1460 [TCP PDU reassembled in 89]"
"86","2.575139","23.198.241.2","192.168.1.166","TCP","1514","443  >  58685 [ACK] Seq=109438 Ack=50168 Win=9699 Len=1460 [TCP PDU reassembled in 89]"
"87","2.575139","23.198.241.2","192.168.1.166","TCP","1514","443  >  58685 [ACK] Seq=110898 Ack=50168 Win=9699 Len=1460 [TCP PDU reassembled in 89]"
"88","2.575139","23.198.241.2","192.168.1.166","TCP","4434","443  >  58685 [ACK] Seq=112358 Ack=50168 Win=9699 Len=4380 [TCP PDU reassembled in 89]"
"89","2.575139","23.198.241.2","192.168.1.166","TLSv1.2","1161","Application Data"
"90","2.575175","192.168.1.166","23.198.241.2","TCP","54","58685  >  443 [ACK] Seq=61916 Ack=117845 Win=8191 Len=0"
"91","2.594686","23.198.241.2","192.168.1.166","TLSv1.2","424","Application Data"
"92","2.594686","23.198.241.2","192.168.1.166","TCP","1514","443  >  58685 [ACK] Seq=118215 Ack=50168 Win=9770 Len=1460 [TCP PDU reassembled in 93]"
"93","2.594686","23.198.241.2","192.168.1.166","TLSv1.2","809","Application Data"
"94","2.594686","23.198.241.2","192.168.1.166","TLSv1.2","424","Application Data"
"95","2.594686","23.198.241.2","192.168.1.166","TCP","1514","443  >  58685 [ACK] Seq=120800 Ack=50168 Win=9770 Len=1460 [TCP PDU reassembled in 96]"
"96","2.594686","23.198.241.2","192.168.1.166","TLSv1.2","1017","Application Data"
"97","2.594686","23.198.241.2","192.168.1.166","TLSv1.2","424","Application Data"
"98","2.594686","23.198.241.2","192.168.1.166","TCP","1514","443  >  58685 [ACK] Seq=123593 Ack=50168 Win=9770 Len=1460 [TCP PDU reassembled in 99]"
"99","2.594686","23.198.241.2","192.168.1.166","TLSv1.2","693","Application Data"
"100","2.594686","23.198.241.2","192.168.1.166","TLSv1.2","345","Application Data"
"101","2.594686","23.198.241.2","192.168.1.166","TLSv1.2","1439","Application Data"
"102","2.594686","23.198.241.2","192.168.1.166","TLSv1.2","346","Application Data"
"103","2.594686","23.198.241.2","192.168.1.166","TCP","2974","443  >  58685 [ACK] Seq=127660 Ack=50168 Win=9770 Len=2920 [TCP PDU reassembled in 104]"
"104","2.594686","23.198.241.2","192.168.1.166","TLSv1.2","1257","Application Data"
"105","2.594740","192.168.1.166","23.198.241.2","TCP","54","58685  >  443 [ACK] Seq=61916 Ack=131783 Win=8191 Len=0"
"106","2.596641","192.168.1.166","23.198.241.2","TLSv1.2","5681","Application Data"
"107","2.596701","192.168.1.166","23.198.241.2","TLSv1.2","5675","Application Data"
"108","2.597274","23.198.241.2","192.168.1.166","TCP","54","443  >  58685 [ACK] Seq=131783 Ack=50935 Win=9770 Len=0"
"109","2.597274","23.198.241.2","192.168.1.166","TCP","54","443  >  58685 [ACK] Seq=131783 Ack=53855 Win=9754 Len=0"
"110","2.597274","23.198.241.2","192.168.1.166","TCP","54","443  >  58685 [ACK] Seq=131783 Ack=56294 Win=9756 Len=0"
"111","2.607276","23.198.241.2","192.168.1.166","TLSv1.2","333","Application Data"
"112","2.607276","23.198.241.2","192.168.1.166","TCP","2974","443  >  58685 [ACK] Seq=132062 Ack=61916 Win=9727 Len=2920 [TCP PDU reassembled in 113]"
"113","2.607276","23.198.241.2","192.168.1.166","TLSv1.2","1363","Application Data"
"114","2.607307","192.168.1.166","23.198.241.2","TCP","54","58685  >  443 [ACK] Seq=73164 Ack=136291 Win=8191 Len=0"
"115","2.609146","192.168.1.166","23.198.241.2","TLSv1.2","5675","Application Data"
"116","2.613849","192.168.1.166","23.198.241.2","TLSv1.2","90","Application Data"
"117","2.613876","192.168.1.166","23.198.241.2","TLSv1.2","90","Application Data"
"118","2.617349","192.168.1.166","23.198.241.2","TLSv1.2","90","Application Data"
"119","2.617370","192.168.1.166","23.198.241.2","TLSv1.2","90","Application Data"
"120","2.620056","192.168.1.166","23.198.241.2","TLSv1.2","5650","Application Data"
"121","2.628186","23.198.241.2","192.168.1.166","TCP","54","443  >  58685 [ACK] Seq=136291 Ack=67543 Win=9740 Len=0"
"122","2.628186","23.198.241.2","192.168.1.166","TLSv1.2","333","Application Data"
"123","2.628186","23.198.241.2","192.168.1.166","TCP","2974","443  >  58685 [ACK] Seq=136570 Ack=73164 Win=9711 Len=2920 [TCP PDU reassembled in 124]"
"124","2.628186","23.198.241.2","192.168.1.166","TLSv1.2","653","Application Data"
"125","2.628186","23.198.241.2","192.168.1.166","TLSv1.2","346","Application Data"
"126","2.628186","23.198.241.2","192.168.1.166","TCP","4434","443  >  58685 [ACK] Seq=140381 Ack=73164 Win=9711 Len=4380 [TCP PDU reassembled in 127]"
"127","2.628186","23.198.241.2","192.168.1.166","TLSv1.2","987","Application Data"
"128","2.628186","23.198.241.2","192.168.1.166","TLSv1.2","371","Application Data"
"129","2.628186","23.198.241.2","192.168.1.166","TLSv1.2","553","Application Data, Application Data"
"130","2.628245","192.168.1.166","23.198.241.2","TCP","54","58685  >  443 [ACK] Seq=84525 Ack=146510 Win=8191 Len=0"
"131","2.628310","23.198.241.2","192.168.1.166","TCP","1514","443  >  58685 [ACK] Seq=146510 Ack=73164 Win=9711 Len=1460 [TCP PDU reassembled in 134]"
"132","2.628310","23.198.241.2","192.168.1.166","TCP","1514","443  >  58685 [ACK] Seq=147970 Ack=73164 Win=9711 Len=1460 [TCP PDU reassembled in 134]"
"133","2.628310","23.198.241.2","192.168.1.166","TCP","1514","443  >  58685 [ACK] Seq=149430 Ack=73164 Win=9711 Len=1460 [TCP PDU reassembled in 134]"
"134","2.628310","23.198.241.2","192.168.1.166","TLSv1.2","254","Application Data"
"135","2.628331","192.168.1.166","23.198.241.2","TCP","54","58685  >  443 [ACK] Seq=84525 Ack=151090 Win=8191 Len=0"
"136","2.630241","192.168.1.166","23.198.241.2","TLSv1.2","5738","Application Data"
"137","2.636006","23.198.241.2","192.168.1.166","TCP","54","443  >  58685 [ACK] Seq=151090 Ack=77544 Win=9747 Len=0"
"138","2.639461","192.168.1.166","23.198.241.2","TLSv1.2","5687","Application Data"
"139","2.642487","23.198.241.2","192.168.1.166","TLSv1.2","371","Application Data"
"140","2.642487","23.198.241.2","192.168.1.166","TCP","1514","443  >  58685 [ACK] Seq=151407 Ack=78857 Win=9737 Len=1460 [TCP PDU reassembled in 141]"
"141","2.642487","23.198.241.2","192.168.1.166","TLSv1.2","202","Application Data"
"142","2.642487","23.198.241.2","192.168.1.166","TLSv1.2","371","Application Data"
"143","2.642487","23.198.241.2","192.168.1.166","TCP","1514","443  >  58685 [ACK] Seq=153332 Ack=78857 Win=9737 Len=1460 [TCP PDU reassembled in 144]"
"144","2.642487","23.198.241.2","192.168.1.166","TLSv1.2","640","Application Data"
"145","2.642520","192.168.1.166","23.198.241.2","TCP","54","58685  >  443 [ACK] Seq=95842 Ack=155378 Win=8191 Len=0"
"146","2.659455","23.198.241.2","192.168.1.166","TLSv1.2","957","Application Data"
"147","2.659455","23.198.241.2","192.168.1.166","TLSv1.2","85","Application Data"
"148","2.659455","23.198.241.2","192.168.1.166","TCP","54","443  >  58685 [ACK] Seq=156312 Ack=78929 Win=9770 Len=0"
"149","2.659455","23.198.241.2","192.168.1.166","TCP","54","443  >  58685 [ACK] Seq=156312 Ack=84525 Win=9767 Len=0"
"150","2.659455","23.198.241.2","192.168.1.166","TCP","54","443  >  58685 [ACK] Seq=156312 Ack=87445 Win=9752 Len=0"
"151","2.659455","23.198.241.2","192.168.1.166","TCP","54","443  >  58685 [ACK] Seq=156312 Ack=90209 Win=9755 Len=0"
"152","2.659511","192.168.1.166","23.198.241.2","TCP","54","58685  >  443 [ACK] Seq=95842 Ack=156312 Win=8188 Len=0"
"153","2.672027","23.198.241.2","192.168.1.166","TLSv1.2","382","Application Data"
"154","2.672027","23.198.241.2","192.168.1.166","TCP","1514","443  >  58685 [ACK] Seq=156640 Ack=95842 Win=9725 Len=1460 [TCP PDU reassembled in 155]"
"155","2.672027","23.198.241.2","192.168.1.166","TLSv1.2","454","Application Data"
"156","2.672064","192.168.1.166","23.198.241.2","TCP","54","58685  >  443 [ACK] Seq=95842 Ack=158500 Win=8191 Len=0"
"157","2.688572","23.198.241.2","192.168.1.166","TLSv1.2","424","Application Data"
"158","2.688572","23.198.241.2","192.168.1.166","TCP","1514","443  >  58685 [ACK] Seq=158870 Ack=95842 Win=9770 Len=1460 [TCP PDU reassembled in 159]"
"159","2.688572","23.198.241.2","192.168.1.166","TLSv1.2","805","Application Data"
"160","2.688572","23.198.241.2","192.168.1.166","TLSv1.2","372","Application Data"
"161","2.688609","192.168.1.166","23.198.241.2","TCP","54","58685  >  443 [ACK] Seq=95842 Ack=161399 Win=8191 Len=0"
"162","2.703342","23.198.241.2","192.168.1.166","TLSv1.2","85","Application Data"
"163","2.703373","192.168.1.166","23.198.241.2","TCP","54","58685  >  443 [ACK] Seq=95842 Ack=161430 Win=8191 Len=0"
"164","2.715750","192.168.1.166","23.198.241.2","TLSv1.2","571","Application Data"
"165","2.715800","192.168.1.166","23.198.241.2","TLSv1.2","176","Application Data"
"166","2.715819","192.168.1.166","23.198.241.2","TLSv1.2","191","Application Data"
"167","2.715834","192.168.1.166","23.198.241.2","TLSv1.2","176","Application Data"
"168","2.715875","192.168.1.166","23.198.241.2","TLSv1.2","176","Application Data"
"169","2.732511","192.168.1.166","23.198.241.2","TLSv1.2","5447","Application Data"
"170","2.732587","192.168.1.166","23.198.241.2","TLSv1.2","5661","Application Data"
"171","2.742814","192.168.1.166","23.198.241.2","TLSv1.2","5708","Application Data"
"172","2.742878","192.168.1.166","23.198.241.2","TLSv1.2","253","Application Data"
"173","2.752572","23.198.241.2","192.168.1.166","TCP","54","443  >  58685 [ACK] Seq=161430 Ack=96862 Win=9770 Len=0"
"174","2.759427","192.168.1.166","23.198.241.2","TLSv1.2","5649","Application Data"
"175","2.759529","192.168.1.166","23.198.241.2","TLSv1.2","5649","Application Data"
"176","2.760448","23.198.241.2","192.168.1.166","TLSv1.2","317","Application Data"
"177","2.760448","23.198.241.2","192.168.1.166","TCP","4434","443  >  58685 [ACK] Seq=161693 Ack=96862 Win=9770 Len=4380 [TCP PDU reassembled in 178]"
"178","2.760448","23.198.241.2","192.168.1.166","TLSv1.2","1443","Application Data"
"179","2.760448","23.198.241.2","192.168.1.166","TLSv1.2","318","Application Data"
"180","2.760448","23.198.241.2","192.168.1.166","TCP","16114","443  >  58685 [ACK] Seq=167726 Ack=96862 Win=9770 Len=16060 [TCP PDU reassembled in 181]"
"181","2.760448","23.198.241.2","192.168.1.166","TLSv1.2","400","Application Data"
"182","2.760448","23.198.241.2","192.168.1.166","TLSv1.2","85","Application Data"
"183","2.760448","23.198.241.2","192.168.1.166","TCP","5894","443  >  58685 [ACK] Seq=184163 Ack=96862 Win=9770 Len=5840 [TCP PDU reassembled in 184]"
"184","2.760448","23.198.241.2","192.168.1.166","TLSv1.2","1445","Application Data"
"185","2.760448","23.198.241.2","192.168.1.166","TLSv1.2","16114","Application Data"
"186","2.760448","23.198.241.2","192.168.1.166","TLSv1.2","664","Application Data"
"187","2.760448","23.198.241.2","192.168.1.166","TLSv1.2","8814","Application Data"
"188","2.760448","23.198.241.2","192.168.1.166","TLSv1.2","1162","Application Data"
"189","2.760448","23.198.241.2","192.168.1.166","TLSv1.2","318","Application Data"
"190","2.760448","23.198.241.2","192.168.1.166","TLSv1.2","1477","Application Data"
"191","2.760448","23.198.241.2","192.168.1.166","TCP","16114","443  >  58685 [ACK] Seq=219619 Ack=96862 Win=9770 Len=16060 [TCP PDU reassembled in 192]"
"192","2.760448","23.198.241.2","192.168.1.166","TLSv1.2","400","Application Data"
"193","2.760448","23.198.241.2","192.168.1.166","TLSv1.2","85","Application Data"
"194","2.760448","23.198.241.2","192.168.1.166","TLSv1.2","647","Application Data"
"195","2.760533","192.168.1.166","23.198.241.2","TCP","54","58685  >  443 [ACK] Seq=124905 Ack=236649 Win=8191 Len=0"
"196","2.774396","192.168.1.166","23.198.241.2","TLSv1.2","5650","Application Data"
"197","2.780538","23.198.241.2","192.168.1.166","TLSv1.2","317","Application Data"
"198","2.780538","23.198.241.2","192.168.1.166","TLSv1.2","1466","Application Data"
"199","2.780538","23.198.241.2","192.168.1.166","TCP","1514","443  >  58685 [ACK] Seq=238324 Ack=96862 Win=9770 Len=1460 [TCP PDU reassembled in 201]"
"200","2.780538","23.198.241.2","192.168.1.166","TCP","1514","443  >  58685 [ACK] Seq=239784 Ack=96862 Win=9770 Len=1460 [TCP PDU reassembled in 201]"
"201","2.780538","23.198.241.2","192.168.1.166","TLSv1.2","714","Application Data"
"202","2.780587","192.168.1.166","23.198.241.2","TCP","54","58685  >  443 [ACK] Seq=130501 Ack=241904 Win=8191 Len=0"
"203","2.790457","23.198.241.2","192.168.1.166","TCP","54","443  >  58685 [ACK] Seq=241904 Ack=102255 Win=9770 Len=0"
"204","2.790457","23.198.241.2","192.168.1.166","TCP","54","443  >  58685 [ACK] Seq=241904 Ack=106635 Win=9747 Len=0"
"205","2.790457","23.198.241.2","192.168.1.166","TCP","54","443  >  58685 [ACK] Seq=241904 Ack=109322 Win=9755 Len=0"
"206","2.805769","23.198.241.2","192.168.1.166","TLSv1.2","424","Application Data"
"207","2.805769","23.198.241.2","192.168.1.166","TCP","1514","443  >  58685 [ACK] Seq=242274 Ack=124905 Win=9673 Len=1460 [TCP PDU reassembled in 208]"
"208","2.805769","23.198.241.2","192.168.1.166","TLSv1.2","1155","Application Data"
"209","2.805806","192.168.1.166","23.198.241.2","TCP","54","58685  >  443 [ACK] Seq=130501 Ack=244835 Win=8191 Len=0"
"210","2.806742","192.168.1.166","23.198.241.2","TLSv1.2","5528","Application Data"
"211","2.809216","23.198.241.2","192.168.1.166","TCP","54","443  >  58685 [ACK] Seq=244835 Ack=127825 Win=9754 Len=0"
"212","2.823019","23.198.241.2","192.168.1.166","TLSv1.2","376","Application Data"
"213","2.823019","23.198.241.2","192.168.1.166","TCP","1514","443  >  58685 [ACK] Seq=245157 Ack=130501 Win=9740 Len=1460 [TCP PDU reassembled in 214]"
"214","2.823019","23.198.241.2","192.168.1.166","TLSv1.2","331","Application Data"
"215","2.823041","192.168.1.166","23.198.241.2","TCP","54","58685  >  443 [ACK] Seq=135975 Ack=246894 Win=8191 Len=0"
"216","2.824539","192.168.1.166","23.198.241.2","TLSv1.2","5538","Application Data"
"217","2.833022","23.198.241.2","192.168.1.166","TCP","54","443  >  58685 [ACK] Seq=246894 Ack=135975 Win=9741 Len=0"
"218","2.840737","23.198.241.2","192.168.1.166","TLSv1.2","383","Application Data"
"219","2.840737","23.198.241.2","192.168.1.166","TCP","1514","443  >  58685 [ACK] Seq=247223 Ack=135975 Win=9741 Len=1460 [TCP PDU reassembled in 220]"
"220","2.840737","23.198.241.2","192.168.1.166","TLSv1.2","1269","Application Data"
"221","2.840737","23.198.241.2","192.168.1.166","TLSv1.2","377","Application Data"
"222","2.840737","23.198.241.2","192.168.1.166","TCP","16114","443  >  58685 [ACK] Seq=250221 Ack=135975 Win=9741 Len=16060 [TCP PDU reassembled in 223]"
"223","2.840737","23.198.241.2","192.168.1.166","TLSv1.2","400","Application Data"
"224","2.840737","23.198.241.2","192.168.1.166","TLSv1.2","85","Application Data"
"225","2.840737","23.198.241.2","192.168.1.166","TCP","8814","443  >  58685 [ACK] Seq=266658 Ack=135975 Win=9741 Len=8760 [TCP PDU reassembled in 226]"
"226","2.840737","23.198.241.2","192.168.1.166","TLSv1.2","201","Application Data"
"227","2.840737","23.198.241.2","192.168.1.166","TLSv1.2","964","Application Data, Application Data"
"228","2.840783","192.168.1.166","23.198.241.2","TCP","54","58685  >  443 [ACK] Seq=141459 Ack=276475 Win=8191 Len=0"
"229","2.842855","192.168.1.166","23.198.241.2","TLSv1.2","5538","Application Data"
"230","2.842941","192.168.1.166","23.198.241.2","TLSv1.2","5525","Application Data"
"231","2.843147","192.168.1.166","23.198.241.2","TLSv1.2","5525","Application Data"
"232","2.857916","23.198.241.2","192.168.1.166","TCP","54","443  >  58685 [ACK] Seq=276475 Ack=138895 Win=9754 Len=0"
"233","2.873512","23.198.241.2","192.168.1.166","TLSv1.2","383","Application Data"
"234","2.873512","23.198.241.2","192.168.1.166","TCP","1514","443  >  58685 [ACK] Seq=276804 Ack=141459 Win=9740 Len=1460 [TCP PDU reassembled in 235]"
"235","2.873512","23.198.241.2","192.168.1.166","TLSv1.2","1225","Application Data"
"236","2.873512","23.198.241.2","192.168.1.166","TCP","54","443  >  58685 [ACK] Seq=279435 Ack=145839 Win=9747 Len=0"
"237","2.873512","23.198.241.2","192.168.1.166","TLSv1.2","377","Application Data"
"238","2.873512","23.198.241.2","192.168.1.166","TCP","16114","443  >  58685 [ACK] Seq=279758 Ack=156794 Win=9689 Len=16060 [TCP PDU reassembled in 239]"
"239","2.873512","23.198.241.2","192.168.1.166","TLSv1.2","400","Application Data"
"240","2.873512","23.198.241.2","192.168.1.166","TLSv1.2","85","Application Data"
"241","2.873512","23.198.241.2","192.168.1.166","TCP","16114","443  >  58685 [ACK] Seq=296195 Ack=156794 Win=9689 Len=16060 [TCP PDU reassembled in 242]"
"242","2.873512","23.198.241.2","192.168.1.166","TLSv1.2","400","Application Data"
"243","2.873512","23.198.241.2","192.168.1.166","TLSv1.2","5894","Application Data"
"244","2.873512","23.198.241.2","192.168.1.166","TLSv1.2","1169","Application Data"
"245","2.873632","192.168.1.166","23.198.241.2","TCP","54","58685  >  443 [ACK] Seq=157885 Ack=279435 Win=8191 Len=0"
"246","2.873695","192.168.1.166","23.198.241.2","TCP","54","58685  >  443 [ACK] Seq=157885 Ack=319556 Win=8191 Len=0"
"247","2.876131","192.168.1.166","23.198.241.2","TLSv1.2","5518","Application Data"
"248","2.876840","192.168.1.166","23.198.241.2","TLSv1.2","5518","Application Data"
"249","2.882393","192.168.1.166","23.198.241.2","TLSv1.2","5543","Application Data"
"250","2.895706","23.198.241.2","192.168.1.166","TLSv1.2","493","Application Data"
"251","2.895706","23.198.241.2","192.168.1.166","TLSv1.2","174","Application Data"
"252","2.895706","23.198.241.2","192.168.1.166","TLSv1.2","376","Application Data"
"253","2.895706","23.198.241.2","192.168.1.166","TCP","1514","443  >  58685 [ACK] Seq=320437 Ack=157885 Win=9763 Len=1460 [TCP PDU reassembled in 264]"
"254","2.895706","23.198.241.2","192.168.1.166","TCP","1514","443  >  58685 [ACK] Seq=321897 Ack=157885 Win=9763 Len=1460 [TCP PDU reassembled in 264]"
"255","2.895706","23.198.241.2","192.168.1.166","TCP","1514","443  >  58685 [ACK] Seq=323357 Ack=157885 Win=9763 Len=1460 [TCP PDU reassembled in 264]"
"256","2.895706","23.198.241.2","192.168.1.166","TCP","1514","443  >  58685 [ACK] Seq=324817 Ack=157885 Win=9763 Len=1460 [TCP PDU reassembled in 264]"
"257","2.895706","23.198.241.2","192.168.1.166","TCP","1514","443  >  58685 [ACK] Seq=326277 Ack=157885 Win=9763 Len=1460 [TCP PDU reassembled in 264]"
"258","2.895706","23.198.241.2","192.168.1.166","TCP","1514","443  >  58685 [ACK] Seq=327737 Ack=157885 Win=9763 Len=1460 [TCP PDU reassembled in 264]"
"259","2.895706","23.198.241.2","192.168.1.166","TCP","1514","443  >  58685 [ACK] Seq=329197 Ack=157885 Win=9763 Len=1460 [TCP PDU reassembled in 264]"
"260","2.895706","23.198.241.2","192.168.1.166","TCP","1514","443  >  58685 [ACK] Seq=330657 Ack=157885 Win=9763 Len=1460 [TCP PDU reassembled in 264]"
"261","2.895706","23.198.241.2","192.168.1.166","TCP","1514","443  >  58685 [ACK] Seq=332117 Ack=157885 Win=9763 Len=1460 [TCP PDU reassembled in 264]"
"262","2.895706","23.198.241.2","192.168.1.166","TCP","1514","443  >  58685 [ACK] Seq=333577 Ack=157885 Win=9763 Len=1460 [TCP PDU reassembled in 264]"
"263","2.895706","23.198.241.2","192.168.1.166","TCP","1514","443  >  58685 [ACK] Seq=335037 Ack=157885 Win=9763 Len=1460 [TCP PDU reassembled in 264]"
"264","2.895706","23.198.241.2","192.168.1.166","TLSv1.2","400","Application Data"
"265","2.895706","23.198.241.2","192.168.1.166","TLSv1.2","85","Application Data"
"266","2.895706","23.198.241.2","192.168.1.166","TCP","1514","443  >  58685 [ACK] Seq=336874 Ack=157885 Win=9763 Len=1460 [TCP PDU reassembled in 270]"
"267","2.895706","23.198.241.2","192.168.1.166","TCP","1514","443  >  58685 [ACK] Seq=338334 Ack=157885 Win=9763 Len=1460 [TCP PDU reassembled in 270]"
"268","2.895706","23.198.241.2","192.168.1.166","TCP","1514","443  >  58685 [ACK] Seq=339794 Ack=157885 Win=9763 Len=1460 [TCP PDU reassembled in 270]"
"269","2.895706","23.198.241.2","192.168.1.166","TCP","1514","443  >  58685 [ACK] Seq=341254 Ack=157885 Win=9763 Len=1460 [TCP PDU reassembled in 270]"
"270","2.895706","23.198.241.2","192.168.1.166","TLSv1.2","974","Application Data"
"271","2.895785","192.168.1.166","23.198.241.2","TCP","54","58685  >  443 [ACK] Seq=174302 Ack=343634 Win=8191 Len=0"
"272","2.900254","192.168.1.166","23.198.241.2","TLSv1.2","5516","Application Data"
"273","2.901174","23.198.241.2","192.168.1.166","TLSv1.2","376","Application Data"
"274","2.901174","23.198.241.2","192.168.1.166","TCP","7354","443  >  58685 [ACK] Seq=343956 Ack=157885 Win=9770 Len=7300 [TCP PDU reassembled in 275]"
"275","2.901174","23.198.241.2","192.168.1.166","TLSv1.2","1067","Application Data"
"276","2.901174","23.198.241.2","192.168.1.166","TLSv1.2","376","Application Data"
"277","2.901174","23.198.241.2","192.168.1.166","TCP","8814","443  >  58685 [ACK] Seq=352591 Ack=157885 Win=9770 Len=8760 [TCP PDU reassembled in 278]"
"278","2.901174","23.198.241.2","192.168.1.166","TLSv1.2","1157","Application Data"
"279","2.901204","192.168.1.166","23.198.241.2","TCP","54","58685  >  443 [ACK] Seq=179764 Ack=362454 Win=8191 Len=0"
"280","2.902416","192.168.1.166","23.198.241.2","TLSv1.2","5516","Application Data"
"281","2.904267","23.198.241.2","192.168.1.166","TCP","54","443  >  58685 [ACK] Seq=362454 Ack=162265 Win=9770 Len=0"
"282","2.904267","23.198.241.2","192.168.1.166","TCP","54","443  >  58685 [ACK] Seq=362454 Ack=167729 Win=9741 Len=0"
"283","2.908366","192.168.1.166","23.198.241.2","TLSv1.2","5520","Application Data"
"284","2.918264","23.198.241.2","192.168.1.166","TLSv1.2","376","Application Data"
"285","2.918264","23.198.241.2","192.168.1.166","TCP","1514","443  >  58685 [ACK] Seq=362776 Ack=168813 Win=9763 Len=1460 [TCP PDU reassembled in 286]"
"286","2.918264","23.198.241.2","192.168.1.166","TLSv1.2","380","Application Data"
"287","2.918299","192.168.1.166","23.198.241.2","TCP","54","58685  >  443 [ACK] Seq=190692 Ack=364562 Win=8191 Len=0"
"288","2.919238","192.168.1.166","23.198.241.2","TLSv1.2","5520","Application Data"
"289","2.923917","192.168.1.166","23.198.241.2","TLSv1.2","5542","Application Data"
"290","2.924910","23.198.241.2","192.168.1.166","TCP","54","443  >  58685 [ACK] Seq=364562 Ack=174302 Win=9734 Len=0"
"291","2.925304","23.198.241.2","192.168.1.166","TCP","54","443  >  58685 [ACK] Seq=364562 Ack=179764 Win=9741 Len=0"
"292","2.933560","192.168.1.166","23.198.241.2","TLSv1.2","5539","Application Data"
"293","2.933603","192.168.1.166","23.198.241.2","TLSv1.2","538","Application Data"
"294","2.935193","23.198.241.2","192.168.1.166","TLSv1.2","358","Application Data"
"295","2.935193","23.198.241.2","192.168.1.166","TCP","1514","443  >  58685 [ACK] Seq=364866 Ack=185226 Win=9712 Len=1460 [TCP PDU reassembled in 296]"
"296","2.935193","23.198.241.2","192.168.1.166","TLSv1.2","779","Application Data"
"297","2.935193","23.198.241.2","192.168.1.166","TCP","54","443  >  58685 [ACK] Seq=367051 Ack=189606 Win=9747 Len=0"
"298","2.935237","192.168.1.166","23.198.241.2","TCP","54","58685  >  443 [ACK] Seq=207615 Ack=367051 Win=8191 Len=0"
"299","2.953303","23.198.241.2","192.168.1.166","TLSv1.2","363","Application Data"
"300","2.953303","23.198.241.2","192.168.1.166","TLSv1.2","820","Application Data"
"301","2.953303","23.198.241.2","192.168.1.166","TLSv1.2","365","Application Data"
"302","2.953303","23.198.241.2","192.168.1.166","TLSv1.2","711","Application Data"
"303","2.953351","192.168.1.166","23.198.241.2","TCP","54","58685  >  443 [ACK] Seq=207615 Ack=369094 Win=8191 Len=0"
"304","2.954842","192.168.1.166","23.198.241.2","TLSv1.2","5520","Application Data"
"305","2.959654","192.168.1.166","23.198.241.2","TLSv1.2","5736","Application Data"
"306","2.960993","192.168.1.166","23.198.241.2","TLSv1.2","5736","Application Data"
"307","2.964176","23.198.241.2","192.168.1.166","TCP","54","443  >  58685 [ACK] Seq=369094 Ack=196158 Win=9741 Len=0"
"308","2.964784","192.168.1.166","23.198.241.2","TLSv1.2","5549","Application Data"
"309","2.964820","192.168.1.166","23.198.241.2","TLSv1.2","339","Application Data"
"310","2.966502","192.168.1.166","23.198.241.2","TLSv1.2","5736","Application Data"
"311","2.968063","23.198.241.2","192.168.1.166","TLSv1.2","382","Application Data"
"312","2.968063","23.198.241.2","192.168.1.166","TCP","1514","443  >  58685 [ACK] Seq=369422 Ack=207615 Win=9679 Len=1460 [TCP PDU reassembled in 313]"
"313","2.968063","23.198.241.2","192.168.1.166","TLSv1.2","1241","Application Data"
"314","2.968063","23.198.241.2","192.168.1.166","TLSv1.2","383","Application Data"
"315","2.968063","23.198.241.2","192.168.1.166","TCP","16114","443  >  58685 [ACK] Seq=372398 Ack=207615 Win=9679 Len=16060 [TCP PDU reassembled in 316]"
"316","2.968063","23.198.241.2","192.168.1.166","TLSv1.2","400","Application Data"
"317","2.968063","23.198.241.2","192.168.1.166","TLSv1.2","1514","Application Data"
"318","2.968063","23.198.241.2","192.168.1.166","TLSv1.2","225","Application Data"
"319","2.968104","192.168.1.166","23.198.241.2","TCP","54","58685  >  443 [ACK] Seq=235907 Ack=390435 Win=8191 Len=0"
"320","2.983044","192.168.1.166","23.198.241.2","TLSv1.2","5565","Application Data"
"321","2.983147","192.168.1.166","23.198.241.2","TLSv1.2","5567","Application Data"
"322","2.983173","192.168.1.166","23.198.241.2","TLSv1.2","781","Application Data"
"323","2.983188","192.168.1.166","23.198.241.2","TLSv1.2","865","Application Data"
"324","2.983738","23.198.241.2","192.168.1.166","TLSv1.2","358","Application Data"
"325","2.983738","23.198.241.2","192.168.1.166","TLSv1.2","538","Application Data"
"326","2.983738","23.198.241.2","192.168.1.166","TLSv1.2","2974","Application Data"
"327","2.983738","23.198.241.2","192.168.1.166","TLSv1.2","61","Application Data"
"328","2.983769","192.168.1.166","23.198.241.2","TCP","54","58685  >  443 [ACK] Seq=248469 Ack=394150 Win=8191 Len=0"
"329","2.985814","192.168.1.166","23.198.241.2","TLSv1.2","5543","Application Data"
"330","2.993173","23.198.241.2","192.168.1.166","TCP","54","443  >  58685 [ACK] Seq=394150 Ack=220223 Win=9711 Len=0"
"331","2.994569","23.198.241.2","192.168.1.166","TCP","54","443  >  58685 [ACK] Seq=394150 Ack=223143 Win=9754 Len=0"
"332","3.010721","23.198.241.2","192.168.1.166","TCP","54","443  >  58685 [ACK] Seq=394150 Ack=235907 Win=9686 Len=0"
"333","3.010721","23.198.241.2","192.168.1.166","TCP","54","443  >  58685 [ACK] Seq=394150 Ack=241418 Win=9740 Len=0"
"334","3.025737","23.198.241.2","192.168.1.166","TLSv1.2","384","Application Data"
"335","3.025737","23.198.241.2","192.168.1.166","TCP","16114","443  >  58685 [ACK] Seq=394480 Ack=253958 Win=9673 Len=16060 [TCP PDU reassembled in 336]"
"336","3.025737","23.198.241.2","192.168.1.166","TLSv1.2","400","Application Data"
"337","3.025737","23.198.241.2","192.168.1.166","TLSv1.2","85","Application Data"
"338","3.025737","23.198.241.2","192.168.1.166","TCP","16114","443  >  58685 [ACK] Seq=410917 Ack=253958 Win=9673 Len=16060 [TCP PDU reassembled in 339]"
"339","3.025737","23.198.241.2","192.168.1.166","TLSv1.2","400","Application Data"
"340","3.025737","23.198.241.2","192.168.1.166","TLSv1.2","7354","Application Data"
"341","3.025737","23.198.241.2","192.168.1.166","TLSv1.2","1275","Application Data"
"342","3.025828","192.168.1.166","23.198.241.2","TCP","54","58685  >  443 [ACK] Seq=253958 Ack=435844 Win=8191 Len=0"
"343","3.040304","23.198.241.2","192.168.1.166","TLSv1.2","370","Application Data"
"344","3.040304","23.198.241.2","192.168.1.166","TLSv1.2","105","Application Data"
"345","3.040304","23.198.241.2","192.168.1.166","TLSv1.2","473","Application Data"
"346","3.040304","23.198.241.2","192.168.1.166","TLSv1.2","116","Application Data"
"347","3.040332","192.168.1.166","23.198.241.2","TCP","54","58685  >  443 [ACK] Seq=253958 Ack=436692 Win=8188 Len=0"
"348","3.092034","23.198.241.2","192.168.1.166","TLSv1.2","494","Application Data"
"349","3.092034","23.198.241.2","192.168.1.166","TLSv1.2","1508","Application Data"
"350","3.092034","23.198.241.2","192.168.1.166","TCP","1514","443  >  58685 [ACK] Seq=438586 Ack=253958 Win=9770 Len=1460 [TCP PDU reassembled in 356]"
"351","3.092034","23.198.241.2","192.168.1.166","TCP","1514","443  >  58685 [ACK] Seq=440046 Ack=253958 Win=9770 Len=1460 [TCP PDU reassembled in 356]"
"352","3.092034","23.198.241.2","192.168.1.166","TCP","1514","443  >  58685 [ACK] Seq=441506 Ack=253958 Win=9770 Len=1460 [TCP PDU reassembled in 356]"
"353","3.092034","23.198.241.2","192.168.1.166","TCP","1514","443  >  58685 [ACK] Seq=442966 Ack=253958 Win=9770 Len=1460 [TCP PDU reassembled in 356]"
"354","3.092034","23.198.241.2","192.168.1.166","TCP","1514","443  >  58685 [ACK] Seq=444426 Ack=253958 Win=9770 Len=1460 [TCP PDU reassembled in 356]"
"355","3.092034","23.198.241.2","192.168.1.166","TCP","1514","443  >  58685 [ACK] Seq=445886 Ack=253958 Win=9770 Len=1460 [TCP PDU reassembled in 356]"
"356","3.092034","23.198.241.2","192.168.1.166","TLSv1.2","255","Application Data"
"357","3.092034","23.198.241.2","192.168.1.166","TLSv1.2","574","Application Data"
"358","3.092034","23.198.241.2","192.168.1.166","TLSv1.2","943","Application Data"
"359","3.092034","23.198.241.2","192.168.1.166","TLSv1.2","531","Application Data"
"360","3.092034","23.198.241.2","192.168.1.166","TLSv1.2","708","Application Data"
"361","3.092083","192.168.1.166","23.198.241.2","TCP","54","58685  >  443 [ACK] Seq=253958 Ack=450087 Win=8191 Len=0"
"362","3.093991","23.198.241.2","192.168.1.166","TLSv1.2","574","Application Data"
"363","3.093991","23.198.241.2","192.168.1.166","TLSv1.2","752","Application Data"
"364","3.094013","192.168.1.166","23.198.241.2","TCP","54","58685  >  443 [ACK] Seq=253958 Ack=451305 Win=8187 Len=0"
"365","3.094293","192.168.1.166","23.198.241.2","TLSv1.2","5520","Application Data"
"366","3.094357","192.168.1.166","23.198.241.2","TLSv1.2","5519","Application Data"
"367","3.094676","192.168.1.166","23.198.241.2","TLSv1.2","5520","Application Data"
"368","3.095081","192.168.1.166","23.198.241.2","TLSv1.2","5520","Application Data"
"369","3.100879","23.198.241.2","192.168.1.166","TLSv1.2","574","Application Data"
"370","3.100879","23.198.241.2","192.168.1.166","TLSv1.2","943","Application Data"
"371","3.100901","192.168.1.166","23.198.241.2","TCP","54","58685  >  443 [ACK] Seq=275821 Ack=452714 Win=8191 Len=0"
"372","3.101641","192.168.1.166","23.198.241.2","TLSv1.2","5528","Application Data"
"373","3.121948","23.198.241.2","192.168.1.166","TLSv1.2","531","Application Data"
"374","3.121948","23.198.241.2","192.168.1.166","TLSv1.2","723","Application Data"
"375","3.121993","192.168.1.166","23.198.241.2","TCP","54","58685  >  443 [ACK] Seq=281295 Ack=453860 Win=8187 Len=0"
"376","3.123187","192.168.1.166","23.198.241.2","TLSv1.2","5528","Application Data"
"377","3.130831","23.198.241.2","192.168.1.166","TCP","54","443  >  58685 [ACK] Seq=453860 Ack=269269 Win=9697 Len=0"
"378","3.132305","23.198.241.2","192.168.1.166","TCP","54","443  >  58685 [ACK] Seq=453860 Ack=273275 Win=9748 Len=0"
