"No.","Time","Source","Destination","Protocol","Length","Info"
"1","0.000000","192.168.1.166","23.198.241.2","TLSv1.2","5987","Application Data"
"2","0.028186","23.198.241.2","192.168.1.166","TCP","54","443  >  58685 [ACK] Seq=1 Ack=5934 Win=14788 Len=0"
"3","0.077096","23.198.241.2","192.168.1.166","TLSv1.2","429","Application Data"
"4","0.077096","23.198.241.2","192.168.1.166","TLSv1.2","1192","Application Data"
"5","0.077120","192.168.1.166","23.198.241.2","TCP","54","58685  >  443 [ACK] Seq=5934 Ack=1514 Win=8191 Len=0"
"6","0.077787","192.168.1.166","23.198.241.2","TLSv1.2","89","Application Data"
"7","0.083030","192.168.1.166","23.198.241.2","TLSv1.2","5925","Application Data"
"8","0.110255","23.198.241.2","192.168.1.166","TCP","54","443  >  58685 [ACK] Seq=1514 Ack=8889 Win=14805 Len=0"
"9","0.110255","23.198.241.2","192.168.1.166","TCP","54","443  >  58685 [ACK] Seq=1514 Ack=11840 Win=14815 Len=0"
"10","0.168917","23.198.241.2","192.168.1.166","TLSv1.2","429","Application Data"
"11","0.168917","23.198.241.2","192.168.1.166","TLSv1.2","1288","Application Data"
"12","0.168953","192.168.1.166","23.198.241.2","TCP","54","58685  >  443 [ACK] Seq=11840 Ack=3123 Win=8191 Len=0"
"13","0.172050","192.168.1.166","23.198.241.2","TLSv1.2","5988","Application Data"
"14","0.179691","192.168.1.166","23.198.241.2","TLSv1.2","562","Application Data"
"15","0.179741","192.168.1.166","23.198.241.2","TLSv1.2","167","Application Data"
"16","0.179760","192.168.1.166","23.198.241.2","TLSv1.2","182","Application Data"
"17","0.179776","192.168.1.166","23.198.241.2","TLSv1.2","167","Application Data"
"18","0.179814","192.168.1.166","23.198.241.2","TLSv1.2","169","Application Data"
"19","0.180022","192.168.1.166","23.198.241.2","TLSv1.2","90","Application Data"
"20","0.180049","192.168.1.166","23.198.241.2","TLSv1.2","90","Application Data"
"21","0.180081","192.168.1.166","23.198.241.2","TLSv1.2","90","Application Data"
"22","0.180092","192.168.1.166","23.198.241.2","TLSv1.2","90","Application Data"
"23","0.180104","192.168.1.166","23.198.241.2","TLSv1.2","90","Application Data"
"24","0.180114","192.168.1.166","23.198.241.2","TLSv1.2","90","Application Data"
"25","0.210168","192.168.1.166","23.198.241.2","TLSv1.2","5884","Application Data"
"26","0.210196","23.198.241.2","192.168.1.166","TCP","54","443  >  58685 [ACK] Seq=3123 Ack=16220 Win=14815 Len=0"
"27","0.210196","23.198.241.2","192.168.1.166","TCP","54","443  >  58685 [ACK] Seq=3123 Ack=18282 Win=14803 Len=0"
"28","0.210196","23.198.241.2","192.168.1.166","TCP","54","443  >  58685 [ACK] Seq=3123 Ack=18523 Win=14815 Len=0"
"29","0.219666","23.198.241.2","192.168.1.166","TLSv1.2","334","Application Data"
"30","0.219666","23.198.241.2","192.168.1.166","TLSv1.2","713","Application Data"
"31","0.220719","192.168.1.166","23.198.241.2","TCP","54","58685  >  443 [ACK] Seq=24797 Ack=4062 Win=8188 Len=0"
"32","0.234064","23.198.241.2","192.168.1.166","TLSv1.2","333","Application Data"
"33","0.234064","23.198.241.2","192.168.1.166","TLSv1.2","1008","Application Data"
"34","0.234064","23.198.241.2","192.168.1.166","TLSv1.2","333","Application Data"
"35","0.234064","23.198.241.2","192.168.1.166","TLSv1.2","973","Application Data"
"36","0.234064","23.198.241.2","192.168.1.166","TLSv1.2","334","Application Data"
"37","0.234064","23.198.241.2","192.168.1.166","TLSv1.2","1065","Application Data"
"38","0.234064","23.198.241.2","192.168.1.166","TLSv1.2","333","Application Data"
"39","0.234064","23.198.241.2","192.168.1.166","TLSv1.2","1062","Application Data"
"40","0.234093","192.168.1.166","23.198.241.2","TCP","54","58685  >  443 [ACK] Seq=24797 Ack=9071 Win=8191 Len=0"
"41","0.236980","23.198.241.2","192.168.1.166","TCP","54","443  >  58685 [ACK] Seq=9071 Ack=21887 Win=14815 Len=0"
"42","0.236980","23.198.241.2","192.168.1.166","TCP","54","443  >  58685 [ACK] Seq=9071 Ack=24797 Win=14815 Len=0"
"43","0.260026","23.198.241.2","192.168.1.166","TLSv1.2","356","Application Data"
"44","0.260026","23.198.241.2","192.168.1.166","TLSv1.2","349","Application Data"
"45","0.260026","23.198.241.2","192.168.1.166","TLSv1.2","429","Application Data"
"46","0.260026","23.198.241.2","192.168.1.166","TLSv1.2","1181","Application Data"
"47","0.260059","192.168.1.166","23.198.241.2","TCP","54","58685  >  443 [ACK] Seq=24797 Ack=11170 Win=8191 Len=0"
"48","0.266649","192.168.1.166","23.198.241.2","TLSv1.2","5940","Application Data"
"49","0.293108","23.198.241.2","192.168.1.166","TCP","54","443  >  58685 [ACK] Seq=11170 Ack=29177 Win=14815 Len=0"
"50","0.293108","23.198.241.2","192.168.1.166","TCP","54","443  >  58685 [ACK] Seq=11170 Ack=30683 Win=14815 Len=0"
"51","0.341669","23.198.241.2","192.168.1.166","TLSv1.2","429","Application Data"
"52","0.341669","23.198.241.2","192.168.1.166","TLSv1.2","1040","Application Data"
"53","0.341695","192.168.1.166","23.198.241.2","TCP","54","58685  >  443 [ACK] Seq=30683 Ack=12531 Win=8186 Len=0"
"54","0.344520","192.168.1.166","23.198.241.2","TLSv1.2","5987","Application Data"
"55","0.347048","192.168.1.166","23.198.241.2","TLSv1.2","548","Application Data"
"56","0.347085","192.168.1.166","23.198.241.2","TLSv1.2","167","Application Data"
"57","0.347103","192.168.1.166","23.198.241.2","TLSv1.2","167","Application Data"
"58","0.347118","192.168.1.166","23.198.241.2","TLSv1.2","167","Application Data"
"59","0.347154","192.168.1.166","23.198.241.2","TLSv1.2","167","Application Data"
"60","0.371521","23.198.241.2","192.168.1.166","TCP","54","443  >  58685 [ACK] Seq=12531 Ack=36523 Win=14815 Len=0"
"61","0.378445","192.168.1.166","23.198.241.2","TLSv1.2","5884","Application Data"
"62","0.390677","23.198.241.2","192.168.1.166","TCP","54","443  >  58685 [ACK] Seq=12531 Ack=37562 Win=14815 Len=0"
"63","0.399432","23.198.241.2","192.168.1.166","TLSv1.2","345","Application Data"
"64","0.399432","23.198.241.2","192.168.1.166","TLSv1.2","618","Application Data"
"65","0.399432","23.198.241.2","192.168.1.166","TLSv1.2","346","Application Data"
"66","0.399432","23.198.241.2","192.168.1.166","TLSv1.2","503","Application Data"
"67","0.399432","23.198.241.2","192.168.1.166","TLSv1.2","334","Application Data"
"68","0.399432","23.198.241.2","192.168.1.166","TLSv1.2","770","Application Data"
"69","0.399432","23.198.241.2","192.168.1.166","TLSv1.2","346","Application Data"
"70","0.399432","23.198.241.2","192.168.1.166","TLSv1.2","716","Application Data"
"71","0.399432","23.198.241.2","192.168.1.166","TLSv1.2","335","Application Data"
"72","0.399432","23.198.241.2","192.168.1.166","TLSv1.2","481","Application Data"
"73","0.399470","192.168.1.166","23.198.241.2","TCP","54","58685  >  443 [ACK] Seq=43392 Ack=16785 Win=8191 Len=0"
"74","0.403678","23.198.241.2","192.168.1.166","TCP","54","443  >  58685 [ACK] Seq=16785 Ack=41942 Win=14815 Len=0"
"75","0.436494","23.198.241.2","192.168.1.166","TLSv1.2","429","Application Data"
"76","0.436494","23.198.241.2","192.168.1.166","TLSv1.2","1174","Application Data"
"77","0.436530","192.168.1.166","23.198.241.2","TCP","54","58685  >  443 [ACK] Seq=43392 Ack=18280 Win=8191 Len=0"
"78","0.439770","192.168.1.166","23.198.241.2","TLSv1.2","5988","Application Data"
"79","0.441400","23.198.241.2","192.168.1.166","TLSv1.2","356","Application Data"
"80","0.441400","23.198.241.2","192.168.1.166","TLSv1.2","350","Application Data"
"81","0.441419","192.168.1.166","23.198.241.2","TCP","54","58685  >  443 [ACK] Seq=49326 Ack=18878 Win=8189 Len=0"
"82","0.464876","23.198.241.2","192.168.1.166","TCP","54","443  >  58685 [ACK] Seq=18878 Ack=46312 Win=14815 Len=0"
"83","0.464876","23.198.241.2","192.168.1.166","TCP","54","443  >  58685 [ACK] Seq=18878 Ack=49232 Win=14815 Len=0"
"84","0.506156","23.198.241.2","192.168.1.166","TCP","54","443  >  58685 [ACK] Seq=18878 Ack=49326 Win=14815 Len=0"
"85","0.536170","23.198.241.2","192.168.1.166","TLSv1.2","429","Application Data"
"86","0.536170","23.198.241.2","192.168.1.166","TLSv1.2","1055","Application Data"
"87","0.536193","192.168.1.166","23.198.241.2","TCP","54","58685  >  443 [ACK] Seq=49326 Ack=20254 Win=8191 Len=0"
"88","0.539190","192.168.1.166","23.198.241.2","TLSv1.2","5939","Application Data"
"89","0.578425","23.198.241.2","192.168.1.166","TCP","54","443  >  58685 [ACK] Seq=20254 Ack=55211 Win=14788 Len=0"
"90","0.644374","23.198.241.2","192.168.1.166","TLSv1.2","429","Application Data"
"91","0.644374","23.198.241.2","192.168.1.166","TLSv1.2","1032","Application Data"
"92","0.644391","192.168.1.166","23.198.241.2","TCP","54","58685  >  443 [ACK] Seq=55211 Ack=21607 Win=8186 Len=0"
"93","0.647052","192.168.1.166","23.198.241.2","TLSv1.2","5990","Application Data"
"94","0.648976","192.168.1.166","23.198.241.2","TLSv1.2","547","Application Data"
"95","0.649010","192.168.1.166","23.198.241.2","TLSv1.2","167","Application Data"
"96","0.649028","192.168.1.166","23.198.241.2","TLSv1.2","167","Application Data"
"97","0.649043","192.168.1.166","23.198.241.2","TLSv1.2","167","Application Data"
"98","0.649079","192.168.1.166","23.198.241.2","TLSv1.2","167","Application Data"
"99","0.674734","23.198.241.2","192.168.1.166","TCP","54","443  >  58685 [ACK] Seq=21607 Ack=58131 Win=14815 Len=0"
"100","0.674734","23.198.241.2","192.168.1.166","TCP","54","443  >  58685 [ACK] Seq=21607 Ack=61147 Win=14815 Len=0"
"101","0.679284","192.168.1.166","23.198.241.2","TLSv1.2","5881","Application Data"
"102","0.702731","23.198.241.2","192.168.1.166","TCP","54","443  >  58685 [ACK] Seq=21607 Ack=62092 Win=14815 Len=0"
"103","0.712551","23.198.241.2","192.168.1.166","TLSv1.2","334","Application Data"
"104","0.712551","23.198.241.2","192.168.1.166","TLSv1.2","555","Application Data"
"105","0.712573","192.168.1.166","23.198.241.2","TCP","54","58685  >  443 [ACK] Seq=67919 Ack=22388 Win=8191 Len=0"
"106","0.730528","23.198.241.2","192.168.1.166","TLSv1.2","334","Application Data"
"107","0.730528","23.198.241.2","192.168.1.166","TLSv1.2","507","Application Data"
"108","0.730528","23.198.241.2","192.168.1.166","TLSv1.2","346","Application Data"
"109","0.730528","23.198.241.2","192.168.1.166","TLSv1.2","539","Application Data"
"110","0.730528","23.198.241.2","192.168.1.166","TLSv1.2","347","Application Data"
"111","0.730528","23.198.241.2","192.168.1.166","TLSv1.2","443","Application Data"
"112","0.730528","23.198.241.2","192.168.1.166","TLSv1.2","334","Application Data"
"113","0.730528","23.198.241.2","192.168.1.166","TLSv1.2","501","Application Data"
"114","0.730570","192.168.1.166","23.198.241.2","TCP","54","58685  >  443 [ACK] Seq=67919 Ack=25307 Win=8191 Len=0"
"115","0.734066","23.198.241.2","192.168.1.166","TLSv1.2","355","Application Data"
"116","0.734066","23.198.241.2","192.168.1.166","TLSv1.2","357","Application Data"
"117","0.734082","192.168.1.166","23.198.241.2","TCP","54","58685  >  443 [ACK] Seq=67919 Ack=25911 Win=8189 Len=0"
"118","0.737727","23.198.241.2","192.168.1.166","TLSv1.2","429","Application Data"
"119","0.737727","23.198.241.2","192.168.1.166","TLSv1.2","1054","Application Data"
"120","0.737750","192.168.1.166","23.198.241.2","TCP","54","58685  >  443 [ACK] Seq=67919 Ack=27286 Win=8191 Len=0"
"121","0.744061","192.168.1.166","23.198.241.2","TLSv1.2","5990","Application Data"
"122","0.776362","23.198.241.2","192.168.1.166","TCP","54","443  >  58685 [ACK] Seq=27286 Ack=73855 Win=14815 Len=0"
"123","0.834645","23.198.241.2","192.168.1.166","TLSv1.2","429","Application Data"
"124","0.834645","23.198.241.2","192.168.1.166","TLSv1.2","1054","Application Data"
"125","0.834667","192.168.1.166","23.198.241.2","TCP","54","58685  >  443 [ACK] Seq=73855 Ack=28661 Win=8186 Len=0"
"126","0.994972","192.168.1.166","23.198.241.2","TLSv1.2","6253","Application Data"
"127","1.039156","23.198.241.2","192.168.1.166","TCP","54","443  >  58685 [ACK] Seq=28661 Ack=80054 Win=14787 Len=0"
"128","2.489141","23.198.241.2","192.168.1.166","TCP","1514","443  >  58685 [ACK] Seq=28661 Ack=80054 Win=14815 Len=1460 [TCP PDU reassembled in 129]"
"129","2.489141","23.198.241.2","192.168.1.166","TLSv1.2","548","Application Data"
"130","2.489141","23.198.241.2","192.168.1.166","TCP","1514","443  >  58685 [ACK] Seq=30615 Ack=80054 Win=14815 Len=1460 [TCP PDU reassembled in 141]"
"131","2.489141","23.198.241.2","192.168.1.166","TCP","1514","443  >  58685 [ACK] Seq=32075 Ack=80054 Win=14815 Len=1460 [TCP PDU reassembled in 141]"
"132","2.489141","23.198.241.2","192.168.1.166","TCP","1514","443  >  58685 [ACK] Seq=33535 Ack=80054 Win=14815 Len=1460 [TCP PDU reassembled in 141]"
"133","2.489141","23.198.241.2","192.168.1.166","TCP","1514","443  >  58685 [ACK] Seq=34995 Ack=80054 Win=14815 Len=1460 [TCP PDU reassembled in 141]"
"134","2.489141","23.198.241.2","192.168.1.166","TCP","1514","443  >  58685 [ACK] Seq=36455 Ack=80054 Win=14815 Len=1460 [TCP PDU reassembled in 141]"
"135","2.489141","23.198.241.2","192.168.1.166","TCP","1514","443  >  58685 [ACK] Seq=37915 Ack=80054 Win=14815 Len=1460 [TCP PDU reassembled in 141]"
"136","2.489141","23.198.241.2","192.168.1.166","TCP","1514","443  >  58685 [ACK] Seq=39375 Ack=80054 Win=14815 Len=1460 [TCP PDU reassembled in 141]"
"137","2.489141","23.198.241.2","192.168.1.166","TCP","1514","443  >  58685 [ACK] Seq=40835 Ack=80054 Win=14815 Len=1460 [TCP PDU reassembled in 141]"
"138","2.489141","23.198.241.2","192.168.1.166","TCP","1514","443  >  58685 [ACK] Seq=42295 Ack=80054 Win=14815 Len=1460 [TCP PDU reassembled in 141]"
"139","2.489141","23.198.241.2","192.168.1.166","TCP","1514","443  >  58685 [ACK] Seq=43755 Ack=80054 Win=14815 Len=1460 [TCP PDU reassembled in 141]"
"140","2.489141","23.198.241.2","192.168.1.166","TCP","1514","443  >  58685 [ACK] Seq=45215 Ack=80054 Win=14815 Len=1460 [TCP PDU reassembled in 141]"
"141","2.489141","23.198.241.2","192.168.1.166","TLSv1.2","400","Application Data"
"142","2.489141","23.198.241.2","192.168.1.166","TLSv1.2","1514","Application Data"
"143","2.489141","23.198.241.2","192.168.1.166","TCP","1514","443  >  58685 [ACK] Seq=48481 Ack=80054 Win=14815 Len=1460 [TCP PDU reassembled in 153]"
"144","2.489141","23.198.241.2","192.168.1.166","TCP","1514","443  >  58685 [ACK] Seq=49941 Ack=80054 Win=14815 Len=1460 [TCP PDU reassembled in 153]"
"145","2.489141","23.198.241.2","192.168.1.166","TCP","1514","443  >  58685 [ACK] Seq=51401 Ack=80054 Win=14815 Len=1460 [TCP PDU reassembled in 153]"
"146","2.489141","23.198.241.2","192.168.1.166","TCP","1514","443  >  58685 [ACK] Seq=52861 Ack=80054 Win=14815 Len=1460 [TCP PDU reassembled in 153]"
"147","2.489141","23.198.241.2","192.168.1.166","TCP","1514","443  >  58685 [ACK] Seq=54321 Ack=80054 Win=14815 Len=1460 [TCP PDU reassembled in 153]"
"148","2.489141","23.198.241.2","192.168.1.166","TCP","1514","443  >  58685 [ACK] Seq=55781 Ack=80054 Win=14815 Len=1460 [TCP PDU reassembled in 153]"
"149","2.489141","23.198.241.2","192.168.1.166","TCP","1514","443  >  58685 [ACK] Seq=57241 Ack=80054 Win=14815 Len=1460 [TCP PDU reassembled in 153]"
"150","2.489141","23.198.241.2","192.168.1.166","TCP","1514","443  >  58685 [ACK] Seq=58701 Ack=80054 Win=14815 Len=1460 [TCP PDU reassembled in 153]"
"151","2.489141","23.198.241.2","192.168.1.166","TCP","1514","443  >  58685 [ACK] Seq=60161 Ack=80054 Win=14815 Len=1460 [TCP PDU reassembled in 153]"
"152","2.489141","23.198.241.2","192.168.1.166","TCP","1514","443  >  58685 [ACK] Seq=61621 Ack=80054 Win=14815 Len=1460 [TCP PDU reassembled in 153]"
"153","2.489141","23.198.241.2","192.168.1.166","TLSv1.2","431","Application Data"
"154","2.489141","23.198.241.2","192.168.1.166","TLSv1.2","7354","Application Data"
"155","2.489141","23.198.241.2","192.168.1.166","TLSv1.2","1269","Application Data"
"156","2.489141","23.198.241.2","192.168.1.166","TCP","2974","443  >  58685 [ACK] Seq=71973 Ack=80054 Win=14815 Len=2920 [TCP PDU reassembled in 157]"
"157","2.489141","23.198.241.2","192.168.1.166","TLSv1.2","259","Application Data"
"158","2.489288","192.168.1.166","23.198.241.2","TCP","54","58685  >  443 [ACK] Seq=80054 Ack=75098 Win=8191 Len=0"
"159","2.490104","23.198.241.2","192.168.1.166","TCP","16114","443  >  58685 [ACK] Seq=75098 Ack=80054 Win=14815 Len=16060 [TCP PDU reassembled in 160]"
"160","2.490104","23.198.241.2","192.168.1.166","TLSv1.2","400","Application Data"
"161","2.490104","23.198.241.2","192.168.1.166","TLSv1.2","85","Application Data"
"162","2.490104","23.198.241.2","192.168.1.166","TCP","8814","443  >  58685 [ACK] Seq=91535 Ack=80054 Win=14815 Len=8760 [TCP PDU reassembled in 163]"
"163","2.490104","23.198.241.2","192.168.1.166","TLSv1.2","246","Application Data"
"164","2.490126","192.168.1.166","23.198.241.2","TCP","54","58685  >  443 [ACK] Seq=80054 Ack=100487 Win=8191 Len=0"
"165","2.494288","23.198.241.2","192.168.1.166","TCP","16114","443  >  58685 [ACK] Seq=100487 Ack=80054 Win=14815 Len=16060 [TCP PDU reassembled in 166]"
"166","2.494288","23.198.241.2","192.168.1.166","TLSv1.2","400","Application Data"
"167","2.494288","23.198.241.2","192.168.1.166","TLSv1.2","85","Application Data"
"168","2.494288","23.198.241.2","192.168.1.166","TCP","8814","443  >  58685 [ACK] Seq=116924 Ack=80054 Win=14815 Len=8760 [TCP PDU reassembled in 169]"
"169","2.494288","23.198.241.2","192.168.1.166","TLSv1.2","61","Application Data"
"170","2.494322","192.168.1.166","23.198.241.2","TCP","54","58685  >  443 [ACK] Seq=80054 Ack=125691 Win=8191 Len=0"
"171","2.496387","192.168.1.166","23.198.241.2","TLSv1.2","6322","Application Data"
"172","2.496421","192.168.1.166","23.198.241.2","TLSv1.2","1711","Application Data"
"173","2.501101","23.198.241.2","192.168.1.166","TCP","16114","443  >  58685 [ACK] Seq=125691 Ack=80054 Win=14815 Len=16060 [TCP PDU reassembled in 174]"
"174","2.501101","23.198.241.2","192.168.1.166","TLSv1.2","400","Application Data"
"175","2.501101","23.198.241.2","192.168.1.166","TLSv1.2","85","Application Data"
"176","2.501101","23.198.241.2","192.168.1.166","TCP","10274","443  >  58685 [ACK] Seq=142128 Ack=80054 Win=14815 Len=10220 [TCP PDU reassembled in 177]"
"177","2.501101","23.198.241.2","192.168.1.166","TLSv1.2","1161","Application Data"
"178","2.501101","23.198.241.2","192.168.1.166","TCP","4434","443  >  58685 [ACK] Seq=153455 Ack=80054 Win=14815 Len=4380 [TCP PDU reassembled in 179]"
"179","2.501101","23.198.241.2","192.168.1.166","TLSv1.2","790","Application Data"
"180","2.501101","23.198.241.2","192.168.1.166","TLSv1.2","93","Application Data"
"181","2.501101","23.198.241.2","192.168.1.166","TLSv1.2","85","Application Data"
"182","2.501164","192.168.1.166","23.198.241.2","TCP","54","58685  >  443 [ACK] Seq=87979 Ack=158641 Win=8191 Len=0"
"183","2.530318","192.168.1.166","23.198.241.2","TLSv1.2","552","Application Data"
"184","2.530357","192.168.1.166","23.198.241.2","TLSv1.2","168","Application Data"
"185","2.541587","23.198.241.2","192.168.1.166","TCP","54","443  >  58685 [ACK] Seq=158641 Ack=87979 Win=14784 Len=0"
"186","2.575588","23.198.241.2","192.168.1.166","TCP","54","443  >  58685 [ACK] Seq=158641 Ack=88591 Win=14815 Len=0"
"187","2.603422","23.198.241.2","192.168.1.166","TLSv1.2","333","Application Data"
"188","2.603422","23.198.241.2","192.168.1.166","TLSv1.2","587","Application Data"
"189","2.603422","23.198.241.2","192.168.1.166","TLSv1.2","1148","Application Data, Application Data"
"190","2.603442","192.168.1.166","23.198.241.2","TCP","54","58685  >  443 [ACK] Seq=88591 Ack=160547 Win=8191 Len=0"
"191","2.604478","192.168.1.166","23.198.241.2","TLSv1.2","167","Application Data"
"192","2.604559","192.168.1.166","23.198.241.2","TLSv1.2","168","Application Data"
"193","2.618534","23.198.241.2","192.168.1.166","TLSv1.2","365","Application Data"
"194","2.618534","23.198.241.2","192.168.1.166","TLSv1.2","159","Application Data"
"195","2.618550","192.168.1.166","23.198.241.2","TCP","54","58685  >  443 [ACK] Seq=88818 Ack=160963 Win=8190 Len=0"
"196","2.638213","23.198.241.2","192.168.1.166","TCP","54","443  >  58685 [ACK] Seq=160963 Ack=88818 Win=14815 Len=0"
"197","2.647753","23.198.241.2","192.168.1.166","TLSv1.2","333","Application Data"
"198","2.647753","23.198.241.2","192.168.1.166","TLSv1.2","911","Application Data"
"199","2.647765","192.168.1.166","23.198.241.2","TCP","54","58685  >  443 [ACK] Seq=88818 Ack=162099 Win=8191 Len=0"
"200","2.648626","192.168.1.166","23.198.241.2","TLSv1.2","167","Application Data"
"201","2.656084","23.198.241.2","192.168.1.166","TLSv1.2","344","Application Data"
"202","2.656084","23.198.241.2","192.168.1.166","TLSv1.2","638","Application Data"
"203","2.656097","192.168.1.166","23.198.241.2","TCP","54","58685  >  443 [ACK] Seq=88931 Ack=162973 Win=8188 Len=0"
"204","2.679211","192.168.1.166","23.198.241.2","TLSv1.2","5873","Application Data"
"205","2.685037","192.168.1.166","23.198.241.2","TLSv1.2","561","Application Data"
"206","2.687076","192.168.1.166","23.198.241.2","TLSv1.2","167","Application Data"
"207","2.687100","192.168.1.166","23.198.241.2","TLSv1.2","167","Application Data"
"208","2.687113","192.168.1.166","23.198.241.2","TLSv1.2","167","Application Data"
"209","2.687126","192.168.1.166","23.198.241.2","TLSv1.2","167","Application Data"
"210","2.689385","192.168.1.166","23.198.241.2","TLSv1.2","5936","Application Data"
"211","2.690620","23.198.241.2","192.168.1.166","TLSv1.2","333","Application Data"
"212","2.690620","23.198.241.2","192.168.1.166","TLSv1.2","604","Application Data"
"213","2.690642","192.168.1.166","23.198.241.2","TCP","54","58685  >  443 [ACK] Seq=101591 Ack=163802 Win=8191 Len=0"
"214","2.691138","192.168.1.166","23.198.241.2","TLSv1.2","552","Application Data"
"215","2.714979","23.198.241.2","192.168.1.166","TCP","54","443  >  58685 [ACK] Seq=163802 Ack=95709 Win=14785 Len=0"
"216","2.714979","23.198.241.2","192.168.1.166","TCP","54","443  >  58685 [ACK] Seq=163802 Ack=101591 Win=14753 Len=0"
"217","2.739770","23.198.241.2","192.168.1.166","TLSv1.2","958","Application Data"
"218","2.739770","23.198.241.2","192.168.1.166","TLSv1.2","1109","Application Data, Application Data"
"219","2.739770","23.198.241.2","192.168.1.166","TLSv1.2","2974","Application Data, Application Data, Application Data, Application Data, Application Data, Application Data, Application Data"
"220","2.739770","23.198.241.2","192.168.1.166","TLSv1.2","900","Application Data, Application Data"
"221","2.739770","23.198.241.2","192.168.1.166","TLSv1.2","372","Application Data"
"222","2.739770","23.198.241.2","192.168.1.166","TLSv1.2","85","Application Data"
"223","2.739770","23.198.241.2","192.168.1.166","TLSv1.2","346","Application Data"
"224","2.739770","23.198.241.2","192.168.1.166","TLSv1.2","477","Application Data"
"225","2.739805","192.168.1.166","23.198.241.2","TCP","54","58685  >  443 [ACK] Seq=102089 Ack=170591 Win=8191 Len=0"
"226","2.742327","192.168.1.166","23.198.241.2","TLSv1.2","166","Application Data"
"227","2.742361","192.168.1.166","23.198.241.2","TLSv1.2","167","Application Data"
"228","2.742379","192.168.1.166","23.198.241.2","TLSv1.2","167","Application Data"
"229","2.742394","192.168.1.166","23.198.241.2","TLSv1.2","166","Application Data"
"230","2.742410","192.168.1.166","23.198.241.2","TLSv1.2","166","Application Data"
"231","2.742425","192.168.1.166","23.198.241.2","TLSv1.2","166","Application Data"
"232","2.744609","192.168.1.166","23.198.241.2","TLSv1.2","183","Application Data"
"233","2.775400","23.198.241.2","192.168.1.166","TCP","54","443  >  58685 [ACK] Seq=170591 Ack=102763 Win=14815 Len=0"
"234","2.784023","23.198.241.2","192.168.1.166","TLSv1.2","344","Application Data"
"235","2.784023","23.198.241.2","192.168.1.166","TLSv1.2","287","Application Data"
"236","2.784059","192.168.1.166","23.198.241.2","TCP","54","58685  >  443 [ACK] Seq=102892 Ack=171114 Win=8189 Len=0"
"237","2.791056","23.198.241.2","192.168.1.166","TLSv1.2","317","Application Data"
"238","2.791056","23.198.241.2","192.168.1.166","TCP","1514","443  >  58685 [ACK] Seq=171377 Ack=102892 Win=14815 Len=1460 [TCP PDU reassembled in 239]"
"239","2.791056","23.198.241.2","192.168.1.166","TLSv1.2","273","Application Data"
"240","2.791056","23.198.241.2","192.168.1.166","TLSv1.2","1514","Application Data, Application Data, Application Data, Application Data"
"241","2.791056","23.198.241.2","192.168.1.166","TLSv1.2","379","Application Data, Application Data"
"242","2.791056","23.198.241.2","192.168.1.166","TLSv1.2","1398","Application Data, Application Data, Application Data, Application Data"
"243","2.791107","192.168.1.166","23.198.241.2","TCP","54","58685  >  443 [ACK] Seq=102892 Ack=176185 Win=8191 Len=0"
"244","2.795852","192.168.1.166","23.198.241.2","TLSv1.2","166","Application Data"
"245","2.795902","192.168.1.166","23.198.241.2","TLSv1.2","166","Application Data"
"246","2.795920","192.168.1.166","23.198.241.2","TLSv1.2","166","Application Data"
"247","2.795937","192.168.1.166","23.198.241.2","TLSv1.2","166","Application Data"
"248","2.795955","192.168.1.166","23.198.241.2","TLSv1.2","167","Application Data"
"249","2.796855","192.168.1.166","23.198.241.2","TLSv1.2","166","Application Data"
"250","2.827410","23.198.241.2","192.168.1.166","TCP","54","443  >  58685 [ACK] Seq=176185 Ack=103565 Win=14815 Len=0"
"251","2.836885","23.198.241.2","192.168.1.166","TLSv1.2","344","Application Data"
"252","2.836885","23.198.241.2","192.168.1.166","TLSv1.2","505","Application Data"
"253","2.836908","192.168.1.166","23.198.241.2","TCP","54","58685  >  443 [ACK] Seq=103565 Ack=176926 Win=8188 Len=0"
"254","2.837621","192.168.1.166","23.198.241.2","TLSv1.2","166","Application Data"
"255","2.843346","23.198.241.2","192.168.1.166","TLSv1.2","334","Application Data"
"256","2.843346","23.198.241.2","192.168.1.166","TLSv1.2","283","Application Data"
"257","2.843346","23.198.241.2","192.168.1.166","TLSv1.2","335","Application Data"
"258","2.843346","23.198.241.2","192.168.1.166","TLSv1.2","1514","Application Data, Application Data, Application Data, Application Data"
"259","2.843346","23.198.241.2","192.168.1.166","TLSv1.2","520","Application Data, Application Data"
"260","2.843346","23.198.241.2","192.168.1.166","TLSv1.2","473","Application Data"
"261","2.843382","192.168.1.166","23.198.241.2","TCP","54","58685  >  443 [ACK] Seq=103677 Ack=180061 Win=8191 Len=0"
"262","2.845101","192.168.1.166","23.198.241.2","TLSv1.2","166","Application Data"
"263","2.845135","192.168.1.166","23.198.241.2","TLSv1.2","166","Application Data"
"264","2.845152","192.168.1.166","23.198.241.2","TLSv1.2","166","Application Data"
"265","2.845169","192.168.1.166","23.198.241.2","TLSv1.2","166","Application Data"
"266","2.845187","192.168.1.166","23.198.241.2","TLSv1.2","166","Application Data"
"267","2.854075","192.168.1.166","23.198.241.2","TLSv1.2","5754","Application Data"
"268","2.856569","192.168.1.166","23.198.241.2","TLSv1.2","5912","Application Data"
"269","2.875109","23.198.241.2","192.168.1.166","TCP","54","443  >  58685 [ACK] Seq=180061 Ack=103901 Win=14815 Len=0"
"270","2.883911","23.198.241.2","192.168.1.166","TLSv1.2","334","Application Data"
"271","2.883911","23.198.241.2","192.168.1.166","TLSv1.2","333","Application Data"
"272","2.883929","192.168.1.166","23.198.241.2","TCP","54","58685  >  443 [ACK] Seq=115795 Ack=180620 Win=8189 Len=0"
"273","2.886420","192.168.1.166","23.198.241.2","TLSv1.2","552","Application Data"
"274","2.906180","23.198.241.2","192.168.1.166","TLSv1.2","426","Application Data"
"275","2.906180","23.198.241.2","192.168.1.166","TCP","16114","443  >  58685 [ACK] Seq=180992 Ack=115795 Win=14815 Len=16060 [TCP PDU reassembled in 276]"
"276","2.906180","23.198.241.2","192.168.1.166","TLSv1.2","400","Application Data"
"277","2.906180","23.198.241.2","192.168.1.166","TLSv1.2","16114","Application Data"
"278","2.906180","23.198.241.2","192.168.1.166","TLSv1.2","431","Application Data"
"279","2.906180","23.198.241.2","192.168.1.166","TLSv1.2","14654","Application Data, Application Data, Application Data, Application Data, Application Data, Application Data"
"280","2.906230","192.168.1.166","23.198.241.2","TCP","54","58685  >  443 [ACK] Seq=116293 Ack=228435 Win=8191 Len=0"
"281","2.906417","23.198.241.2","192.168.1.166","TLSv1.2","1514","Application Data, Application Data, Application Data, Application Data"
"282","2.906417","23.198.241.2","192.168.1.166","TLSv1.2","182","Application Data"
"283","2.906417","23.198.241.2","192.168.1.166","TLSv1.2","287","Application Data"
"284","2.906430","192.168.1.166","23.198.241.2","TCP","54","58685  >  443 [ACK] Seq=116293 Ack=230256 Win=8191 Len=0"
"285","2.908971","192.168.1.166","23.198.241.2","TLSv1.2","166","Application Data"
"286","2.908997","192.168.1.166","23.198.241.2","TLSv1.2","166","Application Data"
"287","2.909011","192.168.1.166","23.198.241.2","TLSv1.2","166","Application Data"
"288","2.909023","192.168.1.166","23.198.241.2","TLSv1.2","166","Application Data"
"289","2.909036","192.168.1.166","23.198.241.2","TLSv1.2","166","Application Data"
"290","2.931336","23.198.241.2","192.168.1.166","TLSv1.2","333","Application Data"
"291","2.931336","23.198.241.2","192.168.1.166","TLSv1.2","552","Application Data"
"292","2.931374","192.168.1.166","23.198.241.2","TCP","54","58685  >  443 [ACK] Seq=116853 Ack=231033 Win=8188 Len=0"
"293","2.932323","192.168.1.166","23.198.241.2","TLSv1.2","176","Application Data"
"294","2.935607","23.198.241.2","192.168.1.166","TCP","54","443  >  58685 [ACK] Seq=231033 Ack=116853 Win=14815 Len=0"
"295","2.946301","23.198.241.2","192.168.1.166","TLSv1.2","334","Application Data"
"296","2.946301","23.198.241.2","192.168.1.166","TLSv1.2","283","Application Data"
"297","2.946301","23.198.241.2","192.168.1.166","TLSv1.2","333","Application Data"
"298","2.946301","23.198.241.2","192.168.1.166","TLSv1.2","1514","Application Data, Application Data, Application Data, Application Data"
"299","2.946301","23.198.241.2","192.168.1.166","TLSv1.2","515","Application Data, Application Data"
"300","2.946301","23.198.241.2","192.168.1.166","TLSv1.2","243","Application Data"
"301","2.946336","192.168.1.166","23.198.241.2","TCP","54","58685  >  443 [ACK] Seq=116975 Ack=233931 Win=8191 Len=0"
"302","2.949472","23.198.241.2","192.168.1.166","TLSv1.2","282","Application Data"
"303","2.949472","23.198.241.2","192.168.1.166","TCP","1514","443  >  58685 [ACK] Seq=234159 Ack=116853 Win=14815 Len=1460 [TCP PDU reassembled in 314]"
"304","2.949472","23.198.241.2","192.168.1.166","TCP","1514","443  >  58685 [ACK] Seq=235619 Ack=116853 Win=14815 Len=1460 [TCP PDU reassembled in 314]"
"305","2.949472","23.198.241.2","192.168.1.166","TCP","1514","443  >  58685 [ACK] Seq=237079 Ack=116853 Win=14815 Len=1460 [TCP PDU reassembled in 314]"
"306","2.949472","23.198.241.2","192.168.1.166","TCP","1514","443  >  58685 [ACK] Seq=238539 Ack=116853 Win=14815 Len=1460 [TCP PDU reassembled in 314]"
"307","2.949472","23.198.241.2","192.168.1.166","TCP","1514","443  >  58685 [ACK] Seq=239999 Ack=116853 Win=14815 Len=1460 [TCP PDU reassembled in 314]"
"308","2.949472","23.198.241.2","192.168.1.166","TCP","1514","443  >  58685 [ACK] Seq=241459 Ack=116853 Win=14815 Len=1460 [TCP PDU reassembled in 314]"
"309","2.949472","23.198.241.2","192.168.1.166","TCP","1514","443  >  58685 [ACK] Seq=242919 Ack=116853 Win=14815 Len=1460 [TCP PDU reassembled in 314]"
"310","2.949472","23.198.241.2","192.168.1.166","TCP","1514","443  >  58685 [ACK] Seq=244379 Ack=116853 Win=14815 Len=1460 [TCP PDU reassembled in 314]"
"311","2.949472","23.198.241.2","192.168.1.166","TCP","1514","443  >  58685 [ACK] Seq=245839 Ack=116853 Win=14815 Len=1460 [TCP PDU reassembled in 314]"
"312","2.949472","23.198.241.2","192.168.1.166","TCP","1514","443  >  58685 [ACK] Seq=247299 Ack=116853 Win=14815 Len=1460 [TCP PDU reassembled in 314]"
"313","2.949472","23.198.241.2","192.168.1.166","TCP","1514","443  >  58685 [ACK] Seq=248759 Ack=116853 Win=14815 Len=1460 [TCP PDU reassembled in 314]"
"314","2.949472","23.198.241.2","192.168.1.166","TLSv1.2","400","Application Data"
"315","2.949472","23.198.241.2","192.168.1.166","TLSv1.2","1514","Application Data"
"316","2.949472","23.198.241.2","192.168.1.166","TCP","1514","443  >  58685 [ACK] Seq=252025 Ack=116853 Win=14815 Len=1460 [TCP PDU reassembled in 326]"
"317","2.949472","23.198.241.2","192.168.1.166","TCP","1514","443  >  58685 [ACK] Seq=253485 Ack=116853 Win=14815 Len=1460 [TCP PDU reassembled in 326]"
"318","2.949472","23.198.241.2","192.168.1.166","TCP","1514","443  >  58685 [ACK] Seq=254945 Ack=116853 Win=14815 Len=1460 [TCP PDU reassembled in 326]"
"319","2.949472","23.198.241.2","192.168.1.166","TCP","1514","443  >  58685 [ACK] Seq=256405 Ack=116853 Win=14815 Len=1460 [TCP PDU reassembled in 326]"
"320","2.949472","23.198.241.2","192.168.1.166","TCP","1514","443  >  58685 [ACK] Seq=257865 Ack=116853 Win=14815 Len=1460 [TCP PDU reassembled in 326]"
"321","2.949472","23.198.241.2","192.168.1.166","TCP","1514","443  >  58685 [ACK] Seq=259325 Ack=116853 Win=14815 Len=1460 [TCP PDU reassembled in 326]"
"322","2.949472","23.198.241.2","192.168.1.166","TCP","1514","443  >  58685 [ACK] Seq=260785 Ack=116853 Win=14815 Len=1460 [TCP PDU reassembled in 326]"
"323","2.949472","23.198.241.2","192.168.1.166","TCP","1514","443  >  58685 [ACK] Seq=262245 Ack=116853 Win=14815 Len=1460 [TCP PDU reassembled in 326]"
"324","2.949472","23.198.241.2","192.168.1.166","TCP","1514","443  >  58685 [ACK] Seq=263705 Ack=116853 Win=14815 Len=1460 [TCP PDU reassembled in 326]"
"325","2.949472","23.198.241.2","192.168.1.166","TCP","1514","443  >  58685 [ACK] Seq=265165 Ack=116853 Win=14815 Len=1460 [TCP PDU reassembled in 326]"
"326","2.949472","23.198.241.2","192.168.1.166","TLSv1.2","431","Application Data"
"327","2.949472","23.198.241.2","192.168.1.166","TLSv1.2","11734","Application Data, Application Data"
"328","2.949472","23.198.241.2","192.168.1.166","TLSv1.2","473","Application Data, Application Data"
"329","2.949564","192.168.1.166","23.198.241.2","TCP","54","58685  >  443 [ACK] Seq=116975 Ack=279101 Win=8191 Len=0"
"330","2.949712","192.168.1.166","23.198.241.2","TLSv1.2","176","Application Data"
"331","2.949738","192.168.1.166","23.198.241.2","TLSv1.2","176","Application Data"
"332","2.949757","192.168.1.166","23.198.241.2","TLSv1.2","177","Application Data"
"333","2.949769","192.168.1.166","23.198.241.2","TLSv1.2","176","Application Data"
"334","2.973056","23.198.241.2","192.168.1.166","TLSv1.2","317","Application Data"
"335","2.973056","23.198.241.2","192.168.1.166","TLSv1.2","1335","Application Data"
"336","2.973089","192.168.1.166","23.198.241.2","TCP","54","58685  >  443 [ACK] Seq=117464 Ack=280645 Win=8191 Len=0"
"337","2.983813","23.198.241.2","192.168.1.166","TLSv1.2","317","Application Data"
"338","2.983813","23.198.241.2","192.168.1.166","TCP","1514","443  >  58685 [ACK] Seq=280908 Ack=117464 Win=14813 Len=1460 [TCP PDU reassembled in 339]"
"339","2.983813","23.198.241.2","192.168.1.166","TLSv1.2","515","Application Data"
"340","2.983848","192.168.1.166","23.198.241.2","TCP","54","58685  >  443 [ACK] Seq=117464 Ack=282829 Win=8191 Len=0"
"341","2.990067","23.198.241.2","192.168.1.166","TLSv1.2","317","Application Data"
"342","2.990067","23.198.241.2","192.168.1.166","TLSv1.2","1505","Application Data"
"343","2.990100","192.168.1.166","23.198.241.2","TCP","54","58685  >  443 [ACK] Seq=117464 Ack=284543 Win=8191 Len=0"
"344","2.991931","192.168.1.166","23.198.241.2","TLSv1.2","5746","Application Data"
"345","2.991980","192.168.1.166","23.198.241.2","TLSv1.2","339","Application Data"
"346","2.994265","192.168.1.166","23.198.241.2","TLSv1.2","5967","Application Data"
"347","2.994474","192.168.1.166","23.198.241.2","TLSv1.2","5967","Application Data"
"348","2.994959","192.168.1.166","23.198.241.2","TLSv1.2","6015","Application Data"
"349","2.997064","23.198.241.2","192.168.1.166","TLSv1.2","317","Application Data"
"350","2.997064","23.198.241.2","192.168.1.166","TLSv1.2","1033","Application Data"
"351","2.997064","23.198.241.2","192.168.1.166","TLSv1.2","1514","Application Data"
"352","2.997064","23.198.241.2","192.168.1.166","TLSv1.2","1148","Application Data"
"353","2.997097","192.168.1.166","23.198.241.2","TCP","54","58685  >  443 [ACK] Seq=141228 Ack=288339 Win=8191 Len=0"
"354","3.000524","192.168.1.166","23.198.241.2","TLSv1.2","6013","Application Data"
"355","3.000584","192.168.1.166","23.198.241.2","TLSv1.2","777","Application Data"
"356","3.000973","192.168.1.166","23.198.241.2","TLSv1.2","6013","Application Data"
"357","3.001011","192.168.1.166","23.198.241.2","TLSv1.2","860","Application Data"
"358","3.026830","23.198.241.2","192.168.1.166","TCP","54","443  >  58685 [ACK] Seq=288339 Ack=120384 Win=14815 Len=0"
"359","3.026830","23.198.241.2","192.168.1.166","TCP","54","443  >  58685 [ACK] Seq=288339 Ack=129354 Win=14770 Len=0"
"360","3.026830","23.198.241.2","192.168.1.166","TCP","54","443  >  58685 [ACK] Seq=288339 Ack=132274 Win=14755 Len=0"
"361","3.029339","23.198.241.2","192.168.1.166","TCP","54","443  >  58685 [ACK] Seq=288339 Ack=135267 Win=14803 Len=0"
"362","3.029762","192.168.1.166","23.198.241.2","TLSv1.2","6023","Application Data"
"363","3.029819","192.168.1.166","23.198.241.2","TLSv1.2","253","Application Data"
"364","3.046511","23.198.241.2","192.168.1.166","TLSv1.2","380","Application Data"
"365","3.046511","23.198.241.2","192.168.1.166","TCP","16114","443  >  58685 [ACK] Seq=288665 Ack=154675 Win=14695 Len=16060 [TCP PDU reassembled in 366]"
"366","3.046511","23.198.241.2","192.168.1.166","TLSv1.2","400","Application Data"
"367","3.046511","23.198.241.2","192.168.1.166","TLSv1.2","16114","Application Data"
"368","3.046511","23.198.241.2","192.168.1.166","TLSv1.2","431","Application Data"
"369","3.046511","23.198.241.2","192.168.1.166","TLSv1.2","16114","Application Data"
"370","3.046511","23.198.241.2","192.168.1.166","TLSv1.2","462","Application Data, Application Data"
"371","3.046511","23.198.241.2","192.168.1.166","TLSv1.2","26334","Application Data, Application Data"
"372","3.046581","192.168.1.166","23.198.241.2","TCP","54","58685  >  443 [ACK] Seq=160843 Ack=364256 Win=8191 Len=0"
"373","3.049033","23.198.241.2","192.168.1.166","TLSv1.2","21954","Application Data, Application Data"
"374","3.049033","23.198.241.2","192.168.1.166","TLSv1.2","1154","Application Data"
"375","3.049033","23.198.241.2","192.168.1.166","TLSv1.2","16114","Application Data"
"376","3.049033","23.198.241.2","192.168.1.166","TLSv1.2","462","Application Data, Application Data"
"377","3.049033","23.198.241.2","192.168.1.166","TLSv1.2","64294","Application Data, Application Data, Application Data, Application Data, Application Data, Application Data"
"378","3.049033","23.198.241.2","192.168.1.166","TLSv1.2","64294","Application Data, Application Data, Application Data, Application Data, Application Data, Application Data, Application Data, Application Data"
"379","3.049033","23.198.241.2","192.168.1.166","TLSv1.2","14654","Application Data, Application Data"
"380","3.049033","23.198.241.2","192.168.1.166","TLSv1.2","868","Application Data"
"381","3.049033","23.198.241.2","192.168.1.166","TCP","13194","443  >  58685 [ACK] Seq=547618 Ack=154675 Win=14815 Len=13140 [TCP PDU reassembled in 384]"
"382","3.049109","192.168.1.166","23.198.241.2","TCP","54","58685  >  443 [ACK] Seq=160843 Ack=560758 Win=8191 Len=0"
"383","3.049279","23.198.241.2","192.168.1.166","TCP","2974","443  >  58685 [ACK] Seq=560758 Ack=154675 Win=14815 Len=2920 [TCP PDU reassembled in 384]"
"384","3.049279","23.198.241.2","192.168.1.166","TLSv1.2","400","Application Data"
"385","3.049279","23.198.241.2","192.168.1.166","TLSv1.2","85","Application Data"
"386","3.049279","23.198.241.2","192.168.1.166","TCP","16114","443  >  58685 [ACK] Seq=564055 Ack=154675 Win=14815 Len=16060 [TCP PDU reassembled in 387]"
"387","3.049279","23.198.241.2","192.168.1.166","TLSv1.2","400","Application Data"
"388","3.049279","23.198.241.2","192.168.1.166","TLSv1.2","11734","Application Data"
"389","3.049310","192.168.1.166","23.198.241.2","TCP","54","58685  >  443 [ACK] Seq=160843 Ack=592141 Win=8069 Len=0"
