"No.","Time","Source","Destination","Protocol","Length","Info"
"1","0.000000","192.168.1.166","23.39.213.4","TLSv1.2","5313","Application Data"
"2","0.000105","192.168.1.166","23.39.213.4","TLSv1.2","5313","Application Data"
"3","0.000126","192.168.1.166","23.39.213.4","TLSv1.2","1173","Application Data"
"4","0.000142","192.168.1.166","23.39.213.4","TLSv1.2","538","Application Data"
"5","0.046571","23.39.213.4","192.168.1.166","TCP","54","443  >  52183 [ACK] Seq=1 Ack=1461 Win=11800 Len=0"
"6","0.046571","23.39.213.4","192.168.1.166","TCP","54","443  >  52183 [ACK] Seq=1 Ack=2921 Win=11793 Len=0"
"7","0.046571","23.39.213.4","192.168.1.166","TCP","54","443  >  52183 [ACK] Seq=1 Ack=5260 Win=11795 Len=0"
"8","0.046571","23.39.213.4","192.168.1.166","TCP","54","443  >  52183 [ACK] Seq=1 Ack=6720 Win=11787 Len=0"
"9","0.046571","23.39.213.4","192.168.1.166","TCP","54","443  >  52183 [ACK] Seq=1 Ack=8180 Win=11800 Len=0"
"10","0.046571","23.39.213.4","192.168.1.166","TCP","54","443  >  52183 [ACK] Seq=1 Ack=10519 Win=11787 Len=0"
"11","0.046571","23.39.213.4","192.168.1.166","TCP","54","443  >  52183 [ACK] Seq=1 Ack=11638 Win=11781 Len=0"
"12","0.046571","23.39.213.4","192.168.1.166","TCP","54","443  >  52183 [ACK] Seq=1 Ack=12122 Win=11778 Len=0"
"13","0.123620","23.39.213.4","192.168.1.166","TLSv1.2","938","Application Data"
"14","0.123620","23.39.213.4","192.168.1.166","TLSv1.2","116","Application Data"
"15","0.123656","192.168.1.166","23.39.213.4","TCP","54","52183  >  443 [ACK] Seq=12122 Ack=947 Win=4095 Len=0"
"16","0.124582","192.168.1.166","23.39.213.4","TLSv1.2","5495","Application Data"
"17","0.129170","23.39.213.4","192.168.1.166","TLSv1.2","952","Application Data"
"18","0.129170","23.39.213.4","192.168.1.166","TLSv1.2","120","Application Data"
"19","0.129204","192.168.1.166","23.39.213.4","TCP","54","52183  >  443 [ACK] Seq=17563 Ack=1911 Win=4092 Len=0"
"20","0.157905","23.39.213.4","192.168.1.166","TCP","54","443  >  52183 [ACK] Seq=1911 Ack=13582 Win=11800 Len=0"
"21","0.157905","23.39.213.4","192.168.1.166","TCP","54","443  >  52183 [ACK] Seq=1911 Ack=15042 Win=11800 Len=0"
"22","0.157905","23.39.213.4","192.168.1.166","TCP","54","443  >  52183 [ACK] Seq=1911 Ack=17563 Win=11794 Len=0"
"23","1.994834","23.39.213.4","192.168.1.166","TLSv1.2","1512","Application Data"
"24","1.994834","23.39.213.4","192.168.1.166","TCP","16114","443  >  52183 [ACK] Seq=3369 Ack=17563 Win=11805 Len=16060 [TCP PDU reassembled in 25]"
"25","1.994834","23.39.213.4","192.168.1.166","TLSv1.2","400","Application Data"
"26","1.994834","23.39.213.4","192.168.1.166","TLSv1.2","16114","Application Data"
"27","1.994834","23.39.213.4","192.168.1.166","TLSv1.2","431","Application Data"
"28","1.994894","192.168.1.166","23.39.213.4","TCP","54","52183  >  443 [ACK] Seq=17563 Ack=36212 Win=4095 Len=0"
"29","1.995309","23.39.213.4","192.168.1.166","TLSv1.2","7354","Application Data"
"30","1.995309","23.39.213.4","192.168.1.166","TLSv1.2","357","Application Data"
"31","1.995309","23.39.213.4","192.168.1.166","TCP","5894","443  >  52183 [ACK] Seq=43815 Ack=17563 Win=11805 Len=5840 [TCP PDU reassembled in 32]"
"32","1.995309","23.39.213.4","192.168.1.166","TLSv1.2","1436","Application Data"
"33","1.995335","192.168.1.166","23.39.213.4","TCP","54","52183  >  443 [ACK] Seq=17563 Ack=51037 Win=4095 Len=0"
"34","1.997693","23.39.213.4","192.168.1.166","TCP","16114","443  >  52183 [ACK] Seq=51037 Ack=17563 Win=11805 Len=16060 [TCP PDU reassembled in 35]"
"35","1.997693","23.39.213.4","192.168.1.166","TLSv1.2","400","Application Data"
"36","1.997693","23.39.213.4","192.168.1.166","TLSv1.2","85","Application Data"
"37","1.997693","23.39.213.4","192.168.1.166","TCP","5894","443  >  52183 [ACK] Seq=67474 Ack=17563 Win=11805 Len=5840 [TCP PDU reassembled in 40]"
"38","1.997731","192.168.1.166","23.39.213.4","TCP","54","52183  >  443 [ACK] Seq=17563 Ack=73314 Win=4095 Len=0"
"39","1.998514","23.39.213.4","192.168.1.166","TCP","2974","443  >  52183 [ACK] Seq=73314 Ack=17563 Win=11805 Len=2920 [TCP PDU reassembled in 40]"
"40","1.998514","23.39.213.4","192.168.1.166","TLSv1.2","358","Application Data"
"41","1.998533","192.168.1.166","23.39.213.4","TCP","54","52183  >  443 [ACK] Seq=17563 Ack=76538 Win=4095 Len=0"
"42","1.999786","23.39.213.4","192.168.1.166","TCP","10274","443  >  52183 [ACK] Seq=76538 Ack=17563 Win=11805 Len=10220 [TCP PDU reassembled in 47]"
"43","1.999809","192.168.1.166","23.39.213.4","TCP","54","52183  >  443 [ACK] Seq=17563 Ack=86758 Win=4095 Len=0"
"44","1.999920","23.39.213.4","192.168.1.166","TCP","2974","443  >  52183 [ACK] Seq=86758 Ack=17563 Win=11805 Len=2920 [TCP PDU reassembled in 47]"
"45","1.999934","192.168.1.166","23.39.213.4","TCP","54","52183  >  443 [ACK] Seq=17563 Ack=89678 Win=4095 Len=0"
"46","2.001208","23.39.213.4","192.168.1.166","TCP","2974","443  >  52183 [ACK] Seq=89678 Ack=17563 Win=11805 Len=2920 [TCP PDU reassembled in 47]"
"47","2.001208","23.39.213.4","192.168.1.166","TLSv1.2","400","Application Data"
"48","2.001208","23.39.213.4","192.168.1.166","TLSv1.2","85","Application Data"
"49","2.001208","23.39.213.4","192.168.1.166","TCP","5894","443  >  52183 [ACK] Seq=92975 Ack=17563 Win=11805 Len=5840 [TCP PDU reassembled in 50]"
"50","2.001208","23.39.213.4","192.168.1.166","TLSv1.2","307","Application Data"
"51","2.001231","192.168.1.166","23.39.213.4","TCP","54","52183  >  443 [ACK] Seq=17563 Ack=99068 Win=4095 Len=0"
"52","2.001896","192.168.1.166","23.39.213.4","TLSv1.2","5508","Application Data"
"53","2.001930","192.168.1.166","23.39.213.4","TLSv1.2","1405","Application Data"
"54","2.005204","23.39.213.4","192.168.1.166","TCP","16114","443  >  52183 [ACK] Seq=99068 Ack=17563 Win=11805 Len=16060 [TCP PDU reassembled in 55]"
"55","2.005204","23.39.213.4","192.168.1.166","TLSv1.2","400","Application Data"
"56","2.005204","23.39.213.4","192.168.1.166","TLSv1.2","85","Application Data"
"57","2.005204","23.39.213.4","192.168.1.166","TCP","5894","443  >  52183 [ACK] Seq=115505 Ack=17563 Win=11805 Len=5840 [TCP PDU reassembled in 58]"
"58","2.005204","23.39.213.4","192.168.1.166","TLSv1.2","1420","Application Data"
"59","2.005237","192.168.1.166","23.39.213.4","TCP","54","52183  >  443 [ACK] Seq=24368 Ack=122711 Win=4095 Len=0"
"60","2.020407","23.39.213.4","192.168.1.166","TCP","16114","443  >  52183 [ACK] Seq=122711 Ack=17563 Win=11805 Len=16060 [TCP PDU reassembled in 61]"
"61","2.020407","23.39.213.4","192.168.1.166","TLSv1.2","400","Application Data"
"62","2.020461","192.168.1.166","23.39.213.4","TCP","54","52183  >  443 [ACK] Seq=24368 Ack=139117 Win=4095 Len=0"
"63","2.020718","23.39.213.4","192.168.1.166","TLSv1.2","85","Application Data"
"64","2.020718","23.39.213.4","192.168.1.166","TCP","7354","443  >  52183 [ACK] Seq=139148 Ack=17563 Win=11805 Len=7300 [TCP PDU reassembled in 65]"
"65","2.020718","23.39.213.4","192.168.1.166","TLSv1.2","302","Application Data"
"66","2.020738","192.168.1.166","23.39.213.4","TCP","54","52183  >  443 [ACK] Seq=24368 Ack=146696 Win=4095 Len=0"
"67","2.025204","192.168.1.166","23.39.213.4","TLSv1.2","561","Application Data"
"68","2.031672","23.39.213.4","192.168.1.166","TCP","2974","443  >  52183 [ACK] Seq=146696 Ack=17563 Win=11805 Len=2920 [TCP PDU reassembled in 70]"
"69","2.031672","23.39.213.4","192.168.1.166","TCP","13194","443  >  52183 [ACK] Seq=149616 Ack=17563 Win=11805 Len=13140 [TCP PDU reassembled in 70]"
"70","2.031672","23.39.213.4","192.168.1.166","TLSv1.2","400","Application Data"
"71","2.031672","23.39.213.4","192.168.1.166","TLSv1.2","85","Application Data"
"72","2.031730","192.168.1.166","23.39.213.4","TCP","54","52183  >  443 [ACK] Seq=24875 Ack=163133 Win=4095 Len=0"
"73","2.033902","23.39.213.4","192.168.1.166","TCP","54","443  >  52183 [ACK] Seq=163133 Ack=19023 Win=11800 Len=0"
"74","2.033902","23.39.213.4","192.168.1.166","TCP","54","443  >  52183 [ACK] Seq=163133 Ack=23017 Win=11779 Len=0"
"75","2.033902","23.39.213.4","192.168.1.166","TCP","54","443  >  52183 [ACK] Seq=163133 Ack=24368 Win=11772 Len=0"
"76","2.039744","23.39.213.4","192.168.1.166","TCP","7354","443  >  52183 [ACK] Seq=163133 Ack=24368 Win=11805 Len=7300 [TCP PDU reassembled in 77]"
"77","2.039744","23.39.213.4","192.168.1.166","TLSv1.2","577","Application Data"
"78","2.039784","192.168.1.166","23.39.213.4","TCP","54","52183  >  443 [ACK] Seq=24875 Ack=170956 Win=4095 Len=0"
"79","2.042438","192.168.1.166","23.39.213.4","TLSv1.2","164","Application Data"
"80","2.043361","23.39.213.4","192.168.1.166","TCP","16114","443  >  52183 [ACK] Seq=170956 Ack=24368 Win=11805 Len=16060 [TCP PDU reassembled in 81]"
"81","2.043361","23.39.213.4","192.168.1.166","TLSv1.2","400","Application Data"
"82","2.043361","23.39.213.4","192.168.1.166","TLSv1.2","85","Application Data"
"83","2.043361","23.39.213.4","192.168.1.166","TLSv1.2","404","Application Data"
"84","2.043361","23.39.213.4","192.168.1.166","TLSv1.2","85","Application Data"
"85","2.043393","192.168.1.166","23.39.213.4","TCP","54","52183  >  443 [ACK] Seq=24985 Ack=187774 Win=4095 Len=0"
"86","2.074658","23.39.213.4","192.168.1.166","TCP","54","443  >  52183 [ACK] Seq=187774 Ack=24985 Win=11805 Len=0"
"87","2.086615","23.39.213.4","192.168.1.166","TLSv1.2","361","Application Data"
"88","2.086615","23.39.213.4","192.168.1.166","TLSv1.2","289","Application Data"
"89","2.086632","192.168.1.166","23.39.213.4","TCP","54","52183  >  443 [ACK] Seq=24985 Ack=188316 Win=4093 Len=0"
"90","2.112856","23.39.213.4","192.168.1.166","TLSv1.2","338","Application Data"
"91","2.112856","23.39.213.4","192.168.1.166","TLSv1.2","1438","Application Data"
"92","2.112856","23.39.213.4","192.168.1.166","TCP","1514","443  >  52183 [ACK] Seq=189984 Ack=24985 Win=11805 Len=1460 [TCP PDU reassembled in 93]"
"93","2.112856","23.39.213.4","192.168.1.166","TLSv1.2","1136","Application Data"
"94","2.112898","192.168.1.166","23.39.213.4","TCP","54","52183  >  443 [ACK] Seq=24985 Ack=192526 Win=4095 Len=0"
"95","2.114789","23.39.213.4","192.168.1.166","TLSv1.2","318","Application Data"
"96","2.114789","23.39.213.4","192.168.1.166","TLSv1.2","1507","Application Data"
"97","2.114789","23.39.213.4","192.168.1.166","TCP","16114","443  >  52183 [ACK] Seq=194243 Ack=24985 Win=11805 Len=16060 [TCP PDU reassembled in 98]"
"98","2.114789","23.39.213.4","192.168.1.166","TLSv1.2","400","Application Data"
"99","2.114823","192.168.1.166","23.39.213.4","TCP","54","52183  >  443 [ACK] Seq=24985 Ack=210649 Win=4095 Len=0"
"100","2.115561","23.39.213.4","192.168.1.166","TLSv1.2","85","Application Data"
"101","2.115561","23.39.213.4","192.168.1.166","TCP","7354","443  >  52183 [ACK] Seq=210680 Ack=24985 Win=11805 Len=7300 [TCP PDU reassembled in 102]"
"102","2.115561","23.39.213.4","192.168.1.166","TLSv1.2","1031","Application Data"
"103","2.115561","23.39.213.4","192.168.1.166","TLSv1.2","207","Application Data"
"104","2.115585","192.168.1.166","23.39.213.4","TCP","54","52183  >  443 [ACK] Seq=24985 Ack=219110 Win=4095 Len=0"
"105","2.122714","192.168.1.166","23.39.213.4","TLSv1.2","164","Application Data"
"106","2.165520","23.39.213.4","192.168.1.166","TLSv1.2","339","Application Data"
"107","2.165520","23.39.213.4","192.168.1.166","TCP","8814","443  >  52183 [ACK] Seq=219395 Ack=25095 Win=11805 Len=8760 [TCP PDU reassembled in 108]"
"108","2.165520","23.39.213.4","192.168.1.166","TLSv1.2","127","Application Data"
"109","2.165550","192.168.1.166","23.39.213.4","TCP","54","52183  >  443 [ACK] Seq=25095 Ack=228228 Win=4095 Len=0"
"110","2.210186","192.168.1.166","23.39.213.4","TLSv1.2","5167","Application Data"
"111","2.218438","192.168.1.166","23.39.213.4","TLSv1.2","544","Application Data"
"112","2.231415","192.168.1.166","23.39.213.4","TLSv1.2","5230","Application Data"
"113","2.231478","192.168.1.166","23.39.213.4","TLSv1.2","562","Application Data"
"114","2.231498","192.168.1.166","23.39.213.4","TLSv1.2","183","Application Data"
"115","2.231513","192.168.1.166","23.39.213.4","TLSv1.2","183","Application Data"
"116","2.235754","192.168.1.166","23.39.213.4","TLSv1.2","90","Application Data"
"117","2.235827","192.168.1.166","23.39.213.4","TLSv1.2","90","Application Data"
"118","2.235859","192.168.1.166","23.39.213.4","TLSv1.2","90","Application Data"
"119","2.244328","23.39.213.4","192.168.1.166","TCP","54","443  >  52183 [ACK] Seq=228228 Ack=30208 Win=11805 Len=0"
"120","2.253894","23.39.213.4","192.168.1.166","TLSv1.2","1005","Application Data"
"121","2.263443","23.39.213.4","192.168.1.166","TLSv1.2","85","Application Data"
"122","2.263469","192.168.1.166","23.39.213.4","TCP","54","52183  >  443 [ACK] Seq=36748 Ack=229210 Win=4092 Len=0"
"123","2.264527","23.39.213.4","192.168.1.166","TCP","54","443  >  52183 [ACK] Seq=229210 Ack=36640 Win=11772 Len=0"
"124","2.274368","23.39.213.4","192.168.1.166","TLSv1.2","338","Application Data"
"125","2.274368","23.39.213.4","192.168.1.166","TLSv1.2","817","Application Data"
"126","2.274389","192.168.1.166","23.39.213.4","TCP","54","52183  >  443 [ACK] Seq=36748 Ack=230257 Win=4095 Len=0"
"127","2.277149","23.39.213.4","192.168.1.166","TLSv1.2","338","Application Data"
"128","2.277149","23.39.213.4","192.168.1.166","TLSv1.2","1433","Application Data"
"129","2.277169","192.168.1.166","23.39.213.4","TCP","54","52183  >  443 [ACK] Seq=36748 Ack=231920 Win=4095 Len=0"
"130","2.278128","23.39.213.4","192.168.1.166","TLSv1.2","317","Application Data"
"131","2.278128","23.39.213.4","192.168.1.166","TLSv1.2","727","Application Data"
"132","2.278128","23.39.213.4","192.168.1.166","TLSv1.2","373","Application Data"
"133","2.278145","192.168.1.166","23.39.213.4","TCP","54","52183  >  443 [ACK] Seq=36748 Ack=233175 Win=4091 Len=0"
"134","2.279598","23.39.213.4","192.168.1.166","TLSv1.2","85","Application Data"
"135","2.279610","192.168.1.166","23.39.213.4","TCP","54","52183  >  443 [ACK] Seq=36748 Ack=233206 Win=4090 Len=0"
"136","2.289364","192.168.1.166","23.39.213.4","TLSv1.2","192","Application Data"
"137","2.289415","192.168.1.166","23.39.213.4","TLSv1.2","192","Application Data"
"138","2.289430","192.168.1.166","23.39.213.4","TLSv1.2","192","Application Data"
"139","2.289444","192.168.1.166","23.39.213.4","TLSv1.2","192","Application Data"
"140","2.289473","192.168.1.166","23.39.213.4","TLSv1.2","192","Application Data"
"141","2.295629","23.39.213.4","192.168.1.166","TLSv1.2","338","Application Data"
"142","2.295629","23.39.213.4","192.168.1.166","TLSv1.2","473","Application Data"
"143","2.295665","192.168.1.166","23.39.213.4","TCP","54","52183  >  443 [ACK] Seq=37438 Ack=233909 Win=4095 Len=0"
"144","2.296656","192.168.1.166","23.39.213.4","TLSv1.2","192","Application Data"
"145","2.321116","23.39.213.4","192.168.1.166","TCP","54","443  >  52183 [ACK] Seq=233909 Ack=37438 Win=11805 Len=0"
"146","2.335826","23.39.213.4","192.168.1.166","TLSv1.2","317","Application Data"
"147","2.335826","23.39.213.4","192.168.1.166","TCP","1514","443  >  52183 [ACK] Seq=234172 Ack=37576 Win=11805 Len=1460 [TCP PDU reassembled in 148]"
"148","2.335826","23.39.213.4","192.168.1.166","TLSv1.2","68","Application Data"
"149","2.335826","23.39.213.4","192.168.1.166","TLSv1.2","1514","Application Data"
"150","2.335826","23.39.213.4","192.168.1.166","TLSv1.2","320","Application Data"
"151","2.335826","23.39.213.4","192.168.1.166","TLSv1.2","1514","Application Data"
"152","2.335826","23.39.213.4","192.168.1.166","TLSv1.2","330","Application Data"
"153","2.335826","23.39.213.4","192.168.1.166","TCP","2974","443  >  52183 [ACK] Seq=239108 Ack=37576 Win=11805 Len=2920 [TCP PDU reassembled in 154]"
"154","2.335826","23.39.213.4","192.168.1.166","TLSv1.2","80","Application Data"
"155","2.335826","23.39.213.4","192.168.1.166","TLSv1.2","14654","Application Data"
"156","2.335826","23.39.213.4","192.168.1.166","TLSv1.2","691","Application Data"
"157","2.335901","192.168.1.166","23.39.213.4","TCP","54","52183  >  443 [ACK] Seq=37576 Ack=257291 Win=4095 Len=0"
"158","2.336986","192.168.1.166","23.39.213.4","TLSv1.2","192","Application Data"
"159","2.337060","192.168.1.166","23.39.213.4","TLSv1.2","192","Application Data"
"160","2.347805","23.39.213.4","192.168.1.166","TLSv1.2","317","Application Data"
"161","2.347805","23.39.213.4","192.168.1.166","TCP","1514","443  >  52183 [ACK] Seq=257554 Ack=37576 Win=11805 Len=1460 [TCP PDU reassembled in 162]"
"162","2.347805","23.39.213.4","192.168.1.166","TLSv1.2","68","Application Data"
"163","2.347841","192.168.1.166","23.39.213.4","TCP","54","52183  >  443 [ACK] Seq=37852 Ack=259028 Win=4095 Len=0"
"164","2.348001","23.39.213.4","192.168.1.166","TCP","4434","443  >  52183 [ACK] Seq=259028 Ack=37576 Win=11805 Len=4380 [TCP PDU reassembled in 165]"
"165","2.348001","23.39.213.4","192.168.1.166","TLSv1.2","878","Application Data"
"166","2.348029","192.168.1.166","23.39.213.4","TCP","54","52183  >  443 [ACK] Seq=37852 Ack=264232 Win=4095 Len=0"
"167","2.349134","23.39.213.4","192.168.1.166","TLSv1.2","317","Application Data"
"168","2.349148","192.168.1.166","23.39.213.4","TCP","54","52183  >  443 [ACK] Seq=37852 Ack=264495 Win=4094 Len=0"
"169","2.349746","23.39.213.4","192.168.1.166","TCP","1514","443  >  52183 [ACK] Seq=264495 Ack=37576 Win=11805 Len=1460 [TCP PDU reassembled in 170]"
"170","2.349746","23.39.213.4","192.168.1.166","TLSv1.2","68","Application Data"
"171","2.349746","23.39.213.4","192.168.1.166","TCP","2974","443  >  52183 [ACK] Seq=265969 Ack=37576 Win=11805 Len=2920 [TCP PDU reassembled in 172]"
"172","2.349746","23.39.213.4","192.168.1.166","TLSv1.2","1226","Application Data"
"173","2.349775","192.168.1.166","23.39.213.4","TCP","54","52183  >  443 [ACK] Seq=37852 Ack=270061 Win=4095 Len=0"
"174","2.378229","23.39.213.4","192.168.1.166","TCP","54","443  >  52183 [ACK] Seq=270061 Ack=37852 Win=11805 Len=0"
"175","2.388833","23.39.213.4","192.168.1.166","TLSv1.2","317","Application Data"
"176","2.388833","23.39.213.4","192.168.1.166","TCP","1514","443  >  52183 [ACK] Seq=270324 Ack=37852 Win=11805 Len=1460 [TCP PDU reassembled in 177]"
"177","2.388833","23.39.213.4","192.168.1.166","TLSv1.2","57","Application Data"
"178","2.388833","23.39.213.4","192.168.1.166","TLSv1.2","749","Application Data"
"179","2.388884","192.168.1.166","23.39.213.4","TCP","54","52183  >  443 [ACK] Seq=37852 Ack=272482 Win=4095 Len=0"
"180","2.390758","23.39.213.4","192.168.1.166","TLSv1.2","317","Application Data"
"181","2.390758","23.39.213.4","192.168.1.166","TLSv1.2","1482","Application Data"
"182","2.390758","23.39.213.4","192.168.1.166","TCP","4434","443  >  52183 [ACK] Seq=274173 Ack=37852 Win=11805 Len=4380 [TCP PDU reassembled in 183]"
"183","2.390758","23.39.213.4","192.168.1.166","TLSv1.2","898","Application Data"
"184","2.390792","192.168.1.166","23.39.213.4","TCP","54","52183  >  443 [ACK] Seq=37852 Ack=279397 Win=4095 Len=0"
"185","2.408628","23.39.213.4","192.168.1.166","TLSv1.2","318","Application Data"
"186","2.408628","23.39.213.4","192.168.1.166","TCP","1514","443  >  52183 [ACK] Seq=279661 Ack=37852 Win=11805 Len=1460 [TCP PDU reassembled in 187]"
"187","2.408628","23.39.213.4","192.168.1.166","TLSv1.2","67","Application Data"
"188","2.408628","23.39.213.4","192.168.1.166","TCP","1514","443  >  52183 [ACK] Seq=281134 Ack=37852 Win=11805 Len=1460 [TCP PDU reassembled in 189]"
"189","2.408628","23.39.213.4","192.168.1.166","TLSv1.2","347","Application Data"
"190","2.408739","192.168.1.166","23.39.213.4","TCP","54","52183  >  443 [ACK] Seq=37852 Ack=282887 Win=4095 Len=0"
"191","2.672407","192.168.1.166","23.39.213.4","TLSv1.2","5299","Application Data"
"192","2.672483","192.168.1.166","23.39.213.4","TLSv1.2","588","Application Data"
"193","2.708465","23.39.213.4","192.168.1.166","TCP","54","443  >  52183 [ACK] Seq=282887 Ack=43631 Win=11776 Len=0"
"194","2.758225","192.168.1.166","23.39.213.4","TLSv1.2","5547","Application Data"
"195","2.758297","192.168.1.166","23.39.213.4","TLSv1.2","3641","Application Data"
"196","2.791137","23.39.213.4","192.168.1.166","TCP","54","443  >  52183 [ACK] Seq=282887 Ack=46551 Win=11793 Len=0"
"197","2.791137","23.39.213.4","192.168.1.166","TCP","54","443  >  52183 [ACK] Seq=282887 Ack=49124 Win=11794 Len=0"
"198","2.791137","23.39.213.4","192.168.1.166","TCP","54","443  >  52183 [ACK] Seq=282887 Ack=52711 Win=11774 Len=0"
"199","2.803305","192.168.1.166","23.39.213.4","TLSv1.2","5546","Application Data"
"200","2.803381","192.168.1.166","23.39.213.4","TLSv1.2","685","Application Data"
"201","2.835534","23.39.213.4","192.168.1.166","TLSv1.2","954","Application Data"
"202","2.835534","23.39.213.4","192.168.1.166","TCP","1514","443  >  52183 [ACK] Seq=283787 Ack=52711 Win=11805 Len=1460 [TCP PDU reassembled in 203]"
"203","2.835534","23.39.213.4","192.168.1.166","TLSv1.2","55","Application Data"
"204","2.835534","23.39.213.4","192.168.1.166","TLSv1.2","227","Application Data"
"205","2.835581","192.168.1.166","23.39.213.4","TCP","54","52183  >  443 [ACK] Seq=58834 Ack=285421 Win=4095 Len=0"
"206","2.837861","23.39.213.4","192.168.1.166","TCP","54","443  >  52183 [ACK] Seq=285421 Ack=58834 Win=11782 Len=0"
"207","2.907669","192.168.1.166","23.39.213.4","TLSv1.2","556","Application Data"
"208","2.907736","192.168.1.166","23.39.213.4","TLSv1.2","175","Application Data"
"209","2.907754","192.168.1.166","23.39.213.4","TLSv1.2","177","Application Data"
"210","2.907770","192.168.1.166","23.39.213.4","TLSv1.2","177","Application Data"
"211","2.912540","192.168.1.166","23.39.213.4","TLSv1.2","90","Application Data"
"212","2.912607","192.168.1.166","23.39.213.4","TLSv1.2","90","Application Data"
"213","2.939787","23.39.213.4","192.168.1.166","TLSv1.2","958","Application Data"
"214","2.939787","23.39.213.4","192.168.1.166","TLSv1.2","173","Application Data"
"215","2.939787","23.39.213.4","192.168.1.166","TCP","54","443  >  52183 [ACK] Seq=286444 Ack=59703 Win=11805 Len=0"
"216","2.939827","192.168.1.166","23.39.213.4","TCP","54","52183  >  443 [ACK] Seq=59775 Ack=286444 Win=4091 Len=0"
"217","2.940448","192.168.1.166","23.39.213.4","TLSv1.2","89","Application Data"
"218","2.948526","23.39.213.4","192.168.1.166","TCP","54","443  >  52183 [ACK] Seq=286444 Ack=59775 Win=11805 Len=0"
"219","2.951143","23.39.213.4","192.168.1.166","TLSv1.2","318","Application Data"
"220","2.951143","23.39.213.4","192.168.1.166","TCP","1514","443  >  52183 [ACK] Seq=286708 Ack=59775 Win=11805 Len=1460 [TCP PDU reassembled in 221]"
"221","2.951143","23.39.213.4","192.168.1.166","TLSv1.2","66","Application Data"
"222","2.951143","23.39.213.4","192.168.1.166","TLSv1.2","1514","Application Data, Application Data, Application Data"
"223","2.951143","23.39.213.4","192.168.1.166","TLSv1.2","250","Application Data"
"224","2.951143","23.39.213.4","192.168.1.166","TCP","16114","443  >  52183 [ACK] Seq=289836 Ack=59775 Win=11805 Len=16060 [TCP PDU reassembled in 225]"
"225","2.951143","23.39.213.4","192.168.1.166","TLSv1.2","400","Application Data"
"226","2.951208","192.168.1.166","23.39.213.4","TCP","54","52183  >  443 [ACK] Seq=59810 Ack=306242 Win=4095 Len=0"
"227","2.951469","23.39.213.4","192.168.1.166","TLSv1.2","13194","Application Data"
"228","2.951469","23.39.213.4","192.168.1.166","TLSv1.2","1429","Application Data"
"229","2.951495","192.168.1.166","23.39.213.4","TCP","54","52183  >  443 [ACK] Seq=59810 Ack=320757 Win=4095 Len=0"
"230","2.952484","23.39.213.4","192.168.1.166","TLSv1.2","317","Application Data"
"231","2.952484","23.39.213.4","192.168.1.166","TLSv1.2","675","Application Data"
"232","2.952509","192.168.1.166","23.39.213.4","TCP","54","52183  >  443 [ACK] Seq=59810 Ack=321641 Win=4092 Len=0"
"233","2.957321","192.168.1.166","23.39.213.4","TLSv1.2","5186","Application Data"
"234","2.957380","192.168.1.166","23.39.213.4","TLSv1.2","391","Application Data"
"235","2.958155","192.168.1.166","23.39.213.4","TLSv1.2","5551","Application Data"
"236","2.958235","192.168.1.166","23.39.213.4","TLSv1.2","5551","Application Data"
"237","2.958265","192.168.1.166","23.39.213.4","TLSv1.2","3223","Application Data"
"238","2.958281","192.168.1.166","23.39.213.4","TLSv1.2","1469","Application Data"
"239","2.990887","23.39.213.4","192.168.1.166","TCP","54","443  >  52183 [ACK] Seq=321641 Ack=62730 Win=11793 Len=0"
"240","2.990887","23.39.213.4","192.168.1.166","TCP","54","443  >  52183 [ACK] Seq=321641 Ack=65279 Win=11792 Len=0"
"241","2.990887","23.39.213.4","192.168.1.166","TCP","54","443  >  52183 [ACK] Seq=321641 Ack=68199 Win=11800 Len=0"
"242","2.990887","23.39.213.4","192.168.1.166","TCP","54","443  >  52183 [ACK] Seq=321641 Ack=75156 Win=11771 Len=0"
"243","2.993848","23.39.213.4","192.168.1.166","TCP","54","443  >  52183 [ACK] Seq=321641 Ack=77733 Win=11794 Len=0"
"244","3.001075","192.168.1.166","23.39.213.4","TLSv1.2","572","Application Data"
"245","3.004774","23.39.213.4","192.168.1.166","TCP","54","443  >  52183 [ACK] Seq=321641 Ack=80857 Win=11776 Len=0"
"246","3.038125","192.168.1.166","23.39.213.4","TLSv1.2","5186","Application Data"
"247","3.039067","192.168.1.166","23.39.213.4","TLSv1.2","5459","Application Data"
"248","3.048347","23.39.213.4","192.168.1.166","TLSv1.2","951","Application Data"
"249","3.048347","23.39.213.4","192.168.1.166","TLSv1.2","1511","Application Data"
"250","3.048394","192.168.1.166","23.39.213.4","TCP","54","52183  >  443 [ACK] Seq=91912 Ack=323995 Win=4095 Len=0"
"251","3.050812","23.39.213.4","192.168.1.166","TCP","5894","443  >  52183 [ACK] Seq=323995 Ack=81375 Win=11805 Len=5840 [TCP PDU reassembled in 252]"
"252","3.050812","23.39.213.4","192.168.1.166","TLSv1.2","1046","Application Data"
"253","3.050839","192.168.1.166","23.39.213.4","TCP","54","52183  >  443 [ACK] Seq=91912 Ack=330827 Win=4095 Len=0"
"254","3.070378","23.39.213.4","192.168.1.166","TCP","54","443  >  52183 [ACK] Seq=330827 Ack=91912 Win=11760 Len=0"
"255","3.094337","23.39.213.4","192.168.1.166","TLSv1.2","317","Application Data"
"256","3.094337","23.39.213.4","192.168.1.166","TLSv1.2","1377","Application Data"
"257","3.094337","23.39.213.4","192.168.1.166","TCP","4434","443  >  52183 [ACK] Seq=332413 Ack=91912 Win=11805 Len=4380 [TCP PDU reassembled in 258]"
"258","3.094337","23.39.213.4","192.168.1.166","TLSv1.2","421","Application Data"
"259","3.094383","192.168.1.166","23.39.213.4","TCP","54","52183  >  443 [ACK] Seq=91912 Ack=337160 Win=4095 Len=0"
"260","3.099123","23.39.213.4","192.168.1.166","TLSv1.2","953","Application Data"
"261","3.099123","23.39.213.4","192.168.1.166","TLSv1.2","197","Application Data"
"262","3.099153","192.168.1.166","23.39.213.4","TCP","54","52183  >  443 [ACK] Seq=91912 Ack=338202 Win=4091 Len=0"
"263","3.100514","23.39.213.4","192.168.1.166","TLSv1.2","953","Application Data"
"264","3.100514","23.39.213.4","192.168.1.166","TLSv1.2","1511","Application Data"
"265","3.100536","192.168.1.166","23.39.213.4","TCP","54","52183  >  443 [ACK] Seq=91912 Ack=340558 Win=4095 Len=0"
"266","3.103744","23.39.213.4","192.168.1.166","TCP","8814","443  >  52183 [ACK] Seq=340558 Ack=91912 Win=11805 Len=8760 [TCP PDU reassembled in 267]"
"267","3.103744","23.39.213.4","192.168.1.166","TLSv1.2","732","Application Data"
"268","3.103777","192.168.1.166","23.39.213.4","TCP","54","52183  >  443 [ACK] Seq=91912 Ack=349996 Win=4095 Len=0"
"269","3.107632","23.39.213.4","192.168.1.166","TLSv1.2","484","Application Data"
"270","3.107632","23.39.213.4","192.168.1.166","TLSv1.2","448","Application Data"
"271","3.107656","192.168.1.166","23.39.213.4","TCP","54","52183  >  443 [ACK] Seq=91912 Ack=350820 Win=4092 Len=0"
"272","3.109135","23.39.213.4","192.168.1.166","TLSv1.2","484","Application Data"
"273","3.109135","23.39.213.4","192.168.1.166","TLSv1.2","639","Application Data"
"274","3.109159","192.168.1.166","23.39.213.4","TCP","54","52183  >  443 [ACK] Seq=91912 Ack=351835 Win=4095 Len=0"
"275","3.113745","192.168.1.166","23.39.213.4","TLSv1.2","5426","Application Data"
"276","3.113796","192.168.1.166","23.39.213.4","TLSv1.2","317","Application Data"
"277","3.146266","23.39.213.4","192.168.1.166","TCP","54","443  >  52183 [ACK] Seq=351835 Ack=97547 Win=11784 Len=0"
"278","3.174238","23.39.213.4","192.168.1.166","TLSv1.2","952","Application Data"
"279","3.174238","23.39.213.4","192.168.1.166","TCP","1514","443  >  52183 [ACK] Seq=352733 Ack=97547 Win=11805 Len=1460 [TCP PDU reassembled in 280]"
"280","3.174238","23.39.213.4","192.168.1.166","TLSv1.2","56","Application Data"
"281","3.174238","23.39.213.4","192.168.1.166","TLSv1.2","220","Application Data"
"282","3.174287","192.168.1.166","23.39.213.4","TCP","54","52183  >  443 [ACK] Seq=97547 Ack=354361 Win=4095 Len=0"
"283","3.188413","192.168.1.166","23.39.213.4","TLSv1.2","5543","Application Data"
"284","3.188449","192.168.1.166","23.39.213.4","TLSv1.2","411","Application Data"
"285","3.189096","192.168.1.166","23.39.213.4","TLSv1.2","5543","Application Data"
"286","3.189134","192.168.1.166","23.39.213.4","TLSv1.2","2030","Application Data"
"287","3.222112","23.39.213.4","192.168.1.166","TCP","54","443  >  52183 [ACK] Seq=354361 Ack=101927 Win=11785 Len=0"
"288","3.222112","23.39.213.4","192.168.1.166","TCP","54","443  >  52183 [ACK] Seq=354361 Ack=103393 Win=11798 Len=0"
"289","3.222112","23.39.213.4","192.168.1.166","TCP","54","443  >  52183 [ACK] Seq=354361 Ack=110858 Win=11768 Len=0"
"290","3.242580","23.39.213.4","192.168.1.166","TLSv1.2","957","Application Data"
"291","3.242580","23.39.213.4","192.168.1.166","TLSv1.2","244","Application Data"
"292","3.242601","192.168.1.166","23.39.213.4","TCP","54","52183  >  443 [ACK] Seq=110858 Ack=355454 Win=4091 Len=0"
"293","3.304978","23.39.213.4","192.168.1.166","TLSv1.2","954","Application Data"
"294","3.304978","23.39.213.4","192.168.1.166","TLSv1.2","504","Application Data"
"295","3.305006","192.168.1.166","23.39.213.4","TCP","54","52183  >  443 [ACK] Seq=110858 Ack=356804 Win=4095 Len=0"
"296","3.336693","192.168.1.166","23.39.213.4","TLSv1.2","5443","Application Data"
"297","3.336788","192.168.1.166","23.39.213.4","TLSv1.2","5436","Application Data"
"298","3.337098","23.39.213.4","192.168.1.166","TLSv1.2","951","Application Data"
"299","3.337098","23.39.213.4","192.168.1.166","TLSv1.2","1512","Application Data"
"300","3.337098","23.39.213.4","192.168.1.166","TCP","2974","443  >  52183 [ACK] Seq=359159 Ack=110858 Win=11805 Len=2920 [TCP PDU reassembled in 301]"
"301","3.337098","23.39.213.4","192.168.1.166","TLSv1.2","523","Application Data"
"302","3.337135","192.168.1.166","23.39.213.4","TCP","54","52183  >  443 [ACK] Seq=121629 Ack=362548 Win=4095 Len=0"
"303","3.345521","192.168.1.166","23.39.213.4","TLSv1.2","557","Application Data"
"304","3.345556","192.168.1.166","23.39.213.4","TLSv1.2","176","Application Data"
"305","3.345570","192.168.1.166","23.39.213.4","TLSv1.2","177","Application Data"
"306","3.345584","192.168.1.166","23.39.213.4","TLSv1.2","177","Application Data"
"307","3.371315","23.39.213.4","192.168.1.166","TCP","54","443  >  52183 [ACK] Seq=362548 Ack=116247 Win=11779 Len=0"
"308","3.371315","23.39.213.4","192.168.1.166","TCP","54","443  >  52183 [ACK] Seq=362548 Ack=119167 Win=11764 Len=0"
"309","3.371315","23.39.213.4","192.168.1.166","TCP","54","443  >  52183 [ACK] Seq=362548 Ack=121629 Win=11751 Len=0"
"310","3.388055","23.39.213.4","192.168.1.166","TCP","54","443  >  52183 [ACK] Seq=362548 Ack=122500 Win=11805 Len=0"
"311","3.402271","23.39.213.4","192.168.1.166","TLSv1.2","317","Application Data"
"312","3.402831","23.39.213.4","192.168.1.166","TCP","1514","443  >  52183 [ACK] Seq=362811 Ack=122500 Win=11805 Len=1460 [TCP PDU reassembled in 313]"
"313","3.402831","23.39.213.4","192.168.1.166","TLSv1.2","67","Application Data"
"314","3.402831","23.39.213.4","192.168.1.166","TCP","1514","443  >  52183 [ACK] Seq=364284 Ack=122500 Win=11805 Len=1460 [TCP PDU reassembled in 316]"
"315","3.402831","23.39.213.4","192.168.1.166","TCP","1514","443  >  52183 [ACK] Seq=365744 Ack=122500 Win=11805 Len=1460 [TCP PDU reassembled in 316]"
"316","3.402831","23.39.213.4","192.168.1.166","TLSv1.2","407","Application Data"
"317","3.402862","192.168.1.166","23.39.213.4","TCP","54","52183  >  443 [ACK] Seq=122500 Ack=367557 Win=4095 Len=0"
"318","3.408610","23.39.213.4","192.168.1.166","TLSv1.2","317","Application Data"
"319","3.408610","23.39.213.4","192.168.1.166","TCP","1514","443  >  52183 [ACK] Seq=367820 Ack=122500 Win=11805 Len=1460 [TCP PDU reassembled in 320]"
"320","3.408610","23.39.213.4","192.168.1.166","TLSv1.2","68","Application Data"
"321","3.408680","192.168.1.166","23.39.213.4","TCP","54","52183  >  443 [ACK] Seq=122500 Ack=369294 Win=4095 Len=0"
"322","3.414196","23.39.213.4","192.168.1.166","TLSv1.2","484","Application Data"
"323","3.414196","23.39.213.4","192.168.1.166","TCP","1514","443  >  52183 [ACK] Seq=369724 Ack=122500 Win=11805 Len=1460 [TCP PDU reassembled in 324]"
"324","3.414196","23.39.213.4","192.168.1.166","TLSv1.2","72","Application Data"
"325","3.414227","192.168.1.166","23.39.213.4","TCP","54","52183  >  443 [ACK] Seq=122500 Ack=371202 Win=4095 Len=0"
"326","3.426333","23.39.213.4","192.168.1.166","TCP","1514","443  >  52183 [ACK] Seq=371202 Ack=122500 Win=11805 Len=1460 [TCP PDU reassembled in 328]"
"327","3.426333","23.39.213.4","192.168.1.166","TCP","1514","443  >  52183 [ACK] Seq=372662 Ack=122500 Win=11805 Len=1460 [TCP PDU reassembled in 328]"
"328","3.426333","23.39.213.4","192.168.1.166","TLSv1.2","822","Application Data"
"329","3.426377","192.168.1.166","23.39.213.4","TCP","54","52183  >  443 [ACK] Seq=122500 Ack=374890 Win=4095 Len=0"
"330","3.438177","23.39.213.4","192.168.1.166","TLSv1.2","485","Application Data"
"331","3.438177","23.39.213.4","192.168.1.166","TCP","1514","443  >  52183 [ACK] Seq=375321 Ack=122500 Win=11805 Len=1460 [TCP PDU reassembled in 332]"
"332","3.438177","23.39.213.4","192.168.1.166","TLSv1.2","524","Application Data"
"333","3.438218","192.168.1.166","23.39.213.4","TCP","54","52183  >  443 [ACK] Seq=122500 Ack=377251 Win=4095 Len=0"
"334","3.438976","23.39.213.4","192.168.1.166","TLSv1.2","317","Application Data"
"335","3.438976","23.39.213.4","192.168.1.166","TCP","1514","443  >  52183 [ACK] Seq=377514 Ack=122500 Win=11805 Len=1460 [TCP PDU reassembled in 336]"
"336","3.438976","23.39.213.4","192.168.1.166","TLSv1.2","68","Application Data"
"337","3.438976","23.39.213.4","192.168.1.166","TCP","2974","443  >  52183 [ACK] Seq=378988 Ack=122500 Win=11805 Len=2920 [TCP PDU reassembled in 338]"
"338","3.438976","23.39.213.4","192.168.1.166","TLSv1.2","822","Application Data"
"339","3.439022","192.168.1.166","23.39.213.4","TCP","54","52183  >  443 [ACK] Seq=122500 Ack=382676 Win=4095 Len=0"
"340","3.451601","192.168.1.166","23.39.213.4","TLSv1.2","5487","Application Data"
"341","3.451644","192.168.1.166","23.39.213.4","TLSv1.2","3804","Application Data"
"342","3.454467","192.168.1.166","23.39.213.4","TLSv1.2","5736","Application Data"
"343","3.454501","192.168.1.166","23.39.213.4","TLSv1.2","3961","Application Data"
"344","3.469620","192.168.1.166","23.39.213.4","TLSv1.2","5543","Application Data"
"345","3.469780","192.168.1.166","23.39.213.4","TLSv1.2","5544","Application Data"
"346","3.469825","192.168.1.166","23.39.213.4","TLSv1.2","487","Application Data"
"347","3.469862","192.168.1.166","23.39.213.4","TLSv1.2","382","Application Data"
"348","3.471103","192.168.1.166","23.39.213.4","TLSv1.2","5544","Application Data"
"349","3.471209","192.168.1.166","23.39.213.4","TLSv1.2","5544","Application Data"
"350","3.471294","192.168.1.166","23.39.213.4","TLSv1.2","5544","Application Data"
"351","3.471325","192.168.1.166","23.39.213.4","TLSv1.2","2959","Application Data"
"352","3.471342","192.168.1.166","23.39.213.4","TLSv1.2","579","Application Data"
"353","3.471356","192.168.1.166","23.39.213.4","TLSv1.2","579","Application Data"
"354","3.484346","23.39.213.4","192.168.1.166","TCP","54","443  >  52183 [ACK] Seq=382676 Ack=126880 Win=11785 Len=0"
"355","3.484346","23.39.213.4","192.168.1.166","TCP","54","443  >  52183 [ACK] Seq=382676 Ack=129393 Win=11772 Len=0"
"356","3.484346","23.39.213.4","192.168.1.166","TCP","54","443  >  52183 [ACK] Seq=382676 Ack=131683 Win=11759 Len=0"
"357","3.486399","23.39.213.4","192.168.1.166","TCP","54","443  >  52183 [ACK] Seq=382676 Ack=136063 Win=11793 Len=0"
"358","3.486399","23.39.213.4","192.168.1.166","TCP","54","443  >  52183 [ACK] Seq=382676 Ack=138825 Win=11800 Len=0"
"359","3.486399","23.39.213.4","192.168.1.166","TCP","54","443  >  52183 [ACK] Seq=382676 Ack=141272 Win=11805 Len=0"
"360","3.494941","192.168.1.166","23.39.213.4","TLSv1.2","5544","Application Data"
"361","3.495036","192.168.1.166","23.39.213.4","TLSv1.2","898","Application Data"
"362","3.501390","23.39.213.4","192.168.1.166","TCP","54","443  >  52183 [ACK] Seq=382676 Ack=144192 Win=11800 Len=0"
"363","3.501390","23.39.213.4","192.168.1.166","TCP","54","443  >  52183 [ACK] Seq=382676 Ack=146761 Win=11801 Len=0"
"364","3.501390","23.39.213.4","192.168.1.166","TCP","54","443  >  52183 [ACK] Seq=382676 Ack=153012 Win=11772 Len=0"
"365","3.507199","23.39.213.4","192.168.1.166","TCP","54","443  >  52183 [ACK] Seq=382676 Ack=155932 Win=11800 Len=0"
"366","3.507199","23.39.213.4","192.168.1.166","TCP","54","443  >  52183 [ACK] Seq=382676 Ack=158502 Win=11801 Len=0"
"367","3.507199","23.39.213.4","192.168.1.166","TCP","54","443  >  52183 [ACK] Seq=382676 Ack=161422 Win=11793 Len=0"
"368","3.507199","23.39.213.4","192.168.1.166","TCP","54","443  >  52183 [ACK] Seq=382676 Ack=163992 Win=11805 Len=0"
"369","3.515576","23.39.213.4","192.168.1.166","TLSv1.2","361","Application Data"
"370","3.515576","23.39.213.4","192.168.1.166","TLSv1.2","289","Application Data"
"371","3.515612","192.168.1.166","23.39.213.4","TCP","54","52183  >  443 [ACK] Seq=179771 Ack=383218 Win=4093 Len=0"
"372","3.527308","23.39.213.4","192.168.1.166","TCP","54","443  >  52183 [ACK] Seq=383218 Ack=176357 Win=11793 Len=0"
"373","3.529914","192.168.1.166","23.39.213.4","TLSv1.2","5503","Application Data"
"374","3.529970","192.168.1.166","23.39.213.4","TLSv1.2","186","Application Data"
"375","3.530629","23.39.213.4","192.168.1.166","TLSv1.2","361","Application Data"
"376","3.530629","23.39.213.4","192.168.1.166","TLSv1.2","289","Application Data"
"377","3.530650","192.168.1.166","23.39.213.4","TCP","54","52183  >  443 [ACK] Seq=185352 Ack=383760 Win=4091 Len=0"
"378","3.548050","23.39.213.4","192.168.1.166","TLSv1.2","2974","Application Data, Application Data"
"379","3.548091","192.168.1.166","23.39.213.4","TCP","54","52183  >  443 [ACK] Seq=185352 Ack=386680 Win=4095 Len=0"
"380","3.557049","192.168.1.166","23.39.213.4","TLSv1.2","5544","Application Data"
"381","3.557114","192.168.1.166","23.39.213.4","TLSv1.2","726","Application Data"
"382","3.563129","23.39.213.4","192.168.1.166","TCP","54","443  >  52183 [ACK] Seq=386680 Ack=182691 Win=11805 Len=0"
"383","3.563129","23.39.213.4","192.168.1.166","TCP","54","443  >  52183 [ACK] Seq=386680 Ack=185220 Win=11805 Len=0"
"384","3.565250","23.39.213.4","192.168.1.166","TCP","1514","443  >  52183 [ACK] Seq=386680 Ack=185352 Win=11805 Len=1460 [TCP PDU reassembled in 385]"
"385","3.565250","23.39.213.4","192.168.1.166","TLSv1.2","945","Application Data"
"386","3.565284","192.168.1.166","23.39.213.4","TCP","54","52183  >  443 [ACK] Seq=191514 Ack=389031 Win=4095 Len=0"
"387","3.589286","23.39.213.4","192.168.1.166","TCP","54","443  >  52183 [ACK] Seq=389031 Ack=188272 Win=11793 Len=0"
"388","3.589286","23.39.213.4","192.168.1.166","TCP","54","443  >  52183 [ACK] Seq=389031 Ack=190842 Win=11801 Len=0"
"389","3.606409","23.39.213.4","192.168.1.166","TLSv1.2","940","Application Data"
"390","3.606409","23.39.213.4","192.168.1.166","TLSv1.2","778","Application Data"
"391","3.606453","192.168.1.166","23.39.213.4","TCP","54","52183  >  443 [ACK] Seq=191514 Ack=390641 Win=4095 Len=0"
"392","3.613939","23.39.213.4","192.168.1.166","TLSv1.2","955","Application Data"
"393","3.613939","23.39.213.4","192.168.1.166","TCP","1514","443  >  52183 [ACK] Seq=391542 Ack=191514 Win=11805 Len=1460 [TCP PDU reassembled in 397]"
