"No.","Time","Source","Destination","Protocol","Length","Info"
"1","0.000000","192.168.1.166","23.198.241.2","TLSv1.2","5705","Application Data"
"2","0.000033","192.168.1.166","23.198.241.2","TLSv1.2","1173","Application Data"
"3","0.001462","192.168.1.166","23.198.241.2","TLSv1.2","5705","Application Data"
"4","0.001505","192.168.1.166","23.198.241.2","TLSv1.2","538","Application Data"
"5","0.015569","192.168.1.166","23.198.241.2","TLSv1.2","5658","Application Data"
"6","0.035253","23.198.241.2","192.168.1.166","TCP","54","443  >  58685 [ACK] Seq=1 Ack=2921 Win=14805 Len=0"
"7","0.038048","23.198.241.2","192.168.1.166","TCP","54","443  >  58685 [ACK] Seq=1 Ack=5652 Win=14806 Len=0"
"8","0.038048","23.198.241.2","192.168.1.166","TCP","54","443  >  58685 [ACK] Seq=1 Ack=6771 Win=14814 Len=0"
"9","0.038048","23.198.241.2","192.168.1.166","TCP","54","443  >  58685 [ACK] Seq=1 Ack=8231 Win=14806 Len=0"
"10","0.038048","23.198.241.2","192.168.1.166","TCP","54","443  >  58685 [ACK] Seq=1 Ack=12422 Win=14784 Len=0"
"11","0.038048","23.198.241.2","192.168.1.166","TCP","54","443  >  58685 [ACK] Seq=1 Ack=12906 Win=14781 Len=0"
"12","0.049880","23.198.241.2","192.168.1.166","TCP","54","443  >  58685 [ACK] Seq=1 Ack=14366 Win=14812 Len=0"
"13","0.049880","23.198.241.2","192.168.1.166","TCP","54","443  >  58685 [ACK] Seq=1 Ack=15826 Win=14812 Len=0"
"14","0.049880","23.198.241.2","192.168.1.166","TCP","54","443  >  58685 [ACK] Seq=1 Ack=17286 Win=14812 Len=0"
"15","0.049880","23.198.241.2","192.168.1.166","TCP","54","443  >  58685 [ACK] Seq=1 Ack=18510 Win=14813 Len=0"
"16","0.100459","23.198.241.2","192.168.1.166","TLSv1.2","473","Application Data"
"17","0.100459","23.198.241.2","192.168.1.166","TLSv1.2","116","Application Data"
"18","0.100459","23.198.241.2","192.168.1.166","TLSv1.2","473","Application Data"
"19","0.100459","23.198.241.2","192.168.1.166","TLSv1.2","116","Application Data"
"20","0.100490","192.168.1.166","23.198.241.2","TCP","54","58685  >  443 [ACK] Seq=18510 Ack=963 Win=8191 Len=0"
"21","0.101266","192.168.1.166","23.198.241.2","TLSv1.2","89","Application Data"
"22","0.109759","23.198.241.2","192.168.1.166","TLSv1.2","328","Application Data"
"23","0.109759","23.198.241.2","192.168.1.166","TLSv1.2","841","Application Data"
"24","0.109786","192.168.1.166","23.198.241.2","TCP","54","58685  >  443 [ACK] Seq=18545 Ack=2024 Win=8187 Len=0"
"25","0.128190","23.198.241.2","192.168.1.166","TCP","54","443  >  58685 [ACK] Seq=2024 Ack=18545 Win=14815 Len=0"
"26","0.812564","192.168.1.166","23.198.241.2","TLSv1.2","5774","Application Data"
"27","0.841427","23.198.241.2","192.168.1.166","TCP","54","443  >  58685 [ACK] Seq=2024 Ack=20005 Win=14812 Len=0"
"28","0.841427","23.198.241.2","192.168.1.166","TCP","54","443  >  58685 [ACK] Seq=2024 Ack=21465 Win=14812 Len=0"
"29","0.841427","23.198.241.2","192.168.1.166","TCP","54","443  >  58685 [ACK] Seq=2024 Ack=24265 Win=14805 Len=0"
"30","0.913624","23.198.241.2","192.168.1.166","TLSv1.2","429","Application Data"
"31","0.913624","23.198.241.2","192.168.1.166","TLSv1.2","1194","Application Data"
"32","0.913658","192.168.1.166","23.198.241.2","TCP","54","58685  >  443 [ACK] Seq=24265 Ack=3539 Win=8191 Len=0"
"33","0.917262","192.168.1.166","23.198.241.2","TLSv1.2","5775","Application Data"
"34","0.944543","23.198.241.2","192.168.1.166","TCP","54","443  >  58685 [ACK] Seq=3539 Ack=27185 Win=14805 Len=0"
"35","0.944543","23.198.241.2","192.168.1.166","TCP","54","443  >  58685 [ACK] Seq=3539 Ack=29986 Win=14790 Len=0"
"36","0.995217","23.198.241.2","192.168.1.166","TLSv1.2","429","Application Data"
"37","0.995217","23.198.241.2","192.168.1.166","TLSv1.2","1118","Application Data"
"38","0.995242","192.168.1.166","23.198.241.2","TCP","54","58685  >  443 [ACK] Seq=29986 Ack=4978 Win=8186 Len=0"
"39","0.998413","192.168.1.166","23.198.241.2","TLSv1.2","5726","Application Data"
"40","1.025110","23.198.241.2","192.168.1.166","TCP","54","443  >  58685 [ACK] Seq=4978 Ack=31446 Win=14812 Len=0"
"41","1.025110","23.198.241.2","192.168.1.166","TCP","54","443  >  58685 [ACK] Seq=4978 Ack=32906 Win=14812 Len=0"
"42","1.045244","23.198.241.2","192.168.1.166","TCP","54","443  >  58685 [ACK] Seq=4978 Ack=35658 Win=14805 Len=0"
"43","1.099124","23.198.241.2","192.168.1.166","TLSv1.2","429","Application Data"
"44","1.099124","23.198.241.2","192.168.1.166","TLSv1.2","1032","Application Data"
"45","1.099147","192.168.1.166","23.198.241.2","TCP","54","58685  >  443 [ACK] Seq=35658 Ack=6331 Win=8191 Len=0"
"46","1.107614","192.168.1.166","23.198.241.2","TLSv1.2","558","Application Data"
"47","1.107665","192.168.1.166","23.198.241.2","TLSv1.2","190","Application Data"
"48","1.107692","192.168.1.166","23.198.241.2","TLSv1.2","176","Application Data"
"49","1.107718","192.168.1.166","23.198.241.2","TLSv1.2","178","Application Data"
"50","1.107781","192.168.1.166","23.198.241.2","TLSv1.2","176","Application Data"
"51","1.108201","192.168.1.166","23.198.241.2","TLSv1.2","90","Application Data"
"52","1.108240","192.168.1.166","23.198.241.2","TLSv1.2","90","Application Data"
"53","1.108287","192.168.1.166","23.198.241.2","TLSv1.2","90","Application Data"
"54","1.108310","192.168.1.166","23.198.241.2","TLSv1.2","90","Application Data"
"55","1.125391","192.168.1.166","23.198.241.2","TLSv1.2","5507","Application Data"
"56","1.135808","23.198.241.2","192.168.1.166","TCP","54","443  >  58685 [ACK] Seq=6331 Ack=36162 Win=14815 Len=0"
"57","1.135808","23.198.241.2","192.168.1.166","TCP","54","443  >  58685 [ACK] Seq=6331 Ack=36298 Win=14814 Len=0"
"58","1.135808","23.198.241.2","192.168.1.166","TCP","54","443  >  58685 [ACK] Seq=6331 Ack=36420 Win=14814 Len=0"
"59","1.137231","192.168.1.166","23.198.241.2","TLSv1.2","5919","Application Data"
"60","1.143987","23.198.241.2","192.168.1.166","TLSv1.2","317","Application Data"
"61","1.143987","23.198.241.2","192.168.1.166","TCP","1514","443  >  58685 [ACK] Seq=6594 Ack=36420 Win=14815 Len=1460 [TCP PDU reassembled in 62]"
"62","1.143987","23.198.241.2","192.168.1.166","TLSv1.2","91","Application Data"
"63","1.143987","23.198.241.2","192.168.1.166","TLSv1.2","972","Application Data, Application Data"
"64","1.144017","192.168.1.166","23.198.241.2","TCP","54","58685  >  443 [ACK] Seq=48128 Ack=9009 Win=8191 Len=0"
"65","1.150043","23.198.241.2","192.168.1.166","TCP","54","443  >  58685 [ACK] Seq=9009 Ack=36666 Win=14815 Len=0"
"66","1.150043","23.198.241.2","192.168.1.166","TCP","54","443  >  58685 [ACK] Seq=9009 Ack=36810 Win=14815 Len=0"
"67","1.152062","23.198.241.2","192.168.1.166","TCP","54","443  >  58685 [ACK] Seq=9009 Ack=39730 Win=14805 Len=0"
"68","1.152062","23.198.241.2","192.168.1.166","TCP","54","443  >  58685 [ACK] Seq=9009 Ack=42263 Win=14814 Len=0"
"69","1.170810","23.198.241.2","192.168.1.166","TLSv1.2","317","Application Data"
"70","1.170810","23.198.241.2","192.168.1.166","TLSv1.2","1279","Application Data"
"71","1.170810","23.198.241.2","192.168.1.166","TLSv1.2","1514","Application Data"
"72","1.170810","23.198.241.2","192.168.1.166","TLSv1.2","172","Application Data"
"73","1.170849","192.168.1.166","23.198.241.2","TCP","54","58685  >  443 [ACK] Seq=48128 Ack=12075 Win=8191 Len=0"
"74","1.194485","23.198.241.2","192.168.1.166","TLSv1.2","356","Application Data"
"75","1.194485","23.198.241.2","192.168.1.166","TLSv1.2","342","Application Data"
"76","1.194510","192.168.1.166","23.198.241.2","TCP","54","58685  >  443 [ACK] Seq=48128 Ack=12665 Win=8189 Len=0"
"77","1.203088","23.198.241.2","192.168.1.166","TLSv1.2","429","Application Data"
"78","1.203088","23.198.241.2","192.168.1.166","TLSv1.2","1105","Application Data"
"79","1.203113","192.168.1.166","23.198.241.2","TCP","54","58685  >  443 [ACK] Seq=48128 Ack=14091 Win=8191 Len=0"
"80","1.251821","23.198.241.2","192.168.1.166","TLSv1.2","317","Application Data"
"81","1.251821","23.198.241.2","192.168.1.166","TLSv1.2","1407","Application Data"
"82","1.251855","192.168.1.166","23.198.241.2","TCP","54","58685  >  443 [ACK] Seq=48128 Ack=15707 Win=8191 Len=0"
"83","1.398358","192.168.1.166","23.198.241.2","TLSv1.2","5776","Application Data"
"84","1.425724","23.198.241.2","192.168.1.166","TCP","54","443  >  58685 [ACK] Seq=15707 Ack=51048 Win=14805 Len=0"
"85","1.425724","23.198.241.2","192.168.1.166","TCP","54","443  >  58685 [ACK] Seq=15707 Ack=53850 Win=14805 Len=0"
"86","1.488586","23.198.241.2","192.168.1.166","TLSv1.2","429","Application Data"
"87","1.488586","23.198.241.2","192.168.1.166","TLSv1.2","1087","Application Data"
"88","1.488618","192.168.1.166","23.198.241.2","TCP","54","58685  >  443 [ACK] Seq=53850 Ack=17115 Win=8186 Len=0"
"89","1.493186","192.168.1.166","23.198.241.2","TLSv1.2","5777","Application Data"
"90","1.523500","23.198.241.2","192.168.1.166","TCP","54","443  >  58685 [ACK] Seq=17115 Ack=59573 Win=14815 Len=0"
"91","1.573416","23.198.241.2","192.168.1.166","TLSv1.2","429","Application Data"
"92","1.573416","23.198.241.2","192.168.1.166","TLSv1.2","1041","Application Data"
"93","1.573448","192.168.1.166","23.198.241.2","TCP","54","58685  >  443 [ACK] Seq=59573 Ack=18477 Win=8191 Len=0"
"94","1.747395","192.168.1.166","23.198.241.2","TLSv1.2","5777","Application Data"
"95","1.774230","23.198.241.2","192.168.1.166","TCP","54","443  >  58685 [ACK] Seq=18477 Ack=62493 Win=14815 Len=0"
"96","1.774230","23.198.241.2","192.168.1.166","TCP","54","443  >  58685 [ACK] Seq=18477 Ack=65296 Win=14815 Len=0"
"97","1.826001","23.198.241.2","192.168.1.166","TLSv1.2","429","Application Data"
"98","1.826001","23.198.241.2","192.168.1.166","TLSv1.2","1041","Application Data"
"99","1.826027","192.168.1.166","23.198.241.2","TCP","54","58685  >  443 [ACK] Seq=65296 Ack=19839 Win=8186 Len=0"
"100","1.981977","192.168.1.166","23.198.241.2","TLSv1.2","5778","Application Data"
"101","2.008112","23.198.241.2","192.168.1.166","TCP","54","443  >  58685 [ACK] Seq=19839 Ack=68216 Win=14805 Len=0"
"102","2.008112","23.198.241.2","192.168.1.166","TCP","54","443  >  58685 [ACK] Seq=19839 Ack=71020 Win=14813 Len=0"
"103","2.059530","23.198.241.2","192.168.1.166","TLSv1.2","429","Application Data"
"104","2.059530","23.198.241.2","192.168.1.166","TLSv1.2","1042","Application Data"
"105","2.059558","192.168.1.166","23.198.241.2","TCP","54","58685  >  443 [ACK] Seq=71020 Ack=21202 Win=8191 Len=0"
"106","2.098292","192.168.1.166","23.198.241.2","TLSv1.2","5904","Application Data"
"107","2.098346","192.168.1.166","23.198.241.2","TLSv1.2","1077","Application Data"
"108","2.125063","23.198.241.2","192.168.1.166","TCP","54","443  >  58685 [ACK] Seq=21202 Ack=75400 Win=14815 Len=0"
"109","2.125063","23.198.241.2","192.168.1.166","TCP","54","443  >  58685 [ACK] Seq=21202 Ack=77893 Win=14805 Len=0"
"110","2.169606","192.168.1.166","23.198.241.2","TLSv1.2","5779","Application Data"
"111","2.194594","23.198.241.2","192.168.1.166","TLSv1.2","361","Application Data"
"112","2.194594","23.198.241.2","192.168.1.166","TLSv1.2","290","Application Data"
"113","2.194620","192.168.1.166","23.198.241.2","TCP","54","58685  >  443 [ACK] Seq=83618 Ack=21745 Win=8189 Len=0"
"114","2.212583","23.198.241.2","192.168.1.166","TCP","54","443  >  58685 [ACK] Seq=21745 Ack=80813 Win=14805 Len=0"
"115","2.212583","23.198.241.2","192.168.1.166","TCP","54","443  >  58685 [ACK] Seq=21745 Ack=83618 Win=14813 Len=0"
"116","2.273166","23.198.241.2","192.168.1.166","TLSv1.2","429","Application Data"
"117","2.273166","23.198.241.2","192.168.1.166","TLSv1.2","1043","Application Data"
"118","2.273199","192.168.1.166","23.198.241.2","TCP","54","58685  >  443 [ACK] Seq=83618 Ack=23109 Win=8191 Len=0"
"119","2.276498","192.168.1.166","23.198.241.2","TLSv1.2","5779","Application Data"
"120","2.304369","23.198.241.2","192.168.1.166","TCP","54","443  >  58685 [ACK] Seq=23109 Ack=86538 Win=14805 Len=0"
"121","2.304369","23.198.241.2","192.168.1.166","TCP","54","443  >  58685 [ACK] Seq=23109 Ack=89343 Win=14813 Len=0"
"122","2.353794","23.198.241.2","192.168.1.166","TLSv1.2","429","Application Data"
"123","2.353794","23.198.241.2","192.168.1.166","TLSv1.2","1043","Application Data"
"124","2.353818","192.168.1.166","23.198.241.2","TCP","54","58685  >  443 [ACK] Seq=89343 Ack=24473 Win=8186 Len=0"
"125","2.452846","192.168.1.166","23.198.241.2","TLSv1.2","5780","Application Data"
"126","2.480119","23.198.241.2","192.168.1.166","TCP","54","443  >  58685 [ACK] Seq=24473 Ack=92263 Win=14815 Len=0"
"127","2.480119","23.198.241.2","192.168.1.166","TCP","54","443  >  58685 [ACK] Seq=24473 Ack=95069 Win=14815 Len=0"
"128","2.528571","23.198.241.2","192.168.1.166","TLSv1.2","429","Application Data"
"129","2.528571","23.198.241.2","192.168.1.166","TLSv1.2","1000","Application Data"
"130","2.528591","192.168.1.166","23.198.241.2","TCP","54","58685  >  443 [ACK] Seq=95069 Ack=25794 Win=8191 Len=0"
"131","2.605574","192.168.1.166","23.198.241.2","TLSv1.2","5724","Application Data"
"132","2.605613","192.168.1.166","23.198.241.2","TLSv1.2","2098","Application Data"
"133","2.631370","23.198.241.2","192.168.1.166","TCP","54","443  >  58685 [ACK] Seq=25794 Ack=102783 Win=14787 Len=0"
"134","2.646890","23.198.241.2","192.168.1.166","TLSv1.2","374","Application Data"
"135","2.646890","23.198.241.2","192.168.1.166","TLSv1.2","85","Application Data"
"136","2.646906","192.168.1.166","23.198.241.2","TCP","54","58685  >  443 [ACK] Seq=102783 Ack=26145 Win=8190 Len=0"
"137","2.687157","192.168.1.166","23.198.241.2","TLSv1.2","5978","Application Data"
"138","2.712984","23.198.241.2","192.168.1.166","TCP","54","443  >  58685 [ACK] Seq=26145 Ack=108707 Win=14815 Len=0"
"139","4.811268","23.198.241.2","192.168.1.166","TCP","1514","443  >  58685 [ACK] Seq=26145 Ack=108707 Win=14815 Len=1460 [TCP PDU reassembled in 140]"
"140","4.811268","23.198.241.2","192.168.1.166","TLSv1.2","70","Application Data"
"141","4.811268","23.198.241.2","192.168.1.166","TCP","16114","443  >  58685 [ACK] Seq=27621 Ack=108707 Win=14815 Len=16060 [TCP PDU reassembled in 142]"
"142","4.811268","23.198.241.2","192.168.1.166","TLSv1.2","400","Application Data"
"143","4.811268","23.198.241.2","192.168.1.166","TLSv1.2","85","Application Data"
"144","4.811268","23.198.241.2","192.168.1.166","TCP","16114","443  >  58685 [ACK] Seq=44058 Ack=108707 Win=14815 Len=16060 [TCP PDU reassembled in 145]"
"145","4.811268","23.198.241.2","192.168.1.166","TLSv1.2","400","Application Data"
"146","4.811268","23.198.241.2","192.168.1.166","TLSv1.2","7354","Application Data"
"147","4.811268","23.198.241.2","192.168.1.166","TLSv1.2","1309","Application Data"
"148","4.811268","23.198.241.2","192.168.1.166","TCP","4434","443  >  58685 [ACK] Seq=69019 Ack=108707 Win=14815 Len=4380 [TCP PDU reassembled in 149]"
"149","4.811268","23.198.241.2","192.168.1.166","TLSv1.2","935","Application Data"
"150","4.811336","192.168.1.166","23.198.241.2","TCP","54","58685  >  443 [ACK] Seq=108707 Ack=74280 Win=8191 Len=0"
"151","4.814994","23.198.241.2","192.168.1.166","TCP","1514","443  >  58685 [ACK] Seq=74280 Ack=108707 Win=14815 Len=1460 [TCP PDU reassembled in 162]"
"152","4.814994","23.198.241.2","192.168.1.166","TCP","1514","443  >  58685 [ACK] Seq=75740 Ack=108707 Win=14815 Len=1460 [TCP PDU reassembled in 162]"
"153","4.814994","23.198.241.2","192.168.1.166","TCP","1514","443  >  58685 [ACK] Seq=77200 Ack=108707 Win=14815 Len=1460 [TCP PDU reassembled in 162]"
"154","4.814994","23.198.241.2","192.168.1.166","TCP","1514","443  >  58685 [ACK] Seq=78660 Ack=108707 Win=14815 Len=1460 [TCP PDU reassembled in 162]"
"155","4.814994","23.198.241.2","192.168.1.166","TCP","1514","443  >  58685 [ACK] Seq=80120 Ack=108707 Win=14815 Len=1460 [TCP PDU reassembled in 162]"
"156","4.814994","23.198.241.2","192.168.1.166","TCP","1514","443  >  58685 [ACK] Seq=81580 Ack=108707 Win=14815 Len=1460 [TCP PDU reassembled in 162]"
"157","4.814994","23.198.241.2","192.168.1.166","TCP","1514","443  >  58685 [ACK] Seq=83040 Ack=108707 Win=14815 Len=1460 [TCP PDU reassembled in 162]"
"158","4.814994","23.198.241.2","192.168.1.166","TCP","1514","443  >  58685 [ACK] Seq=84500 Ack=108707 Win=14815 Len=1460 [TCP PDU reassembled in 162]"
"159","4.814994","23.198.241.2","192.168.1.166","TCP","1514","443  >  58685 [ACK] Seq=85960 Ack=108707 Win=14815 Len=1460 [TCP PDU reassembled in 162]"
"160","4.814994","23.198.241.2","192.168.1.166","TCP","1514","443  >  58685 [ACK] Seq=87420 Ack=108707 Win=14815 Len=1460 [TCP PDU reassembled in 162]"
"161","4.814994","23.198.241.2","192.168.1.166","TCP","1514","443  >  58685 [ACK] Seq=88880 Ack=108707 Win=14815 Len=1460 [TCP PDU reassembled in 162]"
"162","4.814994","23.198.241.2","192.168.1.166","TLSv1.2","400","Application Data"
"163","4.814994","23.198.241.2","192.168.1.166","TLSv1.2","85","Application Data"
"164","4.814994","23.198.241.2","192.168.1.166","TCP","1514","443  >  58685 [ACK] Seq=90717 Ack=108707 Win=14815 Len=1460 [TCP PDU reassembled in 169]"
"165","4.814994","23.198.241.2","192.168.1.166","TCP","1514","443  >  58685 [ACK] Seq=92177 Ack=108707 Win=14815 Len=1460 [TCP PDU reassembled in 169]"
"166","4.814994","23.198.241.2","192.168.1.166","TCP","1514","443  >  58685 [ACK] Seq=93637 Ack=108707 Win=14815 Len=1460 [TCP PDU reassembled in 169]"
"167","4.814994","23.198.241.2","192.168.1.166","TCP","1514","443  >  58685 [ACK] Seq=95097 Ack=108707 Win=14815 Len=1460 [TCP PDU reassembled in 169]"
"168","4.814994","23.198.241.2","192.168.1.166","TCP","1514","443  >  58685 [ACK] Seq=96557 Ack=108707 Win=14815 Len=1460 [TCP PDU reassembled in 169]"
"169","4.814994","23.198.241.2","192.168.1.166","TLSv1.2","819","Application Data"
"170","4.815063","192.168.1.166","23.198.241.2","TCP","54","58685  >  443 [ACK] Seq=108707 Ack=98782 Win=8191 Len=0"
"171","4.817585","192.168.1.166","23.198.241.2","TLSv1.2","5973","Application Data"
"172","4.817623","192.168.1.166","23.198.241.2","TLSv1.2","1236","Application Data"
"173","4.819112","23.198.241.2","192.168.1.166","TCP","16114","443  >  58685 [ACK] Seq=98782 Ack=108707 Win=14815 Len=16060 [TCP PDU reassembled in 174]"
"174","4.819112","23.198.241.2","192.168.1.166","TLSv1.2","400","Application Data"
"175","4.819112","23.198.241.2","192.168.1.166","TLSv1.2","85","Application Data"
"176","4.819112","23.198.241.2","192.168.1.166","TCP","11734","443  >  58685 [ACK] Seq=115219 Ack=108707 Win=14815 Len=11680 [TCP PDU reassembled in 177]"
"177","4.819112","23.198.241.2","192.168.1.166","TLSv1.2","1189","Application Data"
"178","4.819161","192.168.1.166","23.198.241.2","TCP","54","58685  >  443 [ACK] Seq=115808 Ack=128034 Win=8191 Len=0"
"179","4.846788","192.168.1.166","23.198.241.2","TLSv1.2","553","Application Data"
"180","4.846829","192.168.1.166","23.198.241.2","TLSv1.2","182","Application Data"
"181","4.876127","23.198.241.2","192.168.1.166","TCP","1514","443  >  58685 [ACK] Seq=128034 Ack=108707 Win=14815 Len=1460 [TCP PDU reassembled in 190]"
"182","4.876127","23.198.241.2","192.168.1.166","TCP","1514","443  >  58685 [ACK] Seq=129494 Ack=108707 Win=14815 Len=1460 [TCP PDU reassembled in 190]"
"183","4.876127","23.198.241.2","192.168.1.166","TCP","1514","443  >  58685 [ACK] Seq=130954 Ack=108707 Win=14815 Len=1460 [TCP PDU reassembled in 190]"
"184","4.876127","23.198.241.2","192.168.1.166","TCP","1514","443  >  58685 [ACK] Seq=132414 Ack=108707 Win=14815 Len=1460 [TCP PDU reassembled in 190]"
"185","4.876127","23.198.241.2","192.168.1.166","TCP","1514","443  >  58685 [ACK] Seq=133874 Ack=108707 Win=14815 Len=1460 [TCP PDU reassembled in 190]"
"186","4.876127","23.198.241.2","192.168.1.166","TCP","1514","443  >  58685 [ACK] Seq=135334 Ack=108707 Win=14815 Len=1460 [TCP PDU reassembled in 190]"
"187","4.876127","23.198.241.2","192.168.1.166","TCP","1514","443  >  58685 [ACK] Seq=136794 Ack=108707 Win=14815 Len=1460 [TCP PDU reassembled in 190]"
"188","4.876127","23.198.241.2","192.168.1.166","TCP","1514","443  >  58685 [ACK] Seq=138254 Ack=108707 Win=14815 Len=1460 [TCP PDU reassembled in 190]"
"189","4.876127","23.198.241.2","192.168.1.166","TCP","1514","443  >  58685 [ACK] Seq=139714 Ack=108707 Win=14815 Len=1460 [TCP PDU reassembled in 190]"
"190","4.876127","23.198.241.2","192.168.1.166","TLSv1.2","1238","Application Data"
"191","4.876127","23.198.241.2","192.168.1.166","TLSv1.2","93","Application Data"
"192","4.876127","23.198.241.2","192.168.1.166","TLSv1.2","85","Application Data"
"193","4.876127","23.198.241.2","192.168.1.166","TCP","54","443  >  58685 [ACK] Seq=142428 Ack=111627 Win=14805 Len=0"
"194","4.876127","23.198.241.2","192.168.1.166","TCP","54","443  >  58685 [ACK] Seq=142428 Ack=114626 Win=14810 Len=0"
"195","4.876197","192.168.1.166","23.198.241.2","TCP","54","58685  >  443 [ACK] Seq=116435 Ack=142428 Win=8191 Len=0"
"196","4.880635","23.198.241.2","192.168.1.166","TLSv1.2","365","Application Data"
"197","4.880635","23.198.241.2","192.168.1.166","TLSv1.2","159","Application Data"
"198","4.880666","192.168.1.166","23.198.241.2","TCP","54","58685  >  443 [ACK] Seq=116435 Ack=142844 Win=8190 Len=0"
"199","4.908554","23.198.241.2","192.168.1.166","TCP","54","443  >  58685 [ACK] Seq=142844 Ack=116435 Win=14815 Len=0"
"200","4.918789","23.198.241.2","192.168.1.166","TLSv1.2","346","Application Data"
"201","4.918789","23.198.241.2","192.168.1.166","TLSv1.2","1274","Application Data"
"202","4.918789","23.198.241.2","192.168.1.166","TLSv1.2","1514","Application Data"
"203","4.918789","23.198.241.2","192.168.1.166","TLSv1.2","574","Application Data"
"204","4.918831","192.168.1.166","23.198.241.2","TCP","54","58685  >  443 [ACK] Seq=116435 Ack=146336 Win=8191 Len=0"
"205","4.920601","192.168.1.166","23.198.241.2","TLSv1.2","167","Application Data"
"206","4.923336","192.168.1.166","23.198.241.2","TLSv1.2","180","Application Data"
"207","4.955787","23.198.241.2","192.168.1.166","TCP","54","443  >  58685 [ACK] Seq=146336 Ack=116674 Win=14815 Len=0"
"208","4.962571","23.198.241.2","192.168.1.166","TLSv1.2","338","Application Data"
"209","4.962571","23.198.241.2","192.168.1.166","TCP","1514","443  >  58685 [ACK] Seq=146620 Ack=116674 Win=14815 Len=1460 [TCP PDU reassembled in 210]"
"210","4.962571","23.198.241.2","192.168.1.166","TLSv1.2","405","Application Data"
"211","4.962616","192.168.1.166","23.198.241.2","TCP","54","58685  >  443 [ACK] Seq=116674 Ack=148431 Win=8191 Len=0"
"212","4.962694","23.198.241.2","192.168.1.166","TLSv1.2","333","Application Data"
"213","4.962694","23.198.241.2","192.168.1.166","TCP","1514","443  >  58685 [ACK] Seq=148710 Ack=116674 Win=14815 Len=1460 [TCP PDU reassembled in 214]"
"214","4.962694","23.198.241.2","192.168.1.166","TLSv1.2","57","Application Data"
"215","4.962699","192.168.1.166","23.198.241.2","TCP","54","58685  >  443 [ACK] Seq=116674 Ack=150173 Win=8191 Len=0"
"216","4.964341","192.168.1.166","23.198.241.2","TLSv1.2","180","Application Data"
"217","4.967893","192.168.1.166","23.198.241.2","TLSv1.2","5650","Application Data"
"218","4.997384","23.198.241.2","192.168.1.166","TLSv1.2","338","Application Data"
"219","4.997384","23.198.241.2","192.168.1.166","TCP","1514","443  >  58685 [ACK] Seq=150457 Ack=122396 Win=14791 Len=1460 [TCP PDU reassembled in 220]"
"220","4.997384","23.198.241.2","192.168.1.166","TLSv1.2","460","Application Data"
"221","4.997404","192.168.1.166","23.198.241.2","TCP","54","58685  >  443 [ACK] Seq=122396 Ack=152323 Win=8191 Len=0"
"222","5.006183","23.198.241.2","192.168.1.166","TLSv1.2","952","Application Data"
"223","5.006183","23.198.241.2","192.168.1.166","TLSv1.2","85","Application Data"
"224","5.006196","192.168.1.166","23.198.241.2","TCP","54","58685  >  443 [ACK] Seq=122396 Ack=153252 Win=8188 Len=0"
"225","5.011607","192.168.1.166","23.198.241.2","TLSv1.2","573","Application Data"
"226","5.046184","23.198.241.2","192.168.1.166","TLSv1.2","338","Application Data"
"227","5.046184","23.198.241.2","192.168.1.166","TCP","1514","443  >  58685 [ACK] Seq=153536 Ack=122915 Win=14815 Len=1460 [TCP PDU reassembled in 228]"
"228","5.046184","23.198.241.2","192.168.1.166","TLSv1.2","97","Application Data"
"229","5.046209","192.168.1.166","23.198.241.2","TCP","54","58685  >  443 [ACK] Seq=122915 Ack=155039 Win=8191 Len=0"
"230","5.047057","192.168.1.166","23.198.241.2","TLSv1.2","193","Application Data"
"231","5.088650","192.168.1.166","23.198.241.2","TLSv1.2","193","Application Data"
"232","5.090319","23.198.241.2","192.168.1.166","TLSv1.2","338","Application Data"
"233","5.090319","23.198.241.2","192.168.1.166","TLSv1.2","1424","Application Data"
"234","5.090319","23.198.241.2","192.168.1.166","TLSv1.2","803","Application Data"
"235","5.090339","192.168.1.166","23.198.241.2","TCP","54","58685  >  443 [ACK] Seq=123193 Ack=157442 Win=8191 Len=0"
"236","5.102276","192.168.1.166","23.198.241.2","TLSv1.2","194","Application Data"
"237","5.106430","192.168.1.166","23.198.241.2","TLSv1.2","194","Application Data"
"238","5.106461","192.168.1.166","23.198.241.2","TLSv1.2","194","Application Data"
"239","5.106478","192.168.1.166","23.198.241.2","TLSv1.2","180","Application Data"
"240","5.106493","192.168.1.166","23.198.241.2","TLSv1.2","194","Application Data"
"241","5.108934","192.168.1.166","23.198.241.2","TLSv1.2","5707","Application Data"
"242","5.126808","23.198.241.2","192.168.1.166","TLSv1.2","338","Application Data"
"243","5.126808","23.198.241.2","192.168.1.166","TCP","1514","443  >  58685 [ACK] Seq=157726 Ack=123193 Win=14815 Len=1460 [TCP PDU reassembled in 244]"
"244","5.126808","23.198.241.2","192.168.1.166","TLSv1.2","184","Application Data"
"245","5.126845","192.168.1.166","23.198.241.2","TCP","54","58685  >  443 [ACK] Seq=129532 Ack=159316 Win=8191 Len=0"
"246","5.127472","192.168.1.166","23.198.241.2","TLSv1.2","89","Application Data"
"247","5.129010","192.168.1.166","23.198.241.2","TLSv1.2","579","Application Data"
"248","5.134832","23.198.241.2","192.168.1.166","TLSv1.2","338","Application Data"
"249","5.134832","23.198.241.2","192.168.1.166","TCP","1514","443  >  58685 [ACK] Seq=159600 Ack=123879 Win=14810 Len=1460 [TCP PDU reassembled in 250]"
"250","5.134832","23.198.241.2","192.168.1.166","TLSv1.2","568","Application Data"
"251","5.134869","192.168.1.166","23.198.241.2","TCP","54","58685  >  443 [ACK] Seq=130092 Ack=161574 Win=8191 Len=0"
"252","5.135415","23.198.241.2","192.168.1.166","TCP","54","443  >  58685 [ACK] Seq=161574 Ack=129532 Win=14781 Len=0"
"253","5.135671","192.168.1.166","23.198.241.2","TLSv1.2","193","Application Data"
"254","5.147367","192.168.1.166","23.198.241.2","TLSv1.2","184","Application Data"
"255","5.182984","23.198.241.2","192.168.1.166","TLSv1.2","338","Application Data"
"256","5.182984","23.198.241.2","192.168.1.166","TCP","1514","443  >  58685 [ACK] Seq=161858 Ack=129532 Win=14815 Len=1460 [TCP PDU reassembled in 257]"
"257","5.182984","23.198.241.2","192.168.1.166","TLSv1.2","386","Application Data"
"258","5.182984","23.198.241.2","192.168.1.166","TLSv1.2","372","Application Data"
"259","5.182984","23.198.241.2","192.168.1.166","TLSv1.2","85","Application Data"
"260","5.182984","23.198.241.2","192.168.1.166","TLSv1.2","338","Application Data"
"261","5.182984","23.198.241.2","192.168.1.166","TCP","1514","443  >  58685 [ACK] Seq=164283 Ack=129532 Win=14815 Len=1460 [TCP PDU reassembled in 262]"
"262","5.182984","23.198.241.2","192.168.1.166","TLSv1.2","201","Application Data"
"263","5.182984","23.198.241.2","192.168.1.166","TLSv1.2","1514","Application Data"
"264","5.182984","23.198.241.2","192.168.1.166","TLSv1.2","608","Application Data"
"265","5.182984","23.198.241.2","192.168.1.166","TLSv1.2","338","Application Data"
"266","5.182984","23.198.241.2","192.168.1.166","TLSv1.2","1451","Application Data"
"267","5.182984","23.198.241.2","192.168.1.166","TCP","54","443  >  58685 [ACK] Seq=169585 Ack=130092 Win=14815 Len=0"
"268","5.183073","192.168.1.166","23.198.241.2","TCP","54","58685  >  443 [ACK] Seq=130361 Ack=169585 Win=8191 Len=0"
"269","5.188070","192.168.1.166","23.198.241.2","TLSv1.2","194","Application Data"
"270","5.188095","192.168.1.166","23.198.241.2","TLSv1.2","166","Application Data"
"271","5.188108","192.168.1.166","23.198.241.2","TLSv1.2","166","Application Data"
"272","5.203364","23.198.241.2","192.168.1.166","TCP","54","443  >  58685 [ACK] Seq=169585 Ack=130231 Win=14815 Len=0"
"273","5.209798","23.198.241.2","192.168.1.166","TCP","54","443  >  58685 [ACK] Seq=169585 Ack=130361 Win=14815 Len=0"
"274","5.214024","23.198.241.2","192.168.1.166","TCP","54","443  >  58685 [ACK] Seq=169585 Ack=130501 Win=14815 Len=0"
"275","5.214024","23.198.241.2","192.168.1.166","TCP","54","443  >  58685 [ACK] Seq=169585 Ack=130613 Win=14815 Len=0"
"276","5.217448","23.198.241.2","192.168.1.166","TCP","54","443  >  58685 [ACK] Seq=169585 Ack=130725 Win=14815 Len=0"
"277","5.226800","23.198.241.2","192.168.1.166","TLSv1.2","346","Application Data"
"278","5.226800","23.198.241.2","192.168.1.166","TLSv1.2","433","Application Data"
"279","5.226828","192.168.1.166","23.198.241.2","TCP","54","58685  >  443 [ACK] Seq=130725 Ack=170256 Win=8189 Len=0"
"280","5.227448","23.198.241.2","192.168.1.166","TLSv1.2","333","Application Data"
"281","5.227448","23.198.241.2","192.168.1.166","TLSv1.2","808","Application Data"
"282","5.227464","192.168.1.166","23.198.241.2","TCP","54","58685  >  443 [ACK] Seq=130725 Ack=171289 Win=8191 Len=0"
"283","5.227477","192.168.1.166","23.198.241.2","TLSv1.2","179","Application Data"
"284","5.227972","192.168.1.166","23.198.241.2","TLSv1.2","179","Application Data"
"285","5.229553","23.198.241.2","192.168.1.166","TLSv1.2","317","Application Data"
"286","5.229553","23.198.241.2","192.168.1.166","TCP","1514","443  >  58685 [ACK] Seq=171552 Ack=130725 Win=14815 Len=1460 [TCP PDU reassembled in 287]"
"287","5.229553","23.198.241.2","192.168.1.166","TLSv1.2","142","Application Data"
"288","5.229573","192.168.1.166","23.198.241.2","TCP","54","58685  >  443 [ACK] Seq=130975 Ack=173100 Win=8191 Len=0"
"289","5.237103","192.168.1.166","23.198.241.2","TLSv1.2","5493","Application Data"
"290","5.254541","23.198.241.2","192.168.1.166","TCP","2974","443  >  58685 [ACK] Seq=173100 Ack=130850 Win=14815 Len=2920 [TCP PDU reassembled in 291]"
"291","5.254541","23.198.241.2","192.168.1.166","TLSv1.2","564","Application Data"
"292","5.254577","192.168.1.166","23.198.241.2","TCP","54","58685  >  443 [ACK] Seq=136414 Ack=176530 Win=8191 Len=0"
"293","5.255065","192.168.1.166","23.198.241.2","TLSv1.2","565","Application Data"
"294","5.267891","23.198.241.2","192.168.1.166","TLSv1.2","338","Application Data"
"295","5.267891","23.198.241.2","192.168.1.166","TLSv1.2","1293","Application Data"
"296","5.267891","23.198.241.2","192.168.1.166","TLSv1.2","1514","Application Data"
"297","5.267891","23.198.241.2","192.168.1.166","TLSv1.2","328","Application Data"
"298","5.267891","23.198.241.2","192.168.1.166","TLSv1.2","1514","Application Data"
"299","5.267891","23.198.241.2","192.168.1.166","TLSv1.2","594","Application Data"
"300","5.267926","192.168.1.166","23.198.241.2","TCP","54","58685  >  443 [ACK] Seq=136925 Ack=181787 Win=8191 Len=0"
"301","5.268957","192.168.1.166","23.198.241.2","TLSv1.2","192","Application Data"
"302","5.268985","192.168.1.166","23.198.241.2","TLSv1.2","194","Application Data"
"303","5.280582","23.198.241.2","192.168.1.166","TCP","54","443  >  58685 [ACK] Seq=181787 Ack=136414 Win=14791 Len=0"
"304","5.290842","23.198.241.2","192.168.1.166","TLSv1.2","169","Application Data"
"305","5.290842","23.198.241.2","192.168.1.166","TLSv1.2","337","Application Data"
"306","5.290842","23.198.241.2","192.168.1.166","TLSv1.2","1453","Application Data"
"307","5.290842","23.198.241.2","192.168.1.166","TLSv1.2","338","Application Data"
"308","5.290842","23.198.241.2","192.168.1.166","TLSv1.2","1423","Application Data"
"309","5.290884","192.168.1.166","23.198.241.2","TCP","54","58685  >  443 [ACK] Seq=137203 Ack=185237 Win=8191 Len=0"
"310","5.291722","192.168.1.166","23.198.241.2","TLSv1.2","180","Application Data"
"311","5.291826","192.168.1.166","23.198.241.2","TLSv1.2","180","Application Data"
"312","5.302055","23.198.241.2","192.168.1.166","TLSv1.2","515","Application Data"
"313","5.302055","23.198.241.2","192.168.1.166","TLSv1.2","338","Application Data"
"314","5.302055","23.198.241.2","192.168.1.166","TLSv1.2","1447","Application Data"
"315","5.302080","192.168.1.166","23.198.241.2","TCP","54","58685  >  443 [ACK] Seq=137455 Ack=187375 Win=8191 Len=0"
"316","5.302730","192.168.1.166","23.198.241.2","TLSv1.2","180","Application Data"
"317","5.302823","192.168.1.166","23.198.241.2","TLSv1.2","178","Application Data"
"318","5.321172","23.198.241.2","192.168.1.166","TCP","54","443  >  58685 [ACK] Seq=187375 Ack=137203 Win=14815 Len=0"
"319","5.323692","23.198.241.2","192.168.1.166","TLSv1.2","338","Application Data"
"320","5.323692","23.198.241.2","192.168.1.166","TCP","1514","443  >  58685 [ACK] Seq=187659 Ack=137455 Win=14815 Len=1460 [TCP PDU reassembled in 321]"
"321","5.323692","23.198.241.2","192.168.1.166","TLSv1.2","267","Application Data"
"322","5.323720","192.168.1.166","23.198.241.2","TCP","54","58685  >  443 [ACK] Seq=137705 Ack=189332 Win=8191 Len=0"
"323","5.324684","192.168.1.166","23.198.241.2","TLSv1.2","178","Application Data"
"324","5.331069","23.198.241.2","192.168.1.166","TCP","54","443  >  58685 [ACK] Seq=189332 Ack=137705 Win=14815 Len=0"
"325","5.339826","192.168.1.166","23.198.241.2","TLSv1.2","5583","Application Data"
"326","5.339900","192.168.1.166","23.198.241.2","TLSv1.2","339","Application Data"
"327","5.349910","23.198.241.2","192.168.1.166","TLSv1.2","338","Application Data"
"328","5.349910","23.198.241.2","192.168.1.166","TCP","1514","443  >  58685 [ACK] Seq=189616 Ack=137705 Win=14815 Len=1460 [TCP PDU reassembled in 329]"
"329","5.349910","23.198.241.2","192.168.1.166","TLSv1.2","279","Application Data"
"330","5.349910","23.198.241.2","192.168.1.166","TLSv1.2","338","Application Data"
"331","5.349910","23.198.241.2","192.168.1.166","TLSv1.2","1449","Application Data"
"332","5.349910","23.198.241.2","192.168.1.166","TLSv1.2","338","Application Data"
"333","5.349910","23.198.241.2","192.168.1.166","TCP","1514","443  >  58685 [ACK] Seq=193264 Ack=137705 Win=14815 Len=1460 [TCP PDU reassembled in 334]"
"334","5.349910","23.198.241.2","192.168.1.166","TLSv1.2","63","Application Data"
"335","5.349910","23.198.241.2","192.168.1.166","TLSv1.2","111","Application Data"
"336","5.349910","23.198.241.2","192.168.1.166","TLSv1.2","282","Application Data"
"337","5.349910","23.198.241.2","192.168.1.166","TCP","16114","443  >  58685 [ACK] Seq=195018 Ack=137705 Win=14815 Len=16060 [TCP PDU reassembled in 338]"
"338","5.349910","23.198.241.2","192.168.1.166","TLSv1.2","400","Application Data"
"339","5.349910","23.198.241.2","192.168.1.166","TLSv1.2","85","Application Data"
"340","5.349910","23.198.241.2","192.168.1.166","TCP","16114","443  >  58685 [ACK] Seq=211455 Ack=137705 Win=14815 Len=16060 [TCP PDU reassembled in 341]"
"341","5.349910","23.198.241.2","192.168.1.166","TLSv1.2","400","Application Data"
"342","5.349910","23.198.241.2","192.168.1.166","TLSv1.2","11734","Application Data, Application Data"
"343","5.349910","23.198.241.2","192.168.1.166","TLSv1.2","473","Application Data, Application Data"
"344","5.349910","23.198.241.2","192.168.1.166","TLSv1.2","338","Application Data"
"345","5.349910","23.198.241.2","192.168.1.166","TCP","1514","443  >  58685 [ACK] Seq=240244 Ack=137705 Win=14815 Len=1460 [TCP PDU reassembled in 346]"
"346","5.349910","23.198.241.2","192.168.1.166","TLSv1.2","97","Application Data"
"347","5.349910","23.198.241.2","192.168.1.166","TLSv1.2","338","Application Data"
"348","5.349910","23.198.241.2","192.168.1.166","TLSv1.2","1422","Application Data"
"349","5.349910","23.198.241.2","192.168.1.166","TLSv1.2","418","Application Data"
"350","5.349910","23.198.241.2","192.168.1.166","TLSv1.2","423","Application Data"
"351","5.350008","192.168.1.166","23.198.241.2","TCP","54","58685  >  443 [ACK] Seq=143643 Ack=244132 Win=8191 Len=0"
"352","5.354486","192.168.1.166","23.198.241.2","TLSv1.2","558","Application Data"
"353","5.354537","192.168.1.166","23.198.241.2","TLSv1.2","178","Application Data"
"354","5.354552","192.168.1.166","23.198.241.2","TLSv1.2","193","Application Data"
"355","5.355673","192.168.1.166","23.198.241.2","TLSv1.2","179","Application Data"
"356","5.355699","192.168.1.166","23.198.241.2","TLSv1.2","179","Application Data"
"357","5.362962","23.198.241.2","192.168.1.166","TLSv1.2","338","Application Data"
"358","5.362962","23.198.241.2","192.168.1.166","TCP","1514","443  >  58685 [ACK] Seq=244416 Ack=137829 Win=14815 Len=1460 [TCP PDU reassembled in 359]"
"359","5.362962","23.198.241.2","192.168.1.166","TLSv1.2","97","Application Data"
"360","5.362962","23.198.241.2","192.168.1.166","TLSv1.2","471","Application Data"
"361","5.363002","192.168.1.166","23.198.241.2","TCP","54","58685  >  443 [ACK] Seq=144660 Ack=246336 Win=8191 Len=0"
"362","5.365202","192.168.1.166","23.198.241.2","TLSv1.2","5600","Application Data"
"363","5.365288","192.168.1.166","23.198.241.2","TLSv1.2","5850","Application Data"
"364","5.365307","192.168.1.166","23.198.241.2","TLSv1.2","790","Application Data"
"365","5.365321","192.168.1.166","23.198.241.2","TLSv1.2","873","Application Data"
"366","5.366206","192.168.1.166","23.198.241.2","TLSv1.2","573","Application Data"
"367","5.377216","23.198.241.2","192.168.1.166","TCP","54","443  >  58685 [ACK] Seq=246336 Ack=142209 Win=14815 Len=0"
"368","5.388464","192.168.1.166","23.198.241.2","TLSv1.2","5659","Application Data"
"369","5.399121","23.198.241.2","192.168.1.166","TCP","54","443  >  58685 [ACK] Seq=246336 Ack=144660 Win=14804 Len=0"
"370","5.399121","23.198.241.2","192.168.1.166","TCP","54","443  >  58685 [ACK] Seq=246336 Ack=147580 Win=14805 Len=0"
"371","5.403971","23.198.241.2","192.168.1.166","TLSv1.2","338","Application Data"
"372","5.403971","23.198.241.2","192.168.1.166","TLSv1.2","1478","Application Data"
"373","5.403971","23.198.241.2","192.168.1.166","TLSv1.2","338","Application Data"
"374","5.403971","23.198.241.2","192.168.1.166","TLSv1.2","1423","Application Data"
"375","5.403971","23.198.241.2","192.168.1.166","TLSv1.2","338","Application Data"
"376","5.403971","23.198.241.2","192.168.1.166","TLSv1.2","91","Application Data"
"377","5.403971","23.198.241.2","192.168.1.166","TLSv1.2","585","Application Data"
"378","5.404020","192.168.1.166","23.198.241.2","TCP","54","58685  >  443 [ACK] Seq=163681 Ack=250549 Win=8191 Len=0"
"379","5.404125","23.198.241.2","192.168.1.166","TLSv1.2","1512","Application Data"
"380","5.404125","23.198.241.2","192.168.1.166","TLSv1.2","339","Application Data"
"381","5.404125","23.198.241.2","192.168.1.166","TLSv1.2","1422","Application Data"
"382","5.404140","192.168.1.166","23.198.241.2","TCP","54","58685  >  443 [ACK] Seq=163681 Ack=253660 Win=8191 Len=0"
"383","5.405108","192.168.1.166","23.198.241.2","TLSv1.2","574","Application Data"
"384","5.405143","192.168.1.166","23.198.241.2","TLSv1.2","193","Application Data"
"385","5.413977","23.198.241.2","192.168.1.166","TLSv1.2","447","Application Data"
"386","5.413977","23.198.241.2","192.168.1.166","TLSv1.2","899","Application Data"
"387","5.414011","192.168.1.166","23.198.241.2","TCP","54","58685  >  443 [ACK] Seq=164340 Ack=254898 Win=8187 Len=0"
"388","5.414785","192.168.1.166","23.198.241.2","TLSv1.2","193","Application Data"
"389","5.414822","192.168.1.166","23.198.241.2","TLSv1.2","194","Application Data"
"390","5.424491","23.198.241.2","192.168.1.166","TCP","54","443  >  58685 [ACK] Seq=254898 Ack=162456 Win=14815 Len=0"
"391","5.431123","23.198.241.2","192.168.1.166","TCP","54","443  >  58685 [ACK] Seq=254898 Ack=164201 Win=14815 Len=0"
"392","5.450719","23.198.241.2","192.168.1.166","TCP","54","443  >  58685 [ACK] Seq=254898 Ack=164619 Win=14815 Len=0"
"393","5.462253","23.198.241.2","192.168.1.166","TLSv1.2","338","Application Data"
"394","5.462253","23.198.241.2","192.168.1.166","TLSv1.2","1446","Application Data"
"395","5.462253","23.198.241.2","192.168.1.166","TLSv1.2","339","Application Data"
