"No.","Time","Source","Destination","Protocol","Length","Info"
"1","0.000000","192.168.1.166","23.198.241.2","TLSv1.2","945","Application Data"
"2","0.000067","192.168.1.166","23.198.241.2","TLSv1.2","137","Application Data"
"3","0.000083","192.168.1.166","23.198.241.2","TLSv1.2","538","Application Data"
"4","0.000098","192.168.1.166","23.198.241.2","TLSv1.2","1173","Application Data"
"5","0.007720","192.168.1.166","23.198.241.2","TLSv1.2","203","Application Data"
"6","0.007806","192.168.1.166","23.198.241.2","TLSv1.2","4616","Application Data"
"7","0.028425","23.198.241.2","192.168.1.166","TCP","54","443  >  58685 [ACK] Seq=1 Ack=1459 Win=9770 Len=0"
"8","0.042975","23.198.241.2","192.168.1.166","TCP","54","443  >  58685 [ACK] Seq=1 Ack=7289 Win=9742 Len=0"
"9","0.090395","23.198.241.2","192.168.1.166","TLSv1.2","492","Application Data"
"10","0.090395","23.198.241.2","192.168.1.166","TLSv1.2","120","Application Data"
"11","0.090395","23.198.241.2","192.168.1.166","TLSv1.2","493","Application Data"
"12","0.090395","23.198.241.2","192.168.1.166","TLSv1.2","141","Application Data"
"13","0.090426","192.168.1.166","23.198.241.2","TCP","54","58685  >  443 [ACK] Seq=7289 Ack=1031 Win=4095 Len=0"
"14","0.091074","192.168.1.166","23.198.241.2","TLSv1.2","89","Application Data"
"15","0.108321","192.168.1.166","23.198.241.2","TLSv1.2","365","Application Data"
"16","0.109656","192.168.1.166","23.198.241.2","TLSv1.2","185","Application Data"
"17","0.109693","192.168.1.166","23.198.241.2","TLSv1.2","595","Application Data"
"18","0.135770","23.198.241.2","192.168.1.166","TLSv1.2","1038","Application Data"
"19","0.135770","23.198.241.2","192.168.1.166","TLSv1.2","103","Application Data"
"20","0.135794","192.168.1.166","23.198.241.2","TCP","54","58685  >  443 [ACK] Seq=8307 Ack=2064 Win=4091 Len=0"
"21","0.151040","23.198.241.2","192.168.1.166","TCP","54","443  >  58685 [ACK] Seq=2064 Ack=8307 Win=9770 Len=0"
"22","0.185574","23.198.241.2","192.168.1.166","TCP","1514","443  >  58685 [ACK] Seq=2064 Ack=8307 Win=9770 Len=1460 [TCP PDU reassembled in 23]"
"23","0.185574","23.198.241.2","192.168.1.166","TLSv1.2","901","Application Data"
"24","0.185574","23.198.241.2","192.168.1.166","TLSv1.2","1302","Application Data"
"25","0.185597","192.168.1.166","23.198.241.2","TCP","54","58685  >  443 [ACK] Seq=8307 Ack=5619 Win=4095 Len=0"
"26","0.192215","192.168.1.166","23.198.241.2","TLSv1.2","2705","Application Data"
"27","0.192253","192.168.1.166","23.198.241.2","TLSv1.2","1234","Application Data"
"28","0.212502","192.168.1.166","23.198.241.2","TLSv1.2","89","Application Data"
"29","0.220345","23.198.241.2","192.168.1.166","TCP","54","443  >  58685 [ACK] Seq=5619 Ack=10958 Win=9755 Len=0"
"30","0.222559","192.168.1.166","23.198.241.2","TLSv1.2","3383","Application Data"
"31","0.222591","192.168.1.166","23.198.241.2","TLSv1.2","1116","Application Data"
"32","0.224304","192.168.1.166","23.198.241.2","TLSv1.2","3541","Application Data"
"33","0.247126","23.198.241.2","192.168.1.166","TCP","54","443  >  58685 [ACK] Seq=5619 Ack=12173 Win=9770 Len=0"
"34","0.269262","23.198.241.2","192.168.1.166","TCP","54","443  >  58685 [ACK] Seq=5619 Ack=15502 Win=9770 Len=0"
"35","0.272288","23.198.241.2","192.168.1.166","TCP","54","443  >  58685 [ACK] Seq=5619 Ack=20051 Win=9744 Len=0"
"36","0.281189","23.198.241.2","192.168.1.166","TLSv1.2","486","Application Data"
"37","0.281189","23.198.241.2","192.168.1.166","TCP","16114","443  >  58685 [ACK] Seq=6051 Ack=20051 Win=9770 Len=16060 [TCP PDU reassembled in 38]"
"38","0.281189","23.198.241.2","192.168.1.166","TLSv1.2","400","Application Data"
"39","0.281189","23.198.241.2","192.168.1.166","TLSv1.2","85","Application Data"
"40","0.281189","23.198.241.2","192.168.1.166","TCP","16114","443  >  58685 [ACK] Seq=22488 Ack=20051 Win=9770 Len=16060 [TCP PDU reassembled in 41]"
"41","0.281189","23.198.241.2","192.168.1.166","TLSv1.2","400","Application Data"
"42","0.281189","23.198.241.2","192.168.1.166","TLSv1.2","32174","Application Data, Application Data, Application Data"
"43","0.281189","23.198.241.2","192.168.1.166","TLSv1.2","808","Application Data"
"44","0.281230","192.168.1.166","23.198.241.2","TCP","54","58685  >  443 [ACK] Seq=20051 Ack=71768 Win=4095 Len=0"
"45","0.281843","23.198.241.2","192.168.1.166","TLSv1.2","56994","Application Data, Application Data, Application Data, Application Data, Application Data, Application Data, Application Data"
"46","0.281866","192.168.1.166","23.198.241.2","TCP","54","58685  >  443 [ACK] Seq=20051 Ack=128708 Win=4095 Len=0"
"47","0.282407","23.198.241.2","192.168.1.166","TCP","7354","443  >  58685 [ACK] Seq=128708 Ack=20051 Win=9770 Len=7300 [TCP PDU reassembled in 48]"
"48","0.282407","23.198.241.2","192.168.1.166","TLSv1.2","1450","Application Data"
"49","0.282423","192.168.1.166","23.198.241.2","TCP","54","58685  >  443 [ACK] Seq=20051 Ack=137404 Win=4095 Len=0"
"50","0.292822","23.198.241.2","192.168.1.166","TLSv1.2","361","Application Data"
"51","0.292822","23.198.241.2","192.168.1.166","TLSv1.2","289","Application Data"
"52","0.292839","192.168.1.166","23.198.241.2","TCP","54","58685  >  443 [ACK] Seq=20051 Ack=137946 Win=4093 Len=0"
"53","0.331823","192.168.1.166","23.198.241.2","TLSv1.2","3958","Application Data"
"54","0.348565","23.198.241.2","192.168.1.166","TLSv1.2","361","Application Data"
"55","0.348565","23.198.241.2","192.168.1.166","TLSv1.2","290","Application Data"
"56","0.348580","192.168.1.166","23.198.241.2","TCP","54","58685  >  443 [ACK] Seq=23955 Ack=138489 Win=4091 Len=0"
"57","0.358057","23.198.241.2","192.168.1.166","TCP","54","443  >  58685 [ACK] Seq=138489 Ack=23955 Win=9770 Len=0"
"58","0.377904","23.198.241.2","192.168.1.166","TLSv1.2","369","Application Data"
"59","0.377904","23.198.241.2","192.168.1.166","TLSv1.2","367","Application Data"
"60","0.377923","192.168.1.166","23.198.241.2","TCP","54","58685  >  443 [ACK] Seq=23955 Ack=139117 Win=4095 Len=0"
"61","1.305698","192.168.1.166","23.198.241.2","TLSv1.2","4001","Application Data"
"62","1.305770","192.168.1.166","23.198.241.2","TLSv1.2","5455","Application Data"
"63","1.333924","23.198.241.2","192.168.1.166","TCP","54","443  >  58685 [ACK] Seq=139117 Ack=26875 Win=9754 Len=0"
"64","1.333924","23.198.241.2","192.168.1.166","TCP","54","443  >  58685 [ACK] Seq=139117 Ack=32282 Win=9741 Len=0"
"65","1.353112","23.198.241.2","192.168.1.166","TLSv1.2","1377","Application Data"
"66","1.353112","23.198.241.2","192.168.1.166","TLSv1.2","85","Application Data"
"67","1.353142","192.168.1.166","23.198.241.2","TCP","54","58685  >  443 [ACK] Seq=33303 Ack=140471 Win=4090 Len=0"
"68","1.359375","192.168.1.166","23.198.241.2","TLSv1.2","4110","Application Data"
"69","1.385128","23.198.241.2","192.168.1.166","TCP","54","443  >  58685 [ACK] Seq=140471 Ack=37359 Win=9770 Len=0"
"70","2.342437","192.168.1.166","23.198.241.2","TLSv1.2","3998","Application Data"
"71","2.342508","192.168.1.166","23.198.241.2","TLSv1.2","2150","Application Data"
"72","2.378075","23.198.241.2","192.168.1.166","TCP","54","443  >  58685 [ACK] Seq=140471 Ack=40279 Win=9754 Len=0"
"73","2.378075","23.198.241.2","192.168.1.166","TCP","54","443  >  58685 [ACK] Seq=140471 Ack=42763 Win=9762 Len=0"
"74","2.392158","23.198.241.2","192.168.1.166","TLSv1.2","374","Application Data"
"75","2.392158","23.198.241.2","192.168.1.166","TLSv1.2","85","Application Data"
"76","2.392176","192.168.1.166","23.198.241.2","TCP","54","58685  >  443 [ACK] Seq=43399 Ack=140822 Win=4095 Len=0"
"77","3.363186","23.198.241.2","192.168.1.166","TCP","1514","443  >  58685 [ACK] Seq=140822 Ack=43399 Win=9770 Len=1460 [TCP PDU reassembled in 78]"
"78","3.363186","23.198.241.2","192.168.1.166","TLSv1.2","486","Application Data"
"79","3.363186","23.198.241.2","192.168.1.166","TCP","1514","443  >  58685 [ACK] Seq=142714 Ack=43399 Win=9770 Len=1460 [TCP PDU reassembled in 90]"
"80","3.363186","23.198.241.2","192.168.1.166","TCP","1514","443  >  58685 [ACK] Seq=144174 Ack=43399 Win=9770 Len=1460 [TCP PDU reassembled in 90]"
"81","3.363186","23.198.241.2","192.168.1.166","TCP","1514","443  >  58685 [ACK] Seq=145634 Ack=43399 Win=9770 Len=1460 [TCP PDU reassembled in 90]"
"82","3.363186","23.198.241.2","192.168.1.166","TCP","1514","443  >  58685 [ACK] Seq=147094 Ack=43399 Win=9770 Len=1460 [TCP PDU reassembled in 90]"
"83","3.363186","23.198.241.2","192.168.1.166","TCP","1514","443  >  58685 [ACK] Seq=148554 Ack=43399 Win=9770 Len=1460 [TCP PDU reassembled in 90]"
"84","3.363186","23.198.241.2","192.168.1.166","TCP","1514","443  >  58685 [ACK] Seq=150014 Ack=43399 Win=9770 Len=1460 [TCP PDU reassembled in 90]"
"85","3.363186","23.198.241.2","192.168.1.166","TCP","1514","443  >  58685 [ACK] Seq=151474 Ack=43399 Win=9770 Len=1460 [TCP PDU reassembled in 90]"
"86","3.363186","23.198.241.2","192.168.1.166","TCP","1514","443  >  58685 [ACK] Seq=152934 Ack=43399 Win=9770 Len=1460 [TCP PDU reassembled in 90]"
"87","3.363186","23.198.241.2","192.168.1.166","TCP","1514","443  >  58685 [ACK] Seq=154394 Ack=43399 Win=9770 Len=1460 [TCP PDU reassembled in 90]"
"88","3.363186","23.198.241.2","192.168.1.166","TCP","1514","443  >  58685 [ACK] Seq=155854 Ack=43399 Win=9770 Len=1460 [TCP PDU reassembled in 90]"
"89","3.363186","23.198.241.2","192.168.1.166","TCP","1514","443  >  58685 [ACK] Seq=157314 Ack=43399 Win=9770 Len=1460 [TCP PDU reassembled in 90]"
"90","3.363186","23.198.241.2","192.168.1.166","TLSv1.2","400","Application Data"
"91","3.363186","23.198.241.2","192.168.1.166","TLSv1.2","1514","Application Data"
"92","3.363186","23.198.241.2","192.168.1.166","TCP","1514","443  >  58685 [ACK] Seq=160580 Ack=43399 Win=9770 Len=1460 [TCP PDU reassembled in 102]"
"93","3.363186","23.198.241.2","192.168.1.166","TCP","1514","443  >  58685 [ACK] Seq=162040 Ack=43399 Win=9770 Len=1460 [TCP PDU reassembled in 102]"
"94","3.363186","23.198.241.2","192.168.1.166","TCP","1514","443  >  58685 [ACK] Seq=163500 Ack=43399 Win=9770 Len=1460 [TCP PDU reassembled in 102]"
"95","3.363186","23.198.241.2","192.168.1.166","TCP","1514","443  >  58685 [ACK] Seq=164960 Ack=43399 Win=9770 Len=1460 [TCP PDU reassembled in 102]"
"96","3.363186","23.198.241.2","192.168.1.166","TCP","1514","443  >  58685 [ACK] Seq=166420 Ack=43399 Win=9770 Len=1460 [TCP PDU reassembled in 102]"
"97","3.363186","23.198.241.2","192.168.1.166","TCP","1514","443  >  58685 [ACK] Seq=167880 Ack=43399 Win=9770 Len=1460 [TCP PDU reassembled in 102]"
"98","3.363186","23.198.241.2","192.168.1.166","TCP","1514","443  >  58685 [ACK] Seq=169340 Ack=43399 Win=9770 Len=1460 [TCP PDU reassembled in 102]"
"99","3.363186","23.198.241.2","192.168.1.166","TCP","1514","443  >  58685 [ACK] Seq=170800 Ack=43399 Win=9770 Len=1460 [TCP PDU reassembled in 102]"
"100","3.363186","23.198.241.2","192.168.1.166","TCP","1514","443  >  58685 [ACK] Seq=172260 Ack=43399 Win=9770 Len=1460 [TCP PDU reassembled in 102]"
"101","3.363186","23.198.241.2","192.168.1.166","TCP","1514","443  >  58685 [ACK] Seq=173720 Ack=43399 Win=9770 Len=1460 [TCP PDU reassembled in 102]"
"102","3.363186","23.198.241.2","192.168.1.166","TLSv1.2","431","Application Data"
"103","3.363186","23.198.241.2","192.168.1.166","TLSv1.2","1514","Application Data"
"104","3.363186","23.198.241.2","192.168.1.166","TCP","1514","443  >  58685 [ACK] Seq=177017 Ack=43399 Win=9770 Len=1460 [TCP PDU reassembled in 108]"
"105","3.363186","23.198.241.2","192.168.1.166","TCP","1514","443  >  58685 [ACK] Seq=178477 Ack=43399 Win=9770 Len=1460 [TCP PDU reassembled in 108]"
"106","3.363186","23.198.241.2","192.168.1.166","TCP","1514","443  >  58685 [ACK] Seq=179937 Ack=43399 Win=9770 Len=1460 [TCP PDU reassembled in 108]"
"107","3.363186","23.198.241.2","192.168.1.166","TCP","1514","443  >  58685 [ACK] Seq=181397 Ack=43399 Win=9770 Len=1460 [TCP PDU reassembled in 108]"
"108","3.363186","23.198.241.2","192.168.1.166","TLSv1.2","980","Application Data"
"109","3.363306","192.168.1.166","23.198.241.2","TCP","54","58685  >  443 [ACK] Seq=43399 Ack=183783 Win=4095 Len=0"
"110","3.363354","23.198.241.2","192.168.1.166","TCP","5894","443  >  58685 [ACK] Seq=183783 Ack=43399 Win=9770 Len=5840 [TCP PDU reassembled in 112]"
"111","3.363354","23.198.241.2","192.168.1.166","TCP","1514","443  >  58685 [ACK] Seq=189623 Ack=43399 Win=9770 Len=1460 [TCP PDU reassembled in 112]"
"112","3.363354","23.198.241.2","192.168.1.166","TLSv1.2","581","Application Data"
"113","3.363354","23.198.241.2","192.168.1.166","TCP","16114","443  >  58685 [ACK] Seq=191610 Ack=43399 Win=9770 Len=16060 [TCP PDU reassembled in 114]"
"114","3.363354","23.198.241.2","192.168.1.166","TLSv1.2","400","Application Data"
"115","3.363354","23.198.241.2","192.168.1.166","TLSv1.2","85","Application Data"
"116","3.363354","23.198.241.2","192.168.1.166","TCP","7354","443  >  58685 [ACK] Seq=208047 Ack=43399 Win=9770 Len=7300 [TCP PDU reassembled in 117]"
"117","3.363354","23.198.241.2","192.168.1.166","TLSv1.2","870","Application Data"
"118","3.363383","192.168.1.166","23.198.241.2","TCP","54","58685  >  443 [ACK] Seq=43399 Ack=216163 Win=4095 Len=0"
"119","3.366493","23.198.241.2","192.168.1.166","TCP","16114","443  >  58685 [ACK] Seq=216163 Ack=43399 Win=9770 Len=16060 [TCP PDU reassembled in 120]"
"120","3.366493","23.198.241.2","192.168.1.166","TLSv1.2","400","Application Data"
"121","3.366493","23.198.241.2","192.168.1.166","TLSv1.2","85","Application Data"
"122","3.366493","23.198.241.2","192.168.1.166","TCP","4434","443  >  58685 [ACK] Seq=232600 Ack=43399 Win=9770 Len=4380 [TCP PDU reassembled in 123]"
"123","3.366493","23.198.241.2","192.168.1.166","TLSv1.2","1464","Application Data"
"124","3.366520","192.168.1.166","23.198.241.2","TCP","54","58685  >  443 [ACK] Seq=43399 Ack=238390 Win=4095 Len=0"
"125","3.369031","23.198.241.2","192.168.1.166","TCP","5894","443  >  58685 [ACK] Seq=238390 Ack=43399 Win=9770 Len=5840 [TCP PDU reassembled in 132]"
"126","3.369047","192.168.1.166","23.198.241.2","TCP","54","58685  >  443 [ACK] Seq=43399 Ack=244230 Win=4095 Len=0"
"127","3.369250","23.198.241.2","192.168.1.166","TCP","1514","443  >  58685 [ACK] Seq=244230 Ack=43399 Win=9770 Len=1460 [TCP PDU reassembled in 132]"
"128","3.369250","23.198.241.2","192.168.1.166","TCP","1514","443  >  58685 [ACK] Seq=245690 Ack=43399 Win=9770 Len=1460 [TCP PDU reassembled in 132]"
"129","3.369250","23.198.241.2","192.168.1.166","TCP","1514","443  >  58685 [ACK] Seq=247150 Ack=43399 Win=9770 Len=1460 [TCP PDU reassembled in 132]"
"130","3.369250","23.198.241.2","192.168.1.166","TCP","1514","443  >  58685 [ACK] Seq=248610 Ack=43399 Win=9770 Len=1460 [TCP PDU reassembled in 132]"
"131","3.369250","23.198.241.2","192.168.1.166","TCP","4434","443  >  58685 [ACK] Seq=250070 Ack=43399 Win=9770 Len=4380 [TCP PDU reassembled in 132]"
"132","3.369250","23.198.241.2","192.168.1.166","TLSv1.2","400","Application Data"
"133","3.369250","23.198.241.2","192.168.1.166","TLSv1.2","85","Application Data"
"134","3.369250","23.198.241.2","192.168.1.166","TCP","5894","443  >  58685 [ACK] Seq=254827 Ack=43399 Win=9770 Len=5840 [TCP PDU reassembled in 135]"
"135","3.369250","23.198.241.2","192.168.1.166","TLSv1.2","1329","Application Data"
"136","3.369284","192.168.1.166","23.198.241.2","TCP","54","58685  >  443 [ACK] Seq=43399 Ack=261942 Win=4095 Len=0"
"137","3.371215","192.168.1.166","23.198.241.2","TLSv1.2","3993","Application Data"
"138","3.372533","23.198.241.2","192.168.1.166","TCP","16114","443  >  58685 [ACK] Seq=261942 Ack=43399 Win=9770 Len=16060 [TCP PDU reassembled in 139]"
"139","3.372533","23.198.241.2","192.168.1.166","TLSv1.2","400","Application Data"
"140","3.372533","23.198.241.2","192.168.1.166","TLSv1.2","85","Application Data"
"141","3.372533","23.198.241.2","192.168.1.166","TCP","7354","443  >  58685 [ACK] Seq=278379 Ack=43399 Win=9770 Len=7300 [TCP PDU reassembled in 142]"
"142","3.372533","23.198.241.2","192.168.1.166","TLSv1.2","1024","Application Data"
"143","3.372564","192.168.1.166","23.198.241.2","TCP","54","58685  >  443 [ACK] Seq=47338 Ack=286649 Win=4095 Len=0"
"144","3.374451","192.168.1.166","23.198.241.2","TLSv1.2","3993","Application Data"
"145","3.374499","192.168.1.166","23.198.241.2","TLSv1.2","3993","Application Data"
"146","3.374541","192.168.1.166","23.198.241.2","TLSv1.2","3993","Application Data"
"147","3.374576","192.168.1.166","23.198.241.2","TLSv1.2","3993","Application Data"
"148","3.375272","192.168.1.166","23.198.241.2","TLSv1.2","3993","Application Data"
"149","3.375319","192.168.1.166","23.198.241.2","TLSv1.2","3993","Application Data"
"150","3.375353","192.168.1.166","23.198.241.2","TLSv1.2","3964","Application Data"
"151","3.375385","192.168.1.166","23.198.241.2","TLSv1.2","3963","Application Data"
"152","3.375415","192.168.1.166","23.198.241.2","TLSv1.2","3964","Application Data"
"153","3.375448","192.168.1.166","23.198.241.2","TLSv1.2","3979","Application Data"
"154","3.375468","192.168.1.166","23.198.241.2","TLSv1.2","548","Application Data"
"155","3.375481","192.168.1.166","23.198.241.2","TLSv1.2","164","Application Data"
"156","3.377177","23.198.241.2","192.168.1.166","TCP","1514","443  >  58685 [ACK] Seq=286649 Ack=43399 Win=9770 Len=1460 [TCP PDU reassembled in 167]"
"157","3.377177","23.198.241.2","192.168.1.166","TCP","1514","443  >  58685 [ACK] Seq=288109 Ack=43399 Win=9770 Len=1460 [TCP PDU reassembled in 167]"
"158","3.377177","23.198.241.2","192.168.1.166","TCP","1514","443  >  58685 [ACK] Seq=289569 Ack=43399 Win=9770 Len=1460 [TCP PDU reassembled in 167]"
"159","3.377177","23.198.241.2","192.168.1.166","TCP","1514","443  >  58685 [ACK] Seq=291029 Ack=43399 Win=9770 Len=1460 [TCP PDU reassembled in 167]"
"160","3.377177","23.198.241.2","192.168.1.166","TCP","1514","443  >  58685 [ACK] Seq=292489 Ack=43399 Win=9770 Len=1460 [TCP PDU reassembled in 167]"
"161","3.377177","23.198.241.2","192.168.1.166","TCP","1514","443  >  58685 [ACK] Seq=293949 Ack=43399 Win=9770 Len=1460 [TCP PDU reassembled in 167]"
"162","3.377177","23.198.241.2","192.168.1.166","TCP","1514","443  >  58685 [ACK] Seq=295409 Ack=43399 Win=9770 Len=1460 [TCP PDU reassembled in 167]"
"163","3.377177","23.198.241.2","192.168.1.166","TCP","1514","443  >  58685 [ACK] Seq=296869 Ack=43399 Win=9770 Len=1460 [TCP PDU reassembled in 167]"
"164","3.377177","23.198.241.2","192.168.1.166","TCP","1514","443  >  58685 [ACK] Seq=298329 Ack=43399 Win=9770 Len=1460 [TCP PDU reassembled in 167]"
"165","3.377177","23.198.241.2","192.168.1.166","TCP","1514","443  >  58685 [ACK] Seq=299789 Ack=43399 Win=9770 Len=1460 [TCP PDU reassembled in 167]"
"166","3.377177","23.198.241.2","192.168.1.166","TCP","1514","443  >  58685 [ACK] Seq=301249 Ack=43399 Win=9770 Len=1460 [TCP PDU reassembled in 167]"
"167","3.377177","23.198.241.2","192.168.1.166","TLSv1.2","400","Application Data"
"168","3.377177","23.198.241.2","192.168.1.166","TLSv1.2","85","Application Data"
"169","3.377177","23.198.241.2","192.168.1.166","TCP","1514","443  >  58685 [ACK] Seq=303086 Ack=43399 Win=9770 Len=1460 [TCP PDU reassembled in 172]"
"170","3.377177","23.198.241.2","192.168.1.166","TCP","1514","443  >  58685 [ACK] Seq=304546 Ack=43399 Win=9770 Len=1460 [TCP PDU reassembled in 172]"
"171","3.377177","23.198.241.2","192.168.1.166","TCP","1514","443  >  58685 [ACK] Seq=306006 Ack=43399 Win=9770 Len=1460 [TCP PDU reassembled in 172]"
"172","3.377177","23.198.241.2","192.168.1.166","TLSv1.2","1265","Application Data"
"173","3.377177","23.198.241.2","192.168.1.166","TLSv1.2","85","Application Data"
"174","3.377251","192.168.1.166","23.198.241.2","TCP","54","58685  >  443 [ACK] Seq=87230 Ack=308708 Win=4095 Len=0"
"175","3.400849","23.198.241.2","192.168.1.166","TCP","54","443  >  58685 [ACK] Seq=308708 Ack=46319 Win=9754 Len=0"
"176","3.400849","23.198.241.2","192.168.1.166","TCP","54","443  >  58685 [ACK] Seq=308708 Ack=55216 Win=9712 Len=0"
"177","3.400849","23.198.241.2","192.168.1.166","TCP","54","443  >  58685 [ACK] Seq=308708 Ack=58136 Win=9713 Len=0"
"178","3.403488","23.198.241.2","192.168.1.166","TCP","54","443  >  58685 [ACK] Seq=308708 Ack=63094 Win=9743 Len=0"
"179","3.416261","23.198.241.2","192.168.1.166","TLSv1.2","372","Application Data"
"180","3.416261","23.198.241.2","192.168.1.166","TCP","10274","443  >  58685 [ACK] Seq=309026 Ack=87230 Win=9611 Len=10220 [TCP PDU reassembled in 186]"
"181","3.416299","192.168.1.166","23.198.241.2","TCP","54","58685  >  443 [ACK] Seq=87230 Ack=319246 Win=4095 Len=0"
"182","3.417426","23.198.241.2","192.168.1.166","TCP","1514","443  >  58685 [ACK] Seq=319246 Ack=87230 Win=9611 Len=1460 [TCP PDU reassembled in 186]"
"183","3.417426","23.198.241.2","192.168.1.166","TCP","1514","443  >  58685 [ACK] Seq=320706 Ack=87230 Win=9611 Len=1460 [TCP PDU reassembled in 186]"
"184","3.417426","23.198.241.2","192.168.1.166","TCP","1514","443  >  58685 [ACK] Seq=322166 Ack=87230 Win=9611 Len=1460 [TCP PDU reassembled in 186]"
"185","3.417426","23.198.241.2","192.168.1.166","TCP","1514","443  >  58685 [ACK] Seq=323626 Ack=87230 Win=9611 Len=1460 [TCP PDU reassembled in 186]"
"186","3.417426","23.198.241.2","192.168.1.166","TLSv1.2","400","Application Data"
"187","3.417426","23.198.241.2","192.168.1.166","TLSv1.2","85","Application Data"
"188","3.417426","23.198.241.2","192.168.1.166","TCP","16114","443  >  58685 [ACK] Seq=325463 Ack=87230 Win=9611 Len=16060 [TCP PDU reassembled in 189]"
"189","3.417426","23.198.241.2","192.168.1.166","TLSv1.2","400","Application Data"
"190","3.417426","23.198.241.2","192.168.1.166","TLSv1.2","29254","Application Data, Application Data, Application Data"
"191","3.417426","23.198.241.2","192.168.1.166","TLSv1.2","1136","Application Data"
"192","3.417426","23.198.241.2","192.168.1.166","TLSv1.2","10274","Application Data, Application Data, Application Data"
"193","3.417426","23.198.241.2","192.168.1.166","TLSv1.2","815","Application Data"
"194","3.417470","192.168.1.166","23.198.241.2","TCP","54","58685  >  443 [ACK] Seq=87230 Ack=383132 Win=4095 Len=0"
"195","3.444058","23.198.241.2","192.168.1.166","TLSv1.2","338","Application Data"
"196","3.444074","192.168.1.166","23.198.241.2","TCP","54","58685  >  443 [ACK] Seq=87230 Ack=383416 Win=4094 Len=0"
"197","3.464632","23.198.241.2","192.168.1.166","TCP","1514","443  >  58685 [ACK] Seq=383416 Ack=87230 Win=9770 Len=1460 [TCP PDU reassembled in 200]"
"198","3.464632","23.198.241.2","192.168.1.166","TCP","1514","443  >  58685 [ACK] Seq=384876 Ack=87230 Win=9770 Len=1460 [TCP PDU reassembled in 200]"
"199","3.464632","23.198.241.2","192.168.1.166","TCP","1514","443  >  58685 [ACK] Seq=386336 Ack=87230 Win=9770 Len=1460 [TCP PDU reassembled in 200]"
"200","3.464632","23.198.241.2","192.168.1.166","TLSv1.2","401","Application Data"
"201","3.464632","23.198.241.2","192.168.1.166","TLSv1.2","338","Application Data"
"202","3.464632","23.198.241.2","192.168.1.166","TCP","1514","443  >  58685 [ACK] Seq=388427 Ack=87230 Win=9770 Len=1460 [TCP PDU reassembled in 204]"
"203","3.464632","23.198.241.2","192.168.1.166","TCP","1514","443  >  58685 [ACK] Seq=389887 Ack=87230 Win=9770 Len=1460 [TCP PDU reassembled in 204]"
"204","3.464632","23.198.241.2","192.168.1.166","TLSv1.2","751","Application Data"
"205","3.464632","23.198.241.2","192.168.1.166","TLSv1.2","369","Application Data"
"206","3.464632","23.198.241.2","192.168.1.166","TCP","1514","443  >  58685 [ACK] Seq=392359 Ack=87230 Win=9770 Len=1460 [TCP PDU reassembled in 208]"
"207","3.464632","23.198.241.2","192.168.1.166","TCP","8814","443  >  58685 [ACK] Seq=393819 Ack=87230 Win=9770 Len=8760 [TCP PDU reassembled in 208]"
"208","3.464632","23.198.241.2","192.168.1.166","TLSv1.2","152","Application Data"
"209","3.464632","23.198.241.2","192.168.1.166","TLSv1.2","382","Application Data"
"210","3.464632","23.198.241.2","192.168.1.166","TCP","2974","443  >  58685 [ACK] Seq=403005 Ack=87230 Win=9770 Len=2920 [TCP PDU reassembled in 211]"
"211","3.464632","23.198.241.2","192.168.1.166","TLSv1.2","115","Application Data"
"212","3.464632","23.198.241.2","192.168.1.166","TLSv1.2","350","Application Data"
"213","3.464632","23.198.241.2","192.168.1.166","TLSv1.2","150","Application Data"
"214","3.464632","23.198.241.2","192.168.1.166","TLSv1.2","358","Application Data"
"215","3.464632","23.198.241.2","192.168.1.166","TLSv1.2","580","Application Data"
"216","3.464632","23.198.241.2","192.168.1.166","TLSv1.2","1349","Application Data, Application Data"
"217","3.464632","23.198.241.2","192.168.1.166","TLSv1.2","384","Application Data"
"218","3.464632","23.198.241.2","192.168.1.166","TCP","16114","443  >  58685 [ACK] Seq=408833 Ack=87230 Win=9770 Len=16060 [TCP PDU reassembled in 219]"
"219","3.464632","23.198.241.2","192.168.1.166","TLSv1.2","400","Application Data"
"220","3.464632","23.198.241.2","192.168.1.166","TLSv1.2","85","Application Data"
"221","3.464632","23.198.241.2","192.168.1.166","TCP","16114","443  >  58685 [ACK] Seq=425270 Ack=87230 Win=9770 Len=16060 [TCP PDU reassembled in 222]"
"222","3.464632","23.198.241.2","192.168.1.166","TLSv1.2","400","Application Data"
"223","3.464632","23.198.241.2","192.168.1.166","TLSv1.2","32174","Application Data, Application Data, Application Data"
"224","3.464632","23.198.241.2","192.168.1.166","TLSv1.2","808","Application Data"
"225","3.464632","23.198.241.2","192.168.1.166","TLSv1.2","13194","Application Data"
"226","3.464632","23.198.241.2","192.168.1.166","TLSv1.2","1445","Application Data"
"227","3.464632","23.198.241.2","192.168.1.166","TLSv1.2","1514","Application Data"
"228","3.464632","23.198.241.2","192.168.1.166","TLSv1.2","1223","Application Data"
"229","3.464737","192.168.1.166","23.198.241.2","TCP","54","58685  >  443 [ACK] Seq=87230 Ack=491710 Win=4095 Len=0"
"230","3.464774","23.198.241.2","192.168.1.166","TLSv1.2","2974","Application Data"
"231","3.464774","23.198.241.2","192.168.1.166","TLSv1.2","1287","Application Data"
"232","3.464788","192.168.1.166","23.198.241.2","TCP","54","58685  >  443 [ACK] Seq=87230 Ack=495863 Win=4079 Len=0"
"233","3.465015","192.168.1.166","23.198.241.2","TCP","54","[TCP Window Update] 58685  >  443 [ACK] Seq=87230 Ack=495863 Win=4095 Len=0"
"234","3.467842","192.168.1.166","23.198.241.2","TLSv1.2","3722","Application Data"
"235","3.468774","192.168.1.166","23.198.241.2","TLSv1.2","3993","Application Data"
"236","3.493459","23.198.241.2","192.168.1.166","TCP","54","443  >  58685 [ACK] Seq=495863 Ack=90898 Win=9770 Len=0"
"237","3.493634","192.168.1.166","23.198.241.2","TLSv1.2","3993","Application Data"
"238","3.493714","192.168.1.166","23.198.241.2","TLSv1.2","3988","Application Data"
"239","3.493758","192.168.1.166","23.198.241.2","TLSv1.2","3977","Application Data"
"240","3.493806","192.168.1.166","23.198.241.2","TLSv1.2","3978","Application Data"
"241","3.507674","192.168.1.166","23.198.241.2","TLSv1.2","569","Application Data"
"242","3.507718","192.168.1.166","23.198.241.2","TLSv1.2","183","Application Data"
"243","3.507735","192.168.1.166","23.198.241.2","TLSv1.2","191","Application Data"
"244","3.507905","192.168.1.166","23.198.241.2","TLSv1.2","3735","Application Data"
"245","3.507969","192.168.1.166","23.198.241.2","TLSv1.2","3984","Application Data"
"246","3.508012","192.168.1.166","23.198.241.2","TLSv1.2","3984","Application Data"
"247","3.508041","192.168.1.166","23.198.241.2","TLSv1.2","576","Application Data"
"248","3.508858","23.198.241.2","192.168.1.166","TLSv1.2","382","Application Data"
"249","3.508858","23.198.241.2","192.168.1.166","TCP","2974","443  >  58685 [ACK] Seq=496191 Ack=94837 Win=9748 Len=2920 [TCP PDU reassembled in 250]"
"250","3.508858","23.198.241.2","192.168.1.166","TLSv1.2","1320","Application Data"
"251","3.508892","192.168.1.166","23.198.241.2","TCP","54","58685  >  443 [ACK] Seq=123401 Ack=500377 Win=4095 Len=0"
"252","3.516856","192.168.1.166","23.198.241.2","TLSv1.2","90","Application Data"
"253","3.516886","192.168.1.166","23.198.241.2","TLSv1.2","90","Application Data"
"254","3.516905","192.168.1.166","23.198.241.2","TLSv1.2","90","Application Data"
"255","3.516916","192.168.1.166","23.198.241.2","TLSv1.2","90","Application Data"
"256","3.519606","23.198.241.2","192.168.1.166","TCP","54","443  >  58685 [ACK] Seq=500377 Ack=97757 Win=9754 Len=0"
"257","3.522878","23.198.241.2","192.168.1.166","TLSv1.2","371","Application Data"
"258","3.522878","23.198.241.2","192.168.1.166","TCP","1514","443  >  58685 [ACK] Seq=500694 Ack=110557 Win=9686 Len=1460 [TCP PDU reassembled in 259]"
"259","3.522878","23.198.241.2","192.168.1.166","TLSv1.2","1193","Application Data"
"260","3.522900","192.168.1.166","23.198.241.2","TCP","54","58685  >  443 [ACK] Seq=123545 Ack=503293 Win=4095 Len=0"
"261","3.533613","23.198.241.2","192.168.1.166","TCP","54","443  >  58685 [ACK] Seq=503293 Ack=115019 Win=9741 Len=0"
"262","3.537552","23.198.241.2","192.168.1.166","TLSv1.2","1052","Application Data"
"263","3.537552","23.198.241.2","192.168.1.166","TCP","16114","443  >  58685 [ACK] Seq=504291 Ack=123401 Win=9696 Len=16060 [TCP PDU reassembled in 264]"
"264","3.537552","23.198.241.2","192.168.1.166","TLSv1.2","400","Application Data"
"265","3.537552","23.198.241.2","192.168.1.166","TLSv1.2","85","Application Data"
"266","3.537552","23.198.241.2","192.168.1.166","TCP","14654","443  >  58685 [ACK] Seq=520728 Ack=123401 Win=9696 Len=14600 [TCP PDU reassembled in 269]"
"267","3.537584","192.168.1.166","23.198.241.2","TCP","54","58685  >  443 [ACK] Seq=123545 Ack=535328 Win=4095 Len=0"
"268","3.538076","23.198.241.2","192.168.1.166","TCP","1514","443  >  58685 [ACK] Seq=535328 Ack=123401 Win=9696 Len=1460 [TCP PDU reassembled in 269]"
"269","3.538076","23.198.241.2","192.168.1.166","TLSv1.2","400","Application Data"
"270","3.538076","23.198.241.2","192.168.1.166","TLSv1.2","32174","Application Data, Application Data, Application Data"
"271","3.538076","23.198.241.2","192.168.1.166","TLSv1.2","808","Application Data"
"272","3.538104","192.168.1.166","23.198.241.2","TCP","54","58685  >  443 [ACK] Seq=123545 Ack=570008 Win=4095 Len=0"
"273","3.539022","23.198.241.2","192.168.1.166","TLSv1.2","56994","Application Data, Application Data, Application Data, Application Data, Application Data, Application Data, Application Data"
"274","3.539050","192.168.1.166","23.198.241.2","TCP","54","58685  >  443 [ACK] Seq=123545 Ack=626948 Win=4095 Len=0"
"275","3.540372","23.198.241.2","192.168.1.166","TLSv1.2","39474","Application Data, Application Data, Application Data, Application Data, Application Data, Application Data"
"276","3.540372","23.198.241.2","192.168.1.166","TLSv1.2","362","Application Data"
"277","3.540396","192.168.1.166","23.198.241.2","TCP","54","58685  >  443 [ACK] Seq=123545 Ack=666676 Win=4095 Len=0"
"278","3.541851","192.168.1.166","23.198.241.2","TLSv1.2","3781","Application Data"
"279","3.543640","192.168.1.166","23.198.241.2","TLSv1.2","578","Application Data"
"280","3.543672","192.168.1.166","23.198.241.2","TLSv1.2","192","Application Data"
"281","3.543830","192.168.1.166","23.198.241.2","TLSv1.2","3796","Application Data"
"282","3.543879","192.168.1.166","23.198.241.2","TLSv1.2","4045","Application Data"
"283","3.551715","23.198.241.2","192.168.1.166","TLSv1.2","372","Application Data"
"284","3.551715","23.198.241.2","192.168.1.166","TCP","1514","443  >  58685 [ACK] Seq=666994 Ack=123545 Win=9763 Len=1460 [TCP PDU reassembled in 288]"
"285","3.551715","23.198.241.2","192.168.1.166","TCP","1514","443  >  58685 [ACK] Seq=668454 Ack=123545 Win=9763 Len=1460 [TCP PDU reassembled in 288]"
"286","3.551715","23.198.241.2","192.168.1.166","TCP","1514","443  >  58685 [ACK] Seq=669914 Ack=123545 Win=9763 Len=1460 [TCP PDU reassembled in 288]"
"287","3.551715","23.198.241.2","192.168.1.166","TCP","1514","443  >  58685 [ACK] Seq=671374 Ack=123545 Win=9763 Len=1460 [TCP PDU reassembled in 288]"
"288","3.551715","23.198.241.2","192.168.1.166","TLSv1.2","410","Application Data"
"289","3.551715","23.198.241.2","192.168.1.166","TLSv1.2","383","Application Data"
"290","3.551715","23.198.241.2","192.168.1.166","TCP","1514","443  >  58685 [ACK] Seq=673519 Ack=123545 Win=9763 Len=1460 [TCP PDU reassembled in 293]"
"291","3.551715","23.198.241.2","192.168.1.166","TCP","1514","443  >  58685 [ACK] Seq=674979 Ack=123545 Win=9763 Len=1460 [TCP PDU reassembled in 293]"
"292","3.551715","23.198.241.2","192.168.1.166","TCP","1514","443  >  58685 [ACK] Seq=676439 Ack=123545 Win=9763 Len=1460 [TCP PDU reassembled in 293]"
"293","3.551715","23.198.241.2","192.168.1.166","TLSv1.2","1503","Application Data"
"294","3.551715","23.198.241.2","192.168.1.166","TLSv1.2","338","Application Data"
"295","3.551715","23.198.241.2","192.168.1.166","TLSv1.2","1117","Application Data"
"296","3.551715","23.198.241.2","192.168.1.166","TLSv1.2","336","Application Data"
"297","3.551715","23.198.241.2","192.168.1.166","TLSv1.2","487","Application Data"
"298","3.551715","23.198.241.2","192.168.1.166","TLSv1.2","317","Application Data"
"299","3.551715","23.198.241.2","192.168.1.166","TLSv1.2","1113","Application Data"
"300","3.551715","23.198.241.2","192.168.1.166","TLSv1.2","318","Application Data"
"301","3.551715","23.198.241.2","192.168.1.166","TCP","1514","443  >  58685 [ACK] Seq=682996 Ack=123545 Win=9770 Len=1460 [TCP PDU reassembled in 302]"
"302","3.551715","23.198.241.2","192.168.1.166","TLSv1.2","60","Application Data"
"303","3.551715","23.198.241.2","192.168.1.166","TCP","16114","443  >  58685 [ACK] Seq=684462 Ack=123545 Win=9770 Len=16060 [TCP PDU reassembled in 304]"
"304","3.551715","23.198.241.2","192.168.1.166","TLSv1.2","400","Application Data"
"305","3.551715","23.198.241.2","192.168.1.166","TLSv1.2","85","Application Data"
"306","3.551715","23.198.241.2","192.168.1.166","TCP","11734","443  >  58685 [ACK] Seq=700899 Ack=123545 Win=9770 Len=11680 [TCP PDU reassembled in 307]"
"307","3.551715","23.198.241.2","192.168.1.166","TLSv1.2","870","Application Data"
"308","3.551900","192.168.1.166","23.198.241.2","TCP","54","58685  >  443 [ACK] Seq=135667 Ack=713395 Win=4095 Len=0"
"309","3.554189","23.198.241.2","192.168.1.166","TLSv1.2","403","Application Data"
"310","3.554189","23.198.241.2","192.168.1.166","TCP","16114","443  >  58685 [ACK] Seq=713744 Ack=123545 Win=9770 Len=16060 [TCP PDU reassembled in 311]"
"311","3.554189","23.198.241.2","192.168.1.166","TLSv1.2","400","Application Data"
"312","3.554189","23.198.241.2","192.168.1.166","TLSv1.2","85","Application Data"
"313","3.554189","23.198.241.2","192.168.1.166","TCP","4434","443  >  58685 [ACK] Seq=730181 Ack=123545 Win=9770 Len=4380 [TCP PDU reassembled in 314]"
"314","3.554189","23.198.241.2","192.168.1.166","TLSv1.2","1161","Application Data"
"315","3.554189","23.198.241.2","192.168.1.166","TLSv1.2","16114","Application Data"
"316","3.554189","23.198.241.2","192.168.1.166","TLSv1.2","749","Application Data"
"317","3.554189","23.198.241.2","192.168.1.166","TLSv1.2","14654","Application Data, Application Data, Application Data"
"318","3.554244","192.168.1.166","23.198.241.2","TCP","54","58685  >  443 [ACK] Seq=135667 Ack=767023 Win=4095 Len=0"
"319","3.554400","23.198.241.2","192.168.1.166","TLSv1.2","11734","Application Data, Application Data"
"320","3.554400","23.198.241.2","192.168.1.166","TLSv1.2","649","Application Data"
"321","3.554421","192.168.1.166","23.198.241.2","TCP","54","58685  >  443 [ACK] Seq=135667 Ack=779298 Win=4095 Len=0"
"322","3.555509","192.168.1.166","23.198.241.2","TLSv1.2","572","Application Data"
"323","3.555524","192.168.1.166","23.198.241.2","TLSv1.2","193","Application Data"
"324","3.555545","192.168.1.166","23.198.241.2","TLSv1.2","192","Application Data"
"325","3.556114","192.168.1.166","23.198.241.2","TLSv1.2","191","Application Data"
"326","3.556967","192.168.1.166","23.198.241.2","TLSv1.2","3783","Application Data"
"327","3.557243","192.168.1.166","23.198.241.2","TLSv1.2","4040","Application Data"
"328","3.573451","23.198.241.2","192.168.1.166","TCP","54","443  >  58685 [ACK] Seq=779298 Ack=127934 Win=9750 Len=0"
"329","3.573451","23.198.241.2","192.168.1.166","TCP","54","443  >  58685 [ACK] Seq=779298 Ack=134596 Win=9715 Len=0"
"330","3.585070","192.168.1.166","23.198.241.2","TLSv1.2","4099","Application Data"
"331","3.585115","192.168.1.166","23.198.241.2","TLSv1.2","1899","Application Data"
"332","3.587401","23.198.241.2","192.168.1.166","TLSv1.2","404","Application Data"
"333","3.587401","23.198.241.2","192.168.1.166","TCP","16114","443  >  58685 [ACK] Seq=779648 Ack=135667 Win=9763 Len=16060 [TCP PDU reassembled in 334]"
"334","3.587401","23.198.241.2","192.168.1.166","TLSv1.2","400","Application Data"
"335","3.587401","23.198.241.2","192.168.1.166","TLSv1.2","85","Application Data"
"336","3.587401","23.198.241.2","192.168.1.166","TCP","4434","443  >  58685 [ACK] Seq=796085 Ack=135667 Win=9763 Len=4380 [TCP PDU reassembled in 337]"
"337","3.587401","23.198.241.2","192.168.1.166","TLSv1.2","1381","Application Data"
"338","3.587401","23.198.241.2","192.168.1.166","TLSv1.2","7354","Application Data"
"339","3.587401","23.198.241.2","192.168.1.166","TLSv1.2","663","Application Data"
"340","3.587401","23.198.241.2","192.168.1.166","TLSv1.2","7354","Application Data"
"341","3.587401","23.198.241.2","192.168.1.166","TLSv1.2","766","Application Data"
"342","3.587463","192.168.1.166","23.198.241.2","TCP","54","58685  >  443 [ACK] Seq=150204 Ack=817713 Win=4095 Len=0"
"343","3.589137","192.168.1.166","23.198.241.2","TLSv1.2","4040","Application Data"
"344","3.589184","192.168.1.166","23.198.241.2","TLSv1.2","577","Application Data"
"345","3.602824","23.198.241.2","192.168.1.166","TLSv1.2","404","Application Data"
"346","3.602824","23.198.241.2","192.168.1.166","TCP","1514","443  >  58685 [ACK] Seq=818063 Ack=144314 Win=9717 Len=1460 [TCP PDU reassembled in 357]"
"347","3.602824","23.198.241.2","192.168.1.166","TCP","1514","443  >  58685 [ACK] Seq=819523 Ack=144314 Win=9717 Len=1460 [TCP PDU reassembled in 357]"
"348","3.602824","23.198.241.2","192.168.1.166","TCP","1514","443  >  58685 [ACK] Seq=820983 Ack=144314 Win=9717 Len=1460 [TCP PDU reassembled in 357]"
"349","3.602824","23.198.241.2","192.168.1.166","TCP","1514","443  >  58685 [ACK] Seq=822443 Ack=144314 Win=9717 Len=1460 [TCP PDU reassembled in 357]"
"350","3.602824","23.198.241.2","192.168.1.166","TCP","1514","443  >  58685 [ACK] Seq=823903 Ack=144314 Win=9717 Len=1460 [TCP PDU reassembled in 357]"
"351","3.602824","23.198.241.2","192.168.1.166","TCP","1514","443  >  58685 [ACK] Seq=825363 Ack=144314 Win=9717 Len=1460 [TCP PDU reassembled in 357]"
"352","3.602824","23.198.241.2","192.168.1.166","TCP","1514","443  >  58685 [ACK] Seq=826823 Ack=144314 Win=9717 Len=1460 [TCP PDU reassembled in 357]"
"353","3.602824","23.198.241.2","192.168.1.166","TCP","1514","443  >  58685 [ACK] Seq=828283 Ack=144314 Win=9717 Len=1460 [TCP PDU reassembled in 357]"
"354","3.602824","23.198.241.2","192.168.1.166","TCP","1514","443  >  58685 [ACK] Seq=829743 Ack=144314 Win=9717 Len=1460 [TCP PDU reassembled in 357]"
"355","3.602824","23.198.241.2","192.168.1.166","TCP","1514","443  >  58685 [ACK] Seq=831203 Ack=144314 Win=9717 Len=1460 [TCP PDU reassembled in 357]"
"356","3.602824","23.198.241.2","192.168.1.166","TCP","1514","443  >  58685 [ACK] Seq=832663 Ack=144314 Win=9717 Len=1460 [TCP PDU reassembled in 357]"
"357","3.602824","23.198.241.2","192.168.1.166","TLSv1.2","400","Application Data"
"358","3.602824","23.198.241.2","192.168.1.166","TLSv1.2","85","Application Data"
"359","3.602824","23.198.241.2","192.168.1.166","TCP","1514","443  >  58685 [ACK] Seq=834500 Ack=144314 Win=9717 Len=1460 [TCP PDU reassembled in 363]"
"360","3.602824","23.198.241.2","192.168.1.166","TCP","1514","443  >  58685 [ACK] Seq=835960 Ack=144314 Win=9717 Len=1460 [TCP PDU reassembled in 363]"
"361","3.602824","23.198.241.2","192.168.1.166","TCP","1514","443  >  58685 [ACK] Seq=837420 Ack=144314 Win=9717 Len=1460 [TCP PDU reassembled in 363]"
"362","3.602824","23.198.241.2","192.168.1.166","TCP","1514","443  >  58685 [ACK] Seq=838880 Ack=144314 Win=9717 Len=1460 [TCP PDU reassembled in 363]"
