"No.","Time","Source","Destination","Protocol","Length","Info"
"1","0.000000","192.168.1.166","23.39.213.4","TLSv1.2","5870","Application Data"
"2","0.000060","192.168.1.166","23.39.213.4","TLSv1.2","93","Application Data"
"3","0.002612","192.168.1.166","23.39.213.4","TLSv1.2","5281","Application Data"
"4","0.002636","192.168.1.166","23.39.213.4","TLSv1.2","629","Application Data"
"5","0.032077","23.39.213.4","192.168.1.166","TCP","54","443  >  50692 [ACK] Seq=1 Ack=1461 Win=9945 Len=0"
"6","0.035296","23.39.213.4","192.168.1.166","TCP","54","443  >  50692 [ACK] Seq=1 Ack=2921 Win=9945 Len=0"
"7","0.035296","23.39.213.4","192.168.1.166","TCP","54","443  >  50692 [ACK] Seq=1 Ack=5817 Win=9937 Len=0"
"8","0.035296","23.39.213.4","192.168.1.166","TCP","54","443  >  50692 [ACK] Seq=1 Ack=5856 Win=9937 Len=0"
"9","0.035296","23.39.213.4","192.168.1.166","TLSv1.2","93","Application Data"
"10","0.037270","23.39.213.4","192.168.1.166","TCP","54","443  >  50692 [ACK] Seq=40 Ack=11658 Win=9928 Len=0"
"11","0.090034","192.168.1.166","23.39.213.4","TCP","54","50692  >  443 [ACK] Seq=11658 Ack=40 Win=16379 Len=0"
"12","0.091562","23.39.213.4","192.168.1.166","TLSv1.2","355","Application Data"
"13","0.091562","23.39.213.4","192.168.1.166","TLSv1.2","121","Application Data"
"14","0.091579","192.168.1.166","23.39.213.4","TCP","54","50692  >  443 [ACK] Seq=11658 Ack=408 Win=16378 Len=0"
"15","0.092015","192.168.1.166","23.39.213.4","TLSv1.2","89","Application Data"
"16","0.165407","23.39.213.4","192.168.1.166","TCP","54","443  >  50692 [ACK] Seq=408 Ack=11693 Win=9949 Len=0"
"17","0.429358","23.39.213.4","192.168.1.166","TLSv1.2","1454","Application Data"
"18","0.429358","23.39.213.4","192.168.1.166","TCP","4434","443  >  50692 [ACK] Seq=1808 Ack=11693 Win=9949 Len=4380 [TCP PDU reassembled in 25]"
"19","0.429387","192.168.1.166","23.39.213.4","TCP","54","50692  >  443 [ACK] Seq=11693 Ack=6188 Win=16383 Len=0"
"20","0.432866","23.39.213.4","192.168.1.166","TCP","1514","443  >  50692 [ACK] Seq=6188 Ack=11693 Win=9949 Len=1460 [TCP PDU reassembled in 25]"
"21","0.432866","23.39.213.4","192.168.1.166","TCP","1514","443  >  50692 [ACK] Seq=7648 Ack=11693 Win=9949 Len=1460 [TCP PDU reassembled in 25]"
"22","0.432866","23.39.213.4","192.168.1.166","TCP","1514","443  >  50692 [ACK] Seq=9108 Ack=11693 Win=9949 Len=1460 [TCP PDU reassembled in 25]"
"23","0.432866","23.39.213.4","192.168.1.166","TCP","1514","443  >  50692 [ACK] Seq=10568 Ack=11693 Win=9949 Len=1460 [TCP PDU reassembled in 25]"
"24","0.432866","23.39.213.4","192.168.1.166","TCP","5894","443  >  50692 [ACK] Seq=12028 Ack=11693 Win=9949 Len=5840 [TCP PDU reassembled in 25]"
"25","0.432866","23.39.213.4","192.168.1.166","TLSv1.2","400","Application Data"
"26","0.432866","23.39.213.4","192.168.1.166","TLSv1.2","4434","Application Data"
"27","0.432866","23.39.213.4","192.168.1.166","TLSv1.2","958","Application Data"
"28","0.432914","192.168.1.166","23.39.213.4","TCP","54","50692  >  443 [ACK] Seq=11693 Ack=23498 Win=16383 Len=0"
"29","0.439827","192.168.1.166","23.39.213.4","TLSv1.2","5453","Application Data"
"30","0.472907","23.39.213.4","192.168.1.166","TCP","54","443  >  50692 [ACK] Seq=23498 Ack=13153 Win=9945 Len=0"
"31","0.472907","23.39.213.4","192.168.1.166","TCP","54","443  >  50692 [ACK] Seq=23498 Ack=14613 Win=9937 Len=0"
"32","0.472907","23.39.213.4","192.168.1.166","TCP","54","443  >  50692 [ACK] Seq=23498 Ack=17092 Win=9939 Len=0"
"33","1.924484","192.168.1.166","23.39.213.4","TLSv1.2","5293","Application Data"
"34","1.924508","192.168.1.166","23.39.213.4","TLSv1.2","629","Application Data"
"35","1.958104","23.39.213.4","192.168.1.166","TCP","54","443  >  50692 [ACK] Seq=23498 Ack=18552 Win=9945 Len=0"
"36","1.958104","23.39.213.4","192.168.1.166","TCP","54","443  >  50692 [ACK] Seq=23498 Ack=22331 Win=9925 Len=0"
"37","1.958104","23.39.213.4","192.168.1.166","TCP","54","443  >  50692 [ACK] Seq=23498 Ack=22906 Win=9921 Len=0"
"38","2.077316","23.39.213.4","192.168.1.166","TLSv1.2","355","Application Data"
"39","2.077316","23.39.213.4","192.168.1.166","TLSv1.2","121","Application Data"
"40","2.077341","192.168.1.166","23.39.213.4","TCP","54","50692  >  443 [ACK] Seq=22906 Ack=23866 Win=16382 Len=0"
"41","2.162931","23.39.213.4","192.168.1.166","TLSv1.2","1480","Application Data"
"42","2.162931","23.39.213.4","192.168.1.166","TCP","16114","443  >  50692 [ACK] Seq=25292 Ack=22906 Win=9949 Len=16060 [TCP PDU reassembled in 43]"
"43","2.162931","23.39.213.4","192.168.1.166","TLSv1.2","400","Application Data"
"44","2.162931","23.39.213.4","192.168.1.166","TLSv1.2","85","Application Data"
"45","2.162931","23.39.213.4","192.168.1.166","TCP","16114","443  >  50692 [ACK] Seq=41729 Ack=22906 Win=9949 Len=16060 [TCP PDU reassembled in 46]"
"46","2.162931","23.39.213.4","192.168.1.166","TLSv1.2","400","Application Data"
"47","2.162931","23.39.213.4","192.168.1.166","TLSv1.2","5894","Application Data"
"48","2.162990","192.168.1.166","23.39.213.4","TCP","54","50692  >  443 [ACK] Seq=22906 Ack=63975 Win=16383 Len=0"
"49","2.165828","23.39.213.4","192.168.1.166","TLSv1.2","1514","Application Data"
"50","2.165828","23.39.213.4","192.168.1.166","TCP","1514","443  >  50692 [ACK] Seq=65435 Ack=22906 Win=9949 Len=1460 [TCP PDU reassembled in 54]"
"51","2.165828","23.39.213.4","192.168.1.166","TCP","1514","443  >  50692 [ACK] Seq=66895 Ack=22906 Win=9949 Len=1460 [TCP PDU reassembled in 54]"
"52","2.165828","23.39.213.4","192.168.1.166","TCP","1514","443  >  50692 [ACK] Seq=68355 Ack=22906 Win=9949 Len=1460 [TCP PDU reassembled in 54]"
"53","2.165828","23.39.213.4","192.168.1.166","TCP","1514","443  >  50692 [ACK] Seq=69815 Ack=22906 Win=9949 Len=1460 [TCP PDU reassembled in 54]"
"54","2.165828","23.39.213.4","192.168.1.166","TLSv1.2","582","Application Data"
"55","2.165868","192.168.1.166","23.39.213.4","TCP","54","50692  >  443 [ACK] Seq=22906 Ack=71803 Win=16383 Len=0"
"56","2.168084","23.39.213.4","192.168.1.166","TCP","1514","443  >  50692 [ACK] Seq=71803 Ack=22906 Win=9949 Len=1460 [TCP PDU reassembled in 61]"
"57","2.168084","23.39.213.4","192.168.1.166","TCP","1514","443  >  50692 [ACK] Seq=73263 Ack=22906 Win=9949 Len=1460 [TCP PDU reassembled in 61]"
"58","2.168084","23.39.213.4","192.168.1.166","TCP","1514","443  >  50692 [ACK] Seq=74723 Ack=22906 Win=9949 Len=1460 [TCP PDU reassembled in 61]"
"59","2.168084","23.39.213.4","192.168.1.166","TCP","1514","443  >  50692 [ACK] Seq=76183 Ack=22906 Win=9949 Len=1460 [TCP PDU reassembled in 61]"
"60","2.168084","23.39.213.4","192.168.1.166","TCP","10274","443  >  50692 [ACK] Seq=77643 Ack=22906 Win=9949 Len=10220 [TCP PDU reassembled in 61]"
"61","2.168084","23.39.213.4","192.168.1.166","TLSv1.2","400","Application Data"
"62","2.168084","23.39.213.4","192.168.1.166","TLSv1.2","85","Application Data"
"63","2.168084","23.39.213.4","192.168.1.166","TCP","1514","443  >  50692 [ACK] Seq=88240 Ack=22906 Win=9949 Len=1460 [TCP PDU reassembled in 68]"
"64","2.168084","23.39.213.4","192.168.1.166","TCP","1514","443  >  50692 [ACK] Seq=89700 Ack=22906 Win=9949 Len=1460 [TCP PDU reassembled in 68]"
"65","2.168084","23.39.213.4","192.168.1.166","TCP","1514","443  >  50692 [ACK] Seq=91160 Ack=22906 Win=9949 Len=1460 [TCP PDU reassembled in 68]"
"66","2.168084","23.39.213.4","192.168.1.166","TCP","1514","443  >  50692 [ACK] Seq=92620 Ack=22906 Win=9949 Len=1460 [TCP PDU reassembled in 68]"
"67","2.168084","23.39.213.4","192.168.1.166","TCP","2974","443  >  50692 [ACK] Seq=94080 Ack=22906 Win=9949 Len=2920 [TCP PDU reassembled in 68]"
"68","2.168084","23.39.213.4","192.168.1.166","TLSv1.2","312","Application Data"
"69","2.168141","192.168.1.166","23.39.213.4","TCP","54","50692  >  443 [ACK] Seq=22906 Ack=97258 Win=16383 Len=0"
"70","2.169967","23.39.213.4","192.168.1.166","TCP","16114","443  >  50692 [ACK] Seq=97258 Ack=22906 Win=9949 Len=16060 [TCP PDU reassembled in 71]"
"71","2.169967","23.39.213.4","192.168.1.166","TLSv1.2","400","Application Data"
"72","2.169967","23.39.213.4","192.168.1.166","TLSv1.2","85","Application Data"
"73","2.169967","23.39.213.4","192.168.1.166","TCP","4434","443  >  50692 [ACK] Seq=113695 Ack=22906 Win=9949 Len=4380 [TCP PDU reassembled in 74]"
"74","2.169967","23.39.213.4","192.168.1.166","TLSv1.2","1131","Application Data"
"75","2.170001","192.168.1.166","23.39.213.4","TCP","54","50692  >  443 [ACK] Seq=22906 Ack=119152 Win=16383 Len=0"
"76","2.171469","192.168.1.166","23.39.213.4","TLSv1.2","5585","Application Data"
"77","2.171511","192.168.1.166","23.39.213.4","TLSv1.2","1644","Application Data"
"78","2.177266","23.39.213.4","192.168.1.166","TCP","16114","443  >  50692 [ACK] Seq=119152 Ack=22906 Win=9949 Len=16060 [TCP PDU reassembled in 79]"
"79","2.177266","23.39.213.4","192.168.1.166","TLSv1.2","400","Application Data"
"80","2.177266","23.39.213.4","192.168.1.166","TLSv1.2","85","Application Data"
"81","2.177311","192.168.1.166","23.39.213.4","TCP","54","50692  >  443 [ACK] Seq=30027 Ack=135589 Win=16383 Len=0"
"82","2.178344","23.39.213.4","192.168.1.166","TCP","7354","443  >  50692 [ACK] Seq=135589 Ack=22906 Win=9949 Len=7300 [TCP PDU reassembled in 83]"
"83","2.178344","23.39.213.4","192.168.1.166","TLSv1.2","499","Application Data"
"84","2.178371","192.168.1.166","23.39.213.4","TCP","54","50692  >  443 [ACK] Seq=30027 Ack=143334 Win=16383 Len=0"
"85","2.181748","23.39.213.4","192.168.1.166","TCP","16114","443  >  50692 [ACK] Seq=143334 Ack=22906 Win=9949 Len=16060 [TCP PDU reassembled in 86]"
"86","2.181748","23.39.213.4","192.168.1.166","TLSv1.2","400","Application Data"
"87","2.181748","23.39.213.4","192.168.1.166","TLSv1.2","85","Application Data"
"88","2.181748","23.39.213.4","192.168.1.166","TCP","5894","443  >  50692 [ACK] Seq=159771 Ack=22906 Win=9949 Len=5840 [TCP PDU reassembled in 89]"
"89","2.181748","23.39.213.4","192.168.1.166","TLSv1.2","1120","Application Data"
"90","2.181788","192.168.1.166","23.39.213.4","TCP","54","50692  >  443 [ACK] Seq=30027 Ack=166677 Win=16383 Len=0"
"91","2.185189","23.39.213.4","192.168.1.166","TCP","16114","443  >  50692 [ACK] Seq=166677 Ack=22906 Win=9949 Len=16060 [TCP PDU reassembled in 92]"
"92","2.185189","23.39.213.4","192.168.1.166","TLSv1.2","400","Application Data"
"93","2.185189","23.39.213.4","192.168.1.166","TLSv1.2","85","Application Data"
"94","2.185219","192.168.1.166","23.39.213.4","TCP","54","50692  >  443 [ACK] Seq=30027 Ack=183114 Win=16383 Len=0"
"95","2.186007","23.39.213.4","192.168.1.166","TCP","8814","443  >  50692 [ACK] Seq=183114 Ack=22906 Win=9949 Len=8760 [TCP PDU reassembled in 96]"
"96","2.186007","23.39.213.4","192.168.1.166","TLSv1.2","70","Application Data"
"97","2.186053","192.168.1.166","23.39.213.4","TCP","54","50692  >  443 [ACK] Seq=30027 Ack=191890 Win=16383 Len=0"
"98","2.187513","23.39.213.4","192.168.1.166","TCP","11734","443  >  50692 [ACK] Seq=191890 Ack=22906 Win=9949 Len=11680 [TCP PDU reassembled in 99]"
"99","2.187513","23.39.213.4","192.168.1.166","TLSv1.2","896","Application Data"
"100","2.187513","23.39.213.4","192.168.1.166","TLSv1.2","93","Application Data"
"101","2.187513","23.39.213.4","192.168.1.166","TLSv1.2","85","Application Data"
"102","2.187543","192.168.1.166","23.39.213.4","TCP","54","50692  >  443 [ACK] Seq=30027 Ack=204482 Win=16383 Len=0"
"103","2.203667","23.39.213.4","192.168.1.166","TCP","54","443  >  50692 [ACK] Seq=204482 Ack=24366 Win=9945 Len=0"
"104","2.203667","23.39.213.4","192.168.1.166","TCP","54","443  >  50692 [ACK] Seq=204482 Ack=25826 Win=9945 Len=0"
"105","2.203667","23.39.213.4","192.168.1.166","TCP","54","443  >  50692 [ACK] Seq=204482 Ack=27286 Win=9945 Len=0"
"106","2.203900","23.39.213.4","192.168.1.166","TCP","54","443  >  50692 [ACK] Seq=204482 Ack=28437 Win=9946 Len=0"
"107","2.203900","23.39.213.4","192.168.1.166","TCP","54","443  >  50692 [ACK] Seq=204482 Ack=29897 Win=9945 Len=0"
"108","2.203900","23.39.213.4","192.168.1.166","TCP","54","443  >  50692 [ACK] Seq=204482 Ack=30027 Win=9944 Len=0"
"109","2.211189","192.168.1.166","23.39.213.4","TLSv1.2","576","Application Data"
"110","2.211218","192.168.1.166","23.39.213.4","TLSv1.2","164","Application Data"
"111","2.242653","23.39.213.4","192.168.1.166","TCP","54","443  >  50692 [ACK] Seq=204482 Ack=30549 Win=9949 Len=0"
"112","2.242653","23.39.213.4","192.168.1.166","TCP","54","443  >  50692 [ACK] Seq=204482 Ack=30659 Win=9949 Len=0"
"113","2.243143","23.39.213.4","192.168.1.166","TLSv1.2","361","Application Data"
"114","2.243143","23.39.213.4","192.168.1.166","TLSv1.2","289","Application Data"
"115","2.243157","192.168.1.166","23.39.213.4","TCP","54","50692  >  443 [ACK] Seq=30659 Ack=205024 Win=16381 Len=0"
"116","2.255301","23.39.213.4","192.168.1.166","TLSv1.2","325","Application Data"
"117","2.255301","23.39.213.4","192.168.1.166","TLSv1.2","1245","Application Data"
"118","2.255342","192.168.1.166","23.39.213.4","TCP","54","50692  >  443 [ACK] Seq=30659 Ack=206486 Win=16383 Len=0"
"119","2.259750","192.168.1.166","23.39.213.4","TLSv1.2","164","Application Data"
"120","2.259778","192.168.1.166","23.39.213.4","TLSv1.2","164","Application Data"
"121","2.261642","192.168.1.166","23.39.213.4","TLSv1.2","5073","Application Data"
"122","2.266525","192.168.1.166","23.39.213.4","TLSv1.2","558","Application Data"
"123","2.270038","192.168.1.166","23.39.213.4","TLSv1.2","177","Application Data"
"124","2.270070","192.168.1.166","23.39.213.4","TLSv1.2","180","Application Data"
"125","2.271021","23.39.213.4","192.168.1.166","TLSv1.2","318","Application Data"
"126","2.271021","23.39.213.4","192.168.1.166","TLSv1.2","1471","Application Data"
"127","2.271111","192.168.1.166","23.39.213.4","TCP","54","50692  >  443 [ACK] Seq=36651 Ack=208167 Win=16383 Len=0"
"128","2.271376","23.39.213.4","192.168.1.166","TCP","7354","443  >  50692 [ACK] Seq=208167 Ack=30659 Win=9949 Len=7300 [TCP PDU reassembled in 131]"
"129","2.271399","192.168.1.166","23.39.213.4","TCP","54","50692  >  443 [ACK] Seq=36651 Ack=215467 Win=16383 Len=0"
"130","2.272332","23.39.213.4","192.168.1.166","TCP","8814","443  >  50692 [ACK] Seq=215467 Ack=30659 Win=9949 Len=8760 [TCP PDU reassembled in 131]"
"131","2.272332","23.39.213.4","192.168.1.166","TLSv1.2","400","Application Data"
"132","2.272332","23.39.213.4","192.168.1.166","TLSv1.2","85","Application Data"
"133","2.272332","23.39.213.4","192.168.1.166","TCP","13194","443  >  50692 [ACK] Seq=224604 Ack=30659 Win=9949 Len=13140 [TCP PDU reassembled in 134]"
"134","2.272332","23.39.213.4","192.168.1.166","TLSv1.2","119","Application Data"
"135","2.272363","192.168.1.166","23.39.213.4","TCP","54","50692  >  443 [ACK] Seq=36651 Ack=237809 Win=16383 Len=0"
"136","2.295567","23.39.213.4","192.168.1.166","TCP","54","443  >  50692 [ACK] Seq=237809 Ack=35898 Win=9921 Len=0"
"137","2.296849","192.168.1.166","23.39.213.4","TLSv1.2","5136","Application Data"
"138","2.298723","192.168.1.166","23.39.213.4","TLSv1.2","563","Application Data"
"139","2.309539","192.168.1.166","23.39.213.4","TLSv1.2","197","Application Data"
"140","2.309580","192.168.1.166","23.39.213.4","TLSv1.2","183","Application Data"
"141","2.309603","192.168.1.166","23.39.213.4","TLSv1.2","183","Application Data"
"142","2.309623","192.168.1.166","23.39.213.4","TLSv1.2","183","Application Data"
"143","2.310533","23.39.213.4","192.168.1.166","TLSv1.2","338","Application Data"
"144","2.310533","23.39.213.4","192.168.1.166","TCP","2974","443  >  50692 [ACK] Seq=238093 Ack=36651 Win=9944 Len=2920 [TCP PDU reassembled in 145]"
"145","2.310533","23.39.213.4","192.168.1.166","TLSv1.2","307","Application Data"
"146","2.310533","23.39.213.4","192.168.1.166","TLSv1.2","338","Application Data"
"147","2.310533","23.39.213.4","192.168.1.166","TCP","5894","443  >  50692 [ACK] Seq=241550 Ack=36651 Win=9944 Len=5840 [TCP PDU reassembled in 148]"
"148","2.310533","23.39.213.4","192.168.1.166","TLSv1.2","109","Application Data"
"149","2.310533","23.39.213.4","192.168.1.166","TLSv1.2","960","Application Data"
"150","2.310585","192.168.1.166","23.39.213.4","TCP","54","50692  >  443 [ACK] Seq=42772 Ack=248351 Win=16383 Len=0"
"151","2.323114","23.39.213.4","192.168.1.166","TLSv1.2","85","Application Data"
"152","2.323114","23.39.213.4","192.168.1.166","TLSv1.2","327","Application Data"
"153","2.323114","23.39.213.4","192.168.1.166","TLSv1.2","1379","Application Data"
"154","2.323114","23.39.213.4","192.168.1.166","TLSv1.2","327","Application Data"
"155","2.323114","23.39.213.4","192.168.1.166","TLSv1.2","1117","Application Data"
"156","2.323114","23.39.213.4","192.168.1.166","TLSv1.2","327","Application Data"
"157","2.323114","23.39.213.4","192.168.1.166","TLSv1.2","1171","Application Data"
"158","2.323174","192.168.1.166","23.39.213.4","TCP","54","50692  >  443 [ACK] Seq=42772 Ack=252706 Win=16383 Len=0"
"159","2.324868","192.168.1.166","23.39.213.4","TLSv1.2","181","Application Data"
"160","2.329928","23.39.213.4","192.168.1.166","TCP","54","443  >  50692 [ACK] Seq=252706 Ack=41733 Win=9925 Len=0"
"161","2.341920","23.39.213.4","192.168.1.166","TLSv1.2","373","Application Data"
"162","2.341920","23.39.213.4","192.168.1.166","TCP","54","443  >  50692 [ACK] Seq=253025 Ack=42772 Win=9949 Len=0"
"163","2.360582","23.39.213.4","192.168.1.166","TLSv1.2","339","Application Data"
"164","2.360582","23.39.213.4","192.168.1.166","TLSv1.2","469","Application Data"
"165","2.360582","23.39.213.4","192.168.1.166","TLSv1.2","85","Application Data"
"166","2.360582","23.39.213.4","192.168.1.166","TLSv1.2","327","Application Data"
"167","2.360582","23.39.213.4","192.168.1.166","TLSv1.2","1150","Application Data"
"168","2.360633","192.168.1.166","23.39.213.4","TCP","54","50692  >  443 [ACK] Seq=42899 Ack=255125 Win=16383 Len=0"
"169","2.362053","192.168.1.166","23.39.213.4","TLSv1.2","178","Application Data"
"170","2.362095","192.168.1.166","23.39.213.4","TLSv1.2","177","Application Data"
"171","2.387040","23.39.213.4","192.168.1.166","TLSv1.2","317","Application Data"
"172","2.387040","23.39.213.4","192.168.1.166","TLSv1.2","985","Application Data"
"173","2.387040","23.39.213.4","192.168.1.166","TLSv1.2","338","Application Data"
"174","2.387040","23.39.213.4","192.168.1.166","TLSv1.2","779","Application Data"
"175","2.387040","23.39.213.4","192.168.1.166","TLSv1.2","1514","Application Data"
"176","2.387040","23.39.213.4","192.168.1.166","TLSv1.2","85","Application Data"
"177","2.387086","192.168.1.166","23.39.213.4","TCP","54","50692  >  443 [ACK] Seq=43146 Ack=258819 Win=16383 Len=0"
"178","2.388448","192.168.1.166","23.39.213.4","TLSv1.2","182","Application Data"
"179","2.388475","192.168.1.166","23.39.213.4","TLSv1.2","192","Application Data"
"180","2.388489","192.168.1.166","23.39.213.4","TLSv1.2","192","Application Data"
"181","2.392151","23.39.213.4","192.168.1.166","TLSv1.2","338","Application Data"
"182","2.392151","23.39.213.4","192.168.1.166","TLSv1.2","279","Application Data"
"183","2.392172","192.168.1.166","23.39.213.4","TCP","54","50692  >  443 [ACK] Seq=43550 Ack=259328 Win=16381 Len=0"
"184","2.393340","192.168.1.166","23.39.213.4","TLSv1.2","192","Application Data"
"185","2.394386","23.39.213.4","192.168.1.166","TCP","54","443  >  50692 [ACK] Seq=259328 Ack=43146 Win=9949 Len=0"
"186","2.405447","23.39.213.4","192.168.1.166","TLSv1.2","327","Application Data"
"187","2.405447","23.39.213.4","192.168.1.166","TLSv1.2","1035","Application Data"
"188","2.405447","23.39.213.4","192.168.1.166","TLSv1.2","327","Application Data"
"189","2.405447","23.39.213.4","192.168.1.166","TLSv1.2","992","Application Data"
"190","2.405479","192.168.1.166","23.39.213.4","TCP","54","50692  >  443 [ACK] Seq=43688 Ack=261793 Win=16383 Len=0"
"191","2.406570","192.168.1.166","23.39.213.4","TLSv1.2","192","Application Data"
"192","2.406634","192.168.1.166","23.39.213.4","TLSv1.2","192","Application Data"
"193","2.419296","23.39.213.4","192.168.1.166","TCP","54","443  >  50692 [ACK] Seq=261793 Ack=43550 Win=9949 Len=0"
"194","2.439010","23.39.213.4","192.168.1.166","TLSv1.2","327","Application Data"
"195","2.439010","23.39.213.4","192.168.1.166","TLSv1.2","927","Application Data"
"196","2.439043","192.168.1.166","23.39.213.4","TCP","54","50692  >  443 [ACK] Seq=43964 Ack=262939 Win=16379 Len=0"
"197","2.439858","192.168.1.166","23.39.213.4","TLSv1.2","192","Application Data"
"198","2.494685","23.39.213.4","192.168.1.166","TLSv1.2","317","Application Data"
"199","2.494685","23.39.213.4","192.168.1.166","TCP","1514","443  >  50692 [ACK] Seq=263202 Ack=44102 Win=9949 Len=1460 [TCP PDU reassembled in 200]"
"200","2.494685","23.39.213.4","192.168.1.166","TLSv1.2","92","Application Data"
"201","2.494685","23.39.213.4","192.168.1.166","TCP","1514","443  >  50692 [ACK] Seq=264700 Ack=44102 Win=9949 Len=1460 [TCP PDU reassembled in 202]"
"202","2.494685","23.39.213.4","192.168.1.166","TLSv1.2","1280","Application Data"
"203","2.494723","192.168.1.166","23.39.213.4","TCP","54","50692  >  443 [ACK] Seq=44102 Ack=267386 Win=16383 Len=0"
"204","2.495462","192.168.1.166","23.39.213.4","TLSv1.2","192","Application Data"
"205","2.551283","23.39.213.4","192.168.1.166","TLSv1.2","318","Application Data"
"206","2.551283","23.39.213.4","192.168.1.166","TCP","1514","443  >  50692 [ACK] Seq=267650 Ack=44240 Win=9949 Len=1460 [TCP PDU reassembled in 207]"
"207","2.551283","23.39.213.4","192.168.1.166","TLSv1.2","92","Application Data"
"208","2.551323","192.168.1.166","23.39.213.4","TCP","54","50692  >  443 [ACK] Seq=44240 Ack=269148 Win=16383 Len=0"
"209","2.578226","23.39.213.4","192.168.1.166","TCP","7354","443  >  50692 [ACK] Seq=269148 Ack=44240 Win=9949 Len=7300 [TCP PDU reassembled in 210]"
"210","2.578226","23.39.213.4","192.168.1.166","TLSv1.2","448","Application Data"
"211","2.578226","23.39.213.4","192.168.1.166","TLSv1.2","317","Application Data"
"212","2.578226","23.39.213.4","192.168.1.166","TCP","1514","443  >  50692 [ACK] Seq=277105 Ack=44240 Win=9949 Len=1460 [TCP PDU reassembled in 213]"
"213","2.578226","23.39.213.4","192.168.1.166","TLSv1.2","95","Application Data"
"214","2.578279","192.168.1.166","23.39.213.4","TCP","54","50692  >  443 [ACK] Seq=44240 Ack=278606 Win=16383 Len=0"
"215","2.579025","192.168.1.166","23.39.213.4","TLSv1.2","192","Application Data"
"216","2.579316","23.39.213.4","192.168.1.166","TCP","1514","443  >  50692 [ACK] Seq=278606 Ack=44240 Win=9949 Len=1460 [TCP PDU reassembled in 218]"
"217","2.579316","23.39.213.4","192.168.1.166","TCP","1514","443  >  50692 [ACK] Seq=280066 Ack=44240 Win=9949 Len=1460 [TCP PDU reassembled in 218]"
"218","2.579316","23.39.213.4","192.168.1.166","TLSv1.2","925","Application Data"
"219","2.579316","23.39.213.4","192.168.1.166","TLSv1.2","318","Application Data"
"220","2.579316","23.39.213.4","192.168.1.166","TCP","1514","443  >  50692 [ACK] Seq=282661 Ack=44240 Win=9949 Len=1460 [TCP PDU reassembled in 221]"
"221","2.579316","23.39.213.4","192.168.1.166","TLSv1.2","91","Application Data"
"222","2.579347","192.168.1.166","23.39.213.4","TCP","54","50692  >  443 [ACK] Seq=44378 Ack=284158 Win=16383 Len=0"
"223","2.581807","23.39.213.4","192.168.1.166","TLSv1.2","316","Application Data"
"224","2.581807","23.39.213.4","192.168.1.166","TCP","1514","443  >  50692 [ACK] Seq=284420 Ack=44240 Win=9949 Len=1460 [TCP PDU reassembled in 225]"
"225","2.581807","23.39.213.4","192.168.1.166","TLSv1.2","93","Application Data"
"226","2.581807","23.39.213.4","192.168.1.166","TCP","10274","443  >  50692 [ACK] Seq=285919 Ack=44240 Win=9949 Len=10220 [TCP PDU reassembled in 227]"
"227","2.581807","23.39.213.4","192.168.1.166","TLSv1.2","832","Application Data"
"228","2.581807","23.39.213.4","192.168.1.166","TLSv1.2","317","Application Data"
"229","2.581807","23.39.213.4","192.168.1.166","TLSv1.2","1456","Application Data"
"230","2.581857","192.168.1.166","23.39.213.4","TCP","54","50692  >  443 [ACK] Seq=44378 Ack=298582 Win=16383 Len=0"
"231","2.583814","23.39.213.4","192.168.1.166","TCP","2974","443  >  50692 [ACK] Seq=298582 Ack=44240 Win=9949 Len=2920 [TCP PDU reassembled in 232]"
"232","2.583814","23.39.213.4","192.168.1.166","TLSv1.2","815","Application Data"
"233","2.583814","23.39.213.4","192.168.1.166","TCP","4434","443  >  50692 [ACK] Seq=302263 Ack=44240 Win=9949 Len=4380 [TCP PDU reassembled in 234]"
"234","2.583814","23.39.213.4","192.168.1.166","TLSv1.2","886","Application Data"
"235","2.583855","192.168.1.166","23.39.213.4","TCP","54","50692  >  443 [ACK] Seq=44378 Ack=307475 Win=16383 Len=0"
"236","2.652539","23.39.213.4","192.168.1.166","TCP","54","443  >  50692 [ACK] Seq=307475 Ack=44378 Win=9949 Len=0"
"237","2.661802","192.168.1.166","23.39.213.4","TLSv1.2","5213","Application Data"
"238","2.661869","192.168.1.166","23.39.213.4","TLSv1.2","588","Application Data"
"239","2.693225","23.39.213.4","192.168.1.166","TCP","54","443  >  50692 [ACK] Seq=307475 Ack=50071 Win=9928 Len=0"
"240","2.748785","23.39.213.4","192.168.1.166","TLSv1.2","318","Application Data"
"241","2.748785","23.39.213.4","192.168.1.166","TLSv1.2","1456","Application Data"
"242","2.748785","23.39.213.4","192.168.1.166","TCP","1514","443  >  50692 [ACK] Seq=309141 Ack=50071 Win=9949 Len=1460 [TCP PDU reassembled in 243]"
"243","2.748785","23.39.213.4","192.168.1.166","TLSv1.2","616","Application Data"
"244","2.748837","192.168.1.166","23.39.213.4","TCP","54","50692  >  443 [ACK] Seq=50071 Ack=311163 Win=16383 Len=0"
"245","2.765202","192.168.1.166","23.39.213.4","TLSv1.2","5462","Application Data"
"246","2.765254","192.168.1.166","23.39.213.4","TLSv1.2","3641","Application Data"
"247","2.783676","23.39.213.4","192.168.1.166","TLSv1.2","317","Application Data"
"248","2.783676","23.39.213.4","192.168.1.166","TLSv1.2","1453","Application Data"
"249","2.783676","23.39.213.4","192.168.1.166","TCP","1514","443  >  50692 [ACK] Seq=312825 Ack=50071 Win=9949 Len=1460 [TCP PDU reassembled in 252]"
"250","2.783676","23.39.213.4","192.168.1.166","TCP","1514","443  >  50692 [ACK] Seq=314285 Ack=50071 Win=9949 Len=1460 [TCP PDU reassembled in 252]"
"251","2.783676","23.39.213.4","192.168.1.166","TCP","1514","443  >  50692 [ACK] Seq=315745 Ack=50071 Win=9949 Len=1460 [TCP PDU reassembled in 252]"
"252","2.783676","23.39.213.4","192.168.1.166","TLSv1.2","309","Application Data"
"253","2.783730","192.168.1.166","23.39.213.4","TCP","54","50692  >  443 [ACK] Seq=59066 Ack=317460 Win=16383 Len=0"
"254","2.797967","23.39.213.4","192.168.1.166","TCP","54","443  >  50692 [ACK] Seq=317460 Ack=52991 Win=9937 Len=0"
"255","2.797967","23.39.213.4","192.168.1.166","TCP","54","443  >  50692 [ACK] Seq=317460 Ack=55479 Win=9947 Len=0"
"256","2.797967","23.39.213.4","192.168.1.166","TCP","54","443  >  50692 [ACK] Seq=317460 Ack=59066 Win=9927 Len=0"
"257","2.811636","23.39.213.4","192.168.1.166","TLSv1.2","954","Application Data"
"258","2.811636","23.39.213.4","192.168.1.166","TLSv1.2","1514","Application Data"
"259","2.811636","23.39.213.4","192.168.1.166","TLSv1.2","786","Application Data"
"260","2.811674","192.168.1.166","23.39.213.4","TCP","54","50692  >  443 [ACK] Seq=59066 Ack=320552 Win=16383 Len=0"
"261","2.811738","192.168.1.166","23.39.213.4","TLSv1.2","5461","Application Data"
"262","2.811785","192.168.1.166","23.39.213.4","TLSv1.2","685","Application Data"
"263","2.843864","23.39.213.4","192.168.1.166","TCP","54","443  >  50692 [ACK] Seq=320552 Ack=61986 Win=9937 Len=0"
"264","2.843864","23.39.213.4","192.168.1.166","TCP","54","443  >  50692 [ACK] Seq=320552 Ack=64473 Win=9947 Len=0"
"265","2.885555","23.39.213.4","192.168.1.166","TCP","54","443  >  50692 [ACK] Seq=320552 Ack=65104 Win=9949 Len=0"
"266","2.918897","192.168.1.166","23.39.213.4","TLSv1.2","571","Application Data"
"267","2.918961","192.168.1.166","23.39.213.4","TLSv1.2","190","Application Data"
"268","2.918980","192.168.1.166","23.39.213.4","TLSv1.2","190","Application Data"
"269","2.918996","192.168.1.166","23.39.213.4","TLSv1.2","190","Application Data"
"270","2.919041","192.168.1.166","23.39.213.4","TLSv1.2","192","Application Data"
"271","2.944621","23.39.213.4","192.168.1.166","TLSv1.2","953","Application Data"
"272","2.944621","23.39.213.4","192.168.1.166","TLSv1.2","173","Application Data"
"273","2.944657","192.168.1.166","23.39.213.4","TCP","54","50692  >  443 [ACK] Seq=66167 Ack=321570 Win=16379 Len=0"
"274","2.951597","23.39.213.4","192.168.1.166","TCP","54","443  >  50692 [ACK] Seq=321570 Ack=66029 Win=9949 Len=0"
"275","2.959405","192.168.1.166","23.39.213.4","TLSv1.2","5091","Application Data"
"276","2.959468","192.168.1.166","23.39.213.4","TLSv1.2","391","Application Data"
"277","2.961665","192.168.1.166","23.39.213.4","TLSv1.2","5456","Application Data"
"278","2.961739","192.168.1.166","23.39.213.4","TLSv1.2","5456","Application Data"
"279","2.961757","192.168.1.166","23.39.213.4","TLSv1.2","3223","Application Data"
"280","2.961772","192.168.1.166","23.39.213.4","TLSv1.2","1469","Application Data"
"281","2.962807","23.39.213.4","192.168.1.166","TCP","54","443  >  50692 [ACK] Seq=321570 Ack=66167 Win=9949 Len=0"
"282","2.964202","192.168.1.166","23.39.213.4","TLSv1.2","90","Application Data"
"283","2.977500","192.168.1.166","23.39.213.4","TLSv1.2","5340","Application Data"
"284","2.979943","192.168.1.166","23.39.213.4","TLSv1.2","5364","Application Data"
"285","3.000078","23.39.213.4","192.168.1.166","TLSv1.2","317","Application Data"
"286","3.000078","23.39.213.4","192.168.1.166","TLSv1.2","979","Application Data"
"287","3.000078","23.39.213.4","192.168.1.166","TLSv1.2","317","Application Data"
"288","3.000078","23.39.213.4","192.168.1.166","TLSv1.2","645","Application Data"
"289","3.000078","23.39.213.4","192.168.1.166","TLSv1.2","840","Application Data, Application Data"
"290","3.000123","192.168.1.166","23.39.213.4","TCP","54","50692  >  443 [ACK] Seq=97561 Ack=324398 Win=16383 Len=0"
"291","3.001048","23.39.213.4","192.168.1.166","TLSv1.2","317","Application Data"
"292","3.001048","23.39.213.4","192.168.1.166","TLSv1.2","745","Application Data"
"293","3.001066","192.168.1.166","23.39.213.4","TCP","54","50692  >  443 [ACK] Seq=97561 Ack=325352 Win=16380 Len=0"
"294","3.007282","23.39.213.4","192.168.1.166","TLSv1.2","318","Application Data"
"295","3.007282","23.39.213.4","192.168.1.166","TLSv1.2","1472","Application Data"
"296","3.007282","23.39.213.4","192.168.1.166","TCP","16114","443  >  50692 [ACK] Seq=327034 Ack=86965 Win=9949 Len=16060 [TCP PDU reassembled in 297]"
"297","3.007282","23.39.213.4","192.168.1.166","TLSv1.2","400","Application Data"
"298","3.007282","23.39.213.4","192.168.1.166","TLSv1.2","85","Application Data"
"299","3.007282","23.39.213.4","192.168.1.166","TCP","8814","443  >  50692 [ACK] Seq=343471 Ack=86965 Win=9949 Len=8760 [TCP PDU reassembled in 300]"
"300","3.007282","23.39.213.4","192.168.1.166","TLSv1.2","1012","Application Data"
"301","3.007326","192.168.1.166","23.39.213.4","TCP","54","50692  >  443 [ACK] Seq=97561 Ack=353189 Win=16383 Len=0"
"302","3.009458","23.39.213.4","192.168.1.166","TCP","54","443  >  50692 [ACK] Seq=353189 Ack=89885 Win=9949 Len=0"
"303","3.009458","23.39.213.4","192.168.1.166","TCP","54","443  >  50692 [ACK] Seq=353189 Ack=92251 Win=9949 Len=0"
"304","3.031655","23.39.213.4","192.168.1.166","TCP","54","443  >  50692 [ACK] Seq=353189 Ack=97561 Win=9924 Len=0"
"305","3.080542","23.39.213.4","192.168.1.166","TLSv1.2","954","Application Data"
"306","3.080542","23.39.213.4","192.168.1.166","TLSv1.2","1510","Application Data"
"307","3.080577","192.168.1.166","23.39.213.4","TCP","54","50692  >  443 [ACK] Seq=97561 Ack=355545 Win=16383 Len=0"
"308","3.090446","23.39.213.4","192.168.1.166","TCP","5894","443  >  50692 [ACK] Seq=355545 Ack=97561 Win=9949 Len=5840 [TCP PDU reassembled in 309]"
"309","3.090446","23.39.213.4","192.168.1.166","TLSv1.2","117","Application Data"
"310","3.090475","192.168.1.166","23.39.213.4","TCP","54","50692  >  443 [ACK] Seq=97561 Ack=361448 Win=16383 Len=0"
"311","3.093434","23.39.213.4","192.168.1.166","TLSv1.2","484","Application Data"
"312","3.093434","23.39.213.4","192.168.1.166","TLSv1.2","447","Application Data"
"313","3.093434","23.39.213.4","192.168.1.166","TLSv1.2","484","Application Data"
"314","3.093434","23.39.213.4","192.168.1.166","TLSv1.2","639","Application Data"
"315","3.093458","192.168.1.166","23.39.213.4","TCP","54","50692  >  443 [ACK] Seq=97561 Ack=363286 Win=16383 Len=0"
"316","3.127480","23.39.213.4","192.168.1.166","TLSv1.2","959","Application Data"
"317","3.127480","23.39.213.4","192.168.1.166","TLSv1.2","1510","Application Data"
"318","3.127480","23.39.213.4","192.168.1.166","TCP","1514","443  >  50692 [ACK] Seq=365647 Ack=97561 Win=9949 Len=1460 [TCP PDU reassembled in 324]"
"319","3.127480","23.39.213.4","192.168.1.166","TCP","1514","443  >  50692 [ACK] Seq=367107 Ack=97561 Win=9949 Len=1460 [TCP PDU reassembled in 324]"
"320","3.127480","23.39.213.4","192.168.1.166","TCP","1514","443  >  50692 [ACK] Seq=368567 Ack=97561 Win=9949 Len=1460 [TCP PDU reassembled in 324]"
"321","3.127480","23.39.213.4","192.168.1.166","TCP","1514","443  >  50692 [ACK] Seq=370027 Ack=97561 Win=9949 Len=1460 [TCP PDU reassembled in 324]"
"322","3.127480","23.39.213.4","192.168.1.166","TCP","1514","443  >  50692 [ACK] Seq=371487 Ack=97561 Win=9949 Len=1460 [TCP PDU reassembled in 324]"
"323","3.127480","23.39.213.4","192.168.1.166","TCP","1514","443  >  50692 [ACK] Seq=372947 Ack=97561 Win=9949 Len=1460 [TCP PDU reassembled in 324]"
"324","3.127480","23.39.213.4","192.168.1.166","TLSv1.2","706","Application Data"
"325","3.127552","192.168.1.166","23.39.213.4","TCP","54","50692  >  443 [ACK] Seq=97561 Ack=375059 Win=16383 Len=0"
"326","3.129937","23.39.213.4","192.168.1.166","TLSv1.2","957","Application Data"
"327","3.129937","23.39.213.4","192.168.1.166","TLSv1.2","197","Application Data"
"328","3.129970","192.168.1.166","23.39.213.4","TCP","54","50692  >  443 [ACK] Seq=97561 Ack=376105 Win=16379 Len=0"
"329","3.145079","192.168.1.166","23.39.213.4","TLSv1.2","5344","Application Data"
"330","3.145144","192.168.1.166","23.39.213.4","TLSv1.2","317","Application Data"
"331","3.190044","23.39.213.4","192.168.1.166","TLSv1.2","953","Application Data"
"332","3.190044","23.39.213.4","192.168.1.166","TLSv1.2","1513","Application Data"
"333","3.190087","192.168.1.166","23.39.213.4","TCP","54","50692  >  443 [ACK] Seq=103114 Ack=378463 Win=16383 Len=0"
"334","3.191547","23.39.213.4","192.168.1.166","TLSv1.2","1088","Application Data"
"335","3.210516","192.168.1.166","23.39.213.4","TLSv1.2","5455","Application Data"
"336","3.210558","192.168.1.166","23.39.213.4","TLSv1.2","411","Application Data"
"337","3.212287","192.168.1.166","23.39.213.4","TLSv1.2","5455","Application Data"
"338","3.212326","192.168.1.166","23.39.213.4","TLSv1.2","2030","Application Data"
"339","3.255448","23.39.213.4","192.168.1.166","TCP","54","443  >  50692 [ACK] Seq=379497 Ack=116249 Win=9881 Len=0"
"340","3.283035","192.168.1.166","23.39.213.4","TLSv1.2","5353","Application Data"
"341","3.283132","192.168.1.166","23.39.213.4","TLSv1.2","5346","Application Data"
"342","3.289707","192.168.1.166","23.39.213.4","TLSv1.2","572","Application Data"
"343","3.289749","192.168.1.166","23.39.213.4","TLSv1.2","191","Application Data"
"344","3.289766","192.168.1.166","23.39.213.4","TLSv1.2","192","Application Data"
"345","3.289780","192.168.1.166","23.39.213.4","TLSv1.2","191","Application Data"
"346","3.297221","192.168.1.166","23.39.213.4","TLSv1.2","5206","Application Data"
"347","3.297301","192.168.1.166","23.39.213.4","TLSv1.2","561","Application Data"
"348","3.297968","192.168.1.166","23.39.213.4","TLSv1.2","5417","Application Data"
"349","3.301779","192.168.1.166","23.39.213.4","TLSv1.2","5465","Application Data"
"350","3.314739","23.39.213.4","192.168.1.166","TCP","54","443  >  50692 [ACK] Seq=379497 Ack=119169 Win=9937 Len=0"
"351","3.335845","23.39.213.4","192.168.1.166","TCP","54","443  >  50692 [ACK] Seq=379497 Ack=144203 Win=9797 Len=0"
"352","3.370502","23.39.213.4","192.168.1.166","TLSv1.2","951","Application Data"
"353","3.370502","23.39.213.4","192.168.1.166","TLSv1.2","244","Application Data"
"354","3.370502","23.39.213.4","192.168.1.166","TLSv1.2","953","Application Data"
"355","3.370502","23.39.213.4","192.168.1.166","TLSv1.2","1513","Application Data"
"356","3.370552","192.168.1.166","23.39.213.4","TCP","54","50692  >  443 [ACK] Seq=144203 Ack=382942 Win=16383 Len=0"
"357","3.371739","23.39.213.4","192.168.1.166","TCP","2974","443  >  50692 [ACK] Seq=382942 Ack=144203 Win=9949 Len=2920 [TCP PDU reassembled in 358]"
"358","3.371739","23.39.213.4","192.168.1.166","TLSv1.2","214","Application Data"
"359","3.371762","192.168.1.166","23.39.213.4","TCP","54","50692  >  443 [ACK] Seq=144203 Ack=386022 Win=16383 Len=0"
"360","3.397131","23.39.213.4","192.168.1.166","TLSv1.2","957","Application Data"
"361","3.397131","23.39.213.4","192.168.1.166","TLSv1.2","548","Application Data"
"362","3.397131","23.39.213.4","192.168.1.166","TLSv1.2","484","Application Data"
"363","3.397131","23.39.213.4","192.168.1.166","TCP","1514","443  >  50692 [ACK] Seq=387849 Ack=144203 Win=9949 Len=1460 [TCP PDU reassembled in 364]"
"364","3.397131","23.39.213.4","192.168.1.166","TLSv1.2","74","Application Data"
"365","3.397131","23.39.213.4","192.168.1.166","TLSv1.2","317","Application Data"
"366","3.397131","23.39.213.4","192.168.1.166","TLSv1.2","1482","Application Data"
"367","3.397131","23.39.213.4","192.168.1.166","TLSv1.2","317","Application Data"
"368","3.397131","23.39.213.4","192.168.1.166","TLSv1.2","1482","Application Data"
"369","3.397131","23.39.213.4","192.168.1.166","TCP","2974","443  >  50692 [ACK] Seq=392711 Ack=144203 Win=9949 Len=2920 [TCP PDU reassembled in 370]"
"370","3.397131","23.39.213.4","192.168.1.166","TLSv1.2","1490","Application Data"
"371","3.397131","23.39.213.4","192.168.1.166","TCP","4434","443  >  50692 [ACK] Seq=397067 Ack=144203 Win=9949 Len=4380 [TCP PDU reassembled in 372]"
"372","3.397131","23.39.213.4","192.168.1.166","TLSv1.2","168","Application Data"
"373","3.397211","192.168.1.166","23.39.213.4","TCP","54","50692  >  443 [ACK] Seq=144203 Ack=401561 Win=16383 Len=0"
"374","3.402460","23.39.213.4","192.168.1.166","TLSv1.2","317","Application Data"
"375","3.402460","23.39.213.4","192.168.1.166","TLSv1.2","1472","Application Data"
"376","3.402460","23.39.213.4","192.168.1.166","TCP","4434","443  >  50692 [ACK] Seq=403242 Ack=144203 Win=9949 Len=4380 [TCP PDU reassembled in 377]"
"377","3.402460","23.39.213.4","192.168.1.166","TLSv1.2","92","Application Data"
"378","3.402502","192.168.1.166","23.39.213.4","TCP","54","50692  >  443 [ACK] Seq=144203 Ack=407660 Win=16383 Len=0"
"379","3.411420","23.39.213.4","192.168.1.166","TLSv1.2","484","Application Data"
"380","3.411420","23.39.213.4","192.168.1.166","TLSv1.2","1072","Application Data"
"381","3.411470","192.168.1.166","23.39.213.4","TCP","54","50692  >  443 [ACK] Seq=144203 Ack=409108 Win=16378 Len=0"
"382","3.412173","23.39.213.4","192.168.1.166","TLSv1.2","483","Application Data"
"383","3.412173","23.39.213.4","192.168.1.166","TLSv1.2","193","Application Data"
"384","3.412198","192.168.1.166","23.39.213.4","TCP","54","50692  >  443 [ACK] Seq=144203 Ack=409676 Win=16383 Len=0"
"385","3.419908","192.168.1.166","23.39.213.4","TLSv1.2","5364","Application Data"
"386","3.420771","192.168.1.166","23.39.213.4","TLSv1.2","5351","Application Data"
"387","3.445352","192.168.1.166","23.39.213.4","TLSv1.2","5630","Application Data"
"388","3.445425","192.168.1.166","23.39.213.4","TLSv1.2","3833","Application Data"
"389","3.445602","23.39.213.4","192.168.1.166","TLSv1.2","484","Application Data"
"390","3.445602","23.39.213.4","192.168.1.166","TCP","1514","443  >  50692 [ACK] Seq=410106 Ack=144203 Win=9949 Len=1460 [TCP PDU reassembled in 391]"
"391","3.445602","23.39.213.4","192.168.1.166","TLSv1.2","527","Application Data"
"392","3.445642","192.168.1.166","23.39.213.4","TCP","54","50692  >  443 [ACK] Seq=164165 Ack=412039 Win=16383 Len=0"
"393","3.448806","192.168.1.166","23.39.213.4","TLSv1.2","5629","Application Data"
