"No.","Time","Source","Destination","Protocol","Length","Info"
"1","0.000000","192.168.1.166","23.39.213.4","TLSv1.2","5340","Application Data"
"2","0.000065","192.168.1.166","23.39.213.4","TLSv1.2","1027","Application Data"
"3","0.033066","23.39.213.4","192.168.1.166","TCP","54","443  >  52183 [ACK] Seq=1 Ack=1461 Win=4299 Len=0"
"4","0.033066","23.39.213.4","192.168.1.166","TCP","54","443  >  52183 [ACK] Seq=1 Ack=2921 Win=4322 Len=0"
"5","0.035187","23.39.213.4","192.168.1.166","TCP","54","443  >  52183 [ACK] Seq=1 Ack=5287 Win=4359 Len=0"
"6","0.035187","23.39.213.4","192.168.1.166","TCP","54","443  >  52183 [ACK] Seq=1 Ack=6260 Win=4382 Len=0"
"7","0.105021","23.39.213.4","192.168.1.166","TLSv1.2","443","Application Data"
"8","0.112529","23.39.213.4","192.168.1.166","TLSv1.2","85","Application Data"
"9","0.112548","192.168.1.166","23.39.213.4","TCP","54","52183  >  443 [ACK] Seq=6260 Ack=421 Win=508 Len=0"
"10","0.151754","192.168.1.166","23.39.213.4","TLSv1.2","5342","Application Data"
"11","0.151880","192.168.1.166","23.39.213.4","TLSv1.2","5342","Application Data"
"12","0.151908","192.168.1.166","23.39.213.4","TLSv1.2","1173","Application Data"
"13","0.151926","192.168.1.166","23.39.213.4","TLSv1.2","538","Application Data"
"14","0.183792","23.39.213.4","192.168.1.166","TCP","54","443  >  52183 [ACK] Seq=421 Ack=7720 Win=4405 Len=0"
"15","0.188335","23.39.213.4","192.168.1.166","TCP","54","443  >  52183 [ACK] Seq=421 Ack=10640 Win=4450 Len=0"
"16","0.188335","23.39.213.4","192.168.1.166","TCP","54","443  >  52183 [ACK] Seq=421 Ack=11548 Win=4473 Len=0"
"17","0.188335","23.39.213.4","192.168.1.166","TCP","54","443  >  52183 [ACK] Seq=421 Ack=13008 Win=4496 Len=0"
"18","0.188335","23.39.213.4","192.168.1.166","TCP","54","443  >  52183 [ACK] Seq=421 Ack=14468 Win=4519 Len=0"
"19","0.188335","23.39.213.4","192.168.1.166","TCP","54","443  >  52183 [ACK] Seq=421 Ack=16836 Win=4556 Len=0"
"20","0.188335","23.39.213.4","192.168.1.166","TCP","54","443  >  52183 [ACK] Seq=421 Ack=17955 Win=4579 Len=0"
"21","0.188335","23.39.213.4","192.168.1.166","TCP","54","443  >  52183 [ACK] Seq=421 Ack=18439 Win=4601 Len=0"
"22","0.239514","192.168.1.166","23.39.213.4","TLSv1.2","5544","Application Data"
"23","0.239601","192.168.1.166","23.39.213.4","TLSv1.2","16460","Application Data"
"24","0.239646","192.168.1.166","23.39.213.4","TLSv1.2","13693","Application Data"
"25","0.240145","192.168.1.166","23.39.213.4","TLSv1.2","5544","Application Data"
"26","0.240200","192.168.1.166","23.39.213.4","TLSv1.2","16460","Application Data"
"27","0.240236","192.168.1.166","23.39.213.4","TLSv1.2","13693","Application Data"
"28","0.240350","192.168.1.166","23.39.213.4","TLSv1.2","5543","Application Data"
"29","0.240372","192.168.1.166","23.39.213.4","TLSv1.2","5467","Application Data"
"30","0.243152","192.168.1.166","23.39.213.4","TLSv1.2","5443","Application Data"
"31","0.273278","23.39.213.4","192.168.1.166","TCP","54","443  >  52183 [ACK] Seq=421 Ack=19899 Win=4624 Len=0"
"32","0.273278","23.39.213.4","192.168.1.166","TCP","54","443  >  52183 [ACK] Seq=421 Ack=23929 Win=4687 Len=0"
"33","0.273278","23.39.213.4","192.168.1.166","TCP","54","443  >  52183 [ACK] Seq=421 Ack=25389 Win=4710 Len=0"
"34","0.273278","23.39.213.4","192.168.1.166","TCP","54","443  >  52183 [ACK] Seq=421 Ack=26849 Win=4733 Len=0"
"35","0.273278","23.39.213.4","192.168.1.166","TCP","54","443  >  52183 [ACK] Seq=421 Ack=28309 Win=4756 Len=0"
"36","0.273278","23.39.213.4","192.168.1.166","TCP","54","443  >  52183 [ACK] Seq=421 Ack=29769 Win=4779 Len=0"
"37","0.273278","23.39.213.4","192.168.1.166","TCP","54","443  >  52183 [ACK] Seq=421 Ack=31229 Win=4801 Len=0"
"38","0.273278","23.39.213.4","192.168.1.166","TCP","54","443  >  52183 [ACK] Seq=421 Ack=32689 Win=4824 Len=0"
"39","0.275730","23.39.213.4","192.168.1.166","TCP","54","443  >  52183 [ACK] Seq=421 Ack=34149 Win=4847 Len=0"
"40","0.275730","23.39.213.4","192.168.1.166","TCP","54","443  >  52183 [ACK] Seq=421 Ack=38529 Win=4915 Len=0"
"41","0.275730","23.39.213.4","192.168.1.166","TCP","54","443  >  52183 [ACK] Seq=421 Ack=40335 Win=4944 Len=0"
"42","0.275730","23.39.213.4","192.168.1.166","TCP","54","443  >  52183 [ACK] Seq=421 Ack=41795 Win=4966 Len=0"
"43","0.275730","23.39.213.4","192.168.1.166","TCP","54","443  >  52183 [ACK] Seq=421 Ack=43255 Win=4989 Len=0"
"44","0.275730","23.39.213.4","192.168.1.166","TCP","54","443  >  52183 [ACK] Seq=421 Ack=46175 Win=5035 Len=0"
"45","0.275730","23.39.213.4","192.168.1.166","TCP","54","443  >  52183 [ACK] Seq=421 Ack=47635 Win=5058 Len=0"
"46","0.278153","23.39.213.4","192.168.1.166","TCP","54","443  >  52183 [ACK] Seq=421 Ack=49095 Win=5080 Len=0"
"47","0.278153","23.39.213.4","192.168.1.166","TCP","54","443  >  52183 [ACK] Seq=421 Ack=52015 Win=5126 Len=0"
"48","0.278153","23.39.213.4","192.168.1.166","TCP","54","443  >  52183 [ACK] Seq=421 Ack=53974 Win=5157 Len=0"
"49","0.278153","23.39.213.4","192.168.1.166","TCP","54","443  >  52183 [ACK] Seq=421 Ack=55434 Win=5180 Len=0"
"50","0.278153","23.39.213.4","192.168.1.166","TCP","54","443  >  52183 [ACK] Seq=421 Ack=59464 Win=5242 Len=0"
"51","0.278153","23.39.213.4","192.168.1.166","TCP","54","443  >  52183 [ACK] Seq=421 Ack=60924 Win=5265 Len=0"
"52","0.278153","23.39.213.4","192.168.1.166","TCP","54","443  >  52183 [ACK] Seq=421 Ack=62384 Win=5288 Len=0"
"53","0.278685","23.39.213.4","192.168.1.166","TCP","54","443  >  52183 [ACK] Seq=421 Ack=63844 Win=5311 Len=0"
"54","0.282160","23.39.213.4","192.168.1.166","TCP","54","443  >  52183 [ACK] Seq=421 Ack=65304 Win=5334 Len=0"
"55","0.282160","23.39.213.4","192.168.1.166","TCP","54","443  >  52183 [ACK] Seq=421 Ack=66764 Win=5357 Len=0"
"56","0.282160","23.39.213.4","192.168.1.166","TCP","54","443  >  52183 [ACK] Seq=421 Ack=68224 Win=5379 Len=0"
"57","0.282160","23.39.213.4","192.168.1.166","TCP","54","443  >  52183 [ACK] Seq=421 Ack=71144 Win=5425 Len=0"
"58","0.282160","23.39.213.4","192.168.1.166","TCP","54","443  >  52183 [ACK] Seq=421 Ack=72604 Win=5448 Len=0"
"59","0.282160","23.39.213.4","192.168.1.166","TCP","54","443  >  52183 [ACK] Seq=421 Ack=74064 Win=5471 Len=0"
"60","0.282160","23.39.213.4","192.168.1.166","TCP","54","443  >  52183 [ACK] Seq=421 Ack=75870 Win=5499 Len=0"
"61","0.282296","23.39.213.4","192.168.1.166","TCP","54","443  >  52183 [ACK] Seq=421 Ack=77330 Win=5522 Len=0"
"62","0.282296","23.39.213.4","192.168.1.166","TCP","54","443  >  52183 [ACK] Seq=421 Ack=78790 Win=5544 Len=0"
"63","0.282296","23.39.213.4","192.168.1.166","TCP","54","443  >  52183 [ACK] Seq=421 Ack=84630 Win=5636 Len=0"
"64","0.282296","23.39.213.4","192.168.1.166","TCP","54","443  >  52183 [ACK] Seq=421 Ack=86090 Win=5659 Len=0"
"65","0.282296","23.39.213.4","192.168.1.166","TCP","54","443  >  52183 [ACK] Seq=421 Ack=87550 Win=5681 Len=0"
"66","0.282296","23.39.213.4","192.168.1.166","TCP","54","443  >  52183 [ACK] Seq=421 Ack=89509 Win=5712 Len=0"
"67","0.282296","23.39.213.4","192.168.1.166","TCP","54","443  >  52183 [ACK] Seq=421 Ack=90969 Win=5735 Len=0"
"68","0.282296","23.39.213.4","192.168.1.166","TCP","54","443  >  52183 [ACK] Seq=421 Ack=93889 Win=5780 Len=0"
"69","0.284535","23.39.213.4","192.168.1.166","TCP","54","443  >  52183 [ACK] Seq=421 Ack=94998 Win=5803 Len=0"
"70","0.284535","23.39.213.4","192.168.1.166","TCP","54","443  >  52183 [ACK] Seq=421 Ack=96458 Win=5826 Len=0"
"71","0.284535","23.39.213.4","192.168.1.166","TCP","54","443  >  52183 [ACK] Seq=421 Ack=97918 Win=5849 Len=0"
"72","0.284535","23.39.213.4","192.168.1.166","TCP","54","443  >  52183 [ACK] Seq=421 Ack=100411 Win=5888 Len=0"
"73","0.284535","23.39.213.4","192.168.1.166","TCP","54","443  >  52183 [ACK] Seq=421 Ack=101871 Win=5911 Len=0"
"74","0.284535","23.39.213.4","192.168.1.166","TCP","54","443  >  52183 [ACK] Seq=421 Ack=103331 Win=5933 Len=0"
"75","0.284535","23.39.213.4","192.168.1.166","TCP","54","443  >  52183 [ACK] Seq=421 Ack=105800 Win=5972 Len=0"
"76","0.317011","23.39.213.4","192.168.1.166","TLSv1.2","89","Application Data"
"77","0.317011","23.39.213.4","192.168.1.166","TLSv1.2","953","Application Data"
"78","0.317011","23.39.213.4","192.168.1.166","TLSv1.2","120","Application Data"
"79","0.317011","23.39.213.4","192.168.1.166","TLSv1.2","955","Application Data"
"80","0.317011","23.39.213.4","192.168.1.166","TLSv1.2","662","Application Data, Application Data, Application Data"
"81","0.317011","23.39.213.4","192.168.1.166","TLSv1.2","361","Application Data"
"82","0.317011","23.39.213.4","192.168.1.166","TLSv1.2","289","Application Data"
"83","0.317063","192.168.1.166","23.39.213.4","TCP","54","52183  >  443 [ACK] Seq=105800 Ack=3472 Win=511 Len=0"
"84","0.318526","192.168.1.166","23.39.213.4","TLSv1.2","89","Application Data"
"85","0.342683","23.39.213.4","192.168.1.166","TLSv1.2","361","Application Data"
"86","0.342683","23.39.213.4","192.168.1.166","TLSv1.2","289","Application Data"
"87","0.342712","192.168.1.166","23.39.213.4","TCP","54","52183  >  443 [ACK] Seq=105835 Ack=4014 Win=509 Len=0"
"88","0.391953","23.39.213.4","192.168.1.166","TCP","54","443  >  52183 [ACK] Seq=4014 Ack=105835 Win=5972 Len=0"
"89","1.215966","23.39.213.4","192.168.1.166","TLSv1.2","1046","Application Data"
"90","1.215966","23.39.213.4","192.168.1.166","TCP","1514","443  >  52183 [ACK] Seq=5006 Ack=105835 Win=5972 Len=1460 [TCP PDU reassembled in 97]"
"91","1.215966","23.39.213.4","192.168.1.166","TCP","1514","443  >  52183 [ACK] Seq=6466 Ack=105835 Win=5972 Len=1460 [TCP PDU reassembled in 97]"
"92","1.215966","23.39.213.4","192.168.1.166","TCP","1514","443  >  52183 [ACK] Seq=7926 Ack=105835 Win=5972 Len=1460 [TCP PDU reassembled in 97]"
"93","1.215966","23.39.213.4","192.168.1.166","TCP","1514","443  >  52183 [ACK] Seq=9386 Ack=105835 Win=5972 Len=1460 [TCP PDU reassembled in 97]"
"94","1.215966","23.39.213.4","192.168.1.166","TCP","1514","443  >  52183 [PSH, ACK] Seq=10846 Ack=105835 Win=5972 Len=1460 [TCP PDU reassembled in 97]"
"95","1.215966","23.39.213.4","192.168.1.166","TCP","7354","443  >  52183 [PSH, ACK] Seq=12306 Ack=105835 Win=5972 Len=7300 [TCP PDU reassembled in 97]"
"96","1.215966","23.39.213.4","192.168.1.166","TCP","1514","443  >  52183 [ACK] Seq=19606 Ack=105835 Win=5972 Len=1460 [TCP PDU reassembled in 97]"
"97","1.215966","23.39.213.4","192.168.1.166","TLSv1.2","1514","Application Data, Application Data"
"98","1.215966","23.39.213.4","192.168.1.166","TCP","1514","443  >  52183 [ACK] Seq=22526 Ack=105835 Win=5972 Len=1460 [TCP PDU reassembled in 105]"
"99","1.215966","23.39.213.4","192.168.1.166","TCP","1514","443  >  52183 [ACK] Seq=23986 Ack=105835 Win=5972 Len=1460 [TCP PDU reassembled in 105]"
"100","1.215966","23.39.213.4","192.168.1.166","TCP","1514","443  >  52183 [PSH, ACK] Seq=25446 Ack=105835 Win=5972 Len=1460 [TCP PDU reassembled in 105]"
"101","1.215966","23.39.213.4","192.168.1.166","TCP","1514","443  >  52183 [ACK] Seq=26906 Ack=105835 Win=5972 Len=1460 [TCP PDU reassembled in 105]"
"102","1.215966","23.39.213.4","192.168.1.166","TCP","1514","443  >  52183 [ACK] Seq=28366 Ack=105835 Win=5972 Len=1460 [TCP PDU reassembled in 105]"
"103","1.215966","23.39.213.4","192.168.1.166","TCP","1514","443  >  52183 [ACK] Seq=29826 Ack=105835 Win=5972 Len=1460 [TCP PDU reassembled in 105]"
"104","1.215966","23.39.213.4","192.168.1.166","TCP","1514","443  >  52183 [ACK] Seq=31286 Ack=105835 Win=5972 Len=1460 [TCP PDU reassembled in 105]"
"105","1.215966","23.39.213.4","192.168.1.166","TLSv1.2","8814","Application Data, Application Data"
"106","1.216049","192.168.1.166","23.39.213.4","TCP","54","52183  >  443 [ACK] Seq=105835 Ack=41506 Win=511 Len=0"
"107","1.217820","23.39.213.4","192.168.1.166","TLSv1.2","14654","Application Data"
"108","1.217849","192.168.1.166","23.39.213.4","TCP","54","52183  >  443 [ACK] Seq=105835 Ack=56106 Win=511 Len=0"
"109","1.218513","23.39.213.4","192.168.1.166","TLSv1.2","7354","Application Data"
"110","1.218533","192.168.1.166","23.39.213.4","TCP","54","52183  >  443 [ACK] Seq=105835 Ack=63406 Win=511 Len=0"
"111","1.221768","23.39.213.4","192.168.1.166","TCP","1514","443  >  52183 [ACK] Seq=63406 Ack=105835 Win=5972 Len=1460 [TCP PDU reassembled in 119]"
"112","1.221768","23.39.213.4","192.168.1.166","TCP","1514","443  >  52183 [ACK] Seq=64866 Ack=105835 Win=5972 Len=1460 [TCP PDU reassembled in 119]"
"113","1.221768","23.39.213.4","192.168.1.166","TCP","1514","443  >  52183 [ACK] Seq=66326 Ack=105835 Win=5972 Len=1460 [TCP PDU reassembled in 119]"
"114","1.221768","23.39.213.4","192.168.1.166","TCP","1514","443  >  52183 [ACK] Seq=67786 Ack=105835 Win=5972 Len=1460 [TCP PDU reassembled in 119]"
"115","1.221768","23.39.213.4","192.168.1.166","TCP","1514","443  >  52183 [PSH, ACK] Seq=69246 Ack=105835 Win=5972 Len=1460 [TCP PDU reassembled in 119]"
"116","1.221768","23.39.213.4","192.168.1.166","TCP","1514","443  >  52183 [ACK] Seq=70706 Ack=105835 Win=5972 Len=1460 [TCP PDU reassembled in 119]"
"117","1.221768","23.39.213.4","192.168.1.166","TCP","1514","443  >  52183 [ACK] Seq=72166 Ack=105835 Win=5972 Len=1460 [TCP PDU reassembled in 119]"
"118","1.221768","23.39.213.4","192.168.1.166","TCP","1514","443  >  52183 [ACK] Seq=73626 Ack=105835 Win=5972 Len=1460 [TCP PDU reassembled in 119]"
"119","1.221768","23.39.213.4","192.168.1.166","TLSv1.2","1514","Application Data, Application Data"
"120","1.221768","23.39.213.4","192.168.1.166","TCP","1514","443  >  52183 [PSH, ACK] Seq=76546 Ack=105835 Win=5972 Len=1460 [TCP PDU reassembled in 125]"
"121","1.221768","23.39.213.4","192.168.1.166","TCP","7354","443  >  52183 [PSH, ACK] Seq=78006 Ack=105835 Win=5972 Len=7300 [TCP PDU reassembled in 125]"
"122","1.221813","192.168.1.166","23.39.213.4","TCP","54","52183  >  443 [ACK] Seq=105835 Ack=85306 Win=511 Len=0"
"123","1.222156","192.168.1.166","23.39.213.4","TLSv1.2","5543","Application Data"
"124","1.222193","192.168.1.166","23.39.213.4","TLSv1.2","1462","Application Data"
"125","1.224509","23.39.213.4","192.168.1.166","TLSv1.2","232","Application Data, Application Data, Application Data"
"126","1.249753","192.168.1.166","23.39.213.4","TLSv1.2","5375","Application Data"
"127","1.254376","23.39.213.4","192.168.1.166","TCP","54","443  >  52183 [ACK] Seq=85484 Ack=107295 Win=5995 Len=0"
"128","1.254376","23.39.213.4","192.168.1.166","TCP","54","443  >  52183 [ACK] Seq=85484 Ack=108755 Win=6018 Len=0"
"129","1.256576","23.39.213.4","192.168.1.166","TCP","54","443  >  52183 [ACK] Seq=85484 Ack=111324 Win=6058 Len=0"
"130","1.256576","23.39.213.4","192.168.1.166","TCP","54","443  >  52183 [ACK] Seq=85484 Ack=112732 Win=6081 Len=0"
"131","1.281654","23.39.213.4","192.168.1.166","TCP","54","443  >  52183 [ACK] Seq=85484 Ack=114192 Win=6103 Len=0"
"132","1.281654","23.39.213.4","192.168.1.166","TCP","54","443  >  52183 [ACK] Seq=85484 Ack=115652 Win=6126 Len=0"
"133","1.281654","23.39.213.4","192.168.1.166","TCP","54","443  >  52183 [ACK] Seq=85484 Ack=118053 Win=6164 Len=0"
"134","1.285978","23.39.213.4","192.168.1.166","TLSv1.2","361","Application Data"
"135","1.285978","23.39.213.4","192.168.1.166","TLSv1.2","289","Application Data"
"136","1.285995","192.168.1.166","23.39.213.4","TCP","54","52183  >  443 [ACK] Seq=118053 Ack=86026 Win=509 Len=0"
"137","1.297642","23.39.213.4","192.168.1.166","TLSv1.2","1011","Application Data"
"138","1.298111","23.39.213.4","192.168.1.166","TLSv1.2","85","Application Data"
"139","1.298125","192.168.1.166","23.39.213.4","TCP","54","52183  >  443 [ACK] Seq=118053 Ack=87014 Win=511 Len=0"
"140","1.424017","192.168.1.166","23.39.213.4","TLSv1.2","556","Application Data"
"141","1.424059","192.168.1.166","23.39.213.4","TLSv1.2","176","Application Data"
"142","1.424077","192.168.1.166","23.39.213.4","TLSv1.2","176","Application Data"
"143","1.424091","192.168.1.166","23.39.213.4","TLSv1.2","191","Application Data"
"144","1.424174","192.168.1.166","23.39.213.4","TLSv1.2","191","Application Data"
"145","1.424194","192.168.1.166","23.39.213.4","TLSv1.2","176","Application Data"
"146","1.440002","192.168.1.166","23.39.213.4","TLSv1.2","90","Application Data"
"147","1.440062","192.168.1.166","23.39.213.4","TLSv1.2","90","Application Data"
"148","1.440101","192.168.1.166","23.39.213.4","TLSv1.2","90","Application Data"
"149","1.440119","192.168.1.166","23.39.213.4","TLSv1.2","90","Application Data"
"150","1.440138","192.168.1.166","23.39.213.4","TLSv1.2","90","Application Data"
"151","1.440154","192.168.1.166","23.39.213.4","TLSv1.2","90","Application Data"
"152","1.461989","23.39.213.4","192.168.1.166","TCP","54","443  >  52183 [ACK] Seq=87014 Ack=119195 Win=6187 Len=0"
"153","1.472176","23.39.213.4","192.168.1.166","TLSv1.2","317","Application Data"
"154","1.472176","23.39.213.4","192.168.1.166","TCP","4434","443  >  52183 [ACK] Seq=87277 Ack=119411 Win=6187 Len=4380 [TCP PDU reassembled in 155]"
"155","1.472176","23.39.213.4","192.168.1.166","TLSv1.2","231","Application Data"
"156","1.472224","192.168.1.166","23.39.213.4","TCP","54","52183  >  443 [ACK] Seq=119411 Ack=91834 Win=511 Len=0"
"157","1.475155","23.39.213.4","192.168.1.166","TLSv1.2","318","Application Data"
"158","1.475155","23.39.213.4","192.168.1.166","TLSv1.2","1479","Application Data"
"159","1.475155","23.39.213.4","192.168.1.166","TLSv1.2","317","Application Data"
"160","1.475155","23.39.213.4","192.168.1.166","TCP","1514","443  >  52183 [ACK] Seq=93786 Ack=119411 Win=6187 Len=1460 [TCP PDU reassembled in 161]"
"161","1.475155","23.39.213.4","192.168.1.166","TLSv1.2","66","Application Data"
"162","1.475155","23.39.213.4","192.168.1.166","TCP","7354","443  >  52183 [PSH, ACK] Seq=95258 Ack=119411 Win=6187 Len=7300 [TCP PDU reassembled in 165]"
"163","1.475210","192.168.1.166","23.39.213.4","TCP","54","52183  >  443 [ACK] Seq=119411 Ack=95246 Win=511 Len=0"
"164","1.475238","192.168.1.166","23.39.213.4","TCP","54","52183  >  443 [ACK] Seq=119411 Ack=102558 Win=511 Len=0"
"165","1.477807","23.39.213.4","192.168.1.166","TLSv1.2","4434","Application Data"
"166","1.477807","23.39.213.4","192.168.1.166","TLSv1.2","1415","Application Data"
"167","1.477828","192.168.1.166","23.39.213.4","TCP","54","52183  >  443 [ACK] Seq=119411 Ack=108299 Win=511 Len=0"
"168","1.478071","192.168.1.166","23.39.213.4","TLSv1.2","176","Application Data"
"169","1.479039","192.168.1.166","23.39.213.4","TLSv1.2","176","Application Data"
"170","1.482457","192.168.1.166","23.39.213.4","TLSv1.2","5054","Application Data"
"171","1.485728","23.39.213.4","192.168.1.166","TLSv1.2","318","Application Data"
"172","1.485728","23.39.213.4","192.168.1.166","TCP","1514","443  >  52183 [ACK] Seq=108563 Ack=119411 Win=6187 Len=1460 [TCP PDU reassembled in 173]"
"173","1.485728","23.39.213.4","192.168.1.166","TLSv1.2","110","Application Data"
"174","1.485728","23.39.213.4","192.168.1.166","TCP","2974","443  >  52183 [ACK] Seq=110079 Ack=119411 Win=6187 Len=2920 [TCP PDU reassembled in 175]"
"175","1.485728","23.39.213.4","192.168.1.166","TLSv1.2","462","Application Data"
"176","1.485766","192.168.1.166","23.39.213.4","TCP","54","52183  >  443 [ACK] Seq=124655 Ack=113407 Win=511 Len=0"
"177","1.503889","23.39.213.4","192.168.1.166","TLSv1.2","317","Application Data"
"178","1.503889","23.39.213.4","192.168.1.166","TLSv1.2","1482","Application Data"
"179","1.503889","23.39.213.4","192.168.1.166","TCP","5894","443  >  52183 [ACK] Seq=115098 Ack=119411 Win=6187 Len=5840 [TCP PDU reassembled in 180]"
"180","1.503889","23.39.213.4","192.168.1.166","TLSv1.2","1174","Application Data"
"181","1.503944","192.168.1.166","23.39.213.4","TCP","54","52183  >  443 [ACK] Seq=124655 Ack=122058 Win=511 Len=0"
"182","1.514028","23.39.213.4","192.168.1.166","TCP","54","443  >  52183 [ACK] Seq=122058 Ack=121115 Win=6209 Len=0"
"183","1.514028","23.39.213.4","192.168.1.166","TCP","54","443  >  52183 [ACK] Seq=122058 Ack=124655 Win=6265 Len=0"
"184","1.552457","23.39.213.4","192.168.1.166","TLSv1.2","318","Application Data"
"185","1.552457","23.39.213.4","192.168.1.166","TLSv1.2","1509","Application Data"
"186","1.552457","23.39.213.4","192.168.1.166","TCP","7354","443  >  52183 [PSH, ACK] Seq=123777 Ack=124655 Win=6265 Len=7300 [TCP PDU reassembled in 189]"
"187","1.552501","192.168.1.166","23.39.213.4","TCP","54","52183  >  443 [ACK] Seq=124655 Ack=131077 Win=511 Len=0"
"188","1.552657","23.39.213.4","192.168.1.166","TCP","1514","443  >  52183 [ACK] Seq=131077 Ack=124655 Win=6265 Len=1460 [TCP PDU reassembled in 189]"
"189","1.552657","23.39.213.4","192.168.1.166","TLSv1.2","1455","Application Data"
"190","1.552673","192.168.1.166","23.39.213.4","TCP","54","52183  >  443 [ACK] Seq=124655 Ack=133938 Win=511 Len=0"
"191","1.557976","23.39.213.4","192.168.1.166","TLSv1.2","318","Application Data"
"192","1.557976","23.39.213.4","192.168.1.166","TCP","1514","443  >  52183 [ACK] Seq=134202 Ack=124655 Win=6265 Len=1460 [TCP PDU reassembled in 193]"
"193","1.557976","23.39.213.4","192.168.1.166","TLSv1.2","94","Application Data"
"194","1.557976","23.39.213.4","192.168.1.166","TCP","7354","443  >  52183 [PSH, ACK] Seq=135702 Ack=124655 Win=6265 Len=7300 [TCP PDU reassembled in 197]"
"195","1.558022","192.168.1.166","23.39.213.4","TCP","54","52183  >  443 [ACK] Seq=124655 Ack=143002 Win=511 Len=0"
"196","1.558806","23.39.213.4","192.168.1.166","TCP","1514","443  >  52183 [ACK] Seq=143002 Ack=124655 Win=6265 Len=1460 [TCP PDU reassembled in 197]"
"197","1.558806","23.39.213.4","192.168.1.166","TLSv1.2","1410","Application Data"
"198","1.558866","192.168.1.166","23.39.213.4","TCP","54","52183  >  443 [ACK] Seq=124655 Ack=145818 Win=511 Len=0"
"199","1.564867","23.39.213.4","192.168.1.166","TLSv1.2","317","Application Data"
"200","1.564867","23.39.213.4","192.168.1.166","TCP","1514","443  >  52183 [ACK] Seq=146081 Ack=124655 Win=6265 Len=1460 [TCP PDU reassembled in 201]"
"201","1.564867","23.39.213.4","192.168.1.166","TLSv1.2","66","Application Data"
"202","1.564867","23.39.213.4","192.168.1.166","TCP","5894","443  >  52183 [ACK] Seq=147553 Ack=124655 Win=6265 Len=5840 [TCP PDU reassembled in 203]"
"203","1.564867","23.39.213.4","192.168.1.166","TLSv1.2","482","Application Data"
"204","1.564915","192.168.1.166","23.39.213.4","TCP","54","52183  >  443 [ACK] Seq=124655 Ack=153821 Win=511 Len=0"
"205","1.589161","192.168.1.166","23.39.213.4","TLSv1.2","5389","Application Data"
"206","1.589243","192.168.1.166","23.39.213.4","TLSv1.2","339","Application Data"
"207","1.623332","23.39.213.4","192.168.1.166","TCP","54","443  >  52183 [ACK] Seq=153821 Ack=127575 Win=6310 Len=0"
"208","1.623332","23.39.213.4","192.168.1.166","TCP","54","443  >  52183 [ACK] Seq=153821 Ack=129990 Win=6348 Len=0"
"209","1.624354","23.39.213.4","192.168.1.166","TLSv1.2","574","Application Data"
"210","1.624354","23.39.213.4","192.168.1.166","TLSv1.2","347","Application Data"
"211","1.624354","23.39.213.4","192.168.1.166","TLSv1.2","85","Application Data"
"212","1.624376","192.168.1.166","23.39.213.4","TCP","54","52183  >  443 [ACK] Seq=130275 Ack=154665 Win=508 Len=0"
"213","1.635270","23.39.213.4","192.168.1.166","TLSv1.2","89","Application Data"
"214","1.635297","192.168.1.166","23.39.213.4","TCP","54","52183  >  443 [ACK] Seq=130275 Ack=154700 Win=508 Len=0"
"215","1.637065","192.168.1.166","23.39.213.4","TLSv1.2","5469","Application Data"
"216","1.637147","192.168.1.166","23.39.213.4","TLSv1.2","5470","Application Data"
"217","1.637171","192.168.1.166","23.39.213.4","TLSv1.2","815","Application Data"
"218","1.637184","192.168.1.166","23.39.213.4","TLSv1.2","899","Application Data"
"219","1.664475","192.168.1.166","23.39.213.4","TLSv1.2","5414","Application Data"
"220","1.668673","23.39.213.4","192.168.1.166","TCP","54","443  >  52183 [ACK] Seq=154700 Ack=133195 Win=6416 Len=0"
"221","1.668673","23.39.213.4","192.168.1.166","TCP","54","443  >  52183 [ACK] Seq=154700 Ack=135690 Win=6455 Len=0"
"222","1.668673","23.39.213.4","192.168.1.166","TCP","54","443  >  52183 [ACK] Seq=154700 Ack=140070 Win=6524 Len=0"
"223","1.668673","23.39.213.4","192.168.1.166","TCP","54","443  >  52183 [ACK] Seq=154700 Ack=141867 Win=6569 Len=0"
"224","1.695584","23.39.213.4","192.168.1.166","TCP","54","443  >  52183 [ACK] Seq=154700 Ack=144172 Win=6615 Len=0"
"225","1.695584","23.39.213.4","192.168.1.166","TCP","54","443  >  52183 [ACK] Seq=154700 Ack=148072 Win=6676 Len=0"
"226","1.724861","23.39.213.4","192.168.1.166","TLSv1.2","458","Application Data"
"227","1.724861","23.39.213.4","192.168.1.166","TLSv1.2","737","Application Data"
"228","1.724884","192.168.1.166","23.39.213.4","TCP","54","52183  >  443 [ACK] Seq=148072 Ack=155787 Win=511 Len=0"
"229","1.730125","23.39.213.4","192.168.1.166","TLSv1.2","952","Application Data"
"230","1.730125","23.39.213.4","192.168.1.166","TLSv1.2","1510","Application Data"
"231","1.730125","23.39.213.4","192.168.1.166","TCP","7354","443  >  52183 [PSH, ACK] Seq=158141 Ack=148072 Win=6676 Len=7300 [TCP PDU reassembled in 234]"
"232","1.730172","192.168.1.166","23.39.213.4","TCP","54","52183  >  443 [ACK] Seq=148072 Ack=165441 Win=511 Len=0"
"233","1.731062","23.39.213.4","192.168.1.166","TCP","1514","443  >  52183 [ACK] Seq=165441 Ack=148072 Win=6676 Len=1460 [TCP PDU reassembled in 234]"
"234","1.731062","23.39.213.4","192.168.1.166","TLSv1.2","564","Application Data"
"235","1.731078","192.168.1.166","23.39.213.4","TCP","54","52183  >  443 [ACK] Seq=148072 Ack=167411 Win=511 Len=0"
"236","1.734778","23.39.213.4","192.168.1.166","TLSv1.2","458","Application Data"
"237","1.734778","23.39.213.4","192.168.1.166","TLSv1.2","752","Application Data"
"238","1.734800","192.168.1.166","23.39.213.4","TCP","54","52183  >  443 [ACK] Seq=148072 Ack=168513 Win=507 Len=0"
"239","1.740878","23.39.213.4","192.168.1.166","TLSv1.2","483","Application Data"
"240","1.740878","23.39.213.4","192.168.1.166","TLSv1.2","781","Application Data"
"241","1.740898","192.168.1.166","23.39.213.4","TCP","54","52183  >  443 [ACK] Seq=148072 Ack=169669 Win=511 Len=0"
"242","1.741706","192.168.1.166","23.39.213.4","TLSv1.2","5414","Application Data"
"243","1.746210","192.168.1.166","23.39.213.4","TLSv1.2","5437","Application Data"
"244","1.746253","192.168.1.166","23.39.213.4","TLSv1.2","538","Application Data"
"245","1.774497","23.39.213.4","192.168.1.166","TCP","54","443  >  52183 [ACK] Seq=169669 Ack=153432 Win=6760 Len=0"
"246","1.780217","23.39.213.4","192.168.1.166","TCP","54","443  >  52183 [ACK] Seq=169669 Ack=156352 Win=6805 Len=0"
"247","1.780217","23.39.213.4","192.168.1.166","TCP","54","443  >  52183 [ACK] Seq=169669 Ack=158815 Win=6844 Len=0"
"248","1.791150","192.168.1.166","23.39.213.4","TLSv1.2","5711","Application Data"
"249","1.812218","192.168.1.166","23.39.213.4","TLSv1.2","5782","Application Data"
"250","1.812298","192.168.1.166","23.39.213.4","TLSv1.2","5500","Application Data"
"251","1.812422","192.168.1.166","23.39.213.4","TLSv1.2","5770","Application Data"
"252","1.813210","192.168.1.166","23.39.213.4","TLSv1.2","5783","Application Data"
"253","1.813272","192.168.1.166","23.39.213.4","TLSv1.2","5500","Application Data"
"254","1.813370","192.168.1.166","23.39.213.4","TLSv1.2","5770","Application Data"
"255","1.814616","192.168.1.166","23.39.213.4","TLSv1.2","5783","Application Data"
"256","1.814694","192.168.1.166","23.39.213.4","TLSv1.2","5500","Application Data"
"257","1.815406","192.168.1.166","23.39.213.4","TLSv1.2","5770","Application Data"
"258","1.815689","192.168.1.166","23.39.213.4","TLSv1.2","5783","Application Data"
"259","1.815756","192.168.1.166","23.39.213.4","TLSv1.2","5500","Application Data"
"260","1.815807","192.168.1.166","23.39.213.4","TLSv1.2","5770","Application Data"
"261","1.816950","192.168.1.166","23.39.213.4","TLSv1.2","5782","Application Data"
"262","1.817012","192.168.1.166","23.39.213.4","TLSv1.2","5500","Application Data"
"263","1.817108","192.168.1.166","23.39.213.4","TLSv1.2","5770","Application Data"
"264","1.819885","23.39.213.4","192.168.1.166","TCP","54","443  >  52183 [ACK] Seq=169669 Ack=159299 Win=6867 Len=0"
"265","1.824012","23.39.213.4","192.168.1.166","TCP","54","443  >  52183 [ACK] Seq=169669 Ack=160759 Win=6890 Len=0"
"266","1.824012","23.39.213.4","192.168.1.166","TCP","54","443  >  52183 [ACK] Seq=169669 Ack=162219 Win=6912 Len=0"
"267","1.824012","23.39.213.4","192.168.1.166","TCP","54","443  >  52183 [ACK] Seq=169669 Ack=164956 Win=6955 Len=0"
"268","1.843907","23.39.213.4","192.168.1.166","TCP","54","443  >  52183 [ACK] Seq=169669 Ack=166416 Win=6978 Len=0"
"269","1.843907","23.39.213.4","192.168.1.166","TCP","54","443  >  52183 [ACK] Seq=169669 Ack=167876 Win=7001 Len=0"
"270","1.843907","23.39.213.4","192.168.1.166","TCP","54","443  >  52183 [ACK] Seq=169669 Ack=170684 Win=7045 Len=0"
"271","1.843907","23.39.213.4","192.168.1.166","TCP","54","443  >  52183 [ACK] Seq=169669 Ack=172144 Win=7067 Len=0"
"272","1.843907","23.39.213.4","192.168.1.166","TCP","54","443  >  52183 [ACK] Seq=169669 Ack=175064 Win=7113 Len=0"
"273","1.843907","23.39.213.4","192.168.1.166","TCP","54","443  >  52183 [ACK] Seq=169669 Ack=176130 Win=7136 Len=0"
"274","1.843907","23.39.213.4","192.168.1.166","TCP","54","443  >  52183 [ACK] Seq=169669 Ack=177590 Win=7159 Len=0"
"275","1.843907","23.39.213.4","192.168.1.166","TCP","54","443  >  52183 [ACK] Seq=169669 Ack=180510 Win=7204 Len=0"
"276","1.845676","23.39.213.4","192.168.1.166","TCP","54","443  >  52183 [ACK] Seq=169669 Ack=181846 Win=7227 Len=0"
"277","1.845676","23.39.213.4","192.168.1.166","TCP","54","443  >  52183 [ACK] Seq=169669 Ack=183306 Win=7250 Len=0"
"278","1.845676","23.39.213.4","192.168.1.166","TCP","54","443  >  52183 [ACK] Seq=169669 Ack=187575 Win=7317 Len=0"
"279","1.845676","23.39.213.4","192.168.1.166","TCP","54","443  >  52183 [ACK] Seq=169669 Ack=189035 Win=7339 Len=0"
"280","1.845676","23.39.213.4","192.168.1.166","TCP","54","443  >  52183 [ACK] Seq=169669 Ack=193021 Win=7402 Len=0"
"281","1.845676","23.39.213.4","192.168.1.166","TCP","54","443  >  52183 [ACK] Seq=169669 Ack=194481 Win=7425 Len=0"
"282","1.845676","23.39.213.4","192.168.1.166","TCP","54","443  >  52183 [ACK] Seq=169669 Ack=195941 Win=7447 Len=0"
"283","1.847883","23.39.213.4","192.168.1.166","TCP","54","443  >  52183 [ACK] Seq=169669 Ack=197401 Win=7470 Len=0"
"284","1.847883","23.39.213.4","192.168.1.166","TCP","54","443  >  52183 [ACK] Seq=169669 Ack=198737 Win=7493 Len=0"
"285","1.847883","23.39.213.4","192.168.1.166","TCP","54","443  >  52183 [ACK] Seq=169669 Ack=200197 Win=7516 Len=0"
"286","1.847883","23.39.213.4","192.168.1.166","TCP","54","443  >  52183 [ACK] Seq=169669 Ack=201657 Win=7539 Len=0"
"287","1.847883","23.39.213.4","192.168.1.166","TCP","54","443  >  52183 [ACK] Seq=169669 Ack=204466 Win=7582 Len=0"
"288","1.847883","23.39.213.4","192.168.1.166","TCP","54","443  >  52183 [ACK] Seq=169669 Ack=205926 Win=7605 Len=0"
"289","1.847883","23.39.213.4","192.168.1.166","TCP","54","443  >  52183 [ACK] Seq=169669 Ack=209912 Win=7668 Len=0"
"290","1.847883","23.39.213.4","192.168.1.166","TCP","54","443  >  52183 [ACK] Seq=169669 Ack=211372 Win=7690 Len=0"
"291","1.850216","23.39.213.4","192.168.1.166","TCP","54","443  >  52183 [ACK] Seq=169669 Ack=212832 Win=7713 Len=0"
"292","1.850216","23.39.213.4","192.168.1.166","TCP","54","443  >  52183 [ACK] Seq=169669 Ack=215628 Win=7757 Len=0"
"293","1.850216","23.39.213.4","192.168.1.166","TCP","54","443  >  52183 [ACK] Seq=169669 Ack=217088 Win=7780 Len=0"
"294","1.850216","23.39.213.4","192.168.1.166","TCP","54","443  >  52183 [ACK] Seq=169669 Ack=221357 Win=7846 Len=0"
"295","1.850216","23.39.213.4","192.168.1.166","TCP","54","443  >  52183 [ACK] Seq=169669 Ack=222817 Win=7869 Len=0"
"296","1.850216","23.39.213.4","192.168.1.166","TCP","54","443  >  52183 [ACK] Seq=169669 Ack=226803 Win=7931 Len=0"
"297","1.852251","23.39.213.4","192.168.1.166","TCP","54","443  >  52183 [ACK] Seq=169669 Ack=228263 Win=7954 Len=0"
"298","1.853231","23.39.213.4","192.168.1.166","TCP","54","443  >  52183 [ACK] Seq=169669 Ack=232519 Win=8021 Len=0"
"299","1.853231","23.39.213.4","192.168.1.166","TCP","54","443  >  52183 [ACK] Seq=169669 Ack=233979 Win=8044 Len=0"
"300","1.853231","23.39.213.4","192.168.1.166","TCP","54","443  >  52183 [ACK] Seq=169669 Ack=238247 Win=8110 Len=0"
"301","1.853231","23.39.213.4","192.168.1.166","TCP","54","443  >  52183 [ACK] Seq=169669 Ack=239707 Win=8133 Len=0"
"302","1.853231","23.39.213.4","192.168.1.166","TCP","54","443  >  52183 [ACK] Seq=169669 Ack=242627 Win=8179 Len=0"
"303","1.854322","23.39.213.4","192.168.1.166","TCP","54","443  >  52183 [ACK] Seq=169669 Ack=243693 Win=8202 Len=0"
"304","1.854322","23.39.213.4","192.168.1.166","TCP","54","443  >  52183 [ACK] Seq=169669 Ack=245153 Win=8224 Len=0"
"305","1.854322","23.39.213.4","192.168.1.166","TCP","54","443  >  52183 [ACK] Seq=169669 Ack=246613 Win=8247 Len=0"
"306","1.854629","23.39.213.4","192.168.1.166","TCP","54","443  >  52183 [ACK] Seq=169669 Ack=248073 Win=8270 Len=0"
"307","1.854629","23.39.213.4","192.168.1.166","TCP","54","443  >  52183 [ACK] Seq=169669 Ack=249409 Win=8293 Len=0"
"308","1.866159","192.168.1.166","23.39.213.4","TLSv1.2","5545","Application Data"
"309","1.866627","192.168.1.166","23.39.213.4","TLSv1.2","5656","Application Data"
"310","1.868559","192.168.1.166","23.39.213.4","TLSv1.2","5545","Application Data"
"311","1.868715","192.168.1.166","23.39.213.4","TLSv1.2","5656","Application Data"
"312","1.871076","192.168.1.166","23.39.213.4","TLSv1.2","5545","Application Data"
"313","1.871145","192.168.1.166","23.39.213.4","TLSv1.2","5656","Application Data"
"314","1.872899","192.168.1.166","23.39.213.4","TLSv1.2","5545","Application Data"
"315","1.873065","192.168.1.166","23.39.213.4","TLSv1.2","5656","Application Data"
"316","1.890394","23.39.213.4","192.168.1.166","TLSv1.2","483","Application Data"
"317","1.890394","23.39.213.4","192.168.1.166","TLSv1.2","781","Application Data"
"318","1.890422","192.168.1.166","23.39.213.4","TCP","54","52183  >  443 [ACK] Seq=293781 Ack=170825 Win=507 Len=0"
"319","1.892317","192.168.1.166","23.39.213.4","TLSv1.2","5414","Application Data"
"320","1.898395","23.39.213.4","192.168.1.166","TCP","54","443  >  52183 [ACK] Seq=170825 Ack=250869 Win=8316 Len=0"
"321","1.898625","23.39.213.4","192.168.1.166","TCP","54","443  >  52183 [ACK] Seq=170825 Ack=254900 Win=8379 Len=0"
"322","1.898625","23.39.213.4","192.168.1.166","TCP","54","443  >  52183 [ACK] Seq=170825 Ack=256360 Win=8401 Len=0"
"323","1.898625","23.39.213.4","192.168.1.166","TCP","54","443  >  52183 [ACK] Seq=170825 Ack=260502 Win=8466 Len=0"
"324","1.900346","23.39.213.4","192.168.1.166","TCP","54","443  >  52183 [ACK] Seq=170825 Ack=261962 Win=8489 Len=0"
"325","1.900346","23.39.213.4","192.168.1.166","TCP","54","443  >  52183 [ACK] Seq=170825 Ack=264882 Win=8535 Len=0"
"326","1.900346","23.39.213.4","192.168.1.166","TCP","54","443  >  52183 [ACK] Seq=170825 Ack=265993 Win=8557 Len=0"
"327","1.900346","23.39.213.4","192.168.1.166","TCP","54","443  >  52183 [ACK] Seq=170825 Ack=267453 Win=8580 Len=0"
"328","1.901070","23.39.213.4","192.168.1.166","TCP","54","443  >  52183 [ACK] Seq=170825 Ack=271595 Win=8645 Len=0"
"329","1.902150","23.39.213.4","192.168.1.166","TLSv1.2","935","Application Data"
"330","1.902150","23.39.213.4","192.168.1.166","TLSv1.2","116","Application Data"
"331","1.902208","192.168.1.166","23.39.213.4","TCP","54","52183  >  443 [ACK] Seq=299141 Ack=171768 Win=511 Len=0"
"332","1.903153","23.39.213.4","192.168.1.166","TCP","54","443  >  52183 [ACK] Seq=171768 Ack=277086 Win=8731 Len=0"
"333","1.903153","23.39.213.4","192.168.1.166","TCP","54","443  >  52183 [ACK] Seq=171768 Ack=282688 Win=8818 Len=0"
"334","1.904380","23.39.213.4","192.168.1.166","TCP","54","443  >  52183 [ACK] Seq=171768 Ack=288179 Win=8904 Len=0"
"335","1.904380","23.39.213.4","192.168.1.166","TCP","54","443  >  52183 [ACK] Seq=171768 Ack=291099 Win=8950 Len=0"
"336","1.908439","23.39.213.4","192.168.1.166","TCP","54","443  >  52183 [ACK] Seq=171768 Ack=293781 Win=8995 Len=0"
"337","1.910590","192.168.1.166","23.39.213.4","TLSv1.2","5479","Application Data"
"338","1.910625","192.168.1.166","23.39.213.4","TLSv1.2","253","Application Data"
"339","1.924064","23.39.213.4","192.168.1.166","TCP","54","443  >  52183 [ACK] Seq=171768 Ack=299141 Win=9079 Len=0"
"340","1.925271","192.168.1.166","23.39.213.4","TLSv1.2","5548","Application Data"
"341","1.925332","192.168.1.166","23.39.213.4","TLSv1.2","5659","Application Data"
"342","1.927178","192.168.1.166","23.39.213.4","TLSv1.2","5467","Application Data"
"343","1.927210","192.168.1.166","23.39.213.4","TLSv1.2","906","Application Data"
"344","1.942576","23.39.213.4","192.168.1.166","TCP","54","443  >  52183 [ACK] Seq=171768 Ack=302061 Win=9125 Len=0"
"345","1.942576","23.39.213.4","192.168.1.166","TCP","54","443  >  52183 [ACK] Seq=171768 Ack=304566 Win=9164 Len=0"
"346","1.958682","23.39.213.4","192.168.1.166","TCP","54","443  >  52183 [ACK] Seq=171768 Ack=306225 Win=9187 Len=0"
"347","1.958682","23.39.213.4","192.168.1.166","TCP","54","443  >  52183 [ACK] Seq=171768 Ack=310259 Win=9250 Len=0"
"348","1.958682","23.39.213.4","192.168.1.166","TCP","54","443  >  52183 [ACK] Seq=171768 Ack=315864 Win=9337 Len=0"
"349","1.962085","23.39.213.4","192.168.1.166","TCP","54","443  >  52183 [ACK] Seq=171768 Ack=321277 Win=9422 Len=0"
"350","1.978477","23.39.213.4","192.168.1.166","TLSv1.2","482","Application Data"
"351","1.978477","23.39.213.4","192.168.1.166","TLSv1.2","192","Application Data"
"352","1.978477","23.39.213.4","192.168.1.166","TLSv1.2","484","Application Data"
"353","1.978477","23.39.213.4","192.168.1.166","TCP","1514","443  >  52183 [ACK] Seq=172764 Ack=322129 Win=9445 Len=1460 [TCP PDU reassembled in 354]"
"354","1.978477","23.39.213.4","192.168.1.166","TLSv1.2","229","Application Data"
"355","1.978515","192.168.1.166","23.39.213.4","TCP","54","52183  >  443 [ACK] Seq=322129 Ack=174399 Win=511 Len=0"
"356","1.981697","192.168.1.166","23.39.213.4","TLSv1.2","5482","Application Data"
"357","1.998537","23.39.213.4","192.168.1.166","TLSv1.2","484","Application Data"
"358","1.998537","23.39.213.4","192.168.1.166","TCP","1514","443  >  52183 [ACK] Seq=174829 Ack=322129 Win=9445 Len=1460 [TCP PDU reassembled in 359]"
"359","1.998537","23.39.213.4","192.168.1.166","TLSv1.2","1024","Application Data"
"360","1.998537","23.39.213.4","192.168.1.166","TLSv1.2","484","Application Data"
"361","1.998537","23.39.213.4","192.168.1.166","TCP","1514","443  >  52183 [ACK] Seq=177689 Ack=322129 Win=9445 Len=1460 [TCP PDU reassembled in 362]"
"362","1.998537","23.39.213.4","192.168.1.166","TLSv1.2","650","Application Data"
"363","1.998603","192.168.1.166","23.39.213.4","TCP","54","52183  >  443 [ACK] Seq=327557 Ack=179745 Win=511 Len=0"
"364","2.012929","23.39.213.4","192.168.1.166","TCP","54","443  >  52183 [ACK] Seq=179745 Ack=327557 Win=9529 Len=0"
"365","2.013972","192.168.1.166","23.39.213.4","TLSv1.2","560","Application Data"
"366","2.027177","23.39.213.4","192.168.1.166","TLSv1.2","354","Application Data"
"367","2.027177","23.39.213.4","192.168.1.166","TCP","4434","443  >  52183 [ACK] Seq=180045 Ack=327557 Win=9529 Len=4380 [TCP PDU reassembled in 368]"
"368","2.027177","23.39.213.4","192.168.1.166","TLSv1.2","927","Application Data"
"369","2.027212","192.168.1.166","23.39.213.4","TCP","54","52183  >  443 [ACK] Seq=328063 Ack=185298 Win=511 Len=0"
"370","2.028140","23.39.213.4","192.168.1.166","TLSv1.2","482","Application Data"
"371","2.028140","23.39.213.4","192.168.1.166","TLSv1.2","192","Application Data"
"372","2.028165","192.168.1.166","23.39.213.4","TCP","54","52183  >  443 [ACK] Seq=328063 Ack=185864 Win=509 Len=0"
"373","2.052708","23.39.213.4","192.168.1.166","TLSv1.2","484","Application Data"
"374","2.052708","23.39.213.4","192.168.1.166","TCP","4434","443  >  52183 [ACK] Seq=186294 Ack=328063 Win=9552 Len=4380 [TCP PDU reassembled in 375]"
"375","2.052708","23.39.213.4","192.168.1.166","TLSv1.2","322","Application Data"
"376","2.052746","192.168.1.166","23.39.213.4","TCP","54","52183  >  443 [ACK] Seq=328063 Ack=190942 Win=511 Len=0"
