"No.","Time","Source","Destination","Protocol","Length","Info"
"1","0.000000","192.168.1.166","23.39.213.4","TLSv1.2","5972","Application Data"
"2","0.000084","192.168.1.166","23.39.213.4","TLSv1.2","4665","Application Data"
"3","0.002433","192.168.1.166","23.39.213.4","TLSv1.2","5813","Application Data"
"4","0.037051","23.39.213.4","192.168.1.166","TCP","54","443  >  51520 [ACK] Seq=1 Ack=1461 Win=12270 Len=0"
"5","0.037051","23.39.213.4","192.168.1.166","TCP","54","443  >  51520 [ACK] Seq=1 Ack=2921 Win=12270 Len=0"
"6","0.037051","23.39.213.4","192.168.1.166","TCP","54","443  >  51520 [ACK] Seq=1 Ack=5919 Win=12260 Len=0"
"7","0.037051","23.39.213.4","192.168.1.166","TCP","54","443  >  51520 [ACK] Seq=1 Ack=7379 Win=12252 Len=0"
"8","0.037051","23.39.213.4","192.168.1.166","TCP","54","443  >  51520 [ACK] Seq=1 Ack=10530 Win=12235 Len=0"
"9","0.038997","23.39.213.4","192.168.1.166","TCP","54","443  >  51520 [ACK] Seq=1 Ack=11990 Win=12270 Len=0"
"10","0.038997","23.39.213.4","192.168.1.166","TCP","54","443  >  51520 [ACK] Seq=1 Ack=13450 Win=12262 Len=0"
"11","0.038997","23.39.213.4","192.168.1.166","TCP","54","443  >  51520 [ACK] Seq=1 Ack=16289 Win=12262 Len=0"
"12","0.078085","23.39.213.4","192.168.1.166","TLSv1.2","89","Application Data"
"13","0.078085","23.39.213.4","192.168.1.166","TLSv1.2","365","Application Data"
"14","0.078085","23.39.213.4","192.168.1.166","TLSv1.2","159","Application Data"
"15","0.078102","192.168.1.166","23.39.213.4","TCP","54","51520  >  443 [ACK] Seq=16289 Ack=452 Win=2043 Len=0"
"16","0.078548","192.168.1.166","23.39.213.4","TLSv1.2","89","Application Data"
"17","0.153329","23.39.213.4","192.168.1.166","TCP","54","443  >  51520 [ACK] Seq=452 Ack=16324 Win=12273 Len=0"
"18","1.901134","23.39.213.4","192.168.1.166","TCP","1514","443  >  51520 [ACK] Seq=452 Ack=16324 Win=12273 Len=1460 [TCP PDU reassembled in 19]"
"19","1.901134","23.39.213.4","192.168.1.166","TLSv1.2","56","Application Data"
"20","1.901134","23.39.213.4","192.168.1.166","TCP","1514","443  >  51520 [ACK] Seq=1914 Ack=16324 Win=12273 Len=1460 [TCP PDU reassembled in 31]"
"21","1.901134","23.39.213.4","192.168.1.166","TCP","1514","443  >  51520 [ACK] Seq=3374 Ack=16324 Win=12273 Len=1460 [TCP PDU reassembled in 31]"
"22","1.901134","23.39.213.4","192.168.1.166","TCP","1514","443  >  51520 [ACK] Seq=4834 Ack=16324 Win=12273 Len=1460 [TCP PDU reassembled in 31]"
"23","1.901134","23.39.213.4","192.168.1.166","TCP","1514","443  >  51520 [ACK] Seq=6294 Ack=16324 Win=12273 Len=1460 [TCP PDU reassembled in 31]"
"24","1.901134","23.39.213.4","192.168.1.166","TCP","1514","443  >  51520 [ACK] Seq=7754 Ack=16324 Win=12273 Len=1460 [TCP PDU reassembled in 31]"
"25","1.901134","23.39.213.4","192.168.1.166","TCP","1514","443  >  51520 [ACK] Seq=9214 Ack=16324 Win=12273 Len=1460 [TCP PDU reassembled in 31]"
"26","1.901134","23.39.213.4","192.168.1.166","TCP","1514","443  >  51520 [ACK] Seq=10674 Ack=16324 Win=12273 Len=1460 [TCP PDU reassembled in 31]"
"27","1.901134","23.39.213.4","192.168.1.166","TCP","1514","443  >  51520 [PSH, ACK] Seq=12134 Ack=16324 Win=12273 Len=1460 [TCP PDU reassembled in 31]"
"28","1.901134","23.39.213.4","192.168.1.166","TCP","1514","443  >  51520 [ACK] Seq=13594 Ack=16324 Win=12273 Len=1460 [TCP PDU reassembled in 31]"
"29","1.901134","23.39.213.4","192.168.1.166","TCP","1514","443  >  51520 [ACK] Seq=15054 Ack=16324 Win=12273 Len=1460 [TCP PDU reassembled in 31]"
"30","1.901134","23.39.213.4","192.168.1.166","TCP","1514","443  >  51520 [ACK] Seq=16514 Ack=16324 Win=12273 Len=1460 [TCP PDU reassembled in 31]"
"31","1.901134","23.39.213.4","192.168.1.166","TLSv1.2","1514","Application Data, Application Data"
"32","1.901134","23.39.213.4","192.168.1.166","TCP","5894","443  >  51520 [PSH, ACK] Seq=19434 Ack=16324 Win=12273 Len=5840 [TCP PDU reassembled in 39]"
"33","1.901134","23.39.213.4","192.168.1.166","TCP","1514","443  >  51520 [ACK] Seq=25274 Ack=16324 Win=12273 Len=1460 [TCP PDU reassembled in 39]"
"34","1.901134","23.39.213.4","192.168.1.166","TCP","1514","443  >  51520 [ACK] Seq=26734 Ack=16324 Win=12273 Len=1460 [TCP PDU reassembled in 39]"
"35","1.901134","23.39.213.4","192.168.1.166","TCP","1514","443  >  51520 [ACK] Seq=28194 Ack=16324 Win=12273 Len=1460 [TCP PDU reassembled in 39]"
"36","1.901134","23.39.213.4","192.168.1.166","TCP","1514","443  >  51520 [ACK] Seq=29654 Ack=16324 Win=12273 Len=1460 [TCP PDU reassembled in 39]"
"37","1.901134","23.39.213.4","192.168.1.166","TCP","1514","443  >  51520 [ACK] Seq=31114 Ack=16324 Win=12273 Len=1460 [TCP PDU reassembled in 39]"
"38","1.901134","23.39.213.4","192.168.1.166","TCP","1514","443  >  51520 [ACK] Seq=32574 Ack=16324 Win=12273 Len=1460 [TCP PDU reassembled in 39]"
"39","1.901134","23.39.213.4","192.168.1.166","TLSv1.2","777","Application Data"
"40","1.901134","23.39.213.4","192.168.1.166","TLSv1.2","1514","Application Data"
"41","1.901134","23.39.213.4","192.168.1.166","TCP","1514","443  >  51520 [ACK] Seq=36217 Ack=16324 Win=12273 Len=1460 [TCP PDU reassembled in 44]"
"42","1.901134","23.39.213.4","192.168.1.166","TCP","1514","443  >  51520 [ACK] Seq=37677 Ack=16324 Win=12273 Len=1460 [TCP PDU reassembled in 44]"
"43","1.901134","23.39.213.4","192.168.1.166","TCP","1514","443  >  51520 [ACK] Seq=39137 Ack=16324 Win=12273 Len=1460 [TCP PDU reassembled in 44]"
"44","1.901134","23.39.213.4","192.168.1.166","TLSv1.2","1514","Application Data"
"45","1.901134","23.39.213.4","192.168.1.166","TCP","1514","443  >  51520 [ACK] Seq=42057 Ack=16324 Win=12273 Len=1460 [TCP PDU reassembled in 49]"
"46","1.901134","23.39.213.4","192.168.1.166","TCP","1514","443  >  51520 [ACK] Seq=43517 Ack=16324 Win=12273 Len=1460 [TCP PDU reassembled in 49]"
"47","1.901134","23.39.213.4","192.168.1.166","TCP","1514","443  >  51520 [PSH, ACK] Seq=44977 Ack=16324 Win=12273 Len=1460 [TCP PDU reassembled in 49]"
"48","1.901134","23.39.213.4","192.168.1.166","TCP","1514","443  >  51520 [ACK] Seq=46437 Ack=16324 Win=12273 Len=1460 [TCP PDU reassembled in 49]"
"49","1.901134","23.39.213.4","192.168.1.166","TLSv1.2","798","Application Data"
"50","1.901260","192.168.1.166","23.39.213.4","TCP","54","51520  >  443 [ACK] Seq=16324 Ack=48641 Win=2047 Len=0"
"51","1.901300","23.39.213.4","192.168.1.166","TCP","1514","443  >  51520 [ACK] Seq=48641 Ack=16324 Win=12273 Len=1460 [TCP PDU reassembled in 60]"
"52","1.901300","23.39.213.4","192.168.1.166","TCP","1514","443  >  51520 [ACK] Seq=50101 Ack=16324 Win=12273 Len=1460 [TCP PDU reassembled in 60]"
"53","1.901300","23.39.213.4","192.168.1.166","TCP","1514","443  >  51520 [ACK] Seq=51561 Ack=16324 Win=12273 Len=1460 [TCP PDU reassembled in 60]"
"54","1.901300","23.39.213.4","192.168.1.166","TCP","1514","443  >  51520 [ACK] Seq=53021 Ack=16324 Win=12273 Len=1460 [TCP PDU reassembled in 60]"
"55","1.901300","23.39.213.4","192.168.1.166","TCP","1514","443  >  51520 [ACK] Seq=54481 Ack=16324 Win=12273 Len=1460 [TCP PDU reassembled in 60]"
"56","1.901300","23.39.213.4","192.168.1.166","TCP","1514","443  >  51520 [ACK] Seq=55941 Ack=16324 Win=12273 Len=1460 [TCP PDU reassembled in 60]"
"57","1.901300","23.39.213.4","192.168.1.166","TCP","1514","443  >  51520 [ACK] Seq=57401 Ack=16324 Win=12273 Len=1460 [TCP PDU reassembled in 60]"
"58","1.901300","23.39.213.4","192.168.1.166","TCP","1514","443  >  51520 [PSH, ACK] Seq=58861 Ack=16324 Win=12273 Len=1460 [TCP PDU reassembled in 60]"
"59","1.901300","23.39.213.4","192.168.1.166","TCP","4434","443  >  51520 [ACK] Seq=60321 Ack=16324 Win=12273 Len=4380 [TCP PDU reassembled in 60]"
"60","1.901300","23.39.213.4","192.168.1.166","TLSv1.2","431","Application Data, Application Data"
"61","1.901319","192.168.1.166","23.39.213.4","TCP","54","51520  >  443 [ACK] Seq=16324 Ack=65078 Win=2047 Len=0"
"62","1.901343","23.39.213.4","192.168.1.166","TCP","5894","443  >  51520 [ACK] Seq=65078 Ack=16324 Win=12273 Len=5840 [TCP PDU reassembled in 63]"
"63","1.901343","23.39.213.4","192.168.1.166","TLSv1.2","1318","Application Data"
"64","1.901349","192.168.1.166","23.39.213.4","TCP","54","51520  >  443 [ACK] Seq=16324 Ack=72182 Win=2047 Len=0"
"65","1.903010","23.39.213.4","192.168.1.166","TCP","16114","443  >  51520 [PSH, ACK] Seq=72182 Ack=16324 Win=12273 Len=16060 [TCP PDU reassembled in 66]"
"66","1.903010","23.39.213.4","192.168.1.166","TLSv1.2","400","Application Data"
"67","1.903040","192.168.1.166","23.39.213.4","TCP","54","51520  >  443 [ACK] Seq=16324 Ack=88588 Win=2047 Len=0"
"68","1.903999","23.39.213.4","192.168.1.166","TLSv1.2","5894","Application Data"
"69","1.903999","23.39.213.4","192.168.1.166","TLSv1.2","633","Application Data"
"70","1.904015","192.168.1.166","23.39.213.4","TCP","54","51520  >  443 [ACK] Seq=16324 Ack=95007 Win=2047 Len=0"
"71","1.907128","23.39.213.4","192.168.1.166","TCP","11734","443  >  51520 [PSH, ACK] Seq=95007 Ack=16324 Win=12273 Len=11680 [TCP PDU reassembled in 74]"
"72","1.907153","192.168.1.166","23.39.213.4","TCP","54","51520  >  443 [ACK] Seq=16324 Ack=106687 Win=2047 Len=0"
"73","1.907271","23.39.213.4","192.168.1.166","TCP","4434","443  >  51520 [ACK] Seq=106687 Ack=16324 Win=12273 Len=4380 [TCP PDU reassembled in 74]"
"74","1.907271","23.39.213.4","192.168.1.166","TLSv1.2","400","Application Data"
"75","1.907288","192.168.1.166","23.39.213.4","TCP","54","51520  >  443 [ACK] Seq=16324 Ack=111413 Win=2047 Len=0"
"76","1.908377","192.168.1.166","23.39.213.4","TLSv1.2","5986","Application Data"
"77","1.908395","23.39.213.4","192.168.1.166","TLSv1.2","85","Application Data"
"78","1.908395","23.39.213.4","192.168.1.166","TCP","7354","443  >  51520 [ACK] Seq=111444 Ack=16324 Win=12273 Len=7300 [TCP PDU reassembled in 79]"
"79","1.908395","23.39.213.4","192.168.1.166","TLSv1.2","1233","Application Data"
"80","1.908413","192.168.1.166","23.39.213.4","TLSv1.2","2065","Application Data"
"81","1.908425","192.168.1.166","23.39.213.4","TCP","54","51520  >  443 [ACK] Seq=24267 Ack=119923 Win=2047 Len=0"
"82","1.909599","23.39.213.4","192.168.1.166","TCP","11734","443  >  51520 [PSH, ACK] Seq=119923 Ack=16324 Win=12273 Len=11680 [TCP PDU reassembled in 83]"
"83","1.909599","23.39.213.4","192.168.1.166","TLSv1.2","321","Application Data"
"84","1.909599","23.39.213.4","192.168.1.166","TLSv1.2","124","Application Data, Application Data"
"85","1.928786","192.168.1.166","23.39.213.4","TCP","54","51520  >  443 [ACK] Seq=24267 Ack=131940 Win=2047 Len=0"
"86","1.943584","23.39.213.4","192.168.1.166","TCP","54","443  >  51520 [ACK] Seq=131940 Ack=17784 Win=12270 Len=0"
"87","1.943584","23.39.213.4","192.168.1.166","TCP","54","443  >  51520 [ACK] Seq=131940 Ack=22256 Win=12245 Len=0"
"88","1.943584","23.39.213.4","192.168.1.166","TCP","54","443  >  51520 [ACK] Seq=131940 Ack=23716 Win=12237 Len=0"
"89","1.943584","23.39.213.4","192.168.1.166","TCP","54","443  >  51520 [ACK] Seq=131940 Ack=24267 Win=12233 Len=0"
"90","1.951851","192.168.1.166","23.39.213.4","TLSv1.2","5663","Application Data"
"91","1.974825","23.39.213.4","192.168.1.166","TLSv1.2","365","Application Data"
"92","1.974825","23.39.213.4","192.168.1.166","TLSv1.2","159","Application Data"
"93","1.974851","192.168.1.166","23.39.213.4","TCP","54","51520  >  443 [ACK] Seq=29876 Ack=132356 Win=2046 Len=0"
"94","1.985003","23.39.213.4","192.168.1.166","TCP","54","443  >  51520 [ACK] Seq=132356 Ack=25727 Win=12270 Len=0"
"95","1.985003","23.39.213.4","192.168.1.166","TCP","54","443  >  51520 [ACK] Seq=132356 Ack=29876 Win=12248 Len=0"
"96","1.994908","192.168.1.166","23.39.213.4","TLSv1.2","5726","Application Data"
"97","2.019804","23.39.213.4","192.168.1.166","TLSv1.2","988","Application Data"
"98","2.026171","23.39.213.4","192.168.1.166","TLSv1.2","85","Application Data"
"99","2.026210","192.168.1.166","23.39.213.4","TCP","54","51520  >  443 [ACK] Seq=35548 Ack=133321 Win=2042 Len=0"
"100","2.027124","23.39.213.4","192.168.1.166","TCP","54","443  >  51520 [ACK] Seq=133321 Ack=35548 Win=12248 Len=0"
"101","2.038025","23.39.213.4","192.168.1.166","TLSv1.2","373","Application Data"
"102","2.038025","23.39.213.4","192.168.1.166","TLSv1.2","85","Application Data"
"103","2.038049","192.168.1.166","23.39.213.4","TCP","54","51520  >  443 [ACK] Seq=35548 Ack=133671 Win=2047 Len=0"
"104","2.253562","192.168.1.166","23.39.213.4","TLSv1.2","5589","Application Data"
"105","2.253626","192.168.1.166","23.39.213.4","TLSv1.2","588","Application Data"
"106","2.287139","23.39.213.4","192.168.1.166","TCP","54","443  >  51520 [ACK] Seq=133671 Ack=38468 Win=12262 Len=0"
"107","2.287139","23.39.213.4","192.168.1.166","TCP","54","443  >  51520 [ACK] Seq=133671 Ack=41083 Win=12263 Len=0"
"108","2.326921","192.168.1.166","23.39.213.4","TLSv1.2","5589","Application Data"
"109","2.326980","192.168.1.166","23.39.213.4","TLSv1.2","3641","Application Data"
"110","2.328036","23.39.213.4","192.168.1.166","TCP","54","443  >  51520 [ACK] Seq=133671 Ack=41617 Win=12273 Len=0"
"111","2.357309","192.168.1.166","23.39.213.4","TLSv1.2","5588","Application Data"
"112","2.357389","192.168.1.166","23.39.213.4","TLSv1.2","685","Application Data"
"113","2.360863","23.39.213.4","192.168.1.166","TCP","54","443  >  51520 [ACK] Seq=133671 Ack=43077 Win=12270 Len=0"
"114","2.360863","23.39.213.4","192.168.1.166","TCP","54","443  >  51520 [ACK] Seq=133671 Ack=47152 Win=12256 Len=0"
"115","2.360863","23.39.213.4","192.168.1.166","TCP","54","443  >  51520 [ACK] Seq=133671 Ack=48612 Win=12270 Len=0"
"116","2.360863","23.39.213.4","192.168.1.166","TCP","54","443  >  51520 [ACK] Seq=133671 Ack=50072 Win=12262 Len=0"
"117","2.360863","23.39.213.4","192.168.1.166","TCP","54","443  >  51520 [ACK] Seq=133671 Ack=50739 Win=12258 Len=0"
"118","2.384387","23.39.213.4","192.168.1.166","TLSv1.2","953","Application Data"
"119","2.384387","23.39.213.4","192.168.1.166","TLSv1.2","1514","Application Data"
"120","2.384387","23.39.213.4","192.168.1.166","TLSv1.2","200","Application Data"
"121","2.384433","192.168.1.166","23.39.213.4","TCP","54","51520  >  443 [ACK] Seq=56904 Ack=136176 Win=2047 Len=0"
"122","2.390782","23.39.213.4","192.168.1.166","TCP","54","443  >  51520 [ACK] Seq=136176 Ack=55119 Win=12255 Len=0"
"123","2.390782","23.39.213.4","192.168.1.166","TCP","54","443  >  51520 [ACK] Seq=136176 Ack=56904 Win=12244 Len=0"
"124","2.530362","23.39.213.4","192.168.1.166","TLSv1.2","957","Application Data"
"125","2.530362","23.39.213.4","192.168.1.166","TLSv1.2","1514","Application Data"
"126","2.530362","23.39.213.4","192.168.1.166","TCP","1514","443  >  51520 [ACK] Seq=138539 Ack=56904 Win=12273 Len=1460 [TCP PDU reassembled in 130]"
"127","2.530362","23.39.213.4","192.168.1.166","TCP","1514","443  >  51520 [ACK] Seq=139999 Ack=56904 Win=12273 Len=1460 [TCP PDU reassembled in 130]"
"128","2.530362","23.39.213.4","192.168.1.166","TCP","1514","443  >  51520 [ACK] Seq=141459 Ack=56904 Win=12273 Len=1460 [TCP PDU reassembled in 130]"
"129","2.530362","23.39.213.4","192.168.1.166","TCP","1514","443  >  51520 [ACK] Seq=142919 Ack=56904 Win=12273 Len=1460 [TCP PDU reassembled in 130]"
"130","2.530362","23.39.213.4","192.168.1.166","TLSv1.2","1062","Application Data"
"131","2.530423","192.168.1.166","23.39.213.4","TCP","54","51520  >  443 [ACK] Seq=56904 Ack=145387 Win=2047 Len=0"
"132","2.579531","23.39.213.4","192.168.1.166","TLSv1.2","957","Application Data"
"133","2.579531","23.39.213.4","192.168.1.166","TLSv1.2","196","Application Data"
"134","2.579573","192.168.1.166","23.39.213.4","TCP","54","51520  >  443 [ACK] Seq=56904 Ack=146432 Win=2043 Len=0"
"135","2.597762","192.168.1.166","23.39.213.4","TLSv1.2","5474","Application Data"
"136","2.597836","192.168.1.166","23.39.213.4","TLSv1.2","391","Application Data"
"137","2.603056","192.168.1.166","23.39.213.4","TLSv1.2","5590","Application Data"
"138","2.603148","192.168.1.166","23.39.213.4","TLSv1.2","5590","Application Data"
"139","2.603175","192.168.1.166","23.39.213.4","TLSv1.2","3223","Application Data"
"140","2.603190","192.168.1.166","23.39.213.4","TLSv1.2","1469","Application Data"
"141","2.625404","192.168.1.166","23.39.213.4","TLSv1.2","5590","Application Data"
"142","2.625484","192.168.1.166","23.39.213.4","TLSv1.2","653","Application Data"
"143","2.673281","23.39.213.4","192.168.1.166","TCP","54","443  >  51520 [ACK] Seq=146432 Ack=84452 Win=12129 Len=0"
"144","2.786013","23.39.213.4","192.168.1.166","TLSv1.2","957","Application Data"
"145","2.786013","23.39.213.4","192.168.1.166","TLSv1.2","195","Application Data"
"146","2.786013","23.39.213.4","192.168.1.166","TLSv1.2","958","Application Data"
"147","2.786013","23.39.213.4","192.168.1.166","TLSv1.2","226","Application Data"
"148","2.786057","192.168.1.166","23.39.213.4","TCP","54","51520  >  443 [ACK] Seq=84452 Ack=148552 Win=2047 Len=0"
"149","2.792504","192.168.1.166","23.39.213.4","TLSv1.2","5590","Application Data"
"150","2.792564","192.168.1.166","23.39.213.4","TLSv1.2","4300","Application Data"
"151","2.825659","23.39.213.4","192.168.1.166","TCP","54","443  >  51520 [ACK] Seq=148552 Ack=85912 Win=12270 Len=0"
"152","2.825659","23.39.213.4","192.168.1.166","TCP","54","443  >  51520 [ACK] Seq=148552 Ack=89988 Win=12256 Len=0"
"153","2.825659","23.39.213.4","192.168.1.166","TCP","54","443  >  51520 [ACK] Seq=148552 Ack=91448 Win=12248 Len=0"
"154","2.825659","23.39.213.4","192.168.1.166","TCP","54","443  >  51520 [ACK] Seq=148552 Ack=92908 Win=12241 Len=0"
"155","2.825659","23.39.213.4","192.168.1.166","TCP","54","443  >  51520 [ACK] Seq=148552 Ack=94234 Win=12234 Len=0"
"156","2.845543","23.39.213.4","192.168.1.166","TLSv1.2","957","Application Data"
"157","2.845543","23.39.213.4","192.168.1.166","TLSv1.2","1510","Application Data"
"158","2.845543","23.39.213.4","192.168.1.166","TCP","8814","443  >  51520 [ACK] Seq=150911 Ack=94234 Win=12273 Len=8760 [TCP PDU reassembled in 159]"
"159","2.845543","23.39.213.4","192.168.1.166","TLSv1.2","739","Application Data"
"160","2.845607","192.168.1.166","23.39.213.4","TCP","54","51520  >  443 [ACK] Seq=94234 Ack=160356 Win=2047 Len=0"
"161","2.848888","192.168.1.166","23.39.213.4","TLSv1.2","5471","Application Data"
"162","2.848936","192.168.1.166","23.39.213.4","TLSv1.2","317","Application Data"
"163","2.882591","23.39.213.4","192.168.1.166","TCP","54","443  >  51520 [ACK] Seq=160356 Ack=99914 Win=12246 Len=0"
"164","2.960880","23.39.213.4","192.168.1.166","TLSv1.2","960","Application Data"
"165","2.960880","23.39.213.4","192.168.1.166","TLSv1.2","1169","Application Data"
"166","2.960919","192.168.1.166","23.39.213.4","TCP","54","51520  >  443 [ACK] Seq=99914 Ack=162377 Win=2047 Len=0"
"167","2.977301","192.168.1.166","23.39.213.4","TLSv1.2","5593","Application Data"
"168","2.977353","192.168.1.166","23.39.213.4","TLSv1.2","411","Application Data"
"169","2.978231","23.39.213.4","192.168.1.166","TLSv1.2","959","Application Data"
"170","2.978231","23.39.213.4","192.168.1.166","TLSv1.2","244","Application Data"
"171","2.978263","192.168.1.166","23.39.213.4","TLSv1.2","5593","Application Data"
"172","2.978291","192.168.1.166","23.39.213.4","TLSv1.2","2030","Application Data"
"173","2.985978","23.39.213.4","192.168.1.166","TLSv1.2","953","Application Data"
"174","2.985978","23.39.213.4","192.168.1.166","TLSv1.2","1184","Application Data"
"175","2.986020","192.168.1.166","23.39.213.4","TCP","54","51520  >  443 [ACK] Seq=113325 Ack=165501 Win=2047 Len=0"
"176","3.011308","23.39.213.4","192.168.1.166","TCP","54","443  >  51520 [ACK] Seq=165501 Ack=102834 Win=12262 Len=0"
"177","3.011308","23.39.213.4","192.168.1.166","TCP","54","443  >  51520 [ACK] Seq=165501 Ack=105453 Win=12263 Len=0"
"178","3.011308","23.39.213.4","192.168.1.166","TCP","54","443  >  51520 [ACK] Seq=165501 Ack=107270 Win=12253 Len=0"
"179","3.011308","23.39.213.4","192.168.1.166","TCP","54","443  >  51520 [ACK] Seq=165501 Ack=112809 Win=12224 Len=0"
"180","3.011541","192.168.1.166","23.39.213.4","TLSv1.2","5586","Application Data"
"181","3.011593","192.168.1.166","23.39.213.4","TLSv1.2","561","Application Data"
"182","3.034793","192.168.1.166","23.39.213.4","TLSv1.2","5477","Application Data"
"183","3.035447","192.168.1.166","23.39.213.4","TLSv1.2","5470","Application Data"
"184","3.035907","192.168.1.166","23.39.213.4","TLSv1.2","5494","Application Data"
"185","3.043132","192.168.1.166","23.39.213.4","TLSv1.2","5548","Application Data"
"186","3.043599","192.168.1.166","23.39.213.4","TLSv1.2","5596","Application Data"
"187","3.044658","23.39.213.4","192.168.1.166","TCP","54","443  >  51520 [ACK] Seq=165501 Ack=114785 Win=12270 Len=0"
"188","3.044658","23.39.213.4","192.168.1.166","TCP","54","443  >  51520 [ACK] Seq=165501 Ack=119364 Win=12260 Len=0"
"189","3.079369","23.39.213.4","192.168.1.166","TCP","54","443  >  51520 [ACK] Seq=165501 Ack=146679 Win=12133 Len=0"
"190","3.121056","23.39.213.4","192.168.1.166","TLSv1.2","483","Application Data"
"191","3.121056","23.39.213.4","192.168.1.166","TLSv1.2","639","Application Data"
"192","3.121085","192.168.1.166","23.39.213.4","TCP","54","51520  >  443 [ACK] Seq=146679 Ack=166515 Win=2044 Len=0"
"193","3.129715","23.39.213.4","192.168.1.166","TLSv1.2","963","Application Data"
"194","3.129715","23.39.213.4","192.168.1.166","TLSv1.2","369","Application Data"
"195","3.129759","192.168.1.166","23.39.213.4","TCP","54","51520  >  443 [ACK] Seq=146679 Ack=167739 Win=2047 Len=0"
"196","3.130312","23.39.213.4","192.168.1.166","TLSv1.2","952","Application Data"
"197","3.130312","23.39.213.4","192.168.1.166","TLSv1.2","331","Application Data"
"198","3.130334","192.168.1.166","23.39.213.4","TCP","54","51520  >  443 [ACK] Seq=146679 Ack=168914 Win=2043 Len=0"
"199","3.134658","23.39.213.4","192.168.1.166","TLSv1.2","483","Application Data"
"200","3.134658","23.39.213.4","192.168.1.166","TCP","1514","443  >  51520 [ACK] Seq=169343 Ack=146679 Win=12273 Len=1460 [TCP PDU reassembled in 201]"
"201","3.134658","23.39.213.4","192.168.1.166","TLSv1.2","74","Application Data"
"202","3.134658","23.39.213.4","192.168.1.166","TLSv1.2","955","Application Data"
"203","3.134658","23.39.213.4","192.168.1.166","TLSv1.2","2974","Application Data"
"204","3.134658","23.39.213.4","192.168.1.166","TLSv1.2","169","Application Data"
"205","3.134697","192.168.1.166","23.39.213.4","TCP","54","51520  >  443 [ACK] Seq=146679 Ack=174759 Win=2047 Len=0"
"206","3.135764","23.39.213.4","192.168.1.166","TLSv1.2","483","Application Data"
"207","3.135764","23.39.213.4","192.168.1.166","TLSv1.2","449","Application Data"
"208","3.135785","192.168.1.166","23.39.213.4","TCP","54","51520  >  443 [ACK] Seq=146679 Ack=175583 Win=2044 Len=0"
"209","3.137804","23.39.213.4","192.168.1.166","TLSv1.2","482","Application Data"
"210","3.137804","23.39.213.4","192.168.1.166","TLSv1.2","193","Application Data"
"211","3.137825","192.168.1.166","23.39.213.4","TCP","54","51520  >  443 [ACK] Seq=146679 Ack=176150 Win=2042 Len=0"
"212","3.139475","23.39.213.4","192.168.1.166","TLSv1.2","482","Application Data"
"213","3.139475","23.39.213.4","192.168.1.166","TLSv1.2","196","Application Data"
"214","3.139493","192.168.1.166","23.39.213.4","TCP","54","51520  >  443 [ACK] Seq=146679 Ack=176720 Win=2047 Len=0"
"215","3.265743","192.168.1.166","23.39.213.4","TLSv1.2","5477","Application Data"
"216","3.265822","192.168.1.166","23.39.213.4","TLSv1.2","5562","Application Data"
"217","3.300378","23.39.213.4","192.168.1.166","TCP","54","443  >  51520 [ACK] Seq=176720 Ack=149599 Win=12262 Len=0"
"218","3.300378","23.39.213.4","192.168.1.166","TCP","54","443  >  51520 [ACK] Seq=176720 Ack=152102 Win=12264 Len=0"
"219","3.300378","23.39.213.4","192.168.1.166","TCP","54","443  >  51520 [ACK] Seq=176720 Ack=157610 Win=12235 Len=0"
"220","3.336553","192.168.1.166","23.39.213.4","TLSv1.2","5485","Application Data"
"221","3.340920","192.168.1.166","23.39.213.4","TLSv1.2","5587","Application Data"
"222","3.340979","192.168.1.166","23.39.213.4","TLSv1.2","474","Application Data"
"223","3.370423","23.39.213.4","192.168.1.166","TCP","54","443  >  51520 [ACK] Seq=176720 Ack=161990 Win=12262 Len=0"
"224","3.374728","23.39.213.4","192.168.1.166","TCP","54","443  >  51520 [ACK] Seq=176720 Ack=164501 Win=12270 Len=0"
"225","3.411340","23.39.213.4","192.168.1.166","TCP","54","443  >  51520 [ACK] Seq=176720 Ack=168994 Win=12245 Len=0"
"226","3.469515","23.39.213.4","192.168.1.166","TLSv1.2","374","Application Data"
"227","3.475430","23.39.213.4","192.168.1.166","TLSv1.2","484","Application Data"
"228","3.475430","23.39.213.4","192.168.1.166","TCP","1514","443  >  51520 [ACK] Seq=177470 Ack=168994 Win=12273 Len=1460 [TCP PDU reassembled in 229]"
"229","3.475430","23.39.213.4","192.168.1.166","TLSv1.2","526","Application Data"
"230","3.475459","192.168.1.166","23.39.213.4","TCP","54","51520  >  443 [ACK] Seq=168994 Ack=179402 Win=2047 Len=0"
"231","3.494679","23.39.213.4","192.168.1.166","TLSv1.2","941","Application Data"
"232","3.494679","23.39.213.4","192.168.1.166","TLSv1.2","767","Application Data"
"233","3.494720","192.168.1.166","23.39.213.4","TCP","54","51520  >  443 [ACK] Seq=168994 Ack=181002 Win=2047 Len=0"
"234","3.509562","23.39.213.4","192.168.1.166","TLSv1.2","85","Application Data"
"235","3.515940","192.168.1.166","23.39.213.4","TLSv1.2","5587","Application Data"
"236","3.516026","192.168.1.166","23.39.213.4","TLSv1.2","5588","Application Data"
"237","3.516055","192.168.1.166","23.39.213.4","TLSv1.2","487","Application Data"
"238","3.516071","192.168.1.166","23.39.213.4","TLSv1.2","382","Application Data"
"239","3.517098","192.168.1.166","23.39.213.4","TLSv1.2","5588","Application Data"
"240","3.517167","192.168.1.166","23.39.213.4","TLSv1.2","5588","Application Data"
"241","3.517223","192.168.1.166","23.39.213.4","TLSv1.2","5588","Application Data"
"242","3.517247","192.168.1.166","23.39.213.4","TLSv1.2","1465","Application Data"
"243","3.517258","192.168.1.166","23.39.213.4","TLSv1.2","579","Application Data"
"244","3.517269","192.168.1.166","23.39.213.4","TLSv1.2","579","Application Data"
"245","3.517492","192.168.1.166","23.39.213.4","TLSv1.2","5588","Application Data"
"246","3.517554","192.168.1.166","23.39.213.4","TLSv1.2","5588","Application Data"
"247","3.517612","192.168.1.166","23.39.213.4","TLSv1.2","5588","Application Data"
"248","3.517663","192.168.1.166","23.39.213.4","TLSv1.2","5588","Application Data"
"249","3.517677","192.168.1.166","23.39.213.4","TLSv1.2","579","Application Data"
"250","3.517688","192.168.1.166","23.39.213.4","TLSv1.2","579","Application Data"
"251","3.517701","192.168.1.166","23.39.213.4","TLSv1.2","579","Application Data"
"252","3.517712","192.168.1.166","23.39.213.4","TLSv1.2","579","Application Data"
"253","3.535442","192.168.1.166","23.39.213.4","TLSv1.2","5588","Application Data"
"254","3.535511","192.168.1.166","23.39.213.4","TLSv1.2","898","Application Data"
"255","3.550441","23.39.213.4","192.168.1.166","TCP","54","443  >  51520 [ACK] Seq=181033 Ack=171914 Win=12273 Len=0"
"256","3.550441","23.39.213.4","192.168.1.166","TCP","54","443  >  51520 [ACK] Seq=181033 Ack=174527 Win=12273 Len=0"
"257","3.550441","23.39.213.4","192.168.1.166","TCP","54","443  >  51520 [ACK] Seq=181033 Ack=180822 Win=12242 Len=0"
"258","3.551563","192.168.1.166","23.39.213.4","TLSv1.2","5547","Application Data"
"259","3.551615","192.168.1.166","23.39.213.4","TLSv1.2","186","Application Data"
"260","3.553248","23.39.213.4","192.168.1.166","TCP","54","443  >  51520 [ACK] Seq=181033 Ack=183742 Win=12270 Len=0"
"261","3.553248","23.39.213.4","192.168.1.166","TCP","54","443  >  51520 [ACK] Seq=181033 Ack=186356 Win=12271 Len=0"
"262","3.553248","23.39.213.4","192.168.1.166","TCP","54","443  >  51520 [ACK] Seq=181033 Ack=196270 Win=12226 Len=0"
"263","3.554720","23.39.213.4","192.168.1.166","TCP","54","443  >  51520 [ACK] Seq=181033 Ack=198835 Win=12264 Len=0"
"264","3.564482","23.39.213.4","192.168.1.166","TCP","54","443  >  51520 [ACK] Seq=181033 Ack=224121 Win=12124 Len=0"
"265","3.567918","23.39.213.4","192.168.1.166","TCP","54","443  >  51520 [ACK] Seq=181033 Ack=228501 Win=12255 Len=0"
"266","3.580017","23.39.213.4","192.168.1.166","TCP","54","443  >  51520 [ACK] Seq=181033 Ack=230499 Win=12243 Len=0"
"267","3.584596","23.39.213.4","192.168.1.166","TCP","54","443  >  51520 [ACK] Seq=181033 Ack=235992 Win=12256 Len=0"
"268","3.612710","192.168.1.166","23.39.213.4","TLSv1.2","5459","Application Data"
"269","3.613469","192.168.1.166","23.39.213.4","TLSv1.2","5451","Application Data"
"270","3.614207","192.168.1.166","23.39.213.4","TLSv1.2","5487","Application Data"
"271","3.614365","192.168.1.166","23.39.213.4","TLSv1.2","5574","Application Data"
"272","3.615230","192.168.1.166","23.39.213.4","TLSv1.2","5486","Application Data"
"273","3.615688","192.168.1.166","23.39.213.4","TLSv1.2","5458","Application Data"
"274","3.626746","23.39.213.4","192.168.1.166","TCP","54","443  >  51520 [ACK] Seq=181033 Ack=236124 Win=12273 Len=0"
"275","3.635701","23.39.213.4","192.168.1.166","TLSv1.2","955","Application Data"
"276","3.635701","23.39.213.4","192.168.1.166","TLSv1.2","1513","Application Data"
"277","3.635701","23.39.213.4","192.168.1.166","TLSv1.2","887","Application Data"
"278","3.635701","23.39.213.4","192.168.1.166","TLSv1.2","418","Application Data"
"279","3.635701","23.39.213.4","192.168.1.166","TLSv1.2","254","Application Data"
"280","3.635742","192.168.1.166","23.39.213.4","TCP","54","51520  >  443 [ACK] Seq=268715 Ack=184790 Win=2047 Len=0"
"281","3.645814","23.39.213.4","192.168.1.166","TCP","54","443  >  51520 [ACK] Seq=184790 Ack=239044 Win=12273 Len=0"
"282","3.645814","23.39.213.4","192.168.1.166","TCP","54","443  >  51520 [ACK] Seq=184790 Ack=241529 Win=12273 Len=0"
"283","3.649860","192.168.1.166","23.39.213.4","TLSv1.2","5588","Application Data"
"284","3.649921","192.168.1.166","23.39.213.4","TLSv1.2","1069","Application Data"
"285","3.667516","23.39.213.4","192.168.1.166","TLSv1.2","957","Application Data"
"286","3.667516","23.39.213.4","192.168.1.166","TLSv1.2","647","Application Data"
"287","3.667557","192.168.1.166","23.39.213.4","TCP","54","51520  >  443 [ACK] Seq=275264 Ack=186286 Win=2047 Len=0"
"288","3.682501","23.39.213.4","192.168.1.166","TCP","54","443  >  51520 [ACK] Seq=186286 Ack=274249 Win=12248 Len=0"
"289","3.693069","23.39.213.4","192.168.1.166","TLSv1.2","957","Application Data"
"290","3.693069","23.39.213.4","192.168.1.166","TCP","11734","443  >  51520 [PSH, ACK] Seq=187189 Ack=275264 Win=12243 Len=11680 [TCP PDU reassembled in 292]"
"291","3.693100","192.168.1.166","23.39.213.4","TCP","54","51520  >  443 [ACK] Seq=275264 Ack=198869 Win=2047 Len=0"
"292","3.693739","23.39.213.4","192.168.1.166","TLSv1.2","11734","Application Data, Application Data"
"293","3.693755","192.168.1.166","23.39.213.4","TCP","54","51520  >  443 [ACK] Seq=275264 Ack=210549 Win=2047 Len=0"
"294","3.694441","23.39.213.4","192.168.1.166","TCP","8814","443  >  51520 [ACK] Seq=210549 Ack=275264 Win=12243 Len=8760 [TCP PDU reassembled in 296]"
"295","3.694457","192.168.1.166","23.39.213.4","TCP","54","51520  >  443 [ACK] Seq=275264 Ack=219309 Win=2047 Len=0"
"296","3.694554","23.39.213.4","192.168.1.166","TLSv1.2","777","Application Data"
"297","3.694563","192.168.1.166","23.39.213.4","TCP","54","51520  >  443 [ACK] Seq=275264 Ack=220032 Win=2045 Len=0"
"298","3.695303","23.39.213.4","192.168.1.166","TLSv1.2","5894","Application Data, Application Data, Application Data, Application Data, Application Data, Application Data, Application Data, Application Data, Application Data"
"299","3.695303","23.39.213.4","192.168.1.166","TLSv1.2","225","Application Data"
"300","3.695312","192.168.1.166","23.39.213.4","TCP","54","51520  >  443 [ACK] Seq=275264 Ack=226043 Win=2047 Len=0"
"301","3.701204","23.39.213.4","192.168.1.166","TLSv1.2","246","Application Data"
"302","3.701204","23.39.213.4","192.168.1.166","TLSv1.2","940","Application Data"
"303","3.701204","23.39.213.4","192.168.1.166","TLSv1.2","554","Application Data"
"304","3.701222","192.168.1.166","23.39.213.4","TCP","54","51520  >  443 [ACK] Seq=275264 Ack=227621 Win=2047 Len=0"
"305","3.706577","23.39.213.4","192.168.1.166","TLSv1.2","950","Application Data"
"306","3.706577","23.39.213.4","192.168.1.166","TLSv1.2","715","Application Data"
"307","3.706597","192.168.1.166","23.39.213.4","TCP","54","51520  >  443 [ACK] Seq=275264 Ack=229178 Win=2047 Len=0"
"308","3.751807","23.39.213.4","192.168.1.166","TLSv1.2","483","Application Data"
"309","3.751807","23.39.213.4","192.168.1.166","TLSv1.2","651","Application Data"
"310","3.751807","23.39.213.4","192.168.1.166","TLSv1.2","484","Application Data"
"311","3.751807","23.39.213.4","192.168.1.166","TCP","1514","443  >  51520 [ACK] Seq=230634 Ack=275264 Win=12273 Len=1460 [TCP PDU reassembled in 312]"
"312","3.751807","23.39.213.4","192.168.1.166","TLSv1.2","530","Application Data"
"313","3.751839","192.168.1.166","23.39.213.4","TCP","54","51520  >  443 [ACK] Seq=275264 Ack=232570 Win=2047 Len=0"
"314","3.753030","23.39.213.4","192.168.1.166","TLSv1.2","484","Application Data"
"315","3.753030","23.39.213.4","192.168.1.166","TLSv1.2","949","Application Data"
"316","3.753052","192.168.1.166","23.39.213.4","TCP","54","51520  >  443 [ACK] Seq=275264 Ack=233895 Win=2042 Len=0"
"317","3.759483","23.39.213.4","192.168.1.166","TLSv1.2","483","Application Data"
"318","3.759483","23.39.213.4","192.168.1.166","TLSv1.2","1085","Application Data"
"319","3.759508","192.168.1.166","23.39.213.4","TCP","54","51520  >  443 [ACK] Seq=275264 Ack=235355 Win=2047 Len=0"
"320","3.761253","23.39.213.4","192.168.1.166","TLSv1.2","483","Application Data"
"321","3.761253","23.39.213.4","192.168.1.166","TLSv1.2","448","Application Data"
"322","3.761275","192.168.1.166","23.39.213.4","TCP","54","51520  >  443 [ACK] Seq=275264 Ack=236178 Win=2044 Len=0"
"323","3.777794","192.168.1.166","23.39.213.4","TLSv1.2","5778","Application Data"
"324","3.777860","192.168.1.166","23.39.213.4","TLSv1.2","4140","Application Data"
"325","3.779101","192.168.1.166","23.39.213.4","TLSv1.2","5494","Application Data"
"326","3.779145","192.168.1.166","23.39.213.4","TLSv1.2","253","Application Data"
"327","3.792221","23.39.213.4","192.168.1.166","TLSv1.2","483","Application Data"
"328","3.792221","23.39.213.4","192.168.1.166","TLSv1.2","773","Application Data"
"329","3.792265","192.168.1.166","23.39.213.4","TCP","54","51520  >  443 [ACK] Seq=290713 Ack=237326 Win=2047 Len=0"
"330","3.808158","192.168.1.166","23.39.213.4","TLSv1.2","5582","Application Data"
"331","3.808224","192.168.1.166","23.39.213.4","TLSv1.2","2980","Application Data"
"332","3.850047","23.39.213.4","192.168.1.166","TCP","54","443  >  51520 [ACK] Seq=237326 Ack=278184 Win=12262 Len=0"
"333","3.850047","23.39.213.4","192.168.1.166","TCP","54","443  >  51520 [ACK] Seq=237326 Ack=280988 Win=12270 Len=0"
"334","3.850047","23.39.213.4","192.168.1.166","TCP","54","443  >  51520 [ACK] Seq=237326 Ack=285074 Win=12249 Len=0"
"335","3.850047","23.39.213.4","192.168.1.166","TCP","54","443  >  51520 [ACK] Seq=237326 Ack=290514 Win=12249 Len=0"
"336","3.854703","23.39.213.4","192.168.1.166","TCP","54","443  >  51520 [ACK] Seq=237326 Ack=290713 Win=12273 Len=0"
"337","3.862986","23.39.213.4","192.168.1.166","TLSv1.2","953","Application Data"
"338","3.862986","23.39.213.4","192.168.1.166","TLSv1.2","345","Application Data"
"339","3.863011","192.168.1.166","23.39.213.4","TCP","54","51520  >  443 [ACK] Seq=299167 Ack=238516 Win=2043 Len=0"
"340","3.889351","23.39.213.4","192.168.1.166","TLSv1.2","941","Application Data"
"341","3.889351","23.39.213.4","192.168.1.166","TLSv1.2","621","Application Data"
"342","3.889368","192.168.1.166","23.39.213.4","TCP","54","51520  >  443 [ACK] Seq=299167 Ack=239970 Win=2047 Len=0"
"343","3.894594","192.168.1.166","23.39.213.4","TLSv1.2","5438","Application Data"
"344","3.894641","192.168.1.166","23.39.213.4","TLSv1.2","784","Application Data"
"345","3.895853","192.168.1.166","23.39.213.4","TLSv1.2","5452","Application Data"
"346","3.895888","192.168.1.166","23.39.213.4","TLSv1.2","871","Application Data"
"347","3.896838","192.168.1.166","23.39.213.4","TLSv1.2","5588","Application Data"
"348","3.896874","192.168.1.166","23.39.213.4","TLSv1.2","2296","Application Data"
"349","3.902135","23.39.213.4","192.168.1.166","TLSv1.2","89","Application Data"
"350","3.928877","23.39.213.4","192.168.1.166","TCP","54","443  >  51520 [ACK] Seq=240005 Ack=303547 Win=12273 Len=0"
"351","3.928877","23.39.213.4","192.168.1.166","TCP","54","443  >  51520 [ACK] Seq=240005 Ack=305281 Win=12267 Len=0"
"352","3.928877","23.39.213.4","192.168.1.166","TCP","54","443  >  51520 [ACK] Seq=240005 Ack=309661 Win=12244 Len=0"
"353","3.928877","23.39.213.4","192.168.1.166","TCP","54","443  >  51520 [ACK] Seq=240005 Ack=311496 Win=12266 Len=0"
"354","3.931824","23.39.213.4","192.168.1.166","TCP","54","443  >  51520 [ACK] Seq=240005 Ack=314416 Win=12273 Len=0"
"355","3.931824","23.39.213.4","192.168.1.166","TCP","54","443  >  51520 [ACK] Seq=240005 Ack=319272 Win=12251 Len=0"
"356","3.943535","192.168.1.166","23.39.213.4","TCP","54","51520  >  443 [ACK] Seq=319272 Ack=240005 Win=2047 Len=0"
"357","3.993112","23.39.213.4","192.168.1.166","TLSv1.2","958","Application Data"
"358","3.993112","23.39.213.4","192.168.1.166","TLSv1.2","174","Application Data"
"359","3.993145","192.168.1.166","23.39.213.4","TCP","54","51520  >  443 [ACK] Seq=319272 Ack=241029 Win=2043 Len=0"
"360","4.017764","23.39.213.4","192.168.1.166","TLSv1.2","361","Application Data"
"361","4.017764","23.39.213.4","192.168.1.166","TLSv1.2","289","Application Data"
"362","4.017788","192.168.1.166","23.39.213.4","TCP","54","51520  >  443 [ACK] Seq=319272 Ack=241571 Win=2047 Len=0"
"363","4.021183","23.39.213.4","192.168.1.166","TLSv1.2","361","Application Data"
"364","4.021183","23.39.213.4","192.168.1.166","TLSv1.2","85","Application Data"
"365","4.021199","192.168.1.166","23.39.213.4","TCP","54","51520  >  443 [ACK] Seq=319272 Ack=241909 Win=2046 Len=0"
"366","4.035756","23.39.213.4","192.168.1.166","TLSv1.2","438","Application Data"
"367","4.035756","23.39.213.4","192.168.1.166","TLSv1.2","727","Application Data"
"368","4.035773","192.168.1.166","23.39.213.4","TCP","54","51520  >  443 [ACK] Seq=319272 Ack=242966 Win=2042 Len=0"
"369","4.049756","23.39.213.4","192.168.1.166","TLSv1.2","957","Application Data"
"370","4.049756","23.39.213.4","192.168.1.166","TLSv1.2","1513","Application Data"
"371","4.049756","23.39.213.4","192.168.1.166","TLSv1.2","1081","Application Data"
"372","4.049779","192.168.1.166","23.39.213.4","TCP","54","51520  >  443 [ACK] Seq=319272 Ack=246355 Win=2047 Len=0"
"373","4.052687","192.168.1.166","23.39.213.4","TLSv1.2","5589","Application Data"
"374","4.052730","192.168.1.166","23.39.213.4","TLSv1.2","576","Application Data"
"375","4.134561","23.39.213.4","192.168.1.166","TCP","54","443  >  51520 [ACK] Seq=246355 Ack=322192 Win=12262 Len=0"
"376","4.134561","23.39.213.4","192.168.1.166","TCP","54","443  >  51520 [ACK] Seq=246355 Ack=324807 Win=12263 Len=0"
"377","4.134561","23.39.213.4","192.168.1.166","TCP","54","443  >  51520 [ACK] Seq=246355 Ack=325329 Win=12273 Len=0"
"378","4.166234","23.39.213.4","192.168.1.166","TLSv1.2","955","Application Data"
"379","4.166234","23.39.213.4","192.168.1.166","TLSv1.2","1510","Application Data"
"380","4.166234","23.39.213.4","192.168.1.166","TCP","1514","443  >  51520 [ACK] Seq=248712 Ack=325329 Win=12273 Len=1460 [TCP PDU reassembled in 384]"
"381","4.166234","23.39.213.4","192.168.1.166","TCP","1514","443  >  51520 [ACK] Seq=250172 Ack=325329 Win=12273 Len=1460 [TCP PDU reassembled in 384]"
"382","4.166234","23.39.213.4","192.168.1.166","TCP","5894","443  >  51520 [ACK] Seq=251632 Ack=325329 Win=12273 Len=5840 [TCP PDU reassembled in 384]"
"383","4.166234","23.39.213.4","192.168.1.166","TCP","1514","443  >  51520 [ACK] Seq=257472 Ack=325329 Win=12273 Len=1460 [TCP PDU reassembled in 384]"
"384","4.166234","23.39.213.4","192.168.1.166","TLSv1.2","1258","Application Data"
"385","4.166274","192.168.1.166","23.39.213.4","TCP","54","51520  >  443 [ACK] Seq=325329 Ack=260136 Win=2047 Len=0"
"386","4.168469","192.168.1.166","23.39.213.4","TLSv1.2","5449","Application Data"
"387","4.168506","192.168.1.166","23.39.213.4","TLSv1.2","829","Application Data"
"388","4.181771","192.168.1.166","23.39.213.4","TLSv1.2","5586","Application Data"
"389","4.181814","192.168.1.166","23.39.213.4","TLSv1.2","2296","Application Data"
"390","4.200373","23.39.213.4","192.168.1.166","TLSv1.2","960","Application Data"
"391","4.200373","23.39.213.4","192.168.1.166","TLSv1.2","352","Application Data"
"392","4.200398","192.168.1.166","23.39.213.4","TCP","54","51520  >  443 [ACK] Seq=339273 Ack=261340 Win=2043 Len=0"
"393","4.201125","23.39.213.4","192.168.1.166","TCP","54","443  >  51520 [ACK] Seq=261340 Ack=331499 Win=12252 Len=0"
"394","4.206059","192.168.1.166","23.39.213.4","TLSv1.2","5591","Application Data"
"395","4.206103","192.168.1.166","23.39.213.4","TLSv1.2","725","Application Data"
"396","4.210205","192.168.1.166","23.39.213.4","TLSv1.2","5591","Application Data"
"397","4.210249","192.168.1.166","23.39.213.4","TLSv1.2","725","Application Data"
"398","4.212844","192.168.1.166","23.39.213.4","TLSv1.2","5591","Application Data"
"399","4.212878","192.168.1.166","23.39.213.4","TLSv1.2","725","Application Data"
"400","4.215164","192.168.1.166","23.39.213.4","TLSv1.2","5591","Application Data"
"401","4.215200","192.168.1.166","23.39.213.4","TLSv1.2","725","Application Data"
"402","4.215294","23.39.213.4","192.168.1.166","TCP","54","443  >  51520 [ACK] Seq=261340 Ack=334419 Win=12262 Len=0"
"403","4.215294","23.39.213.4","192.168.1.166","TCP","54","443  >  51520 [ACK] Seq=261340 Ack=337031 Win=12263 Len=0"
"404","4.215294","23.39.213.4","192.168.1.166","TCP","54","443  >  51520 [ACK] Seq=261340 Ack=339273 Win=12251 Len=0"
"405","4.217909","192.168.1.166","23.39.213.4","TLSv1.2","5591","Application Data"
"406","4.217947","192.168.1.166","23.39.213.4","TLSv1.2","725","Application Data"
"407","4.220158","192.168.1.166","23.39.213.4","TLSv1.2","5591","Application Data"
"408","4.220189","192.168.1.166","23.39.213.4","TLSv1.2","725","Application Data"
"409","4.222353","192.168.1.166","23.39.213.4","TLSv1.2","5591","Application Data"
"410","4.222386","192.168.1.166","23.39.213.4","TLSv1.2","725","Application Data"
"411","4.224830","192.168.1.166","23.39.213.4","TLSv1.2","5591","Application Data"
"412","4.224871","192.168.1.166","23.39.213.4","TLSv1.2","725","Application Data"
"413","4.226782","192.168.1.166","23.39.213.4","TLSv1.2","5591","Application Data"
"414","4.226813","192.168.1.166","23.39.213.4","TLSv1.2","725","Application Data"
"415","4.229555","192.168.1.166","23.39.213.4","TLSv1.2","5481","Application Data"
"416","4.229594","192.168.1.166","23.39.213.4","TLSv1.2","2305","Application Data"
"417","4.231818","192.168.1.166","23.39.213.4","TLSv1.2","5591","Application Data"
"418","4.231854","192.168.1.166","23.39.213.4","TLSv1.2","725","Application Data"
"419","4.234041","192.168.1.166","23.39.213.4","TLSv1.2","5591","Application Data"
"420","4.234083","192.168.1.166","23.39.213.4","TLSv1.2","725","Application Data"
"421","4.250525","192.168.1.166","23.39.213.4","TLSv1.2","5458","Application Data"
"422","4.250567","192.168.1.166","23.39.213.4","TLSv1.2","551","Application Data"
"423","4.279292","23.39.213.4","192.168.1.166","TCP","54","443  >  51520 [ACK] Seq=261340 Ack=345481 Win=12244 Len=0"
"424","4.279292","23.39.213.4","192.168.1.166","TCP","54","443  >  51520 [ACK] Seq=261340 Ack=348401 Win=12270 Len=0"
"425","4.279292","23.39.213.4","192.168.1.166","TCP","54","443  >  51520 [ACK] Seq=261340 Ack=351689 Win=12259 Len=0"
"426","4.279292","23.39.213.4","192.168.1.166","TCP","54","443  >  51520 [ACK] Seq=261340 Ack=354609 Win=12270 Len=0"
"427","4.279292","23.39.213.4","192.168.1.166","TCP","54","443  >  51520 [ACK] Seq=261340 Ack=357226 Win=12273 Len=0"
"428","4.279292","23.39.213.4","192.168.1.166","TCP","54","443  >  51520 [ACK] Seq=261340 Ack=357897 Win=12273 Len=0"
"429","4.279292","23.39.213.4","192.168.1.166","TCP","54","443  >  51520 [ACK] Seq=261340 Ack=360817 Win=12273 Len=0"
"430","4.279292","23.39.213.4","192.168.1.166","TCP","54","443  >  51520 [ACK] Seq=261340 Ack=364105 Win=12259 Len=0"
"431","4.279292","23.39.213.4","192.168.1.166","TCP","54","443  >  51520 [ACK] Seq=261340 Ack=368485 Win=12262 Len=0"
"432","4.279292","23.39.213.4","192.168.1.166","TCP","54","443  >  51520 [ACK] Seq=261340 Ack=370313 Win=12266 Len=0"
"433","4.279292","23.39.213.4","192.168.1.166","TCP","54","443  >  51520 [ACK] Seq=261340 Ack=373233 Win=12270 Len=0"
"434","4.279292","23.39.213.4","192.168.1.166","TCP","54","443  >  51520 [ACK] Seq=261340 Ack=376521 Win=12259 Len=0"
"435","4.279292","23.39.213.4","192.168.1.166","TCP","54","443  >  51520 [ACK] Seq=261340 Ack=382729 Win=12244 Len=0"
"436","4.279292","23.39.213.4","192.168.1.166","TCP","54","443  >  51520 [ACK] Seq=261340 Ack=385649 Win=12270 Len=0"
"437","4.279292","23.39.213.4","192.168.1.166","TCP","54","443  >  51520 [ACK] Seq=261340 Ack=388937 Win=12259 Len=0"
"438","4.279292","23.39.213.4","192.168.1.166","TLSv1.2","438","Application Data"
"439","4.279292","23.39.213.4","192.168.1.166","TLSv1.2","718","Application Data"
"440","4.279361","192.168.1.166","23.39.213.4","TCP","54","51520  >  443 [ACK] Seq=421140 Ack=262388 Win=2047 Len=0"
"441","4.310738","23.39.213.4","192.168.1.166","TCP","54","443  >  51520 [ACK] Seq=262388 Ack=391857 Win=12251 Len=0"
"442","4.310738","23.39.213.4","192.168.1.166","TCP","54","443  >  51520 [ACK] Seq=262388 Ack=396605 Win=12228 Len=0"
"443","4.310738","23.39.213.4","192.168.1.166","TCP","54","443  >  51520 [ACK] Seq=262388 Ack=399525 Win=12221 Len=0"
"444","4.310738","23.39.213.4","192.168.1.166","TCP","54","443  >  51520 [ACK] Seq=262388 Ack=402032 Win=12264 Len=0"
"445","4.310738","23.39.213.4","192.168.1.166","TCP","54","443  >  51520 [ACK] Seq=262388 Ack=404283 Win=12251 Len=0"
"446","4.312985","23.39.213.4","192.168.1.166","TCP","54","443  >  51520 [ACK] Seq=262388 Ack=408360 Win=12263 Len=0"
"447","4.312985","23.39.213.4","192.168.1.166","TCP","54","443  >  51520 [ACK] Seq=262388 Ack=410491 Win=12265 Len=0"
"448","4.312985","23.39.213.4","192.168.1.166","TCP","54","443  >  51520 [ACK] Seq=262388 Ack=413411 Win=12250 Len=0"
"449","4.312985","23.39.213.4","192.168.1.166","TCP","54","443  >  51520 [ACK] Seq=262388 Ack=415239 Win=12239 Len=0"
"450","4.312985","23.39.213.4","192.168.1.166","TCP","54","443  >  51520 [ACK] Seq=262388 Ack=418159 Win=12224 Len=0"
"451","4.315055","23.39.213.4","192.168.1.166","TCP","54","443  >  51520 [ACK] Seq=262388 Ack=420643 Win=12271 Len=0"
"452","4.315055","23.39.213.4","192.168.1.166","TCP","54","443  >  51520 [ACK] Seq=262388 Ack=421140 Win=12273 Len=0"
"453","4.343421","23.39.213.4","192.168.1.166","TLSv1.2","953","Application Data"
"454","4.343421","23.39.213.4","192.168.1.166","TLSv1.2","352","Application Data"
"455","4.343440","192.168.1.166","23.39.213.4","TCP","54","51520  >  443 [ACK] Seq=421140 Ack=263585 Win=2043 Len=0"
"456","4.349393","23.39.213.4","192.168.1.166","TLSv1.2","950","Application Data"
"457","4.349393","23.39.213.4","192.168.1.166","TLSv1.2","294","Application Data"
"458","4.349415","192.168.1.166","23.39.213.4","TCP","54","51520  >  443 [ACK] Seq=421140 Ack=264721 Win=2047 Len=0"
"459","4.349505","192.168.1.166","23.39.213.4","TLSv1.2","5449","Application Data"
"460","4.349537","192.168.1.166","23.39.213.4","TLSv1.2","862","Application Data"
"461","4.350449","23.39.213.4","192.168.1.166","TLSv1.2","958","Application Data"
"462","4.350449","23.39.213.4","192.168.1.166","TLSv1.2","379","Application Data"
"463","4.350463","192.168.1.166","23.39.213.4","TCP","54","51520  >  443 [ACK] Seq=427343 Ack=265950 Win=2043 Len=0"
"464","4.351564","23.39.213.4","192.168.1.166","TLSv1.2","949","Application Data"
"465","4.351575","192.168.1.166","23.39.213.4","TCP","54","51520  >  443 [ACK] Seq=427343 Ack=266845 Win=2047 Len=0"
"466","4.352618","23.39.213.4","192.168.1.166","TLSv1.2","344","Application Data"
"467","4.352618","23.39.213.4","192.168.1.166","TLSv1.2","955","Application Data"
"468","4.352618","23.39.213.4","192.168.1.166","TLSv1.2","404","Application Data"
"469","4.352638","192.168.1.166","23.39.213.4","TCP","54","51520  >  443 [ACK] Seq=427343 Ack=268386 Win=2047 Len=0"
"470","4.357439","23.39.213.4","192.168.1.166","TLSv1.2","954","Application Data"
"471","4.357439","23.39.213.4","192.168.1.166","TLSv1.2","327","Application Data"
"472","4.357467","192.168.1.166","23.39.213.4","TCP","54","51520  >  443 [ACK] Seq=427343 Ack=269559 Win=2043 Len=0"
"473","4.366784","23.39.213.4","192.168.1.166","TLSv1.2","952","Application Data"
"474","4.366784","23.39.213.4","192.168.1.166","TLSv1.2","355","Application Data"
"475","4.366812","192.168.1.166","23.39.213.4","TCP","54","51520  >  443 [ACK] Seq=427343 Ack=270758 Win=2047 Len=0"
"476","4.421552","23.39.213.4","192.168.1.166","TLSv1.2","355","Application Data"
"477","4.421552","23.39.213.4","192.168.1.166","TLSv1.2","121","Application Data"
"478","4.421552","23.39.213.4","192.168.1.166","TCP","54","443  >  51520 [ACK] Seq=271126 Ack=425520 Win=12255 Len=0"
"479","4.421552","23.39.213.4","192.168.1.166","TCP","54","443  >  51520 [ACK] Seq=271126 Ack=427343 Win=12266 Len=0"
"480","4.421552","23.39.213.4","192.168.1.166","TLSv1.2","955","Application Data"
"481","4.421552","23.39.213.4","192.168.1.166","TLSv1.2","325","Application Data"
"482","4.421597","192.168.1.166","23.39.213.4","TCP","54","51520  >  443 [ACK] Seq=427343 Ack=272298 Win=2047 Len=0"
"483","4.425444","23.39.213.4","192.168.1.166","TLSv1.2","959","Application Data"
"484","4.425444","23.39.213.4","192.168.1.166","TLSv1.2","1514","Application Data"
"485","4.425470","192.168.1.166","23.39.213.4","TCP","54","51520  >  443 [ACK] Seq=427343 Ack=274663 Win=2047 Len=0"
"486","4.443730","23.39.213.4","192.168.1.166","TCP","11734","443  >  51520 [PSH, ACK] Seq=274663 Ack=427343 Win=12273 Len=11680 [TCP PDU reassembled in 487]"
"487","4.443730","23.39.213.4","192.168.1.166","TLSv1.2","494","Application Data"
"488","4.443765","192.168.1.166","23.39.213.4","TCP","54","51520  >  443 [ACK] Seq=427343 Ack=286783 Win=2047 Len=0"
"489","4.446526","192.168.1.166","23.39.213.4","TLSv1.2","5590","Application Data"
"490","4.446566","192.168.1.166","23.39.213.4","TLSv1.2","2070","Application Data"
"491","4.449687","23.39.213.4","192.168.1.166","TLSv1.2","951","Application Data"
"492","4.449687","23.39.213.4","192.168.1.166","TLSv1.2","355","Application Data"
"493","4.449711","192.168.1.166","23.39.213.4","TCP","54","51520  >  443 [ACK] Seq=434895 Ack=287981 Win=2043 Len=0"
"494","4.456956","23.39.213.4","192.168.1.166","TLSv1.2","374","Application Data"
"495","4.456956","23.39.213.4","192.168.1.166","TLSv1.2","85","Application Data"
"496","4.456975","192.168.1.166","23.39.213.4","TCP","54","51520  >  443 [ACK] Seq=434895 Ack=288332 Win=2047 Len=0"
"497","4.480060","23.39.213.4","192.168.1.166","TCP","54","443  >  51520 [ACK] Seq=288332 Ack=432879 Win=12273 Len=0"
"498","4.480060","23.39.213.4","192.168.1.166","TCP","54","443  >  51520 [ACK] Seq=288332 Ack=434895 Win=12266 Len=0"
"499","4.509019","23.39.213.4","192.168.1.166","TLSv1.2","438","Application Data"
"500","4.509019","23.39.213.4","192.168.1.166","TLSv1.2","722","Application Data"
"501","4.509038","192.168.1.166","23.39.213.4","TCP","54","51520  >  443 [ACK] Seq=434895 Ack=289384 Win=2043 Len=0"
"502","4.599110","23.39.213.4","192.168.1.166","TLSv1.2","952","Application Data"
"503","4.599110","23.39.213.4","192.168.1.166","TLSv1.2","415","Application Data"
"504","4.599142","192.168.1.166","23.39.213.4","TCP","54","51520  >  443 [ACK] Seq=434895 Ack=290643 Win=2047 Len=0"
"505","4.620590","23.39.213.4","192.168.1.166","TLSv1.2","955","Application Data"
"506","4.620590","23.39.213.4","192.168.1.166","TLSv1.2","358","Application Data"
"507","4.620616","192.168.1.166","23.39.213.4","TCP","54","51520  >  443 [ACK] Seq=434895 Ack=291848 Win=2043 Len=0"
"508","4.672177","23.39.213.4","192.168.1.166","TLSv1.2","958","Application Data"
"509","4.672177","23.39.213.4","192.168.1.166","TLSv1.2","1511","Application Data"
"510","4.672177","23.39.213.4","192.168.1.166","TCP","4434","443  >  51520 [ACK] Seq=294209 Ack=434895 Win=12273 Len=4380 [TCP PDU reassembled in 511]"
"511","4.672177","23.39.213.4","192.168.1.166","TLSv1.2","1194","Application Data"
"512","4.672214","192.168.1.166","23.39.213.4","TCP","54","51520  >  443 [ACK] Seq=434895 Ack=299729 Win=2047 Len=0"
"513","4.691903","192.168.1.166","23.39.213.4","TLSv1.2","5453","Application Data"
"514","4.692021","192.168.1.166","23.39.213.4","TLSv1.2","5455","Application Data"
"515","4.692052","192.168.1.166","23.39.213.4","TLSv1.2","763","Application Data"
"516","4.692077","192.168.1.166","23.39.213.4","TLSv1.2","1643","Application Data"
"517","4.696068","192.168.1.166","23.39.213.4","TLSv1.2","5590","Application Data"
"518","4.696114","192.168.1.166","23.39.213.4","TLSv1.2","772","Application Data"
"519","4.725305","23.39.213.4","192.168.1.166","TCP","54","443  >  51520 [ACK] Seq=299729 Ack=439275 Win=12255 Len=0"
"520","4.725305","23.39.213.4","192.168.1.166","TCP","54","443  >  51520 [ACK] Seq=299729 Ack=441754 Win=12264 Len=0"
"521","4.725305","23.39.213.4","192.168.1.166","TCP","54","443  >  51520 [ACK] Seq=299729 Ack=447993 Win=12242 Len=0"
"522","4.730122","23.39.213.4","192.168.1.166","TCP","54","443  >  51520 [ACK] Seq=299729 Ack=452373 Win=12262 Len=0"
"523","4.730122","23.39.213.4","192.168.1.166","TCP","54","443  >  51520 [ACK] Seq=299729 Ack=454247 Win=12266 Len=0"
"524","4.760731","192.168.1.166","23.39.213.4","TLSv1.2","5456","Application Data"
"525","4.760797","192.168.1.166","23.39.213.4","TLSv1.2","265","Application Data"
"526","4.761074","192.168.1.166","23.39.213.4","TLSv1.2","5456","Application Data"
"527","4.761107","192.168.1.166","23.39.213.4","TLSv1.2","312","Application Data"
"528","4.799736","23.39.213.4","192.168.1.166","TCP","54","443  >  51520 [ACK] Seq=299729 Ack=465520 Win=12215 Len=0"
"529","4.800290","23.39.213.4","192.168.1.166","TLSv1.2","438","Application Data"
"530","4.800290","23.39.213.4","192.168.1.166","TLSv1.2","692","Application Data"
"531","4.800313","192.168.1.166","23.39.213.4","TCP","54","51520  >  443 [ACK] Seq=465520 Ack=300751 Win=2043 Len=0"
"532","4.833477","23.39.213.4","192.168.1.166","TLSv1.2","438","Application Data"
"533","4.833477","23.39.213.4","192.168.1.166","TLSv1.2","867","Application Data"
"534","4.833509","192.168.1.166","23.39.213.4","TCP","54","51520  >  443 [ACK] Seq=465520 Ack=301948 Win=2047 Len=0"
"535","4.863528","23.39.213.4","192.168.1.166","TLSv1.2","355","Application Data"
"536","4.863528","23.39.213.4","192.168.1.166","TLSv1.2","121","Application Data"
"537","4.863528","23.39.213.4","192.168.1.166","TLSv1.2","355","Application Data"
"538","4.863528","23.39.213.4","192.168.1.166","TLSv1.2","121","Application Data"
"539","4.863548","192.168.1.166","23.39.213.4","TCP","54","51520  >  443 [ACK] Seq=465520 Ack=302684 Win=2045 Len=0"
"540","4.872266","23.39.213.4","192.168.1.166","TLSv1.2","955","Application Data"
"541","4.872266","23.39.213.4","192.168.1.166","TLSv1.2","321","Application Data"
"542","4.872286","192.168.1.166","23.39.213.4","TCP","54","51520  >  443 [ACK] Seq=465520 Ack=303852 Win=2047 Len=0"
"543","4.879197","192.168.1.166","23.39.213.4","TLSv1.2","5586","Application Data"
"544","4.879235","192.168.1.166","23.39.213.4","TLSv1.2","1704","Application Data"
"545","4.899946","192.168.1.166","23.39.213.4","TLSv1.2","571","Application Data"
"546","4.912266","23.39.213.4","192.168.1.166","TCP","54","443  >  51520 [ACK] Seq=303852 Ack=468440 Win=12262 Len=0"
"547","4.912266","23.39.213.4","192.168.1.166","TCP","54","443  >  51520 [ACK] Seq=303852 Ack=471052 Win=12263 Len=0"
"548","4.912266","23.39.213.4","192.168.1.166","TCP","54","443  >  51520 [ACK] Seq=303852 Ack=472702 Win=12253 Len=0"
"549","4.945718","23.39.213.4","192.168.1.166","TLSv1.2","317","Application Data"
"550","4.945718","23.39.213.4","192.168.1.166","TLSv1.2","1481","Application Data"
"551","4.945718","23.39.213.4","192.168.1.166","TLSv1.2","193","Application Data"
"552","4.945749","192.168.1.166","23.39.213.4","TCP","54","51520  >  443 [ACK] Seq=473219 Ack=305681 Win=2047 Len=0"
"553","5.051533","23.39.213.4","192.168.1.166","TLSv1.2","958","Application Data"
"554","5.051533","23.39.213.4","192.168.1.166","TLSv1.2","1513","Application Data"
"555","5.051533","23.39.213.4","192.168.1.166","TLSv1.2","1264","Application Data"
"556","5.051563","192.168.1.166","23.39.213.4","TCP","54","51520  >  443 [ACK] Seq=473219 Ack=309254 Win=2047 Len=0"
