"No.","Time","Source","Destination","Protocol","Length","Info"
"1","0.000000","192.168.1.166","23.198.241.2","TLSv1.2","5883","Application Data"
"2","0.000077","192.168.1.166","23.198.241.2","TLSv1.2","538","Application Data"
"3","0.027218","23.198.241.2","192.168.1.166","TCP","54","443  >  58685 [ACK] Seq=1 Ack=2921 Win=14805 Len=0"
"4","0.027218","23.198.241.2","192.168.1.166","TCP","54","443  >  58685 [ACK] Seq=1 Ack=5830 Win=14805 Len=0"
"5","0.027218","23.198.241.2","192.168.1.166","TCP","54","443  >  58685 [ACK] Seq=1 Ack=6314 Win=14802 Len=0"
"6","0.103580","23.198.241.2","192.168.1.166","TLSv1.2","492","Application Data"
"7","0.103580","23.198.241.2","192.168.1.166","TLSv1.2","120","Application Data"
"8","0.103615","192.168.1.166","23.198.241.2","TCP","54","58685  >  443 [ACK] Seq=6314 Ack=505 Win=8189 Len=0"
"9","1.682177","192.168.1.166","23.198.241.2","TLSv1.2","6007","Application Data"
"10","1.710556","23.198.241.2","192.168.1.166","TCP","54","443  >  58685 [ACK] Seq=505 Ack=7774 Win=14812 Len=0"
"11","1.710556","23.198.241.2","192.168.1.166","TCP","54","443  >  58685 [ACK] Seq=505 Ack=9234 Win=14812 Len=0"
"12","1.710556","23.198.241.2","192.168.1.166","TCP","54","443  >  58685 [ACK] Seq=505 Ack=10694 Win=14812 Len=0"
"13","1.710556","23.198.241.2","192.168.1.166","TCP","54","443  >  58685 [ACK] Seq=505 Ack=12154 Win=14812 Len=0"
"14","1.710556","23.198.241.2","192.168.1.166","TCP","54","443  >  58685 [ACK] Seq=505 Ack=12267 Win=14815 Len=0"
"15","2.222612","23.198.241.2","192.168.1.166","TLSv1.2","1476","Application Data"
"16","2.222612","23.198.241.2","192.168.1.166","TCP","16114","443  >  58685 [ACK] Seq=1927 Ack=12267 Win=14815 Len=16060 [TCP PDU reassembled in 17]"
"17","2.222612","23.198.241.2","192.168.1.166","TLSv1.2","400","Application Data"
"18","2.222612","23.198.241.2","192.168.1.166","TLSv1.2","16114","Application Data"
"19","2.222612","23.198.241.2","192.168.1.166","TLSv1.2","431","Application Data"
"20","2.222612","23.198.241.2","192.168.1.166","TLSv1.2","7354","Application Data"
"21","2.222612","23.198.241.2","192.168.1.166","TLSv1.2","1211","Application Data"
"22","2.222612","23.198.241.2","192.168.1.166","TCP","8814","443  >  58685 [ACK] Seq=43227 Ack=12267 Win=14815 Len=8760 [TCP PDU reassembled in 23]"
"23","2.222612","23.198.241.2","192.168.1.166","TLSv1.2","111","Application Data"
"24","2.222612","23.198.241.2","192.168.1.166","TCP","2974","443  >  58685 [ACK] Seq=52044 Ack=12267 Win=14815 Len=2920 [TCP PDU reassembled in 25]"
"25","2.222612","23.198.241.2","192.168.1.166","TLSv1.2","729","Application Data"
"26","2.222612","23.198.241.2","192.168.1.166","TLSv1.2","93","Application Data"
"27","2.222612","23.198.241.2","192.168.1.166","TLSv1.2","85","Application Data"
"28","2.222691","192.168.1.166","23.198.241.2","TCP","54","58685  >  443 [ACK] Seq=12267 Ack=55709 Win=8191 Len=0"
"29","2.230060","192.168.1.166","23.198.241.2","TLSv1.2","6259","Application Data"
"30","2.230109","192.168.1.166","23.198.241.2","TLSv1.2","1644","Application Data"
"31","2.256848","23.198.241.2","192.168.1.166","TCP","54","443  >  58685 [ACK] Seq=55709 Ack=13727 Win=14812 Len=0"
"32","2.256848","23.198.241.2","192.168.1.166","TCP","54","443  >  58685 [ACK] Seq=55709 Ack=18472 Win=14794 Len=0"
"33","2.256848","23.198.241.2","192.168.1.166","TCP","54","443  >  58685 [ACK] Seq=55709 Ack=19932 Win=14812 Len=0"
"34","2.256848","23.198.241.2","192.168.1.166","TCP","54","443  >  58685 [ACK] Seq=55709 Ack=20062 Win=14815 Len=0"
"35","2.272150","192.168.1.166","23.198.241.2","TLSv1.2","5802","Application Data"
"36","2.272211","192.168.1.166","23.198.241.2","TLSv1.2","5820","Application Data"
"37","2.273748","192.168.1.166","23.198.241.2","TLSv1.2","5814","Application Data"
"38","2.273807","192.168.1.166","23.198.241.2","TLSv1.2","5810","Application Data"
"39","2.273852","192.168.1.166","23.198.241.2","TLSv1.2","5814","Application Data"
"40","2.273896","192.168.1.166","23.198.241.2","TLSv1.2","5812","Application Data"
"41","2.278514","192.168.1.166","23.198.241.2","TLSv1.2","5818","Application Data"
"42","2.291347","23.198.241.2","192.168.1.166","TLSv1.2","365","Application Data"
"43","2.291347","23.198.241.2","192.168.1.166","TLSv1.2","159","Application Data"
"44","2.291364","192.168.1.166","23.198.241.2","TCP","54","58685  >  443 [ACK] Seq=60374 Ack=56125 Win=8190 Len=0"
"45","2.299380","23.198.241.2","192.168.1.166","TCP","54","443  >  58685 [ACK] Seq=56125 Ack=22982 Win=14805 Len=0"
"46","2.299380","23.198.241.2","192.168.1.166","TCP","54","443  >  58685 [ACK] Seq=56125 Ack=25810 Win=14805 Len=0"
"47","2.299380","23.198.241.2","192.168.1.166","TCP","54","443  >  58685 [ACK] Seq=56125 Ack=31576 Win=14790 Len=0"
"48","2.301054","23.198.241.2","192.168.1.166","TCP","54","443  >  58685 [ACK] Seq=56125 Ack=34496 Win=14805 Len=0"
"49","2.328645","23.198.241.2","192.168.1.166","TLSv1.2","371","Application Data"
"50","2.328645","23.198.241.2","192.168.1.166","TCP","1514","443  >  58685 [ACK] Seq=56442 Ack=60374 Win=14670 Len=1460 [TCP PDU reassembled in 52]"
"51","2.328645","23.198.241.2","192.168.1.166","TCP","1514","443  >  58685 [ACK] Seq=57902 Ack=60374 Win=14670 Len=1460 [TCP PDU reassembled in 52]"
"52","2.328645","23.198.241.2","192.168.1.166","TLSv1.2","146","Application Data"
"53","2.328645","23.198.241.2","192.168.1.166","TLSv1.2","956","Application Data"
"54","2.328645","23.198.241.2","192.168.1.166","TLSv1.2","85","Application Data"
"55","2.328688","192.168.1.166","23.198.241.2","TCP","54","58685  >  443 [ACK] Seq=60374 Ack=60387 Win=8191 Len=0"
"56","2.336156","23.198.241.2","192.168.1.166","TLSv1.2","371","Application Data"
"57","2.336156","23.198.241.2","192.168.1.166","TLSv1.2","1329","Application Data"
"58","2.336156","23.198.241.2","192.168.1.166","TLSv1.2","282","Application Data"
"59","2.336156","23.198.241.2","192.168.1.166","TCP","16114","443  >  58685 [ACK] Seq=62207 Ack=60374 Win=14815 Len=16060 [TCP PDU reassembled in 60]"
"60","2.336156","23.198.241.2","192.168.1.166","TLSv1.2","400","Application Data"
"61","2.336156","23.198.241.2","192.168.1.166","TLSv1.2","16114","Application Data"
"62","2.336156","23.198.241.2","192.168.1.166","TLSv1.2","431","Application Data"
"63","2.336156","23.198.241.2","192.168.1.166","TLSv1.2","7354","Application Data"
"64","2.336156","23.198.241.2","192.168.1.166","TLSv1.2","927","Application Data"
"65","2.336156","23.198.241.2","192.168.1.166","TCP","2974","443  >  58685 [ACK] Seq=103223 Ack=60374 Win=14815 Len=2920 [TCP PDU reassembled in 66]"
"66","2.336156","23.198.241.2","192.168.1.166","TLSv1.2","1060","Application Data, Application Data"
"67","2.336156","23.198.241.2","192.168.1.166","TLSv1.2","1080","Application Data, Application Data"
"68","2.336205","192.168.1.166","23.198.241.2","TCP","54","58685  >  443 [ACK] Seq=60374 Ack=108175 Win=8191 Len=0"
"69","2.337453","23.198.241.2","192.168.1.166","TLSv1.2","356","Application Data"
"70","2.337453","23.198.241.2","192.168.1.166","TLSv1.2","474","Application Data"
"71","2.337453","23.198.241.2","192.168.1.166","TLSv1.2","1283","Application Data, Application Data"
"72","2.337473","192.168.1.166","23.198.241.2","TCP","54","58685  >  443 [ACK] Seq=60374 Ack=110126 Win=8191 Len=0"
"73","2.340318","192.168.1.166","23.198.241.2","TLSv1.2","5881","Application Data"
"74","2.350287","192.168.1.166","23.198.241.2","TLSv1.2","564","Application Data"
"75","2.350321","192.168.1.166","23.198.241.2","TLSv1.2","202","Application Data"
"76","2.350342","192.168.1.166","23.198.241.2","TLSv1.2","219","Application Data"
"77","2.351050","192.168.1.166","23.198.241.2","TLSv1.2","90","Application Data"
"78","2.351075","192.168.1.166","23.198.241.2","TLSv1.2","90","Application Data"
"79","2.351100","192.168.1.166","23.198.241.2","TLSv1.2","90","Application Data"
"80","2.351110","192.168.1.166","23.198.241.2","TLSv1.2","90","Application Data"
"81","2.351124","192.168.1.166","23.198.241.2","TLSv1.2","90","Application Data"
"82","2.374414","23.198.241.2","192.168.1.166","TCP","54","443  >  58685 [ACK] Seq=110126 Ack=64754 Win=14815 Len=0"
"83","2.377136","23.198.241.2","192.168.1.166","TCP","54","443  >  58685 [ACK] Seq=110126 Ack=66711 Win=14815 Len=0"
"84","2.381810","23.198.241.2","192.168.1.166","TLSv1.2","372","Application Data"
"85","2.381810","23.198.241.2","192.168.1.166","TLSv1.2","85","Application Data"
"86","2.381842","192.168.1.166","23.198.241.2","TCP","54","58685  >  443 [ACK] Seq=67204 Ack=110475 Win=8190 Len=0"
"87","2.389525","23.198.241.2","192.168.1.166","TLSv1.2","318","Application Data"
"88","2.389525","23.198.241.2","192.168.1.166","TCP","4434","443  >  58685 [ACK] Seq=110739 Ack=67204 Win=14815 Len=4380 [TCP PDU reassembled in 89]"
"89","2.389525","23.198.241.2","192.168.1.166","TLSv1.2","67","Application Data"
"90","2.389551","192.168.1.166","23.198.241.2","TCP","54","58685  >  443 [ACK] Seq=67204 Ack=115132 Win=8191 Len=0"
"91","2.394079","23.198.241.2","192.168.1.166","TLSv1.2","317","Application Data"
"92","2.394079","23.198.241.2","192.168.1.166","TCP","1514","443  >  58685 [ACK] Seq=115395 Ack=67204 Win=14815 Len=1460 [TCP PDU reassembled in 93]"
"93","2.394079","23.198.241.2","192.168.1.166","TLSv1.2","142","Application Data"
"94","2.394079","23.198.241.2","192.168.1.166","TCP","7354","443  >  58685 [ACK] Seq=116943 Ack=67204 Win=14815 Len=7300 [TCP PDU reassembled in 95]"
"95","2.394079","23.198.241.2","192.168.1.166","TLSv1.2","562","Application Data"
"96","2.394115","192.168.1.166","23.198.241.2","TCP","54","58685  >  443 [ACK] Seq=67204 Ack=124751 Win=8191 Len=0"
"97","2.436422","192.168.1.166","23.198.241.2","TLSv1.2","5578","Application Data"
"98","2.459820","192.168.1.166","23.198.241.2","TLSv1.2","5793","Application Data"
"99","2.459986","192.168.1.166","23.198.241.2","TLSv1.2","5783","Application Data"
"100","2.472293","23.198.241.2","192.168.1.166","TCP","54","443  >  58685 [ACK] Seq=124751 Ack=71584 Win=14815 Len=0"
"101","2.494463","192.168.1.166","23.198.241.2","TLSv1.2","5841","Application Data"
"102","2.494563","192.168.1.166","23.198.241.2","TLSv1.2","5843","Application Data"
"103","2.494581","192.168.1.166","23.198.241.2","TLSv1.2","734","Application Data"
"104","2.494595","192.168.1.166","23.198.241.2","TLSv1.2","817","Application Data"
"105","2.500221","23.198.241.2","192.168.1.166","TCP","54","443  >  58685 [ACK] Seq=124751 Ack=84196 Win=14761 Len=0"
"106","2.503527","192.168.1.166","23.198.241.2","TLSv1.2","5852","Application Data"
"107","2.503592","192.168.1.166","23.198.241.2","TLSv1.2","253","Application Data"
"108","2.512004","23.198.241.2","192.168.1.166","TLSv1.2","317","Application Data"
"109","2.512004","23.198.241.2","192.168.1.166","TCP","1514","443  >  58685 [ACK] Seq=125014 Ack=84196 Win=14815 Len=1460 [TCP PDU reassembled in 110]"
"110","2.512004","23.198.241.2","192.168.1.166","TLSv1.2","88","Application Data"
"111","2.512004","23.198.241.2","192.168.1.166","TLSv1.2","1514","Application Data"
"112","2.512004","23.198.241.2","192.168.1.166","TLSv1.2","978","Application Data"
"113","2.512004","23.198.241.2","192.168.1.166","TCP","7354","443  >  58685 [ACK] Seq=128892 Ack=84196 Win=14815 Len=7300 [TCP PDU reassembled in 114]"
"114","2.512004","23.198.241.2","192.168.1.166","TLSv1.2","850","Application Data"
"115","2.512004","23.198.241.2","192.168.1.166","TLSv1.2","383","Application Data"
"116","2.512004","23.198.241.2","192.168.1.166","TCP","1514","443  >  58685 [ACK] Seq=137317 Ack=84196 Win=14815 Len=1460 [TCP PDU reassembled in 117]"
"117","2.512004","23.198.241.2","192.168.1.166","TLSv1.2","787","Application Data"
"118","2.512062","192.168.1.166","23.198.241.2","TCP","54","58685  >  443 [ACK] Seq=103212 Ack=139510 Win=8191 Len=0"
"119","2.520901","23.198.241.2","192.168.1.166","TLSv1.2","490","Application Data"
"120","2.520901","23.198.241.2","192.168.1.166","TLSv1.2","604","Application Data"
"121","2.520939","192.168.1.166","23.198.241.2","TCP","54","58685  >  443 [ACK] Seq=103212 Ack=140496 Win=8188 Len=0"
"122","2.538558","192.168.1.166","23.198.241.2","TLSv1.2","5846","Application Data"
"123","2.540418","192.168.1.166","23.198.241.2","TLSv1.2","532","Application Data"
"124","2.553989","23.198.241.2","192.168.1.166","TCP","54","443  >  58685 [ACK] Seq=140496 Ack=91443 Win=14790 Len=0"
"125","2.553989","23.198.241.2","192.168.1.166","TCP","54","443  >  58685 [ACK] Seq=140496 Ack=94363 Win=14775 Len=0"
"126","2.553989","23.198.241.2","192.168.1.166","TCP","54","443  >  58685 [ACK] Seq=140496 Ack=96452 Win=14808 Len=0"
"127","2.553989","23.198.241.2","192.168.1.166","TCP","54","443  >  58685 [ACK] Seq=140496 Ack=98675 Win=14812 Len=0"
"128","2.553989","23.198.241.2","192.168.1.166","TCP","54","443  >  58685 [ACK] Seq=140496 Ack=103212 Win=14788 Len=0"
"129","2.579693","192.168.1.166","23.198.241.2","TLSv1.2","5526","Application Data"
"130","2.580396","192.168.1.166","23.198.241.2","TLSv1.2","5792","Application Data"
"131","2.580581","192.168.1.166","23.198.241.2","TLSv1.2","5793","Application Data"
"132","2.583613","23.198.241.2","192.168.1.166","TCP","54","443  >  58685 [ACK] Seq=140496 Ack=106132 Win=14812 Len=0"
"133","2.583613","23.198.241.2","192.168.1.166","TCP","54","443  >  58685 [ACK] Seq=140496 Ack=109004 Win=14813 Len=0"
"134","2.592282","23.198.241.2","192.168.1.166","TLSv1.2","326","Application Data"
"135","2.592282","23.198.241.2","192.168.1.166","TLSv1.2","676","Application Data"
"136","2.592313","192.168.1.166","23.198.241.2","TCP","54","58685  >  443 [ACK] Seq=126431 Ack=141390 Win=8191 Len=0"
"137","2.594440","23.198.241.2","192.168.1.166","TLSv1.2","954","Application Data"
"138","2.594440","23.198.241.2","192.168.1.166","TLSv1.2","85","Application Data"
"139","2.594465","192.168.1.166","23.198.241.2","TCP","54","58685  >  443 [ACK] Seq=126431 Ack=142321 Win=8188 Len=0"
"140","2.595066","23.198.241.2","192.168.1.166","TLSv1.2","528","Application Data"
"141","2.595066","23.198.241.2","192.168.1.166","TLSv1.2","696","Application Data"
"142","2.595082","192.168.1.166","23.198.241.2","TCP","54","58685  >  443 [ACK] Seq=126431 Ack=143437 Win=8191 Len=0"
"143","2.602117","23.198.241.2","192.168.1.166","TLSv1.2","531","Application Data"
"144","2.602117","23.198.241.2","192.168.1.166","TLSv1.2","710","Application Data"
"145","2.602205","192.168.1.166","23.198.241.2","TCP","54","58685  >  443 [ACK] Seq=126431 Ack=144570 Win=8187 Len=0"
"146","2.607131","23.198.241.2","192.168.1.166","TLSv1.2","493","Application Data"
"147","2.607131","23.198.241.2","192.168.1.166","TLSv1.2","174","Application Data"
"148","2.607160","192.168.1.166","23.198.241.2","TCP","54","58685  >  443 [ACK] Seq=126431 Ack=145129 Win=8191 Len=0"
"149","2.608921","23.198.241.2","192.168.1.166","TCP","54","443  >  58685 [ACK] Seq=145129 Ack=112402 Win=14815 Len=0"
"150","2.608921","23.198.241.2","192.168.1.166","TCP","54","443  >  58685 [ACK] Seq=145129 Ack=116414 Win=14806 Len=0"
"151","2.629924","23.198.241.2","192.168.1.166","TLSv1.2","383","Application Data"
"152","2.629924","23.198.241.2","192.168.1.166","TCP","5894","443  >  58685 [ACK] Seq=145458 Ack=126431 Win=14768 Len=5840 [TCP PDU reassembled in 153]"
"153","2.629924","23.198.241.2","192.168.1.166","TLSv1.2","313","Application Data"
"154","2.629958","192.168.1.166","23.198.241.2","TCP","54","58685  >  443 [ACK] Seq=126431 Ack=151557 Win=8191 Len=0"
"155","2.640981","23.198.241.2","192.168.1.166","TLSv1.2","384","Application Data"
"156","2.640981","23.198.241.2","192.168.1.166","TCP","10274","443  >  58685 [ACK] Seq=151887 Ack=126431 Win=14815 Len=10220 [TCP PDU reassembled in 157]"
"157","2.640981","23.198.241.2","192.168.1.166","TLSv1.2","908","Application Data"
"158","2.641022","192.168.1.166","23.198.241.2","TCP","54","58685  >  443 [ACK] Seq=126431 Ack=162961 Win=8191 Len=0"
"159","2.643325","23.198.241.2","192.168.1.166","TLSv1.2","383","Application Data"
"160","2.643325","23.198.241.2","192.168.1.166","TCP","16114","443  >  58685 [ACK] Seq=163290 Ack=126431 Win=14815 Len=16060 [TCP PDU reassembled in 161]"
"161","2.643325","23.198.241.2","192.168.1.166","TLSv1.2","400","Application Data"
"162","2.643325","23.198.241.2","192.168.1.166","TLSv1.2","211","Application Data, Application Data"
"163","2.643359","192.168.1.166","23.198.241.2","TCP","54","58685  >  443 [ACK] Seq=126431 Ack=179853 Win=8191 Len=0"
"164","2.654616","192.168.1.166","23.198.241.2","TLSv1.2","5812","Application Data"
"165","2.654650","192.168.1.166","23.198.241.2","TLSv1.2","339","Application Data"
"166","2.671545","192.168.1.166","23.198.241.2","TLSv1.2","588","Application Data"
"167","2.671600","192.168.1.166","23.198.241.2","TLSv1.2","204","Application Data"
"168","2.671616","192.168.1.166","23.198.241.2","TLSv1.2","206","Application Data"
"169","2.671631","192.168.1.166","23.198.241.2","TLSv1.2","201","Application Data"
"170","2.671671","192.168.1.166","23.198.241.2","TLSv1.2","201","Application Data"
"171","2.671696","192.168.1.166","23.198.241.2","TLSv1.2","200","Application Data"
"172","2.681002","23.198.241.2","192.168.1.166","TCP","54","443  >  58685 [ACK] Seq=179853 Ack=130811 Win=14815 Len=0"
"173","2.681002","23.198.241.2","192.168.1.166","TCP","54","443  >  58685 [ACK] Seq=179853 Ack=132474 Win=14810 Len=0"
"174","2.707396","23.198.241.2","192.168.1.166","TCP","54","443  >  58685 [ACK] Seq=179853 Ack=133457 Win=14815 Len=0"
"175","2.712169","23.198.241.2","192.168.1.166","TCP","54","443  >  58685 [ACK] Seq=179853 Ack=133750 Win=14815 Len=0"
"176","2.720785","23.198.241.2","192.168.1.166","TLSv1.2","318","Application Data"
"177","2.720785","23.198.241.2","192.168.1.166","TCP","1514","443  >  58685 [ACK] Seq=180117 Ack=133750 Win=14815 Len=1460 [TCP PDU reassembled in 178]"
"178","2.720785","23.198.241.2","192.168.1.166","TLSv1.2","142","Application Data"
"179","2.720810","192.168.1.166","23.198.241.2","TCP","54","58685  >  443 [ACK] Seq=133750 Ack=181665 Win=8191 Len=0"
"180","2.721402","23.198.241.2","192.168.1.166","TCP","4434","443  >  58685 [ACK] Seq=181665 Ack=133750 Win=14815 Len=4380 [TCP PDU reassembled in 181]"
"181","2.721402","23.198.241.2","192.168.1.166","TLSv1.2","66","Application Data"
"182","2.721417","192.168.1.166","23.198.241.2","TCP","54","58685  >  443 [ACK] Seq=133750 Ack=186057 Win=8191 Len=0"
"183","2.726762","23.198.241.2","192.168.1.166","TLSv1.2","317","Application Data"
"184","2.726762","23.198.241.2","192.168.1.166","TCP","1514","443  >  58685 [ACK] Seq=186320 Ack=133750 Win=14815 Len=1460 [TCP PDU reassembled in 185]"
"185","2.726762","23.198.241.2","192.168.1.166","TLSv1.2","106","Application Data"
"186","2.726762","23.198.241.2","192.168.1.166","TLSv1.2","1514","Application Data"
"187","2.726762","23.198.241.2","192.168.1.166","TLSv1.2","325","Application Data"
"188","2.726762","23.198.241.2","192.168.1.166","TCP","4434","443  >  58685 [ACK] Seq=189563 Ack=133750 Win=14815 Len=4380 [TCP PDU reassembled in 189]"
"189","2.726762","23.198.241.2","192.168.1.166","TLSv1.2","1220","Application Data"
"190","2.726762","23.198.241.2","192.168.1.166","TCP","1514","443  >  58685 [ACK] Seq=195109 Ack=133750 Win=14815 Len=1460 [TCP PDU reassembled in 191]"
"191","2.726762","23.198.241.2","192.168.1.166","TLSv1.2","917","Application Data"
"192","2.726839","192.168.1.166","23.198.241.2","TCP","54","58685  >  443 [ACK] Seq=133750 Ack=197432 Win=8191 Len=0"
"193","2.759348","23.198.241.2","192.168.1.166","TLSv1.2","494","Application Data"
"194","2.759348","23.198.241.2","192.168.1.166","TLSv1.2","1506","Application Data"
"195","2.759348","23.198.241.2","192.168.1.166","TCP","8814","443  >  58685 [ACK] Seq=199324 Ack=133750 Win=14815 Len=8760 [TCP PDU reassembled in 196]"
"196","2.759348","23.198.241.2","192.168.1.166","TLSv1.2","257","Application Data"
"197","2.759372","192.168.1.166","23.198.241.2","TCP","54","58685  >  443 [ACK] Seq=133750 Ack=208287 Win=8191 Len=0"
"198","2.779777","192.168.1.166","23.198.241.2","TLSv1.2","90","Application Data"
"199","2.779803","192.168.1.166","23.198.241.2","TLSv1.2","90","Application Data"
"200","2.782312","23.198.241.2","192.168.1.166","TLSv1.2","317","Application Data"
"201","2.782312","23.198.241.2","192.168.1.166","TCP","1514","443  >  58685 [ACK] Seq=208550 Ack=133750 Win=14815 Len=1460 [TCP PDU reassembled in 202]"
"202","2.782312","23.198.241.2","192.168.1.166","TLSv1.2","88","Application Data"
"203","2.782312","23.198.241.2","192.168.1.166","TCP","1514","443  >  58685 [ACK] Seq=210044 Ack=133750 Win=14815 Len=1460 [TCP PDU reassembled in 204]"
"204","2.782312","23.198.241.2","192.168.1.166","TLSv1.2","224","Application Data"
"205","2.782331","192.168.1.166","23.198.241.2","TCP","54","58685  >  443 [ACK] Seq=133822 Ack=211674 Win=8191 Len=0"
"206","2.794108","192.168.1.166","23.198.241.2","TLSv1.2","5645","Application Data"
"207","2.806835","23.198.241.2","192.168.1.166","TCP","54","443  >  58685 [ACK] Seq=211674 Ack=133822 Win=14815 Len=0"
"208","2.821408","23.198.241.2","192.168.1.166","TCP","54","443  >  58685 [ACK] Seq=211674 Ack=136742 Win=14815 Len=0"
"209","2.821408","23.198.241.2","192.168.1.166","TCP","54","443  >  58685 [ACK] Seq=211674 Ack=139413 Win=14815 Len=0"
"210","2.840784","23.198.241.2","192.168.1.166","TLSv1.2","317","Application Data"
"211","2.840784","23.198.241.2","192.168.1.166","TCP","1514","443  >  58685 [ACK] Seq=211937 Ack=139413 Win=14815 Len=1460 [TCP PDU reassembled in 212]"
"212","2.840784","23.198.241.2","192.168.1.166","TLSv1.2","88","Application Data"
"213","2.840801","192.168.1.166","23.198.241.2","TCP","54","58685  >  443 [ACK] Seq=139413 Ack=213431 Win=8191 Len=0"
"214","2.841300","23.198.241.2","192.168.1.166","TCP","1514","443  >  58685 [ACK] Seq=213431 Ack=139413 Win=14815 Len=1460 [TCP PDU reassembled in 215]"
"215","2.841300","23.198.241.2","192.168.1.166","TLSv1.2","1510","Application Data"
"216","2.841300","23.198.241.2","192.168.1.166","TLSv1.2","317","Application Data"
"217","2.841300","23.198.241.2","192.168.1.166","TCP","1514","443  >  58685 [ACK] Seq=216610 Ack=139413 Win=14815 Len=1460 [TCP PDU reassembled in 218]"
"218","2.841300","23.198.241.2","192.168.1.166","TLSv1.2","87","Application Data"
"219","2.841315","192.168.1.166","23.198.241.2","TCP","54","58685  >  443 [ACK] Seq=139413 Ack=218103 Win=8191 Len=0"
"220","2.842197","23.198.241.2","192.168.1.166","TCP","1514","443  >  58685 [ACK] Seq=218103 Ack=139413 Win=14815 Len=1460 [TCP PDU reassembled in 221]"
"221","2.842197","23.198.241.2","192.168.1.166","TLSv1.2","715","Application Data"
"222","2.842212","192.168.1.166","23.198.241.2","TCP","54","58685  >  443 [ACK] Seq=139413 Ack=220224 Win=8191 Len=0"
"223","2.849464","23.198.241.2","192.168.1.166","TLSv1.2","348","Application Data"
"224","2.849464","23.198.241.2","192.168.1.166","TLSv1.2","312","Application Data"
"225","2.849479","192.168.1.166","23.198.241.2","TCP","54","58685  >  443 [ACK] Seq=139413 Ack=220776 Win=8189 Len=0"
"226","2.883866","192.168.1.166","23.198.241.2","TLSv1.2","5918","Application Data"
"227","2.912169","23.198.241.2","192.168.1.166","TCP","54","443  >  58685 [ACK] Seq=220776 Ack=143793 Win=14797 Len=0"
"228","2.912169","23.198.241.2","192.168.1.166","TCP","54","443  >  58685 [ACK] Seq=220776 Ack=145277 Win=14800 Len=0"
"229","2.959447","23.198.241.2","192.168.1.166","TLSv1.2","350","Application Data"
"230","2.959447","23.198.241.2","192.168.1.166","TLSv1.2","394","Application Data"
"231","2.959466","192.168.1.166","23.198.241.2","TCP","54","58685  >  443 [ACK] Seq=145277 Ack=221412 Win=8187 Len=0"
"232","2.968967","192.168.1.166","23.198.241.2","TLSv1.2","6063","Application Data"
"233","2.969028","192.168.1.166","23.198.241.2","TLSv1.2","3936","Application Data"
"234","2.975521","192.168.1.166","23.198.241.2","TLSv1.2","6063","Application Data"
"235","2.975563","192.168.1.166","23.198.241.2","TLSv1.2","3928","Application Data"
"236","2.983103","192.168.1.166","23.198.241.2","TLSv1.2","6064","Application Data"
"237","2.983166","192.168.1.166","23.198.241.2","TLSv1.2","2119","Application Data"
"238","2.985557","192.168.1.166","23.198.241.2","TLSv1.2","6064","Application Data"
"239","2.985593","192.168.1.166","23.198.241.2","TLSv1.2","2119","Application Data"
"240","2.995884","23.198.241.2","192.168.1.166","TCP","54","443  >  58685 [ACK] Seq=221412 Ack=151117 Win=14790 Len=0"
"241","2.995884","23.198.241.2","192.168.1.166","TCP","54","443  >  58685 [ACK] Seq=221412 Ack=152746 Win=14810 Len=0"
"242","3.019917","23.198.241.2","192.168.1.166","TCP","54","443  >  58685 [ACK] Seq=221412 Ack=155168 Win=14815 Len=0"
"243","3.019917","23.198.241.2","192.168.1.166","TCP","54","443  >  58685 [ACK] Seq=221412 Ack=158088 Win=14805 Len=0"
"244","3.019917","23.198.241.2","192.168.1.166","TCP","54","443  >  58685 [ACK] Seq=221412 Ack=161177 Win=14815 Len=0"
"245","3.019917","23.198.241.2","192.168.1.166","TCP","54","443  >  58685 [ACK] Seq=221412 Ack=166511 Win=14792 Len=0"
"246","3.019917","23.198.241.2","192.168.1.166","TCP","54","443  >  58685 [ACK] Seq=221412 Ack=171061 Win=14802 Len=0"
"247","3.019917","23.198.241.2","192.168.1.166","TCP","54","443  >  58685 [ACK] Seq=221412 Ack=173126 Win=14808 Len=0"
"248","3.019917","23.198.241.2","192.168.1.166","TCP","54","443  >  58685 [ACK] Seq=221412 Ack=181201 Win=14764 Len=0"
"249","3.029008","23.198.241.2","192.168.1.166","TLSv1.2","365","Application Data"
"250","3.029008","23.198.241.2","192.168.1.166","TLSv1.2","159","Application Data"
"251","3.029039","192.168.1.166","23.198.241.2","TCP","54","58685  >  443 [ACK] Seq=181201 Ack=221828 Win=8191 Len=0"
"252","3.053682","23.198.241.2","192.168.1.166","TLSv1.2","365","Application Data"
"253","3.053682","23.198.241.2","192.168.1.166","TLSv1.2","159","Application Data"
"254","3.053682","23.198.241.2","192.168.1.166","TLSv1.2","365","Application Data"
"255","3.053682","23.198.241.2","192.168.1.166","TLSv1.2","159","Application Data"
"256","3.053682","23.198.241.2","192.168.1.166","TLSv1.2","365","Application Data"
"257","3.053682","23.198.241.2","192.168.1.166","TLSv1.2","159","Application Data"
"258","3.053712","192.168.1.166","23.198.241.2","TCP","54","58685  >  443 [ACK] Seq=181201 Ack=223076 Win=8187 Len=0"
"259","3.764890","192.168.1.166","23.198.241.2","TLSv1.2","5821","Application Data"
"260","3.764953","192.168.1.166","23.198.241.2","TLSv1.2","5444","Application Data"
"261","3.794289","23.198.241.2","192.168.1.166","TCP","54","443  >  58685 [ACK] Seq=223076 Ack=184121 Win=14815 Len=0"
"262","3.794289","23.198.241.2","192.168.1.166","TCP","54","443  >  58685 [ACK] Seq=223076 Ack=192358 Win=14777 Len=0"
"263","3.824260","23.198.241.2","192.168.1.166","TLSv1.2","374","Application Data"
"264","3.824260","23.198.241.2","192.168.1.166","TLSv1.2","85","Application Data"
"265","3.824295","192.168.1.166","23.198.241.2","TCP","54","58685  >  443 [ACK] Seq=192358 Ack=223427 Win=8191 Len=0"
"266","4.239841","192.168.1.166","23.198.241.2","TLSv1.2","566","Application Data"
"267","4.239892","192.168.1.166","23.198.241.2","TLSv1.2","202","Application Data"
"268","4.239923","192.168.1.166","23.198.241.2","TLSv1.2","202","Application Data"
"269","4.244468","192.168.1.166","23.198.241.2","TLSv1.2","201","Application Data"
"270","4.266974","23.198.241.2","192.168.1.166","TCP","54","443  >  58685 [ACK] Seq=223427 Ack=193166 Win=14815 Len=0"
"271","4.311863","23.198.241.2","192.168.1.166","TCP","54","443  >  58685 [ACK] Seq=223427 Ack=193313 Win=14815 Len=0"
"272","4.349400","23.198.241.2","192.168.1.166","TLSv1.2","317","Application Data"
"273","4.349400","23.198.241.2","192.168.1.166","TCP","1514","443  >  58685 [ACK] Seq=223690 Ack=193313 Win=14815 Len=1460 [TCP PDU reassembled in 274]"
"274","4.349400","23.198.241.2","192.168.1.166","TLSv1.2","88","Application Data"
"275","4.349400","23.198.241.2","192.168.1.166","TCP","1514","443  >  58685 [ACK] Seq=225184 Ack=193313 Win=14815 Len=1460 [TCP PDU reassembled in 276]"
"276","4.349400","23.198.241.2","192.168.1.166","TLSv1.2","174","Application Data"
"277","4.349426","192.168.1.166","23.198.241.2","TCP","54","58685  >  443 [ACK] Seq=193313 Ack=226764 Win=8191 Len=0"
"278","4.349712","192.168.1.166","23.198.241.2","TLSv1.2","89","Application Data"
"279","4.360151","23.198.241.2","192.168.1.166","TLSv1.2","317","Application Data"
"280","4.360151","23.198.241.2","192.168.1.166","TCP","1514","443  >  58685 [ACK] Seq=227027 Ack=193313 Win=14815 Len=1460 [TCP PDU reassembled in 281]"
"281","4.360151","23.198.241.2","192.168.1.166","TLSv1.2","89","Application Data"
"282","4.360151","23.198.241.2","192.168.1.166","TLSv1.2","355","Application Data"
"283","4.360151","23.198.241.2","192.168.1.166","TLSv1.2","317","Application Data"
"284","4.360151","23.198.241.2","192.168.1.166","TCP","1514","443  >  58685 [ACK] Seq=229086 Ack=193313 Win=14815 Len=1460 [TCP PDU reassembled in 285]"
"285","4.360151","23.198.241.2","192.168.1.166","TLSv1.2","88","Application Data"
"286","4.360151","23.198.241.2","192.168.1.166","TLSv1.2","150","Application Data"
"287","4.360171","192.168.1.166","23.198.241.2","TCP","54","58685  >  443 [ACK] Seq=193348 Ack=230676 Win=8191 Len=0"
"288","4.387386","23.198.241.2","192.168.1.166","TLSv1.2","318","Application Data"
"289","4.387386","23.198.241.2","192.168.1.166","TCP","1514","443  >  58685 [ACK] Seq=230940 Ack=193313 Win=14815 Len=1460 [TCP PDU reassembled in 290]"
"290","4.387386","23.198.241.2","192.168.1.166","TLSv1.2","89","Application Data"
"291","4.387386","23.198.241.2","192.168.1.166","TLSv1.2","1217","Application Data"
"292","4.387386","23.198.241.2","192.168.1.166","TCP","54","443  >  58685 [ACK] Seq=233598 Ack=193348 Win=14815 Len=0"
"293","4.387409","192.168.1.166","23.198.241.2","TCP","54","58685  >  443 [ACK] Seq=193348 Ack=233598 Win=8191 Len=0"
"294","4.431470","192.168.1.166","23.198.241.2","TLSv1.2","5572","Application Data"
"295","4.431515","192.168.1.166","23.198.241.2","TLSv1.2","1632","Application Data"
"296","4.458813","23.198.241.2","192.168.1.166","TCP","54","443  >  58685 [ACK] Seq=233598 Ack=194808 Win=14812 Len=0"
"297","4.458813","23.198.241.2","192.168.1.166","TCP","54","443  >  58685 [ACK] Seq=233598 Ack=198866 Win=14799 Len=0"
"298","4.458813","23.198.241.2","192.168.1.166","TCP","54","443  >  58685 [ACK] Seq=233598 Ack=200444 Win=14810 Len=0"
"299","4.473553","23.198.241.2","192.168.1.166","TLSv1.2","374","Application Data"
"300","4.473553","23.198.241.2","192.168.1.166","TLSv1.2","85","Application Data"
"301","4.473571","192.168.1.166","23.198.241.2","TCP","54","58685  >  443 [ACK] Seq=200444 Ack=233949 Win=8190 Len=0"
"302","5.275839","192.168.1.166","23.198.241.2","TLSv1.2","6063","Application Data"
"303","5.275872","192.168.1.166","23.198.241.2","TLSv1.2","5213","Application Data"
"304","5.301942","23.198.241.2","192.168.1.166","TCP","54","443  >  58685 [ACK] Seq=233949 Ack=201904 Win=14812 Len=0"
"305","5.301942","23.198.241.2","192.168.1.166","TCP","54","443  >  58685 [ACK] Seq=233949 Ack=204824 Win=14805 Len=0"
"306","5.301942","23.198.241.2","192.168.1.166","TCP","54","443  >  58685 [ACK] Seq=233949 Ack=206453 Win=14810 Len=0"
"307","5.301942","23.198.241.2","192.168.1.166","TCP","54","443  >  58685 [ACK] Seq=233949 Ack=207913 Win=14812 Len=0"
"308","5.301942","23.198.241.2","192.168.1.166","TCP","54","443  >  58685 [ACK] Seq=233949 Ack=209373 Win=14804 Len=0"
"309","5.301942","23.198.241.2","192.168.1.166","TCP","54","443  >  58685 [ACK] Seq=233949 Ack=210833 Win=14812 Len=0"
"310","5.301942","23.198.241.2","192.168.1.166","TCP","54","443  >  58685 [ACK] Seq=233949 Ack=211612 Win=14807 Len=0"
"311","5.337114","23.198.241.2","192.168.1.166","TLSv1.2","365","Application Data"
"312","5.337114","23.198.241.2","192.168.1.166","TLSv1.2","159","Application Data"
"313","5.337130","192.168.1.166","23.198.241.2","TCP","54","58685  >  443 [ACK] Seq=211612 Ack=234365 Win=8188 Len=0"
"314","5.387379","192.168.1.166","23.198.241.2","TLSv1.2","5794","Application Data"
"315","5.387418","192.168.1.166","23.198.241.2","TLSv1.2","287","Application Data"
"316","5.420033","23.198.241.2","192.168.1.166","TCP","54","443  >  58685 [ACK] Seq=234365 Ack=215992 Win=14797 Len=0"
"317","5.420033","23.198.241.2","192.168.1.166","TCP","54","443  >  58685 [ACK] Seq=234365 Ack=217585 Win=14810 Len=0"
"318","5.513052","23.198.241.2","192.168.1.166","TLSv1.2","355","Application Data"
"319","5.513052","23.198.241.2","192.168.1.166","TLSv1.2","121","Application Data"
"320","5.513080","192.168.1.166","23.198.241.2","TCP","54","58685  >  443 [ACK] Seq=217585 Ack=234733 Win=8187 Len=0"
"321","5.862697","192.168.1.166","23.198.241.2","TLSv1.2","583","Application Data"
"322","5.862757","192.168.1.166","23.198.241.2","TLSv1.2","191","Application Data"
"323","5.862773","192.168.1.166","23.198.241.2","TLSv1.2","202","Application Data"
"324","5.863059","192.168.1.166","23.198.241.2","TLSv1.2","201","Application Data"
"325","5.889350","23.198.241.2","192.168.1.166","TCP","54","443  >  58685 [ACK] Seq=234733 Ack=218546 Win=14815 Len=0"
"326","5.901977","23.198.241.2","192.168.1.166","TLSv1.2","317","Application Data"
"327","5.901977","23.198.241.2","192.168.1.166","TCP","1514","443  >  58685 [ACK] Seq=234996 Ack=218546 Win=14815 Len=1460 [TCP PDU reassembled in 328]"
"328","5.901977","23.198.241.2","192.168.1.166","TLSv1.2","106","Application Data"
"329","5.901977","23.198.241.2","192.168.1.166","TCP","1514","443  >  58685 [ACK] Seq=236508 Ack=218546 Win=14815 Len=1460 [TCP PDU reassembled in 330]"
"330","5.901977","23.198.241.2","192.168.1.166","TLSv1.2","1058","Application Data"
"331","5.901977","23.198.241.2","192.168.1.166","TLSv1.2","317","Application Data"
"332","5.901977","23.198.241.2","192.168.1.166","TCP","1514","443  >  58685 [ACK] Seq=239235 Ack=218546 Win=14815 Len=1460 [TCP PDU reassembled in 333]"
"333","5.901977","23.198.241.2","192.168.1.166","TLSv1.2","141","Application Data"
"334","5.901977","23.198.241.2","192.168.1.166","TLSv1.2","447","Application Data"
"335","5.902009","192.168.1.166","23.198.241.2","TCP","54","58685  >  443 [ACK] Seq=218546 Ack=241175 Win=8191 Len=0"
"336","5.907205","192.168.1.166","23.198.241.2","TLSv1.2","199","Application Data"
"337","5.907234","192.168.1.166","23.198.241.2","TLSv1.2","185","Application Data"
"338","5.907249","192.168.1.166","23.198.241.2","TLSv1.2","200","Application Data"
"339","5.912967","192.168.1.166","23.198.241.2","TLSv1.2","186","Application Data"
"340","5.933759","23.198.241.2","192.168.1.166","TCP","54","443  >  58685 [ACK] Seq=241175 Ack=218822 Win=14815 Len=0"
"341","5.941846","23.198.241.2","192.168.1.166","TCP","54","443  >  58685 [ACK] Seq=241175 Ack=219100 Win=14815 Len=0"
"342","5.951829","23.198.241.2","192.168.1.166","TLSv1.2","324","Application Data"
"343","5.951829","23.198.241.2","192.168.1.166","TLSv1.2","1492","Application Data"
"344","5.951829","23.198.241.2","192.168.1.166","TCP","1514","443  >  58685 [ACK] Seq=242883 Ack=219100 Win=14815 Len=1460 [TCP PDU reassembled in 349]"
"345","5.951829","23.198.241.2","192.168.1.166","TCP","1514","443  >  58685 [ACK] Seq=244343 Ack=219100 Win=14815 Len=1460 [TCP PDU reassembled in 349]"
"346","5.951829","23.198.241.2","192.168.1.166","TCP","1514","443  >  58685 [ACK] Seq=245803 Ack=219100 Win=14815 Len=1460 [TCP PDU reassembled in 349]"
"347","5.951858","192.168.1.166","23.198.241.2","TCP","54","58685  >  443 [ACK] Seq=219100 Ack=247263 Win=8191 Len=0"
"348","5.952816","23.198.241.2","192.168.1.166","TCP","1514","443  >  58685 [ACK] Seq=247263 Ack=219100 Win=14815 Len=1460 [TCP PDU reassembled in 349]"
"349","5.952816","23.198.241.2","192.168.1.166","TLSv1.2","133","Application Data"
"350","5.952834","192.168.1.166","23.198.241.2","TCP","54","58685  >  443 [ACK] Seq=219100 Ack=248802 Win=8191 Len=0"
"351","5.953241","192.168.1.166","23.198.241.2","TLSv1.2","178","Application Data"
"352","5.955500","23.198.241.2","192.168.1.166","TLSv1.2","317","Application Data"
"353","5.955500","23.198.241.2","192.168.1.166","TLSv1.2","1468","Application Data"
"354","5.955500","23.198.241.2","192.168.1.166","TCP","1514","443  >  58685 [ACK] Seq=250479 Ack=219100 Win=14815 Len=1460 [TCP PDU reassembled in 355]"
"355","5.955500","23.198.241.2","192.168.1.166","TLSv1.2","370","Application Data"
"356","5.955500","23.198.241.2","192.168.1.166","TLSv1.2","317","Application Data"
"357","5.955500","23.198.241.2","192.168.1.166","TLSv1.2","1468","Application Data"
"358","5.955500","23.198.241.2","192.168.1.166","TLSv1.2","268","Application Data"
"359","5.955521","192.168.1.166","23.198.241.2","TCP","54","58685  >  443 [ACK] Seq=219224 Ack=254146 Win=8191 Len=0"
"360","5.956093","192.168.1.166","23.198.241.2","TLSv1.2","205","Application Data"
"361","5.963128","23.198.241.2","192.168.1.166","TLSv1.2","318","Application Data"
"362","5.963128","23.198.241.2","192.168.1.166","TCP","1514","443  >  58685 [ACK] Seq=254410 Ack=219100 Win=14815 Len=1460 [TCP PDU reassembled in 363]"
"363","5.963128","23.198.241.2","192.168.1.166","TLSv1.2","88","Application Data"
"364","5.963128","23.198.241.2","192.168.1.166","TLSv1.2","850","Application Data"
"365","5.963163","192.168.1.166","23.198.241.2","TCP","54","58685  >  443 [ACK] Seq=219375 Ack=256700 Win=8191 Len=0"
"366","5.972755","23.198.241.2","192.168.1.166","TLSv1.2","317","Application Data"
"367","5.972755","23.198.241.2","192.168.1.166","TCP","1514","443  >  58685 [ACK] Seq=256963 Ack=219100 Win=14815 Len=1460 [TCP PDU reassembled in 368]"
"368","5.972755","23.198.241.2","192.168.1.166","TLSv1.2","88","Application Data"
"369","5.972755","23.198.241.2","192.168.1.166","TLSv1.2","122","Application Data"
"370","5.972784","192.168.1.166","23.198.241.2","TCP","54","58685  >  443 [ACK] Seq=219375 Ack=258525 Win=8191 Len=0"
"371","5.990465","23.198.241.2","192.168.1.166","TCP","54","443  >  58685 [ACK] Seq=258525 Ack=219375 Win=14815 Len=0"
"372","5.997996","23.198.241.2","192.168.1.166","TLSv1.2","317","Application Data"
"373","5.997996","23.198.241.2","192.168.1.166","TLSv1.2","1401","Application Data"
"374","5.997996","23.198.241.2","192.168.1.166","TLSv1.2","671","Application Data"
"375","5.998018","192.168.1.166","23.198.241.2","TCP","54","58685  >  443 [ACK] Seq=219375 Ack=260752 Win=8191 Len=0"
"376","6.006136","23.198.241.2","192.168.1.166","TLSv1.2","317","Application Data"
"377","6.006136","23.198.241.2","192.168.1.166","TLSv1.2","1366","Application Data"
"378","6.006136","23.198.241.2","192.168.1.166","TCP","1514","443  >  58685 [ACK] Seq=262327 Ack=219375 Win=14815 Len=1460 [TCP PDU reassembled in 379]"
"379","6.006136","23.198.241.2","192.168.1.166","TLSv1.2","768","Application Data"
"380","6.006282","192.168.1.166","23.198.241.2","TCP","54","58685  >  443 [ACK] Seq=219375 Ack=264501 Win=8191 Len=0"
"381","6.017682","23.198.241.2","192.168.1.166","TLSv1.2","317","Application Data"
"382","6.017682","23.198.241.2","192.168.1.166","TLSv1.2","1450","Application Data"
"383","6.017682","23.198.241.2","192.168.1.166","TLSv1.2","1116","Application Data"
"384","6.017699","192.168.1.166","23.198.241.2","TCP","54","58685  >  443 [ACK] Seq=219375 Ack=267222 Win=8191 Len=0"
"385","7.027219","192.168.1.166","23.198.241.2","TLSv1.2","5823","Application Data"
"386","7.027285","192.168.1.166","23.198.241.2","TLSv1.2","16460","Application Data"
"387","7.027317","192.168.1.166","23.198.241.2","TLSv1.2","13695","Application Data"
"388","7.027815","192.168.1.166","23.198.241.2","TLSv1.2","6079","Application Data"
"389","7.027863","192.168.1.166","23.198.241.2","TLSv1.2","14533","Application Data"
"390","7.032018","192.168.1.166","23.198.241.2","TLSv1.2","5934","Application Data"
"391","7.052733","23.198.241.2","192.168.1.166","TCP","54","443  >  58685 [ACK] Seq=267222 Ack=222295 Win=14805 Len=0"
"392","7.052733","23.198.241.2","192.168.1.166","TCP","54","443  >  58685 [ACK] Seq=267222 Ack=225144 Win=14813 Len=0"
"393","7.059096","23.198.241.2","192.168.1.166","TCP","54","443  >  58685 [ACK] Seq=267222 Ack=277155 Win=14546 Len=0"
"394","7.059096","23.198.241.2","192.168.1.166","TLSv1.2","89","Application Data"
"395","7.061236","23.198.241.2","192.168.1.166","TCP","54","443  >  58685 [ACK] Seq=267257 Ack=280075 Win=14815 Len=0"
"396","7.061236","23.198.241.2","192.168.1.166","TCP","54","443  >  58685 [ACK] Seq=267257 Ack=281575 Win=14815 Len=0"
"397","7.083530","23.198.241.2","192.168.1.166","TLSv1.2","89","Application Data"
"398","7.083544","192.168.1.166","23.198.241.2","TCP","54","58685  >  443 [ACK] Seq=281575 Ack=267292 Win=8191 Len=0"
"399","7.086328","23.198.241.2","192.168.1.166","TLSv1.2","1392","Application Data"
"400","7.086328","23.198.241.2","192.168.1.166","TCP","1514","443  >  58685 [ACK] Seq=268630 Ack=281575 Win=14815 Len=1460 [TCP PDU reassembled in 401]"
"401","7.086328","23.198.241.2","192.168.1.166","TLSv1.2","615","Application Data"
"402","7.086343","192.168.1.166","23.198.241.2","TCP","54","58685  >  443 [ACK] Seq=281575 Ack=270651 Win=8191 Len=0"
"403","7.088178","192.168.1.166","23.198.241.2","TLSv1.2","5935","Application Data"
"404","7.089691","23.198.241.2","192.168.1.166","TLSv1.2","365","Application Data"
"405","7.089691","23.198.241.2","192.168.1.166","TLSv1.2","159","Application Data"
"406","7.089703","192.168.1.166","23.198.241.2","TCP","54","58685  >  443 [ACK] Seq=287456 Ack=271067 Win=8190 Len=0"
"407","7.097260","23.198.241.2","192.168.1.166","TLSv1.2","365","Application Data"
"408","7.097260","23.198.241.2","192.168.1.166","TLSv1.2","159","Application Data"
"409","7.097278","192.168.1.166","23.198.241.2","TCP","54","58685  >  443 [ACK] Seq=287456 Ack=271483 Win=8188 Len=0"
"410","7.113487","23.198.241.2","192.168.1.166","TCP","54","443  >  58685 [ACK] Seq=271483 Ack=284495 Win=14815 Len=0"
"411","7.113487","23.198.241.2","192.168.1.166","TCP","54","443  >  58685 [ACK] Seq=271483 Ack=287456 Win=14815 Len=0"
"412","8.849055","23.198.241.2","192.168.1.166","TLSv1.2","1496","Application Data"
"413","8.849055","23.198.241.2","192.168.1.166","TCP","16114","443  >  58685 [ACK] Seq=272925 Ack=287456 Win=14815 Len=16060 [TCP PDU reassembled in 414]"
"414","8.849055","23.198.241.2","192.168.1.166","TLSv1.2","400","Application Data"
"415","8.849055","23.198.241.2","192.168.1.166","TLSv1.2","85","Application Data"
"416","8.849055","23.198.241.2","192.168.1.166","TCP","16114","443  >  58685 [ACK] Seq=289362 Ack=287456 Win=14815 Len=16060 [TCP PDU reassembled in 417]"
"417","8.849055","23.198.241.2","192.168.1.166","TLSv1.2","400","Application Data"
"418","8.849055","23.198.241.2","192.168.1.166","TLSv1.2","126","Application Data, Application Data"
"419","8.849055","23.198.241.2","192.168.1.166","TCP","10274","443  >  58685 [ACK] Seq=305840 Ack=287456 Win=14815 Len=10220 [TCP PDU reassembled in 420]"
"420","8.849055","23.198.241.2","192.168.1.166","TLSv1.2","661","Application Data"
"421","8.849128","192.168.1.166","23.198.241.2","TCP","54","58685  >  443 [ACK] Seq=287456 Ack=316667 Win=8191 Len=0"
"422","8.850134","23.198.241.2","192.168.1.166","TCP","2974","443  >  58685 [ACK] Seq=316667 Ack=287456 Win=14815 Len=2920 [TCP PDU reassembled in 424]"
"423","8.850134","23.198.241.2","192.168.1.166","TCP","13194","443  >  58685 [ACK] Seq=319587 Ack=287456 Win=14815 Len=13140 [TCP PDU reassembled in 424]"
"424","8.850134","23.198.241.2","192.168.1.166","TLSv1.2","400","Application Data"
"425","8.850134","23.198.241.2","192.168.1.166","TLSv1.2","85","Application Data"
"426","8.850134","23.198.241.2","192.168.1.166","TCP","5894","443  >  58685 [ACK] Seq=333104 Ack=287456 Win=14815 Len=5840 [TCP PDU reassembled in 427]"
"427","8.850134","23.198.241.2","192.168.1.166","TLSv1.2","1089","Application Data"
"428","8.850156","192.168.1.166","23.198.241.2","TCP","54","58685  >  443 [ACK] Seq=287456 Ack=319587 Win=8191 Len=0"
"429","8.850185","192.168.1.166","23.198.241.2","TCP","54","58685  >  443 [ACK] Seq=287456 Ack=339979 Win=8191 Len=0"
"430","8.855198","192.168.1.166","23.198.241.2","TLSv1.2","6097","Application Data"
"431","8.855235","192.168.1.166","23.198.241.2","TLSv1.2","1776","Application Data"
"432","8.855545","23.198.241.2","192.168.1.166","TCP","1514","443  >  58685 [ACK] Seq=339979 Ack=287456 Win=14815 Len=1460 [TCP PDU reassembled in 443]"
"433","8.855545","23.198.241.2","192.168.1.166","TCP","1514","443  >  58685 [ACK] Seq=341439 Ack=287456 Win=14815 Len=1460 [TCP PDU reassembled in 443]"
"434","8.855545","23.198.241.2","192.168.1.166","TCP","1514","443  >  58685 [ACK] Seq=342899 Ack=287456 Win=14815 Len=1460 [TCP PDU reassembled in 443]"
"435","8.855545","23.198.241.2","192.168.1.166","TCP","1514","443  >  58685 [ACK] Seq=344359 Ack=287456 Win=14815 Len=1460 [TCP PDU reassembled in 443]"
"436","8.855545","23.198.241.2","192.168.1.166","TCP","1514","443  >  58685 [ACK] Seq=345819 Ack=287456 Win=14815 Len=1460 [TCP PDU reassembled in 443]"
"437","8.855545","23.198.241.2","192.168.1.166","TCP","1514","443  >  58685 [ACK] Seq=347279 Ack=287456 Win=14815 Len=1460 [TCP PDU reassembled in 443]"
"438","8.855545","23.198.241.2","192.168.1.166","TCP","1514","443  >  58685 [ACK] Seq=348739 Ack=287456 Win=14815 Len=1460 [TCP PDU reassembled in 443]"
"439","8.855545","23.198.241.2","192.168.1.166","TCP","1514","443  >  58685 [ACK] Seq=350199 Ack=287456 Win=14815 Len=1460 [TCP PDU reassembled in 443]"
"440","8.855545","23.198.241.2","192.168.1.166","TCP","1514","443  >  58685 [ACK] Seq=351659 Ack=287456 Win=14815 Len=1460 [TCP PDU reassembled in 443]"
"441","8.855545","23.198.241.2","192.168.1.166","TCP","1514","443  >  58685 [ACK] Seq=353119 Ack=287456 Win=14815 Len=1460 [TCP PDU reassembled in 443]"
"442","8.855545","23.198.241.2","192.168.1.166","TCP","1514","443  >  58685 [ACK] Seq=354579 Ack=287456 Win=14815 Len=1460 [TCP PDU reassembled in 443]"
"443","8.855545","23.198.241.2","192.168.1.166","TLSv1.2","400","Application Data"
"444","8.855545","23.198.241.2","192.168.1.166","TLSv1.2","85","Application Data"
"445","8.855545","23.198.241.2","192.168.1.166","TCP","1514","443  >  58685 [ACK] Seq=356416 Ack=287456 Win=14815 Len=1460 [TCP PDU reassembled in 448]"
"446","8.855545","23.198.241.2","192.168.1.166","TCP","1514","443  >  58685 [ACK] Seq=357876 Ack=287456 Win=14815 Len=1460 [TCP PDU reassembled in 448]"
"447","8.855545","23.198.241.2","192.168.1.166","TCP","10274","443  >  58685 [ACK] Seq=359336 Ack=287456 Win=14815 Len=10220 [TCP PDU reassembled in 448]"
"448","8.855545","23.198.241.2","192.168.1.166","TLSv1.2","774","Application Data"
"449","8.855590","192.168.1.166","23.198.241.2","TCP","54","58685  >  443 [ACK] Seq=295221 Ack=356385 Win=8191 Len=0"
"450","8.855628","192.168.1.166","23.198.241.2","TCP","54","58685  >  443 [ACK] Seq=295221 Ack=370276 Win=8191 Len=0"
"451","8.863781","23.198.241.2","192.168.1.166","TCP","14654","443  >  58685 [ACK] Seq=370276 Ack=287456 Win=14815 Len=14600 [TCP PDU reassembled in 452]"
"452","8.863781","23.198.241.2","192.168.1.166","TLSv1.2","1452","Application Data"
"453","8.863781","23.198.241.2","192.168.1.166","TLSv1.2","93","Application Data"
"454","8.863781","23.198.241.2","192.168.1.166","TLSv1.2","85","Application Data"
"455","8.863825","192.168.1.166","23.198.241.2","TCP","54","58685  >  443 [ACK] Seq=295221 Ack=386344 Win=8191 Len=0"
"456","8.884022","192.168.1.166","23.198.241.2","TLSv1.2","551","Application Data"
"457","8.884041","192.168.1.166","23.198.241.2","TLSv1.2","182","Application Data"
"458","8.888777","23.198.241.2","192.168.1.166","TCP","54","443  >  58685 [ACK] Seq=386344 Ack=291836 Win=14815 Len=0"
"459","8.888777","23.198.241.2","192.168.1.166","TCP","54","443  >  58685 [ACK] Seq=386344 Ack=295221 Win=14799 Len=0"
"460","8.928604","23.198.241.2","192.168.1.166","TCP","54","443  >  58685 [ACK] Seq=386344 Ack=295846 Win=14815 Len=0"
"461","8.936507","23.198.241.2","192.168.1.166","TLSv1.2","345","Application Data"
"462","8.936507","23.198.241.2","192.168.1.166","TLSv1.2","820","Application Data"
"463","8.936507","23.198.241.2","192.168.1.166","TLSv1.2","334","Application Data"
"464","8.936507","23.198.241.2","192.168.1.166","TLSv1.2","949","Application Data"
"465","8.936507","23.198.241.2","192.168.1.166","TLSv1.2","365","Application Data"
"466","8.936507","23.198.241.2","192.168.1.166","TLSv1.2","159","Application Data"
"467","8.936529","192.168.1.166","23.198.241.2","TCP","54","58685  >  443 [ACK] Seq=295846 Ack=388992 Win=8191 Len=0"
"468","8.943379","192.168.1.166","23.198.241.2","TLSv1.2","182","Application Data"
"469","8.943417","192.168.1.166","23.198.241.2","TLSv1.2","167","Application Data"
"470","8.943434","192.168.1.166","23.198.241.2","TLSv1.2","167","Application Data"
"471","8.944075","192.168.1.166","23.198.241.2","TLSv1.2","5573","Application Data"
"472","8.944138","192.168.1.166","23.198.241.2","TLSv1.2","5829","Application Data"
"473","8.946320","192.168.1.166","23.198.241.2","TLSv1.2","5828","Application Data"
"474","8.946843","192.168.1.166","23.198.241.2","TLSv1.2","562","Application Data"
"475","8.948247","192.168.1.166","23.198.241.2","TLSv1.2","168","Application Data"
"476","8.948678","192.168.1.166","23.198.241.2","TLSv1.2","167","Application Data"
"477","8.950679","192.168.1.166","23.198.241.2","TLSv1.2","5635","Application Data"
"478","8.965246","192.168.1.166","23.198.241.2","TLSv1.2","90","Application Data"
"479","8.965306","192.168.1.166","23.198.241.2","TLSv1.2","90","Application Data"
"480","8.972444","23.198.241.2","192.168.1.166","TCP","54","443  >  58685 [ACK] Seq=388992 Ack=296087 Win=14815 Len=0"
"481","8.989160","23.198.241.2","192.168.1.166","TLSv1.2","333","Application Data"
"482","8.989160","23.198.241.2","192.168.1.166","TCP","1514","443  >  58685 [ACK] Seq=389271 Ack=319584 Win=14693 Len=1460 [TCP PDU reassembled in 483]"
"483","8.989160","23.198.241.2","192.168.1.166","TLSv1.2","691","Application Data"
"484","8.989160","23.198.241.2","192.168.1.166","TLSv1.2","334","Application Data"
"485","8.989160","23.198.241.2","192.168.1.166","TCP","1514","443  >  58685 [ACK] Seq=391648 Ack=319584 Win=14693 Len=1460 [TCP PDU reassembled in 486]"
"486","8.989160","23.198.241.2","192.168.1.166","TLSv1.2","1450","Application Data"
"487","8.989204","192.168.1.166","23.198.241.2","TCP","54","58685  >  443 [ACK] Seq=319656 Ack=394504 Win=8191 Len=0"
"488","8.993509","192.168.1.166","23.198.241.2","TLSv1.2","552","Application Data"
"489","8.994604","192.168.1.166","23.198.241.2","TLSv1.2","181","Application Data"
"490","9.004522","23.198.241.2","192.168.1.166","TLSv1.2","345","Application Data"
"491","9.004522","23.198.241.2","192.168.1.166","TLSv1.2","1150","Application Data"
"492","9.004522","23.198.241.2","192.168.1.166","TLSv1.2","372","Application Data"
"493","9.004522","23.198.241.2","192.168.1.166","TCP","16114","443  >  58685 [ACK] Seq=396209 Ack=319584 Win=14815 Len=16060 [TCP PDU reassembled in 494]"
"494","9.004522","23.198.241.2","192.168.1.166","TLSv1.2","400","Application Data"
"495","9.004522","23.198.241.2","192.168.1.166","TLSv1.2","85","Application Data"
"496","9.004522","23.198.241.2","192.168.1.166","TLSv1.2","284","Application Data"
"497","9.004522","23.198.241.2","192.168.1.166","TLSv1.2","16114","Application Data"
"498","9.004522","23.198.241.2","192.168.1.166","TLSv1.2","719","Application Data"
"499","9.004522","23.198.241.2","192.168.1.166","TLSv1.2","5894","Application Data, Application Data, Application Data, Application Data, Application Data, Application Data, Application Data, Application Data, Application Data"
"500","9.004522","23.198.241.2","192.168.1.166","TLSv1.2","808","Application Data, Application Data"
"501","9.004590","192.168.1.166","23.198.241.2","TCP","54","58685  >  443 [ACK] Seq=320281 Ack=436195 Win=8191 Len=0"
"502","9.005259","23.198.241.2","192.168.1.166","TLSv1.2","85","Application Data"
"503","9.009787","192.168.1.166","23.198.241.2","TLSv1.2","181","Application Data"
"504","9.009842","192.168.1.166","23.198.241.2","TLSv1.2","176","Application Data"
"505","9.009863","192.168.1.166","23.198.241.2","TLSv1.2","176","Application Data"
"506","9.010948","192.168.1.166","23.198.241.2","TLSv1.2","191","Application Data"
"507","9.012271","192.168.1.166","23.198.241.2","TLSv1.2","90","Application Data"
"508","9.012291","192.168.1.166","23.198.241.2","TLSv1.2","90","Application Data"
"509","9.012304","192.168.1.166","23.198.241.2","TLSv1.2","90","Application Data"
"510","9.012316","192.168.1.166","23.198.241.2","TLSv1.2","90","Application Data"
"511","9.030606","192.168.1.166","23.198.241.2","TLSv1.2","5554","Application Data"
"512","9.031469","192.168.1.166","23.198.241.2","TLSv1.2","5810","Application Data"
"513","9.046179","23.198.241.2","192.168.1.166","TCP","54","443  >  58685 [ACK] Seq=436226 Ack=320652 Win=14815 Len=0"
"514","9.046179","23.198.241.2","192.168.1.166","TLSv1.2","317","Application Data"
"515","9.046179","23.198.241.2","192.168.1.166","TCP","1514","443  >  58685 [ACK] Seq=436489 Ack=320933 Win=14813 Len=1460 [TCP PDU reassembled in 520]"
"516","9.046279","192.168.1.166","23.198.241.2","TCP","54","58685  >  443 [ACK] Seq=332189 Ack=437949 Win=8191 Len=0"
"517","9.047548","23.198.241.2","192.168.1.166","TCP","1514","443  >  58685 [ACK] Seq=437949 Ack=320933 Win=14813 Len=1460 [TCP PDU reassembled in 520]"
"518","9.047548","23.198.241.2","192.168.1.166","TCP","1514","443  >  58685 [ACK] Seq=439409 Ack=320933 Win=14813 Len=1460 [TCP PDU reassembled in 520]"
"519","9.047548","23.198.241.2","192.168.1.166","TCP","4434","443  >  58685 [ACK] Seq=440869 Ack=320933 Win=14813 Len=4380 [TCP PDU reassembled in 520]"
"520","9.047548","23.198.241.2","192.168.1.166","TLSv1.2","971","Application Data"
"521","9.047548","23.198.241.2","192.168.1.166","TLSv1.2","346","Application Data"
"522","9.047548","23.198.241.2","192.168.1.166","TLSv1.2","251","Application Data"
"523","9.047548","23.198.241.2","192.168.1.166","TLSv1.2","345","Application Data"
"524","9.047548","23.198.241.2","192.168.1.166","TLSv1.2","653","Application Data"
"525","9.047548","23.198.241.2","192.168.1.166","TLSv1.2","333","Application Data"
"526","9.047548","23.198.241.2","192.168.1.166","TLSv1.2","195","Application Data"
"527","9.047548","23.198.241.2","192.168.1.166","TLSv1.2","317","Application Data"
"528","9.047548","23.198.241.2","192.168.1.166","TCP","1514","443  >  58685 [ACK] Seq=448228 Ack=320933 Win=14815 Len=1460 [TCP PDU reassembled in 529]"
"529","9.047548","23.198.241.2","192.168.1.166","TLSv1.2","75","Application Data"
"530","9.047585","192.168.1.166","23.198.241.2","TCP","54","58685  >  443 [ACK] Seq=332189 Ack=449709 Win=8191 Len=0"
"531","9.050694","192.168.1.166","23.198.241.2","TLSv1.2","562","Application Data"
"532","9.051141","192.168.1.166","23.198.241.2","TLSv1.2","176","Application Data"
"533","9.051162","192.168.1.166","23.198.241.2","TLSv1.2","176","Application Data"
"534","9.062160","23.198.241.2","192.168.1.166","TLSv1.2","317","Application Data"
"535","9.062160","23.198.241.2","192.168.1.166","TLSv1.2","1514","Application Data"
"536","9.062160","23.198.241.2","192.168.1.166","TLSv1.2","672","Application Data"
"537","9.062224","192.168.1.166","23.198.241.2","TCP","54","58685  >  443 [ACK] Seq=332941 Ack=452050 Win=8191 Len=0"
"538","9.069563","23.198.241.2","192.168.1.166","TCP","54","443  >  58685 [ACK] Seq=452050 Ack=327893 Win=14791 Len=0"
"539","9.069563","23.198.241.2","192.168.1.166","TCP","54","443  >  58685 [ACK] Seq=452050 Ack=330813 Win=14776 Len=0"
"540","9.081603","23.198.241.2","192.168.1.166","TLSv1.2","376","Application Data"
"541","9.081603","23.198.241.2","192.168.1.166","TCP","1514","443  >  58685 [ACK] Seq=452372 Ack=332189 Win=14815 Len=1460 [TCP PDU reassembled in 542]"
"542","9.081603","23.198.241.2","192.168.1.166","TLSv1.2","453","Application Data"
"543","9.081629","192.168.1.166","23.198.241.2","TCP","54","58685  >  443 [ACK] Seq=332941 Ack=454231 Win=8191 Len=0"
"544","9.087268","23.198.241.2","192.168.1.166","TLSv1.2","377","Application Data"
"545","9.087268","23.198.241.2","192.168.1.166","TLSv1.2","647","Application Data"
"546","9.087290","192.168.1.166","23.198.241.2","TCP","54","58685  >  443 [ACK] Seq=332941 Ack=455147 Win=8188 Len=0"
"547","9.114287","23.198.241.2","192.168.1.166","TCP","54","443  >  58685 [ACK] Seq=455147 Ack=332941 Win=14815 Len=0"
"548","9.114287","23.198.241.2","192.168.1.166","TLSv1.2","317","Application Data"
"549","9.114287","23.198.241.2","192.168.1.166","TCP","1514","443  >  58685 [ACK] Seq=455410 Ack=332941 Win=14815 Len=1460 [TCP PDU reassembled in 552]"
"550","9.114287","23.198.241.2","192.168.1.166","TCP","1514","443  >  58685 [ACK] Seq=456870 Ack=332941 Win=14815 Len=1460 [TCP PDU reassembled in 552]"
"551","9.114287","23.198.241.2","192.168.1.166","TCP","1514","443  >  58685 [ACK] Seq=458330 Ack=332941 Win=14815 Len=1460 [TCP PDU reassembled in 552]"
"552","9.114287","23.198.241.2","192.168.1.166","TLSv1.2","1349","Application Data"
"553","9.114380","192.168.1.166","23.198.241.2","TCP","54","58685  >  443 [ACK] Seq=332941 Ack=461085 Win=8191 Len=0"
"554","9.152709","192.168.1.166","23.198.241.2","TLSv1.2","5551","Application Data"
"555","9.170771","192.168.1.166","23.198.241.2","TLSv1.2","530","Application Data"
"556","9.174463","192.168.1.166","23.198.241.2","TLSv1.2","5641","Application Data"
"557","9.179586","192.168.1.166","23.198.241.2","TLSv1.2","5802","Application Data"
"558","9.184563","23.198.241.2","192.168.1.166","TLSv1.2","317","Application Data"
"559","9.184563","23.198.241.2","192.168.1.166","TLSv1.2","1447","Application Data"
"560","9.184582","192.168.1.166","23.198.241.2","TCP","54","58685  >  443 [ACK] Seq=350249 Ack=462741 Win=8191 Len=0"
"561","9.185125","23.198.241.2","192.168.1.166","TLSv1.2","1463","Application Data"
"562","9.186394","23.198.241.2","192.168.1.166","TCP","54","443  >  58685 [ACK] Seq=464150 Ack=335861 Win=14805 Len=0"
"563","9.186394","23.198.241.2","192.168.1.166","TCP","54","443  >  58685 [ACK] Seq=464150 Ack=338438 Win=14806 Len=0"
"564","9.200386","23.198.241.2","192.168.1.166","TCP","54","443  >  58685 [ACK] Seq=464150 Ack=340374 Win=14809 Len=0"
"565","9.204959","23.198.241.2","192.168.1.166","TCP","54","443  >  58685 [ACK] Seq=464150 Ack=344501 Win=14787 Len=0"
"566","9.218437","23.198.241.2","192.168.1.166","TCP","54","443  >  58685 [ACK] Seq=464150 Ack=348881 Win=14797 Len=0"
"567","9.222856","23.198.241.2","192.168.1.166","TLSv1.2","317","Application Data"
"568","9.222856","23.198.241.2","192.168.1.166","TCP","1514","443  >  58685 [ACK] Seq=464413 Ack=350249 Win=14790 Len=1460 [TCP PDU reassembled in 569]"
"569","9.222856","23.198.241.2","192.168.1.166","TLSv1.2","89","Application Data"
"570","9.222856","23.198.241.2","192.168.1.166","TLSv1.2","345","Application Data"
"571","9.222856","23.198.241.2","192.168.1.166","TLSv1.2","542","Application Data"
"572","9.222882","192.168.1.166","23.198.241.2","TCP","54","58685  >  443 [ACK] Seq=350249 Ack=466687 Win=8191 Len=0"
"573","9.240279","23.198.241.2","192.168.1.166","TLSv1.2","375","Application Data"
