"No.","Time","Source","Destination","Protocol","Length","Info"
"1","0.000000","23.39.213.4","192.168.1.166","TCP","54","443  >  50692 [ACK] Seq=1 Ack=1 Win=9920 Len=0"
"2","0.001799","23.39.213.4","192.168.1.166","TCP","54","443  >  50692 [ACK] Seq=1 Ack=1919 Win=9941 Len=0"
"3","0.031619","23.39.213.4","192.168.1.166","TCP","54","443  >  50692 [ACK] Seq=1 Ack=3522 Win=9931 Len=0"
"4","0.140683","23.39.213.4","192.168.1.166","TLSv1.2","954","Application Data"
"5","0.140683","23.39.213.4","192.168.1.166","TLSv1.2","120","Application Data"
"6","0.140719","192.168.1.166","23.39.213.4","TCP","54","50692  >  443 [ACK] Seq=3522 Ack=967 Win=8188 Len=0"
"7","0.205562","23.39.213.4","192.168.1.166","TLSv1.2","955","Application Data"
"8","0.205562","23.39.213.4","192.168.1.166","TLSv1.2","120","Application Data"
"9","0.205599","192.168.1.166","23.39.213.4","TCP","54","50692  >  443 [ACK] Seq=3522 Ack=1934 Win=8191 Len=0"
"10","0.311401","192.168.1.166","23.39.213.4","TLSv1.2","4978","Application Data"
"11","0.343625","23.39.213.4","192.168.1.166","TCP","54","443  >  50692 [ACK] Seq=1934 Ack=8446 Win=9949 Len=0"
"12","1.182103","23.39.213.4","192.168.1.166","TLSv1.2","940","Application Data"
"13","1.182103","23.39.213.4","192.168.1.166","TCP","16114","443  >  50692 [ACK] Seq=2820 Ack=8446 Win=9949 Len=16060 [TCP PDU reassembled in 14]"
"14","1.182103","23.39.213.4","192.168.1.166","TLSv1.2","400","Application Data"
"15","1.182103","23.39.213.4","192.168.1.166","TLSv1.2","85","Application Data"
"16","1.182103","23.39.213.4","192.168.1.166","TCP","16114","443  >  50692 [ACK] Seq=19257 Ack=8446 Win=9949 Len=16060 [TCP PDU reassembled in 17]"
"17","1.182103","23.39.213.4","192.168.1.166","TLSv1.2","400","Application Data"
"18","1.182103","23.39.213.4","192.168.1.166","TLSv1.2","20494","Application Data, Application Data"
"19","1.182103","23.39.213.4","192.168.1.166","TLSv1.2","311","Application Data"
"20","1.182163","192.168.1.166","23.39.213.4","TCP","54","50692  >  443 [ACK] Seq=8446 Ack=56360 Win=8191 Len=0"
"21","1.187914","23.39.213.4","192.168.1.166","TCP","16114","443  >  50692 [ACK] Seq=56360 Ack=8446 Win=9949 Len=16060 [TCP PDU reassembled in 22]"
"22","1.187914","23.39.213.4","192.168.1.166","TLSv1.2","400","Application Data"
"23","1.187914","23.39.213.4","192.168.1.166","TLSv1.2","85","Application Data"
"24","1.187914","23.39.213.4","192.168.1.166","TCP","5894","443  >  50692 [ACK] Seq=72797 Ack=8446 Win=9949 Len=5840 [TCP PDU reassembled in 27]"
"25","1.187963","192.168.1.166","23.39.213.4","TCP","54","50692  >  443 [ACK] Seq=8446 Ack=78637 Win=8191 Len=0"
"26","1.188022","23.39.213.4","192.168.1.166","TCP","7354","443  >  50692 [ACK] Seq=78637 Ack=8446 Win=9949 Len=7300 [TCP PDU reassembled in 27]"
"27","1.188022","23.39.213.4","192.168.1.166","TLSv1.2","144","Application Data"
"28","1.188031","192.168.1.166","23.39.213.4","TCP","54","50692  >  443 [ACK] Seq=8446 Ack=86027 Win=8191 Len=0"
"29","1.188900","23.39.213.4","192.168.1.166","TCP","2974","443  >  50692 [ACK] Seq=86027 Ack=8446 Win=9949 Len=2920 [TCP PDU reassembled in 34]"
"30","1.188918","192.168.1.166","23.39.213.4","TCP","54","50692  >  443 [ACK] Seq=8446 Ack=88947 Win=8191 Len=0"
"31","1.189561","192.168.1.166","23.39.213.4","TLSv1.2","5102","Application Data"
"32","1.189614","192.168.1.166","23.39.213.4","TLSv1.2","1228","Application Data"
"33","1.190823","23.39.213.4","192.168.1.166","TCP","5894","443  >  50692 [ACK] Seq=88947 Ack=8446 Win=9949 Len=5840 [TCP PDU reassembled in 34]"
"34","1.190823","23.39.213.4","192.168.1.166","TLSv1.2","397","Application Data"
"35","1.190823","23.39.213.4","192.168.1.166","TLSv1.2","93","Application Data"
"36","1.190823","23.39.213.4","192.168.1.166","TLSv1.2","85","Application Data"
"37","1.190848","192.168.1.166","23.39.213.4","TCP","54","50692  >  443 [ACK] Seq=14668 Ack=95200 Win=8191 Len=0"
"38","1.222825","192.168.1.166","23.39.213.4","TLSv1.2","4987","Application Data"
"39","1.222866","192.168.1.166","23.39.213.4","TLSv1.2","566","Application Data"
"40","1.222908","192.168.1.166","23.39.213.4","TLSv1.2","4703","Application Data"
"41","1.222964","192.168.1.166","23.39.213.4","TLSv1.2","4986","Application Data"
"42","1.224216","23.39.213.4","192.168.1.166","TCP","54","443  >  50692 [ACK] Seq=95200 Ack=11366 Win=9937 Len=0"
"43","1.224216","23.39.213.4","192.168.1.166","TCP","54","443  >  50692 [ACK] Seq=95200 Ack=13494 Win=9949 Len=0"
"44","1.225657","192.168.1.166","23.39.213.4","TLSv1.2","4919","Application Data"
"45","1.255524","23.39.213.4","192.168.1.166","TCP","54","443  >  50692 [ACK] Seq=95200 Ack=16128 Win=9945 Len=0"
"46","1.271148","23.39.213.4","192.168.1.166","TLSv1.2","361","Application Data"
"47","1.271148","23.39.213.4","192.168.1.166","TLSv1.2","289","Application Data"
"48","1.271177","192.168.1.166","23.39.213.4","TCP","54","50692  >  443 [ACK] Seq=34559 Ack=95742 Win=8189 Len=0"
"49","1.285334","23.39.213.4","192.168.1.166","TLSv1.2","282","Application Data"
"50","1.285334","23.39.213.4","192.168.1.166","TLSv1.2","958","Application Data"
"51","1.285334","23.39.213.4","192.168.1.166","TLSv1.2","85","Application Data"
"52","1.285334","23.39.213.4","192.168.1.166","TLSv1.2","85","Application Data"
"53","1.285362","192.168.1.166","23.39.213.4","TCP","54","50692  >  443 [ACK] Seq=34559 Ack=96936 Win=8191 Len=0"
"54","1.291487","23.39.213.4","192.168.1.166","TLSv1.2","340","Application Data"
"55","1.291487","23.39.213.4","192.168.1.166","TLSv1.2","350","Application Data"
"56","1.291487","23.39.213.4","192.168.1.166","TLSv1.2","85","Application Data"
"57","1.291487","23.39.213.4","192.168.1.166","TLSv1.2","212","Application Data"
"58","1.291487","23.39.213.4","192.168.1.166","TLSv1.2","339","Application Data"
"59","1.291510","192.168.1.166","23.39.213.4","TCP","54","50692  >  443 [ACK] Seq=34559 Ack=97992 Win=8187 Len=0"
"60","1.291986","192.168.1.166","23.39.213.4","TLSv1.2","89","Application Data"
"61","1.293062","23.39.213.4","192.168.1.166","TLSv1.2","85","Application Data"
"62","1.338191","192.168.1.166","23.39.213.4","TCP","54","50692  >  443 [ACK] Seq=34594 Ack=98023 Win=8187 Len=0"
"63","1.365580","23.39.213.4","192.168.1.166","TCP","54","443  >  50692 [ACK] Seq=98023 Ack=34594 Win=9949 Len=0"
"64","1.411055","192.168.1.166","23.39.213.4","TLSv1.2","556","Application Data"
"65","1.432527","192.168.1.166","23.39.213.4","TLSv1.2","191","Application Data"
"66","1.432583","192.168.1.166","23.39.213.4","TLSv1.2","176","Application Data"
"67","1.432605","192.168.1.166","23.39.213.4","TLSv1.2","176","Application Data"
"68","1.432625","192.168.1.166","23.39.213.4","TLSv1.2","176","Application Data"
"69","1.432699","192.168.1.166","23.39.213.4","TLSv1.2","176","Application Data"
"70","1.442557","23.39.213.4","192.168.1.166","TCP","54","443  >  50692 [ACK] Seq=98023 Ack=35096 Win=9949 Len=0"
"71","1.452779","23.39.213.4","192.168.1.166","TLSv1.2","317","Application Data"
"72","1.452779","23.39.213.4","192.168.1.166","TCP","5894","443  >  50692 [ACK] Seq=98286 Ack=35096 Win=9949 Len=5840 [TCP PDU reassembled in 73]"
"73","1.452779","23.39.213.4","192.168.1.166","TLSv1.2","411","Application Data"
"74","1.452804","192.168.1.166","23.39.213.4","TCP","54","50692  >  443 [ACK] Seq=35721 Ack=104483 Win=8191 Len=0"
"75","1.464643","23.39.213.4","192.168.1.166","TCP","54","443  >  50692 [ACK] Seq=104483 Ack=35233 Win=9949 Len=0"
"76","1.464643","23.39.213.4","192.168.1.166","TCP","54","443  >  50692 [ACK] Seq=104483 Ack=35355 Win=9949 Len=0"
"77","1.464643","23.39.213.4","192.168.1.166","TCP","54","443  >  50692 [ACK] Seq=104483 Ack=35477 Win=9949 Len=0"
"78","1.464643","23.39.213.4","192.168.1.166","TCP","54","443  >  50692 [ACK] Seq=104483 Ack=35599 Win=9949 Len=0"
"79","1.464643","23.39.213.4","192.168.1.166","TCP","54","443  >  50692 [ACK] Seq=104483 Ack=35721 Win=9949 Len=0"
"80","1.474405","23.39.213.4","192.168.1.166","TLSv1.2","317","Application Data"
"81","1.474405","23.39.213.4","192.168.1.166","TCP","4434","443  >  50692 [ACK] Seq=104746 Ack=35721 Win=9949 Len=4380 [TCP PDU reassembled in 82]"
"82","1.474405","23.39.213.4","192.168.1.166","TLSv1.2","231","Application Data"
"83","1.474440","192.168.1.166","23.39.213.4","TCP","54","50692  >  443 [ACK] Seq=35721 Ack=109303 Win=8191 Len=0"
"84","1.491855","23.39.213.4","192.168.1.166","TLSv1.2","317","Application Data"
"85","1.491855","23.39.213.4","192.168.1.166","TLSv1.2","1436","Application Data"
"86","1.491855","23.39.213.4","192.168.1.166","TCP","1514","443  >  50692 [ACK] Seq=110948 Ack=35721 Win=9949 Len=1460 [TCP PDU reassembled in 87]"
"87","1.491855","23.39.213.4","192.168.1.166","TLSv1.2","636","Application Data"
"88","1.491895","192.168.1.166","23.39.213.4","TCP","54","50692  >  443 [ACK] Seq=35721 Ack=112990 Win=8191 Len=0"
"89","1.496660","192.168.1.166","23.39.213.4","TLSv1.2","4594","Application Data"
"90","1.497623","192.168.1.166","23.39.213.4","TLSv1.2","5002","Application Data"
"91","1.498616","23.39.213.4","192.168.1.166","TLSv1.2","317","Application Data"
"92","1.498616","23.39.213.4","192.168.1.166","TCP","1514","443  >  50692 [ACK] Seq=113253 Ack=35721 Win=9949 Len=1460 [TCP PDU reassembled in 93]"
"93","1.498616","23.39.213.4","192.168.1.166","TLSv1.2","66","Application Data"
"94","1.498655","192.168.1.166","23.39.213.4","TCP","54","50692  >  443 [ACK] Seq=45209 Ack=114725 Win=8191 Len=0"
"95","1.499437","23.39.213.4","192.168.1.166","TLSv1.2","317","Application Data"
"96","1.499453","192.168.1.166","23.39.213.4","TCP","54","50692  >  443 [ACK] Seq=45209 Ack=114988 Win=8190 Len=0"
"97","1.499574","23.39.213.4","192.168.1.166","TCP","1514","443  >  50692 [ACK] Seq=114988 Ack=35721 Win=9949 Len=1460 [TCP PDU reassembled in 98]"
"98","1.499574","23.39.213.4","192.168.1.166","TLSv1.2","65","Application Data"
"99","1.499588","192.168.1.166","23.39.213.4","TCP","54","50692  >  443 [ACK] Seq=45209 Ack=116459 Win=8191 Len=0"
"100","1.500105","23.39.213.4","192.168.1.166","TCP","2974","443  >  50692 [ACK] Seq=116459 Ack=35721 Win=9949 Len=2920 [TCP PDU reassembled in 101]"
"101","1.500105","23.39.213.4","192.168.1.166","TLSv1.2","803","Application Data"
"102","1.500127","192.168.1.166","23.39.213.4","TCP","54","50692  >  443 [ACK] Seq=45209 Ack=120128 Win=8191 Len=0"
"103","1.503619","23.39.213.4","192.168.1.166","TLSv1.2","317","Application Data"
"104","1.503619","23.39.213.4","192.168.1.166","TCP","1514","443  >  50692 [ACK] Seq=120391 Ack=35721 Win=9949 Len=1460 [TCP PDU reassembled in 105]"
"105","1.503619","23.39.213.4","192.168.1.166","TLSv1.2","145","Application Data"
"106","1.503619","23.39.213.4","192.168.1.166","TCP","5894","443  >  50692 [ACK] Seq=121942 Ack=35721 Win=9949 Len=5840 [TCP PDU reassembled in 107]"
"107","1.503619","23.39.213.4","192.168.1.166","TLSv1.2","479","Application Data"
"108","1.503644","192.168.1.166","23.39.213.4","TCP","54","50692  >  443 [ACK] Seq=45209 Ack=121942 Win=8191 Len=0"
"109","1.503681","192.168.1.166","23.39.213.4","TCP","54","50692  >  443 [ACK] Seq=45209 Ack=128207 Win=8191 Len=0"
"110","1.509691","23.39.213.4","192.168.1.166","TCP","5894","443  >  50692 [ACK] Seq=128207 Ack=35721 Win=9949 Len=5840 [TCP PDU reassembled in 111]"
"111","1.509691","23.39.213.4","192.168.1.166","TLSv1.2","1130","Application Data"
"112","1.509725","192.168.1.166","23.39.213.4","TCP","54","50692  >  443 [ACK] Seq=45209 Ack=135123 Win=8191 Len=0"
"113","1.521451","192.168.1.166","23.39.213.4","TLSv1.2","4957","Application Data"
"114","1.531176","23.39.213.4","192.168.1.166","TCP","54","443  >  50692 [ACK] Seq=135123 Ack=45209 Win=9901 Len=0"
"115","1.553454","23.39.213.4","192.168.1.166","TCP","54","443  >  50692 [ACK] Seq=135123 Ack=50112 Win=9926 Len=0"
"116","1.559800","23.39.213.4","192.168.1.166","TLSv1.2","394","Application Data"
"117","1.560085","192.168.1.166","23.39.213.4","TLSv1.2","89","Application Data"
"118","1.583794","23.39.213.4","192.168.1.166","TLSv1.2","85","Application Data"
"119","1.583794","23.39.213.4","192.168.1.166","TLSv1.2","349","Application Data"
"120","1.583842","192.168.1.166","23.39.213.4","TCP","54","50692  >  443 [ACK] Seq=50147 Ack=135789 Win=8189 Len=0"
"121","1.584057","192.168.1.166","23.39.213.4","TLSv1.2","89","Application Data"
"122","1.603173","23.39.213.4","192.168.1.166","TLSv1.2","85","Application Data"
"123","1.611056","192.168.1.166","23.39.213.4","TLSv1.2","4897","Application Data"
"124","1.612180","192.168.1.166","23.39.213.4","TLSv1.2","4897","Application Data"
"125","1.636638","192.168.1.166","23.39.213.4","TLSv1.2","4962","Application Data"
"126","1.643584","23.39.213.4","192.168.1.166","TCP","54","443  >  50692 [ACK] Seq=135820 Ack=51642 Win=9945 Len=0"
"127","1.643584","23.39.213.4","192.168.1.166","TCP","54","443  >  50692 [ACK] Seq=135820 Ack=59868 Win=9907 Len=0"
"128","1.668788","23.39.213.4","192.168.1.166","TCP","54","443  >  50692 [ACK] Seq=135820 Ack=62788 Win=9937 Len=0"
"129","1.672633","192.168.1.166","23.39.213.4","TLSv1.2","4986","Application Data"
"130","1.685943","23.39.213.4","192.168.1.166","TLSv1.2","573","Application Data"
"131","1.685943","23.39.213.4","192.168.1.166","TLSv1.2","347","Application Data"
"132","1.685943","23.39.213.4","192.168.1.166","TLSv1.2","384","Application Data"
"133","1.685943","23.39.213.4","192.168.1.166","TCP","11734","443  >  50692 [ACK] Seq=136962 Ack=64776 Win=9926 Len=11680 [TCP PDU reassembled in 134]"
"134","1.685943","23.39.213.4","192.168.1.166","TLSv1.2","511","Application Data"
"135","1.685943","23.39.213.4","192.168.1.166","TLSv1.2","11734","Application Data"
"136","1.685943","23.39.213.4","192.168.1.166","TLSv1.2","1369","Application Data"
"137","1.685943","23.39.213.4","192.168.1.166","TLSv1.2","85","Application Data"
"138","1.686011","192.168.1.166","23.39.213.4","TCP","54","50692  >  443 [ACK] Seq=69708 Ack=162125 Win=8191 Len=0"
"139","1.705148","23.39.213.4","192.168.1.166","TCP","54","443  >  50692 [ACK] Seq=162125 Ack=69708 Win=9926 Len=0"
"140","1.708816","23.39.213.4","192.168.1.166","TLSv1.2","346","Application Data"
"141","1.709098","192.168.1.166","23.39.213.4","TLSv1.2","89","Application Data"
"142","1.728026","23.39.213.4","192.168.1.166","TLSv1.2","340","Application Data"
"143","1.728026","23.39.213.4","192.168.1.166","TLSv1.2","85","Application Data"
"144","1.728055","192.168.1.166","23.39.213.4","TCP","54","50692  >  443 [ACK] Seq=69743 Ack=162734 Win=8189 Len=0"
"145","1.728379","192.168.1.166","23.39.213.4","TLSv1.2","89","Application Data"
"146","1.729824","23.39.213.4","192.168.1.166","TLSv1.2","85","Application Data"
"147","1.775038","23.39.213.4","192.168.1.166","TCP","54","443  >  50692 [ACK] Seq=162765 Ack=69778 Win=9949 Len=0"
"148","1.785215","192.168.1.166","23.39.213.4","TCP","54","50692  >  443 [ACK] Seq=69778 Ack=162765 Win=8189 Len=0"
"149","1.788360","192.168.1.166","23.39.213.4","TLSv1.2","4990","Application Data"
"150","1.788422","192.168.1.166","23.39.213.4","TLSv1.2","339","Application Data"
"151","1.821686","23.39.213.4","192.168.1.166","TCP","54","443  >  50692 [ACK] Seq=162765 Ack=72698 Win=9949 Len=0"
"152","1.821686","23.39.213.4","192.168.1.166","TCP","54","443  >  50692 [ACK] Seq=162765 Ack=74999 Win=9938 Len=0"
"153","1.866682","192.168.1.166","23.39.213.4","TLSv1.2","5007","Application Data"
"154","1.866730","192.168.1.166","23.39.213.4","TLSv1.2","775","Application Data"
"155","1.868207","192.168.1.166","23.39.213.4","TLSv1.2","5008","Application Data"
"156","1.868263","192.168.1.166","23.39.213.4","TLSv1.2","859","Application Data"
"157","1.901496","23.39.213.4","192.168.1.166","TCP","54","443  >  50692 [ACK] Seq=162765 Ack=80673 Win=9921 Len=0"
"158","1.901496","23.39.213.4","192.168.1.166","TCP","54","443  >  50692 [ACK] Seq=162765 Ack=83593 Win=9937 Len=0"
"159","1.901496","23.39.213.4","192.168.1.166","TCP","54","443  >  50692 [ACK] Seq=162765 Ack=86432 Win=9921 Len=0"
"160","1.922859","192.168.1.166","23.39.213.4","TLSv1.2","5325","Application Data"
"161","1.922988","192.168.1.166","23.39.213.4","TLSv1.2","5042","Application Data"
"162","1.923067","192.168.1.166","23.39.213.4","TLSv1.2","5312","Application Data"
"163","1.924025","192.168.1.166","23.39.213.4","TLSv1.2","5325","Application Data"
"164","1.924106","192.168.1.166","23.39.213.4","TLSv1.2","5043","Application Data"
"165","1.924269","192.168.1.166","23.39.213.4","TLSv1.2","5313","Application Data"
"166","1.925844","192.168.1.166","23.39.213.4","TLSv1.2","5324","Application Data"
"167","1.925908","192.168.1.166","23.39.213.4","TLSv1.2","5042","Application Data"
"168","1.926016","192.168.1.166","23.39.213.4","TLSv1.2","5312","Application Data"
"169","1.928223","23.39.213.4","192.168.1.166","TLSv1.2","955","Application Data"
"170","1.928223","23.39.213.4","192.168.1.166","TLSv1.2","1512","Application Data"
"171","1.928223","23.39.213.4","192.168.1.166","TCP","8814","443  >  50692 [ACK] Seq=165124 Ack=86432 Win=9949 Len=8760 [TCP PDU reassembled in 172]"
"172","1.928223","23.39.213.4","192.168.1.166","TLSv1.2","562","Application Data"
"173","1.928273","192.168.1.166","23.39.213.4","TCP","54","50692  >  443 [ACK] Seq=132984 Ack=174392 Win=8191 Len=0"
"174","1.931072","192.168.1.166","23.39.213.4","TLSv1.2","5006","Application Data"
"175","1.931119","192.168.1.166","23.39.213.4","TLSv1.2","846","Application Data"
"176","1.943737","192.168.1.166","23.39.213.4","TLSv1.2","5018","Application Data"
"177","1.943810","192.168.1.166","23.39.213.4","TLSv1.2","253","Application Data"
"178","1.944278","192.168.1.166","23.39.213.4","TLSv1.2","5254","Application Data"
"179","1.954472","23.39.213.4","192.168.1.166","TCP","54","443  >  50692 [ACK] Seq=174392 Ack=89352 Win=9949 Len=0"
"180","1.954472","23.39.213.4","192.168.1.166","TCP","54","443  >  50692 [ACK] Seq=174392 Ack=91703 Win=9949 Len=0"
"181","1.954472","23.39.213.4","192.168.1.166","TCP","54","443  >  50692 [ACK] Seq=174392 Ack=101949 Win=9898 Len=0"
"182","1.956711","23.39.213.4","192.168.1.166","TCP","54","443  >  50692 [ACK] Seq=174392 Ack=107220 Win=9925 Len=0"
"183","1.981492","23.39.213.4","192.168.1.166","TLSv1.2","458","Application Data"
"184","1.981492","23.39.213.4","192.168.1.166","TLSv1.2","715","Application Data"
"185","1.981542","192.168.1.166","23.39.213.4","TCP","54","50692  >  443 [ACK] Seq=149091 Ack=175457 Win=8187 Len=0"
"186","2.036819","23.39.213.4","192.168.1.166","TLSv1.2","458","Application Data"
"187","2.036819","23.39.213.4","192.168.1.166","TLSv1.2","730","Application Data"
"188","2.036850","192.168.1.166","23.39.213.4","TCP","54","50692  >  443 [ACK] Seq=149091 Ack=176537 Win=8191 Len=0"
"189","2.038385","192.168.1.166","23.39.213.4","TLSv1.2","5087","Application Data"
"190","2.038473","192.168.1.166","23.39.213.4","TLSv1.2","5198","Application Data"
"191","2.040774","192.168.1.166","23.39.213.4","TLSv1.2","5087","Application Data"
"192","2.040898","192.168.1.166","23.39.213.4","TLSv1.2","5198","Application Data"
"193","2.047092","23.39.213.4","192.168.1.166","TLSv1.2","354","Application Data"
"194","2.047092","23.39.213.4","192.168.1.166","TCP","4434","443  >  50692 [ACK] Seq=176837 Ack=149091 Win=9949 Len=4380 [TCP PDU reassembled in 195]"
"195","2.047092","23.39.213.4","192.168.1.166","TLSv1.2","927","Application Data"
"196","2.047131","192.168.1.166","23.39.213.4","TCP","54","50692  >  443 [ACK] Seq=169445 Ack=182090 Win=8191 Len=0"
"197","2.052013","192.168.1.166","23.39.213.4","TLSv1.2","4980","Application Data"
"198","2.052091","192.168.1.166","23.39.213.4","TLSv1.2","538","Application Data"
"199","2.064089","23.39.213.4","192.168.1.166","TLSv1.2","482","Application Data"
"200","2.064089","23.39.213.4","192.168.1.166","TLSv1.2","192","Application Data"
"201","2.064119","192.168.1.166","23.39.213.4","TCP","54","50692  >  443 [ACK] Seq=174855 Ack=182656 Win=8189 Len=0"
"202","2.071380","23.39.213.4","192.168.1.166","TCP","54","443  >  50692 [ACK] Seq=182656 Ack=152011 Win=9937 Len=0"
"203","2.071380","23.39.213.4","192.168.1.166","TCP","54","443  >  50692 [ACK] Seq=182656 Ack=154124 Win=9940 Len=0"
"204","2.071380","23.39.213.4","192.168.1.166","TCP","54","443  >  50692 [ACK] Seq=182656 Ack=159268 Win=9913 Len=0"
"205","2.071876","23.39.213.4","192.168.1.166","TCP","54","443  >  50692 [ACK] Seq=182656 Ack=162188 Win=9937 Len=0"
"206","2.097368","23.39.213.4","192.168.1.166","TLSv1.2","482","Application Data"
"207","2.097368","23.39.213.4","192.168.1.166","TLSv1.2","192","Application Data"
"208","2.097368","23.39.213.4","192.168.1.166","TLSv1.2","458","Application Data"
"209","2.097368","23.39.213.4","192.168.1.166","TLSv1.2","738","Application Data"
"210","2.097416","192.168.1.166","23.39.213.4","TCP","54","50692  >  443 [ACK] Seq=174855 Ack=184310 Win=8191 Len=0"
"211","2.113843","23.39.213.4","192.168.1.166","TLSv1.2","484","Application Data"
"212","2.113843","23.39.213.4","192.168.1.166","TCP","1514","443  >  50692 [ACK] Seq=184740 Ack=174855 Win=9949 Len=1460 [TCP PDU reassembled in 213]"
"213","2.113843","23.39.213.4","192.168.1.166","TLSv1.2","226","Application Data"
"214","2.113886","192.168.1.166","23.39.213.4","TCP","54","50692  >  443 [ACK] Seq=174855 Ack=186372 Win=8191 Len=0"
"215","2.157009","23.39.213.4","192.168.1.166","TLSv1.2","953","Application Data"
"216","2.157009","23.39.213.4","192.168.1.166","TLSv1.2","174","Application Data"
"217","2.157051","192.168.1.166","23.39.213.4","TCP","54","50692  >  443 [ACK] Seq=174855 Ack=187391 Win=8187 Len=0"
"218","2.158576","23.39.213.4","192.168.1.166","TLSv1.2","482","Application Data"
"219","2.158576","23.39.213.4","192.168.1.166","TLSv1.2","192","Application Data"
"220","2.158597","192.168.1.166","23.39.213.4","TCP","54","50692  >  443 [ACK] Seq=174855 Ack=187957 Win=8191 Len=0"
"221","2.198428","192.168.1.166","23.39.213.4","TLSv1.2","5197","Application Data"
"222","2.203633","23.39.213.4","192.168.1.166","TLSv1.2","936","Application Data"
"223","2.203633","23.39.213.4","192.168.1.166","TLSv1.2","116","Application Data"
"224","2.203670","192.168.1.166","23.39.213.4","TCP","54","50692  >  443 [ACK] Seq=179998 Ack=188901 Win=8188 Len=0"
"225","2.219434","23.39.213.4","192.168.1.166","TLSv1.2","484","Application Data"
"226","2.219434","23.39.213.4","192.168.1.166","TCP","4434","443  >  50692 [ACK] Seq=189331 Ack=174855 Win=9949 Len=4380 [TCP PDU reassembled in 227]"
"227","2.219434","23.39.213.4","192.168.1.166","TLSv1.2","426","Application Data"
"228","2.219494","192.168.1.166","23.39.213.4","TCP","54","50692  >  443 [ACK] Seq=179998 Ack=194083 Win=8191 Len=0"
"229","2.223031","23.39.213.4","192.168.1.166","TLSv1.2","484","Application Data"
"230","2.223031","23.39.213.4","192.168.1.166","TCP","1514","443  >  50692 [ACK] Seq=194513 Ack=174855 Win=9949 Len=1460 [TCP PDU reassembled in 231]"
"231","2.223031","23.39.213.4","192.168.1.166","TLSv1.2","229","Application Data"
"232","2.223087","192.168.1.166","23.39.213.4","TCP","54","50692  >  443 [ACK] Seq=179998 Ack=196148 Win=8191 Len=0"
"233","2.230025","23.39.213.4","192.168.1.166","TCP","54","443  >  50692 [ACK] Seq=196148 Ack=179998 Win=9949 Len=0"
"234","2.255425","23.39.213.4","192.168.1.166","TLSv1.2","484","Application Data"
"235","2.255425","23.39.213.4","192.168.1.166","TCP","7354","443  >  50692 [ACK] Seq=196578 Ack=179998 Win=9949 Len=7300 [TCP PDU reassembled in 236]"
"236","2.255425","23.39.213.4","192.168.1.166","TLSv1.2","1431","Application Data"
"237","2.255425","23.39.213.4","192.168.1.166","TLSv1.2","484","Application Data"
"238","2.255425","23.39.213.4","192.168.1.166","TCP","7354","443  >  50692 [ACK] Seq=205685 Ack=179998 Win=9949 Len=7300 [TCP PDU reassembled in 239]"
"239","2.255425","23.39.213.4","192.168.1.166","TLSv1.2","1401","Application Data"
"240","2.255490","192.168.1.166","23.39.213.4","TCP","54","50692  >  443 [ACK] Seq=179998 Ack=214332 Win=8191 Len=0"
"241","2.257907","23.39.213.4","192.168.1.166","TLSv1.2","484","Application Data"
"242","2.257907","23.39.213.4","192.168.1.166","TCP","7354","443  >  50692 [ACK] Seq=214762 Ack=179998 Win=9949 Len=7300 [TCP PDU reassembled in 243]"
"243","2.257907","23.39.213.4","192.168.1.166","TLSv1.2","1453","Application Data"
"244","2.257943","192.168.1.166","23.39.213.4","TCP","54","50692  >  443 [ACK] Seq=179998 Ack=223461 Win=8191 Len=0"
"245","2.269244","192.168.1.166","23.39.213.4","TLSv1.2","556","Application Data"
"246","2.269320","192.168.1.166","23.39.213.4","TLSv1.2","198","Application Data"
"247","2.269339","192.168.1.166","23.39.213.4","TLSv1.2","196","Application Data"
"248","2.277668","23.39.213.4","192.168.1.166","TLSv1.2","484","Application Data"
"249","2.277668","23.39.213.4","192.168.1.166","TCP","1514","443  >  50692 [ACK] Seq=223891 Ack=179998 Win=9949 Len=1460 [TCP PDU reassembled in 252]"
"250","2.277668","23.39.213.4","192.168.1.166","TCP","1514","443  >  50692 [ACK] Seq=225351 Ack=179998 Win=9949 Len=1460 [TCP PDU reassembled in 252]"
"251","2.277668","23.39.213.4","192.168.1.166","TCP","1514","443  >  50692 [ACK] Seq=226811 Ack=179998 Win=9949 Len=1460 [TCP PDU reassembled in 252]"
"252","2.277668","23.39.213.4","192.168.1.166","TLSv1.2","441","Application Data"
"253","2.277736","192.168.1.166","23.39.213.4","TCP","54","50692  >  443 [ACK] Seq=180786 Ack=228658 Win=8191 Len=0"
"254","2.286288","23.39.213.4","192.168.1.166","TLSv1.2","574","Application Data"
"255","2.286288","23.39.213.4","192.168.1.166","TLSv1.2","928","Application Data"
"256","2.286317","192.168.1.166","23.39.213.4","TCP","54","50692  >  443 [ACK] Seq=180786 Ack=230052 Win=8186 Len=0"
"257","2.321286","23.39.213.4","192.168.1.166","TLSv1.2","574","Application Data"
"258","2.321286","23.39.213.4","192.168.1.166","TLSv1.2","932","Application Data"
"259","2.321305","192.168.1.166","23.39.213.4","TCP","54","50692  >  443 [ACK] Seq=180786 Ack=231450 Win=8191 Len=0"
"260","2.323555","192.168.1.166","23.39.213.4","TLSv1.2","4792","Application Data"
"261","2.339242","23.39.213.4","192.168.1.166","TLSv1.2","334","Application Data"
"262","2.339242","23.39.213.4","192.168.1.166","TCP","4434","443  >  50692 [ACK] Seq=231730 Ack=180786 Win=9949 Len=4380 [TCP PDU reassembled in 263]"
"263","2.339242","23.39.213.4","192.168.1.166","TLSv1.2","101","Application Data"
"264","2.339283","192.168.1.166","23.39.213.4","TCP","54","50692  >  443 [ACK] Seq=185524 Ack=236157 Win=8191 Len=0"
"265","2.339714","192.168.1.166","23.39.213.4","TLSv1.2","89","Application Data"
"266","2.340685","23.39.213.4","192.168.1.166","TLSv1.2","346","Application Data"
"267","2.340685","23.39.213.4","192.168.1.166","TCP","2974","443  >  50692 [ACK] Seq=236449 Ack=180786 Win=9949 Len=2920 [TCP PDU reassembled in 268]"
"268","2.340685","23.39.213.4","192.168.1.166","TLSv1.2","498","Application Data"
"269","2.340729","192.168.1.166","23.39.213.4","TCP","54","50692  >  443 [ACK] Seq=185559 Ack=239813 Win=8191 Len=0"
"270","2.342810","23.39.213.4","192.168.1.166","TLSv1.2","346","Application Data"
"271","2.342810","23.39.213.4","192.168.1.166","TCP","2974","443  >  50692 [ACK] Seq=240105 Ack=180786 Win=9949 Len=2920 [TCP PDU reassembled in 272]"
"272","2.342810","23.39.213.4","192.168.1.166","TLSv1.2","135","Application Data"
"273","2.342832","192.168.1.166","23.39.213.4","TCP","54","50692  >  443 [ACK] Seq=185559 Ack=243106 Win=8191 Len=0"
"274","2.355798","23.39.213.4","192.168.1.166","TCP","54","443  >  50692 [ACK] Seq=243106 Ack=185524 Win=9927 Len=0"
"275","2.369153","23.39.213.4","192.168.1.166","TLSv1.2","484","Application Data"
"276","2.369153","23.39.213.4","192.168.1.166","TCP","4434","443  >  50692 [ACK] Seq=243536 Ack=185524 Win=9949 Len=4380 [TCP PDU reassembled in 277]"
"277","2.369153","23.39.213.4","192.168.1.166","TLSv1.2","446","Application Data"
"278","2.369153","23.39.213.4","192.168.1.166","TLSv1.2","952","Application Data"
"279","2.369153","23.39.213.4","192.168.1.166","TLSv1.2","85","Application Data"
"280","2.369193","192.168.1.166","23.39.213.4","TCP","54","50692  >  443 [ACK] Seq=185559 Ack=249237 Win=8191 Len=0"
"281","2.370928","23.39.213.4","192.168.1.166","TLSv1.2","574","Application Data"
"282","2.370928","23.39.213.4","192.168.1.166","TLSv1.2","946","Application Data"
"283","2.370946","192.168.1.166","23.39.213.4","TCP","54","50692  >  443 [ACK] Seq=185559 Ack=250649 Win=8186 Len=0"
"284","2.401375","192.168.1.166","23.39.213.4","TLSv1.2","606","Application Data"
"285","2.402408","23.39.213.4","192.168.1.166","TCP","54","443  >  50692 [ACK] Seq=250649 Ack=185559 Win=9949 Len=0"
"286","2.444559","23.39.213.4","192.168.1.166","TLSv1.2","318","Application Data"
"287","2.445992","23.39.213.4","192.168.1.166","TCP","16114","443  >  50692 [ACK] Seq=250913 Ack=186111 Win=9949 Len=16060 [TCP PDU reassembled in 288]"
"288","2.445992","23.39.213.4","192.168.1.166","TLSv1.2","400","Application Data"
"289","2.445992","23.39.213.4","192.168.1.166","TLSv1.2","85","Application Data"
"290","2.445992","23.39.213.4","192.168.1.166","TCP","11734","443  >  50692 [ACK] Seq=267350 Ack=186111 Win=9949 Len=11680 [TCP PDU reassembled in 291]"
"291","2.445992","23.39.213.4","192.168.1.166","TLSv1.2","1069","Application Data"
"292","2.446040","192.168.1.166","23.39.213.4","TCP","54","50692  >  443 [ACK] Seq=186111 Ack=280045 Win=8191 Len=0"
"293","2.629508","192.168.1.166","23.39.213.4","TLSv1.2","4841","Application Data"
"294","2.629771","192.168.1.166","23.39.213.4","TLSv1.2","5090","Application Data"
"295","2.661556","23.39.213.4","192.168.1.166","TCP","54","443  >  50692 [ACK] Seq=280045 Ack=189031 Win=9937 Len=0"
"296","2.661556","23.39.213.4","192.168.1.166","TCP","54","443  >  50692 [ACK] Seq=280045 Ack=190898 Win=9949 Len=0"
"297","2.682820","192.168.1.166","23.39.213.4","TLSv1.2","5016","Application Data"
"298","2.683041","192.168.1.166","23.39.213.4","TLSv1.2","4955","Application Data"
"299","2.688778","23.39.213.4","192.168.1.166","TCP","54","443  >  50692 [ACK] Seq=280045 Ack=195934 Win=9949 Len=0"
"300","2.702687","192.168.1.166","23.39.213.4","TLSv1.2","5065","Application Data"
"301","2.704119","192.168.1.166","23.39.213.4","TLSv1.2","5064","Application Data"
"302","2.705567","192.168.1.166","23.39.213.4","TLSv1.2","5065","Application Data"
"303","2.716365","23.39.213.4","192.168.1.166","TCP","54","443  >  50692 [ACK] Seq=280045 Ack=198854 Win=9937 Len=0"
"304","2.716365","23.39.213.4","192.168.1.166","TCP","54","443  >  50692 [ACK] Seq=280045 Ack=202356 Win=9918 Len=0"
"305","2.716365","23.39.213.4","192.168.1.166","TCP","54","443  >  50692 [ACK] Seq=280045 Ack=205276 Win=9903 Len=0"
"306","2.735151","23.39.213.4","192.168.1.166","TCP","54","443  >  50692 [ACK] Seq=280045 Ack=207257 Win=9941 Len=0"
"307","2.740627","23.39.213.4","192.168.1.166","TLSv1.2","345","Application Data"
"308","2.740627","23.39.213.4","192.168.1.166","TCP","54","443  >  50692 [ACK] Seq=280336 Ack=218738 Win=9937 Len=0"
"309","2.744336","192.168.1.166","23.39.213.4","TLSv1.2","89","Application Data"
"310","2.750297","192.168.1.166","23.39.213.4","TLSv1.2","4965","Application Data"
"311","2.759235","23.39.213.4","192.168.1.166","TLSv1.2","85","Application Data"
"312","2.759235","23.39.213.4","192.168.1.166","TLSv1.2","375","Application Data"
"313","2.759235","23.39.213.4","192.168.1.166","TLSv1.2","501","Application Data"
"314","2.759259","192.168.1.166","23.39.213.4","TCP","54","50692  >  443 [ACK] Seq=225775 Ack=281135 Win=8187 Len=0"
"315","2.782611","23.39.213.4","192.168.1.166","TCP","54","443  >  50692 [ACK] Seq=281135 Ack=222324 Win=9943 Len=0"
"316","2.785934","23.39.213.4","192.168.1.166","TLSv1.2","485","Application Data"
"317","2.785934","23.39.213.4","192.168.1.166","TCP","8814","443  >  50692 [ACK] Seq=281566 Ack=225775 Win=9924 Len=8760 [TCP PDU reassembled in 318]"
"318","2.785934","23.39.213.4","192.168.1.166","TLSv1.2","1484","Application Data"
"319","2.785980","192.168.1.166","23.39.213.4","TCP","54","50692  >  443 [ACK] Seq=225775 Ack=291756 Win=8191 Len=0"
"320","2.805902","23.39.213.4","192.168.1.166","TLSv1.2","354","Application Data"
"321","2.805902","23.39.213.4","192.168.1.166","TLSv1.2","367","Application Data"
"322","2.805924","192.168.1.166","23.39.213.4","TCP","54","50692  >  443 [ACK] Seq=225775 Ack=292369 Win=8189 Len=0"
"323","2.833872","192.168.1.166","23.39.213.4","TLSv1.2","5196","Application Data"
"324","2.833932","192.168.1.166","23.39.213.4","TLSv1.2","2337","Application Data"
"325","2.839511","192.168.1.166","23.39.213.4","TLSv1.2","5196","Application Data"
"326","2.839597","192.168.1.166","23.39.213.4","TLSv1.2","2337","Application Data"
"327","2.843893","192.168.1.166","23.39.213.4","TLSv1.2","5196","Application Data"
"328","2.843947","192.168.1.166","23.39.213.4","TLSv1.2","2337","Application Data"
"329","2.848065","192.168.1.166","23.39.213.4","TLSv1.2","5197","Application Data"
"330","2.848138","192.168.1.166","23.39.213.4","TLSv1.2","2337","Application Data"
"331","2.871610","23.39.213.4","192.168.1.166","TCP","54","443  >  50692 [ACK] Seq=292369 Ack=240625 Win=9873 Len=0"
"332","2.875793","23.39.213.4","192.168.1.166","TCP","54","443  >  50692 [ACK] Seq=292369 Ack=243545 Win=9937 Len=0"
"333","2.876060","23.39.213.4","192.168.1.166","TLSv1.2","757","Application Data"
"334","2.876060","23.39.213.4","192.168.1.166","TLSv1.2","752","Application Data"
"335","2.876087","192.168.1.166","23.39.213.4","TCP","54","50692  >  443 [ACK] Seq=255476 Ack=293770 Win=8191 Len=0"
"336","2.882345","23.39.213.4","192.168.1.166","TLSv1.2","756","Application Data"
"337","2.882345","23.39.213.4","192.168.1.166","TLSv1.2","752","Application Data"
"338","2.882374","192.168.1.166","23.39.213.4","TCP","54","50692  >  443 [ACK] Seq=255476 Ack=295170 Win=8186 Len=0"
"339","2.899509","23.39.213.4","192.168.1.166","TLSv1.2","380","Application Data"
"340","2.899509","23.39.213.4","192.168.1.166","TLSv1.2","797","Application Data"
"341","2.899537","192.168.1.166","23.39.213.4","TCP","54","50692  >  443 [ACK] Seq=255476 Ack=296239 Win=8191 Len=0"
"342","2.901984","23.39.213.4","192.168.1.166","TLSv1.2","485","Application Data"
"343","2.901984","23.39.213.4","192.168.1.166","TCP","10274","443  >  50692 [ACK] Seq=296670 Ack=255476 Win=9949 Len=10220 [TCP PDU reassembled in 344]"
"344","2.901984","23.39.213.4","192.168.1.166","TLSv1.2","76","Application Data"
"345","2.902013","192.168.1.166","23.39.213.4","TCP","54","50692  >  443 [ACK] Seq=255476 Ack=306912 Win=8191 Len=0"
"346","2.904141","23.39.213.4","192.168.1.166","TLSv1.2","380","Application Data"
"347","2.904141","23.39.213.4","192.168.1.166","TLSv1.2","797","Application Data"
"348","2.904157","192.168.1.166","23.39.213.4","TCP","54","50692  >  443 [ACK] Seq=255476 Ack=307981 Win=8187 Len=0"
"349","2.905102","23.39.213.4","192.168.1.166","TLSv1.2","485","Application Data"
"350","2.905102","23.39.213.4","192.168.1.166","TCP","8814","443  >  50692 [ACK] Seq=308412 Ack=255476 Win=9949 Len=8760 [TCP PDU reassembled in 351]"
"351","2.905102","23.39.213.4","192.168.1.166","TLSv1.2","1483","Application Data"
"352","2.905130","192.168.1.166","23.39.213.4","TCP","54","50692  >  443 [ACK] Seq=255476 Ack=318601 Win=8191 Len=0"
"353","2.932414","23.39.213.4","192.168.1.166","TLSv1.2","380","Application Data"
"354","2.932414","23.39.213.4","192.168.1.166","TLSv1.2","797","Application Data"
"355","2.932447","192.168.1.166","23.39.213.4","TCP","54","50692  >  443 [ACK] Seq=255476 Ack=319670 Win=8187 Len=0"
"356","2.967170","23.39.213.4","192.168.1.166","TLSv1.2","380","Application Data"
"357","2.967170","23.39.213.4","192.168.1.166","TLSv1.2","797","Application Data"
"358","2.967194","192.168.1.166","23.39.213.4","TCP","54","50692  >  443 [ACK] Seq=255476 Ack=320739 Win=8191 Len=0"
"359","4.715860","192.168.1.166","23.39.213.4","TLSv1.2","5224","Application Data"
"360","4.715936","192.168.1.166","23.39.213.4","TLSv1.2","11854","Application Data"
"361","4.748676","23.39.213.4","192.168.1.166","TCP","54","443  >  50692 [ACK] Seq=320739 Ack=262106 Win=9898 Len=0"
"362","4.748676","23.39.213.4","192.168.1.166","TCP","54","443  >  50692 [ACK] Seq=320739 Ack=267946 Win=9887 Len=0"
"363","4.750508","23.39.213.4","192.168.1.166","TCP","54","443  >  50692 [ACK] Seq=320739 Ack=272446 Win=9928 Len=0"
"364","4.777866","23.39.213.4","192.168.1.166","TLSv1.2","361","Application Data"
"365","4.777866","23.39.213.4","192.168.1.166","TLSv1.2","289","Application Data"
"366","4.777895","192.168.1.166","23.39.213.4","TCP","54","50692  >  443 [ACK] Seq=272446 Ack=321281 Win=8189 Len=0"
"367","5.324945","192.168.1.166","23.39.213.4","TLSv1.2","4981","Application Data"
"368","5.360790","23.39.213.4","192.168.1.166","TCP","54","443  >  50692 [ACK] Seq=321281 Ack=275366 Win=9949 Len=0"
"369","5.360790","23.39.213.4","192.168.1.166","TCP","54","443  >  50692 [ACK] Seq=321281 Ack=277373 Win=9949 Len=0"
"370","5.387051","23.39.213.4","192.168.1.166","TLSv1.2","368","Application Data"
"371","5.387051","23.39.213.4","192.168.1.166","TLSv1.2","476","Application Data"
"372","5.387079","192.168.1.166","23.39.213.4","TCP","54","50692  >  443 [ACK] Seq=277373 Ack=322017 Win=8186 Len=0"
"373","5.389354","192.168.1.166","23.39.213.4","TLSv1.2","4998","Application Data"
"374","5.389400","192.168.1.166","23.39.213.4","TLSv1.2","449","Application Data"
"375","5.390100","192.168.1.166","23.39.213.4","TLSv1.2","4998","Application Data"
"376","5.390154","192.168.1.166","23.39.213.4","TLSv1.2","1645","Application Data"
"377","5.424368","23.39.213.4","192.168.1.166","TCP","54","443  >  50692 [ACK] Seq=322017 Ack=280293 Win=9949 Len=0"
"378","5.426644","23.39.213.4","192.168.1.166","TCP","54","443  >  50692 [ACK] Seq=322017 Ack=284172 Win=9930 Len=0"
"379","5.426644","23.39.213.4","192.168.1.166","TCP","54","443  >  50692 [ACK] Seq=322017 Ack=289116 Win=9903 Len=0"
"380","5.469077","23.39.213.4","192.168.1.166","TCP","54","443  >  50692 [ACK] Seq=322017 Ack=289247 Win=9949 Len=0"
"381","5.481417","23.39.213.4","192.168.1.166","TLSv1.2","355","Application Data"
"382","5.481417","23.39.213.4","192.168.1.166","TLSv1.2","121","Application Data"
"383","5.481442","192.168.1.166","23.39.213.4","TCP","54","50692  >  443 [ACK] Seq=289247 Ack=322385 Win=8191 Len=0"
"384","5.488733","23.39.213.4","192.168.1.166","TLSv1.2","355","Application Data"
"385","5.488733","23.39.213.4","192.168.1.166","TLSv1.2","121","Application Data"
"386","5.488751","192.168.1.166","23.39.213.4","TCP","54","50692  >  443 [ACK] Seq=289247 Ack=322753 Win=8190 Len=0"
"387","6.768656","192.168.1.166","23.39.213.4","TLSv1.2","5224","Application Data"
"388","6.768769","192.168.1.166","23.39.213.4","TLSv1.2","16460","Application Data"
"389","6.768836","192.168.1.166","23.39.213.4","TLSv1.2","13693","Application Data"
"390","6.769320","192.168.1.166","23.39.213.4","TLSv1.2","5224","Application Data"
"391","6.769374","192.168.1.166","23.39.213.4","TLSv1.2","16460","Application Data"
"392","6.769413","192.168.1.166","23.39.213.4","TLSv1.2","10618","Application Data"
"393","6.801062","23.39.213.4","192.168.1.166","TCP","54","443  >  50692 [ACK] Seq=322753 Ack=290707 Win=9945 Len=0"
"394","6.801062","23.39.213.4","192.168.1.166","TCP","54","443  >  50692 [ACK] Seq=322753 Ack=292167 Win=9945 Len=0"
"395","6.803377","23.39.213.4","192.168.1.166","TCP","54","443  >  50692 [ACK] Seq=322753 Ack=293627 Win=9945 Len=0"
"396","6.803377","23.39.213.4","192.168.1.166","TCP","54","443  >  50692 [ACK] Seq=322753 Ack=294417 Win=9947 Len=0"
"397","6.803377","23.39.213.4","192.168.1.166","TCP","54","443  >  50692 [ACK] Seq=322753 Ack=295877 Win=9945 Len=0"
"398","6.803377","23.39.213.4","192.168.1.166","TCP","54","443  >  50692 [ACK] Seq=322753 Ack=298797 Win=9930 Len=0"
"399","6.803377","23.39.213.4","192.168.1.166","TCP","54","443  >  50692 [ACK] Seq=322753 Ack=307557 Win=9907 Len=0"
"400","6.805649","23.39.213.4","192.168.1.166","TCP","54","443  >  50692 [ACK] Seq=322753 Ack=309017 Win=9900 Len=0"
"401","6.805649","23.39.213.4","192.168.1.166","TCP","54","443  >  50692 [ACK] Seq=322753 Ack=310823 Win=9889 Len=0"
"402","6.805649","23.39.213.4","192.168.1.166","TCP","54","443  >  50692 [ACK] Seq=322753 Ack=312283 Win=9882 Len=0"
"403","6.805649","23.39.213.4","192.168.1.166","TCP","54","443  >  50692 [ACK] Seq=322753 Ack=323963 Win=9822 Len=0"
"404","6.807980","23.39.213.4","192.168.1.166","TCP","54","443  >  50692 [ACK] Seq=322753 Ack=324462 Win=9819 Len=0"
"405","6.807980","23.39.213.4","192.168.1.166","TCP","54","443  >  50692 [ACK] Seq=322753 Ack=325922 Win=9809 Len=0"
"406","6.807980","23.39.213.4","192.168.1.166","TCP","54","443  >  50692 [ACK] Seq=322753 Ack=327382 Win=9802 Len=0"
"407","6.807980","23.39.213.4","192.168.1.166","TCP","54","443  >  50692 [ACK] Seq=322753 Ack=329632 Win=9789 Len=0"
"408","6.807980","23.39.213.4","192.168.1.166","TCP","54","443  >  50692 [ACK] Seq=322753 Ack=331092 Win=9782 Len=0"
"409","6.809941","23.39.213.4","192.168.1.166","TCP","54","443  >  50692 [ACK] Seq=322753 Ack=339852 Win=9737 Len=0"
"410","6.810247","23.39.213.4","192.168.1.166","TCP","54","443  >  50692 [ACK] Seq=322753 Ack=342772 Win=9937 Len=0"
"411","6.817912","23.39.213.4","192.168.1.166","TCP","54","443  >  50692 [ACK] Seq=322753 Ack=356602 Win=9863 Len=0"
"412","6.839145","23.39.213.4","192.168.1.166","TLSv1.2","361","Application Data"
"413","6.839145","23.39.213.4","192.168.1.166","TLSv1.2","289","Application Data"
"414","6.839173","192.168.1.166","23.39.213.4","TCP","54","50692  >  443 [ACK] Seq=356602 Ack=323295 Win=8188 Len=0"
"415","6.842325","23.39.213.4","192.168.1.166","TLSv1.2","361","Application Data"
"416","6.842325","23.39.213.4","192.168.1.166","TLSv1.2","289","Application Data"
"417","6.842348","192.168.1.166","23.39.213.4","TCP","54","50692  >  443 [ACK] Seq=356602 Ack=323837 Win=8186 Len=0"
